title,thumbnail,short_content,write_time,link,company
"""감사의 마음 전하세요""…SPC 파스쿠찌, 케이크 3종 출시",https://img.asiatoday.co.kr/file/2025y/04m/18d/20250418010011097_250.jpg,"SPC그룹의 커피 브랜드 파스쿠찌가 5월 가정의 달을 맞아 신제품 케이크 3종을 출시한다고 18일 밝혔다.이번 신제품은 '하트 통통 케이크', '고마워요 케이크', '사랑해요 케이크' 등 총 3종으로 구성됐다. '하트 투 스위트(Heart To Sweet)'를 콘셉트로 하트 모양을 케이크에 적용했다.파스쿠찌는 신제품 출시를 기념해 다양한 프로모션을 진행한다. 21~28일 해피오더 애플리케이션(앱)에서 '고마워요 케이크'와 '사랑해요 케이크'..",,https://www.asiatoday.co.kr/kn/view.php?key=20250418010011097,아시아투데이
"쿠팡, '메가뷰티쇼 버추얼스토어' 오픈…역대 최대 혜택",https://img.asiatoday.co.kr/file/2025y/04m/18d/20250418010011096_250.jpg,"쿠팡이 대규모 뷰티 프로모션 행사인 '메가뷰티쇼 버추얼스토어'를 연다.18일 쿠팡에 따르면 이번 행사는 18일부터 20일까지 사흘간 서울 성수동 복합문화공간 'XYZ 서울'에서 열리며, 쿠팡 와우 멤버십 회원을 대상으로 진행된다. 약 620평 규모의 공간에 뷰티 체험존을 마련해 다양한 브랜드 제품을 직접 체험하고 구매할 수 있도록 구성했다.입장권은 지난 7일 오픈 직후 1시간 만에 모두 매진됐다. 행사 운영 시간은 오전 10시부터 오후 8시까..",,https://www.asiatoday.co.kr/kn/view.php?key=20250418010011096,아시아투데이
"경동나비엔, 폐보일러 업사이클링 전시회 개최…""보일러가 의자로""",https://img.asiatoday.co.kr/file/2025y/04m/18d/20250418010010999_250.jpg,"경동나비엔이 서울새활용플라자와 함께 '한번 더 콘덴싱 : 가치의 재발견' 전시회를 개최한다고 18일 밝혔다.이날부터 오는 7월말까지 서울 성동구 서울새활용플라자에서 열리며, 수명이 다한 콘덴싱 보일러를 학생들의 창의력으로 재탄생시킨 다양한 작품이 전시된다.서울새활용플라자는 서울특별시 산하의 서울디자인재단에서 운영하는 기관으로. 자원 순환과 새활용 문화 확산을 지원하는 세계 최대 규모 업사이클링 복합 문화 공간이다.경동나비엔의 콘덴싱 보일러는..",,https://www.asiatoday.co.kr/kn/view.php?key=20250418010010999,아시아투데이
"""헬시플레저 열풍""…GS25, 저당 아이스크림 매출 50% 급증",https://img.asiatoday.co.kr/file/2025y/04m/18d/20250418010011087_250.jpg,GS25가 '저당' 열풍을 타고 차별화 먹거리 플랫폼으로 자리매김한다.18일 GS리테일이 운영하는 편의점 GS25에 따르면 지난 1일부터 17일까지 저당 아이스크림 매출이 전년 동기 대비 50.8% 급증하며 가파르게 성장하고 있다. 동기간 전체 아이스크림 매출 가운데 저당 아이스크림 매출이 차지하는 비중이 처음으로 두 자릿수(19.1%)를 돌파했다. 즐겁게 건강을 관리하는 '헬시플레저' 트렌드가 아이스크림까지 확대되며 저당 라인업이 큰 수혜를..,,https://www.asiatoday.co.kr/kn/view.php?key=20250418010011087,아시아투데이
'행사장 농성' 전장연 활동가 현행범 체포 후 석방,https://img.asiatoday.co.kr/file/2025y/04m/18d/20250418010011027_250.jpg,"전국장애인차별철폐연대(전장연) 활동가가 행사장에서 농성을 벌이다 경찰에 체포됐다.서울 영등포경찰서는 18일 0시 13분께 경찰의 퇴거 요청에 불응하고 농성한 혐의(형법상 퇴거불응)로 20대 여성 전장연 활동가 A씨를 현행범 체포했다.A씨는 전날 밤 10시 30분께 장애인의 날 기념식을 하루 앞두고 조규홍 보건복지부 장관에게 면담요구안을 전달하겠다며 영등포구 여의도동 한 호텔을 찾았다.전장연 측은 성명을 통해 ""A씨가 자진 퇴거 의사를 밝혔으나..",,https://www.asiatoday.co.kr/kn/view.php?key=20250418010011027,아시아투데이
"경찰, 박나래 자택 수천만원 금품 절도 30대 남성 구속 송치",https://img.asiatoday.co.kr/file/2025y/04m/18d/20250418010010979_250.jpg,경찰이 개그우먼 박나래씨(40) 자택에서 수천만원 상당의 금품을 훔친 혐의를 받는 30대 남성을 검찰에 넘겼다.서울 용산경찰서는 야간주거침입 및 절도 혐의를 받는 A씨를 검찰에 구속 송치했다고 18일 밝혔다.A씨는 지난 4일 박씨의 용산구 자택에서 금품을 훔쳐 달아난 혐의를 받는다. A씨는 훔친 귀금속 등 수천만원대 금품을 장물로 내놓은 것으로 조사됐다.A씨는 경찰 조사에서 박씨 집이라는 사실을 모른 채 범행을 저질렀다고 진술했다.경찰은 A씨..,,https://www.asiatoday.co.kr/kn/view.php?key=20250418010010979,아시아투데이
"중기중앙회, 기업승계 준비 차세대 CEO 육성",https://img.asiatoday.co.kr/file/2025y/04m/18d/20250418010010898_250.jpg,중소기업중앙회는 18일 서울 마포구에 있는 중소기업DMC타워에서 기업승계를 준비하고 있는 차세대 CEO(최고경영자)와 승계예정자를 대상으로 '2025년 차세대 CEO 스쿨 심화과정 입학식'을 개최했다.차세대 CEO 스쿨 심화과정은 중소기업의 안정적인 기업승계를 위한 차세대 CEO의 경영 능력 함양과 교육생 간의 상호 교류를 통한 역량 강화를 목적으로 하며 2009년부터 운영해 총 20기수 474명의 수료생을 배출했다.이날 입학식에는 이명로 중..,,https://www.asiatoday.co.kr/kn/view.php?key=20250418010010898,아시아투데이
