title,thumbnail,short_content,write_time,link,company
"오영주 ""트럼프 관세 중기 50개 품목 별도 지원…산하기관장 인사 곧""",https://img.asiatoday.co.kr/file/2025y/02m/26d/20250226010014281_250.jpg,"오영주 중소벤처기업부 장관은 26일 ""트럼프 관세 정책으로 인해 중소기업 수출 지원방안으로 50개 품목을 별도 뽑아 각 중소기업의 업력, 업종에 따라 맞춤형 지원을 진행하겠다""고 말했다. 오 장관은 이날 오후 서울 종로구에 있는 포시즌스 호텔 서울에서 'AI 초격차 챌린지 킥 오프데이(Kick-off Day)' 행사 후 기자들과 가진 티타임에서 이같이 밝히며, ""지난 한 달 반 긴급경영안정자금을 550억원을 지원했으며 단기대책으로 수출바우처를..",,https://www.asiatoday.co.kr/kn/view.php?key=20250226010014281,아시아투데이
"코레일, 데이터 기반 행정 평가 '최고 등급'",https://img.asiatoday.co.kr/file/2025y/02m/26d/20250226010014279_250.jpg,"한국철도공사(코레일)가 '2024년 공공데이터 제공 및 데이터 기반 행정 평가'에서 각각 최고 등급인 '우수' 등급을 달성했다고 26일 밝혔다.공공데이터 평가는 행정안전부 주관으로 중앙행정기관과 지방자치단체, 공공기관 등 679개 기관을 심사한다. 평가분야는 '공공데이터 제공'과 '데이터기반행정'으로 나뉘고 세부 분야는 △개방·활용 △분석·활용 △공유 △품질 △관리체계 등 5개다. 코레일은 공공데이터 제공 평가에서 4년 연속 최고등급인 '우수..",,https://www.asiatoday.co.kr/kn/view.php?key=20250226010014279,아시아투데이
"이정복 서부발전 사장 ""직원들과 소통으로 난관 헤쳐나간다""",https://img.asiatoday.co.kr/file/2025y/02m/26d/20250226010014275_250.jpg,이정복 한국서부발전 사장은 회사의 지속 성장 방향성을 고민하고 조직일체감을 조성하기 위해 현장에서 직원들과 즉시 묻고 즉시 답하는 '즉문즉답' 소통 행보에 나섰다.서부발전은 지난 11일부터 오는 3월 5일까지 약 한 달 동안 본사를 비롯해 태안과 구미 등 전국 사업소 10곳을 돌며 부장급 이하 직원을 대상으로 '현장 소통·공감을 위한 CEO 타운홀 미팅'을 개최한다고 26일 밝혔다.CEO 타운홀 미팅은 이정복 사장이 직접 직원들과 경영 현안을..,,https://www.asiatoday.co.kr/kn/view.php?key=20250226010014275,아시아투데이
"연매출 '40조 돌파' 쿠팡, AI·글로벌 영토확장으로 '점프업'(종합)",https://img.asiatoday.co.kr/file/2025y/02m/26d/20250226010014152_250.jpg,국내 유통기업 중 처음으로 연매출 40조원을 돌파한 쿠팡이 더 큰 미래를 그린다다. 쿠팡의 성공DNA를 적용한 글로벌 영토확장과 수익 개선의 원동력이 된 로보틱스와 자동화를 통해서다. 로켓배송·로켓프레시·로켓그로스·마켓플레이스 등 기존 주력 사인인 프로덕트 커머스 사업의 안정적 성장 기반에 AI(인공지능)를 접목한 고도 자동화율 확대와 글로벌 신사업을 더해 올해도 매출 20% 이상의 성장을 달성하겠다는 각오다. 연매출 50조원 돌파도 시간 문..,,https://www.asiatoday.co.kr/kn/view.php?key=20250226010014152,아시아투데이
"흉기난동 피의자, 경찰 실탄 대응에 사망…정당방위 논란",https://img.asiatoday.co.kr/file/2025y/02m/26d/20250226010014193_250.jpg,"광주 도심에서 50대 남성이 경찰관을 흉기로 공격하다 실탄에 맞아 사망한 사건과 관련해 정당방위와 과잉대응 여부를 놓고 논란이 일고 있다. 경찰 내부에선 적법한 절차에 따른 정당한 물리력 행사라는 목소리에 무게가 실리고 있지만, 피의자가 사망해 과잉대응 지적이 나올 것이라는 의견도 있다.26일 경찰청과 광주경찰청에 따르면 경찰은 '광주 흉기난동 사건' 당시 A 경감이 총기를 사용한 행위가 적절했는지 여부를 들여다보고 있다.광주 동부경찰서 금남..",,https://www.asiatoday.co.kr/kn/view.php?key=20250226010014193,아시아투데이
MZ부모가 바꾼 분유시장…매일·남양유업의 묘수는,https://img.asiatoday.co.kr/file/2025y/02m/26d/20250226010014031_250.jpg,"MZ부모들이 분유시장의 판도를 바꿔 놓았다. 출산률 감소로 국내 분유시장 규모는 줄어드는데 지난해 분유 수입량은 역대 최대치를 기록했다. 매일유업, 남양유업은 줄어드는 내수시장 대신 해외 공략에 나선 모습이다. 26일 한국농수산식품유통공사에 따르면 2023년 상반기 소매 유통채널을 통한 분유 판매액은 약 158억 9300만원으로, 2022년 상반기 202억 3500만원에서 21.5% 감소했다.저출산으로 인한 신생아 수 감소가 가장 큰 원인이지..",,https://www.asiatoday.co.kr/kn/view.php?key=20250226010014031,아시아투데이
"민주당월급방위대 “직장인 식대 비과세 한도, 30만원으로”",https://img.asiatoday.co.kr/file/2025y/02m/26d/20250226010014266_250.jpg,"더불어민주당이 직장인의 식대 비과세 한도를 30만원으로 올려 식대를 현실화하겠다고 선언했다.민주당 월급방위대는 26일 오후 국회에서 '직장인 식대 현실화법' 추진 정책협약식을 열고 이 같이 밝혔다. 이들은 ""직장인들이 점심 한 끼라도 마음 편하게 든든하게 먹기 위해서는 과감한 세제 지원이 필요하다""고 전했다.이 기구는 이재명 대표 직속 기구다. 월급 생활자들에게 불리한 조세 제도 재설계 등을 위한 법안을 발굴하는 비상설특별위원회다. 민주당은..",,https://www.asiatoday.co.kr/kn/view.php?key=20250226010014266,아시아투데이
"대한민국부사관정책발전협의회, 세계 각국 드론협회장들과 환담",https://img.asiatoday.co.kr/file/2025y/02m/26d/20250226001614344_250.jpg,"대한민국부사관정책발전협의회는 26일 부산 백스코에서 협의회 특위 서윤호 국방홍보위원장의 주선으로 세계 각국 드론협회장들과 상호 적극적 교류를 위한 환담을 가졌다고 밝혔다.이날 환담 자리에 협의회에서는 윤성열 의장, 서윤호 국방홍보위원장, 이기철 경영지원국장 등이, 세계 각국 드론협회장들로는 양 진차이(Yang Jincai) 세계드론협회장(중국), 바트수흐(Batsukh) 몽골드론협회장, 다토 레스터(Dato Lester) 말레이시아드론협회장,..",,https://www.asiatoday.co.kr/kn/view.php?key=20250226001614344,아시아투데이
"참사 반복될라…정부, 붕괴 현장과 동일 공법 쓰는 고속도로 공사 3곳 중지",https://img.asiatoday.co.kr/file/2025y/02m/26d/20250226010014262_250.jpg,정부가 붕괴 사고로 10명의 사상자를 낸 안성 고속도로 현장과 같은 공법을 쓴 3곳의 고속도로 공사현장을 중단시켰다. 안전성 검증을 거친 뒤 문제가 없을 경우 공사를 재개하도록 한다는 계획이다.26일 국토교통부에 따르면 서울세종고속도로 천안∼안성 구간 천용천교 공사현장에서 이용한 공법은 교각 사이를 잇는 상판과 보를 공장에서 사전 제작한 뒤 현장에서 조립하는 'DR거더 런칭 가설 공법'이다.거더(Girder)는 다리 상판 밑에 깔아 대들보 역..,,https://www.asiatoday.co.kr/kn/view.php?key=20250226010014262,아시아투데이
"노인연령 조정 논의…""일률적 규정 비현실적""",https://img.asiatoday.co.kr/file/2025y/02m/26d/20250226010014261_250.jpg,"세계적 고령화 추세에 해외 주요국들이 노인 연령 상향 조정을 검토하고 있다. 하지만 일률적으로 규정하는 것은 비현실적이라는 인식이 확산되고 있다.보건복지부는 26일 노인인력개발원 서울본부에서 2차 노인연령 전문가 간담회를 열었다. 이날 간담회에선 해외 주요국의 노인연령 상향 관련 움직임이 소개됐다. 발제자로 나선 정순둘 이화여대 사회복지학과 교수는 노인연령 기준에 대한 해외 논의 사례를 소개했다.정 교수는 ""국제사회에서 통용되고 있는 노인연령..",,https://www.asiatoday.co.kr/kn/view.php?key=20250226010014261,아시아투데이
"넷플릭스, 오징어게임 체험공간 운영…신규 유입 노린다",https://img.asiatoday.co.kr/file/2025y/02m/26d/20250226010014257_250.jpg,"넷플릭스가 오징어게임 체험 공간을 열고 새로운 한국 이용자 유입에 나선다. 넷플릭스는 서울 성동구 성수동에서 오징어게임 더 익스피리언스를 26일 언론에 공개했다. 더 익스피리언스는 넷플릭스 콘텐츠를 오프라인에서 경험할 수 있는 공간이다. 오징어게임 더 익스피리언스는 전세계 도시에서 5번째로 서울에서 문을 열었다. 앞서 2023년 12월 미국 로스엔젤레스를 필두로 뉴욕, 스페인 마드리드, 호주 시드니에서 오징어게임 더 익스피리언스를 운영했다...",,https://www.asiatoday.co.kr/kn/view.php?key=20250226010014257,아시아투데이
"野 박선원 검찰 고발돼…""곽종근 회유 위증교사 해당""",https://img.asiatoday.co.kr/file/2025y/02m/26d/20250226010014255_250.jpg,"이종배 국민의힘 의원이 박선원 더불어민주당 의원을 위증교사 혐의로 검찰에 고발했다. 이 의원은 26일 위증교사 및 위계에 의한 업무방해 혐의로 박 의원을 서울중앙지검에 고발했다고 밝혔다. 이 의원은 곽종근 전 특전사령관이 비상계엄령 선포 직후 지난해 12월 6일 김병주 더불어민주당 의원 유튜브 채널에 출연해 '(비상계엄 선포 후) 본회장으로 들어갔던 일부 인원이 있고 밖에 있던 인원이 있었는데, 전임 장관으로부터 국회의사당 안에 있는 인원들을..",,https://www.asiatoday.co.kr/kn/view.php?key=20250226010014255,아시아투데이
"필리핀, 또 '간첩혐의' 중국인 2명 체포…대통령궁·美대사관 도청혐의",https://img.asiatoday.co.kr/file/2025y/02m/26d/20250226010014258_250.jpg,중국과 남중국해 영유권 갈등이 심화하는 가운데 간첩 혐의자들의 체포가 잇따르고 있는 필리핀에서 중국 국적자 2명이 또다시 체포됐다. 이들은 대통령궁과 필리핀 주재 미국대사관 등을 도청한 혐의를 받고 있다. 26일(현지시간) AFP와 필스타글로벌에 따르면 필리핀 국가수사청(NBI)은 전날 중국인 2명과 필리핀인 운전사 3명을 간첩 혐의로 체포했다고 밝혔다.체포된 중국인 용의자들은 필리핀인 운전사를 고용해 수도 마닐라의 대통령궁·주필리핀 미국대사관..,,https://www.asiatoday.co.kr/kn/view.php?key=20250226010014258,아시아투데이
"분만취약지 지원책, 근본 해결 없이 반복되는 대책",https://img.asiatoday.co.kr/file/2025y/02m/26d/20250226010014219_250.jpg,"분만취약지 문제를 해결하겠다는 정부의 발표가 나왔지만, 현장에서는 이번 대책이 과연 실질적인 변화를 가져올 수 있을지 여전히 회의적인 반응이 나오고 있다.26일 관련 업계에 따르면 전일 보건복지부는 분만취약지 지원사업의 개선안을 공개하며 의료진 채용 유예기간 연장, 운영 기준 완화, 모자의료 협력사업 등을 추진하겠다고 밝혔다.정부의 이번 대책은 기존의 문제점을 보완하는 데 초점을 맞췄고, 지원 대상도 기존 대비 확대했다. 이번 대책은 기존보다..",,https://www.asiatoday.co.kr/kn/view.php?key=20250226010014219,아시아투데이
"인하대 '尹 탄핵 반대' 시국선언…""불법탄핵 규탄""",https://img.asiatoday.co.kr/file/2025y/02m/26d/20250226010014166_250.jpg,"""대한민국의 법치주의와 자유 민주주의를 훼손하고, 부정선거 의혹을 검증하지 않는 불법탄핵 반대한다.""인하대학교 재학생과 동문 등으로 구성된 '탄핵을 반대하는 인하인들'이 26일 오후 2시께 인천 미추홀구 인하대 비룡플라자 앞에서 불법탄핵을 반대하는 시국선언을 진행했다. 서울과 부산, 경북 등에 이어 인천에서도 탄핵을 반대하는 청년들의 목소리가 처음으로 나왔다.시국선언을 주도한 정대교씨(컴퓨터공학과 22학번)는 ""우리는 현재 자유 대한민국의 위..",,https://www.asiatoday.co.kr/kn/view.php?key=20250226010014166,아시아투데이
"잔디로, '천연가죽 내추럴 모션워킹화2' 출시…착화감·내구성↑",https://img.asiatoday.co.kr/file/2025y/02m/26d/20250226010014248_250.jpg,"잔디로가 새 워킹화를 내놨다. 잔디로는 기존 '천연가죽 내추럴 모션워킹화' 성능을 업그레이드한 새 버전을 출시한다고 26일 밝혔다.신제품은 한국인의 발 모양을 반영해 맞춤형으로 설계한 게 특징이다. 천연 소가죽을 활용해 통기성을 극대화했다. 회사 관계자는 ""열과 습기를 효과적으로 배출하고 발수·방수 처리가 적용된 소프트 천연가죽을 사용해 생활 방수 기능까지 갖췄다""고 설명했다.워킹에 최적화한 논슬립 모션 아웃솔(밑창)도 추가했다. 발 앞부분을..",,https://www.asiatoday.co.kr/kn/view.php?key=20250226010014248,아시아투데이
"한권환 SK하이닉스 부사장 ""올해 12단 HBM3E 주력 생산""",https://img.asiatoday.co.kr/file/2025y/02m/26d/20250226010014253_250.jpg,"한권환 SK하이닉스 HBM융합기술 부사장이 올해 HBM 시장 수요에 안정적으로 대응하는 한편, 차세대 HBM 양산을 위한 기술적 준비도 탄탄히 하겠다고 밝혔다.한 부사장은 26일 SK하이닉스 뉴스룸 인터뷰에서 ""HBM 시장 경쟁에서 우위를 점하기 위해서는 기술력은 기본이고, 최상의 제품을 적시에 고객에게 공급할 수 있어야 한다""며 이 같이 말했다.2002년 SK하이닉스에 입사한 한 부사장은 어드밴스드 패키징 개발 부서에 재직하며 모든 세대 H..",,https://www.asiatoday.co.kr/kn/view.php?key=20250226010014253,아시아투데이
"개혁신당, 조기대선 대비 경선출마안 확정",https://img.asiatoday.co.kr/file/2025y/02m/26d/20250226010014252_250.jpg,"개혁신당이 선거기획단 첫 회의를 갖고 조기대선 시 전체 당원의 3% 지지를 받는 예비 후보자가 경선에 출마할 수 있도록 하는 안을 확정했다. 기획단은 의미없는 거대양당 2파전이 아닌 3파전으로 갈 것이라며 치열한 경쟁을 예고했다.당 선거기획단은 26일 국회에서 첫 회의를 열고 이 같은 포부를 전했다. 함익병 단장은 ""국민들에게 기존 양당의 낡은 모습이 아닌 대한민국을 위한 개혁적 정책을 마련하고 더 좋은 후보로 당을 어필할 수 있도록 준비해놓..",,https://www.asiatoday.co.kr/kn/view.php?key=20250226010014252,아시아투데이
"GS25 와인25플러스, 비수도권 매출 123% 급증…지역 가맹점 수익↑",https://img.asiatoday.co.kr/file/2025y/02m/26d/20250226010014249_250.jpg,GS리테일 주류 스마트오더 플랫폼 '와인25플러스'가 지역 가맹점 매출을 견인하며 새로운 '상생 모델'로 자리매김하고 있다.GS리테일이 운영하는 편의점 GS25에 따르면 올해(1월 1일 ~ 2월 25일) 서울·인천·경기를 제외한 비(非)수도권 매장의 '와인25플러스' 매출이 전년 동기 대비 123.3% 증가한 것으로 분석됐다. 이는 동기간 전체 와인25플러스 매출 신장률인 98.3%를 크게 상회하는 수치다.와인25플러스 비수도권 매출 비중은..,,https://www.asiatoday.co.kr/kn/view.php?key=20250226010014249,아시아투데이
[내일날씨] 낮 최고 16도…미세먼지 나쁨,https://img.asiatoday.co.kr/file/2025y/02m/26d/20250226010014147_250.jpg,"목요일인 27일 남서쪽에서 따뜻한 공기가 유입되면서 낮부터 차차 기온이 오르겠다.아침 최저기온은 -7~3도, 낮 최고기온은 9~16도로 예보됐다.전국은 가끔 구름이 많겠고 제주도는 오전부터 차차 흐려지겠다.제주도에는 밤부터 5~10㎜가량의 눈 또는 비가 내리겠다.바다 물결은 서해 앞바다에서 0.5~1.0m, 남해 앞바다에서 0.5~1.0m, 동해 앞바다에서 0.5~2.0m로 일겠다.미세먼지 농도는 국외 미세먼지의 유입으로 대부분 권역에서 높게..",,https://www.asiatoday.co.kr/kn/view.php?key=20250226010014147,아시아투데이
여야 연금특위 설치 합의…'자동조정장치' 논란 확대,https://img.asiatoday.co.kr/file/2025y/02m/26d/20250226010014234_250.jpg,여야가 국민연금 개혁 특별위원회(연금특위) 설치에 합의하면서 구조개혁과 함께 저출산 상황에 따라 연금액을 삭감하는 자동조정장치 논의 가능성이 제기됐다. 26일 정치권에 따르면 여야 원내대표는 국회 연금특위 설치에 원칙적으로 합의했다. 오는 28일 국정협의체를 열어 구체적 논의를 이어간다는 계획이다. 소득대체율 인상 논의 주체는 야당이 요구하는 보건복지위원회와 여당이 주장하는 특위 중 결정하지 않은채 구조개혁을 논의할 특위 설치만 확정한 것이다..,,https://www.asiatoday.co.kr/kn/view.php?key=20250226010014234,아시아투데이
"검찰, '한국복합물류 취업청탁 의혹' 김외숙 전 인사수석 소환",https://img.asiatoday.co.kr/file/2025y/02m/26d/20250226010014235_250.jpg,"검찰이 '한국복합물류 취업청탁 의혹'과 관련해 김외숙 전 대통령비서실 인사수석관을 소환했다.26일 법조계에 따르면 서울중앙지검 반부패수사2부(이승학 부장검사 직무대행)는 전날 김 전 수석을 피의자 신분으로 조사했다. 검찰은 지난 2020년 8월 이정근 전 더불어민주당 사무부총장이 한국복합물류 상근고문으로 취직할 당시, 김 전 수석이 청와대 내부 의사 결정 과정 등에 관여한 것 아닌지 들여다본 것으로 전해진다.검찰은 지난달 23일 이번 사건을..",,https://www.asiatoday.co.kr/kn/view.php?key=20250226010014235,아시아투데이
"실탄 장전하는 HD한국조선, SMR 기술 고도화 '원년' 만든다",https://img.asiatoday.co.kr/file/2025y/02m/26d/20250226010014206_250.jpg,"HD한국조선해양이 6000억원의 자금을 확보하며 조선시장의 '게임체인저'로 꼽히는 소형모듈원자로(SMR) 기술 고도화의 발판을 마련한다. 친환경 선박 경쟁력 강화를 외쳐온 정기선 HD현대 수석부회장이 지켜보고 신사업인 만큼, 3년에 거친 투자로 신 성장동력으로 자리매김시키겠다는 각오다.26일 업계에 따르면 HD한국조선해양은 운영자금을 확보하기 위해 6000억원 규모의 교환사채를 발행하기로 결정했다. 이번에 발행되는 사채는 회사가 보유한 HD현..",,https://www.asiatoday.co.kr/kn/view.php?key=20250226010014206,아시아투데이
"금감원, GA 불법광고 뿌리 뽑는다… 건전 GA광고질서 정착 캠페인 실시",https://img.asiatoday.co.kr/file/2025y/02m/26d/20250226010014228_250.jpg,"금융감독원이 법인보험대리점(GA) 업계의 불법 광고 관행을 막기 위해 캠페인에 나선다.금감원은 GA업계의 건전한 광고질서 정착을 위해 생명보험협회, 손해보험협회, 보험GA협회와 공동으로 'GA 자체 광고 자율점검 및 시정 캠페인'을 실시한다고 26일 밝혔다.이 캠페인에 참가하고자 하는 GA는 생명·손해보험협회의 광고심의 규정 준수 서약서를 작성해 보험GA협회로 제출해야 한다.서약서를 제출한 GA는 유튜브, 소셜네트워크서비스(SNS), 블로그..",,https://www.asiatoday.co.kr/kn/view.php?key=20250226010014228,아시아투데이
"권영세 ""입법 권력 이용해 법위에 군림하는 野…하나로 뭉쳐 대응해야""",https://img.asiatoday.co.kr/file/2025y/02m/26d/20250226010014231_250.jpg,"권영세 국민의힘 비상대책위원장은 26일 ""더불어민주당의 무도한 태도에 대응하기 위해서는 우선 우리가 모두 하나로 똘똘 뭉쳐야 할 것""이라고 말했다.권 비대위원장은 이날 충남 천안 재능교육연수원에서 열린 충청·호남권 광역·기초의원 연수 인사말에서 ""입법 권력을 이용해 이재명의 사법 리스크를 벗겠다고 법 위에 군림하면서 대한민국의 자유민주주의를 억압하려는 세력이 말 그대로 활개를 치고 있다""며 이같이 밝혔다. 권 비대위원장은 ""정국이 정말 어수선..",,https://www.asiatoday.co.kr/kn/view.php?key=20250226010014231,아시아투데이
"하나투어 트레킹 설명회 개최, 일본 후지산 등 코스·팁 소개",https://img.asiatoday.co.kr/file/2025y/02m/26d/20250226010014229_250.jpg,"하나투어가 해외 트레킹에 관심을 반영해 '2025 하나투어 트레킹 설명회'를 개최한다.이번 설명회는 해외 트레킹 지역부터 지역별 코스, 기후, 준비물 등 세부 정보와 팁을 소개하는 행사다. 코로나19 이후 약 5년 만에 재개된다. 설명회에는 트레킹 전문가들이 직접 참여해 현장감 있는 이야기를 전달한다고 하나투어가 26일 전했다.첫 설명회는 3월 31일 하나투어 본사에서 열린다. 여름과 가을 시즌에 떠나기 좋은 트레킹 목적지로 일본 후지산과 다..",,https://www.asiatoday.co.kr/kn/view.php?key=20250226010014229,아시아투데이
"한성자동차, 유튜버 '부읽남' 초청 강연…'드라이브 투 렉처' 성료",https://img.asiatoday.co.kr/file/2025y/02m/26d/20250226010014201_250.jpg,메르세데스-벤츠 공식 딜러 한성자동차가 '드라이브 투 렉처'를 통해 고객들을 초청해 실질적 도움이 되는 부동산 정보를 공유하는 장을 마련했다.한성자동차는 지난 20일 조선팰리스 서울 강남의 조선 마스터즈 스위트룸에서 부동산 전문 유튜버 '부읽남'과 함께 고객 초청 강연 프로그램 '드라이브 투 렉처'를 성황리에 마쳤다고 26일 밝혔다.드라이브 투 렉처는 한성자동차 고객 초청 맞춤 강연이다. 고객의 주요 관심사에 대한 전문적 인사이트를 제공한다...,,https://www.asiatoday.co.kr/kn/view.php?key=20250226010014201,아시아투데이
"오뚜기, 방탄소년단 진과 '진라면' 글로벌 캠페인",https://img.asiatoday.co.kr/file/2025y/02m/26d/20250226010014218_250.jpg,오뚜기는 '진라면' 글로벌 모델로 방탄소년단 진을 발탁하고 3월부터 캠페인을 펼친다고 26일 밝혔다.오뚜기는 올해 진라면의 글로벌 패키지를 재단장하고 시장 확대에 나설 계획이다. 방탄소년단 진 초상이 들어간 패키지는 용기 및 컵 제품으로 만나볼 수 있다. 국내 제품은 물론 미국·캐나다·중국·베트남·인도네시아 등으로 수출되는 진라면에 진의 초상이 새겨진다.씰스티커도 구성했다. 2022년 진의 첫 솔로 싱글 '디 애스트로넛(The Astronau..,,https://www.asiatoday.co.kr/kn/view.php?key=20250226010014218,아시아투데이
"김영호 통일장관 ""북한군 포로 우리 국민…수용할 만반의 준비""",https://img.asiatoday.co.kr/file/2025y/02m/26d/20250226010014213_250.jpg,"김영호 통일부 장관은 우크라이나에 생포된 북한군 포로가 한국 귀순을 희망할 경우, 수용하고 보호할 만반의 준비를 하고 있다고 밝혔다.김 장관은 26일 국회 외교통일위원회 전체회의에서 북한군 포로의 귀순 문제에 대한 진행 상황을 묻는 인요한 국민의힘 의원의 질의에 이 같이 답했다.김 장관은 ""북한군 포로는 헌법상으로 우리 국민""이라며 ""(귀순 의사를 밝힌) 그분들의 자유의사가 확인된다면 통일부는 그분들을 수용하고 보호할 만반의 준비를 하고 있다..",,https://www.asiatoday.co.kr/kn/view.php?key=20250226010014213,아시아투데이
"농관원, 대학생기자단 2기 발족… ""생산자·소비자 모두에게 다가갈 것""",https://img.asiatoday.co.kr/file/2025y/02m/26d/20250226010013888_250.jpg,"세종// 국립농산물품질관리원이 지역 대학생으로 구성된 '농관원 제2기 대학생기자단'을 발족한다.26일 농관원에 따르면 올해 대학생기자단은 우송대·영남대·전북대 등 3개 대학에 다니는 학생 12명으로 구성된다. 지난해는 우송대·영남대 재학생 8명으로 운영됐다.대학생기자단은 농관원이 추진하는 농업경영체, 원산지표시 및 국가인증제도 등 주요 농업 정책을 포함해 농식품 관련 △카드뉴스 △쇼츠 영상 △블로그 기사 등을 제작한 뒤 소셜미디어(SNS)에 게..",,https://www.asiatoday.co.kr/kn/view.php?key=20250226010013888,아시아투데이
