title,thumbnail,short_content,write_time,link,company
"휴온스메디텍, 전립선염 체외충격파치료기 'IMPO88 플러스' 선봬",https://img.asiatoday.co.kr/file/2025y/04m/18d/20250418010011260_250.jpg,"휴온스메디텍은 체외충격파 치료기 'IMPO88 Plus(플러스)'를 출시했다고 18일 밝혔다.회사 측에 따르면 제품은 기존 발기부전 체외충격파 치료기기 'IMPO88'의 후속 모델로, 만성전립선염과 만성골반통증증후군에 대한 적응증을 추가한 것이 특징이다.휴온스메디텍은 IMPO88 Plus가 발기부전뿐 아니라 만성전립선염, 염증성·비염증성 만성골반통증증후군 환자를 대상으로도 치료 효과가 있음을 입증했다고 강조했다.회사 측에 따르면 만성전립선염,..",,https://www.asiatoday.co.kr/kn/view.php?key=20250418010011260,아시아투데이
"스킨1004, ‘히알루-시카 워터핏 선세럼’ 日 오프라인 출시",https://img.asiatoday.co.kr/file/2025y/04m/18d/20250418010011259_250.jpg,"스킨케어 브랜드 스킨1004(스킨천사)가 '히알루-시카 워터핏 선세럼'을 일본 오프라인 채널에 론칭한다고 18일 밝혔다.선케어 제품인 '히알루-시카 워터핏 선세럼'은 SPF 50+, PA++++의 자외선 차단 효과와 함께 히알루론산, 센텔라아시아티카 성분을 함유해 피부에 끈적임 없는 수분감을 선사한다. 지난 2022년 일본 출시 이후 온라인에서만 누적 판매량 30만개 이상을 기록하고 있다.이에 스킨1004는 오프라인까지 판매 채널을 확대해 일..",,https://www.asiatoday.co.kr/kn/view.php?key=20250418010011259,아시아투데이
"한화에너지 등 3개사, 한화에어로 1.3조 유증 참여…""소액주주 보호 초점""",https://img.asiatoday.co.kr/file/2025y/04m/18d/20250418010011258_250.jpg,"한화에어로스페이스의 1조3000억원 규모 제3자배정 유상증자에 한화에너지, 한화임팩트파트너스, 한화에너지싱가포르 등 3개사가 참여한다. 이에 따라 지난 2월 한화에어로가 한화에너지 등에 한화오션 지분 매각대금으로 지급한 1조3000억원은 다시 한화에어로로 되돌아가게 된다. 이번 유증으로 해당 자금이 한화에너지 대주주의 경영권 승계 자금으로 쓰이는 것 아니냐는 논란을 완전히 해소시키겠다는 것이다. 한화에너지는 김승연 한화그룹 회장의 세 아들이..",,https://www.asiatoday.co.kr/kn/view.php?key=20250418010011258,아시아투데이
"""고급스러움 더했다""…롯데칠성음료 '여울', 패키지 리뉴얼",https://img.asiatoday.co.kr/file/2025y/04m/18d/20250418010011252_250.jpg,"롯데칠성음료는 증류식 소주 '여울'의 패키지를 리뉴얼 한다고 18일 밝혔다. '여울' 디자인의 기본 콘셉트인 '이응(ㅇ)'으로 표현한 여울물에 비친 달의 모습, 여울이 흐르는 모습을 형상화한 물결 패턴의 병 디자인을 유지한 가운데 고급스러움을 더했으며, 병뚜껑은 소재를 변경하고 상단에 여울물을 형상화한 디자인을 적용했다. 병뚜껑의 높이를 늘려 개봉 편의성을 높였고 캡씰을 적용해 고급스러움과 안정성을 더했으며, 제품 라벨을 하얀색에서 검정색으..",,https://www.asiatoday.co.kr/kn/view.php?key=20250418010011252,아시아투데이
"'P4G' 국제회의 폐막… 기후대사, '자발적 기여' 한국역할 강조",https://img.asiatoday.co.kr/file/2025y/04m/18d/20250418010011256_250.jpg,"외교부는 정기용 기후변화대사가 지난 14~17일(현지시간) 베트남 하노이에서 열린 '2025 제4차 P4G 정상회의'에 참석해 기후위기 극복을 위한 한국의 기여 방안에 대해 소개했다고 18일 밝혔다.P4G (Partnering for Green Growth and the Global Goals 2030)는 민관 협력을 통한 기후 행동과 지속가능발전목표(SDGs) 달성 촉진을 위해 2018년 출범했다. 한국, 덴마크, 네덜란드, 베트남, 인도네..",,https://www.asiatoday.co.kr/kn/view.php?key=20250418010011256,아시아투데이
"""디지털전환 차원"" HDC·부동산114 합병…HDC랩스에 부동산 DB 양도",https://img.asiatoday.co.kr/file/2025y/04m/18d/20250418010011254_250.jpg,HDC그룹이 신사업 확장과 그룹 차원의 디지털 전환(DX)을 위해 구조 개편을 단행한다. HDC그룹은 지주사 HDC와 부동산114의 합병 절차를 오는 30일까지 마무리한다고 18일 밝혔다. HDC가 부동산114를 2018년 2월에 인수한 지 7년 만이다.앞으로 HDC그룹은 HDC가 지분 100% 보유하고 있는 부동산114의 부동산 DB 등 소프트웨어 측면의 사업부문을 HDC랩스에 영업양도할 방침이다. 또한 부동산114의 자회사인 미래비아이가..,,https://www.asiatoday.co.kr/kn/view.php?key=20250418010011254,아시아투데이
최태원 회장 동생 최기원 이사장 SK㈜ 3500주 매수,https://img.asiatoday.co.kr/file/2025y/04m/18d/20250418010011235_250.jpg,"최태원 SK그룹 회장의 동생 최기원 행복나눔재단 이사장이 SK㈜ 3500주를 매수했다. 18일 금융감독원에 따르면 최기원 이사장은 16일과 이날 각각 1300주, 2200주를 매수했다. 매수 금액은 약 4억2000만원이다. 최 이사장의 보유 지분율은 6.6%다. 최 이사장은 경영에는 참여하지 않고 있다. SK는 지난해부터 그룹 리밸런싱 작업을 강도 높게 진행하고 있다. 올해도 적극적인 리밸런싱과 본원적 경쟁력 강화를 통해 기업가치를 제고하는..",,https://www.asiatoday.co.kr/kn/view.php?key=20250418010011235,아시아투데이
"에너지공단, 8개 분산에너지 비즈니스 모델 지원 업무협약",https://img.asiatoday.co.kr/file/2025y/04m/18d/20250418010011228_250.jpg,"한국에너지공단은 2025년 미래 지역에너지 생태계 활성화 사업에 최종 선정된 8개 주관기관 대표들과 지역 기반의 에너지 생산·소비 체계 구축과 지역 경제 활성화 지원을 위한 업무협약을 체결했다고 18일 밝혔다.해당 사업은 분산에너지 활성화 특별법 시행에 따라 지난해부터 지역 특성에 맞는 분산에너지 비즈니스 모델을 발굴·지원하고 지역으로 확산하는 사업으로 올해 사업규모는 87억원이다.특히, 상반기 분산에너지 특화 지역 지정이 예정돼 신청을 준비..",,https://www.asiatoday.co.kr/kn/view.php?key=20250418010011228,아시아투데이
해외 대형 프로젝트 수주 시동 건 대우건설…플랜트 영토 확장 '꿈' 이룬다,https://img.asiatoday.co.kr/file/2025y/04m/18d/20250418010011218_250.jpg,대우건설이 의욕적으로 추진하고 있는 해외 대형 프로젝트 수주에 청신호가 커졌다. 그동안 계약이 미뤄졌던 해외 대형 프로젝트가 올해부터 본격적으로 계약에 나설 것으로 예상되고 있어서다. 앞으로는 해외 플랜트 수주에 총력전을 펼치기로 했다.18일 대우건설에 따르면 회사는 투르크메니스탄 국영 화학공사와 함께 이날 서울 종로구 소재 포시즌스호텔에서 약 1조원 규모의 투르크메니스탄 인산 비료 플랜트 프로젝트 수주 기본합의서에 서명했다. 회사가 지난해..,,https://www.asiatoday.co.kr/kn/view.php?key=20250418010011218,아시아투데이
차태현·조인성 신생 기획사 차렸다… 20년 절친 '의기투합',https://img.asiatoday.co.kr/file/2025y/04m/18d/20250418001643158_250.jpg,"배우 차태현과 조인성이 신생 매니지먼트사 ‘베이스캠프 컴퍼니’를 설립하고 새로운 여정을 시작한다. 18일 차태현과 조인성은 선후배이자 절친으로 20년 이상 다져온 신의를 바탕으로 ‘베이스캠프 컴퍼니’를 설립하고 새로운 출발을 알렸다. ‘베이스캠프 컴퍼니’라는 이름에는 높은 산을 등반하거나 새로운 탐험을 할 때 반드시 베이스캠프가 필요하듯, 아티스트의 활동을 안정적으로 지원하며 함께 나아가는 든든한 기지가 되고자 하는 마음을 담았다. ‘베이스캠프..",,https://www.asiatoday.co.kr/kn/view.php?key=20250418001643158,아시아투데이
"[영상] 금융산업 선진화를 위한 Value UP, '제7회 아시아투데이 금융포럼' 성료",,"아시아투데이는 지난 3월 28일 서울 중구 은행회관에서 ‘밸류업, 1년간의 성과와 과제’를 주제로 제7회 아시아투데이 금융포럼을 개최했다. 이번 포럼은 정부가 추진한 ‘밸류업 프로그램’ 시행 1주년을 맞아 그간의 성과를 되짚고 향후 발전 방향을 모색하기 위해 마련된 자리로, 아시아투데이가 주최·주관하고 금융위원회, 금융감독원, 한국거래소, 금융투자협회, 은행연합회 등 주요 금융 유관기관이 후원해 민관이 함께하는 의미 있는 논의의 장으로 꾸려졌다..",,https://www.asiatoday.co.kr/kn/view.php?key=20250418001635323,아시아투데이
"한전KDN, 국가산업대상 경영혁신 부문 4년 연속 수상",https://img.asiatoday.co.kr/file/2025y/04m/18d/20250418010011214_250.jpg,"한전KDN은 '2025 국가산업대상' 경영혁신 부문에서 4년 연속 대상을 수상했다고 17일 밝혔다.산업정책연구원(IPS)이 주최하고 산업통상자원부, 중소벤처기업부, 서울과학종합대학원대학교(sSSIST) 등이 공동 후원하는 '국가산업대상'은 우수한 경영 능력과 차별화된 서비스 경쟁력 제고로 국가 산업 발전에 크게 공헌한 기관에 수여하는 상이다. 한전KDN은 국내 유일의 에너지ICT 전문 공기업으로 다양한 대·내외 이해관계자의 목소리를 회사 경영..",,https://www.asiatoday.co.kr/kn/view.php?key=20250418010011214,아시아투데이
"질병청, 감염병 대비 국가비축물자 중장기 계획 수립",https://img.asiatoday.co.kr/file/2025y/04m/18d/20250418010011205_250.jpg,"질병관리청은 2025년 제1차 감염병관리위원회에서 '제2차 국가비축물자 중장기 계획'을 확정했다고 18일 밝혔다.이번 중장기 계획은 코로나19 대응 등의 경험을 바탕으로, 향후 감염병 대유행에 대비하여 비축이 필요한 의료·방역 물품을 재검토하고, 세부 운영 방안을 마련하여 위기 상황에서 국민의 생명을 보호하고자 수립됐다.그간 정부는 감염병으로 인한 국가 공중보건 위기 상황을 대비해 비축물자 선정 및 관리 계획을 수립·운영해 왔으며, 코로나19..",,https://www.asiatoday.co.kr/kn/view.php?key=20250418010011205,아시아투데이
"우크라, 美와 MOU 체결… ""광물 협정 향한 첫 걸음""",https://img.asiatoday.co.kr/file/2025y/04m/18d/20250418010011204_250.jpg,"우크라이나 정부는 17일(현지시간) 미국과 광물 자원 개발 협정 체결을 위한 첫 단계로서 양해각서(MOU)를 체결했다고 밝혔다.양국은 지난 2월 광물 협정을 체결할 예정이었으나, 백악관 집무실에서 열린 도널드 트럼프 대통령과 볼로디미르 젤렌스키 우크라이나 대통령 간의 정상회담이 파국으로 치달으며 체결이 무산됐다.로이터통신에 따르면 우크라이나의 율리야 스비리덴코 부총리 겸 경제장관은 MOU 체결 후 SNS를 통해 ""미국 파트너들과의 서명을 발표..",,https://www.asiatoday.co.kr/kn/view.php?key=20250418010011204,아시아투데이
‘몸짱 경찰 달력’으로 2900만원 기부…아동학대·산불 피해 지원,https://img.asiatoday.co.kr/file/2025y/04m/18d/20250418010011122_250.jpg,"전국의 경찰관들이 재능기부로 제작한 '몸짱 경찰 달력' 수익금 2900여만원을 서울 사회복지공동모금회(서울 사랑의열매)에 기부했다.18일 경찰에 따르면 이번 달력 제작에는 총 58명의 경찰관이 참여했으며, 3000여명의 시민이 달력을 구매하며 기부에 동참했다. 수익금은 학대 피해 아동의 치료 및 생계 지원은 물론, 최근 발생한 대형 산불 피해 지역 주민 지원에도 사용될 예정이다.기부에 사용된 '몸짱 경찰 달력'은 제주도보디빌딩협회가 주최하는..",,https://www.asiatoday.co.kr/kn/view.php?key=20250418010011122,아시아투데이
"올해 첫 SFTS 환자 발생…질병청 ""진드기 기피제 사용·예방수칙 준수해야""",https://img.asiatoday.co.kr/file/2025y/04m/18d/20250418010011201_250.jpg,"질병관리청은 올해 처음으로 중증열성혈소판감소증후군(SFTS) 환자가 발생했다고 18일 밝혔다. 첫 환자는 전북특별자치도 남원시에 거주하는 80대 여성으로 집 주변에서 농작업 중 진드기에 물린 후, 구토, 발열(38.1℃), 전신 쇠약, 식욕부진 증상이 발생했으며, 의료기관을 방문 후 SFTS 확인진단 검사 결과 양성으로 확인됐다. 올해 SFTS 첫 환자 발생은 최근 3년간 발생일과 비슷한 것으로 나타났다.SFTS는 주로 4~11월까지 SFTS..",,https://www.asiatoday.co.kr/kn/view.php?key=20250418010011201,아시아투데이
"김문수 캠프 ""尹 탈당 반대…도의적으로 옳지 않아""",https://img.asiatoday.co.kr/file/2025y/04m/18d/20250418010011199_250.jpg,"아시아투데이 이체리 기자·권해준 인턴 기자 = 윤석열 전 대통령의 '탈당'을 요구하는 목소리가 국민의힘 일각에서 나오고 있는 가운데 김문수 대선 캠프 측은 18일 반대 입장을 밝혔다이충형 김문수 캠프 대변인은 이날 논평에서 ""윤 전 대통령에 대한 탈당을 요구하는 국민의힘 일부 후보의 주장에 반대한다""며 ""탄핵 사태는 당에도 정치적 책임이 있다""고 이같이 말했다.이 대변인은 ""국민들이 직접 선거로 선출한 대통령의 탄핵은 역사적으로 불행한 일""이라..",,https://www.asiatoday.co.kr/kn/view.php?key=20250418010011199,아시아투데이
"음주운전 이유 물어보니…""대리운전·대중교통 없어서"" 응답 최다",https://img.asiatoday.co.kr/file/2025y/04m/18d/20250418010011200_250.jpg,"한국도로교통공단이 최근 음주운전 교통안전교육 수강생을 대상으로 설문 조사한 결과 음주운전을 하게 된 이유로 '대리운전이나 대중교통이 없어서'라는 답변이 가장 많은 것으로 조사됐다.18일 한국도로교통공단(공단)에 따르면 공단은 지난 3월 전국 21개 교육장 음주운전 교통안전교육 수강생 1518명을 대상으로 설문 조사를 진행했다.음주운전 교통안전교육은 음주운전자를 대상으로, 재발방지를 위한 실천계획 수립을 목표로 하는 교육이다.수강생들은 음주운전..",,https://www.asiatoday.co.kr/kn/view.php?key=20250418010011200,아시아투데이
고령 장애인 55% 돌파…자립 지원 사각지대 여전,https://img.asiatoday.co.kr/file/2025y/04m/18d/20250418010011171_250.jpg,"65세 이상 고령 장애인이 빠르게 늘어나고 있지만 이들의 특성을 고려한 자립 지원 정책이 그 속도를 따라가지 못하고 있다. 고령 장애인이 독립적 생활을 할 수 있는 현실적인 제도 개선이 시급하다는 지적이 제기되고 있다.18일 보건복지부에 따르면 지난해 말 기준 등록장애인은 263만1000명으로 전체 인구의 5.1%를 차지했다. 이 가운데 65세 이상 고령 장애인은 145만5782명으로, 전체 등록장애인의 55.3%에 달했다. 고령 장애인 비율..",,https://www.asiatoday.co.kr/kn/view.php?key=20250418010011171,아시아투데이
"송치영 ""업종특화교육 소상공인 성장 동력 제공 계기""",https://img.asiatoday.co.kr/file/2025y/04m/18d/20250418010011197_250.jpg,"소상공인연합회 서울 여의도에 있는 CCMM빌딩에서 '2024년도 업종별 맞춤 교육 성과보고회'를 개최했다고 18일 밝혔다. 소공연은 작년 소속 회원단체의 자생적 성장구조를 체계적으로 구축하기 위해 소상공인 업종특화교육을 진행했다. 이번 사업은 소상공인시장진흥공단 위탁사업으로 소상공인의 경영개선과 지속 성장을 위해 업종별 협·단체와 협업, 11개 단체에서 각 업종별 자격·최신기술, 관련 업계 종사자의 노하우 등의 교육이 진행됐다. 지난해 7월..",,https://www.asiatoday.co.kr/kn/view.php?key=20250418010011197,아시아투데이
"김백준ㆍ옥태훈, KPGA 개막전 선두 다툼",https://img.asiatoday.co.kr/file/2025y/04m/18d/20250418010011195_250.jpg,"신예 김백준(23)과 베테랑 옥태훈(26)이 한국프로골프(KPGA) 투어 개막전에서 우승 경쟁에 본격 돌입했다. 김백준은 18일 강원도 춘천시 라비에벨 골프 & 리조트 올드코스(파71)에서 계속된 KPGA 투어 시즌 개막전인 DB손해보험 프로미 오픈(총상금 10억원) 2라운드에서 이글 1개, 버디 5개, 보기 2개 등으로 5언더파 66타를 때렸다. 첫날 2언더파에 더해 중간 합계 7언더파 135타가 된 김백준은 순위를 19계단이나 끌어..",,https://www.asiatoday.co.kr/kn/view.php?key=20250418010011195,아시아투데이
"폭스바겐코리아, 전국 전시장서 전모델 시승 이벤트 진행",https://img.asiatoday.co.kr/file/2025y/04m/18d/20250418010011190_250.jpg,"폭스바겐코리아가 전국 전시장에서 폭스바겐의 전 모델을 경험할 수 있는 'Timeless Moment' 전국 시승 행사를 진행한다.18일 폭스바겐코리아에 따르면 오는 19일부터 6월 1일까지 전국 22개 폭스바겐 전시장에서 올해 1분기 베스트셀링 유럽 브랜드 전기차 'ID.4', 쿠페 스타일 순수 전기 SUV 'ID.5', 타임리스 아이콘 해치백 '신형 골프', 플래그십 SUV '투아렉' 등 전 모델 시승이 가능한 이벤트를 실시한다.상반기 중..",,https://www.asiatoday.co.kr/kn/view.php?key=20250418010011190,아시아투데이
"농협, 나주 냉해 피해농가 점검… ""대책 마련 최선""",https://img.asiatoday.co.kr/file/2025y/04m/18d/20250418010011191_250.jpg,세종// 농협중앙회가 전남 나주에 위치한 배 재배농가를 방문해 냉해 피해상황을 점검했다.18일 농협에 따르면 지준섭 부회장은 이날 관내 조합장들과 냉해 피해 점검 및 과수농가 현장 간담회를 실시했다.이번 방문은 지난달 말부터 발생한 이상저온으로 전국 과수농가에서 냉해 피해가 발생하자 현장 상황을 점검하고 지원방안을 모색하기 위해 마련됐다.현재까지 사과·배·복숭아 등 전국 과수농가에게 냉해 피해가 발생한 것으로 파악됐다. 특히 배 주산지인 나주..,,https://www.asiatoday.co.kr/kn/view.php?key=20250418010011191,아시아투데이
"대검, 서민다중피해범죄 대응 전국 전담검사 회의 개최",https://img.asiatoday.co.kr/file/2025y/04m/18d/20250418010011184_250.jpg,"대검찰청이 전담검사 회의를 열고 다단계·불법사금융 범죄 등 서민에게 피해를 끼치는 경제 범죄에 엄정 대응을 시사했다.18일 대검 형사부(이진수 검사장)는 불법사금융 범죄, 유사수신·다단계 범죄에 대한 검찰의 대응역량을 강화하고자 서민다중피해범죄 대응 수도권 부장검사 및 전국 전담검사 회의를 개최했다고 밝혔다.제1부 부장검사 회의에서는 수도권 서민다중피해범죄 전담부서 부장검사 13명이 모여 서민다중피해범죄 현황을 살피고 불법사금융 범죄에 대한..",,https://www.asiatoday.co.kr/kn/view.php?key=20250418010011184,아시아투데이
"우리은행, 알뜰폰 브랜드 '우리WON모바일' 출시",https://img.asiatoday.co.kr/file/2025y/04m/18d/20250418010011185_250.jpg,"우리은행은 18일 금융과 통신을 결합한 알뜰폰 서비스 '우리WON모바일'을 정식 출시했다고 밝혔다.이날 출시된 우리WON모바일은 우리WON뱅킹 앱과 전용 홈페이지를 통해 비대면으로 간편하게 가입할 수 있다. 특히 사용자 중심의 간편한 UX(사용자경험)를 적용해 간소화된 가입 절차가 특징이다.요금제는 월 5000원부터 3만원대까지 총 34종으로 구성됐다. 일반요금제와 OTT(온라인 동영상 서비스) 할인 요금제, 급여이체 실적에 따라 할인이 적용..",,https://www.asiatoday.co.kr/kn/view.php?key=20250418010011185,아시아투데이
"‘슬로우 스타터’ 마다솜 김해서 맹타, 최은우도 순항",https://img.asiatoday.co.kr/file/2025y/04m/18d/20250418010011177_250.jpg,한국여자프로골프(KLPGA) 투어의 대표적인 슬로우 스타터로 알려져 있는 마다솜이 시즌 초반 까다로운 김해 무대에서 조기 첫 승 가능성을 열었다. 김해 여신 최은우도 대회 3연패를 향한 디딤돌을 무난하게 놓았다. 마다솜은 18일 경남 김해 가야 컨트리클럽(파72·6836야드)에서 막을 올린 KLPGA 투어 넥센·세인트나인 마스터즈(총상금 9억원) 1라운드에서 보기 없이 버디만 7개를 낚으며 리드보드의 최상단을 차지했다. 이날 마다솜은 상대적으..,,https://www.asiatoday.co.kr/kn/view.php?key=20250418010011177,아시아투데이
"지방금융 전문가들 ""지역경제 활성화 위해 지방은행 역할 필요""",https://img.asiatoday.co.kr/file/2025y/04m/18d/20250418010011101_250.jpg,"아시아투데이 한상욱 기자·손승현 인턴기자= 지방소멸 위기로 어려움을 겪고 있는 지역경제의 활성화를 위해 지방은행이 경쟁력을 갖출 수 있도록 정책 지원이 필요하다는 제언이 나왔다. 18일 '지역경제의 위기와 지방은행의 역할' 토론회가 국회도서관 소회의실에서 진행됐다. 이번 토론회는 금융경제연구소가 주관하고 전국금융산업노동조합과 더불어민주당 노동존중실천단이 공동 주최했다.지역경제 침체와 지방은행의 소멸 위기가 심화되는 가운데, 지역경제가 활기를 찾..",,https://www.asiatoday.co.kr/kn/view.php?key=20250418010011101,아시아투데이
"NH농협은행, 부산 전통시장과 '장금이 결연'…지역상생 '앞장'",https://img.asiatoday.co.kr/file/2025y/04m/18d/20250418010011173_250.jpg,"NH농협은행은 지난 17일 부산 부산진구 NH농협은행 부산본부에서 부전마켓타운, 해운대시장과 '장금이 결연'을 체결했다고 18일 밝혔다.금융감독원과 중소벤처기업부가 주관하는 '장금(場金)이'는 시장을 의미하는 장(場)과 금융기관을 의미하는 금(金)을 합친 말로, 전통시장 소상공인의 금융사기 피해예방과 상생금융을 위한 결연을 의미한다.이번 협약을 통해 NH농협은행은 부전마켓타운과 해운대시장 상인들을 대상으로 금융사기 예방교육을 진행하고, 보이스..",,https://www.asiatoday.co.kr/kn/view.php?key=20250418010011173,아시아투데이
"나경원 ""교육감 직선제 폐지…'서울런' 전국 확대""",https://img.asiatoday.co.kr/file/2025y/04m/18d/20250418010011164_250.jpg,"아시아투데이 이체리 기자·홍채완 인턴 기자 = 나경원 국민의힘 대선 경선 후보는 18일 ""교육감 직선제를 폐지할 것. 공교육 완전 정상화로 교육의 근본을 바로 세우겠다""며 교육 정책 공약을 발표했다.나 후보는 이날 오전 국회 소통관에서 기자회견을 열고 ""정치화된 교육 현장을 반드시 개선하겠다""며 ""교육감 직선제가 오히려 교육현장 이념·정치화를 부추겼다""고 이같이 밝혔다.이어 ""무력화된 교원평가제를 활성화 하는 등 대한민국 교육을 병들게 하는 소..",,https://www.asiatoday.co.kr/kn/view.php?key=20250418010011164,아시아투데이
"[마감시황] 코스피, 2480대 강보합 마감…코스닥도 상승",https://img.asiatoday.co.kr/file/2025y/04m/18d/20250418010011167_250.jpg,"코스피가 2480대에서 강보합 마감했다. 코스닥 역시 710대에 안착했다.21일 한국거래소에 따르면 이날 코스피 지수는 전 거래일 대비 13.01포인트(0.53%) 오른 2483.42에 장을 마감했다. 장중 최저가는 2466.90원, 최고가는 2486.37원을 기록했다.시가총액 상위 10개 기업 중 삼성전자(0.36%), 현대차(3.03%), 한화에어로스페이스(1.47%), 삼성전자우(0.22%), 기아(2.71%), KB금융(2.62%) 등..",,https://www.asiatoday.co.kr/kn/view.php?key=20250418010011167,아시아투데이
"NH농협금융, 기보와 중소벤처기업 금융지원 '맞손'",https://img.asiatoday.co.kr/file/2025y/04m/18d/20250418010011165_250.jpg,"NH농협금융그룹은 지난 17일 부산 남구 기술보증기금 본사에서 기술보증기금과 '중소벤처기업 기술금융 지원 강화를 위한 업무협약'을 체결했다고 18일 밝혔다.이번 협약은 보증서 기반 협약대출 확대를 비롯해 중소벤처기업에 생애주기별 맞춤형 금융솔루션을 제공하기 위해 마련됐다. NH농협금융은 은행, 보험, 증권 등 다양한 자회사 포트폴리오를 기술보증기금의 보증 지원 역량과 연계해 기술금융을 강화한다는 구상이다.특히 핵심 자회사인 NH농협은행이 올해..",,https://www.asiatoday.co.kr/kn/view.php?key=20250418010011165,아시아투데이
