title,thumbnail,short_content,write_time,link,company
"권기식 한중도시우호협회장, 대외경제무역대 방문",https://img.asiatoday.co.kr/file/2025y/02m/26d/20250226010014356_250.jpg,"아시아투데이 홍순도 베이징 특파원 = 권기식 한중도시우호협회장은 25일 중국 베이징시 차오양(朝陽)구 소재 대외경제무역대학을 방문, 하오쥔펑 부학장과 오찬을 함께 하면서 한중 경제 협력과 대학 교류에 대해 대담했다.협회의 베이징 지회 김형학 비서장의 26일 전언에 따르면 권 회장은 이어 이 대학 외국어학부 회의실에서 취안샤오싱(權小星) 상하이미디어그룹 외교·동아시아 담당 선임 프로듀서와 한중 관계 및 미중 관계에 대한 대담 인터뷰를 가졌다.권..",,https://www.asiatoday.co.kr/kn/view.php?key=20250226010014356,아시아투데이
'리딩뱅크 탈환' 특명 이환주號… 관건은 신뢰회복·수익 제고,https://img.asiatoday.co.kr/file/2025y/02m/27d/20250227010014355_250.jpg,"KB국민은행이 이름값을 못했다. KB금융그룹이 지난해 금융그룹 역사상 처음으로 '순익 5조원 시대'를 열며 리딩금융그룹 위상을 공고히 했지만, 핵심 자회사인 국민은행은 신한·하나은행에 밀려 3등 은행에 머물렀다. 대규모 투자자 손실을 야기한 홍콩 H지수 ELS(주가연계증권) 사태로 인해 수천억원의 충당부채가 반영됐기 때문이다. 하지만 경쟁사들도 ELS 사태 여파를 겪은 만큼, 국민은행이 수익성 문제에 직면한 게 아닌지 우려되는 상..",,https://www.asiatoday.co.kr/kn/view.php?key=20250227010014355,아시아투데이
"큐텐재팬, K뷰티 컨퍼런스 개최…코스맥스와 '맞손'",https://img.asiatoday.co.kr/file/2025y/02m/26d/20250226010014353_250.jpg,일본 K뷰티 플랫폼 중 하나인 큐텐재팬과 화장품 ODM(제조업자개발생산) 기업 코스맥스가 K뷰티의 일본 시장 진출 지원을 위해 손 잡는다.이커머스 기업 이베이재팬이 운영하는 온라인 오픈마켓 '큐텐재팬'이 다음달 14일 그랜드 인터컨티넨탈 서울 파르나스에서 '2025 큐텐재팬 K뷰티 메가 컨퍼런스'를 진행한다고 26일 밝혔다. 코스맥스는 공식 협찬사로 나선다.큐텐재팬은 K뷰티 브랜드들의 글로벌 진출에 대한 높은 관심을 반영해 대규모 뷰티 컨퍼런..,,https://www.asiatoday.co.kr/kn/view.php?key=20250226010014353,아시아투데이
"尹, 국민통합·책임총리제 제안… ""과거 벗어난 새정치 희망""",https://img.asiatoday.co.kr/file/2025y/02m/27d/20250227010014354_250.jpg,"대통령실은 26일 윤석열 대통령이 전날 밤 헌법재판소 최후 변론에서 개헌을 언급한 것과 관련해 ""대통령의 개헌 의지가 실현돼 우리 정치가 과거의 질곡에서 벗어나 새로운 시대를 열기를 희망한다""고 밝혔다. 대통령실은 이날 기자들에게 보낸 메시지에서 ""윤석열 대통령은 어제 헌법재판소 탄핵심판 최후진술에서 임기 단축 개헌 추진, 국민통합 그리고 총리에게 국내 문제 권한 대폭 위임 등의 뜻을 밝혔다""며 ""대통령실 직원들은 각자 위치에서..",,https://www.asiatoday.co.kr/kn/view.php?key=20250227010014354,아시아투데이
"대체거래소 출범 임박에…증권사, 수수료 인하 '치킨게임'",https://img.asiatoday.co.kr/file/2025y/02m/26d/20250226010014243_250.jpg,"다음 달 4일 대체거래소(ATS) 출범을 앞두고 주요 증권사들이 국내주식 매매수수료율을 잇따라 조정하고 나섰다. 단순히 한국거래소(KRX) 대비 매매체결 수수료가 20~40% 저렴한 넥스트레이드(NXT)의 수수료율을 반영하는 데서 나아가, 추가적인 인하를 통해 고객을 유치하기 위함이다.미래에셋증권을 시작으로 촉발된 국내주식 수수료율 경쟁에는 한국투자증권에 이어 키움증권까지 참전하기로 했다. KB증권과 신한투자증권, 하나증권 등 주요 증권사 역..",,https://www.asiatoday.co.kr/kn/view.php?key=20250226010014243,아시아투데이
내달 尹·李 정치운명 갈림길… 법조계 유·무죄 예측 엇갈려,https://img.asiatoday.co.kr/file/2025y/02m/27d/20250227010014351_250.jpg,이재명 더불어민주당 대표의 항소심과 윤석열 대통령 탄핵심판 선고가 3월 안에 결론이 날 것으로 관측되면서 이들 정치 운명의 열쇠를 쥔 법조계에 시선이 쏠리고 있다. 만일 5월 조기 대선이 치러질 경우 이 대표는 최종 선고 결과가 나오기 전에 출마가 가능한 만큼 사법부 최고 기관인 대법원이 선고를 서둘러야 한다는 지적이 나온다.26일 법조계에 따르면 이재명 대표의 공직선거법 위반 사건에서 주목하고 있는 건 크게 2가지다. 서울고법이..,,https://www.asiatoday.co.kr/kn/view.php?key=20250227010014351,아시아투데이
"이재명 발언 '즉흥성' 여부 최대쟁점… 檢, 유죄 입증 '자신감'",https://img.asiatoday.co.kr/file/2025y/02m/27d/20250227010014350_250.jpg,검찰이 이재명 더불어민주당 대표의 공직선거법 위반 사건 항소심에서도 징역 2년을 구형했다. 선거법의 경우 1심 선고 이후 3개월 내 2심 선고가 원칙이지만 이 대표 측의 재판 지연 전략이 먹혀들면서 선고가 한 달 이상 늦춰지게 됐다. 26일 항소심 재판에서 이 대표의 백현동 발언의 영향력을 두고 상반된 증언이 나오면서 재판부가 어떤 판단을 내릴지에 관심이 모인다.앞서 1심은 이 대표의 발언 가운데 고(故) 김문기 전 성남도시..,,https://www.asiatoday.co.kr/kn/view.php?key=20250227010014350,아시아투데이
"농협, 고향주부모임과 2025년 정기 총회… ""도농상생 실현 기여""",https://img.asiatoday.co.kr/file/2025y/02m/26d/20250226010014348_250.jpg,"세종// 농협중앙회가 (사)고향을생각하는주부들의모임중앙회(고향주부모임)와 쌀 소비 촉진 운동 등 협력을 결의했다.26일 농협에 따르면 서울 중구에 위치한 농협중앙회 본관에서 고향주부모임의 2025년 정기총회가 열렸다.이날 행사에는 강호동 농협회장을 비롯해 전국 고향주부모임 대의원 및 수상자 등 300여 명이 참석했다.고향주부모임은 회원 16만 명을 보유한 대한민국 대표 여성 소비자 단체로, 농협 주부대학 수료생들을 중심으로 결성됐다.이들은 '고..",,https://www.asiatoday.co.kr/kn/view.php?key=20250226010014348,아시아투데이
"""출시 1주만에 10만개 판매""…컴포즈커피, '컴포즈콤보' 출시",https://img.asiatoday.co.kr/file/2025y/02m/26d/20250226010014341_250.jpg,"컴포즈커피에서 새롭게 출시한 '컴포즈콤보'가 소비자들의 이목을 집중시키고 있다.26일 컴포즈커피에 따르면 컴포즈콤보는 출시 일주일만에 10만개 판매를 돌파했다.컴포즈콤보는 66종의 음료와 17가지의 디저트를 자유롭게 조합해 1122가지의 콤보를 구성할 수 있는 메뉴다.지난 20일 공개한, 컴포즈콤보의 바이럴 영상은 공개된 지 단 3일만에 100만 조회 수를 돌파하며, 나만의 최애 콤보 꿀조합을 찾는 이벤트가 사회관계망서비스(SNS) 상에서 확..",,https://www.asiatoday.co.kr/kn/view.php?key=20250226010014341,아시아투데이
화춘잉 中 외교부 부부장 새 자리로 이동,https://img.asiatoday.co.kr/file/2025y/02m/26d/20250226010014346_250.jpg,"아시아투데이 홍순도 베이징 특파원 기자 = 중국 외교부 대변인을 지낸 화춘잉(華春瑩·55) 부부장(차관)이 중국-중·동유럽(CEEC) 협력사무국 사무총장으로 발령이 나면서 무려 15년 동안에 걸친 해외 근무 무경험의 경력을 다시 이어갔다. 그러나 통상 3년인 임기를 마칠 즈음에는 대사 직급의 자리로 이동할 가능성도 없지 않아 보인다. 베이징 외교 소식통들의 26일 전언에 따르면 이날 CEEC 협력사무국 홈페이지에는 1970년 4월 출생, 한족(..",,https://www.asiatoday.co.kr/kn/view.php?key=20250226010014346,아시아투데이
"""트럼프, 공정한 尹탄핵심판 촉구해야""",,"고든 창 미국 변호사는 25일(현지시간) 도널드 트럼프 미국 대통령이 윤석열 대통령에 대한 탄핵 심판이 공정하게 진행돼야 한다고 촉구해야 한다고 강조했다.고든 창은 이날 오전 미국 워싱턴 D.C. 공산주의 희생자 박물관에서 진행된 '대한민국 체제 전복 위험: 반국가 세력·북한, 그리고 중국 공산당'이라는 주제의 포럼에서 ""미국민과 트럼프 대통령이 해야 할 일은 미국과 전 세계가 탄핵 절차를 지켜보고 있으며, 그 결과가 한국의 법에 따라 공정하..",,https://www.asiatoday.co.kr/kn/view.php?key=20250227010014345,아시아투데이
이재명 2심도 '법정최고형' 구형...내달 법원 선고 따라 정국 요동,https://img.asiatoday.co.kr/file/2025y/02m/27d/20250227010014344_250.jpg,조기대선의 가장 큰 변수로 꼽히는 이재명 더불어민주당 대표의 공직선거법 위반 사건에서 검찰이 항소심에서도 이 대표에게 법정최고형인 징역 2년을 구형했다. 검찰은 26일 서울고법 형사6-2부(최은정·이예슬·정재오 부장판사) 심리로 열린 이 대표의 공직선거법 위반 혐의 항소심 결심 공판에서 이같이 구형했다. 특히 검찰은 1심 재판부가 무죄로 판단한 '고 김문기 성남도시개발공사 개발1처장을 몰랐다'는 이 대표의 발언에 사실 오인..,,https://www.asiatoday.co.kr/kn/view.php?key=20250227010014344,아시아투데이
정국 흔드는 尹의 '임기단축 개헌',https://img.asiatoday.co.kr/file/2025y/02m/27d/20250227010014343_250.jpg,"윤석열 대통령이 헌법재판소 최후 진술에서 던진 개헌이 정국을 강타하고 있다. 역대 대선 과정에서 후보들은 1987년 체제의 변화를 외치며 개헌을 시대정신으로 제시해 왔다. 하지만 정부 출범 후엔 사회적 합의·정치 갈등 봉합·체제 변화 비용 등이 쟁점화하면서 과감한 개헌 추진에 나서지 못했다. 윤 대통령의 25일 최후진술을 분석해 보면 복귀 시 내정은 국무총리에게 모두 맡기고 대통령은 외교와 국방, 그리고 개헌을 통한 정치개혁에 나서겠다는 구상..",,https://www.asiatoday.co.kr/kn/view.php?key=20250227010014343,아시아투데이
'이원집정부제 개헌' 꺼낸 尹… 40년 해묵은 '87체제' 손본다,https://img.asiatoday.co.kr/file/2025y/02m/27d/20250227010014342_250.jpg,"윤석열 대통령이 탄핵심판 최후 진술에서 '직무복귀 시 개헌에 힘쓰겠다'고 발언해 40년 해묵은 '87체제' 헌법 개정 가능성에 힘이 실리고 있다. 특히 내치와 외치를 대통령과 국무총리로 각각 권한을 분산하는 '이원집정부제' 방향을 짚은 만큼 개헌에 대한 관심이 모아지고 있다.26일 정치권 등에 따르면 윤 대통령은 전날 탄핵심판 최후 진술에서 ""직무 복귀 시 먼저 개헌과 정치개혁 추진에 임기 후반부를 집중하려 한다. 잔여임기에..",,https://www.asiatoday.co.kr/kn/view.php?key=20250227010014342,아시아투데이
"이수지 '대치맘' 영상에… 대선배 김지혜 ""D사 스니커즈는 안돼""",https://img.asiatoday.co.kr/file/2025y/02m/26d/20250226001738537_250.jpg,"개그우먼 김지혜가 '대치맘' 패러디로 논란을 겪고 있는 후배 이수지를 응원했다.김지혜는 25일 자신의 SNS에 밍크퍼를 착용한 영상과 함께 ""잘가 내 마지막 착샷... 제이미맘 다음엔 D사 스니커즈 신는 건 아니겠지?"", ""개그맨 개그우먼 통틀어 넘버원. 내 기준 너무너무 재밌다""라고 작성했다.이 영상에서 남편 박준형이 ""왜 그렇게 입고 장조림을 해?""라고 묻자 김지혜는 ""이제 이거 입고 밖에 못 나간다. 수지야. 중고 거래 해야 되는거니?""라..",,https://www.asiatoday.co.kr/kn/view.php?key=20250226001738537,아시아투데이
"""尹 진정성 엿보여… 탄핵 기각이 순리""",,"윤석열 대통령이 헌법재판소 최후변론에서 정치개혁과 개헌을 언급한 가운데 여권 인사들은 헌재가 탄핵기각 결정을 내려야 한다고 목소리를 높이고 있다. 이들은 한목소리로 ""윤 대통령의 최후변론은 진정성이 있었다""고 호평했다.김기현 국민의힘 의원은 26일 자신의 페이스북에 ""우리나라가 처한 위기에 대한 절박함을 국민에게 알리고자 하는 마음이 절절하게 느껴졌다""며 ""대통령으로서 일신의 안일함을 택하기보다는 대한민국의 현재와 미래를 위한 걱정이 국민들에..",,https://www.asiatoday.co.kr/kn/view.php?key=20250227010014340,아시아투데이
外人 한도 채우고 해외서도 인기… KT '통신 대장주' 탈환 시동,https://img.asiatoday.co.kr/file/2025y/02m/27d/20250227010014339_250.jpg,"'통신 대장주' 탈환을 노리는 KT가 해외에서도 인기다. 견조한 실적과 AI 중심의 체질개선, 배당정책 확대 등 호재로 오르기 시작한 주가는 거침이 없다. 지난 1년간 뉴욕증권거래소에 상장된 KT 주가 상승률은 20%를 넘는다. 외국인 한도소진율까지 100%에 도달하면서 해외 거래량도 대체로 증가 추세다. 현지 투자 전문가들은 여전히 기업가치가 저평가 상태라는 점을 강조하며 강한 매수 의견을 보이고 있다.26일 뉴욕증권거래소에 따..",,https://www.asiatoday.co.kr/kn/view.php?key=20250227010014339,아시아투데이
말레이 교두보로 할랄시장 공략… 세계로 뻗어가는 SPC삼립,https://img.asiatoday.co.kr/file/2025y/02m/27d/20250227010014338_250.jpg,허영인 SPC그룹 회장의 꿈은 '그레이트 푸드 컴퍼니'다. 2030년까지 전 세계에 1만2000개 매장을 둔 글로벌 기업으로 성장한다는 비전이다. 이 꿈을 위한 필수요건은 해외 생산 체제다. 유통기한이 짧은 빵의 특성상 해외 각지에 생산네트워크를 구축하는 게 필수다.SPC가 허 회장의 꿈을 이룰 교두보를 또 하나 확보했다. 말레이시아에 하루 최대 30만개의 베이커리 제품을 만들 '메머드급' 공장을 준공했다. 대표 브랜드 파리바게뜨..,,https://www.asiatoday.co.kr/kn/view.php?key=20250227010014338,아시아투데이
[민노총 간첩단] 캄보디아·中 등서 접선한 北 공작조에 국가기밀 넘겨,,"북한 문화교류국으로부터 지령을 받아 온 민노총 간첩단이 그동안 대한민국의 국가전복을 위해 어떤 활동을 해왔는지에 이목이 집중되고 있다. 민노총 간첩단 사건의 총책으로 알려진 민노총 조직쟁의국장 석모씨는 북한 문화교류국의 지령에 따라 신규 조직원들을 영입하고, 군사시설 등 국가주요시설 정보를 수집하고 노동조합이나 정당을 장악하는 방법으로 국가전복을 준비했음이 판결을 통해 확인됐다. 26일 본지가 단독 입수한 민노총 간첩단 판결문에 따르면, 석씨..",,https://www.asiatoday.co.kr/kn/view.php?key=20250227010014337,아시아투데이
"9인 맞추고 '8인 선고' 노리는 헌재… ""전원 참여가 논란 없다""",https://img.asiatoday.co.kr/file/2025y/02m/27d/20250227010014336_250.jpg,마은혁 헌법재판관 후보자 임명을 보류한 최상목 대통령 권한대행 부총리 겸 기획재정부 장관의 결정에 대한 헌법재판소(헌재) 판단이 27일 나온다. 헌재가 '9인 완전체' 구성을 위해 마 후보자를 임명하는 방향으로 판결을 낼 것이라는 관측이 법조계 안팎에서 나온다. 문제는 전날 변론 종결된 윤석열 대통령 탄핵심판의 경우 '신속 판결'을 위해 기존 '8인 체제'에서 선고할 가능성이 크다는 점이다. 법조계 일각에선 '재판관 임명'과 '8인 선고'를..,,https://www.asiatoday.co.kr/kn/view.php?key=20250227010014336,아시아투데이
"[민노총 간첩단] 北 ""尹 탄핵 투쟁 선동하라"" 지령에… 방화·폭력 계획까지",https://img.asiatoday.co.kr/file/2025y/02m/27d/20250227010014335_250.jpg,"북한 문화교류국이 전국민주노동조합총연맹(민노총) 간첩단에 보낸 지령 방식과 그 형태에 이목이 집중되고 있다. 북한은 그동안 민노총 간첩단에게 △정치권과 군사시설에 대한 정보수집 △선거개입 △양경수 민노총 위원장 선거 지원 △반미·반보수 투쟁 강화 △윤석열 대통령 퇴진 운동 등의 구체적 지령을 지속적으로 하달했다.26일 본지가 단독 입수한 민노총 간첩단 판결문에 따르면, 문화교류국은 민노총 간첩단에 지령을 내릴 때 크게 다섯 가지 방식을 택했다...",,https://www.asiatoday.co.kr/kn/view.php?key=20250227010014335,아시아투데이
"전한길 ""尹 탄핵 인용시 국민 가만있지 않을 것…마땅히 각하돼야""",https://img.asiatoday.co.kr/file/2025y/02m/26d/20250226010014330_250.jpg,"한국사 강사 전한길 씨가 26일 헌법재판소를 향해 ""윤석열 대통령의 탄핵을 인용한다면 국민들은 재판 결과를 수용할 수 없다""며 ""헌재는 국민의 저항을 각오해야 한다""고 밝혔다.전 씨는 이날 국회 소통관에서 기자회견을 열어 ""우리는 졸속 탄핵을 우려하고 반대하는 모든 국민들의 뜻을 모아 헌법재판소에 강력하게 경고한다. 국회 탄핵 의결부터 헌재 재판까지 수 없는 헌법 위반 논란에 휩싸이고 있는 대통령 탄핵심판은 기각이 아닌 마땅히 각하돼야 한다""..",,https://www.asiatoday.co.kr/kn/view.php?key=20250226010014330,아시아투데이
[K자동차 리부트] '신차·미래車 협업' 양날개… 제2 전성기 맞은 르노코리아,https://img.asiatoday.co.kr/file/2025y/02m/27d/20250227010014329_250.jpg,브랜드 전환 1주년을 맞이하는 르노코리아가 효자 모델로 떠오른 '그랑 콜레오스'를 앞세워 제 2의 전성기를 맞고 있다. 4년 만의 신차를 통해 재도약의 원년을 알린 르노코리아는 올해 부산공장의 생산을 잠시 멈추고 시설 투자에 집중하며 발판을 더욱 공고히 다졌다. 르노코리아는 지난해 전년 대비 80% 이상 증가한 판매량을 달성하며 르노 그룹의 글로벌 실적 상승을 견인했다. 그 중심에 있는 그랑 콜레오스는 올해도 성장세를 이어갈 것으..,,https://www.asiatoday.co.kr/kn/view.php?key=20250227010014329,아시아투데이
"넥스트레이드, 28개 증권사와 함께 출범",https://img.asiatoday.co.kr/file/2025y/02m/26d/20250226010014328_250.jpg,"넥스트레이드가 대체거래소 출범일인 내달 4일부터 28개 증권사가 함께 거래에 참가한다고 26일 밝혔다. 출범일부터 모든 시장 거래에 참가하는 증권사는 총 14개사이며, 교보·대신·미래에셋·삼성·NH투자·LS·유안타·KB·키움·하나·한국투자·한화투자·현대차증권 등이 여기에 해당한다. 또 프리·에프터마켓 등에 우선 참가하고 이후 순차적으로 모든시장 거래에 참가하는 증권사는 14개사로 다올투자·DB금융투자·BNK투자·메리츠·부국·신영·신한투자·IB..",,https://www.asiatoday.co.kr/kn/view.php?key=20250226010014328,아시아투데이
상상 속 '미래형 공장'… 현대차·삼성전자가 함께 만든다,https://img.asiatoday.co.kr/file/2025y/02m/27d/20250227010014327_250.jpg,"현대자동차와 삼성전자가 미래형 공장을 만드는 데 손을 맞잡았다. 양사 협력은 스마트 카·스마트 홈을 넘어 이번엔 스마트 팩토리까지 이어졌다. 모든 로봇과 현장을 지연 없이 일사불란하게 콘트롤, 모니터링 하고 보안까지 챙기면서 작업속도와 생산성을 극대화 할 것으로 보인다. 한때 재계 1위를 두고 경쟁하던 라이벌 관계였지만 미래 모빌리티 시장을 선점하기 위해 협력에 나서면서 어떤 혁신이 가능할 지 관심을 모은다. 26일 현대차는 지난..",,https://www.asiatoday.co.kr/kn/view.php?key=20250227010014327,아시아투데이
"한동훈 '이재명 계엄' 발언에 野 ""인신공격""",https://img.asiatoday.co.kr/file/2025y/02m/26d/20250226010014322_250.jpg,"더불어민주당은 26일 한동훈 전 국민의힘 대표가 이재명 대표의 계엄선포 가능성을 주장한 것과 관련해 ""인신공격""이라고 비판했다.조승래 민주당 수석대변인은 이날 오후 기자들과 만나 ""근거와 팩트(사실)를 가지고 비판해야 한다""며 이 같이 말했다. 한 전 대표는 최근 출간한 책에 ""이 대표가 행정부까지 장악하면 사법부 유죄 판결을 막으려고 계엄이나 처벌 규정 개정 같은 극단적 수단을 쓸 수 있다""고 말했다. 이와 관련해 이 대표는 이날 최고위원회를..",,https://www.asiatoday.co.kr/kn/view.php?key=20250226010014322,아시아투데이
"장현국 ‘원톱’ 체제 굳힌 넥써쓰, 속도전 불 지핀다",https://img.asiatoday.co.kr/file/2025y/02m/26d/20250226001739246_250.jpg,"장현국 대표가 넥써쓰(구 액션스퀘어)의 ‘원톱’ 자리에 오르며, 블록체인 게임 사업에 속도를 낸다.26일 공시에 따르면 넥써쓰는 기존의 김연준·장현국 각자 대표 체제를 종료하고 장현국 대표가 단독으로 경영을 맡는다. 김연준 대표는 기존 게임사업부문에 집중할 계획이다.현재 장현국 대표는 넥써쓰 지분 9.97%(580만6997주)를 보유한 2대 주주다. 10년간 몸담은 위메이드 시절부터 ‘미르4 글로벌’과 ‘나이트 크로우’ 같은 글로벌 히트작을 통..",,https://www.asiatoday.co.kr/kn/view.php?key=20250226001739246,아시아투데이
성균관대 2025학년도 입학식 성료…신입생 4317명,https://img.asiatoday.co.kr/file/2025y/02m/26d/20250226010014291_250.jpg,"성균관대학교는 26일 2025학년도 입학식을 개최했다.성균관대에 따르면 이번 신입생은 4317명이다. 입학식에 앞서 총장과 교무위원들은 서울 종로구 성균관대 인문사회과학캠퍼스에서 고유례(告由禮 : 큰 행사가 있을 때 공자 사당을 찾아 이를 고하는 성균관대학교만의 고유 의식)를 거행하고, 자연과학캠퍼스 수성관으로 이동해 입학식을 진행했다.이날 입학식에서는 성균관대의 상징적인 행사인 '희망 종이비행기 날리기'와 부모가 자녀에게 적은 편지를 보내는..",,https://www.asiatoday.co.kr/kn/view.php?key=20250226010014291,아시아투데이
"코웨이, '서울리빙디자인페어' 참가…비렉스 체험관 운영",https://img.asiatoday.co.kr/file/2025y/02m/26d/20250226010014325_250.jpg,"코웨이는 다음달 2일까지 서울 삼성동 코엑스에서 열리는 '2025 서울리빙디자인페어'에 참가한다고 26일 밝혔다.올해 30회째를 맞는 서울리빙디자인페어는 최신 생활 주거 트렌드와 라이프스타일을 소개하는 국내 최대 규모의 리빙 산업 분야 박람회다.코웨이는 이번 전시에 환경 가전제품을 비롯해 슬립 및 힐링케어 브랜드 '비렉스'의 트리플체어, 등받이 조정 안마베드, 스마트 매트리스 등으로 구성한 대규모 고객 체험관을 마련했다.코웨이 관계자는 ""박람..",,https://www.asiatoday.co.kr/kn/view.php?key=20250226010014325,아시아투데이
"딱 3시간! 레전드 오브 이미르, 희귀 무기 제작 속성 공략",https://img.asiatoday.co.kr/file/2025y/02m/26d/20250226001738116_250.jpg,"MMORPG에서 항상 변치 않는 진리이자, 어린아이도 아는 상식이 있다. 가장 중요한 장비는 무기라는 것이다.'레전드 오브 이미르'에서도 무기의 중요성은 두말할 나위 없다. 레전드 오브 이미르의 필수 장비 희귀 등급 장비를 얻기 위해서는 희귀 무기를 빠르게 갖춰야 하기 때문이다.희귀 장비들은 대체로 검은 발키리, 레이드, 원정 등의 콘텐츠를 통해 얻을 수 있는데, 이 콘텐츠를 진행하기 위해서는 어느 정도의 전투력이 확보되어야 한다. 발할라나 반..",,https://www.asiatoday.co.kr/kn/view.php?key=20250226001738116,아시아투데이
"장신호 서울교대 총장, 서울RISE위원회 위원 위촉",https://img.asiatoday.co.kr/file/2025y/02m/26d/20250226010014274_250.jpg,"서울교육대학교는 지난 24일 장신호 총장이 서울혁신대학지원위원회(서울RISE위원회) 위원으로 위촉됐다고 26일 밝혔다. 서울RISE위원회는 지역혁신중심 대학지원체계를 이끌어가는 최고 기구로, RISE 사업 전반에 대해 논의하고 의결하며 지역발전 선순환 체제 구축을 위한 계획과 성과를 관리한다. RISE 사업은 지역인재 육성을 위한 교육혁신 체계로 올해부터 본격 시행된다. 장 총장은 ""RISE 사업의 성공적인 정착을 위해 맡은 바 소임을 다할..",,https://www.asiatoday.co.kr/kn/view.php?key=20250226010014274,아시아투데이
