title,thumbnail,short_content,write_time,link,company
[인터뷰] K-치안 뜬다…인터폴 아시아위원회 초대위원 된 박재석 총경,https://img.asiatoday.co.kr/file/2025y/10m/12d/20251012010002098_250.jpg,"이제 범죄는 어느 한 국가에서만 발생하지 않는다. 마약부터 피싱, 인신매매 등까지 국경을 뛰어넘는 게 요즘의 추세다. 이른바 '초국경 범죄 시대'다. 당연히 각국의 경찰들은 국제형사경찰기구인 '인터폴'을 통해 대응하고 있다. 인터폴이 유럽에서 시작된 만큼 본부도 프랑스에 있다. 그러나 점차 확대돼 이제는 세계 기구로 발돋움했다. 지난달 설립된 '인터폴 아시아위원회'가 이를 잘 보여준다.인터폴 아시아위원회는 아시아 53개국이 자체적으로 논의할..",,https://www.asiatoday.co.kr/kn/view.php?key=20251012010002098,아시아투데이
'문제 감사' 다시 들추는 감사원…사법부에 가이드라인 제시하나,https://img.asiatoday.co.kr/file/2025y/10m/12d/20251012010002303_250.jpg,16일 국정감사를 앞두고 감사원이 '서해 공무원 피살 사건 은폐·왜곡' 등 지난 정권 감사를 재조사한 사실이 주요 쟁점으로 부상할 전망이다. 특히 정부여당이 문제라고 지목한 '7대 감사'를 그대로 재조사 대상에 포함시키는 등 헌법상 독립기관인 감사원이 '하청' 역할을 하고 있다는 지적이 나온다. 더구나 재판이 진행 중인 사안을 다시 들춰 사법부에 '가이드라인'을 제시하려는 게 아니냐는 비판까지 제기되고 있는 상황이다.12일 아시아투데이 취재를..,,https://www.asiatoday.co.kr/kn/view.php?key=20251012010002303,아시아투데이
"김희상 체제하 ESG 경영 고도화…애큐온저축은행, 실행력·성과 겨냥",https://img.asiatoday.co.kr/file/2025y/10m/12d/20251012010002321_250.jpg,"애큐온저축은행이 김희상 대표 체제에서 ESG(환경·사회·지배구조) 경영을 본격 강화하고 있다. 기존에는 탄소 감축, 정보보호 등 인증 취득 중심으로 기반을 다지는 단계였다면, 김 대표 체제에서는 이를 실제 경영 전략으로 끌어올려 실행력과 성과를 강화하는 모델을 구축하고 있다는 평가다.12일 금융권에 따르면 애큐온저축은행은 지난해부터 ESG 기반 경영을 본격화하고 친환경 경영 확대, 사회적 가치 창출, 투명한 지배구조 확립 등 3대 전략 방향을..",,https://www.asiatoday.co.kr/kn/view.php?key=20251012010002321,아시아투데이
'반도체 힘' 코스피 3600 돌파…AI 훈풍 속 '美 셧다운·보호무역' 변수로,https://img.asiatoday.co.kr/file/2025y/10m/12d/20251012010002294_250.jpg,"코스피가 지난 10일 반도체 대장주의 질주에 힘입어 사상 처음으로 3600을 돌파한 가운데, 국내 증시가 상승세를 이어갈지 기대와 우려가 공존하고 있다. 전문가들은 중장기적으로는 인공지능(AI)발 강세장이 이어질 것으로 보면서도, 반도체주 중심의 급등 피로감과 한미 통상협상 장기화 등 대내외 불확실성으로 인해 증시가 단기 조정을 거칠 수도 있다고 진단했다. 12일 한국거래소에 따르면 코스피는 지난 10일 전 거래일 대비 1.73% 오른 361..",,https://www.asiatoday.co.kr/kn/view.php?key=20251012010002294,아시아투데이
"IBK투자증권, 탄소금융본부 격상…나눔음악회 개최 등 ESG 경영 강화",https://img.asiatoday.co.kr/file/2025y/10m/12d/20251012010002320_250.jpg,"IBK투자증권이 ESG(환경·사회·지배구조) 경영 강화에 속도를 내고 있다. 탄소금융 전담 조직을 본부급으로 확대해 친환경 금융 경쟁력을 높이는 한편, 시각장애 음악인을 위한 나눔음악회를 여는 등 다층적 ESG 행보를 이어가고 있다. 이는 올해 '디지털·ESG 경영 확대를 통한 밸류업(Value-Up) IBKS'를 목표로 경영을 추진 중인 서정학 대표의 전략이 녹아있는 행보다.12일 금융투자업계에 따르면 IBK투자증권은 하반기 조직개편을 통해..",,https://www.asiatoday.co.kr/kn/view.php?key=20251012010002320,아시아투데이
美·中 갈등에 급락한 뉴욕증시…벌벌떠는 코스피,https://img.asiatoday.co.kr/file/2025y/10m/12d/20251012010002346_250.jpg,"도널드 트럼프 미국 대통령이 지난 10일(현지 시간) 중국과의 관세 전쟁 재개를 선언한 데 따라 뉴욕증시에서 하루 만에 약 2조달러(한화 약 2870조원)의 시가총액이 증발한 것으로 나타났다. 재점화된 미·중 무역 갈등에 따라 코스피 역시 오는 13일 장에서 조정받을 가능성이 커졌다.12일 CNBC 등 외신에 따르면 비스코프 투자그룹은 지난 10일(현지시간) 뉴욕증시 벤치마크인 스탠더드앤드푸어스(S&P)500지수가 2.71%, 다우지수..",,https://www.asiatoday.co.kr/kn/view.php?key=20251012010002346,아시아투데이
[알림] 더 깊고 다채로운 시각…아시아투데이 필진 개편,https://img.asiatoday.co.kr/file/2025y/10m/13d/20251013010002359_250.jpg,"올해로 창간 20주년을 맞는 전국 12대 종합일간지 아시아투데이가 새로운 기명컬럼 필진을 모시고 오피니언면을 쇄신합니다. 학계에서 깊이 있는 식견과 내공을 쌓은 필진이 독자들의 세상 보는 눈을 한층 넓혀줄 것입니다. 독자 여러분들의 많은 관심과 성원 바랍니다. (새 필진: 가나다순) 김영한 성균관대학교 경제학과 교수는 서울대 철학과, 미국 인디애나대학 경제학 석·박사 과정을..",,https://www.asiatoday.co.kr/kn/view.php?key=20251013010002359,아시아투데이
"경주 시내버스부터 뉴욕 전광판까지… LG, APEC 홍보 총력",https://img.asiatoday.co.kr/file/2025y/10m/13d/20251013010002358_250.jpg,"LG그룹이 미국 뉴욕과 영국 런던을 비롯해 서울 랜드마크 대형 전광판을 도배하는 것도 부족해, 경주 시내버스 절반에 래핑으로 이달 말 경주에서 열리는 '2025년 아시아태평양경제협력체 정상회의(APEC 2025 KOREA)' 알리기에 그룹 역량을 총동원하고 있다. 단순 후원을 넘어 '민간 외교'가 한창이다. 12일 LG에 따르면 그룹은 지난 8월 말 민간기업 최초로 'APEC 정상회의 준비기획단'과 홍보 협력 양해각서(MOU)를 체결한 이후..",,https://www.asiatoday.co.kr/kn/view.php?key=20251013010002358,아시아투데이
증인석에 조희대 앉히겠다는 與… '최대 격전지'된 법사위,https://img.asiatoday.co.kr/file/2025y/10m/13d/20251013010002357_250.jpg,이재명 정부의 첫 국정감사가 13일 국회에서 막을 올리는 가운데 이번 국감에서 조희대 대법원장이 국감 증인석에 설지 이목이 집중된다. 여당은 삼권분립 원칙을 근거로 관례였던 대법원장의 이석(국감장을 떠나는 것)을 허용하지 않고 조 대법원장의 '대선 개입 의혹'을 집중 추궁하겠다는 방침이다. 법조계에선 헌법이 규정한 삼권분립 구조상 입법기관이 사법부의 핵심 업무인 재판까지 간섭하는 것은 '권력 분립의 본질'..,,https://www.asiatoday.co.kr/kn/view.php?key=20251013010002357,아시아투데이
최태원 'APEC CEO 서밋' 막판 담금질… 韓中협력 새 장 연다,https://img.asiatoday.co.kr/file/2025y/10m/13d/20251013010002356_250.jpg,'민간 외교관' 최태원 대한상공회의소 회장이 'APEC CEO 서밋' 개최를 보름 앞두고 중국을 방문하며 막바지 담금질에 들어갔다. 지난 1년간 글로벌 주요 인사들과 직접 접촉하며 행사를 준비해 온 최 회장은 이번 서밋을 통해 한국 경제의 위상과 민간 외교의 힘을 세계 무대에서 입증하겠다는 각오다. 12일 대한상의에 따르면 최 회장은 지난 10일부터 사흘간 중국 베이징과 상하이를 오가며 APEC 아웃리치를 벌였다. 이..,,https://www.asiatoday.co.kr/kn/view.php?key=20251013010002356,아시아투데이
"수익률 껑충 '액티브 ETF'…""무서운 기세만큼 옥석 가려야""",https://img.asiatoday.co.kr/file/2025y/10m/12d/20251012010002219_250.jpg,"상장지수펀드(ETF) 시장이 250조원 규모로 커지며 '국민 재테크 수단'으로 자리 잡은 가운데, 단순히 시장대표지수를 추종하는 상품을 넘어 다양한 유형에 대한 투자자들의 관심이 커지고 있다. 특히 직접 투자 대비 상대적으로 안정적인 ETF의 특징에 공격적인 운용 방식을 더한 액티브형에 대한 반응이 뜨겁다.2021년 42개에 불과했던 액티브 ETF는 최근 271개까지 늘어났고, 순자산총액 역시 5조원에서 86조원으로 늘었다. 같은 기간 전체..",,https://www.asiatoday.co.kr/kn/view.php?key=20251012010002219,아시아투데이
"""美 당국 승인 받았는데'…셀트리온, 아일리아 시밀러 출시 불투명한 배경은",https://img.asiatoday.co.kr/file/2025y/10m/12d/20251012010002269_250.jpg,"셀트리온이 블록버스터 의약품 '아일리아' 바이오시밀러 '아이덴젤트(CT-P42)'를 앞세워 연 매출 13조원 규모의 시장을 적극 공략한다. 최근 유럽, 호주 등에 이어 세계 최대 시장 미국에서도 안과 질환 치료제 '아일리아'의 바이오시밀러 '아이덴젤트'의 품목허가를 승인받았기 때문이다. 하지만 오리지널 의약품 개발사와의 특허 소송으로 출시일은 불투명하다. 미국이 일찍이 지난해 물질 특허가 만료되면서 아일리아의 바이오시밀러 시장이 열리는 듯했지..",,https://www.asiatoday.co.kr/kn/view.php?key=20251012010002269,아시아투데이
"기업銀, 3분기 순이익 '역대 최대'…비이자이익 급증·NIM 반등 견인",https://img.asiatoday.co.kr/file/2025y/10m/13d/20251013010002355_250.jpg,"IBK기업은행이 역대급 3분기 누적 당기순이익을 기록할 것으로 보인다. 3분기 이자이익과 환평가 손익 감소라는 변수가 존재함에도 불구하고, 비이자이익 성장을 바탕으로 한 상반기 우수한 수익성이 전체 순이익 개선을 이끌었다는 분석이다. 한국은행의 기준금리 인하 시점 조정 가능성이 높아지면서, 순이자마진(NIM) 방어가 예상되는 가운데, 현 정부의 중소기업대출 확대 기조는 기업은행의 강점인 기업대출 자산 성장에 힘이 될..",,https://www.asiatoday.co.kr/kn/view.php?key=20251013010002355,아시아투데이
삼성 '설계사 확대' 한화 'M&A'… 자회사형 GA 키우는 생보사,https://img.asiatoday.co.kr/file/2025y/10m/13d/20251013010002354_250.jpg,"삼성생명과 한화생명이 자회사형 법인보험대리점(GA) 덩치 키우기에 나섰다. 삼성생명은 자회사형GA의 설계사 수를 1년 만에 두 배 이상 늘렸고, 한화생명은 다른 GA 인수로 몸집을 키우고 있다. 자회사형 GA의 경쟁력 확보라는 방향성은 같지만, 구체적인 전략에서는 차이를 보이고 있다는 분석이다.삼성생명은 지난해 '영업통'인 홍원학 사장 취임 이후 GA 설계사 보강을 통해 경쟁력을 확보했다는 평가다. 이어 GA채널에서의..",,https://www.asiatoday.co.kr/kn/view.php?key=20251013010002354,아시아투데이
"“노동자 죽음엔 이유 있다”…환노위, 기업 경영진 '정조준'",https://img.asiatoday.co.kr/file/2025y/10m/12d/20251012010002226_250.jpg,"국회 기후에너지환경노동위원회(환노위)는 올해 국정감사에서 대기업 대표들을 대거 증인으로 불러세우며 노동·환경 분야 핵심 현안을 정조준한다. 중대재해, 환경오염, 고용형태 개선 등 굵직한 쟁점을 둘러싸고 여야가 강도 높은 질의와 책임 추궁을 예고하면서 치열한 공방이 예상된다.국회 환노위에 따르면 오는 30일 열릴 고용노동부 종합감사에서 주우정 현대엔지니어링 대표와 송치영 포스코이앤씨 대표가 증인석에 선다. 두 기업은 건설현장에서 반복되는 산재..",,https://www.asiatoday.co.kr/kn/view.php?key=20251012010002226,아시아투데이
'공룡경찰' 통제·이진숙 체포 논란… 경찰청 국감 '뜨거운 감자',https://img.asiatoday.co.kr/file/2025y/10m/13d/20251013010002353_250.jpg,"경찰청 국정감사에서 '경찰권 통제 방안'이 최대 쟁점이 될 전망이다. 수사와 기소의 완전 분리로 '공룡 경찰'이라는 지적을 받고 있는 상황에서 이진숙 전 방송통신위원장(위원장)에 대한 무리한 체포영장 집행까지 논란이 되고 있기 때문이다. 이에 따라 경찰 견제 장치인 '보완수사권', '전건 송치' 등이 화두가 될 것으로 보인다.국회 행정안전위원회(행안위)는 오는 17일 경찰청 국정감사를 진행한다. 행안위 소속..",,https://www.asiatoday.co.kr/kn/view.php?key=20251013010002353,아시아투데이
기술탈취·해킹 이슈에 경영진 줄소환… 올해도 '기업국감',https://img.asiatoday.co.kr/file/2025y/10m/13d/20251013010002352_250.jpg,"이재명 정부 첫 국회 국정감사가 13일부터 막을 올리며 재계 전반이 긴장하고 있다. 증인·참고인으로 채택된 기업인이 이미 200명에 육박하며 역대 최대 규모를 넘어섰으며, 주요 그룹 총수들까지 대거 소환되면서 경영 부담이 커지고 있다는 우려도 제기된다. 12일 재계에 따르면 13일부터 다음 달 6일까지 17개 상임위원회가 총 834개 기관을 대상으로 진행하는 이번 국감은 산업재해·환경오염, 기술 탈취, 계열사 부당지원..",,https://www.asiatoday.co.kr/kn/view.php?key=20251013010002352,아시아투데이
"소 잃고 외양간 고치나…경찰청, 캄보디아 범죄에 '합동 작전' 추진",https://img.asiatoday.co.kr/file/2025y/10m/12d/20251012010002325_250.jpg,"경찰청이 캄보디아 납치·감금 사태에 대한 '국제 합동 작전'을 추진한다. 경북 예천의 20대 대학생 박모씨가 숨진 뒤 내놓은 대책이다. 그러나 이 사태는 박씨뿐만 아니라 지난해부터 심각했기에 '소 잃고 외양간 고치려는 격'이라는 비판이 나온다.경찰청은 오는 20일부터 23일까지 개최하는 국제경찰청장회의에서 '캄보디아 납치 범죄'의 심각성을 공유할 것이라고 12일 밝혔다. 이 자리엔 국제형사경찰기구인 인터폴을 비롯해 지역경찰협력체인 유로폴, 아..",,https://www.asiatoday.co.kr/kn/view.php?key=20251012010002325,아시아투데이
"""오늘의 혁신, 내일의 도약""… 최태원이 제시하는 AI 생태계",https://img.asiatoday.co.kr/file/2025y/10m/13d/20251013010002350_250.jpg,"SK그룹이 오는 11월 국내 최대 규모의 AI 서밋, 'SK AI Summit 2025'를 개최하며 글로벌 AI 생태계와 협력 확대에 나선다. 이번 행사는 SK가 추진 중인 자국 산업 맞춤형 '제조 AI' 전략과 데이터·기술 주권 확보, 글로벌 빅테크와의 협력을 통한 AI 사업 확장의 성과를 점검하고 향후 협력 방안을 모색하는 자리가 될 전망이다. 최태원 SK그룹 회장은 앞서 제조업에 AI를 접목해 우리나라만의 AI..",,https://www.asiatoday.co.kr/kn/view.php?key=20251013010002350,아시아투데이
여야 '김현지 증인채택' 두고 거세지는 공방,https://img.asiatoday.co.kr/file/2025y/10m/13d/20251013010002349_250.jpg,"이재명 정부의 첫 국정감사를 하루 앞두고 여야는 김현지 대통령실 제1부속실장<사진>의 증인 채택 문제를 놓고 대치를 이어갔다. 국민의힘은 김 실장의 보직 이동을 '국감 회피용 방탄 인사'로 규정하며 정부·여당의 행태를 '명백한 내로남불'이라고 공세를 폈고, 이에 더불어민주당은 ""전 정부의 국정농단 의혹을 덮기 위한 불순한 정치공세""라고 맞섰다.국민의힘은 인사가 국회 출석을 회피하기 위한 '꼼수'라..",,https://www.asiatoday.co.kr/kn/view.php?key=20251013010002349,아시아투데이
'전산망 마비·비상계엄' 최대 쟁점… 전·현정부 책임 공방 예고,https://img.asiatoday.co.kr/file/2025y/10m/13d/20251013010002348_250.jpg,이재명 정부 첫 국정감사가 13일부터 약 3주간의 일정으로 본격 개막한다. 행정안전부 국감을 시작으로 각 상임위별 감사가 이어지는 가운데 '국가정보자원관리원 화재에 따른 전산망 마비'와 '12·3비상계엄 기록물 논란'이 최대 쟁점으로 부상했다. 여야가 각각 '전 정부 책임론'과 '현 정부 무능론'을 내세운 여론전에 나서는 등 최대 관전 포인트는 '책임 공방'이 될 전망이다.12일 정치권에 따르면 이번 국감에..,,https://www.asiatoday.co.kr/kn/view.php?key=20251013010002348,아시아투데이
'요가대회·라인댄스·음악회' 가을철 지리산 화엄사 장식,https://img.asiatoday.co.kr/file/2025y/10m/12d/20251012010002347_250.jpg,추석 연휴 지리산 화엄사에서는 다양한 볼거리가 펼쳐졌다. 1년에 단 몇 시간만 볼 수 있는 국보 화엄사 영산회 괘불탱화 아래서 요가대회·라인댄스 공연·음악회 등이 진행됐으며 화엄사를 지켜낸 고(故) 차일혁(1920-1958) 경무관 67주기 추모제 또한 봉행됐다.대한불교조계종 19교구본사 화엄사는 지난 10일부터 12일까지 '바람이 물을 스칠 때'이라는 주제로 2025년 제21회 화엄문화제를 성대하게 치렀다고 밝혔다.화엄문화제 첫날인 10일..,,https://www.asiatoday.co.kr/kn/view.php?key=20251012010002347,아시아투데이
치킨게임에 미중 APEC 정상회담 무산 위기,https://img.asiatoday.co.kr/file/2025y/10m/12d/20251012010002345_250.jpg,미국과 중국의 관세전쟁 치킨게임에 이달 말 경주에서의 아시아태평양경제협력체(APEC) 정상회의를 계기로 열릴 예정이었던 미중 정상회담이 무산될 위기에 직면하고 있다. 현재 분위기로 보면 무산 가능성이 높으나 막판에 극적으로 열릴 수도 있을 것으로 보인다. 양국 관계에 밝은 베이징 외교 소식통들의 12일 전언에 따르면 약 20여 일 앞으로 다가온 정상회담에 임하는 양국의 그동안의 행보는 상당히 긍정적이었다고 해도 좋았다. 외신 일각에서 양국의..,,https://www.asiatoday.co.kr/kn/view.php?key=20251012010002345,아시아투데이
"현대차그룹, 싱가포르 과학청·공대 손잡고 '기업연구소' 설립… ""제조혁신 시험장""",https://img.asiatoday.co.kr/file/2025y/10m/12d/20251012010002257_250.jpg,"현대자동차그룹이 제조혁신 글로벌 거점인 싱가포르에 현지 대학과 정부 연구기관이 참여하는 공동 기업연구소를 설립했다. 현대차그룹은 연구소 설립을 통해 차세대 제조기술을 실증하고 '미래형 생산 체계' 구축에 속도를 낼 계획이다.12일 현대차그룹은 싱가포르 글로벌 혁신센터(HMGICS)에 싱가포르 난양공대(NTU), 싱가포르 과학기술청(A*STAR)과 함께 '현대차그룹-NTU-A*STAR 기업연구소'를 공식 개소했다고 밝혔다. 지난해 10월 '한국..",,https://www.asiatoday.co.kr/kn/view.php?key=20251012010002257,아시아투데이
"""멈추지 않는 '나눔'""…노스페이스, 사회공헌 10주년 기념 행사 개최",https://img.asiatoday.co.kr/file/2025y/10m/12d/20251012010002341_250.jpg,"영원아웃도어의 글로벌 아웃도어 브랜드 노스페이스는 올해로 10주년을 맞은 사회공헌 프로젝트 '노스페이스 에디션'의 기념행사를 오는 14일까지 서울 영등포 타임스퀘어 1층 아트리움에서 진행한다고 12일 밝혔다.이번 행사는 지난 10년간 소비자들의 착한 소비가 만들어온 나눔의 성과를 되돌아보고, 브랜드 슬로건인 '멈추지 않는 탐험'을 사회적 가치 실현으로 확장한다는 의미를 담았다.2015년부터 시작된 '노스페이스 에디션'은 제품 구매 시 수익금..",,https://www.asiatoday.co.kr/kn/view.php?key=20251012010002341,아시아투데이
"아프간 탈레반 ""파키스탄군 58명 사살…국경 침범 보복""",https://img.asiatoday.co.kr/file/2025y/10m/12d/20251012010002338_250.jpg,아프가니스탄 측이 국경을 맞대고 있는 파키스탄의 군인 58명을 사살했다고 12일(현지시간) 밝혔다. 자국 영토와 영공이 반복적으로 침범당했다는 명분을 내세워 밤새 이같은 작전을 실행했다는 입장이다.아프간을 점령하고 있는 이슬람 무장조직 탈레반은 파키스탄군이 최근 수도 카불과 동부의 시장을 폭격했다고 비난했다. 파키스탄 측은 이에 대한 책임을 인정하지 않았다.AP통신에 따르면 자비훌라 무자히드 탈레반 대변인은 12일 카불에서 열린 기자회견을 통..,,https://www.asiatoday.co.kr/kn/view.php?key=20251012010002338,아시아투데이
금융권 국감 롯데카드 해킹·MBK 책임론 화력집중…김병주·조좌진 등 소환,https://img.asiatoday.co.kr/file/2025y/10m/12d/20251012010002307_250.jpg,"국회 정무위원회의 국정감사가 오는 14일부터 본격 시작되면서 금융권이 촉각을 곤두세우고 있다. 국감 증인 명단에 금융지주 회장과 주요 은행장은 빠졌지만 김용범 메리츠금융지주 부회장, 조좌진 롯데카드 대표이사 등 2금융권 인사들이 이름을 올렸다. 올해 금융권 국감에서는 대규모 해킹 사태와 내부통제, 부동산 프로젝트파이낸싱(PF) 등이 주요 쟁점으로 떠오를 전망이다.12일 금융권에 따르면 정무위는 오는 14일 개인정보보호위원회·공정거래위원회 대상..",,https://www.asiatoday.co.kr/kn/view.php?key=20251012010002307,아시아투데이
'세기의 이혼' 최태원·노소영 16일 결론…'노태우 비자금' 관건,https://img.asiatoday.co.kr/file/2025y/10m/12d/20251012010002317_250.jpg,"최태원 SK그룹 회장과 노소영 아트센터 나비 관장의 '세기의 이혼' 소송 최종 결론이 오는 16일 나온다. 최대 쟁점은 최 회장이 보유한 SK㈜ 주식이 재산 분할 대상에 포함되느냐다. 즉 노 관장의 부친인 고(故) 노태우 전 대통령의 '300억 비자금'이 선경(현SK)으로 흘러들어간 사실을 대법원이 인정하느냐에 달렸다.다만 노 관장이 재산분할에서 유리한 고지를 점하기 위해 '노태우 비자금 카드'를 꺼내든 걸 두고, 본래 국가에 환수됐어야 할..",,https://www.asiatoday.co.kr/kn/view.php?key=20251012010002317,아시아투데이
시드니 도심 3만 명 운집…팔레스타인 연대 물결,https://img.asiatoday.co.kr/file/2025y/10m/12d/20251012010002337_250.jpg,"이스라엘과 하마스 간 가자지구 휴전이 발효된 가운데, 시드니를 비롯한 호주 주요 도시에서 팔레스타인 지지 시위가 이어졌다고 로이터통신이 12일(현지시간) 보도했다. 참가자들은 ""이번 휴전은 오래가지 않을 것""이라며 이스라엘의 점령 정책과 호주 정부의 소극적인 대응을 비판했다.로이터통신에 따르면 '팔레스타인 행동그룹'은 이날 시드니 도심에서 열린 집회에 약 3만명이 참여했다고 밝혔다. 이는 이날 호주 전역 27곳에서 동시에 열린 시위 중 최대..",,https://www.asiatoday.co.kr/kn/view.php?key=20251012010002337,아시아투데이
美 온라인 시장서 중국산 전자기기 대거 퇴출…FCC ‘보안 미인증 제품 정리',https://img.asiatoday.co.kr/file/2025y/10m/12d/20251012010002335_250.jpg,"미국 연방통신위원회 (FCC) 브렌던 카 위원장은 미국 주요 온라인 웹사이트들이 금지된 중국산 전자 제품 수백만 개를 판매 목록에서 삭제했다고 10일(현지시간) 밝혔다.카 위원장은 화웨이와 ZTE를 포함한 회사들의 보안 카메라와 전화 등, 미국 금지 장비 목록에 있거나 기관의 승인을 받지 않은 품목들은 더 이상 판매할 수 없다고 밝혔다고 로이터 통신이 보도했다.문제가 된 제품들은 주로 스마트워치, 무선 이어폰, 홈 CCTV·보안 카메라 등 무..",,https://www.asiatoday.co.kr/kn/view.php?key=20251012010002335,아시아투데이
李대통령 “여야 구분 없이 국정감사 적극 협조하라”,https://img.asiatoday.co.kr/file/2025y/10m/12d/20251012010002334_250.jpg,"이재명 대통령은 12일 정부 전 부처에 여야 구분 없이 국회 국정감사에 적극 협조할 것을 지시했다. 그동안 '선출 권력'에 대한 존중을 강조해 온 이재명 대통령이 취임 이후 첫 국정감사를 하루 앞두고 국회에 대한 존중을 재차 강조한 셈이다.이 대통령은 이날 ""시정 가능한 것은 즉시 조치하는 등 여야를 막론하고 국회의 지적을 적극 수용하라""고 당부했다고 대변인실이 문자 알림을 통해 전했다.이 대통령은 이어 ""타당한 지적이 있었음에도 이유 없이..",,https://www.asiatoday.co.kr/kn/view.php?key=20251012010002334,아시아투데이
