title,thumbnail,short_content,write_time,link,company
"안병훈, 베이커런트 클래식 공동 4위…김시우·임성재 공동 20위",https://img.asiatoday.co.kr/file/2025y/10m/12d/20251012010002332_250.jpg,안병훈이 미국프로골프(PGA) 투어 베이커런트 클래식(총상금 800만달러)에서 공동 4위에 올랐다.안병훈은 12일 일본 요코하마의 요코하마 컨트리클럽(파71·7315야드)에서 열린 대회 최종 4라운드에서 5언더파 66타를 쳐 최종 합계 14언더파 270타를 적어냈다. 가나야 다쿠미(일본) 등과 공동 4위를 기록한 안병훈은 이로써 지난 6월 RBC 캐나다오픈의 공동 6위를 뛰어넘는 올해 최고 성적을 거뒀다.이 대회 전까지 페덱스컵 포인트 78..,,https://www.asiatoday.co.kr/kn/view.php?key=20251012010002332,아시아투데이
"구윤철, G20서 관세협상 '접점' 찾을까…통화스와프 촉각",https://img.asiatoday.co.kr/file/2025y/10m/12d/20251012010002327_250.jpg,구윤철 경제부총리 겸 기획재정부 장관이 주요 20개국(G20) 경제컨트롤 타워가 모이는 국제무대에서 한미 관세협상 타개책을 마련할지 주목된다. 총회 기간 스콧 베선트 미국 재무장관과 양자 회담이 열릴 것이란 전망 속에 관세 협상 교착을 풀 수 있는 합의안이 논의될 수 있을지도 관심이 쏠린다.12일 기재부와 통상 당국 등에 따르면 구 부총리는 오는 15일 미국 워싱턴 DC에서 열리는 G20 재무장관회의와 국제통화기금(IMF) 연차총회 참석을 위..,,https://www.asiatoday.co.kr/kn/view.php?key=20251012010002327,아시아투데이
"현대건설, 31조 수주 향해 ""주택사업 새 판 짜기""…'포스트 신축' 전략 가속",https://img.asiatoday.co.kr/file/2025y/10m/12d/20251012010002141_250.jpg,현대건설이 핵심 사업인 주택 부문의 패러다임 전환에 속도를 내고 있다. 단순히 도급공사 중심의 '짓는 회사'에서 벗어나 아파트 노후화 이후까지 책임지는 '케어형 건설사'로 도약하겠다는 구상이다. 주택사업 전 과정을 아우르는 종합적 역량을 확보해 올해 목표인 31조원 규모의 연간 수주 달성에도 박차를 가한다. 최근 주택시장은 불확실성이 커지며 '아파트를 잘 짓는 것'만으로는 경쟁사들과의 출혈경쟁을 피하기 어려운 만큼 '포스트 신축 아파트' 전략..,,https://www.asiatoday.co.kr/kn/view.php?key=20251012010002141,아시아투데이
"순차입금비율 '본궤도' 진입…금호건설, 부채비율 낮추기에 화력 집중",https://img.asiatoday.co.kr/file/2025y/09m/28d/20250928010015204_250.jpg,"금호건설이 부채비율을 개선하기 위해 자산매각, 무상감자, 채무의 출자전환 등에 집중하기로 했다. 특히 흑자전환 기조를 유지하고 있는 만큼 부채비율 개선에 탄력이 붙을 것으로 기대하고 있다. 12일 업계에 따르면 금호건설은 유동성을 개선하기 위해 오는 15일 부동산투자회사(리츠) 지분을 기초자산으로 한 주가수익스왑(PRS) 계약을 통해 420억원의 유동성을 확보할 계획이다. 계약기간은 44개월이다.회사는 대한제16호고덕어울림뉴스테이위탁관리부동산..",,https://www.asiatoday.co.kr/kn/view.php?key=20250928010015204,아시아투데이
"""드디어 국내 상륙""…동원F&B, 日 마루하니치로 손잡고 신제품 공개",https://img.asiatoday.co.kr/file/2025y/10m/12d/20251012010002326_250.jpg,동원F&B가 일본 기업과 공동 개발한 간편식 제품을 한국에서도 선보인다.동원F&B는 일본의 수산 가공식품 1위 기업 '마루하니치로'와 공동 개발한 '와일디시(WILDish) 고추참치볶음밥'을 출시했다고 12일 밝혔다.이번 신제품은 동원F&B의 '동원 고추참치'와 마루하니치로의 볶음밥 브랜드 '와일디시'를 결합한 제품이다. 동원 고추참치 특유의 매콤함과 참치 살코기를 비롯한 다양한 재료를 200℃로 볶아 불맛을 살린 것이..,,https://www.asiatoday.co.kr/kn/view.php?key=20251012010002326,아시아투데이
연휴 끝 고위당정협의회 개최…민생·개혁 과제에 초점,https://img.asiatoday.co.kr/file/2025y/10m/12d/20251012010002316_250.jpg,"추석 연휴가 끝난 후 12일 당정대(더불어민주당·정부·대통령실) 고위급 인사들이 한자리에 모여 현안 및 향후 국정과제 실행 방향을 두고 의견을 나눴다.국무총리실에 따르면, 정청래 민주당 대표와 김병기 원내대표, 김민석 국무총리, 강훈식 대통령 비서실장 등은 이날 오후 4시 서울 종로구 총리 공관에서 비공개 고위당정협의회를 열었다.이번 협의회에선 최근 서울을 중심으로 주택 가격이 과열되는 양상을 보이는 가운데 정부가 검토 중인 것으로 알려진 '..",,https://www.asiatoday.co.kr/kn/view.php?key=20251012010002316,아시아투데이
"적립금·쿠폰 '펑펑'…hy, 정기구독 혜택 확대",https://img.asiatoday.co.kr/file/2025y/10m/12d/20251012010001096_250.jpg,"hy가 정기구독 이용자를 위해 10월 한 달간 특별 혜택을 마련했다.12일 hy에 따르면 정기구독 고객은 지급받은 페이백 쿠폰을 사용하면 hy 인기 제품 무료 교환권과 할인쿠폰을 동시에 받을 수 있다. 1차부터 3차까지 차수별로 진행되며 하루야채 프로틴, 야쿠르트 XO, 헬리코박터 프로젝트 윌 3종이 순차 증정된다.프레딧 만보기 연동자에게는 적립금을 평소보다 두 배로 제공한다. 프레딧 만보기는 걸음 수를 적립금으로 전환해주는 서비스로 적립금은..",,https://www.asiatoday.co.kr/kn/view.php?key=20251012010001096,아시아투데이
의정갈등 봉합 후 첫 국감…'수련환경·공공의대' 도마 오른다,https://img.asiatoday.co.kr/file/2025y/10m/12d/20251012010002223_250.jpg,"의정갈등 봉합 이후 첫 국정감사가 다가오는 가운데, 전공의 수련환경에 대한 논의와 의료정책에 대한 현장의 목소리가 주요 어젠다로 꼽히고 있다. 1년 반 만에 병원으로 복귀한 전공의들이 수련환경 개선을 요구하는 한편, 지역의사제·공공의대 정책에 대한 의료계의 반발이 이어지는 만큼 이번 국감에서 의정갈등의 후속 문제를 다룰 것으로 보인다.12일 의료계에 따르면 오는 14일 보건복지부와 질병관리청을 시작으로 오는 30일 종합감사까지 19일 동안 진..",,https://www.asiatoday.co.kr/kn/view.php?key=20251012010002223,아시아투데이
"가스안전공사, 안전경영 강화…""안심되는 작업현장 조성""",https://img.asiatoday.co.kr/file/2025y/10m/12d/20251012010002246_250.jpg,"정부가 올해 공공기관 경영평가부터 안전관리 부문을 강화하는 가운데, 한국가스안전공사가 안전경영에 나서고 있다. 중소 수급업체의 한계를 보완하기 위해 추진계획을 마련하는 한편, 내부 직원 대상 건강증진 프로그램 등을 운영하고 있다.12일 업계에 따르면 최근 가스안전공사는 협력업체를 위한 '수급업체 인프라 지원 중점강화 추진계획'을 마련했다. 계약 전 단계부터 용역 수행 단계까지 모든 현장의 안전한 환경을 확보하기 위한 것이다. 박경국 사장은 ""..",,https://www.asiatoday.co.kr/kn/view.php?key=20251012010002246,아시아투데이
"홍정민, 시즌 3승째 다승 공동 선두…상금 단독 선두 도약",https://img.asiatoday.co.kr/file/2025y/10m/12d/20251012010002311_250.jpg,"홍정민이 한국여자프로골프(KLPGA) 투어 K-푸드 놀부·화미 마스터즈(총상금 12억원)에서 우승하며 다승 공동 선두, 상금 단독 선두로 뛰어올랐다.홍정민은 12일 경기도 용인 88컨트리클럽(파72·6748야드)에서 열린 대회 최종 3라운드에서 3언더파 69타를 쳐 최종 합계 12언더파 204타로 2위 서교림을 한 타 차로 제치고 우승했다.시즌 3번째 우승을 거둔 홍정민은 이예원, 방신실과 함께 시즌 다승 공동 선두에 올랐다. 홍정민은 지난..",,https://www.asiatoday.co.kr/kn/view.php?key=20251012010002311,아시아투데이
막 오른 2025 국정감사…'산업재해 지뢰밭' 건설업계 대표 '덜덜',https://img.asiatoday.co.kr/file/2025y/10m/12d/20251012010002183_250.jpg,"13일부터 시작되는 새 정부 첫 국정감사에 주요 건설사 대표이사들이 대거 증인으로 소환된다. 최근 건설현장에서 산업재해와 부실시공 등 안전 문제가 잇따르면서 여야 의원들의 질의가 집중될 전망이다. 특히 이재명 대통령이 취임 이후 산업안전 문제를 지속적으로 강조해온 만큼, 이번 국감은 건설업계에 이른바 '산재 청문회'로 불릴 가능성이 크다.12일 건설업계에 따르면 13일 열리는 국토교통위원회 국정감사에는 국토교통부 시공능력평가 상위 10위 건설..",,https://www.asiatoday.co.kr/kn/view.php?key=20251012010002183,아시아투데이
美 캘리포니아 헌팅턴비치서 헬기 추락…탑승자 등 5명 부상,https://img.asiatoday.co.kr/file/2025y/10m/12d/20251012010002309_250.jpg,"미국 캘리포니아주(州) 오렌지 카운티에 있는 헌팅턴비치에서 11일(현지시간) 헬리콥터가 추락해 지상에 있던 사람 3명을 포함한 5명이 부상을 입어 병원에 입원했다.이날 뉴욕타임스(NYT), USA투데이 등에 따르면 헌팅턴비치 경찰서(HBPD)는 소셜미디어를 통해 같은 날 오후 2시경 한 호텔 주차장에 헬기 1대가 추락하면서 건물 일부와 야자수가 파손됐다.구조 당국은 탑승자 2명을 안전하게 구조해 인근 병원으로 후송했다. 다만 부상자들의 상태와..",,https://www.asiatoday.co.kr/kn/view.php?key=20251012010002309,아시아투데이
"법원 ""나눔의집 후원금 후원자에게 돌려줘야""…파기환송심 종결",https://img.asiatoday.co.kr/file/2025y/10m/12d/20251012010002285_250.jpg,위안부 피해자 지원시설인 '나눔의집'이 후원자에게 후원금을 돌려줘야 한다는 파기환송심 판결이 나왔다.12일 법조계에 따르면 서울중앙지법 민사항소9-2부(변지영 윤재남 노진영 부장판사)는 지난달 24일 후원자 이모씨가 나눔의집을 상대로 낸 후원금 반환 청구소송 파기환송심에서 원고 일부승소로 판결했다. 지난해 대법원이 2심을 취소하고 돌려보낸 데 따른 판결이다.파기환송심 재판부는 나눔의집이 이씨에게 155만원과 지연손해금을 지급하라고 결정했다.재..,,https://www.asiatoday.co.kr/kn/view.php?key=20251012010002285,아시아투데이
"주진우 “李, 80일 만의 캄보디아 뒷북 지시…중국인 범죄와 전면전 벌여야”",https://img.asiatoday.co.kr/file/2025y/10m/12d/20251012010002299_250.jpg,"주진우 국민의힘 의원이 12일 캄보디아에서 발생한 한국인 대상 살해 사건과 관련해 ""이재명 대통령의 외교부 지시는 사건 발생 80일 만의 뒷북""이라고 강하게 비판했다.주 의원은 이날 오후 자신의 페이스북에 ""(이 대통령의 지시는) 반쪽짜리 지시다. 핵심은 '국내 중국인 범죄'다. 우리 국민이 납치·살해된 후 캄보디아가 범인 잡으면 무슨 소용인가""라며 이같이 밝혔다.그러면서 ""올해 캄보디아에서 실종된 우리 국민이 330명에 달한다""며 ""이들 대..",,https://www.asiatoday.co.kr/kn/view.php?key=20251012010002299,아시아투데이
모태펀드 73.8%·정책자금 43.1%·청창사 입학생 66.4% 수도권 집중,,"최근 5년간 모태펀드 투자액의 73.8%, 정책자금의 43.1%, 청년창업사관학교 입학생의 66.4% 가 수도권에 집중된 것으로 나타나 중소기업에 대한 투자·정책자금·창업 교육 기회의 편중이 심화되고 있는 것으로 드러났다.12일 국회 산업통상자원중소벤처기업위원회 소속 더불어민주당 오세희 의원이 중소벤처기업부 자료를 분석한 결과 최근 5 년간 모태펀드 투자액의 73.8%, 정책자금 집행액(시도 평균)은 수도권이 지방보다 3.5배 많았으며 청년창..",,https://www.asiatoday.co.kr/kn/view.php?key=20251012010002298,아시아투데이
국힘 “민중기 특검이 국민을 죽음으로 몰아”…‘폭력수사 특검법’ 발의 예고,https://img.asiatoday.co.kr/file/2025y/10m/12d/20251012010002291_250.jpg,"국민의힘이 12일 이재명 정부의 첫 국정감사를 하루 앞두고, 경기 양평군 공무원 A씨의 극단적 선택을 계기로 민중기 특별검사팀을 강하게 비판했다. 당은 '특검의 폭력적 수사가 한 시민을 죽음으로 몰았다'며 이른바 '폭력수사 특검법'을 발의에 나서겠다는 방침을 밝혔다. 송언석 원내대표는 이날 오후 국회에서 기자간담회를 열고 ""여야 합의를 파기하고 더 센 특검법을 밀어붙인 끝에 탄생한 괴물특검이 국가의 보호를 받아야 할 국민에게 오히려 폭력을 행..",,https://www.asiatoday.co.kr/kn/view.php?key=20251012010002291,아시아투데이
'불탄 행정망' 국회로 번졌다…행안부 지휘라인 도마위,https://img.asiatoday.co.kr/file/2025y/10m/12d/20251012010002282_250.jpg,"국가 시스템이 멈춘 충격이 '국정감사'로 번지고 있다. 행정안전부(행안부) 지휘라인과 민간 협력업체가 줄줄이 증인석에 서고 정부의 디지털 재난 대응 체계 전반이 정밀 검증 대상이 된다. 초기 대응 실패, 민관 협업 붕괴, 재난대응 허점까지 총체적 부실이 드러나면서 국정감사가 사실상 '국가망 국감'으로 흘러가고 있다.12일 국회 행정안전위원회(행안위)는 14일 행안부 대상으로 국정감사를 진행한다. 올해 행안부 국감에는 지난달 26일 국가정보자원..",,https://www.asiatoday.co.kr/kn/view.php?key=20251012010002282,아시아투데이
"엽서 쓰고 색도 찾고…롯데免, 외국인 고객 맞춤 체험 강화",https://img.asiatoday.co.kr/file/2025y/10m/12d/20251012010002244_250.jpg,롯데면세점이 외국인 관광객을 겨냥한 체험형 콘텐츠를 확대한다.롯데면세점은 서울 명동본점 12층에 '베러 메모리즈 포스트(Better Memories Post)' 이벤트 존을 마련해 운영한다고 12일 밝혔다. 외국인 고객이 비치된 엽서를 직접 작성해 현장에 설치된 빨간 우체통에 넣으면 롯데면세점이 해당 국가로 무료로 발송한다.이벤트 존에 비치된 엽서는 총 4종이다. 전통 한복에 현대적인 요소를 결합한 콘셉트와 한국의 대표 랜드마크를 전통 자개..,,https://www.asiatoday.co.kr/kn/view.php?key=20251012010002244,아시아투데이
"이스라엘체조연맹 ""인니의 출전 금지 조치, 국제 스포츠 정신 훼손"" 항의",https://img.asiatoday.co.kr/file/2025y/10m/12d/20251012010002258_250.jpg,"인도네시아 정부가 이스라엘 선수단의 입국을 불허하면서 세계 기계체조 선수권 대회 출전이 무산되자, 이스라엘체조연맹이 ""부당한 결정""이라며 강하게 반발했다. 연맹은 국제스포츠중재재판소(CAS)에 긴급 항소를 제기하고 선수단 출전 허가를 요구하고 나섰다.인도네시아 정부는 가자지구 전쟁을 둘러싼 반(反)이스라엘 여론이 확산하는 가운데, 오는 19일 자카르타에서 개막하는 세계 기계체조 선수권 대회에 출전 예정이던 이스라엘 선수들의 비자를 발급하지 않..",,https://www.asiatoday.co.kr/kn/view.php?key=20251012010002258,아시아투데이
"에스원, '호텔 특화 통합 보안 솔루션' 보안 사각지대 해결",https://img.asiatoday.co.kr/file/2025y/09m/14d/20250914010007376_250.jpg,"에스원이 호텔 특화 통합 보안 솔루션으로 호텔 보안 사각지대 해소에 적극 나서고 있다. 12일 에스원에 따르면 호텔업계 인력 부족으로 보안 관리 공백이 심화된 것으로 나타났다. 올해 4월 기준 숙박업 인력 부족률은 3.6%로 전체 산업 중 2위를 차지했다. 1위는 운수·창고업(4.5%), 2위는 숙박·음식점업(3.6%), 3위는 협회·단체·수리·기타 개인 서비스업(3.3%)으로 전체 산업 중 2위를 차지했다.호텔 보안은 24시간 운영 특성상..",,https://www.asiatoday.co.kr/kn/view.php?key=20250914010007376,아시아투데이
"LG전자, 향균 신소재 B2B 본격화…'퓨로텍' 글로벌 무대 진격",https://img.asiatoday.co.kr/file/2025y/10m/12d/20251012010002216_250.jpg,LG전자가 향균 기능성 신소재 '퓨로텍(PuroTec™)'을 앞세워 글로벌 B2B 시장 공략에 본격 나섰다. 가전·TV 등 기존 소비자 중심 사업의 성장성이 한계에 부딪힌 상황에서 고부가가치 소재를 기반으로 한 글로벌 공급망 경쟁에 뛰어들며 새로운 성장 동력을 확보하려는 전략이다.12일 LG전자는 지난 8일(현지시간) 노르트라인베스트팔렌주 뒤셀도르프에서 열린 세계 3대 플라스틱 소재 전시회 'K 2025'에서 퓨로텍을 유럽 시장에 처음으로 선..,,https://www.asiatoday.co.kr/kn/view.php?key=20251012010002216,아시아투데이
"'연휴 끝' 李, 국정자원 복구·관세협상·APEC 과제 수두룩",https://img.asiatoday.co.kr/file/2025y/10m/12d/20251012010002241_250.jpg,이재명 대통령이 긴 추석 연휴 이후 산적한 국정 현안들을 어떻게 풀어갈지 주목된다. 지난달 26일 발생한 국가정보자원관리원 화재 복구와 재발 방지 대책 마련은 아직 완료되지 않았고 대미 관세협상과 관련한 가시적인 진전이 있는 상황도 아니다. 막바지 담금질을 하고 있는 아시아태평양경제협력체(APEC) 정상회의는 미중 간 무역전쟁이 재점화될 조짐이 보이고 있어 이와 관련한 여파가 미칠 수 있다는 우려의 목소리가 나온다.이 대통령은 추석 연휴 기간..,,https://www.asiatoday.co.kr/kn/view.php?key=20251012010002241,아시아투데이
멕시코 집중호우로 홍수·산사태…최소 41명 사망,https://img.asiatoday.co.kr/file/2025y/10m/12d/20251012010002239_250.jpg,"멕시코 중부와 남동부에서 지난 9~10일(현지시간) 집중호우가 내리면서 발생한 홍수와 산사태로 인해 최소 41명이 목숨을 잃고 주민 다수가 실종됐다.11일 AP 통신, BBC 등에 따르면 멕시코 국가민방위조정본부는 이번 폭우로 가장 큰 피해를 입은 동부 이달고주(州)에서 16명이 사망한 것으로 보고됐다고 밝혔다.비로 인해 강둑이 무너지면서 거리가 물에 잠겼고 주택 수천채가 파손됐다. 도로는 잔해로 막혔고 전기 공급도 끊겼다.중동부 푸에블라주에..",,https://www.asiatoday.co.kr/kn/view.php?key=20251012010002239,아시아투데이
"준PO 3차전, SSG 앤더슨-삼성 원태인 선발 맞대결",https://img.asiatoday.co.kr/file/2025y/10m/12d/20251012010002224_250.jpg,"2025 프로야구 준플레이오프(준PO·5전 3승제) 3차전에서 SSG 랜더스의 드루 앤더슨과 삼성 라이온즈의 원태인이 선발 맞대결을 펼친다. 1승 1패로 맞선 두 팀에게는 이번 경기가 플레이오프 진출에 있어 중요한 분수령이 될 전망이다.SSG의 앤더슨은 13일 대구 삼성라이온즈파크에서 열리는 준PO 3차전에서 원정 선발승에 도전한다. 앤더슨은 올 시즌 정규리그 30경기에서 12승 7패, 평균자책점 2.25를 기록한 특급 에이스다. 특히 탈삼..",,https://www.asiatoday.co.kr/kn/view.php?key=20251012010002224,아시아투데이
"26년 연정 균열, 일본 정치의 ‘전후 체제’가 흔들린다",https://img.asiatoday.co.kr/file/2025y/10m/12d/20251012010001987_250.jpg,"일본의 자민·공명 연정 체제가 26년 만에 붕괴의 기로에 섰다. 1999년 이후 일본 정치는 자민당(自由民主, LDP)과 공명당(公明, Komeito)의 긴밀한 연립체제로 안정 구조를 유지해 왔다. 그러나 2025년 10월 그 '안정의 축'이 근본부터 흔들리고 있다. 정치자금 규제를 둘러싼 충돌이 표면화하면서 연립 균열 조짐이 현실화한 것이다. 일본 정치의 전후(戰後) 질서가 재편의 문턱에 선 셈이다.갈등의 발단은 '후원금 규제 강화 문제'다..",,https://www.asiatoday.co.kr/kn/view.php?key=20251012010001987,아시아투데이
"'검찰청 폐지' 이룬 민주당, 사법개혁 본격 시동…대법관 증원 핵심",https://img.asiatoday.co.kr/file/2025y/10m/12d/20251012010002217_250.jpg,'추석 전 검찰청 폐지'를 현실화한 더불어민주당이 사법개혁에 본격적인 시동을 걸고 있다. 대법관 증원 등을 핵심으로 한 개혁안이 조만간 공개될 예정이며 조희대 대법원장의 '대선 개입' 의혹을 명분 삼아 개혁 속도를 가속화할 것으로 보인다. 12일 정치권에 따르면 민주당 사법개혁특별위원회(사개특위)는 지난달 29일 사법개혁 관련 안을 발표할 예정이었지만 대전 국가정보자원관리원(국정자원) 화재와 추석 연휴로 인해 일정이 연기됐다. 민주당은 이르면..,,https://www.asiatoday.co.kr/kn/view.php?key=20251012010002217,아시아투데이
'가자 정상회의' 앞두고 카타르 외교관 사망…회의장 향하던 중 교통사고,https://img.asiatoday.co.kr/file/2025y/10m/12d/20251012010002218_250.jpg,가자지구 평화를 위한 정상회의를 앞두고 이집트 샤름엘셰이크로 향하던 카타르 의전팀 소속 외교관 3명이 교통사고로 사망했다고 로이터 통신이 12일(현지시간) 보도했다.이집트 주재 카타르 대사관은 엑스(X·옛 트위터)를 통해 카타르 정부 최고 기관인 카타르 아미리 디완 직원 3명이 사망했다고 밝혔다. 대사관은 다른 외교관 2명도 부상을 입었으며 병원에서 치료받고 있다고 덧붙였다.로이터에 따르면 외교관을 태운 차량은 이집트이 휴양 도시 샤름엘셰이크..,,https://www.asiatoday.co.kr/kn/view.php?key=20251012010002218,아시아투데이
"북한, 중국에 이어 대미 타격용 ICBM 무력시위… 한미일의 침묵, 전략적 ‘자제’인가 ‘무기력’인가",https://img.asiatoday.co.kr/file/2025y/10m/12d/20251012010002207_250.jpg,"북한이 노동당 창건 80주년을 맞아 평양 김일성광장에서 대륙간탄도미사일(ICBM) '화성-20형'을 최초로 공개하며 미국 본토를 직접 겨냥한 무력시위를 벌였다. 김정은 위원장은 10일 저녁 10시부터 약 15분간의 열병식 연설에서 특히 ""전략적 억제력의 강화와 러-우 전쟁 참전 해외작전부대""를 언급했지만, 미국이나 한국, 일본을 직접 언급하지는 않았다. 그럼에도 불구하고 북의 신형 ICBM의 등장만으로도 핵전쟁 위협의 현실화는 급격히 고조되고..",,https://www.asiatoday.co.kr/kn/view.php?key=20251012010002207,아시아투데이
불만족 후기 숨긴 오늘과일·쿠마마켓…공정위 과태료 '철퇴',https://img.asiatoday.co.kr/file/2025y/10m/12d/20251012010002204_250.jpg,전자상거래에서 소비자의 불만족 이용후기를 비공개 처리한 퍼스트엔터테인먼트와 한국유기농이 공정거래위원회로부터 제재를 받게 됐다.공정위는 이들 기업에 각각 시정명령 및 공표명령과 함께 과태료 500만원씩을 부과하기로 결정했다고 12일 밝혔다.공정위에 따르면 퍼스트엔터는 자신이 운영하는 사이버몰 '오늘과일'에서 과일 등 신선식품을 판매하면서 소비자가 작성한 후기 중 불만족 후기를 비공개 했다. 한국유기농도 자신이 운영하는 사이버몰 '쿠마마켓'에서..,,https://www.asiatoday.co.kr/kn/view.php?key=20251012010002204,아시아투데이
"성동구, '성수 도시재생' 도시·지역혁신대상 2년 연속 수상",https://img.asiatoday.co.kr/file/2025y/10m/12d/20251012010002201_250.jpg,"서울 성동구가 성수동의 비약적 발전을 이끈 '성수 도시재생사업' 성과를 인정받아 '2025 대한민국 도시·지역혁신대상'에서 일자리 창출 분야 '국토교통부 장관상'을 수상했다.12일 구에 따르면, 시상식이 열린 '2025 대한민국 도시·지역혁신 산업박람회'는 전국 공공기관과 기업, 전문가들이 모여 지속가능한 도시발전 전략과 혁신 사례를 공유하는 전국 규모의 박람회다. 지난달 24일부터 27일까지 4일간 강원도 삼척시에서 개최됐다.구는 박람회 개..",,https://www.asiatoday.co.kr/kn/view.php?key=20251012010002201,아시아투데이
"""엔저의 그림자, 한국의 수출·관광·금융 모두 흔들""",https://img.asiatoday.co.kr/file/2025y/10m/12d/20251012010001997_250.jpg,"일본 엔화의 약세는 이제 일본 내부의 문제가 아니다. 157엔대 지속적인 흐름은 한국 경제 전반에 직격탄을 날릴 수 있는 한·일 상호 충격의 매개가 될 가능성이 높다. 먼저 환율 측면에서, 강한 엔저는 원/엔 환율을 900원대 진입 수준까지 밀어올릴 수 있는 구조적 요인이 된다. 한국 기업들이 엔화로 경쟁력을 확보하는 일본산 제품과 직접 경쟁하는 구도에서는 가격 경쟁력 약화가 현실화될 것으로 관측된다. 예컨대 자동차, 기계, 철강 등 중공업..",,https://www.asiatoday.co.kr/kn/view.php?key=20251012010001997,아시아투데이
