title,thumbnail,short_content,write_time,link,company
“김여정 당 총무부 맡으면서 노동당 내 권력부서 불편해할 것”,https://img.asiatoday.co.kr/file/2026y/03m/13d/20260313010004019_250.jpg?v=1773383352,"북한 김여정 부장이 이번 9차 당대회를 통해 노동당 총무부장을 맡으면서 기존 당 총무부의 전반적인 기능이 강화될 것이라는 분석이 나왔다. 이에 따라 노동당 내 막강한 권력을 자랑하는 조직지도부·선전선동부 등이 총무부를 불편해하며 눈치를 볼 수 있다는 분석이다. 김인태 국가안보전략연구원 수석연구위원은 13일 내놓은 'INSS 전략보고'를 통해 ""노동당 중앙위원회 '전문부서'는 당과 체제 전반을 지도하고 총무부는 그 '전문부서'들을 관리, 통제하..",,https://www.asiatoday.co.kr/kn/view.php?key=20260313010004019,아시아투데이
"석유최고가격 첫날…김정관 “이미 인하 효과, 손실 보전은 객관적 산정”",https://img.asiatoday.co.kr/file/2026y/03m/13d/20260313010004021_250.jpg?v=1773383289,"29년 만에 시행된 석유 최고가격제가 13일부터 시행된 가운데 김정관 산업통상부 장관이 첫날부터 현장 점검에 나서 유가 안정 의지를 강조했다. 그는 ""이미 시장에서 가격 인하효과가 나타나고 있다""며 석유업계의 가격 인하에 적극적인 동참을 당부했다.김 장관은 이날 서울 한국무역보험공사에서 열린 '석유시장 점검회의' 이후 기자들과 만나 ""재고 소진 등으로 인해 주유소 판매가에 반영되기까지 최대 일주일가량이 소요되지만 이번엔 특별한 상황을 고려해..",,https://www.asiatoday.co.kr/kn/view.php?key=20260313010004021,아시아투데이
"HD현대중공업, HJ중공업 최대주주에 군산조선소 매각…신조 재개 기대",https://img.asiatoday.co.kr/file/2026y/03m/13d/20260313010004017_250.jpg?v=1773382916,HD현대중공업이 HJ중공업 최대주주인 에코프라임마린퍼시픽에 군산조선소를 매각한다.양사는 13일 용산에 위치한 에코프라임마린퍼시픽 본사에서 군산조선소 자산 양수도를 위한 합의각서(MOA)를 체결했다고 밝혔다. 최종 계약은 실사 이후 진행될 예정이다.현대중공업 군산조선소는 2010년 전라북도 군산국가산업단지 내 180만㎡ 규모로 건립됐다. 해당 조선소는 조선업 불황과 적자 여파로 2017년 가동이 중단됐다. 2022년 10월 재가동에 들어갔지만..,,https://www.asiatoday.co.kr/kn/view.php?key=20260313010004017,아시아투데이
"강유미, 두쫀쿠·봄동으로 소비 문화 풍자…현대미술 패러디 영상 화제",https://img.asiatoday.co.kr/file/2026y/03m/13d/20260313010004011_250.jpg?v=1773382483,코미디언 강유미가 최근 유행하는 음식과 소비 문화를 현대미술 형식으로 풍자한 영상을 공개해 온라인에서 관심을 모으고 있다.강유미는 최근 자신의 유튜브 채널에 '현대미술 안내'라는 제목으로 영상을 올려 유행 음식인 두바이 쫀득 쿠키(두쫀쿠)와 봄동을 소재로 소비 사회를 풍자했다. 영상에서 그는 전시 도슨트 역할을 맡아 작품을 설명하는 형식으로 이야기를 풀어냈다. 전시 제목은 과부하다. 첫 번째 작품은 배변 패드 위에 올려진 두바이 쫀득 쿠키다...,,https://www.asiatoday.co.kr/kn/view.php?key=20260313010004011,아시아투데이
"사상 첫 적자 기록한 혼다, 전기차 대신 하이브리드로 전략 선회",https://img.asiatoday.co.kr/file/2026y/03m/13d/20260313010003983_250.jpg?v=1773381897,img-01-jms-c 혼다가 사상 첫 연간 적자를 기록할 것으로 전망된다. 분위기 반전을 위해 혼다는 전기차(EV) 전략을 대폭 수정한다. 북미 시장을 겨냥해 개발하던 차세대 전기차 3종의 출시를 전면 취소하고 하이브리드 모델 확대에 무게를 싣는다. 이에 따라 한국 시장에서도 혼다의 라인업 변화와 전략 수정이 예상된다.12일 업계에 따르면 혼다는 2025년 회계연도(2025년 4월~2026년 3월) 실적에서 대규모 손실을 기록할 것으로 예상된..,,https://www.asiatoday.co.kr/kn/view.php?key=20260313010003983,아시아투데이
"李대통령, '기름값 암행어사' 자처…""바가지는 신고하세요""",https://img.asiatoday.co.kr/file/2026y/03m/13d/20260313010003999_250.jpg?v=1773388019,"이재명 대통령이 '석유 최고가격제' 시행 첫날인 13일 ""(기름값) 바가지는 신고하세요""라고 하며 유가 안정 의지를 피력했다. 이 대통령은 이날 X에 경기도 시흥 일대 주유소 휘발유 가격이 표기된 지도를 올리고 ""유류값 많이 안정돼 가고 있나요""라며 이 같이 썼다.이 대통령이 올린 지도에는 ℓ당 1700원대부터 1900원대까지 다양한 휘발유 판매가가 표시돼 있다. 정부는 이날 0시부터 정유사의 보통휘발유 공급가격 최고액을 ℓ당 1724원으로..",,https://www.asiatoday.co.kr/kn/view.php?key=20260313010003999,아시아투데이
"'기뢰의 늪' 호르무즈, 日해상자위대 '마지막 카드'로 부상하나",https://img.asiatoday.co.kr/file/2026y/03m/13d/20260313010004000_250.jpg?v=1773490457,"13일 현재, 세계 경제의 동맥인 호르무즈 해협은 사실상 '사망 선고'를 받았다. 지난달 28일(이하 '이란' 현지시간) 전격적으로 시작된 미·이스라엘 연합군의 테헤란 공습과 이에 맞선 이란의 보복전이 갈수록 격화되면서, 이 좁은 물길은 항행이 불가능한 '위험 지대'로 전락했다. 12일 미 해군이 이란의 기뢰 부설 선박 16척을 격침했다는 승전보는 공허한 메아리가 되었다.이란은 공식적으로 해협을 '폐쇄'했다고 선언한 후, 통과를 시도하는 모든..",,https://www.asiatoday.co.kr/kn/view.php?key=20260313010004000,아시아투데이
"국토부, 공동주택 공시가격안 18일 공개…강남권 보유세 부담 확대 전망",https://img.asiatoday.co.kr/file/2026y/03m/13d/20260313010004001_250.jpg?v=1773381153,"올해 공동주택 공시가격(안)이 오는 18일부터 공개된다. 지난해 서울 아파트값이 크게 오른 영향으로 ,강남권을 중심으로 보유세 부담이 늘어날 가능성이 나온다.국토교통부는 오는 18일부터 다음 달 6일까지 20일간 올해 공동주택 공시가격(안)에 대한 소유자 열람과 의견 제출 절차를 진행한다고 13일 밝혔다. 대상은 올해 1월 1일 기준으로 조사·산정한 공동주택 약 1585만가구다.제출된 의견은 조사 기관인 한국부동산원의 자체 검토와 외부 전문가..",,https://www.asiatoday.co.kr/kn/view.php?key=20260313010004001,아시아투데이
"체질 개선 중인 태광, ‘석화 전문가’ 이부의 대표 선임…공동대표 체제 전환 관측도",https://img.asiatoday.co.kr/file/2026y/03m/13d/20260313010003988_250.jpg?v=1773382658,태광산업이 유태호 대표이사의 사임으로 사업 전반을 총괄하던 이부의 전무를 선임했다. 이부의 대표는 그룹 차원의 신사업을 이끌어갈 전망이다. 다만 이부의 대표가 석유화학 분야 전문가인 데다 이호진 전 회장 부재에 따른 경영 안정성 차원에서 추가 대표 선임 가능성도 나온다. 이에 이사회의 적지 않은 변화도 예상된다.13일 태광산업에 따르면 유 대표이사가 전날 일신상의 사유로 사임 의사를 밝히면서 오는 31일까지 임기를 지낸다. 유 대표이사는 지난..,,https://www.asiatoday.co.kr/kn/view.php?key=20260313010003988,아시아투데이
롯데홈쇼핑 김재겸 사내이사 재선임…이사회 6대3 재편,https://img.asiatoday.co.kr/file/2026y/03m/13d/20260313010003962_250.jpg?v=1773380493,"롯데홈쇼핑 정기 주주총회에서 김재겸 대표의 사내이사 재선임과 사외이사 선임 안건 등 주요 안건이 모두 원안대로 통과됐다. 이사회 구성은 롯데 측 6명, 태광 측 3명으로 재편됐다. 롯데홈쇼핑은 사외이사 확대에 대해 ""이사회의 독립성과 의사결정 투명성을 강화하기 위한 조치""라는 입장이다. 다만 2대 주주인 태광산업이 법적 대응을 예고하면서 양측 갈등은 이어질 전망이다. 13일 롯데홈쇼핑은 오전 10시 서울 롯데양평빌딩에서 정기 주주총회를 열고..",,https://www.asiatoday.co.kr/kn/view.php?key=20260313010003962,아시아투데이
"[취재후일담] ""중국행 티켓 이번엔 우리가?""…LCC 기대 커지는 이유",https://img.asiatoday.co.kr/file/2026y/03m/13d/20260313010003993_250.jpg?v=1773380683,국내 항공사들이 한중 여객 수요 증가 속 중국 노선 확대 움직임을 보이고 있습니다. 취재 과정에서 겪은 업계 분위기는 기대감과 긴장감이 동시에 엿보였습니다. 특히 저비용항공사(LCC)들이 평소 접근하기 쉽지 않았던 일부 중국 노선이 조만간 풀릴 예정이라 이들 모두 만반의 준비를 하고 있습니다.13일 항공업계에 따르면 국토교통부는 올해 중으로 중국 노선 운수권 일부를 LCC에 배분할 예정입니다. 대한항공과 아시아나항공 합병 과정에서 독과점 우려..,,https://www.asiatoday.co.kr/kn/view.php?key=20260313010003993,아시아투데이
"美, 러시아산 원유 제재 일시 유예…이란발 에너지 위기 대응",https://img.asiatoday.co.kr/file/2026y/03m/13d/20260313010003994_250.jpg?v=1773379980,미국 정부가 이란 전쟁으로 인한 세계 에너지 시장의 혼란을 완화하기 위해 해상에 묶여 있는 러시아 원유 및 석유 제품의 거래를 30일간 한시적으로 허용했다고 로이터통신이 12일(현지시간) 보도했다. 스콧 베선트 미 재무장관은 이번 제재 완화가 이란 전쟁 여파로 불안정해진 국제 에너지 시장을 안정시키기 위한 필수적인 단계라고 밝혔다. 이날 발표 후 13일 오전 아시아 시장의 유가 상승세는 소폭 둔화했다.지난 28일 시작된 미국·이스라엘과 이란..,,https://www.asiatoday.co.kr/kn/view.php?key=20260313010003994,아시아투데이
가상자산 침체 장기화에…거래소 수익성 '감소',https://img.asiatoday.co.kr/file/2026y/03m/13d/20260313010003992_250.jpg?v=1773379721,가상자산 시장 침체가 이어지면서 국내 주요 거래소들의 수익성에도 영향을 미칠 것으로 보인다. 시장 하락세로 거래량이 줄어들면서 수수료 수익 의존도가 높은 거래소 구조의 한계가 다시 부각되는 모습이다.13일 가상자산 데이터 플랫폼 코인게코에 따르면 이날 오후 2시 기준 국내 최대 가상자산 거래소 업비트의 평균 거래량은 약 13억4300만달러로 집계됐다. 이는 한 달 전(18억3000만달러) 대비 약 27% 감소한 수준이다. 시장 침체 속에서 투..,,https://www.asiatoday.co.kr/kn/view.php?key=20260313010003992,아시아투데이
"신작 사이클 앞둔 게임사들, 대표 교체 대신 '연임' 택했다",https://img.asiatoday.co.kr/file/2026y/03m/13d/20260313010003966_250.jpg?v=1773379221,"국내 주요 게임사들이 이달 말 정기 주주총회를 앞두고 대표이사와 주요 경영진 재선임에 나선다. 신작 경쟁이 본격화되는 시점에서 경영진 교체보다 전략의 연속성을 택한 것이다.13일 게임업계 관계자에 따르면 크래프톤, 넷마블 등 대형 게임사뿐 아니라 네오위즈, 카카오게임즈 등 중견 게임사들도 기존 리더십 체제를 유지하며 글로벌 시장 공략과 신작 출시 전략을 이어갈 전망이다.먼저 크래프톤은 오는 24일 정기 주주총회를 열고 김창한 대표이사를 재선임..",,https://www.asiatoday.co.kr/kn/view.php?key=20260313010003966,아시아투데이
"한화에어로, 호주 공장 증축 완료…""인도·태평양 핵심 거점으로""",https://img.asiatoday.co.kr/file/2026y/03m/13d/20260313010003987_250.jpg?v=1773378698,"한화에어로스페이스가 호주 현지 공장의 2단계 증축을 완료했다. 한화에어로스페이스는 호주 현지 공장을 호주와 한국뿐 아니라 인도·태평양 지역의 전략적 생산·정비(MRO) 거점으로 활용한다는 방침이다.13일 한화에어로스페이스에 따르면 2단계 시설의 주요 구성은 제2생산동, 남반구 최대 규모의 전자파 적합성(EMI/EMC) 시험실, 대형 세척 시설, 완제품 보관동 등이다. 제2생산동 등 핵심 시설은 당초 일정보다 1개월 반 앞당겨 완공됐다.호주 현..",,https://www.asiatoday.co.kr/kn/view.php?key=20260313010003987,아시아투데이
"관악구, 전국 유일 21개 전 동 치매안심마을 완성",https://img.asiatoday.co.kr/file/2026y/03m/13d/20260313010003986_250.jpg?v=1773378677,"올해 국내 치매 환자 수가 100만명을 넘어설 것으로 예상되는 가운데, 서울 관악구가 전국에서 유일하게 관내 21개 동 전체를 치매안심마을로 지정 완료했다.관악구는 2018년 보라매동·은천동을 시작으로 치매안심마을 조성에 나선 지 8년 만에 올해 초 서원·신원·남현·난향동을 추가 지정하며 전 동 완성을 이뤄냈다고 13일 밝혔다. 구 전체 65세 이상 어르신 인구 비율이 19.3%에 달하는 현실을 반영한 선제적 대응이다. 이로써 관악구는 치매..",,https://www.asiatoday.co.kr/kn/view.php?key=20260313010003986,아시아투데이
"야구방망이 휘두르며 직원 위협 의혹…노동부, 신재생에너지 업체 특별감독",https://img.asiatoday.co.kr/file/2026y/03m/13d/20260313010003985_250.jpg?v=1773378328,"세종// 고용노동부가 직원들을 향해 야구방망이를 휘두르고 흉기로 위협했다는 의혹이 제기된 신재생에너지 기업 대표에 대해 특별근로감독에 착수했다.고용노동부는 13일 서울 소재 신재생에너지 관련 기업 대표 A씨가 직원들이 함께 있는 사무실에서 야구방망이를 휘두르는 등 위협을 가하고 ""흉기로 찌르겠다""는 폭언을 했다는 언론 보도가 있어 이날부터 특별감독에 착수했다고 밝혔다.앞서 한 언론은 A씨가 사무실에서 야구방망이로 칸막이와 바닥을 내리치는 등 직..",,https://www.asiatoday.co.kr/kn/view.php?key=20260313010003985,아시아투데이
"美 트럼프 행정부, 韓 포함 60개국 '강제노동' 301조 조사 전격 착수… 글로벌 관세 압박 재구축",https://img.asiatoday.co.kr/file/2026y/03m/13d/20260313010003984_250.jpg?v=1773377888,미국 도널드 트럼프 행정부가 12일(현지시간) 한국·중국·일본·유럽연합(EU)을 포함한 60개 주요 무역 파트너들을 상대로 '강제노동 생산품 수입'과 관련한 1974년 무역법 301조(b) 조사에 착수했다. 이번 조사는 전날 한·중·일·EU 등 16개 경제주체를 대상으로 착수한 '과잉생산' 문제에 대한 301조 조사와 병렬적으로 진행된다.무역법 301조는 미국의 무역을 제한하거나 부담을 주는 외국 정부의 부당하거나 불합리하고 차별적인 행동·정..,,https://www.asiatoday.co.kr/kn/view.php?key=20260313010003984,아시아투데이
"SKT 정재헌 ""통신사, 데이터 전달자 넘어 AI 인프라 설계자 돼야""",https://img.asiatoday.co.kr/file/2026y/03m/13d/20260313010003981_250.jpg?v=1773376950,"정재헌 SK텔레콤 사장이 ""이제 통신사는 단순한 데이터 전달자를 넘어 인프라를 직접 설계하고 운영하는 'AI 인프라 설계자'가 돼야 한다""고 말했다.정 사장은 13일 SK텔레콤 뉴스룸을 통해 최근 스페인 바르셀로나에서 열린 세계 최대 이동통신 전시회 'MWC26' 소회를 밝혔다. 그는 ""올해 MWC를 통해 확인할 수 있었던 흐름은 AI가 소프트웨어를 넘어 '실물 인프라'의 주도권 경쟁으로 확장되었다는 점""이라며 ""CEO로서 SK텔레콤이 글로벌..",,https://www.asiatoday.co.kr/kn/view.php?key=20260313010003981,아시아투데이
"日, G7 호르무즈 선박호위 참가 고민…자위대 파견에 법적 장애",https://img.asiatoday.co.kr/file/2026y/03m/13d/20260313010003967_250.jpg?v=1773373141,"일본 정부가 G7의 호르무즈 해협 선박호위 활동에 자위대를 파견할지 법적·실무적 장애를 놓고 깊은 고민에 빠졌다. 미국·이스라엘의 이란 공격 여파로 중동 정세가 격화된 가운데, 집단적 자위권 발동 요건과 일본 주변 방위 공백이 주요 걸림돌로 떠올랐다. 산케이신문이 12일 보도했다.G7 정상들은 지난 11일 화상 회의에서 호르무즈 해협의 항행 자유 보장을 위해 선박호위 가능성을 검토하기로 합의했다. 의장국 프랑스가 발표한 성명은 ""호르무즈 해협..",,https://www.asiatoday.co.kr/kn/view.php?key=20260313010003967,아시아투데이
"與 공관위, 충청지사 경선 후보로 노영민·송기섭·신용환·한범덕 선정",https://img.asiatoday.co.kr/file/2026y/03m/13d/20260313010003964_250.jpg?v=1773371089,"더불어민주당이 공천관리위원회가 다가오는 6·3 지방선거 충청북도지사 경선 후보로 노영민, 송기섭, 신용환, 한범덕 후보를 선정했다. 김이수 민주당 중앙당 공천관리위원장은 13일 ""충청북도지사 후보자 심사 결과 공관위는 공모 후보자 4명 모두를 경선 후보자로 선정했다""고 밝혔다. 이어 김 위원장은 ""3선 국회의원을 역임하고 주중대사와 대통령비서실장을 지낸 노영민 후보, 3선 군수를 지내며 10년간 진천군 성장을 이끈 송기섭 후보, 명태균 사태의..",,https://www.asiatoday.co.kr/kn/view.php?key=20260313010003964,아시아투데이
"日, 美차세대 미사일 방어구상 '골든돔' 참여 조율…극초음속 무기 대응 공조 강화",https://img.asiatoday.co.kr/file/2026y/03m/13d/20260313010003963_250.jpg?v=1773370777,일본 정부가 이달 중 워싱턴에서 열리는 미·일 정상회담에서 미국이 추진 중인 차세대 미사일 방어 구상 '골든돔(Golden Dome)' 참여 방침을 밝히는 방안을 검토 중인 것으로 알려졌다. 양국은 극초음속 활공무기(HGV) 등 신종 위협에 대응하기 위한 미사일 요격체계와 위성 감시망 협력을 강화할 계획이다.요미우리신문 13일자 보도에 따르면 다카이치 사나에 총리는 이 달 중 백악관에서 도널드 트럼프 미국 대통령과 회담을 가질 예정이다. 지난..,,https://www.asiatoday.co.kr/kn/view.php?key=20260313010003963,아시아투데이
"李대통령, '국빈방한' 마크롱과 내달 3일 정상회담",https://img.asiatoday.co.kr/file/2026y/03m/13d/20260313010003957_250.jpg?v=1773369368,"이재명 대통령이 국빈 방한하는 에마뉘엘 마크롱 프랑스 대통령과 내달 3일 정상회담을 한다. 이 대통령은 마크롱 대통령에 앞서 이달 말 국빈 방한하는 프라보워 수비안토 인도네시아 대통령과도 회담에 나선다. 강유정 대변인은 13일 서면 브리핑을 통해 이 같은 내용을 밝혔다. 강 대변인은 ""마크롱 대통령이 이 대통령 초청으로 내달 2∼3일 한국을 찾을 예정""이라며 ""양 정상은 4월 3일 오전에 공식환영식, 정상회담, 조약·양해각서 서명식, 국빈 오..",,https://www.asiatoday.co.kr/kn/view.php?key=20260313010003957,아시아투데이
"미·서방, 안보리서 이란 핵무기 놓고 러·중과 충돌",https://img.asiatoday.co.kr/file/2026y/03m/13d/20260313010003956_250.jpg?v=1773369212,"미국과 서방 동맹국들이 12일(현지시간) 유엔(UN) 안전보장이사회(안보리)에서 이란의 핵 개발 의도를 둘러싸고 러시아 및 중국과 정면으로 충돌했다고 로이터 통신이 보도했다. 이달 안보리 의장국인 미국은 이란 제재 이행을 감시하는 '1737 위원회' 활동 재개를 논의 테이블에 올렸다. 러시아와 중국은 이 논의 자체를 저지하려 했으나, 표결 결과 찬성 11, 반대 2, 기권 2로 회의가 진행됐다.마이크 왈츠 유엔 주재 미국 대사는 중국과 러시아..",,https://www.asiatoday.co.kr/kn/view.php?key=20260313010003956,아시아투데이
정청래 “경제도 민생도 때가 있어…정부 추경안 제출되는 즉시 처리”,https://img.asiatoday.co.kr/file/2026y/03m/13d/20260313010003955_250.jpg?v=1773368877,"정청래 더불어민주당 대표가 정부에서 추가경정예산(추경)안을 제출하면 곧바로 통과시키겠다고 밝혔다. 중동 사태로 인해 불거질 수 있는 민생 경제 위기를 최소화하기 위해 정부와 함께 총력을 다하겠다는 입장이다. 정 대표는 13일 전북 순창에서 열린 최고위원회의에서 ""이재명 대통령이 물가 안정과 취약계층 보호를 위해 공공요금을 동결과 유류세 인하 등을 지시했다. 특히 민생 현장에 온기를 넣기 위해 신속한 재정 투입이 필요하다고 했다""고 말했다.그러..",,https://www.asiatoday.co.kr/kn/view.php?key=20260313010003955,아시아투데이
"필립스 보청기, 'KIMES 2026' 참가.. 신규 창업 대리점 모집",https://img.asiatoday.co.kr/file/2026y/03m/13d/20260313001123077_250.jpg?v=1773368679,"덴마크 청각 전문 기업 디만트코리아의 ‘필립스 보청기’가 오는 3월 19일부터 22일까지 서울 코엑스에서 열리는 ‘제41회 국제의료기기병원설비전시회(KIMES 2026)’에 참가해 창업 대리점 모집 상담을 진행한다고 13일 밝혔다. 필립스 보청기는 덴마크 디만트(Demant) 그룹의 청각 솔루션 브랜드로, 청력 관리 기술을 기반으로 다양한 청력 손실 상황에서의 일상생활 불편을 완화하는 제품과 서비스를 제공하고 있다. 디만트 그룹은 청각 솔루션..",,https://www.asiatoday.co.kr/kn/view.php?key=20260313001123077,아시아투데이
두끼 대만 이벤트 홍보 글 논란…WBC ‘조작’ 표현에 사과문 발표,https://img.asiatoday.co.kr/file/2026y/03m/13d/20260313010003953_250.jpg?v=1773368495,"떡볶이 프랜차이즈 두끼가 대만 법인의 SNS 게시물 논란과 관련해 공식 사과했다.두끼는 공식 입장문을 통해 ""최근 두끼 대만에서 진행된 이벤트 과정에서 왜곡된 사실을 표현한 게시물이 확인됐다""며 ""불편함과 실망을 드린 모든 분들께 진심으로 사과드린다""고 밝혔다.두끼에 따르면 문제의 이벤트는 대만 파트너사가 자체적으로 기획·운영한 것으로, 한국 본사와 사전 협의 없이 진행됐다. 본사는 해당 내용을 인지한 즉시 현지 파트너사에 게시물 삭제를 요청..",,https://www.asiatoday.co.kr/kn/view.php?key=20260313010003953,아시아투데이
‘절윤 실천’ 평행선 끝 파열음…이정현 사퇴에 국힘 비상,https://img.asiatoday.co.kr/file/2026y/03m/13d/20260313010003951_250.jpg?v=1773368304,"국민의힘 서울시장 공천을 둘러싼 내홍이 공천관리위원장 사퇴로까지 번졌다. 오세훈 서울시장이 당 쇄신 조치를 요구하며 서울시장 후보 등록을 거듭 미루는 사이 이정현 중앙당 공천관리위원장이 전격 사퇴하면서 서울시장 경선은 물론 당 전체 공천 구도도 흔들리는 양상이다.이 위원장은 13일 언론 공지를 통해 ""이번 공천 과정에서 변화와 혁신의 필요성을 절실히 느끼며 맡은 역할에 최선을 다해보려고 했다""면서도 ""여러 의견을 존중하는 과정에서 제가 생각했..",,https://www.asiatoday.co.kr/kn/view.php?key=20260313010003951,아시아투데이
내년 의대 정원 대학별 배정…강원·충북대 각 39명 최대 증원,https://img.asiatoday.co.kr/file/2026y/03m/13d/20260313010003947_250.jpg?v=1773367319,세종// 2027학년도 의과대학 정원이 대학별로 배정됐다. 강원대와 충북대가 각각 39명 늘어나 가장 큰 폭의 증원이 이뤄진다. 이번에 확대되는 정원은 모두 지역의사 전형으로 선발된다.교육부는 13일 서울을 제외한 지역 32개 의과대학을 대상으로 '2027학년도~2031학년도 의과대학 학생정원 배정안'을 마련해 대학에 사전 통지했다고 밝혔다.배정안에 따르면 전국 40개 의과대학의 총정원은 2024학년도 정원 3058명을 기준으로 2027학년도에..,,https://www.asiatoday.co.kr/kn/view.php?key=20260313010003947,아시아투데이
"셀리맥스, 일본 최대 이커머스 이벤트 ‘메가와리’ 1위 등극",https://img.asiatoday.co.kr/file/2026y/03m/13d/20260313001050038_250.jpg,더마코스메틱 브랜드 셀리맥스(celimax)가 일본 이커머스 플랫폼 큐텐(Qoo10)의 대형 할인 행사 메가와리(メガ割)’에서 종합 랭킹 1위를 기록했다.셀리맥스는 일본 인플루언서와 협업해 선보인 콜라보 세트가 지난 5일 기준 메가와리 종합 랭킹 1위를 차지했다고 13일 밝혔다. 대표 제품인 ‘레티날 샷 타이트닝 부스터’ 단품도 종합 랭킹 2위에 올랐다.메가와리는 이베이재팬이 운영하는 큐텐의 분기별 대형 할인 행사로 일본 온라인 쇼핑 이용자들이..,,https://www.asiatoday.co.kr/kn/view.php?key=20260313001050038,아시아투데이
