title,thumbnail,short_content,write_time,link,company
'카자흐 국민라면' 팔도 도시락 단종 오보에 '판매 촉구 운동' 해프닝,https://img.asiatoday.co.kr/file/2025y/02m/26d/20250226010013689_250.jpg,"아시아투데이 김민규 아스타나 통신원 = 러시아 및 중앙아시아에서 선풍적인 인기를 끌며 현지에서 '국민라면'이 된 팔도의 컵라면 '도시락'의 판매가 중단된다는 소문이 퍼지면서 SNS에서 판매 재개 촉구 운동이 일어났다.카자흐스탄 일간 텡그리뉴스는 25일 SNS에서 한국기업 팔도의 도시락을 판매하라고 요구하는 운동이 확산되고 있다고 보도했다.현지 일부 매체는 최근 카자흐스탄 수도 아스타나시에서 샤인머스켓, 두바이 초콜릿, 팔도 도시락의 판매를 중단..",,https://www.asiatoday.co.kr/kn/view.php?key=20250226010013689,아시아투데이
"""가사가 이게 맞아?""… 지드래곤, 선정적 가사 '논란'",https://img.asiatoday.co.kr/file/2025y/02m/26d/20250226001542591_250.jpg,"지드래곤의 신곡 가사가 선정성 논란에 휩싸였다. 지난 25일 11년 5개월 만에 나온 지드래곤의 정규 3집 '위버멘쉬(Ubermensch)' 수록곡 가사를 두고 누리꾼들의 설전이 오가고 있다.일부 누리꾼은 타이틀곡 'TOO BAD'의 의 '불이나 축이듯, 땀이 주르르르륵', '게슴츠르레, G'azm 오르게'라는 가사 부분이 선정적이라고 지적했다. 또 수록곡 '보나마나'의 '(Giddy-up) 내 위에 올라타 문질러봐 Push me hard..",,https://www.asiatoday.co.kr/kn/view.php?key=20250226001542591,아시아투데이
"""고객 쇼핑 편의성↑""…에이블리, ‘사이즈 추천 기능’ 개선",https://img.asiatoday.co.kr/file/2025y/02m/26d/20250226010014205_250.jpg,"에이블리코퍼레이션의 스타일 커머스 플랫폼 에이블리는 고객 쇼핑 편의성 향상을 위해 상품 상세 페이지 내 '사이즈 추천 기능'을 개선했다고 26일 밝혔다.에이블리 사이즈 추천 기능은 월 936만명 이상의 버티컬 커머스 전체 1위 규모 사용자로부터 쌓이는 빅데이터를 기반으로 최적의 상품 사이즈를 추천해 주는 서비스다. 유저가 키, 체중, 상·하의 사이즈 등 신체 정보를 입력하면 자신과 비슷한 체형을 가진 유저의 구매 데이터 분석을 기반으로 가장..",,https://www.asiatoday.co.kr/kn/view.php?key=20250226010014205,아시아투데이
"WKBL 포스트시즌 4강, 우승 출사표",https://img.asiatoday.co.kr/file/2025y/02m/26d/20250226010014203_250.jpg,"2024~25시즌 여자프로농구(WKBL) 우승팀을 가리는 포스트시즌(PS)을 앞두고 감독과 선수들이 우승 열망을 드러냈다. WKBL은 26일 서울시 상암동 스탠포드호텔 서울 그랜드볼룸에서 하나은행 2024~2025 여자프로농구 포스트시즌 미디어데이를 가졌다. 아산 우리은행과 부산 BNK 썸, 용인 삼성생명, 청주 KB 스타즈 감독과 선수들은 이 자리에서 저마다 우승 각오를 밝혔다.정규시즌 챔피언 위성우 우리은행 감독은 ""PS는 다를 거라고 생..",,https://www.asiatoday.co.kr/kn/view.php?key=20250226010014203,아시아투데이
‘좌초 위기’ 동해가스전… “한 번 시추로 끝낼 일 아냐”,https://img.asiatoday.co.kr/file/2025y/02m/26d/20250226010014171_250.jpg,"동해 심해 가스전·유전 개발 사업인 '대왕고래 프로젝트' 1차 시추에서 경제성을 발표하지 못했다는 결론이 나오며 논란이 이어지고 있는 가운데, 업계 및 전문가들 사이에서는 한 번의 시추만으로 사업 중단을 이야기하기는 이르다는 목소리가 나온다. 특히 정치권이 사업에 개입하지 말고 전문가 및 실무자들의 손에 맡겨야 한다는 지적이다. 26일 업계 및 정치권에 따르면 대왕고래 프로젝트 1차 시추 결과 대왕고래 구조에서 발견된 가스가 경제성을 확보하기..",,https://www.asiatoday.co.kr/kn/view.php?key=20250226010014171,아시아투데이
"""3월 3일은 삼겹살 먹는날""…어디가 가장 저렴할까",https://img.asiatoday.co.kr/file/2025y/02m/26d/20250226010014202_250.jpg,3월 3일 삼겹살데이를 맞아 각종 유통 판매채널에서 대대적인 할인행사가 열린다. 최저가 경쟁을 펼치는 대형마트에서는 100g당 700원대의 삼겹살도 나왔다. 고물가 시대 파격적인 가격 혜택으로 오픈런은 물론이고 조기품절도 예상되고 있다. 롯데백화점은 오는 3월 4일까지 전점에서 '삼겹살데이' 행사를 진행한다고 26일 밝혔다. 제주 서귀포의 온화한 기후에서 지하수를 먹고 자란 '제주돼지 삼겹살'을 서귀포축산농협과 협업해 50% 할인 판매한다...,,https://www.asiatoday.co.kr/kn/view.php?key=20250226010014202,아시아투데이
"블랙야크 키즈, 운동화 ‘스프린트젬’ 출시",https://img.asiatoday.co.kr/file/2025y/02m/26d/20250226010014187_250.jpg,"블랙야크 키즈는 신학기를 맞아 아이들을 겨냥한 운동화 '스프린트젬'을 출시했다고 26일 밝혔다.브랜드 처음으로 선보인 벨크로 (단추나 지퍼 대신 쓰이는 탈부착 소재) 타입과, 슬립온(끈이 없어 바로 신을 수 있는 신발) 타입 '스프린트젬B' 버전도 함께 공개했다.'스프린트젬'은 한 쪽 무게가 198g(210㎜ 기준)이며 발등의 베라(설포) 한 쪽을 고정하고, 신축성이 좋은 밴딩 디테일을 더했다.앞쪽은 엠보싱(돋을새김으로 무늬를 찍어내는 가공..",,https://www.asiatoday.co.kr/kn/view.php?key=20250226010014187,아시아투데이
"검찰, '서부지법 난입 사태' 가담자 7명 추가 기소",https://img.asiatoday.co.kr/file/2025y/02m/26d/20250226010014190_250.jpg,검찰이 '서울서부지법 난입 사태'와 관련해 피의자 7명을 추가로 재판에 넘겼다.26일 법조계에 따르면 서울서부지검은 최근 A 교회 특임전도사 윤모씨를 비롯한 7명을 특수건조물침입 등 혐의로 구속 기소했다.이들은 지난달 19일 서부지법에 난입해 기물을 파손하고 폭력 행위를 벌인 혐의를 받는다. 서부지법 난입 사태로 재판에 넘겨진 인원은 70명으로 늘었다.서울서부지검 전담수사팀은 지난 10일 서부지법 불법 점거 및 폭력 사건과 관련해 62명을 구..,,https://www.asiatoday.co.kr/kn/view.php?key=20250226010014190,아시아투데이
