title,thumbnail,short_content,write_time,link,company
"ICC, '인지장애 주장' 두테르테 前 필리핀 대통령 석방 요청 기각",https://img.asiatoday.co.kr/file/2025y/10m/12d/20251012010002121_250.jpg,"'마약과의 전쟁' 중 벌어진 반인도적 범죄 혐의로 네덜란드 헤이그에 구금되어 있는 로드리고 두테르테(80) 전 필리핀 대통령이 재판 전 석방(보석)을 요청했으나 국제형사재판소(ICC)로부터 거부당했다.12일 로이터에 따르면 ICC 재판부는 지난 10일(현지시간) 공개된 결정문에서 두테르테 전 대통령을 구치소에 계속 구금해야 한다고 판결했다. 앞서 두테르테 전 대통령의 변호인단은 그가 ""인지 장애를 앓고 있어 재판을 받을 수 없는 상태""로 고령..",,https://www.asiatoday.co.kr/kn/view.php?key=20251012010002121,아시아투데이
"순직해병 특검, 이번 주 尹 소환 전망…출석 가능성 낮아",https://img.asiatoday.co.kr/file/2025y/10m/12d/20251012010002113_250.jpg,이명현 순직해병 특검팀이 윤석열 전 대통령을 이번 주 소환해 조사할 방침이다. 다만 윤 전 대통령이 재구속 이후 특검 조사와 재판에 모두 불응하고 있어 소환에 응할지는 불투명하다.12일 법조계에 따르면 순직해병 특검팀은 오는 13일 윤 전 대통령 측에 출석요구서를 송부할 예정이다. 피의자가 출석 준비 기간을 가질 수 있도록 며칠의 여유를 두고 조사 일정을 통보하는 점을 고려하면 이번 주 후반께 소환 일정이 잡힐 가능성이 크다.윤 전 대통령은..,,https://www.asiatoday.co.kr/kn/view.php?key=20251012010002113,아시아투데이
하마스 “떠나지 않을 것”…'가자 평화안' 최대 난제는 무장 해제,https://img.asiatoday.co.kr/file/2025y/10m/12d/20251012010002092_250.jpg,"가자지구에서 휴전이 발효됐지만, 평화의 향방은 여전히 하마스의 무장 해제에 달려 있다. 하마스가 ""떠나지 않겠다""며 재충돌 가능성을 언급하면서, 트럼프 미국 대통령의 가자 평화 구상은 가장 어려운 시험대에 올랐다.하마스 정치국 고위 간부 호삼 바드란은 11일(현지시간) AFP 인터뷰에서 ""무기는 팔레스타인 인민 전체의 것""이라며 ""하마스의 무기는 국민 방어 수단""이라고 주장했다. 그는 ""하마스를 추방한다는 것은 터무니없다""며, 가자지구 잔류와..",,https://www.asiatoday.co.kr/kn/view.php?key=20251012010002092,아시아투데이
'오스카 주연상' 다이앤 키튼 별세…향년 79세,https://img.asiatoday.co.kr/file/2025y/10m/12d/20251012010002093_250.jpg,"미국 할리우드 배우 다이앤 키튼이 11일(현지시간) 향년 79세로 별세했다.현지 매체 피플지는 로스앤젤레스 소방국(LAFD)이 이날 오전 8시 8분경 캘리포니아주에 있는 키튼의 자택에 출동해 그를 지역 병원으로 이송한 것으로 확인했다.사인 등 구체적인 사안은 알려지지 않았다. 키튼의 대변인은 고인에 관해 ""현재 추가 정보는 없으며 유가족은 깊은 슬픔 속에 사생활 보호를 요청했다""고 말했다.고인은 1946년 LA에서 4남매 중 장녀로 태어나 1..",,https://www.asiatoday.co.kr/kn/view.php?key=20251012010002093,아시아투데이
"창작뮤지컬의 새 바람, ‘프라테르니테’ 10월 첫선",https://img.asiatoday.co.kr/file/2025y/10m/12d/20251012010002075_250.jpg,"CJ문화재단은 뮤지컬 창작자 지원사업 '스테이지업(STAGE UP)'을 통해 개발을 지원한 뮤지컬 '프라테르니테'가 10월 초연 무대에 오른다고 12일 밝혔다.스테이지업은 CJ문화재단이 기획·개발 단계부터 제작사 연계에 이르기까지 창작뮤지컬의 시장 진출을 돕는 프로그램이다. 재단은 이재현 이사장의 사회공헌 철학을 바탕으로 문화 분야에서 젊은 창작자와 작품을 체계적으로 지원해 왔다고 설명했다.프라테르니테는 18세기 말 프랑스를 배경으로, 한때..",,https://www.asiatoday.co.kr/kn/view.php?key=20251012010002075,아시아투데이
"친절·위생·정찰제, 전통시장 건강한 상거래 정착 캠페인 진행",https://img.asiatoday.co.kr/file/2025y/10m/12d/20251012010002086_250.jpg,"전국 전통시장의 건강한 상거래 문화 정착을 위한 '2025 스마일 어게인 캠페인'이 진행 중이다.이번 캠페인은 문화체육관광부와 한국관광공사가 친절, 위생, 정찰제, 카드 결제 실천을 통해 전통시장에 대한 국민 인식을 개선하고자 기획했다.캠페인은 오는 11월 1일까지 전국 전통시장 곳곳에서 진행된다. 지난 2023년 공사가 선정한 K-관광마켓 10선을 중심으로 펼쳐진다. 스마일 트럭이 운영되는 전통시장에서는 물건을 구매하고 1만 원 이상의 영..",,https://www.asiatoday.co.kr/kn/view.php?key=20251012010002086,아시아투데이
"LG, APEC 정상회의 지원 그룹역량 총동원…""글로벌 브랜드 외교""",https://img.asiatoday.co.kr/file/2025y/10m/12d/20251012010002025_250.jpg,LG가 이달 말 경주에서 열리는 '2025년 APEC 정상회의(APEC 2025 KOREA)'의 성공적 개최를 위해 그룹 역량을 총동원하고 있다. 단순 후원을 넘어 국가 행사와 연계한 '브랜드 외교' 전략으로 글로벌 무대에서 존재감을 강화하는 모습이다. 12일 LG에 따르면 지난 8월 말 민간기업 최초로 'APEC 정상회의 준비기획단'과 홍보 협력 양해각서(MOU)를 체결한 후 그룹 역량을 총동원해 APEC 홍보 활동을 전방위로 전개하고 있..,,https://www.asiatoday.co.kr/kn/view.php?key=20251012010002025,아시아투데이
"LG전자, 향균 기능성 소재 '퓨로텍' 유럽서 첫 선",https://img.asiatoday.co.kr/file/2025y/10m/12d/20251012010002010_250.jpg,"LG전자가 향균 기능성 소재 '퓨로텍(PuroTec™)'을 유럽 시장에서 선보였다.12일 LG전자는 독일 노르트라인베스트팔렌주 뒤셀도르프에서 8일(현지시간) 개막한 K 2025(이하 K쇼)에 LG 퓨로텍을 선보였다고 밝혔다. 3년 주기로 개최되는 K쇼는 3년 주기로 개최되는 미국 NPE(National Plastics Exposition), 매년 개최되는 중국 차이나플라스(Chinaplas)와 함께 세계 3대 플라스틱 소재 전시회로 꼽힌다...",,https://www.asiatoday.co.kr/kn/view.php?key=20251012010002010,아시아투데이
