title,thumbnail,short_content,write_time,link,company
[백운산 오늘의 운세] 2026년 3월 15일,https://img.asiatoday.co.kr/file/2026y/02m/04d/20260204001436333_1.jpg,쥐띠36년 몸이 좋아지니 기분이 아주 좋다. 48년 일이 잘 풀리니 의기양양하다. 60년 온종일 기쁨이 가득하다. 72년 안 되는 것은 단호히 결정하도록 한다.84년 귀인을 만나니 상황이 빠르게 좋아진다.96년 금전 운에 회복의 낌새가 보인다.소띠37년 인색하면 오는 것이 적어진다. 49년 운이 약하니 근심이 온다. 61년 귀인을 만나니 예상치 못한 금전이 생긴다...,,https://www.asiatoday.co.kr/kn/view.php?key=20260204001436333,아시아투데이
"트럼프, 韓·日 등 5개국에 호르무즈 군함 파견 촉구…정부 '참전 딜레마'",https://img.asiatoday.co.kr/file/2026y/03m/15d/20260315010004131_250.jpg?v=1773521757,"미국과 이스라엘의 대(對)이란 전쟁이 2주를 넘기며 중동 군사 긴장이 최고조로 치닫는 가운데, 도널드 트럼프 미국 대통령이 한국과 일본 등 주요 국가를 직접 지목해 호르무즈 해협으로의 군함 파견을 요청했다.이란의 해협 봉쇄로 국제 유가가 배럴당 100달러를 넘어서는 등 글로벌 경제 충격이 커지는 상황에서 미국이 동맹국과 주요 에너지 수입국들에게 군사적 부담 분담을 공개적으로 압박하고 나선 것으로 해석된다.한국 정부는 한미동맹과 에너지 안보,..",,https://www.asiatoday.co.kr/kn/view.php?key=20260315010004131,아시아투데이
[속보] 트럼프 “호르무즈 지켜라”… 한국에도 군함 파견 요구,https://img.asiatoday.co.kr/file/2026y/03m/14d/20260314010004121_250.jpg?v=1773502267,"도널드 트럼프 미국 대통령이 호르무즈 해협의 안전 확보를 명분으로 한국을 포함한 주요 국가들에 군함 파견을 요구하고 나섰다.트럼프 대통령은 14일(현지시간) 자신의 소셜미디어 트루스소셜에 올린 글에서 ""이란의 호르무즈 해협 봉쇄 시도로 영향을 받는 국가들은 해협을 개방되고 안전하게 유지하기 위해 미국과 함께 군함을 보낼 것""이라고 밝혔다.그는 특히 한국과 일본, 영국, 프랑스, 중국 등을 거론하며 ""이들 국가가 함정을 파견해 호르무즈 해협이..",,https://www.asiatoday.co.kr/kn/view.php?key=20260314010004121,아시아투데이
"""위안화 거래 원유만 통과""…이란, 호르무즈 통제 강화",https://img.asiatoday.co.kr/file/2026y/03m/14d/20260314010004120_250.jpg?v=1773493217,이란이 호르무즈 해협을 통과하는 유조선 가운데 위안화로 거래되는 원유를 실은 선박만 허용하는 방안을 검토 중인 것으로 알려졌다.CNN 방송은 14일(현지시간) 소식통을 인용해 이란이 호르무즈 해협을 통과하는 유조선 흐름을 관리하는 새로운 계획을 진행하고 있으며 이 차원에서 위안화 거래 선박의 통행 허용 가능성이 제기됐다고 보도했다.글로벌 원유 거래는 서방 제재를 받는 러시아산을 제외하면 거의 전적으로 달러화로 이뤄진다. 러시아산 원유는 현재..,,https://www.asiatoday.co.kr/kn/view.php?key=20260314010004120,아시아투데이
소공동 게스트하우스 화재…중상 2명·경상 8명,https://img.asiatoday.co.kr/file/2026y/03m/14d/20260314010004114_250.jpg?v=1773488450,"14일 오후 6시 10분경 서울 중구 소공동 7층 빌딩 3층에서 화재가 발생해 10명의 인명피해가 발생했다.소방 당국에 따르면 중상자 2명이 병원으로 이송됐고, 경상자 8명은 현장에서 응급처치를 받았다. 불이 난 곳은 게스트하우스로 전해졌다.소방 당국은 현재 진화작업을 진행 중이다. 중구는 안전 문자를 통해 ""다량의 연기가 발생하고 있으니 연기 흡입에 유의하고 우회해달라""고 당부했다.현재 세종대로18길 시청교차로~남대문로7길 구간과 소공로 대..",,https://www.asiatoday.co.kr/kn/view.php?key=20260314010004114,아시아투데이
일요일 낮 16도까지 올라…일교차 크고 안개 주의,https://img.asiatoday.co.kr/file/2026y/03m/14d/20260314010004113_250.jpg?v=1773488167,"15일 일요일은 낮 기온이 10~16도까지 오르며 포근한 날씨를 보이겠다. 전국이 대체로 흐리다.아침 최저기온은 0~6도로 예보됐다. 낮과 밤의 기온 차가 15도 안팎으로 클 것으로 예상돼 건강관리에 유의해야 한다.새벽부터 아침 사이 경기 남부 서해안과 충남 서해안에서 0.1mm 미만의 빗방울이 떨어지는 곳이 있다. 오후에는 강원 산지, 충북, 전북 동부, 경북 북동 산지에서 0.1mm 미만의 비 또는 0.1cm 미만의 눈이 내린다.새벽부터..",,https://www.asiatoday.co.kr/kn/view.php?key=20260314010004113,아시아투데이
"'서울 200인의 아빠단' 출범…오세훈 ""아이 울음소리 커지는 서울 만들 것""",https://img.asiatoday.co.kr/file/2026y/03m/14d/20260314010004111_250.jpg?v=1773486472,서울시가 아빠들의 육아 참여를 높이고 맞돌봄 문화 확산을 위해 운영 중인 '서울 200인의 아빠단'이 새롭게 출범했다.오세훈 서울시장은 14일 중구 남산공원백범광장에서 열린 '서울 200인의 아빠단' 발대식에 참석해 시민들과 소통하며 격려의 메시지를 전했다.시에 따르면 지난해 서울에 사는 남성 육아휴직급여 수급자수는 2만2693명으로 전년(1만5022명) 대비 약 51% 늘었다. 시는 늘어나는 맞돌봄을 지원하기 위해 육아 노하우와 정보를 나누..,,https://www.asiatoday.co.kr/kn/view.php?key=20260314010004111,아시아투데이
"원·엔 급락에 공동 경계…한일 재무장관 ""외환시장 변동성 대응 공조",https://img.asiatoday.co.kr/file/2026y/03m/14d/20260314010004109_250.jpg?v=1773480072,"한국과 일본 재무당국이 최근 원화와 엔화 가치의 급격한 하락에 대해 ""심각한 우려""를 표명하고 외환시장의 과도한 변동성에 공동 대응하기로 했다. 또 핵심광물 공급망 협력과 역내 금융안전망 강화, 한일 통화스왑 등 경제·금융 협력을 지속하기로 했다.구윤철 부총리 겸 재정경제부 장관은 14일 일본 도쿄 재무성에서 가타야마 사쓰키 일본 재무장관과 제10차 한일 재무장관회의를 열고 세계 및 역내 경제 상황과 경제안보, 금융 협력 방안을 논의했다...",,https://www.asiatoday.co.kr/kn/view.php?key=20260314010004109,아시아투데이
"""韓日 모두 지방소멸 위기""…윤호중, 인구감소 공동 대응 필요성 제기",https://img.asiatoday.co.kr/file/2026y/03m/14d/20260314010004108_250.jpg?v=1773478908,"윤호중 행정안전부 장관은 14일 일본 도쿄에서 열린 동경특파원단 오찬 간담회에서 한일 양국이 동시에 직면한 지방소멸·인구감소 문제와 관련해 ""양국이 정책 경험을 공유하고 협력할 필요가 있다""고 밝혔다. 일본의 외국인 체류 제도와 비자 규제 강화 움직임과 관련해서는 ""우리 국민과 재일동포의 권익에 영향을 미칠 수 있는 사안인 만큼 정부도 상황을 계속 주시하고 있다""고 말했다.윤 장관은 이날 간담회에서 한일 양국이 공통적으로 겪고 있는 지방 인구..",,https://www.asiatoday.co.kr/kn/view.php?key=20260314010004108,아시아투데이
"국가안보실, 긴급회의…""北 탄도미사일, 안보리 결의 위반""",https://img.asiatoday.co.kr/file/2026y/03m/14d/20260314010004107_250.jpg?v=1773518979,"국가안보실은 14일 북한이 평양 인근에서 동해상으로 탄도미사일 10여 발을 발사한 것과 관련해 상황을 점검하고 조치사항을 점검하기 위해 '긴급안보상황점검회의'를 개최했다.국가안보실은 이날 ""국방부·합참 등 관계기관이 참석한 가운데 '긴급안보상황점검회의'를 개최했다""고 밝혔다.국가안보실은 이번 발사가 우리 안보에 미치는 영향을 살펴보고 필요한 조치 사항들을 점검했다. 국가안보실은 관계기관에 현재 한미연합연습 기간(3월9~19일)이라는 점을 감안..",,https://www.asiatoday.co.kr/kn/view.php?key=20260314010004107,아시아투데이
"日 방위성 ""北 미사일 여러 발 발사…EEZ 밖 낙하""",https://img.asiatoday.co.kr/file/2026y/03m/14d/20260314010004106_250.jpg?v=1773472976,"일본 방위성은 14일 북한이 동해상으로 탄도미사일 여러 발을 발사했다고 밝혔다. 미사일은 일본 배타적 경제수역(EEZ) 밖 해상에 낙하한 것으로 추정된다.교도통신과 NHK에 따르면 방위성은 미사일이 최고 고도 약 80km까지 상승한 뒤 북동쪽으로 약 340km 비행해 한반도 동해안 부근에 떨어진 것으로 분석했다. 일본 정부는 북한에 엄중히 항의하고 강하게 비난했다.다카이치 사나에 총리는 정보 수집·분석에 총력을 기울이고, 국민에게 신속한 정보..",,https://www.asiatoday.co.kr/kn/view.php?key=20260314010004106,아시아투데이
"[속보] 합참 ""北 발사 탄도미사일 약 350km 비행""",https://img.asiatoday.co.kr/file/2026y/03m/14d/20260314010004105_250.jpg?v=1773472373,"[속보] 합참 ""北 발사 탄도미사일 약 350km 비행""",,https://www.asiatoday.co.kr/kn/view.php?key=20260314010004105,아시아투데이
"삼성디스플레이 노사, 6.2% 임금인상 잠정합의",https://img.asiatoday.co.kr/file/2026y/03m/14d/20260314010004103_250.jpg?v=1773471452,"삼성디스플레이 노사가 올해 임금협약에 잠정 합의했다. 평균 임금인상률은 6.2%로, 기본 인상률 4.1%와 성과 인상률 2.1%를 합친 수치다.14일 업계에 따르면 삼성디스플레이는 전날 노사 협의에서 이같은 내용의 임금협약안을 도출했다. 이번 합의안에는 5년 단위 휴가 3일 신설, 무주택자 대상 주택 대부 도입, 고정 초과근무 시간 축소(14시간→12시간) 등도 포함됐다.보너스는 400만원 상당으로 자사 제품 구매에 사용할 수 있는 패밀리넷..",,https://www.asiatoday.co.kr/kn/view.php?key=20260314010004103,아시아투데이
"한-일 산업장관, 공급망 파트너십 체결…LNG 협력 본격화",https://img.asiatoday.co.kr/file/2026y/03m/14d/20260314010004102_250.jpg?v=1773471217,"한국과 일본이 글로벌 공급망 위기 대응을 위한 정례 협의체를 출범시키고 LNG 수급 안정 협력에 나선다. 미국-이란 전쟁으로 에너지 불안이 커지는 가운데 양국이 협력 체계를 강화한 것이다.14일 김정관 산업통상자원부 장관과 아카자와 료세이 일본 경제산업상은 도쿄에서 회담을 갖고 '한일 산업통상 정책대화' 신설에 합의했다. 해당 플랫폼은 통상협력, 경제안보, 공급망, 철강, 광물자원 등 양국 간 협력 의제를 종합 관리하는 창구가 된다.양측은 '..",,https://www.asiatoday.co.kr/kn/view.php?key=20260314010004102,아시아투데이
"'투타 제압' 당한 한국, 도미니카에 0-10 콜드패",https://img.asiatoday.co.kr/file/2026y/03m/14d/20260314010004100_250.jpg?v=1773470942,17년 만에 WBC(월드베이스볼클래식) 8강에 진출한 한국 야구가 도미니카공화국에 10-0 7회 콜드게임으로 패했다. 한국은 13일(현지시간) 미국 플로리다주 마이애미 론디포파크에서 열린 2026 WBC 8강전 도미니카공화국과 경기에서 결선 토너먼트 여정을 마쳤다. 한국 마운드는 메이저리거가 즐비한 도미니카 타선을 견디지 못했다.선발 류현진(한화 이글스)이 2회를 버티지 못하고 3점을 내주며 강판하자 한국 마운드는 와르르 무너졌다. 3회에만..,,https://www.asiatoday.co.kr/kn/view.php?key=20260314010004100,아시아투데이
"정부, 주가조작 신고 포상금 '상한 폐지'…이 대통령 직접 홍보",https://img.asiatoday.co.kr/file/2026y/03m/14d/20260314010004098_250.jpg?v=1773470374,"정부가 주가조작 신고 포상금 상한선을 폐지하고 적발·환수된 부당이득과 과징금의 최대 30%까지 포상금으로 지급하기로 하면서 이재명 대통령이 직접 신고를 독려하고 나섰다.금융위원회는 지난달 25일 자본시장 범죄 내부 고발 활성화를 위해 주가조작·회계 부정 등 신고 포상금 상한을 폐지한다고 밝혔다. 기존에는 포상금 상한이 있었으나, 이제는 적발 금액에 따라 수십억 원에서 수백억 원까지 받을 수 있게 됐다.이 대통령은 14일 엑스(X·옛 트위터)에..",,https://www.asiatoday.co.kr/kn/view.php?key=20260314010004098,아시아투데이
"트럼프 '러브콜' 보내자마자…北, 탄도미사일 10발 쐈다",https://img.asiatoday.co.kr/file/2026y/03m/14d/20260314001533132_250.jpg,"북한이 14일 동해상으로 탄도미사일 10여발을 발사했다. 합참은 ""우리 군은 오늘 오후 1시 20분께 북한 순안 일대에서 동해상으로 발사된 미상 탄도미사일 10여발을 포착했다""고 밝혔다. 그러면서 ""추가 발사에 대비해 감시 및 경계를 강화한 가운데 미국 및 일본 측과 북한 탄도미사일 관련 정보를 긴밀하게 공유하면서 만반의 대비태세를 유지하고 있다""고 밝혔다. 한미 정보당국은 북한 탄도미사일의 제원과 사거리 등을 분석 중..",,https://www.asiatoday.co.kr/kn/view.php?key=20260314001533132,아시아투데이
"北, 순안서 탄도미사일 10여 발 기습 발사...이례적 대규모 도발",https://img.asiatoday.co.kr/file/2026y/03m/14d/20260314010004097_250.jpg?v=1773470034,"북한이 14일 오후 1시 20분경 순안 일대에서 동해상으로 탄도미사일 10여발을 발사했다고 합동참모본부가 밝혔다. 한 번에 10발 이상을 발사한 것은 이례적이다.합참은 ""추가 발사에 대비해 감시 및 경계를 강화한 가운데 미국, 일본과 북한 탄도미사일 관련 정보를 긴밀하게 공유하며 만반의 대비태세를 유지하고 있다""고 전했다. 한미 정보당국은 미사일의 제원과 사거리를 분석 중이다.발사 시점은 한미연합훈련 '자유의 방패'(FS) 연습 기간이다. 한..",,https://www.asiatoday.co.kr/kn/view.php?key=20260314010004097,아시아투데이
[내일날씨] 포근한 봄날씨…수도권 미세먼지 '나쁨',https://img.asiatoday.co.kr/file/2026y/03m/14d/20260314010004095_250.jpg?v=1773468821,"일요일인 15일 포근한 봄 날씨가 이어지겠다.기상청에 따르면 이날은 전국이 대체로 흐리겠으나, 중부지방(강원영동 제외)과 전라권, 경상권서부는 밤부터 차차 맑아지겠다.아침 최저기온은 0∼6도, 낮 최고기온은 10∼15도로 당분간 예년과 비슷하겠다. 경기 동부와 강원내륙·산지, 경북 내륙은 아침 기온이 영하권에 머물겠다.미세먼지 농도는 수도권과 강원 영서, 충청권은 '나쁨', 그 밖의 지역은 '보통' 수준을 보이겠다.",,https://www.asiatoday.co.kr/kn/view.php?key=20260314010004095,아시아투데이
"北, 동해상 미상 발사체 발사…한미훈련 반발 무력시위",https://img.asiatoday.co.kr/file/2026y/03m/14d/20260314001355436_250.jpg,"북한이 14일 동해상으로 미상 발사체를 발사했다고 합동참모본부가 밝혔다. 합참은 북한 발사체의 제원과 사거리 등을 분석 중이다. 앞서 북한은 지난 1월 27일 동해상으로 탄도미사일을 발사한 바 있다. 북한 발사체가 탄도미사일로 확인되면 47일 만에 발사이며, 올해 들어 3번째다. 한미는 지난 9일부터 오는 19일까지 한반도 유사시에 대비한 전구(戰區)급 한미연합훈련인 '자유의 방패'(프리덤실드·FS) 연습을 진행 중이다...",,https://www.asiatoday.co.kr/kn/view.php?key=20260314001355436,아시아투데이
전자발찌 차고 교제 여성 살해한 40대 검거,https://img.asiatoday.co.kr/file/2026y/03m/14d/20260314010004091_250.jpg?v=1773462646,경기 남양주시에서 전자발찌를 착용한 채 교제하던 여성을 흉기로 찌르고 도주한 40대 남성이 경찰에 붙잡혔다.14일 남양주북부경찰서에 따르면 이날 오전 8시 58분께 남양주시 오남읍 한 길거리에서 30대 여성 B씨가 흉기에 찔렸다는 신고가 접수됐다. 출동한 경찰과 구급대원은 현장에서 심정지 상태의 B씨를 발견해 병원으로 이송했으나 결국 숨졌다. 피의자인 40대 남성 A씨는 차량을 몰고 와 길거리에 있던 B씨를 흉기로 찌른 뒤 도주한 것으로 전해..,,https://www.asiatoday.co.kr/kn/view.php?key=20260314010004091,아시아투데이
"류현진, 국가대표 은퇴 선언 ""끝맺음 아쉽지만 영광스러웠다""",https://img.asiatoday.co.kr/file/2026y/03m/14d/20260314001251112_250.jpg,"21세기 한국 최고의 투수 류현진(한화 이글스)이 국가대표 은퇴를 선언했다. 류현진은 14일(한국시간) 미국 플로리다주 마이애미 론디포파크에서 열린 2026 월드베이스볼클래식(WBC) 준준결승 도미니카공화국과 경기를 마치고 취재진과 만나 ""이제는 마지막인 것 같다""며 ""끝맺음이 아쉽지만, 이렇게 대표팀에 복귀해 후배들과 함께하게 돼 영광스러웠다""고 말했다. 2010년 광저우 아시안게임 이래 16년 만에 다시 태극마크를 단 류현진은..",,https://www.asiatoday.co.kr/kn/view.php?key=20260314001251112,아시아투데이
"한국 야구, 도미니카共에 완패…17년 만의 WBC 4강 진출 무산",https://img.asiatoday.co.kr/file/2026y/03m/14d/20260314001247139_250.jpg?v=1773460498,"한국 야구가 17년 만에 진출한 월드베이스볼클래식(WBC) 결선 무대를 8강에서 마감했다. 류지현 감독이 이끄는 한국은 14일(한국시간) 미국 플로리다주 마이애미 론디포파크에서 열린 2026 WBC 8강전 도미니카공화국과 경기에서 0-10으로 7회 콜드게임 패했다. 한국은 한 수 위 상대로 평가받는 도미니카공화국을 맞아 고전을 면치 못했다. 선발 류현진(한화 이글스)이 2회 3점을 내줬고, 3회에는 4명의 투수가 마운드에 올라..",,https://www.asiatoday.co.kr/kn/view.php?key=20260314001247139,아시아투데이
"트럼프·밴스 연쇄 회동, 한미 '펀더멘털' 다진 김민석 총리…북미 대화부터 301조 우려까지 조율",https://img.asiatoday.co.kr/file/2026y/03m/14d/20260314010004089_250.jpg?v=1773459686,"미국을 방문 중인 김민석 국무총리가 13일(현지시간) 워싱턴 D.C. 백악관에서 도널드 트럼프 미국 대통령과 전격적으로 회동했다. 당초 예정에 없던 만남이었으나, 트럼프 대통령은 김 총리와 20여분간 통역 없이 대화를 나누며 이달 말 중국 방문을 앞두고 김정은 북한 국무위원장과의 대화 가능성에 상당한 관심을 표명했다. 김 총리는 이번 방미를 통해 북·미 대화 재개의 단초를 마련하는 한편, 미국 행정부 고위급 인사들과 연쇄 회동하며 경제·통상..",,https://www.asiatoday.co.kr/kn/view.php?key=20260314010004089,아시아투데이
"트럼프, 이란 '석유 심장' 공격 ""한 주간 강한 타격할 것""",https://img.asiatoday.co.kr/file/2026y/03m/14d/20260314001122476_250.jpg,"도널드 트럼프 미국 대통령은 13일(현지시간) 자신의 지시에 따라 미군이 이란의 대표적인 원유 수출 터미널이 있는 하르그 섬을 공격했다고 밝혔다. 트럼프 대통령은 이날 기자들과 만난 자리에서 ""내 지시에 따라 미군 중부 사령부는 하르그 섬을 타격했다""고 소개했다. 다만 트럼프 대통령은 하르그 섬의 석유 관련 인프라를 제거하지는 않기로 했다고 말해 이 공격이 하르그 섬 내부의 군사 목표물을 주로 겨냥했음을 시사했다. 미군의..",,https://www.asiatoday.co.kr/kn/view.php?key=20260314001122476,아시아투데이
"제주 차귀도 10명 탑승 어선 화재…""인명구조 최우선""",https://img.asiatoday.co.kr/file/2026y/03m/14d/20260314001113112_250.jpg?v=1773455933,"제주 차귀도 인근 해상서 10명이 탑승한 어선에서 화재사고가 발생했다.14일 해양수산부에 따르면 이날 오전 9시 58분경 제주도 차귀도 남서방 약 47해리 해상에서 발생한 29톤 규모의 '제703유경호'에서 화재가 났다.유경호에 탑승한 선원은 10명이다. 김성범 해수부 장관 직무대행은 이날 오전 10시 ""구조가용 자원을 최대한 동원해 인명구조에 최선을 다할 것""을 지시했다.",,https://www.asiatoday.co.kr/kn/view.php?key=20260314001113112,아시아투데이
"남양주서 전자발찌 착용 40대, 교제 여성 흉기 살해 후 도주…경찰 추적",https://img.asiatoday.co.kr/file/2026y/03m/14d/20260314010004087_250.jpg?v=1773453570,"경기 남양주시에서 전자발찌를 착용한 남성이 30대 여성을 흉기로 찔러 살해한 뒤 도주해 경찰이 추적에 나섰다.14일 경찰에 따르면 이날 오전 9시께 남양주시 오남읍 한 길거리에서 30대 여성 B씨가 흉기에 찔렸다는 신고가 접수됐다. 출동한 경찰과 구급대원은 현장에서 심정지 상태의 B씨를 발견해 병원으로 이송했으나 결국 숨졌다. 피의자 A씨는 40대 남성으로, 차량을 이용해 B씨에게 접근한 뒤 흉기로 찌른 것으로 전해졌다. B씨는 보호조치를 받..",,https://www.asiatoday.co.kr/kn/view.php?key=20260314010004087,아시아투데이
'최고가격제' 이튿날 기름값↓…휘발유·경유 격차 축소,https://img.asiatoday.co.kr/file/2026y/03m/14d/20260314010004086_250.jpg?v=1773451311,"석유 최고가격제 시행 이튿날인 14일 전국 평균 주유소 기름값이 전날 대비 두 자릿수 하락세를 이어갔다.14일 한국석유공사 유가정보시스템 오피넷에 따르면 이날 오전 9시 기준 전국 주유소 평균 휘발유 가격은 ℓ당 1851.9원으로 전날보다 12.2원 내렸다. 경유는 같은 시각 1856.1원으로 16.6원 하락했다. 경유는 휘발유보다 여전히 높은 가격을 유지하고 있으나, 한때 20원 이상 벌어졌던 가격 격차는 크게 줄었다. 전국에서 기름값이 가..",,https://www.asiatoday.co.kr/kn/view.php?key=20260314010004086,아시아투데이
"李대통령 ""허위주장 그대로 옮기는 언론, 흉기보다 무서워""",https://img.asiatoday.co.kr/file/2026y/03m/14d/20260314010004083_250.jpg?v=1773448284,"이재명 대통령은 14일 ""사실 확인 없이 보도하는 언론, 의도적으로 조작왜곡보도하는 언론, 근거 없는 허위주장을 그대로 옮기는 무책임한 언론은 흉기보다 무서운 것""이라고 강조했다.이 대통령은 이날 엑스(X)에 20대 대선주자였던 자신에 대해 '조폭 연루설'을 제기한 장영하 국민의힘 경기 성남 수정구 당협위원장의 징역형 집행유예(징역 1년에 집행유예 2년)가 확정됐다는 소식을 전한 이건태 더불어민주당 의원의 글을 공유하며 이 같이 썼다. 이 대..",,https://www.asiatoday.co.kr/kn/view.php?key=20260314010004083,아시아투데이
[오늘날씨] 전국 흐리고 일교차 커…낮 최고 10~15도,https://img.asiatoday.co.kr/file/2026y/03m/14d/20260314010004082_250.jpg?v=1773447467,"토요일인 14일은 전국 대부분 지역이 일교차가 크고 대기가 건조한 초봄 날씨가 이어지겠다. 내륙을 중심으로는 낮과 밤의 기온차가 15도 안팎으로 크게 벌어지겠다.기상청에 따르면 이날은 낮과 밤의 기온차가 큰 가운데, 충청권내륙과 남부내륙에는 서리가 내리는 곳이 있겠다.아침 최저기온은 -3~-5도, 낮 최고기온은 10~15도로 예보됐다. 이날 하늘은 대체로 흐리겠지만, 제주도는 가끔 구름이 많겠다. 한반도가 동해북부 해상에서 동쪽으로 이동하는..",,https://www.asiatoday.co.kr/kn/view.php?key=20260314010004082,아시아투데이
"김민석 총리, 트럼프와 백악관 '깜짝 20분 회동'…""북미대화 재개 아이디어 제시""",https://img.asiatoday.co.kr/file/2026y/03m/14d/20260314010004081_250.jpg?v=1773445169,"김민석 국무총리는 13일(현지시간) 도널드 트럼프 미국 대통령과 북한 문제 등에 관해 약 20분간 대화를 나눴다고 밝혔다.미국을 방문 중인 김 총리는 이날 워싱턴 D.C. 한국문화원에서 한국 특파원단과 간담회를 갖고 이같이 말하고, ""대화 내용의 상당 부분이 북한 문제에 대한 제 견해를 묻는 것이었다""고 전했다.◇ 김민석 총리, 백악관서 트럼프 대통령 '깜짝 20분 회동'김 총리에 따르면 이날 낮 백악관에서 신앙사무국 국장인 폴라 화이트 목사..",,https://www.asiatoday.co.kr/kn/view.php?key=20260314010004081,아시아투데이
