title,thumbnail,short_content,write_time,link,company
"[PMPS] 강자는 돌아왔고, 신예는 올라왔다…‘PMWC 티켓’ 향한 도전 시작",https://img.asiatoday.co.kr/file/2025y/04m/18d/20250418001541561_250.jpg,"2025년 배틀그라운드 모바일 이스포츠의 시작을 알리는 정규 리그, ‘PMPS 2025 시즌 1’이 4월 18일 개막한다. 총 16개 팀이 참가하는 이번 시즌은 오는 5월 4일까지 이어지며, 우승 팀에게는 7월 사우디아라비아 리야드에서 열리는 ‘2025 펍지 모바일 월드컵(PMWC)’ 출전권이 주어진다.PMPS 2025 시즌 0에서 우승을 차지한 농심 레드포스, 지난 시즌 각기 다른 방식으로 존재감을 드러낸 DRX와 DK, 그리고 아마추어 리그..",,https://www.asiatoday.co.kr/kn/view.php?key=20250418001541561,아시아투데이
"여조업체 논란에 날세운 김동연, 李공약 해수부 이전에 전면 반박",https://img.asiatoday.co.kr/file/2025y/04m/18d/20250418010011161_250.jpg,"아시아투데이 이한솔 기자·황수영 인턴 기자 = '비명횡사 공천 여론조사 업체' 논란으로 더불어민주당과 날을 세우고 있는 김동연 민주당 대선 경선 후보가 해양수산부를 부산으로 옮기겠다는 이재명 예비후보의 공약에 정면으로 반박하고 나섰다.김 후보는 18일 서울 여의도 선거 캠프에서 '영남지역 공약'을 발표하며 이 후보의 '해수부 부산 이전' 공약과 관련해 ""해수부가 가는 것보다 정책금융기관이 한꺼번에 부산으로 가는 것이 일자리 확충에 더 도움이 된..",,https://www.asiatoday.co.kr/kn/view.php?key=20250418010011161,아시아투데이
"동양생명, 창립 36주년 기념 이노베이션 포럼·우수직원 시상식 개최",https://img.asiatoday.co.kr/file/2025y/04m/18d/20250418010011157_250.jpg,"동양생명은 창립 36주년을 맞아 서울 종로구 소재 동양생명 엔젤라운지에서 이노베이션 포럼과 우수직원 시상식을 개최했다고 18일 밝혔다.이노베이션 포럼은 임직원들의 최신 비즈니스 트렌드와 산업 전망에 대한 소양을 함양하고 역량을 강화하기 위해 마련된 자리로, 지난해 12월에 이어 두 번째로 개최됐다. 이번 포럼에는 김지현 IT 전문 칼럼니스트가 강사로 초청돼 'AI 특이점 시대, 보험업계는 무엇을 준비해야 하는가'를 주제로 약 1시간 30분에..",,https://www.asiatoday.co.kr/kn/view.php?key=20250418010011157,아시아투데이
"일본, '독도영유권 주장 전시관' 재개관… 외교부 ""즉시폐쇄 촉구""",https://img.asiatoday.co.kr/file/2025y/04m/18d/20250418010011155_250.jpg,"외교부는 일본이 도쿄에 독도 영유권을 주장하는 전시관을 재개관한 것에 대해 18일 ""강력히 항의하며, 즉시 폐쇄할 것을 다시 한 번 촉구한다""고 밝혔다.일본 정부는 이날 독도 영유권 주장이 담긴 국립 영토주권전시관을 재개관했다. 일본은 독도와 센카쿠 열도, 쿠릴열도 남단 4개 섬에 대해 영유권을 주장하는 전시관을 2018년 첫 개관했다. 이어 2020년 확장 이전했고, 이후 내부 시설을 보수하는 등 리모델링을 거쳐 이날 재개관했다.이에 한국..",,https://www.asiatoday.co.kr/kn/view.php?key=20250418010011155,아시아투데이
"BTS 진, 첫 단독 팬콘서트 투어… 6월 고양에서 시작",https://img.asiatoday.co.kr/file/2025y/04m/18d/20250418001535245_250.jpg,"방탄소년단(BTS) 진이 오는 6월부터 첫 단독 팬콘서트 투어를 시작한다. 첫 콘서트는 경기 고양에서 열린다.글로벌 팬 플랫폼 위버스에 29일 공지된 내용에 따르면 진의 팬콘서트 투어는 #RUNSEOKJIN_EP.TOUR in GOYANG 이라는 타이틀로 6월 28일부터 이틀간 고양종합운동장 보조경기장에서 개최된다.함께 공개된 포스터에는 진이 가죽 점퍼를 입은 록스타 콘셉트로 기타, 건반 등의 악기와 함께 포즈를 취하고 있다.‘#RUNSEOKJ..",,https://www.asiatoday.co.kr/kn/view.php?key=20250418001535245,아시아투데이
"태국 도발에, 강소휘 “2경기 다 이겨버리겠다”",https://img.asiatoday.co.kr/file/2025y/04m/18d/20250418010011150_250.jpg,"김연경(36)이 없는 한국 여자배구대표팀을 이끌어갈 차세대 주자인 강소휘(27)가 팀 동료의 도발에 아시아 강자 태국과 슈퍼매치를 2승으로 마무리하겠다고 출사표를 던졌다. 한국 여자배구 올스타팀은 19일과 20일 화성체육관에서 태국 올스타팀과 맞붙는다. 6년 만에 부활한 한국과 태국의 올스타 슈퍼매치다. 이에 앞서 18일 경기도 화성의 롤링힐스 호텔에서 개최된 기자회견에 모습을 드러낸 강소휘는 ""친선 경기라서 1승 1패를 목표로 삼았는데 타나..",,https://www.asiatoday.co.kr/kn/view.php?key=20250418010011150,아시아투데이
"현대하이카손해사정, SK스피드메이트와 친환경 부품 확대 MOU",https://img.asiatoday.co.kr/file/2025y/04m/18d/20250418010011148_250.jpg,"현대해상은 자회사 현대하이카손해사정과 SK스피드메이트가 친환경 부품 확대 및 외산차 수리 견적 플랫폼 정착을 위한 업무협약(MOU)을 체결했다고 18일 밝혔다.이번 협약식은 지난 10일 현대하이카손해사정 이재열 대표와 SK 스피드메이트 안무인 대표 등이 참석한 가운데 SK스피드메이트 본사 사옥에서 진행됐다.SK스피드메이트는 국내 수입차 부품 유통 시장을 선도하는 기업으로, 외산차 수리 견적 프로그램인 DAT(Deutsche Automobil..",,https://www.asiatoday.co.kr/kn/view.php?key=20250418010011148,아시아투데이
쿠팡 '착한상점'에 벤처기업 우수 제품 400개 선봬,https://img.asiatoday.co.kr/file/2025y/04m/18d/20250418010011145_250.jpg,벤처기업협회는 임원사 쿠팡과 우수 벤처기업의 판로 확대·상생 협력을 위한 '대한민국 벤처기업 특별기획전'을 오픈했다고 18일 밝혔다.대한민국 벤처기업 특별기획전은 쿠팡 내 상생 기획관인 '착한상점'에 별도 페이지로 개설되며 쿠팡에 입점한 벤처기업 중 우수 제품을 선별·홍보하고 판매 증대를 지원하는 기획전으로 오는 12월 31일까지 연중 상설 운영된다. 이번 기획전에는 약 30개사 협회 회원사가 참여해 총 400개 상품을 선보인다. 협회는 향후..,,https://www.asiatoday.co.kr/kn/view.php?key=20250418010011145,아시아투데이
"삼성화재, '카케어' 회원수 20만명 돌파",https://img.asiatoday.co.kr/file/2025y/04m/18d/20250418010011144_250.jpg,"삼성화재는 지난해 7월 보험업계 최초로 오픈한 모빌리티 일상생활 서비스 '카(Car)케어'의 회원수가 20만명을 돌파했다고 18일 밝혔다. 삼성화재 'Car케어' 서비스는 올해에도 '정기검사대행 서비스'와 '플랫폼 내 결제 완결형 시스템'을 도입해 서비스 경쟁력을 강화했다.'정기검사대행 서비스'는 삼성화재 애니카패밀리센터 직원이 직접 고객의 자택, 회사 등으로 방문하는 D2D(Door to Door)형태로 바쁜 직장인들에게 인기가 높다. 또한..",,https://www.asiatoday.co.kr/kn/view.php?key=20250418010011144,아시아투데이
"MG지역희망나눔재단, 아동·청소년 건강돌봄 지원 위한 보험료 2억원 지원",https://img.asiatoday.co.kr/file/2025y/04m/18d/20250418010011140_250.jpg,"MG새마을금고 지역희망나눔재단(이하 재단)은 청소년의 건강한 성장과 안전한 환경 조성을 위해 의료사각지대에 놓여있는 청소년들을 대상으로 질병·상해에 대한 보험가입을 지원할 계획이라고 18일 밝혔다.재단은 한국청소년수련시설협회와 협력해 취약계층 청소년 중 대상자를 발굴·모집하고, 가입 보험료 2억원을 전액 지원할 예정이다. MG희망나눔공제는 새마을금고중앙회의 공익형 의료보험상품으로 의료사각지대에 있는 청소년의 입원·수술·통원치료비 등을 종합적으..",,https://www.asiatoday.co.kr/kn/view.php?key=20250418010011140,아시아투데이
"산업부, 투르크메니스탄과 플랜트 협력 본격화",https://img.asiatoday.co.kr/file/2025y/04m/18d/20250418010011138_250.jpg,안덕근 산업통상자원부장관은 18일 서울 포시즌스호텔에서 바이무라트 아나맘메도프 투르크메니스탄 건설·산업부총리와 '한-투르크메니스탄 고위급 회담'을 갖고 양국 플랜트 협력을 논의했다.회담에 앞서 투르크멘화학공사에서 발주하고 대우건설이 시공사로 참여하는 약 1조원 규모의 '투르크메나밧 인산 비료플랜트' 기본합의서 서명식이 진행됐다. 투르크메나밧 지역의 풍부한 인광석에서 인산을 추출해 비료로 가공하는 시설로서 현지의 산업·농업 생산성 향상과 수출..,,https://www.asiatoday.co.kr/kn/view.php?key=20250418010011138,아시아투데이
"소상공인들 ""추경안 당장 위기 해소 미진""",https://img.asiatoday.co.kr/file/2025y/04m/18d/20250418010011137_250.jpg,"소상공인들은 18일 2025년 추가경정예산안 편성 관련해 ""내수부진과 고물가 등에 더해 통상전쟁으로 대내외적으로 위기에 처한 소상공인 지원을 위한 신규사업 편성과 기존 사업 확대로 소상공인 경영 환경 개선에 도움이 될 것으로 기대한다""는 입장을 밝혔다.소상공인연합회는 이날 ""정부는 국무회의를 열고 12조2000억원 규모의 추경안을 의결했다""며 ""재해대책과 통상리스크 대응, 민생회복 지원 등을 위해 편성된 이번 추경안에서 중소벤처기업부는 5조원..",,https://www.asiatoday.co.kr/kn/view.php?key=20250418010011137,아시아투데이
"한 대행, 탄핵정국 치안유지 '경찰 초청' 오찬 격려",https://img.asiatoday.co.kr/file/2025y/04m/18d/20250418010011136_250.jpg,"한덕수 대통령 권한대행 국무총리는 윤석열 전 대통령 탄핵 심판 기간 치안 질서를 유지한 경찰 지휘부와 현장 출동 경찰들을 삼청동 총리공관으로 초청해 18일 오찬 간담회를 열고 관계자들을 격려했다. 한 대행은 이날 오찬장에서 ""국가적으로 매우 민감하고 중요한 상황에서 경찰관들이 완벽하게 임무를 수행해 줬다""며 ""앞으로도 국민의 곁에서 안전한 대한민국을 만드는 역할을 계속해 주길 기대한다""고 밝혔다.이날 간담회엔 이호영 경찰청장 직무대행, 박현수..",,https://www.asiatoday.co.kr/kn/view.php?key=20250418010011136,아시아투데이
"KB손해보험, LIG그룹과 함께 '장애인 축구 발전기금' 전달",https://img.asiatoday.co.kr/file/2025y/04m/18d/20250418010011135_250.jpg,"KB손해보험은 장애인의 날을 앞두고 LIG그룹과 함께 대한장애인축구협회에 '장애인 축구 발전기금'을 전달했다고 18일 밝혔다.서울 송파구에 위치한 LIG 본사에서 진행된 이날 전달식에는 오병주 KB손해보험 경영관리부문장, 최용준 (주)LIG 대표 및 김기환 대한장애인축구협회장 등이 참석했다.이날 행사에서 KB손해보험과 LIG는 대한장애인축구협회에 '장애인 축구 발전기금' 1억8000만원을 전달했다. 전달된 발전기금은 장애인축구 국가대표 선수단..",,https://www.asiatoday.co.kr/kn/view.php?key=20250418010011135,아시아투데이
"'제4인뱅 철수' 더존비즈온, 제주銀 지분 인수…2대 주주 등극",https://img.asiatoday.co.kr/file/2025y/04m/18d/20250418010011134_250.jpg,제주은행은 18일 임시 이사회를 열고 더존비즈온을 대상으로 신주 566만9783주(약 570억원)를 배정하는 제3자 배정방식 유상증자 결의안을 승인했다고 밝혔다. 더존비즈온은 최근 제4인뱅 예비인가 신청을 철회한 더존뱅크 컨소시엄을 주도했던 기업이다.이번 유상증자로 더존비즈온은 제주은행의 지분을 14.99% 매입해 신한금융그룹에 이어 2대 주주가 됐다. 이는 현행법상 비금융주력자가 지방은행에 투자할 수 있는 최대 수준이다. 이에 신한금융의 제..,,https://www.asiatoday.co.kr/kn/view.php?key=20250418010011134,아시아투데이
"신한카드, 대전 갈마공원에 네 번째 에코존 조성",https://img.asiatoday.co.kr/file/2025y/04m/18d/20250418010011132_250.jpg,"신한카드는 서울그린트러스트와 함께 대전 서구 갈마공원에 네 번째 ECO Zone(이하 에코존)을 조성했다고 18일 밝혔다.에코존은 그린 캠페인 기금을 활용, 도시 노후공원을 녹생공원으로 재생해 지속가능한 친환경 공간을 만들어가는 신한카드의 건강한 공원만들기 프로젝트이다.지난 2021년 서울 성동구 서울숲에 첫번째 에코존을 조성한 이후, 부산 APEC나루공원, 광주 한새봉농업생태공원에 이어 네 번째 에코존을 개장함으로써 지역별로 필요한 에코존을..",,https://www.asiatoday.co.kr/kn/view.php?key=20250418010011132,아시아투데이
"신협재단, 6000명 아동 경제 멘토링에 7억8000만원 후원",https://img.asiatoday.co.kr/file/2025y/04m/18d/20250418010011127_250.jpg,"신협사회공헌재단(이하 신협재단)은 '2025년 신협 어부바 멘토링' 사업을 본격적으로 추진하기에 앞서 전국 6000명 아동의 건강한 성장을 지원하기 위한 후원금 7억8000만원을 한국사회복지협의회에 전달했다고 18일 밝혔다.'신협 어부바 멘토링'은 보건복지부, 신협재단, 한국사회복지협의회, 청소년금융교육협의회가 함께하는 대표적인 사회공헌 사업이다. 2025년에는 전국 237개 신협과 아동복지시설이 수행기관으로 참여하며, 협동과 경제를 주제로..",,https://www.asiatoday.co.kr/kn/view.php?key=20250418010011127,아시아투데이
"'日콘서트 취소' 태연 ""도둑맞은 느낌… 팬들에 미안""",https://img.asiatoday.co.kr/file/2025y/04m/18d/20250418001511242_250.jpg,"태연이 일본 도쿄 콘서트를 이틀 앞두고 급작스럽게 취소된 상황에 대해 ""허무하고 허탈하다""고 심경을 드러냈다.태연은 18일 팬 소통 플랫폼에 직접 입장을 전했다. 그는 ""일본 공연 취소 소식이 전해졌을 때 소원(팬덤명)이 걱정되고 마음이 너무 안 좋아서 무슨 말을 어떻게 해야 할지 모르겠다""고 털어놨다.그러면서 ""이 모든 상황이 너무 싫고 소원에게 미안하다. 모든 이의 노력과 기대감으로 만들어진 내 공연이 한순간에 날아가 버리고 도둑맞은 느낌이..",,https://www.asiatoday.co.kr/kn/view.php?key=20250418001511242,아시아투데이
"서울경찰, 4주간 이륜차 특별단속 4167건 적발",https://img.asiatoday.co.kr/file/2025y/04m/18d/20250418010011126_250.jpg,서울경찰청이 최근 한 달간 이륜차 특별단속을 실시해 이륜차 법규위반 4167건을 단속했다고 18일 밝혔다.서울경찰청은 지난 3월 17일부터 이달 13일까지 4주간 이륜차 특별단속을 벌여 △신호위반 1049건 △보도통행 133건 △안전모 미착용 962건 등 총 4167건을 단속했다.경찰은 해빙기에 따라 이륜차 운행이 증가하면서 교통사고를 사전에 예방하기 위해 이번 특별단속을 실시했다. 이에 서울경찰청 산하 서울 지역 31개 경찰서에서 이륜차 사..,,https://www.asiatoday.co.kr/kn/view.php?key=20250418010011126,아시아투데이
"정관장, ""정정한 그대, 그때 정말 좋았네"" 댓글 이벤트 진행",https://img.asiatoday.co.kr/file/2025y/04m/18d/20250418010011125_250.jpg,"정관장이 5월 가정의 달을 앞두고 댓글 이벤트를 진행한다.정관장은 오는 22일까지 '正(정)情(정)한 그대, 그때 정말 좋았네' 이벤트를 실시한다고 18일 밝혔다. 인생에서 가장 좋았던 시절을 댓글로 남긴 고객 중 추첨을 통해 '정관장 활기력', '스타벅스 모바일 상품권' 등의 경품을 제공한다. 이벤트는 정관장 공식 인스타그램과 정관장 공식 온라인몰 '정몰', '정관장 네이버 브랜드스토어'에서 참여할 수 있다.정관장은 같은 기간 정몰에서 제품..",,https://www.asiatoday.co.kr/kn/view.php?key=20250418010011125,아시아투데이
"NH농협생명, 2025년 농촌봉사활동 시작",https://img.asiatoday.co.kr/file/2025y/04m/18d/20250418010011123_250.jpg,"NH농협생명은 지난 17일 경기도 화성시 서신농협 관내 포도농가를 찾아 2025년 농촌봉사활동을 실시했다고 18일 밝혔다.봉사활동은 본격적인 영농철을 앞두고 일손 부족으로 어려움을 겪는 농가를 지원하기 위해 마련됐다.현장에는 박병희 대표이사를 비롯해 경영지원부 부서장과 본부 직원 등 30여 명의 임직원이 함께했다. 참가자들은 포도밭의 비닐 씌우기, 지주대 정비, 과수원 주변 쓰레기 수거 등 작업에 나서며 바쁜 일손을 도왔다.농촌봉사활동은 임직..",,https://www.asiatoday.co.kr/kn/view.php?key=20250418010011123,아시아투데이
"금감원, DB에 내부통제 전담조직 운영 미흡 등 경영유의사항 통보",https://img.asiatoday.co.kr/file/2025y/04m/18d/20250418010011119_250.jpg,금융감독원이 DB금융복합기업집단에 내부통제 전담조직의 운영 미흡 등 16건의 경영유의·개선사항을 통보했다.18일 금융당국에 따르면 금감원은 최근 DB 금융복합기업집단(대표 금융회사 DB손해보험)에 경영유의사항 7건과 개선사항 9건의 조치사항을 통보했다. 경영유의사항 및 개선사항은 금융회사의 주의 또는 자율적 개선을 요구하는 행정지도적 성격의 조치다.DB는 내규인 'DB금융복합기업집단 내부통제기준'에 따라 DB손보 준법감시인 직속으로 내부통제..,,https://www.asiatoday.co.kr/kn/view.php?key=20250418010011119,아시아투데이
"에너지공단, 지역특성 맞는 8개 분산에너지 비즈니스 모델 지원",https://img.asiatoday.co.kr/file/2025y/04m/18d/20250418010011115_250.jpg,한국에너지공단이 지역 기반의 에너지 생산·소비 체계 구축 및 지역 경제 활성화 지원을 위해 '2025년 미래 지역에너지 생태계 활성화 사업' 선정 주관기관들과 손을 맞잡았다. 에너지공단은 18일 서울 양재 엘타워에서 '2025년 미래 지역에너지 생태계 활성화 사업'에 최종 선정된 8개 주관기관 대표들과 업무협약(MOU)을 체결했다.미래 지역에너지 생태계 활성화 사업은 '분산에너지 활성화 특별법' 시행에 따라 지난해부터 지역 특성에 맞는 분산에..,,https://www.asiatoday.co.kr/kn/view.php?key=20250418010011115,아시아투데이
"""자동차는 이제 생활 공간""…LGD, 미래 모빌리티 디스플레이 전략은",https://img.asiatoday.co.kr/file/2025y/04m/18d/20250418010011113_250.jpg,"LG디스플레이가 미래 모빌리티의 변화와 중심에 디스플레이 기술의 전략적 중요성을 강조했다.손기환 LG디스플레이 상무는 18일 서울 양재동 엘타워에서 열린 'OLED & XR KOREA 2025'에서 기조연설을 통해 전기차(EV), 소프트웨어 중심 자동차(SDV), 그리고 인공지능(AI)을 자동차 산업의 '3대 패러다임'으로 꼽으며, 이 변화가 자동차 내부 구조는 물론 디스플레이 수요와 역할 자체를 근본적으로 바꾸고 있다고 설명했다.손..",,https://www.asiatoday.co.kr/kn/view.php?key=20250418010011113,아시아투데이
"DS단석, SAF 효과에 1분기 매출 11% 증가",https://img.asiatoday.co.kr/file/2025y/04m/18d/20250418010011111_250.jpg,"DS단석이 올 1분기 연결기준 매출이 지난해 동기 대비 10.9% 증가한 2424억원, 영업이익은 20.6% 증가한 91억원을 기록했다고 18일 밝혔다. 실적은 바이오에너지 사업부의 SAF(지속가능항공유) 목적 전처리 제품 매출액이 반영된데 따라 전년 동기 대비 상승했다는 설명이다.DS단석 관계자는 ""지난해 어려운 경영 여건 속에서도 전년 동기 대비 개선된 실적을 달성하게 됐다""며 ""앞으로도 점진적인 실적 개선세를 이어나갈 수 있도록 노력할..",,https://www.asiatoday.co.kr/kn/view.php?key=20250418010011111,아시아투데이
"혼다코리아, 모터사이클 'CB1000 호넷 SP' 50대 한정판매",https://img.asiatoday.co.kr/file/2025y/04m/18d/20250418010011110_250.jpg,"혼다코리아가 고성능 스포츠 네이키드 모터사이클 'CB1000 호넷 SP' 출시를 기념해, 50대 한정판매로 온라인 구매 상담 신청을 개시한다.18일 혼다코리아에 따르면 'CB1000 호넷 SP'은 스포티한 스타일링과 고성능을 바탕으로 다이내믹한 주행 경험은 물론, 다양한 첨단 편의 및 안전 사양으로 일상 주행에서도 편안하고 컨트롤 가능한 퍼포먼스를 실현했다. 호넷 시리즈의 최상위 트림으로서 국내에는 프리미엄 전용 파츠로 성능을 극대화한 SP..",,https://www.asiatoday.co.kr/kn/view.php?key=20250418010011110,아시아투데이
"""음료수 사줄까""…서울 강남 초교들서 '유괴미수' 의심신고",https://img.asiatoday.co.kr/file/2025y/04m/18d/20250418010011102_250.jpg,"서울 강남의 한 초등학교 앞에서 등하굣길에 오른 학생을 납치하려다 미수로 그쳤다는 신고가 잇달아 접수돼 경찰이 사실관계 파악에 나섰다.18일 서울 수서경찰서에 따르면 전날 오후 6시 20분께 강남구 역삼동 A초등학교 인근에 있던 남성 2명이 초등학교 2학년 남학생에게 ""음료수 사줄까""라고 물어봤다.이 학생은 ""괜찮다""라며 거절해 돌아갔고, 경찰은 이날 오전 A초교 측 신고를 받고 사실관계를 파악 중이다.A초교는 가정통신문을 통해 ""최근 학교..",,https://www.asiatoday.co.kr/kn/view.php?key=20250418010011102,아시아투데이
"그로서리 특화로 승부 건다…강동구, 대형마트 새 격전지로",https://img.asiatoday.co.kr/file/2025y/04m/18d/20250418010011107_250.jpg,"아시아투데이 이다혜 기자 서울 강동구가 대형마트 업계의 새로운 격전지로 부상하고 있다. 단순한 점포 확장이 아닌 식료품(그로서리) 중심의 특화 매장 전략을 전면에 내세웠다18일 유통업계에 따르면 강동 상권에는 홈플러스를 시작으로 롯데마트, 이마트까지 국내 주요 대형마트 3사가 잇따라 출점하며, 식료품 집중에 나섰다.가장 먼저 포문을 연 곳은 홈플러스다. 지난해 8월 '메가푸드마켓 강동점'을 열고, 신선식품과 간편식, 베이커리 등 식료품 구색을..",,https://www.asiatoday.co.kr/kn/view.php?key=20250418010011107,아시아투데이
'서울대 N번방' 주범 2심서 감형…왜?,https://img.asiatoday.co.kr/file/2025y/04m/18d/20250418010011109_250.jpg,동문 여학생의 사진을 합성해 음란물을 제작·유포한 혐의를 받는 이른바 '서울대 딥페이크 N번방' 사건의 40대 주범이 항소심에서 감형됐다. 서울고법 형사8부(김성수 김윤종 이준현 부장판사)는 18일 아동·청소년의 성보호에 관한 법률 위반(성 착취물 제작·배포 등) 등 혐의로 구속기소 된 주범 박모(41)씨에게 징역 10년을 선고한 원심 판결을 깨고 징역 9년을 선고했다. 함께 재판에 넘겨진 공범 강모씨도 이날 1심 징역 4년에서 3년 6개월로..,,https://www.asiatoday.co.kr/kn/view.php?key=20250418010011109,아시아투데이
'김프로' 국내 최초 '1억 유튜버' 등극… 얼마 벌었나?,https://img.asiatoday.co.kr/file/2025y/04m/18d/20250418001427175_250.jpg,"국내 최초로 구독자 1억명을 모은 유튜버가 탄생했다. 그 주인공은 '김프로' 다. 유튜브 채널 분석 사이트 '녹스인플루언서(kr.noxinfluencer.com)'에 따르면 '김프로'는 국내 개인, 전체 유튜브 채널 중 가장 가장 많은 구독자를 보유하고 있다. 한때 걸그룹 '블랙핑크' 채널에 밀려 2위에 있다 지난 3월 국내 1위 자리에 돌아왔다. 세계 기준으로도 14위에 달한다.녹스인플루언서에 따르면 김프로의 월 수익은 약 206억원, 연 수..",,https://www.asiatoday.co.kr/kn/view.php?key=20250418001427175,아시아투데이
"중진공, 美 관세 피해기업 사업장 찾아 간담회",https://img.asiatoday.co.kr/file/2025y/04m/18d/20250418010011104_250.jpg,"중소벤처기업진흥공단이 미국 트럼프 행정부의 '관세 폭탄' 정책으로 피해가 예상되는 기업들을 찾아 애로사항을 듣고 지원을 약속했다. 강석진 중진공 이사장은 18일 인천 부평구 소재의 ㈜오디에이테크놀로지 사업장을 방문해 미국 관세 부과에 따른 피해 중소기업과 간담회를 가졌다. 미국 트럼프 행정부의 철강, 알루미늄, 자동차 및 자동차 부품 등의 품목에 대한 25% 수준의 고율 관세를 부과에 따른 국내 중소기업의 피해 상황을 점검하고 지원방안을 마련..",,https://www.asiatoday.co.kr/kn/view.php?key=20250418010011104,아시아투데이
