title,thumbnail,short_content,write_time,link,company
"결과 필요한 홍명보호, 브라질전 대패 딛고 파라과이 사냥 나선다",https://img.asiatoday.co.kr/file/2025y/10m/12d/20251012010002195_250.jpg,홍명보 감독이 이끄는 축구 대표팀이 브라질전 대패를 딛고 파라과이 사냥에 나선다.대표팀은 14일 오후 8시 서울월드컵경기장에서 파라과이와 10월 A매치 평가전 두 번째 경기를 치른다. 이번 경기는 내년 북중미 월드컵 본선 조 추첨 포트 배정에 직접적인 영향을 줄 수 있기 때문에 브라질전 0-5 대패의 충격에서 벗어나는 것 이상의 의미가 걸린 일전이 될 전망이다.북중미 월드컵은 48개국을 4개 포트(12개국씩)로 나눈다. 개최 3개국을 제외하고..,,https://www.asiatoday.co.kr/kn/view.php?key=20251012010002195,아시아투데이
"법무부, '친일파' 이해승 후손에 토지 매각대금 78억원 반환 청구",https://img.asiatoday.co.kr/file/2025y/10m/12d/20251012010002190_250.jpg,"법무부가 친일반민족행위자 이해승의 후손이 토지를 매각해 얻은 부당이득금 약 78억원을 국가로 귀속하는 작업에 착수했다.법무부는 ""지난 10일 이해승이 취득했던 경기 의정부시 호원동 토지 31필지를 매각하고 얻은 부당이득금 약 78억원에 대해 서울중앙지방법원에 부당이득반환 청구의 소를 제기했다""고 12일 밝혔다.이해승은 1910년 일제로부터 후작 작위를 받은 후 일제가 패망할 때까지 귀족 지위와 특권을 누린 자로, 친일반민족행위진상규명위원회는..",,https://www.asiatoday.co.kr/kn/view.php?key=20251012010002190,아시아투데이
"北 황강댐 방류, 필승교 수위 1.8m…기후부 ""접경지역 국민 안전에 최선""",https://img.asiatoday.co.kr/file/2025y/10m/12d/20251012010002198_250.jpg,"기후에너지환경부는 지난 11일 오후 11시 경 촬영된 접경지역 위성 영상을 분석한 결과, 북측 황강댐에서 일부 방류가 이뤄진 것으로 추정했다고 12일 밝혔다.기후부는 하루에 1~2회 위성영상으로 접경지역을 감시하고, 집중호우 상황에서는 하루에 최대 3회까지 감시 중이다.지난 10일부터 북측 임진강 유역에 내린 지속적인 강우에 이어, 오는 13일부터 14일 기간 중 추가적인 강우가 예상됨에 따라 방류한 것으로 추정된다. 이날 9시 기준 군남댐..",,https://www.asiatoday.co.kr/kn/view.php?key=20251012010002198,아시아투데이
"“셀러 부담금 0원”…G마켓, '빅스마일데이' 셀러 유치전 나서",https://img.asiatoday.co.kr/file/2025y/10m/12d/20251012010002185_250.jpg,"G마켓과 옥션이 다음달 1일부터 11일까지 진행하는 '11월 빅스마일데이'에 함께 할 셀러를 오는 24일까지 모집한다. 빅스마일데이는 G마켓과 옥션이 매년 5월과 11월 두 차례 진행하는 대규모 온라인 쇼핑 행사다.12일 G마켓에 따르면 이번 행사는 신세계그룹과 알리바바 인터내셔널이 만든 조인트벤처(JV) 산하에서 처음으로 진행되는 만큼, 역대 최대 규모로 준비됐다. 셀러 지원을 대폭 강화해 상품 경쟁력을 높이고, 풍성한 혜택으로 소비자들에게..",,https://www.asiatoday.co.kr/kn/view.php?key=20251012010002185,아시아투데이
"軍 중견간부 이탈 급증, 신규 충원은 반토막…""심각한 균열""",https://img.asiatoday.co.kr/file/2025y/10m/12d/20251012010002189_250.jpg,"군의 중간급 간부 이탈이 증가 추세인 반면 신규 간부 충원은 꾸준히 감소하고 있는 것으로 드러났다.12일 국방부가 국회 국방위원회 유용원 국민의힘 의원에게 제출한 자료에 따르면, 임관 10년 이상 20년 미만 부사관·장교들의 희망전역과 휴직 건수는 지난해 창군 이래 최대치를 기록했다.희망전역 인원은 2021년 960명에서 2022년 1301명, 2023년 1495명, 지난해 1821명으로 증가했고, 올해도 지난달 말까지 총 1327명의 중간..",,https://www.asiatoday.co.kr/kn/view.php?key=20251012010002189,아시아투데이
"국힘 “캄보디아 참사, 뒤늦은 대통령 지시로 불안만 키워…외교공백 문제”",https://img.asiatoday.co.kr/file/2025y/10m/12d/20251012010002182_250.jpg,"국민의힘이 12일 캄보디아에서 발생한 한국인 대학생 고문 살해 사건을 계기로 이재명 정부의 외교 대응을 강하게 비판했다. 조용술 국민의힘 대변인은 이날 논평에서 ""국민이 위험에 처한 뒤에야 대통령이 지시를 내리는 사후 대응 행태가 되풀이되고 있다""며 ""국민 생명을 지키는 일보다 늦은 보고와 형식적 절차에 매달리고 있다""고 밝혔다.이어 ""캄보디아 내 한국인을 겨냥한 범죄가 수차례 발생했음에도 정부는 늘 '확인 중'이라는 답변만 반복했다""며 ""그..",,https://www.asiatoday.co.kr/kn/view.php?key=20251012010002182,아시아투데이
"내란특검, 조태용 이번 주 피의자 조사…尹 정부 인사 수사 막바지",https://img.asiatoday.co.kr/file/2025y/10m/12d/20251012010002154_250.jpg,"조은석 내란 특검팀이 이번 주 조태용 전 국가정보원장을 피의자 신분으로 소환 조사할 예정이다. 12·3 비상계엄 선포 당일 국무회의를 둘러싼 수사가 막바지에 접어든 가운데 내란 특검팀은 향후 외환 수사에 집중할 것이란 관측이 제기된다.12일 내란 특검팀 관계자는 본지와의 통화에서 조 전 원장 소환 일정과 관련해 ""구체적인 일정은 공개하지 않는 것이 원칙""이라면서도 ""다음 주 중 출석하기로 협의가 이뤄졌다""고 밝혔다. 조 전 원장이 비상계엄 선..",,https://www.asiatoday.co.kr/kn/view.php?key=20251012010002154,아시아투데이
"혁신당, 李정부 첫 국감 키워드 '투지'…""내란 청산·불평등 해소""",https://img.asiatoday.co.kr/file/2025y/10m/12d/20251012010002179_250.jpg,"조국혁신당은 12일 이재명 정부의 첫 국정감사 핵심키워드로 'TWO ZEROS(투지)'를 제시하며 강한 의지를 다졌다. 이는 '극우 내란세력 제로'와 '격차·불평등 제로'를 의미한다. 서왕진 혁신당 원내대표는 이날 국회에서 열린 기자간담회에서 ""혁신당의 강한 투지를 보여드리겠다는 뜻도 있다""며 이같이 밝혔다.서 원내대표는 ""윤석열·김건희 정권의 내란과 국정혼란을 뒷받침한 인물, 제도, 정책을 남김없이 발굴하고 청산하겠다""고 했다. 안창호 인권..",,https://www.asiatoday.co.kr/kn/view.php?key=20251012010002179,아시아투데이
"與 ""국감서 尹정부 1060일 파헤칠 것…국힘 '민생국감' 주장은 적반하장""",https://img.asiatoday.co.kr/file/2025y/10m/12d/20251012010002178_250.jpg,"더불어민주당이 다가오는 국정감사를 '윤석열 정부의 망가진 1060일을 철저히 파헤치는 국감'으로 규정했다. 양평 공무원 사망 사건에 대해서는 ""고인의 죽음을 정쟁화하는 국민의힘은 특검 흔들기를 멈추라""고 촉구했다. 박수현 민주당 수석대변인은 12일 오전 국회 본청에서 열린 기자간담회 모두발언에서 국민의힘의 '민생 국감' 주장을 '적반하장', '후안무치'라고 비판하며 이같이 말했다.박 수석대변인은 국민의힘이 ""이재명 정부에 의해 박살 난 130..",,https://www.asiatoday.co.kr/kn/view.php?key=20251012010002178,아시아투데이
"이창용 한은 총재, 美 워싱턴 행…G20 회의·IMF-WBG 연차총회 참석",https://img.asiatoday.co.kr/file/2025y/10m/12d/20251012010002128_250.jpg,"이창용 한국은행 총재가 세계 주요국 재무·통화당국 수장들이 한자리에 모이는 G20 재무장관·중앙은행총재 회의와 IMF·세계은행(WBG) 연차총회에 참석한다. 12일 한국은행에 따르면, 이창용 총재는 미국 워싱턴DC에서 열리는 'G20 재무장관·중앙은행총재 회의' 및 'IMF·WBG 연차총회'에 참석하기 위해 오는 13일 출국해 18일 귀국할 예정이다.이 총재는 이번 G20 회의에서 회원국 재무장관과 중앙은행 총재, 국제금융기구 인사들과 함께..",,https://www.asiatoday.co.kr/kn/view.php?key=20251012010002128,아시아투데이
"입양기록물 국가 관리체계 구축…""전문시설에서 위탁 보존""",https://img.asiatoday.co.kr/file/2025y/10m/12d/20251012010002116_250.jpg,"보건복지부와 국가기록원, 아동권리보장원이 입양기록물의 안전한 보존을 위해 상호 협력체계를 구축한다.복지부는 국가기록원, 아동권리보장원과 지난 10일 국가기록원 성남분원에서 입양기록물의 안전한 보존관리를 위한 업무협약을 체결했다고 12일 밝혔다.이번 협약은 지난 7월 공적입양체계 시행에 따라 아동권리보장원으로 이관된 입양기록물을 안전하고 체계적으로 보존할 수 있도록 국가 차원의 전문적인 관리체계를 구축하기 위해 이뤄졌다. 앞서 국가기록원에서 입..",,https://www.asiatoday.co.kr/kn/view.php?key=20251012010002116,아시아투데이
"소상공인들 ""대법원 주휴수당 판결 공정 보상 원칙 확립""",https://img.asiatoday.co.kr/file/2025y/10m/11d/20251011010001977_250.jpg,"소상공인들은 12일 대법원의 주휴수당 관련 판결에 대해 ""대법원이 일주일 동안 실제 근로한 시간에 비례해 주휴수당을 지급하라는 취지의 판결을 내린 것에 대해 적극적으로 환영한다""는 입장을 밝혔다.소상공인연합회는 이날 ""대법원은 격일제 근무로 일주일 중 일한 날이 5일에 미치지 못했다면 주 5일 근무자보다 적은 주휴수당을 지급해야 한다는 취지의 판결을 내린 것으로 알려졌다""며 ""이번 대법원의 판결을 상식적이고 합리적인 판단으로 평가하며 주휴수당..",,https://www.asiatoday.co.kr/kn/view.php?key=20251011010001977,아시아투데이
"중기부, 내년 전통시장·상점가 활성화지원 모집 공고",https://img.asiatoday.co.kr/file/2025y/10m/10d/20251010010001868_250.jpg,"중소벤처기업부는 '2026년 전통시장·상점가 활성화 지원사업' 참여 대상을 13일부터 11월 7일까지 모집한다고 12일 밝혔다.이번 공고는 '전통시장 및 상점가 육성을 위한 특별법' 제2조에 따른 전통시장, 상점가, 골목형상점가 등을 대상으로 문화관광형시장, 시장경영지원(구 시장경영패키지), 지역상품전시회, 전국우수시장박람회 개최지 등 총 4개 사업에 대해 모집한다.이중 문화관광형시장의 경우 신청 단계에서 자가 진단을 통해 유형 분류(문화거점..",,https://www.asiatoday.co.kr/kn/view.php?key=20251010010001868,아시아투데이
"종합금융그룹으로 도약한 우리금융, 계열사 특판 상품 공개",https://img.asiatoday.co.kr/file/2025y/10m/12d/20251012010002152_250.jpg,"우리금융그룹은 동양생명과 ABL생명 인수 이후 종합금융그룹으로서의 첫해를 맞아 그룹 공동 고객 사은 행사인 '우리금융 다함께 페스타(우다페)'를 개최한다고 12일 밝혔다.이번 행사는 오는 13일부터 이달 말까지 '우리WON뱅킹' 앱에서 진행된다. 우리은행·우리금융저축은행·우리투자증권·우리카드·동양생명·ABL생명 등 7개 계열사가 참여하며, 적금상품·미니보험·해외주식 소수점 증정 등 총 30여종의 특판 상품과 이벤트가 제공된다.우선 우리은행은..",,https://www.asiatoday.co.kr/kn/view.php?key=20251012010002152,아시아투데이
한여름 전차 내부 50도까지 치솟아도 '에어컨 탑재' 예산은 전액 미반영,https://img.asiatoday.co.kr/file/2025y/10m/12d/20251012010002151_250.jpg,"한 여름 전차 내부 온도가 50도에 육박함에도 장병의 생명과 인권 보호를 위한 전차 냉방장치 설치 예산이 전액 미반영된 것으로 드러났다. 12일 국방부가 국회 국방위원회 유용원 국민의힘 의원에게 제출한 자료에 따르면, K1 전차는 외부온도 섭씨 35도에서 1시간을 운용하게 되면 내부온도가 섭씨 약 50도까지 급상승했다. 성능개량 장비인 냉방장치를 가동하면 내부 온도는 섭씨 약 22도까지 떨어졌다.다만 기획재정부는 올해 예산 심사 과정에서 '..",,https://www.asiatoday.co.kr/kn/view.php?key=20251012010002151,아시아투데이
"美 CDC, 셧다운 기간 직원 1000여명에 해고 통지서 발송",https://img.asiatoday.co.kr/file/2025y/10m/12d/20251012010002150_250.jpg,"미국 질병통제예방센터(CDC)가 최근 연방정부 셧다운(업무 정지)이 시작된 이래 전 부서의 직원 1000명 이상에게 해고를 통지한 것으로 전해졌다.워싱턴포스트(WP)는 셧다운 11일째를 맞은 11일(현지시간) 통보 대상에 감염병 발생 대응 부서, 과학·보건 데이터 분석 및 정책 개발 부서, 직원 안전 감독 부서 등이 포함됐다고 인사 조치에 관여한 관계자들 등을 인용해 보도했다.또 홍역 확산에 대응하고 있는 CDC 책임자들과 연방정부 내 여러..",,https://www.asiatoday.co.kr/kn/view.php?key=20251012010002150,아시아투데이
이집트서 '가자 정상회의'…트럼프 등 20개국 정상 참석,https://img.asiatoday.co.kr/file/2025y/10m/12d/20251012010002146_250.jpg,"도널드 트럼프 미국 대통령 등 20개국 정상이 참석하는 회의가 이집트 휴양지 샤름엘셰이크에서 열린다. 11일(현지시간) AP·AFP통신 등 외신에 따르면 샤름엘셰이크에서 트럼프 대통령과 압델 파타 엘시시 대통령이 주재하는 가자 평화를 위한 정상회의가 13일 개최된다. 이집트 대통령실은 11일 성명에서 ""트럼프 대통령이 오는 13일 이집트에서 열리는 중동 평화 정상회의를 공동 주재할 예정""이라며 ""회의에서는 가자 재건, 팔레스타인 통치 구조,..",,https://www.asiatoday.co.kr/kn/view.php?key=20251012010002146,아시아투데이
"미얀마 군정 ""말레이, 선거감시단 보낼 것""…말레이 ""아세안서 논의할 사안"" 선 긋기",https://img.asiatoday.co.kr/file/2025y/10m/12d/20251012010002142_250.jpg,미얀마 군사정권이 올해 연말 실시 예정인 총선의 정당성을 확보하기 위해 아세안(ASEAN·동남아시아국가연합)을 향해 '선거 감시단 파견'이라는 카드를 꺼내 들었다. 12일(현지시간) 로이터 등에 따르면 말레이시아 외교부는 지난 10일 밤 성명을 통해 미얀마 군사정권이 아세안 모든 회원국들에게 올해 연말 실시될 미얀마 총선에 선거 감시단을 파견해줄 것을 공식 요청했다고 밝혔다. 앞서 지난 10일 미얀마 국영 언론인 글로벌뉴라이트오브미얀마는 전..,,https://www.asiatoday.co.kr/kn/view.php?key=20251012010002142,아시아투데이
"핸들 없는 자율주행 마을버스, 동대문·서대문 달린다",https://img.asiatoday.co.kr/file/2025y/10m/12d/20251012010002139_250.jpg,"서울시가 오는 14일부터 자율주행 마을버스 '동대문A01'을, 15일부터는 '서대문A01' 운행에 들어간다. 시는 지난 6월 동작구에서 첫선을 보인 '자율주행 마을버스'가 90% 이상 높은 만족도를 기록하며 안정적으로 운행되고 있는 가운데 이달부터 동대문구, 서대문구로 확대 운행된다고 12일 밝혔다. 내년 하반기 유상 운송으로 전환되기 전까지 시민 누구나 무료로 이용할 수 있다.운행에 앞서 동대문구는 13일 동대문구청 앞 광장에서, 서대문구는..",,https://www.asiatoday.co.kr/kn/view.php?key=20251012010002139,아시아투데이
"바이든, 전립선암 진단 후 호르몬·방사선 병행 치료 돌입",https://img.asiatoday.co.kr/file/2025y/10m/12d/20251012010002138_250.jpg,"조 바이든 전 미국 대통령이 전립선암 치료를 위해 방사선 치료를 받고 있다고 AP 통신, 로이터 통신 등이 11일(현지시간) 보도했다. 바이든의 보좌관 켈리 스컬리는 ""전립선암 치료 계획의 일환으로 바이든 전 대통령은 현재 방사선 치료와 호르몬 치료를 받고 있다""고 전했다.방사선 치료는 5주에 걸쳐 진행될 것으로 예상되며 바이든이 이미 알약 형태의 호르몬 약물을 복용하고 있다고 미 NBC 뉴스는 전했다.바이든은 지난 5월 전립선암 진단을 받았..",,https://www.asiatoday.co.kr/kn/view.php?key=20251012010002138,아시아투데이
최근 5년간 신규 법관 10명 중 1명 '김앤장 출신',https://img.asiatoday.co.kr/file/2025y/10m/12d/20251012010002125_250.jpg,"최근 5년간 새로 임용된 법관 10명 중 1명은 김앤장 법률사무소 출신으로 나타났다.12일 국회 법제사법위원회 위원장인 추미애 더불어민주당 의원이 대법원으로부터 받은 '최근 5년간(2021∼2025년) 신임법관 임용 현황' 자료에 따르면 올해 신규 임용된 5년 이상 법조 경력자 법관 153명 중 로펌 등 변호사 출신은 68명(44.4%)으로 파악됐다.소속 로펌별로 보면 김앤장 출신이 14명으로 가장 많고, 화우 6명, 세종과 태평양 각각 4명..",,https://www.asiatoday.co.kr/kn/view.php?key=20251012010002125,아시아투데이
"마늘·양파·보리, 수입안정보험 가입 시작… 지역 농·축협서 판매",https://img.asiatoday.co.kr/file/2025y/10m/12d/20251012010002136_250.jpg,"세종// 마늘·양파·보리에 대한 '농업수입안정보험' 가입이 이달부터 순차적으로 시작된다.12일 농림축산식품부에 따르면 마늘은 오는 13일부터, 양파와 보리는 20일부터 전국 지역 농·축협을 통해 가입할 수 있다.농업수입안정보험은 자연재해·화재 등으로 인한 수확량 감소 및 시장가격 하락 등으로 보험 가입연도 수입(收入)이 과거 평균 수입(收入)의 일정 수준 미만으로 감소하는 경우 감소분 전액을 보상하는 제도다. 농식품부 관계자는 ""지난 2001년..",,https://www.asiatoday.co.kr/kn/view.php?key=20251012010002136,아시아투데이
"서울시, '안심통장' 4000억 지원 조기마감…중·저신용자 절반",https://img.asiatoday.co.kr/file/2025y/10m/12d/20251012010002118_250.jpg,"서울시가 전국 최초로 시행한 자영업자 전용 마이너스 통장 사업 '안심통장' 2호가 시행 30영업일 만에 자금 소진으로 조기 마감된다. 1호 사업(58영업일) 대비 한 달 이상 빠른 속도다. 12일 시에 따르면, 안심통장 2호는 추석을 앞두고 자금 유동성 위기에 놓인 자영업자의 신청이 몰리면서 하루 최대 3135명이 접수됐다. 시는 1·2호 사업을 통해 총 4만명의 자영업자에게 4000억원의 긴급 자금을 공급하며 금융 안전망 역할을 했다고 설명..",,https://www.asiatoday.co.kr/kn/view.php?key=20251012010002118,아시아투데이
AI·디지털 특화 청년취업사관학교 구로캠 개관…취업률 75%,https://img.asiatoday.co.kr/file/2025y/10m/12d/20251012010002104_250.jpg,서울시가 평균 취업률 75%를 기록하는 청년취업사관학교의 24번째 캠퍼스인 '구로캠퍼스'를 13일 개관하고 본격 운영에 들어간다. 시의 인공지능(AI) 인재 양성 거점이 서울 전역으로 확산되고 있다.시는 구로구 오류2동 서울시 50플러스 남부캠퍼스 지하 1층에 조성한 구로캠퍼스를 통해 AI·디지털 분야 실무형 청년 인재 양성을 강화한다고 12일 밝혔다. 청년취업사관학교는 2021년 영등포 캠퍼스를 시작으로 서울 전역에 23개 캠퍼스를 운영 중..,,https://www.asiatoday.co.kr/kn/view.php?key=20251012010002104,아시아투데이
"정진욱 ""중기부 산하 공고, 전문교과 교사 4명 중 3명 기간제...안정성 우려""",https://img.asiatoday.co.kr/file/2025y/10m/12d/20251012010002132_250.jpg,"더불어민주당 정진욱 국회의원(광주 동남갑)은 중소벤처기업부(중기부) 산하 국립공업고등학교의 전기전자·기계 등 전문교과 교사 편성이 기간제 위주로 운영되면서 교육의 안정성이 심각하게 훼손되고 있다고 지적했다. 정 의원은 특히 전문교과 분야 교사 4명 중 3명(74.6%)이 기간제라며 안정적 교사 충원과 처우 개선을 위한 제도가 필요하다고 강조했다.12일 정 의원이 중기부로부터 제출받은 자료에 따르면, 구미전자공고·부산기계공고·전북기계공고 등 중..",,https://www.asiatoday.co.kr/kn/view.php?key=20251012010002132,아시아투데이
공명당 이탈…일본 우경화의 가속 페달 밟다,https://img.asiatoday.co.kr/file/2025y/10m/12d/20251012010001999_250.jpg,"공명당의 연정 이탈은 단순한 정당 간 정치적 거리 조정이 아니다. 이는 일본 정치의 '비핵·평화주의 견제축'이 해체되는 상징적 장면이다. 과거 공명당은 자민당의 강경 안보 노선에 제동을 거는 균형추 역할을 해 왔다. 그러나 공명당이 이탈할 경우, 자민당은 그간의 억제 장치 없이 더욱 우경화의 길을 걷게 될 가능성이 크다.자민당 내 보수 우파 세력 및 개헌 추진위원회 계열은 이미 유신회(日本維新の) 등 중도 우파 세력과의 연대 가능성을 염두에..",,https://www.asiatoday.co.kr/kn/view.php?key=20251012010001999,아시아투데이
"'빼빼로데이' 대목 잡아라…롯데웰푸드, 한정 컬래버 온팩 공개",https://img.asiatoday.co.kr/file/2025y/10m/12d/20251012010002127_250.jpg,롯데웰푸드는 다가오는 '빼빼로데이'를 맞아 다양한 컬래버레이션 온팩 '빼빼로'를 선보인다고 12일 밝혔다.빼빼로의 글로벌 앰배서더인 '스트레이 키즈'가 담긴 빼빼로데이 한정판 온팩은 '빼빼로 아몬드'와 '빼빼로 크런키' 두 가지 맛에 적용됐으며 8개입 패키지로 만나볼 수 있다. 각 맛마다 두 가지 버전의 디자인이 준비돼 있으며 패키지 속에는 3종의 디자인을 모두 포함해 무작위로 8개 들어가 있다.'캐치! 티니핑' 컬래버 패키지는 티니핑 시즌6..,,https://www.asiatoday.co.kr/kn/view.php?key=20251012010002127,아시아투데이
"롯데마트 발리점, 리뉴얼 후 매출·객수↑…도소매 융합 모델 효과 '톡톡'",https://img.asiatoday.co.kr/file/2025y/10m/12d/20251012010002126_250.jpg,"롯데마트가 도매와 소매의 강점을 결합해 선보인 하이브리드형 매장, 인도네시아 발리점이 성과를 보였다.롯데마트는 지난 8월 21일 재단장한 발리점이 오픈 직후부터 지난 10일까지 7주간 누계 매출이 리뉴얼 이전 대비 50% 상승했으며 객수는 약 3배 증가했다고 12일 밝혔다. 'K-푸드와 신선식품 중심의 먹거리 진열 확대 전략'이 현지 소비자와 해외 관광객에게 주효했다는 분석이다.발리점에서 가장 큰 호실적을 보이는 곳은 '롱 델리 로드'다. 롯..",,https://www.asiatoday.co.kr/kn/view.php?key=20251012010002126,아시아투데이
"귀주대첩 영웅, '시민 강감찬'으로 태어나다…관악강감찬축제 개막",https://img.asiatoday.co.kr/file/2025y/10m/12d/20251012010002120_250.jpg,"서울 관악구가 귀주대첩의 영웅 '강감찬 장군'의 호국정신을 기리는 '2025 관악강감찬축제'를 17일부터 19일까지 3일간 낙성대공원 일대에서 개최한다.12일 구에 따르면, 관악강감찬축제는 서울시 대표 역사 문화축제로 지난해 문화체육관광부가 전국 1200여 개 지역 축제 중 선정한 '예비 문화관광축제'다. 서울시에서는 유일하게 2020년에 이어 2회째 선정됐다.낙성대는 강감찬 장군이 태어난 곳으로 '별이 떨어진 터'라는 뜻인데, 장군이 태어날..",,https://www.asiatoday.co.kr/kn/view.php?key=20251012010002120,아시아투데이
"트럼프 ""셧다운 지속시 R&D 예산으로 군인 급여 지급""",https://img.asiatoday.co.kr/file/2025y/10m/12d/20251012010002122_250.jpg,"도널드 트럼프 미국 행정부가 미 연방정부 셧다운(업무정지) 사태가 계속될 경우, 미군 급여를 연구개발(R&D) 예산에서 충당하기로 했다.트럼프 대통령은 11일(현지시간) 자신의 소셜미디어(SNS) 트루스 소셜에 ""나는 군 통수권자로서의 내 권한을 활용해 피트 헤그세스 전쟁부(국방부) 장관에게 우리 군인들이 10월 15일에 급여를 받을 수 있도록 모든 사용 가능한 자금을 사용하라고 지시했다""고 말했다.트럼프 대통령은 구체적인 재원 규모나..",,https://www.asiatoday.co.kr/kn/view.php?key=20251012010002122,아시아투데이
