title,thumbnail,short_content,write_time,link,company
[속보] 檢 '공직선거법 위반' 이재명 2심도 징역 2년 구형,https://img.asiatoday.co.kr/file/2025y/02m/26d/20250226010014324_250.jpg,"조기대선의 가장 큰 변수로 꼽히는 이재명 더불어민주당 대표의 공직선거법 위반 사건에서 검찰이 항소심에서도 이 대표에게 법정최고형인 징역 2년을 구형했다. 검찰은 26일 서울고법 형사6-2부(최은정 이예슬 정재오 부장판사) 심리로 열린 이 대표의 공직선거법 위반 혐의 항소심 결심 공판에서 이 같이 구형했다. 검찰은 ""피고인의 대선 행보에 가장 걸림돌이 되는 대장동 리스크에 관련해 국민의 관심이 최고조에 다다른 상태에서 당시 성남 시장이었던 피고..",,https://www.asiatoday.co.kr/kn/view.php?key=20250226010014324,아시아투데이
연매출 40조 돌파 쿠팡… 'AI·글로벌' 영토확장으로 점프업,https://img.asiatoday.co.kr/file/2025y/02m/27d/20250227010014323_250.jpg,"쿠팡의 기세가 거침이 없다. 지난해 국내 유통기업 중 처음으로 연매출 40조원을 돌파했다. 올해는 전년 대비 매출 20% 확대가 목표다. 더 큰 미래도 그린다. 쿠팡의 성공DNA를 적용한 글로벌 영토확장, 수익 개선의 원동력이 된 로보틱스와 자동화에 속도를 낸다는 계획이다. 김범석 쿠팡Inc 의장은 ""우리의 성장 스토리가 한국을 넘어 세계로 뻗어나가고 있다""고 자신했다.◇ 거침없는 '쿠팡 파워'쿠팡Inc는 26일(한국시간) 미국..",,https://www.asiatoday.co.kr/kn/view.php?key=20250227010014323,아시아투데이
"환경부 ""봄철 고농도 초미세먼지 범정부 총력대응""",https://img.asiatoday.co.kr/file/2025y/02m/26d/20250226010014321_250.jpg,"세종// 환경당국이 봄철 고농도 초미세먼지(PM-2.5) 발생에 대비해 관계부처와 함께 총력대응 체제를 가동한다. 봄철을 맞아 오염도가 높거나 교통량이 많은 도로에 대해 청소차 운영을 일 최대 4회까지 확대하고, 건설공사장의 날림(비산)먼지 저감조치와 대기관리권역 내 관급공사장의 노후건설기계 사용제한 이행에 대해서도 단속을 강화한다.26일 환경부에 따르면 정부는 △생활공간 국민건강 보호 △주요 오염원 집중관리 △공공부문 배출저감 확대 △현장소통..",,https://www.asiatoday.co.kr/kn/view.php?key=20250226010014321,아시아투데이
"트와이스, '스토킹, 안 봐줘!'",https://img.asiatoday.co.kr/file/2025y/02m/26d/20250226010014320_250.jpg,"인기 걸그룹 트와이스가 스토커를 대상으로 법적 대응을 예고했다.이들의 소속사인 JYP엔터테인먼트는 26일 ""최근 트와이스 멤버들을 대상으로 특정인이 망상에서 비롯된 부적절한 내용과 사진을 포함해, 직장과 주거 지역 등 아티스트 주변을 지속적으로 맴돌고 있다는 사실을 명시하는 편지들을 무분별하게 발송하고 있다""면서 ""이 같은 행위로 해당 아티스트는 물론 아티스트 주변에 계신 분들까지 심각한 정신적 피해와 불안에 시달리고 있다""고 밝혔다.이어 ""..",,https://www.asiatoday.co.kr/kn/view.php?key=20250226010014320,아시아투데이
"尹 정치개혁 의지에…""집권당이 나서야""",https://img.asiatoday.co.kr/file/2025y/02m/26d/20250226010014319_250.jpg,"윤석열 대통령이 지난 25일 헌법재판소(헌재)의 탄핵심판 최후진술에서 '정치개혁을 이루겠다'며 복귀 의지를 피력한 가운데, 집권여당이 직접 나서서 현안 해결에 앞장서야 한다는 목소리가 정치권 안팎으로 제기된다. 26일 여권에 따르면 국민의힘은 윤 대통령이 직무 복귀를 전제로 한 개헌 발언을 부각하며 탄핵 반대 여론전에 나선다는 방침이다. 우선 국민의힘은 오는 27일 개헌특위를 발족한다. 위원장에는 6선 주호영 의원이 맡고, 특위를 계기로 개헌..",,https://www.asiatoday.co.kr/kn/view.php?key=20250226010014319,아시아투데이
"BNK금융, 캠코와 '청렴·윤리경영 협의회' 개최",https://img.asiatoday.co.kr/file/2025y/02m/26d/20250226010014314_250.jpg,"BNK금융그룹은 지난 25일 부산 남구 부산국제금융센터에서 캠코(한국자산관리공사)와 함께 '청렴·윤리경영 협의회'를 개최했다고 26일 밝혔다.이번 협의회는 지역 금융그룹과 공공기관이 협력해 윤리경영 실천을 강화하고, 청렴 기업 문화를 조성하기 위한 공동 노력의 일환으로 마련됐다. 협의회에는 BNK금융지주 및 BNK부산은행의 윤리경영부 관계자와 캠코 준법경영실 관계자들이 참석했다. 양 기관 관계자들은 청렴·윤리경영 우수 정책사례를 공유하고 올해..",,https://www.asiatoday.co.kr/kn/view.php?key=20250226010014314,아시아투데이
경제계·여당 반대에도…野주도 상법개정안 법사위 통과,https://img.asiatoday.co.kr/file/2025y/02m/26d/20250226010014313_250.jpg,경제계와 여당의 반대에도 상법 개정안이 야당 단독으로 국회 법제사법위원회 문턱을 넘었다.26일 국회 등에 따르면 이날 법사위는 전체회의를 열고 상법 개정안을 야당 주도로 통과시켰다. 여당은 강력 반발하며 표결에 불참했다. 야당은 오는 27일 예정된 본회의에서 상법 개정안을 처리하겠다는 방침이다. 이정문 더불어민주당 의원이 대표 발의한 이번 개정안은 이사의 충실의무를 주주로 확대하고 전자 주주총회 도입을 의무화하는 것을 골자로 한다. 이재명 대..,,https://www.asiatoday.co.kr/kn/view.php?key=20250226010014313,아시아투데이
"4선 성공 정몽규 ""커다란 책임감 느껴""",https://img.asiatoday.co.kr/file/2025y/02m/26d/20250226010014269_250.jpg,"새해 한국 체육계에 분 거센 변화의 바람이 축구계에는 미치지 못했다. 정몽규 대한축구협회장 후보가 압도적인 표차로 4선 연임에 성공했다. 향후 껄끄러운 정부와 관계는 커다란 숙제로 남겨졌다. 정 회장은 26일 서울 신문로 축구회관에서 열린 제55대 대한축구협회장 선거에서 유효 투표 182표(총 투표인단 192명) 가운데 156표를 획득해 허정무 후보(15표), 신문선 후보(11표)를 크게 따돌리고 당선됐다. 이날 선거는 정견 발표 후 오후 2..",,https://www.asiatoday.co.kr/kn/view.php?key=20250226010014269,아시아투데이
"디나미스원, 넥슨게임즈 미공개 프로젝트 유출 혐의로 경찰 수사",https://img.asiatoday.co.kr/file/2025y/02m/26d/20250226001721274_250.jpg,"국내 게임사 디나미스원이 넥슨게임즈의 미공개 프로젝트 데이터를 유출한 혐의로 경찰 수사를 받고 있다. 26일 업계에 따르면, 서울경찰청 산업기술안보수사대는 지난 24일 서울 서초구에 위치한 디나미스원의 사옥을 압수수색하고 관련 자료를 확보했다. 경찰은 디나미스원의 주요 관계자들이 넥슨게임즈를 퇴사하는 과정에서 개발 중이던 미공개 프로젝트 'MX BLADE'의 핵심 데이터를 무단으로 반출하고, 이를 신설 법인의 게임 개발에 활용하려 한 정황을 포..",,https://www.asiatoday.co.kr/kn/view.php?key=20250226001721274,아시아투데이
"가자 지구 휴전 시한 임박… 이스라엘, 전쟁 재개 준비",https://img.asiatoday.co.kr/file/2025y/02m/26d/20250226010014306_250.jpg,"이스라엘과 팔레스타인 무장정파 하마스 사이의 가자지구 전쟁 휴전이 이번 주말에 만료될 예정인 가운데, 이스라엘은 전쟁 재개를 준비하고 있다고 CNN 방송이 25일(현지시간) 보도했다. 1월 19일에 발효된 휴전 1단계의 지속 기간은 6주(42일)였고, 연장 합의가 추가로 이뤄지지 않는 한 3월 1일 휴전 기간이 종료된다.앞서 이스라엘과 하마스는 지난달 19일 42일간의 1단계 휴전에 돌입하며 2단계 이행을 위한 협상을 재개할 것을 합의한 바 있..",,https://www.asiatoday.co.kr/kn/view.php?key=20250226010014306,아시아투데이
다이소 건기식 시장 참전…30여종 판매,https://img.asiatoday.co.kr/file/2025y/02m/26d/20250226010014305_250.jpg,"다이소가 건강기능식품 시장에 본격적으로 뛰어들었다.26일 아성다이소에 따르면 다이소는 지난 24일부터 전국 200여개 매장에서 대웅제약, 일양식품 건강기능식품(건기식) 30여종을 판매한다.품목은 종합 비타민제, 칼슘제, 눈 영양제, 가르시니아, 오메가3 등으로, 3000원과 5000원 두 가지 균일가로 책정됐다.다이소는 이르면 다음달 종근당건강의 건기식 제품도 판매할 예정이다. 판매 매장은 고객 방문율이 높은 매장 중심으로 선정했다고 다이소..",,https://www.asiatoday.co.kr/kn/view.php?key=20250226010014305,아시아투데이
"신용보증기금, 주택금융공사와 감사업무 협력체계 구축",https://img.asiatoday.co.kr/file/2025y/02m/26d/20250226010014304_250.jpg,"신용보증기금은 한국주택금융공사와 '감사역량 강화 및 청렴문화 정착을 위한 업무협약'을 체결했다고 26일 밝혔다.지난 25일 주택금융공사 본사에서 열린 이번 협약은 양 기관의 내부감사 역량을 실질적으로 강화하고, 반부패·청렴 문화를 확산하기 위한 협력 체계를 구축하기 위해 마련됐다.양 기관은 △상호 특화 및 공통 감사업무에 대한 교차감사 지원 △내부통제 체계 고도화를 위한 정보교류 △반부패·청렴 우수정책 공유 △감사업무 전문성 강화를 위한 감사..",,https://www.asiatoday.co.kr/kn/view.php?key=20250226010014304,아시아투데이
"MBC제3노조 ""MBC, 극단 편파방송…국민 40% 이상을 극우로 몰아""",https://img.asiatoday.co.kr/file/2025y/02m/26d/20250226010014165_250.jpg,"MBC 노동조합(제3노조)는 26일 MBC가 전날 헌법재판소 주변에서 열린 윤석열 대통령 찬성·반대 집회와 최종변론 내용을 편파적으로 보도한 것을 겨냥해 ""극우 몰이 말고 '극단'이나 고쳐라""고 비판했다.노조는 이날 발표한 성명에서 ""합리적인 보수층까지 적으로 간주하며 극우라고 몰아세우면서 자신들은 끝없이 극단으로 치닫는다""며 ""MBC의 경영진과 보도책임자들, 또 부화뇌동하는 기자들, 제발 정신 좀 차려라""고 밝혔다.노조는 ""KBS와 SBS..",,https://www.asiatoday.co.kr/kn/view.php?key=20250226010014165,아시아투데이
"10주년 맞은 금감원 '1사 1교 금융교육', '점프업'으로 강화",https://img.asiatoday.co.kr/file/2025y/02m/26d/20250226010014302_250.jpg,금융감독원이 지난 2015년부터 진행 중인 '1사 1교 금융교육'의 한계점을 보완한 '1사 1교 금융교육 점프업' 프로그램을 추진한다. 맞춤형 금융교육 프로그램을 확대하고 결연 학교와 금융회사 간 소통을 강화해 보다 효과적인 금융교육을 제공한다. 또 지역 간 금융교육 격차 해소에도 노력한다.26일 금감원은 '2024년도 1사 1교 금융교육 우수사례 시상식'에서 이 같은 추진계획을 밝히며 결연 학교 및 금융회사의 적극적인 참여를 독려했다.점프업..,,https://www.asiatoday.co.kr/kn/view.php?key=20250226010014302,아시아투데이
"올해 30회 맞은 '서울리빙디자인페어', 글로벌 연사 콘퍼런스로 풍성",https://img.asiatoday.co.kr/file/2025y/02m/26d/20250226010014298_250.jpg,"리빙 및 라이프스타일 전시회 '2025 서울리빙디자인페어(Seoul Living Design Fair)'가 26일 개막했다. 올해 30회를 맞아 9개국 22명의 건축·소재·인테리어·공간·가구·디지털아트·뷰티 분야 전문가들이 참여해 양적, 질적으로 더욱 풍성해졌다.이번 행사는 오는 3월 2일까지 5일간 '2025 생활백서 : 삶의 낭만'이라는 주제로 서울 강남구 삼성동 코엑스 A·B·C·D홀에서 개최한다. 시몬스, KCC신한벽지, 코웨이, 스트..",,https://www.asiatoday.co.kr/kn/view.php?key=20250226010014298,아시아투데이
"계룡건설, 공공공사 2건 계약 체결…약 2000억원 수주",https://img.asiatoday.co.kr/file/2025y/02m/26d/20250226010014299_250.jpg,"계룡건설산업(이하 계룡건설)이 약 2000억원 규모의 공공공사 계약을 체결했다.26일 금융감독원 전자공시시스템에 따르면 계룡건설은 조달청과 한국토지주택공사(LH)가 각각 발주한 방위사업청 청사 신축공사와 고양장항 S-1블록 아파트 건설공사 5공구 계약을 이날 체결했다.계약금액은 각각 약 1127억원, 약 828억원이다.계룡건설은 대전 서구 청사로 일대 연면적 5만9737㎡ 규모 부지에 지하 2층~지상 21층 방위사업청 청사를 조성할 예정이다...",,https://www.asiatoday.co.kr/kn/view.php?key=20250226010014299,아시아투데이
양자 시대 맞아 보안 강화나선 삼성·KT,https://img.asiatoday.co.kr/file/2025y/02m/26d/20250226010014128_250.jpg,"삼성전자와 KT가 양자컴퓨터 시대 대비에 발빠르게 나서고 있다.26일 ICT업계에 따르면 삼성전자는 업계 최초로 하드웨어 양자내성암호(PQC)를 적용한 보안칩 S3SSE2A을 개발, 견본품 출하 준비를 마쳤다. S3SSE2A는 보안 연산과 정보 저장을 독립적으로 수행해 애플리케이션 프로세서에 결과만 전달해 좀 더 안전한 보안 환경을 제공한다. 전자 서명 암호화 해킹 공격 , 해커의 칩 분해 공격, 보안 기능 우회시도 등 최신 해킹 기법을 차단..",,https://www.asiatoday.co.kr/kn/view.php?key=20250226010014128,아시아투데이
"與배현진, 공무원연금법 개정안 대표발의…""3년이상 실형 확정시 연금박탈""",https://img.asiatoday.co.kr/file/2025y/02m/26d/20250226010014247_250.jpg,"배현진 국민의힘 의원은 26일 중대범죄로 3년 이상의 실형을 받은 공무원의 연금 수령을 박탈하는 '공무원연금법' 개정안을 대표발의 했다.배 의원은 이날 오전 국회 소통관에서 기자회견을 열고 ""최근 한 초등학교 교사가 학교내에서 자신의 제자인 초등학생을 잔혹하게 살해한 사건이 있었다""며 ""국민의 봉사자인 대한민국의 공무원이 학교에서 아이를 무참히 살해하고도 평생 매달 100만 원이 넘는 연금을 받을 수 있다는 소식을 듣고 법적 미비점을 보완해야..",,https://www.asiatoday.co.kr/kn/view.php?key=20250226010014247,아시아투데이
[아투포커스] “대우건설 그늘 벗어나라”건설·토건 등 중흥그룹 계열사 약진中,https://img.asiatoday.co.kr/file/2025y/02m/25d/20250225010013432_250.jpg,"중흥그룹 내 계열사들이 사업을 확장한 덕분에 대우건설의 보증 비중이 감소했다. 통상적으로 건설사는 프로젝트를 진행하면 보증이 발생되고, 프로젝트가 마무리 되면 보증이 없어진다. 즉 그룹 내 중흥토건·중흥건설 등이 굵직한 프로젝트를 진행했다는 뜻이다. 이들이 주택 사업을 강화할 계획인 만큼 대우건설의 의존도 역시 낮아질 전망이다.26일 중흥건설에 따르면 중흥그룹 계열사들이 발행한 보증 규모는 37조 6988억원(2022년), 43조 8527억원..",,https://www.asiatoday.co.kr/kn/view.php?key=20250225010013432,아시아투데이
"민주 ""대통령실 희망회로 내란 단죄 피할 수 없어""",https://img.asiatoday.co.kr/file/2025y/02m/26d/20250226010014295_250.jpg,"더불어민주당은 26일 용산 대통령실 브리핑과 관련해 ""일말의 부끄러움조차 없는 대통령실의 희망회로는 내란 단죄를 피할 수는 없을 것""이라고 비판했다.황정아 민주당 대변인은 이날 논평을 통해 ""대통령실이 윤석열 대통령의 복귀에 나섰다""며 ""윤석열이 내란 단죄를 피할 수 있다는 희망회로에 어처구니가 없다""며 이 같이 밝혔다. 유혜미 대통령실 저출생대응수석비서관은 이날 용산 대통령실에서 2024년 합계출산율 반등을 주제로 브리핑을 진행했다.황 대변인..",,https://www.asiatoday.co.kr/kn/view.php?key=20250226010014295,아시아투데이
"홍준표 “尹최후진술 진정성 보여…헌재, 탄핵 기각할 듯”",https://img.asiatoday.co.kr/file/2025y/02m/26d/20250226010013919_250.jpg,"26일 홍준표 대구시장은 윤석열 대통령이 11차 최후진술을 통해 밝힌 87체제 청산과 직무복귀 후 개헌·정치개혁을 하겠다는 진술을 높이 평가하며 헌법재판소(헌재)에서 윤 대통령의 탄핵이 기각될 수 있다고 25일 밝혔다.홍 시장은 전날 윤 대통령의 최후진술 직후인 밤 자신의 페이스북으로 ""비상계엄의 막전 막후 자세한 사정을 알 수 있었다. (윤 대통령이) 다시 복귀하면 외교 국방에만 전념하고 내치는 총리에게 맡기겠다는 진술도 작년 8월에 제가..",,https://www.asiatoday.co.kr/kn/view.php?key=20250226010013919,아시아투데이
"美 해양탐사기업, '최대 미스테리' 말레이항공 MH370편 수색 시작",https://img.asiatoday.co.kr/file/2025y/02m/26d/20250226010014293_250.jpg,"미국 해양 탐사기업인 오션 인피니티가 '항공 최대 미스테리 실종사건'인 말레이시아 항공 MH370편에 대한 수색에 공식적으로 착수했다. 26일 AFP와 현지매체에 따르면 말레이시아 교통부는 전날 오션 인피니티가 2014년 3월 실종된 말레이시아 항공 MH370편에 대한 수색에 공식적으로 착수했다고 밝혔다. 앤서니 로케 말레이시아 교통부 장관은 ""정부와 오션 인피니티 간의 계약은 아직 마무리되지 않았지만 수색 지역에 선박을 배치하는 등 적극적인..",,https://www.asiatoday.co.kr/kn/view.php?key=20250226010014293,아시아투데이
"강호동 농협회장 ""돈 버는 농업 위해 힘 써야""",https://img.asiatoday.co.kr/file/2025y/02m/26d/20250226010014289_250.jpg,"세종// 강호동 농협중앙회장이 ""돈 버는 농업 실현을 위해 농산물의 고부가가치 창출에 힘 써 달라""고 당부했다.26일 농협에 따르면 강 회장은 지난 24일부터 이틀간 경북 안동 관내 농산물산지유통센터(APC)와 가공사업소 등을 방문해 이같이 말했다.이 기간 강 회장은 북안동농협 스마트 APC 신축 현장을 방문해 공사 진행상황과 설비현황을 확인했다. 또 첨단 설비를 활용한 농산물 유통 및 판매사업 활성화를 강조했다.이튿날 강 회장은 남안동농협 가..",,https://www.asiatoday.co.kr/kn/view.php?key=20250226010014289,아시아투데이
"중소기업퇴직연금 '푸른씨앗' 1조 돌파…김문수 ""퇴직연금 의무화 추진""",https://img.asiatoday.co.kr/file/2025y/02m/26d/20250226010014288_250.jpg,세종// 중소기업 근로자의 노후 소득을 보장하기 위해 마련된 퇴직연금기금이 출범 2년여 만에 1조원이 모였다. 정부는 퇴직연금 의무화 및 기금형 퇴직연금 도입을 추진한다는 방침이다. 고용노동부와 근로복지공단은 26일 서울 영등포구 근로복지공단 서울합동청사에서 중소기업퇴직연금기금(푸른씨앗) 조성액 1조원 기념행사를 개최했다.국내 유일의 공적 기금형 퇴직연금제도인 푸른씨앗은 30인 이하 중소기업 근로자의 노후 준비를 위해 2022년 9월 본격 도입..,,https://www.asiatoday.co.kr/kn/view.php?key=20250226010014288,아시아투데이
"토스, 글로벌 일상 수퍼앱 선언…5년 내 해외 사용자 비중 50% 목표",https://img.asiatoday.co.kr/file/2025y/02m/26d/20250226010014238_250.jpg,"토스가 금융을 넘어 글로벌 '수퍼앱'으로 도약하겠다는 비전을 제시했다. 5년 내 글로벌 사용자 비중을 50%까지 확대하고, 페이스페이를 통한 오프라인 결제 혁신과 1조원 규모의 스타트업 생태계 지원을 통해 국내를 넘어 세계 시장에서 금융 혁신을 이끌겠다는 계획이다. 이를 통해 기존 금융업의 틀을 넘어 생활 전반을 아우르는 일상의 플랫폼으로 자리매김하겠다는 전략이다.토스는 26일 앱 출시 10주년을 맞아 '토스 10주년, 새로운 출발선' 기자간..",,https://www.asiatoday.co.kr/kn/view.php?key=20250226010014238,아시아투데이
"HUG, AI 기반 채권관리 서비스 특허 등록",https://img.asiatoday.co.kr/file/2025y/02m/26d/20250226010014284_250.jpg,"주택도시보증공사(HUG)는 전세보증금반환보증 사고 채권 회수 효율성을 높이기 위해 개발한 'AI 기반 채권관리 서비스 및 방법'에 대한 특허를 취득했다고 26일 밝혔다.이번 특허는 인공지능(AI) 기술을 활용해 채권 회수 정확성과 효율성을 높이는 방법이다. 2021년 출원을 신청했고, 지난 1월 특허 등록을 완료했다.HUG는 특허받은 모형을 지속적으로 개선하며 채권 회수 업무에 활용하고 있다고 밝혔다. 임대인의 상환 의지와 낙찰가율 등 다양한..",,https://www.asiatoday.co.kr/kn/view.php?key=20250226010014284,아시아투데이
지방 여행 가볼까…숙박할인권 30만장 배포,https://img.asiatoday.co.kr/file/2025y/02m/26d/20250226010014285_250.jpg,"문화체육관광부와 한국관광공사가 올해 첫 '대한민국 숙박세일 페스타'를 추진한다. 문체부와 관광공사는 3월 여행가는 달을 맞이해 지역관광과 내수를 활성화하고자 1차로 2025년 숙박할인권 30만 장을 배포한다. 숙박할인권은 2월 28일부터 매일 오전 10시, 42개 온라인 채널(OTA)을 통해 선착순으로 1인 1매씩 발급한다. 준비된 수량이 모두 소진되면 배포를 종료한다.발급된 할인권은 입실일 기준으로 2월 28일부터 4월 6일까지 비수도권 지..",,https://www.asiatoday.co.kr/kn/view.php?key=20250226010014285,아시아투데이
"'10주년' 토스 ""연간 흑자 기대…금융 넘어 '일상 수퍼앱' 목표""",https://img.asiatoday.co.kr/file/2025y/02m/26d/20250226010014008_250.jpg,"지난해 연간 흑자를 기대 중이라고 밝힌 토스는 금융 수퍼앱을 넘어 일상의 수퍼앱으로 진화하겠다는 목표를 밝혔다. 또 글로벌 시장을 위한 서비스도 지속 확장해 외국인 이용자 비중을 높일 계획이다.26일 토스는 앱 출시 10주년을 맞이해 서울 성동구 성수동 앤더슨씨에서 '토스 10주년, 새로운 출발선' 기자간담회를 개최했다. 이번 간담회는 지난 10년간의 성과와 앞으로의 비전을 공유하기 위해 마련됐다.이날 이승건 토스 대표는 ""토스는 2015년에..",,https://www.asiatoday.co.kr/kn/view.php?key=20250226010014008,아시아투데이
"'현대로템·코레일' 등 K-철도 원팀, 2.2조원 규모 '모로코 메트로 차량' 사업 수주",https://img.asiatoday.co.kr/file/2025y/02m/26d/20250226010014230_250.jpg,정부가 주축이 되어 해외 프로젝트 수주를 지원하는 이른 바 'K-원팀'이 또 다시 성과를 냈다. 한국철도공사(코레일)·국가철도공단·현대로템 등으로 구성된 민관 협력 수주단이 모로코에서 2조2000억원 규모의 사업을 따냈다. 국토교통부는 26일 오전 1시(현지시간 25일 오후) 현대로템이 모로코 철도청(ONCF)에서 발주한 철도차량 4종 공급사업 중' 통근형(도시 간) 메트로 차량 240칸 및 도시 내 메트로 차량 200칸 공급 사업'을 수주했..,,https://www.asiatoday.co.kr/kn/view.php?key=20250226010014230,아시아투데이
[르포] 노후아파트 안전문제 도마…90년된 충정아파트 재건축 언제,https://img.asiatoday.co.kr/file/2025y/02m/24d/20250224010012526_250.jpg,1937년 완공된 서울 서대문구 충정아파트는 서울시가 공인한 우리나라 최초의 아파트다. 건설된 지 90년에 다다른 이 아파트는 충정로 역세권 알짜배기 위치에 우뚝 서 있지만 빛바랜 초록색 외관과 군데군데 벗겨진 페인트 자국을 통해 세월의 흔적을 고스란히 보여주고 있다.26일 5층짜리 충정아파트 건물 내부로 들어가보니 어두컴컴한 복도가 스산한 분위기를 풍겼다. 건물 내부에선 오랜 기간 많은 사람들이 거쳐간 흔적을 어렵지 않게 볼 수 있었다. 바..,,https://www.asiatoday.co.kr/kn/view.php?key=20250224010012526,아시아투데이
"하림-국립공원공단, ESG활동 확대 업무협약 체결",https://img.asiatoday.co.kr/file/2025y/02m/26d/20250226010014282_250.jpg,"하림은 지난 24일 국립공원공단과 새만금환경 생태단지의 지속가능한 보전과 ESG활동 확대를 위한 업무협약을 체결했다고 26일 밝혔다.이날 협약식에는 정호석 하림 대표이사, 송호석 전북지방환경청장, 송형근 국립공원공단 이사장을 비롯해 3개 기관 관계자 30여명이 참석했다.이에 따라 이들 기관은 △새만금환경생태단지 생태복원·생물다양성 증진 활동 참여 △환경보호 캠페인 홍보용 에디션 제품 출시 △치유프로그램 등 국립공원 생태관광프로그램 상호교류 △..",,https://www.asiatoday.co.kr/kn/view.php?key=20250226010014282,아시아투데이
