title,thumbnail,short_content,write_time,link,company
[이재명 정부 100일] 수사·기소 분리 대원칙 속 쟁점놓고 당정대 혼선,https://img.asiatoday.co.kr/file/2025y/09m/10d/20250910010005805_250.jpg,"이재명 대통령의 핵심 개혁과제 가운데 하나인 검찰개혁의 청사진이 윤곽을 드러냈다. 이 대통령은 취임 100일 전 검찰의 수사·기소권을 분리하는 '정부조직법 개정안'을 발표하며 검찰개혁의 토대를 마련했다. 그러나 수사·기소 분리라는 대원칙 외에는 해소되지 않은 쟁점이 상당수 있어 당분간 검찰개혁을 둘러싼 혼란은 가라앉지 않을 전망이다.이 대통령은 지난 5월 대선후보 시절 검찰개혁과 관련해 ""시간표를 정확히 정한 건 아니지만 기본적인 스케줄은 가..",,https://www.asiatoday.co.kr/kn/view.php?key=20250910010005805,아시아투데이
[이재명 정부 100일] 수사·기소 분리 대원칙 속 쟁점놓고 당정대 혼선,https://img.asiatoday.co.kr/file/2025y/09m/11d/20250911010005965_250.jpg,"이재명 대통령의 핵심 개혁과제 가운데 하나인 검찰개혁의 청사진이 윤곽을 드러냈다. 이 대통령은 취임 100일 전 검찰의 수사·기소권을 분리하는 '정부조직법 개정안'을 발표하며 검찰개혁의 토대를 마련했다. 그러나 수사·기소 분리라는 대원칙 외에는 해소되지 않은 쟁점이 상당수 있어 당분간 검찰개혁을 둘러싼 혼란은 가라앉지 않을 전망이다. 이 대통령은 지난 5월 대선후보 시절 검찰개혁과 관련해 ""시간표를 정확히 정한 건 아니지만 기본적인 스케줄은 가..",,https://www.asiatoday.co.kr/kn/view.php?key=20250911010005965,아시아투데이
"李대통령, 교육장관 등 청문보고서 송부 재요청…12일 임명 가능성",https://img.asiatoday.co.kr/file/2025y/09m/10d/20250910010005963_250.jpg,"이재명 대통령이 10일 국회에 최교진 교육부 장관 후보자와 이억원 금융위원장 후보자, 주병기 공정거래위원장 후보자의 인사청문경과보고서 송부를 재요청했다.강유정 대통령실 대변인은 이날 서면 브리핑을 통해 이 같은 내용을 밝혔다.강 대변인은 ""지난 8일 인사청문 기간이 종료된 이후에도, 여야 합의를 통한 청문보고서 채택 및 송부를 기다렸지만 더 이상 국정공백을 둘 수 없어 오늘과 내일 이틀간 기간을 두고 청문보고서 송부를 다시 요청했다""고 밝혔다..",,https://www.asiatoday.co.kr/kn/view.php?key=20250910010005963,아시아투데이
[이재명 정부 100일] 정상외교 복원 '첫단추' 잘 끼웠지만… 관세·대북관계 난제도,https://img.asiatoday.co.kr/file/2025y/09m/11d/20250911010005964_250.jpg,"이재명 대통령의 지난 100일 간 외교·안보 행보는 주요7개국(G7) 정상회의와 한미·한일 정상회담으로 요약된다. '탄핵정국'으로 마비된 정상외교 복원, 한미일 연대 재확인을 통한 '친중' 이미지 탈피 등으로 '첫단추'를 잘 끼웠다는 평가가 나온다. 하지만 '현재진행형'인 미국과의 관세·안보 협상, 이시바 시게루 일본 총리의 사임으로 인한 한일 관계 재설정, 북중러의 연대 강화 대응과 선제적 대북 유화 조치..",,https://www.asiatoday.co.kr/kn/view.php?key=20250911010005964,아시아투데이
"이승돈 농진청장 ""벼 수확기까지 병해충 예찰·방제 총력""",https://img.asiatoday.co.kr/file/2025y/09m/10d/20250910010005961_250.jpg,"세종// 이승돈 농촌진흥청장은 10일 ""벼 안정 생산을 위해 수확기까지 병해충 예찰 및 방제에 총력을 다하겠다""고 밝혔다.이 청장은 이날 전북 고창군과 충남 당진시에 위치한 벼 재배단지를 찾아 생육상황을 점검하고 이같이 말했다.농진청에 따르면 이 청장은 지난해 대규모 벼멸구 발생으로 심각한 피해를 본 지역의 벼 병해충 예방·경감 대책을 재차 확인하고, 방제 이후 재배단지별 관리 현황을 확인했다.이 청장은 ""충남, 전북, 전남, 경남 등 서남해안..",,https://www.asiatoday.co.kr/kn/view.php?key=20250910010005961,아시아투데이
[IAA 2025] 자동차 넘어 전자 및 IT까지...전세계가 주목하는 모빌리티 쇼,https://img.asiatoday.co.kr/file/2025y/09m/10d/20250910010005960_250.jpg,"세계에서 가장 영향력 있는 모빌리티 전시회 중 하나인 IAA 모빌리티 2025는 9일부터 14일(현지시간)까지 독일 뮌헨에서 열린다. 전기차를 비롯해 SDV, 커넥티드 기술, 차세대 배터리와 관련된 기업은 물론 전자 및 IT 기업도 참가하며 매년 주목받고 있다.",,https://www.asiatoday.co.kr/kn/view.php?key=20250910010005960,아시아투데이
5년만에 재개한 으뜸효율 사업…두달간 예산 34% 소진,https://img.asiatoday.co.kr/file/2025y/09m/10d/20250910010005933_250.jpg,"내수 진작과 전기요금 절감을 목적으로 실시하고 있는 '으뜸효율 가전제품' 신청금액이 한달 만에 850억원을 넘어섰다. 이 속도라면 이르면 12월 배정된 예산이 모두 소진될 것으로 전망된다.10일 한국에너지공단에 따르면 전일 기준 으뜸효율 가전제품 환급사업(으뜸효율사업) 신청액은 전체 예산 중 34%에 달하는 것으로 집계됐다. 해당 사업의 총 예산은 2539억원으로, 현재 누적 신청액은 853억원이다. 지난달 13일부터 신청 접수가 시작된 것을..",,https://www.asiatoday.co.kr/kn/view.php?key=20250910010005933,아시아투데이
USV 기술유출 관련 LIG넥스원… 수원지검 방위사업수사부로 송치하나,https://img.asiatoday.co.kr/file/2025y/09m/10d/20250910010005926_250.jpg,국군방첩사령부(방첩사)가 최근 군사기밀보호법 위반 등의 혐의와 관련해 LIG넥스원 판교하우스에 대한 압수수색을 단행한 정황이 포착됐다. 이번 압수수색은 지난해 LIG넥스원이 수주한 정찰용 무인수상정(USV) 체계개발 사업과 연관된 것으로 알려졌다.10일 업계에 따르면 방첩사는 수원지방검찰청의 지휘를 받아 지난달 말 LIG넥스원 판교하우스를 대상으로 압수수색을 진행 했다. 현재 기소의견으로 수원지검 방위사업수사부 송치 방향이 유력하다는 얘기가..,,https://www.asiatoday.co.kr/kn/view.php?key=20250910010005926,아시아투데이
공공의대 설립 시작하는데…39억 예산 실효성 '물음표',https://img.asiatoday.co.kr/file/2025y/09m/10d/20250910010005870_250.jpg,"이재명 정부가 핵심 공약인 '공공의료 사관학교'(공공의대) 설립을 위한 첫걸음을 뗐지만 내년도 예산안에 반영된 규모가 39억원에 그치면서 실효성에 의문이 제기된다. 7일 의료계에 따르면 정부가 국회에 제출한 '2026년도 예산안'에 보건복지부는 내년도 '공공의료 전문인력 양성 및 지원' 사업비로 39억원을 편성했다. 연구비 3억원과 실시 설계비 36억원으로, 지난해에는 배정조차 없었던 신규 예산이다. 정은경 복지부 장관은 ""사회안전망 강화와..",,https://www.asiatoday.co.kr/kn/view.php?key=20250910010005870,아시아투데이
"[IAA 2025] ""신형 세단 ES90 눈길"" 볼보, 완전 전동화 브랜드 도약",https://img.asiatoday.co.kr/file/2025y/09m/10d/20250910010005959_250.jpg,"볼보가 독일에서 열린 'IAA 모빌리티 2025'에 참가했다. EX30, EX90, ES90 등 핵심 전기차 모델들이 총출동했다. 내년 출시 예정인 신형 EX60도 최초로 베일을 벗었다.",,https://www.asiatoday.co.kr/kn/view.php?key=20250910010005959,아시아투데이
코스피 사상 최고...장중 3317선 돌파,https://img.asiatoday.co.kr/file/2025y/09m/11d/20250911010005957_250.jpg,"코스피가 10일 장중 3310선을 돌파하며 역사적 신고가를 경신했다. 이재명 대통령의 취임 100일 기자회견을 하루 앞두고 대주주 양도세 기준 현행 유지 등 자본시장 활성화 정책에 대한 기대가 주가 상승세에 불을 지폈다. 외국인과 기관의 동반 순매수가 지수 상승을 견인한 가운데 반도체, 금융, 증권 업종이 강세를 주도했다.10일 한국거래소에 따르면 이날 코스피 지수는 전 거래일 대비 54.48포인트(1.67..",,https://www.asiatoday.co.kr/kn/view.php?key=20250911010005957,아시아투데이
"""5년 간 '선도형 경제' 골든타임""… SiC반도체 기술자립 2배로",https://img.asiatoday.co.kr/file/2025y/09m/11d/20250911010005956_250.jpg,"정부가 향후 5년을 '선도형 경제' 전환의 골든타임으로 삼고, 초혁신경제 15대 선도 프로젝트에 대한 추진 체계를 밝혔다. 지역별 특화기술자립도산업과도 연계해 지역균형성장 및 지역혁신도 촉진한다는 구상이다. 이를 위한 20개 추진단을 마련해 5년 내 가시적인 성과 창출에 나선다.10일 기획재정부가 발표한 '초혁신경제 15대 선도 프로젝트 추진계획'에 따르면 정부는 주관부처 주도 하에 기업·지자체·지원 조직으로 이뤄진..",,https://www.asiatoday.co.kr/kn/view.php?key=20250911010005956,아시아투데이
"[IAA 2025] 로터스, 전통과 미래 잇는 무대 선봬...아일톤 세나의 F1 경주차도 전시",https://img.asiatoday.co.kr/file/2025y/09m/10d/20250910010005955_250.jpg,"로터스는 9일부터 14일(현지시간)까지 독일 뮌헨에서 열린 'IAA 모빌리티 2025'에 참가했다. 로터스는 브랜드의 새로운 방향을 담은 콘셉트카 Theory 1과 아일톤 세나가 몰았던 전설적인 F1 경주차 타입 99T, 그 전통을 이어받아 더욱 특별하게 만들어진 로터스 에미라 리미티드 99t를 비롯한 엘레트라와 에메야 등을 함께 전시했다.",,https://www.asiatoday.co.kr/kn/view.php?key=20250910010005955,아시아투데이
"[IAA 2025] ""ID.크로스 콘셉트 궁금해"" 폭스바겐 야외 부스 '북적'",https://img.asiatoday.co.kr/file/2025y/09m/10d/20250910010005954_250.jpg,폭스바겐이 독일 뮌헨에서 개최되는 'IAA 모빌리티 2025'에서 엔트리급 순수전기 SUV 'ID.크로스 콘셉트(ID. CROSS Concept)'를 세계 최초 공개했다. ID.크로스 콘셉트는 폭스바겐의 네 번째 컴팩트 전기 콘셉트카이자 차세대 도심형 전기차 라인업의 핵심 모델이다.,,https://www.asiatoday.co.kr/kn/view.php?key=20250910010005954,아시아투데이
[이재명 정부 100일] 실용외교·파격 국정운영… '일하는 정부'로 혁신,https://img.asiatoday.co.kr/file/2025y/09m/11d/20250911010005952_250.jpg,"11일 취임 100일을 맞은 이재명 대통령이 지지율 60%대를 유지하며 국정 기반 다지기에 선방했다는 평가가 나온다. 12·3비상계엄의 혼란을 딛고 탄생한 이재명 정부는 '국민주권정부', '회복과 성장'을 내세워 국가 정상화에 나섰지만, '반미·친중', '독불장군', '사법 리스크' 등 이 대통령을 둘러싼 부정적 이미지에서 비롯된 우려가 있었던 것도 사실이다. 하지만 이 대통령은 한미동맹과 한미일 삼각공조..",,https://www.asiatoday.co.kr/kn/view.php?key=20250911010005952,아시아투데이
[이재명 정부 100일] 실용·파격·통합 행보로 국정 기반 다지기 선방,https://img.asiatoday.co.kr/file/2025y/09m/10d/20250910010005739_250.jpg,"11일 취임 100일을 맞는 이재명 대통령이 지지율 60%대를 유지하며 국정 기반 다지기에 선방했다는 평가가 나온다. 12·3 비상계엄, 이후 6개월의 혼란을 딛고 탄생한 이재명 정부는 '국민주권정부' '회복과 성장'을 내세워 국가 정상화에 나섰지만, '반미·친중', '독불장군', '사법 리스크' 등 이 대통령을 둘러싼 부정적 이미지 때문에 우려가 있었던 것도 사실이다. 하지만 이 대통령은 한미동맹과 한미일 삼각공조에 힘을 싣는 외교, 협치·..",,https://www.asiatoday.co.kr/kn/view.php?key=20250910010005739,아시아투데이
"[이재명 정부 100일-산업] 'AI·반도체' 혁신 드라이브… ""反기업법은 속도조절 절실""",https://img.asiatoday.co.kr/file/2025y/09m/11d/20250911010005951_250.jpg,이재명 정부가 출범 100일을 맞은 가운데 산업계에서는 굵직한 사건들이 잇달았다. 정부가 AI와 반도체를 국가 성장의 핵심 축으로 삼아 강력한 혁신 드라이브를 건 것은 산업계 전반에 새로운 도약의 기회로 평가된다. 또 15%로 타결된 대미 관세 협상은 세계 주요국과 비슷한 수준을 확보했다는 점에서 '선방'이라는 평가가 나온다. 다만 상법과 노동조합법 개정안은 현장의 혼란을 최소화하기 위해 속도조절과 보완입법이 필요하다는 지적 등이 과제로 남아..,,https://www.asiatoday.co.kr/kn/view.php?key=20250911010005951,아시아투데이
"[IAA 2025] 메르세데스-벤츠, 디 올 뉴 GLC EQ 테트놀로지 공개",https://img.asiatoday.co.kr/file/2025y/09m/10d/20250910010005950_250.jpg,메르세데스-벤츠가 독일 뮌헨에서 열리는 IAA 2025에 참가해 'GLC'의 첫 순수 전기 SUV '디 올 뉴 GLC 위드 EQ 테크놀로지'를 공개했다.,,https://www.asiatoday.co.kr/kn/view.php?key=20250910010005950,아시아투데이
주식양도세 기준 상향 기대감에… 되살아나는 증권·은행株,https://img.asiatoday.co.kr/file/2025y/09m/11d/20250911010005949_250.jpg,"대주주 양도세 기준 완화 논의가 급물살을 타면서 주춤했던 증권·은행주들이 강세를 보이고 있다. 시장 기대와 대치된 정부의 세제개편안에 조정을 받았지만, 재검토 소식으로 다시 우상향하기 시작한 거다. 전문가들은 양도세 기준이 현행 수준으로 유지될 경우, 증권사들은 수급 개선과 함께 리테일 등 사업 전반의 실적을 끌어올릴 수 있다는 분석을 내놨다. 은행들 역시 고배당 매력이 부각되면서 투자심리에 활기가 더해질 것이라는..",,https://www.asiatoday.co.kr/kn/view.php?key=20250911010005949,아시아투데이
"""산재 줄이고 노동권 강화""… 장관은 직까지 걸고 현장행보",https://img.asiatoday.co.kr/file/2025y/09m/11d/20250911010005948_250.jpg,"이재명 대통령이 취임 후 100일 동안 보여준 노동정책 초점은 분명하다. 산업재해(산재) 감축에 강한 드라이브를 걸고 임금체불을 '중대한 경제범죄'로 규정하며 현장 변화를 압박하는 한편, 노조법 2·3조 개정안(노란봉투법)을 통과시키며 노동권 강화의 전환점도 마련했다.이 대통령은 포스코그룹의 잇단 사망 사고를 두고 ""미필적 고의에 의한 살인""이라고 질타했고, 산재 사망사고가 난 SPC 제빵공장을 찾아 장시간 노동과 안전 실태를 직접 점검했다..",,https://www.asiatoday.co.kr/kn/view.php?key=20250911010005948,아시아투데이
"정은보 한국거래소 이사장 ""코스피 5000 조속 실현될 수 있도록 할 것""",https://img.asiatoday.co.kr/file/2025y/09m/10d/20250910010005947_250.jpg,"정은보 한국거래소 이사장이 10일 코스피 사상 최고치(3314.53) 경신을 축하하며 ""코스피 5000시대를 조속 실현할 수 있도록 최선의 노력을 다하겠다""고 강조했다.이를 위해 상장기업의 주주가치 제고 노력을 지속 유도하고, 불공정거래 시장감시를 강화한다는 방침이다. 아울러 24시간 거래와 결제주기 단축 등 거래 인프라의 혁신도 차질 없이 준비하겠다는 계획이다.이날 정 이사장은 ""오늘 코스피가 4년 2개월 만에 사상 최고치를 경신했다""며 ""..",,https://www.asiatoday.co.kr/kn/view.php?key=20250910010005947,아시아투데이
"카타르 공습 비난에도…이스라엘 ""군사작전 계속"" 강경 모드",https://img.asiatoday.co.kr/file/2025y/09m/10d/20250910010005934_250.jpg,"하마스 지도부를 노린 이스라엘의 카타르 공습으로 확전 우려 목소리가 큰 가운데 이스라엘이 군사작전을 계속할 뜻을 밝혔다.10일(현지시간) 주요 외신에 따르면 이스라엘 카츠 이스라엘 국방장관은 성명을 통해 ""이스라엘의 안보 교리는 명확하다""며 ""이스라엘은 모든 곳에서 적들을 향해 긴 팔을 휘두를 것""이라고 밝혔다.이어 카츠 장관은 ""(2023년) 10월 7일 학살에 연루된 모든 사람은 무거운 처벌을 받을 것""이라고 경고했다.그는 또 ""하마스 살..",,https://www.asiatoday.co.kr/kn/view.php?key=20250910010005934,아시아투데이
[IAA 2025] 베일 벗은 BMW '노이어 클라쎄'…뉴 iX3 공개,https://img.asiatoday.co.kr/file/2025y/09m/10d/20250910010005946_250.jpg,"BMW 그룹은 독일 뮌헨에서 열린 IAA 모빌리티 2025에서 'BMW 뉴 iX3'와 'MINI 스케그', 'BMW 모토라드 비전 CE'를 세계 최초로 공개했다.",,https://www.asiatoday.co.kr/kn/view.php?key=20250910010005946,아시아투데이
"정부는 소비자보호 외치는데… 일부 카드사, 해지 기능 숨긴 이유는",https://img.asiatoday.co.kr/file/2025y/09m/11d/20250911010005945_250.jpg,"# 삼성카드 고객 A씨는 최근 사용하지 않는 카드를 해지하기 위해 모바일 앱에 접속했다. 검색창에 '해지'를 검색했지만 카드 해지를 위한 메뉴를 확인하지 못했고 한참을 헤매다가 결국 카드 해지하는 것을 포기했다. 위 사례처럼 금융소비자가 안쓰는 카드를 해지하지 못하고 불필요한 연회비만 지출하는 경우가 종종 발생해 카드사에 대한 불만의 목소리가 나오고 있다. 카드 개설은 쉽지만, 해지 절차를 까다롭게 한다는 불만은 계속돼 왔는데, 개선이 안 되고..",,https://www.asiatoday.co.kr/kn/view.php?key=20250911010005945,아시아투데이
"[IAA 2025] 르노, 소형 전기차로 유럽인 홀려...'르노 5와 르노 4'",https://img.asiatoday.co.kr/file/2025y/09m/10d/20250910010005944_250.jpg,르노가 9일부터 14일(현지시간)까지 독일 뮌헨에서 열린 'IAA 모빌리티 2025'에 참가했다. 르노는 최근 출시한 소형 전기 해치백 르노 5와 소형 전기 SUV 르노 4를 전시했다. 르노 5는 르노의 오랜 역사를 함께한 소형 해치백을 전동화한 모델로 유럽 시장에서 인기를 끌고 있다. 올해 1월 '2025 유럽 올해의 차'에 선정되기도 했다.,,https://www.asiatoday.co.kr/kn/view.php?key=20250910010005944,아시아투데이
"""보습·선케어 한번에""…프리메라, 핸드 케어 신제품 공개",https://img.asiatoday.co.kr/file/2025y/09m/10d/20250910010005943_250.jpg,"아모레퍼시픽의 프리메라가 새로운 핸드 케어 제품 '더 핸드 크림 미스트 UV(SPF 15)를 출시한다.10일 프리메라에 따르면 이번 신제품은 보습과 자외선 차단을 동시에 구현한 새로운 유형의 핸드 미스트로, 간편하게 분사해 사용하는 형태다.운전이나 야외 활동 시에도 자외선으로부터 손 피부를 보호해 광노화를 예방할 수 있다고 회사 측은 설명했다.상쾌한 귤과 베르가못이 느껴지는 시트러스 향에 파촐리와 라벤더가 어우러진 향이 특징이다.아모레퍼시픽..",,https://www.asiatoday.co.kr/kn/view.php?key=20250910010005943,아시아투데이
돌아온 조국… 위기의 혁신당 구원투수 될까,https://img.asiatoday.co.kr/file/2025y/09m/11d/20250911010005942_250.jpg,성 비위 사건으로 내홍을 겪고 있는 조국혁신당이 조국 혁신정책연구원장을 비상대책위원장으로 사실상 내정했다. 정치권 안팎에서는 조 원장이 위기의 혁신당을 수습할 '구원투수'가 될 수 있을지에 관심이 쏠리고 있다. 10일 정치권에 따르면 혁신당은 비대위원장을 선출하는 당무위원회에 조 원장을 단수 추천하기로 했다. 당초 조 원장은 오는 11월로 예정된 전당대회에 출마할 예정이었으나 당의 위기상황이 장기화되면서 조기 등판이 결정된 것으로 보인다...,,https://www.asiatoday.co.kr/kn/view.php?key=20250911010005942,아시아투데이
"주식양도세 기준 10억 철회, 50억 유지 가닥",,"정치권에선 주식 양도소득세 부과 대주주 기준이 '현행 50억원 유지'로 가닥이 잡힌 것에 대해 환영의 목소리가 나왔다. 여기에 더불어민주당은 배당소득세 분리과세를 비롯한 제도 개선을 내세웠고, 국민의힘은 대주주 기준 추가완화 카드로 '개미 달래기'에 나섰다. 이언주 민주당 최고위원은 10일 국회에서 열린 최고위원회의에서 ""최근 당정협의회에서 양도세 대주주 기준과 관련해 현행 50억원을 유지하자는 입장을 전달했다""며 ""영수회담에서 야당 측 건의..",,https://www.asiatoday.co.kr/kn/view.php?key=20250911010005941,아시아투데이
'하루 한 알' 먹는 비만약…일동제약 임상 결과에 쏠리는 관심,https://img.asiatoday.co.kr/file/2025y/09m/10d/20250910010005767_250.jpg,일동제약이 개발 중인 경구용 비만 치료제의 임상1상 결과가 곧 발표될 전망이다. '위고비' '마운자로'와 같은 주사제보다 투여 편의성을 높인 경구제가 등장하면 시장 판도를 흔들 수 있다는 기대감에 업계의 관심도 높다. 10일 제약업계에 따르면 일동제약은 자회사 유노비아가 개발 중인 비만 신약 파이프라인 ID110521156의 임상1상 톱라인 결과를 오는 29일 발표한다. 지난 6월 미국 당뇨병학회(ADA 2025)에서 일부 결과를 공개한 데..,,https://www.asiatoday.co.kr/kn/view.php?key=20250910010005767,아시아투데이
'주가조작·공천개입·청탁 의혹' 김건희 여사 재판 24일 시작,https://img.asiatoday.co.kr/file/2025y/09m/10d/20250910010005909_250.jpg,"도이치모터스 주가조작·명태균 공천개입·건진법사 청탁 의혹 등으로 구속된 김건희 여사의 재판이 오는 24일 시작된다.서울중앙지법 형사합의27부(우인성 부장판사)는 자본시장법 위반, 정치자금법 위반, 특정범죄가중처벌법상 알선수재 혐의로 구속 기소된 김 여사의 재판의 첫 공판기일을 오는 24일 오후 2시 10분께로 지정했다.앞서 민중기 김건희 특검팀은 지난달 29일 김 여사를 구속기소했다.김 여사는 2009∼2012년 도이치모터스 주가조작 사건에..",,https://www.asiatoday.co.kr/kn/view.php?key=20250910010005909,아시아투데이
반도체 현장 스킨십에도… 與 '주 52시간'엔 원론적 입장만,https://img.asiatoday.co.kr/file/2025y/09m/11d/20250911010005938_250.jpg,정청래 더불어민주당 대표가 '반도체특별법'의 빠른 처리를 약속하며 반도체 산업 현장 '스킨십'에 나섰다. 정 대표는 이재명 대통령의 공약인 특별법 제정을 통해 '세계 1등 반도체 국가'를 뒷받침하겠다고 약속했다. 다만 업계에서 건의한 중복·비합리적 규제 혁신 등 현안에 대해서는 정책적 검토가 필요하다는 원론적 입장을 밝힌 것으로 전해진다.정 대표는 10일 삼성전자 평택캠퍼스에서 열린 '반도체 산업 발전을 위..,,https://www.asiatoday.co.kr/kn/view.php?key=20250911010005938,아시아투데이
단통법 폐지후 첫 출격 아이폰17… 시장 '판 흔들기' 쉽지않다,https://img.asiatoday.co.kr/file/2025y/09m/11d/20250911010005936_250.jpg,"애플의 차세대 스마트폰 '아이폰17' 시리즈가 베일을 벗었다. 커다란 외형 변화와 함께 카메라, 배터리 등 하드웨어 중심의 성능 개선이 이번 시리즈의 가장 큰 특징이다. 여기에 아이폰 최초의 초슬림형 '아이폰 에어'를 함께 내놓으며 라인업을 한층 강화했다.국내에선 지난 7월 단통법 폐지 이후 처음으로 출시되는 아이폰 시리즈라는 점에서 판매 성과에 관심이 모인다. 애플은 올해에도 한국을 1차 출시국에 포함하며 국내 스마..",,https://www.asiatoday.co.kr/kn/view.php?key=20250911010005936,아시아투데이
'배터리 혈관' 동박 특허전쟁… SK·솔루스 국제소송 격화,https://img.asiatoday.co.kr/file/2025y/09m/11d/20250911010005935_250.jpg,"이차전지 핵심 소재인 동박을 둘러싸고 SK넥실리스와 솔루스첨단소재의 국제 소송전이 격화하고 있다. SK넥실리스는 지난 2023년 미국에서 특허 침해 소송을 제기한 데 이어, 최근에는 영업비밀 침해 책임까지 추가로 묻겠다는 취지로 공세를 확대했다. 반면 솔루스첨단소재는 미국 법원이 영업비밀 침해 소송을 기각했다는 점을 강조하며, 자사의 비침해 입증이 받아들여졌다는 입장을 고수하고 있다. 특히 최근 글로벌 동박 시장이 전..",,https://www.asiatoday.co.kr/kn/view.php?key=20250911010005935,아시아투데이
