title,thumbnail,short_content,write_time,link,company
상반기 글로벌 핀테크 투자 5년 새 ‘최저’,https://img.asiatoday.co.kr/file/2025y/09m/10d/20250910010005481_250.jpg,"올해 상반기 글로벌 핀테크 시장은 지정학적 긴장과 무역 정책의 불확실성 속에 큰 폭으로 위축된 것으로 나타났다. 그 가운데 핀테크 산업에서 디지털 자산과 인공지능(AI) 분야가 새로운 성장축으로 부상하고 있다는 분석이 나왔다.삼정KPMG가 10일 발간한 '글로벌 핀테크 2025년 상반기 투자 결과 분석과 전망'에 따르면, 올 상반기 글로벌 핀테크 투자 규모는 447억달러(2216건)로 반기 기준 최근 5년 내 최저치를 기록했다. 특히 그간 핀..",,https://www.asiatoday.co.kr/kn/view.php?key=20250910010005481,아시아투데이
'농업4법' 통과·농축산 시장 방어… '농정 대전환' 토대 닦았다,https://img.asiatoday.co.kr/file/2025y/09m/10d/20250910010005520_250.jpg,세종// 새 정부 농정이 100일을 앞두고 있다. '농업4법' 통과부터 한미 상호관세 협상 타결 등 주요 현안이 일단락된 가운데 농업·농촌의 지속가능성 확보가 다음 과제로 떠오른다.10일 농림축산식품부 등에 따르면 이재명 정부는 오는 11일 출범 100일을 맞이한다. 지난 6월 득표율 약 49.4%로 당선된 이재명 대통령은 첫 내각 인사에서 송미령 농식품부 장관을 유임하는 선택으로 농정 첫발을 뗐다.새 정부 들어 농정은 굵직한 변화의 연속이었다..,,https://www.asiatoday.co.kr/kn/view.php?key=20250910010005520,아시아투데이
"통신망 뚫린 KT…정부 ""중대한 침해사고 규정, 통신3사 전수조사 착수""",https://img.asiatoday.co.kr/file/2025y/09m/10d/20250910010005925_250.jpg,"KT를 통한 무단 소액결제 피해가 확산되면서 통신망 보안 취약성에 대한 우려가 커지고 있다. 정부는 이번 사태를 '중대한 침해사고'로 규정하고 KT를 포함한 통신 3사 전수 조사에 나섰다.과학기술정보통신부는 10일 브리핑에서 사고 경위와 조사 상황을 공개하며 ""KT 통화기록 분석 결과 등록되지 않은 기지국 접속 정황을 8일 오후 확인했고 같은 날 저녁 침해사고로 접수했다""고 밝혔다. SK텔레콤과 LG유플러스에도 유사 사례 점검을 요청했으나 두..",,https://www.asiatoday.co.kr/kn/view.php?key=20250910010005925,아시아투데이
재정·검찰·방송개혁 '협치의 길' 열어둔 송언석,,송언석 국민의힘 원내대표가 10일 국회 교섭단체 대표연설에서 정부·여당을 비판하는 강경 발언을 쏟아내면서 정국은 다시 강대강 대치모드에 돌입했다. 지난 8일 이재명 대통령과 여야 대표 회담에서 서로 손을 맞잡고 '여야정 민생협의체' 구성에 합의하면서 조성된 협치 분위기가 여야 교섭단체 대표연설을 기점으로 뒤집혔다는 분석이다.송 원내대표는 이날 더불어민주당이 추진하는 3대 특검법과 내란특별재판부 설치를 문제 삼았다. 민주당이 이를 '사법 정의..,,https://www.asiatoday.co.kr/kn/view.php?key=20250911010005930,아시아투데이
"中, 대만에 대한 무력 사용 포기 안해 주장",https://img.asiatoday.co.kr/file/2025y/09m/10d/20250910010005929_250.jpg,"중국 정부가 10일 대만에 대한 무력 사용을 절대로 포기하지 않을 것이라고 강조했다. 그러나 평화통일 전망을 쟁취하기 위한 노력도 최대한 기울일 것이라고 밝혔다. 중국의 대만 담당 기구인 국무원 대만사무판공실 천빈화(陳斌華) 대변인은 10일 지난 3일 베이징에서 열린 '중국인민 항일전쟁 및 세계 반파시스트 전쟁 승리 80주년' 열병식과 관련한 기자 회견에서 ""(대만과의) 평화 통일 전망을 쟁취하기 위해 최대한 노력하겠다. 그러나 무력 사용을..",,https://www.asiatoday.co.kr/kn/view.php?key=20250910010005929,아시아투데이
"정청래 ""반공 웅변대회하는 줄""… 野 교섭단체 연설 깎아내린 與",https://img.asiatoday.co.kr/file/2025y/09m/11d/20250911010005928_250.jpg,"이재명 정부 첫 정기국회 교섭단체 연설은 고성과 비난으로 얼룩졌다. 정치권 안팎에선 '여야 협치' 메시지가 나올 것이란 기대 섞인 목소리가 나오기도 했지만, 여야 모두 강경 지지층에 기댄 대치노선을 택했다.10일 정청래 더불어민주당 대표는 송언석 국민의힘 원내대표의 연설을 두고 ""반공(反共) 웅변대회하는 줄 알았다""며 ""너무 소리를 꽥꽥 질러대서 귀에서 피가 날 것 같다""고 비판했다. 그러면서 ""협치를 하자면서 협박만 있었던 것 같다""고 지적..",,https://www.asiatoday.co.kr/kn/view.php?key=20250911010005928,아시아투데이
"송언석 ""李정부 100일 '혼용무도'… 국민의 정치로 돌아와야""",https://img.asiatoday.co.kr/file/2025y/09m/11d/20250911010005927_250.jpg,"송언석 국민의힘 원내대표는 10일 이재명 정부의 지난 100일을 '혼용무도(昏庸無道)의 시간'이라고 규정하며 '정치 보복'에만 몰두했다고 비판했다. 또 '내란특별재판부'와 검찰청 폐지를 포함한 정부조직법 개정안, 3대 특검법 개정안, 노란봉투법 등을 겨냥해 총공세를 펼쳤다.송 원내대표는 이날 국회 교섭단체 대표연설에서 ""작금의 국회는 다수 의석을 앞세운 집권 여당의 일방적인 폭주와 의회 독재의 횡포만 가득하다""며 ""여당 대표는 걸핏하면 '해산'..",,https://www.asiatoday.co.kr/kn/view.php?key=20250911010005927,아시아투데이
[IAA 2025] '소형 SUV' 본고장 유럽 사로잡는 기아 콘셉트 EV2,https://img.asiatoday.co.kr/file/2025y/09m/10d/20250910010005924_250.jpg,"기아는 9일부터 14일(현지시간)까지 독일 뮌헨에서 열린 'IAA 모빌리티 2025'에 참가했다. 기아는 IAA 2025 현장에서 콘셉트 EV2를 비롯해 EV3, EV4, EV5, EV6, EV9, PV5 패신저 등 총 7종의 전기차를 전시했다.",,https://www.asiatoday.co.kr/kn/view.php?key=20250910010005924,아시아투데이
"이앤인베스트먼트, '은행권 기후기술펀드 2호' 운용사 선정",https://img.asiatoday.co.kr/file/2025y/09m/10d/2025091001001003800059231.jpg,"벤처캐피탈 이앤인베스트먼트가 한국성장금융이 주관하는 '은행권 기후기술펀드 2호'의 위탁운용사(GP)로 선정됐다고 10일 밝혔다. 이앤인베스트먼트는 이번 펀드를 통해 최소 400억원 규모의 기후기술 펀드를 조성할 계획이며, 펀드 결성이 완료되면 운용 자산(AUM)은 누적 8000억원을 넘어설 전망이다. 이번 펀드는 탄소중립 실현에 기여하는 혁신 기술기업에 대한 투자를 핵심 목표로 삼는다. 특히 AI(인공지능), ICT(정보통신기술) 등 첨단 딥..",,https://www.asiatoday.co.kr/kn/view.php?key=20250910010005923,아시아투데이
K-9 폭발묘사탄 원인미상 폭발…파주 포병부대서 10명 부상,https://img.asiatoday.co.kr/file/2025y/09m/10d/20250910010005917_250.jpg,경기도 파주 소재 K-9 전차를 운용하는 포병부대에서 10일 오후 3시 20분께 훈련 중 원인미상의 폭발이 발생해 10명이 부상을 입었다.육군에 따르면 이 부대는 이날 K-9 자주포 운용에 관한 절차적 훈련을 진행 중이었다. 절차적 훈련은 실제 포탄을 사용하는 훈련이 아니라 교육의 성과 달성을 극대화하고자 '교육보조재'를 활용한 훈련을 말한다. 부대 주둔지에서 일부 부대원들이 K-9자주포 운용 훈련을 진행하던 중 교육보조재로 사용하던 '폭발효..,,https://www.asiatoday.co.kr/kn/view.php?key=20250910010005917,아시아투데이
"[IAA 2025] BYD, 헝가리 세게드에 유럽 첫 공장 설립...""유럽을 위해 유럽에서 생산""",https://img.asiatoday.co.kr/file/2025y/09m/10d/20250910010005880_250.jpg,"BYD가 10일(현지시간) 독일 뮌헨에서 열린 'IAA 모빌리티 2025'에서 헝가리 세게드에 건설 중인 유럽 첫 공장에서 소형 전기 SUV '돌핀 서프'를 생산할 예정이라고 밝혔다. 해당 공장은 2025년 말 완공 목표로 추진 중이며, 스텔라 리 BYD 부사장는 ""유럽을 위해 유럽에서 생산하는"" 전략의 출발점이 될 전망이다.",,https://www.asiatoday.co.kr/kn/view.php?key=20250910010005880,아시아투데이
"이두희 국방차관, 軍헬기 산불대응 태세 점검 ""재난을 안보상황으로 인식""",https://img.asiatoday.co.kr/file/2025y/09m/10d/20250910010005921_250.jpg,"이두희 국방부 차관은 10일 오후 경기도 이천의 육군 항공사령부를 방문해 산불 발생시 군 헬기 대응 준비상태를 점검했다. 이 차관은 가을철 산불조심기간을 앞두고, 군이 보유한 헬기의 물 투하 능력을 강화해 관계기관의 요청 시 즉각 대응할 수 있는 준비상태를 확인했다. 이 차관은 항공사 계류장에서 시누크 및 블랙호크 등 군 헬기 기종별로 물버킷·물탱크 등 산불진화 관련 장비 준비상태를 확인하고, 조종사들의 헌신적인 노고를 치하했다.이 차관은..",,https://www.asiatoday.co.kr/kn/view.php?key=20250910010005921,아시아투데이
"""73조원 시장 공략 시동""…W컨셉, 글로벌몰 전면 개편",https://img.asiatoday.co.kr/file/2025y/09m/10d/20250910010005919_250.jpg,패션 플랫폼 W컨셉이 글로벌몰을 전면 개편하고 일본 시장 공략에 속도를 낸다. K패션·뷰티 수요 급증에 일본을 아시아 거점 국가로 삼고 시장 내 입지 확대에 나설 계획이다.10일 W컨셉에 따르면 이번 개편은 일본 현지 맞춤 서비스 강화와 쇼핑 편의성 증대에 초점을 맞췄다. 일본어 검색과 인공지능(AI) 자동 번역 시스템을 도입해 상품 탐색 효율성을 높이고 결제 수단을 다양화했다. 특히 상품 상세 페이지에는 일본어로 상품 요약 정보를 별도 표기..,,https://www.asiatoday.co.kr/kn/view.php?key=20250910010005919,아시아투데이
재생에너지 사업에 ‘환경영향평가’…모순 안은 기후에너지환경부,https://img.asiatoday.co.kr/file/2025y/09m/10d/20250910010005826_250.jpg,"에너지와 환경을 아우르는 '공룡 부처'로 거듭날 기후에너지환경부가 상충하는 정책들을 조율하고 규제와 개발 조직을 안정화할 역량이 충분한지를 두고 의견이 분분하다. 전력망과 재생에너지 사업을 개발하면서 스스로 환경영향평가 규제를 소화해야 하는 모순으로 환경부 본연의 역할이 오히려 축소될 수 있다는 지적이 나온다.10일 업계에 따르면 이재명 정부는 출범 직후부터 에너지 고속도로, RE100 산업단지, 차세대 전력망, 분산에너지 특구 등 주요 에너..",,https://www.asiatoday.co.kr/kn/view.php?key=20250910010005826,아시아투데이
“0.5초면 결제 끝”…세계 첫 AI 무인계산 매장 열렸다,https://img.asiatoday.co.kr/file/2025y/09m/10d/20250910010005915_250.jpg,"새벽배송 전문기업 '오아시스마켓'이 세계 최초 실시간으로 상품 인식이 가능한 AI 무인계산 시스템 '루트100'을 선보인다. 10일 오아시스마켓에 따르면 '루트100'은 이날 서울 강남에 오픈하는 신규 매장에 적용됐다. 강남점은 100% 무인계산 매장으로 운영될 예정이다. 루트100은 오아시스마켓과 모회사 지어소프트가 공동 개발한 소형 AI 무인계산 시스템으로, 고객은 구매할 상품을 전용 레일에 올려두기만 하면 된다. 인공지능이 0.5초 이..",,https://www.asiatoday.co.kr/kn/view.php?key=20250910010005915,아시아투데이
"KT 무단 소액결제 피해규모 1억7000만원…정부 ""피해금액 미청구 방침""",https://img.asiatoday.co.kr/file/2025y/09m/10d/20250910010005892_250.jpg,"KT 무단 소액결제 사고의 피해액 규모가 1억7000만원 규모에 달하는 것으로 파악됐다.10일 과기부는 정부서울청사에서 진행된 KT고객 무단 소액결제 침해사고 관련 브리핑을 통해 KT의 자체 파악 결과, 현재까지 278건의 피해사례와 1억7000여만원의 금전적 피해가 발생한 것으로 집계됐다.KT는 무단 소액결제로 인한 피해를 입은 이용자들에 대해서는 피해 금액 전액을 청구하지 않기로 했으며, 과기부 역시 타 통신사에 대해서도 소액결제 피해가..",,https://www.asiatoday.co.kr/kn/view.php?key=20250910010005892,아시아투데이
"中, 이스라엘의 카타르 공습 규탄…""영토 주권 침해""",https://img.asiatoday.co.kr/file/2025y/09m/10d/20250910010005912_250.jpg,"중국 정부가 이스라엘의 카타르 도하 공습을 강하게 비판하며 사태 확대에 대한 우려를 드러냈다.로이터통신에 따르면, 중국 외교부는 10일 성명을 통해 ""이스라엘이 카타르의 영토 주권을 침해했다""며 공습을 규탄했다. 린젠 외교부 대변인은 이날 정례 브리핑에서 ""중국은 이번 공격이 가져올 수 있는 사태의 격화를 깊이 우려한다""고 밝혔다.앞서 이스라엘은 9일(현지시간) 팔레스타인 무장정파 하마스 고위급 제거를 명분으로 도하를 공습했다. 이스라엘의 이..",,https://www.asiatoday.co.kr/kn/view.php?key=20250910010005912,아시아투데이
"노동부, 심우정 딸 특혜채용에 ""채용절차법 위반"" 판단",https://img.asiatoday.co.kr/file/2025y/09m/10d/20250910010005911_250.jpg,"고용노동부(노동부)가 심우정 전 검찰총장의 장녀 특혜 채용 의혹과 관련해 국립외교원이 일부 채용절차법을 위반했다고 결론 내렸다.10일 노동부에 따르면 서울지방고용노동청은 국립외교원이 지난해 기간제 연구원 채용 과정에서 석사학위 자격이 필요한 자리에 '석사학위 예정자'였던 심씨를 합격시킨 것은 채용절차법 위반에 해당한다고 판단했다. 채용이 원서 접수, 서류전형, 면접, 최종합격자 발표순으로 진행돼 각 단계가 전 단계의 합격을 전제로 하는데, 최..",,https://www.asiatoday.co.kr/kn/view.php?key=20250910010005911,아시아투데이
참여연대 “‘소액결제 사태’ 원인 단정 말아야…KT 책임전가 시도 의심”,https://img.asiatoday.co.kr/file/2025y/09m/10d/20250910010005872_250.jpg,"KT 무단 소액결제 사태와 관련해 '해커의 불법 초소형 기지국 설치'가 원인으로 지목되고 있는 가운데 참여연대가 KT의 책임 돌리기 시도가 의심된다고 지적했다. 그러면서 섣불리 사건의 원인을 단정하지 말아야 한다고도 했다. 참여연대는 10일 논평을 내고 ""KT 소액결제 사태를 조사 중인 민관합동조사단은 오늘 해커가 불법 초소형 기지국을 설치했을 가능성을 염두에 두고 조사를 확대하고 있다고 했다""며 ""(그러나) 이미 다수의 전문가들이 불법 초소..",,https://www.asiatoday.co.kr/kn/view.php?key=20250910010005872,아시아투데이
부산서 '동물보호의 날' 첫 축제,https://img.asiatoday.co.kr/file/2025y/09m/10d/20250910010005391_250.jpg,"세종// 농림수산식품교육문화정보원(농정원)은 이달 26일일부터 27일까지 부산BEXCO 2전시장에서 개최하는 '제1회 동물보호의 날 축제' 자원봉사자를 모집한다고 10일 밝혔다.동물보호법에 제정된 '제1회 동물보호의 날)'을 기념하기 위해 마련된 축제는 동물복지에 대한 정부의 지향점을 알리고 '사람과 동물이 공존하는 성숙한 반려문화' 확산을 목표로 한다.자원봉사자 모집은 22일일까지 진행하며, 1365자원봉사포털에서 봉사명(동물보호의 날)을 검..",,https://www.asiatoday.co.kr/kn/view.php?key=20250910010005391,아시아투데이
"李대통령 ""150조원 국민성장펀드, 대한민국 미래 초석 될 것""",https://img.asiatoday.co.kr/file/2025y/09m/10d/20250910010005896_250.jpg,"이재명 대통령은 10일 AI(인공지능), 바이오, 반도체, 방산, 항공·우주 등 대한민국 주력 첨단전략산업을 적극 육성하기 위한 '국민펀드 150조원' 조성 계획을 밝혔다. 역량 있는 벤처·혁신 기업에 국민펀드 150조원을 집중 분배해 글로벌 기업을 만드는 것은 물론 첨단전략산업 성장 과실을 국민들과 공유해 '우리 경제의 재도약'을 이끈다는 목표다.이 대통령은 이날 오후 서울 마포구 창업지원센터 프론트원에서 열린 '국민성장펀드 보고 대회'에서..",,https://www.asiatoday.co.kr/kn/view.php?key=20250910010005896,아시아투데이
"글로벌 가상자산 제도화에…""韓 스테이블코인 도입 필요성 강조""",https://img.asiatoday.co.kr/file/2025y/09m/10d/20250910010005825_250.jpg,"미국, 일본 등 글로벌부터 가상자산 시장 법제화가 진행되고 있는 가운데, 가상자산 기업 대표 및 관계자가 원화 '스테이블코인(stablecoin)'의 이점과 도입 필요성에 대해 강조하고 나섰다. 10일 서울 강남구 슈피겐홀에서 개최된 'BTCON2025'에 참석한 김종승 엑스크립톤(Xcrypton) 대표가 국내 원화 스테이블코인 현황과 원화 스테이블코인 도입 방법에 대한 입장을 전했다. 스테이블코인은 법정화폐로 표시한 코인의 가격이 거의 변동..",,https://www.asiatoday.co.kr/kn/view.php?key=20250910010005825,아시아투데이
'서부지법 난동' 30대 징역 1년 6개월…가담자 5명 실형,https://img.asiatoday.co.kr/file/2025y/09m/10d/20250910010005897_250.jpg,서울서부지법 난동 사태 당시 법원에 침입한 30대가 징역 1년 6개월에 처해지는 등 가담자 5명이 모두 실형을 선고받았다.서울서부지법은 10일 특수건조물침입·특수공무집행방해 등 혐의로 기소된 오모씨(38)에게 징역 1년 6개월을 선고했다.오씨는 지난 1월 19일 새벽 윤석열 전 대통령에 대한 구속영장이 발부되자 시위대와 함께 법원으로 침입한 뒤 이를 막는 경찰을 밀치며 폭행한 혐의로 재판에 넘겨졌다.오씨는 법원 침입 전 이른바 'MZ자유결사대..,,https://www.asiatoday.co.kr/kn/view.php?key=20250910010005897,아시아투데이
농촌 어르신 '보이스피싱' 막고 건강검진,https://img.asiatoday.co.kr/file/2025y/09m/10d/20250910010005322_250.jpg,"세종// 농림축산식품부와 KB금융그룹과 행복한 농촌 만들기를 위해 힘을 모은다농식품부는 10일 KB금융그룹과 전북 진안군을 시작으로 5개 시·군 농촌지역에 대학생 농촌 재능 나눔 활동과 보이스피싱 예방 캠페인을 연계한 협업을 추진한다고 밝혔다. 이와 관련 대학생들이 필수서비스가 부족한 농촌 현장을 방문해 보이스피싱 예방 교육과 이·미용, 기초 건강검진, 물리치료 등 농촌 재능 나눔 활동을 진행한다. 또한 KB금융그룹은 대학생 봉사자와 농촌주민들..",,https://www.asiatoday.co.kr/kn/view.php?key=20250910010005322,아시아투데이
"애경산업 '럽센트' 신제품 출시…“피부는 매끈, 잔향은 오래”",https://img.asiatoday.co.kr/file/2025y/09m/10d/20250910010005898_250.jpg,"애경산업의 퍼스널센트 바디케어 브랜드 '럽센트(LUVSCENT)'가 스크럽 바디워시 신제품 4종을 선보인다고 10일 밝혔다. 이번 신제품은 프랑스산 프리미엄 향료를 활용해 글로벌 향료사와 공동 개발한 '럽센트'만의 시그니처 생화향을 담은 것이 특징이다. 가든 로즈, 핑크 피오니, 미모사, 자스민 등 4가지 향으로 구성됐다.회사 관계자는 ""코코넛 껍질 가루 등 자연 유래 저자극 스크럽제를 포함해 피부 각질을 부드럽게 관리할 수 있다""고 했다...",,https://www.asiatoday.co.kr/kn/view.php?key=20250910010005898,아시아투데이
"‘성폭행범 혀 깨물어 유죄’ 최말자씨, 61년 만에 재심서 무죄",https://img.asiatoday.co.kr/file/2025y/09m/10d/20250910010005883_250.jpg,"61년 전 자신을 성폭행하려던 남성의 혀를 깨물어 중상해 혐의로 기소돼 유죄 판결을 받았던 최말자씨(78)가 재심에서 무죄를 선고받았다.부산지법 형사5부(김현순 부장판사)는 10일 오후 중상해 혐의를 받는 최씨에 대한 재심 선고기일을 열고 최씨에게 무죄를 선고했다.재판부는 ""중상해를 인정할 증거가 부족하다""며 ""피고인이 피해자의 혀를 깨문 것과 관련해 정당방위라고 인정돼 상해죄도 성립하지 않는다""고 판시했다.선고 직후 최씨 일행과 변호인, 한..",,https://www.asiatoday.co.kr/kn/view.php?key=20250910010005883,아시아투데이
"그라비티 게임 비전(GGV), '라그나로크 : 트와일라잇' 동남아 지역 CBT 개시",https://img.asiatoday.co.kr/file/2025y/09m/10d/20250910001651399_250.jpg,"10일 그라비티의 홍콩 지사인 그라비티 게임 비전(Gravity Game Vision, GGV)이 MMORPG ‘라그나로크 : 트와일라잇'의 동남아시아 지역 CBT를 시작했다.라그나로크 : 트와일라잇 동남아시아 지역 CBT는 현지 시간 기준으로 9월 10일 9시부터 9월 18일 10시까지 진행한다. 각 지역 구글 플레이와 화웨이 앱갤러리에서 CBT 버전 다운로드 후 바로 플레이할 수 있다.라그나로크 : 트와일라잇은 라그나로크 온라인의 클래식한..",,https://www.asiatoday.co.kr/kn/view.php?key=20250910001651399,아시아투데이
‘부정거래 의혹’ 방시혁 15일 경찰 소환 조사,https://img.asiatoday.co.kr/file/2025y/09m/10d/20250910010005876_250.jpg,방시혁 하이브 의장이 자본시장법 위반 혐의로 오는 15일 경찰 소환 조사를 받는다.서울경찰청 금융범죄수사대는 15일 오전 10시께 방 의장을 피의자 신분으로 불러 조사할 계획이라고 10일 밝혔다. 방 의장은 출석 당일 취재진 포토라인을 지날 것으로 예상된다.방 의장은 하이브 상장 전인 2019년 벤처캐피털 등 기존 하이브 투자자들에게 기업공개(IPO) 계획이 없다고 속인 뒤 자신과 관계 있는 사모펀드가 설립한 특수목적법인(SPC)에 지분을 팔..,,https://www.asiatoday.co.kr/kn/view.php?key=20250910010005876,아시아투데이
"[IAA 2025] 기아, EV 라인업 대거 공개…북적이는 오픈 부스",https://img.asiatoday.co.kr/file/2025y/09m/10d/20250910010005889_250.jpg,"기아는 9일부터 14일(현지시간)까지 독일 뮌헨에서 열린 'IAA 모빌리티 2025'에 참가했다. 기아는 IAA 2025 현장에서 콘셉트 EV2를 비롯해 EV3, EV4, EV5, EV6, EV9, PV5 패신저 등 총 7종의 전기차를 전시했다.",,https://www.asiatoday.co.kr/kn/view.php?key=20250910010005889,아시아투데이
"[IAA 2025] ""아이오닉 보러가자"" 관람객 줄 잇는 현대차 야외 부스",https://img.asiatoday.co.kr/file/2025y/09m/10d/20250910010005877_250.jpg,현대차가 9일부터 14일(현지시간)까지 독일 뮌헨에서 열린 'IAA 모빌리티 2025'에 참가했다. 현대차는 아이오닉의 첫 소형 EV 콘셉트카 '콘셉트 쓰리'를 선보였다. 콘셉트 쓰리는 공기역학적 성능을 강조한 해치백 디자인인 '에어로 해치(Aero Hatch)'가 특징이다.,,https://www.asiatoday.co.kr/kn/view.php?key=20250910010005877,아시아투데이
"송미령 농식품부 장관 ""동물권리 보장하는 동물복지 선진국 나아갈 것""",https://img.asiatoday.co.kr/file/2025y/09m/10d/20250910010005874_250.jpg,"세종// 송미령 농림축산식품부 장관은 10일 ""동물복지 분야의 국정과제를 마련한 만큼 동물의 권리를 보장하는 동물복지 선진국으로 나갈 계획""이라고 밝혔다.송 장관은 이날 오후 서울 하나증권센터에서 주요 동물보호단체장과 간담회를 갖고 이같이 말했다.이번 간담회는 오는 10월4일 법정기념일로 지정된 '제1회 동물보호의 날'을 맞아 동물복지 강화를 위한 정부 정책방향을 공유하고, 관련 단체 건의사항 등을 수렴하기 위해 마련됐다.농식품부에 따르면 간담..",,https://www.asiatoday.co.kr/kn/view.php?key=20250910010005874,아시아투데이
"정부 ""통신 3사, 신규 초소형 기지국 접속 전면 제한""",https://img.asiatoday.co.kr/file/2025y/09m/10d/20250910010005887_250.jpg,"KT를 통한 무단 소액결제 피해가 확산되면서 통신망 보안 취약성에 대한 우려가 커지고 있다. 정부는 이번 사태를 ""중대한 침해사고""로 판단하고 통신 3사를 대상으로 불법 기지국 접속 여부를 전수 조사 중이다. 과학기술정보통신부는 10일 브리핑을 통해 사고 경위와 조사 진행 상황을 공개하고 소액결제 피해에 대한 대응 방안을 밝혔다.이날 정부서울청사에서 진행된 현안 브리핑서 류제명 과기정통부 2차관은 ""KT 통화기록 분석 결과 등록되지 않은 기지..",,https://www.asiatoday.co.kr/kn/view.php?key=20250910010005887,아시아투데이
