title,thumbnail,short_content,write_time,link,company
"트럼프 지지 미 대학가 공개토론 진행 커크, 행사 중 총격, 위독",https://img.asiatoday.co.kr/file/2025y/09m/11d/20250911010005994_250.jpg,"도널드 트럼프 미국 대통령을 지지하는 우파 단체 '터닝포인트 USA' 창립자 찰리 커크가 미국 유타주 오렘의 유타밸리대에서 행사 참가 도중 총에 맞아 위중한 상태라고 AP통신·야후뉴스 등이 10일(현지시간) 전했다.보도를 종합하면 커크는 유타밸리대에서 진행된 야외 집회에서 연설 중 푸드코트 근처에서 한발의 총성이 울려 퍼지면서 총탄이 커크의 목에 명중했고, 한 법 집행기관 관계자는 커크가 병원에서 치료를 받고 있으나 위독한 상태다.유타밸리대..",,https://www.asiatoday.co.kr/kn/view.php?key=20250911010005994,아시아투데이
"중기부, '납품대금 연동약정 사례집' 발간",https://img.asiatoday.co.kr/file/2025y/09m/10d/20250910010005916_250.jpg,"중소벤처기업부는 납품대금 연동제 시행 2주년을 맞아 기업들이 연동약정 체결 때 참고할 수 있도록 '납품대금 연동약정 사례집'을 발간했다고 11일 밝혔다.이번 사례집은 작년 납품대금 연동약정 컨설팅을 받은 실제 사례(987건) 중 주요 수·위탁거래 사례 14건을 선별해 제작됐으며 △주요 업종별 주요 원재료, 산식 등 연동약정 사례 △원재료 가격 변동에 따른 납품대금 조정 예시 △우수 연동사례 소개 △납품대금 연동약정 컨설팅 개요·문의처 안내..",,https://www.asiatoday.co.kr/kn/view.php?key=20250910010005916,아시아투데이
"김범석號 배달의민족, 음식서 금융까지 생활 전반 구독 모델로 승부",https://img.asiatoday.co.kr/file/2025y/09m/10d/20250910010005786_250.jpg,"김범석 대표가 이끄는 배달의민족이 글로벌 동영상 플랫폼 유튜브와 손잡고 시장 공략에 속도를 높이고 있다. 시장에선 후발주자인 쿠팡이 '와우 멤버십'으로 배송과 쿠팡플레이를 묶어 추격하는 상황에서, 배민이 승부수를 던졌다는 평가를 내놓고 있다. 10일 우아한형제들에 따르면 배민은 오는 24일부터 '배민클럽-유튜브 프리미엄 제휴 상품'을 출시한다. 이 상품은 월 1만3990원으로 배민 무료 배달과 광고 없는 유튜브 프리미엄을 동시에 이용할 수 있..",,https://www.asiatoday.co.kr/kn/view.php?key=20250910010005786,아시아투데이
[백운산 오늘의 운세] 2025년 9월 11일,https://img.asiatoday.co.kr/file/2025y/08m/11d/20250811001417337_1.jpg,쥐띠36년 아무리 답답해도 화내지 않는다. 48년 꼬였던 문제들이 잘 풀린다.60년 즐겁게 가족 여행을 간다.72년 집안에 즐거운 일이 가득 생긴다. 84년 묵은 근심이 사라진다.96년 금전 운이 좋아져 밀린 빚을 갚는다.소띠37년 근심이 사라진다.49년 짜증 나는 일이 없으니 대길하다.61년 씁쓸한 말을 들어도 웃어넘긴다.73년 마음을 비우고 수련에 집중한다.85년 화를 참아내니 얼굴이 밝아진다.97년 불길한 운이 사라지니 마음이 편하다. 범..,,https://www.asiatoday.co.kr/kn/view.php?key=20250811001417337,아시아투데이
"미 NBC ""10일 300여명 한국인 탑승 예정 전세기 편 취소""",https://img.asiatoday.co.kr/file/2025y/09m/11d/20250911010005991_250.jpg,"지난 4일(현지시간) 미국 조지아주 한국 배터리 공장 건설 현장에서 이민 당국에 체포돼 구금된 한국인 300여명이 예정된 10일 출국하기 어려울 것이라고 미국 NBC방송이 보도했다.NBC는 300여명의 한국인이 이날 전세기편으로 미국을 떠날 예정이었던 조지아주 하츠필드-잭슨 애틀랜타 국제공항 대변인이 ""전세기 편이 취소됐다""고 밝혔다고 전했다.이날 오전 10시 21분 인천공항에서 이륙한 대한항공 전세기 KE2901편은 같은 날 오전 늦게 하츠..",,https://www.asiatoday.co.kr/kn/view.php?key=20250911010005991,아시아투데이
"조현 외교-루비오 미 국무 긴급 회담, 외교부 ""트럼프, 루비오에 한국 원하는 대로 조치 지시""",https://img.asiatoday.co.kr/file/2025y/09m/11d/20250911010005989_250.jpg,"조현 외교부 장관은 10일(현지시간) 마코 루비오 미국 국무부 장관 겸 백악관 국가안보보좌관을 만나 미국 이민세관단속국(ICE) 조지아주 구금 시설에 있는 한국민의 조기 출국과 향후 미국 입국 때 불이익이 없도록 해 달라고 요청해 긍정적인 반응을 얻었다고 외교부가 전했다.조 장관은 이날 오전 워싱턴 D.C. 백악관에서 루비오 장관을 만나 이같이 요청했고, 이에 루비오 장관은 ""도널드 트럼프 대통령이 한국 측이 원하는 바대로 가능한 한 이루어질..",,https://www.asiatoday.co.kr/kn/view.php?key=20250911010005989,아시아투데이
"미 국무부 ""루비오 장관, 조현 외교장관에 한국의 미국 투자 환영""...한국인 석방 언급 없어",https://img.asiatoday.co.kr/file/2025y/09m/11d/20250911010005988_250.jpg,"마코 루비오 미국 국무부 장관은 10일(현지시간) 조현 외교부 장관에게 ""한국의 대(對)미국 투자를 환영하며 이 분야의 협력을 심화하는 데 관심을 표명했다""고 국무부가 전했다.루비오 장관은 이날 오전 미국 워싱턴 D.C. 백악관에서 조 장관을 만나 이같이 말했다고 국무부는 알렸다.다만 국무부는 보도자료에서 루비오 장관과 조 장관이 이날 석방돼 귀국하기로 했다가 석방이 지연되고 있는 한국인 300여명의 자진 출국 문제에 관한 논의가 있었는지는..",,https://www.asiatoday.co.kr/kn/view.php?key=20250911010005988,아시아투데이
미중 국방장관 화상통화 통해 소통,https://img.asiatoday.co.kr/file/2025y/09m/11d/20250911010005987_250.jpg,"둥쥔(董軍) 중국 국방부장(장관)이 피트 헤그세스 미국 국방부 장관과 9일 가진 화상통화에서 ""대만을 이용해 중국을 견제하려는 어떠한 시도나 간섭도 좌절될 것""이라고 말했다.10일 중국 국방부에 따르면 미중 양국 국방장관은 전날 저녁 미국 측의 요청으로 화상통화를 가졌다. 둥 부장은 이 통화에서 ""열린 태도를 유지해야 한다. 또 소통과 교류를 유지하면서 평등 존중·평화 공존·상호 존중을 기반으로 안정적이고 긍정적 군사 관계를 구축해야 한다""면..",,https://www.asiatoday.co.kr/kn/view.php?key=20250911010005987,아시아투데이
"[FC PRO 챔피언스] 부활한 FC 온라인 황제 곽, 디플러스 기아 4강 견인",https://img.asiatoday.co.kr/file/2025y/09m/10d/20250910002248252_250.jpg,"FC 온라인 황제 '곽' 곽준혁이 디플러스 기아의 4강 진출을 견인했다.10일 중국 상하이에서 열린 'FC 프로 챔피언스 컵 2025' 8강전에서 디플러스 기아와 DRX가 맞붙었다. 이번 대회에는 한국과 중국, 태국, 베트남을 대표하는 12개 팀이 참가했다. 한국에서는 젠시티와 디플러스 기아, DRX가 출전해 모두 8강에 올랐다.조별 예선에서 디플러스 기아는 세계 최강 젠시티를 꺾고 2승 무패로 당당히 8강에 올랐다. 특히 올해 부진했던 곽이..",,https://www.asiatoday.co.kr/kn/view.php?key=20250910002248252,아시아투데이
영유권 분쟁 황옌다오에 中 국가급 보호구역 신설,https://img.asiatoday.co.kr/file/2025y/09m/10d/20250910010005984_250.jpg,중국 정부가 필리핀과 영유권 분쟁을 벌이고 있는 남중국해 황옌다오(黃岩島·스카버러 암초)에 국가급 자연보호 구역을 신설하기로 결정했다. 섬을 자국의 영토로 완전히 편입하겠다는 강렬한 의지를 담은 결정이라고 할 수 있을 것 같다. 당연히 필리핀의 즉각 반발을 부를 것으로 보인다. 베이징 외교 소식통들의 10일 전언에 따르면 중국 국무원은 이날 황옌다오에 국가급 자연보호 구역을 신설하려는 자연자원부의 제안을 승인했다고 밝혔다. 승인의 명분으로..,,https://www.asiatoday.co.kr/kn/view.php?key=20250910010005984,아시아투데이
"中 외교부, 美의 韓 공장에서 중국인도 체포 발표",https://img.asiatoday.co.kr/file/2025y/09m/10d/20250910010005983_250.jpg,"중국 외교부가 미국 이민 당국이 지난 4일(현지 시간) 조지아주 현대차그룹-LG에너지솔루션 합작 배터리 공장을 단속하는 과정에서 중국인도 체포됐다고 10일 밝혔다.린젠(林檢) 외교부 대변인은 이날 열린 정례 브리핑에서 중국인의 구금 여부를 파악하고 있는지에 관한 취재진 질의에 ""우리는 관련 보도에 주목했다""면서 ""미국 주재 중국 대사관은 상황을 상세히 파악하면서 이번 일에 관련된 중국 공민(시민)에 직무 범위 안에서 필요한 조력을 제공하고 있..",,https://www.asiatoday.co.kr/kn/view.php?key=20250910010005983,아시아투데이
'내란 연루 의혹' 국정원 “계엄사 인력 파견 계획 사실 아냐”,https://img.asiatoday.co.kr/file/2025y/09m/10d/20250910010005979_250.jpg,"국가정보원(국정원)이 10일 '12·3 비상계엄' 당시 직원 80여명을 계엄사에 파견하려 했다는 주장에 대해 ""비상사태 대응 시나리오 내용을 단순 인용한 것""이라고 밝혔다. 직원들이 재출근 지시를 받았다는 의혹엔 ""별도 지시 없이 자발적으로 출근한 것""이라고 해명했다. 비상계엄 사태 연루 의혹에 대해 적극 반박에 나선 것이다.국정원은 이날 입장문을 내고 ""(지난해) 12월 3일 작성된 문서는 실무직원 본인이 참고하기 위한 초안 형태의 문건과..",,https://www.asiatoday.co.kr/kn/view.php?key=20250910010005979,아시아투데이
조계종 중앙종회 235회 임시회...호계원 자료 제출 놓고 격론,https://img.asiatoday.co.kr/file/2025y/09m/10d/20250910010005978_250.jpg,"대한불교조계종 중앙종회가 사법부에 해당하는 호계원에 자료 제출을 요구하는 것을 법제화하는 것을 두고 격론이 벌어졌다. 하루만에 회의는 끝났지만 첨예한 사안을 두고서는 종회의원 간의 치열한 논쟁이 이어져 눈길을 끌었다.조계종 중앙종회는 10일 서울 봉은문화회관에서 제235회 임시회를 열고 종헌·종법 개정안 및 인사의 안 등을 처리했다. 이번 임시회에는 7인의 초심호계원 호계위원을 9인으로 늘리고, 비구니 관련 사건 심판에는 비구니 초심호계위원..",,https://www.asiatoday.co.kr/kn/view.php?key=20250910010005978,아시아투데이
투쟁수위 끌어올리는 금감원 직원들…오픈채팅방 열고 '파업카드' 만지작,https://img.asiatoday.co.kr/file/2025y/09m/10d/20250910010005973_250.jpg,"금융감독원 직원들 사이에서 정부의 금융소비자보호처 분리와 공공기관 재지정 방안에 대한 반발이 확산하고 있다. 최근 개설된 오픈채팅방을 통해 개편 소식과 내부 의견이 빠르게 공유되며 기류가 거세지는 모습이다. 금감원 노조는 비상대책위원회 발족과 파업 투표 논의 등 대응 수위를 높이고 있다.10일 금감원에 따르면 직원들은 전날에 이어 이틀째 서울 여의도 본원 로비에서 '금소원 분리 철회', '공공기관 지정 철회'를 요구하며 집회를 이어갔다. 현장..",,https://www.asiatoday.co.kr/kn/view.php?key=20250910010005973,아시아투데이
"한변, 노란봉투법 헌법소원 청구…""죄형법정주의 위반·경제활동 자유 침해""",https://img.asiatoday.co.kr/file/2025y/09m/10d/20250910010005969_250.jpg,"한반도 인권과 통일을 위한 변호사모임(한변) 명예회장 김태훈 변호사가 10일 여러 중소기업을 대리해 헌법재판소(헌재)에 '노란봉투법(노동조합법 2·3조 개정안)'에 대한 위헌 확인 헌법소원을 청구했다.김 변호사는 ""노란봉투법은 사용자 범위를 '실질적 지배력'이란 모호한 기준으로 확대해 헌법상 죄형법정주의를 위반하고 형사처벌 위험을 증가시킨다""며 ""구조조정 등 고도의 경영 판단 마저 파업 대상으로 삼아 경제활동의 자유와 계약·영업의 자유를 침해한..",,https://www.asiatoday.co.kr/kn/view.php?key=20250910010005969,아시아투데이
"김건희 특검, '삼부토건 주가조작' 이기훈 부회장 체포",https://img.asiatoday.co.kr/file/2025y/09m/10d/20250910010005971_250.jpg,"민중기 김건희 특검팀이 삼부토건 주가조작의 '그림자 실세'로 지목된 이기훈 삼부토건 부회장을 체포했다. 지난 7월 구속심사를 앞두고 도주한 지 두 달여 만이다.김건희 특검팀은 10일 언론 공지를 통해 ""서울경찰청 형사기동대와 공조해 이날 오후 6시14분 목포에서 이기훈을 체포영장에 의해 체포했다""고 밝혔다. 이 부회장은 곧바로 서울구치소로 이송될 예정이다. 이날 특검팀의 조사는 예정돼 있지 않다.이 부회장은 삼부토건 전현직 임원들과 2023년..",,https://www.asiatoday.co.kr/kn/view.php?key=20250910010005971,아시아투데이
"여야, 3대 특검법 '추가 연장 없는' 수정안 합의…금감위 설치법도 협조",https://img.asiatoday.co.kr/file/2025y/09m/10d/20250910010005975_250.jpg,"국민의힘은 10일 여야 원내대표 회동에서 금융감독위원회 설치법 제·개정에 최대한 협조하기로 합의했다고 밝혔다. 이어 더불어민주당도 3대 특검(내란·김건희·채상병)법 개정안에 대한 국민의힘의 '수정 '추가 연장 제외' 요구를 수용하기로 했다. 수정안은 내일(11일) 국회 본회의에서 처리될 예정이다.유상범 원내수석부대표는 이날 오후 여야 회동을 마친 뒤 기자들과 만나 ""특검이 군·검찰에 재판 중인 사건에 대해 수사를 지휘하는 것이 형사법체계에..",,https://www.asiatoday.co.kr/kn/view.php?key=20250910010005975,아시아투데이
"삼일PwC ""국내 E&M산업, 가치 창출하려면 전문성 필수""",https://img.asiatoday.co.kr/file/2025y/09m/10d/20250910010005972_250.jpg,"국내 엔터테인먼트 및 미디어(E&M) 기업은 디지털 콘텐츠 확장, 글로벌 시장 개척, 현 정부의 문화예술산업 지원 확대에 대한 기대감 등을 바탕으로 성장 기회를 모색하고 있다. K-콘텐츠가 더욱 성장하기 위해서는 글로벌 협업 생태계 구축 및 전략적 인공지능(AI) 도입 등 다각적인 전략이 요구된다는 제언이 나왔다.삼일PwC는 지난 9일 서울 용산구 본사 2층 아모레홀에서 이 같은 내용을 담은 '엔터테인먼트 산업 전망 및 비즈니스 세미나..",,https://www.asiatoday.co.kr/kn/view.php?key=20250910010005972,아시아투데이
"금융 전문가에서 작가로 변신한 최재필, ‘내 인생의 빛나는 시간 오십’ 출간",https://img.asiatoday.co.kr/file/2025y/09m/10d/20250910001842188_250.jpg,"금융 전문가에서 작가로 변신한 최재필이 인생의 두 번째 무대에 도전장을 내밀었다.30년간 금융 현장에서 디지털 대전환의 최전선에 몸담았던 그는 최근 자기계발서 '내 인생의 빛나는 시간 오십, 당신의 전성기는 이제 시작된다'를 출간했다.최재필 작가는 오십을 ‘인생의 하강기’로 바라보는 사회 통념을 깨고, 오히려 ‘전성기의 시작’으로 재정의한다. 그는 오십 세대를 “두 나라(가난했던 대한민국과 지금의 경제 강국), 두 지구(현실 세계와 온라인 세..",,https://www.asiatoday.co.kr/kn/view.php?key=20250910001842188,아시아투데이
"[속보] 여야 원내대표 ""3대 특검법 개정안 수정·금감위 설치법 협조 합의""",https://img.asiatoday.co.kr/file/2025y/09m/10d/20250910010005970_250.jpg,"[속보] 여야 원내대표 ""3대 특검법 개정안 수정·금감위 설치법 협조 합의""",,https://www.asiatoday.co.kr/kn/view.php?key=20250910010005970,아시아투데이
[이재명 100일 성과]'코스피 5000달성' 절반의 성공…기업 氣 살릴 부양책 급하다,https://img.asiatoday.co.kr/file/2025y/09m/10d/20250910010005895_250.jpg,출범 100일을 맞은 이재명 정부의 '자본시장 활성화' 정책은 '절반의 성공'으로 평가된다. 이 대통령은 취임 직후 한국거래소를 찾아 '코스피 5000달성' 의지를 재차 드러낸 바 있다. 코리아 디스카운트 해소를 위해 주가조작 등 불공정거래를 근절시켜 시장 정상화를 이뤄내겠다는 취지에서다. 이에 따라 이번 정부 출범 이후 약 한 달만에 금융위원회·금융감독원·한국거래소가 합동으로 만든 '주가조작근절합동대응단'이 출범했다. 불공정거래에 대한 무관..,,https://www.asiatoday.co.kr/kn/view.php?key=20250910010005895,아시아투데이
확산하는 'KT 소액 결제 공포'…잇따르는 '피해 신고',https://img.asiatoday.co.kr/file/2025y/09m/10d/20250910010005788_250.jpg,"""나도 곧 당할지 어떻게 알아요.""경기 수원에서 사는 A씨(34)는 10일 이렇게 말했다. 나도 모르는 사이에 휴대폰을 통해 돈이 빠져나가는 'KT 소액 결제 사태' 얘기다. 이는 서울 금천과 경기 광명 등에서 거주 중인 이들 대상으로 휴대폰에서 수십만원 정도가 결제되고 있는 일이다. 해당 지역을 지나가기만 해도 결제된다는 괴담에 A씨는 '휴대폰 소액결제 원천 차단'까지 했다. A씨는 인근 다른 지역에서도 피해 사례가 나오면서 걱정이라고 호소..",,https://www.asiatoday.co.kr/kn/view.php?key=20250910010005788,아시아투데이
"[속보] 김건희 특검, 삼부토건 부회장 이기훈 목포서 체포",https://img.asiatoday.co.kr/file/2025y/09m/10d/20250910010005968_250.jpg,"[속보] 김건희 특검, 삼부토건 부회장 이기훈 목포서 체포",,https://www.asiatoday.co.kr/kn/view.php?key=20250910010005968,아시아투데이
"'제조 AX 1등' 향해 뭉친 기업들… ""2030년 100兆 부가가치""",https://img.asiatoday.co.kr/file/2025y/09m/11d/20250911010005967_250.jpg,"국내 1000여개 기업·연구기관이 참여하는 대규모 '제조업 AI 전환' 프로젝트가 가동을 시작했다. 2030년까지 AI 팩토리 500개를 보급하고 휴머노이드를 연 1000대 이상 양산하는 등의 내용이 담겼다. 산업현장에 AI를 본격 활용 하면서 획기적으로 개선 될 생산성은 기본이고, 이를 통해 또다른 AI 산업 경쟁력을 키워 2030년까지 총 100조 원의 부가가치를 만들어 내기로 했다. 10일 김정관 산업통상자원부..",,https://www.asiatoday.co.kr/kn/view.php?key=20250911010005967,아시아투데이
"토요타, HEV '대표주자' 프리우스... 6년 만에 연 판매 1000대 돌파하나",https://img.asiatoday.co.kr/file/2025y/09m/10d/20250910010005962_250.jpg,"토요타의 간판 하이브리드 자동차 프리우스가 6년 만에 연간 1000대 판매 재도전에 나섰다. 전동화 전환이 가속화되는 시장에서 하이브리드 강자의 위상을 다시 확인할 수 있을지 관심이 쏠린다.10일 카이즈유데이터연구소에 따르면 올해 상반기 국내 하이브리드 자동차 판매는 22만8478대로, 지난해 같은 기간 대비 21.6% 증가했다. 상반기 전체 신차 판매에서 차지하는 비중도 27.1%에 달했다. 디젤차 판매가 줄어드는 대신 하이브리드와 전기차가..",,https://www.asiatoday.co.kr/kn/view.php?key=20250910010005962,아시아투데이
[이재명 정부 100일] 정부 효율화에 방점…조직개편 기대감 '업',https://img.asiatoday.co.kr/file/2025y/09m/10d/20250910010005829_250.jpg,"세종// 이재명 정부가 출범 100일을 앞두고 대규모 정부 조직개편을 단행했다. 기획재정부에 집중된 권한을 분산하고, 환경부를 기후에너지환경부로 확대하는 등 새 정부 기조에 맞춰 국가 정책의 실효성을 높이고 지속 가능한 성장 기반을 마련하려는 취지다. 다만 조직 개편이 실질적 효과를 거두려면 부처 간 협력을 잘 이끌어내 행정 효율성을 높여야 한다는 지적도 나온다.10일 당정에 따르면 기존 기재부는 내년부터 재정경제부와 기획예산처로 나뉜다. 재경..",,https://www.asiatoday.co.kr/kn/view.php?key=20250910010005829,아시아투데이
'서민대출 금리 잔인' 언급한 李에 카드사도 예의주시,https://img.asiatoday.co.kr/file/2025y/09m/10d/20250910010005873_250.jpg,이재명 대통령이 서민대출 금리가 15%대에 달한다는 점을 두고 '잔인하다'라고 평가하면서 카드사들이 긴장하는 분위기다. 카드사들이 주로 취급하는 '카드론(장기카드대출)'의 평균 금리가 14%대에 아르는 만큼 카드사들에 대한 금리 인하 압박이 현실화할 수 있다는 판단에서다. 카드사들은 저신용자에 대해 연체 리스크를 반영해 높은 금리를 적용하는 만큼 무리해서 금리를 인하할 경우 건전성이 악화할 수 있다고 보고 있다. 일각에서는 저신용자들에 대한..,,https://www.asiatoday.co.kr/kn/view.php?key=20250910010005873,아시아투데이
포용금융 어디로…은행권 이자장사에 내몰린 중·저신용자,https://img.asiatoday.co.kr/file/2025y/09m/10d/20250910010005817_250.jpg,"올해 본격적인 금리 인하기에 접어들었지만 중·저신용자들은 금리 하락 효과를 체감하지 못하고 있다. 은행들이 중·저신용자 대출의 가산금리를 높이고 우대금리를 축소하면서 여전히 높은 금리가 유지되고 있어서다. 정부와 금융당국은 '포용금융' 기치 아래 중·저신용자 대상 자금 공급 확대를 주문하고 있지만, 은행들은 가계대출 총량 규제와 차주의 높은 연체율을 이유로 난색을 표하고 있다. 이에 강화된 심사와 금리 부담에 은행권에서 밀려난 중·저신용자들이..",,https://www.asiatoday.co.kr/kn/view.php?key=20250910010005817,아시아투데이
[마켓파워] 하이테크 육성 나선 SK에코플랜트…SK하이닉스와 시너지 극대화 노린다,https://img.asiatoday.co.kr/file/2025y/09m/10d/20250910010005194_250.jpg,SK에코플랜트가 하이테크사업을 집중 육성해 반도체·인공지능(AI) 중심으로 사업 포트폴리오 전환에 마침표를 찍는다. SK하이닉스의 미국 현지 공장을 통해서다. 이를 통해 SK에코플랜트는 중심축 중 하나였던 '친환경 사업'에서 반도체·인공지능(AI) 중심 첨단 인프라로 사업 포트폴리오를 전환할 수 있게 됐다는 평가를 받는다. 10일 업계에 따르면 SK에코플랜트는 미국 인디애나주에 SK하이닉스의 차세대 고대역폭메모리(HBM) 생산을 위한 반도체..,,https://www.asiatoday.co.kr/kn/view.php?key=20250910010005194,아시아투데이
꼬리에 꼬리 무는 '김건희 의혹',https://img.asiatoday.co.kr/file/2025y/09m/10d/20250910010005847_250.jpg,민중기 김건희 특검팀의 수사 대상이 눈덩이처럼 불어나고 있다. 수사가 진행될수록 새로운 의혹들이 꼬리를 물고 이어지면서 김건희 특검팀의 부담이 눈에 띄게 가중되고 있다. 여당에선 특검 수사 범위와 기간을 대폭 확대하는 이른바 '더 센 특검법'을 추진하고 나선 가운데 특검의 상설화를 우려하는 목소리도 적지 않다.특검법상 명시된 김건희 특검팀의 수사 대상은 16개다. 구체적으로 △도이치모터스·삼부토건 주가조작 △코바나컨텐츠 뇌물 협찬 △명품가방·..,,https://www.asiatoday.co.kr/kn/view.php?key=20250910010005847,아시아투데이
"서유석 회장 ""코스피 최고치 경신, '머니 무브' 시작…자본시장 중심 투자 본격화""",https://img.asiatoday.co.kr/file/2025y/09m/10d/20250910010005966_250.jpg,"서유석 금융투자협회장이 코스피 지수가 최고치를 경신한 것을 두고 '머니 무브'가 시작됐음을 강조하면서, 부동산에서 자본시장 중심으로 투자가 전환되고 있다고 10일 밝혔다.이날 코스피 지수는 3314.53포인트로 정규시장을 마감해, 종전 역대 최고치인 3305.21포인트를 돌파하며 사상 최고점을 기록했다. 4년 2개월 만이다. 금융투자협회는 우리 자본시장의 회복과 도약을 상징하는 '역사적 전환점'이며, 고령화·저성장 시대에 자본시장을 통해..",,https://www.asiatoday.co.kr/kn/view.php?key=20250910010005966,아시아투데이
"내란특검, '안가회동' 위증 의혹 조태용 소환 임박",https://img.asiatoday.co.kr/file/2025y/09m/10d/20250910010005851_250.jpg,"조은석 내란 특검팀이 조태용 전 국가정보원장 수사에 속도를 내고 있다. 조 전 원장이 비상계엄 선포 계획을 사전에 알고도 국회에 보고하지 않았는지, 헌법재판소(헌재)와 국회에서 위증했는지가 핵심 쟁점이다. 내란 특검팀이 지난 8일 신원식 전 국가안보실장과 9일 여인형 전 국군방첩사령관을 참고인으로 불러 조사하면서 조 전 원장의 피의자 소환이 임박했다는 관측이 나온다.내란 특검팀은 조 전 원장이 지난해 12월 3일 용산 대통령실에서 윤석열 전..",,https://www.asiatoday.co.kr/kn/view.php?key=20250910010005851,아시아투데이
