title,thumbnail,short_content,write_time,link,company
[백운산 오늘의 운세] 2025년 4월 19일,https://img.asiatoday.co.kr/file/2025y/03m/05d/20250305000828198_1.jpg,쥐띠36년 오래된 문서 덕에 재물을 만진다.48년 뜻을 이루기 힘든 시기다.60년 손재수가 있으니 절약해야 한다.72년 지갑만 열고 실속은 전혀 없다.84년 깜박하고 차를 잘못 타는 날이다.96년 얻을 것에서 반이 줄어든다.소띠37년 건강에 자신만만하다가 몸살이 온다.49년 빌려줬던 금전 소식만 기다린다.61년 재물이 들어오고 명예가 가득하다.73년 가족들과 즐거운 시간을 보낸다.85년 숨은 능력을 발휘하니 기쁘다.97년 소원을 성취한다.범띠3..,,https://www.asiatoday.co.kr/kn/view.php?key=20250305000828198,아시아투데이
"젤렌스키 ""中, 러시아에 무기 공급"" 주장",https://img.asiatoday.co.kr/file/2025y/04m/19d/20250419010011310_250.jpg,"아시아투데이 홍순도 베이징 특파원 = 볼로디미르 젤렌스키 우크라이나 대통령이 중국의 대(對)러시아 무기 공급 의혹을 제기했다.베이징 외교 소식통들의 18일 전언에 따르면 젤렌스키 대통령은 17일(현지 시간) 기자회견을 통해 ""중국이 러시아에 무기를 공급하고 있다는 정보를 입수했다""고 밝혔다. 이어 ""이에 관한 세부적인 내용을 제공할 준비가 돼 있다""면서 ""보안국과 정보 당국으로부터 화약과 대포 공급에 관한 전반적인 정보를 받았다""고 설명했다.이..",,https://www.asiatoday.co.kr/kn/view.php?key=20250419010011310,아시아투데이
美 입항료 부과 조치에 中 자국에 손해 주장,https://img.asiatoday.co.kr/file/2025y/04m/18d/20250418010011309_250.jpg,"아시아투데이 홍순도 베이징 특파원 = 중국이 미국 정부가 자국 선박과 해운사에 입항 수수료를 부과하기로 한 조치에 대해 ""자신에게 해를 끼치는 행위""라고 비난하면서 대응 조치에 나설 것임을 예고했다.린젠(林劍) 외교부 대변인은 18일 열린 정례 브리핑에서 미국의 입항 수수료 부과 방침과 관련, ""이 문제에 대해 이미 여러 차례 우리의 입장을 설명했다""면서 이같이 밝혔다. 이어 ""항구 입항 수수료 부과, 화물 하역 장비에 대한 관세 부과 등의 조..",,https://www.asiatoday.co.kr/kn/view.php?key=20250418010011309,아시아투데이
[PMPS] DRX의 완벽한 출발...2025 시즌1 개막전부터 2치킨으로 1위 질주,https://img.asiatoday.co.kr/file/2025y/04m/18d/20250418002215464_250.jpg,"2025 PMPS 시즌1이 개막했다. 18일 온라인으로 진행된 첫 경기에서 DRX가 2치킨, 76점을 기록하며 단독 선두에 올랐다. DRX는 이스포츠 프롬, 이글아울스, 리스타트 CG 등 초반 분위기를 끌어올린 팀들과 함께 토탈 리더보드 상위권을 형성하며 기세를 올렸다.◆ DRX, 2치킨+45킬…'씨재' 복귀 효과 톡톡히DRX는 3매치와 4매치에서 각각 치킨을 따내며 단 하루 만에 76점을 챙겼다. 3매치에서는 돌아온 '씨재'와 오더 '쏘이지'..",,https://www.asiatoday.co.kr/kn/view.php?key=20250418002215464,아시아투데이
"경찰, 단전·단수 의혹 이상민 전 장관 피의자 소환",https://img.asiatoday.co.kr/file/2025y/04m/18d/20250418010011298_250.jpg,"12·3 비상계엄 사태 당시 주요 언론사에 단전·단수를 지시했다는 의혹을 받는 이상민 전 행정안전부 장관이 18일 경찰에 출석해 조사를 받고 있다.경찰청 국가수사본부 비상계엄 특별수사단(특수단)은 이날 언론 공지를 통해 이 전 장관을 피의자 신분으로 불러 조사 중이라고 밝혔다.이 전 장관은 계엄 당시 소방청에 한겨레, 경향신문, MBC 등 언론사 단전·단수를 지시한 혐의(내란)를 받는다.경찰은 지난 2월 18일 이 전 장관의 자택과 서울·세종..",,https://www.asiatoday.co.kr/kn/view.php?key=20250418010011298,아시아투데이
"아시아의 가후 덩리쥔, 미발표곡 극적 발견",https://img.asiatoday.co.kr/file/2025y/04m/18d/20250418010011294_250.jpg,아시아투데이 홍순도 베이징 특파원 = 아시아의 가후(歌后)로 불리는 대만 출신의 불세출의 가수 덩리쥔(鄧麗君)은 절정의 인기를 끌던 1995년 5월 8일 태국 치앙마이의 한 호텔에서 의문사해 수많은 팬들을 무척이나 슬프게 만들었다. 항간에는 극단적 선택을 했다는 소문도 무성했으나 공식 사인은 그녀를 평생 괴롭힌 천식에 의한 호흡곤란이었던 것으로 알려지고 있다. 홀연히 세상과 이별한지 올해 30주년이 됐다는 상징성 때문에 그녀를 추모하는 각종..,,https://www.asiatoday.co.kr/kn/view.php?key=20250418010011294,아시아투데이
"경찰 ""강남 초교 '유괴미수' 의심신고, 범죄 혐의점 낮아""",https://img.asiatoday.co.kr/file/2025y/04m/18d/20250418010011288_250.jpg,"최근 서울 강남구 소재 초등학교에서 유괴 의심 신고가 연이어 접수된 가운데 경찰이 사실관계를 확인한 결과 범죄 혐의점이 낮은 것으로 나타났다.서울 수서경찰서는 18일 강남구 역삼동 소재 A초등학교 인근에서 2학년 남학생에게 접근한 남성 2명을 조사했다.이들은 지난 16일 A초교 인근에서 남학생에게 ""음료수 사줄까""라고 물었고, 학생은 이를 거절하고 떠났다.이들은 경찰 조사에서 ""차도 가까이에 있어 '위험하다' 제지한 것이고, 숨이 차 보여 음..",,https://www.asiatoday.co.kr/kn/view.php?key=20250418010011288,아시아투데이
'메테오'가 이기면 '텐텐'이 산다…동생 위해 나서는 '세계 최고 감시자',https://img.asiatoday.co.kr/file/2025y/04m/18d/20250418001901187_250.jpg,"EMEA의 명문 팀 헤레틱스에 '부'와 '미니부' 형제가 있다면 퍼시픽에는 '메테오' 김태오와 '텐텐' 김태영 형제가 있다. 비록 팀은 갈라졌지만 평소 끈끈한 모습을 보여주던 형제의 우애는 여전히 돋보인다. 특히 형 메테오의 손 끝에 동생 텐텐의 VCT 퍼시픽 PO 진출이 달렸다는 점에서 팬들의 시선이 모이고 있다.올 시즌 초까지 메테오는 T1에, 텐텐은 2군 T1 아카데미 소속으로 한솥밥을 먹고 있었다. 그러나 제타 디비전의 핵심 '뎁' 하시..",,https://www.asiatoday.co.kr/kn/view.php?key=20250418001901187,아시아투데이
국민의힘 8人 비전대회…너도나도 '이재명 막겠다',https://img.asiatoday.co.kr/file/2025y/04m/18d/20250418010011292_250.jpg,"아시아투데이 이체리 기자·홍채완 인턴기자 = 6·3 조기대선에 출마하는 국민의힘 경선 후보자들은 18일 '대한민국의 도약과 미래 비전'을 주제로 각자 경쟁력 있는 분야를 앞세운 공약을 발표했다. 경선 후보자 8명은 이날 오후 서울 강서구 ASSA아트홀에서 열린 '제21대 대통령후보자 국민의힘 1차 경선 후보자 비전대회'에서 권력 분권을 골자로 한 개헌과 인공지능(AI) 산업을 강조하는 한편, 이재명 더불어민주당 대선 경선 후보 비판에 대해선 한..",,https://www.asiatoday.co.kr/kn/view.php?key=20250418010011292,아시아투데이
"GS건설·메이플자이 조합, 788억 인상…서울시 중재로 합의",https://img.asiatoday.co.kr/file/2025y/04m/18d/20250418010011293_250.jpg,GS건설과 서울 신반포4지구 재건축(메이플자이) 조합의 공사비 갈등이 서울시 중재 덕분에 788억원 인상하기로 했다. 18일 정비업계에 따르면 GS건설과 서울 신반포4지구 재건축 조합은 추가 공사비 3082억원 중 788억원을 증액하기로 최종 합의했다. 양측의 합의로 오는 6월 말 예정대로 입주를 시작할 전망이다.조합이 총회를 거쳐 승인하면 GS건설은 조합을 상대로 제기한 공사대금 관련 소송을 취하할 방침이다. 서울시가 지난 2월 정비사업 코..,,https://www.asiatoday.co.kr/kn/view.php?key=20250418010011293,아시아투데이
"'나는 절로 쌍계사' 조계종 진우스님 ""상대 인정할 내공 기르라""",https://img.asiatoday.co.kr/file/2025y/04m/18d/20250418010011289_250.jpg,"조계종사회복지재단이 운영하는 사찰 소개팅 '나는 절로'가 18일 경남 하동 쌍계사에 열렸다. 이날부터 19일까지 쌍계사에서 개최하는 올해 첫 '나는 절로'는 조계종 총무원장 진우스님이 주선자로 함께해 의미를 더했다.이날 입재식에는 지원자 남자 699명, 여자 633명 중 선발된 남녀 각각 12명 총 24명의 선남선녀가 참여했다. 공기업 직원, 교사, 약사, 해양경찰, 피아니스트, 대기업 직원 등 참가자의 직업도 다채롭다.입재식은 총무원장 진우..",,https://www.asiatoday.co.kr/kn/view.php?key=20250418010011289,아시아투데이
"하나은행, 해외서 '찾아가는 패밀리 오피스' 세미나 실시",https://img.asiatoday.co.kr/file/2025y/04m/18d/20250418010011287_250.jpg,"아시아투데이 한상욱 기자·손승현 인턴기자= 하나은행은 18일 해외에서 거주하고 있는 글로벌 고객들의 맞춤형 자산관리를 위한 '해외로 찾아가는 패밀리오피스 세미나'를 진행한다고 밝혔다.이번 세미나는 다양한 연령대와 직업군을 가진 해외 거주 교민들에게 금융투자와 세무, 법률, 부동산 등 종합자산관리 솔루션을 제공하고자 마련됐다.이에 하나은행은 지난 16일 대만 타이베이 지점에서 대만 한인회 교민들을 대상으로 첫 번째 세미나를 개최했다. 이날 행사에..",,https://www.asiatoday.co.kr/kn/view.php?key=20250418010011287,아시아투데이
"신한장학재단, 유공자 자녀 90명에 장학금 지원",https://img.asiatoday.co.kr/file/2025y/04m/18d/20250418010011284_250.jpg,"아시아투데이 한상욱 기자·손승현 인턴기자= 신한장학재단은 18일 경찰관과 소방관, 해양경찰관 순직·공상 유공자 자녀 중 신규 장학생 36명을 선발하고, 기존 장학생을 포함한 총 90명에게 올해 장학 지원사업을 실시한다고 밝혔다.신한장학재단은 매년 경찰관과 소방관, 해양경찰관 순직·공상 유공자의 뜻을 기리기 위해 이들의 자녀들이 안정적으로 학업을 지속할 수 있도록 지원하고 있다.선발된 장학생에게는 대학교 졸업 시까지 연 600만원의 생활비와 자기..",,https://www.asiatoday.co.kr/kn/view.php?key=20250418010011284,아시아투데이
예산실장 유병서·세제실장 박금철…기재부 1급 인사 단행,https://img.asiatoday.co.kr/file/2025y/04m/18d/20250418010011283_250.jpg,"세종// 기획재정부가 신임 예산실장에 유병서 예산총괄심의관을 세제실장에는 박금철 조세총괄정책관을 각각 임명하는 실장급(1급) 인사를 단행했다고 18일 밝혔다.유병서 실장은 서울 반포고와 서울대 경제학과를 졸업하고 행정고시 38회로 공직에 입문했다. 기재부에서 복지예산과장, 재정기획심의관, 복지안전예산심의관, 예산총괄심의관 등을 거친 예산통이다. 경제협력개발기구(OECD) 이코노미스트와 아세안+3 거시경제조사기구(AMRO) 부소장을 역임하면서 국..",,https://www.asiatoday.co.kr/kn/view.php?key=20250418010011283,아시아투데이
"""부사관은 군의 중추""…윤성열 의장 '전쟁과 부사관 역할' 용산특강",https://img.asiatoday.co.kr/file/2025y/04m/18d/20250418010011273_250.jpg,"""부사관은 군의 중추라고 할 수 있습니다.""윤성열 대한민국부사관정책발전협의회 의장이 18일 오후 서울 용산구 전쟁기념관 1층 이병형홀에서 진행된 '용산특강'의 강연자로 나서며 이같이 말했다.윤 의장은 '전쟁과 부사관의 역할'이라는 주제로 연 특강에서 ""장교는 전략을 기획하고 계획하는 위치에 있다면 부사관은 장교가 세운 기획과 계획을 현장에서 실행하고 운영하는 역할을 맡게 된다""며 ""척추가 제대로 작용하지 않는 경우 뇌가 명령을 보내도 행동할..",,https://www.asiatoday.co.kr/kn/view.php?key=20250418010011273,아시아투데이
"BNK부산은행, 한국M&A거래소와 지역기업 성장 지원 협력",https://img.asiatoday.co.kr/file/2025y/04m/18d/20250418010011282_250.jpg,"BNK부산은행은 18일 부산 남구 BNK부산은행 본점에서 한국M&A거래소와 협력체계 구축을 위한 업무협약을 체결했다고 밝혔다.이번 협약은 인수합병과 기업공개 등 전문 금융서비스 분야에서 다양한 협업을 통해 지역기업의 성장을 지원하기 위해 마련됐다. 양 기관은 이번 협약을 바탕으로 인수합병 및 기업공개 관련 정보·자문 제공과 인수합병 관련 교육 프로그램 운영, 전문 네트워크를 활용한 기업 매칭 지원 등을 추진하기로 했다.BNK부산은행은..",,https://www.asiatoday.co.kr/kn/view.php?key=20250418010011282,아시아투데이
"바쁜 현대인을 위한 '갓겜', 마음의 쉼표 찍어주는 '라그나로크 백 투 글로리'",https://img.asiatoday.co.kr/file/2025y/04m/18d/20250418001754041_250.jpg,"피곤하지도, 복잡하지도 않다. 현생이 바빠 이틀 동안 접속을 못해도 게임 속 내 캐릭터는 열심히 단련중이다. 바쁜 현대 사회인에 가장 잘 어울리는 MMORPG가 등장했다.지난 17일 그라비티의 신작 MMORPG '라그나로크: 백 투 글로리(이하 라그 글로리)'가 출시됐다. 라그 글로리는 출시전부터 누구나 쉽게 즐길 수 있는 접근성 낮은 MMORPG를 표방했다. 게임 개발진은 MMORPG의 진입장벽을 크게 낮췄다고 자신했는데, 과연 실제로는 어..",,https://www.asiatoday.co.kr/kn/view.php?key=20250418001754041,아시아투데이
"美 F-35B 최초 참가한 '프리덤 플래그'…""70주년 한·미동맹 견고히""",https://img.asiatoday.co.kr/file/2025y/04m/18d/20250418010011280_250.jpg,"최초로 미국의 5세대 스텔스 다목적 전투기인 F-35B가 참여한 한·미 연합훈련 '프리덤 플래그(Freedom Flag)' 미디어데이가 18일 진행됐다. 미 공군의 조나단 디츠(Jonathan Dietz) 제7공군 작전처 훈련연습과장(중령)은 이날 ""훈련은 70여년간 한·미 동맹을 견고히 하는 계기가 될 것""이라고 밝혔다.조나단 디츠 중령은 이날 오후 광주 광산구 공군 제1전투비행단 기지에서 열린 한·미 공군 인터뷰를 통해 이 같이 말했다...",,https://www.asiatoday.co.kr/kn/view.php?key=20250418010011280,아시아투데이
"한국가상자산평가인증, 가상자산 정보 제공해 투자자 보호한다",https://img.asiatoday.co.kr/file/2025y/04m/18d/20250418010011281_250.jpg,"세계적으로 가상자산 시장 규모가 급격히 커지고 있는 가운데 한국가상자산평가인증이 국내 가상자산 시장 활성화 및 투자자 보호를 위해 가상자산 정보를 제공하며 본격적으로 나설 전망이다.18일 한국가상자산평가인증(한가평)은 웹사이트와 애플리케이션을 통해 투자자에게 가상자산에 대한 정확한 정보를 무료로 공개해 가상자산 시장 활성화를 돕겠다고 밝혔다. 한가평 관계자는 ""가상자산 ETF와 법인 계좌 발급 허용 등 가상자산 시장 확장이 기대되는 가운데 투..",,https://www.asiatoday.co.kr/kn/view.php?key=20250418010011281,아시아투데이
"서울중기청, 아마존 활용 美 시장 진출 온라인 교육 진행",https://img.asiatoday.co.kr/file/2025y/04m/18d/20250418010011149_250.jpg,중소벤처기업부 서울지방중소벤처기업청은 중소기업의 디지털 역량 강화를 위해 '아마존을 활용한 미국 온라인 시장 진출전략 온라인 교육'을 23일 비대면 온라인 방식으로 개최한다고 18일 밝혔다.이번 교육은 서울중기청 등 13개 지방중기청이 공동으로 주관해 진행하며 지역 중소기업을 대상으로 글로벌 진출역량 강화를 위해 지원하는 교육 프로그램을 매월 다른 주제로 개최한다. 4월 교육에서는 미국 시장 진출을 위한 온라인 마케팅 전략에 초점을 맞춘다.교..,,https://www.asiatoday.co.kr/kn/view.php?key=20250418010011149,아시아투데이
"포드, '더 뉴 익스플로러'로 대형 SUV 강자 입증",https://img.asiatoday.co.kr/file/2025y/04m/18d/20250418010011267_250.jpg,최근 국내 스포츠유틸리티차(SUV) 시장에서 포드코리아의 '익스플로러' 모델에 대한 수요가 많아진 것으로 나타났다. 크고 실용적인 차량에 대한 선호도가 커진 덕분이다. 넉넉한 공간·강력한 성능·높은 활용성을 갖춘 대형 SUV '더 뉴 포드 익스플로러'에 대한 소비자들의 관심이 점차 커지고 있다. 18일 한국수입차협회(KAIDA)에 따르면 더 뉴 포드 익스플로러의 지난달 판매량은 전월 대비 38% 증가한 440대를 기록하며 수입 가솔린 차량 부..,,https://www.asiatoday.co.kr/kn/view.php?key=20250418010011267,아시아투데이
[내일날씨] 전국 대부분 비…낮 최고 27도,https://img.asiatoday.co.kr/file/2025y/04m/18d/20250418010011270_250.jpg,"토요일인 19일은 전국 대부분 지역에 비가 내리겠다.이날 오전 6시부터 수도권과 강원 내륙·산지에서 시작된 비는 오후를 기점으로 전국 대부분 지역으로 확대되겠다. 수도권과 강원 내륙·산지의 경우 돌풍과 천둥·번개도 치겠다.수도권은 자정께, 그 외 지역은 오는 20일 오전 6시까지 빗줄기가 이어질 전망이다.예상 강수량(19~20일)은 △경기북·동부 5~30mm △서울·인천·경기남서부, 서해5도 5~20mm △강원북부내륙·산지 10~40mm, 강..",,https://www.asiatoday.co.kr/kn/view.php?key=20250418010011270,아시아투데이
"지난달 카드론 잔액 감소 전환…""가계대출 관리·부실채권 상각 영향""",https://img.asiatoday.co.kr/file/2025y/04m/18d/20250418010011266_250.jpg,올해 들어 역대 최다를 경신해왔던 장기카드대출(카드론) 잔액이 지난달 감소한 것으로 나타났다. 가계부채 관리방안이 시행된데다 분기말 부실채권 상각이 이뤄진데 따른 결과로 풀이된다.18일 여신금융협회에 따르면 9개 카드사(롯데·BC·삼성·신한·우리·하나·현대·KB국민·NH농협카드)의 3월 말 기준 카드론 잔액은 42조3720억원으로 전월 말(42조9888억원) 대비 6168억원 감소했다. 지난 2월 역대 최다를 기록했던 카드론 잔액이 감소세로..,,https://www.asiatoday.co.kr/kn/view.php?key=20250418010011266,아시아투데이
"키움증권, 350억 규모 자사주 취득 후 소각 결정…밸류업 이행",https://img.asiatoday.co.kr/file/2025y/04m/18d/20250418010011269_250.jpg,키움증권이 주주가치 제고를 위해 350억원 규모의 주식을 취득한 뒤 소각할 계획이라고 18일 공시했다.키움증권은 이날 이사회를 통해 장내 매수 방식으로 오는 21일부터 7월 18일까지 보통주 30만주를 취득하는 내용을 결의했다고 밝혔다. 지난 17일 종가 기준으로 산출한 취득 규모는 350억4000만원 수준에 달한다.키움증권은 신규 취득 주식을 포함해 기보유 중인 자사주 69만5345주까지 총 99만5345만주를 내년 3월 중 소각할 예정이다..,,https://www.asiatoday.co.kr/kn/view.php?key=20250418010011269,아시아투데이
"사상 최고로 폭발하는 中 반미 감정, 위험 수위",https://img.asiatoday.co.kr/file/2025y/04m/18d/20250418010011268_250.jpg,아시아투데이 홍순도 베이징 특파원 = 사실상 두번째로 발발했다고 해야 할 미중 관세 및 무역전쟁으로 중국의 반미 감정이 사상 최고로 폭발하고 있다. 이대로 가다가는 전쟁이 극적으로 봉합되더라도 이로 인한 중국의 미국에 대한 악감정의 앙금은 여전할 것이 확실시되고 있다. 미중 관계에 밝은 베이징 소식통들의 최근 전언을 종합할 경우 이 단정은 진짜 절대 과하지 않다고 해야 한다. 미국을 바라보는 중국의 피로도와 적대감이 설명하기 어려울 만큼 비등..,,https://www.asiatoday.co.kr/kn/view.php?key=20250418010011268,아시아투데이
'크보빵' 못 산 자이언트팬 모여라… '롯데빵' 내달 출시,https://img.asiatoday.co.kr/file/2025y/04m/18d/20250418001730244_250.jpg,"'크보빵' 열풍에서 밀려난 롯데자이언츠 팬들을 위한 '롯데빵'이 편의점 세븐일레븐에서 다음 달 출시된다.18일 업계에 따르면 세븐일레븐은 다음달 PB(자체브랜드) '세븐 셀렉트'를 통해 롯데 자이언트 단팥빵을 선보인다. 롯데그룹 계열사 롯데웰푸드와 세븐일레븐이 손을 맞잡았다.총 120종의 랜덤씰이 들어있으며, 판매가는 1900원으로 알려졌다.앞서 한국야구위원회(KBO)가 SPC삽립과 협업해 지난달 출시한 '크보빵(KBO빵)'이 출시 3일 만에..",,https://www.asiatoday.co.kr/kn/view.php?key=20250418001730244,아시아투데이
"디디에 두보, 25SS '센슈얼 마리아주' 출시",https://img.asiatoday.co.kr/file/2025y/04m/18d/20250418010011265_250.jpg,"주얼리 브랜드 디디에 두보가 '2025 SS(봄·여름) 센슈얼 마리아주' 라인을 출시하고, 뮤즈 고윤정과 함께한 새로운 광고 캠페인을 공개했다고 18일 밝혔다.올해 디디에 두보는 주얼리를 통해 일상의 예술을 표현하는 '더 아트 오브 리빙' 캠페인을 전개하고 있다. 이번에 선보인 센슈얼 마리아주 라인 신제품은 '일상을 쌓아가다'라는 테마 아래, 쌓여가는 시간과 사랑의 가치를 구조적이고 예술적인 디자인에 담아냈다.브랜드 뮤즈 고윤정과 '2025..",,https://www.asiatoday.co.kr/kn/view.php?key=20250418010011265,아시아투데이
"LG엔솔, 11조 규모 인니 배터리 밸류체인 프로젝트 철회",https://img.asiatoday.co.kr/file/2025y/04m/18d/20250418010011262_250.jpg,LG에너지솔루션을 필두로 한 LG컨소시엄과 인도네시아 정부가 추진해 온 11조원 규모의 배터리 밸류체인(가치사슬) 구축 프로젝트가 무산됐다.18일 업계에 따르면 LG컨소시엄은 최근 인도네시아 정부와 협의 끝에 '그랜드 패키지 프로젝트'를 철회하기로 결정했다. 그랜드 패키지 프로젝트는 배터리 원재료인 광물 채굴부터 배터리 생산에 이르기까지 토탈 프로세스를 구축하는 프로젝트다.LG에너지솔루션은 2022년 LG화학·LX인터내셔널·포스코·중국업체 화..,,https://www.asiatoday.co.kr/kn/view.php?key=20250418010011262,아시아투데이
"민주당 대선 첫 출사표 던졌던 김두관, 끝내 대선불참 표명",https://img.asiatoday.co.kr/file/2025y/04m/18d/20250418010011263_250.jpg,"더불어민주당 경선 출마를 선언했다가 경선룰에 반발해 경선 불참 선언을 한 김두관 전 의원이 끝내 대선 불출마를 선언했다.김 전 의원은 18일 ""개헌과 7공화국이라는 개헌 대통령 김두관의 꿈은 아쉽지만 여기서 멈춘다""며 ""민주당의 대선 승리를 위해 모든 힘을 모태겠다. 그간 성원해주신 모든 분께 허리숙여 감사드린다""며 이 같이 밝혔다.민주당 내에서 가장 먼저 대선 출마 선언을 한 김 전 의원은 민주당 경선 방식에 반발해 ""특정 후보를 추대하는..",,https://www.asiatoday.co.kr/kn/view.php?key=20250418010011263,아시아투데이
"경찰, 쯔양 고소 '김세의 스토킹 사건' 수사팀 재배당",https://img.asiatoday.co.kr/file/2025y/04m/18d/20250418010011255_250.jpg,"경찰이 유튜버 쯔양(본명 박정원)이 유튜브 채널 가로세로연구소의 김세의 대표를 스토킹 등 혐의로 고소한 사건을 재배당했다.18일 서울 강남경찰서에 따르면 박씨가 김씨를 스토킹처벌법 위반과 명예훼손 등 혐의로 고소한 사건이 수사2과와 형사1과에서 형사2과로 재배당됐다. 당초 스토킹, 협박·강요 등 사건은 형사1과가, 명예훼손 사건은 수사2과가 맡고 있었다.경찰은 ""검찰 보완수사 요구사항을 포함해 관련 사건을 공정하게 수사하겠다""고 밝혔다.재배당..",,https://www.asiatoday.co.kr/kn/view.php?key=20250418010011255,아시아투데이
"동서식품, 생물다양성 보전 위한 수목원 봉사활동 진행",https://img.asiatoday.co.kr/file/2025y/04m/18d/20250418010011261_250.jpg,"동서식품은 지난 17일 충청남도 태안군에 위치한 천리포수목원에서 생물다양성 보전을 위한 임직원 봉사활동을 진행했다고 18일 밝혔다. 이번 봉사활동은 식목일이 있는 4월을 맞아 생물다양성 보전 및 환경보호 실천을 위한 사회공헌 활동으로 기획됐다. 동서식품 임직원들은 수목원 관계자로부터 생물다양성 보전의 중요성에 대한 강의를 들은 후, 수목원으로 나가 직접 무궁화의 묵은 가지를 정리하고 동백나무를 식재하는 활동을 진행했다.천리포수목원은 2010년..",,https://www.asiatoday.co.kr/kn/view.php?key=20250418010011261,아시아투데이
