title,thumbnail,short_content,write_time,link,company
"류긍선 카카오모빌리티 대표, '피지컬 AI 기반 모빌리티 기업' 선언",https://img.asiatoday.co.kr/file/2026y/03m/13d/20260313010003944_250.jpg?v=1773366183,"류긍선 카카오모빌리티 대표가 '피지컬 AI 기반 미래 모빌리티 기업으로의 도약'이 담긴 비전을 제시했다.13일 카카오모빌리티에 따르면 류 대표는 지난 12일 전사 임직원에게 보낸 레터에서 ""일상의 모든 이동을 책임지는 '피지컬 AI 시대를 선도하는 기술회사'로 거듭나겠다""며 ""기술 주권을 확보하고 글로벌 플레이어들과 대등하게 경쟁해 미래 모빌리티 시장을 주도해 나갈 것""이라고 전했다. 류 대표는 카카오모빌리티의 피지컬 AI 전략은 회사의 지..",,https://www.asiatoday.co.kr/kn/view.php?key=20260313010003944,아시아투데이
“중국인 유학생에게 월세 받았는데 통장 정지”…집주인 사연 온라인 확산,https://img.asiatoday.co.kr/file/2026y/03m/13d/20260313010003942_250.jpg?v=1773379768,"서울 동대문구 회기동에서 월세를 받던 집주인이 세입자인 중국인 유학생과 관련된 사기 사건에 연루되면서 본인 계좌까지 지급정지됐다는 사연이 온라인에서 확산되고 있다.최근 한 온라인 이용자는 자신의 쓰레드 계정에 ""경희대 중국인 유학생에게 월세를 받았는데 집주인인 제 통장이 지급정지됐다""는 글을 올렸다.작성자는 ""이유를 확인해 보니 유학생 계좌가 사기 계좌와 연루됐고, 그 계좌로 월세를 받은 제 계좌도 연계 계좌로 묶였다는 설명을 들었다""고 밝..",,https://www.asiatoday.co.kr/kn/view.php?key=20260313010003942,아시아투데이
"이정현 국힘 공관위원장 전격 사퇴…""더이상 혁신 추진 어려워""",https://img.asiatoday.co.kr/file/2026y/03m/13d/20260313010003935_250.jpg?v=1773379195,"이정현 국민의힘 공천관리위원장이 13일 ""제가 생각했던 방향을 더 이상 추진하기 어렵다""며 전격 사퇴했다. 공관위원장에 임명된지 29일 만이다.6·3 지방선거를 82일 앞둔 이 위원장은 이날 오전 사퇴의 변을 내고 ""이번 공천 과정에서 저는 변화와 혁신의 필요성을 절실히 느끼며 맡은 역할에 최선을 다해보려고 했다""며 ""그러나 여러 의견을 존중하는 과정에서 제가 생각했던 방향을 더 이상 추진하기 어렵다고 판단했다""고 밝혔다.이 위원장은 ""모든..",,https://www.asiatoday.co.kr/kn/view.php?key=20260313010003935,아시아투데이
조계종 원로의원 자광 원행스님 입적...10·27 법난 증인,https://img.asiatoday.co.kr/file/2026y/03m/13d/20260313010003933_250.jpg?v=1773365123,"대한불교조계종 원로의원인 자광당 원행스님이 지난 12일 저녁 입적했다. 세수 85세, 법랍 57년.13일 조계종에 따르면 원행스님은 오대산 월정사로 출가해 만화스님을 은사로, 탄허스님을 법사로 수계했다. 이후 대전 자광사·동해 삼화사·원주 구룡사 주지와 월정사 부주지를 지냈고, 조계종 제10대 중앙종회 의원, 호계원 호계위원 등도 역임했다. 해인사에서 팔만대장경판을 지키는 장주 소임을 맡기도 했다.원행스님은 특히 '10·27 법난'의 피해자로..",,https://www.asiatoday.co.kr/kn/view.php?key=20260313010003933,아시아투데이
양천구 신월5동 일대 1241가구 아파트 들어선다…공공재개발 지정 고시,https://img.asiatoday.co.kr/file/2026y/03m/13d/20260313010003932_250.jpg?v=1773365114,"서울 양천구 신월5동 77번지 일대 공공재개발 사업이 본궤도에 올랐다.한국토지주택공사(LH)는 양천구 신월5동 77번지 일대 공공재개발 지정 고시가 완료됐다고 13일 밝혔다.이 사업지는 용적률 249.94%를 적용받아 최고 14층, 공동주택 25개동, 총 1241가구(공공주택 201가구 포함) 규모로 조성될 예정이다. 2010년 정비예정구역으로 지정됐지만 제2종 일반주거지역(7층)과 높이제한(김포공항 인근) 등 사유로 사업성이 부진해 사업 추..",,https://www.asiatoday.co.kr/kn/view.php?key=20260313010003932,아시아투데이
"임이자 ""경북의 '진정성'으로 출마…에너지 수도로 활력""",https://img.asiatoday.co.kr/file/2026y/03m/12d/20260312010003823_250.jpg?v=1773365063,"""대한민국 발전에 자부심을 갖고 있는 경북에 다시 한번 새로운 리더십, 시대에 맞는 리더십으로 에너지 수도 경북을 만들겠다.""임이자 국민의힘 의원은 지난 12일 국회 재정경제기획위원장실에서 진행한 아시아투데이와의 인터뷰에서 3선 중진 의원으로서 책임을 다하고 경북이 처한 어려움을 회복하기 위해 경북지사 출마를 결심했다고 밝혔다.임 의원은 ""3선 여성 중진 의원으로서 상당히 고민이 많았다""며 ""경북의 성장 동력이 식어가고 있다는 판단을 하게 됐..",,https://www.asiatoday.co.kr/kn/view.php?key=20260312010003823,아시아투데이
"직방, 가상오피스 ‘소마’에 50개국 다국어 기능 도입…글로벌 업무환경 조성",https://img.asiatoday.co.kr/file/2026y/03m/13d/20260313010003926_250.jpg?v=1773364613,"종합 프롭테크 기업 직방이 자사 가상오피스 플랫폼 '소마(Soma)'에 50개 이상의 다국어 기능을 도입해 글로벌 원격 근무 환경을 만든다.소마는 직방이 자체 개발한 메타버스 기반 가상오피스 플랫폼으로, 실제 사무실과 유사한 공간 경험을 온라인 환경에서 구현해 원격·하이브리드 근무 환경에서도 자연스러운 소통과 협업을 지원한다.직방은 소마에 인공지능(AI) 기반 실시간 다국어 음성 인식(STT) 및 번역 기능을 도입했다고 13일 밝혔다.이번 업..",,https://www.asiatoday.co.kr/kn/view.php?key=20260313010003926,아시아투데이
"이스라엘, 베이루트 심장부 공습 감행…""장기전 불사""",https://img.asiatoday.co.kr/file/2026y/03m/13d/20260313010003925_250.jpg?v=1773364486,"이스라엘이 레바논 수도 베이루트 중심가에 대한 공습을 단행하면서 공세 수위를 끌어올리고 있다. 이스라엘군 수뇌부가 이번 작전의 장기화를 공식화한 가운데, 레바논 정부를 향해서는 헤즈볼라 통제 실패 시 영토 점령까지 불사하겠다고 경고했다.12일(현지시간) 로이터, AP통신 등에 따르면 이스라엘군은 레바논 정부 본부인 '그랑 세라이'에서 불과 1km 떨어진 바추라와 주카크 알블라트 등 베이루트 심장부 건물을 잇달아 타격했다. 그간 외곽 지역에 집..",,https://www.asiatoday.co.kr/kn/view.php?key=20260313010003925,아시아투데이
"삼성중공업, 미국 샌디에이고에 첫 연구센터 개소",https://img.asiatoday.co.kr/file/2026y/03m/13d/20260313010003924_250.jpg?v=1773364221,"삼성중공업이 샌디에이고에 미국 내 첫 연구 거점을 열었다.13일 삼성중공업은 미국 샌디에이고주립대학교(SDSU)와 공동으로 샌디에이고에 'SSAM 센터(SHI-SDSU Advanced Maritime Center)'를 개소했다고 밝혔다.개소식에는 이왕근 삼성중공업 최고운영책임자(부사장)와 하라 마다낫 SDSU 연구 혁신 부총장, 벤 무어 샌디에이고시 글로벌 협력 최고책임자, 마크 캐퍼티 샌디에이고 지역경제개발공사 최고경영책임자 등 관계자 60..",,https://www.asiatoday.co.kr/kn/view.php?key=20260313010003924,아시아투데이
