title,thumbnail,short_content,write_time,link,company
여야 국정협의회 30분만에 결렬…연금개혁 이견,https://dimg.donga.com/a/296/167/95/2/wps/NEWS/IMAGE/2025/03/10/131179440.1.jpg,"우원식 국회의장과 국민의힘 권성동 원내대표, 더불어민주당 박찬대 원내대표가 10일 세 번째 국정협의회를 열었지만 연금개혁에 대한 이견을 좁히지 못하고 32분 만에 회동이 결렬됐다. 정부에서 추가경정예산안(추경) 4월 초 국회 제출 목표를 제시한 것으로 알려졌지만 파행으로 추경 논의도 …",8분 전,https://www.donga.com/news/Politics/article/all/20250310/131178832/1,동아일보
민주 최기상 “尹 통화 더 하면 다시 구속해야 된다 이야기 나와”[정치를 부탁해],https://dimg.donga.com/a/296/167/95/2/wps/NEWS/IMAGE/2025/03/10/131178156.1.jpg,동아일보 정치 라이브 ＜정치를 부탁해＞O 일시: 월·수요일 오전 10~11시 O 브리핑: 이상헌 동아일보 기자O 인터뷰: 최기상 더불어민주당 의원O 진행·연출: 권오혁 심성주O 동아일보 유튜브 : www.youtube.com/@donga-ilbo〈인터뷰를 부탁해〉 전문▷ 권오혁 : 법…,37분 전,https://www.donga.com/news/Politics/article/all/20250310/131178746/1,동아일보
경찰 “尹 탄핵심판 선고일에 헌재 주변 100m ‘진공 상태’ 만들 것”,https://dimg.donga.com/a/296/167/95/2/wps/NEWS/IMAGE/2025/03/10/131178542.1.jpg,경찰이 윤석열 대통령 탄핵심판 선고 당일 헌법재판소가 있는 서울 종로구와 중구 일대를 ‘특별범죄예방 강화구역’으로 정하고 특공대를 동원해 폭발물을 탐지하는 등 경계를 강화하겠다고 10일 밝혔다. 박현수 서울경찰청장 직무대리는 “헌재로부터 100ｍ 이내는 집회금지구역이라 차벽으로 다 둘…,1시간 전,https://www.donga.com/news/Society/article/all/20250310/131177517/1,동아일보
"檢총장 “尹석방, 소신껏 내린 결정”…野 “사퇴 안하면 탄핵”",https://dimg.donga.com/a/296/167/95/2/wps/NEWS/IMAGE/2025/03/10/131178183.1.jpg,심우정 검찰총장은 10일 윤석열 대통령 석방 결정에 대해 “적법절차 원칙에 따라 소신껏 내린 결정”이라고 강조했다. 지난해 9월 취임 후 처음으로 출근길 문답(도어스테핑)에 나서 더불어민주당의 주장에 조목조목 반박하고 나선 것. 민주당은 야5당 명의로 이날 심 총장을 직권남용 혐의로 …,1시간 전,https://www.donga.com/news/Politics/article/all/20250310/131177603/1,동아일보
"현직 부장판사, ‘尹 구속취소’ 비판…“법리적으로 문제 있어”",https://dimg.donga.com/a/296/167/95/2/wps/NEWS/IMAGE/2025/03/10/131177939.1.jpg,현직 부장판사가 윤석열 대통령의 구속 취소를 결정한 서울중앙지법 재판부에 대해 “법리적·제도적으로 많은 문제를 안고 있는 결정”이라고 비판했다. 검찰에서도 법원 결정에 대해 ‘즉시항고’를 포기하고 윤 대통령의 석방을 지휘한 대검에 명확한 설명을 요구하는 글이 올라오는 등 법조계 전반으…,1시간 전,https://www.donga.com/news/Society/article/all/20250310/131176429/1,동아일보
"민주, 北미사일 도발에 “긴장 고조하는 망동 당장 멈춰야”",https://dimg.donga.com/a/296/167/95/2/wps/NEWS/IMAGE/2025/03/10/131177910.1.jpg,더불어민주당은 10일 약 두 달 만에 재개된 북한의 미사일 도발을 두고 “북한은 한반도의 긴장을 고조하려는 망동을 당장 멈추길 바란다”고 밝혔다.한민수 민주당 대변인은 이날 오후 서면 브리핑을 내고 “북한이 오늘 서해상으로 수발의 탄도미사일을 발사했다고 한다. 북한의 군사적 도발을 강…,1시간 전,https://www.donga.com/news/Politics/article/all/20250310/131177909/1,동아일보
한덕수 탄핵심판 기약없이 미뤄져…尹과 같이 나오나,https://dimg.donga.com/a/296/167/95/2/wps/NEWS/IMAGE/2025/03/10/131177852.1.jpg,10일로 헌법재판소가 한덕수 국무총리 탄핵심판 변론을 종결한지 19일이 지났지만 선고 일정은 잡히지 않고 있다. 이르면 이번 주 선고가 점쳐지는 가운데 윤석열 대통령 탄핵심판과 같은 날 선고가 이뤄질 가능성도 거론된다. 두 탄핵심판의 쟁점이 일부 겹치기 때문이다.헌재가 지난달 19일 …,1시간 전,https://www.donga.com/news/Society/article/all/20250310/131177044/1,동아일보
"석방 다음날 권영세-권성동 면담…尹, ‘관저 정치’ 본격화하나",https://dimg.donga.com/a/296/167/95/2/wps/NEWS/IMAGE/2025/03/10/131177814.1.jpg,윤석열 대통령이 9일 서울 한남동 관저에서 여당 지도부와 면담하고 대통령실 참모들과 식사를 한 것으로 전해졌다. 석방 당일 친윤(친윤석열)계 의원들과의 전화 통화에 이어 9일엔 식사 접견을 이어간 것이다. 헌법재판소 탄핵 심판 결정을 앞두고 여론을 자극할 대외 활동이나 메시지는 자제하…,1시간 전,https://www.donga.com/news/Politics/article/all/20250310/131177212/1,동아일보
헌재앞-광화문서 ‘맞불 단식’…尹석방에 탄핵 찬반 극한 대치,https://dimg.donga.com/a/296/167/95/2/wps/NEWS/IMAGE/2025/03/10/131176961.1.jpg,"윤석열 대통령 석방 이틀 뒤인 10일에도 서울 시내 곳곳에서 탄핵 찬반 집회가 격화됐다. 헌법재판소 앞에는 집회 참여자들 사이에 고성이 오가거나 몸싸움이 벌어졌다. 윤 대통령 지지자는 헌재 앞에서, 탄핵 찬성 진영은 광화문에서 각각 ‘맞불 단식’에 들어갔다. 이날 오전 9시 반경 서울…",3시간 전,https://www.donga.com/news/Society/article/all/20250310/131176760/1,동아일보
尹 석방 날 “뜻밖의 행운” 글 올린 文 평산책방…무슨일?,https://dimg.donga.com/a/296/167/95/2/wps/NEWS/IMAGE/2025/03/10/131176651.2.jpg,문재인 전 대통령이 운영하는 ‘평산책방’이 윤석열 대통령 석방 당일 “뜻밖의 행운”이라는 글을 올렸다 삭제한 사실이 뒤늦게 알려졌다.지난 8일 평산책방은 공식 페이스북에 1만 번째 책방에 방문하는 손님을 환영하며 “뜻밖의 행운은 어떤 사람에게 오는 걸까요. 뜻밖의 기쁨은 어떤 사람에게…,3시간 전,https://www.donga.com/news/Politics/article/all/20250310/131176621/2,동아일보
"한미훈련 첫날…北, 서해로 탄도미사일 여러발 ‘도발’",https://dimg.donga.com/a/296/167/95/2/wps/NEWS/IMAGE/2025/01/07/130804046.1.jpg,한미 정례 연합훈련이 시작된 첫날 북한이 서해 방향으로 탄도미사일 여러 발을 발사했다고 군 당국이 밝혔다. 합동참모본부는 10일 언론 공지를 통해 “오늘 오후 1시 50분경 북한 황해도 내륙에서 서해 방향으로 발사된 미상의 탄도미사일 수 발을 포착했다”고 발표했다. 이날은 한미 양국 …,4시간 전,https://www.donga.com/news/Politics/article/all/20250310/131176284/1,동아일보
“화교”라더니 “애국판사”…‘尹 석방’ 판사 놓고 뒤바뀐 민심,https://dimg.donga.com/a/296/167/95/2/wps/NEWS/IMAGE/2025/03/10/131175842.1.jpg,"내란수괴 혐의로 구속기소 된 윤석열 대통령의 구속 취소를 결정한 서울중앙지법 지귀연 부장판사(51·사법연수원 31기)에 대한 여야 지지자들의 민심이 뒤바뀌었다. 여당 지지자들은 “애국판사”라며 환호하는 반면, 야당 지지자들은 외모까지 들먹이며 비난 공세를 높이고 있다. 10일 정치…",4시간 전,https://www.donga.com/news/Politics/article/all/20250310/131175841/1,동아일보
포천 오폭 피해현장 복구 ‘한창’…주민들 “공군총장 사과 알맹이 없어”,https://dimg.donga.com/a/296/167/95/2/wps/NEWS/IMAGE/2025/03/10/131175647.1.jpg,"“금 간 집에서 불안하게 밤을 보내고 있는데, 총장은 구체적 피해 보상 방안에 대해선 회피하는 것 같아.”이영수 공군참모총장이 10일 ‘전투기 민가 오폭’ 사고에 대해 머리 숙여 사과했지만, 피해 지역 주민들은 “구체적 보상 방안이 없다”고 비판했다.이날 오전 11시께 찾은 경기 포천…",4시간 전,https://www.donga.com/news/Politics/article/all/20250310/131175646/1,동아일보
"민주 오늘 국정협의회 참석…박찬대 “국힘, 추경안 가져와야”",https://dimg.donga.com/a/296/167/95/2/wps/NEWS/IMAGE/2025/03/10/131175506.1.jpg,"박찬대 더불어민주당 원내대표가 10일 오후 열리는 여야 국정협의회에 참석하겠다는 입장을 밝혔다.박 원내대표는 이날 국회에서 기자들과 만나 “(여당이) 추가경정예산안을 가져와야 한다. 일단 추경이 급하다”며 이같이 말했다.박 원내대표는 “반도체특별법도 중요하지만, 추경은 긴급한 투입이 …",5시간 전,https://www.donga.com/news/Politics/article/all/20250310/131175505/1,동아일보
한미훈련에 맞대응 경고…‘도쿄 대공습’ 日에 사과 요구,https://dimg.donga.com/a/296/167/95/2/wps/NEWS/IMAGE/2025/03/10/131175404.1.jpg,북한이 한미 연합훈련 ‘자유의 방패(FS)’ 첫날인 10일 “위험천만한 도발”이라며 강하게 반발하고 나섰다.노동당 기관지 노동신문은 이날 6면에 ‘미국이 남발하고 있는 완력 행사는 가중된 안보 위기로 회귀할 것이다’라는 제목의 외무성 보도국 공보문을 보도했다.신문은 북한이 FS에 맞대…,5시간 전,https://www.donga.com/news/Politics/article/all/20250310/131175403/1,동아일보
與 “오늘 오동운 공수처장 형사 고발”…오후 3시 고발장 접수,https://dimg.donga.com/a/296/167/95/2/wps/NEWS/IMAGE/2025/03/10/131175334.1.jpg,비상계엄 국정조사 특별위원회 소속 국민의힘 위원들은 10일 “오늘 오동운 고위공직자범죄수사처(공수처) 처장을 형사 고발한다”고 했다.주진우 의원 등 특위 위원들은 이날 오전 국회에서 기자회견을 열고 “오 처장은 내란죄 수사권이 없는데도 불법 체포·구금을 일삼았다”며 이같이 밝혔다.주 …,5시간 전,https://www.donga.com/news/Politics/article/all/20250310/131175333/1,동아일보
"박찬대 “심우정, 尹에 증거인멸 기회 준 것…즉시 사퇴해야”",https://dimg.donga.com/a/296/167/95/2/wps/NEWS/IMAGE/2025/03/10/131175078.2.jpg,"더불어민주당 박찬대 원내대표가 10일 윤석열 대통령이 석방된 것과 관련 “심우정 검찰총장이 이 모든 사태의 원흉”이라고 밝혔다. 박 원내대표는 이날 국회에서 열린 최고위원회의에서 “심 총장은 쓸데없이 시간을 끌며 기소를 늦춰 꼬투리를 제공했고, 법에 규정된 권한 행사를 포기하도록 지시…",6시간 전,https://www.donga.com/news/Politics/article/all/20250310/131175077/2,동아일보
포천 민가 전투기 오폭사고 부상자 늘어…총 31명,https://dimg.donga.com/a/296/167/95/2/wps/NEWS/IMAGE/2025/03/10/131175226.1.jpg,"한미연합훈련 중 우리 공군 전투기가 발사한 폭탄이 경기 포천시 민가에 떨어지는 오폭 사고로 10일 현재까지 총 31명의 부상자가 발생했다.포천시와 관계당국에 따르면 부상자가 중상 2명, 경상 17명에 군인 12명까지 포함하면 총 31명으로 집계됐다.두통, 복통, 불안증세를 호소하는 사…",6시간 전,https://www.donga.com/news/Society/article/all/20250310/131175068/1,동아일보
"나경원 “22대 국회, 野 정략 줄탄핵에 3억원 지출”",https://dimg.donga.com/a/296/167/95/2/wps/NEWS/IMAGE/2025/03/10/131174924.1.jpg,나경원 국민의힘 의원은 10일 “야당의 정략적 줄탄핵으로 법조 좌파 이권 카르텔에 22대 국회가 9개월 만에 혈세 3억원을 퍼줬다”고 비판했다.이날 나경원 의원실이 국회사무처로부터 제출받은 자료에 따르면 22대 국회 개원 이후 9개월 만에 탄핵소추안 관련 변호사 선임에 지출된 비용은 …,7시간 전,https://www.donga.com/news/Politics/article/all/20250310/131174923/1,동아일보
‘삼부토건 조사’ 항의 방문 野…“올 때마다 금감원장 없다” 비판,https://dimg.donga.com/a/296/167/95/2/wps/NEWS/IMAGE/2025/03/10/131174905.1.jpg,삼부토건 주가 조작 의혹 조사를 촉구하기 위해 10일 금융감독원을 방문한 국회의원들이 이복현 금감원장의 잇단 부재에 “국회를 전혀 존중하고 있지 않다”고 비판했다.국회 정무위원회 소속 민병덕 더불어민주당 의원은 이날 오전 금감원 항의방문 전 기자들을 만나 “이복현 원장이 취임 후 정무…,7시간 전,https://www.donga.com/news/Politics/article/all/20250310/131174904/1,동아일보
尹 관저 복귀하자…여권 줄지어 면담 요청,https://dimg.donga.com/a/296/167/95/2/wps/NEWS/IMAGE/2025/03/10/131167656.1.png,윤석열 대통령이 서울 한남동 관저로 복귀해 여당 지도부 투톱을 만난 데 이어 지자체장 등 여권 인사들이 잇따라 대통령실에 예방 요청을 하고 있는 것으로 알려졌다.여권 관계자는 10일 “각 지자체장부터 다양한 여권 인사들이 대통령실을 통해 관저에서 윤 대통령을 뵙고 싶다고 문의하고 있다…,7시간 전,https://www.donga.com/news/Politics/article/all/20250310/131174496/1,동아일보
"이재명 “악착같던 검찰, 尹에게만 관대…한패라서 그런 것”",https://dimg.donga.com/a/296/167/95/2/wps/NEWS/IMAGE/2025/03/10/131174721.3.jpg,더불어민주당 이재명 대표가 윤석열 대통령을 석방한 검찰을 향해 “아마 한 패라 그런 것 (아니겠느냐)”고 강하게 반발했다. 이 대표는 10일 국회 본청에서 열린 최고위원회의에서 “이 나라 질서 유지의 최후 보루여야 할 검찰이 해괴한 잔꾀로 내란 수괴를 석방했다”며 “저런 (법원의) 계…,7시간 전,https://www.donga.com/news/Politics/article/all/20250310/131174732/2,동아일보
"野5당 “尹 석방 지휘 검찰총장 고발”…민주당, 대검 항의 방문",https://dimg.donga.com/a/296/167/95/2/wps/NEWS/IMAGE/2025/03/10/131174690.1.jpg,"더불어민주당을 포함한 5개 야당은 10일 윤석열 대통령의 석방을 지휘한 심우정 검찰총장을 직권남용 혐의로 고위공직자범죄수사처에 고발하기로 했다. 민주당 내란진상조사단도 이날 서울 서초구 대검 청사를 항의 방문해 김 총장의 사퇴를 촉구했다. 민주당, 조국혁신당, 진보당, 기본소득당, …",7시간 전,https://www.donga.com/news/Politics/article/all/20250310/131174671/1,동아일보
"북한, 핵추진 잠수함 첫 공개…정부 “러 기술 제공 동향 주시”",https://dimg.donga.com/a/296/167/95/2/wps/NEWS/IMAGE/2025/03/10/131174697.1.jpg,정부는 10일 핵 잠수함 건조 현장을 공개한 북한이 관련 기술을 러시아로부터 제공받았을 가능성에 대해 “주시하고 있다”라고 밝혔다.구병삼 통일부 대변인은 이날 정례브리핑에서 북한이 최근 핵 잠수함 건조 장면을 처음으로 공개한 것을 두고 “러시아의 (핵잠수함) 기술 제공 가능성이 제기되…,7시간 전,https://www.donga.com/news/Politics/article/all/20250310/131174696/1,동아일보
서울대·전남·‘인권법’ 출신…尹구속취소 결정 지귀연 판사는,https://dimg.donga.com/a/296/167/95/2/wps/NEWS/IMAGE/2025/03/10/131174336.1.jpg,내란 우두머리 혐의로 구속기소된 윤석열 대통령이 석방된 상태에서 재판을 받을 수 있도록 윤 대통령의 구속취소를 결정한 지귀연 부장판사(51·사법연수원 31기)가 주목을 받고 있다. 10일 법조계에 따르면 서울중앙지법 형사합의25부(부장판사 지귀연)는 지난 7일 윤 대통령의 구속취소 청…,7시간 전,https://www.donga.com/news/Society/article/all/20250310/131174335/1,동아일보
"한동훈, 尹 석방에 “때가 되면 뵐 기회 있었으면 좋겠다”",https://dimg.donga.com/a/296/167/95/2/wps/NEWS/IMAGE/2025/03/10/131174881.1.jpg,"한동훈 전 국민의힘 대표는 10일 석방돼 관저로 돌아온 윤석열 대통령을 향해 “때가 되면 뵐 기회가 있었으면 좋겠다”고 밝혔다.한 전 대표는 이날 CBS 라디오 ‘김현정의 뉴스쇼’에 출연해 ‘여당 인사들은 줄줄이 만남을 신청한다고 하는데, 대통령을 만나서 이야기를 직접 해보실 생각도 …",8시간 전,https://www.donga.com/news/Politics/article/all/20250310/131174115/1,동아일보
"尹, 관저서 與지도부 30분 만남…“당 잘 이끌어줘 고맙다”",https://dimg.donga.com/a/296/167/95/2/wps/NEWS/IMAGE/2025/03/10/131174432.1.jpg,윤석열 대통령이 9일 저녁 서울 용산구 한남동 관저에서 국민의힘 권영세 비상대책위원장·권성동 원내대표를 만나 “지금까지 당을 잘 이끌어줘서 고맙다”고 말한 것으로 전해졌다.신동욱 국민의힘 수석대변인은 10일 국회에서 당 비상대책위원회의 뒤 기자들과 만나 윤 대통령이 52일 만에 석방된…,8시간 전,https://www.donga.com/news/Politics/article/all/20250310/131174105/1,동아일보
"尹, 어젯밤 권영세·권성동 면담…“당 잘 운영해줘 고맙다”",https://dimg.donga.com/a/296/167/95/2/wps/NEWS/IMAGE/2025/03/10/131174133.1.jpg,국민의힘 권영세 비상대책위원장·권성동 원내대표가 9일 저녁 서울 용산구 한남동 관저에서 윤석열 대통령을 예방했다. 윤 대통령은 이들에게 “지금까지 당을 잘 이끌어줘서 고맙다”고 말한 것으로 전해졌다.신동욱 국민의힘 수석대변인은 10일 국회에서 열린 당 비상대책위원회의 뒤 기자들과 만난…,8시간 전,https://www.donga.com/news/Politics/article/all/20250310/131174103/1,동아일보
"권성동 “野, 검찰총장 법 지켰다고 탄핵…굴복 말라”",https://dimg.donga.com/a/296/167/95/2/wps/NEWS/IMAGE/2025/03/10/131174073.3.jpg,국민의힘은 야당의 심우정 검찰총장 탄핵 움직임에 대해 “심우정 총장은 사퇴 압박에 굴복하지 말라”고 반발했다. 국민의힘 권성동 원내대표는 10일 비상대책위원 회의에서 야 5당이 심 총장을 공수처에 고발하기로 한 것을 두고 “어제(9일) 야 5당은 심우정 총장 사퇴하지 않으면 탄핵을 추…,8시간 전,https://www.donga.com/news/Politics/article/all/20250310/131174082/2,동아일보
박찬대 “심우정이 모든 사태의 원흉…尹에 증거인멸 기회 줘”,https://dimg.donga.com/a/296/167/95/2/wps/NEWS/IMAGE/2025/03/10/131174025.1.jpg,박찬대 더불어민주당 원내대표는 10일 서울구치소에 수감돼 있던 윤석열 대통령이 석방된 것을 두고 “심우정 검찰총장이 이 모든 사태의 원흉”이라며 즉각 사퇴하라고 거듭 촉구했다.박 원내대표는 이날 국회에서 열린 최고위원회의에서 “심 총장은 쓸데없이 시간을 끌며 기소를 늦춰 꼬투리를 제…,8시간 전,https://www.donga.com/news/Politics/article/all/20250310/131174024/1,동아일보
"민주, ‘즉시항고 포기’ 심우정 법사위 불러 현안질의 추진",https://dimg.donga.com/a/296/167/95/2/wps/NEWS/IMAGE/2025/03/10/131173850.1.jpg,더불어민주당은 윤석열 대통령의 구속 취소 결정에 대해 ‘즉시 항고’를 포기한 심우정 검찰총장을 국회 법제사법위원회로 불러 현안 질의를 추진한다. 10일 정치권에 따르면 국회 법사위는 오는 12일 열리는 전체 회의에서 심 총장을 불러 현안 질의를 진행할 예정이다. 다만 참고인 신분으로 …,8시간 전,https://www.donga.com/news/Politics/article/all/20250310/131173849/1,동아일보
권영세 “오동운은 국민 속인 범죄 혐의자…명백한 수사대상”,https://dimg.donga.com/a/296/167/95/2/wps/NEWS/IMAGE/2025/03/10/131173761.1.jpg,권영세 국민의힘 비상대책위원장은 10일 오동운 고위공직자범죄수사처(공수처)장을 향해 “국민을 속인 범죄 혐의자이며 명백한 수사대상”이라고 비판했다. 이어 “공수처의 불법행위에 대해 책임을 묻고 공수처를 반드시 폐지하겠다”고도 했다.권 위원장은 이날 오전 국회에서 열린 비상대책회의에서 …,8시간 전,https://www.donga.com/news/Politics/article/all/20250310/131173760/1,동아일보
"檢총장 “尹석방, 적법절차 따라 소신껏 결정…탄핵사유 안돼”",https://dimg.donga.com/a/296/167/95/2/wps/NEWS/IMAGE/2025/03/10/131173631.1.jpg,"심우정 검찰총장은 법원의 윤석열 대통령 구속 취소 결정에 대해 즉시항고 등 불복 절차를 밟지 않고 석방을 지휘한 데 대해 적법 절차 원칙 등에 따라 즉시항고 하지 않은 것이라고 말했다.심 총장은 더불어민주당의 사퇴 요구 및 검찰총장 탄핵 목소리에 대해선 “수사팀, 대검찰청 부장 회의 …",9시간 전,https://www.donga.com/news/Society/article/all/20250310/131173449/1,동아일보
尹 관저정치 본격화하나…당 지도부·친윤 의원들 방문 줄이을 듯,https://dimg.donga.com/a/296/167/95/2/wps/NEWS/IMAGE/2025/03/10/131172946.1.jpg,"윤석열 대통령이 한남동 관저로 복귀하면서 ‘관저정치’도 본격화될지 관심이다.대통령실에 따르면 구속취소 사흘째인 10일, 윤 대통령은 관저에 머물면서 휴식을 이어갈 것으로 보인다. 윤 대통령은 전날도 관저에 머물며 건강검진을 하는 등 컨디션 회복에 주력하고 별도의 대국민 메시지 등은 준…",12시간 전,https://www.donga.com/news/Politics/article/all/20250310/131172945/1,동아일보
尹 석방후 더 극심해진 분열,https://dimg.donga.com/a/296/167/95/2/wps/NEWS/IMAGE/2025/03/10/131172899.1.jpg,윤석열 대통령이 법원의 구속 취소로 석방되면서 탄핵 찬반을 둘러싼 갈등과 분열이 더욱 극심해지고 있다. 윤 대통령이 석방 직후 지지층을 향해 결집 메시지를 낸 가운데 여당인 국민의힘은 헌법재판소에 윤 대통령 탄핵 기각을 요구하며 압박했고 더불어민주당 등 야 5당은 윤 대통령 구속 취소…,15시간 전,https://www.donga.com/news/Politics/article/all/20250310/131172526/2,동아일보
"지지자 향해 주먹 불끈-90도 인사… 건재 과시 尹, 여론전 본격화",https://dimg.donga.com/a/296/167/95/2/wps/NEWS/IMAGE/2025/03/10/131172888.1.jpg,8일 오후 5시 48분 경기 의왕 서울구치소 정문. 구치소의 녹색 철문이 열리자 대통령 경호차량인 검은색 캐딜락 에스컬레이드의 모습이 보였다. 정문 앞에 멈춰 선 차량에선 체포 당시 입었던 짙은 감색 양복을 입은 윤석열 대통령이 내렸다. 윤 대통령은 “윤석열”을 연호하는 지지자들과 눈…,15시간 전,https://www.donga.com/news/Politics/article/all/20250310/131172396/2,동아일보
"석방 첫날 金여사-참모와 김치찌개 저녁… 與지도부-친윤과 통화, ‘관저정치’ 시동",https://dimg.donga.com/a/296/167/95/2/wps/NEWS/IMAGE/2025/03/10/131172896.1.jpg,윤석열 대통령이 석방돼 서울 용산구 한남동 관저에 복귀한 가운데 대통령실은 9일 “차분하고 담담하게 헌법재판소의 선고를 기다릴 것”이라며 윤 대통령이 당분간 외부 활동이나 메시지는 자제할 방침이라고 밝혔다. 하지만 여당 지도부를 포함한 정치인들이 줄줄이 윤 대통령 접견에 나설 예정인 …,15시간 전,https://www.donga.com/news/Politics/article/all/20250310/131172393/2,동아일보
尹 복귀 이후 다시 시끄러워진 한남동 관저 앞,https://dimg.donga.com/a/296/167/95/2/wps/NEWS/IMAGE/2025/03/10/131172893.1.jpg,"“12·3 비상계엄 선포 직후 시위대가 몰려들면서 영업에 큰 타격을 입었어요. 이제야 겨우 조용해지나 싶었는데, 시위대가 다시 몰려들고 있어 걱정입니다.” 9일 서울 용산구 한남동 대통령 관저 인근의 한 주유소에서 만난 직원 이모 씨(40)는 어두운 표정으로 한숨을 내쉬었다. 그가 일…",15시간 전,https://www.donga.com/news/Society/article/all/20250310/131172390/2,동아일보
野5당 “檢총장 사퇴안하면 탄핵”… 與 “헌재 尹심판 원점 재검토를”,https://dimg.donga.com/a/296/167/95/2/wps/NEWS/IMAGE/2025/03/10/131172879.1.jpg,"“심우정 검찰총장이 자진 사퇴를 거부한다면 탄핵을 포함해 모든 조치를 취하겠다.”(더불어민주당 박찬대 원내대표) 민주당은 법원의 윤석열 대통령 구속 취소 결정에 당혹스러움을 감추지 못한 채 “검찰이 의도적으로 항고를 포기한 것”이라며 심 총장 탄핵 가능성을 꺼내 들었다. 주말인 8, …",15시간 전,https://www.donga.com/news/Politics/article/all/20250310/131172446/2,동아일보
