title,thumbnail,short_content,write_time,link,company
李대통령 “APEC 일정 마무리…앞으로도 대한민국 위상 높이겠다”,https://dimg.donga.com/a/296/167/95/2/wps/NEWS/IMAGE/2025/11/03/132689597.1.jpg,"이재명 대통령은 3일 “이로써 모든 APEC 정상회의 일정을 마무리했다”며 “앞으로도 국민 여러분의 기대에 부응하며, 대한민국의 위상을 높일 수 있도록 전력을 다하겠다”고 밝혔다.이 대통령은 이날 페이스북을 통해 “무엇보다 이번 회의가 성공적으로 개최될 수 있도록 응원해 주신 우리 국…",9시간 전,https://www.donga.com/news/Politics/article/all/20251103/132689596/1,동아일보
박수현 “‘국정안정법’은 재판재개 주장한 국힘 때문…정당방위”,https://dimg.donga.com/a/296/167/95/2/wps/NEWS/IMAGE/2025/11/03/132689473.1.jpg,"박수현 더불어민주당 수석대변인은 3일 현직 대통령의 재판을 중지하는 ‘국정안정법’(재판중지법) 추진과 관련해 국민의힘을 강요죄 위반으로 국민에게 고발하겠다고 밝혔다. 민주당은 당초 처리할 생각이 없었지만, 국민의힘이 이재명 대통령 재판 재개를 들고나오면서 법 처리에 나설 수밖에 없었다…",10시간 전,https://www.donga.com/news/Politics/article/all/20251103/132689472/1,동아일보
오늘 與 정년연장특위 회의…‘정년 65세 연장’ 본격 논의,https://dimg.donga.com/a/296/167/95/2/wps/NEWS/IMAGE/2025/11/03/132689276.1.jpg,더불어민주당은 3일 법정 정년을 65세로 연장하는 방안을 본격 논의한다.민주당은 3일 오전 국회 원내대표 회의실에서 ‘회복과 성장을 위한 정년연장특별위원회 제1차 본회의’를 열어 정년 상향의 단계적 시행 방침 등을 검토한다. 이번 회의는 지난 4월 태스크포스(TF)로 출범한 뒤 특위로…,11시간 전,https://www.donga.com/news/Politics/article/all/20251103/132689275/1,동아일보
韓中 “전략적 소통 강화” 관계개선 실마리,https://dimg.donga.com/a/296/167/95/2/wps/NEWS/IMAGE/2025/11/03/132689128.1.jpg,이재명 대통령과 시진핑(習近平) 중국 국가주석이 1일 열린 첫 정상회담에서 한중 관계 개선을 위한 전략적 소통을 강화하기로 합의했다. 두 정상은 70조 원 규모의 통화스와프를 체결하고 한중 자유무역협정(FTA) 2단계 협상에도 속도를 내기로 했다. 미중 패권경쟁과 반중(反中) 정서 확…,15시간 전,https://www.donga.com/news/Politics/article/all/20251103/132688689/2,동아일보
"美 “中, 조선-해운 보복 철회키로” 마스가 제재 해제 기대",https://dimg.donga.com/a/296/167/95/2/wps/NEWS/IMAGE/2025/11/01/132684086.1.jpg,미국 백악관이 지난달 30일 부산에서 열린 미중 정상회담 합의에 따라 중국의 대(對)미 해상·물류·조선 산업 관련 제재가 철회될 것이라고 1일(현지 시간) 밝혔다. 최근 대미 투자 및 협력을 이유로 중국으로부터 거래 금지 대상으로 지목된 조선기업 한화오션이 관련 제재에서 벗어날 수 있…,15시간 전,https://www.donga.com/news/Inter/article/all/20251103/132688681/2,동아일보
李 ‘핵잠 추진은 방어 목적’ 설명… 시진핑 “차이점 속 협력 모색”,https://dimg.donga.com/a/296/167/95/2/wps/NEWS/IMAGE/2025/11/03/132689104.1.jpg,이재명 대통령과 시진핑(習近平) 중국 국가주석의 1일 첫 정상회담은 부침을 거듭하던 한중관계를 정상 궤도로 되돌리는 계기가 될 수 있다는 평가가 나온다. 시 주석은 회담에서 전략적 소통 강화를 제안하며 “차이점 속에 공통점을 찾고 협력과 상생을 추구해야 한다”고 강조했다. 더 이상의 …,15시간 전,https://www.donga.com/news/Politics/article/all/20251103/132688816/2,동아일보
한중 70조원 규모 통화스와프 체결… ‘보이스피싱-스캠’ 공동 대응하기로,https://dimg.donga.com/a/296/167/95/2/wps/NEWS/IMAGE/2025/11/03/132689121.1.jpg,한중 양국은 1일 이재명 대통령과 시진핑(習近平) 중국 국가주석의 첫 한중 정상회담을 계기로 70조 원(약 4000억 위안) 규모의 원-위안화 통화스와프 계약서를 체결했다. 또 양국 경찰이 초국가 스캠 범죄에 공동 대응하기 위한 보이스피싱·온라인 사기 범죄 대응 공조 등 6건의 양해각…,15시간 전,https://www.donga.com/news/Politics/article/all/20251103/132688814/2,동아일보
"“서해구조물, 실무 협의 통해 문제 풀기로”",https://dimg.donga.com/a/296/167/95/2/wps/NEWS/IMAGE/2025/11/03/132689123.1.jpg,"“실무 협의를 통해 서로 소통하며 문제를 풀어보자는 공감대가 있었다.” 위성락 국가안보실장은 1일 중국의 서해 불법 구조물, 중국의 희토류 수출 통제, 중국의 한화오션 미국 자회사 제재 등 한중 간 민감한 의제들이 정상회담에서 다뤄졌다고 밝히며 이같이 말했다. 위 실장은 이날 아시아태…",15시간 전,https://www.donga.com/news/Politics/article/all/20251103/132688812/2,동아일보
"李, 샤오미폰 선물에 “보안 되나” 시진핑 “백도어 있나 보라” 서로 농담",https://dimg.donga.com/a/296/167/95/2/wps/NEWS/IMAGE/2025/11/03/132686989.5.jpg,“통신 보안은 되나.”(이재명 대통령)“뒷문(백도어)이 있는지 한번 확인해 보라.”(시진핑·習近平 중국 국가주석) 이 대통령과 시 주석은 1일 한중 정상회담을 마친 뒤 선물을 주고받는 친교 자리에서 시 주석이 이 대통령 부부에게 선물한 중국산 스마트폰 샤오미 15 울트라 2대를 두고 …,15시간 전,https://www.donga.com/news/Politics/article/all/20251103/132688828/2,동아일보
"李 “北, 적대적 표현 강도 많이 완화됐지만 대결적 사고를 바꾸려면 상당한 노력 필요”",https://dimg.donga.com/a/296/167/95/2/wps/NEWS/IMAGE/2025/11/03/132689116.1.jpg,이재명 대통령은 1일 김대중 정부의 햇볕정책을 언급하며 “북측이 한국 정부를 의심하며 적대적으로 행동하고 있지만 이 대결적 사고를 바꾸려면 상당한 노력이 필요하다”며 실천 의지를 밝혔다. 이 대통령은 1일 경북 경주 아시아태평양경제협력체(APEC) 정상회의 국제미디어센터(IMC)에서 …,15시간 전,https://www.donga.com/news/Politics/article/all/20251103/132688826/2,동아일보
韓-싱가포르 “방산-AI-금융 협력 강화”,https://dimg.donga.com/a/296/167/95/2/wps/NEWS/IMAGE/2025/11/02/132685317.3.jpg,이재명 대통령과 로런스 웡 싱가포르 총리는 2일 정상회담에서 양국 관계를 ‘전략적 동반자 관계’로 격상하고 안보와 경제 등 다방면에서 협력 공조를 강화하기로 합의했다. 이 대통령은 경주 아시아태평양경제협력체(APEC) 정상회의 폐막 다음 날인 이날 서울 용산 대통령실에서 APEC을 계…,15시간 전,https://www.donga.com/news/Politics/article/all/20251103/132688824/2,동아일보
위성락 “핵잠 승인 받은건 연료”… ‘美서 건조’ 제안에 신중 반응,https://dimg.donga.com/a/296/167/95/2/wps/NEWS/IMAGE/2025/11/01/132684005.2.jpg,위성락 국가안보실장이 도널드 트럼프 미국 대통령이 승인한다고 밝힌 한국의 핵추진 잠수함(핵잠) 건조에 대해 “우리는 연료에 대해 승인받은 것”이라고 말했다. 트럼프 대통령은 한미 정상회담 다음 날인 지난달 30일 “한국은 미국 필라델피아 조선소에서 핵잠을 건조할 예정”이라면서 미국에서…,15시간 전,https://www.donga.com/news/Politics/article/all/20251103/132688654/2,동아일보
APEC ‘경주 선언’ 채택… ‘WTO 다자무역 지지’ 표현은 빠져,https://dimg.donga.com/a/296/167/95/2/wps/NEWS/IMAGE/2025/11/03/132687093.4.jpg,경주 아시아태평양경제협력체(APEC) 정상회의가 1일 폐막식에서 21개 회원국이 만장일치 합의로 정상 공동 문서인 ‘경주 선언’을 채택했다. 경주 선언에는 다자주의와 자유무역을 확산하는 APEC 설립 취지에 따라 공동선언문에 포함돼 왔던 ‘다자무역 체제 지지’라는 표현이 빠졌다. 자국…,15시간 전,https://www.donga.com/news/Politics/article/all/20251103/132688652/2,동아일보
美中 무역전쟁 휴전 무대 된 ‘경주 APEC’… 글로벌 투자 이끌어 7.4조 넘는 경제효과,,20년 만에 한국에서 열린 아시아태평양경제협력체(APEC) 정상회의와 미국과 중국 일본 등 주요국의 릴레이 정상회담은 글로벌 통상 질서의 중요한 분기점이 됐다는 평가가 나온다. 도널드 트럼프 미국 대통령과 시진핑 중국 국가주석이 6년 만에 만나 무역전쟁 휴전에 합의하면서 전 세계의 주…,15시간 전,https://www.donga.com/news/Politics/article/all/20251103/132688650/2,동아일보
728조 예산전쟁… 지역상품권 등 이재명표 사업 놓고 격돌 예고,https://dimg.donga.com/a/296/167/95/2/wps/NEWS/IMAGE/2025/11/03/132689167.1.jpg,이재명 정부 첫 예산안의 국회 심사가 5일 국회 공청회를 시작으로 본격 진행된다. 정부가 확장재정 기조하에 올해 대비 8% 증가한 728조 원 규모 예산안을 국회에 제출한 가운데 여당은 “원안 통과”를 주장하는 반면 야당은 “빚잔치”라고 비판하며 대대적 삭감을 요구하겠단 방침이다.● …,15시간 전,https://www.donga.com/news/Politics/article/all/20251103/132688598/2,동아일보
"與, ‘李 재판중지법’ 공식화… 이달 우선처리 내비쳐",https://dimg.donga.com/a/296/167/95/2/wps/NEWS/IMAGE/2025/11/03/132689106.1.jpg,더불어민주당은 2일 “‘재판중지법’(형사소송법 개정안)에 대한 논의가 불가피한 현실적 문제가 됐다”고 밝혔다. 현직 대통령의 형사재판을 중단할 수 있는 재판중지법은 ‘국정안정법’이라고 규정하면서 이르면 이달 내 처리 가능성을 내비친 것이다 민주당 박수현 수석대변인은 이날 국회 기자간담…,15시간 전,https://www.donga.com/news/Politics/article/all/20251103/132688593/2,동아일보
與 “배당소득 분리과세 최고세율 완화 집중논의”,https://dimg.donga.com/a/296/167/95/2/wps/NEWS/IMAGE/2025/11/03/132689109.1.jpg,국회 기획재정위원회 조세소위는 정부가 9월 국회에 제출한 예산부수법안인 세법개정안 심사에 본격 착수한다. 특히 여당은 증시 부양책인 ‘배당소득 분리과세’의 최고세율 완화에 대해 집중 논의할 방침이다. 2일 민주당 김현정 원내대변인은 기자들과 만나 “배당소득 분리과세는 조세소위에서 이번…,15시간 전,https://www.donga.com/news/Politics/article/all/20251103/132688595/2,동아일보
軍 정찰위성 5호기 궤도 안착… 北 30㎝ 물체까지 식별,https://dimg.donga.com/a/296/167/95/2/wps/NEWS/IMAGE/2025/11/03/132688514.3.jpg,북한의 핵·미사일 도발 징후를 밀착 감시할 우리 군사정찰위성이 2일 발사됐다. 대북 킬체인(선제타격)의 ‘눈’을 구성할 군사정찰위성 5기 중 마지막 5호기다. 우리 군의 독자적인 군사 정찰위성 확보는 이재명 정부가 본격적으로 추진 중인 ‘임기 내 전시작전통제권(전작권) 전환’의 3대 …,15시간 전,https://www.donga.com/news/Politics/article/all/20251103/132688515/2,동아일보
"[단독]‘5년간 6건 기소’ 공수처, 내년 예산 296억 역대최대 편성",https://dimg.donga.com/a/296/167/95/2/wps/NEWS/IMAGE/2025/11/02/132631913.1.jpg,"고위공직자범죄수사처(공수처)의 내년 예산이 출범 이후 최대 규모인 296억여 원으로 편성된 것으로 확인됐다. 공수처는 ‘출범 5년간 6건 기소’라는 성적표를 거뒀는데, 수사 실적과 무관하게 예산은 매년 늘고 있다는 지적이 나온다. 2일 국민의힘 신동욱 의원실이 확보한 ‘2026년 공…",15시간 전,https://www.donga.com/news/Society/article/all/20251103/132688463/2,동아일보
"中 “韓, 시 주석 최고 예우로 맞이해줘… 바이오-AI 등 협력”",https://dimg.donga.com/a/296/167/95/2/wps/NEWS/IMAGE/2025/11/01/132683613.1.jpg,중국 정부가 아시아태평양경제협력체(APEC) 정상회의를 계기로 양국 정상이 만나 한중 관계가 개선됐고 이를 발판 삼아 한중 자유무역협정(FTA) 2단계 협상을 가속할 것이라고 했다.중국 외교부는 2일 “지난 몇 년간 어려움과 도전을 겪었음에도 이익이 서로 얽히고 얽혀 운명이 함께하는 …,20시간 전,https://www.donga.com/news/Inter/article/all/20251102/132688782/1,동아일보
"특검 “윤석열, 2022년 6·1 지방선거 직후 계엄 논의 가능성”",https://dimg.donga.com/a/296/167/95/2/wps/NEWS/IMAGE/2025/11/02/132688291.1.jpg,내란 특검팀은 윤석열 전 대통령이 취임 초기인 2022년 6·1 지방선거 직후부터 비상계엄을 모의했을 가능성을 포착하고 수사 중인 것으로 나타났다.2일 법조계에 따르면 특검은 지난 9월 민간인 A(79)씨의 서울 소재 주거지 등을 내란방조 혐의로 압수수색했다.A씨는 윤 전 대통령이 검…,22시간 전,https://www.donga.com/news/Society/article/all/20251102/132688290/1,동아일보
"김정수 “‘삼양라면 1963’ 귀환, 창업주 시아버지 평생 한 풀어드려”",https://dimg.donga.com/a/296/167/95/2/wps/NEWS/IMAGE/2025/11/03/132695250.1.png,3일 오전 서울 보코서울명동 호텔에서 열린 삼양식품 신제품 설명회장에서 김정수 삼양식품 부회장이 ‘식족평천(食足平天)’이란 문구가 새겨진 검은 천을 걷어 올리자 신제품 ‘삼양1963’ 모형이 모습을 드러냈다. ‘먹는 것이 족하면 천하가 평화롭다’는 뜻의 식족평천은 고(故) 전중윤 삼양…,10분 전,https://www.donga.com/news/Economy/article/all/20251103/132695180/1,동아일보
"한국여성경제인협회 서울지회, 베트남 현지서 여성기업 해외시장개척 사업 전개",https://dimg.donga.com/a/296/167/95/2/wps/NEWS/IMAGE/2025/11/03/132694778.1.jpg,한국여성경제인협회 서울지회(회장 김영순)는 서울시의 지원으로 추진한 ‘2025 해외시장개척 사업’을 10월 27일부터 29일까지 베트남 호치민에서 진행해 실질적인 성과를 거뒀다고 밝혔다.이번 사업은 여성기업종합지원센터 서울센터와 공동으로 진행됐다. 서울지역 여성 CEO 105명이 참여…,29분 전,https://www.donga.com/news/Economy/article/all/20251103/132695136/1,동아일보
"HD현대, 3분기 영업益 295%↑… “조선·변압기 호황 흐름 탔다”",https://dimg.donga.com/a/296/167/95/2/wps/NEWS/IMAGE/2025/11/03/132694990.1.jpg,"HD현대가 조선 호황에 힘입어 수익성이 대폭 개선된 실적을 거뒀다.HD현대는 올해 3분기 연결기준 매출 18조2243억 원, 영업이익 1조7024억 원의 경영실적을 기록했다고 3일 밝혔다. 전년 동기 대비 매출은 9.8% 증가했고 영업이익은 294.5% 늘어난 실적이다. 매출 증가율을…",29분 전,https://www.donga.com/news/Economy/article/all/20251103/132695129/1,동아일보
저축銀 연 3%대 예금상품 두 달 만에 188개→0개,https://dimg.donga.com/a/296/167/95/2/wps/NEWS/IMAGE/2025/11/03/132694393.1.jpg,서민금융기관인 저축은행의 연 3%대 예금 상품 200여 개가 두 달여 만에 자취를 감춘 것으로 나타났다. 한미 기준금리 인하에 따라 시장금리가 내려간 데다 정부의 대출 총량 감축으로 나갈 돈이 줄다 보니 저축은행들이 받을 돈도 늘리지 못하고 있기 때문으로 보인다. 3일 저축은행중앙회에…,1시간 전,https://www.donga.com/news/Economy/article/all/20251103/132692008/1,동아일보
반포 래미안 트리니원 등 청약 잇따라…현금부자 아니면 ‘높은 벽’,https://dimg.donga.com/a/296/167/95/2/wps/NEWS/IMAGE/2025/11/03/132692850.1.jpg,"10·15 부동산 대책으로 서울 전역과 수도권 주요 지역이 규제지역(조정대상지역·투기과열지구)으로 묶이면서 현금 부자가 아니면 청약 도전이 어려울 것으로 보인다. 이런 가운데 이달 서울 서초구 반포 래미안 트리니원, 경기 성남 더샵 분당 티에르원, 경기 광명 힐스테이트 광명11 등이 …",1시간 전,https://www.donga.com/news/Economy/article/all/20251103/132693431/1,동아일보
"“경로당 식사 공백 해소한다”… 농협경제지주, 농촌 경로당 ‘반조리식품 지원사업’ 추진",https://dimg.donga.com/a/296/167/95/2/wps/NEWS/IMAGE/2025/11/03/132694278.1.jpeg,농협경제지주는 농촌 지역 경로당의 식사 공백 문제를 해소하기 위해 ‘반조리식품 지원사업’을 추진하고 있다고 3일 밝혔다.이번 사업은 고령화와 인구 감소로 식사 준비에 어려움을 겪고 있는 농촌 경로당을 지원하기 위한 취지로 마련됐다. 농협경제지주는 전국 단위 공급망과 네트워크를 활용해 …,1시간 전,https://www.donga.com/news/Economy/article/all/20251103/132694288/1,동아일보
"남해화학·GS칼텍스, ‘무탄소 스팀 도입·공급사업’ 계약",https://dimg.donga.com/a/296/167/95/2/wps/NEWS/IMAGE/2025/11/03/132693894.1.jpg,남해화학과 GS칼텍스가 여수산단의 탄소중립 전환을 위한 무탄소 스팀(Carbon-free Steam) 도입·공급사업 계약을 체결했다고 3일 밝혔다.계약식은 지난달 31일 서울 GS칼텍스 본사에서 진행됐다. 이번 협력은 여수국가산업단지의 경쟁력 강화와 에너지 전환 대응을 위한 공동 사업…,1시간 전,https://www.donga.com/news/Economy/article/all/20251103/132693915/1,동아일보
“젠슨 황이 돌린 과자”…‘빼빼로데이’ 마케팅 경쟁 치열,https://dimg.donga.com/a/296/167/95/2/wps/NEWS/IMAGE/2025/11/03/132693791.1.jpg,유통업체들이 11일 ‘빼빼로 데이’를 앞두고 마케팅에 속도를 내고 있다. 아시아태평양경제협력체(APEC) 정상회의 기간 젠슨 황 엔비디아 최고경영자(CEO)가 간담회 도중 취재진에게 빼빼로를 건네며 화제가 된 가운데 업계는 높아진 관심을 판매 확대로 이어가려는 모양새다.편의점 업계는 …,1시간 전,https://www.donga.com/news/Economy/article/all/20251103/132693518/1,동아일보
"시드물, ‘보르피린 10% 볼륨 광크림’ 출시",https://dimg.donga.com/a/296/167/95/2/wps/NEWS/IMAGE/2025/11/03/132695304.1.jpeg,시드물은 볼륨 개선과 윤광 케어 기능을 결합한 신제품 ‘보르피린 볼륨 광크림’을 출시했다고 3일 밝혔다. 시드물은 자연 유래 성분과 합리적 처방을 특징으로 하는 국내 화장품 브랜드다.이번 신제품은 프랑스 세더마(Sederma)사의 성분 보르피린을 10% 함유하고 펩타이드 복합체 매트릭…,2시간 전,https://www.donga.com/news/Economy/article/all/20251103/132693658/1,동아일보
"카이스트, 초소형 적외선 센서 제작하는 3D 프린팅 기술 개발",https://dimg.donga.com/a/296/167/95/2/wps/NEWS/IMAGE/2025/11/03/132693555.1.jpg,KAIST 연구진이 머리카락 굵기 10분의 1 수준의 초소형 적외선 센서를 제작할 수 있는 3D 프린팅 기술을 세계 최초로 개발했다. 로봇에 대한 시장 수요가 커지고 있는 가운데 이번 기술 개발은 로봇 경량화에 기여를 할 것으로 기대된다.KAIST는 3일 김지태 기계공학과 교수팀이 오…,2시간 전,https://www.donga.com/news/Economy/article/all/20251103/132692903/1,동아일보
"국립농산물품질관리원, ‘제11회 GAP 인증 우수사례 경진대회’ 개최",https://dimg.donga.com/a/296/167/95/2/wps/NEWS/IMAGE/2025/11/03/132693403.1.jpg,"국립농산물품질관리원(이하 농관원)은 지난달 31일 제11회 GAP 인증 우수사례 경진대회를 개최하고 GAP 인증 우수농가와 유통업체, 지자체 등 GAP 인증 확산에 기여한 우수 사례를 선정해 시상했다고 밝혔다.농산물우수관리(GAP)제도는 농산물의 생산부터 수확 후 관리, 유통 단계까지…",2시간 전,https://www.donga.com/news/Economy/article/all/20251103/132693399/1,동아일보
세계인 입맛 사로잡은 김…해외표기 ‘GIM’으로 통일 추진,https://dimg.donga.com/a/296/167/95/2/wps/NEWS/IMAGE/2025/11/03/132693448.1.jpg,한국 김이 세계적으로 인기를 끌며 라면에 이어 연간 수출액 10억 달러(약 1조4000억 원) 클럽에 가입할 것으로 보인다. 정부는 폭발적인 김 수출 증가를 바탕으로 김의 해외 표기를 일본식 명칭인 노리(Nori)나 영어의 씨위드(Seaweed)가 아닌 ‘GIM’으로 만들기 위한 작업…,2시간 전,https://www.donga.com/news/Economy/article/all/20251103/132692838/1,동아일보
"aT, ‘식품외식·푸드테크 기술사업화 교육 성과공유대회’ 성료",https://dimg.donga.com/a/296/167/95/2/wps/NEWS/IMAGE/2025/11/03/132693381.2.jpg,"농림축산식품부와 한국농수산식품유통공사(aT)가 ‘식품외식·푸드테크 기술사업화 교육 성과공유대회’를 성황리에 마쳤다고 3일 밝혔다.aT는 식품산업과 푸드테크 분야 창업을 희망하는 벤처 연구팀을 위해 ‘식품외식·푸드테크 기술사업화 교육’을 운영해 청년들의 취업, 창업, 그리고 식품외식·푸…",2시간 전,https://www.donga.com/news/Economy/article/all/20251103/132693392/1,동아일보
현대차 美 판매량 13개월만에 감소…EV 세제혜택 만료 여파,https://dimg.donga.com/a/296/167/95/2/wps/NEWS/IMAGE/2025/11/03/132693380.1.jpg,현대차의 미국 내 자동차 판매량이 전기차(EV) 세제 혜택 만료 여파로 13개월만에 뒷걸음질쳤다. 다만 하이브리드차(HEV)의 선전으로 현대차그룹 전체 판매량은 전년과 비슷한 수준을 유지했다.3일 현대차·기아는 지난달 현대차(제네시스 포함)·기아의 미국 내 합산 판매량이 14만6137…,2시간 전,https://www.donga.com/news/Economy/article/all/20251103/132692901/1,동아일보
‘장기연체 빚 탕감’ 배드뱅크 난항…대부업체 “정부 제시액 너무 헐값”,https://dimg.donga.com/a/296/167/95/2/wps/NEWS/IMAGE/2025/11/03/132693263.1.jpg,이재명 정부의 장기 연체자 빚 탕감을 위한 배드뱅크인 ‘새도약기금’이 출범한 지 한 달이 넘었지만 가장 많은 연체 채권을 쥔 대부업권과 이견을 좁히지 못해 차질을 빚고 있다. 6조 원이 넘는 연체 채권을 보유한 대부업체들은 “정부가 제시한 헐값에 채권을 넘기기 힘들다”며 버티고 있다.…,2시간 전,https://www.donga.com/news/Economy/article/all/20251103/132692291/1,동아일보
‘김치프리미엄 해법 vs 근본적 한계’…가상자산 거래소 간 ‘오더북 공유’ 논란,https://dimg.donga.com/a/296/167/95/2/wps/NEWS/IMAGE/2025/11/03/132693097.1.jpg,가상자산거래 업계에 ‘오더북 공유(Order Book)’가 화두로 떠올랐다. 국내 2위 거래소 빗썸과 세계 1위 거래소 바이낸스에 인수된 고팍스 등을 중심으로 현행법상 사실상 불가능한 ‘오더북 공유’가 논란이 되고 있어서다.업계에 따르면 금융위원회 산하 금융정보분석원(FIU)은 지난달…,2시간 전,https://www.donga.com/news/Economy/article/all/20251103/132691579/1,동아일보
"36년 만에 돌아온 우지 라면… ‘나쁜기름 우려’, 정말 괜찮을까?",https://dimg.donga.com/a/296/167/95/2/wps/NEWS/IMAGE/2025/11/03/132693146.2.jpg,‘우지(牛脂·소기름) 파동’으로 사라졌던 ‘우지 라면’이 36년 만에 돌아온다. 우지가 건강에 좋지 않다는 우려 속에서도 삼양식품은 ‘진짜 맛’이라는 진정성으로 승부를 보겠다는 복안이다.삼양식품은 3일 서울 중구 보코서울명동 호텔에서 신제품 ‘삼양1963’ 출시 발표회를 진행했다. 해…,2시간 전,https://www.donga.com/news/Economy/article/all/20251103/132693192/1,동아일보
"알몬티인더스트리즈, 미국 몬태나 텅스텐 광산 인수",,알몬티인더스트리즈(Almonty Industries)는 미국 몬태나주 비버헤드 카운티(Beaverhead County)에 위치한 ‘젠텅브라운스레이크 텅스텐 광산(Gentung-Browns Lake Tungsten Project)’을 인수했다고 3일 밝혔다.해당 광산은 과거 미국 전략 …,2시간 전,https://www.donga.com/news/Economy/article/all/20251103/132693185/1,동아일보
‘저가 예금’ 22조 줄고 ‘마통’ 1억 뚫었다…증시로 ‘머니무브’ 뚜렷,https://dimg.donga.com/a/296/167/95/2/wps/NEWS/IMAGE/2025/11/03/132693129.1.jpg,"은행권의 저가 예금이자 ‘투자 대기성 자금’인 요구불예금이 한 달 새 22조 원 감소한 것으로 나타났다. 하루 평균 7000억 원이 넘게 빠져나간 것으로, 사천피(4000포인트)를 돌파한 증시로의 ‘머니무브’ 영향인 것으로 풀이된다.반면 잇따른 대출 규제로 ‘갭투자’가 크게 제한되자 …",2시간 전,https://www.donga.com/news/Economy/article/all/20251103/132693128/1,동아일보
