title,thumbnail,short_content,write_time,link,company
"감사원, 尹 대통령실 비밀통로-히노키 사우나 들여다본다",https://dimg.donga.com/a/296/167/95/2/wps/NEWS/IMAGE/2026/02/06/133309336.1.jpg,감사원이 윤석열 정부 당시 대통령 집무실에 조성된 비밀통로와 사우나실 등에 대한 감사에 착수한다. 2023년 한국마사회와 한전KDN의 YTN 지분 매각 과정 등 공공기관 자산 관리에 대한 감사도 올해 이뤄질 예정이다. 감사원은 이 같은 내용의 ‘2026년도 연간 감사계획’을 5일 공개…,14시간 전,https://www.donga.com/news/Politics/article/all/20260206/133308838/2,동아일보
李 국정지지율 63%… 6개월새 가장 높아,https://dimg.donga.com/a/296/167/95/2/wps/NEWS/IMAGE/2026/02/06/133309290.1.jpeg,"이재명 대통령의 국정 지지율이 63%로 집계돼 지난해 8월 1주차(65%) 이후 6개월 만에 가장 높은 수치를 기록했다. 엠브레인퍼블릭, 케이스탯리서치, 코리아리서치, 한국리서치가 2∼4일 전국 성인 남녀 1003명을 조사해 5일 발표한 2월 1주 전국지표조사(NBS 무선전화 면접 1…",14시간 전,https://www.donga.com/news/Politics/article/all/20260206/133308836/2,동아일보
트럼프 ‘희토류 블록’… 中 독점 판 뒤엎는다,https://dimg.donga.com/a/296/167/95/2/wps/NEWS/IMAGE/2026/02/06/133309287.1.jpg,도널드 트럼프 미국 행정부가 핵심광물의 원활한 공급망 확보를 위해 새로운 무역블록 구축에 나섰다. 이 블록은 전 세계 희토류 정제의 90% 이상을 독점해 온 중국의 ‘희토류 무기화’에 대응하기 위한 것으로 미국이 동맹·우방을 규합해 핵심광물 생태계를 재편하려는 시도다. 이에 사실상 강…,14시간 전,https://www.donga.com/news/Inter/article/all/20260206/133308832/2,동아일보
장동혁 “사퇴 요구하려면 의원-단체장직 걸어라”,https://dimg.donga.com/a/296/167/95/2/wps/NEWS/IMAGE/2026/02/06/133309283.1.jpg,국민의힘 장동혁 대표가 5일 한동훈 전 대표 제명 이후 제기된 사퇴·재신임 요구와 관련해 “누구라도 내일까지 자신의 정치적 생명을 걸고 제게 재신임이나 사퇴를 요구한다면 저는 곧바로 전 당원 투표를 실시하겠다”고 밝혔다. 서로 직책을 걸고 자신의 재신임 여부를 당원에게 묻자는 것. 친…,14시간 전,https://www.donga.com/news/Politics/article/all/20260206/133308830/2,동아일보
與 “보완수사권 없애고 요구권만 부여”… 정부案에 반기,https://dimg.donga.com/a/296/167/95/2/wps/NEWS/IMAGE/2026/02/06/133309280.1.jpg,더불어민주당이 보완수사권을 전면 폐지하는 대신 보완수사요구권만 허용하는 검찰개혁안을 정부에 요구하기로 했다. 이재명 대통령이 검찰청 폐지 후 신설되는 공소청에 ‘예외적인 보완수사권’을 부여하는 방안을 제안했지만 이를 수용하지 않기로 한 것이다. 민주당은 5일 정책의원총회를 열고 이 같…,14시간 전,https://www.donga.com/news/Politics/article/all/20260206/133308828/2,동아일보
겨울바다 뚫고… 해군 특전요원 혹한기 훈련,https://dimg.donga.com/a/296/167/95/2/wps/NEWS/IMAGE/2026/02/06/133306277.5.jpg,해군 특수전전단 특전요원(UDT/SEAL)들이 강원 동해안 일대에서 혹한기 훈련의 일환으로 해안 침투 훈련을 하고 있다. 5일 해군은 특전요원들이 2일부터 11일까지 동해안과 산악 일대에서 2026년 혹한기 훈련을 진행한다고 밝혔다.,14시간 전,https://www.donga.com/news/Politics/article/all/20260206/133308825/2,동아일보
[단독]與 대외비 문건 “조국당에 지명직 최고위원 배분”,https://dimg.donga.com/a/296/167/95/2/wps/NEWS/IMAGE/2026/02/06/133309278.1.jpg,더불어민주당이 조국혁신당과 합당 시 일정과 방식에 대한 대외비 문건을 작성한 것으로 나타났다. 문건에는 조국혁신당 측 인사를 지명직 최고위원으로 지명하는 방안을 검토하는 내용이 담겼다. 사실상 2021년 열린민주당과의 흡수 합당을 모델로 삼은 것이어서 논란이 예상된다. 5일 동아일보…,14시간 전,https://www.donga.com/news/Politics/article/all/20260206/133308826/2,동아일보
"與, 李 언급 ‘예외적 보완수사권’도 거부… “검찰총장 호칭 안돼”",https://dimg.donga.com/a/296/167/95/2/wps/NEWS/IMAGE/2026/02/06/133306592.6.jpg,더불어민주당이 5일 중대범죄수사청(중수청)과 공소청 법안에 대한 당의 입장을 발표하면서 정부가 입법 예고한 법안의 주요 내용들을 상당수 뒤집었다. 이재명 대통령이 제안한 예외적 보완수사권 유지에 대해서도 수용 불가 입장을 분명히 했다. 민주당은 정부와의 협의 과정에서 일부 수정 여지를…,14시간 전,https://www.donga.com/news/Politics/article/all/20260206/133308852/2,동아일보
"李, 2차 특검 권창영 임명… 조국당 추천, 판사 출신",https://dimg.donga.com/a/296/167/95/2/wps/NEWS/IMAGE/2026/02/06/133308431.4.jpg,이재명 대통령은 5일 ‘3대(내란·김건희·채 상병) 특검’ 종료 이후 남은 의혹 등을 추가로 수사할 ‘2차 종합특검’의 특별검사로 조국혁신당이 추천한 권창영 법무법인 지평 변호사(사법연수원 28기·사진)를 임명했다. 청와대 대변인실은 이날 공지를 내고 이같이 밝혔다. 앞서 더불어민주당…,14시간 전,https://www.donga.com/news/Politics/article/all/20260206/133308849/2,동아일보
통일부 이어 軍도 “DMZ 남측 철책 이남은 韓 관할” 유엔사에 요구,https://dimg.donga.com/a/296/167/95/2/wps/NEWS/IMAGE/2026/02/06/133309258.1.jpg,"국방부가 최근 유엔군사령부에 비무장지대(DMZ) 내 일부 구역의 관할권(출입 승인 권한)을 한국군이 행사하는 방안을 제안한 것으로 밝혀졌다. 하지만 지난달 말 유엔사가 DMZ 관할은 유엔군사령관의 고유 권한이고, 정부와 여당이 주도하는 ‘DMZ법’(비군사적 목적의 DMZ 출입 권한은 …",14시간 전,https://www.donga.com/news/Politics/article/all/20260206/133308482/2,동아일보
"관세 위협 美, ‘본토 전력수급 프로젝트’에 韓 1호 투자 요구",https://dimg.donga.com/a/296/167/95/2/wps/NEWS/IMAGE/2026/02/06/133309254.1.jpg,"한국에 대한 25% 관세 재부과 조치가 담긴 도널드 트럼프 미국 행정부의 연방 관보 게재가 임박한 가운데, 미국은 한국의 ‘1호 대미 투자 프로젝트’ 이행 속도와 관세 인상을 연계해 압박하고 있는 것으로 알려졌다. 인공지능(AI) 등 첨단 산업 전력 수요가 급증하면서 미국이 에너지 관…",14시간 전,https://www.donga.com/news/Politics/article/all/20260206/133308479/2,동아일보
與 “대미투자특별법 내달 9일까지 처리”,https://dimg.donga.com/a/296/167/95/2/wps/NEWS/IMAGE/2026/02/06/133309252.1.jpg,더불어민주당이 한미 관세협상의 후속 조치인 대미투자특별법(한미 전략적 투자 관리를 위한 특별법)을 다음 달 9일까지 국회 본회의에서 처리하기로 했다. 문금주 원내대변인은 5일 국회에서 열린 정책조정회의 후 기자들과 만나 “대미투자특별법 처리를 위한 특위가 9일 본회의에서 의결되면 1개…,14시간 전,https://www.donga.com/news/Politics/article/all/20260206/133308477/2,동아일보
"“창조경제센터 답습 안하려면, AI 등 지역별 ‘규제 프리존’ 설치를”",https://dimg.donga.com/a/296/167/95/2/wps/NEWS/IMAGE/2026/02/06/133309245.1.jpg,"삼성, SK, 현대차, LG 등 10대 그룹이 4일 이재명 대통령과의 기업 간담회 이후 5년간 270조 원을 지방에 투자하겠다고 밝히며 지역 경제 활성화 기대감이 커지고 있다. 다만 ‘균형 발전’을 위한 지방 경제 활성화 정책은 이미 역대 여러 정부에서 추진했지만 흐지부지된 경험이 적…",14시간 전,https://www.donga.com/news/Economy/article/all/20260206/133308858/2,동아일보
李 “똘똘한 한채? 주거용 아니면 안하는게 이익될 것”,https://dimg.donga.com/a/296/167/95/2/wps/NEWS/IMAGE/2026/02/06/133309247.1.jpg,"이재명 대통령은 5일 “똘똘한 한 채로 갈아타기요? 분명히 말씀드리는데, 주거용이 아니면 그것도 안 하는 것이 이익일 것”이라고 밝혔다. 다주택자를 겨냥한 고강도 발언을 잇달아 내놓으며 매도를 압박하는 가운데, 이 대통령이 향후 보유세 등 세제 개편 가능성을 시사하면서 이른바 ‘똘똘한…",14시간 전,https://www.donga.com/news/Politics/article/all/20260206/133308854/2,동아일보
李 “과학기술 인재 대체복무 확대 검토”… 연구부대도 제안,https://dimg.donga.com/a/296/167/95/2/wps/NEWS/IMAGE/2026/02/06/133306586.6.jpg,이재명 대통령은 5일 과학기술 인재의 군 대체복무와 관련해 “확대를 검토하는 중”이라고 밝혔다. 이 대통령은 이날 청와대 영빈관에서 열린 ‘미래 과학자와의 대화’ 행사에서 “남성 청년들이 국방 의무 이행으로 상당 기간의 공백이 발생할 수밖에 없는 상황이라 여러 갈등 요소가 되기도 하고…,14시간 전,https://www.donga.com/news/Politics/article/all/20260206/133308862/2,동아일보
"‘대장동 변호인’ 與이건태, 李사건 공소취소 모임 추진",https://dimg.donga.com/a/296/167/95/2/wps/NEWS/IMAGE/2026/02/05/133306757.1.jpeg,이재명 대통령의 대장동 사건 변호사 출신인 더불어민주당 이건태 의원이 이 대통령 사건의 공소취소를 위한 의원 모임 결성에 나섰다. 검찰이 ‘대장동 닮은꼴 사건’으로 불리는 위례 신도시 개발 비리 사건 1심 무죄 판결에 항소를 포기한 가운데 공소 취소 압박에 나선 것으로 풀이된다. 5일…,14시간 전,https://www.donga.com/news/Politics/article/all/20260206/133308860/2,동아일보
‘1억 공천헌금’ 의혹 38일만에… 강선우-김경 구속영장 신청,https://dimg.donga.com/a/296/167/95/2/wps/NEWS/IMAGE/2026/02/06/133308511.4.jpg,‘1억 원 공천헌금’ 의혹을 수사하는 경찰이 5일 더불어민주당에서 제명된 강선우 의원과 김경 전 서울시의원의 구속영장을 신청했다. 관련 녹취록이 공개된 뒤 38일 만이다. 서울경찰청 공공범죄수사대는 이날 오전 강 의원과 김 전 시의원에 대해 정치자금법·청탁금지법 위반 혐의로 서울중앙지…,14시간 전,https://www.donga.com/news/Society/article/all/20260206/133308875/2,동아일보
박찬대 “시장합니다! 밥주세요!” 발언에 李대통령 웃음,https://dimg.donga.com/a/296/167/95/2/wps/NEWS/IMAGE/2026/02/05/133308927.1.jpg,"더불어민주당 박찬대 전 원내대표가 5일 이재명 대통령이 초청한 청와대 만찬 자리에서 “시장합니다, 밥주세요”라는 발언으로 6·3지방선거에서 인천시장 출마할 결심을 밝힌 것으로 알려졌다. “밥주세요“라며 사실상 지원 요청으로 해석될 수 있는 이같은 발언에 이 대통령은 크게 웃으며 화답한…",20시간 전,https://www.donga.com/news/Politics/article/all/20260205/133308777/1,동아일보
오세훈 ‘시내버스’ 발언 겨냥한 정원오…“디테일 확인 않은 비판”,https://dimg.donga.com/a/296/167/95/2/wps/NEWS/IMAGE/2026/02/05/133308774.1.jpg,정원오 성동구청장은 5일 오세훈 서울시장이 자신이 제기한 시내버스 운영 방식 개편 구상을 즉흥적인 제안이라고 비판한 데 대해 “최소한의 사실관계와 제도 구분이라는 디테일조차 확인하지 않은 비판”이라고 반박했다.정 구청장은 이날 자신의 페이스북을 통해 “오세훈 시장님은 공공시설 무료 셔…,20시간 전,https://www.donga.com/news/Politics/article/all/20260205/133308773/1,동아일보
"‘대장동 변호인’ 이건태 의원, 李대통령 사건 공소취소 추진 의원 모임 결성 나서",https://dimg.donga.com/a/296/167/95/2/wps/NEWS/IMAGE/2026/02/05/133306757.1.jpeg,이재명 대통령의 대장동 사건 변호사 출신인 더불어민주당 이건태 의원이 이 대통령 사건의 공소취소를 위한 의원 모임 결성에 나섰다. 검찰이 ‘대장동 닮은꼴 사건’으로 불리는 위례 신도시 개발비리 사건 1심 무죄 판결에 항소를 포기한 가운데 공소 취소 압박에 나선 것으로 풀이된다.5일 정…,20시간 전,https://www.donga.com/news/Politics/article/all/20260205/133308564/1,동아일보
"EV 부진에 배터리서 발 빼는 美 완성차… LG에너지솔루션, 스텔란티스 합작법인 인수",https://dimg.donga.com/a/296/167/95/2/wps/NEWS/IMAGE/2026/02/06/133314422.1.jpg,제너럴모터스(GM)에 이어 스텔란티스도 LG에너지솔루션과 배터리 합작법인 운영에서 손을 떼기로 했다. 전기차 수요 부진이 이어지면서 완성차 업체들이 직접 개입하는 배터리 사업 축소하는 모습이다.LG에너지솔루션은 스텔란티스와 캐나다 합작법인 ‘넥스트스타에너지(NextStar Energy…,20분 전,https://www.donga.com/news/Economy/article/all/20260206/133314428/1,동아일보
"“韓 GDP 대비 대미투자 규모 17.5%, 日-EU 웃돌아”…‘2026 경제학 공동학술대회’ 개최",https://dimg.donga.com/a/296/167/95/2/wps/NEWS/IMAGE/2026/02/06/133314145.1.jpg,"한국의 국내총생산(GDP) 대비 대미 투자 규모가 유럽연합(EU), 일본 등 주요 국가보다 높다는 분석이 나왔다.6일 한국국제경제학회 등이 서울 동장국 중앙대 서울캠퍼스에서 개최한 ‘2026 경제학 공동학술대회’에서 최병일 한국국제경제학회 명예회장은 “트럼프 행정부 관세 조치, 차이나…",53분 전,https://www.donga.com/news/Economy/article/all/20260206/133314127/1,동아일보
"LG엔솔, 넥스트스타 에너지 완전 자회사로… 북미 ESS 전초기지 구축",https://dimg.donga.com/a/296/167/95/2/wps/NEWS/IMAGE/2026/02/06/133314203.1.jpg,LG에너지솔루션이 캐나다 합작법인 ‘넥스트스타 에너지(NextStar Energy)’를 100% 자회사로 전환하며 북미 ESS(에너지저장장치) 시장 공략에 속도를 낸다.LG에너지솔루션은 6일 캐나다 합작법인인 넥스트스타 에너지의 스텔란티스 보유 지분 49%를 인수한다고 밝혔다. 이로써…,57분 전,https://www.donga.com/news/Economy/article/all/20260206/133314209/1,동아일보
"“영업익 126%↑”… ‘체질 개선’ 교촌, 올림픽·월드컵 특수 기대감까지",https://dimg.donga.com/a/296/167/95/2/wps/NEWS/IMAGE/2026/02/06/133313987.2.jpg,교촌치킨을 운영하는 교촌에프앤비가 지난해 가맹본부 구조 개선 등 수익 구조를 개선하면서 수익성 회복에 성공했다.교촌에프앤비는 연결 기준으로 지난해 매출액이 5174억 원으로 전년 대비 7.6% 증가했다고 6일 밝혔다.특히 영업이익은 349억 원으로 126.2%나 급증했다. 원자재 가격…,1시간 전,https://www.donga.com/news/Economy/article/all/20260206/133313988/1,동아일보
"현대차그룹, 美 3대 자동차 전문매체 연속 수상… “소비자 중심경영 지속”",https://dimg.donga.com/a/296/167/95/2/wps/NEWS/IMAGE/2026/02/06/133313780.2.jpg,"현대차그룹은 6일 미국 3대 주요 자동차 매체에서 연속 수상하며 북미 시장에서 제품 경쟁력을 다시 한번 인정받았다고 밝혔다. 이번 수상은 미국의 대표 자동차 전문지 카 앤 드라이버(Car and Driver), TV 프로그램 모터위크(MotorWeek), 자동차 평가 웹사이트 카즈닷컴…",1시간 전,https://www.donga.com/news/Economy/article/all/20260206/133313830/1,동아일보
"단돈 14만원에…LG엔솔, 스텔란티스-加 공장 지분 49% 인수",https://dimg.donga.com/a/296/167/95/2/wps/NEWS/IMAGE/2026/02/06/133313752.1.jpg,"LG에너지솔루션이 스텔란티스와의 캐나다 배터리 합작법인 ‘넥스트스타 에너지’를 100% 자회사로 전환한다. 스텔란티스가 보유하고 있던 지분 49%를 인수한 것으로, 인수 금액은 단돈 100달러(약 14만 원)에 불과하다. 전기차 수요 회복 시점이 불투명한 상황에서, 이미 가동 중인 북…",1시간 전,https://www.donga.com/news/Economy/article/all/20260206/133313371/1,동아일보
"세정나눔재단, 설 앞두고 취약계층 자활 지원에 6000만 원 후원",https://dimg.donga.com/a/296/167/95/2/wps/NEWS/IMAGE/2026/02/06/133312035.1.jpg,세정그룹 산하 세정나눔재단이 설 명절을 앞두고 부산 지역 취약계층 자활 참여자 지원에 나섰다.세정나눔재단은 6일 오전 10시 부산 금정구 부곡동에 위치한 세정그룹 본사에서 금정구지역자활센터가 추진하는 사회공헌 사업 ‘오늘이 괜찮아지는 하루’에 총 6000만 원을 지원한다고 밝혔다.‘오…,1시간 전,https://www.donga.com/news/Economy/article/all/20260206/133312003/1,동아일보
"외국인 ‘셀 코리아’ 가속…환율, 장중 1470원 돌파",https://dimg.donga.com/a/296/167/95/2/wps/NEWS/IMAGE/2026/02/06/133313541.1.jpg,외국인투자가들의 ‘셀 코리아’(국내 증시 순매도)가 이어지면서 원-달러 환율이 장중 1470원 선을 넘어섰다.6일 서울 외환시장에서 원-달러 환율은 전날보다 0.5원 오른 1469.5원에 주간거래(오후 3시 반 기준)를 마감했다. 이날 환율은 1472.7원으로 출발했는데 장중 1470…,1시간 전,https://www.donga.com/news/Economy/article/all/20260206/133312317/1,동아일보
"롯데쇼핑, 작년 영업익 5470억 원…전년 대비 15.6% 증가",https://dimg.donga.com/a/296/167/95/2/wps/NEWS/IMAGE/2026/02/06/133313258.1.jpg,롯데쇼핑이 백화점 사업 호조에 힘입어 지난해 영업이익을 큰 폭으로 늘렸다. 다만 마트 사업은 국내 부진 여파로 적자 전환하며 사업별 희비가 엇갈렸다.롯데쇼핑은 연결 기준 지난해 영업이익이 5470억 원으로 전년보다 15.6% 증가한 것으로 잠정 집계됐다고 6일 공시했다. 매출은 13조…,2시간 전,https://www.donga.com/news/Economy/article/all/20260206/133312134/1,동아일보
"쿠팡 반사익 ‘반짝’… 네이버, 작년 커머스 성장세 속 역대 최대 실적",https://dimg.donga.com/a/296/167/95/2/wps/NEWS/IMAGE/2026/02/06/133313234.2.jpg,"네이버가 지난해 AI 기술을 접목한 핵심 사업과 커머스 성장세에 힘입어 역대 최대 실적을 올렸다.네이버는 연결 기준 지난해 매출 12조350억 원, 영업이익 2조2081억 원을 달성했다고 6일 밝혔다. 이는 각각 전년 대비 12.1%, 11.6%씩 증가한 수준이다. 네이버는 지난해 처…",2시간 전,https://www.donga.com/news/Economy/article/all/20260206/133313236/1,동아일보
"이번주만 사이드카 3번 발동…코스피, 장중 5000 아래로",https://dimg.donga.com/a/296/167/95/2/wps/NEWS/IMAGE/2026/02/06/133313181.1.jpg,"미국 빅테크의 과도한 인공지능(AI) 투자와 수익성 부진 우려로 코스피가 나흘 만에 장중 5,000선 밑으로 떨어졌다. 이른바 ‘AI 거품론’이 제기될 때마다 주식시장이 롤러코스터처럼 크게 요동치면서 이번 주에만 코스피 사이드카(프로그램 매매 호가 일시 효력 정지)가 세 차례나 발동되…",2시간 전,https://www.donga.com/news/Economy/article/all/20260206/133312720/1,동아일보
“코인에 2억4000 날리고 빚만 2200만원 남아” 영끌 청년들 멘붕,https://dimg.donga.com/a/296/167/95/2/wps/NEWS/IMAGE/2026/02/06/133314426.1.jpg,며칠째 하락하던 비트코인 가격이 6일 추가로 급락하면서 대출까지 동원해 투자에 나섰던 이른바 ‘영끌’ 청년층이 패닉에 빠졌다. 온라인 커뮤니티에는 결혼 자금을 잃었다거나 빚만 남았다는 하소연이 잇따랐다.이날 서울 강북구에 사는 정모 씨(29)는 “최근 비트코인 가격 급락으로 현물 투자…,2시간 전,https://www.donga.com/news/Society/article/all/20260206/133312638/1,동아일보
“이게 한국 ‘정’ 과자야”…세계인 취향 잡은 초코파이의 변신,https://dimg.donga.com/a/296/167/95/2/wps/NEWS/IMAGE/2026/02/06/133313044.1.jpg,한국인의 대표 과자로 꼽히는 초코파이로 인지도가 높은 오리온이 해외 시장에서 현지화 전략을 바탕으로 실적 개선 흐름을 이어가고 있다.,2시간 전,https://www.donga.com/news/Economy/article/all/20260206/133312053/2,동아일보
이제 폰으로 ‘로또’ 사세요…7년만에 모바일 판매 도입,https://dimg.donga.com/a/296/167/95/2/wps/NEWS/IMAGE/2026/02/06/133312923.1.jpg,9일부터 평일에는 로또복권을 스마트폰으로 살 수 있다. 2018년 12월 로또복권의 PC 판매가 허용된 지 7년여 만에 모바일 판매로 확대되는 것이다.기획예산처 복권위원회는 9일부터 동행복권 모바일 홈페이지를 통해 로또복권을 구입할 수 있다고 6일 밝혔다. 지금까지는 로또판매점을 찾아…,2시간 전,https://www.donga.com/news/Economy/article/all/20260206/133312512/1,동아일보
"풀무원푸드앤컬처, 호텔 뷔페·100층 전망대서 설 맞이 프로모션 선봬",https://dimg.donga.com/a/296/167/95/2/wps/NEWS/IMAGE/2026/02/06/133312522.1.jpg,풀무원의 푸드서비스 전문기업 풀무원푸드앤컬처는 설 명절을 맞아 자사가 운영하는 호텔 뷔페 ‘더카라’와 해운대 랜드마크 전망대 ‘부산 엑스 더 스카이’에서 시즌 프로모션을 진행한다고 6일 밝혔다.분당 서현역 인근 스카이파크 센트럴 서울 판교 호텔 내 위치한 뷔페 레스토랑 더카라는 이달 …,3시간 전,https://www.donga.com/news/Economy/article/all/20260206/133312532/1,동아일보
"삼성전자, ‘찾아가는 바로 서비스’ 확대… 제품 점검·수리 더 간편하게",https://dimg.donga.com/a/296/167/95/2/wps/NEWS/IMAGE/2026/02/06/133312504.2.jpg,"삼성전자는 6일 고객이 거주하는 지역으로 직접 방문해 제품 점검과 상담을 제공하는 ‘찾아가는 바로 서비스’를 본격 운영한다고 밝혔다.이 서비스는 삼성전자 전문 인력이 아파트나 주상복합 단지 등 생활공간 인근을 찾아가 약 1~2주 동안 운영되는 임시 서비스 부스를 통해 제품 점검, 간단…",3시간 전,https://www.donga.com/news/Economy/article/all/20260206/133312515/1,동아일보
李 “주가조작땐 패가망신”…경제지 기자 선행매매 혐의에 경고,https://dimg.donga.com/a/296/167/95/2/wps/NEWS/IMAGE/2026/02/06/133311126.1.jpg,이재명 대통령은 6일 한 경제지 기자들의 선행매매 혐의에 대해 “주가조작 패가망신”이라고 했다. 이 대통령은 이날 X(옛 트위터)에 국내 한 경제지 매체 소속 기자들이 선행매매를 벌여 강제 수사를 받는다는 내용의 기사를 게시했다. 그러면서 “주가조작 패가망신”이라고 짧게 언급했다.해당…,3시간 전,https://www.donga.com/news/Politics/article/all/20260206/133312468/1,동아일보
[인터뷰]아벨라워 50년 위스키 한국상륙… 40년 경력 위스키장인이 말하는 ‘맛의 비밀’,https://dimg.donga.com/a/296/167/95/2/wps/NEWS/IMAGE/2026/02/06/133312334.2.jpg,"스코틀랜드 스페이사이드 아벨라워 증류소의 마스터 디스틸러 그레임 크뤽생크와 페르노리카 코리아 마케팅 총괄 미겔 파스칼 전무를 ‘아벨라워 50년’ 국내 출시를 기념해 인터뷰했다. 전 세계 20병 한정 생산된 초고연령 위스키는 롯데백화점을 통해 판매되며, 브랜드의 장인정신과 기술력을 상징…",3시간 전,https://www.donga.com/news/Economy/article/all/20260206/133312401/1,동아일보
‘공항 명가’ HJ중공업 “고난도 가덕도공항 건설 문제 없다… 기술력·경험 앞세워 해결”,https://dimg.donga.com/a/296/167/95/2/wps/NEWS/IMAGE/2026/02/06/133312374.1.jpg,"가덕도신공항 건설을 둘러싼 기술적 우려가 제기되는 가운데, 컨소시엄 참여사인 HJ중공업이 “기술적으로 충분히 대응 가능하다”는 입장을 6일 밝혔다. 일부 시공사 이탈로 사업 안정성 논란이 불거진 상황이지만 HJ중공업은 그동안 쌓아온 대형 국책 인프라 실적과 기술력으로 이를 극복할 수 …",3시간 전,https://www.donga.com/news/Economy/article/all/20260206/133312396/1,동아일보
남부내륙철도 첫삽…서울~진주·거제 2시간대로,https://dimg.donga.com/a/296/167/95/2/wps/NEWS/IMAGE/2026/02/06/133312237.1.png,"서울에서 거제까지 이동 시간이 2시간 50분대로 단축되는 남부내륙철도 건설사업이 첫 삽을 떴다.국토교통부는 6일 경남 거제시 견내량 인근에서 남부내륙철도 건설사업 착공식을 개최했다고 밝혔다. 이날 행사에는 정부와 국회, 지방정부 관계자와 지역 주민 등 약 400명이 참석했다.남부내륙철…",3시간 전,https://www.donga.com/news/Economy/article/all/20260206/133312235/1,동아일보
