title,thumbnail,short_content,write_time,link,company
[오늘의 채널A]유산균 효능과 ‘장 건강’ 생활습관 소개,,"유산균 효능과 ‘장 건강’ 생활습관 소개 비만은 단순한 체중 증가가 아니라 심뇌혈관 질환과 암, 치매의 위험을 높이는 원인이다. 순환기내과 김미현 전문의는 비만 체질에서 벗어나기 위해서는 장 건강에 신경 써야 한다고 강조한다. 건강한 한국인 산모의 모유에서 분리한 ‘BNR17유산균’의…",4시간 전,https://www.donga.com/news/Entertainment/article/all/20250321/131256845/2,동아일보
"‘피부과 얼굴화상’ 여배우, 윤진이었다…“CG 작업비 955만원”",https://dimg.donga.com/a/296/167/95/2/wps/NEWS/IMAGE/2025/03/21/131257246.1.jpg,"피부과 시술을 받다가 2도 화상을 입은 여성배우가 뒤늦게 윤진이로 알려졌다.21일 연예계에 따르면, 윤진이는 지난 2021년 KBS 2TV 주말극 ‘신사의 아가씨’ 방송을 앞두고 피부과 시술을 받았다가 2도 화상을 입었다. 앞서 서울중앙지법 18민사부(부장 박준민)가 최근 모 여성 배…",10시간 전,https://www.donga.com/news/Entertainment/article/all/20250321/131257245/1,동아일보
41세 윤은혜 “13년째 연애 안 하는 중…결혼하고파”,https://dimg.donga.com/a/296/167/95/2/wps/NEWS/IMAGE/2025/03/21/131257193.1.jpg,"그룹 ‘베이비복스’ 멤버 겸 배우 윤은혜(41)가 결혼에 대한 생각을 고백한다.21일 오후 9시 10분 방송되는 MBN·채널S 예능물 ‘전현무계획2’에 윤은혜가 게스트로 출연한다. 방송인 전현무, 유튜버 곽튜브와 함께 ‘소 한바퀴’ 특집의 끝을 선보인다.이날 방송에서 세 사람은 ‘전현…",10시간 전,https://www.donga.com/news/Entertainment/article/all/20250321/131257192/1,동아일보
‘하트페어링’ 입주자 놀라운 스펙…“백과사전서 볼 인물”,https://dimg.donga.com/a/296/167/95/2/wps/NEWS/IMAGE/2025/03/21/131257190.1.jpg,"‘하트페어링’의 한 입주자가 초고스펙을 공개했다.21일 오후 10시 50분 방송되는 채널A ‘하트페어링’은 이탈리아 피렌체에서 펼쳐지는 두 번째 ‘1 대 1 밀착 데이트’로 꾸며진다.이탈리아 토스카나에 마련된 ‘페어링하우스’에 입주한 참가자 우재, 제연, 지민, 지원, 찬형, 하늘과 …",10시간 전,https://www.donga.com/news/Entertainment/article/all/20250321/131257189/1,동아일보
"韓日 코미디 드림팀, 日서 또 뭉친다…메타코미디·요시모토 흥업 합동공연",https://dimg.donga.com/a/296/167/95/2/wps/NEWS/IMAGE/2025/03/21/131256810.1.jpg,"CJ ENM, 일본 최대 이동통신사 NTT 도코모 등과 협업해 K팝에 진출한 일본 대형 연예기획사 요시모토 흥업이 국내 코미디 대표 레이블 메타코미디와 또 협업한다. 21일 메타코미디에 따르면, 이 레이블은 오는 23일 일본 도쿄 시부야 무겐다이돔과 30~31일 일본 오카사 도톤보리 …",11시간 전,https://www.donga.com/news/Entertainment/article/all/20250321/131256809/1,동아일보
"김준수 “‘알라딘’ 노출 스트레스였는데, 모든 배우 벗고 있어”",https://dimg.donga.com/a/296/167/95/2/wps/NEWS/IMAGE/2025/03/21/131256744.1.jpg,"뮤지컬 배우 김준수가 뮤지컬 ‘알라딘’ 속 상의 탈의를 언급했다.21일 오후 공개된 대성의 유튜브 콘텐츠 ‘집대성’(집 밖으로 나온 대성)에서는 뮤지컬 ‘알라딘’의 김준수, 이성경, 정원영이 함께한 영상이 게재됐다.김준수가 뮤지컬 ‘알라딘’에서 자스민을 맡아 처음 뮤지컬에 도전한 이성…",11시간 전,https://www.donga.com/news/Entertainment/article/all/20250321/131256743/1,동아일보
‘병역기피’ 유승준 “잊지 않고 법원까지 온 팬들 감사”,https://dimg.donga.com/a/296/167/95/2/wps/NEWS/IMAGE/2025/03/21/131255959.1.jpg,"가수 유승준(스티브 유)이 팬들에게 고마움을 전했다.유승준이 21일 인스타그램에 “감사합니다. 그리고 사랑합니다”라며 “이렇게 오랜 시간이 지났는데도, 아직까지 잊지 않고 법원까지 찾아가서 힘이 돼주는 사랑하는 팬들과, 아직도 저를 기억하며 응원해 주는 여러분들이 있어서 저는 너무 행…",12시간 전,https://www.donga.com/news/Entertainment/article/all/20250321/131255958/1,동아일보
김수현 사태에 美 CNN “톱스타 엄격하게 감시하는 한국”,https://dimg.donga.com/a/296/167/95/2/wps/NEWS/IMAGE/2025/03/21/131255732.1.jpg,"외신이 고(故) 김새론과의 교제 논란에 휩싸인 배우 김수현 사태를 비중있게 다뤘다.미국 CNN은 20일(현지 시간) 김수현에 대한 기업의 광고 모델 기용 중단을 보도했다. 이탈리아 명품 브랜드 프라다(PRADA)는 지난해 12월 김수현을 브랜드 앰버서더로 발탁했으나, 이번 주 계약을 …",12시간 전,https://www.donga.com/news/Entertainment/article/all/20250321/131255731/1,동아일보
"한소희, 볼 빨간 미녀…‘좋아요’ 100만 돌파",https://dimg.donga.com/a/296/167/95/2/wps/NEWS/IMAGE/2025/03/21/131255362.1.jpg,배우 한소희가 미모를 뽐냈다. 한소희는 최근 자신의 소셜미디어에 별다른 글 없이 사진 여러 장을 올렸다.사진 속 한소희는 캐주얼한 의상을 입고 화보 촬영에 나선 모습이다. 뚜렷한 이목구비와 발랄한 미모가 돋보인다. 해당 게시물은 ‘좋아요’ 100만개를 돌파했다. 한소희는 인스타그램 팔…,13시간 전,https://www.donga.com/news/Entertainment/article/all/20250321/131255361/1,동아일보
"‘기습공격’, 16년 만에 ‘놀뭐’에서 부활…유재석 출정식",https://dimg.donga.com/a/296/167/95/2/wps/NEWS/IMAGE/2025/03/21/131255276.1.jpg,‘놀면 뭐하니?’ 유재석 어사와 암행단의 ‘2025년판 기습 공격’이 펼쳐진다.22일 오후 방송되는 MBC ‘놀면 뭐하니?’에서는 다시 보고 싶은 레전드 예능 ‘무한도전-기습 공격’이 16년 만에 부활한다. 최근 불황에 힘들어진 자영업자들을 위해 2025년 부활한 ‘기습 공격’은 유재…,13시간 전,https://www.donga.com/news/Entertainment/article/all/20250321/131255275/1,동아일보
"이수지, ‘여배우 조롱 시비’ 의식? “거친 바람 때문에 낭떠러지로…”",https://dimg.donga.com/a/296/167/95/2/wps/NEWS/IMAGE/2025/03/21/131254546.1.jpg,여배우를 조롱했다는 시비에 휩싸였던 개그우먼 이수지가 근황을 공개했다. 이수지는 21일 자신의 소셜미디어에 “낭떠러지로 함께 갈 수 있는 친구가 있다는 건”이라고 적고 지인으로부터 받은 손편지를 공개했다. 지인 A씨는 이수지에게 “연예인이라는 직업이 많은 사람들의 관심 속에서 살아간다…,14시간 전,https://www.donga.com/news/Entertainment/article/all/20250321/131254545/1,동아일보
"심은우 “학폭이슈 5년째, 가해자 누명 벗고파”",https://dimg.donga.com/a/296/167/95/2/wps/NEWS/IMAGE/2025/03/21/131254411.1.jpg,"배우 심은우(32·박소리)가 5년째 학교폭력 의혹 억울함을 호소했다. 피해자라고 주장한 A를 명예훼손 혐의로 고소했으나 불송치됐고, 재수사에도 증거 불충분으로 기존 결정이 유지됐다. 심은우는 “A가 금전적 배상을 요구했지만, 난 괴롭힌 사실이 없다”고 토로했다.심은우는 21일 “202…",14시간 전,https://www.donga.com/news/Entertainment/article/all/20250321/131254410/1,동아일보
"조훈현 그 자체…‘승부’ 이병헌, 유아인 리스크 뚫은 열연",https://dimg.donga.com/a/296/167/95/2/wps/NEWS/IMAGE/2025/03/21/131254327.1.jpg,그야말로 이병헌이 이병헌했다. 영화 ‘승부’(감독 김형주)에서 바둑계의 살아있는 전설 조훈현을 연기한 그는 예상대로 탁월한 연기를 보여주며 예비 관객의 마음을 사로잡았다.‘승부’는 대한민국 최고의 바둑 레전드 조훈현(이병헌 분)이 제자 이창호(유아인 분)와의 대결에서 패한 후 타고난 …,14시간 전,https://www.donga.com/news/Entertainment/article/all/20250321/131254326/1,동아일보
‘가처분 인용’ 어도어 “뉴진스 홍콩 공연 지원…멤버들 만나 진솔한 대화하고파”,https://dimg.donga.com/a/296/167/95/2/wps/NEWS/IMAGE/2025/03/21/131254321.1.jpg,"그룹 뉴진스의 소속사이자 하이브 레이블 중 한 곳인 어도어가 법원의 가처분 인용 결정에 대해 입장을 전했다.어도어는 21일 오후 공식 입장을 내고 “가처분 재판부의 현명한 판단에 깊이 감사드린다”라며 “어도어는 뉴진스 소속사 지위를 법적으로 확인 받은 만큼, 향후 아티스트 지원에 책임…",14시간 전,https://www.donga.com/news/Entertainment/article/all/20250321/131254320/1,동아일보
"어도어, 법원 가처분 인용에 “‘뉴진스 지원’ 책임 다하겠다”",https://dimg.donga.com/a/296/167/95/2/wps/NEWS/IMAGE/2025/03/21/131254275.1.jpg,"법원이 그룹 ‘뉴진스’가 소속사 어도어와의 전속계약 해지를 일방적으로 선언하고 새로운 팀명 ‘엔제이지(NJZ)’를 내세워 활동을 강행한 것에 제동을 건 가운데, 어도어가 뉴진스 지원에 나선다. 어도어는 21일 “가처분 재판부의 현명한 판단에 깊이 감사드린다. 어도어는 뉴진스 소속사 지…",14시간 전,https://www.donga.com/news/Culture/article/all/20250321/131254274/1,동아일보
뉴진스 멤버 측 “가처분 인용 이의제기할 것…홍콩 공연은 참석”,https://dimg.donga.com/a/296/167/95/2/wps/NEWS/IMAGE/2025/03/21/131254132.1.jpg,"그룹 뉴진스 멤버 측이 독자 활동에 제동이 걸린 가운데, 법원의 가처분 결정에 대해 입장을 밝혔다.뉴진스 멤버들의 부모 측은 21일 오후 공식 사회관계망서비스(SNS) 계정에 “저희 NJZ(엔제이지, 뉴진스 멤버들이 정한 그룹의 새 이름)는 법원의 결정을 존중한다”면서도 “그러나 해당…",14시간 전,https://www.donga.com/news/Entertainment/article/all/20250321/131254131/1,동아일보
"‘나혼산’ 옥자연, 반전 농구 실력 공개…현란한 양손 드리블",https://dimg.donga.com/a/296/167/95/2/wps/NEWS/IMAGE/2025/03/21/131254127.1.jpg,‘나 혼자 산다’에서 배우 옥자연이 반전의 농구 실력을 발휘한다.21일 오후 방송되는 MBC ‘나 혼자 산다’에서는 반전의 농구 실력을 뽐내는 옥자연의 ‘옥램덩크’ 현장이 공개된다.옥자연은 봄을 맞이해 침대 위 17년 된 애착 이불을 걷어내고 올 화이트의 봄 이불로 새로 단장한다. 이…,14시간 전,https://www.donga.com/news/Entertainment/article/all/20250321/131254126/1,동아일보
"‘600억 대작’ 김수현 차기작 ‘넉오프’, 결국 공개 보류",https://dimg.donga.com/a/296/167/95/2/wps/NEWS/IMAGE/2025/03/21/131254479.1.jpg,배우 김수현이 출연하는 디즈니+ 드라마 ‘넉오프’의 공개가 잠정 보류됐다.21일 디즈니+ ‘넉오프’ 측 관계자는 동아닷컴에 “‘넉오프’의 공개가 잠정 보류된 것이 맞다”고 밝혔다. ‘넉오프’는 IMF로 인해 인생이 송두리째 뒤바뀐 한 남자가 평범한 회사원에서 세계적인 짝퉁 시장의 제왕…,14시간 전,https://www.donga.com/news/Society/article/all/20250321/131254152/2,동아일보
"이시영, 이혼 공개 4일 만에 전한 근황 “예쁜 곳만 갈 것 같아”",https://dimg.donga.com/a/296/167/95/2/wps/NEWS/IMAGE/2025/03/21/131253984.1.jpg,"배우 이시영이 이혼 소식을 알린 지 4일 만에 근황을 공개했다.이시영은 21일 인스타그램에 “신꾸(신발 꾸미기)를 1시간 넘게 했나 봐”라며 “이거 했다 저거 했다 이것도 달아보고 저것도 달아보고, 이렇게 예쁜 신발 신고 다니면 예쁜 곳만 갈 것 같아”라고 적었다.함께 공개된 사진에서…",15시간 전,https://www.donga.com/news/Entertainment/article/all/20250321/131253983/1,동아일보
"‘김재중 소속사’ 인코드, 120억대 투자 유치 “글로벌 엔터로 도약”",https://dimg.donga.com/a/296/167/95/2/wps/NEWS/IMAGE/2025/03/21/131253977.1.jpg,"가수 겸 배우 김재중이 설립한 인코드 엔터테인먼트가 글로벌 종합 엔터사로의 발돋움을 예고했다.인코드 엔터테인먼트 측은 21일 “스틱벤처스, CJ인베스트먼트, SL인베스트먼트, 미래에셋벤처투자 등 클럽딜로 120억대 투자 계약을 체결했다”면서 “이를 토대로 향후 K팝과 K컬처를 주도하는…",15시간 전,https://www.donga.com/news/Entertainment/article/all/20250321/131253976/1,동아일보
