title,thumbnail,short_content,write_time,link,company
이재명 “근로소득세 역대 최대 수준…합리적 조세 정책 필요”,https://dimg.donga.com/a/296/167/95/2/wps/NEWS/IMAGE/2025/03/06/131154254.1.jpg,더불어민주당 이재명 대표가 6일 근로소득세 합리화 방안과 관련해 “근로소득세가 전체 세금의 18%를 차지해 역대 최대 수준”이라며 “합리적인 조세 정책의 필요성이 절실하다”고 강조했다.이 대표는 이날 국회에서 열린 ‘근로소득세 과세합리화 방안 모색 토론회’에 보낸 서면 축사에서 “물가…,8시간 전,https://www.donga.com/news/Politics/article/all/20250306/131153617/1,동아일보
與 “배우자 상속세 전면 폐지…유산세도 받은만큼만”,https://dimg.donga.com/a/296/167/95/2/wps/NEWS/IMAGE/2025/03/06/131153824.1.jpg,국민의힘이 6일 배우자 상속세 전면 폐지 방침을 밝혔다. 상속세의 배우자 공제 한도를 현행 5억 원에서 10억 원으로 높이겠다던 당론에서 한층 나아간 것이다. 최근 더불어민주당이 상속세 공제한도 상향을 추진하는 움직임에 맞불을 놓은 것으로 풀이된다.국민의힘 권영세 비상대책위원장은 이날…,8시간 전,https://www.donga.com/news/Politics/article/all/20250306/131153758/1,동아일보
"노엘, 父장제원 성폭력 의혹 속…SNS 의미심장한 한마디",https://dimg.donga.com/a/296/167/95/2/wps/NEWS/IMAGE/2025/03/06/131153691.2.jpg,레퍼 노엘(장용준·24)이 부친 국민의힘 장제원 전 의원의 성폭력 보도 이후 소셜네트워크(SNS)에 의미심장한 글을 올렸다.노엘은 지난 4일 자신의 인스타그램에 “모든 건 제자리로 돌아갈 거다. 기다려줘”라는 게시 글을 업데이트했다.해당 글은 지난해 12월 4일 올린 글을 수정해 올린…,9시간 전,https://www.donga.com/news/Politics/article/all/20250306/131153690/2,동아일보
"법사위, 국감 불출석 김건희·노소영 등 43명 검찰고발",https://dimg.donga.com/a/296/167/95/2/wps/NEWS/IMAGE/2025/03/06/131153631.3.jpg,국회 법제사법위원회가 지난해 국정감사 증인으로 출석하지 않은 김건희 여사와 노소영 아트센터 나비 관장을 ‘국회증언감정법 위반 혐의’로 고발했다. 5일 정치권에 따르면 법사위는 국정감사에 정당한 사유 없이 불출석한 43명을 지난달 21일 서울남부지검에 고발했다. 국회증언감정법은 정당한 …,9시간 전,https://www.donga.com/news/Politics/article/all/20250306/131153632/2,동아일보
美 “한국 정치상황 보면 한미일 협력지속 불확실”,https://dimg.donga.com/a/296/167/95/4/wps/NEWS/IMAGE/2025/03/06/131152898.1.jpg,엘브리지 콜비 미국 국방부 정책차관 후보자(사진)는 4일(현지 시간) “한국의 정치적 상황(political dynamics)을 보면 한미일 3자 협력이 지속될 수 있을지 불확실하다”고 밝혔다. 비상계엄 사태와 국정 공백 등을 언급한 것으로 풀이된다. 도널드 트럼프 2기 행정부 출범 …,15시간 전,https://www.donga.com/news/Politics/article/all/20250306/131152347/2,동아일보
"트럼프, 상하원 연설서 ‘김정은’ 한번도 언급안해",https://dimg.donga.com/a/296/167/95/2/wps/NEWS/IMAGE/2025/03/06/131152887.1.jpg,도널드 트럼프 미국 대통령은 4일(현지 시간) 상하원 합동회의 연설에서 북핵 문제나 김정은 국무위원장 등에 대해선 거론하지 않았다. 취임 첫날부터 김 위원장과의 ‘브로맨스’를 과시하며 북한을 ‘핵 능력 보유국(nuclear power)’이라고 표현한 트럼프 대통령이 트럼프 2기 행정부…,15시간 전,https://www.donga.com/news/Politics/article/all/20250306/131152344/2,동아일보
"한경협 국회로 부른 이재명, 상법 개정 사실상 못박아",https://dimg.donga.com/a/296/167/95/2/wps/NEWS/IMAGE/2025/03/06/131152865.1.jpg,더불어민주당 이재명 대표가 5일 한국경제인협회(한경협) 회장단과 만났지만 상법 개정안과 주 52시간 예외 규정을 제외한 반도체특별법 추진에 대한 입장 차만 재확인했다. 상법 개정안과 52시간 예외 미적용에 대한 재계의 우려에 이 대표는 “시장에 대한 불신 해소가 먼저”라는 기존 입장을…,15시간 전,https://www.donga.com/news/Politics/article/all/20250306/131152697/2,동아일보
野 “원희룡 우크라 재건 출장때 삼부토건 끼어 주가 급등”,https://dimg.donga.com/a/296/167/95/2/wps/NEWS/IMAGE/2025/03/06/131152860.1.jpg,더불어민주당은 5일 금융감독원이 주가조작 의혹을 조사하고 있는 삼부토건에 대해 “삼부토건은 주가가 뛸 수밖에 없는 시그널을 원희룡 당시 국토교통부 장관을 비롯한 정부가 준 것”이라고 주장했다. 민주당 한준호 최고위원은 5일 오전 국회에서 열린 최고위원회의에서 “정부에서 추진했던 우크라…,15시간 전,https://www.donga.com/news/Politics/article/all/20250306/131152698/2,동아일보
"이재명 “내 체포동의안 가결, 黨 일부가 檢과 짠것” 비명계 “앞에서 웃고 뒤에서 칼 꽂는 격” 반발",https://dimg.donga.com/a/296/167/95/2/wps/NEWS/IMAGE/2025/03/06/131152856.1.jpg,더불어민주당 이재명 대표가 2023년 9월 자신의 체포동의안에 찬성 표결을 했던 비명(비이재명)계 의원들을 향해 “검찰과 당내 일부가 짜고 한 짓”이라면서 “책임을 물어야 한다”고 주장했다. 이를 두고 비명계에서는 “지난 총선 때 ‘비명횡사’로도 모자라 부관참시하는 것이냐”는 반발이 …,15시간 전,https://www.donga.com/news/Politics/article/all/20250306/131152696/2,동아일보
"“의원체포 닦달” 진술, 명단 적힌 방첩사 메모… 헌재 판단 근거될듯",https://dimg.donga.com/a/296/167/95/2/wps/NEWS/IMAGE/2025/03/06/131152848.1.jpg,윤석열 대통령 탄핵심판을 심리 중인 헌법재판소가 5일에도 평의를 열고 선고에 속도를 내고 있다. 헌재가 중점적으로 살펴보는 쟁점 중 하나는 ‘정치인 등 주요 인사 체포 지시’ 의혹이다. 윤 대통령이 여야 정치인 등을 체포하라고 지시한 사실이 입증될 경우 비상계엄 때도 국회의 활동을 방…,15시간 전,https://www.donga.com/news/Politics/article/all/20250306/131152448/2,동아일보
한덕수 탄핵심판 이번주 선고 어려울듯… 자료 추가 검토,https://dimg.donga.com/a/296/167/95/2/wps/NEWS/IMAGE/2025/03/06/131152840.1.jpg,헌법재판소가 한덕수 국무총리 탄핵심판과 관련해 12·3 비상계엄 전 국무회의에 참석한 국무위원들의 수사 기록을 받아달라는 국회 측 요청을 수용했다. 검찰이 자료를 송부하고 수사 기록 검토 등에 걸리는 시간을 감안하면 이번 주 선고는 어려워졌다는 전망이 나온다. 5일 법조계에 따르면 4…,15시간 전,https://www.donga.com/news/Politics/article/all/20250306/131152441/2,동아일보
"‘체포조 운영-국회 봉쇄’ 혐의… 檢, 군경 간부 9명 잇단 기소",https://dimg.donga.com/a/296/167/95/2/wps/NEWS/IMAGE/2025/03/06/131152833.1.jpg,12·3 비상계엄 선포 사태를 수사 중인 검찰 특별수사본부(본부장 박세현 서울고검장)는 정치인 등 체포조 의혹과 관련해 계엄군 수뇌부는 물론이고 군경 간부 9명을 잇달아 기소하며 수사를 진행하고 있다. 지난달 28일 검찰은 국회 봉쇄와 체포조 운영 등에 가담한 혐의(내란중요임무종사 등…,15시간 전,https://www.donga.com/news/Politics/article/all/20250306/131152440/2,동아일보
"노태악 선관위장 “자녀 특혜 채용 통렬한 반성, 외부통제 적극 검토”",https://dimg.donga.com/a/296/167/95/2/wps/NEWS/IMAGE/2025/03/05/131152777.1.jpg,노태악 중앙선거관리위원장이 5일 선관위 고위직 간부의 특혜 채용 문제에 대해 “선관위원장으로서 통렬한 반성과 함께 머리 숙여 사과드린다”고 밝혔다. 노 위원장은 이날 대국민 사과문을 내고 “고위직 간부들의 자녀 특혜 채용 문제로 국민 여러분에게 큰 실망과 걱정을 끼쳐 드렸다”고 말했다…,15시간 전,https://www.donga.com/news/Politics/article/all/20250305/131152421/2,동아일보
"장제원, ‘여비서 성폭력 의혹’ 알려진지 하루만에 탈당",https://dimg.donga.com/a/296/167/95/2/wps/NEWS/IMAGE/2025/03/05/131152747.1.jpg,"성폭력 혐의로 피소된 국민의힘 장제원 전 의원이 5일 “당을 잠시 떠나겠다”며 “반드시 누명을 벗고 돌아오겠다”고 밝혔다. 장 전 의원은 성폭력 의혹이 불거진 지 하루 만에 당에 탈당계를 냈다. 국민의힘에 따르면 장 전 의원의 탈당계는 이날 부산시당에 제출됐고, 이르면 6일 국민의힘 …",15시간 전,https://www.donga.com/news/Politics/article/all/20250305/131152695/2,동아일보
"한경협 국회로 부른 이재명, 상법 개정 사실상 못박아",https://dimg.donga.com/a/296/167/95/2/wps/NEWS/IMAGE/2025/03/05/131152631.1.jpg,더불어민주당 이재명 대표가 5일 한국경제인협회(한경협)와 만났지만 상법 개정안과 주 52시간 예외 규정을 제외한 반도체특별법 추진에 대한 입장 차만 재확인했다. 상법 개정안과 52시간 예외 적용에 대한 재계의 우려에 이 대표는 “시장에 대한 불신 해소가 먼저”라는 기존 입장을 밝히며 …,20시간 전,https://www.donga.com/news/Politics/article/all/20250305/131151637/1,동아일보
"이재명, 대통령 집무실 ‘세종 이전’ 가능성 검토 지시",https://dimg.donga.com/a/296/167/95/2/wps/NEWS/IMAGE/2025/03/05/131151473.2.jpg,더불어민주당 이재명 대표가 최근 지도부 회의에서 대통령실의 세종 이전 가능성에 대해 검토하라고 지시한 것으로 전해졌다.5일 복수의 민주당 지도부 의원에 따르면 이 대표는 지난달 28일 확대간부회의 비공개회의에서 “대통령실의 세종 이전 가능성과 함께 관련 논란들에 대해 검토하고 정리해달…,20시간 전,https://www.donga.com/news/Politics/article/all/20250305/131152531/1,동아일보
"한덕수 탄핵 결정 미뤄지나… 헌재, ‘국무회의 수사자료’ 검토요청 수용",https://dimg.donga.com/a/296/167/95/2/wps/NEWS/IMAGE/2025/03/05/131151843.1.jpg,헌법재판소가 한덕수 국무총리 탄핵심판과 관련해 12·3 비상계엄 전 국무회의에 참석한 국무위원들의 수사기록을 받아달라는 국회 측 요청을 수용했다. 검찰이 자료를 송부하고 수사기록 검토 등에 걸리는 시간을 감안하면 이번 주 선고는 어려워졌다는 전망이 나온다.5일 법조계에 따르면 4일 국…,23시간 전,https://www.donga.com/news/Politics/article/all/20250305/131150656/1,동아일보
"선관위, 특혜채용 고위직 자녀 10명 ‘직무배제’",https://dimg.donga.com/a/296/167/95/2/wps/NEWS/IMAGE/2025/03/05/131150651.1.jpg,중앙선거관리위원회는 고위직 자녀로 채용 과정에서 특혜를 받은 직원 9명에 대해 직무배제 조치를 했다고 5일 발표했다.해당 직원들은 3월 6일 자로 즉각 직무배제 될 예정이다.중앙선관위는 이날 오후 알림을 통해 “자녀 직원들은 감사원의 징계 대상자에 포함되지 않았고 징계에 대한 법적 근…,1일 전,https://www.donga.com/news/Society/article/all/20250305/131150650/1,동아일보
“코로나와 싸운 선배 보고 꿈 키워”…간호사관생도 84명 임관,https://dimg.donga.com/a/296/167/95/2/wps/NEWS/IMAGE/2025/03/05/131150357.3.jpg,“국군간호사관학교 60기 선배님들의 코로나19 대구 파견을 보고 간호장교의 꿈을 꾸게 되었습니다. 군을 넘어 해외 및 민간 분야에서도 두각을 나타내고 위기와 재난 상황에서 내가 받은 모든 것을 국가에 환원할 수 있는 간호장교가 되고 싶습니다.”5일 오후 대전 국군간호사관학교 졸업·임관…,1일 전,https://www.donga.com/news/Politics/article/all/20250305/131150350/2,동아일보
"민주, 상속세법도 패스트트랙 추진…與 “선택적 실용주의” 비판",https://dimg.donga.com/a/296/167/95/2/wps/NEWS/IMAGE/2025/03/05/131146465.1.jpg,더불어민주당이 상속세 일괄공제와 배우자 상속공제 금액을 총 18억 원까지 상향하는 내용의 상속세 및 증여세법 개정안을 패스트트랙(신속처리안건)으로 추진한다. 국민의힘이 요구하고 있는 상속세 최고세율 인하 요구를 받아들일 수 없다는 뜻을 분명히 한 것이다.5일 민주당에 따르면 당 정책위…,1일 전,https://www.donga.com/news/Politics/article/all/20250305/131149152/1,동아일보
이재명 “檢과 짜고 체포동의안 가결” vs 비명계 “비명횡사에 부관참시”,https://dimg.donga.com/a/296/167/95/2/wps/NEWS/IMAGE/2025/03/04/131138782.1.jpg,더불어민주당 이재명 대표가 2023년 9월 자신의 체포동의안에 찬성 표결했던 비명(비이재명)계 의원들을 향해 “다 맞춰보니까 검찰이 당내 일부하고 짜고한 짓”이라면서 “책임을 물어야 한다”고 주장했다. 이를 두고 비명계에서는 “지난 총선 때 ‘비명횡사’로도 모자라 부관참시하는 것이냐”…,1일 전,https://www.donga.com/news/Politics/article/all/20250305/131149257/1,동아일보
"명노현 LS 부회장, “LS GPT로 혁신 주도…스타 플레이어 배출” 주문",https://dimg.donga.com/a/296/167/95/2/wps/NEWS/IMAGE/2025/03/06/131158652.1.jpg,LS그룹은 명노현 ㈜LS 대표이사 부회장(사진)이 최근 경기 안성시 LS미래원에서 ‘LS 팀장 콘퍼런스 2025’를 개최하고 인공지능(AI)을 활용한 사업 경쟁력 강화와 팀 내 스타플레이어 배출을 주문했다고 6일 밝혔다. 이 자리에서 명 부회장은 “이처럼 판이 흔들릴 때일수록 새로운 …,34분 전,https://www.donga.com/news/Economy/article/all/20250306/131156247/1,동아일보
"동원그룹, 美 애너하임 국제식품박람회 참가… ‘양반김·비비드키친’ 투톱전략 내세워",https://dimg.donga.com/a/296/167/95/2/wps/NEWS/IMAGE/2025/03/06/131158924.2.jpg,"동원그룹은 6일 미국 캘리포니아주 애너하임에서 4~7일까지 진행될 ‘2025 국제 자연식품박람회(Natural Products Expo West)’에 참가해 K-푸드의 새로운 가능성을 선보인다고 밝혔다. 동원F&B와 동원홈푸드는 각각 김, 음료, 떡볶이, 김치, 저칼로리 소스 등을 앞…",35분 전,https://www.donga.com/news/Economy/article/all/20250306/131158968/1,동아일보
“‘티메프’ 악몽 재연될까 겁나”… 홈플러스 협력사 잇단 이탈,https://dimg.donga.com/a/296/167/95/2/wps/NEWS/IMAGE/2025/03/06/131157902.2.jpg,"홈플러스가 기업회생절차(법정관리)에 들어가면서 주요 식음료업체가 신규 납품을 중단하는 등 조치에 나섰다. 대금을 제때 정산 받지 못할 수도 있다는 우려감 때문이다.6일 유통업계에 따르면 삼양식품, 오뚜기, 롯데칠성음료, 롯데웰푸드, 팔도 등 일부 업체가 홈플러스에 납품을 일시 중단했다…",1시간 전,https://www.donga.com/news/Economy/article/all/20250306/131157903/1,동아일보
홈플러스 모바일 상품권 환불된다…나이스정보통신 약관 명시,https://dimg.donga.com/a/296/167/95/2/wps/NEWS/IMAGE/2025/03/06/131157871.1.jpg,"기업회생절차에 들어간 홈플러스 상품권에 대해 소비자들의 환불 요청이 빗발치고 있는 가운데, 모바일 상품권의 경우 나이스정보통신을 통해 일정 금액을 환불받을 수 있는 것으로 확인됐다.6일 홈플러스 모바일 상품권 발행처인 나이스정보통신의 전자금융거래 이용약관에 따르면 선불전자지급수단은 수…",1시간 전,https://www.donga.com/news/Economy/article/all/20250306/131157870/1,동아일보
김연섭 롯데에너지머티리얼즈 대표 “LFP·고체전해질 개발로 종합 배터리 소재 회사 발판 마련”,https://dimg.donga.com/a/296/167/95/2/wps/NEWS/IMAGE/2025/03/06/131157710.1.jpg,"김연섭 롯데에너지머티리얼즈 대표가 리튬인산철배터리(LFP) 양극재, 고체전해질 등을 개발해 종합 배터리 소재 회사로 거듭나겠다고 밝혔다. 김 대표는 5일 서울 강남구 코엑스에서 열린 ‘인터배터리 2025’ 현장에서 동아일보 기자와 만나 “최근 3세대 LFP 양극재 개발을 완료해 파일럿…",1시간 전,https://www.donga.com/news/Economy/article/all/20250306/131157673/1,동아일보
"피엠인터내셔널코리아, 모범납세 기업으로 선정… 인천공항본부세관장 표창",https://dimg.donga.com/a/296/167/95/2/wps/NEWS/IMAGE/2025/03/06/131157695.2.jpg,"피엠인터내셔널코리아(이하 PMIK, 대표 오상준)는 6일 인천공항본부세관 주최 ‘제59회 납세자의 날’ 행사에서 모범납세 기업으로 선정돼 인천공항본부세관장 표창을 받았다고 밝혔다.이번 표창은 납세 의무를 성실히 이행하며 국가 재정에 기여한 공로를 인정받은 결과다. PMIK는 독일 건강…",1시간 전,https://www.donga.com/news/Economy/article/all/20250306/131157703/1,동아일보
"[이호 기자의 마켓ON]하나금융지주, 신종자본증권 수요예측서 목표액 2배 넘는 자금 확보",,하나금융지주가 신종자본증권 수요예측에서 목표액의 2배가 넘는 자금을 확보했다.5일 투자은행(IB) 업계에 따르면 하나금융지주은 5년 콜옵션(조기상환권)을 조건으로 2700억 원 모집에 6990억 원의 매수 주문을 받았다. 하나금융지주는 3.3~4.0%의 금리를 제시해 3.88%에 목표…,1시간 전,https://www.donga.com/news/Economy/article/all/20250306/131156941/1,동아일보
"[이호 기자의 마켓ON]현대종합특수강, 회사채 수요예측서 목표액 2배 넘는 자금 확보",,"현대종합특수강이 회사채 수요예측에서 목표액의 2배가 넘는 자금을 확보했다.6일 투자은행(IB) 업계에 따르면 현대종합특수강은 총 400억 원 모집에 1100억 원의 매수 주문을 받았다. 2년물 200억 원 모집에 660억 원, 3년물 200억 원 모집에 440억 원의 자금이 몰렸다.현…",1시간 전,https://www.donga.com/news/Economy/article/all/20250306/131156926/1,동아일보
"[이호 기자의 마켓ON]하나증권, 회사채 수요예측서 ‘1조1000억 원’ 넘는 자금 확보",,"하나증권이 회사채 수요예측에서 1조1000억 원이 넘는 자금을 받았다.6일 투자은행(IB) 업계에 따르면 하나증권은 총 2000억 원 모집에 1조1300억 원의 매수 주문을 받았다. 2년물 800억 원 모집에 5050억 원, 3년물 1200억 원 모집에 6250억 원의 자금이 몰렸다.…",1시간 전,https://www.donga.com/news/Economy/article/all/20250306/131156955/1,동아일보
"[이호 기자의 마켓ON]파주에너지서비스, 회사채 수요예측서 목표액 4배 넘는 자금 확보",,"파주에너지서비스가 회사채 수요예측에서 목표액의 4배가 넘는 자금을 확보했다.6일 투자은행(IB) 업계에 따르면 파주에너지서비스는 총 1500억 원 모집에 6900억 원의 매수 주문을 받았다. 3년물 1000억 원 모집에 5400억 원, 5년물 500억 원 모집에 1500억 원의 자금이…",1시간 전,https://www.donga.com/news/Economy/article/all/20250306/131156912/1,동아일보
"‘토허제’ 해제 뒤 강남 집값 급등… 송파, 7년만에 상승폭 최대",https://dimg.donga.com/a/296/167/95/2/wps/NEWS/IMAGE/2025/03/06/131157533.1.jpg,서울 송파구 아파트값이 7년 1개월 만에 가장 큰 폭으로 올랐다. 지난달 서울시가 토지거래허가구역을 해제한 이후 ‘강남 3구(강남 서초 송파)’로 매수세가 몰리면서 가격이 급등하고 있다. 6일 한국부동산원이 발표한 주간동향에 따르면 3월 첫째 주(3일 기준) 서울 아파트값은 전주보다 …,1시간 전,https://www.donga.com/news/Economy/article/all/20250306/131156487/1,동아일보
MWC가 주목한 미래 스타트업은 어디?…올해 화두는 ‘AI’,https://dimg.donga.com/a/296/167/95/2/wps/NEWS/IMAGE/2025/03/06/131155109.1.jpg,3일부터 나흘간 스페인 바르셀로나에서 열린 세계 최대 정보통신기술(ICT) 박람회 ‘모바일월드콩그레스 2025(MWC25)’에서는 아이디어와 기술력으로 무장한 스타트업 기업들이 주목을 받았다. MWC의 자매행사이자 세계 최대 규모의 스타트업을 소개하는 프로그램인 ‘4YFN’의 올해 …,1시간 전,https://www.donga.com/news/Economy/article/all/20250306/131155237/1,동아일보
‘사람 중심 AI’ 비전 발표…LG유플러스 홍범식 사장 “구글과 함께 AI 비서 해외 진출”,https://dimg.donga.com/a/296/167/95/2/wps/NEWS/IMAGE/2025/03/06/131155227.1.jpg,LG유플러스가 인공지능(AI) 에이전트(비서) 서비스 ‘익시오’의 기능을 고도화해 글로벌 진출에 도전한다. 빅테크 구글과 긴밀한 협력을 통해서 2028년까지 3억 달러(약 4400억 원)의 매출을 달성한다는 목표다. 홍범식 LG유플러스 사장(사진)은 4일(현지 시간) ‘모바일월드콩그레…,2시간 전,https://www.donga.com/news/Economy/article/all/20250306/131154969/1,동아일보
"휠라, 헤일리 비버와 협업… 요즘 뜨는 ‘패션 아이콘’이 해석한 스포츠 감성",https://dimg.donga.com/a/296/167/95/2/wps/NEWS/IMAGE/2025/03/06/131157189.2.jpg,"휠라(FILA)는 6일 스타일 아이콘으로 불리는 헤일리 비버(Hailey Bieber)와 협업해 ‘휠라 x 헤일리 비버 SS 2025’ 컬렉션을 선보인다고 밝혔다.이번 2025 봄·여름 컬렉션은 휠라의 스포츠 감성과 헤일리 비버의 현대적 감각을 결합, 실용성과 세련미를 동시에 갖춘 의…",2시간 전,https://www.donga.com/news/Economy/article/all/20250306/131157202/1,동아일보
‘농지법 위반’에 입 연 백종원…“법령 인지 못해…재발방지 노력할 것”,https://dimg.donga.com/a/296/167/95/2/wps/NEWS/IMAGE/2025/03/06/131157125.1.jpg,최근 농지법 위반 및 산지관리법 위반 등의 논란으로 구설에 오른 더본코리아(475560) 측이 공식 해명문을 발표했다. 회사 측이 이번 논란에 대해 공시적으로 입장을 내놓은 것은 이번이 처음이다.6일 더본코리아는 ‘백석공장 및 학교법인 예덕학원 관련 보도 관련 입장문’을 통해 일부 보…,2시간 전,https://www.donga.com/news/Economy/article/all/20250306/131157124/1,동아일보
"레겐보겐, 세계 3대 미용성형학회 ‘IMCAS Paris 2025’ 참가",https://dimg.donga.com/a/296/167/95/2/wps/NEWS/IMAGE/2025/03/06/131157141.2.png,화장품 및 의료기기 제조·유통 기업인 레겐보겐이 프랑스 파리에서 열린 세계적인 미용·성형 학회 ‘IMCAS Paris 2025’에 참가해 주요 제품을 소개하며 글로벌 의료진과 교류를 이어갔다. IMCAS는 전 세계 미용·성형 및 피부과 전문가들이 모여 최신 기술과 트렌드를 공유하는 학…,2시간 전,https://www.donga.com/news/Economy/article/all/20250306/131157209/1,동아일보
CJ-현대자동차 제쳤다…대학생이 가장 일하고 싶어하는 기업은,https://dimg.donga.com/a/296/167/95/2/wps/NEWS/IMAGE/2025/03/06/131157113.3.jpg,우리나라 대학생들이 가장 일하고 싶은 대기업 그룹사는 삼성이라는 조사 결과가 나왔다. HR테크 기업 ‘인크루트’는 지난달 10일부터 지난 3일까지 전국 대학생 1144명을 대상으로 ‘대학생이 가장 일하고 싶은 그룹사’를 설문 조사한 결과를 밝혔다.그 결과 상위 20개 그룹사 중 응답자…,2시간 전,https://www.donga.com/news/Society/article/all/20250306/131157094/2,동아일보
"루이비통, 뷰티 시장 진출한다…올 가을 ‘라 보떼 루이비통’ 론칭",https://dimg.donga.com/a/296/167/95/2/wps/NEWS/IMAGE/2025/03/06/131157056.1.jpg,프랑스 명품 브랜드 루이비통이 뷰티 시장에 진출한다. 루이비통은 올해 가을 시즌에 뷰티 컬렉션 ‘라 보떼 루이비통(La Beauté Louis Vuitton)’을 론칭하고 화장품 시장에 진출한다고 6일 밝혔다.이번 컬렉션의 크리에이티브 디렉터는 유명 메이크업 아티스트인 데임 팻 맥그라…,2시간 전,https://www.donga.com/news/Economy/article/all/20250306/131156721/1,동아일보
"정부, 아시아나 품은 대한항공 10년간 운임·좌석 등 감독한다",https://dimg.donga.com/a/296/167/95/2/wps/NEWS/IMAGE/2025/03/06/131157045.1.jpg,정부가 대한항공과 아시아나항공의 기업결합 이후 항공운임과 공급좌석에 대한 시정조치를 이행하는지 향후 10년간 감독한다.공정거래위원회와 국토교통부는 6일 정부서울청사에서 대한항공의 시정조치 이행을 점검하기 위한 이행감독위원회 발족식을 개최했다.대한항공 측은 공정위·국토부와 협의를 거쳐 …,2시간 전,https://www.donga.com/news/Economy/article/all/20250306/131157044/1,동아일보
