title,thumbnail,short_content,write_time,link,company
‘사퇴촉구 vs 망신주기’…성비위 논란 조국혁신당 원주지역도 내홍,https://dimg.donga.com/a/296/167/95/2/wps/NEWS/IMAGE/2025/11/03/132695220.1.jpg,"조국혁신당 내 성비위 논란 여파 속에서 당의 강원 원주지역위원회도 내홍을 겪고 있다.위원회 평당원모임 관계자들이 위원장의 당내문제와 관련한 부적절 발언에 따른 사퇴를 공개적으로 촉구하자, 해당 위원장은 ‘이미 사의 표명한 상태인데도 일부 모임 관계자들이 더 망신을 주려는 것 아니냐’는…",24분 전,https://www.donga.com/news/Politics/article/all/20251103/132695219/1,동아일보
李 ‘정부자산 매각 전면 중단’ 지시…尹정부식 ‘헐값 매각’ 차단한다,https://dimg.donga.com/a/296/167/95/2/wps/NEWS/IMAGE/2025/11/03/132694648.2.jpg,"이재명 대통령이 3일 정부 자산매각을 전면 중단하라고 지시했다. 이날 최휘영 정부대변인 겸 문화체육관광부 장관은 보도자료를 통해 “이 대통령은 정부의 자산매각을 전면 중단할 것을 지시하고, 현재 진행·검토 중인 자산매각에 대해 전면 재검토 후 시행여부를 재결정하도록 각 부처에 지시했다…",49분 전,https://www.donga.com/news/Politics/article/all/20251103/132694645/2,동아일보
"헤그세스 美국방, 방한 첫 일정으로 JSA 찾아 안규백과 악수",https://dimg.donga.com/a/296/167/95/2/wps/NEWS/IMAGE/2025/11/03/132694643.3.jpg,안규백 국방부 장관과 피트 헤그세스 미국 국방부 장관이 3일 판문점 공동경비구역(JSA)에서 만났다. 한미 국방장관의 JSA 동반 방문은 2017년 10월 송영무 당시 장관과 제임스 매티스 당시 장관의 방문 이후 8년 만이다. 안 장관과 헤그세스 장관은 이날 오후 경기도 파주시 JSA…,55분 전,https://www.donga.com/news/Politics/article/all/20251103/132694638/2,동아일보
"각각 전투기 탄 한미 합참의장, 공중서 함께 편대비행 지휘",https://dimg.donga.com/a/296/167/95/2/wps/NEWS/IMAGE/2025/11/03/132694452.2.jpg,한미 합참의장이 3일 한국군과 미국군의 전투기에 탑승해 공중에서 연합 편대비행을 함께 지휘했다. 이는 한미동맹 역사에서 처음이다. 진영승 합동참모본부 의장은 “앞으로도 한미가 함께 긴밀한 협력을 통해 한미동맹 현안에 대해 미래지향적으로 발전시켜 나갈 것”이라고 했다.합참에 따르면 진 …,59분 전,https://www.donga.com/news/Politics/article/all/20251103/132694444/2,동아일보
"곽종근 “尹, 한동훈 잡아오면 총으로 쏴서라도 죽이겠다고 했다”",https://dimg.donga.com/a/296/167/95/2/wps/NEWS/IMAGE/2025/11/03/132694437.1.jpg,곽종근 전 육군특수전사령관이 윤석열 전 대통령 내란 우두머리 혐의 재판에서 “(윤 전 대통령이) 국민의힘 한동훈 대표를 잡아오라. 총으로 쏴서라도 죽이겠다고 말했다”고 증언했다. 3일 서울중앙지법 형사합의25부(부장판사 지귀연) 심리로 진행된 재판에 증인으로 출석한 곽 전 사령관은 윤…,1시간 전,https://www.donga.com/news/Society/article/all/20251103/132692470/1,동아일보
"송언석 “추경호 영장 청구한 특검, 처음부터 답정너였다”",https://dimg.donga.com/a/296/167/95/2/wps/NEWS/IMAGE/2025/11/03/132694283.3.jpg,국민의힘 송언석 원내대표는 3일 같은 당 추경호 의원에 대해 내란 특검팀(특별검사 조은석)이 구속영장을 청구한 데 대해 “처음부터 특검은 ‘답정너’(답은 정해졌으니 너는 답만 하면 된다)식이었다”고 비판했다.송 원내대표는 이날 경북 안동 산불 피해지역을 찾은 자리에서 기자들과 만나 “…,1시간 전,https://www.donga.com/news/Politics/article/all/20251103/132694280/2,동아일보
"내란특검, 추경호 구속영장 청구…계엄해제 표결 방해 혐의",https://dimg.donga.com/a/296/167/95/2/wps/NEWS/IMAGE/2025/11/03/132693834.1.jpg,내란 특검(특별검사 조은석)이 ‘계엄 해제 표결 방해 의혹’을 받는 국민의힘 추경호 의원에 대해 내란중요임무종사 혐의로 구속영장을 청구했다. 특검 관계자는 3일 “구속 중대성과 증거인멸 우려 가능성 등을 고려했다”고 영장 청구 이유를 설명했다. 비상계엄 선포 당일 국민의힘 원내대표였던…,1시간 전,https://www.donga.com/news/Society/article/all/20251103/132692436/1,동아일보
"“시진핑에 ‘통신보안 되나’ 농담한 李, 아슬아슬했다”[정치를 부탁해]",https://dimg.donga.com/a/296/167/95/2/wps/NEWS/IMAGE/2025/11/03/132693773.1.jpg,"동아일보 정치 라이브 ＜정치를 부탁해＞- 일시: 월·수요일 오전 10~11시- 토크: 정광재 동연정치연구소장, 김준일 시사평론가- 진행·연출: 권오혁 김선우- 동아일보 유튜브 : www.youtube.com/@donga-ilbo아시아태평양경제협력체(APEC) 정상회의와 관련한 이재명 …",1시간 전,https://www.donga.com/news/Politics/article/all/20251103/132691653/1,동아일보
이준석 “李대통령 APEC 외교 긍정적…국정안정법은 윤석열식 논리”,https://dimg.donga.com/a/296/167/95/2/wps/NEWS/IMAGE/2025/11/03/132693085.2.jpg,이준석 개혁신당 대표가 이재명 대통령의 APEC 외교 행보를 “실용 외교로의 변화”라며 긍정 평가했다. 다만 한미 통상협상엔 “우리에게 유리하지 않다”고 지적했다.,2시간 전,https://www.donga.com/news/Politics/article/all/20251103/132693084/2,동아일보
"내란특검, 추경호 국힘 前원내대표 구속영장 청구",https://dimg.donga.com/a/296/167/95/2/wps/NEWS/IMAGE/2025/11/03/132693365.1.jpg,12·3 비상계엄 관련 내란·외환 의혹을 수사 중인 조은석 특별검사팀이 3일 추경호 전 국민의힘 원내대표에 대한 구속영장을 신청했다.박지영 내란 특검보는 이날 서울 서초구 서울고검에서 브리핑을 열고 “오후 4시경 추 전 원내대표에 대해 내란중요임무종사 혐의로 구속영장을 청구했다”며 “…,2시간 전,https://www.donga.com/news/Politics/article/all/20251103/132693356/1,동아일보
"이해찬 “北 적대적 입장 인정하지만, 통일 포기해선 안돼”",https://dimg.donga.com/a/296/167/95/2/wps/NEWS/IMAGE/2025/11/03/132693017.1.jpg,이해찬 신임 민주평화통일자문회의(민주평통) 수석부의장이 3일 북한의 ‘적대적 두 국가론’에 대해 “북한의 입장을 인정하면서도 통일정책이 바뀌어선 안 된다”고 밝혔다.이 수석부의장은 이날 서울 중구 민주평통 사무처에서 열린 취임식 직후 기자간담회에서 “정동영 통일부 장관의 ’평화적 두 …,3시간 전,https://www.donga.com/news/Politics/article/all/20251103/132692950/1,동아일보
"특검, 내일 ‘양평 공흥지구 의혹’ 김건희 모친·오빠 소환",https://dimg.donga.com/a/296/167/95/2/wps/NEWS/IMAGE/2025/11/03/132692916.1.jpg,특검이 양평 공흥지구 개발 특혜 의혹과 관련해 김건희 여사의 모친과 오빠를 같은날 불러 조사한다.3일 법조계에 따르면 김건희 특검팀(특별검사 민중기)은 오는 4일 특정범죄가중처벌 등에 관한 법률 위반(국고손실) 등 혐의를 받는 김 여사의 모친 최은순씨와 오빠 김진우씨에 관한 피의자 조…,3시간 전,https://www.donga.com/news/Society/article/all/20251103/132692915/1,동아일보
‘李대통령 무죄’ 주장 법제처장…법제처 “탄핵 대상 아니다”,https://dimg.donga.com/a/296/167/95/2/wps/NEWS/IMAGE/2025/11/03/132692682.2.jpg,법제처가 법제처장에 대해 “탄핵 대상이 아니다”라는 입장을 냈다. 국민의힘은 국정감사에서 “이재명 대통령은 무죄”라고 말한 조원철 법제처장에 대한 탄핵소추안 발의를 추진하고 있다.3일 정부 등에 따르면 법제처는 최근 ‘법제처장이 탄핵소추 대상 공무원에 해당하느냐’는 국민의힘 신동욱 국…,3시간 전,https://www.donga.com/news/Politics/article/all/20251103/132692622/2,동아일보
"장동혁, 與 재판중지법 철회에 “민주당 발표 누가 믿겠냐”",https://dimg.donga.com/a/296/167/95/2/wps/NEWS/IMAGE/2025/11/03/132692783.1.jpg,장동혁 국민의힘 대표는 3일 더불어민주당의 ‘재판중지법’ 추진 철회와 관련해 “여야 협의를 손바닥 뒤집듯 뒤집는 게 민주당인데 그런 민주당의 발표를 누가 믿을 수 있겠냐”고 반문했다. 장 대표는 이날 오후 경북도청에서 열린 ‘대구-경북 지역민생 예산정책협의회’ 후 기자들 만나 “대통령…,3시간 전,https://www.donga.com/news/Politics/article/all/20251103/132692782/1,동아일보
다카이치 日총리 “김정은과 정상회담 희망…北에 뜻 전하고 있어”,https://dimg.donga.com/a/296/167/95/2/wps/NEWS/IMAGE/2025/11/03/132692792.1.jpg,다카이치 사나에(高市早苗) 일본 총리가 북한 측에 김정은 북한 국무위원장과 정상회담을 희망한다는 뜻을 전달했다고 3일 밝혔다. 북일 정상회담은 2004년이 마지막이었다.다카이치 총리는 이날 납북자 귀국을 촉구하는 자리에 참석해 “북한 측에 김 위원장과 정상회담을 하고 싶다는 뜻을 전달…,3시간 전,https://www.donga.com/news/Inter/article/all/20251103/132692776/1,동아일보
"대통령실 “재판중지법, 사법개혁서 제외해달라 與에 요청”",https://dimg.donga.com/a/296/167/95/2/wps/NEWS/IMAGE/2025/11/03/132693195.1.jpg,대통령실이 현직 대통령의 형사재판을 중단하도록 하는 ‘재판중지법’(형사소송법 개정안)에 대해 3일 “헌법상 재판중지 입법이 필요하지 않다”며 “대통령을 정쟁의 중심에 끌어넣지 않아 주시길 당부드린다”고 밝혔다. 앞서 더불어민주당이 이재명 대통령 재판과 관련해 ‘국정안정법’이란 이름으로…,3시간 전,https://www.donga.com/news/Politics/article/all/20251103/132692640/1,동아일보
경사노위 위원장에 김지형 前대법관,https://dimg.donga.com/a/296/167/95/2/wps/NEWS/IMAGE/2025/11/03/132692615.1.jpg,"이재명 대통령은 3일 대통령 소속 경제사회노동위원회(경사노위) 위원장에 법무법인 지평의 고문변호사인 김지형 전 대법관을 임명했다고 대통령실 강유정 대변인이 밝혔다.강 대변인은 이날 서울 용산 대통령실에서 브리핑을 통해 “김 전 대법관은 법원 내 손꼽히는 노동법 권위자로, 사회적 약자를…",3시간 전,https://www.donga.com/news/Politics/article/all/20251103/132692582/1,동아일보
김건희특검 “‘인사청탁 귀금속 수수 의혹’ 尹부부 이달내 소환 통보”,https://dimg.donga.com/a/296/167/95/2/wps/NEWS/IMAGE/2025/11/03/132692506.1.jpg,김건희 여사의 각종 의혹을 받는 민중기 특별검사팀이 매관매직 의혹과 관련해 윤석열 전 대통령 부부를 조만간 소환 통보할 계획이다.김형근 특별검사보는 3일 오후 정례 브리핑을 열고 “인사 청탁 명목 귀금속 등 수수 의혹과 관련해 김 여사에 대해 조만간 소환 일자를 이번 달 내로 정해 통…,3시간 전,https://www.donga.com/news/Society/article/all/20251103/132692505/1,동아일보
"조국, 엔비디아 GPU 26만장 공급에 “나경원 떠올라”…이유는?",https://dimg.donga.com/a/296/167/95/2/wps/NEWS/IMAGE/2025/11/03/132692447.2.jpg,조국혁신당 조국 비상대책위원장은 세계 최대 인공지능(AI) 반도체 기업 엔비디아가 한국에 최신 고성능 그래픽처리장치(GPU) 26만 장을 공급하기로 한 것을 두고 국민의힘 나경원 의원이 떠올랐다고 2일 밝혔다. 조 위원장과 나 의원은 서울대 법대 82학번 동기다. 조 위원장은 이날 자…,3시간 전,https://www.donga.com/news/Politics/article/all/20251103/132692446/2,동아일보
한미 합참의장 “전작권 전환에 의미있는 진전”,https://dimg.donga.com/a/296/167/95/2/wps/NEWS/IMAGE/2025/11/03/132692111.3.jpg,한미 합동참모본부의장이 3일 만나 전시작전통제권(전작권) 전환 조건 충족과 관련해 의미 있는 진전이 있다고 평가했다.합참은 이날 진영승 합참의장과 존 대니얼 케인 미국 합참의장이 서울 용산구 합참본부에서 제50차 한미 군사위원회 회의(MCM)를 진행했다며 이같이 밝혔다. 케인 의장의 …,4시간 전,https://www.donga.com/news/Politics/article/all/20251103/132692091/2,동아일보
"조국 “李, 시진핑에 선물 황남빵에 ‘황제 皇’ 들어가…영리한 선택”",https://dimg.donga.com/a/296/167/95/2/wps/NEWS/IMAGE/2025/11/03/132692100.2.jpg,이재명 대통령이 한중 정상회담을 앞두고 시진핑(習近平) 중국 국가주석에게 경주 황남빵을 선물한 것을 두고 조국혁신당 조국 비상대책위원장이 “영리한 선택”이라고 했다. 조 위원장은 2일 자신의 페이스북에 “이 대통령이 (도널드) 트럼프 (미국) 대통령에게 신라 금빛 왕관을 선물한 것에 …,4시간 전,https://www.donga.com/news/Politics/article/all/20251103/132692099/2,동아일보
"법제처 “법제처장, 탄핵대상 아냐…관련 법률 없어”",https://dimg.donga.com/a/296/167/95/2/wps/NEWS/IMAGE/2025/11/03/132691574.1.jpg,법제처는 3일 국민의힘이 조원철 법제처장에 대한 탄핵소추안 발의를 추진하는 것과 관련해 수장인 “탄핵 대상이 아니다”라고 해석한 것으로 확인됐다. 법제처는 법령에 대해 유권해석을 담당하는 기구다.정부 등에 따르면 법제처는 최근 ‘법제처장이 탄핵소추 대상 공무원에 해당하냐’는 신동욱 국…,5시간 전,https://www.donga.com/news/Politics/article/all/20251103/132691573/1,동아일보
"국힘 윤리위 “김종혁, 징계 없이 ‘주의’ 조치…조병길 사상구청장은 ‘제명’”",https://dimg.donga.com/a/296/167/95/2/wps/NEWS/IMAGE/2025/11/03/132691544.1.jpg,국민의힘 윤리위원회는 3일 친한(친한동훈)계인 김종혁 전 최고위원을 징계하지 않기로 했다. 다만 사전 정보 취득을 통한 재개발 주택 매입 의혹을 받고 있는 조병길 부산 사상구청장에 대해서는 중징계에 해당하는 제명 조치를 내렸다.당 윤리위는 이날 오전 서울 여의도 중앙당사에서 회의를 열…,5시간 전,https://www.donga.com/news/Politics/article/all/20251103/132691543/1,동아일보
"국힘 “내년 지방선거용 현금살포 예산, 한 푼도 허락 안할것”",https://dimg.donga.com/a/296/167/95/2/wps/NEWS/IMAGE/2025/11/03/132691412.3.jpg,"국민의힘은 3일 “이번 예산 심사에서 ‘돈 뿌리기’, ‘표 사기’, ‘포퓰리즘’ 예산을 단 한 푼도 허락하지 않겠다”며 “내년 ‘지방선거용 현금 살포 예산’은 단 한 푼도 허락하지 않겠다”고 강조했다.박성훈 수석대변인은 이날 논평을 내고 “이재명 정부의 728조 원 ‘빚잔치 예산’에 …",6시간 전,https://www.donga.com/news/Politics/article/all/20251103/132691422/2,동아일보
"與 “대장동 ‘이재명 연루설’ 거짓 드러나…檢, 공소 철회하라”",https://dimg.donga.com/a/296/167/95/2/wps/NEWS/IMAGE/2025/11/03/132690973.3.jpg,더불어민주당은 대장동 의혹 관련 재판 1심 선고에 대해 “정치 검찰의 조작 기소가 사법부에 의해 명백하게 드러났다”며 검찰을 향해 이재명 대통령에 대한 공소를 취소하라고 요구했다.3일 김병기 민주당 원내대표는 이날 국회에서 열린 최고위원회의에서 “법원이 분명히 말했다 ‘이재명 시장은 …,7시간 전,https://www.donga.com/news/Politics/article/all/20251103/132690990/2,동아일보
내란특검 4일 조태용 前국정원장 소환…3차 피의자 조사,https://dimg.donga.com/a/296/167/95/2/wps/NEWS/IMAGE/2025/11/03/132691287.1.jpg,"국정원법상 직무 유기 혐의 등을 받는 조태용 전 국가정보원장이 오는 4일 내란 특검팀(특별검사 조은석)의 3차 조사를 받는다.3일 법조계에 따르면 내란 특검팀은 4일 조 전 원장을 소환해 피의자 조사를 할 방침이다. 조 전 원장은 지난달 15일, 17일에도 특검팀의 조사를 받았다.조 …",7시간 전,https://www.donga.com/news/Society/article/all/20251103/132690957/1,동아일보
정청래 “APEC 역대급 성과…국힘 딴지 그만 걸고 ‘애국’ 동참하라”,https://dimg.donga.com/a/296/167/95/2/wps/NEWS/IMAGE/2025/11/03/132690909.3.jpg,더불어민주당 정청래 대표는 3일 “경주 아시아태평양경제협력체(APEC) 정상회의가 역대급 성과를 내며 막을 내렸다”고 평가하며 “당 차원에서 가칭 ‘APEC 및 관세협상 성과 후속 지원을 위한 특별위원회’를 설치하는 등 APEC 성과가 국민께 알려질 수 있도록 최대한 노력하겠다”고 밝…,7시간 전,https://www.donga.com/news/Politics/article/all/20251103/132690901/2,동아일보
이해찬 민주평통 수석부의장 공식 취임…“국민 공감대 형성 이끌겠다”,https://dimg.donga.com/a/296/167/95/2/wps/NEWS/IMAGE/2025/11/03/132690831.1.jpg,"이해찬 민주평화통일자문회의(민주평통) 수석부의장이 3일 공식 취임했다. 이 수석부의장은 사회적 대화를 통한 국민 공감대 형성의 중요성을 강조했다. 이 수석부의장은 이날 민주평통 대회의실에서 열린 취임식에서 “포용과 통합은 평화, 공존과 번영의 한반도의 출발점”이라며 “더 나은 미래로 …",7시간 전,https://www.donga.com/news/Politics/article/all/20251103/132690830/1,동아일보
李대통령 지지율 3주 만에 상승 53%…‘관세협상·코스피 4천’ 영향[리얼미터],https://dimg.donga.com/a/296/167/95/2/wps/NEWS/IMAGE/2025/11/03/132690725.1.jpg,"이재명 대통령 국정수행 지지율이 한미 관세협상 타결과 코스피 4000선 돌파 등을 동력으로 3주 만에 소폭 반등했다는 여론조사 결과가 3일 나왔다.여론조사 기관 리얼미터가 에너지경제신문 의뢰로 지난달 27~31일 전국 18세 이상 2517명을 대상으로 실시한 조사에 따르면, 이 대통령…",7시간 전,https://www.donga.com/news/Politics/article/all/20251103/132690724/1,동아일보
국힘 “소비쿠폰 같은 대규모 포퓰리즘 예산 반드시 삭감”,https://dimg.donga.com/a/296/167/95/2/wps/NEWS/IMAGE/2025/11/03/132690540.1.jpg,"국민의힘은 3일 “소비쿠폰같이 경제적 효과는 입증 안 됐음에도 오로지 정치적 이익을 극대화하기 위한, 미래세대에 부담으로 전가될 수 있는 대규모 포퓰리즘 예산은 반드시 삭감하겠다”고 했다. 박성훈 국민의힘 수석대변인은 이날 오전 국회에서 최고위원회의 종료 후 기자들과 만나 이같이 말하…",8시간 전,https://www.donga.com/news/Politics/article/all/20251103/132690539/1,동아일보
"검찰, ‘김정숙 여사 옷값 의혹’ 경찰에 재수사 요청",https://dimg.donga.com/a/296/167/95/2/wps/NEWS/IMAGE/2025/11/03/132690490.1.jpg,"검찰이 문재인 전 대통령의 배우자 김정숙 여사의 옷을 사는 데 청와대 특수활동비(특활비)가 사용됐다는 의혹을 다시 들여다봐야 한다며 경찰에 재수사를 요청했다.3일 법조계에 따르면 서울중앙지검 형사2부(부장검사 신재홍)는 서울경찰청에 강요, 업무상 횡령 등 혐의를 받는 김 여사 사건에 …",8시간 전,https://www.donga.com/news/Politics/article/all/20251103/132690489/1,동아일보
조국 “레드팀 직설위 구성…쓴소리 거침없이 경청”,https://dimg.donga.com/a/296/167/95/2/wps/NEWS/IMAGE/2025/11/03/132690440.2.jpg,조국혁신당 조국 비상대책위원장이 ‘레드팀 직설 위원회’를 구성해 “당심과 민심의 쓴소리와 회초리를 거침없이 경청하겠다”며 “다양한 계층으로 구성된 직설 위원회의 날카로운 직설을 거치며 검증받을 것”이라고 했다.조 비대위원장은 3일 오전 서울 여의도 국회에서 열린 ‘비상대책위원회 뉴파티…,8시간 전,https://www.donga.com/news/Politics/article/all/20251103/132690425/2,동아일보
"정청래 “APEC은 A급, 역대급 성과…대미투자 특별법 신속 처리”",https://dimg.donga.com/a/296/167/95/2/wps/NEWS/IMAGE/2025/11/03/132690356.1.jpg,정청래 더불어민주당 대표는 3일 “민주당은 정부와 함께 대미 투자 관련 특별법을 준비하고 신속히 처리하겠다”고 말했다.정 대표는 이날 오전 국회에서 열린 최고위원회의에서 이같이 말하며 “당 차원에서는 가칭 ‘APEC 및 관세협상 성과 후속 지원을 위한 특별위원회’를 설치하는 등 APE…,8시간 전,https://www.donga.com/news/Politics/article/all/20251103/132690355/1,동아일보
"이준석 “국정안정법은 李재판중지법, 독재를 유신이라 포장한 것과 같아”",https://dimg.donga.com/a/296/167/95/2/wps/NEWS/IMAGE/2025/11/03/132690329.1.jpg,이준석 개혁신당 대표는 3일 “더불어민주당이 추진 중인 이른바 국정안정법은 본질적으로 재판 중지법”이라고 했다.이 대표는 이날 오전 국회에서 열린 최고위회의에서 이같이 말하며 “법안의 이름으로 프레임 전쟁을 벌이는 것은 과거 독재 정권의 방식”이라고 했다.그는 “박정희 대통령이 독재를…,8시간 전,https://www.donga.com/news/Politics/article/all/20251103/132690328/1,동아일보
"李대통령, 내일 내년도 예산안 시정연설",https://dimg.donga.com/a/296/167/95/2/wps/NEWS/IMAGE/2025/11/03/132689665.2.jpg,이재명 대통령이 4일 내년도 예산안에 대한 국회 시정연설에 나선다.3일 대통령실에 따르면 이 대통령은 4일 2026년도 예산안과 관련한 시정연설을 위해 국회를 찾는다. 이 대통령은 이 자리에서 728조 원 규모인 내년도 예산안의 방향을 설명하고 여야에 원활한 예산안 처리 협조를 당부할…,8시간 전,https://www.donga.com/news/Politics/article/all/20251103/132690301/1,동아일보
"조국 “李대통령, 시진핑에 황남빵 선물…영리한 선택”",https://dimg.donga.com/a/296/167/95/2/wps/NEWS/IMAGE/2025/11/03/132690021.1.jpg,조국 조국혁신당 비상대책위원장은 아시아태평양경제협력체(APEC) 정상회의를 기념해 지난달 31일 이재명 대통령이 중국 시진핑 국가주석에게 황남빵을 선물한 것에 대해 “영리한 선택”이라고 칭찬했다.지난 2일 조 위원장은 자신의 페이스북을 통해 “이재명 대통령이 트럼프 대통령에게 신라 금…,8시간 전,https://www.donga.com/news/Politics/article/all/20251103/132690020/1,동아일보
장동혁 “李재판 오늘 다시 시작돼야…재개땐 대통령 아닌 그냥 이재명 될 것”,https://dimg.donga.com/a/296/167/95/2/wps/NEWS/IMAGE/2025/11/03/132689738.3.jpg,장동혁 국민의힘 대표는 3일 “이재명에 대한 재판은 오늘 다시 시작되어야 한다”며 재판 재개를 촉구했다.장 대표는 3일 국회에서 열린 국민의힘 최고위원회의에서 “이 대통령은 12개 혐의로 기소돼서 5개의 재판을 받고 있다“며 ”그중 공직선거법 사건은 이미 대법원에서 유죄가 인정됐다“고…,9시간 전,https://www.donga.com/news/Politics/article/all/20251103/132689766/2,동아일보
"송언석 “李 재판중지법, 유죄 스스로 자백…민주당의 자기 부정”",https://dimg.donga.com/a/296/167/95/2/wps/NEWS/IMAGE/2025/11/03/132689736.1.jpg,"송언석 국민의힘 원내대표는 3일 더불어민주당에서 추진하는 이재명 대통령 재판중지법에 대해 “이재명 대통령이 유죄임을 누구보다 잘 알고, 유죄임을 스스로 자백한 것으로 밖에 볼 수 없다”고 비판했다.송 원내대표는 이날 오전 당 최고위원회의에서 “이재명 대통령 유죄자백법은 더불어민주당의 …",9시간 전,https://www.donga.com/news/Politics/article/all/20251103/132689735/1,동아일보
李대통령 “APEC 일정 마무리…대한민국 위상 높일 수 있도록 전력”,https://dimg.donga.com/a/296/167/95/2/wps/NEWS/IMAGE/2025/11/03/132689666.2.jpg,이재명 대통령이 “모든 아시아태평양경제협력체(APEC) 정상회의 일정을 마무리했다”며 “앞으로도 국민 여러분의 기대에 부응하며 대한민국의 위상을 높일 수 있도록 전력을 다하겠다”고 했다.이 대통령은 경주 APEC 정상회의 폐막 다음 날인 2일 밤 페이스북에 쓴 글에서 “무엇보다 이번 …,9시간 전,https://www.donga.com/news/Politics/article/all/20251103/132689633/2,동아일보
