title,thumbnail,short_content,write_time,link,company
"검찰, 한덕수 탄핵심판 ‘국무위원 조서 요청’ 거부…헌재 선고 고심",https://dimg.donga.com/a/296/167/95/2/wps/NEWS/IMAGE/2025/03/06/131159028.1.jpg,검찰이 한덕수 국무총리 탄핵심판 사건 관련 국무위원 등의 진술조서 등을 요구한 국회 측 대리인단의 요청을 거부한 것으로 파악됐다. 이에 따라 헌법재판소가 한 총리 탄핵심판 선고를 할지 여부를 놓고 고심할 것으로 보인다.6일 법조계에 따르면 검찰은 한 총리 탄핵심판 사건 관련 전날 국회…,24분 전,https://www.donga.com/news/Society/article/all/20250306/131159027/1,동아일보
"윤희숙 “배우자 상속세 폐지, 시대 못따라가는 제도 바꾸자는 것”",https://dimg.donga.com/a/296/167/95/2/wps/NEWS/IMAGE/2025/03/06/131158876.1.jpg,"국민의힘 권영세 비상대책위원장이 6일 “배우자 상속세를 전면 폐지하겠다”고 밝혔다. “함께 재산을 일군 배우자 간 상속은 세대 간 부의 이전이 아니다”라며 “미국, 영국, 프랑스 등 대부분의 선진국은 배우자 상속에 과세하지 않는다”고도 덧붙였다. 당 지도부가 ‘배우자 상속세 폐지’ 카…",33분 전,https://www.donga.com/news/Politics/article/all/20250306/131158622/1,동아일보
미사일이 거꾸로 날고 튕긴 총알이 차에 박혀…오폭·오발 처음 아니다,https://dimg.donga.com/a/296/167/95/2/wps/NEWS/IMAGE/2025/03/06/131159048.1.jpg,"한미 연합훈련 도중 우리 공군 전투기의 폭탄이 민가로 잘못 떨어져 다수의 민간인 부상자가 발생하는 초유의 사고가 발생했다. 공군의 오폭 사고는 매우 이례적이지만, 우리 군에서 오폭 및 오발 사고가 발생해 민간의 피해가 발생한 것은 처음이 아니다.6일 공군과 소방당국 등에 따르면 이날 …",57분 전,https://www.donga.com/news/Politics/article/all/20250306/131158434/1,동아일보
인권위 ‘헌재 비판서한’ 논란에…野 “인권위원 탄핵법” 발의,https://dimg.donga.com/a/296/167/95/2/wps/NEWS/IMAGE/2025/03/06/131158290.1.jpg,"안창호 국가인권위원장이 세계국가인권기구연합(GANHRI)에 헌법재판소를 비판하는 내용의 서한을 보내 논란이 되는 가운데, 더불어민주당이 인권위원 탄핵을 가능하게 하는 법안을 6일 발의했다.민주당 박지원 의원은 이날 국가인권위원장과 상임위원, 비상임위원 등 인권위원 11명에 대한 국회 …",1시간 전,https://www.donga.com/news/Politics/article/all/20250306/131158056/1,동아일보
‘규제철폐’ 내건 이준석 “금융 규제 더 화끈하게 풀어야”,https://dimg.donga.com/a/296/167/95/2/wps/NEWS/IMAGE/2025/03/06/131157989.1.jpg,개혁신당 이준석 의원이 6일 “금융 관련 규제는 더 화끈하게 풀어야 된다”라고 밝혔다. 이 의원은 규제철폐를 내걸고 대선 행보를 이어가고 있다.이 의원은 이날 서울 강남구 갤럭시아머니트리 본사를 찾아 간담회를 가진 후 기자들과 만나 “투자자 보호나 이런 측면에서 충분한 장치가 마련됐다…,1시간 전,https://www.donga.com/news/Politics/article/all/20250306/131157321/1,동아일보
[단독]‘장제원 성폭력 의혹’ 당일 호텔바엔 張측근까지 3명 자리…참고인 수사중,https://dimg.donga.com/a/296/167/95/2/wps/NEWS/IMAGE/2025/03/06/131156396.1.jpg,경찰이 성폭력 혐의로 피소된 국민의힘 장제원 전 의원에 대해 지난주 출석을 통보한 것으로 6일 전해졌다. 장 의원을 고소한 여성은 ‘그렇게 가면 내 맘은 어떡해’ 등 장 의원이 과거에 보낸 문자 메시지를 캡처해 9년여 간 보관하고 있었던 것으로 알려졌다. 경찰은 사건 직전 술자리에 동…,1시간 전,https://www.donga.com/news/Society/article/all/20250306/131155037/1,동아일보
우 의장 “개헌 1·2차 나눠 해도 돼…충분히 해볼 시간 있어”,https://dimg.donga.com/a/296/167/95/2/wps/NEWS/IMAGE/2025/03/06/131157956.1.jpg,우원식 국회의장은 6일 여야 정치권에서 급물살을 타고 있는 개헌 논의에 대해 “급한 것은 먼저 하고 좀 더 논의할 건 나중에 해도 된다. 1·2차 개헌을 나눠서 해도 된다”며 개헌의 필요성에 공감했다.우 의장은 이날 SBS ‘편상욱의 뉴스브리핑’에 출연해 “개헌 논의를 시작한다면 충분…,1시간 전,https://www.donga.com/news/Politics/article/all/20250306/131157955/1,동아일보
부산 찾은 이재명 “북극항로 시급”…박형준 “부산 시민 냉대”,https://dimg.donga.com/a/296/167/95/2/wps/NEWS/IMAGE/2025/03/06/131156910.1.jpg,더불어민주당 이재명 대표가 6일 부산항만공사에서 박형준 부산시장과 만나 “북극항로 개척은 시급하고 중요한 문제”라고 했다. 이에 대해 박 시장은 “(북극항로보다) 글로벌허브도시 특별법과 산업은행 이전이 시급하다”며 “민주당은 국가균형발전에 대한 관심이 많이 떨어진 것 같다”고 직격했다…,2시간 전,https://www.donga.com/news/Politics/article/all/20250306/131156075/1,동아일보
"“건진법사, 2018년 공천 청탁 대가로 법당서 1억 받아”",https://dimg.donga.com/a/296/167/95/2/wps/NEWS/IMAGE/2025/03/06/131157219.1.jpg,"검찰이 ‘건진법사’로 알려진 전성배 씨(65)가 2018년 경북 영천시장 선거 과정에서 1억 원의 불법 정치자금을 받은 것으로 파악했다.6일 박은정 조국혁신당 의원실이 법무부로부터 제출받은 공소장에 따르면, 전 씨는 2018년 1월 12일 서울 강남구의 한 법당에서 당시 영천시장 경선…",2시간 전,https://www.donga.com/news/Society/article/all/20250306/131156571/1,동아일보
"권성동 “개헌, 대통령 됐다고 착각하는 이재명 압박해야 가능”",https://dimg.donga.com/a/296/167/95/2/wps/NEWS/IMAGE/2025/03/06/131157052.1.jpg,권성동 국민의힘 원내대표는 6일 개헌 필요성을 촉구하며 “지금 대통령이 다 됐다고 착각하는 이재명 더불어민주당 대표를 여론으로 압박해야만 성사가 될 것”이라고 말했다.권 원내대표는 이날 오후 국회도서관에서 열린 ‘분권형 권력구조 개헌 대토론회’에서 “현행 87년 헌법 체제에 문제가 많…,2시간 전,https://www.donga.com/news/Politics/article/all/20250306/131157051/1,동아일보
"‘불법 정치자금 혐의’ 1심 징역형 송영길, 항소심 재판부에 보석 신청",https://dimg.donga.com/a/296/167/95/2/wps/NEWS/IMAGE/2025/03/06/131156828.1.jpg,더불어민주당 전당대회 돈봉투 살포 의혹과 불법 정치자금 수수 의혹 등으로 1심에서 실형을 선고받고 법정 구속된 송영길 소나무당 대표가 항소심 재판부에 보석을 신청했다.6일 법원에 따르면 특정범죄 가중처벌 등에 관한 법률 위반(뇌물) 등 혐의로 기소된 송 대표는 전날 항소심 재판부인 서…,2시간 전,https://www.donga.com/news/Society/article/all/20250306/131156827/1,동아일보
"與 “내년 의대정원, 증원前 원상복귀… 정부 적극 검토를”",https://dimg.donga.com/a/296/167/95/2/wps/NEWS/IMAGE/2025/03/06/131156712.1.jpg,"국민의힘이 내년도 의대 정원을 증원 이전인 2024학년도 수준(3058명)으로 조정하는 방안을 적극 검토해야 한다고 밝혔다. 의대를 둔 40개 대학 총장 모임인 ‘의과대학 선진화를 위한 총장협의회’(의총협)이 이에 합의한 데다, 의대 교육정상화가 시급하다는 판단에서다. 국민의힘 권성동…",2시간 전,https://www.donga.com/news/Politics/article/all/20250306/131156513/1,동아일보
‘비대면 마약’ 대응 ‘온라인 수사팀’ 신설…보이스피싱도 특별 단속,https://dimg.donga.com/a/296/167/95/2/wps/NEWS/IMAGE/2025/03/06/131156586.1.jpg,정부가 최근 증가하고 있는 비대면 마약거래에 관한 대응 강화를 위해 경찰청 내 ‘온라인 수사팀’을 신설한다.또 보이스피싱 범죄를 막기 위해 자금세탁조직 집중수사 체계를 구축하고 불법사금융 범죄 근절을 위해 저신용층 제도권 금융 공급을 확대할 계획이다.최상목 대통령 권한대행 부총리 겸 …,3시간 전,https://www.donga.com/news/Politics/article/all/20250306/131156585/1,동아일보
"“선관위 ‘아빠 찬스’ 박찬진 前사무총장 딸, 비리 논란 이후에도 승진”",https://dimg.donga.com/a/296/167/95/2/wps/NEWS/IMAGE/2025/03/06/131156488.1.jpg,"특혜 채용으로 중앙선거관리위원회(선관위)에 입사한 의혹을 받는 직원이 채용 비리 논란이 불거진 이후에도 승진했던 것으로 6일 파악됐다.이날 국회 행정안전위원회 소속 국민의힘 조은희 의원실이 선관위로부터 제출받은 자료에 따르면, 고위직 자녀로 특혜 채용으로 입사한 직원이 특혜 채용 의혹…",3시간 전,https://www.donga.com/news/Politics/article/all/20250306/131155586/1,동아일보
"軍 “전투기 포천 민가 오폭, 조종사 좌표입력 실수 때문”",https://dimg.donga.com/a/296/167/95/2/wps/NEWS/IMAGE/2025/03/06/131156947.1.jpg,경기 포천시에 전투기 오폭으로 포탄 8발이 떨어져 여러 사람이 다친 ‘날벼락’ 같은 사고의 원인이 조종사의 좌표 입력 실수인 것으로 드러났다.공군 관계자는 6일 국방부 기자단과 만나 “사고 원인은 조종사의 좌표 입력 실수로 보고 있다”며 “1번기가 사격을 하면 2번기가 동시에 나란히 …,3시간 전,https://www.donga.com/news/Politics/article/all/20250306/131156568/1,동아일보
"[단독]“북한, 중국보다 北-中 관계 개선 적극적”",https://dimg.donga.com/a/296/167/95/2/wps/NEWS/IMAGE/2025/03/06/131156428.1.jpg,지난해 급속도로 경색됐던 북한과 중국 양국이 올해 들어 관계 개선을 위한 물밑 소통에 나선 가운데 북한이 중국보다 관계 개선에 적극적인 것으로 파악됐다. 북한의 이 같은 움직임은 향후 우크라이나 전쟁 종전에 따른 동북아시아 정세 변화를 준비하는 차원일 수 있다는 분석이 나온다.정보당국…,3시간 전,https://www.donga.com/news/Politics/article/all/20250306/131155533/1,동아일보
"[단독]이동옥 대통령민정비서관, 충북 부지사 내정",https://dimg.donga.com/a/296/167/95/2/wps/NEWS/IMAGE/2025/03/06/131155977.1.jpg,이동옥 대통령민정비서관이 충청북도 행정부지사에 내정된 것으로 6일 알려졌다. 복수의 여권 관계자에 따르면 이 비서관은 이르면 7일자로 충북 행정부지사로 인사발령이 날 예정이다. 정부 고위관계자는 “오래 전 내정돼 있던 인사로 알고 있다”고 전했다. 이 내정자는 충북 제천 출신으로 고려…,3시간 전,https://www.donga.com/news/Politics/article/all/20250306/131155742/1,동아일보
최신 해상헬기 MH-60R 첫 비행…北 함정 원거리서 탐지·공격,https://dimg.donga.com/a/296/167/95/2/wps/NEWS/IMAGE/2025/03/06/131155845.1.jpg,해군은 6일 북한 잠수함과 수상함을 원거리에서 탐지 및 공격할 수 있는 최신예 해상작전헬기 MH-60R(시호크·Sea Hawk)이 태극마크를 달고 국내 첫 비행을 시작했다고 밝혔다. 정부는 2020년 12월 미국 정부와 대외군사판매(FMS) 방식으로 MH-60R 12대를 도입하는 구매…,4시간 전,https://www.donga.com/news/Politics/article/all/20250306/131155844/1,동아일보
"北, 5년만에 재개한 외국인 ‘나선 관광’ 돌연 중단",https://dimg.donga.com/a/296/167/95/2/wps/NEWS/IMAGE/2025/03/06/131155762.2.jpg,"북한이 지난달 13일 외국인 관광객에게 국경을 개방한 지 불과 3주 만에 갑작스럽게 관광을 중단했다. 정확한 이유는 밝혀지지 않아 다양한 추측이 나오고 있다. 5일 북한 전문 여행사 ‘고려투어스’는 공식 홈페이지와 페이스북을 통해 “나선 관광이 일시적으로 중단됐다”며, “이런 일은 …",4시간 전,https://www.donga.com/news/Politics/article/all/20250306/131155761/2,동아일보
野 ‘완전국민경선’ 제안에 선그은 친명계 “실익 있겠나”,https://dimg.donga.com/a/296/167/95/2/wps/NEWS/IMAGE/2025/03/06/131155698.3.jpg,더불어민주당 친명계 의원들이 조국혁신당이 제안한 야권 단일 후보 선출을 위한 오픈프라이머리(완전국민경선) 방식에 대해 선 긋기에 나섰다. 친명계 장경태 의원은 6일 YTN 라디오 ‘뉴스파이팅 김영수입니다’에서 “당헌·당규 개정 사항이라고 본다. 당원의 의사를 묻고 당원들이 결정할 사안…,4시간 전,https://www.donga.com/news/Politics/article/all/20250306/131155715/2,동아일보
날벼락 맞은 포천…‘오폭’ Mk-82 폭탄은 시설·다리 대량 폭격용,https://dimg.donga.com/a/296/167/95/2/wps/NEWS/IMAGE/2025/03/06/131155673.1.jpg,"우리 공군의 전투기가 6일 실사격 훈련 중 민간인 지역에 Mk-82(마크 82) 폭탄 8발을 잘못 떨어뜨리는 사고가 발생했다. 이날 공군은 5개의 KF-16 전투기를 훈련에 참가시킨 것으로 파악된다. 각 전투기엔 4발의 Mk-82 공대지 폭탄이 장착된 것으로 알려졌는데, 이 중 8발의…",4시간 전,https://www.donga.com/news/Politics/article/all/20250306/131155672/1,동아일보
與 “배우자 상속세 전면 폐지…유산세는 유산취득세로 전환해야”,https://dimg.donga.com/a/296/167/95/2/wps/NEWS/IMAGE/2025/03/06/131153986.1.jpg,국민의힘이 6일 배우자 상속세 전면 폐지를 제안했다. 더불어민주당이 상속세 일괄공제액과 배우자 상속 공제 최저한도 금액을 높이는 상속세 및 증여세법 개정안을 패스트트랙(신속처리안건)으로 지정하려는 움직임을 보이자 맞불을 놓은 것으로 풀이된다. 국민의힘 권영세 비상대책위원장은 이날 국회…,4시간 전,https://www.donga.com/news/Politics/article/all/20250306/131155446/1,동아일보
김대웅 선관위원 후보 “부정투표 불가능…채용비리 신상필벌해야”,https://dimg.donga.com/a/296/167/95/2/wps/NEWS/IMAGE/2025/03/06/131155437.3.jpg,"김대웅 중앙선거관리위원회 위원 후보자가 윤석열 대통령 측이 제기한 ‘부정선거론’에 대해 “국민 개개인이 여러 생각을 할 수는 있겠지만, 객관적 근거가 없는 부분이 널리 퍼지거나 유포되는 것은 옳지 않다”고 밝혔다.김 후보자는 6일 국회 행정안전위원회에서 실시된 인사청문회에 출석해 ‘부…",4시간 전,https://www.donga.com/news/Politics/article/all/20250306/131155434/2,동아일보
부산 찾은 이재명 “북극항로 시급”…박형준 “지역현안 외면 실망”,https://dimg.donga.com/a/296/167/95/2/wps/NEWS/IMAGE/2025/03/06/131155417.2.jpg,"더불어민주당 이재명 대표는 6일 박형준 부산시장을 만나 “북극항로는 시급하고 중요한 문제”라고 밝혔다. 이 대표는 이날 오전 부산항만공사 신항사업소를 방문해 박 시장과의 면담, 북극항로 간담회를 진행해 “박형준 시장은 북극항로 문제가 시급하기보단 중요한 문제 가깝다고 하는데 저는 이게…",4시간 전,https://www.donga.com/news/Politics/article/all/20250306/131155416/2,동아일보
"‘러 파병’ 정보 확산 두려웠나…북한, 나선관광 돌연 중단 배경은",https://dimg.donga.com/a/296/167/95/2/wps/NEWS/IMAGE/2025/03/06/131155230.1.jpg,"북한이 5년여 만에 서방 단체 관광객을 대상으로 관광을 재개했다가 3주 만에 돌연 중단해 배경이 주목된다.고려투어스와 영파이오니어투어 등 북한 전문 여행사들은 5일 홈페이지 공지를 통해 북한측 파트너로부터 나선 관광이 일시적으로 중단됐다는 통보를 받았다고 알렸다.중단 이유나, 재개 시…",5시간 전,https://www.donga.com/news/Politics/article/all/20250306/131155229/1,동아일보
"정치 유튜버 후원금 모금, 탈루 여부 들여다본다",https://dimg.donga.com/a/296/167/95/2/wps/NEWS/IMAGE/2025/03/06/131155167.1.jpg,문재인 전 대통령 사저 앞에서 유튜버들이 방송하며 후원금을 모금한 행위와 관련해 국세청이 탈세 혐의가 있는지 모니터링한 것으로 나타났다. 6일 국회 기획재정위원회 소속 차규근 조국혁신당 의원 질의에 국세청이 답변한 자료에 따르면 국세청은 2022년 경남 양산 문 전 대통령 사저 앞 …,5시간 전,https://www.donga.com/news/Politics/article/all/20250306/131155133/1,동아일보
“尹탄핵 인용” 56% “기각” 37%…민주 35% 국힘 34%,https://dimg.donga.com/a/296/167/95/2/wps/NEWS/IMAGE/2025/03/06/131155003.2.jpg,"윤석열 대통령 탄핵 심판 선고가 임박한 가운데 헌법재판소가 탄핵안을 인용해 파면해야 한다는 의견이 56%, 탄핵안을 기각해 직무에 복귀시켜야 한다는 의견이 37%로 나타났다는 여론조사 결과가 6일 나왔다. 헌재가 탄핵안을 인용해 파면할 것이라는 예상은 62%, 탄핵을 기각해 직무에 복…",6시간 전,https://www.donga.com/news/Politics/article/all/20250306/131154975/2,동아일보
與 “선관위 현안질의 필요” 野 “경찰 알박기 인사도”…행안위서 설전,https://dimg.donga.com/a/296/167/95/2/wps/NEWS/IMAGE/2025/03/06/131154953.3.jpg,여야가 6일 국회 행정안전위원회에서 특혜 채용 문제가 불거진 중앙선거관리위원회와 보은 인사 논란이 인 경찰을 상대로 현안질의를 개최하는 것에 대해 충돌했다. 이후 노태악 선관위원장과 김용빈 사무총장에 대한 국회 출석 여부를 놓고도 여야가 설전을 벌이면서 결국 정회가 선포되기도 했다.국…,6시간 전,https://www.donga.com/news/Politics/article/all/20250306/131154950/2,동아일보
"이재명, K엔비디아 관련 ‘펀드’ 언급 하루만에…민주 “50조 규모 조성”",https://dimg.donga.com/a/296/167/95/2/wps/NEWS/IMAGE/2025/03/06/131154832.1.jpg,더불어민주당이 6일 첨단 전략산업의 글로벌 경쟁력 강화를 지원하는 50조 원 규모의 국민 참여형 국부펀드 조성을 추진하겠다고 밝혔다. 이재명 대표가 한국판 엔비디아(K엔비디아) 발언과 관련한 논쟁 과정에서 한국형 국부·국민펀드 조성 필요성을 주장한 지 하루만에 당 차원의 국부펀드 조성…,7시간 전,https://www.donga.com/news/Politics/article/all/20250306/131154661/1,동아일보
[단독]선관위 친인척 경력 채용 33건…당초 밝혔던 21건보다 늘어,https://dimg.donga.com/a/296/167/95/2/wps/NEWS/IMAGE/2025/03/06/131154690.1.jpg,"중앙선거관리위원회에 친인척 경력 채용으로 입사한 경우가 2023년 기준 33건인 것으로 파악됐다. 당초 선관위가 같은 해 행정안전위원회에서 밝혔던 21건보다 12건이나 늘어난 수치다. 조승환 국민의힘 의원실이 중앙선관위로부터 제출 받은 친인척채용 현황 자료에 따르면, 2023년 6월 …",7시간 전,https://www.donga.com/news/Society/article/all/20250306/131154390/1,동아일보
"육군50사단, 10~20일 ‘자유의 방패’ 연습…병력·장비이동",https://dimg.donga.com/a/296/167/95/2/wps/NEWS/IMAGE/2025/03/06/131154520.1.jpg,육군 제50보병사단은 대구와 경북 일대에서 올해 ‘자유의 방패(FS/TIGER)’ 연습을 실시한다고 6일 밝혔다.한·미연합과 민·관·군·경·소방의 통합방위태세 확립을 위한 이번 훈련은 10일부터 20일까지 진행된다. 장소는 ▲11일 안동댐 ▲13일 칠곡차량기지 ▲19일 대구공항 ▲2…,7시간 전,https://www.donga.com/news/Society/article/all/20250306/131154519/1,동아일보
상속세 이번엔 줄어드나…與野 ‘공제한도 확대’ 공감-‘최고세율 인하’ 이견,https://dimg.donga.com/a/296/167/95/2/wps/NEWS/IMAGE/2025/03/06/131154456.1.jpg,상속세 개편을 두고 정치권의 감세 경쟁이 치열해지고 있다. 헌법재판소의 윤석열 대통령 탄핵 선고를 앞두고 여야의 조기 대선을 염두에 둔 정책 전쟁이 본격화되고 있는 것이다. 6일 국민의힘은 배우자 상속세 전면 폐지와 유산취득세 방식 도입 방침을 밝혔다. 더불어민주당은 상속세 면제 기준…,7시간 전,https://www.donga.com/news/Politics/article/all/20250306/131153933/1,동아일보
"KF-16 전투기, 포천 민가 오폭 15명 부상…“폭탄 8발 비정상 투하”",https://dimg.donga.com/a/296/167/95/2/wps/NEWS/IMAGE/2025/03/06/131154760.1.jpg,공군 전투기가 실사격 훈련 중 경기 포천의 민가에 폭탄을 떨어뜨리는 사고가 발생했다. 이 사고로 7명이 부상을 입었다.6일 경기북부소방재난본부에 따르면 이날 오전 10시 5분경 경기 포천시 이동면 노곡리 민가에서 “포탄이 떨어졌다”는 신고가 접수됐다.현재까지 4명이 중상을 입는 등 총…,7시간 전,https://www.donga.com/news/Society/article/all/20250306/131154406/1,동아일보
"[단독]스티븐스 전 주한대사 “韓, 트럼프의 ‘우크라 협상’ 주목…北-美 협상시 한국에도 일어날 수 있어”",https://dimg.donga.com/a/296/167/95/2/wps/NEWS/IMAGE/2025/03/06/131154382.1.jpg,"도널드 트럼프 미국 대통령과 볼로디미르 젤렌스키 우크라이나 대통령 간 지난달 28일(현지 시간) 백악관 정상회담은 국제사회에 ‘충격과 공포’를 안겼다. 러시아의 침공으로 국토를 유린당한 약소국 우크라이나 정상을 앞에 두고 트럼프 대통령은 “당신은 (협상) 카드가 없다”, “(미국과 러…",7시간 전,https://www.donga.com/news/Politics/article/all/20250306/131153597/1,동아일보
"해병대, ‘1심 무죄’ 박정훈 대령 인사근무차장 임명",https://dimg.donga.com/a/296/167/95/2/wps/NEWS/IMAGE/2025/03/06/131154329.1.jpg,"해병대가 채상병 순직사건과 관련해 항명 혐의로 기소됐다 1심 무죄를 선고받은 박정훈 대령에게 새로운 보직을 부여하기로 했다. 해병대는 6일 국방부 기자단에 보낸 문자공지를 통해 “박정훈 대령을 군사경찰 분야의 전문지식, 경험 등을 고려해 3월 7일부로 해병대 인사근무차장으로 보직할 예…",7시간 전,https://www.donga.com/news/Politics/article/all/20250306/131154328/1,동아일보
민주 “김건희 상설특검·마약특검·상법 13일 본회의 상정”,https://dimg.donga.com/a/296/167/95/2/wps/NEWS/IMAGE/2025/03/06/131154276.1.jpg,"더불어민주당은 6일 “김건희 상설특검과 마약특검법, 상법 개정안을 13일 본회의에 상정하겠다”고 밝혔다.민주당 강유정 원내대변인은 이날 오전 서울 여의도 국회에서 열린 당 정책조정회의 후 기자들과 만나 “오는 13일과 20일, 27일에 본회의를 잡아뒀는데 가능한 법안은 13일에 대부분…",8시간 전,https://www.donga.com/news/Politics/article/all/20250306/131154267/1,동아일보
尹 대통령 탄핵심판 선고일 ‘갑호비상’ 가닥…총동원 검토,https://dimg.donga.com/a/296/167/95/2/wps/NEWS/IMAGE/2025/03/06/131154263.2.jpg,경찰이 윤석열 대통령 탄핵심판 선고일에 비상근무태세 중 가장 높은 등급인 ‘갑호비상’ 발령 정식 건의를 경찰청에 하기로 가닥을 잡았다. 6일 경찰에 따르면 서울경찰청은 전날 기동단장과 주요 일선 경찰서장등을 소집해 윤 대통령 탄핵심판 선고일 대비 비상 대응 방안 마련 회의를 열었다.경…,8시간 전,https://www.donga.com/news/Society/article/all/20250306/131154262/2,동아일보
野 “50조 첨단산업 국민펀드 조성…국민 투자에 세금혜택”,https://dimg.donga.com/a/296/167/95/2/wps/NEWS/IMAGE/2025/03/06/131154236.1.jpg,더불어민주당이 첨단산업 경쟁력 확보를 위한 대규모 국민 펀드 조성 계획을 밝혔다.진성준 더불어민주당 정책위의장은 6일 국회에서 열린 정책조정회의에서 “글로벌 기술 패권 전쟁에서 살아남기 위한 각국의 경쟁이 치열하다”며 “글로벌 경쟁력 강화를 위해 국민 펀드 조성 방안을 마련하겠다”고 …,8시간 전,https://www.donga.com/news/Politics/article/all/20250306/131154177/1,동아일보
이재명-권성동 ‘AI 공개토론’ 성사되나…민주 “일정 잡자”,https://dimg.donga.com/a/296/167/95/2/wps/NEWS/IMAGE/2025/03/06/131154123.1.jpg,더불어민주당은 6일 이재명 대표가 제안하고 권성동 국민의힘 원내대표가 수용 입장을 밝힌 인공지능(AI) 등 미래산업 현안 공개토론과 관련해 구체적 일정을 조율하자고 제안했다.진성준 민주당 정책위의장은 이날 오전 국회에서 열린 정책조정회의에서 “이재명 대표가 인공지능을 비롯한 정책 현황…,8시간 전,https://www.donga.com/news/Politics/article/all/20250306/131154122/1,동아일보
