title,thumbnail,short_content,write_time,link,company
"‘선정 방송’ BJ·사이버 렉카 탈세 정황… 국세청, 세무조사 착수",https://dimg.donga.com/a/296/167/95/2/wps/NEWS/IMAGE/2025/03/06/131156936.1.jpg,선정적 노출 방송이나 유명인 사생활 폭로로 막대한 후원금을 받아 돈을 벌고도 세금은 빼돌린 인터넷 방송 진행자(BJ)와 유튜버가 국세청 조사를 받게 됐다. 불법 도박 사이트로 번 돈을 세탁하기 위해 전용 애플리케이션(앱)까지 개발한 운영자도 조사 대상에 포함됐다.6일 국세청은 탈세 혐…,2시간 전,https://www.donga.com/news/Economy/article/all/20250306/131156347/1,동아일보
"‘부동산 6채’ 팝핀현준, 일산집 공개 “으리으리하네”",https://dimg.donga.com/a/296/167/95/2/wps/NEWS/IMAGE/2025/03/06/131158625.1.jpg,가수 겸 공연예술가인 팝핀현준이 재력을 뽐냈다.팝핀현준은 지난 5일 자신의 소셜미디어에 “오랜만이다 일산집 꽃피는 봄이 오면 파티 고고”라고 적고 사진을 올렸다.사진 속 팝핀현준은 경기도 일산의 전원주택 앞에서 포즈를 취했다. 정원 앞에 세워진 외제차도 시선을 끈다.팝핀현준은 지난해 …,40분 전,https://www.donga.com/news/Entertainment/article/all/20250306/131158624/1,동아일보
세븐틴 원우부터 강다니엘까지…1996년생 아이돌 군입대 러시,https://dimg.donga.com/a/296/167/95/2/wps/NEWS/IMAGE/2025/03/06/131158619.1.jpg,1996년생 K팝 스타들이 줄줄이 군입대를 앞두고 있다. 현행 병역법상 만 28세까지 입영을 연기할 수 있는 만큼 기한이 얼마 남지 않은 보이그룹 멤버들의 군백기가 본격화됐다.먼저 그룹 ‘세븐틴’의 원우가 입대 소식을 알렸다. 소속사 플레디스 엔터테인먼트는 지난 5일 공지를 통해 “원…,41분 전,https://www.donga.com/news/Entertainment/article/all/20250306/131158618/1,동아일보
"타블로 “‘본 헤이터’, 전 대표 디스한 것…인피니트 아냐”",https://dimg.donga.com/a/296/167/95/2/wps/NEWS/IMAGE/2025/03/06/131157122.1.jpg,그룹 ‘에픽하이’의 타블로가 히트곡 ‘본 헤이터’(BORN HATER) 가사에 담긴 뜻을 해명했다.에픽하이는 지난 5일 공식 유튜브 채널에 ‘에픽하이가 인피니트 디스한 이유 직접 물어봄 ft. 뜨개질’이라는 제목의 영상을 공개했다.영상에서 게스트로 출연한 ‘인피니트’의 김성규와 남우현…,2시간 전,https://www.donga.com/news/Entertainment/article/all/20250306/131157121/1,동아일보
"신지 “날짜 겹친 김종민·에일리 결혼식, 둘 다 갈 것”",https://dimg.donga.com/a/296/167/95/2/wps/NEWS/IMAGE/2025/03/06/131156864.1.jpg,그룹 ‘코요태’ 신지가 김종민(46)과 에일리(36·이예진)의 결혼식 날짜가 겹치는 것에 대해 입장을 밝혔다.신지는 6일 본인 소셜미디어에 “논란 종식. 둘 다 갈거야 결혼식”이라고 적었다.오는 4월20일 열리는 김종민과 에일리의 결혼식에 모두 참석할 것이라고 알렸다.함께 올린 사진…,2시간 전,https://www.donga.com/news/Culture/article/all/20250306/131156863/1,동아일보
이수지 ‘대치맘’ 패러디 반응에 “의도대로 흘러가지 않아 부담”,https://dimg.donga.com/a/296/167/95/2/wps/NEWS/IMAGE/2025/03/06/131154558.3.jpg,코미디언 이수지가 강남 지역 학부모 ‘대치맘’ 패러디한 콘텐츠가 열풍을 넘어 논란이 되자 “의도대로 흘러가지 않아 부담스럽다”고 밝혔다.이수지는 5일 방송된 KBS 쿨FM ‘오마이걸 효정의 볼륨을 높여요’에 출연해 자신의 유튜브 채널 ‘핫이슈지’에 대해 언급했다.이수지는 “100만 구…,3시간 전,https://www.donga.com/news/Culture/article/all/20250306/131156138/2,동아일보
"김두영, 韓 떠나 가족과 세부로 이민 갔다…“코미디언 은퇴 아닌 도전”",https://dimg.donga.com/a/296/167/95/2/wps/NEWS/IMAGE/2025/03/06/131155426.1.jpg,"코미디언 김두영이 필리핀 세부로 이민을 떠났다고 밝혔다.지난 5일 김두영은 자신의 인스타그램에 “이미 아시는 분도 계실 테고 모르시는 분들도 계실 테지만, 오늘(5일) 저녁에 저는 저희 가족들과 함께 대한민국을 떠나 타국에서의 이민생활을 시작하게 됐다”라는 글을 게시했다.이어 “전부터…",4시간 전,https://www.donga.com/news/Entertainment/article/all/20250306/131155425/1,동아일보
"강은비, 4월의 신부된다…“17년 함께 보낸 안식처 같은 사람”",https://dimg.donga.com/a/296/167/95/2/wps/NEWS/IMAGE/2025/03/06/131155412.1.jpg,"배우 강은비(38)가 4월의 신부가 된다.6일 강은비는 자신의 인스타그램에 오는 4월 5일 결혼식을 올린다고 알리는 글을 게시하며 “이제 하나가 아닌 둘로 열심히 살겠다”라고 전했다.강은비는 결혼을 하게 된 것에 대해 “제가 방황하던 시기에 2008년, 한 친구를 만나서 점점 긍정적으…",4시간 전,https://www.donga.com/news/Entertainment/article/all/20250306/131155411/1,동아일보
"11세 연하 예비신부 눈물 ‘글썽’…김종민, 무슨 말 했길래",https://dimg.donga.com/a/296/167/95/2/wps/NEWS/IMAGE/2025/03/06/131154668.1.jpg,"혼성 그룹 ‘코요태’ 김종민이 11세 연하 예비 신부로부터 ‘신랑 점수’ 만점을 받았다.김종민은 5일 방송된 채널A ‘요즘 남자 라이프-신랑수업’에서 예비 신부에게 전화를 걸어 ‘20년 지기’ 절친 하하를 소개했다. 하하가 “종민이는 첫눈에 히융(애칭)님한테 반했다는데, 히융님은 어떠…",7시간 전,https://www.donga.com/news/Entertainment/article/all/20250306/131154667/1,동아일보
"대치맘 논란 후…유퀴즈, 한가인편 VOD 삭제 왜?",https://dimg.donga.com/a/296/167/95/2/wps/NEWS/IMAGE/2025/03/06/131154620.1.jpg,"tvN ‘유 퀴즈 온 더 블럭’이 배우 한가인 편을 삭제했다.유퀴즈는 6일 “한가인 이슈 때문이 아니다”라며 “해당 회차에서 사용한 아시안게임 경기 화면 중 일부 자료 추가 협의가 필요한 상황이 발생했다. VOD를 잠시 비공개했는데, 문제 해결 후 다시 서비스할 예정”이라고 밝혔다.이…",7시간 전,https://www.donga.com/news/Entertainment/article/all/20250306/131154619/1,동아일보
황기순 “필리핀 가서 도박…노숙은 안 했다”,https://dimg.donga.com/a/296/167/95/2/wps/NEWS/IMAGE/2025/03/06/131154571.1.jpg,코미디언 황기순(62)이 과거 필리핀에 가서 도박을 한 이유를 밝혔다. 지난 4일 유튜브 채널 ‘클레먹타임’에는 ‘황기순 필리핀 노숙자 논란 진실은? 원정 도박 썰’이라는 제목의 영상이 올라왔다. 영상에서 배우 이동준은 황기순에게 “예전에 도대체 왜 필리핀에 가서 노름을 했냐”고 …,7시간 전,https://www.donga.com/news/Entertainment/article/all/20250306/131154570/1,동아일보
"이수지 “대치맘 반응 예상보다 커, 내 의도대로 안 돼…오해 아쉽다”",https://dimg.donga.com/a/296/167/95/2/wps/NEWS/IMAGE/2025/03/06/131154558.1.jpg,"‘대치맘’ 패러디로 화제를 모은 이수지가 비판적인 시각에 대해 입장을 밝혔다. 5일 방송된 KBS 쿨FM ‘오마이걸 효정의 볼륨을 높여요’에는 이수지가 게스트로 출연했다.한 청취자가 “수지 님이 연기할 때 가장 공들이는 캐릭터는 무엇인지, 캐릭터 탄생 비화와 또 다른 캐릭터도 만들 예…",7시간 전,https://www.donga.com/news/Entertainment/article/all/20250306/131154557/1,동아일보
"구준엽, 故 쉬시위안 떠나보낼 결심…덩리쥔 안장된 금보산서 영면",https://dimg.donga.com/a/296/167/95/2/wps/NEWS/IMAGE/2025/03/06/131154213.1.jpg,"클론 멤버 구준엽의 아내인 대만 배우 쉬시위안(서희원)의 묘역이 대만 진바오산(금보산)에 조성될 것으로 전해졌다.5일 대만 ET투데이 등 다수의 현지 매체에 따르면 본래 쉬시위안의 가족은 수목장을 고려했으나, 여러 가지 요인으로 인해 다시 매장지를 선택하기로 결정했다.이런 가운데, 구…",8시간 전,https://www.donga.com/news/Entertainment/article/all/20250306/131154105/1,동아일보
‘세상에 8점뿐’ 지드래곤 콜라보 시계…무려 16억원,https://dimg.donga.com/a/296/167/95/2/wps/NEWS/IMAGE/2025/03/06/131154079.1.jpg,가수 지드래곤이 글로벌 하이엔드 시계 브랜드 ‘제이콥앤코(JACOB&CO.)’와 협업해서 내놓은 16억원 호가의 한정판 시계가 국내에 상륙했다. 제이콥앤코는 5일 지드래곤과 협업한 한정판 시계 ‘아스트로노미아 지드래곤 워치(Astronomia G-DRAGON Watch)’를 공개했다.…,8시간 전,https://www.donga.com/news/Entertainment/article/all/20250306/131154078/1,동아일보
"‘4살 연하♥’ 서동주, 눈부신 웨딩드레스 자태",https://dimg.donga.com/a/296/167/95/2/wps/NEWS/IMAGE/2025/03/06/131154028.1.jpg,변호사 겸 방송인 서동주(42)가 근황을 밝혔다.서동주는 지난 5일 본인 소셜 미디어에 “웨딩 스튜디오 촬영용 드레스 피팅하고 왔어요”라고 적었다. “드레스가 다 예쁜데 어떻게 골라요?”라고 덧붙이며 사진 여러 장을 올렸다. 사진 속 서동주는 촬영용 웨딩드레스를 입고 물오른 미모를 뽐…,8시간 전,https://www.donga.com/news/Entertainment/article/all/20250306/131154027/1,동아일보
‘책받침 여신’ 왕조현 뜻밖의 근황…캐나다서 ‘뜸 치료’,https://dimg.donga.com/a/296/167/95/2/wps/NEWS/IMAGE/2025/03/06/131153772.1.jpg,"영화 ‘천녀유혼’(1987)으로 큰 인기를 얻었던 대만의 전설적인 여배우 왕조현(왕쭈셴·58)이 캐나다에서 중국식 전통 치료 센터를 운영한다고 밝혔다.5일(현지시각) 홍콩 사우스차이나모닝포스트(SCMP)에 따르면, 왕조현은 지난달 24일 자신의 소셜미디어(SNS)에 캐나다 밴쿠버에 중…",8시간 전,https://www.donga.com/news/Entertainment/article/all/20250306/131153771/1,동아일보
"화사, ‘12세 연상’ 사업가와 헤어졌나…“현재 싱글”",https://dimg.donga.com/a/296/167/95/2/wps/NEWS/IMAGE/2025/03/06/131153764.1.jpg,"12세 연상 사업가와 열애설에 입장을 내지 않았던 그룹 ‘마마무’ 멤버 겸 솔로가수 화사가 현재 솔로라고 고백했다.5일 유튜브 채널 ‘나래식’에서 코미디언 박나래가 “우리가 항상 이야기하지 않나. 커플 모임 (하자고)”이라고 말하자, 화사는 “그럴 날이 올까. 우리 셋 다 지금 싱글”…",8시간 전,https://www.donga.com/news/Entertainment/article/all/20250306/131153763/1,동아일보
"지수, 나탈리 포트먼과 나란히 사진…빛나는 외모",https://dimg.donga.com/a/296/167/95/2/wps/NEWS/IMAGE/2025/03/06/131153760.1.jpg,그룹 블랙핑크의 지수가 나탈리 포트먼과 나란히 사진을 찍었다.지수는 지난 5일 자신의 인스타그램에 디올쇼에서 찍은 사진을 공개했다.사진 속 지수는 흰 블라우스에 검은 미니스커트를 입고 화사한 비주얼을 뽐내고 있다.특히 지수는 디올쇼에서 나탈리 포트먼과 나란히 앉아 환한 미소를 보이고 …,8시간 전,https://www.donga.com/news/Entertainment/article/all/20250306/131153759/1,동아일보
"슬기, 오프숄더·쇼트팬츠로 완성한 섹시함…각선미 눈길",https://dimg.donga.com/a/296/167/95/2/wps/NEWS/IMAGE/2025/03/06/131153713.1.jpg,그룹 레드벨벳 멤버 슬기가 섹시미를 한껏 뽐냈다.6일 슬기는 자신의 인스타그램에 “이 착도 너무 예쁘다”라는 글과 함께 사진을 게시했다.사진 속 슬기는 한 액세서리 브랜드의 가방을 손에 들고 거리의 고풍스러운 문 앞에서 포즈를 취하고 있다. 하얀색 오프숄더 블라우스에 쇼트 팬츠와 검정…,9시간 전,https://www.donga.com/news/Entertainment/article/all/20250306/131153712/1,동아일보
"TXT, 7일 인천서 월드투어 첫걸음…특별 퍼포먼스 예고",https://dimg.donga.com/a/296/167/95/2/wps/NEWS/IMAGE/2025/03/06/131153701.1.jpg,투모로우바이투게더(TXT)가 확장된 월드 투어의 첫걸음을 인천에서 나선다.투모로우바이투게더는 오는 7~9일 인천 인스파이어 아레나에서 월드 투어 ‘투모로우바이투게더 월드 투어 〈액트: 프로미스〉 - EP. 2 - 인 인천’(TOMORROW X TOGETHER WORLD TOUR - E…,9시간 전,https://www.donga.com/news/Entertainment/article/all/20250306/131153700/1,동아일보
故장국영 22주기…‘열화청춘’·‘대삼원’ 리마스터링 31일 개봉,https://dimg.donga.com/a/296/167/95/2/wps/NEWS/IMAGE/2025/03/06/131153587.1.jpg,22주기를 앞두고 고(故) 장국영의 모습을 만나볼 수 있는 ‘열화청춘 리마스터링’과 ‘대삼원 리마스터링’이 국내 최초 리마스터링 개봉을 확정했다.6일 수입사 엔케이컨텐츠에 따르면 ‘열화청춘 리마스터링’과 ‘대삼원 리마스터링’을 오는 31일 국내 최초 리마스터링 버전으로 개봉한다.‘열화…,9시간 전,https://www.donga.com/news/Entertainment/article/all/20250306/131153586/1,동아일보
