title,thumbnail,short_content,write_time,link,company
"北 “李, 괴뢰들과 공범…위장 간판 스스로 내팽개” EU 공동성명에 반발",https://dimg.donga.com/a/296/167/95/2/wps/NEWS/IMAGE/2026/06/13/134105369.2.jpg,이재명 대통령이 유럽을 순방 중인 가운데 북한이 한국과 유럽연합(EU) 정상회담 공동성명에 반발하며 “한국은 우리 국가에 대한 적대를 떠나 절대 존재할 수 없는 제1의 적대국”이라고 반발했다.북한 외무성 10국 대변인은 이날 조선중앙통신에 공개한 ‘한국은 역시 적대와 대결을 체질화한 …,1일 전,https://www.donga.com/news/Politics/article/all/20260613/134105368/2,동아일보
"종합특검, 尹 9시간 고강도 2차 조사…반란·외환 의혹 조사",https://dimg.donga.com/a/296/167/95/2/wps/NEWS/IMAGE/2026/06/13/134105365.1.jpg,3대 특검(내란·김건희·순직해병)의 미제 의혹을 수사 중인 2차 종합특검팀(특별검사 권창영)이 13일 윤석열 전 대통령을 2차 소환해 약 9시간 조사했다.윤 전 대통령은 이날 오후 6시 46분쯤 법무부 호송차를 타고 경기 과천시 특검팀 사무실을 빠져나와 서울구치소로 향했다.종합특검은 …,1일 전,https://www.donga.com/news/Society/article/all/20260613/134105364/1,동아일보
"與 “국힘, ‘법사위 요구’는 적반하장식 주장…결코 넘겨줄 수 없어”",https://dimg.donga.com/a/296/167/95/2/wps/NEWS/IMAGE/2026/06/13/134105354.1.jpg,더불어민주당은 13일 “국민의힘이 견제와 균형의 원리를 언급하며 (국회) 법제사법위원회 위원장 자리를 요구하는 것은 그간 자신들이 저지른 무책임한 국회 발목 잡기 행적을 망각한 적반하장식 주장에 불과하다”고 했다.이주희 민주당 원내대변인은 이날 오후 서면 브리핑을 내고 이같이 말하며 …,1일 전,https://www.donga.com/news/Politics/article/all/20260613/134105353/1,동아일보
‘소쿠리 투표’ 해놓고 83억원 성과급 챙겼다…‘돈 잔치’ 선관위,https://dimg.donga.com/a/296/167/95/2/wps/NEWS/IMAGE/2026/06/13/134105323.3.jpg,중앙선거관리위원회가 2022년 대선 당시 일명 ‘소쿠리 투표’ 논란에도 성과급 예산으로 배정된 약 83억 원을 대부분 집행한 것으로 확인됐다. 투표 관리는 부실하게 해놓고 내부에서 성과급 잔치를 벌였다는 비판이 나온다.13일 김승수 국민의힘 의원이 중앙선거관리위원회로부터 받은 ‘202…,1일 전,https://www.donga.com/news/Politics/article/all/20260613/134105320/2,동아일보
"장동혁, 검찰미래위 출범에 “李 재판 취소 빌드업용”",https://dimg.donga.com/a/296/167/95/2/wps/NEWS/IMAGE/2026/06/13/134105307.1.jpg,장동혁 국민의힘 대표는 13일 검찰의 수사·기소 과정에서 인권 침해나 권한을 남용한 의혹들을 조사하는 검찰인권존중미래위원회가 출범한 데 대해 “이재명 재판 취소 빌드업용”이라고 했다.장 대표는 이날 자신의 페이스북에 “법무부 장관 정성호가 검찰인권존중미래위원회라는 해괴한 조직을 출범시…,1일 전,https://www.donga.com/news/Politics/article/all/20260613/134105306/1,동아일보
韓-이탈리아 비즈니스 라운드테이블…이재용 회장 등 참석[청계천 옆 사진관],https://dimg.donga.com/a/296/167/95/2/wps/NEWS/IMAGE/2026/06/13/134104408.1.jpg,"이재명 대통령이 이탈리아를 국빈 방문 중인 가운데 12일(현지시간) 이탈리아 로마의 한 호텔에서 한-이탈리아 비즈니스 라운드테이블이 열렸다. 이날 행사는 전략·첨단산업(AI/반도체/자동차/항공우주), 에너지·인프라(청정에너지/건설), 미래 유망산업(바이오, 제약) 분야에 대한 협력 논…",1일 전,https://www.donga.com/news/Politics/article/all/20260613/134104514/1,동아일보
로마서 한복 패션쇼 찾은 김혜경 여사 ‘은빛 한복 외교’[청계천 옆 사진관],https://dimg.donga.com/a/296/167/95/2/wps/NEWS/IMAGE/2026/06/13/134104410.1.jpg,"이재명 대통령과 함께 이탈리아를 국빈 방문 중인 김혜경 여사가 현지시각(12일) 국립로마미술대학교에서 열린 한복 패션쇼 참석했다. 이날 행사는 패션의 본고장인 이탈리아에서 한복의 가치와 아름다움을 조명하고, 한국과 이탈리아 간 문화 교류와 우호 협력을 더욱 증진하기 위해 마련됐다. 김…",1일 전,https://www.donga.com/news/Politics/article/all/20260613/134104493/1,동아일보
"與 “국힘, 정부 흠집내기 중단하고 참정권 수호 동참하라”",https://dimg.donga.com/a/296/167/95/2/wps/NEWS/IMAGE/2026/06/13/134105249.1.jpg,더불어민주당은 13일 6·3지방선거 투표용지 부족 사태 관련해 국민의힘을 향해 “국가적 사태를 이재명 정부 흠집 내기용 정쟁으로 악용하는 구태를 즉각 중단하라”며 참정권 수호를 위한 초당적 조치에 동참할 것을 촉구했다.이주희 원내대변인은 이날 서면 브리핑에서 “민주당은 투표용지 부족 …,1일 전,https://www.donga.com/news/Politics/article/all/20260613/134105248/1,동아일보
최불암 병문안 최휘영 장관 “‘파하’ 웃음에 안심…퇴원하면 막걸리 한잔”,https://dimg.donga.com/a/296/167/95/2/wps/NEWS/IMAGE/2026/06/13/134105256.1.jpg,최휘영 문화체육관광부 장관이 입원 중인 배우 최불암을 찾았다. 최 장관은 12일 소셜네트워크서비스(SNS)에 “건강이 불편하셔서 입원 중이신 우리의 ‘국민 아버지’ 최불암 선생님을 찾아뵙고 문안인사를 드렸다”고 밝혔다.최 장관은 최불암과 함께 찍은 사진을 올리며 “특유의 ‘파하’ 웃음…,1일 전,https://www.donga.com/news/Society/article/all/20260613/134105165/1,동아일보
위성락 “철강관세 등 EU 규제 입법 협의 생산적…자유무역 질서 중요성 재확인”,https://dimg.donga.com/a/296/167/95/2/wps/NEWS/IMAGE/2026/06/13/134105132.1.jpg,청와대는 12일(현지시간) 이재명 대통령의 주요 7개국(G7) 정상회의 참석을 계기로 이뤄진 첫 유럽 순방과 관련 “EU의 경제 안보 자구 노력이 우리에 대한 대(對)유럽 진입 장벽으로 작동하지 않도록 대처 방안을 모색하는 성과를 거뒀다”고 밝혔다.위성락 국가안보실장은 이날 오후 로마…,1일 전,https://www.donga.com/news/Politics/article/all/20260613/134105131/1,동아일보
"李 “한·伊 ‘연대와 협력’, 기업인 역할 기대”…이재용 “힘 합쳐 다양한 협력 가능”",https://dimg.donga.com/a/296/167/95/2/wps/NEWS/IMAGE/2026/06/13/134105126.1.jpg,이재명 대통령은 “지금과 같은 대전환기에는 가치를 공유하는 국가 간 연대와 협력이 중요하다”며 한국과 이탈리아 기업인들에게 그 과정에서 가교 역할을 해줄 것을 당부했다.유럽 순방의 두 번째 방문지인 이탈리아를 국빈 방문한 이 대통령이 12일(현지시간) 오후 로마 시내 한 호텔에서 양국…,1일 전,https://www.donga.com/news/Politics/article/all/20260613/134105125/1,동아일보
"김용범, 재경부 국제차관보 방미 관련 “통상적 협력 차원에서 간 걸로 알아”",https://dimg.donga.com/a/296/167/95/2/wps/NEWS/IMAGE/2026/06/13/134105123.1.jpg,"김용범 대통령비서실 정책실장은 13일 문지성 재정경제부 국제차관보가 최근 원달러 환율이 1500원대에서 거래되는 상황에서 이번 주 미국을 방문한 것과 관련 “통상적인 차원”이라고 했다.김 실장은 이날 이탈리아 로마에서 브리핑을 열고 “국제 차관보는 여러 일로, 여러 나라들을 다닌다”며…",1일 전,https://www.donga.com/news/Politics/article/all/20260613/134105122/1,동아일보
“전국 재선거” 주장 장동혁…“김 총리-정청래 같이 3자 회동하자”,https://dimg.donga.com/a/296/167/95/2/wps/NEWS/IMAGE/2026/06/13/134105011.1.jpg,국민의힘 장동혁 대표는 13일 6·3 지방선거 투표용지 부족 사태와 관련해 전국 재선거를 주장하며 김민석 국무총리와 정청래 더불어민주당 대표를 향해 ‘3자 회동’을 제안했다. 장 대표는 이날 페이스북을 통해 “형식이 무엇이든 상관없다. 3자 회동도 좋다”며 “전국 재선거를 실시하고 당…,1일 전,https://www.donga.com/news/Politics/article/all/20260613/134105087/1,동아일보
트럼프 G7행에 靑 “기회 닿으면 미국과 대화할 수도”,https://dimg.donga.com/a/296/167/95/2/wps/NEWS/IMAGE/2026/06/13/134105064.1.png,청와대가 유럽을 순방 중인 이재명 대통령이 주요 7개국(G7) 정상회의 기간(15일~17일) 도널드 트럼프 미국 대통령과의 회동 가능성에 대해 “이번 유럽 순방은 주안점은 유럽”이라며 신중한 입장을 밝혔다.청와대 고위 관계자는 12일(현지 시간) 이탈리아 로마에서 기자들과 만나 ‘트럼…,1일 전,https://www.donga.com/news/Politics/article/all/20260613/134105065/1,동아일보
韓기업 “이탈리아 정부 문제 해결 속도는 세계에서 가장 빠른 페라리”,https://dimg.donga.com/a/296/167/95/2/wps/NEWS/IMAGE/2026/06/13/134104991.1.jpg,김용범 대통령정책실장이 12일(현지 시간) ‘한-이탈리아 비즈니스 라운드테이블’에서 양국 참석자들이 “한국과 이탈리아의 협력 관계가 인공지능(AI) 혁명과 공급망 재편의 시대를 맞아 새로운 차원의 도약이 필요하다는것에 공감했다”고 밝혔다.김 실장은 이날 이탈리아 로마 현지 브리핑에서 …,1일 전,https://www.donga.com/news/Politics/article/all/20260613/134104944/1,동아일보
"국힘 “한성숙, 총리 지명 이후에야 불법 건축물 철거…지명 철회해야”",https://dimg.donga.com/a/296/167/95/2/wps/NEWS/IMAGE/2026/06/13/134105057.1.jpg,국민의힘은 13일 한성숙 국무총리 후보자가 중소벤처기업부 장관 청문회 당시 불법 증축 논란이 일었던 서울 종로구 건물을 철거하지 않고 버티다 총리 지명 직후에야 철거 논의를 시작했다며 이재명 대통령에게 지명 철회를 촉구했다.박성훈 수석대변인은 이날 논평에서 “(한 후보자는) 지난해 중…,1일 전,https://www.donga.com/news/Politics/article/all/20260613/134105056/1,동아일보
"홍준표 “검찰개혁 입법독주, 범죄자 천국시대 된다…개혁 아닌 보복”",https://dimg.donga.com/a/296/167/95/2/wps/NEWS/IMAGE/2026/06/13/134105042.1.jpg,"홍준표 전 대구시장이 여권 중심의 검찰개혁 추진과 관련해 비판하고 나섰다.홍 전 시장은 13일 소셜네트워크서비스(SNS)에 “검찰개혁 한답시고, 입법독주로 계속 치닫으면 경찰 만능시대가 되고 범죄자 천국시대가 된다”고 지적했다.이어 “헌법상 명시된 검찰청을 공소청으로 격하시키는 것도 …",1일 전,https://www.donga.com/news/Politics/article/all/20260613/134105041/1,동아일보
"장동혁 “정청래·김민석, 오늘이라도 만나 재선거·특검 논의하자”",https://dimg.donga.com/a/296/167/95/2/wps/NEWS/IMAGE/2026/06/13/134105011.1.jpg,"장동혁 국민의힘 대표는 13일 6·3 지방선거 투표용지 부족 사태와 관련해 정청래 더불어민주당 대표와 김민석 국무총리를 향해 “오늘이라도 만나서 재선거와 특검을 논의하자. 형식이 무엇이든 상관없다. ‘3자 회동’도 좋다”고 밝혔다.장 대표는 이날 페이스북을 통해 “김민석 총리, 선관위…",1일 전,https://www.donga.com/news/Politics/article/all/20260613/134105010/1,동아일보
"이준석 “국힘은 尹, 민주는 李 앞에서 침묵…공소취소로 도망치면 2, 3배 저항”",https://dimg.donga.com/a/296/167/95/2/wps/NEWS/IMAGE/2026/06/11/134093684.1.jpg,이준석 개혁신당 대표는 13일 “이재명 대통령도 (대북 송금 의혹에 대해) 법정에서 끝을 봐야 한다”고 했다. 이 대표는 이날 소셜네트워크서비스(SNS)를 통해 “법원이 윤석열 전 대통령에게 징역 30년을 선고했다”며 “잣대는 일관되어야 한다. 이제 적에게 돈을 보냈다는 의혹을 받는 …,1일 전,https://www.donga.com/news/Politics/article/all/20260613/134104999/1,동아일보
"이준석, 尹 징역 30년 언급하며 李대통령 비판 “무인기든 달러든 이적행위”",https://dimg.donga.com/a/296/167/95/2/wps/NEWS/IMAGE/2026/06/13/134104905.1.jpg,"이준석 개혁신당 대표는 13일 법원이 윤석열 전 대통령에게 징역 30년을 선고한 것을 언급하며 이재명 대통령도 같은 잣대로 법의 심판을 받아야 한다고 주장했다.이 대표는 이날 페이스북에 “군 통수권은 국민을 지키라고 준 권한이지, 권좌를 지키라고 준 권한이 아니다. 이것과 결별하지 못…",1일 전,https://www.donga.com/news/Politics/article/all/20260613/134104904/1,동아일보
"국힘 “선관위, 대통령 밥 친구가 주도하는 셀프 조사 아닌 국조·특검이 답”",https://dimg.donga.com/a/296/167/95/2/wps/NEWS/IMAGE/2026/06/13/134104892.1.jpg,국민의힘은 13일 “대통령 밥 친구가 주도하는 선관위 셀프 조사가 아닌 국정조사와 특검 투트랙만이 답”이라고 강조했다.최수진 원내수석대변인은 이날 논평에서 “민주주의의 꽃이어야 할 선거가 선거관리위원회의 무능함 때문에 엉망진창이 됐다”며 이같이 밝혔다.최 대변인은 “선관위는 자신들이 …,1일 전,https://www.donga.com/news/Politics/article/all/20260613/134104891/1,동아일보
민간분양도 신생아 특공 신설,https://dimg.donga.com/a/296/167/95/2/wps/NEWS/IMAGE/2026/06/15/134110911.1.jpg,"15일부터 민간 분양 주택에도 신생아 특별공급이 신설된다. 2세 미만 신생아가 있는 무주택 가구가 대상으로, 전체 일반분양 물량의 10%가 신생아 특공 물량으로 배정된다. 그동안은 민간 주택의 경우 신생아가 있어도 혼인신고 후 7년 이내인 신혼부부 등만 특별공급 대상이었다. 이 때문에…",2시간 전,https://www.donga.com/news/Economy/article/all/20260615/134110523/2,동아일보
민영주택 청약에도 ‘신생아 특공’… 결혼기간 상관없이 신청 가능,https://dimg.donga.com/a/296/167/95/2/wps/NEWS/IMAGE/2026/06/15/134110892.1.jpg,이달부터 혼인 기간과 관계없이 만 2세 미만 자녀가 있으면 민영주택 청약에서 신생아 특별공급(특공)에 지원할 수 있게 된다. 기존에 신혼부부 특공이나 생애최초 특공에 있던 신생아 우선공급 제도가 신생아 특별공급 제도로 대체되는 것이다. 지방 이전기업 종사자 등을 대상으로 주택을 특별공…,2시간 전,https://www.donga.com/news/Economy/article/all/20260615/134110106/2,동아일보
AI에 응급환자 증상 말하니 “심근경색 의심” 이송병원 추천,https://dimg.donga.com/a/296/167/95/2/wps/NEWS/IMAGE/2026/06/15/134108724.4.jpg,"12일 대구 경북대병원 강당. 가슴을 움켜쥔 응급환자가 119구급대원에게 “속이 울렁거리고 숨이 찬다. 고혈압 약을 먹고 있다”며 증상과 병력을 말했다. 구급대원은 곧바로 환자의 혈압과 맥박, 산소포화도 등을 측정했다. 그러자 인공지능(AI)이 ‘흉통’ ‘팔 저림’ ‘고혈압’ 등 환자…",2시간 전,https://www.donga.com/news/Economy/article/all/20260615/134110103/2,동아일보
"반도체로 더 걷힐 세수 16조, 나랏빚 갚는 대신 ‘미래기금’ 만들듯",https://dimg.donga.com/a/296/167/95/2/wps/NEWS/IMAGE/2026/06/15/134110739.1.jpg,반도체 슈퍼사이클(초호황)과 증시 활황에 힘입어 올해 국세 수입이 두 달 전 정부의 전망치보다 16조 원 이상 많을 수 있다는 분석이 나온다. 정부는 늘어나는 초과 세수를 국가 채무 상환이나 추가경정예산(추경) 편성에 투입하는 기존 방식에서 벗어나 미래 산업 투자 재원으로 활용하는 방…,2시간 전,https://www.donga.com/news/Economy/article/all/20260615/134110317/2,동아일보
"스페이스X 상장 잔치, 韓 ‘0주’… 공모 참여 미래에셋 1주도 못받아",https://dimg.donga.com/a/296/167/95/2/wps/NEWS/IMAGE/2026/06/15/134110727.1.jpg,"미국 우주항공 기업 스페이스X가 사상 최대 규모의 기업공개(IPO)에 성공했지만, 국내에서 유일하게 공모주 인수단으로 참여한 미래에셋증권이 공모주 확보에 실패한 것으로 밝혀져 파장을 낳고 있다. 이에 따라 국내 기관 투자가 공모주 배정은 무산됐다. 국내에서 개인 투자자의 스페이스X 공…",2시간 전,https://www.donga.com/news/Economy/article/all/20260615/134110221/2,동아일보
티빙 개인정보 유출에… 5만6300명 단체소송,https://dimg.donga.com/a/296/167/95/2/wps/NEWS/IMAGE/2026/06/15/134110887.1.jpg,최근 국내 온라인동영상서비스(OTT) ‘티빙’에서 대규모 개인정보 유출이 발생한 가운데 이용자들의 피해 인증과 단체소송 움직임이 이어지고 있다. 14일 소셜네트워크서비스(SNS)에 ‘개인정보 유출’ 피해를 인증했다는 김학철 씨(32)는 “내 정보 곳간이 털렸는데 사태 심각성을 사람들이…,2시간 전,https://www.donga.com/news/Society/article/all/20260615/134109877/2,동아일보
"소비기한 임박한 식품, 오늘부터 배달앱서 ‘마감 할인’ 판매",https://dimg.donga.com/a/296/167/95/2/wps/NEWS/IMAGE/2026/06/15/134110885.1.jpg,"소비기한이 임박했거나 당일 팔리지 않은 빵이나 음식을 배달의민족, 쿠팡이츠, 요기요 등 배달 애플리케이션(앱)을 통해 저렴하게 구매할 수 있게 됐다. 기후에너지환경부는 15일부터 주요 배달 앱에서 폐기를 앞둔 식품을 할인가로 주문할 수 있는 ‘미판매 식품 마감할인 서비스’를 운영한다고…",2시간 전,https://www.donga.com/news/Society/article/all/20260615/134109866/2,동아일보
AI 사이클 탄 반도체부품-전력기기… 영업익 줄상향,https://dimg.donga.com/a/296/167/95/2/wps/NEWS/IMAGE/2026/06/14/134110563.1.jpg,"인공지능(AI) 슈퍼사이클의 훈풍이 반도체 업계를 넘어 커패시터와 반도체 기판 등을 생산하는 반도체 부품 업계, 변압기와 전선을 생산하는 전력기기 업체에도 불고 있다. 증권가는 이들 기업의 올 2분기(4∼6월) 실적을 줄줄이 상향 조정하고 있다. AI 데이터센터 증설 수요가 넘쳐 제품…",6시간 전,https://www.donga.com/news/Economy/article/all/20260614/134109171/2,동아일보
"효성중공업, 변압기 이어 美서 초고압 차단기 생산",https://dimg.donga.com/a/296/167/95/2/wps/NEWS/IMAGE/2026/06/15/134110918.1.jpg,효성중공업이 국내 전력기기 업체 최초로 미국 현지에 초고압 차단기 생산기지를 설립한다. 14일 효성중공업은 자회사인 효성HICO가 북미 에너지 인프라 솔루션 기업 콴타(Quanta)의 자회사와 가스절연차단기(GCB) 합작법인 ‘효성HICO 브레이커’ 설립 계약을 체결했다고 밝혔다. 7…,6시간 전,https://www.donga.com/news/Economy/article/all/20260614/134109154/2,동아일보
2차 국민성장펀드 3분기에 나온다… 6000억 규모,https://dimg.donga.com/a/296/167/95/2/wps/NEWS/IMAGE/2026/06/15/134110905.1.jpg,정부가 올해 3분기(7∼9월) 중 2차 국민참여형 국민성장펀드(국민참여성장펀드)를 6000억 원 규모로 내놓는다. 당초 3주 동안 판매하기로 했던 1차 물량이 닷새 만에 완판되면서 정부가 추가 공급에 나선다. 이억원 금융위원장은 12일 서울 영등포구 한국금융투자협회에서 열린 국민참여성…,6시간 전,https://www.donga.com/news/Economy/article/all/20260614/134109169/2,동아일보
종전 기대감에 국제유가 3개월새 최저… 환율 상승세도 꺾일듯,https://dimg.donga.com/a/296/167/95/2/wps/NEWS/IMAGE/2026/06/14/134110548.1.jpg,"중동 전쟁 종전 기대감이 높아지며 국제 유가가 2, 3개월 전 수준으로 하락했다. 미국과 이란이 종전을 위한 양해각서(MOU)를 체결하고 국제 유가가 추가로 하락하면 1500원을 넘어선 원-달러 환율 상승세도 한풀 꺾일 가능성이 크다. 다만 종전 기대감이 현재 유가에 이미 반영돼 막상…",6시간 전,https://www.donga.com/news/Economy/article/all/20260614/134109188/2,동아일보
"수출로 번 달러, 원화로 안 바꾸는 기업들",,"기업들이 쌓아둔 달러예금 잔액이 3년 5개월 만에 최대치를 기록한 것으로 나타났다. 정부는 기업들이 수출로 번 달러를 원화로 환전하길 원하지만 기업들은 대외 불확실성 등을 고려해 달러를 쥐고 있다. 14일 금융권에 따르면 KB국민, 신한, 하나, 우리, NH농협은행 등 5대 시중은행의…",6시간 전,https://www.donga.com/news/Economy/article/all/20260614/134109178/2,동아일보
배추 1포기 평균 3656원… 한 달 새 11% 올라,https://dimg.donga.com/a/296/167/95/2/wps/NEWS/IMAGE/2026/06/14/134108797.4.jpg,"14일 서울 서초구 하나로마트 양재점에서 한 시민이 배추를 고르고 있다. 최근 일부 채소, 과일값이 올라 장바구니 물가 불안이 커지고 있다. 한국농수산식품유통공사(aT)에 따르면 이날 기준 배추 1포기(3656원)는 지난달보다 11.84%, 작년 같은 달보다 5.73% 올랐다.",6시간 전,https://www.donga.com/news/Economy/article/all/20260614/134109190/2,동아일보
시중은행 예금 금리도 年 3%대 진입,https://dimg.donga.com/a/296/167/95/2/wps/NEWS/IMAGE/2026/06/15/134110925.1.jpg,주요 시중은행 정기예금 금리가 연 3%대로 올라서고 있다. 이르면 7월 한국은행이 기준금리를 인상할 것이라는 전망에 시장 금리가 상승하자 인터넷전문은행과 저축은행에 이어 시중은행들도 자금 조달을 위해 예금 금리를 높이고 있다. 14일 은행연합회에 따르면 12일 기준 5대 은행(KB국민…,6시간 전,https://www.donga.com/news/Economy/article/all/20260614/134109186/2,동아일보
"[단신]하나금융연구소, ‘생산적 금융 활성화’ 세미나 外",,"■ 하나금융연구소, ‘생산적 금융 활성화’ 세미나하나금융연구소는 11일 한국금융연구원, 산업연구원과 생산적 금융 활성화를 위한 세미나를 열었다고 14일 밝혔다. 이날 세미나에서는 혁신성장을 위한 금융의 역할, 정책금융과 민간금융의 협력 방식 등이 주요 의제로 다뤄졌다. 함영주 하나금융…",6시간 전,https://www.donga.com/news/Economy/article/all/20260614/134109182/2,동아일보
K뷰티 열풍 확산… 美 개점 첫날 오픈런-日선 편집숍 120개 입점,https://dimg.donga.com/a/296/167/95/2/wps/NEWS/IMAGE/2026/06/14/134110352.1.jpg,"K뷰티가 미국과 일본 시장에서 빠르게 성장하고 있다. CJ올리브영은 미국 캘리포니아주 로스앤젤레스(LA)에 두 번째 오프라인 매장을 열어 유통 거점 확대에 나섰고, 일본에서는 국내 주요 브랜드들이 드러그스토어·편의점 등 현지 주류 유통망으로 속속 진입하고 있다. 13일(현지 시간) C…",6시간 전,https://www.donga.com/news/Economy/article/all/20260614/134109266/2,동아일보
최태원 “전속력 AI 전환… ‘1인 1에이전트’ 도입”,https://dimg.donga.com/a/296/167/95/2/wps/NEWS/IMAGE/2026/06/15/134110927.1.jpg,최태원 SK그룹 회장이 그룹 차원의 신속하고 전방위적인 인공지능 전환(AX)을 주문했다. 인공지능(AI)이 개인 업무보조 수준을 넘어 조직 전체의 성과 창출을 위해 활용되어야 한다는 지적이다. 14일 SK그룹에 따르면 최 회장은 11∼13일 경기 이천시 SKMS연구소에서 열린 ‘202…,6시간 전,https://www.donga.com/news/Economy/article/all/20260614/134109268/2,동아일보
"정의선, ‘르망 24시’ 찾아 제네시스 레이싱팀 격려",https://dimg.donga.com/a/296/167/95/2/wps/NEWS/IMAGE/2026/06/14/134109263.3.jpg,정의선 현대자동차그룹 회장이 세계 최고 권위의 내구 레이스 대회인 프랑스 ‘르망 24시’ 현장을 방문했다. 14일 현대차그룹에 따르면 정 회장은 13일(현지 시간) 프랑스 르망의 라사르트 서킷에서 열린 르망 24시 대회를 찾았다. 정 회장은 이날 오전 제네시스 마그마 레이싱(GMR) …,6시간 전,https://www.donga.com/news/Economy/article/all/20260614/134109264/2,동아일보
K배터리-태양광 ‘빅뱅’ 온다…우주 데이터센터 산업 본격화,https://dimg.donga.com/a/296/167/95/2/wps/NEWS/IMAGE/2026/06/14/134110338.1.jpg,"스페이스X가 12일(현지 시간) 사상 최대 규모의 기업공개(IPO)에 성공하며 글로벌 우주 산업에 새로운 전기가 열렸다는 평가가 나온다. 그간 가능성에 머물렀던 우주 데이터센터 시장이 본격적으로 개화되고, 기존 발사체 대비 4배 이상의 중량을 실을 수 있는 스페이스X ‘스타십’의 상용…",6시간 전,https://www.donga.com/news/Economy/article/all/20260614/134109143/2,동아일보
