title,thumbnail,short_content,write_time,link,company
野 오늘 ‘최상목 탄핵안’ 발의…“마은혁 임명 의무 무시”,https://dimg.donga.com/a/296/167/95/2/wps/NEWS/IMAGE/2025/03/11/131182686.1.jpg,더불어민주당 등 야5당은 21일 최상목 대통령 권한대행 부총리 겸 기획재정부 장관에 대한 탄핵소추안을 발의한다.야5당은 이날 오후 2시 국회 의안과에 최 대행 탄핵안을 제출한다고 밝혔다.민주당은 최 대행이 마은혁 헌법재판관 후보자를 임명하지 않은 데 대해 ‘헌법 위배 사항’이라면서 책…,19시간 전,https://www.donga.com/news/Politics/article/all/20250321/131252649/1,동아일보
쇼이구 러 국가안보회의 서기 방북…김정은 방러 논의 가능성,https://dimg.donga.com/a/296/167/95/2/wps/NEWS/IMAGE/2025/03/21/131252609.1.jpg,세르게이 쇼이구 러시아 국가안보회의 서기가 21일 북한을 방문했다.리아 노보스티 등 다수 러시아 국영 매체는 쇼이구 서기가 이날 북한 수도인 평양에 도착했다고 보도했다. 쇼이구 서기는 김정은 북한 국무위원장을 포함한 북한 지도부와 회담할 예정이다. 미국 북한전문매체 NK뉴스는 “이번 …,19시간 전,https://www.donga.com/news/Inter/article/all/20250321/131252608/1,동아일보
“우리 차례야” 헌재 앞 맞불 기자회견…여야 자리다툼에 날선 대립,https://dimg.donga.com/a/296/167/95/2/wps/NEWS/IMAGE/2025/03/21/131252586.1.jpg,국민의힘과 더불어민주당이 각각 윤석열 대통령 탄핵 기각과 파면 인용 촉구를 위해 헌법재판소 앞을 찾았다.예정한 기자회견 시간이 겹쳤던 양당은 서로 헌법재판소 현판 앞에서 기자회견을 열기 위해 고성을 지르고 각자의 피켓으로 서로를 막는 등 충돌했다.국회 산업통상자원중소벤처기업위원회·농림…,19시간 전,https://www.donga.com/news/Politics/article/all/20250321/131252585/1,동아일보
"민주, 최상목 뇌물-공갈죄 고발…“최순실 게이트때 尹이 불기소”",https://dimg.donga.com/a/296/167/95/2/wps/NEWS/IMAGE/2025/03/21/131252469.2.jpg,더불어민주당이 최상목 대통령권한대행 부총리 겸 기획재정부 장관을 박근혜 정부 당시 국정농단 사건과 관련 뇌물죄와 공갈죄 혐의로 21일 고발했다. 민주당 법률위원회는 이날 오전 고위공직자수사처 앞에서 기자회견을 열어 “최 권한대행은 박근혜·최순실 게이트에 적극 가담했던 자로 행정부의 책…,19시간 전,https://www.donga.com/news/Society/article/all/20250321/131252468/2,동아일보
"이재명, 증인 불출석에 재판 6분 만에 종료…재판장 “과태료 검토”",https://dimg.donga.com/a/296/167/95/2/wps/NEWS/IMAGE/2025/03/21/131252380.1.jpg,‘대장동 본류 사건’이라고 불리는 민간업자들 공판에 증인으로 소환된 지목된 이재명 더불어민주당 대표가 불출석하면서 재판이 6분 만에 종료됐다.재판장은 다음 기일에도 출석하지 않을 경우 과태료 부과를 검토하기로 했다.서울중앙지법 형사합의22부(부장판사 조형우)는 21일 오전 대장동 민간…,19시간 전,https://www.donga.com/news/Society/article/all/20250321/131252379/1,동아일보
‘취임 100일’ 권성동 “국민 힘으로 버텨…탄핵 공포 벗어날 것”,https://dimg.donga.com/a/296/167/95/2/wps/NEWS/IMAGE/2025/03/21/131252371.1.jpg,권성동 국민의힘 원내대표가 21일 취임 100일을 맞이해 “국민 여러분께서 힘을 실어주셔서 지금까지 버텨왔다”고 감사 인사를 전했다.권 원내대표는 이날 오전 국회에서 기자들과 만나 “12월 12일 의원님들의 선택으로 원내대표에 취임했다. 하루하루 이렇게 버티고 지나오는 것이 굉장히 힘…,19시간 전,https://www.donga.com/news/Politics/article/all/20250321/131252370/1,동아일보
정당지지율 민주 40% 국힘 36%…尹탄핵 찬성 58% 반대 36%,https://dimg.donga.com/a/296/167/95/2/wps/NEWS/IMAGE/2025/03/21/131252314.2.jpg,"더불어민주당의 지지율이 국민의힘을 앞서고 있다는 여론조사 결과가 21일 나왔다. 한국갤럽이 지난 18~20일 전국 만 18세 이상 남녀 1003명을 대상으로 진행한 정당 지지도 조사 결과, 국민의힘이 36%, 민주당은 40%로 집계됐다. 지지하는 정당이 없는 무당(無黨)층은 19%다.…",19시간 전,https://www.donga.com/news/Politics/article/all/20250321/131252313/2,동아일보
"이재명 “18년 만의 연금개혁, 모처럼 정치권이 칭찬받을 일 해”",https://dimg.donga.com/a/296/167/95/2/wps/NEWS/IMAGE/2025/03/21/131252244.1.jpg,이재명 더불어민주당 대표는 21일 국민연금법 개정안이 18년 만에 여야 합의로 국회를 통과한 데 대해 “모처럼 정치권이 국민들한테 칭찬받을 일을 했다”고 말했다.이 대표는 이날 국회에서 열린 최고위원회의에서 “노무현 정부 이후 18년 만에 (여야가) 연금개혁에 합의했다. 지난해 12월…,20시간 전,https://www.donga.com/news/Politics/article/all/20250321/131252243/1,동아일보
국민 10명 중 7명 ‘추경 편성 필요’…54.8% “경기 침체 대응”,https://dimg.donga.com/a/296/167/95/2/wps/NEWS/IMAGE/2025/03/21/131252054.1.jpg,우리나라 국민 10명 중 7명은 추가경정예산(추경)안 편성이 필요하다고 생각한다는 여론조사 결과가 나왔다.21일 국회 예산결산특별위원장인 박정 더불어민주당 의원이 여론조사 업체 메타보이스에 의뢰해 지난 12~13일 전국 만 18세 이상 성인 남녀 1001명을 대상으로 실시한 ‘추경 편…,20시간 전,https://www.donga.com/news/Politics/article/all/20250321/131252053/1,동아일보
민노총 총파업 예고에 권성동 “민주당과 정치적 동업 확인”,https://dimg.donga.com/a/296/167/95/2/wps/NEWS/IMAGE/2025/03/21/131251972.1.jpg,전국민주노동조합총연맹(민노총)이 윤석열 대통령의 탄핵 심판 선고 일정이 확정되지 않으면 27일 총파업을 벌이겠다고 예고한 데 대해 국민의힘 권성동 원내대표가 “더불어민주당과의 정치적 동업 관계를 다시 한번 확인했다”고 비판했다. 권 원내대표는 21일 오전 국회에서 열린 원내대책회의에서…,20시간 전,https://www.donga.com/news/Politics/article/all/20250321/131251950/1,동아일보
박찬대 “尹보다 한덕수 먼저 선고…납득할 국민 얼마나 되겠나”,https://dimg.donga.com/a/296/167/95/2/wps/NEWS/IMAGE/2025/03/21/131251961.1.jpg,"박찬대 더불어민주당 원내대표는 21일 헌법재판소가 한덕수 국무총리에 대한 탄핵 심판을 오는 24일 선고하기로 한 데 대해 “최우선 처리하겠다고 한 윤석열은 선고 일정조차 잡히지 않았는데 한덕수 총리 먼저 선고를 한다니, 이를 납득할 국민이 얼마나 되겠나”라고 말했다.박 원내대표는 이날…",20시간 전,https://www.donga.com/news/Politics/article/all/20250321/131251960/1,동아일보
권성동 “의대생 복귀 진심으로 호소…환자 삶 무너질 수 있어”,https://dimg.donga.com/a/296/167/95/2/wps/NEWS/IMAGE/2025/03/21/131251737.1.jpg,권성동 국민의힘 원내대표는 21일 의과대학(의학전문대학원)들이 정한 의대생 복귀 마감 시한이 도래하는 것과 관련해 “국민의힘은 여러분의 복귀를 다시 한번 진심으로 호소드린다”고 밝혔다.권 원내대표는 이날 오전 국회에서 열린 원내대책회의에서 “의료 교육이 멈춘다는 것은 단순히 학업의 중…,21시간 전,https://www.donga.com/news/Politics/article/all/20250321/131251736/1,동아일보
"권성동, ‘분신 사망’ 尹 지지자 조문…“가슴 아픈 일 없게 할 것”",https://dimg.donga.com/a/296/167/95/2/wps/NEWS/IMAGE/2025/03/21/131251660.1.jpg,권성동 국민의힘 원내대표가 윤석열 대통령을 지지하며 분신을 시도하다가 사망한 권모씨를 지난 20일 조문했다.21일 국민의힘 관계자에 따르면 권 원내대표는 전날 저녁 서울 한 병원에 마련된 권씨의 빈소를 찾았다.권 원내대표는 유가족을 만나 “다시는 이런 가슴 아픈 일이 발생하지 않도록 …,21시간 전,https://www.donga.com/news/Politics/article/all/20250321/131251659/1,동아일보
"안철수 “野에서 나를 고발, 최고존엄 아버지 건드렸다는 것”",https://dimg.donga.com/a/296/167/95/2/wps/NEWS/IMAGE/2025/03/21/131251591.2.jpg,더불어민주당이 안철수 국민의힘 의원을 명예훼손죄로 고발한 것에 대해 안 의원은 “제발 염치부터 챙기기 바란다. 어디서 인간성을 논하느냐”고 말했다.안 의원은 20일 자신의 페이스북에 글을 올려 “더불어민주당 의원들이 저를 고발했다고 들었다. ‘최고존엄 아버지’를 건드렸다는 것”이라고 …,21시간 전,https://www.donga.com/news/Politics/article/all/20250321/131251590/2,동아일보
"군, 서해서 목선 탄 北어민 발견…“표류 추정”",https://dimg.donga.com/a/296/167/95/2/wps/NEWS/IMAGE/2025/03/21/131251575.1.jpg,북한 주민 2명이 탄 소형 목선이 서해 북방한계선(NLL) 이남 지역에서 우리 군 당국에 발견됐다. 21일 군 관계자에 따르면 군은 이달 초 서해상에서 표류 중인 목선을 포착하고 해경과 협조해 신병을 확보했다. 국가정보원 등 관계당국은 이들을 대상으로 합동신문을 진행해왔다.이들은 귀순…,21시간 전,https://www.donga.com/news/Politics/article/all/20250321/131251574/1,동아일보
"北김정은, 또 조선소 시찰…“해군력 강화 위한 선박건조 능력 제고”",https://dimg.donga.com/a/296/167/95/2/wps/NEWS/IMAGE/2025/03/21/131251253.1.jpg,북한은 김정은 국무위원장이 20일 남포조선소를 찾았다고 21일 밝혔다.북한 노동당 기관지 노동신문은 김 위원장이 “조선노동당 중앙위원회 주요 지도간부들”과 남포조선소를 현지지도 했다고 이날 보도했다.신문은 김 위원장이 “조선소의 개건 및 생산능력 확장사업 정형을 구체적으로 료해(점검)…,23시간 전,https://www.donga.com/news/Politics/article/all/20250321/131251251/1,동아일보
"직장인 月6만원 더내고, 연금 月9만원 더받는다",https://dimg.donga.com/a/296/167/95/2/wps/NEWS/IMAGE/2025/03/21/131251134.1.jpg,"내는 돈(보험료율)을 13%로, 노후에 받는 돈(소득대체율)을 43%로 높이는 국민연금법 개정안이 20일 국회 본회의를 통과했다. 이에 따라 보험료는 기존 9%에서 내년부터 매년 0.5%포인트씩 8년간 올라간다. 내년부터 내는 돈에 대해선 소득대체율이 40%에서 43%로 인상된다. 2…",1일 전,https://www.donga.com/news/Politics/article/all/20250321/131250731/2,동아일보
"헌재, 24일 ‘韓총리 탄핵심판’ 선고… 尹보다 먼저 한다",https://dimg.donga.com/a/296/167/95/2/wps/NEWS/IMAGE/2025/03/21/131251116.1.jpg,헌법재판소가 24일 한덕수 국무총리 탄핵심판을 선고한다고 20일 밝혔다. 국회가 탄핵소추안을 가결한 지 87일 만이다. 헌재는 이날 “국무총리 한덕수 탄핵 사건에 대한 선고가 24일 오전 10시에 있을 예정”이라고 밝혔다. 국회는 지난해 12월 27일 윤 대통령의 12·3 비상계엄을 …,1일 전,https://www.donga.com/news/Society/article/all/20250321/131250732/2,동아일보
연금개혁 물꼬 텄지만… 구조개혁-자동조정장치 도입 ‘산 넘어 산’,https://dimg.donga.com/a/296/167/95/2/wps/NEWS/IMAGE/2025/03/21/131251098.1.jpg,국민연금 모수개혁안을 담은 국민연금법 개정안이 국회 본회의를 통과한 20일 오전까지도 여야는 세부 합의 내용을 놓고 줄다리기를 벌였다. 막판 진통 끝에 여야 원내대표가 ‘연금개혁 합의문’에 서명한 건 본회의 예정 시각까지 2시간여를 앞둔 오전 11시 40분경이었다. 여야는 본회의 시작…,1일 전,https://www.donga.com/news/Politics/article/all/20250321/131250275/2,동아일보
"野, 최상목 탄핵 착수… “한덕수 24일 선고 예고에 스텝 꼬여”",https://dimg.donga.com/a/296/167/95/2/wps/NEWS/IMAGE/2025/03/21/131251123.1.jpg,더불어민주당 박찬대 원내대표가 20일 “최상목 대통령 권한대행 부총리 겸 기획재정부 장관에 대한 탄핵 절차를 개시하겠다”고 밝혔다. 최 대행이 마은혁 헌법재판관 후보자 임명을 미루고 있는 점을 문제 삼아 당 일각의 만류에도 불구하고 탄핵 절차를 밟겠다고 공식화한 것이다. 최 대행에 대…,1일 전,https://www.donga.com/news/Politics/article/all/20250321/131250742/2,동아일보
이재명 ‘몸조심’ 발언 후폭풍… 與 “李 재판 판사에도 압박”,https://dimg.donga.com/a/296/167/95/2/wps/NEWS/IMAGE/2025/03/21/131251125.1.jpg,더불어민주당 이재명 대표가 19일 최상목 대통령 권한대행 부총리가 마은혁 헌법재판관 후보자를 임명하지 않고 있는 것을 비판하며 “몸조심하기 바란다”고 발언한 데 대한 후폭풍이 이어지고 있다. 국민의힘은 “이 대표 재판 판사에게도 상당한 심리적 압박이 될 수 있다”며 이 대표와 민주당의…,1일 전,https://www.donga.com/news/Politics/article/all/20250321/131250741/2,동아일보
[지표로 보는 경제]3월 22일,https://dimg.donga.com/a/296/167/95/2/wps/NEWS/IMAGE/2025/03/22/131257988.1.jpg,,4시간 전,https://www.donga.com/news/Economy/article/all/20250322/131256498/2,동아일보
[단독]10억 이상 ‘코인 큰손’ 2명 중 1명은 ‘5060’,https://dimg.donga.com/a/296/167/95/2/wps/NEWS/IMAGE/2025/03/22/131257970.1.jpg,"지난해 비트코인 등 가상화폐를 보유한 국내 투자자가 1년 전보다 50% 넘게 늘어나며 960만 명을 넘어선 것으로 나타났다. 가상화폐 투자자 네 명 중 한 명은 50대 이상이었다.21일 더불어민주당 안도걸 의원이 업비트, 빗썸, 코인원, 코빗, 고팍스 등 국내 가상화폐 거래소 5곳에서…",4시간 전,https://www.donga.com/news/Economy/article/all/20250322/131257861/2,동아일보
"한미 ‘민감국가, 조속한 해결’ 합의… 정부 “美, 해제 긍정적”",https://dimg.donga.com/a/296/167/95/2/wps/NEWS/IMAGE/2025/03/22/131255360.5.jpg,한미 양국이 미국 에너지부(DOE)의 ‘민감국가 및 기타 지정국가 목록(SCL)’에 한국이 포함된 문제를 해결하는 데 협력하기로 합의했다. 다만 미국 내에서도 민감국가 해제를 위한 절차가 복잡한 탓에 지정 효력이 발효되는 다음 달 15일 전까지 목록에서 제외되긴 쉽지 않다는 관측이 나…,4시간 전,https://www.donga.com/news/Economy/article/all/20250322/131257850/2,동아일보
동아일보사 정기 주주총회,,"대표이사 사장 임 채 청이사 김 병 철이사 김 승 환감사 임 환 수동아일보사는 21일 제99기 정기 주주총회와 이사회를 열어 임기 만료된 임채청 대표이사 사장, 김병철 김승환 이사, 임환수 감사를 각각 재선임했다.",4시간 전,https://www.donga.com/news/Economy/article/all/20250322/131257568/2,동아일보
"백악관, 또 현대차 거론하며 “트럼프 덕에 美 제조업 르네상스”",https://dimg.donga.com/a/296/167/95/2/wps/NEWS/IMAGE/2025/03/22/131258010.1.jpg,현대차그룹이 이달 말 미국 조지아주 서배너에서 ‘현대차그룹 메타플랜트 아메리카(HMGMA)’ 공장 준공식을 개최할 예정인 가운데 미국 백악관이 이를 도널드 트럼프 2기 행정부 통상 정책의 성공 사례로 소개했다. 관세 등 트럼프 2기 행정부의 ‘미국 우선주의’ 통상 정책의 효과로 현대차…,4시간 전,https://www.donga.com/news/Inter/article/all/20250322/131257572/2,동아일보
"美상의 “韓, 美기업인 처벌 과도”… 비관세 장벽 주장",https://dimg.donga.com/a/296/167/95/2/wps/NEWS/IMAGE/2025/03/21/131254544.1.jpg,"다음 달 2일 ‘상호 관세’ 시행을 앞두고 도널드 트럼프 2기 미국 행정부가 주요 교역국의 불공정 무역 관행을 수집하고 있는 가운데 미국 재계가 한국의 기업인 형사 기소 관행, 예고 없이 도입되는 각종 규제와 제재 등을 문제 삼았다. 이것이 일종의 비(非)관세 장벽으로 작용해 미국산 …",4시간 전,https://www.donga.com/news/Inter/article/all/20250322/131257570/2,동아일보
“자신의 감정에 솔직한 장하나 가장 인상적”,https://dimg.donga.com/a/296/167/95/2/wps/NEWS/IMAGE/2025/03/21/131255036.4.jpg,"“필드에서 본인의 감정을 솔직히 드러냈던 장하나가 가장 찍기 좋았던 선수입니다.” 2003년부터 올해까지 23년째 한국여자프로골프(KLPGA)투어 사진작가로 활동하고 있는 박준석 작가는 20일부터 서울 강남구 캐논 갤러리에서 사진전을 열고 있다. ‘792만 번의 스윙, 792만 번…",4시간 전,https://www.donga.com/news/Sports/article/all/20250321/131257380/2,동아일보
"양자컴 20년 걸린다던 젠슨 황 “내가 틀렸다, 기술 배울것”",https://dimg.donga.com/a/296/167/95/2/wps/NEWS/IMAGE/2025/03/21/131257897.1.jpg,“이 행사는 역사상 최초로 회사 최고경영자(CEO)가 자신이 틀렸던 이유를 설명하는 행사입니다.” 20일(현지 시간) 미국 캘리포니아주 새너제이에서 열린 엔비디아 연례 개발자 회의인 ‘GTC 2025’에서는 처음으로 양자컴퓨터에 대해 논의하는 ‘양자 데이’가 열렸다. 올해 1월 미국 …,4시간 전,https://www.donga.com/news/Economy/article/all/20250321/131257598/2,동아일보
또 “고정밀 지도 달라”는 구글… 보안시설 노출 우려 넘을까,https://dimg.donga.com/a/296/167/95/2/wps/NEWS/IMAGE/2025/03/21/131255080.4.jpg,"《9년만에 또 “고정밀 지도 달라”는 구글구글이 지난달 한국 정부에 고정밀 지도의 해외 반출을 허가해 달라고 신청서를 냈다. 2007, 2016년 불허 통보를 받은 구글이 9년 만에 지도 반출을 재요청하면서 안보, 산업, 외교까지 얽힌 지도 논란이 재점화되고 있다.》구글이 지난달 국토…",4시간 전,https://www.donga.com/news/Economy/article/all/20250321/131256338/2,동아일보
‘포켓몬 고’ 출시 지연은 지도 반출 불허 탓?… 실제론 무관,,구글의 고정밀 지도 반출 요청이 대중의 관심사로 떠오른 건 2016년 무렵이다. 당시 스마트폰 증강현실(AR) 게임인 ‘포켓몬 고’가 해외에서 큰 인기를 끌었다. 국내 정식 출시 전에는 강원 속초시 등 일부 지역에서만 포켓몬 고를 이용할 수 있었다. 온라인에서 국내 서비스가 제한적인…,4시간 전,https://www.donga.com/news/Economy/article/all/20250321/131256332/2,동아일보
저축은행 작년 4000억 적자…연체율 9년만에 최고,https://dimg.donga.com/a/296/167/95/2/wps/NEWS/IMAGE/2025/03/21/131257154.1.jpg,지난해 국내 저축은행들이 4000억 원에 가까운 적자를 낸 것으로 나타났다. 부동산 프로젝트파이낸싱(PF) 부실 여파로 2년 연속 적자를 이어간 가운데 연체율도 9년 만에 최고치로 치솟았다.24일 금융감독원에 따르면 지난해 전국 79개 저축은행은 총 3974억 원의 순손실을 본 것으로…,10시간 전,https://www.donga.com/news/Economy/article/all/20250321/131255904/1,동아일보
"SK하이닉스 美 HBM 공장 건설, 주민 반대 부딪혀",https://dimg.donga.com/a/296/167/95/2/wps/NEWS/IMAGE/2025/03/21/131257072.1.jpg,SK하이닉스가 미국 인디애나주에 건설을 준비 중인 고대역폭메모리(HBM) 패키징 공장이 주민 반대에 부딪혔다.20일(현지 시간) 저널앤드쿠리어를 비롯한 인디애나주 지역 매체에 따르면 공장 용지 인허가를 심사하는 티페카누 카운티 지역계획위원회(APC)는 SK하이닉스의 공장 용지 조성안을…,10시간 전,https://www.donga.com/news/Economy/article/all/20250321/131256814/1,동아일보
“젊은 조직으로” 노루페인트 수장 교체…‘86년생’ 3세 승계 주목,https://dimg.donga.com/a/296/167/95/2/wps/NEWS/IMAGE/2025/03/21/131256753.1.jpg,"노루페인트(090350)가 4달 만에 대표 교체를 단행했다. 김용기 노루페인트(090350) 대표이사 부회장이 사임하고 이수민 노루페인트 부총괄을 신임 대표로 선임했다.노루페인트는 ‘젊은 조직으로의 체질 개선’을 교체 사유로 밝혔는데, 일각에선 3세 경영 승계를 위한 포석이란 분석도 …",11시간 전,https://www.donga.com/news/Economy/article/all/20250321/131256752/1,동아일보
"델타항공, 창립 100주년 특별 항공기 공개… “한 세기 이어온 혁신 담았다”",https://dimg.donga.com/a/296/167/95/2/wps/NEWS/IMAGE/2025/03/21/131256731.2.jpg,델타항공이 창립 100주년을 기념해 특별 도색 항공기를 선보였다.델타항공은 창립 100주년 기념 ‘델타 센테니얼 갈라(Delta Centennial Gala)’를 개최했다고 21일 밝혔다. 이번 행사에서는 100주년 기념 이벤트로 특별 도색 항공기를 공개했다.기체 도장에는 한 세기 동…,11시간 전,https://www.donga.com/news/Culture/article/all/20250321/131256747/1,동아일보
또래오래 앱 주문 시 닭다리 2개 추가 증정,https://dimg.donga.com/a/296/167/95/2/wps/NEWS/IMAGE/2025/03/21/131256451.2.png,농협목우촌 치킨브랜드 또래오래가 3월 말까지 자사 앱을 통해 주문한 고객에게 오곡후라이드 닭다리 2개를 추가로 증정하는 행사를 실시한다고 21일 밝혔다.이번 행사로 또래오래 ▲오곡양념치킨 ▲고추단짠치킨 ▲갈릭반핫양념반 ▲단짠윙봉 등 다채로운 치킨메뉴에 바삭하고 고소한 오곡후라이드 닭다…,11시간 전,https://www.donga.com/news/List/article/all/20250321/131256466/2,동아일보
"공매도, 5년 만에 전면 부활…“31일부터 재개”",https://dimg.donga.com/a/296/167/95/2/wps/NEWS/IMAGE/2025/03/21/131256432.1.jpg,"코스피200과 코스닥150 종목은 17개월, 그 외 종목은 약 5년 만의 공매도가 부활한다.금융위원회는 오는 31일부터 공매도가 재개된다고 21일 밝혔다.이번 공매도 재개는 ‘제도개선 추진’에 따라 공정한 가격형성을 저해할 우려가 해소될 수 있다는 판단에 따른 결정이다.앞서 금융당국은…",11시간 전,https://www.donga.com/news/Economy/article/all/20250321/131256431/1,동아일보
"쌍용건설, 싱가포르 우드랜드 종합병원 3개 부문 수상",https://dimg.donga.com/a/296/167/95/2/wps/NEWS/IMAGE/2025/03/21/131256356.2.jpg,"쌍용건설 조인트 벤처는 싱가포르 보건부 산하 공공병원 관리 총괄기관이 주관하는 시상식에서 우드랜드 종합병원 현장으로 공로상과 시공 부분 플래티넘, 개인 최우수상 등 총 3개 부문을 수상했다고 밝혔다.JW 메리어트 호텔 싱가포르 사우스 비치에서 열린 시상식에는 김석준 쌍용건설 회장 등 …",11시간 전,https://www.donga.com/news/List/article/all/20250321/131256386/2,동아일보
"8분기째 발묶인 전기요금…‘빚 200조’ 한전, 하루 이자만 127억 허덕",https://dimg.donga.com/a/296/167/95/2/wps/NEWS/IMAGE/2025/03/21/131255699.1.jpg,전기요금이 올해 2분기(4~6월)까지 8분기 연속 동결되면서 한국전력공사(015760)의 재정 부담도 가중될 전망이다.과거 국제 에너지 가격 급등기에 소비자 부담을 덜어주기 위해 원가보다 싸게 전기를 공급한 한전은 아직도 전기요금을 현실화하지 못해 재정난에 허덕이고 있다. 당시 누적적…,13시간 전,https://www.donga.com/news/Economy/article/all/20250321/131255158/1,동아일보
딥다이브 ‘베리시’ 성수동에 두 번째 매장 오픈… 오프라인 거점 통한 브랜드 확장 전략,https://dimg.donga.com/a/296/167/95/2/wps/NEWS/IMAGE/2025/03/21/131254709.1.jpg,여성 언더웨어 브랜드 ‘베리시(Verish)’가 서울 성수동에 두 번째 플래그십 스토어를 열었다. 강남 도산대로에 문을 연 첫 번째 매장 ‘베리시 도산’에 이은 두 번째 플래그십이다. 브랜드 운영사 딥다이브는 이번 오프라인 진출을 단순한 매출 확보 차원을 넘어 브랜드 확장과 체험 기반…,13시간 전,https://www.donga.com/news/Economy/article/all/20250321/131255543/1,동아일보
"HD현대, 故 정주영 창업자 24주기 추모행사 진행",https://dimg.donga.com/a/296/167/95/2/wps/NEWS/IMAGE/2025/03/21/131254543.2.jpg,HD현대는 21일 경기도 성남시 판교 소재 HD현대 글로벌R&D센터에서 고(故) 정주영 창업자(명예회장) 24주기 추모행사를 진행했다. 정주영 명예회장 기일은 3월 21일이다. HD현대 글로벌R&D센터 5층 청운홀에서 진행된 추모행사에는 권오갑 HD현대 회장과 정기선 수석부회장 등 주…,14시간 전,https://www.donga.com/news/Economy/article/all/20250321/131254899/1,동아일보
