title,thumbnail,short_content,write_time,link,company
"李대통령, 오늘 레오 14세 교황과 단독 면담…‘방북 요청’ 주목",https://dimg.donga.com/a/296/167/95/2/wps/NEWS/IMAGE/2026/06/15/134111009.1.jpg,바티칸을 공식 방문 중인 이재명 대통령은 15일(현지시간) 레오 14세 교황과 단독 면담에 이어 피에트로 파롤린 교황청 국무원장과도 마주앉는다.이 대통령은 전 세계 기독교인과 평화의 상징인 레오 14세 교황과 이날 오전 바티칸 교황궁에서 단독 면담을 갖는다. 2021년 10월 문재인 …,1시간 전,https://www.donga.com/news/Politics/article/all/20260615/134111008/1,동아일보
"李, 與에 “해결책 없이 편가르면 무능한 선동가”",https://dimg.donga.com/a/296/167/95/2/wps/NEWS/IMAGE/2026/06/15/134110917.1.jpg,유럽을 순방 중인 이재명 대통령은 13일(현지 시간) “현실이 없는 이상주의자는 해결책 없이 편 가르기에 집중하는 무능한 선동가가 된다”며 “여당의 열정은 ‘우리 진영’이 아니라 ‘국민 전체’를 향해야 한다”고 밝혔다. ‘검찰 보완수사권’ 폐지 등 강경 메시지를 내걸고 당권 연임 행보…,2시간 전,https://www.donga.com/news/Politics/article/all/20260615/134110529/2,동아일보
"靑내부 “정청래 ‘정권 짧다’ 발언은 협박, 여당이 정권 흔들어” 격앙",https://dimg.donga.com/a/296/167/95/2/wps/NEWS/IMAGE/2026/06/15/134110960.1.jpg,"“현실이 없는 이상주의자는 해결책 없는 편 가르기에 집중하는 무능한 선동가가 된다.” 유럽을 순방 중인 이재명 대통령은 13일(현지 시간) X(옛 트위터)에 올린 1500여 자 분량의 ‘여당과 야당, 그리고 정치적 책임’이란 제목의 글에서 이같이 밝혔다. 청와대와 더불어민주당 내에선 …",2시간 전,https://www.donga.com/news/Politics/article/all/20260615/134110175/2,동아일보
"정청래, 이르면 주내 대표직 사퇴-연임 도전",https://dimg.donga.com/a/296/167/95/2/wps/NEWS/IMAGE/2026/06/15/134110880.1.jpg,"더불어민주당 정청래 대표를 향한 친명(친이재명)계의 6·3 지방선거 결과 책임론과 연임 도전 포기 요구가 거세지는 가운데, 정 대표가 이르면 이번 주 대표직에서 사퇴하고 8·17 전당대회 출마를 준비할 것이란 관측이 나온다. 당은 7월 16, 17일경 대표와 최고위원 후보 등록을 진행…",2시간 전,https://www.donga.com/news/Politics/article/all/20260615/134110172/2,동아일보
"김민석 “선거가 준 긴장, 혁신으로 이어가야”",https://dimg.donga.com/a/296/167/95/2/wps/NEWS/IMAGE/2026/06/15/134110881.1.jpg,더불어민주당 차기 당권에 도전하는 김민석 국무총리가 “이번 (지방)선거 결과는 우리에게 긴장을 주었다”며 “(민주당이) 긴장과 혁신의 시간에 들어갈 때”라고 말했다. 당권 경쟁자 정청래 대표를 우회적으로 비판하며 민주당의 노선을 포용과 실용으로 전환할 필요가 있다는 점을 강조한 것으로…,2시간 전,https://www.donga.com/news/Politics/article/all/20260615/134110170/2,동아일보
"사퇴 요구에도 버티는 장동혁, 일부 지도부 “선관위 문제 집중” 감싸기",https://dimg.donga.com/a/296/167/95/2/wps/NEWS/IMAGE/2026/06/15/134108424.5.jpg,"6·3 지방선거 패배에 따른 국민의힘 장동혁 대표에 대한 당내 개혁파의 사퇴 압박이 계속되고 있는 가운데, 이번 주 열리는 의원총회가 현 지도부 유지 여부에 대한 중대 분수령이 될 것으로 보인다. 장 대표는 투표용지 부족 사태 대응에 집중하며 ‘퇴진론’ 불식을 시도하고 있지만, 정점식…",2시간 전,https://www.donga.com/news/Politics/article/all/20260615/134110535/2,동아일보
李 “참정권 침해 문제 악용해 부정선거 음모론 세력 고개들어”,https://dimg.donga.com/a/296/167/95/2/wps/NEWS/IMAGE/2026/06/14/134110553.1.jpg,이탈리아를 국빈 방문 중인 이재명 대통령은 14일(현지 시간) 투표용지 부족 사태에 대해 “선거 결과 조작 등등을 운운하면서 부정선거론을 퍼뜨리는 것은 이 문제의 본질을 왜곡하고 국민들의 귀한 목소리를 모욕하는 반사회적 행태”라고 비판했다. 이 대통령은 화상으로 비공개 수석보좌관회의를…,2시간 전,https://www.donga.com/news/Politics/article/all/20260615/134110531/2,동아일보
"韓-EU 등 ‘北비핵화’ 강조에… 北 “평화 가면 벗어던져, 적대 불변”",https://dimg.donga.com/a/296/167/95/2/wps/NEWS/IMAGE/2026/06/14/134105816.2.jpg,"북한이 13, 14일 이재명 정부를 비난하며 ‘핵보유국’ 지위를 주장하는 담화를 잇달아 쏟아냈다. 10일(현지 시간) 한국과 유럽연합(EU) 정상회의에서 채택한 공동성명과 11일 제6차 한미 핵협의그룹(NCG) 등에서 북한 비핵화 목표를 강조한 데 대해 반발한 것. 최근 중국, 러시아…",2시간 전,https://www.donga.com/news/Politics/article/all/20260615/134110429/2,동아일보
안규백 “연말 韓美 대통령에 전작권 전환 시기 건의해 결정”,https://dimg.donga.com/a/296/167/95/2/wps/NEWS/IMAGE/2026/06/15/134110752.1.jpg,안규백 국방부 장관이 전시작전통제권(전작권) 전환에 대해 “올해 말 양국 대통령에게 건의해 전작권 회복 X년(목표 연도)을 결정하게 될 것”이라고 말했다. 안 장관은 14일 KBS ‘일요진단’에 출연해 이재명 정부 임기(2030년) 내 전작권 전환에 관한 질문을 받고 이같이 답했다.…,2시간 전,https://www.donga.com/news/Politics/article/all/20260615/134110427/2,동아일보
李 “남북 6·15선언 희망의 불씨 살아있어… 정전 넘어 평화체제 구축 모든 걸 다할 것”,https://dimg.donga.com/a/296/167/95/2/wps/NEWS/IMAGE/2026/06/15/134110750.1.jpg,"이재명 대통령은 14일(현지 시간) 6·15 남북공동선언 26주년을 하루 앞두고 “26년 전 남북은 분단 이후 처음으로 마주 앉아 6·15 남북공동선언을 발표했다”며 “저는 지금도 그 희망의 불씨가 살아있다고 확신한다”고 밝혔다. 북한이 중국, 러시아와 밀착하며 대남 단절 기조를 이어…",2시간 전,https://www.donga.com/news/Politics/article/all/20260615/134110424/2,동아일보
"후쿠시마 원전 오염수 방류, 정전으로 일시 중단",https://dimg.donga.com/a/296/167/95/2/wps/NEWS/IMAGE/2026/06/15/134110746.1.jpg,"일본 후쿠시마 제1원자력발전소 오염수 해양 방류가 13일 일시 중단됐다가 약 5시간 반 만에 재개됐다. 정부는 정전이 순간적으로 발생해 바닷물을 보내는 펌프의 물 흐름이 약해졌고, 안전장치가 작동하면서 방류가 자동으로 멈췄다고 밝혔다. 국무조정실 김영수 국무1차장은 이날 밤 공지를 통…",2시간 전,https://www.donga.com/news/Politics/article/all/20260615/134110217/2,동아일보
"법원 “北 오물풍선 안보낼때 평양에 드론, 도발 대응 아니다”",https://dimg.donga.com/a/296/167/95/2/wps/NEWS/IMAGE/2026/06/14/134109618.1.jpg,법원이 12일 윤석열 전 대통령 등의 ‘평양 무인기(드론) 작전’ 사건 1심에서 해당 작전을 비상계엄을 위한 불법 작전으로 판단한 배경에는 정상 지휘 체계를 따르지 않고 작전을 강행한 여러 정황이 포착됐기 때문인 것으로 파악됐다. 14일 내란 특검(특별검사 조은석) 등에 따르면 서울중…,2시간 전,https://www.donga.com/news/Society/article/all/20260615/134109875/2,동아일보
“유전자 교정 현실로… 5년 내 국산 유전자 치료제 나온다”,https://dimg.donga.com/a/296/167/95/2/wps/NEWS/IMAGE/2026/06/14/134110277.1.jpg,미국 컬럼비아대 연구팀은 인간 배아에서 심장 질환과 빈혈을 유발하는 유전자를 교정하는 데 성공하고 이달 1일 논문 사전공개 사이트 ‘바이오아카이브’에 연구 결과를 공개했다. 인간 배아 단계에서 유전적 원인으로 발생할 수 있는 심장질환을 한 번의 유전자 교정으로 치료할 수 있음을 입증한…,6시간 전,https://www.donga.com/news/It/article/all/20260614/134107047/2,동아일보
李 “참정권 침해 문제 악용해 부정선거 음모론 세력 고개들어”,https://dimg.donga.com/a/296/167/95/2/wps/NEWS/IMAGE/2026/06/14/134110553.1.jpg,이탈리아를 국빈 방문 중인 이재명 대통령은 14일(현지 시간) 투표용지 부족 사태에 대해 “선거 결과 조작 등등을 운운하면서 부정선거론을 퍼뜨리는 것은 이 문제의 본질을 왜곡하고 국민들의 귀한 목소리를 모욕하는 반사회적 행태”라고 비판했다.이 대통령은 화상으로 비공개 수석보좌관회의를 …,8시간 전,https://www.donga.com/news/Politics/article/all/20260614/134107439/1,동아일보
"靑, 北 NCG 성명 반발에 “한미 확장억제 협력은 책임있는 정부 의무”",https://dimg.donga.com/a/296/167/95/2/wps/NEWS/IMAGE/2026/06/14/134110224.1.jpg,청와대는 14일 한미 핵협의그룹(NCG)에서 북한 비핵화 공동 목표를 확인한 것에 북한이 반발하자 “한미의 확장억제 협력은 국민의 생명과 안전을 보호하는 책임있는 정부로서의 의무”라고 밝혔다. 청와대 관계자는 “이는 NPT(핵확산금지조약)를 포함한 국제 비확산 체제와 규범에도 전적으로…,10시간 전,https://www.donga.com/news/Politics/article/all/20260614/134110223/1,동아일보
"법원 “北서 오물풍선 안보낼때 드론 작전, 도발 대응 아니다”",https://dimg.donga.com/a/296/167/95/2/wps/NEWS/IMAGE/2026/06/14/134109618.1.jpg,법원이 12일 윤석열 전 대통령 등의 ‘평양 무인기(드론) 작전’ 사건 1심에서 해당 작전을 비상계엄을 위한 불법 작전으로 판단한 배경에는 정상 지휘 체계를 따르지 않고 작전을 강행한 여러 정황이 포착됐기 때문인 것으로 파악됐다.14일 내란 특검(특별검사 조은석) 등에 따르면 서울중앙…,11시간 전,https://www.donga.com/news/Society/article/all/20260614/134107970/1,동아일보
“대안 없어” vs “사퇴해야”…의원총회 장동혁 거취 분수령,https://dimg.donga.com/a/296/167/95/2/wps/NEWS/IMAGE/2026/06/14/134109599.1.jpg,"6·3 지방선거 패배에 따른 국민의힘 장동혁 대표에 대한 당내 개혁파의 사퇴 압박이 계속되고 있는 가운데, 이번주 중 열리는 의원총회가 현 지도부 유지 여부에 대한 중대 분수령이 될 전망이다. 장 대표는 투표용지 부족 사태 대응에 집중하며 ‘퇴진론’ 불식을 시도하고 있지만, 정점식 신…",11시간 전,https://www.donga.com/news/Politics/article/all/20260614/134109138/1,동아일보
"李 “6·15 남북공동선언, 역사 전환점…희망의 불씨 살아있다 믿어”",https://dimg.donga.com/a/296/167/95/2/wps/NEWS/IMAGE/2026/06/14/134108969.3.jpg,"이재명 대통령은 14일(현지시간) 이탈리아 로마 성 바오로 대성당에서 열린 평화와 연대를 위한 특별 미사에 참석해 “한반도의 평화가 세계평화로 이어지고, 세계의 연대가 다시 한반도의 평화를 굳건하게 만드는 선순환을 함께 만들어 가길 희망한다”고 밝혔다.이 대통령은 이날 기념연설에서 “…",13시간 전,https://www.donga.com/news/Politics/article/all/20260614/134109057/2,동아일보
日 후쿠시마 원전 오염수 방류 재개…정부 “순간 정전으로 방류 일시 중단”,https://dimg.donga.com/a/296/167/95/2/wps/NEWS/IMAGE/2026/06/14/134108763.1.jpg,"일본 후쿠시마 제1원자력발전소 오염수 해양 방류가 13일 일시 중단됐다가 약 5시간 반 만에 재개됐다. 정부는 정전이 순간적으로 발생해 바닷물을 보내는 펌프의 물 흐름이 약해졌고, 안전장치가 작동하면서 방류가 자동으로 멈췄다고 밝혔다. 국무조정실 김영수 국무1차장은 이날 밤 공지를 통…",14시간 전,https://www.donga.com/news/Politics/article/all/20260614/134108258/1,동아일보
鄭 “정권은 짧다”에…靑 내부 “대통령 탄핵 협박 아니냐” 분노,https://dimg.donga.com/a/296/167/95/2/wps/NEWS/IMAGE/2026/06/14/134108120.1.jpg,더불어민주당 정청래 대표의 “국민은 영원하고 정권은 짧다”는 발언을 두고 청와대 내부에서 “사실상 대통령을 탄핵하자는 협박 아니냐”는 반응이 나온 것으로 알려졌다. 이재명 대통령이 8일 지방선거 결과에 대해 “국민이 이 정권에 주는 경고”라고 평가한 직후 정 대표가 사실상 연임 도전 …,14시간 전,https://www.donga.com/news/Politics/article/all/20260614/134107753/1,동아일보
"안규백 “전작권 전환 목표 연도, 연말 韓美 대통령에 건의”",https://dimg.donga.com/a/296/167/95/2/wps/NEWS/IMAGE/2026/06/14/134108038.1.jpg,안규백 국방부 장관이 전시작전통제권(전작권) 전환에 대해 “올해 연말 양국 대통령에게 건의해 전작권 회복 X년(목표 연도)을 결정하게 될 것”이라고 말했다. 안 장관은 14일 KBS ‘일요진단’에 출연해 이재명 정부 임기(2030년) 내 전작권 전환에 관한 질문을 받고 이같이 답했다.…,15시간 전,https://www.donga.com/news/Politics/article/all/20260614/134107658/1,동아일보
"‘주말 잠행’ 정청래, 이르면 이번주 연임 도전…‘친명’선 포기 압박",https://dimg.donga.com/a/296/167/95/2/wps/NEWS/IMAGE/2026/06/14/134107514.1.jpg,더불어민주당 정청래 대표가 이르면 이번 주 대표직에서 사퇴하고 8·17 전당대회에서 연임에 도전할 것이란 관측이 나오는 가운데 친명(친이재명)계에서 정 대표를 향한 6·3 지방선거 패배 책임론과 연임 도전 포기 요구가 거세지고 있다. 당권 주자로 거론되는 김민석 국무총리는 14일 오후…,16시간 전,https://www.donga.com/news/Politics/article/all/20260614/134107327/1,동아일보
국힘 지도부 “장동혁 사퇴 의사 밝힌 바 없어…거취 논할 단계 아냐”,https://dimg.donga.com/a/296/167/95/2/wps/NEWS/IMAGE/2026/06/14/134106747.1.jpg,국민의힘 지도부는 14일 6·3 지방선거 이후 당 안팎에서 장동혁 대표의 책임론이 나오는 것과 관련 “장 대표가 사퇴 의사를 밝힌 바가 없다”며 선을 그었다.최보윤 수석대변인은 이날 국회에서 기자들과 만나 “장 대표가 거취 문제와 관련해 사퇴 의사를 밝힌 바가 없다”며 “당헌·당규에 …,18시간 전,https://www.donga.com/news/Politics/article/all/20260614/134106746/1,동아일보
"조승래, ‘與 책임’ 강조한 李 메시지에 “국정 운영 책임성 강조한 것”",https://dimg.donga.com/a/296/167/95/2/wps/NEWS/IMAGE/2026/06/14/134106744.1.jpg,조승래 더불어민주당 사무총장이 14일 ‘집권 여당은 신념의 언어보다는 책임의 언어에 더 집중해야 한다’는 이재명 대통령의 메시지가 정청래 대표를 겨냥한 것이라는 해석이 나오는 데 대해 “대통령의 뜻을 왜곡하는 것”이라고 했다.조 사무총장은 이날 국회에서 열린 기자간담회에서 ‘이 대통령…,18시간 전,https://www.donga.com/news/Politics/article/all/20260614/134106743/1,동아일보
장동혁 “여당 바뀌길 원하면 李대통령 본인부터 바꿔야”,https://dimg.donga.com/a/296/167/95/2/wps/NEWS/IMAGE/2026/06/14/134106639.2.jpg,국민의힘 장동혁 대표는 이재명 대통령이 여당의 ‘책임’을 강조한 데 대해 “구구절절 옳은 말”이라면서도 “문제는 그렇게 잘 아는 사람이 지금껏 어떻게 해왔냐는 것”이라고 비판했다.장 대표는 14일 페이스북에서 “(이 대통령은) 그 긴 글 가운데 정작 자신이 지킨 건 하나라도 있나”라고…,19시간 전,https://www.donga.com/news/Politics/article/all/20260614/134106619/2,동아일보
법사위원장 놓고 격돌…민주 “절대 못 넘겨” vs 국힘 “특검법 폭주 견제”,https://dimg.donga.com/a/296/167/95/2/wps/NEWS/IMAGE/2026/06/14/134106450.3.jpg,여야가 22대 국회 후반기 원 구성과 관련해 법제사법위원장 자리를 놓고 신경전을 벌였다.14일 국민의힘 최보윤 수석대변인은 논평을 내고 “이 정권의 사법 파괴 책동을 막아내기 위해 야당이 법사위원장직을 반드시 맡아야 한다”고 밝혔다.그는 법무부가 산하에 ‘검찰인권존중미래위원회’를 발족…,19시간 전,https://www.donga.com/news/Politics/article/all/20260614/134106440/2,동아일보
주식 팔아 강남 집 샀다…4개월간 3.7조 주택시장 유입,https://dimg.donga.com/a/296/167/95/2/wps/NEWS/IMAGE/2026/06/14/134106426.1.jpg,"올해 들어 주식·채권을 처분해 마련한 자금 3조7000억원이 주택시장에 유입된 것으로 파악됐다. 이 가운데 약 65%인 2조4000억원은 서울 주택 구매에 사용됐으며, 특히 강남 3구에 집중된 것으로 나타났다.14일 국회 국토교통위원회 소속 김종양 국민의힘 의원이 국토교통부로부터 제출…",20시간 전,https://www.donga.com/news/Politics/article/all/20260614/134106425/1,동아일보
"장동혁, 李대통령 ‘여당의 책무’ SNS글에 “먼저 본인부터 바꿔야”",https://dimg.donga.com/a/296/167/95/2/wps/NEWS/IMAGE/2026/06/14/134106403.1.jpg,장동혁 국민의힘 대표는 14일 이재명 대통령이 전날 SNS에 게시한 ‘여당과 야당 그리고 정치적 책임’ 글과 관련해 “그 긴 글 가운데 정작 자신이 지킨 건 하나라도 있나”라고 밝혔다.장 대표는 이날 오전 자신의 페이스북에 “여당이 바뀌길 원하는가. 그러면 먼저 본인부터 바꿔야 한다”…,20시간 전,https://www.donga.com/news/Politics/article/all/20260614/134106402/1,동아일보
"안규백 “전작권 전환 목표 연도, 연말 한미 대통령에 건의”",https://dimg.donga.com/a/296/167/95/2/wps/NEWS/IMAGE/2026/06/14/134106397.1.jpg,안규백 국방부 장관이 14일 올해 연말 한국의 전시작전통제권(전작권) 전환 목표 시기를 한미 양국 대통령에 건의할 것이라고 말했다. 안 장관은 이날 오전 KBS 일요진단에 출연해 “완전운용능력(FOC) 검증을 올해 11월 가을 미국 국방부 장관과 한미안보협의회(SCM)에서 논의하게 될…,20시간 전,https://www.donga.com/news/Politics/article/all/20260614/134106396/1,동아일보
"나경원 “오세훈, 재선거해도 압승…6·3 부정선거, 책임은 李대통령”",https://dimg.donga.com/a/296/167/95/2/wps/NEWS/IMAGE/2026/06/14/134106366.1.jpg,나경원 국민의힘 의원이 14일 6·3 지방선거에서 5선에 성공한 오세훈 서울시장이 재선거를 치러도 압승을 거둘 것이라고 강조했다. 또 ‘투표용지 부족’ 사태를 부정선거로 언급하며 이재명 대통령에게 책임이 있다고 했다.나 의원은 자신의 소셜네트워크서비스(SNS)를 통해 “일각에서 오세훈…,20시간 전,https://www.donga.com/news/Politics/article/all/20260614/134106365/1,동아일보
국힘 “野 법사위원장직 사수가 지방선거 민심 따르는 길”,https://dimg.donga.com/a/296/167/95/2/wps/NEWS/IMAGE/2026/06/14/134106212.1.jpg,국민의힘은 14일 “이재명 정권의 사법 파괴 책동을 막아내야 한다”며 후반기 국회 법제사법위원장직을 야당이 맡아야 한다고 재차 주장했다.최보윤 수석대변인은 이날 논평에서 “야당이 법사위원장직을 사수해 국회의 견제 기능을 온전히 복원하는 것만이 권력의 사유화를 막으라는 6·3 지방선거의…,20시간 전,https://www.donga.com/news/Politics/article/all/20260614/134106211/1,동아일보
한동훈에 패한 하정우 “수첩 들고 다시 구포시장으로”,https://dimg.donga.com/a/296/167/95/2/wps/NEWS/IMAGE/2026/06/14/134105902.1.jpg,"부산 북갑 국회의원 보궐선거에서 무소속 한동훈 의원에게 패한 하정우 전 대통령AI미래기획수석비서관이 북구 구포시장을 찾으며 활동을 재개했다.하 전 수석은 11일 페이스북에 “제 발걸음은 자연스럽게 다시 구포시장으로 향한다”며 “아침 문을 여는 소리, 국수 삶는 김, 손님을 부르는 상인…",22시간 전,https://www.donga.com/news/Politics/article/all/20260614/134105858/2,동아일보
北 “비핵화는 되돌릴 수 없이 종결된 사안”…한미 NCG회의에 반발,https://dimg.donga.com/a/296/167/95/2/wps/NEWS/IMAGE/2026/06/14/134105816.2.jpg,북한은 한미가 확장억제 협의체인 핵협의그룹(NCG) 회의를 열고 북한 비핵화 공동목표를 확인했다고 밝힌 데 대해 “비핵화는 최종적으로 되돌릴 수 없이 종결된 사안”이라고 반발했다.북한 외무성 대변인은 14일 당 기관지 노동신문을 통해 발표한 담화에서 “미국과 추종 세력들의 무의미한 반…,23시간 전,https://www.donga.com/news/Politics/article/all/20260614/134105809/2,동아일보
"정부 “日 후쿠시마원전, 오염수 방출 중단했다 5시간만에 재개”",https://dimg.donga.com/a/296/167/95/2/wps/NEWS/IMAGE/2026/06/14/134105665.1.jpg,일본 후쿠시마 원전의 20차 방사성 오염수 해양 방류가 중지됐다가 5시간 만에 재개됐다.국무조정실 김영수 국무1차장은 14일 문자공지를 통해 “13일 오후10시34분께 오염수 20차 방류가 재개됐다”고 밝혔다.정부는 방류 자동 정지 원인에 대해 순간 정전에 의한 해수 이송펌프의 유량 …,1일 전,https://www.donga.com/news/Politics/article/all/20260614/134105664/1,동아일보
"李대통령, 오늘 교황청 공식 방문…‘평화·연대’ 특별 미사서 연설",https://dimg.donga.com/a/296/167/95/2/wps/NEWS/IMAGE/2026/06/14/134105658.1.jpg,"이탈리아 국빈 일정을 마친 뒤 이재명 대통령은 14~15일(현지시간) 바티칸을 방문한다. 이 대통령은 14일 오전 성 바오로 성당에서 평화와 연대를 위한 특별 미사에 참석하고, 기념 연설로 교황청 공식 방문을 시작한다.한국인으로서 성직자부 장관에 최초로 임명된 유흥식 추기경을 비롯해 …",1일 전,https://www.donga.com/news/Politics/article/all/20260614/134105657/1,동아일보
불 붙는 與 당권경쟁…최고위원도 친명·친청 경쟁 가시화,https://dimg.donga.com/a/296/167/95/2/wps/NEWS/IMAGE/2026/06/14/134105639.1.jpg,오는 8월 더불어민주당의 차기 지도부를 선출하는 전당대회를 앞두고 당 대표 뿐 아니라 최고위원 선출을 두고도 친명·친청 구도가 뚜렷해질 것이라는 관측이 나온다. 양측은 벌써부터 최고위원회 과반을 차지하기 위해 진용을 꾸리고 있다.민주당은 오는 8월 17일 지도부 선출을 위한 전당대회를…,1일 전,https://www.donga.com/news/Politics/article/all/20260614/134105638/1,동아일보
韓-EU 공동성명에 北 반발…靑 “긴 안목으로 평화공존 정책 추진”,https://dimg.donga.com/a/296/167/95/2/wps/NEWS/IMAGE/2026/06/14/134105612.1.jpg,청와대는 14일 한국과 유럽연합(EU)이 정상회의에서 채택한 공동성명에 대해 북한이 “주권 침해”라며 반발한 것을 두고 “정부는 긴 안목을 가지고 한반도 평화공존 정책을 일관되게 추진할 것”이라고 밝혔다.청와대는 이날 “EU도 한반도의 긴장 완화와 평화 정착을 위한 우리 정부의 정책을…,1일 전,https://www.donga.com/news/Politics/article/all/20260614/134105598/1,동아일보
"정부 “日후쿠시마 원전, 오염수 방출 중지…이송 공정 경보 발생”",https://dimg.donga.com/a/296/167/95/2/wps/NEWS/IMAGE/2026/06/13/134105423.1.jpg,일본 후쿠시마 원전의 20차 방사성 오염수 해양 방류가 이송 공정 경보 발생으로 중지됐다.국무조정실 김영수 국무1차장은 13일 문자공지를 통해 이같이 전했다.정부에 따르면 도쿄전력은 지난 11일 재개되었던 20차 오염수 방류가 이날 오후 5시4분께 오염수 이송 공정 경보 발생으로 자동…,1일 전,https://www.donga.com/news/Politics/article/all/20260613/134105422/1,동아일보
"李 “與, 방해 뚫고 국민 먹고사는 문제 해결해야…구호 말고 실행 집중하라”",https://dimg.donga.com/a/296/167/95/2/wps/NEWS/IMAGE/2026/06/13/134105376.1.jpg,이재명 대통령은 13일(현지시간) “여당(與黨)의 열정은 ‘우리 진영’이 아니라 ‘국민 전체’를 향해야 한다”고 밝혔다.이탈리아 국빈 방문 중인 이 대통령은 이날 엑스(X)에 더불어민주당을 향해 “여당의 사전적 의미는 더불어 함께 하는 무리”라며 이같이 말했다.이 대통령은 “여당은 국…,1일 전,https://www.donga.com/news/Politics/article/all/20260613/134105375/1,동아일보
