title,thumbnail,short_content,write_time,link,company
"동원F&B, 1400억 투입 ‘단백질식품 생산기지’ 가동",https://dimg.donga.com/a/296/167/95/2/wps/NEWS/IMAGE/2026/06/14/134108814.4.png,동원그룹 식품 부문 계열사 동원F&B가 충북 진천군에 대규모 단백질 식품 생산기지를 구축하고 K푸드 글로벌 시장 확대에 속도를 낸다. 동원F&B는 진천 제2사업장을 준공하고 본격적인 가동에 돌입했다고 14일 밝혔다. 총 1400억 원이 투입된 진천 제2사업장은 연면적 약 2만6446m…,6시간 전,https://www.donga.com/news/Economy/article/all/20260614/134109141/2,동아일보
"강예원, 돌아가신 父 빚 11억 몰랐다…“막막함에 눈물”",https://dimg.donga.com/a/296/167/95/2/wps/NEWS/IMAGE/2026/06/15/134111130.1.jpg,"배우 강예원이 부친상 이후 11억 원 규모의 채무를 마주한 심경을 고백했다.지난 14일 방송된 SBS TV 예능물 ‘미운 우리 새끼’에서 강예원은 법률사무소를 찾아 상속 상담을 받았다. 변호사는 부친이 남긴 빚이 10억에서 11억 원에 달하며, 이 중 3억 원은 당장 상환해야 한다고 …",13분 전,https://www.donga.com/news/Culture/article/all/20260615/134111129/1,동아일보
"‘런닝맨’ 김동현, 학창 시절 터보 찐팬 인증…김종국 ‘흐뭇’",https://dimg.donga.com/a/296/167/95/2/wps/NEWS/IMAGE/2026/06/15/134110999.1.jpg,김동현이 학창 시절부터 터보의 열혈 팬이었다는 사실이 공개돼 김종국을 흐뭇하게 했다.지난 14일 방송된 SBS 예능 프로그램 ‘런닝맨’은 ‘너희 집에 살짝 들렀어’ 특집으로 꾸며졌다. 게스트로는 이종격투기 선수 출신 방송인 김동현과 오마이걸 미미가 출연했다.이날 멤버들은 넷째 출산을 …,1시간 전,https://www.donga.com/news/Entertainment/article/all/20260615/134110998/1,동아일보
"강예원, 부친이 남긴 11억 빚에도…“직원들 급여는 꼭 해결”",https://dimg.donga.com/a/296/167/95/2/wps/NEWS/IMAGE/2026/06/15/134110991.1.jpg,배우 강예원이 부친상 이후 힘겨웠던 시간을 고백했다.지난 14일 오후 방송된 SBS 예능 프로그램 ‘미운 우리 새끼’에서는 강예원의 일상이 공개됐다.이날 강예원은 4월 말 세상을 떠난 아버지를 떠올리며 힘들었던 시간을 털어놨다. 그는 아버지 병간호를 하면서 “(지난해) 12월부터 3월…,1시간 전,https://www.donga.com/news/Entertainment/article/all/20260615/134110990/1,동아일보
이경규 “닭 사업 망해…남은 닭 사자·호랑이 먹이로”,https://dimg.donga.com/a/296/167/95/2/wps/NEWS/IMAGE/2026/06/15/134110970.1.jpg,코미디언 이경규가 닭 사업을 시작했다가 실패했었다고 했다.이경규는 14일 방송한 KBS 2TV 예능프로그램 ‘사장님 귀는 당나귀 귀’에서 양준혁이 운영하는 양식장에 갔다가 사업 관련 얘기를 했다.이경규는 “사업이라는 게 쉬운 일이 아니다. 특히 자연과 함께하는 사업이 정말 어렵다. 이…,2시간 전,https://www.donga.com/news/Entertainment/article/all/20260615/134110969/1,동아일보
[오늘의 채널A]남편 빼앗고 남동생까지 유혹한 여성,,남편 빼앗고 남동생까지 유혹한 여성 ‘사건 수첩’에서는 의뢰인의 남편을 빼앗은 한 여성이 자신의 남동생까지 유혹한 사건을 파헤친다. ‘탐정 24시’에서는 지난주에 이어 16년 전 연락이 끊긴 시어머니를 찾는 사연을 전한다. 탐정단은 수소문 끝에 시어머니와 같이 근무했던 사람을 찾게 되…,2시간 전,https://www.donga.com/news/Entertainment/article/all/20260615/134110072/2,동아일보
"‘임신’ 이다해, ‘뼈말라’ 시절 그리웠나…“맞는 옷 찾기 힘들어” 속상",https://dimg.donga.com/a/296/167/95/2/wps/NEWS/IMAGE/2026/06/15/134110677.1.jpg,최근 임신 소식을 전했던 배우 이다해가 달라진 몸매에 과거를 회상했다.이다해는 14일 자신의 인스타그램에 “작년 9월의 나”라며 “아직 1년도 안 됐는데 왜 이렇게 옛날 같을까?”라는 글을 게재했다.그는 이어 “요즘보다 훨씬 많이 먹었던 것 같은데 지지배(계집애) 말랐었네”라며 “지금…,7시간 전,https://www.donga.com/news/Entertainment/article/all/20260615/134110676/1,동아일보
"‘1박2일’ 문세윤, 얼음장 계곡서 이기택 업고 이동… “훈훈한 선배미”",https://dimg.donga.com/a/296/167/95/2/wps/NEWS/IMAGE/2026/06/15/134110669.1.jpg,문세윤이 이기택의 든든한 지원군으로 나서며 훈훈함을 자아냈다.14일 오후 방송된 KBS2 예능 프로그램 ‘1박2일’은 ‘자급자족 오지 생활’ 특집으로 꾸며졌다. 이날 멤버들이 강원도 정선을 찾았다.멤버들은 베이스캠프로 이동하기 위해 얼음장 같은 계곡물을 맨발로 건너야 했다. 멤버들은 …,7시간 전,https://www.donga.com/news/Entertainment/article/all/20260615/134110668/1,동아일보
데뷔 13주년 방탄…RM “우리만 아는 추억 쌓아가자”,https://dimg.donga.com/a/296/167/95/2/wps/NEWS/IMAGE/2026/06/15/134110666.1.jpg,그룹 방탄소년단 RM이 13일 부산 공연을 마친 뒤 팬에게 “계속 우리만 아는 추억과 기념할 날을 쌓으려 한다”고 말했다. 이날은 방탄소년단 데뷔 13주년이었다.RM은 이날 방탄소년단 월드투어 ‘아리랑’ 인 부산(BTS WORLD TOUR ‘ARIRANG’ IN BUSAN) 2회차 공…,7시간 전,https://www.donga.com/news/Culture/article/all/20260615/134110665/1,동아일보
"이상이, 슈트 입고 완성한 조각 비주얼…훈훈함 ‘한도 초과’",https://dimg.donga.com/a/296/167/95/2/wps/NEWS/IMAGE/2026/06/15/134110660.1.jpg,배우 이상이가 슈트 차림의 훈훈한 외모로 팬들을 설레게 했다.이상이는 14일 자신의 사회관계망서비스(SNS) 계정을 통해 여러 장의 사진을 공개했다.공개된 사진 속 이상이는 블랙 슈트와 넥타이를 착용한 채 카메라를 바라보고 있다. 특히 손으로 동그라미를 만들어 한쪽 눈에 갖다 댄 유쾌…,7시간 전,https://www.donga.com/news/Entertainment/article/all/20260615/134110659/1,동아일보
"한혜진, 유부녀들 매운맛 토크에 진땀…“얼굴 알려진 사람? 또?”",https://dimg.donga.com/a/296/167/95/2/wps/NEWS/IMAGE/2026/06/15/134110656.1.jpg,"모델 겸 방송인 한혜진이 이상형 질문에 재치 있는 답변으로 웃음을 자아냈다.14일 오후 방송된 SBS 예능 프로그램 ‘미운 우리 새끼’에서는 모델 이혜정의 럭셔리 대저택이 공개됐다.이날 한혜진과 야노 시호는 배우 이희준의 아내인 이혜정의 집을 방문했고, 세 사람은 함께 식사하며 다양한…",7시간 전,https://www.donga.com/news/Entertainment/article/all/20260615/134110655/1,동아일보
"‘이희준 아내’ 이혜정, ‘미우새’서 셰프 못지않은 요리 실력 과시…감탄",https://dimg.donga.com/a/296/167/95/2/wps/NEWS/IMAGE/2026/06/15/134110649.1.jpg,배우 이희준의 아내이자 농구선수 출신 모델 이혜정이 수준급 요리 실력을 뽐내며 한혜진과 야노 시호의 감탄을 자아냈다.14일 오후 방송된 SBS 예능 프로그램 ‘미운 우리 새끼’에서는 모델 이혜정의 럭셔리 대저택이 공개됐다.이날 한혜진과 야노시호는 이혜정의 집을 방문해 집들이를 즐겼다.…,7시간 전,https://www.donga.com/news/Entertainment/article/all/20260615/134110648/1,동아일보
"샤이니 키, SNS 재개 “진심으로 감사” 논란 후 6개월만",https://dimg.donga.com/a/296/167/95/2/wps/NEWS/IMAGE/2026/06/15/134110646.1.jpg,그룹 샤이니 키가 이른바 주사이모 논란 후 약 6개월만에 소셜미디어 활동을 재개했다. 그는 공연에 함께해준 팬을 향해 감사 인사를 했다.키는 14일 인스타그램에 멤버들과 함께 찍은 사진을 올리며 “케이스포돔과 베루나돔 공연까지 덕분에 무사히 마칠 수 있었다. 무대 위에서 여러분과 함께…,7시간 전,https://www.donga.com/news/Entertainment/article/all/20260615/134110645/1,동아일보
바타 감싼 지예은 “내 남친 잘 모르면서 그런 말 하지마”,https://dimg.donga.com/a/296/167/95/2/wps/NEWS/IMAGE/2026/06/15/134110643.1.jpg,방송인 지예은이 남자친구인 바타에 대한 험담을 하는 ‘런닝맨’ 멤버를 향해 “내 남친한테 뭐라고 하지 마라”고 했다.지예은은 14일 방송한 SBS TV 예능프로그램 ‘런닝맨’에서 멤버들과 함께 차를 타고 게스트 김동현 집으로 가면서 남자친구 얘기를 했다.또 다른 게스트인 미미가 자신의…,7시간 전,https://www.donga.com/news/Entertainment/article/all/20260615/134110642/1,동아일보
"“남편 백도빈, 5개월 만에 20㎏ 감량”…정시아가 공개한 비법",https://dimg.donga.com/a/296/167/95/2/wps/NEWS/IMAGE/2026/06/15/134110636.1.jpg,"배우 정시아가 남편 백도빈이 5개월 만에 20㎏을 감량한 비법을 공개했다.12일 정시아가 운영하는 유튜브 채널에는 ‘말로만 듣던 정시아 요리 실력 최초 공개, 남편 백집사에게 전수 받은 일본 카레 레시피’라는 제목의 영상이 올라왔다. 영상 속 정시아는 주방에서 직접 요리를 선보이며 남…",7시간 전,https://www.donga.com/news/Culture/article/all/20260615/134110635/1,동아일보
“혈당스파이크 막아 준다더라” 장윤정이 먹은 땅콩버터 효능은?,https://dimg.donga.com/a/296/167/95/2/wps/NEWS/IMAGE/2026/06/15/134110628.1.jpg,"가수 장윤정이 평소 식습관에 대해 밝혔다.지난 11일 유튜브 ‘달라 스튜디오’에는 ‘완전 럭키 네고가잖아~? 고소달달하게 7로 통일한 건강 간식 네고’라는 제목의 영상이 업로드됐다. 장윤정이 ‘옳곡’ 브랜드를 만나 제품 가격 협상에 나서는 모습이 담겼는데, 영상 초반 장윤정이 자신의 …",7시간 전,https://www.donga.com/news/Culture/article/all/20260615/134110627/1,동아일보
"박세미, 20㎏ 빼고 미모 리즈 경신…‘요요 제로’ 유쾌한 다이어트의 비밀",https://dimg.donga.com/a/296/167/95/2/wps/NEWS/IMAGE/2026/06/15/134110623.1.jpg,코미디언 박세미가 20㎏ 감량 성공 소식과 함께 자신만의 다이어트 유지 비결을 솔직하게 털어놨다. 박세미는 지난 11일 방송된 SBS 파워FM ‘두시탈출 컬투쇼’에 게스트로 출연해 몰라보게 가벼워진 모습으로 청취자들을 만나 화제를 모았다. 이날 방송에서 요요 현상 없이 체중을 유지하는…,7시간 전,https://www.donga.com/news/Entertainment/article/all/20260615/134110622/1,동아일보
"이경규, 건강이상설 또 일축 “전혀 문제 없다…멀쩡해”",https://dimg.donga.com/a/296/167/95/2/wps/NEWS/IMAGE/2026/06/14/134109555.1.jpg,코미디언 이경규가 최근 불거진 건강이상설을 재차 일축했다.이경규는 13일 방송한 MBC TV 예능프로그램 ‘놀면 뭐하니?’에 코미디언 이윤석과 함께 출연했다.유재석은 이경규에게 “최근 용만이 형과 골프 콘텐츠를 자주 찍으시지 않나. 저도 자주 보는데 댓글 중에 ‘건강에 문제가 있다’는…,11시간 전,https://www.donga.com/news/Entertainment/article/all/20260614/134109554/1,동아일보
황신혜 “유튜브 채널 해킹 당해 사라져…복구 중”,https://dimg.donga.com/a/296/167/95/2/wps/NEWS/IMAGE/2026/06/14/134109550.1.jpg,배우 황신혜가 운영 중인 유튜브 채널에 해킹 당했다.황신혜는 13일 소셜미디어에 “제 유튜브 계정이 최근에 해킹을 당해서 지금 사라진 상태”라고 말했다.그는 “정말 당황스럽지만 열심히 복구하고 있으니 조금만 기다려달라. 곧 다시 돌아올 테니 응원 부탁한다”고 했다.황신혜는 7년 간 유…,11시간 전,https://www.donga.com/news/Entertainment/article/all/20260614/134109549/1,동아일보
버즈 사실상 해체 “완전체 활동 어려워…민경훈 지원”,https://dimg.donga.com/a/296/167/95/2/wps/NEWS/IMAGE/2026/06/14/134109545.1.jpg,밴드 버즈가 사실상 해체됐다. 소속사는 보컬 민경훈 솔로 활동을 지원한다고 했다.소속사 롱플레이뮤직은 13일 공식 소셜미디어에 “현재 버즈는 멤버들과의 전속 계약이 종료됨에 따라 당사는 민경훈님의 솔로 활동을 지원하는 데 집중하고 있다”고 말했다.그러면서 “당분간 원년 멤버 전원이 함…,11시간 전,https://www.donga.com/news/Entertainment/article/all/20260614/134109544/1,동아일보
김동완 “돌아보니 무책임한 짓 많이 해…새삼 깨달아”,https://dimg.donga.com/a/296/167/95/2/wps/NEWS/IMAGE/2026/06/14/134109540.1.jpg,"그룹 신화 김동완이 그간 자신의 언행이 무책임했다고 반성했다.김동완은 13일 소셜미디어에 한 마케터와 상담을 했다며 ‘동완씨와 함께 일하는 사람들의 가족들을 생각해 본 적이 있어요?’라는 말을 들었다고 했다.김동완은 “눈이 번쩍 뜨이는 말이었다. 내 실수로 어떤 일이 망가졌을 때, 그…",11시간 전,https://www.donga.com/news/Entertainment/article/all/20260614/134109539/1,동아일보
