title,thumbnail,short_content,write_time,link,company
"SK하닉 “AI 발전, 메모리 혁신 필요…HBM 앞으로도 게임체인저”",https://dimg.donga.com/a/296/167/95/2/wps/NEWS/IMAGE/2025/11/03/132693042.1.jpg,김호식 SK하이닉스 메모리시스템 연구센터 부사장은 3일 “컴퓨팅 패러다임이 메모리 중심으로 변하고 있다”며 “인공지능(AI) 시스템의 발전을 위해 메모리 혁신이 필요하다”고 강조했다.김 부사장은 이날 오후 서울 강남구 코엑스에서 열린 ‘SK AI 서밋 2025’ ‘새로운 반도체 설루션…,2시간 전,https://www.donga.com/news/Economy/article/all/20251103/132693041/1,동아일보
‘식스센스’ PD 성추행 의혹…“허위 주장” vs “강제 추행” 입장 팽팽,https://dimg.donga.com/a/296/167/95/2/wps/NEWS/IMAGE/2025/11/03/132693628.3.jpg,"tvN 예능 ‘식스센스’ PD가 직장 내 성추행 혐의로 고소됐다. 피해자는 강제추행과 프로그램 하차를 주장했으며, PD는 “허위 주장일 뿐”이라며 전면 부인했다.",1시간 전,https://www.donga.com/news/Society/article/all/20251103/132693576/2,동아일보
"아이들 미연 “3년 6개월 만의 솔로 컴백, 열심히 준비해”",https://dimg.donga.com/a/296/167/95/2/wps/NEWS/IMAGE/2025/11/03/132693595.1.jpg,"그룹 아이들 미연이 솔로 컴백을 하게 된 소감을 전했다.3일 오후 서울 용산구 이태원로에 위치한 블루스퀘어 SOL트래블홀에서는 아이들 미연의 솔로 미니 2집 ‘마이, 러버’(My, Lover) 발매 기념 미디어 쇼케이스가 열렸다. 이 자리에서 미연은 신곡 무대를 처음으로 선보이고 신보…",2시간 전,https://www.donga.com/news/Entertainment/article/all/20251103/132693594/1,동아일보
“전이 빨라 항암치료”…조권 반려견 암투병에 응원 물결,https://dimg.donga.com/a/296/167/95/2/wps/NEWS/IMAGE/2025/11/03/132693345.1.jpg,그룹 ‘2AM’ 멤버 조권이 반려견 ‘가가’의 암 투병 소식을 전하며 애틋한 마음을 드러냈다.조권은 2일 자신의 소셜미디어를 통해 가가의 사진과 함께 긴 글을 남겼다. 그는 “영원히 한 살일 것 같던 가가가 어느덧 12살이 됐다”며 “노견이 되면서 눈이 하얗게 변하고 왼쪽 눈은 거의 …,2시간 전,https://www.donga.com/news/Culture/article/all/20251103/132693344/1,동아일보
"트와이스 나연, 과감 노출 무대 의상…볼륨감에 상큼 미소까지",https://dimg.donga.com/a/296/167/95/2/wps/NEWS/IMAGE/2025/11/03/132693279.1.jpg,그룹 트와이스의 나연이 과감하게 노출한 무대 의상을 선보였다.나연은 지난 2일 자신의 인스타그램 스토리에 시드니 공연 중 찍은 사진을 올렸다.사진 속 나연은 상큼한 표정 속에 비키니를 연상시키는 과감한 무대 의상을 입고 자연스럽게 볼륨감도 과시했다. 나연은 귀여움과 섹시한 매력을 동시…,2시간 전,https://www.donga.com/news/Entertainment/article/all/20251103/132693278/1,동아일보
"임채무, ‘빚 190억’ 두리랜드 손자에게 안 물려준다",https://dimg.donga.com/a/296/167/95/2/wps/NEWS/IMAGE/2025/11/03/132692769.1.jpg,배우 임채무가 직접 운영 중인 두리랜드를 가족에게 절대 물려주지 않는다고 말했다.그는 지난 2일 방송한 KBS 2TV 예능 프로그램 ‘사장님 귀는 당나귀 귀’에서 가족과 함께 시간을 보냈다.임채무 손자는 “할아버지는 두리랜드를 언제까지 운영하실 거냐”고 물었다.임채무는 “25년만 더 …,3시간 전,https://www.donga.com/news/Culture/article/all/20251103/132692768/1,동아일보
메달 들고 함박웃음…뉴진스 다니엘 전속계약 패소 후 근황,https://dimg.donga.com/a/296/167/95/2/wps/NEWS/IMAGE/2025/11/03/132692373.3.jpg,"소속사 어도어와의 전속계약 분쟁 1심에서 패소한 그룹 뉴진스(NewJeans)의 멤버 다니엘의 근황이 전해졌다.● “다니 진짜 대견”…이연진·다니엘, 환한 미소로 10K 완주 인증이연진 전 마라톤선수는 2일 자신의 SNS에 “다니엘과 해피한 10K 동반주. 46분 PB달성 추카추카”라…",3시간 전,https://www.donga.com/news/Culture/article/all/20251103/132692364/2,동아일보
"59세 이창훈, 54세 김승수에 ‘65세 친누나’ 배우 이금주‘ 소개…“아직 미혼”",https://dimg.donga.com/a/296/167/95/2/wps/NEWS/IMAGE/2025/11/03/132691986.1.jpg,배우 이창훈이 ‘미운 우리 새끼’에서 후배 김승수에게 자신의 미혼 누나이자 배우 이금주를 소개하겠다고 제안해 화제를 모았다. 김승수는 “처남이네”라며 웃음을 터뜨렸다.,4시간 전,https://www.donga.com/news/Entertainment/article/all/20251103/132691985/1,동아일보
"도경수 “이광수, 동생들 힘들게 하는 형…작품에선 많이 배워”",https://dimg.donga.com/a/296/167/95/2/wps/NEWS/IMAGE/2025/11/03/132691567.1.jpg,"‘조각도시’ 도경수가 이광수의 다양한 면모에 대해 밝혔다.엔터테인먼트 서비스 디즈니+(플러스) 새 드라마 ‘조각도시’(극본 오상호/연출 박신우, 김창우)는 3일 오전 11시 서울 여의도 콘래드에서 제작발표회를 열었다.도경수와 이광수는 실제 절친 사이다. 도경수는 이광수에 대해 “평소 …",5시간 전,https://www.donga.com/news/Entertainment/article/all/20251103/132691566/1,동아일보
"강타, SM 산하 레이블 스마트 론칭…임시완 첫 솔로 음반 프로듀싱",https://dimg.donga.com/a/296/167/95/2/wps/NEWS/IMAGE/2025/11/03/132691471.1.jpg,1세대 K-팝 그룹 ‘H.O.T.’ 출신 강타가 SM엔터테인먼트 산하 뮤직 레이블 스마트(SMArt)를 론칭하고 총괄 프로듀서로 나선다.SM은 3일 “스마트는 다양한 음악 장르를 아우르고 끊임없이 확장해 나가는 것을 목표로 한다”면서 이렇게 밝혔다. K팝을 하나의 문화 콘텐츠로 재해석…,6시간 전,https://www.donga.com/news/Culture/article/all/20251103/132691470/1,동아일보
"데이식스, 공연으로 한 해 마무리…12월 단콘 개최",https://dimg.donga.com/a/296/167/95/2/wps/NEWS/IMAGE/2025/11/03/132691319.1.jpg,데이식스가 오는 12월 단독 콘서트를 개최한다.JYP엔터테인먼트는 3일 0시 그룹 공식 채널에 ‘2025 데이식스 스페셜 콘서트 더 프레젠트’(2025 DAY6 Special Concert The Present)의 포스터를 게재했다. 이에 따르면 데이식스는 오는 12월 19일~21일 …,6시간 전,https://www.donga.com/news/Entertainment/article/all/20251103/132691318/1,동아일보
"여진구, 내달 카투사 입대…“더 단단해져 돌아오겠다”",https://dimg.donga.com/a/296/167/95/2/wps/NEWS/IMAGE/2025/11/03/132690920.2.jpg,배우 여진구가 오는 12월 15일 입대한다. 그는 카투사(KATUSA)로 선발돼 병역 의무를 이행할 예정이다.● “입소 장소·시간 비공개…변함없는 응원 부탁”3일 여진구 측은 “여진구가 카투사(KATUSA: Korean Augmentation to the United States Ar…,7시간 전,https://www.donga.com/news/Society/article/all/20251103/132690823/2,동아일보
"성시경, ‘10년 지기’ 매니저에 배신당해…“금전피해”",https://dimg.donga.com/a/296/167/95/2/wps/NEWS/IMAGE/2025/11/03/132690608.2.jpg,"가수 성시경이 10년 이상 함께한 매니저에게 금전적 피해를 입었다. 소속사 측은 “정확한 피해 범위를 확인 중”이라고 입장을 전했다.● 소속사 “성시경 매니저, 신뢰 저버려”3일 성시경 소속사 에스케이재원(주)는 “성시경 전 매니저는 재직 중 업무 수행 과정에서 회사의 신뢰를 저버리는…",7시간 전,https://www.donga.com/news/Society/article/all/20251103/132690607/2,동아일보
"부국제 최고 평점 日 영화 ‘여행과 나날’, 12월 개봉…심은경 주연",https://dimg.donga.com/a/296/167/95/2/wps/NEWS/IMAGE/2025/11/03/132690731.1.jpg,"영화 ‘여행과 나날’이 오는 12월 국내 개봉을 확정했다.배급사 엣나인필름은 3일 이같이 밝히며 여름과 겨울의 정수를 포착한 ‘여행과 나날’(감독 미야케 쇼)의 계절 포스터 2종, 계절 클립 2종을 공개했다.제78회 로카르노영화제에서 황금표범상(Pardo d’Oro)을 수상하고 제73…",7시간 전,https://www.donga.com/news/Entertainment/article/all/20251103/132690730/1,동아일보
‘얄미운 사랑’ 첫방…이정재·임지연 18세 차 로맨스에 쏠리는 관심,https://dimg.donga.com/a/296/167/95/2/wps/NEWS/IMAGE/2025/11/03/132690681.1.jpg,"‘18세 차이’ 이정재(54)와 임지연(36)의 로맨스 ‘얄미운 사랑’이 안방극장을 찾는다.3일 오후 8시 50분 tvN 월화드라마 ‘얄미운 사랑’(극본 정여랑/연출 김가람)이 처음 방송된다. ‘얄미운 사랑’은 초심을 잃은 국민 배우와 정의 실현에 목매는 연예부 기자의 디스 전쟁, 팩…",7시간 전,https://www.donga.com/news/Entertainment/article/all/20251103/132690680/1,동아일보
"지드래곤, 장원영에 꽃다발 선물했다…뜻밖의 이유?",https://dimg.donga.com/a/296/167/95/2/wps/NEWS/IMAGE/2025/11/03/132690690.1.jpg,지드래곤이 장원영에게 “2025 차 빼러 가요”라는 문구가 적힌 순백의 꽃다발을 선물하며 재치 있는 응원을 전했다. 두 사람의 APEC 홍보영상 인연이 다시 화제를 모았다.,7시간 전,https://www.donga.com/news/Culture/article/all/20251103/132690689/1,동아일보
"“확신의 결과물” 강승윤, 5년만의 솔로 정규로 보여줄 성장",https://dimg.donga.com/a/296/167/95/2/wps/NEWS/IMAGE/2025/11/03/132690673.1.jpg,위너 강승윤이 진두지휘한 약 5년 만의 솔로 정규 앨밤이 3일 오후 6시 세상에 나온다. 정규 2집 ‘페이지 투’(PAGE 2)는 4년 7개월 만의 솔로 정규이자 전곡 프로듀싱과 비주얼·프로모션 기획까지 아티스트 본인이 진두지휘한 프로젝트라는 점에서 그의 성장을 확인할 수 있다.YG엔…,7시간 전,https://www.donga.com/news/Entertainment/article/all/20251103/132690672/1,동아일보
손흥민 美 경기서 울려 퍼진 K팝…하이브가 만든 K-페스티벌,https://dimg.donga.com/a/296/167/95/2/wps/NEWS/IMAGE/2025/11/03/132690665.1.jpg,손흥민 선수가 뛰고 있는 미국 프로축구단 LAFC의 홈구장 BMO 스타디움이 K팝으로 물들었다.하이브(352820)가 미국 프로축구팀 LAFC와 공동 기획한 K-컬처 행사가 2만 2000여 명의 관객이 모인 BMO 스타디움에서 지난달 29일(현지시간) 성황리에 개최됐다. ‘아우디 20…,7시간 전,https://www.donga.com/news/Entertainment/article/all/20251103/132690664/1,동아일보
"성시경, 10년 동고동락 매니저에 배신당했다…“금전 피해 범위 확인 중”",https://dimg.donga.com/a/296/167/95/2/wps/NEWS/IMAGE/2025/11/03/132690650.1.jpg,"가수 성시경이 전 매니저로 인해 금전 피해를 입었다.3일 소속사 에스케이재원㈜은 공식 입장을 내고 “성시경 전 매니저는 재직 중 업무 수행 과정에서 회사의 신뢰를 저버리는 행위를 한 것으로 확인됐다‘라고 밝혔다.이어 ”당사는 내부 조사 결과 사안의 심각성을 인지했고, 정확한 피해 범위…",7시간 전,https://www.donga.com/news/Entertainment/article/all/20251103/132690649/1,동아일보
"28세 여진구, 카투사 간다…12월 15일 입대",https://dimg.donga.com/a/296/167/95/2/wps/NEWS/IMAGE/2025/11/03/132690526.1.jpg,배우 여진구가 입대한다.3일 여진구 측은 “여진구가 카투사(KATUSA: Korean Augmentation to the United States Army)에 선발되어 12월 15일 월요일부터 약 1년 6개월간 복무를 하게 되었다”고 알렸다.또 여진구 측은 입소 일정이 비공개로 진행된…,8시간 전,https://www.donga.com/news/Entertainment/article/all/20251103/132690525/1,동아일보
"‘이병헌♥’ 이민정, 붕어빵 2살 딸 공개 “드레스 공주병”",https://dimg.donga.com/a/296/167/95/2/wps/NEWS/IMAGE/2025/11/03/132690359.1.jpg,"배우 이민정이 딸 이서이 양의 근황을 공개했다.이민정은 지난 2일 자신의 소셜미디어에 “단단히 빠진 드레스 공주병”이라고 적었다.“하루에 세번 드레스 갈아입음. 벌써 크리스마스트리가. 아, 이번 크리스마스엔 뭐해야 하나요”라고 덧붙이며 사진 여러 장을 올렸다.사진 속 서이 양은 크리스…",8시간 전,https://www.donga.com/news/Entertainment/article/all/20251103/132690358/1,동아일보
