title,thumbnail,short_content,write_time,link,company
檢 수사팀 “즉시항고 해야” 반발에… 檢총장이 직접 尹 석방 지휘,https://dimg.donga.com/a/296/167/95/2/wps/NEWS/IMAGE/2025/03/10/131172886.1.jpg,"윤석열 대통령의 석방 지휘를 두고 대검찰청 지휘부와 수사팀이 큰 의견 차를 보였던 것으로 9일 파악됐다. 대검은 “일단 석방해야 한다”는 의견이었던 반면, 수사팀은 “즉시항고 해야 한다”고 맞선 것으로 알려졌다. 검찰은 법원의 구속 취소 결정에 대해 즉시항고 등 불복 절차는 밟지 않기…",15시간 전,https://www.donga.com/news/Society/article/all/20250310/131172404/2,동아일보
탄핵 찬성 측 “尹 풀어준 검찰도 공범” vs 전광훈 “헌재 한칼에 날려버릴 것”,https://dimg.donga.com/a/296/167/95/2/wps/NEWS/IMAGE/2025/03/10/131172866.1.jpg,"윤석열 대통령이 석방된 다음 날(9일) 서울 도심 곳곳에서 탄핵 찬반 집회가 열렸다. 윤 대통령 지지자들은 용산구 한남동 대통령 관저 일대 등에 모여 탄핵 기각을 촉구했고, 탄핵 찬성 측은 “풀어준 검찰도 공범”이라며 맞불 집회를 이어갔다.이날 오전 전광훈 목사가 이끄는 사랑제일교회는…",15시간 전,https://www.donga.com/news/Society/article/all/20250310/131172405/2,동아일보
"매일 평의 여는 헌재, ‘尹석방 변수’에 이번주 결론낼지 주목",https://dimg.donga.com/a/296/167/95/2/wps/NEWS/IMAGE/2025/03/10/131172861.1.jpg,"윤석열 대통령 탄핵심판을 심리 중인 헌법재판소가 지난달 25일 변론을 마친 이후 사실상 매일 평의를 열며 숙고를 이어가고 있다. 변론 종료 후 2주가 지난 이번 주 내로 헌재의 선고가 내려질 것이라는 전망이 나오지만, 법원의 윤 대통령 구속 취소 결정과 검찰의 석방 지휘가 예상치 못한…",15시간 전,https://www.donga.com/news/Society/article/all/20250310/131172341/2,동아일보
"경찰, 尹탄핵심판 선고일 헌재 인근 주유소 폐쇄 검토",https://dimg.donga.com/a/296/167/95/2/wps/NEWS/IMAGE/2025/03/10/131172868.1.jpg,"경찰이 윤석열 대통령 탄핵심판 선고 당일 서울 종로구 헌법재판소 인근의 주유소들을 폐쇄하는 방안도 검토 중인 것으로 알려졌다. 헌재의 결정에 따라 흥분한 시민들이 휘발유, 경유 등을 탈취하거나 불을 지르는 사태에 대비하기 위해서다. 9일 경찰 등에 따르면 서울경찰청은 최근 헌재 일대 …",15시간 전,https://www.donga.com/news/Society/article/all/20250310/131172338/2,동아일보
“한국 사회대립 커질것” “탄핵심판 영향 작을듯”… 尹석방에 외신도 주시,https://dimg.donga.com/a/296/167/95/2/wps/NEWS/IMAGE/2025/03/10/131172870.1.jpg,해외 주요 언론들은 8일(현지 시간) 법원의 구속 취소 결정에 따른 윤석열 대통령 석방 소식을 전하며 향후 재판과 정국에 미칠 영향을 분석했다. 특히 외신들은 헌법재판소의 윤 대통령 탄핵심판 선고를 앞두고 여론에 영향을 줄 가능성 등을 짚었다. 또 탄핵을 둘러싼 한국 내 갈등이 격화되…,15시간 전,https://www.donga.com/news/Inter/article/all/20250310/131172337/2,동아일보
트럼프 보란듯… 北 “미사일 탑재 핵추진잠수함 건조중” 첫 공개,https://dimg.donga.com/a/296/167/95/2/wps/NEWS/IMAGE/2025/03/10/131172815.1.jpg,북한이 전략핵잠수함(SSBN)의 건조 현장을 최초로 공개했다. 핵 장착 잠수함발사탄도미사일(SLBM)을 싣고 핵추진으로 장기간 잠항할 수 있는 SSBN은 ‘최종 핵병기’로 불린다. 10일 개시되는 한미 자유의방패(FS) 연합연습과 도널드 트럼프 미 행정부를 겨냥해 대미 핵무력 고도화가…,15시간 전,https://www.donga.com/news/Politics/article/all/20250310/131172529/2,동아일보
"한미, 오늘부터 ‘자유의 방패’ 훈련… 北의 ICBM 도발 등 대비",https://dimg.donga.com/a/296/167/95/2/wps/NEWS/IMAGE/2025/03/09/131169859.1.jpg,한미 군 당국이 10일 북한의 전면 남침 등 한반도 유사시를 상정한 ‘자유의 방패(FS·프리덤실드)’ 연합연습에 돌입한다. 20일까지 진행되는 이번 FS 연습은 도널드 트럼프 2기 행정부 출범 이후 첫 대규모 정례 연합훈련이다.한미 양국군은 연합 작전계획에 따라 컴퓨터 시뮬레이션 방식…,15시간 전,https://www.donga.com/news/Politics/article/all/20250310/131172319/2,동아일보
“北 영변핵시설 연기-냉각수 방류 등 재가동 징후”,https://dimg.donga.com/a/296/167/95/2/wps/NEWS/IMAGE/2025/03/09/131169684.1.jpg,"미국의 북한 전문매체 38노스가 올겨울 촬영한 위성사진 분석 결과, 북한이 영변 핵시설을 계속 가동하고 있는 것으로 보인다고 7일(현지 시간) 보도했다. 38노스는 영변 핵시설의 방사화학실험실(RCL)에서 간헐적으로 연기가 뿜어져 나오는 모습 등이 포착됐다며 “김정은 북한 국무위원장의…",15시간 전,https://www.donga.com/news/Politics/article/all/20250310/131172320/2,동아일보
"연일 스피커 시위-차벽에 갇힌 헌재 앞… 주민 한숨, 상인도 울상",https://dimg.donga.com/a/296/167/95/2/wps/NEWS/IMAGE/2025/03/10/131172797.1.jpg,"“동네가 언제까지 이렇게 시끄러워야 하나요? 걷는데 한숨이 푹푹 나옵니다.”9일 서울 종로구 헌법재판소 인근. “편향된 헌재가 무슨 재판이냐”, “탄핵 각하” 등 확성기 소리가 집회 현장에서 울려 퍼졌다. 이를 듣던 주민 김가인 씨(48)는 한숨을 내쉬며 이렇게 말했다. 윤석열 대통령…",15시간 전,https://www.donga.com/news/Society/article/all/20250310/131172537/2,동아일보
野5당 “심우정 사퇴안하면 탄핵”…與 “헌재 尹심판 원점 재검토를”,https://dimg.donga.com/a/296/167/95/2/wps/NEWS/IMAGE/2025/03/09/131169043.1.jpg,"“심우정 검찰총장이 자진사퇴를 거부한다면 탄핵을 포함해 모든 조치를 취하겠다.” (더불어민주당 박찬대 원내대표)민주당은 법원의 윤석열 대통령 구속 취소 결정에 당혹스러움을 감추지 못한 채 “검찰이 의도적으로 항고를 포기한 것”이라며 심 총장 탄핵을 공개 거론했다. 주말인 8, 9일 국…",19시간 전,https://www.donga.com/news/Politics/article/all/20250309/131171338/1,동아일보
檢 ‘尹석방’ 27시간 격론…수사팀 반발에 檢 총장이 직접 지휘,https://dimg.donga.com/a/296/167/95/2/wps/NEWS/IMAGE/2025/03/09/131172072.1.jpg,"윤석열 대통령의 석방 지휘를 두고 대검찰청 지휘부와 수사팀이 큰 의견 차를 보였던 것으로 9일 파악됐다. 대검은 “일단 석방해야 한다”는 의견인 반면, 수사팀은 “즉시항고 해야한다”고 맞선 것으로 알려졌다. 검찰은 일단 대검의 결정에 따라 법원의 구속취소 결정에 대해 즉시항고 등 불복…",22시간 전,https://www.donga.com/news/Politics/article/all/20250309/131169439/1,동아일보
"지지자 향해 주먹 불끈-90도 인사 …尹, 여론전 본격화",https://dimg.donga.com/a/296/167/95/2/wps/NEWS/IMAGE/2025/03/09/131172058.1.jpg,8일 오후 5시 48분 경기 의왕 서울구치소 정문. 구치소의 녹색 철문이 열리자 대통령 경호차량인 검은색 캐딜락 에스컬레이드 모습이 보였다. 정문 앞에 멈춰 선 차량에선 체포 당시 입었던 짙은 감색 양복을 입은 윤석열 대통령이 내렸다. 윤 대통령은 “윤석열”을 연호하는 지지자들과 눈을…,22시간 전,https://www.donga.com/news/Politics/article/all/20250309/131171193/1,동아일보
폴란드 k2 전차 2차 수출계약 이르면 4월 체결,https://dimg.donga.com/a/296/167/95/2/wps/NEWS/IMAGE/2025/03/09/131172448.1.jpg,"9조 원대에 달하는 K2 흑표 전차의 폴란드 2차 수출 계약이 이르면 4월 체결될 것으로 9일 알려졌다. 정부 관계자는 이날 “K2 전차 폴란드 2차 수출 계약이 마무리단계”라며 “체결 시기는 4월이 될 수도, 5월이 될 수도 있다”고 말했다. 계약 규모는 2022년 8월에 체결된 1…",22시간 전,https://www.donga.com/news/Politics/article/all/20250309/131171990/1,동아일보
전광훈 “헌재 한칼에 날려버릴 것” vs 진보단체 “검찰도 공범”,https://dimg.donga.com/a/296/167/95/2/wps/NEWS/IMAGE/2025/03/09/131172150.1.jpg,"윤석열 대통령이 석방된 다음날(9일) 서울 도심 곳곳에서 탄핵 찬반 집회가 열렸다. 윤 대통령 지지자들은 한남동 대통령 관저 일대 등에서 모여 탄핵 기각을 촉구했고, 탄핵 찬성 측은 “풀어준 검찰도 공범”이라며 맞불 집회를 이어갔다. 이날 오전 전광훈 목사가 이끄는 사랑제일교회는 서울…",1일 전,https://www.donga.com/news/Society/article/all/20250309/131169908/1,동아일보
석방 첫날 金여사 등과 김치찌개 저녁…비서관 회의 개최 등 ‘관저 정치’ 시동,https://dimg.donga.com/a/296/167/95/2/wps/NEWS/IMAGE/2025/03/09/131171253.1.jpg,윤석열 대통령이 석방돼 서울 한남동 관저에 복귀한 가운데 대통령실은 9일 “차분하고 담담하게 헌법재판소의 선고를 기다릴 것”이라며 윤 대통령이 당분간 외부 활동이나 메시지는 자제할 방침이라고 밝혔다. 하지만 여당 지도부를 포함한 정치인들이 줄줄이 윤 대통령 접견에 나설 예정인 만큼 ‘…,1일 전,https://www.donga.com/news/Politics/article/all/20250309/131170416/1,동아일보
"숙고하는 헌재…법조계 “尹석방, 탄핵 선고엔 영향 적어”",https://dimg.donga.com/a/296/167/95/2/wps/NEWS/IMAGE/2025/03/09/131169259.1.jpg,"윤석열 대통령 탄핵심판을 심리 중인 헌법재판소가 지난달 25일 변론을 마친 이후 사실상 매일 평의를 열며 선고를 위한 숙고를 이어가고 있다. 변론 종료 후 2주가 지난 이번 주 내로 헌재의 선고가 내려질 것이라는 전망이 나오지만, 법원의 윤 대통령 구속취소 결정과 검찰의 석방지휘가 예…",1일 전,https://www.donga.com/news/Politics/article/all/20250309/131169149/1,동아일보
주진우 “아버지가 간부인 회사에 합격했는데 몰랐겠는가”…선관위 특혜 채용 직격,https://dimg.donga.com/a/296/167/95/2/wps/NEWS/IMAGE/2025/03/09/131170594.1.jpg,"국민의힘 법률자문위원장인 주진우 의원은 9일 중앙선거관리위원회(선관위)를 향해 “선관위는 국민 앞에 자정하겠다고 했는데 허언이 아니라면 지켜라”라며 “말로만 자정이 아닌 행동으로 보여라”라고 촉구했다.주 의원은 이날 “선관위는 간부의 자녀 또는 친인척이 특혜 채용된 것을 인지하고도, …",1일 전,https://www.donga.com/news/Politics/article/all/20250309/131170548/1,동아일보
北 ‘최종 핵병기’ 전략핵잠수함 건조현장 공개…대미 핵무력 과시,https://dimg.donga.com/a/296/167/95/2/wps/NEWS/IMAGE/2025/03/09/131167948.1.jpg,북한이 전략핵잠수함(SSBN)의 건조 현장을 최초로 공개했다. 핵 장착 잠수함발사탄도미사일(SLBM)을 싣고 핵추진으로 장기간 잠항할 수 있는 SSBN은 ‘최종 핵병기’로 불린다.10일 개시되는 한미 자유의방패(FS) 연합연습과 도널드 트럼프 미 행정부를 겨냥해 대미 핵무력 고도화가 …,1일 전,https://www.donga.com/news/Politics/article/all/20250309/131169887/1,동아일보
"北, 러 파병 대가로 ‘핵잠수함용 원자로 기술’ 받았을 가능성",https://dimg.donga.com/a/296/167/95/2/wps/NEWS/IMAGE/2025/03/09/131172151.1.jpg,북한 관영 매체들이 8일 김정은 국무위원장이 건조 현장을 현지 지도했다고 보도한 ‘핵동력전략유도탄 잠수함’은 전략핵잠수함(SSBN)을 의미한다. 핵탄두가 장착된 잠수함발사탄도미사일(SLBM)을 다량으로 싣고 핵추진으로 움직이는 ‘북한판 SSBN’을 처음으로 공개한 것.군 관계자는 “1…,1일 전,https://www.donga.com/news/Politics/article/all/20250309/131169151/1,동아일보
"이재명 “검찰, 초보적 산수도 못한 것 안 믿겨…의도에 따른 기획 의심”",https://dimg.donga.com/a/296/167/95/2/wps/NEWS/IMAGE/2025/03/09/131170561.1.jpg,이재명 더불어민주당 대표는 9일 검찰이 법원의 구속취소 결정에 따라 윤석열 대통령을 석방한 것에 대해 “일정한 의도에 따른 기획이 아닌가 의심하지 않을 수 없다”고 말했다.이 대표는 이날 국회에서 열린 ‘야5당 대표 비상시국 공동대응을 위한 원탁회의’에 참석해 모두발언에서 “내란 수괴…,1일 전,https://www.donga.com/news/Politics/article/all/20250309/131170518/1,동아일보
"“악의 무리 맞선 활약상 들어” 김용현, 신남성연대에 옥중 서신",https://dimg.donga.com/a/296/167/95/2/wps/NEWS/IMAGE/2025/03/09/131170511.1.jpg,김용현 전 국방부 장관이 배인규 신남성연대 대표에게 “2030 청년들을 이끌어 주심에 깊이 감사드린다”는 내용의 옥중 서신을 보냈다. 윤석열 대통령 탄핵을 찬성하는 쪽을 향해선 ‘악의 무리’라는 표현도 사용했다.신남성연대 유튜브 채널은 9일 ‘집안 가보 생긴 썰 푼다’는 제목의 영상을…,1일 전,https://www.donga.com/news/Politics/article/all/20250309/131170510/1,동아일보
"CJ제일제당, 퀴진케이 팝업 레스토랑 개최… ‘한식 세계화’ 지속추진",https://dimg.donga.com/a/296/167/95/2/wps/NEWS/IMAGE/2025/03/10/131179223.2.jpg,CJ제일제당이 한식 셰프 양성 프로젝트 ‘퀴진케이(Cuisine.K)’를 통해 ‘유용욱바베큐연구소’와 협업한 스페셜 팝업 레스토랑을 연다. CJ제일제당은 오는 3월 18일부터 29일까지 열흘간 서울 강남구 퀴진케이 레스토랑에서 ‘유용욱바베큐연구소’와 공동 운영하는 팝업 레스토랑을 진…,15분 전,https://www.donga.com/news/Economy/article/all/20250310/131179224/1,동아일보
문서 파일 열었을 뿐인데…악성코드 감염 주의보,https://dimg.donga.com/a/296/167/95/2/wps/NEWS/IMAGE/2025/03/10/131179179.1.jpg,국내 유명 대학에서 진행하는 통일 분야 교육 프로그램을 사칭한 해킹 공격이 발견돼 보안업계가 주의를 당부했다.10일 이스트시큐리티 시큐리티대응센터(이하 ESRC)에 따르면 이번 공격에는 ‘워터링 홀(Watering Hole)’해킹 기법이 활용됐다.워터링 홀 공격이란 공격 대상이 자주 …,15분 전,https://www.donga.com/news/Economy/article/all/20250310/131179178/1,동아일보
"CJ프레시웨이, ‘슬로잇’ 캠페인 전개… 저속노화식단 도입 적극 행보",https://dimg.donga.com/a/296/167/95/2/wps/NEWS/IMAGE/2025/03/10/131178890.2.jpg,"CJ프레시웨이가 건강한 식생활을 지원하는 ‘슬로잇(SlowEat)’ 캠페인을 시작했다. 저속노화 식단을 통해 급식 이용객의 건강을 돕고, 지속가능한 식습관을 확산하는 것이 목표다.최근 저속노화식이 새로운 건강 트렌드로 떠오르면서 급식업계에서도 이에 대한 관심이 커지고 있다. 사무실 및…",28분 전,https://www.donga.com/news/Economy/article/all/20250310/131178891/1,동아일보
"이월드, 개장 30주년 기념 ‘매지컬 셀러브레이션’ 개최",https://dimg.donga.com/a/296/167/95/2/wps/NEWS/IMAGE/2025/03/10/131178908.1.jpg,이랜드는 대구에서 운영 중인 테마파크 이월드가 개장 30주년을 맞아 기념 축제 ‘매지컬 셀러브레이션’을 3월 22일부터 개최한다고 10일 밝혔다. 이월드는 1995년 개장 이후 약 1억 명의 방문객이 다녀갔다고 전하며 이번 행사는 고객 감사의 의미를 담아 기획됐다고 설명했다. 이번 축…,35분 전,https://www.donga.com/news/Economy/article/all/20250310/131178915/1,동아일보
"현대차, 日과 수소협력 네트워크 구축… 한일의원연맹 방일행사 동행",https://dimg.donga.com/a/296/167/95/2/wps/NEWS/IMAGE/2025/03/10/131178874.2.jpg,현대자동차는 일본 내 수소협력 네트워크 구축과 교류 활성화를 위해 오는 12일까지 3일간 일본 도쿄와 가와사키 등지에서 열리는 한일의원연맹 방일행사에 참여한다고 10일 밝혔다. 이를 통해 한국과 일본이 유기적인 수소 협력체계를 구축하고 양국은 물론 글로벌 차원 수소산업 생태계 구축과 …,38분 전,https://www.donga.com/news/Economy/article/all/20250310/131178881/1,동아일보
"동원홈푸드, 마곡 코엑스 ‘크리스피 프레시·포르투7’ 개점… 차별화 메뉴로 승부",https://dimg.donga.com/a/296/167/95/2/wps/NEWS/IMAGE/2025/03/10/131178655.2.jpeg,"동원홈푸드는 10일 프리미엄 샐러드 카페 ‘크리스피 프레시(crispy fresh)’와 이탈리안 가정식 레스토랑 ‘포르투7(PORTO7)’의 마곡 코엑스점을 개점했다고 밝혔다.새롭게 문을 연 크리스피 프레시와 포르투7은 각각 93㎡(39석), 172㎡(66석) 규모로, 코엑스 마곡 지…",1시간 전,https://www.donga.com/news/Economy/article/all/20250310/131178681/1,동아일보
"중소조선연구원, 2025년 조직개편 및 인사 단행",https://dimg.donga.com/a/296/167/95/2/wps/NEWS/IMAGE/2025/03/10/131177588.1.png,"중소조선연구원은 조선·해양산업의 급변하는 환경에 대응하고 미래 경쟁력을 강화하기 위해 2025년 조직개편과 인사를 단행했다고 10일 밝혔다.친환경·디지털 전환, 자율운항 기술 등 미래 조선·해양 산업을 선도할 핵심 기술 연구 역량을 강화하고 관련 기업 및 기관들과의 협력 네트워크를 더…",1시간 전,https://www.donga.com/news/Economy/article/all/20250310/131177498/1,동아일보
"삼성바이오로직스, 美 뉴욕 ‘디캣위크 2025’ 참가… “50건 회의서 파트너십 모색”",https://dimg.donga.com/a/296/167/95/2/wps/NEWS/IMAGE/2025/03/10/131178435.2.jpg,삼성바이오로직스는 오는 17일부터 20일까지 미국 뉴욕에서 열리는 ‘디캣위크(DCAT Week) 2025’에 참가한다고 10일 밝혔다.디캣위크는 지난 1890년 뉴욕 상공회의소 주관으로 처음 시작된 글로벌 제약·바이오 네트워킹 행사다. 130년 넘는 역사와 전통을 자랑한다. 현재는 디…,1시간 전,https://www.donga.com/news/Economy/article/all/20250310/131178511/1,동아일보
셰리위스키 맛집 글렌드로낙… 신규 위스키 3종 ‘마스터스 앤솔로지’ 국내도입,https://dimg.donga.com/a/296/167/95/2/wps/NEWS/IMAGE/2025/03/10/131178065.2.jpg,"글렌드로낙 증류소가 마스터 블렌더 레이첼 베리의 감독 아래 새롭게 선보인 ‘마스터스 앤솔로지’ 위스키 3종을 10일 공개했다. 3종 위스키는 오드 투 더 밸리, 오드 투 더 엠버스, 오드 투 더 다크로 구성됐으며, 글렌드로낙 증류소 200년 역사를 대표하는 새로운 위스키가 될 것으로 …",1시간 전,https://www.donga.com/news/Economy/article/all/20250310/131178213/1,동아일보
"티엔에프컨설팅, ‘2025 일터혁신 상생컨설팅 운영기관’ 선정",https://dimg.donga.com/a/296/167/95/2/wps/NEWS/IMAGE/2025/03/10/131177851.2.jpg,티엔에프컨설팅(대표 김형섭)이 노무법인 해든(대표 전해경)과 컨소시엄을 통해 고용노동부가 주관하는 ‘2025년 일터혁신 상생컨설팅’ 운영기관으로 선정되었다고 밝혔다. 일터혁신컨설팅은 약 400억 규모의 일터혁신 지원금으로 기업의 경쟁력 강화와 지속 가능성 및 근로자 삶의 질을 높이는 …,1시간 전,https://www.donga.com/news/Economy/article/all/20250310/131177878/1,동아일보
"“대장내시경 전 역한 맛 약물 이제 그만”… GC녹십자웰빙, 용량·맛 개선 ‘원프렙1.38산’ 제안",https://dimg.donga.com/a/296/167/95/2/wps/NEWS/IMAGE/2025/03/10/131177868.2.jpg,GC녹십자웰빙은 제45회 대한위대장내시경학회(KSDE) 춘계학술대회에서 ‘원프렙1.38산’을 주제로 런천 심포지엄을 건강약품과 공동 개최했다고 10일 밝혔다.원프렙1.38산은 이름 그대로 1.38리터의 물만으로 충분한 장 정결 효과를 제공하는 것이 특징이다. 최소 2리터에서 최대 4리…,1시간 전,https://www.donga.com/news/Economy/article/all/20250310/131177895/1,동아일보
"삼양사, 美 천연식품박람회 참가…스페셜티 솔루션으로 해외 공략",https://dimg.donga.com/a/296/167/95/2/wps/NEWS/IMAGE/2025/03/10/131177772.1.jpg,삼양사는 이달 5~7일 미국 캘리포니아주 애너하임에서 개최된 ‘NPEW(2025 Natural Products Expo West)’에 참가해 스페셜티(고기능성) 식품 소재 솔루션을 선보였다고 10일 밝혔다. 지난해에 이어 두번째로 참가하는 것이다. 삼양사는 이번 박람회에서 제로 칼로리…,1시간 전,https://www.donga.com/news/Economy/article/all/20250310/131176881/1,동아일보
"서경배 아모레퍼시픽그룹 회장, 이달 말 나델라 MS CEO 만난다",https://dimg.donga.com/a/296/167/95/2/wps/NEWS/IMAGE/2025/03/10/131177765.1.jpg,서경배 아모레퍼시픽그룹 회장이 이달 25일 서울에서 사티아 나델라 미국 마이크로소프트(MS) 최고경영자(CEO)를 만난다. 나델라 CEO는 26일 서울 양재 aT센터에서 열리는 ‘마이크로소프트 인공지능(AI) 투어 인 서울’에 참석할 예정인데 공식 행사 하루 전날 서 회장과 만남을 갖…,1시간 전,https://www.donga.com/news/Economy/article/all/20250310/131177490/1,동아일보
"건강 챙기고 봄옷도 장만…hy, LF와 손잡고 이색 협업",https://dimg.donga.com/a/296/167/95/2/wps/NEWS/IMAGE/2025/03/10/131176986.1.png,요구르트를 사면 명품 의류를 받을 수 있는 이색 협업 행사가 열린다.hy(옛 한국야쿠르트)는 패션업체 LF와 손잡고 ‘LF몰과 함께하는 봄맞이 페스타’를 진행한다고 10일 밝혔다. hy와 LF 상품을 구매할 때 상대편 제품을 함께 받을 수 있는 ‘주고 받는’ 혜택이 특징이다.23일까지…,2시간 전,https://www.donga.com/news/Economy/article/all/20250310/131177180/1,동아일보
"월간농협맛선, 소용 김치 구독 서비스 출시",https://dimg.donga.com/a/296/167/95/2/wps/NEWS/IMAGE/2025/03/10/131177650.2.png,농협에서 운영하는 농식품 구독서비스 ‘월간농협맛선’이 1·2인 가구를 겨냥해 맞춤형김치 구독서비스를 새롭게 선보인다. 소용량 포장으로 더욱 실속있는 소비가 가능하도록 했다.월간농협맛선 김치 구독 서비스는 100% 국내산 계약재배 농산물과 천연 조미료를 사용해 자연발효 방식으로 만들어…,2시간 전,https://www.donga.com/news/List/article/all/20250310/131177651/2,동아일보
"한국청년회의소-골든블루, 딥페이크 성범죄 예방 캠페인 전개",https://dimg.donga.com/a/296/167/95/2/wps/NEWS/IMAGE/2025/03/10/131177512.2.jpg,골든블루가 세계 여성의 날을 맞아 디지털 시대의 새로운 위협인 딥페이크 성범죄 예방을 위한 캠페인을 진행했다고 10일 밝혔다.사단법인 한국청년회의소(이하 한국JC)가 주최·주관하고 골든블루가 후원하는 ‘딥페이크 성범죄 예방 캠페인’은 최근 AI 기술 발달로 급증하고 있는 딥페이크를 이…,2시간 전,https://www.donga.com/news/Economy/article/all/20250310/131177531/1,동아일보
"직장인 10명 중 6명 “결혼, 필수 아냐”…직장 규모에 따라 답도 달라",https://dimg.donga.com/a/296/167/95/2/wps/NEWS/IMAGE/2025/03/10/131177398.2.jpg,"‘결혼은 필수일까’라는 질문에 성별과 직장 규모에 따라 답변이 다른 것으로 나타났다.HR테크 기업 인크루트가 직장인 653명을 대상으로 결혼 가치관에 대해 설문조사를 진행한 결과 응답자의 60.2%가 결혼이 필수가 아니라고 답했다.직장 규모별로 교차 분석한 결과, 대기업에 다니는 직장…",2시간 전,https://www.donga.com/news/Society/article/all/20250310/131177407/2,동아일보
"BAT로스만스 ‘글로’, 봄 시즌 한정 ‘하이퍼 프로 오로라 퍼플’ 출시",https://dimg.donga.com/a/296/167/95/2/wps/NEWS/IMAGE/2025/03/10/131177355.2.jpg,BAT로스만스의 궐련형 전자담배 브랜드 ‘글로(glo)’가 봄 시즌 한정판 디바이스 ‘하이퍼 프로 오로라 퍼플(HYPER pro Aurora Purple)’을 출시한다고 10일 밝혔다.이번 한정판 디바이스는 ‘리브 라이프 인 컬러(Live Life in Color)’ 캠페인의 일환으로…,2시간 전,https://www.donga.com/news/Economy/article/all/20250310/131177364/1,동아일보
"LG유플러스, AWS와 AI 클라우드 생태계 구축 위한 협력",https://dimg.donga.com/a/296/167/95/2/wps/NEWS/IMAGE/2025/03/10/131177380.1.jpg,"LG유플러스는 아마존웹서비스(AWS)와 전략적 파트너십을 체결하고, 국내 AI 클라우드 생태계 조성을 위한 ‘AX얼라이언스’ 전략을 공동 추진한다고 10일 밝혔다.이번 파트너십은 스페인 바르셀로나에서 열린 MWC25에서 체결됐으며 양사는 한국형 소버린 클라우드 개발, AI 플랫폼 및 …",2시간 전,https://www.donga.com/news/Economy/article/all/20250310/131177391/1,동아일보
