title,thumbnail,short_content,write_time,link,company
"野, 끝내 ‘대행의 대행’까지 ‘30번째 탄핵’",https://dimg.donga.com/a/296/167/95/2/wps/NEWS/IMAGE/2025/03/22/131255064.6.jpg,더불어민주당 등 야 5당이 21일 최상목 대통령 권한대행 부총리 겸 기획재정부 장관의 탄핵소추안을 발의했다. ‘줄탄핵’에 대한 당내 일각의 우려에도 윤석열 정부 출범 이후 30번째 탄핵 시도에 나선 것. 헌법재판소가 24일 한덕수 국무총리에 대한 탄핵심판 결정을 선고한다고 밝히면서 윤…,4시간 전,https://www.donga.com/news/Politics/article/all/20250322/131257852/2,동아일보
"“崔 떡메 치고 다녀… 황당한 사람” 이재명, 당내 우려에도 탄핵 강행",https://dimg.donga.com/a/296/167/95/2/wps/NEWS/IMAGE/2025/03/22/131254894.4.jpg,더불어민주당이 최상목 대통령 권한대행 부총리 겸 기획재정부 장관에 대해 “탄핵 절차를 개시하겠다”고 밝힌 지 하루 만인 21일 탄핵소추안을 발의했다. 헌법재판소의 한덕수 국무총리 탄핵심판 선고기일 지정이 새 변수로 떠오르면서 최 권한대행 탄핵에 “실익이 없다”는 지적이 잇따랐지만 결국…,4시간 전,https://www.donga.com/news/Politics/article/all/20250322/131257404/2,동아일보
"민주, 10년전 국정농단 꺼내 최상목 고발… 국힘 “이재명 강요죄 고발” 맞불",https://dimg.donga.com/a/296/167/95/2/wps/NEWS/IMAGE/2025/03/21/131257230.1.jpg,21일 더불어민주당이 최상목 대통령 권한대행 부총리 겸 기획재정부 장관을 뇌물 및 공갈 혐의로 고위공직자범죄수사처에 고발한 사건은 박근혜 정부의 국정농단과 관련한 청와대의 미르·K스포츠재단에 대한 대기업의 출연 강요 의혹이다. 최 권한대행은 박근혜 정부 시절인 2014년부터 2015년…,4시간 전,https://www.donga.com/news/Politics/article/all/20250322/131257402/2,동아일보
"李 ‘崔, 몸조심’ 발언 사과 거부… “체포 조심하란 뜻, 왜곡 말라”",https://dimg.donga.com/a/296/167/95/2/wps/NEWS/IMAGE/2025/03/21/131254890.4.jpg,더불어민주당 이재명 대표가 최상목 대통령 권한대행 부총리 겸 기획재정부 장관에게 “몸조심하기 바란다”고 한 데 대한 사과 요구를 거부했다. 이 대표는 21일 국회에서 기자들과 만나 ‘최 권한대행에게 몸조심하라고 발언한 데 대해 사과할 의향이 있나’라는 질문에 “체포당할 수 있으니 조심…,4시간 전,https://www.donga.com/news/Politics/article/all/20250321/131257400/2,동아일보
"한덕수 탄핵심판, ‘내란 공모-헌재 재판관 미임명’ 최대 쟁점",https://dimg.donga.com/a/296/167/95/2/wps/NEWS/IMAGE/2025/03/20/131247948.1.jpg,헌법재판소가 한덕수 국무총리의 탄핵심판 선고기일을 24일로 예고하면서 선고 결과 및 결정문에 담길 헌재 재판관들의 판단에 관심이 모이고 있다. 한 총리의 탄핵소추 사유는 △윤석열 대통령의 ‘내란 행위’에 대한 공모·묵인·방조 △국회가 추천한 헌재 재판관 후보자 3명 임명 거부 △한동훈…,4시간 전,https://www.donga.com/news/Society/article/all/20250321/131257670/2,동아일보
“탄핵 각하” “즉시 파면” 헌재 앞서 매일 회견 열겠다는 여야,https://dimg.donga.com/a/296/167/95/2/wps/NEWS/IMAGE/2025/03/21/131255045.6.jpg,21일 오전 9시경 서울 종로구 헌법재판소 앞. 여야 국회의원들이 고성을 지르며 실랑이를 벌였다. 더불어민주당 의원들이 헌재 현판 앞에서 기자회견을 진행 중인 가운데 국민의힘 의원들이 자리를 비켜 달라고 요구하자 실랑이가 벌어진 것이다. ‘즉시 파면’ 팻말을 든 민주당 의원들이 “왜 …,4시간 전,https://www.donga.com/news/Politics/article/all/20250321/131257668/2,동아일보
"尹탄핵 찬성 58%, 반대 36%… 중도층선 64% 찬성",https://dimg.donga.com/a/296/167/95/2/wps/NEWS/IMAGE/2025/03/22/131258005.1.jpg,"윤석열 대통령 탄핵에 찬성한다는 답변이 58%, 반대한다는 답변이 36%라는 여론조사 결과가 21일 나왔다. 한국갤럽이 18∼20일 전국 만 18세 이상 남녀 1003명을 대상으로 실시해 이날 발표한 여론조사(전화조사원이 무선전화 인터뷰 방식으로 실시. 자세한 사항은 중앙선거여론조사심…",4시간 전,https://www.donga.com/news/Politics/article/all/20250321/131257664/2,동아일보
"與 “연금특위에 젊은 의원 배치, 목소리 반영”… 이재명 “軍 전체 복무기간 인정 못해 아쉬워”",https://dimg.donga.com/a/296/167/95/2/wps/NEWS/IMAGE/2025/03/22/131258003.1.jpg,‘더 내고 더 받는’ 방식의 국민연금 모수개혁안이 국회 본회의를 통과한 가운데 국민의힘이 국회 연금개혁특별위원회(연금특위)에서 연금재정 고갈 시 받는 돈을 자동으로 삭감하는 자동조정장치 도입 문제를 중점 논의하겠다고 밝혔다. 18년 만의 모수개혁 합의에 이어 청년층 표심을 고려해 젊은…,4시간 전,https://www.donga.com/news/Politics/article/all/20250321/131257666/2,동아일보
러 쇼이구 방북… 김정은에 푸틴 메시지 전달,https://dimg.donga.com/a/296/167/95/2/wps/NEWS/IMAGE/2025/03/21/131252609.1.jpg,세르게이 쇼이구 러시아 국가안보회의 서기가 21일 김정은 북한 국무위원장을 만나 블라디미르 푸틴 러시아 대통령의 메시지를 전달했다. 이날 오전 평양에 도착한 쇼이구 서기는 김 위원장을 만나 “푸틴 대통령이 가장 따뜻한 축하와 인사를 전했다”며 “(푸틴 대통령은 북-러가) 맺은 협정 이…,4시간 전,https://www.donga.com/news/Politics/article/all/20250321/131257662/2,동아일보
"檢, ‘명태균 여론조사 의혹’ 김종인 조사… 이르면 내주 오세훈 소환 전망",https://dimg.donga.com/a/296/167/95/2/wps/NEWS/IMAGE/2025/03/21/131257514.1.jpg,"오세훈 서울시장의 여론조사 비용 대납 의혹과 이른바 ‘명태균 게이트’를 수사 중인 검찰이 김종인 전 국민의힘 비상대책위원장을 21일 조사했다. 전날 서울시장 집무실, 공관 등 대대적인 압수수색을 진행한 검찰은 하루 만에 김 전 위원장까지 조사하며 오 시장에 대한 수사망을 빠르게 좁혀 …",4시간 전,https://www.donga.com/news/Society/article/all/20250321/131257840/2,동아일보
러 쇼이구 방북…김정은에 푸틴 메시지 전달,https://dimg.donga.com/a/296/167/95/2/wps/NEWS/IMAGE/2025/03/21/131252609.1.jpg,세르게이 쇼이구 러시아 국가안보회의 서기가 21일 김정은 북한 국무위원장을 만나 블라디미르 푸틴 러시아 대통령의 메시지를 전달했다.이날 오전 평양에 도착한 쇼이구 서기는 김 위원장을 만나 “푸틴 대통령이 가장 따뜻한 축하와 인사를 전했다”며 “(푸틴 대통령은 북-러가) 맺은 협정 이행…,9시간 전,https://www.donga.com/news/Politics/article/all/20250321/131257171/1,동아일보
“즉시 파면” “탄핵 각하” 헌재 앞에서 매일 회견 열겠다는 여야,https://dimg.donga.com/a/296/167/95/2/wps/NEWS/IMAGE/2025/03/21/131257657.1.jpg,21일 오전 9시경 서울 종로구 헌법재판소 앞. 여야 국회의원들이 고성을 지르며 실랑이를 벌였다. 더불어민주당 의원들이 헌재 현판 앞에서 기자회견을 진행 중인 가운데 국민의힘 의원들이 자리를 비켜달라고 요구하자 실랑이가 벌어진 것이다. ‘즉시 파면’ 팻말을 든 민주당 의원들이 “왜 굳…,9시간 전,https://www.donga.com/news/Politics/article/all/20250321/131254139/1,동아일보
"檢, ‘명태균 여론조사 의혹’ 김종인 조사…오세훈 소환 초읽기",https://dimg.donga.com/a/296/167/95/2/wps/NEWS/IMAGE/2025/03/21/131257514.1.jpg,"오세훈 서울시장의 여론조사 비용 대납 의혹과 이른바 ‘명태균 게이트’를 수사 중인 검찰이 김종인 전 국민의힘 비상대책위원장을 21일 조사했다. 전날 서울시장 집무실, 공관 등 대대적인 압수수색을 진행한 검찰은 하루 만에 김 전 위원장까지 조사하며 오 시장에 대한 수사망을 빠르게 좁혀가…",9시간 전,https://www.donga.com/news/Society/article/all/20250321/131254208/1,동아일보
"러 쇼이구, 北김정은 만나 푸틴 메시지 전달",https://dimg.donga.com/a/296/167/95/2/wps/NEWS/IMAGE/2025/03/21/131252609.1.jpg,북한을 방문한 세르게이 쇼이구 러시아 국가안보회의 서기가 21일 김정은 국무위원장을 만났다고 현지 언론이 보도했다.이날 러시아 타스 통신 등에 따르면 쇼이구 서기는 이날 김 위원장을 만나 블라드미르 푸틴 러시아 대통령의 메시지를 전달했다. 이 언론은 쇼이구 서기가 김 위원장에 “푸틴 …,10시간 전,https://www.donga.com/news/Inter/article/all/20250321/131257257/1,동아일보
軍 “포천 오폭사고 전투기 조종사 2명 자격정지 1년 결정”,https://dimg.donga.com/a/296/167/95/2/wps/NEWS/IMAGE/2025/03/21/131257241.1.jpg,화력 실사격 훈련 중 민가 오폭 사고를 낸 KF-16 조종사들이 자격정지 1년 처분을 받았다.공군은 21일 출입기자단에 보낸 문자 공지에서 “오늘 조종사 2명에 대해 ‘공중근무자격 심사위원회’를 열고 이들의 공중 근무 자격을 1년 정지하기로 의결했다”라며 “향후 국방부 조사본부의 조사…,10시간 전,https://www.donga.com/news/Politics/article/all/20250321/131257240/1,동아일보
"野, 10년전 ‘국정농단’ 꺼내 최상목 고발…與, “강요죄” 이재명 맞고발",https://dimg.donga.com/a/296/167/95/2/wps/NEWS/IMAGE/2025/03/21/131257228.1.jpg,21일 더불어민주당이 최상목 대통령 권한대행 부총리 겸 기획재정부 장관을 뇌물 및 공갈 혐의로 고위공직자범죄수사처에 고발한 사건은 박근혜 정부의 국정농단과 관련한 청와대의 미르·K스포츠재단에 대한 대기업의 출연 강요 의혹이다. 최 권한대행은 박근혜 정부 시절인 2014년부터 2015년…,10시간 전,https://www.donga.com/news/Politics/article/all/20250321/131255599/1,동아일보
"野 5당, 끝내 ‘대행의 대행’까지 ‘30번째 탄핵’",https://dimg.donga.com/a/296/167/95/2/wps/NEWS/IMAGE/2025/03/21/131257097.1.jpg,더불어민주당 등 야 5당이 21일 최상목 대통령 권한대행 부총리 겸 기획재정부 장관의 탄핵소추안을 발의했다. ‘줄탄핵’에 대한 당내 일각의 우려에도 윤석열 정부 출범 이후 30번째 탄핵을 시도하고 나선 것. 헌법재판소가 24일 한덕수 국무총리에 대한 탄핵심판 결정을 선고한다고 밝히면서…,10시간 전,https://www.donga.com/news/Politics/article/all/20250321/131255710/1,동아일보
"최상목 “산청 산불, 조기 진화·주민 대피에 만전 기하라”",https://dimg.donga.com/a/296/167/95/2/wps/NEWS/IMAGE/2025/03/21/131256824.1.jpg,"최상목 대통령 권한대행 부총리 겸 기획재정부 장관은 21일 경상남도 산청군 시천면 산불 발생 보고를 받고 조기 진화와 주민 대피에 만전을 기할 것을 지시했다고 국무조정실이 밝혔다.최 대행은 “산림청은 지자체, 소방청, 국방부 등과 협조해 활용 가능한 모든 장비와 인력을 동원해 산불 조…",11시간 전,https://www.donga.com/news/Politics/article/all/20250321/131256823/1,동아일보
"조태열, 日 관방장관 면담…“한일 관계 긍정적 흐름 지속”",https://dimg.donga.com/a/296/167/95/2/wps/NEWS/IMAGE/2025/03/21/131256437.1.jpg,제11차 한일중 외교장관회의 참석차 방일 중인 조태열 외교부장관은 21일 하야시 요시마사 일본 관방 장관과 면담하고 한일 관계 개선 기조 흐름을 지속하자는데 뜻을 모았다. 외교부에 따르면 조 장관은 이날 오후 하야시 관방장관이 한일 관계 발전에 기여해 온 것을 평가하고 미래지향적 양국…,11시간 전,https://www.donga.com/news/Politics/article/all/20250321/131256436/1,동아일보
"정부, ‘우키시마호’ 조선인 승선자 명부 모두 입수…사고 80년만",https://dimg.donga.com/a/296/167/95/2/wps/NEWS/IMAGE/2025/03/21/131255900.1.jpg,정부가 조선인 수천 명이 희생된 것으로 알려진 1945년 ‘우키시마호’ 폭침 사건과 관련해 80년 만에 일본 정부가 보유하고 있다고 밝힌 승선자 명부를 모두 제공받았다.외교부는 21일 “일본 정부와 협의를 거쳐 이날 우키시마호 승선자 명부 관련 자료 22건을 추가로 제공받았다”라고 밝…,12시간 전,https://www.donga.com/news/Politics/article/all/20250321/131255899/1,동아일보
이재명 연금개혁 처리에 “모처럼 칭찬받을 일 해” 자평,https://dimg.donga.com/a/296/167/95/2/wps/NEWS/IMAGE/2025/03/21/131254726.2.jpg,이재명 더불어민주당 대표가 연금개혁안 처리와 관련해 “작년 12월 3일 군사계엄을 해제시킨 것에는 미치지 못하겠지만 그래도 양보와 타협으로 큰 개혁안을 끌어냈다”고 평가했다.이 대표는 21일 오전 최고위원회의에서 “모처럼 국회와 정치권이 국민으로부터 칭찬받을 일을 해냈다”며 이같이 말…,13시간 전,https://www.donga.com/news/Society/article/all/20250321/131254725/2,동아일보
김경수 “폭력과 테러는 절대 용납 못해…일벌백계해야”,https://dimg.donga.com/a/296/167/95/2/wps/NEWS/IMAGE/2025/03/21/131254623.1.jpg,김경수 전 경남도지사는 21일 최근 헌법재판소 앞에서 더불어민주당 의원이 테러당한 것 등 폭력행위가 자행되고 있는 상황에 “폭력과 테러는 절대 용납할 수 없다”고 강조했다.김 전 지사는 이날 사회관계망서비스(SNS)를 통해 “민주주의 국가에서 있어서는 안 될 백색테러가 연일 벌어지고 …,13시간 전,https://www.donga.com/news/Politics/article/all/20250321/131254622/1,동아일보
與 “연금특위에 젊은의원 배치해 의견 반영”…이재명 “군복무 크레디트 1년만 인정 아쉬워”,https://dimg.donga.com/a/296/167/95/2/wps/NEWS/IMAGE/2025/03/21/131254608.1.jpg,‘더 내고 더 받는’ 방식의 국민연금 모수개혁안이 국회 본회의를 통과한 가운데 국민의힘이 국회 연금개혁특별위원회(연금특위)에서 연금재정 고갈 시 받는 돈을 자동으로 삭감하는 자동조정장치 도입 문제를 중점 논의하겠다고 밝혔다. 18년만의 모수개혁 합의한데 이어 청년층 표심을 고려해 젊…,13시간 전,https://www.donga.com/news/Politics/article/all/20250321/131253971/1,동아일보
‘尹탄핵’ 찬성 58％-반대 36％…중도층 찬성 64%[한국갤럽],https://dimg.donga.com/a/296/167/95/2/wps/NEWS/IMAGE/2025/03/21/131254564.1.jpg,"윤석열 대통령 탄핵에 찬성한다는 답변이 58%, 반대한다는 답변이 36%라는 여론조사 결과가 21일 나왔다.한국갤럽이 18~20일 전국 만 18세 이상 남녀 1003명을 대상으로 실시해 이날 발표한 여론조사(전화조사원이 무선전화 인터뷰 방식으로 실시. 자세한 사항은 중앙선거여론조사심의…",14시간 전,https://www.donga.com/news/Politics/article/all/20250321/131253624/1,동아일보
"민주, 與 ‘이재명 고발’에 “법에 대한 조롱이자 모독”",https://dimg.donga.com/a/296/167/95/2/wps/NEWS/IMAGE/2025/03/21/131254469.1.jpg,더불어민주당이 21일 이재명 대표에 대한 강요죄 고발 방침을 밝힌 국민의힘을 향해 “궤변을 넘어 법에 대한 조롱이고 모독”이라며 “강요죄는 헌재 판결을 이행하지 말라고 강요하는 국민의힘에나 적용될 혐의”라고 비판했다.이건태 대변인은 이날 서면브리핑을 통해 “마은혁 헌법재판관 후보자를 …,14시간 전,https://www.donga.com/news/Politics/article/all/20250321/131254468/1,동아일보
"‘최연소 출마’ 예약 이준석 “당원 92% 지지 감사, 압도적 새로움 보일 것”",https://dimg.donga.com/a/296/167/95/2/wps/NEWS/IMAGE/2025/03/21/131254338.1.jpg,개혁신당 당원 92.81%의 지지를 받아 차기 대통령 선거 후보로 확정된 이준석 의원은 당원들에게 보낼 이메일 메시지를 통해 “압도적 새로움을 보여주겠다”고 약속했다. 21일 정치권에 따르면 개혁신당은 지난 경선 과정에서 후보자에 대한 인터넷 찬반 투표를 한 당원들을 대상으로 이 의원…,14시간 전,https://www.donga.com/news/Politics/article/all/20250321/131254337/1,동아일보
‘13일째 단식’ 김경수 “체력 허락까지 버틸 것”…李 만류에도 강행 의지,https://dimg.donga.com/a/296/167/95/2/wps/NEWS/IMAGE/2025/03/21/131254318.1.jpg,13일째 단식을 이어오고 있는 김경수 전 경남도지사가 21일 이재명 더불어민주당 대표의 단식 중단 요청에도 “체력이 허락하는 데까지 버티겠다”고 입장을 밝혔다.김 전 지사는 이날 오후 사회관계망서비스(SNS)를 통해 “이 대표께서 농성장을 찾아 단식 중단을 요청해 줬다”며 이같이 말했…,14시간 전,https://www.donga.com/news/Politics/article/all/20250321/131254317/1,동아일보
"이재명, 22일 광화문 집회 참석 독려…“신속한 선고로 정상화”",https://dimg.donga.com/a/296/167/95/2/wps/NEWS/IMAGE/2025/03/21/131254162.1.jpg,"이재명 더불어민주당 대표는 21일 “매일 밤, 빛의 혁명으로 광장을 채우는 우리 국민의 간절함에 헌법재판소는 신속한 선고로 응답해야 한다”며 집회 참여를 촉구했다.이 대표는 이날 당원 등에게 보낸 문자 메시지를 통해 오는 22일 서울 광화문 동십자각에서 열리는 ‘야5당 공동 내란종식·…",14시간 전,https://www.donga.com/news/Politics/article/all/20250321/131254161/1,동아일보
"“국제질서 리셋의 시간…한국, 협력 공간 넓혀야” [화정 인사이트 ⑦]",https://dimg.donga.com/a/296/167/95/2/wps/NEWS/IMAGE/2025/03/21/131253953.1.jpg,미국은 4월 2일 전 세계를 상대로 한 상호관세 부과를 앞두고 미국에 고관세를 부과하는 ‘더티 15’(Dirty 15) 국가들을 거론하면서 국제사회를 압박했다. 그러면서 ‘민감국가 및 기타 지정국가 목록’(Sensitive and Other Designated Countries Lis…,14시간 전,https://www.donga.com/news/Politics/article/all/20250321/131253876/1,동아일보
권성동 “기어이 30번째 탄핵…국정 파괴하는 테러리즘”,https://dimg.donga.com/a/296/167/95/2/wps/NEWS/IMAGE/2025/03/21/131253908.1.jpg,더불어민주당을 포함한 5개 야당이 21일 최상목 대통령 권한대행 부총리 겸 기획재정부 장관에 대한 탄핵소추안을 발의한 데 대해 국민의힘 권성동 원내대표가 “국정을 파괴하는 테러리즘”이라고 비판했다.권 원내대표는 이날 민주당의 탄핵소추안 발의 직후 기자간담회에서 “이재명 대표가 기어이 …,15시간 전,https://www.donga.com/news/Politics/article/all/20250321/131253900/1,동아일보
"국민의힘, 이재용 만난 이재명 비판…“뻔뻔해 말문 막혀”",https://dimg.donga.com/a/296/167/95/2/wps/NEWS/IMAGE/2025/03/21/131253754.1.jpg,국민의힘은 21일 이재용 삼성전자 회장을 만난 이재명 더불어민주당 대표를 겨냥해 “뻔뻔하게 기업 경쟁력을 운운하니 말문이 막힐 따름”이라고 비판했다.김상훈 정책위의장은 이날 오전 원내대책회의에서 “민주당은 기업의 국제 경쟁력을 키우기보다 반대로 기업 발목만 잡고 있는 입법만 하고 있다…,15시간 전,https://www.donga.com/news/Politics/article/all/20250321/131253753/1,동아일보
서울 동작구 공사현장서 6·25전사자 유해 발굴,https://dimg.donga.com/a/296/167/95/2/wps/NEWS/IMAGE/2025/03/21/131253645.1.jpg,국방부유해발굴감식단(국유단)은 13일부터 이틀간 서울 동작구 공사현장에서 6·25전사자 유해 발굴을 진행해 유해 및 유품을 수습했다.21일 국유단에 따르면 이번 발굴은 지난 12일 아파트 공사현장에서 굴삭기 작업 중이던 건설업체 직원이 제보를 하면서 시작됐다. 이 제보자는 “수방사 부…,15시간 전,https://www.donga.com/news/Politics/article/all/20250321/131253644/1,동아일보
한덕수 복귀 기대하는 총리실 “국민통합 메시지 낼 것”,https://dimg.donga.com/a/296/167/95/2/wps/NEWS/IMAGE/2025/03/21/131253625.1.jpg,"한덕수 국무총리의 헌법재판소 탄핵심판 결정이 24일로 정해지자 국무총리실은 “선고를 차분히 지켜볼 것”이라면서도 복귀 기대감을 드러내고 있다. 총리실은 한 총리가 복귀할 경우 즉각 업무수행을 할 수 있도록 준비하는 한편, 국민 통합의 뜻을 담은 대국민 담화도 검토하는 것으로 알려졌다.…",15시간 전,https://www.donga.com/news/Politics/article/all/20250321/131253225/1,동아일보
경찰차 밑에 누운 보수 유튜버…헌재 일대 극심한 혼란,https://dimg.donga.com/a/296/167/95/2/wps/NEWS/IMAGE/2025/03/21/131253492.3.jpg,4개의 확성기가 달린 차량을 타고 헌법재판소 주위를 돌며 시위 하던 보수 유튜버 등이 경찰과 실랑이를 벌였다. 21일 오전 서울 종로구 안국역 사거리에서 한 유튜버는 자신들의 차량이 경찰에 가로 막히자 경찰 차량 밑으로 들어가 드러누웠다.전날에도 안국역 일대는 혼란스러웠다. 경찰은 헌…,16시간 전,https://www.donga.com/news/Politics/article/all/20250321/131253602/2,동아일보
"야5당, 최상목 탄핵안 제출…“한덕수 복귀 여부와 무관”",https://dimg.donga.com/a/296/167/95/2/wps/NEWS/IMAGE/2025/03/21/131253773.1.jpg,더불어민주당이 야4당과 함께 최상목 대통령 권한대행 부총리 겸 기획재정부 장관에 대한 탄핵소추안을 21일 발의했다. 윤석열 정부 들어 민주당이 주도한 30번째 탄핵안이다. 이에 앞서 민주당은 최 권한대행을 뇌물죄 및 공갈죄 혐의로 고위공직자범죄수사처에 고발하기도 했다. 윤석열 대통령의…,16시간 전,https://www.donga.com/news/Politics/article/all/20250321/131253385/2,동아일보
"이재명 “최상목, 헌정 통째로 파괴…이런 황당한 사람 처음”",https://dimg.donga.com/a/296/167/95/2/wps/NEWS/IMAGE/2025/03/21/131253185.1.jpg,더불어민주당 이재명 대표가 21일 최상목 대통령 권한대행 부총리 겸 기획재정부 장관을 향해 “헌정 질서를 통째로 파괴하려 작심했다” “공직자인지 의심스럽다” 등의 강한 비판을 쏟아냈다.이 대표는 이날 서울 종로구 광화문 앞에서 윤석열 대통령 파면을 촉구하며 농성을 벌이고 있는 김경수 …,16시간 전,https://www.donga.com/news/Politics/article/all/20250321/131253157/1,동아일보
"한미, 민감국가 문제 조속히 해결 합의…韓 제외 공감",https://dimg.donga.com/a/296/167/95/2/wps/NEWS/IMAGE/2025/03/21/131252944.1.jpg,한미 양국이 미국 에너지부(DOE)의 ‘민감국가 및 기타 지정국가 목록(SCL)’에 한국이 포함된 데 대한 문제 해결을 위해 협력하기로 합의했다.산업통상자원부는 안덕근 산업부 장관이 미국 워싱턴D.C.를 방문해 크리스 라이트 미국 에너지부 장관과 첫 회담을 개최한 자리에서 이 같이 합…,17시간 전,https://www.donga.com/news/Politics/article/all/20250321/131252938/1,동아일보
尹탄핵 장외 여론전 과열…주말 30만명 집회 신고 ‘3배 껑충’,https://dimg.donga.com/a/296/167/95/2/wps/NEWS/IMAGE/2025/03/21/131252788.1.jpg,22일 서울 도심 곳곳에서 윤석열 대통령 탄핵 찬성·반대 집회가 대규모로 잇따라 열린다. 지난주 10만 명 규모에서 껑충 뛴 총 30만 명 규모의 집회가 신고된 상황이다. 윤 대통령에 대한 탄핵심판 선고가 예상보다 늦어지면서 서울 도심 마비 현상이 장기화되고 있다. 날씨까지 풀리며 많…,17시간 전,https://www.donga.com/news/Society/article/all/20250321/131252719/1,동아일보
"與, 민주 ‘최상목 고발’에 이재명 ‘강요 혐의’ 고발로 맞불",https://dimg.donga.com/a/296/167/95/2/wps/NEWS/IMAGE/2025/03/21/131252677.1.jpg,국민의힘은 21일 더불어민주당이 최상목 대통령 권한대행 부총리 겸 기획재정부 장관을 고위공직자범죄수사처(공수처)에 고발하자 이재명 민주당 대표를 고발하겠다고 밝혔다.국민의힘 법률자문위원장을 맡고 있는 주진우 의원은 이날 언론 공지를 통해 “이 대표와 박균택 민주당 의원을 강요 혐의 …,19시간 전,https://www.donga.com/news/Politics/article/all/20250321/131252676/1,동아일보
