title,thumbnail,short_content,write_time,link,company
"[단독]국힘, ‘한동훈 제명 반대 성명’ 배현진 징계 절차 착수",https://dimg.donga.com/a/296/167/95/2/wps/NEWS/IMAGE/2026/02/06/133314124.1.jpg,국민의힘 중앙윤리위원회가 6일 배현진 의원에 대한 징계 절차에 착수한 것으로 알려졌다. 한동훈 전 대표 제명 이후 심리적 분당 상태에 빠진 국민의힘의 내홍은 더 깊어질 전망이다.이날 중앙윤리위는 윤민우 중앙윤리위원장 주재로 회의를 열고 배 의원에 대한 징계 안건을 논의한 것으로 전해졌…,1시간 전,https://www.donga.com/news/Politics/article/all/20260206/133313968/1,동아일보
李 “부동산 정리하면 임금격차…비정규직 박봉 당연시 안 돼”,https://dimg.donga.com/a/296/167/95/2/wps/NEWS/IMAGE/2026/02/06/133313935.3.jpg,이재명 대통령은 6일 임금 격차 문제를 언급하며 “어느 시점에 우리 사회의 주요 의제로 한 번쯤은 시끄럽게 논쟁해야 할 일”이라고 밝혔다. 아울러 최저임금에 맞춰서 인건비를 지급하는 관행을 지적하며 ‘적정임금’의 필요성을 강조했다.이 대통령은 이날 경남 창원컨벤션센터에서 열린 ‘경남의…,1시간 전,https://www.donga.com/news/Politics/article/all/20260206/133313932/2,동아일보
李대통령 “몰빵 전략 한계…지역 균형발전으로 국토 대전환”,https://dimg.donga.com/a/296/167/95/2/wps/NEWS/IMAGE/2026/02/06/133311111.1.jpg,"이재명 대통령은 6일 “대한민국은 지난 시기에 모든 자원과 기회를 한쪽으로 몰아서 소위 몰빵하는, 올인 전략을 구사했다”며 “이제는 이런 일극 체제, 불균형 성장 전략이 한계를 맞이했다”고 말했다.이 대통령은 이날 경남 거제에서 열린 남부내륙철도 착공식에 참석해 이 같이 말했다. 경북…",1시간 전,https://www.donga.com/news/Politics/article/all/20260206/133312277/1,동아일보
"나도 걸테니 너도 걸어라?…“장동혁, 당을 포커판 만들어” 내홍",https://dimg.donga.com/a/296/167/95/2/wps/NEWS/IMAGE/2026/02/06/133312414.1.jpg,"장동혁 대표가 “직(職)을 걸고 사퇴·재신임을 요구하면 즉각 당원투표에 돌입하겠다”고 밝힌 것을 두고 국민의힘에선 이틀째 내홍이 확산됐다. 오세훈 서울시장은 “장 대표는 자격을 잃었다”고 직격했고, 소장·개혁파 인사들은 “도박판 정치” “조폭 정치”라는 비판을 쏟아냈다. 장 대표는 “…",1시간 전,https://www.donga.com/news/Politics/article/all/20260206/133313113/1,동아일보
정청래 만난 3선들 “이러다 가래로도 못 막아…‘결자해지’하라”,https://dimg.donga.com/a/296/167/95/2/wps/NEWS/IMAGE/2026/02/06/133313310.1.jpg,소병훈 더불어민주당 3선 의원 모임 대표가 최근 조국혁신당과의 합당 문제에 대한 당내 갈등을 두고 “정청래 대표와 최고위원이 결자해지해야 한다. 호미로 막을 것 가래로도 못 막게 된다”고 말했다. 정청래 민주당 대표는 “원내대표에게 빠른 시간에 전체 의원총회 소집을 요청했다”고 했다.…,2시간 전,https://www.donga.com/news/Politics/article/all/20260206/133313436/1,동아일보
‘대장동 50억 의혹’ 곽상도 아들 무죄…郭은 공소기각,https://dimg.donga.com/a/296/167/95/2/wps/NEWS/IMAGE/2026/02/06/133313425.1.jpg,이른바 ‘50억 클럽’ 관련 의혹으로 기소된 곽상도 전 국민의힘 의원에 대해 법원이 공소를 기각했다. 곽 전 의원의 아들 병채 씨의 뇌물수수 혐의에 대해서도 무죄로 판단했다.6일 서울중앙지법 형사합의23부(부장판사 오세용)는 곽 전 의원과 화천대유자산관리(화천대유) 대주주 김만배 씨의…,2시간 전,https://www.donga.com/news/Society/article/all/20260206/133312208/1,동아일보
연두색 저고리 입고 등장한 김혜경 여사…“예쁘시다”,https://dimg.donga.com/a/296/167/95/2/wps/NEWS/IMAGE/2026/02/06/133314218.1.jpg,해외 순방 등 국내외 행사에서 한복을 착용해 온 이재명 대통령 부인 김혜경 여사가 6일 한복 명예홍보대사로 추서됐다.이날 서울 정동1928 아트센터에서 열린 설맞이 한복인 신년회 ‘새해를 입다(Wear the New Year!)’에서 정순훈 한복세계화재단 이사장은 김 여사에게 한복 명…,2시간 전,https://www.donga.com/news/Politics/article/all/20260206/133313241/2,동아일보
與 전략공관위원장에 ‘친문’ 황희…잇단 ‘비명’ 기용에 내홍,https://dimg.donga.com/a/296/167/95/2/wps/NEWS/IMAGE/2026/02/06/133313027.1.jpg,더불어민주당 정청래 지도부가 주요 당직자에 비명(비이재명)계로 분류되는 인물을 잇따라 발탁하면서 당 갈등이 불거지고 있다. 6·3지방선거에서 전략공천 방향성을 정할 전략공천관리위원장에 친문(친문재인) 성향의 3선 황희 의원을 임명했고 싱크탱크인 민주연구원 부원장에 비명 성향의 이진련…,2시간 전,https://www.donga.com/news/Politics/article/all/20260206/133312219/1,동아일보
‘코스피 5000’ 안 믿었다고?…李 “믿는 자에게 복이 있는데”,https://dimg.donga.com/a/296/167/95/2/wps/NEWS/IMAGE/2026/02/06/133312608.3.jpg,“대통령님이 코스피 5000을 말씀하실 때 여기 계신 분들 안 믿으셨죠?”(배경훈 부총리 겸 과학기술정보통신부 장관)(좌중 웃음)“믿는 자에게 복이 있는데.”(이재명 대통령)“그런데 그것들이 다 실제 현실화되고 있습니다. 이렇게 만들어주신 대통령님께 박수 한번 우리”(배 부총리)(좌중…,3시간 전,https://www.donga.com/news/Politics/article/all/20260206/133312602/2,동아일보
"정청래 “보완수사권 안 준단, 폐지한단 뜻”…李 요구 재차 일축",https://dimg.donga.com/a/296/167/95/2/wps/NEWS/IMAGE/2026/02/06/133312620.1.jpg,더불어민주당 정청래 대표가 6일 “보완수사 요구권을 준다는 것은 보완수사권도 주지 않겠다는 뜻이다. 보완수사권을 폐지하겠다는 것”이라고 밝혔다. 이재명 대통령이 언급한 보완수사권의 ‘예외적 허용’도 하지 않겠다는 점을 재차 강조한 것이다.정 대표는 이날 최고위원회의에서 “민주당은 어제…,3시간 전,https://www.donga.com/news/Politics/article/all/20260206/133312292/1,동아일보
李 “주가조작땐 패가망신”…경제지 기자 선행매매 혐의에 경고,https://dimg.donga.com/a/296/167/95/2/wps/NEWS/IMAGE/2026/02/06/133311126.1.jpg,이재명 대통령은 6일 한 경제지 기자들의 선행매매 혐의에 대해 “주가조작 패가망신”이라고 했다. 이 대통령은 이날 X(옛 트위터)에 국내 한 경제지 매체 소속 기자들이 선행매매를 벌여 강제 수사를 받는다는 내용의 기사를 게시했다. 그러면서 “주가조작 패가망신”이라고 짧게 언급했다.해당…,3시간 전,https://www.donga.com/news/Politics/article/all/20260206/133312468/1,동아일보
출산 50일전부터 ‘아빠 휴가’ 쓸수 있다…유산때도 5일 휴가,https://dimg.donga.com/a/296/167/95/2/wps/NEWS/IMAGE/2026/02/06/133312448.1.jpg,아이가 태어난 뒤에만 쓸 수 있던 남편의 출산휴가를 ‘출산전후휴가’로 바꿔 배우자의 출산 직전에도 사용할 수 있게 하는 법안이 6일 국회 상임위원회 문턱을 넘었다. 기후에너지환경노동위원회는 이날 전체회의에서 이 같은 내용의 ‘남녀고용평등과 일·가정 양립 지원에 관한 법률’ 개정안을 통…,3시간 전,https://www.donga.com/news/Politics/article/all/20260206/133312217/1,동아일보
"李 “서울 1평에 3억, 말이 되나…경남은 한채에 3억?”",https://dimg.donga.com/a/296/167/95/2/wps/NEWS/IMAGE/2026/02/06/133312278.3.jpg,"이재명 대통령 “대한민국이 보시면 알지만, 요새 서울 수도권은 집값 때문에 시끄럽죠? 제가 요새 그거 때문에 좀 힘들어요.”(좌중 웃음)이 대통령 “아, 저항 강도가 만만치 않습니다. 그래도 아파트 한 평에 3억 원씩 한다는 게 말이 됩니까? 여기는 아파트 한 채에 3억…?”(좌중 또…",3시간 전,https://www.donga.com/news/Politics/article/all/20260206/133312258/2,동아일보
"조현 “美, 韓통상이행 관련 분위기 좋지 않다고 말해”",https://dimg.donga.com/a/296/167/95/2/wps/NEWS/IMAGE/2026/02/06/133312243.1.jpg,마코 루비오 미국 국무장관이 “(한국의) 통상 공약 이행과 관련해 미국 내 분위기가 좋지 않다”고 말했다고 방미 중인 조현 외교부 장관이 5일(현지 시간) 밝혔다. 미국 내에선 한국에 대한 관세를 25%로 인상하는 내용을 연방관보에 게재하는 절차가 임박한 것으로 알려졌다. 이에 한국 …,3시간 전,https://www.donga.com/news/Inter/article/all/20260206/133311247/1,동아일보
아빠 출산휴가도 예정일 50일 전부터 가능…유산 땐 5일 휴가,https://dimg.donga.com/a/296/167/95/2/wps/NEWS/IMAGE/2026/02/06/133312295.1.jpg,아빠의 출산휴가를 ‘출산전후 휴가’로 바꿔 아내의 임신 기간 중에도 사용할 수 있도록 하는 법안이 6일 국회 상임위원회를 통과했다.기후에너지환경노동위원회는 이날 전체회의에서 이 같은 내용의 ‘남녀고용평등과 일·가정 양립 지원에 관한 법률’ 개정안을 가결했다.개정안은 배우자의 출산 예정…,4시간 전,https://www.donga.com/news/Politics/article/all/20260206/133312209/1,동아일보
"‘尹내란 재판장’ 지귀연, 19일 선고후 중앙지법 떠난다",https://dimg.donga.com/a/296/167/95/2/wps/NEWS/IMAGE/2026/02/06/133312173.1.jpg,윤석열 전 대통령의 내란 우두머리 사건을 심리하고 있는 지귀연 부장판사가 법관 정기인사로 서울중앙지법을 떠난다. 다만 인사 시점은 윤 전 대통령 등 선고기일 이후라 선고에 차질은 없을 것으로 보인다. 6일 대법원이 공개한 올해 지방법원 부장판사 이하 법관 정기인사 내역에 따르면 지 부…,4시간 전,https://www.donga.com/news/Society/article/all/20260206/133312167/1,동아일보
"반청 “합당 문건, 누가·언제·왜 만들었는지 정청래가 밝혀라”",https://dimg.donga.com/a/296/167/95/2/wps/NEWS/IMAGE/2026/02/06/133311845.1.jpg,"이언주, 강득구, 황명선 더불어민주당 최고위원은 6일 국회에서 기자회견을 열고 민주당이 사무처에서 작성했다고 밝힌 일명 ‘조국혁신당 합당 문건’에 대해 “누가, 언제, 왜 문건을 작성했는지 정청래 대표가 밝히고 합당 절차를 중단해라”라고 요구했다. 그러면서 “정 대표는 문건을 공개하고…",4시간 전,https://www.donga.com/news/Politics/article/all/20260206/133311882/1,동아일보
"오세훈 “장동혁, 당심에 갇혀 민심 못봐…자격 잃었다”",https://dimg.donga.com/a/296/167/95/2/wps/NEWS/IMAGE/2026/02/06/133311780.1.jpg,"오세훈 서울시장은 6일 국민의힘 장동혁 대표를 향해 “스스로 자격을 잃었다”고 비판했다. 전날 장 대표는 ‘한동훈 제명’ 이후 자신을 향한 사퇴 및 재신임 요구에 대해 직을 걸고 요구하라는 입장을 밝혔다.오 시장은 이날 페이스북에 “장 대표가 원하는 당원 투표 결과가 나온다 한들, 그…",5시간 전,https://www.donga.com/news/Politics/article/all/20260206/133311654/2,동아일보
지방선거 “與 이겨야” 44% “野 승리” 32%…격차 벌어져,https://dimg.donga.com/a/296/167/95/2/wps/NEWS/IMAGE/2026/02/06/133311323.1.jpg,6·3 지방선거가 4개월 앞으로 다가온 가운데 이번 선거에서 “여당이 승리해야 한다”는 의견이 야당이 이겨야 한다는 의견보다 10%포인트 이상 더 많다는 여론조사 결과가 나왔다.한국갤럽이 3~5일 전국 만 18세 이상 1001명을 대상으로 조사해 6일 공개한 여론조사에 따르면(무선 전…,5시간 전,https://www.donga.com/news/Politics/article/all/20260206/133311311/1,동아일보
"44% “지선, 與 승리” 32% “野 이겨야”…정청래 38% 장동혁 27% [갤럽]",https://dimg.donga.com/a/296/167/95/2/wps/NEWS/IMAGE/2026/02/06/133311269.1.jpg,"오는 6월 치러질 제9회 지방선거에서 ‘여당 후보’가 더 많이 당선돼야 한다는 여론이 더 많은 것으로 나타났다. 한국갤럽이 지난 3~5일 전국 만 18세 이상 1001명을 대상으로 조사해 6일 발표한 결과에 따르면, 지방선거 결과로 ‘여당 후보가 많이 당선돼야 한다’는 응답은 44%로…",6시간 전,https://www.donga.com/news/Politics/article/all/20260206/133311268/1,동아일보
경찰 고위직 출신 6·3 지방선거 출마 러시…성적표 관심,https://dimg.donga.com/a/296/167/95/2/wps/NEWS/IMAGE/2026/02/06/133311415.1.jpg,6·3 지방선거를 앞두고 경찰 고위직 출신 인사들의 출마 러시가 이어지면서 이들의 성적표에 관심이 모아진다.6일 충북 정치권에 따르면 이번 지방선거 출마 예정자로 거론되는 총경급 이상 경찰 출신 인사만 8명에 이른다.국민의힘에서는 경찰총수에 올랐던 윤희근 전 경찰청장(57·치안총감)이…,6시간 전,https://www.donga.com/news/Politics/article/all/20260206/133311264/1,동아일보
"행안부, 지방선거 앞두고 공무원 감찰 강화…‘신고방’ 운영",https://dimg.donga.com/a/296/167/95/2/wps/NEWS/IMAGE/2026/02/06/133311259.1.jpg,정부가 6·3 지방선거를 앞두고 지방정부 공무원의 정치적 중립 의무 위반 행위를 집중 감찰한다. 행정안전부 누리집에 ‘선거 비리 익명신고방’도 운영할 방침이다.행정안전부는 6월3일 실시되는 제9회 전국동시지방선거가 공정하고 깨끗하게 치뤄질 수 있도록 지원하기 위해 ‘공명선거지원상황실’…,6시간 전,https://www.donga.com/news/Politics/article/all/20260206/133311258/1,동아일보
"‘우주 셀카’ 시대 열린다…NASA, 우주비행사 ‘스마트폰 지참’ 첫 허용",https://dimg.donga.com/a/296/167/95/2/wps/NEWS/IMAGE/2026/02/06/133311146.1.jpg,미 항공우주국(NASA)이 다음 주 발사 예정인 ‘크루-12’와 달 궤도 유인 탐사 임무인 ‘아르테미스 2호’를 기점으로 우주비행사의 개인 스마트폰 휴대를 사상 처음으로 허용하기로 했다. 이에 따라 앞으로 우주에서 촬영된 생생한 일상 영상과 ‘우주 셀카’가 소셜미디어를 통해 실시간으로…,6시간 전,https://www.donga.com/news/Politics/article/all/20260206/133311145/1,동아일보
"李 “몰빵 전략 한계…서울 집값, 사람 살 수 없는 지경”",https://dimg.donga.com/a/296/167/95/2/wps/NEWS/IMAGE/2026/02/06/133311126.1.jpg,이재명 대통령이 6일 오전 경남 거제시에서 열린 남부내륙철도 착공식에서 “남부내륙철도는 단순히 선로 하나를 놓는 사업이 아니다”라며 “수도권에 모든 것이 집중된 1극 체제에서 벗어나 사람과 지역을 잇고 기회를 연결하며 지역의 성장 동력을 만들어 내는 국토 대전환의 시작”이라고 말했다.…,7시간 전,https://www.donga.com/news/Politics/article/all/20260206/133311082/2,동아일보
"[단독]트럼프 행정부, 대북 인도적 지원사업 승인",https://dimg.donga.com/a/296/167/95/2/wps/NEWS/IMAGE/2026/02/06/133311020.1.jpg,도널드 트럼프 미국 행정부가 그동안 유엔 안전보장이사회 대북제재위원회에서 반대해온 대북 인도적 지원 사업 관련해 제재 면제를 승인해 주기로 한 것으로 확인됐다. 이에 국내 비정부기구(NGO) 등이 북한에 인도적 지원을 하는 길이 일단 열렸다는 평가다. 우리 정부는 이 같은 미국의 조치…,7시간 전,https://www.donga.com/news/Inter/article/all/20260206/133310993/1,동아일보
"오세훈, 권영세 만나 “용산국제업무지구 1만 가구 불가”…정치적 지원 요청",https://dimg.donga.com/a/296/167/95/2/wps/NEWS/IMAGE/2026/02/06/133310974.1.jpg,오세훈 서울시장이 용산국제업무지구 주택 공급 확대 문제와 관련해 지역구 의원인 국민의힘 권영세 의원을 만나 정부의 ‘1만 가구 공급’ 계획에 반대 입장을 설명하고 정치적 지원을 요청했다.오 시장은 6일 오전 서울시청 집무실에서 권 의원과 면담하며 “용산국제업무지구는 단순한 주택 공급 …,7시간 전,https://www.donga.com/news/Politics/article/all/20260206/133310924/1,동아일보
‘합당 문건’에 반청 폭발…“밀약-답정너 합당 즉각 중단하라”,https://dimg.donga.com/a/296/167/95/2/wps/NEWS/IMAGE/2026/02/05/133304662.1.jpg,더불어민주당과 조국혁신당의 합당 추진 계획이 담긴 문건이 공개된 이후 정치권에 후폭풍이 불고 있다. 당장 민주당 내부에선 정청래 민주당 대표의 합당 제안에 반대했던 의원들을 중심으로 해명 요구가 쏟아졌다. 한준호 의원은 기자회견을 열어 긴급 의원총회 소집을 공식 요구했다. 민주당은 실…,7시간 전,https://www.donga.com/news/Politics/article/all/20260206/133310965/1,동아일보
"文, 다음달 5일 LA 방문…퇴임 뒤 첫 해외 공식 일정",https://dimg.donga.com/a/296/167/95/2/wps/NEWS/IMAGE/2026/02/06/133310889.2.jpg,문재인 전 대통령이 다음 달 5일부터 미국 캘리포니아주 로스앤젤레스(LA)를 방문할 예정이다. 문 전 대통령의 퇴임 이후 첫 해외 공식 방문 일정이다. 문 전 대통령은 미국 싱크탱크 랜드연구소 관계자와 남북 관계 등에 관한 좌담회를 갖는다고 더불어민주당 윤건영 의원 측이 밝혔다.윤건영…,7시간 전,https://www.donga.com/news/Politics/article/all/20260206/133310872/2,동아일보
"“한국 가고파” 북한군 2명, 러·우 포로 교환 대상서 빠졌다",https://dimg.donga.com/a/296/167/95/2/wps/NEWS/IMAGE/2026/02/06/133310876.1.jpg,"러시아와 우크라이나가 지난 5일(현지시간) 총 314명의 전쟁 포로를 교환하기로 합의했지만, 한국 귀순 의사를 밝혀온 북한군 포로 2명은 교환 대상에서 빠진 것으로 확인됐다.탈북민 단체 ‘겨레얼통일연대’의 장세율 대표는 6일 뉴스1에 “그간 포로 송환 문제에 있어 협력해온 국제 비정부…",7시간 전,https://www.donga.com/news/Politics/article/all/20260206/133310875/1,동아일보
"정청래, 檢 위례 항소포기에 “이재명 죽이기 잘못된 의도”",https://dimg.donga.com/a/296/167/95/2/wps/NEWS/IMAGE/2026/02/06/133310555.2.jpg,더불어민주당 정청래 대표는 검찰의 ‘위례 신도시 개발사업 특혜 의혹 사건’ 항소 포기를 두고 “(검찰 수사는) ‘이재명 죽이기’에 초점이 맞춰져 있었다”며 “시작부터 잘못된 의도를 품었으니 당연히 무리한 수사로 점철된 것”이라고 6일 말했다. 정 대표는 이를 고리 삼아 “검찰개혁이 왜…,8시간 전,https://www.donga.com/news/Politics/article/all/20260206/133310554/2,동아일보
"“정청래 잘한다” 38%, “장동혁 잘한다” 27%…당 지지층서도 두자릿수 하락",https://dimg.donga.com/a/296/167/95/2/wps/NEWS/IMAGE/2026/02/06/133310642.1.jpg,더불어민주당 정청래 대표와 국민의힘 장동혁 대표가 각각 당내 지지율이 두자릿수로 떨어졌다는 여론조사 결과가 나왔다. 두 사람 모두 전체 유권자를 대상으로 묻는 지지율에서도 하락세를 면치 못했다. 6일 한국갤럽이 3~5일 전국 만 18세 이상 1001명을 대상으로 조사해 발표한 여론조사…,8시간 전,https://www.donga.com/news/Politics/article/all/20260206/133310466/1,동아일보
金총리 “20대 전후 국정 만족도 떨어져…청년세대 어려움 반영”,https://dimg.donga.com/a/296/167/95/2/wps/NEWS/IMAGE/2026/02/06/133310613.1.jpg,김민석 국무총리는 6일 “여론 조사를 보면 상대적으로 20대 전후 청년들의 국정에 대한 만족도가 전 세계 평균에 비해 좀 떨어지는 게 사실”이라며 “그만큼 청년 세대가 살면서 여러 어려움 겪는 걸 반영하는 거 아닌가 (싶다)”고 밝혔다.김 총리는 이날 오전 정부서울청사에서 열린 제1차…,8시간 전,https://www.donga.com/news/Politics/article/all/20260206/133310612/1,동아일보
"‘YS아들’ 김현철 “국힘, 아버지 사진 당장 내려라…수구집단 변질”",https://dimg.donga.com/a/296/167/95/2/wps/NEWS/IMAGE/2026/02/06/133306261.5.jpg,“이미 과거 군사정권 후예라고 자처하는 국힘을 보면서 더 이상 그 곳에 있어야 할 이유가 없는 김영삼 대통령의 사진을 당장 내려주기 바란다.” -김현철 김영삼대통령기념재단 이사장(김영삼 전 대통령 아들)최수진 국민의힘 원내수석대변인은 6일 “김영삼 전 대통령의 사진을 내리고 전두환 전…,8시간 전,https://www.donga.com/news/Politics/article/all/20260206/133310441/1,동아일보
"국힘 “與 합당문건, 집권세력의 권력투쟁 민낯 드러나”",https://dimg.donga.com/a/296/167/95/2/wps/NEWS/IMAGE/2026/02/06/133310381.1.jpg,국민의힘이 더불어민주당과 조국혁신당간 합당을 위한 추진 계획 등이 담긴 민주당 내부 문건의 존재에 대해 “집권세력의 권력투쟁 민낯이 적나라하게 드러났다”고 비판하고 나섰다. 국민의힘 조용술 대변인인 6일 논평을 통해 “문재인 정부 몰락의 도화선이 된 입시비리 사건의 핵심 당사자인 조국…,9시간 전,https://www.donga.com/news/Politics/article/all/20260206/133310255/1,동아일보
"강득구, ‘합당 문건’에 “조국당과 밀약…정청래 전적으로 책임져야”",https://dimg.donga.com/a/296/167/95/2/wps/NEWS/IMAGE/2026/02/06/133310245.1.jpg,더불어민주당 강득구 최고위원이 최근 여론조사 결과를 토대로 “(조국혁신당과의) 합당은 지방선거 이후에 원점에서 다시 논의해야 한다”고 밝혔다. 그는 조국당과의 합당 추진 일정이 아주 상세하게 짜여진 당 내부 문건의 공개도 요구했다. 강 최고위원은 6일 민주당 최고위원회 회의에서 전날 …,9시간 전,https://www.donga.com/news/Politics/article/all/20260206/133310081/1,동아일보
"국힘 “李, 분당 아파트 보유 위선적…국민도 ‘똘똘한 한채’ 원해”",https://dimg.donga.com/a/296/167/95/2/wps/NEWS/IMAGE/2026/02/06/133310061.1.jpg,국민의힘이 정부의 부동산 대책을 비판하며 이재명 대통령의 성남 분당 아파트 보유를 문제 삼았다. 2020년 총선 인천 계양을 출마 당시 매각을 약속했지만 지키지 않았고 현재 20억 원이 넘는 시세차익을 얻었다고 지적했다. 다주택자인 강유정 청와대 대변인이 최근 용인 아파트를 매물로 내…,9시간 전,https://www.donga.com/news/Politics/article/all/20260206/133309871/1,동아일보
"조현 “美, 韓통상합의 이행 지연에 분위기 좋지 않다고 말해”",https://dimg.donga.com/a/296/167/95/2/wps/NEWS/IMAGE/2026/02/06/133310018.2.jpg,미국을 방문 중인 조현 외교부 장관이 마코 루비오 미국 국무장관으로부터 “한미 관계가 나쁜 상황에 있는 것까지는 아니지만 통상 관련 공약 이행 관련해서 미국 측 내부 분위기가 좋지 않다는 상황을 솔직하게 공유하겠다”는 말을 들었다고 밝혔다. 앞서 도널드 트럼프 미국 대통령이 우리 국회…,9시간 전,https://www.donga.com/news/Politics/article/all/20260206/133310017/2,동아일보
"[속보]조현 “美, 한국 통상공약 이행 관련 분위기 좋지 않다고 말해”",https://dimg.donga.com/a/296/167/95/2/wps/NEWS/IMAGE/2026/02/06/133309875.1.jpg,"조현 “美, 한국 통상공약 이행 관련 분위기 좋지 않다고 말해”",9시간 전,https://www.donga.com/news/Politics/article/all/20260206/133309873/1,동아일보
국힘 “김경 ‘황금PC’ 파일에 與의원 7명 후원 정황…특검 수용하라”,https://dimg.donga.com/a/296/167/95/2/wps/NEWS/IMAGE/2026/02/06/133309863.1.jpg,국민의힘이 공천헌금 의혹을 받는 무소속 강선우 의원과 김경 전 서울시의원에 대한 특검을 재차 요구하고 나섰다. 경찰이 두 사람에 대한 구속영장을 신청하자 공세에 나선 것이다. 국민의힘 곽규택 원내수석대변인은 6일 논평을 통해 “어제 경찰이 강 의원과 김 전 서울시의원에 대해 구속 영장…,9시간 전,https://www.donga.com/news/Politics/article/all/20260206/133309775/1,동아일보
"장동혁 ‘협박 정치’… “직 걸어라” 비판 막고, 당협위원장엔 교체 경고",https://dimg.donga.com/a/296/167/95/2/wps/NEWS/IMAGE/2026/02/06/133306261.5.jpg,국민의힘 장동혁 대표가 한동훈 전 대표 제명 이후 자신의 사퇴 또는 재신임을 요구하는 당내 인사들에게 전(全) 당원 투표를 고리로 한 ‘정치 생명 내기’를 들고나온 건 자신의 사퇴를 요구하는 친한(친한동훈)계와 오세훈 서울시장 등을 겨냥한 최후 통첩으로 풀이된다. 당원 투표가 장 대표…,14시간 전,https://www.donga.com/news/Politics/article/all/20260206/133308841/2,동아일보
