title,thumbnail,short_content,write_time,link,company
44세 이민정 인형같은 미모…20대인 줄,https://dimg.donga.com/a/296/167/95/2/wps/NEWS/IMAGE/2026/02/06/133313266.1.jpg,배우 이민정이 완벽한 미모를 자랑했다.그는 6일 소셜미디어에 “넘나 싱그러운 향”이란 글과 함께 사진 여러 장을 올렸다.사진 속 이민정은 브랜드 행사에 참석한 모습이다.그는 가죽재킷을 소화했다.이민정은 향수를 들고 있다.그는 뚜렷한 이목구비를 뽐냈다.한편 이민정은 다음 달 15일 첫방…,2시간 전,https://www.donga.com/news/Entertainment/article/all/20260206/133313265/1,동아일보
"송해나, ‘40년 대출’ 받아 구매한 새집 공개…깔끔 인테리어",https://dimg.donga.com/a/296/167/95/2/wps/NEWS/IMAGE/2026/02/06/133312740.1.jpg,모델 겸 방송인 송해나가 새집을 공개한다.8일 오후 방송되는 SBS ‘미운 우리 새끼’(이하 ‘미우새’)에서는 모델계와 예능계를 접수한 만능 엔터테이너 송해나의 새집과 일상이 최초 공개된다.최근 진행된 ‘미우새’ 스튜디오 녹화에는 송해나 어머니가 처음으로 함께했다. 딸과 똑 닮은 외모…,2시간 전,https://www.donga.com/news/Entertainment/article/all/20260206/133312739/1,동아일보
"앤팀 하루아, 한국 데뷔 발언 사과…“신중하게 표현 못 해 죄송”",https://dimg.donga.com/a/296/167/95/2/wps/NEWS/IMAGE/2026/02/06/133312725.1.jpg,"일본 보이그룹 앤팀(&TEAM) 멤버 하루아가 한국 팬들에게 사과했다.6일 가요계에 따르면 하루아는 최근 일본 한 매체와의 인터뷰에서 한국 데뷔에 대해 부정적인 뉘앙스를 내비쳤다.하루아는 “일본에서 성과가 조금씩 나오던 시기였고, 마음으로는 이대로 계속 노력해서 더 높은 목표를 향해 …",2시간 전,https://www.donga.com/news/Culture/article/all/20260206/133312724/1,동아일보
"설 연휴 극장 부활할까…베일 벗은 ‘왕사남’·‘넘버원’·‘휴민트’, 고루 호평",https://dimg.donga.com/a/296/167/95/2/wps/NEWS/IMAGE/2026/02/06/133312652.1.jpg,"설 연휴를 앞두고 개봉하는 한국 영화 세 편이 공개된 가운데, 세 편 모두 고루 호평받고 있다. 관객몰이가 쉽지 않은 과도기의 극장가에서 이들 영화가 설 연휴를 기회로 삼아 ‘극장의 부활’을 끌어낼 수 있을지 기대감을 준다.영화 ‘왕과 사는 남자’는 지난 4일 개봉해 흥행 중이다. ‘…",3시간 전,https://www.donga.com/news/Entertainment/article/all/20260206/133312651/1,동아일보
"‘JYP 걸그룹’ 엔믹스, 커리어 꽃 피웠다…한국대중음악상 4개 부문 후보",https://dimg.donga.com/a/296/167/95/2/wps/NEWS/IMAGE/2026/02/06/133312539.1.jpg,JYP엔터테인먼트(035900) 걸그룹 엔믹스(NMIXX)의 ‘음악 뚝심’이 통했다. 이들은 한국대중음악상 4개 부문에 노미네이트되며 주목받고 있다.한국대중음악상 선정위원회는 5일 오후 2시 공식 유튜브 채널을 통해 제23회 한국대중음악상 후보를 발표했다. 올해 한국대중음악상은 종합분…,3시간 전,https://www.donga.com/news/Entertainment/article/all/20260206/133312538/1,동아일보
"하정우, 11세 연하 연인 차정원과 결혼설엔…“식장 들어갈 때까지 몰라요”",https://dimg.donga.com/a/296/167/95/2/wps/NEWS/IMAGE/2026/02/06/133312557.1.jpg,"배우 하정우(47·본명 김성훈)가 차정원(36·본명 차미영)과 열애를 인정한 가운데, 결혼설에 대해선 “아직”이라고 밝혔다.하정우는 6일 자신의 인스타그램을 통해 “용접용 물안경”이라는 글과 함께 오는 3월 14일 처음 방송될 tvN 새 토일드라마 ‘대한민국에서 건물주 되는 법’ 리딩…",3시간 전,https://www.donga.com/news/Entertainment/article/all/20260206/133312556/1,동아일보
"손담비, 육아 잠시 해방…“오랜만에 자유부인”",https://dimg.donga.com/a/296/167/95/2/wps/NEWS/IMAGE/2026/02/06/133312109.1.jpg,가수 겸 배우 손담비가 육아에서 잠시 벗어난 근황을 전했다. 손담비는 6일 자신의 사회관계망서비스(SNS)에 “오랜만에 자유부인?”이라는 글과 함께 사진을 올렸다. 사진 속 손담비는 편안한 옷차림과 함께 미소를 지었다. 손담비는 육아에서 잠시 해방감을 느낀 듯 여유 있는 자세와 표정으…,4시간 전,https://www.donga.com/news/Culture/article/all/20260206/133312108/1,동아일보
강승윤 “위너 곡 저작권료 月 억 단위…완전 효자”,https://dimg.donga.com/a/296/167/95/2/wps/NEWS/IMAGE/2026/02/06/133311970.1.jpg,그룹 위너 멤버 강승윤이 저작권료가 한 달에 억 단위로 들어온다고 말한다.강승윤 김진우는 6일 방송하는 채널S 예능 프로그램 ‘전현무계획3’에 게스트로 출연한다.강승윤 “정말 많이 스트리밍 된 노래가 대부분 연간 몇천만 회 정도가 끝인데 위너 노래 ‘릴리 릴리’(REALLY REALL…,4시간 전,https://www.donga.com/news/Culture/article/all/20260206/133311969/1,동아일보
28기 영호♥옥순까지 재혼…기수마다 ‘부부’ 탄생하는 ‘나는 솔로’,https://dimg.donga.com/a/296/167/95/2/wps/NEWS/IMAGE/2026/02/06/133311859.1.jpg,"‘나는 솔로’ 28기 옥순과 영호가 부부가 됐다.SBS플러스·ENA 예능 프로그램 ‘나는 솔로’ 28기 출연자 영호는 4일 인스타그램에 “오늘, 옥순님과 법적으로 부부가 되었습니다”라면서 옥순과 혼인신고를 했다고 알렸다.이어 “더 책임감 있게 좋은 남편, 좋은 아빠가 되고 싶어 혼인신…",4시간 전,https://www.donga.com/news/Entertainment/article/all/20260206/133311858/1,동아일보
"‘아기가 생겼어요’ 최진혁, 영화는 안중에도 없다…오연서에 시선 고정",https://dimg.donga.com/a/296/167/95/2/wps/NEWS/IMAGE/2026/02/06/133311853.1.jpg,‘아기가 생겼어요’ 최진혁과 오연서의 달콤·살벌한 데이트가 포착됐다.채널A 토일드라마 ‘아기가 생겼어요’(극본 소해원/연출 김진성) 측은 6일 강두준(최진혁 분)과 장희원(오연서 분)의 데이트를 공개했다.지난 방송은 희원을 사이에 두고 두준과 민혁의 불꽃 튀는 신경전이 고조되며 삼각 …,4시간 전,https://www.donga.com/news/Entertainment/article/all/20260206/133311852/1,동아일보
"이범수·이윤진, 합의 이혼 “억측 중단하길” [공식]",https://dimg.donga.com/a/296/167/95/2/wps/NEWS/IMAGE/2026/02/06/133311817.1.jpg,"배우 이범수, 번역가 이윤진이 합의 이혼했다. 이범수 소속사 와이원엔터테인먼트는 6일 “이범수와 이윤진은 충분한 협의를 거쳐 상호 간의 오해를 해소하였으며, 앞으로는 자녀들의 부모로서 각자의 자리에서 서로를 존중하고 응원하기로 합의하였다”라며 이혼 소식을 전했다. 이어 “이혼 절차가 …",4시간 전,https://www.donga.com/news/Entertainment/article/all/20260206/133311821/1,동아일보
‘나혼산’ 박지현의 ‘겨울나기’…셀프 리모델링에 호떡·떡볶이 먹방까지,https://dimg.donga.com/a/296/167/95/2/wps/NEWS/IMAGE/2026/02/06/133311673.1.jpg,‘나 혼자 산다’ 박지현이 겨울을 이겨내기 위해 셀프 집 리모델링에 나선다.6일 방송되는 MBC ‘나 혼자 산다’에서는 ‘핫가이’ 박지현의 겨울나기 일상이 그려진다.공개된 사진에는 박지현이 장갑을 끼고 거실 조명의 덮개를 뜯는 모습이 포착돼 눈길을 끈다. 그는 “포근한 분위기를 만들기…,5시간 전,https://www.donga.com/news/Entertainment/article/all/20260206/133311672/1,동아일보
"키키, 콘크리트 차트 뚫었다",https://dimg.donga.com/a/296/167/95/2/wps/NEWS/IMAGE/2026/02/06/133311626.1.jpg,"그룹 키키(KiiiKiii : 지유, 이솔, 수이, 하음, 키야)가 신곡 ‘404 (New Era)’로 차트에서 존재감을 보이고 있다. 소속사 스타쉽엔터테인먼트 측에 따르면, 지난 26일 발매된 키키 미니 2집 ‘델룰루 팩(Delulu Pack)’의 타이틀곡 ‘404 (New Era)…",5시간 전,https://www.donga.com/news/Entertainment/article/all/20260206/133311631/1,동아일보
"온유, 亞 팬미팅 투어 개최",https://dimg.donga.com/a/296/167/95/2/wps/NEWS/IMAGE/2026/02/06/133311596.1.jpg,"그룹 샤이니 온유(ONEW)가 ‘2026 ONEW FANMEETING ’TOUGH LOVE‘’(이하 ‘TOUGH LOVE’)의 포스터를 공개하며, 아시아 3개 도시 팬미팅 개최 소식을 알렸다.‘TOUGH LOVE(터프 러브)’는 온유가 오는 3월 9일 발매를 앞둔 미니 5집과 동명의 …",5시간 전,https://www.donga.com/news/Entertainment/article/all/20260206/133311603/1,동아일보
"이정현 “딸 서아, 의사 아닌 가수 됐으면…그 이유는”",https://dimg.donga.com/a/296/167/95/2/wps/NEWS/IMAGE/2026/02/06/133311578.1.jpg,‘신상출시 편스토랑’ 이정현이 딸 서아와 함께 표지모델에 도전한다.6일 오후 방송되는 KBS 2TV ‘신상출시 편스토랑’(이하 ‘편스토랑‘)에서는 만능여신 이정현 부부가 귀염둥이 첫째 딸 서아의 미래에 대해 이야기를 나눈다. 이 과정에서 이정현과 딸 서아가 꼭 닮은 끼를 발산하며 함께…,5시간 전,https://www.donga.com/news/Entertainment/article/all/20260206/133311577/1,동아일보
"임영웅, 2년2개월 만에 부산으로…‘아임 히어로’ 피날레",https://dimg.donga.com/a/296/167/95/2/wps/NEWS/IMAGE/2026/02/06/133311076.1.jpg,"가수 임영웅이 부산에서 전국투어 콘서트를 마무리한다.소속사 물고기뮤직에 따르면 임영웅은 6~8일 부산 벡스코 제1전시장에서 전국투어 콘서트 ‘아임 히어로’(IM HERO)를 개최한다.지난해 인천을 시작으로 대구, 서울, 광주, 대전 등에서 공연을 이어온 임영웅은 부산에서 긴 여정에 마…",7시간 전,https://www.donga.com/news/Culture/article/all/20260206/133311075/1,동아일보
"SF9 유태양, 3월 3일 현역 입대…군악대 합격",https://dimg.donga.com/a/296/167/95/2/wps/NEWS/IMAGE/2026/02/06/133311072.1.jpg,그룹 SF9 유태양(28)이 입대한다.소속사 FNC엔터테인먼트(173940)는 6일 공식 팬카페를 통해 “최근 군악대에 지원한 유태양은 병무청으로부터 최종 합격 통지를 받아 오는 3월 3일 훈련소에 입소해 기초군사훈련을 받은 뒤 군악대에서 국방의 의무를 이행할 예정”이라고 알렸다.이어…,7시간 전,https://www.donga.com/news/Entertainment/article/all/20260206/133311071/1,동아일보
“몸무게 1㎏ 늘었다”…김소영 입덧에 오상진 비상,https://dimg.donga.com/a/296/167/95/2/wps/NEWS/IMAGE/2026/02/06/133311062.1.jpg,‘신상출시 편스토랑’에서 오상진·김소영 부부의 둘째 소식이 공개된다.6일 오후 8시30분 방송되는 KBS 2TV ‘편스토랑’에서는 오상진이 신입 편셰프로 출격해 가족을 위한 일상을 공개한다. 그는 “매일 주방으로 출근하는 남자 오상진입니다”라고 자신을 소개한다.오상진은 이른 새벽부터 …,7시간 전,https://www.donga.com/news/Culture/article/all/20260206/133311061/1,동아일보
"블랙핑크 리사, 넷플릭스 로코 영화 출연…제작도 참여",https://dimg.donga.com/a/296/167/95/2/wps/NEWS/IMAGE/2026/02/06/133311059.1.jpg,"그룹 블랙핑크 리사가 넷플릭스 오리지널 로맨틱 코미디 영화에 출연한다. 넷플릭스는 6일 공식 사회관계망서비스(SNS)를 통해 “리사가 넷플릭스의 새로운 로맨틱 코미디 장편 영화에 주연으로 출연할 예정이다. 작품은 ‘노팅 힐’에서 영감을 받았다”고 밝혔다.각본은 ‘북스마트’, ‘어쩌다 …",7시간 전,https://www.donga.com/news/Entertainment/article/all/20260206/133311058/1,동아일보
"데이식스 영케이, 박나래·키 하차 ‘놀토’ 새멤버 됐다",https://dimg.donga.com/a/296/167/95/2/wps/NEWS/IMAGE/2026/02/06/133310998.1.jpg,"밴드 데이식스 영케이가 ‘놀라운 토요일’에 합류했다.6일 tvN 관계자에 따르면 영케이는 이날 녹화를 진행한 tvN ‘놀라운 토요일’ 고정 멤버로 새롭게 합류했다.‘놀라운 토요일’은 전국 시장 속 핫한 음식을 걸고 노래 가사 받아쓰기 게임을 하는 세대 초월 음악 예능으로, 2018년 …",7시간 전,https://www.donga.com/news/Entertainment/article/all/20260206/133310997/1,동아일보
