title,thumbnail,short_content,write_time,link,company
"삼성전자, 두 번 접는 혁신 스마트폰 '트라이폴드' 다음 달 출시",https://cdn.ebn.co.kr/news/thumbnail/202511/1686516_704568_5021_v150.jpg,"삼성전자가 화면이 두 번 접히는 스마트폰 '갤럭시Z 트라이폴드'를 다음 달 공식 출시하며 폴더블폰 시장의 새로운 장을 연다.12일 전자업계에 따르면 삼성전자는 다음 달 5일 트라이폴드의 공식 출시 행사를 열고 국내 판매를 개시할 예정이다. 트라이폴드는 기존 양면 접이식 '폴드' 시리즈에서 한 단계 진화하여 화면을 두 번 접을 수 있는 구조로 설계된 것이 특징이다.완전히 펼쳤을 때 약 10인치의 대화면을 제공하며, 접었을 때는 일반 스마트폰 수준의 뛰어난 휴대성을 유지할 수 있도록 했다.출고가는 복잡한 힌지 구조와 추가 디스플레이 부",11-12 21:51,https://www.ebn.co.kr/news/articleView.html?idxno=1686516,EBN
"[G-STAR '25] 넥슨, 창사 이래 최초 게임대상 '대상·최우수상' 싹쓸이…6관왕",https://cdn.ebn.co.kr/news/thumbnail/202511/1686514_704566_4929_v150.jpg,"넥슨이 창사 이래 최초로 대한민국 게임대상 대상과 최우수상을 동시에 수상했다. 올해 신작인 '마비노기 모바일'이 대상을, '퍼스트 버서커: 카잔'이 최우수상을 받으며 게임성과 개발력을 인정받았다. 기술창작상 등도 수상해 6관왕에 올랐다. 12일 문화체육관광부가 주최하고 한국게임산업협회가 주관한 제30회 대한민국 게임대상에서 넥슨의 개발 자회사 데브캣이 개발한 '마비노기 모바일'이 대상(대통령상)의 영예를 안았다. 넥슨이 게임대상 대상을 수상한 것은 지난 2022년 '던전앤파이터 모바일'의 대상 수상 이후 3년 만이다. 마비노기 모바",11-12 19:51,https://www.ebn.co.kr/news/articleView.html?idxno=1686514,EBN
"이승우 디스플레이협회 부회장 ""산·학·연·관 협력해 新시장기회 선점""",https://cdn.ebn.co.kr/news/thumbnail/202511/1686505_704555_122_v150.jpg,한국디스플레이산업협회는 디스플레이 초격차 기술 확보전략 논의를 위해 산·학·연·관 450여명이 함께하는 '제18회 디스플레이 국가연구개발사업 총괄워크샵'을 12일부터 3일간 개최한다고 밝혔다.이번 행사에서는 산업통상부가 지원하고 한국산업기술기획평가원이 전담하는 총 80개 디스플레이 분야 국가연구개발사업의 연구성과 발표와 미래기술 전략 논의가 진행되된다.특히 OLED·iLED 중심의 기술전환과 신시장 확장 관련 연구동향 발표가 진행된다.디스플레이 혁신공정플랫폼 구축사업을 통해 도출된 OLED 열화 원인규명용 질량분석시스템(아스타)과,11-12 17:04,https://www.ebn.co.kr/news/articleView.html?idxno=1686505,EBN
"파두, 3분기 매출 256억원 '2.5배' 고속 성장…AI 수혜 본격화",https://cdn.ebn.co.kr/news/thumbnail/202511/1686504_704553_525_v150.jpg,"데이터센터 반도체 전문기업 파두가 인공지능(AI) 데이터센터용 솔리드스테이트드라이브(SSD) 수요 증가에 힘입어 3분기 매출이 큰 폭으로 성장했다.파두는 올해 3분기 매출 256억원, 연간 누적 매출 685억원을 기록했다고 12일 공시했다.3분기 매출 256억원은 전년도 같은 기간 매출(약 101억원) 대비 2.5배 증가한 수치다. 이러한 매출 성장은 AI 데이터센터용 SSD 수요 상승의 본격적인 수혜를 받은 결과로 분석된다.특히 파두는 데이터센터 SSD의 두뇌 역할을 하는 컨트롤러 설계 기술력을 바탕으로 최근 4개월 연속 대형 수",11-12 16:53,https://www.ebn.co.kr/news/articleView.html?idxno=1686504,EBN
"“배틀그라운드, 하나의 무대로”… 크래프톤 ‘PUBG 유나이티드’ 출범",https://cdn.ebn.co.kr/news/thumbnail/202511/1686486_704533_4434_v150.jpg,크래프톤이 배틀그라운드를 통해 글로벌 e스포츠 시장을 향한 새로운 도전에 나섰다.크래프톤은 대표작 PC 게임 ‘PUBG: 배틀그라운드’와 모바일 게임 ‘배틀그라운드 모바일’의 글로벌 통합 e스포츠 프로젝트 ‘PUBG 유나이티드(PUBG UNITED)’를 공식 발표했다고 12일 밝혔다.‘PUBG 유나이티드’는 두 타이틀의 e스포츠를 하나의 비전과 커뮤니티 아래에서 통합한 새로운 대회 브랜드다. 이번 프로젝트는 배틀그라운드 e스포츠의 양대 대회인 ‘펍지 글로벌 챔피언십(PGC)’과 ‘펍지 모바일 글로벌 챔피언십(PMGC)’을 한 무대에,11-12 15:48,https://www.ebn.co.kr/news/articleView.html?idxno=1686486,EBN
"SKT, 6G 핵심 ‘AI-RAN’ 기술 인정…4년 연속 과기정통부 장관상 영예",https://cdn.ebn.co.kr/news/thumbnail/202511/1686484_704531_4038_v150.jpg,"SK텔레콤은 차세대 6G 이동통신을 위한 AI 기반 무선 송수신 기술로 제26회 전파방송 기술대상 과학기술정보통신부 장관상을 수상했다고 12일 밝혔다. 이번 수상으로 SK텔레콤은 AI 기술을 기반으로 한 6G 네트워크 혁신의 글로벌 리더로서 입지를 강화하게 됐다.전파방송 기술대상은 국내 통신·방송 산업 발전에 기여한 혁신 기술을 선정해 매년 과학기술정보통신부가 시상하는 최고 권위의 기술상이다.이번에 SK텔레콤이 수상한 기술은 NTT도코모·NTT·노키아 벨연구소와 공동으로 개발한 AI 기반 무선 송수신(AI-RAN, AI Radio",11-12 15:42,https://www.ebn.co.kr/news/articleView.html?idxno=1686484,EBN
"한컴위드, 3분기 누적 매출 4972억 돌파…“금거래소 성장·보안사업 시너지”",https://cdn.ebn.co.kr/news/thumbnail/202511/1686477_704523_2813_v150.jpg,"한컴그룹의 실질적 지주사인 한컴위드가 올해 3분기 누적 기준으로 전년 연간 실적을 넘어서는 성과를 냈다. 금 유통 사업 자회사 ‘한컴금거래소’의 급성장과 함께 보안 기술 사업의 실적이 더해지며 수익성이 대폭 개선된 덕이다.한컴위드는 12일 공시를 통해 2025년 3분기 누적 연결 기준 매출액 4972억원, 영업이익 41.3억원을 달성했다고 밝혔다.매출은 전년 동기 대비 50.1% 증가했으며, 영업이익은 7.6배 급등했다. 이로써 이미 2024년 연간 매출(4481.8억원)을 3분기 만에 넘어섰다.이번 실적 호조는 보안사업의 견조한",11-12 15:31,https://www.ebn.co.kr/news/articleView.html?idxno=1686477,EBN
"엔씨, 신작 MMORPG ‘아이온2’ 사전 설치 예고…정식 오픈은?",https://cdn.ebn.co.kr/news/thumbnail/202511/1686474_704519_2359_v150.jpg,"엔씨소프트가 신작 MMORPG ‘아이온2’의 사전 다운로드 및 캐릭터 커스터마이징 이벤트를 오는 16일부터 진행한다고 12일 밝혔다.정식 출시는 19일 자정으로 예정돼 있으며, 엔씨는 이번 작품을 통해 원작 ‘아이온’의 정통성과 현대적 기술 혁신을 결합한 ‘아이온의 완전판’을 선보인다는 계획이다.이용자들은 16일 낮 12시부터 18일 밤 11시 59분까지 엔씨의 게임 플랫폼 ‘퍼플(PURPLE)’을 통해 사전 설치를 진행할 수 있다.사전 설치를 완료한 이용자는 16일 오후 2시부터 18일 낮 12시까지 PC에서 캐릭터 커스터마이징",11-12 15:25,https://www.ebn.co.kr/news/articleView.html?idxno=1686474,EBN
"CCIA·CSI, 한국 정부 지도 데이터 해외 반출 불허 결정에 “깊은 유감”",https://cdn.ebn.co.kr/news/thumbnail/202511/1686467_704516_119_v150.jpg,"미국 정보통신·서비스 업계를 대표하는 주요 산업 단체들이 한국 정부의 디지털 지도 데이터 해외 반출 승인 유보 결정에 대해 강한 유감을 표명했다.미국 컴퓨터통신산업협회(CCIA)와 서비스산업협회(CSI)는 12일(현지시간) 공동 성명을 내고, 한국 국토교통부의 지도 데이터 반출 제한 정책이 한미 자유무역협정(KORUS FTA)의 비차별 원칙을 훼손하고 있다고 비판했다.이번 사안은 구글이 지난 2월 한국 국토교통부에 지도 데이터의 해외 서버 활용을 위한 반출 허가를 요청했으나, 국토지리정보원이 주관한 ‘측량성과 국외 반출 협의체’에서",11-12 15:21,https://www.ebn.co.kr/news/articleView.html?idxno=1686467,EBN
"삼성인력개발원, '갤럭시 XR' 기반 차세대 교육 본격 도입",https://cdn.ebn.co.kr/news/thumbnail/202511/1686418_704458_4536_v150.jpg,"삼성인력개발원이 11월부터 인공지능(AI)과 확장현실(XR)을 결합한 차세대 교육 프로그램을 본격 도입한다.삼성전자는 기존 강의실 중심 교육의 한계를 넘어 몰입도 높은 혁신적 학습 환경을 조성하기 위해 삼성전자의 헤드셋 형태 XR 기기인 '갤럭시 XR'를 활용한 교육을 시작했다고 12일 밝혔다.삼성은 신입사원부터 고위임원 교육까지 임직원 교육 전반에 갤럭시 XR을 활용할 계획이며, 11월에는 △명상 △삼성 역사체험 △리더십 △외국어 △토론 등 5개 교육에 AI·XR 기술을 적용했다.교육생들은 갤럭시 XR을 착용하고 가상 공간에서 음",11-12 15:00,https://www.ebn.co.kr/news/articleView.html?idxno=1686418,EBN
“크로스파이어 최강은 누구?”…CFS 2025 12월 개막,https://cdn.ebn.co.kr/news/thumbnail/202511/1686446_704486_319_v150.jpg,"스마일게이트 엔터테인먼트가 글로벌 크로스파이어 최강전 ‘CFS 2025 그랜드 파이널’의 세부 일정을 확정하고, 참가 16개 팀의 구성을 12일 공개했다.대회는 오는 12월 3일부터 14일까지 중국 청두(Chengdu)에서 진행되며, 총상금 규모는 143만달러(약 20억원)에 달한다.이번 CFS 2025는 그룹 스테이지와 플레이오프 1~2차전은 청두 양자계 스튜디오, 패자조 준결승부터 결승전은 대마방 금융타운 연예센터에서 열린다.출전 팀은 중국 4팀, 브라질 3팀, 베트남 3팀, 필리핀 2팀, EUMENA(유럽·중동·북아프리카) 3",11-12 14:39,https://www.ebn.co.kr/news/articleView.html?idxno=1686446,EBN
"엔씨, 26일 리니지2M 6주년 업데이트…“전설의 화룡이 깨어난다”",https://cdn.ebn.co.kr/news/thumbnail/202511/1686440_704483_242_v150.jpg,"엔씨소프트(NC)의 MMORPG ‘리니지2M’이 12일 서비스 6주년을 맞아 대규모 업데이트 ‘BLAZING FATE: 발라카스’를 예고했다.이번 업데이트는 오는 26일 진행되며, 리니지 IP의 상징적인 보스 몬스터 ‘화룡 발라카스’가 새롭게 등장한다.엔씨소프트는 이번 6주년 업데이트를 통해 ▲‘발라카스의 둥지’ 신규 던전 추가 ▲오리진·리저브 월드 신규 콘텐츠 공개 ▲유저 의견을 반영한 ‘인터루드 리메이크V’ 시스템 개편 ▲기념 아이템 ‘인터루드 쿠폰’ 지급 등을 진행한다.업데이트의 세부 내용은 18일 진행되는 공식 라이브 방송을",11-12 14:27,https://www.ebn.co.kr/news/articleView.html?idxno=1686440,EBN
"ASML, 화성 '스마트 캠퍼스' 개관…韓 반도체 업계와 동반 성장 가속",https://cdn.ebn.co.kr/news/thumbnail/202511/1686437_704484_2523_v150.jpg,"글로벌 반도체 노광장비 기업 ASML은 12일 경기도 화성시 송동에 조성한 화성캠퍼스의 공식 개관식을 가졌다고 밝혔다. 이번 행사에는 ASML 고객사, 정부 및 지자체 관계자, 주한 네덜란드 대사관, 주요 파트너사 등 약 80여 명의 인사가 참석해 개관을 축하했다.ASML코리아는 2022년 11월 화성캠퍼스 설립 계획을 발표한 뒤, 국내 반도체 산업과의 협력 확대 및 리소그래피 기술 교육 허브 구축에 나섰다. 이번에 완공된 캠퍼스는 화성시 송동 도시지원시설 용지에 약 1만6000㎡ 규모로 건립됐다.A동(지하 4층~지상 11층)은 주",11-12 14:26,https://www.ebn.co.kr/news/articleView.html?idxno=1686437,EBN
"LG CNS, ‘2025 대한민국 IT서비스 혁신대상’ 과기정통부 장관상 수상",https://cdn.ebn.co.kr/news/thumbnail/202511/1686433_704475_1452_v150.jpg,"AX(인공지능 전환) 전문기업 LG CNS는 ‘2025 대한민국 IT서비스 혁신대상’ 기술혁신 부문에서 과학기술정보통신부 장관상을 수상했다고 12일 밝혔다. 공공·금융 등 다양한 산업에서 AI 기반 비즈니스 혁신을 선도하며 국내 IT서비스 발전에 기여한 성과를 인정받은 결과다.‘대한민국 IT서비스 혁신대상’은 한국IT서비스학회와 IT서비스산업협회가 공동으로 주관하며, 국내 IT 서비스 산업 분야에서 뛰어난 업적을 쌓았거나 발전에 기여한 기업, 단체, 개인을 선정해 매년 시상하고 있다.LG CNS는 기술혁신 부문에서 △정부 AI 시스",11-12 14:16,https://www.ebn.co.kr/news/articleView.html?idxno=1686433,EBN
"인터넷진흥원, 중국과 개인정보보호 협약 연장…“피싱·스팸 방지 공조""",https://cdn.ebn.co.kr/news/thumbnail/202511/1686428_704465_641_v150.jpg,"한국인터넷진흥원(KISA)이 중국인터넷협회(ISC)와 중국 내 한국인의 개인정보 보호를 위한 협력 체계를 유지한다.양 기관은 12일 “개인정보 보호 협력에 관한 양해각서(MOU)를 유지·확대하기로 합의했다”고 밝혔다.중국인터넷협회는 중국 전역의 약 1400개 인터넷 관련 기업이 회원으로 가입한 중국 최대 규모의 인터넷 산업 단체로, 인터넷 정책·법률 연구와 산업 발전 전략 수립 등 중국 정부의 주요 정책 파트너 역할을 맡고 있다.한국인터넷진흥원과 중국인터넷협회는 2013년 6월 처음 협약을 체결한 이후 3년마다 갱신해 오고 있다.",11-12 14:09,https://www.ebn.co.kr/news/articleView.html?idxno=1686428,EBN
“10곳 중 9곳 만족”…삼성·포스코 참여 ‘상생형 스마트공장’ 성과 입증,https://cdn.ebn.co.kr/news/thumbnail/202511/1686426_704463_256_v150.jpg,"중소벤처기업부와 중소기업중앙회, 삼성전자, 포스코가 공동 추진하는 ‘대·중소 상생형 스마트공장 구축사업’이 중소기업들로부터 높은 만족도를 얻고 있는 것으로 나타났다. 참여 기업 10곳 중 9곳이 사업 성과에 만족을 표하며, 고용과 매출 모두에서 긍정적 효과를 확인했다.중소기업중앙회는 12일 지난해 사업에 참여한 중소기업 246개사(삼성전자 145개사, 포스코 101개사)를 대상으로 한 조사 결과를 발표했다. 조사에 따르면 응답 기업의 90.2%가 스마트공장 구축사업에 ‘만족’, 이 중 54.5%는 ‘매우 만족’한다고 답했다.특히 중",11-12 14:05,https://www.ebn.co.kr/news/articleView.html?idxno=1686426,EBN
AI기본법 시행령 나왔다…“고영향AI 기준·투명성 의무 구체화”,https://cdn.ebn.co.kr/news/thumbnail/202511/1686420_704461_5445_v150.jpg,"과학기술정보통신부는 12일 ‘인공지능 발전과 신뢰 기반 조성 등에 관한 기본법’(AI기본법)의 시행령 제정안을 마련하고 40일간 입법예고에 들어갔다고 밝혔다.이번 제정안은 내년 1월 시행을 앞둔 AI기본법의 구체적 실행 방안을 규정한 것으로, AI 산업 진흥 중심의 정책 기조를 유지하면서 기업 부담 완화를 위한 명확한 제도 설계를 목표로 했다.AI기본법은 지난해 12월 국회를 통과한 뒤 내년 1월 시행을 앞두고 있으며, 과기정통부는 관계 부처 및 업계 의견을 반영해 시행령 초안을 확정했다.배경훈 과학기술정보통신부 장관은 “시행령은",11-12 13:55,https://www.ebn.co.kr/news/articleView.html?idxno=1686420,EBN
"한컴, AI 사업 수익화 본격 궤도…3분기 영업이익 45% 급증",https://cdn.ebn.co.kr/news/thumbnail/202511/1686414_704454_3423_v150.jpg,"한글과컴퓨터가 2025년 3분기 연결·별도 실적 모두 두 자릿수 성장을 기록하며 AI 중심의 비즈니스 전환 성과를 본격화했다.한컴은 3분기 보고서를 통해 연결 기준 매출액 840억 원, 영업이익 123억 원을 달성했다고 12일 밝혔다. 전년 동기 대비 각각 18.1%, 45.7% 증가한 수치다.별도 기준 매출액도 440억 원으로 17.2% 성장하며 B2G(공공)·B2B 시장에서의 견조한 입지를 재확인했다. 별도 기준 영업이익은 AI 사업 관련 리브랜딩과 연구개발(R&D) 투자 확대에 따른 전략적 비용 집행으로 전년 수준을 유지했다.",11-12 13:34,https://www.ebn.co.kr/news/articleView.html?idxno=1686414,EBN
"[G-STAR '25] 하이브랩, AI 콘텐츠 솔루션 ‘AVIKO’ 공개",https://cdn.ebn.co.kr/news/thumbnail/202511/1686399_704420_1455_v150.jpg,"인공지능(AI) 및 디지털전환(DX) 전문기업 하이브랩은 AI기반 콘텐츠 제작 효율화 솔루션 'AVIKO'를 지스타 2025에서 공개한다고 12일 밝혔다.'지스타 2025'는 오는 13일부터 16일까지 부산 벡스코에서 개최된다. 하이브랩은 B2B(기업 간 거래) 구역에 전시 부스를 마련하고, 국내외 유수의 게임사들을 대상으로 글로벌 확장 전략을 소개하는 한편, 차세대 AI 솔루션을 적극적으로 제안한다는 계획이다.특히 하이브랩은 최근 3년 연속 지스타에 참가, AVIKO 솔루션을 필두로 게임분야 특화 UI/UX 설계, 콘텐츠 크리에이",11-12 11:15,https://www.ebn.co.kr/news/articleView.html?idxno=1686399,EBN
ASML 화성캠퍼스 준공…전영현·곽노정 만나 반도체 협력 강화,https://cdn.ebn.co.kr/news/thumbnail/202511/1686396_704412_5759_v150.jpg,네덜란드 ASML의 크리스토퍼 푸케 최고경영자(CEO)가 방한해 전영현 삼성전자 디바이스솔루션(DS)부문장(부회장)과 곽노정 SK하이닉스 대표이사 사장을 잇따라 만나며 협력 관계를 강화한다.12일 업계에 따르면 푸케 CEO는 이날 오전 경기 화성 송동에서 열리는 ASML 화성캠퍼스 준공식에 참석한 뒤 오후에 전영현 부회장을 만난다. 전날에는 곽노정 사장을 만난 것으로 알려졌다.ASML은 네덜란드를 대표하는 세계 최고의 반도체 장비 기업이다. 반도체 초미세공정 구현에 필수적인 극자외선(EUV) 노광장비를 전 세계에서 유일하게 생산해,11-12 11:02,https://www.ebn.co.kr/news/articleView.html?idxno=1686396,EBN
"웰컴저축은행-배래, 임베디드 금융 서비스 맞손",https://cdn.ebn.co.kr/news/thumbnail/202511/1686513_704563_3647_v150.jpg,웰컴저축은행은 블록체인 핀테크 전문 기업인 배래와 임베디드 금융 서비스 공동 추진을 위한 전략적 업무 제휴 협약을 지난 10일 체결했다고 12일 밝혔다.이번 협약은 마이데이터 사업 본허가를 획득한 웰컴저축은행의 전문성과 'ZKAP Wallet' 등 최첨단 탈중앙화 지갑 및 패스키(Passkey) 인증 기술을 개발하는 배래 간 전략적 파트너십으로 검증된 전문성을 바탕으로 고객에게 더욱 안전하고 혁신적인 금융 경험을 제공하는 것을 목표로 한다.이에 배래의 고객들은 ZKAP 플랫폼 내에서 웰컴저축은행의 다양한 비대면 금융 서비스를 원스톱,11-12 19:36,https://www.ebn.co.kr/news/articleView.html?idxno=1686513,EBN
"[은행 & NOW] 캠코, '사랑의 집 고치기' 노인복지시설 환경 개선 등",https://cdn.ebn.co.kr/news/thumbnail/202511/1686453_704501_4529_v150.jpg,"캠코, '사랑의 집 고치기' 노인복지시설 환경 개선캠코(한국자산관리공사)은 서울 동작구 소재 경로당에서 노후복지시설 개선을 위한 ‘사랑의 집 고치기’ 활동을 지난 8~11일 실시했다고 12일 밝혔다.사랑의 집고치기는 캠코가 2017년부터 이어오고 있는 대표적인 사회공헌 활동으로, 아동·노인 등 취약계층의 주거환경을 개선해 보다 나은 생활공간을 마련할 수 있도록 지원하고 있다. 사회공헌활동에는 캠코와 동작구청 직원 등 20여명이 참여했으며, 각 기관의 전문 인력들이 재능기부 형태로 함께했다. 각 기관은 동절기 혹한에 대비해 지역 어르",11-12 16:51,https://www.ebn.co.kr/news/articleView.html?idxno=1686453,EBN
"KB국민카드, 국가고객만족도 신용·체크카드 부문 동시 1위",https://cdn.ebn.co.kr/news/thumbnail/202511/1686498_704550_4159_v150.jpg,"KB국민카드는 2025년도 국가고객만족도(NCSI) 조사에서 신용카드 부문 5년 연속 1위에 오르는데 이어, 체크카드 부문에서도 2년 연속 1위로 선정됐다.신용카드 고객에게는 차별화된 상품 경쟁력과 프리미엄 서비스를 체크카드 고객에게는 편리하고 실속 있는 혜택을 각각 제공하며 광범위한 고객층으로부터 최고의 평가를 받았다.특히 올해도 체크카드는 3대 고객만족 조사기관(한국생산성본부, 한국표준협회, 한국능률협회컨설팅)에서 모두 1위를 차지하며 시장 경쟁력을 입증했다.국가고객만족도(NCSI) 조사는 한국생산성본부와 미국 미시간대학이 공동",11-12 16:43,https://www.ebn.co.kr/news/articleView.html?idxno=1686498,EBN
"우리금융캐피탈, 브리지스톤과 '생산적 금융' 실천.. 화물차주 지원",https://cdn.ebn.co.kr/news/thumbnail/202511/1686495_704545_224_v150.jpg,우리금융그룹의 계열사인 우리금융캐피탈이 타이어업계 선두주자인 브리지스톤타이어세일즈코리아와 화물차주를 위한 상생경영 실천에 나선다. 양사는 지난 11일 서울 역삼동 우리금융캐피탈 서울본사에서 ‘화물차주 상생 금융지원 업무협약(MOU)’을 체결했다고 밝혔다.협약식에는 우리금융캐피탈 기동호 대표이사와 브리지스톤타이어세일즈코리아 김헌영 대표이사를 비롯한 양사 주요 임직원이 참석했다. 양사는 화물차주의 경제적 부담을 경감하고 차량 안전을 강화하기 위한 다양한 지원을 추진하기로 뜻을 모았다.이번 협약에 따라 브리지스톤타이어세일즈코리아는 화물차,11-12 16:23,https://www.ebn.co.kr/news/articleView.html?idxno=1686495,EBN
"미래에셋자산운용, AI 탑재한 'TIGER ETF' 앱 출시",https://cdn.ebn.co.kr/news/thumbnail/202511/1686494_704544_1539_v150.jpg,"미래에셋자산운용은 TIGER ETF 투자 정보를 손쉽게 이용할 수 있는 모바일 애플리케이션 ‘TIGER ETF’를 출시했다고 12일 밝혔다.신규 TIGER ETF 앱은 최근 전면 개편된 TIGER ETF 공식 홈페이지의 주요 기능과 디자인을 그대로 반영했다. 앱을 통해 이용자는 TIGER ETF 라인업에 대한 상세 정보는 물론, 시장 리포트 및 각종 투자 데이터를 직관적으로 확인할 수 있다.특히 AI 어시스턴트 기능이 탑재돼 투자자 편의성이 크게 향상됐다. 해당 기능은 “요즘 뜨는 ETF는?”과 같은 질문에 대해 시장 동향을 반영한",11-12 16:15,https://www.ebn.co.kr/news/articleView.html?idxno=1686494,EBN
"코스피, 기관 매수에 1%대 반등…코스닥 900선 회복",https://cdn.ebn.co.kr/news/thumbnail/202511/1686491_704539_5924_v150.jpg,"코스피가 기관의 대규모 매수에 힘입어 1% 넘게 상승하며 4150선에서 거래를 마쳤다. 코스닥 역시 외국인과 기관의 동반 매수세에 2.5% 이상 오르며 900선을 탈환했다.이날 코스피는 전장보다 8.95p(0.22%) 하락한 4097.44로 출발해 장중 4088.86까지 밀렸으나이후 상승 전환하며 전장 대비 44.00포인트(1.07%) 오른 4150.39로 마감했다.개인과 외국인이 각각 4466억원, 4280억원 규모로 매도한 반면 기관 홀로 9127억원을 순매수하며 지수 반등을 주도했다.시가총액 상위 종목 중 삼성전자(-0.39%",11-12 15:59,https://www.ebn.co.kr/news/articleView.html?idxno=1686491,EBN
"[증권 & Now] 현대차증권, 탄소금융 리더십 강화 박차 등",https://cdn.ebn.co.kr/news/thumbnail/202511/1686490_704536_5349_v150.jpg,"현대차증권은 오는 19일 서울 중구 대한상공회의소에서 '제1회 2025 탄소금융 인사이트 데이'를 개최한다고 12일 밝혔다.이번 행사는 배출권거래제 및 목표관리제 등 탄소규제를 적용받는 기업의 실무자와 유관 부서 담당자를 대상으로 탄소금융 분야 최신 동향과 전략을 공유하기 위해 마련됐다.세미나는 오후 1시 30분부터 시작되며, 총 3개 세션으로 구성된다. 세션 1은 배출권 제도와 시장 동향, 세션 2는 기업의 대응 전략 및 실제 추진 사례, 세션 3은 배출권 파생상품의 이해를 주제로, 각 분야 전문가 6명이 발표자로 나선다.현대차증",11-12 15:55,https://www.ebn.co.kr/news/articleView.html?idxno=1686490,EBN
