title,thumbnail,short_content,write_time,link,company
"캐나다, 한화오션에 RFP 발송…60조원 잠수함 프로젝트 시동",https://cdn.ebn.co.kr/news/thumbnail/202511/1686508_704557_235_v150.jpg,"캐나다 정부가 총 60조원 규모의 차세대 잠수함 조달 사업(CPSP)에 대한 입찰제안요청서(RFP)를 공식 발송하면서 한국과 독일의 ‘양자 대결’이 본격화됐다.한국 측에서는 한화오션과 HD현대중공업이 '원팀' 형태로 참여해 기술력과 납기 경쟁력을 내세우고 있다.12일 업계에 따르면, 캐나다 정부는 최근 한화오션에 CPSP 사업 입찰제안요청서를 전달했으며, 제안서 제출 기한은 내년 3월 초까지다. 최종 사업자는 이르면 내년 중 선정될 전망이다.이번 사업은 12척 규모의 3000톤급 잠수함을 조달하는 초대형 프로젝트로, 향후 유지·정비",11-12 17:43,https://www.ebn.co.kr/news/articleView.html?idxno=1686508,EBN
"고려아연, 동절기 취약계층에 김장김치·방한용품 지원",https://cdn.ebn.co.kr/news/thumbnail/202511/1686482_704530_396_v150.jpg,"고려아연은 동절기 취약계층을 위한 방한용품·김장김치 지원을 위해 적십자사 서울지사에 후원금 4300만원을 전달하고, 자사와 계열사 임직원들은 김장 봉사활동에 참여했다고 12일 밝혔다.지난 11일 서울시 노원구 소재 대한적십자사 서울지사 북부봉사관에서 진행된 ‘고려아연과 대한적십자사가 함께하는 2025 건강한 겨울나기’ 행사에는 정무경 고려아연 지속가능경영부문 사장, 허혜숙 대한적십자사 서울지사 사무처장을 비롯해 고려아연과 계열사(서린정보기술·케이지트레이딩) 임직원, 적십자봉사원 등 관계자 60여명이 참여했다.이날 행사에서는 정무경",11-12 15:39,https://www.ebn.co.kr/news/articleView.html?idxno=1686482,EBN
"'AI 특수' HD현대일렉트릭, 북미 수주 폭증에 4분기도 '고압 질주'",https://cdn.ebn.co.kr/news/thumbnail/202511/1686432_704477_1910_v150.jpg,"AI(인공지능) 데이터센터 확산과 북미 송전 인프라 투자 붐이 맞물리며 HD현대일렉트릭이 '고압 성장 궤도'에 올랐다.3분기 사상 최대 실적을 기록한 데 이어 4분기에도 외형 성장세가 이어질 것으로 전망된다. 공급자 우위 시장이 장기화되면서 내년 이후 실적뿐 아니라 중장기 성장성에 대한 기대감이 커지고 있다.12일 업계에 따르면, HD현대일렉트릭은 지난 3분기 매출 9954억원, 영업이익 2471억원을 기록했다. 매출은 전년 대비 26%, 영업이익은 51% 증가했다. 영업이익률은 24.8%로 역대 최고치다.북미 전력망 투자 확대와",11-12 14:46,https://www.ebn.co.kr/news/articleView.html?idxno=1686432,EBN
정치 공방에 ‘K-스틸법’ 또 안갯속…철강산업 규제 지속,https://cdn.ebn.co.kr/news/thumbnail/202511/1686448_704488_3227_v150.jpg,철강산업 지원을 위한 핵심 법안으로 기대를 모았던 ‘K-스틸법’의 국회 통과가 다시 안갯속에 빠졌다.12일 관련 업계에 따르면 이달 본회의 통과가 유력했던 K-스틸법(철강산업 경쟁력 강화 및 녹색철강기술 전환을 위한 특별법안)은 여야 간 대립 격화로 이달 본회의 통과가 어려워졌다.당초 여야는 13일 열리는 본회의를 통해 민생경제법안들을 먼저 처리하고자 했다. 하지만 검찰의 대장동 사건 항소 포기 결정 이후 정치권이 극한 대치 국면으로 치달았다.결국 여야는 13일 본회의에서는 별도 합의가 필요 없는 50여개 법안만 처리하기로 합의했으,11-12 14:45,https://www.ebn.co.kr/news/articleView.html?idxno=1686448,EBN
"""원점에서 다시""… 한화오션, 안전관리 전면 재정비 나선다",https://cdn.ebn.co.kr/news/thumbnail/202511/1686385_704401_1742_v150.jpg,"한화오션이 안전관리 체계를 근본부터 재정비한다. 최근 안전 의식 강화를 그룹 차원의 핵심 과제로 삼은 가운데, 제도·시스템·인력 전 영역에서 전면적인 '리셋(Re-Set)' 작업에 돌입한다는 방침이다.한화오션은 12일 경남 거제사업장에서 김희철 대표이사와 임직원, 협력사 대표 등이 참석한 가운데 '안전 혁신 선포식'을 열었다고 밝혔다. 이번 행사는 안전에 관한 모든 관행을 원점에서 재점검하고, 실질적 개선책을 실행하겠다는 의지를 담았다.회사는 이번 선포식을 계기로 △제도 △시스템 △사람을 축으로 한 '20대 안전 혁신 과제'를 본격",11-12 10:17,https://www.ebn.co.kr/news/articleView.html?idxno=1686385,EBN
"티엑스알로보틱스, 상품 분류·정렬 시스템 개발",https://cdn.ebn.co.kr/news/thumbnail/202511/1686383_704399_858_v150.jpg,"티엑스알로보틱스는 자체 개발한 상품 분류 및 정렬 시스템을 갖춘 솔루션을 출시했다고 12일 밝혔다.티엑스알로보틱스는 ‘상품의 분류와 정렬이 가능한 싱귤레이터(Singulator)’로 무작위로 투입된 상품을 자동으로 개별 인식·분류하고 일정한 방향으로 정렬해 배출하는 시스템을 개발했으며, 특허를 출원했다.기존의 단순 이송 중심 장비와 달리 정렬의 정확도와 유연성을 크게 높인 것이 특징이다.핵심 기술은 싱귤레이터의 각 모듈 제어 기술과 비전(영상 인식) 시스템이다. 카메라가 상품의 형태와 위치를 실시간으로 인식하면, 싱귤레이터의 각 모",11-12 10:10,https://www.ebn.co.kr/news/articleView.html?idxno=1686383,EBN
"현대제철 홈페이지, 레드닷 디자인 어워드 본상",https://cdn.ebn.co.kr/news/thumbnail/202511/1686381_704395_44_v150.jpg,"현대제철은 '2025 레드닷 디자인 어워드'에서 본상을 수상했다고 12일 밝혔다.레드닷 디자인 어워드는 70년의 역사를 자랑하는 세계적 권위의 디자인 공모전이다. 매년 제품 디자인, 브랜드&커뮤니케이션 디자인, 디자인 콘셉트 3개 부문에서 수상작을 선정한다.현대제철이 수상한 부문은 브랜드&커뮤니케이션 디자인이다. 공식 홈페이지를 사용자 중심으로 설계해 직관적면서도 몰입감을 높여 철강산업 전반에 대한 고객들의 접근성을 제고했다는 평가를 받았다.현대제철 홈페이지는 '무거운 철강, 가벼운 경험'을 콘셉트로, 현대제철의 70년 역사와 혁신",11-12 10:04,https://www.ebn.co.kr/news/articleView.html?idxno=1686381,EBN
"포스코홀딩스, 1.1조 투입 글로벌 리튬 자원 확보… 장인화 ""글로벌 1위 기업 도약""",https://cdn.ebn.co.kr/news/thumbnail/202511/1686363_704378_4011_v150.jpg,"포스코홀딩스가 이차전지소재 원료 경쟁력 강화를 위해 총 1조1000억 원을 투자해 호주와 아르헨티나의 우량 리튬 자원 확보에 나선다.우량 자원 선점을 최우선 과제로, 글로벌 리튬 자원에 대한 신속하고 공격적인 투자를 통해 원가 경쟁력 강화와 안정적 원료 확보를 동시에 추진하겠다는 포스코그룹 이차전지소재 사업 전략의 일환이다.포스코홀딩스는 호주의 대표 광산기업인 미네랄 리소스(Mineral Resources)사가 신규 설립하는 중간 지주사의 지분 30% 인수를 결정했다고 12일 밝혔다. 투자금액은 약 7억 6500만 달러, 한화로 약",11-12 09:40,https://www.ebn.co.kr/news/articleView.html?idxno=1686363,EBN
"정도원 삼표 회장, 임직원 자녀 수능생 격려… ""뜨거운 노력, 단단한 기초 될 것""",https://cdn.ebn.co.kr/news/thumbnail/202511/1686338_704350_311_v150.jpg,"건설기초소재 전문기업 삼표그룹은 대학수학능력시험을 앞두고 임직원 자녀 수험생들에게 ‘수능 응원 선물’을 전달했다고 12일 밝혔다.삼표그룹은 매년 수능을 앞두고 응원 선물을 전달하며 수험생과 학부모를 격려하고 있다.올해는 프랑스 전통 디저트인 ‘까눌레’와 ‘레몬파운드’로 구성된 선물을 마련해 달콤함과 함께 작은 즐거움을 전했다.이번 선물에는 정도원 회장의 격려 메시지도 함께 담겼다. 정 회장은 메시지를 통해 ""수험생 여러분이 그동안 쌓아온 뜨거운 노력과 인내의 시간이 앞으로의 단단한 기초가 될 것""이라며 수험생과 가족들에게 따뜻한 격",11-12 08:31,https://www.ebn.co.kr/news/articleView.html?idxno=1686338,EBN
"HD현대·한화, 선박 엔진사업 폭풍 성장…이중연료 확대 수혜",https://cdn.ebn.co.kr/news/thumbnail/202511/1686251_704334_733_v150.jpg,"HD현대와 한화그룹의 선박 엔진 제조 사업이 올해 가파른 성장세를 보이고 있다. 11일 조선업계에 따르면, 조선 경기 회복과 환경 규제 강화로 이중연료(DF) 엔진 중심의 시장 재편이 가속화되면서 선박 엔진 산업이 K-조선의 새로운 성장축으로 부상하고 있다.■ HD현대중공업·HD현대마린엔진, 엔진 사업 ‘쌍끌이 호황’HD현대의 엔진 사업이 그룹 내 새로운 수익 축으로 자리매김하고 있다. 대형 엔진은 HD현대중공업이, 중소형 엔진은 HD현대마린엔진이 각각 담당하며 두 회사 모두 뚜렷한 성장세를 보이고 있다.HD현대중공업의 3분기 엔진",11-12 06:00,https://www.ebn.co.kr/news/articleView.html?idxno=1686251,EBN
"WSJ ""한화 필리조선소, 10년 내 연 2~3척 핵잠 건조 목표""",https://cdn.ebn.co.kr/news/thumbnail/202511/1686309_704323_2134_v150.jpg,"한화그룹이 인수한 미국 필라델피아 소재 필리조선소에서 10년 내 매년 2~3척의 핵추진 잠수함을 건조한다는 내부 목표를 세웠다고 월스트리트저널(WSJ)이 10일(현지시간) 보도했다.WSJ은 트럼프 대통령의 미국 조선업 부활 구상 속에서 한화가 필리조선소를 핵심 거점으로 삼아 최고 난이도의 핵잠 건조에 도전하고 있다고 전했다.현재 필리조선소의 연간 건조량은 1척 수준이지만, 한화는 이를 연간 최대 20척으로 확대한다는 계획 아래 수천 명의 인력 충원과 한국식 생산 효율화 방식을 도입 중이다.다만 WSJ은 한화가 핵잠수함 건조 경험이",11-11 21:23,https://www.ebn.co.kr/news/articleView.html?idxno=1686309,EBN
"동국제강그룹, ‘소방가족희망나눔’에 2억원 전달…교육·주거·취업까지 지원",https://cdn.ebn.co.kr/news/thumbnail/202511/1686298_704313_345_v150.jpg,"동국제강그룹은 순직 소방관 자녀들의 교육 지원을 위해 기부금을 전달했다고 11일 밝혔다.이날 동국제강그룹은 세종시 소방청에서 ‘순직 소방관 유자녀 교육 지원 기부금 전달식’을 열고, 사단법인 ‘소방가족희망나눔’에 후원금 2억원을 전달했다.사단법인 소방가족희망나눔은 순직 소방공무원 유가족의 안정과 복지를 지원하는 소방청 산하 재단이다.동국제강그룹은 대한소방공제회와 함께 2018년부터 이어온 소방공무원 후원 체계를 재검토한 뒤, 소방청과의 협의를 거쳐 올해부터 기금 운용 주체를 소방가족희망나눔으로 이관했다. 현재까지 누적 후원금은 16",11-11 17:34,https://www.ebn.co.kr/news/articleView.html?idxno=1686298,EBN
"브로넥스, 스맥·로체시스템즈과 제조실행시스템 구축 계약",https://cdn.ebn.co.kr/news/thumbnail/202511/1686270_704282_4416_v150.jpg,"종합 IT 서비스기업 브로넥스는 최근 국내 코스닥 상장사 스맥, 로체시스템즈과 잇달아 제조실행시스템(MES) 구축 계약을 체결했다고 11일 밝혔다.스맥은 정밀기계·공작기계 분야에서 독자적인 기술력을 보유한 코스닥 상장사다. 다양한 산업군의 생산 현장에 스마트 제조 자동화 솔루션을 공급하고 있다.로체시스템즈은 반도체·디스플레이 장비 전문 기업이다. 고도화된 공정 제어 기술과 자동화 설비 역량을 바탕으로 스마트 팩토리 구축 분야에서 경쟁력을 강화하고 있다.브로넥스는 두 기업의 제조 현장에 맞춤형 MES를 구축하고, 자사 협업 솔루션 '",11-11 15:44,https://www.ebn.co.kr/news/articleView.html?idxno=1686270,EBN
"현대차그룹, 평택항 탄소중립 수소항만 구축 사업 참여",https://cdn.ebn.co.kr/news/thumbnail/202511/1686247_704248_3832_v150.jpg,"현대자동차그룹이 평택시 등과 함께 수소 생태계 조성에 앞장선다.현대차그룹은 평택시청에서 현대차그룹 켄 라미레즈 에너지&수소사업본부장 부사장, 정장선 평택시장, 도경식 평택지방해양수산청 청장, 김금규 경기평택항만공사 사장 직무대행 등 주요 관계자들이 참석한 가운데 ‘탄소중립 수소항만 구축을 위한 업무협약(MOU)’을 체결했다고 11일 밝혔다.이번 업무협약은 현대차, 기아, 현대글로비스와 평택시, 경기평택항만공사, 평택지방해양수상청이 탄소중립에 대한 공감대를 바탕으로 평택항을 탄소중립 친환경 그린수소 항만으로 조성해 국가 수소 생태계",11-11 14:38,https://www.ebn.co.kr/news/articleView.html?idxno=1686247,EBN
"WSJ ""한화, 필리조선소 확장 추진… 10년내 매년 원잠 2∼3척 건조 목표""",https://cdn.ebn.co.kr/news/thumbnail/202511/1686244_704244_3055_v150.jpg,"한화가 향후 10년 이내에 미국에서 매년 2∼3척의 원자력 추진 잠수함(원잠)을 만든다는 계획을 갖고 있다고 미국 월스트리트저널(WSJ)이 10일(현지시간) 보도했다.WSJ은 ""한화가 신규 프로젝트 역량을 확보하기 위해 필리조선소 주변 지역에서 사업 확장 기회를 모색하고 있다""며 ""한화필리조선소가 연간 생산량을 최대 20척으로 늘리는 것을 목표로 한다""고 했다.이날 보도는 건조 장소를 놓고 일부 혼선이 빚어지고 있는 상황이라는 점에서 이목을 집중시키고 있다. 앞서 지난달 30일 트럼프 대통령은 한국의 원잠 건조를 승인하면서 필리조선",11-11 14:31,https://www.ebn.co.kr/news/articleView.html?idxno=1686244,EBN
"관세 충격에 운임 37% ‘뚝’…HMM, 3분기 '빨간불'",https://cdn.ebn.co.kr/news/thumbnail/202511/1686236_704232_4759_v150.jpg,"미국발 관세 충격과 해운운임 급락이 겹치면서 HMM의 3분기 실적에 경고등이 켜졌다. 높아진 관세를 피하려는 '밀어내기 출하'가 2분기에 선반영되며 성수기 효과가 약화됐고, 해운 시황의 구조적 둔화로 운임 하락세가 장기화되고 있다.11일 금융정보업체 에프앤가이드에 따르면 주요 증권사들이 추정한 HMM의 3분기 영업이익은 2722억원으로, 전년 동기(1조4614억원) 대비 81% 급감할 것으로 예상된다. 매출액도 2조5838억원으로 전년 대비 27% 감소가 전망된다.이번 3분기 부진은 단기적인 관세 충격과 시황 악화뿐 아니라, 해운시",11-11 13:50,https://www.ebn.co.kr/news/articleView.html?idxno=1686236,EBN
"HD현대중공업, 코친조선소와 인도 함정시장 진출 본격화",https://cdn.ebn.co.kr/news/thumbnail/202511/1686208_704201_1137_v150.jpg,"HD현대중공업이 인도 코친조선소와 손잡고 인도 해군 상륙함 사업에 뛰어든다. 인도 해군 현대화 정책이 본격화되는 가운데 현지 조선소와 함께 글로벌 방산·특수선 시장 확대의 발판을 마련했다.HD현대중공업은 인도 최대 국영 조선소인 코친조선소(Cochin Shipyard Limited, CSL)와 ‘인도 해군 상륙함(LPD·Landing Platform Dock) 사업 추진을 위한 전략적 협력 양해각서(MOU)’를 체결했다고 11일 밝혔다.코친조선소는 인도 남부 케랄라주에 위치한 대형 조선소로 상선부터 항공모함까지 건조 가능한 설계·생",11-11 11:15,https://www.ebn.co.kr/news/articleView.html?idxno=1686208,EBN
곡소리 나는 시멘트업계…내수판매 34년만에 최저,https://cdn.ebn.co.kr/news/thumbnail/202511/1686184_704175_633_v150.jpg,시멘트 업계가 극심한 건설 경기 침체로 최대 위기에 처했다.11일 한국시멘트협회에 따르면 올해 국내 시멘트 내수(출하)는 작년 대비 16.5%(721만t) 감소한 3650만t에 그칠 것으로 전망됐다.올해 국내 시멘트 출하량은 1991년(3711만t) 이후 34년 만에 가장 적은 수준이다. 이는 건설경기 부진이 지속된데 따른 것으로 분석됐다. 협회는 내년 시멘트 수요 전망도 부정적으로 봤다. 올해보다 1.4%(50만t) 감소한 3천600만t에 그칠 것이라는 분석이다. 건설업계가 겪는 자금 문제와 공사비 폭등에 불구하고 수요 회복을 기,11-11 10:06,https://www.ebn.co.kr/news/articleView.html?idxno=1686184,EBN
"HD현대미포, 자동화로 새 시대… 통합 현대重 핵심 축 부상",https://cdn.ebn.co.kr/news/thumbnail/202511/1686172_704164_1926_v150.jpg,"HD현대미포의 기술 경쟁력이 두각을 나타내고 있다.오는 12월 HD현대중공업과의 합병 이후에도 기술력을 앞세워 통합 HD현대중공업의 성장을 이끌겠다는 구상이다.11일 HD현대미포에 따르면 회사는 지난달 20일 국내 최초로 옥외작업인 외업 공정에서 협동로봇을 활용한 자동용접에 성공했다.이번 자동용접 로봇은 HD현대미포와 HD한국조선해양이 공동 개발한 것으로, 자동용접 기술이 내업 공정에서 외업 공정으로 확장된 첫 사례다. 날씨와 장애물 등 변수가 많은 환경에서도 로봇이 스스로 장애물을 인식·회피하며 용접을 수행했다는 점에서 의미가 크",11-11 09:21,https://www.ebn.co.kr/news/articleView.html?idxno=1686172,EBN
