title,thumbnail,short_content,write_time,link,company
"BNK부산은행, 거래실적 조건 없는 모바일 전용 'ONE주택담보대출' 출시",https://cdn.ebn.co.kr/news/thumbnail/202511/1686479_704526_3331_v150.jpg,"BNK부산은행은 12일 영업점 방문 없이 모바일뱅킹 앱(App)을 통해 손쉽게 신청할 수 있는 모바일 전용 주택담보대출 신상품 'ONE주택담보대출'을 출시했다고 밝혔다.‘ONE주택담보대출’은 거래실적 연동 우대금리 조건이 없는 주택담보대출 상품으로, 복잡한 거래실적 충족 부담 없이 합리적인 금리로 이용할 수 있다. 이는 금융소비자의 접근성을 높이고 상품 이해도를 개선하여 최근 금융시장 트렌드를 반영한 것이다.대출 신청 과정에서는 스크래핑 및 공공 마이데이터 연계해, 고객이 별도 서류를 제출하지 않아도 심사에 필요한 자료가 자동 제출",11-12 15:34,https://www.ebn.co.kr/news/articleView.html?idxno=1686479,EBN
"증권가, 고액자산가 맞춤 서비스 강화·프리미엄 마케팅 총력",https://cdn.ebn.co.kr/news/thumbnail/202511/1686476_704520_2651_v150.jpg,"국내 주요 증권사들이 고액자산가를 위한 프리미엄 자산관리 서비스에 박차를 가하고 있다. 각 사는 고객 맞춤형 컨퍼런스, 복합점포 기반 PB센터, 스포츠 이벤트 등 차별화된 프로그램을 통해 고객과의 접점을 넓히고 있다.12일 금융투자업계에 따르면 한국투자증권은 지난 11일 서울 파크 하얏트에서 '패밀리오피스 컨퍼런스 데이'를 열었다.글로벌 웰스 매니지먼트 조직(GWM)이 주최한 이번 행사는 초고액자산가 고객을 대상으로 서울대 조영태 교수의 인구경제 특강과 바이올리니스트 김빛날윤미의 공연이 함께 진행됐다.GWM은 글로벌 투자 전략, 가",11-12 15:29,https://www.ebn.co.kr/news/articleView.html?idxno=1686476,EBN
메가딜 인수금융 나선 은행…'예대 마진' 한계 넘는다,https://cdn.ebn.co.kr/news/thumbnail/202511/1686463_704508_5717_v150.jpg,은행들이 조 단위 인수금융에 깃발을 꽂으며 비이자 이익을 취하고 있다. 안정적인 이자이익 확보처였던 가계대출이 제한되면서 인수금융은 은행들의 수익 다변화의 주축이 되고 있다.12일 금융권에 따르면 은행권이 부동산으로 치우친 대출이나 예대마진 중심 영업을 넘어 금융 대전환에 집중하는 가운데 굵직한 인수금융에서 성과를 내고 있다. 증권사들이 최근 몇년 간 자기자본을 확대해 대규모 인수금융 시장에서 플레이어로 등장하고 있지만 여전히 은행권이 전통 강자로서 입지를 굳히고 있다. KB금융은 최근 생산적금융 프로젝트로 3조3000억원 규모의,11-12 15:22,https://www.ebn.co.kr/news/articleView.html?idxno=1686463,EBN
"[현장] ""토큰화 시대, 국채토큰 부상…선제 대응 중요""",https://cdn.ebn.co.kr/news/thumbnail/202511/1686401_704421_1744_v150.jpg,"디지털 자산 시대에 국채 토큰이 새로운 금융 인프라의 핵심 역할을 수행할 것이라는 전망이 나왔다.정화영 자본시장연구원 연구위원은 12일 열린 ‘디지털 전환 시대의 국채 토큰화’ 세미나에서 토큰화 기술이 자본시장에 가져올 효율성 향상과 시장 혁신 가능성에 주목하며, 이에 대한 정책적 대응과 제도적 정비가 시급하다고 강조했다.정 연구위원은 “실물 자산의 디지털화인 토큰화(tokenization)가 향후 금융 시스템의 구조를 근본적으로 바꿀 수 있다”며 “토큰화가 국채를 포함한 다양한 금융자산에 적용될 수 있으며, 특히 국채는 안전자산",11-12 14:50,https://www.ebn.co.kr/news/articleView.html?idxno=1686401,EBN
한국은행 “위기 때 정화 작동 안돼…한계기업이 투자·성장 발목”,https://cdn.ebn.co.kr/news/thumbnail/202511/1686423_704462_5915_v150.jpg,"한국은행이 우리 경제의 구조적 성장 둔화 원인으로 ‘한계기업의 미흡한 퇴출’을 지목했다. 수차례 위기를 거치면서도 기업 구조조정이 제대로 작동하지 않아, 민간 투자 부진과 성장 잠재력 약화로 이어졌다는 분석이다.한은은 12일 발표한 보고서 ‘경제위기 이후 우리 성장은 왜 구조적으로 낮아졌나’에서 “1990년대 이후 한국 경제는 위기를 겪을 때마다 성장 추세가 낮아졌으며, 이는 민간 소비와 투자의 장기적 위축에 기인한다”고 밝혔다.이어 “특히 민간 투자 둔화는 위기 이후 한계기업의 퇴출이 지연되면서 기업 역동성이 장기간 회복되지 못한",11-12 14:01,https://www.ebn.co.kr/news/articleView.html?idxno=1686423,EBN
"""언론과는 경쟁적·협력적 관계""…이억원 금융위원장 기자간담회 [Q&A]",https://cdn.ebn.co.kr/news/thumbnail/202511/1686405_704424_558_v150.jpg,"미국과 관세협상이 어느 정도 마무리가 됐는데도 외국인 매도세가 계속 이어지고 있고 또 환율도 1460원을 넘어서고 있는데 계엄 이후에 1440원이었을 때 당국이, 그때에 비해서 당국이 지나치게 손을 놓고 있는 것 아닌가 하는 생각이 들어서요. 오히려 지금 외화 유동성 관리가 더 해야 되는데, 지금 금융회사나 민간이 알아서 하고 있는데 F4 회의가 그때보다 더 이루어지지 못하는 다른 이유가 있는지 궁금합니다. [이억원] ▶그때와 다른 건 없고요. 계속해서 이런 부분들은, 시장 상황들은 저희들이 면밀히 점검하고 체크하고 있고요",11-12 14:00,https://www.ebn.co.kr/news/articleView.html?idxno=1686405,EBN
"이억원 “금융은 韓경제 재도약 엔진…'생산적 돈흐름'이 비약의 열쇠""",https://cdn.ebn.co.kr/news/thumbnail/202511/1686406_704436_442_v150.jpg,"이억원 금융위원장이 12일 취임 두 달을 맞아 첫 기자간담회를 열고 ‘금융의 3대 대전환’을 앞세운 경제 반전 전략을 제시했다. 핵심은 '산업과 실물이 금융에 먹거리를 주고, 금융이 다시 산업의 성장을 밀어주는 선순환'이다. 그는 “숨 가쁘게 달려온 두 달이었다”며 “이제는 속도를 내 국민이 체감할 수 있는 결과로 보여줄 때”라고 강조했다.그는 한국경제의 구조적 난제를 ‘저성장’과 ‘양극화’로 진단했다. 그는 “산업과 실물이 다시 성장하려면 금융이 뒤에서 밀어줘야 한다”며 “금융이 산업에 먹거리를 주고, 산업이 다시 금융에 활력을",11-12 14:00,https://www.ebn.co.kr/news/articleView.html?idxno=1686406,EBN
이억원 “금융이 산업에 숨 불어넣어야 한국경제 다시 뛴다”,https://cdn.ebn.co.kr/news/thumbnail/202511/1686413_704449_1833_v150.jpg,"“이 자리는 정책을 발표하는 자리가 아닙니다. 여러분과 제가 같은 흐름을 공유하는 자리입니다.”(이억원 금융위원장)이억원 금융위원장이 12일 취임 두 달을 맞아 첫 기자간담회를 열고 ‘금융의 3대 대전환’을 앞세운 이같은 경제 전략을 제시했다. 그의 첫마디는 담담했지만, 목소리에는 단단한 결의가 묻어났다. 핵심은 '산업과 실물이 금융에 먹거리를 주고, 금융이 다시 산업의 성장을 밀어주는 선순환'이다.그는 취임 두 달을 “100m 전력질주를 계속한 마라톤 주자”에 비유했다. 숨가쁜 일정 속에서도 금융의 세 축, 생산적 금융, 포용적",11-12 14:00,https://www.ebn.co.kr/news/articleView.html?idxno=1686413,EBN
9월 통화량 4430조5000억…전월比 0.7%↑,https://cdn.ebn.co.kr/news/thumbnail/202511/1686408_704441_325_v150.jpg,"올해 9월 통화량은 투자 대기성 자금 유입으로 증가한 것으로 나타났다.12일 한국은행이 발표한 '2025년 9월 통화 및 유동성' 통계에 따르면, 지난 9월 평균 광의 통화량(M2 기준·평잔)은 전월보다 0.7% 늘어난 4430조5000억원을 기록했다.요구불예금은 9조5000억원, 수시입출식 저축성예금은 6조8000억원, 수익증권은 5조7000억원 증가한 것으로 집계됐다.넓은 의미의 통화량 지표 M2에는 현금, 요구불예금, 수시입출금식 예금(이상 M1) 외 머니마켓펀드(MMF), 2년 미만 정기 예·적금, 수익증권, 양도성예금증서(",11-12 13:03,https://www.ebn.co.kr/news/articleView.html?idxno=1686408,EBN
"하나금융, 4000억원 'K-미래전략산업 벤처 모펀드' 설정",https://cdn.ebn.co.kr/news/thumbnail/202511/1686400_704422_2324_v150.jpg,"하나금융그룹은 6개 관계사가 참여한 모펀드 출자를 통해 생산적 금융 실천을 위한 첨단산업(ABCDEF) 생태계 조성에 나선다고 12일 밝혔다. ‘하나 모두 성장 프로젝트’ 중 생산적 금융 84조원에 대한 실행 약속을 가장 먼저 이행한 대표적 사례다.함영주 하나금융그룹 회장을 비롯한 그룹 사장단과 임직원들이 참석한 ‘2026년 그룹 경영계획 워크숍’에서 그룹 차원의 ‘생산적 금융 공급 확대’를 핵심 주제로 선정, ‘하나 모두 성장 K-미래전략산업 벤처 모펀드’의 조기 결성에 공감대를 형성하고 이를 본격 추진키로 했다.‘하나 모두 성장",11-12 11:30,https://www.ebn.co.kr/news/articleView.html?idxno=1686400,EBN
"AI 거품 경고에도…""삼성전자·하이닉스 계속 달린다""",https://cdn.ebn.co.kr/news/thumbnail/202511/1686375_704387_553_v150.jpg,"AI 산업 과열 우려가 잇따르지만 SK하이닉스와 삼성전자에 대한 시장의 시선은 오히려 단단해지고 있다. 핵심은 밸류에이션과 실적이다. 글로벌 반도체 수요의 구조적 반등 조짐에 두 기업의 실적 추정치는 급격히 상향되고 있으며 여전히 낮은 주가 수준은 외국계 기관의 재평가 흐름을 이끌고 있다.11일 금융투자업계에 따르면 글로벌 투자은행 모건스탠리는 최근 발표한 보고서에서 삼성전자와 SK하이닉스의 목표주가를 최대 17만5000원, 85만원으로 대폭 상향 조정했다. 이는 지난달 제시한 11만원, 48만원에서 불과 한 달 만에 각각 59%,",11-12 10:11,https://www.ebn.co.kr/news/articleView.html?idxno=1686375,EBN
"[특징주] 효성, 거래소 투자경고 지정에 급락",https://cdn.ebn.co.kr/news/thumbnail/202511/1686361_704377_3851_v150.jpg,효성이 12일 한국거래소의 투자경고종목 지정 소식에 장초반 급락세다.이날 오전 9시 26분 현재 효성은 전장 대비 9.86% 하락한 14만8100원에 매매 중이다.전일 한국거래소는 효성을 12일자로 투자경고종목으로 지정한다고 공시했다. 거래소는 소수 계좌에 매매가 집중되거나 주가가 일정 기간 급등하는 등 불공정거래 가능성이 있는 종목에 대해 투자주의→투자경고→투자위험 3단계로 투자위험을 고지한다.지정 사유는 ▲최근 1년간 200% 이상 주가 상승 ▲최근 15일 종가 중 최고가 기록 ▲최근 15일간 매수관여율 상위 10개 계좌 관여율,11-12 09:39,https://www.ebn.co.kr/news/articleView.html?idxno=1686361,EBN
10월 국고채 금리 일제히 상승…외국인 순매수 11조원 급감,https://cdn.ebn.co.kr/news/thumbnail/202511/1686360_704374_348_v150.jpg,"10월 국내 장외채권시장은 기준금리 동결과 인하 기대 약화 영향으로 금리가 상승한 가운데, 발행과 거래 모두 감소한 것으로 나타났다.12일 금융투자협회 '2025년 10월 장외채권시장 동향'에 따르면 지난달 말 기준 국고채 3년물 금리는 연 0.2716%로 전월 말 대비 0.134%p 올했다. 5년물 0.121%p, 10년물 0.111%p, 30년물 0.144%p 상승하는 등 전 구간에서 금리가 일제히 상승 마감했다.국고채 금리가 월 중반까지는 글로벌 금리 하락세에 따라 일시 하락했으나, 한국은행의 금통위 기준금리 동결과 포워드 가",11-12 09:34,https://www.ebn.co.kr/news/articleView.html?idxno=1686360,EBN
수도권 분양실적 20년 이후 두 번째 최저…'신축 품귀' 더 심해진다,https://cdn.ebn.co.kr/news/thumbnail/202511/1686502_704552_4734_v150.jpg,"수도권 아파트 분양실적이 2020년 이후 두 번째로 낮은 수준까지 떨어진 것으로 집계됐다. 이미 억눌려 있던 갈아타기 수요와 대기 수요가 적은 '신축'으로 몰리는 구도가 굳어지면서, 주요 입지에서는 청약 경쟁률 급등과 '신축 품귀' 현상이 한동안 이어질 것이란 전망이 힘을 얻고 있다.부동산 리서치업체 리얼투데이가 국토교통부 통계누리의 '주택건설 분양실적(공동주택)' 자료를 분석한 결과, 올해 1~9월 수도권 분양실적은 5만3646가구(분양 기준, 임대·조합 제외)로 집계됐다. 2020년 이후 최저치였던 2023년(3만9615가구)에",11-12 16:48,https://www.ebn.co.kr/news/articleView.html?idxno=1686502,EBN
청약마저 '그사세'…10·15대책에 현금부자만 '로또' 맞는다,https://cdn.ebn.co.kr/news/thumbnail/202511/1686496_704546_3126_v150.jpg,"서민들의 대표적인 내 집 마련 통로였던 청약제도가 사실상 현금 부자들만의 ‘그사세’(그들이 사는 세상)로 변질되고 있다. 공사비 급등과 잇따른 정부의 대출 규제가 겹치며 자금 조달이 어려워진 반면, 분양가 상한제가 되레 ‘로또 청약’ 열풍을 불러일으키는 양상이다.12일 한국부동산원 청약홈에 따르면 올해 서울에서 전용 84㎡(국민평형) 일반분양이 포함된 단지는 총 9곳으로, 평균 분양가(최저가 기준)는 17억6900만원에 달했다. 공공택지 분양인 강동구 고덕강일 대성베르힐(9억7500만원)을 제외하면 평균 18억6800만원으로 상승한",11-12 16:33,https://www.ebn.co.kr/news/articleView.html?idxno=1686496,EBN
"삼부토건, 회생계획안 제출 기한 내년 1월로 연장",https://cdn.ebn.co.kr/news/thumbnail/202511/1686493_704543_1523_v150.jpg,"회생절차를 밟고 있는 삼부토건이 법원의 허가를 받아 회생계획안 제출 기한을 내년으로 늦췄다. 채권자와 이해관계인 조정, 사업 구조조정 방안 마련에 시간이 더 필요하다는 판단에 따라 회생 일정에 숨 고르기를 택한 것으로 해석된다.12일 금융감독원 전자공시시스템에 따르면 삼부토건은 '회생절차 개시결정' 공시에 대한 정정신고를 통해 회생계획안 제출 기한을 종전 2025년 11월 17일에서 2026년 1월 17일로 연장했다고 밝혔다. 지난 9월 11일 제출했던 기존 공시에서 회생계획안 제출 기한을 올해 11월 중순으로 안내했으나, 이번 정",11-12 16:14,https://www.ebn.co.kr/news/articleView.html?idxno=1686493,EBN
주택산업硏 “주택 공급난 심각…‘특별대책지역’ 지정하자”,https://cdn.ebn.co.kr/news/thumbnail/202511/1686481_704529_3750_v150.jpg,"주택 공급난이 장기화되는 가운데 집값 상승이 두드러진 지역을 ‘주택공급 특별대책지역’으로 지정해 관리해야 한다는 제안이 나왔다. 공급 절차를 간소화하고 인센티브를 부여해 민간 주택 건설을 촉진하자는 주장이다.12일 주택산업연구원은 “복잡한 행정 절차와 프로젝트파이낸싱(PF) 건전화 대책, 부동산 시장 규제 등으로 민간부문 주택 공급이 위축됐다”며 “공급 부족이 심각한 지역을 중심으로 특별대책지역 제도를 도입할 필요가 있다”고 밝혔다.연구원은 또 “특별대책지역을 지정할 때는 주택정책심의위원회와 관계 부처 협의를 거쳐 국회에 운영 상황",11-12 15:38,https://www.ebn.co.kr/news/articleView.html?idxno=1686481,EBN
"[단독] ""지나치게 시공사에 유리""…우동1구역, DL이앤씨와 결별 택한 이유",https://cdn.ebn.co.kr/news/thumbnail/202511/1686404_704434_1815_v150.jpg,"부산 해운대구에 소재한 '우동 삼호가든(우동1구역)' 재건축 현장. 지난 4년여간 이어진 시공사 DL이앤씨와 '우동1구역 조합(이하 조합)' 간의 묵은 갈등이 지난 11일 밤 결국 터졌다. 이날 진행된 조합 대의원 회의에서 '시공사 선정 취소' 안건이 통과되면서다. 조합은 ""이번 사태로 DL이앤씨에 대한 신뢰가 바닥으로 떨어졌다""며 분노하는 상황. 이에 DL이앤씨는 ""조합과 지속적으로 문제 해결해 나가겠다""고 전했다.그런데 더 큰 문제는 따로 있었다. EBN 취재결과, DL이앤씨가 조합에 전달한 7차안 제안서가 '조합을 상대로 한",11-12 14:26,https://www.ebn.co.kr/news/articleView.html?idxno=1686404,EBN
"'레고랜드 쇼크' 3년…PF 유동화, 회복이냐 착시냐",https://cdn.ebn.co.kr/news/thumbnail/202511/1686395_704417_520_v150.jpg,"부동산 프로젝트파이낸싱(PF) 유동화시장이 숫자만 놓고 보면 위기 국면을 벗어난 듯한 모습이다. 발행 잔액은 레고랜드 사태 이전 수준을 넘어섰고, 대형 증권사와 건설사를 중심으로 신용보강도 다시 늘고 있다. 하지만 자세히 들여다보면 그림은 다르다. 새 사업에 돈이 들어가는 확장 국면이라기보다 기존 사업을 연장·차환하면서 잔액을 유지하는 '버티기 장세'에 가깝다는 평가가 시장 안팎에서 동시에 나온다.PF 유동화 발행 잔액은 올해 9월 말 기준 46조8000억원 안팎으로 추산된다. 지난해 말 40조원대 초반에서 1년 새 6조원 가까이",11-12 11:15,https://www.ebn.co.kr/news/articleView.html?idxno=1686395,EBN
"[단독] 부산 우동1구역, DL이앤씨와 끝내 결별?…'시공사 선정 취소' 대의원회의 통과",https://cdn.ebn.co.kr/news/thumbnail/202511/1686308_704322_1139_v150.jpg,"지난 4년여간 공사비 증액 문제로 갈등 빚어온 '부산 해운대구 우동 삼호가든(우동1구역) 재건축 조합'과 시공사 DL이앤씨가, 결국 결별 수순을 밟게 됐다. 11일 오후 열린 대의원 회의에서 'DL이앤씨 시공사 선정 취소' 안건이 통과되면서다.조합에 따르면 이날 대의원 회의에서는 찬성 66표, 반대 42표로 'DL이앤씨 시공사 선정 취소' 안건이 가결됐다. 이에 따라 내달 28일 열리는 총회에서는 DL이앤씨 시공사 선정 취소 여부를 최종 확정하는 투표가 진행될 예정이다.앞서 지난 2021년 3월, DL이앤씨는 3.3㎡당 공사비 60",11-11 21:23,https://www.ebn.co.kr/news/articleView.html?idxno=1686308,EBN
"금호건설, 4개 분기 연속 흑자…리츠 매각으로 재무도 숨통",https://cdn.ebn.co.kr/news/thumbnail/202511/1686299_704314_4651_v150.jpg,"금호건설은 11일 2025년 3분기 연결기준 잠정실적을 발표하고 4개 분기 연속 흑자를 이어가며 실적 회복세를 공고히 하고 있다고 밝혔다.3분기 금호건설의 매출액은 5234억원, 영업이익은 154억원, 당기순이익은 77억원을 기록했다. 올해 1~3분기 누적 기준으로는 매출 1조5226억원, 영업이익 373억원, 당기순이익 189억원을 달성했다. 지난해 3분기 대규모 손실을 반영했던 것과 비교하면 매출과 이익 모두 뚜렷한 개선세를 보이고 있다는 평가다.실적 회복과 함께 재무구조도 개선되고 있다. 금호건설은 지난 10월 24일 보유 중",11-11 17:47,https://www.ebn.co.kr/news/articleView.html?idxno=1686299,EBN
가양동 ‘CJ부지 재개발’ 새국면…지산 대신 1000가구 아파트 들어설듯,https://cdn.ebn.co.kr/news/thumbnail/202511/1686266_704278_3845_v150.jpg,"서울 강서구 가양동 CJ공장 부지를 재개발하는 6조원대 대형 프로젝트가 새로운 국면을 맞았다. 당초 지식산업센터로 계획됐던 일부 부지가 아파트 단지로 전환될 전망이다.11일 건설업계에 따르면 시행사 인창개발은 최근 강서구청에 CJ 부지 개발사업 1~3블록 중 3블록의 용도를 지산에서 공동주택으로 변경해 달라는 요청서를 제출했다. 해당 블록은 총 연면적 35만5694㎡ 규모로, 이 중 83%에 해당하는 29만4796㎡를 아파트로 변경하는 내용이다.용적률과 부지 면적을 감안할 때 약 1000가구 규모의 대단지 아파트 건설이 가능할 것으",11-11 15:39,https://www.ebn.co.kr/news/articleView.html?idxno=1686266,EBN
"대방건설 '라이트하우스', 굿디자인 어워드서 4년 연속 '우수디자인' 선정",https://cdn.ebn.co.kr/news/thumbnail/202511/1686262_704274_2932_v150.jpg,"대방건설은 11일 '라이트하우스'가 '2025 굿디자인 어워드'에서 4년 연속 우수디자인(GD)으로 선정됐다고 밝혔다.'라이트하우스'는 지하주차장의 조도 개선과 이용자 안전성 향상을 위한 빛 기반 공간 디자인 솔루션이다. 단순한 조명기구를 넘어 지상과 지하를 연결하는 건축적 오브제로 평가받고 있다. 형태적으로는 박공형 실루엣의 투명한 구조체로, 지상에서는 '빛나는 집(Light House)'을 연상시키는 상징적 조형미를 갖췄다. 지하에서는 복층 폴리카보네이트 외피를 통해 확산된 빛이 공간을 부드럽게 채우며, 따뜻하고 안정적인 분위기",11-11 15:31,https://www.ebn.co.kr/news/articleView.html?idxno=1686262,EBN
"세운4구역 토지주 반발...""국가유산청, 재개발 막으면 손해배상 청구""",https://cdn.ebn.co.kr/news/thumbnail/202511/1686259_704266_2250_v150.jpg,"서울 종로구 세운4구역 토지주들이 국가유산청의 재개발 제동에 강하게 반발하고 나섰다. 유네스코 세계유산인 종묘 인근 재개발 사업과 관련해 국가유산청이 ""문화유산 보존을 위한 높이 규제""를 언급하자, 토지주들은 ""부당한 행정 간섭""이라며 법적 대응을 예고했다.11일 세운4구역 토지주들은 기자회견에 앞서 배포한 입장문에서 ""세운4구역은 세계유산으로 지정된 종묘 정전에서 600ｍ 이상 떨어져 세계유산 보호 완충구역(문화유산으로부터 500ｍ 이내)에 해당하지 않음에도 국가유산청 등은 유네스코를 빙자해 맹목적인 높이 규제를 외치고 있다""고",11-11 15:23,https://www.ebn.co.kr/news/articleView.html?idxno=1686259,EBN
[건설사 CEO 포커스⑱] '26년 반도맨' 김용철 대표의 뚝심 경영 결실,https://cdn.ebn.co.kr/news/thumbnail/202511/1686222_704223_5945_v150.jpg,"CEO(최고경영자)는 회사의 비전과 목표, 방향성 전반을 이끈다. 다양한 사업 전략을 세운 후 이를 진두지휘한다. CEO가 잘못된 선택과 판단을 내리면 기업은 한순간에 나락으로 빠질 수 있다. 그만큼 CEO의 책임은 막중하다. 이에 는 [건설사 CEO 포커스] 시리즈를 통해 CEO들의 면면을 샅샅이 살펴보고자 한다. '전문경영인.' 김용철 대표이사의 별칭이다. 반도건설 입사 후 경기 화성 동탄과 김포 등 국내 신도시 주택사업 비롯해 해외사업에서도 성과를 이끌어내며 이런 수식어가 붙었다. '많이 짓기보단",11-11 14:55,https://www.ebn.co.kr/news/articleView.html?idxno=1686222,EBN
"개미 피눈물 내놓곤…‘거래정지’ 서희건설, 남의 주식으로 2000억 굴린다",https://cdn.ebn.co.kr/news/thumbnail/202511/1686203_704196_96_v150.jpg,"서희건설이 임원 횡령과 김건희 여사 고가 목걸이 제공 의혹 등 각종 논란으로 상장적격성 실질심사에 들어가면서 주식 거래가 3개월째 멈춰섰다. 그러나 회사가 남의 주식과 채권에 투자해 쌓아 올린 단순투자 유가증권 규모는 여전히 수천억원대다. 악재 직격탄을 맞은 뒤 주가가 급락하고 거래가 막히면서 소액주주들은 손실을 확정하지도, 빠져나오지도 못한 채 묶여 있는 사이, 서희건설은 테슬라·엔비디아·글로벌 럭셔리주 등 외부 종목에 대한 공격적 운용 기조를 그대로 유지하고 있다.11일 업계에 따르면 서희건설의 주식 거래는 현재 정지된 상태다.",11-11 14:43,https://www.ebn.co.kr/news/articleView.html?idxno=1686203,EBN
지방 건설업 침체 심화...'대전 4위' 크로스건설마저 기업회생 신청,https://cdn.ebn.co.kr/news/thumbnail/202511/1686199_704190_4354_v150.jpg,"대전 지역 시공능력평가 4위 기업 크로스건설이 지난달 기업회생절차(법정관리)를 신청한 것으로 알려졌다.11일 건설업계에 따르면, 대전에 연고를 둔 크로스건설은 지난 10월 대전지방법원에 기업회생절차를 신청, 10월 30일 회생절차 개시 결정을 받았다.2009년 6월 1일 설립된 크로스건설은 토목·건축공사업을 주력으로 하는 지역 중견 건설사다. 올해 시공능력평가액은 1112억원, 전국 도급순위 217위, 대전 지역에서는 4위를 기록했다.기업의 이상 조짐은 지난해부터 감지됐다. 지난해 말 기준 크로스건설의 매출액은 793억원으로 전년(",11-11 10:59,https://www.ebn.co.kr/news/articleView.html?idxno=1686199,EBN
