title,thumbnail,short_content,write_time,link,company
[HJ중공업 안전관리 체크] 최대 위기 직면한 '공공공사 강자',https://cdn.ebn.co.kr/news/thumbnail/202511/1686167_704154_129_v150.jpg,울산 남구에서 발생한 HJ중공업의 보일러 타워 붕괴는 단순한 현장 과실로만 볼 수 없는 사고다. 아파트 하자 통계에서 드러난 품질관리 실패가 산업현장의 안전 부실로 이어졌다는 점에서 이번 사고는 한 기업의 문제가 아니라 한국 건설산업의 구조적 안전불감증을 드러낸 사례로 평가된다. '작은 하자'가 '큰 참사' 로 번지지 않도록 현장의 숫자와 징후들을 경고의 신호로 읽어내야 할 때다. [편집자주]공공공사 분야 전통 강자로 손꼽히는 HJ중공업이 울산화력발전소 보일러 타워 붕괴 사고로 최대 위기에 직면했다. 일각에서는 이재명 정부가 추진,11-11 09:16,https://www.ebn.co.kr/news/articleView.html?idxno=1686167,EBN
"DL이앤씨, 'e편한세상 내포 에듀플라츠' 11월 분양 예정",https://cdn.ebn.co.kr/news/thumbnail/202511/1686162_704151_5753_v150.jpg,"DL이앤씨는 충남 홍성군 홍북읍 신경리 929번지 일원, 내포신도시 RH14블록에 'e편한세상 내포 에듀플라츠'를 11월 중 공급할 예정이라고 11일 밝혔다. 이날 DL이앤씨에 따르면, 단지는 지하 2층~지상 25층, 9개 동 규모로 조성되며, 전용면적 84㎡와 119㎡로 구성된 총 727가구로 이뤄진다.이번 공급은 내포신도시에서 약 3년 만에 이뤄지는 신규 분양으로, 민간참여공공분양과 일반분양이 동시에 진행된다. 민간참여공공분양 물량은 수요자 선호도가 높은 전용 84㎡형 605가구이며, 일반분양은 지역 내 희소성이 높은 전용 11",11-11 08:58,https://www.ebn.co.kr/news/articleView.html?idxno=1686162,EBN
"에스앤아이코퍼레이션, CRE본부 확대 개편...종합 부동산관리 역량 강화",https://cdn.ebn.co.kr/news/thumbnail/202511/1686111_704086_1845_v150.jpg,"프롭테크 기반 종합 부동산관리 서비스 기업 에스앤아이코퍼레이션(에스앤아이)은 상업용 부동산 전략 컨설팅 전담 조직인 'CRE본부(Commercial Real Estate)'를 확대 개편했다고 10일 밝혔다.이번 개편은 종합 부동산관리 서비스의 경쟁력 강화를 목표로 11월 조직 개편 방침에 따라 추진됐다.에스앤아이는 기존 단일팀 체제였던 CRE본부를 △임대차 컨설팅 및 시장 데이터 분석을 담당하는 1팀 △매입·매각 자문을 전담하는 2팀으로 재편했다. 동시에 전문 인력을 보강하고 역할을 세분화해, 부동산 운영부터 투자 전반에 이르는 관",11-10 16:20,https://www.ebn.co.kr/news/articleView.html?idxno=1686111,EBN
"라인그룹, '회천중앙역 파라곤' 정당계약 실시",https://cdn.ebn.co.kr/news/thumbnail/202511/1686107_704082_1133_v150.jpg,"라인그룹은 '회천중앙역 파라곤'의 정당계약을 오는 12일까지 진행한다고 10일 밝혔다.회천중앙역 파라곤은 경기도 양주시 회정동 785번지(회천지구 A10-1블록) 일원에 지하 2층~지상 29층, 8개 동, 전용면적 72~84㎡, 총 845세대 규모로 조성된다. 단지 내에는 피트니스센터, 작은도서관, 북카페, 음악연습실 등 다양한 커뮤니티 시설이 마련된다. 분양가상한제가 적용돼 합리적인 분양가를 갖춘 점도 특징이다.단지가 들어서는 회천신도시는 서울과의 물리적 거리보다 실제 출퇴근 소요 시간이 짧은 '시간 효율형 지역'으로 주목받고 있",11-10 16:13,https://www.ebn.co.kr/news/articleView.html?idxno=1686107,EBN
"""색으로 경험을 짓다""...호반건설, '2025 한국색채대상' 혁신·공간환경 부문 수상",https://cdn.ebn.co.kr/news/thumbnail/202511/1686099_704076_573_v150.jpg,"호반건설이 '2025 한국색채대상'에서 혁신(레드)부문과 공간환경(그린)부문을 동시에 수상하며, 건축 디자인 분야에서의 창의성과 전문성을 다시 한번 입증했다.올해로 23회를 맞은 '한국색채대상'은 산업통상자원부가 후원하고 한국색채학회가 주관하는 국내 유일의 색채 전문 시상식이다. 색채 문화의 발전과 색채 산업의 전문성 제고를 목표로, 우수한 색채 디자인 사례와 연구 성과를 △레드(혁신) △블루(기술) △그린(공간환경) 등 세 부문으로 나눠 시상한다.호반건설은 색채를 단순한 미적 요소를 넘어, 건축·조경·공간 전반의 경험을 확장하는",11-10 16:01,https://www.ebn.co.kr/news/articleView.html?idxno=1686099,EBN
"'규제 무풍지대' 초고가 아파트, 거래·청약 열기 이어져",https://cdn.ebn.co.kr/news/thumbnail/202511/1686090_704062_3437_v150.jpg,"정부의 10.15 부동산대책으로 서울 전역과 경기 12곳이 규제지역으로 지정됐지만, 초고가 아파트 거래와 청약 열기는 여전히 뜨겁다. 고액 자산가를 중심으로 한 탄탄한 수요가 형성돼 대출 규제에도 불구하고 매매와 분양이 꾸준히 이어지고 있다.국토교통부 실거래가 공개시스템에 따르면, 올해 1~10월 서울에서 가장 고가에 거래된 단지는 성동구 성수동 ‘아크로서울포레스트’ 전용 273.928㎡로, 6월 실거래가는 290억원에 달했다. 이어 용산구 한남동 ‘나인원한남’ 전용 273.94㎡(2월 250억원), 강남구 청담동 ‘PH129’ 전",11-10 15:35,https://www.ebn.co.kr/news/articleView.html?idxno=1686090,EBN
"SK렌터카, '2025 Black Driving Festa' 시행",https://cdn.ebn.co.kr/news/thumbnail/202511/1686511_704561_1615_v150.jpg,SK렌터카가 이달 말까지 20일간 ‘2025 Black Driving Festa’를 실시한다고 12일 밝혔다.‘2025 Black Driving Festa’는 SK렌터카의 온라인 다이렉트 채널 ‘SK렌터카 다이렉트’에서 진행하며 연중 최대 할인 혜택을 제공하는 SK렌터카만의 ‘블랙 프라이데이’ 행사이다.이번 행사는 ▲1년 또는 첫 달 렌털료 무료 럭키드로우 ▲8개 인기 차종 렌털료 할인 ▲렌털 상품 약정거리 추가 제공으로 구성됐다.SK렌터카는 ‘2025 Black Driving Festa’ 기간 동안 계약 고객 중 추첨을 통해 1년,11-12 18:17,https://www.ebn.co.kr/news/articleView.html?idxno=1686511,EBN
"한국타이어, 겨울나기 '김장 대봉사' 진행 및 성금 기탁",https://cdn.ebn.co.kr/news/thumbnail/202511/1686466_704512_251_v150.jpg,"한국타이어앤테크놀로지(한국타이어)가 대전시 유성구 엑스포 시민광장에서 진행된 대전시자원봉사연합회 주관 ‘제17차 따뜻한 겨울나기 김장 대봉사’에 참여해 지역사회 소외계층을 위한 나눔 활동을 진행했다고 12일 밝혔다. 한국타이어는 지난 2011년부터 15년째 해당 봉사활동에 참여하고 있다. 이날 대전시자원봉사연합회에 성금 800만원을 기탁하고, 한국타이어 임직원 30여명이 직접 재료 손질부터 담그기까지 김장 전 과정에 참여해 이웃 사랑 실천의 의미를 더했다. 완성된 김치는 대전시자원봉사연합회를 통해 지역 내 소외계층 가정에 전달될 예",11-12 15:03,https://www.ebn.co.kr/news/articleView.html?idxno=1686466,EBN
"KAI, 태국 D&S서 K-방산 역량 과시…동남아 수출 교두보 확대",https://cdn.ebn.co.kr/news/thumbnail/202511/1686464_704511_044_v150.jpg,"한국항공우주산업(KAI)이 유무인 복합체계를 통해 동남아시아 방산시장 공략에 속도를 낸다.KAI는 10일부터 13일까지 태국 방콕에서 열리는 ‘D&S(Defense & Security) 2025’에 참가해 KF-21, FA-50, LAH, KUH 등 주요 항공기 라인업을 선보이고 국산 항공기 수출 확대를 위한 마케팅을 전개했다고 12일 밝혔다.‘D&S’는 2003년부터 격년으로 열리는 아세안 지역 대표 방산 전시회로, 올해는 우리나라를 포함한 35개국 480여 개 업체와 400명 이상의 대표단이 참가했다.KAI는 이번 전시에서 고정",11-12 15:01,https://www.ebn.co.kr/news/articleView.html?idxno=1686464,EBN
"BMW '뉴 X3' 신규 라인업 출시…""마일드 하이브리드 탑재""",https://cdn.ebn.co.kr/news/thumbnail/202511/1686465_704510_5822_v150.jpg,"BMW 코리아가 더욱 강력한 성능과 첨단 사양을 갖춘 ‘BMW 뉴 X3 30 xDrive M 스포츠 패키지 프로’를 출시한다고 12일 밝혔다.BMW X3는 지난 2003년 처음 선보인 모델로 프리미엄 중형 SUV라는 새로운 세그먼트를 개척한 스포츠 액티비티 비히클(SAV)이다. 강렬한 디자인과 역동적인 주행성능을 겸비해 전 세계 시장에서 누적 350만대 판매를 돌파했으며, 국내에서도 지난 2004년 출시 이후 현재까지 5만 대 이상 판매된 베스트셀링 모델이다. 지난해 11월에는 향상된 성능과 디자인의 4세대 모델이 출시됐으며, 올해",11-12 14:59,https://www.ebn.co.kr/news/articleView.html?idxno=1686465,EBN
"기아 노사, '합동 사랑나누기' 기부 캠페인 진행",https://cdn.ebn.co.kr/news/thumbnail/202511/1686460_704505_5051_v150.jpg,기아 노사가 뜻을 모아 우리 사회의 다양한 소외계층을 위한 차량 및 장학금 기부에 나섰다.기아 국내사업본부 노사는 지난 11일 서울 압구정에 위치한 브랜드 체험관인 'Kia360'에서 '2025년 노사 합동 사랑나누기' 기부 캠페인을 실시하고 차량 및 장학금 전달식을 진행했다고 12일 밝혔다.2013년부터 시작돼 올해로 13년째 이어지고 있는 '사랑나누기 캠페인'은 기아 국내사업본부 노사가 마련한 사회공헌 기금을 통해 사회복지 단체에게 차량과 장학금을 지원하는 대표적인 상생 프로그램이다.이날 전달식은 기아 국내사업지원담당 최진기 전,11-12 14:51,https://www.ebn.co.kr/news/articleView.html?idxno=1686460,EBN
"현대차, 신규 먹거리 '로보택시·수소' 사업 추진 잰걸음",https://cdn.ebn.co.kr/news/thumbnail/202511/1686456_704498_4333_v150.jpg,"현대자동차가 신규 먹거리로 낙점한 로보택시와 수소연료전지 사업 추진 속도를 낸다. 향후 백조원 단위 성장이 예상되는 시장을 선점해 글로벌 톱 모빌리티 기업으로 자리를 굳힌다는 방침이다.12일 완성차 업계에 따르면 호세 무뇨스 현대차 사장은 개인 SNS를 통해 웨이모의 6세대 자율주행 기술을 탑재한 현대차 아이오닉 5 로보택시가 실도로 테스트를 시작했다고 알렸다. 호세 무뇨스 사장은 ""아이오닉 5 온로드 테스트 시작은 더 많은 사람에게 안전하고 편리한 자율 주행 모빌리티를 제공하기 위한 전략적 파트너십의 중요한 이정표""라며 ""우리는",11-12 14:46,https://www.ebn.co.kr/news/articleView.html?idxno=1686456,EBN
"대한항공, 진에어·에어부산과 일본 여행사 초청 ‘부산 팸투어’ 실시",https://cdn.ebn.co.kr/news/thumbnail/202511/1686457_704503_4557_v150.jpg,"대한항공이 그룹 내 계열 항공사와 함께 일본 주요 여행사 실무자들을 초청해 부산 관광 자원을 알렸다.대한항공은 진에어, 에어부산과 공동으로 이달 10일부터 12일까지 사흘간 ‘부산 팸투어(FAM tour)’를 진행했다고 12일 밝혔다. 이번 행사는 세 항공사가 운항하는 일본 주요 도시의 여행사 실무자들을 초청해 부산의 관광 인프라를 소개하고 지역 경제 활성화에 기여하기 위해 마련됐다.행사에는 대한항공과 진에어, 에어부산 임직원을 비롯해 도쿄·오사카·후쿠오카 등에서 활동 중인 일본 주요 여행업계 관계자 20여 명이 참석했다. 참가 여",11-12 14:46,https://www.ebn.co.kr/news/articleView.html?idxno=1686457,EBN
"한진, 택배업계 첫 ‘생성형 AI 챗봇’ 도입…고객 소통 혁신",https://cdn.ebn.co.kr/news/thumbnail/202511/1686452_704491_374_v150.jpg,"한진이 택배업계 최초로 생성형 인공지능(AI) 기반 챗봇 서비스를 선보였다.한진은 12일 생성형 AI 모델을 적용한 새로운 AI 챗봇 ‘한지니(HanJini)’를 공개하고, 기존 규칙 기반(Rule-Based) 시스템에서 자연어 대화형 모델로 전면 리뉴얼했다고 밝혔다.‘한지니’는 단순 질의응답을 넘어 고객 문의의 맥락과 의도를 이해해 대화하듯 응대하는 것이 특징이다. 이를 통해 고객의 문의 내용을 실시간으로 분석하고, 상황에 맞는 맞춤형 답변을 제공해 문제 해결 속도를 높였다.이번 개편에는 AWS의 생성형 AI 플랫폼인 ‘아마존 베",11-12 14:38,https://www.ebn.co.kr/news/articleView.html?idxno=1686452,EBN
"아시아나항공, 中 광군절 ‘라이브 커머스’로 중국 공략",https://cdn.ebn.co.kr/news/thumbnail/202511/1686438_704482_2350_v150.jpg,"아시아나항공이 중국 최대 온라인 쇼핑 축제인 ‘광군절’을 맞아 중국인 관광객 유치에 나섰다.아시아나항공은 지난 11일 알리바바 그룹의 온라인 여행 플랫폼 ‘페이주(Fliggy)’에서 열린 ‘VIP 광군절 BOSS 특별 라이브 커머스’에 참여했다고 12일 밝혔다.이날 방송은 중국 최대 쇼핑 플랫폼인 타오바오(Taobao)와 알리페이(Alipay) 등을 통해 송출됐으며, 누적 시청자 50만명을 기록했다.방송에는 아시아나항공 주재형 상하이지점장이 직접 출연해 항공권 프로모션을 소개하고, 한국 주요 관광지와 최신 기재를 소개했다. 또 아시",11-12 14:24,https://www.ebn.co.kr/news/articleView.html?idxno=1686438,EBN
"국내 항공사, 부산발 노선 확대 적중…김해공항 여객 12.7%↑",https://cdn.ebn.co.kr/news/thumbnail/202511/1686410_704443_77_v150.jpg,"국내 항공사들의 부산발 국제선 확대 전략이 김해공항 여객 증가로 직결되고 있다. 일본과 동남아 지역을 중심으로 여행 수요가 집중되며 지방공항 가운데 가장 뚜렷한 증가세를 나타냈다.12일 항공정보포털시스템에 따르면 올해 10월 김해공항 여객은 154만6715명으로 전년 동기 대비 12.7% 증가했다. 전월 대비 증가율도 13.0% 수준이며, 월간 여객 100만명 이상 공항 중 전년 대비 증가율이 가장 높았다.단거리 국제선 수요가 회복세를 이끌었다. 국가별 노선 여객은 일본이 35만9174명으로 가장 많았고, 베트남 19만5083명,",11-12 13:51,https://www.ebn.co.kr/news/articleView.html?idxno=1686410,EBN
"지성원 현대차 전무, 대한민국디자인대상 디자인공로 부문 ‘대통령상 표창’ 수상",https://cdn.ebn.co.kr/news/thumbnail/202511/1686419_704460_4722_v150.jpg,"현대자동차 지성원 전무가 제27회 대한민국디자인대상에서 대통령 표창을 받았다.현대자동차는 12일 서울 강남구에 위치한 코엑스 그랜드컨퍼런스룸에서 열린 제27회 대한민국디자인대상 시상식에서 브랜드마케팅본부장 지성원 전무가 디자인공로 부문 대통령 표창을 수상했다고 밝혔다.산업통상자원부가 주최하고 한국디자인진흥원이 주관하는 대한민국디자인대상은 차별화된 디자인 경영을 통해 대한민국의 디자인산업 경쟁력을 제고하고, 디자인 개발·관리·육성으로 국가경제발전에 기여한 우수기업, 지자체, 유공자 등에 대하여 수여하는 정부 포상이다.심사위원단은 지성",11-12 13:47,https://www.ebn.co.kr/news/articleView.html?idxno=1686419,EBN
"현대오토에버, 고객경험 설계·검증 공간 ‘이노엑스 스튜디오’ 개관",https://cdn.ebn.co.kr/news/thumbnail/202511/1686327_704341_4852_v150.jpg,"현대오토에버는 ‘이노엑스 스튜디오(InnoX Studio)’를 최근 개관했다고 12일 밝혔다.이노엑스 스튜디오는 고객경험을 직접 설계하고 검증하며, 신사업 기회도 발굴하는 공간이다. 고객경험은 제품과 서비스의 본원적 가치로 자리 잡으며, 중요성이 지속적으로 커지고 있다.공간은 △디지털 전시 △피드백 △워크숍 등 세 개 구역(존)으로 구분된다. ‘디지털 전시’에서 고객사는 현대오토에버의 최신 모빌리티 기술을 직접 체험할 수 있다. ‘피드백’에서 현대오토에버는 고객사와 함께 기술의 효용성을 검증하며, 사업적 가치를 검토한다. ‘워크숍’",11-12 07:49,https://www.ebn.co.kr/news/articleView.html?idxno=1686327,EBN
"자동차 업계 ""2035 NDC, 과도한 설정…하이브리드 병행해 감축 추진해야""",https://cdn.ebn.co.kr/news/thumbnail/202511/1686287_704299_3337_v150.jpg,자동차 업계가 2035 국가온실가스감축목표(NDC)을 달성하려면 하이브리드와 같은 친환경 파워트레인(동력 전달 방식) 병행이 필요하다고 호소했다. 이와 함께 무공해차 수요 창출을 위한 강력한 인센티브 정책이 필요하다고 강조했다.11일 한국자동차모빌리티산업협회(KAMA)는 '2035 NDC에 대한 자동차산업계 입장문'을 통해 이같이 밝혔다.업계는 정부에서 확정 발표한 NDC가 그간 업계가 제기했던 급격한 전환으로 인한 문제점이 명확히 해소되지 않은 채 목표가 설정된 점에 대해 우려를 나타냈다.이에 업계는 정부가 향후 이행과정에서 급격,11-11 16:35,https://www.ebn.co.kr/news/articleView.html?idxno=1686287,EBN
"금호타이어, 2025 현대N페스티벌 eN1클래스 '3관왕' 달성",https://cdn.ebn.co.kr/news/thumbnail/202511/1686276_704288_344_v150.jpg,"금호타이어는 자사가 후원하고, 신영학 감독이 이끄는 금호 SL모터스포츠팀이 지난 8일~9일 경기도 용인 에버랜드 스피드웨이에서 펼쳐진 2025 현대N페스티벌 eN1 클래스에서 드라이버, 팀, 타이어 제조사 통합 챔피언 타이틀을 차지했다고 11일 밝혔다.이날 금호 SL모터스포츠팀 이창욱 선수는 5라운드 결승에서 치열한 순위 다툼 끝에 2위로 결승선을 통과, 누적 포인트 223점으로 종합 우승의 영예를 안았다. 특히 올 시즌 6차례 레이스 중 3승을 거두며 독보적인 경기력을 과시해온 이창욱 선수는 생애 첫 'eN1' 드라이버 챔피언에",11-11 16:04,https://www.ebn.co.kr/news/articleView.html?idxno=1686276,EBN
"포르쉐, 카이엔 일렉트릭 전 세계 최초 공개 '예고'",https://cdn.ebn.co.kr/news/thumbnail/202511/1686275_704287_5548_v150.jpg,"포르쉐 AG가 오는 11월 19일 오후 11시(한국시간 기준) 자사의 두 번째 순수 전기 SUV 카이엔 일렉트릭을 디지털 생중계를 통해 월드 프리미어로 공개한다고 11일 밝혔다.20여 년 전 포르쉐는 카이엔과 함께 스포츠카 브랜드의 정체성을 새로운 세그먼트로 확장하는 데 성공했다. 지난 2002년 이후 카이엔은 퍼포먼스 및 다재다능함, 그리고 일상적인 실용성을 완벽히 결합한 럭셔리 SUV로 자리매김했다. 이제 포르쉐는 뛰어난 주행 성능, 탁월한 장거리 주행 편의성, 타협 없는 오프로드 성능, e-최신 모빌리티의 효율성을 두루 갖춘",11-11 15:57,https://www.ebn.co.kr/news/articleView.html?idxno=1686275,EBN
"에어부산, KS-SQI 'LCC 부문' 9년 연속 1위",https://cdn.ebn.co.kr/news/thumbnail/202511/1686254_704256_335_v150.jpg,에어부산이 국내 저비용항공사(LCC) 시장에서 서비스 경쟁력을 증명했다.에어부산은 11일 서울 롯데호텔에서 열린 한국표준협회 주관 2025년 ‘한국서비스품질지수(KS-SQI) 인증 수여식에서 LCC 부문 9년 연속 1위에 올랐다고 밝혔다.이번 평가에서 에어부산은 서비스 품질 평가를 구성하는 8개의 평가 항목 모두 업계 최고점을 기록하며 종합 1위의 영예를 안았다.올해 창립 18주년을 맞이한 에어부산은 완벽한 안전·편리한 서비스·실용적인 가격을 핵심 가치로 항공 본연의 서비스에 집중하며 경쟁력 강화에 힘써왔다. 지난 5월 국토교통부가,11-11 15:06,https://www.ebn.co.kr/news/articleView.html?idxno=1686254,EBN
"LIG넥스원, 태국 한국전 참전용사협회 방문…참전 용사에 감사 전해",https://cdn.ebn.co.kr/news/thumbnail/202511/1686241_704240_1810_v150.jpg,"LIG넥스원이 태국 방콕에서 열린 ‘D&S(Defense & Security) 2025’ 전시회 기간 중 태국 한국전 참전용사협회를 방문해 감사 인사를 전했다.LIG넥스원은 10일(현지시간) 구본상 LIG 회장을 비롯한 LIG넥스원 관계자들은 태국군 한국전 참전용사들을 찾아 기념품을 전달하고 한국전쟁 당시 희생과 헌신을 기렸다고 밝혔다.태국군은 한국전쟁에 6326명을 파병했으며, 이 중 136명이 전사하고 1200여 명이 부상을 입는 등 큰 희생을 치른 바 있다. 지난해 11월에는 태국 파병군 의무대 소속으로 한국전에 참전했던 롯",11-11 14:18,https://www.ebn.co.kr/news/articleView.html?idxno=1686241,EBN
"CJ대한통운, ‘매일오네’ 효과에 본업 성장…4Q 기대감↑",https://cdn.ebn.co.kr/news/thumbnail/202511/1686228_704225_523_v150.jpg,"CJ대한통운이 택배 물동량 증가와 원가 효율 개선 효과로 준수한 실적을 거둔 가운데 연말 성수기에 따른 4분기 실적 기대감이 커지고 있다.11일 CJ대한통운에 따르면 올해 3분기 매출액은 3조666억원, 영업이익은 1479억원으로 집계됐다. 이는 전년 동기 대비 각각 매출액 3.1%, 영업이익 4.4% 증가한 수치다.특히 신영수 CJ대한통운 대표가 주요 전략으로 내세운 주7일 배송인 ‘매일 오네’의 성과가 눈에 띈다. 3분기 택배 부문 매출은 9650억원으로 7.4% 증가했고 영업이익은 628억원으로 16.6% 늘었다. 주7일 배송",11-11 13:52,https://www.ebn.co.kr/news/articleView.html?idxno=1686228,EBN
"진에어, 누적 탑승객 1억명 돌파…'항공 여행 대중화' 이끌어",https://cdn.ebn.co.kr/news/thumbnail/202511/1686234_704229_3554_v150.jpg,"진에어가 2008년 김포~제주 노선 취항 이후 약 17년 4개월 만에 누적 탑승객 1억명을 돌파했다.진에어는 국토교통부 항공정보포털시스템 통계 등을 기반으로 올해 10월까지 누적 탑승객이 약 9994만명을 기록했으며, 11월 초 자체 집계 결과 총 1억명을 넘어섰다고 11일 밝혔다. 누적 탑승객 가운데 국내선이 약 5610만명, 국제선이 약 4390만명으로 나타났다.2008년 김포~제주, 2009년 인천~방콕 노선 운항을 시작한 진에어는 안전 운항 체계 강화, 비용 구조 효율화, 노선 확장 전략을 병행해 고객층을 꾸준히 확보해 왔다",11-11 13:37,https://www.ebn.co.kr/news/articleView.html?idxno=1686234,EBN
"대한항공, KS-SQI·NCSI ‘항공사 부문 1위’…서비스 품질 2관왕",https://cdn.ebn.co.kr/news/thumbnail/202511/1686232_704228_2537_v150.jpg,대한항공이 올해 한국서비스품질지수(KS-SQI)와 국가고객만족도(NCSI) 조사에서 항공사 부문 1위를 차지하며 서비스 품질 경쟁력을 입증했다.대한항공은 11일 서울 중구 롯데호텔 서울에서 열린 한국표준협회 주관 ‘2025 KS-SQI’ 인증 수여식에서 항공사 부문 4년 연속 1위를 차지했다고 밝혔다.KS-SQI는 한국표준협회와 서울대학교 경영연구소가 공동 개발한 서비스 품질 평가모델이다. 국내 서비스기업의 제품 또는 서비스를 경험한 고객을 대상으로 서비스품질에 대한 만족 정도를 나타내는 종합 지표다. 대한항공은 정확성·전문성·진정,11-11 13:26,https://www.ebn.co.kr/news/articleView.html?idxno=1686232,EBN
"'수의계약만 반복'… 방사청, 경쟁입찰·상생안 검토 의지 있나",https://cdn.ebn.co.kr/news/thumbnail/202511/1686478_704527_346_v150.jpg,"한국형 차기 이지스 구축함(KDDX) 사업이 또다시 표류하고 있다. 방위사업청이 수의계약만 고집하면서 사업 지연이 불가피해서다. 업계 안팎에선 KDDX 사업에 대한 신뢰 저하가 우려되는 상황에도 불구하고 기존 관행에만 기댄 방사청 태도에 불만의 목소리가 나온다. 13일 관련업계에 따르면 방위사업청은 오는 14일 열릴 방위사업기획·관리분과위원회에 상정할 안건으로 또다시 ‘수의계약’ 방안만을 제출할 것으로 확인됐다.지난 3월, 4월, 8월, 9월 분과위에서 연이어 수의계약 추진안이 부결된 데 이어, 11월 사전설명회에서도 동일한 안건이",11-13 06:00,https://www.ebn.co.kr/news/articleView.html?idxno=1686478,EBN
