title,thumbnail,short_content,write_time,link,company
"[특징주] 우진, 국내 유일 원전 계측기 공급사…李대통령 원전 필요 발언에 상승세",https://img.etoday.co.kr/crop/200/125/2283975.jpg,"우진이 이재명 대통령이 원자력 발전을 필요로 한다는 국민 여론 의견을 최대한 수렴하겠다는 발언 소식에 상승세다. 원전 산업 추진에 따른 수혜 기대감이 반영된 것으로 해석된다. 20일 오후 2시 56분 현재 우진은 전일 대비 2900원(13.03%) 오른 2만5150원에 거래됐다. 앞서 이재명 대통령은 신규 원자력발전소 건설 및 소형모듈원자로(SMR) 도입 계획과 관련해 ""충분히 의견을 수렴하고, 난타전을 하더라도 따로 헤어져 싸우지 말고 모여서 논쟁하게 해달라""라고 주문했다. 이 대통령은 이날 오전 청와대 본관에서 열린 제2회 국",2026-01-20 14:58,https://www.etoday.co.kr/news/view/2547422?trc=main_list_news,이투데이
"국토부, 주택ㆍ교통 정책 설계에 2030 청년 목소리 담는다",https://img.etoday.co.kr/crop/200/125/2284229.jpg,"주택과 교통 등 일상과 밀접한 국토교통 정책에 청년이 정책 수혜자를 넘어 직접 참여할 수 있는 기회가 마련된다. 국토교통부는 21일부터 31일까지 제4기 ‘2030 자문단’과 ‘청년온라인패널’을 모집한다고 21일 밝혔다. 두 제도는 청년의 정책 참여를 확대하고, 현장 경험을 바탕으로 정책 개선 방안을 발굴하기 위한 국토부의 대표적인 청년 소통 채널이다. 2030 자문단과 청년온라인패널은 2022년 도입 이후 전세보증금 반환보증 보증료 지원사업, 드론 활성화 정책, 든든전세 등 주요 정책의 설계·홍보 과정에 청년 의견을 반영해 왔다",2026-01-21 06:00,https://www.etoday.co.kr/news/view/2547499?trc=main_list_news,이투데이
"“오늘도 안전하게 퇴근합시다”⋯반도건설 현장의 아침 [산재 공화국, 시스템의 부재 下-②]",https://img.etoday.co.kr/crop/200/125/2283620.jpg,"안전의 언어가 더 이상 현장에서 통하지 않는다. 대통령은 매일 산업재해 발생 여부를 묻지만 사고는 멈추지 않고 있다. 수많은 대책과 제도 마련에도 불구, ‘죽음의 곡선’이 좀처럼 꺾이지 않는 것이다. 한국의 산재 사망률은 경제협력개발기구(OECD)의 평균의 세 배, 영국의 열세 배에 달한다. 사고는 줄지 않고 이동했다. 대기업에서 빠져나간 위험은 하청과 재하청, 영세사업장, 통계에 잡히지 않는 비정형 노동으로 옮겨갔다. 정부의 공식 지표가 말하지 않는 ‘숫자 밖의 죽음들’이 늘고 있다. 문제는 시스템이다. 위험은 사전에 관리되지",2026-01-21 05:00,https://www.etoday.co.kr/news/view/2547040?trc=main_list_news,이투데이
올해 서울 첫 분양 '드파인 연희' 1순위 6655명 몰려…청약률 44대 1,https://img.etoday.co.kr/crop/200/125/2284317.jpg,"올해 첫 서울 아파트 분양 단지인 서울 서대문구 연희동 '드파인 연희'(연희1구역 재개발) 1순위 청약이 두 자릿수 경쟁률을 기록했다. 20일 연합뉴스에 따르면 한국부동산원 청약홈에 게시된 드파인 연희 1순위 청약은 151가구 모집에 6655명이 신청해 44.1대 1의 평균 경쟁률로 모든 주택형이 마감됐다. 주택형별로 59㎡A형의 경쟁률이 66.2대 1로 가장 높았다. 이어 84㎡A형(55.6대 1), 59㎡B형(44.9대 1), 84㎡B형(35.7대 1), 115㎡B형(34.0대 1), 74㎡C형(33.0대 1) 등의 순이었다.",2026-01-20 21:20,https://www.etoday.co.kr/news/view/2547577?trc=main_list_news,이투데이
"인천공항공사 인사 개입 논란에…국토부 ""사실 아냐""",https://img.etoday.co.kr/crop/200/125/2284268.jpg,국토교통부는 인천국제공항공사 인사에 불법적으로 개입했다는 주장에 대해 “사실이 아니다”라고 반박했다. 국토부는 20일 설명자료를 통해 “공사 경영진 공백 가능성 등을 고려해 일부 임원의 퇴임 인사안에 대해 신중한 접근이 필요하다는 의견을 전달한 것”이라며 “불법적인 인사 개입은 없었다”고 밝혔다. 인천국제공항공사의 정기 인사는 2026년 1월 1일 자로 시행된 바 있다고 덧붙였다. 인천국제공항공사의 주차대행 서비스 개편과 관련해 진행 중인 특정감사에 대해서도 “공항 이용객 불편 우려와 개편 추진 과정에서의 문제점이 다수 언론 등을,2026-01-20 17:26,https://www.etoday.co.kr/news/view/2547531?trc=main_list_news,이투데이
"우미에스테이트, 김정훈 신임 대표 취임",https://img.etoday.co.kr/crop/200/125/2284262.jpg,우미건설은 우미그룹 자산관리 전문 기업 우미에스테이트의 새 대표에 김정훈 전 우미건설 상무가 선임됐다고 20일 밝혔다. 김 신임대표는 한양대학교 건축공학과를 졸업한 뒤 대림산업(현 DL이앤씨)에서 건축개발사업팀장 등을 역임했다. 2018년 우미건설에 합류한 이후에는 부동산 개발사업과 수주·영업 분야에서 전문성을 발휘하며 경영 능력을 인정받았다. 김 대표는 우미에스테이트를 부동산 생애주기의 전 과정을 책임지는 종합 부동산 운영 기업으로 성장시키겠다고 밝혔다. 김 대표는 “마곡 시대를 맞아 뉴브 클라우드 힐스라는 최적의 업무 환경에서,2026-01-20 17:20,https://www.etoday.co.kr/news/view/2547526?trc=main_list_news,이투데이
"코레일, ‘APEC 정상회의’ 지원 공로…대통령 표창",https://img.etoday.co.kr/crop/200/125/2284168.jpg,"한국철도공사(코레일)가 지난해 APEC 정상회의 개최 지원의 공로를 인정받아 대통령 표창을 수상했다고 20일 밝혔다. 이번 표창은 국가 행사인 APEC 정상회의의 성공적 개최에 기여한 기관의 공로를 기리기 위한 것으로 코레일은 철도 수송 지원 확대와 철저한 안전관리에 기여한 점을 인정받았다. 코레일은 행사기간 경주역에 KTX를 360회 운행해 방문객 이동을 지원하고 24시간 비상대응체계를 가동해 안전관리에 역량을 집중했다. 또한 칠레 대통령과 싱가포르 총리, 멕시코·호주 장관 등 정상급 외빈과 취재진 수송도 지원했다. 그 결과 행",2026-01-20 15:49,https://www.etoday.co.kr/news/view/2547462?trc=main_list_news,이투데이
"중흥그룹, ‘사랑의 헌혈 캠페인’ 진행",https://img.etoday.co.kr/crop/200/125/2284165.jpg,중흥그룹은 19일 중흥건설 본사 앞에서 임직원이 참여하는 헌혈 캠페인을 진행했다고 20일 밝혔다. 이번 캠페인은 동절기 혈액 수급난 완화를 위해 중흥건설과 중흥토건 등 계열사 임직원들의 자발적인 참여로 이뤄졌다. 중흥그룹은 2022년 대한적십자사 광주전남혈액원과 헌혈 캠페인을 연 2회 이상 정기적으로 실시하고 긴급 수급 상황 발생 시에도 협력하기로 하는 업무협약을 체결한 바 있다. 이후 그룹 계열사 임직원들이 정기 캠페인에 참여하고 있다. 이번 헌혈은 방문 헌혈 방식으로 진행됐으며 혈액 수급이 특히 어려운 겨울철을 고려해 추진됐다,2026-01-20 15:44,https://www.etoday.co.kr/news/view/2547457?trc=main_list_news,이투데이
"서울시, 올해 주택 공급 속도 높이고 ‘강북 전성시대’ 집중 나선다",https://img.etoday.co.kr/crop/200/125/2275014.jpg,"서울시, 20일부터 2026 신년업무보고 돌입 ‘신통기획’ 본격 가동·공공기여 강북 집중투자 서울시가 20일부터 ‘2026년 신년업무보고’에 돌입한다. 서울시는 올해 핵심 화두로 ‘주택 공급’과 ‘다시, 강북전성시대’ 추진 동력 확보를 전면에 세웠다. 올해 서울시 신년업무보고는 29개 실국이 순차적으로 진행한다. 각 실국장이 소관 업무를 보고한 뒤 시장과 부시장단 등 핵심 간부들이 토론·강평을 통해 정책 방향과 속도, 보완 과제를 점검하는 방식으로 운영한다. 서울시는 이번 보고가 사업 설명을 넘어 정책 완성도와 실행력을 ‘핀셋 점",2026-01-20 15:00,https://www.etoday.co.kr/news/view/2547209?trc=main_list_news,이투데이
서울 평균 11% 오를 때 '대장아파트' 26% 뛰었다,https://img.etoday.co.kr/crop/200/125/2265962.jpg,지난해 서울 집값이 19년 만에 최고 상승률을 기록한 가운데 일명 ‘대장 아파트’ 오름세를 견인한 것으로 나타났다. 20일 KB부동산의 ‘선도아파트 50지수’에 따르면 선도 50개 단지의 매매가격지수는 지난해 12월 기준 132.1을 기록해 직전 년도(104)보다 28.1포인트 급등했다. 1년 만에 27% 오른 것이다. KB선도아파트 50지수는 전국 시가총액 상위 50개 단지의 아파트를 선정해 시가총액 변동률을 지수화한 수치다. 전국의 고가 ‘대장 아파트’ 단지에 대한 가격 변동을 살펴볼 수 있는 참고 자료다. 서울 아파트 전체,2026-01-20 14:57,https://www.etoday.co.kr/news/view/2547405?trc=main_list_news,이투데이
"GS건설, 분양·계약·입주 한 번에…‘My 자이’ 서비스 출시",https://img.etoday.co.kr/crop/200/125/2284076.jpg,"GS건설이 분양부터 계약, 입주까지 주택 구매 전 과정을 온라인으로 통합 관리할 수 있는 계약고객 통합서비스 플랫폼 ‘마이(My) 자이’를 20일 선보였다. ‘마이 자이’는 자이 아파트 계약 고객을 위한 온라인 전용 서비스로, 계약부터 잔금 완납까지의 절차를 하나의 화면에서 관리할 수 있는 통합 플랫폼이다. 계약 내용 변경·정정은 물론 중도금과 잔금 납부, 환불 신청, 소유권 이전 등기 관련 서류 접수까지 온라인으로 직접 처리할 수 있어 전화 문의나 현장 방문이 필요 없다. 마이 자이는 복잡한 분양 대금 정산 구조를 고객 관점에서",2026-01-20 13:50,https://www.etoday.co.kr/news/view/2547369?trc=main_list_news,이투데이
전월세 부담 늘자…서울 아파트 준월세 비중 55%로 확대,https://img.etoday.co.kr/crop/200/125/2283988.jpg,"전세 매물이 줄어드는 가운데 가격이 오르면서 전세 보증금 일부를 월세로 전환하는 사례가 늘어나고 있다. 임대인은 수익성 확보와 세 부담 완화, 임차인은 전·월세 부담을 동시에 조정하려는 선택이 맞물린 결과로 해석된다. 20일 부동산R114가 국토부 실거래가 자료를 분석한 결과 서울 아파트 임대차 계약 중 준월세 비중은 △2022년 51% △2023년 54% △2024년 54% △2025년 55%로 매년 확대됐다. 반면 전세 보증금은 월세의 240배보다 높아 전세 성격이 강한 준전세는 △2023년 42% △2024년 41% △202",2026-01-20 11:36,https://www.etoday.co.kr/news/view/2547324?trc=main_list_news,이투데이
경기 집값 상단 끌어올린 과천·분당…과천은 평당 1억 돌파,https://img.etoday.co.kr/crop/200/125/2283970.jpg,"최근 경기도 아파트 시장에서는 과천시와 성남시 분당구가 고가 거래를 이끌고 있는 것으로 나타났다. 이들 지역에서는 3.3㎡(1평)당 가격이 1억원을 넘어서는 계약도 잇따르고 있다. 20일 부동산 정보 애플리케이션 집품이 지난해 12월부터 이달 19일까지 경기도 아파트 매매 거래를 분석한 결과 최고가 상위 10건이 모두 성남시 분당구와 과천시에서 발생한 것으로 집계됐다. 분당구에서는 수내동과 정자동이, 과천시에서는 별양동과 원문동 소재 단지가 상위권에 포함됐다. 총매매가 기준 최고가 거래는 성남시 분당구 수내동에 위치한 ‘양지1단지",2026-01-20 11:09,https://www.etoday.co.kr/news/view/2547311?trc=main_list_news,이투데이
"국토부, K-패스 발급 카드사 확대…전북은행·토스뱅크 등 7곳 추가",https://img.etoday.co.kr/crop/200/125/2196042.jpg,대중교통비 환급 제도인 ‘모두의 카드(K-패스)’를 앞으로 더 다양한 금융사에서 발급받을 수 있게 된다. 주관 카드사가 늘어나면서 이용자는 소비·생활 패턴에 맞춰 카드사별 혜택을 선택할 수 있는 폭이 확대됐다. 국토교통부 대도시권광역교통위원회(대광위)는 K-패스 주관 카드사 7곳(전북은행·신협·경남은행·새마을금고·제주은행·토스뱅크·티머니)을 추가 선정했다고 20일 밝혔다. 이 가운데 토스뱅크를 제외한 6개 금융사의 K-패스 카드 발급은 다음 달 2일부터 가능하다. 대광위는 토스뱅크와 함께 ‘카드 발급부터 K-패스 회원가입·등록까지,2026-01-20 11:00,https://www.etoday.co.kr/news/view/2547261?trc=main_list_news,이투데이
서울 156대 1 vs 전국 6.93대 1⋯아파트 청약도 양극화,https://img.etoday.co.kr/crop/200/125/2283923.jpg,"작년 12월 전국 아파트 청약 경쟁률이 한 자릿수 성적을 이어간 가운데 서울 경쟁률은 150대 1을 웃돌며 '서울 독주'로 나타났다. 20일 분양평가 전문회사 리얼하우스가 청약홈 자료를 분석한 결과, 2025년 12월 전국 1순위 평균 청약 경쟁률은 6.93대 1(12개월 이동평균값)로 집계됐다. 전국 평균 경쟁률은 5월 14.8대 1로 정점을 찍은 뒤 하락세로 돌아서며 6개월 연속 한 자릿수에 머물렀다. 지난해 연간 기준 전국 청약 경쟁률은 전년(12.54) 대비 40% 이상 낮았다. 반면 서울은 정반대 흐름으로 나타났다. 지난",2026-01-20 10:32,https://www.etoday.co.kr/news/view/2547286?trc=main_list_news,이투데이
"인천공항, 신년 인사회 개최…""안전 최우선·AI 전환”",https://img.etoday.co.kr/crop/200/125/2283891.jpg,"인천국제공항공사는 19일 인천공항 제2여객터미널 교통센터에서 ‘2026년 인천공항 신년 인사회’를 개최했다고 20일 밝혔다. 이날 행사에는 이학재 인천국제공항공사 사장을 비롯해 서울지방항공청, 인천공항출입국외국인청 관계자와 항공사, 상업시설, 물류업체 대표 등 공항 상주기관 관계자 약 200명이 참석했다. 신년 인사회는 공항 상주기관과 종사자들이 한자리에 모여 지난해 운영 성과를 돌아보고 올해 인천공항 운영 방향과 주요 계획을 공유하기 위해 마련됐다. 행사는 축하 공연을 시작으로 신년 인사와 새해 기념 행사 순으로 진행됐다. 참석",2026-01-20 10:09,https://www.etoday.co.kr/news/view/2547265?trc=main_list_news,이투데이
"현대건설, 탑솔라와 국내 최대 1.5GW 재생에너지 공급 협력",https://img.etoday.co.kr/crop/200/125/2283889.jpg,"현대건설이 태양광 전문기업 탑솔라와 대규모 재생에너지 전력공급 협력에 나선다. 현대건설은 광주광역시 북구 탑솔라 본사에서 재생에너지 전력공급 협약을 체결했다고 20일 밝혔다. 전날 진행한 확약식에는 백상현 현대건설 인프라투자개발실장과 오형석 탑솔라그룹 회장 등 양사 관계자들이 참석했다. 이번 협약에 따라 현대건설은 탑솔라가 추진하거나 시공에 참여하는 태양광 발전사업의 전력을 2028년 말까지 순차적으로 공급받는 전력거래계약(PPA)을 체결할 예정이다. 탑솔라가 공급하는 태양광 전력의 총 설비용량은 1.5GW로, 대형 원전 1기 발",2026-01-20 10:08,https://www.etoday.co.kr/news/view/2547266?trc=main_list_news,이투데이
[아파트값 상승 톱10] 서울 동대문구 ‘롯데캐슬피렌체’ 등,https://img.etoday.co.kr/crop/200/125/2283759.jpg,부동산 플랫폼 호갱노노에 따르면 19일 신고 기준 전국 아파트 가운데 실거래가 상승 폭이 가장 컸던 단지는 서울 동대문구 ‘롯데캐슬피렌체’로 나타났다. 이 단지는 12억3000만 원에 거래되며 직전 거래 대비 1억3000만 원(11%) 상승했다. 2위는 경기 고양시 ‘문촌마을16단지뉴삼익’으로 4억 원에 실거래되며 3900만 원(10%) 올랐다. 3위는 용인시 ‘용인역북우미린센트럴파크’로 5억4000만 원에 거래되며 2500만 원(4%) 상승한 것으로 집계됐다. 이어 경기 용인시 ‘역북명지대역동원로얄듀크’가 4억9500만 원에 거,2026-01-20 08:30,https://www.etoday.co.kr/news/view/2547131?trc=main_list_news,이투데이
[오늘의 청약 일정] ‘드파인 연희’ 1순위 청약 접수 등,https://img.etoday.co.kr/crop/200/125/2283584.jpg,"부동산 정보업체 부동산R114에 따르면 20일 오늘은 서울 서대문구 '드파인연희', 경기 김포시 '사우역지엔하임' 단지에서 1순위 청약 접수를 실시한다. 또 경기 성남시 '더샵분당센트로'와 경남 양산시 '힐스테이트물금센트럴' 단지에서는 당첨자를 발표하며, 이날부터 22일까지 인천 중구 '영종국제도시신일비아프크레스트(1·단지)A19·20' 단지는 정당계약을 진행한다. 아울러 한국부동산원 청약홈에 따르면 이날 경기 오산시 '북오산자이리버블시티' 단지는 특별공급 청약 접수를 실시한다.",2026-01-20 07:00,https://www.etoday.co.kr/news/view/2547029?trc=main_list_news,이투데이
“‘강남 집값 강박’ 떨치고 수요 분산ㆍ공급 유도해야” [강남 집값 안 잡나 못 잡나 ③],https://img.etoday.co.kr/crop/200/125/2283695.jpg,"전문가들은 이제 ‘강남 집값 잡기’라는 정책적 강박에서 벗어날 필요가 있다고 입을 모은다. 강남 집값을 직접 억누르기보다, 수요 분산과 공급 유도를 병행하는 방향으로 정책의 무게중심을 옮겨야 한다는 지적이다. 19일 본지 자문위원인 임미화 전주대 부동산국토정보학과 교수는 “강남 집값은 이미 대출로 움직이는 시장이 아니다”라며 “오히려 대출을 과도하게 조이기보다 자산은 부족하지만 향후 현금 흐름 창출 능력이 있는 계층이 주거 사다리를 탈 수 있도록 진입로를 열어줄 필요가 있다”고 말했다. 이어 “가격은 모든 경제 활동의 결과물인데",2026-01-20 06:00,https://www.etoday.co.kr/news/view/2546994?trc=main_list_news,이투데이
"""백약이 무효… 규제가 성벽 쌓았다"" [강남 집값 안잡나 못잡나 ②]",https://img.etoday.co.kr/crop/200/125/2283694.jpg,“정부가 안 잡는 게 아니라 구조적으로 못 잡는 단계에 진입했다“ 부동산 전문가들의 공통된 견해다. 규제가 반복될수록 강남은 오히려 '안전자산'이란 믿음만 두터워졌고 사실상 무너뜨리기 어려운 단단한 성을 쌓은 것과 마찬가지란 것이다. 이번 정부를 포함해 역대 정부는 줄곧 강남 집값을 잡겠다고 공언해 왔다. 하지만 결과는 번번이 실패였다. 가격을 강하게 누를수록 중장기적으로 더 큰 반등이 나타나는 패턴이 계속됐다. 19일 부동산 업계에 따르면 서울 강남 지역은 현재 투기과열지구와 토지거래허가구역으로 묶여 있는 데다 재건축초과이익환수,2026-01-20 06:00,https://www.etoday.co.kr/news/view/2546965?trc=main_list_news,이투데이
평당 1억 원·연일 신고가…규제에도 ‘강남 불패’ [강남 집값 안잡나 못잡나 ①],https://img.etoday.co.kr/crop/200/125/2283693.jpg,"이재명 정부가 출범 초기부터 부동산 규제를 잇달아 내놓으며 집값 억제 의지를 내비쳤지만 서울 강남권 아파트 가격은 오히려 고점을 갈아치우며 독주를 이어가고 있다. 규제가 반복될수록 가격 상승세가 더 뚜렷해지는 양상이다. 최근에는 정부가 강남 집값 상승 억제 신호마저 내놓지 않으면서 강남 집값 잡기에 손을 놓은 것 아니냐는 평가마저 나온다. 19일 한국부동산원이 발표한 ‘전국주택가격동향조사’에 따르면 지난해 연간 서울 강남 3구 아파트 매매가격 상승률은 15~20%대를 기록하며 서울 평균을 크게 웃돌았다. 강남구는 14.67%, 서",2026-01-20 06:00,https://www.etoday.co.kr/news/view/2546935?trc=main_list_news,이투데이
10·15 대책 이후 서울 거래 ‘중저가 쏠림’…15억 이하 거래 비중 확대,https://img.etoday.co.kr/crop/200/125/2283697.jpg,정부의 10·15 대책 이후 서울 아파트 거래의 무게중심이 '15억 원 이하' 아파트로 이동하는 흐름이 뚜렷해졌다. 고가 주택을 겨냥한 금융 규제가 강화되면서 상대적으로 대출 문턱이 낮은 중저가 아파트로 수요가 몰린 것으로 풀이된다. 19일 국토교통부 실거래가 공개시스템에 따르면 지난해 12월 서울 아파트 전체 거래 4422건 가운데 15억 원 이하 아파트 거래는 3649건으로 집계됐다. 비중으로 보면 전체의 82.5%가 15억 원 이하다. 올해 1월 역시 아직 집계가 진행 중이지만 공개된 거래 기준으로 전체 756건 가운데 61,2026-01-20 06:00,https://www.etoday.co.kr/news/view/2546916?trc=main_list_news,이투데이
"정부·기업, '단속→예측' 산업안전 DNA 바꾼다 [산재 공화국, 시스템의 부재 中-③]",https://img.etoday.co.kr/crop/200/125/2275078.jpg,"고용부 '근로감독 행정 혁신 방안' 발표 근로감독 물량 3배↑⋯지자체 권한 위임 안전의 언어가 더 이상 현장에서 통하지 않는다. 대통령은 매일 산업재해 발생 여부를 묻지만 사고는 멈추지 않고 있다. 수많은 대책과 제도 마련에도 불구, ‘죽음의 곡선’이 좀처럼 꺾이지 않는 것이다. 한국의 산재 사망률은 경제협력개발기구(OECD)의 평균의 세 배, 영국의 열세 배에 달한다. 사고는 줄지 않고 이동했다. 대기업에서 빠져나간 위험은 하청과 재하청, 영세사업장, 통계에 잡히지 않는 비정형 노동으로 옮겨갔다. 정부의 공식 지표가 말하지 않는",2026-01-20 05:00,https://www.etoday.co.kr/news/view/2543734?trc=main_list_news,이투데이
"서울시, 또다시 국가유산청에 유감 표명…""공동 실측 응해야""",https://img.etoday.co.kr/crop/200/125/2278996.jpg,세운 4구역 재개발 사업을 둘러싼 경관 훼손 논란과 관련해 서울시가 19일 국가유산청을 향해 다시 한번 공개 비판에 나섰다. 7일 종묘 정전 상월대 촬영 불허에 대해 유감을 표명한 데 이어 이번에는 객관적 검증을 위한 공동 실측 제안마저 거부하고 있다며 문제를 제기했다. 이민경 서울시 대변인은 이날 입장문을 통해 “국가유산청장은 세운 4구역 재개발은 세계유산영향평가를 반드시 받아야 한다는 기존 주장을 되풀이하며 일방적으로 서울시와 종로 주민들을 압박했다”며 “이 사안은 국가유산청장이 단독으로 판단하고 강요할 문제가 아니다. 오랫동,2026-01-19 19:36,https://www.etoday.co.kr/news/view/2547099?trc=main_list_news,이투데이
SGC E&C 작년 공공사업 비중 40% 육박…“안정적 이익 확대”,https://img.etoday.co.kr/crop/200/125/2283579.jpg,"SGC E&C(SGC이앤씨)는 국내 공공사업의 비중을 약 40%까지 높이며 안정적으로 이익을 확대하고 있다고 19일 밝혔다. SGC E&C는 신규 수주 총액에서 공공사업 수주액이 차지하는 비중을 2023년 17%, 2024년 22%, 지난해 39%로 높였다고 이날 밝혔다. SGC E&C는 “그동안 공공 주택 공사와 사회 인프라 관련 토목 공사를 중심으로 사업을 전개하며 공공사업 포트폴리오를 축적해왔다”며 “지난해 용산국제업무지구 도시개발사업 단지 조성 공사와 연향들 도시개발사업 부지 조성 공사 등을 수주해 공공사업을 다각화했다”고",2026-01-19 15:25,https://www.etoday.co.kr/news/view/2547019?trc=main_list_news,이투데이
“할아버지 집을 유지하고 짓고 싶어서”⋯한옥학과에 모인 만학도들 [르포],https://img.etoday.co.kr/crop/200/125/2283538.jpg,"“할아버지 집이 한옥인데 지금은 쓰지 않고 있어요. 그 집을 가족들이 쉬는 공간으로 고쳐보고 싶어서 여기까지 오게 됐습니다.” 16일 전북 전주에 위치한 전북대학교 한옥학과에서 만난 김모(35) 씨의 말이다. 그는 할아버지와 아버지가 살던 한옥을 직접 손보고 싶다는 생각에 한옥학과에 진학했다. 도시 생활을 이어오다 가족이 함께 쉴 수 있는 공간의 필요성을 느꼈고, 그 해답으로 한옥을 떠올렸다고 했다. 전북대 한옥학과는 전국에서 유일하게 한옥을 전공으로 다루는 학과다. 강의실과 실습실에는 전통 목구조와 결구 방식을 배우는 학생들이",2026-01-19 14:37,https://www.etoday.co.kr/news/view/2546962?trc=main_list_news,이투데이
