title,thumbnail,short_content,write_time,link,company
"대광위, 트램 사업 가이드라인 설명회 20일 개최…지자체 추진 기준 제시",https://img.etoday.co.kr/crop/200/125/2283562.jpg,국토교통부 대도시권광역교통위원회(대광위)는 20일 오후 서울역에서 한국교통연구원과 공동으로 수행한 노면전차(트램) 관련 연구 성과를 공유하고 지자체가 사업을 기획·추진할 때 참고할 수 있는 실무적 쟁점을 설명하기 위해 설명회를 개최한다고 19일 밝혔다. 설명회에는 서울·경기·인천을 비롯해 대전·광주·부산·울산·대구·경남·제주 등 트램 사업을 추진 중인 광역 및 기초 지자체가 참석 대상이다. 설명회에서는 실제 사업 사례를 중심으로 지자체 추진 역량을 높이고 ‘트램 사업 가이드라인’의 주요 내용을 소개한다. 서울시는 올해 개통 예정인,2026-01-19 14:36,https://www.etoday.co.kr/news/view/2546982?trc=main_list_news,이투데이
"두산건설, ‘두산위브더제니스 구미’ 100% 분양 성공",https://img.etoday.co.kr/crop/200/125/2283528.jpg,"두산건설은 경북 구미시 광평동 227 일원에 조성 중인 ‘두산위브더제니스 구미’의 일반분양 물량 계약을 모두 완료했다고 19일 밝혔다. 이 단지는 지난해 10월 청약 접수 당시 평균 9.93대 1의 경쟁률을 기록한 바 있다. 수도권 중심의 분양 시장 분위기 속에서도 정당계약 개시 이후 약 2개월 만에 전 가구 완판을 달성하며 흥행에 성공했다는 평가다. 두산건설은 이번 사업을 통해 구미시에서 처음으로 최상위 주거 브랜드인 ‘위브더제니스’를 선보였다. ‘두산위브더제니스 구미’는 지하 3층~지상 최고 39층, 9개 동, 총 1372가구",2026-01-19 13:48,https://www.etoday.co.kr/news/view/2546951?trc=main_list_news,이투데이
오세훈 “10·15 대책 이후 재개발 제동…신림7구역 사업성 추가개선 지원” [종합],https://img.etoday.co.kr/crop/200/125/2283473.jpg,오세훈 서울시장은 19일 관악구 신림7구역 재개발 현장을 찾아 정부의 10·15 대책 이후 재개발 사업 추진에 제동이 걸리고 있다며 해당 구역의 사업성 추가 개선을 지원하고 정부에 규제 완화를 요구하겠다고 밝혔다. 이날 오 시장은 신림7구역을 직접 방문해 주민들과 현장 점검에 나섰다. 신림7구역은 신림동 675번지 일대 목골산 자락에 위치한 저층 주거지로 노후도가 89%에 달한다. 구릉지 특성상 높이 제한과 교통 불편 등으로 사업성이 낮아 2011년 정비예정구역으로 지정됐다가 2014년 해제된 뒤 장기간 방치됐다. 이후 2024년,2026-01-19 13:44,https://www.etoday.co.kr/news/view/2546923?trc=main_list_news,이투데이
신림7구역 주거환경 점검하는 오세훈 서울시장 [포토로그],https://img.etoday.co.kr/crop/200/125/2283460.jpg,오세훈 서울시장이 19일 서울 관악구 신림7재개발 구역을 찾아 노후 주거환경을 점검하고 있다.,2026-01-19 12:18,https://www.etoday.co.kr/news/view/2546914?trc=main_list_news,이투데이
신세계백화점 “기순도 명인과 함께 ‘나만의 장 만들기’ 여행 떠나요”,https://img.etoday.co.kr/crop/200/125/2284265.jpg,1년의 시간 담은 체험형 설 선물 신세계백화점이 설 명절을 맞아 기순도 명인과 함께 전통장을 직접 담그는 체험형 프로그램을 선보이며 명절 선물의 새로운 기준을 제시했다. 최근 명절 선물 트렌드가 취향과 스토리를 중시하는 방향으로 변화함에 따라 신세계백화점은 상품 판매를 넘어 경험을 선물하는 새로운 시도를 도입한 것이다. 신세계백화점은 자체 여행 콘텐츠 ‘로컬이 신세계’의 일환으로 대한민국 전통장 대표 장인 기순도 명인과 함께하는 ‘나만의 장 만들기’를 마련했다고 21일 밝혔다. 이번 프로그램은 다음달 14일까지 신세계백화점 본점과,2026-01-21 06:00,https://www.etoday.co.kr/news/view/2547527?trc=main_list_news,이투데이
"롯데마트, 설 명절 ‘효소·알부민’ 등 이색 건강 선물세트 선봬",https://img.etoday.co.kr/crop/200/125/2284282.jpg,"롯데마트는 2026년 설 명절을 맞아 소비자의 세분화된 건강 관리 목적에 맞춘 다양한 이색 건강 선물세트를 선보인다. 롯데마트는 올해 핵심 트렌드인 ‘건강지능(HQ)’에 발맞춰 가족과 지인의 라이프스타일을 고려한 맞춤형 건강 선물 라인업을 대폭 강화했다고 21일 밝혔다. 기존 홍삼과 비타민 위주의 선물 관행에서 벗어나 효소, 알부민 등 최신 트렌드 상품을 전면에 내세운 점이 특징이다. 실제로 지난해 추석 효소 선물세트가 헬스케어 판매 1위를 기록하는 등 변화하는 소비 흐름을 반영해 효소 세트와 알부민 제품을 판매한다. 알부민은 계",2026-01-21 06:00,https://www.etoday.co.kr/news/view/2547549?trc=main_list_news,이투데이
"롯데하이마트 ‘웨딩 페어’, 예비 신혼부부 대상 최대 5% 할인 강화",https://img.etoday.co.kr/crop/200/125/2284250.jpg,"롯데하이마트가 예비 신혼부부 고객 수요에 대응하기 위해 연중 최대 5% 할인을 제공하는 ‘웨딩 페어’ 프로모션 혜택을 강화한다. 21일 롯데하이마트에 따르면, ‘웨딩 페어’는 결혼식장 계약서 등을 통해 결혼을 증빙하면 주요 가전 제품을 할인하는 행사다. 롯데하이마트는 최근 국내 혼인건수가 증가함에 따라 이달 말까지 행사 상품 2% 할인, 구매 금액대별 최대 3% 할인을 더해 연중 최대 총 5% 할인 혜택을 제공한다. 기존 고객에게 제공하는 다양한 혜택들과도 중복으로 적용할 수 있다. 특히 ‘브랜드 위크’는 삼성전자, LG전자 상품",2026-01-21 06:00,https://www.etoday.co.kr/news/view/2547516?trc=main_list_news,이투데이
OECD 경제계 “상반기 저성장 지속…기업투자는 회복 조짐”,https://img.etoday.co.kr/crop/200/125/2224637.jpg,"OECD 경제산업자문위원회 ‘2025 경제정책 조사‘ 보고서 상반기 기업투자 증가 전망 우세…AI 등 전략산업 집중 경제협력개발기구(OECD) 경제계는 올해 상반기 급격한 경기 하강에 대한 공포는 완화됐지만 저성장 국면이 지속될 것으로 예상했다. 무역·통상과 지정학 리스크가 지속되는 가운데 에너지 수급 불안과 노동시장 경색, 인플레이션 등이 기업활동을 제약하는 요인으로 지목됐다. 21일 OECD 경제산업자문위원회(BIAC)는 회원국 경제단체들의 2026년 상반기 전망을 담은 ‘2025 경제정책 조사’ 보고서를 발표했다. BIAC에",2026-01-21 06:00,https://www.etoday.co.kr/news/view/2547325?trc=main_list_news,이투데이
"중국, 혁신 기술로 글로벌 바이오 시장 선점 [한중 바이오 경쟁과 협력②]",https://img.etoday.co.kr/crop/200/125/2284239.jpg,중국 바이오기업들이 글로벌 제약사들과 초대형 기술이전과 전략적 협력을 잇달아 성사시키며 존재감을 키우고 있다. 특허 만료와 매출 둔화에 직면한 다국적 제약사들이 새로운 성장 동력을 확보하기 위해 중국과의 협업을 확대하는 흐름이 뚜렷해지는 모습이다. 20일 본지 취재를 종합하면 이달 12일(현지시간)부터 15일까지 미국 샌프란시스코에서 열린 JP모건 헬스케어 콘퍼런스(JPMHC 2026)를 통해 중국 기업들의 위상이 다시 한번 확인됐다. 미국 제약기업 애브비(AbbVie)는 중국 레미젠(RemeGen)이 개발한 PD-1·VEGF 이,2026-01-21 05:02,https://www.etoday.co.kr/news/view/2546544?trc=main_list_news,이투데이
‘브랜드 신뢰’ 올인하는 BYD…전국 권역별 전시장 구축 [‘백도어’ 우려 잠재운 BYD],https://img.etoday.co.kr/crop/200/125/2284090.jpg,"지난해 말 기준 30개 전시장 구축 스타필드 하남 등 대규모 전시장 중국 최대 전기차 기업 비야디(BYD)가 국내 진출 1년 만에 전시장 네트워크와 서비스센터를 적극적으로 확대하며 시장 공략에 속도를 내고 있다. 단기간 내 전국 주요 권역에 전시장을 확보하고, 서비스 인프라를 병행해 중국차에 대한 소비자들의 신뢰를 쌓겠다는 전략이다. 단순한 차량 판매를 넘어 사후 관리(AS) 인프라까지 동시에 확충하는 행보는 한국 시장을 결코 가볍게 보지 않겠다는 BYD의 선전포고다. 20일 BYD코리아에 따르면 지난해 말 기준 전주 전시장을 개",2026-01-21 05:00,https://www.etoday.co.kr/news/view/2547384?trc=main_list_news,이투데이
[단독] 10월 ‘아태 AI 허브’ 청사진 시동…인프라·정주까지 묶은 실행형 허브,https://img.etoday.co.kr/crop/200/125/2284247.jpg,GPU·전력·인허가 한 묶음… AI 특화지구 ‘패키지 설계’ 비자·정주·인센티브까지 담아 글로벌 인재 유치 10월 마스터플랜 확정 목표로 상반기 실행 틀 마련 정부가 추진하는 ‘아태 인공지능(AI) 허브(AI 특화지구)’ 조성 사업은 단순한 단지 개발을 넘어 글로벌 기업과 인재가 상시적으로 모여드는 완결형 AI 생태계 모델 구축을 목표로 한다. 20일 정보통신산업진흥원이 발주한 ‘AI 특화지구 조성 마스터플랜 수립’ 용역에 따르면 정부는 올해 10월까지 인프라·규제·정주 여건을 포괄하는 실행안을 마련해 정책 설계를 마무리할 계획이,2026-01-21 05:00,https://www.etoday.co.kr/news/view/2547475?trc=main_list_news,이투데이
"코웨이, 가정용 의료기기·시니어 사업 공략 박차⋯연매출 5조 달성 정조준",https://img.etoday.co.kr/crop/200/125/2284263.jpg,"코웨이가 가정용 의료기기와 실버케어를 양대 축으로 신사업을 강화한다. 정수기·공기청정기 등 기존 환경가전 사업을 넘어 고령화 시대에 맞춘 헬스케어와 시니어 라이프 사업으로 성장 동력을 넓히고, 이를 통해 연 매출 5조 원 달성 시기를 앞당기겠다는 구상이다. 20일 관련 업계에 따르면 코웨이는 최근 가정용 의료기기 브랜드 ‘테라솔’을 공식 출범하고 첫 제품으로 요실금 치료 의료기기 ‘테라솔 U’를 출시했다. 테라솔은 집에서 쉽게 사용할 수 있는 제품으로 실버 세대에 초점이 맞춰졌다. 고령화 속도가 빨라지고 건강 관리에 대한 수요가",2026-01-21 05:00,https://www.etoday.co.kr/news/view/2547418?trc=main_list_news,이투데이
"산업현장에 들어온 AI⋯'예측형 안전관리' 대전환 [산재공화국, 시스템의 부재 下]",https://img.etoday.co.kr/crop/200/125/2284065.jpg,"안전의 언어가 더 이상 현장에서 통하지 않는다. 대통령은 매일 산업재해 발생 여부를 묻지만 사고는 멈추지 않고 있다. 수많은 대책과 제도 마련에도 불구, ‘죽음의 곡선’이 좀처럼 꺾이지 않는 것이다. 한국의 산재 사망률은 경제협력개발기구(OECD)의 평균의 세 배, 영국의 열세 배에 달한다. 사고는 줄지 않고 이동했다. 대기업에서 빠져나간 위험은 하청과 재하청, 영세사업장, 통계에 잡히지 않는 비정형 노동으로 옮겨갔다. 정부의 공식 지표가 말하지 않는 ‘숫자 밖의 죽음들’이 늘고 있다. 문제는 시스템이다. 위험은 사전에 관리되지",2026-01-21 05:00,https://www.etoday.co.kr/news/view/2547351?trc=main_list_news,이투데이
세계의 공장에서 바이오 혁신국으로 도약한 중국의 비밀 [한중 바이오 경쟁과 협력①],https://img.etoday.co.kr/crop/200/125/2284232.jpg,"지난 10여년 중국 바이오산업의 급부상은 한국 제약·바이오산업의 경쟁 지형을 근본적으로 흔들고 있다. 과거 생산기지로 여겨졌던 중국은 글로벌 2위 제약·바이오 시장이자, 글로벌 신약 기술 경쟁에서 한국을 앞서 가고 있다. ‘한중 바이오 협력과 경쟁’ 기획을 통해 양국의 바이오 산업 변화를 분석하고 미중 패권 경쟁 속에서 한국 바이오산업의 대응 과제를 점검한다. 중국이 ‘세계의 공장’을 넘어 글로벌 바이오 혁신 국가로 빠르게 변모하고 있다. 과거 저렴한 비용을 앞세워 복제약과 원료의약품(API) 생산기지로 인식됐던 중국은 이제 신약",2026-01-21 05:00,https://www.etoday.co.kr/news/view/2546538?trc=main_list_news,이투데이
머크·J&J가 택한 SC·병용 카드…알테오젠·유한양행 존재감 커진다,https://img.etoday.co.kr/crop/200/125/2282164.jpg,"머크·J&J, JP모건서 SC 전략 중요성 강조 파트너사 알테오젠‧유한양행 가치 부각 글로벌 빅파마 머크와 존슨앤드존슨(J&J)이 피하주사(SC) 제형 전환과 병용요법을 핵심 성장 전략으로 제시했다. 단순한 투여 편의성 개선을 넘어 특허 만료(LOE) 이후에도 매출 구조를 안정적으로 유지하겠다는 의도다. 이에 따라 이들과 협력 관계에 있는 알테오젠과 유한양행의 가치가 다시 부각되고 있다. 20일 업계에 따르면 머크와 J&J 최고경영자(CEO)들은 미국 샌프란시스코에서 열리고 있는 JP모건 헬스케어 콘퍼런스에서 나란히 SC 제형의",2026-01-21 05:00,https://www.etoday.co.kr/news/view/2545963?trc=main_list_news,이투데이
"“여성이 쓴 의·생명 논문, 남성보다 최대 15일 승인 늦어”",https://img.etoday.co.kr/crop/200/125/2284099.jpg,"의·생명 연구 성과가 학자의 성별에 따라 다른 평가를 받을 가능성이 제기됐다. 여성의 논문이 남성의 논문보다 더 오랜 시간 심사를 받는 경향성이 확인된 것이다. 그간 학계의 임금 및 고용 성차별은 고질적인 문제로 지적됐지만, 논문 심사 자체의 편향성을 확인한 사례는 드물다. 21일 데이비드 알바레스-폰세(David Alvarez-Ponce) 교수 연구팀은 여성이 집필한 의생명 및 생물학 논문은 남성의 논문보다 심사 과정에 소요되는 기간이 7.4%에서 14.6%까지 길다는 사실을 데이터베이스 분석을 통해 확인했다고 밝혔다. 연구 결",2026-01-21 04:00,https://www.etoday.co.kr/news/view/2547400?trc=main_list_news,이투데이
"현대차그룹, 부회장 직속 ‘사업기획 TFT팀’ 신설 “신사업 속도”",https://img.etoday.co.kr/crop/200/125/2277820.jpg,"현대자동차그룹이 장재훈 부회장 직속으로 '사업기획 태스크포스팀(TFT)'을 꾸렸다. 인공지능(AI)과 로보틱스 중심의 신사업 전략 방향성을 검토할 것으로 예상된다. 20일 완성차 업계에 따르면 현대차그룹은 최근 장 부회장 직속 조직으로 사업기획 TFT를 신설하고, TFT 수장으로 전상태 전 감사실장 부사장을 임명했다. 전 부사장은 서울대 경제학과 졸업 후 미국 매사추세츠공대(MIT)에서 경영학 석사 학위를 취득했다. 현대차·기아에서 혁신전략실장, 기획조정2실장, 사업기획2실장 등을 역임하며 그룹 내 기획 분야 핵심 요직을 두루 거",2026-01-20 19:10,https://www.etoday.co.kr/news/view/2547568?trc=main_list_news,이투데이
"[BioS]온코닉, 'PARP/TYKS' 난소암 2상 IND 승인",https://img.etoday.co.kr/crop/200/125/2089797.jpg,온코닉테라퓨틱스(Onconic Therapeutics)는 차세대 합성치사 기전의 이중타깃 항암신약 후보물질 ‘네수파립(nesuparib)’의 신규 적응증인 난소암에 대한 임상2상 시험계획(IND)을 국내 식품의약품안전처로부터 승인받았다고 20일 밝혔다. 이에 따라 온코닉테라퓨틱스는 세브란스병원을 포함한 국내 주요 상급종합병원에서 환자등록 및 투약준비에 돌입한다. 특히 이번 임상은 기존 난소암에 대한 표준치료 가이드라인에는 없던 PARP(poly ADP-ribose polymerase) 저해제 유지요법 후 새로운 ‘재유지요법’을 만,2026-01-20 18:58,https://www.etoday.co.kr/news/view/2547566?trc=main_list_news,이투데이
"현대제철, 인천공장 철근 설비 폐쇄 추진",https://img.etoday.co.kr/crop/200/125/2214349.jpg,노사협의회서 설비 폐쇄 추진 철근 수요 감소 대응 및 사업 경쟁력 강화 차원 현대제철이 인천공장 철근 설비 폐쇄를 추진한다. 20일 철강업계에 따르면 현대제철은 최근 노사협의회를 개최하고 인천의 소형 철근을 주로 생산하는 90톤(t) 규모의 제강공장과 소형 압연공장 폐쇄에 나서기로 했다. 이는 국내 건설경기 둔화로 감소한 철근 수요에 대응하고 봉형강 사업 경쟁력을 확보하기 위함으로 풀이된다. 현대제철의 해당 제강공장과 압연공장은 4일부터 가동중단을 실시하고 있다. 다만 가동 중단에 따른 인위적 인력 감축은 낮다는 게 회사 안팎의,2026-01-20 18:03,https://www.etoday.co.kr/news/view/2547552?trc=main_list_news,이투데이
"중소기업계, 노동자 추정제에 “나도 모르게 범법자⋯행정 부담·법적 리스크 커질 것”",https://img.etoday.co.kr/crop/200/125/2180272.jpg,정부가 플랫폼 노동자 등 '권리 밖 노동자'를 제도권 안으로 끌어들이는 '노동자 추정제'를 추진하는 데에 대해 중소기업계의 우려가 커지고 있다. 입증 책임이 사업주로 옮겨지면서 행정적 부담과 법적 리스크를 키울 것이라는 지적이 나온다. 고용노동부는 20일 '권리 밖 노동자 보호를 위한 패키지 입법' 방안을 밝혔다. 프리랜서·특수고용직·플랫폼 노동자 등 약 870만 명에 이르는 법 밖의 노동자를 제도권 안으로 끌어오기 위해 이른바 '노동자 추정제'를 도입하는 게 핵심이다. 노동자 추정제는 분쟁이 발생한 경우 노무를 제공한 사실이 확,2026-01-20 17:53,https://www.etoday.co.kr/news/view/2547545?trc=main_list_news,이투데이
정부 프리랜서·배달 기사 노동권 강화…플랫폼 업계 우려,https://img.etoday.co.kr/crop/200/125/2284276.jpg,"정부가 프리랜서·플랫폼·특수고용 종사자를 근로자로 추정하는 패키지 법안을 추진하는 가운데 실효성 논란이 제기됐다. 배달 플랫폼업계는 배달 라이더 시장구조를 이해하지 못한 것이라며 법안 실현 가능성에 의문을 제기했다. 20일 고용노동부에 따르면 정부는 5월 1일 처리를 목표로 ‘권리 밖 노동 보호 패키지 입법’을 추진한다. 일하는 사람의 권리를 명문화하고, 근로자 추정을 제도화하는 게 이번 입법의 핵심이다. 특수형태근로종사자(특고), 프리랜서 등 사각지대 노동자를 보호하려는 취지다. 구체적으로 민사 분쟁서 노무 제공자를 노동자로 추",2026-01-20 17:37,https://www.etoday.co.kr/news/view/2547540?trc=main_list_news,이투데이
"“올해 ASIC 기반 서버 증가율, GPU 넘어선다”…점유율 27% 예상",https://img.etoday.co.kr/crop/200/125/2284275.jpg,"트렌드포스 조사 2023년 이후 가장 높아 올해 전 세계 인공지능(AI) 서버 출하량이 큰 폭으로 증가하는 가운데, 주문형 반도체(ASIC) 기반 AI 서버의 출하량 증가율이 그래픽처리장치(GPU) 기반 서버를 크게 웃돌 것으로 전망된다. 20일 시장조사기관 트렌드포스에 따르면 올해 ASIC 기반 AI 서버의 시장 점유율은 27.8%에 달할 것으로 예상된다. 이는 2023년 이후 가장 높은 수준이다. 이 같은 흐름은 구글, 메타 등 북미 클라우드서비스제공업체(CSP)들이 자체 ASIC 개발에 속도를 내면서 더욱 두드러지고 있다.",2026-01-20 17:35,https://www.etoday.co.kr/news/view/2547539?trc=main_list_news,이투데이
로봇ㆍ밸류체인 '수직 계열화' 계획…모비스·글로비스까지 재평가 [‘피지컬 AI’ 날개 단 현대차],https://img.etoday.co.kr/crop/200/125/2284242.jpg,"""그룹 핵심 계열사 성장 기회"" 분석도 ""매출 반영에 시간 필요"" 신중론도 현대자동차 주가가 급등하자, 시장의 시선은 그룹 핵심 계열사로 옮겨가고 있다. 완성차 주가 재평가가 일회성 이벤트에 그칠지 아니면 현대모비스·현대글로비스 등 계열사로 확산하는 구조적 밸류에이션 재편의 출발점이 될지가 관전 포인트다. 20일 업계에 따르면 현대차는 그룹사 내부 역량을 활용, 로봇 밸류체인을 내재화·수직 계열화할 계획이다. 이 가운데 현대모비스는 ‘미래 기술의 하드웨어 플랫폼’으로 정체성이 빠르게 재정의되고 있다. 첨단운전자보조시스템(ADAS)",2026-01-20 17:30,https://www.etoday.co.kr/news/view/2547435?trc=main_list_news,이투데이
"‘정의선 체제’ 5년, 시장이 답했다…'기술의 힘' 시장이 공인 [‘피지컬 AI’ 날개 단 현대차]",https://img.etoday.co.kr/crop/200/125/2284243.jpg,대한민국 굴뚝 산업의 상징이었던 현대자동차가 ‘피지컬 인공지능(AI)’ 전략을 앞세워 시가총액 100조 원 시대를 열었다. 정의선 현대차그룹 회장이 5년간 밀어붙여 온 경영 전략과 의사결정에 시장이 처음으로 명확한 평가를 내린 장면으로 읽힌다. 주가에 반영된 것은 자동차 판매 성과가 아니라 ‘정의선 체제’에 대한 신뢰다. 단순한 지표 개선을 넘어 ‘정의선식 리더십’이 증명한 미래 비전이 현대차를 국내 증시의 세 번째 거인으로 우뚝 세웠다. 20일 한국거래소에 따르면 현대차는 이날 장중 49만6500원까지 오르며 시총 100조 원을,2026-01-20 17:30,https://www.etoday.co.kr/news/view/2547399?trc=main_list_news,이투데이
"새 성장 엔진은 '로보틱스'⋯100조 클럽, ‘車’가 아닌 ‘플랫폼’ [‘피지컬 AI’ 날개 단 현대차]",https://img.etoday.co.kr/crop/200/125/2284245.jpg,"시총 100조 시대 중장기 전략 ""자동차 넘어 로봇 생산기업으로"" 그룹 통합 밸류체인 구축 추진 엔비디아ㆍ구글과도 협력 가속 레벨4 자율주행차 연내 상용화 현대자동차그룹이 엔진 소리에 인공지능(AI)과 로보틱스의 심장을 장착하면서 ‘시총 100조 원’이라는 압도적 숫자로 그 가치를 증명해 냈다. 대규모 투자 전략이 실질적인 제조 혁신으로 시장의 확신을 이끌어 내며, 대한민국 대표 제조업에서 ‘피지컬 AI’ 기업으로 대전환을 선언했다. 20일 완성차 업계에 따르면 현대차그룹은 글로벌 대규모 생산 제조 역량과 강력한 그룹 밸류체인을",2026-01-20 17:30,https://www.etoday.co.kr/news/view/2547368?trc=main_list_news,이투데이
"인천공항 T1 면세점 재입찰, 롯데·현대 ‘2파전’⋯신세계·신라는 불참",https://img.etoday.co.kr/crop/200/125/2247507.jpg,20일 인천국제공항 면세점 사업권 입찰 마감 롯데·현대면세점 참여⋯해외사업자 ‘아볼타’ 불참 인천국제공항 제1여객터미널(T1) 면세점 사업권 입찰 대진표가 롯데면세점과 현대면세점의 양자 구도로 압축됐다. 신세계면세점과 신라면세점이 나란히 입찰 참여를 포기했다. 20일 본지 취재를 종합하면 신세계면세점과 신라면세점이 인천국제공항 T1 면세점 사업권(DF1·DF2)에 대한 입찰에 참여하지 않기로 했다. 이에 따라 이번 입찰에는 롯데면세점과 현대면세점 등 2개 업체만이 입찰 의향서를 제출한 것으로 확인됐다. 신라면세점 관계자는 “소비패,2026-01-20 17:21,https://www.etoday.co.kr/news/view/2547517?trc=main_list_news,이투데이
"네이버, 신규 CDO에 김광현 검색 플랫폼 부문장 선임",https://img.etoday.co.kr/crop/200/125/2284254.jpg,"네이버가 김광현 검색 플랫폼 부문장을 최고 데이터·콘텐츠 책임자(CDO)로 신규 선임한다. 팀네이버 역량을 통합하고 인공지능(AI) 에이전트부터 피지컬AI, 웹3 등 변화하는 글로벌 환경에 기민하게 대응하겠다는 취지다. 네이버는 내달 1일자로 김 CDO를 신규 선임하는 한편 세부 조직 개편을 순차적으로 진행한다고 20일 밝혔다. 김 CDO는 팀네이버 주요 서비스 전반에 AI 에이전트 적용을 가속화하고 검색 및 데이터 기술 플랫폼의 통합과 고도화를 추진한다. 구체적으로 네이버 전반에 축적된 사용자 데이터와 콘텐츠를 유기적으로 융합해",2026-01-20 17:11,https://www.etoday.co.kr/news/view/2547519?trc=main_list_news,이투데이
