title,thumbnail,short_content,write_time,link,company
"미래에셋증권, 국내 최초 홍콩 디지털자산 리테일 사업 진출",https://img.etoday.co.kr/crop/200/125/2321824.jpg,"홍콩에서 한국주식 투자 서비스 추진향후 싱가폴, 미국 등 글로벌 디지털 사업 확대 미래에셋증권 홍콩법인이 국내 증권사 최초로 홍콩 증권선물위원회(SFC)로부터 ‘디지털자산 리테일 라이선스(VA License Uplift)'를 최종 승인받았다고 15일 밝혔다. 미래에셋증권 홍콩법인은 오는 6월 모바일트레이딩시스템(MTS)을 오픈해 홍콩 내 개인 투자자를 대상으로 디지털자산 거래서비스를 정식 출시한다. 전통자산인 주식, 채권과 디지털자산을 아우르는 통합 투자 환경을 제공할 계획이다. 아울러 홍콩 고객이 한국 주식시장에 투자할 수 있는",2026-04-15 09:15,https://www.etoday.co.kr/news/view/2575845?trc=main_list_news,이투데이
3월 서울 민간아파트 분양가 평당 5490만원...전월 대비 4%↑,https://img.etoday.co.kr/crop/200/125/2321540.jpg,"올해 3월 기준 서울 민간아파트당 분양가격이 전월 대비 4% 상승하면서 5500만원에 육박한 것으로 나타났다. 15일 주택도시보증공사(HUG)가 공표한 민간아파트 분양가격 동향에 따르면 최근 1년간 전국에서 신규 분양된 민간아파트의 단위면적(㎡)당 평균 분양가격은 올 3월 말 기준 611만4000원이다. 이는 전월 대비 0.71% 상승한 금액으로, 3.3㎡(1평)로 환산하면 2021만2000원에 해당한다. HUG가 산출하는 월별 평균 분양가는 작성기준월 한 달이 아니라 해당월을 포함해 공표 직전 12개월간 분양보증서가 발급된 민간",2026-04-15 16:57,https://www.etoday.co.kr/news/view/2576092?trc=main_list_news,이투데이
李 대통령 강공에 수요는 눌렸지만…공급 불안은 그대로,https://img.etoday.co.kr/crop/200/125/2321500.jpg,"다주택·투기 차단 의지 지속 강조 서울 주택 인허가는 1~2월 반 토막 ""민간 정비사업 활로 과감히 열어야"" 이재명 대통령이 수개월째 다주택·투기 수요에 대한 강경 발언과 수요 억제책을 지속하며 주택시장은 다소 잠잠한 분위기가 이어지고 있다. 하지만 공급 확대를 체감할 만한 정책이나 움직임으로는 이어지지 않고 있다 보니 공급 부족 우려는 그대로다. 특히 서울 주택시장의 인허가 실적이 반 토막 나는 등 공급 가뭄은 심화할 가능성이 큰 상태다. 15일 온라인 커뮤니티에서는 부동산 시장의 진단과 처방을 둘러싼 논쟁이 벌어지고 있다. 유",2026-04-15 14:05,https://www.etoday.co.kr/news/view/2575607?trc=main_list_news,이투데이
"사전청약 무산 단지 살렸다⋯LH, 인천가정2 공공분양 308가구 공급",https://img.etoday.co.kr/crop/200/125/2322018.jpg,한국토지주택공사(LH)가 인천 서구 가정2지구 내 공공분양 주택 공급에 나선다. 민간사업자의 사전청약 이후 사업 포기로 중단됐던 단지를 공공이 이어받아 공급하는 첫 사례다. 15일 LH는 인천가정2지구 B2블록 공공분양주택 308가구 입주자 모집공고를 시행한다고 밝혔다. 이번 단지는 올해 LH가 공급하는 첫 공공분양 물량이다. 인천가정2 B2블록은 2022년 민간사업자가 사전청약을 진행했으나 2024년 사업을 포기하면서 공급이 중단된 바 있다. LH는 이를 공공분양으로 전환해 재공급에 나섰다. 단지는 총 308가구 규모로 조성된다,2026-04-15 14:02,https://www.etoday.co.kr/news/view/2575985?trc=main_list_news,이투데이
다주택자 규제 움직임에 3월 서울 집값 둔화⋯전ㆍ월세는 치솟아,https://img.etoday.co.kr/crop/200/125/2321898.jpg,서울 주택 매매가격 0.66%→0.39%로 위축 물량 감소에…서울 전세 외곽·한강벨트 모두 상승 오피스텔 월세 상승 지속…서울 평균 94만원 다주택자 규제 여파가 이어진 3월 서울 주택시장은 매매가격 상승폭이 둔화된 반면 전·월세는 오름세가 확대되는 엇갈린 흐름을 보였다. 주택 규제가 강화되면서 아파트 대체재로 꼽히는 오피스텔은 서울을 포함해 전국적으로 월세 상승세가 나타났다. 15일 한국부동산원이 발표한 ‘3월 전국 주택가격 동향조사’에 따르면 지난달 서울 주택 매매가격은 전월 대비 0.39% 상승했다. 상승세는 이어졌지만 전월,2026-04-15 14:00,https://www.etoday.co.kr/news/view/2575923?trc=main_list_news,이투데이
"포니정재단, ‘혁신상’ 수상자에 정영선 조경가",https://img.etoday.co.kr/crop/200/125/2322014.jpg,아시아선수촌 아파트ㆍ예술의전당 등 대표작 포니정재단은 대한민국 1호 여성 조경가인 정영선 조경설계 서안 대표를 올해 ‘포니정 혁신상’ 수상자로 선정했다고 15일 밝혔다. 반세기 넘게 현장에서 활동하며 한국 조경의 지평을 넓혀온 공로를 높이 평가했다. 시상식은 5월 28일 서울 강남구 아이파크타워 포니정홀에서 열린다. 정몽규 이사장은 선정 배경에 대해 “정영선 조경가는 ‘나이는 숫자에 불과하다’는 말을 몸소 증명하듯 늘 새로운 콘셉트를 선보이며 끊임없이 도전하고 혁신해온 인물”이라며 “우리나라 곳곳에 주변 경관과 조화를 이루면서도,2026-04-15 13:55,https://www.etoday.co.kr/news/view/2575983?trc=main_list_news,이투데이
"신영에셋, ﻿손종구 대표 체제로...“상업용 부동산 경쟁력 강화”",https://img.etoday.co.kr/crop/200/125/2321947.jpg,"신영그룹의 상업용 부동산 종합 서비스 계열사 신영에셋이 손종구 대표 취임을 계기로 조직 개편과 핵심 인재 영입에 나서며 시장 경쟁력 강화에 나선다. 신영그룹은 올 초 정기 임원 인사를 통해 개발 분야 전문가인 손종구 신영 대표이사를 신영에셋 대표이사로 겸직 선임했다고 15일 밝혔다. 부동산 개발과 자산관리 사업 간 시너지를 극대화해 시행부터 시공, 임대차 자문, 자산관리, 매입·매각까지 아우르는 '원스톱 밸류체인'을 구축한다는 전략이다. 신영에셋은 전문성 강화를 위해 업계 전문가를 주요 보직에 배치했다. 투자자문 본부장에는 이윤영",2026-04-15 12:42,https://www.etoday.co.kr/news/view/2575959?trc=main_list_news,이투데이
"서울시, 정비사업에 180억 저리융자⋯초기 자금난 해소로 속도전",https://img.etoday.co.kr/crop/200/125/2321871.jpg,추진위 최대 15억·조합 최대 60억 담보 2.5%·신용 4.0% 적용 서울시가 재개발·재건축 등 정비사업 초기 자금난 해소를 위해 총 180억원 규모의 저리 융자 지원에 나선다. 사업 초기에 필요한 설계비·운영비 등을 지원해 지연 요인을 줄이고 사업 속도를 높이겠다는 취지다. 15일 서울시에 따르면 시는 '2026년 정비사업 융자금 지원계획'을 16일 공고하고 추진위원회와 조합을 대상으로 금융 지원을 실시한다. 지원 대상은 '도시 및 주거환경정비법'에 따라 정비구역으로 지정·고시된 구역의 추진위원회와 조합이다. 토지주택공사 등과,2026-04-15 11:15,https://www.etoday.co.kr/news/view/2575899?trc=main_list_news,이투데이
"온수역 한주물류센터 부지, 공공임대 195가구·산후조리원 조성",https://img.etoday.co.kr/crop/200/125/2321845.jpg,"서울 구로구 오류동 온수역 인근 한주물류센터 부지가 공공임대주택과 공공산후조리원을 갖춘 주거·돌봄 복합단지로 재편된다. 역세권 입지를 활용해 신혼부부용 공공임대주택 ‘미리내집’ 195가구를 공급하고, 지역 주민이 함께 이용할 수 있는 돌봄시설을 결합한 형태다. 15일 서울시는 전날 개최한 제5차 건축위원회에서 ‘오류동 326-16 공동주택 건립사업’을 심의 통과시켰다고 밝혔다. 대상지는 온수역(서울 지하철 1·7호선) 인근 한주물류센터 특별계획구역인 구로구 오류동 326-16번지다. 이곳에는 지하 3층~지상 26층 규모로 공공임대",2026-04-15 11:15,https://www.etoday.co.kr/news/view/2575871?trc=main_list_news,이투데이
"국토부, 신도시 교통망 ‘속도전’⋯36개 사업 TF로 집중관리",https://img.etoday.co.kr/crop/200/125/2321803.jpg,"정부가 신도시 주민들의 교통 불편 해소를 위해 광역교통망 구축 속도전에 나선다. 주요 사업을 선별해 집중 관리하고 갈등 조정과 인허가 단축을 병행하는 방식이다. 15일 국토교통부 대도시권광역교통위원회는 16일 오후 한국토지주택공사(LH) 서울본부에서 ‘2026년 신도시 교통대책 신속추진 TF’ 첫 회의를 연다고 밝혔다. 이번 회의에는 서울시와 인천시, 하남시 등 지방자치단체와 함께 LH, 인천도시공사, 한국철도공사 등 관계기관 약 50여 명이 참석해 광역교통 개선대책 사업의 이행 점검과 협력체계 강화 방안을 논의한다. ‘신도시 교",2026-04-15 11:00,https://www.etoday.co.kr/news/view/2575820?trc=main_list_news,이투데이
집 사려던 발길 멈췄다...전국 주택 매매 소비심리지수 두 달 연속 하락,https://img.etoday.co.kr/crop/200/125/2321840.jpg,전국 주택 매매 소비심리지수가 두 달 연속 하락했다. 정부의 규제 강화 신호와 대출 부담이 겹치면서 서울을 중심으로 주택 매매 심리가 크게 꺾인 영향으로 풀이된다. 15일 국토연구원이 발표한 부동산시장 소비자 심리조사 결과에 따르면 올해 3월 전국 주택 매매시장 소비심리지수는 전월 대비 1.7포인트(p) 하락한 110.6으로 집계됐다. 2월에도 전월 대비 9.8p 하락하는 등 두 달 연속 하락 흐름이다. 부동산시장 소비심리지수는 매달 마지막 주 전국 152개 시군구에서 영업 중인 중개업소와 일반 가구를 대상으로 조사한다. 지수가,2026-04-15 11:00,https://www.etoday.co.kr/news/view/2575870?trc=main_list_news,이투데이
LH 부채 또 늘었는데…공급 확대에 올해도 재무 부담 가중 우려,https://img.etoday.co.kr/crop/200/125/2306108.jpg,지난해 부채 173조⋯1년 새 13조 늘어올해 공공주택 공급에 18조 투입 계획‘조직분리’로 부채관리 나섰지만 우려 여전 한국토지주택공사(LH)의 부채가 170조원을 넘어서며 재무 부담이 빠르게 커지고 있다. 공공주택 공급 확대에 따른 자금 투입은 늘어난 반면 토지 매각 감소와 분양 지연으로 현금 회수는 늦어지면서 재무 구조에 부담이 누적되는 모습이다. 여기에 올해도 사업비 증가가 이어지면서 적자 폭이 더욱 확대될 것이라는 전망이 나온다. 15일 공공기관 경영정보공개시스템(알리오)에 공개된 LH 이사회 회의록에 따르면 지난해 부채는,2026-04-15 10:00,https://www.etoday.co.kr/news/view/2575648?trc=main_list_news,이투데이
"대우건설, 한전과 TBM 설계기술 협력…굴진 데이터·예측모델 공동 개발",https://img.etoday.co.kr/crop/200/125/2321851.jpg,"대우건설은 15일 한전과 ‘TBM 설계기술 고도화’를 위한 업무협약(MOU)을 체결했다고 밝혔다. 협약식은 전날 서울 을지로 본사에서 열렸으며 심철진 대우건설 토목사업본부장과 김대한 한전 전력연구원장 등 양측 관계자들이 참석했다. TBM(Tunnel Boring Machine)은 철도·도로·전력구 등 지하 터널 시공에 활용되는 대형 굴착 장비로 지반 조건에 맞는 장비 선정과 운용 설계에 따라 공사 기간과 비용, 안전성이 크게 좌우된다. 이번 협약에 따라 양측은 TBM 관련 연구개발과 기술 교류 전반에서 협력 체계를 구축한다. 구체",2026-04-15 09:52,https://www.etoday.co.kr/news/view/2575880?trc=main_list_news,이투데이
"LH, 1882억원 규모 스위스프랑화 채권 발행",https://img.etoday.co.kr/crop/200/125/2321356.jpg,한국토지주택공사(LH)가 스위스 금융시장에서 1억 스위스프랑(약 1882억원) 규모 채권 발행에 성공했다. 올해 국내 기업 중 첫 발행 사례다. LH는 15일 스위스프랑 표시 채권 발행을 완료했다고 밝혔다. 이번 발행은 만기 3년물로 금리는 3년 만기 스위스프랑 미드스왑 금리에 43bp를 가산한 수준에서 결정됐다. 발행일은 이달 10일이며 BNP Paribas가 단독 주관했다. 이번 발행은 중동 정세 불안 등으로 글로벌 금융시장 변동성이 확대된 상황에서 이뤄졌다는 점에서 의미가 있다. 특히 안정형 투자자 비중이 높은 스위스프랑 시,2026-04-15 09:47,https://www.etoday.co.kr/news/view/2575874?trc=main_list_news,이투데이
[아파트값 상승 톱10] 서울 성동구 ‘옥수현대’ 등,https://img.etoday.co.kr/crop/200/125/2321763.jpg,부동산 플랫폼 호갱노노에 따르면 14일 신고일 기준 전국 아파트 가운데 실거래가 상승 폭이 가장 컸던 단지는 서울 성동구 ‘옥수현대’로 나타났다. 이 단지는 23억5000만원에 거래되며 직전 거래 대비 5억3000만원(29%) 상승했다. 2위는 서울 강남구 ‘동현’으로 38억3000만원에 실거래되며 5억3000만원(16%) 올랐다. 3위는 양천구 ‘목동센트럴아이파크위브’로 12억원에 거래되며 4억6500만원(63%) 상승한 것으로 집계됐다. 이어 서울 강남구 ‘삼성롯데캐슬킹덤’이 29억원에 거래되며 직전 거래 대비 16% 올라 4,2026-04-15 08:30,https://www.etoday.co.kr/news/view/2575789?trc=main_list_news,이투데이
[오늘의 청약 일정] 과천 디에트르 퍼스티지 ‘줍줍’ 무순위 청약 접수,https://img.etoday.co.kr/crop/200/125/2321566.jpg,"부동산 정보업체 부동산R114에 따르면 14일 오늘은 서울 서초구 '오티에르반포', 경기 김포시 '풍무역세권수자인그라센트2차(B1)', 부산 동래구 '온천장하늘채엘리시움', 강원 고성군 '르네오션고성퍼스트뷰', 전북 전주시 '북전주광신프로그레스', 충남 천안시 '업성푸르지오레이크시티(A1)' 등 단지에서 2순위 청약 접수를 받는다. 경기 의정부시 '의정부역센트럴아이파크'와 인천 부평구 '중앙하이츠갈산역센트럴' 단지는 이날 당첨자를 가린다. 또 한국부동산원 청약홈에 따르면 이날 경기 과천시 갈현동 지식정보타운 공공주택지구 '과천 디",2026-04-15 07:00,https://www.etoday.co.kr/news/view/2575632?trc=main_list_news,이투데이
"노량진 '라클라체 자이 드파인', 1순위 26.9대 1⋯고분양가 논란에도 전 주택형 마감",https://img.etoday.co.kr/crop/200/125/2321741.jpg,59㎡ 최고 42.4대 1 서울 동작구 노량진뉴타운 첫 분양 단지인 '라클라체 자이 드파인'이 1순위 청약에서 평균 26.9대 1의 경쟁률을 기록하며 전 주택형이 마감됐다. 고분양가 논란에도 불구하고 두 자릿수 경쟁률을 나타내며 수요가 몰린 모습이다. 15일 한국부동산원 청약홈에 따르면 노량진6구역 재개발 사업으로 공급되는 이 단지는 이날 진행된 일반공급(해당지역) 1순위 청약에서 180가구 모집에 4843명이 신청해 평균 26.9대 1의 경쟁률을 기록했다. 주택형별로는 전용면적 59㎡ B형이 5가구 모집에 212명이 몰려 42.,2026-04-15 06:23,https://www.etoday.co.kr/news/view/2575762?trc=main_list_news,이투데이
"차로 가득한 영동대로, 광장 품은 지하도시로…강남 동남권 재편의 핵심축 뜬다 [서울 복합개발 리포트 ⑬]",https://img.etoday.co.kr/crop/200/125/2321699.jpg,지하 5층·17만㎡ 복합환승공간 조성 지상은 광장·테라스 녹지로 재편 GBC 중심 삼성~잠실 축 구축…완성은 단계적 출근 시간대 서울 강남구 영동대로. 삼성역 사거리 일대에는 신호가 바뀔 때마다 차량 행렬이 길게 늘어서고 도로 한가운데에는 공사 펜스와 대형 장비가 줄지어 서 있다. 과거 왕복 14차선이던 도로는 공사로 8차선까지 줄어들며 차량 흐름은 답답해졌다. 5년 넘게 이어진 공사에 익숙해진 듯하지만 보행자는 좁아진 인도를 따라 발걸음을 재촉하고 차량은 엇갈리듯 교차로를 빠져나간다. 지금은 교통 혼잡과 장기 공사의 상징처럼 보,2026-04-15 06:00,https://www.etoday.co.kr/news/view/2575604?trc=main_list_news,이투데이
“우리 건물도 사주나요”⋯PF 막히자 LH 오픈마켓에 주택 사업자 몰렸다 [르포],https://img.etoday.co.kr/crop/200/125/2321612.jpg,"LH, 연내 3만8224가구 매입 추진 수도권 81% 집중·매입약정 중심 확대 건설ㆍ시행사 1700여명 방문⋯북새통 “건설 경기가 너무 안 좋아 분양 리스크도 크고 부동산 프로젝트파이낸싱(PF)도 막혀 답이 없어 찾아왔습니다.” 14일 경기남부지역본부에서 열린 한국토지주택공사(LH) ‘주택매입 오픈마켓·사업설명회’ 현장. 보유 토지를 활용해 매입약정 사업을 검토하려는 건설사와 시행사 관계자들의 발걸음이 이어졌다. 상담 부스마다 사업 참여 조건과 매입 구조를 묻는 질문이 이어지며 현장은 비교적 분주한 분위기였다. 이날 오후 3시 3",2026-04-14 17:00,https://www.etoday.co.kr/news/view/2575675?trc=main_list_news,이투데이
현대건설 “압구정5구역 ‘클린수주’ 원칙 강화”,https://img.etoday.co.kr/crop/200/125/2321679.jpg,"“공정 경쟁 훼손 행위 엄정 대응” 현대건설이 압구정5구역 재건축 시공사 선정 과정에서 불거진 경쟁사의 입찰서류 무단 촬영 논란과 관련, 수주 과정의 투명성을 높이겠다고 밝혔다. 현대건설은 14일 ""공정 경쟁의 원칙을 훼손하는 행위에 대해 엄정하게 대응하겠다""며 ""조합원의 이익을 위해 클린수주 원칙을 한층 강화하겠다""고 강조했다. 10일 마감된 압구정5구역 재건축 시공사 선정 입찰에서는 서류 확인 과정에서 경쟁사인 DL이앤씨 측 직원이 볼펜형 카메라로 입찰서류를 무단 촬영했다는 의혹이 제기됐다. 현대건설은 해당 행위가 공정 경쟁의",2026-04-14 16:54,https://www.etoday.co.kr/news/view/2575713?trc=main_list_news,이투데이
대출 더 조이는데 왜 오르나⋯서울 외곽 집값 떠받친 '전월세난',https://img.etoday.co.kr/crop/200/125/2321621.jpg,"서울 외곽 아파트값이 정부의 대출 규제 강화에도 오름세를 이어가는 배경으로 임대차 시장 불안이 지목됐다. 전월세 매물이 부족한 지역을 중심으로 임차인이 매수로 돌아서면서 외곽 집값을 떠받치고 있다는 분석이다. 남혁우 우리은행 부동산연구원은 14일 YTN 라디오 '조태현의 생생경제'에서 ""중심 지역은 7월 세제 개편안과 이란 전쟁 장기화에 따른 금리 인상 우려 등 매수 심리에 영향을 주는 불확실성이 작용하고 있다""며 ""반면 외곽 지역은 기저에 임대차 시장 불안이 일부 가격 상승 흐름의 원인으로 작용하고 있다""고 말했다. 이어 ""특히",2026-04-14 16:52,https://www.etoday.co.kr/news/view/2575688?trc=main_list_news,이투데이
정왕국 SR 대표 “9월 통합 큰 무리 없어…정부 로드맵 맞춰 준비”,https://img.etoday.co.kr/crop/200/125/2321567.jpg,SR과 한국철도공사(코레일) 통합 작업이 속도를 내는 가운데 정왕국 SR 대표가 양 기관 통합이 9월 1일 큰 무리 없이 이뤄질 수 있다고 밝혔다. 정부가 제시한 통합 로드맵에 맞춰 노사정 협의체 논의가 진행 중인 데다 교차운행 등 사전 절차도 큰 문제 없이 이뤄지고 있다는 판단에서다. 정 대표는 14일 출입기자단과의 오찬 간담회에서 “기관 대 기관 통합은 철도산업발전기본법상 양수도 방식으로 진행되는데 이러한 방식으로 간다면 9월 1일 크게 어렵지 않을 것으로 판단한다”며 “그 이후 후속 행정절차는 진행될 것으로 보인다”고 말했다,2026-04-14 16:46,https://www.etoday.co.kr/news/view/2575633?trc=main_list_news,이투데이
3월 건설경기 체감지수 기저효과에 소폭 상승했지만⋯여전히 '부정적',https://img.etoday.co.kr/crop/200/125/2321611.jpg,지난달 건설사들의 체감경기가 여전히 기준선을 크게 밑돌며 부진한 흐름이 이어지고 있다. 14일 한국건설산업연구원(건산연)에 따르면 지난달 건설경기실사지수(CBSI)는 67.8로 전월보다 5.3포인트 상승했다. 다만 기준선인 100을 크게 밑도는 수준으로 건설 경기를 비관적으로 보는 시각이 여전히 우세한 것으로 나타났다. 건산연은 2월 급락에 따른 기저효과로 지수가 일부 반등했지만 구조적 제약 요인이 지속되면서 체감경기 회복은 제한적이라고 설명했다. 세부 지표를 보면 신규수주지수(68.5)가 6.9포인트 오르며 전체 상승을 이끌었고,2026-04-14 16:07,https://www.etoday.co.kr/news/view/2575681?trc=main_list_news,이투데이
"코레일, 전관예우 근절 종합대책 본격 시행",https://img.etoday.co.kr/crop/200/125/2321600.jpg,한국철도공사(코레일)가 정부의 전관예우 근절 대책에 발맞춰 철도 산업 전반의 공정성과 투명성 강화를 위한 ‘전관예우 근절 종합대책’을 수립하고 본격 시행한다고 14일 밝혔다. 이번 대책은 퇴직 임직원의 재취업과 관련해 부당한 영향력 행사 가능성을 원천 차단하기 위해 기술분야를 중심으로 계약·납품 과정 전반에 대한 투명성 강화에 중점을 두고 있다. 우선 입찰 평가에서 기술분야 퇴직자가 재취업한 업체에 대한 감점제도를 신설(최대 3점)하고 수의계약 참여 제한 기간을 기존 2년에서 3년으로 확대하는 등 페널티를 강화한다. 또한 불필요한,2026-04-14 15:55,https://www.etoday.co.kr/news/view/2575670?trc=main_list_news,이투데이
"""감당 가능한 집""만⋯청약·매매·전월세 ‘소형’ 아파트에 쏠린다",https://img.etoday.co.kr/crop/200/125/2321534.jpg,"대출 규제·분양가 상승에 59㎡ 선호 뚜렷전세 품귀까지 겹치며 소형 수요 확대 서울 아파트 청약 시장부터 매매, 전·월세 시장까지 소형 아파트 선호 현상이 뚜렷하게 나타나고 있다. 고강도 대출 규제와 치솟는 분양가로 인해 수요자들이 '감당 가능한 금액대' 안에서 매물을 찾기 때문인 것으로 풀이된다. 14일 한국부동산원 청약홈에 따르면 전날 진행된 서초구 잠원동 '오티에르반포' 1순위 청약에서 43가구 모집에 3만540명이 몰렸다. 주택형별 경쟁률을 보면 59㎡ B형이 1180.9대 1로 가장 높았다. 이어 59㎡ A형(939.7대",2026-04-14 14:55,https://www.etoday.co.kr/news/view/2575623?trc=main_list_news,이투데이
"서울 아파트, 신축 대신 구축이 인기인 이유 [포토]",https://img.etoday.co.kr/crop/200/125/2321534.jpg,"14일 국토교통부 실거래가 공개시스템에 따르면 올해 1월 1일부터 4월 13일까지 서울 아파트 거래 중 준공 30년 초과 아파트가 차지하는 비중은 26.3%로 집계됐다. 이는 5년 이하 신축 아파트 거래 비중인 6.2%를 4.2배에 달하는 수준이다. 분양가 상승과 대출 규제가 맞물리면서, 자금 부담을 느낀 수요자들이 중저가 구축 아파트로 눈을 돌리고 있는 것으로 해석된다. 사진은 이날 서울 송파구 롯데월드타워에서 바라본 서울의 아파트 전경. 김예연 인턴기자 kimye@",2026-04-14 14:51,https://www.etoday.co.kr/news/view/2575613?trc=main_list_news,이투데이
교통비 환급 ‘모두의카드’ 500만명 돌파⋯도입 2년 만에 ‘국민카드’ 자리매김,https://img.etoday.co.kr/crop/200/125/2321275.jpg,대중교통비 일부를 환급해주는 ‘모두의카드(K-패스)’ 이용자가 500만 명을 돌파했다. 도입 2년여 만에 빠르게 확산되며 교통비 절감 정책의 대표 사례로 자리 잡는 모습이다. 국토교통부는 14일 대도시권광역교통위원회와 함께 모두의카드 이용자가 500만 명을 넘어섰다고 밝혔다. 모두의카드는 대중교통 이용 금액의 일정 부분을 환급해주는 교통카드로 2024년 5월 도입됐다. 이용자는 꾸준히 증가했다. 지난해 10월 400만 명을 돌파한 데 이어 약 6개월 만에 100만 명이 추가되며 500만 명을 넘어섰다. 올해 1월에는 기준 금액을,2026-04-14 14:00,https://www.etoday.co.kr/news/view/2575418?trc=main_list_news,이투데이
