title,thumbnail,short_content,write_time,link,company
공급 속도 높인다⋯노후주택단지 단독 주택단지 재건축진단 규제 완화,https://img.etoday.co.kr/crop/200/125/2312511.jpg,특별법 시행령 개정안 국무회의 통과 정부가 노후계획도시 정비사업의 속도를 높이기 위해 재건축 규제를 완화하고 행정 절차를 간소화한다. 국토교통부는 '노후계획도시 정비 및 지원에 관한 특별법' 시행령 개정안이 14일 국무회의를 통과해 공포일인 21일부터 시행될 예정이라고 밝혔다. 이번 개정안은 정비사업 추진 과정에서의 제도적 제약을 완화해 사업 착수를 앞당기고 주민 부담을 줄이는 데 초점을 맞췄다. 우선 단일 주택단지로 구성된 특별정비예정구역도 일정 요건을 충족하면 재건축진단을 완화하거나 면제할 수 있도록 했다. 그동안은 여러 단지,2026-04-14 13:20,https://www.etoday.co.kr/news/view/2575525?trc=main_list_news,이투데이
"노선버스ㆍ심야화물차, 전국 재정고속도로 한 달간 통행료 면제",https://img.etoday.co.kr/crop/200/125/2296561.jpg,16일부터 시행…“고유가 부담 완화” 정부가 고유가로 어려움을 겪는 운송업계를 지원하기 위해 한 달간 고속도로 통행료를 전액 면제한다. 국토교통부는 노선버스와 심야 화물차를 대상으로 재정고속도로 통행료를 16일부터 면제한다고 14일 밝혔다. 이번 조치는 4월 14일 국무회의에서 의결됐으며 3월 26일 대통령 주재 비상경제점검회의에서 결정된 민생 안정 대책의 후속 조치다. 노선버스의 경우 4월 16일 0시부터 5월 15일 24시까지 전국 재정고속도로 통행료가 전일 면제된다. 대상은 하이패스를 이용하는 노선 여객자동차 운송사업 차량으,2026-04-14 13:17,https://www.etoday.co.kr/news/view/2575513?trc=main_list_news,이투데이
KTX·SRT 한 열차로 묶는 '중련운행' 실시…좌석 늘고 운임 10% 할인,https://img.etoday.co.kr/crop/200/125/2321294.jpg,"국토교통부는 한국철도공사(코레일), 에스알과 함께 다음 달 15일부터 KTX와 SRT를 연결한 시범 중련운행을 시작한다고 14일 밝혔다. 승차권 예매는 15일 오전 7시부터 가능하다. 중련운행은 두 대의 열차를 하나로 연결해 운행하는 방식으로 운행 횟수를 늘리지 않고도 좌석 공급을 확대할 수 있는 것이 특징이다. 특히 이번 시범운행은 서로 다른 운영사의 열차를 연결하는 첫 사례로 운행 안전성과 이용 편의성을 함께 점검한다. 시범운행은 호남선과 경부선 일부 구간에서 시행된다. 호남선에서는 주말에 수서~광주송정 구간 일부 열차에 적용",2026-04-14 11:00,https://www.etoday.co.kr/news/view/2575438?trc=main_list_news,이투데이
중동전쟁·금리상승 이중 충격⋯주택사업 전망지수 63.7로 추락,https://img.etoday.co.kr/crop/200/125/2321358.jpg,"수도권 78.2·비수도권 60.6 동반 하락 자금조달 66.1·자재수급 79.6⋯사업여건 전방위 악화 중동 전쟁 장기화에 따른 고유가·고금리 부담과 대외 불확실성 확대로 주택사업 경기가 한 달 새 급랭했다. 특히 지방을 중심으로 미분양 누적과 수요 부진이 겹치며 사업자들의 심리가 크게 위축되는 모습이다. 14일 주택산업연구원이 주택사업자를 대상으로 설문조사한 결과, 4월 주택사업경기 전망지수는 63.7로 집계됐다. 전월보다 25.3포인트(p) 하락한 수치다. 수도권은 78.2로 16.7p 내렸고 비수도권은 60.6으로 27.1p",2026-04-14 11:00,https://www.etoday.co.kr/news/view/2575457?trc=main_list_news,이투데이
운송 차질·발주 급감...중동 전쟁에 中企 피해 618건으로,https://img.etoday.co.kr/crop/200/125/2322092.jpg,"중동전쟁 장기화로 운송 차질과 물류비 상승 등 국내 중소기업의 피해가 커지고 있다. 15일 중소벤처기업부는 이날 정오 기준 중동전쟁 관련 중소기업 피해·애로 및 우려 접수 건수가 총 618건을 기록했다고 밝혔다. 전주 대비 69건 증가했다. 피해·애로는 445건, 우려는 106건이다. 피해·애로(중복 응답)에선 운송 차질이 224건(50.3%)으로 가장 많았다. 이어 물류비 상승(164건, 36.9%), 계약 취소·보류(154건, 34.6%) 순으로 나타났다. 우려 유형에선 운송 차질(74건, 69.8%) 비중이 가장 컸다. 국가",2026-04-15 18:26,https://www.etoday.co.kr/news/view/2576132?trc=main_list_news,이투데이
"현대위아, 현대로템에 방산 매각 추진…시너지 노린다",https://img.etoday.co.kr/crop/200/125/2322206.jpg,"현대차그룹이 현대위아 방위산업 부문을 현대로템에 넘기는 방안을 검토 중이다. 방산 일원화를 통해 시너지 효과를 내기 위함으로 풀이된다. 15일 업계에 따르면 현대차그룹은 최근 현대위아의 방산 부문을 현대로템에 넘기는 사업구조 개편을 논의하고 있다. 사업 조정 논의는 계열사별 효율성 제고를 위해서다. 이관이 성사될 경우 현대로템은 현대위아가 담당하던K9자주포의 포신과 K2전차의 주포 등 핵심 화포 제조 기술을 내재화하게 된다. 부품부터 완성 장비까지 일괄 생산 체계를 구축해 외부 조달 비용을 절감하고, 납기 유연성을 확보해 방산 수",2026-04-15 18:18,https://www.etoday.co.kr/news/view/2576131?trc=main_list_news,이투데이
"국립중앙박물관-CJ나눔·문화재단, 문화다양성 교육 확산에 힘 모은다",https://img.etoday.co.kr/crop/200/125/2322195.jpg,"국립중앙박물관과 CJ나눔·문화재단이 손잡고 문화유산을 기반으로 한 문화다양성 교육 확산에 나선다. 박물관이 보유한 교육 콘텐츠와 기업 재단의 전국 단위 교육 네트워크를 결합해 어린이·청소년을 대상으로 한 체험형 교육을 확대하고, 지역 간 교육 격차 해소와 문화 향유 기회 확대를 동시에 추진한다는 구상이다. 15일 국립중앙박물관은 CJ나눔·CJ문화재단과 이날 박물관에서 문화다양성 교육 및 문화 향유 기회 확대를 위한 업무협약(MOU)을 체결했다고 밝혔다. 이번 협약은 각 기관이 보유한 플랫폼과 인프라를 연계해 문화다양성 교육 프로그",2026-04-15 17:57,https://www.etoday.co.kr/news/view/2576130?trc=main_list_news,이투데이
"코드프레소, GITEX AI ASIA ‘슈퍼노바’ 본상…한국 스타트업 최초 수상",https://img.etoday.co.kr/crop/200/125/2322177.jpg,"코드프레소가 아시아 최대 기술·AI 행사에서 한국 스타트업 최초로 본상을 수상했다. 코드프레소는 9~10일(현지시간) 싱가포르 마리나 베이 샌즈에서 열린 GITEX AI ASIA 2026 ‘슈퍼노바 챌린지’에서 본상(Winner)을 수상하고 상금 1만 싱가포르달러(약 1159만원)를 획득했다고 밝혔다. GITEX AI ASIA는 아시아 최대 규모의 기술·AI 행사 중 하나로, 올해 행사에는 2만3000명 이상의 바이어와 750여 개 기업 및 스타트업, 250명 이상의 투자자, 110개국 대표단이 참여했다. 행사 기간 동안 ASEA",2026-04-15 17:32,https://www.etoday.co.kr/news/view/2576115?trc=main_list_news,이투데이
비행기 취소되면 호텔·렌터카는 어쩌나⋯여행객 부담 더 커져,https://img.etoday.co.kr/crop/200/125/2322138.jpg,"중동 전쟁 여파로 항공유 가격이 급등하면서 국내 항공업계에 비상이 걸렸다. 일부 저비용항공사(LCC)는 노선 감축과 무급 휴직에 나섰고, 항공권 가격 상승과 항공편 취소 우려가 커지면서 소비자 불안도 확대됐다. 전문가들은 정부가 유류세 조정 등 추가 지원책을 검토해야 한다고 지적했다. 김광옥 한국항공대 항공경영학과 교수는 15일 YTN 라디오 '슬기로운 라디오생활'에서 ""지금 항공사들이 겪는 상황은 단순히 기름값만 오르는 수준이 아니라 돈 버는 구조 자체가 흔들리고 있는 상황""이라고 말했다. 김 교수는 ""항공유가 매출 원가의 30",2026-04-15 17:28,https://www.etoday.co.kr/news/view/2576062?trc=main_list_news,이투데이
"BBQ, 온두라스 진출 두 달 만에 4호점까지 확대",https://img.etoday.co.kr/crop/200/125/2322171.jpg,"제너시스BBQ그룹은 온두라스 제2도시 산페드로술라 남동부 복합 상업시설 ‘타운센터(Town Center)’에 4호점 ‘BBQ 타운센터점’을 오픈했다고 15일 밝혔다. 앞서 BBQ는 2월 산페드로술라시 마스데발 플라자에 1호점을 오픈한 이후 온두라스에서 빠르게 출점을 이어왔다. 산페드로술라는 인구 약 90만 명이 거주하는 제조·유통·무역 산업이 발달한 대표 상업 도시다. 쇼핑몰과 외식 브랜드가 밀집해 중산층 소비가 활발하며 맥도날드, 버거킹, 애플비, 서브웨이 등 글로벌 외식 브랜드가 진출해 있는 주요 시장으로 꼽힌다. BBQ 타운",2026-04-15 17:23,https://www.etoday.co.kr/news/view/2576111?trc=main_list_news,이투데이
"TV홈쇼핑, 4년째 ‘역성장’…TV시청 감소·송출수수료가 발목",https://img.etoday.co.kr/crop/200/125/2322167.jpg,"TV홈쇼핑 업계가 지난해에도 거래액 감소를 이어가며 구조적 침체 흐름을 벗어나지 못한 것으로 나타났다. TV 시청 감소와 고정비 부담이 겹치며 외형과 수익성 모두 압박을 받는 모습이다. 한국TV홈쇼핑협회는 15일 GS샵·CJ온스타일·현대홈쇼핑·롯데홈쇼핑·NS홈쇼핑·홈앤쇼핑·공영쇼핑 등 7개사의 지난해 총 거래액(취급고)이 18조5050억원으로 집계됐다고 밝혔다. 이는 전년 대비 5.1% 줄어든 수치로, 업계 외형은 4년 연속 감소세를 이어갔다. 최근 5년간 연평균 성장률은 -4.2%로, 본격적인 역성장 단계에 접어들었다는 평가다.",2026-04-15 17:22,https://www.etoday.co.kr/news/view/2576110?trc=main_list_news,이투데이
"방미심위, 사무총장에 송요훈 前 MBC 기자 임명",https://img.etoday.co.kr/crop/200/125/2322161.jpg,"방송미디어통신심의위원회는 송요훈 전 MBC 기자를 초대 방미심위 신임 사무총장으로 임명했다고 15일 밝혔다. 발령 일자는 16일이다. 송요훈 사무총장은 MBC 보도국 기자로 입사해 MBC 기자회 회장, 보도국 문화부장, 사회부장, 기획취재부장 등으로 근무했다. MBC 정상화위원회 조사실장과 아리랑국제방송 방송본부장을 역임한 바 있다. 송 총장은 MBC에 재직하는 동안 '시사매거진 2580', '카메라 출동', 발해 역사 다큐 '스위픈강, 그 슬픈 천년', 시대 다큐 '그때를 아십니까?' 등을 취재･제작했다. 한편, 이재명 대통령은",2026-04-15 17:11,https://www.etoday.co.kr/news/view/2576100?trc=main_list_news,이투데이
"네이버, Al 데이터센터 GPU 도입자금 ‘4000억’ 국민성장펀드로 저리대출 받는다",https://img.etoday.co.kr/crop/200/125/1947880.jpg,네이버가 인공지능(AI) 데이터센터(각 세종) 증설ㆍ그래픽처리장치(GPU) 서버 도입 사업에 드는 총 4000억원을 국민성장펀드로부터 저리대출을 받을 수 있게 됐다. 이를 통해 네이버는 소버린 AI를 확보하고 플랫폼을 통한 전 국민 AI를 실현하는 데 힘쓸 방침이다. 금융위원회는 15일 개최된 국민성장펀드 기금운용심의회에서 이러한 내용의 안건을 의결했다고 밝혔다. 첨단전략산업기금 3400억원과 산은 본체 600억원이 합해진 금액이다. 이번 승인사업은 네이버가 자체 거대언어모델(LLM)을 고도화하고 검색 서비스에 Al를 확대 도입하,2026-04-15 17:05,https://www.etoday.co.kr/news/view/2576102?trc=main_list_news,이투데이
"KGM, ‘최대 실적’ 넘어 수익 체질 전환 “글로벌 판매 확대 안정화 기대”",https://img.etoday.co.kr/crop/200/125/2304695.jpg,"지난해 연간 매출 4조 돌파 무쏘·토레스 등 실적 견인 KG모빌리티(KGM)가 연간 매출 4조 원을 돌파하며 창사 이래 최대 실적을 기록한 가운데, 수출 확대와 전동화 전략을 기반으로 한 글로벌 판매 증가가 향후 손익 안정화로 이어질 것이라는 전망이 나온다. 단순한 판매 회복을 넘어 수익성 중심의 사업 구조 재편이 본격화하면서 중장기 성장 궤도에 진입했다는 평가다. 15일 완성차 업계에 따르면 증권가는 KGM의 실적 개선 배경으로 전동화 차량 비중 확대와 수출 증가를 꼽고 있다. 특히 하이브리드 차량 비중이 높아질 경우 제품 믹스",2026-04-15 17:00,https://www.etoday.co.kr/news/view/2576097?trc=main_list_news,이투데이
"[BioS]셀비온, 500억 규모 CPS·CB 발행 결정",https://img.etoday.co.kr/crop/200/125/2221631.jpg,"셀비온(CellBion)은 15일 이사회를 열고 전환우선주(CPS), 전환사채(CB)를 각각 250억원 규모로 발행해 총 500억원의 자금을 조달하기로 결정했다고 공시했다. 공시에 따르면 회사는 이번 자금의 340억원을 시설자금에, 남은 160억원은 운영자금으로 사용할 계획이다. 셀비온은 제조시설(GMP) 구축, 신약의 임상개발에 집중 투입할 예정이라고 설명했다. 이번 제3자배정 유상증자와 CB 발행에는 한국투자증권, 대신증권, LS증권 등 주요 증권사와 삼호그린인베스트먼트, 현대투자파트너스 등 투자사들이 참여했다. 사모 발행하는",2026-04-15 17:00,https://www.etoday.co.kr/news/view/2576096?trc=main_list_news,이투데이
"LF 헤지스, 유기견 보호 ‘해피퍼피’ 캠페인⋯기부부터 봉사까지 [CSR, 기업의 온기㉘]",https://img.etoday.co.kr/crop/200/125/2322027.jpg,"유통·소비재 기업은 고객의 일상과 가장 가까운 곳에서 만난다. 자체 매장에서, 복합몰에서, 때론 온라인 플랫폼에서, 그 공간에서 선보인 제품 하나하나는 소비자의 일상 생활에 직접적인 영향을 미친다. 이런 이유로 이들 기업의 사회적 책임(CSR) 활동은 단순한 ESG 경영 전략을 넘어 소비자의 마음을 자연스럽게 여는 기폭제가 된다. 본지는 긴 겨울을 뚫고 따뜻한 볕이 드는 새봄(3~4월), 유통·소비재 기업들이 고객과 가장 가까운 곳에서 희망과 온기를 전하는 행보를 30회에 걸쳐 연재한다. 생활문화기업 LF의 헤지스가 브랜드 상징인",2026-04-15 17:00,https://www.etoday.co.kr/news/view/2575997?trc=main_list_news,이투데이
"PFCT, 금융 인프라 AI ‘에어팩’으로 해외 진출 본격화⋯“글로벌이 주목”",https://img.etoday.co.kr/crop/200/125/2322137.jpg,"PFCT는 금융 특화 버티컬 AI 인프라 ‘에어팩(AIRPACK)’으로 해외 확장을 본격화한다고 15일 밝혔다. 에어팩은 데이터 전처리부터 모델 개발, 전략 설계, 실행, 운영 모니터링까지 여신 전 과정을 하나의 구조로 통합한 AI 렌딩테크 인프라다. 리스크를 하나의 문제로 단순화하는 대신 여러 단위 문제로 분해하고 모듈 단위로 적용할 수 있도록 설계돼 국내외를 막론하고 각 금융기관의 상황에 맞는 단계적 도입이 가능하다. 이러한 구조는 성과로도 증명됐다. 대용량 데이터 분석 속도는 최대 30배(약 500분 → 15분) 개선됐고,",2026-04-15 16:51,https://www.etoday.co.kr/news/view/2576090?trc=main_list_news,이투데이
"과기정통부, AI분야 PM 4개로 확대…ICT R&D PM 6명 신규 위촉",https://img.etoday.co.kr/crop/200/125/2321866.jpg,"과학기술정보통신부는 대한민국의 글로벌 인공지능(AI) 3대 강국 도약을 위해 정보통신방송(ICT) 연구개발(R&D) 민간전문가(PM) 체계를 AI 중심으로 전면 개편하고, 현장 전문성을 갖춘 신규 PM 6명을 위촉한다고 15일 밝혔다. ICT R&D PM은 기술 분야별로 사업의 상시 책임 관리를 위해 △중장기 연구개발 전략 및 기술로드맵의 수립 △중대형 연구개발 사업기획 및 창의적‧도전적인 과제 발굴 △신규 후보과제 및 신규과제 관련 예산의 검토‧조정 △기술동향 조사‧분석 및 정책 자문 △연구개발 과제의 과제 기획, 진도 점검 및",2026-04-15 16:00,https://www.etoday.co.kr/news/view/2575895?trc=main_list_news,이투데이
교촌치킨 ‘차액가맹금’ 소송 다음달 첫 재판⋯소송가액 23억원,https://img.etoday.co.kr/crop/200/125/2292621.jpg,교촌치킨 점주 230여 명이 가맹본부 교촌에프앤비를 상대로 낸 차액가맹금 반환 소송의 첫 재판이 다음 달 진행된다. 15일 식품업계에 따르면 대구지법 민사합의11부는 5월 28일 오전 교촌치킨 점주들이 낸 부당이득금 반환 청구 소송의 첫 변론기일을 열 예정이다. 차액가맹금이란 가맹본부가 가맹점주에게 원·부자재를 공급할 때 도매가격에 유통 마진을 얹어 수취하는 금액이다. 이 차액이 가맹본부의 수익으로 귀속되는 구조다. 점주들은 지난해 3월 본사를 상대로 차액가맹금 반환 소송을 냈다. 초기 1인당 청구액은 100만원이었으나 이후 10,2026-04-15 15:55,https://www.etoday.co.kr/news/view/2576063?trc=main_list_news,이투데이
전기차 ‘반값 충전’ 민간까지 확대…할인 확산 속 체감은 ‘글쎄’,https://img.etoday.co.kr/crop/200/125/2322109.jpg,"전기차 충전요금 할인 정책이 공공을 넘어 민간 충전 플랫폼으로 확산하고 있다. 다만 이용자 체감은 제한적이라는 평가가 동시에 나온다. 15일 업계에 따르면 전기차 충전 플랫폼 기업 에버온은 최근 요금 체계를 개편하고 할인 적용 구간을 확대했다. 완속 충전요금은 기본 296원 수준에서 ‘그린세이브’ 적용 시 246원, 알뜰ON AI회원은 276원에서 226원까지 50원씩 낮아진다. 급속 충전 역시 조건을 충족하면 기본 296원에서 148원 수준까지 절반으로 인하된다. 해당 요금제는 16일 10시부터 적용된다. 그린세이브 요금제는 정",2026-04-15 15:55,https://www.etoday.co.kr/news/view/2576008?trc=main_list_news,이투데이
"파수AI, 보안에서 AX기업으로…조규곤 대표 “미토스로 보안 위협 현실화”",https://img.etoday.co.kr/crop/200/125/2322089.jpg,"앤스로픽의 차세대 AI 모델 ‘미토스’의 등장으로 보안 대응 방식의 근본적 변화가 요구되는 가운데 파수가 파수AI로 사명을 바꾸고 인공지능 전환(AX)에 속도를 낸다. 기업용 보안 소프트웨어를 넘어 ‘안전한 AX’를 지원하겠다는 선언이다. 15일 서울 여의도 페어몬트 앰배서더에서 열린 기자간담회에서 조규곤 파수AI 대표는 “AI는 내부 정보에 접근할 수 있는 ‘내부자’이지만 사람처럼 신뢰하긴 어렵다”며 “지금까지와는 다른 스케일, 다른 속도로 AI 에이전트를 활용한 해킹이 이뤄질 것”이라고 말했다. 이번 행사는 파수가 파수AI로",2026-04-15 15:39,https://www.etoday.co.kr/news/view/2576042?trc=main_list_news,이투데이
"[포토] 홈플러스 “아메리카노 1000원, 태국산 계란 한판 5000원대”",https://img.etoday.co.kr/crop/200/125/2322080.jpg,"홈플러스는 16일부터 22일까지 자체 브랜드(PB) '심플러스'를 중심으로 신선식품, 델리, 완구 등 다양한 카테고리 상품을 합리적인 가격에 내놓으며 고객 장바구니 부담 낮추기에 나선다고 15일 밝혔다. 먼저 ‘심플러스 아메리카노·스위트 아메리카노’는 각 1000원에 팔고, 19일부터 재고 소진 시까지 농림축산검역본부와 식약처의 위생 검사를 거친 ‘태국산 신선란(30구)’은 5890원에 대형마트 단독으로 한정 판매한다. 통통하게 살 오른 ‘서해안 꽃게(100g)’는 멤버십 특가로 반값인 990원에, ‘봉지라면·상온 시즌면’은 3개",2026-04-15 15:17,https://www.etoday.co.kr/news/view/2576033?trc=main_list_news,이투데이
"강원랜드-강원경찰청-게임물관리위원회, 불법도박 근절 위해 ‘맞손’…공동 대응체계 구축",https://img.etoday.co.kr/crop/200/125/2322073.jpg,"강원랜드가 관계기관과 협력해 불법도박 및 사행성 게임물 근절을 위한 강력한 공동 대응에 나선다. 강원랜드는 하이원그랜드호텔 연회장에서 강원경찰청, 게임물관리위원회와 ‘불법도박 대응 강화 업무협약’을 체결했다고 15일 밝혔다. 이날 협약식에는 남한규 강원랜드 대표이사 직무대행, 박재현 강원경찰청 공공안전부장, 서태건 게임물관리위원회 위원장 등 주요 관계자 23명이 참석했다. 이번 협약은 기관 간 긴밀한 협력체계를 구축해 갈수록 확산하는 불법도박을 방지하고 건전한 사회문화를 조성하기 위해 마련됐다. 협약에 따라 세 기관은 앞으로 △불",2026-04-15 15:09,https://www.etoday.co.kr/news/view/2576027?trc=main_list_news,이투데이
"금호타이어, ‘타이어프로 플러스’ 출시…구매·관리 통합 플랫폼 전환",https://img.etoday.co.kr/crop/200/125/2322067.jpg,"금호타이어는 기존 ‘타이어프로 온라인몰’을 리뉴얼하고 멤버십을 결합한 O2O 서비스 ‘타이어프로 플러스(TIREPRO+)’를 출시했다고 15일 밝혔다. 타이어프로 플러스는 타이어 구매부터 장착, 사후 관리까지 전 과정을 하나의 흐름으로 연결한 통합 플랫폼이다. 온라인에서 제품을 선택하면 전국 타이어프로 매장 네트워크와 연계해 장착과 관리 서비스를 제공하는 구조다. 특히 △당일·휴일 장착 △타이어 보관 △교체 대행 등 편의 서비스를 강화해 고객 접근성을 높였다. 구매 이후에는 상시 할인과 함께 공기압·마모도 점검 등 ‘6대 무상 점",2026-04-15 15:01,https://www.etoday.co.kr/news/view/2576026?trc=main_list_news,이투데이
"네이버, 달러·유로 그린본드 동시 발행 성공…첫 유로화 채권 발행해 유럽 투자자 기반 확대",https://img.etoday.co.kr/crop/200/125/2052593.jpg,"네이버는 달러화와 유로화로 동시 발행되는 글로벌 그린본드(Green Bond) 발행에 성공했다고 15일 밝혔다. 이는 네이버 최초의 유로화 채권 발행인 동시에 2021년 이후 약 5년만의 달러화 채권 발행이다. 이번 발행은 달러화 채권과 유로화 채권, 총 2개로 구성됐다. 달러화 채권은 5년 만기 5억 달러로 유로화 채권은 7년 만기 5억 유로로 발행됐다. 이는 약 11억 달러(약 1조 6212억원) 규모로, 국내 민간기업의 달러화 및 유로화 채권 동시 발행 사례는 2020년 이후 약 6년 만이다. 특히 유로화 7년물은 국내 민간",2026-04-15 14:57,https://www.etoday.co.kr/news/view/2576020?trc=main_list_news,이투데이
"코트라, 전쟁 대응 수출 지원 총력…500개사 바우처 확대",https://img.etoday.co.kr/crop/200/125/2322055.jpg,긴급바우처 255억원 투입…지원 대상 22개국 확대 물류·바이어 대응 현장 지원 강화…13개 무역관 총동원 중동 전쟁 장기화로 수출기업 피해가 확대되자 대한무역투자진흥공사(코트라)가 긴급 지원을 대폭 확대한다. 물류 차질과 바이어 단절 등 현장 리스크를 최소화하기 위한 ‘전방위 대응 체계’ 가동이다. 산업통상부와 코트라는 전쟁 대응 추경 1조980억원을 활용해 수출기업 지원 사업을 확대 시행한다고 15일 밝혔다. 코트라는 본사와 중동·북미·서남아·CIS 본부를 연결해 제18차 긴급대응 TF 회의를 열고 지원 실행력을 점검했다. 우,2026-04-15 14:57,https://www.etoday.co.kr/news/view/2576019?trc=main_list_news,이투데이
"롯데바이오로직스, ADC 플랫폼 ‘솔루플렉스 링크’ 연구 성과 AACR 발표",https://img.etoday.co.kr/crop/200/125/2322032.jpg,"롯데바이오로직스는 이달 17일부터 22일까지 미국 샌디에이고에서 열리는 ‘미국암연구학회(AACR 2026)’에서 항체약물접합체(ADC) 플랫폼 ‘솔루플렉스 링크(SoluFlex Link)’ 관련 연구 결과를 공개한다고 15일 밝혔다. AACR은 미국임상종양학회(ASCO), 유럽종양학회(ESMO)와 함께 세계 3대 암학회로 손꼽히며, 전 세계 암 연구 분야 전문가 및 업계 관계자들이 모여 항암 치료 및 신약과 관련한 다양한 논의를 진행하는 학술대회다. 롯데바이오로직스는 카나프테라퓨틱스와 공동 개발한 ‘솔루플렉스 링크’ 기술을 적용한",2026-04-15 14:17,https://www.etoday.co.kr/news/view/2575999?trc=main_list_news,이투데이
