title,thumbnail,short_content,write_time,link,company
"[AD] 고성능 브랜드 N 10주년…현대차, N 고객 프로모션 시행",https://img.etoday.co.kr/crop/200/125/2142944.jpg,"아반떼 N, 아이오닉 5 N 출고 고객 대상 추첨 통해 다양한 체험 기회 제공 뉘르부르크링 24시 내구레이스, HMG 드라이빙 익스피리언스 센터 초청 예정 전국 드라이빙 라운지 10곳에서 N 차량 시승할 수 있는 투게더 시승 이벤트 운영 현대자동차는 고성능 브랜드 ‘N’의 출범 10주년을 맞아 다양한 고객 프로모션을 진행한다고 4일 밝혔다. 현대차는 2015년 9월 프랑크푸르트 모터쇼에서 고성능 브랜드 ‘N’을 최초 공개했으며, 아반떼 N과 아이오닉 5 N을 출시하는 등 10년간 고성능차 대중화를 위해 노력해왔다. 이번 ‘N’ 1",2025-03-04 13:29,https://www.etoday.co.kr/news/view/2449582?trc=main_list_news,이투데이
"삼성전자 하만, 신임 대표에 ‘크리스천 소봇카’ 사장…“전장 사업 가속화”",https://img.etoday.co.kr/crop/200/125/2142886.jpg,"하만, 5년만에 수장 교체 25년 車 전문가, 사업 속도 삼성전자 전장 자회사 하만이 5년 만에 수장을 교체했다. 크리스천 소봇카 전장부문(Automotive) 사장이 지휘봉을 잡는다. 그는 25년간 자동차 업계에 몸담아온 만큼 향후 하만의 전장 사업에 탄력이 붙을 것으로 기대된다. 4일 업계에 따르면 하만 인터네셔널은 다음 달 1일부로 소봇카 사장을 신임 대표로 선임한다. 이에 기존 마이클 마우저 대표는 2020년 대표 취임 이후 5년만에 물러나게 됐다. 마우저 대표는 27년간 하만에 재직하며 코로나19 팬데믹, 글로벌 반도체",2025-03-04 12:56,https://www.etoday.co.kr/news/view/2449549?trc=main_list_news,이투데이
"이연제약, 유전자치료제 플라스미드 DNA 공급 계약 체결",https://img.etoday.co.kr/crop/200/125/2142917.jpg,"이연제약은 지난달 28일 국내 바이오의약품 개발사와 유전자치료제 플라스미드 DNA 공급계약을 체결했다고 4일 밝혔다. 이번 계약은 단회성이 아니라 장기적으로 다양한 플라스미드 DNA를 공급한다는 내용을 담고 있다. 해당 DNA는 이연제약 충주바이오공장에서 생산한다. 플라스미드 DNA는 유전자치료제의 원료로 사용되며, 세포 및 유전자 치료제 개발 확대와 함께 시장 수요가 지속해서 증가하고 있다. 계약 상세조건과 고객사 등은 비밀유지 조항에 따라 양사 합의하에 공개하지 않기로 했다.",2025-03-04 12:38,https://www.etoday.co.kr/news/view/2449568?trc=main_list_news,이투데이
"법원, 홈플러스 기업회생절차 개시 결정…現 공동대표 체제 유지",https://img.etoday.co.kr/crop/200/125/2140467.jpg,"서울회생법원은 4일 오전 홈플러스가 신청한 기업회생절차에 대해 개시 결정을 내리고, 별도의 관리인 선임 없이 현재 홈플러스 공동대표 체제를 유지하기로 결정했다. 이번 회생절차 개시 결정은 사업성과 경쟁력 등 홈플러스의 펀더멘탈(Fundamental)에는 문제가 없다는 판단에 따른 것. 법원은 특히 신속한 회생절차 개시를 통해 조기에 안정을 되찾을 수 있도록 할 필요성이 있다는 부분에 공감해 회생절차 결정을 내린 것으로 알려졌다. 회생절차가 개시 됨에 따라 홈플러스의 금융채권 상환은 유예되지만, 협력업체와의 일반적인 상거래 채무는",2025-03-04 12:05,https://www.etoday.co.kr/news/view/2449561?trc=main_list_news,이투데이
'1만 원대' 5G 20GB 알뜰폰 요금제 출시 봇물,https://img.etoday.co.kr/crop/200/125/2142874.jpg,"과기정통부 ""저렴·다양한 알뜰폰 요금제 출시 기대"" 알뜰폰 업계에서 1만 원대 5G 20기가바이트(GB) 요금제가 출시가 이어지고 있다. 4일 과학기술정보통신부에 따르면 스마텔과 큰사람커넥트 등 도매제공의무사업자(SK텔레콤)의 망을 사용하는 중소 알뜰폰 사업자를 중심으로 1만 원대 5G 20GB 요금제가 출시되고 있다. 스마텔의 5G스마일플러스20GB 요금제는 1만 9800원에 음성, 문자를 기본 제공한다. 큰사람커넥트의 5G함께이야기해S 요금제는 음성 200분에 문자를 100건 제공한다. 또 ’우체국500분20G‘ 요금제(1만 9",2025-03-04 12:00,https://www.etoday.co.kr/news/view/2449553?trc=main_list_news,이투데이
"선관위 ""국민께 깊이 사과…국회 통제방안 마련에 적극 참여""",https://img.etoday.co.kr/crop/200/125/2118595.jpg,"""책임 통감…감사원 직무감찰 대상 제외돼도 외부 통제 베제는 아냐"" 중앙선거관리위원회는 4일 지난달 27일 감사원이 발표한 선관위 직무감찰 결과에 따른 일부 고위직 자녀 경력채용의 문제와 복무기강 해이 등과 관련해 ""국민 여러분께 다시 한번 깊이 사과드린다""고 밝혔다. 선관위는 이날 입장문을 통해 이같이 밝히며 ""감사원의 직무감찰이 종료되지 않아 징계 절차가 중단됐던 직원들에 대해서는 관련 규정에 따라 신속하고 엄중하게 조치할 예정""이라며 덧붙였다. 선관위는 또 ""국민의 믿음과 기대에 미치지 못한다면 공정과 신뢰가 생명인 선관위에",2025-03-04 17:15,https://www.etoday.co.kr/news/view/2449713?trc=main_list_news,이투데이
"여야, 6일 최상목 뺀 협의회 개최…추경·연금개혁 논의",https://img.etoday.co.kr/crop/200/125/2143105.jpg,"여야가 최상목 대통령 권한대행 겸 부총리를 제외한 여야 협의회를 이달 6일 개최하기로 합의했다. 박성준 더불어민주당 원내수석부대표는 4일 국회에서 국회의장 주재 여야 원내대표 회동 후 기자들과 만나 “최상목 대행이 마은혁 헌법재판관 후보자를 임명하지 않는 것은 헌법을 무시하는 것이기 때문에 협상테이블에 앉는 것이 맞지 않다”고 밝혔다. 이어 “여야가 의장과 함께 여야 원내대표, 양당 수석, 정책위의장이 만나는 여야 협의회를 신속하게 개최하자고 하는데 합의했다”고 덧붙였다. 이날 여야는 연금개혁특별위원회 구성과 관련해선 우원식 국회",2025-03-04 17:14,https://www.etoday.co.kr/news/view/2449712?trc=main_list_news,이투데이
"野 “상법 개정안, 다음 본회의서 반드시 상정해달라”",https://img.etoday.co.kr/crop/200/125/2143104.jpg,더불어민주당은 우원식 국회의장을 향해 이사의 충실의무를 ‘회사’에서 ‘주주 전체’로 확대하는 상법 개정안의 본회의 상정을 재차 촉구했다. 오기형 민주당 ‘대한민국 주식시장 활성화 태스크포스’(국장부활TF) 단장은 4일 국회에서 열린 ‘주주 권익 보호를 위한 투자자 시민사회 간담회’에서 “상법 개정안의 본회의 상정 자체를 반대하는 것은 아니라고 했으니 다음 본회의에선 반드시 상정해달라”고 우 의장에 요청했다. 진성준 정책위의장은 “윤석열 대통령은 지난해 1월 22일 한국거래소를 방문해 소액주주의 이익을 반영할 수 있도록 상법을 개정,2025-03-04 17:12,https://www.etoday.co.kr/news/view/2449710?trc=main_list_news,이투데이
"가스공사 ""2024년 흑자 전환은 전사적인 노력의 결실""",https://img.etoday.co.kr/crop/200/125/2141408.jpg,요금 부담 완화 노력·해외사업 성과·경영 효율화 등 복합 작용 안정적인 천연가스 공급 위해 민수용 미수금 14조 원 해소 절실 한국가스공사가 지난해 당기순이익이 1조1490억 원을 기록하며 큰 폭으로 흑자 전환한 것은 2023년의 적자를 만회하기 위한 전사적인 노력에 힘입은 결과라고 밝혔다. 이어 안정적인 천연가스 공급을 위해 민수용 미수금 14조 원 해소가 절실하다고 강조했다. 가스공사는 4일 이런 내용을 담은 보도자료를 통해 국제 정세 급변과 에너지 위기 일상화로 가중된 국민 가스 요금 부담을 완화하기 위해 전방위적인 활동을,2025-03-04 16:50,https://www.etoday.co.kr/news/view/2449700?trc=main_list_news,이투데이
"[속보] 선관위 ""국민께 깊이 사과…국회 통제방안 마련에 적극 참여""",https://img.etoday.co.kr/crop/200/125/1990411.jpg,,2025-03-04 16:49,https://www.etoday.co.kr/news/view/2449699?trc=main_list_news,이투데이
"[속보] 여야, 6일 최상목 제외 여야 협의회 개최",https://img.etoday.co.kr/crop/200/125/1990411.jpg,,2025-03-04 16:47,https://www.etoday.co.kr/news/view/2449697?trc=main_list_news,이투데이
이재명표 ‘K-엔비디아’ 논란 일파만파...“사회주의” “극우문맹”,https://img.etoday.co.kr/crop/200/125/2142596.jpg,"與 “기업가 정신 흔드는 위험한 발상” 이재명 “극우 문맹 수준” 반박 유승민 “기업가 정신에 대한 초보적 이해도 없어” 이준석 “AI 대박론 심취...위험한 경제관” 이재명 더불어민주당 대표가 ‘한국판 엔비디아’ 설립을 가정해 ‘이 기업 지분이 70% 민간·30% 국민으로 구성되면 세금에 의존하지 않아도 된다’고 한 발언 때문에 정치권이 떠들썩하다. 4일 국민의힘이 이 대표의 발언을 “사회주의적 접근”이라며 공세를 이어가자, 이 대표는 “극우 본색에 문맹 수준의 식견”이라며 맞받아쳤다. 이후 유승민 전 의원, 이준석 개혁신당 의",2025-03-04 16:40,https://www.etoday.co.kr/news/view/2449691?trc=main_list_news,이투데이
"남부발전, 200MWh급 BESS 사업으로 미국 텍사스 전력시장 첫 진출",https://img.etoday.co.kr/crop/200/125/2143074.jpg,"한국남부발전이 공기업 최초로 미국 에너지 신산업 분야에 진출한다. 남부발전은 지난달 27일 미국 텍사스주에서 추진 중인 200MWh(메가와트시)급 대용량 BESS(배터리에너지저장장치) 사업을 위한 투자구도를 확정하고, 주주사간 협약을 체결했다고 4일 밝혔다. 남부발전이 미국 제3호 사업으로 추진하는 이번 루틸 BESS 사업은 공기업 최초로 미국 대용량 BESS 시장에 진출한 사례로 배터리를 활용해 전력거래를 하는 사업이다. 남부발전 관계자는 ""기존의 가스복합 위주의 전통 발전사업에서 배터리를 활용한 미래 전략산업 분야로의 확장을",2025-03-04 16:33,https://www.etoday.co.kr/news/view/2449686?trc=main_list_news,이투데이
중도 겨냥한 李의 감세 카드…‘포퓰리즘’ 비판 넘을까,https://img.etoday.co.kr/crop/200/125/2143058.jpg,"野, 6일 근로소득세 과세 합리화 토론회 상속세 개편 이어 근로소득세 개편 추진 “2년 연속 세수 부족…87조 원 덜 걷혀"" “세제 확보 계획 없어 걸림돌 될 수 있어” 이재명 더불어민주당 대표가 조기 대선을 앞두고 중도층을 겨냥한 감세 드라이브에 나서고 있다. 상속세 개편과 근로소득세 개편에 이어 부동산 세제도 현행안을 유지하겠다는 의사를 내비쳤다. 다만 정치권 안팎에선 세수 결손이 지속 중인 상황에서 증세 대안이 없는 감세 추진은 포퓰리즘이 될 수 있다는 비판이 나온다. 4일 정치권에 따르면 민주당 조세금융포럼은 이달 6일 근",2025-03-04 16:29,https://www.etoday.co.kr/news/view/2449673?trc=main_list_news,이투데이
"한전, 올해 신입 정규직 700명·체험형 인턴 900명 등 1600개 일자리 창출",https://img.etoday.co.kr/crop/200/125/2143071.jpg,한국전력이 올해 신입 정규직 올해 신입 정규직 700명·체험형 인턴 900명을 채용하는 등 1600개 일자리를 만든다. 한전은 11일부터 상반기 대졸수준 공채(310명) 지원서 접수를 시작한다고 4일 밝혔다. 올해 정규직 700명 채용은 전년 대비 20% 이상 증가한 인원이며 2022년 이후 최대 채용 규모다.,2025-03-04 16:25,https://www.etoday.co.kr/news/view/2449683?trc=main_list_news,이투데이
