title,thumbnail,short_content,write_time,link,company
"온코닉테라퓨틱스, 항암신약 후보물질 ‘네수파립’ 난소암 임상 2상 승인",https://img.etoday.co.kr/crop/200/125/2284252.jpg,"온코닉테라퓨틱스의 항암신약 후보물질 ‘네수파립’이 췌장암, 자궁내막암에 이어 난소암으로 임상 2상에 돌입한다. 온코닉테라퓨틱스는 차세대 합성치사 이중표적 항암신약 후보물질 네수파립의 신규 적응증인 난소암에 대한 2상 임상시험계획(IND)을 식품의약품안전처로부터 승인받았다고 20일 밝혔다. 이에 따라 온코닉테라퓨틱스는 세브란스병원을 포함한 국내 주요 상급종합병원에서 환자 등록 및 투약 준비에 돌입한다. 특히 이번 임상에서는 기존 난소암에 대한 표준치료 가이드라인에는 없던 재유지요법이라는 새로운 표준치료 적응증을 창출하기 위한 연구가",2026-01-20 17:07,https://www.etoday.co.kr/news/view/2547515?trc=main_list_news,이투데이
"메르세데스-벤츠 '올-뉴 일렉트릭 CLA', 유럽 안전도 평가 '최고 등급'",https://img.etoday.co.kr/crop/200/125/2284244.jpg,메르세데스-벤츠는 전동화 세단 ‘디 올-뉴 일렉트릭 CLA’가 유럽 신차 안전도 평가 프로그램 'Euro NCAP'에서 최고 등급인 별 다섯 개를 획득했다고 20일 밝혔다. 특히 지난해 평가를 받은 전체 차량 가운데 가장 높은 점수를 기록하며 ‘가장 안전한 차’로 선정됐다. 이번 평가에서 디 올-뉴 일렉트릭 CLA는 △성인 탑승자 보호 △어린이 탑승자 보호 △보행자 보호 △안전 기술 등 네 개 부문 전반에서 고르게 높은 점수를 받았다. 단일 항목이 아닌 전 영역에서 최고 수준의 안전성을 입증했다는 평가다. 이번 성과로 CLA는 ‘,2026-01-20 17:02,https://www.etoday.co.kr/news/view/2547512?trc=main_list_news,이투데이
"코스맥스, ‘맞춤형 컬러 솔루션’으로 日 베이스 메이크업 수요 공략",https://img.etoday.co.kr/crop/200/125/2284246.jpg,日 최대 뷰티 박람회 ‘코스메위크’ 참가 맞춤형 컨설팅 ‘셰이드 아틀라스’ 시스템 소개 글로벌 화장품 ODM(연구·개발·생산) 기업 코스맥스가 일본 최대 뷰티 박람회에서 기초와 색조를 아우르는 융합 전략으로 주목받았다. 코스맥스재팬은 14~16일까지 일본 도쿄 빅사이트에서 개최된 ‘코스메위크 도쿄 2026’ 부스 전시를 성료했다고 20일 밝혔다. 코스맥스재팬은 일본 최대 규모 뷰티 전시회인 코스메위크에서 코스맥스의 글로벌 컬러 트렌드 연구 능력을 강조한 ‘셰이드 아틀라스(Shade Atlas)’를 전면에 내세웠다. 셰이드 아틀라스,2026-01-20 17:01,https://www.etoday.co.kr/news/view/2547511?trc=main_list_news,이투데이
"강추위 녹이는 ‘러닝 열풍’…기능성 갖춘 애슬레저 브랜드, 계절 무관 매출↑",https://img.etoday.co.kr/crop/200/125/2284211.jpg,"국내 패션 시장에서 새로운 ‘캐시카우’로 떠오른 러닝 의류와 신발 수요가 계속 늘면서 애슬레저 브랜드가 조용히 웃고 있다. 계절을 막론하고 러닝 열풍이 꾸준히 이어지면서 기능성과 디자인을 모두 잡은 애슬레저 브랜드에 대한 소비자 수요는 더욱 늘어날 전망이다. 20일 패션업계에 따르면 글로벌 애슬레저 브랜드 젝시믹스의 러닝 컬렉션 ‘RX’이 지난해 약 200억 원의 매출을 기록했다. 젝시믹스가 RX를 론칭한 것은 2024년 7월로, 출시 1년 만에 누적 매출 100억 원을 돌파한 데 이어 작년 한 해 동안에만 200억 원의 매출을",2026-01-20 17:00,https://www.etoday.co.kr/news/view/2547490?trc=main_list_news,이투데이
AI 스타트업 모티프∙트릴리온랩스…‘독파모’ 재도전한다,https://img.etoday.co.kr/crop/200/125/2284238.jpg,"네이버클라우드, NC AI, 카카오가 과학기술정보통신부의 ‘독자 AI 파운데이션 프로젝트’ 추가 선발전 불참 의사를 밝힌 가운데 국내 인공지능(AI) 스타트업 2곳이 패자부활전에 도전한다. 20일 모티프테크놀로지스는 보도자료를 통해 독파모 추가 공모에 적극 참여할 예정이라고 밝혔다. 이는 탈락 팀 가운데 패자부활전 참여를 공개적으로 밝힌 첫 사례다. 모티프가 지난해 11월 자체 개발한 대규모언어모델(LLM) '모티프 12.7B'는 글로벌 AI 모델 성능을 종합 평가하는 '아티피셜 애널리시스' 인텔리전스지수(AAII)에서 675B에",2026-01-20 16:59,https://www.etoday.co.kr/news/view/2547508?trc=main_list_news,이투데이
"리비아, CJ대한통운에 대수로공사 '3조9000억' 황당한 맞소송",https://img.etoday.co.kr/crop/200/125/2171846.jpg,"CJ대한통운이 2000년대 초 리비아대수로 공사를 위해 납입한 보증금을 돌려달라고 요구한 가운데, 리비아 정부가 되레 하자 보수가 있다며 비용을 달라고 맞소송을 제기했다. CJ대한통운은 리비아대수로청이 지난해 26억9761만719달러(한화 약 3조8999억 원)를 보상하라는 중재 신청을 프랑스 소재 국제상업회의소에 냈다고 20일 공시했다. 리비아대수로청은 1983년 시작된 리비아대수로 공사의 하자가 있다고 주장했다. 1983년과 1990년 각각 착공한 리비아대수로 1, 2단계 공사의 하자 파이프 교체 비용, 대수로 운영불능에 따른",2026-01-20 16:58,https://www.etoday.co.kr/news/view/2547507?trc=main_list_news,이투데이
"설화수, 영국 온라인 플랫폼 ‘컬트 뷰티’ 공식 입점",https://img.etoday.co.kr/crop/200/125/2284233.jpg,"글로벌 럭셔리 뷰티 브랜드 설화수가 영국의 대표적인 온라인 뷰티 플랫폼 ‘컬트 뷰티(Cult Beauty)’에 공식 입점했다고 20일 밝혔다. 설화수는 전략적 거점인 영국을 발판으로 유럽 시장 공략을 본격화하며, 글로벌 성장 기반을 단계적으로 강화해간다는 계획이다. 영국은 뷰티 문화와 브랜드 가치에 대한 이해도가 높은 럭셔리 소비자층이 형성된 시장으로, 유럽과 중동을 잇는 전략적 허브로 평가된다. 설화수는 컬트 뷰티를 첫 파트너로 선정해 현지 고객과의 소통을 강화하고, 유럽 전역으로 이어지는 브랜드 확장 기반을 다질 계획이다. 설",2026-01-20 16:56,https://www.etoday.co.kr/news/view/2547505?trc=main_list_news,이투데이
"정부, 의대 증원 '2037년 부족 의사 2530명~4800명' 기반 논의",https://img.etoday.co.kr/crop/200/125/2277990.jpg,"정부가 2037년 기준 부족한 의사 수를 2500명에서 4800명 수준으로 추계해 의과대학 정원 증원 논의를 이어가기로 했다. 20일 연합뉴스에 따르면 보건복지부는 서울 서초구 국제전자센터에서 제4차 보건의료정책심의위원회(보정심)를 열고 2027학년도 이후 의사인력 양성 규모와 의과대학 교육여건을 논의했다. 보정심은 정부와 의료 공급자·수요자 단체, 전문가 등이 참여하는 보건의료 정책 심의기구로, 지난해 출범한 의사인력 수급추계위원회의 추계 결과를 토대로 의대 정원을 심의하고 있다. 이날 보정심은 추계위가 제시한 12개 수요·공급",2026-01-20 21:35,https://www.etoday.co.kr/news/view/2547578?trc=main_list_news,이투데이
"李대통령, 카타르 국왕과 통화…방산·에너지 협력 확대 논의",https://img.etoday.co.kr/crop/200/125/2284316.jpg,"취임 이후 두 번째 이재명 대통령이 20일 타밈 빈 하마드 알사니 카타르 국왕과 전화 통화를 갖고 국방·방산·에너지 등 전략 분야 협력 확대 방안을 논의했다고 연합뉴스가 보도했다. 두 정상 간 통화는 취임 이후 두 번째다. 김남준 청와대 대변인은 서면 브리핑에서 “이 대통령은 카타르와의 협력 지평을 국방·방산, 에너지, 인프라 등으로 넓혀가길 기대한다는 뜻을 전했다”고 밝혔다. 이 대통령은 또 중동 지역 분쟁 조정 과정에서 카타르가 보여온 역할을 언급하며 “국제 정세 안정을 위한 카타르의 책임 있는 기여에 주목하고 있다”고 말했다",2026-01-20 20:42,https://www.etoday.co.kr/news/view/2547576?trc=main_list_news,이투데이
"조현 외교부 장관, 21일 튀르키예 방문…원전·방산·에너지 협력 논의",https://img.etoday.co.kr/crop/200/125/2284312.jpg,"튀르키예 일정 후 벨기에로 이동 제2차 한·EU 외교장관 전략대화 개최 조현 외교부 장관이 21일부터 24일까지 튀르키예와 벨기에를 잇달아 방문한다고 연합뉴스가 20일 보도했다. 이번 순방은 지난해 11월 대통령의 튀르키예 국빈 방문 후속 조치 성격으로, 전략산업 협력을 구체화하는 논의가 이뤄질 전망이다. 이문배 외교부 부대변인은 정례브리핑에서 조 장관이 21일 튀르키예에서 하칸 피단 외교장관과 회담한다고 전했다. 그는 “원자력발전소·방산·바이오·인프라 등 주요 협력 사업의 진척 상황을 점검하고 향후 협력 방향을 논의할 계획”이라",2026-01-20 20:11,https://www.etoday.co.kr/news/view/2547573?trc=main_list_news,이투데이
"국조특위, 무안공항 제주항공 참사 현장조사…진상규명 ‘첫발’",https://img.etoday.co.kr/crop/200/125/2284309.jpg,"22일 청문회·27일 결과보고서 채택 예정 국회 국정조사특별위원회가 12·29 제주항공 여객기 참사와 관련해 무안국제공항을 방문하며 본격적인 현장 조사에 나섰다. 20일 연합뉴스에 따르면 국조특위 위원들은 무안공항 관리동 회의실에서 사고 경위와 조사 진행 상황에 대한 브리핑을 들은 뒤, 공항 시설 곳곳을 점검했다. 이날 조사에는 특위 위원과 보좌진, 유가족, 법률지원단 등 100여 명이 동행했다. 위원들은 사고 상황실과 관제실을 차례로 둘러보며 사고 시점의 관제 동향과 시스템 운영 실태를 확인했다. 오후에는 조류 충돌 대응 현장을",2026-01-20 19:53,https://www.etoday.co.kr/news/view/2547571?trc=main_list_news,이투데이
"임이자 ""대구·경북 통합, 지방시대 전환점…특별법·재정 지원 약속""",https://img.etoday.co.kr/crop/200/125/2237555.jpg,"임이자 국회 재정경제기획위원회 위원장은 20일 발표된 대구·경북 행정통합 추진 합의에 적극 환영한다는 입장을 밝혔다. 임이자 위원장은 이날 자신의 SNS에 “대구와 경북의 행정통합을 중단 없이 추진하기로 합의하고, 관련 절차를 신속히 진행하기로 한 결단을 진심으로 환영한다”며 “지방소멸 위기와 수도권 집중이 심화하는 지금 대구·경북 통합은 낙후된 지역 발전의 새로운 전환점이자 진정한 지방시대로 나아가기 위한 피할 수 없는 과제”라고 말했다. 이어 “이 과정에서 통합 논의를 끊임없이 이어오며 지역의 미래를 위해 헌신해 오신 이철우",2026-01-20 17:48,https://www.etoday.co.kr/news/view/2547544?trc=main_list_news,이투데이
"복기왕·권영진, ‘원도심 특별법’ 여야 공동발의…“원도심 살려야 균형발전”",https://img.etoday.co.kr/crop/200/125/2085634.jpg,"복기왕 더불어민주당 의원과 권영진 국민의힘 의원은 노후화된 원도심의 주거환경 개선과 도시 기능 회복을 위한 '원도심 정비 및 지원에 관한 특별법안'을 공동 대표발의했다고 20일 밝혔다. 분당·일산 등 1기 신도시를 대상으로 한 노후계획도시법의 정책 사각지대에 놓였던 원도심을 지원 대상으로 포함해 건축 규제 완화와 조세 감면 등을 통해 재정비 사업에 속도를 내겠다는 취지다. 법안은 원도심 정비사업에 대해 용적률을 최대 200%까지 상향하고, 건폐율·높이 제한 완화, 광역교통개선대책 수립, 각종 부담금과 법인세·취득세 감면 등의 특례",2026-01-20 17:33,https://www.etoday.co.kr/news/view/2547537?trc=main_list_news,이투데이
"이준석 “장동혁 특검 투쟁, 진정성 의심할 이유 없다…공조 논의”",https://img.etoday.co.kr/crop/200/125/2280720.jpg,"“천하람의 예리함·장동혁의 묵직함…야당 투쟁의 두 축” “귀국 후 장동혁 만나 야권 공조 강화 논의” 이준석 개혁신당 대표는 20일 장동혁 국민의힘 대표의 특검 촉구 단식과 관련해 “장 대표의 특검 통과를 향한 진정성에 어떤 의심을 할 이유도 없다”며 야권 공조의 필요성을 강조했다. 이 대표는 이날 페이스북에 올린 글에서 “누군가가 극단적인 수단에 의존할 때, 그것은 육신의 고달픔으로 자신의 진정성을 드러내 보이려는 것”이라며 이같이 밝혔다. 이어 “장동혁 대표가 만든 무거운 정국 아래에서 정치권의 모든 인사는 자신의 말 한마디",2026-01-20 17:22,https://www.etoday.co.kr/news/view/2547529?trc=main_list_news,이투데이
아침밥 거르는 이유는 ‘시간·소화·체중 관리’…건강 부담에 ‘천원의 아침밥’ 수요 증가,https://img.etoday.co.kr/crop/200/125/2284258.jpg,"농정원 트렌드 분석, 아침 결식은 개인 선택 아닌 구조적 문제 대학 밀집 지역서 온라인 언급량 집중…정책 확대 요구 뚜렷 아침 식사를 거르는 현상이 개인의 생활 습관이나 의지 문제가 아니라 시간 부족과 건강 부담, 생활 환경이 복합적으로 작용한 결과라는 분석이 나왔다. 특히 쌀 기반 아침 식사를 1000원에 제공하는 ‘천원의 아침밥’ 사업이 이러한 구조적 결식을 완화하는 정책 수단으로 기능하며, 온라인상에서도 확대 필요성이 뚜렷하게 확인됐다. 농림수산식품교육문화정보원은 21일 ‘천원의 아침밥 확대’를 주제로 온라인 언급량과 주요",2026-01-20 17:17,https://www.etoday.co.kr/news/view/2547522?trc=main_list_news,이투데이
"여름배추 수급 불안 선제 대응…정부, 병해충 방제·비상물량 총력",https://img.etoday.co.kr/crop/200/125/2284257.jpg,"농식품부, 관계기관 협의회 열고 생산·공급 안정 대책 점검 강원 고랭지 재배 여건 악화에 면적 감소…공적방제·농자재 지원 확대 여름철 배추 수급 불안을 사전에 차단하기 위해 정부가 관계기관과 함께 생산·공급 안정 대책 점검에 나섰다. 폭염과 집중호우 등 이상기상과 고랭지 연작에 따른 병해충 확산으로 재배 여건이 악화되자 방제부터 농자재 지원, 비상공급물량 확보까지 전방위 대응에 나선 것이다. 박정훈 농림축산식품부 식량정책실장은 20일 여름배추 안정생산을 위한 관계기관·단체 협의회를 열고, 4월부터 본격 재배되는 여름배추의 생산·공",2026-01-20 17:00,https://www.etoday.co.kr/news/view/2547367?trc=main_list_news,이투데이
군 조직 대수술…'합동작전사 창설·드론작전사령부 폐지' 권고,https://img.etoday.co.kr/crop/200/125/2198510.jpg,"드론작전사령부의 작전권을 없애고, 합동참모본부(합참)의 전시작전통제권을 신설 합동작전사령부(합동작전사)로 이양하는 방안이 제시됐다. 20일 민관군 합동 특별자문위원회 미래전략 분과위원회가 국방부에 권고한 방안에는 드론작전사령부는 육·해·공군 및 해병대와의 기능 중복에 따른 비효율을 고려해 폐지하는 내용이 담겼다. 각 군에서 드론 관련 작전 개념을 발전시키고 소요도 제기하는 상황을 고려하면, 통합소요 발굴 등 업무를 담당하는 기능사령부만 있어도 된다는 게 분과위 판단이다. 분과위의 권고를 국방부가 수용하면 '평양무인기' 사건으로 논",2026-01-20 16:42,https://www.etoday.co.kr/news/view/2547493?trc=main_list_news,이투데이
