title,thumbnail,short_content,write_time,link,company
"[단독] 李 'AI 3강' 시동… 정부, 아태 AI 허브 마스터플랜 착수",https://img.etoday.co.kr/crop/200/125/2284160.jpg,"정부, ‘아태 AI 허브’ 마스터플랜 용역…상반기 실증체계 구축 GPU·데이터센터 확보전 격화…규제 예측가능성이 입지 좌우 정부가 '아태 인공지능(AI) 허브' 구상을 실제 실행 단계로 옮기기 위한 설계 작업에 본격 착수했다. 미국·유럽 등 주요국이 컴퓨팅 자원과 제도 특례, 자금 지원을 패키지로 묶어 글로벌 기업·인재를 끌어들이는 '소버린 AI' 경쟁이 본격화한 가운데 우리나라도 기존 특구 틀을 넘어서는 집적(集積) 모델 구축에 속도를 낼 계획이다. 20일 본지 취재에 따르면 정보통신산업진흥원은 전날 'AI 특화지구 조성 마스터",2026-01-21 05:00,https://www.etoday.co.kr/news/view/2547452?trc=main_list_news,이투데이
“결과가 아니라 과정이 잣대”… ‘기준·기록’이 신뢰 가른다 [이사회의 역설 下],https://img.etoday.co.kr/crop/200/125/2284277.jpg,"좁은 인적풀 안에서 순환인사 후보 발굴부터 검증 및 의결까지 투명한 절차ㆍ합리적 설명 필요 제도 마련돼도 CEO 의지 관건 금융권에서 사외이사·최고경영자(CEO) 추천을 둘러싼 논란이 반복되면서, 인사 결과보다 절차의 투명성과 설명 가능성이 이사회 신뢰를 가르는 핵심 기준으로 떠오르고 있다. 누가 선임됐는지보다 후보 발굴·검증·추천·의결 전 과정이 명확한 기준과 기록에 따라 진행됐는지, 외부에서도 납득 가능한 절차였는지가 중요해졌다는 지적이다. 전문가들은 제도 보완과 함께 최고경영진과 이사회의 인식·문화 전환이 병행되지 않으면 같",2026-01-21 05:00,https://www.etoday.co.kr/news/view/2547364?trc=main_list_news,이투데이
시총 상위 종목 애프터마켓서 줄하락…삼전·SK하닉 4% 하락,https://img.etoday.co.kr/crop/200/125/2283608.jpg,"코스피 시가총액 상위 종목들이 20일 애프터마켓에서 일제히 하락세를 보였다. 연합뉴스에 따르면 이날 오후 7시 38분 기준 삼성전자는 전날 한국거래소 종가 대비 4.29% 내린 14만2900원에 거래 중이다. SK하이닉스도 4.32% 하락한 73만1000원에 거래되고 있다. 삼성전자와 SK하이닉스는 이날 한국거래소 종가 대비 각각 1.65%, 1.62% 떨어졌다. 현대차(-2.40%), LG에너지솔루션(-2.61%), 삼성바이오로직스(-1.35%), 한화에어로스페이스(-3.46%) 등도 전날 한국거래소 종가 대비 줄줄이 하락 중이",2026-01-20 20:11,https://www.etoday.co.kr/news/view/2547574?trc=main_list_news,이투데이
천스닥 시대도 목전…로봇주가 불씨 살렸다,https://img.etoday.co.kr/crop/200/125/2284294.jpg,코스닥이 4거래일 연속 상승하며 1000선 돌파에 성큼 다가섰다. 외국인·기관 수급이 개선되는 가운데 로봇주가 상승장의 중심축으로 부상하고 있다. 20일 한국거래소에 따르면 코스닥 지수는 전 거래일 대비 8.01포인트(0.83%) 오른 976.37에 거래를 마감했다. 지수는 장중 985.79를 찍으며 52주 신고가를 기록했다. 이는 지난 2022년 1월 13일(983.25포인트) 이후 4년 만에 980선을 넘어선 것이다. 종가 기준 970선을 넘어선 것도 2022년 1월 14일(971.39) 이후 처음이다. 코스닥은 올해 국내 증,2026-01-20 19:00,https://www.etoday.co.kr/news/view/2547366?trc=main_list_news,이투데이
12월 카드론 잔액 두 달 만에 감소세⋯전월 대비 0.53%↓,https://img.etoday.co.kr/crop/200/125/2241014.jpg,지난달 카드론 잔액이 두 달 만에 다시 감소세로 전환됐다. 20일 여신금융협회에 따르면 롯데·BC·삼성·신한·우리·하나·현대·KB국민·NH농협카드 등 9개 카드사의 지난해 12월 말 기준 카드론 잔액은 42조3292억 원으로 집계됐다. 전월 말(42조5529억 원) 대비 0.53% 줄었다. 카드론 잔액의 전월 대비 증감 흐름을 보면 지난해 6~9월에는 금융당국의 강도 높은 대출 규제 영향으로 4개월 연속 감소했다. 이후 10월과 11월 반등했지만 12월 들어 다시 감소세로 돌아섰다. 카드론 관련 다른 지표들도 전반적으로 축소됐다.,2026-01-20 18:36,https://www.etoday.co.kr/news/view/2547558?trc=main_list_news,이투데이
"[급등락주 짚어보기] 한신기계, 원전 밸류체인 부각에 上⋯코스닥서 보성파워텍ㆍ우리기술ㆍ일진파워 등 ↑",https://img.etoday.co.kr/crop/200/125/2284281.jpg,"20일 코스피 시장에서 상한가를 기록한 종목은 한신기계다. 전 거래일 대비 29.92% 오른 4255원에 거래를 마쳤다. 시장에서는 신규 원전 논의 재부각이 원전 밸류체인 종목 전반으로 확산하면서 투자심리를 자극한 것으로 보고 있다 이날 코스피 시장에서 하한가를 기록한 종목은 없다. 코스닥 시장에서는 원전·전력 인프라 관련 종목들이 동반 급등했다. 보성파워텍, 우리기술, 일진파워 등이 나란히 상한가를 기록했다. 특히 원전 관련 기대감은 이날 장에서 핵심 테마로 부각되며 수급을 견인했다. 그린광학은 방산과 우주항공 기대감을 아우르며",2026-01-20 17:53,https://www.etoday.co.kr/news/view/2547548?trc=main_list_news,이투데이
"iM증권, 'iM-프루츠 글로벌 올에셋 랩'…수익 창출·리스크 방어를 동시에",https://img.etoday.co.kr/crop/200/125/2284279.jpg,"iM증권은 글로벌 주식 및 ETF 투자로 시장 상황의 영향 없이 절대 수익을 추구하는 'iM-프루츠 글로벌 올에셋 랩'을 추천했다. 20일 iM증권에 따르면 'iM-프루츠 글로벌 올에셋 랩'은 프루츠투자자문의 자문을 바탕으로 운용되는 일임형 상품으로, 글로벌 시장의 주식, 채권, 원자재 등 전 자산군에 투자한다. 글로벌 매크로 전략을 바탕으로 수익 모멘텀이 기대되는 자산을 선택하고 집중한다. 전 세계의 거시경제 변화와 정책 환경, 지정학적 리스크 분석 등을 통해 투자 방향을 설정한다. 글로벌 시장 전반의 다양한 자산군에 투자하며,",2026-01-20 17:50,https://www.etoday.co.kr/news/view/2547546?trc=main_list_news,이투데이
"[채권마감] 초장기물 7개월만 최대폭 급등, 일 금리 폭등+이 대통령 추경 언급",https://img.etoday.co.kr/crop/200/125/2281016.jpg,"초장기물 1년9개월여만 최고...미 금리 상승에 30년물 교환 물량도 부담..패닉 매도도 가세 일본 중의원 선거전까진 일본 금리 상승 우려..당분간 약세 분위기 속 변동성 장세 불가피 채권시장이 사실상 패닉장(금리 폭등)을 연출했다. 국고20년물 이상 초장기물은 10bp 이상 급등해 7개월만에 가장 큰 폭으로 올랐고, 금리 수준도 1년8개월에서 1년9개월만에 최고치를 경신했다. 국고채 3년물 금리도 3.19%를 돌파하며 1년반만에 가장 높은 수준을 기록했다. 일본 중의원 선거 우려에 일본 금리가 큰 폭으로 오른데다, 오전 중 이재",2026-01-20 17:33,https://www.etoday.co.kr/news/view/2547538?trc=main_list_news,이투데이
"한국산업은행, 하노이지점 설립 본인가 획득",https://img.etoday.co.kr/crop/200/125/2284261.jpg,인가 신청 6년만…정부 전방위 외교 지원 ‘주효’ 한국산업은행이 베트남 진출 6년만에 하노이지점 설립 본인가를 획득했다. 이는 2021년 이후 베트남 정부가 외국계 은행에 내준 첫 인가 사례다. 산은은 지난 16일 베트남 중앙은행으로부터 외국은행 지점 설립 절차의 최종 단계인 하노이지점 설립 본인가(License)를 획득했다고 20일 밝혔다. 이번 본인가는 2019년 7월 지점 설립 인가를 신청한 이후 약 6년 반 만에 거둔 성과다. 베트남 정부의 보수적인 인가 기조 속에서도 한국 정부의 전방위적인 외교적 지원과 산업은행의 노력이,2026-01-20 17:23,https://www.etoday.co.kr/news/view/2547528?trc=main_list_news,이투데이
[오늘의 주요공시] CJ대한통운·HD현대중공업·KCC건설 등,https://img.etoday.co.kr/crop/200/125/2272682.jpg,"대유에이텍 지연공시에 따른 불성실공시법인지정 예고 CJ대한통운 지연공시에 불성실공시법인지정 예고 HD현대중공업 157,000 DWT 원유운반선 2척, 115,000 DWT P/C선 2척 수주…4816억 원 규모 비스토스 대표이사 변경…기존 이후정 → 변경 이선종 KCC건설 남부내륙철도(김천~거제)건설사업 제4-1공구 노반신설 기타공사 수주…1715억 원 규모",2026-01-20 17:13,https://www.etoday.co.kr/news/view/2547521?trc=main_list_news,이투데이
현대차 급등 뒤 코스피 조정...'5천피' 앞두고 경계론도,https://img.etoday.co.kr/crop/200/125/2284251.jpg,"20일 코스피가 장중 4935선까지 오르며 꿈의 지수 '5천피'(코스피 5000) 돌파 기대감이 커지고 있다. 반도체에 이어 자동차·로봇주로 주도주가 확산되는 가운데, 전문가들은 새로운 성장 기대를 인정하면서도 주가 반영 속도가 지나치게 빠르다며 경계가 필요하다고 진단했다. 허재환 유진투자증권 상무와 차영주 와이즈경제연구소장은 이날 YTN 라디오 '조태현의 생생경제'에서 최근 코스피 급등세에 대해 기대와 경계가 동시에 필요하다고 진단했다. 허 상무는 ""어제는 좀 무섭더라. 너무 올라가니까""라며 ""1월 들어서만 거의 16~17% 올",2026-01-20 17:09,https://www.etoday.co.kr/news/view/2547514?trc=main_list_news,이투데이
금감원장 만난 PE 대표들 “생산적 금융 위해 RWA 완화·모험자본 인정” 요청,https://img.etoday.co.kr/crop/200/125/2284241.jpg,"이찬진 금융감독원장이 기관전용 사모펀드(PE) 운용사 대표이사(CEO)들과 만나 국민성장펀드 성공을 위해서는 PE 업계의 역할이 중요하다고 강조했다. PE 업계는 국민성장펀드 출자 확대를 위해 위험가중자산(RWA) 규제 부담 완화를 요청하는 한편, 펀드 성격에 따라 벤처캐피탈(VC)과 같은 수준의 모험자본으로 인정해 정책적 지원을 확대해 달라고 요청했다. 금융감독원은 20일 서울 여의도 본원에서 이 원장 주재로 기관전용 PE 12곳 CEO들과 간담회를 열었다. 그동안 정규 금융사 범주에서 벗어나 있던 PE 업계를 금융감독원장이 직",2026-01-20 17:01,https://www.etoday.co.kr/news/view/2547510?trc=main_list_news,이투데이
"[장외시황] 덕양에너젠, 공모청약 시작",https://img.etoday.co.kr/crop/200/125/2284240.jpg,"20일 비상장 주식 시장은 호가 변화가 없었다. 산업용 수소 전문기업 덕양에너젠이 금일부터 이틀간 일반투자자 대상 공모주 청약을 시작했다. 공모가는 희망공모범위 상단인 1만원으로 확정되었고, 수요예측 경쟁률은 650.14대1을 기록했다. 급속, 정밀 냉각 의료기기 전문업체 리센스메디컬이 20~18일까지 기관투자자 대상 수요예측을 진행한다. 공모가 희망밴드는 9000~1만1000원이고, 한국투자증권과 신한투자증권이 상장 주관을 맡았다. 인간 유전체 기반 약물 개발기업 카나프테라퓨틱스는 공모 청약 일정이 2월19~20일로 변경되었다.",2026-01-20 16:59,https://www.etoday.co.kr/news/view/2547509?trc=main_list_news,이투데이
KB라이프 역삼센터 개소⋯시니어 ‘보험·요양·은행’ 서비스 원스톱 지원,https://img.etoday.co.kr/crop/200/125/2284215.jpg,전문 간호사 상주⋯요양·돌봄 컨설팅 제공 보험·자산관리·은퇴 금융 상담 원스톱 운영 에이지테크랩·교육센터 연계한 통합 모델 KB금융그룹이 시니어 고객의 노후 전반을 아우르는 통합 서비스 모델을 본격 가동한다. 보험·요양·은행 서비스를 한 공간에 결합한 복합 거점을 구축해 시니어 고객의 의사 결정 부담을 낮추고 보다 체계적인 노후 준비를 지원하겠다는 구상이다. KB금융은 20일 서울 역삼동 KB라이프타워에 보험·은행 복합 점포인 ‘KB라이프 역삼센터’를 개소했다고 밝혔다. 이를 통해 고객의 생애주기 전반을 아우르는 그룹 차원의 통합,2026-01-20 16:52,https://www.etoday.co.kr/news/view/2547345?trc=main_list_news,이투데이
"스틱인베 새 주인 미리캐피탈 ""핵심 운용 인력·조직 체계 기존대로 유지""",https://img.etoday.co.kr/crop/200/125/2220612.jpg,"사모펀드(PEF) 운용사 스틱인베스트먼트의 최대주주가 미국 운용사 미리캐피탈로 변경된다. 창업 회장인 도용환 회장이 지분 대부분을 매각하면서다. 도 회장은 2%의 지분을 남기고, 당분간 회사에 남을 예정이다. 새 최대주주인 미리캐피탈은 기존 운용 인력 및 조직체계를 유지할 것이라고 밝혔다. 20일 금융감독원 전자공시시스템에 따르면 도 회장은 미리캐피탈에게 지분 11.44%(476만9600주)를 주당 1만2600원에 매각한다. 총 거래금액은 601억 원이다. 미리캐피탈은 스틱인베스트먼트 지분 13.52%를 보유하고 있었다. 이번 거",2026-01-20 16:51,https://www.etoday.co.kr/news/view/2547501?trc=main_list_news,이투데이
"KB금융그룹, 보험-은행 복합점포 ‘KB골든라이프 플래그십 센터’ 오픈 [포토]",https://img.etoday.co.kr/crop/200/125/2284220.jpg,20일 서울 강남구 KB라이프타워에서 KB금융그룹 ‘KB골든라이프 플래그십 센터’ 개소식이 열렸다. ‘KB골든라이프 플래그십 센터’는 보험·요양·은행 서비스를 결합한 보험-은행 복합점포로 고객의 생애 주기 전반을 아우르는 그룹 통합 시니어 서비스를 제공한다.,2026-01-20 16:43,https://www.etoday.co.kr/news/view/2547495?trc=main_list_news,이투데이
"도용환 스틱인베 회장, 미리캐피탈에 지분 11.4% 매각",https://img.etoday.co.kr/crop/200/125/2264252.jpg,사모펀드(PEF) 운용사 스틱인베스트먼트의 최대주주인 도용환 회장이 보유하고 있던 지분 11.4%를 미국 운용사 미리캐피탈에 매각한다. 20일 금융감독원 전자공시시스템에 따르면 도 회장은 미리캐피탈에게 지분 11.44%(476만9600주)를 주당 1만2600원에 매각한다. 총 거래금액은 601억 원이다. 미리캐피탈은 스틱인베스트먼트 지분 13.52%를 보유하고 있었다. 이번 거래로 미리캐피탈은 스틱인베스트먼트의 지분 24.96%를 확보해 새 최대주주에 올랐다. 도 회장의 잔여 스틱인베스트먼트 지분은 2.00% 수준이다. 도 회장은,2026-01-20 16:38,https://www.etoday.co.kr/news/view/2547491?trc=main_list_news,이투데이
"‘7년 분급’ 앞둔 GA업권, 수수료 개편 넘어 ‘소비자보호·보안·책임’ 시험대",https://img.etoday.co.kr/crop/200/125/2284197.jpg,7월 ‘1200%룰’ 시행…전산·정산 준비 부담 외형 성장 뒤 ‘내실’ 과제…금융보안 공백 지적 GA의 소비자보호 전략 ‘보험금 제때·제대로 받기’ 보험 판매수수료 체계가 최장 7년 분급 구조로 전환되면서 법인보험대리점(GA) 업권이 구조적 변곡점에 놓였다. 선지급 중심의 영업 관행에 제동이 걸린 가운데 GA업권은 개편된 판매수수료 제도 안착과 함께 소비자보호·내부통제·금융보안까지 동시에 끌어올려야 하는 과제를 안게 됐다. 한국보험대리점협회(보험GA협회)는 20일 신년 기자간담회를 열고 “판매수수료 분급제도가 현장에 안정적으로 정,2026-01-20 16:24,https://www.etoday.co.kr/news/view/2547481?trc=main_list_news,이투데이
"'엔비디아가 키운 전력반도체 시장' 파워큐브세미, '산화갈륨'으로 IPO 승부수",https://img.etoday.co.kr/crop/200/125/2284170.jpg,차세대 전력반도체 팹리스 기업 파워큐브세미가 코스닥 상장 예비심사를 청구하고 본격적인 기업공개(IPO) 절차에 돌입했다. 실리콘(Si) 기반의 매출 성장세에 더해 ‘꿈의 소자’로 불리는 산화갈륨(Ga2O3) 기술력을 앞세워 시장 평가를 받겠다는 전략이다. 20일 투자은행(IB) 업계에 따르면 파워큐브세미는 최근 한국거래소에 코스닥 상장 예비심사 청구서를 제출했다. 주관사는 하나증권과 BNK투자증권이다. 시장의 관심은 기업가치(밸류에이션)에 쏠린다. 회사는 상장 예비심사 청구 직전인 지난해 12월 60억 원 규모의 상장 전 지분투자,2026-01-20 16:17,https://www.etoday.co.kr/news/view/2547464?trc=main_list_news,이투데이
[환율마감] 달러수요+엔화약세…1480원에 바싹 다가선 원·달러 ‘한달만 최고’,https://img.etoday.co.kr/crop/200/125/2283051.jpg,"일 금리상승+가라앉은 차기 연준 의장 헤싯 카드+그린란드발 미·유럽 갈등 마지노선 1480원대, 다음달은 뚫릴 수도...이번주말 BOJ 매파적이면 하향 안정 원·달러 환율이 1480원에 바싹 다가서며 지난해말 외환당국의 강력한 개입 이후 최고치를 경신했다. 달러 매수 수요가 여전한 가운데 일본 금리상승발 엔화약세가 영향을 미쳤다. 케빈 해싯 백악관 국가경제위원장의 차기 미국 연방준비제도(Fed·연준) 의장 가능성이 떨어진 점, 그린란드를 놓고 미국과 유럽간 갈등이 벌어지고 있는 점 등이 안전자산 선호심리(리스크오프)를 부추기고 있",2026-01-20 16:13,https://www.etoday.co.kr/news/view/2547478?trc=main_list_news,이투데이
금값 치솟자 골드뱅킹에 뭉칫돈…잔액 2조 원 첫 돌파,https://img.etoday.co.kr/crop/200/125/2284190.jpg,3개 시중은행 골드뱅킹 잔액 2조633억⋯첫 2조 원 돌파 골드뱅킹 계좌 수도 역대 최대⋯지난해 1월보다 22%↑ 실물 금 수요 뜨거워⋯골드바 판매량 올해 들어서만 633억 국내 주요 시중은행의 골드뱅킹(금통장) 잔액이 사상 처음으로 2조 원을 넘어섰다. 금값이 연일 최고가를 경신하는 가운데 안전자산인 금으로 투자 수요가 집중되면서 골드뱅킹에 뭉칫돈이 몰리고 있다. 20일 금융권에 따르면 골드뱅킹을 취급하는 KB국민·신한·우리 등 3개 시중은행의 전날 기준 골드뱅킹 잔액은 2조 633억 원으로 집계됐다. 이는 지난해 1월(8353,2026-01-20 16:12,https://www.etoday.co.kr/news/view/2547347?trc=main_list_news,이투데이
"김용태 GA협회장 “보험판매전문회사, 더 이상 미룰 수 없어…입법화 논의 나설 것”",https://img.etoday.co.kr/crop/200/125/2284167.jpg,"판매수수료 개편 이후…GA, ‘보험판매전문회사’ 입법 논의 재점화 보험 판매수수료 분급 전환과 판매채널 책임성 강화 기조 속에서 법인보험대리점(GA) 업권이 ‘보험판매전문회사’ 제도 도입을 핵심 과제로 다시 꺼내 들었다. 판매수수료 제도 개편과 보험사의 제3자 리스크관리 가이드라인 정비가 마무리 단계에 접어들면서, 보험개혁회의 미결 과제로 남아 있던 보험판매전문회사 제도에 대한 입법화 논의에 나서겠다는 입장이다. 김용태 한국보험대리점협회(보험GA협회) 회장은 20일 신년 기자간담회에서 “보험판매전문회사 도입은 더 이상 늦출 때가",2026-01-20 16:05,https://www.etoday.co.kr/news/view/2547460?trc=main_list_news,이투데이
[종합] 랠리 멈춘 코스피 13거래일 만에 하락 마감…코스닥 4년 만에 970선,https://img.etoday.co.kr/crop/200/125/2278146.jpg,"코스피가 4900선 안착에 실패하며 하락 마감했다. 12거래일 연속 상승 랠리를 이어오던 코스피가 13거래일 만에 숨돌리기에 들어선 모습이다. 20일 한국거래소에 따르면 코스피 지수는 전 거래일보다 18.91(0.39%) 내린 4885.75에 거래를 마감했다. 오전 한때 1.65%까지 빠지다 4900선을 회복했던 코스피는 장 막판 다시 낙폭을 키워 약세로 돌아서며 장을 마쳤다. 개인이 7593억 원 순매수하는 가운데 외국인과 기관이 각각 2397억 원, 6665억 원 순매도했다. 업종별로 보면 음식료·담배(1.51%), 섬유·의류",2026-01-20 15:48,https://www.etoday.co.kr/news/view/2547461?trc=main_list_news,이투데이
"KB증권, 중개형 ISA 잔고 4조 돌파",https://img.etoday.co.kr/crop/200/125/2284162.jpg,"KB증권은 20일 중개형 개인종합자산관리계좌(ISA) 잔고가 지난 5일 기준 4조 원을 돌파했다고 밝혔다. 중개형 ISA는 하나의 계좌에서 펀드·ELS·채권은 물론 국내 상장 주식과 ETF까지 자유롭게 운용·통합 관리할 수 있는 상품이다. 3년 보유 후 해지 시 최대 400만 원(서민형 기준)까지 비과세 혜택이 제공되고, 초과 수익에는 9.9% 분리과세가 적용된다. KB증권이 고객 데이터를 분석한 결과, 매년 신규 납입한도가 부여되는 제도적 특성과 맞물려 투자 저변이 빠르게 확대되고 있는 것으로 나타났다. 2030세대를 중심으로",2026-01-20 15:36,https://www.etoday.co.kr/news/view/2547450?trc=main_list_news,이투데이
[속보] 코스피 18.91p(0.39%) 내린 4885.75(마감),https://img.etoday.co.kr/crop/200/125/1990411.jpg,[속보] 코스피 18.91p(0.39%) 내린 4885.75(마감),2026-01-20 15:33,https://www.etoday.co.kr/news/view/2547448?trc=main_list_news,이투데이
[속보] 코스닥 8.01p(0.83%) 오른 976.37(마감),https://img.etoday.co.kr/crop/200/125/1990411.jpg,[속보] 코스닥 8.01p(0.83%) 오른 976.37(마감),2026-01-20 15:33,https://www.etoday.co.kr/news/view/2547446?trc=main_list_news,이투데이
천장 뚫고 또 가는 금·은 ETF…“무분별한 추매 지양해야”,https://img.etoday.co.kr/crop/200/125/2284125.jpg,"환율·지정학 리스크에 안전자산 쏠림 가속 은 ETF 한 달 40%↑…금·은 동반 강세 증권가 “에브리싱 랠리 유효, 단기 과열은 경계” 금과 은 가격이 연일 고점을 새로 쓰면서 관련 상장지수펀드(ETF) 수익률도 급등했다. 환율 상승과 글로벌 불확실성이 맞물리며 안전자산 선호가 강화된 영향이다. 다만 증권가에서는 단기 급등 이후 가격 변동성이 커질 가능성이 높아 추격 매수에 주의가 필요하다고 조언한다. 20일 한국거래소에 따르면 ‘KODEX 은선물(H)’은 최근 한 달 새 41.2%가 넘는 수익률을 기록했다. 같은 기간 미래에셋자",2026-01-20 15:12,https://www.etoday.co.kr/news/view/2547425?trc=main_list_news,이투데이
"대신증권, 온라인 채권 타임딜 첫날 완판…연 수익률 7.6%에 수요 몰려",https://img.etoday.co.kr/crop/200/125/2284129.jpg,"대신증권이 처음 선보인 ‘온라인 채권 타임딜’이 첫날부터 조기 완판되며 개인투자자들의 단기 채권 수요를 확인했다. 20일 대신증권에 따르면 지난 16일 진행한 온라인 채권 타임딜에서 오전 회차는 개시 11분 만에, 오후 회차는 10분 만에 각각 매진됐다. 회차당 판매 규모는 10억~15억 원 수준으로, 첫날 총 20억 원어치 채권이 모두 소진됐다. 이번 타임딜에 공급된 채권의 세전환산수익률은 연 7.6%로 고금리 단기 상품을 찾는 투자자들의 매수세가 집중된 것으로 분석된다. 최근 금리 변동성이 이어지는 가운데 듀레이션이 짧은 채권을",2026-01-20 15:05,https://www.etoday.co.kr/news/view/2547427?trc=main_list_news,이투데이
"이찬진 금감원장, 사모펀드 대표 소환해 ‘생산적 금융’ 협조 요청",https://img.etoday.co.kr/crop/200/125/2207183.jpg,"이찬진 금융감독원장이 취임 후 처음으로 기관전용 사모펀드 운용사(PE) 대표이사(CEO)들을 직접 소집했다. 최근 사모펀드(PEF)를 둘러싼 사회적 논란과 시장 영향력 속에서 PE 업계의 ‘신뢰 회복’과 ‘생산적 금융’ 역할을 분명히 하겠다는 신호로 해석된다. 단기 수익 중심 투자 관행에서 벗어나 성장기업 육성과 모험자본 공급 기능을 강화할 것도 주문했다. 금융감독원은 20일 서울 여의도 본원에서 이 원장 주재로 기관전용 PE 12곳 CEO들과 간담회를 열었다. 박병건 PEF협의회장(대신 PE 대표)을 비롯해 한앤코, IMM, U",2026-01-20 15:00,https://www.etoday.co.kr/news/view/2547415?trc=main_list_news,이투데이
