title,thumbnail,short_content,write_time,link,company
"증선위, 만호제강 회계처리 위반 제재…감사인지정 3년 의결",https://img.etoday.co.kr/crop/200/125/2355442.jpg,만호제강이 수익인식기준을 충족하지 못한 거래를 매출로 잡은 사실이 증권선물위원회 감리에서 적발됐다. 감사인인 신한회계법인도 관련 감사절차를 충분히 수행하지 못한 것으로 판단돼 함께 제재 대상에 올랐다. 금융위원회 산하 증권선물위원회는 8일 제13차 회의에서 회계처리기준을 위반해 재무제표를 작성·공시한 만호제강에 대해 감사인지정 등의 조치를 의결했다고 밝혔다. 만호제강 감사인인 신한회계법인과 소속 공인회계사에 대해서도 감사절차 소홀 등을 이유로 제재를 결정했다. 증선위에 따르면 만호제강은 2019~2022년 결산기 수익인식기준을 충,2026-07-08 19:21,https://www.etoday.co.kr/news/view/2601758?trc=main_list_news,이투데이
"[채권마감] 30·50년물 금리 사상최고, 보험사 수요부진",https://img.etoday.co.kr/crop/200/125/2356776.jpg,미국·이란 교전 불안감에 약세 분위기..환율 급락에 단기물은 강세 반전 국고10년-3년물간 장단기금리차 47bp ‘2개월만 최대’ 이번주 큰 이벤트 없어 유가·환율 등 곁눈질 속 등락할 듯 채권시장이 단기물은 강세(금리 하락) 초장기물은 약세(금리 상승)로 갈렸다. 특히 국고30년물과 50년물 금리는 역대 최고치를 경신했다. 20년물 금리도 3년9개월만에 최고치를 보였다. 국고10년물과 3년물간 장단기금리차 역시 2개월여만에 최대치를 경신했다. 최근 보험사 수요부진이 이어지면서 초장기물 금리가 꾸준히 오르고 있다. 호르무즈 해협을,2026-07-08 17:19,https://www.etoday.co.kr/news/view/2601723?trc=main_list_news,이투데이
코스피 5.4%·코스닥 5.6% 급락…'검은 수요일' 양 시장 매도 사이드카 발동,https://img.etoday.co.kr/crop/200/125/2356743.jpg,코스피와 코스닥 지수가 동반 급락하면서 어제에 이어 양 시장에 프로그램매매 매도호가 효력정지(매도 사이드카)가 발동됐다. 8일 한국거래소에 따르면 코스피 지수는 전장보다 409.42포인트(5.35%) 내린 7246.79에 거래를 마쳤다. 코스닥 지수는 전장대비 46.23포인트(5.56%) 하락한 785.00에 장을 마감했다. 이날 시장은 삼성전자와 SK하이닉스 등 시가총액 상위권인 반도체 관련주가 대거 급락하면서 오후 1시31분 코스피200 선물이 5% 넘게 하락해 매도 사이드카가 발동됐다. 이번 조치는 올해 들어 17번째로 기록,2026-07-08 17:12,https://www.etoday.co.kr/news/view/2601668?trc=main_list_news,이투데이
[오늘의 주요공시] 삼성중공업·대우건설·기아 등,https://img.etoday.co.kr/crop/200/125/2353184.jpg,"△ 중앙백신, 58억1000만원 규모 정부 백신 공급계약 체결 △ 기아, 송호성·송민수 각자대표 체제 전환 △ 쇼박스, 주식소각 변경상장…총 주식 수 조정 △ 라온시큐어, 20억원 규모 자사주 취득 결정 △ 아이씨디, 295억6000만원 규모 FPD 장비 공급계약 체결 △ 한진, 2분기 영업이익 전년 대비 22.4% 감소 △ 삼성중공업, 2849억원 규모 유조선 2척 수주 △ 대우건설, 8181억원 규모 주상복합 신축공사 수주 △ 크레버스, 보통주 1주당 500원 중간배당 결정 △ 서진시스템, 537억원 규모 ESS 장비 공급계약",2026-07-08 16:36,https://www.etoday.co.kr/news/view/2601696?trc=main_list_news,이투데이
"LS증권, ‘외국인 사칭’ 해킹 메일에 수십억원 인출 사고⋯상임대리인 허점 노려",https://img.etoday.co.kr/crop/200/125/2356780.jpg,외국인 투자자를 사칭한 이메일 주문으로 수십억원이 무단 인출되는 사고가 발생해 경찰이 수사 중이다. LS증권은 사고를 인지한 직후 금융당국에 보고하고 경찰에 수사를 의뢰했다고 밝혔다. 8일 금융투자업계에 따르면 서울경찰청 사이버수사대는 올해 초 LS증권 직원이 해킹된 가짜 이메일을 받고 외국인 투자자 A씨 명의의 주식 주문을 처리하는 과정에서 수십억원이 무단 인출된 사건을 수사 중이다. 이번 사고는 '외국인 상임대리인' 제도의 허점을 노린 것으로 파악된다. 상임대리인 제도는 해외에 거주하는 외국인이 국내 주식을 거래할 때 투자 등,2026-07-08 16:32,https://www.etoday.co.kr/news/view/2601688?trc=main_list_news,이투데이
[급등락주 짚어보기] 태양광 수주에 다스코 '上'…호남 반도체 기대에 금호전기도 급등,https://img.etoday.co.kr/crop/200/125/2356778.jpg,"8일 국내 증시에서는 태양광 발전사업 수주와 호남권 반도체 클러스터 조성 기대, 대규모 AI 사업 계약 등 개별 재료에 따라 종목별 주가가 엇갈렸다. 코스피 시장에서는 다스코와 금호전기 등이 상한가를 기록했고 코스닥 시장에서는 AI와 화장품, 신재생에너지 관련주를 중심으로 매수세가 유입됐다. 8일 코스피 시장에서 상한가를 기록한 종목은 다스코, 금호에이치티, 금호전기 등 3종목이다. 다스코는 전 거래일 대비 30.00% 오른 5200원에 거래를 마쳤다. 전남 신안군에서 대규모 태양광 발전사업을 수주했다는 소식이 매수세를 끌어들였다",2026-07-08 16:25,https://www.etoday.co.kr/news/view/2601689?trc=main_list_news,이투데이
"코스피 5.35%, 코스닥 5.56% 급락…'검은 수요일' [포토]",https://img.etoday.co.kr/crop/200/125/2356775.jpg,8일 서울 중구 하나은행 딜링룸 전광판에 코스피가 전 거래일보다 409.52포인트(5.35%) 하락한 7246.79를 나타내고 있다. 코스닥 지수는 전 거래일보다 46.23포인트(5.56%) 내린 785.00에 거래를 마감했다. 원·달러 환율은 주간 거래 종가(15시30분) 기준 전일 대비 29.7원 내린 1498.5원을 기록했다. 고이란 기자 photoeran@,2026-07-08 16:19,https://www.etoday.co.kr/news/view/2601687?trc=main_list_news,이투데이
"[환율마감] 원·달러 급락 두달만 빅피겨(1500원) 하회, 외인·SK하이닉스·한일공조",https://img.etoday.co.kr/crop/200/125/2356733.jpg,"원화 강세 분위기에 급한 곳은 달러 팔아야하는 쪽..1480원까지 떨어질 듯 원·달러 환율이 두달만에 빅피겨인 1500원을 하회했다(원화 강세). 장중 변동폭도 30원을 넘겨 연중 최대폭을 나타냈다. 최근 주식시장이 폭락하면서 외국인 리밸런싱이 멈춘데다, SK하이닉스 ADR 나스닥 상장 이슈에 달러화가 유입되고 있어서다. 최근 원화와 엔화 약세에 한국과 일본 외환당국이 공조에 나선 것도 영향을 미쳤다. 빅피겨를 깸에 따라 원·달러가 추가 하락할 수 있다는 관측이다. 8일 서울 외환시장에서 원·달러 환율은 전일대비 29.7원(1.9",2026-07-08 15:59,https://www.etoday.co.kr/news/view/2601670?trc=main_list_news,이투데이
"금감원 특사경, 매경TV 압수수색…선행매매 혐의",https://img.etoday.co.kr/crop/200/125/2277624.jpg,"금융감독원 자본시장 특별사법경찰(특사경)은 매일경제TV를 상대로 선행매매 혐의를 포착해 압수수색에 나섰다. 8일 금융투자업계에 따르면 금감원 특사경은 이날 오전부터 서울 중구 매일경제신문사 계열 경제방송 매일경제TV 본사를 압수수색하고 관련 자료 등을 확보했다. 특사경은 매일경제TV 소속 직원 등이 업무 과정에서 취득한 미공개 호재성 정보를 이용해 특정 주식을 미리 사들인 뒤, 방송 이후 주가가 오르면 이를 되팔아 부당이득을 챙긴 정황을 포착한 것으로 알려졌다. 이번 사건은 금감원의 첫 인지수사 사례다. 금융위원회가 4월 '자본시",2026-07-08 15:55,https://www.etoday.co.kr/news/view/2601666?trc=main_list_news,이투데이
사학연금 새 CIO에 백주현 전 공무원연금 단장,https://img.etoday.co.kr/crop/200/125/2348000.jpg,30조원 규모의 자금을 굴리는 사학연금 차기 자금운용관리단장(CIO)에 백주현 전 공무원연금 자금운용단장이 내정됐다 8일 금융투자업계에 따르면 사학연금공단은 이날 인사위원회를 열고 백 전 단장을 신임 CIO로 선임하기로 결정했다. 이번 인선은 전범식 전 CIO가 수협중앙회 자금운용본부장으로 자리를 옮긴 데 따른 후속 절차다. 사학연금은 5월 차기 CIO 공개 모집을 시작해 백 전 단장을 최종 낙점했다. 백 전 단장은 해외투자 전문가로 평가된다. 1970년생으로 1995년 한국수출입은행에서 경력을 시작했다. 미국 듀크대학교에서 경영,2026-07-08 15:46,https://www.etoday.co.kr/news/view/2601657?trc=main_list_news,이투데이
"‘검은 수요일’ 코스피 5.35% 폭락, 코스닥 10개월 만에 800선 붕괴",https://img.etoday.co.kr/crop/200/125/2356733.jpg,"국내 증시가 8일 롤러코스터 장세 끝에 5%대 급락했다. 코스피는 장 초반 3% 넘게 밀렸다가 상승 전환했지만 오후 들어 미국과 이란의 충돌 확대 소식이 전해지면서 다시 추락했다. 코스피와 코스닥에서는 2분 간격으로 매도 사이드카가 발동됐고, 코스닥은 10개월 만에 800선을 내줬다. 이날 한국거래소에 따르면 코스피는 전 거래일보다 409.52포인트(5.35%) 내린 7246.79에 거래를 마쳤다. 지수는 전장보다 203.83포인트(2.66%) 내린 7452.48로 출발해 오전 9시2분 7364.32까지 밀렸다. 이후 반도체주가 낙",2026-07-08 15:46,https://www.etoday.co.kr/news/view/2601658?trc=main_list_news,이투데이
[속보] 코스닥 46.23p(5.56%) 내린 785.00(장마감),https://img.etoday.co.kr/crop/200/125/1990411.jpg,[속보] 코스닥 46.23p(5.56%) 내린 785.00(장마감),2026-07-08 15:34,https://www.etoday.co.kr/news/view/2601644?trc=main_list_news,이투데이
[속보] 코스피 409.52p(5.35%) 내린 7246.79(장마감),https://img.etoday.co.kr/crop/200/125/1990411.jpg,[속보] 코스피 409.52p(5.35%) 내린 7246.79(장마감),2026-07-08 15:33,https://www.etoday.co.kr/news/view/2601643?trc=main_list_news,이투데이
"[장외시황] 카카오모빌리티, 2.54% 상승",https://img.etoday.co.kr/crop/200/125/2356724.jpg,비상장 주식은 하락했다. 8일 금융투자업계에 따르면 모빌리티 서비스 및 플랫폼 운영업체 카카오모빌리티가 1만100원(+2.54%)으로 상승했다. 신선식품 새벽배송 전문기업 컬리는 호가 3만2250원(+0.78%)으로 올랐다. 석유 정제 전문업체 HD현대오일뱅크(구.현대오일뱅크)와 신용카드 및 할부금융사 현대카드가 보합세를 유지했다. 플랜트 종합엔지니어링 건설기업 현대엔지니어링은 3만5250원(-2.08%)으로 하락했다. IPO(기업공개)관련 상장 예비심사 청구종목으로 특수 목적용 항법 및 항재밍 토탈 솔루션 전문업체 덕산넵코어스(구,2026-07-08 15:30,https://www.etoday.co.kr/news/view/2601638?trc=main_list_news,이투데이
"한양증권, 500억 유증 걸림돌 텄다...법원, 소액주주 가처분 '기각'",https://img.etoday.co.kr/crop/200/125/2348351.jpg,"서울남부지법, ""장외파생 진출 위한 자본 확충·할증 발행"" 인정 500억 대금 납입·장외파생상품 시장 진출 계획 차질 없이 추진 한양증권이 장외파생상품 시장 진출을 위해 추진 중인 500억원 규모 제3자배정 유상증자가 소액주주들의 반발을 딛고 예정대로 진행한다. 법원이 소액주주 측이 제기한 신주발행금지 가처분 신청을 기각하면서 한양증권 자본 확충 및 신규 사업 추진에 청신호가 켜졌다. 8일 법조계 및 금융투자업계에 따르면 서울남부지방법원 제51민사부(재판장 권성수)는 유한회사 뚜벅이투자 등 소액주주 4명이 한양증권을 상대로 낸 신",2026-07-08 15:18,https://www.etoday.co.kr/news/view/2601626?trc=main_list_news,이투데이
"[김남현의 왈가왈부] 금리인상 초읽기, 장기고정금리 더 늦출 수 없다",https://img.etoday.co.kr/crop/200/125/2347269.jpg,한국은행 금융통화위원회가 16일 기준금리를 결정한다. 시장에서는 이번 회의를 본격적인 금리인상 사이클의 출발점으로 받아들이는 분위기다. 이번 인상을 포함해 내년 상반기까지 많게는 100bp(1bp=0.01%포인트)를 인상할 수 있다고 보고 있다. 일각에서는 원·달러 환율 안정을 위해 빅스텝(50bp인상)이나 백투백(25bp씩 7월·8월 연속) 인상 가능성까지 거론한다. 금리가 오르면 가장 먼저 충격을 받는 곳은 가계다. 특히 변동금리 대출 비중이 높은 차주일수록 부담은 빠르게 커진다. 문제는 정책당국이 가장 먼저 준비했어야 할 대응,2026-07-08 15:03,https://www.etoday.co.kr/news/view/2601616?trc=main_list_news,이투데이
"미래에셋증권, 개인투자용 국채 7월 청약…총 1600억원 규모",https://img.etoday.co.kr/crop/200/125/2356669.jpg,미래에셋증권은 개인투자용 국채 7월 청약을 실시한다고 8일 밝혔다. 청약은 이날부터 14일까지 공휴일을 제외한 5영업일 동안 진행된다. 당초 9일부터 15일까지로 예정됐지만 제헌절이 공휴일로 지정되면서 일정이 하루 앞당겨졌다. 투자자는 미래에셋증권 전국 영업점과 모바일트레이딩시스템(MTS) 엠스탁(M-STOCK)을 통해 오전 9시부터 오후 4시까지 신청할 수 있다. 이번 발행 규모는 총 1600억원으로 전월보다 400억원 줄었다. 종목별 발행 규모는 △3년물 이표채 30억원 △3년물 복리채 70억원 △5년물 600억원 △10년물,2026-07-08 14:29,https://www.etoday.co.kr/news/view/2601599?trc=main_list_news,이투데이
"티로보틱스, 방사성폐기물 처분시설 무인화 실증 참여…고위험 로봇 시장 확대",https://img.etoday.co.kr/crop/200/125/2356658.jpg,"한국로봇산업진흥원 공모 컨소시엄 최종 선정…물류 자동화 전담 무인지게차·자율이동로봇 투입해 경주 처분시설 내 방사선 피폭 위험 차단 진공로봇 및 자율이동로봇(AMR) 전문기업 티로보틱스가 국내 최초로 방사성폐기물 처분시설 무인화 실증사업에 참여하며 고위험 특수 산업용 로봇 시장으로 보폭을 넓힌다. 티로보틱스는 한국로봇산업진흥원이 주관하는 ‘2026년도 사회문제해결형 대규모 융합 로봇 실증사업’에 경북ICT융합산업진흥협회(GBICT), 한국원자력환경공단(KORAD), 클로봇과 함께 컨소시엄을 구성해 최종 선정됐다고 8일 밝혔다. 이",2026-07-08 14:17,https://www.etoday.co.kr/news/view/2601588?trc=main_list_news,이투데이
"하나증권, 금융권 최초 ‘장애인 직무개발 사업’ 참여기업 선정",https://img.etoday.co.kr/crop/200/125/2356646.jpg,하나증권이 한국장애인고용공단이 주관하는 ‘2026년 선도기업 전략직종 직무개발 사업’ 참여기업으로 선정됐다. 하나증권은 2023년 이 사업이 시행된 이래로 최초의 금융권 기업이다. 8일 하나증권에 따르면 이번 사업에는 현재까지 총 12개 기업이 선정됐다. 참여기업은 장애인에게 적합한 직무를 개발하고 고용 확대를 위한 맞춤형 컨설팅을 지원받는다. 하나증권은 앞으로 6개월간 직무개발 컨설팅을 받고 한국장애인고용공단 관할 지사의 취업 지원 서비스를 연계해 장애인 고용 기반을 강화할 계획이다. 하나증권은 장애 청년의 안정적인 금융권 진출,2026-07-08 14:04,https://www.etoday.co.kr/news/view/2601578?trc=main_list_news,이투데이
"美-이란 충돌 격화, 코스피·코스닥 급락⋯연쇄 매도 사이드카",https://img.etoday.co.kr/crop/200/125/2356621.jpg,"코스피와 코스닥이 8일 오후 들어 낙폭을 키우면서 양 시장에서 매도 사이드카가 연이어 발동됐다. 미국의 대이란 공습 확대와 이란의 미군 시설 공격 소식이 전해지자 지정학적 불안이 급격히 커졌고, 반도체 대형주를 중심으로 매도세가 쏟아졌다. 이날 오후 1시48분 현재 코스피는 전 거래일보다 372.07포인트(4.86%) 내린 7284.24를 나타내고 있다. 지수는 전장보다 203.83포인트(2.66%) 내린 7452.48로 출발해 오전 9시2분 7364.32까지 밀렸다. 이후 반도체주가 낙폭을 줄이면서 오전 9시42분에는 18.19",2026-07-08 13:55,https://www.etoday.co.kr/news/view/2601573?trc=main_list_news,이투데이
"청담글로벌, 글로벌 팝업 참여 브랜드 112개로 확대…북미·유럽 공략 본격화",https://img.etoday.co.kr/crop/200/125/2356631.jpg,"글로벌 뷰티 유통 플랫폼 기업 청담글로벌은 2월 약 50개 브랜드로 시작한 글로벌 팝업 및 박람회 프로젝트가 7월 현재 총 112개 브랜드가 참여하는 규모로 확대됐다고 8일 밝혔다. 회사는 미국 팝업스토어와 글로벌 박람회를 기반으로 북미와 유럽 시장 공략을 본격화하고 있다. 현재 청담글로벌은 미국 서부 핵심 상권인 델 아모 패션센터, 디 아메리카나 엣 브랜드, 산타나 로우 등에서 팝업스토어를 운영 중이다. 앞서 미션 비에호, 그레이트 몰, 온타리오 밀스, 더 아울렛 엣 오렌지에서 팝업을 성공적으로 마친 데 이어, 이달부터 8월 사",2026-07-08 13:43,https://www.etoday.co.kr/news/view/2601565?trc=main_list_news,이투데이
[속보] 코스닥도 매도 사이드카 발동,https://img.etoday.co.kr/crop/200/125/1990411.jpg,[속보] 코스닥도 매도 사이드카 발동,2026-07-08 13:35,https://www.etoday.co.kr/news/view/2601558?trc=main_list_news,이투데이
"[속보] 코스피, 급락에 이틀 연속 매도 사이드카",https://img.etoday.co.kr/crop/200/125/1990411.jpg,"[속보] 코스피, 급락에 이틀 연속 매도 사이드카",2026-07-08 13:34,https://www.etoday.co.kr/news/view/2601556?trc=main_list_news,이투데이
"코스피, 장중 상승 전환 뒤 다시 3%대 급락…7370선 후퇴",https://img.etoday.co.kr/crop/200/125/2356621.jpg,"코스피가 8일 장중 상승 전환에 성공했다가 오후 들어 다시 3% 넘게 급락하며 7370선까지 밀렸다. 미국 반도체주 약세와 중동 분쟁 재점화, 최근 극심한 변동성에 따른 투자심리 위축이 겹치면서 오전 반등분을 모두 반납했다. 이날 오후 1시17분 현재 코스피는 전 거래일보다 285.78포인트(3.73%) 내린 7370.53을 나타내고 있다. 지수는 전장보다 203.83포인트(2.66%) 내린 7452.48로 출발해 오전 9시2분 7364.32까지 밀렸다. 이후 낙폭을 빠르게 만회해 오전 9시42분에는 18.19포인트(0.24%)",2026-07-08 13:26,https://www.etoday.co.kr/news/view/2601551?trc=main_list_news,이투데이
UBS “SK하이닉스 美 ADR 사고 서울주식 팔아라”,https://img.etoday.co.kr/crop/200/125/2356605.jpg,미국 상장 프리미엄 전망 TSMC도 평균 16% 웃돈 거래 전환 규제 여부가 최대 변수 스위스 투자은행 UBS그룹이 SK하이닉스의 미국주식예탁증서(ADR) 나스닥 상장을 사흘 앞둔 7일(현지시간) ADR을 매수하고 한국 상장 주식은 매도하라고 권고했다. 신규 ADR이 프리미엄을 받고 거래될 가능성이 높다는 이유에서다. 블룸버그통신에 따르면 UBS그룹의 세일즈·트레이딩 데스크는 이날 고객 노트에서 “SK하이닉스 신규 ADR이 프리미엄에 거래될 가능성이 높기 때문에 투자자들은 SK하이닉스의 ADR을 매수하고 한국 상장 주식은 매도해야,2026-07-08 13:08,https://www.etoday.co.kr/news/view/2601540?trc=main_list_news,이투데이
증시 활황에 투심 회복…1분기 파생결합증권·사채 발행액 19.6조,https://img.etoday.co.kr/crop/200/125/2356550.jpg,1년 전 대비 24% 증가…상환액도 20.6조 종목형 ELS 확대…테슬라·팔란티어 등 인기 투자심리 회복에 힘입어 올해 1분기 파생결합증권·사채 발행액이 20조원에 육박한 것으로 나타났다. 종목형 주가연계증권(ELS)과 원금지급형 주가연계파생결합사채(ELB) 수요가 함께 늘어난 영향이다. 금융감독원이 9일 발표한 ‘올해 1분기 파생결합증권·사채 발행·운용현황’에 따르면 올해 1분기 파생결합증권·사채 발행액은 19조6000억원으로 전년 동기 대비 24.1%(3조8000억원) 증가했다. 유형별로는 파생결합증권(ELS·DLS) 발행액이,2026-07-08 12:00,https://www.etoday.co.kr/news/view/2601495?trc=main_list_news,이투데이
"기대 컸던 스페이스X, 나스닥100 편입 첫날 ‘삐끗’",https://img.etoday.co.kr/crop/200/125/2356543.jpg,"6.8% 뚝…지수 편입 효과 기대 못 미쳐 월가 평균 목표가 229달러…상승 여력 53% 위성통신사업 등 장기 성장 기대는 여전 AI 사업 적자·회사채 약세에 신중론도 일론 머스크가 이끄는 로켓ㆍ위성ㆍAI 기업 스페이스X가 나스닥100 지수에 편입된 첫날인 7일(현지시간) 기대와 달리 주가가 부진한 모습을 보이며 체면을 구겼다. 스페이스X는 이날 나스닥에서 전장보다 6.8% 하락한 149.47달러로 마감했다. 이는 기업공개(IPO) 공모가인 135달러보다는 높은 수준이지만, 한때 200달러를 웃돌았던 고점과 비교하면 크게 떨어진",2026-07-08 11:09,https://www.etoday.co.kr/news/view/2601492?trc=main_list_news,이투데이
"포커스에이아이, 국제안전보건전시회 참가…인공지능 산업안전 솔루션 공개",https://img.etoday.co.kr/crop/200/125/2356533.jpg,스마트 안전 플랫폼·지게차 인체 감지 등 소개…삼성중공업·삼성물산 공급 이력 확보 김영훈 고용노동부 장관 부스 방문…조선·건설·제조 중심 신규 고객사 발굴 박차 인공지능(AI) 기반 산업안전 솔루션 기업 포커스에이아이가 국내 최대 규모의 안전보건 전시회에 참가해 독자적인 기술력을 선보인다. 포커스에이아이는 경기 고양시 킨텍스에서 열리는 ‘국제안전보건전시회(KISS 2026)’에 참가해 다양한 AI 산업안전 솔루션을 선보이고 국내외 네트워크 구축에 나선다고 8일 밝혔다. 9일까지 진행되는 이번 전시회에서 회사는 △스마트 산업 안전,2026-07-08 10:34,https://www.etoday.co.kr/news/view/2601483?trc=main_list_news,이투데이
"미래에셋증권, 유튜브 라이브로 ‘연금 투자 인사이트’ 제공",https://img.etoday.co.kr/crop/200/125/2356518.jpg,"미래에셋증권은 연금 고객을 위한 유튜브 라이브 세미나를 ‘퇴근길 30분, 연금 투자 인사이트’로 개편해 선보인다고 8일 밝혔다. 첫 방송은 이날 오후 5시 30분에 진행된다. 바쁜 직장인들이 30분 동안 연금 투자와 자산배분, 상장지수펀드(ETF), 절세 등 실질적인 정보를 접할 수 있도록 구성했다. 이번 개편은 연금 운용 방식이 원리금 보장형 상품 중심에서 자산배분을 활용한 적극적인 투자로 변화하는 흐름을 반영했다. 미래에셋증권은 연금 투자자에게 필요한 시장 정보와 투자 전략을 정기적으로 제공할 계획이다. 세미나는 총 3부로 진",2026-07-08 10:16,https://www.etoday.co.kr/news/view/2601472?trc=main_list_news,이투데이
"유럽 아문디 “AI 투자, 개발에서 확산 단계로 이동”",https://img.etoday.co.kr/crop/200/125/2356508.jpg,NH-아문디(Amundi)자산운용은 8일 2대 주주이자 유럽 1위 자산운용사인 아문디가 ‘2026 하반기 글로벌 투자 전망’ 보고서를 발표했다고 밝혔다. 아문디는 하반기 글로벌 시장에 대해 국가별 성장 속도가 엇갈리고 인플레이션 변동성과 정책 리스크가 커지면서 부담이 확대될 것으로 전망했다. 이런 국면에서는 위험자산 비중을 일괄적으로 줄이기보다 특정 자산에 쏠린 위험을 낮추고 유망 자산을 선별해 다시 담는 전략이 필요하다고 조언했다. 기본 시나리오로는 호르무즈 해협 긴장이 다소 완화되고 브렌트유가 연말 배럴당 80~90달러 선에서,2026-07-08 10:13,https://www.etoday.co.kr/news/view/2601468?trc=main_list_news,이투데이
"민간임대 공급 4년 새 81% 감소⋯""조기 분양전환 허용해야""",https://img.etoday.co.kr/crop/200/125/2356714.jpg,"'민간임대주택 공급 확대와 주거안정' 국회 토론회 공공임대 비중 8.6% 한계...“전향적 법 개정 필요” 정부의 규제 강화와 공사비 급등 여파로 서민과 청년층의 핵심 주거 안전망 역할을 해온 제도권 민간임대주택 공급이 최근 4년 사이 81% 이상 급감한 것으로 나타났다. 공공임대만으로는 감당하기 어려운 서민·중산층의 임차 수요를 민간임대가 떠받쳐온 만큼 공급 절벽을 해소하고, 공공임대에만 허용되는 조기 분양전환 등 차별적인 규제를 조속히 폐지해야 한다는 지적이 나온다. 8일 국회의원회관 제3세미나실에서 열린 '민간임대주택 공급",2026-07-08 15:55,https://www.etoday.co.kr/news/view/2601631?trc=main_list_news,이투데이
