title,thumbnail,short_content,write_time,link,company
"포스코이앤씨, 용산정비창 전면1구역 사업 수주 출사표…“개발사업 역량 적용”",https://img.etoday.co.kr/crop/200/125/2153080.jpg,"포스코이앤씨가 “서울 용산정비창 전면1구역을 글로벌 중심의 랜드마크로 개발하겠다”고 28일 밝혔다. 용산정비창 전면1구역은 용산구 한강로3가 일대를 대상으로 진행되는 초대형 복합개발 프로젝트다. 이 프로젝트는 지하 6층에서 지상 38층, 빌딩 12개 동, 아파트 777가구, 오피스텔 894실, 상업 및 업무 시설로 구성될 예정이다. 이 구역은 용산정비창 부지와 매우 인접해 있어 향후 용산 국제업무지구 개발계획의 직접적인 수혜가 예상되는 곳으로 투자자들로부터 많은 관심이 집중되고 있다. 포스코이앤씨는 랜드마크로 바뀔 용산정비창 전면",2025-03-28 11:13,https://www.etoday.co.kr/news/view/2456912?trc=main_list_news,이투데이
"국토부, 서울 강동구 싱크홀 사고조사위 구성…31일 첫 회의",https://img.etoday.co.kr/crop/200/125/2151475.jpg,국토교통부가 서울 강동구 명일동에서 발생한 대형 싱크홀(땅 꺼짐) 사고의 원인 규명을 위한 사고조사위원회를 구성했다. 국토부는 중앙지하사고조사위원회가 31일 사고 현장 인근에서 착수 회의를 여는 것을 시작으로 활동에 들어간다고 28일 밝혔다. 지하안전관리특별법에 따라 국토부는 일정 규모 이상의 피해가 난 사고 조사를 위해 필요한 경우 중앙지하사고조사위를 구성·운영할 수 있다. 사조위원은 제4기 중앙지하사고조사위원단(62명) 소속 전문가 중 12명이 맡는다. 운영 기간은 5월 30일까지 2개월간이다. 이들은 설계도서 등 관련 서류를,2025-03-28 11:08,https://www.etoday.co.kr/news/view/2456910?trc=main_list_news,이투데이
"국토부, 조달청과 ‘공공건축물 탄소중립 대응’ 업무협약",https://img.etoday.co.kr/crop/200/125/2140934.jpg,국토교통부와 조달청은 공공부문 제로에너지건축물(ZEB) 보급 활성화 등 공공건축물 탄소중립 실현 및 기후위기 대응을 위한 업무협약(MOU)을 체결한다고 28일 밝혔다. 이날 서울지방조달청에서 협약식을 진행하며 업무협약의 주요 내용은 △ZEB 확대 등 공공건축물 온실가스 감축 △ZEB 적정 공사비 도출을 위한 최적 설계 표준화 기반 마련 △공공건축물 탄소중립 실현을 위한 정책적 협력 강화 등이다. 국토부는 올해부터 공공건축물 신축 시 취득해야 하는 ZEB 최저 의무 등급을 상향(5등급→4등급)해 공공부문에서 선도적으로 건물 온실가스,2025-03-28 10:30,https://www.etoday.co.kr/news/view/2456814?trc=main_list_news,이투데이
"중견주택업체, 4월 4390가구 분양",https://img.etoday.co.kr/crop/200/125/2153004.jpg,"대한주택건설협회는 회원사를 대상으로 4월 주택분양계획을 집계한 결과 8개사가 10개 사업장에서 총 4390가구를 공급한다고 28일 밝혔다. 전월보다 1917가구, 전년동월보다는 3215가구 감소한 수치다. 수도권에는 2814가구가 공급될 예정이다. 인천이 1453가구로 가장 많고 이어 경기(1093가구), 서울(268가구) 순이다. 대전에는 998가구, 부산과 제주도에는 각각 419가구, 159가구가 분양할 예정이다. 다른 지역은 분양이 없다.",2025-03-28 09:57,https://www.etoday.co.kr/news/view/2456860?trc=main_list_news,이투데이
"국토부 해외건설 수주지원단, 필리핀·베트남 인프라 공략 나선다",https://img.etoday.co.kr/crop/200/125/2135747.jpg,"국토교통부는 4월 1일까지 박상우 장관을 단장으로 하는 수주지원단을 필리핀·베트남에 파견한다고 28일 밝혔다. 박 장관은 이날 아시아개발은행(ADB) 칸다 마사토(Kanda Masato) 총재를 만나 ADB 인프라 개발 분야에서 국토부와 공동사업 추진, 전문인력의 ADB 파견 교류, 정례 워크숍 개최, 국토부 산하기관과의 협업 추진 등 양 기관 간 협력을 강화하는 업무협약(MOU)을 체결할 예정이다. 아울러, 비벤시오 디존(Vivencio B. Dizon) 교통부 장관을 만나, 우리 기업의 철도 및 공항 개발 등 교통 분야 인프라",2025-03-28 09:51,https://www.etoday.co.kr/news/view/2456854?trc=main_list_news,이투데이
영등포 양남시장 주상복합 탈바꿈…공공임대주택·상가 공급,https://img.etoday.co.kr/crop/200/125/2152993.jpg,서울시는 제2차 도시재생위원회 심의 결과 양남시장 도시재생인정사업 변경안을 원안 가결했다고 28일 밝혔다. 양남시장 도시재생인정사업은 영등포구 양평동 1가 30번지 일대에 시장정비사업으로 조성된 시설 일부를 매입하는 것으로 2021년 8월 도시재생사업으로 인정받았다. 2022년 12월 착공했고 다음 달 준공을 앞두고 있다. 이번 사업으로 해당 지역에는 지하 4층~지상 12층 규모의 주거·상업시설이 들어선다. 공공지원임대주택은 주변 시세의 80% 수준의 임대료로 공급된다. 공공임대지원주택은 전체 79가구 중 38가구다. 전 가구 임,2025-03-28 09:48,https://www.etoday.co.kr/news/view/2456852?trc=main_list_news,이투데이
"부영그룹, 산불 피해 복구 성금 5억원 기탁",https://img.etoday.co.kr/crop/200/125/2152753.jpg,"부영그룹은 전국적을 발생하고 있는 대형 산불 피해 현장의 신속한 복구와 피해 지역 주민 지원을 위해 전국재해구호협회에 5억원을 기부했다고 27일 밝혔다. 부영그룹의 성금은 대형 산불 피해 현장 복구와 이재민 지원을 위한 긴급 구호 활동, 생필품 지원 등에 사용될 예정이다. 이중근 부영그룹 회장은 ""상심이 클 피해 지역 주민들께 위로의 마음을 전하고 빠른 피해 복구에 힘을 보태고자 성금을 기탁하게 됐다""며 ""조속한 시일 내에 산불이 진화돼 이재민들이 희망을 잃지 않고 빠르게 일상을 회복하길 기원한다""고 말했다. 부영그룹은 재난·재해",2025-03-27 16:13,https://www.etoday.co.kr/news/view/2456697?trc=main_list_news,이투데이
"'토허제 실책 수습' 서울시, 부동산 조직 개편 착수…주택시장 전문가 합류",https://img.etoday.co.kr/crop/200/125/2152727.jpg,"토지거래허가구역 해제 후 확대 재지정으로 혼란을 야기한 서울시가 부동산 정책의 전문성을 높이기 위한 조직 개선에 착수했다. 27일 서울시는 신선종 대변인 명의의 성명서에서 시민의 삶과 경제에 상당한 영향을 미칠 수 있는 부동산 정책 추진 시 사전 검증체계를 강화하고 관련 조직의 전문성 보강을 주요 내용으로 하는 개선 대책을 수립중에 있다고 밝혔다. 세부 개선대책은 추후 발표할 계획이다. 오세훈 서울시장은 ""앞으로 토지거래허가구역을 포함한 주요 부동산 정책 추진시 주택 시장과 주택시장과 거시경제 동향을 체계적으로 분석해 정확한 판단",2025-03-27 15:39,https://www.etoday.co.kr/news/view/2456673?trc=main_list_news,이투데이
"""할래 말래?""…새아파트는 왜 실종됐을까 [왁자집껄]",https://img.etoday.co.kr/crop/200/125/2131297.jpg,"집과 공간에 대한 이야기를 유쾌하고 깊이 있게 다뤄보자는 취지로 마련한 코너입니다. '왁자집껄'에서는 스타의 집, 부동산 트렌드, 시장 동향, 재미있는 일화 등 실용적이고 유익한 팁까지 집과 관련된 소식을 나누고자 합니다. 왁자지껄하게! 서울 부동산 시장에서 신규 아파트 분양이 사라지고 있습니다. 분양 성수기라 불리는 3월에도 단 한 건의 일반 분양도 없었는데요. 올해 서울에서 나온 분양 물량은 지난달 서초구 ‘래미안 원페를라’ 단 한 곳뿐이었죠. 그럼 왜 이렇게 새 아파트가 사라졌을까요? ""공사비 올랐는데…분양가 규제는 여전"" 먼",2025-03-27 15:28,https://www.etoday.co.kr/news/view/2456605?trc=main_list_news,이투데이
"대우건설, 전국 산불 피해 복구 성금 3억 원 기부",https://img.etoday.co.kr/crop/200/125/2133517.jpg,대우건설이 전국적으로 발생한 대규모 산불 피해 복구를 위해 3억 원을 기부한다고 27일 밝혔다. 이번 성금은 대한적십자사를 통해 전달되며 피해 지역 주민들의 긴급 지원과 복구에 사용될 예정이다. 대우건설은 신속한 복구지원이 필요한 상황에서 지역사회 공헌을 선도하기 위해 기부를 결정했다. 정원주 대우건설 회장은 “산불 피해를 입은 지역 주민들께 깊은 위로의 말씀을 전하며 하루 빨리 일상으로 돌아갈 수 있도록 지원을 아끼지 않겠다”며 “대우건설은 앞으로도 사회적 책임을 다하는 기업으로 재난 및 재해 극복을 위한 나눔을 지속적으로 실천,2025-03-27 15:25,https://www.etoday.co.kr/news/view/2456657?trc=main_list_news,이투데이
"부동산원, 취약계층 34가구 대상 사랑의 집수리 사업",https://img.etoday.co.kr/crop/200/125/2152646.jpg,"한국부동산원은 취약계층의 주거환경 개선을 위해 ‘2025년 REB행복HOME 사업’을 시행한다고 27일 밝혔다. REB행복HOME 사업은 2014년 ‘사랑의 집수리’를 시작으로 11년째 이어지는 한국부동산원의 대표적인 사회공헌 프로그램이다. 주거 취약계층의 안전하고 쾌적한 생활 공간 조성을 위해 현재까지 전국적으로 462가구 지원해 왔다. 올해는 대구사회복지협의회와 함께 다문화, 독거노인, 장애인 가정 등 총 34가구를 선정해 도배, 장판, 창호 등 각 세대별 요구를 반영한 맞춤형 수리를 시공할 예정이다. 이를 위해 한국부동산원은",2025-03-27 14:30,https://www.etoday.co.kr/news/view/2456611?trc=main_list_news,이투데이
“토허제 약발 먹혔다” 서울 아파트값 상승 제동…0.11%로 상승 폭 축소,https://img.etoday.co.kr/crop/200/125/2152778.jpg,서울 강남 3구(서초·강남·송파구) 아파트값 상승세에 제동이 걸렸다. 정부가 24일 강남 3구와 용산구 등 서울 핵심지에서 시행한 토지거래허가제가 효과를 발휘하는 모양새다. 토허제 적용 지역은 일제히 상승 폭이 줄어든 가운데 송파구는 하락 전환했다. 전국 기준으로도 이번 주 하락 전환하는 등 서울지역 토허제 시행 여파가 전국에 영향을 미치고 있다. 27일 한국부동산원이 발표한 주간 아파트값 동향에 따르면 3월 넷째 주(24일 기준) 서울 아파트값은 0.11% 상승했다. 지난주 0.25% 오른 것과 비교하면 0.14%포인트(p) 하,2025-03-27 14:00,https://www.etoday.co.kr/news/view/2456507?trc=main_list_news,이투데이
용산국제업무지구 복합개발 첫발…'제1호 필지' 한전에 공급,https://img.etoday.co.kr/crop/200/125/2152404.jpg,"서울의 중심을 넘어 아시아·태평양의 중심이자 핵심으로 도약한다는 의미를 담은 '용산서울코어' 용산국제업무지구 복합개발사업이 첫발을 뗀다. 27일 서울시는 용산국제업무지구 개발에 원활한 전력공급을 위해 제1호 필지를 한국전력공사에 공급하고 복합개발을 추진한다고 밝혔다. 용산국제업무지구는 올해 말 도로, 공원 등 부지조성 작업 착공을 시작해 2030년대 초부터 기업과 주민이 입주할 수 있다. 서울시는 용산국제업무지구를 건축물 용도와 밀도 규제가 없는 화이트존인 '도시혁신구역'으로 지정해 창의적이고 혁신적인 공간을 조성할 계획이다. 이",2025-03-27 11:15,https://www.etoday.co.kr/news/view/2456473?trc=main_list_news,이투데이
"농촌 단독주택 규제 완화·농공단지 건폐율 상향…국토부, 개정안 입법예고",https://img.etoday.co.kr/crop/200/125/2140934.jpg,"정부가 농촌 지역의 정주 여건을 개선하고 지역경제를 활성화하기 위해 규제완화에 나섰다. 국토교통부는 농림지역 내 일반인의 단독주택 건축을 허용하고, 농공단지의 건폐율을 80%까지 확대하는 내용을 담은 ‘국토의 계획 및 이용에 관한 법률 시행령’ 개정안을 28일부터 5월 7일까지 40일간 입법예고한다고 27일 밝혔다. 먼저 농림지역 내 일반인 단독주택을 허용한다. 그간 농어업인이 아니면 농림지역에 단독주택을 지을 수 없었으나, 이제 일반인도 단독주택을 건축할 수 있게 된다. 이를 통해 정주 여건이 크게 개선되고 농촌 생활이 편리해져",2025-03-27 11:00,https://www.etoday.co.kr/news/view/2456387?trc=main_list_news,이투데이
"현대건설, 샤힌 프로젝트 현장에 50층 높이 올레핀 거탑 세웠다",https://img.etoday.co.kr/crop/200/125/2152375.jpg,"현대건설은 최근 샤힌 에틸렌시설 건설공사 현장에 국내 최대 규모의 프로필렌 분리타워 설치를 완료했다고 27일 밝혔다. 이번에 설치한 타워는 높이 118m, 직경 8.5m, 무게 2370톤에 달해 국내 석유화학 설비로는 사상 최대 규모의 중량물이다. 현대건설은 약 50층 아파트 높이의 설비를 하역부두로부터 현장으로 이동한 후 TLS(Tower Lifting System)를 활용해 14시간만에 설치를 마쳤다. 국내 석유화학 사상 최대 규모를 자랑하는 샤힌 프로젝트는 울산광역시 온산국가산업단지 내 축구장 120여개 면적 부지에 9조25",2025-03-27 10:00,https://www.etoday.co.kr/news/view/2456463?trc=main_list_news,이투데이
지난해 빌라 월세 거래 비중 54.4%로 전세 추월…광진구 수요 ‘급증’,https://img.etoday.co.kr/crop/200/125/2152368.jpg,"지난해 서울 빌라(연립·다세대주택) 전·월세 시장에서 월세 거래 비중이 전세를 추월한 것으로 나타났다. 매매량과 거래금액은 전년 대비 모두 증가하며 각각 4년, 3년 만에 상승 전환했다. 27일 프롭테크 기업 부동산플래닛은 2024년 연간 서울 빌라(연립·다세대주택) 매매 및 전·월세 시장 동향 보고서를 발표했다. 이 보고서에 따르면 서울 빌라 전·월세 거래량은 13만7315건으로 전년(13만7980건)과 비교해 0.5% 감소했다. 이 중 전세 거래는 6만2657건으로 전년(7만1566건) 대비 12.4% 줄어든 반면 월세 거래는",2025-03-27 09:54,https://www.etoday.co.kr/news/view/2456455?trc=main_list_news,이투데이
두산건설 아파트에 삼성물산 '홈닉' 적용한다,https://img.etoday.co.kr/crop/200/125/2152367.jpg,"삼성물산 건설부문의 홈플랫폼 '홈닉'이 두산건설의 아파트 브랜드인 '위브'와 '위브더제니스'에 적용된다. 27일 삼성물산과 두산건설은 스마트 주거 서비스 제공을 위한 전략적 파트너십을 체결했다고 밝혔다. 이번 협약을 통해 '남양주 두산위브 더제니스 평내호평역 N49'를 시작으로 두산건설의 아파트 약 2만 가구에 홈닉을 적용한다. 홈닉은 디지털 스마트홈 서비스와 함께 홈닉 공구, 아파트 케어 등 다양한 주거 생활 서비스를 통합 제공하는 올인원 플랫폼을 지향한다. 홈닉은 2023년 8월 전용 앱 출시와 함께 '래미안 원베일리'에 도입",2025-03-27 09:48,https://www.etoday.co.kr/news/view/2456452?trc=main_list_news,이투데이
"HDC현대산업개발, CBRE코리아와 용산 글로벌 복합상권 마스터플랜 그린다",https://img.etoday.co.kr/crop/200/125/2152340.jpg,"HDC현대산업개발이 글로벌 부동산 컨설팅 선도 기업 CBRE코리아와 손잡고 용산 정비창전면 제1구역을 글로벌 복합상권으로 개발할 종합 마스터플랜을 수립한다고 27일 밝혔다. CBRE코리아는 용산국제업무지구를 비롯해 마곡 원그로브몰, 여의도 TP 타워, 판교 카카오아지트, 롯데월드타워, 코엑스몰, 래미안글로우힐즈 한남 등 국내 최고 수준의 랜드마크 프로젝트에 참여한 글로벌 상업용 부동산 컨설팅사다. 주거와 오피스, 상업, 문화시설이 어우러진 복합개발 사업의 특성과 종합적인 상권 분석을 통해 상권 마스터플랜 수립부터 구성과 운영까지",2025-03-27 09:42,https://www.etoday.co.kr/news/view/2456415?trc=main_list_news,이투데이
"DL그룹, 헌혈 캠페인 시행...“수혈난 해소·생명 나눔 실천”",https://img.etoday.co.kr/crop/200/125/2152361.jpg,"DL그룹은 ‘생명 나눔 헌혈 캠페인’을 시행 중이라고 27일 밝혔다. 이번 행사는 26~27일 서울 종로구 돈의문 디타워 본사에서 진행됐으며 최근 혈액 수급난이 지속되는 가운데 DL그룹이 사회적 책임을 실천하고 ESG 경영을 강화하기 위해 마련됐다. 지주사인 DL㈜을 비롯해 DL이앤씨와 DL케미칼, DL에너지, 카본코 등 그룹 주요 계열사 임직원이 자발적으로 참여한다. DL그룹은 매년 정기적으로 헌혈 캠페인을 추진하며 전사적인 생명 나눔 문화 조성에 힘쓰고 있다. DL그룹은 헌혈 캠페인 외에도 취약계층 주거환경 개선, 에코 플로깅",2025-03-27 09:38,https://www.etoday.co.kr/news/view/2456442?trc=main_list_news,이투데이
용두역 역세권에 49층 주상복합 들어선다,https://img.etoday.co.kr/crop/200/125/2152360.jpg,"서울시는 제5차 도시·건축공동위원회를 열고 '용두역세권 지구단위계획 결정안'을 수정 가결했다고 27일 밝혔다. 대상지는 지하철 2호선 용두역과 동대문구청에 인접했으며 청량리·왕십리 광역중심에 있다. 현재는 홈프러스가 운영 중이다. 서울시는 청량리·왕십리 광역중심에 있는 대상지 특성을 고려해 주거·문화·상업·업무·근린생활시설 등 다양한 복합기능을 도입했다. 이번 계획 결정에 따라 대상지에는 지하 6층~지상 49층 규모의 공동주택(408가구)과 공연장, 판매시설이 들어선다. 공연장은 500석 규모다. 청계천 경관과 주변 지역 스카이라",2025-03-27 09:38,https://www.etoday.co.kr/news/view/2456441?trc=main_list_news,이투데이
"KCC건설, ‘하이브리드 합성구조’ 신기술 공동개발 업무협약…“수주 경쟁력 강화”",https://img.etoday.co.kr/crop/200/125/2099455.jpg,"KCC건설이 적극적인 기술 개발을 통해 수주 경쟁력 강화에 박차를 가하고 있다. 대형 판매시설 등 대공간 구조 설계에 활용되는 신기술 개발에 나서면서 대규모 복합 물류센터 관련 시공 노하우와의 시너지를 통해 사업 포트폴리오를 대거 확장할 전망이다. KCC건설은 26일 서울 성수동 이지파트너 본사에서 진행된 협약식을 통해 ‘하이브리드 합성구조 공법(가칭) 개발을 위한 신기술 공동추진 업무협약(MOU)’을 체결했다고 27일 밝혔다. 업무협약 참여사는 KCC건설 및 포스코, 신세계건설, 씨엠파트너스건축사사무소, 이지파트너 등 5곳이다.",2025-03-27 09:32,https://www.etoday.co.kr/news/view/2456431?trc=main_list_news,이투데이
"LH, 건설현장 추락사고 예방 나섰다…스마트 장비 시연·시설물 점검 진행",https://img.etoday.co.kr/crop/200/125/2152315.jpg,"한국토지주택공사(LH)는 건설현장 추락사고를 예방 및 안전문화 확산을 위한 캠페인을 진행했다고 27일 밝혔다. 전날 화성태안3 B3 블록 건설현장에서 진행된 이번 캠페인은 2월 국토교통부의 ‘건설현장 추락사고 예방대책’에 따라 마련됐다. 이날 현장에서는 근로자의 심전도와 맥박 등 생체 데이터를 분석해 이상 징후를 빠르게 파악할 수 있는 스마트 안전장비 시연과 외부 전문가와 함께하는 중대위험 시설물 특별 안전점검 등이 추진됐다. 특히 타워크레인, 리프트, 비계 등 추락 위험이 큰 시설물을 대상으로 안전사고 예방 수칙을 전달하고 더불",2025-03-27 09:01,https://www.etoday.co.kr/news/view/2456393?trc=main_list_news,이투데이
"용적률 400%·복합개발 허용 …서울시, 준공업지역 개발 가속",https://img.etoday.co.kr/crop/200/125/1569000.jpg,서울시가 준공업지역의 성장 잠재력을 끌어올려 새로운 거점으로 조성하려고 마련한 제도 개선방안이 본격적인 시행을 위한 제도적 기반을 마련했다. 서울시는 서울시의회 서상열 의원이 대표 발의한 '서울특별시 도시계획 조례 일부 개정 조례안'이 27일 개정·공포되며 즉시 시행에 들어간다고 밝혔다. 이번 조례개정으로 준공업지역 내 공동주택 건립을 위한 지구단위계획 수립시 상한 용적률이 현행 250%에서 400%까지 높아지는 등 규제가 대폭 완화된다. 이를 위해 공공임대주택 공급 규정을 추가 신설해 공공성을 강화하면서도 주거공급을 확대할 수,2025-03-27 09:00,https://www.etoday.co.kr/news/view/2456389?trc=main_list_news,이투데이
"현대엔지니어링, 잇따른 사고…실적 회복은 언제쯤?",https://img.etoday.co.kr/crop/200/125/2086366.jpg,현대엔지니어링이 어수선한 상황을 벗어나지 못하고 있다. '빅배스'(대규모 손실 반영)로 부실을 털어낸 뒤 수익성을 크게 끌어올리겠다는 야심 찬 계획이 연이은 사고에 발목이 잡히는 모양새다. 현대엔지니어링의 재무·실적 개선을 진두지휘하기 위해 온 주우정 대표이사는 '청사진'은 꺼내지 못하고 거듭 고개만 숙이고 있다. 27일 건설업계 등에 따르면 지난 25일 현대엔지니어링 충남 아산 오피스텔 공사현장에서 근로자 1명이 작업 중 숨졌다. 올해 현대엔지니어링 현장에서 발생한 3번째 사망사고다. 첫 사고부터 따지면 불과 한 달 새에 사고가,2025-03-27 06:00,https://www.etoday.co.kr/news/view/2456050?trc=main_list_news,이투데이
미래도시펀드 조성 정책 설명회 개최…총 12조 규모,https://img.etoday.co.kr/crop/200/125/1973379.jpg,"국토교통부와 주택도시보증공사(HUG)는 총 12조 원 규모의 미래도시펀드 조성을 위한 투자 정책 설명회를 개최한다고 27일 밝혔다. 이날 서울 콘래드호텔에서 열리는 이번 투자 정책설명회는 본격적인 미래도시펀드 투자자 모집에 앞서 노후계획도시 정책과 미래도시펀드의 구조·지원내용 등을 설명하고자 마련된 자리다. 이날 HUG와 한국금융투자협회는 미래도시펀드 조성 지원, 부동산 금융산업 활성화를 위해 업무협약(MOU)도 체결한다. 그간 정비사업에 필요한 계획비용, 운영비용, 공사비용 등 사업비용은 주민이 자체적으로 정비사업 관련 금융기관",2025-03-27 06:00,https://www.etoday.co.kr/news/view/2456309?trc=main_list_news,이투데이
"박상우 국토부 장관, 재산 4억5284만 원 신고…진현환·백원국 차관 전년 대비↑ [재산공개]",https://img.etoday.co.kr/crop/200/125/2151592.jpg,박상우 국토교통부 장관이 올해 공직자 재산공개에서 지난해보다 4억8475만 원가량 줄어든 4억5284만 원(본인·배우자·부모 포함)의 재산을 신고했다. 27일 정부공직자윤리위원회가 공개한 고위공직자 수시 재산 등록사항에 따르면 박 장관은 본인 명의로 경기 군포시 산본동 아파트(4억3200만 원·149.76㎡)를 보유하고 있다. 해당 가구는 전년 대비 공시가격 하락으로 현재가액은 전년 대비 2400만 원 감소했다. 또 부산 동래구 복천동 소재 아파트(7567만 원·84㎡)를 법정상속 지분으로 보유 중이다. 증권 재산으로는 본인 소유,2025-03-27 00:00,https://www.etoday.co.kr/news/view/2456255?trc=main_list_news,이투데이
"서울시, '명일동 싱크홀' 사고 원인 규명 나선다…국토부와 조사위 구성",https://img.etoday.co.kr/crop/200/125/2152154.jpg,서울시는 강동구 명일동에서 발생한 땅꺼짐 사고와 관련해 시민 불안을 해소하기 위해 국토교통부와 사고 원인을 규명하고 주요 지하철 공사장 인근 도로에 대해서는 GPR 탐사도 강화할 계획이라고 26일 밝혔다. 우선 국토부와 '중앙지하사고조사위원회'를 구성한다. 투명하고 객관적인 사고원인 조사를 위해 사고조사위는 지하안전관리특별법에 의거해 토질·기초 등 법에서 정한 관련 분야의 외부 전문가로 구성할 계획이다. 서울시는 본격적인 조사가 시작되기 전 사고와 관련된 영상·계측자료를 최대한 확보해 조사위에 제공할 예정이다. 인근 CCTV와 차,2025-03-26 17:56,https://www.etoday.co.kr/news/view/2456257?trc=main_list_news,이투데이
