title,thumbnail,short_content,write_time,link,company
"통풍치료제 임상 중단한 LG화학…""항암제 개발 집중“",https://img.etoday.co.kr/crop/200/125/2132415.jpg,"LG화학이 항암제를 미래 먹거리로 낙점했다. 미국 자회사인 아베오 파마슈티컬스를 통해 미국 항암 시장 사업 경쟁력을 강화해 글로벌 혁신 신약을 보유한 기업으로 도약할 계획이다. 28일 제약업계 등에 따르면 LG화학은 지난해 4분기 2520억 원의 영업손실을 기록하며 5년 만에 영업실적이 적자로 돌아섰다. 올해 2월 실적발표 이후 모든 투자의 경제성을 원점에서 재검토하고 최적의 자원을 투입해 재무 건전성을 제고하겠다는 계획을 밝혔다. LG화학은 두경부암 치료제 및 면역항암제, 암 악액질 치료제 등 성장 가능성이 큰 항암신약 파이프라",2025-03-28 17:27,https://www.etoday.co.kr/news/view/2456996?trc=main_list_news,이투데이
"드림어스컴퍼니, 김동훈 대표이사 재선임",https://img.etoday.co.kr/crop/200/125/2153275.jpg,"음악 플랫폼 플로(FLO) 운영사 드림어스컴퍼니는 28일 제26기 정기주주총회에서 김동훈 대표가 사내이사로 재선임됐으며 김진수 사내이사와 이헌 기타비상무이사가 신규 선임됐다고 밝혔다. 드림어스컴퍼니는 이밖에도 △재무제표 승인 △감사 선임 △이사 보수한도 승인 △감사 보수한도 승인 등의 안건을 상정하고, 의결을 진행했다. 김동훈 대표이사는 격화된 음악플랫폼 시장 상황에서 플로의 경쟁력을 지속 강화해 왔으며 국내외 MD 및 공연 비즈니스 확대, 비수익사업 매각 등 뮤직·엔터 중심의 사업 재편에서 리더십을 발휘했다. 또한 SK텔레콤 출",2025-03-28 17:14,https://www.etoday.co.kr/news/view/2457062?trc=main_list_news,이투데이
"윤춘성 LX인터 대표 ""미래 지향적 사업 포트폴리오 전환""",https://img.etoday.co.kr/crop/200/125/2153273.jpg,"윤춘성 LX인터내셔널 대표이사 사장은 28일 정기 주주총회에서 ""기존 사업의 체질 강화와 함께 미래 지향적인 사업구조로의 포트폴리오 전환을 꾸준히 진행해 나갈 것""이라고 밝혔다. 주총에선 윤 대표를 사내이사로, 손란 이사를 사외이사로 각각 재선임했다. 백복현 서울대 경영학과 교수는 사외이사 및 사외이사인 감사위원으로 신규 선임했다.",2025-03-28 17:13,https://www.etoday.co.kr/news/view/2457060?trc=main_list_news,이투데이
"무협, ‘韓-EU 통상정책 포럼’ 개최…“전략적 협력 중요성 커져”",https://img.etoday.co.kr/crop/200/125/2153253.jpg,한국무역협회는 28일 서울 강남구 트레이드타워에서 ‘한-EU 통상정책 포럼’을 개최했다. 포럼은 폰 데어 라이엔 2기 유럽연합(EU) 집행위원회의 통상정책 방향을 검토하고 한-EU 협력 방안을 논의하기 위해 마련됐다. 윤진식 무협 회장은 “글로벌 보호무역주의가 강화되는 가운데 한국과 EU 간 전략적 협력의 중요성이 커지고 있다”고 말했다.,2025-03-28 16:55,https://www.etoday.co.kr/news/view/2457047?trc=main_list_news,이투데이
"이재용ㆍ곽노정, 中 시진핑과 회동…협력 강화하나",https://img.etoday.co.kr/crop/200/125/2153127.jpg,"이재용 삼성전자 회장과 곽노정 SK하이닉스 대표이사 사장이 28일 시진핑 중국 국가주석을 만났다. 업계에 따르면 이 회장과 곽 사장은 이날 오전 11시께(현지시간) 중국 베이징 인민대회당에서 열린린 '국제공상계 대표 회견' 행사에 참석했다. 해당 행사에는 23∼24일 중국발전포럼(CDF)에 참가하러 중국에 온 글로벌 기업 최고경영자(CEO) 30여 명이 모였다. 이번 회동은 중국이 부동산 위기와 투자·소비심리 약화, 외국인 투자 감소 등 경제적 어려움을 겪는 가운데, 글로벌 기업과의 협력을 강화하려는 의도의 일환으로 진행됐다. 이",2025-03-28 16:40,https://www.etoday.co.kr/news/view/2457040?trc=main_list_news,이투데이
"파르나스호텔, 작년 영업익 848억 전년比 17.8% 감소",https://img.etoday.co.kr/crop/200/125/2153241.jpg,"파르나스호텔은 2024년 매출 4545억 원, 영업이익 848억 원을 기록했다고 28일 밝혔다. 전년 대비 매출은 5.7%, 영업이익은 17.8% 감소했다. 파르나스호텔 관계자는 “주력 호텔 중 하나로 2023년 전체 매출의 25.7% 비중을 차지했던 인터컨티넨탈 서울 코엑스가 지난해 7월 전면 리모델링 및 리브랜딩을 위해 영업을 중단했음에도 호실적을 기록했다”고 설명했다. 그랜드 인터컨티넨탈 서울 파르나스, 파르나스 호텔 제주, 나인트리 바이 파르나스 등 파르나스호텔이 운영하는 모든 호텔들이 전년 대비 매출 성장을 이뤘다. 인터",2025-03-28 16:33,https://www.etoday.co.kr/news/view/2457036?trc=main_list_news,이투데이
"CJ푸드빌, 지난해 영업익 556억원…창사 이래 최대",https://img.etoday.co.kr/crop/200/125/2115089.jpg,"CJ푸드빌이 지난해 전 사업 부문 흑자를 달성하며 최대 실적을 냈다. CJ푸드빌은 2024년 연결기준 매출액 9092억 원, 영업이익 556억 원으로 전년 대비 각각 7.6%, 22.7% 증가했다고 28일 밝혔다. 흑자 전환에 성공한 2021년 이래로 4개년도 연속 성장세를 보이며 지난해 역대 최대 영업이익을 기록했다. CJ푸드빌은 사업 호조의 주요 배경으로 글로벌 사업의 지속적인 성장세를 꼽았다. CJ푸드빌이 운영하는 뚜레쥬르는 현재 9개국에 진출해 약 560여 개의 매장을 운영하고 있으며, 미국∙인도네시아∙베트남에 현지 법인을",2025-03-28 16:21,https://www.etoday.co.kr/news/view/2457027?trc=main_list_news,이투데이
"유한양행 폐암신약 ‘렉라자’, 미국·유럽 이어 일본 허가 획득",https://img.etoday.co.kr/crop/200/125/2090515.jpg,유한양행의 폐암 치료제 ‘렉라자’(성분명 레이저티닙)가 일본 시장에도 진출한다. 28일 제약업계 등에 따르면 유한양행의 비소세포폐암 치료제 ‘렉라자’(성분명 레이저티닙)와 존슨앤드존슨(J&J)의 항암제 ‘리브리반트’(성분명 아미반타맙) 병용요법이 일본 후생노동성(MHLW)으로부터 상피세포성장인자수용체(EGFR) 유전자 변이 양성 비소세포폐암(NSCLC) 치료제로 제조 판매 승인을 획득했다. 유한양행은 이번 허가로 1500만 달러(220억 원)의 마일스톤(단계별 기술료 을 수령할 예정이다. 세기구치 슈헤이(Sekiguchi Shuh,2025-03-28 16:19,https://www.etoday.co.kr/news/view/2457018?trc=main_list_news,이투데이
"SOOP, 최영우 신임 대표이사 선임…글로벌 확장·성장 전략 본격화",https://img.etoday.co.kr/crop/200/125/2153226.jpg,"SOOP은 28일 개최된 정기 주주총회 및 이사회 결의를 통해 최영우 CSO를 신임 대표이사로 선임하고, 서수길·최영우 각자 대표 체제로 전환했다고 밝혔다. 서수길 대표는 신규 사업과 프로젝트 중심의 성장 동력 확보에 주력한다. 최영우 대표는 B2B 파트너십 확대를 중심으로 전략 수립과 실행을 이끈다.",2025-03-28 16:18,https://www.etoday.co.kr/news/view/2457025?trc=main_list_news,이투데이
"우크라이나 상공회의소, 한국과 전후 재건 협력 본격화",https://img.etoday.co.kr/crop/200/125/2153225.jpg,"우크라이나 상공회의소(UCCI)는 한국과의 전후 재건 협력과 민간 경제 파트너십 확대를 위해 우크라이나 경제대표단은 24일에 방한해 29일에 귀국한다고 28일 밝혔다. 대표단을 이끄는 로만 그레고리신(Roman Grygoryshyn) 의장은 현재 우크라이나-한국 기업 협의회(UKBC)를 이끌고 있으며, 이번 방문은 UCCI가 공식 주관한 경제 사절단 활동의 일환으로 진행됐다. 로만 그레고리신 의장은 1991년 우크라이나 서부 이반오프란키우스크주 코시브(Kosiv) 지역에서 태어난 행정·경제 분야 전문가다. 그는 우크라이나 최고 명",2025-03-28 16:14,https://www.etoday.co.kr/news/view/2457023?trc=main_list_news,이투데이
"과기정통부, 딜라이브 SO·남인천방송 재허가 결정",https://img.etoday.co.kr/crop/200/125/2153224.jpg,"과학기술정보통신부는 딜라이브 계열 16개 종합유선방송사업자(SO) 및 남인천방송에 대해 재허가를 통보했다고 28일 밝혔다. 과기정통부는 방송, 법률, 경영, 회계, 기술, 시청자 등 총 6개 분야 민간 전문가로 SO 재허가 심사위원회를 구성해 지난해 11월 26일부터 29일까지 심사를 진행했다. 재허가 심사위원회는 심사 결과 17개 사업자 모두 재허가 기준인 400점(600점 만점)을 넘어 재허가를 의결하면서 △시청자 위원회 충실 운영, △PP 계약 등 관련 가이드라인 준수, △지역채널 투자계획 성실 이행 등에 관한 조건 부과가",2025-03-28 16:13,https://www.etoday.co.kr/news/view/2457022?trc=main_list_news,이투데이
"롯데케미칼, 일본 레조낙 지분 2750억원에 매각",https://img.etoday.co.kr/crop/200/125/2137226.jpg,"롯데케미칼이 일본 소재기업 레조낙 지분을 매각해 추가 유동성을 확보한다. 롯데지주는 롯데케미칼이 28일 레조낙 지분 4.9%를 2750억 원에 매각했다고 밝혔다. 2020년 매입한 레조낙 지분 전량으로, 롯데케미칼은 이번 매각과 그간 확보한 배당금을 합쳐 약 800억 원의 차익을 실현했다. 지분 매각 후에도 레조낙과의 사업 협력은 지속적으로 이어간다. 롯데케미칼은 최근 악화된 석유화학시장 환경 속에서 신속한 의사결정을 진행하며 비효율 사업 및 자산 매각을 중심으로 재무구조 개선에 속도를 내고 있다. 이번 레조낙 지분 매각도 비핵심",2025-03-28 16:01,https://www.etoday.co.kr/news/view/2457019?trc=main_list_news,이투데이
K게임 3월 신작 흥행 돌풍…“글로벌서 통했다”,https://img.etoday.co.kr/crop/200/125/2152983.jpg,크래프톤 ‘인조이’ 발매 40분 만에 스팀 1위 넥슨 ‘카잔’ 체험판 글로벌 다운로드 100만 넥슨 ‘마비노기 모바일’ 앱스토어 1위 등극 넥슨과 크래프톤이 연달아 선보인 초대형 신작들이 초반 글로벌 흥행에 성공한 모양새다. 이들 게임의 흥행이 움츠러들었던 게임업계에 활력을 불어넣을 수 있을지 관심이 모인다. 28일 온라인 게임 유통망 ‘스팀’에 따르면 크래프톤의 인생 시뮬레이션 게임 ‘인조이’(inZOI) 얼리 액세스(앞서 해보기) 버전은 발매 40분 만에 전 세계 매출 1위(판매수익 기준)를 기록했다. 인조이 얼리 액세스 버전,2025-03-28 15:30,https://www.etoday.co.kr/news/view/2456981?trc=main_list_news,이투데이
"부광약품, 1000억 규모 유증 결정…“제조설비·R&D 확대”",https://img.etoday.co.kr/crop/200/125/2056353.jpg,"부광약품은 28일 이사회를 열고 1000억 원 규모의 유상증자를 결의했다고 공시했다. 회사는 ‘2030년 20위권 제약사 도약’이란 제2성장 목표를 설정하고, 안정적인 공급체계 구축을 위한 제조설비의 경쟁력을 확보하는 한편 차별성과 경쟁력 있는 신제품의 발매를 위한 자체 연구역량의 강화를 추진한다는 계획이다. 부광약품은 이번 유상증자를 통해 조달하는 자금으로 △기존 제조설비 확장 및 설비 도입 △신규 제조설비 취득 등에 투자한다. 이는 안정적인 의약품공급과 중장기 성장 동력을 확보하기 위한 것으로 최근 계속된 품절 문제가 회사의",2025-03-28 15:26,https://www.etoday.co.kr/news/view/2457001?trc=main_list_news,이투데이
"테슬라코리아, 4월 모델Y 부분변경 모델 출시…5299만원부터",https://img.etoday.co.kr/crop/200/125/2153195.jpg,"테슬라코리아는 내달 2일 모델Y의 부분변경 모델인 '뉴 모델Y'를 국내에 출시한다고 28일 밝혔다. 뉴 모델Y는 후륜구동인 'RWD', 사륜구동인 '롱레인지', 테슬라 첫 한정판인 '론치 시리즈' 등 3가지 트림으로 출시된다. 국내 판매 가격은 RWD 5299만 원, 롱레인지 6314만 원, 론치 시리즈 7300만 원이다.",2025-03-28 15:24,https://www.etoday.co.kr/news/view/2456999?trc=main_list_news,이투데이
"윤성태 휴온스그룹 회장, 3년 만에 경영 전격 복귀",https://img.etoday.co.kr/crop/200/125/2153193.jpg,"휴온스그룹은 윤성태 회장이 창립 60주년을 맞은 그룹의 대도약을 위해 경영 일선에 복귀한다고 28일 밝혔다. 휴온스그룹 지주사 ㈜휴온스글로벌은 28일 경기도 성남 판교 사옥에서 정기 주주총회 및 이사회를 개최하고 윤 회장의 대표이사 선임을 가결했다. 이에 따라 휴온스글로벌은 윤성태·송수영 각자대표 체제를 맞이한다. 윤 회장은 2022년 경영 일선에서 물러난 후 3년 만에 복귀해 미래 사업을 진두지휘한다. 그는 “글로벌 시장 확대, 연구개발을 통한 신성장동력 확보 등 미래 지속 성장을 위한 핵심 과제들을 살피겠다”라고 말했다.",2025-03-28 15:19,https://www.etoday.co.kr/news/view/2456997?trc=main_list_news,이투데이
"유한양행, 프리미엄 여성 유산균 ‘엘레나’ 연매출 300억 달성",https://img.etoday.co.kr/crop/200/125/2153192.jpg,"유한양행은 프리미엄 여성 유산균 브랜드 ‘엘레나’가 연 매출 300억 원을 돌파했다고 28일 밝혔다. 엘레나는 국내 최초로 식품의약품안전처에서 여성 질 건강에 도움을 줄 수 있는 기능성을 인정받은 개별 인정형 건강기능식품이다. 유한양행은 다양한 마케팅 활동과 캠페인을 통해 브랜드 인지도를 확대하고, 온·오프라인 유통 채널을 활용해 소비자 접근성을 높이고 있다. 유한양행 관계자는 “엘레나는 국내 프리미엄 여성 유산균 시장을 선도하는 제품으로 10여 년 동안 꾸준히 신뢰를 주는 제품으로 입지를 다져왔다”라고 말했다.",2025-03-28 15:14,https://www.etoday.co.kr/news/view/2456995?trc=main_list_news,이투데이
소비자단체 “원재룟값 비슷한데 가격 인상…소비자 부담 외면”,https://img.etoday.co.kr/crop/200/125/2143243.jpg,"식품 기업들의 가격 인상 행렬이 이어지는 가운데 소비자단체가 이를 두고 비판의 목소리를 냈다. 한국소비자단체협의회는 28일 성명을 통해 ""식품 기업들이 3∼4월 식품 가격 인상을 단행하면서 환율과 국제 식량 가격 상승을 근거로 내세웠지만 실제로는 실적 개선과 이윤추구를 위해 소비자 부담을 외면한 것은 아닌지 의문이 든다""고 지적했다. 녹색소비자연대 등 10여개 소비자단체로 구성된 협의회는 코코아와 원두 등 일부 원재료 가격이 올랐지만, 밀가루와 식용유, 옥수수 등은 작년과 비슷하거나 오히려 하락했다고 지적했다. 정부가 식품업계의",2025-03-28 15:05,https://www.etoday.co.kr/news/view/2456992?trc=main_list_news,이투데이
"개인정보위, 소비자·시민단체와 개인정보 보호 함께 고민한다",https://img.etoday.co.kr/crop/200/125/2152792.jpg,"개인정보보호위원회는 28일 서울 광화문 교보생명빌딩에서 ‘소비자·시민단체 개인정보 정책간담회’를 개최했다고 밝혔다. 개인정보위는 IP(아이피) 카메라와 같은 IT(정보기술) 기기의 개인정보 처리 현황 파악 및 분석, 개인정보 처리방침 평가, 개인정보 침해 요소 공동 모니터링 등에 소비자·시민단체가 참여하는 방안을 제안했다.",2025-03-28 15:00,https://www.etoday.co.kr/news/view/2456838?trc=main_list_news,이투데이
롯데리아ㆍ노브랜드버거ㆍ써브웨이 등 버거ㆍ샌드위치 가격 줄인상,https://img.etoday.co.kr/crop/200/125/2080792.jpg,"4월부터 버거와 샌드위치의 가격이 줄줄이 오른다. 롯데GRS가 운영하는 버거 프랜차이즈 롯데리아는 다음 달 3일부터 버거류 23종을 포함해 총 65개 품목 판매 가격을 평균 3.3% 인상한다고 28일 밝혔다. 제품별 인상 가격은 최소 100원에서 최대 400원 수준으로, 대표 메뉴 ‘리아 불고기’와 ‘리아 새우’는 단품과 세트 메뉴 모두 200원 인상해 각각 5000원, 7300원으로 가격을 조정한다. 롯데GRS 관계자는 “원자재 상승은 곧 가맹점의 이익률 하락으로 이어져 이익 확보를 위해 불가피한 가격 조정을 결정했다” 며 “다",2025-03-28 14:35,https://www.etoday.co.kr/news/view/2456972?trc=main_list_news,이투데이
백종원 “점주께 제일 죄송…회사 시스템 원점 재점검”[2025 주총],https://img.etoday.co.kr/crop/200/125/2153157.jpg,“원산지 관리 체계 강화…홍보팀 만들 것” M&A·전문경영인 선임 등 가능성 열어둬 백종원 더본코리아 대표가 “경영자로서 더욱 철저하게 관리하지 못한 점 뼈저리게 반성하고 있다”며 주주들에게 직접 사과했다. 백 대표는 28일 오전 서울 서초구에서 열린 정기 주주총회에 정장 차림으로 참석해 주주들을 한 명씩 찾아다니며 악수를 나눴다. 40여 명의 주주가 참석한 주총은 차분한 분위기에서 진행됐다. 백 대표는 인사말을 통해 “호실적에도 최근 원산지 논란으로 주주 여러분께 심려를 끼쳐드려 깊이 사과드린다”고 말했다. 백 대표가 주주들 앞,2025-03-28 14:33,https://www.etoday.co.kr/news/view/2456962?trc=main_list_news,이투데이
"유통가, 산불지원 구호품·성금 지원의 손길",https://img.etoday.co.kr/crop/200/125/2153156.jpg,"유통업계가 최근 산불 피해를 돕기 위해 지원 행렬에 나섰다. 삼양그룹은 영남지역에서 발생한 산불로 피해를 입은 주민들을 지원하기 위해 대한적십자사에 성금 1억5000만 원과 5000만 원 상당의 의약품 기탁했다고 28일 밝혔다. 삼양그룹 계열사인 삼양사와 삼양패키징, 삼양엔씨켐이 성금을 마련했으며, 삼양홀딩스 바이오팜그룹은 붙이는 골관절염 치료제 ‘류마스탑파워 플라스타’를 지원했다. 이번에 대한적십자사를 통해 전달한 성금과 의약품은 경남 산청과 하동, 경북 의성, 울산 울주, 경남 김해 등 산불로 피해를 입은 지역의 피해 복구와",2025-03-28 14:24,https://www.etoday.co.kr/news/view/2456971?trc=main_list_news,이투데이
[단독] 산불로 통신 두절…방송통신 재난 관리 예산은 21.5% 삭감,https://img.etoday.co.kr/crop/200/125/2153152.jpg,"2025 방송통신 재난관리 예산 전년比 21.5%↓ 데이터 센터 등 관리 대상 늘었지만, 예산은 줄어 산불로 기지국 2829개소 피해…82.6% 복구 과기부, “대응 총력”…방송통신재난 경보 ‘경계’ 상향 대형 산불로 통신 두절이 잇따르면서 방송통신 재난 관리 중요성이 커졌지만, 정작 올해 관련 예산은 작년 대비 21.5% 줄어든 것으로 나타났다. 28일 과학기술정보통신부 2025년도 예산 및 기금운용계획 사업설명 자료에 따르면 방송통신 재난관리 예산은 41억4400만 원으로 지난해 52억8200만 원 대비 21.5% 감소했다.",2025-03-28 14:19,https://www.etoday.co.kr/news/view/2456960?trc=main_list_news,이투데이
"네이버 모빌리티 AI 에이전트, 현대자동차그룹과 첫 시동",https://img.etoday.co.kr/crop/200/125/2153148.jpg,"네이버는 분야별 특화된 인공지능(AI) 에이전트 제공 전략의 일환으로, 모빌리티 AI 에이전트 제공에도 나선다고 28일 밝혔다. 네이버는 현대자동차그룹과의 첫 파트너십으로, 현대자동차그룹의 개발자 컨퍼런스 ‘Pleos 25’에서 차량용 AI 에이전트 모습의 일부를 미리 공개했다.",2025-03-28 13:58,https://www.etoday.co.kr/news/view/2456959?trc=main_list_news,이투데이
"크래프톤, 인도 크리켓 게임 개발사 ‘노틸러스 모바일’ 경영권 확보",https://img.etoday.co.kr/crop/200/125/2153147.jpg,크래프톤은 인도 크리켓 게임 개발사 ‘노틸러스 모바일(Nautilus Mobile)’의 지분을 총 1375만 달러(한화 약 202억 원)에 인수하며 경영권을 확보했다고 28일 밝혔다. 인수 주체는 크래프톤 인도법인으로 노틸러스 모바일은 크래프톤 인도법인의 자회사로 편입된다.,2025-03-28 13:54,https://www.etoday.co.kr/news/view/2456957?trc=main_list_news,이투데이
"두산에너빌리티, 여수천연가스발전소 주기기 공급",https://img.etoday.co.kr/crop/200/125/2153146.jpg,"두산에너빌리티는 한국서부발전과 3200억 원 규모 여수천연가스발전소 주기기 공급계약을 체결했다고 28일 밝혔다. 2028년까지 380메가와트(㎿) 규모 H급(입구 1500℃ 이상 고효율 모델) 초대형 가스터빈과 스팀터빈, 배열회수보일러(HRSG) 등을 공급한다.",2025-03-28 13:54,https://www.etoday.co.kr/news/view/2456956?trc=main_list_news,이투데이
현대차그룹 SW 브랜드 ‘플레오스’ 공개 “모빌리티 테크 기업 전환”,https://img.etoday.co.kr/crop/200/125/2153130.jpg,"신규 개발자 컨퍼런스 ‘플레오스 25’ 개최 SW 중심의 모빌리티 생태계 구축 방안 소개 2027년 말까지 자율주행 레벨2+ 양산 계획 현대자동차그룹이 모빌리티 소프트웨어 브랜드 ‘플레오스(Pleos)’를 발표하고, 소프트웨어 중심 ‘모빌리티 테크 기업’으로의 전환을 선언했다. 2027년 말까지 레벨2+(플러스) 수준의 자율주행 기술을 양산차에 탑재하겠다는 로드맵도 내놨다. 송창현 현대차·기아 AVP 본부장 사장은 28일 서울 강남구 코엑스에서 개최된 개발자 콘퍼런스 ‘플레오스 25’에서 현대차그룹의 새로운 모빌리티 소프트웨어 브",2025-03-28 13:39,https://www.etoday.co.kr/news/view/2456924?trc=main_list_news,이투데이
"[종합] 삼성, 중국 투자 및 협력 확대할까… 이재용, 시진핑 중국 주석과 회동",https://img.etoday.co.kr/crop/200/125/2153127.jpg,"삼성, 중국 내 사업 확장 가속화 전망 전장 사업 확대 위한 중국 기업과의 협력 강화 이재용 삼성전자 회장이 28일 시진핑 중국 국가주석을 만나 투자 및 협력 방안을 논의했다. 삼성전자는 중국 시안 등에 반도체 생산 공장을 운영 중이다. 최근 전장 사업 확대를 위한 중국 기업들과의 협력도 강화하고 있다. 이번 시 주석과의 만남을 계기로 삼성의 중국 내 투자 확대 및 현지 기업과의 협업이 가속화될 것이란 전망이 나온다. 28일 재계 및 외신에 따르면 이 회장은 이날 오전 11시(현지시간) 베이징 인민대회당에서 열린 '국제공상계 대표",2025-03-28 13:22,https://www.etoday.co.kr/news/view/2456929?trc=main_list_news,이투데이
고려아연 주총장 나서는 강성두 영풍 사장 [포토],https://img.etoday.co.kr/crop/200/125/2153119.jpg,강성두 영풍 사장이 28일 서울 용산구 몬드리안 호텔에서 열린 제51기 고려아연 주주총회장을 나서고 있다.,2025-03-28 13:15,https://www.etoday.co.kr/news/view/2456937?trc=main_list_news,이투데이
"이재용 삼성전자 회장, 시진핑 중국 주석 주최 글로벌 CEO 회동 참석",https://img.etoday.co.kr/crop/200/125/2151194.jpg,이재용 삼성전자 회장이 28일 시진핑 중국 국가주석을 만나 투자 협력 등을 논의했다. 삼성전자는 중국 시안 등에 공장을 두고 메모리 반도체를 생산 중이다. 앞서 이 회장은 중국 샤오미와 BYD 등 전기차 업체와도 회동한 바 있다. 28일 재계 및 외신 등에 따르면 이 회장은 이날 오전 11시께(현지시간) 베이징 인민대회당에서 열린 시 주석과 '국제공상계 대표 회견'으로 이름 붙여진 글로벌 CEO 면담에 참석했다. 이번 면담에는 이 회장을 비롯해 23∼24일 중국발전포럼(CDF)에 참가하러 중국에 온 독일 자동차 업체 BMW와 메르세,2025-03-28 12:59,https://www.etoday.co.kr/news/view/2456928?trc=main_list_news,이투데이
"재판관 2명 퇴임 코앞...尹 선고는 '안갯속', 민주당 '불안감'",https://img.etoday.co.kr/crop/200/125/2152425.jpg,"윤석열 대통령 탄핵심판 선고가 사실상 4월로 넘어가게 됐다. 문형배 헌법재판소장 권한대행과 이미선 재판관의 퇴임이 3주 앞으로 다가왔는데도 헌법재판관들의 장고가 계속되면서 '4월 선고' 가능성이 가시화하자 더불어민주당의 내부적 불안감이 확산하는 모양새다. 더불어민주당 초선 국회의원들은 28일 오후 긴급성명서를 내고 ""다가오는 4월 18일, 두 명의 헌법재판관이 퇴임하게 된다. 그 전에 윤석열 (대통령)이 파면되지 않는다면 대한민국은 심각한 혼란에 빠지게 될 것""이라며 ""국회는 국민을 위해, 헌법재판소의 판결을 무시하고 행정부 독재",2025-03-28 18:24,https://www.etoday.co.kr/news/view/2457082?trc=main_list_news,이투데이
