title,thumbnail,short_content,write_time,link,company
"건설공제조합, 금융관리체계 개편…“금융전문사로 발돋움”",https://img.etoday.co.kr/crop/200/125/2006024.jpg,"건설공제조합(조합)이 금융관리체계의 전면 개편을 통한 금융전문회사로 탈바꿈하겠다고 20일 밝혔다. 이날 조합에 따르면 조합은 지난해 보증사업체계 전반에 대한 연구용역을 마치고 현재 그 결과를 규정과 시스템에 반영하고 있다. 이를 통해 위기 상황에서도 보증사업이 건전하게 유지될 수 있는 보증한도와 심사, 요율 등 전반적인 체계를 개선한다는 방침이다. 자산운용 분야에서도 개편이 진행 중이다. 지난해 하반기에 구축한 자산운용시스템은 자산운용 규모, 수익률, 투자포트폴리오 현황에 대한 실시간 정보를 활용해 자산운용의 업무효율을 극대화하고",2025-02-20 17:50,https://www.etoday.co.kr/news/view/2446883?trc=main_list_news,이투데이
"""TV만 틀면 나온다""… '다작의 아이콘' 전현무가 사는 '아이파크 삼성'은 [왁자집껄]",https://img.etoday.co.kr/crop/200/125/2138912.jpg,"집과 공간에 대한 이야기를 유쾌하고 깊이 있게 다뤄보자는 취지로 마련한 코너입니다. '왁자집껄'에서는 스타의 집, 부동산 트렌드, 시장 동향, 재미있는 일화 등 실용적이고 유익한 팁까지 집과 관련된 소식을 나누고자 합니다. 왁자지껄하게! 최근 방송가에서 가장 활발하게 활동하는 연예인 중 한 명을 꼽으라면 단연 '전현무'입니다. 아나운서 출신 방송인 전현무는 특유의 입담과 재치 있는 진행으로 다수의 프로그램을 이끌고 있죠. 워낙 많은 프로그램을 진행하다 보니 그에게 붙은 수식어는 '다작(多作)의 아이콘' 입니다 전현무의 활약은 숫자",2025-02-20 15:57,https://www.etoday.co.kr/news/view/2446776?trc=main_list_news,이투데이
"DL이앤씨, 대구·천안서 마수걸이 분양…다음 달 4일부터 동시 청약",https://img.etoday.co.kr/crop/200/125/2138943.jpg,"DL이앤씨는 21일 동대구와 천안 성성권역에서 견본주택을 열고 2025년 마수걸이 분양에 나선다고 20일 밝혔다. 동대구에 공급되는 ‘e편한세상 동대구역 센텀스퀘어’는 동대구역 초역세권 입지이며, 천안 성성지구에 공급되는 ‘e편한세상 성성호수공원’은 성성호수공원 조망이 가능한 레이크프론트 입지로 두 단지 모두 수요자로부터 기대가 높다. 먼저 e편한세상 동대구역 센텀스퀘어는 대구 동구 신천동 옛 동대구 고속버스터미널 부지에 들어서며 지하 5층~지상 24층, 4개 동, 전용면적 79~125㎡, 총 322가구 규모다. 전 가구가 일반분",2025-02-20 15:03,https://www.etoday.co.kr/news/view/2446791?trc=main_list_news,이투데이
"삼성물산, ‘스마트 말뚝 공법’ 선봬…리모델링 품질·안전 다 잡는다",https://img.etoday.co.kr/crop/200/125/2138907.jpg,"삼성물산 건설부문(삼성물산)이 리모델링 사업 기초공사에 필요한 기초보강공법 개발을 통해 기술 경쟁력 확보에 박차를 가하고 있다. 20일 삼성물산은 리모델링 현장 기초공사에 쓰이는 말뚝과 관련된 8건의 기술을 자체 개발해 특허를 마쳤다고 밝혔다. 그중에서도 ‘스마트선재하공법’ 관련 특허 4건은 지난해 보강 말뚝 시공사인 고려이엔씨와 공동으로 특허를 출원한 후 등록까지 완료했고, 전문기술학회인 지반공학회 기술인증도 마쳤다. 최근에는 국토교통부 건설신기술 지정을 추진하고 있다. 선재하공법이란 기존 시공된 말뚝 외에 보조 말뚝을 추가로",2025-02-20 14:41,https://www.etoday.co.kr/news/view/2446769?trc=main_list_news,이투데이
지난해 서울 상업용 부동산 투자 22조…9년 만에 최대,https://img.etoday.co.kr/crop/200/125/2138890.jpg,"지난해 서울 상업용 부동산 투자액이 9년 만에 최대치를 나타냈다. 오피스 투자가 늘어난 영향이다. 20일 CBRE코리아는 '2024년 4분기 국내 상업용 부동산 시장 보고서'를 통해 지난해 서울 투자금액이 22조 원으로 약 49% 증가했다고 밝혔다. 저금리로 투자가 활발했던 2021년(21조 원) 투자액을 웃도는 동시에 2015년 이후 가장 많은 금액이다. 오피스 거래(13조 원)가 전체의 60%를 차지하며 실적을 견인했다. 이어 물류(5조 원), 호텔과 리테일(각각 2조 원) 순이다. 지난해 4분기 투자액은 5조2685억 원을",2025-02-20 14:04,https://www.etoday.co.kr/news/view/2446749?trc=main_list_news,이투데이
"동부건설, 군산 전북대 병원 건립공사 착공… 공사비 약 2000억 원",https://img.etoday.co.kr/crop/200/125/2138739.jpg,"20일 동부건설은 전북 군산시 전북대학교병원 건립공사를 착공했다고 밝혔다. 군산시 사정동 194번지 일원에 지하 2층~지상 10층 규모의 의료시설을 건립하는 프로젝트로, 총 공사비는 약 2000억 원 규모다. 공사 기간은 착공일로부터 약 40개월로, 19일 기공식을 개최했다. 군산 전북대병원 건립은 지역 의료환경 개선 목적으로 약 15년 간 추진, 전북의 숙원 사업 중 하나로 꼽힌다. 준공 후 특성화센터 집중 운영 등을 통해 미래형 병원이자 노년의학 특성화 병원으로 거듭날 계획이다. 이번 프로젝트가 창의성과 고난도 기술력이 필요한",2025-02-20 11:33,https://www.etoday.co.kr/news/view/2446648?trc=main_list_news,이투데이
‘30일 내 안전진단 계획 통보·추진위 조기 구성’…정비사업 패스트트랙 본격화,https://img.etoday.co.kr/crop/200/125/2071342.jpg,"국토교통부는 재건축진단의 시기 조정 등을 포함한 정비사업 패스트트랙 제도를 시행하고, 각종 동의 시 전자방식을 전격적으로 활용하기 위한 세부사항을 담은 ‘도시 및 주거환경정비법 시행령’을 입법예고한다고 20일 밝혔다. 이번 입법예고는 주택공급 확대 및 건설경기 보완방안과 주택공급 확대방안에 따라 개정된 도시정비법의 위임사항을 정하기 위한 것이다. 먼저 정비사업 패스트트랙 운영사항으로 지자체가 재건축진단 실시 여부를 자체 판단하던 현지조사 절차가 법률개정으로 폐지됨에 따라, 지자체는 재건축진단을 요청 받으면 현지조사 없이 30일 이",2025-02-20 11:00,https://www.etoday.co.kr/news/view/2446640?trc=main_list_news,이투데이
"부영 우정교육문화재단, 외국인 유학생 98명에 장학금",https://img.etoday.co.kr/crop/200/125/2069354.jpg,"부영그룹 우정교육문화재단은 20일 서울 중구 대한상공회의소에서 '2025년 1학기 외국인 장학금 수여식'을열고 30개국 외국인 유학생 98명에게 장학금 약 4억원을 제공했다고 밝혔다. 우정교육문화재단은 이 회장이 사재를 출연해 2008년 설립됐으며 2010년부터 매년 두 차례 외국인 유학생에게 장학금을 지급한다. 이번을 포함해 총 43개국 2645명이 104억원의 장학금을 받았다. 콜롬비아 출신 아르구에조 가오나는 ""홀로 유학생활을 하다보니 경제적인 어려움이 많았는데 우정교육문화재단의 지원 덕에 학업에만 전념할 수 있는 환경이 마",2025-02-20 09:39,https://www.etoday.co.kr/news/view/2446643?trc=main_list_news,이투데이
"해외건설협회, 국토교통 ODA 신규사업 6건 발주… 212억 규모",https://img.etoday.co.kr/crop/200/125/2138709.jpg,"해외건설협회는 2025년 국토교통 ODA 신규사업 6건을 발주했다고 20일 밝혔다. 총 212억 원 규모다. 이번 발주 사업은 중점협력국인 베트남에서의 도시정비 사업(49억 원 규모)과 인도네시아 공간정보 관련 사업(49억9000만 원)이 포함됐다. 이밖에 콜롬비아 지적 관련 사업과 몽골, 캄보디아의 도로·교통 시스템 디지털화 사업, 우크라이나 건설기계 부문 연수사업 등도 있다. 협회는 국토교통 ODA 전담기관 지정 5년 차를 맞아 사업관리의 내실화와 전문성 강화를 위한 노력을 지속할 계획이다. 사업 수행기관과 독립된 감리기관을",2025-02-20 09:30,https://www.etoday.co.kr/news/view/2446629?trc=main_list_news,이투데이
[오늘의 청약 일정] '대전롯데캐슬더퍼스트' 1순위 청약 접수 등,https://img.etoday.co.kr/crop/200/125/2138572.jpg,"부동산 정보업체 부동산R114에 따르면 20일인 오늘은 경기 고양시 ‘고양창릉S5·S6블록’(공공분양) 본청약이 진행된다. 이달 21일까지다. 또, 대전 동구 ‘대전롯데캐슬더퍼스트’의 1순위 청약 접수를 받는다.",2025-02-20 07:00,https://www.etoday.co.kr/news/view/2446513?trc=main_list_news,이투데이
"국토부, 대전서 노후계획도시 정비 지원 ‘찾아가는 미래도시지원센터’ 연다",https://img.etoday.co.kr/crop/200/125/2138463.jpg,"국토교통부는 대전시, 한국토지주택공사(LH)와 함께 대전 둔산지구와 법동지구를 대상으로 ‘찾아가는 미래도시지원센터’를 개최했다고 20일 밝혔다. 전날 열린 ‘찾아가는 미래도시지원센터’는 부산과 인천에 이어 세 번째로 개최됐다. 노후계획도시정비 기본계획 수립 대상지인 둔산지구·법동지구 중 특별정비예정구역(안)에 대한 이해도 제고가 우선적으로 요구되는 아파트 단지를 대상으로 진행했다. 대전시 노후계획도시 정비사업에 대한 주요내용 및 향후계획 안내, 질의사항에 대한 1대 1 컨설팅을 위해 LH 직원과 대전시 직원, 기본계획 수립 용역사",2025-02-20 06:00,https://www.etoday.co.kr/news/view/2446430?trc=main_list_news,이투데이
"“더 올려도 팔릴 듯"" 토허제 해제에 잠실·대치 눈치게임 ‘치열’… 과열 우려도[가보니]",https://img.etoday.co.kr/crop/200/125/2138417.jpg,서울 강남구 삼성·대치·청담동과 송파구 잠실동 일대 준 신축 대단지에서 ‘부르는 게 값’인 집이 속속 등장하고 있다. 1주일 전 서울시가 2020년 이후 5년 동안 이어오던 토지거래허가구역(이하 토허제)을 일부 해제하며 가격 상승 기대가 부푼 것으로 해석된다. 19일 찾은 잠실동 리센츠 아파트 상가 내 공인중개사 사무소 유리 벽엔 신규 매물을 알리는 종이가 빼곡하게 붙어 있었다. 잠실 대표 대단지로 꼽히는 엘·리·트(엘스·리센츠·트리지움) 집주인들이 토허제 해제 소식에 직전 거래가보다 높은 가격으로 앞다퉈 집을 내놔서다. 인근에서,2025-02-20 06:00,https://www.etoday.co.kr/news/view/2446409?trc=main_list_news,이투데이
"서울시, '화정아이파크' 행정처분 3월 중 결론…임예협은 ""HDC현산에 선처를"" 탄원",https://img.etoday.co.kr/crop/200/125/2138553.jpg,서울시가 광주 화정아이파크 붕괴사고와 관련한 HDC현대산업개발 행정처분 결과를 다음 달 중 내놓는다. 2022년 사고 발생 후 3년여 만이다. 화정아이파크 입주예정자협의회는 시공 차질 우려를 제기하며 서울시에 선처를 요청하고 있다. 19일 본지 취재에 따르면 서울시는 조만간 청문 절차를 거쳐 화정아이파크 붕괴사고에 대한 HDC현대산업개발의 소명을 듣고 3월 중 행정처분을 내릴 방침이다. 서울시는 사고 관련 1심 결과를 보고 행정 처분 수위를 결정하겠다며 판단을 미뤄왔다. 화정아이파크 붕괴사고는 2022년 1월 11일 발생했다. 당,2025-02-19 17:07,https://www.etoday.co.kr/news/view/2446499?trc=main_list_news,이투데이
"건설공제조합, 이석용 신임 이사장 19일 선임",https://img.etoday.co.kr/crop/200/125/2133386.jpg,"건설공제조합은 제132회 임시총회에서 이석용 전 농협은행장을 제20대 이사장으로 선임했다고 19일 밝혔다. 이 신임 이사장의 임기는 2025년 2월 20일부터 3년이다. 이 이사장은 지난 1991년 농업협동조합 중앙회에 입사해 NH농협은행 서울영업본부 본부장과 농협중앙회 기획조정본부 본부장을 거쳐 제7대 NH농협은행 은행장을 역임한 금융전문가이다. 그는 취임 인사에서 “조합의 재무 건전성 제고를 위해 힘쓰는 한편, 핵심 사업에 대한 경쟁력을 강화하고 사업다각화와 디지털 전환 그리고 조직 효율화를 통해서 조합이 종합건설금융기관으로",2025-02-19 16:45,https://www.etoday.co.kr/news/view/2446495?trc=main_list_news,이투데이
"고양창릉 사전청약자 27%, 본청약 안 했다… LH “미분양 걱정 안 해”",https://img.etoday.co.kr/crop/200/125/2138525.jpg,"경기 고양시 고양창릉 공공택지지구의 사전청약 당첨자 4명 중 1명이 본청약에 응하지 않은 것으로 집계됐다. 19일 한국토지주택공사(LH)는 이달 17~18일 고양창릉 A4·S5·S6 블록 사전청약자를 대상으로 본청약을 접수를 마감한 결과, 총 1401명 중 73%(1028명)만 신청했다고 밝혔다. 나머지 373명(27%)은 본청약을 포기했다. 블록과 주택 유형별로는 S5 블록의 51㎡(이하 전용면적)형이 약 69%로 가장 낮았다. 신청률이 가장 높은 유형은 84㎡형(84%)으로 나타났다. 고양창릉지구는 경기 고양시 덕양구 원흥동,",2025-02-19 16:19,https://www.etoday.co.kr/news/view/2446479?trc=main_list_news,이투데이
건설·주택업계 “정부 ‘지역 건설경기 보완방안’ 환영”,https://img.etoday.co.kr/crop/200/125/2138400.jpg,"건설·주택업계가 19일 정부가 발표한 ‘지역 건설경기 보완방안’에 일제히 환영 의사를 밝혔다. 이날 대한건설협회는 “우선 금번 대책 중 지역 개발사업 확대 및 재정 조기집행은 수주난에 시달리고 있는 건설사에 가뭄의 단비와 같은 조치”라고 평가했다. LH의 지방 미분양 아파트 직접 매입과 국토부의 지방 미분양 주택 매입을 위한 CR리츠 출시도 고평가했다. 다만, 협회는 “고사직전의 지방부동산을 살리기 위해서는 DSR 대출규제의 한시적 적용완화가 절실한데, 이번 대책에서 제외된 것에 대해 다소 아쉽다”며 “또 부동산 PF 부실문제가",2025-02-19 15:36,https://www.etoday.co.kr/news/view/2446455?trc=main_list_news,이투데이
"정원주 대우건설 회장, 한국건설경영협회 신임 협회장에 선출",https://img.etoday.co.kr/crop/200/125/2138445.jpg,정원주 대우건설 회장이 한국건설경영협회 신임 협회장에 올랐다. 19일 한국건설경영협회는 서울 중구 롯데호텔에서 열린 ‘2025회계연도 정기총회’를 통해 회원사 대표 만장일치로 정 회장을 신임 협회장으로 선출했다고 밝혔다. 임기는 2028년 2월까지다. 정 회장은 “국내외 건설 경기 침체로 어려움을 겪고 있는 시기에 중책을 맡게 돼 책임이 무겁다”며 “직면한 다양한 문제를 해결하고 새로운 도약을 이뤄낼 수 있도록 최선을 다할 것”이라고 말했다. 한국건설경영협회 관계자는 “어려운 시기에 국내외 건설업계를 잘 아는 정 회장이 신임 협회,2025-02-19 14:37,https://www.etoday.co.kr/news/view/2446420?trc=main_list_news,이투데이
"LH 미분양 ‘구원투수’ 나서지만, 민간 주택 수요 진작 대책은 텅텅…“언 발에 오줌 누기”",https://img.etoday.co.kr/crop/200/125/2138587.jpg,"정부가 한국토지주택공사(LH)를 통해 지방 악성 미분양 아파트 3000가구를 사들이기로 했다. 원래 업계에서 요구했던 민간 수요 진작을 위한 취·등록세 추가 완화 등 혜택은 제외하고 LH 직접 매입을 선택한 것이다. 다만 정책 실효성은 턱없이 부족할 전망이다. 또 정부는 LH 기축 매입임대주택 예산을 활용하겠다는 태도지만, 추가 예산 지출과 함께 업무 과부하 문제는 피할 수 없다. 여기에 기업구조조정(CR) 리츠까지 포함해 전체 8000가구 규모의 미분양 주택을 정부가 사들이려 하지만, 전국 단위의 미분양 문제 해결엔 역부족이란",2025-02-19 14:15,https://www.etoday.co.kr/news/view/2446390?trc=main_list_news,이투데이
"지방 악성 미분양 3000가구, LH가 매입…부산·대전·안산 철도 지하화 사업 우선 추진",https://img.etoday.co.kr/crop/200/125/2138318.jpg,"한국토지주택공사(LH)가 지방 준공 후 미분양 아파트 약 3000가구를 사들인다. 지역 경기 활성화를 위해 부산과 대전, 경기 안산의 철도 지하화 사업을 우선 추진한다. 건설사가 준공 기한을 넘겨 부동산 프로젝트 파이낸싱(PF) 부담을 지는 ‘책임준공 확약’ 부담 역시 완화한다. 19일 정부는 이런 내용을 담은 ‘지역 건설경기 보완방안’을 발표했다. 지난해 기준 건설투자가 전년 대비 2.7% 줄었다. 또 주택시장 매수심리 감소와 악성으로 분류되는 준공 후 미분양 아파트가 지난해 말 기준으로 2만1480가구를 넘겨 2014년 1월(",2025-02-19 11:30,https://www.etoday.co.kr/news/view/2446341?trc=main_list_news,이투데이
"수도권 물류센터 시장, 공급량 감소에 한숨 돌렸다… 올해 볕 들까",https://img.etoday.co.kr/crop/200/125/2138262.jpg,"과잉 공급으로 침체를 피하지 못한 수도권 물류센터 시장이 올해부터 회복세에 들어설 것이란 예측이 나온다. 19일 글로벌 상업용 부동산 전문기업 ‘쿠시먼앤드웨이크필드(C&W) 코리아’에 따르면 지난해 하반기 수도권에 공급된 신규 물류센터 면적은 약 159만㎡로, 전 분기 대비 19% 줄었다. 전년 동기와 비교하면 40% 감소한 수치다. 공급 건수도 2024년 3분기보다 55% 적은 17건으로 동부권 5건, 서·남부권이 각각 6건씩이다. 그러나 9만9000㎡ 이상의 대형 자산이 다수 포함돼 총 면적 감소율은 낮았다. 서부권에서는 16",2025-02-19 11:26,https://www.etoday.co.kr/news/view/2446301?trc=main_list_news,이투데이
성수동 '삼표레미콘 부지'에 77층 복합시설 들어선다,https://img.etoday.co.kr/crop/200/125/2138110.jpg,"서울숲과 한강에 둘러싸인 성동구 성수동 삼표레미콘 부지 개발사업이 속도를 내고 있다. 19일 서울시는 삼표레미콘 부지 도시계획변경 사전협상 절차를 완료하고 민간 측에 협상완료를 공식 통보했다고 밝혔다. 대상지는 1977년부터 약 45년간 레미콘 공장이 운영됐으며 2017년 서울시와 성동구, 삼표산업, 현대제철이 업무협약을 통해 기존 시설 철거에 합의했다. 철거가 완료된 2022년 8월부터는 성동구가 문화공연장 등으로 활용하고 있다. 사전협상에서는 삼표레미콘 부지에 대한 개발계획과 공공기여 활용계획이 중점적으로 논의됐다. 인접한 서",2025-02-19 11:15,https://www.etoday.co.kr/news/view/2446179?trc=main_list_news,이투데이
"서울시, 올해 안전·건설분야에 1.3조 투자…""경제 활력·일자리 창출""",https://img.etoday.co.kr/crop/200/125/2138124.jpg,서울시는 올해 안전·기반시설 분야 용역과 건설공사 바주에 1조3083억원을 투입한다고 19일 밝혔다. 서울시는 4월까지 전체의 약 70%에 해당하는 공사·용역 발주를 추진해 경기침체로 위기를 겪고 있는 건설산업과 지역 경제에 활력을 불어넣고 일자리 창출을 도모할 방침이다. 올해 계획한 안전·기반시설 분야 발주 용역은 △도로시설·소방·산지 등 안전 분야 100건(571억원) △기반시설 설계 77건(623억원) △상하수도 안전관리 17건(229억원) 등 총 194건이며 사업비는 총 1423억원이다. 건설공사 발주는 △도로·공원 등 도,2025-02-19 11:15,https://www.etoday.co.kr/news/view/2446188?trc=main_list_news,이투데이
"신반포4차 재건축 조합, 삼성물산과 수의계약 절차 개시",https://img.etoday.co.kr/crop/200/125/2138253.jpg,"삼성물산 건설부문(삼성물산)이 서울 서초구 신반포4차 재건축 사업의 우선협상대상자가 되며 최종 시공사 선정까지의 거리를 좁혔다. 19일 도시정비업계에 따르면 신반포4차 재건축조합은 최 삼성물산에 우선협상대상자 선정 통보 공문을 보냈다. 삼성물산은 회신을 통해 수락 의사를 밝힌 한편 시공계획 제안서를 보냈다. 삼성물산 관계자는 “17일 우선협상대상자 통보를 받았고, 19일 조합에서 1차 입찰 당시 제출했던 입찰제안서를 열어볼 예정”이라며 “수의계약 절차가 19일부터 시작되는 셈”이라고 말했다. 다음 달 중 열리는 시공사 선정 총회를",2025-02-19 10:34,https://www.etoday.co.kr/news/view/2446293?trc=main_list_news,이투데이
[오늘의 청약 일정] '고양창릉A-4신혼희망타운' 본청약,https://img.etoday.co.kr/crop/200/125/2138203.jpg,부동산 정보업체 부동산R114에 따르면 19일인 오늘은 경기 고양시 ‘고양창릉A-4신혼희망타운’(공공분양)의 본청약이 진행된다. 이달 21일까지다.,2025-02-19 09:00,https://www.etoday.co.kr/news/view/2446243?trc=main_list_news,이투데이
"동부건설, 세종-포천고속도로 3공구 준공",https://img.etoday.co.kr/crop/200/125/2137851.jpg,"동부건설이 도로공사 분야 전문 기업의 역량을 입증했다. 19일 동부건설은 고속국도 제29호 세종-포천선(안성-구리) 건설공사 제3공구 현장을 준공했다고 밝혔다. 한국도로공사가 발주했으며 경기 안성시 보개면 가율리에서 고삼면 쌍지리까지 총연장 6.8km의 도로와 교량 4개소, 터널 1개소 및 휴게소 부지 등을 건설하는 공사다. 공사 기간은 2017년 12월부터 약 87개월이다. 동부건설은 준공 시공평가에서 만점(100점)에 가까운 점수를 받았다. 준공 시공평가란 ‘건설기술진흥법’에 따라 건설 안전사고 예방과 기술 수준 향상, 설계",2025-02-19 08:51,https://www.etoday.co.kr/news/view/2446031?trc=main_list_news,이투데이
천안 ‘e편한세상 성성호수공원’ 분양 출사표… 입지 좋지만 대중교통 접근성↓[이번 주 분양 '픽'],https://img.etoday.co.kr/crop/200/125/2138082.jpg,"충남 천안시 서북구 업성도시개발구역에 조성되는 ‘e편한세상 성성호수공원’이 분양 시장에 도전장을 내민다. 19일 분양업계에 따르면 DL이앤씨는 이달 ‘e편한세상 성성호수공원’을 분양한다. 지하 3층~지상 최고 39층, 13개 동, 전용 84~191㎡, 총 1763가구(일반분양 1498가구) 규모다. 52만8000여㎡의 규모를 자랑하는 성성호수공원 바로 앞에 지어져 호수 조망과 4.1㎞ 길이의 생태 탐방로를 동시에 즐길 수 있다. 단지와 호수 사이 3만여㎡ 규모의 근린공원이 조성될 예정이라 ‘숲세권’ 아파트라는 평가도 나온다. 단지",2025-02-19 06:00,https://www.etoday.co.kr/news/view/2446046?trc=main_list_news,이투데이
“처벌보다 주거 안정이 먼저” 광주 화정아이파크 입주예정자…오세훈 시장에 ‘HDC현산 선처’ 탄원,https://img.etoday.co.kr/crop/200/125/2138022.jpg,"광주 화정아이파크 입주예정자협의회가 오는 19일 오세훈 서울시장에게 HDC현대산업개발(HDC현산) 행정처분 선처를 요청하는 탄원서를 제출한다. HDC현산은 지난 2022년 1월 발생한 광주 화정아이파크 붕괴 사고 책임을 두고 서울시의 행정처분 결정을 앞두고 있다. 입주예정자들은 ""처벌보다 재시공을 제때 완료해 주거 안정성을 높이는 것이 우선돼야 한다”며 서울시의 합리적 결정을 당부했다. 18일 본지 취재에 따르면 화정아이파크 입주예정자협의회는 19일 오후 서울시청을 방문해 서울시 건설혁신담당관을 만나 면담하고 HDC현산의 행정처분",2025-02-19 06:00,https://www.etoday.co.kr/news/view/2446059?trc=main_list_news,이투데이
"지방 '악성 미분양' 주택, LH가 사들인다",https://img.etoday.co.kr/crop/200/125/2107061.jpg,"지방 건설경기 회복을 뒷받침하기 위해 한국토지주택공사(LH)가 지방 악성 미분양 아파트를 직접 사들일 전망이다. 건설회사가 준공 기한을 넘기면 부동산 프로젝트파이낸싱(PF) 사업장의 채무를 떠안는 '책임준공' 부담을 완화해주는 방안도 추진된다. 18일 연합뉴스와 건설업계에 따르면 박상우 국토부 장관은 오는 19일 건설업계와 만나 이 같은 내용을 담은 지방 건설경기 보완 방안을 논의할 것으로 알려졌다. 간담회에는 한승구 대한건설협회장, 윤영준 한국주택협회장, 정원주 대한주택건설협회장, 윤학수 대한전문건설협회장 등이 참석할 전망이다.",2025-02-18 22:20,https://www.etoday.co.kr/news/view/2446201?trc=main_list_news,이투데이
