title,thumbnail,short_content,write_time,link,company
호르무즈 열려도 中企 숨통은 아직…공급망 회복 시간 걸릴 듯 [미·이란 종전],https://img.etoday.co.kr/crop/200/125/2346228.jpg,전쟁은 끝나도 비용은 남는다…中企 회복까지 시차 운송 차질·보험료 부담 여전…물류바우처 연말까지 집행 미·이란 종전 합의 기대감이 커지면서 중소기업계도 한숨을 돌리는 분위기다. 중동 지역 긴장 완화로 원자재 의존도가 높은 제조업과 운송업계의 비용 부담도 일부 줄어들 것으로 기대된다. 다만 호르무즈 해협이 열리더라도 수출 계약과 공급망 회복까지는 상당한 시간이 걸릴 것으로 보여 정부 지원이 당분간 이어져야 한다는 목소리가 나온다. 15일 중소기업계에 따르면 중기부가 2월 28일부터 이달 12일까지 집계한 피해·애로 접수는 총 918,2026-06-15 16:52,https://www.etoday.co.kr/news/view/2593730?trc=main_list_news,이투데이
"두산에너빌리티, 5천억 규모 오만 가스복합발전소 공사 수주",https://img.etoday.co.kr/crop/200/125/2346303.jpg,서부발전 컨소시엄과 5300억원 규모 EPC 계약 870MW급 발전소 건설…스팀터빈·발전기도 직접 공급 두산에너빌리티가 오만 두큼 가스복합발전소 건설공사를 수주했다. 중동 지역에서 쌓아온 발전소 EPC 수행 경험을 바탕으로 해외 발전시장 수주를 이어가고 있다. 두산에너빌리티는 한국서부발전이 참여한 컨소시엄과 오만 두큼 가스복합발전소 건설공사 계약을 체결했다고 15일 밝혔다. 계약금액은 약 5300억원이다. 이번 프로젝트에서 두산에너빌리티는 발전소 건설 전문회사인 셉코3(SEPCO-3)와 컨소시엄을 구성해 설계·조달·시공(EPC)을,2026-06-15 16:48,https://www.etoday.co.kr/news/view/2593783?trc=main_list_news,이투데이
"대한상의, 중견기업위원회 개최⋯“중견기업 도약 지원할 것”",https://img.etoday.co.kr/crop/200/125/2346333.jpg,"대한상공회의소는 15일 상의회관에서 ‘제31차 대한상의 중견기업위원회’를 열고 우리 경제의 허리인 중견기업들의 체질 개선과 당면 현안 해결 방안을 논의했다. 이날 회의에는 신임 위원장으로 선임된 정유석 신흥정밀 부회장을 비롯해 오원석 코리아에프티 회장, 이준환 케이씨티시 부회장, 임각균 이트너스 대표이사 등 중견기업 대표 및 임원 20여명이 참석했다. 정유석 신임 위원장은 인사말을 통해 “중견기업은 우리 경제의 허리로서 고용과 생산 양면에서 중요한 역할을 담당하고 있는 만큼 지금처럼 경영환경이 빠르게 변화하는 시기일수록 흔들리지 않",2026-06-15 16:30,https://www.etoday.co.kr/news/view/2593556?trc=main_list_news,이투데이
"레이저옵텍, 세계 최초 고출력 589nm 고체 혈관 레이저 ‘바스큐라589’ 출시",https://img.etoday.co.kr/crop/200/125/2346285.jpg,레이저옵텍은 세계 최초로 고출력 589nm 고체 혈관 레이저 기기인 ‘바스큐라(VASCURA)589’를 공식 출시했다고 15일 밝혔다. 레이저옵텍은 이달 13일 서울 드래곤시티에서 ‘바스큐라 589 프리미어(VASCURA 589 PREMIERE)’를 개최하고 바스큐라589의 핵심 기술과 임상 적용 방향을 소개했다. 이날 행사에는 국내외 의료진 및 업계 관계자들이 대거 참석해 고체 레이저 기반 589nm 파장 구현 기술과 혈관성 피부질환 치료 적용 가능성에 관심을 보였다. 바스큐라589는 라만 산란 현상을 이용해 레이저옵텍이 독자,2026-06-15 16:24,https://www.etoday.co.kr/news/view/2593764?trc=main_list_news,이투데이
위메이드 “로열티 정산 완료…액토즈소프트 상대 로열티 지급 청구 소송 취하”,https://img.etoday.co.kr/crop/200/125/2346280.jpg,"위메이드는 자회사 전기아이피와 함께 ‘액토즈소프트’와 그 자회사 진전기를 상대로 제기했던 ‘미르의 전설2·3’ 로열티의 지급 청구 소송을 취하했다고 15일 밝혔다. 미르의 전설2·3는 위메이드와 액토즈소프트가 공동으로 지식재산권(IP)을 보유한 게임이다. 양사는 로열티 수익분배 비율을 두고 수년간 법적 다툼을 진행해왔다. 그러나 지난해 12월 대법원 판결로 미르의 전설2·3 로열티 수익분배 비율이 위메이드 80%, 액토즈소프트 20%로 최종 확정됐다. 양사는 대법원 판결에 따라 확정된 수익분배 비율대로 현재까지 정산이 이뤄지지 않",2026-06-15 16:22,https://www.etoday.co.kr/news/view/2593771?trc=main_list_news,이투데이
"유흥식 추기경 ""교황 방북, 북한에 달려…북미관계 역할 가능""",https://img.etoday.co.kr/crop/200/125/2345917.jpg,"교황청 성직자부 장관인 유흥식 추기경이 레오 14세 교황의 북한 방문 가능성에 대해 ""북한에 달린 일""이라고 말했다. 또 미국 출신인 레오 14세 교황이 향후 북미 관계 개선 과정에서 일정한 역할을 할 수 있을 것이라는 기대도 내비쳤다. 유 추기경은 14일(현지시간) 바티칸 성베드로대성당 앞에서 기자들과 만나 교황의 방북 가능성을 묻는 질문에 ""북한에서 초청하고 여건을 만들어야 한다""며 이같이 밝혔다. 유 추기경은 ""(전임인) 프란치스코 교황도 여러 차례 '초청하면 가겠다'고 했었다""며 ""이번에도 마찬가지""라고 덧붙였다. 특히 레",2026-06-15 19:00,https://www.etoday.co.kr/news/view/2593833?trc=main_list_news,이투데이
"[속보] 이 대통령, 레오 14세 교황에 내년 방한 초청",https://img.etoday.co.kr/crop/200/125/2344614.jpg,"이 대통령, 레오 14세 교황에 내년 방한 초청",2026-06-15 18:44,https://www.etoday.co.kr/news/view/2593831?trc=main_list_news,이투데이
정청래 책임론 분출 계속…당권 신경전 격화,https://img.etoday.co.kr/crop/200/125/2346365.jpg,"李 “여당 책임언어 집중해야” 이틀만에정청래 “이 대통령, 월드클래스 지도자”지도부 “정 대표 발언 곡해” 진화에도친명계 중심 사퇴론·전대 불출마 목소리 6·3 지방선거 이후 정청래 더불어민주당 대표를 향해 제기된 책임론이 당내에서 사그라지지 않고 있다. 민주당 지도부는 ‘정청래 책임론’ 진화에 나섰지만 차기 당권을 둘러싼 당내 갈등은 심화하는 분위기다. 정 대표는 15일 국회에서 열린 최고위원회의에서 유럽을 순방 중인 이재명 대통령에 대해 “외교 역량으로 월드클래스의 세계적인 지도자로 자리매김하고 있다”고 밝혔다. 또 “‘윤석열",2026-06-15 18:14,https://www.etoday.co.kr/news/view/2593819?trc=main_list_news,이투데이
"이 대통령, 레오 14세 교황에 '하느님의 품' 조각상 등 선물",https://img.etoday.co.kr/crop/200/125/2346370.jpg,"이재명 대통령이 15일(현지시간) 교황청에서 레오 14세 교황을 면담하고 조각상과 백자를 선물했다. 청와대에 따르면 이 대통령은 이날 레오 14세 교황에게 ‘하느님의 품’이라는 이름의 조각상을 전달했다. 성경 속 ‘돌아온 탕아’ 이야기를 형상화한 작품으로, 인간에 대한 연민과 용서, 화해와 공동체 회복의 의미를 담고 있다는 설명이다. 또 백자 다용도 합도 선물했다. 한국 백자 특유의 정갈함과 비움의 미학이 사제의 청빈과 성찰의 가치와 맞닿아 있다는 점을 고려한 것이다. 피에트로 파롤린 교황청 국무원장에게도 별도 선물이 전달됐다.",2026-06-15 18:09,https://www.etoday.co.kr/news/view/2593824?trc=main_list_news,이투데이
"與 지도부 ""6·15 정신 계승"" 한목소리…남북 대화 복원 의지 강조",https://img.etoday.co.kr/crop/200/125/2346225.jpg,"6·15 남북정상회담 26주년 기념식 강훈식 대통령비서실장과 조정식 국회의장, 정청래 더불어민주당 대표는 15일 6·15 남북정상회담 26주년 기념식에 참석해 김대중 정부의 6·15 정신 계승과 남북 대화 복원 필요성을 한목소리로 강조했다. 강 비서실장은 이날 서울 마포구 연세대학교 김대중도서관에서 열린 기념식에서 이재명 대통령의 축사를 대독하며 ""국민주권정부는 6·15 남북공동선언 정신을 말이 아닌 행동으로 이어가고 있다""고 밝혔다. 강 비서실장은 ""정부 출범 이후 대북 확성기 방송을 중단했고 민간단체의 대북 전단 살포 중단을",2026-06-15 15:48,https://www.etoday.co.kr/news/view/2593725?trc=main_list_news,이투데이
한성숙 총리 후보자 인청특위 구성…위원장에 백혜련 내정,https://img.etoday.co.kr/crop/200/125/2346231.jpg,"민주 7명·국힘 5명·비교섭단체 1명 25~26일 청문회 유력…다주택 논란 쟁점 전망 국회가 한성숙 국무총리 후보자 인사청문특별위원회 구성을 사실상 마무리했다. 15일 정치권에 따르면 한 후보자 인사청문특위는 더불어민주당 7명, 국민의힘 5명, 비교섭단체 1명 등 총 13명으로 구성됐다. 특위 위원장에는 3선의 백혜련 민주당 의원이 내정됐다. 민주당에서는 간사를 맡은 김한규 의원을 비롯해 이소영·전용기 의원, 김동아·박균택·송재봉 의원이 위원으로 참여한다. 국민의힘은 김희정 의원과 강승규·김선교·조정훈 의원, 유영하 의원을 특위",2026-06-15 15:28,https://www.etoday.co.kr/news/view/2593736?trc=main_list_news,이투데이
"개혁신당, 선관위에 선거소청 제출…""문제 투표소 선별적 재선거해야""",https://img.etoday.co.kr/crop/200/125/2346227.jpg,"""참정권 침해 발생한 26개 투표소 대상"" ""장동혁·민주당도 17일까지 선거소청 접수해야"" 전한길 주장 '투표지 상자 1900매' 공개 요구 개혁신당이 15일 6·3 지방선거 투표용지 부족 사태와 관련해 중앙선거관리위원회에 공식 선거소청을 제출하며 문제가 발생한 투표소에 대한 선별적 재선거를 촉구했다. 천하람 개혁신당 원내대표와 김정철 최고위원은 이날 경기 과천 중앙선관위 앞에서 기자들과 만나 참정권 침해가 발생한 투표소를 대상으로 한 선거소청을 접수했다고 밝혔다. 김 최고위원은 ""이번 투표용지 부족 사태 등 중앙선관위의 부실 선",2026-06-15 15:21,https://www.etoday.co.kr/news/view/2593726?trc=main_list_news,이투데이
"국힘, 원내부대표단 11명 인선…김승수·김미애 원내수석 내정",https://img.etoday.co.kr/crop/200/125/2346066.jpg,"정점식 원내대표 ""통합·탕평 중점"" 후반기 원구성 협상 대비 최소 규모 우선 발표 국민의힘이 22대 국회 후반기 원내 운영을 이끌 원내부대표단 인선을 15일 발표했다. 원내수석부대표로 내정된 김승수 의원은 이날 국회 원내대표실 앞에서 기자들과 만나 ""정점식 원내대표가 원내부대표단 예정 명단을 발표했다""고 밝혔다. 대여 협상과 원내 운영을 총괄할 원내수석부대표에는 김승수 의원이, 정책·현안을 담당할 원내수석부대표에는 김미애 의원이 각각 내정됐다. 원내수석대변인은 최수진·최은석 의원이 유임됐으며, 법률 지원을 담당할 대변인으로는 김태",2026-06-15 11:17,https://www.etoday.co.kr/news/view/2593619?trc=main_list_news,이투데이
與 “전쟁종식 환영…우리나라 경제 긍정적 효과 기대”[미·이란 종전],https://img.etoday.co.kr/crop/200/125/2346059.jpg,"정청래 더불어민주당 대표는 미국과 이란의 종전 합의 소식에 대해 “미국과 이란 간의 전쟁 종식을 환영한다”며 “우리나라 경제에도 긍정적인 효과를 기대한다”고 15일 밝혔다. 정 대표는 이날 국회에서 열린 최고위원회의에서 “정말 다행이고 잘된 일이다. 평화가 곧 경제”라며 이같이 말했다. 그는 “미국과 이란의 전쟁이 106일 만에 끝났다. 미국과 이란이 종전 합의문에 19일 서명한다고 발표됐다”며 “도널드 트럼프 대통령은 호르무즈 해협을 전면 개방하고 봉쇄를 해제한다고 발표했고, 이란은 카타르 중재로 합의했다며 모든 분쟁을 종식한다",2026-06-15 11:10,https://www.etoday.co.kr/news/view/2593608?trc=main_list_news,이투데이
"'지선 논란'에 李 대통령 지지율, 4주 연속 하락…국힘 44.3%로 민주당 역전",https://img.etoday.co.kr/crop/200/125/2345984.jpg,"""선관위 부실관리 책임론 확산"" 與, 10개월만 30%대로 하락 국힘, 현 정부 최고치 기록 이재명 대통령의 국정수행 지지율이 4주 연속 하락하며 50% 초반대로 내려앉았다는 여론조사 결과가 15일 나왔다. 정당 지지도에서는 국민의힘이 더불어민주당을 오차범위 밖에서 앞선 것으로 나타났다. 리얼미터가 에너지경제신문 의뢰로 지난 8~12일 전국 만 18세 이상 유권자 2515명을 대상으로 실시한 조사 결과, 이 대통령의 국정수행 긍정 평가는 51.5%로 집계됐다. 이는 전주 대비 3.7%포인트(p) 하락한 수치다. 부정 평가는 44.",2026-06-15 09:49,https://www.etoday.co.kr/news/view/2593553?trc=main_list_news,이투데이
