title,thumbnail,short_content,write_time,link,company
美 엔론 사태가 쏘아 올린 ‘내부회계관리제도’[삼일PwC아카데미의 알기 쉬운 회계⑤],https://img.etoday.co.kr/crop/200/125/2123887.jpg,#2000년대 초반 미국의 초대형 에너지 기업 엔론에서 대규모 분식회계가 발생했다. 5년간 파생상품 투자로 입은 손실 15억 달러(약 1조7000억 원)를 회계 장부에 넣지 않은 채 투자자를 속인 것이다. 이후 엔론은 파산했다. 미국 사회에선 회계감사를 받았는데도 엔론의 분식회계를 막지 못했다는 점에서 회계감사의 한계점이 제기됐다. 기업의 재무제표는 기업회계기준에 따라 작성해야 한다. 기업의 외부 이해관계자는 재무제표를 통해 의사결정에 필요한 정보를 얻기 때문이다. 그러나 일부 기업들이 자신들의 성과를 돋보이려고 기업회계기준을 위,2025-03-28 18:00,https://www.etoday.co.kr/news/view/2457008?trc=main_list_news,이투데이
[종합] 외인 7000억 ‘팔자’에 양대 지수 하락 마감…코스피 상위 12개 ‘파란불’,https://img.etoday.co.kr/crop/200/125/2153202.jpg,"양대 지수가 28일 하락 마감했다. 이날 코스피 지수는 전일보다 1.89%(49.17포인트) 내린 2557.98에 마감했다. 개인과 기관은 각각 5446억 원, 11억 원을 사들였고, 외국인 홀로 6425억 원을 순매도했다. 서울 외환시장에서 오후 3시 30분 주간 기준 원·달러 환율은 전 거래일보다 1.20원 오른 1466.50원에 거래를 마쳤다. 코스피 시가총액 상위 12개 종목은 일제히 하락마감했다. 삼성전자(-2.59%), SK하이닉스(-3.67%), 현대차(-4.00%), 한화에어로스페이스(-5.28%) 등은 큰 폭 하락",2025-03-28 17:16,https://www.etoday.co.kr/news/view/2457065?trc=main_list_news,이투데이
"한국씨티은행, 지난해 순익 3119억 원…전년比 12.4%↑",https://img.etoday.co.kr/crop/200/125/2136279.jpg,한국씨티은행이 지난해 3119억 원의 당기순이익을 시현했다고 28일 밝혔다. 이는 전년 대비 12.4% 증가한 수치다. 지난해 총수익은 전년 대비 4.2% 늘어난 1조1758억 원으로 집계됐다. 이중 이자수익은 7560억 원을 기록해 전년보다 12.2% 줄었다. 순이자마진(NIM)이 2023년 2.64%에서 지난해 2.78%로 개선됐다. 소비자금융 철수로 대출 자산이 감소한 영향이다. 비이자수익은 외환·파생상품·유가증권 관련 수익이 늘어나면서 전년(2683억 원)보다 56.5% 증가한 4198억 원으로 집계됐다. 지난해 비용은 64,2025-03-28 17:06,https://www.etoday.co.kr/news/view/2457055?trc=main_list_news,이투데이
"토스, 작년 영업이익 907억 원… 창사 이래 최대 매출",https://img.etoday.co.kr/crop/200/125/2153255.jpg,"지난해 연결 영업수익 1조9556억 원 사용자 기반 확대ㆍ연결 회사 시너지 토스를 운영하고 있는 비바리퍼블리카가 지난해 연간 실적을 발표하며 창사 이래 최대 매출(연결 영업수익)을 달성했다고 밝혔다. 28일 토스에 따르면 지난해 연결 기준 매출(영업수익)은 1조9556억 원으로 전년 대비 42.7% 성장하며 역대 최대를 기록했다. 영업이익 907억 원, 당기순이익 213억 원을 내면서 첫 연간 흑자를 달성했다. 지난해 말 기준 토스 앱의 월간 활성 이용자 수(MAU)는 와이즈앱 기준 전년 대비 29% 늘어난 2480만 명에 달했다",2025-03-28 16:58,https://www.etoday.co.kr/news/view/2457049?trc=main_list_news,이투데이
"[종합]""예대마진 더 커졌다"" 예대금리차 7개월 연속 확대",https://img.etoday.co.kr/crop/200/125/2153228.jpg,"은행권의 가계 예대금리차가 7개월 연속 확대됐다. 기준금리 인하 이후 시장금리 하락으로 대출금리는 소폭 낮아졌지만, 예금금리가 더 큰 폭으로 떨어지며 확대 흐름이 이어졌다. 28일 은행연합회 공시에 따르면 5대 은행(KB국민‧신한‧하나‧우리‧NH농협)의 정책서민금융(햇살론뱅크·햇살론15·안전망대출)을 뺀 2월 신규취급액 기준 평균 예대금리차는 1.38%포인트(p)로 전월(1.376%p) 대비 소폭 확대됐다. 가계 예대금리차는 가계 대출금리에서 저축성 수신금리를 뺀 값으로 예대금리차가 확대될수록 은행의 이자수익도 커진다. 5대 은행",2025-03-28 16:33,https://www.etoday.co.kr/news/view/2457034?trc=main_list_news,이투데이
"넥스트레이드, 31일부터 거래종목 796개로…대량·바스켓매매도 개시",https://img.etoday.co.kr/crop/200/125/2144884.jpg,대체거래소(ATS) 넥스트레이드의 거래 종목이 31일부터 796개로 확대된다. 대량·바스켓 매매 시장도 이날부터 개시하며 참여 증권사도 2곳 더 늘어난다. 넥스트레이드는 거래 종목을 31일부터 796개로 확대한다고 28일 밝혔다. 애초 800개로 확대할 예정이었으나 △브릿지바이오테라퓨틱스 △앱클론 △이오플로우 △HLB생명과학 등 관리종목 4개가 제외됐다. 넥스트레이드의 거래 종목은 출범한 4일로 10개로 시작해 △17일 100개 △24일 350개 △31일 796개로 늘어났다. 넥스트레이드는 종목 수 확대에 따라 기관투자자들의 거래,2025-03-28 16:03,https://www.etoday.co.kr/news/view/2457020?trc=main_list_news,이투데이
"[속보] 코스피, 49.17p(1.89%) 내린 2557.98(마감)",https://img.etoday.co.kr/crop/200/125/1990411.jpg,,2025-03-28 15:35,https://www.etoday.co.kr/news/view/2457007?trc=main_list_news,이투데이
"[속보] 코스닥, 13.73p(1.94%) 내린 693.76(마감)",https://img.etoday.co.kr/crop/200/125/1990411.jpg,,2025-03-28 15:34,https://www.etoday.co.kr/news/view/2457006?trc=main_list_news,이투데이
"[속보] 5대 은행, 예대금리차 7개월 연속 확대…평균 1.38%p",https://img.etoday.co.kr/crop/200/125/2153170.jpg,지난달 5대 은행의 가계 예대금리차가 7개월 연속 확대됐다. 28일 은행연합회 공시에 따르면 5대 은행(KB국민·신한·우리·하나·NH농협)의 정책서민금융(햇살론뱅크·햇살론15·안전망대출)을 뺀 2월 신규취급액 기준 평균 가계예대금리차는 1.38%포인트(p)로 전월(1.376%p) 대비 0.004%p 확대됐다.,2025-03-28 15:02,https://www.etoday.co.kr/news/view/2456975?trc=main_list_news,이투데이
"현대차증권, 퇴직연금 컨설팅 서비스 오픈 기념 ETF 매수 이벤트",https://img.etoday.co.kr/crop/200/125/2153172.jpg,"현대차증권은 동행 컨설팅 서비스 오픈을 맞아 참여 운용사와 제휴해 상장지수펀드(ETF) 매수 이벤트를 실시한다고 28일 밝혔다. 17일 오픈한 현대차증권 퇴직연금 동행 컨설팅 서비스는 H케어 구독 서비스를 신청한 DC형(확정기여형) 가입자를 대상으로 전화 및 온∙오프라인 채널을 통해 해피콜, 모바일트레이딩시스템(MTS) 이용방법, 연금 관련 콘텐츠 활용법 등을 안내하는 고객 밀착 서비스다. 현대차증권 MTS를 통해 신청 가능하다. ETF 매수 이벤트는 현대차증권 퇴직연금 DC형 가입자를 대상으로 이달 17일부터 6월 30일까지 진",2025-03-28 14:40,https://www.etoday.co.kr/news/view/2456983?trc=main_list_news,이투데이
"[속보] 코스피, 장중 2550선도 깨졌다…2549.26",https://img.etoday.co.kr/crop/200/125/1990411.jpg,"[속보] 코스피, 장중 2550선도 깨졌다…2549.26",2025-03-28 14:37,https://www.etoday.co.kr/news/view/2456980?trc=main_list_news,이투데이
"[특징주] 고려아연, 정기주총날 주가 10% 넘게 급락…경영권 분쟁 향방은",https://img.etoday.co.kr/crop/200/125/2153161.jpg,"고려아연 주가가 정기주주총회 개최일인 28일 장중 급락 중이다. 이날 오후 2시 27분 기준 고려아연은 전일보다 10.73%(9만 원) 내린 74만9000원에 거래되고 있다. 이날 상승 출발한 고려아연은 개장 30분도 안 되어 80만 원 선이 깨지더니 보합세를 그리다가 오후 1시 30분 직후 급격히 하락 폭을 키우고 있다. 주가가 오후 1시를 기점으로 약세로 기울기 시작할 때 고려아연 정기주주총회도 진행 중이었다. 이날 고려아연 정기주주총회는 오전 9시 개최 예정이었지만, 당초 예정 시간을 2시간 이상 넘기면서 지연됐다. 오전 1",2025-03-28 14:32,https://www.etoday.co.kr/news/view/2456977?trc=main_list_news,이투데이
"토스뱅크, 전월세보증금대출 4종으로 확대… 주거 상품 강화",https://img.etoday.co.kr/crop/200/125/2153128.jpg,"토스뱅크는 전월세보증금대출 상품을 기존 2종에서 4종으로 확대 구성했다고 28일 밝혔다. 새롭게 선보인 ‘전월세보증금대출 플러스’는 기존 전월세보증금 대출보다 최대한도가 100% 높아졌다. 최대 대출 가능 금액은 4억4400만 원이며 금리는 최저 연 3.63%다. KB 부동산시세 기준 전세보증금의 최대 88%까지 대출할 수 있다. 신용회복자를 위한 전월세보증금 대출도 선보였다. 대출 한도는 최대 5000만 원이며, 임차보증금의 80%까지 대출할 수 있다.",2025-03-28 14:29,https://www.etoday.co.kr/news/view/2456940?trc=main_list_news,이투데이
"[종합] 코스피, 2% 넘게 내려 2550선 ‘털썩’…외인·기관 ‘쌍끌이 팔자’에 하락폭↑",https://img.etoday.co.kr/crop/200/125/2153159.jpg,"양대 지수가 장중 내림폭을 키우고 있다. 28일 오후 2시 10분 기준 코스피 지수는 전일보다 2.02%(52.58포인트) 내린 2554.57에 거래 중이다. 개인 홀로 5669억 원을 순매수, 외국인과 기관은 각각 5601억 원, 787억 원을 순매도 중이다. 서울 외환시장에서 오후 2시 4분 주간 기준 원·달러 환율은 전 거래일보다 2.00원(0.14%) 오른 1466.70원에 거래 중이다. 코스피 시가총액 상위 30개 종목에서는 HD한국조선해양(1.22%), 크래프톤(5.76%), 메리츠금융지주(0%), LG에너지솔루션(0.",2025-03-28 14:21,https://www.etoday.co.kr/news/view/2456970?trc=main_list_news,이투데이
"[특징주] 크래프톤, 신작 게임 흥행 기대감에 5%↑",https://img.etoday.co.kr/crop/200/125/2153161.jpg,"크래프톤이 출시한 신작 게임이 인기를 끌면서 주가가 상승세를 기록하고 있다. 28일 오후 2시 12분 현재 크래프톤은 전 거래일 대비 5.61% 오른 35만7500원에 거래되고 있다. 글로벌 PC 게임 플랫폼인 '스팀(STEAM)'의 최고 판매 순위에 따르면 '인조이(inZOI)'는 이날 오전 9시 조기 공개(얼리 액세스)와 함께 주요 국가 판매량 선두에 이름을 올렸다. '인조이'는 이날 크래프톤이 출시한 신작 게임으로, 장르는 생활 시뮬레이션이다. 가격은 4만4800원(39.99달러)이다. 앞서 스팀 글로벌 위시리스트(인기 찜",2025-03-28 14:14,https://www.etoday.co.kr/news/view/2456965?trc=main_list_news,이투데이
"이복현, 정부에 “상법 개정안 거부권 행사 부적절” 의견서 발송",https://img.etoday.co.kr/crop/200/125/2152538.jpg,상법 개정안 재의요구권(거부권) 행사는 비생산적 김병환 금융위원장과 의견 엇갈려 이복현 금융감독원장이 28일 기획재정부와 금융위원회에 지금 상황에서 상법 개정안에 대한 재의요구권(거부권) 행사는 적절하지 않다는 취지의 의견서를 보냈다. 금감원은 “상법 개정안이 장기간의 논의를 거쳐 국회에서 통과된 현재로서는 재의요구를 통해 그간의 논의를 원점으로 돌리는 것은 비생산적이며 불필요한 사회적 에너지 소모 등 효율성을 저해한다”고 지적했다. 상법 개정안에 대한 재의요구권 행사시 주주보호 논의가 원점으로 회귀 돼 사실상 재논의 추진 동력을,2025-03-28 13:33,https://www.etoday.co.kr/news/view/2456946?trc=main_list_news,이투데이
"[특징주] '논란 연속' 더본코리아, 백종원 대표 사과에 3%대 반등",https://img.etoday.co.kr/crop/200/125/2153102.jpg,각종 논란에 휩싸이며 하락을 이어가던 더본코리아가 백종원 대표의 사과에 상승하고 있다. 28일 오전 12시 2분 현재 더본코리아는 전 거래일보다 3.47% 오른 2만9800원에 거래 중이다. 주가는 이날 장중 한때 3만1500원을 기록하기도 했다. 더본코리아는 유가증권시장에 상장한 지난해 11월 6일 공모가(3만4000원)보다 89.7% 상승한 6만4500원으로 최고가를 기록한 뒤 5만1400원에 마감했다. 이후 4개월 여에 걸쳐 내리막길을 걷던 주가는 17일 2만7900원까지 밀렸다가 최근 점진적으로 회복 중이다. 이날은 오전에,2025-03-28 12:06,https://www.etoday.co.kr/news/view/2456921?trc=main_list_news,이투데이
"저축은행중앙회, 산불 피해 이재민 지원 성금 기부",https://img.etoday.co.kr/crop/200/125/2153078.jpg,"저축은행중앙회는 전국적인 산불 재난으로 어려움을 겪고 있는 이재민 지원을 위해, 희망브리지 전국재해구호협회에 총 5000만 원을 기부했다고 28일 밝혔다. 이번 기부는 화마에 피해를 입은 주민들을 돕고 아픔을 나누고자 전체 저축은행의 모금으로 마련되었으며, 피해 지역의 복구 지원과 이재민 구호 활동 등에 쓰일 예정이다. 오화경 저축은행중앙회장은 “산불 피해로 어려움을 겪고 있는 이재민과 지역사회에 조금이나마 힘을 보태고자 기부를 하게 되었다”고 말했다.",2025-03-28 11:10,https://www.etoday.co.kr/news/view/2456906?trc=main_list_news,이투데이
"하나금융, '산불 피해 지원' 임직원 성금 1억 기부",https://img.etoday.co.kr/crop/200/125/2094894.jpg,하나금융그룹은 전국적으로 발생한 산불 피해 지역의 이재민과 진화 인력을 돕기 위해 주요 계열사인 하나은행 노동조합과 임직원들이 자발적으로 모금한 성금 1억1691만 원을 대한적십자사에 전달했다고 28일 밝혔다. 하나금융 임직원들은 급식차량 지원과 급식 봉사활동 등 현장 이재민 돕기활동도 진행한다. 또 산불 진화 현장에서 사투를 벌이고 있는 소방대원 등 진화 인력을 위해 도시락도 전달할 예정이다.,2025-03-28 10:47,https://www.etoday.co.kr/news/view/2456895?trc=main_list_news,이투데이
"KB국민은행, 상반기 신입행원 110명 채용",https://img.etoday.co.kr/crop/200/125/2086206.jpg,"KB국민은행은 미래 금융시장을 선도할 인재를 선발하기 위해 올해 상반기 110명 규모의 신입행원을 채용한다고 28일 밝혔다. 채용 부문은 △UB △전역장교 △보훈 △ESG 동반성장 등 총 4개 부문이다. 서류 접수 기간은 4월 4일까지이며, KB국민은행 채용 홈페이지에서 지원 가능하다.",2025-03-28 10:22,https://www.etoday.co.kr/news/view/2456880?trc=main_list_news,이투데이
"우리은행, 급여이체 특화통장 출시…첫 급여 이체시 최고 3.1%",https://img.etoday.co.kr/crop/200/125/2153025.jpg,"우리은행은 급여이체 고객을 위한 특화상품인 ‘우월한 월급 통장’을 출시했다고 28일 밝혔다. 우월한 월급 통장으로 급여를 수령하면 입출식 통장임에도 최대 3.1%의 금리를 받을 수 있다. 기본금리 0.1%에 급여이체만으로 2.0%p, 직전반기까지 급여이체 실적이 없었던 신규 급여 이체 고객에게는 추가 1.0%p의 우대금리를 제공한다. 단, 우대금리는 200만 원 한도 내에서 제공된다.",2025-03-28 10:13,https://www.etoday.co.kr/news/view/2456875?trc=main_list_news,이투데이
"[종합] 코스피, 외인 팔자에 10거래일만 2600선 붕괴…환율 1470선 코앞",https://img.etoday.co.kr/crop/200/125/2152957.jpg,"양대 지수가 28일 개장 직후 약세다. 이날 오전 9시 23분 기준 코스피 지수는 1.43%(37.41P) 내린 2569.74에 거래 중이다. 코스피 지수는 3월 17일(2587.52) 이후 10거래일 만에 2600선 아래로 내려왔다. 개인 홀로 2551억 원을 순매수, 외국인과 기관은 각각 2021억 원, 552억 원을 순매도 중이다. 오전 9시 18분 기준 서울 외환시장에서 원·달러 환율은 전장보다 2.80원(0.19%) 오른 1467.50원에 거래 중이다. 뉴욕증시는 전일(현지시간) 도널드 트럼프 미국 대통령의 자동차 품목별",2025-03-28 09:44,https://www.etoday.co.kr/news/view/2456847?trc=main_list_news,이투데이
"[특징주] 삼성전자·SK하이닉스, 트럼프 관세정책 불안에 약세",https://img.etoday.co.kr/crop/200/125/2152984.jpg,삼성전자와 SK하이닉스가 약세다. 28일 오전 9시 24분 기준 삼성전자는 전 거래일보다 2.43%(1500원) 내린 6만300원에 거래 중이다. 같은 시각 SK하이닉스도 2.90%(6000원) 하락한 20만1000원에 거래되고 있다. 도널드 트럼프 미국 대통령의 관세 전쟁 영향으로 투자심리가 위축된 것으로 풀이된다. 트럼프 대통령은 다음 달 2일 ‘상호관세’(reciprocal tariff) 발표를 예고했다. 앞서 26일(현지시각)에는 수입 자동차에 25% 관세를 부과하는 행정명령에 서명하기도 했다.,2025-03-28 09:26,https://www.etoday.co.kr/news/view/2456837?trc=main_list_news,이투데이
"[특징주] 태성, 500억대 대형 공장 신설 소식에 상승세",https://img.etoday.co.kr/crop/200/125/2152661.jpg,태성이 500억 원대 초대형 공장 신설을 결정했다는 소식에 상승세다. 28일 오전 9시 20분 현재 태성은 전일 대비 2450원(9.23%) 오른 2만9000원에 거래됐다. 전날 태성은 태성은 552억5000만 원 규모의 천안공장 신설을 결정했다고 공시했다. 이는 자기 자본 대비 45.4%에 해당하는 규모다. 투자 목적은 중장기 성장 기반 확보와 신사업 추진을 위한 생산능력 증대다. 투자 기간은 4월 1일부터 2026년 6월 30일까지다. 보통 공장 투자 결정은 향후 수주 확대와 매출 증가 등으로 이어질 수 있다는 기대감이 반영된,2025-03-28 09:21,https://www.etoday.co.kr/news/view/2456834?trc=main_list_news,이투데이
"삼일PwC-차헬스케어, 시니어·헬스케어 분야 MOU 체결",https://img.etoday.co.kr/crop/200/125/2152982.jpg,"삼일PwC는 차바이오텍의 글로벌 의료사업을 총괄하는 자회사 차헬스케어와 시니어 및 헬스케어 분야 사업을 위해 전략적 업무협약(MOU)을 체결했다고 28일 밝혔다. 양사는 헬스케어 분야에서 쌓아온 글로벌 전문성을 바탕으로 추진 중인 프로젝트와 정보를 공유하고, 국가적 과제로 부상한 고령화 문제를 해결해 나갈 계획이다. 삼일PwC는 국내외 시니어 부동산 프로젝트 경험과 전문성을 활용해 한국형 시니어 주거 및 케어 모델을 만드는 데 협력할 예정이다. 대학 캠퍼스 내 은퇴자 주거 단지인 대학연계형 은퇴자 공동체(UBRC)와 한국판 은퇴자",2025-03-28 09:18,https://www.etoday.co.kr/news/view/2456832?trc=main_list_news,이투데이
"""손님 목소리에 귀기울입니다"" 하나증권, ‘손님 소리 체험의 날’ 운영",https://img.etoday.co.kr/crop/200/125/2152981.jpg,"하나증권은 '손님 소리 체험의 날 운영'과 손님가치선언문 발표를 통해 손님 중심 경영에 박차를 가한다고 28일 밝혔다. 손님 소리 체험의 날은 하나증권 경영진이 손님케어센터에서 콜센터 상담 업무를 체험하는 프로그램으로, 26일 진행됐다. 이날 행사에는 강성묵 하나증권 대표가 참여해 현장에서 손님 목소리를 듣고 우수 상담 사례 등을 분석하며 손님 응대 품질 개선을 위한 시간을 가졌다. 손님 소리 체험의 날 프로그램은 매월 운영될 예정이다. 하나증권은 27일 손님가치선언문도 발표했다. 선언문을 통해 ‘손님을 위해 하나 되어 일할 것’",2025-03-28 09:16,https://www.etoday.co.kr/news/view/2456830?trc=main_list_news,이투데이
"[속보] 코스닥, 개장 직후 700선 이하로…1월 3일 이후 처음",https://img.etoday.co.kr/crop/200/125/1990411.jpg,"[속보] 코스닥, 장중 700선 이하로…1월 3일 이후 처음",2025-03-28 09:16,https://www.etoday.co.kr/news/view/2456831?trc=main_list_news,이투데이
"[속보] 코스피, 3월 14일 이후 10거래일만 2600선 붕괴",https://img.etoday.co.kr/crop/200/125/1990411.jpg,,2025-03-28 09:14,https://www.etoday.co.kr/news/view/2456829?trc=main_list_news,이투데이
"EY한영, 산불 피해 복구 및 이재민 지원에 1억 기탁",https://img.etoday.co.kr/crop/200/125/2152980.jpg,"글로벌 회계·컨설팅 법인 EY한영은 경북·경남·울산 등 대형 산불 피해 지역의 복구와 이재민 지원을 위해 1억 원의 성금을 기부했다고 28일 밝혔다. 이번 성금은 EY한영의 사내 사회공헌 네트워크인 ‘EY한영 한마음나누미’를 통해 희망브리지 전국재해구호협회에 전달됐으며, 피해 지역의 복구 작업과 이재민 긴급 구호 및 지원 활동과 생필품 지원 등에 사용될 예정이다. 박용근 EY한영 대표이사는 “예기치 못한 대형 산불로 삶의 터전을 잃은 이재민들께 깊은 위로를 전하며, 지역 사회가 하루빨리 안정을 되찾고 다시 일상을 회복하는 데 조금",2025-03-28 09:12,https://www.etoday.co.kr/news/view/2456827?trc=main_list_news,이투데이
‘ACE 글로벌인컴TOP10 SOLACTIVE ETF’ 순자산 600억 돌파,https://img.etoday.co.kr/crop/200/125/2152977.jpg,한국투자신탁운용은 ‘ACE 글로벌인컴TOP10 SOLACTIVE 상장지수펀드(ETF)’의 순자산액이 600억 원을 돌파했다고 28일 밝혔다. ACE 글로벌인컴TOP10 SOLACTIVE ETF는 2023년 7월 상장한 자산배분형 월분배 상품이다. 기초지수는 ‘Solactive Global Superior Income TOP 10 Price Return Index’다. 해당 지수는 미국 상장 ETF 중 분배율이 높고 분배 일관성이 우수한 10종목으로 구성돼 있다. 한국거래소에 따르면 ACE 글로벌인컴TOP10 SOLACTIVE ET,2025-03-28 09:09,https://www.etoday.co.kr/news/view/2456822?trc=main_list_news,이투데이
"이승찬 계룡건설 회장, '인구문제 인식개선 릴레이 캠페인' 동참",https://img.etoday.co.kr/crop/200/125/2153249.jpg,"계룡건설은 이승찬 회장이 저출생·고령화 등 인구문제에 대한 사회적 인식 개선과 범국민적 관심을 높이기 위해 '인구문제 인식개선 릴레이 캠페인'에 참여했다고 28일 밝혔다. 보건복지부와 한국보건복지인재원이 공동 주관하는 이 캠페인은 지난해 10월 시작돼 전국 각지의 다양한 기관과 기업이 동참하고 있다. 이 회장은 김홍범 한남대 사범대학장의 지목을 받아 참여했으며 다음 참가자로 오종민 한성저축은행 대표(한국다문화연구원 이사장)을 지목했다. 이 회장은 ""결혼과 출산이 사회적 이슈로 떠오른 만큼 다양한 지원제도를 통해 젊은 세대가 실질적",2025-03-28 16:49,https://www.etoday.co.kr/news/view/2457045?trc=main_list_news,이투데이
"HDC현대산업개발, 서울 중랑구 지역 주민과 봉사활동 진행",https://img.etoday.co.kr/crop/200/125/2153230.jpg,"HDC현대산업개발은 지역 주민과 함께하는 현장 릴레이 봉사활동으로 서울 중랑구 시립중랑노인전문요양원에서 사회공헌 활동을 진행했다고 28일 밝혔다. 이날 HDC현대산업개발 상봉9-I 현장 직원, 영업본부 등 직원과 중랑구민 등 총 10여명은 서울시립중랑노인전문요양원에서 원예 활동 봉사를 진행했다. HDC현대산업개발 상봉9-I 현장 매니저는 “뜻깊은 봉사활동에 참여해 현장 인근인 중랑구에 거주하는 어르신들에게 작은 보탬이 될 수 있어 보람을 느낀다”고 소감을 밝혔다. HDC현대산업개발 관계자는 “연속해서 진행하고 있는 사회공헌 활동이",2025-03-28 16:25,https://www.etoday.co.kr/news/view/2457029?trc=main_list_news,이투데이
서울 강남 30분대…쌍용건설 '평택 더 플래티넘 스카이 헤론' 분양,https://img.etoday.co.kr/crop/200/125/2153082.jpg,"쌍용건설은 수도권광역급행철도(GTX)를 편리하게 이용할 수 있는 '평택 더 플래티넘 스카이 헤론'을 분양하고 있다고 28일 밝혔다. 더 플래티넘 스카이 헤론은 평택에서 가장 높은 최고 49층 랜드마크 단지다. 전용면적 84㎡~134㎡(펜트형 포함) 아파트 784가구와 전용 113~118㎡의 오피스텔 50실로 구성되며 만 19세 이상이면 거주지역, 청약통장, 주택소유와 관계없이 계약할 수 있다. 단지 도보권인 평택역에서 지하철 한 정거장이면 평택지제역으로 이동 가능하다. 평택역과 평택지제역은 GTX-A(2028년 개통 예정)와 GT",2025-03-28 11:16,https://www.etoday.co.kr/news/view/2456914?trc=main_list_news,이투데이
