title,thumbnail,short_content,write_time,link,company
[환율마감] 미국·이란 종전…원·달러 장중 1510원 하회 ‘보름만 최저’,https://img.etoday.co.kr/crop/200/125/2346202.jpg,이번주 FOMC 등 주요국 통화정책 대기 속 하단지지 종전 합의 서명까지 지켜봐야..이번주 1500~1520원 등락할 듯 원·달러 환율이 하락해 보름여만에 최저치를 경신했다(원화 강세). 장중 10원 넘게 내린 1500원대 초반까지 떨어지기도 했다. 개장초 나온 미국과 이란 종전 합의 소식이 영향을 미쳤다. 앞서 도널드 트럼프 미 대통령은 자산의 SNS 트루스소셜을 통해 “이란 이슬람공화국과의 합의가 지금 마무리됐다”고 밝혔다. 외신보도에 따르면 카젬 가리바바디 이란 외무부 차관도 TV 인터뷰에서 “레바논을 포함한 모든 전선에서,2026-06-15 15:56,https://www.etoday.co.kr/news/view/2593751?trc=main_list_news,이투데이
코스피는 흔들리고 집값은 버텼다…코로나 19가 남긴 투자 공식 [유동성의 종착역 ②],https://img.etoday.co.kr/crop/200/125/2346277.jpg,코로나 유동성에 증시·주택시장 동반 급등 코스피 급등락 반복ㆍ서울 집값은 낙폭 제한 공급 감소 겹치며 증시 자금 부동산 이동 관측 주식시장이 급등세를 타면 그 수익이 부동산 시장으로 유입되는 현상은 불과 몇 년 전에도 나타났다. 증시는 급등과 급락을 오가며 높은 변동성을 보인 반면 서울 아파트값은 상대적으로 낙폭이 제한되는 강점을 드러내기 때문이다. 이런 모습은 코로나 19 전후 코스피지수와 서울 아파트값 흐름으로 확인된다. 15일 금융투자업계와 부동산업계에 따르면 코로나 19 확산 이후 시중에 대규모 유동성이 공급되면서 2020,2026-06-16 06:00,https://www.etoday.co.kr/news/view/2593722?trc=main_list_news,이투데이
[오늘의 청약 일정] ‘써밋더힐’ 당첨자 계약 등,https://img.etoday.co.kr/crop/200/125/2345452.jpg,"부동산 정보업체 부동산114에 따르면 16일인 오늘은 경기 남양주시 ‘다산지금A3(통합공공임대)’, 평택시 ‘평택고덕우미린프레스티지(Abc-36)’, 부산 수영구 ‘알티에로광안’, 충남 천안시 ‘백석시그니처자이(1·2단지)’ 등에서 청약 접수를 받는다. 당첨자 발표는 강원 강릉시 ‘강릉성보필리오더센트럴힐즈’, 전북 익산시 ‘익산펠리피아’ 등에서 진행된다. 경기 남양주시 ‘오남역서희스타힐스여의재(3단지)’, 부산 동래구 ‘동래사적공원오네뜨’, 서울 동작구 ‘써밋더힐’ 등은 계약 일정에 돌입한다.",2026-06-16 06:00,https://www.etoday.co.kr/news/view/2593208?trc=main_list_news,이투데이
[오늘의 청약 일정] ‘써밋더힐’ 당첨자 계약 등,https://img.etoday.co.kr/crop/200/125/2346235.jpg,"부동산 정보업체 부동산114에 따르면 16일인 오늘은 경기 남양주시 ‘다산지금A3(통합공공임대)’, 평택시 ‘평택고덕우미린프레스티지(Abc-36)’, 부산 수영구 ‘알티에로광안’, 충남 천안시 ‘백석시그니처자이(1·2단지)’ 등에서 청약 접수를 받는다. 당첨자 발표는 강원 강릉시 ‘강릉성보필리오더센트럴힐즈’, 전북 익산시 ‘익산펠리피아’ 등에서 진행된다. 경기 남양주시 ‘오남역서희스타힐스여의재(3단지)’, 부산 동래구 ‘동래사적공원오네뜨’, 서울 동작구 ‘써밋더힐’ 등은 계약을 시작한다.",2026-06-16 06:00,https://www.etoday.co.kr/news/view/2593744?trc=main_list_news,이투데이
레미콘 노사 운송비 5.5% 인상 합의…휴업 8일 만에 종료,https://img.etoday.co.kr/crop/200/125/2344388.jpg,"레미콘 운송 중단 사태가 8일 만에 마무리 수순에 들어갔다. 운송료 인상안을 담은 잠정합의안이 조합원 투표를 통과하면서 레미콘 공급도 단계적으로 정상화될 전망이다. 15일 레미콘 업계에 따르면 전국레미콘운송노동조합(전운련) 수도권본부는 운송료 협상 2차 잠정합의안에 대한 조합원 찬반투표를 실시한 결과 찬성 4714표(65.9%)로 가결됐다. 재적 조합원 7517명 가운데 7158명이 투표에 참여해 95.2%의 참여율을 기록했다. 반대는 2316표(32.4%), 무효·기권은 128표(1.8%)였다. 노조는 이날 ""금일부터 파업(운송",2026-06-15 18:00,https://www.etoday.co.kr/news/view/2593822?trc=main_list_news,이투데이
"SH, 신임 건설사업본부장에 이철규 처장 임명",https://img.etoday.co.kr/crop/200/125/2346193.jpg,서울주택도시개발공사(SH)는 신임 건설사업본부장(상임이사)에 이철규 현 건설공사처장을 임명했다고 15일 밝혔다. 이 신임 본부장은 1995년 SH에 건축직으로 입사해 설계와 시공 등 건설 분야 전반에서 경력을 쌓아왔다. 그동안 서울시와 SH의 주요 건설사업을 수행하며 전문성과 업무 추진 능력을 인정받았으며 이번 임원 공모 절차를 거쳐 최종 선임됐다. 이 본부장은 앞으로 SH의 공공주택 공급 사업을 총괄하며 핵심 정책 사업인 '미리내집'의 안정적인 추진과 주택 공급 확대에 주력할 계획이다. 아울러 건설 현장의 품질관리와 안전관리 체,2026-06-15 14:04,https://www.etoday.co.kr/news/view/2593678?trc=main_list_news,이투데이
서울 전셋값 12년 7개월 만에 가장 많이 올랐다,https://img.etoday.co.kr/crop/200/125/2346144.jpg,서울 전세 3월부터 석달 연속 상승 월세는 통계 공표 후 최대폭 뛰어 서울 주택 전셋값이 12년 7개월 만에 가장 큰 폭으로 오르며 상승세를 이어갔다. 월세 역시 관련 통계 집계 이후 가장 높은 오름폭을 기록했다. 15일 한국부동산원이 발표한 5월 전국주택가격동향조사에 따르면 서울 주택종합(아파트·연립주택·단독주택) 전세가격지수는 전월 대비 0.91% 상승했다. 2013년 10월(1.04%) 이후 가장 높은 상승률이다. 지난해 12월 0.53%를 기록한 이후 올해 1월(0.46%)과 2월(0.35%) 두 달 연속 상승폭이 줄었지만,2026-06-15 14:00,https://www.etoday.co.kr/news/view/2593657?trc=main_list_news,이투데이
미·이란 종전 합의에 중동 재건 기대감⋯대이란 제재는 변수,https://img.etoday.co.kr/crop/200/125/2345708.jpg,"미국과 이란의 종전 합의로 중동 정세가 안정화되면서 국내 건설업계의 전후 복구 사업 참여 가능성에 관심이 모아진다. 15일 국토교통부에 따르면 지난해 한국 건설업계의 중동 수주액은 118억8000만 달러로 전체 해외 수주의 25.1%를 기록했다. 187억 달러 규모인 체코 두코바니 원전 건설사업 수주로 유럽 수주액이 급등해 비중이 줄었으나, 2024년에는 49.8%로 전체의 절반을 차지할 만큼 중동은 국내 건설업계에 강세를 보이는 핵심 지역이다. 현재도 사우디아라비아, 아랍에미리트(UAE), 카타르, 쿠웨이트 등에서 국내 기업들이",2026-06-15 13:57,https://www.etoday.co.kr/news/view/2593673?trc=main_list_news,이투데이
‘고덕국제신도시 수자인하우스디’ 견본주택 개관,https://img.etoday.co.kr/crop/200/125/2346062.jpg,"4개 동 총 403가구 공급 23일 1순위 청약…분상제 단지 BS한양과 대보건설은 '고덕국제신도시 수자인하우스디' 견본주택을 12일 개관하고 분양 일정에 들어간다고 15일 밝혔다. 이 단지는 고덕국제신도시 A-67블럭에 조성되는 공동주택이다. 지하 2층~지상 최고 23층, 4개 동, 총 403가구 규모다. 주택형별로는 △84㎡A 107가구 ’84㎡B 90가구 △84㎡C 59가구 △101㎡ 147가구다. 단지는 분양가상한제가 적용돼 전용면적 84㎡ 기준 5억원대 초반의 분양가로 공급된다. 분양가상한제 적용에도 거주의무기간이 없다는",2026-06-15 11:27,https://www.etoday.co.kr/news/view/2593620?trc=main_list_news,이투데이
"""재건축 이주비 LTV 70%까지 확대""…서울시, 규제완화 건의",https://img.etoday.co.kr/crop/200/125/2222660.jpg,"이주비 LTV 70%·조합설립 동의율 70% 제안 용적률 완화·임대주택 비율 조정 등 사업성 개선 추진 서울시는 재개발·재건축 사업의 속도를 높이고 도심 주택공급을 확대하기 위해 10개 법령 개정안을 15일 정부에 건의했다고 밝혔다. 이번 건의안은 최근 이재명 대통령이 부동산 가격 안정을 위한 공급 확대와 정비사업 속도 제고를 강조한 데 따라 마련됐다. 서울시는 현장에서 확인한 사업 추진 장애 요인과 제도 개선 과제를 중심으로 규제완화, 사업성 개선, 사업기간 단축, 주민 권익 보호 등 4개 분야 10개 과제를 정부에 제시했다.",2026-06-15 11:15,https://www.etoday.co.kr/news/view/2593514?trc=main_list_news,이투데이
제주영어교육도시 국제학교 확대⋯‘한화포레나 제주에듀시티’ 눈길,https://img.etoday.co.kr/crop/200/125/2346025.jpg,제주영어교육도시에 다섯 번째 국제학교 설립이 본격화되면서 인근 분양 단지에 대한 관심도 높아지고 있다. ‘한화포레나 제주에듀시티’가 대표적이다. 15일 업계에 따르면 제주국제자유도시개발센터(JDC)는 최근 제주영어교육도시 내 ‘풀턴 사이언스 아카데미 애서튼(FSAA)’ 기공식을 개최했다. FSAA는 미국 조지아주 애틀랜타의 명문 사립학교인 ‘풀턴 사이언스 아카데미(FSA)’의 첫 해외 캠퍼스로 STEM(과학·기술·공학·수학) 교육에 특화된 국제학교다. FSAA는 유치원부터 12학년까지 총 1354명 규모로 운영될 예정이다. 올해,2026-06-15 11:03,https://www.etoday.co.kr/news/view/2593573?trc=main_list_news,이투데이
"국토부, 해체공사 안전관리 TF 출범⋯노후 교량 철거 안전기준 손본다",https://img.etoday.co.kr/crop/200/125/2338197.jpg,국토교통부가 노후 교량 등 사회기반시설(SOC) 해체공사 과정의 안전관리를 강화하기 위해 민관합동 태스크포스(TF)를 출범한다. 국토부는 16일 서울에서 산·학·연·관 전문가들과 함께 ‘민관합동 해체공사 안전관리 TF’ 착수회의를 개최하고 해체공사 안전관리 강화 방안과 향후 운영 계획을 논의한다고 15일 밝혔다. 이번 TF는 최근 해체공사 현장에서 잇따라 발생한 붕괴 사고를 계기로 마련됐다. 지난달 26일 서울 서소문 고가 철거공사 현장에서 붕괴 사고가 발생한 데 이어 학계와 업계에서는 SOC 해체공사 안전관리 제도 개선 필요성을,2026-06-15 11:00,https://www.etoday.co.kr/news/view/2593587?trc=main_list_news,이투데이
화장실 다녀와도 추가요금 없다…수도권 전철 15분 내 재승차 허용,https://img.etoday.co.kr/crop/200/125/2345937.jpg,"앞으로 수도권 전철 이용객이 화장실 이용이나 하차 착오 등으로 잠시 개찰구 밖으로 나갔다가 15분 안에 다시 탑승하면 기본운임을 추가로 내지 않아도 된다. 국토교통부는 수도권 전철 ‘15분 내 재승차 제도’를 20일부터 시행한다고 15일 밝혔다. 이번 제도는 전철 이용 중 같은 역, 같은 노선 게이트에서 하차 후 15분 이내 재승차하면 기본운임 1550원을 면제하고 환승 처리하는 방식이다. 적용 대상은 한국철도공사가 운영하는 수도권 전철 구간에서 교통카드를 이용하는 승객이다. 1호선(연천~회기, 남영~신창, 구로~인천 등) 구간과",2026-06-15 11:00,https://www.etoday.co.kr/news/view/2593510?trc=main_list_news,이투데이
"DL이앤씨, 제주 복합발전소 수주⋯수소발전 전환 추진",https://img.etoday.co.kr/crop/200/125/2345971.jpg,DL이앤씨가 제주에서 5500억원 규모의 가스복합발전소 건설 사업을 수주하며 친환경 에너지 사업 확대에 나섰다. 향후 청정 수소 발전이 가능한 설비를 적용해 에너지 전환 시장 공략에도 속도를 낸다는 계획이다. DL이앤씨는 한국동서발전이 발주한 ‘동제주 복합발전소 건설 공사’ 계약을 체결했다고 15일 밝혔다. 동제주 복합발전소는 제주 제주시 구좌읍 동복리 일원에 총 발전용량 150MW(메가와트) 규모의 가스복합발전소를 건설하는 사업이다. DL이앤씨는 설계·조달·시공(EPC)과 시운전까지 전 과정을 일괄 수행한다. 준공 목표 시점은,2026-06-15 09:38,https://www.etoday.co.kr/news/view/2593541?trc=main_list_news,이투데이
강남권·반도체 벨트 아파트 고가 거래 늘고 지방은 관망…양극화 뚜렷,https://img.etoday.co.kr/crop/200/125/2345879.jpg,"전국 아파트 거래에서 3억원 미만 저가 거래 비중이 줄고 고가 거래 비중은 확대된 것으로 나타났다. 특히 서울 강남권과 경기 남부 반도체 벨트를 중심으로 고가 아파트 거래 비중이 늘어나며 지역별 가격대 양극화가 뚜렷해지는 모습이다. 15일 부동산 정보 플랫폼 직방이 국토교통부 아파트 매매 실거래가 자료를 분석한 결과, 지난달 전국 아파트 매매 거래 중 3억원 미만 거래 비중은 34.9%로 집계됐다. 올해 1월(38.3%)과 비교하면 3.4%포인트(p) 감소한 수준이다. 반면 6억원 이상 가격대 거래 비중은 전반적으로 확대되며 거래",2026-06-15 08:55,https://www.etoday.co.kr/news/view/2593490?trc=main_list_news,이투데이
세계 6번째 심해 유인잠수정 개발 나선다…2030년 실해역 투입 목표,https://img.etoday.co.kr/crop/200/125/2345902.jpg,"KIOST, 325억원 투입해 국내 첫 3인승 유인잠수정 개발 기술 자립과 안전 기준 마련 병행…해양주권 확보 기대 한국이 해양탐사와 구조·구난에 활용할 국산 유인잠수정 개발에 본격 착수했다. 미국과 중국, 일본 등 주요국이 심해 유인잠수정 기술 경쟁을 벌이는 가운데 독자 기술 확보와 함께 관련 법·제도 기반을 마련해 해양주권과 해양산업 경쟁력을 강화하겠다는 구상이다. 15일 한국해양과학기술원(KIOST)에 따르면 KIOST는 해양수산부의 '천해용 수중 모빌리티 기술개발' 사업을 통해 수심 300m급 3인승 유인잠수정 '해리온30",2026-06-15 08:52,https://www.etoday.co.kr/news/view/2593487?trc=main_list_news,이투데이
[아파트값 상승 톱10] 경기 성남 ‘양지마을1단지금호’ 등,https://img.etoday.co.kr/crop/200/125/2345828.jpg,부동산 플랫폼 호갱노노에 따르면 13·14일 신고일 기준 전국 아파트 가운데 실거래가 상승 폭이 가장 컸던 단지는 경기 성남시 ‘양지마을1단지금호’로 나타났다. 이 단지는 29억원에 거래되며 직전 거래 대비 9억원(45%) 상승했다. 2위는 경기 성남시 ‘파크뷰’로 27억5000만원에 실거래되며 7억5000만원(37%) 올랐다. 3위는 서울 광진구 ‘우성1차’로 17억3500만원에 거래되며 6억8500만원(65%) 상승한 것으로 집계됐다. 이어 서울 서초구 ‘방배래미안아트힐’이 26억3000만원에 거래되며 직전 거래 대비 34%,2026-06-15 08:30,https://www.etoday.co.kr/news/view/2593435?trc=main_list_news,이투데이
반도체·AI 붐 타고⋯동탄·평택·용인 집값 ‘꿈틀’,https://img.etoday.co.kr/crop/200/125/2345770.jpg,"역세권 집중됐던 '부동산 가치' 삼전 등 첨단산업 단지로 번져 동탄 일주일 새 2% 급등 강세 평택·기흥도 산단중심 상승세 인공지능(AI) 산업 경쟁이 국가 성장 전략의 핵심으로 떠오르면서 국내 부동산 시장의 가치 판단 기준에도 영향을 미치고 있다. 역세권과 학군에 이어 최근에는 반도체 공장과 AI 데이터센터(AIDC), 전력 인프라 등 첨단산업 기반 시설도 새로운 가치 상승 요인으로 부상하는 모습이다. 14일 부동산 업계에 따르면 삼성전자와 SK하이닉스 등 글로벌 반도체 기업의 생산시설이 집중된 경기 남부 벨트는 최근 집값 상승",2026-06-15 06:00,https://www.etoday.co.kr/news/view/2593159?trc=main_list_news,이투데이
[오늘의 청약 일정] ‘해운대마티안디에디션’ 당첨자 계약 등,https://img.etoday.co.kr/crop/200/125/2345448.jpg,"부동산 정보업체 부동산114에 따르면 15일인 오늘은 경기 남양주시 ‘남양주왕숙2A3(공공분양)’의 당첨자 발표가 진행된다. 경기 부천시 ‘엘리프역곡’, 부산 해운대구 ‘해운대마티안디에디션’, 인천 서구 ‘검암역세권자이르네(B2)’ 등은 계약 일정에 돌입한다.",2026-06-15 06:00,https://www.etoday.co.kr/news/view/2593198?trc=main_list_news,이투데이
동탄·분당 다 뛰는데 과천만 뒷걸음...급등 뒤 숨 고르는 ‘준강남’,https://img.etoday.co.kr/crop/200/125/2345576.jpg,6월 둘째 주 0.30% 하락…경기 최대 낙폭 누적 상승률 0.55%…지난해 급등 후 관망세 지난해 경기권 집값 상승을 이끌었던 과천 아파트 시장이 올해 들어 힘을 쓰지 못하고 있다. 성남 분당구와 화성 동탄구 등 경기 남부 주요 지역이 상승세를 이어가는 것과 달리 과천은 6월 들어 2주 연속 하락하며 뚜렷한 온도차를 보였다. 재건축 이주 수요가 잦아든 가운데 급등에 따른 가격 부담이 커지면서 매수세가 숨 고르기에 들어간 모습이다. 14일 한국부동산원의 주간 아파트가격 동향에 따르면 과천 아파트값은 6월 둘째 주 0.30% 하락했,2026-06-14 18:00,https://www.etoday.co.kr/news/view/2593283?trc=main_list_news,이투데이
"오세훈 시장, 지선 승리에...신세계 ‘서울 고속버스터미널’ 복합개발 속도 낼까",https://img.etoday.co.kr/crop/200/125/2345760.jpg,"서울시·신세계센트럴 실무협의 착수… 연내 사전협상 마무리 목표 1975년 준공 노후 시설 지하화, 지상엔 업무·쇼핑 '랜드마크' 조성 서울 강남의 대표적 노후 시설인 서울 고속버스터미널 부지를 지하화하고, 지상에 최고 60층 이상의 업무·상업·주거 복합단지를 조성하는 대규모 개발 사업이 본격화된다. 14일 서울시와 신세계그룹에 따르면, 서울시와 신세계 자회사인 신세계센트럴시티는 연내 사전협상 타결을 목표로 실무 협의를 수시로 진행 중이다. 이번 사업은 14만 6260㎡ 부지를 대상으로 하며, 용도지역 상향에 따른 공공기여 규모만",2026-06-14 17:00,https://www.etoday.co.kr/news/view/2593393?trc=main_list_news,이투데이
“이주비 넘어 안전 경쟁”⋯재건축 수주전 ‘내진 특등급’ 부상,https://img.etoday.co.kr/crop/200/125/2345436.jpg,"압구정·성수 등 주요 사업장 잇달아 적용 초고층 경쟁에 구조 안전성 부각 서울 핵심 재건축·재개발 사업지가 초고층 랜드마크 경쟁에 뛰어들면서 건설사들의 수주 전략에도 변화가 나타나고 있다. 과거 브랜드와 설계, 이주비 조건이 수주전의 핵심 경쟁 요소였다면 최근에는 내진 성능까지 전면에 내세우며 차별화에 나서는 모습이다. 14일 정비업계에 따르면 건설사들은 주요 도시정비사업 입찰 제안서에서 내진 특등급 적용 계획을 적극적으로 강조하고 있다. 압구정과 성수, 반포, 여의도 등 서울 주요 사업지들이 최고 60~70층 규모 초고층 단지로",2026-06-14 16:00,https://www.etoday.co.kr/news/view/2593173?trc=main_list_news,이투데이
"화학사고 잇따르자⋯서울시, 유해화학물질 취급시설 긴급안전점검",https://img.etoday.co.kr/crop/200/125/2222660.jpg,2014~2025년 서울 발생 화학물질 사고 31건 한화에어로스페이스와 SK하이닉스 사업장에서 잇따라 화학사고가 발생한 가운데 서울시가 관내 유해화학물질 취급시설에 대한 긴급안전점검에 나선다. 14일 서울시는 7월 중순까지 서울 시내 유해화학물질 취급 사업장을 대상으로 긴급안전점검을 실시하고 화학물질 취급기준 준수 여부와 안전관리 실태를 집중 점검한다고 밝혔다. 이번 점검은 최근 한화에어로스페이스 대전 사업장에서 화학성분 세척 과정 중 원인 미상의 폭발 사고가 발생해 5명이 숨지고 2명이 다친 데 이어 같은 날 SK하이닉스 청주,2026-06-14 11:15,https://www.etoday.co.kr/news/view/2593320?trc=main_list_news,이투데이
혼인 7년 넘겨도 신생아 특공 가능…민영주택 청약 문턱 낮춘다,https://img.etoday.co.kr/crop/200/125/2345182.jpg,"민영주택에 신생아 특별공급 10% 신설 지방 이전기업 종사자 등 지역 주거 지원 확대 앞으로 혼인 기간과 관계없이 2세 미만 자녀를 둔 가구는 민영주택 특별공급을 통해 청약 기회를 얻을 수 있게 된다. 국토교통부는 출산가구 지원과 지방 인구 유입 활성화를 위한 내용을 담은 '주택공급에 관한 규칙' 개정안을 15일부터 시행한다고 14일 밝혔다. 이번 개정안은 저출생 문제에 대응하기 위해 출산가구의 청약 문턱을 낮추고, 지방정부가 기업 유치와 인구 유입 정책에 맞춰 보다 탄력적으로 주택을 공급할 수 있도록 하는 데 초점을 맞췄다. 우",2026-06-14 11:00,https://www.etoday.co.kr/news/view/2593177?trc=main_list_news,이투데이
화물차 바퀴 이탈 사고 막는다⋯정기 분해점검 제도화,https://img.etoday.co.kr/crop/200/125/2305520.jpg,'자동차관리법 시행규칙' 개정안 입법예고 8년 이상 대형 화물차ㆍ특수차 대상 고속도로를 달리던 화물차의 바퀴가 빠지는 사고를 예방하기 위해 정부가 가변축이 장착된 대형 화물차와 특수차를 대상으로 정기 분해점검 제도를 도입한다. 국토교통부는 사업용 화물·특수차 정기점검 제도의 세부 기준을 담은 '자동차관리법 시행규칙' 개정안을 15일부터 7월 27일까지 입법예고한다고 14일 밝혔다. 이 제도는 올해 12월 3일 시행될 예정이다. 정기점검 제도는 2024년 2월 경부고속도로에서 발생한 화물차 가변축 바퀴 이탈 사고를 계기로 마련됐다.,2026-06-14 11:00,https://www.etoday.co.kr/news/view/2593168?trc=main_list_news,이투데이
"삼성물산 건설, 6538억원 규모 방배신삼호 재건축 시공사 선정",https://img.etoday.co.kr/crop/200/125/2345656.jpg,"총 7개동 928가구⋯단지명 '래미안 르페리움' 삼성물산 건설부문이 서울 서초구 방배신삼호 아파트 재건축 사업의 시공권을 확보했다. 삼성물산은 방배신삼호 재건축 조합이 13일 개최한 총회에서 자사를 시공사로 최종 선정했다고 14일 밝혔다. 조합은 앞서 1월 삼성물산을 우선협상대상자로 선정한 바 있다. 방배신삼호 재건축은 서초구 방배동 725번지 일대 4만4106㎡ 부지에 지하 5층~지상 41층, 7개 동, 928가구 규모의 아파트와 부대복리시설 등을 조성하는 사업이다. 공사비는 약 6538억 원 규모다. 사업지는 사평대로와 서초대",2026-06-14 08:50,https://www.etoday.co.kr/news/view/2593326?trc=main_list_news,이투데이
"주식ㆍ채권 처분한 3.7조원, 주택시장으로⋯강남 3구 집중",https://img.etoday.co.kr/crop/200/125/2345182.jpg,"65.5% 서울 주택 매입에 투입 30대 자금 유입 규모 가장 커 올해 들어 주식과 채권을 매도해 확보한 자금 가운데 3조7000억원 이상이 주택 매수에 투입된 것으로 집계됐다. 특히 이 자금의 약 3분의 2가 서울로 향했으며, 강남·서초·송파 등 강남 3구에 집중되는 양상을 보였다. 14일 국회 국토교통위원회 소속 김종양 국민의힘 의원이 국토교통부로부터 제출받은 자금조달계획서 자료에 따르면 올해 1~4월 주택 매입에 활용된 주식·채권 매각 자금은 총 3조7254억9400만원으로 나타났다. 자금조달계획서는 주택 취득 시 매수 자금",2026-06-14 08:24,https://www.etoday.co.kr/news/view/2593321?trc=main_list_news,이투데이
16조원 투입에 집값도 들썩…‘강북 전성시대’ 기대감 커진다,https://img.etoday.co.kr/crop/200/125/2345202.jpg,"강북권 집값 상승률, 서울 평균 웃돌아 장위·은평 등 신규 분양 주목 서울시가 향후 10년간 16조원을 투입해 강북권 교통망과 산업·업무 거점을 대폭 확충하는 '강북 전성시대 2.0' 프로젝트를 추진하면서 강북 지역 부동산 시장이 주목받고 있다. 대규모 공공 투자와 재개발 사업이 맞물리며 집값 상승세가 서울 평균을 웃도는 가운데 신규 분양 단지에도 수요자들의 관심이 쏠리는 모습이다. 13일 부동산R114에 따르면 서울 한강 이북 14개 자치구의 평균 아파트값은 지난달 29일 기준 연초 대비 5.65% 상승해 같은 기간 서울 전체",2026-06-13 17:00,https://www.etoday.co.kr/news/view/2593023?trc=main_list_news,이투데이
