title,thumbnail,short_content,write_time,link,company
"아파트값 격차 더 벌어졌다…""양극화 심화 가속""",https://img.etoday.co.kr/crop/200/125/2138120.jpg,고가 아파트와 저가 아파트의 가격 차가 계속해서 사상 최대를 경신하고 있다. 주택시장이 전반적으로 침체한 가운데 서울 핵심지와 수도권 주요 지역에 대한 쏠림이 가속한 영향이다. '똘똘한 한 채'를 찾는 경향이 강해지면서 주택시장 내 양극화는 앞으로도 계속 심화할 것이란 전망이 나온다. 18일 KB부동산에 따르면 올해 1월 기준 전국 아파트 매매평균가격 5분위 배율은 11.1이다. 관련 통계가 작성된 이후 최고치다. 전국 5분위 배율은 2022년 11월 10.7을 기록한 뒤 2023년 5월 10까지 줄었다가 다시 커졌고 지난해 9월,2025-02-18 17:51,https://www.etoday.co.kr/news/view/2446047?trc=main_list_news,이투데이
"박상우 국토부 장관 “CR리츠, 미분양 3800가구 매입 협의 중”",https://img.etoday.co.kr/crop/200/125/2135747.jpg,"박상우 국토교통부 장관이 지방 미분양 주택을 매입하는 기업구조조정 부동산투자회사(CR리츠)가 3800가구 매입을 협의 중이라고 18일 밝혔다. 이날 국회 국토교통위원회 전체회의에 출석한 박 장관은 ‘세제 혜택과 CR리츠 등 정부 미분양 대책의 효과가 제대로 나지 않고 있는 것 같다’는 송기헌 더불어민주당 의원 지적에 “CR리츠는 작년 출시를 목표로 했지만, 금융상품이다 보니 (가격 관련) 조건이 맞지 않는 측면이 있었다”며 이같이 말했다. 미분양 사업장을 보유한 사업자는 조금이라도 값을 높여 팔려 하고, CR리츠는 매입 가격을 낮",2025-02-18 15:51,https://www.etoday.co.kr/news/view/2446126?trc=main_list_news,이투데이
한국게임산업협회 신임 협회장에 조영기 전 넷마블 대표,https://img.etoday.co.kr/crop/200/125/2139057.jpg,"한국게임산업협회는 20일 협회 대회의실에서 제21차 정기총회를 열고 조영기 전 넷마블 대표를 협회장으로 추대했다고 밝혔다. 조 신임 회장은 연세대 심리학과를 졸업하고 연세대 대학원에서 경영학 석사(MBA)를 취득한 후 2007년 CJ인터넷에 입사, CJ인터넷게임즈 대표를 거쳐 2011년부터 2014년까지 CJ E&M 게임사업부문(넷마블) 대표를 지냈다. 넷마블 수장직에서 물러난 뒤에는 게임 개발사 펀플을 창업해 대표를 맡았다. 조 신임 회장은 4월 정식 취임, 강신철 현 회장의 뒤를 이어 2027년까지 2년 간 협회를 이끌어나갈",2025-02-20 17:52,https://www.etoday.co.kr/news/view/2446880?trc=main_list_news,이투데이
"트럼프가 밀고 SEC는 당긴다…리플, 일주일간 나홀로 10% 상승",https://img.etoday.co.kr/crop/200/125/2139042.jpg,"가상자산 시장이 횡보하는 가운데 알트코인 리플이 상승하고 있다. 20일(한국시간) 오후 5시 가상자산(암호화폐) 통계사이트 코인게코에 따르면 리플은 전일 대비 5.1% 상승한 2.69달러에 거래되고 있다. 리플은 최근 일주일간 10% 이상 상승, 시가총액 20위권 내의 가상자산 중 가장 큰 상승 폭을 기록했다. 최근 미국 내 규제환경이 가상자산에 친화적이라는 것이 상승에 가장 큰 요인으로 꼽혔다. 앞서 리플은 미국 증권거래위원회(SEC)와 장기 소송전을 치르고 있었다. 지난해 리플이 사실상 소송전에서 승리하면서 법적 리스크에 대한",2025-02-20 17:44,https://www.etoday.co.kr/news/view/2446875?trc=main_list_news,이투데이
"[BioS]삼성에피스, 이번엔 고려대서 ‘연구노트 경진대회’",https://img.etoday.co.kr/crop/200/125/2139041.jpg,"삼성바이오에피스(Samsung Bioepis)는 20일 고려대 자연계 캠퍼스에서 '연구노트 경진대회' 시상식을 열고 생명과학대 대학원생들에게 우수 상패와 총 1000만원 규모의 장학금을 전달했다고 밝혔다. 앞서 삼성바이오에피스는 지난달 연세대에서도 연구노트 경진대회를 개최해 시상식 및 장학금을 전달한 바 있다. 연구노트는 시작부터 결과물 보고, 발표 및 지적재산권 확보 등에 이르기까지 전 과정에서의 연구성과를 기록한 자료다. 연구노트는 연구의 지속성 유지 및 결과 보호, 논문발표, 특허출원 때의 기초 자료로 활용된다. 삼성바이오에",2025-02-20 17:22,https://www.etoday.co.kr/news/view/2446872?trc=main_list_news,이투데이
"[BioS]동아ST, SK바팜서 L/I ‘세노바메이트’ 국내 허가신청",https://img.etoday.co.kr/crop/200/125/1866913.jpg,"동아에스티(Dong-A ST)는 20일 식품의약품안전처에 SK바이오팜(SK Biopharmaceuticals)으로부터 라이선스인(L/I)한 뇌전증 신약 ‘세노바메이트(cenobamate, 미국 제품명: Xcopri)’의 시판허가를 신청했다고 밝혔다. 동아에스티는 지난해 1월 SK바이오팜으로부터 총 190억원 규모로 한국 등 30개국에 대한 세노바메이트의 상업화 권리를 들여왔다. 동아에스티는 SK바이오팜으로부터 세노바메이트의 완제의약품(DP) 생산기술을 이전받아 30개국에 대한 허가, 판매 및 완제의약품 생산을 담당한다. SK바이오",2025-02-20 17:10,https://www.etoday.co.kr/news/view/2446863?trc=main_list_news,이투데이
"동아ST, 뇌전증 신약 ‘세노바메이트’ 국내 품목허가 신청",https://img.etoday.co.kr/crop/200/125/2139028.jpg,"동아ST는 식품의약품안전처에 뇌전증 신약 ‘세노바메이트’의 품목허가를 신청했다고 20일 밝혔다. 세노바메이트는 SK바이오팜이 자체 개발한 뇌전증 치료제로, 뇌에 흥분성 신호를 전달하는 나트륨 채널을 차단해 신경세포의 흥분성 및 억제성 신호의 균형을 정상화한다. 동아ST는 지난해 1월 SK바이오팜과 세노바메이트의 국내외 30개국 공급을 위한 기술도입 계약을 체결했다. SK바이오팜으로부터 완제의약품(DP) 생산 기술을 이전받아 각국 허가와 판매 및 완제의약품 생산을 담당한다.",2025-02-20 17:04,https://www.etoday.co.kr/news/view/2446855?trc=main_list_news,이투데이
"韓 기업 80%, ‘데이터 기반 HR’ 결정에 AI 활용",https://img.etoday.co.kr/crop/200/125/2139013.jpg,"기업의 인사 및 재무관리를 지원하는 솔루션 업체 워크데이는 한국 기업 80%가 HR 업무와 인재 관리를 위해 AI·ML을 활용하고 있다고 20일 밝혔다. 워크데이에 따르면 이는 북아시아, 호주·뉴질랜드, 일본보다 높은 수치다. 기업들은 AI 기술을 활용해 프로세스를 단순화하고, 인력 데이터를 분석해 전략적 의사결정을 강화하고 있는 것으로 나타났다.",2025-02-20 16:41,https://www.etoday.co.kr/news/view/2446847?trc=main_list_news,이투데이
"""망 무임승차하는 ‘넷플·구글 유튜브 방지법’ 필요해""",https://img.etoday.co.kr/crop/200/125/2138952.jpg,"트래픽 사용량 3분의 1 달하는데 망 이용대가는 0원 국내 CP는 해외 ISP에 요금 지불…'韓기업 역차별' 우려 ""정부, 국내 ISP가 정당한 요구할 수 있는 배경 만들어야"" 구글과 넷플릭스 등 글로벌 콘텐츠서비스제공자(CP)의 ‘망 이용대가 무임승차’를 방지하는 법안의 필요성이 제기됐다. 망 이용대가는 CP들이 인터넷서비스제공자(ISP)에게 이들이 구축한 망 네트워크를 사용하는 대가로 지불하는 요금이다. 20일 한국통신사업자연합회(KTOA)는 서울시 강남구 KTOA 빌딩에서 ‘제6회 통신 산업·서비스 스터디데이’를 열었다. 신",2025-02-20 16:13,https://www.etoday.co.kr/news/view/2446803?trc=main_list_news,이투데이
"쇼핑엔티, 신학기·이사철 맞아 ‘가전 할인 대전’",https://img.etoday.co.kr/crop/200/125/2138989.jpg,"T-커머스 채널 쇼핑엔티는 신학기와 결혼·이사철을 맞아 ‘가전 할인 대전’을 진행한다고 20일 밝혔다. 가전 수요 증가에 맞춰 엄선된 인기 브랜드 제품을 특별 할인가에 선보이며, 라이브 방송을 통해 추가 혜택도 제공할 예정이다. 대표 제품은 △로보락 로봇청소기 △필립스 뉴 슬림쉐이브 면도기 △블랙앤데커 피벗 호루라기 청소기 등이다. 쇼핑엔티는 3월까지 인기 브랜드 가전을 최대 60% 할인하며, 농협카드로 결제 시 5% 추가 할인 혜택을 제공한다.",2025-02-20 16:05,https://www.etoday.co.kr/news/view/2446835?trc=main_list_news,이투데이
"'국가대표' 꾸려 AI 모델 개발 추진…""중·소·대기업 상관없이 공모"" [종합]",https://img.etoday.co.kr/crop/200/125/2138896.jpg,"파운데이션 LLM 모델 개발하는 '국가대표 AI팀' 꾸린다 ""기업 규모 상관없이 역량 있는 팀 공모 통해 선발"" 정부가 ‘국가대표’ 인공지능(AI)팀을 선발해 대형언어모델(LLM) 개발을 추진한다. 국가인공지능위원회는 20일 오전 10시 서울스퀘어 회의실에서 제3차 위원회를 열고, 이 같은 내용이 담긴 AI 산업 지원 방안 등을 논의했다. 이번 3차 위원회는 최상목 대통령 권한대행 부총리 겸 기획재정부 장관을 비롯해 정부·민간위원과 네이버, 모레, 라이너 등 40여 명이 참여했다. LLM 개발 프로젝트의 이름은 ‘월드 베스트 LL",2025-02-20 15:44,https://www.etoday.co.kr/news/view/2446794?trc=main_list_news,이투데이
‘딥시크 금지령’에도 ‘오픈소스 R1’ 쓰는 기업들,https://img.etoday.co.kr/crop/200/125/2138452.jpg,"뤼튼테크놀로지스, 딥시크 ‘안전서비스’ 운영 이스트소프트, AI 검색서비스 ‘앨런’에 R1 적용 “가격 저렴한데 성능은 비슷...활용도 높다” MS·AWS 등 글로벌 빅테크도 적극 도입 정부가 중국의 생성형 인공지능(AI) ‘딥시크’ 애플리케이션(앱)의 국내 서비스를 잠정 중단했지만, 기업들은 딥시크의 추론형 AI 모델 '알원(R1)'을 활용한 서비스를 계속 제공하고 있다. 이는 중단 조치가 앱 서비스에 집중되면서, 딥시크의 오픈소스 기반 R1 모델은 개인정보보호위원회의 제재 대상에서 제외됐기 때문이다. 정부의 '딥시크 금지령'에",2025-02-20 15:36,https://www.etoday.co.kr/news/view/2446417?trc=main_list_news,이투데이
신규 간호사 10명 중 2명 ‘남성’…63년 만에 4만 명 돌파,https://img.etoday.co.kr/crop/200/125/2138949.jpg,"올해 신규로 면허를 받는 간호사 중 10명 중 2명은 남성인 것으로 나타났다. 국내 남자 간호사 수는 63년 만에 처음으로 4만 명을 돌파했다. 20일 대한간호협회에 따르면 2025년도 제65회 간호사 국가시험에서 남자 4292명이 합격해 전체 합격자(2만3760명) 중 18.1%를 차지했다. 남자 간호사 수는 총 4만305명으로 늘어났다. 남자 간호사는 1962년 처음으로 면허를 취득했다. 2000년 처음 연 배출 인원이 100명을 넘어선 데 이어, 2013년에는 1000명을, 2017년에는 2000명을, 2020년에는 3000",2025-02-20 15:17,https://www.etoday.co.kr/news/view/2446798?trc=main_list_news,이투데이
1년 새 ‘주인 바뀐’ 인스파이어 리조트에 쏠린 우려의 시선,https://img.etoday.co.kr/crop/200/125/2136232.jpg,"아시아 최대 엔터테인먼트 리조트 표방 '인스파이어', 1주년 특가 패키지·공연 선봬 1년 간 500만 방문객 다녀가며 인기…내부 상황은 경영권 이슈로 녹록지 않아 인스파이어 “조직 등 운영 그대로”…모히건 “베인캐피탈 경영, 최선의 이익 안될 것” 아시아 최대 엔터테인먼트 리조트를 표방하고 나선 인천 영종도 인스파이어 리조트(인스파이어)의 주인이 개장 1년 만에 돌연 바뀌었다. 앞서 글로벌 프리미어복합리조트 기업 모히건이 출자해 8년간 준비 끝에 탄생한 인스파이어의 주인이 순식간에 바뀌면서 인스파이어 만의 차별화한 콘셉트와 경쟁력",2025-02-20 15:13,https://www.etoday.co.kr/news/view/2446734?trc=main_list_news,이투데이
실내 가스통 옆서 닭 튀긴 백종원…‘더본코리아’에 100만원 과태료,https://img.etoday.co.kr/crop/200/125/2138946.jpg,백종원 더본코리아 대표가 액화석유가스(LPG) 가스통을 실내에 두고 요리했다 과태료 처분을 받게 됐다. 20일 충남 예산군은 더본코리아에 액화석유가스 안전관리 및 사업법 위반으로 과태료 100만원을 부과하기로 했다고 밝혔다. 유통업계와 지역자치단체에 따르면 올해 초 백 대표가 실내에서 LP 가스통 옆 화구에서 요리했다는 민원이 국민신문고에 접수됐다. 작년 5월 유튜브에 올라온 영상에는 백 씨가 예산군 소재 더본외식산업개발원 주방에서 LP 가스통 옆에서 닭을 튀기는 장면이 나온다. 현행 액화석유가스법에 따르면 LP 가스통은 환기가,2025-02-20 15:13,https://www.etoday.co.kr/news/view/2446789?trc=main_list_news,이투데이
삼성·LG 추격에…로봇청소기 1위 로보락 “비교받는 거 뿌듯”,https://img.etoday.co.kr/crop/200/125/2138882.jpg,"한국 기업들과 비교가 된다는 것 자체가 그동안 잘해왔다고 생각하고 뿌듯하다. 한국 소비자들이 제품이나 AS에서 높은 퀄리티를 요구하고 있는 만큼 최고의 가치를 드리겠다. 댄 챔 로보락 아시아태평양 마케팅 총괄은 20일 서울 강남구 그랜드 인터컨티넨탈 서울 파르나스 호텔에서 열린 신제품 출시 기자간담회에서 로봇청소기 시장에서 삼성전자, LG전자 등 국내 기업들의 최근 거센 추격에 관해 이같이 설명했다. 국내 기업들은 지난해 청소와 물걸레를 동시에 하는 하이엔드 올인원 로봇청소기 신제품을 잇달아 출시하면서 시장에 본격적으로 도전장을",2025-02-20 15:05,https://www.etoday.co.kr/news/view/2446742?trc=main_list_news,이투데이
류진 한경협 회장 연임 성공…내달 미국 사절단 꾸린다,https://img.etoday.co.kr/crop/200/125/2138869.jpg,제64회 정기총회 개최 류진 회장 “3월 대미 사절단 꾸릴 것” 트럼프 2기 대응 총력 IT·엔터업계 합류로 외연 확장 한국경제인협회가 다음 달 경제사절단을 꾸려 미국을 방문한다. 류진 한경협 회장은 20일 서울 여의도 FKI타워 컨퍼런스타워에서 열린 제64회 정기총회 참석에 앞서 취재진을 만나 이 같은 계획을 밝혔다. 도널드 트럼프 미국 대통령이 최근 철강에 이어 자동차·반도체 등에 대한 관세 부과를 예고하면서 재계에서도 대응 마련에 분주하다. 전날 최태원 대한상공회의소 회장은 20대 그룹 최고경영자(CEO)로 구성된 사절단을,2025-02-20 15:03,https://www.etoday.co.kr/news/view/2446720?trc=main_list_news,이투데이
"KT&G, ‘릴 솔리드 3.0’ 무상교체 리콜 돌입",https://img.etoday.co.kr/crop/200/125/2138923.jpg,KT&G가 2024년 8월~11월 생산한 ‘릴 솔리드 3.0(lil SOLID 3.0)’ 무상교체 리콜을 20일부터 시행한다. 일부 제품에서 ‘히터 핀 이탈 현상’이 발견돼 판매 중단·제품 전량 회수한다. 자세한 리콜 방법은 ‘릴 미니멀리움’ 또는 ‘릴 공식 서비스센터’를 방문하거나 릴 공식 홈페이지와 고객센터(080-931-0399)에서 안내 받을 수 있다.,2025-02-20 14:51,https://www.etoday.co.kr/news/view/2446779?trc=main_list_news,이투데이
"롯데렌탈, 신성장 동력 B2C 중고차 판매 목표 수정 왜?",https://img.etoday.co.kr/crop/200/125/2138906.jpg,"롯데렌탈이 신성장 동력으로 역점을 두고 추진 중인 기업 소비자 간 거래(B2C) 중고차 매매 사업이 판매 목표치를 하향 조정했다. 사업 진행이 다소 지연된 것과 더불어 업종 내 경쟁 심화로 눈높이를 낮춘 것으로 분석된다. 20일 본지 취재 결과 롯데렌탈은 중고차 B2C 매매사업의 거래 대수 목표치를 올해는 9000대, 내년에는 2만대로 설정했다. 이에 따라 기대되는 매출은 각각 1550억 원, 3520억 원이다. 롯데렌탈은 기존 사업 전략을 재정립하는 과정에서 B2C 중고차 매매를 핵심 신성장 동력으로 준비해왔다. 이와 관련해 최",2025-02-20 14:48,https://www.etoday.co.kr/news/view/2446764?trc=main_list_news,이투데이
송진우 우버택시 대표 “리브랜딩 후 이용률 50%↑…기업용 서비스 출시 예정”,https://img.etoday.co.kr/crop/200/125/2138886.jpg,지난해 3월 우티→우버택시로 리브랜딩 우버에 친숙한 외국인 관광객 이용 늘어 배차 성공률 증진에도 집중…이용률도↑ 기업용 U4B 출시 예정…출장 등서 용이 프리미엄 밴 론칭 계획…여행ㆍ숙박은 아직 “리브랜딩한 다음 외국인 손님들이 눈에 띄게 늘었다” 송진우 우버 택시 코리아 총괄(GM)은 20일 서울특별시 중구 더 플라자 호텔에서 ‘우버 택시 커넥트데이’를 열고 “우티(UT)에서 ‘우버 택시’로 리브랜딩한 이후 이용 건수가 50% 이상 증가했다”며 이같이 말했다. 특히 외국인 관광객이 늘어난 비결은 리브랜딩에 있다. 해외에서 우버,2025-02-20 14:44,https://www.etoday.co.kr/news/view/2446743?trc=main_list_news,이투데이
맛은 기본·영양↑…식사대용 새 간편식 ‘컴포트잇츠이너프’,https://img.etoday.co.kr/crop/200/125/2138888.jpg,"롯데웰푸드는 영양강화 ·식사대용 제과 브랜드 ‘컴포트잇츠이너프(ComfortEatsEnouF)’를 론칭했다고 20일 밝혔다. 컴포트잇츠이너프는 하루 세끼를 차려 먹는 전통적인 식사 대신 필요할 때 간편하면서도 균형 잡힌 영양을 채우고, 효율적으로 시간을 사용하고자 하는 소비자에 주목한 브랜드다. 균형 잡힌 영양 설계를 위해 롯데중앙연구소의 보리 및 통곡물 연구 결과와 제품 개발 노하우를 적용했다. 배우 고민시가 모델로 나선 컴포트잇츠이너프의 신제품은 △베이크드쿠키 △토스티드브레드 △골든츄이바 △큐브케이크 △쉐이크밀 △클래식보리밀",2025-02-20 14:21,https://www.etoday.co.kr/news/view/2446746?trc=main_list_news,이투데이
"셀트리온, 유플라이마 상호교환성 임상 3상 결과 국제학술지 게재",https://img.etoday.co.kr/crop/200/125/2129001.jpg,"셀트리온은 자가면역질환 치료제 유플라이마(성분명 아달리무맙)와 휴미라 간 상호교환성글로벌 임상 3상 결과 논문이 과학기술논문인용색인 확장판(SCIE) 국제학술지에 게재됐다고 20일 밝혔다. 이번 논문을 통해 공개한 연구는 중등도 내지 중증 판상형 건선 환자 367명을 대상으로 진행한 상호교환성 글로벌 임상 3상 결과다. 유플라이마와 휴미라 간 다회교차 투약군과 휴미라 유지 투약군 간의 약동학, 유효성, 안전성 등을 비교 검증했다. 그 결과 유플라이마와 휴미라 간 다회교차 투약군과 휴미라 유지 투약군 간의 약동학적 특성에서 통계적으",2025-02-20 14:17,https://www.etoday.co.kr/news/view/2446753?trc=main_list_news,이투데이
"[BioS]일동 애임스, 'CRO 디티앤씨알오'와 임상 협력 MOU",https://img.etoday.co.kr/crop/200/125/2138879.jpg,일동제약그룹의 신약개발전략 컨설팅 회사인 애임스바이오사이언스(AIMS BioScience)는 20일 디티앤씨바이오그룹(Dt&C Bio Group)의 임상시험수탁기관(CRO)인 디티앤씨알오(Dt&CRO)와 신약연구개발 및 임상시험분야 제휴에 관한 업무협약(MOU)을 체결했다고 밝혔다. 이번 협약에 따라 애임스와 디티앤씨알오는 △신약개발 초기전략 및 임상시험 설계 최적화 △임상시험 운영 및 데이터관리 효율화 △분산형 임상시험(DCT) 기반의 혁신모델 개발 △글로벌 임상시험 규제 대응 및 신약허가 전략수립 등의 분야에서 협력할 예정이다,2025-02-20 14:07,https://www.etoday.co.kr/news/view/2446754?trc=main_list_news,이투데이
박성효 소진공 이사장 “올해 소상공인 어려움 더 커질 것…신속 지원 총력”,https://img.etoday.co.kr/crop/200/125/2138875.jpg,"배달‧택배비 신규 지원…21일부터 지급 3조7700억 원 규모 소상공인 융자지원 “올해는 소상공인들이 겪는 어려움이 더 커질 것으로 예상돼 소상공인시장진흥공단이 해야 할 일이 더 많아질 것이다.” 박성효 소진공 이사장은 20일 여의도 중소기업중앙회에서 신년 기자간담회를 열고 지난해 성과와 향후 중점 추진 과제를 발표하며 이같이 말했다. 박 이사장은 “미국의 보호무역주의 강화, 관세 정책과 경기침체, 정치 상황 등으로 자영업자, 소상공인이 훨씬 어려워지고 올해 폐업률도 높아질 것으로 보인다”고 짚었다. 위기에 몰린 소상공인을 지원하",2025-02-20 14:03,https://www.etoday.co.kr/news/view/2446737?trc=main_list_news,이투데이
‘아이CU’ 덕분에…7년간 실종아동 200명 ‘가족 품으로’,https://img.etoday.co.kr/crop/200/125/2138799.jpg,"#충북 제천에서 CU를 운영하는 이창남(55세) 씨는 새벽 대로변에서 울고 있는 한 아이를 발견하고 ‘아이CU’ 신고 시스템을 활용, 안전하게 경찰에 인계했다. CU는 2017년부터 시행하고 있는 아이CU를 통해 7년 동안 총 200명의 길 잃은 이웃들이 다시 가족의 품을 찾았다고 20일 밝혔다. 아이CU는 전국 1만8500여개 CU 네트워크를 활용해 길을 잃은 어린이(치매환자·발달장애인 등 포함)를 CU에서 보호하고 경찰, 가족에게 인계해주는 실종 예방 신고 시스템이다. 아이CU가 도입된 후 지금까지 아동 131명, 치매노인 5",2025-02-20 13:48,https://www.etoday.co.kr/news/view/2446689?trc=main_list_news,이투데이
"코스맥스, 인니 시장서 ‘화장품·건기식’ 투 트랙 공략",https://img.etoday.co.kr/crop/200/125/2138876.jpg,"화장품 제조자개발생산(ODM) 기업 코스맥스가 인도네시아에서 화장품과 건강기능식품(건기식)을 연계해 포괄적인 뷰티 솔루션을 제시하며 시장 개척에 나선다. 코스맥스인도네시아는 13일 인도네시아 자카르타에서 ‘코스맥스 이노베이션 콘퍼런스 2025’를 진행했다고 20일 밝혔다. 코스맥스는 매년 이노베이션 콘퍼런스를 통해 글로벌 및 인도네시아 최신 뷰티 트렌드를 소개하고 현지 고객사를 위한 통합 전략을 제안한다. 올해 행사에는 타루나 이크라르(Taruna Ikrar) 인도네시아 식약청장, 다니엘 미나르디(Daniel Minardi) 쇼피",2025-02-20 13:45,https://www.etoday.co.kr/news/view/2446739?trc=main_list_news,이투데이
"차백신연구소, 면역증강제 활용 항암백신 조성물 日 특허 취득",https://img.etoday.co.kr/crop/200/125/1918018.jpg,"차백신연구소는 독자 개발한 면역증강제 플랫폼 엘-팜포(L-pampo™)를 활용한 항암 백신 및 그 제조방법에 대한 일본 특허를 취득했다고 19일 밝혔다. 회사에 따르면 엘-팜포를 사용한 항암 백신을 면역관문억제제와 병용 투여한 결과, 면역관문억제제 단독 투여보다 면역원성이 25배 증가했다. 염정선 차백신연구소 대표는 “우리의 면역증강제 기술이 감염병 백신은 물론 항암 백신과 면역치료제로도 높은 가치를 지닌단 점을 입증한 성과”라며 “국내외 대형 제약사들과 협력을 확대할 것”이라고 말했다.",2025-02-20 13:43,https://www.etoday.co.kr/news/view/2446736?trc=main_list_news,이투데이
"HD현대인프라코어, 수소엔진 저온 성능 입증",https://img.etoday.co.kr/crop/200/125/2138873.jpg,"HD현대인프라코어는 타타대우모빌리티와 11리터급 수소엔진(HX12)의 혹한지 테스트를 완료했다고 20일 밝혔다. 저온 환경에서의 즉각 시동 가능 여부, 화물 적재 조건에서의 경사로 운전성 및 제동성, 충전 안전성 등을 검증했다. 회사는 내년 초 수소엔진을 양산해 타타대우모빌리티에 공급한다. 수소엔진 트럭은 2027년 상반기 출시 예정이다.",2025-02-20 13:35,https://www.etoday.co.kr/news/view/2446733?trc=main_list_news,이투데이
"경보제약, 바이넥스와 ADC CDMO 시스템 구축 ‘맞손’",https://img.etoday.co.kr/crop/200/125/2138870.jpg,"경보제약은 바이넥스와 항체약물접합체(ADC) 위탁개발생산(CDMO) 사업을 위한 업무협약을 체결했다고 20일 밝혔다. 이번 협약으로 양사는 ADC용 항체와 링커, 페이로드의 개발부터 ADC 임상시료 생산까지 일괄 제공하는 국내 최초 ‘ADC CDMO 서비스 패키지’를 구축한다. 경보제약은 페이로드 및 링커 라이브러리를 스크리닝해 최적화된 ADC 조합을 도출하고 공정 및 분석법을 개발해 ADC 제조를 담당한다. 바이넥스는 ADC용 항체의 세포주와 공정, 분석법 개발부터 GMP 생산을 맡는다.",2025-02-20 13:35,https://www.etoday.co.kr/news/view/2446732?trc=main_list_news,이투데이
