title,thumbnail,short_content,write_time,link,company
[증시키워드] 삼성전자·SK하이닉스 강세 속 삼성전기·NAVER 재조명,https://img.etoday.co.kr/crop/200/125/2346488.jpg,"삼성전자와 SK하이닉스를 중심으로 한 반도체 랠리가 이어지는 가운데 삼성전기, 네이버(NAVER), LG전자 등이 재부각됐다. 전날 급등했던 반도체 대형주의 추가 상승 여력과 함께 AI 인프라, 플랫폼, 부품주로 번지는 확산 장세가 이어질지 주목하고 있다. 16일 금융투자업계에 따르면 장 시작 전 네이버페이증권 검색 상위종목은 삼성전자, SK하이닉스, 삼성전기, 현대차, NAVER다. 전날 삼성전자는 전 거래일 대비 4.50% 오른 33만7000원, SK하이닉스는 6.42% 상승한 228만8000원에 거래를 마쳤다. 미국과 이란의",2026-06-16 08:08,https://www.etoday.co.kr/news/view/2593883?trc=main_list_news,이투데이
"뉴욕증시, 다우 사상 최고치...반도체 랠리에 나스닥 3%↑[종합]",https://img.etoday.co.kr/crop/200/125/2346481.jpg,"미ㆍ이란 종전 합의 전자 서명 3대 지수, 3거래일 연속 오름세 엔비디아ㆍ마이크론이 주도 스페이스X, 데뷔 2거래일에도 20%↑ 폭스, 로쿠 인수 발표 후 주가 17%↓ 뉴욕증시는 15일(현지시간) 상승 종료했다. 미국과 이란이 종전 합의에 성공한 데 따른 것이다. 뉴욕증권거래소(NYSE)에서 다우존스30산업평균지수는 전 거래일 대비 468.77포인트(0.92%) 오른 5만1671.03에 마무리했다. 스탠더드앤드푸어스(S&P)500지수는 122.83포인트(1.65%) 상승한 7554.29에, 기술주 중심의 나스닥종합지수는 795.",2026-06-16 08:05,https://www.etoday.co.kr/news/view/2593872?trc=main_list_news,이투데이
"유안타 ""현대모비스, 보스턴다이내믹스 타고 로봇 부품 재평가…목표가↑""",https://img.etoday.co.kr/crop/200/125/2346485.jpg,"유안타증권은 16일 현대모비스에 대해 보스턴다이내믹스(BD)향 휴머노이드 핵심 부품 공급사로서 중장기 성장성이 부각된다며 투자의견 ‘매수’를 유지하고 목표주가를 87만원으로 올렸다. 그룹 내 완성차 업체가 BD의 고객이라면, 현대모비스는 BD 성장과 직접 연결되는 핵심 부품 공급사라는 점에 주목하며 업종 내 유일한 톱픽으로 제시했다. 김용민 유안타증권 연구원은 ""현대모비스의 향후 역할은 단순 부품 공급업체가 아니라 휴머노이드 산업의 하드웨어 플랫폼 티어1 공급자""라며 ""BD 아틀라스향 부품 양산 경험을 쌓은 뒤 비계열 고객으로 공",2026-06-16 08:05,https://www.etoday.co.kr/news/view/2593881?trc=main_list_news,이투데이
강세일 에스바이오메딕스 대표 “파킨슨병 세포치료제 ‘TED-A9’ 2년 추적 성공…글로벌 탑티어 입지 확보”,https://img.etoday.co.kr/crop/200/125/2182815.jpg,"“시간 지날수록 운동기능 개선 폭 확대…이식 세포 생착ㆍ도파민 생성 과학적 입증” “2년간 세포 관련 이상반응 ‘제로’…연내 미 FDA IND 신청 목표, 한ㆍ미ㆍ일 멀티트랙 가속화” 전 세계 약 1000만 명의 환자에게 고통을 안기고 있는 퇴행성 뇌 질환 ‘파킨슨병’ 시장에 국내 바이오 기업이 기념비적인 이정표를 세웠다. 인간 배아줄기세포 유래 파킨슨병 세포치료제 ‘TED-A9’을 개발 중인 에스바이오메딕스가 임상 1/2a상의 24개월 추적관찰 톱라인(Top-line) 데이터를 확보하며 글로벌 상업화를 위한 발판을 마련했다. 1",2026-06-16 08:03,https://www.etoday.co.kr/news/view/2593879?trc=main_list_news,이투데이
"뉴욕금값, 美·이란 종전 합의 소식 전해지며 상승 마감…금 선물 2.66%↑",https://img.etoday.co.kr/crop/200/125/2300884.jpg,국제 금값은 15일(현지시간) 상승 마감했다. 뉴욕상품거래소(COMEX)에서 8월 인도분 금 선물 가격은 전 거래일 대비 112.80달러(2.66%) 상승한 온스당 4351.60달러에 마감했다. 금 현물 가격은 전 거래일 대비 약 2.6% 오른 온스당 4300달러 선에서 거래됐다. 이날 금값은 전날 미국과 이란 간 종전 합의 양해각서(MOU)가 19일 체결될 것이란 소식에 상승하며 이틀 연속 상승세를 이어갔다. 양 국가의 종합 합의 발표 이후 유가가 급락세를 보인 것이 미 국채 금리와 달러화 가치를 낮추며 금값에 영향을 미쳤다.,2026-06-16 08:02,https://www.etoday.co.kr/news/view/2593876?trc=main_list_news,이투데이
[오늘의 투자전략] 코스피 추가 반등 시도…‘삼전ㆍ닉스’ 반도체 강세 뒤 순환매 주목,https://img.etoday.co.kr/crop/200/125/2342472.jpg,"16일 국내 증시는 미국과 이란의 휴전 기대, 유가·금리 하락, 미국 반도체주 급등을 반영해 상승 출발할 전망이다. 다만 전일 코스피가 5% 넘게 급등한 만큼 장 초반에는 반도체 강세가 먼저 나타난 뒤, 이후 다른 업종으로 매기가 확산할 가능성이 크다. ◆한지영 키움증권 연구원 = 15일 미국 증시는 미·이란 휴전 협상 타결 기대에 힘입어 상승 마감했다. 국제유가는 급락했고, 스페이스X 강세도 이어졌다. HBM 수요 지속 전망에 마이크론과 엔비디아 등 반도체주도 크게 올랐다. 다우지수는 0.9%, S&P500지수는 1.7%, 나스",2026-06-16 07:59,https://www.etoday.co.kr/news/view/2593874?trc=main_list_news,이투데이
"국제유가, 미ㆍ이란 종전 합의 전자 서명에 하락…WTI 4.9%↓",https://img.etoday.co.kr/crop/200/125/2314629.jpg,3월 4일 이후 최저가 국제유가는 15일(현지시간) 미국과 이란의 종전 합의로 하락했다. 뉴욕상업거래소(NYMEX)에서 미국 서부 텍사스산 원유(WTI) 선물은 전 거래일 대비 4.13달러(4.87%) 내린 배럴당 80.75달러에 마감했다. 런던 ICE선물거래소에서 브렌트유 선물은 4.16달러(4.76%) 떨어진 배럴당 83.17달러로 집계됐다. 두 유종 모두 3월 4일 이후 가장 낮은 종가를 기록했다. 지난 몇 달간 누적됐던 ‘전쟁 리스크 프리미엄’의 상당 부분을 반납한 셈이다. 미국의 도널드 트럼프 대통령과 J.D. 밴스 부통,2026-06-16 07:56,https://www.etoday.co.kr/news/view/2593857?trc=main_list_news,이투데이
"LS증권 ""전력기기, 5~6월 숨고르기 끝…효성중공업 목표가 상향""",https://img.etoday.co.kr/crop/200/125/2346474.jpg,"LS증권은 16일 전력기기 업종에 대해 최근 조정은 펀더멘털 훼손이 아닌 단기 숨고르기 과정이라며 재차 주목할 시점이라고 분석했다. 미국 전력망 투자 확대와 인공지능(AI) 데이터센터 전력 수요 급증이 맞물리며 업황 호조가 장기화할 것으로 전망했다. 이날 LS증권 '전력기기, 5~6월 적절한 숨고르기 조정. 재주목 시점' 보고서에 따르면 미국 전력망 시장은 2022년 이후 수요 급증과 공급망 병목 현상이 지속되며 극심한 공급자 우위(Seller's Market) 국면이 이어지고 있다. 하이퍼스케일 AI 데이터센터 확대와 제조업 리",2026-06-16 07:52,https://www.etoday.co.kr/news/view/2593871?trc=main_list_news,이투데이
"스페이스X, 공모주 추가 배정…조달액 750억→857억달러로 ‘초대박’",https://img.etoday.co.kr/crop/200/125/2346460.jpg,"머스크 “2030년까지 매출 1조달러” 자신 스페이스X 주가, 2거래일째 20% 가까이 폭등 미국 우주항공기업 스페이스X의 기업공개(IPO) 주관사들이 추가 물량 배정 옵션(그린슈)을 행사하면서 이번 상장을 통한 신규자금 조달액이 총 857억달러(약 130조원)로 늘었다고 로이터통신이 15일(현지시간) 보도했다. 앞서 스페이스X는 12일 상장 당시 공모가격을 주당 135달러로 최종 확정하고, 보통주(A주) 5억5556만 주를 매각해 750억달러를 조달했다. 그린슈란 상장 흥행 시 주관사가 주식을 추가로 더 팔 수 있게 해주는 초과",2026-06-16 07:47,https://www.etoday.co.kr/news/view/2593863?trc=main_list_news,이투데이
원·달러 NDF 2.75원 상승..종전합의에도 경계감 잔존,https://img.etoday.co.kr/crop/200/125/2345143.jpg,"역외환율이 상승했다. 미국·이란간 종전 합의에도 불구하고 19일 정식서명까지는 경계감이 남아 있다는 분위기를 반영했기 때문이다. 실제, 이번 합의에도 불구하고 19일까지는 호르무즈 봉쇄가 여전한데다, 핵 관련 부분은 빠져있다는데 주목했다. 반면, 3대 국제유가는 일제히 하락해 3개월만에 최저치를 경신했고, 달러인덱스도 소폭 하락했다. 15일(현지시간) 뉴욕 차액결제선물환(NDF)시장에서 원·달러 1개월물은 1512.2/1512.6원에 최종 호가되며 거래를 마쳤다. 이는 최근 1개월물 스왑포인트 -1.45원(서울외환중개 기준)을 감안",2026-06-16 07:45,https://www.etoday.co.kr/news/view/2593866?trc=main_list_news,이투데이
"대신증권 ""SK, 에코플랜트 어닝 서프라이즈…실트론 매각 곧 매듭""",https://img.etoday.co.kr/crop/200/125/2346459.jpg,"대신증권은 16일 SK에 대해 메모리부터 전력까지 인공지능(AI) 인프라 전반을 아우르는 역량이 쌓였다며 투자의견 '매수'와 목표주가 88만원을 유지했다. SK의 전 거래일 종가는 64만6000원이다. 이경연 대신증권 연구원은 ""SK에코플랜트 지분 취득과 포트폴리오 리밸런싱을 통해 순자산가치(NAV) 할인율이 지속 축소될 전망""이라고 짚었다. SK의 비상장 자회사 SK에코플랜트는 올 1분기 매출액 4조8997억원, 영업이익 9310억원을 기록했다. 전년 동기 대비 각각 99%, 1269% 상승하며 어닝 서프라이즈를 보였다. 반도체",2026-06-16 07:38,https://www.etoday.co.kr/news/view/2593864?trc=main_list_news,이투데이
[오늘의 IR] 두산에너빌리티ㆍ케이뱅크ㆍ티쓰리 등,https://img.etoday.co.kr/crop/200/125/2285973.jpg,"△성광벤드, BofA 2026 Korea Conference 참가 △우진, 국내 기관 대상 NDR 실시 △모다이노칩, 로젠과의 합병 관련 투자자 설명회 △CJ대한통운, BofA 2026 Korea Conference 참가 △미래에셋증권, BofA 2026 Korea Conference 참가 △티쓰리, 현대차증권 주관 NDR △현대모비스, BofA 2026 Korea Conference 참가 △롯데쇼핑, BofA 2026 Korea Conference 참가 △로젠, 모다이노칩과의 합병 관련 투자자 설명회 △에코프로비엠, BofA 2",2026-06-16 07:14,https://www.etoday.co.kr/news/view/2593858?trc=main_list_news,이투데이
"뉴욕증시, 다우ㆍ반도체지수 사상 최고치⋯나스닥 3%↑[상보]",https://img.etoday.co.kr/crop/200/125/2346448.jpg,"3대 지수, 3거래일 연속 오름세 엔비디아ㆍ마이크론이 주도 스페이스X, 데뷔 2거래일에도 20%↑ 폭스, 로쿠 인수 발표 후 주가 17%↓ 뉴욕증시는 15일(현지시간) 상승 종료했다. 미국과 이란이 종전 합의에 성공한 데 따른 것이다. 뉴욕증권거래소(NYSE)에서 다우존스30산업평균지수는 전 거래일 대비 468.77포인트(0.92%) 오른 5만1671.03에 마무리했다. 스탠더드앤드푸어스(S&P)500지수는 122.83포인트(1.65%) 상승한 7554.29에, 기술주 중심의 나스닥종합지수는 795.10포인트(3.07%) 급등한",2026-06-16 07:00,https://www.etoday.co.kr/news/view/2593855?trc=main_list_news,이투데이
"유럽증시, 美·이란 종전 MOU 체결 소식에 상승 마감…스톡스600 0.19%↑",https://img.etoday.co.kr/crop/200/125/2346444.jpg,"유럽증시는 15일(현지시간) 상승 마감했다. 범유럽 주가지수인 스톡스유럽600 지수는 전 거래일 대비 1.23포인트(0.19%) 오른 634.44에 마감했다. 독일 프랑크푸르트증시 DAX30지수는 258.71포인트(1.05%) 상승한 2만4894.01에, 영국 런던증시 FTSE100지수는 41.10포인트(0.39%) 하락한 1만430.62에, 프랑스 파리증시 CAC40지수는 33.14포인트(0.40%) 오른 8384.01에 거래를 마쳤다. 이날 유럽증시는 미국과 이란이 종전 양해각서(MOU)에 체결하기로 했다는 소식이 전해지며 상",2026-06-16 06:38,https://www.etoday.co.kr/news/view/2593853?trc=main_list_news,이투데이
"[속보] 국제유가, 미ㆍ이란 종전 합의에 하락…WTI 4.9%↓",https://img.etoday.co.kr/crop/200/125/2259613.jpg,국제유가는 15일(현지시간) 하락했다. 미국과 이란이 종전 합의에 성공한 데 따른 것이다. 뉴욕상업거래소(NYMEX)에서 미국 서부 텍사스산 원유(WTI) 선물은 전 거래일 대비 4.13달러(4.87%) 내린 배럴당 80.75달러에 마감했다. 런던 ICE선물거래소에서 브렌트유 선물은 4.16달러(4.76%) 떨어진 배럴당 83.17달러로 집계됐다.,2026-06-16 05:54,https://www.etoday.co.kr/news/view/2593851?trc=main_list_news,이투데이
"[속보] 뉴욕증시, 종전 합의에 상승 마감…나스닥 3%↑",https://img.etoday.co.kr/crop/200/125/2259613.jpg,"뉴욕증시는 15일(현지시간) 상승 종료했다. 미국과 이란이 종전 합의에 성공한 데 따른 것이다. 뉴욕증권거래소(NYSE)에서 다우존스30산업평균지수는 전 거래일 대비 468.77포인트(0.92%) 오른 5만1671.03에 마무리했다. 스탠더드앤드푸어스(S&P)500지수는 122.83포인트(1.65%) 상승한 7554.29에, 기술주 중심의 나스닥종합지수는 795.10포인트(3.07%) 오른 2만6683.94에 마감했다.",2026-06-16 05:48,https://www.etoday.co.kr/news/view/2593850?trc=main_list_news,이투데이
"제이알글로벌리츠, 자율구조조정 협의 기간 한 달 연장",https://img.etoday.co.kr/crop/200/125/2327473.jpg,"제이알글로벌리츠를 정상화하기 위한 기업과 채권자 간의 협의 기간이 연장됐다. 제이알글로벌리츠는 15일 서울회생법원이 자율구조조정프로그램(ARS)의 협의 기간을 다음달 15일까지 1개월 연장하는 것을 승인했다고 밝혔다. ARS는 법원의 감독 하에 기업이 채무변제 등 정상화 방안을 채권자와 자율적으로 협의할 수 있도록 회생절차 개시를 최장 3개월 동안 보류해주는 제도다. 채권자와의 협의가 원만하게 이뤄지면 회생절차 개시 신청은 취하되고 회사는 정상 영업이 가능해진다. 제이알글로벌리츠 관계자는 ""지난 1개월의 ARS 기간 동안 회사와",2026-06-15 20:16,https://www.etoday.co.kr/news/view/2593840?trc=main_list_news,이투데이
서학개미 2.0은 ‘AI 인프라 베팅’⋯순매수 상위 6개 종목 모두 미국 반도체·클라우드,https://img.etoday.co.kr/crop/200/125/2346336.jpg,국내 개인 투자자(서학개미)들이 미국 증시의 AI 데이터센터 구축 및 인프라 관련 성장주를 대거 사들이며 ‘AI 인프라’라는 단일 거시 테마에 집중 투자하고 있는 것으로 나타났다. 15일 증권정보포털 세이브로(SEIBro)에 따르면 이달 1일부터 12일까지 국내 투자자들의 해외주식 순매수 상위 6개 종목(ETF 제외)은 1위 마이크론(2억9183만 달러)을 필두로 △2위 마벨 테크놀로지(2억6116만 달러) △3위 브로드컴(1억2355만 달러) △4위 암 홀딩스(1억730만 달러) △5위 스노우플레이크(9122만 달러) △6위 코,2026-06-15 18:00,https://www.etoday.co.kr/news/view/2593760?trc=main_list_news,이투데이
"[채권마감] 금리 보름여만 최저, 종전 합의·입찰 호조·외인 10선 대량매수",https://img.etoday.co.kr/crop/200/125/2346275.jpg,"선물 만기 앞둔 수급장도 강세 요인 이틀간 금리낙폭 큰데다 BOJ·FOMC 등 대기, 선물 월물교체 후 강세 제한될 듯 채권시장이 이틀째 강세를 이어갔다(금리 하락, 국고3년물 기준). 특히, 국고3년물부터 10년물까지 금리는 이달들어 가장 낮은 수준을 기록하며, 보름만에 최저치를 경신했다. 국고20년물이상 초장기물도 이달 2일 이후 가장 낮은 수준을 기록했다. 지난주말부터 기대감이 확산했던 미국·이란간 종전협상이 끝났다. 19일 스위스에서 정식 서명식을 할 예정이다. 이에 따라 국제유가가 80달러대로 내려앉았고, 원·달러 환율도",2026-06-15 17:12,https://www.etoday.co.kr/news/view/2593802?trc=main_list_news,이투데이
"아시아증시, 종전 MOU가 지수 들어올려⋯닛케이 4.9%↑",https://img.etoday.co.kr/crop/200/125/2346326.jpg,15일 아시아 증시는 ‘이란 전쟁 리스크 해소 랠리’가 두드러졌다. 미국과 이란이 전격적으로 종전 MOU를 예고했고 동시에 호르무즈 해협 재개방 소식도 호재로 작용했다. 지정학적 리스크 해소와 유가 급락에 따른 인플레이션 우려 완화가 시장의 강력한 ‘위험 자산 선호(Risk-on)’ 심리를 자극했다. 한국과 일본 대표 지수는 각각 5% 안팎 급등하며 마감했다. 특히 일본 증시 대표 지수인 닛케이225지수(닛케이)는 역대 최고치를 경신한 것은 물론 사상 처음으로 6만9000선을 돌파했다. 마켓워치에 따르면 일본 닛케이는 전 거래일,2026-06-15 17:12,https://www.etoday.co.kr/news/view/2593799?trc=main_list_news,이투데이
[급등락주 짚어보기] 탈모 건보 기대에 현대약품ㆍJW신약·TS트릴리온 상한가…로봇·반도체도 강세,https://img.etoday.co.kr/crop/200/125/2346307.jpg,"국내 증시에서는 탈모 치료 건강보험 급여 확대 추진 기대와 미·이란 종전 합의에 따른 항공주 투자심리 회복, 로봇·반도체·이차전지 장비 순환매가 맞물리며 상한가 종목이 나왔다. 코스피 시장에서는 3개, 코스닥 시장에서는 10개 종목이 상한가를 기록했다. 15일 코스피 시장에서 상한가를 기록한 종목은 삼화전자, 티웨이홀딩스, 현대약품이다. 삼화전자는 전 거래일 대비 29.80% 오른 2875원에 거래를 마감했다. 전기차용 전장부품 공급 확대 기대와 인공지능(AI) 전력용 부품 성장성이 부각되며 매수세가 유입된 것으로 풀이된다. 삼화",2026-06-15 16:53,https://www.etoday.co.kr/news/view/2593784?trc=main_list_news,이투데이
총성 멈추자 글로벌 시장 반색…유가 급락·증시 고공행진 [미·이란 종전],https://img.etoday.co.kr/crop/200/125/2346275.jpg,"코스피 5.2%↑…2거래일 연속 매수 사이드카 원·달러 환율 1511.1원…8.7원↓ 日증시 닛케이, 사상 첫 6만9000선 국제유가 5% 안팎 급락…3월 이후 최저 미국과 이란이 종전 합의에 도달하면서 글로벌 금융시장이 일제히 안도 랠리를 펼쳤다. 세계 원유 수송의 핵심 통로인 호르무즈 해협 재개방 기대가 커지면서 국제유가는 5% 안팎으로 급락했고 주식시장과 외환시장에서는 위험자산 선호 심리가 빠르게 되살아났다. 글로벌 증시가 일제히 강세를 보였고 국내 금융시장도 즉각 반응했다. 15일 코스피지수는 전 거래일 대비 422.36포",2026-06-15 16:23,https://www.etoday.co.kr/news/view/2593769?trc=main_list_news,이투데이
[오늘의 주요공시] JTBC·SK·한미반도체 등,https://img.etoday.co.kr/crop/200/125/2344440.jpg,"△ JTBC, 법원에 회생절차 신청 △ SK, SK실트론 매각 추진설 해명…협의 진행 중이나 미확정 △ 두산, SK실트론 인수설 해명…구체적 확정 사항 미정 △ 감성코퍼레이션, 보유 자사주 64만여 주 소각 결정 △ 인탑스, 130억원 규모 자사주 취득 신탁계약 체결 △ 동양이엔피, 모티브링크 주식 364억원 규모 취득…지분율 43.4% △ 콘텐트리중앙·메가박스중앙, 법원에 회생절차 신청 △ 엠에프씨, 10억원 규모 자사주 취득 결정 △ 한미반도체, 스페이스X 주식 500억원 규모 취득 완료 △ 씨메스로보틱스, 23억원 규모 로봇",2026-06-15 16:19,https://www.etoday.co.kr/news/view/2593766?trc=main_list_news,이투데이
공모가 놓친 우주 ETF…스페이스X '편입가 싸움'으로,https://img.etoday.co.kr/crop/200/125/2345374.jpg,"미국 우주기업 스페이스X 상장 이후 국내 우주항공 상장지수펀드(ETF) 경쟁의 초점이 편입 여부에서 매입 단가로 옮겨가고 있다. 공모주 물량 확보가 불발된 뒤 장내 매수로 비중을 채운 상품과 지수 방법론에 따라 뒤늦게 편입하는 상품 간 차이가 벌어지면서다. 15일 금융투자업계에 따르면 코스콤 ETF CHECK와 각 운용사 포트폴리오 공개자료 기준 일부 국내 우주항공·우주테크 ETF들이 스페이스X를 장내에서 편입하기 시작했다. 삼성자산운용의 'KODEX 미국우주항공'은 스페이스X를 25% 비중으로 담았고, 한국투자신탁운용의 'ACE",2026-06-15 16:18,https://www.etoday.co.kr/news/view/2593754?trc=main_list_news,이투데이
"[장외시황] 레몬헬스케어, 수요예측 진행",https://img.etoday.co.kr/crop/200/125/2346259.jpg,"비상장 주식 시장은 호가 변화가 없었다. 15일 금융투자업계에 따르면 의료용 마이데이터 플랫폼 전문기업 레몬헬스케어가 이날부터 19일까지 기관투자자 대상 수요예측을 진행한다. 희망공모가는 7500~1만원이고, 대표주관사는 KB증권이다. IPO(기업공개)관련 상장 예비심사 청구종목으로 특수 목적용 항법 및 항재밍 토탈 솔루션 전문업체 덕산넵코어스(구.넵코어스)와 전력반도체 전문기업 파워큐브세미가 보합세를 보였다. 상장 예비심사 승인종목으로 휴대용 엑스레이 장치 전문업체 레메디는 호가 4만2450원(+1.07%)으로 상승했다. 인공지능",2026-06-15 16:08,https://www.etoday.co.kr/news/view/2593759?trc=main_list_news,이투데이
"코스피, 종전 합의에 5%대 급등…8500선 회복",https://img.etoday.co.kr/crop/200/125/2346254.jpg,"코스피가 15일 400포인트 넘게 폭등하며 단숨에 8500선을 탈환했다. 미국·이란 전쟁 종전 합의로 중동 리스크가 걷히자 얼어붙었던 투자심리가 빠르게 되살아났고, 유가증권시장에는 전 거래일에 이어 2거래일 연속 매수 사이드카가 발동됐다. 외국인은 이틀째 ‘사자’에 나서며 삼성전자와 SK하이닉스 등 대형 반도체주 중심의 급반등을 이끌었다. 이날 코스피는 전 거래일보다 422.36포인트(5.20%) 오른 8545.98에 거래를 마쳤다. 지수는 전장보다 402.50포인트(4.95%) 오른 8526.12로 출발한 뒤 장중 8500선 위에",2026-06-15 16:03,https://www.etoday.co.kr/news/view/2593757?trc=main_list_news,이투데이
"한투증권, 카카오뱅크와 적립식 발행어음 서비스 선봬",https://img.etoday.co.kr/crop/200/125/2346233.jpg,한국금융지주 자회사 한국투자증권이 카카오뱅크와 손을 맞잡고 발행어음 서비스를 선보인다. 한국투자증권은 카카오뱅크 앱을 통해 '적립식 발행어음' 서비스를 출시했다고 15일 밝혔다. 적립식 발행어음은 매월 지정한 날짜마다 발행어음 상품에 자동 투자할 수 있는 서비스다. 투자기간은 1년이다. 이달 기준 연 4.35% 수익률(세전)을 제공한다. 카카오뱅크 제휴 한국투자증권 뱅키스(BanKIS) 위탁계좌를 보유한 고객이라면 누구든 카카오뱅크 앱에서 1인당 1계좌씩 가입할 수 있다. 납부 금액은 월 10만원부터 최대 1000만원까지다. 월,2026-06-15 16:02,https://www.etoday.co.kr/news/view/2593740?trc=main_list_news,이투데이
'미-이란 종전합의' 코스피 급등 [포토로그],https://img.etoday.co.kr/crop/200/125/2346250.jpg,미국과 이란의 종전 합의 소식에 힘입어 코스피가 8500선에서 상승 마감한 15일 서울 중구 하나은행 본점 모니터에 코스피 등 시황이 표시되고 있다. 이날 지수는 전 거래일보다 422.36포인트(5.20%) 오른 8545.98에 장을 마쳤다. 코스닥은 4.98포인트(0.48%) 상승한 1034.03에 마감했고 서울 외환시장에서 원·달러 환율은 전 거래일보다 8.7원 내린 1511.1원에 거래를 마쳤다.,2026-06-15 16:01,https://www.etoday.co.kr/news/view/2593755?trc=main_list_news,이투데이
"금투협, 우주산업 투자 기회 모색…룩셈부르크와 세미나",https://img.etoday.co.kr/crop/200/125/2346245.jpg,"금융투자협회는 15일 주한룩셈부르크대사관(대사 자크 플리스)과 함께 국내 금융투자업계의 우주산업 투자 기회를 모색하기 위한 ‘글로벌 우주산업 투자 세미나’를 개최했다고 밝혔다. 이번 세미나는 룩셈부르크를 중심으로 성장하고 있는 유럽 우주산업의 투자 환경과 핵심 밸류체인을 점검하기 위해 마련됐다. 국내 증권사와 자산운용사의 해외 대체투자 포트폴리오 다변화와 신성장 분야 진출을 지원하는 취지도 담겼다. 세미나에는 유럽 우주산업 전문 투자회사와 기술 기업, 법률 전문가가 참여했다. 참석자들은 산업 전망부터 기술 혁신, 투자 구조화까지",2026-06-15 16:00,https://www.etoday.co.kr/news/view/2593753?trc=main_list_news,이투데이
