title,thumbnail,short_content,write_time,link,company
한남1구역 등 9곳 신통기획 재개발 후보지 선정,https://img.etoday.co.kr/crop/200/125/2141892.jpg,서울시는 '2025년 제1차 주택재개발사업 후보지 선정위원회'를 열고 강북구 미아동 75일대와 용산구 이태원동 730일대(한남1구역) 등 후보지 9곳을 선정했다고 28일 밝혔다. 신속통합기획 재개발 추진구역은 이를 포함해 총 97곳이 됐다. 미아동 75일대는 미아삼거리역 인근에 있으며 호수밀도와 반지하주택 비율이 높고 침수발생 예상지역이 포함된 곳이다. 용산구 이태원동 730일대는 한남재정비촉진지구 한남1촉진지구에서 해제된 노후불량 주택지다. 후보지 선정으로 주변 한남재정비촉진사업과 함께 정주환경 개선에 상승효과를 보일 것으로 기,2025-02-28 11:15,https://www.etoday.co.kr/news/view/2448861?trc=main_list_news,이투데이
"국토부, 세종안성 고속도로 붕괴사고 조사위 구성…28일 조사 착수",https://img.etoday.co.kr/crop/200/125/2140825.jpg,"국토교통부는 25일 세종안성 고속도로 건설공사 제9공구 현장에서 발생한 교량 거더 붕괴사고 조사를 위한 건설사고조사위원회(사조위)를 구성·운영한다고 28일 밝혔다. 이번 사조위는 전문성과 객관성을 확보하기 위해 산·학·연 중심의 민간 전문가로 구성하였으며 투명한 조사를 위해 독립적으로 업무를 수행한다. 이 과정에서 국토부는 관계기관 협의 등을 지원하고, 국토안전관리원은 간사 역할을 수행할 계획이다. 사조위는 토목구조 전문가인 양은익 강릉원주대 교수를 위원장으로 12명의 위원으로 구성되었으며 이날부터 약 2개월간 사고조사를 시행할",2025-02-28 10:01,https://www.etoday.co.kr/news/view/2448964?trc=main_list_news,이투데이
서울 지식산업센터 거래 '시들'…매매지수 전 분기 대비 4.9%↓,https://img.etoday.co.kr/crop/200/125/2141961.jpg,"서울 지식산업센터 거래 시장 회복세가 더딘 것으로 나타났다. 28일 상업용 부동산 데이터 기업 알스퀘어가 조사한 '2024년 4분기 지산 매매 지표'에 따르면 서울 지식산업센터 매매 지수(ROSI)는 191.1포인트를 기록했다. 이는 전 분기(201.2포인트) 대비 4.9% 하락한 수치다. 전년 동기(217.0포인트)와 비교하면 11.9% 낮은 수준이다. 거래량은 증가했다. 4분기 거래액은 1748억 원으로, 전 분기(1358억 원) 대비 28.7% 증가했다. 2024년 서울 지식산업센터 누적 거래액은 4583억 원으로 전년(35",2025-02-28 09:07,https://www.etoday.co.kr/news/view/2448924?trc=main_list_news,이투데이
'노치원' 품은 여의도 대교아파트 재건축 통합심의 통과,https://img.etoday.co.kr/crop/200/125/2141890.jpg,서울시는 제2차 정비사업 통합심의위원회에서 '여의도 대교아파트 재건축사업'의 사업시행인가를 위한 통합심의안을 통과시켰다고 28일 밝혔다. 여의도 대교아파트 재건축은 공동주택 4개동(43~49층) 총 912가구를 건립하는 사업이다. 여의도 일대와 중산층이 선호하는 입지 특성을 고려한 단지 계획이 수립됐다. 사업지 북쪽에 있는 한강과 여의도공원 연계를 위해 통경축·개방감을 고려했으며 기부채납으로 건립될 공공체육시설과도 연계된다. 사업지 내 8m의 공공보행통로를 이용해 아파트 입주민의 보행편의성과 인근 학교로 연결되는 통학로가 확보된다,2025-02-28 06:00,https://www.etoday.co.kr/news/view/2448859?trc=main_list_news,이투데이
"이통3사, MWC25서 'AI 동맹' 전선 구축",https://img.etoday.co.kr/crop/200/125/2142987.jpg,"SKT, 글로벌 텔코 AI 얼라이언스 총회 개최 KT, 韓 AI스타트업과 상생…유럽 시장 공략 LG유플러스, 구글과 AI 협력…익시오 고도화 국내 이동통신사가 세계 최대 이동통신 박람회 ‘모바일월드콩그레스(MWC)25’에서 인공지능(AI) 분야 동맹 구축에 뛰어들고 있다. 글로벌 빅테크와 AI 기술 및 서비스를 공동 개발하면서도 한국 기업 간 AI 생태계를 조성하는 식이다. 올해 MWC는 스페인 바르셀로나에서 3일부터 6일까지 개최됐다. 4일 통신 업계에 따르면, SK텔레콤은 MWC25에서 글로벌 텔코 AI 얼라이언스 총회를 열었",2025-03-04 18:09,https://www.etoday.co.kr/news/view/2449559?trc=main_list_news,이투데이
홈플러스 노조 “매장 줄폐점·직원 대량 해고 우려”,https://img.etoday.co.kr/crop/200/125/2143123.jpg,"대형마트업계 2위 홈플러스가 단기 유동성 악화로 기업회생절차에 들어간 가운데 홈플러스 노조가 매장 폐점, 직원 대량 해고 등을 우려했다. 홈플러스의 교섭노조인 마트산업노동조합 홈플러스 지부는 4일 입장문을 내고 “홈플러스 주식회사가 서울회생법원에 기업회생절차를 신청하며 약 2만 명의 조합원과 그 가족의 생존이 위협받고 있다”고 우려했다. 이어 이들은 “회생절차가 시작되면 고정비용 절감을 명분으로 심각한 구조조정이 불가피하다”며 “회생 과정에서 매장 폐점, 자산 매각, 대량 해고 등 최악의 시나리오가 현실화될 가능성이 높다”고 했다",2025-03-04 18:06,https://www.etoday.co.kr/news/view/2449727?trc=main_list_news,이투데이
빅테크 공세에도 안방 사수한 네이버,https://img.etoday.co.kr/crop/200/125/2143120.jpg,네이버 AI 활용한 초개인화 서비스로 검색시장 지켜…구글은 하락 연임 확실시 최수연 대표와 복귀하는 이해진 창업자 시너지 기대 네이버가 글로벌 빅테크의 거센 공세에도 국내 검색 시장의 강자로서 입지를 굳건히 지키고 있다. 지난해 50% 초반까지 하락했던 네이버의 검색 점유율은 60% 후반까지 반등하며 확고한 시장 우위를 확보했다. 네이버는 인공지능(AI)을 활용한 초개인화된 서비스를 강화해 검색 시장에서 경쟁력을 확대하고 있다. 4일 국내 웹사이트 분석 사이트 인터넷트렌드에 따르면 네이버의 2월 평균 검색시장 점유율은 66.41%,2025-03-04 18:01,https://www.etoday.co.kr/news/view/2449655?trc=main_list_news,이투데이
"로봇청소기 정보 유출 논란에…개인정보위, 실태점검 나선다",https://img.etoday.co.kr/crop/200/125/2123297.jpg,"개인정보보호위원회는 최근 사물인터넷(IoT) 기술을 활용하는 가전제품인 로봇청소기의 판매량이 급증하고 있는 상황 에서 정보주체의 영상·음성 정보 등을 처리하는 로봇청소기의 개인정보 수집·이용 현황에 대한 사전 실태점검을 진행한다고 4일 밝혔다. 개인정보위는 국내에 출시된 로봇청소기 국내·외 주요 브랜드 제품을 중심으로 개인정보 처리 과정 전반에 대해 개인정보 처리 주체, 개인정보 처리 동의 여부, 수집·이용 항목 및 목적, 개인정보 보관·이전·전송 방식, 제3자 제공·공유 여부 등 개인정보 보호법 준수 여부를 살펴볼 계획이다. 점검",2025-03-04 17:10,https://www.etoday.co.kr/news/view/2449711?trc=main_list_news,이투데이
"TSMC, 트럼프 관세폭탄 위협에 “146조원 더 쓰겠다”...보조금 향방 ‘관심",https://img.etoday.co.kr/crop/200/125/2143098.jpg,"TSMC, 4년간 대미 투자 1000억 달러 늘리기로 인텔 구하기 참여 압박도 받는 것으로 알려져 보류된 보조급 지급은 여전히 불투명 “경제·기술 안보 측면서 한국·대만 등 불리” 도널드 트럼프 미국 대통령이 반도체에 대한 관세 부과를 예고하자 세계 최대 파운드리(반도체 위탁생산) 업체 대만 TSMC가 1000억 달러(약 146조 원) 규모의 대미 투자 계획을 발표했다. 3일(현지시간) 블룸버그통신에 따르면 이날 오후 트럼프 대통령은 백악관에서 웨이저자 TSMC 회장 겸 최고경영자(CEO)와 하워드 러트닉 미국 상무장관이 배석한",2025-03-04 17:02,https://www.etoday.co.kr/news/view/2449705?trc=main_list_news,이투데이
"다문화TV, 방통위 '공익채널' 선정",https://img.etoday.co.kr/crop/200/125/2143073.jpg,"다문화TV가 방송통신위원회에서 지정하는 2025~2026년도 공익채널로 선정됐다고 4일 밝혔다. 방송통신위원회는 지난달 제4차 전체회의에서 9개의 공익채널과 1개의 장애인복지채널을 발표했다. 방통위는 다문화 사회로 빠르게 변화하는 한국 사회에서 다양한 문화적 가치를 존중하고 포용하는 미디어를 강화하기 위해 공익채널을 선정한다. 다문화TV는 다문화 가정과 외국인 주민 대상 프로그램을 편성해 한국 사회의 다양성을 증진하는 데 기여하고 있다. 방통위 선정 공익채널은 공공성과 공익성을 갖춘 방송 콘텐츠를 제공하며, 다양한 사회적 가치를",2025-03-04 17:02,https://www.etoday.co.kr/news/view/2449685?trc=main_list_news,이투데이
"트럼프, 캐·멕·중 관세 강행...캐나다·중국, 맞불 관세 발표",https://img.etoday.co.kr/crop/200/125/2143091.jpg,"4월 2일 농산물 관세 부과도 예고 나스닥 2%대 급락ㆍ비트코인 등 가상자산 폭락세 캐나다, 30조 원 규모 미국산에 25% 보복 관세 중국, 10일부터 농축산물 등에 10~15% 관세 한국 가전·배터리 업계 악영향 우려 도널드 트럼프 미국 대통령이 끝내 캐나다와 멕시코, 중국에 대한 관세 부과를 강행했다. 3일(현지시간) CNBC방송에 따르면 트럼프 대통령은 백악관에서 “모두 준비됐다. 내일(4일) 발효된다”며 “협상할 여지가 더는 없다”고 밝혔다. 트럼프 대통령은 지난달 멕시코와 캐나다 수입품에 관세 25%를 부과하는 행정명령",2025-03-04 16:57,https://www.etoday.co.kr/news/view/2449702?trc=main_list_news,이투데이
스카이라이프TV→'KT ENA'로 사명 변경,https://img.etoday.co.kr/crop/200/125/2143076.jpg,"스카이라이프티브이는 KT ENA로 사명 변경을 마쳤다고 4일 밝혔다. 대표 채널 ENA의 브랜드 인지도 제고 및 KT그룹 브랜드 통일성을 기반으로 그룹사로서의 결속력을 강화하기 위함이다. 김호상 KT ENA 대표는 ""ENA가 시청자에게 더 익숙한 만큼 우리의 핵심 가치를 분명하게 사명에 담아 급변하는 방송 시장 환경 속에서 도약을 이루고, 콘텐츠 미디어 기업으로 지속적인 성장을 이뤄낼 것""이라고 말했다.",2025-03-04 16:36,https://www.etoday.co.kr/news/view/2449689?trc=main_list_news,이투데이
사회·경제적 부담 커지는 ‘비만’…“치료 필요한 질환”,https://img.etoday.co.kr/crop/200/125/2143027.jpg,"비만학회 “비만병 대응위해 국가 차원 치료 환경·인식 개선 절실” “기존 BMI 아닌 ‘임상적 비만병’ 활용 정책 마련해야” 사회·경제적 비용 부담이 큰 비만병에 대한 치료 환경 개선을 위해 국가 차원의 정책 수립이 절실하다는 의견이 제시됐다. 또 우리 국민 10명 중 약 8명꼴로 다이어트 경험이 있지만, 병원 진료를 통해 체중 관리를 시도한 사람은 10명 중 1명 정도로 비만이 개인의 문제가 아닌 사회적·의료적 접근이 필요한 질환이란 인식 개선이 필요한 것으로 나타났다. 대한비만학회는 4일 서울 중구 포스트타워 대회의실에서 ‘2",2025-03-04 16:18,https://www.etoday.co.kr/news/view/2449652?trc=main_list_news,이투데이
"수면 부족의 나라 한국, OECD 평균보다 18% 덜 잔다",https://img.etoday.co.kr/crop/200/125/2143045.jpg,"한국인의 평균 수면 시간은 6시간 58분으로 경제협력개발기구(OECD) 평균(8시간 27분)보다 18% 부족한 것으로 나타났다. 수면장애로 인한 생산성 감소와 질병 부담이 큰 경제적 손실로 이어지는 만큼, 정부가 나서서 대책을 마련해야 한다는 것이 전문가들의 의견이다. 4일 대한수면연구학회는 2025년 세계 수면의 날 기념 기자 간담회를 열고 이런 통계가 담긴 ‘2024년 한국인의 수면 실태 보고서’를 발표했다. 보고서는 글로벌 수면 인식 설문조사, 2024 가민 커넥트(Garmin Connect) 데이터, 2024 한국 웰니스",2025-03-04 16:04,https://www.etoday.co.kr/news/view/2449664?trc=main_list_news,이투데이
"‘주류 2병 제한 폐지’ 가뭄에 단비지만...면세업계, 매출 효과는 ‘반신반의’",https://img.etoday.co.kr/crop/200/125/2142989.jpg,"국내 면세업계, 매출 증가 등 판촉 효과 기대“가격·용량 기준 여전…실효성 의문” 목소리도 정부가 해외여행객이 면세로 구매할 수 있는 주류 병 수 제한을 폐지하면서 면세업계가 작게나마 숨통을 트게 됐다. 다만 가격과 용량 기준은 현행을 유지한 만큼 실제 매출 증대 효과로 이어지긴 어렵다는 관측이 지배적이다. 개수 제한을 폐지한 만큼 이에 맞춰 가격과 용량 기준도 완화해야 한다는 목소리도 나온다. 4일 면세점 업계에 따르면 기획재정부는 ‘2024년 세제 개편 후속 시행규칙 개정안’을 발표하고 입법예고·부처 협의, 법제처 심사 등을 거",2025-03-04 16:00,https://www.etoday.co.kr/news/view/2449635?trc=main_list_news,이투데이
"과기정통부, 22년 만 신규 'kr 도메인' 도입…5일부터 접수",https://img.etoday.co.kr/crop/200/125/2143047.jpg,"과학기술정보통신부는 신규 도입하는 3단계 kr도메인 ‘ai.kr’, ‘it.kr’, ‘io.kr’, ‘me.kr’의 일반 등록 접수를 5일부터 시작한다고 4일 밝혔다. 이는 22년 만에 kr도메인을 신설하는 것이다.",2025-03-04 15:55,https://www.etoday.co.kr/news/view/2449665?trc=main_list_news,이투데이
"'파업ㆍ직장폐쇄'로 몸살앓는 현대제철, 포항공장 기술직 희망퇴직",https://img.etoday.co.kr/crop/200/125/2143012.jpg,"현대제철이 포항공장 기술직을 대상으로 희망퇴직과 전환배치를 실시한다. 4일 업계에 따르면 현대제철은 이날부터 14일까지 포항공장 기술직 근무자를 대상으로 희망퇴직을 받는다. 현대제철이 희망퇴직을 실시한 건 2022년 2월 이후 3년여 만이다. 지난달에는 현대제철 자회사 현대IMC가 희망퇴직을 받았다. 현대제철 관계자는 ""포항 2공장 정상 가동을 위해 노력했으나 저가 수입 철강재 유입 등 어려운 철강 경기가 지속됨에 따라 기술직 희망퇴직 및 전환배치를 진행하게 됐다""며 ""향후 노사 협의를 거쳐 희망퇴직과 전환배치를 진행하고, 고용",2025-03-04 15:50,https://www.etoday.co.kr/news/view/2449645?trc=main_list_news,이투데이
"스피어엑스 우주망원경, 발사 7일로 미뤄져…4번째 연기",https://img.etoday.co.kr/crop/200/125/2135954.jpg,"우주항공청은 미국 항공우주국(NASA)과 한국천문연구원이 공동 개발한 우주망원경 '스피어엑스'(SPHEREx) 발사가 7일 낮 12시 9분(현지시간 6일 오후 7시 9분)으로 연기됐다고 4일 밝혔다. 총 4번째 연기로, 우주청은 스페이스X 팰컨9 발사체 준비에 추가적인 시간이 소요돼 또다시 연기됐다고 설명했다.",2025-03-04 15:48,https://www.etoday.co.kr/news/view/2449659?trc=main_list_news,이투데이
네이버웹툰 '이현세 만화 창작캠프' 후원 통해 아마추어 작가 발굴 앞장,https://img.etoday.co.kr/crop/200/125/2143038.jpg,"네이버웹툰이 올해도 ‘이현세 만화 창작캠프’를 공식 후원하며 아마추어 웹툰 작가 지원을 지속한다고 4일 밝혔다. 네이버웹툰은 올해로 9회째 창작캠프 후원을 이어가고 있다. 네이버웹툰에서 서비스 중인 ‘킬러 배드로’의 임리나 작가, ‘연의 편지’의 조현아 작가, ‘부동산이 없는 자에게 치명적인’의 유기 작가 등 여러 웹툰 작가들이 창작캠프에 참여했다. 창작캠프에서는 웹툰작가를 꿈꾸는 전국 대학교 재·휴학생과 네이버웹툰 베스트도전 작가 등 총 100여명을 선발하며 참가비는 네이버웹툰이 전액 지원한다. 참가자들은 10박 11일간 창작에",2025-03-04 15:44,https://www.etoday.co.kr/news/view/2449657?trc=main_list_news,이투데이
"고환율·관세전쟁, IT SW 업계에는 오히려 기회",https://img.etoday.co.kr/crop/200/125/2143002.jpg,"IT·SW 업계 ""고환율·관세전쟁 부담은 제한적"" 국내 기업 48% ""IT 투자는 지난해와 비슷하게"" 고환율·관세전쟁의 거센 비바람 속에도, 국내 IT 소프트웨어(SW) 업계는 비교적 그 영향을 덜 받고 있다. 4일 관련 업계에 따르면 국내 IT·SW 업계는 고환율·관세전쟁이 미칠 영향에 촉각을 곤두세우고 있다. 하지만 당장 매출이나 실적에 미치는 영향은 크지 않다는 게 중론이다. 소프트웨어는 물리적 제품이 아니므로 관세 전쟁의 직접적인 영향을 덜 받는다. 미국·동남아 등 최근 해외 시장에 적극 진출 중인 지니언스 관계자는 ""기업",2025-03-04 15:12,https://www.etoday.co.kr/news/view/2449607?trc=main_list_news,이투데이
"제미나이 품은 익시오…LG유플러스, 'AI 유료화' 성공할까",https://img.etoday.co.kr/crop/200/125/2142990.jpg,"통화 맥락 분석·맞춤형 제안 도입 익시오-IoT 연계로 AI 생태계 구축 연내 유료화 추진…'AI 수익화' 방점 AI 서비스 '킬러콘텐츠'가 핵심 LG유플러스가 자사 인공지능(AI) 에이전트 ‘익시오(ixi-O)’에 구글의 ‘제미나이(Gemini)’를 탑재할 계획이다. 이를 통해 이용자 맞춤형 행동 제안 기능을 고도화하고, 멀티모달 거대언어모델(LLM) 서비스를 적용한다는 전략이다. 이에 LG유플러스가 연내 ‘익시오 유료화’를 기반으로 AI 수익을 창출할 수 있을지 관심이 집중된다. 4일 통신 업계에 따르면, LG유플러스는 스페인",2025-03-04 15:11,https://www.etoday.co.kr/news/view/2449628?trc=main_list_news,이투데이
"""갤럭시 개발 주역""…최원준 삼성전자 MX사업부 개발실장, 사장 승진",https://img.etoday.co.kr/crop/200/125/2034642.jpg,갤럭시 스마트폰 개발 주역으로 꼽히는 최원준 삼성전자 모바일경험(MX) 사업부 개발실장 부사장이 사장으로 승진했다. 4일 삼성전자에 따르면 이날 오전 사내 내부망에 이같은 내용을 담은 공지를 게시했다. 최 사장은 MX사업부 개발실장 자리를 그대로 유지한다. 최 신임 사장은 노태문 삼성전자 MX사업부장 사장과 함께 인공지능(AI) 스마트폰 개발에 주력하고 있다. 특히 이번 원포인트 승진은 지난해 갤럭시 S24 시리즈에 이어 올해 플래그십 모델인 갤럭시 S25 시리즈 흥행 공로를 인정받은 데 따른 것으로 알려졌다. 최 신임 사장은 1,2025-03-04 14:52,https://www.etoday.co.kr/news/view/2449629?trc=main_list_news,이투데이
"중기부, 키오스크 등 스마트상점 보급 참여 소상공인 모집",https://img.etoday.co.kr/crop/200/125/2142978.jpg,중소벤처기업부는 7일부터 21일까지 ‘2025년 스마트상점 기술보급사업’ 지원사업에 참여할 상점을 모집한다고 4일 밝혔다. 서비스형 소프트웨어(SaaS) 구독 프로그램을 비롯해 접근성 향상(배리어프리) 키오스크 보급을 희망하는 소상공인을 모집한다. 자세한 내용은 소상공인24 또는 소상공인스마트상점 누리집에서 확인할 수 있다.,2025-03-04 14:38,https://www.etoday.co.kr/news/view/2449618?trc=main_list_news,이투데이
"혼다코리아, 국내 최대 모터사이클 교육 전문기관 ‘혼다 에듀케이션 센터’ 오픈",https://img.etoday.co.kr/crop/200/125/2142972.jpg,"혼다코리아는 국내 수입차 브랜드 최초 및 국내 최대 규모의 모터사이클 안전운전 교육 전문기관인 ‘혼다 에듀케이션 센터’를 5일 공식 오픈하고, 일반 소비자 대상 본격적인 교육 운영을 시작한다고 4일 밝혔다. 이 센터는 경기도 이천시 부발읍 수정리에 있다. 매주 수요일부터 일요일까지 주 5일 운영한다.",2025-03-04 14:25,https://www.etoday.co.kr/news/view/2449612?trc=main_list_news,이투데이
태광산업 유태호·흥국생명 김대현 대표이사 내정,https://img.etoday.co.kr/crop/200/125/2142968.jpg,"태광그룹은 4일 섬유·석유화학 계열사인 태광산업 대표에 유태호 티시스 대표를 내정했다고 밝혔다. 금융 계열사인 흥국생명 대표에는 김대현 전 KB손해보험 경영관리부문장(부사장)을, 흥국생명의 판매자회사인 HK금융파트너스 대표에는 유재준 전 KB라이프생명 부사장을 각각 내정했다. 유태호 대표는 1980년 흥국생명에 입사한 뒤 총무와 자산관리 담당 임원을 거쳤고, 2002년 태광산업으로 자리를 옮겨 부동산 관리와 홍보 담당 임원을 지냈다. 2023년 8월부터 태광그룹의 인프라·레저 계열사인 티시스 대표를 맡았다. 김대현 내정자는 199",2025-03-04 14:11,https://www.etoday.co.kr/news/view/2449604?trc=main_list_news,이투데이
"“가장 사랑받는 항공사로” 조원태, 대한항공 새 기업 가치 ‘KE 웨이’ 선포",https://img.etoday.co.kr/crop/200/125/2142960.jpg,"새로운 기업 가치 체계인 ‘KE Way’를 통해 대한항공이 가장 사랑받는 항공사로 자리매김하길 바란다. 조원태 한진그룹 회장은 4일 서울 강서구 대한항공 본사 대강당에서 개최된 ‘보딩데이’에서 새로운 기업 가치 체계 ‘KE Way’를 선포하고 글로벌 네트워크 캐리어로 도약하겠다는 의지를 표명했다. 조 회장은 창립 기념사에서 “올해 본격적인 통합 항공사 출범 준비를 시작하기에 앞서 새로운 기업 가치 체계를 제시하고자 한다”며 “KE Way는 우리가 모두 하나의 목표를 향해 가는 여정의 구심점이자, 대한항공의 정체성을 규정하는 핵심이",2025-03-04 14:04,https://www.etoday.co.kr/news/view/2449590?trc=main_list_news,이투데이
"에이비엘바이오, 국제학술지에 ‘ABL112’ 논문 게재",https://img.etoday.co.kr/crop/200/125/1979623.jpg,"에이비엘바이오는 이중항체 면역항암제 ‘ABL112’에 대한 논문을 미국면역항암학회가 발행하는 국제 학술지 JITC에 발표했다고 4일 밝혔다. 논문에 따르면 ABL112는 T세포의 활성을 억제하는 TIGIT과 CD155 간의 상호작용을 차단해 CD8+ T 세포를 회복시켰고, 장기적인 치료 효과도 나타났다. PD-(L)1 억제제 병용요법에서도 항암 효능이 확인됐다. 회사 관계자는 “이번 논문을 포함해 다양한 학술지 게재와 학회 발표를 통해 4-1BB 이중항체의 우수성을 알리겠다”고 말했다.",2025-03-04 13:55,https://www.etoday.co.kr/news/view/2449592?trc=main_list_news,이투데이
"휴런, 일본 ‘닥터넷’과 뇌졸중 솔루션 총판 협약",https://img.etoday.co.kr/crop/200/125/2142952.jpg,휴런은 최근 일본 도쿄에서 원격 영상 진단 기업 닥터넷과 총판 협약을 맺었다고 4일 밝혔다. 휴런은 이번 협약을 통해 비조영 컴퓨터단층촬영(CT) 기반 응급 뇌졸중 선별 솔루션 휴런 스트로케어 스위트를 일본 전국 병원 및 의료기관 등에 유통·판매한다. 또한 양사는 올해 내 휴런 스트로케어 스위트가 일본 내 인허가를 획득할 수 있도록 협력할 예정이다. 신동훈 휴런 대표는 “한국뿐 아니라 일본 등 아시아 및 세계 시장에서 인정받고 많은 환자와 의료진에게 도움될 수 있도록 하겠다”고 말했다.,2025-03-04 13:55,https://www.etoday.co.kr/news/view/2449583?trc=main_list_news,이투데이
"국정원 ""SW 공급망 노린 북한발 해킹 확산""",https://img.etoday.co.kr/crop/200/125/2142953.jpg,"IT·SW 공급망 노려 국가기관 및 기업 정보 탈취 국정원 ""北 해커, 공급망 보안 허점 공격 집중"" 국정원은 최근 북한 해킹 조직이 IT·소프트웨어(SW) 공급망을 노려 국가기관 및 기업의 핵심 기술을 탈취하고 있는 사실 포착하고 이에 주의를 당부했다. 4일 국정원에 따르면 북한 해킹 조직은 △IT용역업체 해킹을 통한 기관·기업 우회 침투 △IT솔루션·S/W 취약점을 악용한 침투 △보안관리 허점을 노린 해킹 등 3가지 공격유형을 활용해 자료 탈취에 주력하고 있다. 실제로 북한 해킹조직은 지난해 10월 지자체 전산망 유지관리 업체",2025-03-04 13:38,https://www.etoday.co.kr/news/view/2449586?trc=main_list_news,이투데이
