title,thumbnail,short_content,write_time,link,company
"온코닉테라퓨틱스, AACR 2026서 ‘네수파립’ 데이터 공개",https://img.etoday.co.kr/crop/200/125/2322030.jpg,"온코닉테라퓨틱스는 이달 17일부터 22일까지 미국 샌디에이고에서 열리는 미국암학회(AACR 2026)에 참가해 네수파립의 소세포폐암 및 췌장암 관련 연구결과를 포스터 발표한다고 15일 밝혔다. 네수파립은 PARP와 탄키라제(Tankyrase)를 동시에 억제하는 이중 기전의 합성치사 항암제로, 현재 췌장암을 비롯해 자궁내막암, 난소암, 위암 등 4개 암종에서 임상 2상 개발이 진행되고 있다. 공개된 초록에 따르면 소세포폐암 세포실험에서 네수파립은 기존 PARP 저해제 올라파립 대비 최대 133배, 이리노테칸 대비 약 25배 높은 암",2026-04-15 14:12,https://www.etoday.co.kr/news/view/2575995?trc=main_list_news,이투데이
"정부, 미토스 충격에 통신사·네카오에 이어 정보보호기업 긴급 소집",https://img.etoday.co.kr/crop/200/125/2278851.jpg,"과학기술정보통신부는 최근 엔스로픽 및 오픈AI가 자사의 최신 인공지능(AI) 모델을 사이버 보안에 활용하는 프로젝트를 출범한 것과 관련해 정보보호 기업 등과 긴급 현안 공유 회의 등을 개최했다고 밝혔다. 15일 과기정통부는 국내 주요 정보보호 기업과 간담회를 열고 글로벌 AI 기업의 사이버 보안 프로젝트와 관련한 국내 정보보호 산업계의 영향과 기회, 우리 산업의 고도화 방안 등을 논의했다. 전날(14일) 통신 3사 및 네이버, 카카오, 우아한형제들, 쿠팡 등 주요 플랫폼사의 정보보호 최고 책임자 및 국내 AI 보안 전문가와 릴레이",2026-04-15 14:06,https://www.etoday.co.kr/news/view/2575991?trc=main_list_news,이투데이
"압타머사이언스, MSD와 임상시험 협력ㆍ의약품 공급 계약 체결",https://img.etoday.co.kr/crop/200/125/2322020.jpg,"압타머사이언스는 항암 후보물질 AST-201과 MSD의 항-PD-1 치료제 키트루다(성분명 펨브롤리주맙)의 병용요법을 평가하기 위해 MSD와 임상시험 협력 및 의약품 공급 계약을 체결했다고 15일 밝혔다. 이번 계약으로 압타머사이언스는 AST-201과 키트루다의 병용 투여 가능성을 평가하기 위한 임상 2상 시험을 진행하고, MSD는 임상시험에 사용될 키트루다를 공급하며 임상시험 수행 과정에서 과학적 협력을 제공한다. AST-201은 GPC3(Glypican-3) 표적 압타머-약물접합체(ApDC®) 기반 항암 신약 후보물질로, 간세",2026-04-15 14:05,https://www.etoday.co.kr/news/view/2575989?trc=main_list_news,이투데이
호세 무뇨스 현대차 사장 “전동화 일변도 아니다…하이브리드·수소까지 병행 전략”,https://img.etoday.co.kr/crop/200/125/2322010.jpg,세마포 콘퍼런스서 현대차 전략 직접 설명“자율주행은 현재…로봇은 생산성·품질 개선 수단” 호세 무뇨스 현대자동차 사장이 전동화 일변도 전략에서 벗어난 ‘멀티 파워트레인’ 전략과 수소·자율주행·로보틱스를 아우르는 미래 모빌리티 비전을 제시했다. 무뇨스 사장은 14일(현지시간) 미국에서 열린 ‘세마포 월드 이코노미(Semafor World Economy)’ 미래 모빌리티 트랙 세션에 연사로 참석해 글로벌 모빌리티 산업 변화와 에너지 전환 대응 전략을 설명했다. 이번 행사는 글로벌 디지털 미디어 세마포가 주최한 경제 콘퍼런스로 포춘 선정,2026-04-15 13:46,https://www.etoday.co.kr/news/view/2575977?trc=main_list_news,이투데이
"HD건설기계, 차세대 신모델 국내 시장서 60여대 판매…출시 3개월만",https://img.etoday.co.kr/crop/200/125/2322004.jpg,"HD건설기계는 올해 1월 출시된 현대(HYUNDAI) 32t(톤)급 차세대 신모델 굴착기(HX320)가 출시 3개월 만에 국내 시장에서 60여대 판매됐다고 15일 밝혔다. 이는 같은 기간 판매된 이전 모델 대비 50% 이상 높은 판매량으로, 고유가 상황 속에서 연비와 스마트 기술 등 성능을 두루 갖춘 차세대 신모델에 대한 고객 수요가 높아졌다는 분석이다. HX320은 독자 개발한 ‘DX08 엔진’을 탑재하고 ‘전자식 유압시스템(FEH)’을 적용했다. 정격 출력을 높이면서도 엔진 회전수는 대폭 낮춰 연비 효율(리터당 작업량)을 25",2026-04-15 13:33,https://www.etoday.co.kr/news/view/2575973?trc=main_list_news,이투데이
"“특허절벽 끄떡없어”…빅파마, 신약으로 매출 공백 메운다",https://img.etoday.co.kr/crop/200/125/2321997.jpg,글로벌 빅파마들이 블록버스터 의약품 특허 만료에도 불구하고 신약 포트폴리오를 앞세워 견조한 성장세를 이어가고 있다. 과거 ‘특허절벽(Patent cliff)’으로 불리던 매출 공백이 다양한 포트폴리오 확대를 통해 상당 부분 상쇄되면서 사업 구조가 변화하고 있다는 분석이다. 15일 제약바이오업계에 따르면 존슨앤드존슨(J&J)은 14일(현지시간) 올해 1분기 매출 240억6200만달러(약 35조4000억원)를 기록해 전년 동기(약 218억9300만달러) 대비 9.9% 증가했다고 밝혔다. 사업부문별로는 혁신의약품(Innovative M,2026-04-15 13:33,https://www.etoday.co.kr/news/view/2575968?trc=main_list_news,이투데이
‘삑’ 소리로 이상 징후 잡아낸다…웨어러블 AI가 지키는 병동 [가보니],https://img.etoday.co.kr/crop/200/125/2321943.jpg,고요하던 간호사 병동에 ‘삑’ 하는 경보음이 울린다. 이상 징후를 보인 환자가 발생했다는 신호다. 의료진은 즉시 해당 병실로 향해 환자 상태를 확인하고 자칫 놓칠 수 있었던 변화를 조기에 포착하며 응급 상황으로 번지는 것을 막는다. 환자의 생체 신호를 실시간으로 감지하고 대응하는 스마트병동의 일상이다. 15일 오전 찾은 경기도 화성시 동탄시티병원. 이곳은 인공지능(AI) 기반 환자 모니터링 시스템 ‘씽크(thynC)’를 도입해 병동 운영 방식을 전환했다. 씨어스가 개발한 씽크는 웨어러블 바이오 센서와 AI 분석 기술을 기반으로 심,2026-04-15 12:30,https://www.etoday.co.kr/news/view/2575954?trc=main_list_news,이투데이
"여야, 신현송 청문회 공방…“이론·실무 갖춰” vs “검은머리 외국인”",https://img.etoday.co.kr/crop/200/125/2322135.jpg,與 “국제 금융전문가…물가 안정 소신으로 정책 균형” 野 “금융자산 대부분 외화…국적 상실 미신고 말안돼” 여야는 15일 신현송 한국은행 총재 후보자 인사청문회에서 전문성과 도덕성을 놓고 이견을 나타냈다. 더불어민주당은 신 후보자가 이론과 실무를 갖춘 국제 금융 전문가라고 평가했다. 국민의힘은 신 후보자 가족 국적과 외화 자산 등 신상 문제를 집중적으로 거론했다. 정일영 민주당 의원은 이날 국회에서 열린 신 후보자에 대한 재정경제기획위원회 인사청문회에서 “후보자는 국제적 전문성이 충분히 있다고 본다”며 “거시경제 지표로만 대한민국,2026-04-15 16:45,https://www.etoday.co.kr/news/view/2576084?trc=main_list_news,이투데이
"[속보] 강훈식 ""호르무즈 外 석유저장시설 구축 논의하기로""",https://img.etoday.co.kr/crop/200/125/2322021.jpg,"강훈식 ""호르무즈 外 석유저장시설 구축 논의하기로""",2026-04-15 14:35,https://www.etoday.co.kr/news/view/2576004?trc=main_list_news,이투데이
"[속보] 강훈식 ""나프타, 연말까지 최대 210만t 추가 확보""",https://img.etoday.co.kr/crop/200/125/2322021.jpg,"강훈식 ""나프타, 연말까지 최대 210만t 추가 확보""",2026-04-15 14:05,https://www.etoday.co.kr/news/view/2575992?trc=main_list_news,이투데이
"[속보] 강훈식 ""올해 말까지 원유 2억7300만배럴 도입 확정""",https://img.etoday.co.kr/crop/200/125/2322021.jpg,"강훈식 ""올해 말까지 원유 2억7300만배럴 도입 확정""",2026-04-15 14:05,https://www.etoday.co.kr/news/view/2575990?trc=main_list_news,이투데이
"정청래, 부산서 전재수에 파란 점퍼 입히며 ""부산 중흥 이끌 진짜 사나이”",https://img.etoday.co.kr/crop/200/125/2322008.jpg,"현장 최고위 열고 전재수 지원사격…""6·3 승리 진원지” 부전시장·기장 민생행보 이어가며 부산 밀착 총력 3선 도전 박형준과 양강 구도…50일 격전 본격 시동 정청래 더불어민주당 대표가 부산에서 전재수 부산시장 후보에게 직접 '파란 점퍼'를 입혔다. 아울러 ""부산 중흥 시대를 이끌 진짜 부산 사나이""라는 수식어를 붙이며 부산 공략을 위한 지원 사격에 나섰다. 정 대표는 15일 오전 부산 동구 부산항국제전시컨벤션센터에서 진행된 현장 최고위원회의에서 전 후보에 점퍼를 전달하며 ""부산 중흥 시대를 이끌 부산 갈매기도 좋아하는 진짜 부산",2026-04-15 13:39,https://www.etoday.co.kr/news/view/2575974?trc=main_list_news,이투데이
국민의힘-경제계 노동현안 간담회 [포토],https://img.etoday.co.kr/crop/200/125/2321928.jpg,"송언석 국민의힘 원내대표가 15일 서울 여의도 국회에서 열린 경제계 노동현안 간담회에서 참석자들과 기념촬영을 하고 있다. 왼쪽부터 박충권 원내수석대변인, 정점식 정책위의장, 정대진 한국자동차모빌리티산업협회장, 송 원내대표, 이동근 한국경영자총협회 상근부회장, 오기웅 중소기업중앙회 상근부회장, 오충종 조선해양플랜트협회 부회장. 고이란 기자 photoeran@",2026-04-15 11:55,https://www.etoday.co.kr/news/view/2575952?trc=main_list_news,이투데이
"조국, 평택을 출마 승부수…與 연대 변수 속 민주당 셈법 촉각",https://img.etoday.co.kr/crop/200/125/2321926.jpg,"평택 택한 조국…“국힘 제로·험지 도전” 명분 강조 민주당, 김용 카드 검토 속 독자 공천 기조 진보 3분열 속 다자구도 불가피…막판 단일화 여부 최대 변수 조국 조국혁신당 대표가 6·3 지방선거와 함께 치러지는 국회의원 재·보궐선거에서 경기 평택을 출마를 공식화하면서 범여권 내 셈법이 복잡해지고 있다. 더불어민주당이 전 지역 공천 방침을 유지하는 가운데 다자 구도 속 경쟁과 단일화 변수까지 맞물리며 선거 구도가 출렁이는 양상이다. 조 대표는 15일 유튜브 ‘김어준의 겸손은힘들다 뉴스공장’에 출연해 평택을 선택 배경을 설명하며 이",2026-04-15 11:48,https://www.etoday.co.kr/news/view/2575950?trc=main_list_news,이투데이
"정원오 “오세훈, 시정 철학 잘못돼…한강버스로 정신승리”",https://img.etoday.co.kr/crop/200/125/2321922.jpg,"정원오 더불어민주당 서울시장 후보는 15일 국민의힘 소속 오세훈 서울시장을 겨냥해 “시정 철학부터 잘못됐다”고 비판했다. 정 후보는 이날 ‘김어준의 겸손은힘들다 뉴스공장’에 출연해 “시 행정 주인은 시민인데 어느 순간 오 시장으로 바뀌었다”며 이같이 밝혔다. 그는 “지금은 시장이 하고 싶은 일을 하는데 목표는 대권에 가 있다”며 “이명박 전 시장의 청계천 같은 걸 해야 한다는 생각에 랜드마크와 거대한 업적만 하는 것”이라고 주장했다. 이어 서울링, 노들섬 ‘토마스 헤더윅’ 건축물, 받들어총 조형물 등을 거론하며 “시민들은 불필요하",2026-04-15 11:35,https://www.etoday.co.kr/news/view/2575946?trc=main_list_news,이투데이
"李대통령, 규제합리화委 첫 회의서 ""첨단산업 네거티브 규제로 전환 ⋯대규모 규제 특구 조성도""",https://img.etoday.co.kr/crop/200/125/2321902.jpg,"이재명 대통령은 15일 ""첨단 기술·첨단 산업 분야에 있어서는 네거티브 규제로 전환하는 게 필요하다""고 밝혔다. 이 대통령은 이날 청와대에서 규제합리화위원회 제1차 전체회의를 주재하고 ""우리가 할 수 있는 방안 중에는 비효율적인 규제를 정리하고, 이를 국제 표준에 맞춰 가는 것이 필요하다""며 이같이 말했다. 규제개혁위원회가 규제합리화위원회로 개편된 이후 28년 만에 처음 열리는 전체회의다. 이 대통령은 ""보통 규제 얘기를 하면 규제 철폐 또는 규제 개혁 규제 강화 이렇게 좀 양분하는 경향이 있다""면서도 ""국민의 생명과 안전을 위한",2026-04-15 10:58,https://www.etoday.co.kr/news/view/2575930?trc=main_list_news,이투데이
국힘 “고용 한파 재난 수준“…경영계 “노란봉투법 전면 재검토해야”,https://img.etoday.co.kr/crop/200/125/2321884.jpg,경제단체 “노사분쟁·불확실성 확대” 중소·조선·자동차 업계 부담 호소 국민의힘은 15일 경제계 노동현안 간담회를 열고 최근 고용지표 악화와 노란봉투법 시행에 따른 산업현장 혼란을 지적하며 노동정책 전면 재검토를 촉구했다. 송언석 원내대표는 이날 국회에서 열린 '국민의힘·경제계 노동현안 간담회' 자리에서 “지난달 청년 실업률이 6.8%로 2022년 9월이후 3년 5개월만에 가장 높은 수준이다. 청년 고용률도 43.9%로 최저수준이다”며 “청년들이 체감하는 고용한파 이미 재난수준에 다달았다”고 말했다. 이어 “노란봉투법이 시행된지 한,2026-04-15 10:43,https://www.etoday.co.kr/news/view/2575915?trc=main_list_news,이투데이
