title,thumbnail,short_content,write_time,link,company
공무원연금공단 ‘2024년 책임투자 활동 보고서’ 발간,https://img.etoday.co.kr/crop/200/125/2142826.jpg,"공무원연금공단은 국내 기업가치 제고를 위한 수탁자 책임 활동 내용을 반영한 ‘2024년 책임투자 활동 보고서’를 지난달 28일 발간했다고 4일 밝혔다. 공무원연금공단은 2007년 국내주식 사회책임형 펀드 운용을 시작으로 2020년에는 스튜어드십 코드를 도입했다. 지난해에는 국내 밸류업·배당형 투자를 확대하는 등 기금의 장기 수익성·안정성 제고를 위한 책임투자 활동을 전개해 오고 있다. 2023년 국내주식에 대한 ESG 평가를 전면 실시한 이후, 지난해에는 국내 상장기업의 채권, 해외 주식 직접투자 부분에 대한 ESG 평가 체계를",2025-03-04 10:39,https://www.etoday.co.kr/news/view/2449517?trc=main_list_news,이투데이
"공간정보 업체 이지스, 2025년 디지털 트윈 플랫폼 서비스 위한 ‘원 이지스’ 선포",https://img.etoday.co.kr/crop/200/125/2143082.jpg,이지스가 공간정보 플랫폼 서비스 기업 위한 경영혁신 전략을 공표했다고 4일 밝혔다. 이지스는 지난달 27~28일 전사 워크숍을 진행했다. 이지스는 전사 워크숍을 위해 전남 해남 바다와 신안군의 섬들로 둘러싸인 4성급 호텔리조트인 해남126에서 장기 근속자 시상식과 체육 행사도 진행했다. 해남126 오시아노 호텔은 디지털 트윈 기술을 활용한 OTA(Online Travel Agency) 시장 진입을 위한 테스트베드로 지난해 10월부터 이지스가 정식 운영하고 있다. 회사는 국내 기업 가운데 유일하게 고객의 생산 및 활용 데이터를 별도,2025-03-04 16:41,https://www.etoday.co.kr/news/view/2449692?trc=main_list_news,이투데이
"SH공사, 신축약정 매입임대주택 2917가구 산다",https://img.etoday.co.kr/crop/200/125/2143039.jpg,"서울주택도시공사(SH공사)가 올해 신축 약정 방식의 매입임대주택 2917가구를 매입한다고 4일 밝혔다. 올해 목표는 5350가구였으나 지난해 매입한 이월 물량 1206가구와 사전 매입공고 물량 1000가구를 제외한 나머지를 매입 추진한다. 매입 유형은 신혼·신생아Ⅰ, 신혼·신생아Ⅱ(미리내집), 일반, 청년, 임대형 기숙사 등 총 5가지다. 미리내집 연계형이 1707가구로 가장 많고 나머지는 각각 200~370가구다. SH공사는 올해부터 매입주택 공급 활성화와 매도자 자금 지원 강화를 위한 인센티브를 도입한다. 매입 공고부터 약정",2025-03-04 15:49,https://www.etoday.co.kr/news/view/2449660?trc=main_list_news,이투데이
래미안vs자이 '리턴매치' 무산…잠실 우성 시공사 입찰 GS건설만 참여,https://img.etoday.co.kr/crop/200/125/2143021.jpg,삼성물산이 서울 송파구 재건축 대어인 '잠실 우성' 재건축 시공사 입찰에서 발을 빼면서 래미안과 자이의 맞대결이 무산됐다. 4일 정비업계에 따르면 이날 오후 2시 마감한 잠실 우성 1·2·3차 재건축사업 시공사 입찰은 GS건설만 참여했다. GS건설과 함께 후보로 거론되던 삼성물산은 응찰하지 않았다. 지난해 9월 입찰에도 GS건설이 단독 응찰했다. 조합은 조만간 한 차례 더 시공사 입찰을 할 것으로 보인다. 정비사업은 두 차례 경쟁 입찰이 성립되지 않으면 수의계약을 할 수 있으나 두 번의 입찰 사이에 조건이 변경돼 이번이 1차 입찰,2025-03-04 15:30,https://www.etoday.co.kr/news/view/2449647?trc=main_list_news,이투데이
"""집값 오를까?""…금리가 부동산 시장에 미치는 3가지 [왁자집껄]",https://img.etoday.co.kr/crop/200/125/2140857.jpg,"집과 공간에 대한 이야기를 유쾌하고 깊이 있게 다뤄보자는 취지로 마련한 코너입니다. '왁자집껄'에서는 스타의 집, 부동산 트렌드, 시장 동향, 재미있는 일화 등 실용적이고 유익한 팁까지 집과 관련된 소식을 나누고자 합니다. 왁자지껄하게! 한국은행이 드디어 금리를 내렸습니다. 지난달 25일, 2년 4개월 만에 기준금리를 3%에서 2.75%로 0.25%포인트 인하하며 다시 2%대 금리 시대가 열었는데요. 금리는 부동산 시장과 밀접한 관계가 있는 만큼 시장에서도 촉각을 곤두세우고 있습니다. 금리가 오르면 대출이자 부담이 커지면서 거래가",2025-03-04 15:09,https://www.etoday.co.kr/news/view/2449613?trc=main_list_news,이투데이
"주건협, 정비사업 등 회원사 주택사업 실무교육",https://img.etoday.co.kr/crop/200/125/2142984.jpg,"대한주택건설협회는 11일 오전 10시부터 서울 관악구 남현동 서울교통문화교육원에서 '2025년도 상반기 회원사 주택사업 실무교육'을 실시한다고 4일 밝혔다. 이번 교육에서는 △정비사업의 사업구조 및 자금조달의 이해 △주택건설사업자를 위한 세무회계와 세무리스크 확인 △부동산정책과 시장분석 등에 관해 강의한다. 정원주 주건협 회장은 ""원자재가격·인건비 상승과 지속적인 대출규제, 분양시장 침체 등으로 어려움을 겪는 회원사들이 어려움을 효율적으로 타개할 수 있도록 다양한 지원을 하고 있다""며 ""정비사업 등 관심이 높은 분야에 대한 실무대",2025-03-04 14:42,https://www.etoday.co.kr/news/view/2449621?trc=main_list_news,이투데이
"한승구 건설협회장, 취임 1주년 맞아 “건설산업 활성화 총력 대처”",https://img.etoday.co.kr/crop/200/125/2123453.jpg,"한승구 대한건설협회장은 “침체된 건설 경기의 위기 극복, 적정공사비 확보, 건설산업 이미지 개선 등 건설산업 활성화에 총력 대처하겠다”고 4일 밝혔다. 이날 건설협회에 따르면 이날 기준으로 취임 1주년을 맞은 한 회장은 지난해 중동 불안 등에 따른 글로벌 경기 침체와 국내 공사비용 상승 등 건설업계 어려움에도 업계 어려움을 해소하기 위해 노력했다. 올해 한 회장은 “건설기업 금융 유동성 해소를 위해 자금 공급 지원확대를 통한 PF 사업 정상화에 주력할 것”이라고 강조했다. 재건축･재개발 규제 완화 및 신도시 개발을 통한 주택공급시",2025-03-04 13:36,https://www.etoday.co.kr/news/view/2449585?trc=main_list_news,이투데이
오류동 4번지 일대 신통기획 확정…1250가구 주거단지 재탄생,https://img.etoday.co.kr/crop/200/125/2142798.jpg,"서울시 구로구 오류동 일대가 저층 노후주거지에서 자연을 누리는 숲속 주거단지로 탈바꿈한다. 4일 서울시는 '오류동 4번지 일대 주택정비형 재개발사업'의 신속통합기획을 확정했다고 밝혔다. 매봉산 자락에 있는 오류동 4번지 일대는 온수근린공원과도 인접해 정온하고 자연경관이 뛰어나다. 하지만 저밀 용도지역, 급경사 등 제약으로 개발에서 소외되며 노후화했다. 이번 신속통합기획 확정으로 이 지역 일대는 25층 내외 약 1250가구 규모의 주거단지가 들어선다. 기획안은 매봉산과 온수근린공원의 아름다운 자연환경을 누릴 수 있도록 순환형 보행녹",2025-03-04 11:15,https://www.etoday.co.kr/news/view/2449498?trc=main_list_news,이투데이
지역 경쟁력 강화·주거여건 개선할 ‘2025년 지역개발사업’ 공모,https://img.etoday.co.kr/crop/200/125/2142708.jpg,"국토교통부는 지역의 경쟁력 강화와 민간 투자 유도로 성장을 견인하고 지역주민의 정주여건 개선을 위해 2025년도 지역개발사업 공모를 본격 추진한다고 4일 밝혔다. 이 사업은 2015년부터 지역개발사업 공모를 통해 지역별 특색을 고려한 우수 사업을 선정해 맞춤형 지원을 제공하고 있다. 공모는 투자선도지구와 지역 수요맞춤지원 사업 2개 분야로 시행한다. 올해 공모는 5월 접수를 시작으로 사전컨설팅, 현장심사, 최종평가 등을 거쳐 7월 초 최종 대상지가 선정될 예정이다. 지난해 우수사례로는 원주시 ‘남원주 역세권 개발’(투자선도지구),",2025-03-04 11:00,https://www.etoday.co.kr/news/view/2449436?trc=main_list_news,이투데이
건설기계 입고 검사 예약제 10일 시행…“대기시간 축소 예상”,https://img.etoday.co.kr/crop/200/125/2142717.jpg,국토교통부는 건설기계 입고검사시 대기시간을 줄이기 위해 10일부터 전국 18개 건설기계 검사소에서 예약제를 전면 시행한다고 4일 밝혔다. 건설기계 입고 검사 예약은 전화·인터넷으로 검사 일시 및 시간을 미리 예약하는 방식이다. 그동안 우천 및 한파 등 건설현장 휴무일에 건설기계의 검사수요가 집중돼 당일 장시간 대기하거나 검사를 받지 못하는 등 건설기계 운전자로부터 불만족 사례가 발생했다. 또 검사를 기다리는 대형 건설기계 때문에 검사소 주변 불법 주·정차 및 교통혼잡으로 민원도 수차례 발생했다. 이를 개선하기 위해 지난해 7월부터,2025-03-04 11:00,https://www.etoday.co.kr/news/view/2449442?trc=main_list_news,이투데이
허윤홍 GS건설 대표 '인구문제 인식개선' 캠페인 동참,https://img.etoday.co.kr/crop/200/125/2142828.jpg,"GS건설은 허윤홍 대표가 '인구문제 인식개선' 캠페인에 동참한다고 4일 밝혔다. 인구문제 인식개선 릴레이 캠페인은 저출생·고령화 문제에 대한 사회적 인식을 제고하고 인구 문제를 해결하기 위한 관심을 환기하기 위해 보건복지부와 한국보건복지인재원이 공동기획했다. 다양한 기업·공공기관이 릴레이 형식으로 동참하고 있으며 허 대표는 송병준 컴투스 의장의 지목을 받아 참여하게 됐다. GS건설은 지난해 7월 임신부터 출산, 육아 전 주기에 걸쳐 직원들이 일과 가정을 양립할 수 있도록 사내 제도를 개편했다. 난임 시술비와 산후조리원 비용 추가",2025-03-04 10:41,https://www.etoday.co.kr/news/view/2449520?trc=main_list_news,이투데이
"SH공사, 신입사원 공채…25일까지 원서 접수",https://img.etoday.co.kr/crop/200/125/2122936.jpg,"서울주택도시공사(SH공사)는 신입 사원 49명을 공개채용한다고 4일 밝혔다. 모집 인원은 사무직(경영 지원·사업 관리 전산) 16명, 기술직(토목, 건축, 기계, 전기, 조명) 15명, 주거복지직(사무, 기술) 18명이다. 서류·면접 전형은 인적 사항을 철저히 배제한 전면 정보 가림(블라인드) 채용으로 진행된다. SH공사는 직무 관련 경험·능력, 향후 직무 수행 계획을 중심으로 입사 지원서를 평가하고 직무 관련 주제에 대한 발표·토론 면접을 통해 지원자의 직무 접합성을 살펴볼 계획이다. 입사 지원서는 이날부터 이달 25일가지 채용",2025-03-04 10:28,https://www.etoday.co.kr/news/view/2449511?trc=main_list_news,이투데이
미분양 공포에 '2월 분양 예정' 물량 반도 안 나왔다,https://img.etoday.co.kr/crop/200/125/2142740.jpg,지난달 분양을 준비했으나 실제로 청약을 진행하지 않고 미룬 단지가 전체의 60%에 육박했다. 일부를 제외하면 흥행에 성공하지 못하는 상황이 이어지면서 건설사들이 공급을 자제한 것으로 풀이된다. 4일 직방은 지난달 분양예정 물량이 총 1만2676가구였는데 실제 분양은 5385가구만 이뤄져 공급실적률이 42%를 기록했다고 밝혔다. 일반분양은 7821가구가 예정돼 있었으나 3560가구만 분양해 46%의 공급실적률을 보였다. 건설사들이 청약 심리 위축을 우려해 전년보다 공급 예정 물량을 줄였음에도 불구하고 실적률마저 낮에 나타난 것이다.,2025-03-04 09:29,https://www.etoday.co.kr/news/view/2449464?trc=main_list_news,이투데이
전국 상업용 빌딩 1월 거래량 전월 대비 24.4% 줄었다…거래액도 ‘반 토막’,https://img.etoday.co.kr/crop/200/125/2142724.jpg,1월 전국 상업업무용 빌딩 거래량과 거래액이 전월 대비 각각 24.4%와 50.7% 하락한 것으로 조사됐다. 4일 상업용 부동산 전문기업 부동산플래닛은 2025년 1월 전국 상업·업무용 빌딩 거래 시장 분석 결과를 4일 발표했다. 1월 전국에서 발생한 상업업무용 빌딩 거래량은 총 854건으로 지난해 12월(1130건)과 비교해 24.4% 하락했다. 2023년 1월(668건) 다음으로 가장 낮은 거래량이자 2023년 3월부터 유지해오던 1000건 규모의 월 거래량에 못 미쳤다. 거래금액은 전월 3조3431억 원에서 50.7% 하락한,2025-03-04 09:18,https://www.etoday.co.kr/news/view/2449453?trc=main_list_news,이투데이
래미안 원페를라 빼면 0.4대 1…서울 밖 청약시장 찬바람 '쌩쌩',https://img.etoday.co.kr/crop/200/125/2132110.jpg,"아파트 청약시장이 한파를 벗어나지 못하고 있다. 서울을 제외하면 하나같이 처참한 수준의 성적표를 내놓는 모습이다. 지방에 쌓인 미분양 물량과 주택 가격 흐름 등을 고려하면 단기간에 분위기 반전이 일어날 가능성은 크지 않은 것으로 관측된다. 3일 한국부동산원 청약홈에 따르면 지난 달 1·2순위 청약을 진행한 단지(공공분양, 분양전환 후 잔여 가구 제외)는 11곳으로 총 1651가구 모집에 4만1230명이 접수해 평균 24.97대 1의 경쟁률을 기록했다. 전체로 보면 20대 1이 넘으며 흥행한 듯 보이는데 서울 서초구 방배동에 공급되",2025-03-03 16:05,https://www.etoday.co.kr/news/view/2448681?trc=main_list_news,이투데이
"지적측량 용어, 100년 만에 한글로 바꿨다…일본식 용어 31개 변경 행정규칙 고시",https://img.etoday.co.kr/crop/200/125/2142222.jpg,"국토교통부는 일제강점기에 도입된 지적(地籍)분야 일본식 용어 등 어려운 전문용어 31개를 3·1절에 맞춰 쉽고 바른 우리말로 바꿔 행정규칙으로 고시한다고 3일 밝혔다. 31개 용어는 지적·공간정보 전문가, 학계 및 국립국어원 등으로 구성된 국토부 표준화협의회의 심의를 거쳐 선정됐다. 이후 국어기본법에 따라 문체부 국어심의회 최종 의결을 통해 확정했다. 이번에 고시를 앞둔 ‘공유지연명부’는 ‘공동 소유자 명부’로 바뀐다. 공유지연명부는 토지의 소유자가 2명 이상인 경우 소유자와 지분비율 등을 기록하여 관리하는 장부를 뜻하는 말로 일",2025-03-03 11:00,https://www.etoday.co.kr/news/view/2449135?trc=main_list_news,이투데이
맞벌이 부부 소득요건 올리자 신생아대출 1년간 13조 신청,https://img.etoday.co.kr/crop/200/125/2142492.jpg,"신생아 특례대출을 받을 수 있는 소득 기준을 부부합산 연 1억3000만 원에서 2억 원으로 올리자 매월 1조 원씩 대출 신청이 늘어난 것으로 나타났다. 이에 신생아 대출 신청액은 1년간 13조 원, 집행액은 10조 원을 넘어섰다. 3일 국토교통부가 국회 국토교통위원회 소속 더불어민주당 이연희 의원에게 제출한 자료에 따르면 신생아 대출을 출시한 지난해 1월 29일부터 올해 1월 30일까지 1년간 총 13조2458억 원의 대출 신청이 들어왔다. 주택 구입자금 대출(디딤돌) 신청 규모가 10조1818억 원으로 76%를 차지하고, 전세자",2025-03-03 09:54,https://www.etoday.co.kr/news/view/2449291?trc=main_list_news,이투데이
국내 부동산정책 총괄하는 국토부 주택정책과장에 최초 여성 과장 탄생,https://img.etoday.co.kr/crop/200/125/2142489.jpg,"국내 부동산 정책을 총괄하는 국토교통부 핵심 부서인 주택정책과에 최초로 여성 과장이 탄생했다. 국토부는 오는 4일 자로 이유리 서기관을 주택정책과장으로 임명한다고 3일 밝혔다. 주택정책과는 국토부 내에서 중요성이 가장 높은 부서 중 하나로, 주택법 운영과 함께 주택시장 동향 방향은 물론이고 주택시장 관리와 주택 공급, 주거 복지 정책 등을 총괄한다. '1·10 대책' 같은 정부 부동산 대책 수립 때도 주택정책과가 금융·세제 정책까지 조율해 최종 결과물을 내놓게 된다. 중요성이 크다보니 그만큼 격무에 시달리는 것으로도 유명한 부서다",2025-03-03 09:45,https://www.etoday.co.kr/news/view/2449287?trc=main_list_news,이투데이
"SK오션플랜트, “해상풍력특별법 통과 환영”···지속가능 자원 확보 기대",https://img.etoday.co.kr/crop/200/125/2142475.jpg,해상풍력 전문기업 SK오션플랜트가 “‘해상풍력발전 보급 촉진 및 산업 육성에 관한 특별법(해상풍력특별법)’과 ‘국가기간 전력망 확충 특별법(전력망특별법)’이 국회 본회의를 통과한 것을 환영한다”고 3일 밝혔다. 회사 관계자는 “해상풍력발전은 기후위기 대응을 위한 지속가능한 에너지 자원 확보 방안임과 동시에 국내 우수한 공급망 기업들이 동반 성장할 수 있는 매우 중요한 산업”이라며 “대한민국을 대표하는 해상풍력 하부구조물 생산 기업으로서 산업 발전에 이바지할 수 있도록 최선의 노력을 다하겠다”고 덧붙였다. SK오션플랜트는 우수한 기,2025-03-03 09:33,https://www.etoday.co.kr/news/view/2449284?trc=main_list_news,이투데이
"""살기 좋고 가격도 탄탄""…분양 앞둔 대단지는?",https://img.etoday.co.kr/crop/200/125/2141777.jpg,수요자들의 관심이 높은 대단지 아파트가 줄줄이 분양할 예정이다. 통상 대단지는 주변 생활인프라와 단지 내 시설이 잘 갖춰진 데다 거래가 많아 가격이 안정적이란 점에서 선호도가 높다. 2일 분양업계에 따르면 두산건설 컨소시엄(두산건설·GS건설·금호건설)은 경남 창원 진해구 일원 대야구역 재개발정비사업을 통해 공급하는 '창원 메가시티 자이&위브'를 분양한다. 단지는 지하 4층~지상 37층 17개 동 총 2638가구 규모로 조성될 예정이다. 창원 메가시티 자이&위브는 진해구 최초의 2000가구 이상 대단지로 지역 내 최대 규모를 자랑한,2025-03-02 07:00,https://www.etoday.co.kr/news/view/2448775?trc=main_list_news,이투데이
“세종 아파트값 언제까지 하락?”…신고가 대비 반값 아파트 수두룩,https://img.etoday.co.kr/crop/200/125/1907662.jpg,"세종시 아파트값 침체의 골이 깊다. 서울은 토지거래허가제 해제 영향으로 강남지역을 중심으로 강한 반등세를 보이고, 전국 기준으로도 낙폭을 줄이고 있다. 하지만 세종시는 소폭 낙폭이 줄었지만 여전히 전국 기준으로 하락률 상위권을 유지하고 있다. 일각에선 ‘대통령실’과 ‘국회 세종 이전’ 이슈 등 정책 영향에 따라 급등락을 반복 중인 세종 아파트 시장 특성상 얼마든지 상승 반전이 시작될 수 있다는 의견도 나온다. 2일 KB부동산 통계에 따르면 지난달 24일 기준 전국 주간 아파트값 변동률 중 세종시는 –0.13%로 집계됐다. 이는 제",2025-03-02 07:00,https://www.etoday.co.kr/news/view/2448945?trc=main_list_news,이투데이
[분양 캘린더] 3월 첫째 주 ‘e편한세상동대구역센텀스퀘어’ 등 2753가구 분양,https://img.etoday.co.kr/crop/200/125/2142152.jpg,"3월 첫째 주에는 전국에서 2753가구가 분양에 나선다. ◇청약 단지(4곳) 부동산 정보업체 부동산R114에 따르면 3월 첫째 주에는 전국 4개 단지에서 총 2753가구(일반분양 2299가구)가 분양을 시작한다. 대구 동구 'e편한세상동대구역센텀스퀘어'와 충남 천안시 ‘e편한세상성성호수공원’, 울산 남구 ‘문수로센트레빌에듀리체’ 등에서 청약을 진행한다. ◇당첨자 발표(7곳) 당첨자를 가리는 단지는 7곳이다. 부산 연제구 '거제역양우내안애아시아드'와 대구 달서구 '두류센트레빌더파크', 울산 중구 '우정동 한양립스더센트럴'은 5일 당",2025-03-01 07:00,https://www.etoday.co.kr/news/view/2449060?trc=main_list_news,이투데이
"""관망세 풀린다""…아파트 매물 내놓는 집주인 급증",https://img.etoday.co.kr/crop/200/125/2141845.jpg,전국 아파트 매물이 크게 늘고 있다. 서울은 물론이고 대부분 지역에서 이달에만 두 자릿수 증가율을 나타냈다. 연말·연초 주택 매수심리를 위축시켰던 '12·3 계엄 사태'가 어느 정도 수습되고 대출 금리 인하 가능성도 고개를 들면서 매수자들이 움직일 것이란 기대가 형성된 영향으로 풀이된다. 1일 부동산 빅데이터 플랫폼 아실에 따르면 서울의 아파트 매물은 9만3120건(27일 기준)으로 이달 들어 10.4% 증가했다. 지난달 말 8만4284건이었던 서울 아파트 매물은 이달 중순 9만 건이 넘었고 이후 증가세가 계속됐다. 서울 뿐 아니,2025-03-01 07:00,https://www.etoday.co.kr/news/view/2448834?trc=main_list_news,이투데이
"대우건설, 6970억 규모 개포주공5단지 재건축 수주",https://img.etoday.co.kr/crop/200/125/2071878.jpg,"대우건설은 6970억 원 규모 개포주공5단지 재건축 사업을 수주했다고 28일 공시했다. 이 사업은 서울 강남구 개포동 187번지외 1필지에 지하 4층~지상 35층, 14개 동 규모의 아파트 1279가구와 부대복리시설을 신축하는 사업으로 공사비는 6970억 원 규모다. 공사비는 2023년 말 연결 기준 매출액의 5.98%이고, 계약 기간은 실착공일로부터 45개월이다. 대우건설은 사업장 번지수인 개포동 187의 의미를 살려 단지명을 '개포 써밋 187'로 제안했다. 외관 디자인·구조 안정성·조경 디자인·커뮤니티·단위 세대·홈데코 디자",2025-02-28 17:31,https://www.etoday.co.kr/news/view/2449164?trc=main_list_news,이투데이
"HDC현대산업개발, 서울 성동구 지역주민과 베이킹 봉사활동",https://img.etoday.co.kr/crop/200/125/2142159.jpg,HDC현대산업개발은 지역 주민과 함께하는 현장 릴레이 첫 봉사활동을 성동구에서 시작했다고 28일 밝혔다. 이날 HDC현대산업개발 서울숲 아이파크 리버포레 2차 현장 직원과 지파운데이션의 어린이를 포함한 20여 명은 서울 성동구 라온지역아동센터 인근 베이킹센터에서 주변 이웃에게 나눠줄 빵과 아이들의 소망을 담은 레터링이 담긴 케이크 등을 만들었다. HDC현대산업개발 관계자는 “지역 주민과 함께하는 현장 릴레이 봉사활동을 서울숲아이파크리버포레 현장이 위치한 성동구의 라온지역아동센터 아이들과 함께 시작하게 되어 더욱 뜻깊다”며 “오늘을,2025-02-28 14:31,https://www.etoday.co.kr/news/view/2449068?trc=main_list_news,이투데이
"LH 스마트홈 플랫폼 '홈즈', LG전자 가전 플랫폼 '씽큐' 연동된다",https://img.etoday.co.kr/crop/200/125/2142142.jpg,"LH는 임대주택 스마트홈 플랫폼인 ‘홈즈(Homez)’와 LG전자의 가전제품 플랫폼 ‘씽큐(ThinQ)’가 연동된다고 28일 밝혔다. 두 플랫폼이 연동되면 LH 임대주택 내 LG전자의 에어컨, 세탁기, 건조기, 로봇청소기 등 다양한 가전제품을 ‘홈즈(Homez)’로 관리할 수 있게 된다. LH 임대주택 스마트홈 플랫폼인 ‘홈즈’는 임대주택 내 조명, 난방, 환기 등 다양한 주거환경을 입주민이 원격으로 편리하게 제어할 수 있는 앱이다. 2023년 과천지식정보타운 S-10 블록(605가구) 시범사업을 시작으로 지난해에는 총 12개 단",2025-02-28 13:53,https://www.etoday.co.kr/news/view/2449048?trc=main_list_news,이투데이
"현대엔지니어링, ""역량 총동원 해 수습 만전""…전문가 “공사 기간 촉박 영향 유력”",https://img.etoday.co.kr/crop/200/125/2142077.jpg,현대엔지니어링이 10명의 사상자를 낸 경기 안성시 서울세종고속도로 건설현장 교량 붕괴 사고(고속도로 붕괴 사고)와 관련해 입을 닫았다. 사고 원인을 묻는 말에는 “조사 중”이라는 말만 되풀이했다. 당국은 이를 위한 수사 진행을 위해 압수수색에 착수했다. 28일 현대엔지니어링은 서울 종로구 현대빌딩 별관에서 고속도로 붕괴 사고 미디어 브리핑을 개최했다. 주우종 현대엔지니어링 대표는 이날 모두 발언에서 “결코 일어나서는 안 될 사고가 발생했다”며 “삼가 고인의 명복을 빌며 유가족에게 머리 숙여 사죄 드린다”고 말했다. 주 대표는 이어,2025-02-28 11:26,https://www.etoday.co.kr/news/view/2449014?trc=main_list_news,이투데이
