title,thumbnail,short_content,write_time,link,company
"IPARK현대산업개발, 탄소 절감 위한 텀블러 나눔 캠페인",https://img.etoday.co.kr/crop/200/125/2355910.jpg,"일회용품 줄이기 실천 독려 임직원 참여 ESG 활동 IPARK현대산업개발이 서울숲 국제정원박람회 아이파크 정원에서 탄소 절감 텀블러 캠페인을 진행했다고 7일 밝혔다. 이번 캠페인은 서울숲 국제정원박람회를 찾은 시민들의 일회용품 사용을 줄이고 탄소중립 실천 문화를 확산하기 위해 마련됐다. 행사에는 IPARK현대산업개발과 HDC랩스, IPARK호텔, IPARK신라면세점 임직원 등 총 30명이 참여했다. 봉사활동 참가자들은 서울숲을 찾은 시민들에게 투썸플레이스와 협업해 제작한 텀블러를 전달하고 텀블러 사용 필요성과 탄소 절감 효과를 알",2026-07-07 10:42,https://www.etoday.co.kr/news/view/2600970?trc=main_list_news,이투데이
"[포토] 워커힐, 스포츠·문화 결합 ‘2026 서머 키즈 캠프’",https://img.etoday.co.kr/crop/200/125/2356811.jpg,워커힐호텔앤리조트는 여름방학을 맞아 스포츠·문화·미식을 결합한 2박3일 일정의 ‘서머 키즈 캠프’를 선보인다고 8일 밝혔다. 어린이들이 레저 전문가와 함께 △테니스 레슨 △생존 수영 △빛의 시어터 전시 관람 △쿠킹 클래스에 참여하는 동안 부모들은 클럽라운지에서 해피아워를 즐기며 휴식할 수 있도록 동선을 분리한 것이 특징이다. 야외수영장 야간 입장과 풀사이드 뷔페 혜택도 포함된다.,2026-07-08 18:19,https://www.etoday.co.kr/news/view/2601704?trc=main_list_news,이투데이
"홈플러스 ""5월까지 체불임금 모두 지급, 6월분 332억원만 남아""",https://img.etoday.co.kr/crop/200/125/2355681.jpg,"홈플러스가 자금난에 체불됐던 5월까지의 임금을 모두 지급했다고 8일 밝혔다. 홈플러스는 이날 입장문을 통해 ""자금 상황으로 인해 2025년 12월 이후 매월 급여가 지연 지급되면서 6월까지 지연 지급된 급여의 누적 총액은 1410억원""이라며 ""5월까지의 급여는 모두 지급 완료된 상황으로, 현재는 6월 급여 332억원만 체불된 상황""이라고 설명했다. 최근 홈플러스 익스프레스 매각 대금이 들어오면서 밀린 임금의 상당수를 지급한 것으로 보인다. 홈플러스는 ""영업 정상화를 위해 상품 대금 지급이 무엇보다 필요한 상황에서도 직원 급여가 장",2026-07-08 17:50,https://www.etoday.co.kr/news/view/2601741?trc=main_list_news,이투데이
"""경쟁 업체 거래 7년간 막아""...중기부, 한국엔지니어링플라스틱 고발 요청",https://img.etoday.co.kr/crop/200/125/2322405.jpg,중소벤처기업부가 공정거래법을 위반한 한국엔지니어링플라스틱에 대해 검찰 고발을 요청했다. 중소벤처기업부는 이날 ‘제34차 의무고발요청 심의위원회’를 열고 한국엔지니어링플라스틱에 대한 검찰 고발을 공정거래위원회에 요청하기로 했다고 8일 밝혔다. 의무고발요청제도는 공정위가 미고발한 6개 법률(하도급법·공정거래법·대규모유통업법·표시광고법·가맹사업법·대리점법) 위반사건을 중기부가 고발요청하면 이를 검찰에 의무고발하는 제도다. 중기부는 중소기업에 미친 피해나 사회적 파급효과 등을 고려해 고발 요청 여부를 결정한다. 중기부에 따르면 한국엔지니,2026-07-08 17:50,https://www.etoday.co.kr/news/view/2601737?trc=main_list_news,이투데이
홈플러스 사태 속…다시 주목받는 김병주 MBK 회장 장편소설,https://img.etoday.co.kr/crop/200/125/2355986.jpg,"책임 있는 금융·구조조정 철학 담은 자전적 소설 현실 경영과의 괴리 두고 평가 엇갈려 홈플러스 회생절차 폐지 결정 이후 MBK파트너스와 김병주 회장을 둘러싼 책임론이 커지는 가운데, 김 회장이 집필한 장편소설 '오퍼링스(Offerings)'도 다시 주목받고 있다. 8일 금융투자업계에 따르면 김 회장은 언론 인터뷰 등을 통해 이 소설이 자신의 경험과 금융 철학을 바탕으로 쓰였다고 설명해왔다. 이 때문에 '오퍼링스'는 단순한 소설을 넘어 김 회장의 경영관과 리더십을 엿볼 수 있는 작품으로 받아들여져 왔다. '오퍼링스'는 한국계 미국인",2026-07-08 17:38,https://www.etoday.co.kr/news/view/2601735?trc=main_list_news,이투데이
"중기중앙회, 중소기업 나눔 페스타 개최…제품 15만점 판매",https://img.etoday.co.kr/crop/200/125/2356855.jpg,"중소기업중앙회와 중소기업사랑나눔재단은 8일 서울 여의도 중기중앙회에서 ‘2026 중소기업 나눔 페스타’ 개막식을 개최했다고 밝혔다. 이번 행사는 8일부터 9일까지 이틀간 열린다. 중소기업계가 기부한 생활용품, 아동도서, 학용품, 액세서리 등 중소기업 제품 15만점 상당을 시민에게 합리적인 가격으로 판매하고 수익금을 소외계층에 지원하는 방식이다. 개막식에서는 고액 후원자 감사패 전달과 복지시설 후원 결연식이 진행됐다. 중기중앙회와 재단은 나눔에 참여한 중소기업인에게 감사의 뜻을 전하고 지속적인 상생 후원 기반을 마련했다. 행사장에서",2026-07-08 17:38,https://www.etoday.co.kr/news/view/2601734?trc=main_list_news,이투데이
"현대차 노조, 13~15일 부분파업 예고…임단협 교섭 난항",https://img.etoday.co.kr/crop/200/125/2350122.jpg,"현대자동차 노동조합이 올해 임금 및 단체협약(임단협) 교섭이 난항을 겪으면서 13일부터 사흘간 부분파업에 돌입한다. 현대차 노조는 열린 8일 제2차 중앙쟁의대책위원회에서 13~15일 매일 2시간씩 부분파업을 실시하기로 했다고 밝혔다. 노사는 이날 15차 교섭을 진행했지만 합의에 이르지 못했다. 사측은 월 기본급 8만9000원 인상과 성과금 350%+1000만원, 자사주 15주 지급 등을 담은 3차 제시안을 내놨지만, 노조는 조합원 기대 수준에 미치지 못한다며 거부한 것으로 알려졌다. 노조는 부분파업을 통해 사측의 추가 제시안을 이",2026-07-08 17:27,https://www.etoday.co.kr/news/view/2601732?trc=main_list_news,이투데이
"굿네이버스 미래재단·시니스트, AI 기반 스마트 돌봄시스템 업무협약 체결",https://img.etoday.co.kr/crop/200/125/2356849.jpg,"굿네이버스의 시니어서비스 전문기관인 재단법인 굿네이버스 미래재단(이하 미래재단)과 AI 기반 시니어 케어 전문기업 주식회사 시니스트가 AI·사물인터넷(IoT) 기반 ‘시니어 주거 맞춤형 돌봄사업’을 통한 안전한 시니어 주거공동체 조성을 위해 업무협약(MOU)을 체결했다고 8일 밝혔다. 이번 협약은 미래재단의 시니어 복지 전문성과 시니스트의 AIoT(AI+IoT) 기술을 결합해 초고령사회에 대응하는 스마트 돌봄서비스를 구축하고, 안전하고 지속 가능한 시니어 주거모델을 구현하기 위해 마련됐다. 양 기관은 올해 하반기 경기도 시흥시 배",2026-07-08 17:23,https://www.etoday.co.kr/news/view/2601726?trc=main_list_news,이투데이
"기아, 송민수 대표이사 선임…송호성 단독서 각자 대표 체제 전환",https://img.etoday.co.kr/crop/200/125/2349831.jpg,기아가 현대자동차그룹의 노무 라인 재편에 따른 후속 인사로 송민수 부사장을 신임 대표이사로 선임하고 송호성 사장과의 각자 대표 체제로 전환했다. 기아는 8일 이사회를 열고 송민수 부사장(국내생산담당·안전보건최고책임자)을 대표이사로 신규 선임했다고 공시했다. 이에 따라 기존 송호성 사장 단독 대표이사 체제는 송호성·송민수 각자 대표 체제로 변경됐다. 이번 인사는 5월 최준영 전 기아 사장이 현대자동차그룹 정책개발담당으로 자리를 옮긴 데 따른 후속 조치다. 현대차그룹은 당시 정책개발실 수장을 부사장급에서 사장급으로 격상하고 최 사장에,2026-07-08 17:23,https://www.etoday.co.kr/news/view/2601727?trc=main_list_news,이투데이
방미통위 “허위정보법 적용 네이버·구글·메타 등 8곳”…7일 뒤 효력,https://img.etoday.co.kr/crop/200/125/2356830.jpg,"네이버와 카카오 등 국내외 주요 플랫폼 8곳이 개정 정보통신망법에 따라 허위조작정보 대응 의무를 적용받는 대규모 정보통신서비스 제공자로 지정됐다. 지정 효력은 사업자 소명 절차를 거쳐 7일 뒤 발생한다. 방송미디어통신위원회는 네이버와 카카오, 구글, 메타, 엑스(X), 틱톡 등 국내외 플랫폼 8곳을 대규모 정보통신서비스 제공자로 지정해 8일 통보했다고 밝혔다. 방미통위 관계자는 ""오늘 오전 지정 대상 사업자 8곳에 통보를 완료했다""며 ""법령에 따라 사업자들에게 7일간 소명 기회를 부여하며 별도 이견이 없으면 7일 뒤 지정 효력이 발",2026-07-08 17:19,https://www.etoday.co.kr/news/view/2601721?trc=main_list_news,이투데이
[단독] 법원 “하이브 ‘사내 추천 입사’ 유출 방지책 없어...개인정보보호법 위반”,https://img.etoday.co.kr/crop/200/125/2356736.jpg,"“지원 사실 외부에 알려졌다” 하이브 상대 손배소...일부 승소 판결 法 “입사지원 사실, 내부인이 유출 않도록 최소한의 수단 갖췄어야“ 사내 직원을 통한 추천 입사 제도를 운용하는 하이브가 입사지원 사실의 외부 유출을 막기 위한 최소한의 조치도 갖추지 않은 건 개인정보보호법 위반이라는 법원 판단이 나왔다. 8일 법조계에 따르면 서울서부지법 민사단독10부(우라옥 부장판사)는 최근 A 씨가 하이브를 상대로 제기한 손해배상 소송에서 일부 승소 판결했다. 법원은 하이브가 A 씨에게 100만원과 지연손해금을 지급하라고 명령했다. A 씨는",2026-07-08 17:18,https://www.etoday.co.kr/news/view/2601672?trc=main_list_news,이투데이
"파리바게뜨, 상큼달콤 레몬·복숭아 에이드 선봬",https://img.etoday.co.kr/crop/200/125/2356828.jpg,여름철 과일 음료 트렌드 반영한 에이드 2종 레몬·복숭아의 상큼달콤한 풍미 식후에 즐기는 시즌 음료 ‘밥 먹고 파바 고?’ 파리바게뜨가 연일 이어지는 무더위 속에서 상큼한 과일 음료를 찾는 소비자들을 위해 이번 신제품을 마련했다. 파리바게뜨가 여름철 과일 음료 트렌드를 반영해 청량하고 시원하게 즐길 수 있는 레몬과 복숭아 활용 에이드 2종을 선보인다고 8일 밝혔다. 시칠리아 레몬 에이드는 향이 진하고 산뜻한 맛으로 유명한 이탈리아 시칠리아산 레몬을 포함한 레몬 베이스를 활용했다. 복숭아 에이드는 달콤한 복숭아에 레몬을 더해 복숭아,2026-07-08 17:07,https://www.etoday.co.kr/news/view/2601716?trc=main_list_news,이투데이
광주 군공항 반도체 클러스터 속도전…전력·용수·인력 확보가 관건,https://img.etoday.co.kr/crop/200/125/2356822.jpg,"250만평 국유지·평탄화 완료로 속도전 기대 ""우수 인재 확보도 함께 이뤄져야"" 정부가 호남권 반도체 클러스터 부지로 광주 군공항을 확정한 데 이어 전남광주통합특별시가 사업 기간을 절반으로 줄이는 '패스트트랙' 추진에 나서면서 사업에 속도가 붙고 있다. 실제 팹 건설까지는 군공항 이전과 안정적인 전력·용수 공급, 전문 인력 확보 등이 해결 과제로 꼽힌다. 8일 전남광주통합특별시에 따르면 시는 반도체 산업단지 조성 기간을 단축하기 위해 인허가와 토지 보상, 설계를 동시에 추진하고 전력·용수 공급시설 구축과 공사를 병행하는 패스트트랙",2026-07-08 16:58,https://www.etoday.co.kr/news/view/2601600?trc=main_list_news,이투데이
테슬라·BYD·지커 '중국산' 삼각공세…안방 車 시장 흔든다,https://img.etoday.co.kr/crop/200/125/2356821.jpg,"테슬라·BYD, 전년비 각각 192.2%·807.9% 증가 국산 전기차 점유율 75%→57.2%로 하락 테슬라와 비야디(BYD), 지커 등 중국산 전기차의 안방 시장 공략이 거세지면서 국내 자동차 산업의 위기감이 커지고 있다. 가격 경쟁력을 앞세운 중국산 차량이 판매를 빠르게 늘리는 가운데 국내 완성차와 부품업계에서는 생산 기반과 공급망 경쟁력을 유지하기 위한 '한국판 IRA(국내생산촉진세제)' 도입이 시급하다는 목소리가 커지고 있다. 8일 한국수입자동차협회(KAIDA)에 따르면 올해 1~6월 테슬라의 국내 판매량은 5만6139대",2026-07-08 16:57,https://www.etoday.co.kr/news/view/2601585?trc=main_list_news,이투데이
메모리 품귀에 흔들린 폴더블 아이폰…삼성 ‘선점 효과’ 커진다,https://img.etoday.co.kr/crop/200/125/2356819.jpg,"애플, 아이폰18 프로에 부품 우선 배정 전망 출시 지연 땐 갤럭시Z 시리즈 수요 집중 가능성 삼성전자가 이달 차세대 폴더블 스마트폰을 공개하는 가운데 애플의 첫 폴더블 아이폰 출시 일정에도 시장의 관심이 쏠리고 있다. 삼성전자와 애플이 올해 하반기 나란히 폴더블 스마트폰을 선보이며 프리미엄 폴더블 시장 경쟁이 본격화할 것으로 예상되지만, 애플이 메모리 등 핵심 부품 수급에 어려움을 겪으면서 출시 일정이 늦춰질 가능성이 제기되면서 삼성전자가 시장 선점 효과를 누릴 수 있다는 분석이 나온다. 삼성전자는 22일(현지시간) 영국 런던",2026-07-08 16:57,https://www.etoday.co.kr/news/view/2601647?trc=main_list_news,이투데이
"한화에어로, KAI 지분 10% 턱밑까지 샀다…5000억 매입 조기 완료",https://img.etoday.co.kr/crop/200/125/2353698.jpg,당초 12월 말 예정서 7월 8일 거래 완료로 정정 취득 목적은 ‘사업적 협력 강화’…KAI 주요 주주 지위 확대 한화에어로스페이스가 한국항공우주산업(KAI) 지분 추가 취득을 당초 계획보다 앞당겨 마무리했다. KAI와의 사업적 협력 강화를 목적으로 5000억원에 가까운 자금을 투입하며 항공우주 분야 영향력을 확대하는 모습이다. 한화에어로스페이스는 8일 KAI 주식 취득 관련 정정공시를 통해 KAI 주식 331만8057주를 장내에서 취득했다고 밝혔다. 취득금액은 4998억7399만원이다. 이번 정정공시의 핵심은 취득 일정이다. 한,2026-07-08 16:56,https://www.etoday.co.kr/news/view/2601708?trc=main_list_news,이투데이
"모잠비크 수주, 또다시 연기…조선사 “지연으로 인한 손해 없어”",https://img.etoday.co.kr/crop/200/125/2319149.jpg,LNG 운반선 인도 일정 또다시 미뤄져 프로젝트 표류 계속…조선사는 계약 유지 “수익이나 슬롯 스케쥴에 악영향 없어” 프랑스 토탈에너지스가 추진하고 있는 모잠비크 액화천연가스(LNG) 프로젝트가 최근 또다시 연기됐다는 외신 보도가 나왔다. 이에 건조의향서를 체결했던 HD현대삼호와 삼성중공업은 최종 계약 체결이 또다시 미뤄진 가운데 조선사 측의 대응에 관심이 쏠리고 있다. 8일 조선업계에 따르면 모잠비크 LNG 프로젝트에 포함된 LNG 운반선 17척에 대한 인도 일정이 2029~2030년으로 또다시 연기됐다. 해당 프로젝트는 202,2026-07-08 16:56,https://www.etoday.co.kr/news/view/2601685?trc=main_list_news,이투데이
"삼성전자 DS 노조, 차주부터 정책위 운영…성과급 등 논의",https://img.etoday.co.kr/crop/200/125/2356283.jpg,"사측, 노조 요구에 회신 조직문화·임금 등 안건 삼성전자 디바이스솔루션(DS) 부문 노사가 차주부터 정책위원회를 운영한다. 내년도 임금교섭을 앞두고 성과급 제도와 조직문화 등 DS 현안을 정기적으로 논의하기 위한 취지다. 8일 업계에 따르면 삼성전자는 이날 삼성그룹 초기업노동조합 삼성전자 지부(초기업노조)에 보낸 회신 공문을 통해 이같은 내용을 전했다. 정책위는 다음주부터 시작되며 월 1회 정책위원회 회의와 월 1회 노사 간 회의가 열릴 수 있도록 노조는 계획 중이다. 이는 앞서 초기업노조 삼성전자 지부의 요구에 따른 것이다. 초",2026-07-08 16:54,https://www.etoday.co.kr/news/view/2601706?trc=main_list_news,이투데이
기술 이어 디자인도...중기·렌털시장 덮친 디자인 분쟁,https://img.etoday.co.kr/crop/200/125/2356813.jpg,"정수기와 음식물 처리기, 공기청정기 등 소형가전을 둘러싼 렌탈업계의 디자인 분쟁이 확산하고 있다. 렌털업계의 내수 경쟁이 치열해지는 상황에서 후발 기업 제품들이 기존 제품과 유사한 사례가 이어지자 무분별한 지식재산권 침해에 대한 강경 대응의 필요성이 커지는 것으로 풀이된다. 8일 관련 업계에 따르면 음식물처리기를 둘러싼 앳홈과 쿠쿠의 디자인 무효 심판 청구 결과가 조만간 나올 것으로 전해진다. 앞서 앳홈은 쿠쿠가 작년 4월 말 출시한 음식물처리기 '에코웨일'이 2023년 자사가 내놓은 '더 플랜더'의 디자인과 유사하다고 판단하고",2026-07-08 16:54,https://www.etoday.co.kr/news/view/2601667?trc=main_list_news,이투데이
"반도체 수출 호조에, 5월 경상수지 386억 달러 흑자‥'사상최대' [포토로그]",https://img.etoday.co.kr/crop/200/125/2356808.jpg,반도체 호황이 이어지며 올해 5월 경상수지가 386억1000만 달러를 기록했다. 사상 최대 규모다. 8일 한국은행이 발표한 '올해 5월 국제수지(잠정)'에 따르면 경상수지는 386억1000만 달러로 직전 최대 규모인 3월 379억3000만 달러를 뛰어넘었다. 상품수지도 378억6000만 달러로 역대 1위 금액을 경신했다. 사진은 이날 인천 연수구 인천신항 모습.,2026-07-08 16:51,https://www.etoday.co.kr/news/view/2601703?trc=main_list_news,이투데이
"美, 한국 조선사에 전투함·급유함 타진…방산 공급망 ‘반전 계기’ 되나",https://img.etoday.co.kr/crop/200/125/2298673.jpg,"美, 한국 조선사에 전투함·급유함 정보 요청 2054년까지 360척 이상 신규 함정 필요 1600조 규모 美 방산 시장 참여 계기 될 수도 미국 행정부가 한국 조선업계에 함정 건조·설계 역량을 공식 타진한 것으로 알려졌다. 최근 캐나다 잠수함 수주전에서 고배를 마신 국내 특수선 제조사들 입장에서는 새로운 반전의 계기가 될 수 있다는 기대가 나온다. 8일 방산업계에 따르면 미 국방부와 해군이 전투함과 급유함에 대한 정보 요청(RFI)을 국내 조선사들에 보낸 것으로 알려졌다. 미국에서 RFI 형식으로 조선소들에게 함정 역량을 문의한",2026-07-08 16:36,https://www.etoday.co.kr/news/view/2601612?trc=main_list_news,이투데이
ESG 공시 앞당긴 정부…대기업 '투자 신뢰 vs 비용 부담' 셈법 [베일 벗은 ESG 공시 로드맵],https://img.etoday.co.kr/crop/200/125/2291929.jpg,2028년 자산 10조 이상 코스피 상장사부터 의무화 공급망 관리·공시 시스템 구축 부담…초기 3년 면책으로 연착륙 유도 2028년부터 연결자산총액 10조원 이상 코스피 상장사를 시작으로 지속가능성(ESG) 공시가 의무화된다. 당초 연결자산 30조원 이상 대기업부터 단계적으로 도입하려던 정부 초안보다 대상과 속도가 모두 확대됐다. 대기업들은 글로벌 기관투자자 대응과 자본시장 신뢰도 제고라는 효과를 기대하면서도 연결 종속회사와 협력사까지 포괄하는 데이터 구축 부담을 피하기 어려워졌다. 8일 재계에 따르면 정부와 더불어민주당이 발표한,2026-07-08 16:35,https://www.etoday.co.kr/news/view/2601590?trc=main_list_news,이투데이
디지털산업 매출 1300조 돌파…3년 연속 100조 이상 증가,https://img.etoday.co.kr/crop/200/125/2356597.jpg,2024년 디지털산업 실태조사결과 발표 제조업 절반 넘은 디지털산업 AI 투자 확대·DX 누적 효과 국내 디지털산업 매출이 3년 연속 100조원 이상 증가하며 1378조원을 기록했다. AI 확산과 디지털 전환을 바탕으로 성장세를 이어가며 제조업에 이어 우리 경제의 핵심 성장축으로 자리매김하는 모습이다. 정부는 내년부터 AI 투자와 활용 효과를 별도로 분석할 수 있도록 디지털산업 통계 체계도 손질한다. AI 투자·DX 확산…디지털산업 외형 키웠다 과학기술정보통신부는 정보통신정책연구원(KISDI)과 2024년 우리나라 디지털산업의 규,2026-07-08 16:32,https://www.etoday.co.kr/news/view/2601532?trc=main_list_news,이투데이
"중기부, 소상공인 휴·폐업 안전망 간담회…정책보험 도입 논의",https://img.etoday.co.kr/crop/200/125/2356520.jpg,"중소벤처기업부는 8일 서울 중구에서 ‘소상공인 사회안전망 강화 정책간담회’를 개최했다고 밝혔다. 이번 간담회는 소상공인 고용보험료 지원사업 확대와 휴업 단계의 정책 공백 해소를 위한 사회안전망 강화 방안을 논의하기 위해 마련됐다. 간담회에는 실업급여 수급 후 재창업에 성공한 소상공인, 최근 자영업자 고용보험 신규 가입자, 폐업 경험 소상공인 등이 참석했다. 사회보장·보험 전문가, 민간 손해보험사, 소상공인시장진흥공단(소진공) 관계자도 함께했다. 재창업에 성공한 소상공인은 보험료 지원 덕분에 고용보험에 가입할 수 있었고 실업급여가",2026-07-08 16:30,https://www.etoday.co.kr/news/view/2601475?trc=main_list_news,이투데이
"두산퓨얼셀, 3분기 중 美 데이터센터 연료전지 공급 가시화",https://img.etoday.co.kr/crop/200/125/2356722.jpg,"AI 전력난에 온사이트 발전 대안 부상 3분기 PAFC 공급 계약 체결 전망 두산퓨얼셀의 미국 데이터센터향 연료전지 공급이 가시화하고 있다. AI 확산으로 데이터센터 전력난이 심화하는 가운데, 비교적 설치 속도가 빠르고 ‘온사이트’ 발전이 가능한 연료전지가 대안으로 떠오르면서 두산퓨얼셀의 해외 수출 확대에도 속도가 붙을 전망이다. 8일 업계에 따르면 두산퓨얼셀은 3분기 중 글로벌 빅테크와 인산형 연료전지(PAFC) 공급 계약을 체결할 것으로 예상된다. 1년 이상의 품질 검증과 실사를 마치고 막바지 논의를 진행 중인 것으로 전해졌다",2026-07-08 16:29,https://www.etoday.co.kr/news/view/2601665?trc=main_list_news,이투데이
교섭 세 차례 만에 쟁의투표…포스코 노사관계 긴장,https://img.etoday.co.kr/crop/200/125/2348242.jpg,"8~9일 투표…가결돼도 즉시 쟁의권 확보는 아냐 직고용·복지 쟁점 겹쳐…중노위 추가 조정 여부 변수 포스코 정규직 노동조합이 올해 단체교섭 초반부터 쟁의행위 찬반투표에 들어갔다. 업계에서는 노사가 요구안을 충분히 주고받기 전 쟁의 절차가 먼저 추진되는 것은 통상적이지 않다는 지적이 나온다. 8일 업계에 따르면 한국노총 산하 포스코노동조합은 이날 오전 6시부터 9일 오후 1시까지 조합원을 대상으로 쟁의행위 찬반투표를 진행한다. 투표는 모바일 방식으로 이뤄지며, 개표는 9일 오후 진행될 예정이다. 노조는 조합원 메시지를 통해 “이번",2026-07-08 16:28,https://www.etoday.co.kr/news/view/2601596?trc=main_list_news,이투데이
"라온시큐어, 20억원 규모 자사주 취득…주주 가치 제고",https://img.etoday.co.kr/crop/200/125/2356751.jpg,AI 보안·인증 플랫폼 기업 ‘라온시큐어’가 20억원 규모의 자사주를 취득했다. 회사는 중장기 성장성과 기업 가치를 고려한 결정으로 주주 가치 제고를 위한 책임경영의 일환이라고 밝혔다. 라온시큐어는 8일 자기주식취득 신탁계약을 체결했다고 공시했다. 취득 예정 주식 수는 보통주 27만7392주이며 취득 예정 금액은 20억원이다. 취득 단가는 결의일 전일 종가인 7210원을 기준으로 산정했다. 지난달 최대주주인 이순형 대표도 장내 매수를 통해 보유 주식을 늘린 바 있다. 대표이사의 자사주 취득에 이어 회사 차원의 추가 자사주 취득까지,2026-07-08 16:08,https://www.etoday.co.kr/news/view/2601671?trc=main_list_news,이투데이
