title,thumbnail,short_content,write_time,link,company
"행안부·새마을금고, 전국동시 이사장 선거 준비상황 현장점검",https://img.etoday.co.kr/crop/200/125/2143124.jpg,"행정안전부와 새마을금고중앙회는 ‘제1회 전국동시 새마을금고이사장 선거’를 하루 앞둔 4일 동대문상가 새마을금고를 방문해 선거 준비상황을 점검했다고 밝혔다. 이날 현장점검에서 한순기 행안부 지방재정경제실장은 ”새마을금고 회원들이 안전하게 선거권을 행사할 수 있는 투표환경 조성이 매우 중요하다“며 ”개표가 종료될 때까지 투·개표 안전관리에 맡은 바 소임을 다해 줄 것”을 당부했다. 최훈 새마을금고중앙회 지도이사는 투표 준비상황을 점검하고, “선거를 위해 아낌없는 노력을 다해준 새마을금고 직원들과 유관기관 관계자 여러분께 감사드린다”라",2025-03-04 18:11,https://www.etoday.co.kr/news/view/2449728?trc=main_list_news,이투데이
"[장외시황] 씨케이솔루션, 공모주 청약 진행",https://img.etoday.co.kr/crop/200/125/2143108.jpg,4일 비상장 주식 시장은 호가 변화가 없었다. 38커뮤니케이션에 따르면 인공지능(AI) 기반 재생치료 플랫폼 전문기업 로킷헬스케어는 이날부터 기관투자자 대상 수요예측을 시작한다. 희망공모가는 1만1000~1만3000원이며 상장 주관은 SK증권이 맡았다. 이차전지 드라이룸 전문업체 씨케이솔루션은 이날부터 이틀간 공모주 청약을 진행한다. 공모가가 희망 범위 최상단인 1만5000원으로 결정됐다. 수요예측 경쟁률은 1020.35 대 1을 기록했다. 인터넷 전문은행 케이뱅크는 전 거래일보다 2.96% 하락한 호가 6550원에 마감했다. 이,2025-03-04 17:25,https://www.etoday.co.kr/news/view/2449718?trc=main_list_news,이투데이
윤호영 카카오뱅크 대표 '5연임' 성공…이달 말 주총서 확정,https://img.etoday.co.kr/crop/200/125/2143106.jpg,"이달 26일 주주총회서 확정 윤호영 카카오뱅크 대표이사가 5연임에 성공해 2027년까지 카카오뱅크를 이끌게 됐다. 4일 카카오뱅크에 따르면 지난달 말 임원후보추천위원회(이하 임추위) 회의에서 윤호영 대표가 차기 대표이사 후보로 추천됐다. 윤 대표의 임기는 오는 28일 만료되며, 다음 임기는 2년이다. 카카오뱅크는 오는 26일 주주총회를 통해 윤 대표의 선임 절차를 완료할 예정이다. 임추위는 윤 대표에 관해 ""1인 태스크포스로 카카오뱅크의 설립 단계부터 참여한 통찰력 있는 금융·정보기술(IT) 융합 전문가""라며 ""재임 기간에 급변하",2025-03-04 17:22,https://www.etoday.co.kr/news/view/2449716?trc=main_list_news,이투데이
5대 은행 주담대 들썩…이사철 대출 수요 자극,https://img.etoday.co.kr/crop/200/125/2143090.jpg,"토허제·금리 인하 기대감에 3.4조 증가 개인신용대출, 3개월 연속 감소세 당국, 대출 쏠림 방지 위한 총량 관리 주문 주요 시중은행의 가계대출 잔액이 한 달 만에 증가세로 돌아섰다. 서울시의 토지거래허가구역 해제로 인한 부동산 거래량 증가와 한국은행의 기준금리 인하, 이사철 수요가 맞물린 것으로 풀이된다. 4일 금융권에 따르면 5대 은행(KB국민·신한·하나·우리·NH농협)의 지난달 28일 기준 가계대출 잔액은 736조7519억 원으로 집계됐다. 지난 1월 4762억 원 감소하며 733조6588억 원으로 줄어든 지 한 달 만에 다",2025-03-04 16:56,https://www.etoday.co.kr/news/view/2449624?trc=main_list_news,이투데이
"[급등락주 짚어보기] 방산주 대성하이텍, 트럼프發 안보 불안에 ‘상한가’",https://img.etoday.co.kr/crop/200/125/2143062.jpg,"4일 유가증권시장(코스피)에서 상한가를 기록한 종목은 HJ중공업이다. 하한가를 기록한 종목은 없었다. HJ중공업은 30.00%(1830원) 오른 7930원에 장을 마쳤다. 미 해군 함정 유지·정비·보수(MRO) 사업에 진출하는데 필요한 함정정비협약(MSRA) 체결 준비에 돌입했다는 소식에 상승한 것으로 풀이된다. 이날 코스닥 시장에서 상한가를 기록한 종목은 에코캡, 대성하이텍, 파인테크닉스, 한일단조 등 4종목이다. 에코캡은 30.00%(408원) 상승한 1768원으로 거래를 마감했다. 지난해 영업이익이 전년보다 260% 가까이",2025-03-04 16:10,https://www.etoday.co.kr/news/view/2449675?trc=main_list_news,이투데이
"신한금융, 양인집·전묘상 신임 사외이사 추천",https://img.etoday.co.kr/crop/200/125/2143033.jpg,"사외이사 후보 2명 신규 선임 추천 9명 중 여성 4명…업계 최고 수준 신한금융은 4일 ‘사외이사 및 감사위원 후보 추천위원회’를 열고 양인집 후보자와 전묘상 후보자 총 2명의 신규 사외이사 후보를 신규 추천했다. 신한금융은 양 후보의 추천 사유와 관련해 “후보자는 빅데이터, 머신러닝, 인공지능 기반 솔루션 및 소프트웨어, 모바일 애플리케이션 개발과 ICT 품질 검증 등을 주력 사업으로 영위하는 회사를 오랜 기간 이끌어왔다”며 “디지털 사업과 ICT 기술에 대한 전문적 이해도를 갖고 있으며 손해보험사와 국내 대기업의 해외사업총괄사",2025-03-04 16:05,https://www.etoday.co.kr/news/view/2449653?trc=main_list_news,이투데이
[종합] 사흘째 내린 코스피 2520선 마감…코스닥 730대로,https://img.etoday.co.kr/crop/200/125/2143057.jpg,"4일 코스피가 3거래일 연속 하락하며 2520선 마감했다. 이날 코스피 지수는 전일 대비 3.86포인트(0.15%) 내린 2528.92에 장을 마쳤다. 코스피는 장중 한때 19.47포인트(0.77%) 하락한 2513.31을 기록했다가 16.00포인트(0.63%) 오른 2548.78에 도달하는 등 등락을 거듭했다. 외국인과 기관이 각각 1968억 원, 1472억 원 순매도하며 지수를 끌어내렸다. 개인은 2063억 원어치를 순매수했다. 업종별로는 운송장비·부품(5.17%), 운송·창고(2.67%), 일반서비스(0.96% 등이 상승했고",2025-03-04 16:03,https://www.etoday.co.kr/news/view/2449671?trc=main_list_news,이투데이
"'위믹스 탈취' 해킹 사태…거래소들, 거래유의종목 지정",https://img.etoday.co.kr/crop/200/125/2099205.jpg,"위믹스, 지난달 28일 해킹 발생 후 4일 새벽에 공식 공지 닥사, ‘불성실공시ㆍ보상안부재’로 거래유의 종목 지정 위믹스 재단 “경위 파악 중이나, 대부분 자산 매도 추정” 디지털자산거래소 공동협의체(DAXA·닥사)가 위믹스를 거래유의 종목으로 지정했다. 위믹스가 해킹으로 대규모 코인을 탈취당한 후 뒤 늦게 관련 사실을 공시했다는 이유다. 4일 위믹스가 거래되고 있는 국내 가상자산 원화거래소 빗썸과 코인원이 위믹스에 대한 ‘거래유의 종목 지정’을 공지했다. 이번 거래유의 종목 지정은 닥사 차원의 공동 대응을 통해 이뤄졌다. 이에",2025-03-04 15:53,https://www.etoday.co.kr/news/view/2449654?trc=main_list_news,이투데이
김학수 넥스트레이드 대표 “안정·혁신 거래로 자본시장 밸류업 기여”,https://img.etoday.co.kr/crop/200/125/2142847.jpg,개장식에 금융당국·정관계·증권사 등 200명 참석 “수많은 테스트 거쳐 양적 확대 넘는 질적 변화” 국내 첫 대체거래소(ATS) 넥스트레이드가 출범한 4일 김학수 넥스트레이드 대표는 “투자자에게 더 좋은 투자 환경과 투자 기회를 제공하고 안정적이며 신속한 거래체결을 지원하겠다”고 밝혔다. 김 대표는 이날 서울 여의도 금융투자협회에서 열린 넥스트레이드 개장식에서 “시장 요청에 맞춰 기민하고도 혁신적인 서비스를 제공해 우리 자본시장 밸류업과 지속적 성장에 기여하도록 노력할 것”이라며 이렇게 말했다. 그는 “60년 넘게 자본시장에는 한,2025-03-04 15:36,https://www.etoday.co.kr/news/view/2449646?trc=main_list_news,이투데이
[속보] 코스피 3.86p(0.15%) 내린 2528.92(마감),https://img.etoday.co.kr/crop/200/125/1990411.jpg,,2025-03-04 15:33,https://www.etoday.co.kr/news/view/2449650?trc=main_list_news,이투데이
[속보] 코스닥 6.06p(0.81%) 내린 737.90(마감),https://img.etoday.co.kr/crop/200/125/1990411.jpg,,2025-03-04 15:33,https://www.etoday.co.kr/news/view/2449649?trc=main_list_news,이투데이
국민연금 ‘공공데이터 제공 운영실태’ 6년 연속 최고등급,https://img.etoday.co.kr/crop/200/125/2143010.jpg,"국민연금공단은 행정안전부가 주관하는 ‘2024년 공공데이터 제공 운영실태 평가’에서 6년 연속으로 최고 등급인 ‘우수’를 받았다고 4일 밝혔다. 국민연금공단은 공공데이터포털에 117종의 데이터를 개방하고 있다. 이 중 ‘국민연금 가입 사업장 내역’ 데이터는 공공데이터포털에서 개방 중인 파일데이터 7만5508건 중 2번째로 많은 누적 조회수를 기록 중이다. 이 데이터에는 사업장별로 가입자 수, 보험료 고지금액, 사업장 탈퇴일 등 정보가 담겨 있어 △코로나19 지원금 △휴·폐업 사업장 지원 정책 △기업 신용평가 등에 참고 자료로 유용",2025-03-04 15:13,https://www.etoday.co.kr/news/view/2449637?trc=main_list_news,이투데이
"[특징주] 신송홀딩스, 中 미국산 밀·옥수수 등에 15% 관세 소식에 반사이익 기대감↑",https://img.etoday.co.kr/crop/200/125/2142973.jpg,"신송홀딩스가 중국의 미국산 농산물에 보복관세를 부과한다는 소식에 반사이익 기대감으로 상승세다. 4일 오후 2시32분 현재 신송홀딩스는 전일 대비 1110원(15.35%) 오른 8340원에 거래됐다. 이날 중국 국무원은 공고를 통해 미국산 닭고기·밀·옥수수·면화에 15% 보복관세를 부과한다고 밝혔다. 이는 도널드 트럼프 미국 대통령이 4일(미국시간)부터 중국산 제품에 10% 추가관세를 부과하기로 한 것에 대한 보복조치다. 신송홀딩스는 곡물트레이딩을 통해 쌀, 콩, 밀, 옥수수등의 곡물을 중국 등 아시아지역은 물론 러시아와 중남미 시",2025-03-04 14:35,https://www.etoday.co.kr/news/view/2449616?trc=main_list_news,이투데이
"[특징주] 풍산, 美 '구리 관세' 시사에 7%대↑",https://img.etoday.co.kr/crop/200/125/2142973.jpg,풍산이 미국의 구리 관세 부과가 현실화할 수 있다는 전망에 강세를 나타내고 있다. 4일 오후 2시 24분 현재 풍산은 전 거래일보다 7.47% 오른 5만9000원에 거래 중이다. 도널드 트럼프 대통령의 구리 관세 부과 가능성이 구리 가격 상승으로 이어져 풍산에 호재로 작용할 수 있다는 증권가 분석에 영향을 받은 것으로 풀이된다. 지난달 트럼프 대통령은 구리 수입이 국가안보에 미치는 영향을 조사하라고 지시하며 구리에 대해서도 관세를 부과할 것임을 시사했다. 이태환 대신증권 연구원은 “관세 부과 가능성은 선수요 발생으로 이어지며 중국,2025-03-04 14:30,https://www.etoday.co.kr/news/view/2449614?trc=main_list_news,이투데이
"서울보증보험, 공모가 2만6000원 확정…희망범위 하단",https://img.etoday.co.kr/crop/200/125/2142971.jpg,"유가증권시장 상장을 추진 중인 서울보증보험은 공모가를 2만6000원으로 확정했다고 4일 밝혔다. 지난달 20일~26일 국내외 기관투자자 수요예측 결과를 거쳐 결정한 서울보증보험 공모가는 희망 범위(2만6000원~3만1800원) 하단에 해당한다. 이번 수요예측에는 국내 1421곳, 해외 88곳 등 총 1509곳의 기관이 참여했다. 신청 주식 수량은 9억2465만 주이며 최종 경쟁률은 240.8대 1로 집계됐다. 공모가 기준 총 공모금액은 약 1815억 원이다. 의무보유확약 건수는 136건(참여 주식 수 기준 16.3%)이다. 6개월",2025-03-04 14:24,https://www.etoday.co.kr/news/view/2449611?trc=main_list_news,이투데이
"금감원, 올해 금융소비자 사전예방적 현장점검 강화",https://img.etoday.co.kr/crop/200/125/2142472.jpg,"금융감독원이 올해 금융소비자보호 부문에서 현장점검을 강화하는 등 선제적인 소비자 보호에 나선다. 금감원은 4일 금융소비자보호 부문 금융감독 업무설명회를 개최해 이같이 밝혔다. 이날 설명회에는 금융협회 및 금융회사 소비자보호 담당자 등 약 260명이 참석했다. 김미영 금융소비자보호처장은 인사말씀을 통해 “경기 불확실성과 금융시장 변동성이 지속되는 가운데 신종 금융 사기 등 민생금융범죄 증가로 소비자의 어려움이 가중되고 있다”며 “금융의 지털화로 새로운 형태의 위험이 증가하고, 금융상품 불완전 판매도 이어지면서, 소비자 신뢰 회복을",2025-03-04 14:00,https://www.etoday.co.kr/news/view/2449557?trc=main_list_news,이투데이
[종합] 美 관세에도 코스피 2530선 보합…코스닥 약세,https://img.etoday.co.kr/crop/200/125/2142962.jpg,"미국 트럼프 행정부의 관세 리스크가 부각한 4일 코스피가 2530선을 가까스로 지키고 있다. 이날 오후 1시 34분 현재 코스피 지수는 전일 대비 0.02포인트(0.00%) 오른 2532.80에 거래되고 있다. 코스피는 장중 한때 2548.78까지 올랐다가 2513.31까지 내리는 등 변동 폭을 키우다 보합에 머물고 있다. 외국인, 기관이 각각 1226억 원, 1382억 원 순매도하며 지수를 끌어내리고 있다. 개인은 1642억 원 순매수하고 있다. 업종별로는 운송장비·부품(4.91%), 운송·창고(2.27%), 음식료·담배(0.8",2025-03-04 13:52,https://www.etoday.co.kr/news/view/2449595?trc=main_list_news,이투데이
"김병환 금융위원장 ""복수시장 철저히 관리…투자자 보호에 빈틈 없을 것""",https://img.etoday.co.kr/crop/200/125/2142840.jpg,"김병환 금융위원장은 대체거래소(ATS)와 관련해 ""엄격한 시장 감시를 통해 불공정거래를 차단하고 복수시장을 철저히 관리해 투자자 보호에 한치에 빈틈이 없게 하겠다""고 밝혔다. 김 위원장은 이날 서울 여의도 금융투자협회에서 열린 넥스트레이드 개장식에서 이같이 말했다. 그는 ""넥스트레이드 출범은 주식시장, 자본시장 거래 인프라 차원의 밸류업으로서 큰 의미가 있다""며 ""시장 접근성 제고, 유동성 개선을 통한 증시 저변의 확대와 함께 투자자들도 다양한 편익을 누릴 수 있을 것으로 기대된다""고 말했다. 이어 ""복수 시장간 건전한 경쟁으로",2025-03-04 13:40,https://www.etoday.co.kr/news/view/2449587?trc=main_list_news,이투데이
"'기업회생' 홈플러스에 1.2조 빌려준 메리츠 ""자금회수 문제없어""",https://img.etoday.co.kr/crop/200/125/2064322.jpg,"기업회생절차에 돌입한 홈플러스에 대한 담보채권(신탁) 1조2000억 원을 빌려준 메리츠금융그룹이 자금회수에는 문제가 없다고 4일 밝혔다. 이날 메리츠금융은 입장문을 통해 ""메리츠금융그룹은 홈플러스에 대한 신탁 1조2000억 원을 보유 중이나, 신탁사의 담보가치가 약 5조로 평가받는 만큼 자금회수에는 문제가 없을 것""이라고 설명했다. 메리츠금융 3사(메리츠증권·메리츠화재·메리츠캐피탈)는 지난해 5월 홈플러스에 선순위 대출 약 1조2000억 원을 집행했다. 홈플러스는 부동산 신탁사와 맺은 신탁계약의 수익증권을 담보로 제공했다. 해당",2025-03-04 13:22,https://www.etoday.co.kr/news/view/2449578?trc=main_list_news,이투데이
"[특징주] SK하이닉스, 엔비디아 급락에 2%대 하락",https://img.etoday.co.kr/crop/200/125/2142943.jpg,"간밤 엔비디아가 주가가 8% 넘게 떨어지면서 SK하이닉스도 약세를 보이고 있다. 4일 오후 1시 9분 기준 SK하이닉스는 전 거래일 대비 2.57% 내린 18만5300원에 거래되고 있다. 간밤 엔비디아 주가는 8.69% 내린 114.06달러까지 밀리면서 우리나라 기술주에 대한 투심도 약해진 것으로 풀이된다. 월스트리트저널이 미국 정부의 수출 금지에도 중국 업자들이 엔비디아의 최신 칩 블랙웰을 3국을 통해 우회적으로 들여오고 있다고 보도하자, 엔비디아에 대한 대중 수출 통제가 더 강화될 것이란 우려가 커진 영향이다. 도널드 트럼프",2025-03-04 13:16,https://www.etoday.co.kr/news/view/2449575?trc=main_list_news,이투데이
"넥스트레이드 운영 시작, '하루 12시간 주식 거래 한다' [포토]",https://img.etoday.co.kr/crop/200/125/2142913.jpg,국내 최초 대체거래소(ATS)인 넥스트레이드(NXT)가 운영을 시작한 4일 서울 영등포구 넥스트레이드 사무실에서 직원들이 업무를 보고 있다. 넥스트레이드는 KRX와 동시에 운영하는 정규 거래시간 전·후로 프리마켓(오전 8시~8시 50분)과 애프터마켓(오후 3시 30분~오후 8시)을 운영한다. 이에 따라 국내 하루 주식거래 시간은 12시간으로 현행 보다 5시간 30분 늘어난다. 단 개장 첫날엔 개장식 후에 서비스 제공이 시작되어 프리마켓 없이 운영을 시작했다. 조현호 기자 hyunho@,2025-03-04 12:25,https://www.etoday.co.kr/news/view/2449565?trc=main_list_news,이투데이
“개인정보 유출 손실 보상금으로 코인 드립니다”...사기 주의보 발령,https://img.etoday.co.kr/crop/200/125/2142807.jpg,"지난 1월, 피해자 A씨는 ‘◎◎(가상자산사업자)’ 직원 B가(사칭) 개인정보보호위원회에서 위임가짜받아 개인정보유출 피해 보상금 300만 원을 지급한다는 내용의 전화를 받았다. B는 개인정보보호위원회 명의의 가짜 문서를 보여줬다. 손실 보상금은 00코인(가짜)으로만 지급되기 때문에 코인 지갑사이트(가짜)의 회원으로 가입을 유도했다. B는 예정됐던 보상금 보다 많은 1억 3000만 원 상당의 코인이 지급됐다며 A씨에게 코인 구매대금으로 6000만 원 입금 시, 당일 차액(7000만 원) 출금이 가능하다고 말했다. A씨는 저축은행에서",2025-03-04 12:00,https://www.etoday.co.kr/news/view/2449492?trc=main_list_news,이투데이
"[특징주] HJ중공업, 국내 1호 함정 방산…美 매년 42조 MRO 참여 추진 소식에 상승세",https://img.etoday.co.kr/crop/200/125/2142882.jpg,"미국 해군 유지ㆍ정비ㆍ보수(MRO) 사업에 국내 1호 함정 방산업체로 지정된 HJ중공업이 미 해군 함정정비협약(MSRA) 체결준비에 돌입했다는 소식에 상승세다. 4일 오전 11시 16분 현재 HJ중공업은 전일대비 840원(13.77%) 상승한 6940원에 거래 중이다. 이 날 전자신문에 따르면 HJ중공업은 별도의 태스크포스(TF)를 꾸려 미 함정 MRO 사업 진출에 필요한 MSRA 체결 준비를 하고 있다. 미 해군 함정 MRO 사업에 진출하기 위해서는 미 해군보급체계사령부 MSRA를 체결해야 하는데, MSRA의 체결 과정은 구체적",2025-03-04 11:17,https://www.etoday.co.kr/news/view/2449547?trc=main_list_news,이투데이
"빗썸, 대학생 서포터즈 ‘썸즈업(Thumbs Up)’ 3기 모집…이달 14일까지",https://img.etoday.co.kr/crop/200/125/2142869.jpg,"14일까지 모집…빗썸 채용공고 홈페이지 통해 지원 매월 활동비, 우수 활동자에는 상금ㆍ앰배서더 기회 빗썸이 대학생 서포터즈 ‘썸즈업(Thumbs Up)’ 3기를 모집 중이라고 4일 밝혔다. 썸즈업은 빗썸의 브랜드 가치를 제고하고, 차별화된 아이디어를 통해 빗썸의 미래 경쟁력을 강화하는 대학생 홍보대사다. 이번 3기는 다음 달 4일 발대식을 시작으로 이전 기수보다 한 달 연장된 4개월 동안 활동할 예정이다. 썸즈업 3기는 △빗썸 브랜딩을 위한 오프라인 홍보 △서비스 개선 아이디어 발표 △빗썸 브랜드 가치를 제고할 수 있는 사회공헌활",2025-03-04 11:04,https://www.etoday.co.kr/news/view/2449540?trc=main_list_news,이투데이
"케이피에스 미국 자회사, 영국 암연구소 주도 PARP 억제제 병용 임상 1상(b) 돌입",https://img.etoday.co.kr/crop/200/125/2142854.jpg,"바이오제약사로 변신 중인 케이피에스의 글로벌 항암신약 프로젝트에 시동이 걸렸다. 케이피에스 미국 자회사 알곡바이오(Algok Bio Inc.)는 지난달 28일 영국 암연구소(ICR, The Institute of Cancer Research) 주도로 신약 후보물질 이데트렉세드(Idetrexed)와 PARP(Poly ADP-Ribose Polymerase Inhibitor) 억제제 린파자(성분명 올라파립, BRCA변이 난소암·유방암·전립선암·췌장암 치료제)의 임상 1상(b)를 개시했다고 4일 밝혔다. 알곡바이오는 2023년 보스턴사",2025-03-04 10:57,https://www.etoday.co.kr/news/view/2449534?trc=main_list_news,이투데이
"삼일PwC “M&A 시장, 하반기 점진적 회복 전망”",https://img.etoday.co.kr/crop/200/125/2142857.jpg,3년간의 침체기를 보낸 인수합병(M&A) 시장이 올해 하반기로 갈수록 회복될 것이란 전망이 나왔다. 4일 삼일PwC는 이 같은 내용을 담은 ‘2025 M&A 시장 전망’ 보고서를 발간했다. 보고서는 강달러를 기반으로 한 미국 기업의 크로스보더(국경 간) 거래와 사모크레딧 시장 등이 M&A 시장에 활력을 불어넣을 것으로 봤다. 또 인공지능(AI) 중심의 기술 혁명에 대응하기 위해 기업들이 신사업에 투자하거나 비(非) 핵심 자산을 매각하는 등 사업 재편을 활발히 할 것으로 전망했다. 보고서는 지난해는 고금리와 미국 대선 등 여러 정치,2025-03-04 10:55,https://www.etoday.co.kr/news/view/2449532?trc=main_list_news,이투데이
"두나무, 공정거래 자율준수 프로그램(CP) 도입…“공정한 기업 문화 정착 노력”",https://img.etoday.co.kr/crop/200/125/2142850.jpg,"두나무가 공정거래 자율준수 프로그램(CP)을 도입했다고 4일 밝혔다. CP는 공정거래위원회가 마련한 관련 법규 준수를 위한 내부 컴플라이언스 시스템이다. 기업이 자체적으로 행동규범을 제정하고 이를 실천하도록 하고 있다. 이석우 두나무 대표는 사내 게시판을 통해 CP 도입을 선포하고, 내부 임직원들에게 관련 법률 준수에 대한 당부를 전한 것으로 알려졌다. 두나무 측에 따르면 이 대표는 “가상자산 산업은 전례 없이 빠른 속도로 성장하고 있고 산업 전반의 투명성과 공정성에 대한 중요성이 심화되고 있다”며 “두나무는 이러한 사회적 가치를",2025-03-04 10:52,https://www.etoday.co.kr/news/view/2449529?trc=main_list_news,이투데이
"김성환 한국투자증권 사장, 글로벌 금융사 CEO들과 잇단 협력 논의",https://img.etoday.co.kr/crop/200/125/2142834.jpg,한국금융지주 자회사 한국투자증권에 글로벌운용사 최고경영자(CEO)들의 방문이 잇따르고 있다. 한국투자증권은 지난달 27일 만 그룹(Man Group)의 그레고리 본드(Gregory Bond) 대표와 얼라이언 번스타인(Alliance Bernstein)의 오너 에르잔(Onur Erzan) 대표가 각각 내한해 김성환 사장과 금융투자시장 현황을 직접 점검하고 올해 글로벌 금융상품 전략방향 등을 논의했다고 4일 밝혔다. 이번에 방문한 만 그룹과 AB운용 상품 중 한국투자증권을 통해 판매되고 있는 대표 상품은 ‘한국투자MAN다이나믹인컴펀드,2025-03-04 10:52,https://www.etoday.co.kr/news/view/2449526?trc=main_list_news,이투데이
"삼성증권, 중개형 ISA ‘절세응원 이벤트’ 진행",https://img.etoday.co.kr/crop/200/125/2142831.jpg,"삼성증권이 중개형 개인종합자산관리계좌(ISA) 계좌 보유 고객 대상으로 상품권을 지급하는 이벤트를 4월 30일까지 실시한다. 이번 이벤트는 △웰컴(Welcome) 이벤트 △스타트업(Start-up) 이벤트 △레벨업(Level-up) 이벤트 △붐업(Boom-up) 이벤트 총 4가지로 진행된다. 웰컴 이벤트는 신규 고객 대상으로 진행되며 기간 내 최초 중개형 ISA 계좌 개설 시 상품권 5000원, 개설 후 100만 원 이상 순입금 시 상품권 1만 원을 전원에 지급한다. 단 상품권 5000원권 혜택과 1만 원권 혜택은 중복 지급되지",2025-03-04 10:47,https://www.etoday.co.kr/news/view/2449522?trc=main_list_news,이투데이
