title,thumbnail,short_content,write_time,link,company
"아워홈, 편스토랑 우승 메뉴 손태진의 크런치 한입치킨 선봬",https://img.etoday.co.kr/crop/200/125/2356740.jpg,"촉촉한 닭다리살에 감자 플레이크 입혀 바삭한 식감 극대화 온·오프라인 판매와 함께 외식 및 단체급식 메뉴로 확대 운영 아워홈이 KBS 2TV 예능 프로그램 ‘신상출시 편스토랑’의 우승 메뉴를 간편식으로 구현한 신제품을 선보였다. 아워홈은 8일 촉촉한 닭다리살에 감자 플레이크를 더해 바삭한 식감을 극대화한 손태진의 크런치 한입치킨을 내놨다. 이번 신제품은 1kg, 450g 두 가지 용량으로 나왔다. 아워홈몰과 네이버 브랜드스토어, 쿠팡 등 주요 온라인 채널과 이마트 트레이더스 등 오프라인 채널에서 구매할 수 있다. 아워홈은 이번 신",2026-07-08 15:58,https://www.etoday.co.kr/news/view/2601646?trc=main_list_news,이투데이
"이재용 회장, 파운드리 사업장과 美선밸리 참석…AI반도체 협력 기대감",https://img.etoday.co.kr/crop/200/125/2356273.jpg,매년 열리는 억만장자 사교클럽 ‘구글 캠프’도 참석 전망 이재용 삼성전자 회장이 7일(현지시간) 미국에서 열린 선밸리 콘퍼런스에 한진만 삼성전자 DS부문 파운드리사업부장(사장)과 함께 참석했다. 글로벌 빅테크 수장들이 한자리에 모이는 행사인 만큼 AI 분야 협력과 삼성 파운드리의 추가 수주로 이어질지 업계의 관심이 쏠린다. 8일 재계에 따르면 이 회장은 이날부터 11일(현지시간)까지 미국 아이다호주 선밸리 리조트에서 열리는 선밸리 콘퍼런스에 참석했다. 이 자리에는 파운드리 사업을 총괄하는 한 사장도 동행했다. 선밸리 콘퍼런스는 미,2026-07-08 15:58,https://www.etoday.co.kr/news/view/2601669?trc=main_list_news,이투데이
"태광 일주재단, 해외박사 장학생 7명 선발…이호진 회장 이사장 선임도",https://img.etoday.co.kr/crop/200/125/2356741.jpg,"MIT·하버드·컬럼비아대 등 박사과정 진학 예정 이호진 회장, 일주재단 이사장 선임…그룹 3개 재단 맡아 태광그룹 일주학술문화재단이 해외 박사과정에 진학하는 장학생 7명을 선발했다. 일주재단은 8일 서울 종로구 흥국생명빌딩에서 ‘제34기 해외박사 장학증서 수여식’을 열고 장학생 7명에게 장학증서를 전달했다고 밝혔다. 이번에 선발된 장학생들은 MIT, 하버드대, 컬럼비아대 등 세계 주요 대학 박사과정에 진학할 예정이다. 전공 분야는 재료공학, 인공지능공학, 토목공학 등으로, 연구 경력과 학문적 잠재력을 인정받아 장학생으로 선정됐다.",2026-07-08 15:51,https://www.etoday.co.kr/news/view/2601662?trc=main_list_news,이투데이
"HD현대오일뱅크, 여름맞이 주유 고객 경품 이벤트 진행",https://img.etoday.co.kr/crop/200/125/2356737.jpg,7월 7일부터 한 달간 카앤앱서 응모 신규·휴면 고객 1000명에 주유쿠폰 제공 HD현대오일뱅크가 여름 휴가철을 맞아 주유 고객 대상 경품 이벤트를 진행한다. 7일 HD현대오일뱅크는 8월 6일까지 한 달간 ‘주유하고 경품 받자’ 고객 감사 이벤트를 연다고 밝혔다. 이번 행사는 기존 고객뿐 아니라 신규·휴면 고객도 참여할 수 있도록 경품 이벤트와 주유쿠폰 증정 이벤트로 구성됐다. 첫 번째 이벤트는 행사 기간 중 6만원 이상 주유한 고객을 대상으로 진행된다. 고객은 주유 후 HD현대오일뱅크의 카라이프 통합 플랫폼 ‘카앤앱’을 통해 원,2026-07-08 15:47,https://www.etoday.co.kr/news/view/2601659?trc=main_list_news,이투데이
"이 대통령, 트럼프와 만나 군용 선박 건조 협력 논의",https://img.etoday.co.kr/crop/200/125/2356893.jpg,"북대서양조약기구(NATO·나토) 정상회의 참석을 위해 튀르키예를 방문 중인 이재명 대통령이 도널드 트럼프 미국 대통령과 만나 군용 선박 건조 협력 방안을 논의했다. 청와대는 8일 서면 브리핑을 통해 이 대통령이 전날(현지시간) 레제프 타이이프 에르도안 튀르키예 대통령 내외가 주최한 공식 환영 만찬에서 트럼프 대통령과 만나 군용 선박 건조와 관련한 후속 협의를 진행했다고 밝혔다. 이번 만남은 지난달 프랑스 에비앙에서 열린 주요 7개국(G7) 정상회의 이후 약 3주 만이다. 청와대 관계자는 ""이 대통령은 G7 정상회의 당시 트럼프 대",2026-07-08 20:10,https://www.etoday.co.kr/news/view/2601765?trc=main_list_news,이투데이
李대통령·젤렌스키 첫 회담…“北포로 자유의사 존중해 인도적 해결”,https://img.etoday.co.kr/crop/200/125/2356892.jpg,"이재명 대통령과 볼로디미르 젤렌스키 우크라이나 대통령이 첫 정상회담을 갖고 우크라이나 전쟁 종식과 재건 지원, 북한군 포로 문제 등을 논의했다. 북대서양조약기구(NATO·나토) 정상회의 참석차 튀르키예를 방문 중인 이 대통령은 8일(현지시간) 젤렌스키 대통령과 정상회담을 가졌다. 두 정상의 회담은 이번이 처음이다. 이 대통령은 회담에서 한국 정부가 우크라이나에 1억 달러 규모의 포괄적 지원 계획을 공식화한 점을 설명했다. 강유정 청와대 수석대변인은 서면 브리핑을 통해 ""한국 정부가 우크라이나 국민에게 필요한 인도적 지원을 이어가고",2026-07-08 20:06,https://www.etoday.co.kr/news/view/2601766?trc=main_list_news,이투데이
법원 출석하는 김만배-박영수-추경호-안철수 [포토],https://img.etoday.co.kr/crop/200/125/2356794.jpg,"8일 서울 서초구 서울중앙지방법원에서 범죄수익 은닉 혐의를 받는 김만배 화천대유자산관리 대주주, 대장동 50억클럽 뇌물 의혹으로 기소된 박영수 전 특별검사, 계엄 해제 표결 방해 혐의를 받는 추경호 대구시장, 계엄 해제 표결 방해 혐의 공판에 증인 신분으로 출석하는 안철수 국민의힘 의원이 법정으로 향하고 있다. 사진공동취재단",2026-07-08 16:47,https://www.etoday.co.kr/news/view/2601701?trc=main_list_news,이투데이
"與, '검사 보완수사권 폐지' 형소법 심사 착수…국민의힘 ""졸속 입법 중단""",https://img.etoday.co.kr/crop/200/125/2356783.jpg,"민주, 전당대회 전 처리 목표…보완수사권 폐지 법안 법사위 상정 국힘 회의장 앞 규탄 시위…""법사위 장악해 권력 비호 입법"" 비판 더불어민주당이 검찰의 보완수사권을 폐지하는 내용을 담은 형사소송법 개정안 심사에 착수했다. 국민의힘은 민주당의 후반기 국회 원 구성 강행을 문제 삼으며 ""졸속 입법""이라고 반발했다. 국회 법제사법위원회는 8일 전체회의를 열고 민주당 김용민 의원과 조국혁신당 박은정 의원이 공동 발의한 형사소송법 개정안을 상정했다. 민주당은 8·17 전당대회 이전 법안 처리를 목표로 입법에 속도를 낸다는 방침이다. 개정안",2026-07-08 16:34,https://www.etoday.co.kr/news/view/2601694?trc=main_list_news,이투데이
"정청래 ""선호투표제, 당헌·당규 위반하며 할 수 없어""",https://img.etoday.co.kr/crop/200/125/2356765.jpg,"더불어민주당 당권주자인 정청래 전 대표가 8·17 전당대회 최고위원 선출 방식인 선호투표제 도입 논란과 관련해 ""당헌·당규를 위반하면서 할 수는 없는 일""이라며 당 지도부의 신중한 판단을 주문했다. 정 전 대표는 8일 국회에서 열린 '서남권 반도체 클러스터 성공을 위한 정책토론회'를 마친 뒤 기자들과 만나 ""전날 전준위 결정을 존중하고 수용한다고 말했지만 이후 당헌·당규 위반이라는 논란이 있어 직접 살펴봤다""며 ""헌법과 법률을 위반하면서 할 수 없듯이 당헌·당규를 위반하면서 할 수는 없는 것 아니냐""고 말했다. 그는 ""당헌 25조",2026-07-08 16:12,https://www.etoday.co.kr/news/view/2601681?trc=main_list_news,이투데이
"박지원, 장동혁 겨냥 ""대통령 예우 지켜야""…정성호 ""가짜뉴스 법적 검토""",https://img.etoday.co.kr/crop/200/125/2356732.jpg,"박지원 의원, 법사위서 장동혁 국힘 대표 ‘대통령 예우 상실’ 막말 정조준“MB·박근혜 정부 때부터 이어진 ‘빨갱이 가짜뉴스’ 인격 말살… 단속해야”법무장관 “매우 부적절… 가짜뉴스법 저촉 여부 등 필요시 법적 검토할 것” 박지원 더불어민주당 의원이 장동혁 국민의힘 대표의 대통령 관련 발언을 겨냥해 ""국가원수에 대한 최소한의 예우를 지켜야 한다""고 비판하며 공권력의 대응을 촉구했다. 이에 법무부는 최근 시행된 관련 법률에 따라 가짜뉴스 해당 여부 등을 검토하겠다는 입장을 밝혔다. 박 의원은 8일 국회 법제사법위원회 전체회의에서 최근",2026-07-08 15:38,https://www.etoday.co.kr/news/view/2601649?trc=main_list_news,이투데이
"""육해공군 사관학교 통폐합 반대""...2000명 모인 총궐기 대회",https://img.etoday.co.kr/crop/200/125/2356705.jpg,"육·해·공군 사관학교 통폐합 및 육사 지방 이전 저지를 위한 국민 총궐기 대회가 8일 오전 11시 국회의사당 본관 앞에서 열렸다. 군 장성 출신인 한기호·임종득 국민의힘 의원, 육·해·공군사관학교 총동창회, 육군사관학교 사관생도 학부모 모임 등이 주최한 이날 총궐기 대회에는 사관학교 졸업생, 군 예비역 장병, 종교계, 주민대표, 안보단체 등 주최 측 추산 2000여 명이 함께 했다. 총동창회는 결의문에서 “국가안보는 결코 정부의 정책 실험 대상이 될 수 없으며, 대한민국의 미래를 책임질 장교 양성체계 또한 정치적 이해관계에 따라",2026-07-08 15:33,https://www.etoday.co.kr/news/view/2601642?trc=main_list_news,이투데이
"與 “메가특구법, 정기국회서 대부분 처리할 것”",https://img.etoday.co.kr/crop/200/125/2356698.jpg,산자위-산업부 당정협의…“늦어도 내년 2월까지” 법안 발의 이달 중 마무리…“당정·당내 쟁점 있어” 민주당 메가프로젝트 TF→특위 격상…지원 총력전 더불어민주당과 정부가 3대 메가 프로젝트 추진을 뒷받침하기 위한 ‘메가특구 특별법’을 올해 정기국회가 끝나기 전까지 처리하는 데 공감대를 형성했다. 정기국회는 매년 9월에 시작해 100일간 열린다. 국회 산업통상자원중소벤처기업위원회 여당 간사 장철민 민주당 의원은 8일 산업통상부와의 당정협의를 마치고 기자들과 만나 메가특구 특별법 입법 시점과 관련해 “정기국회 내에 대부분 처리한다는,2026-07-08 15:13,https://www.etoday.co.kr/news/view/2601621?trc=main_list_news,이투데이
"정청래 ""서남권 반도체 성공, 민주당이 속전속결 지원""",https://img.etoday.co.kr/crop/200/125/2356570.jpg,"'서남권 반도체 클러스터 성공을 위한 정책토론회' 개최 더불어민주당 당권주자인 정청래 전 대표가 정부의 3대 메가프로젝트인 서남권 반도체 클러스터의 성공을 위해 당 차원의 신속한 지원을 약속했다. 정 전 대표는 ""속전속결로 사업이 추진되도록 적극 협력하겠다""며 입법 지원 의지도 강조했다. 정 전 대표는 8일 국회 의원회관에서 열린 '서남권 반도체 클러스터 성공을 위한 정책토론회'에서 ""서남권 반도체 클러스터 메가프로젝트는 대한민국의 미래를 여는 핵심 동력""이라며 ""당에서도 적극 지원하고 사업이 지연돼 차질을 빚는 일이 없도록 속전",2026-07-08 11:38,https://www.etoday.co.kr/news/view/2601512?trc=main_list_news,이투데이
"정점식 ""원 구성 협조할 수 없어…중진 의견 수렴해 투쟁 방향 결정""",https://img.etoday.co.kr/crop/200/125/2354388.jpg,"""민주당, 대통령만 바라보는 정치 멈춰야""""'공소취소 특검법' 위해 법사위 독식""""계파가 다르다고 악수조차 하지 않아"" 정점식 국민의힘 원내대표는 더불어민주당의 후반기 국회 원 구성 강행과 관련해 ""민주당이 법제사법위원장을 고집하는 이유는 피고인 이재명의 재판을 없애기 위한 '공소취소 특검법'을 밀어붙이기 위한 것""이라며 ""현재와 같은 상황에서는 원 구성에 협조할 수 없다""고 밝혔다. 정 원내대표는 8일 매일신문 유튜브에 출연해 ""19대와 20대, 21대 후반기 국회까지 제1당은 국회의장, 제2당은 법사위원장을 맡아 견제와 균형을",2026-07-08 10:03,https://www.etoday.co.kr/news/view/2601457?trc=main_list_news,이투데이
