title,thumbnail,short_content,write_time,link,company
[오늘의 주요공시] KC코트렐·코오롱인더 등,https://img.etoday.co.kr/crop/200/125/2139058.jpg,"△KC코트렐, 83억 규모 영흥 6호기 전기집진기 방전극, 집진판 개선 공사 수주 △코오롱인더스트리, 보통주 1주당 1300원·우선주 1350원 현금 배당 결정 △한화솔루션, 보통주 1주당 300원·우선주 350원 현금 배당 결정 △일성아이에스, 보통주 1주당 1000원 현금 배당 결정 △제일엠앤에스, 지난해 영업손실 464억…전년비 적자 전환 △KH바텍, 지난해 영업익 218억…전년비 35%↓ △유아이엘, 21일 무상증자 권리락 발생…기준가 4380원 △아이티엠반도체, 종속사에 144억 규모 채무보증 결정",2025-02-20 18:05,https://www.etoday.co.kr/news/view/2446887?trc=main_list_news,이투데이
"저축은행중앙회, 회추위·선관위 구성…선거 일정 추후 논의",https://img.etoday.co.kr/crop/200/125/2131125.jpg,"저축은행중앙회는 20일 열린 이사회에서 차기 회장 선출을 위한 회장후보추천위원회와 선거관리위원회 구성을 의결했다고 밝혔다. 저축은행중앙회 회추위와 선관위는 각각 7명, 5명으로 구성된다. 선거 관련 일정은 추후 논의될 예정이다. 선거 일정이 확정되면 저축은행중앙회는 선거일 14일 전까지 입후보자를 공고한다. 선거 당일 79개 저축은행중앙회 회원이 모인 임시총회에서 투표를 통해 차기 회장을 선출한다.",2025-02-20 17:37,https://www.etoday.co.kr/news/view/2446870?trc=main_list_news,이투데이
"미래에셋증권, 3670억 원 주주환원 ‘역대 최대’… 기업가치 제고",https://img.etoday.co.kr/crop/200/125/2127220.jpg,"미래에셋증권이 역대 최대규모인 약 3670억 원의 주주환원을 단행한다. 미래에셋증권은 20일 이사회를 개최하고 배당 및 자사주 소각, 사내ㆍ사외이사 선임을 포함한 2024년 재무제표 승인 등을 의결했다고 밝혔다. 배당총액은 약 1467억 원(보통주 250원, 1우선주 275원, 2우선주 250원), 자사주 소각은 약 1369억 원(보통주 1500만 주, 2우선주 250만 주)을 결정했다. 지난해 11월 보통주 1000만 주 소각을 포함한 2024년 주주환원 규모는 총 3670억 원으로 주주환원성향은 약 39.8%다. 미래에셋증권은",2025-02-20 17:30,https://www.etoday.co.kr/news/view/2446877?trc=main_list_news,이투데이
"이지스자산운용, ‘오산세교2지구 공공지원 민간임대주택’ 본PF 모집 완료",https://img.etoday.co.kr/crop/200/125/2139030.jpg,"이지스자산운용은 ‘오산세교2지구 M1BL(블록) 공공지원 민간임대주택 사업’ 본프로젝트파이낸싱(PF) 모집을 완료했다고 20일 밝혔다. 이번 자금 조달에는 키움증권, 한국투자증권, 하나증권 등 3개 대형 증권사가 참여해 총 3480억 원 규모 민간 PF대출을 모집했다. 또 주택도시기금 임대주택건설자금대출 810억 원을 포함해 총 4280억 원 규모 사업비를 확보했다. 본PF 약정과 기표는 3월 중, 임차인 모집공고는 5월 중 진행할 예정이다. 해당 사업은 포스코이앤씨의 ‘더샵’ 브랜드로 시공되는 오산시 최초 초고층 주상복합으로 아",2025-02-20 16:58,https://www.etoday.co.kr/news/view/2446857?trc=main_list_news,이투데이
"PFCT, 작년 연계액 2.2조…“최대 성과”",https://img.etoday.co.kr/crop/200/125/2139022.jpg,"온라인투자연계금융 기업 피에프씨테크놀로지스(PFCT)가 지난해 역대 최대 성과를 거뒀다고 20일 밝혔다. PFCT 온투금융사업은 지난해 신규 대출-투자 연계액이 전년 대비 2배 이상 늘었고, 누적 연계액은 2조2300억 원이 넘었다. PFCT는 추가 외부 투자금 없이 손익분기점을 달성할 수 있는 재무안전성을 확보했다.",2025-02-20 16:51,https://www.etoday.co.kr/news/view/2446851?trc=main_list_news,이투데이
"[급등락주 짚어보기] 평화홀딩스, 김문수 테마주 대선 지지율 상승에 '上'",https://img.etoday.co.kr/crop/200/125/2138991.jpg,"20일 양대 지수에서 하한가 종목은 없었다. 한국거래소에 따르면 이날 코스피 시장에서 평화홀딩스(29.96%)와 YG PLUS(29.86%), 코스닥에서는 TS트릴리온(29.63%), 비엘팜텍(29.85%), 스튜디오미르(29.84%), 에이스토리(30.00), 엔에스이엔엠(29.95%), 클리노믹스(29.94%), 키이스트(29.78%), 판타지오(29.90%) 등 8개 종목이 상한가를 기록했다. 평화홀딩스는 평화산업과 함께 김문수 고용노동부 장관 테마주로 묶인다. 김문수 고용노동부 장관이 범보수 대선주자 적합도 조사에서 지지율",2025-02-20 16:17,https://www.etoday.co.kr/news/view/2446839?trc=main_list_news,이투데이
"한화생명 “이익 증가에도 배당 여력 감소, 제도 개선 공동 대응”",https://img.etoday.co.kr/crop/200/125/2113258.jpg,한화생명이 지난해 7200억 원이 넘는 당기순이익을 올렸지만 제도적인 문제로 배당을 하지 못하게 되자 업계와 공동 대응한다. 한화생명은 20일 열린 2024년 실적 발표 컨퍼런스콜에서 “상반기 내로 업계와 제도 개선안을 제출해 금융당국에 건의할 예정”이라며 이같이 밝혔다. 김동희 한화생명 재정팀장은 “해약환급금이 신계약 규모에 정비례해 증가함에 따라 적립 규모가 매년 증가하고 있고 다른 보험사도 상황이 비슷하다”며 “이익이 증가해도 배당 여력 감소와 세무 이슈 등이 지속해서 발생할 우려가 있어 합리적인 제도 개선이 필요한 상황임을,2025-02-20 16:08,https://www.etoday.co.kr/news/view/2446815?trc=main_list_news,이투데이
"금융투자협회, 자산운용사 6곳 정회원 승인",https://img.etoday.co.kr/crop/200/125/2138985.jpg,"금융투자협회는 20일 개최된 이사회에서 6개 금융투자회사에 대해 정회원 전환 및 신규가입을 승인했다고 밝혔다. 이날 이사회에서 케이원자산운용은 기존 준회원에서 정회원으로 전환됐다. 선스피어자산운용, 아크로스자산운용, 크리에이트자산운용, 페어필드자산운용, 현대하임자산운용 등 5개사는 정회원으로 가입됐다. 금투협 정회원은 총회 출석 권한과 의결권을 가지며, 각종 회의체에 참여해 시장과 산업 전반에 대한 법령·제도 개선, 규제 완화 등에 대해 의견을 낼 수 있다. 또 홍보, 공시·통계, 광고·약관 심사, 전문인력 등록·관리 등에 대한",2025-02-20 15:59,https://www.etoday.co.kr/news/view/2446831?trc=main_list_news,이투데이
"[장외시황] 대진첨단소재, 공모주 청약 시작",https://img.etoday.co.kr/crop/200/125/2138972.jpg,20일 비상장 주식시장은 호가 변화가 없었다. 38커뮤니케이션에 따르면 이차전지 공정용 화재 및 대전 방지 전문기업 대진첨단소재는 이날부터 이틀간 일반투자자 대상 공모주 청약을 시작했다. 대진첨단소재 공모가는 희망 범위를 밑도는 9000원으로 확정됐다. 글로벌 종합보증회사 서울보증보험과 이치전지 드라이룸 전문업체 씨케이솔루션은 이날부터 26일까지 기관투자자 대상 수요예측을 진행한다. 히알루론산(HA)필러 및 의료기기 제조기업 아크로스는 전 거래일보다 3.12% 상승한 호가 16만5000원을 기록했다. 양극소재 제조 전문업체 에스엠,2025-02-20 15:50,https://www.etoday.co.kr/news/view/2446824?trc=main_list_news,이투데이
[종합] 코스피 2650선으로 후퇴…코스닥 1%대 하락,https://img.etoday.co.kr/crop/200/125/2138965.jpg,"19일까지 7거래일 연속 상승하던 코스피가 20일 조정 받으며 2650선으로 내려왔다. 이날 코스피 지수는 전일 대비 17.46포인트(0.65%) 내린 2654.06에 마감했다. 코스피는 장중 한때 25.99포인트(0.97%) 하락한 2645.53까지 밀리기도 했다. 외국인과 기관이 각각 2704억 원, 1211억 원 순매도하며 지수를 끌어내렸다. 개인은 2979억 원어치를 순매수했다. 업종별로는 전기·가스(2.66%), 통신(2.09%), 오락·문화(1.62%), 금속(1.56%) 등이 상승했고 운송장비·부품(-2.71%), 보",2025-02-20 15:42,https://www.etoday.co.kr/news/view/2446818?trc=main_list_news,이투데이
[속보] 코스피 17.46p(0.65%) 내린 2654.06(마감),https://img.etoday.co.kr/crop/200/125/1990411.jpg,,2025-02-20 15:34,https://www.etoday.co.kr/news/view/2446811?trc=main_list_news,이투데이
[속보] 코스닥 10.00p(1.28%) 내린 768.27(마감),https://img.etoday.co.kr/crop/200/125/1990411.jpg,,2025-02-20 15:33,https://www.etoday.co.kr/news/view/2446809?trc=main_list_news,이투데이
"KB국민카드, 저소득 가정 예비 초등학생에 책가방 선물",https://img.etoday.co.kr/crop/200/125/2138937.jpg,KB국민카드는 20일 서울 종로구 ‘한국불교역사문화기념관’에서 다음 달 초등학교 입학을 앞둔 예비초등학생 2124명에게 총 2억 원 상당의 책가방 선물세트를 전달했다고 밝혔다. KB국민카드는 2015년부터 재단법인 ‘아름다운 동행’ 과 협력해 저소득 가정 아동들에게 매년 책가방 선물세트를 지원하고 있다. 지금까지 2만1000여 명의 어린이에게 총 15억 원 상당의 물품을 전달했다. KB국민카드 관계자는 “지속적인 미래세대 지원으로 상생과 돌봄의 가치를 실현하기 위해 노력할 것”이라고 말했다.,2025-02-20 15:19,https://www.etoday.co.kr/news/view/2446787?trc=main_list_news,이투데이
"우리은행, 21일부터 '유주택자 수도권 주담대' 재개",https://img.etoday.co.kr/crop/200/125/2125717.jpg,우리은행이 유주택자의 수도권 추가 주택 구입을 위한 대출 취급을 다시 시작한다. 전세대출 취급제한을 푼 데 이은 추가 완화 조치다. 20일 금융권에 따르면 우리은행은 이달 21일부터 주택을 1채 이상 보유한 유주택자 고객의 서울 등 수도권 주택 구입 목적 주담대 취급을 재개한다. 우리은행은 지난해 9월 가계부채 관리를 이유로 유주택자의 수도권 주담대 및 전세대출 취급을 중단했다. 그러나 올해 초부터 은행들이 취급할 수 있는 가계대출 총량이 재설정되자 대출 제한 조치를 완화하고 있다. 우리은행은 지난달 2일 유주택자에 대한 전세대출,2025-02-20 15:17,https://www.etoday.co.kr/news/view/2446768?trc=main_list_news,이투데이
"[특징주] 조선주, 대장주 한화오션 “밸류에이션 과도” 투자의견 하향에 급락",https://img.etoday.co.kr/crop/200/125/2138733.jpg,"국내 조선주 밸류에이션이 과도하다는 증권가 의견에 20일 조선주가 일제히 약세다. 조선주들은 최근 일제히 주가가 급등해왔다. 이날 오후 2시 31분 한화오션은 전일보다 6.65%(5200원) 내린 7만3000원에 거래 중이다. 같은 시각 삼성중공업(-7.40%), HD현대중공업(-10.66%), HD한국조선해양(-8.37%), HD현대마린솔루션(-9.85%) 등도 일제히 내림세다. 한국투자증권은 한화오션에 대해 밸류에이션 문제로 상승 여력이 부족하다며 투자의견을 기존 '매수'에서 '중립'으로 하향한다고, 목표주가는 제시하지 않는다",2025-02-20 14:36,https://www.etoday.co.kr/news/view/2446772?trc=main_list_news,이투데이
[특징주] 中 한한령 해제 기대에 면세株 상승,https://img.etoday.co.kr/crop/200/125/2138911.jpg,"중국 한류제한령(한한령)이 해제될 수 있다는 기대감이 커지며 면세점 관련주가 강세다. 20일 오후 2시 18분 현재 호텔신라는 전 거래일보다 4.38% 오른 4만1750원에 거래되고 있다. 같은 시간 호텔신라우는 7.37% 상승한 3만4250원에 거래 중이다. 신세계(4.94%), 파라다이스(3.94%), 현대백화점(2.77%) 등 면세점 사업을 하는 상장사 주가도 오르고 있다. 전날 중국중앙TV(CCTV)에 따르면 중국 국무원 판공청은 상무부와 국가발전개혁위원회가 마련한 ‘2025년 외국인 투자 안정 행동계획’을 발표했다. 행동",2025-02-20 14:32,https://www.etoday.co.kr/news/view/2446770?trc=main_list_news,이투데이
"이복현 ""공매도 新시스템, 불법거래 99% 차단할 수 있다""",https://img.etoday.co.kr/crop/200/125/2138891.jpg,"'증시 인프라 개선을 위한 열린 토론회’서 자신 잔고관리 시스템 신설 종목별 실시간 잔고정보 보고체계 구축 이복현 금융감독원장이 내달 31일 공매도 재개를 앞두고 철저한 준비를 약속했다. 공매도의 투명성과 공정성에 대해 개인 투자자들의 불안감이 큰 상황에서 구체적인 프로세스를 제시해, 리스크를 최소화할 방침이다. 이 원장은 20일 한국거래소에서 진행한 ‘증시 인프라 개선을 위한 열린 토론’회에서 “종전에 진행했던 무차입 공매도 건에 대한 점검 조사는 내달 중 마무리할 것""이라며 “이번에 새롭게 구축된 시스템을 활용해 시뮬레이션해",2025-02-20 14:13,https://www.etoday.co.kr/news/view/2446758?trc=main_list_news,이투데이
[종합] 코스피 2650선 약세…외인·기관 ‘팔자’,https://img.etoday.co.kr/crop/200/125/2138895.jpg,"코스피가 20일 장중 외국인과 기관의 5000억 원 규모 매도세에 약세를 나타내고 있다. 이날 오후 1시 56분 현재 코스피 지수는 전일 대비 17.06포인트(0.64%) 내린 2654.46에 거래되고 있다. 코스피는 장중 한때 21.06포인트(0.79%) 내린 2650.46을 기록하기도 했다. 외국인, 기관이 각각 2972억 원, 2092억 원 순매도하며 지수를 끌어내리고 있다. 개인은 4267억 원 순매수하고 있다. 업종별로는 전기·가스(2.50%), 통신(1.48%), 금속(1.45%), 오락·문화(1.31%) 등이 오르고",2025-02-20 14:06,https://www.etoday.co.kr/news/view/2446752?trc=main_list_news,이투데이
수성웹툰 “중국어 회원 300만ㆍ페이지뷰 5200만 돌파…한한령 해제 수혜 기대”,https://img.etoday.co.kr/crop/200/125/2138415.jpg,"수성웹툰이 한한령 해제 분위기에 힘입어 중국 시장에서 빠른 성장세를 기대하고 있다. 20일 수성웹툰 관계자는 “작년 한 해 동안 중국어 페이지뷰는 5200만을 돌파하며 현지 사용자들의 높은 관심을 확인할 수 있었다”며 “작년 연말 기준 수성웹툰의 중국어 회원 수는 289만 명에 달하며, 올해 안에 300만 명을 돌파할 것으로 예상된다”고 밝혔다. 이어 “이는 한한령 해제 이후 중국 시장의 회복세와 당사의 전략적인 콘텐츠 공급이 맞물리면 이용자층이 빠르게 확대될 수 있음이 기대되는 대목”이라고 덧붙였다. 특히 수성웹툰의 자회사인 테",2025-02-20 12:54,https://www.etoday.co.kr/news/view/2446721?trc=main_list_news,이투데이
"금감원, 24일부터 감독 업무설명회",https://img.etoday.co.kr/crop/200/125/2138104.jpg,"금융감독원은 이달 24일부터 다음 달 12일까지 부문별 금융감독 업무설명회를 개최한다고 20일 밝혔다. 금감원은 감독·검사 방향과 최근 현안에 대한 추진계획 등을 설명하고, 금융업계 및 학계 관계자 등의 의견을 청취한다. 업무설명회는 24일 금융투자 부문을 시작으로 27일 디지털·IT 부문, 3월 4일 소비자보호 부문, 5일 보험, 중소금융 부문, 11일 은행 부문, 12일 연금 부문 순으로 열린다. 금감원은 설명회 현장을 녹화해 3월 중 유튜브, 블로그 등에 공개할 계획이다.",2025-02-20 12:00,https://www.etoday.co.kr/news/view/2446644?trc=main_list_news,이투데이
"토마토시스템, 퓨리오사AI 지분투자 이어 티온 인수로 AI 사업 확대",https://img.etoday.co.kr/crop/200/125/2138829.jpg,"토마토시스템이 메타 공식 등록 확장현실(XR) 기반헬스케어 솔루션으로 국내 및 미국 특허를 다수 보유하고 있는 ‘티온(T-ON)’을 인수했다. 또 메타가 인수 협상중인 것으로 알려진 퓨리오사AI에도 투자해 지분을 보유중인 토마토시스템은 인공지능(AI) 디지털 헬스케어 솔루션 사업을 확대한다는 계획이다. 토마토시스템은 XR 기반 AI 디지털 헬스케어 솔루션 티온을 인수했다고 20일 밝혔다. 이번 인수는 디지털 헬스케어 사업의 다각화 및 글로벌 경쟁력 강화를 위한 전략적 결정으로, 토마토시스템은 미국 법인에서 운영중인 ‘사이버엠디케어",2025-02-20 11:31,https://www.etoday.co.kr/news/view/2446708?trc=main_list_news,이투데이
‘증시 인프라 개선 관련 열린 토론회’ [포토],https://img.etoday.co.kr/crop/200/125/2138824.jpg,"이복현 금융감독원장, 김근익 한국거래소 시장감시위원장, 김학수 넥스트레이드 대표 등이 참석한 가운데 20일 서울 여의도 한국거래소에서 ‘증시 인프라 개선 관련 열린 토론회’가 열렸다.",2025-02-20 11:23,https://www.etoday.co.kr/news/view/2446707?trc=main_list_news,이투데이
삼성증권 “온라인 금융상품 거래하고 순금 1돈 받으세요”,https://img.etoday.co.kr/crop/200/125/2138816.jpg,"삼성증권은 금융상품 온라인 거래 고객을 대상으로 상품권 최대 20만 원과 금 1돈(추첨 3명)을 지급하는 이벤트를 3월 말까지 진행한다고 20일 밝혔다. 해당 이벤트는 기간 내 채권, 펀드, 주가연계증권(ELS, ELB·DLS·DLB 포함)을 온라인으로 500만 원 이상 순매수하고 5월 30일까지 총 잔고 1억 원을 유지하는 전원에게 상품권을 지급한다. 500만원 이상 1000만원 미만 순매수하면 상품권 1만 원을 지급한다. 단계별로 3억 원 이상 순매수하면 상품권 10만 원을 지급한다. 연금저축 종합자산관리계좌(CMA) 내에서는",2025-02-20 11:21,https://www.etoday.co.kr/news/view/2446706?trc=main_list_news,이투데이
"LS증권, 리테일 고객 대상 '투자 세미나' 성료…매월 개최 예정",https://img.etoday.co.kr/crop/200/125/2138788.jpg,"LS증권은 18일 서울 여의도 본사에서 리테일 고객을 대상으로 올해 첫 세미나를 개최했다고 20일 밝혔다. 이번 세미나는 최근 증시 불확실성이 확대되는 가운데 고객들에게 다양한 정보와 투자 방향을 소개하기 위해 마련됐다. 1부에서는 최광혁 LS증권 리서치센터장이 ‘2025년 경제 및 환율 전망’을 주제로, 2부에서는 염승환 LS증권 이사가 ‘트럼프 스톰, 위기가 아닌 기회’를 주제로 발표를 진행했다. LS증권은 이번 세미나를 시작으로 매월 리테일 고객 대상 세미나를 진행한다는 계획이다. 세미나 일정 및 주제는 LS증권 홈페이지,",2025-02-20 10:38,https://www.etoday.co.kr/news/view/2446682?trc=main_list_news,이투데이
"무디스, LG전자 신용등급 전망 '긍정적' 상향…2021년 이후 4년만",https://img.etoday.co.kr/crop/200/125/2123824.jpg,"국제신용평가기관 무디스는 전일(현지시간) LG전자 신용등급 전망을 기존 '안정적'에서 '긍정적'으로 상향 조정했다고 밝혔다. 무디스가 LG전자 신용등급 및 전망을 조정한 것은 2021년 이후 4년 만이다. 신용등급은 Baa2를 유지했다. '긍정적' 신용등급 전망은 현재 회사 사업구조와 재무 상황 등을 고려했을 때 향후 신용등급이 Baa1으로 상향될 가능성이 높다고 전망된다는 의미다. LG전자가 안정적 수익창출 능력을 바탕으로 재무구조를 안정적으로 관리하고 있다고 진단했다. 무디스는 등급 전망 상향 조정 이유로 ""올해 관세 인상과",2025-02-20 10:17,https://www.etoday.co.kr/news/view/2446671?trc=main_list_news,이투데이
"지앤지유니버스, 중국인 동포 대상 프랜차이즈 ‘리유바오 소한마리’ 런칭",https://img.etoday.co.kr/crop/200/125/2138757.jpg,"지앤지유니버스는 중국인 동포를 대상으로 하는 프랜차이즈 ‘리유바오 소한마리’ 브랜드를 런칭했다고 20일 밝혔다. ‘리유바오 소한마리’는 중국인 동포 타운을 공략하는 브랜드로, 주로 소의 특수부위를 활용한 전골 메뉴를 판매한다. 강예 지앤지유니버스 대표는 이번 브랜드 론칭에 대해 “한국과 해외에 거주하는 중국인 동포들이 즐길 수 있는 음식점이나 메뉴가 한정적이라는 점에 주목했다”며 “중국인 동포 타운 내에서 블루오션 시장성을 확인하고, 그들이 원하는 메뉴와 맛, 식자재를 적절히 반영한 전문 프랜차이즈가 필요하다고 판단했다”고 설명했",2025-02-20 10:08,https://www.etoday.co.kr/news/view/2446668?trc=main_list_news,이투데이
"뮤직카우, 신규 회원 저작권료 2배 이벤트…연이은 신규 옥션 소개",https://img.etoday.co.kr/crop/200/125/2138758.jpg,"뮤직카우는 음악증권을 첫 구매한 신규 회원을 대상으로 저작권료를 2배로 지급하는 이벤트를 진행한다고 20일 밝혔다. 뮤직카우 신규 회원은 가입 즉시 뮤카 포인트 5000p를 받을 수 있다. 뮤카 포인트는 신규 음악증권이 최초로 공개되는 옥션이나, 사용자 간 자유롭게 음악증권을 거래하는 마켓에서 활용할 수 있다. 가입 당월에 음악증권 첫 구매까지 마친 신규 회원에겐 저작권료 2배 지급(최대 지급 한도 1만 원) 혜택도 제공한다. 저작권료 2배 혜택은 가입 월에 구매 후 익월 정산되는 저작권료 기준으로 현금 지급되며, 저작권료 정산",2025-02-20 10:06,https://www.etoday.co.kr/news/view/2446667?trc=main_list_news,이투데이
이복현 “공매도 전산화ㆍ대체거래소 출범…국내 시장 매력도 제고”,https://img.etoday.co.kr/crop/200/125/2138807.jpg,"이복현 금융감독원장은 20일 “공매도 전산화는 세계최초로 시도되는 글로벌 민관협력 체계로 우리 자본시장의 신뢰도를 제고시킬 것으로 기대한다”고 강조했다. 이 원장은 이날 여의도 한국거래소에서 열린 ‘공매도 전산화 및 대체거래소 출범 등 인프라 개선에 대한 2차 열린 토론’에서 이같이 밝혔다. 열린 토론은 자본시장 선진화를 지속 추진하기 위해 금감원이 진행중인 시리즈 토론회다. 증시 활성화, 증시 인프라, 주주·기업 동반성장 등 3차에 걸쳐 진행한다. 이날 토론회는 김근익 한국거래소 시장감시위원장, 김학수 넥스트레이드 대표 등 금융",2025-02-20 10:00,https://www.etoday.co.kr/news/view/2446596?trc=main_list_news,이투데이
"엔에스이엔엠 자회사, 비덴트 인수 추진…“가상자산 시장 진출”",https://img.etoday.co.kr/crop/200/125/2138747.jpg,종합 엔터테인먼트기업 엔에스이엔엠 산하 레이블 법인 매시브이엔씨가 코스닥 상장사 비덴트 인수전에 나서면서 가상자산사업에 전격 뛰어든다. 매시브이엔씨는 지난 13일 비덴트 측과 인수를 위한 실사 계약를 체결하고 실사보증금 100억 원을 예치했다고 20일 밝혔다. 회사는 엔에스이앤엠이 지분 85%를 보유한 자회사다. 국내 가상자산 거래소 빗썸의 최대주주는 지분율 73%를 보유하고 있는 지주사 빗썸홀딩스이며 비덴트는 빗썸홀딩스 지분 34%를 확보한 단일 최대주주다. 빗썸코리아의 지분도 10% 보유하고 있다. 비덴트는 지난 4일 주주간담,2025-02-20 09:57,https://www.etoday.co.kr/news/view/2446659?trc=main_list_news,이투데이
"DB금융투자, ‘DB W 아들 딸 독립만세 증여랩 1호’ 출시 기념 이벤트",https://img.etoday.co.kr/crop/200/125/2138743.jpg,"DB금융투자는 ‘DB W 아들 딸 독립만세 증여랩 1호’ 상품을 출시한 기념으로 28일까지 영업점 개인고객을 대상으로 가입 이벤트를 실시한다고 20일 밝혔다. ‘DB W 아들 딸 독립만세 증여랩 1호’는 사전 증여 솔루션을 통해 자녀에게 빠른 증여로 절세 효과를 증대시키고 전문가의 안정적인 투자관리를 통해 장기적으로 이익을 쌓아 가는 상품으로 자녀들에게 사전에 증여한 자산을 투자하는 랩어카운트 서비스이다. 미성년 자녀에게는 부모가 10년마다 2000만 원까지, 성년 자녀에게는 5000만 원까지 세금 없이 증여가 가능하며, 투자로",2025-02-20 09:51,https://www.etoday.co.kr/news/view/2446655?trc=main_list_news,이투데이
