title,thumbnail,short_content,write_time,link,company
서울 호텔시장 회복 넘어 성장 국면⋯객실 매출 67%↑,https://img.etoday.co.kr/crop/200/125/2356739.jpg,서울 호텔 시장이 역대 최대 수준의 외국인 관광객 유입과 제한적인 신규 공급에 힘입어 단기 회복을 넘어 구조적 성장 국면에 진입했다는 분석이 나왔다. 글로벌 상업용 부동산 서비스 기업 쿠시먼앤드웨이크필드 코리아는 '2026 서울 호텔 마켓 리포트'를 통해 서울 호텔 시장이 강한 인바운드 수요와 공급 부족을 바탕으로 높은 수익성을 이어가고 있다고 8일 밝혔다. 보고서에 따르면 지난해 방한 외래객은 1894만명을 기록하며 역대 최고치를 경신했다. 이는 2019년 대비 회복률 108%로 글로벌 평균(104%)을 웃도는 수준이다. 중국,2026-07-08 15:50,https://www.etoday.co.kr/news/view/2601653?trc=main_list_news,이투데이
"서울시 ""GTX-A 철근누락, 국토부 보고절차 따랐다""",https://img.etoday.co.kr/crop/200/125/2338060.jpg,"‘서울시→철도공단→국토부’⋯직통 아닌 단계별 전달 “보고 지연, 절차 누락 아닌 보고체계 작동 문제” 서울시는 GTX-A 삼성역 영동대로 지하공간 복합개발 3공구에서 발생한 철근 누락 보고 지연 사태가 국가철도공단 중심의 보고체계에서 비롯된 것이라고 8일 밝혔다. 아울러 국토교통부가 정한 공식 보고 절차에 따라 국가철도공단에 관련 내용을 정상적으로 통보해 왔다고 강조했다. 국토교통부는 2023년 1월 11일 ‘GTX 삼성역 구간 공정관리 관련 보고체계’를 마련했다. 해당 공문에 따르면 서울시는 월간 건설사업관리보고서를 철도공단에",2026-07-08 15:42,https://www.etoday.co.kr/news/view/2601639?trc=main_list_news,이투데이
5조원 투입 차세대 KTX 도입…2032년부터 순차 운행,https://img.etoday.co.kr/crop/200/125/2356694.jpg,"좌석 1000석으로 확대…안전·에너지 효율도 강화 2033년 기대수명이 끝나는 KTX-1을 대체할 차세대 고속열차 도입 사업이 본격 추진된다. 정부는 약 5조원을 투입해 시속 320㎞급 고속열차 49편성을 도입하고, 고속철도 좌석 공급 확대와 안전성 강화에 나설 계획이다. 한국철도공사(코레일)는 '차세대 고속열차 도입 사업'이 기획재정부 공공기관 사업 예비타당성조사를 최종 통과했다고 8일 밝혔다. 이번 사업은 2033년 설계수명이 도래하는 KTX-1 46편성을 적기에 교체하고 안정적인 고속철도 운영 체계를 구축하기 위해 추진됐다.",2026-07-08 15:07,https://www.etoday.co.kr/news/view/2601620?trc=main_list_news,이투데이
1년 새 9.5% 뛴 아파트 분양가…6월 평당 857만원 '역대 최고',https://img.etoday.co.kr/crop/200/125/2356610.jpg,"'드파인 아르티아' ㎡당 3300만원대 경기·부산·인천 국민평형 역대 최고 수준 지방선거 이후 공급재개…6월 분양 전월 2배 지난달 전국 민간 아파트 분양가가 또 다시 역대 최고치를 경신했다. 국민평형(전용면적 84㎡) 기준 분양가는 경기·부산·인천이 각각 최고치를 다시 썼다. 8일 분양평가 전문회사 리얼하우스가 청약홈 자료를 분석한 결과 6월 전국 민간 아파트의 전용면적 기준 ㎡당 평균 분양가는 857만원(12개월 이동평균)으로 집계됐다. 전월(855만원)보다 0.25%, 지난해 같은 달(783만원)보다 9.46% 상승하며 관련",2026-07-08 13:59,https://www.etoday.co.kr/news/view/2601559?trc=main_list_news,이투데이
"현대엔지니어링, 美 리튬·붕소 프로젝트 참여…북미 핵심광물 시장 공략",https://img.etoday.co.kr/crop/200/125/2356617.jpg,"3조원 규모 '라이올라이트 릿지 프로젝트' 업무협약 현대엔지니어링이 미국 리튬·붕소 개발 프로젝트에 참여하며 북미 핵심광물 플랜트 시장 공략에 나선다. 현대엔지니어링은 미국 워싱턴 D.C.에서 호주 핵심광물 개발사 아이오니어(Ioneer)가 추진하는 '라이올라이트 릿지(Rhyolite Ridge) 리튬·붕소 프로젝트'의 구매(Procurement) 업무 수행을 위한 업무협약(MOU)을 체결했다고 8일 밝혔다. 이번 협약은 6월 양사가 체결한 참여의향서(LOI)를 구체화한 것으로, 현대엔지니어링의 프로젝트 참여가 본격화됐다는 데 의",2026-07-08 13:19,https://www.etoday.co.kr/news/view/2601550?trc=main_list_news,이투데이
"동부건설, 라오스 메콩강변 정비사업 준공",https://img.etoday.co.kr/crop/200/125/2356609.jpg,"동부건설은 라오스 ‘메콩강 종합관리사업 2차 건설공사’를 성공적으로 준공했다고 8일 밝혔다. 이번 사업은 라오스 수도 비엔티안의 메콩강변 일대를 정비해 홍수와 하천 침식 피해를 예방하고, 시민 생활환경과 도시 기반시설을 개선하기 위해 추진된 공적개발원조 기반 인프라 프로젝트다. 사업 구간에는 메콩강변 제방 축조와 호안 정비 9.3㎞, 강변공원 4.3㏊, 강변도로 4.4㎞, 보행로 1.01㎞ 등이 조성됐다. 발주처는 라오스 비엔티안시 공공사업교통국이며 사업 재원은 대외경제협력기금(EDCF)을 통해 마련됐다. 동부건설은 60% 지분으",2026-07-08 13:07,https://www.etoday.co.kr/news/view/2601544?trc=main_list_news,이투데이
"이성훈 LH 사장, 첫 현장으로 서리풀行…""착공 1년 이상 앞당겨라""",https://img.etoday.co.kr/crop/200/125/2356604.jpg,"이성훈 한국토지주택공사(LH) 사장이 취임 후 첫 현장 행보로 서울 서초구 서리풀 공공주택지구를 찾아 주택공급 추진 상황을 점검했다. 이 사장은 현장에서 당초 계획보다 주택 착공 일정을 1년 이상 앞당기라고 지시했다. LH는 이 사장이 8일 서울 서초구 서리풀 1·2지구를 방문해 사업 추진 현황과 일정, 현안 사항 등을 점검했다고 밝혔다. 서리풀지구는 서울권 주택공급 확대의 상징적 사업지로 꼽힌다. 2월 지정된 서리풀 1지구 1만8000가구와 6월 지정된 2지구 2000가구를 합쳐 최대 2만 가구 공급이 예정돼 있다. LH는 이달",2026-07-08 12:51,https://www.etoday.co.kr/news/view/2601538?trc=main_list_news,이투데이
"당정 ""2028년부터 자산 10조 코스피 상장사 ESG 공시 의무화""",https://img.etoday.co.kr/crop/200/125/2356581.jpg,"연내 자본시장법 개정 추진…‘법정 의무’로 2028년 자산 10조 이상 상장사 첫 적용 당정 “초기 3년 착오·오류는 포괄 면책” 협력사 배출량 공시는 3년 유예 두기로 2028년부터 연결 자산총액 10조 원 이상 코스피 상장사 100여곳이 기후 관련 정보를 의무적으로 공개하는 지속가능성 공시(ESG 공시) 대상이 된다. 역대 정부가 방향만 잡고 결론을 미뤄온 제도로, 적용 대상은 2029년 5조 원 이상, 2030년 2조 원 이상으로 단계적으로 넓어진다. 당정은 8일 국회 의원회관에서 지속가능성 공시 제도화 당정협의를 열고 이",2026-07-08 11:34,https://www.etoday.co.kr/news/view/2601523?trc=main_list_news,이투데이
"대우건설, 이라크 알포 신항 연결도로 최종 준공",https://img.etoday.co.kr/crop/200/125/2356536.jpg,"대우건설은 이라크 항만청으로부터 알포 신항 연결도로 사업의 최종 준공했다고 8일 밝혔다. 이번 사업은 이라크 남부 알포 신항과 움카스르를 연결하는 총연장 62㎞ 규모의 고속도로 건설 프로젝트다. 총 공사금액은 4억4000만달러이며 설계·시공 일괄 방식으로 대우건설이 단독 수행했다. 대우건설은 2021년 8월 공사를 시작해 2025년 5월까지 45개월간 공사를 진행했다. 이후 1년여의 하자보수기간을 거쳐 최종 준공에 이르렀다. 연결도로는 왕복 4차선 고속도로와 교량 2곳, 인터체인지 1곳, 회전교차로 3곳으로 구성됐다. 알포 신항과",2026-07-08 10:35,https://www.etoday.co.kr/news/view/2601485?trc=main_list_news,이투데이
"현대건설, ‘저탄소 콘크리트’ 녹색기술 인증",https://img.etoday.co.kr/crop/200/125/2356491.jpg,HMG건설기술연구원ㆍ삼표산업 공동 개발⋯탄소배출 55% 감축 현대건설이 저탄소 건설 소재 개발과 순환자원 활용 확대를 통해 현장의 탄소 저감 기술 상용화에 속도를 내고 있다. 현대건설은 콘크리트 양생 과정의 에너지 사용을 줄이는 '조강형 콘크리트 적용 공정 기술(조강 콘크리트 기술)'이 국가 녹색기술 인증을 획득했다고 8일 밝혔다. 녹색기술 인증은 저탄소 녹색성장 기본법에 따라 국토교통부 등 9개 관계 부처와 국토교통과학기술진흥원 등 11개 평가기관이 공동 운영하는 국가 인증 제도다. 기술의 전 생애주기에서 에너지와 자원 사용 절,2026-07-08 09:53,https://www.etoday.co.kr/news/view/2601442?trc=main_list_news,이투데이
"DL이앤씨, 신용평가 3사서 최고 수준 등급 유지⋯기업어음 A1 획득",https://img.etoday.co.kr/crop/200/125/2356438.jpg,"DL이앤씨가 국내 주요 신용평가사들로부터 건설업계 최고 수준의 신용등급을 유지한 데 이어 기업어음(CP) 최고 등급인 A1을 획득하며 재무안정성을 다시 인정받았다. DL이앤씨는 나이스신용평가와 한국기업평가로부터 회사채 신용등급 'AA-(안정적)'를 유지했고, 한국신용평가로부터 기업어음 최고 등급인 'A1'을 획득했다고 8일 밝혔다. 신용평가사들은 공통적으로 주택부문 원가율 개선에 따른 수익성 회복과 안정적인 현금창출력을 긍정적으로 평가했다. 나이스신용평가는 다각화된 사업 포트폴리오와 우수한 사업경쟁력, 안정적인 사업기반을 강점으로",2026-07-08 09:27,https://www.etoday.co.kr/news/view/2601393?trc=main_list_news,이투데이
[아파트값 상승 톱10] 서울 서초구 ‘반포르엘’ 등,https://img.etoday.co.kr/crop/200/125/2356375.jpg,부동산 플랫폼 호갱노노에 따르면 7일 신고일 기준 전국 아파트 가운데 실거래가 상승 폭이 가장 컸던 단지는 서울 서초구 ‘반포르엘’로 나타났다. 이 단지는 69억원에 거래되며 직전 거래 대비 13억원(23%) 상승했다. 2위는 서울 서초구 ‘상지리츠빌’로 23억5000만원에 실거래되며 10억8000만원(85%) 올랐다. 3위는 마포구 ‘마포보성’으로 16억원에 거래되며 10억원(166%) 상승한 것으로 집계됐다. 이어 서울 서초구 ‘래미안원베일리’가 65억원에 거래되며 직전 거래 대비 17% 올라 4위를 기록했고 강남구 ‘개포우성,2026-07-08 08:30,https://www.etoday.co.kr/news/view/2601326?trc=main_list_news,이투데이
전세사기 피해자 548건 추가 인정⋯공동담보 피해자 지원 강화,https://img.etoday.co.kr/crop/200/125/2356301.jpg,"국토교통부가 지난달 전세사기 피해자 등 548건을 추가 인정했다. 한국토지주택공사(LH)의 전세사기 피해주택 매입은 누적 9707가구를 기록했다. 국토부는 이달부터 공동담보 피해자에 대한 경매차익 일부 선지급도 시행한다. 8일 국토부에 따르면 전세사기피해지원위원회는 지난달 10일과 17일, 24일 세 차례 전체회의를 열고 총 1409건을 심의했다. 이 가운데 548건을 전세사기 피해자 등으로 최종 가결했다. 가결 건수 중 505건은 신규 신청(재신청 포함)이며 43건은 기존 결정에 이의신청을 제기한 뒤 전세사기피해자법상 요건 충족",2026-07-08 06:00,https://www.etoday.co.kr/news/view/2601258?trc=main_list_news,이투데이
[오늘의 청약 일정] ‘드파인아르티아’ 당첨자 발표 등,https://img.etoday.co.kr/crop/200/125/2356179.jpg,"부동산 정보업체 부동산114에 따르면 8일인 오늘은 경남 김해시 ‘트리븐김해’가 2순위 청약 접수를 받는다. 당첨자 발표는 경남 밀양시 ‘밀양수자인더퍼스트(2단지) 공공분양’, 서울 동작구 ‘드파인아르티아’, 성북구 ‘장위푸르지오마크원’ 등에서 진행된다.",2026-07-08 06:00,https://www.etoday.co.kr/news/view/2601160?trc=main_list_news,이투데이
'막차 계약' 몰린 동탄⋯규제 이후 관망세 짙어졌다,https://img.etoday.co.kr/crop/200/125/2356310.jpg,"규제 발표일 계약 192건 급증 최근 신고·신고가 거래는 감소 개발 호재에 가격 하락 제한적 ""6월 초처럼 거래가 활발한 분위기는 아닙니다. 당분간은 관망세가 이어질 것으로 보고 있습니다."" 정부가 경기 화성 동탄구를 규제지역으로 지정하고 토지거래허가구역으로 묶으면서 과열 양상을 보이던 동탄 부동산 시장이 숨 고르기에 들어가는 모습이다. 규제 발표 직전에는 이른바 '막차 계약'이 몰렸지만 시행 이후에는 거래가 주춤한 분위기다. 다만 수도권광역급행철도(GTX)-A와 삼성전자 국가산업단지, 동탄 트램 등 개발 호재가 여전해 가격이 떨",2026-07-08 06:00,https://www.etoday.co.kr/news/view/2601149?trc=main_list_news,이투데이
가덕도신공항 덮친 공사비 갈등…연내 착공 변수 되나,https://img.etoday.co.kr/crop/200/125/2282880.jpg,지역 건설사 13곳 공동 탄원서…공사비 현실화 요구 입찰공고 후 중동전쟁 탓에 건설공사비 급등 컨소시엄 탈퇴 가능성까지…연내 착공 부담 커져 전문가 “공사비 협의 길어지면 착공 일정 영향” 가덕도신공항 부지조성공사의 착공 일정에 지역 건설사들의 공사비 반발이 변수로 떠올랐다. 대우건설 컨소시엄에 참여한 부산·경남 지역 건설사들이 유류비와 원자잿값 상승을 이유로 공사비 현실화를 요구하고 나서면서다. 탈퇴 가능성까지 거론되면서 컨소시엄 운영과 후속 일정에 차질이 생길 수 있다는 우려가 나온다. 7일 건설업계에 따르면 대우건설 컨소시엄,2026-07-07 17:00,https://www.etoday.co.kr/news/view/2600695?trc=main_list_news,이투데이
"현대건설, 5000억 전환사채 조달⋯“SMR 등 미래 성장사업 투자”",https://img.etoday.co.kr/crop/200/125/2356217.jpg,표면·만기금리 0% 조건⋯장기 자금 확보 신용 경쟁력 제고⋯원전·SMR 투자 확대 현대건설이 5000억원 규모의 전환사채(CB) 발행을 완료했다고 7일 밝혔다. 이번 CB는 표면금리와 만기금리가 모두 0%이며 만기는 5년으로 설정됐다. 현대건설은 이번 발행을 통해 이자 비용 부담 없이 장기간 자금을 운용할 수 있는 기반을 마련했다. 특히 투자자에게 조기상환청구권(Put Option)과 리픽싱(전환가액 조정) 조건을 부여하지 않아 향후 조기 상환 부담과 추가적인 자금 유출 가능성을 낮췄다. 전환가액은 이사회 결의 시점 기준 주가 대,2026-07-07 16:30,https://www.etoday.co.kr/news/view/2601206?trc=main_list_news,이투데이
재경위·정무위 쥔 與…‘이재명표’ 부동산 입법 속도낸다,https://img.etoday.co.kr/crop/200/125/2355692.jpg,이달 말 세제개편안 발표 예고 보유세·거래세 조정 본격화 감독원 설치 입법도 속도전 조사권 논란·여론 반발 변수 출범 1년을 맞은 이재명 정부의 역점 부동산 정책들이 국회 상임위원회 사령탑 재편과 맞물려 강력한 입법 동력을 얻게 됐다. 더불어민주당이 재정경제기획위원회와 정무위원회에 이어 법제사법위원회 위원장까지 확보하면서 세제 개편과 부동산감독원 설치 등 핵심 과제의 국회 논의가 빨라질 전망이다. 다만 세 부담 확대와 부동산감독원의 조사 권한을 둘러싼 반발이 변수가 될 것으로 보인다. 7일 부동산 업계와 정치권에 따르면 이재명 정,2026-07-07 16:23,https://www.etoday.co.kr/news/view/2601105?trc=main_list_news,이투데이
"인천공항, 상주직원 주차요금 인상 추진…공항 종사자 반발",https://img.etoday.co.kr/crop/200/125/2353171.jpg,"인천국제공항공사가 공항 주차난 해소를 위해 상주직원 정기주차권을 대폭 축소한 데 이어 주차요금 인상도 추진한다. 여객 주차공간을 확보하기 위한 조치라는 게 공사 측 설명이지만 공항 종사자들은 현장 부담을 직원에게 전가하고 있다며 반발하고 있다. 7일 인천공항공사에 따르면 공사는 다음 달부터 인천공항 상주직원을 대상으로 제1·2여객터미널 주차장 유료 정기권 금액을 인상하는 방안을 검토 중이다. 장기주차장의 경우 항공사 직원은 월 11만원, 나머지 상주직원은 월 7만원 수준으로 정기권 요금을 조정하는 방안이 논의되고 있다. 단기주차장",2026-07-07 16:14,https://www.etoday.co.kr/news/view/2601196?trc=main_list_news,이투데이
오세훈 “청년이 머무는 산업단지 만든다”…가든밸리 프로젝트 본격화,https://img.etoday.co.kr/crop/200/125/2356114.jpg,"공원·녹지 ‘0%’ 산업단지 탈바꿈 2030년까지 10만㎡ 녹지 확충 가로숲정원·공유정원 단계적 조성 “가든밸리 프로젝트는 산업단지를 단순히 일하는 공간이 아니라, 시민들이 머물고 걷고 쉬며 일상의 활력을 누릴 수 있는 녹색공간으로 전환하는 새로운 도시혁신 프로젝트입니다.” 오세훈 서울시장은 7일 로구 디지털로 일대에 조성된 ‘가로숲정원’과 공유정원 대상지를 방문해 “2030년까지 단계적으로 정원과 녹지를 확충해 회색도시의 상징이었던 G밸리를 서울을 대표하는 녹색 산업단지이자 세계적인 정원도시로 탈바꿈시키겠다”며 이 같이 말했다.",2026-07-07 15:48,https://www.etoday.co.kr/news/view/2601130?trc=main_list_news,이투데이
"인천공항, 개항 25년 만에 누적 여객 10억 명 돌파…세계 허브공항 중 '최단급'",https://img.etoday.co.kr/crop/200/125/2341476.jpg,"인천국제공항이 개항 25년 만에 누적 여객 10억 명을 달성했다. 독일 뮌헨공항과 싱가포르 창이공항 등 세계 주요 허브공항보다 약 10년 빠른 속도로 달성한 기록이다. 7일 인천국제공항공사에 따르면 인천공항은 2001년 3월 29일 개항 이후 25년 3개월 10일, 총 9232일 만에 누적 여객 10억 명을 넘어섰다. 이는 개항 이후 하루 평균 10만8000명, 시간당 4513명, 분당 75명이 인천공항을 이용한 셈이다. 공사는 전 세계 주요 허브공항과 비교해 인천공항이 가장 빠른 속도로 누적 여객 10억 명을 달성했다고 설명했다",2026-07-07 14:30,https://www.etoday.co.kr/news/view/2601131?trc=main_list_news,이투데이
"대우건설, 협력사 안전등급제 도입…우수 업체 입찰 우대",https://img.etoday.co.kr/crop/200/125/2219153.jpg,대우건설이 협력회사의 안전관리 수준을 평가해 입찰에 반영하는 안전등급제를 도입한다고 7일 밝혔다. 협력회사 안전등급제는 협력회사의 안전관리 수준을 객관적으로 평가해 우수 협력회사에는 입찰 인센티브를 제공하고 안전관리가 미흡한 협력회사에는 단계적으로 입찰을 제한하는 제도다. 협력회사의 자율적인 안전관리 역량을 높이고 안전을 기업 경쟁력의 핵심 요소로 반영하기 위해 마련됐다. 평가는 현장 안전평가와 본사 안전평가를 기본으로 한다. 여기에 신용평가사의 안전등급을 종합 반영해 협력회사의 안전 수준을 평가한다. 안전등급이 우수한 협력회사에,2026-07-07 14:09,https://www.etoday.co.kr/news/view/2601116?trc=main_list_news,이투데이
레벨4 자율주행 안전기준 마련…완전 무인화 지원,https://img.etoday.co.kr/crop/200/125/2307459.jpg,정부가 운전자 없는 레벨4 자율주행차의 안전운행 기준을 마련했다. 기업은 명확한 기준에 따라 완전 무인 자율주행 기술을 개발하고 정부는 안전성이 확보된 무인 자율주행 서비스 상용화를 지원한다는 방침이다. 국토교통부는 ‘무인 자율주행차 안전운행 요건 가이드라인’을 마련했다고 7일 밝혔다. 이번 가이드라인은 지난해 11월 발표한 ‘자율주행차 산업 경쟁력 제고방안’의 후속 조치다. 국제기준이 국내 법령에 반영되기 전이라도 기업이 무인 자율주행차 임시운행허가를 받아 레벨4 수준의 기술을 안전하게 개발할 수 있도록 기준을 선제적으로 마련한,2026-07-07 13:39,https://www.etoday.co.kr/news/view/2600870?trc=main_list_news,이투데이
지난해 종부세 87% 상위 10%가 부담···개인 중 절반은 60세 이상 [포토로그],https://img.etoday.co.kr/crop/200/125/2356047.jpg,지난해 종합부동산세 결정세액의 87%가 상위 10% 납세자에게 집중됐다. 개인 종부세 납부자 중에서는 60세 이상 고령층이 인원과 세액에서 모두 절반 이상을 차지했다. 은퇴 세대 자산이 부동산을 중심으로 형성된 영향으로 분석된다. 7일 국세청 국세통계포털에 따르면 지난해 토지와 주택을 포괄한 종합부동산세 결정세액(개인+법인)은 4조8565억원으로 집계됐다. 이 가운데 상위 10% 납세자의 결정세액은 4조2420억원으로 전체의 87.3%를 차지했다. 연령대별로는 노령층 쏠림이 두드러졌다. 지난해 개인 종부세 납세자는 54만8177명,2026-07-07 12:49,https://www.etoday.co.kr/news/view/2601079?trc=main_list_news,이투데이
서울 집값 치솟고 전세난까지…수도권 분양시장 기대감 '쑥',https://img.etoday.co.kr/crop/200/125/2355942.jpg,전국 분양전망지수 69.4→87.6 반등 서울 114.3·경기 100.0 회복 서울 집값 상승세와 전세난 심화로 주택사업자들의 수도권 분양시장 기대감이 살아나고 있다. 지난달 급락했던 전국 분양전망지수는 한 달 만에 큰 폭 반등했고 수도권은 기준선(100)을 회복했다. 서울은 전국에서 가장 높은 114.3을 기록하며 분양시장 기대심리 회복을 이끌었다. 7일 주택산업연구원에 따르면 주택사업자를 대상으로 조사한 7월 전국 아파트 분양전망지수는 87.6으로 전월(69.4)보다 18.2포인트(p) 상승했다. 수도권은 84.3에서 102.,2026-07-07 11:00,https://www.etoday.co.kr/news/view/2600991?trc=main_list_news,이투데이
"잠실·강남·서울역까지 한번에⋯대광위, 경기 광역버스 5개 노선 신설",https://img.etoday.co.kr/crop/200/125/2350448.jpg,"국토교통부 대도시권광역교통위원회는 이천·양주·용인·수원·의정부 등 경기 5개 지역과 서울 주요 거점을 잇는 광역버스 준공영제 신설 노선을 순차적으로 운행한다고 7일 밝혔다. 이번에 운행을 시작하는 노선은 △이천 3303번 △양주 1407번 △용인 4105번 △수원 M5165번 △의정부 1108번 등 5개다. 각 노선은 잠실역, 강남고속터미널, 서울역, 광화문 등 서울 주요 업무·환승 거점을 연결한다. 가장 먼저 운행을 시작하는 노선은 이천 3303번이다. 이 노선은 이천 부발읍에서 잠실역을 오가며 13일 오전 5시부터 운행한다.",2026-07-07 11:00,https://www.etoday.co.kr/news/view/2600946?trc=main_list_news,이투데이
"DL건설, 한기평 6년·나신평 3년 연속 신용등급 유지",https://img.etoday.co.kr/crop/200/125/2355991.jpg,DL건설이 한국기업평가와 나이스신용평가의 주요 신용등급을 잇달아 유지하며 재무안정성을 입증했다. DL건설은 한국기업평가로부터 기업신용등급(무보증사채) 'A-(안정적)'를 획득했다고 7일 밝혔다. 이로써 DL건설은 6년 연속 A- 등급을 유지하게 됐다. 한국기업평가는 평가보고서에서 건축부문 원가율 안정화에 따른 수익성 개선과 우수한 재무안정성을 높게 평가했다. 견조한 현금창출력을 바탕으로 앞으로도 우수한 재무구조를 유지할 것으로 전망했다. 나이스신용평가도 DL건설의 기업어음(CP) 등급을 'A2-'로 평가했다. DL건설은 해당 등급,2026-07-07 10:52,https://www.etoday.co.kr/news/view/2601033?trc=main_list_news,이투데이
"롯데건설, ABS 3000억원 발행⋯공사비 7700억원 조기 회수",https://img.etoday.co.kr/crop/200/125/2355976.jpg,"롯데건설이 공사대금채권을 기초자산으로 한 AAA등급 자산유동화증권(ABS) 3000억원 규모의 2차 발행에 성공했다. 이를 통해 2027년 1분기까지 약 7700억원 규모의 공사비를 조기 회수하며 현금흐름을 개선한다는 계획이다. 롯데건설은 준공이 임박한 주택사업장과 그룹 계열사 건축사업장의 공사대금채권을 활용해 AAA등급 ABS 3000억원을 발행했다고 7일 밝혔다. 이번 ABS는 만기 1년 1500억원과 만기 1년 3개월 1500억원으로 구성됐다. 인수단에는 KB증권, 하나증권, 키움증권, 삼성증권, 한국투자증권이 참여했다. 이",2026-07-07 10:44,https://www.etoday.co.kr/news/view/2601023?trc=main_list_news,이투데이
