title,thumbnail,short_content,write_time,link,company
"오스템임플란트, ‘일자리 창출’ 공로 고용노동부 장관상 수상",https://img.etoday.co.kr/crop/200/125/2138867.jpg,"오스템임플란트는 일자리 창출을 통해 국가경제에 기여한 공로를 인정받아 고용노동부 장관상을 수상했다고 20일 밝혔다. 지난해 오스템임플란트는 670명에 달하는 신규 인원을 채용했으며 이 가운데 2030 청년세대에 해당하는 사원, 대리급 인원 비중이 77%에 달한다. 또한 장애인과 비장애인이 함께 할 수 있는 다양한 직무를 개발해 최근 2년 동안 33명의 장애인이 입사했다. 회사 관계자는 “적극적인 채용 정책으로 청년 구직난 해소에 일조한 점을 높이 인정받아 이번 상을 받았다”라고 말했다.",2025-02-20 13:27,https://www.etoday.co.kr/news/view/2446729?trc=main_list_news,이투데이
"한화오션, 세계 최초 200번째 LNG 운반선 인도",https://img.etoday.co.kr/crop/200/125/2138866.jpg,"한화오션은 세계 최초로 200번째 액화천연가스(LNG) 운반선 ‘레브레사’호를 SK해운에 20일 인도했다고 밝혔다. 레브레사호는 카타르 에너지의 노스필드 확장 프로젝트에 투입된다. 운영사는 SK해운, 에이치라인해운, 팬오션 등 국내 3개 회사로 구성된 KGL이다. 한화오션은 LNG 관련 설비 라인업을 모두 구축하며 기술 경쟁력을 인정받고 있다.",2025-02-20 13:20,https://www.etoday.co.kr/news/view/2446728?trc=main_list_news,이투데이
중소기업 절반 “환율 급등으로 피해 발생”,https://img.etoday.co.kr/crop/200/125/2138708.jpg,중소기업 절반 이상이 최근 환율 급등 상황에서 피해를 입은 것으로 조사됐다. 중소기업중앙회는 1월 14일부터 31일까지 중소기업 360개 사를 대상으로 진행한 ‘고환율 관련 중소기업 실태조사’ 결과를 20일 발표했다. 환율 급등으로 ‘피해가 발생’한 중소기업은 51.4%로 ‘이익 발생’ 중소기업(13.3%)을 크게 상화했다. 피해 유형(복수응답)은 △환차손 발생(51.4%) △고환율로 인한 생산비용 증가(51.4%) △수입 비용 증가로 인한 가격경쟁력 저하(49.2%) △환율상승분에 대한 납품단가 미반영(40.0%) 등이다. 환율,2025-02-20 12:00,https://www.etoday.co.kr/news/view/2446620?trc=main_list_news,이투데이
'국정 안정을 위한 국회-정부 국정협의회 첫 회의' [포토],https://img.etoday.co.kr/crop/200/125/2139065.jpg,"최상목 대통령 권한대행 경제부총리 겸 기획재정부 장관이 20일 서울 여의도 국회 사랑재에서 열린 국정 안정을 위한 국회-정부 국정협의회 첫 회의에서 참석자들과 기념촬영을 하고 있다. 왼쪽부터 이재명 더불어민주당 대표, 최 권한대행, 우원식 국회의장, 권영세 국민의힘 비상대책위원장. 조현호 기자 hyunho@",2025-02-20 18:14,https://www.etoday.co.kr/news/view/2446891?trc=main_list_news,이투데이
"무역위, 중국산 후판에 27.91∼38.02% 잠정 반덤핑 관세 부과",https://img.etoday.co.kr/crop/200/125/2139059.jpg,"정부가 중국산 철강 후판에 최대 38%의 잠정 덤핑 방지 관세를 부과하기로 했다. 산업통상자원부 무역위원회는 20일 제457차 회의를 열고 중국산 '탄소강 및 그 밖의 합금강 열연강판 후판 제품'(이하 후판)을 대상으로 예비 조사를 진행한 결과, 덤핑 사실과 덤핑 수입으로 인한 국내 산업의 실질적 피해를 추정할 충분한 근거가 있다고 예비 판정했다. 무역위는 향후 이뤄질 본조사 기간 발생할 수 있는 피해를 방지하기 위해 잠정 덤핑 방지 관세 27.91%~ 38.02% 부과를 기획재정부 장관에게 건의하기로 했다. 기업별 예비 덤핑률은",2025-02-20 18:10,https://www.etoday.co.kr/news/view/2446889?trc=main_list_news,이투데이
국정협의회 ‘4자회담’ 시작...최상목 “반도체법 제정 꼭 필요”,https://img.etoday.co.kr/crop/200/125/2139056.jpg,"“학생 안전 위해 ‘하늘이법’ 조속 입법 촉구” 최상목 대통령 권한대행 부총리 겸 기획재정부 장관은 20일 여·야·정 대표가 한자리에 모이는 국정협의회 4자 회담에서 주 52시간 근로 예외 조항을 명시한 반도체 특별법의 조속한 통과를 촉구했다. 최 권한대행과 우원식 국회의장, 권영세 국민의힘 비상대책위원장, 이재명 더불어민주당 대표는 이날 오후 국회 사랑재에서 만나 국정 현안 협의에 나섰다. 최 권한대행은 “미국, 일본 등 주요 경제국들의 반도체 첨단 인력들은 근로시간 제약 없이 신기술 개발에 매진하고 있다. 설상가상으로 미국은 반",2025-02-20 17:49,https://www.etoday.co.kr/news/view/2446882?trc=main_list_news,이투데이
복지 사각지대 살피는 가스공사…위기가정에 가구당 150만 원 지원,https://img.etoday.co.kr/crop/200/125/2139055.jpg,"한국가스공사가 복지 사각지대에 있는 위기 가정을 위해 여타 기관 및 협회와 가구당 150만 원을 지원한다고 20일 밝혔다. 가스공사는 20일 국민권익위원회, 한국사회복지협의회 및 3개 공공기관과 '복지 사각지대 발굴·지원을 위한 업무 협약'을 체결했으며, 공공기관들은 약 1억2000만 원을 사회복지협의회에 맡겼다.",2025-02-20 17:48,https://www.etoday.co.kr/news/view/2446881?trc=main_list_news,이투데이
[속보] 우원식 “민생 한계 이르러...적어도 ‘추경’ 편성에는 합의해야”,https://img.etoday.co.kr/crop/200/125/1990411.jpg,,2025-02-20 17:27,https://www.etoday.co.kr/news/view/2446874?trc=main_list_news,이투데이
[속보] 이재명 “반도체법 ‘근로시간 특례’ 패키지 아냐...유연한 태도 필요”,https://img.etoday.co.kr/crop/200/125/1990411.jpg,,2025-02-20 17:24,https://www.etoday.co.kr/news/view/2446873?trc=main_list_news,이투데이
"崔대행, 싱가포르 국회의장 접견...""디지털, AI 협력 확대""",https://img.etoday.co.kr/crop/200/125/2136501.jpg,"최상목 대통령 권한대행 부총리 겸 기획재정부 장관은 20일 방한 중인 시아 키앤 펭 싱가포르 국회의장과 만나 양국 관계 및 실질 협력, 북한 문제 등에 대해 의견을 교환했다. 기획재정부에 따르면 최 권한대행은 이날 오후 정부서울청사에서 시아 의장을 만나 ""양국 수교 50주년을 맞는 뜻깊은 해에 싱가포르 고위급 인사로서 방한한 것을 환영한다""며 ""이는 굳건한 양국 관계 발전 의지를 보여준다""고 말했다. 이에 시아 의장은 최 대행의 환영에 사의를 표하며 ""양국 관계의 중요성과 아울러 한국 민주주의와 경제의 견조함에 대해 확고하게 신뢰",2025-02-20 17:22,https://www.etoday.co.kr/news/view/2446871?trc=main_list_news,이투데이
[속보] 최상목 권한대행 “학생 안전 위해 ‘하늘이법’ 조속 입법 촉구”,https://img.etoday.co.kr/crop/200/125/1990411.jpg,,2025-02-20 17:21,https://www.etoday.co.kr/news/view/2446869?trc=main_list_news,이투데이
[속보] 권영세 “협치 가장 중요…여야정 합심해 민생현안 신속 논의”,https://img.etoday.co.kr/crop/200/125/1990411.jpg,,2025-02-20 17:20,https://www.etoday.co.kr/news/view/2446868?trc=main_list_news,이투데이
[속보] 최상목 권한대행 “반도체법 제정 꼭 필요…근로시간특례 포함돼야”,https://img.etoday.co.kr/crop/200/125/1990411.jpg,,2025-02-20 17:10,https://www.etoday.co.kr/news/view/2446864?trc=main_list_news,이투데이
