title,thumbnail,short_content,write_time,link,company
"""3040이 찜했다""⋯학세권·공세권 품은 '맹모·맹부' 아파트 대세",https://img.etoday.co.kr/crop/200/125/2345182.jpg,"3040 매매 비중 54% 넘어 주택시장의 핵심 수요층으로 자리 잡은 30~40대 부모 세대가 자녀 교육환경과 쾌적한 주거 여건을 모두 갖춘 '학세권·공세권' 단지로 대거 몰리고 있다. 13일 분양업계에 따르면 교육과 녹지 인프라를 동시에 확보한 신규 단지들이 청약시장에서 흥행을 이어가고 있다. 5월 포스코이앤씨가 인천 연수구 송도동에서 선보인 '더샵 송도그란테르'는 1순위 청약에서 평균 17.65 대 1의 경쟁률을 기록했다. 이 단지는 채드윅 송도국제학교를 비롯한 명문 학군이 가깝고, 센트럴파크 등 대형 공원이 인접해 교육과 자",2026-06-13 13:00,https://www.etoday.co.kr/news/view/2593004?trc=main_list_news,이투데이
3분기 새 아파트 5.4만 가구 분양⋯절반 넘게 '1000가구 대단지',https://img.etoday.co.kr/crop/200/125/2337009.jpg,"전국 63개 단지, 5만4137가구 공급 올해 3분기 전국에서 새 아파트 5만 4000여 가구가 분양에 나선다. 특히 수요자 선호도가 꾸준한 1000가구 이상 대단지 물량이 대거 포함돼 있어 예비 청약자들의 관심이 집중될 전망이다. 13일 부동산114 자료에 따르면 올해 3분기 전국에서 임대를 제외한 63개 단지, 총 5만4137가구가 공급될 예정이다. 이는 직전 분기(2분기) 분양 물량인 8만1476가구와 비교해 약 33.55%(2만7339가구) 감소한 수치다. 6월 지방선거 일정에 맞춰 건설사들이 분양을 앞당겨 진행한 영향이",2026-06-13 11:00,https://www.etoday.co.kr/news/view/2593025?trc=main_list_news,이투데이
[분양 캘린더] 6월 셋째 주 ‘알티에로광안’ 등 3606가구 분양,https://img.etoday.co.kr/crop/200/125/2345341.jpg,"6월 셋째 주에는 전국에서 3606가구가 분양에 나선다. ◇청약 단지(7곳) 부동산 정보업체 부동산114에 따르면 6월 셋째 주에는 전국에서 7개 단지 3606가구(일반분양 3088가구)가 분양에 나선다. 16일에는 경기 남양주시 ‘다산지금A3(통합공공임대)’, 평택시 ‘평택고덕우미린프레스티지(ABC-36)’, 부산 수영구 ‘알티에로광안’ 등이 청약에 나선다. 17일에는 광주 북구 ‘호반써밋첨단3지구(A7)’, 전남 장성군 ‘호반써밋첨단3지구(A8)’가 1순위 청약을 진행한다. ◇당첨자 발표(4곳) 당첨자를 가리는 단지는 6곳이다",2026-06-13 07:00,https://www.etoday.co.kr/news/view/2593099?trc=main_list_news,이투데이
"중기부-지재처, 스마트제조 전략기술 로드맵 수립 공동착수",https://img.etoday.co.kr/crop/200/125/2346442.jpg,중소벤처기업부는 지식재산처와 인공지능(AI) 기반 스마트제조 추진과 중소 제조기업의 경쟁력 강화를 위해 '2026 스마트제조 전략기술로드맵(2027~2029)' 수립에 공동 착수했다고 16일 밝혔다. 스마트제조 전략기술로드맵은 중기부가 추진하는 스마트제조 분야 특화 로드맵이다. 스마트제조 산업의 미래 기술 방향을 제시하고 중소 제조기업 중심의 연구개발 전략 품목을 도출하기 위해 마련됐다. 지난해 추진된 로드맵에서는 스마트제조 7대 전략 분야를 대상으로 △기술혁신형 △현장수요형 트랙을 운영해 총 49개 전략 품목을 도출했다. 올해는,2026-06-16 06:00,https://www.etoday.co.kr/news/view/2593848?trc=main_list_news,이투데이
"이마트, ‘상반기 결산’ 역대급 세일…‘2000원대 옛날통닭·반값 소고기’ 푼다",https://img.etoday.co.kr/crop/200/125/2346309.jpg,"18일부터 일주일간 상반기 인기 먹거리 압도적 특가 행사 돌입 스낵·즉석밥 전용 박스 ‘무한 골라담기’ 등 오프라인 쇼핑 재미 더해 고물가 속 장바구니 부담을 덜어줄 대형마트의 역대급 할인 행사가 열린다. 이마트는 상반기 동안 소비자들에게 가장 큰 사랑을 받았던 주요 먹거리와 인기 상품을 엄선해 파격적인 가격에 선보이는 상반기 결산 행사를 개최한다고 16일 밝혔다. 이번 기획전은 18일부터 24일까지 일주일간 전국 매장에서 진행되며, 차별화된 가격 경쟁력을 통해 대형마트 본연의 집객 효과를 극대화한다는 구상이다. 가장 눈길을 끄는",2026-06-16 06:00,https://www.etoday.co.kr/news/view/2593793?trc=main_list_news,이투데이
"롯데백화점 잠실점, ‘니치향수 특화존’ 오픈…프리미엄 향수 거점 육성",https://img.etoday.co.kr/crop/200/125/2346306.jpg,"본관·에비뉴엘 매장 통합해 140평 규모 원스톱 쇼핑 환경 구축 젠더리스 브랜드 확대로 남성 수요 잡고 일대일 맞춤형 컨설팅 강화 롯데백화점이 잠실점을 프리미엄 향수 시장을 선점하기 위한 전략 거점으로 키운다. 롯데백화점은 잠실점 본관 1층에 140평 규모의 ‘니치향수 특화존’을 새로 선보인다고 16일 밝혔다. 이번 개편은 에비뉴엘과 본관에 분산됐던 매장을 통합해 동선을 효율화하고, 글로벌 하이엔드 브랜드 20개를 한자리에 모아 쇼핑 편의성을 높인 것이 특징이다. 새롭게 조성된 특화존은 희소성 높은 글로벌 브랜드를 엄선하고, 신제",2026-06-16 06:00,https://www.etoday.co.kr/news/view/2593788?trc=main_list_news,이투데이
“한 번 부러지면 또 부러진다”…골다공증 치료 패러다임 변화 [메디컬 줌인],https://img.etoday.co.kr/crop/200/125/2345586.jpg,"“골다공증 골절은 한 번 발생하면 끝이 아닙니다. 첫 골절 이후 추가 골절이 연쇄적으로 이어질 가능성이 크기 때문에 처음 골절이 생긴 시점부터 적극적인 치료를 시작하는 것이 중요합니다.” 대한민국이 초고령사회에 접어들면서 골다공증이 개인의 노화 문제를 넘어 사회적 부담으로 떠오르고 있다. 자기 키 높이에서 넘어지는 작은 충격에도 척추나 고관절이 부러질 수 있는 골다공증 골절은 거동 장애와 장기 입원, 침상 생활로 이어지며 환자와 가족 모두의 삶의 질을 떨어뜨린다. 이에 의료 현장에서도 치료의 초점이 단순한 골절 치료에서 재골절 예",2026-06-16 06:00,https://www.etoday.co.kr/news/view/2593288?trc=main_list_news,이투데이
"‘검은 반도체’ 김, CJ 필두로 사계절 내내 ‘육지 양식’ 상용화 속도",https://img.etoday.co.kr/crop/200/125/2346334.jpg,"CJ제일제당, 내년 상반기 상업화 시설 완공 대상·풀무원도 국책 사업 기반 대규모 실증 착수 해수온 상승 등 기후변화에도 안정적 공급망 기대↑ 지난해 사상 처음 수출액 11억달러(약 1조6662억원)를 돌파한 김이 우리나라 주요 수출품목으로 등극했다. 일명 ‘검은 반도체’로 글로벌 식품 시장에서 위상이 높아졌지만, 해수온 상승 등에 따른 해상양식의 한계 극복이 과제로 지적되고 있다. 이에 정부와 식품업계는 김의 ‘육상양식’ 투자에 속속 나서며 상용화에 고삐를 당기는 모습이다. 15일 식품업계에 따르면 CJ제일제당과 대상, 풀무원",2026-06-16 05:30,https://www.etoday.co.kr/news/view/2593746?trc=main_list_news,이투데이
마약성 진통제 ‘중독·부작용’ 심각한데…‘비마약성 진통제’ 대안 언제쯤,https://img.etoday.co.kr/crop/200/125/2346155.jpg,"암 환자나 수술 후 환자의 통증 조절에 ‘비마약성 진통제’가 효과적인 선택지로 자리 잡을 수 있을지 주목된다. 마약성 진통제는 중독성이 강하고 호흡억제 부작용 위험이 커 안전한 대체재가 필요한 실정이다. 국내에는 비마약성 진통제 ‘어나프라주’(성분명 오피란제린)가 의료 현장에 도입됐지만, 아직 활용도가 높지 않은 상태다. 15일 제약바이오 업계에 따르면 마약류 오남용에 대한 경각심이 높아지면서 비마약성 진통제의 보급에 대한 사회적 관심이 증가했다. 의료 현장에서는 중증 통증을 효과적으로 조절하면서도 환자가 마약성 진통제에 노출되지",2026-06-16 05:00,https://www.etoday.co.kr/news/view/2593661?trc=main_list_news,이투데이
"폐수 다시 쓰고 오염물질 잡는다…중소 워터테크, 물 산업 공략[물의시대中]",https://img.etoday.co.kr/crop/200/125/2346337.jpg,"물 재이용·오염물질 분해…워터테크 스타트업, 틈새시장 개척 PFAS 분해부터 폐수 순환까지…기술로 물 산업 파고든다 실증·레퍼런스 확보가 관건…중소 워터테크, 사업화 속도전 기후위기와 AI 시대, 물을 다시 쓰는 기술이 산업 경쟁력이 되며 물이 비용에서 자원으로 바뀌고 있다. 폐수 재이용부터 난분해성 오염물질 분해까지 국내 중소·스타트업들이 물 산업 밸류체인 곳곳에서 틈새시장 공략에 적극적이다. 15일 본지 취재를 종합하면 반도체·데이터센터 등 첨단산업뿐 아니라 식품 가공·중소 제조 현장에서도 폐수 재이용과 수처리 비용 절감 수요",2026-06-16 05:00,https://www.etoday.co.kr/news/view/2592723?trc=main_list_news,이투데이
반도체 수율 가르는 ‘초순수’…한성크린텍 “물 확보·재이용이 경쟁력”[물의시대中],https://img.etoday.co.kr/crop/200/125/2344815.jpg,"반도체 공정 전반에 초순수 투입…수율 직결 댐·원수 의존 한계…폐수 재이용으로 용수 확보 전략 확장 “초순수는 수처리의 정점…물 자원화 중요성 커질 것” “반도체 산업에서 물은 전력만큼 중요한 생산 자원입니다. 수율과 직결되는 초순수의 역할을 고려하면 물의 자원화는 핵심 과제입니다.” 정윤석 한성크린텍 대표는 최근 서울 강남구 논현동 사무실에서 본지와 인터뷰를 갖고 반도체 초순수 산업의 무한한 성장 가능성을 강조했다. 반도체 생산 경쟁력은 미세공정과 장비, 전력만으로 결정되지 않는다. 웨이퍼를 세정하고 약품을 희석하며 공정 열 제",2026-06-16 05:00,https://www.etoday.co.kr/news/view/2592712?trc=main_list_news,이투데이
"60조 물산업 잡아라…건설사, 수처리 기술 확보 속도[물의시대中]",https://img.etoday.co.kr/crop/200/125/2346344.jpg,"바닷물로 하루 10만 톤 공업용수…GS건설, 대산 해수담수화 준공 SK에코플랜트, 하·폐수 재이용 기술 반도체 사업장서 실증 현대건설·삼성물산, 이라크·카타르 대형 물 플랜트 공략 물이 산업 인프라의 핵심 변수로 떠오르면서 건설사들의 수처리 기술이 주목받고 있다. 물 인프라가 정수장·하수처리장 등 공공시설 시공을 넘어 하·폐수 재이용, 해수담수화, 고순도 공업용수 생산, AI 기반 운영기술로 확장되고 있기 때문이다. 15일 기후에너지환경부에 따르면 2024년 기준 국내 물산업 매출액은 51조6056억원이다. 정부는 제2차 물관리기",2026-06-16 05:00,https://www.etoday.co.kr/news/view/2592711?trc=main_list_news,이투데이
주가는 바닥인데 기술수출은 역대급…엇갈린 K바이오,https://img.etoday.co.kr/crop/200/125/2346362.jpg,"기술수출 규모, 작년 대비 62% 수준 그러나 반도체‧AI 쏠림에 바이오 부진 국내 제약·바이오 기업들이 올해 대형 기술수출과 임상 성과를 내놓고 있지만 주가는 좀처럼 반등하지 못하고 있다. 과거에는 대형 기술수출 한 건만으로도 해당 기업은 물론 바이오 섹터 전반이 강세를 보였지만 최근 분위기는 다르다. 투자자들의 관심이 반도체와 AI 등 다른 산업으로 이동하면서다. 15일 본지 취재를 종합하면 코스닥 제약지수는 올해 3월 대비 약 두 달 만에 약 40% 안팎 하락했다. 과거 바이오 업종이 조정을 받을 때는 1년 이상에 걸쳐 50",2026-06-16 05:00,https://www.etoday.co.kr/news/view/2592650?trc=main_list_news,이투데이
"바닷물에 정책금융 붙는다…해수담수화, 산업용수 대안 부상 [물의시대下]",https://img.etoday.co.kr/crop/200/125/2343922.jpg,"중동 식수 의존도 높아지며 담수화 인프라 수요 확대 수은, 사우디·오만 프로젝트 PF로 국내 기업 수주 지원 국내선 산단·가뭄 대응용 대체 수자원으로 활용 논의 물 부족 국가의 생존 인프라인 해수담수화에 정책금융이 붙고 있다. 사우디아라비아와 오만 등 건조 기후대에서 담수화 수요가 커지면서 국내 건설·수처리 기업의 해외 수주 기회도 확대되는 추세다. 15일 관련 업계에 따르면 세계적인 기후변화로 국내에서도 물 확보가 산업 경쟁력을 좌우하는 핵심 변수로 부상했다. 이에 따라 해수담수화는 산업용수 안정화와 비상 대체 수자원 확보를 위",2026-06-16 05:00,https://www.etoday.co.kr/news/view/2591982?trc=main_list_news,이투데이
"현대차, 원청 책임 첫 인정…사내하청 넘어 급식·보안과도 교섭",https://img.etoday.co.kr/crop/200/125/2336212.jpg,"울산지노위, 현대차 사용자성 판단 사내하청·급식·보안까지 교섭 확대 현대자동차가 하청노동조합의 ‘실질적 사용자’라는 첫 노동위원회 판단이 나오면서 노사관계가 새로운 국면에 접어들었다. 개정 노동조합 및 노동관계조정법(노란봉투법) 시행 이후 노동위원회가 현대차 원청 사용자성을 처음 인정한 사례로, 향후 현대차 내부 노사 관계는 물론 제조업 간접고용 구조 전반에도 적잖은 변화가 예상된다. 특히 사내하청을 넘어 급식·보안·판매대리점까지 교섭 범위가 확대될 가능성이 제기되면서 현대차 내부 긴장감도 높아지고 있다. 15일 재계에 따르면 울",2026-06-15 20:47,https://www.etoday.co.kr/news/view/2593699?trc=main_list_news,이투데이
"[속보] 울산지노위, 현대차 사용자성 '인정'",https://img.etoday.co.kr/crop/200/125/1990411.jpg,,2026-06-15 20:17,https://www.etoday.co.kr/news/view/2593841?trc=main_list_news,이투데이
"개인정보위, CU 택배 개인정보 유출 조사 착수",https://img.etoday.co.kr/crop/200/125/2346392.jpg,"개인정보보호위원회가 CU편의점 택배 서비스 개인정보 유출사건 조사에 착수했다. 15일 연합뉴스에 따르면 개보위는 CU편의점 택배를 운영하는 BGF네트웍스를 상대로 9일부터 조사를 벌이고 있다. 개보위는 구체적인 유출 경위와 피해 규모, 관련법상 안전조치 의무와 유출 통지·신고 의무 준수 여부를 확인하고 법 위반 사항이 적발되면 관계 법령에 따라 처분할 방침이다. BGF네트웍스는 이달 4일 해킹 공격을 받아 개인정보가 유출된 점을 확인했다. 유출 항목은 아이디와 비밀번호, 이름, 생년월일, 성별, 주소, 이메일, 핸드폰 번호 등이다",2026-06-15 19:49,https://www.etoday.co.kr/news/view/2593839?trc=main_list_news,이투데이
"“미국, 이란 호르무즈 통항 수수료 징수권 인정”",https://img.etoday.co.kr/crop/200/125/2346390.jpg,"미국과 이란의 종전 양해각서(MOU)에 이란의 호르무즈 해협 통항 수수료 징수권을 인정하는 내용이 포함됐다는 현지 언론 보도가 나왔다. 15일 연합뉴스에 따르면 이란 반관영 파르스 통신은 미국과 이란이 오는 19일(현지시간) 서명할 예정인 MOU 문안을 협상 막바지에 수정했으며, 호르무즈 해협에 대한 이란과 오만의 주권 문제가 확고하고 명시적으로 강조됐다고 전했다. 수정 이전 초안에는 호르무즈 해협 관련 주권 행사와 이란의 조치를 보장하는 조건이 포함된 것으로 전해졌다. 하지만 수정 후 최종안에는 ‘호르무즈 해협의 향후 해상 항행",2026-06-15 19:42,https://www.etoday.co.kr/news/view/2593838?trc=main_list_news,이투데이
"[BioS]마티카랩스, 아스리젠과 '관절 연골재생 치료제' CDMO",https://img.etoday.co.kr/crop/200/125/2346371.jpg,"차바이오텍(CHA Biotech)의 자회사인 마티카바이오랩스(Matica Biolabs)는 재생의료 전문기업 아스리젠(ArthRezen)과 와튼젤리 유래 중간엽줄기세포(WJ-MSC) 제조 CDMO 계약을 했다고 15일 밝혔다. 이번 계약으로 마티카바이오랩스는 아스리젠이 개발중인 관절 연골재생 치료제 연구에 활용되는 와튼젤리 유래 중간엽줄기세포의 분리 공정개발 및 제조를 수행하고, 아스리젠의 전임상 연구를 지원할 예정이다. 회사에 따르면 와튼젤리(Wharton's Jelly)는 탯줄 안에서 제대혈관을 둘러싸고 있는 젤리 형태의 조직",2026-06-15 18:23,https://www.etoday.co.kr/news/view/2593825?trc=main_list_news,이투데이
"르무통, 순천만국가정원서 제12회 산책회 성황리 마무리",https://img.etoday.co.kr/crop/200/125/2346367.jpg,고객 1400명 참여해 6km 코스 완주 걷기와 가든 음악회 결합한 프로그램 선봬 친환경 신발 브랜드 르무통이 전남 순천시 순천만국가정원에서 고객 1400명과 함께 걷기 행사와 문화 공연을 결합한 제12회 르무통 산책회를 마쳤다. 르무통은 13일부터 이틀간 순천만국가정원에서 고객 참여형 걷기 행사 ‘르무통 산책회 in 순천’을 진행했다고 15일 밝혔다. 이번 행사는 지난해 9월에 이어 순천에서 두 번째로 열린 산책회다. 주말 동안 선착순으로 모집한 1400명의 참가자가 초여름의 정원을 걸으며 브랜드 가치를 경험했다. 참가자들은 그,2026-06-15 18:03,https://www.etoday.co.kr/news/view/2593823?trc=main_list_news,이투데이
"중기 1~5월 소비재 96억달러 '전년比 16% 증가'...""K-뷰티 최고 실적""",https://img.etoday.co.kr/crop/200/125/2340577.jpg,"중소기업 4대 유망 소비재(화장품, 패션·의류, 농수산식품, 생활유아용품)의 올해 1~5월 수출액이 전년 대비 16% 넘게 증가한 것으로 나타났다. 중소벤처기업부는 올해 1~5월 중소기업 4대 유망소비재 수출현황(잠정치)가 95억8000만달러로 전년 대비 16.4% 증가했다고 15일 밝혔다. 이는 같은 기간 중소기업 전체 수출 증가율(9.3%)을 크게 상회한 수치다. 이에 중소기업 수출에서 4대 유망 소비재가 차지하는 비중은 18.4%로 확대됐다. 수출 기업수도 2만7000개사로 전년동기대비 5.2% 증가하며 전체 수출 중소기업",2026-06-15 17:59,https://www.etoday.co.kr/news/view/2593821?trc=main_list_news,이투데이
"보랏빛 정원에 가족 발길 '북적'…원그로브, 도심 나들이 명소 부상",https://img.etoday.co.kr/crop/200/125/2346356.jpg,"서울 서남권 복합문화공간 원그로브가 선보인 라벤더 정원 캠페인이 가족 단위 방문객들의 호응을 얻으며 새로운 도심 나들이 명소로 주목받고 있다. 보랏빛 라벤더 정원을 중심으로 다양한 체험형 콘텐츠를 결합해 고객 체류시간을 늘리고 상권 활성화 효과까지 이끌어내고 있다는 평가다. 15일 유통업계에 따르면 원그로브는 최근 '라벤더 정원'을 테마로 한 시즌 캠페인을 진행하며 방문객 유치에 나서고 있다. 핵심 콘텐츠는 약 4200㎡(약 1300평) 규모의 야외 라벤더 정원이다. 정원에는 잉글리시 라벤더와 프렌치 라벤더, 러시안 세이지 등 약",2026-06-15 17:52,https://www.etoday.co.kr/news/view/2593816?trc=main_list_news,이투데이
손흥민이 경기 후 싹 비운 '이 음식'⋯한국에서도 팔까?,https://img.etoday.co.kr/crop/200/125/2346281.jpg,"한국 축구대표팀의 손흥민(LAFC)이 멕시코 현지 식당에서 다양한 멕시코 음식을 먹은 사실이 알려지면서 해당 음식들에 대한 관심도 함께 커지고 있다. 14일(현지시간) 멕시코 '폭스 스포츠'는 손흥민은 멕시코 과달라하라의 한 타코 전문점을 찾아 한국 축구대표팀 선수들 및 가족과 함께 식사를 즐겼다고 보도했다. 이날 식사 자리에는 이재성(마인츠 05), 김승규(도쿄), 송범근(전북 현대 모터스) 등도 함께했으며 손흥민의 아버지 손웅정도 참석했다. 현지 직원은 폭스 스포츠와의 인터뷰에서 ""손흥민이 알 파스토르(Al Pastor)와 아",2026-06-15 17:50,https://www.etoday.co.kr/news/view/2593811?trc=main_list_news,이투데이
"유한양행, 알레르기 질환 치료제 ‘레시게르셉트’ 임상 1b상 결과 발표",https://img.etoday.co.kr/crop/200/125/2346324.jpg,"유한양행은 알레르기 질환 치료제 ‘레시게르셉트(개발 코드명 YH35324)’의 임상 1b상 결과를 튀르키예 이스탄불에서 열린 ‘유럽 알레르기 임상면역학회(EAACI) 2026’ 연례 학술대회에서 발표했다고 15일 밝혔다. 레시게르셉트는 항-면역글로불린 E(anti-IgE) 계열의 장기 지속형 고친화도 IgETrap-Fc 융합단백질 신약 후보 물질이다. 혈중 유리 IgE를 중화해 IgE 매개 알레르기 염증 반응을 조절하도록 설계됐다. 이번 임상 1b상은 레시게르셉트 반복 투여 시 안전성, 내약성, 약동학 및 약력학 특성을 평가하기",2026-06-15 17:08,https://www.etoday.co.kr/news/view/2593794?trc=main_list_news,이투데이
OLED 시장 키우는 삼성디플·LGD…中 추격에 기술 경쟁 격화,https://img.etoday.co.kr/crop/200/125/2346323.jpg,"삼성디플, 8.6세대 IT OLED 양산 초읽기 LGD, 게이밍 OLED·고부가 제품 확대 BOE·CSOT 추격…한중 기술격차 2년 유기발광다이오드(OLED)가 노트북과 태블릿, 게이밍 모니터 등으로 적용 범위를 넓히면서 차세대 디스플레이 시장 경쟁이 한층 치열해지고 있다. 삼성디스플레이와 LG디스플레이는 정보기술(IT) 기기와 게이밍 시장을 중심으로 OLED 사업 확대에 속도를 내고 있으며 중국 업체들도 대규모 투자에 나서며 추격 수위를 높이고 있다. 15일 업계에 따르면 삼성디스플레이는 충남 아산캠퍼스에 구축한 8.6세대 IT",2026-06-15 17:05,https://www.etoday.co.kr/news/view/2593599?trc=main_list_news,이투데이
美·이란 종전에 숨돌린 산업계…“비용 부담·조달 리스크 완화”,https://img.etoday.co.kr/crop/200/125/2346321.jpg,"미국과 이란이 사실상 종전 합의에 도달한 가운데 중동 전쟁의 직격탄을 맞았던 국내 산업계도 일단 안도하는 분위기다. 항공·해운업계는 국제유가 안정과 호르무즈 해협 통행 재개에 따른 비용 부담 완화를, 정유·석유화학업계는 원료 수급 정상화를 기대하고 있다. 15일 외신과 업계 등에 따르면 미국과 이란이 19일 종전 서명식을 예고 하면서 국제유가가 급락했다. 이날 도널드 트럼프 미 대통령은 자신의 SNS를 통해 호르무즈 해협의 ‘통행료 없는’ 개방을 예고했다. 항공업계는 유가 안정이 장기화할 경우 연료비 부담 완화에 도움이 될 것으로",2026-06-15 17:04,https://www.etoday.co.kr/news/view/2593727?trc=main_list_news,이투데이
올여름 ‘긴소매’ 예상밖 불티⋯냉방·자외선·격식 맞춤까지 ‘일석삼조’,https://img.etoday.co.kr/crop/200/125/2346217.jpg,"린넨·시어서커 셔츠 및 카디건 등 일명 ‘살안타템’ 햇볕 가리고 냉방병 방지⋯신경 쓴 스타일로 인식돼 출근룩부터 리조트룩까지⋯가을에도 입을 수 있어 예년보다 부쩍 더위가 빨라진 올여름 유난히 ‘긴소매’ 의류가 인기다. 최근 자외선 차단에 대한 관심이 높아지고, 무더운 날씨에도 단정함을 유지할 수 있는 패션 아이템으로 주목받고 있기 때문. 여기에 실내외 기온차 대응까지 다방면으로 활용도가 높은 것도 장점이다. 15일 패션업계에 따르면 냉감 기능을 앞세운 반소매 티셔츠 위주 상의가 주를 이루던 여름 의류의 긴소매 판매 비중이 올해 특",2026-06-15 17:00,https://www.etoday.co.kr/news/view/2593716?trc=main_list_news,이투데이
"아시아나항공, 에어부산에 1000억 투입…통합 LCC 앞두고 재무구조 개선",https://img.etoday.co.kr/crop/200/125/2294455.jpg,아시아나항공이 통합 저비용항공사(LCC) 출범을 앞두고 에어부산 재무구조 개선에 나섰다. 아시아나항공은 15일 에어부산 제6회 영구전환사채 1000억원에 대한 전환권 행사를 결정했다고 밝혔다. 아시아나항공은 이번 결정에 대해 에어부산의 기업가치 상승 가능성을 고려한 투자 목적과 함께 최근 비상경영 상황 속에서 재무 건전성을 강화해 안정적인 통합 작업을 추진하려는 조치라고 설명했다. 에어부산은 2023년 이후 실적 턴어라운드에 성공하며 경쟁사 대비 높은 영업이익률과 수익성을 기록하고 있다. 다만 시장에서는 기업가치가 실적 대비 충분,2026-06-15 16:58,https://www.etoday.co.kr/news/view/2593790?trc=main_list_news,이투데이
