title,thumbnail,short_content,write_time,link,company
고비 넘긴 이재명…사흘째 산불 대응 민생행보,https://img.etoday.co.kr/crop/200/125/2153292.jpg,"‘무죄’ 선고 직후 안동 이어 의성·청송·영양·산청 찾아임시 대피소 이재민·봉사자들 만나 피해 상황 점검산림항공본부 직원들 만나 ‘처우개선’ 고충 수첩 적기도정부여당엔 “4조8700억 예비비 한 푼이라도 쓴 거 있나”서해수호의날 기념식 첫 참석…“서해바다 영웅들 기억” 이재명 더불어민주당 대표가 사법 리스크를 덜어낸 직후 사상 초유의 산불 사태 대응 민생 행보를 이어가고 있다. 산불 피해 지역인 경북 안동에 이어 의성, 청송, 영양, 경남 산청 등을 차례로 돌며 피해 상황을 점검하는 한편, 예비비 활용 피해 지원 방안을 모색하고 있",2025-03-28 18:03,https://www.etoday.co.kr/news/view/2457086?trc=main_list_news,이투데이
"與, 경북 찾아 산불 피해 점검·민심 수습…“실질 대책 신속 마련”",https://img.etoday.co.kr/crop/200/125/2153280.jpg,"권영세, 경북 안동 산불 현장 방문…“착잡한 마음” “전방위 자원 투입으로 현장 어려움 해소하겠다” 국민의힘 지도부는 28일 산불 피해 현장을 찾아 상황을 점검하고 이재민들을 위로했다. 권영세 비상대책위원장은 “현장을 꼼꼼히 살펴 하루라도 빨리 국민께서 안전하고 평온한 일상으로 복귀하실 수 있도록 최선을 다하겠다”고 약속했다. 권 비대위원장은 이날 오후 경북 안동의 산불 피해 현장을 방문해 “오늘 이곳을 찾은 이유는 현장을 직접 점검하고 피해 복구와 지원을 위한 실질적 대책을 신속하게 마련하기 위함”이라며 이같이 밝혔다. 권 비대",2025-03-28 17:33,https://www.etoday.co.kr/news/view/2457072?trc=main_list_news,이투데이
"안동 산불 현장 찾은 韓대행 ""신속 조치·과감한 지원 협의할 것""[종합]",https://img.etoday.co.kr/crop/200/125/2153271.jpg,"-한덕수 권한대행 안동 산불 피해 현장점검 -""경험하지 못한 최대 규모 피해...산불 대책 종합적·전면적 개편""-임시대피소 찾아 ""저희가 잘 돕겠다"" 한덕수 대통령 권한대행 국무총리는 28일 경북 안동 산불피해 현장 점검에 나서 ""앞으로 어떻게 신속하게 우리가 모든 조치를 할 수 있는가, 또 거기에 따른 재정 지원을 어떻게 과감하게 할 수 있나 협의하겠다""고 말했다. 한 권한대행은 이날 오후 경북 안동시 산불현장통합지휘본부를 찾아 산불 대응상황을 점검하며 이같이 밝혔다. 이 자리에서 한 대행은 ""지난 며칠 동안 정말 모든 국민이 걱",2025-03-28 17:24,https://www.etoday.co.kr/news/view/2457068?trc=main_list_news,이투데이
"韓대행, 안동 산불 현장 찾아...""신속 조치·과감한 지원 협의할 것""",https://img.etoday.co.kr/crop/200/125/2153271.jpg,"한덕수 대통령 권한대행 국무총리는 28일 경북 안동 산불피해 현장 점검에 나서 ""앞으로 어떻게 신속하게 우리가 모든 조치를 할 수 있는가, 또 거기에 따른 재정 지원같은 거를 어떻게 과감하게 할 수 있나 협의하겠다""고 말했다. 한 권한대행은 이날 오후 경북 안동시 산불현장통합지휘본부를 찾아 산불 대응상황을 점검하며 이같이 밝혔다. 이 자리에서 한 대행은 ""지난 며칠 동안 정말 모든 국민들이 걱정하는 과정에서 산림청, 소방청, 지방자치공무원, 군, 경남·북도 모두 애를 써주시고, 피로가 누적됐을 거라고 생각한다""며 ""어제 조금 비가",2025-03-28 17:09,https://www.etoday.co.kr/news/view/2457052?trc=main_list_news,이투데이
"韓대행, 다음주 4대 그룹 총수 만난다...美 관세전쟁 대응책 논의",https://img.etoday.co.kr/crop/200/125/2152811.jpg,"한덕수 대통령 권한대행 국무총리가 미국발 통상 이슈에 대응하기 위해 조만간 국내 4대 그룹(삼성·SK·현대차·LG) 총수와 회동에 나선다. 총리실은 ""다음주 중 개최를 검토하고 있다""며 ""정부는 민간이 참여하는 경제안보전략 TF 회의를 통해 민관이 힘을 합쳐 통상 현안에 대응해 나갈 계획""이라고 28일 밝혔다. 한 권한대행이 이재용 삼성전자 회장, 최태원 SK 회장, 정의선 현대차 회장, 구광모 LG 회장 등 4대 그룹 총수와 만나는 건 이번이 처음이다. 이번 회동은 상호관세 부과 등 미국발 통상 리스크에 대한 대응책을 논의하기",2025-03-28 16:01,https://www.etoday.co.kr/news/view/2457017?trc=main_list_news,이투데이
4·2 재보궐선거 구로구청장 사전투표하는 구민들 [포토],https://img.etoday.co.kr/crop/200/125/2153215.jpg,4·2 재보궐선거 사전투표 첫날인 28일 서울 구로구 개봉2동 주민센터에서 구민들이 구로구청장 선출을 위한 투표를 하고 있다.,2025-03-28 15:54,https://www.etoday.co.kr/news/view/2457015?trc=main_list_news,이투데이
"유럽, 전후 우크라이나 파병…러시아 견제 수위 높여",https://img.etoday.co.kr/crop/200/125/2153186.jpg,"英ㆍ佛 중심의 재침략 억제군 4주 내로 구체적 파병 국가 확정 “러시아 제재 유지가 더 중요해” 러시아 견제…자강론 집중 행보 프랑스와 영국을 중심으로 한 유럽의 일부 국가들이 우크라이나에 러시아 재침략 억제를 주된 목적으로 하는 군대를 파견하기로 결정했다. 유럽의 복수 국가들이 파견을 할 것으로 예상되지만, 입장이 많이 나뉘는 상황이다. 앞으로 3~4주 내로 상세한 계획이 결정될 것으로 전망되며, 이들은 대러 제재를 해제하지 않는다는 입장도 재확인했다. 28일 니혼게이자이신문(닛케이)에 따르면 프랑스와 영국 등은 27일(현지시간",2025-03-28 15:34,https://www.etoday.co.kr/news/view/2456986?trc=main_list_news,이투데이
"한덕수 ""北 어떤 도발에도 즉각적·압도적 대응"" [종합]",https://img.etoday.co.kr/crop/200/125/2153068.jpg,"-한 권한대행, '제10회 서해수호의 날 기념식' 참석 -""한미동행 굳건히...안보태세 확고히 유지할 것"" -나눔의집 나마스떼도 찾아...""보훈은 거창한 게 아니라 조국 지킨 영웅과 가족 기억하는 것"" 한덕수 대통령 권한대행 국무총리는 28일 ""한미동맹을 더욱 굳건히 하고, 국제사회와 연대를 강화해 감히 대한민국을 넘볼 수 없도록 안보태세를 확고히 유지해 나가겠다""고 말했다. 한 권한대행은 이날 오전 국립대전현충원에서 진행된 '제10회 서해수호의 날 기념식' 기념사에서 ""서해수호 용사들의 투혼을 이어받은 후배 장병들은 강력한 전투",2025-03-28 14:54,https://www.etoday.co.kr/news/view/2456866?trc=main_list_news,이투데이
"김경수 “헌재, 할 일 해야…‘尹 즉각 파면’ 국민 염원 이뤄지길”",https://img.etoday.co.kr/crop/200/125/2153145.jpg,"“헌재, 더 이상 방치한다면 존재 이유 대한 비판 직면할 것” 김경수 전 경남지사는 28일 “헌법재판소는 대한민국이 더 이상 파국에 빠지지 않도록 신속하게 해야 할 일을 해야 한다고 생각한다”며 윤석열 대통령에 대한 파면 선고를 내려달라고 촉구했다. 14일간 단식 농성을 이어가다 건강 악화로 입원했던 김 전 지사는 이날 퇴원 후 다시 광화문을 찾은 뒤 이같은 입장을 밝혔다. 김 전 지사는 “광화문 광장을 다시 찾아야 하는 현재 상황이 참담하다. 헌재에서 판결을 했어도 진작 했어야 되는 상황인데, 아직까지도 윤 대통령에 대한 파면이",2025-03-28 13:54,https://www.etoday.co.kr/news/view/2456955?trc=main_list_news,이투데이
