title,thumbnail,short_content,write_time,link,company
"금융위, 회계기준 위반한 이화전기공업에 과징금 14.7억 부과",https://img.etoday.co.kr/crop/200/125/2298723.jpg,"금융당국이 회계처리 기준을 위반한 이화전기공업에 대해 14억원이 넘는 과징금을 부과했다. 금융위원회는 15일 제7차 회의를 열고 회계처리기준을 위반한 이화전기공업과 회사 관계자에 대해 과징금 부과를 의결했다고 밝혔다. 이에 따라 이화전기공업에는 14억7050만원의 과징금이 부과됐으며, 전 대표이사와 전 담당임원, 전 상근감사 등 회사 관계자 3명에게는 총 1억380만원의 과징금이 내려졌다. 금융당국에 따르면 이화전기공업은 신주인수권부사채(BW)를 발행하면서 보유 금융자산을 담보로 제공하고도 해당 사실을 재무제표 주석에 기재하지 않",2026-04-15 17:46,https://www.etoday.co.kr/news/view/2576126?trc=main_list_news,이투데이
"[채권마감] 강보합, 휴전협상 기대 vs 신현송 인플레 우려",https://img.etoday.co.kr/crop/200/125/2321984.jpg,"전황 따른 출렁임 지속될 듯..월말로 갈수록 WGBI 관련 수급 기대감에 안정 찾을 듯 채권시장이 강보합으로 마감했다(금리 하락). 간밤 미국 이란 2차 협상 기대감이 확산하면서 안도감을 줬기 때문이다. 반면, 신현송 한국은행 총재 후보자 인사청문회가 진행된 가운데 인플레이션 우려가 강조된 점은 강세폭을 반납하는 요인이 됐다. 국고3년물과 한은 기준금리간 괴리가 있다는 언급이 나왔을때는 장중 강세를 보이기도 하는 등 출렁임도 있었다. 15일 채권시장과 금융투자협회에 따르면 통안2년물은 0.7bp 내린 3.233%를, 국고3년물은",2026-04-15 17:23,https://www.etoday.co.kr/news/view/2576112?trc=main_list_news,이투데이
[급등락주 짚어보기] 코스피 2개·코스닥 22개 상한가…스테이블코인ㆍ광통신ㆍ양자컴퓨터 ↑,https://img.etoday.co.kr/crop/200/125/2322131.jpg,"코스피가 6000선을 재돌파하는 등 국내 증시가 강세를 보인 가운데 코스피 시장에서는 2개 종목, 코스닥 시장에서는 22개 종목이 상한가를 기록했다. 디지털자산 제도화 기대가 재부각되며 스테이블코인 관련 종목으로 매수세가 쏠렸고, 광통신·통신장비주 강세도 재확인됐다. 15일 코스피 시장에서 상한가를 기록한 종목은 광전자, 태영건설우다. 광전자는 전 거래일 대비 29.99% 오른 1만7780원에 거래를 마감했다. AI 데이터센터 확산 국면에서 광(光) 인터커넥트와 광통신 부품 수요가 커질 수 있다는 기대가 이어지며 관련주로 매수세가",2026-04-15 16:44,https://www.etoday.co.kr/news/view/2576085?trc=main_list_news,이투데이
[오늘의 주요공시] HD현대중공업·삼성SDS·HD현대마린엔진 등,https://img.etoday.co.kr/crop/200/125/2320255.jpg,"△ 더블유게임즈, 팍시게임즈 지분 13.33% 추가 확보 △ ‘HD현대중공업, '잠수함 사고’ 전 공장 생산중단 △ HD현대마린엔진, 409억 선박엔진 공급계약 △ 삼성SDS, KKR 대상 1.2조 전환사채 발행 △ 오에스피, 주식소각 결정→상장주식 총수 감축 △ 대성파인텍, 상호 디에스엠으로 변경 △ DSC인베스트먼트, 주식소각 변경상장→상장 주식수 감소 △ 엠플러스, 단기차입금 150억원 증가 결정 △ 솔트웨어, 주식병합에 따라 주권매매거래정지 △ 알엔티엑스, 추가상장 결의→상장주식수 확대 △ 비트맥스, 감자 완료로 보통주 3",2026-04-15 16:35,https://www.etoday.co.kr/news/view/2576082?trc=main_list_news,이투데이
"금투협, 주한 인도네시아 대사와 면담…신수도 투자협력 확대 논의",https://img.etoday.co.kr/crop/200/125/2322128.jpg,"금융투자협회는 황성엽 회장이 체쳅 헤라완 주한 인도네시아 대사와 협회에서 만나 인도네시아 신수도 이전 사업 등을 포함한 양국 간 투자 협력 확대 방안을 논의했다고 15일 밝혔다. 이번 간담회에는 주한 인도네시아대사관 경제 담당 관계자들도 참석해 인도네시아 금융시장 동향과 주요 개발사업, 투자환경, 정책 방향 등에 대해 의견을 교환했다. 인도네시아 측은 투자 및 산업 정책과 외국인 투자유치 전략 등을 설명하며 한국 금융투자업계와의 협력 확대 의지를 밝혔다. 금투협은 이 자리에서 인도네시아 신수도(IKN·누산타라) 건설을 포함한 주요",2026-04-15 16:24,https://www.etoday.co.kr/news/view/2576080?trc=main_list_news,이투데이
"[장외시황] 비바리퍼블리카, 0.78% 내린 6만3500원…5주 최저가 기록",https://img.etoday.co.kr/crop/200/125/2322125.jpg,비바리퍼블리카는 5주 최저가를 기록한 가운데 비상 주식은 상승했다. 15일 비상장 주식 시장이 5일 연속 상승했다. 증권금융 전문기업 한국증권금융은 호가 1만7850원(+1.42%)으로 오름세를 보였다. 희토류 영구자석 생산업체 성림첨단산업과 해운물류 컨설팅 전문기업 싸이버로지텍이 보합세였다. 모바일 금융 플랫폼 토스앱 운영업체 비바리퍼블리카가는 6만3500원(-0.78%)으로 5주 최저가를 기록했다. IPO(기업공개)관련 상장 예비심사 청구 종목으로 특수 목적용 항법 및 항재밍 토탈 솔루션 전문기업 덕산넵코어스(넵코어스)가 호가,2026-04-15 16:20,https://www.etoday.co.kr/news/view/2576079?trc=main_list_news,이투데이
'빨갛게 빨갛게 물들었네' 종가 6000선 회복한 코스피 [포토로그],https://img.etoday.co.kr/crop/200/125/2322120.jpg,"코스피가 외국인 매수에 힘입어 종가 기준 6000선을 회복한 15일 서울 여의도 한국거래소 전광판에 코스피 등 시황이 표시되고 있다. 이날 코스피는 전 거래일보다 123.64포인트(2.07%) 오른 6091.39에 거래를 마쳤다. 지수는 173.85포인트(2.91%) 상승한 6141.60으로 출발, 장중 한때 6183.21까지 오르며 상승폭을 키웠다. 종가 기준 6000선 회복은 미국과 이란 간 전쟁 발발 직전인 2월 27일 이후 처음이다. 코스닥도 30.55포인트(2.72%) 오른 1152.43에 마감하며 동반 상승했다. 시가총",2026-04-15 16:17,https://www.etoday.co.kr/news/view/2576077?trc=main_list_news,이투데이
"대신자산신탁, 신림5구역 사업시행자 지정 고시 신청 완료",https://img.etoday.co.kr/crop/200/125/2322113.jpg,"대신자산신탁은 서울 관악구 ‘신림5구역’ 재개발 사업과 관련해 사업시행자 지정 고시 신청을 완료했다고 15일 밝혔다. 이번 신청은 토지등소유자 동의서 징구를 시작한 지 25일 만에 이뤄졌다. 통상 수개월이 걸리는 절차를 비교적 빠르게 마무리한 것으로, 회사 측은 토지등소유자만 2600여명에 달하는 대형 정비사업이라는 점에서 의미가 있다고 설명했다. 대신자산신탁은 사업 추진에 대한 지역 내 공감대가 빠르게 형성되고 주민 참여가 이어진 점이 조기 신청의 배경이라고 설명했다. 신탁방식 정비사업 구조를 기반으로 초기 단계부터 체계적인 관",2026-04-15 16:08,https://www.etoday.co.kr/news/view/2576071?trc=main_list_news,이투데이
[환율마감] 원·달러 하락 일주일만 1470원선 안착 ‘미국·이란 2차 협상 기대’,https://img.etoday.co.kr/crop/200/125/2322040.jpg,"미국장부터 위험선호 확산, 전쟁 후 처음으로 코스피 6000 등정 배당금 역송금에 하단도 지지 ‘장중변동폭 3개월만 최저’ 협상 기대감+국민연금 환헤지에 내주부턴 하향 안정, 1460~1490원 등락할 듯 원·달러 환율이 하락해 1470원선에 안착했다(원화 강세). 환율 1470원대는 일주일만이다. 반면, 변동성이 크게 줄어 장중 변동폭은 3개월만에 최저치를 경신했다. 미국과 이란간 2차 협상 기대감과 미국장부터 확산한 위험선호 분위기가 장을 주도했다. 주식시장에서 외국인 순매수가 살아나며 코스피가 미국 이란 전쟁 발발 이후 처음",2026-04-15 15:58,https://www.etoday.co.kr/news/view/2576065?trc=main_list_news,이투데이
외국인 '사자'에 코스피 6000선 회복 마감…33거래일만,https://img.etoday.co.kr/crop/200/125/2278146.jpg,"코스피 지수가 외국인 매수세에 힘입어 33거래일 만에 6000선에 안착하며 장을 마감했다. 15일 한국거래소에 따르면 코스피는 전 거래일 대비 123.64포인트(2.07%) 오른 6091.39에 거래를 마쳤다. 전장보다 2.91% 오른 6141.60에 출발한 코스피는 장 중 한때 3% 넘게 오르며 6183.21까지 올랐지만 상승 폭을 지키지 못하고 2%대 상승으로 거래를 마감했다. 코스피가 종가 기준 6000선에 장을 마감한 건 지난 2월27일 6244.13이 마지막으로, 고점은 2월26일 6307.27이다. 올해 들어 2월말까지",2026-04-15 15:53,https://www.etoday.co.kr/news/view/2576060?trc=main_list_news,이투데이
[속보] 코스피 123.64p(2.07%) 오른 6091.39(마감),https://img.etoday.co.kr/crop/200/125/1990411.jpg,[속보] 코스피 123.64p(2.07%) 오른 6091.39(마감),2026-04-15 15:32,https://www.etoday.co.kr/news/view/2576044?trc=main_list_news,이투데이
[속보] 코스닥 30.55p(2.72%) 오른 1152.43(마감),https://img.etoday.co.kr/crop/200/125/1990411.jpg,[속보] 코스닥 30.55p(2.72%) 오른 1152.43(마감),2026-04-15 15:31,https://www.etoday.co.kr/news/view/2576043?trc=main_list_news,이투데이
"NH투자증권, THE100리포트 121호 발간",https://img.etoday.co.kr/crop/200/125/2322048.jpg,우리나라 순자산 상위 1% 가구에 진입하기 위한 기준선이 전년보다 높아진 34.8억원으로 나타났다. NH투자증권은 이 같은 분석을 담은 보고서를 발간하며 부자 가구의 경제적 특징을 조명했다. 15일 NH투자증권 100세시대연구소에 따르면 우리나라 상위 1% 부자 가구를 분석한 ‘THE100리포트 121호’가 발간됐다. 이번 리포트는 2025년 국가데이터처 가계금융·복지조사의 마이크로데이터를 기반으로 상위 1% 이내 가구의 경제 현황을 면밀히 분석했다. 리포트 분석 결과 우리나라 상위 1% 가구의 순자산 기준선은 34.8억원으로 집,2026-04-15 14:42,https://www.etoday.co.kr/news/view/2576009?trc=main_list_news,이투데이
'돌아온 외국인'…코스피 3%대·코스닥은 2.8% 상승,https://img.etoday.co.kr/crop/200/125/2278146.jpg,"코스피 시장이 외국인의 6500억원 넘는 매수세에 힘입어 3%대 상승세를 보이고 있다. 15일 한국거래소에 따르면 오후 1시20분 코스피 지수는 전 거래일 대비 180.71포인트(3.03%) 오른 6148.46에 거래되고 있다. 전장보다 2.91% 오른 6141.60에 출발한 코스피는 상승세를 지키며 3%대 강세를 유지하고 있다. 개인이 9802억원 순매도하고 있는 가운데 외국인과 기관이 각각 6517억원, 447억원 순매수하고 있다. 외국인은 전날 9164억원 순매수에 이어 2거래일 연속 매수세를 유지하고 있다. 대부분 업종이",2026-04-15 13:42,https://www.etoday.co.kr/news/view/2575975?trc=main_list_news,이투데이
"에스에너지, 日 태양광 리파워링 시장 공략 속도…대규모 본계약 잇따라",https://img.etoday.co.kr/crop/200/125/2321994.jpg,"일본법인, EF 인베스트먼트와 MOU 후 실질적 성과 가시화 “일본 내 리파워링 사업 규모 30MW 이상 확대해 나갈 것” 에스에너지가 일본 재생에너지 시장에서 대규모 리파워링(Repowering) 본계약을 잇따라 체결하며 현지 시장 진출에 박차를 가하고 있다. 리파워링은 노후화된 발전소의 설비를 교체해 발전 효율을 높이는 사업이다. 에스에너지 일본법인(S-Energy Japan)은 2월 ‘합동회사 레이즈 FIT 솔라 1호’와 요쓰카이도 제1태양광발전소 리파워링 공사 도급 계약을 체결했다고 15일 밝혔다. 이번 계약은 1억2500만",2026-04-15 13:28,https://www.etoday.co.kr/news/view/2575970?trc=main_list_news,이투데이
"테크윙, HBM 검사장비 수주 효과에 1분기 실적 급등…큐브 프로버로 성장 가속",https://img.etoday.co.kr/crop/200/125/2226276.jpg,"반도체 검사장비 전문기업 테크윙이 고대역폭메모리(HBM) 검사장비 수주 확대에 힘입어 1분기 실적이 큰 폭으로 개선되며 반등 신호를 뚜렷하게 드러냈다. HBM용 ‘큐브 프로버(Cube Prober)’와 메모리 테스트 핸들러를 잇따라 확보하면서 장비 포트폴리오 전반의 매출 기여도가 확대되는 모습이다. 테크윙은 1분기 매출액 524억원, 영업이익은 97억원을 기록했다고 15일 밝혔다. 전분기 대비 매출액 51.5% 증가와 영업이익(443.96%)이 모두 증가한 흐름이다. 회사 측은 다음 분기에도 매출 성장세가 이어질 것으로 보고 있다",2026-04-15 11:08,https://www.etoday.co.kr/news/view/2575938?trc=main_list_news,이투데이
"신한투자증권, 법인 CEO·임원 대상 'C-Level 연금컨설팅' 서비스 강화",https://img.etoday.co.kr/crop/200/125/2321905.jpg,"신한투자증권이 법인 CEO와 임원 등 자산가들의 체계적인 노후 준비를 지원하기 위해 맞춤형 'C-Level 연금컨설팅' 서비스를 대폭 강화하며 연금 시장 공략에 박차를 가한다. 15일 신한투자증권의 이번 서비스 고도화는 최근 C-Level 퇴직연금 가입자가 증가함에 따라 이들을 위한 맞춤형 초밀착 관리 서비스를 강화하고 자산관리 효율을 극대화하기 위해 추진됐다. 이를 위해 신한투자증권은 세무, 계리, 노무 전문가 그룹을 통해 입체적인 1:1 솔루션을 제공한다는 방침이다. 특히 퇴직연금 컨설팅 분야에서 굵직한 경력을 가진 베테랑 수",2026-04-15 10:59,https://www.etoday.co.kr/news/view/2575932?trc=main_list_news,이투데이
"NH투자증권, 코스피200 기초 '연10.41% ELS' 모집",https://img.etoday.co.kr/crop/200/125/2321903.jpg,"NH투자증권이 코스피(KOSPI)200 지수를 기초자산으로 삼아 연 10%가 넘는 높은 수익률을 제공하는 주가연계증권(ELS) 상품 모집에 나섰다. 15일 NH투자증권은 KOSPI200 지수가 3년 동안 65% 넘게 하락하지 않으면 연 10.41%의 수익을 지급하는 'N2 ELS 24652호'를 오는 23일까지 모집한다고 밝혔다. 이번에 출시된 상품은 3년 만기로, 매 4개월마다 조기상환 기회를 제공하는 구조로 설계됐다. 가입 후 4개월 시점에 KOSPI200 지수가 최초 기준가격 대비 85% 이상일 경우, 즉 15% 넘게 하락하",2026-04-15 10:54,https://www.etoday.co.kr/news/view/2575927?trc=main_list_news,이투데이
미래에셋 'TIGER 미국우주테크 ETF' 상장 첫날 완판…개인 순매수 최대,https://img.etoday.co.kr/crop/200/125/2321895.jpg,"미래에셋자산운용은 ‘TIGER 미국우주테크 상장지수펀드(ETF)’가 상장 첫날 개인 순매수 약 615억원을 기록했다고 15일 밝혔다. 이는 국내 상장 패시브 ETF 기준 상장일 개인 순매수 최대 규모다. 해당 ETF는 14일 상장과 함께 300억원 규모로 설정됐으며, 상장 직후 개인과 기관 자금이 유입되며 1시간 만에 초기 물량이 모두 완판됐다. 특히 상장 당일 개인 순매수는 614억 6900만원을 기록하면서 우주 산업에 대한 투자자들의 높은 관심이 확인됐다. ‘TIGER 미국우주테크 ETF’는 록히드마틴, 보잉 등 전통 방산 기",2026-04-15 10:48,https://www.etoday.co.kr/news/view/2575922?trc=main_list_news,이투데이
"한국투자증권, 손익차등형 공모펀드 ‘한국밸류기업가치포커스3’ 1066억 설정",https://img.etoday.co.kr/crop/200/125/2321889.jpg,"한국금융지주 자회사 한국투자증권은 최근 모집한 손익차등형 공모펀드 '한국밸류기업가치포커스3'이 약 1066억 원 규모로 설정 완료했다고 15일 밝혔다. 회사는 최근 국내외 증시 변동성이 심화되며 전체 공모펀드 시장의 신규 자금 유입이 주춤한 상황임에도 불구하고, 상대적으로 안정적인 구조를 바탕으로 매력적인 수익을 기대할 수 있는 상품에 투자자들의 수요가 몰린 결과로 해석했다. 이번에 설정된 ‘한국밸류기업가치포커스3’은 손익차등형 구조를 채택한 공모펀드다. 펀드 수익자를 선순위와 후순위로 구분하여 손익을 배분한다. 일반 고객을 선순",2026-04-15 10:42,https://www.etoday.co.kr/news/view/2575913?trc=main_list_news,이투데이
"키움증권, 중개형ISA 전용 원금지급형 특판 ELB 판매",https://img.etoday.co.kr/crop/200/125/2321886.jpg,"키움증권이 중개형ISA 고객을 대상으로 한 특판 주가연계파생결합사채(ELB)를 판매한다고 15일 밝혔다. ISA전용 특판 ELB는 2024년 5월 처음 선보인 이후 현재까지 꾸준히 발행을 이어오고 있다. 지난달 말 기준 누적 가입건수 약 3만건, 누적 청약금액은 2700억원이 넘는다. 상품의 가장 큰 특징은 중개형ISA 계좌 안에서 원금지급형 구조 ELB에 투자할 수 있다는 점이다. ISA 고유의 비과세 혜택과 결합하면 절세 효과와 수익을 동시에 추구할 수 있다. 절세 계좌로만 활용하던 ISA를 보다 폭넓은 투자 수단으로 활용할",2026-04-15 10:38,https://www.etoday.co.kr/news/view/2575912?trc=main_list_news,이투데이
삼성증권 '중개형ISA 다시 봄 이벤트' 실시,https://img.etoday.co.kr/crop/200/125/2321881.jpg,삼성증권이 중개형ISA 계좌 고객을 대상으로 '중개형ISA 다시 봄 이벤트'를 30일까지 진행한다고 15일 밝혔다. 이번 이벤트는 중개형 ISA계좌에 대한 관심이 늘어나는 상황에서 △Welcome 이벤트 △Re-start 이벤트 △Level-up 이벤트 △국내주식 첫걸음 이벤트 총 네 가지 이벤트로 진행된다. Welcome 이벤트는 신규개설 고객 대상으로 기간 내 최초 중개형 ISA 계좌 개설 후 100만원 이상 1000만원 미만 순입금 시 상품권 1만원을 조건 달성 고객 전원에게 지급한다. Re-start 이벤트는 ISA 계좌,2026-04-15 10:35,https://www.etoday.co.kr/news/view/2575910?trc=main_list_news,이투데이
"한국투자신탁운용, ‘우주산업 투자’ 라이브 세미나 개최",https://img.etoday.co.kr/crop/200/125/2321854.jpg,"한국투자신탁운용은 자사 공식 유튜브 채널에서 라이브 세미나 ‘한투스테이션’을 진행한다고 15일 밝혔다. 이번 세미나는 이날 오후 5시 30분부터 30분간 진행된다. 주제는 ‘우주산업 투자’로, 우주산업 전망과 함께 주목할 투자처에 대한 분석을 다룰 예정이다. 세미나에는 김현태 한국투자신탁운용 글로벌퀀트운용부 책임이 출연한다. 김 책임은 서울대 물리학 박사로, 현재 한국투자글로벌우주기술&방산 펀드와 ACE 미국우주테크액티브 상장지수펀드(ETF)를 운용한다. 한국투자글로벌우주기술&방산 펀드는 2023년 설정된 상품으로 글로벌 우주산업",2026-04-15 10:00,https://www.etoday.co.kr/news/view/2575887?trc=main_list_news,이투데이
"김익래 전 다우키움그룹 회장, 사람인 공개매수 목표 미달",https://img.etoday.co.kr/crop/200/125/2321885.jpg,김익래 전 다우키움그룹 회장이 진행한 공개매수 결과 목표 주식 수에 미달한 것으로 나타났다. 15일 금융감독원 전자공시시스템에 따르면 사람인은 김 전 회장이 지난달 23일부터 이달 13일까지 진행한 공개매수에서 응모한 주식 수는 67만2387주로 집계됐다고 공시했다. 목표예정수량 90만주의 74.71%에 그쳤다. 김 전 회장은 응모한 주식을 모두 매수할 예정이다. 이번 공개매수를 통해 김 전 회장의 사람인 지분은 3.38%에서 9.65%로 늘어났다. 앞서 김 전 회장은 지난달 사람인 주식 90만주(지분 7.68%)를 공개매수한다고,2026-04-15 09:59,https://www.etoday.co.kr/news/view/2575885?trc=main_list_news,이투데이
"[특징주] OCI홀딩스, 스페이스X와 공급 계약 소식에⋯20% 급등",https://img.etoday.co.kr/crop/200/125/2321836.jpg,스페이스X와 폴리실리콘 공급계약을 맺었다는 언론 보도에 OCI홀딩스가 장 초반 급등세다. 15일 한국거래소에 따르면 오전 9시 23분 OCI홀딩스는 전 거래일 대비 20.15% 상승한 22만6000원에 거래 중이다. 이러한 상승세는 OCI테라서스와 스페이스X가 태양광 폴리실리콘 공급 계약을 맺었다는 전날 언론 보도의 영향으로 풀이된다. OCI테라서스는 OCI홀딩스의 말레이시아 자회사다. 보도에 따르면 두 업체 간 장기 공급 계약이 체결됐으며 현재 세부 조건을 조율 중이다. OCI홀딩스 측은 스페이스X와 공급 계약 체결 여부에 대해,2026-04-15 09:48,https://www.etoday.co.kr/news/view/2575865?trc=main_list_news,이투데이
"원·달러 환율 이틀째 하락, 미국 이란 2차 협상 기대",https://img.etoday.co.kr/crop/200/125/2321682.jpg,"배당금 역송금+수입업체 달러 수요로 낙폭 줄일 수도 리스크온+코스피 급등+국민연금 환헤지 비율 상향 등은 원화 강세요인 협상 구체적인 내용 아직 없어, 관망 속 1470~1480원 사이 등락할 듯 원·달러 환율이 이틀연속 하락세다(원화 강세). 미국 이란간 2차 대면 협상이 곧 있을 것이라는 기대감이 영향을 주고 있다. 간밤 도널드 트럼프 미 대통령은 “이틀 안에 2차 회담이 열릴 수 있다”고 언급했다. 이에 따라 뉴욕 3대 증시는 일제히 올랐고, 국제유가는 급락했다. 달러인덱스 또한 7거래일연속 내림세를 이어갔다. 15일 오전",2026-04-15 09:35,https://www.etoday.co.kr/news/view/2575864?trc=main_list_news,이투데이
"미국·이란 종전 협상 재개 기대감…코스피, 장 초반 6100 돌파",https://img.etoday.co.kr/crop/200/125/2278146.jpg,코스피가 미국과 이란 간 종전 협상 재개 기대감이 이어지면서 장 초반 6100선을 돌파했다. 15일 한국거래소에 따르면 오전 9시5분 코스피 지수는 전 거래일 대비 179.19포인트(3.00%) 오른 6146.94에 거래되고 있다. 전장보다 2.91% 오른 6141.60에 출발한 코스피는 상승폭을 키우며 3%대 강세를 보이고 있다. 3%대 강세에 코스피의 시가총액도 5000조원을 돌파했다. 같은 시각 코스피 상장사의 시가총액 합계는 약 5033조830억원으로 전날 4894조5285억원에서 약 137조원 가량 늘어난 수치다. 코스피,2026-04-15 09:30,https://www.etoday.co.kr/news/view/2575862?trc=main_list_news,이투데이
"[특징주] 대우건설, 원전ㆍLNG 재평가 기대에 급등⋯52주 신고가 경신",https://img.etoday.co.kr/crop/200/125/2321372.jpg,미국과 이란의 종전 협상 진전 기대감으로 중동 지정학적 리스크가 완화하면서 원전 산업 강세 기대에 대우건설이 장 초반 상승세다. 15일 오전 9시15분 대우건설은 전 거래일 대비 17.23% 오른 2만7550원에 거래되며 52주 신고가를 새로 썼다. 이날 유진투자증권은 대우건설의 목표주가를 2만8000원으로 상향했다. 류태환 유진투자증권 연구원은 “대형원전 프로젝트 주간사로서의 위상을 고려하면 주가 상승 여력은 충분하다”고 판단했다. 류 연구원은 “핵잠수함 건조 승인과 함께 우라늄 농축과 사용후핵연료 재처리 논의가 부각되며 K-원,2026-04-15 09:21,https://www.etoday.co.kr/news/view/2575853?trc=main_list_news,이투데이
"더존비즈온, 상장폐지 순항…이사회, 공개매수 찬성·참여 권고",https://img.etoday.co.kr/crop/200/125/2313435.jpg,"스웨덴계 글로벌 사모펀드운용사(PE) EQT파트너스가 추진 중인 더존비즈온의 자발적 상장폐지 작업이 막바지 단계에 접어들었다. 더존비즈온 이사회가 최대주주의 공개매수에 대해 공식적인 찬성 의견을 표명하며 주주들의 응모를 권장하고 나섰다. 15일 금융감독원 전자공시시스템에 따르면 더존비즈온은 전날 개최된 이사회에서 현재 진행 중인 제2차 공개매수에 대해 찬성 의견을 표명하고, 주주들에게 응모를 권장하기로 결의했다. 이번 결의는 사외이사로 구성된 독립 특별위원회의 검토 결과와 외부 전문가의 자문을 종합적으로 고려해 내려졌다. EQT파",2026-04-15 09:16,https://www.etoday.co.kr/news/view/2575846?trc=main_list_news,이투데이
