title,thumbnail,short_content,write_time,link,company
"""못 지나가"" 펜스 친 땅주인… 대법 ""통행권 침해""",,"본인 소유의 땅에 펜스를 설치했더라도 다른 사람이 오가는 길을 막았다면, 통행권 침해에 해당한다는 대법원 판단이 나왔다. 27일 법조계에 따르면 대법원 1부(주심 신숙희 대법관)는 A씨가 B씨를 상대로 제기한 통행방해금지 및 주위토지통행권 확인 청구 소송에서 원고 패소 판결한 원심을 깨고 사건을 서울고법으로 돌려보냈다. A씨는 지난 2020년 12월 강제경매로 광..",2025.08.27 18:16,https://www.fnnews.com/news/202508271816449302,파이낸셜뉴스
"강서 세 모녀 비극… 경찰 ""휴대전화 포렌식 검토""",,"서울 강서구 염창동의 12층 오피스텔 건물 옥상에서 모녀지간인 3명이 추락해 사망하는 사건이 발생했다. 27일 경찰과 소방 당국에 따르면 전날 오후 9시 30분께 등촌역 인근에서 ""여자 세 명이 누워있다""는 신고가 접수됐다. 신고를 받고 소방이 출동했지만, 이들은 모두 심정지 상태로 발견됐다. 40대 1명과 10대 1명은 현장에서 숨졌고, 다른 10대 1명은 심폐소생..",2025.08.27 18:16,https://www.fnnews.com/news/202508271816411003,파이낸셜뉴스
"현대제철 고소한 하청노동자... ""진짜 사장이 교섭하라"" 촉구",,현대제철 비정규직 노동자들이 27일 서울 서초구 대검찰청 정문 앞에서 기자회견을 열고 현대제철을 상대로 집단 고소장을 제출했다. 전 조합원이 집단으로 고소에 나선 것은 사상 최초다. 이번 고소는 하청 근로자에게 교섭권을 보장하고 파업에 따른 기업의 손해배상 청구를 제한하는 '노란봉투법'이 국회를 통과한 지 사흘 만에 이뤄졌다. 재계는 법 시행으로 경영 ..,2025.08.27 18:16,https://www.fnnews.com/news/202508271816329330,파이낸셜뉴스
"특검, 권성동 피의자 조사… 전당대회 끝난 국힘 수사 속도",,내란·외환 특별검사팀(조은석 특검)과 김건희 특검팀(민중기 특검)의 수사망이 국민의힘을 향하고 있다. 국민의힘은 윤석열 전 대통령 부부의 각종 의혹에 연루되며 특검의 수사 칼날을 피하지 못하는 상황이 됐다. 김건희 특검은 27일 정치자금법 위반 혐의를 받는 권성동 국민의힘 의원을 피의자 신분으로 소환해 조사했다. 권 의원은 2021부터 지난해까지 통일..,2025.08.27 18:16,https://www.fnnews.com/news/202508271816304914,파이낸셜뉴스
하차 안내 들으려면 초집중… 불친절한 대중교통서비스,,"#. 직장인 서모씨(28)는 최근 종로행 버스를 탔다가 제때 내리지 못하는 일을 겪었다. 버스가 종로1·2·3에 근접하면서 안내 전광판에 집중했으나 화면이 10초 만에 광고로 바뀐 탓에 하차 타이밍을 놓친 것이다. 그는 ""안내를 보던 도중 광고가 나와 벨 누르기 망설여졌다""며 ""내려야 할 곳이 맞는지 헷갈렸기 때문""이라고 토로했다. ..",2025.08.27 18:16,https://www.fnnews.com/news/202508271816284570,파이낸셜뉴스
"""웰에이징 시대 맞춤 솔루션 제공할 것""[창립 80돌 아모레퍼시픽]",,"""미래의 뷰티는 노화 방지를 넘어 건강하고 아름답게 나이 드는 삶을 지향하는 '웰에이징'의 개념으로 확장될 것입니다."" 27일 박원석 아모레퍼시픽 R&I센터 선행뷰티연구소장(사진)은 ""향후엔 뷰티가 의학적 전문성과 과학적 효능이 결합된 '바이오뷰티' 영역과 더욱 밀접하게 연결될 것""이라며 이 같은 전망을 내놨다. 또 ""외면 뿐만 아..",2025.08.27 18:16,https://www.fnnews.com/news/202508271816246501,파이낸셜뉴스
연구개발로 다져온 80년… 화장품 혁신으로 K뷰티 이끌다[창립 80돌 아모레퍼시픽],,"광복 80주년인 올해 창립 80주년의 역사를 쓴 기업이 있다. '아름다움과 건강으로 인류에 공헌하겠다'는 창업 정신을 이어오고 있는 국내 뷰티업계의 선두 아모레퍼시픽이다. 아모레퍼시픽은 자연을 통찰하고 과학 기술 연구를 통해 끊임없이 혁신하고, 모든 이가 자신만의 아름다움을 발견하고 실현하는 삶을 누리는 미래를 만들어가기 위해 80년째 노력을 이어가..",2025.08.27 18:16,https://www.fnnews.com/news/202508271816137084,파이낸셜뉴스
"퀄컴, 극초단파 기능 완전 통합... 기업용 드래곤윙 Q-6690 공개",,"퀄컴 테크놀로지스는 세계 최초로 극초단파(UHF) RFID 기능이 완전 통합된 기업용 모바일 프로세서 '퀄컴 드래곤윙 Q-6690'을 27일 공개했다. 퀄컴 드래곤윙 Q-6690은 내장형 5G, 와이파이 7, 블루투스 6.0, 초광대역(UWB)을 탑재해 근접 인식 기반의 경험과 우수한 글로벌 연결성을 제공한다. 퀄컴 드래곤윙 Q-6690은 저가형 휴대기기부터 소매점 POS 시스템, 스마트 키..",2025.08.27 18:15,https://www.fnnews.com/news/202508271816064649,파이낸셜뉴스
AI인재 키우는 포스코DX… 제6회 유스 챌린지 성료,,"포스코DX는 전날 판교사옥에서 '2025 AI 유스 챌린지(Youth Challenge)'를 개최했다고 27일 밝혔다. 올해로 6회째를 맞이한 행사는 전국 중·고등학생이 '인공지능과 함께하는 인간 중심의 AI'를 주제로 창의적인 아이디어와 AI 개발 역량을 선보이는 대회로, 포스코DX가 한국인공지능산업협회와 공동 주최하고 교육부가 후원했다. 청소년 문제, 환경, 안전, 건강..",2025.08.27 18:15,https://www.fnnews.com/news/202508271815590354,파이낸셜뉴스
초슬림·폴더블·보급형… 삼성·애플 '트리플 대전' 막 오른다,,삼성전자가 초슬림폰 '갤럭시S25 엣지'를 내놓은데 이어 애플도 '아이폰17 에어' 출시를 예고하면서 초슬림폰 경쟁이 달아오르는 양상이다. 스마트폰 두께가 줄어들면 편의성은 좋아지지만 제조사 입장에선 두께를 줄이기 위해 일부 하드웨어를 제거해 기능을 줄이고 배터리 용량 역시 줄여야 한다. 삼성전자에 이어 애플 역시 초슬림폰을 내는 이유는 소비자 선택 폭을..,2025.08.27 18:15,https://www.fnnews.com/news/202508271815572188,파이낸셜뉴스
"SKT ""수조 파라미터 규모 K-AI 만들것""",,"양승현 SK텔레콤 인공지능(AI) 연구개발(R&D) 센터장(CTO·사진)이 수조 파라미터 규모의 차세대 대형 옴니모달 'K-AI 모델'을 구축하겠다고 강조했다. 양 센터장은 이날 SK텔레콤 뉴스룸을 통해 SK텔레콤 컨소시엄이 독자 AI 파운데이션 모델 개발 프로젝트의 정예팀 5곳 중 한 곳으로 선정된 것에 대해 ""주권 AI의 주역으로서 국가 전략 사업의 책임을..",2025.08.27 18:15,https://www.fnnews.com/news/202508271815555758,파이낸셜뉴스
'마스가' 앞두고 방산 키우는 HD현대…함정 수주 정조준,,"HD한국조선해양은 HD현대중공업과 HD현대미포 합병으로 단순한 양적·질적 성장을 넘어서 K-방산 선도와 시장 확대, 초격차 기술 확보를 이룬다는 목표다. 이를 통해 2035년 연 매출 10조원 달성을 목표로 한다. 이와 더불어 조선 부문 해외 사업을 담당하는 투자 법인을 설립해 해외사업 총괄 허브 역할을 맡길 계획이다. ■ K-조선·방산 시너지 극대화 2..",2025.08.27 18:14,https://www.fnnews.com/news/202508271814504241,파이낸셜뉴스
기술 혁신 속도내는 LG엔솔... 2분기 이어 실적반등 굳힌다,,"LG에너지솔루션이 '수주 다변화'와 '북미 현지 생산 역량 확보', '자원 선순환 체계 구축'으로 2·4분기 실적 반등에 성공하면서 성장 모멘텀을 강화하고 있다. 실제 중국 체리자동차와의 46시리즈 원통형 배터리 공급 계약, 미시간 홀랜드 공장에서의 ESS(에너지저장장치)용 LFP(리튬·인산·철) 롱셀 양산 개시, 토요타통상과의 배터리 리사이클 합작..",2025.08.27 18:14,https://www.fnnews.com/news/202508271814484704,파이낸셜뉴스
현대모비스 새 먹거리는 '반도체·로보틱스',,"'윈드쉴드 디스플레이'와 'SDV(소프트웨어 중심 자동차) 솔루션' 등 미래 핵심분야 선도기술 확보로 시장을 주도하겠다는 목표를 제시한 현대모비스가 신성장 먹거리인 '차량용 반도체'와 '로보틱스 사업' 분야 진출 계획을 밝혔다. 현대모비스는 27일 오후 서울 여의도 페어몬트 호텔에서 투자자와 애널리스트, 신용 평가사 담당자 등을 대상으로 '2025 CEO 인베스터 ..",2025.08.27 15:00,https://www.fnnews.com/news/202508271814450081,파이낸셜뉴스
"현대차 ""민관 함께 지속가능한 수소 생태계 구축""",,"현대자동차그룹이 부산에서 열린 '청정에너지 장관 회의'에 참가해 글로벌 수소 생태계 구축의 비전을 제시했다. 특히 이번 회의에는 신형 수소전기차 '디 올 뉴 넥쏘'가 국제 주요 행사에서 수소차로는 최초로 의전차로 활용돼 눈길을 끌었다. 현대차그룹은 '제16차 청정에너지 장관 회의'에 참가해 확장 가능한 수소 생태계 구축에 대한 필요성을 강조하고, 수소 분야..",2025.08.27 18:14,https://www.fnnews.com/news/202508271814413010,파이낸셜뉴스
연준 때리는 트럼프… 국채시장 요동,,【 뉴욕=이병철특파원】 도널드 트럼프 미국 대통령이 쿡 리사 연방준비제도(Fed 연준) 이사를 주택담보대출 사기 혐의로 즉시 사임하겠다고 밝힌 후 쿡 이사는 소송을 제기하기로 했다. 트럼프 대통령은 쿡 이사 후임을 물색 중이라고 말했다. 연준에 대한 트럼프 행정부의 압박은 주식 시장은 흔들리지 않았지만 국채 시장은 요동치게 했다. 전문가들은 이번 사태가 장..,2025.08.27 18:13,https://www.fnnews.com/news/202508271813378574,파이낸셜뉴스
"""러시아산 원유 쓰지마라""… 美, 인도에 50% 보복관세 발효",,"미국이 인도에 부과하기로 한 50% 관세가 27일(현지 시간) 예정대로 발효됐다. 도널드 트럼프 미국 행정부는 이날 0시1분(미 동부시간 기준)을 기해 러시아산 원유 수입 등을 이유로 인도산 제품에 적용한 보복성 50% 관세 부과의 시행에 들어갔다. 앞서 트럼프 행정부는 지난 25일 이 같은 내용의 초안을 공고한 바 있다. 미국 국토안보부는 공고문에서 ""27일 오전 ..",2025.08.27 18:13,https://www.fnnews.com/news/202508271813350325,파이낸셜뉴스
환율 역풍 맞은 日기업… 2분기 영업익 14% 증발,,【 도쿄=김경민 특파원】 엔저 특수에 기대 성장해온 일본 기업들이 5년 만의 엔고 역풍에 휘청이고 있다. 2·4분기 주요 51개사는 환율 영향만으로 영업이익이 5500억엔(약 5조2000억원) 줄며 전체 이익의 14%가 증발했다. 27일 일본 주요 기업 51개사의 집계에 따르면 2025년 4~6월기 환율 영향만 없었다면 영업이익은 2% 증가했을 것으로 추산됐지만 실제로는 전..,2025.08.27 18:13,https://www.fnnews.com/news/202508271813346743,파이낸셜뉴스
"IEA 사무총장 ""전력수요 6배 증가… 전력망 투자가 경쟁력""",,"【 부산=김준혁 기자】 파티 비롤 국제에너지기구(IEA) 사무총장(사진)이 인공지능(AI) 확산과 첨단산업 성장으로 전 세계 전력 수요가 폭발적으로 증가할 것이라며, 전력망 투자가 국가 경쟁력의 핵심 요인이 될 것이라고 강조했다. 27일 비롤 사무총장은 부산 파라다이스호텔에서 열린 기후산업국제박람회 공동 기자회견에서 ""2035년까지 전력 수요 증가 속도가 ..",2025.08.27 18:12,https://www.fnnews.com/news/202508271813043549,파이낸셜뉴스
