title,thumbnail,short_content,write_time,link,company
"구글 ""2029년 양자컴퓨터가 비트코인 보안 무력화""... 가격 급락 우려",,"[파이낸셜뉴스] 구글이 오는 2029년 양자컴퓨터가 비트코인을 비롯한 디지털자산의 보안 체계를 무력화할 수 있다는 전망을 내놓으면서, 비트코인 가격의 급격한 하락에 대한 경고가 제기되고 있다.포브스는 3일(현지시간) ""지금까지 채굴된 비트코인 가운데 약 32%에 해당하는 670만개가 양자 공격에 취약한 주소에 있다""며 이같이 전망했다.포브스는 ""프로토..",2026.04.06 06:30,https://www.fnnews.com/news/202604060627562328,파이낸셜뉴스
"美 트럼프, 조종사 구출 후일담 ""야만인 수천 명이 쫒아""",,"[파이낸셜뉴스]  미국의 도널드 트럼프 대통령이 지난 4일(현지시간) 진행된 미군 조종사 구조 작전의 후일담을 공개했다. 그는 미군이 구출 작전 초기에 실종된 조종사의 신호를 포착했으나 이란의 함정일지 몰라 걱정했다고 말했다.5일 미국 정치매체 악시오스에 따르면 트럼프는 전날 인터뷰에서 ""수천 명의 야만인들이 그를 추적하고 있었다""고 말했다. 이..",2026.04.06 06:38,https://www.fnnews.com/news/202604060625591251,파이낸셜뉴스
"집단 폭행 숨졌는데 영장 기각... 검찰, 김창민 감독 사건 전담팀 편성",,[파이낸셜뉴스] 장기기증으로 4명의 생명을 살린 김창민 영화감독이 식당에서 집단 폭행을 당해 숨졌다는 사실이 뒤늦게 알려져 논란이 일은 가운데 검찰이 수사 전담팀을 구성한다.의정부지검 남양주지청은 김 감독 폭행 사망과 관련해 형사2부장을 팀장으로 검사 3명과 수사관 5명을 전담 수사팀으로 편성한다고 5일 밝혔다.검찰 관계자는 “지난 2일 경찰로부터 사건을 송치..,2026.04.06 06:33,https://www.fnnews.com/news/202604060624061170,파이낸셜뉴스
"""나 못 내렸어""…지하철 문 비상 개방해 선로 무단 침입한 50대 승객",,[파이낸셜뉴스]  지하철에서 미처 내리지 못한 승객이 열차 문을 열고 선로로 내려오는 일이 발생해 한때 열차 운행이 지연됐다.5일 서울교통공사에 따르면 이날 오후 5시 20분께 지하철 1호선 청량리역에서 정차 중이던 열차에서 50대 남성 A씨가 비상 개방 장치(비상 코크)로 출입문을 열고 열차 선로로 내려갔다.당시 열차는 승강장을 지나 다음 시간대 운행 준비..,2026.04.06 06:28,https://www.fnnews.com/news/202604060615213317,파이낸셜뉴스
"""내 몸 이용하지마""…160만 팔로워 인플루언서 도용 논란",,"[파이낸셜뉴스]  인공지능(AI) 기술을 이용해 타인의 신체 사진에 자신의 얼굴을 합성한 결과물을 게시한 유명 인플루언서가 논란이다.5일(현지시간) 미국 뉴욕포스트 등 외신 보도 내용에 따르면, 약 160만 명의 팔로워를 보유한 백인 인플루언서 로런 블레이크 볼티어가 최근 흑인 모델의 사진을 무단으로 도용한 사실이 밝혀졌다. 그는 해당 이미지를 본인의 사진..",2026.04.06 05:34,https://www.fnnews.com/news/202604060530503738,파이낸셜뉴스
"""비닐 포장째 어묵탕에 넣어 삶아""…부산 연제고분축제 노점 위생 논란",,"[파이낸셜뉴스] 봄철을 맞아 각 지방자치단체에서 다양한 지역 행사를 개최하고 있는 가운데, 부산에서 진행된 연제고분축제의 한 노점 식당 위생 상태가 논란의 중심에 섰다.6일 온라인 커뮤니티 등에 따르면 한 누리꾼은 자신의 사회관계망서비스(SNS)에 “온천천 연제고분축제 실시간(모습)”이라며 사진 속 식당 상황을 설명하며 “순대를 봉지째 찌고 있고 오뎅국물 안에 ..",2026.04.06 05:20,https://www.fnnews.com/news/202604060518138868,파이낸셜뉴스
"美 트럼프, 욕설 올리며 이란과 협상 기한 하루 연장..7일까지",,[파이낸셜뉴스]  이란을 향해 오는 6일(현지시간)까지 미국의 종전안을 수용하거나 호르무즈해협을 개방하라고 요구했던 도널드 트럼프 미국 대통령이 협상 시한을 하루 더 연장했다. 그는 일단 6일에는 이란 문제에 대한 기자회견을 열 계획이다.트럼프는 5일 소셜미디어 트루스소셜에 “이번 화요일(7일)은 이란에서 발전소의 날이자 다리의 날이 될 것이며 이보다 더 ..,2026.04.06 05:38,https://www.fnnews.com/news/202604060508162455,파이낸셜뉴스
"'2.4조 유증' 한화솔루션, EOD·차환 리스크 ‘이중 압박’ [fn마켓워치]",,"[파이낸셜뉴스] 한화솔루션의 대규모 유상증자가 주주 반발에 직면한 가운데, 시장에서는 회사의 재무구조가 사실상 ‘사면초가’에 놓였다는 평가가 나오고 있다. 숨통을 트이게 할 것이라는 의견과 '시간 벌기'에 불과하다는 의견이 맞선다. 시장에선 유상증자로 단기 유동성은 확보하더라도, 근본적인 상환능력 개선에는 한계가 있다는 지적이 나온다. 6일 금융투..",2026.04.06 06:07,https://www.fnnews.com/news/202604060143159315,파이낸셜뉴스
"""이 미친 X들"" 욕설 몇 시간만에..트럼프 ""이란과 오늘 내 합의 가능""",,"[파이낸셜뉴스] 도널드 트럼프 미국 대통령이 현재 이란과 협상을 하고 있다며 오늘(6일)까지 합의가 가능하다고 말했다.트럼프 대통령은 5일(현지시간) 미국 폭스뉴스를 통해 ""나는 내일(6일) (합의가 이뤄질) 가능성이 크다고 본다""면서 ""그들(이란)과 지금 협상하고 있다""고 말했다.이어 ""그들이 빨리 합의하지 않으면 모든 것을 날려버리고 ..",2026.04.06 04:30,https://www.fnnews.com/news/202604060004475997,파이낸셜뉴스
"""좌파였냐?""..조인성 SNS '좌표' 찍고 악플 표적 됐다, 왜?",,"[파이낸셜뉴스] 배우 조인성이 정치적 악성 댓글에 시달리고 있다.조인성은 지난달 20일 자신의 SNS에 ""6년의 동행, 감사하다""는 글과 함께 한 건강 브랜드 광고 계약을 마무리하며 감사 인사를 전했다. 그러나 해당 게시물은 본래 취지와 달리 정치적 성향에 대한 지적과 악성 댓글이 이어지고 있다.댓글에는 ""촛불집회 나가셨었죠? 지금은 어떻게 생각하냐&qu..",2026.04.06 05:10,https://www.fnnews.com/news/202604052342487823,파이낸셜뉴스
삼성전자 실적 D-1...전쟁 눌린 증시 ‘반전 키’ 될까,,"[파이낸셜뉴스] 중동발 지정학 리스크와 금리 상승 압력이 맞물리며 변동성이 확대된 국내 증시가 삼성전자의 실적 발표를 앞두고 중대한 분기점에 서 있다. 이번 실적이 단순 기업 이벤트를 넘어 코스피 방향성을 좌우할 핵심 변수로 부상한 것이다.■시가총액 1위 삼성전자, 7일 분기 실적 발표6일 증권업계에 따르면 삼성전자는 오는 7일 오전 1·4분기 잠정실적을 발..",2026.04.06 06:00,https://www.fnnews.com/news/202604052336204448,파이낸셜뉴스
"[속보] 트럼프 ""이란과 협상중…6일까지 합의 가능하다""",,[파이낸셜뉴스] 도널드 트럼프 미국 대통령은 5일(현지시간) 이란과 협상이 계속되고 있으며 다음날까지 타결될 가능성이 크다고 밝혔다.트럼프 대통령은 이날 폭스뉴스와의 인터뷰에서 이란과의 협상 타결 전망과 관련해 “내일(6일) 가능성이 크다고 본다. 지금 협상이 진행되고 있다”고 말했다.그는 이어 “빨리 합의하지 않으면 (이란의) 모든 것을 날려버리고 석유..,2026.04.05 23:08,https://www.fnnews.com/news/202604052306034818,파이낸셜뉴스
[속보] 전남 화순 규모 2.4 지진 발생... 광주·전남 전역서 진동 감지,,"[파이낸셜뉴스] 5일 밤 전남 화순군 북동쪽 지역에서 규모 2.4의 지진이 발생해 광주와 전남 전역에서 진동이 감지됐다.기상청은 이날 밤 10시 10분께 전남 화순군 동북동쪽 8km 지역에서 규모 2.4 지진이 발생했다고 발표했다.기상청에 따르면 지진 발생 직후 화순과 인접한 광주, 담양, 곡성 등지에서 ""건물이 흔들렸다"", ""창문이 덜덜 거리는 소리가 났다&qu..",2026.04.05 23:06,https://www.fnnews.com/news/202604052301237369,파이낸셜뉴스
"""이재명 하면 음주운전 떠오른다""던 100만 정치 유튜버, 음주운전 혐의 송치",,"[파이낸셜뉴스] 구독자 100만명을 보유한 보수성향 정치 유튜버가 음주운전 혐의로 검찰에 넘겨졌다. 서울 강남경찰서는 최근 유튜버 성제준(35)씨를 음주운전 혐의로 서울중앙지검에 송치했다고 5일 밝혔다. 경찰은 송치 전에 성씨를 소환조사했고, 면허 정지 처분도 내려졌다. 성씨는 지난달 16일 강남구 청담동 한 명품 매장에서 음주 상태로 자신의 차량을 운전한 혐의를 ..",2026.04.06 05:00,https://www.fnnews.com/news/202604052256376234,파이낸셜뉴스
"트럼프 ""빌어먹을 호르무즈 열어라"" 대규모 공격 위협",,"[파이낸셜뉴스] 도널드 트럼프 미국 대통령은 5일(현지시간) 발전소와 교량 등의 폭격을 위협하면서 이란에 호르무즈 해협 개방을 압박했다.트럼프 대통령은 이란을 향해 '미친놈들'이라고 원색적으로 비난하기도 했다.트럼프 대통령은 이날 오전 사회관계망서비스(SNS) 트루스소셜에 게시물을 올려 ""화요일(7일)은 이란에 발전소의 날, 교량의 날""이라며 ""..",2026.04.05 22:59,https://www.fnnews.com/news/202604052255039768,파이낸셜뉴스
"""韓 드라마 때문에 못살겠다""..日 ‘슬램덩크’ 동네 주민들 '폭발'",,"[파이낸셜뉴스] 일본 가나가와현 가마쿠라시가 최근 한국 드라마 촬영지로 주목받으며 관광객들 때문에 몸살을 앓고 있다.5일 일본 아사히신문에 따르면 가마쿠라시가 이미 애니메이션 ‘슬램덩크’로 오버투어리즘 문제를 겪는 상황에서 한국 드라마로 인해 추가적인 불편을 떠안게 됐다고 전했다. 지난 1월 고윤정, 김선호 주연의 넷플릭스 드라마 ‘이 사랑 통역되나요?’에..",2026.04.06 04:50,https://www.fnnews.com/news/202604052240333451,파이낸셜뉴스
"""앗 뜨거!"" 기계가 통증을 느낀다… 로봇에 이식한 '인간의 본능' [언박싱 연구실]",,"택배 상자를 열 때의 설렘, 기억하시나요? 대학 연구실에서는 지금 이 순간에도 우리 삶을 바꿀 놀라운 발견들이 쏟아지고 있습니다. 다만 '논문'이라는 두꺼운 포장지에 쌓여있을 뿐이죠. '언박싱 연구실'에서는 복잡한 수식과 이론 대신, 여러분이 알고 싶은 알맹이만 쏙 골라 담겠습니다. 자, 그럼 상자를 열어볼까요? 오늘 언박싱할 주인공은 바로 이 연구입니다. [파이낸..",2026.04.06 05:56,https://www.fnnews.com/news/202604052135252938,파이낸셜뉴스
"""스토킹 피해자가 오히려 피의자 됐다"" 호소..서유리 ""끝까지 싸울 것""",,"[파이낸셜뉴스] 성우 겸 방송인 서유리가 스토킹 피해를 알리며, 오히려 피의자가 됐다고 밝혔다.서유리는 5일 자신의 SNS를 통해 ""스토킹을 당한 피해자가, 피해를 당했다고 말했다는 이유로, 엄벌을 탄원했다는 이유로, 지금 이 순간 피의자 신분으로 검찰 수사를 받고 있다""고 호소했다. 서유리는 지난 2020년 A씨가 온라인 커뮤니티에 자신을 향한 수천 건..",2026.04.06 04:40,https://www.fnnews.com/news/202604052128068798,파이낸셜뉴스
"'골프 회원권' 직거래 플랫폼 그린판다, 누적 거래액 300억원 돌파",,"[파이낸셜뉴스] 골프 회원권 P2P 직거래 플랫폼 그린판다는 서비스 론칭 이후 플랫폼 누적 거래액이 300억 원을 돌파했다고 5일 밝혔다.최근 출시한 '판다캐시백' 프로그램이 출시 1주일 만에 50건 이상의 추천 거래를 유도하며, 거래액 성장을 견인했다. 거래 추천인에게 거래액의 일부를 현금으로 지급하는 방식으로, 추천 거래가 성사되면 추천인과 거래 당사자 모두 ..",2026.04.05 21:20,https://www.fnnews.com/news/202604052114514474,파이낸셜뉴스
이란-오만 '호르무즈 해협 통항 보장 방안' 논의,,"[파이낸셜뉴스] 호르무즈 해협 연안국인 이란과 오만이 원활한 해협 통항을 보장하기 위한 방안을 논의했다.5일 외신에 따르면 양국은 이날 외무부 차관급 회담을 열고 현재 지역 정세를 고려한 원활한 해협 통항 보장 방안을 논의했다.  오만 국영 통신사는 ""양측 전문가들이 이 문제에 대해 여러 가지 비전과 제안을 제시했다""고 전했다.호르무즈 ..",2026.04.05 20:42,https://www.fnnews.com/news/202604052038550465,파이낸셜뉴스
"""요리 안할거냐""...맞벌이 며느리에게 '밥상' 차리라는 시모 [어떻게 생각하세요]",,"[파이낸셜뉴스] 맞벌이 부부인 워킹맘이 식사 해결 방식을 두고 시어머니와 갈등을 빚고 있다는 사연이 전해졌다. 5일 한 온라인 커뮤니티에 글을 올린 A씨는 ""밀키트가 그렇게 나쁜 거냐""면서 ""맞벌이를 하고 있고 두 사람의 월수입을 합치면 800만원 이상이다. 솔직히 집에서 요리는 거의 하지 않는다""고 했다. 결혼 8년차로 남편과 같은 회사에 다닌다..",2026.04.06 05:20,https://www.fnnews.com/news/202604052038103878,파이낸셜뉴스
"野공관위, 광주특별시장 추가 공모..이정현 출마 선언",,"[파이낸셜뉴스] 국민의힘 공천관리위원회가 6·3 지방선거 전남·광주통합특별시(광주특별시)에 대해 추가 공모를 실시하겠다고 밝힌 가운데, 이정현 전 공관위원장이 5일 ""몸부림이라도 쳐보고 싶다""며 광주특별시장 출마를 선언했다.이 전 위원장은 이날 사회관계망서비스(SNS)를 통해 ""누군가는 호남에서 보수가 아직 완전히 죽지 않았다는 것을..",2026.04.05 19:57,https://www.fnnews.com/news/202604051944409155,파이낸셜뉴스
"李대통령, 벚꽃축제 시민들과 깜짝소통…""신혼부부가 정말 중요""",,"[파이낸셜뉴스] 이재명 대통령과 김혜경 여사는 5일 서울 여의도복음교회에서 부활절 연합예배를 마친 후 윤중로에 나가 벚꽃놀이를 즐기러 온 시민들과 깜짝 소통에 나섰다.강유정 청와대 수석대변인은 이날 서면 브리핑을 통해 이같이 밝혔다.시민들은 '대통령님, 여사님 파이팅', '반갑습니다', '감사합니다', '여기도 봐주세요'등을 외치며 이 대통령 부부를 반갑게 맞이했..",2026.04.05 19:48,https://www.fnnews.com/news/202604051942098912,파이낸셜뉴스
"李대통령, 식목일 맞아 청와대에 체리나무·복사나무 심어",,"[파이낸셜뉴스] 이재명 대통령은 5일 식목일을 맞아 관저와 청와대에 나무를 심었다.이 대통령은 이날 페이스북을 통해 ""제81회 식목일을 맞아 관저와 청와대에도 새 생명을 심었다""면서 ""체리나무와 복사나무다. 아직은 작은 묘목이지만 따스한 봄 햇살이 더해지면, 국민 여러분의 정성으로 키워낸 나무들처럼 머지않아 꽃을 피우고 풍성한 열매를 맺겠지요&qu..",2026.04.05 19:32,https://www.fnnews.com/news/202604051927053137,파이낸셜뉴스
"홍익표 ""상황 장기화될 경우 하반기 추가 추경도 조심스럽게 전망""",,"[파이낸셜뉴스] 홍익표 청와대 정무수석비서관은 5일 ""(중동) 상황이 장기화할 경우 이번 추가경정예산(추경) 이후에도 하반기에 추가적인 추경이 필요할 수도 있다는 전망까지도 조심스럽게 내다보고 있다""고 밝혔다.홍 수석은 이날 MBN '정운갑의 집중분석'에 출연해 국민의힘에서 현재 국회 심의를 기다리는 추경안이 6월 지방선거를 겨냥한 것 아니냐고 비..",2026.04.05 19:27,https://www.fnnews.com/news/202604051920186534,파이낸셜뉴스
"GS칼텍스·베올리아 ""여수공장 혁신""",,GS칼텍스가 글로벌 환경 솔루션 기업 베올리아와 손잡고 여수공장 유틸리티 운영 혁신과 지속가능 경영 강화에 나선다. GS칼텍스는 지난 3일 베올리아와 포괄적 업무협약(MOU)을 체결하고 환경·에너지·디지털 전 영역을 아우르는 통합 솔루션 구축에 착수했다고 5일 밝혔다. 이번 협약은 에마뉘엘 마크롱 프랑스 대통령 방한을 계기로 이뤄졌으며 기존 수..,2026.04.05 19:03,https://www.fnnews.com/news/202604051902263426,파이낸셜뉴스
부산 숙원 '하단~녹산선' 본궤도,,"부산시가 서부산 교통 편의를 높일 도시철도 하단~녹산선 건설사업의 설계업체 선정을 위한 최종 적격심사를 마쳤다. 2028년 착공을 목표로 기본 및 실시설계 등 각종 행정 절차를 본격적으로 밟을 것으로 보인다. 시는 하단~녹산선 3개 공구 설계를 맡을 업체에 대한 적격심사를 모두 마쳤다고 5일 밝혔다. 심사를 마치는 대로 열흘 안에 업체와 계약을 진행하는데, 시..",2026.04.05 19:03,https://www.fnnews.com/news/202604051902236500,파이낸셜뉴스
"대선주조, 13년째 중증장애인 부부 결혼식 지원",,부산 명문향토기업 대선주조가 올해로 13년째 지역 중증장애인 부부의 새로운 출발을 뒷받침하고 있다. 대선주조는 지난 2일 오후 2시 30분 부산시민회관 소극장에서 열린 '2026년 제37회 부산중증장애인 합동결혼식'을 후원했다고 5일 밝혔다. 부산지체장애인단체협의회가 주최하는 이 행사는 경제적 여건 등으로 예식을 올리지 못한 중증장애인 부부들을 위해 마련된 ..,2026.04.05 19:03,https://www.fnnews.com/news/202604051902176883,파이낸셜뉴스
"""장애인-기업 연결... 양질 일자리 창출""",,부산시가 장애인들에게 양질의 일자리를 제공하기 위한 프로젝트를 추진한다. 민관이 협업해 장애인일자리 직무디자인단을 발족하고 전국 지방자치단체 중에선 처음으로 장애인 자영업자와 재택근무자를 위한 '장애인 특화 공유 오피스'를 조성한다 시는 지난 3일 시청 대회의실에서 지속 가능한 양질의 장애인 일자리 창출을 위한 'B-일사천리 프로젝트' 비전을 선포하고..,2026.04.05 19:03,https://www.fnnews.com/news/202604051902160785,파이낸셜뉴스
부산 기초단체 '3구 3色' 해양수산부 신청사 유치전 후끈,,"부산으로 이전한 해양수산부가 지난해 12월부터 동구 수정동 부산진역 근처에 임시청사에서 본격 업무에 들어갔다. 임시청사 본관과 별관 두 곳의 임차 기한은 각각 2030년, 2031년까지다. 따라서 올해 신청사 부지를 선정하고 내년 초에는 설계에 들어갈 것으로 예상된다. ■동구 ""북항 부지 준비된 인프라""이에 기존 임시청사를 유치한 부산 동구와 부산항..",2026.04.05 19:03,https://www.fnnews.com/news/202604051902104560,파이낸셜뉴스
절세·성장 동시에 누리는 'BNK코스닥벤처펀드',,"BNK자산운용은 벤처기업과 코스닥 상장(예정) 기업에 투자하는 'BNK코스닥벤처펀드'를 출시한다고 5일 밝혔다. 이 펀드는 벤처기업 신주에 15% 이상, 벤처기업 또는 벤처기업 해제 후 7년 이내 코스닥 상장 중소·중견기업의 신주 및 구주에 35% 이상 투자하는 상품이다. 해당 투자 요건을 충족할 경우 코스닥 공모주 물량의 30%를 우선 배정받을 수 있어, 기업공개..",2026.04.05 19:03,https://www.fnnews.com/news/202604051902097175,파이낸셜뉴스
"부산 롯데百 4곳, 19일까지 스포츠·아웃도어 특가전",,"부산지역 롯데백화점 4개점이 본격적인 야외 활동 시즌을 맞아 스포츠와 아웃도어를 아우르는 대규모 행사를 선보인다. 롯데백화점은 오는 19일까지 상반기 최대 규모 스포츠 & 아웃도어 축제인 '롯데 액티브 위크'를 진행한다고 5일 밝혔다. 행사 기간 중 스포츠, 애슬레저, 아웃도어 카카테고리의 주요 브랜드는 상반기 최대 수준의 구매 혜택과 함께 고객 선호도..",2026.04.05 19:03,https://www.fnnews.com/news/202604051902048829,파이낸셜뉴스
어묵 한계 뛰어넘는 혁신 '삼진어묵'... 세계적 권위 뉴욕페스티벌서 첫 1위,,대한민국 대표 어묵 브랜드 삼진어묵이 세계적 권위를 자랑하는 '2026 뉴욕페스티벌 대한민국 국가브랜드 대상(2026 NYF K-NBA)'에서 어묵 부문 최초로 1위를 차지했다고 5일 밝혔다. 뉴욕페스티벌 대한민국 국가브랜드 대상은 세계 3대 광고제 중 하나인 뉴욕페스티벌이 주최하는 글로벌 브랜드 시상식이다. 자체 개발한 평가 지표인 '국가브랜드경쟁력지수(NCI)'를 기..,2026.04.05 19:03,https://www.fnnews.com/news/202604051902006470,파이낸셜뉴스
"동아대 ""외국인 유학생, 취업·정착까지 지원""",,"동아대가 외국인 유학생 취업 지원에 발벗고 나섰다. 외국인 유학생의 초기 정착이나 비자·체류, 문화 및 학습 등 단순 지원을 넘어 졸업 후까지 지속적 커리어를 관리하는 '장기 지원 시스템'을 새롭게 구축하겠다는 취지다. 5일 동아대학교에 따르면 유학생을 대상으로 학점 인정형 현장실습을 처음으로 도입하고 전문 취업 지원 프로그램인 '스텝 업(STEP UP)..",2026.04.05 19:02,https://www.fnnews.com/news/202604051901575512,파이낸셜뉴스
부산 노동안전지킴이 1명 사업체 2만곳 맡아… 충남의 3배,,부산지역에서 발생한 산업재해 사고의 70%가 50인 미만 소기업에서 발생한 것으로 나타난 가운데 노동안전지킴이 1명이 맡는 사업체 수는 전국 평균보다 많아 관련 사업을 확대·강화해야 한다는 목소리가 나온다. 최근 지역노동사회연구소가 발표한 보고서에 따르면 부산지역(2017~2024년) 전체 산업재해 사고의 71.8%가 50인 미만 사업장에서 발생했다. 사고 재..,2026.04.05 19:02,https://www.fnnews.com/news/202604051901550138,파이낸셜뉴스
"前 ADB 총재·자산토큰 대가 등 한자리에... 글로벌 석학, 韓금융 대전환기 방향 짚어 [미리보는 2026 FIND]",,파이낸셜뉴스가 오는 22일 서울 여의도 페어몬트 앰배서더 서울에서 주최하는 '2026 FIND·서울국제금융포럼'에서는 글로벌 금융·투자 분야 최고의 전문가들이 대거 참여해 한국 금융의 미래 방향을 논의할 예정이다. 이날 포럼에서는 가계·부동산에 머물러 있는 자금을 산업과 기술 등 생산적 부문으로 전환해야 한다는 '생산적 금융'의 필요성을 중..,2026.04.05 18:58,https://www.fnnews.com/news/202604051857266540,파이낸셜뉴스
관세 뚫은 K푸드... 대미수출 6% ↑,,최대 25%에 달하는 미국의 일방적인 상호관세 부과가 1년을 지났지만 K푸드 대미 수출은 괄목할 성장세를 기록한 것으로 나타났다. 다만 올해 들어 미국·이란전쟁에 따른 고환율과 유가 상승으로 원부자재 매입비용이 급증하며 대미 수출이 역성장세로 돌아서는 등 K푸드 시장에도 적신호가 켜졌다. 5일 한국무역협회와 한국농수산식품유통공사(aT)에 따르면 도..,2026.04.05 18:58,https://www.fnnews.com/news/202604051857237403,파이낸셜뉴스
"[단독] ""자잿값 20% 인상""… 건설현장 ‘중동發 청구서’ [미-이란 전쟁]",,"미국·이란전쟁이 촉발한 원자재 가격 급등의 청구서가 건설사들에 날아들었다. 나프타 수급 차질을 이유로 자재 가격 인상을 통보받은 협력사들이 건설사들에 이를 반영해줄 것을 요구하고 나선 것이다. 건설사들은 협상을 준비하면서도 결과적으로 공사비 증가가 불가피할 것으로 우려하고 있다. ■""납품가 올려달라"" 날아든 공문 5일 파이낸셜뉴스 취재 내..",2026.04.05 18:58,https://www.fnnews.com/news/202604051857224282,파이낸셜뉴스
"""사이드카 울리면 반대로""… 변동장에 개미들 ‘역매매 전략’",,"변동성 장세에서 개인투자자들의 '사이드카 역매매' 기류가 짙어지고 있다. 매도 사이드카가 발동되면 매수, 매수 사이드카가 울리면 매도로 대응하는 등 지난달 이후 코스피 총 9회 사이드카 중 7회에서 이 같은 추세가 나타나고 있다. 과거 학습효과에 기반한 변동성 장세 대응으로 풀이되지만 자칫 손실로 이어질 수 있어 주의해야 한다고 전문가들은 조언한다. 5일 ..",2026.04.05 18:58,https://www.fnnews.com/news/202604051857219805,파이낸셜뉴스
