title,thumbnail,short_content,write_time,link,company
"D-9, BTS 광화문 공연 앞두고 피싱 사기 경보..경찰은 암표단속",,[파이낸셜뉴스] 오는 21일 서울 광화문 일대에서 열리는 방탄소년단(BTS)의 컴백 행사를 앞두고 경찰이 피싱 사기 주의보를 내렸다. 경찰은 또 공연 당일 BTS 티켓 암표거래를 '암행단속'할 예정이다.12일 서울경찰청은 소방 당국 사칭 사기를 당할 뻔했다는 종로구 한 숙박업소의 사례를 파악해 사실 확인 중이라고 밝혔다.숙박업소를 운영하는 A씨는 지난 5일 자신을 서울소..,2026.03.12 19:33,https://www.fnnews.com/news/202603121931587309,파이낸셜뉴스
"""점수 조작해서 미안..떡볶이는 미워하지마"" 두끼, 대만서 도 넘은 '혐한' 마케팅 발칵",,[파이낸셜뉴스] 한국 월드베이스볼클래식(WBC) 8강 진출에 대해 일부 대만 누리꾼들이 '점수 조작'이라는 근거 없는 주장을 펼친 가운데 현지에 진출한 국내 유명 기업이 혐한 정서를 자극하는 마케팅을 펼쳐 논란이 되고 있다.12일 업계에 따르면 두끼 대만 공식 SNS 계정엔 무릎을 꿇은 남성이 종이를 들고 사과하는 사진 여러 장이 올라왔다. 남성이 들고 있는 종이에..,2026.03.13 04:50,https://www.fnnews.com/news/202603121926467520,파이낸셜뉴스
[속보] 석유최고가격제 13일 시행.. 휘발유 도매가 1724원,,[파이낸셜뉴스]  aber@fnnews.com 박지영 기자,2026.03.12 19:30,https://www.fnnews.com/news/202603121924102532,파이낸셜뉴스
"전국 법관회의 ""재판소원제 혼란 예상..법왜곡죄 대응 형사법관 보호 강화""",,"[파이낸셜뉴스] '사법 3법'(법왜곡죄·재판소원·대법관 증원) 시행 첫날 진행된 전국 법관회의에서는 ""재판소원 도입으로 재판실무와 제도운영에 혼란이 초래될 수 있고, 법왜곡죄 도입 후 형사재판부 기피 현상이 심화될 수 있다""는 우려가 나왔다.대법원 소속 법원행정처는 12일 오후 2시부터 김시철(사법연수원 19기) 사법연수원장 주재로 전국 각급..",2026.03.12 19:15,https://www.fnnews.com/news/202603121911556238,파이낸셜뉴스
"정유업계 ""석유 최고가격제 시행에 적극 협조""",,"[파이낸셜뉴스]  정유업계가 정부의 ‘석유 최고가격제’ 시행에 협조하겠다는 입장을 내놨다.대한석유협회는 이날 보도자료를 통해 ""정부에서 석유제품 가격 안정 방안으로 발표한 '석유 최고가격제 시행에 적극 협조할 것”이라며 이 같이 밝혔다.정부는 미국·이란 전쟁 여파로 고공 행진 중인 국내 기름값을 잡기 위해 1997년 유가 자유화 이후 처음..",2026.03.12 19:22,https://www.fnnews.com/news/202603121909292993,파이낸셜뉴스
석유정제업자 유류 반출량 전년 대비 90% 이상 반출...13일부터 시행,,[파이낸셜뉴스] 정부는 최근 유가가 급등하고 있는 상황에서 폭리 목적의 매점 및 판매기피 행위 등을 방지하기 위해 석유제품 매점매석행위 금지 등에 관한 고시를 법제처 및 규제 심사 등을 신속히 진행해 오는13일부터 시행한다고 12일 밝혔다.  석유제품 매점매석행위 금지 등에 관한 고시에 따르면 석유정제업자는 3월 및 4월 월별 유종별 유류 반출량을 각각 ..,2026.03.12 19:10,https://www.fnnews.com/news/202603121905089445,파이낸셜뉴스
"부산진해경자청, 입주기업 상생 현장투어",,부산진해경제자유구역청이 12일 화전·녹산산단에 위치한 태웅을 방문해 입주기업 대표들과 함께 '제3회 BJFEZ 기업현장투어'를 실시했다. 이번 기업현장투어는 최근 국내외 정치·경제 불확실성 심화로 기업 경영환경이 악화되는 상황에서 입주기업 간 상호 학습과 혁신사례 공유를 통해 실질적인 경영전략을 모색하기 위해 마련됐다. 경자청은 지난해 두 ..,2026.03.12 19:00,https://www.fnnews.com/news/202603121900153842,파이낸셜뉴스
지역 중소기업에 정책자금 5000억 푼다,,"부산시가 금융·보증기관과 협력해 총 5000억원 규모의 중소기업 정책자금을 지원한다. 시는 12일 오후 시청 국제의전실에서 '부산 넥스트루트(Next Root) 특별금융 지원' 업무협약을 체결했다고 밝혔다. 이번 업무협약은 지역 중소기업의 자금 애로를 해소하고 성장 잠재력이 높은 기업에 생산적 금융을 집중 공급, 지역경제의 미래 성장동력을 확보하기 위해 마련..",2026.03.12 19:00,https://www.fnnews.com/news/202603121900146237,파이낸셜뉴스
"유영한 부산세관장, 삼성전기 찾아 수출현장 점검",,"유영한 부산본부세관장이 지난 11일 부산 강서구의 삼성전기 사업장을 찾아 생산·수출현장을 점검하고 애로사항을 확인했다고 12일 밝혔다. 이번 방문은 최근 글로벌 통상환경 변화에 따른 조처다. 미래의 불확실성이 커지면서 첨단 전자부품 수출기업의 어려움을 사전에 파악, 보세공장 운영 제도 개선과 수출경쟁력 강화를 지원할 계획이디. 이날 삼성전기 측..",2026.03.12 19:00,https://www.fnnews.com/news/202603121900062182,파이낸셜뉴스
"부산항만공사, ESG 우수기업에 현판 수여",,"부산항만공사(BPA)는 지난 11일 부산 강서구 광림마린테크 본사에서 '2025년 협력사 ESG 지원사업'의 우수 중소기업 현판 수여식을 했다고 12일 밝혔다. 공사는 지난해 6월부터 5개월간 협력 중소기업 10개 회사에 5500만원의 예산을 들여 협력사 ESG 지원사업을 추진했다. 동반성장위원회의 '중소기업 ESG 표준 지침'을 기반으로 기업 진단, 맞춤형 지표 적용, 교육 및..",2026.03.12 19:00,https://www.fnnews.com/news/202603121900039399,파이낸셜뉴스
"성석동 대표, 동아대에 발전기금 1억 기부",,"동아대학교는 수근종합건설 대표이사이자 동아대 부동산학 박사과정 원우회장인 성석동 회장이 부동산학 교육과정 발전과 학생지원 등을 위한 발전기금 1억원을 기부했다고 12일 밝혔다. 성 회장은 아파트 브랜드 '봄여름가을겨울'로 잘 알려진 수근종합건설 대표이사로, 부동산학 박사과정 원우회장을 맡아 동문 네트워크 활성화와 교육과정 발전 등을 위해 다양한 활..",2026.03.12 19:00,https://www.fnnews.com/news/202603121900010256,파이낸셜뉴스
부산! 소리 질러~ 부산국제록페스티벌 정부가 쑥쑥 키운다,,부산시는 국내 최장수 록페스티벌인 부산국제록페스티벌이 문화체육관광부가 추진하는 '글로벌 축제' 육성 사업 공모에서 '예비 글로벌 축제'에 최종 선정됐다고 12일 밝혔다. 이번 공모는 문체부가 방한 관광객 3000만명 시대를 열기 위해 전국의 문화관광축제 중 세계적인 잠재력을 가진 축제를 선별해 집중 지원하는 사업이다. 이번 예비 글로벌 축제 선정으로 부산..,2026.03.12 19:00,https://www.fnnews.com/news/202603121859586506,파이낸셜뉴스
사상구에 지역 1호 '반려동물 숲속 놀이터' 개소,,부산 사상구에 지역 최초의 숲속 반려동물 놀이터가 조성돼 19일부터 무료로 운영된다. 사상구는 오는 19일 사상근린공원 일원에서 숲속 반려동물 놀이터 개장식을 연다고 12일 밝혔다. 행사에는 신라대 반려동물 학부가 참여한 반려견 어질리티(장애물 달리기) 공연 등의 볼거리와 주민이 함께 하는 축하 공연이 예정됐다. 놀이터는 부산시의 15분 도시' 정책의 확산모..,2026.03.12 19:00,https://www.fnnews.com/news/202603121859566603,파이낸셜뉴스
"부산과학관, 3월 14일'세계 수학의 날'행사 풍성",,국립부산과학관은 세계 수학의 날을 기념해 온 가족이 놀이와 체험으로 수학을 즐기는 축제 '수학이 좋은 아이(AI)!'를 오는 14~15일 개최한다고 12일 밝혔다. 세계 수학의 날(매년 3월 14일)은 유네스코가 수학의 중요성을 알리기 위해 원주율의 근삿값인 3.14에서 착안해 지정한 날이다. 국립부산과학관은 인공지능과 네트워크 등 미래 기술의 기초가 되는 수학을 시..,2026.03.12 19:00,https://www.fnnews.com/news/202603121859530412,파이낸셜뉴스
"""금정산 국립공원 지정 축하""... 반달이와 꼬미,롯데百 온다",,"롯데백화점 센텀시티점이 금정산 국립공원 지정을 축하하고, 지속 가능한 자연의 가치를 전하기 위한 특별한 공간을 마련했다. 롯데백화점 센텀시티점은 오는 13~20일 지하 2층 특설매장에서 국립공원공단과 손잡고 국립공원 캐릭터 상품 팝업스토어(포스터)를 진행한다고 12일 밝혔다. 이 행사는 대한민국 24번째 국립공원으로 이름을 올린 금정산의 신규 지정을 기념..",2026.03.12 19:00,https://www.fnnews.com/news/202603121859498239,파이낸셜뉴스
부산교육청 돌봄 '우리 동네 자람터' 16곳으로 확대,,부산시교육청이 지난 11일 연제구 더샵파크시티 내 작은 도서관에서 '우리 동네 자람터' 개소식을 열고 본격적인 운영에 들어갔다고 12일 밝혔다. 이날 문을 연 우리 동네 자람터는 아파트 단지 내 유휴 공간인 '작은 도서관'을 활용해 마련한 돌봄 공간이다. 시교육청은 이번 개소를 계기로 지역 내 우수한 인프라를 갖춘 아파트 단지 및 공공기관과의 협력을 지속적으로..,2026.03.12 19:00,https://www.fnnews.com/news/202603121859485103,파이낸셜뉴스
18일 '국제물산업박람회' 개막,,부산시 상수도사업본부는 오는 18~20일 3일간 벡스코에서'2026 국제물산업박람회'를 개최한다고 12일 밝혔다. 이번 박람회는 '스마트 워터 블루 퓨처'라는 주제로 기후 위기 대응과 디지털 전환 최신 트렌드를 학습하고 상하수도 관리 체계의 선진화 방안을 모색한다. 2016년 이후 10년 만에 다시 부산서 열리는 국제물산업박람회는 국내 물산업 활성화와 관련 종사자들의..,2026.03.12 19:00,https://www.fnnews.com/news/202603121859461496,파이낸셜뉴스
폐유 8만t 선박에 숨겨 가짜 석유 만들어 판 70대 구속,,"법인세 등 약 100억원대의 세금을 체납하고도 법인자금을 횡령하고, 가짜 석유와 불법 재생유를 제조한 혐의로 70대가 구속돼 검찰에 넘겨졌다. 남해해양경찰청은 특정경제범죄법·폐기물관리법·위험물관리법·석유사업법 위반 등 혐의로 A씨(70대)를 구속 수사한 뒤 사건을 검찰에 송치했다고 12일 밝혔다. A씨는 지난 2008년께 국세청으로부터 허위..",2026.03.12 19:00,https://www.fnnews.com/news/202603121859443893,파이낸셜뉴스
"부산, 3년내 외국인 방문객 500만명 유치 향해 달린다",,"지난해 사상 첫 외국인 방문객 300만명을 기록한 부산시가 오는 2028년까지 방문객 500만명 유치를 목표로 내걸고, 지역 유망 관광상품 및 관광 플랫폼 발굴에 나선다. 시와 부산관광공사는 이달 중 '부산 K-관광 콘텐츠 활용 FIT 상품 기획전'과 '부산 관광사업체 글로벌 OTA 진출 코디네이팅·컨설팅 지원사업' 2개 공모전을 동시 추진한다고 12일 밝혔다. 이번..",2026.03.12 19:00,https://www.fnnews.com/news/202603121859411259,파이낸셜뉴스
"美, 韓中日 겨냥 '무역법 301조' 꺼냈다 [美, 무역법 301조 조사]",,"미국의 도널드 트럼프 정부가 '상호관세'를 대신하는 관세를 부과하기 위해 '무역법 301조'를 동원한 사전 조사에 들어갔다. 미국 무역대표부(USTR)는 11일(현지시간) 홈페이지를 통해 한국, 중국, 일본 등 15개국과 유럽연합(EU)의 불공정 무역 관행을 조사한다고 밝혔다. 15개국에는 싱가포르, 스위스, 노르웨이, 인도네시아, 말레이시아, 캄보디아, 태국, 베트남, 대만, 방..",2026.03.12 18:56,https://www.fnnews.com/news/202603121855598322,파이낸셜뉴스
중동戰에 美증시 횡보... 국장 돌아온 서학개미 [美-이란 전쟁],,중동 리스크로 서학개미의 국내 유턴 행렬이 이어지고 있다. 미국 증시에 비해 국내 증시가 뚜렷한 회복 탄력성을 보이면서 매수 열기가 한국으로 옮겨오는 양상이다. 실제 이달 들어 개인투자자들의 미국 주식 순매수 규모는 급격히 쪼그라든 반면 국내 주식 순매수 금액은 전달 대비 3배 이상으로 치솟았다. 12일 한국예탁결제원 세이브로에 따르면 이달 2~11일 국내 투자자..,2026.03.12 18:56,https://www.fnnews.com/news/202603121855565223,파이낸셜뉴스
비축유 4억배럴 방출에도 유가 장중 100弗 돌파 [美-이란 전쟁],,"【 뉴욕=이병철 특파원】 국제에너지기구(IEA) 32개국이 미국·이스라엘과 이란의 전쟁으로 국제유가가 치솟자 전략비축유를 출하하기로 합의했지만 국제유가는 오히려 상승했다. 이란이 호르무즈해협 인근에서 유조선과 상선을 공격하고, 양측의 교전이 더 격렬해지면서 시장 불안감도 커졌다. 시장은 비축유 출하량도 역부족이라고 반응했다. 국제유가의 벤치마..",2026.03.12 18:56,https://www.fnnews.com/news/202603121855546887,파이낸셜뉴스
보유세 실효세율 0.15%→1% 안팎까지 올리나,,"정부가 다주택자 규제에 이어 초고가·비거주 1주택, 이른바 '똘똘한 한 채'까지 규제범위를 확대하는 방향으로 부동산정책을 구상하고 있다. 오는 5월 다주택자 양도세 중과에 이어 보유세 인상, 장기보유특별공제(장특공제) 조정까지 거론하며 투자·투기형 1주택자도 정조준했다. ■'싱가포르식 실거주 중심 과세' 12일 김윤덕 국토교통부 장관은 라디오 ..",2026.03.12 18:56,https://www.fnnews.com/news/202603121855524197,파이낸셜뉴스
집 소유 이익 안 되게…'초고가·비거주 1주택' 보유세 개편,,"정부가 초고가 및 비거주 1주택자에 대한 보유세 강화를 공식화했다. 특히 집을 가지고 있다고 해서 경제적으로 이익이 되지 않도록 만들겠다고 했다. 김윤덕 국토교통부 장관은 12일 CBS 라디오 '박성태의 뉴스쇼'에 출연, ""세제와 금융, 유동성 관리를 망라한 전방위적 부동산 대책을 준비하고 있다""며 이같이 밝혔다. ■""초고가·비거주 1주택..",2026.03.12 18:56,https://www.fnnews.com/news/202603121855518933,파이낸셜뉴스
'법왜곡죄 1호' 고발당한 조희대... 李대통령 '선거법 파기환송' 관련 [재판소원제 시행 첫날],,이재명 대통령 공직선거법 위반 사건을 파기환송한 조희대 대법원장이 12일 0시에 공포·시행된 '사법 3법'(법왜곡죄·재판소원·대법관 증원법) 중 법왜곡죄 혐의로 지난 2일 이미 고발된 것으로 확인됐다. 재판소원은 '시리아인 강제퇴거명령 사건'(1호)을 비롯해 시행 첫날 오후 6시 기준 16건이 접수됐다. 사법개편 3법의 문이 열리면서 사법체계..,2026.03.12 18:56,https://www.fnnews.com/news/202603121855483373,파이낸셜뉴스
호르무즈 선박 공격한 이란... 中에는 원유 1170만배럴 수출 [美-이란 전쟁],,"호르무즈 해협이 사실상 봉쇄된 가운데, 이란은 이 해협을 통해 1000만배럴 이상의 원유를 중국에 수출해 온 것으로 알려졌다. 탱커트래커스닷컴 공동 설립자 사미르 다마디는 11일(현지시간) 미 경제방송 CNBC에 ""이란이 미국·이스라엘 공습이 이뤄진 이후 호르무즈 해협을 통해 최소 1170만배럴의 원유를 수송했으며, 모든 원유가 중국으로 향했다""고 밝혔..",2026.03.12 18:54,https://www.fnnews.com/news/202603121853495561,파이낸셜뉴스
휘발유 출고가 1724원·경유 1713원… 100∼400원 싸진다,,국제유가 급등에 대응해 정부가 30년 만에 석유 가격 통제 카드를 꺼냈다. 정유사가 주유소에 공급하는 가격에 상한선을 두는 '석유 최고가격제'를 13일 0시부터 시행한다. 다만 전문가들은 단기적인 물가 안정 효과는 기대할 수 있지만 시장 가격 신호를 왜곡해 공급 감소 등 부작용이 나타날 가능성도 있다고 우려했다. 12일 산업통상부에 따르면 석유 최고가격은 '기준가격&..,2026.03.12 19:00,https://www.fnnews.com/news/202603121853454655,파이낸셜뉴스
"'무소불위' 관세카드 꺼낸 美… 현실화땐 철강·석화 특히 타격 [美, 무역법 301조 조사]",,"미국이 한국, 중국, 유럽연합(EU) 등 16개국을 대상으로 이른바 '무소불위' 수단으로 불리는 무역법 301조(1974년 제정) 조사 개시를 선언하면서 대미수출 5대 흑자업종을 중심으로 긴장이 고조되고 있다. 미국 무역대표부(USTR)가 무역법 301조 발동과 관련한 관보에서 지목한 한국의 대미흑자 품목은 전기전자, 자동차, 기계, 철강, 선박이며 현재 구조조정 중인 석유..",2026.03.12 18:54,https://www.fnnews.com/news/202603121853422975,파이낸셜뉴스
0시 10분 '1호 사건' 접수… 피청구인은 대법원 [재판소원제 시행 첫날],,"판사·검사의 오판을 처벌하는 법왜곡죄와 법원의 확정판결에 불복해 헌법재판소의 판단을 다시 받는 재판소원 시행 첫날부터 법조계가 혼란에 휩싸였다. 이재명 대통령 사건을 처리하면서 논란을 빚었던 '사법부 수장' 조희대 대법원장이 법왜곡죄로 고발당했고, 난민 사건과 국가배상 지연 사건 등도 재판소원으로 잇따라 접수됐다. ■""졸속 재판""VS&..",2026.03.12 18:54,https://www.fnnews.com/news/202603121853343533,파이낸셜뉴스
"공정위, 식탁물가 담합 단속 속도… 다음 타깃은 '교복·석유·장례식장'",,"공정거래위원회가 식탁 물가 담합 단속에 속도를 내고 있다. 설탕과 돼지고기 제재를 마무리한 데 이어 밀가루와 전분당 사건을 상반기 내 끝내고, 교복·석유·장례식장에 대한 조사도 신속히 진행할 계획이다. 공정위는 12일 민생물가 특별관리 관계장관 태스크포스(TF)에서 이 같은 내용의 '민생품목 담합 제재 사례 및 대응 현황'을 발표했다. 우선 공..",2026.03.12 19:00,https://www.fnnews.com/news/202603121853328034,파이낸셜뉴스
라면 40~100원·식용유 300~1250원 ↓… 4월부터 가공식품값 내린다 [美-이란 전쟁],,"중동 사태로 국제 원자재 시장의 변동성이 확대되는 가운데서도 4월부터 라면과 식용유 등 주요 가공식품 가격이 내려갈 예정이다. 라면 40여개는 약 40~100원, 식용유 5개 유종은 약 300~1250원 가격이 인하될 계획이다. 농림축산식품부는 12일 국민의 물가 부담을 완화하기 위해 식품업계와 협력한 결과, 라면과 식용유 등 주요 가공식품의 가격 인하가 이뤄지고 있다고..",2026.03.12 19:00,https://www.fnnews.com/news/202603121853309659,파이낸셜뉴스
"정부 ""美 관세 15% 지켜지도록 협의… 301조, 비관세장벽과는 별개"" [美, 무역법 301조 조사]",,"통상당국은 미국이 12일 무역법 301조 조사 절차를 시작한 점과 관련, ""한미가 기존에 합의한 이익균형이 지켜지도록 미국 측과 협의해 나갈 것""이라고 밝혔다. 지난해 11월 한미가 합의한 상호관세율 15%를 마지노선으로 잡고 대응에 나설 것으로 예상된다. 미국 측도 미 대법원의 국제비상경제권한법(IEEPA) 기반 상호관세 부과 위헌 판결 이전 관세율 회복이..",2026.03.12 18:54,https://www.fnnews.com/news/202603121853302321,파이낸셜뉴스
임대차 분쟁·세금·과징금 등 재산권 사건도 재판소원 가능 [재판소원제 시행 첫날],,"확정된 법원 판결의 헌법 위반 여부를 다투는 재판소원제도가 12일 공식 시행되면서 부동산·세금 등 재산권 관련 사건도 헌법재판소까지 이어질 수 있을 것으로 법조계는 내다본다. 임대차 분쟁이나 과세 처분을 놓고 '재산권 침해' 주장이 꾸준히 제기돼 온 만큼, 재판소원 절차에서도 유사한 불복이 이어질 것이란 분석이다. 법조계에 따르면 이날 시행된 개정 ..",2026.03.12 18:54,https://www.fnnews.com/news/202603121853296393,파이낸셜뉴스
"트럼프가 궤멸시켰다던 이란군, 유조선·상선 무차별 공격 [美-이란 전쟁]",,"미국·이스라엘의 이란 공격이 약 2주일 동안 지속되는 가운데 궤멸됐다고 알려졌던 이란군이 오히려 중동 일대에서 더 강력한 반격을 감행하면서 더 격렬한 전투가 전개되고 있다. 도널드 트럼프 미국 대통령은 이란에 ""더 부술 것이 없다. 이겼다""고 주장하면서도 ""일찍 떠나고 싶은 건 아니다. 우리는 임무를 마무리해야 한다""고 강조했다..",2026.03.12 18:54,https://www.fnnews.com/news/202603121853271862,파이낸셜뉴스
가상자산거래소도 ‘지급정지’ 의무화…보이스피싱 자금세탁 차단한다,,"[파이낸셜뉴스] 가상자산거래소에 금융회사와 동일한 수준의 보이스피싱 방지 및 피해구제 의무를 부과하는 법안이 국회 본회의를 통과했다. 이에 따라 가상자산거래소는 의심 거래를 상시 모니터링하고 범죄 의심 계정을 즉시 지급정지해야 한다. 구제 대상 자산범위도 기존 ‘금전’에서 ‘가상자산’으로 확대, 신종 범죄 수법에 노출된 피해자들의 신속한 재산 회복이..",2026.03.12 18:53,https://www.fnnews.com/news/202603121849444906,파이낸셜뉴스
가방 채운만큼 든든하니까… ‘보부상 빅백’ 뜬다 [Weekend 스타일],,"여성들의 가방 크기가 다시 커지고 있다. 한 손에 들어오는 미니백을 넘어 카드지갑, 휴대폰 등 최소한의 소지품을 넣을 수 있는 '마이크로백'이 주도하던 패션업계 트렌드가 다시 빅백으로 돌아온 것이다. '조용한 럭셔리' 흐름이 확산하면서 실용성과 우아함을 동시에 갖춘 대형 숄더백 등 빅백이 존재감을 드러내고 있다. ■간결한 디자인과 수납력 활용도 높아 12일 패션업..",2026.03.13 04:00,https://www.fnnews.com/news/202603121849345033,파이낸셜뉴스
인삼처럼 면역력 강화 돕는 도라지... 환절기에 먹으면 기침감기 줄어들어 [한의사 日 건강꿀팁],,"유난히 추웠던 겨울이 지나고 2월 말부터 날씨가 따뜻해져 겨울이 다 끝난 줄 알았다. 하지만 3월 초부터 강한 바람과 함께 기온이 급격히 내려가며 방심하던 이들에게 매서운 꽃샘추위를 경험하게 하고 있다. 한의원에서 환자들을 진료하다 보면 이번 겨울에는 독감이 창궐해 고열에 시달리는 분들이 많았다면, 3월 꽃샘추위에는 유독 기침 감기 환자가 많은 듯하다. ..",2026.03.12 18:50,https://www.fnnews.com/news/202603121849301921,파이낸셜뉴스
심인성 쇼크 생존자에 찾아온 우울증… 10명중 1명은 정신질환 겪는다,,"심장이 갑자기 제 기능을 못 해 혈액을 온몸에 충분히 보내지 못하는 '심인성 쇼크'는 중환자실 치료가 필요한 응급질환이다. 어렵게 급성기를 넘겨 퇴원하더라도, 이후의 삶은 심장만의 문제가 아닐 수 있다는 경고가 나왔다. 12일 질병관리청 국립보건연구원은 건강보험 자료 분석 결과 심인성 쇼크 생존자 10명 중 1명꼴로 퇴원 후 우울증·불안장애·불..",2026.03.12 12:00,https://www.fnnews.com/news/202603121849234849,파이낸셜뉴스
20대 연골로 돌아갈 수 있을까… 희망으로 떠오른 갈비뼈 세포 [Weekend 헬스],,"""서울대병원은 국가중앙병원으로서 새로운 치료법을 도입하고, 데이터를 축적·분석해 우리나라 전체의 의료 수준을 리딩해야 한다. 이번 자가연골세포 치료 도입도 부족했던 치료 포트폴리오를 채우는 과정이고, 여기서 얻은 데이터가 대한민국 모든 환자에게 혜택으로 돌아갈 수 있게 하는 것이 목표다."" 12일 서울대학교병원 정형외과 한혁수 교수는..",2026.03.13 04:00,https://www.fnnews.com/news/202603121849221783,파이낸셜뉴스
"'묻지마 폭행' 190cm 거구男, 테이저건 맞고도 멀쩡...경찰 4명이 제압 [영상]",,[파이낸셜뉴스] 일면식 없는 사람들을 상대로 '묻지마 폭행'을 저지른 것은 물론 흉기 위협까지 가한 40대가 경찰관의 삼단봉에 제압됐다.12일 경기남부경찰청은 전날 오후 8시께 안산시 단원구 선부역 길거리에서 발생한 특수협박 사건의 피의자 A씨의 검거 영상을 공개했다.당시 영상에는 길가에 세워진 승용차 문을 열고 운전자 40대 B씨를 폭행하는 A씨의 모습이 담겼다.얼..,2026.03.12 19:22,https://www.fnnews.com/news/202603121844428112,파이낸셜뉴스
