title,thumbnail,short_content,write_time,link,company
혁신 리빙·패션브랜드 한자리에.. 서울디자인위크 29만명 즐겼다,,'서울디자인위크'가 행사 5일간 29만명을 끌어모으며 흥행에 성공했다. 핵심 행사인 'DDP디자인페어'를 보기 위한 줄이 500m 이상 늘어서기도 했다. 22일 서울시에 따르면 지난 15일부터 19일까지 5일간 열린 'DDP디자인페어'의 누적 방문객은 29만명을 넘어섰다. 두 달 전 오픈한 '슈퍼 얼리버드 티켓'이 하루 만에 전량 매진됐고 관람객들은 앞다퉈 SNS에 감상평을 남..,2025.10.22 18:25,https://www.fnnews.com/news/202510221824489619,파이낸셜뉴스
경기 버스요금 6년만에 오른다… 25일 첫차부터 최대 400원,,"【 경기=김경수 기자】 경기도가 오는 25일 첫차부터 시내버스 요금을 올린다. 일반형·좌석형은 각 200원, 직행좌석형·경기순환형은 각 400원 인상된다. 2019년 9월 이후 6년 만이다. 도는 'The 경기패스'를 통해 도민 부담을 최소화하겠다는 입장이다. 경기도는 버스 업계의 경영 상황을 개선하고 안정적 대중교통 서비스 제공을 위해 도내 시내버스 요금..",2025.10.22 18:25,https://www.fnnews.com/news/202510221824465285,파이낸셜뉴스
"""토허제, 사유재산 침해 과도… 시장 왜곡하는 규제 철회하라""",,"서울 전역과 경기 일부 지역을 토지거래허가구역으로 묶은 정부의 10·15부동산 대책을 두고 ""과도한 사유재산 침해""이자 ""지방자치 근간의 훼손""이라는 비판이 쏟아지고 있다. 서울 뿐 아니라 이번 규제 여파로 자유로운 거래가 불가능해진 경기 일부 지역에서도 규제 철회를 요구하는 등 곳곳에서 불만이 터져나왔다. ■서울 15개구 ""..",2025.10.22 18:25,https://www.fnnews.com/news/202510221824348574,파이낸셜뉴스
"GS건설, 신기술·아이디어로 현장 난제 푼다",,"GS건설이 협력사 등 외부의 신기술 제안과 임직원들의 다양한 아이디어를 수렴하는 플랫폼 '혁신 아이디어 허브'를 신설한다고 22일 밝혔다. 혁신 아이디어 허브 플랫폼은 현장의 난제를 해결하기 위한 외부의 솔루션을 제안을 받고, 내부 임직원들의 안전확보·품질향상 등 아이디어를 수렴하는 두개의 창구로 운영된다. 플랫폼을 통해 제안된 기술과 아이디어는 ..",2025.10.22 18:25,https://www.fnnews.com/news/202510221824325059,파이낸셜뉴스
"""독보적 조경 역량 입증"" 삼성물산, 세계조경가협회상 2관왕",,삼성물산 건설부문이 세계조경가협회(IFLA)가 주관하는 2025 IFLA 아시아·태평양 지역 조경 어워즈에서 최우수상과 본상을 수상했다고 22일 밝혔다. 삼성물산은 서울시 서초구 래미안 원펜타스와 부산광역시 동래구 래미안 포레스티지 조경을 출품해 주거 부문에서 각각 최우수상과 본상을 받았다. 세계조경가협회는 1948년 창설돼 현재 80여개 회원국을 보유한 ..,2025.10.22 18:25,https://www.fnnews.com/news/202510221824280197,파이낸셜뉴스
규제 일주일새 서울 갭투자 매물 5000건 증발,,"정부의 10·15 대책 발표 후 일주일 새 서울 아파트 매물이 약 5000가구 사라진 것으로 나타났다. 규제 효력 발휘 전인 '5일장' 동안 거래가 활발히 이뤄지고, 이후 전세를 낀 '갭투자' 매물이 거둬지며 일어난 현상으로 풀이된다. 22일 부동산 빅데이터 플랫폼 아실에 따르면 이날 기준 서울 아파트 매매 매물은 6만8616가구로 집계됐다. 대책 발표 당일인 7만4044..",2025.10.22 18:24,https://www.fnnews.com/news/202510221824272106,파이낸셜뉴스
규제 학습 효과에 내집마련 서둘러…6~9월 넉달간 매수자 2만5147명,,새 정부 출범 이후 4개월 동안 서울 아파트 생애최초 매수자가 지난 2020년 이후 5년 만에 최고치를 기록한 것으로 조사됐다. 대출 옥죄기 등 강력한 규제정책으로 내집마련이 더 어려워질 수 있다는 불안심리가 작용한 것도 한 원인으로 보고 있다. 22일 법원 등기정보광장에 따르면 새 정부가 출범한 지난 6월부터 9월까지 서울 아파트 등 집합건물 생애최초 매수자는..,2025.10.22 18:24,https://www.fnnews.com/news/202510221824251941,파이낸셜뉴스
수서역세권 개발 주도… 폐선 부지를 지역 관광명소로,,"국가철도공단이 전국에 산재한 142조원 규모 철도 재산을 단순한 선로나 역사가 아닌 '도시 자산'으로 전환하고 있다. 유휴 역사공간과 폐선 부지를 활용해 지역경제를 살리고, 수익을 다시 철도산업에 재투자하는 선순환 구조를 만드는 것이다. 공단은 직접 투자와 지역 맞춤형 개발을 확대하며 철도 중심의 도시혁신 모델을 본격화하고 있다. ■2조원 투입해 수서역..",2025.10.22 18:24,https://www.fnnews.com/news/202510221823293684,파이낸셜뉴스
"수자원공사, 디지털·AI 물관리 기술 전파",,"한국수자원공사는 지난 21일 미국 워싱턴 세계은행 본부에서 물 분야 디지털 및 AI 전환 가속화를 위한 특별 세션을 개최했다고 22일 밝혔다. 이번 세션은 KGGTF가 주최한 KGID 2025의 공식 프로그램으로, 수자원공사와 세계은행 Water GP가 공동으로 진행했다. 공사는 AI 정수장을 중심으로 그간 구축해온 물관리 데이터 및 대표사례와 디지털, AI를 접목한 물관리 솔루..",2025.10.22 18:24,https://www.fnnews.com/news/202510221823286871,파이낸셜뉴스
"LH, AI로 임대주택 옹벽 안전관리 강화",,한국토지주택공사(LH)는 22일 인공지능(AI) 기반 스마트 계측관리 시스템을 통해 임대주택 옹벽 안전 관리를 강화한다고 밝혔다. 최근 갑작스러운 기후변화로 집중호우·지반침하 등 주택 인근 급경사지에 대한 자연재해 위험이 커지고 있다. 이에 LH는 옹벽 관리체계 고도화를 위한 AI 기반 스마트 계측관리 시스템을 도입키로 했다. 스마트 계측관리 시스템은 IoT..,2025.10.22 18:23,https://www.fnnews.com/news/202510221823270560,파이낸셜뉴스
3분기 DLS 7조625억… 작년보다 50% 가까이 늘어,,"한국예탁결제원은 올해 3·4분기 파생결합증권(DLS)이 7조625억원 발행돼 전년 동기 대비 48.4% 증가했다고 22일 밝혔다. DLS는 금리나 환율 등 기초자산 가격이 특정 범위 내 움직인다는 조건을 충족하면 약속한 수익을 주는 금융 상품이다. 예탁원의 DLS 집계는 파생결합채권(DLB)은 포함하고, 대중 인지도가 높은 다른 파생 금융 상품인 주가연계증권(ELS)은 제..",2025.10.22 18:22,https://www.fnnews.com/news/202510221822099298,파이낸셜뉴스
"개미는 하이닉스, 외인은 삼전 담았다… 반도체 대장주 ‘독주’",,"'반도체 투톱'이 국내 증시 자금을 빨아들이고 있다. 지난달 이후 대형 반도체주의 독주가 이어지면서 관련 상장지수펀드(ETF)도 빠르게 몸집을 불리는 가운데, 개인과 외국인은 투톱 종목에 엇갈린 매매 행보를 보이고 있다. 22일 한국거래소에 따르면 지난달 이후 KRX 반도체지수는 46.3% 급등하면서 같은 기간 코스피 지수 상승률(21.9%)을 두 배 이상 앞질렀다.특히..",2025.10.22 18:22,https://www.fnnews.com/news/202510221822060057,파이낸셜뉴스
코스피 연일 최고치 찍는데… 맥 못추는 게임주,,"코스피 지수가 최고치를 연일 갈아치우고 있지만 게임주는 힘을 쓰지 못하면서 투자자들의 '미운 오리 새끼'신세로 전락했다. 업종 전체를 끌어갈 이렇다 할 성장 동력이 부재하고, 엔씨소프트·펄어비스·카카오게임즈 등 주요 게임주의 3·4분기 실적 역시 부진할 것으로 예상되면서 게임주에 대한 기대감이 옅어졌다는 평가다. 22일 한국거래소에 ..",2025.10.22 18:22,https://www.fnnews.com/news/202510221822032861,파이낸셜뉴스
"HDC, 내달 1000억 회사채 발행 도전",,"HDC가 다음달 4년 4개월여 만에 공모채 시장에 도전한다. 22일 금융투자업계에 따르면 HDC는 다음달 20일 공모 시장에서 2·3년물 총 1000억원 회사채 발행을 목표로 수요예측을 진행한다. 발행 예정일은 같은 달 27일이다. KB증권, 한국투자증권, 하나증권이 공동으로 대표주관을 맡았다. HDC가 회사채 시장에 나온 것은 지난 2021년 7월 5일 200억원 발행한 이후 ..",2025.10.22 18:22,https://www.fnnews.com/news/202510221822024218,파이낸셜뉴스
"삼성證, 업계 최초 자산 30억 이상 고객 5000명 돌파",,"삼성증권은 업계 최초로 자산 30억원 이상 고객이 5000명을 돌파했다고 22일 밝혔다. 삼성증권이 분석한 자료에 따르면 지난달 말 기준 삼성증권의 자산 30억원 이상 고객 수는 5449명으로 2020년 말 대비 91% 증가했다. 자산 30억원 이상 고객 수의 증가율을 연령대별로 살펴보면 30대(194%), 40대(184%), 20대(178%), 50대(147%), 60대(93%), 70대 이상(39%) 순으로 증..",2025.10.22 18:22,https://www.fnnews.com/news/202510221822011536,파이낸셜뉴스
"대한항공, 록히드마틴과 美군용기 후속 군수지원 '맞손'",,대한항공이 세계 최대 방산기업인 미국 록히드마틴(Lockheed Martin)과 손잡고 미국 육·해·공군 전력 강화를 위한 미 군용기 후속 군수지원에 협력한다. 대한항공과 록히드마틴은 22일 열린 '서울 국제 항공우주 및 방위산업 전시회(ADEX) 2025'에서 인도-태평양 지역 및 제3국 내 미군 전력자산의 정비지원과 적기전력화에 기여하기 위한 파트너십 프레..,2025.10.22 18:21,https://www.fnnews.com/news/202510221821165096,파이낸셜뉴스
"밀레 ""삼성·LG 프리미엄 가전 경쟁 환영""",,"""한국 시장은 밀레에게 매우 중요한 시장이다. 탁월한 안목을 지닌 고객군이 있고, 한국 고객들의 피드백을 적극적으로 수용해서 아시아 지역 제품을 개발하고 있기도 하다."" 마르쿠스 밀레 공동 회장은 22일 서울 강남 밀레 익스피리언스 센터에서 진행된 '밀레코리아 설립 20주년 기자간담회'에서 ""지난 20년간 한국 시장 매출은 꾸준히 늘어왔고, 밀..",2025.10.22 18:21,https://www.fnnews.com/news/202510221821119913,파이낸셜뉴스
"""에코프로, 이차전지 선도기업 도약하자""",,"에코프로가 창립 27주년을 맞아 국가대표 글로벌 기업으로 도약하자는 의지를 다졌다. 에코프로는 충북 오창 본사에서 창립 27주년 기념식을 열고 글로벌 생산 체제를 구축해 국가를 대표하는 글로벌 기업으로 도약하기로 했다고 22일 밝혔다. 이동채 에코프로 창업주는 창립 기념사를 통해 ""지난 27년이 '도전과 개척의 역사'였다면 다가올 27년은 '혁신과 글로벌..",2025.10.22 18:21,https://www.fnnews.com/news/202510221821088250,파이낸셜뉴스
아이디어를 실물로… 현대차 미래기술을 엿보다,,"""외부 충격이나 비오는 날에도 문제가 없는지 궁금한데 실제로 양산까지 적용이 가능한 건가요?"" 22일 오후 12시, 점심시간이지만 경기 화성에 있는 현대자동차그룹의 남양연구소에선 임직원 수십 명이 건물 밖으로 나왔다. 반짝 반짝 빛나는 눈. 날카로운 질문도 서슴지 않았다. '2025 아이디어 페스티벌' 본선 경연에 진출한 혁신 아이디어를 직접 보기 위..",2025.10.22 18:21,https://www.fnnews.com/news/202510221821049697,파이낸셜뉴스
"S&P, LG전자 신용등급 3년 만에 한단계 상향",,"LG전자는 국제신용평가기관 스탠더드앤드푸어스(S&P)가 지난 21일 자사 신용등급 전망을 BBB 안정적(Stable)에서 BBB 긍정적(Positive)으로 한 단계 상향 조정했다고 22일 밝혔다. S&P가 LG전자 신용등급 전망을 조정한 것은 2022년 10월 이후 3년 만이다. 이는 가전, 전장사업의 견조한 성과와 최근 인도법인 상장을 통한 대규모 현금 조달, 관계사 LG디스플레이..",2025.10.22 18:21,https://www.fnnews.com/news/202510221821037053,파이낸셜뉴스
추경 밀어붙이는 日 다카이치…'아베노믹스 시즌2' 시작,,【 도쿄=서혜진 특파원】 다카이치 사나에 일본 신임 총리(사진)가 취임 직후 '강한 일본'을 표방하며 대규모 경기부양책과 방위력 강화책에 본격 착수했다. '강력한 경제 성장 실현'을 위해 추가경정예산(추경)을 통한 대규모 경기 부양책을 추진하고 방위비 증액과 방위력 대폭 강화에 드라이브를 걸겠다는 것이다. 일각에서는 도널드 트럼프 미국 행정부의 방위비 증..,2025.10.22 18:21,https://www.fnnews.com/news/202510221820316006,파이낸셜뉴스
"사람 대신 로봇… 일자리 감소 본격화 ""아마존 2033년까지 60만명 고용 대체""",,온라인 유통기업으로 미국내 민간 기업 고용 규모 2위인 아마존이 직원의 상당수를 로봇으로 대체할 계획이다. 자동화가 미국에서 고용을 가장 많이 하는 기업 중 하나를 '일자리 파괴자'로 만들 수 있다는 우려가 나오고 있다. 21일(현지시간) 뉴욕타임스(NYT)는 물류 창고에서 수십만명을 고용하는 등 대규모 직원을 거느리고 있는 아마존이 약 50만명 규모의 일손을 로..,2025.10.22 18:21,https://www.fnnews.com/news/202510221820304083,파이낸셜뉴스
"""캄 스캠범죄 수익 18조원… 한국인 최대 2000명 연루""",,캄보디아에서 급속히 퍼진 온라인 사기범죄 조직의 수익이 125억달러(한화 약 18조원)에 육박한다고 국가정보원이 국회에 보고했다. 캄보디아 온라인 사기범죄에 연루된 한국인은 최대 2000명에 달하는 것으로 추정됐다. 22일 국회는 캄보디아 온라인 사기범죄 사태파악을 위해 외교통일위원회 국정감사를 프놈펜 주캄보디아한국대사관에서 가졌다. 또한 국회 정보위원..,2025.10.22 18:20,https://www.fnnews.com/news/202510221819483838,파이낸셜뉴스
교황청 찾은 우원식… '교황 방북 요청' 서한 전달,,"우원식 국회의장이 바티칸 교황청에서 피에트로 파롤린 교황청 국무원장을 예방하고, 레오 14세 교황의 방북을 요청하는 서한을 전달했다. 국회의장실은 21일(현지시간) 우 의장이 교황청을 찾은 자리에서 2027년 8월 서울에서 개최되는 가톨릭 세계청년대회(WYD)와 관련해 교황의 방북을 요청하는 등의 내용을 담은 서한을 전달했다고 밝혔다. 우 의장은 ""교황청은 ..",2025.10.22 18:20,https://www.fnnews.com/news/202510221819473847,파이낸셜뉴스
"APEC 앞두고… 北, 탄도미사일 도발",,"북한이 22일 탄도미사일을 발사했다. 이번 발사는 지난 6월 이재명 정부 출범 후 처음이다. 지난 5월 8일 '600㎜ 다연장 방사포'와 전술탄도미사일 '화성포-11가'형을 동해상으로 발사 이후 다섯 달여 만이다. 합동참모본부는 이날 오전 8시 20분쯤 ""북한이 동쪽 방향으로 미상 탄도미사일을 발사했다""고 전했다. 합참은 이날 8시 10분경 북한 황북 중화 일대에..",2025.10.22 18:20,https://www.fnnews.com/news/202510221819467075,파이낸셜뉴스
"""수시배당·장기보유세제 내달 발의… 정기국회 처리 목표"" [정책&인물]",,"정치의 과잉은 낯 뜨거운 정쟁과 국회 본연 임무인 입법 과정 소외를 동반한다. 국회가 정책 생산을 등한시하게되면 피해는 국민, 기업 모두에게 돌아온다. 정쟁은 정치 자체가 아니라 한 부분일 뿐이다. 국회의 정책 수립, 집행에 대한 지속적인 관심이 필요하다. '정책&인물'란을 신설한다. 산업, 금융, 세제 등 주요 법안을 발의한 의원들을 만나 정책입안자로서..",2025.10.22 18:20,https://www.fnnews.com/news/202510221819378015,파이낸셜뉴스
"고려아연, 호주 BESS·태양광 사업 돌입",,고려아연이 호주 뉴사우스웨일스(NSW)주에서 1조원 규모의 초대형 친환경 에너지 프로젝트를 본격화한다. 대규모 배터리 에너지저장시스템(BESS)과 태양광 발전소를 함께 짓는 이번 사업은 최근 주정부의 개발계획 승인을 받아 오는 2027년 상업운전을 목표로 착공에 돌입한다. 고려아연은 호주 신재생에너지·그린수소 사업 자회사인 아크에너지가 추진 중인 '리치..,2025.10.22 18:19,https://www.fnnews.com/news/202510221819017591,파이낸셜뉴스
에쓰오일 '샤힌' 내년 상반기 가동… 정유·석화 투톱 체제로,,에쓰오일이 추진 중인 초대형 석유화학 프로젝트 '샤힌(Shaheen)'이 공정률 85%를 넘어서며 내년 상반기 가동을 앞두고 있다. 국내 석유화학 투자 사상 최대 규모인 이번 사업은 정유 중심 구조에서 고부가 석유화학으로 전환을 도모하는 핵심 전략으로 내년 6월 기계적 완공 이후 시운전을 거쳐 본격 생산에 들어갈 예정이다. ■정유에서 화학으로 사업구조 전환22일..,2025.10.22 17:00,https://www.fnnews.com/news/202510221818565491,파이낸셜뉴스
"KT, 국내 첫 UAM 실증사업 자격… ""미래 모빌리티 상용화""",,"KT는 국토교통부로부터 도심항공교통(UAM) 실증사업자 자격을 획득했다고 22일 밝혔다. KT는 지난해 전남 고흥에서 진행된 한국형 도심항공교통(K-UAM) 그랜드챌린지 1단계 실증을 성공적으로 수행하며 통합운용성과 비행 안전성, 관제 시스템 연동 등 주요 기술 요소를 검증했다. 또 UAM 특별법에서 요구하는 장비와 인력 기준을 모두 충족했으며 고도화된 기술력과 운..",2025.10.22 18:18,https://www.fnnews.com/news/202510221817260074,파이낸셜뉴스
"LGU+, APEC 열리는 경주 통신망 확충",,LG유플러스는 다음주 경주에서 열리는 아시아태평양경제협력체(APEC) 정상회의에 많은 인파가 몰릴 것을 대비해 경주시 일대 주요 시설에 추가 통신 장치를 구축하고 전용 상황실을 운영한다고 22일 밝혔다. APEC 정상회의가 큰 불편 없이 성황리에 마무리될 수 있도록 최적의 통신 품질을 제공한다는 계획이다. 약 2만명이 넘는 사람들이 참석할 것으로 예상되는 이번 AP..,2025.10.22 09:00,https://www.fnnews.com/news/202510221817247401,파이낸셜뉴스
"맛집·명소 소개… 네이버, APEC 기념 '비로컬위크'",,"네이버가 아시아태평양경제협력체(APEC) 정상회의 개최를 기념해 외국인 방문객에게 경주 고유의 문화와 특색을 알리는 '비로컬위크' 캠페인을 진행한다고 22일 밝혔다. 특히 최수연 네이버 대표는 APEC 기간 동안 캠페인이 열리는 현장을 찾아 경주 로컬 사업자들을 만나, 로컬이 가진 성장 가능성에 대해 이야기를 나눌 예정이다. '비로컬위크'는 APEC 기간동안 경주를 ..",2025.10.22 18:17,https://www.fnnews.com/news/202510221817245813,파이낸셜뉴스
"""유튜브 틀어봐"" 3차원 공간서 음성·제스처로 AI와 즉각 소통",,"삼성전자가 확장현실(XR) 헤드셋 '갤럭시 XR'을 22일 한국과 미국에 동시 출시했다. 갤럭시 XR은 물리적 제한없이 확장된 3차원의 공간에서 음성, 시선, 제스처 등으로 콘텐츠를 즐기고 직관적인 상호작용을 할 수 있는 기기다. 같은 날 출시한 애플의 '비전 프로 2'에 비해 200만원대의 낮은 가격도 강점으로 꼽힌다. ■AI가 사용자 음성·시선·제스처 인..",2025.10.22 18:17,https://www.fnnews.com/news/202510221817219592,파이낸셜뉴스
사전행사에 서버 폭주…'아이온2' 대박 예감,,엔씨소프트의 2025년 하반기 최대 기대작인 '아이온2(사진)'가 정식 출시 한 달여 앞두고 일찌감치 흥행 조짐을 보이고 있다. 최근 진행된 사전 이벤트에서 이용자들이 대거 몰려 서버를 폭주시키는 등 출시 전 반응이 뜨겁다. 22일 업계에 따르면 엔씨의 '아이온2'는 사전 캐릭터 이름 선점 이벤트가 시작 2분여 만에 조기 마감되는 등 이용자 관심이 폭발했다. 지난 1..,2025.10.22 18:17,https://www.fnnews.com/news/202510221817188545,파이낸셜뉴스
대통령실 인구정책비서관 넉달째 임명도 못했다 [초고령사회 한국],,이재명 정부 출범 4개월이 지난 지금까지도 대통령실 인구정책비서관 자리가 공석인 것으로 확인됐다. 정부가 출범과 함께 신설한 AI미래기획수석실 산하에 인구정책 기능을 통합해 놓고도 이를 총괄할 실무 책임자 임명을 미루면서 저출산·고령화 대응의 컨트롤타워가 사실상 실종된 상태다. 인구문제를 기술산업 중심의 'AI미래기획수석' 산하에 두고 있는 조직..,2025.10.22 18:17,https://www.fnnews.com/news/202510221817111951,파이낸셜뉴스
불장 뛰어든 빚투… 4년만에 24조 돌파,,국내증시의 거침없는 상승세에 빚을 내서 투자하는 '빚투' 규모가 4년 만에 24조원을 넘어섰다. 22일 금융투자협회에 따르면 지난 20일 신용거래융자 잔액은 24조552억원을 기록했다. 신용거래융자 잔액이 24조원을 돌파한 것은 지난 2021년 11월 5일(24조292억원) 이후 처음이다. 신용거래융자 잔액 규모는 지난달 19일 23조원대로 올라선 후 보름 만에 1조원가량 늘어..,2025.10.22 18:17,https://www.fnnews.com/news/202510221817095369,파이낸셜뉴스
"관세협상단 美서 막판담판 ""쟁점 뺀 부분 MOU는 안해"" [한미 관세협상]",,"한미 관세협상 최종 합의를 위한 정부 움직임이 빨라지고 있다. 김용범 대통령실 정책실장, 김정관 산업통상부 장관을 필두로 한 정부협상단이 미국에서 귀국한 지 2~3일 만인 22일 다시 대미협상을 위한 출국길에 올랐다. 김용범 실장은 ""한미 간 주요 쟁점을 남긴 채 '부분 양해각서(MOU)' 체결은 없다""며 최종 합의문 작성이 목표라는 입장을 간접적으로 ..",2025.10.22 18:17,https://www.fnnews.com/news/202510221817071585,파이낸셜뉴스
고공행진하던 금값 5%대 급락… 증시도 고점 경계감 고개 [금값 폭등 제동],,고공행진하던 국제 금값이 하루 만에 5% 이상 급락하면서 조만간 '에브리싱 쇼크'가 오는 것 아니냐는 우려가 제기되고 있다. 국내 증시에서도 단기급등 피로감 등으로 고점을 경계하는 목소리가 적지 않다. 일부 전문가는 인플레이션 지표를 주목하면서 내년에 횡보 가능성도 열어놓고 있다. 22일 코스콤 체크에 따르면 이날 금 관련 상장지수펀드(ETF)인 'ACE KRX금..,2025.10.22 18:16,https://www.fnnews.com/news/202510221815302018,파이낸셜뉴스
"美 금리 내렸는데 환율 왜 오르나.. 한은, 통화정책 영향 파악 나섰다",,"국내 기준금리가 지난 5월 말부터 연 2.50% 수준을 유지하는 가운데 미국이 지난달 금리를 내렸음에도 원·달러 환율이 달러당 1430원을 넘어서자 외환당국이 원인 분석에 나섰다. 통화정책 변화에 따른 내외금리차 변동이 얼마나 원·달러 환율에 영향을 끼치는지를 추산하고, 추가 원화약세 요인 파악에 나선 것이다. 22일 한국은행에 따르면 통화정책국은 ..",2025.10.22 18:16,https://www.fnnews.com/news/202510221815299413,파이낸셜뉴스
"SK케미칼, 아리바이오와 K치매약 개발 확대",,SK케미칼이 아리바이오와 경구형 알츠하이머병 치료제 'AR1001(성분명 미로데나필)' 개발 확대와 글로벌 진출 협력을 위한 업무협약(MOU)을 체결했다고 22일 밝혔다. AR1001은 SK케미칼이 개발한 미로데나필을 기반으로 한다. 아리바이오는 지난 2011년 SK케미칼로부터 해당 물질에 대한 기술이전을 받은 이후 치매 치료제로 개발을 진행해왔다. 현재 13개 국가에서 글로..,2025.10.22 18:15,https://www.fnnews.com/news/202510221815222341,파이낸셜뉴스
"종근당, 신약개발로 영토확장…자회사 아첼라 신설",,"종근당이 신약개발 전문 회사 '아첼라'를 자회사로 신설하고 창립식을 가졌다고 22일 밝혔다. 회사명 아첼라는 시작과 근원, 원리를 의미하는 고대 그리스어 '아르케(Arche)'와 생명과 조화, 확장을 상징하는 어미 '라(-la)'를 결합한 단어다. 근원에서 피어난 생명과 근본에서 확장되는 조화로운 성장이라는 뜻을 담고 있다. '한 사람에서 전 인류까지, 예방부터 치료까..",2025.10.22 18:15,https://www.fnnews.com/news/202510221815202490,파이낸셜뉴스
