title,thumbnail,short_content,write_time,link,company
"野 만난 중기중앙회 ""노봉법 적극 대응을""",,"중소기업계가 국민의힘에 고관세 등 통상 문제와 노란봉투법 시행과 관련해 적극 대응해달라고 요청했다. 22일 김기문 중소기업중앙회장은 서울 여의도 중소기업중앙회에서 장동혁 국민의힘 당대표와 만나 ""여야가 협력해 민생법안을 빨리 처리해 주시길 당부드린다""고 말했다. 김 회장은 ""저출생·고령화로 소비인구가 줄고, 통상문제까지 겹치면..",2025.10.22 18:15,https://www.fnnews.com/news/202510221815131202,파이낸셜뉴스
"정책자금 확대 부메랑… 중진공, 못받은 돈 늘었다",,최근 3년간 중소벤처기업진흥공단 정책자금의 연체·약정해지·소각 건수가 동시에 늘어난 것으로 나타났다. 정책자금 공급 규모가 확대되는 가운데 부실 예방과 사후관리도 뒷받침돼야 한다는 조언이 나온다. 22일 국회 산업통상자원중소벤처기업위원회 소속 김원이 더불어민주당 의원이 중진공으로부터 제출받은 자료에 따르면 지난해 연간 누적 정책자금..,2025.10.22 18:15,https://www.fnnews.com/news/202510221815110552,파이낸셜뉴스
더 정밀해진 AI카메라·보청기… 中企 반도체 진화 한눈에 [현장르포],,"22일 서울 강남구 코엑스에서 개막한 '제27회 반도체대전(SEDEX 2025)' 현장은 발 디딜 틈 없이 붐볐다. 삼성전자와 SK하이닉스 등 대기업 부스 앞에는 인공지능(AI) 반도체의 미래를 확인하려는 관람객이 몰렸는데, 그 못지않게 팹리스(반도체 설계), 디자인하우스(반도체 설계 지원), 반도체 소재·부품·장비(소부장) 등 중견·중소기업 부스에도 ..",2025.10.22 18:15,https://www.fnnews.com/news/202510221814558189,파이낸셜뉴스
"CEO 책임 명문화·징벌적 과징금 검토.. 배경훈 부총리 ""구체적 방안 연내 발표""",,"해킹 시 신고를 지연하거나 감추는 기업에 대한 제재방안이 보완될 예정이다. 공공 클라우드 운용 효율성을 높이기 위해 민간 클라우드 사업자의 공공 클라우드 진출방안도 유연하게 재설계할 예정이다. 정부는 22일 '범정부 정보보호 종합대책'을 내놓은 데 이어 연내 과징금, 민간 클라우드 사업자의 공공 진출방안 등을 담은 구체적 방안을 12월에 내놓는다. ■""..",2025.10.22 18:14,https://www.fnnews.com/news/202510221813428553,파이낸셜뉴스
"정부, 해킹 정황만으로도 조사… 통신사 '불시점검' 추진",,정부가 공공·금융·통신 등 1600여개 정보기술(IT) 시스템들에 대한 대대적인 보안취약점 점검에 들어간다. 통신사나 금융사 등 주요 업체의 해킹 정황이 확보되는 경우 정부는 기업의 신고 없이도 조사할 수 있도록 권한을 확대할 예정이다. 22일 과학기술정보통신부 등 관계부처는 정부서울청사에서 브리핑을 열고 이 같은 내용을 담은 '범부처 정보보호..,2025.10.22 14:00,https://www.fnnews.com/news/202510221813380646,파이낸셜뉴스
"LG가 본 AI로봇 현실 ""中은 하드웨어, 美는 두뇌서 부각..韓은 초창기""",,"【대구=김학재 기자】 백승민 LG전자 로봇연구소장은 22일 인공지능(AI)을 포함한 로봇 기술력 현황에 대해 ""현재 로봇 산업의 두 축은 미국과 중국으로, 한국은 아직 초창기""라고 진단했다.중국이 부품·모터·센서·공급망등 하드웨어 분야, 미국은 AI 두뇌 등 소프트웨어 분야에서 차별화된 역량을 보유한 상황에서 백 소장은 ""중국이 미..",2025.10.22 18:19,https://www.fnnews.com/news/202510221813337839,파이낸셜뉴스
"생산인구 절반 주는데 나랏빚은 3배 쑥.. 재정 적자, 갈수록 벌어지는 '악어의 입' [초고령사회 한국]",,"초고령사회에서 노인을 부양하는 부담은 납세하는 청장년들이 짊어진다. 15~64세의 생산연령인구인데, 이들은 갈수록 줄어들지만 고령인구는 계속 늘어나 노년부양비도 가파르게 증가한다. 노년부양비가 커진다는 것은 현세대의 국민 조세부담과 미래세대가 갚을 빚이 늘어난다는 의미다. 무엇보다 낮은 출산율에 기대수명이 늘어 정부의 노인복지 지출은 늘 수밖에 없다...",2025.10.22 18:11,https://www.fnnews.com/news/202510221811219473,파이낸셜뉴스
노인부양 부담 10년새 2배로… 2037년엔 '초고령 日' 추월 [초고령사회 한국],,"일하며 세금을 내는 청장년들이 노인을 부양해야 하는 부담이 10년 새 배 이상 커졌다. 역대 처음이자 세계에서 가장 빠른 속도다. 고령층 사회복지 정책에 드는 재정 지출도 더 크고 빠르게 늘어날 전망이다. 국민연금과 기초연금 구조개혁, 노인 연령기준 상향 등 고령화 관련 정책을 급변한 현실에 맞춰 시급히 개혁해야 한다는 지적이 나온다. ■청장년들 노인부양 ..",2025.10.22 18:11,https://www.fnnews.com/news/202510221811198909,파이낸셜뉴스
"핵융합 에너지 상용화 속도… ""2035년 8대 핵심기술 확보""",,"정부가핵융합 에너지 핵심 기술 개발에 속도를 낸다. 핵융합 핵심기술을 고도화하면서 전력 생산 기술을 확보한다는 계획이다. 이를 위해 원자력 규제에 포함돼 있는 핵융합 규제를 분리해 완화하고, 인공지능(AI) 기술을 핵융합에도 도입해 설계 기간을 단축한다. 22일 과학기술정보통신부는 서울 서초구 엘타워에서 열린 '핵융합 에너지 기술개발 전략 포럼'에서 이 ..",2025.10.22 18:10,https://www.fnnews.com/news/202510221809412164,파이낸셜뉴스
"무신사, 7년만에 새 BI… ""글로벌 사업 확장""",,무신사가 기업과 온·오프라인 스토어 및 서비스라는 두 개의 정체성을 분리해 브랜드 이미지를 제고한다. 플랫폼을 넘어 글로벌 지역을 포함한 사업 영역 확장성을 강조하겠다는 전략이다. 무신사는 22일 새롭게 달라진 무신사 스토어 BI를 선보였다. 기존 영문 대문자 'MUSINSA'로 쓰였던 로고를 더욱 두껍고 단단하게 표현했다. 이번 BI 리뉴얼은 것은 단순히 ..,2025.10.22 18:10,https://www.fnnews.com/news/202510221809364560,파이낸셜뉴스
에이피알 ‘뷰티 디바이스’ 500만대 팔렸다… 매출 절반이 해외,,'K뷰티 대장주'로 떠오른 에이피알의 뷰티 디바이스 '메디큐브 에이지알(AGE-R)'이 글로벌 브랜드로 안착했다. 2021년 출시 이후 4년 반 만에 글로벌 누적 판매 500만대를 돌파한 것이다. 세계적으로 홈 뷰티 디바이스 수요 확대와 함께 K뷰티의 글로벌 인기도 상승하면서 판매 증가 속도가 더욱 가팔라질 전망이다. ■글로벌 판매 가속화… 9개월새 200만대 22일 업계..,2025.10.22 18:10,https://www.fnnews.com/news/202510221809312424,파이낸셜뉴스
"뚜레쥬르 ""수능 합격 기원"" 선물세트 출시",,"CJ푸드빌이 운영하는 뚜레쥬르는 2026학년도 대학수학능력시험을 앞두고 수험생들을 응원하는 제품을 선보인다고 22일 밝혔다. 올해 뚜레쥬르의 수능 신제품 컨셉은 'OPEN YOUR LUCK'으로, '행운의 열쇠(LUCK-KEY)'를 통해 합격의 기운과 응원의 마음을 선물한다는 의미를 담았다. LUCK-KEY 찹쌀떡 세트는 수험생 선물의 스테디셀러인 찹쌀떡을 고급스럽게 구성한 선물..",2025.10.22 18:10,https://www.fnnews.com/news/202510221809270688,파이낸셜뉴스
AI·빅데이터로 식품연구 영역 확장.. 발효음식 등 '전통 K푸드' 글로벌화,,"""스마트 제조를 통해 우리 고유의 K-푸드 세계화를 뒷받침하겠다. 인공지능(AI)과 데이터를 기반으로 과학적인 맞춤형 식품 개발과 안전 관리의 새로운 패러다임을 열겠다"" 내달초 취임 1년을 맞는 백현동 한국식품연구원 원장의 포부다. 그는 22일 파이낸셜뉴스와의 인터뷰에서 ""국내 식품산업은 초고령사회 진입, 기후위기와 식량안보, 글로벌 시장의 ..",2025.10.22 18:09,https://www.fnnews.com/news/202510221809177094,파이낸셜뉴스
"中 ""韓·日과 3자 통화스와프 체결 논의""… 한은 ""사실 아니다""",,"경주 아시아태평양경제협력체(APEC) 정상회의을 앞두고 중국이 한국·일본과 3자 통화스와프 체결을 논의하는 등 역내 금융안전망 강화와 위안화 사용 확대에 적극적인 자세를 보이고 있는 것으로 알려졌다. 22일 홍콩 사우스차이나모닝포스트(SCMP)는 익명의 관계자를 인용해 ""중국인민은행(PBOC)의 판궁성 총재가 지난 15일 미국 워싱턴DC에서 열린 국제통..",2025.10.22 18:07,https://www.fnnews.com/news/202510221806464720,파이낸셜뉴스
"트럼프니까… 美전문가 ""김정은과 APEC서 짧은 만남이라면 가능""",,"도널드 트럼프 미국 대통령이 이달 말 한국에서 열리는 아시아태평양경제협력체(APEC) 정상회의에 참석할 예정인 가운데 김정은 북한 국무위원장과의 회동이 성사될 가능성을 완전히 배제할 수 없다는 관측이 나왔다. 미국 싱크탱크 전략국제문제연구소(CSIS)의 시드니 사일러 선임고문은 21일(현지시간) 이 연구소 팟캐스트 대담에서 ""트럼프 대통령이 방한 중 김..",2025.10.22 18:07,https://www.fnnews.com/news/202510221806419083,파이낸셜뉴스
'직접투자 비율·투자처 선정방식' 등 관세 조율 막판 스퍼트 [한미 관세협상],,"이달 말 경주에서 진행되는 아시아태평양경제협력체(APEC) 정상회의에서 한미 관세협상을 마무리 짓기 위해 양국이 막판 스퍼트를 내고 있다. 그동안 이견을 좁히지 못한 '한두 가지 남은 쟁점'을 해소하고, 합의 내용을 문서화하는 수준의 구체적 성과로 이어질지 주목된다. 관세협상이 타결될 경우 함께 발표될 '안보 패키지'에도 관심이 쏠리고 있다. ■""한두 ..",2025.10.22 18:07,https://www.fnnews.com/news/202510221806378097,파이낸셜뉴스
"KB증권, 사내 ‘헬시플레저’ 문화 조성",,"KB증권은 임직원의 몸과 마음 건강 증진을 위해 사내 '헬시플레저(Healthy Pleasure)' 문화를 조성하고 있다고 22일 밝혔다. '헬시플레저'는 건강을 의미하는 '헬시(Healthy)'와 즐거움을 뜻하는 '플레저(Pleasure)'가 합쳐진 신조어로, 건강과 즐거움을 함께 챙기는 라이프스타일을 의미한다. KB증권은 지난 18일 혈당 관리를 희망하는 임직원 100명을 대상으로 체험형 ..",2025.10.22 18:07,https://www.fnnews.com/news/202510221806302677,파이낸셜뉴스
증시 불장인데 코넥스는 ‘한파’… 신규상장 3분의 1토막,,"국내증시 불장에도 코넥스 시장에는 한파가 불고 있다. 코스피와 코스닥시장은 거래대금 확대 등으로 시가총액 몸집을 빠르게 키우고 있는 것과 달리, 코넥스만 나홀로 역주행중이다. 22일 한국거래소에 따르면 올해 코넥스 시장에 상장 심사를 신청한 곳은 단 1곳에 그쳤다. 지난 8월 심사를 신청한 '본시스템즈'는 9월 코넥스 시장에 상장하면서 올해 유일하게 상장을..",2025.10.22 18:07,https://www.fnnews.com/news/202510221806278062,파이낸셜뉴스
"한양증권, 글로벌 IB 출범 반년만에 대형 딜 잇따라",,한양증권은 자본시장본부 내에 신디케이트론 및 사모사채 주관·주선·자문 중심의 글로벌 IB 조직을 신설한 이후 6개월 만에 주요 해외 자금 조달 계약을 잇따라 성사시켰다고 22일 밝혔다. 한양증권은 지난 3월 글로벌 IB 조직을 이끌 리더로 해외 금융 전문가 노형석 이사를 영입해 글로벌 시장으로 사업 영역을 확대하고 있다. 해당 조직은 최근 △넥센타..,2025.10.22 18:06,https://www.fnnews.com/news/202510221806268369,파이낸셜뉴스
"하나증권, 장기 거래 가족고객에 감사 이벤트",,하나증권은 고객 중심 가치 문화의 일환으로 진행한 '대대손손 가족 손님 이벤트'의 당첨자를 선정하고 감사의 마음을 전했다고 22일 밝혔다. 하나증권은 올해를 '손님 중심 가치 문화' 정착의 원년으로 삼고 고객의 목소리와 경험을 기업 전략의 출발점으로 삼는 '손님 중심 경영'을 전사적으로 추진하고 있다. 이러한 목표에 따라 손님 사용자 경험 빅데이터를 기반으..,2025.10.22 18:06,https://www.fnnews.com/news/202510221806249256,파이낸셜뉴스
지방에도 돈 흐르게… 정책금융 3년내 120조로 늘린다,,"금융위원회가 지방기업 살리기에 나섰다. 이억원 금융위원장은 22일 부산 남구 부산은행 본점에서 지역경제 활성화를 위한 지방우대 금융 간담회를 주재하고, 지방우대 금융으로의 전환을 통해 지역성장을 뒷받침할 수 있는 제도와 규제 개선안을 논의했다. 금융위는 지방우대 금융 정책으로 내년부터 4개 정책금융기관에 '지방금융 공급확대 목표제'를 신설해 약 40% ..",2025.10.22 18:03,https://www.fnnews.com/news/202510221803033007,파이낸셜뉴스
30일부터 사망보험금 연금처럼 받는다,,사후에 받는 사망보험금을 생전 연금자산으로 전환하는 유동화 상품이 이달 나온다. 5개 생명보험사가 먼저 상품을 선보인 후 내년 초까지 전 생보사에서 상품을 내놓는다. 22일 금융위원회에 따르면 오는 30일부터 사망보험금을 생전 소득으로 유동화할 수 있게 된다. 1차 출시되는 5개 생명보험사(삼성·한화·교보·신한라이프·KB라이프)의 ..,2025.10.22 12:00,https://www.fnnews.com/news/202510221803005572,파이낸셜뉴스
美서 주목한 '우리금융식 굿윌스토어',,"임종룡 우리금융그룹 회장이 지난 16일(현지시각) 미국 메릴랜드주 록빌의 굿윌스토어 본사를 방문했다. 22일 우리금융그룹에 따르면 굿윌스토어 본사는 우리금융의 굿윌스토어 사업모델을 발달장애인 일자리 생태계 구축 성공모델로 보고, 임 회장을 공식 초청했다. 임 회장은 강연을 통해 우리금융그룹 소개와 함께 △우리금융과 굿윌스토어의 협력 프로젝트 성과 △..",2025.10.22 18:03,https://www.fnnews.com/news/202510221803004837,파이낸셜뉴스
제주銀 'DJ BANK' 중소기업·직장인 대출 첫선,,"제주은행이 더존비즈온의 전사적 자원관리(ERP) 데이터를 금융 서비스와 연계한 디지털 뱅킹 브랜드 'DJ BANK'를 공개했다. 제주은행은 'DJ BANK'의 첫 상품으로 'ERP 기업 직장인 신용대출'을 오는 24일 출시한다고 22일 밝혔다. 제주은행은 더존비즈온과의 전략적 파트너십을 통해 추진하는 ERP 뱅킹 전용 디지털 금융 브랜드의 이름을 'DJ BANK'로 정하고, ERP 데이터..",2025.10.22 18:03,https://www.fnnews.com/news/202510221802587132,파이낸셜뉴스
"롯데손보, 앨리스·원더로 디지털 혁신 나서",,롯데손해보험이 생활밀착형 보험 플랫폼 '앨리스(ALICE)'와 영업지원 플랫폼 '원더(wonder)'를 앞세워 디지털 혁신에 나선다. 22일 보험업계에 따르면 롯데손보는 앨리스와 원더를 독자적인 브랜드로 키우는 CIC(Company-in-Company) 전략을 펼치고 있다. 2023년 8월 선보인 앨리스는 앱 하나로 보험가입과 계약조회 및 보험금 청구를 간편하게 할 수 있어 젊은 고객들의 ..,2025.10.22 18:03,https://www.fnnews.com/news/202510221802579668,파이낸셜뉴스
'연 4%' 모니모 KB 매일이자 통장 추가 판매,,삼성금융네트웍스(삼성생명·삼성화재·삼성카드·삼성증권)는 '모니모 KB 매일이자 통장'의 추가 판매를 개시했다고 22일 밝혔다. 삼성금융네트웍스와 KB국민은행의 협업으로 지난 4월 선보인 '모니모KB 통장'은 출시 60일 만에 금융위원회의 승인 물량(22만5000좌)가 완판된 바 있다. 최근 80만좌 추가 가입이 가능해짐에 따라 삼성금융네트웍스가 다..,2025.10.22 18:03,https://www.fnnews.com/news/202510221802567504,파이낸셜뉴스
유류세 인하 연말까지 연장… 인하율은 축소,,"정부가 유류세 한시 인하 조치를 올해 말까지 두 달 더 연장한다. 다만 인하 폭은 소폭 축소된다. 기획재정부는 22일 ""교통·에너지·환경세법 시행령과 개별소비세법 시행령 개정안을 입법예고와 국무회의 의결을 거쳐 11월 1일부터 시행할 예정""이라고 밝혔다. 이에 따라 당초 오는 31일 종료 예정이던 유류세 한시 인하 조치는 12월 31일까지 ..",2025.10.22 18:01,https://www.fnnews.com/news/202510221801081621,파이낸셜뉴스
"고용부, 캄보디아 사태 재발 방지…허위 구인광고 감시체계 만든다",,"고용노동부가 잡코리아·알바몬, 사람인, 원티드랩 등 민간 채용플랫폼과 함께 거짓구인광고 공동 모니터링 시스템 구축에 나선다. 최근 캄보디아 취업사기 사태의 원인으로 지목되는 허위·과장 구인광고에 대응하기 위해 공공·민간 협업체계를 마련하겠다는 내용이 핵심이다. 권창준 고용노동부 차관은 22일 서울고용노동청에서 열린 '안전한 채용환..",2025.10.22 18:01,https://www.fnnews.com/news/202510221801076343,파이낸셜뉴스
김밥 100줄 주문 후 ‘노쇼’… 음식값 40% 위약금 낸다,,"그동안 총이용금액의 10% 이하였던 음식점 '노쇼' 위약금이 앞으로는 예약기반음식점의 경우 최대 40%, 일반 음식점은 최대 20%까지 부과될 전망이다. 22일 공정거래위원회는 사업자와 소비자 간 분쟁이 발생한 경우 원활하고 공정하게 처리될 수 있도록 이 같은 내용의 소비자분쟁해결기준 개정안을 마련해 11월 11일까지 행정예고한다고 밝혔다. 이번 개정은 스터디카..",2025.10.22 12:00,https://www.fnnews.com/news/202510221801056825,파이낸셜뉴스
"곽노정 SK하이닉스 사장의 자신감 ""HBM4, 양산성 확보""",,"[파이낸셜뉴스] 곽노정 SK하이닉스 대표이사 사장이 ""6세대 고대역폭메모리(HBM)4 양산성을 확보했다""고 자신했다.곽 사장은 22일 서울 강남 파르나스호텔에서 열린 반도체의 날에서 기자들과 만나 ""SK하이닉스의 HBM4는 고객들이 원하는 어떤 성능이나 속도 기준 등은 다 충족을 시킨다""며 이같이 말했다.그러면서 ""수립했던 계획은 차질 없이 진행 ..",2025.10.22 18:18,https://www.fnnews.com/news/202510221758018068,파이낸셜뉴스
'구금사태' 빚은 美조지아주 수장 방한...현대차·LG엔솔 만난다,,"[파이낸셜뉴스] 미국 이민당국의 단속으로 '한국인 구금사태'를 빚은 미국 조지아주의 브라이언 켐프 주지사가 방한해 현대자동차그룹, LG에너지솔루션 등 현지에 생산 거점을 둔 기업들과 연이어 회동한다. 22일 재계에 따르면 켐프 주지사는 오는 23일 방한 첫 일정으로 장재훈 현대차그룹 부회장과 만난다. 두 사람은 LG에너지솔루션-현대차그룹 배터리 합작공장 구금 ..",2025.10.22 17:51,https://www.fnnews.com/news/202510221748211175,파이낸셜뉴스
"李대통령 ""산불은 초기 대응이 관건""…軍헬기 첫 대규모 투입",,"[파이낸셜뉴스] 이재명 대통령이 22일 ""산불은 ‘압도적 초기 대응’이 관건""고 강조했다.이 대통령은 이날 자신의 페이스북에 올린 글에서 ""산림청은 물론 군, 소방, 경찰 등 모든 관계기관이 하나의 팀으로 긴밀히 협조해야 한다""고 밝혔다.이어 “오늘 정부는 범정부 관계부처 합동 산불진화 통합훈련을 실시했다”며 “군 헬기도 처음으로 대거 ..",2025.10.22 17:53,https://www.fnnews.com/news/202510221746582891,파이낸셜뉴스
"IBK기업은행, 미트박스 이용 소상공인에 금융지원",,"[파이낸셜뉴스] IBK기업은행은 지난 21일 미트박스글로벌, 금융결제원과 ‘이커머스 플랫폼 상생 협력을 위한 업무협약’을 체결했다고 22일 밝혔다.이번 협약은 축산물 기업간거래(B2B) 이커머스 플랫폼 ‘미트박스’를 이용하는 정육점·음식점업 등 소상공인의 안정적인 사업 운영을 지원하기 위해 체결됐다.기업은행은 이번 협약을 통해 플랫폼 이용 기업에 소상공인..",2025.10.22 17:49,https://www.fnnews.com/news/202510221745270228,파이낸셜뉴스
"트럼프 방일 앞두고 日 ""5500억 대미 투자 조기 실행""",,"【파이낸셜뉴스 도쿄=서혜진 특파원】다음주 미일 정상회담이 예정된 가운데 일본 정부가 22일 미일 합의에 따른 5500억달러 규모의 대미 투자를 조기 실행하겠다는 뜻을 밝혔다. NHK에 따르면 아카자와 료헤이 일본 신임 경제산업상은 이날 취임 기자회견에서 5500억달러 규모 대미 투자에 대해 ""양국에 도움이 되는 실질적이고 충실한 사업을 탄탄히 구성하기 위해..",2025.10.22 17:56,https://www.fnnews.com/news/202510221737362482,파이낸셜뉴스
“BTS 정국 보러 한국 왔다” 전역날 자택 침입 시도한 中 여성 기소유예,,[파이낸셜뉴스] 방탄소년단(BTS) 멤버 정국의 자택에 침입하려고 한 중국인 여성이 기소유예 처분을 받은 것으로 알려졌다.22일 검찰에 따르면 서울서부지검은 주거침입 미수 혐의를 받는 30대 중국인 여성 A씨에 대해 지난달 10일 기소유예 처분했다.기소유예는 혐의가 인정되지만 검사가 여러 정황을 고려해 피의자를 재판에 넘기지 않는 처분을 뜻한다.A씨는 정국이 군..,2025.10.22 17:36,https://www.fnnews.com/news/202510221733085596,파이낸셜뉴스
"KB국민은행, DC 퇴직연금 적립금 15조원 돌파...금융권 1위 유지",,"[파이낸셜뉴스] KB국민은행은 전체 퇴직연금사업자 중 최초로 DC형 적립금 15조원을 달성하며 전 금융권 1위를 유지했다고 22일 밝혔다.금융감독원 통합연금포털 공시에 따르면 3분기말 기준 KB국민은행은 DC형 적립금 15조원을 달성하며, 전체 사업자 중 DC형 적립금 규모 1위 지위를 지난 2010년부터 지금까지 유지하고 있다. 고객이 직접 가입하고 운용하는 DC형 시장에서 K..",2025.10.22 17:33,https://www.fnnews.com/news/202510221731153333,파이낸셜뉴스
내년 1월부터 농협·수협도 중도상환수수료 내린다,,"[파이낸셜뉴스]  내년 1월1일부터 농협, 수협 등 상호금융에서도 신규 대출에 대한 중도상환수수료가 인하된다.금융위원회는 22일 정례회의를 열고 상호금융권의 중도상환수수료 부과체계 개선을 위한 '상호금융업 감독규정' 개정안을 의결했다고 밝혔다.금융위는 금융권에서 구체적인 산정기준 없이 중도상환수수료를 부과하는 문제를 개선하기 위해 지난 1월 '금융..",2025.10.22 17:38,https://www.fnnews.com/news/202510221730082096,파이낸셜뉴스
대구 찾은 김민석 국무총리에 TK 신공항 건설 등 건의한 대구시,,"【파이낸셜뉴스 대구=김장욱 기자】대구시는 김정기 시장 권한대행 행정부시장)이 22일 대구를 방문한 김민석 국무총리와 시청 동인청사에서 간담회를 갖고 대구의 주요 현안 사업에 대한 정부 차원의 지원을 건의했다고 밝혔다. 이 자리에서 김 권한대행은 대구경북(TK) 신공항 건설, 대구 취수원 이전, 지역거점 인공지능 전환(AX) 혁신 기술개발, 문화예술허브 조성, ..",2025.10.22 17:29,https://www.fnnews.com/news/202510221723315379,파이낸셜뉴스
갤럭시S25 흥행에…100만원 이상 프리미엄폰 시장 30% 성장,,[파이낸셜뉴스] 삼성전자 플래그십(최고급) 스마트폰 갤럭시S25 시리즈의 판매 호조로 700달러(약 100만원) 이상 글로벌 프리미엄폰 시장 규모가 30% 이상 커진 것으로 나타났다.22일 시장조사기관 카운터포인트리서치에 따르면 2025년 7~8월 스마트폰 시장이 판매량 기준 전년 동기 대비 2% 성장했다. 이 기간 동안 400~599달러 및 700~999달러 가격대 스마트폰의 판매가..,2025.10.22 17:49,https://www.fnnews.com/news/202510221718505490,파이낸셜뉴스
"中 연구진, '엔비디아 GPU 속도 1천배 가능성' 아날로그칩 개발",,"[파이낸셜뉴스] 중국 연구진이 인공지능(AI) 분야 등의 복잡한 수학문제를 해결할 수 있는 초고속 아날로그 칩을 개발했다면서, 향후 기술이 진전되면 엔비디아 칩 처리 속도보다 1000배 빨라질 가능성도 있다는 기대를 내놨다.22일 홍콩매체 사우스차이나모닝포스트(SCMP) 등에 따르면, 베이징대 쑨중 교수 연구팀은 ""저항성 물질로 된 메모리칩을 사용해 만든 아날..",2025.10.22 17:32,https://www.fnnews.com/news/202510221716259555,파이낸셜뉴스
