title,thumbnail,short_content,write_time,link,company
생산적금융·스테이블코인發 '금융 대격변' 생존법 찾는다 [미리보는 2026 FIND],,"파이낸셜뉴스는 오는 22~23일 서울 여의도 페어몬트 앰배서더 서울에서 '2026 FIND(Financial Insight Network Days)'를 개최한다. 올해는 '한국 금융을 움직일 빅 웨이브'를 주제로, 자본과 화폐 구조가 동시에 재편되는 전환기 속에서 금융의 역할과 방향을 짚어볼 예정이다. 자본 배분의 방향을 바꾸는 '생산적 금융'과 결제·정산 체계를 바꾸는 '스테이블코..",2026.04.05 18:58,https://www.fnnews.com/news/202604051857195219,파이낸셜뉴스
"구윤철·걸프 6개국 주한대사 회동... ""한국에 원유 최우선 공급하겠다"" [미-이란 전쟁]",,정부가 두달째로 접어든 이란사태 장기화에 따른 에너지·나프타 공급난 최소화를 위한 국제 공조를 강화하고 나섰다. 이란사태 장기화로 공급 '불가항력'을 선언하는 걸프국가들이 증가할 우려가 커지면서 전 부처가 피해 최소화에 총력을 기울이고 있다. 구윤철 경제부총리 겸 재정경제부 장관은 걸프협력회의(GCC) 6개국 주한대사들을 만나 협조를 당부했다. GCC..,2026.04.05 18:55,https://www.fnnews.com/news/202604051854177359,파이낸셜뉴스
"""지옥 안겨주겠다""… 美·이란, 48시간 데드라인 앞두고 충돌",,"미국의 도널드 트럼프 대통령과 이란 정부가 평화협상 시한을 48시간 남겨두고 서로에게 ""지옥""을 안겨주겠다고 위협했다. 미국은 이란에 추락한 조종사를 구출해 협상력을 유지하게 됐지만 이란이 호르무즈해협에 이어 홍해까지 막을 경우 전쟁 수행에 부담이 늘어날 전망이다. 트럼프는 4일(현지시간) 소셜미디어 트루스소셜에 글을 올려 ""시간이 많지..",2026.04.05 18:55,https://www.fnnews.com/news/202604051854149251,파이낸셜뉴스
"이란, 호르무즈 선별 개방… 육상 송유관·대체 수입로 모색 [미-이란 전쟁]",,"1개월 넘게 호르무즈해협을 통제하고 있는 이란 정부가 일부 선박의 해협 통과를 허가하며 미국·이스라엘을 제외한 다른 국가들에 유화적인 태도를 보였다. 이들은 앞으로 선별적으로 해협 통행을 관리하면서 통행료를 걷을 계획이지만, 주요 석유 수입국들은 아예 다른 길을 찾고 있다. ■비적대국 통행 허가, 선별 관리미국 뉴욕타임스(NYT) 등 외신들에 따르..",2026.04.05 18:55,https://www.fnnews.com/news/202604051854089539,파이낸셜뉴스
美 지상작전 대비 장기전 준비하는 이란 [미-이란 전쟁],,이란이 미국의 지상전 가능성에 대비해 지구전 태세를 본격화하면서 미국·이란전쟁이 장기 소모전으로 이어질 가능성이 커졌다. 예멘의 후티반군과 레바논의 헤즈볼라 등 친이란 세력도 장기전을 대비하고 있어 전장이 여러 방향으로 확산되는 다중전선 구조로 전개되고 있다. 이란은 5일에도 이스라엘에 대한 공격을 멈추지 않았다. 이란은 하루 20발가량의 미사일을 ..,2026.04.05 18:55,https://www.fnnews.com/news/202604051854073760,파이낸셜뉴스
"D램값 한숨 돌리니 낸드값 급등… ""공급 부족에 SD카드 판매 중단""",,"수개월간 치솟던 D램 현물 가격 상승세가 한풀 꺾였지만 이번엔 낸드플래시 가격이 급등할 조짐이 보인다. 인공지능(AI) 데이터센터발 기업용 솔리드스테이트드라이브(eSSD) 수요의 지속적 확대, 메모리 '빅3'인 마이크론의 소비자용 메모리 사업 철수 등의 여파로 D램 가격 폭등 현상이 낸드에서 재현되는 모양새다. 5일 시장조사기관 트렌드포스에 따르면 올해 2&mid..",2026.04.05 18:55,https://www.fnnews.com/news/202604051854024576,파이낸셜뉴스
"7000억弗 고지 밟은 K수출, 올해 日 뛰어넘는다",,지난해 한국 수출이 반도체 초호황에 힘입어 일본을 턱밑까지 추격한 것으로 나타났다. 특히 올해는 사상 처음으로 일본을 뛰어넘을 수 있다는 기대감도 나오고 있다. 5일 산업통상부에 따르면 지난해 한국의 연간 수출액은 7093억3000만달러를 기록하며 사상 처음으로 7000억달러 고지를 넘어섰다. 한국 수출은 △1995년 1000억달러 △2004년 2000억달러 △2006년 3000억..,2026.04.05 18:55,https://www.fnnews.com/news/202604051854000032,파이낸셜뉴스
건설자재 재고 바닥… 공사현장 한달 버티기도 힘들다 [중동發 고물가 직격탄],,건설사들이 자재비 인상 공문을 하나둘 받으면서 지난 2020~2023년의 공사비 급증 '악몽'이 재현될 수 있다는 우려가 나온다. 당시 고물가와 러시아·우크라이나전쟁이 맞물려 3년 동안 건설공사비지수는 30%가량 올랐다. 2월 말 시작된 미국·이란전쟁이 한달 더 지속되면 공사비 부담은 물론 최악의 경우 현장이 멈추는 등 심각한 차질이 빚어지는 건설사..,2026.04.05 18:54,https://www.fnnews.com/news/202604051853579090,파이낸셜뉴스
"2030년 서·남해 재생에너지, 전력망 타고 수도권 간다 [에너지고속도로 속도낸다 (上)]",,에너지고속도로 건설은 이재명 정부의 핵심 에너지 공약이다. 발전을 해도 갈 곳 없는 호남의 태양광 에너지를 전력 수요가 집중된 수도권과 산업단지에 적기 공급할 수 있게 된다. 이를 통해 국가 온실가스 감축목표(NDC) 달성에 기여할 것으로 예상된다. 아울러 에너지고속도로를 위해 설치되는 해저 HVDC 노선이 수도권 수요를 일부 흡수하면 지상에 새로 건설해야 ..,2026.04.05 18:54,https://www.fnnews.com/news/202604051853551165,파이낸셜뉴스
수입 밀·콩 등 곡물값 껑충... 가공식품업계도 폭풍전야 [중동發 고물가 직격탄],,중동전쟁발 국제유가 상승이 국제곡물 선물가격을 끌어올리고 있다. 해상운임 급등에 더해 미국 등의 바이오디젤 확대 정책으로 콩 수요가 쏠린 영향이다. 한국은 밀·옥수수·콩을 대부분 수입에 의존하는 데다 고환율까지 겹치며 물가 압박이 커지고 있다. 국제곡물 가격은 수개월의 시차를 두고 가공식품 가격에 반영되는 만큼 물가 상승 압력은 올 하반..,2026.04.05 18:54,https://www.fnnews.com/news/202604051853506267,파이낸셜뉴스
호르무즈 막혀도 타격 없다… 전쟁이 키운 美 에너지 패권,,이란 전쟁이 역설적이게도 미국의 에너지 지배력을 사상 최고 수준으로 높이고 있다고 월스트리트저널(WSJ)이 4일(현지시간) 보도했다. 도널드 트럼프 대통령이 시작한 이란 전쟁으로 호르무즈 해협이 봉쇄돼 에너지 공급망이 막히자 셰일혁명으로 화석연료를 수출하게 된 미국 입지가 도리어 강화됐다는 것이다. 국제 유가가 폭등하면서 미국 서부텍사스산원유(WTI) 가격..,2026.04.05 18:46,https://www.fnnews.com/news/202604051845097202,파이낸셜뉴스
"""위기극복에 국민 마음 하나로 모아야""... ""어려운 분일수록 더 두텁고 세심하게 지원""",,"이재명 대통령은 5일 오후 부활절을 맞아 부인 김혜경 여사와 함께 서울 여의도순복음교회에서 열린 연합예배에 참석했다. 이 자리에서 이 대통령은 ""오늘날 우리는 여러 도전과 불확실성에 직면해 있다. 이런 때일수록 부활의 의미와 함께 오늘의 주제인 평화, 사랑의 의미를 다시 깊이 되새겨야 할 것""이라며 ""부활하신 예수님께서 두려움에 떨던 제자들..",2026.04.05 18:46,https://www.fnnews.com/news/202604051845055953,파이낸셜뉴스
원전으로 다시 눈돌리는 유럽,,"유가 급등 등 에너지 충격 속에 유럽이 에너지 자립과 원자력 에너지로 다시 눈을 돌리고 있다. BBC는 4일(현지시각) 원자력 에너지의 안전성에 대한 논란은 여전하지만 원자력 비중을 높이려는 움직임이 확연하다면서 이 같이 전했다. 우르줄라 폰 데어 라이엔 유럽연합(EU) 집행위원장은 최근 유럽이 원자력발전소를 광범위하게 등지고 있는 것는 ""전략적 실수&quo..",2026.04.05 18:46,https://www.fnnews.com/news/202604051845031234,파이낸셜뉴스
"5대 지원사업 중심 증액 추진... 與, 추경안 심사 방향성 공개",,"더불어민주당은 5일 이번 추가경정예산(추경)이 국민의힘이 주장하는 '선거용 추경'이라는 지적에 대해 ""고유가가 국가경제 전체에 미치는 복합적 영향을 간과한 주장""이라며 반박했다. 민주당은 이날 2026년 추경안 심사 방향성을 공개하면서 이같이 밝혔다. 민주당은 또 5대 지원 사업을 중심으로 증액 추진에 나서겠다는 점도 강조했다. 우선 전세버스 등 정..",2026.04.05 18:45,https://www.fnnews.com/news/202604051844586855,파이낸셜뉴스
부동산PF 연체율 3%대로 '뚝',,금융권 부동산 프로젝트파이낸싱(PF) 부실 정리로 연체율이 3%대로 낮아졌다. 다만 최근 중동 사태 등 불확실성이 커지면서 금융당국은 추가 리스크를 예의주시하고 있다. 금융위원회는 지난 3일 부동산 PF 상황 점검회의를 열고 연체율 동향 등을 점검했다고 5일 밝혔다. 지난해 말 기준 금융권의 PF 대출 연체율은 전분기 대비 0.36%p 하락한 3.88%로 집계됐다. 지난해 ..,2026.04.05 18:45,https://www.fnnews.com/news/202604051844487226,파이낸셜뉴스
신현송 '다주택' 정리… 외화자산은 쟁점으로,,"신현송 한국은행 총재 후보자(사진)가 다주택자 논란을 해소하기 위해 국내와 미국에 보유한 부동산을 처분한다. 5일 한은에 따르면 신 후보자는 부부 공동 명의 서울 종로구 오피스텔을 매물로 내놨고, 배우자와 딸이 공동 소유한 미국 일리노이주 아파트도 정리할 계획이다. 각각 18억원, 2억8000만원으로 모두 20억8000만원 규모다. 매도가 이뤄지면 신 후보자는 1주..",2026.04.05 18:45,https://www.fnnews.com/news/202604051844394426,파이낸셜뉴스
美 재정적자發 금리쇼크… 코스피 더 큰 파고 맞나,,국내 증시가 중동 지정학적 리스크보다 미국 금리 상승 압력에 더 크게 흔들릴 수 있다는 분석이 나왔다. 전쟁이 촉발한 재정 악화가 결국 금리 상승으로 이어지며 시장 전반에 부담을 줄 수 있어서다. 5일 증시 전문가들은 미국과 이란의 전쟁이 장기화 양상을 보이면서 미국 정부 지출 확대와 세수 감소를 동시에 유발하고 있다고 지적한다. 이에 따라 올해 미국 재정적자는 ..,2026.04.05 18:45,https://www.fnnews.com/news/202604051844335033,파이낸셜뉴스
월가는 크립토 액티브 운용 경쟁… 프랭클린템플턴 가세,,글로벌 자산운용사 프랭클린템플턴이 가상자산 투자 운용사인 '250 디지털'을 인수하고 전담 부서인 '프랭클린 크립토'를 신설한다. 프랭클린템플턴은 기존 벤처캐피털(VC)·상장지수펀드(ETF) 중심 디지털자산 사업 구조에 액티브 운용 역량을 추가해 기관 투자자 대상 서비스를 확장할 계획이다. 5일 프랭클린템플턴 및 외신에 따르면 이번 인수 핵심은 코인펀드..,2026.04.05 18:45,https://www.fnnews.com/news/202604051844292730,파이낸셜뉴스
"대구선 분열, 경기선 인물난… 끊이지않는 국힘 '공천 혼란'",,"6·3 지방선거가 2달도 남지 않은 시점에서 국민의힘의 '공천 혼란'은 끊이질 않는 모양새다. 단 한번도 더불어민주당 계열 정당에 무너진 적이 없었던 대구시장 선거는 주호영 국회부의장(왼쪽 사진)과 이진숙 전 방송통신위원장(오른쪽 사진)의 무소속 출마 가능성이 거론되고, 민주당 소속 김부겸 전 국무총리가 선전하면서 위기감이 고조되고 있다. 수도권 ..",2026.04.05 18:45,https://www.fnnews.com/news/202604051844190809,파이낸셜뉴스
이란戰 시시각각 변하는데…변수 못 담는 국내 ETF '투자 주의보',,중동발 지정학 리스크 고조로 국내 상장지수펀드(ETF)의 가격 왜곡 현상이 심화되고 있다. ETF의 시장가격과 실제 가치 간의 차이를 나타내는 '괴리율'이 기준치(1~2%)를 넘어서는 사례가 급증하고 있어서다. 5일 한국거래소에 따르면 지난달 ETF 괴리율 초과 공시 건수는 688건으로 지난해 4월(1060건) 이후 11개월만에 최고치이다. 올해 1월과 2월 ETF 괴리율 초과 공시는 각..,2026.04.05 18:45,https://www.fnnews.com/news/202604051844176949,파이낸셜뉴스
널뛰는 유가에 베팅… 원유 ETN 거래 한달새 7배 급증,,"지난달 원유 관련 상장지수증권(ETN) 거래가 7배 이상 급증한 것으로 나타났다. 미국·이스라엘과 이란 간 전쟁으로 국제유가 널뛰기 장세를 펼치자, '한탕'을 노린 투자자들의 관심이 원유 ETN에 쏠린 것으로 분석된다. 5일 한국거래소에 따르면 지난달 원유 ETN 20개 종목의 일평균 거래대금은 730억원으로 집계됐다. 전월 98억원 대비 7배 이상 급증한 수치다...",2026.04.05 18:45,https://www.fnnews.com/news/202604051844151303,파이낸셜뉴스
변방 탈출 꿈꾸는 베트남 반도체… 4년내 '5만 인재' 키운다,,"【파이낸셜뉴스 하노이(베트남)=김준석 특파원·부 튀 띠엔 통신원】 ""자, 여러분. 오늘은 불 대수(Boolean Algebra)의 기본 용어들에 대해 살펴보겠습니다. 이 내용은 디지털 논리 설계의 기초이자, 나아가 반도체 시스템을 이해하는 데 매우 중요한 개념입니다."" 지난 4일 베트남 수도 하노이에 위치한 하노이과학기술대(USTH)의 강의실. 응우옌 쩐 투엇 교..",2026.04.05 18:45,https://www.fnnews.com/news/202604051844102655,파이낸셜뉴스
서열 1위 또럼 서기장 '국가주석' 맡을까,,"【 하노이(베트남)=김준석 특파원】베트남 국회가 6일 새 임기 출범과 함께 국가주석·총리 등 국가 주요 인사 선출과 향후 5년간 운영 방향 설정에 나선다. 응우옌 반 히엔 국회 사무처 부처장은 지난 3일 하노이에서 열린 기자회견에서 이번 회기에서 주요 직위를 선출하고, 부총리 및 장관 등 정부 구성원 임명안을 승인할 예정이라고 밝혔다. 국가주석·..",2026.04.05 18:45,https://www.fnnews.com/news/202604051844074555,파이낸셜뉴스
"""원금 지키며 연 4% 이상 수익 추구""… 법인 자금 IMA로 몰린다",,중동 전쟁 이후 국내 증시 변동성이 확대되면서 종합투자계좌(IMA)에 대한 투자자 관심이 커지고 있다. 안정성과 함께 예금 대비 높은 수익성을 갖추면서 IMA로의 자금 이동이 가속화된 양상이다. 5일 금융투자업계에 따르면 최근 IMA 모집에 참여하는 법인 투자자 비중이 높아지는 추세다. 마땅한 투자처를 찾지 못해 은행에 예치돼 있던 법인 유동자금이 빠르게 움직이고 있..,2026.04.05 18:45,https://www.fnnews.com/news/202604051844060554,파이낸셜뉴스
"""농작만큼 중요한 자금 설계""… 청년농 코치로 나선 '농협銀' [르포]",,"""첫 단추가 중요하다. 스마트팜 창업을 꿈꾼다면 사업부지 선정과 사업계획 수립을 소홀히 하면 안 된다. 사업부지를 잘못 선택했다가 민원으로 사업이 1년 넘게 늦어지는 경우도 있다."" 신황호 NH농협은행 차장(농업경제학 박사)은 지난 1일 경남 밀양 스마트팜 혁신밸리에서 열린 농업금융 컨설팅교육에서 이렇게 말했다. 농협은행은 청년 농업인의 안정적..",2026.04.05 18:45,https://www.fnnews.com/news/202604051843562717,파이낸셜뉴스
공공자산 거래 한곳서 확인하는 '뉴 온비드',,"캠코(한국자산관리공사)가 '온비드(Onbid)'를 새로 선보인다. 온비드는 공공자산 매각과 임대 정보를 한 곳에서 확인하고 입찰까지 진행할 수 있는 공공자산 온라인 거래 플랫폼이다. 지난 2002년 출시 이후 누적 거래금액 121조원, 이용자 303만명을 돌파한 가운데 차세대 서비스가 공개되면서 이용자의 편의성이 한층 개선될 것으로 기대된다. 캠코는 10여년 만에 차세..",2026.04.05 18:44,https://www.fnnews.com/news/202604051843559283,파이낸셜뉴스
KB '상권활성화지수'로 소상공인 경쟁력 강화,,"KB금융그룹은 지난 3일 지역경제 활성화와 소상공인 지원 강화를 위해 개발한 'KB상권활성화지수' 설명회를 개최했다고 5일 밝혔다. 'KB상권활성화지수'는 상권 방문고객 흐름과 소상공인 경영 현황, 지역상권 변화 등을 종합적으로 살펴볼 수 있는 분석모델이다. KB국민은행과 KB국민카드, 한국데이터뱅크가 함께 개발했다. KB금융이 보유한 국내 최고 수준의 금융데이터..",2026.04.05 18:44,https://www.fnnews.com/news/202604051843548877,파이낸셜뉴스
"LG 스타일러, 전 세계 누적판매량 200만대 돌파",,"LG 스타일러의 전 세계 누적 판매량이 200만대를 돌파했다고 LG전자가 5일 밝혔다. 2011년 첫 출시 이후 10년 만인 2021년 누적 판매 100만대에 이어 그로부터 다시 5년 만에 200만대 고지를 달성한 것이다. LG 스타일러는 현재 27개국에서 판매되고 있다. 아시아와 북미 시장의 성장세가 두드러진다. 2025년 기준 중국, 대만, 미국지역 연간 판매 신장률은 30%를 상회..",2026.04.05 18:37,https://www.fnnews.com/news/202604051836143168,파이낸셜뉴스
"르노회장 ""韓 중형·중대형 생산력 탁월""… 전동화 허브로 육성",,"""SM6에 이어 필랑트도 또 하나의 성공작이 되리라 봅니다."" 프랑수아 프로보 르노그룹 회장 겸 최고경영자(CEO)가 지난 3일 서울 서초구 JW 메리어트 호텔에서 미디어 라운드테이블을 열고 르노코리아의 역량을 높게 평가하면서 한국 시장에 대한 높은 기대감을 드러냈다. 프로보 회장은 2011년부터 2016년까지 르노삼성자동차 사장을 역임하며 영업이익 2149..",2026.04.05 15:00,https://www.fnnews.com/news/202604051836124896,파이낸셜뉴스
LGU+ 유심 무료교체 차질없게… 사전예약·업데이트 안내,,LG유플러스는 오는 13일부터 시작되는 전 고객 대상 유심 업데이트 및 무료 교체에 앞서 지난 금요일까지 전체 발송 대상 고객의 64.1%에 해당하는 약 1068만건의 고객 안내 문자 발송을 완료했다고 5일 밝혔다. LG유플러스는 지난 3월 30일부터 고객들에게 문자메시지를 통해 유심 업데이트 및 무료 교체 관련 안내를 순차 발송하고 있다. 이달 6~7일에는 통신(MNO) 480..,2026.04.05 18:37,https://www.fnnews.com/news/202604051836101593,파이낸셜뉴스
"""옥상에 작은 숲 만들었어요""… KT 어린이 생태교육",,"KT는 서울 광화문 웨스트빌딩 옥상에서 KT 광화문 어린이집 원아와 학부모가 함께하는 '옥상 숲 만들기' 활동을 진행했다고 5일 밝혔다. 행사는 지난 3일 진행됐으며 어린이집 원아와 학부모, 국립생태원 관계자 등 20여명이 참여했다. 옥상 숲 만들기는 KT와 국립생태원이 공동으로 준비한 도심 속 생태 체험교육이다. 지난해 8월 양 기관이 체결한 '기후변화 대응과 ..",2026.04.05 18:37,https://www.fnnews.com/news/202604051836082285,파이낸셜뉴스
"김인욱 ""두산 전자BG, 미래기술 기반 닦겠다""",,"""두산 전자BG는 단순히 좋은 소재를 만들어 이익을 내는 기업이 아니라, 미래 기술이 개발될 수 있는 기반을 만들어 주는 기업이다."" 김인욱 ㈜두산 전자BG 사장이 지난달 30일 경기 용인시 수지기술원에서 열린 비전 선포식에서 100여 명의 임직원 앞에 서서 던진 한 마디다. 전자BG의 정체성 전환으로 볼 수 있는 대목이다. 동박적층판(CCL) 단일 제품군 중..",2026.04.05 18:37,https://www.fnnews.com/news/202604051836061837,파이낸셜뉴스
네오플 윤명진 '던파 모바일' 맡는다,,넥슨의 핵심 지식재산권(IP) '던전앤파이터'를 개발한 자회사 네오플이 던파 모바일 부문의 총괄 디렉터를 교체한다. 윤명진 네오플 대표가 약 3년 만에 직접 모바일 부문을 맡을 예정이다. 흥행 부진을 지적 받은 '던파 모바일' 중국 서비스를 현지 퍼블리셔인 텐센트로 이관하기로 결정한 가운데 윤 대표가 소방수로 나선 것으로 풀이된다. 5일 게임업계에 따르면 네오..,2026.04.05 18:37,https://www.fnnews.com/news/202604051836041064,파이낸셜뉴스
K-게임 신작 ‘희비’… 붉은사막 500만장 눈앞 vs 쿠키런은 '비상',,"국내 주요 게임사들이 나란히 출시한 기대작들의 흥행 성적이 글로벌 시장에서 엇갈리고 있다. 펄어비스 '붉은 사막'은 출시 12일 만에 400만 장을 넘어서며 한국 콘솔 게임의 새 기록을 쓴 반면, 데브시스터즈 '쿠키런: 오븐스매시'는 기대에 못 미치는 흐름에 긴급 대응에 나섰다. 신작 흥행 여부가 실적과 직결되는 게임사 특성상, 이번 성적표는 각사의 중장기 전략에도 적..",2026.04.05 18:37,https://www.fnnews.com/news/202604051836004301,파이낸셜뉴스
알뜰폰 인기 한물갔나… 1분기 가입자 순증 규모 '반토막',,"올해 1·4분기 알뜰폰(MVNO) 가입자 순증 규모가 전년 대비 절반 수준으로 감소했다. 이동통신 3사가 1월에는 KT 위약금 면제, 2~3월에는 갤럭시 S26 시리즈 사전예약과 출시를 계기로 보조금과 번호이동 혜택을 강화했다. 이에 알뜰폰으로의 이탈이 아닌 통신사 간 가입자를 주고받는 형태로 번호이동이 나타났다. ■1·4 이탈자 약 5만명 5일 통신업계와 ..",2026.04.05 18:36,https://www.fnnews.com/news/202604051835571004,파이낸셜뉴스
"대한항공, 호주매체가 꼽은 '세계 최고 FSC' 4위",,"대한항공이 호주의 글로벌 항공·여행 전문 매체 에어라인레이팅스의 세계 항공사 평가에서 톱5에 올랐다. 5일 항공업계에 따르면 대한항공은 에어라인레이팅스가 최근 발표한 '2026 세계 최고의 풀서비스 항공사(FSC)' 평가에서 4위를 기록했다. 올해는 항공사를 FSC와 하이브리드, 저비용항공사(LCC) 등 3개 등급으로 구분해 평가했다. 세계 최고 FSC 항공사는 카..",2026.04.05 18:36,https://www.fnnews.com/news/202604051835551850,파이낸셜뉴스
로봇 두뇌·눈·근육·심장 다 만든다… 글로벌 흔드는'원LG',,"LG그룹은 최근 휴머노이드로 대표되는 피지컬 인공지능(AI)에 '원LG' 역량을 집중하고 있다. '원LG'란 LG 계열사들의 핵심 역량을 한데 결집해 차별화된 가치를 창출하는 LG그룹의 전략이다. 구동 모터, 전장 부품, 배터리 등 LG 계열사들이 각각 생산하는 전기차 부품을 묶어 고객사에 최적화된 통합솔루션으로 제공하는 식이다. 이처럼 LG그룹 주력 계열사들이 로봇사..",2026.04.05 18:36,https://www.fnnews.com/news/202604051835527725,파이낸셜뉴스
"HD건설기계, 베트남 국제기능올림픽 국대 지원",,"HD건설기계가 국제기능올림픽에 참가하는 베트남 국가대표를 지원하며 글로벌 건설기계 분야 기술 인재 양성 협력을 확대한다. HD건설기계는 최근 하노이에서 베트남 교육부 산하 직업교육훈련총국, 현지 직업훈련 전문대학 CCT1과 국제기능올림픽 참가 지원을 위한 3자 업무협약을 체결했다고 5일 밝혔다. 협약을 통해 HD건설기계는 오는 9월 열리는 '2026 중국 상하이 ..",2026.04.05 18:36,https://www.fnnews.com/news/202604051835504455,파이낸셜뉴스
"아이오닉 6N, 포르쉐 꺾었다",,"현대차그룹이 세계 3대 자동차 상으로 꼽히는 '월드카 어워즈'의 고성능차 부문에서 주요 프리미엄 브랜드들을 꺾고 또 다시 수상대에 올라 고성능차 시장 판도를 바꾸고 있다. 최근까지 맥라렌, 포르쉐, 아우디, BMW와 같은 럭셔리·프리미엄 브랜드의 주 무대였던 월드카 어워즈의 '세계 올해의 고성능 자동차' 부문에서 현대차그룹의 아이오닉 6N(사진)이 수상한 것이..",2026.04.05 09:00,https://www.fnnews.com/news/202604051835482628,파이낸셜뉴스
주주가치 창출 우량기업 집중... 코스피 대비 초과 성과가 목표 [이런 펀드 어때요?],,우리나라의 고부가가치 기업에 눈을 다시 돌리는 국내 투자자들이 늘었다. 불과 1년 전과는 전혀 달라진 투자 분위기다. 코리아 디스카운트라는 고질적 문제에서 벗어날 것이라는 기대감이 상당하다. 이에 카디안자산운용은 코스피를 벤치마크로 삼은 '카디안 코리아 리더스 펀드'(이하 코리아 리더스 펀드)에 주목할 만하다고 추천했다. 5일 금융정보업체 에프앤가이드..,2026.04.05 18:36,https://www.fnnews.com/news/202604051835465635,파이낸셜뉴스
