title,thumbnail,short_content,write_time,link,company
"누구 말이 맞나? 이란 외교관, 호르무즈 해협 봉쇄 의도 전혀 없어",,[파이낸셜뉴스]  12일(현지시간) 최고 지도자 추대후 처음으로 모습을 드러낸 모즈타바 하메네이가 이란이 호르무즈 해협을 봉쇄하겠다고 밝힌 것과 달리 주 유엔 이스라엘 대사는 정반대의 발언을 내놨다.알리 바흐레이니 주유엔 이란 대표부 대사는 유로뉴스와 가진 인터뷰에서 “테헤란은 호르무즈 해협을 봉쇄할 의도가 전혀 없다”고 강조했다. 그는 “호르무즈 해협..,2026.03.13 06:35,https://www.fnnews.com/news/202603130625288489,파이낸셜뉴스
"""지구 종말?"" 하늘에서 쏟아진 '붉은 비'...새빨갛게 물든 바다, 어디",,[파이낸셜뉴스]  최근 유럽 일부 지역에서 이른바 '블러드 레인'(Blood Rain)으로 불리는 붉은색 비가 관측돼 이목이 쏠리고 있다.지난 9일(현지시간) 폭스웨더뉴스 등에 따르면 지난 7일 스페인과 포르투갈 등 남부 유럽에 블레드 레인이 내린데 이어 프랑스와 영국 등에서도 같은 현상이 관측됐다. 이는 아프리카 사하라 사막의 먼지가 북상해 남유럽 상공까지 영..,2026.03.13 06:42,https://www.fnnews.com/news/202603130623489374,파이낸셜뉴스
"""당신 모텔 갔잖아!"" 위치추적 앱으로 불륜 잡은 아내, 상간녀에게 고소 당해",,"[파이낸셜뉴스] 배우자의 불륜 행적을 스마트폰 동선 파악 애플리케이션(앱)을 통해 적발한 한 여성이 내연녀를 상대로 법적 대응에 나섰으나, 반대로 협박 혐의 고소를 당하는 사건이 발생했다.11일 방송된 JTBC '사건반장'에는 남편의 부정행위를 위치 기록으로 알아챈 40대 여성의 사연이 전해졌다.혼인 생활 10년째를 맞은 A 씨는 ""남편과는 연애할 때부터 아이..",2026.03.13 06:30,https://www.fnnews.com/news/202603130609256187,파이낸셜뉴스
하메네이 연설 공개후 이스라엘 테헤란 대규모 공습,,[파이낸셜뉴스]  이란의 새 최고 지도자 모즈타바 하메네이가 집권 이후 처음으로 발표한 성명이 국영 TV를 통해 낭독된 지 몇 시간 만에 이스라엘이 수도 테헤란을 집중 공습했다고 12일(현지시간) BBC가 보도했다.이스라엘방위군(IDF)은 소셜미디어를 통해 테헤란에 대한 대규모 공습을 시작했으며 수도 주변의 이란 정부 인프라가 공격 목표라고 밝혔다.베냐민 네타냐..,2026.03.13 06:19,https://www.fnnews.com/news/202603130605270473,파이낸셜뉴스
"""지금 당장 치우세요""…'이 물건' 주방 싱크대 밑 무작정 넣었다간 '위험' [건강잇슈]",,"[파이낸셜뉴스] 주방 내 수납공간이 부족하다는 이유로 세제와 식품 등 온갖 잡동사니를 싱크대 하부장에 무작정 보관하는 가정이 적지 않은 가운데, 이러한 습관이 안전과 위생에 악영향을 미칠 수 있다는 지적이 나왔다.미국의 건강 및 생활 분야 전문 매체인 이팅웰(EatingWell)에 따르면, 하부장 내부는 온도가 높고 습기가 차기 쉬운 조건이 만들어지므로 특정 품목..",2026.03.13 06:00,https://www.fnnews.com/news/202603130552057490,파이낸셜뉴스
美 1월 무역 수지 金 수출 급증에 적자 25% 감소,,[파이낸셜뉴스]  미국 도널드 트럼프 행정부의 잦은 무역 정책 변경 속에 지난 1월 미국의 무역적자가 전월 대비 큰 폭으로 감소한 것으로 나타났다.12일(현지시간) 월스트리트저널(WSJ)은 미국 상무부가 발표한 1월 미국의 무역적자가 545억달러(약 81조원)로 전월 보다 25% 줄었다고 보도했다.무역 적자는 저널이 전문가들을 상대로 실시한 조사에서 예상됐던 670억달러..,2026.03.13 05:59,https://www.fnnews.com/news/202603130549101698,파이낸셜뉴스
"""진짜 현기증 난다""…'원유 ETF' 널뛰기 장세, 중동발 유가 요동",,"[파이낸셜뉴스] 중동 지역의 지정학적 긴장감으로 국제 유가가 배럴당 100달러 안팎을 넘나들며 요동치자, 국내 주식시장에 상장된 원유 관련 상장지수펀드(ETF) 역시 가격 급등락을 겪고 있다. 기초 지수 흐름을 좇아야 할 ETF 상품이 매일같이 널뛰기 장세를 보이면서 투자자들도 혼선이 가중되는 상황이다.13일 한국거래소에 따르면 직전 거래일 기준 'KODEX WTI원유선..",2026.03.13 05:45,https://www.fnnews.com/news/202603130540540122,파이낸셜뉴스
"국제유가, 배럴당 100달러 돌파…""유가, 고점보다 기간이 더 중요""",,[파이낸셜뉴스]   국제 유가가 12일(현지시간) 배럴당 100달러를 다시 뚫었다.호르무즈 해협에서 지금 당장은 미국 해군이 선박을 호위할 수 없다고 크리스 라이트 에너지 장관이 밝히면서 유가 상승세 고삐가 풀렸다.스콧 베선트 재무장관이 서둘러 봉합에 나섰지만 투자자들의 불안 심리는 가라앉지 않았다.미 당국자들의 발언이 시장에 극심한 혼선을 주면서 유가는 시..,2026.03.13 06:15,https://www.fnnews.com/news/202603130538188884,파이낸셜뉴스
[뉴욕증시] 유가 100달러 돌파에 일제히 하락…'월가 공포지수' 두 자릿수 폭등,,[파이낸셜뉴스]  뉴욕 증시가 12일(현지시간) 일제히 급락했다.호르무즈 해협 봉쇄로 국제 유가가 배럴당 100달러를 돌파하자 그동안 버팀목 역할을 하던 빅테크가 무너지며 지수가 모두 큰 폭으로 하락했다.투자 심리는 극도로 불안정해졌다.‘월가 공포지수’라고 부르는 시카고옵션거래소(CBOE) 변동성지수(VIX)가 12.6% 폭등했다.일제히 급락주가 지수는 유가 폭등 충..,2026.03.13 05:37,https://www.fnnews.com/news/202603130534474526,파이낸셜뉴스
베선트 “군사적으로 가능해지면 미 해군 호르무즈 유조선 호위”,,"【파이낸셜뉴스 뉴욕=이병철 특파원】 스콧 베선트 미국 재무부 장관은 미군이 호르무즈 해협의 유조선 호위 작전에 나설 것이라고 밝혔다. 그러나 크리스 라이트 미 에너지부 장관은 이달 말에야 미군의 호위 작전이 가능할 것이라고 말했다.베선트 미 재무부 장관은 12일(현지시간) 스카이뉴스 인터뷰에서 ""군사적으로 가능한 즉시 미 해군이 선박 호위를 시작할 ..",2026.03.13 05:36,https://www.fnnews.com/news/202603130525116772,파이낸셜뉴스
"""와 한국 진짜 망했네요"" 외신 경악한 '4세, 7세 고시' 학원 문 닫는다",,[파이낸셜뉴스] 해외 학계마저 경악하게 만든 국내 영유아 대상의 과도한 사교육 열풍이 법적 규제를 받게 됐다. 앞으로 4세와 7세 등 어린 아동을 상대로 입시 난이도에 버금가는 평가를 치르도록 강제하는 유아 대상 학원의 '레벨테스트'가 전면적으로 금지된다.교육부는 12일 국회 본회의에서 ‘학원의 설립·운영 및 과외교습에 관한 법률’(학원법) 개정안이 ..,2026.03.13 05:31,https://www.fnnews.com/news/202603130520417671,파이낸셜뉴스
"[속보][뉴욕증시] 유가 100달러 돌파에 일제히 하락…나스닥, 1.8% 급락",,[파이낸셜뉴스]  dympna@fnnews.com 송경재 기자,2026.03.13 05:00,https://www.fnnews.com/news/202603130459590734,파이낸셜뉴스
美 모기지 금리 다시 6%대…중동 전쟁에 주택시장 ‘불안’,,【파이낸셜뉴스 뉴욕=이병철 특파원】 미국과 이스라엘의 이란 공습으로 중동 전쟁이 격화되면서 미국 모기지 금리가 다시 상승하고 있다. 최근 몇 년 만에 처음으로 6% 아래로 떨어지며 주택시장 회복 기대를 키웠던 금리 하락 흐름이 멈추면서 주택 구매자들의 부담이 다시 커질 수 있다는 우려가 나온다.12일(현지시간) 모기지 금융기관 프레디맥에 따르면 미국의 30년..,2026.03.13 04:15,https://www.fnnews.com/news/202603130412070625,파이낸셜뉴스
중동 전쟁에 헬륨 가격 폭등…현물 가격 두 배 상승,,【파이낸셜뉴스 뉴욕=이병철 특파원】 미국과 이스라엘의 이란 공습으로 중동 전쟁이 격화되면서 헬륨 가격이 급등하고 있다. 카타르의 액화천연가스(LNG) 생산 차질로 헬륨 공급이 줄어들면서 반도체와 의료 장비 등 첨단 산업 공급망에 경고등이 켜졌다.12일(현지시간) 로이터통신에 따르면 중동 위기 이후 헬륨 현물 가격은 두 배로 상승했다. 일부 시장에서는 이미 약..,2026.03.13 03:57,https://www.fnnews.com/news/202603130340296669,파이낸셜뉴스
호르무즈 막히자 러시아 돈 번다…하루 1.5억달러 추가 수입,,【파이낸셜뉴스 뉴욕=이병철 특파원】 미국과 이스라엘의 이란 공습으로 중동 전쟁이 격화되면서 국제 에너지 시장의 예상치 못한 승자가 등장했다. 바로 러시아다.호르무즈 해협이 사실상 마비되면서 중동 원유 공급이 급감하자 인도와 중국이 러시아산 원유 수입을 급격히 늘리고 있다. 이 영향으로 러시아 정부는 하루 최대 1억5000만달러(약 2000억원)의 추가 재정 수..,2026.03.13 03:15,https://www.fnnews.com/news/202603130309576389,파이낸셜뉴스
"63세女, 외아들 잃고 시험관 임신해 '딸' 출산..中누리꾼 ""용감하다 vs. 경이롭다"" 난리",,"[파이낸셜뉴스] 지난해 외동아들을 잃은 60대 여성이 시험관 시술을 통해 딸을 출산해 화제다. 12일 홍콩 사우스차이나모닝포스트(SCMP)에 따르면 , 산샹 메트로폴리스 뉴스에 따르면 중국 동북부에 사는 63세 여성 A씨는 예정일보다 약 2주 빠른 지난 4일 지린성 쑹위안의 한 병원에서 제왕절개로 아기를 낳았다.산모와 아기 모두 건강한 상태이며 아기는 2.8㎏으로 태어났다...",2026.03.13 05:30,https://www.fnnews.com/news/202603122345136088,파이낸셜뉴스
[현장영상] 김민수 “백문이 불여일견” '김어준의 겸손은 힘들다',,"국민의힘 김민수 최고위원이 12일 오전 최고위원회의에서 유튜브 '김어준의 겸손은 힘들다' 갈무리 영상을 재생했다.김 최고위원은 ""대한민국 좌파 세력의 빅파더, 김어준의 뉴스 공장에서 이재명의 사법 리스크와 검찰 간의 거래 의혹이 터졌다""면서 ""백문이 불여일견""이라고 했다.그러면서 “국민 여러분 이재명의 12개의 혐의, 5개의 재판 무죄겠습니까..",2026.03.12 23:25,https://www.fnnews.com/news/202603122319438851,파이낸셜뉴스
"네일아트 뒤, 피 묻은 손톱 사진 보내고 ""돈 내놔""…충격 반전",,[파이낸셜뉴스] 생성형 인공지능(AI)을 이용해 네일아트 시술 부작용이 발생한 것처럼 사진과 진료확인서를 조작한 뒤 업체에 돈을 뜯으려 한 20대 외국인이 검찰에 넘겨졌다.12일 경남 창원중부경찰서는 사기미수와 업무방해 혐의로 튀르키예 국적 20대 A씨를 검찰에 송치했다고 밝혔다.A씨는 지난해 12월 26일 창원 성산구의 한 네일숍에서 시술을 받은 뒤 챗GPT를 활용해 손..,2026.03.13 05:20,https://www.fnnews.com/news/202603122312478458,파이낸셜뉴스
트럼프 “유가 상승 미국에 이익…그래도 최우선은 이란 핵 저지”,,"【파이낸셜뉴스 뉴욕=이병철 특파원】 도널드 트럼프 미국 대통령이 국제유가 상승 속에서도 대이란 군사작전의 정당성을 강조했다. 미국이 원유 가격 상승으로 경제적 이익을 얻을 수 있지만, 이란의 핵무기 보유를 막는 것이 훨씬 더 중요한 목표라는 주장이다.트럼프 대통령은 12일(현지시간) 소셜미디어 트루스소셜에 글을 올려 “미국은 세계 최대의 원유 생산국”이..",2026.03.12 23:13,https://www.fnnews.com/news/202603122310462382,파이낸셜뉴스
이란 새 최고지도자 “호르무즈 봉쇄 계속”…美·이스라엘 보복 경고,,"【파이낸셜뉴스 뉴욕=이병철 특파원】 이란의 새 최고지도자로 선출된 아야톨라 세예드 모즈타바 하메네이가 첫 대외 메시지에서 미국과 이스라엘을 겨냥한 강경 대응을 선언했다. 특히 호르무즈 해협 봉쇄를 지속해야 한다고 공개적으로 밝히면서 중동 정세 긴장이 한층 고조되고 있다.모즈타바 하메네이는 12일(현지시간) 국영TV를 통해 발표한 메시지에서 ""적(미..",2026.03.12 23:03,https://www.fnnews.com/news/202603122301273095,파이낸셜뉴스
"이란 새 지도자 모즈타바 ""복수할 것..미군 기지 즉시 폐쇄하라"" 첫 공개 메시지",,"[파이낸셜뉴스] 이란의 새로운 최고지도자 모즈타바 하메네이가 호르무즈 해협 봉쇄를 “적을 압박하기 위한 수단”으로 계속 유지해야 한다고 밝혔다.12일(현지시간) CNBC, CNN 등에 따르면 모즈타바 하메네이는 국영 TV 연설에서 “중동 지역의 모든 미국 군사기지는 즉각 폐쇄돼야 하며 그렇지 않을 경우 공격 대상이 될 것”이라고 경고했다.이어 ""이웃 국가들과의 우..",2026.03.12 22:56,https://www.fnnews.com/news/202603122253213217,파이낸셜뉴스
"[속보]이란 모즈타바, 첫 메시지 ""복수 피하지 않는다..걸프국 계속 공격할 것""",,[파이낸셜뉴스] 이란 최고지도자로 선출된 모즈타바 하메네이가 선출 후 첫 번째 메시지를 발표하고 걸프국을 계속 공격하겠다고 밝혔다. 아울러 미군 기지 폐쇄를 촉구했다.moon@fnnews.com 문영진 기자,2026.03.12 22:49,https://www.fnnews.com/news/202603122246408195,파이낸셜뉴스
"부상 입고 두문불출했는데…이란 새 최고지도자 모즈타바, 곧 첫 번째 메시지 발표",,"[파이낸셜뉴스] 이란 최고지도자로 선출된하메네이가 곧 첫 번째 메시지를 발표한다.12일(현지시간) AFP통신에 따르면 모즈타바 공식 텔레그램 채널이 이 같이 밝혔다. AFP는 ""음성 메시지인지 서면인지는 명시하지 않았다""고 전했다.이란은 지난달 28일 미국과 이스라엘의 공습으로 아야톨라 알리 하메네이 최고지도자가 사망하자 지난 8일 그의 차남인 모즈타바 하..",2026.03.12 22:35,https://www.fnnews.com/news/202603122230400236,파이낸셜뉴스
미 “이란 공격능력 먼저 제거”…호르무즈 유조선 호위 이달 말 전망,,"【파이낸셜뉴스 뉴욕=이병철 특파원】 미 해군이 이달 말쯤 호르무즈 해협을 통과하는 유조선 호위에 나설 전망이다.크리스 라이트 미국 에너지부 장관은 12일(현지시간) CNBC 인터뷰에서 ""호르무즈 해협에서 유조선 호위는 비교적 곧 이뤄지겠지만 지금 당장은 불가능하다""고 밝혔다. 그는 ""우리는 아직 준비가 돼 있지 않다""며 ""현재 모든 군..",2026.03.12 22:33,https://www.fnnews.com/news/202603122230125276,파이낸셜뉴스
보령머드·안동탈춤·진주유등..세계인이 찾는 '글로벌 축제'로 뜬다,,"문화체육관광부와 한국관광공사가 ‘글로벌 축제’ 3개와 ‘예비 글로벌축제’ 4개를 새로 뽑았다고 12일 밝혔다. 이는 방한 관광객 3000만명 조기 달성을 위한 핵심 관광 콘텐츠 육성 사업의 일환이다.글로벌 축제로는 보령머드축제, 안동국제탈춤페스티벌, 진주남강유등축제가 선정됐다. 또 예비 글로벌축제에는 대구치맥페스티벌, 부산국제록페스티벌, 순창장류축제, 정남진..",2026.03.12 22:08,https://www.fnnews.com/news/202603122147021217,파이낸셜뉴스
국민연금 ‘상법 우회’ 기업에 선전포고…의결권 행사 기준 대폭 강화,,[파이낸셜뉴스] 국민연금공단 기금운용본부(국민연금)가 개정 상법 취지를 외면하는 상장사들에 대해 강력한 의결권 행사로 대응하기로 했다. 이달 정기주주총회부터 집중투표제나 감사위원 분리선출을 우회하는 정관 변경 안건에 대해 반대할 예정이다. 또한 국민연금의 영향력이 미치는 의결권 사전 공개 대상 기업을 지분율 5% 이상으로 늘려 자본시장의 투명성을 높인다는 ..,2026.03.12 21:39,https://www.fnnews.com/news/202603122129044829,파이낸셜뉴스
"관광공사, '2026년 강소형 잠재관광지' 9곳 신규 선정",,"한국관광공사가 ‘2026년 강소형 잠재관광지’ 9곳을 선정했다고 12일 밝혔다. ‘강소형 잠재관광지’는 지난 2019년부터 인지도는 낮지만 독특한 매력과 성장 가능성을 지닌 관광지를 발굴해 대표 관광명소로 육성하는 사업이다.올해 신규 선정 관광지는 강경근대역사거리(충남 논산), 거창산림레포츠파크(경남 거창), 만휴정(경북 안동), 해양생태과학관(경기 시흥), 실레마..",2026.03.12 21:39,https://www.fnnews.com/news/202603122127305637,파이낸셜뉴스
"대통령 성추문 영상 그 후, 연극 ‘빅 마더’..""동시대성과 대중성 겸비""",,"[파이낸셜뉴스] 대선을 앞둔 미국에서 대통령 성추문 영상이 공개되고, 이를 추적하는 기자들이 거대한 데이터 조작 시스템의 존재를 발견한다. 정치와 미디어, 빅데이터가 결탁한 현대 사회의 권력 구조를 파헤치는 프랑스 화제작 ‘빅 마더’가 서울 무대에 오른다.작가 멜로디 무레의 ‘빅 마더’는 2023년 프랑스 연극계 최고 권위인 몰리에르상 5개 부문 후보에..",2026.03.13 00:05,https://www.fnnews.com/news/202603122127271041,파이낸셜뉴스
"""엄마 배가 너무 아파요""..4살 남아 뱃속에 '이 것' 한가득 [헬스톡]",,"[파이낸셜뉴스] 복통을 호소하던 남아의 뱃속에서 자석 뭉치가 발견됐다. 12일 학술지 ‘큐레우스’ 저널에 따르면 오만의 4살 소년이 1년간 지속적인 복통을 겪었다. 초기에는 단순 변비로 판단돼 관련 치료를 받았지만, 증상이 호전되지 않았다. 이에 추가로 엑스레이 검사를 받은 결과, 하복부에 동글한 이물질이 여러 개 붙어 있는 것을 확인했다.현지 소아과 병원 의..",2026.03.13 05:50,https://www.fnnews.com/news/202603122110134646,파이낸셜뉴스
“시민 변화 체감”...이천시 상반기 주요 사업 집중 점검,,"【파이낸셜뉴스 이천=김경수 기자】 경기 이천시가 ‘2026년 상반기 주요 사업 점검’을 실시했다.12일 이천시에 따르면 이번 점검은 민선 8기 핵심 사업 추진 상황을 점검하고, 사업 완성도를 높이고자 마련했다.시는 사회간접자본(SOC) 중심 사업 41건을 대상으로 진행했다. 31건은 서면 보고, 10건은 서면 보고와 현장 점검을 병행해 종합적으로 살폈다.김경희 시장은 시청..",2026.03.12 21:14,https://www.fnnews.com/news/202603122052599216,파이낸셜뉴스
"산림청, 전북 권역서 '산불예방' 영농부산물 파쇄 캠페인",,"[파이낸셜뉴스] 산림청은 12일 전북 남원시·완주군·장수군·순창군·무주군 등 산불 발생 위험이 높은 시·군에서 산불예방을 위한 영농부산물 파쇄 캠페인을 펼쳤다고 밝혔다. 이상익 산림청 산림산업정책국장은 ""작은 부주의가 대형 산불로 이어질 수 있는 시기인 만큼 산불 예방 캠페인과 현장 점검·단속을 강화하고..",2026.03.12 21:02,https://www.fnnews.com/news/202603122048337072,파이낸셜뉴스
"이란 '종전 조건'으로 세가지 요구…미국·이스라엘, 수용 여부 불투명",,[파이낸셜뉴스] 마수드 페제시키안 이란 대통령이 미국·이스라엘과의 전쟁을 끝내기 위한 조건으로 전쟁 피해 배상금 지급 등 세가지를 요구했다.마수드 페제시키안 이란 대통령은 11일(현지시간) 엑스(X)에 “러시아 및 파키스탄 지도자들과의 회담을 통해 역내 평화에 대한 이란의 의지를 재확인했다”며 미국·이스라엘과의 전쟁 종식을 위한 조건으로 △..,2026.03.12 20:58,https://www.fnnews.com/news/202603122047370698,파이낸셜뉴스
"구윤철 ""석유 매점매석 행위 땐 형사처벌 등 엄정 대응""",,"[파이낸셜뉴스]  구윤철 부총리 겸 재정경제부 장관은 12일 석유제품 최고가격제 및 매점매석 행위 금지 조치 시행을 발표하면서 ""법 위반 행위가 적발되면 시정명령과 형사처벌 등 엄정 대응하겠다""고 말했다.이날 구 부총리는 정부서울청사에서 민생물가 특별관리 관계장관 TF 회의를 주재하며 ""정부는 위기 상황을 틈 탄 도를 넘는 가격인상에 단호히 ..",2026.03.12 20:40,https://www.fnnews.com/news/202603122036488820,파이낸셜뉴스
"""당신은 25년 후 치매 걸릴 수 있다""..女의 피 한방울이면 알 수 있다? [헬스톡]",,[파이낸셜뉴스] 혈액 검사를 통해 여성의 치매 위험을 최대 25년 전에 미리 예측할 수 있다는 연구결과가 나왔다. 미국 샌디에이고 캘리포니아대 알라딘 셰디아브 교수팀은 11일 이 같은 연구결과를 미국의사협회 학술지 'JAMA 네트워크 오픈'을 통해 밝혔다. 연구팀은 여성 노인 2700여명을 최대 25년간 추적 관찰한 연구에서 알츠하이머병 생체지표 중 하나인 혈장 인산화 타..,2026.03.13 05:10,https://www.fnnews.com/news/202603122008239030,파이낸셜뉴스
휘발유 1724원 묶었다…석유 최고가격제 효과는,,"[파이낸셜뉴스]  휘발유 리터당 1724원, 경유 1713원, 등유 1320원을 상한으로 하는 ‘석유 최고가격제’가 13일 0시부터 시행된다. 정유사가 주유소에 공급하는 가격에 상한선을 두는 방식으로 정부가 30년 만에 석유 가격 통제에 나서는 조치다. 다만 전문가들은 단기적인 물가 안정 효과는 기대할 수 있지만 시장 가격 신호를 왜곡해 공급 감소 등 부작용이 나타날 가..",2026.03.12 19:56,https://www.fnnews.com/news/202603121947255042,파이낸셜뉴스
"""사생활 지켜달라"" 호소한 제니, 돌연 '손가락 욕' 사진 올려, 무슨 일",,"[파이낸셜뉴스] 그룹 블랙핑크 제니의 소속사 측이 사생활 침해 및 허위 사실 유포에 강경 대응을 예고한 가운데, 돌연 손가락 욕을 하는 셀카를 공개해 화제다. 제니는 지난 10일 자신의 SNS에 앰버서더로 활동 중인 명품 브랜드의 C사의 패션쇼에 참석한 근황을 공개했다. 사진에서 제니는 블랙 브라톱과 짧은 하의 위에 비즈 장식이 들어간 망사 소재의 재킷과 스커트를 겹..",2026.03.13 05:00,https://www.fnnews.com/news/202603121942136132,파이낸셜뉴스
"""지고나서 징징대지 마"" 대만 악플러 뺨 때린 오스틴의 의리… 이 정도면 '잠실 오씨' 귀화 가야죠?",,"[파이낸셜뉴스]  이쯤 되면 여권 검사부터 다시 해봐야 할 것 같다. 미국 국적의 외국인 타자가 아니라, 동네 어귀에서 ""우리 애들 건드리지 마!""라고 외치는 든든한 '잠실 아재'를 보는 듯하다. LG 트윈스의 복덩이 오스틴 딘의 이야기다.멀리 마이애미 결전지에서 들려온 훈훈한 소식 하나가 LG 팬들의 가슴을 뜨겁게 달구고 있다. 사건의 발단은 9일 호주전 ..",2026.03.12 19:50,https://www.fnnews.com/news/202603121942105473,파이낸셜뉴스
"""모델보다 예쁘네. 그런데 명품 아니라 부적이었어?""... 캡틴 이정후, '내돈내산' 목걸이에 팬들 열광",,"[파이낸셜뉴스] 기적의 8강 진출을 일궈낸 도쿄돔의 환희 속에서, 대한민국 야구 국가대표팀 캡틴 이정후(샌프란시스코 자이언츠)의 가슴팍에서 반짝이던 검은색 '네잎클로버'가 화제의 중심으로 떠올랐다. 17년 만의 결선 라운드 진출이라는 대업을 이끄는 동안 그의 곁을 묵묵히 지킨 일종의 '행운의 부적'이다. 여성들의 전유물로만 여겨졌던 초고가 주얼리가 이정후의 태평..",2026.03.12 19:41,https://www.fnnews.com/news/202603121936345362,파이낸셜뉴스
"[2보]휘발유 1724원, 경유 1713원.. 26일까지 2주간 적용",,"[파이낸셜뉴스]  30년만에 석유 최고가격제가 시행되는 가운데, 1차 최고가격은 리터당 보통 휘발유 1724원, 자동차용 경유 1713원으로 설정됐다. 12일 산업부는 관계부처 협의를 거쳐 이같은 금액의 '석유제품 최고가격제'를 13일 0시부로 시행할 예정라고 밝혔다.해당 금액은 11일 정유사가 제출한 평균 공급가격에 비해 각각 휘발유 109원, 경유 218원,..",2026.03.12 19:41,https://www.fnnews.com/news/202603121934503742,파이낸셜뉴스
이란교민 4명 인접국 피난 완료..교민1명·현지인 가족 2명도 모레 도착,,[파이낸셜뉴스] 외교부는 12일 이란 테헤란을 출발한 우리 국민 4명이 투르크메니스탄으로 대피를 완료했다고 밝혔다.우리 국민 1명과 이란 국적자 2명도 오는 14일 추가로 도착한다. 이들은 향후 투르크메니스탄 출발 항공에 따라 두 그룹으로 나뉘어 입국한다.주투르크메니스탄대사관에서는 우리 국민들의 투르크메니스탄 입국 수속이 원활하게 진행될 수 있도록 ..,2026.03.12 19:36,https://www.fnnews.com/news/202603121932352165,파이낸셜뉴스
