title,thumbnail,short_content,write_time,link,company
"오세훈 ""당 변화 없어 공천등록 못해… 선거는 참여""",,"오세훈 서울시장은 12일 국민의힘 서울시장 후보로 등록하지 않겠다고 밝혔다. 오 시장은 장동혁 지도부가 '절윤(絶尹)' 결의문을 실천한다면 경선에 참여하겠다고 밝힌 바 있는데, 아직까지 명확한 실천 조짐이 보이지 않는다면서다. 오 시장은 이날 하이서울기업 사업 설명회를 마치고 기자들과 만나 ""오늘(12일) 송구스럽게도 경선 공천 등록을 하지 못한다&quo..",2026.03.12 18:43,https://www.fnnews.com/news/202603121843045430,파이낸셜뉴스
"""대상과 너무 가까우면 제대로 볼수 없어… 거리는 사유를 위한 조건"" [아트&컬처]",,"""거리란 분리가 아니라, 사유를 위한 조건입니다."" 일본에서 태어나 인도네시아 반둥을 기반으로 활동하는 여성 작가 케이 이마즈(Kei Imazu·작은 사진)의 작업은 서로 다른 시대와 장소의 이미지들이 한 화면 안에서 충돌하는 지점에서 출발한다. 전쟁의 잔해와 신화적 인물, 식민지의 기억과 일상의 몸짓이 한 장면 안에 겹쳐지며 단선적인 역사 서..",2026.03.12 18:43,https://www.fnnews.com/news/202603121843002206,파이낸셜뉴스
'대미투자특별법' 여야 합의로 국회 통과,,"'대한민국과 미합중국 간 전략적투자의 운영 및 관리를 위한 특별법(대미투자특별법)'이 여야 합의로 국회 본회의 문턱을 넘었다. 도널드 트럼프 미국 대통령의 관세 재인상 압박으로 여야가 모처럼 힘을 모은 것이다. 3500억달러(약510조원) 규모의 대미투자가 법적 근거를 얻으면서, 미국 관세 리스크가 해소될지 주목된다. 국회는 12일 본회의를 열고 대미투자특별법을..",2026.03.12 18:43,https://www.fnnews.com/news/202603121842580219,파이낸셜뉴스
"'강한 성장' 추미애·'현장 일꾼' 김동연, 與 경기지사 출사표 [막오른 6·3지방선거]",,"추미애 더불어민주당 의원과 김동연 경기지사가 12일 나란히 오는 6·3 지방선거 경기지사 도전을 공식화했다. 이들은 앞서 출마를 선언한 한준호, 권칠승 의원과 양기대 전 의원을 각종 여론조사 수치상 앞지르며 당내 경선 국면에서 1, 2위를 다투고 있다. 먼저 추 의원은 이날 국회 소통관에서 공식 출마선언을 통해 공약을 발표하고 포부를 밝혔다. 그는 '강..",2026.03.12 18:43,https://www.fnnews.com/news/202603121842496109,파이낸셜뉴스
"정청래 ""공소취소 거래설 가짜뉴스… 강력대응"" vs 장동혁 ""사실이라면 탄핵 사유… 특검 추진해야""",,"정부 고위관계자가 검찰에 이재명 대통령 사건 공소 취소를 압박했다는 의혹에 정치권이 들썩이고 있다. 더불어민주당은 가짜뉴스라며 강력 대응을 예고했다. 국민의힘 사실이라면 이 대통령 탄핵소추 사유라며 특별검사를 요구했다. 12일 정치권에 따르면, 공소 취소 거래설에 민주당은 당혹스러운 분위기고 국민의힘은 대여공세에 활용하고 있다. 민주당은 정청래 대..",2026.03.12 18:43,https://www.fnnews.com/news/202603121842365595,파이낸셜뉴스
"전기톱 든 구순의 작가… ""나무는 내 영원한 친구"" [Weekend 문화]",,"【 용인=유선준 기자】 ""나는 나무예요. 나무는 내 영원한 친구입니다."" 김윤신 작가(90)의 말처럼 전시장은 온통 나무조각으로 가득 찼다. 거친 나무조각과 세심히 깎아낸 나무조각, 뼈대만 앙상한 조각들은 각기 자신만의 생명력을 내뿜었다. 작가의 작업이 매 순간 혼연일체가 돼서인지 조각된 나무들은 또 다른 생명을 얻은 듯 자연을 펼쳐 보였다. 한국..",2026.03.13 04:00,https://www.fnnews.com/news/202603121842283858,파이낸셜뉴스
남녘은 이미 봄… 매화·산수유·진달래 꽃망울 터졌다 [Weekend 레저],,"계절에 앞서 피어나 봄을 알리는 꽃들이 있다. 매화, 산수유, 진달래 같은 꽃들이다. 이미 남녘에는 이들 꽃들이 꽃망울을 터뜨리기 시작해 사람들의 마음을 싱숭생숭하게 한다. 올해는 예년에 비해 개화 시기가 빨라져 '봄의 여왕' 벚꽃도 오는 23~27일(남부지역 기준)이면 꽃잎을 내밀 것으로 보인다. 이번주에는 봄꽃축제 준비가 한창인 광양, 구례, 여수, 진해로 발걸음을 ..",2026.03.13 04:00,https://www.fnnews.com/news/202603121838585034,파이낸셜뉴스
"대한항공, 기내식·면세품 다시 품에..기업가치 1.7兆(종합)",,[파이낸셜뉴스] 대한항공이 자사 기내식 공급과 기내면세품 판매 사업을 담당하는 '대한항공씨앤디서비스(대한항공C&D)'를 다시 품에 안았다. 2020년 코로나19로 유동성 위기에 빠지면서 기내식 및 기내면세품 판매 사업을 한앤컴퍼니에 매각한 후 6년 만이다.대한항공은 12일 오후 서울 중구 대한항공 서소문 빌딩에서 이사회를 열고 한앤컴퍼니가 보유한 '대한항공C&..,2026.03.12 18:49,https://www.fnnews.com/news/202603121838055086,파이낸셜뉴스
"""이란 모즈타바, 전쟁 때문에 지도자에 올라""",,미국과 이스라엘 공습으로 사망한 알리 하메네이에 이어 그의 아들 모즈타바 하메네이가 이란 최고 지도자로 추대된 것은 전쟁 속에서 불가피한 선택이었다는 분석들이 나왔다. 11일(현지시간) USA투데이는 이란 문제에 정통한 전문가들과의 인터뷰를 통해 이 같이 전하면서 예정돼 있지 않은 '즉석의 결정'이라고 강조했다.중동연구소(MEI) 선임 연구원인 앨릭스 버탄카..,2026.03.12 18:35,https://www.fnnews.com/news/202603121834256594,파이낸셜뉴스
가계대출 관리방안 언제 나오나… 대출시장 혼란 가중,,다주택자 관련 규제를 두고 금융당국의 고심이 길어지면서 가계부채 관리방안도 덩달아 지연되고 있다. 은행권의 가계대출 총량 목표치나 페널티 강도 등이 확정되지 않는 가운데 현장의 혼란이 커질 수 있다는 우려가 나온다. 주택담보대출 이외에 새로운 수익원을 마련해야 하는 은행들도 고민이 커지고 있다. 12일 금융당국과 금융권에 따르면 금융위원회는 가계부채 ..,2026.03.12 18:34,https://www.fnnews.com/news/202603121834236935,파이낸셜뉴스
"中, 내수 중심·기술 자립으로 저성장 돌파 나선다",,"중국이 향후 5년간 내수 확대와 과학기술 자립을 축으로 경제 구조 전환에 나선다. 반도체와 인공지능(AI), 6세대(6G) 통신 등 첨단 산업을 집중 육성해 새로운 동력을 확보하고 저성장 국면을 돌파하겠다는 구상이다. 중국 최대 연례 정치행사인 양회(전국인민대표대회·중국인민정치협상회의)는 12일 전인대 폐막식을 끝으로 막을 내렸다. 이번 양회에서는 향후..",2026.03.12 18:34,https://www.fnnews.com/news/202603121834213545,파이낸셜뉴스
"'전쟁 직격탄' 두바이, 유령도시 전락",,중동 전쟁 여파로 아랍에미리트(UAE) 두바이가 불과 2주 만에 사실상 '유령 도시'로 변했다. 억만장자와 관광객이 몰리던 세계적 휴양 도시였지만 이란의 반격 공격이 집중되면서 외국인 체류자와 관광객의 대탈출이 이어지고 있다는 전언이다. 영국 가디언은 11일(현지시간) 미국과 이스라엘의 공습에 맞선 이란의 반격 과정에서 상당수 무기가 UAE 지역으로 향하면서 두바이..,2026.03.12 18:34,https://www.fnnews.com/news/202603121834201776,파이낸셜뉴스
"""불법 현수막 수거해오면 보상금 드려요""",,"서울 서대문구는 다음 달부터 '불법 유동광고물 수거보상제'를 시행한다고 12일 밝혔다. 이 제도는 주민이 직접 불법 벽보와 현수막 등 유동 광고물을 수거해 제출하면 보상금을 지급하는 주민 참여형 정비 사업이다. 참여 대상은 18세 이상 서대문구민으로, 참여 희망자는 오는 17일 오후 6시까지 주소지 관할 동주민센터를 방문해 신청해야 한다. 신청 시 구청 홈페이지..",2026.03.12 18:34,https://www.fnnews.com/news/202603121834187929,파이낸셜뉴스
"중구, 주유소 가격표시제 전수점검",,"서울 중구는 최근 중동 지역 정세 불안과 긴장 고조로 국내 석유제품 가격 상승 우려가 커지는 상황에서 관내 주유소를 대상으로 가격표시 준수 여부를 전수 점검했다고 12일 밝혔다. 점검 결과 위반 사례는 한 건도 없었다. 중구는 지난 6일부터 10일까지 서울시와 합동점검반을 꾸려 관내 주요 주유소 10개소를 방문해 점검을 실시했다. 점검반은 주유기, 주유소 외부..",2026.03.12 18:34,https://www.fnnews.com/news/202603121834154176,파이낸셜뉴스
다자녀 세제혜택·밤샘돌봄… 서울 출산율 끌어올린 자치구들,,지난 2023년 역대 최저치를 기록하며 위기감이 극에 달했던 서울 출생아 수가 지난해부터 반등을 시작했다. 전국 시·도 가운데 최저 수준에 머물던 서울의 합계출산율도 0.6명대로 재진입하며 'V자 반등'의 기대감을 키우고 있다. 올해 '탄생응원 서울' 프로젝트의 '시즌2'를 추진하는 서울시와 함께 25개 기초자치구도 반등 지속을 위한 정책에 힘을 싣는 중이..,2026.03.12 18:34,https://www.fnnews.com/news/202603121834122713,파이낸셜뉴스
중동전쟁 16조7천억원 쓴 美… 6개월 가면 384조원 더 든다,,"미국이 이란 전쟁에 천문학적인 비용을 쏟아부으면서 한계에 온 자국의 재정 적자를 벼랑 끝으로 내몰고 있다. 11일(현지시간) AP, 뉴욕타임스(NYT) 등에 따르면 미국은 이란과의 전쟁 첫 6일 동안 최소 113억달러(약 16조7700억원) 이상의 비용을 썼다. 미국 국방부가 이번 주 초 의회 브리핑에서 밝힌 최소한의 추정치이다. 일부 항목이 반영돼 있지 않아, 총 산정 비..",2026.03.12 18:34,https://www.fnnews.com/news/202603121834102330,파이낸셜뉴스
"SC그룹 ""전략시장 한국에 투자"" 강력 의지",,SC제일은행의 모기업 스탠다드차타드(SC)그룹의 고위 경영진이 SC제일은행 본사를 찾아 글로벌 타운홀을 열었다. 12일 SC제일은행에 따르면 SC그룹 경영진 회의는 지난 10일부터 사흘 동안 진행됐다. 빌 윈터스 회장을 포함한 SC그룹 경영진은 전 세계에 진출해 있는 주요 시장을 순회하면서 경영진 회의를 정기적으로 개최하고 현지 고객 및 임직원들과 소통하고 있다...,2026.03.12 18:34,https://www.fnnews.com/news/202603121834065078,파이낸셜뉴스
롯데카드 정상호 대표이사 선임,,"롯데카드가 정상호 대표이사(사진)를 공식 선임했다. 롯데카드는 12일 임시 주주총회와 이사회를 통해 정 대표이사를 공식 선임했다고 밝혔다. 임기는 오는 2028년 3월 29일까지다. 신임 정 대표는 부산 해동고와 고려대학교 경영학과를 졸업했다. 이후 LG카드 마케팅 팀장, 현대카드 SME사업실장, 삼성카드 전략영업본부장 등을 거치며 카드업계에서 30년 가까이 경력..",2026.03.12 18:34,https://www.fnnews.com/news/202603121834044338,파이낸셜뉴스
"우리銀, 금융소비자보호 내재화 앞당긴다",,우리은행은 금융소비자 보호를 경영의 핵심 가치로 확립하기 위해 이사회 내에 '금융소비자보호위원회'를 신설한다고 12일 밝혔다. 금융감독원이 지난해 9월 발표한 '금융소비자보호 거버넌스 모범관행'을 선제적으로 이행하는 것이다. 우리은행은 소비자보호를 규제 준수 이상으로 경영 전반에 내재화하기 위해서라고 설명했다. 우리은행은 오는 20일 이사회 안에 전문..,2026.03.12 18:34,https://www.fnnews.com/news/202603121834015503,파이낸셜뉴스
변동장에 머니무브 가속… 은행 대기자금 6兆 이탈,,최근 중동 정세 긴장으로 증시 변동성이 확대되면서 은행권 자금 흐름에 변화가 감지되고 있다. 주가 급락을 매수 기회로 판단한 개인 투자자들이 은행에 머물던 대기자금을 증시로 이동시키는 이른바 '머니무브'가 나타나는 모습이다. 12일 금융권에 따르면 5대 은행(KB국민·신한·하나·우리·NH농협)의 요구불예금 잔액은 지난 10일 기준 678..,2026.03.12 18:34,https://www.fnnews.com/news/202603121834008424,파이낸셜뉴스
