title,thumbnail,short_content,write_time,link,company
"부경대·울산대, 해양수산·조선분야 혁신 ‘맞손’",,"국립부경대학교와 울산대학교가 지난 15일 오전 국립부경대 대학본부 접견실에서 '초광역 협력 강화를 위한 협약'을 체결했다. 두 대학은 이번 협약을 통해 해양수도 부산과 해양산업도시 울산을 연결하는 동남권 협력체계를 구축하고, 해양수산, 조선 및 에너지 분야의 혁신과 발전을 위한 공동 대응에 나선다. 이번 협약은 동남권 지역의 해양·조선·에…",2026.05.17 19:17,https://www.fnnews.com/news/202605171917355400,파이낸셜뉴스
"한국해양대, 동삼혁신지구 해양클러스터 간담회 개최",,"국립한국해양대학교는 지난 14일 교내 어울림관 아치홀에서 '동삼혁신지구 해양클러스터 기관장 협의회' 간담회를 개최했다고 17일 밝혔다. 동삼혁신지구 해양클러스터는 공공기관과 대학, 연구소 등 풍부한 사업화 연계 기술개발(R＆BD) 역량이 한데 모여 있는 해양수산 거점이다. 현재 17개 기관이 함께하고 있다. 이번 간담회는 동삼혁신지구 내 해양 관련 기관 간 …",2026.05.17 19:17,https://www.fnnews.com/news/202605171917335412,파이낸셜뉴스
"부산시, 'LIV 골프대회' 유관기관과 최종점검",,부산시는 지난 15일 시청 영상회의실에서 오는 28~31일 부산 아시아드컨트리클럽에서 치러지는 세계적인 골프대회 '리브 골프 코리아(LIV Golf Korea) 2026' 성공 개최를 위한 유관기관 합동 점검회의를 가졌다고 17일 밝혔다. 이번 골프대회 기간에는 세계 최정상급 선수 57명이 참가하고 약 6만명 규모 갤러리 운집이 예상된다. 이에 따라 시민불편을 최소화하고 안전…,2026.05.17 19:16,https://www.fnnews.com/news/202605171916441326,파이낸셜뉴스
"""전쟁 장기화로… 올해 美 해상운송 물동량 성수기 사라질 듯""",,"미국·이란 전쟁 장기화 흐름에 따라 미국의 해상 운송시장에서 성수기 실종 우려가 나오고 있다. 수요 둔화 전망에도 선사들은 아시아발 미국 항로 선복 공급 확대 기조를 유지하고 있는 것으로 나타났으나, 물동량 회복 여부는 불확실한 상황으로 전해진다. 한국해양수산개발원(KMI) 국제물류투자분석·지원센터는 이 같은 내용을 담은 'KMI 국제물류 위클…",2026.05.17 19:16,https://www.fnnews.com/news/202605171916434893,파이낸셜뉴스
"BPA, 삼성SDS AI인프라 벤치마킹",,"부산항을 관리 운영하는 부산항만공사(BPA)는 최근 부산항 AI 데이터센터 등 핵심시설 구축 기획 연구에 활용하기 위해 삼성SDS 춘천 데이터센터를 방문, 선진 AI 인프라 운영 현황을 벤치마킹했다고 17일 밝혔다. 이번 방문은 정부와 공공기관을 중심으로 AI 기반 데이터 인프라 구축 수요가 확대, 부산항의 AI 핵심 인프라 조성 방향을 모색하기 위해 마련했다. BPA는 …",2026.05.17 19:16,https://www.fnnews.com/news/202605171916420461,파이낸셜뉴스
몽골에 '부산형 웰니스 의료관광' 알린다,,"부산경제진흥원(원장 송복철)은 지난 14일부터 15일까지 이틀간 부산 선도협력 의료기관과 웰니스 관광지 일대에서 '부산의료관광 공동 상품개발을 위한 팸투어'를 개최했다고 17일 밝혔다. 이번 행사는 몽골 현지 관광객 대상의 의료관광 마케팅 강화와 더불어 최근 증가세인 개별관광 수요에 대응하기 위한 항공, 의료서비스, 웰니스 관광이 결합된 '부산형 의료관광 …",2026.05.17 19:16,https://www.fnnews.com/news/202605171916396021,파이낸셜뉴스
"닻올린 부산경자청 투자유치委 ""전략 보다 실행에 중점""",,"부산진해경제자유구역청은 최근 아스티호텔 부산에서 자문위원 위촉과 첫 대면 회의를 열고 제11기 투자유치자문위원회를 출범했다고 17일 밝혔다. 제11기 자문위원회는 물류·운송, 스마트 수송기기, 바이오·헬스케어, 금융·법률 등 각 산업 분야를 대표하는 기업대표와 대학교수, 현장 전문가 등 24명으로 구성됐다. 10기 대비 현업 경영진과 글…",2026.05.17 19:16,https://www.fnnews.com/news/202605171916360279,파이낸셜뉴스
이달 그랑 콜레오스·필랑트 사면 3년 잔가 최대 69% 보장,,"르노코리아가 5월 한 달간 그랑 콜레오스와 필랑트 구매 고객을 대상으로 업계 최고 수준의 잔가보장율 혜택과 다양한 할부 프로모션을 제공한다고 17일 밝혔다. 르노코리아는 그랑 콜레오스와 필랑트 구매 고객에게 3년 기준 67% 잔가보장율을 제공한다. 연간 주행거리 1만5000㎞ 기준이며, 차량 반납과 르노코리아 신차 재구매 조건이 적용된다. 르노코리아 금융관계…",2026.05.17 19:15,https://www.fnnews.com/news/202605171915126170,파이낸셜뉴스
"""월세도 카드결제… 집업페이로 '100점짜리 집'에서 사세요""[희망 2026 부산, 청년이 뛴다]",,"""한때 가진 돈이 부족해 반지하에서 살았던 적이 있어요. 그런데 하루는 강도를 당했어요. 그 외 집과 관련한 여러 어려움이 겹치면서, 저와 유사한 환경에 처한 이들은 '100점짜리 집에서 살았으면 좋겠다'는 생각이 들었어요. 월세 카드결제 서비스 창업을 시작한 이유입니다."" 17일 오후 부산 동구 부산역 내 유라시아플랫폼에서 만난 ㈜데브디 김기태 대…",2026.05.17 19:15,https://www.fnnews.com/news/202605171915082612,파이낸셜뉴스
"부산, 글로벌 함정정비 거점도시 도약한다",,부산시는 방위사업청 주관 '방산혁신클러스터 함정 MRO 사업' 공모에 최종 선정됐다고 17일 밝혔다. 이는 지난달 산업통상부 '중소조선 함정 MRO 글로벌 경쟁력 강화 지원사업' 공모 선정에 이은 성과다. 이로써 부산은 산업부 사업 '기업지원 및 인력양성' 트랙과 방사청 '기반구축 및 기술개발(R&D)' 트랙을 상호 연계·보완하는 함정 MRO 성장축을 완성하게 …,2026.05.17 19:13,https://www.fnnews.com/news/202605171913227869,파이낸셜뉴스
"[사설] 삼전 성과급 갈등, 통큰 양보와 타결로 파국 막길",,"삼성전자 창사 이래 최대 규모의 총파업이 임박하면서 긴장감이 고조되고 있다. 김민석 국무총리는 17일 대국민담화에 나서 ""긴급조정을 포함한 가능한 모든 수단을 강구하겠다""고 경고했다. 이에 앞서 이재용 삼성전자 회장은 해외 출장을 급거 중단하고 귀국하며 ""우리는 한 몸 한 가족""이라고 호소했다. 18일 열리는 2차 사후조정에서 노사 간 …",2026.05.17 19:13,https://www.fnnews.com/news/202605171913006261,파이낸셜뉴스
"[사설] 늘어나는 반도체 이익, 미래 투자에 써야 성장 지속",,"삼성전자를 비롯한 한국 반도체 기업들의 올해 순이익이 급증할 것으로 보인다. 성과급 분쟁 중인 삼성전자만 따로 보면 올해 300조원이 넘고, 2028년에는 500조원에 이를 것이라는 분석이 나오고 있다. 그러나 이익이 많이 나는 만큼 글로벌 반도체 기업들의 투자액도 그만큼 늘고 있다. 글로벌 경쟁에서 이기려면 다른 기업보다 더 큰 규모의 투자를 해야 한다. 삼성…",2026.05.17 19:13,https://www.fnnews.com/news/202605171912572651,파이낸셜뉴스
"[기자수첩] 웃는 지수, 우는 종목",,코스피만 보면 뜨거운 상승장이다. 하지만 개인투자자들이 같은 랠리를 경험하고 있는지는 별개의 문제다. 지수는 웃고 있지만 종목별로는 웃는 쪽과 우는 쪽이 갈리는 'K자형 랠리'의 그늘이 짙어지고 있다. 17일 한국거래소에 따르면 지난 15일 기준 이달 코스피 일평균 거래대금은 52조8077억원으로 지난달 29조5507억원 대비 78.7% 증가했다. 반면 일평균 거래량은 …,2026.05.17 19:12,https://www.fnnews.com/news/202605171912545469,파이낸셜뉴스
[강남視角] 부동산 시장의 학습효과,,예고됐던 대로 양도소득세 중과가 시작됐다. 연초부터 대통령까지 나서서 5월 10일 이후에는 감면혜택이 중단될 것이라고 얘기했으니 정부도 시장도 대응을 할 만큼은 한 것 같다. 다만 양도세 중과 이후 부동산 시장의 전망에 대해 양측의 견해는 여전히 간극이 크다. 정부는 주택시장이 안정될 것이라고 자신하지만 오히려 시장에서는 불안정해질 것이라고 입을 모은…,2026.05.17 19:12,https://www.fnnews.com/news/202605171912516340,파이낸셜뉴스
"[포럼] 日 입시, 韓 수험생 사진 有感",,"최근 들어 일본 유학을 희망하는 학생이 늘고 있다. 고환율로 인한 경제적 부담과 미국 트럼프 정권 이후 불안정해진 진로 및 비자 환경 등의 영향으로 영어권 유학 수요가 위축된 점도 배경으로 작용한 듯하다. 올해 초 유학생 입시가 있었다. 한국 수험생들의 면접을 마치고 온 동료들이 이구동성으로 이야기를 꺼냈다. ""지원서 사진과 실물을 몇 번씩 번갈아 확…",2026.05.17 19:09,https://www.fnnews.com/news/202605171909077751,파이낸셜뉴스
[fn광장] 美가 패권 잃은 '종이호랑이'로 보이나,,1992년 1월 부시 대통령이 일본 방문 중 미야자와 총리와의 공식 만찬석상에서 갑자기 구토하면서 졸도한다. 냉전을 통해 소련을 붕괴시키고 걸프전을 승리로 이끈 부시 대통령은 일본에서는 스타일을 구기고 만다. 세계 주요 언론은 쓰러지는 대통령의 모습을 '욱일승천하는 일본과 쓰러지는 미국'을 상징하는 사건으로 대서특필한다. 국력을 소진한 미국 대통령이 적…,2026.05.17 19:09,https://www.fnnews.com/news/202605171909045268,파이낸셜뉴스
"""이젠 AI로 수익화""…빅테크, 테스트베드 한국으로 몰린다[조윤주의 테크 시그널]",,"한국이 글로벌 생성형 AI 기업들의 필수 공략지로 떠올랐다. 메타가 최근 국내 시장에 '메타AI'를 공식 출시하면서, 오픈AI·앤스로픽·구글까지 글로벌 AI 빅테크들이 모두 한국 시장에 집결했다. 한국은 최근 글로벌 생성형AI 시장에서 서비스 수요가 가장 빠르게 팽창하는 국가 가운데 하나로 꼽힌다. 17일 마이크로소프트의 싱크탱크인 AI 이코노미 …",2026.05.17 19:04,https://www.fnnews.com/news/202605171903530899,파이낸셜뉴스
'21마일' 바닷길이 바꿔놓은 글로벌 에너지 지도[글로벌리포트],,"【파이낸셜뉴스 뉴욕=이병철 특파원】 2026년 2월 28일. 21마일(34㎞)이 세계를 멈췄다. 충격의 무게는 균등하게 배분되지 않았다. 미국과 이스라엘의 항공 공습이 이란을 강타하자 이란 혁명수비대가 전 세계가 두려워하던 카드를 역사상 처음으로 꺼내 들었다. 페르시아만과 오만만을 잇는 폭 21마일의 좁은 수로, 호르무즈 해협의 봉쇄였다. 머스크(Maersk), 하팍로이드(Hap…",2026.05.17 19:01,https://www.fnnews.com/news/202605171901139123,파이낸셜뉴스
"""미국산 원유로 대체"" 에너지 패권 노린 트럼프… 美소비자는 '고유가' 비명[글로벌리포트]",,【 뉴욕=이병철 특파원】 미국은 이란과의 전쟁으로 역설적이게 에너지 수출 강국으로서의 위상을 더욱 강화하고 있다. 중동발 에너지 공급망이 흔들리자 유럽과 아시아 국가들이 미국산 원유와 액화천연가스(LNG) 확보 경쟁에 나섰다. 다만 미국 내 휘발유 가격도 급등하면서 미국 소비자들 역시 에너지 충격에서 자유롭지 못한 상황이다. 지난 4월 말 미국 에너지정보청…,2026.05.17 19:01,https://www.fnnews.com/news/202605171901132746,파이낸셜뉴스
"강태영 농협은행장, 농촌 찾아 구슬땀",,"강태영 NH농협은행장이 강원 춘천시 동산면 구암마을에서 올해 첫 농촌 일손돕기에 나섰다. 17일 농협은행에 따르면 강 은행장과 강원테크노파크 임직원 60여명은 지난 15일 구암마을을 찾아 복숭아밭 꽃눈 솎기, 고추 지주대 설치 등 다양한 영농지원 작업을 실시했다. 강 은행장은 ""농업·농촌에 대한 지속적인 지원은 물론 지역 기반 혁신기업의 성장까지…",2026.05.17 18:59,https://www.fnnews.com/news/202605171859091977,파이낸셜뉴스
‘슈페리어 시상식’ 봉사나눔상에 유해근 목사,,"슈페리어재단이 고 한경직 목사의 선교·봉사 정신을 이어 국내외 현장에서 묵묵히 헌신해온 사역자들을 격려했다. 재단은 지난 15일 '제13회 슈페리어 대상 시상식'을 열고, 나섬공동체 대표 유해근 목사 등 7명에게 상을 수여했다. 이날 유 목사는 봉사나눔상, 류강석 목사와 최혜영 선교사는 교육공헌상, 김석종·천예아 목사는 선교실천상을 받았다. 또…",2026.05.17 18:59,https://www.fnnews.com/news/202605171859069347,파이낸셜뉴스
"""스테이블코인 4조弗 시대… 신생기업 투자해 亞시장 선점""1. [fn이사람]",,"카이아인베스트먼트파트너스(KIP)가 스테이블코인과 실물자산토큰화(RWA) 인프라에 특화된 벤처펀드를 정식 출범하고 아시아 금융시장 선점에 나선다. KIP는 이번 펀드를 통해 다음 달부터 스테이블코인 밸류체인 전반에 걸친 투자를 집행할 계획이다. 이윤호 KIP 대표(사진)는 17일 인터뷰에서 KIP 투자철학을 '자산'과 '인프라'의 결합으로 정의했다. 이 대표는 ""…",2026.05.17 18:59,https://www.fnnews.com/news/202605171859044819,파이낸셜뉴스
'친정' 잠재운 100억 방망이 강백호 연타석 3점포 '폭발',,"강백호(27·사진)가 친정팀의 심장부에서 가장 화려하고도 치명적인 비수를 꽂았다. 프로야구 한화 이글스의 '거포' 강백호가 자신이 가장 오래 머물렀던 수원 팬들 앞에서 연타석 3점 홈런을 쏘아 올리며 '100억 FA'의 압도적인 위용을 과시했다. 강백호는 지난 16일 수원 케이티위즈파크에서 열린 kt 위즈와의 방문 경기에서 1회와 6회, 두 차례나 우측 담장을 …",2026.05.17 18:56,https://www.fnnews.com/news/202605171856270687,파이낸셜뉴스
고지대 넘어 '8강' 간다… 첫 경기 체코전 '필승 각오',,"2026년 국제축구연맹(FIFA) 북중미 월드컵에 나설 26명의 태극전사 명단이 마침내 베일을 벗었다. 사상 첫 '원정 8강'이라는 위대한 도전을 향한 홍명보호의 험난하고도 가슴 뛰는 항해가 본격적인 닻을 올렸다. 홍명보 축구대표팀 감독은 지난 16일 서울 종로구 KT 온마당에서 북중미 월드컵에 출전할 최종 명단 26명을 발표했다. 홍 감독은 ""1차 목표는 32강에…",2026.05.17 18:56,https://www.fnnews.com/news/202605171856200960,파이낸셜뉴스
'미공개정보 주식거래' LG家 장녀 부부 항소심 시작[이주의 재판 일정],,이번 주(18~22일) 법원에서는 미공개 정보를 이용해 주식을 취득한 혐의로 1심에서 무죄를 선고받은 고(故) 구본무 LG그룹 회장의 장녀 구연경 LG복지재단 대표 부부의 항소심 재판이 시작된다. 또 12·3 비상계엄과 관련해 재판에 넘겨진 조태용 전 국가정보원장과 김용현 전 국방부 장관 사건의 1심 선고도 잇따라 열린다. 17일 법조계에 따르면 서울고법 형사4-3…,2026.05.17 18:54,https://www.fnnews.com/news/202605171854395078,파이낸셜뉴스
경찰도 직장 내 괴롭힘…신고 10건 중 6건은 징계없이 넘어가,,"경찰 조직 내 접수되는 괴롭힘 신고 10건 중 6건은 별도 징계 없이 '불문종결' 처리된 것으로 나타났다. 관련 신고가 꾸준히 이어지고 있으나 불문종결 사유나 괴롭힘 유형 등에 대한 관리는 충분치 않은 상태다. 전문가들은 위계질서가 뚜렷한 조직 특성상 종결 처리가 '피해 없음'을 의미하지 않는다며, 보다 체계적인 관리 장치를 마련해야 한다고 조언했다. 17일 파이낸셜…",2026.05.17 18:54,https://www.fnnews.com/news/202605171854369022,파이낸셜뉴스
"성탄 선물이 된 전세사기범 구속영장… ""보완수사는 피해자 억울함 지우는 과정""[서초동 溫터뷰]",,"경찰이 두 차례 구속영장을 청구했지만 모두 기각됐다. '도주·증거인멸 우려가 없다'는 법원의 판단 아래 사건이 묻히려던 찰나, 이를 넘겨받은 한 저연차 검사의 집요한 자금 추적이 수사를 뒤집었다. 주인공은 김동영 울산지검 검사(변호사시험 10회). 이 공로는 법무부 '보완수사 우수사례'로 선정되며 인정을 받았다. ■아무도 책임지지 않았던 사건'포항 전…",2026.05.17 18:54,https://www.fnnews.com/news/202605171854295302,파이낸셜뉴스
"""세계가 주목하는 경북… ESG 관광·마이스로 경쟁력 증명""",,"【 경주=김장욱 기자】""2025 아시아태평양경제협력체(APEC) 정상회의가 경북의 역량을 전 세계에 증명한 찬란한 금자탑이었다면, 2026 아시아·태평양 관광협회(PATA) 연차총회는 그 위상을 공고히 다지며 글로벌 관광 시장의 주도권을 완전히 확보한 결정적 계기였다. 이제 경북은 세계 관광의 변방이 아닌, 당당한 메인 무대의 주인공이다."" 김남일 …",2026.05.17 18:51,https://www.fnnews.com/news/202605171851493998,파이낸셜뉴스
"행안부, 2030 청년자문단 활동 시작",,행정안전부가 청년 관점에서 정부 정책을 점검하는 2030청년자문단 4기 활동에 들어갔다. 17일 행정안전부에 따르면 지난 15일 충북 진천 '청년마을 �껼天�지 진천'에서 제4기 2030청년자문단 발대식을 열었다. 2030청년자문단은 행안부 정책 전반에 청년 세대 의견을 반영하기 위해 2023년부터 운영해 온 정책 자문기구다. spring@fnnews.com 이보미 기자,2026.05.17 18:51,https://www.fnnews.com/news/202605171851146858,파이낸셜뉴스
"[르포] ""아이들 교육에 제격""… 인근 직장인은 ‘세금낭비’ 지적",,"서울 광화문 광장에 '감사의 정원'이 17년 만의 새 상징 공간으로 지난 12일 문을 열었다. 개장 직후부터 기존 광장의 의미·경관과 어긋난다는 비판이 정쟁으로 번지며 서울시장 선거 후보 간 존속 공방으로 커졌다. 정작 지난 16일 찾은 현장은 가열된 정치 공방과 달리 비교적 한산했고, 시민 반응도 찬반으로 갈렸다. 지난 16일 오후 4시께 지하 공간 '프리…",2026.05.17 18:51,https://www.fnnews.com/news/202605171851017997,파이낸셜뉴스
"[기고] 능력 중심 공직사회, 대한민국을 바꾼다",,"중소벤처기업부 차상훈 사무관은 중소기업 현장의 고질적 문제였던 기술 탈취 피해를 '한국형 증거개시 제도', 이른바 K-디스커버리 도입을 통해 제도적으로 풀어냈다. 그는 지난 4월 중소벤처기업부 최대 규모인 1000만원의 특별성과 포상금을 받았다. 최근 정부가 추진하고 있는 '특별성과 포상금제'는 바로 이러한 사례에서 그 의미를 찾을 수 있다. 이 제도는 몇몇 …",2026.05.17 18:51,https://www.fnnews.com/news/202605171850595859,파이낸셜뉴스
단일화·고소전에 시끌… 후보 8명 난립 속 ‘교육비전 실종’[6.3 지방선거 D-16],,"서울시교육감 선거를 앞두고 보수와 진보 모두 단일화에 실패했다. 패배를 인정했던 후보는 하루 만에 입장을 뒤집었고, 단일화 경선은 고소전으로 번졌다. 전국 최다인 8명의 후보가 서울시교육감 선거에 출사표를 던졌지만, 정작 서울 교육의 미래를 둘러싼 정책 경쟁은 좀처럼 보이지 않는다는 지적이 나온다. 17일 중앙선거관리위원회에 따르면 서울시교육감 선거에…",2026.05.17 18:51,https://www.fnnews.com/news/202605171850563668,파이낸셜뉴스
서울 공공주도 도심복합사업 공모 44곳 접수,,서울 '도심 공공주택 복합사업' 공모에 강남3구(강남·서초·송파)를 비롯해 총 44곳이 참여했다. 도심복합사업은 공공이 사업을 주도해 사업성을 보완하고 조합 설립과 관리처분계획 등 절차를 줄여 신속하게 주택을 공급하는 방식이다. 국토교통부는 지난 8일 마감된 서울 대상 도심 공공주택 복합사업 후보지 공모 결과 총 44곳에서 약 6만가구 규모의 주…,2026.05.17 11:00,https://www.fnnews.com/news/202605171847407764,파이낸셜뉴스
"생숙, 오피스텔로 용도변경 산 넘어 산… 대출 막혀 '텅텅'",,"#. 수도권의 A생활형숙박시설은 오피스텔로 용도변경 절차를 진행 중인지만 사람이 살지 않은 유령 건물이다. 금융기관들이 여전히 위험자산으로 간주해 잔금대출을 내주지 않으면서 텅텅 빈 건물로 남아있는 것. 한 관계자는 ""계약자가 잔금을 내야 전월세를 주든지 하는데 아예 입주가 안 되고 있다""며 ""정부가 비 아파트 공급을 늘리겠다고 하는데 (…",2026.05.17 18:47,https://www.fnnews.com/news/202605171847340709,파이낸셜뉴스
"""하루 90분 단축"" 포스코이앤씨 AI로 사내 업무 혁신",,포스코이앤씨가 '전사 인공지능(AI) 챌린지' 경진대회에서 하루 평균 90분 이상 소요되던 반복 업무를 획기적으로 줄이는 혁신 모델을 발굴했다. 17일 포스코이앤씨에 따르면 이번 경진대회는 미래지향적이고 창의적인 업무혁신 전략의 일환으로 기획됐다. 정부가 추진 중인 'AI 3대 강국 도약' 정책 기조와도 궤를 같이하며 포스코그룹이 추진 중인 인공지능 전환(AX) …,2026.05.17 18:47,https://www.fnnews.com/news/202605171847274123,파이낸셜뉴스
"""9월 통합 KTX 출범… 좌석공급 2배로 확대""",,"""통합 고속철도의 이름은 KTX로 정했다. 9월 이후에는 중련운행을 통해 좌석공급이 크게 늘어날 것이다."" 김태승 한국철도공사(코레일) 사장(사진)은 지난 14일 전라남도 광주시 호남철도차량정비단 인근에서 기자간담회를 열고 ""걱정보다 굉장히 순조롭게 되고 있다""면서 ""9월이면 조직과 운행, 앱까지 통합된 완벽한 통합체제를 볼 수 있을 …",2026.05.17 12:00,https://www.fnnews.com/news/202605171847258712,파이낸셜뉴스
고물가에 ‘가성비 한끼’ 된 버거… 치킨업계도 참전,,"고물가 여파로 소비자들의 외식 소비심리가 상대적으로 저렴한 햄버거 시장으로 이동하고 있다. 특히, 배달 수수료 부담과 이중 가격제 등으로 성장이 정체된 주요 치킨업체들이 앞다퉈 버거 사업을 확대하며 돌파구 마련에 나섰다. 17일 금융감독원 전자공시시스템에 따르면 지난해 국내 주요 햄버거 업체 5곳(한국맥도날드, 롯데리아, 버거킹, 맘스터치, KFC코리아)…",2026.05.17 18:44,https://www.fnnews.com/news/202605171844056595,파이낸셜뉴스
"베트남선 떡볶이 먹으러 이마트로… 하루 1300접시 팔린다[K푸드, 글로벌 푸드로]",,이마트가 동남아와 몽골을 중심으로 'K푸드 플랫폼' 역할을 강화하고 있다. 과거 라면·김치·과자 등 완제품 중심이던 K푸드 소비가 최근에는 떡볶이·김밥·분식·델리 등 한국의 일상 식문화 전반으로 확대되면서 이마트가 식품 수출사업을 조용히 확대하고 있는 것이다. ■노브랜드 앞세워 700억 수출17일 업계에 따르면 이마트는 최…,2026.05.17 18:44,https://www.fnnews.com/news/202605171844015945,파이낸셜뉴스
"직구로 산 3만9천원 원피스, 반품비가 2만7천원?[소비의 정석]",,"#. ""사진에서는 분명 벨벳 소재 같았는데 받아보니 완전히 다른 재질이네요."" 20대 직장인 A씨는 최근 온라인 쇼핑몰에서 구매한 수입 여성 원피스를 받아보고 당황했다. 판매 페이지 사진에서는 벨벳 느낌의 소재처럼 보였지만 실제 배송된 제품은 니트 재질의 두툼한 옷감이었기 때문이다. A씨는 곧바로 판매자에게 반품과 환불을 요청했다. 하지만, 판매자는…",2026.05.17 09:00,https://www.fnnews.com/news/202605171844003475,파이낸셜뉴스
땀 나도 달라붙지 않고 쾌적… 여름철 기능성·냉감 의류 인기,,아웃도어 브랜드 네파가 여름철 불쾌 요소를 기능적으로 해결한 '2026 봄SS 여름 의류 컬렉션'을 선보였다. 17일 업계에 따르면 네파는 소비자들이 단순히 더위뿐만 아니라 고온·고습 환경에서도 쾌적함이 지속되는 '착용 경험'을 점점 중시한다는 점에 주목해 땀·습도·끈적임 등을 줄이는 상품을 기획했다. 냉감 의류 카테고리 확장도 시도하고 …,2026.05.17 18:44,https://www.fnnews.com/news/202605171843562493,파이낸셜뉴스
