title,thumbnail,short_content,write_time,link,company
30대女 진통제 복용했다가…시력 손실까지 [헬스톡],,"[파이낸셜뉴스] 생리통 완화를 위해 진통제를 복용했다가 심각한 약물 반응으로 혼수상태에 빠진 뒤, 10년 넘게 부작용에 시달리고 있는 브라질 여성의 안타까운 사연이 알려졌다. 지난 26일(현지시간) 외신 매체 니드투노우에 따르면, 브라질 파판두바에 거주하는 재클린 맥(32)은 지난 2011년 생리통을 완화하기 위해 이부프로펜 성분 약을 복용했다가 피부가 벗겨지는 ..",2025.08.28 06:20,https://www.fnnews.com/news/202508280604522129,파이낸셜뉴스
"엔비디아, 깜짝 실적 발표…주가는 약세",,[파이낸셜뉴스]  인공지능(AI) 대장주 엔비디아가 27일(현지시간) 예상대로 기대 이상의 호실적을 공개했다. 그러나 시간외 거래에서 주가는 3% 넘게 떨어졌다. 투자자들의 높아진 눈 높이를 충족하지 못했기 때문이다.엔비디아가 이날 장 마감 뒤 공개한 2026 회계연도 2분기 실적은 시장 전망을 웃돌았다.엔비디아는 5~7월 석 달 동안 467억4000만달러 매출을 기록했다...,2025.08.28 06:04,https://www.fnnews.com/news/202508280600091939,파이낸셜뉴스
"엔비디아, 시장 전망 상회…주당순이익 1.05달러 기록",,"【뉴욕=이병철특파원】엔비디아가 2분기(5월~7월) 시장 예상치를 웃도는 매출과 이익을 기록했으며, 이번 분기에도 매출 성장률이 50% 이상을 유지할 것이라고 전망했다.엔비디아는 27일(현지시간) 주당순이익 1.05달러, 매출 467억4000만 달러를 기록했다고 밝혔다. 순이익은 전년 동기 166억 달러에서 59% 증가한 264억2000만 달러로 늘었다.이는 시장조사업체 LSEG가 집계한..",2025.08.28 05:48,https://www.fnnews.com/news/202508280547354058,파이낸셜뉴스
"[국제유가] 급락 하루 만에 반등…인도 제재, 미 석유 재고 급감 영향",,[파이낸셜뉴스]  국제 유가가 27일(현지시간) 급락 하루 만에 반등했다.미국의 석유 재고가 예상보다 큰 폭으로 감소한 데다 미국이 러시아 석유 수입을 이유로 인도에 50% 관세를 물리기로 한 충격이 컸다.국제 유가 기준물인 브렌트유는 10월 인도분이 전장 대비 0.83달러(1.2%) 상승한 배럴당 68.05달러로 마감했다.미국 유가 기준물인 서부텍사스산원유(WTI) 역시 10..,2025.08.28 05:45,https://www.fnnews.com/news/202508280542283154,파이낸셜뉴스
"[뉴욕증시] 엔비디아 실적 발표 기다리며 일제히 상승…S&P500, 9일 만에 사상 최고 경신",,[파이낸셜뉴스]  뉴욕 증시가 27일(현지시간) 이틀 연속 상승했다. 시황을 폭넓게 반영하는 스탠더드앤드푸어스(S&P)500은 지난 14일 이후 9거래일 만에 사상 최고 기록을 새로 썼다.S&P500 시가총액의 약 8%를 차지하는 인공지능(AI) 대장주 엔비디아가 장 마감 뒤 분기 실적을 공개하기로 한 가운데 투자자들은 관망세 속에서도 매수에 나섰다.그러나 엔비디아..,2025.08.28 05:42,https://www.fnnews.com/news/202508280537514609,파이낸셜뉴스
5년간 교정기 꼈는데…'치아 8개에 구멍' 이유가,,[파이낸셜뉴스] 5년간 치아 교정 치료를 받아 온 중국의 한 20세 여성이 구강 위생 관리가 제대로 이뤄지지 않아 치아 8개에 구멍이 뚫린 사연이 알려졌다.26일(현지시간) VN익스프레스 등에 따르면 중국 랴오닝성에 사는 여성 왕씨(20)는 지난 2020년 8월 약 9000위안(약 175만원)을 들여 교정 치료를 시작했다.그러나 교정 3년 차부터 왕씨의 치아에 검은 반점이 나타났음에..,2025.08.28 05:37,https://www.fnnews.com/news/202508280531346004,파이낸셜뉴스
"가수 싸이, 향정신성의약품 대리 처방 혐의 피고발 입건",,[파이낸셜뉴스] 가수 싸이(본명 박재상·48)가 대면 진료 없이 향정신성 의약품을 처방받은 혐의로 경찰에 고발됐다.27일 경찰 등에 따르면 서울 서대문경찰서는 싸이와 그에게 의약품을 처방한 대학병원 교수 A 씨가 의료법 위반 혐의로 고발돼 사실 확인 중인 것으로 전해졌다.싸이는 최근까지 대면 진료를 받지 않은 채 서울의 한 종합병원에서 향정신성 의약품..,2025.08.28 05:30,https://www.fnnews.com/news/202508280519282386,파이낸셜뉴스
"""최소 20명의 연예인 조사 받아""…대만에서 무슨 일이",,"[파이낸셜뉴스] 대만 정부가 자국 연예인들에게 중국의 선전 활동에 동조하지 말라고 경고했다. 26일(현지시간) 홍콩 사우스차이나모닝포스트(SCMP)에 따르면 대만의 중국 본토 담당 기구인 대륙위원회는 9월3일 중국 베이징 톈안먼 광장에서 열리는 제2차 세계대전 일본 패전 80주년 기념 전승절 열병식을 앞두고 ""중국 본토에서 활동하는 대만 연예인들은 양..",2025.08.28 05:17,https://www.fnnews.com/news/202508280510200519,파이낸셜뉴스
"[속보][뉴욕증시] S&P500, 사상 최고 경신",,[파이낸셜뉴스]  dympna@fnnews.com 송경재 기자,2025.08.28 05:03,https://www.fnnews.com/news/202508280502485695,파이낸셜뉴스
"[속보][뉴욕증시] 3대 지수 일제히 상승…엔비디아, 0.14% 하락",,[파이낸셜뉴스]  dympna@fnnews.com 송경재 기자,2025.08.28 05:01,https://www.fnnews.com/news/202508280501233112,파이낸셜뉴스
베선트 “인텔처럼 조선소 지분 확보도 가능”,,[파이낸셜뉴스]  스콧 베선트 미국 재무장관이 27일(현지시간) 미 정부가 조선소 지분도 확보할 수 있다고 밝혔다.베선트 장관은 이날 폭스비즈니스와 인터뷰에서 인텔 사례를 거론하며 이같이 말했다.그는 111억달러를 지원하고 인텔 지분 10%를 받기로 한 것처럼 미 정부가 엔비디아 같은 다른 반도체 업체에 투자하고 지분을 확보할 계획이 있느냐는 질문에 엔비디아는..,2025.08.28 04:48,https://www.fnnews.com/news/202508280444543124,파이낸셜뉴스
"트럼프, 미니애폴리스 총격 사건에 조기 게양 명령",,"[파이낸셜뉴스]  도널드 트럼프 미국 대통령이 27일(현지시간) 미 공공건물에 조기를 게양할 것을 지시했다. 미네소타주 미니애폴리스 학교 총격 사건 희생자들을 추모하기 위한 것이다.이날 오전 8시 30분께 미니애폴리스의 한 가톨릭 학교에서 미사 중 총격 사건이 일어나 2명이 사망하고, 17명이 부상을 입었다. 범인은 소총 등으로 무장해 성당 창문을 통해 성당 안에..",2025.08.28 04:07,https://www.fnnews.com/news/202508280404045334,파이낸셜뉴스
"트럼프 “소로스, 폭력시위 지원 혐의로 기소해야”",,"[파이낸셜뉴스]  도널드 트럼프 미국 대통령이 헤지펀드의 대부이자 민주당 고액 기부자인 조지 소로스를 기소해야 한다고 27일(현지시간) 주장했다.소로스가 미 전역에서 일어나는 ‘폭력 시위’를 후원하고 있다면서 그를 갈취와 부패 조직에 영향력을 행사하는 법률인 리코(RICO)법 위반 혐의로 기소해야 한다는 것이다.소로스를 비롯한 민주당 후원가, 활동가들에게 ..",2025.08.28 03:27,https://www.fnnews.com/news/202508280324042659,파이낸셜뉴스
워싱턴 유니언역 연방 관리로 전환…노숙·범죄 해결 명분,,"【뉴욕=이병철특파원】미국 교통부가 워싱턴DC의 대표 철도 관문인 유니언역(Union Station) 의 관리 권한을 환수한다. 워싱턴DC의 경찰 장악·주방위군 배치에 이어 연방정부의 개입을 확대하고 있다.션 더피 교통장관은 27일(현지시간) ""우리가 역을 더 잘 관리할 수 있다""며 ""시설 정비와 함께 노숙 문제를 해결하기 위해 투자를 단행할 것""이라..",2025.08.28 02:48,https://www.fnnews.com/news/202508280246574252,파이낸셜뉴스
"“중, AI 반도체 생산 3배 확대한다” FT",,[파이낸셜뉴스]   중국 반도체 업체들이 내년에는 인공지능(AI) 반도체 생산량을 지금의 3배로 확대하려 하고 있다고 파이낸셜타임스(FT)가 27일(현지시간) 보도했다.AI 반도체에 필수적인 HBM(고대역폭 메모리) 반도체도 현재 개발을 끝내고 시험 중이다. 내년 출시가 목표다.이는 미국과 AI 경쟁에서 우위를 차지하기 위한 승부수다.미국은 중국을 견제하기 위해 엔비디..,2025.08.28 02:32,https://www.fnnews.com/news/202508280228123714,파이낸셜뉴스
"李대통령, 美·日 3박6일 순방 마치고 귀국...후속조치 점검 잔망",,[파이낸셜뉴스] 이재명 대통령은 28일 새벽 3박 6일간의 미국·일본 순방 일정을 마치고 서울공항을 통해 귀국했다.이 대통령은 순방 기간 취임 후 첫 한미 정상회담을 통해 한미동맹을 확인하고 도널드 트럼프 대통령과 신뢰 관계 구축의 첫 단추를 끼웠다.이 대통령은 방미에 앞서 지난 23일 일본에서 이시바 시게루 일본 총리와 회담했다. 한일관계를 발전시켜 한미일..,2025.08.28 02:21,https://www.fnnews.com/news/202508280218181728,파이낸셜뉴스
미네소타 가톨릭학교 총격…어린이 2명 사망·17명 부상,,"【뉴욕=이병철특파원】 미국 미네소타주 미니애폴리스의 한 가톨릭학교에서 총격 사건이 발생해 어린이 2명이 숨지고 17명이 부상당했다.브라이언 오하라 미니애폴리스 경찰국장은 27일(현지시간) 가톨릭학교(Annunciation Catholic School)와 연결된 성당에서 8세, 10세 어린이 2명이 사망했다고 밝혔다. 부상자 17명 중 14명이 어린이였으며 이 가운데 2명은 위중한 상..",2025.08.28 02:08,https://www.fnnews.com/news/202508280206241592,파이낸셜뉴스
"美 재무부, 北 해외 IT 사기 연루 러시아·중국 인사·기업 제재",,"【뉴욕=이병철특파원】미국 재무부 해외자산통제국(OFAC)이 북한 정권의 해외 IT 인력 사기 활동에 연루된 러시아와 북한 인사·기업을 추가 제재했다. 이번 조치는 지난 7월 8일과 24일에 이어진 연속 제재의 연장선으로, 가상자산을 이용한 제재 회피까지 차단하려는 조치다.미국 재무부는 27일(현지시간) 러시아 국적자 비탈리이 안드레예프, 러시아 주재 북한 무역관..",2025.08.27 23:55,https://www.fnnews.com/news/202508272352167916,파이낸셜뉴스
대한항공 승무원 단체 지각..세부 공항서 90분 기다린 승객들 '분통',,[파이낸셜뉴스] 필리핀 세부에서 인천으로 향하는 대한항공이 예정보다 1시간 30분 넘게 지연 출발한 이유가 승무원들의 단체 지각 때문인 것으로 드러나 승객들의 불만이 폭발했다.27일 뉴스1에 따르면 대한항공 KE616편은 필리핀 현지 시각으로 지난 16일 오전 1시 막탄세부공항에서 출발할 예정이었으나 당일 오전 2시 30분이 지나서야 이륙했다.항공사측은 지연 사유를 '연..,2025.08.28 05:55,https://www.fnnews.com/news/202508272332461385,파이낸셜뉴스
"'대학생 1500명, 무박 2일로 모였다' 멋쟁이사자처럼 해커톤 개최",,[파이낸셜뉴스] '멋쟁이사자처럼 13기 중앙 해커톤'에 전국 54개 대학 약 1500여명의 학생들이 참가해 약 250개의 AI(인공지능) 프로덕트를 개발하는 성과를 거뒀다.27일 업계에 따르면 지난 25일부터 무박 2일로 서울시 서초구 양재 aT센터에서 진행된 이번 해커톤은 'AI로 다시 뛰는 우리 동네: 지역 경제와 삶을 AI로 연결할 것'이라는 주제로 진행됐다.해당 행사는 AI 및 ..,2025.08.27 23:34,https://www.fnnews.com/news/202508272332101290,파이낸셜뉴스
"다우 상승·나스닥 하락 출발…월가, 엔비디아 실적 촉각",,"【뉴욕=이병철특파원】뉴욕증시는 27일(현지시간) 혼조세로 출발했다. 투자자들이 장 마감 후 발표될 엔비디아 실적에 주목하면서 나스닥은 하락한 반면 다우지수는 상승했다.기술주 중심의 나스닥 종합지수는 엔비디아 주가가 약 1% 하락하면서 0.2% 내렸다. 반면 다우존스산업평균지수는 91포인트(0.2%) 올랐고, S&P500 지수는 보합권에 머물렀다. 팩트셋에 따르면 엔비..",2025.08.27 23:26,https://www.fnnews.com/news/202508272324411567,파이낸셜뉴스
우크라이나 전시 출국 금지 일부 해제…청년층 대상,,"【뉴욕=이병철특파원】  우크라이나 정부가 러시아와의 전쟁 이후 유지해 온 남성 출국 제한을 완화했다. 편법으로 해외에 나가려는 젊은 층이 늘어나자 이를 합법화함으로써 전시 병력 확보와 사회 불만 사이에서 균형을 찾으려는 시도다.27일(현지시간) 파이낸셜타임스(FT)에 따르면, 우크라이나 정부는 18~22세 청년 남성의 해외 이동을 허용하기로 했다. 이번 조치는 ..",2025.08.27 22:51,https://www.fnnews.com/news/202508272249191602,파이낸셜뉴스
"추미애 ""지귀연, 명백한 형사처벌 대상…대법원, 신속히 인사조치 해야""",,"[파이낸셜뉴스]  국회 법제사법위원장인 추미애 더불어민주당 의원이 윤석열 전 대통령의 내란 혐의 사건 재판장인 지귀연 서울중앙지법 부장판사에 대한  대법원의 신속히 인사조치를 촉구했다. 27일 추 의원은 자신의 페이스북을 통해 '지귀연에 대한 인사조치 지연 개탄'이라는 제목의 글을 올렸다.그는 ""윤석열을 풀어준 지귀연의 룸살롱 접대 의혹이 ..",2025.08.28 05:35,https://www.fnnews.com/news/202508272212079963,파이낸셜뉴스
"화웨이, 새 트라이폴드폰 ‘메이트 XTs’ 선공개.. 내달 출시 [1일IT템]",,전 세계 최초로 두 번 접히는 일명 트라이폴드폰을 선보인 화웨이가 차기작 ‘메이트 XTs’ 티저 영상을 공개하고 다음달 제품을 정식 발표한다. 28일 정보기술(IT) 업계에 따르면 화웨이는 전날 자사 웨이보 등을 통해 내달 4일 현지시간 오후 2시 30분(한국시간 오후 3시 30분) 메이트 XTs 출시 행사를 개최한다고 밝혔다. 이와 함께 공개한 티저 영상에는 위청둥 ..,2025.08.28 06:00,https://www.fnnews.com/news/202508272158387342,파이낸셜뉴스
유명 가수 '약물 대리처방' 의혹…경찰 수사 착수,,[파이낸셜뉴스] 유명 가수 A씨가 약물 대리처방 혐의로 경찰 수사를 받고 있는 것으로 파악됐다. 서울 서대문경찰서는 A씨에 대한 고발장을 접수하고 의료법 위반 혐의 여부를 조사하고 27일 밝혔다.고발장에는 A씨가 다른 사람의 명의로 향정신성의약품을 처방받았다는 내용이 담긴 것으로 알려졌다.경찰은 고발 내용을 토대로 사실관계를 확인하고 구체적인 경위를 조사할 방..,2025.08.27 21:54,https://www.fnnews.com/news/202508272146031339,파이낸셜뉴스
"이진숙 ""민주당 작업에 '빵진숙' 됐다…직원들 위해 과자류 구입""",,"[파이낸셜뉴스]  이진숙 방송통신위원장이 과거 대전MBC 사장 사퇴 직전 법인카드로 빵 100만원어치를 구매했다는 의혹에 대해 해명하고 나섰다.27일 이 위원장은 자신의 페이스북에 ""빵에 관하여""라는 제목의 글을 올렸다.이 위원장은 ""어제 과학기술정보방송통신위원회에서 민주당의 한 의원이 KBS 박장범 사장에게 '지난번 과방위 회의 때는 이진..",2025.08.28 05:50,https://www.fnnews.com/news/202508272120594719,파이낸셜뉴스
"""부끄러운데 웃긴다""..윌 스미스, 올린 투어영상 '가짜 팬' 논란",,"[파이낸셜뉴스] 할리우드 배우 윌 스미스가 투어현장을 올린 팬들의 환호영상이 'AI 합성'이라는 의혹을 받고 있다.27일 영국 데일리메일에 따르면 윌 스미스는 최근 앨범을 발매하고 지난 24일부터 스칼버러에서 영국 투어 공연을 시작했다.공연을 마친 뒤 그의 공식 유튜브 채널에는 ""무대에서 팬들과 가까이 호흡하는 게 가장 행복하다”는 메시지와 함께 영상이 공개..",2025.08.28 05:40,https://www.fnnews.com/news/202508272052222287,파이낸셜뉴스
"하남 남한고, 교육부 '자율형 공립고 2.0' 선정",,"【파이낸셜뉴스 하남=김경수 기자】 경기 하남시 남한고가 교육부 ‘자율형 공립고 2.0’ 공모에 최종 선정됐다.27일 하남시에 따르면 전국 25개 학교가 뽑힌 가운데 경기도에선 남한고 포함 10곳이 선정됐다.자율형 공립고 2.0은 지자체·대학·기업 등과 협력해 특색 있는 교육 모델을 운영하도록 지원하는 사업이다.선정된 학교는 무학년제, 조기 입..",2025.08.27 21:14,https://www.fnnews.com/news/202508272045528778,파이낸셜뉴스
"""약혼반지 어디 거야?""…스위프트 약혼반지 사진에 보석업체 주가 급등",,[파이낸셜뉴스]  세계적인 팝스타 테일러 스위프트(35)가 풋볼선수 트래비스 켈시(35)와의 약혼 소식을 알리며 약혼반지 사진을 공개한 가운데 보석업체 주가가 급등했다.26일(현지시간) 미국 경제 매체 CNBC는 이날 스위프트가 자신의 인스타그램을 통해 약혼 소식을 발표한 직후 보석업체 시그넷 주얼러스의 주가가 급등해 장중 3% 넘게 올랐다고 보도했다.앞서 스..,2025.08.28 05:10,https://www.fnnews.com/news/202508272041569829,파이낸셜뉴스
"""일부 오해 송구하다"" PBR 논란 구윤철, 코스피 5000 포기 안 했다",,"[파이낸셜뉴스] 구윤철 경제부총리 겸 기획재정부 장관이 27일 정부의 '초혁신 경제 프로젝트'를 통해 ""코스피가 5000선을 넘어설 수 있다""고 전망했다.구 부총리는 이날 유튜브 채널 '경제 읽어주는 남자(김광석TV)'와의 인터뷰에서 ""코스피 5000 목표를 포기했느냐""는 물음에 ""그렇지 않다""며 이같은 자신감을 드러냈다.최근 주가순자산비율(P..",2025.08.27 20:36,https://www.fnnews.com/news/202508272032256699,파이낸셜뉴스
"방통위→방송미디어통신위 개편안 급물살…""위원 7명으로 확대""",,"[파이낸셜뉴스] 27일 과학기술정보통신방송위원회가 개최한 법안심사소위에서 방송통신위원회 조직 개편 논의가 구체화했다.이날 소위 종료 후 김현 과방위 더불어민주당 간사는 취재진을 만나 ""방통위를 방송미디어통신위원회로 명칭 변경하는 방안에 합의했다""고 발표했다.새로운 조직 구성은 기존 5명 체제에서 총 7명으로 늘어난다. 상임위원 3명과 비상임..",2025.08.27 20:31,https://www.fnnews.com/news/202508272027355628,파이낸셜뉴스
"EU, 美공산품 관세철폐법 발표 임박..이번 주 중 공개",,[파이낸셜뉴스] 유럽연합(EU) 집행위원회가 미국산 제품에 대한 관세 철폐를 위한 주요 입법안을 이달 내 내놓는다고 27일(현지시간) 밝혔다.현지 보도에 따르면 EU 집행위는 지난 21일 발표한 EU-미국 무역 공동성명 1조에 따른 이행 방안을 8월 말까지 마련할 계획이라고 전했다. 이번 달 말이 임박한 상황을 감안하면 빠르면 이번 주 중 공개될 것으로 예상된다.공동성명 1..,2025.08.27 20:26,https://www.fnnews.com/news/202508272021462546,파이낸셜뉴스
'사망률 2%' 사람에도 옮기는 '강아지 성병'..전국 확산 위기 [헬스톡],,[파이낸셜뉴스]  인천 강화군 소재 한 동물 번식장에서 100마리 넘는 개가 '브루셀라병'에 감염된 사실이 확인돼 당국이 조사에 나섰다.최근 농림축산식품부는 지난 4일 동물보호단체가 인천 강화군 소재 동물 번식장에서 구출한 개 260마리 중 105마리에서 브루셀라병이 확인돼 격리 치료를 받고 있다고 밝혔다.동물 구조에 나섰던 동물 보호 단체가 촬영한 영상에 따르..,2025.08.28 05:20,https://www.fnnews.com/news/202508272020343646,파이낸셜뉴스
러 공습에 우크라 에너지 시설 피해...10만 가구 이상 전력 공급 중단,,"[파이낸셜뉴스] 러시아가 27일 우크라이나 곳곳의 에너지 시설을 겨냥해 대규모 공습을 감행하면서 3명이 사망하고 10만 가구 이상이 전력 공급 중단 피해를 입었다고 현지 언론들이 27일 보도했다.우크라이나 에너지부는 성명을 통해 ""러시아가 6개 지역에 위치한 에너지 및 가스 운송 인프라를 표적으로 공격을 가했다""고 발표했다. 에너지부는 ""겨..",2025.08.27 20:19,https://www.fnnews.com/news/202508272017309612,파이낸셜뉴스
"""159명 희생 잊었나"" 이태원 유가족 항의...용산구 '안전상' 취소",,"[파이낸셜뉴스] 서울시가 용산구에 수여했던 '지역축제 안전관리 우수사례' 대상을 유가족들의 강한 항의로 철회했다.서울시는 27일 ""이태원 참사 유가족의 상처가 아직 아물지 않은 상황에서 용산구가 불필요한 과도한 홍보를 한 점을 유감스럽게 여기며, 용산구 대상 수상을 취소한다""고 발표했다.수상 취소에 따라 9월 말 예정이던 시장 표창과 상금 지급도 함께 ..",2025.08.27 20:16,https://www.fnnews.com/news/202508272013494704,파이낸셜뉴스
"인형탈 쓴 채 양손에 흉기 들고 마트 활보한 20대 女, 체포되자 ""야옹""",,[파이낸셜뉴스]  인형탈을 쓴 채 흉기를 들고 마트를 활보한 20대 여성이 경찰에 붙잡혔다. 27일 경남 거제경찰서는 공공장소 흉기 소지 혐의로 20대 여성 A씨를 입건해 조사하고 있다고 밝혔다.A씨는 지난 2일 오후 7시 23분께 경남 거제 소재의 한 대형마트에서 인형탈을 쓴 채 흉기 2자루를 들고 활보하는 등 불안감을 조성한 혐의를 받고 있다.유튜브 채널 '대한..,2025.08.28 04:50,https://www.fnnews.com/news/202508272001163199,파이낸셜뉴스
"하나운용, 국내 첫 '샤오미밸류체인 ETF' 출시",,[파이낸셜뉴스]  하나자산운용은 다음 달 2일 '1Q(원큐) 샤오미밸류체인액티브 ETF'를 신규 상장한다고 27일 밝혔다. 해당 ETF(상장지수펀드)는 샤오미를 중심으로 중국 대표 테크 기업에 투자하는 상품이다.샤오미를 약 25% 비중으로 편입하고 나머지 약 75%는 관련 밸류체인 종목에 투자하는 상품이다. 샤오미는 그동안 가성비 스마트폰 기업으로 알려져 왔지만 실제로..,2025.08.27 19:34,https://www.fnnews.com/news/202508271932117673,파이낸셜뉴스
‘박스피’ 언제까지...거래대금 급감에 증권주 ‘옥석 가리기’,,[파이낸셜뉴스] 국내 증시가 박스권에 갇히면서 거래대금이 급감하고 있다.28일 한국거래소에 따르면 이달 코스피 일평균 거래대금은 10조4000억원 수준으로 지난달 12조9000억원 대비 약 2조5000억원 감소했다. 올해 최고치를 기록했던 지난 6월의 15조2000억원과 비교하면 4조8000억원이 증발한 것이다. 8월 일평균 거래량도 3억2000여만주로 지난 2019년 3월 이후..,2025.08.28 06:00,https://www.fnnews.com/news/202508271930368922,파이낸셜뉴스
"""학교 선생이 학원 선생보다 실력 떨어져""…학원연합회장 발언 논란",,"[파이낸셜뉴스]  한국학원총연합회 회장이 학교 교사가 학원 강사보다 실력이 떨어진다는 취지의 발언을 해 교원단체들이 성명을 내고 사과를 촉구했다.27일 교육계에 따르면 이유원 한국학원총연합회 회장은 지난 22일 국회에서 열린 '늘봄학교, 지자체와 함께하는 선택교육 확대방안' 토론회에서 ""소비자들이 선택할 때 학교 선생님들이 학원 선생님들보다 실..",2025.08.27 20:05,https://www.fnnews.com/news/202508271922238770,파이낸셜뉴스
"검찰개혁안 놓고 당정간 기싸움...與 ""정성호, 좀 너무 나가신 것 아닌가""",,"[파이낸셜뉴스] 검찰개혁 대원칙이 담긴 정부조직법 개정안을 내달 25일 본회의에서 처리한 후 세부적인 개편 논의를 이어가기로 한 더불어민주당이 정성호 법무부장관과 의견 충돌을 빚는 모습이다.민형배 민주당 국민주권 검찰정상화 특별위원장은 27일 국회에서 기자들과 만나 정 장관이 전날 검찰의 보완수사권 완전 폐지에 대해 신중론을 펼친 것에 대해 ""개인적인 ..",2025.08.27 19:27,https://www.fnnews.com/news/202508271918158527,파이낸셜뉴스
"세진·신기테크, 회계처리 위반으로 감사인지정 2년 조치",,"[파이낸셜뉴스] 금융위원회 산하 증권선물위원회(증선위)가 회계부정을 저지른 자동차 부품업체 2곳에 대해 감사인지정 조치를 내렸다. 증선위는 27일 제15차 회의를 열고 회계처리기준을 위반해 재무제표를 작성·공시한 세진, 신기테크에 대해 감사인지정 2년 조치를 의결했다고 밝혔다. 비상장 자동차 부품 제조업체인 세진은 2020년부터 2022년까지 3년간 회계부정이..",2025.08.27 18:49,https://www.fnnews.com/news/202508271847272292,파이낸셜뉴스
