title,thumbnail,short_content,write_time,link,company
트럼프·엘시시 '가자 평화 회의' 공동 주재…20개국 정상 집결,,[파이낸셜뉴스] 도널드 트럼프 미국 대통령과 압델 파타 엘시시 이집트 대통령이 가자지구 휴전 합의 이행을 위한 정상회의를 공동 주재한다.AFP통신 등에 따르면 이집트 대통령실은 11일(현지시간) 홍해 휴양지 샤름엘셰이크에서 양국 정상이 주재하는 '가자 평화를 위한 정상회의'가 열릴 예정이라고 밝혔다.이번 회의는 가자지구 전쟁 종식을 위한 중동 평화 협력 강화를 목..,2025.10.12 12:39,https://www.fnnews.com/news/202510121232383440,파이낸셜뉴스
"'캄보디아 감금' 한국인 2명, 박찬대 의원실 도움으로 구조",,[파이낸셜뉴스] 캄보디아에서 고문과 감금을 당하며 강제로 범죄에 가담해야 했던 한국인 2명이 현지에서 극적으로 구조됐다. 다만 구조되지 못해 목숨을 잃은 대학생은 극심한 고문 끝에 사망했다는 증언 나왔다.12일 국회에 따르면 지난 2일 캄보디아 시아누크빌의 한 호텔에 감금됐던 한국인 2명이 박찬대 더불어민주당 의원의 도움으로 빠져나온 것으로 전해졌다..,2025.10.12 12:49,https://www.fnnews.com/news/202510121230397132,파이낸셜뉴스
"제네시스, 美 캘리포니아에 브랜드 전용 디자인 센터 개소",,"[파이낸셜뉴스] 현대차의 고급브랜드 제네시스가 미국 캘리포니아에 디자인센터를 열어 서울과 독일 디자인 거점과의 협업 체계를 구축해 디자인 역량을 대폭 강화한다.제네시스는 지난 10일(현지시간) 브랜드 전용 디자인 센터 '제네시스 디자인 캘리포니아(Genesis Design California)'를 공식 개소했다고 12일 밝힌 가운데, 미국 캘리포니아 엘 세군도에 위치한 '제네시스 ..",2025.10.12 12:30,https://www.fnnews.com/news/202510121227557486,파이낸셜뉴스
'두피케어부터 힐링까지'..롯데백화점 광복점 헤솔두피클리닉스 인기,,"[파이낸셜뉴스] 롯데백화점 광복점은 아쿠아몰 4층에 위치한 헤솔두피클리닉스가 전문적인 두피·탈모 관리부터 프리미엄 힐링 스파까지 아우르는 토털 케어 프로그램을 운영, 인기를 끌고 있다고 12일 밝혔다.헤솔두피클리닉스는 건국대학교 박사 원장이 직접 진단·케어를 진행하는 전문 클리닉으로 △줄기세포 기반 두피 앰플 △맞춤형 홈케어 솔루션 △프리미..",2025.10.12 12:34,https://www.fnnews.com/news/202510121227495357,파이낸셜뉴스
'반도체 지수' 3분기 상승률 싹쓸이...관세 리스크는 변수,,[파이낸셜뉴스] 올해 3·4분기 국내 증시에서 반도체 관련 지수가 상승률 상위권을 휩쓸었다. 인공지능(AI) 인프라 투자 확산과 메모리 가격 회복에 힘입어 업종 전반의 실적 개선 기대가 커지면서 지수 상승을 견인했다는 분석이다. 다만 최근 불거진 도널드 트럼프 미국 대통령의 관세 불확실성은 4·4분기 변수로 꼽힌다. 12일 한국거래소에 따르면 지난 7..,2025.10.12 14:08,https://www.fnnews.com/news/202510121226144891,파이낸셜뉴스
"부산 황령터널 달리던 외제차, 갑자기 엔진룸서 연기가",,[파이낸셜뉴스] 부산 황령터널에서 대연동 방향으로 달리던 한 외제차의 엔진룸에서 원인을 알 수 없는 불이 나는 사고가 발생했다. 다행히 인명피해는 없는 것으로 확인된다.12일 부산소방재난본부에 따르면 지난 11일 오전 7시께 대연동 황령터널 출입구 맥도날드 황령DT점 앞 도로에서 운전자 A씨가 몰던 차량에서 불이 나는 사고가 났다.차량의 엔진룸에서 불꽃이 튀..,2025.10.12 12:23,https://www.fnnews.com/news/202510121220015246,파이낸셜뉴스
디즈니 테마로 꾸며진 도심 러닝 축제 ‘디즈니런 서울 2025',,"월트디즈니 컴퍼니 코리아(이하 디즈니코리아)가 국내 최초의 디즈니 테마 러닝 이벤트인 ‘디즈니런 서울 2025(Disney Run 2025)’를 오는 10월 11일(토), 서울 여의도공원 문화의 광장에서 개최했다. 이번 행사는 단순 스포츠 이벤트를 넘어, 남녀노소 누구나 디즈니의 브랜드와 스토리를 체험할 수 있는 도심 속 축제로 기획됐으며, 약 1만 5,000여 명이 참가해 서울 도심을..",2025.10.12 12:18,https://www.fnnews.com/news/202510121208457128,파이낸셜뉴스
남양주시 2025 정약용 로봇경진대회 성료,,"【파이낸셜뉴스 남양주=김경수 기자】 경기 남양주시는 '2025 정약용 로봇경진대회'를 성황리에 마쳤다고 12일 밝혔다.전날 남양주체육문화센터 실내체육관에서 열렸다. 오는 18일 열리는 ‘제39회 다산정약용문화제’의 사전 행사로 진행됐다. 시는 다산 정약용 선생의 실학 정신을 현대 로봇 기술과 접목하고자 직접 주최했다.전국 25개 시·군, 200명의 초..",2025.10.12 12:22,https://www.fnnews.com/news/202510121207471267,파이낸셜뉴스
"""마늘 양파 보리도 농업수입안정 보험 가입 하세요""",,"[파이낸셜뉴스]  농림축산식품부는 이달부터 마늘과 양파, 보리에 대해서도 농업수입안정보험에 가입할 수 있다고 12일 밝혔다.마늘은 오는 13일부터, 양파와 보리는 오는 20일부터 각각 가입이 시작된다.농업수입안정보험은 기존 농작물재해보험의 보장 범위인 자연재해·화재·병충해 등에 따른 피해에 더해 시장가격 하락에 따른 농가의 경제적 손실도 보..",2025.10.12 12:09,https://www.fnnews.com/news/202510121207019525,파이낸셜뉴스
"중기부, 전통시장 420여곳 활성화 돕는다",,"[파이낸셜뉴스] 중소벤처기업부가 '2026년도 전통시장 및 상점가 활성화 지원사업' 모집을 시작한다고 12일 밝혔다.이 사업은 '전통시장 및 상점가 육성을 위한 특별법' 제2조에 따라 전통시장, 상점가, 골목형상점가 등을 대상으로 진행한다. 모집 기간은 오는 13일부터 11월 7일까지다. 모집 유형은 문화관광형시장, 시장경영지원, 지역상품전시회, 전국우수시장박..",2025.10.12 12:48,https://www.fnnews.com/news/202510121205176506,파이낸셜뉴스
"현대차, 싱가포르에 산학연 기업연구소 개소..스마트 제조 박차",,"[파이낸셜뉴스] 현대차그룹 싱가포르 글로벌 혁신센터(HMGICS)가 소프트웨어 중심 공장(SDF) 구현에 박차를 가한다.현대차그룹 최초의 스마트팩토리이자 소프트웨어 중심 공장 테스트베드인 HMGICS는 지난 3일 싱가포르 난양공대(NTU)와 싱가포르 과학기술청(A*STAR), HMGICS내에 '현대차그룹-NTU-A*STAR 기업 연구소'를 개소했다고 12일 밝혔다.지난해 10월 '한국-싱가포르 비..",2025.10.12 12:06,https://www.fnnews.com/news/202510121200044184,파이낸셜뉴스
"무디스 새정부 첫 연례협의...“韓, 고령화 해결위해 구조 개혁 필요”",,"[파이낸셜뉴스] 글로벌 3대 신용평가사 중 하나인 무디스(Moody’s)가 지정학적 리스크와 구조개혁을 한국경제의 두 가지 핵심 과제로 지목했다. 새 정부 출범 이후 주요 신평사 중 처음으로 연례협의를 진행한 무디스는 잠재성장률이 하락하고 고령화에 따른 재정 지출이 급증한 상황에서, 강력한 구조개혁이 불가피하다고 강조했다. 12일 금융투자업계에 따르면 무..",2025.10.12 12:03,https://www.fnnews.com/news/202510121156454872,파이낸셜뉴스
고양특례시민의 날 기념식 성황리 개최,,"【파이낸셜뉴스 고양=김경수 기자】 경기 고양특례시는 시민의 날 기념식이 성황리에 개최됐다고 12일 밝혔다.전날 오후 비가 오는 궂은 날씨 속에도 일산호수공원 한울광장에서 진행된 행사에는 이동환 시장을 비롯해 국회의원, 시·도의원, 시민들이 참석했다.시민 대표로 뽑힌 주민들은 '시민헌장'을 낭독하며 화합의 메시지를 전했다.이 시장은 그간 시정 ..",2025.10.12 12:07,https://www.fnnews.com/news/202510121149311150,파이낸셜뉴스
60세 이상이 종부세 절반 납부…은퇴세대 세금 부담 급증,,"[파이낸셜뉴스] 지난해 개인 종합부동산세(종부세)의 절반 이상을 60세 이상 고령층이 납부한 것으로 나타났다. 은퇴세대의 자산이 부동산에 집중되면서 세금 부담이 고령층으로 쏠리고 있다. 12일 국회 기획재정위원회 소속 박성훈 국민의힘 의원이 국세청으로부터 제출받은 ‘2020년 이후 종합부동산세 결정 현황’에 따르면, 지난해 개인 납세자는 46만3906명으로..",2025.10.12 11:37,https://www.fnnews.com/news/202510121132292298,파이낸셜뉴스
K-방산 기술력 총집결... 'ADEX 2025' 17일 개막,,"[파이낸셜뉴스] 국내 최대 항공우주·방위산업 전시회 '서울 ADEX 2025'가 오는 17일부터 개최된다. 올해는 역대 최대 규모로 열리는 가운데, 록히드마틴과 보잉, 에어버스 등 글로벌 방산기업들도 참여해 국내 방산업계와 협력을 모색할 것으로 전망된다.12일 업계에 따르면 서울 ADEX 2025는 17일부터 24일까지 경기 성남시 서울공항과 고양시 킨텍스 일대에서 열린다...",2025.10.12 11:33,https://www.fnnews.com/news/202510121130436898,파이낸셜뉴스
