title,thumbnail,short_content,write_time,link,company
"신한투자증권, 1분기 순익 2884억 '사상 최대'",,"신한투자증권이 증시 활황에 1·4분기 최대 실적을 거뒀다. 17일 신한투자증권에 따르면 올해 1·4분기에 영업이익 3864억원, 당기순이익 2884억원을 달성했다. 전년 동기 대비 각각 228.5%, 167.4% 증가한 규모다. 자기자본이익률(ROE)은 20%까지 상승했으며, 경영효율성 지표인 영업이익경비율(CIR)은 38.78%로 전년 대비 21.14%p 개선됐다. 증시 호조로 거…",2026.05.17 18:13,https://www.fnnews.com/news/202605171813226395,파이낸셜뉴스
코스피 종목 62%는 하락… 삼전닉스 못 담은 개미들 '절망',,"최근 국내 증시가 변동폭을 확대하면서 개인투자자 상당수는 웃지 못하고 있다. 코스피 시장에서 오르는 종목보다 내려가는 종목이 1.5배가량 더 많은 상황이다. 17일 한국거래소에 따르면 최근 한 달 간(4월 15일~5월 15일) 코스피 상장 종목 924개(거래정지 종목 제외) 중 상승 종목은 343개로, 전체의 37.1%에 그쳤다. 반대로 하락한 종목은 577개로, 62.4%에 육박했…",2026.05.17 18:13,https://www.fnnews.com/news/202605171813194999,파이낸셜뉴스
중복상장 규제 부담에… 대어급 사라진 IPO시장,,증시활황에도 기업공개(IPO) 시장의 체감 온도는 오히려 낮아지고 있다. 정부의 중복상장 규제 강화 기조가 상장 일정과 추진 방식에 부담으로 작용하는 모습이다. 17일 한국거래소에 따르면 올해 1월부터 이달 15일까지 국내 신규상장기업 수는 20곳으로 집계됐다. 지난해 1~5월 38곳이 신규 상장한 것과 비교하면 47.4% 감소한 수준이다. 공모금액 합계도 지난해 2조1…,2026.05.17 18:13,https://www.fnnews.com/news/202605171813168388,파이낸셜뉴스
"'오락가락' 코스피, 코로나 때보다 진폭 크다",,"이달 들어 코스피의 변동성이 확대되고 있다. 금리인상 경계감 속 코스피 단기 급등에 따른 차익실현 매물과 저가 매수세가 함께 쏟아지며 장중 진폭이 커지는 양상이다. 17일 한국거래소에 따르면 이달 들어 지난 15일까지 코스피 일중 변동률 평균은 4.47%로, 전월 2.26% 대비 크게 확대됐다. 이는 중동 전쟁 여파로 지수가 크게 흔들렸던 지난 3월 3.77%를 훌쩍 넘어선…",2026.05.17 18:13,https://www.fnnews.com/news/202605171813154522,파이낸셜뉴스
고신용자가 이자 더 낸다… 마통대출 '금리 역전' 현상,,"주요 시중은행에서 중·저신용자 구간 금리가 하락하고, 고신용자 금리가 오르는 역전 현상이 확인됐다. 일부 구간에서는 신용점수가 더 높은 차주가 낮은 차주보다 더 높은 금리를 적용받는 '금리 역전' 현상도 나타났다. 17일 은행권에 따르면 5대 시중은행(KB국민·신한·하나·우리·NH농협)의 4월 일반신용대출 평균 금리는 신용점…",2026.05.17 18:11,https://www.fnnews.com/news/202605171811438791,파이낸셜뉴스
車보험 손해율 악화에 손보사 실적 주춤,,국내 5대 손해보험사의 1·4분기 순이익이 1년 새 크게 줄었다. 자동차보험 손해율 악화로 본업인 보험손익이 줄어든 가운데 금리 상승에 따른 채권 평가손실까지 겹쳤다. 17일 보험업계에 따르면 삼성화재·DB손해보험·현대해상·KB손해보험·메리츠화재 등 국내 주요 5대 손해보험사의 올해 1·4분기 합산 순이익은 약 1조7000억원대로…,2026.05.17 18:11,https://www.fnnews.com/news/202605171811432836,파이낸셜뉴스
양도세 유예 종료 전 막차 탔나..4월 주담대 5조5000억 증가,,"지난달 전 금융권의 주택담보대출이 5조5000억원 늘었다. 3월(3조원)보다 2조원이나 많은 것으로, 지난해 8월(3조8000억원) 이후 8개월 만에 최대치다. 다주택자 중과세 유예 종료(9일) 전에 나온 급매물이 팔리면서 주담대가 크게 늘어난 것으로 해석된다. 금융당국은 은행권이 한층 강화된 가계대출 관리목표에 따라 대출 문턱을 높였음에도 자체 주담대가 증가세로 전환한 …",2026.05.17 18:11,https://www.fnnews.com/news/202605171811411427,파이낸셜뉴스
"하나금융, 두나무 손잡고 디지털자산 승부수",,"하나금융그룹이 1조원을 투자해 두나무 지분을 취득하고, 전략적 파트너십을 강화하기로 했다. 전통 금융사와 국내 최대 디지털자산 플랫폼이 지분 투자와 전략적 제휴로 묶이면서 원화 스테이블코인과 블록체인 기반 외환송금 시장을 둘러싼 주도권 경쟁도 본격화될 전망이다. 17일 하나금융에 따르면 하나은행 이사회는 카카오인베스트먼트가 보유한 두나무 지분 228…",2026.05.17 18:11,https://www.fnnews.com/news/202605171811371047,파이낸셜뉴스
"'백신 강국' 인도, 2030년 바이오시장 3000억弗로 키운다",,【 하노이(베트남)=김준석 특파원】인도가 글로벌 정보기술(IT) 아웃소싱 허브를 넘어 세계 '제약·바이오 강국'으로의 전환에 속도를 내고 있다. 전통적인 저가 제네릭(복제약) 중심 산업 구조에서 벗어나 첨단 바이오의약품과 백신 등 고부가가치 분야를 확대하며 글로벌 공급망의 핵심 축으로 부상하는 모습이다. 인도는 현재 전 세계 제네릭 의약품의 약 20…,2026.05.17 18:09,https://www.fnnews.com/news/202605171809273918,파이낸셜뉴스
"베트남, 100조 북남고속철도 사업 속도전",,【 하노이(베트남)=부 튀 띠엔 통신원·김준석 특파원】베트남 정부가 약 100조원 규모의 북남고속철도 사업의 타당성조사 보고서 작성 컨설팅사 선정을 앞두고 글로벌 로드쇼를 개최했다. 앞서 베트남 건설부는 지난 6일 한국·중국·일본·스페인·프랑스·독일 등 주요국 대사관에 공문을 보내 역량 있는 컨설팅사의 로드쇼 참여…,2026.05.17 18:09,https://www.fnnews.com/news/202605171809267463,파이낸셜뉴스
민주·진보 울산시장 후보 단일화 경선 23~24일 여론조사 실시,,"【파이낸셜뉴스 울산=최수상 기자】6.3 지방선거 울산지역 후보 단일화에 합의한 더불어민주당과 진보당이 오는 19일부터 단일 후보 확정을 위한 여론조사(경선)를 시작한다.17일 진보당 울산시당과 지역 정치계에 따르면 민주당 최덕종 후보와 진보당 김진석 후보 간 남구청장 단일 후보 경선, 민주당 김시욱 후보와 진보당 강상규 후보 간 울주군수 단일 후보 경선 여론…",2026.05.17 18:44,https://www.fnnews.com/news/202605171808036692,파이낸셜뉴스
"위성락 ""전작권 전환 시점, 한미간 큰 갭 없어""",,"위성락 청와대 국가안보실장은 17일 한미 전시작전통제권(전작권) 전환 논의와 관련해 ""군 간의 협의가 계속되고 있는데 (한미간) 타이밍에 큰 갭이 없다. 많은 차이가 있는 게 아니다""라면서도 ""기본적으로는 정치적 결정 사항""이라고 밝혔다. 위 실장은 이날 KBS 일요진단에 출연해 ""(전작권 전환 시기와 관련) 무슨 5년, 10년 차이가 있는 게…",2026.05.17 18:06,https://www.fnnews.com/news/202605171806202936,파이낸셜뉴스
"與 지도부, 전북 총출동… 이원택 힘싣기",,더불어민주당 지도부가 17일 전북에 총출동해 지역 표심 구애에 나섰다. 전북지사 지지도 여론조사에서 공천 문제로 정청래 당 대표와 척을 진 김관영 무소속 후보가 이원택 민주당 후보를 앞서나가는 추세에 위기감을 느낀 것으로 읽힌다. 정 대표는 이날 전북 김제시에서 열린 박지원 전북 군산·김제·부안 을 의원 보궐선거 후보 선거사무소 개소식에서 …,2026.05.17 18:06,https://www.fnnews.com/news/202605171806193784,파이낸셜뉴스
한일 정상 '고향 셔틀외교'… 19일 안동서 만난다,,이재명 대통령과 다카이치 사나에 일본 총리가 오는 19일 경북 안동에서 정상회담과 만찬을 함께한다. 지난 1월 이 대통령이 다카이치 총리의 고향인 일본 나라현을 찾은 데 대한 답방 성격이다. 한일 간 '셔틀외교'를 넘어 '고향외교'가 이뤄지는 만큼 이 대통령이 다카이치 총리를 직접 영접하는 등 국빈 방한에 준하는 예우로 맞이할 예정이다. 특히 이 대통령과 다…,2026.05.17 18:06,https://www.fnnews.com/news/202605171806148384,파이낸셜뉴스
"朴 ""세계 도시 향해 중단 없는 발전""[6.3 지방선거 D-16]",,【 부산=변옥환 기자】 박형준 국민의힘 부산시장 후보가 지난 13일 부산 젊은이들 속으로 파고들었다. 부산 남구 부경대학교 축제 현장을 찾아 청년들과 격의 없는 대화에 나섰다. 치맥(치킨·맥주)도 빠지지 않았다. 박 후보는 지난달 29일 예비후보 등록 이후 첫 공약으로 '부산 청년 복합소득 1억원' 정책을 발표하며 일찌감치 청년층 마음 사로잡기에 나섰다…,2026.05.17 18:05,https://www.fnnews.com/news/202605171805056400,파이낸셜뉴스
"田 ""활력잃은 부산을 기회의 바다로""[6.3 지방선거 D-16]",,"【 부산=백창훈 기자】 ""요새 물가가 비싸가 어디 외식하는 사람 있는가예. 그나마 해양수산부가 와가꼬 이마이 장사하지. 이재명 대통령 한마디에 우리가 이래 장사를 하니까, 이번엔 민주당 한번 믿어봐야지예."" 지난 15일 해수부 부산청사가 위치한 부산 동구 수정동. 꼼장어 가게를 운영하는 50대 김모씨는 손님을 맞이하던 도중 취재진의 부산시장 선거 …",2026.05.17 18:05,https://www.fnnews.com/news/202605171804510570,파이낸셜뉴스
"田 ""해양수도 부산 완성""… 朴 ""월드클래스 도시 격상""[6.3 지방선거 D-16]",,【 부산=변옥환 백창훈 기자】 부산시장 선거는 6·3 지방선거 최대 승부처로 꼽힌다. 3선에 도전하는 국민의힘 박형준 후보와 이재명 정부 후광을 입은 더불어민주당 전재수 후보의 지지율 격차가 초반보다 줄어들면서 분위기는 더욱 달아오르고 있다. 지난달만 해도 여러 여론조사 결과에서 전 후보가 크게 앞서면서 싱겁게 끝나나 싶었다. 그러다 국민의힘 후…,2026.05.17 18:04,https://www.fnnews.com/news/202605171804492329,파이낸셜뉴스
"FIU·가상자산 업계 내일 간담회 갖는다…""특금법 시행령 의견 수렴""",,"[파이낸셜뉴스] 금융당국과 가상자산 업계 관계자들이 오는 18일 간담회를 가질 예정이다. 지난 3월 입법예고된 특정금융정보법(특금법) 시행령 개정안과 관련해 업계의 의견을 듣는다는 취지다.17일 가상자산 업계에 따르면 금융위원회 산하 금융정보분석원(FIU)는 오는 18일 가상자산 업계와 간담회를 진행한다. 금융당국 관계자는 ""다양한 방식으로 의견을 듣는 …",2026.05.17 18:07,https://www.fnnews.com/news/202605171739483660,파이낸셜뉴스
안타 치고 뛰고 또 치고… '5안타 4득점' 박재현 원맨쇼에 라이온즈파크가 얼어붙었다,,[파이낸셜뉴스]  초여름의 열기가 달아오른 대구벌. 하지만 그보다 더 뜨겁고 매서운 것은 호랑이 군단의 방망이였다. KIA 타이거즈가 장단 21안타를 몰아치는 무자비한 융단폭격으로 사자 군단의 마운드를 붕괴시켰다.KIA는 17일 대구 삼성라이온즈파크에서 펼쳐진 2026 신한 SOL뱅크 KBO리그 삼성 라이온즈와의 주말 시리즈 마지막 경기에서 16-7의 압도적인 대승을 거…,2026.05.17 17:42,https://www.fnnews.com/news/202605171737154918,파이낸셜뉴스
"""여보, 당신 퇴직금 얼마나 쌓였어?""… 집 사느라 퇴직금 갈아 넣고 '빈손' 된 40대들 [가장의 은퇴시계]",,"[파이낸셜뉴스]  ""여보, 김 부장네는 이번에 명퇴하면서 퇴직금으로 작은 상가 알아본다는데. 당신은 지금 퇴직금 계좌에 얼마나 쌓였어?""일요일 밤 10시. 주말의 끝자락에서 내일의 출근 압박이 턱끝까지 차오르는 시간. 무심코 던진 아내의 질문에 40대 가장 A씨는 들고 있던 리모컨을 만지작거리며 말을 얼버무렸다. 스마트폰으로 남몰래 확인해 본 퇴직연금…",2026.05.17 19:00,https://www.fnnews.com/news/202605171719110916,파이낸셜뉴스
