title,thumbnail,short_content,write_time,link,company
"""현조야, 미안""… 박보겸, 삼천리 동생 꺾고 개막전 우승",,박보겸이 KLPGA 개막전에서 우승했다. 통산 3승째이고 지난해 10월 상상인·한경 와우넷 오픈 2024 챔피언십 이후 첫 우승이기도 하다. 박보겸은 16일 태국 푸껫의 블루캐니언 컨트리클럽(파72·6550야드)에서 펼쳐진 한국여자프로골프(KLPGA) 투어 개막전 블루캐니언 레이디스 챔피언십(총상금 80만 달러)에서 16언더파 272타를 적어내며 최종 우승했다.박..,2025.03.16 18:24,https://www.fnnews.com/news/202503161824353330,파이낸셜뉴스
선수와 갤러리 함께 호흡… KPGA 등용문 'G투어',,【 대전=전상일 기자】 지난 15일 대전 골프존조이마루. 다소 쌀쌀한 날씨임에도 G투어(TOUR)의 인기를 입증하듯 현장은 주최측이 제공한 팝콘을 든 갤러리들로 가득했다. 골프존이 개최한 첫 메이저 대회 '2025 신한투자증권 G투어' 3차 대회 남자부 결선이 성료했다. 이번 대회는 골프존이 야심차게 기획한 첫 메이저 대회다. 특히 대회에서 우승한 선수가 'KPGA 클래..,2025.03.16 18:24,https://www.fnnews.com/news/202503161824318494,파이낸셜뉴스
"국제질서 틀 바꾼 러우전쟁…""韓, 동맹만 믿지말고 자강책도"" [밀리터리 월드]",,"미국과 북대서양 조약 기구(NATO)는 지난 조 바이든 미국 행정부에서 사활을 걸고 2022년 2월 러시아가 일으킨 우크라이 전쟁에서 줄곧 우크라이나를 지원해 왔다. 그 이유는 무엇이었을까. 원래 나토 유럽은 슬라브 계통의 우크라이나에 그다지 우호적이지 않았지만, 전쟁이 발발하자 무제한적인 지원을 했던 것은 우크라이나를 러시아에 뺏기게 되면 러시아가 유럽으..",2025.03.16 18:23,https://www.fnnews.com/news/202503161823591700,파이낸셜뉴스
"[fn이사람] ""전시장 확장·K전시 수출로 코엑스의 경쟁력 키웠죠""",,"""2년여간 60여개 입주사를 일일이 찾아다니며 설득했죠. 그렇게 해서 만들어진 게 상설전시관인 '더 플라츠'입니다. 이 전시관 개관으로 중소·중견기업들로부터 코엑스의 문턱이 낮아졌다는 얘길 많이 듣습니다."" 이동기 코엑스 사장(58·사진)은 국내 전시산업계 '대부'로 통한다. 이 사장은 지난 1992년 코엑스의 모회사인 한국무역협회 입사 ..",2025.03.16 18:23,https://www.fnnews.com/news/202503161823551599,파이낸셜뉴스
마하 5 속력·저고도 비행으로 기습 타격... 北방어망 뚫는 '한국형 HCM' 개발 박차 [밀리터리 월드],,"극초음속 순항미사일(HCM, Hypersonic Cruise Missile)은 기존 미사일의 단점을 보완, 적의 미사일 방어체계를 뚫을 수 있는 강력한 타격체계로 효용성을 지닌다. HCM은 기존 탄도미사일과 순항미사일의 장점을 모았으며, 일종의 게임체인저로 알려져 있다. 이 같은 이유로 군사 선진국들을 중심으로 기술을 확보하기 위해 경쟁을 벌이고 있다. 16일 국방과학연구소(AD..",2025.03.16 18:23,https://www.fnnews.com/news/202503161823457909,파이낸셜뉴스
KT 2030직원들 모인 청년이사회 '블루보드' 출범,,KT는 서울 종로구 KT 광화문빌딩 이스트에서 2025년 KT 청년이사회 '블루보드' 발대식을 진행했다고 16일 밝혔다. 블루보드로 선발된 직원들은 KT의 AICT 서포터즈로서 사내외 인공지능전환(AX) 확산을 이끌 선도적 역할을 수행한다. 블루보드는 KT가 2001년부터 25년간 운영하고 있는 대표적인 기업문화 강화 프로그램이다. 블루보드로 활동하는 2030세대 직원들은 회..,2025.03.16 18:23,https://www.fnnews.com/news/202503161823418821,파이낸셜뉴스
정홍근 티웨이 대표 10년 경영 마침표… 이달 퇴임,,티웨이항공을 10년 가까이 이끌어 온 '국내 저비용항공사(LCC) 최장수 최고경영자(CEO)' 정홍근 대표이사(사진)가 이달 말 임기를 마치고 회사를 떠난다. 그 자리에는 대명소노그룹 추천으로 오는 31일 정기 주주총회를 거쳐 이사회에 진입할 인사 중 한 명이 선임될 것으로 전망된다. 16일 항공업계에 따르면 정 대표는 지난 14일 티웨이항공 임직원에게 이메일을 보내..,2025.03.16 18:23,https://www.fnnews.com/news/202503161823346537,파이낸셜뉴스
관세 전쟁 피해 안전자산으로 피신… 금값 3300弗까지 치솟을 수도 [글로벌리포트],,【파이낸셜뉴스 실리콘밸리=홍창기 특파원】도널드 트럼프 대통령이 시작한 관세 전쟁 때문에 국제 금값이 연일 사상 최고치를 경신하고 있다. 관세 전쟁으로 안전자산 선호 심리가 커지면서 금 수요가 늘어나고 있는 것인데 온스당 3000달러가 넘은 금값이 현재보다 10% 이상 추가 상승 여력이 있다는 분석도 나온다. 16일 뉴욕상품거래소(COMEX)에 따르면 지난 14일(현지시간..,2025.03.16 18:23,https://www.fnnews.com/news/202503161823313488,파이낸셜뉴스
경기침체도 두렵지 않은 트럼프… 관세맨은 브레이크가 없다 [글로벌리포트],,【 실리콘밸리=홍창기 특파원】도널드 트럼프 미국 대통령이 동맹도 품목도 가리지 않고 '관세전쟁' 전선을 확대하고 있다. 주변국에 대한 보복과 협박도 서슴지 않으면서 전 세계를 관세 전쟁에 휘말리게 한 트럼프 대통령은 사실 관세전쟁에 대해 낯선 사람이 아니다. 트럼프 대통령은 1기 정권 시절에도 중국과 집중적으로 관세 전쟁을 벌인 바 있다. 그는 지난 대선..,2025.03.16 18:23,https://www.fnnews.com/news/202503161823270317,파이낸셜뉴스
[부음] 신욱희씨(서울대 정치외교학부 교수·'순응과 저항을 넘어서' '삼각관계의 국제정치' 저자) 별세·이영부씨 남편상·신동훈 승혜씨 형제상,,"▲신욱희씨(서울대 정치외교학부 교수·'순응과 저항을 넘어서' '삼각관계의 국제정치' 저자) 별세·이영부씨 남편상·신동훈 승혜씨 형제상=16일 분당서울대병원, 발인 18일 오전 11시. (031)787-1510",2025.03.16 18:23,https://www.fnnews.com/news/202503161823267477,파이낸셜뉴스
[인사] 과학기술정보통신부 外,,◆과학기술정보통신부 ◇국장급 승진 △연구개발투자심의국장 서경춘 △우정사업본부 경북지방우정청장 노기섭 △국가바이오위원회지원단 파견 이재흔 ◇과장급 전보 △기획재정담당관 조경옥 △양자혁신기술개발과장 심주섭 △통신이용제도과장 신대식 △과학기술전략과장 이종우 △연구예산총괄과장 박상민 △연구평가혁신과장 김연학 ▲신욱희씨(서울대 정치외교학부 ..,2025.03.16 18:22,https://www.fnnews.com/news/202503161823216832,파이낸셜뉴스
"[fn사설] 청년백수 120만명, 개혁 화급한 이유가 여기 있다",,"일하지 않는 무기력한 청년이 120만명에 이르는 것으로 나타났다. 일터를 잃었거나, 취업을 준비 중이거나, 집에서 그냥 쉬는 청년세대가 이 정도에 달한다는 것이다. 어렵게 일을 구한 청년도 4명 중 1명은 초단기 근로자로 분류됐다. 20대 청년뿐 아니라 우리 사회 허리에 해당하는 30대들의 '쉬었음 인구'도 6개월 연속 최대를 기록했다. 젊은층이 뒷받침되지 않는 ..",2025.03.16 18:15,https://www.fnnews.com/news/202503161815585690,파이낸셜뉴스
"[fn사설] 강남발 집값 과열, 더 큰 불 되기 전에 선제 대응을",,"강남 아파트 가격 상승세로 부동산 리스크에 대한 불안감이 엄습하고 있다. 한국 경제가 대내외적 복합 리스크에 직면한 가운데 집값마저 과열되면 낭패가 아닐 수 없다. 서울시가 16일 지난달 송파구 잠실동, 강남구 삼성·대치·청담동 아파트 291곳에 대한 토지거래허가구역 해제 후 30일간 거래를 분석한 바에 따르면, 이 지역 집값은 평균 2.7% 올랐다..",2025.03.16 18:15,https://www.fnnews.com/news/202503161815543725,파이낸셜뉴스
[강남시선] '내편 네편'만 있는 혼돈의 시대,,"청소년 시절 읽었던 책 중 30년이 지난 지금도 기억에 남는 소설이 있다. 부모님 등쌀에 방학 기간 공부는 해야 했고, 시간은 너무 느리게만 갔다. 당시 책상에 앉아 공부 대신 유일하게 시간을 빨리 보낼 수 있는 방법은 소설책 읽기였다. 그렇게 태백산맥을 만났다. 무협지 읽듯 10권을 쉬지 않고 읽었을 만큼 재미있었다. 내용도 당시 교과서에서 접할 수 없는 것이..",2025.03.16 18:15,https://www.fnnews.com/news/202503161815510420,파이낸셜뉴스
[기자수첩] 대화가 가장 어렵다는 대화경찰관,,'늦게 답장해서 애태우기' '애매하게 답하기' '3밖에 못 준다고 했다가 4를 줘서 5를 얻기'. 이 셋의 공통점은 무엇일까. 답은 협상의 기술 중 하나인 '밀당(밀고 당기기)'이다. 그러나 누구나 밀당할 수 있는 것은 아니다. 서로 대등한 발언권을 가지고 있어야 한다. 기울어진 운동장에서 한쪽에만 유리한 협상이 이뤄지는 이유가 여기에 있다. 애석하게도 '대화경찰(D..,2025.03.16 18:15,https://www.fnnews.com/news/202503161815475951,파이낸셜뉴스
"[차관칼럼] 보험개혁, 국민이 체감할 때까지",,"보험은 예측하지 못한 사고나 재해 등으로 인한 경제적 손실을 보상하며 국민경제의 불안을 경감하고 생활을 안정시키는 기능을 한다. 이러한 보험의 역할을 바탕으로 국내 보험산업은 크게 성장해왔다. 보험산업의 수입보험료는 연간 1830억달러로 세계 7위(스위스리·2022년)이며, 가구당 보험 가입률은 98.2%(보험소비자 설문조사, 2019년)이다. 그러나 이러한..",2025.03.16 18:15,https://www.fnnews.com/news/202503161815455286,파이낸셜뉴스
[김경민의 국제정치] 한일 국교정상화 60주년,,"2025년은 한일기본조약 체결 60주년이 되는 해이다. 공식 명칭은 '대한민국과 일본 간의 기본관계에 관한 조약'인데, 국교정상화와 전후보상 문제를 해결하기 위해 대한민국 정부와 일본 정부 사이에 1965년 6월 22일 체결된 조약이다. 국교정상화 60주년이 되었지만 한일 간의 불행한 과거가 말끔히 해소되었을까? 한국은 일본의 사죄와 반성에 진정성이 없다고 느끼고..",2025.03.16 18:15,https://www.fnnews.com/news/202503161815405631,파이낸셜뉴스
"북한 군, 일부 굶주림에 개인 군장 팔아 당국 검열 강화",,[파이낸셜뉴스] 최근 북한 군 당국이 개인 군장을 팔거나 빼돌리는 일부 군인들의 일탈행위 차단에 고심하고 있는 것으로 16일 알려졌다.자유아시아방송(RFA)은 신변안전을 위해 익명을 요청한 함경북도의 한 주민 소식통을 인용해 지난 11일 “최근 각 군부가 불의에 매 군인에게 보급된 개인 장구류(군장) 검열을 진행했다”며 “전군적으로 장구류를 팔아먹거나 빼돌리..,2025.03.16 17:58,https://www.fnnews.com/news/202503161717198998,파이낸셜뉴스
"김석준 후보, “단일화에만 목메는 후보에게 우리 아이들 맡길 수 있나”",,"[파이낸셜뉴스]  김석준 부산시교육감 후보가 단일화에 또 단일화를 발표한 보수 진영 정승윤·최윤홍 두 후보를 싸잡아 비판했다김 후보는 16일 ‘교육감 선거가 단일화 게임으로 전락했다’는 제목의 입장문을 내고 “유권자들에게 정책을 제시하기보다 단일화에만 목메는 후보들에게 어찌 우리 아이들을 맡길 수 있겠느냐”며 “이번 선거는 상식과 몰상식, 정상..",2025.03.16 16:57,https://www.fnnews.com/news/202503161651315506,파이낸셜뉴스
모수개혁 접점 찾은 與野..이달내 연금 개혁안 처리 가능할까,,[파이낸셜뉴스] 주요 정쟁 현안에 밀려있던 연금개혁과 관련 여야가 모처럼 소득대체율(받는 돈) 43%에 잠정 합의점을 찾으면서 모수개혁에 속도가 붙고 있다.이르면 여야 협의를 거쳐 오는 20일 본회의에서 상정 처리될 가능성이 있다. 다만 야당이 43% 수용 전제조건을 내세운 군 복무 크레딧 확대 등을 놓고 여야간 추가 조율이 필요한 만큼 최종 합의처리까지는 어느정도 ..,2025.03.16 17:09,https://www.fnnews.com/news/202503161636479234,파이낸셜뉴스
"박보겸, 韓‧中‧日 맞대결 최종 승자로... KLPGA 블루캐니언 챔피언십 '우승'",,[파이낸셜뉴스] 박보겸이 KLPGA 개막전에서 우승했다. 통산 3승째이고 지난해 10월 상상인·한경 와우넷 오픈 2024 챔피언십 이후 첫 우승이기도 하다.박보겸은 16일 태국 푸껫의 블루캐니언 컨트리클럽(파72·6550야드)에서 펼쳐진 한국여자프로골프(KLPGA) 투어 개막전 블루캐니언 레이디스 챔피언십(총상금 80만 달러)에서 16언더파 272타를 적어내며 최종 우승..,2025.03.16 18:00,https://www.fnnews.com/news/202503161636442894,파이낸셜뉴스
"'도시바 꼴 되나'...""野, 1400만 개미표 잡자고, 기업경영 훼손"" 경영계 반발 확산",,"[파이낸셜뉴스]  지난 2021년 11월 도요타, 일본제철 등과 함께 일본 재계의 '고산케(御三家, 트로이카)'로 불렸던 도시바가 실적 발표회장에서 총 37쪽짜리 보고서를 발표했다. 일명 '말하는 주주'로 불리는 행동주의 펀드들의 요구대로, 회사를 3분할로 쪼개겠다는 것이 골자였다. 이에 앞서선, 영국계 펀드에 회사를 통째로 매각한 뒤 비상장화하는 시나리오를 추진했..",2025.03.16 17:35,https://www.fnnews.com/news/202503161630253844,파이낸셜뉴스
"""정치적 판단 안돼""..與 한덕수 탄핵심판 우선 선고 촉구",,[파이낸셜뉴스] 윤석열 대통령에 대한 헌법재판소의 탄핵심판 선고가 임박한 가운데 먼저 변론 종결된 한덕수 국무총리 탄핵심판 선고부터 내려져야 한다는 목소리가 여권을 중심으로 거세게 터져나오고 있다.16일 정치권 등에 따르면 헌재에 계류중인 탄핵심판 가운데 선고기일이 지정되지 않은 사건은 윤 대통령 사건과 한 총리 사건 뿐이다. 한 총리 사건을 먼저 선고할 경..,2025.03.16 16:29,https://www.fnnews.com/news/202503161614064918,파이낸셜뉴스
"세븐일레븐, '바밤바 크림빵' 2종 출시",,"[파이낸셜뉴스] 세븐일레븐은 '세븐셀렉트 바밤바꿀밤생크림빵'과 '세븐셀렉트 바밤바알밤크림빵' 2종을 선보인다고 16일 밝혔다.이는 해태아이스와 메가 브랜드 상품 '바밤바' 지식재산권(IP)을 활용해 만든 디저트다.지난해 6월부터 기획 및 개발을 시작했으며, 수십 번의 샘플링 과정을 거쳐 바밤바 특유의 밤 크림 맛을 그대로 재현했다.박대성 세븐일레븐 간편식품팀..",2025.03.16 15:52,https://www.fnnews.com/news/202503161546472762,파이낸셜뉴스
"정치권, 헌재 선고 승복 약속요구 잇따라",,"[파이낸셜뉴스]헌법재판소의 윤석열 대통령에 대한 탄핵 심판이 임박한 가운데 정치권에서 선고시 승복 요구가 잇따르고 있다. 파면 인용이냐, 각하 또는 기각이냐에 따라 탄핵 찬반 쪽에서 각자의 논리로 헌재의 선고를 해석하면서 불복 여론이 형성돼 선고 후유증이 지속될 수 있다는 판단에서다. 여기에는 탄핵 선고 자체가 주는 정치적 의미도 크지만, 무엇보다 탄핵 이후 ..",2025.03.16 16:40,https://www.fnnews.com/news/202503161546316340,파이낸셜뉴스
"커버써먼, 무빈, 엔씽 투자 유치[주간VC동향]",,"[파이낸셜뉴스]   패션테크 스타트업 커버써먼, 인공지능(AI) 기반 3D 모션캡처 기업 무빈, 스마트팜 및 수직농장 기술 전문기업 엔씽이 투자 유치에 성공했다. 16일 벤처캐피탈(VC) 업계에 따르면 커버써먼은 50억 원 규모의 시리즈A 투자를 유치했다. 이번 투자 라운드에는 인터베스트, JS코퍼레이션, 빅무브벤처스, 마크420이 참여했다. 누적 투자 유치액은 100억원이..",2025.03.16 15:48,https://www.fnnews.com/news/202503161538357287,파이낸셜뉴스
"美 민감 국가 지정에 與野 책임 공방…""탄핵 책임"" vs ""내란 때문""",,"[파이낸셜뉴스] 여야는 16일 미국의 민감 국가 리스트에 한국을 추가한 것을 두고 책임 공방을 벌였다. 여당은 야당이 탄핵을 남발한 결과로 평가했고, 야당은 윤석열 정부의 무능과 내란이 초래한 외교 참사로 규정했다.권동국 국민의힘 대변인은 이날 논평을 통해 ""민감 국가 지정, 가장 낮은 수위라고는 하지만 한미동맹의 신뢰에 영향을 줄 수 있는 엄중한 사안""..",2025.03.16 15:39,https://www.fnnews.com/news/202503161538214486,파이낸셜뉴스
"中 BYD, 중고차 수입·유통 법인 신설",,"[파이낸셜뉴스] 중국 전기차 업체 BYD가 한국 내 중고차 수입·유통 법인을 새롭게 만들었다.16일 업계에 따르면 BYD는 최근 BYD코리아와의 별도 법인 BYD코리아오토를 설립했다. 사업 목적은 '중고차의 수입·유통 등'이다.업계는 BYD코리아가 신차 판매를, BYD코리아오토가 중고차 판매를 맡을 것으로 보고 있다.다만 BYD코리아 관계자는 ""이후 사업에..",2025.03.16 15:46,https://www.fnnews.com/news/202503161538006007,파이낸셜뉴스
'전국민이 그리 뛰더니'..퓨마도 나이키도 '한국 OO 시장'에 진심,,"[파이낸셜뉴스] 불황에도 국내 러닝 문화의 대중화로 글로벌 스포츠 브랜드들이 한국 시장 공략을 부쩍 강화하고 있다. 특히, 2030세대를 중심으로 러닝 붐이 불면서 전문가용 수준의 러닝화 시장도 가파른 성장세를 이어가고 있다.16일 시장조사기관 유로모니터에 따르면 국내 운동화 시장 규모는 2021년 2조7700억원대에서 2022년 3조1000억원, 2023년 3조4000억원으로 지난..",2025.03.16 17:02,https://www.fnnews.com/news/202503161534312726,파이낸셜뉴스
"박찬대 ""헌재, 이번주 내 가장 빠른날 尹 탄핵심판 선고 내리길""",,"[파이낸셜뉴스] 박찬대 더불어민주당 원내대표는 16일 ""헌법재판소는 이번주 내로 가장 빠른날 윤석열에 대한 탄핵심판 선고를 내리길 촉구한다""고 했다.박 원내대표는 이날 도보 행진 출발 전 국회에서 ""오늘은 헌재의 변론 기일이 종결된지 20일째 되는 날로, 탄핵심판 선고가 늦어지면서 사회적 불안과 혼란이 가중되고, 경제적 피해도 커지고 있다""며 ..",2025.03.16 15:29,https://www.fnnews.com/news/202503161529255361,파이낸셜뉴스
"권성동 ""헌재의 尹 탄핵심판 결과에 승복…당 공식 입장""",,"[파이낸셜뉴스] 권성동 국민의힘 원내대표는 16일 헌법재판소의 윤석열 대통령 탄핵 심판과 관련해 ""우리 당의 공식 입장은 헌재의 판단 결과에 승복하겠다는 것""이라고 했다.권 원내대표는 이날 국회에서 기자간담회를 갖고 ""다 아시다시피 헌법재판은 단심이다. 거기에서 선고가 되면 그 결과는 모두를 귀속하게 돼 있다""며 이같이 말했다.권 원내대표는..",2025.03.16 15:25,https://www.fnnews.com/news/202503161525340416,파이낸셜뉴스
尹 탄핵 선고 앞두고 與野 막판 세대결 화력 집중,,"[파이낸셜뉴스] 윤석열 대통령에 대한 탄핵 심판 선고를 앞두고 여야가 막판 세대결에 집중하는 모양새다. 여당은 윤 대통령 탄핵 심판 기각·각하를 촉구하며 여론전에 나섰다. 야당 역시 윤 대통령 파면을 요구하며 맞대응에 나섰다. 이번주 중으로 예상되는 윤 대통령 탄핵 심판 선고에서 헌법재판소가 어떤 결정을 내릴지 귀추가 주목된다.■여야, 탄핵 찬반 여론전1..",2025.03.16 15:42,https://www.fnnews.com/news/202503161517336905,파이낸셜뉴스
"쎄트렉아이, 도로위 차종 식별하는 위성 발사 성공",,"[파이낸셜뉴스] 쎄트렉아이는 초고해상도 상용 지구관측위성 '스페이스아이-티(SpaceEye-T)'가 지난 15일(한국시간) 미국 캘리포니아주 반덴버그 우주군 기지에서 스페이스X의 펠콘 9(Falcon 9)으로 발사된 후 지상국 교신에 성공했다고 16일 밝혔다. 쎄트렉아이 측은 ""이 위성이 생성한 영상은 도로 위의 차종을 식별할 수 있을 정도로 정밀하며, 국가안보, 재난재..",2025.03.16 15:01,https://www.fnnews.com/news/202503161500331174,파이낸셜뉴스
"트럼프, 선박 공격 멈출때까지 예멘 후티 반군 공습 지시",,[파이낸셜뉴스]  도널드 트럼프 미국 대통령이 예멘에 거점을 두고 있는 후티반군에 대한 공습을 지시하면서 홍해를 지나는 선박에 대한 공격을 멈추라고 경고했다.15일(현지시간) AP통신 등 외신은 트럼프 대통령이 소셜미디어를 통해 미군이 후티반군이 장악하고 있는 지역을 공습할 것을 지시했으며 선박 공격을 멈출 때까지 “압도적이고 치명적인 힘”을 동원할 것이..,2025.03.16 15:27,https://www.fnnews.com/news/202503161457006151,파이낸셜뉴스
"전원영 TG 대표 ""최적 AI 선택할 수 있도록 품질 중심 컨설팅 제공""[중기·벤처 'Why Pick']",,"[파이낸셜뉴스]  ""이제는 인공지능(AI)를 활용하지 않는 기업을 찾아보기 힘들다. 문제는 어떤 AI를 어떻게 사용하느냐에 따라 성패가 갈린다는 것이다.""티지(TG)가 생성형 AI 컨설팅으로 확장하고 있다. 또한 TG는 그간 국내에서 AI 컨설팅으로 다져 온 입지를 해외 시장 공략에서도 적극 활용한다는 계획이다. 해외 시장 공략으로 눈코 뜰 새 없이 바쁜 ..",2025.03.16 16:01,https://www.fnnews.com/news/202503161455495668,파이낸셜뉴스
'와! 무려 1000명' 갤러리 폭발 골프존 GTOUR...KPGA 등용문으로 자리잡나,,【대전=전상일 기자】 지난 15일 대전 골프존조이마루. 다소 쌀쌀한 날씨임에도 G투어(TOUR)의 인기를 입증하듯 현장은 주최측이 제공한 팝콘을 든 갤러리들로 가득했다. 골프존이 개최한 첫 메이저 대회 ‘2025 신한투자증권 G투어’ 3차 대회 남자부 결선이 성료했다. 이번 대회는 골프존이 야심차게 기획한 첫 메이저 대회다. 특히 대회에서 우승한 선수가 ‘KPGA 클래..,2025.03.16 16:15,https://www.fnnews.com/news/202503161453488995,파이낸셜뉴스
MBK 김병주 사재 출연···“홈플러스 소상공인 결제대금 지원”,,[파이낸셜뉴스] 김병주 MBK파트너스 회장이 홈플러스 정상화를 위해 개인 재산을 출연하겠다는 의사를 밝혔다. 홈플러스 기업회생은 부도를 막기 위한 불가피한 결정이라는 기존 입장에서 다소 선회한 모습이다.MBK는 16일 “김 회장은 특히 어려움이 예상되는 소상공인 거래처에 신속히 결제대금을 지급할 수 있도록 재정 지원을 마련하겠다”며 “매입채무유동화 관련 ..,2025.03.16 15:13,https://www.fnnews.com/news/202503161447523384,파이낸셜뉴스
"""가족 모두 드라이빙 즐겨요""...그룹 회장이 아이디어 낸 행사는",,"[파이낸셜뉴스] 한국앤컴퍼니그룹은 다음달 13일 충남 태안군 한국테크노링에서 ‘2025년 1차 드라이빙 데이’를 개최한다고 16일 밝혔다.이날 행사는 임직원들에게 고성능 자동차 직간접 주행, 글로벌 하이테크 그룹의 첨단기술·인프라 경험을 제공하기 위해 기획했다. 당일 오후 1시부터 테크노링에서 약 4시간 동안 열린다. 직접 체험은 운전면허를 소지한 임직원을 ..",2025.03.16 15:33,https://www.fnnews.com/news/202503161447072050,파이낸셜뉴스
"중국서 보이스피싱 7명, 국내로 도주 입국했다가 '덜미'",,[파이낸셜뉴스] 중국 보이스피싱 일당이 수사가 시작되자 국내로 도주 입국했다가 구속 상태로 재판에 넘겨졌다.서울동부지검 보이스피싱 범죄 정부합동수사단(합수단)은 중국 소재 보이스피싱 조직에 가담한 후 국내로 달아난 조직원 7명을 모두 구속 기소했다고 16일 밝혔다.이들은 지난 2017~2019년 중국 칭다오와 다롄 등의 총책 '문성'이 운영하는 보이스피싱 조직에서 활..,2025.03.16 16:10,https://www.fnnews.com/news/202503161445590709,파이낸셜뉴스
"'최고 5%' 농협은행, 원금보장형 지수연동예금 출시",,"[파이낸셜뉴스] NH농협은행이 만기를 유지하면 원금을 보장하고 최고 5.0%의 수익률을 내는 '원금보장형 지수연동예금(ELD) 25-1호'를 출시했다고 16일 밝혔다.코스피 200지수를 기초자산으로 한 이번 예금 상품은 지수 변동에 따라 개인투자자는 연 2.2%~5.0%, 법인은 연 2.1%~4.9%의 수익률을 기대할 수 있다.상품의 만기는 1년으로 수익 I형과 II형 2종으로 이뤄졌다. ..",2025.03.16 14:50,https://www.fnnews.com/news/202503161441495268,파이낸셜뉴스
