title,thumbnail,short_content,write_time,link,company
"한덕수 구속영장 기각...특검, '비상계엄 국무회의' 수사 제동",,"[파이낸셜뉴스] 내란 우두머리 방조 등의 혐의를 받고 있는 한덕수 전 국무총리가 구속을 면하게 됐다. 내란·외환 특별검사팀(조은석 특검)은 '국정 1인자' 윤석열 전 대통령 구속에 성공했지만 '2인자' 한 전 총리 구속에 실패하면서 수사에 차질이 예상된다.서울중앙지법 정재욱 영장전담 부장판사는 27일 내란 우두머리 방조와 위증, 허위공문서 작성·폐기, ..",2025.08.27 22:18,https://www.fnnews.com/news/202508271846070451,파이낸셜뉴스
"[속보] 법원, 한덕수 구속영장 기각...즉시 석방",,[파이낸셜뉴스]  theknight@fnnews.com 정경수 기자,2025.08.27 22:02,https://www.fnnews.com/news/202508271843094389,파이낸셜뉴스
"'극한 가뭄' 강릉시, 수원 다각화 위한 중장기적 정부 지원 건의",,"【파이낸셜뉴스 강릉=김기섭 기자】강릉시가 27일 윤호중 행안부 장관 주재 관계기관 대책회의에서 강릉시 가뭄 해소 단기 대책으로 지자체 간 응원급수를 지원해 줄 것을 요청했다.27일 강릉시에 따르면 이날 오후 강릉시청 대회의실에서 윤호중 행정안전부 장관, 김진태 강원도지사, 김홍규 강릉시장을 비롯한 기상청, 환경부, 농림축산식품부 등 관계기관이 참가한 가운데 ..",2025.08.27 18:43,https://www.fnnews.com/news/202508271835567618,파이낸셜뉴스
성소수자에 거부감 없는 트럼프 동성연애자를 중용하고 있었다,,[파이낸셜뉴스]동성연애자들이 의외로 도널드 트럼프 미국 행정부에서 요직을 맡으며 활약하고 있었다. 성소수자(LGBTQ+)에 대해 적대적이라는 이미지가 짙은 트럼프 행정부에서 동성연애자 고위 관료들이 두각을 나타내고 있다고 뉴욕타임스(NYT)가 26일(현지시간) 전했다.트럼프 행정부 내에서 가장 영향력 있는 동성연애자 관료는 스콧 베선트 재무장관. 그는 동..,2025.08.27 19:00,https://www.fnnews.com/news/202508271834305335,파이낸셜뉴스
"동아대·메쉬링크, XR 기반 반도체 공정 교육 도입",,"동아대와 XR 반도체 플랫폼 개발 기업 '메쉬링크'가 반도체 전문 인재 양성을 위해 손을 잡았다. 동아대학교는 최근 메쉬링크와 업무협약(MOU)을 체결, 메쉬링크가 개발한 반도체 제조공정 XR 플랫폼 '페러데이XR'을 반도체학과 및 비교과 프로그램에 도입하기로 합의했다고 27일 밝혔다. 이번 협약에 따라 반도체학과 학생뿐만 아니라 관련 비교과 프로그램에 참여하는..",2025.08.27 18:30,https://www.fnnews.com/news/202508271830105283,파이낸셜뉴스
"부산고·주례여고, 자율형 공립고 선정… ""해양·문화 인재 육성""",,부산고등학교와 주례여자고등학교가 교육부 선정 자율형 공립고로 선정됐다. 부산시교육청은 부산고와 주례여고가 교육부 심사를 통과해 자율형 공립고 2.0(자공고 2.0) 신규 지정 학교로 최종 선정됐다고 27일 밝혔다. 자공고 2.0은 인구 감소 등 지방소멸 위기에 대응하기 위해 지역교육 활성화와 교육을 통한 지역 정주여건 개선에 목표를 두고 '교육발전특구'와 연..,2025.08.27 18:30,https://www.fnnews.com/news/202508271830007677,파이낸셜뉴스
부산시·MS '데이터센터 아카데미' 참가자 모집,,부산시는 글로벌 정보기술(IT) 기업 마이크로소프트(MS)와 협력해 추진하는 데이터센터 전문 인력 양성사업인 '마이크로소프트 데이터센터 아카데미(MS DCA)'를 9월부터 본격적으로 운영한다고 27일 밝혔다. MS 데이터센터 아카데미는 클라우드 컴퓨팅과 IT 분야 인재 양성을 목표로 하는 글로벌 교육 프로그램이다. 9월부터 1단계 그린데이터센터 전문 인력 양성 국비 지..,2025.08.27 18:29,https://www.fnnews.com/news/202508271829585886,파이낸셜뉴스
강서구·읏맨 프로배구단 '상생 발전' 맞손,,"부산 강서구와 OK저축은행 읏맨 프로배구단은 지난 26일 강서구청에서 '스포츠 진흥과 지역사회의 상생 발전을 위한 상호 협력 협약'을 체결했다고 27일 밝혔다. 이번 협약을 통해 강서구와 프로배구단은 생활체육 및 프로스포츠 발전 저변 확대, 홈경기장 발전을 위한 지원, 지역 주민의 스포츠 참여 활성화, 유소년 배구 아카데미 개설, 지역사회 특화 사회공헌 활동 ..",2025.08.27 18:29,https://www.fnnews.com/news/202508271829519342,파이낸셜뉴스
"동서대 라이즈사업단, 패션솔버톤 최우수·우수상",,"동서대학교 라이즈사업단이 2025 패션 솔버톤에서 최우수상과 우수상을 동시에 수상했다고 27일 밝혔다. 이번 대회에서 동서대는 PLSTK와 FTS 두 팀이 본선에 진출, '호텔 폐플라스틱 기반 3D 프린팅 친환경 디자인 가방 프로젝트'와 '계층적 탐지 모델 기반 의류 테이터 자동 라벨링 시스템'을 제안해 각각 최우수상과 우수상을 받았다. 권병석 기자",2025.08.27 18:29,https://www.fnnews.com/news/202508271829409480,파이낸셜뉴스
주민 갈등 푼 보배복합지구… 반년만에 사업 본궤도,,"부산진해경제자유구역청은 보배복합지구 개발사업 추진 과정에서 발생한 두동지역 주민 고충 민원과 관련, 국민권익위원회의 중재로 산업통상자원부, 창원시, 주민, 사업시행자와 함께 27일 조정서에 서명하고 최종 합의했다고 밝혔다. 이번 합의는 오랫동안 이어져 온 보배복합지구 개발사업과 두동지역 주민 간 갈등을 종식하고, 지역 발전과 상생의 기반을 마련했다는 ..",2025.08.27 18:29,https://www.fnnews.com/news/202508271829385300,파이낸셜뉴스
"AI 입는 진해신항, 글로벌 거점항만으로 도약",,부산항 진해신항 건설사업에 인공지능(AI) 기반의 항만 인프라 디지털 기술이 적용된다. 진해신항 개발은 부산항을 세계 최고 수준의 친환경·스마트 항만으로 조성하기 위해 2045년까지 약 14조원을 투입해 세계 최대 규모의 메가포트로 구축하는 것을 주요내용으로 한 정부의 '글로벌 거점항만 구축전략'의 핵심사업이다. BPA는 부산항 진해신항 하역장비 통합제..,2025.08.27 18:29,https://www.fnnews.com/news/202508271829378285,파이낸셜뉴스
부산 장애인 취업박람회… 224명 채용,,"부산시는 오는 9월 2일 오전 10시부터 오후 5시까지 시청 1층 로비, 대강당, 지하철 통로 등에서 '2025 부산 장애인 진로·취업 박람회'를 연다고 27일 밝혔다. 이번 박람회에선 시 장애인채용박람회와 장애학생 진로설계아카데미가 동시에 진행된다. 시와 시교육청이 공동으로 주최하고, 시 장애인일자리통합지원센터와 시교육청 특수교육지원센터가 주관한다. 이..",2025.08.27 18:29,https://www.fnnews.com/news/202508271829367713,파이낸셜뉴스
수많은 해전서 빛난 조선의 무기와 기술… 한반도 지켜냈다 [바다를 지킨 선조들의 흔적],,"예나 지금이나 적과 맞서 싸울 때 가장 중요한 것 중 하나는 뛰어난 무장을 갖추는 것이다. 현대 해전에서는 빠르고 멀리, 그리고 은밀하게 접근하는 군함이나 잠수함, 그리고 높은 정밀도를 갖춘 함포, 미사일, 어뢰 등을 손꼽을 수 있다. 그렇다면 고려와 조선시대 수군은 어떤 무기로 적과 맞서 싸웠을까? 고려와 조선시대의 수군에게도 현대 해군처럼 가장 중요..",2025.08.27 18:29,https://www.fnnews.com/news/202508271828391099,파이낸셜뉴스
부산항을 북극항로 거점으로… 쇄빙연구선 모항 유치 사활,,새정부 주도로 북극항로 개척을 준비하고 있는 상황에서 부산항을 쇄빙연구선 모항으로 두는 전문항만 유치 전략이 제시돼 주목된다. 부산연구원은 27일 '북극회랑 선점을 위한 차세대 쇄빙연구선 모항 부산 유치전략' 연구보고서에서 이같이 밝혔다. 이는 이재명 정부의 '북극항로 주도 해양강국 건설' 국정과제와 오는 2029년 완공을 목표하는 '차세대 쇄빙연구선 건..,2025.08.27 18:25,https://www.fnnews.com/news/202508271825166280,파이낸셜뉴스
"세정나눔재단, 모범 고교·대학생 21명에 장학금",,"세정나눔재단은 27일 오전 부산 금정구 세정그룹 본사 대강당에서 '2025년 세정나눔재단 장학금 전달식'을 가졌다고 밝혔다. 이날 장학금은 어려운 가정환경 속에서도 학업성적이 우수하고 타의 모범이 되는 고교생과 대학생을 각계에서 추천 받아 21명을 선발, 장학증서와 함께 총 2750만원의 장학금을 전달했다. 장학금은 고교생 8명에게 각 100만원, 대학생 13명에게..",2025.08.27 18:25,https://www.fnnews.com/news/202508271825149813,파이낸셜뉴스
"국힘, 인권위원 선출안 부결에 국회 보이콧 선언…與野 충돌",,[파이낸셜뉴스] 국민의힘은 27일 국회 본회의에서 자신들이 추천한 국가인권위원회 상임위원·비상임위원 선출안이 부결되자 사실상 국회를 보이콧하기로 결정했다. 국민의힘은 일각에서는 장외투쟁까지 거론되면서 정기국회가 시작부터 파행할 수 있다는 전망도 나온다. 국민의힘은 오는 28∼29일 연찬회에서 향후 투쟁 방법에 대한 의견을 모을 방침이다.국..,2025.08.27 18:39,https://www.fnnews.com/news/202508271824321794,파이낸셜뉴스
"삼성SDS, LIG넥스원 무인수상정 클라우드 단독공급",,"[파이낸셜뉴스] 삼성SDS가 국방 AI(인공지능) 시장 개척을 본격화한다.27일 업계에 따르면 삼성SDS는 LIG넥스원의 정찰용 무인수상정(USV) 개발에 활용되는 엣지 클라우드 공급 계약을 단독 수주했다. 양사는 지난해 말 계약을 맺은 이후 정식 납품 계약을 체결한 것으로 알려졌다.삼성SDS 측는 ""수주 계약이 완료됐으며 이후 공급 규모나 시기는 미공개 사안으로 수주 계..",2025.08.27 19:02,https://www.fnnews.com/news/202508271824204146,파이낸셜뉴스
"李 ""72년 한미동맹 새 장""… 한화 50억弗 투자[李대통령 필리조선소 방문]",,【 필라델피아(미국)·서울=서영준 김동호 기자】 세계 최고의 경쟁력을 자랑하는 한국 조선업이 한미동맹 강화의 핵심으로 떠오른 가운데 이재명 대통령이 26일(현지시간) 미국 펜실베이니아주 필라델피아 '한화 필리조선소'를 방문했다. 이 대통령은 방문 서명록에 '한미 조선협력의 상징인 한화 필리조선소에서 한미 동맹의 새로운 지평이 열리길 기대합니다'..,2025.08.27 18:20,https://www.fnnews.com/news/202508271820514288,파이낸셜뉴스
HD현대-미포 합병... K조선·방산 시너지,,"HD현대중공업과 HD현대미포가 전격 합병한다. 한미 조선협력 프로젝트 '마스가(MASGA·미국 조선업을 다시 위대하게)'의 본격 가동을 앞두고 글로벌 경쟁력 제고와 수주 확대 차원이다. 특히 마스가의 목표가 미 해군 함정 신조인 만큼 두 회사의 방위산업 시너지가 돋보일 것으로 관측된다. HD한국조선해양과 HD현대중공업, HD현대미포는 27일 각각 이사회를 개최..",2025.08.27 18:20,https://www.fnnews.com/news/202508271820492577,파이낸셜뉴스
"""회계부정 과징금 2배 이상 늘린다""",,"금융당국이 분식회계 등 중대 회계부정의 과징금을 최대 2배 이상으로 확대하고 주도·지시한 실질 책임자에 대해 과징금 부과 근거를 신설한다. 27일 증권선물위원회는 제15차 정례회의를 열고 이 같은 '회계부정 제재 강화방안'을 확정했다. 이번 방안은 이재명 대통령이 지난 7월 기자간담회에서 ""주가조작이나 허위공시 같은 부정경쟁 요소를 확실히 제거..",2025.08.27 18:20,https://www.fnnews.com/news/202508271820482105,파이낸셜뉴스
금융권·기관까지 파고든 랜섬웨어… 올 들어 벌써 5000건 피해 [급증하는 랜섬웨어 공포],,"예스24, SGI서울보증, 웰컴금융그룹까지 잇따라 랜섬웨어 공격을 당하는 등 국내 주요 기업·기관의 랜섬웨어 감염 사례가 급증하고 있다. 해외에서도 올해 들어 랜섬웨어 피해 사례가 벌써 5000건을 넘어서면서 사이버 보안 우려가 고조되고 있다. 27일 랜섬웨어 추적 사이트 랜섬웨어닷라이브에 따르면 이날 기준 전 세계 기업 및 기관 랜섬웨어 피해건수는 올해 누적 ..",2025.08.27 18:20,https://www.fnnews.com/news/202508271820455619,파이낸셜뉴스
"BTS 지민과 송다은 사랑 응원? ""흔들림없이, 단단해지길""",,"[파이낸셜뉴스] 방탄소년단 지민이 열애설을 인정한 것은 아니지만, 배우 송다은 팬이 성명문을 통해 둘의 사랑을 응원하고 나섰다.지난 2022년부터 지민과 열애설이 난 송다은은 27일 지민의 얼굴이 나온 동영상을 온라인상에 공개했다 빠르게 삭제했다. 이를 통해 그동안 불거졌던 '셀프 열애설'에 자신만의 방식으로 종지부를 찍었다.지민의 입장 발표가 따로 없는 가운데, ..",2025.08.27 18:31,https://www.fnnews.com/news/202508271820185693,파이낸셜뉴스
콜마홀딩스 '신규 이사 10명' 주주제안 수용… 주총 분수령,,"콜마비앤에이치 경영권을 둘러싸고 대립 중인 윤상현 콜마홀딩스 부회장과 아버지인 창업주 윤동한 회장간 부자갈등이 극한을 피했다. 윤 부회장이 콜마홀딩스 신규 이사 선임 안건을 요구한 윤 회장의 주주제안을 수용키로 하면서 공은 임시주주총회로 넘어갔다. 콜마홀딩스와 윤 부회장은 ""이사회 제도의 취지를 훼손할 수 있다는 우려에도 불필요한 법정 다툼..",2025.08.27 18:19,https://www.fnnews.com/news/202508271820048331,파이낸셜뉴스
"기보, 6대 지역거점은행 손잡고 지역 전략산업 육성",,"기술보증기금은 부산 본점에서 경남은행, 광주은행, 부산은행, 아이엠뱅크, 전북은행, 제주은행 등 6대 지역거점은행과 함께 '대한민국 기술주도 균형성장을 위한 지역은행과의 생산적 금융지원 업무협약'을 체결했다고 27일 밝혔다. 이번 협약은 지역 소멸 위기에 대응하고 새로운 성장 동력을 창출하기 위해 마련됐다. 참여 기관들은 협력체계를 구축해 지역 벤처&middo..",2025.08.27 18:19,https://www.fnnews.com/news/202508271820015339,파이낸셜뉴스
"소진공 노사, 전주 전통시장 방문... 상인회에 쿨링키트 50세트 전달",,"소상공인시장진흥공단은 지난 26일 전주 신중앙시장에서 상인들의 여름철 온열질환 예방과 소비 활성화를 위한 노사합동 환경·사회·지배구조(ESG) 활동을 실시했다고 27일 밝혔다. 이번 활동은 소진공이 매월 지역별로 여는 '소곤소곤 간담회'와 연계해 마련됐다. 노동조합과 임직원 20여명이 참여했으며, 임직원의 자발적 급여 공제로 조성된 상생기금으로..",2025.08.27 18:19,https://www.fnnews.com/news/202508271819593902,파이낸셜뉴스
비뇨기질환 ‘단일공 로봇수술’ 확대,,비뇨기질환 수술에서 '단일공(single port)' 로봇수술이 국내에서 빠르게 확산하고 있다. 27일 의료계에 따르면 '최소 침습' 수술에 대한 환자들의 선호가 높아지는 가운데 국내에서는 세계 최초·국내 최초 수술법이 잇따라 개발돼 임상 성과를 내고 있으며 국제 학계에서도 공인을 받고 있다. 전립선암과 신장암은 고령화와 생활습관 변화로 환자 수가 꾸준히 ..,2025.08.27 18:19,https://www.fnnews.com/news/202508271819530457,파이낸셜뉴스
소상공인 고용보험료 지원대상 7만명으로 늘린다,,중소벤처기업부가 자영업자 고용보험 가입을 촉진하기 위해 보험료 80% 지원 대상을 5년간 2배 이상으로 대폭 확대한다. 또한 노란우산공제 가입자가 자연재해 관련 보험에 가입하면 보험료 자부담를 최대 전액 보장하기로 했다. 27일 중기부는 이같은 내용의 '소상공인 보험·공제 강화방안'을 발표했다. 먼저 중기부는 고용보험료 지원 사업 규모를 현행 3만명..,2025.08.27 18:19,https://www.fnnews.com/news/202508271819434349,파이낸셜뉴스
"세라젬, 척추관리 ‘마스터 V 컬렉션’ 완성",,세라젬이 척추 관리 의료기기 라인업 '마스터 V 컬렉션'을 완성했다. 세라젬은 지난 26일 최상위 모델 '마스터 V11'을 출시하며 V4·V7·V9에 이어 풀 라인업을 갖췄다고 27일 밝혔다. 세라젬은 1998년 설립 이후 척추 관리 의료기기를 중심으로 기술력과 노하우를 축적해왔다. 이번 컬렉션 완성은 다양한 고객층의 요구에 맞춰 세분화된 척추 관리 솔루션..,2025.08.27 18:19,https://www.fnnews.com/news/202508271819385464,파이낸셜뉴스
"""아이들만을 위한 숏폼 놀이터… 다양한 재능 발굴할 도구로"" [C리즈]",,"""아이들이 재능을 뽐내고 새로운 것을 배울 수 있는 숏폼 놀이터를 만들고 싶습니다."" 이혜림 키즐링 대표(사진)는 27일 ""두 돌 된 딸에게 '유튜브 키즈'를 틀어줬는데 유령 영상을 보고 울면서 달려온 적이 있다""며 ""성인들이 보는 콘텐츠에서 아이들이 볼 수 있는 것만 정제하는 것은 한계가 있다. 애초부터 아이들만 대상으로 한 플랫폼이 ..",2025.08.27 18:19,https://www.fnnews.com/news/202508271819311763,파이낸셜뉴스
3배 커진 인천공항 '샤넬 듀플렉스 부티크',,"신라면세점이 인천국제공항 제2여객터미널에 복층 구조 '샤넬 듀플렉스 부티크(사진)'를 열었다고 27일 밝혔다. 지난 22일 문을 연 샤넬 듀플렉스 부티크는 신라면세점이 샤넬과 협업해 국내 공항에 처음 선보이는 복층 매장이다. 제2여객터미널 내 유일한 샤넬 매장이기도 하다. 개장 기념식에는 한인규 호텔신라 운영총괄, 클라우스 올데거 샤넬코리아 대표이사, 김창..",2025.08.27 18:19,https://www.fnnews.com/news/202508271819265017,파이낸셜뉴스
"무신사, 하반기 中 시장 진출... 안타 스포츠와 합작법인 설립",,"무신사는 중국 최대 규모 스포츠웨어기업인 안타 스포츠와 손잡고 중국 시장 공략에 나선다. 무신사는 안타 스포츠와 중국에 합작법인 '무신사 차이나(MUSINSA China)'를 설립하고 공동 투자를 한다고 27일 밝혔다. 이번 투자는 중국 규제 당국의 승인 절차를 거쳐 다음 달 완료될 예정이다. 무신사는 합작법인 지분 60%를 보유하며 최대 주주 지위를 갖고, 안타 스포츠가..",2025.08.27 18:19,https://www.fnnews.com/news/202508271819256268,파이낸셜뉴스
"""경북 안동, 국내 증류수 산업 메카... 나라소주 'K소주 대표’로 키울 것""",,"【 안동(경북)=김서연기자】""세계적인 양조장은 단순히 양조의 단계를 넘어 관광, 지역 음식과 융합으로 나아가고 있는 만큼, 대한민국 정신 문화의 중심인 경북 안동을 국내 증류주 산업의 메카로 만들겠다."" 마승철 나라셀라·소주스토리 대표이사 회장은 27일 경북 안동에서 열린 '소주스토리 안동 신공장' 착공식에서 ""K컬처, K푸드와 함께하..",2025.08.27 18:19,https://www.fnnews.com/news/202508271819236398,파이낸셜뉴스
SPC 생산직 새 근무제 한달 당긴다… 9월부터 시행,,"SPC그룹이 각 계열사 별로 생산직 근무제도를 개편해 다음달 1일부터 시범 운영한다. 이는 시화공장 사망사고를 계기로 10월부터 시행하기로 했던 당초 계획을 한달 앞당긴 것이다. SPC그룹은 전 계열사 생산 현장에서 야간 8시간 초과 근무를 없애고, 3조 3교대(SPC삼립·샤니)를 도입하거나 중간조를 운영(SPL·비알코리아)한다고 27일 밝혔다. 중간조는 야..",2025.08.27 18:19,https://www.fnnews.com/news/202508271819229492,파이낸셜뉴스
AI바이오산업 날개… 특허출원 톱3 예고,,"글로벌 인공지능(AI) 바이오 시장에서 한국이 약진하고 있다는 분석이 나왔다. AI바이오테크 시장규모가 향후 5년간 글로벌 수준인 연평균 19% 이상 성장하고, AI바이오 특허출원은 중국과 미국에 이은 세계 3위로 나타났다. 27일 서울 코엑스에서 열린 세계바이오제약산업전시회에서 과학기술정보통신부가 발표한 'AI바이오 확산전략'에 따르면 글로벌 AI 바이오 시장은 ..",2025.08.27 18:18,https://www.fnnews.com/news/202508271819046920,파이낸셜뉴스
치료용 나노로봇 등 기술 도약 지름길… 출연硏 국제협력 박차,,#. 움직임이 둔했던 쥐가 자연스럽게 운동을 시작한다. 뇌신경 회로를 정밀 타깃하는 나노로봇 과학기술을 통해서다. 막스 플랑크 지능 시스템 연구소(MPI-IS)와 카를스루에 공과대학(KIT)의 과학자들은 사람 머리카락보다 2000배 작은 크기의 신경 장치를 개발해 생쥐의 뇌에 주입했다. 일종의 나노 전극이다. 이 전극들은 자기장 신호를 전기장으로 바꿔준다. 발생한 ..,2025.08.27 18:18,https://www.fnnews.com/news/202508271818580145,파이낸셜뉴스
"[기고] 케카헌, K-포뮬러로 기후 기술 시대 열다",,"케이팝데몬헌터즈(K-Pop Demon Hunters, 케데헌)가 치밀한 세계관과 매혹적인 퍼포먼스로 전 세계인의 감성에 거대한 물결을 일으키고 있다. 이제 이 성공의 기세를 몰아, 인류의 생존을 위협하는 기후 기술 분야에서도 거대한 반향을 일으키고 대한민국의 새로운 경제 도약을 이끌어야 한다. 그 담대한 서사의 주인공은 바로 '케이씨티카본헌터즈(K-CT Carbon Hunters, 케카헌..",2025.08.27 18:18,https://www.fnnews.com/news/202508271818553230,파이낸셜뉴스
"고용부, 임금체불 전용창구 운영... 추석 앞두고 6주간 집중 청산 지도",,"고용노동부는 다가오는 추석 명절에 대비해 오는 29일부터 10월 2일까지 6주간 '임금체불 집중 청산 지도기간'을 운영한다고 27일 밝혔다. 올해는 운영 기간을 2배로 확대(기존 3주→6주)하고, 체불 발생 시에는 '신속하게, 선제적으로, 엄정하게' 대응한다는 것이 특징이다. 먼저 임금체불 피해를 손쉽게 신고할 수 있도록 전용 창구를 운영한다. 노동포털에 임금체불 신..",2025.08.27 18:17,https://www.fnnews.com/news/202508271817536000,파이낸셜뉴스
'빈곤층 족쇄' 부양기준 없앤다... 빈틈없는 AI 복지 안전망 구축,,"지난 2014년 2월 서울 송파구의 한 단독주택 지하 1층에서 생활고에 시달리다 지친 60대 어머니와 30대 두 딸이 스스로 목숨을 끊는 사건이 발생했다. 이들은 ""죄송하다. 마지막 집세와 공과금을 내고 간다""는 유서 쪽지를 남겼다. 복지의 사각지대에 놓여 방치된 이들의 죽음에 온 국민은 공분했고 슬퍼했다. 이후 정부가 여러 대책을 내놓고 취약계층을 찾아 ..",2025.08.27 18:17,https://www.fnnews.com/news/202508271817523924,파이낸셜뉴스
상반기 출생아 증가율 '역대 최대'… 올 출산율 0.8명 청신호,,"지난해 9년 만에 출생아 수와 출산율이 반등하며 인구절벽에 일시적 숨통이 트였다. 올해는 연간 출산율이 0.8명대에 진입할 가능성도 제기된다. 하지만 전체 출생아의 6%가 혼인 외 출산일 만큼 가족 구조 변화가 뚜렷하고, 첫째아 편중과 고령 출산 등 구조적 저출산 문제는 여전히 심각한 상황이다. 전문가들은 정부가 지금처럼 인구 문제를 '미래 과제' 수준으로 인..",2025.08.27 18:17,https://www.fnnews.com/news/202508271817508547,파이낸셜뉴스
기업 경쟁력의 새로운 기준으로... 친환경서 찾은 지속성장의 해답[브랜드 신뢰 높이는 친환경 경영],,"친환경 경영은 지속가능한 경영을 위해 기업들이 갖춰야 할 필수요건으로 자리 잡았다. 주요 기업들은 친환경 경영을 통해 기후위기를 극복하고 순환경제를 구축해 지속가능한 성장을 위한 기반을 마련한다는 전략이다. 실제 국내외에서는 탄소배출권 거래제와 탄소세 도입을 비롯한 탄소배출 규제뿐만 아니라 재활용 및 폐기물 처리 규제, 환경·사회·지..",2025.08.27 18:16,https://www.fnnews.com/news/202508271816537129,파이낸셜뉴스
