title,thumbnail,short_content,write_time,link,company
"'대전 초등생 살해' 교사, 6개월간 80일 넘게 조퇴·병가 반복",,"[파이낸셜뉴스]  고 김하늘 양 살해 혐의를 받는 가해 교사가 작년 하반기에만 8차례에 걸쳐 80일 넘게 조퇴와 병가를 반복한 것으로 확인됐다.13일 MBC 보도에 따르면 가해 교사 A씨는 지난해 7, 8월엔 각각 한 번씩, 9월엔 두 차례 조퇴를 했다. 10월 들어선 7일 하루와 10일과 11일 이틀 병가를 낸 뒤, 14일부턴 56일간 병가에 들어갔다.병가에서 돌아온 다음 날엔 6개..",2025.02.14 06:32,https://www.fnnews.com/news/202502140622194221,파이낸셜뉴스
"전한길 ""헌재, 탄핵 인용 시 역사 속으로 사라질 것""",,"[파이낸셜뉴스] 윤석열 대통령을 공개 지지하는 '한국사 강사' 전한길씨(55)가 ""대통령 탄핵이 인용되면 헌법재판소는 역사 속으로 사라질 것""이라고 주장했다.전씨는 지난 13일 오후 6시 서울 중구 청계광장에서 열린 '윤석열 대통령 국민변호인단 출범식'에 참석했다. 전씨는 이날 현장에서 연사로 나섰다.전씨는 ""지금 대한민국이 무너지느냐, 다시 일어나느..",2025.02.14 06:14,https://www.fnnews.com/news/202502140602229577,파이낸셜뉴스
"[속보] [뉴욕증시] 상호관세 연기에 일제히 상승...테슬라, 5.9% 급등",,[파이낸셜뉴스]  dympna@fnnews.com 송경재 기자,2025.02.14 06:00,https://www.fnnews.com/news/202502140559249918,파이낸셜뉴스
"테슬라차 구매하려던 美 국무부, 논란되자 계획 철회했다",,【실리콘밸리=홍창기 특파원】 미국 트럼프 2기 정부의 '정부효율부'(DOGE)를 이끌고 있는 일론 머스크의 이해충돌 가능성이 현실이 됐다. 미 국무부가 테슬라와 자동차 납품 계약을 맺을 가능성이 제기됐고 논란이 커지자 국무부는 이 계획을 보류했다. 머스크는 국무부에서 해당 계약을 체결할 일이 없을 것이라며 선을 그었다.13일(현지시간) 뉴욕타임스(NYT)와 더힐 등에 ..,2025.02.14 06:01,https://www.fnnews.com/news/202502140544202579,파이낸셜뉴스
"""딥시크가 로또 번호 알려줘 당첨""…中 복권사업자 '발칵'",,"[파이낸셜뉴스]  중국의 한 네티즌이 생성형 인공지능(AI) 딥시크를 이용해 로또에 당첨됐다는 글을 올린 뒤 루머가 확산하자 로또 사업자 측이 번호 예측은 불가능하다며 해명에 나섰다.14일 베이징청년보 등 중국 매체들에 따르면, 중국 안후이성 우후시의 리모씨는 지난 11일 오전 웨이보(微博·중국판 엑스)에 “딥시크가 추천한 숫자대로 로또를 구매했더니 당..",2025.02.14 05:47,https://www.fnnews.com/news/202502140537436646,파이낸셜뉴스
"트럼프 결국 상호 관세 서명, 한미 FTA 체결한 한국도 못피한다",,【실리콘밸리=홍창기 특파원】 미국과 자유무역협정(FTA)을 체결한 한국도 트럼프 2기 정부의 상호관세 부과의 대상이 될 가능성이 생겼다. 도널드 트럼프 미국 대통령이 13일(현지시간) 각국의 관세 및 비관세 장벽을 두루 고려해 '상호 관세'를 세계 각국에 부과하기로 결정했다고 발표하면서다. 상호 관세는 각국이 미국 상품에 적용하는 관세율만큼 미국도 상대국 상..,2025.02.14 06:00,https://www.fnnews.com/news/202502140537062449,파이낸셜뉴스
"野회유 폭로한 김현태 707단장, 민주당이 증인명단서 뺐다",,"[파이낸셜뉴스] 곽종근 전 특수전사령관이 더불어민주당 의원들로부터 회유를 당한 정황을 밝힌 김현태 707특수임무단장이 비상계엄 진상규명 국정조사 특별위원회 청문회 증인에서 제외됐다.민주당에서 정쟁이 될 수 있다는 이유로 김현태 단장을 증인에서 제외한 것으로, 당초 김 단장은 여야가 동시에 신청했던 증인이었다.결국 야당에 불리한 진술을 했다는 이유로 김 단장..",2025.02.14 06:00,https://www.fnnews.com/news/202502140522298656,파이낸셜뉴스
전두환 사진으로 광주FC 도발한 中관중들… 국내 팬들 '분노',,[파이낸셜뉴스] 프로축구 K리그1 광주FC가 산둥 타이산(중국)과의 아시아축구연맹(AFC) 엘리트(ACLE) 원정경기에서 현지 팬들이 광주시를 조롱하고 비하했다며 강력 대응에 나선다고 밝혔다.광주는 “지난 11일 ACLE 7차전 원정 경기에서 발생한 산둥 팬의 도발에 강력 대응에 나설 것”이라고 13일 강조했다.광주 구단에 따르면 지난 11일 중국 올림픽 스포츠센터에서 열린 광..,2025.02.14 05:36,https://www.fnnews.com/news/202502140519292461,파이낸셜뉴스
"""수거 대상 이준석입니다""...'사살' 담긴 '노상원 수첩'에 '개탄'",,[파이낸셜뉴스] 이준석 개혁신당 의원은 12·3 비상계엄을 사전 모의한 혐의로 재판에 넘겨진 노상원 전 국군 정보사령관의 수첩에 자신이 ‘체포 대상’으로 적혀 있었다는 보도에 “개탄스럽고 당혹스럽다”고 토로했다.이 의원은 13일 오후 자신의 사회관계망서비스(SNS)에 “안녕하세요. 수거 대상 이준석입니다”라며 이 같은 글을 남겼다.이어 “윤석열 대통령한테..,2025.02.14 05:18,https://www.fnnews.com/news/202502140508254714,파이낸셜뉴스
"트럼프, 상호관세 행정명령...관세 부과는 4월 이후로",,[파이낸셜뉴스]  도널드 트럼프 미국 대통령이 13일(현지시간) ‘상호관세(reciprocal tariff)’ 행정명령에 서명했다.각 부처가 상호관세 부과를 위해 조사에 나설 것을 지시했다.다만 곧바로 상호관세를 물리는 조처는 없었다. 속도 조절과 함께 협상 여지를 남겨둔 것으로 보인다.상호관세 속도 조절에 힘입어 뉴욕 증시 3대 지수는 일제히 상승했다.CNBC 등 외신에 따..,2025.02.14 04:50,https://www.fnnews.com/news/202502140444422391,파이낸셜뉴스
"이수페타시스, M&A 철회에 목표주가 3.5만→5.3만-BNK",,"[파이낸셜뉴스] BNK투자증권은 14일 이수페타시스의 목표주가를 3만5000원에서 5만3000원으로 높였다. 이차전지 소재 기업 제이오와의 주식 매매계약과 신주 인수 계약을 철회, 밸류에이션 할인요소가 해소됐다는 판단이다. 이민희 연구원은 ""이수페타시스의 올해 영업이익 전망치를 9% 상향수정하고, 유상증자를 통한 M&A(인수합병) 계획이 철회돼 목표주..",2025.02.14 04:36,https://www.fnnews.com/news/202502140421407772,파이낸셜뉴스
"""탄핵 이르게 하는 에이스네""..윤석열도 황급히 말린 '버럭' 변호인",,"[파이낸셜뉴스] 윤석열 대통령이 탄핵 심판 8차 변론에서 문형배 헌법재판소장 권한대행에게 법적 근거를 따져 물은 자신의 변호사를 말리는 모습이 포착됐다.13일 윤 대통령은 증인으로 출석한 조태용 국가정보원장을 직접 신문할 수 있게 해달라고 재판부에 요청했다. 이에 문형배 헌재소장 권한대행은 ""(질문 내용을) 적어주십시오""라며 윤 대통령이 질문을 ..",2025.02.14 05:50,https://www.fnnews.com/news/202502132151033591,파이낸셜뉴스
"하마스 ""이스라엘 인질 3명, 예정대로 석방할 것""",,"[파이낸셜뉴스]  팔레스타인 무장정파 하마스가 이스라엘 인질을 예정대로 석방하겠다고 밝혔다.13일(현지시간) AP통신 등에 따르면 하마스는 성명을 통해 ""15일 이스라엘 국적의 가자 억류 인질 3명을 추가로 석방하는 등 휴전 합의안을 계속 실천할 것""이라고 밝혔다.다만 하마스의 입장에 대한 이스라엘의 공식 입장은 아직 나오지 않았다.앞서 하마스..",2025.02.14 06:00,https://www.fnnews.com/news/202502132149213177,파이낸셜뉴스
김채연·차준환 짜릿한 역전 우승... AG 남녀 피겨 싱글 금메달 싹쓸이 [하얼빈AG],,김채연(수리고)과 차준환(고려대)이 짜릿한 역전 우승으로 금메달을 획득하며 다시 한번 한국 피겨 역사에 큰 획을 그었다. 차준환과 김채연은 13일 열린 2025 하얼빈 동계 아시안게임 피겨스케이팅 남녀 싱글 종목에서 나란히 금메달을 따냈다. 김채연은 이날 중국 하얼빈 헤이룽장 빙상훈련센터 다목적홀에서 열린 대회 프리스케이팅에서 일본의 '세계 최강' 사카모토 가오리..,2025.02.13 21:33,https://www.fnnews.com/news/202502132133415846,파이낸셜뉴스
"與 ""야당의 예산·입법 폭거""… 野 ""계엄으로 경제 무너져""",,"여야가 13일 이틀차를 맞은 대정부질의에서도 작금 경기침체와 관련해 서로 예산삭감 및 입법폭거 책임론과 비상계엄 책임론을 주고받았다. 특히 여당은 이날 35조원 '슈퍼추경 카드'를 꺼내 든 야당을 향해 ""후안무치""하다고 질타했고, 계엄으로 경제가 무너졌다고 주장한 야당은 윤석열 대통령 탄핵으로 경제를 회복해야 한다고 주장했다. 이 외에도 여야는..",2025.02.13 21:22,https://www.fnnews.com/news/202502132122076162,파이낸셜뉴스
이재명·김경수 회동… 당 통합 공감,,"이재명 더불어민주당 대표가 13일 친문(친문재인)계 적자로 불리는 김경수 전 경남도지사와 만나 ""함께 손잡고 가길 기대한다""며 당 통합 의지를 밝혔다. 최근 민주당으로 복당한 김 전 지사는 당내 대권 주자로 꼽히고 있다. 이 대표는 조기 대선 가능성이 높아지는 가운데 비명계를 끌어안아 내부갈등 조짐을 불식하고 통합 행보에 나서겠다는 복안이다. 이 ..",2025.02.13 21:22,https://www.fnnews.com/news/202502132122040884,파이낸셜뉴스
35조 '슈퍼 추경' 꺼낸 野... 이재명표 민생쿠폰 13조,,"더불어민주당이 민생회복과 경제성장을 내걸고 총 35조원 규모의 슈퍼 추가경정예산안을 발표했다. 경제악화 상황에서 먼저 당 자체 추경안을 마련, 국민의힘에 요구하며 정국 주도권을 잡겠다는 전략이다. 다만 추경안에 이재명 민주당 대표의 역점사업인 '전 국민 25만원 민생회복지원금'이 포함됨에 따라 여야 협의는 불투명할 것으로 전망된다. 진성준 민주당 정책..",2025.02.13 21:22,https://www.fnnews.com/news/202502132121576458,파이낸셜뉴스
"오세훈 ""한동훈과 연대설? 왜 나오는지 도저히 이해할 수 없어..사실무근""",,"[파이낸셜뉴스]  오세훈 서울시장이 조기 대선이 치러질 경우 자신과 한동훈 전 국민의힘 대표와의 연대설에 대해 ""왜 연대설이 나오는지 도저히 이해할 수 없다""고 선을 그었다.13일 오 시장은 MBN 뉴스와이드에 출연해 '정치권 일각에서 오 시장과 한 전 대표가 잠재적으로 지지층이 겹친다. 그래서 연대설을 꺼내는 목소리가 나온다'라는 진행자의 질문..",2025.02.14 05:40,https://www.fnnews.com/news/202502132116473723,파이낸셜뉴스
"""계엄은 불가피, 헌재 못 믿어""...'대통령 국민변호인단' 출범식",,"[파이낸셜뉴스] 윤석열 대통령의 탄핵을 반대하는 시민 모임인 '대통령 국민변호인단'(국민변호인단)이 13일 오후 서울 종로구 청계광장에서 출범식을 열고 윤 대통령이 지난해 12월 3일에 선포한 비상계엄령을 '계몽령'이라고 주장했다. 유명 한국사 강사 전한길씨는 ""헌법재판소가 탄핵을 인용한다면 역사 속으로 사라질 것""이라고 경고했다.이날 출범식에는 경찰 ..",2025.02.13 22:01,https://www.fnnews.com/news/202502132115369774,파이낸셜뉴스
"대법원, 'MBN 6개월 업무정지' 취소...방통위 패소 확정",,방송통신위원회가 종합편성채널 MBN(매일방송)에 내린 6개월 업무정지 처분을 대법원이 취소했다.13일 법조계에 따르면 대법원 2부(주심 박영재 대법관)는 이날 MBN이 방통위를 상대로 낸 업무정지 등 처분 취소 소송에서 원심인 원고 승소 판결을 확정했다.앞서 방통위는 지난 2020년 10월 MBN이 자본금을 불법 충당해 방송법을 위반했다는 이유로 6개월 업무정지 처분을 내렸..,2025.02.13 20:28,https://www.fnnews.com/news/202502132023195687,파이낸셜뉴스
"세종지역 공공기관 홍보協, 2025년 제1차 정기회의 개최",,"[파이낸셜뉴스] 세종지역 공공기관 홍보협의회(회장 오의택)는 13일 세종시청 5층 집현실에서 2025년 제1차 정기회의를 개최했다고 밝혔다. 이날 정기회의는 세종시, 세종경찰청, 세종시교육청, 시청자미디어재단 세종시청자미디어센터, 세종충남대병원, 중소기업기술정보진흥원, 경제인문사회연구회, 한국교통연구원, 한국보건사회연구원, 한국수목원정원관리원 등 ..",2025.02.13 20:25,https://www.fnnews.com/news/202502132016197855,파이낸셜뉴스
"수방사 경비단장 ""이진우 수방사령관, 국회 들어가 의원들 끌어내라 지시""",,[파이낸셜뉴스]  조성현 수도방위사령부 제1경비단장(대령)이 '12·3 비상계엄' 사태 당시 병력을 출동시킨 이진우 전 수도방위사령부 사령관으로부터 국회에 들어가 의원들을 끌어내라는 지시를 받았다고 증언했다.13일 조 단장은 윤석열 대통령 탄핵심판 8차 변론에 증인으로 출석해 '(계엄 당일) 0시31분부터 1시 사이 수방사령관으로부터 국회 본청 내부에..,2025.02.13 20:15,https://www.fnnews.com/news/202502132007266410,파이낸셜뉴스
"""장원영, 김하늘양 조문하면 안된다""…개혁신당 천하람 만류한 이유",,"[파이낸셜뉴스] 대전의 한 초등학교에서 여교사에게 살해된 김하늘(8)양의 부친이 그룹 아이브 장원영에 조문을 부탁해 구설에 오른 가운데, 장원영이 하늘양의 빈소를 찾으면 안 된다는 주장이 정치권에서 나왔다.13일 천하람 개혁신당 원내대표 겸 당대표 권한대행은 국회에서 열린 최고위원회의에서 ""하늘 양이 좋아했던 아이돌의 조문 여부를 두고 여러 갑론을박이 있..",2025.02.14 05:30,https://www.fnnews.com/news/202502132000397194,파이낸셜뉴스
"일반 분만보다 몸 더 상하는 유산… 동의보감서도 ""산후조리의 10배 조치 필요"" [한의사 曰 건강꿀팁]",,"임신과 출산은 질병이 아니다. 하지만 ""정말 죽다 살아났다""는 말이 나올 정도로 몸과 마음이 힘든 시기임에는 틀림이 없다. 그렇기 때문에 실제 이 과정을 거친 이후에, 예전과 다르게 건강 상태가 악화되는 경우가 많다. 따라서 산후조리는 '선택이 아니라 필수'라고 할 수 있는데, 간혹 이때 이후로 체질이 바뀌었다는 사람들은 이러한 산후조리가 덜되었..",2025.02.13 19:50,https://www.fnnews.com/news/202502131949599331,파이낸셜뉴스
당뇨 걱정되세요? 홍삼 드세요! [Weekend 헬스],,"홍삼이 효과적으로 혈당을 조절할 수 있다는 임상연구 결과가 나왔다. KGC인삼공사 R&D본부 천연물효능연구소는 당뇨 전 단계 성인이 홍삼을 섭취하면 특이반응 없이 안전하고 효과적으로 혈당을 조절한다는 연구결과를 13일 발표했다. 이번 연구결과는 국제학술지 'Medicine' 최근호에 게재됐다. 홍삼을 섭취하면 공복혈당, 식후혈당, 3개월 평균혈당(당화혈색소),..",2025.02.13 19:49,https://www.fnnews.com/news/202502131949524498,파이낸셜뉴스
눈앞 아득해지면서 '핑글'… 뇌·심장이 보내는 이상신호일수도 [Weekend 헬스],,어지러움은 누구나 한 번쯤 겪는 흔한 증상이다. 특히 실내외 온도차가 커지는 겨울에는 자율신경조절 기능에 문제가 생겨 어지럼증을 호소하는 환자가 많아진다. 대수롭지 않게 여기는 경우가 많지만 원인과 양상이 다양해 진단과 치료가 어려운 병이기도 하다. 전문가들은 13일 어지럼증은 자가 진단에 의존하지 말고 신경과 진료를 통해 정확한 진단과 치료를 받아야..,2025.02.14 04:00,https://www.fnnews.com/news/202502131949496552,파이낸셜뉴스
올 겨울은 클래식 무드로 ‘모카 무스'에 물든 패션템 [Weekend 스타일],,팬톤이 2025년 올해의 컬러로 선정한 '모카 무스(Mocha Mousse)'가 패션계를 물들이고 있다. 초콜릿과 커피를 연상시키는 따뜻하고 차분한 브라운 톤의 모카 무스는 다양한 피부 톤에 어울리는 고급스럽고 세련된 색감으로 주목받고 있다. 최근 출시되는 아이템마다 뜨거운 반응을 얻으며 2025년 초부터 패션 트렌드의 중심에 섰다. 팬톤이 기존에 선정해 온 화려하고 ..,2025.02.14 04:00,https://www.fnnews.com/news/202502131946463631,파이낸셜뉴스
"정화와 재생의 순간, 불타오른 청도천 [Weekend 문화]",,"【청도(경북)=유선준 기자】 ""작품의 기본적 개념은 '순환'입니다. 베니스 전시의 작품을 태우는 것은 지나간 과거를 없애고, 새롭게 시작한다는 의미가 있습니다."" 정월 대보름인 지난 12일 오후 5시, 경상북도 청도의 청도천. 해가 떨어지고 땅거미가 내려앉자 화약 터지는 소리와 함께 청도천의 9917㎡ 규모 작은 섬 곳곳에 화염이 오르고 불꽃과 연기가 피어올랐..",2025.02.14 04:00,https://www.fnnews.com/news/202502131943079032,파이낸셜뉴스
강남에 들어서는 1200석 공연장… 입체적 예술경험 펼쳐진다 [Weekend 문화],,"""새로운 감각을 깨우는 동시에 장르의 경계를 넘어선 예술의 경험이 입체적으로 펼쳐지는 곳으로서 새로운 문화의 흐름을 만드는 공간이 되길 바랍니다."" 박선희 GS문화재단 대표(사진)는 지난 11일 서울 강남구 GS타워 오픈홀에서 열린 기자간담회에서 오는 4월 24일 개관하는 GS아트센터의 운영 목표에 대해 이같이 밝혔다. 박 대표는 ""강남 한복판인..",2025.02.13 06:00,https://www.fnnews.com/news/202502131942565122,파이낸셜뉴스
"""왜 이런 애 불러 자선행사하냐""..쯔양 저격한 '구제역' 변호사",,"[파이낸셜뉴스] 먹방 유튜버 쯔양(27·본명 박정원)이 지자체의 자선 행사에 나선 것을 두고 유튜버 '구제역'의 변호를 맡았던 변호사가 ""아이들 교육상에 안 좋다""고 저격했다.김소연 변호사는 지난 12일 SNS에 쯔양이 대전 동구에서 자선 바자회에 참여한다는 내용의 현수막 사진을 올리며 ""동구청은 왜 이런 애를 불러다 행사를 하는지, 이 친구한테 ..",2025.02.14 05:20,https://www.fnnews.com/news/202502131941298692,파이낸셜뉴스
쪄먹고 비벼먹고 끓여먹고… 속 꽉 찬 대게가 '푸지게 한상' [Weekend 레저],,"【울진(경북)=정순민 기자】 ""니들이 게 맛을 알아?"" 헤밍웨이의 소설 '노인과 바다' 속 주인공처럼 분장한 원로배우 신구가 커다란 게를 베고 누워 이렇게 말한다. 2000년대 초반 인기를 모았던 롯데리아 게살버거 광고의 한 장면이다. 게맛을 실컷 볼 수 있는 축제가 열린다. 오는 28일부터 내달 3일까지 경북 울진 후포항 일대에서 열리는 '울진대게와 붉은대게 ..",2025.02.14 04:00,https://www.fnnews.com/news/202502131939217385,파이낸셜뉴스
'울진대게축제' 올해는 기차 타고 가볼까 [Weekend 레저],,경상북도 북부 지역은 흔히 교통 오지로 통한다. 울진 등 경북 동해안권도 사정은 마찬가지다. 하지만 올해부터 이들 지역의 교통 사정이 좋아졌다. 강원도 강릉에서 부산까지 이어지는 동해선 ITX가 완전 개통하면서다. 이에 발맞춰 코레일관광개발이 기차를 이용해 '2025 울진대게축제'를 다녀올 수 있는 여행 상품을 내놨다. 특히 이번 상품은 수도권뿐만 아니라 부산&middo..,2025.02.13 19:39,https://www.fnnews.com/news/202502131939147835,파이낸셜뉴스
대만 타이중 백화점서 폭발 사고..최소 4명 사망,,"[파이낸셜뉴스]  대만 중부 타이중의 한 백화점에서 가스 폭발 사고가 일어나 최소 4명이 숨지고 26명이 다쳤다.13일 대만 중앙통신사 등에 따르면 이날 오전 11시33분께 공사 중이던 타이중 신광 미츠코시백화점 12층에서 원인을 알 수 없는 가스 폭발이 발생했다. 폭발 당시 같은 층에 있던 사람들이 창문 밖으로 날아갈 정도로 위력이 컸던 것으로 알려졌으며, 백..",2025.02.14 04:35,https://www.fnnews.com/news/202502131938317209,파이낸셜뉴스
"'SG발 주가조작' 라덕연 징역 25년…""유례없는 대규모 시세조종""",,"[파이낸셜뉴스] SG(소시에테제네랄)증권발 주가 폭락 사태의 핵심 인물로 지목돼 구속기소 된 호안투자컨설팅업체 대표 라덕연(44)씨가 1심에서 중형을 선고받았다.서울남부지법 형사합의11부(정도성 부장판사)는 13일 자본시장법 위반, 범죄수익은닉규제법 위반 등의 혐의로 기소된 라씨에게 징역 25년을 선고했다. 이와 함께 1465억1000만원의 벌금과 1944억8675만원의 추징..",2025.02.13 19:35,https://www.fnnews.com/news/202502131928047901,파이낸셜뉴스
[기자수첩] 은행의 고민도 노력도 없는 '간판 얼굴',,"새해 들어 금융권이 '간판 얼굴'을 바꾸고 있다. 신한은행은 이달 '얼굴천재'로 불리는 가수 겸 배우 차은우를 새로운 모델로 내세웠다. 아이돌 그룹 뉴진스와의 계약 종료 후 이번에는 남자 모델을 기용, 성장과 혁신의 에너지를 전달하겠다는 취지다. 우리은행은 최근 4세대 걸그룹 대표로 떠오른 아이브의 멤버 장원영을 새 모델로 선택했다. 정식 공개 전 SNS에서 '우리WON..",2025.02.13 19:24,https://www.fnnews.com/news/202502131924246319,파이낸셜뉴스
"[fn사설] 러·우 전쟁 종식 논의 시작, 인류 비극 이젠 끝내야",,"열흘 후면 발발 3년이 되는 러시아·우크라이나 전쟁 종식 논의가 오가고 있다. 도널드 트럼프 미국 대통령은 러·우 양국 대통령과 연달아 통화해 전쟁 종식 협상을 시작하기로 합의했다고 12일(현지시간) 밝혔다. 트럼프와 블라디미르 푸틴 러시아 대통령이 1시간30분 정도의 긴 통화 끝에 ""우리는 가능한 한 빨리 전쟁을 끝내기 위해 노력할 것&quo..",2025.02.13 19:24,https://www.fnnews.com/news/202502131924206531,파이낸셜뉴스
"[fn사설] ""'전국민 25만원' 추경 포함"" 또 식언한 李대표",,더불어민주당이 13조원 규모의 민생회복 소비쿠폰 지급을 포함한 35조원 규모의 '슈퍼 추경'을 하자고 정부와 여당에 13일 제안했다. 소비쿠폰은 민주당이 주장하던 국민 1인당 25만원 지급과 같은 것이다. 지역화폐 예산 2조원도 들어 있다. 결국 민주당은 민생회복 지원금 25만원 지급을 포기하겠다고 한 최근 입장을 뒤집었다. 이재명 민주당 대표는 지난달 31일 최..,2025.02.13 19:24,https://www.fnnews.com/news/202502131924168203,파이낸셜뉴스
[서초포럼] 트럼프발 무역전쟁과 산업정책,,"도널드 트럼프 대통령이 취임 첫날 서명한 '미국 우선 무역정책(America First Trade Policy)' 행정명령의 내용이 점점 구체화되면서 트럼프발 무역전쟁 폭풍이 휘몰아치기 시작했다. 2월 초 발표된 캐나다, 멕시코, 중국에 대한 관세 부과 방침처럼 트럼프의 자국 우선주의 무역정책은 그 대상을 동맹과 비동맹을 가리지 않는다. 그리고 지난 10일 발표된 철강과 알루미늄에 ..",2025.02.13 19:24,https://www.fnnews.com/news/202502131924128783,파이낸셜뉴스
[김경민의 국제정치] K문화와 국제정치,,"한국의 문화와 노래가 세계에 급속히 퍼져나가고 있다. 한국을 이해하기 위해 한글을 배우는 전 세계 사람들이 1000만명을 넘고 있다. 대한민국이 크나큰 영향력을 발휘하는 선진국이 되어 간다. 교수를 하기 위하여, 미국이나 영국이 쓰는 영어로 공부하기 위하여 미국과 영국에서 공부를 했다. 미국이나 영국의 젊은이들이 한국 문화를 이해하기 위해서는 한글을 꼭 알아야 ..",2025.02.13 19:20,https://www.fnnews.com/news/202502131920143787,파이낸셜뉴스
[기업과 옛 신문광고] 포니 신화와 새한자동차,,현대차가 지난해 세계 3위 자동차기업으로 올라선 것은 1967년 설립 이후 57년 만이다. 1975년 첫 국산 모델 포니가 나온 후로 따지면 반세기 만에 달성한 위업이다. 현대자동차가 미국 포드와 제휴해 설립 석달 만에 조립 생산해 낸 승용차가 '코티나'다. 그러나 코티나는 부산의 택시기사들이 반납 소동을 벌일 만큼 품질에 대한 구매자들의 불만이 많았다. 포드 측은 비포장..,2025.02.13 19:20,https://www.fnnews.com/news/202502131920102935,파이낸셜뉴스
