title,thumbnail,short_content,write_time,link,company
"35조 '슈퍼 추경' 꺼낸 野, 이재명표 민생쿠폰 13조",,"더불어민주당이 민생회복과 경제성장을 내걸고 총 35조원 규모의 슈퍼 추가경정예산안을 발표했다. 경제 악화 상황에서 먼저 당 자체 추경안을 마련, 국민의힘에 요구하며 정국 주도권을 잡겠다는 전략이다. 특히 추경안에 이재명 민주당 대표의 역점 사업인 '전 국민 25만원 지원금'이 포함돼 있어, 국민의힘은 ""조기 대선용""이라고 혹평했다. 민주당 정책위원회와 ..",2025.02.13 18:44,https://www.fnnews.com/news/202502131844204601,파이낸셜뉴스
"보수위기 진단한 與…김형오 ""투쟁력 부족""",,집권여당인 국민의힘이 탄핵정국 와중에 합리적 보수정당으로서 거듭 나기 위한 '셀프 진단'에 나섰다. 여당 소속의 윤석열 대통령에 대한 헌법재판소의 탄핵 심판이 종반전으로 접어든 상황에서 탄핵정국의 공동 책임을 지면서도 국민 지지율을 끌어올리기 위해 미래 방향성을 모색하려는 행보로 읽힌다. 국민의힘 전략기획특별위원회는 13일 국회 의원회관에서 '국민..,2025.02.13 18:44,https://www.fnnews.com/news/202502131844136038,파이낸셜뉴스
'대통령 관저 이전' 상반기 재감사,,감사원은 13일 국회가 요구한 대통령 관저 이전 등 감사와 전국 공항의 항공안전 등 성과·특정사안 감사를 올해 상반기 안에 착수키로 했다. 감사원은 이날 지난달 16일 감사위원회 의결로 이 같은 내용의 연간 감사계획을 확정했다고 밝혔다. 주목을 끄는 감사로는 먼저 대통령 관저 이전 관련 의혹에 대한 '재감사'가 있다. 감사원은 지난 2023년 대통령 집무실..,2025.02.13 18:44,https://www.fnnews.com/news/202502131844102135,파이낸셜뉴스
"'테슬라보다 나랏일' 머스크, 올해 순자산 537억弗 증발",,일론 머스크 테슬라 최고경영자(CEO)의 순자산이 올해 537억달러(약 79조원) 사라진 것으로 집계됐다. 그러나 머스크는 여전히 압도적인 세계 최고 부자인 것으로 확인됐다. 테슬라 CEO이면서 도널드 트럼프 2기 행정부의 비용절감을 이끄는 정부효율부(DOGE) 수장인 머스크가 한 눈을 팔면서 테슬라 주가가 올들어 15% 가까이 급락한 것이 배경이다. 배런스는 12일(현지..,2025.02.13 18:42,https://www.fnnews.com/news/202502131842365400,파이낸셜뉴스
"구글, 성인 인증에 AI 도입… 美부터 우선 적용",,"세계 최대 인터넷 검색엔진 구글이 유튜브를 비롯한 자사 서비스의 성인 인증 과정에 인공지능(AI) 기술을 사용할 예정이라고 밝혔다. 해당 조치는 올해 미국부터 시작해 점차 다른 국가에도 적용될 예정이다. 구글의 젠 피츠패트릭 수석 부사장은 12일(현지시간) 공식 구글 블로그에 ""아동을 위한 새로운 디지털 보호""라는 제목의 글을 올렸다. 그는 올해부터 ..",2025.02.13 18:42,https://www.fnnews.com/news/202502131842339220,파이낸셜뉴스
"올트먼 ""챗GPT, 일반·추론모델 통합… 라인업 단순화""",,챗GPT개발사 오픈AI가 수주 내에 최신 AI모델 GPT-4.5를 출시한다. 또 일반 모델과 추론 모델을 통합해 하나의 서비스로 제공한다. 지금까지 일반 모델인 'GPT시리즈'와 추론 모델인 'o 시리즈'를 선보였지만 제품의 다양성보다는 제품 라인업의 단순화를 선택했다. 결국 조만간 출시 예정이었던 AI 추론 모델 'o3'는 별도 서비스로 출시하지 않고 GPT-시리즈 모델에 통합..,2025.02.13 18:42,https://www.fnnews.com/news/202502131842300556,파이낸셜뉴스
"'발등의 불' 캐나다 총리, 트럼프 맞설 동맹군 찾아 유럽行",,"【 실리콘밸리=홍창기 특파원】 캐나다의 미국 51번째 주 편입과 관세부과 리스크를 여전히 안고 있는 쥐스탱 트뤼도 캐나다 총리가 유럽으로 넘어갔다. 캐나다와 더불어 도널드 트럼프 미 대통령의 관세 위협에 직면한 유럽연합(EU)과 함께 공동 대응 방안을 논의한 것이다. 트뤼도 캐나다 총리는 12일(현지시간) EU의 우르줄라 폰데어라이엔 집행위원장, 안토니우 코스..",2025.02.13 18:42,https://www.fnnews.com/news/202502131842260751,파이낸셜뉴스
"'10년째 손실' JDI, 주력공장도 판다",,【 도쿄=김경민 특파원】 재팬디스플레이(JDI)가 액정표시장치(LCD) 패널 주력 공장인 모바라 공장(치바현 모바라시)의 매각을 검토한다. 내년 3월을 목표로 패널 생산을 종료하고 생산 설비를 이시카와 공장(이시카와현 가와키타마치)으로 이전할 계획이다. 스마트폰용 LCD 패널 수요 감소로 한때 6곳이던 일본 내 생산 거점은 이제 단 1곳으로 줄어든다. 13일 니혼게이..,2025.02.13 18:42,https://www.fnnews.com/news/202502131842206142,파이낸셜뉴스
"""가입 안하면 후회"" 무·저해지 보험 절판 마케팅 주의보",,"#광주에 거주하는 40대 주부 A씨는 3년 전 설계사의 권유로 일반적인 건강보험과 보장은 동일하지만 보험료가 저렴하고, 10년간 납입만 잘하면 환급금도 많이 받는 보험(무해지보험)에 가입했다. 이후 경제적인 상황이 악화되자 보험을 해약해 환급금을 받으려 했으나 무해지 상품으로 납입이 끝나기 전까지는 환급금이 없다는 설명을 듣고 사기를 당했다는 생각이 들었..",2025.02.13 18:41,https://www.fnnews.com/news/202502131841107367,파이낸셜뉴스
'첫 희망퇴직' 페퍼저축은행… 직원 20% 짐쌌다,,처음으로 희망퇴직을 실시한 페퍼저축은행에서 전체 직원의 20%가 짐을 쌌다. 부동산 프로젝트파이낸싱(PF)사업의 부진과 함게 업황이 악화된 때문으로 보인다. 13일 저축은행업계에 따르면 지난달 페퍼저축은행에서는 약 100명이 희망퇴직으로 회사를 떠났다. 지난해 9월 말 기준 임직원 수(503명)를 고려하면 직원의 20%가 퇴사한 셈이다. 지난해 말 이후 4대 시중은행(..,2025.02.13 18:40,https://www.fnnews.com/news/202502131840301470,파이낸셜뉴스
'트래블카드 날개' 해외 카드결제 20조 돌파,,해외에서의 카드 사용이 가파른 증가세를 보이고 있다. 무료 환전 등 혜택을 제공하는 트래블 체크카드가 등장한 여파로 해석된다. 얼해도 연초부터 해외여행이 급증하고 있는 만큼 당분간 해외 카드사용액 증가세는 이어질 전망이다. 13일 여신금융협회에 따르면 지난해 신한·현대·삼성 등 국내 9개 카드사의 개인 해외 카드이용금액(할부 제외)은 모두 ..,2025.02.13 18:40,https://www.fnnews.com/news/202502131840267474,파이낸셜뉴스
"하나은행, K리그 타이틀 스폰서 후원 4년 연장",,하나은행이 13일 서울 서대문구 스위스그랜드호텔에서 'K리그 타이틀 스폰서 후원' 연장 계약을 체결하는 조인식을 가졌다. 이에 따라 하나은행은 오는 2028년까지 K리그 타이틀 스폰서를 맡는다. 지난 2017년부터 K리그 타이틀 스폰서십 맡아온 하나은행은 이번 계약으로 K리그 역사상 최장 기간 타이틀 스폰서 후원 기록을 갖게 됐다. 하나은행은 K리그 공식 타이틀 ..,2025.02.13 18:40,https://www.fnnews.com/news/202502131840221622,파이낸셜뉴스
"""美 증시는 결국 오르더라""… 美 ETF 사모으는 개미",,국내 개인 투자자들이 올해에도 미국 증시에 투자하는 상장지수펀드(ETF)를 적극 사들이고 있다. 가파른 상승 곡선을 그리던 미국 증시가 최근 숨고르기에 들어갔지만 아랑곳 하지 않는 분위기이다. 13일 코스콤 CHECK에 따르면 최근 한달간 개인의 ETF 순매수 상위 10개 종목 중 9개 종목이 미국 증시에 투자하는 ETF로 나타났다. 같은 기간 외국인은 순매수 상위 10개..,2025.02.13 18:39,https://www.fnnews.com/news/202502131839240367,파이낸셜뉴스
한화의 날… 잘나가는 자회사 덕에 신고가 행진,,"한화 주가가 고공행진하고 있다. 한화에어로스페이스, 한화솔루션 등 자회사 지분 가치가 늘고 지난해 4·4분기에도 연결 자회사 실적 호전으로 어닝서프라이즈를 기록하면서 투자심리가 개선된 것으로 풀이된다. 13일 한국거래소에 따르면 한화는 이날 유가증권시장에서 전 거래일 대비 11.80% 급등한 4만2150원에 거래를 마쳤다. 한화는 지난 12일에도 16.00% ..",2025.02.13 18:39,https://www.fnnews.com/news/202502131839209969,파이낸셜뉴스
"한투증권 인니법인, 최우수 지속가능 연계 채권상 수상",,한국투자증권은 인도네시아법인(KISI)이 동남아시아 투자전문매체 '알파 사우스이스트 아시아'가 주최한 시상식에서 '최우수 지속가능 연계 채권 2024' 상을 수상했다고 13일 밝혔다. KISI가 지난해 7월 인도네시아 최대 철강 제조업체인 스핀도의 '지속가능 연계 채권' 발행을 현지 대형 증권사들과 공동 대표 주관해 마무리한 것에 따른 수상이다. 당시 발행된 채권은..,2025.02.13 18:39,https://www.fnnews.com/news/202502131839152971,파이낸셜뉴스
TIGER 다우존스 커버드콜 순자산 1000억 돌파,,"미래에셋자산운용은 'TIGER 미국배당다우존스타겟데일리커버드콜 ETF' 순자산이 1000억원을 돌파했다고 13일 밝혔다. 한국거래소에 따르면 12일 종가 기준 해당 ETF의 순자산은 1257억원이다. 지난 1월 21일 신규 상장 이후 한 달이 채 되지 않아 순자산 1000억원을 넘어섰다. 해당 기간 개인 누적 순매수 규모는 773억원으로, 국내 상장된 커버드콜 ETF 총 36개 중 1위를..",2025.02.13 18:39,https://www.fnnews.com/news/202502131839123220,파이낸셜뉴스
"미래에셋證, 기후변화대응평가 최고등급",,"미래에셋증권은 지난 7일 '2024년 탄소정보공개프로젝트(CDP) 기후변화대응 평가'에서 증권업계 최초로 리더십 A등급을 획득했다고 13일 밝혔다. 2003년 발족된 CDP는 영국에 본사를 둔 글로벌 유일의 환경 및 기후영향 평가기관으로 공신력을 높이 평가받고 있다. 글로벌 2만3200개 이상의 기업이 CDP를 통해 온실가스배출량, 기후변화로 인한 리스크 및 기회요인, 탄소..",2025.02.13 18:39,https://www.fnnews.com/news/202502131839097623,파이낸셜뉴스
코스피·코스닥 오르는데 K-OTC는 빠졌다,,"한국장외주식시장(K-OTC) 시가총액이 올해 들어 2000억원 넘게 증발했다. 코스피, 코스닥 시총이 각각 6%, 9%씩 늘었지만 K-OTC는 회복은커녕 쪼그라들고 있다. K-OTC는 금융투자협회에서 운영하는 비상장기업 거래 플랫폼이다. 13일 금융투자협회에 따르면 K-OTC 시가총액(137개 종목)은 지난 12일기준 16조3074억원이다. 지난 1월 2일 16조5675억원 대비 2601억원(-1...",2025.02.13 18:39,https://www.fnnews.com/news/202502131839057767,파이낸셜뉴스
"가상자산거래소·기부금단체·대학, 코인 팔아 현금화 가능",,"올 상반기부터 원화마켓 등 가상자산거래소가 보유한 비트코인을 매도 및 현금화할 수 있게 된다. 또 기부나 후원으로 가상자산을 받은 비영리법인을 비롯해 대학교 등도 올해 2·4분기부터 법인 실명계좌를 발급받을 수 있다. 올 하반기에는 일부 기관투자자에 대한 투자·재무 목적의 매매 실명계좌가 시범허용, 개인 중심의 국내 가상자산 시장에 기관이..",2025.02.13 12:00,https://www.fnnews.com/news/202502131837094215,파이낸셜뉴스
"""2030 영리치 고객을 잡아라"" 대형증권사 WM서비스 확장",,대형 증권사들이 '슈퍼리치(초고액자산가)'를 위한 자산관리(WM) 서비스를 20~30대의 '영리치'로 확장하고 있다. 가업승계를 앞둔 차세대 경영인(CEO)이나 각 영업점 VIP고객 자녀들이 주요 대상이다. 영리치만을 위한 WM은 물론 금융·회계·조직관리 등 실무역량 강화 및 수시 네트워킹 기회까지 제공하면서 잠재 고객 확보에 공을 들이고 있다. 13일 금융투자업..,2025.02.13 18:37,https://www.fnnews.com/news/202502131837051811,파이낸셜뉴스
