title,thumbnail,short_content,write_time,link,company
AI 영상 앱 '소라' 100만 다운로드 돌파… 챗GPT보다 빨라,,"오픈AI의 AI 영상 앱 '소라'(Sora)가 챗GPT를 뛰어넘는 초기 기록을 달성하며 연일 화제를 모으고 있다. 초대 기반(invite-only) 방식에도 불구하고 첫 5일 만에 100만 다운로드를 넘어섰고, iOS 기준 첫 주 다운로드에서는 챗GPT 기록을 앞서는 성과를 보인 것으로 알려지면서 향후 폭발적인 성장세를 예고했다. 12일 업계에 따르면 오픈AI의 빌 피블스 소라 부문 대표..",2025.10.12 18:20,https://www.fnnews.com/news/202510121820227149,파이낸셜뉴스
"LGU+ 유플투쁠 멤버십, CGV·컴포즈·다이소 인기",,LG유플러스가 지난해 4월부터 시작한 대표 멤버십 프로그램 '유플투쁠'의 누적 참여 건수가 1500만을 돌파했다고 12일 밝혔다. 유플투쁠은 LG유플러스가 운영하는 멤버십 프로그램으로 쇼핑·식음료·문화·라이프스타일 등 다양한 분야의 혜택을 제공한다. 지난달까지 누적 데이터를 보면 1500만 중 가장 인기가 많았던 제휴사는 CGV로 집계됐다. 2위..,2025.10.12 09:00,https://www.fnnews.com/news/202510121820224968,파이낸셜뉴스
해외로 의료계로… 과학인재 유출 가속,,한국의 과학기술 인재가 의료계 등 다른 분야로 이동하거나 해외로 빠져나가는 현상이 심화되고 있다는 지적이 나왔다. 12일 국회 과학기술정보방송통신위원회 이상휘 국민의힘 의원이 과학기술정보통신부로부터 제출받은 자료에 따르면 최근 5년간 정부 과학장학금을 받은 학생 중 316명이 의학계열 등 이공계 이외 분야로 진로를 변경했다. 이들은 장학금 수혜 후 학업..,2025.10.12 18:20,https://www.fnnews.com/news/202510121820202292,파이낸셜뉴스
삼성·오픈AI도 띄우는 FDC… AI 핵심 인프라 부상,,바다 위에 띄우는 데이터센터 '플로팅 데이터센터(FDC)'가 차세대 인공지능(AI) 인프라로 부상하고 있다. FDC는 바닷물로 서버 열을 식힐 수 있어 냉각 전력과 비용을 크게 절감할 수 있다. 또 해상풍력·태양광 등 재생에너지와 연계해 열 관리 효율을 높임으로써 탄소 배출량을 감축하는 친환경 대안으로도 평가된다. 삼성과 오픈AI도 공동 개발에 나선 가운데 ..,2025.10.12 18:20,https://www.fnnews.com/news/202510121820166541,파이낸셜뉴스
통신사·빅테크 대표 등 대규모 소환… 해킹·불공정 집중 추궁,,"추석 연휴가 끝나면서 열리는 국회 과학기술정보방송통신위원회 국정감사에서 해킹 사태와 불공정거래 등이 주요 이슈가 될 전망이다. 과방위는 올해 국감 증인으로 통신 3사, 쿠팡 최고경영자(CEO)를 비롯해 구글·애플·넷플릭스 등 주요 글로벌 빅테크 관계자들을 줄줄이 소환한다. 업계에서는 예년처럼 기업인들을 향한 호통치기, 망신주기가 반복될 것..",2025.10.12 18:20,https://www.fnnews.com/news/202510121820119866,파이낸셜뉴스
스타트업 투자 2조 넘었지만… 소수 기업에 집중,,올해 3·4분기 스타트업 투자 금액이 2조4000억원을 돌파하며 2023년 4·4분기 이후 7분기 만에 2조원을 다시 넘어섰다. 다만 전체 투자 건수는 전년 동기 대비 3분의 1이 감소해 소수 투자에 집중되는 모습을 보였다. 12일 더브이씨에 따르면 3·4분기 스타트업 및 중소기업 대상 투자 금액은 직전 분기 대비 152.3% 증가한 2조4326억원을 달성했다. ..,2025.10.12 18:19,https://www.fnnews.com/news/202510121818387931,파이낸셜뉴스
"의식주에 취업까지 ""자립준비청년 지원""",,"주요 기업들이 우리 사회 복지 사각지대에 놓인 자립준비청년들 지원에 나서 관심이 쏠린다. 12일 관련 업계에 따르면 삼표그룹은 최근 은평구청과 자립준비청년 주거환경 개선 지원을 위한 협약을 체결했다. 자립준비청년은 보호시설 퇴소 후 임대주택과 노후화된 주택에서 생활하지만 통상 곰팡이로 얼룩진 벽지와 단열, 방수 문제 등으로 어려움을 겪는다. 이를 개선..",2025.10.12 18:19,https://www.fnnews.com/news/202510121818316619,파이낸셜뉴스
"""유방암 생존율 높인다"" 의료업계, 치료 기술 고도화",,10월 '유방암 예방의 달'을 맞아 국내 의료기기 업계가 혁신 기술·인공지능(AI)을 활용한 기술로 유방암 치료에 속도를 내고 있다. AI로 유방암 추이를 신속 진단하고 혁신 기술을 통해 치료 시 발생하는 부작용을 최대한 방지한다는 전략이다. 12일 업계에 따르면 최근 오스템임플란트는 유방암 환자를 위한 '융복합 자성 프리 조직 확장기' 개발에 도전했다. 유..,2025.10.12 18:18,https://www.fnnews.com/news/202510121818307929,파이낸셜뉴스
"한진, K물류 혁신 착착… 퍼스트 무버 신화 이어간다",,국내 대표 '해방둥이 기업'으로 꼽히는 ㈜한진은 지난 80년간 국내 물류산업의 패러다임을 바꿔온 '퍼스트 무버'로 평가받는다. 올해 한진은 전통물류에서 한단계 더 나아가 디지털 전환과 친환경 물류로 K물류의 새로운 표준으로 자리매김 한다는 계획이다. 12일 업계에 따르면 한진은 1990년대 국내 최초로 택배 서비스를 도입해 국민 생활의 편의를 높이는 것은 물론..,2025.10.12 18:18,https://www.fnnews.com/news/202510121818278523,파이낸셜뉴스
'로봇 밀도 1등' 한국… 부품 국산화로 中 굴기에 맞선다,,"노란봉투법(노동조합 및 노동관계조정법 2·3조 개정 법률) 통과 이후 인건비 부담과 산업재해 책임 강화로 기업 경영의 불확실성이 커지면서, 로봇 자동화가 더 이상 선택이 아닌 생존 전략으로 자리잡고 있다. 특히 핵심 부품 국산화에 나선 중소기업들도 관련주가 강세를 보이는 등 산업 전환의 중심축으로 부상하고 있다. 12일 국제로봇연맹(IFR)에 따르면 한..",2025.10.12 18:18,https://www.fnnews.com/news/202510121818247593,파이낸셜뉴스
긴 연휴에 유커 특수까지… 백화점·아울렛 추석 매출 급증,,"최장 10일간의 추석연휴기간 백화점과 대형 아울렛이 최대 특수를 누린 것으로 파악됐다. 특히, 중국 단체 관광객의 무비자 입국 허용 효과가 이달 들어 본격화된 것도 대형 유통채널들의 연휴 특수에 한몫한 것으로 분석됐다. 12일 업계에 따르면 주요 백화점 3사의 이번 황금연휴 기간 일 평균 매출이 전년 대비 일제히 20% 이상 성장했다. 연휴 내내 궂은 날씨가 이..",2025.10.12 18:14,https://www.fnnews.com/news/202510121814235768,파이낸셜뉴스
한돈 요리 맛보고 체험존 참여… 2030·외국인들 줄 섰다,,"""SNS에서 한돈 팝업 소식을 보고 친구들과 왔는데 미션 체험도 재미있고 한돈 요리도 기대 이상이다. 주말에 또 오고 싶다."" 지난 11일 서울 성수동 XYZ SEOUL에서 개막한 '한돈팝업스토어'를 찾은 20대 직장인 이혜리씨는 ""스탬프 모아서 굿즈도 받고 다양한 한돈 음식도 먹을 수 있어 좋았다""며 이 같이 말했다. 올해로 12주년을 맞는 '한돈데이'..",2025.10.12 18:14,https://www.fnnews.com/news/202510121814194589,파이낸셜뉴스
"인기·한정판 술, 매장 대신 앱에서 산다",,"#. ""예전엔 원하는 술을 찾으려고 남대문이나 보틀숍을 돌아다녔는데, 요즘엔 앱으로 해결합니다."" 20대 주류 애호가 이모씨는 ""오프라인 주류 매장은 보유 품목과 가격이 제각각이라 허탕치거나 덤터기를 쓰는 일이 많았다""며 ""픽업 서비스가 생기고 나서는 정가에 원하는 제품을 받아볼 수 있어서 훨씬 편리하다""고 말했다. 최근 주류 ..",2025.10.12 08:00,https://www.fnnews.com/news/202510121814186658,파이낸셜뉴스
"""피부과 안 가요"" 홈 뷰티 기기 대세 됐다",,"국내외 뷰티 디바이스 시장이 폭발적으로 성장하면서 대기업뿐 아니라 스타트업까지 투자가 몰리고 있다. 피부과 시술 대신 홈케어 수요가 급증하면서 K뷰티 산업의 중심축이 화장품에서 뷰티 디바이스로 빠르게 이동하는 모습이다. 12일 크라우드 펀딩 플랫폼 와디즈에 따르면 올해 1~9월 기준 뷰티 카테고리 펀딩 금액은 총 69억원으로, 전년 동기 대비 125% 증가했다..",2025.10.12 18:14,https://www.fnnews.com/news/202510121814156736,파이낸셜뉴스
조희대 대법원장 증인 출석할까… 13일 대법원 국감,,"이재명 정부의 첫 국정감사가 막을 올리는 가운데, 조희대 대법원장의 증인 출석 여부가 최대 쟁점으로 떠오르고 있다. 대법원장은 국감장에서 인사말 정도만 하고 이석하는 게 관례였는데, 여권은 조 대법원장의 출석을 압박하는 등 공세 수위를 높이는 모습이다. 12일 법조계에 따르면 국회 법제사법위원회는 13일 대법원 국감에 조 대법원장을 증인으로 부른다. 통상 ..",2025.10.12 18:12,https://www.fnnews.com/news/202510121812318037,파이낸셜뉴스
뒤늦게 부랴부랴… 캄보디아 범죄 총력 대응 나선 정부,,"캄보디아에서 한국인 상대 취업 사기 납치와 감금·고문 등 범죄가 잇따르자, 외교·경찰 당국이 영사 조력, 현지 수사역량 강화 등 전방위적인 대응에 나섰다. 이재명 대통령도 캄보디아 범죄에서 국민 보호에 총력 대응을 관계 부처에 주문했다. 그러나 대학생 고문 사망을 비롯한 피해가 줄줄이 확인되고 여행 예약 취소, 주한 캄보디아인 혐오, 범죄단..",2025.10.12 18:12,https://www.fnnews.com/news/202510121812280354,파이낸셜뉴스
"법무부, 친일파 후손 토지 매각대금 78억 반환소송",,"정부가 친일파 후손의 토지매각 대금에 대한 환수 작업에 착수했다. 법무부는 지난 10일 친일파 이해승(1890~1958)의 후손이 경기도 의정부 호원동 토지 31필지를 매각해 챙긴 약 78억원에 대해 서울중앙지법에 부당이득반환 청구 소송을 제기했다고 12일 밝혔다. 이해승은 지난 1910년 일제로부터 후작 작위를 받고 귀족 지위를 누린 인물로, 친일반민족규명위원회는 지..",2025.10.12 18:12,https://www.fnnews.com/news/202510121812262862,파이낸셜뉴스
"7년간 19일 美 체류 복수국적자, 한국 국적포기 소송냈다가 패소",,"한국에서 생활해 온 복수국적자가 한국 국적 포기를 허가해달라며 소송을 제기했지만 받아들여지지 않았다. 7년간 한국에 머물면서 미국에 체류했던 시간은 19일에 불과했으므로, 생활근거지는 한국으로 봐야 한다는 게 법원의 판단이다. 12일 법조계에 따르면 서울행정법원 행정6부(나진이 부장판사)는 A씨가 법무부를 상대로 제기한 국적이탈신고 반려처분 취소 청구 소..",2025.10.12 18:12,https://www.fnnews.com/news/202510121812222571,파이낸셜뉴스
국토부 ‘집값 띄우기' 의심 거래 8건 수사의뢰,,국토교통부가 서울 아파트 거래에서 발생한 '가격 띄우기' 의심 사례에 대한 기획조사 중간 점검 결과 8건의 의심 정황을 확인했다. 해당 거래는 다음주까지 경찰청에 수사의뢰를 마칠 예정이다. 12일 국토부에 따르면 최근 부동산 실거래가 제도를 악용한 허위신고 문제가 제기됨에 따라 서울시 부동산 거래 해제건(2023년 3월~2025년 8월 거래분)에 대해 기획조사를 진..,2025.10.12 06:00,https://www.fnnews.com/news/202510121810253196,파이낸셜뉴스
서울 절반이 노후 건물인데… 안전 관리 구멍,,"서울시 내 건축물 절반이 30년 이상 된 노후 건축물로 나타났다. 이 중 상당수는 아파트가 아닌 단독·다가구·다세대주택 등으로, 외벽 탈락이나 지붕 붕괴 등 안전사고 위험에 노출돼 있다. 그러나 노후 건축물 관리는 자치구별 조례를 통해 제각각 이뤄지면서 현장에서 혼란을 겪고 있다는 지적이 나온다. 12일 서울연구원에 따르면 2022년을 기준으로 서..",2025.10.12 18:10,https://www.fnnews.com/news/202510121810253069,파이낸셜뉴스
신동아5차 합류로 5천가구 넘는 '더 큰 우·극·신',,"서울 내 최대 리모델링 추진 사업장인 우·극·신(우성2·3단지, 극동, 신동아4차)이 '따로 또 같이' 사업을 추진 중인 가운데, 인접 단지인 신동아5차가 신동아4차보다 조합설립 동의율을 먼저 달성했다. 이들 모두 비슷한 시기 사업이 완성되면 현재 4620가구에서 5164가구로 늘어난다. 10일 정비업계에 따르면 서울 동작구 사당동 신동아5차는 지..",2025.10.12 18:10,https://www.fnnews.com/news/202510121810200117,파이낸셜뉴스
커지는 월세 시장… 오피스텔 '임대 효자' 부상,,"14억원대 아파트를 보유한 40대 직장인 이씨는 요즘 고민이 많다. 가격이 오를 때마다 매도를 고민했지만 '버티기'하는 전세입자 탓에 번번이 타이밍을 놓쳤기 때문이다. 그는 ""하반기 안에 아파트를 빨리 정리하고 공실 위험이 적은 역세권 오피스텔을 사볼까 한다""며 ""월세 수익이 꾸준하다면 안정적인 투자처가 될 것 같다""고 말했다. 12일 부동..",2025.10.12 18:10,https://www.fnnews.com/news/202510121810174246,파이낸셜뉴스
침수된 반지하 市가 사들여도… 7%만 공공시설 등 재활용 [주거의 그늘 반지하(下)],,"서울시와 서울주택도시공사(SH공사)가 반지하 주택을 매입해 지역 커뮤니티 시설로 활용하겠다고 밝혔으나, 지난해 관련 매입은 아예 추진하지 못한 것으로 드러났다. 12일 서울시·SH공사 등에 따르면, 공사는 지난해 기축 매입 유형 중 '커뮤니티' 유형의 경우 아예 매입을 추진하지 못했다. 침수 등으로 시설물 상태가 불량하다는 이유다. 반지하 주택 매입 사..",2025.10.12 18:10,https://www.fnnews.com/news/202510121810150478,파이낸셜뉴스
‘긴축재정’ 서울시… 소비쿠폰 후유증에 내년 예산편성 난항,,올해 민생소비쿠폰 발행을 위해 3500억원의 지방채를 발행한 서울시에 추가적인 재정압박이 가해지고 있다. 서울 마을버스 지원을 상향했음에도 여전히 탈퇴 예고가 철회되지 않은데다 한강버스는 정식운항 열흘여만에 다시 시민 탑승을 일시중지했다. 결론을 짓지 못한 시내버스 임금 역시 노조안을 수용할 경우 1700억원의 추가 재정 부담이 가해질 것이라는 분석이 나..,2025.10.12 18:04,https://www.fnnews.com/news/202510121804065754,파이낸셜뉴스
"경기도, 7000억규모 공사채 발행 신청",,"【 수원=장충식 기자】 경기도는 고양창릉, 남양주왕숙1·2, 용인플랫폼 등 3기 신도시 사업을 본격 추진하기 위해 총 7000억원 규모의 공사채 발행을 행정안전부에 신청했다고 12일 밝혔다. 이번 공사채 발행은 경기주택도시공사(GH)가 신속한 토지보상과 부지 조성 사업을 위한 안정적 재원 확보 목적이다. 공사채는 사채발행 예정액이 300억원 이상인 경우 행정..",2025.10.12 18:04,https://www.fnnews.com/news/202510121804056618,파이낸셜뉴스
"""어르신도 AI로 택시호출 쉽도록"" 서울시, AI에이전트 새기준 제시 [서울을 움직이는 사람들]",,"""서울이 이제 추격자가 아니라, 새로운 기준을 모색하는 도시로 자리매김했다는 점에서 의미가 크다. 단순한 기술 전시를 넘어, 서울이 글로벌 스마트도시 무대에서 인공지능(AI) 서비스의 새로운 기준을 제시하는 자리가 된 것이다."" 서울시가 지난달 30일부터 지난 2일 까지 서울 강남구 코엑스에서 개최한 '스마트라이프위크 2025(SLW 2025)'에서는 인공지..",2025.10.12 18:04,https://www.fnnews.com/news/202510121804005271,파이낸셜뉴스
"디지털 행정 혁신 경북 '모이소', 서비스 늘리고 앱 안전성 높인다",,【 안동=김장욱 기자】 경북도는 공공마이데이터 기반 모바일 앱 '모이소'가 다양한 디지털 행정서비스 확산을 선도하고 있다고 12일 밝혔다. 특히 도민 맞춤형 서비스 확대는 물론 시스템 장애에 대비해 매뉴얼 정비를 통해 도민 편익과 행정 효율성 제고에 박차를 가한다. 모이소는 블록체인 기술과 행정안전부의 공공 마이데이터 서비스를 접목한 앱이다. 지난 2023년 ..,2025.10.12 09:00,https://www.fnnews.com/news/202510121802436014,파이낸셜뉴스
인천항 중고차 수출 점유율 내리막,,"【 인천=한갑수 기자】 중고차 수출 1위 항구인 인천항의 수출 점유율이 최근 5년 새 17%p 떨어진 것으로 나타났다. 특히 부산항에서 수출되는 중고차의 평균 단가가 인천항보다 약 44% 높아 인천항의 고부가가치 차량 수출 전략이 필요하다는 지적이다. 12일 더불어민주당 허종식 의원(국회 산자중기위, 인천 동구·미추홀구갑)이 관세청으로부터 받은 자료에 따르..",2025.10.12 18:03,https://www.fnnews.com/news/202510121802429803,파이낸셜뉴스
막국수·커피·한우… 강원 먹거리 테마 축제 한가득,,"【 춘천=김기섭 기자】 강원도는 도내 대표 축제인 막국수와 한우, 만두, 커피 등을 테마로 한 축제들이 오는 16일부터 11월 초까지 연이어 개최된다고 12일 밝혔다. 강원도 대표 먹거리 축제인 춘천 막국수닭갈비축제는 오는 16일부터 19일까지 열린다. 올해는 축제 파급효과를 높이기 위해 개최 시기를 여름에서 가을로 변경했고 축제 장소도 공지천 하천변을 비롯해 명..",2025.10.12 18:03,https://www.fnnews.com/news/202510121802405680,파이낸셜뉴스
늘어난 韓특허… AI 등 ICT 강세,,올 상반기 동안 내국인의 국내 및 해외 주요국으로의 특허 출원 건수 모두 지난해 같은 기간보다 증가했다. 12일 지식재산처에 따르면 올 상반기 국내 특허출원 건수는 총 10만9322건으로 전년 같은 기간(10만7620건)과 비교해 1.6% 늘었다. 이 중 내국인의 특허출원 건수는 8만3815건으로 전년 동기(8만2472건) 대비 1.6% 증가했다. 미국과 유럽 국적 출원인의 국내 특허..,2025.10.12 12:00,https://www.fnnews.com/news/202510121802402414,파이낸셜뉴스
현 고1 서울대 가려면 수능 평균 1.6등급… 최상위 경쟁 격화,,"올해 고등학교 1학년생부터 적용되는 서울대 정시 전형은 대학수학능력시험 점수가 합격의 주요 변수로 작용할 것이라는 입시 전문가의 전망이 나왔다. 2028학년도부터 수능의 표준점수 반영 방식이 등급·백분위로 변경돼 변별력이 약화되고 내신 반영 비율이 20%에서 40%로 대폭 확대되지만, 내신 5등급제 전환으로 최상위권 내신 동점자가 많아지면서 결국 수..",2025.10.12 18:03,https://www.fnnews.com/news/202510121802385444,파이낸셜뉴스
"[속보] 당정 ""국감 기업인 출석 최소화, 실무자 출석도 살피기로""",,[파이낸셜뉴스]  cjk@fnnews.com 최종근 기자,2025.10.12 17:59,https://www.fnnews.com/news/202510121757574298,파이낸셜뉴스
"[속보] 당정대 ""이번주 부동산 대책 발표…서울·경기 동향 논의""",,"[파이낸셜뉴스] 더불어민주당, 정부, 대통령실이 이번주 부동산 가격 안정을 위한 대책을 함께 마련해 발표하기로 했다.박수현 민주당 수석대변인은 12일 국회에서 고위당정협의회 결과 브리핑을 갖고 ""당정은 최근 서울 및 경기도 일부 지역의 주택시장 동향을 논의했으며 시장 상황을 엄중하게 모니터링해야 할 필요성에 대한 인식을 공유했다""고 말했다.박 수석대..",2025.10.12 18:08,https://www.fnnews.com/news/202510121757372366,파이낸셜뉴스
"[속보] 당정 ""주택시장 엄중 모니터링…이번주 부동산 대책 발표""",,[파이낸셜뉴스]   cjk@fnnews.com 최종근 기자,2025.10.12 17:54,https://www.fnnews.com/news/202510121752564060,파이낸셜뉴스
"뉴비트, F1 페스티벌 축하 무대…'짜릿 퍼포먼스' 선물",,그룹 뉴비트(NEWBEAT)가 F1 축제를 뜨겁게 달궜다.뉴비트는 12일 경기도 용인 에버랜드 스피드웨이에서 개최된 '피치스 런 유니버스 2025'에서 축하 무대를 꾸몄다.이날 뉴비트는 F1 경주의 박진감 넘치는 열기에 걸맞은 파워풀하고 역동적인 퍼포먼스를 선보여 현장 분위기를 끌어올렸다. 데뷔곡 'Flip the Coin'(플립 더 코인) 무대에는 인트로에 웅장한 프롤로그를 더해 강..,2025.10.12 17:43,https://www.fnnews.com/news/202510121742506799,파이낸셜뉴스
"李대통령, 전 부처에 ""국감, 여야 없이 적극 협조…국회 지적 적극 수용""",,"[파이낸셜뉴스] 이재명 대통령은 12일 국회 국정감사와 관련해 전 부처에 ""여야 구분 없이 적극 협조하라""고 했다.이 대통령은 이날 ""시정가능한 것은 즉시 조치하는 등 여야를 막론하고 국회의 지적을 적극 수용하라""며 이같이 지시했다고 대통령실 대변인실이 언론 공지를 통해 밝혔다.이 대통령은 ""타당한 지적이 있었음에도 이유 없이 ..",2025.10.12 17:14,https://www.fnnews.com/news/202510121704336121,파이낸셜뉴스
"[속보]李대통령 ""국감서 발생하는 오해·조작·음해 적극 소명""",,[파이낸셜뉴스]  syj@fnnews.com 서영준 기자,2025.10.12 17:00,https://www.fnnews.com/news/202510121700206473,파이낸셜뉴스
"[속보]李대통령 ""전년도 국감 지적사항 조치 않아도 책임 묻겠다""",,[파이낸셜뉴스]  syj@fnnews.com 서영준 기자,2025.10.12 17:00,https://www.fnnews.com/news/202510121659316478,파이낸셜뉴스
"李대통령 ""세관 마약 수사 외압 의혹, 성역 없이 엄정 수사하라""",,"[파이낸셜뉴스] 이재명 대통령은 12일 서울동부지검에 설치된 세관 마약 수사 외압 의혹 검경 합동수사팀의 수사와 관련해 ""더욱 철저한 수사를 하라""고 당부했다.이 대통령은 이날 세관 마약 수사 외압 의혹에 대해 이같이 지시했다고 대통령실 대변인실이 언론 공지를 통해 밝혔다.이 대통령은 ""백해룡 경정을 검경 합동수사팀에 파견하는 등 ..",2025.10.12 17:09,https://www.fnnews.com/news/202510121659168813,파이낸셜뉴스
"[속보]李대통령 ""국감 타당한 지적에 이유 없이 방치 엄중 문책""",,[파이낸셜뉴스]   syj@fnnews.com 서영준 기자,2025.10.12 16:59,https://www.fnnews.com/news/202510121658176018,파이낸셜뉴스
"[속보]李대통령, 국감 앞두고 전 부처에 ""여야 구분 없이 적극 협조""",,[파이낸셜뉴스]  syj@fnnews.com 서영준 기자,2025.10.12 16:57,https://www.fnnews.com/news/202510121656535370,파이낸셜뉴스
"[속보]李대통령, 세관 마약 수사 외압 의혹에 ""성역 없이 엄정 수사""",,[파이낸셜뉴스]  syj@fnnews.com 서영준 기자,2025.10.12 16:56,https://www.fnnews.com/news/202510121655334998,파이낸셜뉴스
캄보디아 범죄 총력 대응 나선 정부...그러나 경고음은 2년 전부터,,"[파이낸셜뉴스]  캄보디아에서 한국인 상대 취업 사기 납치와 감금·고문 등 범죄가 잇따르자, 외교·경찰 당국이 영사 조력, 현지 수사역량 강화 등 전방위적인 대응에 나섰다. 이재명 대통령도 캄보디아 범죄에서 국민 보호에 총력 대응을 관계 부처에 주문했다. 그러나 대학생 고문 사망을 비롯한 피해가 줄줄이 확인되고 여행 예약 취소, 주한 캄보디아인..",2025.10.12 17:19,https://www.fnnews.com/news/202510121649167254,파이낸셜뉴스
"'핵보유 정상국가' 노리는 北, 아세안으로 외교 타깃 확대 시도",,"[파이낸셜뉴스] 북한이 노동당 창건 80주년을 계기로 중국과 러시아는 물론 베트남, 라오스, 인도네시아 등 아세안(ASEAN·동남아시아국가연합) 국가들을 대거 초청하며 외교 무대 복귀를 시도하고 있다. 핵보유를 기정사실화한 상황에서 아세안과의 관계를 복원해 외교적 고립을 완화하고, 나아가 '정상국가' 이미지를 부각하려는 포석으로 풀이된다.12일 통일부 등에 ..",2025.10.12 17:45,https://www.fnnews.com/news/202510121642576626,파이낸셜뉴스
베이비몬스터 'WE GO UP' MV 초고속 '2000만뷰' 돌파,,베이비몬스터의 존재감이 찬란하게 빛나고 있다.12일 YG엔터테인먼트에 따르면 베이비몬스터의 신곡 'WE GO UP' 뮤직비디오는 이날 오전 11시께 유튜브에서 2000만 뷰를 돌파했다. 음악 팬들의 꾸준한 성원에 힘입어 공개 이틀여 만에 해당 조회수를 넘어선 것.이번 뮤직비디오는 퍼포먼스 요소를 배제하는 대신 곡의 테마를 극대화한 YG의 전략이 제대로 통했다. 여기에 멤버 ..,2025.10.12 16:43,https://www.fnnews.com/news/202510121642123861,파이낸셜뉴스
