title,thumbnail,short_content,write_time,link,company
"[fn이사람] ""돌봄공백 없게… 대기 없는 늘봄학교 만들어""",,"【 전주=강인 기자】 전북특별자치도교육청이 3년 연속 '최우수 교육청'에 선정됐다. 교육감 공석이라는 혼란 속에서 이룬 쾌거다. 5일 전북교육청에 따르면 최근 교육부 주관 시·도교육청 평가에서 4개 영역, 21개 전 지표를 모두 통과하며 최우수 교육청에 꼽혔다. 이런 성과 중심에 유정기 전북교육감 권한대행(사진)이 있다. 지난 6월 서거석 전 전북교육감..",2025.11.05 18:17,https://www.fnnews.com/news/202511051816422458,파이낸셜뉴스
"안규백 ""원잠, 국내서 건조해야""",,"안규백 국방부 장관이 정부가 도입을 공식화한 원자력 추진 잠수함을 국내에서 건조해야 한다는 취지로 말했다. 안규백 국방부 장관은 5일 국회 국방위원회 전체회의에서 '핵추진잠수함을 국내에서 건조하는 것이 맞지 않냐'는 질의에 ""우리가 30년 이상 기술 축적과 연구를 해왔기 때문에 합당하다고 생각한다""고 답변했다. 안 장관은 ""현재 미 필리조선..",2025.11.05 18:16,https://www.fnnews.com/news/202511051815502115,파이낸셜뉴스
"與 ""경기진작 재정전략"" 野 ""확장재정, 부채 증가""",,"여야가 역대 최대인 728조원 규모로 편성된 내년도 정부 예산안에 대해 본격적인 심사 돌입에 앞서 5일 전문가 의견 청취에 나섰다. 야당인 국민의힘은 확장재정으로 부채가 늘어 자칫 국가신용등급이 떨어질 수 있다고 주장했다. 반면, 민주당은 확장재정은 경기흐름을 감안한 재정전략 일환일 수 있다며 내년도 예산안의 실효성을 강조했다. 국회 예산결산특별위원회..",2025.11.05 18:16,https://www.fnnews.com/news/202511051815415353,파이낸셜뉴스
"철강업계 만난 장동혁 ""K스틸법 통과시킬 것""",,"여야 합의로 출항을 앞두고 있던 민생경제협의체가 극심한 정쟁으로 좌초되면서, '1호 민생법안'으로 손꼽혔던 K-스틸법(철강산업 특별법) 역시 난항을 겪고 있다. 미국이 50%로 설정한 철강 관세는 이번 한미 관세 협상에서 논의조차 되지 않으면서 철강산업 진흥을 위해 국가적 지원이 시급하다는 지적이 제기된다. 정치권에서는 K-스틸법을 이달 내 국회 본회의에서 처..",2025.11.05 18:16,https://www.fnnews.com/news/202511051815407026,파이낸셜뉴스
"배임죄 폐지 시동 건 與, 상법상 배임죄만 연내 처리하나",,국정감사를 마친 더불어민주당이 정기국회 내 배임죄 폐지에 다시 시동을 건다. 다만 최근 불거진 이재명 대통령의 대장동 개발 사건 등으로 형법상 배임죄가 수면 위로 떠오르는 상황을 감안할 땐 사실상 사문화된 상법상 배임죄 폐지만이 연내 처리될 가능성이 높다. 5일 민주당 경제 형벌 합리화 태스크포스(TF)는 이달 중순 법무부 관계자를 불러 현행 배임죄로 처벌..,2025.11.05 18:16,https://www.fnnews.com/news/202511051815398603,파이낸셜뉴스
국정자원 화재 복구 예산 증액... 지역화폐 국비 1조1500억 지원,,"이재명 정부와 더불어민주당은 5일 국가정보자원관리원 화재 관련 예산을 증액하고, 비수도권지역사랑상품권(지역화폐) 국비 지원을 확대하기로 했다. 또 행정안전부가 중대범죄수사청 신설에 적극 임해 검찰개혁을 완수해야 한다고 당부했다. 국회 행정안전위원회 소속 민주당 의원들과 행안부는 이날 당정협의를 가지고 이같이 결정했다. 행안위 민주당 간사인 윤건영..",2025.11.05 18:16,https://www.fnnews.com/news/202511051815311156,파이낸셜뉴스
"""전략광물·금 판매 호조"" 고려아연, 103분기 연속 흑자",,"고려아연은 올해 3·4분기 연결 기준 매출 4조1598억원, 영업이익 2734억원을 기록하며 분기 기준 역대 최대 실적을 달성했다고 5일 공시했다. 전년 동기 대비 매출은 29.7%, 영업이익은 82.3% 증가한 수치다. 올해 1~9월 누적 기준으로는 매출 11조8180억원, 영업이익 8034억원으로 전년 대비 각각 36.8%, 33.2% 증가했다. 이로써 '103분기 연속 영업흑자'라는 대..",2025.11.05 18:15,https://www.fnnews.com/news/202511051814498565,파이낸셜뉴스
LX인터내셔널 '현장형' 구혁서 대표 내정,,"LX인터내셔널은 5일 이사회를 통해 구혁서 부사장(사진)을 대표이사로 내정하고, 상무 승진 1명에 대한 2026년 정기 임원인사를 단행했다. 구 부사장은 1996년 LX인터내셔널의 전신인 LG상사에 입사한 이후, 금속사업부장(상무), 에너지사업부장(전무), 인도네시아 지역총괄(부사장) 등 주요 직책을 역임했다. 특히, 인도네시아 지역총괄로 재직하며 신규 니켈 광산 인..",2025.11.05 18:15,https://www.fnnews.com/news/202511051814441198,파이낸셜뉴스
"""원팀으로 단단하게 성장""… '통합' SK온 CEO 타운홀 미팅",,"SK온이 5일 SK엔무브와 합병 후 첫 최고경영자(CEO) 타운홀 미팅을 열고 '통합 SK온'의 출범을 공식화했다. 이날 서울 종로구 SK온 관훈캠퍼스에서 열린 타운홀에는 이석희 CEO를 비롯해 지난 3일 신규 선임된 이용욱 CEO, 김원기 SK엔무브 CIC 사장 등 경영진과 구성원 120여명이 참석했다. 이용욱 CEO는 이 자리에서 사자성어 '마부위침'(磨斧爲針·도끼를 갈아..",2025.11.05 18:15,https://www.fnnews.com/news/202511051814278710,파이낸셜뉴스
"""韓·中전기차, 日모터쇼에서 액셀 밟았다""",,【 도쿄=서혜진 특파원】오는 9일까지 일본 도쿄에서 열리는 재팬모빌리티쇼에서 한국 및 중국 자동차 제조업체들의 존재감이 뚜렷하게 커지고 있다고 아사히신문이 5일 보도했다. 하이브리드차(HV)에 강점을 가진 일본 자동차 제조업체들과 달리 이들은 전기차(EV)를 전면에 내세워 주목을 끌고 있다는 분석이다. 반면 미국 자동차 제조업체는 수년 째 불참하고 있어 ..,2025.11.05 18:15,https://www.fnnews.com/news/202511051814204822,파이낸셜뉴스
올 금리 인하 물건너갔나... 국고채 금리 일제히 상승,,기준금리 인하 기대감이 후퇴하며 국고채 금리가 빠르게 뛰고 있다. 사실상 연내 금리 인하는 물 건너갔다는 분위기가 팽배하다. 내년 금리 인하를 단행하더라도 1회에 그칠 것이란 전망이 나온다. 기업들의 '이자비용 절감' 기대감도 사실상 후퇴하고 있는 셈이다. 유동성 장세가 사실상 끝이 보이는 상황에서 코스피가 장중 4000선이 무너지는 등 분위기도 심상치 않다...,2025.11.05 18:13,https://www.fnnews.com/news/202511051812549630,파이낸셜뉴스
[테헤란로] 보이스피싱 정부 대책 정교해야,,최근 은행 현금자동입출금기(ATM)에서 현금을 출금하기 전 보이스피싱 주의 절차가 하나 더 늘어났다. △검찰·경찰·금융감독원이나 모르는 사람이 전화로 출금이나 이체를 요청했는지 △비상장주식·해외주식·코인 투자 고수익 현황을 보여주고 이체를 요구하면 100% 사기임을 이해했는지 △전화나 텔레그램으로 대환대출을 요청받고 이체하..,2025.11.05 18:13,https://www.fnnews.com/news/202511051812466986,파이낸셜뉴스
[fn광장] 중국의 변신과 밀려오는 도전들,,"카우보이 모자를 쓰고 텍사스 로데오 경기장을 누비던 덩샤오핑, 자신의 피아노 반주에 맞춰 엘비스 플레슬리의 '러브 미 텐더' 노래를 부르고 링컨의 게티즈버그 연설을 외우며 미국 지도자들에게 어필했던 장쩌민, 미국 프로야구 모자를 눌러쓰고 경기장을 찾으며 미국인들과 함께 호흡하려 했던 후진타오. 1978년 말 개혁개방 정책을 시작했던 중국 최고 지도자들. ..",2025.11.05 18:13,https://www.fnnews.com/news/202511051812435295,파이낸셜뉴스
[강남視角] ‘터프한 협상가’ 김정관의 씁쓸함,,"고 이어령 선생(1934~2022)이 쓴 글에 이런 문장이 있다. ""나는 늑대가 두려워하는 강한 사슴이 되고 사자가 무서워하는 강한 양이 되자는 거요. 아니 먹히고 나면 무슨 사슴의 고귀함이 있고 무슨 양의 착함이 있겠나 이거요. 그러니까 강과 약을 다 가져야 합니다."" ('이어령의 말') 한미 관세협상을 마무리한 산업통상부 장관 김정관은 지난 4일 국무회의..",2025.11.05 18:13,https://www.fnnews.com/news/202511051812397819,파이낸셜뉴스
"[fn사설] 중기 연체율 8년반 만에 최고, 한계 기업 정리 시급",,'경제의 허리' 격인 중소기업의 자금난이 심해지면서 한국 경제에 경고음이 울리고 있다. 4대 시중은행의 경영현황을 정리한 팩트북에 따르면 KB국민·신한·하나·우리은행의 중소기업 대출 평균 연체율은 올 3·4분기 기준 0.53%로 2017년 1·4분기(0.59%) 이후 8년 반 만의 최고치다. 중소기업 대출을 가장 많이 취급하는 기업은행의 ..,2025.11.05 18:13,https://www.fnnews.com/news/202511051812360219,파이낸셜뉴스
"배당주의 시간 왔다…보험·통신·금융주, 하락장에서 선방",,"국내 증시가 단기 급등 부담으로 조정을 받으면서 안정적 수익을 낼 수 있는 배당주가 관심을 끌고 있다. 전례 없는 증시 급등에 한동안 주목 받지 못했지만 배당소득 분리과세, 자사주 소각 의무화 등 정책 모멘텀이 남은 만큼 추가 상승을 기대할 만하다는 게 전문가들의 조언이다. 5일 한국거래소에 따르면 코스피 지수가 2.85% 하락 마감했지만 전통적 배당주로 묶..",2025.11.05 18:13,https://www.fnnews.com/news/202511051812331839,파이낸셜뉴스
"[fn사설] 유통의 새시대 연 로켓·새벽배송, 규제 능사 아니다",,"이커머스 업체 쿠팡이 올해 3·4분기 12조7000억원대 매출로 한분기 만에 다시 역대 최대 실적을 갈아치웠다. 지난해 동기 대비 20% 성장한 수치다. 영업이익도 2분기 연속 2000억원대를 기록했다. 지난해 같은 기간과 비교하면 51.5% 증가했다. 알리, 테무 등 중국 공룡 이커머스업체의 파상공세가 거세지고 있는 가운데 주목할 만한 실적이다. 쿠팡의 실적을 끌..",2025.11.05 18:13,https://www.fnnews.com/news/202511051812294087,파이낸셜뉴스
"삼성운용, 글로벌 테마 선제투자 펀드 출시",,"삼성자산운용은 글로벌 주도테마에 선제적으로 투자하는 '삼성알아서글로벌주도테마EMP 목표전환형 펀드 제1호(이하 삼성알아서글로벌주도테마EMP1호)'를 출시한다고 5일 밝혔다. 이번 상품은 삼성자산운용의 대표 목표전환형 펀드 시리즈인 '삼성알아서투자해주는EMP 목표전환형 펀드'를 운용 중인 AI퀀트운용팀에서 출시하는 펀드로, 투자 대상을 국내 중심에서 글로..",2025.11.05 18:13,https://www.fnnews.com/news/202511051812254266,파이낸셜뉴스
코스피 출렁여도 꺾이지 않는 개인 매수세,,코스피 변동성 확대에도 개인 투자자들의 매수강도가 높아지고 있다. 대다수 자금이 SK하이닉스 등에 몰린 게 특징이다. 5일 한국거래소에 따르면 개인은 이날 유가증권시장에서 2조4711억원어치를 사들였다. 같은 기간 외국인이 2조6350억원어치를 판 것과 비교해 차익 실현 물량을 대부분 받아낸 것으로 보인다. 개인은 최근 3거래일 연속 코스피에서 매수우위를 나타..,2025.11.05 18:13,https://www.fnnews.com/news/202511051812233485,파이낸셜뉴스
"""변동성에 강한 TDF…장 흔들려도 성과 꾸준""",,"""인공지능(AI) 버블은 아직 오지 않았다고 본다. 위기가 올 것 같으니 투자를 하지 않고 현금에 머무른다는 전략은 성공할 수 없다"" 배재규 한국투자신탁운용 사장은 5일 서울 여의도 콘래드 호텔에서 진행된 '한국투자TDF알아서ETF포커스펀드' 출시 3주년 맞이 퇴직연금 세미나에서 이같이 강조했다. 그는 ""오늘 시장이 많이 빠진 이유 중 하나가 AI테..",2025.11.05 18:13,https://www.fnnews.com/news/202511051812200821,파이낸셜뉴스
"[fn인사이트] ""美 관세, 합의 자체가 성과…'원잠 美 건조' 논란은 아쉬워""",,"경북 경주에서 지난 1일 막을 내린 아시아태평양경제협력체(APEC) 정상회의는 한미·한중·한일 회담에 미중 정상회담까지 겹치며 한국 외교의 '복합 시험대'였다. 박원곤 이화여대 교수는 지난 3일 노동일 파이낸셜뉴스 주필과의 대담에서 이번 일정을 ""전에 경험하지 못했던 한국 외교의 장이면서 복합외교의 실천 무대""라고 규정했다. 한미 ..",2025.11.05 18:13,https://www.fnnews.com/news/202511051812131816,파이낸셜뉴스
[포럼] 재정 ‘마중물’ 제대로 쓰여야,,"이제 경주에서 개최된 아시아태평양경제협력체(APEC) 정상회의도 끝났고, 우리나라와 미국 간 관세를 둘러싼 투자협정 갈등도 일단락이 되었다. 국내적으로는 10월 한달 동안 전방위적인 국정감사를 통해 국정 전반의 현안을 점검하는 과정도 마무리되어 이제부터는 새 정부가 설계한 내년 그리고 향후 5년간 나라살림 계획에 대해 머리를 맞대고 치열한 공방이 이어질 ..",2025.11.05 18:12,https://www.fnnews.com/news/202511051812118286,파이낸셜뉴스
"‘수익성 악화’ 면세업계, 사업 체질개선 나섰다",,"고환율과 글로벌 경기 둔화 등 구조적 불황을 맞은 국내 면세업계가 근본적인 체질개선에 나서고 있다. 인천공항 임대료 부담으로 사업권을 반납한 신세계·신라면세점을 중심으로 수익성 제고를 위한 구조조정에 속도를 내고 있다. 5일 업계에 따르면 최근 주요 면세업체들은 '몸집 불리기'에 힘쓰던 사업 기조를 버리고, '수익성 개선'을 최우선 목표로 내세우..",2025.11.05 18:11,https://www.fnnews.com/news/202511051810516235,파이낸셜뉴스
"대만서도 실적 ‘로켓’… 쿠팡, 분기 매출 12조원 첫 돌파",,쿠팡이 3·4분기에도 대만 로켓배송과 명품 플랫폼 사업의 '쌍끌이 성장' 덕에 최초로 분기 매출 12조원을 넘어섰다. 김범석 쿠팡Inc 의장도 대만 시장의 성장을 높이 평가한 만큼 대규모 투자가 지속되는 가운데 1%대의 낮은 영업이익률을 끌어올릴 수익성 전략에도 집중할 것으로 보인다. 5일 쿠팡Inc가 미국 증권거래위원회(SEC)에 제출한 3·4분기 연결..,2025.11.05 18:11,https://www.fnnews.com/news/202511051810487586,파이낸셜뉴스
"롯데그룹, 직원들에게 신성장 사업 아이디어 듣는다",,롯데가 그룹 통합 사내벤처 프로그램인 '롯데 유니콘 밸리'를 출범한다고 5일 밝혔다. 롯데는 사내벤처 프로그램을 통해 그룹의 신성장 동력 및 본원적 경쟁력을 강화할 수 있는 아이디어를 발굴해 빠른 시간 내에 사업화까지 추진할 계획이다. 롯데 유니콘 밸리는 '미래의 유니콘 기업으로 성장할 아이디어들이 자라는 곳'이라는 의미로 직원들의 아이디어를 액셀러레이..,2025.11.05 18:11,https://www.fnnews.com/news/202511051810478812,파이낸셜뉴스
"""추위야 반갑다"" 패션플랫폼 겨울 프로모션 후끈",,"찬바람이 본격적으로 불기 시작한 11월, 패션 플랫폼들의 겨울 대형 프로모션이 일제히 활기를 띠고 있다. 갑작스러운 기온 하락에 겨울 아우터와 방한용품 수요가 급증하면서 패딩·퍼·어그 등 주요 상품 매출이 빠르게 늘고 있다. 5일 패션업계에 따르면 무신사가 운영하는 편집숍 29CM는 지난 3일부터 시작한 대규모 겨울 행사 '이구위크(29Week)'에서 행..",2025.11.05 18:11,https://www.fnnews.com/news/202511051810466937,파이낸셜뉴스
"'입주민 헬스케어 특화 AI챗봇'... 현대건설, 공동주택 최초 도입",,"현대건설이 공동주택 분야에서 업계 최초로 '헬스케어 특화 AI 챗봇'을 도입한다고 5일 밝혔다. 현대건설은 원격의료 솔루션 전문기업 솔닥과 업무협약을 맺고, 공동주택 입주민을 대상으로 온·오프라인이 연계된 맞춤형 헬스케어 서비스를 공동 개발한다. 양사는 '스마트의료 기반 원격건강관리 솔루션' 구축을 통해 입주민에게 개인 맞춤형 건강관리 서비스를 제..",2025.11.05 18:10,https://www.fnnews.com/news/202511051809597594,파이낸셜뉴스
"DL이앤씨, 동반성장지수 6년째 최고 등급",,"DL이앤씨는 2024년도 동반성장지수 평가에서 6년 연속 최고 등급인 '최우수' 등급을 받았다고 5일 밝혔다. DL이앤씨는 협력사와 단순한 지원을 넘어 지속가능한 동반성장 생태계를 조성하기 위해 전략적 파트너십을 강화하고 있다. 협력사의 경쟁력 제고를 위해 안전, 재무, 기술 등 다각도의 실질적 지원 프로그램을 운영하며 상생 기반을 공고히 하고 있다. 안전 분야에..",2025.11.05 18:10,https://www.fnnews.com/news/202511051809589214,파이낸셜뉴스
GS건설 '메이플자이' 세계조경가협회상 2관왕,,"GS건설이 세계조경가협회가 주관하는 'IFLA APR LA Awards 2025'에서 메이플자이로 주거부문과 문화 및 도시경관부문 총 2개부문에서 본상을 수상했다고 5일 밝혔다. 세계조경가협회(IFLA)는 1948년 창설, 70여개 회원국을 보유한 국제적인 조경단체다. 매년 회원국 내에서 시공된 건축물 중 환경의 질적 이익을 달성한 프로젝트를 선정해 시상하며, 조경분야 세계 최고..",2025.11.05 18:10,https://www.fnnews.com/news/202511051809538166,파이낸셜뉴스
"본궤도 오른 한남5 재개발, 2개동 층수 낮춰 일조권 논란 해소",,"서울 강북 정비사업 최대어인 한남뉴타운 내 5구역이 일조권 논란을 딛고 내년 초 사업시행인가에 들어간다. 일부 동이 인근 학교의 일조권을 침해할 수 있다는 이유로 세 차례 고배를 마셨던 교육환경영향평가를 통과하면서다. 이외에도 세대수 변경이 일부 이뤄질 예정이지만, 이후 사업에 필요한 단계를 동시 추진해 속도는 지연되지 않을 것이라는게 조합측 설명이다. 5일 ..",2025.11.05 18:10,https://www.fnnews.com/news/202511051809477157,파이낸셜뉴스
"""교통·생활 인프라 탄탄"" 부산에 귀한 '평지형 단지'",,"산지가 많은 부산에서 평지형 아파트가 새로운 주거 프리미엄으로 부상하고 있다. 보행과 차량 이동이 편리하고 생활 효율성이 높은 평지 입지가 실수요자 중심으로 인기를 얻고 있다. 이처럼 부산 내에서 평지 아파트의 입지 프리미엄이 입증되고 있는 가운데, 현대건설이 부산진구 가야동에서 선보이는 '힐스테이트 가야'가 주목받고 있다. 5일 현대건설에 따르면 이 ..",2025.11.05 18:10,https://www.fnnews.com/news/202511051809433525,파이낸셜뉴스
잠실엘스·은마·올훼 줄줄이 신고가 '강남불패',,"서울 아파트 매물이 10·15 부동산 대책 시행 후 한 달도 안 돼 1만건 넘게 증발했다. 거래도 80% 가까이 줄어드는 등 시장이 급랭했지만 강남3구 등 선호지역 단지에서는 신고가가 이어지며 수요자들의 불안을 키우고 있다. 5일 국토교통부 실거래가 공개시스템에 따르면 10월 16일부터 이날까지 20일간 서울 아파트 매매 거래량은 1554건으로, 직전 기간(9월 26일..",2025.11.05 18:10,https://www.fnnews.com/news/202511051809429684,파이낸셜뉴스
"삼성전기, 日과 손잡고 ""반도체 유리기판 선점""",,"장덕현 삼성전기 사장이 84억 달러(12조 원, 2028년)시장으로 고속성장이 전망되는 차세대 기술인 반도체 유리기판 기술 선점에 나섰다. 삼성전기는 2027년 이후 양산을 개시한다는 목표다. 현재 전 세계 기판업계는 인공지능(AI)시대에 대응, 반도체 유리기판 시제품을 출시하는 등 기술 개발에 열을 올리고 있다. 기술 난이도가 매우 높아, 인텔의 경우 경영난 및 기..",2025.11.05 18:08,https://www.fnnews.com/news/202511051808063405,파이낸셜뉴스
"""버스 기다리지 말고 호출하세요""",,"현대자동차·기아의 수요응답교통(DRT) 서비스 '셔클'이 헝가리에서 첫 해외 시범사업을 성공적으로 마치며 글로벌 확장 가능성을 입증했다. 현대차·기아는 헝가리 괴될뢰시에서 지난 8~10월 진행한 셔클의 '헝가리 수요응답교통 서비스 시범사업'을 성공적으로 종료했다고 5일 밝혔다. 괴될뢰는 인구 4만명 미만의 소도시로, 버스 5대가 12개 노선을 담당해..",2025.11.05 18:08,https://www.fnnews.com/news/202511051808046461,파이낸셜뉴스
LGD '정철동 매직' 통할까… 기술격차 벌려 '반전' 노린다,,"정철동 LG디스플레이 사장이 올해 4년 만의 연간 흑자 달성을 자신하며, ""경쟁사가 모방하기 어려운 '기술적 해자(垓子)'를 만들어 성장세를 이어가자""고 강조했다. 지난 9월 말 구광모 LG그룹 회장이 사장단 워크숍에서 ""중국의 (추격에)맞설 구조경쟁력 강화가 시급하다""고 주문한 데 따른 계열사 차원의 후속 메시지로 풀이된다. ■中 경쟁사 등..",2025.11.05 18:08,https://www.fnnews.com/news/202511051808019040,파이낸셜뉴스
"LS전선, 美 데이터센터에 전력시스템 공급",,"LS전선이 글로벌 빅테크 기업의 인공지능(AI) 데이터센터에 대용량 전력공급 시스템을 공급한다. LS전선은 미국 A사와 향후 3년간 버스덕트 공급 프레임 계약을 체결했다고 5일 밝혔다. 구체적인 물량은 확정되지 않았지만, LS전선은 올해 약 200억원 규모 공급을 시작으로 향후 3년간 총 5000억원 이상으로 확대될 것으로 전망하고 있다. LS전선 관계자는 ""공급 규..",2025.11.05 18:08,https://www.fnnews.com/news/202511051808006136,파이낸셜뉴스
SK하이닉스 HBM 4·5세대 세계 첫 '친환경 인증',,"SK하이닉스는 고대역폭메모리(HBM) 등 15종 메모리 제품에 대해 글로벌 친환경 인증기관 '카본 트러스트'로부터 탄소 저감과 탄소발자국 인증을 획득했다고 5일 밝혔다. 카본 트러스트는 지난 2001년 영국 정부가 설립한 비영리 친환경 인증 기관으로 제품의 원자재 조달부터 제조, 유통에 이르는 전 과정에서 발생하는 탄소 배출량을 과학적으로 측정하고, 국제 심사 기..",2025.11.05 18:08,https://www.fnnews.com/news/202511051807596719,파이낸셜뉴스
"12억 넘는 집도 연금 된다… ""하나금융 덕에 노후 든든""",,"""은퇴한지 10년이 넘어 소득은 없는데 손주들 용돈부터 동창모임까지 돈 나갈 곳은 많았다. 집을 정리할까도 생각했지만 평생 머물렀던 동네를 떠나기 싫었다. 12억원이 넘는 집이라 주택연금 가입도 어려웠다. '내집연금'에 가입하니 매월 375만원씩 들어와 웃을 일이 많아졌다."" 하나금융그룹의 '하나더넥스트 내집연금'에 가입한 70대 A씨 얘기다. 5일 하..",2025.11.05 18:07,https://www.fnnews.com/news/202511051807062835,파이낸셜뉴스
"농협금융 ""생산적·포용금융에 108조 투입""",,"NH농협금융지주가 오는 2030년까지 108조원을 투입해 생산적 금융과 포용금융을 지원한다. 농협금융은 향후 5년간 108조원 규모의 생산적·포용금융을 공급하는 'NH 상생성장 프로젝트'를 본격 추진한다고 5일 밝혔다. 108조원 가운데 93조원은 생산적금융에, 15조원은 포용금융에 각각 투입한다. 구체적으로 약 68조원은 투·융자에 활용한다. 투·..",2025.11.05 18:07,https://www.fnnews.com/news/202511051806589353,파이낸셜뉴스
'비이자수익 성장' 카카오뱅크 3분기 순익 3751억,,"카카오뱅크는 올해 3·4분기까지 누적 영업이익 5043억원, 순이익 3751억원을 기록했다고 5일 밝혔다. 전년동기 대비 각각 2.5%, 5.5% 증가한 수치다. 3·4분기 영업이익은 1511억원, 당기순이익은 1114억원으로 집계됐다. 가계부채 총량관리 규제 등으로 이자수익은 전년과 비슷한 수준을 나타냈다. 3·4분기 말 총 여신잔액은 45조2000억원이고, 이 ..",2025.11.05 18:07,https://www.fnnews.com/news/202511051806565803,파이낸셜뉴스
새 수은 행장에 황기연 상임이사,,"한국수출입은행은 황기연 상임이사(사진)가 제23대 수출입은행장으로 임명됐다고 5일 밝혔다. 전임 윤희성 행장에 이어 두 번째 내부 출신 발탁이다. 수출입은행장은 기획재정부 장관의 제청을 거쳐 대통령이 임명한다. 신임 황 행장은 전북대 경영학과를 졸업하고, 커이스트(KAIST)에서 경영정보학 석사학위를 받았다. 지난 1990년 수출입은행에 입행해 서비스산업금융..",2025.11.05 18:07,https://www.fnnews.com/news/202511051806536324,파이낸셜뉴스
