title,thumbnail,short_content,write_time,link,company
"오비맥주 카스, 논알코올도 1위… 1분기 40% 점유율",,"오비맥주의 '카스'가 올해 1·4분기 논알코올 음료 시장에서 점유율 1위를 달성했다. 17일 시장조사기관 닐슨의 맥주 가정시장 통계에 따르면 올해 1·4분기 기준 오비맥주의 '카스 프레시'와 '카스 라이트'는 각각 49.7%, 5.5%의 점유율을 차지하며 두 제품의 점유율 합계가 55%를 넘었다. 이런 가운데 논알코올 시장에서도 빠르게 영향력을 확대하고 있다. …",2026.05.17 18:43,https://www.fnnews.com/news/202605171843550716,파이낸셜뉴스
1분기 벤처투자 3조3000억 돌파… 전년 대비 24%↑,,"인공지능(AI), 반도체 등에 대한 투자가 탄력을 받으면서 올해 1·4분기 신규 벤처투자액이 3조3000억원을 돌파했다. 이는 벤처투자 호황기였던 2022년에 이어 역대 두 번째 규모다. 17일 중소벤처기업부가 발표한 '2026년 1·4분기 신규 벤처투자 및 벤처펀드 결성 동향'에 따르면 1·4분기 신규 벤처투자는 3조3189억원으로 전년 동기 대비 24.1% 증…",2026.05.17 18:40,https://www.fnnews.com/news/202605171840114742,파이낸셜뉴스
장관에게 직접 제안하세요.. 창구 개설 100일간 322건,,중소벤처기업부가 운영 중인 대국민 소통 창구 '장관에게 직접 제안하세요'에 개설 100일 간 322건의 제안이 접수됐다. 17일 중기부에 따르면 이 서비스는 한성숙 중기부 장관이 현장의 목소리를 청취하고자 지난 2월 마련한 소통 창구다. 실무 부서가 아닌 한 장관의 업무용 메일로 국민의 제안이 전달되도록 한 것이 특징이다. 중기부는 322건 가운데 211건에 대한 답변…,2026.05.17 18:40,https://www.fnnews.com/news/202605171840106078,파이낸셜뉴스
"""코로나 여름철 재유행 대비할 때"" 고위험군 예방접종 6월까지 연장",,"코로나19가 엔데믹 국면에 접어들었지만 여름철 재유행 가능성이 다시 거론되면서 방역당국과 의료계의 긴장감이 높아지고 있다. 특히 고령층과 면역저하자 등 고위험군에서는 여전히 중증 위험이 큰 데다, 백신 안전성 논란과 반복 접종 피로감까지 겹치며 예방접종 참여율도 낮아지는 모습이다. 17일 질병관리청에 따르면 최근 고위험군 대상 코로나19 무료 예방접종 …",2026.05.17 18:40,https://www.fnnews.com/news/202605171840068518,파이낸셜뉴스
삼성바이오 갈등 장기화… 시험대 오른 'K바이오',,삼성바이오로직스를 둘러싼 노사 갈등이 장기화되면서 국내 바이오 산업 전반의 경쟁력 저하 우려가 커지고 있다. 단순한 임금 협상을 넘어 글로벌 수주 신뢰와 국가 전략산업 경쟁력까지 흔들 수 있는 만큼 해결이 시급하다는 지적이다. 17일 제약바이오 업계에 따르면 전문가들은 삼성바이오로직스 노조가 또다시 전면 파업을 단행할 경우 일반 제조업보다 부정적 영향…,2026.05.17 18:40,https://www.fnnews.com/news/202605171840055145,파이낸셜뉴스
통합 에어케어 플랫폼 구축하는 코웨이,,코웨이가 공기질 관리 영역을 청정과 습도를 넘어 온도까지 실내 전반으로 확장한다. 특히 최근 에어컨 렌털(구독) 시장에도 진출하며 사계절 통합 에어케어 플랫폼을 구축하고 공기 관리 리더십을 굳힌다는 전략이다. 14일 관련 업계에 따르면 코웨이는 스퀘어핏 공기청정기 중형 모델 2종을 추가로 선보였다. 고급형 라인업 '노블 공기청정기 시리즈'에 이어 실속형 '…,2026.05.17 18:40,https://www.fnnews.com/news/202605171840039358,파이낸셜뉴스
"'실적 숨고르기' 들어간 반도체 장비 ""2분기 기대""",,반도체 장비기업들의 올해 첫 분기 성적표가 시장 기대에 미치지 못한 것으로 나타났다. 하지만 올해 들어 글로벌 반도체 시장이 초호황(슈퍼사이클)에 본격 진입하고 이에 따라 장비 수주 물량이 크게 늘어나면서 올 2·4분기부터 실적 개선이 뚜렷해질 전망이다. 17일 관련 업계에 따르면 신성이엔지는 올해 1·4분기 적자에 머물렀다. 이 기간 매출은 전년 동기…,2026.05.17 18:40,https://www.fnnews.com/news/202605171840005825,파이낸셜뉴스
[르포] 바다위 무선망의 마법… 울릉도 뱃길서 AI 코딩도 척척,,"【 울릉도=최혜림 기자】""코딩이 완료됐습니다. 정보기술(IT) 뉴스 5개를 매시간 자동 모니터링할게요."" 지난 12일 동해 바다 한가운데를 지나는 울릉크루즈 객실 안. 기자는 챗GPT의 '코덱스'를 이용해 1분 만에 간단한 프로그램을 완성했다. 지상 기지국도 없는 바다 위지만 카카오톡도, 유튜브도, 인공지능(AI) 서비스도 빠른 속도로 쓸 수 있었다. 위…",2026.05.17 18:38,https://www.fnnews.com/news/202605171838243441,파이낸셜뉴스
LGU+ 장기고객 초청 '레고랜드 RUN' 성황,,LG유플러스가 장기 고객을 겨냥한 체험형 프로그램 강화에 나서고 있다. 단순 할인 혜택을 넘어 참여형 콘텐츠를 확대하며 체감할 수 있는 혜택을 늘린다는 방침이다. LG유플러스는 레고랜드 코리아에서 장기고객 대상으로 '레고랜드 RUN'을 진행했다고 17일 밝혔다. 이는 LG유플러스 멤버십 VIP 이상이면서 5년 이상 서비스를 이용한 장기고객 4000여명을 대상으로 마…,2026.05.17 18:38,https://www.fnnews.com/news/202605171838213765,파이낸셜뉴스
[기고] 국가가 준 연구비는 '공동 자산'이다,,"우리 연구 현장에서 흔히 들리는 말 중 하나가 ""연구비를 땄다""는 표현이다. 치열한 경쟁을 뚫고 과제를 확보한 연구자의 기쁨과 노고가 담긴 말임을 충분히 이해한다. 그러나 '따다'라는 동사는 위험하다. 그 안에는 연구비를 승자의 전리품이나 개인 소유물로 여기는 인식이 자리 잡고 있기 때문이다. 지난 수십 년간 연구과제중심제도(PBS)는 연구자를 생…",2026.05.17 18:38,https://www.fnnews.com/news/202605171838197972,파이낸셜뉴스
녹색창 대신 'AI탭'… 블로그도 훑어 맛집 추천,,네이버가 차세대 생성형 인공지능(AI) 검색 서비스 'AI탭'을 오는 6월 정식 출시한다. 글로벌 빅테크와의 AI 검색 주도권 경쟁이 치열해지는 가운데 네이버가 압도적인 국내 로컬 데이터와 생태계를 무기로 승부수를 띄웠다는 분석이 나온다. 17일 정보기술(IT) 업계에 따르면 네이버는 6월 중 일반 이용자를 대상으로 한 AI탭 출시를 앞두고 막바지 서비스 고도화 작업에…,2026.05.17 18:38,https://www.fnnews.com/news/202605171838154934,파이낸셜뉴스
고용시장 대기업·60대 쏠림 현상… 中企·청년은 위축,,"고용시장의 겉과 속이 엇갈리고 있다. 취업자 수는 늘고 있지만 대기업·신산업·60대가 성장을 독점하는 사이, 중소기업·전통산업·청년층은 뒤처지는 'K자형 양극화'가 심화되는 것으로 나타났다. 노동시장을 이탈해 아무것도 하지 않고 쉬는 20·30대도 역대 최대치를 기록했고, 전체 노동이동률은 사상 처음으로 10% 아래로 떨어졌다.…",2026.05.17 12:00,https://www.fnnews.com/news/202605171835191525,파이낸셜뉴스
HD현대사이트솔루션 알제리에 지게차 316대 공급,,HD현대사이트솔루션이 아프리카와 중동 시장에서 대규모 산업차량 공급 계약을 잇달아 따내며 글로벌 신흥시장 공략에 속도를 내고 있다. 알제리 정부와 수백억원 규모 계약을 체결한 데 이어 아랍에미리트(UAE)와 시리아에서도 추가 수주에 성공하며 산업차량 사업 확대에 청신호가 켜졌다는 평가다. HD현대사이트솔루션은 최근 알제리 정부와 총 370억원 규모의 산업…,2026.05.17 18:35,https://www.fnnews.com/news/202605171835162863,파이낸셜뉴스
'뉴에너지' 돛 올린 삼성E&A…'글로벌 큰손' 품고 1조 시대로,,삼성E&A가 글로벌 기관투자자를 겨냥한 기업설명회(NDR)에 나선다. 외국인 지분율이 40%를 넘는 만큼 해외 '큰손'과의 접점을 넓혀 밸류업(기업가치 제고)의 마중물로 삼겠다는 전략이다. AI와 에너지 안보 이슈로 글로벌 플랜트 시장에서 '공기(工期)'가 핵심 변수로 부상하는 상황에서 삼성E&A가 정해진 기간 내 대형 프로젝트를 실제로 인도할 수 있는 실행 주체(Ph…,2026.05.17 18:35,https://www.fnnews.com/news/202605171835134445,파이낸셜뉴스
"조현, 이란 외교장관과 통화…""나무호 피격 관련 사건 경위 등 요구""",,[파이낸셜뉴스]  조현 외교부 장관이 호르무즈 해협에서 발생한 한국 선박 'HMM 나무호' 피격 사건과 관련해 이란 측에 사실관계와 공식 입장을 요구했다.17일 외교부에 따르면 조 장관은 이날 오후 세예드 압바스 아락치 이란 외교장관과 전화 통화를 하고 이 같은 요구와 함께 최근 중동 정세와 호르무즈 해협 내 선박 안전 문제 등을 논의했다.조 장관은 통화에서 정부…,2026.05.17 18:49,https://www.fnnews.com/news/202605171835134116,파이낸셜뉴스
"코트라, 美서 K드론 경쟁력 입증",,대한무역투자진흥공사(코트라)가 세계 최대 무인기 전시회에서 한국 드론 기업들의 해외 판로 확대 지원에 나섰다. 코트라는 지난 11~14일(현지시간) 미국 디트로이트에서 열린 무인 이동체 전시회 '엑스포넨셜'에서 한국관을 운영했다고 17일 밝혔다. 엑스포넨셜은 국제무인운송기협회(AUVSI)가 주최하는 세계 최대 규모 무인 이동체 전시회다. 올해는 60개국에서 8500명…,2026.05.17 18:33,https://www.fnnews.com/news/202605171833474890,파이낸셜뉴스
광학 매출 대박… LG이노텍 '1조 클럽' 복귀 기대,,LG이노텍이 연간 '영업이익 1조 클럽' 재진입 가도에 청신호를 켰다. 부품업계의 고질병인 저수익 구조를 깨고 올해 1·4분기 수익성을 대폭 키운 것으로 나타났다. 주력인 카메라 모듈 사업에서의 고부가 제품 판매를 키우고 반도체 기판을 담당하는 패키지솔루션 사업도 성장세를 이어가면서다. 업계에서는 올해 LG이노텍이 지난 2022년 이후 4년 만에 연간 영업…,2026.05.17 18:33,https://www.fnnews.com/news/202605171833460803,파이낸셜뉴스
"高價 가전도 구독.. LG전자, SKS·시그니처 최대 6년간 원스톱 관리",,"LG전자가 초프리미엄 가전 브랜드를 대상으로 한 전용 구독 서비스를 출시하며 고가 가전 시장 공략에 나섰다. 제품 판매를 넘어 컨설팅부터 설치, 유지관리까지 아우르는 '경험 중심 서비스' 전략을 강화하는 모습이다. LG전자는 프리미엄 브랜드 SKS와 LG 시그니처를 대상으로 한 구독 서비스를 새롭게 론칭했다고 17일 밝혔다. 이번 서비스는 제품 구매 전 상담부터 배…",2026.05.17 18:33,https://www.fnnews.com/news/202605171833434277,파이낸셜뉴스
'中내수 기지' 기아 옌청의 반전… 신흥국 수출거점 우뚝,,"기아 옌청 공장의 중국 내수 비중이 4년 새 74%에서 30% 아래로 추락했다. 대신 생산 물량의 70%가 중남미·중동 등 제3국으로 나가면서, 중국 공장이 사실상 신흥시장 수출기지로 변모했다. 한때 중국 시장 공략용으로 출시된 소형 세단 페가스(Pegas)는 올 1~4월 2만여 대가 팔렸지만 중국 소비자가 산 것은 한 자릿수에 그쳤다. ■수출이 내수 추월한 건 2024…",2026.05.17 18:33,https://www.fnnews.com/news/202605171833430291,파이낸셜뉴스
최창원표 'SK 리밸런싱' 3년… 수익·재무 다 잡았다,,"최창원 SK수펙스추구협의회 의장이 지난 3년간 추진해 온 SK그룹의 사업 포트폴리오 재편(리밸런싱)이 재무 및 실적 개선에 가시적 성과를 내고 있는 것으로 나타났다. 최 의장은 확장 중심 성장 전략에서 벗어나 선택과 집중, 재무 안정, 생산성 혁신을 축으로 체질 개선에 방점을 둬 왔다. ■고강도 구조개편, 부채비율 하락 17일 업계에 따르면 SK그룹 지주사 SK㈜는 올해 1…",2026.05.17 18:33,https://www.fnnews.com/news/202605171833409926,파이낸셜뉴스
복지부 '그냥드림' 18일부터 본격 시행,,보건복지부는 18일부터 전국 158개 시군구 280개소 사업장에서 그냥드림 본사업을 시행한다고 17일 밝혔다. 올해 안에 전국 모든 229개 시군구 300개소 이상 사업장으로 확대할 계획이다. 그냥드림 사업은 갑작스러운 생계 위기 등으로 어려움을 겪는 국민에게 복잡한 신청 절차나 소득 증빙 없이 먹거리와 생필품을 신속하게 지원하는 제도다. 생계가 어려운 국민이 사업…,2026.05.17 18:31,https://www.fnnews.com/news/202605171831493826,파이낸셜뉴스
인공위성·AI로 농지 전수조사…경기도는 전체 드론 촬영,,농림축산식품부가 18일부터 지자체와 함께 농지 투기 근절과 데이터베이스(DB) 구축을 위한 전수조사를 진행한다. 투기 우려가 높은 경기도 전체 농지는 드론으로 촬영할 예정이다. 전수조사는 2년 동안 진행된다. 올해는 농지법이 시행된 1996년 1월 이후 취득한 농지를 대상으로 이달부터 7월까지 '기본조사'와 8월부터 12월까지 '심층조사'를 단계적으로 실시한다. 17…,2026.05.17 18:31,https://www.fnnews.com/news/202605171831482347,파이낸셜뉴스
"구윤철, 런던서 '코리아 세일즈'",,구윤철 부총리 겸 재정경제부 장관이 영국과 프랑스를 잇달아 방문해 해외 투자자들을 대상으로 한국 경제 투자 유치에 나선다. 주요 7개국(G7) 재무장관·중앙은행 총재 회의에도 참석해 중동 전쟁 장기화에 따른 글로벌 경제 현안과 국제 공조 방안을 논의할 예정이다. 17일 재정경제부에 따르면 구 부총리는 18일(현지시간) 영국 런던에서 글로벌 주요 투자기관…,2026.05.17 18:31,https://www.fnnews.com/news/202605171831477213,파이낸셜뉴스
‘AI 물가 낙관론’ 워시 연준 이번주 출범… 시장은 금리인상에 베팅,,지난 13일(현지시간) 미국 상원이 케빈 워시 차기 연방준비제도(연준) 의장(사진) 인준안을 통과시키면서 새 연준이 이번 주 공식 출범한다. 그러나 시장은 인공지능(AI)이 물가를 구조적으로 낮출 것이라는 워시의 낙관론보다 이란 전쟁발 유가 급등과 인플레이션 재확산 가능성에 더 주목하며 금리 인하보다 인상 가능성을 가격에 반영하는 분위기다. 인준안은 54 대 …,2026.05.17 18:29,https://www.fnnews.com/news/202605171829093483,파이낸셜뉴스
"中 ""美와 특정분야 관세인하 합의… 농산물·항공기 등 협력""",,"중국과 미국은 14·15일 베이징 정상회담의 합의를 기초로 특정 분야의 관세 인하와 비관세 장벽 완화 등을 실행해 나가기로 했다. 중국 상무부 대변인은 16일 미중 정상회담 결과, 경제·무역 분야에서 초보적 성과들을 거뒀다면서 이 같이 발표했다. 상무부 대변인은 ""양국은 일정 범위 제품에 대한 상호 간의 관세 인하 등의 조치를 통해 농산물을 …",2026.05.17 18:29,https://www.fnnews.com/news/202605171828582764,파이낸셜뉴스
"김민석 ""긴급조정권 등 모든 수단 강구"".. 이재용 ""우리는 가족… 힘 모아야 할 때"" [삼성전자 파업 D-3]",,정부가 삼성전자 파업으로 국민경제에 막대한 피해가 우려될 경우 긴급조정권을 발동하겠다는 의지를 밝혔다. 삼성전자 총파업 예정일을 사흘 남겨놓고 18일 재개되는 2차 사후조정을 앞둔 가운데 정부가 긴급조정 가능성까지 언급하며 노사에 조속한 타협을 촉구한 것이다. 이에 앞서 이재용 삼성전자 회장은 대국민 사과와 함께 노사 화합 메시지를 전달했다.김민석 …,2026.05.17 18:27,https://www.fnnews.com/news/202605171827060340,파이낸셜뉴스
조세특례 일몰제 말뿐 10년동안 87%나 유지[일몰 없는 일몰제],,정부가 관행적 세금감면 축소를 내세우며 조세지출 구조조정 방침을 밝힌 가운데 지난 10년간 일몰 도래 조세특례 대부분이 반복 연장을 통해 유지된 것으로 나타났다. 한시 제도로 도입된 조세특례가 사실상 상시 제도로 고착되면서 향후 구조조정 과정에서도 상당한 저항이 불가피할 것이란 지적이 나온다. 17일 파이낸셜뉴스가 김상훈 국민의힘 의원실을 통해 입수한 '…,2026.05.17 18:27,https://www.fnnews.com/news/202605171827055936,파이낸셜뉴스
"[속보]조현, 이란 외교장관과 통화…""나무호 피격 관련 사실관계 입장 요구""",,[파이낸셜뉴스]  y27k@fnnews.com 서윤경 기자,2026.05.17 18:28,https://www.fnnews.com/news/202605171826569737,파이낸셜뉴스
"""극적타결 안되면 100조 피해""… 최악상황 대비하는 삼전[삼성전자 파업 D-3]",,"삼성전자 노조가 예고한 총파업이 사흘 앞으로 다가온 가운데 삼성전자는 총파업 가능성에 대비해 내부적으로 비상관리체제에 돌입했다. 반도체 공정 특성상 생산라인이 한 번 멈출 경우 수율(양품 비율) 안정화와 공급망 복구에만 수주 이상의 시간이 소요될 수 있는 만큼, 삼성전자도 선제 대응에 나선 것으로 풀이된다. 노사가 다시 협상 테이블에 마주 앉으면서 막…",2026.05.17 18:23,https://www.fnnews.com/news/202605171823266711,파이낸셜뉴스
"삼성전자 가처분 소송에 쏠린 눈… 법원, 파업 직전까지 결론 미루나[삼성전자 파업 D-3]",,"삼성전자 노사가 총파업을 사흘 앞둔 18일 대화를 재개키로 하고, 정부도 긴급조정권을 처음 언급하면서 위법 쟁의행위 금지 가처분 소송에도 영향을 미칠지 주목된다. 당초 18~19일이 유력한 재판부의 결론 디데이로 거론됐지만, 상황이 긴박하게 돌아가면서 파업 직전까지 결론을 내지 않을 가능성도 점차 커지는 상황이다. 서초동의 한 변호사는 17일 ""이미 심문 …",2026.05.17 18:23,https://www.fnnews.com/news/202605171823254749,파이낸셜뉴스
"""노조 위원장 월 1000만원 수당""… 삼전 초기업노조 대표성 '흔들'[삼성전자 파업 D-3]",,삼성전자 노조가 예고한 총파업이 나흘 앞으로 다가온 가운데 가전·휴대폰 등 완제품(DX) 부문 조합원들의 대규모 탈퇴 움직임으로 최대 노조(초기업노조)의 대표성이 시험대에 올랐다. 이번 임금교섭이 반도체(DS) 부문 중심으로 진행되고 있다는 불만이 확산되면서 DX 조합원 이탈이 이어지는 모습이다. 약 3000명이 추가 탈퇴할 경우 초기업노조가 확보한 과…,2026.05.17 18:23,https://www.fnnews.com/news/202605171823211516,파이낸셜뉴스
"금융당국, 靑 눈치보기?.. 굵직한 현안 줄줄이 표류",,금융당국의 핵심 현안들이 줄줄이 표류하고 있다. 굵직한 이슈들이 계속 밀리며 현장의 불확실성이 커지는 가운데 금융권 안팎에서는 당국이 '윗선 눈치보기'에 매몰됐다는 비판이 나온다. 17일 금융당국 및 금융권에 따르면 오랫동안 당국 논의 단계에 머물러 있는 주요 현안으로는 △금융지주 지배구조 개선 △은행권 홍콩H지수 주가연계증권(ELS) 불완전판매 제재 △비…,2026.05.17 18:21,https://www.fnnews.com/news/202605171821205117,파이낸셜뉴스
"올해 끝나는 조세특례 66건…국회 ""연장"" 정부는 ""관행 손질""[일몰 없는 일몰제]",,"정부가 '1회 연장 후 폐지' 원칙까지 내세우며 조세지출 구조조정에 나서고 있지만, 정작 국회에서는 일몰 조세특례 연장 법안이 잇따라 발의되고 있다. 정비 기조를 강조하는 정부와 달리 입법 현장에서는 연장 중심 의사결정이 반복되면서 정책과 입법 간 괴리가 커지는 모습이다. 전문가들은 이해관계 영향을 줄이기 위한 구체적 평가기준과 함께 조세감면이 재정투…",2026.05.17 18:21,https://www.fnnews.com/news/202605171821178274,파이낸셜뉴스
"[인터뷰] ""기업이익·밸류에이션 전망 밝아 이번 조정 비중확대 기회로 봐야""",,"코스피가 8000선 입성 후 급락했지만 이를 상승 추세 마무리로 보기에는 이르다는 진단이 나왔다. 기업 이익 전망이 빠르게 상향되는 실적장세가 이어지고 있는 만큼 단기 변동성은 주식 비중을 줄일 신호가 아니라 분할매수 기회로 활용해야 한다는 분석이다. 양지환 대신증권 리서치센터장(사진)은 17일 인터뷰에서 ""지정학적 리스크, 인플레이션 압력 등에 따른…",2026.05.17 18:19,https://www.fnnews.com/news/202605171819363768,파이낸셜뉴스
금융위기때보다 매서운 외인 100조 매도세… 코스피 '경계감',,연초 이후 외국인 자금이 유가증권시장에서만 100조원가량 빠져나갔다. 현 추세라면 올해 외국인 매도폭탄은 사상 최대 규모가 될 것으로 보인다. 다만 '셀 코리아(Sell Korea)'보다는 글로벌 펀드들의 비중조절을 위한 차익실현에 무게가 실려 중장기 상승 추세는 유효하다는 의견이 우세하다. 17일 코스콤 CHECK에 따르면 외국인은 연초 이후 지난 15일까지 코스피 시…,2026.05.17 18:19,https://www.fnnews.com/news/202605171819344750,파이낸셜뉴스
휴머노이드 상용화 수혜 기대 상장 한달만에 수익률 48%[이런 펀드 어때요?],,휴머노이드 로봇 산업에 기대감이 커지면서 현대차 등 로봇 관련주로 개인투자자들의 뭉칫돈이 몰리고 있다. 실제 현대차 등 로봇 관련 주에 집중 투자하는 ACE K휴머노이드로봇산업TOP2+ 상장지수펀드(ETF)는 상장 한 달여 만에 수익률이 50%에 근접했다. 17일 금융투자업계와 한국투자신탁운용에 따르면 ACE K휴머노이드로봇산업TOP2+ETF는 상장일인 지난달 7일 이후 …,2026.05.17 18:17,https://www.fnnews.com/news/202605171817028598,파이낸셜뉴스
엔비디아 실적·삼성전자 파업 ‘핵심 변수’[주간 증시 전망],,"이번 주 코스피는 단기 과열 부담과 실적 기대 공존으로 변동성 장세를 이어갈 전망이다. 증권가는 이번 주 코스피 예상 밴드를 7200~8100p로 제시했다. 18일 한국거래소에 따르면 지난주(11~15일) 코스피는 7498.00에서 7493.18로 내려 0.06% 하락했다. 같은 기간 개인은 20조9142억원 순매수하며 지수 하단을 받쳤고, 외국인과 기관은 각각 19조7831억원, 1조6340억원 …",2026.05.17 18:17,https://www.fnnews.com/news/202605171817016870,파이낸셜뉴스
스타십 띄우자 우주항공 질주… 차익실현에 AI전력은 주춤[ETF 스퀘어],,미국 우주항공 ETF가 국내 상장지수펀드(ETF) 시장 수익률 상위권을 휩쓸었다. 스페이스X의 스타십 시험발사 기대감과 저궤도 위성·우주 인프라 투자 확대 전망이 맞물린 영향으로 풀이된다. 반면 최근 강세를 보였던 인공지능(AI) 전력기기 ETF는 차익실현 매물 출회로 약세를 나타냈다. 17일 한국거래소에 따르면 지난 11~15일 국내 ETF 가운데 수익률 1위는 '…,2026.05.17 18:17,https://www.fnnews.com/news/202605171816551028,파이낸셜뉴스
"일찍 취업한 20대 직장인 ""본격적으로 저축해 보려 하는데 막막해요""[재테크 Q&A]",,"Q. 5년차 간호사인 20대 A씨는 비교적 빠르게 취업한 뒤 직장 인근에서 자취를 하고 있다. 그동안 저축을 제대로 못했던 것 같아 지출을 줄이고 본격적으로 시작하려 한다. 야간 근무가 많아 월급은 380만~410만원으로 달마다 편차가 있는 편이다. 그동안은 입출금통장에 자금이 모이면 정기예금으로 옮겨뒀었고, 주식 투자도 시작해 수익을 본 상태다. 저축과 투자를 얼…",2026.05.17 05:00,https://www.fnnews.com/news/202605171816528515,파이낸셜뉴스
K제조업 ETF도 美증시 입성,,미국 증시에 한국 주요 제조기업을 담은 상장지수펀드(ETF)가 상장됐다. 17일 한화자산운용에 따르면 지난 7일(미국 동부 시간 기준) 파트너사인 미국 현지 운용사 ETC가 'K제조핵심ETF'를 미국 나스닥 시장에 상장했다. 앞서 한화자산운용이 개발한 K제조핵심지수가 기반이 됐다. 한화자산운용은 최근 미국 투자자들 사이에서는 한국 주식이 단순한 신흥국 인덱스의 일부…,2026.05.17 18:13,https://www.fnnews.com/news/202605171813228628,파이낸셜뉴스
