title,thumbnail,short_content,write_time,link,company
"""서울대 합격? 안 갈래요""..정시 최초합격자 124명, 등록포기",,"[파이낸셜뉴스]  2025학년도 서울대학교 정시모집 최초합격자 중 124명이 등록을 포기한 것으로 나타났다.13일 종로학원은 2025학년도 서울대 정시 최초합격자 중 124명이 등록을 포기했고 밝혔다. 이는 전체 모집인원의 8.9%이며, 전년보다 97명(7.1%) 늘어난 수치다.계열별로 살펴보면 인문계열 등록포기자는 27명으로 지난해(20명)보다 7명 늘었으며, 자연계열 등..",2025.02.14 05:10,https://www.fnnews.com/news/202502131916557807,파이낸셜뉴스
손잡은 부산교통공사·신라대 '교통인재 육성',,"부산교통공사는 신라대학교와 13일 산학 협력체계 구축을 위한 업무협약을 체결했다고 밝혔다. 이번 협약에 따라 두 기관은 상호홍보를 통한 발전, 공공안전 확보, 미래인재 양성이라는 목표 달성을 위해 적극적으로 협력한다는 계획이다. 구체적으로 친환경 도시철도 이용과 신라대학교를 서로 홍보하고, 공공안전을 위한 도시철도 안전이용 합동 캠페인과 미래교통인..",2025.02.13 19:16,https://www.fnnews.com/news/202502131916292021,파이낸셜뉴스
"부산대 학생, 치과의사 국가시험 수석",,"부산대학교가 지난달 시행된 치과의사 국가시험 필기시험에서 전국 수석을 배출했다. 부산대학교(총장 최재원)는 치의학전문대학원 4학년 최영운 학생(사진)이 지난 5일 최종 합격자가 발표된 '2025년 제77회 치과의사 국가시험'에서 필기시험 전국 수석을 차지했다고 13일 밝혔다. 제77회 치과의사 국가시험에는 전국에서 783명이 응시해 716명이 합격, 91.4%의 합격률..",2025.02.13 19:16,https://www.fnnews.com/news/202502131916244330,파이낸셜뉴스
SNT모티브·부산대 '산학협력 강화' 업무협약,,SNT모티브와 부산대학교는 지난 12일 SNT모티브 부산 본사에서 산학협력 강화를 위한 업무협약(MOU)을 체결했다고 13일 밝혔다. 이번 협약은 미래 인재를 양성하고 기술교류를 통한 산학협력 네트워크 구축과 지역산업 발전 등을 위해 마련됐다. SNT모티브와 부산대는 이번 협약을 통해 △인적 및 기술정보 교류 △시설 및 장비 교류 △학생 현장실습 및 취업기회 제공 ..,2025.02.13 19:16,https://www.fnnews.com/news/202502131916165300,파이낸셜뉴스
"자우림 美콘서트 잠정 연기에..""CIA 신고 효과 좋다"" 주장, 무슨 일?",,"[파이낸셜뉴스] 밴드 자우림의 미국 뉴욕 콘서트가 잠정 연기된 가운데, 배경을 두고 추측이 난무하고 있다.여권 지지자들 사이에서는 자우림을 미국 중앙정보국(CIA)에 신고한 것이 영향을 미쳤다는 주장이 나왔지만, 자우림 측은 ""사실무근""이라고 선을 그었다.13일 자우림의 소속사 인터파크엔터테인먼트는 ""오는 3월 22일 뉴욕 맨해튼에서 열릴 예정이던 자..",2025.02.14 04:50,https://www.fnnews.com/news/202502131916135842,파이낸셜뉴스
"허욱 태웅 사장, 착한결제 릴레이 캠페인 참여",,"부산시는 지난 12일 허욱 ㈜태웅 사장이 '부산형 착한결제 캠페인' 민간기업 5호로 참여했다고 13일 밝혔다. 허 사장은 이날 부산 강서구청 경제국장과 함께 명지시장을 방문해 식당 3곳에서 직원 식비를 선결제하며 지역경제 활성화에 힘을 보탰다. 태웅은 1981년 설립 이후 조선, 원자력, 풍력, 석유화학 플랜트, 우주항공 등 다양한 산업 분야의 국내외 고객사에 고..",2025.02.13 19:16,https://www.fnnews.com/news/202502131916128976,파이낸셜뉴스
부울경 기업 육성 '비앤케이 미래혁신성장 펀드' 결성,,"BNK금융그룹은 계열사인 BNK벤처투자를 통해 부산, 울산, 경남 지역 벤처 및 스타트업 생태계 활성화를 목적으로 '비엔케이 미래혁신성장 펀드'를 결성했다고 13일 밝혔다. 펀드의 주요 출자자로 BNK금융그룹 내 자회사인 부산은행, 경남은행, 캐피탈, 벤처투자가 참여했다. 부산은행이 100억원을 출자하고 나머지 3개사가 각각 50억원을 출자해 총 250억원 규모다. 동..",2025.02.13 19:14,https://www.fnnews.com/news/202502131914111344,파이낸셜뉴스
"부산문화회관 조직개편 단행 ""시설→직무 중심으로""",,"(재)부산문화회관이 13일 부산문화회관·부산시민회관 등 기존의 시설 중심 조직을 직무 중심으로 바꾸는 대대적인 조직 개편을 단행했다. 조직 개편에 따른 일부 직원의 인사도 병행했다. 변화하는 공연장 환경에 대응하고, 통합과 신설이라는 효율적인 조직 운영을 통해 시너지효과를 높이겠다는 포석이다. 지속가능한 성장을 위해 전문위원 제도도 도입한다. 기..",2025.02.13 19:14,https://www.fnnews.com/news/202502131914075635,파이낸셜뉴스
'센텀2지구 도심융합특구' 사업 추진 방향 논의,,"부산 해운대구 일대에 들어설 센텀2지구 도심융합특구 조성사업이 본격화될 전망이다. 산단은 부산지역 최대 4차 산업 거점으로 조성되며, 양질의 일자리 창출 등 대규모 경제 파급효과가 기대된다. 부산도시공사는 지난 12일 센텀2지구 도시첨단산업단지(산단) 도심융합특구의 실시계획 수립 용역 착수회의를 진행했다고 13일 밝혔다. 공사에 따르면 이번 회의는 실시계..",2025.02.13 19:14,https://www.fnnews.com/news/202502131914030484,파이낸셜뉴스
"""불법 생숙 넘칠라"" 용도변경 컨설팅 제공",,부산시는 생활숙박시설의 불법적 주거 사용을 방지하고 합법적 사용을 유도하기 위해 숙박업 신고 안내와 함께 용도변경 컨설팅 제도를 추진한다고 13일 밝혔다. 이번 지원 제도는 국토교통부가 지난해 10월 발표한 '생활 숙박시설 합법 사용 지원방안'에 따라 시민들이 생활 숙박시설을 오피스텔로 변경할 때 발생할 수 있는 법적 장애요인 등을 미리 파악해 숙박업 신고..,2025.02.13 19:14,https://www.fnnews.com/news/202502131914004321,파이낸셜뉴스
연초부터 3500만弗… 부산진해경자청 투자 유치 순항,,"부산진해경제자유구역청이 2025년 투자유치 목표를 향해 순항 중이다. 박성호 청장 취임 이후, 투자유치를 위한 전략적 행보가 가시적인 성과로 이어지면서 국내외 기업들의 관심도 집중되고 있다. 13일 부산진해경자청에 따르면 지난 12일 기준, 외국인 직접투자(FDI) 신고 3900만 달러, 도착 3500만 달러를 달성했다. 이는 부산진해경자청의 올해 신고 기준 목표액 1억8..",2025.02.13 19:13,https://www.fnnews.com/news/202502131913585315,파이낸셜뉴스
"""북극항로, 글로벌 허브도시 부산 도약 기회""",,"부산시는 북극항로 개척을 통한 글로벌 무역경제의 전략적 우위를 선점하기 위해 '부산 북극항로 개척 전담조직(TF)'을 구성하고 13일 첫 회의를 했다고 밝혔다. 시는 이날 TF 첫 회의에서 '북극항로 허브도시 부산'을 구축하기 위한 실질적인 정책과제 발굴과 실행방안을 모색했다. TF는 시 김광회 미래혁신부시장을 단장으로 선사, 학계, 연구기관, 공공기관 등에서 19..",2025.02.13 19:12,https://www.fnnews.com/news/202502131912407331,파이낸셜뉴스
"남포동·서면 곳곳에 ‘임대 현수막’… 전통시장도 ""손님 줄어""",,"지난 10일 오후 부산 중구 남포동 중앙광장. 평소 관광객과 시민들로 붐비는 대표 상업 지역이지만 거리는 한산했다. 경기침체와 견디기 힘든 고금리에 짓눌려 가장 눈에 띄는 것은 인파가 아니라 곳곳에 걸린 '임대 문의' 현수막과 텅 빈 점포들이었다. 중앙광장 주변 건물 4곳이 임대 상태였으며, 그중 한 곳은 20평 규모의 3층 건물이 통째로 공실이었다. 롯데백화점..",2025.02.13 19:12,https://www.fnnews.com/news/202502131912365510,파이낸셜뉴스
북항 1단계 재개발구역에 해양 기관 클러스터 조성,,"해양수산부는 부산항 북항 재개발사업 활성화를 위해 부산항 북항 1단계 재개발사업 구역에 해양 관련 기관 클러스터를 조성한다고 13일 밝혔다. 이를 위해 해수부는 14일 부산항국제전시컨벤션센터(BPEX)에서 부산항만공사와 한국해양진흥공사, 한국해양수산개발원 등 6개 기관과 업무협약(MOU)을 체결한다. 해양기관 클러스터는 북항 1단계 재개발사업 구역에 있는 '복..",2025.02.13 19:10,https://www.fnnews.com/news/202502131910445624,파이낸셜뉴스
"""1인 기업도 쑥쑥 크게 AI로 마케팅 돕죠"" [fn이사람]",,"""이제 자리 잡았냐고요? 아니요, 해외에서 더 커야죠."" 커머스 인공지능전환(AX) 전문 스타트업 인덴트코퍼레이션은 최근 4·4분기 실적을 발표하며 창업 이래 첫 흑자전환 소식을 알렸다. 연간 매출로 보면 최근 3년 동안 무려 100배 이상 성장했고, 직원 수는 2년 전에 비해 2배 이상 늘어났다. 인덴트는 '1인 브랜드도 연 매출 1조원을 달성하도록 돕는 기..",2025.02.13 19:09,https://www.fnnews.com/news/202502131909528325,파이낸셜뉴스
이석준 CJ 미래경영연구원장·인재원장 임명,,"CJ그룹이 최근 이석준 전 NH농협금융지주 회장(사진)을 CJ 미래경영연구원장 겸 인재원장으로 영입했다고 13일 밝혔다. 이 원장은 기획재정부, 금융위원회 등을 거친 대표적인 재정금융 정책 전문가다. 국무조정실장, NH농협금융지주 회장 등을 역임했다. CJ그룹 관계자는 ""이 원장은 인재원장을 겸임하며 그룹 중기전략 달성 및 미래성장 방향을 제시하는 역할을 ..",2025.02.13 19:09,https://www.fnnews.com/news/202502131909427888,파이낸셜뉴스
"파두, 삼전 출신 김태균 CBO 영입",,"파두가 최고사업개발책임자(CBO)를 영입하고 '플렉스 SSD' 사업을 본격 추진한다. 13일 관련 업계에 따르면 최근 파두 CBO로 합류한 김태균 부사장(사진)은 삼성전자에서 DS부문 전략기획, 사업분석리더 등을 역임하며 신사업 전략 수립과 추진 분야에서 풍부한 경험을 쌓았다. 강경래 기자",2025.02.13 19:09,https://www.fnnews.com/news/202502131909294095,파이낸셜뉴스
"한국공항공사 ""소음 피해지 활용""",,"한국공항공사는 최근 양천구와 항공기 소음지역 내 매수부지 활용을 위한 업무협약을 체결했다고 13일 밝혔다. 이정기 한국공항공사 사장직무대행(사진)은 ""공사의 자원을 활용한 민관 협력 사업을 통해 소음지역 주민을 적극 지원하고 지역경제를 활성화할 것""이라고 전했다. moving@fnnews.com 이동혁 기자",2025.02.13 19:09,https://www.fnnews.com/news/202502131909212937,파이낸셜뉴스
KCC글라스·서초구 자립준비청년 정착 돕는다,,"KCC글라스가 서울 서초구와 협력해 안정적인 자립준비청년 사회 정착을 돕기 위한 지원을 이어간다. 13일 서초구청에 따르면 KCC글라스가 서초구, 방배아트유스센터, 반포종합사회복지관과 함께 2025년 'Dream홈씨씨' 사업 추진을 위한 업무협약을 체결했다. 협약식에는 김명주 KCC글라스 이사, 전성수 서초구청장, 이정연 방배아트유스센터 관장, 조미진 반포종합사회..",2025.02.13 19:09,https://www.fnnews.com/news/202502131909142135,파이낸셜뉴스
"에쓰오일, 대학생들 모아 '한·아랍 청년교류' 지원",,에쓰오일은 '에쓰오일과학문화재단' 주최로 오는 15일까지 '한-아랍 청년교류 프로그램'을 진행하고 있다고 13일 밝혔다.이번 행사는 한국과 사우디아라비아의 상호 교류를 통해 문화 및 역사에 대한 상호 이해와 글로벌 인식 확대를 통한 글로벌 리더로의 성장을 도모하고자 마련됐다. '한-아랍 청년교류 프로그램'은 지난해 사우디 대학생 12명을 한국으로 초청하여 9..,2025.02.13 19:09,https://www.fnnews.com/news/202502131909078989,파이낸셜뉴스
"현대위아, 창원 복지기관 10곳에 드림카 기증",,"현대위아는 지난 12일 경남 창원특례시 '다옴 장애인보호작업장' 등을 포함, 총 10곳의 복지기관에 '현대위아 드림카'를 기증했다고 13일 밝혔다. 현대위아가 지난 2013년부터 전국 복지기관에 전달한 차량은 올해로 총 180대에 달한다. 현대위아는 '1% 기적'을 통해 모은 기금과 회사 출연금을 합한 약 5억원으로 기증차량을 마련했다. 1% 기적은 임직원이 월급의 1%를..",2025.02.13 19:09,https://www.fnnews.com/news/202502131909024873,파이낸셜뉴스
[인사] 법무부 外,,◆법무부 ◇고위공무원 승진 △서울소년분류심사원장 이법호 ◇부이사관 승진 △법무부 인권정책과장 노일석 △대구보호관찰소장 이용호 △부산보호관찰소장 염정훈 ◇부이사관 전보 △국립법무병원 행정지원과장 오유진 △대전보호관찰소장 김시종 △광주보호관찰소장 정성수 ◇서기관 전보 △법무부 전자감독과장 김근한◆항공안전기술원 ◇직책승진 △기획경영본부장 ..,2025.02.13 19:08,https://www.fnnews.com/news/202502131908571034,파이낸셜뉴스
"박형준 부산시장, 신방주호 화재에 “행정력 총동원해 지원”",,"[파이낸셜뉴스]  부산시는 13일 전북 부안 해상에서 발생한 부산 선적 ‘제2022 신방주호’ 화재 사고와 관련해 시청 재난안전대책본부에서 박형준 시장이 주재하는 비상 대책회의를 열었다.박 시장은 회의에서 “정부와 전라북도, 부안군, 해경 등과 긴밀한 공조체계를 유지하고, 개인 어선이라 실종자 가족에 대한 지원 등이 부족할 수 있는 만큼 행정력을 총동원해 적..",2025.02.13 19:04,https://www.fnnews.com/news/202502131902095831,파이낸셜뉴스
"삼성생명, 화재 품는다... 자회사 편입 신청 제출",,"삼성생명이 13일 금융당국에 삼성화재에 대한 자회사 편입을 신청했다. 금융당국에 따르면 삼성생명은 이날 금융위원회에 삼성화재에 대한 자회사 편입 신청서를 제출했다. 이에 따라 금융감독원은 자회사 등 편입승인 심사를 진행할 예정이다. 심사기간은 2개월이며, 최종 승인 여부는 금융위 전체회의에서 의결된다. 삼성생명의 삼성화재 자회사 편입 가능성은 지난달..",2025.02.13 19:01,https://www.fnnews.com/news/202502131901372033,파이낸셜뉴스
우크라戰 끝 보인다… 1300조 재건사업 꿈틀 [끝 보이는 우크라전쟁],,도널드 트럼프 미국 대통령이 블라디미르 푸틴 러시아 대통령과 우크라이나 전쟁 종전협상을 즉각 시작하기로 합의했다. 이에 따라 우크라이나 재건사업에 전 세계 기업들의 관심이 몰리는 가운데 국내 건설업계는 일찌감치 인접국인 폴란드에서 법인·지사를 설립하며 수주 물밑작업을 진행 중이다. 다만 현장에서는 정부가 팔을 걷어붙이지 않는 한 수혜는 제한..,2025.02.13 19:01,https://www.fnnews.com/news/202502131901320557,파이낸셜뉴스
원자재 수급 안되면 책임준공 연장… 시공사 부담 덜어준다 [책임준공기간 연장 사유 확대],,"천재지변이나 전쟁 등 극히 제한적이었던 시공사 및 부동산신탁사의 책임준공 기간 연장사유가 확대된다. 태풍이나 홍수, 폭염, 한파 등 기상상황을 비롯해 원자재 수급 불균형, 전염병 등도 일정 기준 연장사유로 인정된다. 책임준공 기간이 지나면 시공사가 즉시 100% 채무를 떠안아야 했던 관행도 사라진다. 책임준공 기간 종료 후 기간별로 시공사의 채무인수금액 ..",2025.02.13 19:01,https://www.fnnews.com/news/202502131901299856,파이낸셜뉴스
"사막 3200만㎞ 달리며 품질 테스트… 정의선 ""미래혁신 핵심"" [관세전쟁 속 미국 간 정의선]",,"""우리는 미래를 내다보면서 인공지능(AI), 로봇공학, 소프트웨어중심차(SDV), 전동화, 수소 기술과 같은 선구적인 기술에 집중해야 하고 이러한 혁신을 위해 모하비 주행시험장과 같은 연구시설은 핵심적인 역할을 하게 될 것이다."" 정의선 현대자동차그룹 회장이 현대차·기아의 품질경영을 상징하는 캘리포니아 주행시험장(모하비 주행시험장) 설립 2..",2025.02.13 18:57,https://www.fnnews.com/news/202502131857417685,파이낸셜뉴스
한번에 532㎞ 주행… 아이오닉9 출시,,"현대자동차가 처음 출시하는 전동화 플래그십 스포츠유틸리티차(SUV) 모델인 아이오닉9(사진)을 국내 공식 출시한다. 아이오닉9은 국내를 시작으로 미국, 유럽 등 해외 시장에 순차 판매될 예정인데 글로벌 생산물량은 한국 공장이 맡고, 미국 판매분은 조지아주 신공장에서 생산하는 투트랙 체제를 가동한다. 13일 현대차에 따르면 아이오닉9은 E-GMP 기반의 대형 전동..",2025.02.13 18:57,https://www.fnnews.com/news/202502131857310823,파이낸셜뉴스
"美, 러와 단독으로 종전 논의… 유럽 ""협상판 빠질라"" 견제 [끝 보이는 우크라전쟁]",,"러시아·우크라이나 전쟁 종식을 위한 종전협상이 미국 주도로 속도를 내고 있다. 도널드 트럼프 미국 대통령은 12일(현지시간) 블라디미르 푸틴 러시아 대통령, 볼로디미르 젤렌스키 우크라이나 대통령과 연속 전화통화를 갖고 전쟁 종식 협상에 들어간다는 합의를 이끌어 냈다. 그는 이날 백악관에서 기자들을 만나 푸틴, 젤렌스키와 좋은 통화를 가졌다면서 &q..",2025.02.13 18:54,https://www.fnnews.com/news/202502131854301837,파이낸셜뉴스
"美국방, 우크라에 '양보' 압박... ""2014년전 영토회복은 불가능"" [끝 보이는 우크라전쟁]",,"미국의 도널드 트럼프 대통령이 러시아에 유리한 방향으로 우크라이나 전쟁 종료를 추진하면서 전후 처리에 혼란이 예상된다. 우크라 관계자들은 침략전쟁을 일으킨 러시아가 추가로 무엇을 요구할지 모른다며, 잠시 포성이 멈춘다고 해도 전쟁이 다시 터진다고 보고 있다. 12일(현지시간) 피트 헤그세스 미국 국방장관은 벨기에 브뤼셀의 나토 본부에서 우크라의 나토 ..",2025.02.13 18:54,https://www.fnnews.com/news/202502131854263234,파이낸셜뉴스
전력기기도 관세폭탄 맞나… 초고압 변압기 반덤핑 관세 4월 최종결정,,트럼프발 '관세폭탄' 우려가 전 산업 분야로 퍼지고 있는 가운데 국내 주요 전력기기 업계도 긴장의 끈을 놓지 못하고 있다. 미국 시장에 수출한 초고압 변압기에 뒤늦게 고율관세가 부과될 경우 큰 타격을 입을 수 있어서다. 트럼프 1기 당시 최대 60% 수준까지 변압기에 고율 반덤핑(덤핑을 막기 위한 보호관세)을 확정했던 만큼 트럼프 2기 행정부의 움직임에 업계는..,2025.02.13 18:51,https://www.fnnews.com/news/202502131851250665,파이낸셜뉴스
"""日·유럽은 美관세 대응 나섰는데""… '리더십 공백'이 아쉬운 K철강",,"도널드 트럼프 미국 대통령이 미국으로 수입되는 모든 철강·알루미늄에 25%의 관세를 일률 부과하겠다고 발표한 가운데, 한국은 '리더십 공백'으로 외교전을 통한 협상이 난항을 겪을 것이란 우려가 나온다. 이에 고율관세로 인한 타격을 최소화해야 하는 국내 철강업계는 발을 동동 구르고 있다. 반면 최근 일본, 유럽 등 각국 정상급 인사들은 앞다퉈 트럼프 ..",2025.02.13 18:51,https://www.fnnews.com/news/202502131851163185,파이낸셜뉴스
"트럼프, 상호관세 곧 서명… 시장은 ""美 인플레 자극 우려"" ['관세폭탄 유탄' 美 물가 급등]",,도널드 트럼프 미국 대통령이 이르면 13일(현지시간) 예고했던 상호관세 부과 행정명령에 서명할 예정이다. 상호관세 부과 대상에서 자동차와 의약품 등 일부 품목이 제외될 가능성도 조심스럽게 제기됐다. 다만 1월 미국 소비자물가지수(CPI)가 시장의 예상보다 높게 발표돼 트럼프 대통령의 관세 부과가 인플레이션을 더욱 자극할 수 있다는 우려도 나오고 있다. ■상..,2025.02.13 18:51,https://www.fnnews.com/news/202502131851102356,파이낸셜뉴스
"""건설사 줄도산 막겠다지만… PF 신규대출 위축 불가피"" [책임준공기간 연장 사유 확대]",,금융당국이 검토 중인 '책임준공 기간 연장 관련 금융권 부동산 프로젝트파이낸싱(PF) 모범규준'은 그동안 건설업계가 제시했던 의견을 크게 반영한 것으로 보인다. 올해 건설경기 악화로 시공사(건설사)의 PF 채무인수 부담이 가중될 것이라는 위기감이 고조되는 가운데 책임준공에 대한 부담을 덜어줘 건설사의 줄도산을 막자는 취지로 해석된다. 다만 시공사가 짊어진 리스..,2025.02.13 18:49,https://www.fnnews.com/news/202502131849253018,파이낸셜뉴스
금 수요 폭발… 홈쇼핑도 '골드러시',,"글로벌 경제 불확실성으로 금 수요가 치솟자 유통업계에서도 '금 품귀현상'이 벌어지고 있다. 특히 홈쇼핑 업계는 장기 무이자 할부가 가능해 금 투자수요가 몰리고 있지만 물량 확보가 어려워 방송 편성 차질도 우려되고 있다. 13일 한국거래소에 따르면 금 가격은 이날 종가 기준 g당 16만900원으로, 금 거래소가 개장한 2014년 3월 이후 역대 최고치를 갈아치웠다. ..",2025.02.13 18:49,https://www.fnnews.com/news/202502131849193271,파이낸셜뉴스
"글로벌 IB 만난 최상목 ""국가신인도 사수가 최우선 목표""",,"최상목 대통령 권한대행 부총리 겸 기획재정부 장관이 ""국가신인도 사수와 민생경제 회복을 최우선 목표로 일관되고 체계적인 경제정책을 운영하고 있다""고 말했다. 또 ""자본시장 선진화가 차질 없이 추진될 수 있도록 '밸류업 지원 방안'을 안착시키기 위한 법안들이 국회에서 적극 논의돼야 한다""고 강조했다. 최상목 권한대행은 13일 정부서울청..",2025.02.13 14:30,https://www.fnnews.com/news/202502131846351786,파이낸셜뉴스
"김윤상 기재 2차관 ""1월 한달 민생회복 위해 45조 재정 집행""",,"김윤상 기획재정부 2차관은 13일 ""회계연도 개시 첫날인 1월 2일 역대 최대 규모의 민생 사업을 집행(3300억원)하는 등 1월 한 달 동안 총 45조원을 집행했다""고 밝혔다. 김 차관은 이날 정부서울청사에서 제4차 관계부처 합동 재정집행 점검회의를 열고 2025년 상반기 신속집행 추진현황 및 향후계획과 2025년 민생·경기진작 사업 추진계획 등을 논의했..",2025.02.13 16:00,https://www.fnnews.com/news/202502131846337099,파이낸셜뉴스
"한국농수산대, 농수산업 이끌 정예인력 592명 배출",,"한국농수산대학교는 14일 교내 대강당에서 졸업생과 교수, 학부모 등 800여명이 참석하는 제26회 학위수여식을 개최한다고 13일 밝혔다. 이날 학위수여식에서는 전문학사 478명, 학사 114명 등 592명이 학위를 받을 예정이다. 우수한 학업성적과 리더십을 발휘한 졸업생에게는 포상이 주어진다. 농림축산식품부 장관상에 특용작물학과 이유림씨, 화훼학과 박장웅씨, 한..",2025.02.13 18:46,https://www.fnnews.com/news/202502131846227709,파이낸셜뉴스
사다리타기·제비뽑기로 낙찰 순번 합의... 가구사 20곳 입찰담합에 과징금 183억,,"10년 넘게 진행된 20개 가구회사들의 입찰담합이 적발됐다. 공정거래위원회는 과징금 총 183억원을 부과하고, 한샘 등 4개사를 검찰에 고발하기로 했다. 공정위는 20개 가구사가 2012~2022년 16개 건설사가 발주한 총 190건의 시스템 가구 입찰에서 사전에 낙찰예정자와 입찰가격 등을 합의하고 이를 실행한 행위에 대해 시정명령과 함께 과징금 총 183억원(잠정)을 부과..",2025.02.13 12:00,https://www.fnnews.com/news/202502131846211204,파이낸셜뉴스
"野, 최상목에 마은혁 임명 압박…與는 헌재 흔들기 총공세",,"국회 본회의에서 경제 분야에 대한 대정부 질문이 이어졌지만 여야는 일부를 제외하고는 윤석열 대통령 비상계엄 선포와 관련한 '내란 프레임'과 '마은혁 헌법재판관 후보자 임명 여부'에 대한 공방을 주고 받았다. 특히 여아는 최상목 경제부총리 겸 대통령 권한대행을 가운데 두고 마 후보자 임명 여부 공방을 주고받는 한편, 내란 여부를 두고 여당은 '내란 프레임 ..",2025.02.13 18:44,https://www.fnnews.com/news/202502131844284300,파이낸셜뉴스
