title,thumbnail,short_content,write_time,link,company
주식·코인·금값 폭락... 커지는 위험회피 심리 [자산시장 충격파],,"'주식, 비트코인, 금' 등 이른바 투자자산 3대장이 일제히 악세로 돌아섰다. 미국의 정부 셧다운 장기화 우려 및 인공지능(AI) 버블 논란이 재점화되고, 원·달러 환율 상승 등이 외국인투자자들의 차익실현 욕구를 자극하면서 코스피지수가 장중 3800대까지 급락했다. 비트코인은 5개월 만에 10만달러가 붕괴되고, 금값은 온스당 4000달러를 밑도는 등 안전자산..",2025.11.05 18:27,https://www.fnnews.com/news/202511051826490721,파이낸셜뉴스
'美 셧다운 장기화'에 비트코인 10만달러 붕괴 [자산시장 충격파],,'디지털 골드'로 불리는 비트코인이 10만달러 붕괴로 지난 6월 이후 최저치로 주저앉았다. 미국 정부의 셧다운이 35일째 지속되며 역대 최장 기록을 경신하자 유동성 경색 우려가 위험자산 전반의 매도세로 이어졌다. 국제 금 가격도 사상 최고가 대비 10% 넘게 떨어졌다. 5일 글로벌 가상자산 정보 플랫폼 코인마켓캡에 따르면 비트코인은 이날 오후 3시 기준으로 전일..,2025.11.05 18:27,https://www.fnnews.com/news/202511051826447797,파이낸셜뉴스
"""제조현장 AX, 그 중심에 휴머노이드 로봇"" [2025 로보월드]",,"정부가 올해 제조 인공지능 전환(AX) 얼라이언스를 출범한 가운데 내년 휴머노이드 분야 얼라이언스가 본격 확대된다. 실제 제조현장에서 휴머노이드 활용이 크게 넓어질 전망이다. 5일 경기 고양시 킨텍스 제1 전시장에서 국내 최대 규모의 로봇 행사인 2025 로보월드가 역대 최대 규모로 개막했다. 산업통상부 신용민 제조산업정책관 직무대행은 ""올해 휴머노이..",2025.11.05 18:27,https://www.fnnews.com/news/202511051826384927,파이낸셜뉴스
전고점 넘은 서울 집값… ‘비한강벨트’는 소외 여전,,지난달 서울 아파트 가격이 전고점(2022년 1월)을 뛰어넘은 가운데 25개 자치구 중 12개 자치구는 여전히 당시 집값을 회복하지 못한 것으로 나타났다. 서울 지역 절반이 문재인 정부 시절 집값 급등기 여파로 고전하고 있음에도 '3중 규제' 지역으로 무더기 지정된 것에는 문제가 있다는 지적이다. 5일 KB부동산 자료를 분석한 결과 지난달 서울 아파트 평균 매매가격은 ..,2025.11.05 18:27,https://www.fnnews.com/news/202511051826373660,파이낸셜뉴스
"""올해만 4조7천억 투자 유치… 글로벌 첨단산업 허브로 도약""[로컬 포커스 공공기관장을 만나다]",,"【 광양=황태종 기자】 ""광양만권경제자유구역(GFEZ)이 명실상부한 남해안 경제 중심지로 자리 잡아 지역 경제를 견인하는 시대를 열어갈 수 있도록 더 노력하겠습니다."" 구충곤 광양만권경제자유구역청장은 5일 파이낸셜뉴스와 인터뷰에서 ""지난해 10월 취임 이후 투자 유치에 힘써 4조7000억원 규모의 투자 확정, 코스트코 같은 글로벌 기업 유치, 그..",2025.11.05 18:26,https://www.fnnews.com/news/202511051825563155,파이낸셜뉴스
"명절 '공짜 통행' 年 1천억씩 손실… 도공, 부채 7천억 떠안았다",,"명절마다 도로공사가 면제해주는 고속도로 통행료가 약 1000억원에 달하는 것으로 나타났다. 정부는 명절 민심 겨냥을 위해 매년 단골 대책으로 통행료 면제 카드를 꺼내지만, 도로공사의 부채는 커지고 있어 대안이 필요하다는 지적이 제기된다. 5일 도로공사에 따르면 지난해 명절 등으로 인해 면제한 통행료는 약 4825억원에 달했다. 통행요금 수입의 11% 수준이다. ..",2025.11.05 18:26,https://www.fnnews.com/news/202511051825204816,파이낸셜뉴스
"SH, 우리은행과 400억 규모 상생펀드 조성",,"서울주택도시개발공사는 우리은행과 함께 경기침체·건설업 위축으로 어려움을 겪는 협력업체들의 금융 지원을 위해 400억원 규모의 '상생펀드' 조성 협약을 체결했다고 5일 밝혔다. '상생펀드'는 SH가 보유한 유휴자금 운용으로 발생하는 이자수익을 재원으로 협력업체 대상 저금리 대출 상품을 마련하고, 우리은행이 추가 금리 감면을 적용하는 방식이다. 협력업..",2025.11.05 18:25,https://www.fnnews.com/news/202511051825155967,파이낸셜뉴스
"LH, 삼성과 손잡고 미래 주거환경 제시... AI 가전 기술 접목 모듈러주택 첫 공개",,한국토지주택공사(LH)가 5일 일산 킨텍스에서 개최되는 2025 스마트건설엑스포에서 AI 가전 기술이 접목된 표준 모듈러주택을 공개했다. 2025 스마트건설엑스포는 스마트 건설기술의 발굴·교류 및 건설 산업의 혁신을 도모하고자 마련됐다. 일산 킨텍스에서 11월 5일부터 7일까지 3일간 개최된다. LH는 이번 행사를 통해 OSC 등 LH의 스마트건설기술 도입 성과와..,2025.11.05 18:25,https://www.fnnews.com/news/202511051825004905,파이낸셜뉴스
"지그재그, 연 거래액 100억 쇼핑몰 20곳 넘었다",,"카카오스타일이 운영하는 스타일 커머스 플랫폼 지그재그는 연간 거래액 100억원 이상을 기록하는 대형 쇼핑몰들이 올해도 두 자릿수 성장세를 이어가고 있다고 5일 밝혔다. 지그재그에 따르면 올해 1~10월 거래액 기준 상위 50개 쇼핑몰의 거래액은 지난해 같은 기간 대비 평균 15% 증가했다. 이 중 거래액 100억원을 넘긴 쇼핑몰은 20곳 이상, 200억원 이상은 7곳으로 ..",2025.11.05 18:25,https://www.fnnews.com/news/202511051824249802,파이낸셜뉴스
"신세계百, 방콕서 K뷰티 팝업스토어 연다",,"신세계백화점이 동남아 최대 쇼핑 명소인 태국 방콕 '센트럴월드'에서 K뷰티 브랜드와 함께 글로벌 고객 공략에 나선다. 5일 신세계백화점에 따르면 신세계 하이퍼그라운드는 내년 1월 30일까지 방콕 최대 쇼핑몰인 '센트럴월드'에서 K뷰티 브랜드 15개를 한데 모은 팝업스토어를 연다. 팝업에는 스킨케어부터 메이크업, 향수까지 다양한 카테고리의 15개 국내 K뷰티 브..",2025.11.05 18:25,https://www.fnnews.com/news/202511051824194953,파이낸셜뉴스
30초면 끝… ‘시트 없는 팩’으로 올 매출 200억 달성 코앞[K스타일 웨이브],,"""워킹맘이 되고 나니 하루 20분씩 시트팩을 붙이는 일이 너무 벅차더라고요. 시트를 없애고 30초 만에 끝낼 수 있다면, 그게 진짜 요즘 현대여성들을 위한 뷰티 아닐까 싶었어요."" '워킹맘의 시간'을 줄이기 위한 아이디어에서 출발한 메노킨의 '30초 버블마스크'는 시트 없이도 버블이 피부에 머물며 흡수되는 신개념 마스크팩이다. 20분 걸리던 루틴을 30초..",2025.11.05 18:25,https://www.fnnews.com/news/202511051824142130,파이낸셜뉴스
"""집 팔겠다고 할인까지""… '10·15 규제' 직격탄 맞은 노도강",,"#. ""한강벨트는 규제 소식에 집주인이 계좌를 알려주지 않으며 계약을 미룬다지만, 노원구 상계동 지역은 빨리 팔려고 할인까지 하는 처지가 됐습니다. 대출제한과 토지거래허가제도가 동시에 적용돼 중저가 지역의 거래는 사실상 마비됐습니다."" (노도강 규제 완화 호소 진정서 내용) ■""지역특성 고려 안해 청년·서민층 타격"" 5일 업계에 ..",2025.11.05 18:24,https://www.fnnews.com/news/202511051824020407,파이낸셜뉴스
"""너무 올랐나"" 숨고르는 코스피… 증권가, 저가매수엔 신중론 [자산시장 충격파]",,코스피 상승 질주에 급브레이크가 걸리면서 향후 3700~3800선까지 밀릴 수 있다는 전망이 나온다. 다만 차익실현 매물 소화를 통한 단기급등 부담을 덜어내는 과정으로 보는 시각이 우세하다. 향후 증시 항��의 관건으로는 기업실적과 경기지표가 꼽힌다. 5일 한국거래소에 따르면 이날 코스피 지수는 전장 대비 2.85% 하락한 4004.42에 거래를 마쳤다. 코스피는 이날..,2025.11.05 18:24,https://www.fnnews.com/news/202511051823596734,파이낸셜뉴스
'36조원어치 美첨단무기 구매' 한미 안보분야 팩트시트에 담길 듯,,"이재명 정부가 향후 5년 임기 동안에 미국산 무기 36조원어치를 구매할 것으로 전해졌다. 정부가 구매할 미국산 첨단 무기 중에는 스텔스전투기, 항공통제기, 작전·지휘헬기 등 한미 간 전시작전통제권 전환에 필요한 핵심 전략자산이 대거 포함됐다. 이재명 정부는 임기 내 전작권 환수를 목표로 하고 있다. 이를 위해선 초고가의 미국산 정찰장비 등의 도입이 ..",2025.11.05 18:24,https://www.fnnews.com/news/202511051823535635,파이낸셜뉴스
"구윤철 ""경제분야 팩트시트 거의 마무리… 안보 논의 끝나면 서명""",,"구윤철 경제부총리 겸 기획재정부 장관은 5일 한미 관세협상 결과를 담은 '팩트시트'와 관련, ""경제 분야가 거의 마무리됐고, 안보 분야 논의가 끝나는 대로 서명할 것""이라고 밝혔다. 구 부총리는 이날 출연한 KBS1 라디오 인터뷰에서 ""빠른 시일 내에 발표하려고 노력 중이지만 안보 논의가 진행 중이라 시기를 확정하기는 어렵다""며 이같이 말했..",2025.11.05 18:24,https://www.fnnews.com/news/202511051823494456,파이낸셜뉴스
"""해외투자 등 늘어 대외자산 매년 확대... 국내증시 매력 높여 자본유출 막아야""",,"국내 주식시장 매력을 높여 과도한 해외투자 쏠림을 완화하고, 순대외자산(NFA) 확대 흐름에 대비해야 한다는 지적이 나왔다. 5일 한국은행이 발표한 '순대외자산 안정화 가능성 평가 및 시사점'에 따르면 한국의 NFA는 2014년 3·4분기 이후 플러스로 전환했고, 지난해 4·4분기에는 처음으로 1조달러를 상회했다. NFA는 국제투자대조표(IIP)상 대외금융자산..",2025.11.05 18:24,https://www.fnnews.com/news/202511051823464896,파이낸셜뉴스
자본주의 심장 이끌 '사회주의자'... 뉴욕시 최초 인도계 무슬림 시장 [트럼프 중간평가],,전 세계 자본주의의 심장인 미국 뉴욕에서 '사회주의자'를 자처하는 신예 정치인 조란 맘다니가 111대 시장에 당선되면서 맘다니의 배경에 관심이 쏠리고 있다. 1991년 10월 18일 아프리카 우간다에서 태어난 맘다니는 현재 34세로 역대 2번째로 젊은 뉴욕 시장이 되었다. 최연소 기록은 136년 전(1889년)에 30세 나이로 당선된 휴 J 그랜트다. 맘다니는 동시에 뉴욕 시장..,2025.11.05 18:24,https://www.fnnews.com/news/202511051823435814,파이낸셜뉴스
美민주 '미니 선거' 3곳 모두 압승… 맘다니 뉴욕시장 당선 [트럼프 중간평가],,"【 뉴욕=이병철 특파원】 트럼프 2기 행정부 출범 1년 만에 치러진 미국 주요 지방선거에서 민주당이 압승했다. 신예 조란 맘다니 후보가 뉴욕시장에 선출됐으며, 뉴저지와 버지니아 주지사 선거에서도 민주당 후보들이 각각 당선됐다. 특히 공화당 우세 지역으로 평가됐던 버지니아를 민주당이 탈환했다. ■민주당, 핵심지역 승리4일(현지시간) 일부 주지사 선거와 ..",2025.11.05 18:24,https://www.fnnews.com/news/202511051823325879,파이낸셜뉴스
"삼표산업, 중소기업에 내한 콘크리트 기술 공유",,"삼표그룹이 동절기 내한 콘크리트 적용 확대에 나선다. 삼표그룹 계열사 삼표산업은 정안레미콘, 세종레미콘, 정안레미콘아스콘과 특수 콘크리트 브랜드 '블루콘 윈터' 기술제휴 협약을 체결했다고 5일 밝혔다. 이번 협약을 통해 삼표산업은 내한 콘크리트 기술을 기반으로 고성능 콘크리트 품질 시스템을 도입하고, 이를 중소 레미콘사로 확대 적용해 동절기 품질 경쟁력..",2025.11.05 18:24,https://www.fnnews.com/news/202511051823257258,파이낸셜뉴스
"한미약품·비엣팝 ""고혈압 복합제 베트남 공급"" 맞손",,한미약품이 베트남 제약기업 '비엣팝'과 고혈압 복합제를 수출하는 독점 공급 및 라이선스 계약을 체결했다. 5일 한미약품에 따르면 계약은 지난달 독일 프랑크푸르트에서 열린 국제 제약·바이오 박람회(CPHI 월드와이드 2025)에서 체결됐다. 계약에 따라 한미약품은 비엣팝에 고혈압 복합제 완제품을 공급하며 비엣팝은 베트남 지역 내 허가와 유통 및 판매를 ..,2025.11.05 18:24,https://www.fnnews.com/news/202511051823213054,파이낸셜뉴스
"""희귀병 약 신속 도입·디카페인 기준 마련""",,"""희귀질환 치료나 진단에 사용되는 의약품이면 '희귀의약품'으로 빠르게 지정받을 수 있게 절차를 간소화하겠습니다."" 오유경 식품의약품안전처 처장은 5일 서울 동작구에 위치한 서울시여성가족재단에서 '식의약 안심 50대 과제 대국민 보고회'를 열고 첫 번째 대표과제를 소개하며 이같이 말했다. 오유경 처장은 ""외국에 있는 희귀질환치료제가 국내에 ..",2025.11.05 15:30,https://www.fnnews.com/news/202511051823207880,파이낸셜뉴스
"프로티나, AI 기반 항체 신약 개발 국책과제 선정",,"인공지능(AI) 기반 항체 신약 개발 기업 프로티나는 삼성바이오에피스, 서울대학교 연구팀과 함께 총 470억원 규모의 국책 연구개발 과제를 수행한다고 5일 밝혔다. 보건복지부가 주관하는 'AI 모델을 활용한 항체 바이오의약품 개발 및 실증' 사업에 최종 선정된 것으로, 산업계·학계·글로벌 개발 역량이 결집된 대형 컨소시엄이 본격 가동된다. 이번 프로..",2025.11.05 18:24,https://www.fnnews.com/news/202511051823191019,파이낸셜뉴스
"미·중 의존도 줄이는 韓 의료기기, 신흥국에 집중",,"의료기기 업체들이 중남미와 동남아, 아프리카 등 신흥국가를 중심으로 수출 지역 확대에 나서고 있다. 이를 통해 무역 분쟁으로 인해 변수가 커지고 있는 미국, 중국 의존도를 어느 정도 낮춘다는 전략이다. 5일 관련 업계에 따르면 치과용 엑스레이 등을 생산하는 레이는 올 하반기 들어 중남미와 동남아, 중앙아시아 등으로의 수출 물량 확대에 총력을 기울이고 있다..",2025.11.05 18:24,https://www.fnnews.com/news/202511051823157228,파이낸셜뉴스
"""이젠 성장의 시간… 중기 R&D 2조 지원·AI 공장 1만개 공급""",,"취임 100일을 맞은 한성숙 중소벤처기업부 장관이 향후 정책 과제로 벤처투자 시장 40조원 조성, 인공지능(AI) 중심 스마트공장 1만2000개 등을 제시했다. 5일 한 장관은 서울 강남 팁스타운에서 기자간담회를 열고 ""지난 100일은 회복에 집중했다면 앞으로는 중소기업과 소상공인의 성장에 집중하겠다""며 이같이 말했다. 취임 후 현장 행보를 이어온 한 장관..",2025.11.05 17:00,https://www.fnnews.com/news/202511051823094523,파이낸셜뉴스
로봇은 주권 기술이자 인프라... 교육·연구 선순환 모델 만들것[2025 로보월드],,대통령 표창을 받게 돼 무한히 큰 영광이다. 우리 산업은 단순한 기술 발전을 넘어 국가의 미래 경쟁력과 인류의 삶의 질을 바꾸는 핵심 동력으로 자리잡고 있다. 로봇산업은 단순 기계산업이 아니라 '국가 생산 인프라'이자 '주권 기술'로 간주해야 할 전략자산이다. 앞으로도 AI·로보틱스 융합 기술을 통해 산업혁신과 사회문제 해결에 기여하며 대한민국이 로..,2025.11.05 18:21,https://www.fnnews.com/news/202511051820160704,파이낸셜뉴스
로봇법 개정 등 규제혁신 앞장... 사람과 공존하는 기술이 비전[2025 로보월드],,"대통령 표창 수상의 영광을 로봇 산업을 위해 애쓰고 계신 모든 분들과 나누고 싶다. 지난 4년간 제 5대 한국로봇산업진흥원 원장으로서 '인간, 로봇, 더 나은 미래'라는 비전을 실현하고자 로봇인들과 함께 노력한 덕분이다. 규제 혁신, 로봇법 개정, 국가로봇테스트필드 구축 등 산업 기반을 다지는 동시에 현장 중심의 제조 혁신과 중소기업의 산업 전환을 위해 노력..",2025.11.05 18:20,https://www.fnnews.com/news/202511051820138786,파이낸셜뉴스
국내 로봇산업 기반 굳게 다져... AI 휴머노이드 세계 리더 도약[2025 로보월드],,"2012년부터 푸른기술의 로봇개발을 맡아 앞만 보고 달려왔는데 뜻밖의 산업포장을 수상하게 되어 송구스러운 마음과 함께 정부와 푸른기술을 포함한 모든 로봇인들께 깊은 감사를 드린다. 대한민국은 전자산업과 조선, 반도체와 같은 분야에서 무에서 유를 창조하며 오늘날에 이른 저력이 있다. 이제 AI와 휴머노이드 시대를 맞이하여 하루가 다르게 변화하는 환경을 공..",2025.11.05 18:20,https://www.fnnews.com/news/202511051820090821,파이낸셜뉴스
"'아기상어' 더핑크퐁컴퍼니, 코스닥 입성 ""공모가는 3만8000원""",,"[파이낸셜뉴스] '아기상어'로 유명한 엔터테인먼트 기업 더핑크퐁컴퍼니가 코스닥 입성한다.5일 더핑크퐁컴퍼니에 따르면 지난 10월 28일~11월 3일 총 5일간 국내외 기관투자자를 대상으로 진행한 수요예측 결과, 공모 밴드 상단인 3만8000원에 공모가를 확정했다.이번 수요예측은 총 2300개 기관이 참여하며 최종 615.9대1의 경쟁률을 기록했다. 더핑크퐁컴퍼니의 공모 ..",2025.11.05 18:27,https://www.fnnews.com/news/202511051819557567,파이낸셜뉴스
"팝콘 퍼주고 주사위 게임… 로봇, 놀고 일하며 사람과 동고동락[2025 로보월드]",,"#. 사람이 종이컵을 내밀자 로봇이 이를 인지하고 팔을 움직였다. 로봇은 컵을 받아 이동한 뒤 팝콘을 담아 다시 사람에게 건네주는 모습을 연출했다. 뉴로메카가 만든 휠(wheel) 기반 휴머노이드다. 하체 부분엔 바퀴가 달려 신속하고 정교하게 이동할 수 있고, 상체는 사람처럼 인지하고 움직인다. 속도만 좀 더 붙으면 영화관에서 팝콘을 서빙하는 직원의 업무를 ..",2025.11.05 18:20,https://www.fnnews.com/news/202511051819536403,파이낸셜뉴스
수술 돕는 '7축 협동로봇' 등 첨단화… 글로벌 경쟁력 확보 [2025 로보월드],,국내 최대 로봇산업 유공자 시상행사인 '2025 기계·로봇산업 발전 유공자 정부 포상식'에는 스마트팩토리·협동로봇·AI 자율제조 등 첨단 기술혁신을 이끈 인물과 기업들이 수상의 영예를 안았다. ■협동·의료로봇부터 자율제조까지 5일 경기 고양시 킨텍스 제1전시장에서 '2025 기계·로봇산업발전 유공자 정부 포상식'이 열렸다. ..,2025.11.05 18:20,https://www.fnnews.com/news/202511051819419716,파이낸셜뉴스
찾아가는 상담으로 청소년 마음건강 지킨다,,"#. 학교 밖 청소년 지원센터를 이용하던 한 학생이 지속적인 우울과 불안을 호소하며 자해충동에 시달리고 있었다. 특히 지난해 친구가 자살시도로 뇌사판정으로 죽음에 이르자 이를 막지 못한 괴로움에 자신도 결국 자살시도를 했다. 이에 성평등가족부는 구청, 보건소 등과 함께 긴급하게 개입했다. 이후 해당 학생은 지속적인 약물치료와 긴급상담을 통해 대화와 일..",2025.11.05 18:20,https://www.fnnews.com/news/202511051819371151,파이낸셜뉴스
"송미령 ""신선 농산물 수출비중 늘릴것""",,송미령 농림축산식품부 장관이 한국판 국별무역장벽보고서(NTE) 보고서를 만들 계획을 내놨다. K푸드 수출에서 기존에 잘 팔리는 라면 등 가공식품뿐만 아니라 신선 농산물도 확대하기 위해서다. 경주 아시아태평양경제협력체(APEC)를 통해 중국 및 싱가폴에 각각 단감 및 한우 수출 길을 연 만큼 앞으로 K푸드 교역로가 될 '검역 협상'도 강화할 계획이다. 송 장관은 5..,2025.11.05 18:20,https://www.fnnews.com/news/202511051819325394,파이낸셜뉴스
"양대노총 ""65세 정년, 더 미룰 수 없어… 연내 입법해야""",,"양대노총이 5일 65세 정년연장 의무화 연내 입법, 조기퇴직 관행 근절, 청년·고령자 상생 일자리 확대를 촉구했다. 한국노총과 민주노총은 이날 국회에서 기자회견을 열고 ""정년연장은 더 이상 미룰 수 없는 시대적 과제이자 국민적 요구""라며 이처럼 밝혔다. 양대노총은 ""베이비부머의 대규모 은퇴가 시작된 지금, 현행 60세 정년이 이대로 유지된..",2025.11.05 18:20,https://www.fnnews.com/news/202511051819314843,파이낸셜뉴스
[부음] 문봉화씨 별세·문병래(진주시민버스 근무) 병호(구강서원보존회 사무국장) 신희 병삼씨(한국자산관리공사 기업지원총괄처장) 부친상·조성철씨 장인상,,"▲문봉화씨 별세·문병래(진주시민버스 근무) 병호(구강서원보존회 사무국장) 신희 병삼씨(한국자산관리공사 기업지원총괄처장) 부친상·조성철씨 장인상=5일 진주 중앙병원, 발인 7일 오전 7시. (055)745-8000",2025.11.05 18:18,https://www.fnnews.com/news/202511051817229983,파이낸셜뉴스
"김승연 회장, 한화이글스에 오렌지색 폰 선물",,"김승연 한화그룹 회장이 한화이글스의 2025 한국시리즈 준우승을 축하하며, 끝까지 투혼을 보여준 선수단과 스태프 등 총 60명에게 이글스의 상징색인 오렌지색 휴대전화를 선물했다. 5일 한화에 따르면 김 회장은 한화이글스의 준우승 직후였던 지난달 31일 ""세상에서 가장 뜨겁게 응원해 주신 여러분을 잊지 않겠습니다. 그 사랑 가슴에 품고 다시 날아오르겠습..",2025.11.05 18:18,https://www.fnnews.com/news/202511051817158978,파이낸셜뉴스
"'점자 활용 확대 공로' 오뚜기, 문체부 장관 표창",,"오뚜기는 점자 발전과 활용 확대에 기여한 공로를 인정받아 '제99돌 한글 점자의 날 기념식'에서 문화체육관광부 장관 표창을 수상했다고 5일 밝혔다. 지난 4일 국립중앙도서관 국제회의장에서 열린 이번 점자의 날 기념식은 한글 점자의 창제와 보급 의의를 기리고, 시각장애인의 정보 접근권 향상과 점자문화 확산에 기여한 유공자를 표창하기 위해 마련된 행사다. h..",2025.11.05 18:17,https://www.fnnews.com/news/202511051817103354,파이낸셜뉴스
"SK이노, 소셜벤처 '에이트린'에 전과정평가 지원",,"SK이노베이션이 소셜벤처 '에이트린'이 재생플라스틱 소재로 만든 우산에 대한 전과정평가(LCA)를 무상으로 지원해 글로벌 시장 진출을 돕는다. SK이노베이션은 지난 4일 서울 종로구 SK 서린빌딩에서 에이트린의 업사이클 우산 전과정평가 검증서 수여식을 가졌다고 5일 밝혔다. 글로벌 시장은 친환경제품에 전과정평가 데이터를 요구하는 추세지만, 비용과 인력 부담..",2025.11.05 18:17,https://www.fnnews.com/news/202511051817076147,파이낸셜뉴스
"효성, 시각장애인 위한 배리어프리 영화 제작 지원",,효성은 지난 4일 서울 마포구 한국영상자료원에서 열린 '제15회 서울배리어프리영화제' 개막식에서 제작 지원금을 배리어프리영화위원회에 전달했다고 5일 밝혔다. 배리어프리 영화는 시각장애인을 위한 화면 해설 음성과 청각장애인을 위한 자막을 함께 제공해 장애 유무에 관계없이 모두가 감상할 수 있도록 제작된 영화다. 효성은 올해 영화 '괜찮아 괜찮아 괜찮아'..,2025.11.05 18:17,https://www.fnnews.com/news/202511051817023196,파이낸셜뉴스
"고객 살린 팀워크… 삼성전자서비스 직원들 ""주기적 교육 덕""",,"""당장 119 신고하고 자동심장충격기 준비해!"" 지난달 31일 삼성전자서비스 평촌센터, 오후 5시30분. 조용하던 센터 내부가 갑자기 소란스러워졌다. 전화 송수신 상태 점검을 위해 센터를 방문한 A씨가 갑자기 쓰러지면서부터다. 당시 현장에 있었던 한정현 삼성전자서비스 프로는 5일 파이낸셜뉴스에 ""당시 A씨의 인색이 좋지 않아 어디 불편한 곳이 있..",2025.11.05 18:17,https://www.fnnews.com/news/202511051816555415,파이낸셜뉴스
[인사] 문화체육관광부,,◆문화체육관광부 ◇실장급 △기획조정실장 김정훈 △국제문화홍보정책실장 김재현 △국민소통실장 공형식 ◇국장급 △대변인 송윤석 △문화예술정책실 예술정책관 이용신 △〃 지역문화정책관 김용섭 △콘텐츠정책국장 최성희 △체육국장 이선영 △국립중앙박물관 행정운영단장 강대금 △〃 교육문화교류단장 신은향 △대한민국예술원 사무국장 윤양수 △한국예술종합학..,2025.11.05 18:17,https://www.fnnews.com/news/202511051816528073,파이낸셜뉴스
