title,thumbnail,short_content,write_time,link,company
올해만 M&A 3건… 저축은행 회복 신호탄?,,저축은행업계가 실적 회복세를 보이며 인수합병(M&A) 시장에서 매력이 높아지고 있다. SBI저축은행부터 상상인저축은행까지 올해 총 3건의 M&A가 성사되며 업계 재편에 대한 기대감이 커지고 있다. 5일 저축은행업계에 따르면 상상인저축은행은 지난달 31일 KBI그룹과 주식매매계약(SPA)을 체결했다. KBI그룹은 상상인저축은행 지분 '90%+1주'를 인수한다. 거래금..,2025.11.05 18:07,https://www.fnnews.com/news/202511051806521581,파이낸셜뉴스
"당국 '경영개선권고' 조치에 ‥롯데손보 ""위법소지"" 소송 검토(종합)",,"[파이낸셜뉴스] 롯데손해보험이 금융당국으로부터 적기시정조치를 부과받았다. 적기시정조치는 부실 가능성이 큰 금융회사에 금융당국이 내리는 강제조치로 이날 롯데손보는 가장 낮은 단계인 '경영개선권고' 조치를 받았다. 롯데손보는 금융당국의 결정에 위법성이 있다는 입장으로, 향후 법적대응을 검토하고 있다.금융위원회는 5일 정례회의에서 롯데손해보험에 대한 ..",2025.11.05 18:23,https://www.fnnews.com/news/202511051806177991,파이낸셜뉴스
"금융위, 가상자산 시세조종 혐의자 수사기관에 고발",,"[파이낸셜뉴스] 금융위원회가 대규모 가상자산 시세조종 행위를 벌인 혐의자들을 수사기관에 고발했다.금융위는 “수백억원을 동원해 목표가격까지 인위적으로 가격을 끌어올리거나, 자동매매 프로그램(API)으로 거래량을 부풀려 일반투자자를 유인한 사실을 적발했다”며 5일 이같이 밝혔다.첫 번째 사건은 금융감독원의 시장 모니터링 과정에서 적발됐다. 혐의자는 수십억원 ..",2025.11.05 18:12,https://www.fnnews.com/news/202511051806132604,파이낸셜뉴스
미중 ‘관세 휴전’ 구체화… 양국 ‘맞불 관세’ 단계적 철회,,"미국과 중국이 최근 정상회담에서 합의한 '관세 확전 자제' 조치를 동시에 실행에 옮기고 있다. 도널드 트럼프 미국 대통령이 중국산 제품에 부과해온 이른바 '펜타닐 관세'(일명 좀비 마약)를 10일(현지시간)부터 기존 20%에서 10%로 인하하기로 한 가운데, 중국도 같은 날 미국산 농축산물에 부과했던 보복 관세를 해제하고 24%의 추가 관세는 1년간 유예하기로 했다. ..",2025.11.05 18:06,https://www.fnnews.com/news/202511051805466155,파이낸셜뉴스
"日, 간병·돌봄보험 자기부담율 20% 대상 확대 재논의",,【 도쿄=서혜진 특파원】 일본 정부가 간병·돌봄을 위한 사회보장보험인 '개호보험'에서 자기부담율 20% 대상을 확대하는 방안을 본격 논의하기 시작했다고 요미우리신문이 5일 보도했다. 고령화 가속화로 관련 비용이 급증하자 지불 능력이 있는 고령자의 부담을 늘리기 위해서다.요미우리신문에 따르면 일본 후생노동성은 지난달 27일 열린 사회보장심의회 산하 ..,2025.11.05 18:06,https://www.fnnews.com/news/202511051805440948,파이낸셜뉴스
"엔비디아, 1조6천억 들여 獨에 최초 AI단지 짓는다",,엔비디아가 독일에 10억유로(약 1조6000억원)를 투입해 세계 최초의 산업용 인공지능(AI) 단지를 조성한다. 엔비디아와 독일 통신사 도이체텔레콤은 4일(현지시간) 내년 1·4분기 가동을 목표로 하는 AI 산업용 클라우드 플랫폼을 독일 남부 바이에른주 뮌헨에 구축한다고 밝혔다.젠슨 황 엔비디아 최고경영자(CEO)는 지난 6월 프랑스 파리에서 열린 개발자 콘퍼런..,2025.11.05 18:06,https://www.fnnews.com/news/202511051805427809,파이낸셜뉴스
"""소방관 생존권 보장해 달라"" 국회 앞 모인 소방관들",,"""죽지 않고 살고 싶다, 소방 인력 충원하라"" ""안정적 소방 체계 구축, 소방 예산 확보하라""오는 9일 '소방의 날'을 앞두고 소방관들이 국회 앞으로 모였다. 이들은 소방관의 생명, 나아가 국민의 안전을 지키기 위해선 국가가 보다 적극적으로 소방관 안전을 보장해야 한다고 목소리를 높였다.전국공무원노동조합(전공노) 소방본부는 5일 오후 서울 ..",2025.11.05 18:05,https://www.fnnews.com/news/202511051805159255,파이낸셜뉴스
"김건희 측 ""샤넬백 받았지만 청탁 아냐""",,"김건희 여사가 건진법사 전성배씨를 통해 샤넬백을 받은 사실을 처음으로 인정했다. 다만 김 여사는 사과의 뜻을 밝히면서도 통일교 측의 청탁 대가는 아니라고 강조했다. 영상 통화와 실물 증거 등을 특검팀이 이미 확보한 상황에서 사실관계는 피할 수 없는 만큼, 도덕적 비난은 받더라도 형사처벌을 최소화하겠다는 전략이 깔린 것으로 풀이된다. 김 여사 측 변호인단..",2025.11.05 18:05,https://www.fnnews.com/news/202511051805139278,파이낸셜뉴스
‘로맨스스캠’ 피해액 1천억인데… 돌려받을 방법 없다,,최근 캄보디아 사태를 계기로 연애 빙자 사기를 뜻하는 '로맨스스캠'에 대한 관심이 커지고 있다. 인공지능(AI) 기술 발달과 맞물려 사기 수법이 진화하며 피해 규모가 급증할 거라는 우려도 나온다. 전문가들은 정부의 강력한 대응이 필요하다고 지적했다. 5일 국회 행정안전위원회 소속 한병도 더불어민주당 의원실이 경찰청으로부터 받은 자료에 따르면 올해 1~9월 로..,2025.11.05 18:05,https://www.fnnews.com/news/202511051805121784,파이낸셜뉴스
과로사에 임금체불까지… 런베뮤 근로기준법 위반 의혹 확산,,"직원 과로사 의혹으로 근로감독을 받는 베이커리 브랜드 런던베이글뮤지엄(런베뮤)에 대한 퇴직금 체불 신고가 접수돼 노동당국이 조사 중인 것으로 확인됐다. 고용노동부가 이미 장시간 노동 등 근로기준법 위반 정황을 포착해 전 지점과 계열사로 감독을 확대한 가운데, 임금 지급 문제까지 불거지면서 논란은 확산될 것으로 보인다. 5일 국회 기후에너지환경노동위원회..",2025.11.05 18:05,https://www.fnnews.com/news/202511051805113898,파이낸셜뉴스
외화 선불충천금으로 해외주식 투자…금융위 혁신금융서비스 지정,,[파이낸셜뉴스] 해외에서 이용하고 남은 외화 선불 충전금을 본인 증권사 위탁계좌로 환급받는 서비스가 금융위원회 혁신금융서비스로 지정됐다.금융위원회는 5일 정례회의를 열고 NH투자증권과 트래블월렛의 '트래블월렛 외화 선불충전금 기반 해외주식 투자 서비스' 등 3건을 혁신금융서비스로 지정했다고 밝혔다.외화 선불충전금 기반 해외주식 투자 서비스는 트레블월렛의 ..,2025.11.05 18:26,https://www.fnnews.com/news/202511051802380190,파이낸셜뉴스
"檢, ‘서해피격 공무원 사건’ 文정부 안보라인에 모두 실형 구형...서훈에 징역 4년",,"[파이낸셜뉴스]검찰이 지난 2020년 서해상에서 발생한 공무원 고(故) 이대준씨 피격 사건을 은폐한 혐의로 재판에 넘겨진 문재인 정부 안보라인 인사 전원에게 실형을 선고해 달라고 요청했다.서울중앙지법 형사합의25부(지귀연 부장판사)는 5일 서훈 전 청와대 국가안보실장, 서욱 전 국방부 장관, 박지원 전 국가정보원장, 김홍희 전 해양경찰청장, 노은채 전 국정원장 비서..",2025.11.05 18:09,https://www.fnnews.com/news/202511051801003742,파이낸셜뉴스
"문가비, 정우성 아들 합성 영상에 “허위..멈춰달라” 호소",,[파이낸셜뉴스] 모델 문가비가 자신과 배우 정우성의 아들 사진을 합성하지 말아달라고 호소했다.임신 후 싱글맘의 삶을 선택한 문가비는 지난달 30일 정우성의 혼외자인 아들과의 근황을 공개한 바 있다. 당시 정면 얼굴은 공개하지 않았다. 그런데 이후 온라인에 문가비와 그의 아들 사진을 활용한 인공지능(AI) 합성 영상이 퍼지고 있는 것.문가비는 5일 자신의 ..,2025.11.05 18:15,https://www.fnnews.com/news/202511051758190396,파이낸셜뉴스
"포스코DX, 포항제철소 안전사고 인명피해 사과",,"[파이낸셜뉴스] 포스코DX가 5일 포항제철소에서 발생한 하도급 근로자 사망 사고에 대해 사과했다. 심민석 포스코DX 대표이사는 이날 사과문을 통해 ""금일 포항제철소 현장에서 작업 준비를 하시던 포스코DX의 하도급사 근로자 한 분이 유명을 달리하는 사고가 발생했다""며 ""불의의 사고로 안타깝게 돌아가신 고인의 명복을 빌며, 유가족께도 깊은 애도와 사과..",2025.11.05 17:50,https://www.fnnews.com/news/202511051747314580,파이낸셜뉴스
"신세계사이먼 부산프리미엄, 기장군 장안읍에 500만원 성품 기탁",,[파이낸셜뉴스] 신세계사이먼 부산프리미엄아울렛이 지난 1일 오후 장안읍 농축특산물 판매장에서 열린 ‘2025 장안읍 나눔 프리마켓’ 행사에서 500만원 상당의 취약계층 돕기 성품을 기탁했다고 5일 밝혔다.기탁식에 참석한 신세계사이먼 부산프리미엄아울렛 김재성 운영지원팀장은 “나눔 프리마켓 행사를 기념해 장안읍 주민을 위한 기부를 할 수 있어 매우 뜻깊다”..,2025.11.05 17:41,https://www.fnnews.com/news/202511051738231715,파이낸셜뉴스
"마포서장 ""내란 동조 발언, 전혀 사실 아냐""…허위 주장 법적 대응 예고",,"[파이낸셜뉴스] 김완기 마포경찰서장이 자신을 향한 '내란 동조 발언' 의혹을 전면 부인하며 법적 대응 방침을 밝혔다.김 서장은 5일 경찰서 홈페이지에 게재한 입장문을 통해 ""특정 유튜버가 '내란에 동조하겠다'고 발언했다고 주장한 것은 전혀 사실이 아니다""라며 ""수사기관 조사를 받으며 당시 현장 상황을 상세히 진술했다""고 전했다.이어 ""경찰..",2025.11.05 18:13,https://www.fnnews.com/news/202511051729181058,파이낸셜뉴스
"[속보]檢, '서해피격 사건' 서훈 전 안보실장에 징역 4년 구형...서욱 전 국방장관 징역 3년",,[파이낸셜뉴스]  scottchoi15@fnnews.com 최은솔 기자,2025.11.05 17:32,https://www.fnnews.com/news/202511051729057888,파이낸셜뉴스
‘산부인과 부재·전문의 공백·재정난까지’…갈 길 먼 부산의료원,,"[파이낸셜뉴스] 부산의료원이 최근 몇 년 새 끝없는 적자를 이어가 재정난에 빠지면서 전문의 수가 급격히 줄어드는 등 악순환이 이어지고 있다. 이에 부산의 공공의료 위기를 극복할 대책이 시급하다는 목소리가 나온다. 5일 오전 10시 부산시의회 복지환경위원회에서 열린 부산의료원 행정사무감사에서는 산부인과 부재 문제부터 재정 위기 상태, 전문의 공백 문제까지 ..",2025.11.05 17:25,https://www.fnnews.com/news/202511051722449148,파이낸셜뉴스
[이조로 변호사의 무비:로(LAW)] ‘어쩔수가없다’의 증거인멸죄,,"영화 ‘어쩔수가없다’(감독 박찬욱)는 도널드 E. 웨스트레이크의 미국 소설 ‘액스’(The Ax)를 원작으로 한 작품입니다. 이 원작 소설은 2005년에 프랑스-벨기에 합작으로 ‘액스, 취업에 관한 위험한 안내서’로 영화화되기도 했습니다. 작품 속에서, 실직자가 된 만수(이병헌 분)는 새로운 직장을 얻기 위해서 자신의 경쟁자가 될 선출(박희순 분)을 질식시켜 살해하면서 ..",2025.11.05 17:24,https://www.fnnews.com/news/202511051722068949,파이낸셜뉴스
