title,thumbnail,short_content,write_time,link,company
[단독] 이재명 직속 기본사회위 이번주 출범…조기 대선 앞 핵심정책 ‘시동’,https://img.khan.co.kr/news/c/190x140/2025/03/10/news-p.v1.20250309.867dd97ae5e741d6b666ae140a08327c_P1.jpeg,"이재명 더불어민주당 대표가 자신의 직속 기구인 기본사회위원회를 이번주 공식 출범할 예정인 것으로 전해졌다. 조기 대선 가능성을 앞두고 성장 드라이브에 가려있던 자신의 또 다른 핵심 정책인 기본사회에 시동을 거는 것으로 풀이된다.민주당 관계자는 10일 “(윤석열 대통령이 파면된다면) 조기 대선이 얼마 남지 않기에, 기본사회위를 이번주에 띄우려 한다”고 밝혔다. 위원회 측 관계자도 “이번주를 목표로 현재 막판 조직 구성을 하고 있다”고 말했다. 다만 윤석열 대통령 석방 사태 여파로 위원회 발대식 세부 일정은 최종 조율 중인 것으로 전해졌다.앞서 민주당은 이 대표가 힘을 실어 온 기본사회 정책을 실현하기 위해 2023년 2월 기본사회위를 처음으로 출범한 바 있다. 이 대표가 위원장이며, 부위원장만 27명인 초대형 조직이다. 기본사회 정책 밑그림을 그리는 역할을 맡았다.민주당 상설위원회나 특별위원회는 폐지 방침이 없으면 2년 단위로 발대식을 열고 다시 출범한다. 기본사회위는 ...",30분 전,https://www.khan.co.kr/article/202503100600091,경향신문
비상계엄이 세상 휩쓸자 잊힌 ‘여성 의제’[3·8 여성의날],https://img.khan.co.kr/news/c/190x140/2025/03/10/news-p.v1.20250306.c025ed79e0d74fc79d85e97b9e63283c_P1.jpg,"12·3 비상계엄 이후 여성들이 광장의 주인공으로 떠올랐지만 역설적이게도 계엄 사태로 인해 ‘여성 의제’에 관한 관심은 더 뒷전으로 밀려났다.지난해 8월 ‘36주 임신중지 유튜브 영상 논란’을 계기로 낙태죄 보완 입법 등 ‘안전한 임신중지’에 관한 논의가 조명을 받았다. 한 유튜버가 임신 36주차에 임신중지 수술을 받았다는 내용의 영상을 유튜브에 올리자 보건복지부가 경찰에 수사를 의뢰했다. 여성계는 “2019년 낙태죄가 헌법불합치 결정으로 폐지된 뒤 아무 대안도 마련되지 않아 이러한 사태가 야기됐다”고 지적하며 제도 보완을 촉구했다.‘성적 권리와 재생산 정의를 위한 센터’ 셰어(SHARE)의 나영 대표는 “여성단체들이 계엄 직전 모자보건법 전부 개정안 등과 관련해 복지부, 정치권과 간담회를 이어가고 있었는데 계엄 이후 논의들이 중단됐다”고 말했다. 나영 대표는 “박근혜 대통령 탄핵 이후 여성들이 낙태죄 폐기를 요구해 헌법불합치 결정을 끌어냈지만 문재인 정부에서도 여성 권리...",30분 전,https://www.khan.co.kr/article/202503100600081,경향신문
광장에선 ‘주역’ 표 앞에선 ‘단역’···“더 이상 지워질 수 없다”[3·8 여성의날],https://img.khan.co.kr/news/c/190x140/2025/03/10/news-p.v1.20241221.044944af6d174ca0bf3baa078bdd8be3_P1.jpeg,"지난 8일은 12·3 비상계엄 사태 이후 처음 맞이한 여성의날이었다. 여성들이 정치·경제·사회적으로 싸워서 쟁취한 것들을 기념하고, 평등을 요구하는 여성의날의 의미는 예년과 다를 바 없었지만 올해는 여성, 특히 10~30대 여성이 ‘광장의 주역’으로 우뚝 섰다는 점에서 각별했다.‘응원봉’을 들고 거리와 광장으로 쏟아져 나온 여성들은 스스럼없이 무대에 올라 윤석열 대통령 탄핵을 목놓아 외쳤다. 이들의 목소리는 탄핵 촉구에만 머무르지 않았다. 국회 앞에서 농민들의 시위가 있었던 남태령 고개로, 전국장애인차별철폐연대(전장연)의 출근길 집회가 열린 안국역으로, 해고 노동자들이 고용승계를 요구하며 농성을 벌이는 구미 한국옵티칼하이테크 투쟁 현장으로 옮겨가며 연대했다. “탄핵 이후 더 나은 사회를 만들겠다”는 여성들의 외침은 이들이 세상을 바꾸겠다는 의지를 천명한 것으로 평가됐다.문제는 거리와 광장에 쏟아진 이들의 주장과 요구를 어떻게 관철할 것인가이다. 헌법재판소의 윤 대통령 ...",30분 전,https://www.khan.co.kr/article/202503100600071,경향신문
어느새 입소문…어르신 ‘보람 맛집’,https://img.khan.co.kr/news/c/190x140/2025/03/10/l_2025031001000198600022272.jpg,"메인 메뉴는 콩나물국밥 단골 늘면서 매출도 쏠쏠 첫 월급엔 인센티브까지“땀·정성 담긴 값진 결실”지난 5일 찾아간 서울 성북구 장위전통시장 초입의 ‘할매정국밥’ 식당. 인근에서 40여년째 카센터를 운영하고 있는 A씨(83)는 이날도 점심을 먹기 위해 이 국밥집을 찾았다.“어느새 단골이 됐다”는 그는 “7000원에 한 끼를 먹는데 닭(날계란)까지 주니 자주 안 오겠어요?”라며 어김없이 한 뚝배기를 말끔히 비웠다. 겉절이도 한 접시 더 요청해 먹었다. 이곳에서 일하는 조인씨(63)는 “장사를 시작한 지 얼마 되지 않았는데 단골이 여럿 생겼다. 저분도 그중 한 분”이라며 활짝 웃었다.할매정국밥은 성북구과 성북시니어클럽이 어르신 일자리 사업의 일환으로 지난달 4일 성북에서 최초로 연 ‘밥집’이다. 관내에 카페, 제빵교실 등 어르신 일자리 사업장이 여럿 있지만 밥집을 연 것은 이번이 처음이다. 이날로 시범운영 한 달째를 맞았다.할매...",30분 전,https://www.khan.co.kr/article/202503100600045,경향신문
‘탄핵심판 선고날’ 전국 경찰 10% 투입,,"윤석열 대통령이 석방되면서 경찰이 탄핵심판 관련 경비 계획을 한층 강화하는 등 집회·시위 대책 마련에 골몰하고 있다. 헌법재판소의 탄핵심판 결정 선고일에는 전국 경찰관 10명 중 1명이 관련 작전에 투입될 것으로 전망된다.9일 경향신문 취재를 종합하면 당초 경찰은 탄핵 결정 당일 서울 시내에 기동대 190여개 부대, 1만2000여명을 동원할 계획이었다. 경찰은 탄핵심판 결정 선고일이 공지되면 서울 종로구 헌재 인근과 광화문 일대에 80여개 부대 5000여명을 투입할 방침이었다. 그리고 결정 선고 당일에는 140여개 부대, 9000여명을 배치해 시위대의 접근을 원천 차단할 계획을 세운 것으로 전해졌다. 시위대 습격 가능성이 있는 주요 지점에도 40여개 부대를 투입하고, 극단적 폭력 행위 등에 대비해 서울경찰청 산하 일선 경찰서 형사들이 ‘체포조’로 대기할 것으로 전해졌다.경찰은 윤 대통령이 석방돼 탄핵 찬반 진영의 긴장이 더 고조되면서 추가 인력 동원 계획을 검토...",30분 전,https://www.khan.co.kr/article/202503100600035,경향신문
조기 대선 간보던 국민의힘…다시 커진 ‘윤심’에 복잡한 셈법,https://img.khan.co.kr/news/c/190x140/2025/03/10/l_2025031001000200300022101.jpg,"윤석열 대통령이 석방되면서 국민의힘의 조기 대선 셈법이 복잡해졌다. 윤 대통령 행보 하나하나가 경선과 본선 국면에 영향을 미칠 것으로 예상되기 때문이다. 윤 대통령이 당내 경선에 적극적으로 개입해 ‘윤심’(윤 대통령 의중) 후보를 밀 것이라는 전망도 나온다. 당내 일각에서는 친윤석열(친윤)계가 당 후보로 낙점되면 대선에서 불리해질 것이란 우려가 제기된다.윤 대통령은 서울구치소에서 석방된 직후부터 빠르게 당의 구심점 역할을 되찾고 있다. 그는 국민의힘 의원들과 만나 “잘 싸워줘서 고맙다”고 격려하고, 당 지도부에 “고생했다”는 말을 전했다. 국민의힘 지도부 역시 조만간 윤 대통령 관저를 찾기로 했다. 한 친윤계 의원은 9일 “불구속 상태이기 때문에 정치권에 주는 메시지에 많은 변화가 있을 것”이라면서 윤 대통령이 자유롭게 의견을 개진할 것으로 전망했다.윤 대통령이 당분간 불구속 상태를 유지할 것으로 예상됨에 따라 국민의힘의 조기 대선 계획도 수정이 불가피...",30분 전,https://www.khan.co.kr/article/202503100600025,경향신문
검·경·공 수사권 경쟁에…‘윤’만 웃었다,,"경찰 “내란죄 수사권 있다” 검찰 “경찰 사건 수사 가능” 공수처 “직권남용으로 수사” 수사 초기부터 주도권 다툼 윤 측에 ‘위법’ 주장 빌미 줘‘석방 책임’도 서로 떠넘겨윤석열 대통령이 법원으로부터 구속 취소 결정을 받은 것을 두고 법조계에서는 “검찰과 경찰, 고위공직자범죄수사처(공수처)의 비뚤어진 수사 경쟁이 낳은 결과”라고 지적했다. 세 기관이 수사 초기부터 주도권을 놓고 갈등을 벌이며 절차상 문제의 소지를 남겼고, 이 중 하나가 발목을 잡으면서 형법상 최고 범죄인 내란 우두머리 혐의 피고인이 불구속 상태에서 재판받도록 했다는 것이다.서울중앙지법 형사합의25부(재판장 지귀연)는 지난 7일 윤 대통령 구속 취소 결정을 내리면서 “피고인(윤 대통령)의 구속 기간이 만료된 상태에서 공소가 제기된 것으로 봄이 상당하다”고 밝혔다.법조계에서는 법원이 이렇게 판단하게 된 근본 원인이 윤 대통령을 둘러싼 공수처와 검찰의 수사 경쟁에 있다고 분석한다...",30분 전,https://www.khan.co.kr/article/202503100600015,경향신문
관저 앞에 모인 윤 지지자들 “계엄을 계몽으로…전쟁해야”,https://img.khan.co.kr/news/c/190x140/2025/03/10/l_2025031001000205000022012.jpg,"윤석열 대통령이 석방되면서 서울 한남동 대통령 관저 앞에 지지자들이 다시 모여들기 시작했다. 지지자들은 “탄핵 기각과 불법 수사 무효가 다음 단계”라고 외쳤다.전광훈 사랑제일교회 목사가 집회 장소를 광화문에서 한남동으로 옮기며 9일 오전부터 관저 인근에는 사람들이 운집했다. 이날 정오 경찰 추산 4500명가량이었다.집회는 격앙된 분위기 속에 진행됐다. 무대에 선 목사가 “하나님이 우리의 기도를 들어주셨다. 대통령 석방 축하 예배를 드리자”고 외치자 지지자들은 “아멘”이라고 외치며 눈물을 흘렸다. 최모씨(76)는 “어제도 광화문에 갔다가 관저로 왔었는데, 대통령을 보니 울컥해서 눈물이 났다”고 말했다. 김모씨(69)는 “자식들 좋은 일 있었을 때보다도 행복한 하루”라며 “대통령 석방 소식을 듣고 관저로 향하는데 다들 만세를 부르고 난리가 났다”고 했다.윤 대통령 석방에 고무된 이들은 ‘극우’라고 자칭하는 데도 망설임이 없었다. 이모씨는 “우리를 보고...",30분 전,https://www.khan.co.kr/article/202503100600005,경향신문
‘윤석열 주먹 불끈’ 보고 집회 처음 찾은 시민들···“사법부 신뢰 금 가”,https://img.khan.co.kr/news/c/190x140/2025/03/09/news-p.v1.20250309.d68cdca26ce1434f98f084988f838a2c_P1.jpeg,경기 안양시에 사는 여모씨(48)는 9일 서울 종로구 지하철 경복궁역 인근에서 열린 집회에 12·3 비상계엄 사태 이후 처음으로 나왔다고 했다. 전날 윤석열 대통령이 구속 취소돼 석방되는 모습을 보고 “참을 수 없는 분노가 일었다”고 했다. 여씨는 “주말에 일이 보통 오후 8~9시에 끝나서 집회를 한 번도 못 나왔는데 이날은 생업을 포기하고 나왔다”며 “윤석열을 구속해둬서 마음을 놓고 있었는데 어떻게 구치소에서 두 발로 나올 수가 있냐”고 말했다.이날 경복궁역 앞에서 ‘윤석열즉각퇴진·사회대개혁 비상행동’(비상행동)이 연 집회에 나온 참가자 중에는 여씨처럼 윤 대통령 석방 소식에 분노해 계엄 사태 이후 처음 집회에 참석했다는 사람들이 많았다.서울 양천구에 사는 김모씨(57)는 “윤 대통령이 주먹을 들면서 지지자에게 인사하는 모습을 보니 너무 화가 났다”며 “윤 대통령 탄핵 절차가 잘 진행되고 있다고 생각했는데 관망만 할 수는 없다고 생각했다”고 말했다. 진모씨(35)는 “(...,7시간 전,https://www.khan.co.kr/article/202503092303001,경향신문
[정동칼럼]윤 대통령 석방과 민주당 ‘중도 보수론’,https://img.khan.co.kr/news/c/190x140/2025/03/09/l_2025031001000191800022961.jpg,"윤석열 대통령이 구속 취소로 석방되었다. 내란죄와 관련된 형사재판에 영향을 미치겠지만, 탄핵심판에 미치는 영향은 미미하거나 없을 것이라는 전망이 우세하다. 조기 대선을 앞둔 국민의힘의 전략은 출구가 보이지 않는다. 강성 보수화든 극우화든 국민의힘에는 계륵이다. 대선 승패는 대개 중도층에 달렸기 때문이다.정당 스펙트럼을 극좌에서 극우로 정렬하면, 대선 정국의 스펙트럼은 급진 좌파에서 극우(극단 우파)까지 나타난다. 현재 한국에서 극좌는 존재하지 않는다. 정의당, 기본소득당, 진보당, 사회민주당, 녹색당 등은 급진 좌파에 속한다. 민주당은 중도에 자리하며 중도 보수까지 진출하려 한다. 국민의힘이 극우에 위치하기 때문이다.좌파와 우파의 구분이 반드시 진보와 보수의 구분과 일치하지는 않는다. 진보와 보수는 상대적 개념이다. 보수가 현존 질서를 유지하려는 입장이라면, 진보는 현존 질서를 발전된 미래를 향해 재편하려는 입장이다. 현존 질서를 과거의 특정 질서로 회귀시키려 한다면 ...",8시간 전,https://www.khan.co.kr/article/202503092152015,경향신문
[미디어세상]볼만한 기사가 없던 주말,https://img.khan.co.kr/news/c/190x140/2025/03/09/l_2025031001000192400022951.jpg,"금요일 오후에 벌어진 일이라서 그랬을까. 엄청난 사건이 터졌는데 볼만한 기사가 없다. 서울중앙지법이 윤석열 대통령 구속 취소를 판결한 이후 주말 동안의 언론 사정이다. 법원의 결정을 타전한 직술뉴스가 있고, 검찰이 항고 여부를 놓고 고심한다는 관찰 기사도 나왔다. 여야 정치권의 반응과 분열된 시민 집단들의 찬반 시위를 묘사한 스케치 기사가 있지만 그뿐이다. 법원 판결문을 직접 구해 읽어볼 처지가 아닌 나로서는 6공화국 최초로 내란죄로 대통령을 구속한 일이 실은 부당했다는 법원의 판단을 어떻게 받아들여야 할지 난감했다.갑갑한 마음에 인터넷 동영상과 교류매체 계정들을 둘러봤지만 혼란스럽기는 마찬가지다. 검찰의 간악한 음모라느니, 공수처의 무능함 때문이라느니라며 조리돌림 하려는 움직임이 보인다. 판결을 내린 법관의 출신과 성향을 따져 물으며 마녀사냥을 시작하려는 조짐도 있다. 이 땅에 정의가 죽었느니 살았느니 외치는 한탄과 감탄은 무수하다. 이 판결 때문에 헌법재판소의 탄핵심판이 ...",8시간 전,https://www.khan.co.kr/article/202503092152005,경향신문
[시선]외국인 가사노동자 확대가 답?,https://img.khan.co.kr/news/c/190x140/2025/03/09/l_2025031001000190900022891.jpg,"정부는 외국인 가사사용인 4000명을 각 가정의 육아, 가사 등 돌봄노동 분야에 취업할 수 있도록 올해 허가할 예정이다. 장기 체류자 가운데 취업이 자유롭지 않은 외국인 유학생, 결혼이민자의 가족, 외국인 노동자의 배우자 등을 대상으로 각 지방자치단체에서 직무교육을 실시하고, 교육 이수 후 취업활동 허가를 받도록 한다는 것이다.이는 서울시에서 시행한 ‘외국인 가사관리사 시범사업’과 몇 가지 차이가 있다. 정부의 ‘외국인 가사사용인 시범사업’에서는 가구 내 고용 형태로 일하는 가사사용인에 대해 최저임금법, 근로기준법이 적용되지 않는다. 서울시 시범사업의 경우, 비전문취업(E-9) 체류자격을 부여받아 입국해 가사서비스 제공기관에 고용돼 각 가정으로 파견되는 형태로, 해당 기관이 고용 사업주로서 근로기준법상의 책임 주체가 됐다. 그러나 정부 사업은 이미 장기 체류자격을 보유하고 한국에 거주하고 있는 외국인을 대상으로 허가하는 것으로 체류자격의 유지는 취업 활동이 아닌 유학이나 가족...",8시간 전,https://www.khan.co.kr/article/202503092150025,경향신문
[詩想과 세상]고시원,https://img.khan.co.kr/news/c/190x140/2025/03/09/l_2025031001000189700022881.jpg,"소년은 놓이게 되었습니다찬장의 그릇처럼빈방을 채워가는 거미줄처럼벽지에 눌어붙은 살냄새아무런 이유도 없이 놓였습니다 소년은신문으로 창문을 만들어보다가입구를 찾는 날벌레처럼머뭇거리며연습장 한 권을 쓰지 못하고창틀과 형광등의 차원에 놓인나방처럼한 사람이 살던 방으로 날아와빈 육체를 포개봅니다정우신(1984~)고시원에 누군가 소년을 두고 갔다. 시인은 그 소년에 대해 “찬장의 그릇”처럼 “놓이게 되었”다고 말한다. 소년은 “신문으로 창문을 만들”고, “입구를 찾는 날벌레”가 되어 날아갈 꿈을 꾸지만, 이 습하고 눅눅한 곳에서 빠져나갈 수가 없다. 이 좁은 방에는 해가 찾아오지 않기 때문이다.고시원은 이제 고시생들만의 공간이 아니라 갈 곳 없는 사람들이 임시로 묵는 곳이기도 하다. 작은 방들이 밀집된 공간에서 최소한의 생활만을 겨우 유지할 수 있는 곳, 얇은 벽 때문에 여러 소음...",8시간 전,https://www.khan.co.kr/article/202503092150015,경향신문
[아침을 열며]탄핵 이후,https://img.khan.co.kr/news/c/190x140/2025/03/09/l_2025031001000189200022901.jpg,"얼마 전 온라인 커뮤니티에서 결혼에 관한 글을 읽었다. 직장인 익명 커뮤니티에 올라온 글을 가져왔다는데 실제인지 꾸며낸 것인지는 정확히 모르겠다. 다만 그 밑에 달린 댓글들로 짐작건대 한국 사회 어딘가 있음직한 일은 분명해 보였다.글쓴이는 ‘우리집은 가난과 서민 그 어딘가쯤’이라 소개하며 글을 시작했다. 글쓴이의 누나는 서른한 살로 지난해 괜찮은 공기업에 취업했다. 부모님은 공기업에도 들어갔으니 좋은 남자 만나서 빨리 결혼을 하라 했고, 글쓴이도 누나가 좋은 외모까지 가졌기에 금방 결혼을 할 것이라 여겼다. 그런데 누나는 부모님 앞에서 결혼을 안 하겠다고 선언한다. “부모님이 지원도 못 해줘서 대출 아직도 갚고 있고, 서른 넘었는데 모아놓은 돈도 없고, 부모님 노후준비도 안 되어 있고 물려받을 게 하나도 없기 때문”이었다.글쓴이의 누나는 “비슷한 남자 만나서 결혼하기 싫고 더 잘난 남자 만나서 결혼하기도 싫다”며 “결혼은 안 하는 것이 아니라 못하는 것에 가깝다”고 차...",8시간 전,https://www.khan.co.kr/article/202503092150005,경향신문
[스테판 해거드의 미국에서 온 엽서]국가에 대한 공격,https://img.khan.co.kr/news/c/190x140/2025/03/09/l_2025031001000194300022841.jpg,"트럼프, 단일 행정부를 앞세워대학 등 공공기관 향해 공격훌륭한 행정 장치 없이는위대한 나라를 만들기 어렵다도널드 트럼프 대통령이 미국에 불러일으킨 혼란의 작은 이점은 미국인들이 민주주의 통치의 아주 기본적인 문제를 재고해야 한다는 점이다. 대통령은 행정부에 행사하는 권한을 포함하여 얼마나 많은 권한을 가져야 할까? 경제 생활에서 국가는 어떤 역할을 해야 할까?미국과 다른 선진 산업 민주주의 국가들은 항상 정부의 역할과 규모에 대해 이의를 제기해왔다. 보수주의자들은 세금을 낮추고 규제를 완화하는 것을 선호하며 이것이 더 빠른 성장을 촉진한다고 믿는다. 자유주의자들은 정부가 재분배 및 복지 기능을 수행할 뿐만 아니라, 연구 및 개발 지원이나 디지털 인프라와 같은 정부의 공공재 제공도 경제적 웰빙을 증진시킨다고 믿는다.트럼프와 미국 내 일부 보수주의자들은 연방 관료제에 반대하는 완전히 다른 주장을 펼쳤다. 그들은 일론 머스크가 주장해온 것처럼 공공 지출...",8시간 전,https://www.khan.co.kr/article/202503092148005,경향신문
"[지금, 여기]수많은 ‘유독’의 순간을 넘어",https://img.khan.co.kr/news/c/190x140/2025/03/09/l_2025031001000190400022861.jpg,지난 8일 믿기 어려운 일이 벌어졌다. 내란 우두머리 혐의로 기소돼 서울구치소에 구속되어 있던 윤석열이 제 발로 걸어 나온 것이다. 전날 서울중앙지방법원이 구속 취소 결정을 내리고 검찰이 항고를 포기하고 석방을 지휘하며 이루어진 일이었다. 당시 광장에서 윤석열 퇴진과 민주주의 회복을 바라는 수많은 시민들과 함께 있으며 주변의 허탈감과 분노를 생생히 느낄 수 있었다.법원이 구속 취소 결정을 한 이유는 검찰이 구속기간을 잘못 계산해 기간 만료 후 기소했다는 것이다. 구속기간에서 제외되는 영장실질심사 기간을 날짜가 아닌 시간으로 계산해야 한다는 것이다. 그러나 형사소송법은 모두 구속기간을 날수로 계산하고 있다는 점에서 이러한 법원의 판단이 타당한지 의문이 든다. 그럼에도 피의자의 권리를 보장하기 위해 보다 유리한 해석을 할 수는 있다. 문제는 이것이 왜 유독 피의자가 윤석열인 사건에서 선례와 다른 이번 결정이 이루어졌는지다.이후 검찰의 대응 역시 납득하기 어렵다. 통상 자신...,8시간 전,https://www.khan.co.kr/article/202503092147005,경향신문
"[NGO 발언대]전세사기는 끝나지 않았다, 특별법을 개정하라",https://img.khan.co.kr/news/c/190x140/2025/03/09/l_2025031001000188700022821.jpg,"한 청년이 원양어선에 올랐다. 2년 전 일이다. 전세사기 피해로 인한 빚을 갚기 위해서였다. 전세사기특별법 발의 한 달 전 경매가 완료되면서, 그는 공식 피해자로 인정받지 못했다. 일렁이는 배 위에서 멀미를 삼키는 동안 그에게 가해한 공인중개사는 영업을 이어갔다. 2년이 흘러 다시 밟은 한국 땅에는 새로운 피해자가 발생하고 있었다. 청년은 멀미가 계속되듯 어지러웠을 테다. 전세사기는 현재진행형이다.2월 광화문에서 그의 목소리를 들었다. 전세사기 피해로 목숨을 끊은 첫 번째 희생자의 2주기 추모제였다. 첫 죽음 이후 7명의 부고가 이어졌다. 윤석열의 거부권 행사에도 피해자들의 희생과 절규로 전세사기특별법이 제·개정되었다. 그러나 2023년 6월부터 시행된 전세사기특별법은 한시법으로 올해 5월 만료를 앞두고 있다.2024년 12월 기준 특별법을 통해 인정된 피해자는 2만5000여명이다. 피해자로 인정받지 못한 경우도 약 1만건인 점을 미뤄보면 사각지대 피해자는 훨씬 많을 ...",8시간 전,https://www.khan.co.kr/article/202503092146035,경향신문
[반복과 누적]싱글은 앨범이 아니다,https://img.khan.co.kr/news/c/190x140/2025/03/09/l_2025031001000189000022801.jpg,"제22회 한국대중음악상(한대음) 시상식이 열렸다. 걸그룹 에스파가 3개 부문 수상, 로커 이승윤이 트로피 2개를 가져갔다. 작년 <PSST!>라는 훌륭한 앨범을 낸 존박은 팝 부문 주인공이 됐다. <PSST!>는 정확하면서도 적절한 편곡으로 이뤄진 2024년 최고의 메인스트림 팝 앨범이다. 음악적으로 탄탄한 현재의 대중음악을 듣고 싶다면 강력하게 추천한다.한대음의 하이라이트는 ‘올해의 음반’이다. 그렇다. 싱글이 대세임에도 앨범은 여전히 중요하다. 이렇게 바꿔 말할 수 있지 않을까. 싱글이 가능한 차선이라면 앨범은 불가능한 최선이다. 음악가는 싱글로 상업적 성공을 손에 쥐려 하고, 앨범으로는 예술적 완성을 꿈꾼다. 2025년 올해의 음반 수상작은 밴드 ‘단편선 순간들’의 <음악만세>(사진)다. 짐작건대 ‘단편선 순간들’을 아는 독자는 많지 않을 것이다. 리더 단편선은 2010년부터 활동한 인디 음악가다.시상식 다음날 라이브클럽데이...",8시간 전,https://www.khan.co.kr/article/202503092146025,경향신문
