title,thumbnail,short_content,write_time,link,company
"수명 다한 풍력발전기 날개, 서핑 보드로 부활",https://img.khan.co.kr/news/c/190x140/2025/03/09/l_2025031001000184100022571.jpg,"수명이 다해 폐기된 풍력발전기 날개(블레이드)로 서핑 보드를 만드는 기술이 개발됐다. 유리섬유가 섞인 복합소재로 만들어져 재활용이 어려웠던 풍력발전기 날개를 부활시킬 계기가 마련됐다. 이달 초 스페인 재생에너지 기업인 악시오나는 호주 빅토리아에 있는 한 풍력발전소가 폐기한 풍력발전기 날개를 재활용해 서핑 보드 시제품(사진) 10개를 만들었다고 밝혔다.일반적인 서핑 보드는 폴리우레탄을 몸통 삼아 겉면에 유리섬유를 발라 만든다. 악시오나는 서핑 보드에 바르는 유리섬유에 풍력발전기 날개를 분쇄해 섞었다. 이러면 서핑 보드 내구성이 올라간다. 풍력발전기 날개가 유리섬유가 섞인 플라스틱으로 만들어져 있기 때문이다.풍력발전기 날개 재활용은 환경도 지킬 수 있다. 유리섬유가 섞인 풍력발전기 날개는 가볍고 튼튼하지만, 수명을 다한 뒤에는 재활용이 어려웠다. 순수한 플라스틱이 아니라 녹여서 쓰기가 쉽지 않았고, 이 때문에 매립되거나 소각 처리돼왔다. 악시오나는 풍력발전기 날개가...",9시간 전,https://www.khan.co.kr/article/202503092125015,경향신문
"이상한 변신 로봇, 비상한 이동 능력",https://img.khan.co.kr/news/c/190x140/2025/03/09/l_2025031001000183900022561.jpg,"유리섬유 재질의 얇은 케이블로 이뤄진 몸통을 자유자재로 변형시켜 비포장도로와 비탈길 등에서 막힘없이 이동할 수 있는 로봇이 개발됐다. 재난 현장에서 생존자를 수색하고, 다른 천체에서 과학 탐사를 벌이는 일 등에 활용할 수 있을 것으로 보인다.스위스 로잔연방공대(EPFL) 연구진은 최근 국제학술지 ‘사이언스 로보틱스’를 통해 몸통 모양을 마음대로 바꿔 어떤 지형에서든 거뜬히 이동할 수 있는 로봇 ‘GOAT’(사진)를 개발했다고 밝혔다.GOAT의 겉모습은 일반적인 로봇과는 상당히 다르다. 연구진은 “거미와 캥거루, 바퀴벌레, 문어 등의 움직임에서 영감을 얻어 동체를 디자인했다”고 밝혔다.GOAT 동체는 단단한 외피 없이 철사를 얼기설기 이어놓은 듯한 모습이다. 실제로는 탄성 있는 유리섬유로 제작된 동체의 네 귀퉁이에는 풍차를 닮은 바퀴가 달렸다. 평평한 지형에서는 몸통을 팬케이크처럼 납작하게 만들어 바퀴를 굴린다. 자동차와 비슷하다. 그러다 비탈길을 만나면 ...",9시간 전,https://www.khan.co.kr/article/202503092125005,경향신문
중국 스타트업의 AI 비서 ‘마누스’…‘제2의 딥시크’ 기대감,,중국의 한 인공지능(AI) 스타트업이 내놓은 ‘AI 에이전트(비서)’가 공개 직후 화제가 되고 있다. 현지에선 이 모델이 저비용·고성능이라는 점에서 ‘제2의 딥시크’에 대한 기대도 나온다.9일 업계에서는 중국 AI 스타트업 모니카가 지난 5일 공개한 AI 비서 ‘마누스’를 향한 관심이 이어지고 있다.‘손’이라는 뜻의 라틴어에서 이름을 따온 마누스는 AI 문제 해결 능력을 평가하는 지표인 벤치마크 테스트에서 최고 성능을 획득했다. 이는 챗GPT를 만든 오픈AI의 AI 에이전트 ‘딥 리서치’를 능가하는 수준이라고 모니카 측은 설명했다.모니카는 마누스가 일본 여행을 계획하거나 테슬라 주식을 심층 분석하는 등 복잡한 업무를 수행하는 모습도 마누스 공식 홈페이지를 통해 공개했다.회사 측은 “마누스는 사고와 행동을 연결하는 범용 AI 에이전트”라며 “단순히 사고하는 데 그치지 않고 결과를 제공한다”고 소개했다.현지에서는 마누스가 제2의 딥시크가...,9시간 전,https://www.khan.co.kr/article/202503092124035,경향신문
올 들어 금리 인하 움직임에 ‘껑충’ 늘어난 ‘주담대’,,"새해 들어 집을 사기 위해 은행에서 주택담보대출(주담대)을 받는 사람이 늘고 있다. 최근 토지거래허가구역 해제 등으로 서울 집값이 들썩이고 있는 데다, 시중은행들의 금리 인하 움직임이 이어지는 만큼 주담대 증가세는 당분간 계속될 것으로 보인다.9일 금융권에 따르면 지난달 5대 은행(KB국민·신한·하나·우리·NH농협은행)에서 취급한 주택 구입 목적 신규 주담대는 7조4878억원으로 집계됐다. 전월(5조5765억원)보다 34% 급증했다. 전월 대비 증가율로는 지난해 4월(34.8%) 이후 가장 높다. 취급액도 대출규제 직전인 지난해 9월(9조2088억원) 이래 최대 기록이다.반면 정부가 지원하는 정책대출 비중은 점차 줄고 있다. 5대 은행의 주택 구입 목적 신규 주담대 중 디딤돌대출 등과 같은 정책대출 비중은 지난해 12월 54.6%, 올해 1월 44.0%, 2월 36.6%로 감소세다.이는 새해 들어 은행권이 주담대 문턱을 낮춘 데 따른 것이다. 금융...",9시간 전,https://www.khan.co.kr/article/202503092124025,경향신문
"소액주주 ‘주주관여’ 활동 증가…개미들 목소리, 10년 새 두 배로",,"“배당 확대 등 단기 이익에 초점 기업 R&D·경쟁력 훼손 우려” 전문가 “상의, 한국 기업들의 후진적 경영행태 외면하는 것”개미투자자들의 주주제안이 10년 새 2배로 늘었으며 주로 ‘배당 확대’ 요구가 많았다는 경제단체의 분석 결과가 나왔다. 대한상공회의소가 9일 공개한 300개 상장기업 대상 설문 결과를 보면, 상장기업 10곳 중 4곳은 최근 1년간 주주들로부터 ‘주주관여’를 받은 사실이 있다고 응답했다.주주관여 주체로는 소액주주와 소액주주연대(90.9%)가 가장 많이 꼽혔고 연기금과 사모펀드 및 행동주의 펀드는 각각 29.2%, 19.2%에 그쳤다.주주관여는 경영에 직접적 영향을 미치기 위한 주주행동주의 활동을 일컫는 것으로 경영진과의 대화, 주주서한, 주주제안 등의 활동이 있다. 주주관여 내용을 묻는 질문에는 배당 확대(61.7%), 자사주 매입·소각(47.5%), 임원의 선·해임(19.2%), 집중투표제 도입 등 정관 변경(...",9시간 전,https://www.khan.co.kr/article/202503092124015,경향신문
[포토뉴스] 냉동만두도 가격은 ‘뜨거워져’,https://img.khan.co.kr/yhap/c/190x140/2025/03/09/l_2025031001000195700022541.jpg,"9일 서울 시내 대형마트 냉동만두 판매대에서 한 소비자가 제품을 고르고 있다. CJ제일제당은 이달부터 대형마트에서 파는 만두, 햄, 소시지 등 일부 제품 가격을 인상했다. 동원F&B도 이달부로 마트 등에서 냉동만두 15종 가격을 평균 5% 올렸다.",9시간 전,https://www.khan.co.kr/article/20250309212400A/?cp,경향신문
농촌 빈집 ‘부동산 거래 플랫폼’ 구축,,"이르면 올 5월부터 네이버부동산과 KB부동산 등 부동산 거래 플랫폼에서 농촌 빈집을 사고파는 거래가 가능해진다. 농림축산식품부는 지방자치단체, 유관기관 등과 농촌 빈집 거래 활성화를 위한 ‘농촌 빈집 은행’ 구축 사업을 추진한다고 9일 밝혔다.농촌 빈집 은행은 소유자 동의를 받아 농촌 빈집을 매물화하고, 관련 정보를 민간 부동산 거래 플랫폼에 등록하는 방식으로 구축한다. 같은 정보를 귀농귀촌 통합 플랫폼 ‘그린대로’와 한국부동산원의 빈집 정보 플랫폼 ‘빈집애’ 등과도 연계해 제공할 계획이다. 농식품부는 이달 중 사업에 참여할 지자체와 관리기관을 모집한다. 내달엔 공인중개사를 모집하고, 거래 동의 빈집을 확보한다.5월부터는 부동산 거래 플랫폼과 귀농귀촌 플랫폼 등에 등록을 시작한다. 제주특별자치도, 전북 부안군, 충남 예산군이 빈집 은행 사업에 우선 참여한다. 그 밖에 참여를 희망하는 지자체는 10일부터 24일까지 신청을 받는다.농촌 빈집 규모는 2023년...",9시간 전,https://www.khan.co.kr/article/202503092124005,경향신문
‘가습기살균제 공표 명령’ 무시한 애경·SK…공정위는 뒷짐,,"가습기살균제의 주요 성분이 독성물질이라는 점을 은폐해 공정거래위원회로부터 표시광고법 위반 사실 ‘공표 명령’을 받은 애경산업과 SK케미칼(현재 SK케미칼과 SK디스커버리로 분할)이 해당 명령을 제때 이행하지 않은 사실이 드러났다.특히 이행 여부를 감시해야 할 공정위도 두 기업이 공표를 제대로 했는지 확인조차 하지 않았다. 뒤늦게 기한 내 이행이 되지 않은 사실을 파악한 공정위는 두 기업을 고발하는 방안을 검토하기로 했다.9일 경향신문 취재 결과, 애경산업은 공정위의 시정조치에 대한 행정소송에서 일부 패소, SK케미칼은 전부 패소했지만 법 위반 사실 공표를 제때 하지 않았다.기업은 공정위 의결서를 받은 날로부터 공표 명령 등 시정조치를 30일 이내에 해야 한다. 기업이 법원에 집행정지 신청을 하면 절차가 중단되지만 판결 확정 시에는 30일 안에 이행해야 한다. 애경은 2023년 12월, SK케미칼은 지난해 10월 각각 대법원에서 판결이 확정됐다.공표...",9시간 전,https://www.khan.co.kr/article/202503092123005,경향신문
6년 거주 뒤 우선분양권 제공 ‘e편한세상 내포 퍼스트드림’,https://img.khan.co.kr/news/c/190x140/2025/03/09/l_2025031001000184000022461.jpg,"DL이앤씨가 충남 홍성군 내포신도시 RH16 블록에 공공분양 뉴홈 단지인 ‘e편한세상 내포 퍼스트드림’을 분양한다.e편한세상 내포 퍼스트드림은 6년간 거주한 뒤 입주자에게 우선분양권을 제공하는 ‘뉴홈’ 선택형 단지다. 지하 1층~지상 25층, 10개동 총 949가구로 구성된다. 수요자 선호도가 높은 전용면적 84㎡로만 이루어졌다. 입주 예정일은 2027년 1월이다.동 간 거리를 넓게 확보해 개방감을 극대화하면서 가구 간섭을 최소화한 게 특징이다. 단지 안 풍부한 조경도 장점이다. 약 7500㎡에 이르는 중앙공원과 18곳에 달하는 정원이 조성된다.한울초가 단지 맞은편에 있고, 바로 옆에는 홍북중이 3월에 개교한다. 단지 인근에 도청대로, 충남대로가 있어 서해안고속도로와 당진~영덕고속도로 이용이 편리하다.",9시간 전,https://www.khan.co.kr/article/202503092121005,경향신문
KTX 안동역 인근 ‘안동 용상 하늘채 리버스카이’ 548가구,https://img.khan.co.kr/news/c/190x140/2025/03/09/l_2025031001000183700022451.jpg,"코오롱글로벌이 경북 안동시 용상동 일원에 ‘안동 용상 하늘채 리버스카이’를 분양한다.안동 용상 하늘채 리버스카이는 지하 2층~지상 26층, 9개동으로 구성된다. 선호도 높은 전용 84㎡ 단일 구성에 총 548가구(펜트하우스 5가구 포함)가 공급된다. 용상동 최고 높이인 26층으로 설계돼 반변천 조망권을 확보했다. 실내공간엔 넉넉한 수납공간을 마련하고 일부 가구에는 테라스를 적용해 개방감을 높인다.인근에 KTX안동역이 위치해 사통팔달 교통망을 갖췄다. 용상교리신교도(올해 예정), 선어대~신석 간 교량 가설(예정), 용상중로(예정) 등으로 인근 지역 접근성이 대폭 개선될 것으로 전망된다.또한 길주초, 길주중에 도보로 통학 가능하고 명문 안동고를 비롯해 안동대, 가톨릭상지대 등이 가까이 있어 우수한 교육환경을 제공한다.",9시간 전,https://www.khan.co.kr/article/202503092120015,경향신문
대전 최초 스카이라운지·게스트하우스 ‘롯데캐슬 더퍼스트’,https://img.khan.co.kr/news/c/190x140/2025/03/09/l_2025031001000183500022471.jpg,"롯데건설이 대전 동구 가오동 394번지 일원에 ‘대전 롯데캐슬 더퍼스트’를 분양한다. 롯데캐슬 더퍼스트는 대전에 들어서는 첫 롯데캐슬 브랜드 단지다. 지하 2층~지상 최고 33층, 10개동, 전용 59~74㎡, 총 952가구 규모로 조성되며 일반분양은 394가구다.고품격 설계와 풍부한 커뮤니티 시설이 특징이다. 스카이라운지 및 스카이게스트하우스가 대전 최초로 도입되며, 실내골프클럽, GX룸, 북카페, 독서실, 코인세탁실 등 입주민의 편의성을 고려한 다양한 커뮤니티 시설이 마련된다.남향 위주로 가구를 배치하고 4베이 구조를 적용해 채광과 통풍을 극대화했다. 대전천 시민현수공원과 맞닿아 있어 쾌적한 환경을 자랑하며, 대전역과 가깝고 KTX·SRT, 대전도시철도 1호선 이용이 가능하다. 2028년 개통 예정인 도시철도 2호선 트램도 인근을 지나게 된다.",9시간 전,https://www.khan.co.kr/article/202503092120005,경향신문
[친절한 식품 이야기]뭘 먹을지 고민? 장속 살아있는 미생물에 물어라,https://img.khan.co.kr/news/c/190x140/2025/03/09/l_2025031001000184200022431.jpg,"우리가 매일매일 섭취하는 식품은 우리 몸의 에너지원이 될 뿐만 아니라 건강을 유지하고 질병을 대비하는 데 중요한 역할을 한다. 올바른 식품을 선택해 섭취해야 하는 이유다.하지만 동일한 식품에 대한 인체 반응은 개인마다 차이가 있다. 같은 빵을 먹어도 사람에 따라 혈당이 빠르게 높아지거나 천천히 높아질 수 있다. 이는 모든 사람의 건강에 이로운 단일 식단을 정의하는 게 어렵다는 것을 의미한다.그러면 우리는 어떤 식품 혹은 식단을 섭취해야 건강한 삶을 살 수 있는 것인가. 최근에는 이러한 물음에 답하기 위해 개인의 생물학적 특성, 생활 습관 및 건강 상태 등을 고려한 ‘개인 맞춤 정밀식이’라는 개념이 주목받고 있다. 정밀식이에서 특히 강조되는 것이 장내미생물의 역할이다.인간의 장에 존재하는 미생물은 음식의 소화, 대사, 면역 조절, 비타민 합성 등 건강에 관련한 다양한 역할을 수행한다. 아프리카와 유럽 사람을 대상으로 한 비교 연구에서 장내미생물 구성은 식습관, 생...",9시간 전,https://www.khan.co.kr/article/202503092119025,경향신문
달에서 내비 찍고 달린다,https://img.khan.co.kr/news/c/190x140/2025/03/09/l_2025031001000183600022441.jpg,"지난 2일 달 앞면 안착한 착륙선서울~부산 900배 거리 극복지구 위성서 발사한 전파 증폭기존 위치확인 기술보다 간편달 자동차·우주선 운행에 탄력NASA “역사를 새로 썼다”# “저 커다란 파란 구슬은 볼 때마다 경이롭군.” 검은 우주를 배경으로 떠 있는 처연하면서도 아름다운 지구를 본 프루이트 대령(도널드 서덜랜드 분)은 이 한마디를 뱉은 뒤 침묵을 이어간다. 주행 중인 월면차에 동승한 맥브라이드 소령(브래드 피트 분)도 지구에 시선을 고정한 채 말이 없다. 두 사람은 월면에 있는 화성행 로켓 발사장으로 향하는 길이다.그때, 미확인 월면차 여러 대가 두 사람 근처로 몰려든다. 달 여행자의 금품을 노리는 우주 해적이다. 순식간에 총격전이 벌어진다. 맥브라이드 소령이 탄 월면차는 해적 차량과 충돌하며 운석 충돌구 바닥으로 추락한다.사방이 막히고 움푹 들어간 지형 탓에 운석 충돌구 내부는 빛이 들지 않는다. 전조등을 켜도 칠흑같이...",9시간 전,https://www.khan.co.kr/article/202503092119005,경향신문
[포토뉴스] “여성의 목소리를 막지 말라”,https://img.khan.co.kr/yhap/c/190x140/2025/03/09/l_2025031001000202900022407.jpg,"유엔이 정한 ‘세계여성의날’인 8일 세계 각지의 여성들이 여성의 권리 향상과 정책 개선 등을 요구하는 퍼포먼스를 벌이고 있다. 왼쪽 위 사진부터 시계 방향으로 콜롬비아 보고타, 브라질 상파울루, 스리랑카 콜롬보, 멕시코 멕시코시티, 아르헨티나 부에노스아이레스, 브라질 상파울루.",9시간 전,https://www.khan.co.kr/article/20250309211600A/?cp,경향신문
"미 군사정보 공유 끊긴 우크라, 러 공습에 ‘속수무책’",,"도널드 트럼프 미국 행정부가 우크라이나에 공유하던 군사정보를 비공개 처리한 이후 우크라이나가 러시아의 공습에 속수무책으로 당하고 있다. 러시아는 우크라이나 동부 도심에 대한 미사일·무인기 폭격을 강화했고, 지난 7~8일(현지시간) 공습으로 최소 25명이 목숨을 잃었다고 BBC가 보도했다.볼로디미르 젤렌스키 우크라이나 대통령은 8일 엑스(옛 트위터)에 “전날 밤 러시아군이 도네츠크주 도브로필리아 중심부를 탄도미사일 두 발로 공격했다”며 이 공격으로 11명이 사망하고, 어린이 5명 등 30명 이상이 다쳤다고 밝혔다. 지난 8일엔 하르키우 보호두히우에 드론 공습이 이어져 최소 3명이 사망하고 7명이 부상했다.이번 공습은 미국이 우크라이나군에 위성 이미지 공유를 끊고 24시간이 채 지나지 않아 시작됐다고 미 ABC방송은 전했다. 우크라이나는 미국 정보에 의존해 러시아의 장거리 미사일과 드론 공격에 대한 조기 경보 시스템을 운영하고 있다. 트럼프 대통령은 지난달 젤렌스키...",9시간 전,https://www.khan.co.kr/article/202503092116005,경향신문
"미국과 발맞출라…중국, 캐나다에 ‘최대 100% 추가 관세’ 경고 사격",,"중국이 캐나다산 일부 농산물에 ‘최고 100% 추가 관세 적용’을 발표하면서 최근 미국 관세정책에 동조하는 캐나다에 경고 신호를 보냈다. 미국의 관세 위협으로 미·중 갈등이 심화하는 상황에서 새로운 전선이 열렸다는 분석이 나온다.로이터통신은 8일(현지시간) 중국의 캐나다산 농산물에 대한 보복 관세 발표를 두고 ‘캐나다에 경고사격을 한 것’이라고 보도했다. 도널드 트럼프 미 행정부는 캐나다와 멕시코에 ‘미국과 똑같이 중국산 수입품에 20% 추가 관세를 부과하면 두 국가에 적용할 25% 관세를 완화할 수 있다’는 신호를 보냈는데, 캐나다가 미국과 보조를 맞출 것을 우려한 중국이 견제구를 던졌다는 것이다.앞서 이날 중국 국무원 관세세칙위원회는 성명을 내고 캐나다산 유채씨유, 깻묵, 완두콩에 대해 추가 100% 관세를 부과할 것이며, 수산물과 돼지고기에는 25%의 추가 관세를 매길 것이라고 밝혔다.관세위원회는 이번 관세 조치의 배경으로 지난해 10월 캐나다가 중...",9시간 전,https://www.khan.co.kr/article/202503092115035,경향신문
"내전종식 무색하게…시리아, 유혈충돌로 이틀간 1000명 사망",,"지난해 말 권좌에서 축출된 시리아의 옛 독재자 바샤르 알아사드의 잔당이 소요 사태를 일으켜 이를 진압하는 과정에서 이틀간 1000명 이상 숨지는 참사가 발생했다. 이는 2011년 시리아 내전이 시작된 이래 단기간에 벌어진 최악의 인명 피해다.8일(현지시간) 시리아 분쟁 감시단체 시리아인권관측소(SOHR)에 따르면 지난 6일 시리아 서부에서 발생한 소요 사태 이후 민간인 745명과 정부군 126명, 친알아사드 무장세력 148명이 사망한 것으로 집계됐다.이번 사태는 지난해 말 러시아로 망명한 알아사드 전 대통령에 충성하는 무장세력이 서부 라타키아에서 매복 공격을 일으키며 촉발됐다. 과도정부는 잔당 진압을 위해 서부 해안지역인 라타키아, 타루투스 일대의 모든 도로를 봉쇄하고 헬기를 동원한 광범위한 군사 작전을 벌였다. 전력과 식수도 차단했다. 이 일대는 2대에 걸친 세습 독재 정권이었던 알아사드 가문의 출신지이자 핵심 지지 기반으로, 친알아사드 세력인 알라...",9시간 전,https://www.khan.co.kr/article/202503092115025,경향신문
"이란, 트럼프 핵무기 협상 거부…“협상 아닌 강대국의 겁박” 비판",https://img.khan.co.kr/news/c/190x140/2025/03/09/l_2025031001000191900022391.jpg,이란이 핵무기 개발 문제를 협상하자는 도널드 트럼프 미국 대통령의 제안을 거부했다. 미국의 제안을 “강대국의 겁박”이라고 일축한 것이다.이란 최고지도자인 아야톨라 알리 하메네이(사진)는 8일(현지시간) 테헤란에서 열린 각료회의에서 “겁박하는 강대국의 협상 요구는 진정한 문제 해결을 위한 시도가 아니라 자신들이 원하는 것을 일방적으로 강요하기 위한 것”이라며 “이란은 그들의 기대에 절대 응하지 않을 것”이라고 말했다. 하메네이는 “그들의 요구는 우리의 방위 능력과 국제적 영향력에 관한 것”이라며 “그것은 협상이 아니다. 명령하고 강요하는 것”이라고 비판했다.이런 반응은 트럼프 대통령이 이란 핵무기 개발 문제와 관련해 새로운 협상을 요구하는 서한을 보냈다고 인정한 지 하루 만에 나왔다. 트럼프 대통령은 전날 이란의 핵무기 보유를 막을 수 있는 “마지막 순간에 와 있다”면서 “곧 평화 합의를 할 수 있기를 희망한다”고 말했다.트럼프 대통령은 집권 1기 때인 2...,9시간 전,https://www.khan.co.kr/article/202503092115015,경향신문
"미·하마스 물밑 접촉에 놀란 이스라엘, 대표단 급파…“휴전협상 진전에 노력”",,"이스라엘이 팔레스타인 무장정파 하마스와의 휴전협상 지속 여부를 중재국과 논의하기 위해 카타르 도하에 대표단을 파견하기로 했다. 하마스는 2단계 협상 진전에 “긍정적 지표가 보인다”고 언급한 데 이어 미국과의 협상 의사를 내비쳤다. 지난 1일 협상 1단계 시한이 만료된 후 ‘1단계 연장’ 안과 ‘2단계 진행’ 안을 놓고 양측이 입장차를 좁히지 못한 채 공전해온 논의가 어렵사리 재개되는 모습이다.베냐민 네타냐후 이스라엘 총리실은 10일 카타르 도하에 대표단을 파견해 추가 인질 송환 및 인도적 지원 재개 등 가자지구를 둘러싼 휴전협상 진전을 위한 논의를 이어간다고 8일(현지시간) 밝혔다. 네타냐후 총리 측은 “미국의 지지를 받는 중재국 초대에 동의했으며, 협상 진전을 위해 노력할 것”이라고 했다.가자지구에 대한 인도적 지원 차단, 군사활동 재개 준비 등 그간 협상을 재개할 뜻을 찾아보기 어려웠던 이스라엘의 갑작스러운 태도 전환은 미국과 하마스가 물밑에서 접촉한 데 따른 대응...",9시간 전,https://www.khan.co.kr/article/202503092115005,경향신문
전세사기 걱정 없어요…경남도 인증 ‘동행 부동산’,,"경남도는 사회적 약자에게 부동산 정보를 제공하는 ‘동행 부동산 중개사무소’를 운영한다고 9일 밝혔다. 이 사업은 최근 사회적으로 큰 논란이 된 ‘전세사기’ 등 부동산 거래 사고를 막고자 추진하는 정책이다.동행 부동산 중개사무소는 주거 취약계층에게 중개 보수 지원사업을 안내하고, 사회 초년생에게 부동산 거래 계약 때 유의해야 하는 사항을 설명해준다. 외국인에게 통역 지원 등 안전한 부동산 정보와 상담 서비스도 제공한다.지난해 12월 기준 경남 18개 시군에 있는 부동산 중개사무소는 6040곳으로 집계됐다. 도는 2027년까지 3년 동안 동행 중개사무소 300여곳을 지정하고, 이후 매년 100곳씩 재지정할 예정이다.신청 자격은 도내에서 중개사무소를 개설·등록한 후 5년 이상 영업한 개업 공인중개사로, 최근 2년 이내 행정처분 이력이 없어야 한다.한국공인중개사협회와 해당 시군구의 1·2차 심사를 거쳐 경남도 공인중개사 자문위원회에서 선정한다.",9시간 전,https://www.khan.co.kr/article/202503092107055,경향신문
