title,thumbnail,short_content,write_time,link,company
[한입 우리말]재수가 없으니 땡전도 없다,,"예능 방송에서 유명 연예인이 학생들 앞에서 이런 말을 했다. “내가 땡전 한 푼 못 받아도 이 일을 하고 싶다는 생각이 들어 연기를 다시 시작하게 되었다.” 어느 날 연기를 하는 게 너무 싫어져 연예계를 떠난 뒤 복귀하면서 한 말이었다.지금껏 살면서 땡전 한 푼 못 받아도 하고 싶은 일이 있었을까. 일에 대한 그런 열정이 한 번이라도 있었는지 아무리 생각해도 떠오르지 않는다. 일이 안 풀릴 땐 으레 ‘재수가 없어서’라는 말을 쉼 없이 내뱉으면서 그럭저럭 그 시간을 버틴 듯하다. 재수가 없으니 땡전이 한 푼도 없다. 땡전이 들어올 운수가 없는데 어찌 내 주머니에 돈이 많을 수 있겠는가.재수와 돈, 그리고 땡전 사이에는 어떤 상관관계가 있을까. ‘재수’는 본디 재물에 대한 운수를 가리켰다. ‘재수가 없다’는 재물이 들어올 운수가 없다는 뜻이다. 예나 지금이나 재물이 생기는 것은 사람들에게 좋은 일이었나 보다. 단지 재물이 들어올 운수가 자신에게 좋은 일이 있을 운수를 통칭...",8시간 전,https://www.khan.co.kr/article/202503092146015,경향신문
[황규관의 전환의 상상력]덕과 우애로서의 민주주의,https://img.khan.co.kr/news/c/190x140/2025/03/09/l_2025031001000189600022781.jpg,"아리스토텔레스는 <정치학>의 첫 문장을 “모든 국가는 분명 일종의 공동체이며, 모든 공동체는 좋음을 실현하기 위해 구성된다”라고 썼다. 아리스토텔레스는 역사적 사례를 들며 귀족정, 참주정, 과두정, 민주정에 대해 말하는데, 오늘날의 관점으로 읽거나 아리스토텔레스가 차지하고 있는 서양 정신사의 후광에 기대 무슨 실용을 기대한다면 별 재미를 못 볼 가능성이 크다. 특히 현재의 ‘민주주의’가 모욕당하고 오염되고 있다고 해서 그에게 철학적 응원을 바란다면 더 그럴 것이다. 단언하자면, 이 책은 근대민주주의에 대한 정치철학서가 아니다.아리스토텔레스는 노예제와 노예라는 존재를 당연한 듯 인정했고, 심지어 노예들이 지배하는 세상을 경멸하기까지 했다. 나아가 빈민이 지배하는 민주정이 중용을 잃으면 부자의 재산을 빼앗는 일들이 벌어져 국가의 존속이 불가능하다고까지 말한다. 아리스토텔레스의 이런 ‘엘리트적’인 관점은 노동자인 직공을 ‘전쟁 기술자’의 비유로 쓰거나, 기능적인 일에만 ...",8시간 전,https://www.khan.co.kr/article/202503092146005,경향신문
김경수 “단식한다···윤석열 탄핵 인용될 때까지”,https://img.khan.co.kr/news/c/190x140/2025/03/09/news-p.v1.20250213.105886017c0548e6aa7b7df51fdf8aa6_P1.jpeg,김경수 전 경남지사는 9일 “내란우두머리 윤석열 파면 촉구 단식농성을 시작한다”고 밝혔다. 김 전 지사는 압도적인 탄핵 찬성 여론이 필요하다며 단식을 통해 자신도 투쟁하겠다는 각오를 밝혔다.김 전 지사는 이날 자신의 사회관계망서비스(SNS)에 “광화문 단식농성에 들어가며”라는 제목의 글을 올리며 이 같이 전했다. 그는 “지금은 탄핵이 최우선”이라며 “모든 것을 걸고 윤석열 내란세력과 싸우겠다”고 강조했다.그는 “윤석열의 석방은 단순히 내란 수괴 윤석열이 풀려난 사건에 그치지 않는다. 대한민국 민주주의가 위기의 벼랑 끝으로 몰리고 있다”며 “풀려난 윤석열을 중심으로 한 덩어리가 된 극우보수는 더욱 강고하게 결집하고 저들은 탄핵이 인용돼도 헌재 결정을 수용하려 들지 않을 것이다. 탄핵을 넘어 대선에서 어떤 결과가 나와도 저들은 받아들이지 않을 것”이라고 예상했다.그는 그러면서 “내란 수괴 윤석열은 다시 대통령에 올라 계엄을 발동할 수도 있다”며 “극우파들은 백주대낮에 태연...,8시간 전,https://www.khan.co.kr/article/202503092143001,경향신문
바다의 매력에 빠져 해녀가 된 예술기획자,,"강원 고성 대진항에는 올해로 물질 4년차인 막내 해녀가 있다. 서울에서 나고 자란 뒤 대학에서 문학을 전공한 조단비씨다. 조씨가 아는 사람 한 명 없는 고성에 와 해녀가 된 이유는 뭘까. 이번주 KBS 1TV <인간극장>에서 사연을 알 수 있다.조씨는 대학 졸업 후 예술 프로젝트를 기획하고 운영하는 일을 했다. 그는 예술가들의 속을 몰라 답답했고, 그럴 때마다 바다로 달려갔다고 한다. 수경 너머로 보이는 바닷속은 투명했다. 숨김없이 모든 걸 보여주는 바다의 매력에 빠졌다. 제주와 거제 등 어촌을 찾아다녔으나 조씨를 환영해준 곳은 바로 이곳, 고성이었다.고성의 해녀 이모들은 앞다퉈 조씨를 챙겨줬다. 조씨는 손도 느리고, 물에서는 더 굼떴다. 선배 해녀들의 걱정을 한몸에 받았다. 조씨의 어리숙함은 낯선 이를 경계하는 해녀 세계에 정착하는 데 오히려 도움이 됐다. 해녀들 끼리 왜 조씨에게 더 잘해주지 않느냐며 다투는 일도 있었다.조씨를 따라 그의 남...",8시간 전,https://www.khan.co.kr/article/202503092138025,경향신문
[TV 하이라이트]2025년 3월 10일,,신혼처럼 좋다가도 돌변하는 부부■오은영 리포트-결혼지옥(MBC 오후 10시45분) = 남편 이종구씨는 영화 <파묘> <추격자> 등에 출연한 배우 겸 성우이다. 부부는 결혼 46년차이지만 여전히 신혼처럼 사이가 좋다. 하지만 아내는 “평소에는 행복하지만 남편이 욕하고 확 돌변할 때는 지금도 무섭다”고 말한다. 남편은 “아내가 습관적으로 말을 가로챌 때 화가 난다”며 자신의 얘기를 끝까지 듣지 않는 아내에 대한 답답함을 토로한다.삼달리 해녀들의 공동체 일상■한국기행(EBS1 오후 9시35분) = 제주 성산읍 삼달리에는 11년차 해녀 채지애씨가 살고 있다. 그는 친정어머니의 뒤를 이어 물질을 시작했다. 처음에는 얕은 물에서 고둥밖에 잡지 못했지만 이제는 깊은 바다를 유영하며 커다란 해삼도 척척 잡아낸다. 지애씨의 든든한 지원군은 가족과 삼달리 해녀 공동체이다. 방송은 서로의 생명줄을 맡기고 살아가는 삼달리 해녀들의 일상을 들여다본다.,8시간 전,https://www.khan.co.kr/article/202503092138015,경향신문
[케이블·위성 하이라이트]2025년 3월 10일,,"■ 영화 ■ 브이 포 벤데타(OCN 오후 3시50분) = 2040년 영국. 거리 곳곳에 카메라와 녹음 장치가 설치돼 모든 이가 통제를 받으며 살아간다. 하지만 누구도 세상이 잘못됐다고 생각하지 않는다. 어느 날 소녀 이비(내털리 포트먼)가 위험에 처하자 이니셜 ‘V’(휴고 위빙)로만 알려진 의문의 남성이 나타나 그를 구해준다. 이비는 V를 알아가며 혁명을 계획하고 있는 그의 뜻에 동참한다.■ 예능 ■ 히든 아이(MBC 에브리원 오후 7시40분) = 보험금을 타기 위해 남편을 살해한 ‘가평 계곡 살인 사건’을 ‘3COPS’(권일용, 표창원, 이대우)의 시선으로 분석한다. 프로파일러 권일용은 가해자 이은해가 해당 계곡을 범죄 장소로 정한 이유에 대해 설명한다. ‘권일용의 범죄 규칙’ 코너에서는 30대 남성이 친구와의 의리를 이유로 자신이 거주하는 아파트 경비원을 폭행한 사건 등을 살펴본다.",8시간 전,https://www.khan.co.kr/article/202503092138005,경향신문
배혜윤 ‘투혼의 더블더블’…균형 맞춘 삼성생명 ‘부산행’,https://img.khan.co.kr/news/c/190x140/2025/03/09/l_2025031001000215000022851.jpg,"용인 삼성생명이 플레이오프 승부를 마지막 5차전까지 끌고 갔다.삼성생명은 9일 용인실내체육관에서 열린 하나은행 2024~2025 여자프로농구 플레이오프 4차전에서 부산 BNK를 51-48로 제압했다. 삼성생명은 2패 뒤 2연승으로 시리즈 승부의 균형을 맞추었다.배혜윤은 직전 경기까지 이번 시리즈에서 평균 7.7점으로 시즌 평균 득점에 미치지 못하는 모습을 보였으나, 이날 12점을 기록하며 팀 내 최다 득점을 올렸다. 또한 10리바운드(3블록슛)까지 더블더블을 달성하며 골 밑을 든든하게 지켰다. 배혜윤은 또 수비에서 상대 에이스 박혜진을 전담 마크하며 그의 활약을 3점으로 묶었다. 삼성생명에서는 조수아도 3점슛 2개를 포함해 11점을 기록하며 팀 승리에 힘을 보탰다.경기 초반 양팀 모두 전방 압박 수비로 맞서면서 저득점 양상 경기가 펼쳐졌다. 경기 시작 후 2분이 지나서야 조수아의 3점슛으로 첫 득점이 나왔다. 삼성생명은 1쿼터를 13-6으로 마무리...",8시간 전,https://www.khan.co.kr/article/202503092137035,경향신문
‘승리 본능’ 깨운 시범경기 구름 관중…올해도 ‘천만’ 보인다,https://img.khan.co.kr/news/c/190x140/2025/03/09/l_2025031001000201600022831.jpg,"지난 8일 시범경기가 열린 각 지역 기차역은 각 구단 유니폼을 입은 사람들로 북적였다. 프로야구 시범경기가 개막하자마자 ‘대히트’를 쳤다. 시범경기 첫날부터 구름 관중이 몰렸다.KBO는 이날 전국 5개 구장에 총 6만7264명의 관중이 입장했다고 발표했다. 13년 만에 시범경기가 열린 청주구장에는 한화-두산 경기를 보러 온 팬들로 9000석이 모두 매진됐다. 대구에서 열린 삼성-SSG 경기에는 무려 2만563명의 관중이 입장했다. 롯데-KIA의 경기가 열린 부산 사직구장에도 1만7352명의 팬이 찾았고, 수원구장에서 진행된 KT와 LG의 맞대결에도 1만3179명의 관중이 찾았다. NC와 키움의 경기가 펼쳐진 창원 NC파크에는 7170명의 관중이 두 팀을 응원했다.지난해 시범경기 개막 5경기 총관중(3만6180명)보다 두 배 가까이 늘었다.9일에는 관중이 더 늘었다. 대구는 2만3063석이 팬들로 가득 찼고 사직 경기도 1만7890명이 입장해...",8시간 전,https://www.khan.co.kr/article/202503092137025,경향신문
4경기 4골…‘황새’ 감독 만나 훨훨 나는 주민규,https://img.khan.co.kr/news/c/190x140/2025/03/09/l_2025031001000200100022811.jpg,"국가대표 골잡이 주민규(35·사진)는 마라토너 같았다. 빠르진 않았지만 누구보다 꾸준하고 한결같은 페이스로 골을 사냥했다. 이번 시즌은 조금 다르다. 녹빛 유니폼으로 갈아입은 뒤 스프린터처럼 폭발적인 스타트를 하고 있다.대전 하나시티즌은 지난 8일 대구FC 원정에서 주민규의 1골 1도움에 힘입어 2-1로 승리했다. 지난해 강등 위기로 몰렸던 대전은 4경기 만에 승점 9점(3승1패)을 쌓으면서 선두 경쟁에 뛰어들었다. 최전방 공격수로 나선 주민규는 직전 경기까지 무패를 자랑하던 대구의 수비를 무너뜨렸다. 주민규는 전반 6분 측면 수비수 박규현이 왼쪽 측면에서 연결한 공의 방향을 왼발로 바꾸면서 선제골을 넣더니 3분 뒤 최건주에게 매끄러운 패스를 연결해 결승골까지 도왔다.주민규는 현재 득점 4골로 1위, 골과 도움을 합친 공격 포인트도 5개로 1위다. 또 그날 경기에서 최고 활약을 펼친 선수에게 주는 경기 최우수선수(MOM)도 3회를 받아 단연...",8시간 전,https://www.khan.co.kr/article/202503092137015,경향신문
"‘135억’ 신지애, 통산 상금 1위…“일본 여자골프 역사 됐어요”",https://img.khan.co.kr/news/c/190x140/2025/03/09/l_2025031001000191400022721.jpg,"여자골프 전 세계 1위 신지애(37·사진)가 2025 일본여자프로골프(JLPGA) 투어 개막전에서 준우승하며 통산 상금 1위에 등극했다.신지애는 9일 일본 오키나와현 난조의 류큐GC(파72·6610야드)에서 열린 2025 JLPGA투어 시즌 개막전 다이킨 오키드 레이디스 골프 토너먼트(총상금 1억2000만엔·우승상금 2160만엔) 최종라운드에서 버디 5개, 보기 2개로 3언더파 69타를 쳤다. 합계 6언더파 282타를 기록한 신지애는 대회 2연패를 달성한 이와이 지사토(10언더파 278타·일본)에 4타 뒤진 공동 2위로 마쳤다. 선두와 2타 차로 최종라운드를 맞은 신지애는 이날 4번홀까지 버디 2개를 낚으며 단독 선두로 올라섰으나 이후 맹렬히 타수를 줄인 이와이에게 역전당했다. 막판 4홀을 남기고 공동 3위권에서 경쟁하던 신지애는 17번홀(파4)과 18번홀(파5)에서 연속 버디를 잡아내는 저력으로 준우승을 차지했다.지난 시즌까지 JLPGA투어 299개 대...",8시간 전,https://www.khan.co.kr/article/202503092137005,경향신문
“몇명 늘린다고 필수의료 안 살아…건강급여 체계 재설계해야”,https://img.khan.co.kr/news/c/190x140/2025/03/09/l_2025031001000188800022701.jpg,"병원 경영진 ‘돈 먹는 하마’ 인식에 최소 인력·최대 업무 감당의대 증원 필요하지만 전제조건일 뿐…몇명 늘어도 도움 안돼현장선 드라마보다 전율…후배들, 의사의 진짜 재미 알아주길2023년 서울아산병원에서 간호사가 뇌출혈로 쓰러진 뒤 숨졌다. 당시 이 병원은 ‘뇌졸중 적정성 평가 1등급 병원’이었다.의료진이 현장에 복귀하고 의대 정원이 늘면 ‘응급실 뺑뺑이’가 사라질까. 지난달 서울 서초동에서 만난 조항주 경기북부권역외상센터장(50)은 이 간호사의 안타까운 죽음을 사례로 들었다.“아산병원은 중증질환 전문의나 전공의들이 근무와 수련을 희망하는 1순위 병원이에요. 그런데도 이런 일이 생긴 데엔 여러 사정이 겹쳐 있습니다.”조 센터장은 2012년부터 소방청 응급의료헬기에 직접 탑승해 온 응급 전문의로, 소방청 버전의 ‘닥터헬기’ 시스템을 구축한 선구자 중 한 명이다. 2015년 경기북부권역외상센터장이 됐고, 지난해엔 대한외상학회 이사장으로 ...",8시간 전,https://www.khan.co.kr/article/202503092136045,경향신문
"정영두, ‘로런스 올리비에 상’ 후보로 선정",https://img.khan.co.kr/news/c/190x140/2025/03/09/l_2025031001000189900022691.jpg,"창극 <리어>의 정영두 연출(사진)이 로런스 올리비에 상 후보에 올랐다.주한영국문화원과 올리비에 상 홈페이지에 따르면, 정 연출은 지난해 10월 영국 바비칸센터에서 ‘K뮤직 페스티벌’ 개막작으로 선보인 <리어>로 ‘로런스 올리비에 상 2025’에서 ‘오페라 우수 성취’ 부문 후보가 됐다.영국의 대배우 로런스 올리비에의 이름을 딴 이 상은 영국 공연계 최고 권위의 상으로, 미국의 토니상에 비견된다. 올해 ‘오페라 우수 성취’ 부문에는 로열 오페라 하우스에서 공연한 <카르멘>에 출연한 러시아의 메조 소프라노 아이굴 아크메트시나, <페스텐>에 출연한 영국 테너 앨런 클레이턴도 후보에 올랐다.정영두의 <리어>는 윌리엄 셰익스피어의 원작을 창극으로 각색한 작품이다. 정영두가 연출과 안무, 배삼식이 극작, 한승석이 작창·음악감독, 정재일이 작곡을 맡았다.",8시간 전,https://www.khan.co.kr/article/202503092136035,경향신문
오늘의 부고 - 2025년 3월 10일,,"■김광식씨 별세, 영민 한국도로공사 홍보처 차장 부친상=9일 진주시민장례식장. 발인 11일 오전 6시30분 (055)762-4444■이현수씨 별세, 주용 한국예술종합학교 미술원 명예교수 부친상, 이인수 전 두산중공업 현장소장 장인상=9일 경기도의료원 수원병원. 발인 11일 오전 8시30분 (031)888-0114■양은석씨 별세, 허은씨 남편상, 양승국 연세의료원 시설관리팀 과장·승환씨 부친상= 9일 오전 10시17분 신촌세브란스병원. 발인 11일 오전 11시 (02)2227-7500",8시간 전,https://www.khan.co.kr/article/202503092136025,경향신문
오늘의 인사 - 2025년 3월 10일,,■국무조정실·국무총리비서실 ◇과·팀장급 전보 △국무조정실장 비서관 김성규 △규제심판운영팀장 김광제■중소벤처기업부 ◇국장급 승진 △글로벌성장정책관 일반직고위공무원 이순배 ◇과장급 전보 △소상공인정책과장 부이사관 윤석배 △혁신행정담당관 과학기술서기관 이정훈 △벤처투자과장 서기관 강신천 △특구정책과장 과학기술서기관 우경필 △소상공인판매활력촉진단장 과학기술서기관 이권재 △사업영역조정과장 서기관 이종택■기획재정부 ◇과장급 인사 △예산기준과장 정희철 △문화예산과장 정성원■외교부 △아세안국장 이동기 △조정기획관 문인석 △기획재정담당관 김종민■국토교통부 ◇국장급 전보 △토지정책관 박준형■과학기술정보통신부 ◇국장급 전보 △공공융합연구정책관 정택렬 △과학기술정책국장 강상욱 ◇과장급 전보 △디지털포용정책팀장 권오민■경찰청 ◇경무관 전보 △경찰청 치안정보심의관 정관호 △국정상황실 김찬수 △국무조정실 최은정 △APEC준비기획단장 어윤빈 △경찰대학 치안정책연구소장 ...,8시간 전,https://www.khan.co.kr/article/202503092136015,경향신문
HD현대 정기선 “한·미 동맹 바탕 조선 파트너로 함께할 것”,https://img.khan.co.kr/news/c/190x140/2025/03/09/l_2025031001000190500022651.jpg,"“한·미 동맹은 희생으로 맺어져 수십년 동안 강화됐고, 단순한 군사적 파트너십을 넘어 글로벌 안보의 한 축이 됐다. 도전 과제가 진화함에 따라 한·미 협력도 함께 진화해야 한다.”HD현대는 지난 7일(현지시간) 정기선 수석부회장(사진)이 미국 메릴랜드주 아나폴리스에 있는 미군 해군사관학교를 방문해 생도와의 환담에서 “대한민국은 미국의 굳건한 동맹국이자 신뢰할 수 있는 파트너로, 조선·해양 분야 혁신을 함께할 것”이라며 이같이 말했다고 9일 밝혔다.정 수석부회장은 선체 구조 강의 현장과 유체역학 연구실을 방문했다. 이 자리에서 정 수석부회장은 “HD현대는 인공지능(AI)에 기반한 자율운항, 디지털 첨단선박 분야에서 세계 최고의 기술력을 확보하고 있다”며 “세계 최정상급 이지스 구축함을 5척 건조해 대한민국 해군에 성공적으로 인도해 국가 안보 혁신을 뒷받침하고 있다”고 설명했다.정 수석부회장과 함께 방문한 정호선 전 해군참모총장은 “세계 1위의 조선 ...",8시간 전,https://www.khan.co.kr/article/202503092136005,경향신문
한양대 언정원 ‘손석희 특별 강연’,,한양대 언론정보대학원(원장 한동섭)은 오는 12일 오후 7시 한양대 사회과학관에서 손석희 전 JTBC 대표를 초청해 ‘디지털 시대의 저널리즘’을 주제로 특별 강연회를 개최한다.,8시간 전,https://www.khan.co.kr/article/202503092135005,경향신문
[포토뉴스] ‘AI 음성인식’ LG 휘센 에어컨…“봄바람 불어줘”,https://img.khan.co.kr/news/c/190x140/2025/03/09/l_2025031001000195600022621.jpg,9일 한 홍보모델이 LG 휘센 오브제컬렉션 타워I 에어컨의 ‘AI 음성인식’ 기능을 체험하고 있다. 최근 나온 신제품은 음성명령을 수행하는 수준을 넘어 사용자 의도를 파악하고 반응하는 공감형 인공지능(AI) 기술을 갖췄다.,9시간 전,https://www.khan.co.kr/article/202503092130045,경향신문
"BYD ‘아토3’ 한국서 ‘급제동’…제출 자료 부실, 보조금 ‘퇴짜’",,"중국 전기차 업체 BYD코리아가 ‘아토3’ 보조금을 받기 위해 정부에 관련 자료를 제출했으나 내용이 부실해 ‘퇴짜’를 맞은 것으로 확인됐다.BYD(비야디)는 국산 전기차보다 저렴한 2000만원대 중후반 가격으로 국내 시장을 공략한다는 포석이었다. 이를 위해서는 세제 혜택과 보조금 등을 받아야 한다. 그러나 차량 인도 시기조차 결정하지 못하는 등 주먹구구식 일처리로 사전 계약자들이 피해를 보고 있다.환경부 관계자는 9일 “해당 업체(BYD코리아)에서 전기차 국고 보조금 평가와 관련된 기초 자료를 내지 않고 있다가 지난달 28일 관련 자료를 제출했다”며 “하지만 자료가 부실해 보완해서 내라고 지시했다”고 밝혔다. 이 관계자는 “(제출하지 않았다는 지적이 이어지자) 부랴부랴 만들다 보니 내용이 부실해진 것 같다”고 덧붙였다.현재 아토3의 국내 판매가는 기본 모델이 3150만원, 플러스 모델이 3350만원으로 책정돼 있다. 여기에 세제 혜택이 주어지고, 정부와 ...",9시간 전,https://www.khan.co.kr/article/202503092130035,경향신문
"작년 한국 자동차 생산량, 세계 7위로 후퇴",,"지난해 한국의 자동차 생산이 멕시코에 밀리며 전년도 6위에서 7위로 떨어졌다.한국자동차모빌리티산업협회(KAMA)는 9일 배포한 ‘2024년 세계 자동차 생산 현황과 시사점’ 보고서에서 이같이 밝혔다.2024년 세계 자동차 생산은 전년 대비 0.5% 감소한 9395만대를 기록했다. 2020년 코로나19 팬데믹으로 인한 급감(-15.4%) 이후 처음으로 감소 전환한 것이다.자동차 생산 감소는 도요타·혼다 등 일부 업체의 품질 인증 부정 문제로 인한 일본 생산 부진(-8.5%)이 주요 원인으로 작용했다. 태국(-20.0%), 한국(-2.7%), 스페인(-3.0%) 등도 생산이 감소했다.국내 자동차 생산은 수출 증가(278만대, 0.6%)에도 내수 부진으로 전년 대비 2.7% 감소한 413만대를 기록했다. 중국·미국·일본·인도가 4년 연속 상위 4개국 자리를 유지했으며, 이들 생산은 글로벌 전체 자동차 생산의 59.7%를 차지했다.중국은 정부 주도...",9시간 전,https://www.khan.co.kr/article/202503092130025,경향신문
"금융 취약층 휴대폰 요금, 신용회복위에 ‘채무조정’ 신청하세요",,"40대 A씨는 뇌종양 발병 등 건강 악화로 정상적 경제활동이 어렵게 되자 신용회복위원회에 채무조정을 신청했다. 다행히 금융채무는 조정을 받았지만 통신요금 연체까지 해결하진 못했다. 본인 명의의 휴대전화를 사용하지 못하다 보니 구직활동이나 일상생활을 하기도 쉽지 않은 상황이다.이처럼 금융채무 조정만으로는 충분한 지원을 받기 어려운 이들을 위해 지난해 6월 ‘금융·통신 통합채무조정제도’가 도입됐다. 금융위원회는 제도 시행 이후 지난달까지 8개월간 총 2만9700명이 지원을 받았다고 9일 밝혔다.채무조정을 신청한 통신채무는 총 612억5000만원에 달했다. 이동통신 3사(496억6000만원)가 81%로 가장 많았다. 소액결제사는 17.8%(109억1000만원), 알뜰폰 회사는 1.1%(6억8000만원)를 차지했다.금융·통신 통합채무조정은 금융채무와 통신요금, 소액결제대금을 한 번에 조정해주는 제도다. 채무자가 갚을 수 있는 수준으로 채무를 감면하고, 최장 10...",9시간 전,https://www.khan.co.kr/article/202503092130015,경향신문
IBM “2029년 오류 스스로 잡는 양자컴퓨터 갖게 될 것”,,"“양자컴퓨터 상용화가 늦어질 거라는 회의론이 나오는 상황에서 저희가 할 수 있는 건 결과로 보여주는 것이라고 생각합니다.”미국 정보기술(IT) 기업 IBM에서 양자 기술 개발과 사업을 총괄하는 제이 감베타 부사장은 지난 7일 인천 연수구 연세대 국제캠퍼스에서 열린 기자간담회에서 이같이 말했다. 연세대는 지난해 11월 국내 최초로 실제 연구에 활용 가능한 수준의 127큐비트 양자컴퓨터 ‘IBM 퀀텀 시스템 원’을 도입했고, 이날 해당 컴퓨터가 있는 ‘연세퀀텀컴플렉스’ 개소식을 진행했다.감베타 부사장은 “2029년이 되면 우리 계획상 최초로 (스스로 오류를 바로잡는) 오류 내성을 갖춘 양자컴퓨터를 갖게 될 것”이라고 말했다. 이어 “앞으로 2~3년 안에 양자 우위를 입증하는 것이 중요한 목표”라고 했다. 양자 우위란 양자 컴퓨터가 현존하는 최고의 컴퓨터 성능을 뛰어넘는 것이다. ‘중첩’이나 ‘얽힘’ 같은 양자 현상을 활용하는 양자컴퓨터는 슈퍼컴퓨터보다 훨씬 빠르게 ...",9시간 전,https://www.khan.co.kr/article/202503092130005,경향신문
