title,thumbnail,short_content,write_time,link,company
구속기간 ‘시간’으로 계산한 법원…법조계 “왜 하필 윤석열부터”,https://img.khan.co.kr/news/c/190x140/2025/03/09/l_2025031001000197300023051.jpg,"내란 우두머리 혐의로 기소된 윤석열 대통령의 구속 기간을 엄격하게 판단해야 한다는 법원 결정을 두고 법조계에서 비판이 나왔다. 재판부는 피의자 신체의 자유를 거론하며 구속 기간은 최대한 보수적으로 산정해야 한다고 했지만, 전문가들은 최고 권력자가 형법상 가장 큰 죄를 저지른 사건에서 그간의 형사 실무를 갑자기 뒤집으며 인권에 집중한 법원 판단에 의문을 표했다.서울중앙지법 형사합의25부(재판장 지귀연)는 지난 7일 윤 대통령 측 구속 취소 요구를 인용하면서 “헌법과 형사소송법이 정한 신체의 자유, 불구속 수사의 원칙”을 거론했다. 이어 “(법조문을) 피의자에게 유리하도록 엄격하게 해석하는 것이 타당하다”고 했다.재판부는 피의자 구속 기간 10일을 셀 때 구속 전 피의자 심문(영장실질심사) 기간을 날짜 단위로 제외한 검찰의 계산법이 불합리하다고 봤다. 형사소송법에는 ‘피의자 심문을 하는 경우 법원이 구속영장청구서·수사관계 서류 및 증거물을 접수한 날부터 구속...",9시간 전,https://www.khan.co.kr/article/202503092049005,경향신문
즉시항고 포기한 검찰…‘총장 출신 대통령 봐주기’ 비판 자초,https://img.khan.co.kr/news/c/190x140/2025/03/09/l_2025031001000207500022061.jpg,"검찰이 법원의 구속 취소 결정에 즉시항고를 하지 않고 윤석열 대통령을 석방했다. “구속 취소에 대한 검사의 즉시항고권은 정당하다”고 밝혀온 그간의 입장과 자신들의 수사 관행을 뒤집었다. 상급심 판단을 구할 기회를 스스로 걷어차면서 직무유기라는 비판과 함께 ‘검찰총장 출신 대통령 봐주기’ 비판을 자초했다는 지적이 나온다.9일 경향신문 취재를 종합하면 심우정 검찰총장을 주축으로 한 대검찰청 간부들과 비상계엄 특별수사본부(특수본)는 약 27시간 동안 윤 대통령 석방 여부를 놓고 수차례 의견을 주고받았다. 특수본 수사팀이 “법원 결정에 불복하고 즉시항고를 해야 한다”고 반발했지만, 최종 결론은 간부들의 의견대로 ‘석방’으로 결정됐다.대검은 “법원의 구속 취소 결정을 존중해 특수본에 윤 대통령의 석방을 지휘했다”고 밝혔다. 이어 “구속 기간 산정 등에 대한 법원의 판단은 현행 법률 규정은 물론 오랜 기간 법원과 검찰에서 형성해온 실무례에도 부합하지 아니하는 부당한...",9시간 전,https://www.khan.co.kr/article/202503092047015,경향신문
[김용민의 그림마당] 2025년 3월 10일,https://img.khan.co.kr/news/c/190x140/2025/03/09/l_2025031001000217600022041.jpg,,9시간 전,https://www.khan.co.kr/article/202503092047005,경향신문
"외신 “윤 지지자 결집, 사회 분열 심화될 듯…판사 압박도 우려”",,법원의 구속 취소 결정과 검찰의 즉시항고 포기로 윤석열 대통령이 지난 8일 석방되자 외신들도 이 소식을 신속히 타전했다.뉴욕타임스(NYT)는 “윤 대통령은 구치소에서 나오면서 주먹을 쥐는 승리의 몸짓을 했고 그의 이름을 외치는 지지자들에게 인사했다”며 “이번 석방은 12·3 비상계엄 선포와 관련해 제기된 내란 혐의 재판이나 탄핵사건 심리에 영향을 미치지 않는다. 다만 그가 자유로운 상태로 재판을 받게 된다는 뜻”이라고 보도했다.NYT는 “윤 대통령에게 비판적인 사람들은 석방된 윤 대통령이 나라를 분열시키는 극단적인 언어로 지지자를 결집하고 본인 사건을 심리하는 판사들에게 압력을 가할 것을 우려하고 있다”고 덧붙였다.워싱턴포스트는 “법률 전문가들은 윤 대통령의 석방이 그의 형사사건이나 탄핵사건 심리에 아무런 영향을 미치지 않는다고 말한다”면서 “그러나 그가 갑작스럽게 석방된 것은 그의 지지자들을 고무시키고 진보 및 보수 세력 간 정치적 분열을 심화시킬 가능...,9시간 전,https://www.khan.co.kr/article/202503092044015,경향신문
"“윤, 파면되는 그날까지 광장 지킬 것”…다시 거리서 밤새운 ‘키세스 시민들’",https://img.khan.co.kr/news/c/190x140/2025/03/09/l_2025031001000190200022021.jpg,"서울 도심에 ‘키세스 시민들’이 다시 등장했다. 봄이 됐지만 아직 싸늘한 9일 아침, 밤을 지새운 시민들이 추위에도 아랑곳하지 않고 분노를 토해냈다. 전날 윤석열 대통령이 석방되며 철야 집회에 나선 ‘탄핵 촉구’ 시민들이다. 또다시 거리에서 밤을 새우게 된 이들은 “파면될 때까지 광장을 지키겠다” “지치기보다는 화가 난다”고 말했다.이날 오전 6시20분쯤 서울 종로구 광화문 서십자각 터에 자리 잡은 ‘윤석열 즉각퇴진·사회대개혁비상행동’(비상행동) 농성 천막 주변에는 시민 30여명이 은박 담요를 두르고 모여 있었다. 윤 대통령이 풀려나며 비상행동 측은 전날부터 철야 단식농성에 들어갔다. 그러자 시민들도 광장에 모였다. 시민들은 익숙한 듯 무선 난로·침낭·핫팩 등을 챙겨 나왔다. 오전 7시가 되자 ‘아파트’ ‘다시 만난 세계’ 등 노래에 맞춰 춤을 추거나 컵라면을 나눠 먹으며 졸음을 쫓기도 했다.시민들은 윤 대통령의 석방 소식에 분통을 터트렸다. 전날 낮부터...",9시간 전,https://www.khan.co.kr/article/202503092044005,경향신문
“다시 ‘내란 불면증’에 시달릴 수 없다”,https://img.khan.co.kr/news/c/190x140/2025/03/09/l_2025031001000215100023091.jpg,윤석열 대통령이 석방되자 ‘탄핵 촉구’ 시민들이 다시 거리로 나왔다. 시민들은 “형법상 가장 무거운 죄인 내란죄 피의자가 어떻게 석방되나”라며 격앙된 반응을 보였다. 시민단체들은 단식농성에 나섰고 윤 대통령을 석방하라고 지휘한 심우정 검찰총장을 고발했다. 시민들은 남태령·한강진에 이어 또다시 철야 집회에 나서며 “탄핵이 될 때까지 광장을 지키겠다”고 말했다. ‘윤석열즉각퇴진·사회대개혁 비상행동’(비상행동)은 9일 경찰청 국가수사본부 앞에서 기자회견을 열고 “심우정 총장을 직권남용죄로 고발한다”고 밝혔다. 윤복남 비상행동 공동의장은 “시민·노동자는 쉽게 구속 수사를 하던 검찰이 윤 대통령에 대해서만 인권친화적 결정을 내렸다”며 “수사팀이 아무리 열심히 일하고 올바른 판단을 하려고 해도 총장이 잘못된 지휘를 하면 검찰은 잘못된 길로 갈 수밖에 없다”고 말했다.윤 대통령 석방 소식을 들은 시민들은 전날부터 서울 광화문 일대에서 철야농성을 하는 등 집회를 재개했...,9시간 전,https://www.khan.co.kr/article/202503092039025,경향신문
환자도 의료계도 불만…‘의대 정원 회귀’ 후폭풍,,"의대생 수업 복귀를 전제로 2026학년도 의대 모집 정원을 2000명 증원 이전인 3058명으로 되돌리겠다는 정부 발표의 후폭풍이 거세다. 정부는 의·정 갈등 수습을 위해 ‘의료개혁 후퇴’라는 비판을 감수하고 고육책을 내놓았지만 시민사회는 물론 의료계에서도 비판이 팽배하다. 시민사회는 정부가 또다시 의사 집단의 버티기에 ‘백기’를 들면서 지난 1년간 시민들의 불편과 희생이 ‘무의미’해졌다고 비판한다. 반면 의료계는 의대 증원은 실패한 정책이었다는 게 판명됐다며 이 정책을 추진한 인사들에 대한 문책을 요구하고 있다.경제정의실천시민연합(경실련)은 9일 입장문을 내고 “의대 증원은 국민의 생명과 안전을 지키기 위한 중대한 정책으로, 정부가 의대생 복귀를 위해 함부로 번복할 사안이 아니다”라며 정원 회귀 철회를 요구했다. 경실련은 “정부는 언제까지 의사와 의대생의 집단행동에 질질 끌려다닐 것인가”라고 했다. 전국보건의료산업노동조합은 “24·25학번 의대생에 대해 한꺼번...",9시간 전,https://www.khan.co.kr/article/202503092039015,경향신문
"윤, 석방 후에도 통합·사과 메시지 대신 지지자 선동",,"윤석열 대통령이 법원의 구속 취소 결정과 검찰의 즉시항고 포기로 지난 8일 서울구치소에서 석방됐다. 윤 대통령은 석방 후 자신을 위해 행동에 나섰던 국민들만 선별해 감사를 표시하고, 법원 난입·폭력 사태 수감자들의 석방을 요구하는 것으로 해석되는 메시지를 내놓았다. 현 사태를 초래한 데 대한 진심 어린 사과와 탄핵 찬반 세력을 아우르는 국민통합 메시지는 없었다. 지지자 선동만 있는 메시지에 야당에선 “대통령이 아니라 극우세력 골목대장”이란 비판이 나왔다.윤 대통령은 석방 후 법률대리인단을 통해 내놓은 415자 분량의 입장문에서 “불법을 바로잡아준 중앙지법 재판부의 용기와 결단에 감사드린다”고 밝혔다. 고위공직자범죄수사처(공수처)는 내란죄 수사권이 없어 자신에 대한 수사와 구속이 불법이라는 기존 주장을 되풀이했다.윤 대통령은 또 현재 구속된 내란죄 공범들을 “대통령의 헌법상 권한에 따라 공직자로서 맡은 바 임무를 수행하다가 고초를 겪고 계신 분들”로 표현하며 그들...",9시간 전,https://www.khan.co.kr/article/202503092039005,경향신문
"대기만 1700명, 1분당 글 90여개···헌재 게시판 접속 폭주",https://img.khan.co.kr/news/c/190x140/2025/03/09/news-p.v1.20250309.495ca2f18d8b459fac09595352a76781_P1.png,윤석열 대통령이 석방되고 헌법재판소 탄핵심판 결정이 임박하자 헌재 홈페이지에 접속이 폭주하고 있다. 자유게시판에 글을 쓰기 위해서는 1700명이 넘는 대기 순서를 기다려야 할 정도다.9일 오후 헌재 홈페이지 자유게시판에 글을 남기기 위해 ‘등록’ 버튼을 누르면 “현재 접속자가 많아 서비스 접속 대기 중”이라는 안내 문구가 나왔다. 이날 오후 8시 기준 대기 순번은 한때 1700번이 넘어가기도 했다.다른 때보다도 접속자가 폭주한 데에는 윤 대통령의 석방과 헌재 탄핵심판이 임박한 점이 원인이 된 것으로 보인다. 실제 윤 대통령이 석방된 전날부터 탄핵을 찬성하는 사람들이 대통령 탄핵을 촉구하는 글을 남기기 시작하자 이에 반대해 탄핵에 반대하는 윤 대통령 지지자들이 몰리고 있었다. 게시판에는 ‘윤석열 파면 촉구’ 글과 ‘불법 탄핵 반대’하는 글이 번갈아가며 올라오고 있다.이연희 더불어민주당 국회의원은 이날 오전 사회관계망서비스(SNS)에 “헌재 자유게시판이 미치광이들의 글...,9시간 전,https://www.khan.co.kr/article/202503092035001,경향신문
"미국, 이라크에 이란산 전기 수입 불허",https://img.khan.co.kr/news/c/190x140/2025/03/09/ams.V01.personimage.KHN.P.20230927.20230927000210_P1.jpg,"미국이 이라크에 이란산 전기 수입을 허용하지 않기로 했다고 AFP통신이 9일(현지시간) 보도했다.주이라크 미국 대사관은 미 국무부가 전날 이란산 에너지 수출입 제재와 관련해 이라크에 부여했던 제재 면제 혜택을 갱신하지 않았다고 이날 밝혔다. 대사관은 “이는 이란에 대한 경제적, 재정적 (제재) 완화를 허용하지 않겠다는 것”이라고 설명했다.이번 조치는 도널드 트럼프 미국 행정부가 선언한 대이란 강경책과 관련 있는 것으로 보인다. 트럼프 정부는 이란 핵무기 개발을 막는다는 이유로 이란에 강력한 경제 제재를 부과하는 ‘최대 압박’ 정책을 펴겠다고 밝힌 바 있다.이라크는 석유와 가스 매장량이 상당한데도 에너지 수요를 맞추기 위해 수입에 의존하고 있다. 이라크는 가스·전기 수요의 3분의 1을 이란산으로 충당하고 있다.AFP는 주이라크 미 대사관이 이란산 가스 수입에 대해서는 언급하지 않았다고 전했다.",10시간 전,https://www.khan.co.kr/article/202503092024001,경향신문
"[사설]윤석열 석방, 헌재는 조기 파면해 이 혼란 종식해야",https://img.khan.co.kr/news/c/190x140/2025/03/09/news-p.v1.20250309.987121098f3e4ab796a1c6dc15eb5d64_P1.jpeg,"대통령 윤석열이 지난 8일 서울구치소에서 석방됐다. 내란 우두머리 혐의로 구속된 지 52일 만에 구속기소 절차에 위법적 요소가 있다는 법원 결정으로 풀려난 것이다. 그는 “불법을 바로잡아준 재판부 결단”에 감사하고, “대통령의 헌법상 권한에 따라 공무를 수행하다 고초를 겪는 분들의 석방”을 기원했다. 군경을 앞세워 헌법을 유린한 12·3 비상계엄을 여전히 합법이고 공무라 한 것이다. 그 후안무치에 말문이 막히고 분노를 금할 수 없다.윤석열은 구치소를 걸어나오면서 지지자들 앞에서, 관저로 이동하는 차 안에서 주먹을 쥐어 보였다. 별도로 낸 석방 입장문에서는 “응원해준 국민들과 미래세대들에게 감사하다” 했고, 그가 일으킨 내란 중요 종사자들과 헌법재판소를 압박하며 단식 중인 국민의힘 의원의 안위를 걱정했다. 내란 수괴 석방에 낙담하고 다시 불안해진 국민은 안중에 없고, 사과 한마디 없었다. 한때 대통령직에 있었던 자가 오로지 지지층만 챙기며, 국론 분열을 이어간 것이다. 그는 구...",10시간 전,https://www.khan.co.kr/article/202503092006001,경향신문
‘남편·남친이 웃는’ 여성정책?···‘여성의날’ 기념해 제작했다는 경기도,https://img.khan.co.kr/news/c/190x140/2025/03/09/news-p.v1.20250309.36efd765b8024449824c2c8e39f47239_P1.png,"경기도가 지난 8일 세계여성의 날을 맞아 SNS(사회관계망서비스)에 성인지 감수성이 떨어지는 홍보 포스터를 올렸다가 비판을 받고 삭제했다.9일 경기도에 따르면 경기도는 지난 8일 공식 SNS에 “취·창업, 임신·출산, 노동환경 개선 등 다양한 분야에서 경기도민 모두가 웃을 수 있는 정책을 소개하겠다”며 4장의 포스터를 올렸다.경기도가 소개한 정책은 임신 사전건강관리지원, 여성 1인가구 안심패키지 보급, 경기도 산후조리비 지원 사업 등이었다.경기도는 이 같은 정책을 소개하며 각 포스터에 “아빠가 웃는 여성정책” “남친이 웃는 여성정책” “남편이 웃는 여성정책” 등의 글을 덧붙였다. 경기도의 포스터에는 모두 여성은 작게 표현돼 있고 웃는 남성의 모습만이 강조됐다.누리꾼들은 경기도의 게시물을 보고 강하게 비판했다. 여성의날에 ‘여성’은 사라지고 오히려 여성을 수동적인 존재로 묘사했다는 것이었다.경기도의 SNS에는 “남편이, 아빠가, 오빠가 허락해야 즐길수있는 여성...",10시간 전,https://www.khan.co.kr/article/202503091940001,경향신문
‘잠·삼·대·청 토허제 해제’ 후폭풍 진화 나선 서울시 “실거래가 큰 변화없어”,https://img.khan.co.kr/news/c/190x140/2025/03/09/news-p.v1.20250309.50f72676fe8346b8af3601b7f732e261_P1.jpg,"서울 잠·삼·대·청(송파구 잠실동, 강남구 삼성·대치·청담동) 지역의 토지거래허가구역 해제 후 집값이 오르고 있다는 비판이 일자 서울시가 실거래 분석 결과를 공개하며 진화에 나섰다. 토허제 해제 후 강남 주요 단지에서 신고가가 속출하며 부동산 시장에서 ‘오쏘공’(오세훈 서울시장이 쏘아올린 공)이라는 말까지 나오자 적극 해명에 나선 것이다.시는 9일 설명자료를 통해 잠실·삼성·대치·청담 토허제 해제 전후 22일간 실거래 데이터를 분석한 자료를 공개했다. 여러 논란에도 불구하고 실제 거래량이나 가격 상승은 크지 않다는 취지다.시 집계를 보면 전체 아파트 거래량은 해제 전 78건에서 해제 후 87건으로 9건 증가했다. 중형 아파트(전용면적 84㎡)의 경우 거래량은 해제 전 35건에서 해제 후 36건으로 1건 늘었다.평균 매매가격은 26억9000만원에서 27억1000만원으로 2000만원 올랐다. 서울시는 “신속대응반을 가동하여 현장 점검한 결과 집값 상승 기대심리를 반영해...",11시간 전,https://www.khan.co.kr/article/202503091921001,경향신문
"세계 여성의 날, 대만에서 일본군 ‘위안부’ 다룬 공동 학술서적 출판 기념회",https://img.khan.co.kr/news/c/190x140/2025/03/09/news-p.v1.20250309.bba046710b214751bfad47875cd2e26d_P1.jpg,"세계 여성의 날인 8일 대만에서 동아시아 학자들이 공동 집필한 일본군 ‘위안부’ 문제를 다룬 서적의 출판 기념회가 열렸다.9일 연합신문망 등에 따르면 대만여성구조기금회(TWRF)와 대만일본종합연구소는 전날 타이베이의 TWRF 사무소에서 <초월국경 : 일본제국의 위안부에 대한 책임에 대한 추궁을 영원히 포기하지 않겠다>는 서적의 출판 기념회를 열었다.TRWF에 따르면 책은 ‘위안부’ 의제에 관해 대만, 한국, 일본, 중국 등의 학자들이 공동으로 집필한 첫 학술 전문 서적이다. 책은 인권에 방점을 두고 역사적 정의를 촉구해야 한다는 관점에서 제2차 세계대전 당시 일본제국이 설치한 ‘위안소’ 제도에 대한 논의, 법률 분석, 현지 조사, 생존자의 구술 기록을 담았다고 전했다.책의 수석 기획자 양멍저 타이베이교육대학 교수는 “대만은 동아시아 역사의 교차점에 있다”면서 “이 책은 중국, 한국, 일본, 대만의 학자들이 ‘국경을 초월한’ 관점에서 위안부 문제를 탐구해 대화...",11시간 전,https://www.khan.co.kr/article/202503091846001,경향신문
"[사설] 내란 수괴 풀어준 ‘심우정 검찰’, 엄중히 심판해야",https://img.khan.co.kr/news/c/190x140/2025/03/09/news-p.v1.20250309.1a7df505272346d6abc6f27396b88bb8_P1.jpeg,"검찰이 대통령 윤석열을 석방했다. 경찰과 고위공직자범죄수사처가 간난신고 끝에 구속한 내란 수괴를 검찰이 이렇게 쉽게 풀어줘도 되는가. 주권자가 위임한 권한을 오용하고 내란의 공범임을 자처한 ‘심우정 검찰’을 강력히 규탄한다.구속기간 만료 후 기소가 이뤄져 위법하다는 법원 결정이 있었지만, 기소권을 독점한 검찰이 이에 대해 항고를 포기한 것은 별개의 문제다. 윤석열이 풀려나면서 내란 주범은 불구속, 내란 종범들은 구속 상태에서 재판받는 어처구니없는 일도 일어났다.윤석열은 체포·구속 과정에서 증거를 인멸하고 공권력에 저항했다. 헌법재판소 탄핵심판 과정에서는 부하들에게 책임을 떠넘기고 내내 거짓말을 했다. 대통령의 품격을 잃은 법꾸라지가 수감되자 시민들은 그나마 안도했다. 그런데 법원은 절차적 하자를 이유로 윤석열 주장에 손을 들어주고, 검찰은 기다렸다는 듯 윤석열을 풀어줬다. 건전한 법 상식을 가진 시민으로선 마른하늘에 날벼락이 아닐 수 없다. 그 누구도 아닌 내란 주범의...",11시간 전,https://www.khan.co.kr/article/202503091841001,경향신문
"[사설]주거니 받거니 여야 ‘감세 경쟁’, 나라 재정은 안 보이나",https://img.khan.co.kr/news/c/190x140/2025/03/09/news-p.v1.20250307.3f1381f857f94c9e81a5b8bef416d517_P1.jpeg,"여야가 배우자에 대한 상속세 전면 폐지에 동의했다. 더불어민주당이 현재 5억원인 자녀·배우자 공제액 한도를 8억·10억원으로 각각 확대하는 상속세제 개편안을 내놓고 국민의힘이 배우자 상속세 폐지로 맞대응하자, 이재명 민주당 대표가 지난 7일 “이번(3월 임시국회)에 처리하자”고 화답한 것이다. 조기 대선이 유력해지자, 여야가 주거니 받거니 감세 경쟁에 나선 모양새다.1950년 제정된 배우자 상속세는 개편 논란이 이어져왔다. 세대 내 재산 이전이고 ‘이혼 때는 비과세, 상속 때는 과세’하는 문제가 제기됐다. 하지만 국내 상속증여세 부과는 해마다 사망자의 5% 안팎에 그치고, 누진세 성격상 극소수 거액 자산가들이 대부분을 부담한다. 여기에 국민의힘은 현행 50%인 상속세 최고세율과 가업상속세도 내리자고 주장한다. 여당과 정부는 상속세 부과 방식도 유산 총액에 매기는 현행 유산세에서 상속인이 물려받은 유산을 기준 삼는 유산취득세로 변경하자는 입장이다. 하나 받고 다시 얹는 ...",11시간 전,https://www.khan.co.kr/article/202503091834001,경향신문
“또 상식 밖 일이” 허리끈 고쳐매는 시민들···“왜 다시 ‘내란 불면증’에 떨어야 하나”,https://img.khan.co.kr/news/c/190x140/2025/03/09/news-p.v1.20250308.8b389bb4d2ae465abfaca176441192c7_P1.jpeg,윤석열 대통령이 석방되자 ‘탄핵 촉구’ 시민들이 다시 거리로 나왔다. 시민들은 “형법상 가장 무거운 죄인 내란죄 피의자가 어떻게 석방되나”며 격앙된 반응을 보였다. 시민단체들은 단식 농성에 나섰고 윤 대통령을 석방하라고 지휘한 심우정 검찰총장을 고발했다. 시민들은 남태령·한강진에 이어 또다시 철야 집회에 나서며 “탄핵이 될 때까지 광장을 지키겠다”고 말했다.윤 대통령 석방에 야유 쏟아진 광화문‘윤석열즉각퇴진·사회대개혁 비상행동’(비상행동)은 9일 경찰청 국가수사본부 앞에서 기자회견을 열고 “심우정 총장을 직권남용죄로 고발한다”고 밝혔다. 윤복남 비상행동 공동의장은 “시민·노동자는 쉽게 구속수사를 하던 검찰이 윤 대통령에 대해서만 인권친화적 결정을 내렸다”며 “수사팀이 아무리 열심히 일하고 올바른 판단을 하려고 해도 총장이 잘못된 지휘를 하면 검찰은 잘못된 길로 갈 수밖에 없다”고 말했다.윤 대통령 석방 소식을 들은 시민들은 전날부터 다시 서울 광화문 일대에서 집회를 재...,12시간 전,https://www.khan.co.kr/article/202503091818001,경향신문
[여적] 트럼프의 ‘직거래 외교’,https://img.khan.co.kr/news/c/190x140/2025/03/09/news-p.v1.20250309.b695baac41d0406d9a3ca7fd35842086_P1.jpeg,"도널드 트럼프 미국 대통령을 보는 눈은 다면적이다. 막말 잘하고 허세에 찌든 정치인이란 비판과 영리하고 계산이 치밀한 사람이란 평가가 뒤섞인다. 예측이 힘들고, 냉온탕을 오가는 말이나 행동의 맥락을 가늠하기 어렵다는 뜻이다. 하지만, 이익을 위해선 수단과 방법을 가리지 않는 인물이란 데는 견해가 일치한다.집권 2기 트럼프의 외교 정책에서는 이런 특징이 잘 드러난다. 그에겐 ‘내 편, 네 편’은 없고 오로지 ‘거래’만 있다. 그동안 미국이 지켜온 보편적 가치·규범 존중이나 동맹과의 협력은 뒷전으로 밀렸다. 이로 인해 서방의 단일대오는 흔들리기 시작했다. 전쟁 당사국인 우크라이나를 배제한 채 러시아와 직거래 담판을 시작한 것 역시 트럼프식 외교의 대표적 단면이다.그 직거래는 중동에서도 이어졌다. 교착 상태인 가자지구 휴전 2단계 진입 협상에 이스라엘이 전격 참석한다. 10일 카타르 도하에서 열리는 가자 정전회담에 이스라엘도 대표단을 파견해 인질 송환, 인도적 지원 재개 등...",12시간 전,https://www.khan.co.kr/article/202503091815001,경향신문
