title,thumbnail,short_content,write_time,link,company
"“저항권 있으니 경찰 체포” 탄핵 선고 앞 난동 모의…경찰, 헌재 주변 철통 경비 태세",https://flexible.img.hani.co.kr/flexible/normal/300/180/imgdb/original/2025/0307/20250307503012.webp,"윤석열 대통령 탄핵 재판 선고가 다가오면서 윤석열 대통령을 지지하는 극우세력 사이에서 “국민저항권을 발동하자”, “경찰도 현행범으로 체포가 가능하다”는 극단적 주장이 나오고 있다. 경찰은 대비를 위해 갑호비상을 발동하거나 경찰 특공대 투입 등의 방안을 검토하고 있다. ...",2025-03-08 06:00,https://www.hani.co.kr/arti/society/society_general/1185950.html,한겨레
윤석열 구속 취소 이후…탄핵·형사재판 어떻게 될까,https://flexible.img.hani.co.kr/flexible/normal/300/180/imgdb/original/2025/0307/20250307503010.webp,법원이 내란 우두머리 혐의를 받는 윤석열 대통령의 구속취소 신청을 인용한 가운데 이르면 다음주로 전망되는 탄핵 심판 결과와 향후 형사재판에 어떤 영향을 미칠지 주목된다. 막바지 평의 중인 탄핵 재판과 달리 이제 막 시작해야 하는 형사 재판에는 이번 구속 취소가 의미 있...,2025-03-08 05:00,https://www.hani.co.kr/arti/society/society_general/1185949.html,한겨레
"법원, 김재규 재심까지 들며 ‘윤석열 구속 취소’ 설명",https://flexible.img.hani.co.kr/flexible/normal/300/180/imgdb/original/2025/0307/20250307503007.webp,법원이 윤석열 대통령 구속을 취소한 사유는 크게 두 가지다. 구속기간이 지나고 난 뒤에 기소가 됐기에 ‘불법 구금’이 발생한데다 고위공직자범죄수사처(공수처)의 내란죄 수사권 논란 등 수사 과정의 적법성 의문을 재판 초기에 해소해야 한다는 판단이다. 재판부는 이런 논란을...,2025-03-08 05:00,https://www.hani.co.kr/arti/society/society_general/1185948.html,한겨레
"연세대, 리가켐바이오와 양자컴퓨팅 기반 신약 개발 업무협약 체결",https://flexible.img.hani.co.kr/flexible/normal/300/180/imgdb/original/2025/0308/4717413630491792.webp,연세대학교(총장 윤동섭)는 주식회사 리가켐바이오(이하 리가켐)와 3월 6일 연세대학교 국제캠퍼스 양자컴퓨팅센터에서 ‘양자컴퓨팅을 활용한 바이오의약품 개발’을 위한 업무협약(MOU)을 체결했다. 이번 협약을 통해 양 기관은 첨단 양자컴퓨팅 기술을 기반으로 신약 개발 연구...,2025-03-08 00:57,https://www.hani.co.kr/arti/economy/biznews/1185947.html,한겨레
"명지대, 교육국제화역량 인증대학 11년 연속 선정",https://flexible.img.hani.co.kr/flexible/normal/300/180/imgdb/original/2025/0308/5917413627246157.webp,"명지대(총장 임연수)가 교육부가 주관하는 ‘2024년 교육국제화역량인증제(IEQAS, International Education Quality Assurance System) 평가’에서 인증대학으로 선정되며 2014년부터 11년 연속 인증을 유지했다.교육국제화역량인증제...",2025-03-08 00:52,https://www.hani.co.kr/arti/economy/biznews/1185946.html,한겨레
"연세대 제7회 글로벌지속가능발전포럼(GEEF 2025) 개최, SDGs 달성을 위한 혁신적 해결책 제시",https://flexible.img.hani.co.kr/flexible/normal/300/180/imgdb/original/2025/0308/2717413621671583.webp,"연세대학교(총장 윤동섭)는 오는 3월 13일부터 14일까지 ‘제7회 글로벌지속가능발전포럼(GEEF 2025)’을 개최한다. 이번 포럼은 ‘Time for Action: Bridging Divides for a Sustainable Future’라는 대주제 아래, 지속가...",2025-03-08 00:43,https://www.hani.co.kr/arti/economy/biznews/1185945.html,한겨레
몇 달째 빙글빙글? 어지럼증 오래가면 ‘위험 신호’ [건강한겨레],https://flexible.img.hani.co.kr/flexible/normal/300/180/imgdb/original/2025/0307/20250307503004.webp,"최근 어지럼증을 호소하는 사람들이 늘면서 이에 대한 관심도 커지고 있다. 하지만 몇 개월, 길게는 몇 년간 이어지는 만성 어지럼증의 원인과 치료법에 대한 정확한 정보는 여전히 부족하다.어지럼증이 만성화되는 원인을 찾으려면 먼저 우리 몸이 균형을 어떻게 유지하는지를 이해...",2025-03-08 00:00,https://www.hani.co.kr/arti/hanihealth/healthlife/1185944.html,한겨레
‘계엄 옹호’ 독일 공영방송에 독일 언론도 비판,https://flexible.img.hani.co.kr/flexible/normal/300/180/imgdb/child/2025/0307/53_17413560653644_20250307502073.webp,윤석열 대통령의 비상계엄 선포와 부정선거 음모론을 옹호했다는 논란이 제기된 독일 공영방송의 다큐멘터리와 관련해 독일 언론에서도 비판의 목소리가 나오고 있다.6일(현지시각) 독일의 외교·국제 전문매체 디플로뉴스는 ‘한국에 관한 극도로 편향된 다큐멘터리가 항의 폭풍을 일으...,2025-03-07 22:56,https://www.hani.co.kr/arti/international/europe/1185943.html,한겨레
삼성생명 벼랑 끝 1승…여자프로농구 PO 승부는 4차전으로,https://flexible.img.hani.co.kr/flexible/normal/300/180/imgdb/child/2025/0307/53_17413547250817_20250307502981.webp,벼랑 끝에서 시원하게 반격했다.용인 삼성생명이 7일 경기 용인체육관에서 열린 2024~2025 여자프로농구(WKBL) 플레이오프 3차전에서 비엔케이를 66-50으로 물리쳤다. 삼성생명은 2패 뒤 1승을 챙기고 플레이오프(5전3선승제)를 4차전으로 끌고 갔다. 4차전은 ...,2025-03-07 22:35,https://www.hani.co.kr/arti/sports/basketball/1185942.html,한겨레
"7위 GS칼텍스, 6위 페퍼저축은행에 풀세트 접전 끝 승리",https://flexible.img.hani.co.kr/flexible/normal/300/180/imgdb/child/2025/0307/53_17413521233212_20250307502956.webp,‘꼴찌만은 안 된다’는 집념으로 무장한 6위와 7위 간 혈투는 풀세트 접전 끝에 GS칼텍스의 승리로 마무리됐다.GS칼텍스는 7일 서울 장충체육관에서 열린 2024∼2025 V리그 6라운드 페퍼저축은행과 맞대결에서 세트 점수 3-2(20:25/25:17/25:20/21:...,2025-03-07 21:54,https://www.hani.co.kr/arti/sports/volleyball/1185941.html,한겨레
“석방이 웬말” 시민들 ‘윤석열 구속 취소’에 다시 거리로,https://flexible.img.hani.co.kr/flexible/normal/300/180/imgdb/child/2025/0307/53_17413512072877_20250307502938.webp,“윤석열 대통령은 이미 증거인멸을 여러번 시도해왔습니다. 그가 구속된 것도 바로 그런 이유가 인정됐기 때문입니다. 서울중앙지법은 도대체 무슨 근거로 구속 취소란 결정을 내린 겁니까?”(은평구 주민 신민섭씨)7일 저녁 7시30분께 서울 광화문 서십자각 터. 법원이 윤 대...,2025-03-07 21:25,https://www.hani.co.kr/arti/society/society_general/1185940.html,한겨레
‘계엄 옹호 다큐’ 독일 방송에서 퇴출…누리집서도 삭제,https://flexible.img.hani.co.kr/flexible/normal/300/180/imgdb/child/2025/0307/53_17413493373361_7717412376352834.webp,한국의 위헌적인 비상계엄 사태 및 극우 집단의 부정선거 음모론을 옹호했다는 평가를 받는 독일 방송의 다큐멘터리가 홈페이지에서 삭제되는 등 완전 퇴출됐다.독일 공영방송 아에르데(ARD)와 체트데에프(ZDF)가 운영하는 티브이 채널 ‘푀닉스’는 7일 ‘인사이드 코리아-중국...,2025-03-07 21:05,https://www.hani.co.kr/arti/international/international_general/1185939.html,한겨레
"양대노총 “복지부, 국민연금 결산보고 때 노동계 패싱”",https://flexible.img.hani.co.kr/flexible/normal/300/180/imgdb/child/2025/0307/53_17413477124813_20250307502900.webp,양대노총이 7일 “보건복지부는 국민연금기금운용 절차상 하자를 인정하고 공식 사과하라”고 밝혔다.민주노총과 한국노총은 이날 공동 성명을 내어 “보건복지부가 2024년 국민연금기금의 결산보고 절차를 지키지 않았다”며 “실무평가위원회를 대면이 아닌 서면심의를 통해 진행한 이...,2025-03-07 20:15,https://www.hani.co.kr/arti/society/labor/1185938.html,한겨레
정부 ‘백기’에도…의대생·전공의 “학생 협박…해결된 것 없어”,https://flexible.img.hani.co.kr/flexible/normal/300/180/imgdb/child/2025/0307/53_17413417781244_20250307502861.webp,의대생과 전공의 대표가 의대생 전원의 3월 복귀를 조건으로 내년도 의대 모집인원을 3058명으로 복원하겠단 정부의 방침을 강하게 비판했다.이선우 대한의과대학·의학전문대학원 학생협회 비상대책위원장은 7일 입장문을 내어 “2026학년도 모집인원 3058명 발표로 총장들도 ...,2025-03-07 18:58,https://www.hani.co.kr/arti/society/health/1185937.html,한겨레
국민연금 “홈플러스 투자금 3천억 회수…투자조건 변경 없어”,https://flexible.img.hani.co.kr/flexible/normal/300/180/imgdb/child/2025/0307/53_17413408056468_20250307502843.webp,"국민연금이 기업회생 절차가 진행 중인 홈플러스 투자금 가운데 3천억원을 회수했다고 7일 밝혔다.국민연금은 “국민연금은 2015년 홈플러스 상환전환우선주(RCPS)와 보통주 등에 6121억원을 투자했으며, 현재까지 리파이낸싱과 배당금 수령을 통해 상환전환우선주 3131억...",2025-03-07 18:46,https://www.hani.co.kr/arti/economy/finance/1185936.html,한겨레
"국힘, ‘특혜 채용’ 선관위 특별감사관법 당론 발의",https://flexible.img.hani.co.kr/flexible/normal/300/180/imgdb/child/2025/0307/53_17413411663375_20250307502841.webp,국민의힘이 ‘고위직 자녀 특혜 채용’이 불거진 중앙선거관리위원회를 겨냥해 당론으로 ‘선관위 특별감사관법’을 발의했다.국민의힘은 7일 ‘선관위 특별감사 실시와 국민 신뢰 회복을 위한 특별감사관 임명 등에 관한 법률안’을 국회 본관 의안과에 제출했다. 국민의힘 의원 108...,2025-03-07 18:45,https://www.hani.co.kr/arti/politics/politics_general/1185935.html,한겨레
"[사설] 납득할 수 없는 ‘윤석열 구속취소’ 결정, 검찰은 즉시항고해야",https://flexible.img.hani.co.kr/flexible/normal/300/180/imgdb/child/2025/0307/53_17413406760394_20250307502839.webp,법원이 7일 내란 우두머리 혐의로 구속기소된 윤석열 대통령의 구속취소 신청을 받아들였다. 대통령 관저를 봉쇄하고 극렬히 저항하던 윤 대통령을 체포·구속하는 과정에서 국가 전체가 더없는 혼란을 겪은 상황에서 구속을 취소해야 한다는 법원 결정이 나온 데 깊은 우려를 금할 ...,2025-03-07 18:42,https://www.hani.co.kr/arti/opinion/editorial/1185934.html,한겨레
"“화교”라더니 “대판사, 구국 영웅”…극우 ‘감탄고토’",https://flexible.img.hani.co.kr/flexible/normal/300/180/imgdb/child/2025/0307/53_17413407035461_20250307502836.webp,"7일 서울중앙지법 형사합의25부(재판장 지귀연)가 윤석열 대통령에 대한 구속 취소를 결정한 가운데, 지귀연 부장판사가 “화교 출신”이라며 음모론을 퍼뜨리던 극우 보수 진영에서 이젠 “애국판사 지귀연”, “구국의 영웅”이라며 그를 추켜세우고 있다.앞서 윤 대통령의 형사 ...",2025-03-07 18:40,https://www.hani.co.kr/arti/society/society_general/1185933.html,한겨레
3월8일 궂긴 소식,,"◆ 정창근(소설가·한겨레 창간주주)씨 별세: 이복남씨 남편, 희숙 희연씨 부친=6일 오후 4시 전주 뉴타운장례식장. 발인 9일 오전 11시30분. (063)278-4444. ◆ 이경재(전 연합통신 사진부장)씨 별세: 이민자씨 남편, 범진(한울소재과학 부사장) 선민씨 부...",2025-03-07 18:32,https://www.hani.co.kr/arti/society/obituary/1185932.html,한겨레
3월8일 인사,,⊙ 국가인권위원회 △교육협력심의관 송호섭 ⊙ 기획재정부 △예산기준과장 정희철 △문화예산〃 정성원 ⊙ 과학기술정보통신부 ◇국장급 △공공융합연구정책관 정택렬 △과학기술정책국장 강상욱 ◇과장급 △디지털포용정책팀장 권오민 ⊙ 외교부 △아세안국장 이동기 △조정기획관 문인석 ...,2025-03-07 18:31,https://www.hani.co.kr/arti/society/internalmove/1185931.html,한겨레
침팬지·보노보의 생식기 접촉은 긴장 해소 위한 ‘사회적’ 행동,https://flexible.img.hani.co.kr/flexible/normal/300/180/imgdb/child/2025/0307/53_17413405663122_20240415503086.webp,"사람의 성행위는 생식만을 목적으로 하지 않는 경우가 많다. 이러한 비생식적 성행위를 연구자들은 ‘사회적 성 행동’으로 해석하는데, 다양한 문화권에서 사회적 성 행동은 다른 사람과의 신뢰를 형성하고 사회적 유대를 강화하며 스트레스를 줄이고 대인 관계를 향상한다고 한다. ...",2025-03-07 18:24,https://www.hani.co.kr/arti/animalpeople/wild_animal/1185930.html,한겨레
"법원, 영풍·MBK 손 들어줘…고려아연 임시주총 효력 정지",https://flexible.img.hani.co.kr/flexible/normal/300/180/imgdb/child/2025/0307/53_17413395258976_20250307502788.webp,법원이 지난 1월 고려아연 임시 주주총회에서 통과된 안건 중 집중투표제 도입을 제외한 나머지 안건의 효력을 모두 정지했다. 최윤범 고려아연 회장과 경영권 분쟁 중인 영풍·엠비케이(MBK)파트너스 연합 쪽의 손을 들어준 것이다.서울중앙지방법원 민사합의50부(재판장 김상훈...,2025-03-07 18:20,https://www.hani.co.kr/arti/economy/economy_general/1185929.html,한겨레
SPC계열 평택공장서 또 안전사고…50대 손가락 절단 ‘중상’,https://flexible.img.hani.co.kr/flexible/normal/300/180/imgdb/child/2025/0307/53_17413393461423_20250307502782.webp,"노동자들의 잇단 안전사고로 입길에 오르고 있는 에스피시(SPC)의 계열사 공장에서 또 다시 작업을 하던 노동자가 손가락이 잘리는 사고가 일어난 사실이 뒤늦게 확인됐다.7일 경기도 평택경찰서의 말을 종합하면, 지난 1월22일 오전 6시10분께 경기도 평택시 에스피엘(SP...",2025-03-07 18:18,https://www.hani.co.kr/arti/area/capital/1185928.html,한겨레
‘윤석열 구속 취소’에 한남동은…“애국시민 승리” vs “구속 촉구”,https://flexible.img.hani.co.kr/flexible/normal/300/180/imgdb/child/2025/0307/53_17413389513362_20250307502769.webp,법원에서 윤석열 대통령에 대한 구속 취소를 결정했다는 소식에 윤 대통령 지지자들이 한남동 관저 앞으로 모여들었다. 이들은 “애국시민이 만들어낸 결과물”이라며 “우리가 이겼다”는 구호를 연신 외쳤다.7일 오후 4시께 서울 용산구 한남동 윤 대통령 관저 앞에서 윤 대통령 ...,2025-03-07 18:14,https://www.hani.co.kr/arti/society/society_general/1185927.html,한겨레
트럼프 보고 있나…25년 전 ‘광고 스타’ 재등장해 “난 캐나다인!”,https://flexible.img.hani.co.kr/flexible/normal/300/180/imgdb/child/2025/0307/53_17413388677095_20250307502761.webp,“나는 캐나다인이다!”(I am Canadian!)2000년 캐나다를 달궜던 캐나다 맥주 광고 속 남성이 25년 만에 다시 등장해 캐나다인들의 관심이 쏠리고 있다. 이번에는 맥주를 팔기 위해서가 아니라 캐나다를 대놓고 조롱하고 업신여기는 도널드 트럼프 미국 대통령에 대...,2025-03-07 18:14,https://www.hani.co.kr/arti/international/america/1185926.html,한겨레
이재명 ‘배우자 상속세 폐지’에…“섣부른 부자 감세” 안팎 우려,https://flexible.img.hani.co.kr/flexible/normal/300/180/imgdb/child/2025/0307/53_17413388016767_20250307502748.webp,"이재명 더불어민주당 대표가 국민의힘이 주장하는 ‘배우자 상속세 폐지’를 수용하겠다고 밝혔다. 상속세 배우자 공제액을 상향하는 기존의 민주당 안에서 한 단계 더 나아간 것으로, 국민의힘이 ‘전면 폐지’로 대응하자 ‘전격 수용’으로 맞불을 놓은 것이다. 그러나 당 안팎에서...",2025-03-07 18:10,https://www.hani.co.kr/arti/politics/assembly/1185925.html,한겨레
"[사설] 감세 경쟁 몰두하는 여야, 세입확충 방안은 왜 안 내놓나",https://flexible.img.hani.co.kr/flexible/normal/300/180/imgdb/child/2025/0307/53_17413402274234_20250307502733.webp,조기 대선이 확실시되자 여야가 선거전략의 일환으로 감세 경쟁에 몰두하고 있다. 급기야는 배우자에 대한 상속세 완전 폐지에 여야가 모두 동의하는 상황에까지 이르렀다. 하지만 윤석열 정부의 감세정책으로 세수 기반이 허물어진 상태에서 세수 확충 방안에 대해서는 여야 모두 한...,2025-03-07 18:05,https://www.hani.co.kr/arti/opinion/editorial/1185924.html,한겨레
이재명 “검찰 산수 잘못했다고 윤석열 헌정파괴 안 없어져”,https://flexible.img.hani.co.kr/flexible/normal/300/180/imgdb/child/2025/0307/53_17413384140258_20250307502729.webp,이재명 더불어민주당 대표가 7일 윤석열 대통령의 ‘구속취소’ 청구를 법원이 인용한 것과 관련해 “검찰이 초보적 산수를 잘못했다고 해서 윤석열 대통령이 위헌적인 군사쿠데타를 해서 헌정 질서를 파괴했다는 명백한 사실이 없어지진 않는다”고 밝혔다.이 대표는 이날 국회에서 기...,2025-03-07 18:05,https://www.hani.co.kr/arti/politics/politics_general/1185923.html,한겨레
"[사설] 경찰 손들어준 영장심의위, 김성훈·이광우 구속 수사하라",https://flexible.img.hani.co.kr/flexible/normal/300/180/imgdb/child/2025/0307/53_17413382770732_20250307502724.webp,서울고검 영장심의위원회가 지난 6일 대통령경호처 김성훈 차장 등에 대한 구속 수사가 필요하다고 결론 냈다. 앞서 서울서부지검이 경찰이 신청한 구속영장을 세 차례나 기각한 것이 얼마나 부당한지 보여주는 결정이다. 김 차장은 12·3 내란의 핵심 증거인 비화폰 정보의 삭제...,2025-03-07 18:03,https://www.hani.co.kr/arti/opinion/editorial/1185922.html,한겨레
"법조계·학계 “윤석열 구속취소, 탄핵심판에 영향 없을 것”",https://flexible.img.hani.co.kr/flexible/normal/300/180/imgdb/child/2025/0307/53_17413378700042_20250307502713.webp,법원이 내란 우두머리 혐의를 받는 윤석열 대통령의 구속취소 신청을 인용한 가운데 내주로 전망되는 탄핵심판 결과에도 영향을 미칠지 주목된다.7일 법원은 윤 대통령 쪽이 지난달 4일 제기한 구속취소 청구를 인용하며 구속기간은 날이 아닌 실제 시간으로 계산하는 것이 타당하다...,2025-03-07 17:57,https://www.hani.co.kr/arti/society/society_general/1185921.html,한겨레
정부 ‘백기’에도…의대생 복귀·향후 증원은 ‘안갯속’,https://flexible.img.hani.co.kr/flexible/normal/300/180/imgdb/child/2025/0307/53_17413379162038_20250307502708.webp,"정부가 2026학년도 의대 모집인원을 증원 이전 수준으로 되돌렸지만, 이를 계기로 의-정 갈등이 해소될지는 ‘안갯 속’이다. 갈등의 핵심인 의대생·전공의(인턴·레지던트)들이 교육·수련 현장으로 돌아올지 불투명한 데다, 2027학년도부터의 정원을 두고도 의-정이 다시 부...",2025-03-07 17:55,https://www.hani.co.kr/arti/society/health/1185920.html,한겨레
“윤석열 대통령 만세” 유인물 뿌리며 분신한 80대 남성 중태,https://flexible.img.hani.co.kr/flexible/normal/300/180/imgdb/child/2025/0307/53_17413375589485_20250307502694.webp,서울 중구의 한 건물 옥상에서 윤석열 대통령의 지지자로 추정되는 남성이 분신을 시도해 병원으로 옮겨졌다.서울 중부소방서와 남대문경찰서의 설명을 들어보면 7일 윤 대통령의 지지자로 추정되는 80대 남성 ㄱ씨가 오전 11시58분께 서울 중구 도시건축전시관 옥상에서 분신했다...,2025-03-07 17:51,https://www.hani.co.kr/arti/society/society_general/1185919.html,한겨레
‘윤석열 구속기간 계산법’ 집중분석…법원 판단은 ‘깔끔하게 털고 가자’,https://flexible.img.hani.co.kr/flexible/normal/300/180/imgdb/child/2025/0307/53_17413360301164_20250307502612.webp,"내란 우두머리 혐의를 받는 윤석열 대통령 구속 취소 결정이 나왔다. 법원은 검찰이 구속 기간 ‘시간 계산’을 잘못했으며, 이런 논란을 안고 형사재판을 진행할 경우 재판 결과에도 영향을 줄 수 있다고 판단했다. 다만 고위공직자범죄수사처(공수처)의 내란죄 수사와 구속 자체...",2025-03-07 17:22,https://www.hani.co.kr/arti/politics/politics_general/1185918.html,한겨레
"‘여성 연대의 장미’, 동덕여대부터 한국옵티칼 고공농성장까지",https://flexible.img.hani.co.kr/flexible/normal/300/180/imgdb/child/2025/0307/53_17413359153721_20250307502605.webp,"“여성의날 기념 장미꽃 한 송이씩 받아가세요.”3·8 세계여성의날을 하루 앞둔 7일, 한국여성의전화 활동가들이 서울 성북구 동덕여자대학교 정문 앞에서 바삐 등교하는 학생들의 발걸음을 멈춰 세우고 주황색 장미꽃을 내밀었다. 장미꽃을 건네받은 학생들이 옅은 미소로 화답했다...",2025-03-07 17:19,https://www.hani.co.kr/arti/society/women/1185917.html,한겨레
시민사회 “윤석열 구속 취소 안일한 판단…검찰 즉시항고 해야”,https://flexible.img.hani.co.kr/flexible/normal/300/180/imgdb/original/2025/0307/20250307502591.webp,"법원이 7일 내란 우두머리 혐의로 기소된 윤석열 대통령의 구속취소를 결정하자 시민사회는 ‘안일한 판단을 내렸다’며 검찰에 즉시항고를 촉구했다. 검찰은 석방 뒤 즉시항고, 구속 상태에서의 즉시항고 하는 방안을 모두 검토 중이다.참여연대는 이날 성명에서 “지금까지의 선례 ...",2025-03-07 17:15,https://www.hani.co.kr/arti/society/society_general/1185916.html,한겨레
긴급의총 마친 민주 “윤석열 구속 취소 유감…검찰 즉시 항고해야”,https://flexible.img.hani.co.kr/flexible/normal/300/180/imgdb/child/2025/0307/53_17413353815944_20250307502585.webp,박찬대 더불어민주당 원내대표가 7일 윤석열 대통령의 ‘구속취소’ 청구를 법원이 인용한 것과 관련해 “내란수괴 윤석열에 대한 구속취소 청구를 받아들인 것에 유감을 표한다”고 밝혔다.박 원내대표는 이날 국회에서 긴급 의원총회를 정회한 후 기자들과 만나 이렇게 말한 뒤 “검...,2025-03-07 17:14,https://www.hani.co.kr/arti/politics/politics_general/1185915.html,한겨레
[Column] Why Korean parents just can’t quit private education for their kids,https://flexible.img.hani.co.kr/flexible/normal/300/180/imgdb/original/2025/0307/2217413343273013.webp,"By Hwang Bo-yon, editorial writerComedian Lee Soo-ji’s parody videos of the “Daechi mom” stereotype have gone viral, racking up millions of views. Wea...",2025-03-07 17:07,https://www.hani.co.kr/arti/english_edition/e_editorial/1185914.html,한겨레
‘윤석열 구속 취소’ 재판부 “공수처 수사권 논란 놔두면 재심 사유”,https://flexible.img.hani.co.kr/flexible/normal/300/180/imgdb/child/2025/0307/53_17413348980785_20250307502528.webp,"법원이 윤석열 대통령 구속 취소를 결정하면서 그 사유의 하나로 고위공직자범죄수사처(공수처)의 내란죄 수사권 논란을 거론했다. 재판부는 “(공수처 수사권 등에 대한) 논란을 그대로 두고 형사재판 절차를 진행하는 경우 상급심에서의 파기 사유는 물론, 한참 시간이 지난 후에...",2025-03-07 17:03,https://www.hani.co.kr/arti/society/society_general/1185913.html,한겨레
‘I thought war’: Local Koreans shaken by military’s accidental bombing of village,https://flexible.img.hani.co.kr/flexible/normal/300/180/imgdb/original/2025/0307/2517413343473166.webp,"“If it had been flying any lower, it would have hit us. We’re too scared to even step foot outside,” said Cho Seong-gyun, aged 31, holding out a fragm...",2025-03-07 17:01,https://www.hani.co.kr/arti/english_edition/e_national/1185912.html,한겨레
"After a year of standoff, government relents on plan to raise med school admission cap",https://flexible.img.hani.co.kr/flexible/normal/300/180/imgdb/original/2025/0307/1317413341953412.webp,The Korean government appears to have essentially raised the white flag to medical students as it becomes increasingly likely that it will revert the ...,2025-03-07 16:58,https://www.hani.co.kr/arti/english_edition/e_national/1185911.html,한겨레
German documentary slammed for ‘distorted’ depiction of Korea’s martial law crisis,https://flexible.img.hani.co.kr/flexible/normal/300/180/imgdb/original/2025/0307/3917413340532586.webp,A controversial documentary on Korea’s political situation after December’s martial law debacle aired by German broadcasters is coming under fire for ...,2025-03-07 16:55,https://www.hani.co.kr/arti/english_edition/e_national/1185910.html,한겨레
