title,thumbnail,short_content,write_time,link,company
한국옵티칼 노동자 425일째 최장기 고공농성…우원식 “죄송”,https://flexible.img.hani.co.kr/flexible/normal/300/180/imgdb/child/2025/0307/53_17413260700754_20250307502000.webp,"고용 승계를 외치며 하늘로 오른 한국옵티칼하이테크 해고 노동자들이 7일로 425일째 여성 노동자로서 최장기 고공농성을 이어가는 가운데, 우원식 국회의장이 “아직 문제를 해결하지 못해 죄송하다. 함께 이 문제를 해결해 나가자”고 말했다.우원식 국회의장은 이날 서울 영등포...",2025-03-07 14:39,https://www.hani.co.kr/arti/society/labor/1185869.html,한겨레
박지원 “하늘 무너져…검찰 계산된 착오 의심”,https://flexible.img.hani.co.kr/flexible/normal/300/180/imgdb/child/2025/0307/53_17413259500068_20250307501990.webp,"윤석열 대통령의 구속이 7일 취소되자 박지원 더불어민주당 의원이 “하늘이 무너진다”라고 말했다.박 의원은 이날 페이스북에 “오호 통제라. 내란수괴 윤석열이 법원에 의해 구속 취소라니 하늘이 무너진다”라면서 “검찰이 기소하며 구속기일 시간과 날짜를 혼돈, 착오로 이런 사...",2025-03-07 14:38,https://www.hani.co.kr/arti/politics/politics_general/1185868.html,한겨레
"경찰, 하늘양 살해 교사 체포해 대면조사 시작…“다음주 송치”",https://flexible.img.hani.co.kr/flexible/normal/300/180/imgdb/child/2025/0307/53_17413259910924_20250307501992.webp,경찰이 지난달 10일 학교에서 8살 김하늘(8)양을 살해한 교사 ㄱ씨에 대한 체포영장을 집행하고 피의자 대면조사에 들어갔다. 사건 발생 25일 만이다.대전 서부경찰서 전담수사팀은 7일 “이날 오전 9시49분께 피의자 ㄱ씨에 대한 체포영장을 집행해 조사 중”이라고 밝혔다...,2025-03-07 14:38,https://www.hani.co.kr/arti/area/chungcheong/1185867.html,한겨레
"국민대 김영훈 교수, 고균일 페로브스카이트 나노발광체 대량 합성 기술 관련 논문 SCI학술지 게재",,"국민대학교(총장 정승렬) 과학기술대학 응용화학부 나노소재 전공 김영훈 교수, 김지건 연구원 및 한양대학교 화학공학과 고민재 교수 연구팀이 최근 SCI 국제학술지 ‘Advanced Composites and Hybrid Materials’ 최신호에 ‘SN2-mediate...",2025-03-07 14:18,https://www.hani.co.kr/arti/economy/biznews/1185865.html,한겨레
"개인정보위, ‘개인정보 논란’ 중국 전기차 BYD 실태점검",https://flexible.img.hani.co.kr/flexible/normal/300/180/imgdb/child/2025/0307/53_17413246410306_20250307501876.webp,"개인정보보호위원회가 중국 전기차 업체 비야디(BYD) 등 개인정보 유출 우려가 불거진 주요 스마트자동차 업체의 개인정보 처리방침에 대해 실태점검을 실시한다.개인정보위는 7일 비야디코리아 쪽에 관련 사실 내용을 문의했으며, 회사 쪽은 “개인정보 처리방침과 이용자 매뉴얼 ...",2025-03-07 14:16,https://www.hani.co.kr/arti/economy/it/1185864.html,한겨레
"이마에 ‘검은 십자가’ 긋고 TV 나온 미국 국무장관, 왜?",https://flexible.img.hani.co.kr/flexible/normal/300/180/imgdb/child/2025/0307/53_17413246073261_20250307501872.webp,마코 루비오 미국 국무부 장관이 이마에 ‘검은 십자가’를 그린 채 티브이(TV) 뉴스에 출연했다.루비오 장관은 지난 5일(현지시각) 미국 폭스뉴스와 인터뷰하면서 이마에 검은색 십자가를 그리고 나왔다. 이날 인터뷰에서 루비오 장관은 러시아 우크라이나 전쟁을 종식하고자 하...,2025-03-07 14:15,https://www.hani.co.kr/arti/international/international_general/1185863.html,한겨레
"서울과학기술대학교, ‘에너지신기술융합학과’ 신설 및 입학식 성황리 개최",https://flexible.img.hani.co.kr/flexible/normal/300/180/imgdb/original/2025/0307/171741324380455.webp,"□ 서울과학기술대학교(총장 김동환, 이하 서울과기대) 창의융합대학이 3월 7일(금) 오전 서울 공릉동 서울과기대 테크노큐브동에서 2025년 신규 개설된 학사과정 계약학과인 에너지신기술융합학과 1기 입학생들의 입학식을 성황리에 개최하였다.□ ‘에너지신기술융합학과 1기 입...",2025-03-07 14:13,https://www.hani.co.kr/arti/economy/biznews/1185862.html,한겨레
"‘조기대선 승부처’ 중도층, 정권 교체·이재명 지지 굳어지나",https://flexible.img.hani.co.kr/flexible/normal/300/180/imgdb/child/2025/0307/53_17413241994179_20250307501844.webp,"조기 대선이 치러질 경우 야당 후보가 당선(정권 교체)돼야 한다는 응답이 52%, 여당 후보가 당선(정권 유지)돼야 한다는 응답이 37%가 나왔다. 7일 나온 한국갤럽 정기 여론조사 결과다. 1월14∼16일 조사 때는 정권 교체 48%, 정권 유지 40%였다. 8%포인...",2025-03-07 14:06,https://www.hani.co.kr/arti/politics/politics_general/1185861.html,한겨레
"법원, 윤석열 구속 취소 청구 인용",https://flexible.img.hani.co.kr/flexible/normal/300/180/imgdb/child/2025/0307/53_17413273786371_20250307502103.webp,"법원이 내란 우두머리 혐의를 받는 윤석열 대통령의 구속취소 신청을 인용했다.서울중앙지법 형사합의25부(재판장 지귀연)는 7일 윤 대통령 쪽이 지난 달 4일 제기한 구속취소 청구를 인용했다. 구속취소는 구속의 사유가 없거나 소멸될 때 검사, 피고인, 변호인 등이 법원에 ...",2025-03-07 14:01,https://www.hani.co.kr/arti/society/society_general/1185860.html,한겨레
이주호 “내년도 의대 모집인원 3058명…3월 내 전원 복귀 조건”,https://flexible.img.hani.co.kr/flexible/normal/300/180/imgdb/child/2025/0307/53_17413237591325_20250307501815.webp,"정부가 의대생 전원의 3월내 복귀를 조건으로 2026학년도 의대 모집 인원을 3058명으로 하겠다고 밝혔다.7일 오후 이주호 부총리 겸 교육부 장관은 의과대학 선진화를 위한 총장협의회(의총협), 한국의과대학·의학전문대학원협회(KAMC)와 정부서울청사에서 ‘학생 복귀 및...",2025-03-07 14:00,https://www.hani.co.kr/arti/society/schooling/1185859.html,한겨레
"‘황금돼지띠’ 고3, 의대 정원 동결에 수험생도 많아 “나 어떡해”",https://flexible.img.hani.co.kr/flexible/normal/300/180/imgdb/child/2025/0307/53_17413238149903_20250307501817.webp,정부가 내년도 의대 모집 인원을 증원 이전인 ‘3058명’으로 되돌린 가운데 ‘황금돼지띠’인 고교 3학년 수험생에 대한 안타까움이 나온다. 의대 모집 인원이 2024학년도 수준으로 다시 돌아가는 데다 고교 3학년 수험생 수가 전년에 비해 4만7천명가량 많아 대입 경쟁률...,2025-03-07 14:00,https://www.hani.co.kr/arti/society/schooling/1185858.html,한겨레
"한국, 2월 선박수주 점유율 14% 세계 2위…중국 65% 1위",https://flexible.img.hani.co.kr/flexible/normal/300/180/imgdb/child/2025/0307/53_17413236530413_20250307501804.webp,"올해 2월 글로벌 선박 수주 점유율은 한국이 14%로 중국에 이어 2위를 차지한 것으로 나타났다.7일 영국의 조선·해운시황 분석기관 클락슨리서치 통계를 보면, 지난달 전 세계 선박 수주량은 207만CGT(표준선환산톤수·선박 건조 난이도를 고려한 환산 톤수)로 전년 동월...",2025-03-07 13:58,https://www.hani.co.kr/arti/economy/marketing/1185857.html,한겨레
신한은행 직원이 3년간 17억원 횡령,https://flexible.img.hani.co.kr/flexible/normal/300/180/imgdb/child/2025/0307/53_17413234891914_20250307501792.webp,신한은행에서 17억원 규모의 금융사고가 발생했다.신한은행은 2021년 말부터 지난해 7월 초까지 약 3년 간 17억원 규모의 횡령 사고가 발생했다고 7일 공시했다. 서울 강남지역의 한 지점에서 근무하던 직원이 거래업체의 명의를 도용해 서류를 위조하고 돈을 빼돌린 것으로...,2025-03-07 13:55,https://www.hani.co.kr/arti/economy/finance/1185856.html,한겨레
전국 6개 공항 위험 방위각 시설 개선 착수…실시설계 입찰 공고,https://flexible.img.hani.co.kr/flexible/normal/300/180/imgdb/child/2025/0307/53_17413232860509_20250307501784.webp,"정부가 무안국제공항 등 전국 6개 공항에서 항공 안전을 위협할 수 있는 방위각 시설(로컬라이저) 기초대 개선 작업에 본격 나선다.국토교통부와 한국공항공사는 7일부터 오는 17일까지 무안, 여수, 김해, 사천, 광주, 포항경주공항 등 6개 공항의 방위각 시설 개선 사업 ...",2025-03-07 13:54,https://www.hani.co.kr/arti/economy/economy_general/1185855.html,한겨레
뉴진스만 추모 리본 다르다 했더니…“하이브가 리본 착용 반대”,https://flexible.img.hani.co.kr/flexible/normal/300/180/imgdb/child/2025/0307/53_17413230462648_20250307501765.webp,"지난해 12월 발생한 제주항공 참사 때 하이브 쪽이 뉴진스(NJZ)의 추모 리본 착용을 방해했다는 주장이 제기됐다.뉴진스 쪽 법률대리인 법무법인 세종이 7일 어도어의 뉴진스 활동금지 가처분 등에 대한 심문기일에 제출한 변론 자료를 보면, 제주항공 참사 다음날인 지난해 ...",2025-03-07 13:48,https://www.hani.co.kr/arti/culture/culture_general/1185854.html,한겨레
30년 안에 ‘난카이 대지진’ 가능성…‘피난처 충분’ 지자체 절반 안 돼,https://flexible.img.hani.co.kr/flexible/normal/300/180/imgdb/child/2025/0307/53_17413228718083_20250307501762.webp,"향후 30년 이내 규모 8∼9 대지진 발생 가능성이 있는 일본 서남부 ‘난카이 해곡 대지진’이 현실화하면 인근 피난 대상 주민이 67만여명에 이른다는 추산이 나왔다. 2011년 3·11 대지진을 웃도는 규모지만, 해당 지방자치단체 가운데 절반 이상은 피난처가 충분치 않...",2025-03-07 13:47,https://www.hani.co.kr/arti/international/international_general/1185853.html,한겨레
"용인대학교, 경기콘텐츠진흥원과 업무협약 체결",https://flexible.img.hani.co.kr/flexible/normal/300/180/imgdb/original/2025/0307/1217413252042317.webp,"용인대학교(총장 한진수)와 경기콘텐츠진흥원(원장 탁용석)은 지난 5일 용인대학교 총장 접견실에서 업무협약을 체결했다.이날 협약식에는 한진수 총장을 비롯해 경기콘텐츠진흥원 탁용석 원장, 이문택 본부장, 박관재 매니저, 남수정 교무처장, 문화예술대학 한민형 학장, AI바이...",2025-03-07 13:47,https://www.hani.co.kr/arti/economy/biznews/1185852.html,한겨레
인천에서 서울을 걷다…개항의 역사 간직한 ‘경인가로’,https://flexible.img.hani.co.kr/flexible/normal/300/180/imgdb/child/2025/0307/53_17413221907458_20250307501730.webp,"한국을 방문하는 외국 여행객이 가장 먼저 밟게 되는 도시는 인천이다. 대부분의 여행객이 인천국제공항을 통해 한국에 입국하기 때문이다. 관문 도시라는 인천의 역사는 개항 이후부터 지금까지 이어졌다. 과거 인천항에 내린 선교사, 여행객들은 어떻게 서울을 향했을까? 6일 그...",2025-03-07 13:30,https://www.hani.co.kr/arti/area/capital/1185851.html,한겨레
"[포토] 고공농성 425일째!…“한국옵티칼 고용승계, 국회가 나서라”",https://flexible.img.hani.co.kr/flexible/normal/300/180/imgdb/child/2025/0307/53_17413218809859_20250307501716.webp,"“내일모레면 대한민국은 또 하나의 세계 신기록 보유국이 됩니다. 2014년 파인텍의 홍기탁, 박준호의 426일을 옵티칼의 박정혜, 소현숙이 넘어서는 날짜. 처참하고 참담한 기록. 제 눈엔 보이는 사람들이 정치인들의 눈에는 안보입니까. 땅에서 외치다 외치다 높...",2025-03-07 13:25,https://www.hani.co.kr/arti/society/society_general/1185850.html,한겨레
