title,thumbnail,short_content,write_time,link,company
"South Korean fighter jets mistakenly bomb village during drill, injuring over a dozen",https://flexible.img.hani.co.kr/flexible/normal/300/180/imgdb/original/2025/0307/341741333827763.webp,"Korean fighter jets dropped eight bombs on a civilian area, injuring 15 civilians, during joint military exercises with the US on Thursday. The Korean...",2025-03-07 16:52,https://www.hani.co.kr/arti/english_edition/e_national/1185909.html,한겨레
10년 만에 또 회생절차 삼부토건…거래 재개 직후 ‘하한가’,https://flexible.img.hani.co.kr/flexible/normal/300/180/imgdb/child/2025/0307/53_17413336636018_20250307502480.webp,10년 만에 다시 회생절차를 밟게 된 삼부토건이 유가증권시장에서 거래가 재개된 직후 곧장 하한가를 기록했다.7일 삼부토건은 직전 거래일인 지난달 24일(918원)보다 29.96% 급락한 643원으로 시작해 같은 가격으로 거래를 마감했다. 장 초반 한때 20%...,2025-03-07 16:44,https://www.hani.co.kr/arti/economy/finance/1185908.html,한겨레
김동연 “포천 오폭 피해 마을 특별재난지역 지정해야”,https://flexible.img.hani.co.kr/flexible/normal/300/180/imgdb/child/2025/0307/53_17413334880423_20250307502462.webp,김동연 경기지사가 공군 전투기 오폭으로 피해를 입은 마을에 대한 특별재난지역 선포를 정부에 요청했다.김 지사는 7일 오후 2시께 경기도 포천시 이동면 노곡리 오폭 사고 현장을 찾아 소방당국과 군 관계자 등의 브리핑을 듣고 고기동 행정안전부 차관을 만나 “요건이 충족되지...,2025-03-07 16:40,https://www.hani.co.kr/arti/area/capital/1185907.html,한겨레
"외교부·해수부·해군, 거제 앞바다서 ‘해적 대응’ 훈련",https://flexible.img.hani.co.kr/flexible/normal/300/180/imgdb/child/2025/0307/53_17413332881361_20250307502458.webp,"외교부·해양수산부·해군이 7일 경남 거제시 인근 해역에서 ‘청해부대 제45진 민·관·군 해적대응 합동해상훈련’을 실시했다. 이번 훈련은 해외 파병을 앞둔 청해부대 제45진(문무대왕함)의 임무 수행 능력을 점검하고, 민간 선박 피랍 상황에서의 대응 체계를 강화하기 위해 ...",2025-03-07 16:39,https://www.hani.co.kr/arti/politics/diplomacy/1185906.html,한겨레
배우자 상속세 폐지 논란…“초부유층만 유리” vs “함께 일군 재산”,https://flexible.img.hani.co.kr/flexible/normal/300/180/imgdb/child/2025/0307/53_17413329217606_20250307502442.webp,더불어민주당이 국민의힘의 배우자 상속세 폐지 제안을 수용하겠다고 밝히면서 고액 자산가 감세 혜택에 동조하고 있다는 비판이 제기된다.참여연대 조세재정개혁센터는 7일 논평을 내어 “민주당이 (국민의힘이 제안한) 배우자 상속세 폐지를 수용하겠다고 나섰다”며 “민주당이 불평등...,2025-03-07 16:31,https://www.hani.co.kr/arti/economy/economy_general/1185905.html,한겨레
"시리아 아사드 충성파-과도정부 병력 충돌, 50여명 사망",https://flexible.img.hani.co.kr/flexible/normal/300/180/imgdb/child/2025/0307/53_17413324503164_20250307502423.webp,시리아에서 과도정부 병력과 바샤르 아사드 전 대통령에게 충성하는 무장세력이 충돌해 50명 이상이 사망하고 수십명이 다쳤다.시리아인권관측소는 6일(현지시각) 누리집에 아사드 전 대통령 지지 무장세력과 과도정부 병력이 충돌해 시리아 해안 마을 자블레와 인근 마을에서 48명...,2025-03-07 16:26,https://www.hani.co.kr/arti/international/arabafrica/1185904.html,한겨레
"국힘, ‘윤 구속취소’ 겉으론 환영, 속으론 ‘조기대선 불리’ 우려",https://flexible.img.hani.co.kr/flexible/normal/300/180/imgdb/child/2025/0307/53_17413324203986_20250307502421.webp,"법원이 7일 윤석열 대통령의 ‘구속취소’ 청구를 인용한 데 대해 국민의힘은 환영의 뜻을 나타냈지만, 속내가 복잡하다. 윤 대통령이 석방된 상태에서 ‘장외 여론전’을 펼칠 경우, 탄핵 인용 뒤 치러질 조기대선에는 부정적 영향을 줄 수 있다는 우려 때문이다. 특히 이날 발...",2025-03-07 16:26,https://www.hani.co.kr/arti/politics/politics_general/1185903.html,한겨레
“사법정의 후퇴 방관 말자”…윤석열 구속 취소에 시민 격앙,https://flexible.img.hani.co.kr/flexible/normal/300/180/imgdb/child/2025/0307/53_17413319896025_20250307502404.webp,7일 서울중앙지법이 윤석열 대통령에 대한 구속취소 청구를 인용하자 윤 대통령 탄핵을 촉구하는 시민들은 이날 저녁 서울 광화문으로 집결하자고 촉구했다.‘윤석열 퇴진을 위해 행동하는 청년들’은 이날 “오늘 3월7일 저녁 7시30분 광화문 서십자각터 앞으로 모여달라. 법치주...,2025-03-07 16:19,https://www.hani.co.kr/arti/society/society_general/1185902.html,한겨레
강간 피해 70% ‘폭행·협박’ 없어…“비동의 강간죄 도입을”,https://flexible.img.hani.co.kr/flexible/normal/300/180/imgdb/child/2025/0307/53_17413318077155_20250307502380.webp,"한국성폭력상담소는 7일 지난해 강간 피해를 상담한 240명 가운데 피해 경위 확인이 가능한 218명의 상담일지를 분석한 결과, 153명(70.2%)의 사건은 폭행·협박 없이 발생했다고 밝혔다. 현행 형법은 저항이 불가능할 정도의 폭행과 협박이 있는 경우에만 ...",2025-03-07 16:09,https://www.hani.co.kr/arti/society/women/1185901.html,한겨레
트럼프 ‘반과학’에 맞서 다시 거리로 나서는 미국 과학자들,https://flexible.img.hani.co.kr/flexible/normal/300/180/imgdb/child/2025/0307/53_17413314401713_20250307502362.webp,"두 번째로 집권한 미국 도널드 트럼프 행정부가 비용·인력 삭감 등으로 과학계를 본격적으로 흔들자, 과학자들이 이에 맞서 대규모 행진을 벌이는 등 그 반발도 거세지고 있다. 1기 트럼프 행정부 때에도 과학자들은 대대적인 항의 집회를 여러 차례 벌인 바 있다.미국 과학자들...",2025-03-07 16:06,https://www.hani.co.kr/arti/society/environment/1185900.html,한겨레
미국 관세 압박에 중국 외교수장 “고집하면 공격”…강해진 비판 수위,https://flexible.img.hani.co.kr/flexible/normal/300/180/imgdb/child/2025/0307/53_17413309943613_20250307502339.webp,중국 외교 분야 수장이 도널드 트럼프 미국 대통령 취임 뒤 이어지고 있는 관세 공격에 “압박을 고집하면 단호하게 공격”할 것이라고 밝혔다.7일 왕이 중국 공산당 중앙외사판공실 주임 겸 외교부장(장관)은 양회(전국인민대표대회·전국인민정치협상회의) 중 열린 외교정책·대외관...,2025-03-07 16:00,https://www.hani.co.kr/arti/international/china/1185899.html,한겨레
뉴진스 “어도어가 계약 위반”…어도어 “전속 해지 불가”,https://flexible.img.hani.co.kr/flexible/normal/300/180/imgdb/child/2025/0307/53_17413308510609_20250307502328.webp,‘NJZ’라는 이름으로 새롭게 활동하려는 뉴진스 멤버 5명이 어도어가 제기한 활동금지 가처분 심문에 출석해 “저희를 보호해주긴커녕 안 보이는 곳에서 괴롭힘을 일삼는 어도어에선 더 이상의 계약 이행이 불가능하다”고 말했다. 멤버들은 직접 진술을 하면서 울먹이기도 했다.서...,2025-03-07 15:57,https://www.hani.co.kr/arti/society/society_general/1185898.html,한겨레
"미-우크라, 내주 사우디서 ‘종전협상’ 재개…미-러는 진행 중",https://flexible.img.hani.co.kr/flexible/normal/300/180/imgdb/child/2025/0307/53_17413307615262_20250307502306.webp,도널드 트럼프 미국 대통령과 볼로디미르 젤렌스키 우크라이나 대통령의 가시가 돋친 설전으로 파국으로 치달았던 미국과 우크라이나가 다음주 사우디아라이바에서 고급 회담을 열기로 했다. 우크라이나 전쟁 종식을 위한 첫 단추를 낄 수 있을지 관심이 쏠린다.젤렌스키 대통령은 6일...,2025-03-07 15:55,https://www.hani.co.kr/arti/international/international_general/1185897.html,한겨레
교보생명 ‘12년 풋옵션’ 분쟁 매듭…“지주사 전환 속도 낼 것”,https://flexible.img.hani.co.kr/flexible/normal/300/180/imgdb/original/2025/0307/20250307502299.webp,"교보생명과 사모펀드 어피니티의 풋옵션 분쟁이 해소된다. 교보생명은 장기간 계속된 주주간 분쟁이 해소된 만큼 금융지주사 전환 작업에 속도를 내기로 했다.교보생명은 어피니티에쿼티파트너스와 싱가포르투자청(GIC)이 교보생명 보유 지분(각각 9.05%, 4.5%)을 신한투자증...",2025-03-07 15:54,https://www.hani.co.kr/arti/economy/finance/1185896.html,한겨레
“36개 기업이 전세계 온실가스 절반 배출”…‘기후악당’ 면면은,https://flexible.img.hani.co.kr/flexible/normal/300/180/imgdb/child/2025/0307/53_17413304801099_20250307502296.webp,"화석연료 생산에 기반을 둔 36개 기업이 뿜어 내는 온실가스의 양이 전세계 탄소배출량의 절반 이상을 차지한다는 조사 결과가 발표됐다. 이들 대다수가 국영기업으로, 지구 온도 1.5도 상승을 막자는 국제협약 뒤에도 계속해서 탄소배출량이 증가하고 있어 전지구적인 규제가 필...",2025-03-07 15:53,https://www.hani.co.kr/arti/society/environment/1185895.html,한겨레
Court grants Yoon’s release from detention,https://flexible.img.hani.co.kr/flexible/normal/300/180/imgdb/original/2025/0307/5617413300717889.webp,The Seoul Central District Court accepted a request to rescind the detention of President Yoon Suk-yeol on Friday. The decision comes after a request ...,2025-03-07 15:51,https://www.hani.co.kr/arti/english_edition/e_national/1185894.html,한겨레
"“폭탄이 북에 떨어졌다면…” 시민단체, 한미연합훈련 중단 촉구",https://flexible.img.hani.co.kr/flexible/normal/300/180/imgdb/child/2025/0307/53_17413301226882_20250307502280.webp,"민간인 30여명이 다친 경기도 포천 공군 전투기 오폭사고를 계기로 한미연합훈련을 중단해야 한다는 목소리가 나왔다.윤석열정권즉각퇴진·사회대개혁 광주비상행동과 광주전남대학생진보연합, 국민주권당 광주시당 등 100여개 단체는 7일 광주광역시 동구 5·18민주광장에서 기자회견...",2025-03-07 15:48,https://www.hani.co.kr/arti/area/honam/1185893.html,한겨레
"민주당, 윤석열 구속 취소에 “검찰, 즉시 항고해야”",https://flexible.img.hani.co.kr/flexible/normal/300/180/imgdb/child/2025/0307/53_17413304926442_20250307501228.webp,법원이 내란 우두머리 혐의로 구속 기소된 윤석열 대통령이 청구한 ‘구속취소’ 신청을 인용한 데 대해 더불어민주당이 7일 “검찰은 즉시 항고해야 한다”고 밝혔다.한민수 민주당 대변인은 이날 긴급 최고위원회의 후 기자들과 만나 이런 당의 입장을 설명한 뒤 “이번 법원 결정...,2025-03-07 15:47,https://www.hani.co.kr/arti/politics/politics_general/1185892.html,한겨레
"“윤 구속 취소, 내란성 불면증의 재발”…‘어떻게 잡아넣었는데’",https://flexible.img.hani.co.kr/flexible/normal/300/180/imgdb/child/2025/0307/53_17413300530446_20250307502270.webp,‘내란 우두머리’ 혐의로 기소된 윤석열 대통령의 구속이 취소되자 시민들은 황당함과 실망감 그리고 분노를 숨기지 못했다. 시민들은 ‘자유의 몸’이 된 윤 대통령이 극우 세력을 선동해 혼란이 가중될까 우려했다. 12·3 내란사태 이후 수사의 난맥상이 ‘구속 취소’를 불렀다...,2025-03-07 15:46,https://www.hani.co.kr/arti/society/society_general/1185891.html,한겨레
이철규 며느리도 대마 의혹 피의자 입건…범행 때 아들 차에 동승,https://flexible.img.hani.co.kr/flexible/normal/300/180/imgdb/child/2025/0307/53_17413300186701_20250307502257.webp,액상 대마를 구하려다 적발된 이철규 국민의힘 의원 아들 사건을 수사 중인 경찰이 이 의원의 며느리 ㄱ씨를 공범으로 보고 함께 입건한 것으로 전해졌다.서울 서초경찰서는 7일 이 의원의 아들인 30대 이아무개씨가 범행에 이용한 차에 아내 ㄱ씨 등 2명이 동승한 정황을 포착...,2025-03-07 15:42,https://www.hani.co.kr/arti/society/society_general/1185890.html,한겨레
한동훈 “혼란 초래한 공수처 폐지해야”,https://flexible.img.hani.co.kr/flexible/normal/300/180/imgdb/resize/test/child/2025/0307/53_17413297282786_20250307502253.webp,7일 윤석열 대통령에 대한 구속취소 청구가 법원에서 인용되자 한동훈 전 국민의힘 대표는 “공수처(고위공직자범죄수사처)는 폐지돼야 한다”고 밝혔다.한 전 대표는 이날 페이스북에 올린 글에서 윤 대통령을 향해 “그동안 심신이 많이 지치셨을 거 같다. 건강을 잘 챙기시면서 ...,2025-03-07 15:41,https://www.hani.co.kr/arti/politics/politics_general/1185889.html,한겨레
"윤석열 구속 취소한 재판부, ‘9시간45분 불법 구금’ 판단",https://flexible.img.hani.co.kr/flexible/normal/300/180/imgdb/child/2025/0307/53_17413299124917_20250307502249.webp,서울중앙지법 형사합의25부(재판장 지귀연)는 7일 윤석열 대통령의 구속을 취소하면서 우선 구속기간이 지난 뒤의 기소라는 윤 대통령 쪽의 주장을 받아들였다.윤 대통령이 고위공직자범죄수사처(공수처)에 체포된 시점은 지난 1월15일 오전 10시33분으로 예정된 구속기간 만료...,2025-03-07 15:40,https://www.hani.co.kr/arti/society/society_general/1185888.html,한겨레
5·18단체 “내란 주도자를 사법부가 석방…법을 악용한 역사 반복”,https://flexible.img.hani.co.kr/flexible/normal/300/180/imgdb/child/2025/0307/53_17413296590458_20250307502234.webp,"법원이 윤석열 대통령 구속 취소를 결정하자 5·18단체가 일제히 비판했다.5·18민주화운동 유족회와 5·18부상자회, 5·18공로자회, 5·18기념재단은 7일 성명을 내어 “내란 주범에 대한 구속 취소 결정은 정의에 대한 정면 도전”이라고 밝혔다.이들은 이날 서울중앙지...",2025-03-07 15:37,https://www.hani.co.kr/arti/area/honam/1185887.html,한겨레
"전남 여성농민단체, ‘한가구당 1명’ 농민수당 조례 개정 촉구",https://flexible.img.hani.co.kr/flexible/normal/300/180/imgdb/child/2025/0307/53_17413292952416_20250307502227.webp,전라남도의 농민수당 지급 방식이 농가당 한 사람으로 한정돼 여성농민의 권리가 침해받고 있다. 여성의 날(3월8일)을 앞두고 여성 농민들의 지위를 인정하는 농민수당 조례를 개정해야 한다는 지적이 나온다.전국여성농민회총연합 광주전남연합은 7일 오후 1시 전남 무안 전라남도...,2025-03-07 15:34,https://www.hani.co.kr/arti/area/honam/1185886.html,한겨레
환율 상승에 ‘간편 야식’ 물가 고공행진…햄·냉동만두 동반 인상,https://flexible.img.hani.co.kr/flexible/normal/300/180/imgdb/child/2025/0307/53_17413292160648_20250307502221.webp,"냉동만두와 햄·소시지 등 소비자들이 즐겨 찾는 일부 가공식품 가격이 이달부터 오른 것으로 확인됐다.7일 씨제이(CJ)제일제당은 이달부터 대형마트에서 판매하는 만두, 햄, 소시지 등 일부 제품 가격을 인상했다고 밝혔다. 대표 브랜드인 비비고 만두의 경우 20여개 제품 가...",2025-03-07 15:33,https://www.hani.co.kr/arti/economy/economy_general/1185885.html,한겨레
"오세훈 “윤석열 구속 취소, 참으로 바람직한 결정”",https://flexible.img.hani.co.kr/flexible/normal/300/180/imgdb/child/2025/0307/53_17413290581159_20250307502209.webp,오세훈 서울시장은 법원이 윤석열 대통령의 구속 취소신청을 인용한 것에 대해 “참으로 바람직한 결정이 나왔다”고 밝혔다.오 시장은 7일 서울 여의도 국회 의원회관에서 열린 ‘지방분권형 헌법 개정 국회 대토론회’에 참석한 뒤 기자들과 만나 “지금부터 본격적으로 재판이 이뤄...,2025-03-07 15:28,https://www.hani.co.kr/arti/area/capital/1185884.html,한겨레
"소방은 1분, 군은 20분 뒤 오폭 보고…소방보다 늦은 군",https://flexible.img.hani.co.kr/flexible/normal/300/180/imgdb/child/2025/0307/53_17413290283616_20250307502206.webp,"경기 포천에서 발생한 공군 전투기 오폭 사고로 민간인과 군인 등 29명이 부상한 가운데, 공군과 군 당국이 사태 초기 상황을 제대로 파악하지 못해 보고가 늦었던 것으로 전해졌다. 7일 국방부와 공군 등의 설명을 종합하면 전날 훈련 도중 케이에프(KF)-16 전투기가 ...",2025-03-07 15:28,https://www.hani.co.kr/arti/politics/defense/1185883.html,한겨레
"법원, 홈플러스 협력업체 상대 3400억 채권 조기 변제 허가",https://flexible.img.hani.co.kr/flexible/normal/300/180/imgdb/child/2025/0307/53_17413285200236_20250307502189.webp,법원이 회생절차가 개시된 홈플러스의 상거래 채권 조기 변제를 허가했다.서울회생법원 회생4부(재판장 정준영)는 7일 홈플러스가 신청한 채권 조기 변제를 승인했다. 홈플러스는 전날 협력업체에 대한 지난해 1월과 올해 1~2월 물품·용역 대금 3457억원에 대한 채권 변제를...,2025-03-07 15:21,https://www.hani.co.kr/arti/society/society_general/1185882.html,한겨레
여자당구 조 편성 ‘동료에서 적으로’…김가영·스롱 등 소속팀 선수와 예선전,https://flexible.img.hani.co.kr/flexible/normal/300/180/imgdb/child/2025/0307/53_17413285972746_20250307502180.webp,"우승상금 1억원. 양보 없는 싸움에 ‘어제의 동지가, 오늘의 적’으로 만난다.8일 제주 한라체육관서 개막하는 ‘SK렌터카 제주특별자치도 PBA-LPBA 월드 챔피언십 2025’(8~17일) 대진표를 보면, 김가영과 스롱 피아비 등 주요 선수들이 팀 동료와 예선을 거쳐야...",2025-03-07 15:18,https://www.hani.co.kr/arti/sports/sports_general/1185881.html,한겨레
트럼프 ‘전략 비축’ 서명에도 비트코인 5% 급락…왜?,https://flexible.img.hani.co.kr/flexible/normal/300/180/imgdb/child/2025/0307/53_17413281130119_20250307502152.webp,"도널드 트럼프 대통령이 암호화폐를 전략 비축하는 행정명령에 서명했다는 소식이 전해진 뒤 비트코인 가격이 전날보다 5% 가량 떨어졌다. 그간 미국 정부의 비트코인 보유를 기다렸던 투자자의 기대와 달리, 범죄 수익 등으로 압수한 비트코인만 비축한다는 행정명령 구체안에 대한...",2025-03-07 15:12,https://www.hani.co.kr/arti/economy/finance/1185880.html,한겨레
주인공 없는 연극…‘엑스트라 연대기’ 춘천 공연,https://flexible.img.hani.co.kr/flexible/normal/300/180/imgdb/child/2025/0307/53_17413281208563_20250307502145.webp,한국 현대사의 노동운동을 다루며 실험적인 연출방식과 무대미술로 주목을 받은 연극 ‘엑스트라 연대기’가 춘천에서 관객과 만난다.극단 그린피그는 14일부터 16일까지 4차례에 걸쳐 강원도 춘천시 축제극장몸짓에서 ‘엑스트라 연대기’ 첫 지역공연을 한다고 7일 밝혔다.2022...,2025-03-07 15:10,https://www.hani.co.kr/arti/area/gangwon/1185879.html,한겨레
"[속보] 대통령실, 윤석열 구속 취소에 “조속한 직무 복귀 기대”",https://flexible.img.hani.co.kr/flexible/normal/300/180/imgdb/child/2025/0225/53_17404470574883_20250225501134.webp,대통령실이 7일 내란 우두머리 혐의로 구속 기소된 윤석열 대통령의 구속취소 신청이 인용되자 “대통령의 조속한 직무 복귀를 기대한다”는 입장을 냈다.대통령실은 이날 대변인실 명의의 언론 공지를 내어 “대통령실은 법원의 대통령 구속취소 결정을 환영한다”며 “수사권이 없는 ...,2025-03-07 15:00,https://www.hani.co.kr/arti/politics/politics_general/1185878.html,한겨레
"[속보] 국힘, 윤석열 구속 취소에 “사법 정의 살아있어”",https://flexible.img.hani.co.kr/flexible/normal/300/180/imgdb/child/2025/0307/53_17413270582292_521741327035659.webp,법원이 내란 우두머리 혐의로 구속 기소된 윤석열 대통이 청구한 ‘구속취소’ 신청을 인용한 데 대해 국민의힘이 “대한민국 법치와 사법 정의가 살아있음을 확인하는 중요한 순간”이라고 말했다.권 위원장과 권성동 원내대표는 이날 국회에서 기자간담회를 열고 법원의 결정에 대해 ...,2025-03-07 14:54,https://www.hani.co.kr/arti/politics/politics_general/1185877.html,한겨레
"독일 양대 공영방송, ‘내란 옹호’ 다큐 긴급 취소…영상은 여전히 누리집에",https://flexible.img.hani.co.kr/flexible/normal/300/180/imgdb/child/2025/0307/53_17413270031704_20250307502073.webp,한국의 12·3 내란 사태를 다루며 ‘부정선거 음모론’ 등 내란을 옹호하는 극우 세력의 주장을 일방적으로 반영한 다큐멘터리 방영을 예고해 논란을 빚은 독일 공영방송사 아에르데(ARD)와 체트데에프(ZDF)가 해당 다큐의 편성을 긴급 취소한 것으로 나타났다.7일 독일 1...,2025-03-07 14:53,https://www.hani.co.kr/arti/society/media/1185876.html,한겨레
‘전투기 오폭’ 부상 민간인 1/3은 채소농장 이주노동자,https://flexible.img.hani.co.kr/flexible/normal/300/180/imgdb/child/2025/0307/53_17413269088923_20250307502068.webp,"경기도 포천시 전투기 오폭으로 인한 민간인 부상자의 3분의 1은 외국인인 것으로 확인됐다.7일 포천시 등의 설명을 종합하면, 전날 포천시 이동면 노곡리에서 발생한 공군 전투기 오폭 사고로 다친 민간인 17명 가운데 6명은 외국인이었다. 약 35%에 달하는 숫자다. 국적...",2025-03-07 14:53,https://www.hani.co.kr/arti/area/capital/1185875.html,한겨레
[속보] 윤석열 구속 취소에 민주 긴급의총 소집,https://flexible.img.hani.co.kr/flexible/normal/300/180/imgdb/child/2025/0307/53_17413266990658_20250307502058.webp,내란 우두머리 혐의로 구속 기소된 윤석열 대통령의 석방 소식이 7일 전해지자 더불어민주당은 ‘충격’에 휩싸였다. 민주당은 긴급 의원총회를 소집하며 비상 대응에 나섰다.이재명 대표는 이날 윤 대통령 구속 취소 소식이 전해진 뒤 국회에서 취재진을 만나 “지금 저희도 정확한...,2025-03-07 14:50,https://www.hani.co.kr/arti/politics/assembly/1185874.html,한겨레
‘윤 구속 취소’에 홍준표 “내 주장 받아준 법원에 격한 감사”,https://flexible.img.hani.co.kr/flexible/normal/300/180/imgdb/child/2025/0307/53_17413265830016_20250307502045.webp,"7일 윤석열 대통령에 대한 구속취소 청구가 법원에서 인용되자 홍준표 대구시장은 “공수처장(고위공직자범죄수사처 처장)과 검찰총장, 서울고검장은 즉각 사퇴하라”고 밝혔다.홍 시장은 이날 페이스북에 올린 글에서 “그동안 줄기차게 윤 대통령의 구속은 불법 구속이니 취소하라는 ...",2025-03-07 14:48,https://www.hani.co.kr/arti/politics/politics_general/1185873.html,한겨레
"법원 “검찰, 구속기간 잘못 계산”...윤석열 구속 취소",https://flexible.img.hani.co.kr/flexible/normal/300/180/imgdb/child/2025/0307/53_17413264054115_20250307502024.webp,"법원이 내란 우두머리 혐의를 받는 윤석열 대통령의 구속취소 신청을 인용했다. 검찰이 석방 지휘를 하면 윤 대통령은 풀려나지만 7일 안에 즉시항고를 하면 다시 법원의 판단을 받게 된다. 검찰은 즉시항고를 윤 대통령 구속 상태에서 할지, 아니면 석방 뒤에 할지 검토 중인 ...",2025-03-07 14:45,https://www.hani.co.kr/arti/society/society_general/1185872.html,한겨레
“몰수한 비트코인만 전략 비축”…트럼프 행정명령에 가격 폭락,https://flexible.img.hani.co.kr/flexible/normal/300/180/imgdb/child/2025/0307/53_17413263688636_20250307502022.webp,"도널드 트럼프 미국 대통령이 비트코인을 전략비축하는 행정명령에 서명했다. 가상화폐 전략비축 공약의 이행에 나선 것이다.백악관 인공지능 및 가상화폐 차르인 데이비드 색스는 6일 엑스(X)에 올린 글에서 이렇게 밝히고, 형사 혹은 민사 재판 과정에서 연방정부에 몰수된 가상...",2025-03-07 14:45,https://www.hani.co.kr/arti/international/international_general/1185871.html,한겨레
홈플러스 ‘납품 중단’ 일부 공급 재개…한숨 돌렸지만,https://flexible.img.hani.co.kr/flexible/normal/300/180/imgdb/original/2025/0307/20250307502020.webp,"홈플러스에 물품 공급을 중단했던 일부 제조업체들이 공급을 재개하며, 중단 위기를 맞은 홈플러스 마트 운영이 한숨 돌리는 모양새다. 하지만 협력업체들 사이에선 홈플러스의 대금 지급 능력에 대한 불안이 여전한 것으로 나타났다.7일 홈플러스는 “오뚜기, 농심 등 주요 협력사...",2025-03-07 14:45,https://www.hani.co.kr/arti/economy/economy_general/1185870.html,한겨레
