title,thumbnail,short_content,write_time,link,company
산재 예방하면 저리대출 1호…미리 보는 ‘산재 금융’,https://news.kbs.co.kr/data/news/2025/09/10/20250910_zG2hfQ.png,,,https://news.kbs.co.kr/news/pc/view/view.do?ncd=8354273,KBS
근거도 없이 “공사비 올려달라”…지역주택조합 곳곳 차질,https://news.kbs.co.kr/data/news/2025/09/10/20250910_UaqvKB.png,,,https://news.kbs.co.kr/news/pc/view/view.do?ncd=8354263,KBS
‘한국형 엔비디아’ 육성…국민성장 펀드 150조 원으로 확대,https://news.kbs.co.kr/data/news/2025/09/10/20250910_uzN0es.png,,,https://news.kbs.co.kr/news/pc/view/view.do?ncd=8354258,KBS
청년 고용한파 지속…일자리 ‘첫걸음’ 돕는다,https://news.kbs.co.kr/data/news/2025/09/10/20250910_iYHwrk.png,,,https://news.kbs.co.kr/news/pc/view/view.do?ncd=8354254,KBS
Public Growth Fund expanded,https://news.kbs.co.kr/data/news/2025/09/10/20250910_uzN0es.png,"[Anchor]The scale of the Public Growth Fund, aimed...",2025.09.10 (23:57),https://news.kbs.co.kr/news/view.do?ncd=8354467,KBS
KOSPI hits record high,https://news.kbs.co.kr/data/news/2025/09/10/20250910_N8HFA1.png,[Anchor]The KOSPI has set a new all-time high.In a...,2025.09.10 (23:57),https://news.kbs.co.kr/news/view.do?ncd=8354466,KBS
Man caught trying to kidnap child,https://news.kbs.co.kr/data/news/2025/09/10/20250910_O48BdU.png,[Anchor]Another attempted child abduction case has...,2025.09.10 (23:57),https://news.kbs.co.kr/news/view.do?ncd=8354465,KBS
Conflicting claims on Lee Ufan work,https://news.kbs.co.kr/data/news/2025/09/10/20250910_BMwSO1.png,"[Anchor]This is a painting by artist Lee Ufan, obt...",2025.09.10 (23:57),https://news.kbs.co.kr/news/view.do?ncd=8354464,KBS
KT fraud tied to ghost signals,https://news.kbs.co.kr/data/news/2025/09/10/20250910_WzxXEw.png,"[Anchor]As we reported earlier, suspicions are bei...",2025.09.10 (23:57),https://news.kbs.co.kr/news/view.do?ncd=8354463,KBS
Kidnap attempts spark fear,https://news.kbs.co.kr/data/news/2025/09/10/20250910_D0yiA6.png,[Anchor]As attempted kidnappings of elementary sch...,2025.09.10 (23:57),https://news.kbs.co.kr/news/view.do?ncd=8354462,KBS
No re-entry guarantee,https://news.kbs.co.kr/data/news/2025/09/10/20250910_aizO8N.png,[Anchor]The factory where a large number of Korean...,2025.09.10 (23:57),https://news.kbs.co.kr/news/view.do?ncd=8354461,KBS
Explosion at Paju army unit,https://news.kbs.co.kr/data/news/2025/09/10/20250910_04wKrk.png,[Anchor]An explosion has occurred at an artillery...,2025.09.10 (23:57),https://news.kbs.co.kr/news/view.do?ncd=8354460,KBS
Discharge preparations halted,https://news.kbs.co.kr/data/news/2025/09/10/20250910_yx7ZmB.png,"[Anchor]Our citizens, who were ready to leave the...",2025.09.10 (23:57),https://news.kbs.co.kr/news/view.do?ncd=8354459,KBS
[Exclusive]Navy vessel use,https://news.kbs.co.kr/data/news/2025/09/10/20250910_XGAvXz.png,[Anchor]Former President Yoon Suk Yeol and his wif...,2025.09.10 (23:57),https://news.kbs.co.kr/news/view.do?ncd=8354458,KBS
FM Cho to meet Rubio,https://news.kbs.co.kr/data/news/2025/09/10/20250910_QNAU8T.png,[Anchor]Foreign Minister Cho Hyun is set to meet w...,2025.09.10 (23:57),https://news.kbs.co.kr/news/view.do?ncd=8354457,KBS
Release delayed by U.S.,https://news.kbs.co.kr/data/news/2025/09/10/20250910_SjENu1.png,[Anchor]The return of Korean citizens detained in...,2025.09.10 (23:57),https://news.kbs.co.kr/news/view.do?ncd=8354456,KBS
