title,thumbnail,short_content,write_time,link,company
이 대통령 “석유 최고가격제 신속 도입”…유류세 인하폭 확대 등 검토,https://news.kbs.co.kr/data/news/title_image/newsmp4/news5/2026/03/09/50_8503197.jpg,,,https://news.kbs.co.kr/news/pc/view/view.do?ncd=8503197,KBS
"주유소 기름값 2천 원 눈 앞…정부, 다각도로 대책 마련",https://news.kbs.co.kr/data/news/title_image/newsmp4/news5/2026/03/09/40_8503195.jpg,,,https://news.kbs.co.kr/news/pc/view/view.do?ncd=8503195,KBS
유가 100달러 돌파에 증시 급락…환율도 급등,https://news.kbs.co.kr/data/news/title_image/newsmp4/news5/2026/03/09/30_8503191.jpg,,,https://news.kbs.co.kr/news/pc/view/view.do?ncd=8503191,KBS
"결국 배럴당 100달러 뚫렸다…전쟁 열흘, 치솟는 유가",https://news.kbs.co.kr/data/news/title_image/newsmp4/news5/2026/03/09/20_8503188.jpg,,,https://news.kbs.co.kr/news/pc/view/view.do?ncd=8503188,KBS
이란 초교 인근 폭격한 미사일 정체는…WP “미군 토마호크 맞다” [지금뉴스],https://news.kbs.co.kr/data/fckeditor/vod/2026/03/09/303201773050081396.png,폭격으로 170여명이 사망한 이란 초등학교 인근에 미군 토마호크 미사일로 추정되는 물체가...,2026.03.09 (18:57),https://news.kbs.co.kr/news/view.do?ncd=8503247,KBS
정부 “농축산물 가격 대체로 하락…수급 관리 강화”,https://news.kbs.co.kr/data/news/2026/03/09/20260309_CFactw.jpg,"농축산물 가격이 전반적으로 전주보다 낮아졌지만, 일부 품목은 여전히 높은 수준을 보여 정부...",2026.03.09 (18:49),https://news.kbs.co.kr/news/view.do?ncd=8503244,KBS
"이세돌, AI 숙련도에 따른 양극화에 대해 “격차 더 벌어질 것” [현장영상]",https://news.kbs.co.kr/data/fckeditor/vod/2026/03/09/308531773081518838.png,"10년 만에 인공지능(AI)과 대국을 펼친 이세돌 9단이 ""AI로 인한 격차 심화가 가장...",2026.03.09 (18:47),https://news.kbs.co.kr/news/view.do?ncd=8503243,KBS
"청와대, 에너지·해운 등 범정부 협의체 출범…“인프라 리스크 점검”",https://news.kbs.co.kr/data/news/2026/03/09/20260309_gRaeVX.jpg,최근 중동 상황으로 글로벌 에너지 공급 및 해상 운송망의 불확실성이 확대되고 있는 가운데...,2026.03.09 (18:45),https://news.kbs.co.kr/news/view.do?ncd=8503242,KBS
속초서 ‘시나위 보컬 김바다’ 대마 흡입 혐의 체포,https://news.kbs.co.kr/data/news/2026/03/09/20260309_nDehTR.jpg,밴드 시나위 보컬 김바다 씨가 대마를 흡입하다가 경찰에 붙잡혔습니다. 강원 속초경찰서는...,2026.03.09 (18:45),https://news.kbs.co.kr/news/view.do?ncd=8503241,KBS
‘성토’ 나온 국민의힘 의총…“TK 자민련으로 추락…결단해야” [지금뉴스],https://news.kbs.co.kr/data/fckeditor/vod/2026/03/09/306611773048097633.png,국민의힘이 6.3 지방선거를 3개월 가까이 앞두고 국회에서 긴급 의원총회를 열고 윤석열 전...,2026.03.09 (18:42),https://news.kbs.co.kr/news/view.do?ncd=8503240,KBS
말다툼 하다 아내에게 흉기 휘두른 80대 남성 검거,https://news.kbs.co.kr/data/news/2026/03/09/20260309_K4HVbG.jpg,말다툼 도중 흉기를 휘둘러 아내를 다치게 한 80대 남성이 경찰에 붙잡혔습니다. 경기 의정...,2026.03.09 (18:41),https://news.kbs.co.kr/news/view.do?ncd=8503239,KBS
"일, ‘반격능력’ 미사일 31일 구마모토 배치…중국 일부·북한 도달",https://news.kbs.co.kr/data/news/2026/03/09/20260309_wWjX9V.jpg,일본이 적 기지를 공격할 수 있는 ‘반격 능력’ 확보에 속도를 내는 가운데 장사정 미사일...,2026.03.09 (18:40),https://news.kbs.co.kr/news/view.do?ncd=8503238,KBS
도망친 음주운전자…새내기 경찰의 ‘불꽃 추격’,https://news.kbs.co.kr/data/fckeditor/new/image/2026/03/09/342791773040427064.png,"■ 도망친 음주운전자, 뒤를 쫓는 경찰의 추격전지난 5일 밤 10시 20분쯤 제주시 외도동...",2026.03.09 (18:29),https://news.kbs.co.kr/news/view.do?ncd=8503237,KBS
[속보] 국민의힘 의총 결의문 “윤석열 전 대통령 정치적 복귀 요구 명백히 반대”,https://news.kbs.co.kr/data/news/2026/03/09/20260309_mTNuJc.png,"국민의힘 의총 결의문 ""윤석열 전 대통령 정치적 복귀 요구 명백히 반대""",2026.03.09 (18:26),https://news.kbs.co.kr/news/view.do?ncd=8503236,KBS
"[속보] 국민의힘 의원 전원 결의문 채택…“계엄 국민께 사과, ‘윤’ 정치적 복귀 반대”",https://news.kbs.co.kr/data/news/2026/03/09/20260309_r1gHl2.png,국민의힘이 의원총회 끝장토론 끝에 계엄에 대한 사과와 함께 윤석열 전 대통령과의 '절연'...,2026.03.09 (18:24),https://news.kbs.co.kr/news/view.do?ncd=8503235,KBS
“최고가격제 검토”·“주유소 탓?”…‘유가 급등’ 여야 산자위 현안질의,https://news.kbs.co.kr/data/news/2026/03/09/20260309_cQwt6A.png,여야는 국회 산업통상자원중소벤처기업위원회 현안 질의에서 중동 사태로 인한 유가 상승과 관련...,2026.03.09 (18:22),https://news.kbs.co.kr/news/view.do?ncd=8503234,KBS
