title,thumbnail,short_content,write_time,link,company
[단독] “기출문제 줄테니 샤워 장면 보여줘”…직원 성비위 못 막은 서교공,https://news.kbs.co.kr/data/news/title_image/newsmp4/news9/2025/03/31/210_8214926.jpg,,,https://news.kbs.co.kr/news/pc/view/view.do?ncd=8214926,KBS
[단독] 응급의료기관 80% ‘24시간 분만 불가’…충북은 0곳,https://news.kbs.co.kr/data/news/title_image/newsmp4/news9/2025/03/31/190_8214904.jpg,,,https://news.kbs.co.kr/news/pc/view/view.do?ncd=8214904,KBS
3.6조 유상증자 ‘반나절’ 만에 찬성…사외이사가 일하는 법,https://news.kbs.co.kr/data/news/title_image/newsmp4/news9/2025/03/31/170_8214891.jpg,,,https://news.kbs.co.kr/news/pc/view/view.do?ncd=8214891,KBS
"공매도 첫날, 주가 3%↓…외국인 돌아올까",https://news.kbs.co.kr/data/news/2025/03/31/20250331_x9WBsK.png,,,https://news.kbs.co.kr/news/pc/view/view.do?ncd=8214888,KBS
이스라엘 공격 재개 후 가자지구 사망 1천명 넘어,https://news.kbs.co.kr/data/news/2025/03/31/20250331_t61KjT.jpg,이스라엘이 가자지구 휴전 종료 후 공격을 본격적으로 재개한 이후 사망자가 1천명을 넘어선...,2025.03.31 (23:59),https://news.kbs.co.kr/news/view.do?ncd=8215102,KBS
Myanmar rescue operations obstructed,https://news.kbs.co.kr/data/news/title_image/newsmp4/news9/2025/03/31/120_8214882.jpg,"[Anchor]Now, let's connect with KBS correspondent...",2025.03.31 (23:54),https://news.kbs.co.kr/news/view.do?ncd=8215101,KBS
Discord over supplementary budget,https://news.kbs.co.kr/data/news/2025/03/31/20250331_PLkn9S.png,[Anchor]The government has officially announced a...,2025.03.31 (23:54),https://news.kbs.co.kr/news/view.do?ncd=8215100,KBS
Fire victims face cancellation fees,https://news.kbs.co.kr/data/news/2025/03/31/20250331_GP69Z6.png,[Anchor]The disaster victims who lost their homes...,2025.03.31 (23:54),https://news.kbs.co.kr/news/view.do?ncd=8215099,KBS
Farmers hit by forest fire,https://news.kbs.co.kr/data/news/title_image/newsmp4/news9/2025/03/31/30_8214871.png,[Anchor]The disaster victims who have lost their m...,2025.03.31 (23:53),https://news.kbs.co.kr/news/view.do?ncd=8215098,KBS
Fire extinguishing efforts continue,https://news.kbs.co.kr/data/news/2025/03/31/20250331_GFm982.png,[Anchor]The aftermath of the worst forest fire tha...,2025.03.31 (23:53),https://news.kbs.co.kr/news/view.do?ncd=8215097,KBS
Probe begins into point of ignition,https://news.kbs.co.kr/data/news/2025/03/31/20250331_jqf9qS.png,[Anchor]The investigation into who caused the rece...,2025.03.31 (23:53),https://news.kbs.co.kr/news/view.do?ncd=8215096,KBS
Emergency measures for the vulnerable,https://news.kbs.co.kr/data/news/2025/03/31/20250331_VbmIYx.png,[Anchor]It has been reported that more than 70% of...,2025.03.31 (23:53),https://news.kbs.co.kr/news/view.do?ncd=8215095,KBS
클로징,https://news.kbs.co.kr/data/news/title_image/newsmp4/newsline/2025/03/31/190_8215094.jpg,,2025.03.31 (23:35),https://news.kbs.co.kr/news/view.do?ncd=8215094,KBS
이 시각 소방청 상황실,https://news.kbs.co.kr/data/news/title_image/newsmp4/newsline/2025/03/31/170_8215092.jpg,소방청 상황실입니다. 오늘은 승용차 한 대가 3미터 아래로 추락해 다섯 명이 다친 사고 소...,2025.03.31 (23:34),https://news.kbs.co.kr/news/view.do?ncd=8215092,KBS
"“여기요, 도와주세요” 어둠 속 간절한 외침…골든타임 종료",https://news.kbs.co.kr/data/news/title_image/newsmp4/newsline/2025/03/31/160_8215091.jpg,[앵커] 강진의 직격탄을 맞은 미얀마에 국제기구는 최고 등급 비상사태를 선언하고 각국...,2025.03.31 (23:34),https://news.kbs.co.kr/news/view.do?ncd=8215091,KBS
[오늘의 영상] 타자기로 한 글자씩 찍어낸 놀라운 그림 작품,https://news.kbs.co.kr/data/news/title_image/newsmp4/newsline/2025/03/31/150_8215090.jpg,한 남성이 공원 벤치에 앉아 골동품 타자기를 치고 있습니다. 글을 쓰고 있는 것 같지만…....,2025.03.31 (23:32),https://news.kbs.co.kr/news/view.do?ncd=8215090,KBS
