title,thumbnail,short_content,write_time,link,company
김정은 국무위원장 재추대…최고인민회의 새 수장에 조용원,https://news.kbs.co.kr/data/news/title_image/newsmp4/news5/2026/03/23/140_8515695.jpg,,,https://news.kbs.co.kr/news/pc/view/view.do?ncd=8515695,KBS
“신속한 ‘전쟁 추경’”·“돈 풀 때 아냐”…박홍근 청문회서 여야 충돌,https://news.kbs.co.kr/data/news/title_image/newsmp4/news5/2026/03/23/130_8515691.jpg,,,https://news.kbs.co.kr/news/pc/view/view.do?ncd=8515691,KBS
‘재판 거래 의혹’ 현직 판사 구속 심사…변호사 “혐의 인정 안해”,https://news.kbs.co.kr/data/news/title_image/newsmp4/news5/2026/03/23/100_8515686.jpg,,,https://news.kbs.co.kr/news/pc/view/view.do?ncd=8515686,KBS
"나토 총장 “한·일 등 22개국, 호르무즈 개방에 결집”",https://news.kbs.co.kr/data/news/title_image/newsmp4/news5/2026/03/23/70_8515683.jpg,,,https://news.kbs.co.kr/news/pc/view/view.do?ncd=8515683,KBS
"[속보] 조현 외교장관, 이란 외교장관과 통화…“호르무즈 해협 항행 안전 보장” 촉구",https://news.kbs.co.kr/data/news/2026/03/23/20260323_SmsRgN.jpg,"조현 외교장관, 이란 외교장관과 통화…""호르무즈 해협 항행 안전 보장"" 촉구",2026.03.23 (19:05),https://news.kbs.co.kr/news/view.do?ncd=8515774,KBS
[뉴스7 헤드라인],https://news.kbs.co.kr/data/news/title_image/newsmp4/newsnet/2026/03/23/10_8515761.jpg,"1,510원 넘은 환율…코스피 6% 넘게 급락중동 사태의 장기화 조짐 속에 상대적 안전자산...",2026.03.23 (19:00),https://news.kbs.co.kr/news/view.do?ncd=8515761,KBS
경기 양평 마트 창고서 불…다친 사람 없어,https://news.kbs.co.kr/resource/image/common/noimg_633_355.png,오늘(23일) 오전 10시 40분쯤 경기 양평군 강하면의 마트 창고에서 불이 나 약 50분...,2026.03.23 (18:57),https://news.kbs.co.kr/news/view.do?ncd=8515752,KBS
경찰서 유치장서 마약 의심 봉지 발견…감찰 중,https://news.kbs.co.kr/resource/image/common/noimg_633_355.png,일산동부경찰서 유치장에서 마약으로 의심되는 봉지가 발견돼 경기북부경찰청이 감찰에 나섰습니다...,2026.03.23 (18:57),https://news.kbs.co.kr/news/view.do?ncd=8515751,KBS
박홍근 ‘사면 논란’ 제기한 천하람 “장관 자격 있다 할 수 있나” [지금뉴스],https://news.kbs.co.kr/data/fckeditor/vod/2026/03/23/306611774256274331.png,박홍근 기획예산처 장관 후보자는 오늘(23일) 과거 선거 공보물에 민주화운동 시절 전과 기...,2026.03.23 (18:51),https://news.kbs.co.kr/news/view.do?ncd=8515748,KBS
이별 통보한 전 연인 스토킹하던 남성 경찰에 체포,https://news.kbs.co.kr/resource/image/common/noimg_633_355.png,이별을 통보한 전 연인을 스토킹한 20대 남성이 경찰에 붙잡혔습니다. 경기 포천경찰서는 그...,2026.03.23 (18:49),https://news.kbs.co.kr/news/view.do?ncd=8515747,KBS
인천 모텔서 강도 행각 후 달아난 4명 전원 체포·구속,https://news.kbs.co.kr/resource/image/common/noimg_633_355.png,모텔에서 지인을 폭행하고 휴대전화 등을 빼앗은 일당이 경찰에 붙잡혔습니다. 인천 미추홀경...,2026.03.23 (18:48),https://news.kbs.co.kr/news/view.do?ncd=8515746,KBS
이란 매체에 ‘표적’ 거론된 ‘UAE 바라카 원전’…한전·한수원도 비상,https://news.kbs.co.kr/data/news/2026/03/23/20260323_94YF7D.jpg,이란 매체들이 아랍에미리트(UAE) 아부다비의 바라카 원자력 발전소를 이란군이 공습할 수...,2026.03.23 (18:45),https://news.kbs.co.kr/news/view.do?ncd=8515745,KBS
박홍근 청문회…야 “대한민국 주적 어딘가”·여 “40년 전 발언 사상 검증”,https://news.kbs.co.kr/data/news/2026/03/23/20260323_rIA836.jpg,박홍근 기획예산처 장관 후보자 인사청문회에서 후보자의 대북관을 놓고 여야가 충돌했습니다....,2026.03.23 (18:45),https://news.kbs.co.kr/news/view.do?ncd=8515744,KBS
황종우 해수장관 후보자 “북극항로 대비 동남권 해양 수도권 육성”,https://news.kbs.co.kr/data/news/2026/03/23/20260323_IAGCft.jpg,"황종우 해양수산부 장관 후보자가, 북극항로 시대에 대비해 동남권을 해양 수도권으로 육성하겠...",2026.03.23 (18:45),https://news.kbs.co.kr/news/view.do?ncd=8515743,KBS
북한 김여정 “일본이 원한다고 북일정상회담 실현 안돼”,https://news.kbs.co.kr/data/news/2026/03/23/20260323_NrILXT.jpg,"북한 김여정 노동당 부장이 북일정상회담에 대해 “일본이 원한다고 하여, 결심하였다고 하여...",2026.03.23 (18:45),https://news.kbs.co.kr/news/view.do?ncd=8515742,KBS
황종우 해수부 장관 청문보고서 채택…호르무즈 대응 당부·재산 형성 검증도,https://news.kbs.co.kr/resource/image/common/noimg_633_355.png,국회는 23일(오늘) 농림축산식품해양수산위원회의 황종우 해양수산부 장관 후보자에 대한 인사...,2026.03.23 (18:33),https://news.kbs.co.kr/news/view.do?ncd=8515740,KBS
