title,thumbnail,short_content,write_time,link,company
"전 세계가 ‘클릭’…K-열풍에 역직구 급증, 남은 과제는?",https://news.kbs.co.kr/data/news/2026/02/18/20260218_kPfvJa.png,,,https://news.kbs.co.kr/news/pc/view/view.do?ncd=8487954,KBS
20년간 제자리 ‘기초연금’…‘70% 기준’ 바뀔까,https://news.kbs.co.kr/data/news/2026/02/18/20260218_MxTTfb.png,,,https://news.kbs.co.kr/news/pc/view/view.do?ncd=8487947,KBS
‘비상계엄=내란’ 이번에도 인정될까…핵심 쟁점은 ‘국헌문란·폭동’,https://news.kbs.co.kr/data/news/2026/02/18/20260218_wffzQZ.png,,,https://news.kbs.co.kr/news/pc/view/view.do?ncd=8487939,KBS
‘내란 우두머리’ 윤석열 ‘운명의 날’…비상계엄 443일 만에 1심 선고,https://news.kbs.co.kr/data/news/2026/02/18/20260218_aV6n0U.png,,,https://news.kbs.co.kr/news/pc/view/view.do?ncd=8487938,KBS
미 “핵심 광물 가격 하한 시스템 개발…동맹과 논의 중”,https://news.kbs.co.kr/data/news/2026/02/18/20260218_3boOay.jpg,중국의 희토류 수출 통제 무기화에 맞서 핵심 광물 무역블록 결성을 추진 중인 미국이 핵심...,2026.02.18 (23:56),https://news.kbs.co.kr/news/view.do?ncd=8488061,KBS
"이란, 19일 러와 연합훈련…미 항모전단 맞서 잇단 무력시위",https://news.kbs.co.kr/data/news/2026/02/18/20260218_mOy4qX.jpg,이란과 러시아가 오는 현지시각 19일 오만만에서 북인도양으로 이어지는 해역에서 연합 해상...,2026.02.18 (23:54),https://news.kbs.co.kr/news/view.do?ncd=8488060,KBS
"젤렌스키 “제네바 회담 어려웠다…러, 협상 늦추려 해”",https://news.kbs.co.kr/data/news/2026/02/18/20260218_89Obk8.jpg,볼로디미르 젤렌스키 우크라이나 대통령은 미국의 중재로 러시아와 종전안을 논의하는 3자 협상...,2026.02.18 (23:54),https://news.kbs.co.kr/news/view.do?ncd=8488059,KBS
‘총리 재선출’ 다카이치 “국민 사이서도 개헌 논의 깊어지길”,https://news.kbs.co.kr/data/news/2026/02/18/20260218_SBv2Tj.jpg,"다카이치 사나에 일본 총리는 오늘(18일) 헌법 개정과 관련해 ""당파를 넘어선 건설적 논의...",2026.02.18 (23:54),https://news.kbs.co.kr/news/view.do?ncd=8488058,KBS
"국민의힘 “장동혁, 윤 1심 선고 이후 메시지”",https://news.kbs.co.kr/data/news/title_image/newsmp4/news_etc/2026/02/18/30_8488057.jpg,국민의힘 장동혁 대표가 내일 윤석열 전 대통령 내란 우두머리 혐의 사건 1심 선고 이후 중...,2026.02.18 (23:16),https://news.kbs.co.kr/news/view.do?ncd=8488057,KBS
설 연휴 마지막날 귀경길 정체…이 시각 고속도로,https://news.kbs.co.kr/data/news/2026/02/18/20260218_1gA5qL.jpg,"[앵커] 설 연휴 마지막 날인 오늘, 정체는 대부분 풀렸지만 지금도 일부 구간에서 정체가...",2026.02.18 (23:12),https://news.kbs.co.kr/news/view.do?ncd=8488056,KBS
Overseas direct purchases surge,https://news.kbs.co.kr/data/news/2026/02/18/20260218_kPfvJa.png,[Anchor]As Korean cosmetics and food products gain...,2026.02.18 (22:56),https://news.kbs.co.kr/news/view.do?ncd=8488054,KBS
YouTube down for about an hour,https://news.kbs.co.kr/data/news/2026/02/18/20260218_5dqm0A.png,"Today (Feb. 18), there was a temporary access disr...",2026.02.18 (22:56),https://news.kbs.co.kr/news/view.do?ncd=8488053,KBS
Insurrection ruling key to verdict,https://news.kbs.co.kr/data/news/2026/02/18/20260218_wffzQZ.png,[Anchor]The key issue that will determine the outc...,2026.02.18 (22:56),https://news.kbs.co.kr/news/view.do?ncd=8488051,KBS
Gov't to reform basic pension,https://news.kbs.co.kr/data/news/2026/02/18/20260218_MxTTfb.png,[Anchor]The basic pension is one of the country’s...,2026.02.18 (22:37),https://news.kbs.co.kr/news/view.do?ncd=8488050,KBS
Yoon verdict due tomorrow,https://news.kbs.co.kr/data/news/2026/02/18/20260218_aV6n0U.png,[Anchor]The first trial verdict for former Preside...,2026.02.18 (22:37),https://news.kbs.co.kr/news/view.do?ncd=8488049,KBS
Holiday traffic to ease by midnight,https://news.kbs.co.kr/data/news/2026/02/18/20260218_5l2CjY.png,"[Anchor]Today (Feb. 18), on the last day of the Lu...",2026.02.18 (22:37),https://news.kbs.co.kr/news/view.do?ncd=8488048,KBS
