title,thumbnail,short_content,write_time,link,company
"러시아, ‘휴전’ 압박에도 연일 맹공…트럼프 “14일 중대 성명”",https://news.kbs.co.kr/data/news/title_image/newsmp4/news5/2025/07/11/120_8301986.jpg,,,https://news.kbs.co.kr/news/pc/view/view.do?ncd=8301986,KBS
"트럼프 “캐나다 35%, 나머지 15~20%…관세 덕에 활황, 금리 내려야”",https://news.kbs.co.kr/data/news/title_image/newsmp4/news5/2025/07/11/110_8301984.jpg,,,https://news.kbs.co.kr/news/pc/view/view.do?ncd=8301984,KBS
"이 대통령, 문체부 장관 최휘영·국토부 장관 김윤덕 지명",https://news.kbs.co.kr/data/news/2025/07/11/20250711_bfgPSI.jpg,,,https://news.kbs.co.kr/news/pc/view/view.do?ncd=8301976,KBS
삼고초려만에…‘폭염 작업 20분 휴식’ 다음 주부터 의무화,https://news.kbs.co.kr/data/news/2025/07/11/20250711_nVHFQu.jpg,,,https://news.kbs.co.kr/news/pc/view/view.do?ncd=8301975,KBS
아세안 외교장관들 “세계무역 긴장 우려…자유 다자무역 중요”,https://news.kbs.co.kr/data/news/2025/07/11/20250711_U8stl9.jpg,미국으로부터 20%에서 40%의 상호관세 부과를 통보받은 동남아시아국가연합 아세안(ASEA...,2025.07.11 (18:32),https://news.kbs.co.kr/news/view.do?ncd=8302010,KBS
"“참담하다” 임종득 의원실 압수수색, 국민의힘 ‘발칵’ [지금뉴스]",https://news.kbs.co.kr/data/fckeditor/vod/2025/07/11/174091752225709958.png,순직 해병 특검팀이 윤석열 정부 국가안보실 2차장 출신 임종득 의원의 사무실에 대한 압수수...,2025.07.11 (18:25),https://news.kbs.co.kr/news/view.do?ncd=8302009,KBS
[크랩] ‘사기적 부정 거래’가 뭔데요? 방시혁 주식 논란 4분 정리,https://news.kbs.co.kr/data/news/2025/07/11/20250711_A9RNVV.jpg,금융당국이 방시혁 하이브 의장을 '사기적 부정 거래' 혐의로 검찰에 고발하기로 했습니다....,2025.07.11 (18:09),https://news.kbs.co.kr/news/view.do?ncd=8302007,KBS
"이 대통령, 보수 논객들과 2시간 오찬…조갑제 대표 한 말 [지금뉴스]",https://news.kbs.co.kr/data/fckeditor/vod/2025/07/11/174091752224308587.png,"이재명 대통령이 보수 논객으로 불리는 조갑제 '조갑제 닷컴' 대표, 정규재 전 한국경제신문...",2025.07.11 (18:03),https://news.kbs.co.kr/news/view.do?ncd=8302006,KBS
중기중앙회 “내년 최저임금 인상…중기·소상공인 감당 못할 것”,https://news.kbs.co.kr/data/news/2025/07/11/20250711_QTZtyr.png,내년 시간당 최저임금이 올해보다 2.9% 인상된 1만 320원으로 결정된 것과 관련해 중소...,2025.07.11 (17:48),https://news.kbs.co.kr/news/view.do?ncd=8302004,KBS
"한미, 서울서 외교 국장급 협의…‘동맹 현대화’ 실무협의 본격화",https://news.kbs.co.kr/data/news/2025/07/11/20250711_ITub9V.png,외교부는 한국과 미국 외교 및 국방 분야 주요 직위자들이 참석하는 국장급 협의를 개최해 ‘...,2025.07.11 (17:48),https://news.kbs.co.kr/news/view.do?ncd=8302003,KBS
"뮤지컬 ‘팬텀’ 카이 X 송은혜, KBS 열린음악회서 한 무대",https://news.kbs.co.kr/data/news/2025/07/11/20250711_Y9NRjF.png,뮤지컬 '팬텀'의 주역 배우카이와 송은혜가 오는 13일 KBS 1TV '열린음악회' 무대에...,2025.07.11 (17:48),https://news.kbs.co.kr/news/view.do?ncd=8302002,KBS
경기 고양서 카페에 차량 돌진…60대 운전자 ‘급발진’ 주장,https://news.kbs.co.kr/data/news/2025/07/11/20250711_aUPGnn.png,"오늘(11일) 오전 10시 반쯤, 경기 고양시의 한 카페로 승용차가 돌진했습니다. 이 사고...",2025.07.11 (17:45),https://news.kbs.co.kr/news/view.do?ncd=8302001,KBS
"이 대통령, 광화문서 시민들과 저녁…“소비쿠폰 내수진작 활력 기대”",https://news.kbs.co.kr/data/news/2025/07/11/20250711_1ctHCA.jpg,이재명 대통령이 내수 경기 활성화 차원에서 서울 광화문 인근 한식당에서 시민들과 만나 함께...,2025.07.11 (17:33),https://news.kbs.co.kr/news/view.do?ncd=8302000,KBS
"[현장영상] 이스라엘, 가자 보건센터 공습…줄 서 있던 어린이 등 15명 사망",https://news.kbs.co.kr/data/fckeditor/vod/2025/07/11/320341752252305426.png,이스라엘의 공습으로 지난 10일(현지시간) 가자지구 데이르알발라의 한 보건소 밖에 모여있던...,2025.07.11 (17:28),https://news.kbs.co.kr/news/view.do?ncd=8301999,KBS
클로징,https://news.kbs.co.kr/data/news/title_image/newsmp4/news5/2025/07/11/180_8301998.jpg,,2025.07.11 (17:27),https://news.kbs.co.kr/news/view.do?ncd=8301998,KBS
"이 대통령, 보수 논객 조갑제·정규재 오찬…“국민 통합 앞장설 것”",https://news.kbs.co.kr/data/news/2025/07/11/20250711_tM8A7a.png,"이재명 대통령이 보수 논객으로 불리는 조갑제 ‘조갑제 닷컴’ 대표, 정규재 전 한국경제신문...",2025.07.11 (17:26),https://news.kbs.co.kr/news/view.do?ncd=8301996,KBS
