title,thumbnail,short_content,write_time,link,company
중독성 강한 ‘매운맛’…불 뿜는 캐릭터도 비슷 북한판 ‘짝퉁’ 불닭볶음면,https://static.mk.co.kr/trans_30x13.png,"북한이 삼양식품의 인기 제품인 ‘불닭볶음면’을 모방한 라면을 생산하고 있으며 제품 모두 중국으로 수출하고 있는 것으로 전해졌다. 18일 뉴스1에 따르면 강동완 동아대 교수는 최근 유튜브 채널 영상을 통해 북한에서 생산된 ‘매운 김치맛 비빔국수’를 소개하며, 중국 현지 지인을 통해 해당 제품을 입수했다고 설명했다. 5개 들이로 포장된 이 제품을 보면, 앞쪽",방금 전,https://www.mk.co.kr/news/politics/11423764,매일경제
10년 전 118명이 발의했는데 지금은 달랑 3명…한국 전용 비자법안 꿈쩍않는 미의회,https://static.mk.co.kr/trans_30x13.png,"2013년 의원 118명 참여 최대 이민 관련 부정적 여론 커지자 美의회 지지·관심 급격히 줄어 정부, 美와 행정조치 협의중 한시적·문제 소지 많아 한계 외교부 ‘범정부TF’ 공식 발족미국 조지아주에서 발생한 8일간의 한국인 구금 사태 이후 한미 양국이 비자 제도 개선을 위한 협의에 본격 착수한다. 미국 이민당국은 이달 4일 현대자동차그룹과 LG에너지솔루",방금 전,https://www.mk.co.kr/news/politics/11423761,매일경제
“국장 복귀는 지능 순”이라는 이 대통령…“내 ETF 계좌 수익률 이정도야”,https://static.mk.co.kr/trans_30x13.png,증권사 리서치센터장들 만나 ‘탈출 지능 순’ 유행어에 빗대 증시 활성화 강력 추진 시사 자사주 소각 의무화도 강조이재명 대통령이 증권사 리서치센터장들을 만나 추가적인 증시 활성화 정책 추진 가능성을 시사했다. 또한 비공개 오찬 자리에서는 자사주 소각 의무화의 필요성 등을 강조한 것으로 전해졌다. 18일 이 대통령은 이날 용산 대통령실에서 16개 증권사 리서,48분 전,https://www.mk.co.kr/news/stock/11423735,매일경제
"김건희특검, 세번째 당사 압색 … 국힘 의원들과 대치",https://static.mk.co.kr/trans_30x13.png,"김건희 여사 의혹들을 수사하는 민중기 특별검사팀이 18일 국민의힘 당사에 대한 세 번째 압수수색에 나섰다. 국민의힘은 소속 국회의원들을 소집해 압수수색을 저지하며 ""사법농단을 물타기하려는 시도이자 정당 활동의 자유를 침해하는 것""이라고 맞섰다. 김건희 특검은 이날 오전부터 '통일교 집단 입당' 의혹과 관련해 국민의힘 당사 압수수색에 돌입했다. 지난달 18일..",1시간 전,https://www.mk.co.kr/news/politics/11423696,매일경제
"김건희특검, 세번째 당사 압수수색…국민의힘 의원들과 대치",https://static.mk.co.kr/trans_30x13.png,"당원명부 안 뺏기려 저지 의원들 당사서 긴급 의총 “정당활동 자유 침해말라 사법농단 물타기” 반발김건희 여사 의혹들을 수사하는 민중기 특별검사팀은 18일 국민의힘 당사에 대한 세 번째 압수수색을 시도했다. 국민의힘은 소속 국회의원들을 소집해 압수수색을 저지하며 “사법농단을 물타기하려는 시도이고, 정당 활동의 자유를 침해하는 것”이라고 맞섰다. 김건희 특검은",2시간 전,https://www.mk.co.kr/news/politics/11423623,매일경제
"與, 내란재판부법 발의…野 ""독재정권 술수""",https://static.mk.co.kr/trans_30x13.png,"더불어민주당이 '내란·김건희·순직해병' 등 3대 특검 사건 재판을 각각 전담할 전담재판부 설치법을 18일 발의했다. 3대 특검 수사 관련 재판이 지연되고 있어 공정하고 신속한 재판을 위한 별도의 재판부가 필요하다는 주장이다. 국민의힘은 ""멀쩡한 사법부를 파괴하는 일""이라고 비판했다. 민주당 3대 특검 종합대응 특별위원회는 이날 '윤석열·김건희 등의 국정농..",3시간 전,https://www.mk.co.kr/news/politics/11423561,매일경제
"""美中 사이 최전선 설 위험"" 한국 가교 역할 강조한 李",https://static.mk.co.kr/trans_30x13.png,"이재명 대통령이 ""미국과 함께할 것이지만 한중 관계도 관리할 필요가 있다""는 뜻을 밝혔다. 한미 동맹을 바탕으로 주요 국가 정책을 수립하겠지만 중국을 소홀히 할 수 없다는 취지로 읽힌다. 이 대통령은 18일 공개된 미국 주간지 '타임' 인터뷰를 통해 ""한국이 두 진영 간 대립의 최전선에 서게 될 위험이 있다""면서 강대국 사이를 잇는 '가교(Bridge)' ..",3시간 전,https://www.mk.co.kr/news/politics/11423559,매일경제
형배 vs 형배 권력서열 공방,https://static.mk.co.kr/trans_30x13.png,"민형배 더불어민주당 의원이 문형배 전 헌법재판소장 권한대행을 직격했다. 문 전 대행이 '선출 권력 우위' 주장을 펼친 이재명 대통령에게 ""대한민국 헌법을 한번 읽어보시라""고 직격하자 엄호에 나선 모습이다. 민 의원은 지난 17일 페이스북에 ""문형배 전 재판관님, 권력에 '일종의 서열이 있다'는 말이 불편하신가요?""라는 제목으로 글을 게시했다. 민 의원은 ""..",3시간 전,https://www.mk.co.kr/news/politics/11423560,매일경제
"배임죄 폐지 띄운 與 ""대체 법안 검토 중""",,"더불어민주당이 기업 활동을 제약해온 '경제형벌' 제도를 합리화하기 위한 1차 개선 과제를 이달 안에 내놓는다. 민주당 경제형벌·민사책임 합리화 태스크포스(TF)는 18일 국회에서 2차 전체회의를 열고 배임죄 개정, 민생경제 형벌 합리화, 과도한 행정처분 완화 등 세 가지 주제를 중점 논의했다고 밝혔다. TF 단장인 권칠승 민주당 의원은 ""배임죄는 추상적이고..",3시간 전,https://www.mk.co.kr/news/politics/11423557,매일경제
SKT사태 보다 더 심하네…롯데카드 28만명 비밀번호까지 싹 털렸다,https://static.mk.co.kr/trans_30x13.png,"SKT 이어 또 최악 해킹사태 피해규모 당초 1.7GB라더니 297만 명 정보 200GB 유출 회사측 “피해 땐 전액 보상” 李 “범정부 보안 대책” 지시롯데카드에서 전체 고객 960만명의 3분의 1에 해당하는 297만명에 대한 정보가 유출되는 최악의 해킹사고가 발생했다. 이 중 28만명은 카드번호와 비밀번호, 유효기간, CVC번호, 주민번호, 생년월일",3시간 전,https://www.mk.co.kr/news/economy/11423555,매일경제
‘세계 최초 금지법’까지 만들었는데...왜 미국·유럽처럼 안 바뀌는 거죠? [뉴스 쉽게보기],https://static.mk.co.kr/trans_30x13.png,"우리 일상을 편하고 즐겁게 만들어주는 모바일 앱, 이제는 수많은 종류의 애플리케이션이 없는 세상을 상상하기도 힘들 정도인데요. 이런 앱들의 유통을 지배하는 회사는 단 두 곳이에요. 바로 구글과 애플이죠. 사실상 전 세계 이용자 대부분이 안드로이드 운영 체제의 ‘플레이스토어’와 iOS 운영 체제의 ‘앱스토어’에서 앱을 내려받고 있어요. 두 앱 마켓의 영향력이",방금 전,https://www.mk.co.kr/news/economy/11423240,매일경제
‘빅 컷’이 대세인 것처럼 하더니…나홀로 0.5%P 인하 외친 트럼프 책사,https://static.mk.co.kr/trans_30x13.png,FOMC 데뷔부터 ‘연준 흔들기’9개월 만의 기준금리 인하를 결정한 17일(현지시간) 미국 연방공개시장위원회(FOMC)에서 단연 눈길을 끈 건 이날 처음으로 연방준비제도(Fed·연준)에 합류한 스티븐 마이런 이사다. 백악관 국가경제자문위원장을 겸직하는 초유의 연준 위원이다. 마이런 이사는 이날 유일하게 반대표를 던졌다. 금리 방향에 대한 반대가 아니라 인하,방금 전,https://www.mk.co.kr/news/world/11423805,매일경제
“홈플러스 이어 여기도 MBK가 최대주주?”…롯데카드 인수 후 보안투자 줄였다,https://static.mk.co.kr/trans_30x13.png,"6년전 카드사 팔았던 롯데 해킹사태 탓에 애꿎은 피해 MBK, 롯데카드 매각 불투명롯데카드 해킹 사태와 관련해 대주주인 MBK파트너스가 보안 투자를 경시한 결과가 아니냐는 지적이 나온다. 추후 매각을 고려해 수익성을 극대화하는 데에만 집중하면서 반드시 지출해야 할 보안 관련 비용까지 줄였다는 의혹이 나온다. 고객 수백만 명의 정보가 유출되면서 롯데 브랜드를",방금 전,https://www.mk.co.kr/news/economy/11423803,매일경제
금리인하 부담 던 韓銀 …'고공행진' 서울 집값 변수로,,미국이 기준금리 인하를 재개하면서 역대 최대인 2%포인트까지 벌어졌던 한미 간 금리 격차가 1.75%포인트로 줄었다. 이로써 한국은행의 통화정책 운용 여력이 커짐에 따라 오는 10월 금리 인하 가능성이 제기된다. 다만 10월 23일로 예정된 한은 금융통화위원회 통화정책방향 회의 전까지 서울 집값이 계속 과열 양상을 띠고 가계부채가 다시 팽창한다면 금리를 동..,방금 전,https://www.mk.co.kr/news/economy/11423775,매일경제
"미국 덕에 부담 덜었지만…한은 10월 금리인하, 달아오른 서울 집값이 변수",https://static.mk.co.kr/trans_30x13.png,"10월 금리인하 가능성 제기 한미 금리차 줄며 정책 여력↑ 부동산 과열 지속 땐 동결압박 방미 이창용, IMF 특별 강연 “韓, 양적완화 사실상 불가능”미국이 기준금리 인하를 재개하면서 역대 최대인 2%포인트까지 벌어졌던 한미 간 금리 격차가 1.75%포인트로 줄었다. 이로써 한국은행의 통화정책 운용 여력이 커짐에 따라 오는 10월 금리 인하 가능성이",방금 전,https://www.mk.co.kr/news/economy/11423609,매일경제
수익 높이려 꼼수 부리더니…결국 배탈 난 ‘배민’ [카드뉴스],https://static.mk.co.kr/trans_30x13.png,"8.7%. 최근 서울시가 프랜차이즈 가맹점 186곳 실태조사 결과 집계된 매장당 평균 영업이익률입니다. 1만원 음식을 팔면 점주 손에 남는 돈이 870원이라는 얘기죠. 가뜩이나 불황으로 매출이 부진한데, 그마저도 여기저기 떼어가고 나면 남는 돈이 없습니다. 높은 인건비와 임대료, 원부자재 가격도 문제지만 ‘배달 플랫폼’이 저마진 원흉 중 하나로 꼽힙니다.",방금 전,https://www.mk.co.kr/news/economy/11423759,매일경제
SK텔레콤 이어 KT·롯데카드까지…‘해킹 포비아’ 대한민국 [카드뉴스],https://static.mk.co.kr/trans_30x13.png,"대한민국이 ‘해킹 포비아’에 빠졌습니다. 하루가 멀다 하고 해킹 사건이 터지죠. 무려 2300만여명 개인 정보가 유출된 SK텔레콤 해킹 사태에 이어 KT 무단 소액결제 피해까지 발생하면서 통신사들이 ‘해킹 공포’에 휩싸였습니다. 한국 통신 업계 보안 난맥상이 고스란히 드러났다는 우려죠. 그뿐인가요. 롯데카드, 예스24 등 주요 기업도 해킹 피해에 시달리는",방금 전,https://www.mk.co.kr/news/economy/11423757,매일경제
“알리가 새벽배송까지 해버리면”...지마켓과 ‘한지붕 두 가족’ 이커머스 지각변동,https://static.mk.co.kr/trans_30x13.png,"점유율 40% 넘는 압도적 1위 독점우려에 고객DB 공유 제한 알리의 자본 네트워크에 K셀러 200개국 판로 생겨 G마켓, 동남아 5개국 진출 신세계 유통 노하우 더해 한국 1800만명 소비자 확보 알리, 고부가상품 확대 예고G마켓과 알리익스프레스의 기업결합에 ‘소비자 데이터 공유 차단’을 핵심 조치로 하는 조건부 승인 결과가 나온 데는 해외 직구 시장",방금 전,https://www.mk.co.kr/news/economy/11423754,매일경제
"고용 불안에 무게 둔 파월…연준, 올해 안에 기준금리 인하 ‘두 번 더’",https://static.mk.co.kr/trans_30x13.png,연준 기준금리 0.25%P 인하 트럼프 2기들어 처음으로 내려 백악관 압박에도 ‘스몰컷’ 결론 기존 ‘노동시장 견조’ 문구빼고 결정문에 “취업자 둔화” 추가 파월 “위험관리 차원의 인하” 매파 발언으로 기조전환 일축미국 중앙은행인 연방준비제도(Fed·연준)가 9개월 만에 기준금리를 내리면서 연내 두 차례 추가 인하를 시사했다. 작년 비농업 일자리가 9,3분 전,https://www.mk.co.kr/news/world/11423749,매일경제
윌슨·살로몬·아크테릭스…대세 브랜드 ‘寶庫’ [미장 보석주],https://static.mk.co.kr/trans_30x13.png,"(24) 아머스포츠글로벌 스포츠 용품 제조사 아머스포츠에 서학개미 관심이 집중된다. 지난해 글로벌 러닝 열풍에 호카·온 등 신생 브랜드가 급성장한 가운데, 올해는 그 주인공이 아머스포츠가 될 것이라는 전망이다. 회사는 매 분기 시장 기대치를 웃도는 실적을 발표하며 대세라는 사실을 입증하고 있다. 주가도 반응하며 증권가는 아머스포츠를 향한 눈높이를 높여 잡는",25분 전,https://www.mk.co.kr/news/economy/11417974,매일경제
"“안 치우면 벌금”…‘베를린 평화의 소녀상’ 철거 위기, 무슨 일?",https://static.mk.co.kr/trans_30x13.png,독일 베를린에 위치한 ‘평화의 소녀상’이 철거 위기에 놓였다. 18일 일본 민영 TBS계열 JNN에 따르면 베를린 미테구 측은 최근 시민단체 코리아협의회에 평화의 소녀상을 다음달 7일까지 철거하라고 명령했다. 그러면서 철거하지 않을 경우 과태료 3000유로(약 490만원)를 부과하겠다고도 밝혔다. 코리아협의회는 2020년 9월부터 베를린 미테구 공공부지에,방금 전,https://www.mk.co.kr/news/society/11423812,매일경제
‘세계 최초 금지법’까지 만들었는데...왜 미국·유럽처럼 안 바뀌는 거죠? [뉴스 쉽게보기],https://static.mk.co.kr/trans_30x13.png,"우리 일상을 편하고 즐겁게 만들어주는 모바일 앱, 이제는 수많은 종류의 애플리케이션이 없는 세상을 상상하기도 힘들 정도인데요. 이런 앱들의 유통을 지배하는 회사는 단 두 곳이에요. 바로 구글과 애플이죠. 사실상 전 세계 이용자 대부분이 안드로이드 운영 체제의 ‘플레이스토어’와 iOS 운영 체제의 ‘앱스토어’에서 앱을 내려받고 있어요. 두 앱 마켓의 영향력이",방금 전,https://www.mk.co.kr/news/economy/11423240,매일경제
‘빅 컷’이 대세인 것처럼 하더니…나홀로 0.5%P 인하 외친 트럼프 책사,https://static.mk.co.kr/trans_30x13.png,FOMC 데뷔부터 ‘연준 흔들기’9개월 만의 기준금리 인하를 결정한 17일(현지시간) 미국 연방공개시장위원회(FOMC)에서 단연 눈길을 끈 건 이날 처음으로 연방준비제도(Fed·연준)에 합류한 스티븐 마이런 이사다. 백악관 국가경제자문위원장을 겸직하는 초유의 연준 위원이다. 마이런 이사는 이날 유일하게 반대표를 던졌다. 금리 방향에 대한 반대가 아니라 인하,방금 전,https://www.mk.co.kr/news/world/11423805,매일경제
엔비디아 지분투자 인텔 22% 급등....미 3대 지수 모두 사상 최고치,https://static.mk.co.kr/trans_30x13.png,"엔비디아가 인텔에 50억달러를 투자한다는 소식과 연방준비위원회(FOMC)의 금리 인하 결정 등의 영향으로 미국 증시가 일제히 사상 최고치를 기록했다. 18일(현지 시각) 뉴욕증시에서 다우는 0.27%, S&P500은 0.48%, 나스닥은 0.94% 각각 상승했다. 나스닥의 상승 폭이 가장 큰 것은 인텔은 물론 엔비디아도 랠리했기 때문이다. 이로써 3대지수는",방금 전,https://www.mk.co.kr/news/world/11423797,매일경제
"엔비디아, 50억弗 인텔 투자 ""PC·데이터센터용 칩 협력""",,"엔비디아가 인텔에 50억달러(약 6조9350억원)를 투자한다. 엔비디아는 18일(현지시간) 성명을 통해 ""PC·데이터센터용 칩 공동 개발에 나선다""면서 이같이 발표했다. 로이터통신에 따르면 엔비디아는 인텔 보통주를 주당 23.28달러에 매입하기로 했다. 이는 전날 종가(24.90달러)보다 낮지만 지난달 미국 정부가 인텔 지분 10%를 취득하며 지급한 주당 ..",방금 전,https://www.mk.co.kr/news/world/11423781,매일경제
韓日 쥐어짜던 트럼프…英엔 환대받고 283조원 투자선물,https://static.mk.co.kr/trans_30x13.png,한국과 일본 등 미국의 아시아 동맹국에 대미 투자를 압박한 도널드 트럼프 미 대통령이 영국에는 대규모 투자 보따리를 풀었다. 한국에 3500억달러 규모 대미 투자를 압박하고 일본에서는 5500억달러의 대미 투자를 약속받은 모습과 대비됐다. 영국 정부는 18일(현지시간) 영국이 트럼프 대통령의 국빈 방문을 계기로 미국 기업에서 1500억파운드(약 283조원)..,방금 전,https://www.mk.co.kr/news/world/11423780,매일경제
“반려견 탑승 안됩니다”…벨기에서 개 유기한 뒤 홀로 떠난 견주,https://static.mk.co.kr/trans_30x13.png,벨기에 공항에서 반려견이 비행하기에 어려운 종이라는 이유로 ‘동반 탑승’이 거절되자 개를 유기한 뒤 홀로 탑승한 일이 벌어졌다는 외신의 보도가 나왔다. 18일(현지 시간) 브뤼셀타임스 등 현지 보도에 따르면 브뤼셀 동물보호소인 ‘SRPA 베웨이드’에는 지난주 보호소 문 앞으로 ‘파코’라는 이름의 아메리칸 불리 한 마리가 배달됐다. 보호소 측은 “공항에서 파,방금 전,https://www.mk.co.kr/news/world/11423773,매일경제
‘황금마차 타고 호화 만찬’ 대접받은 트럼프…영국서 푼 ‘투자 보따리’ 규모가 무려,https://static.mk.co.kr/trans_30x13.png,미국 대통령으로는 처음으로 영국을 두 번째로 국빈방문한 도널드 트럼프 대통령이 찰스 3세 국왕을 비롯한 영국 왕실 주요 인사들로부터 극진한 환대를 받았다. 윈저성 세인트조지홀에서 열린 성대한 국빈 만찬이 그 정점이었다. 그가 평소 갈망해왔던 대로 최고 수준의 의전을 제공받은 트럼프 대통령은 영국에 막대한 규모의 ‘투자 보따리’를 안기며 화답했다. 17일(현,방금 전,https://www.mk.co.kr/news/world/11423772,매일경제
“수영만 했을 뿐인데”… 인도서 ‘뇌 먹는 아메바’ 감염 확산,https://static.mk.co.kr/trans_30x13.png,"인도, 올해만 19명 사망 치료제 없어 치사율 95%인도 남부 켈라라주(州)에서 ‘아메바성 뇌수막염’으로 인한 사망자가 올해에만 19명이 나온 가운데, 수영장에서 10대 소년들이 감염된 만큼 사전에 소독이 효과적인 예방법이라는 외신의 보도가 나왔다. 18일(현지 시각) 현지 매체 마드야맘 등의 보도에 따르면 케랄라주 보건당국은 최근 병원에서 약 일주일간 치",방금 전,https://www.mk.co.kr/news/world/11423766,매일경제
"고용 불안에 무게 둔 파월…연준, 올해 안에 기준금리 인하 ‘두 번 더’",https://static.mk.co.kr/trans_30x13.png,연준 기준금리 0.25%P 인하 트럼프 2기들어 처음으로 내려 백악관 압박에도 ‘스몰컷’ 결론 기존 ‘노동시장 견조’ 문구빼고 결정문에 “취업자 둔화” 추가 파월 “위험관리 차원의 인하” 매파 발언으로 기조전환 일축미국 중앙은행인 연방준비제도(Fed·연준)가 9개월 만에 기준금리를 내리면서 연내 두 차례 추가 인하를 시사했다. 작년 비농업 일자리가 9,3분 전,https://www.mk.co.kr/news/world/11423749,매일경제
"단 6일이 문제? 안우진, 재활 중 엔트리 등록 꼼수 or 배려 논란",https://static.mk.co.kr/trans_30x13.png,꼼수인가 배려인가? 단 6일이 문제였을까. 부상 재활 중인 안우진(26)을 1군 엔트리에 등록시킨 키움 히어로즈의 결정이 야구팬들에게 많은 논란을 불러일으키고 있다. 키움히어로즈(대표이사 위재민)는 19일 “군 복무를 마친 투수 안우진을 선수 본인의 요청에 따라 18일 확대 엔트리에 등록한다”고 밝혔다. 이로써 안우진은 18일 잠실 두산전부터 정규시즌 최종,방금 전,https://www.mk.co.kr/news/sports/11423813,매일경제
"[오피셜] ‘손흥민 월클’ 만든 ‘무버지’가 돌아왔다... 무리뉴, 25년 만에 벤피카 복귀···‘2027년 6월까지 이끈다”",https://static.mk.co.kr/trans_30x13.png,조세 무리뉴 감독이 25년 만에 벤피카(포르투갈)로 돌아왔다. 벤피카는 9월 19일 “새 사령탑으로 무리뉴 감독을 선임했다”며 “계약 기간은 2027년 6월까지”라고 발표했다. 무리뉴 감독은 “내게 1순위는 벤피카였다”며 “벤피카보다 매력적으로 느껴진 팀은 없었다”고 말했다. 이어 “나는 이 환상적인 클럽을 위해 최선을 다할 거다. 그게 나의 임무이자 영광,방금 전,https://www.mk.co.kr/news/sports/11423811,매일경제
"‘해트트릭 작렬’ 손흥민, MLS 34라운드 MVP 선정",https://static.mk.co.kr/trans_30x13.png,해트트릭을 기록한 로스앤젤레스FC 손흥민이 MLS 34라운드 최고 선수에 선정됐다. MLS 사무국은 19일(한국시간) 손흥민을 라운드 MVP에 해당하는 매치데이34 ‘플레이어 오브 더 매치데이’에 선정했다고 발표했다. 손흥민이 플레이어 오브 더 매치데이에 선정된 것은 MLS 진출 이후 처음이다. 손흥민은 전날 열린 레알 솔트레이크와 원정경기에서 해트트릭을,방금 전,https://www.mk.co.kr/news/sports/11423808,매일경제
"‘괴물’ 홀란 최단기 ‘챔스’ 50골! 맨시티, 도쿠 쇼타임 힘입어 콘테의 ‘카테나치오’ 뚫었다…나폴리전 1R 2-0 완승 [챔피언스리그]",https://static.mk.co.kr/trans_30x13.png,"‘괴물’ 홀란이 최단기 챔피언스리그 50골을 기록, 맨체스터 시티에 승리를 안겼다. 맨시티는 19일(한국시간) 영국 맨체스터의 에티하드 스타디움에서 열린 나폴리와의 2025-26 UEFA 챔피언스리그 리그 페이즈 1라운드 홈 경기에서 1-0으로 승리했다. 맨시티는 디 로렌초의 퇴장으로 인한 수적 우위에도 전반 내내 득점하지 못했다. 밀린코비치 사비치의 환상",방금 전,https://www.mk.co.kr/news/sports/11423807,매일경제
"레전드가 떠난다...클레이튼 커쇼, 2025시즌 이후 은퇴 선언 [오피셜]",https://static.mk.co.kr/trans_30x13.png,레전드가 떠난다. LA다저스 구단은 19일(한국시간) 구단 공식 소셜 미디어를 통해 좌완 선발 클레이튼 커쇼(37)가 이번 시즌 이후 은퇴를 결정했다고 발표했다. 커쇼는 하루 뒤 샌프란시스코 자이언츠와 홈경기에서 정규시즌 마지막 다저스타디움 등판을 가질 예정이다. 커쇼는 이번 시즌 다저스와 1년 750만 달러에 재계약했다. 이번 시즌 이후 계약이 만료되는데,방금 전,https://www.mk.co.kr/news/sports/11423801,매일경제
"‘가수 김정민 아들’ 다니 다이치, 日이 주목한다! 고교 리그 Top4 유망주로 선정…“정신적 강인함, 미래 기대감 높여”",https://static.mk.co.kr/trans_30x13.png,"가수 김정민의 아들 다니 다이치가 일본의 주목을 받고 있다. 일본 매체 ‘풋볼 트라이브’는 최근 JFA U-18 프리미어리그 2025 WEST에서 주목해야 할 선수 4명을 선정했다. U-18 프리미어리그는 J리그 클럽 아카데미, 일본 고교 축구 팀들이 경쟁하는 무대다. 그리고 다이치는 이곳에서도 주목받는 선수로 평가받았다. ‘풋볼 트라이브’는 사간 도스 U",방금 전,https://www.mk.co.kr/news/sports/11423796,매일경제
‘맙소사’ 황인수의 UFC 드림 정말 끝인가? 美 매체의 가혹한 평가 “다소 굳어 있고 겁먹었어”…‘코좀’ 정찬성은 포기하지 않았다,https://static.mk.co.kr/trans_30x13.png,“황인수는 다소 굳어 있고 겁먹은 경기 운영을 고집했다.” 황인수는 지난 17일(한국시간) 미국 네바다주 라스베거스 UFC 에이펙스에서 열린 패디 맥코리와의 데이나 화이트 컨텐더 시리즈 시즌 9 에피소드 6 미들급 매치에서 졸전 끝 3라운드 만장일치 판정 패배했다. 황인수에게 있어 이번 맥코리전은 두 번째 UFC 도전이었다. 지난 루킹 포 어 파이트에서 한,방금 전,https://www.mk.co.kr/news/sports/11423793,매일경제
