title,thumbnail,short_content,write_time,link,company
민주 “대장동은 애초에 무리한 기소”...국힘 “이재명 정권 몰락 신호탄”,https://static.mk.co.kr/trans_30x13.png,"대장동 항소포기 충돌 격화 민주, 檢반발에 프레임 전환 “친윤 정치검찰이 내란 뿌리” 국힘, 대검·법무부 앞서 규탄 “국정조사·특검 실시해야” 양당 원내대표 만나 긴급논의검찰의 대장동 사건 항소심 포기를 두고 국민의힘은 11일 장외 투쟁에 나서며 이재명 대통령 탄핵까지 거론하기 시작했다. 반면 더불어민주당은 친윤(친윤석열) 정치 검찰의 ‘검란’으로 규",방금 전,https://www.mk.co.kr/news/politics/11465914,매일경제
[속보] 조태용 전 국정원장 구속영장 발부…“증거 인멸 염려”,https://static.mk.co.kr/trans_30x13.png,직무유기와 국정원법 위반 등 혐의를 받는 조태용 전 국정원장이 구속됐다. 12일 법조계에 따르면 이날 서울중앙지법 박정호 영장전담 부장판사는 전날 조 전 원장의 구속 전 피의자 심문(영장실질심사)을 진행한 뒤 “증거를 인별할 염려가 있다”며 영장을 발부했다. 조 전 원장은 윤석열 전 대통령의 대국민 담화 이전 비상계엄 선포 계획을 알았음에도 국회에 보고하지,방금 전,https://www.mk.co.kr/news/politics/11465905,매일경제
1800여만원 받고 중국에 군사기밀 넘긴 현역 병장...징역 5년 선고,https://static.mk.co.kr/trans_30x13.png,"중국군 정보조직에 군사기밀을 유출한 현역 병사가 중형을 선고받았다. 제3지역군사법원은 11일 일반 이적과 군기누설, 부정처사후수뢰, 정보통신망법 위반, 성매매처벌법 위반 등 혐의로 기소된 A씨에게 징역 5년과 1800여만원 추징 명령을 내렸다. 공소사실에 따르면 A 병장은 지난해 8월 휴가 기간 중국 베이징에 간 A 병장은 중국 정보조직의 조직원을 만났다.",방금 전,https://www.mk.co.kr/news/politics/11465867,매일경제
이재명 대통령 “내란협조 공무원 조사 당연”...정부 내년 1월까지 색출,https://static.mk.co.kr/trans_30x13.png,국무회의서 헌법존중TF 승인 49개부처 공무원 계엄가담 조사 李 “특검 의존 말고 독자조사를” 혐오 정당현수막 근절책 지시 사실적시 명예훼손 폐지 검토 암표상에 30배 과징금 물릴것 金총리 “경찰개혁안 마련을”이재명 대통령 지시로 12·3 비상계엄에 동조한 공직자들을 솎아내는 적폐 청산 작업이 개시되면서 공직사회에 인사 폭풍이 몰아칠 전망이다. 대통령,7분 전,https://www.mk.co.kr/news/politics/11465862,매일경제
벨기에 극우정당 이름이 ‘트럼프’가 된 이유는?,https://static.mk.co.kr/trans_30x13.png,트럼프 ‘포퓰리즘’ 정치 매료돼 “우리가 지지하는 것 즉시 구현” 파시즘 옹호 인사 창단멤버 포함유럽연합(EU) 본부가 위치한 벨기에에서 도널드 트럼프 미국 대통령의 포퓰리즘 정치를 이상향으로 생각해 당명까지 ‘트럼프’로 지은 극우 정당이 출범했다. 10일(현지시) 정치전문 매체 폴리티코 유럽판에 따르면 벨기에 극우정당 ‘국민전선’의 전 대표인 살바토레 니,12분 전,https://www.mk.co.kr/news/politics/11465860,매일경제
남편들 아내에게 미안해지는 한마디...“100만원 가방이 무슨 뇌물? 보편적인 백”,https://static.mk.co.kr/trans_30x13.png,"아크로비스타서 나온 ‘로저비비에’ 클러치백 두고 성일종 의원, 11일 라디오 인터뷰서 밝혀 김기현 의원 “배우자가 전달” 인정김기현 국민의힘 의원 배우자가 김건희 여사에게 100만원대 ‘로저 비비에’ 명품 가방을 선물한 사실과 관련 성일종 국민의힘 의원이 “100만원 정도 되는 백이 무슨 뇌물이냐”고 주장했다. 성 의원은 11일 KBS 라디오 ‘전격시사’",1시간 전,https://www.mk.co.kr/news/politics/11465835,매일경제
국힘 김승수 의원 “입법으로 세운4구역 건축 막겠다는건 위헌적 발상”,https://static.mk.co.kr/trans_30x13.png,"국민의힘 김승수 의원이 세운4구역 건물 높이 변경을 “입법을 통해서라도 막겠다”는 정부와 여당에 대해 “3권분립을 이해하지 못하는 반헌법적 발상”이라고 비판했다. 11일 국회 문화체육관광위원회 소속 김승수 국민의힘 의원은 이날 문체위 전체회의 질의에서 “법령개정등 모든 수단 동원해서 막는다고 했는데, 장관님 3권분립이 뭔지 알고 있느냐”고 물었다. 이어 “",3시간 전,https://www.mk.co.kr/news/politics/11465793,매일경제
계엄 동조했던 공직자 다 솎아낸다…‘이재명 정부표 적폐청산’,https://static.mk.co.kr/trans_30x13.png,‘헌법존중 TF’ 총리 건의에 李대통령 “당연히 해야할 일” 내년 1월 말까지 조사활동정부가 국무총리실 산하에 ‘헌법존중 정부혁신 태스크포스(TF)’를 설치하고 지난해 12·3 비상계엄에 협력한 공직자 색출에 나선다. 오는 21일까지 49개 중앙행정기관에 기관별 TF가 설치되고 내년 1월 말까지 고위 공직자를 중심으로 비상계엄 동조 여부에 대한 조사가 진행,3시간 전,https://www.mk.co.kr/news/politics/11465780,매일경제
"관가 덮친 내란發 인사폭풍…李 ""계엄 관여자 문책·인사조치를""",https://static.mk.co.kr/trans_30x13.png,이재명 대통령 지시로 12·3 비상계엄에 동조한 공직자들을 솎아내는 적폐 청산 작업이 개시되면서 공직사회에 인사 폭풍이 몰아칠 전망이다. 대통령실은 정부 내 소위 '내란세력'이 여전히 주요 보직에서 근무하면서 새 정부 국정과제를 추진하는 데 저해 요인으로 작용한다고 보고 있다. 이에 따라 그동안 군 수뇌부와 검찰 등 계엄에 적극 동조한 기관에 집중됐던 인사..,3시간 전,https://www.mk.co.kr/news/politics/11465747,매일경제
'김혜경 여사 보좌' 제2부속실장에 오상호,https://static.mk.co.kr/trans_30x13.png,"이재명 대통령 부인 김혜경 여사를 보좌하는 업무를 맡는 대통령실 제2부속실장에 오상호 전 노무현재단 사무총장(사진)이 임명된 것으로 11일 알려졌다. 오 실장은 참여정부 당시 마지막 청와대 의전비서관을 지내며 노무현 전 대통령을 수행했다. 현재까지 노 전 대통령 부인 권양숙 여사의 비서관으로 근무해왔다. 대통령실 관계자는 ""참여정부 당시 청와대 내에서 의전..",3시간 전,https://www.mk.co.kr/news/politics/11465745,매일경제
대한민국 시계 1시간 뒤로 미뤄지는 이날…“은행도 10시에 문 열어요”,https://static.mk.co.kr/trans_30x13.png,"2026학년도 대학수학능력시험이 치러지는 13일 은행들이 1시간 늦게 문을 열고 1시간 늦게 닫기로 했다. 11일 은행연합회에 따르면 전국 은행 영업점은 13일 오전 10시에 열고 오후 5시에 폐점한다. 은행연합회 측은 “시험일 아침 수험생과 감독관, 학부모 등의 이동으로 교통수요가 급증할 것으로 예상된다”면서 “원활한 교통 소통을 위해 은행 영업시간을 시",방금 전,https://www.mk.co.kr/news/economy/11465913,매일경제
"“차라리 젊은 사람 두 명 뽑죠”...연공서열 임금구조, 정년연장엔 독 된다",https://static.mk.co.kr/trans_30x13.png,"정년연장에 대한 논쟁은 사회 각계가 저마다 다른 목소리를 낸다. 단답형으로 풀 수 있는 문제가 아니다. 저출생·초고령화로 인한 노동시장의 급박한 변화, 국민연금 수급 시점의 불일치 등 복합적이면서도 구조적인 문제를 토대로 하고 있기 때문이다. 양대 노총과 여당은 연내 입법을 강조하고 있다. 하지만 ‘서두르는 것이 답이 아니다’는 게 전문가들의 공통적 인식이",방금 전,https://www.mk.co.kr/news/economy/11465909,매일경제
"“어르신, 장기투자가 말처럼 쉽나요?”...50% 넘는 폭락도 버텼다는 이 남자",https://static.mk.co.kr/trans_30x13.png,"워렌 버핏의 마지막 편지 “60년간 3번 폭락, 절망 않았다” 은퇴 직전 주주서한 보내 후계자 에이블에 무한신뢰 “그보다 나은 CEO는 없어” 지분 팔지 않겠다 강조도“우리의 주가는 변덕스러울 것이다. 60년 동안 세 번 일어났던 것처럼 때때로 50% 정도 하락할 것이다. 그래도 절망하지 말라. 미국은 돌아올 것이고 버크셔 주식도 돌아올 것이다.” 끝까지",방금 전,https://www.mk.co.kr/news/economy/11465907,매일경제
"“우리 경쟁상대는 로펌, 변호사님 모셔요”…‘수천조 시장’ 공들이는 은행들",https://static.mk.co.kr/trans_30x13.png,수천조 고령층 자산 공략위해 전담조직 만득고 전문가 영입올 하반기 일제히 시니어 전문 브랜드를 내놓은 4대 시중은행이 시니어 고객을 공략하기 위해 신탁 전문 변호사 영입 경쟁에 나서고 있다. 시니어 자산 관리 수요가 커지는 가운데 로펌까지 이 시장에 본격 가세하면서 금융권의 인력 확보전이 더욱 속도를 내는 모습이다. 11일 금융권에 따르면 KB국민은행은 지,8분 전,https://www.mk.co.kr/news/economy/11465861,매일경제
“무슨 세금 면제를 53년씩 해주나”…관행적 특례연장에 줄줄 새는 나랏돈,https://static.mk.co.kr/trans_30x13.png,한시적세혜택 주는 조세특례 올해 72건 중 7건만 종료 예정 50년 넘은 선박 유류세 감면 혜택유지한채 기간 늘리기로 정치권은선심성 연장 남발해 “과감한 특례축소 폐지 필요”세금을 일시적으로 감면하는 조세특례 가운데 대부분이 수차례 연장되면서 특례 일몰이 매년 기계적으로 미뤄지고 있다는 지적이 나온다. 전문가들은 세제당국과 국회가 조세특례를 면밀히 심사해,29분 전,https://www.mk.co.kr/news/economy/11465856,매일경제
“잠재성장률 2%까지 끌어 올려라”...경제 기초체력 살릴 ‘회심의 카드’는,https://static.mk.co.kr/trans_30x13.png,"李, 지속발전 토대 구축 강조 “경제 기초체력 더 강화해야” 4대 과제에 정책역량 총동원 부동산·물가 안정에도 주력 올해·내년 성장률 높인 KDI 지나친 부양책 의존은 경계 노동 등 구조개혁 박차 주문이재명 대통령이 국내 주식시장에서 장기 투자할 경우 세제 혜택을 강화해야 한다고 주문했다. 구윤철 경제부총리 겸 기획재정부 장관도 이 대통령의 지시에 따라",3시간 전,https://www.mk.co.kr/news/economy/11465806,매일경제
달러당 원화값 이러다 1500원까지…환율 7개월 만에 최저,https://static.mk.co.kr/trans_30x13.png,달러당 1463.3원…7개월 만에 최저 ‘美 셧다운 종료’ 임박하자 强달러달러당 원화값이 1460원대로 급락했다. 미국 연방정부 셧다운이 곧 종료될 것이란 기대감으로 강달러 흐름이 나타난 가운데 ‘서학개미’의 지속적인 미국 증시 투자도 한 원인으로 지목된다. 11일 서울 외환시장에서 달러당 원화값은 전날보다 11.9원 내린 1463.3원으로 오후 정규장을,3시간 전,https://www.mk.co.kr/news/economy/11465778,매일경제
“주식 장기투자때 혜택주는 방안 만들라”…증시 활성화에 진심인 대통령,https://static.mk.co.kr/trans_30x13.png,"정부, MSCI 선진지수 편입 등 내년 경제성장전략 제시 KDI, 내년 성장률 1.6→1.8%…올 전망도 0.1%P 상향이재명 대통령이 증시를 활성화하고 시중 자금의 부동산 쏠림을 완화하기 위해 장기 주식투자에 대한 세제 혜택 등 인센티브 방안을 마련하라고 지시했다. 11일 오전 서울 용산 대통령실에서 열린 국무회의에서 이 대통령은 “일반 투자자의 장기 투",3시간 전,https://www.mk.co.kr/news/economy/11465776,매일경제
부산상의 인도에 경제사절단 파견…지역 기업 인도 진출 발판 마련,https://static.mk.co.kr/trans_30x13.png,"부산상공회의소가 인도 경제단체와 유기적인 협력체제를 구축하며 지역 기업의 인도 진출 발판을 마련했다. 부산상공회의소는 지난 3일부터 11일까지 인도 델리, 첸나이 지역에 경제 사절단을 파견했다. 부산상의 경제사절단의 이번 인도 방문은 빠르게 성장하는 초대형 경제권인 인도와의 정책·산업·기업 네트워크를 강화하고, 글로벌 공급망이 재편되는 상황에서 부산 기업의",3시간 전,https://www.mk.co.kr/news/economy/11465751,매일경제
원화 약세…'魔의 1500원' 위협,https://static.mk.co.kr/trans_30x13.png,달러당 원화값이 1460원대로 급락했다. 미국 연방정부 셧다운이 곧 종료될 것이란 기대감으로 강달러 흐름이 나타난 가운데 '서학개미'의 지속적인 미국 증시 투자도 한 원인으로 지목된다. 11일 서울 외환시장에서 달러당 원화값은 전날보다 11.9원 내린 1463.3원으로 오후 정규장을 마감했다. 오후 종가 기준으로 원화값이 1460원 아래로 떨어진 것은 지난..,3시간 전,https://www.mk.co.kr/news/economy/11465741,매일경제
"“관세 때문에 미국 제조업 다 죽을 판”...폭등하는 알루미늄값, 시장 패닉",https://static.mk.co.kr/trans_30x13.png,미국에서 알루미늄 현물 가격이 사상 최고치를 기록했다. 도널드 트럼프 행정부가 수입 알루미늄에 대한 관세를 50%로 인상한 데다 세계적인 공급난이 겹치면서 실제 거래 가격이 급등했다. 산업 보호를 내세운 관세 정책이 도리어 원자재 가격을 끌어올리며 인플레이션을 촉발하는 한편 제조업 전반의 부담으로 이어지고 있다는 분석이 나온다. 10일(현지시간) 로이터통신,방금 전,https://www.mk.co.kr/news/world/11465911,매일경제
"“어르신, 장기투자가 말처럼 쉽나요?”...50% 넘는 폭락도 버텼다는 이 남자",https://static.mk.co.kr/trans_30x13.png,"워렌 버핏의 마지막 편지 “60년간 3번 폭락, 절망 않았다” 은퇴 직전 주주서한 보내 후계자 에이블에 무한신뢰 “그보다 나은 CEO는 없어” 지분 팔지 않겠다 강조도“우리의 주가는 변덕스러울 것이다. 60년 동안 세 번 일어났던 것처럼 때때로 50% 정도 하락할 것이다. 그래도 절망하지 말라. 미국은 돌아올 것이고 버크셔 주식도 돌아올 것이다.” 끝까지",방금 전,https://www.mk.co.kr/news/economy/11465907,매일경제
"한국인 인기 여행지, 베트남서 집단 식중독…“살모넬라균 원인 추정”",https://static.mk.co.kr/trans_30x13.png,"한국인의 인기 여행지인 베트남에서 반미 샌드위치를 먹은 230여명이 식중독 증세를 호소하고 있다. 반미 샌드위치는 베트남식 바게트 샌드위치다. 11일 베트남 현지 매체 VN익스프레스 보도에 따르면 최근 호치민 샌드위치 체인점 매장 두 곳에서 반미 샌드위치를 사 먹은 230여명이 복통과 구토, 설사, 발열 등 식중독 증세를 보였다. 증세를 보인 이들은 병원",방금 전,https://www.mk.co.kr/news/world/11465883,매일경제
"민주당 ‘분열’에 허무하게 끝났다…역대 최장 41일 셧다운, 해제 초읽기",https://static.mk.co.kr/trans_30x13.png,"역대 최장 기간을 기록한 미국 연방정부의 셧다운(일시적 업무 중지) 해제가 초읽기에 들어갔다. 임시 예산안이 10일(현지시간) 상원에서 통과됐기 때문이다. 앞으로 임시 예산안이 하원을 통과하고 도널드 트럼프 대통령의 서명을 거치면 셧다운은 종료된다. 상원은 이날 밤 열린 본회의에서 연방정부 임시 예산안에 대한 표결을 진행해 찬성 60표, 반대 40표로 가결",방금 전,https://www.mk.co.kr/news/world/11465874,매일경제
벨기에 극우정당 이름이 ‘트럼프’가 된 이유는?,https://static.mk.co.kr/trans_30x13.png,트럼프 ‘포퓰리즘’ 정치 매료돼 “우리가 지지하는 것 즉시 구현” 파시즘 옹호 인사 창단멤버 포함유럽연합(EU) 본부가 위치한 벨기에에서 도널드 트럼프 미국 대통령의 포퓰리즘 정치를 이상향으로 생각해 당명까지 ‘트럼프’로 지은 극우 정당이 출범했다. 10일(현지시) 정치전문 매체 폴리티코 유럽판에 따르면 벨기에 극우정당 ‘국민전선’의 전 대표인 살바토레 니,12분 전,https://www.mk.co.kr/news/politics/11465860,매일경제
"“남편 대신 임신시켜 주면, 사례금 5억”…SNS서 퍼지는 신종 사기",https://static.mk.co.kr/trans_30x13.png,일본의 한 남성이 “남편 대신 임신시켜 주면 사례하겠다”는 여성의 말에 속아 약 400만원을 빼앗긴 사연이 알려졌다. 남성은 성공 시 사례금으로 5억원을 주겠다는 말을 듣고선 계약 보증금을 입금한 것으로 전해졌다. 11일 야후재팬 등 외신에 따르면 일본 시모노세키에 사는 60대 남성 A씨는 최근 소셜미디어(SNS)에서 알게 된 여성에게 속아 43만엔(약 4,1시간 전,https://www.mk.co.kr/news/world/11465845,매일경제
‘정년 65세’ 안착시킨 12년 큰 그림…일본 기업 85%가 택한 정책은?,https://static.mk.co.kr/trans_30x13.png,일본에서 ‘서브웨이’와 ‘TGI 프라이데이’ 등 다양한 외식업을 하는 와타미는 지난달 정년을 65세로 올렸다. 이와 함께 75세까지 재고용 형태로 직장 생활을 할 수 있게 했다. 인력난에 대응하는 동시에 노년층에게 일할 기회도 주기 위한 정책이다. 고령자 문제를 먼저 겪은 일본은 25년 전부터 정년을 65세로 늘리는 문제를 고민해 왔다. 이의 해결을 위해,2시간 전,https://www.mk.co.kr/news/world/11465826,매일경제
“간헐적 단식하면 살 빠질 줄 알았는데”...결국 시간보다 중요한 건 ‘먹는 양’,https://static.mk.co.kr/trans_30x13.png,"베를린 샤리테 의대, 건강 개선효과 발표최근 몇년 사이 체중 감량에 효과적으로 알려진 ‘간헐적 단식’이 유행하는 가운데, 먹는 양을 줄이지 않고 식사 시간만 제한하면 신진대사·심혈관 건강 개선 효과는 적다는 연구 결과가 나왔다. 간헐적 단식은 하루 식사 시간을 10시간 이하로 제한, 최소 14시간 이상 단식하는 식사법이다. 최근 독일 인간영양연구소(DIfE",2시간 전,https://www.mk.co.kr/news/world/11465820,매일경제
“비단뱀이 목 휘감고 물속으로”…인도네시아서 뱀과 사투 벌인 남성,https://static.mk.co.kr/trans_30x13.png,비단뱀의 주요 서식지인 인도네시아에서 한 남성이 몸 길이가 6ｍ에 이르는 비단뱀에 목이 감겨 물속으로 끌려가는 일이 발생했다. 몸부림치던 남성은 다행히 주변의 동료들에 의해 무사히 구조됐다. 최근 뉴욕포스트 보도에 따르면 투어 가이드로 일하는 이 남성은 관광객들을 이끌고 보르네오섬 일대 강을 관광하고 있었다. 이때 강둑에 있는 거대한 비단뱀을 발견했다. 공,3시간 전,https://www.mk.co.kr/news/world/11465772,매일경제
"화웨이장비 사용 금지…EU, 법으로 못 박는다",,유럽연합(EU)이 회원국 통신망에서 중국 화웨이와 ZTE의 장비를 단계적으로 퇴출하도록 강제하는 방안을 추진 중인 것으로 알려졌다. 10일(현지시간) 블룸버그는 EU 집행위원회가 5년 전 내놓은 같은 내용의 '통신망에서의 고위험 공급 업체 사용 중단' 권고를 법제화하는 방안을 논의 중이라고 소식통들을 인용해 보도했다. 당시 EU는 화웨이와 ZTE를 '고위험..,3시간 전,https://www.mk.co.kr/news/world/11465712,매일경제
"“메릴 켈리 이후 최고의 역수출 기대” ESPN, 코디 폰세 주목",https://static.mk.co.kr/trans_30x13.png,"또 하나의 ‘역수출 신화’를 만들 수 있을까? 한화 이글스의 ‘슈퍼 에이스’ 코디 폰세가 미국 언론의 주목을 받고 있다. ‘ESPN’은 12일(한국시간) 단장회의 시작을 앞두고 이번 오프시즌 바쁜 행보가 예상되는 21개 팀에 어울리는 선수 영입을 추천하는 기사를 게재했다. 지난 시즌 우승팀 LA다저스에게는 우완 마무리 에드윈 디아즈의 영입을, 월드시리즈에서",방금 전,https://www.mk.co.kr/news/sports/11465902,매일경제
"‘나도 손흥민처럼 할 수 있었어’ 우레이 후계자 없는 中 축구, ‘최악의 세대’ 잊게 할 유망주 없나? “호날두급 자신한 웨이샹신 있어”",https://static.mk.co.kr/trans_30x13.png,"‘14억 대륙’ 중국은 여전히 우레이 이상의 선수를 배출하지 못하고 있다. 누군가는 1993년생부터 2005년생 선수들은 역대 ‘최악의 세대’라고 혹평했다. 그런 그들이 새로운 유망주들에게 주목하고 있다. 우레이는 중국 축구를 대표하는 스트라이커다. 라 리가에 진출, 바르셀로나를 상대로 득점하는 등 어쩌면 중국 축구 역사상 가장 대단한 커리어를 보유한 선수",방금 전,https://www.mk.co.kr/news/sports/11465901,매일경제
"‘전설이 떠난다’ 첫 6회 월드컵 앞둔 호날두, 북중미월드컵서 라스트 댄스 예고…“41세의 월드컵, 마지막이 될 것”",https://static.mk.co.kr/trans_30x13.png,크리스티아누 호날두가 라스트 댄스를 예고했다. 호날두는 최근 사우디 아라비아 리야드에서 열린 행사 중 ‘CNN’과 인터뷰를 진행했다. 그리고 다가올 2026 북중미월드컵이 자신의 마지막 대회가 될 것이라고 전했다. 호날두는 “그때(북중미월드컵)가 되면 큰 대회에 나서는 건 마지막이 될 시점이라고 생각한다”고 이야기했다. 그러면서 “지금 이 순간을 즐기고 있,방금 전,https://www.mk.co.kr/news/sports/11465899,매일경제
“2026년이 마지막 월드컵” ‘우리형’ 호날두의 마지막이 다가온다,https://static.mk.co.kr/trans_30x13.png,"‘우리형’도 언젠가는 피치를 떠날 것이다. 그 작별의 순간이 다가오고 있다. 포르투갈의 축구 스타 크리스티아누 호날두(40)는 현지시간으로 화요일 ‘CNN’과 진행한 인터뷰에서 내년 북중미 3개국에서 열리는 월드컵이 자신의 마지막 월드컵이 될 것이라 예고했다. 그는 “그때 나는 마흔 한 살일 것이고, 중요한 무대에서 최고의 순간을 맞이할 것”이라며 2026",방금 전,https://www.mk.co.kr/news/sports/11465898,매일경제
“파이어 니코” 팬들 염원 마침내 이뤄졌다...댈러스 니코 해리슨 단장 해고,https://static.mk.co.kr/trans_30x13.png,"“파이어 니코(Fire Nico, 니코를 해고하라)” 아메리칸 에어라인스센터에 울려퍼지던 팬들의 외침이 마침내 실현됐다. ‘ESPN’은 12일(한국시간) 소식통을 인용, 댈러스 매버릭스가 니코 해리슨 단장을 경질할 계획이라고 전했다. 이 매체는 패트릭 듀몬 구단주가 현지시간으로 화요일 오전 10시 30분 미팅을 소집, 이 자리에서 해리슨 단장을 해고할 계획",방금 전,https://www.mk.co.kr/news/sports/11465895,매일경제
"‘초대박’ 킹 르브론의 역사적인 은퇴 투어, 커리와 함께하나? GSW 관심↑…‘친정’ CLE·DAL도 환영 분위기 “그 꿈, 이곳에서 이루자”",https://static.mk.co.kr/trans_30x13.png,"르브론 ‘킹’ 제임스의 역사적인 은퇴 투어, 스테판 커리가 함께할 수 있다는 예상이 나왔다. 제임스는 올 여름 5260만 달러의 플레이어 옵션을 행사, LA 레이커스와 마지막 시즌을 함께하고 있다. 물론 지금은 부상으로 코트에 서지 못했으나 11월 내 복귀를 앞두고 있다. 1984년생, 이제는 40대가 된 제임스이기에 마지막을 바라보는 건 어쩌면 당연하다.",방금 전,https://www.mk.co.kr/news/sports/11465894,매일경제
"‘죽습니다, 진짜’ 황인수 향한 ‘코좀’ 정찬성의 애정과 신뢰, 팬心은 추락…“인수는 이제 내 동생, 보이는 것과 다른 사람”",https://static.mk.co.kr/trans_30x13.png,"‘죽습니다, 진짜’ 황인수 향한 ‘코리안 좀비’ 정찬성의 신뢰는 여전하다. 그러나 팬들은 이러한 모습이 반갑지 않은 모습이다. 정찬성은 지난 10일 유튜브 채널 ‘정찬성 코리안 좀비’에 출연, 황인수에 대한 이야기를 꺼냈다. 그리고 이제는 자신의 동생과 같은 존재라고 설명했다. 정찬성과 황인수는 지난 데이나 화이트 컨텐더 시리즈에 선수와 코치로 함께 참가했",방금 전,https://www.mk.co.kr/news/sports/11465891,매일경제
