title,thumbnail,short_content,write_time,link,company
"이재명 대통령, 오늘부터 일본·미국 순방…‘3박 6일’ 일정 시작",https://static.mk.co.kr/trans_30x13.png,"이재명 대통령이 일본, 미국 정상과의 연쇄 회담을 위해 23일 순방 길에 나선다. 지난 6월 주요 7개국(G7) 정상회의 참석을 위한 캐나다 방문 이후 두 번째 해외 순방이다. 이 대통령은 이날 오전 부인 김혜경 여사와 함께 서울공항을 통해 일본으로 출국한다. 이 대통령은 이날부터 이틀간 일본 도쿄를 방문한다. 이어 사흘 동안 미국 워싱턴DC와 필라델피아를",방금 전,https://www.mk.co.kr/news/politics/11400943,매일경제
타당성 조사 허들 낮추고 장기·대형연구 중심…R&D 키우기 3대 포인트는?,https://static.mk.co.kr/trans_30x13.png,(1) 예타면제해 AI·SMR 개발 속도전 (2) 광주·대구·전북·경남에 AI 거점 조성 (3) 연구과제 중심제(PBS) 단계적 폐지정부는 내년도 국가 연구개발(R&D) 예산을 역대 최대 규모로 편성하며 기술주도 성장을 통한 경제 도약과 기초연구 생태계 복원을 양대 목표로 내세웠다. 이와 관련해 인공지능(AI) 사업 예비타당성조사 면제와 연구과제중심제(PB,방금 전,https://www.mk.co.kr/news/it/11400937,매일경제
"김여정, 철거 의향 없다더니…북, 대남 확성기 2대 추가 설치",https://static.mk.co.kr/trans_30x13.png,"북한이 최근 대남 확성기 방송 장비를 추가로 설치하는 동향이 군 당국에 포착됐다. 합참 관계자는 22일 “우리 군은 북한의 일부 전방 지역에서 확성기가 추가 설치된 정황을 식별했으며, 관련 동향을 예의주시하고 있다”고 밝혔다. 군 당국에 따르면 이번에 새로 설치된 대남 확성기는 2대이고, 설치는 전날 이뤄진 것으로 추정된다. 앞서 우리 군은 이달 4∼5일에",방금 전,https://www.mk.co.kr/news/politics/11400914,매일경제
현직 검찰간부 건진법사에 인사청탁 정황…대검 “철저 확인할 터”,https://static.mk.co.kr/trans_30x13.png,남부지검서 관련 진술 확보…당사자는 “사실 아냐” 부인현직 검찰 간부가 2017년께 건진법사 전성배씨에게 인사 청탁을 한 정황을 보여주는 진술이 확보된 것으로 알려졌다. 22일 법조계에 따르면 건진법사 청탁 의혹을 수사한 서울남부지검은 지난 6월 전씨 측근으로 꼽히는 A씨로부터 이러한 진술을 받았다. A씨는 검찰조사에서 2017년 전씨 법당에서 B 검사와,방금 전,https://www.mk.co.kr/news/politics/11400910,매일경제
AI·에너지 역대급 예산에 난리난 과학기술계…“최고 대우로 탑티어 인재부터”,https://static.mk.co.kr/trans_30x13.png,내년 과학기술 R&D 35.3조원 전략기술 6.5조 → 8.5조 확대 양자컴 등 미래기술 개발 속도 방산 분야 예산도 25% 늘려 李 “AI 기본사회 실현 속도” 과학기술계 일제히 “대환영” 일각선 “부실연구 양산” 우려윤석열 정부에서 대폭 삭감된 ‘국가 연구개발(R&D) 투자’가 역대 최대 규모로 복원된다. 단순히 줄어든 예산을 다시 메우는 차원을,방금 전,https://www.mk.co.kr/news/it/11400909,매일경제
"“분실 아님 폐기?” 대검, ‘건진 돈다발 띠지 분실’ 남부지검 수사관 압수수색",https://static.mk.co.kr/trans_30x13.png,"돈다발 띠지, 경로 추적 단서로 활용 당시 수사 지휘 신응석 전 남부지검장, 수사 대상에 오를 가능성도 있어서울남부지검이 ‘건진법사’ 전성배씨 자택에서 확보한 돈다발 관봉권 띠지를 분실한 사건을 수사하는 대검찰청 조사팀이 강제수사에 나섰다. 돈다발 띠지에는 돈다발 지폐의 검수 일자와 담당자, 부서 등의 정보가 적혀 있어 경로 추적의 단서가 된다. 22일 대",방금 전,https://www.mk.co.kr/news/politics/11400896,매일경제
"이 대통령, 내일 3박6일 숨가쁜 일정 시작…일본 거쳐 방미, 공동성명 주목",https://static.mk.co.kr/trans_30x13.png,"23일 이시바·25일 트럼프와 대좌이재명 대통령이 23일부터 일본, 미국 정상과의 연쇄회담을 위한 순방 길에 오른다. 3박 6일간 일본 도쿄와 미국 워싱턴DC·필라델피아를 오가는 숨 가쁜 일정으로, 이 대통령 취임 후 방일과 방미 모두 이번이 처음이다. 이 대통령은 우선 23일 오전 서울공항을 떠나 도쿄로 향한다. 첫 일정으로 재일동포들과 오찬 간담회를 한",24분 전,https://www.mk.co.kr/news/politics/11400880,매일경제
신동욱·김민수·김재원 野 새 지도부 반탄 우세,https://static.mk.co.kr/trans_30x13.png,"국민의힘이 22일 제6차 전당대회를 열고 최고위원에 신동욱·김민수·양향자·김재원 후보를 선출했다. 청년 최고위원에는 현역 국회의원인 우재준 후보가 당선됐다. '반탄(탄핵 반대)파'로 분류되는 3명이 선출됐다. 원외 인사가 3명 당선됐고, 원내에서는 신동욱·우재준 의원이 새 지도부를 구성하게 됐다. 이날 신동욱 의원(서울 서초을)이 환산 기준 최종 득표수 1..",1시간 전,https://www.mk.co.kr/news/politics/11400833,매일경제
국힘 반탄끼리 결선행… 친한계 품자는 金 vs 선명성 내세운 張,https://static.mk.co.kr/trans_30x13.png,국민의힘 당대표를 놓고 윤석열 전 대통령 탄핵에 반대했던 '반탄'으로 분류되는 김문수·장동혁 후보가 최종 대결을 펼치게 됐다. 22일 충북 청주오스코에서 열린 국민의힘 전당대회에서는 과반을 득표한 후보가 나오지 않으면서 상위 득표자인 김문수 후보와 장동혁 후보가 결선 진출자로 선출됐다. 탄핵 찬성파였지만 후보 단일화에 실패한 안철수·조경태 후보는 나란히 탈..,1시간 전,https://www.mk.co.kr/news/politics/11400834,매일경제
국힘 전당대회서 유튜버끼리 심한 몸싸움…1명 현행범 체포,https://static.mk.co.kr/trans_30x13.png,국민의힘 전당대회에서 유튜버끼리 심하게 몸싸움이 벌어져 1명이 현행범으로 체포됐다. 22일 경찰에 따르면 이날 오후 5시께 국민의힘 전당대회가 열린 청주오스코 건물 로비에서 유튜버 A씨가 다른 유튜버 B씨와 몸싸움을 벌이다 현행범으로 체포됐다. 같은 국민의힘 지지자이나 평소 사이가 좋지 않았던 두 사람은 전당대회장 앞에서 시비가 붙어 몸싸움까지 한 것으로,1시간 전,https://www.mk.co.kr/news/politics/11400820,매일경제
보험료 납부도 주식 주문도…“네카토 페이로 안되는게 없네”,https://static.mk.co.kr/trans_30x13.png,차보험비교로 보험료 아낄수 있어 카카오페이는 ‘펫보험 비교’ 제공 토스프라임 가입 시 4% 적립 혜택네이버·카카오·토스는 간편결제 서비스에 보험부터 증권까지 확장하며 관련 서비스를 제공하고 있다. 결제를 통해 플랫폼에 유입시킨 뒤 금융상품 중개를 통해 수익을 확대하려는 전략이다. 네이버페이 자동차보험 비교 서비스가 대표적이다. 이 서비스는 보험사별로 보험료,방금 전,https://www.mk.co.kr/news/economy/11400912,매일경제
AI·에너지 역대급 예산에 난리난 과학기술계…“최고 대우로 탑티어 인재부터”,https://static.mk.co.kr/trans_30x13.png,내년 과학기술 R&D 35.3조원 전략기술 6.5조 → 8.5조 확대 양자컴 등 미래기술 개발 속도 방산 분야 예산도 25% 늘려 李 “AI 기본사회 실현 속도” 과학기술계 일제히 “대환영” 일각선 “부실연구 양산” 우려윤석열 정부에서 대폭 삭감된 ‘국가 연구개발(R&D) 투자’가 역대 최대 규모로 복원된다. 단순히 줄어든 예산을 다시 메우는 차원을,방금 전,https://www.mk.co.kr/news/it/11400909,매일경제
"동성애 숨기려고 여성과 위장결혼 [강영운의 ‘야! 한 생각, 아! 한 생각’]",https://static.mk.co.kr/trans_30x13.png,"(46) 찐 동성애자 ‘서머싯 몸’그는 잘나가는 주식 중개인이었다. 그러던 어느 날 불현듯 예술가가 되고 싶었고, 아내와 아이를 버리고 떠났다. 그러고는 친구의 와이프와 잤다(?). 인생이 나락으로 떨어질 때, 유일하게 손을 내밀어준 친구의 아내였다. 은혜로운 친구에게 날린 ‘빅엿’. 자기 잘못이라 생각지 않았다. 먼저 매달린 건 ‘그녀’였으니까. 늘 만지",32분 전,https://www.mk.co.kr/news/columnists/11393679,매일경제
"도심에선 세련되게, 장거리는 편안하게 [시승기]",https://static.mk.co.kr/trans_30x13.png,"신형 볼보 XC60 타보니2008년 1세대 모델로 글로벌 시장에 데뷔한 스포츠유틸리티차량(SUV) ‘XC60’는 전 세계 누적 판매 270만대를 돌파한, 볼보자동차의 베스트셀링 모델이다. 최근에는 2세대 XC60의 두 번째 부분변경 모델이 더욱 향상된 주행 성능과 똑똑해진 운전자 지원 기능을 장착하고 세상에 나왔다. ‘안전의 대명사’답게 첨단 안전 기술과",32분 전,https://www.mk.co.kr/news/business/11393695,매일경제
"메로나에 홀린 미국, 돼지바에 빠진 인도",https://static.mk.co.kr/trans_30x13.png,이번엔 K아이스크림 열풍K팝·K콘텐츠·K푸드 열풍에 이어 이번엔 ‘K아이스크림’이다. 한국산 아이스크림으로 무더위를 달래는 외국인이 빠르게 늘어나는 중이다. 수출이 꾸준히 증가해 올해 사상 첫 1억달러 수출이 가시권이다. 내수 한계에 울상짓던 ‘빙과 빅2’인 빙그레와 롯데웰푸드도 글로벌 호조에 힘입어 숨통이 트였다. 메로나·돼지바 같은 제품이 해외에서도 ‘,32분 전,https://www.mk.co.kr/news/business/11393697,매일경제
글로벌 빅파마와 ‘빅딜’ 기업 계속 나올까,https://static.mk.co.kr/trans_30x13.png,막 오른 K바이오 기술 수출 20조 시대87억6000만달러(약 12조원). 한국제약바이오협회가 집계한 올해 상반기 국내 제약·바이오 업계 기술 수출(잠깐용어 참조) 계약 규모다. 이마저도 비공개 계약을 제외한 수치다. 불과 반년 만에 지난해 연간 실적(61억달러)을 넘어섰다. 특히 올해의 경우 글로벌 빅파마를 상대로 한 조 단위 ‘빅딜’이 대부분이라는 점도,32분 전,https://www.mk.co.kr/news/business/11393698,매일경제
시니어 학습은 새로운 혁명 [‘할말 안할말’…장지호의 ‘도발’],https://static.mk.co.kr/trans_30x13.png,"대학의 정년 퇴임은 학기에 따라 여름과 겨울 두 번 있다. 올 8월 말에도 평생을 학문에만 매진하던 원로 교수들이 은퇴한다. 예전 같으면 전공 저서를 집필하거나 명예교수로서 강의를 이어가곤 했는데, 이제는 확연히 달라졌다. 법학을 전공한 교수가 와인 소믈리에 과정을 이수하고 와인 업계에 진출하거나, 영문학을 강의하던 교수는 보디프로필을 찍고 워킹 수업을 다",32분 전,https://www.mk.co.kr/news/columnists/11393701,매일경제
지식 ‘은닉’을 ‘공유’로 바꾸는 리더의 기술 [김성회의 리더십 코칭],https://static.mk.co.kr/trans_30x13.png,"“지식은 나눌수록 커지는가, 나눌수록 작아지는가.” 정답은 나눌수록 커진다지만 현실에선 교과서 속 진실에 머물러 있기 쉽다. 하버드 비즈니스 리뷰 애널리틱 서비스가 2024년에 발표한 보고서에 따르면, ‘글로벌 경영진의 97%가 지식 관리와 공유의 중요성을 인정했지만, 우리는 잘하고 있다’고 답한 비율은 44%에 불과했다. 팀 간 벽은 여전히 높고, 구성원",32분 전,https://www.mk.co.kr/news/columnists/11393703,매일경제
연일 치솟는 서울 아파트 월세...강북도 400만 원 “월급 다 내야 할 판” [김경민의 부동산NOW],https://static.mk.co.kr/trans_30x13.png,"정부가 강력한 대출 규제를 내놓은 이후 임대차 시장이 급변하는 모습이다. 전세 대신 월세로 이동하는 세입자가 늘면서 ‘전세의 월세화’가 본격화하는 양상이다.‘전세의 월세화’ 현상 지속될 듯 국토교통부에 따르면, 올 상반기 전국 주택 임대차 거래 가운데 월세 비중은 61.4%로 관련 통계 집계를 시작한 이후 처음으로 60% 선을 넘겼다. 서울은 전체 임대차",32분 전,https://www.mk.co.kr/news/economy/11400453,매일경제
"우리은행, 24억원 상당 금융사고 발생…대출기업 기계담보 무단 매각",https://static.mk.co.kr/trans_30x13.png,"우리은행에서 24억원 규모의 금융사고가 또 다시 발생했다. 이번 사고는 지난 6월 초 인도네시아 현지 법인인 우리소다라은행에서 1078억원 규모의 금융사고가 적발된 뒤 두 달 만에 재발한 것이다. 우리은행은 22일 홈페이지를 통해 담보권이 설정된 기계 기구를 외부인이 임의 매각하는 사고가 발생했다고 공시했다. 사고 금액은 24억2280만원이며, 사고 기간은",1시간 전,https://www.mk.co.kr/news/economy/11400851,매일경제
"파월 ""정책조정 필요"" 9월 美금리인하 시사",https://static.mk.co.kr/trans_30x13.png,제롬 파월 미국 연방준비제도(Fed·연준) 의장(사진)이 22일(현지시간) 고용 악화를 근거로 금리 인하에 손을 들어줬다. 당장 9월 연방공개시장위원회(FOMC)에서 금리를 내릴 가능성이 높아졌다. 도널드 트럼프 대통령이 금리 인하를 촉구하며 전방위적으로 연준을 압박해온 만큼 양측 간 갈등도 잦아들 것으로 보인다. 이날 파월 의장은 미국 와이오밍주 잭슨홀..,방금 전,https://www.mk.co.kr/news/world/11400921,매일경제
"파월 ""고용시장 하방위험 커""… 9월 금리인하 확률 92%로 껑충",https://static.mk.co.kr/trans_30x13.png,제롬 파월 연방준비제도(Fed·연준) 의장이 22일(현지시간) 금리 인하에 강한 깜빡이를 켜면서 9월 금리 인하설이 기정사실화되는 모습이다. 앞서 연준은 올해 두 차례 금리를 내리겠다고 예고한 바 있다. 이 때문에 남은 9·10·12월 연방공개시장위원회(FOMC)에서 릴레이로 금리를 인하할 가능성이 높아질 것으로 보인다. 일각에서 제기됐던 빅컷(기준금리 0..,방금 전,https://www.mk.co.kr/news/world/11400920,매일경제
“TSMC·마이크론엔 지분 요구 안 해”...반도체 기업 차별하는 트럼프의 속셈은,https://static.mk.co.kr/trans_30x13.png,"WSJ, 행정부 당국자 인용해 보도 TSMC는 ‘보조금 반환’ 예비논의도널드 트럼프 미국 행정부가 반도체법(CHIPS Act·칩스법)에 따른 생산지원금을 지급하는 대신 이들 반도체 기업의 지분을 확보하는 방안을 검토하고 있지만, 미국 투자를 확대하는 대형 기업들에 대해서는 지분을 요구하지 않을 것이라는 현지 보도가 나왔다. 월스트리트저널(WSJ)은 21일(",방금 전,https://www.mk.co.kr/news/world/11400906,매일경제
"FBI, 볼턴 前 백악관 보좌관 압수수색",https://static.mk.co.kr/trans_30x13.png,"“기밀 정보 등 안보 수사 일환”미국 연방수사국(FBI)이 존 볼턴 전 백악관 국가안보보좌관의 자택을 압수수색 했다. 미국의 대표적인 강경파 인사인 볼턴 전 보좌관은 도널드 트럼프 1기 행정부에 기용됐으나, 각종 외교 문제에서 트럼프 대통령과 마찰을 빚다 2019년 경질됐다. 이후 그는 트럼프에 대한 강력한 비판의 목소리를 내고 있다. FBI는 22일(현지",방금 전,https://www.mk.co.kr/news/world/11400895,매일경제
50대 여성 관광안내 하다가 쓰러져 사망…‘이 나라’도 폭염에 비상사태,https://static.mk.co.kr/trans_30x13.png,"伊협회, 당국에 운영시간 변경요청이탈리아 로마의 한 여성 가이드가 폭염 속에 콜로세움 관광안내를 하던 중 쓰러져 사망했다. 이 사건을 계기로 현지 가이드들은 관광지 운영 시간 재검토를 요구하고 나섰다. 21일(현지시간) 영국 가디언, 프랑스 르피가로에 따르면 지난 19일 오후 6시께 콜로세움에서 관광객들을 안내하던 56세의 조반나 마리아 잠마리노가 쓰러졌다",44분 전,https://www.mk.co.kr/news/world/11400871,매일경제
獨 2분기 GDP 0.3％↓ 3년 연속 역성장 우려,,독일의 올해 2분기 국내총생산(GDP) 확정치가 지난 분기에 비해 0.3% 줄었다고 독일 연방통계청이 22일(현지시간) 발표했다. 이는 시장 전망치이자 지난 7월 발표된 속보치 -0.1%보다 0.2%포인트 하향 조정된 것이다. 독일은 지난해 2분기 -0.3%로 마이너스 경제성장률을 보인 후 같은 해 3분기부터 올해 1분기까지 플러스를 유지해왔다. 4개 분기..,1시간 전,https://www.mk.co.kr/news/world/11400795,매일경제
"“일자리부터 늘려야” vs “물가 더 오르면 위험”…연준, 금리인하 갑론을박",https://static.mk.co.kr/trans_30x13.png,美잭슨홀 달군 금리 논쟁 인하론 우세 속 동결론 부상21일(현지시간) 미국 와이오밍주 잭슨홀에선 그 어느 때보다 시장의 뜨거운 관심 속에 연방준비제도(Fed·연준)의 연례 심포지엄이 열렸다. 평소에는 그랜드티턴 국립공원과 인근 옐로스톤을 찾는 관광객들로 붐비는 이곳은 1년에 한 번 전 세계 중앙은행 거물들이 한자리에 모이는 글로벌 통화정책의 무대로 탈바꿈한,2시간 전,https://www.mk.co.kr/news/world/11400782,매일경제
“9월 금리인하? 두고보면 알 것”...동결론 재부상에도 연준 이사는 자신감,https://static.mk.co.kr/trans_30x13.png,미국 잭슨홀 현장 가보니 월러 이사는 ‘인하’ 자신감크리스토퍼 월러 미국 연방준비제도(Fed·연준) 이사가 21일(현지시간) 미국 와이오밍주 잭슨홀에서 열린 연례 심포지엄에 참석해 매일경제 기자와 만나 향후 금리 방향에 대해 “두고보면 알게 될 것”이라고 밝혔다. 9월 연방공개시장원회(FOMC)를 앞두고 금리 인하 가능성에 자신감을 피력한 것으로 풀이된다.,3시간 전,https://www.mk.co.kr/news/world/11400763,매일경제
"[단독] “원전 수출 족쇄 풀리나”…한수원, 미국과 합작사 만들어 수출지역 제한 피한다",https://static.mk.co.kr/trans_30x13.png,美 WEC와 사업대상 국가 논의 미국 외 전세계에서 수주 가능 수익배분·지분 등은 협의 필요 한수원·한전 영역 정리해야한국수력원자력이 미국 웨스팅하우스(WEC)와 설립을 검토 중인 조인트벤처(JV)의 사업 영역이 ‘미국 원전 시장’에만 국한되지 않는 것으로 확인됐다. 합작사가 전 세계를 대상으로 원전 수주 활동을 펼칠 수 있어 올해 1월 지식재산권 합의로,3시간 전,https://www.mk.co.kr/news/economy/11400755,매일경제
"트럼프, 정부 최고디자인책임자 둔다",https://static.mk.co.kr/trans_30x13.png,도널드 트럼프 미국 대통령이 연방정부 건물과 홈페이지 디자인의 개선을 책임질 '최고디자인책임자'로 에어비앤비의 공동 창립자인 조 게비아를 임명할 예정이다. 21일(현지시간) 블룸버그 등에 따르면 트럼프 대통령은 백악관 대통령실에 '최고디자인책임자' 직책과 '국가디자인스튜디오' 조직을 신설하는 내용의 행정명령에 서명했다. 국가디자인스튜디오는 연방정부의 물리적..,3시간 전,https://www.mk.co.kr/news/world/11400749,매일경제
"2026 월드컵 조추첨, 12월 5일 워싱턴DC에서 개최",https://static.mk.co.kr/trans_30x13.png,"2026 FIFA 월드컵 조추첨 일정이 확정됐다. 국제축구연맹(FIFA)은 23일(한국시간) 보도자료를 통해 2026년 미국과 캐나다, 멕시코 3개 국가가 공동 개최하는 FIFA 월드컵 조추첨 일정을 확정, 발표했다. FIFA 월드컵 조추첨은 현지시간으로 오는 12월 5일 오후 12시(한국시간 6일 오전 2시), 미국 워싱턴DC의 존 F. 케네디 센터에서",방금 전,https://www.mk.co.kr/news/sports/11400941,매일경제
"‘김민재 폭풍 도움’ 케인 해트트릭 대폭발! 뮌헨, 라이프치히와 홈 개막전서 6-0 대승…‘이적생’ 디아스 1골 2도움 활약 [분데스리가]",https://static.mk.co.kr/trans_30x13.png,"김민재의 폭풍 질주, 그리고 첫 도움이 빛난 하루였다. 바이에른 뮌헨은 23일(한국시간) 독일 뮌헨의 알리안츠 아레나에서 열린 라이프치히와의 2025-26 독일 분데스리가 1라운드 홈 개막전에서 6-0 대승했다. 뮌헨은 이날 최고의 경기력을 선보였다. 올리세가 전반에만 멀티골을 기록했고 ‘이적생’ 디아스 역시 데뷔 골을 신고했다. 그리고 후반에는 케인이 해",방금 전,https://www.mk.co.kr/news/sports/11400933,매일경제
"‘손흥민 대체자? 아스널 갑니다요’ 눈 뜨고 코 베였다…굴욕의 토트넘, 아스널에 ‘하이재킹 당해’",https://static.mk.co.kr/trans_30x13.png,"크리스털 팰리스의 공격수 에비리치 에제는 토트넘이 아닌 아스널의 유니폼을 입을 예정이다. 에제는 손흥민의 대체자로 거론됐지만, 토트넘은 라이벌 아스널에 제대로 ‘하이재킹’을 당했다. 영국 ‘BBC’는 21일(한국시간) “아스널이 토트넘의 영입 타깃 에제를 가로챘다. 에제는 토트넘이 아닌 아스널과 협상 테이블에 앉을 예정이다”라고 전했다. ‘이브닝 스탠다드’",방금 전,https://www.mk.co.kr/news/sports/11400929,매일경제
‘미쳤다’ 김민재 폭풍 질주→케인 해트트릭 도왔다! 후반 교체 투입 후 10분 만에 첫 도움 신고 [분데스리가],https://static.mk.co.kr/trans_30x13.png,김민재의 폭풍 질주는 빛났고 케인의 해트트릭까지 돕는 멋진 도움까지 기록했다. 바이에른 뮌헨의 김민재는 23일(한국시간) 독일 뮌헨의 알리안츠 아레나에서 열린 라이프치히와의 2025-26 독일 분데스리가 1라운드 홈 개막전에서 첫 도움을 기록했다. 김민재는 후반 68분 타와 교체되어 그라운드를 밟았다. 이미 5-0으로 앞선 상황. 그러나 김민재의 존재감은,방금 전,https://www.mk.co.kr/news/sports/11400932,매일경제
"‘초대박’ 르브론 향한 GSW의 진심, 18개월 동안 LAL에 연락했다…“커리와 제임스가 함께하는 방법 찾아”",https://static.mk.co.kr/trans_30x13.png,"르브론 ‘킹’ 제임스와 스테판 커리의 만남. NBA 역사에 남을 수 있는 두 선수의 조합은 꿈이 아닐 수 있다. 골든스테이트 워리어스가 제임스 영입에 진심이었다는 건 사실 비밀이 아니다. 그들은 2023-24시즌 트레이드 데드라인 직전, 제임스를 영입하기 위해 노력했다. 당시 제임스가 LA 레이커스 잔류 의지를 드러냈기에 성사되지 않았다. 그러나 골든스테이",방금 전,https://www.mk.co.kr/news/sports/11400931,매일경제
‘14억 대륙’ 중국 축구 욕심 미쳤다! 손흥민 울린 오소리오 부임설에 나이 많아 불만…“경험 좋지만 고집 세고 변화에 둔감”,https://static.mk.co.kr/trans_30x13.png,오랜 기다림 끝에 중국의 새 사령탑 후보가 수면 위로 드러났다. 그러나 반응이 애매하다. 이제는 나이가 많다고 불만이다. 중국은 2026 북중미월드컵 진출 실패 후 브란코 이반코비치 감독을 경질했다. 이후 새로운 감독을 찾기 시작했고 그 결과 지금껏 제대로 된 결과를 내지 못하고 있다. 최근 콜롬비아 매체 ‘윈스포츠’에서 새로운 소식이 전해졌다. 후안 카를,방금 전,https://www.mk.co.kr/news/sports/11400930,매일경제
볼티모어의 파격 투자...갓 데뷔한 신인 포수와 8년 6700만$ 계약,https://static.mk.co.kr/trans_30x13.png,"볼티모어 오리올스가 파격적인 투자를 한다. ‘ESPN’은 23일(한국시간) 소식통을 인용, 볼티모어가 신인 포수 사무엘 바사이요(21)와 8년 6700만 달러(약 926억 원) 계약에 합의했다고 전했다. 도미니카 공화국 출신인 바사이요는 지난 2021년 볼티모어와 130만 달러 계약금에 계약하며 프로 데뷔했다. 우투좌타로 MLB.com 선정 2025 프리시",방금 전,https://www.mk.co.kr/news/sports/11400928,매일경제
"‘김민재 밀렸다’ 뮌헨, 타-우파메카노 조합으로 홈 개막전 나선다…라이프치히와 1R 선발 라인업 발표 [분데스리가]",https://static.mk.co.kr/trans_30x13.png,김민재는 결국 밀렸다. 바이에른 뮌헨은 23일(한국시간) 독일 뮌헨의 알리안츠 아레나에서 열리는 라이프치히와의 2025-26 독일 분데스리가 1라운드 홈 개막전에 앞서 선발 라인업을 발표했다. 뮌헨은 골키퍼 노이어를 시작으로 라이머-우파메카노-타-스타니시치-키미히-고레츠카-그나브리-올리세-디아스-케인이 선발 출전한다. 라이프치히는 골키퍼 굴라치를 시작으로,방금 전,https://www.mk.co.kr/news/sports/11400927,매일경제
