title,thumbnail,short_content,write_time,link,company
"“한국서 3년만 일하면 영주권”…K이민정책, 인재부족·인구감소 해결할까",https://static.mk.co.kr/trans_30x13.png,"崔권한대행, 외국인청책위 회의 저출생 장기화에 인재확보 총력 영주권 취득 6년서 3년으로 단축 생산가능인구 2050년에 52.5%정부가 전 세계 첨단 산업 인재를 유치하기 위해 국내 영주권 취득 기간을 대폭 단축한 톱티어(Top-Tier) 비자를 신설한다. 급격한 인구 감소가 한국을 선진국 함정에 빠뜨리는 만큼 해외 우수 인재 유치를 위한 특단의 대책이",방금 전,https://www.mk.co.kr/news/economy/11256651,매일경제
"부정선거론 퍼질라 … 노태악, 외부통제 수용 시사",https://static.mk.co.kr/trans_30x13.png,"노태악 중앙선거관리위원회 위원장(사진)이 5일 선관위 채용 비리와 관련해 국민 앞에 고개를 숙였다. 노 위원장은 이날 대국민 사과문을 내고 ""고위직 간부들의 자녀 특혜 채용 문제로 국민 여러분께 큰 실망과 걱정을 끼쳐드렸다""며 ""선관위원장으로서 통렬한 반성과 함께 머리 숙여 사과드린다""고 말했다. 노 위원장이 직접 대국민 사과에 나선 배경에는 선관위 채용 ..",방금 전,https://www.mk.co.kr/news/politics/11256619,매일경제
"이재명, 대통령 집무실 ‘세종 이전’ 검토 지시",https://static.mk.co.kr/trans_30x13.png,"이재명 더불어민주당 대표가 최근 지도부 회의에서 대통령실의 세종 이전 가능성을 검토해 보라고 지시한 것으로 알려졌다. 조기 대선 가능성을 염두에 두고 대통령실 ‘세종시 이전론’ 카드를 꺼내들었다는 해석이 나온다. 특히, 내란혐의로 구속영장이 집행된 용산 대통령실 상징성과 일반에 개방된 청와대의 보안성을 고려한 조치로 풀이된다. 5일 MBN 보도에 따르면 차",방금 전,https://www.mk.co.kr/news/politics/11256615,매일경제
판 커진 K엔비디아 논란…여야 공개토론서 끝장 본다,https://static.mk.co.kr/trans_30x13.png,"주52시간·상법 등 이견 재확인 류진 회장, 10대 정책과제 전달 K엔비디아 국민지분 논란 확산 李, 국민의힘에 공개토론 제안 안철수·윤희숙 “언제든 환영”‘K엔비디아’ 발언으로 논란에 휩싸인 이재명 더불어민주당 대표가 인공지능(AI) 분야에 대한 정부의 지분투자 필요성을 거듭 주장하면서 국민의힘에 공개 토론을 제안했다. 정부가 운영하는 국부펀드가 이른바",방금 전,https://www.mk.co.kr/news/politics/11256611,매일경제
"이재명, 화마로 숨진 인천 초등학생 빈소 찾아 조문",https://static.mk.co.kr/trans_30x13.png,더불어민주당 이재명 대표가 5일 집에 혼자 있다가 발생한 화재로 숨진 초등학생 A(12)양의 빈소를 찾아 조문했다. 이 대표는 이날 인천시 서구 가톨릭관동대학교 국제성모병원 장례식장을 찾아 조문한 뒤 유족들에게 위로의 말을 건넸다. 앞서 이 대표는 페이스북을 통해 “사회안전망을 강화하는 일에 총력을 다해야 한다”며 “틈새 없이 두툼한 ‘사회안전 매트리스’로,방금 전,https://www.mk.co.kr/news/politics/11256599,매일경제
"“내 체포안 가결, 다 짜고 한 짓”…이재명 발언에 비명계는 ‘경악’",https://static.mk.co.kr/trans_30x13.png,"이재명 더불어민주당 대표가 5일 방송된 유튜브 ‘매불쇼’에서 2023년 9월 자신의 체포동의안 국회 가결에 대해 “예상한 일이었다. 당시 검찰이 수사과정에서 벌인 일과 당시 당내 움직임 등을 맞춰보니, 당내 일부하고 (검찰이) 다 짜고 한 짓”이라고 주장했다. 그는 이어 “‘가결해달라’고 공개적으로 요구해서 가결되면 법원에서 기각될 가능성이 커지지만, 저는",방금 전,https://www.mk.co.kr/news/politics/11256595,매일경제
"홍준표, 한동훈 향해 “당 망쳐놓고 쓸데 없는 소리…양심 있어야”",https://static.mk.co.kr/trans_30x13.png,"홍준표 대구시장은 5일 한동훈 국민의힘 전 대표를 겨냥해 “당을 이렇게 망쳐놓고 양심이 있어야지, 나라를 이렇게 어지럽게 해 놓고 무슨 쓸데없는 소리냐”고 비판했다. 홍 시장은 이날 국회에서 마은혁 헌법재판관 임명에 반대하며 단식 농성 중인 박수영 국민의힘 의원을 격려 방문한 뒤 기자들과 만난 자리에서 이같이 밝혔다. 그는 대권 주자들 사이에서 제기된 ‘차",22분 전,https://www.mk.co.kr/news/politics/11256584,매일경제
[포토] 류진 한국경제인협회 회장과 악수하는 이재명 대표,https://static.mk.co.kr/trans_30x13.png,이재명 더불어민주당 대표와 류진 한국경제인협회 회장이 5일 국회에서 열린 ‘더불어민주당-한국경제인협회 민생경제 간담회’에서 악수를 하고 있다. 2025.3.5 [김호영기자],49분 전,https://www.mk.co.kr/news/politics/11256569,매일경제
"국정원 ""北, 러시아서 드론 전술 전수받아""",,"쿠르스크 전선에 투입된 북한군이 실제 전장에서 드론(무인기) 관련 지식을 습득하고 있는 정황이 정보당국에 포착됐다. 5일 국가정보원은 ""파병된 북한군이 러시아로부터 드론 조종법과 전술을 전수받고 있는 정황이 있어 양측의 무인기 분야 협력 가능성을 주시하고 있다""고 밝혔다. 러시아가 교전에 참여한 북한군 병력의 전투 능력을 향상시키고 생존성을 높이기 위해 실..",1시간 전,https://www.mk.co.kr/news/politics/11256538,매일경제
"공판 출석하는 이재명에 운동화 ‘퍽’…40대남, 검찰 송치",https://static.mk.co.kr/trans_30x13.png,공직선거법 위반 혐의 1심 선고 공판에 출석하는 더불어민주당 이재명 대표에게 신발을 던진 남성이 검찰에 송치됐다. 서울 서초경찰서는 지난해 공직선거법 1심 재판 출석을 위해 서울중앙지법에 입장하던 이 대표를 향해 신발을 던진 40대 남성 A씨를 지난달 25일 공무집행방해 혐의로 불구속 송치했다고 5일 밝혔다. A씨는 재판을 위해 차량에서 내린 뒤 법원으로,1시간 전,https://www.mk.co.kr/news/society/11256532,매일경제
"“한국서 3년만 일하면 영주권”…K이민정책, 인재부족·인구감소 해결할까",https://static.mk.co.kr/trans_30x13.png,"崔권한대행, 외국인청책위 회의 저출생 장기화에 인재확보 총력 영주권 취득 6년서 3년으로 단축 생산가능인구 2050년에 52.5%정부가 전 세계 첨단 산업 인재를 유치하기 위해 국내 영주권 취득 기간을 대폭 단축한 톱티어(Top-Tier) 비자를 신설한다. 급격한 인구 감소가 한국을 선진국 함정에 빠뜨리는 만큼 해외 우수 인재 유치를 위한 특단의 대책이",방금 전,https://www.mk.co.kr/news/economy/11256651,매일경제
"“게임체인저는 무조건 키워야”…정부, 50조 통큰 지원 ‘이 산업’에 집중",https://static.mk.co.kr/trans_30x13.png,"정부, 첨단산업기금 신설 산은에 설치…20년 운영 저리대출·지분투자 총망라 美관세 피해업종도 지원 이달 관련법 국회 제출 예정반도체와 바이오, 인공지능(AI) 등 첨단전략산업의 경쟁력 강화를 위해 정부가 50조원 규모로 기금을 확대한 것은 트럼프 신정부의 보호무역주의에 대응하려는 조치다. 그간 저리 대출로 제한됐던 지원방식도 지분 투자와 신용 보강 등 업",방금 전,https://www.mk.co.kr/news/economy/11256629,매일경제
“돈 많이 벌었지만 배당은 좀”…역대급 실적에도 배당 줄인 보험사 속내는,https://static.mk.co.kr/trans_30x13.png,11곳 상장사 중 3곳에 그쳐 작년 지급여력비율 낮아지며 충당금 부담에 배당재원 줄어역대급 실적에도 불구하고 올 들어 보험사들이 배당에 소극적으로 돌아섰다. 상장 보험사 11곳 중 현재까지 배당 계획을 밝힌 곳은 3곳뿐이다. 밸류업 열풍에 지난해 7곳의 보험사가 배당에 나선 것과는 달라진 분위기다. 낮아진 지급여력(K-ICS·킥스)비율로 인해 해약환급금,방금 전,https://www.mk.co.kr/news/economy/11256628,매일경제
"[포토] 이복현 금감원장, 증권사 CEO들과 간담회",https://static.mk.co.kr/trans_30x13.png,이복현 금융감독원장이 5일 서울 여의도 금융투자협회 대회의실에서 열린 금융감독원장-증권회사 CEO 간담회에서 서유석 금융투자협회장을 비롯한 증권회사 CEO들과 참석하고 있다. 2025.3.5 [김호영기자],49분 전,https://www.mk.co.kr/news/economy/11256570,매일경제
“홈플러스 상품권 팝니다”…제휴처 사용 중단 늘자 ‘중고거래’ 성행,https://static.mk.co.kr/trans_30x13.png,홈플러스가 기업회생 절차에 들어가면서 홈플러스 상품권 사용이 가능했던 제휴처의 사용 중단 조치가 늘고 있다. 이 가운데 상품권을 갖고 있던 사람들 사이에서 홈플러스 상품권을 중고거래 하는 사례가 늘고 있다. 추후 상품권을 사용하지 못할 수 있다는 불안감이 확산하고 있기 때문이다. 5일 업계에 따르면 중고거래 플랫폼 당근마켓에서는 홈플러스가 기업회생 절차에,1시간 전,https://www.mk.co.kr/news/economy/11256545,매일경제
11년째 힘 못쓰는 한국…국민소득 일본 이겼지만 아직도 3만달러대,https://static.mk.co.kr/trans_30x13.png,"한국은행, ‘2024 국민소득’ 발표 1인당 GNI 2014년 첫 3만弗 돌파 작년 3만6624弗...전년比 1.2%↑ 저성장에 잠재성장률 0%대 될 판국민 1인당 소득이 11년째 4만달러 문턱에서 좌절했다. 5일 한국은행이 발표한 ‘2024년 국민소득’에 따르면 1인당 국민총소득(GNI)이 3만6624달러로 전년 대비 1.2% 증가하는 데 그쳤다. 1인",1시간 전,https://www.mk.co.kr/news/economy/11256543,매일경제
“10년 넘게 소득 3만달러 늪인데 ‘성장 슈퍼스타’라니”…성장판 실종된 한국,https://static.mk.co.kr/trans_30x13.png,"10년 넘도록 3만弗에 갇힌 韓 엄격한 신산업∙노동 규제 등과 높은 법인세율에 기업들 해외로 근로시간 긴데 노동생산성 최하위 2040년 잠재성장률 0%대 될수도2024년 8월. 세계은행은 대한민국을 ‘중진국 함정’을 극복한 대표 사례로 꼽았다. ‘성장 슈퍼스타’라고 추켜세우기도 했다. 세계은행은 한국이 중진국 함정에서 벗어나게 된 이유로 투자, 기술",2시간 전,https://www.mk.co.kr/news/economy/11256527,매일경제
"‘꼼수 연임’ 의혹 순천 중부새마을금고 이사장, 5선 압도적 표차로 성공",https://static.mk.co.kr/trans_30x13.png,‘꼼수 연임’ 논란에 휩싸였던 전남 순천의 한 새마을금고 이사장이 5선 도전에 성공했다. 순천 중부새마을금고 A 이사장(72)은 5일 처음으로 치러진 전국 새마을금고 동시 이사장 선거에서 전체 114표 가운데 98표(85.96％)를 얻어 압도적인 표차로 연임에 성공했다. A 이사장은 2012년부터 2020년 선거까지 세 차례 내리 이사장으로 선출됐으나 세,2시간 전,https://www.mk.co.kr/news/economy/11256510,매일경제
한국 11년째 소득 '3만弗 함정',,국민 1인당 소득이 11년째 4만달러 문턱에서 좌절했다. 5일 한국은행이 발표한 '2024년 국민소득'에 따르면 1인당 국민총소득(GNI)이 3만6624달러로 전년 대비 1.2% 증가하는 데 그쳤다. 1인당 국민소득 4만달러는 선진강국에 진입하는 척도로 받아들여진다. 한국은 2014년 처음 3만달러를 넘은 후 11년째 4만달러 벽을 넘지 못하고 있다. 일..,3시간 전,https://www.mk.co.kr/news/economy/11256487,매일경제
[포토] 사내문화 개선 나선 Sh수협은행,https://static.mk.co.kr/trans_30x13.png,,3시간 전,https://www.mk.co.kr/news/economy/11256419,매일경제
트럼프 관세전쟁 속에서도 매그니피센트7을 놓지 못하는 이유 [매일 돈이 보이는 습관 M+],https://static.mk.co.kr/trans_30x13.png,"미국 S&P500 과거 월별 성과에 있어 2월은 긍정적이지 못했던 것이 사실입니다. 특히 대선으로 신임 대통령이 정부를 맡았을 때는 더더욱 그러합니다. 과거의 기록으로 미래를 알 수 있는 것은 아니지만, 합리적으로 생각해보면 선거 공약이 정책화 및 구체화 되는 과정에서 순탄하기 어렵기 때문입니다. 지나고 나서 2월을 생각해보면 1월 폭풍처럼 지나갔던 중국,",방금 전,https://www.mk.co.kr/news/stock/11256297,매일경제
[속보] 美 “멕시코·캐나다산 수입車 관세 한 달 면제”,https://static.mk.co.kr/trans_30x13.png,‘25% 관세’에 부분적 예외 두기로 “4월 2일엔 상호관세 발효” 재확인미국 도널드 트럼프 행정부가 지난 4일(현지시간)부터 캐나다·멕시코를 대상으로 25%의 관세를 부과하고 있는 가운데 자동차에 한해 1개월간 적용을 면제한다고 5일 밝혔다. 캐롤라인 레빗 백악관 대변인은 이날 브리핑에서 “우리는 ‘빅3’ 자동차 업체와 대화했다”며 “‘미국·멕시코·캐나다,방금 전,https://www.mk.co.kr/news/world/11256650,매일경제
삼성·SK 투자 그렇게 받아놓고는…“끔찍한 것” 보조금 안주려는 美,https://static.mk.co.kr/trans_30x13.png,"트럼프, 반도체법 폐지 주장 삼성·SK하이닉스 ‘초비상’ 이미 미국 공장 짓는 중인데 정권 바뀌자 지원금 끊길 판 트럼프 “미국산 차만 稅혜택”도널드 트럼프 대통령이 조 바이든 행정부 시기에 제정된 반도체과학법(CHIPS Act·반도체법)을 폐지해야 한다고 주장했다. 반도체법은 삼성전자, SK하이닉스 등 국내 기업들이 미국 투자에 대한 생산지원금을 받는 데",방금 전,https://www.mk.co.kr/news/world/11256622,매일경제
한국 콕 집어 압박한 트럼프…“양국관계 공평하지 않다” 주장,https://static.mk.co.kr/trans_30x13.png,"트럼프 “韓관세, 美보다 4배 높아 알래스카 사업 수조弗 투자할 것” 한국 기업 보조금 수혜 거론하며 “반도체과학법 폐지해야” 발언도한국이 미국 상품에 부과하는 관세가 미국이 한국 상품에 물리는 관세보다 4배 이상 높다고 도널드 트럼프 미국 대통령이 주장했다. 트럼프 대통령은 또 알래스카 액화천연가스(LNG) 파이프라인 사업에 한국·일본 등이 파트너가 되",방금 전,https://www.mk.co.kr/news/world/11256617,매일경제
“자기 전 한 스푼 먹으면 8시간 통잠”…SNS서 난리난 ‘버터 수면’,https://static.mk.co.kr/trans_30x13.png,"미국에서 아기를 재우기 전 버터를 한 스푼 먹이는 것이 유행하고 있다는 소식이 알려졌다. 3일(현지시간) 뉴욕포스트는 최근 사회관계망서비스(SNS) 틱톡을 중심으로 아기를 재우기 전 버터를 한 스푼 먹이는 것이 유행하고 있다고 보도했다. 일명 ‘버터 수면’을 하고 있다는 부모들은 아기가 잠들기 전 버터 한 숟가락을 먹이는 것만으로 최대 8시간의 연속 수면,",방금 전,https://www.mk.co.kr/news/world/11256609,매일경제
“결국 트럼프 말한대로 다 되네”…파나마 항구 운영권도 미국 손으로,https://static.mk.co.kr/trans_30x13.png,"트럼프 파나마 운하 압박 결실 홍콩社, 블랙록에 지분 매각세계 최대 자산운용사 블랙록이 홍콩 대기업 CK허치슨홀딩스에서 파나마 운하 항구 운영 사업 부문을 인수한다. 최근 도널드 트럼프 미국 대통령이 파나마 운하에 대한 중국 영향력을 문제 삼은 것이 인수를 촉발했다는 관측이다. 4일(현지시간) 블룸버그에 따르면 블랙록이 주도하는 컨소시엄이 파나마 운하 발보",방금 전,https://www.mk.co.kr/news/world/11256606,매일경제
“왜 한손에만 장갑을?”…‘쇼생크탈출’ 모건 프리먼의 안타까운 ‘왼손’,https://static.mk.co.kr/trans_30x13.png,영화 ‘쇼생크탈출’ 등으로 잘 알려진 할리우드 배우 모건 프리먼이 최근 미국 아카데미 시상식 무대에 나선 가운데 그의 ‘왼손’이 팬들을 안타깝게 했다. 지난 2일(현지시간) 미국 로스앤젤레스 돌비 극장에서 열린 제97회 아카데미 시상식 중 작고한 영화인들을 추모하는 순서가 마련됐다. 모건 프리먼은 이날 무대에 올라 최근 숨진 전설적인 배우 진 해크먼을 추모,방금 전,https://www.mk.co.kr/news/world/11256600,매일경제
제조업 아이콘서 역성장 굴욕까지…이 나라 770조 ‘역대급 돈풀기’ 나선다,https://static.mk.co.kr/trans_30x13.png,“국방비 지출 늘려야” 헌법상 채무 제한도 완화 EU는 ‘재무장 계획’ 발표 유로 가치 3개월 새 최고독일 차기 정부의 연립정부 구성을 논의 중인 정당들이 경제 성장률을 회복시키고 군비 지출을 늘리기 위해 ‘역대급 돈풀기’에 나선다. 4일(현지시간) 파이낸셜타임스(FT)에 따르면 지난달 총선에서 승리한 독일 기독민주당(CDU)·기독사회당(CSU) 연합 지도,방금 전,https://www.mk.co.kr/news/world/11256593,매일경제
"전쟁중인 이스라엘, 출산 급증 ‘베이비붐’이라는데…무슨 일",https://static.mk.co.kr/trans_30x13.png,팔레스타인 무장정파 하마스 등과 17개월째 전쟁을 이어온 이스라엘에서 출산이 급격히 증가한 것으로 나타났다고 이스라엘 매체 와이넷이 5일(현지시간) 보도했다. 이스라엘 인구 당국 통계에 따르면 작년 한 해 출생아는 약 18만1000명으로 2023년 17만2500명보다 4.9% 늘었다. 월별로 보면 출생아는 작년 8∼10월에 집중됐다. 특히 작년 9월에는 출,29분 전,https://www.mk.co.kr/news/world/11256581,매일경제
"“한국, 너네 돈 많잖아”...사실상 돈 내놓으라는 트럼프의 가스라이팅",https://static.mk.co.kr/trans_30x13.png,"트럼프 美 의회연설 팩트체크 1. 알래스카 가스관 투자 확정? 아직 협의체 구성도 안했는데 즉흥적으로 ‘각각’ 표현 넣어 韓 수조달러 투자 계획 강조 2. 한국 관세가 미국의 4배? 트럼프, 상호관세 언급했지만 FTA로 美상품 99% 관세 철폐 미국산 한국 들어올 때 ‘0’ 수준도널드 트럼프 미국 대통령이 4일(현지시간) 워싱턴DC 연방의사당에서 진행한",1시간 전,https://www.mk.co.kr/news/world/11256548,매일경제
“그런 스플리터는 처음 받아봐요” 사사키 공받은 신인 포수의 감탄 [현장인터뷰],https://static.mk.co.kr/trans_30x13.png,LA다저스의 괴물 신인 사사키 로키의 공을 받은 포수 헌터 페두치아(27)는 감탄을 금치 못했다. 페두치아는 6일(한국시간) 미국 애리조나주 글렌데일에 있는 구단 훈련 시설 캐멀백 랜치 글렌데일에서 취재진을 만난 자리에서 전날 호흡을 맞춘 사사키에 대해 말했다. 전날 열린 신시내티 레즈와 캑터스리그 홈경기에서 교체 투입된 페두치아는 5회부터 7회까지 사사키,방금 전,https://www.mk.co.kr/news/sports/11256640,매일경제
"‘정말 다행’ 김민재 부상 피했다! 뮌헨, 케인 헤더골 앞세워 레버쿠젠에 전반 1-0 리드…6G 무승 침묵 깨나 [챔피언스리그]",https://static.mk.co.kr/trans_30x13.png,김민재가 부상을 피했다. 바이에른 뮌헨은 6일(한국시간) 독일 뮌헨의 알리안츠 아레나에서 열린 바이어 04 레버쿠젠과의 2024-25 UEFA 챔피언스리그 16강 1차전 전반전을 1-0으로 앞선 채 마쳤다. 뮌헨은 골키퍼 노이어를 시작으로 데이비스-김민재-우파메카노-라이머-키미히-고레츠카-코망-무시알라-올리세-케인이 선발 출전했다. 레버쿠젠은 골키퍼 코바르,방금 전,https://www.mk.co.kr/news/sports/11256649,매일경제
“골 넣을 때마다 통산 득점만큼 기부” 러시아 출신 아이스하키 골잡이의 특급 선행,https://static.mk.co.kr/trans_30x13.png,"북미아이스하키리그(NHL) 개인 통산 최다 득점을 노리는 워싱턴 캐피털스의 러시아 출신 공격수 알렉스 오베츠킨(39)이 선행에 나선다. ‘ESPN’은 현지시간으로 5일, 오베츠킨이 앞으로 골을 넣을 때마다 소아암 연구 관련 재단에 기부하기로 했다는 소식을 전했다. 오베츠킨은 현재 884득점을 기록중이다. 앞으로 11골만 추가하면 웨인 그레츠키가 갖고 있는",방금 전,https://www.mk.co.kr/news/sports/11256647,매일경제
"‘실화?’ 토트넘, 손흥민 돈 받고 판다?…뮌헨 이적설 → 방출 명단 NO!",https://static.mk.co.kr/trans_30x13.png,토트넘의 방출 명단에는 손흥민의 이름이 없다. 최근 손흥민의 이적설이 불거지는 가운데 토트넘은 어떤 행보를 보일까? 영국 매체 ‘풋볼런던’의 알레스데어 골드 토트넘 전담 기자는 3일(한국시간) 여름 이적시장에서 토트넘이 방출할 명단에 대해 언급했다. 골드 기자는 “여름 이적시장에서 7명의 선수가 토트넘을 떠날 수 있다. 추가적인 변화가 일어날 예정이다. 올,방금 전,https://www.mk.co.kr/news/sports/11256641,매일경제
"샌디에이고, 베테랑 내야수 이글레시아스 영입",https://static.mk.co.kr/trans_30x13.png,"샌디에이고 파드리스가 베테랑 내야수 호세 이글레시아스(35)를 영입한다. 메이저리그 전문 칼럼니스트 로버트 머레이를 비롯한 현지 언론은 6일(한국시간) 파드리스가 이글레시아스와 계약에 합의했다고 전했다. ‘뉴욕포스트’ 메이저리그 전문 기자 존 헤이먼에 따르면, 계약 형태는 마이너리그 계약이며 메이저리그 로스터에 합류할 경우 300만 달러의 연봉을 받는 구조",방금 전,https://www.mk.co.kr/news/sports/11256646,매일경제
"‘천만다행’ 김민재, 프림퐁에 왼쪽 발목 깔렸으나 곧바로 복귀…뮌헨, 케인 헤더골 전반 1-0 리드 [챔피언스리그]",https://static.mk.co.kr/trans_30x13.png,천만다행이다. 바이에른 뮌헨의 김민재는 6일(한국시간) 독일 뮌헨의 알리안츠 아레나에서 열린 바이어 04 레버쿠젠과의 2024-25 UEFA 챔피언스리그 16강 1차전에서 큰 부상을 당할 뻔했다. 김민재는 이날 다요 우파메카노와 함께 뮌헨 중앙 수비를 지키고 있다. 그러나 경기 초반 큰 위기가 있었다. 큰 부상으로 이어질 수 있는 상황이 벌어진 것이다. 전,방금 전,https://www.mk.co.kr/news/sports/11256645,매일경제
"‘황인범 결장’ 페예노르트, 홈에서 치른 UCL 16강 1차전 인터 밀란에 0-2 완패",https://static.mk.co.kr/trans_30x13.png,"페예노르트의 8강 진출에 먹구름이 끼었다. 페예노르트는 3월 6일 오전 2시 45분(이하 한국시간) 네덜란드 로테르담 스타디온 페예노르트에서 열린 2024-25시즌 유럽축구연맹(UEFA) 챔피언스리그(UCL) 16강 1차전 인터 밀란과의 맞대결에서 0-2로 완패했다. 페예노르트는 4-3-3 포메이션이었다. 카란사가 전방에 섰고, 오스만, 하지 무사가 좌·우",방금 전,https://www.mk.co.kr/news/sports/11256644,매일경제
"“미래의 2선발감” 장현석, MLB.com 선정 다저스 유망주 랭킹 17위 등극",https://static.mk.co.kr/trans_30x13.png,"LA다저스 마이너리그 시스템에서 성장중인 우완 장현석(20)이 구단 유망주 랭킹에 이름을 올렸다. 장현석은 6일(한국시간) MLB.com이 공개한 다저스 유망주 랭킹 17위에 이름을 올렸다. 이들은 20-80스카우팅 스케일을 기준으로 패스트볼 60, 커브 50, 슬라이더 60, 체인지업 55, 컨트롤 40, 종합 평가 45를 부여했다. 2~30은 평균에서",방금 전,https://www.mk.co.kr/news/sports/11256642,매일경제
“매일 좋아지고 있다” 숱한 마이너행 예측에도 김혜성 칭찬한 로버츠 감독 [현장인터뷰],https://static.mk.co.kr/trans_30x13.png,"김혜성에 대한 부정적인 예측들이 쏟아지고 있지만, 데이브 로버츠 LA다저스 감독은 그에 대한 칭찬을 잊지 않았다. 로버츠는 6일(한국시간) 미국 애리조나주 글렌데일에 있는 구단 훈련 시설 캐멀백 랜치 글렌데일에서 취재진을 만난 자리에서 이번 캠프 가장 뜨거운 화두중 하나인 2루수와 중견수 주전 경쟁에 대해 말했다. 그는 “도쿄에 갈때까지 일주일 정도 남았지",방금 전,https://www.mk.co.kr/news/sports/11256639,매일경제
