title,thumbnail,short_content,write_time,link,company
"‘미쳤다’ ATL 에이스 향한 ‘악동’ 베벌리의 역대급 디스 “큰돈 벌면 뭐 해, 이기지 못하잖아”…트레이 영의 반격 “이겨본 적은 있어?”",https://static.mk.co.kr/trans_30x13.png,한때 NBA의 대표적인 더티 플레이어로 유명했던 패트릭 베벌리가 애틀란타 호크스의 에이스 트레이 영을 디스했다. 그리고 영 역시 베벌리에게 제대로 답했다. 시작은 베벌리였다. 그는 자신의 팟캐스트 ‘Pat Bev Podcast’에서 영의 리더십에 대해 비판했다. 베벌리는 “영은 나랑 대화가 될 정도로 많이 이기지 못했다. 플레이오프 경험이 겨우 3번이지 않,방금 전,https://www.mk.co.kr/news/sports/11423791,매일경제
"‘韓 농구’ 바닥없는 추락! ‘亞컵 8강’ 대한민국, 9월 FIBA 랭킹서 3계단 하락한 56위…亞 9위 간신히 유지",https://static.mk.co.kr/trans_30x13.png,"대한민국 농구의 추락은 바닥이 없다. FIBA는 지난 15일(현지시간) 9월 FIBA 랭킹을 발표했다. 최근까지 열린 대륙별 대회가 끝난 후 새롭게 업데이트됐다. 대한민국은 지난 2023년 9월, 무려 13계단이 하락하면서 50위권대로 추락했다. 이후 랭킹 회복이 전혀 되지 않고 있다. 이유는 국제대회에서 좋은 성적을 거두지 못했기 때문이다. 이번에도 마찬",방금 전,https://www.mk.co.kr/news/sports/11423787,매일경제
"‘亞 1등 지켰다!’ 월드컵 우승 외친 일본, FIFA 랭킹 15→17→19위 하락 BUT 그래도 만족한다…“아시아 최상위 자리 지켰어”",https://static.mk.co.kr/trans_30x13.png,"“아시아 최상위 자리를 지켰다.” FIFA는 지난 18일(한국시간) 9월 FIFA 랭킹을 발표했다. 이번 FIFA 랭킹에서 아시아 국가들은 대부분 하락세를 보였다. 이란이 20위에서 21위로 내려왔고 호주 역시 24위에서 25위가 됐다. 일본도 이 흐름을 피하지 못했다. 지난 7월, 17위를 유지했던 그들은 두 계단 하락한 19위가 됐다. 4월에 15위가",방금 전,https://www.mk.co.kr/news/sports/11423786,매일경제
‘올다무’ 다음은 약국이다…크리에이트립 ‘K-약국 카테고리’ 선봬,https://static.mk.co.kr/trans_30x13.png,방한 외국인 관광객 K-뷰티 쇼핑 트렌드가 ‘올리브영·다이소·무신사’를 넘어 약국으로 이어지고 있다. 국내 인바운드 관광 플랫폼 크리에이트립은 이러한 트렌드에 맞춰 외국인 관광객을 대상으로 ‘K-약국 카테고리’ 상품을 정식 출시했다. K-약국 카테고리 상품은 서울과 부산 주요 상권 내 약국을 방문해 약사 상담과 제품 구매를 동시에 경험할 수 있도록 설계된,방금 전,https://www.mk.co.kr/news/culture/11423815,매일경제
‘한국인처럼 즐기기가 대세’ 관광공사 네이버와 ‘비 로컬’ 캠페인 펼쳐,https://static.mk.co.kr/trans_30x13.png,"한국을 방문하는 외국인 여행객 사이에서 한국인보다 더 한국인처럼 즐기기가 트렌드로 자리잡았다. 한국관광공사는 네이버와 9월 17일부터 12월 15일까지 ‘한국인처럼’, ‘한국인이 즐기는 모든 것’을 여행으로 소비하고자 하는 외국인 관광객의 여행 트렌드를 반영해 ‘비 로컬’ 캠페인을 진행한다. 공사와 네이버는 서울, 부산, 경북 경주 지역을 중심으로 ‘네이버",방금 전,https://www.mk.co.kr/news/culture/11423814,매일경제
바다 펼쳐지는 푸른 제주 리조트에서 ‘살아보기’ 장기숙박 하려면,https://static.mk.co.kr/trans_30x13.png,"제주에서 한달살기 로망을 실현할 수 있는 장기 숙박 패키지가 나왔다. 대명소노그룹 소노인터내셔널이 운영하는 소노캄·벨 제주는 다양한 부대시설의 이용권 및 할인 혜택으로 구성한 7·15·30박 패키지를 출시했다. 먼저 소노캄 제주의 ‘올레 살아보기’ 패키지는 슈페리어 스탠다드 객실을 기본으로 △조식 뷔페 30% 할인(1일 4인) △식음업장(옵데강, 셰프스키친",방금 전,https://www.mk.co.kr/news/culture/11423810,매일경제
문 연 직후가 가장 좋아…고객 몰리는 웨스틴 파르나스 식음 프로모션,https://static.mk.co.kr/trans_30x13.png,지난 15일 새롭게 문을 연 웨스틴 서울 파르나스 호텔이 다양한 다이닝 프로모션을 선보인다. 호텔 개관을 기념해 준비한 프로모션으로 웨스틴의 핵심 웰니스 가치 중 하나인 ‘잘 먹기(Eat Wel)’를 반영해 눈길을 끌고 있다. 웰니스 올데이 다이닝 레스토랑 ‘온:테이블(ON:TABLE)’은 유기농 식재료와 수퍼푸드를 활용한 계절별 특선 뷔페 메뉴를 내놓는다,방금 전,https://www.mk.co.kr/news/culture/11423809,매일경제
한가인 “‘이것’ 때문에 11년 간 쇼윈도 부부로 오해”,https://static.mk.co.kr/trans_30x13.png,배우 한가인이 ‘이것’ 때문에 남편 연정훈과 무려 11년 간 불화설에 휩싸였다고 고백했다. 18일 그의 유튜브 채널 ‘자유부인 한가인’에는 “‘이것’ 때문에 11년간 쇼윈도 부부로 오해 받은 한가인 연정훈 부부의 속사정”이라는 제목의 영상이 업로드됐다. 한가인은 이 영상에서 “남편이랑 몇 개월 촬영을 좀 멀리했는데 오랜만에 아이들이 학교를 간 뒤 둘이 맛있,1시간 전,https://www.mk.co.kr/news/culture/11423702,매일경제
8년만에 카네기홀 서는 ‘바이올린 여제’ 정경화 “아직도 배울 많아”,https://static.mk.co.kr/trans_30x13.png,"11월 스물한번째 무대 앞두고 24일 롯데콘서트홀 등서 공연 라스칼라 감독된 동생 정명훈 “최고의 영광...내 자신 겸손해져”‘바이올린 여제’ 정경화가 8년 만에 미국 뉴욕 카네기홀 무대에 선다. 세계적인 공연장이지만, 지금의 정경화를 있게 한 시작점이기도 하다. 77세의 나이에도 여전히 음악 얘기엔 환한 미소를 짓는 그는 카네기홀을 일컬어 “죽을 때까지",3시간 전,https://www.mk.co.kr/news/culture/11423527,매일경제
정명훈 지휘 라스칼라필 내한...‘36년 동행’ 빛났다,https://static.mk.co.kr/trans_30x13.png,내년 음악감독 취임 앞두고 내한 가족 같은 신뢰·하모니에 갈채36년의 동행. 지휘자와 오케스트라로서는 절친을 넘어선 가족 같은 신뢰가 쌓이는 시간이다. 그 동행의 새로운 시작을 알리는 자축연이 서울에서 열렸다. 지휘자 정명훈(72)이 이탈리아의 명문 라 스칼라 오페라 극장 음악감독으로 선임된 뒤 이 극장 소속 단체인 라 스칼라 필하모닉과 첫 내한 연주회로,3시간 전,https://www.mk.co.kr/news/culture/11423525,매일경제
“받는데만 1년 걸렸다”…3억짜리 마이바흐 또 샀다는 추신수 아내 하원미,https://static.mk.co.kr/trans_30x13.png,추신수 아내 하원미가 벤츠 마이바흐를 또 구매했다고 밝혔다. 하원미는 17일 자신의 유튜브 채널 ‘하원미’에 “새로 산 미니쿠퍼 출고식에 초대합니다 to. 추신수”라는 영상을 공개했다. 영상에는 하원미가 출고된 미니 쿠퍼를 받으러 매장을 방문하는 모습이 그려졌다. 아기자기한 내부를 본 하원미는 “너무 예쁘다”라며 만족감을 드러냈다. 새 차를 끌고 첫 운전에,3시간 전,https://www.mk.co.kr/news/culture/11423466,매일경제
정우성 혼외자 출산 후 1년 만 부산 포착…수척해진 근황,https://static.mk.co.kr/trans_30x13.png,"혼외자 논란 극비 혼인 후 공식석상 부일영화상 찾은 정우성 “시상 기회 영광”배우 정우성이 혼외자 논란과 극비 혼인신고 이후 공식석상에 섰다. 18일 오후 부산 해운대구 시그니엘 부산에서 제34회 부일영화상 핸드프린팅 행사가 열린 가운데, 수염을 기르고 등장한 정우성은 1년 만에 부산을 찾은 소감을 묻자 “부산영화제 부일상과 함께한다는 건 늘 즐겁다. 작년",3시간 전,https://www.mk.co.kr/news/culture/11423448,매일경제
[매일경제TV] K원전 미국 진출 본격화,,"최근 한국수력원자력과 두산에너빌리티는 미국 기업들과 업무협약을 통해 소형모듈 원자로인 SMR 시장 진출을 위한 교두보를 마련했다. 또한 두산에너빌리티, 한수원과 삼성물산은 미국의 민간 에너지 개발사업자인 페르미 아메리카와 함께 미국에서 '인공지능 캠퍼스 프로젝트' 추진에 힘을 모으기로 했다.이번 양국 정상회담을 통해 한국은 미국 시장에 직접 진출해 원전 건..",4시간 전,https://www.mk.co.kr/news/culture/11423331,매일경제
