title,thumbnail,short_content,write_time,link,company
"감기 걸리고, 근육 경련에도 ‘49득점’ 활약하다니…GS칼텍스 이영택 감독도 감탄 “대단하다는 말 밖에 안 나오네요” [MK수원]",https://static.mk.co.kr/trans_30x13.png,실바가 실바했다. 100% 컨디션이 아니었음에도 GS칼텍스의 승리를 이끌었다. 이영택 감독은 실바의 기록을 바라보며 그저 감탄했다. GS칼텍스는 11일 수원실내체육관에서 열린 현대건설과 진에어 2025-26시즌 V리그 여자부 1라운드에서 풀세트 접전 끝에 3-2(20-25 27-25 18-25 25-18 15-13)로 승리했다. 3경기 만에 승전고를 울리며,방금 전,https://www.mk.co.kr/news/sports/11465881,매일경제
‘2경기 연속 역전패’ 현대건설 강성형 감독의 아쉬움…“특히 5세트 득점력 부족해” [MK현장],https://static.mk.co.kr/trans_30x13.png,"현대건설 강성형 감독 팀의 ‘득점력 부족’을 지적했다. 현대건설은 11일 수원실내체육관에서 열린 GS칼텍스와 진에어 2025-26시즌 V리그 여자부 1라운드에서 풀세트 접전 끝에 세트 점수 2-3(25-20 25027 25-18 18-25 13-15)으로 패했다. 한 세트씩 주고받았지만, 마지막 5세트에서 미소 짓지 못했다. 양효진이 22득점 4블로킹, 카",방금 전,https://www.mk.co.kr/news/sports/11465875,매일경제
"1596경기 산전수전 다 겪은 베테랑 포수 이재원, 플레잉 코치로 새 출발 “한화 더 강팀 되도록 노력하겠다”",https://static.mk.co.kr/trans_30x13.png,"한화이글스가 포수 이재원을 플레잉코치로 선임했다. 한화이글스는 이재원의 지도자로서의 자질을 높이 평가해 플레잉코치 역할을 제안했고, 이재원도 흔쾌히 구단의 제안을 수락했다. 구단은 이재원이 코치로서 팀 내 젊은 포수들의 기량 향상을 이끌어낼 것이라 기대하며, 선수로서도 아직 팀에 기여할 여지가 남아 있다고 판단해 이 같은 결정을 내렸다. 이재원은 2006년",방금 전,https://www.mk.co.kr/news/sports/11465870,매일경제
"""세대·공간 넘어…더 많은 이들이 예술 만나게 도울 것""",https://static.mk.co.kr/trans_30x13.png,"""26년 만에 다시 메세나대상을 받게 된 것은 예술을 통해 공동체의 발전에 기여하는 '메세나 정신'을 다시금 되새기라는 의미라고 생각한다."" 홍라희 리움미술관 명예관장이 11일 서울 중구 웨스틴조선호텔에서 열린 '2025 한국메세나대회'를 찾아 예술계를 향한 더 풍부한 지원의 뜻을 밝혔다. 삼성문화재단은 매경미디어그룹과 한국메세나협회가 1999년부터 공동 ..",56분 전,https://www.mk.co.kr/news/culture/11465851,매일경제
"이이경, ‘슈돌’ 첫 방송 앞두고 돌연 하차…구체적 이유 언급 없었다",https://static.mk.co.kr/trans_30x13.png,"배우 이이경이 ‘놀면 뭐하니?’에 이어 ‘슈퍼맨이 돌아왔다’에서도 하차한다. 11일 KBS2 예능프로그램 ‘슈퍼맨이 돌아왔다’(이하 ‘슈돌’) 관계자는 매일경제 스타투데이에 “이이경의 ‘슈돌’ 출연이 백지화 됐고, 김종민이 새 MC로 최종 확정됐다”라고 밝혔다. 이이경의 구체적인 하차 이유는 언급하지 않았다. 앞서 10월 ‘슈돌’ 측은 이이경과 랄랄을 새",1시간 전,https://www.mk.co.kr/news/culture/11465843,매일경제
"‘공연 중 실신’ 현아, 미소 되찾았다…“모두 감사합니다”",https://static.mk.co.kr/trans_30x13.png,"마카오 워터밤 공연 중 쓰러져 걱정을 산 가수 현아가 팬들을 안심시켰다. 현아는 11일 자신의 SNS에 “모두 감사합니다”라는 글과 함께 여러 장의 사진을 게재했다. 공개된 사진에는 ‘워터밤 2025 마카오’ 무대를 앞두고 대기실에서 다양한 포즈를 취하는 현아의 모습이 담겼다. 그는 손으로 브이를 그리고 카메라를 바라보거나, 쇼파 위에 앉는 도발적인 포즈로",1시간 전,https://www.mk.co.kr/news/culture/11465834,매일경제
공주 되고 싶다더니 영재원 수료…‘응팔 진주’ 아역 김설 잘 컸네,https://static.mk.co.kr/trans_30x13.png,tvN 드라마 ‘응답하라 1988’에서 진주 역할로 큰 사랑을 받은 아역 배우 김설의 근황이 공개됐다. 지난 10일 김설의 모친이 운영하는 김설의 사회관계망서비스(SNS)에는 “2025. 11. 04 영재원 수료식”이라는 글과 함께 사진이 업로드 됐다. 사진 속 김설은 영재원 수료증을 손으로 가리키며 장난기 가득한 미소를 짓고 있다. 2016년 종영한 ‘응,3시간 전,https://www.mk.co.kr/news/culture/11465761,매일경제
"“7세 아들 사망보험금 전액 기부”…이광기, 선행으로 슬픔 이겨낸 사연",https://static.mk.co.kr/trans_30x13.png,"2009년 신종플루로 7세 아들 잃어 “아들 사망보험금, 아이티 지진 피해 복구에 기부”배우 이광기가 7세 아들을 갑작스럽게 떠나보낸 후 슬픔을 이겨낸 사연을 전했다. 이광기는 11일 공개된 유튜브 채널 ‘CGN’의 콘텐츠에 출연해 지난 2009년 신종플루로 아들을 잃었던 당시를 떠올리며 “모든 게 다 원망스러웠다”고 이야기했다. 그는 “내가 그 아이를 지",3시간 전,https://www.mk.co.kr/news/culture/11465729,매일경제
"[MBN] 직장암 아내·치매 남편, 눈물의 듀엣 무대",https://static.mk.co.kr/trans_30x13.png,"MBN 리얼리티 뮤직쇼 '언포게터블 듀엣'에 최초로 부부가 출연해 깊은 울림을 전한다. 직장암 4기 판정을 받은 무명가수 아내와 10년째 중증 치매를 앓고 있는 남편의 사연이 공개되며 스튜디오는 눈물바다가 된다. 남편이 코를 ""신발""이라 말하며 사물을 잊어가는 모습에 장윤정, 조혜련, 손태진, 효정까지 모두 오열한다. 장윤정은 ""어떻게 그 시간을 버티셨느냐..",4시간 전,https://www.mk.co.kr/news/culture/11465605,매일경제
[매일경제TV] 글로벌 시장 선도하는 혁신 기업들,,"55년 업력의 신신기계는 국내 유일의 선박용 펌프 제조 기술과 유동 해석 기술을 기반으로 원자력 발전소, 해양 플랜트 등 핵심 산업에 고품질 펌프를 공급하며 독보적 기술 우위를 확고히 하고 있다. 이 기술력을 바탕으로 글로벌 시장을 선도 중이다. 유성엔비텍은 흐르는 물에 플라스마 기체를 주입해 병원균과 유기물을 99.99% 분해·정화하는 친환경 플라스마 물..",4시간 전,https://www.mk.co.kr/news/culture/11465606,매일경제
향단의 시각으로 재구성한 춘향전,https://static.mk.co.kr/trans_30x13.png,"국립국악원이 '춘향전'을 새로운 시각으로 각색한 무용극 '춘향단전'을 오는 14일부터 사흘간 선보인다. '춘향단전'은 춘향과 몽룡의 사랑을 지켜보던 향단을 주인공으로 내세운 작품이다. 기존 이야기에서 주변 인물이던 향단의 사랑과 질투, 욕망 속에서 흔들리는 모습을 그린다. 몽룡의 오해로 춘향 대신 입맞춤을 받게 된 향단은 이뤄질 수 없는 사랑에 사로잡혀 점..",4시간 전,https://www.mk.co.kr/news/culture/11465603,매일경제
英부커상에 소설 '플레시',https://static.mk.co.kr/trans_30x13.png,"헝가리계 영국인 작가 데이비드 살레이(사진)의 장편소설 '플레시(Flesh)'가 올해 부커상 수상작으로 선정됐다. 부커상 심사위원회는 10일(현지시간) 살레이 소설 '플레시'를 부커상 수상작으로 선정했다. 소설 '플레시'는 15세 소년 이슈트반이 청소년기를 지나 노년에 이르기까지의 여정을 따라가는 작품이다. 부커상 심사위원회는 ""삶을 살 가치가 있게 만드는..",4시간 전,https://www.mk.co.kr/news/culture/11465604,매일경제
"""케데헌에 '불이중도' 사상 담겨있죠""",https://static.mk.co.kr/trans_30x13.png,"""넷플릭스 애니메이션 '케이팝 데몬 헌터스(케데헌)'에 깊은 사상이 깔려 있더군요. 이른바 불교에서 말하는 불이중도(不二中道) 사상이요."" KAIST 명상과학연구소장을 맡고 있는 미산 스님(사진)은 11일 서울 북촌 안국선원에서 열린 '밝은사람들연구소 총서 총 20권' 발간 기념 간담회에 참석해 ""케데헌 주인공 중 한 명이 헌터이면서 데몬의 피를 받았다는 ..",4시간 전,https://www.mk.co.kr/news/culture/11465601,매일경제
