title,thumbnail,short_content,write_time,link,company
"‘오타니 나와!’ LAFC 손흥민, LA다저스에 뜬다!…28일 시구 예정, “솔직히 나쁘지 않은데?”",https://static.mk.co.kr/trans_30x13.png,"손흥민이 로스앤젤레스(LA) 시민 앞에 첫 모습을 내비칠 예정이다. 다만, 장소가 다소 어색하다. 축구장이 아닌 야구장이다. 손흥민은 28일(한국시간) 미국 LA 다저 스타디움에서 열리는 LA다저스와 신시내티 레즈의 2025 미국 메이저리그(MLB) 경기에 시구자로 나선다. 소속팀 LAFC는 손흥민의 시구 연습 장면을 공개했다. 22일 구단 SNS를 통해",방금 전,https://www.mk.co.kr/news/sports/11400925,매일경제
"‘웬만하면 그들을 막을 수 없다!’ 선두 LG, KIA 14-2 대파하며 4연승 질주…2위 한화와 5.5G 차",https://static.mk.co.kr/trans_30x13.png,웬만하면 LG 트윈스를 막을 수 없다. 상승세를 이어가며 독주 체제 구축의 발판을 마련했다. 염경엽 감독이 이끄는 LG는 22일 광주-KIA챔피언스필드에서 열린 2025 프로야구 KBO리그 원정경기에서 이범호 감독의 KIA 타이거즈에 14-2 대승을 거뒀다. 이로써 파죽의 4연승을 달린 선두 LG는 71승 3무 43패를 기록했다. 같은 날 2위 한화 이글스,방금 전,https://www.mk.co.kr/news/sports/11400911,매일경제
“끔찍한 학살의 역사 뒤엔 꼭 이 나라가”...‘신사’로 이미지 세탁한 피의 제국[Book],https://static.mk.co.kr/trans_30x13.png,"아프리카 등 식민지배 국가서 폭력과 억압 체계화한 제국들 퓰리처상 수상한 하버드대 교수 제국주의 이면의 그늘 파헤쳐영(英) 제국은 역사상 존재했던 가장 큰 제국이었다. 1920년대 전성기에는 전 세계 육지의 4분의 1이 영국의 울타리 안에 있었을 정도다. 당시 ‘해가 지지 않는 나라’로 불렸던 영국은 군대와 공무원, 선교사, 물품이 오가는 거대한 네트워크",방금 전,https://www.mk.co.kr/news/culture/11400893,매일경제
'케데헌2' 만들면 한국 트로트 담고 싶어요,https://static.mk.co.kr/trans_30x13.png,"자신감과 진정성. 세계적 신드롬을 일으키고 있는 넷플릭스 애니메이션 영화 '케이팝 데몬 헌터스'(이하 '케데헌')를 만든 한국계 캐나다인 연출자인 매기 강 감독이 강조한 두 단어다. 그는 22일 서울 용산CGV에서 열린 내한 기자간담회에서 ""한국 문화가 앞으로도 세계적인 사랑을 받는 유일한 길은 자신감 있게 우리 문화와 관점을 보여주는 것""이라고 말했다. ..",3시간 전,https://www.mk.co.kr/news/culture/11400744,매일경제
공연 한복판에 걸어 들어갔다 관객 발걸음이 서사가 된다,https://static.mk.co.kr/trans_30x13.png,"역사 속으로 사라진 서울 충무로 대한극장 터에 새로 생긴 '매키탄 호텔'. 이곳은 스크린과 막의 경계가 사라진, 관객의 무대다. 배우를 따라다니며 보는 무용극 또는 1인칭 시점의 몰입형 연극, 대규모 방탈출 게임, 그 무엇이라고 느껴도 좋다. 자신만의 모험으로 자신만의 이야기를 경험하면 된다. 관객 몰입형 공연(이머시브 시어터)의 원조로 꼽히는 '슬립노모어..",4시간 전,https://www.mk.co.kr/news/culture/11400627,매일경제
"숲 한가운데서 찾았다 … 하늘, 바람, 별의 언어",https://static.mk.co.kr/trans_30x13.png,"서울대를 다니던 독문학도가 어느 날 덜컥 학업을 접고 그림을 그리기로 결심했다. 휴학 후 방황하는 모습에 부친은 '그럼 하고 싶은 걸 해보라'고 선뜻 허락을 해줬고, 독일로 떠나 베를린 예술종합대에서 회화 공부를 시작했다. 늦깎이 화가는 오히려 고정관념이 없어서 재료도 소재도 자유롭게 선택할 수 있었다. 문화적 경계를 넘나드는 회화를 하게 된 비결이다. 1..",4시간 전,https://www.mk.co.kr/news/culture/11400626,매일경제
[MBN] 삼각관계와 직진 고백,https://static.mk.co.kr/trans_30x13.png,"'돌싱하우스' 3일 차, 희종은 모두가 모인 거실에서 ""예원과의 마음 정리는 끝났다""며 지우에게 거침없는 직진을 선언한다. ""나랑 내일 데이트하자""는 대담한 고백에 스튜디오는 술렁이고, 지우와 쌍방 호감을 이어온 성우는 복잡한 심경에 빠진다. 그러나 성우의 행동을 지우가 오해하면서 두 사람 사이엔 서먹한 기류가 흐르고, 삼각관계의 중심에 선 지우의 선택에 ..",4시간 전,https://www.mk.co.kr/news/culture/11400620,매일경제
[MBN] 김도균의 '고속노화' 라이프,https://static.mk.co.kr/trans_30x13.png,"기타리스트 김도균, 가정의학과 전문의 박용우, 배우 김영옥 등이 출연해 '나 죽어도 안 죽어'라는 주제로 이야기를 나눈다. 김도균은 ""편의점 음식으로 매 끼니를 해결하지만 시간 간격만큼은 철저히 지킨다""며 '규칙적인 불규칙 생활'을 고백하고, 자신의 독특한 생활습관을 공개해 웃음을 자아낸다. 배우 최성국은 ""(김도균이) 삼각김밥 맛만 봐도 편의점 브랜드를 ..",4시간 전,https://www.mk.co.kr/news/culture/11400621,매일경제
"“건강 악화…괜찮으면 참석할 것” 전유성, ‘부코페’ 참석 불투명",https://static.mk.co.kr/trans_30x13.png,‘개그계 대부’ 전유성(76)의 건강 문제로 ‘제 13회 부산국제코미디페스티벌’(이하 ‘부코페’) 출연이 불확실해졌다. 22일 부산국제코미디페스티벌 측은 매일경제 스타투데이에 “전유성 선배님 컨디션이 좋지 않다. 우선 상황을 보면서 스케줄을 유동적으로 보고 있다. 컨디션이 괜찮으실 경우 참석 할 수 있다”고 밝혔다. 전유성은 오는 9월 6일 부산 해운대구,5시간 전,https://www.mk.co.kr/news/culture/11400598,매일경제
'내가 좋아서' 빠져든 미술컬렉션의 세계,https://static.mk.co.kr/trans_30x13.png,"한국의 대표 미술품 컬렉터 17인을 만나 그들이 미술품 사랑의 비밀을 들여다보는 책이 나왔다. 안병광 유니온그룹 회장, 김정완 매일홀딩스 회장, 김희근 벽산엔지니어링 회장 등 베테랑 컬렉터부터 와인바를 소장품으로 채운 심준섭 오프닝 대표, 1990년대생 젊은 컬렉터 노재명 아트 오앤오 대표까지 신구 세대를 막론한 국가 대표 컬렉터들을 만나 이들의 이야기를 ..",5시간 전,https://www.mk.co.kr/news/culture/11400592,매일경제
[표] 베스트셀러,https://static.mk.co.kr/trans_30x13.png,,5시간 전,https://www.mk.co.kr/news/culture/11400593,매일경제
은행 입출금 서비스 기원은 십자군 전쟁서 시작됐다고?,https://static.mk.co.kr/trans_30x13.png,"은행, 국채, 세금. 이름만 들어도 머리가 지끈거리는 경제 용어다. 난해한 개념과 숱한 숫자들이 접근성을 떨어뜨려서다. 역사 스토리로 어려운 경제 개념을 쉽게 설명하는 책이 나왔다. '돈으로 읽는 세계사'다. 온라인 누적 조회 수 1000만회를 넘긴 매일경제 연재물 '히코노미(History+Economy)'를 엮었다. 책은 중세와 근세를 넘나든다. 역사 이..",5시간 전,https://www.mk.co.kr/news/culture/11400591,매일경제
