title,thumbnail,short_content,write_time,link,company
"오세훈, 野 추경안에 ""민생회복지원금 이름만 바꿔…국민 기만""",https://thumb.mt.co.kr/04/2025/02/2025021515535068210_1.jpg,"오세훈 서울시장은 더불어민주당이 제안한 35조원 규모의 추가경정예산안을 두고 ""민생회복 지원금을 소비쿠폰으로 이름만 바꿔서...",2025.02.15 16:01,https://news.mt.co.kr/mtview.php?no=2025021515535068210&type=2&sec=politics&pDepth2=Ptotal,머니투데이
"김문수 고용장관 ""반얀트리 화재사고, 중대재해법 등 따져 엄정 조치""",https://thumb.mt.co.kr/04/2025/02/2025021514410127021_1.jpg,김문수 고용노동부 장관이 지난 14일 부산의 한 호텔 신축 공사장에서 발생한 화재사고와 관련해 첫 중앙사고수습본부 회의를 열고 &quo...,2025.02.15 14:46,https://news.mt.co.kr/mtview.php?no=2025021514410127021&type=2&sec=politics&pDepth2=Ptotal,머니투데이
신라면·짜파게티…훨씬 많이 팔고도 '영업익 2배' 역전 당했다[핑거푸드],https://thumb.mt.co.kr/04/2025/02/2025021414422548264_2.jpg,지난해 라면업계에선 '불닭볶음면'을 내세운 삼양식품이 매출이 2배 큰 농심보다 영업이익이 2배 많은 기이한 역전 현상이 벌어져 눈길을 ...,2025.02.15 09:20,https://news.mt.co.kr/mtview.php?no=2025021414422548264&type=2&sec=politics&pDepth2=Ptotal,머니투데이
"남편, 친정엄마에 간이식 후 생활고…""진짜 돈 들어왔어"" 펑펑 운 사연",https://thumb.mt.co.kr/04/2025/02/2025021416183720025_1.jpg,#저는 남편과 어린 두 남매를 키우는 30대 전업주부입니다. 외벌이를 하는 남편은 인테리어 목수 일이 없을 때는 퀵배달을 나갔습니다. 그...,2025.02.15 07:35,https://news.mt.co.kr/mtview.php?no=2025021416183720025&type=2&sec=politics&pDepth2=Ptotal,머니투데이
"트럼프 ""4월2일쯤 車관세 내놓을 것""…한국 직접 영향 불가피",https://thumb.mt.co.kr/04/2025/02/2025021507162245406_1.jpg,도널드 트럼프 미국 대통령이 14일(현지시간) 미국에 수입되는 자동차에 대한 관세를 오는 4월2일쯤 내놓을 계획이라고 밝혔다. 전날 전 세...,2025.02.15 07:21,https://news.mt.co.kr/mtview.php?no=2025021507162245406&type=2&sec=politics&pDepth2=Ptotal,머니투데이
"""'비관세장벽' 감안""…'플랫폼 규제', 트럼프 상호관세 트리거되나",https://thumb.mt.co.kr/04/2025/02/2025021410423690144_1.jpg,"도널드 트럼프 미국 대통령이 상호관세를 부과할 때 단순관세율 외에 규제, 환율정책 등 '비관세장벽'도 고려하겠다고 밝히면서 한국도 상...",2025.02.15 07:20,https://news.mt.co.kr/mtview.php?no=2025021410423690144&type=2&sec=politics&pDepth2=Ptotal,머니투데이
상호관세 발표한 트럼프…자동차·반도체 다음 대상은?,https://thumb.mt.co.kr/04/2025/02/2025021413285099788_1.jpg,도널드 트럼프 미국 대통령이 다수의 국가를 대상으로 한 상호관세 조치를 발표하면서 주요 대미 무역흑자국인 우리나라도 포함될 수 있다...,2025.02.15 06:40,https://news.mt.co.kr/mtview.php?no=2025021413285099788&type=2&sec=politics&pDepth2=Ptotal,머니투데이
상호관세 꺼내든 미국…속내는 비관세·무역장벽 해소?,https://thumb.mt.co.kr/04/2025/02/2025021416112699029_1.jpg,도널드 트럼프 대통령이 '상호관세'를 꺼내들면서 우리 경제에 미치는 여파에 관심이 쏠린다. 한미가 자유무역협정(FTA)을 체결한 만큼 ...,2025.02.15 06:19,https://news.mt.co.kr/mtview.php?no=2025021416112699029&type=2&sec=politics&pDepth2=Ptotal,머니투데이
[TheTax] 주식 팔아 양도세 냈는데…왜 내 세금은 남들의 3배?,https://thumb.mt.co.kr/04/2025/02/2025021416022530509_1.jpg,#A씨는 주식 양도후 중소기업 소액 주주의 주식 양도차익에 적용되는 10% 세율을 적용해 주식 양도소득세 예정신고를 했다. 그러나 A씨...,2025.02.15 05:58,https://news.mt.co.kr/mtview.php?no=2025021416022530509&type=2&sec=politics&pDepth2=Ptotal,머니투데이
"60대 부모 일 가는데 20대 자식 ""그냥 쉰다""…'경제허리'도 홀쭉",https://thumb.mt.co.kr/04/2025/02/2025021416144569130_1.jpg,올해 고용시장 전망이 어둡다. 노인 일자리를 토대로 60대 이상 취업자는 늘고 있지만 청년층 취업자수는 가파르게 줄고 있다. 저출생에 따...,2025.02.15 05:40,https://news.mt.co.kr/mtview.php?no=2025021416144569130&type=2&sec=politics&pDepth2=Ptotal,머니투데이
'부산 리조트 화재' 중수본 15일 첫 회의…향후 계획 등 논의,https://thumb.mt.co.kr/04/2025/02/2025021420491779644_1.jpg,6명의 사망자를 낸 부산 기장군 반얀트리 리조트 신축 공사장 화재사고와 관련해 정부가 중앙사고수습본부(중수본)를 본격 가동한다. 고용...,2025.02.14 20:52,https://news.mt.co.kr/mtview.php?no=2025021420491779644&type=2&sec=politics&pDepth2=Ptotal,머니투데이
부산 기장군 리조트 화재 '대응단계 해제'…6명 사망·27명 경상,https://thumb.mt.co.kr/04/2025/02/2025021418524760399_1.jpg,부산 기장군 반얀트리 리조트 신축 공사장 화재로 6명이 사망하고 27명이 경상을 입었다. 소방당국은 대응단계를 해제했다. 14일 소방청에...,2025.02.14 18:56,https://news.mt.co.kr/mtview.php?no=2025021418524760399&type=2&sec=politics&pDepth2=Ptotal,머니투데이
"고용부 '부산 공사장 화재' 수습본부 구성…""작업중지, 엄정수사""",https://thumb.mt.co.kr/04/2025/02/2025021418052879058_1.jpg,고용노동부가 부산 공사장 화재사고 관련해 중앙사고수습본부를 구성해 현장 대응에 나섰다. 김문수 고용노동부 장관은 14일 부산 기장군...,2025.02.14 18:13,https://news.mt.co.kr/mtview.php?no=2025021418052879058&type=2&sec=politics&pDepth2=Ptotal,머니투데이
청년 농수산인재 592명 배출…한농대 제26회 학위수여식,https://thumb.mt.co.kr/04/2025/02/2025021417122486283_1.jpg,14일 한국농수산대학교 졸업식에서 이유림(특용작물학과)·김현재(어류양식전공) 등 8명이 농식품부·해수부 장관상을 각각 수상했다 . ...,2025.02.14 17:48,https://news.mt.co.kr/mtview.php?no=2025021417122486283&type=2&sec=politics&pDepth2=Ptotal,머니투데이
지역 주축산업 이끄는 중기 지원 확 늘린다…전년대비 1500억원 확대,https://thumb.mt.co.kr/04/2025/02/2025021409233711249_1.jpg,중소벤처기업부가 최근 세계 관세전쟁 추세에 대응하기 위해 지역중소기업들에 대한 지원을 확대한다. 전년대비 예산도 1500억원 늘렸다. ...,2025.02.14 15:58,https://news.mt.co.kr/mtview.php?no=2025021409233711249&type=2&sec=politics&pDepth2=Ptotal,머니투데이
"원/달러 환율 종가, 4원 내린 1443.5원",,14일 서울 외환시장. 원/달러 환율 오후 3시30분 종가. ...,2025.02.14 15:32,https://news.mt.co.kr/mtview.php?no=2025021415275781761&type=2&sec=politics&pDepth2=Ptotal,머니투데이
"""정부 약가인하, 약제부담 되레 증가시켜…약가 통합관리 해야""",https://thumb.mt.co.kr/04/2025/02/2025021414414484518_1.jpg,정부의 약가 인하 정책이 되레 소비자의 약제 부담을 증가시켰다는 연구결과가 나왔다. 약가 인하가 신약 연구개발(R&D)에 악영향...,2025.02.14 14:59,https://news.mt.co.kr/mtview.php?no=2025021414414484518&type=2&sec=politics&pDepth2=Ptotal,머니투데이
사상 첫 '4조 클럽' 숙원 이룬 코웨이..배당도 통크게 '더블',https://thumb.mt.co.kr/04/2025/02/2025021414215561814_1.jpg,"코웨이가 숙원이던 연매출 4조원 클럽에 이름을 올렸다. 코웨이는 지난해 매출액이 4조3101억원, 영업이익이 7954억원으로 전년 대비 각...",2025.02.14 14:57,https://news.mt.co.kr/mtview.php?no=2025021414215561814&type=2&sec=politics&pDepth2=Ptotal,머니투데이
필리핀 가사관리사 누가 쓰냐고?…강남 부자 집중 우려,https://thumb.mt.co.kr/04/2025/02/2025021414005755051_1.jpg,정부가 저출생·고령화 정책의 일환으로 실시한 필리핀 가사관리사 시범사업을 연장한다. 기간 연장에 따라 퇴직금 등이 발생해 시간당 이...,2025.02.14 14:08,https://news.mt.co.kr/mtview.php?no=2025021414005755051&type=2&sec=politics&pDepth2=Ptotal,머니투데이
필리핀 가사관리사 3년 일할 수 있다…이용료는 시간당 2860원 인상,https://thumb.mt.co.kr/04/2025/02/2025021413403562706_1.jpg,지난해 9월 3일 시작한 '외국인 가사관리사 시범사업'이 이달 말 종료되는 가운데 필리핀 가사관리사들의 취업활동기간이 3년으로 늘어 아...,2025.02.14 14:06,https://news.mt.co.kr/mtview.php?no=2025021413403562706&type=2&sec=politics&pDepth2=Ptotal,머니투데이
"崔 권한대행, 부산 화재 사고에 ""가용 인력·장비 총동원""",https://thumb.mt.co.kr/04/2025/02/2025021413242551363_1.jpg,"최상목 대통령 권한대행 부총리 겸 기획재정부 장관이 14일 부산 기장군 반얀트리 공사 현장 화재에 대해 ""가용 인력과 장비를 총동원해 화재 진압에 최선을 다하라""라고 지시했다. 최 권한대행...",2025.02.14 13:27,https://news.mt.co.kr/mtview.php?no=2025021413242551363&type=2&sec=politics&pDepth2=Ptotal,머니투데이
계엄·관세전쟁에 韓증시 떠나는 외국인…1월 17.8억달러 순유출,https://thumb.mt.co.kr/04/2025/02/2025021409502481446_1.jpg,지난달 국내 증권시장에서 외국인 증권투자자금이 5개월 연속 순유출됐다. 12·3 비상계엄 여파와 미국 신행정부 출범에 따른 글로벌 불확실성 등이 겹친 결과다. 다만 1월 들어 순유출 규모는 축소됐다. 한국은행...,2025.02.14 13:12,https://news.mt.co.kr/mtview.php?no=2025021409502481446&type=2&sec=politics&pDepth2=Ptotal,머니투데이
올해 중증장애인 국가공무원 68명 선발...3월 원서접수,https://thumb.mt.co.kr/04/2025/02/2025021408085957689_1.jpg,"올해 중증장애인 국가공무원 68명이 행정과 전산, 농업 등의 분야에서 선발된다. 인사혁신처는 '2025년도 중증장애인 국가공무원 경력경쟁채용시험 시행계획'을 사이버국가고시센터(www.gosi.kr)에 14...",2025.02.14 12:00,https://news.mt.co.kr/mtview.php?no=2025021408085957689&type=2&sec=politics&pDepth2=Ptotal,머니투데이
"정부-경제6단체 '일자리 창출협약'…최상목 ""취약부문 일자리 지원""",https://thumb.mt.co.kr/04/2025/02/2025021409255937831_1.jpg,정부와 '일자리 창출 협약'을 맺은 경제6단체가 올해 채용규모를 늘리고 채용시기도 최대한 상반기로 앞당기기로 했다. 정부는 민간 일자리 창출을 지원하는 한편 공공기관 신규채용을 확대하고 청년들이 선호하는 ...,2025.02.14 11:20,https://news.mt.co.kr/mtview.php?no=2025021409255937831&type=2&sec=politics&pDepth2=Ptotal,머니투데이
"美수입품 평균관세율 0.79%…최상목 ""상호관세, 국내영향 크지 않아""",https://thumb.mt.co.kr/04/2025/02/2025021410523645492_1.jpg,"최상목 대통령 권한대행 부총리 겸 기획재정부 장관이 14일 ""(미국의) 상호관세 부과 조치에 대해 한미 FTA(자유무역협정)로 인해 적용관세율이 낮아 우리 경제에 대한 영향은 크지 않을 수 있지만 미국...",2025.02.14 11:17,https://news.mt.co.kr/mtview.php?no=2025021410523645492&type=2&sec=politics&pDepth2=Ptotal,머니투데이
1월 취업자수 한달만에 플러스…건설·청년 고용 불안은 악화,https://thumb.mt.co.kr/04/2025/02/2025021409053019088_1.jpg,"지난해 12월 46개월 만에 마이너스를 기록했던 취업자 수가 한 달 만에 증가세로 전환했다. 그러나 건설업, 도소매업, 제조업에서는 취업자수가 줄고 청년층의 고용 불안은 악화됐다. 특히 건설업 취업자는 2013년 ...",2025.02.14 11:16,https://news.mt.co.kr/mtview.php?no=2025021409053019088&type=2&sec=politics&pDepth2=Ptotal,머니투데이
"최상목 ""한미FTA로 상호관세 영향 크지 않을듯…'비관세장벽' 예의주시""",https://thumb.mt.co.kr/04/2025/02/2025021410321337905_1.jpg,"최상목 대통령 권한대행 부총리 겸 기획재정부 장관이 14일 ""(미국의) 상호관세 부과 조치에 대해 한미 FTA(자유무역협정)로 인해 적용관세율이 낮아 우리 경제에 대한 영향은 크지 않을 수 있지만 미국...",2025.02.14 10:41,https://news.mt.co.kr/mtview.php?no=2025021410321337905&type=2&sec=politics&pDepth2=Ptotal,머니투데이
"아직 암울한 경제 진단…정부 ""경기 하방 압력 증가""",https://thumb.mt.co.kr/04/2025/02/2025021408152952660_1.jpg,정부의 암울한 경기진단이 이어진다. '12·3 비상계엄'과 미국 신행정부 출범 등 대내외 불확실성 확대에 따라 경제심리가 악화된 영향이다. 고환율 속 물가가 다시 꿈틀대고 내수 한파로 고용시장 어려움이 가중되...,2025.02.14 10:00,https://news.mt.co.kr/mtview.php?no=2025021408152952660&type=2&sec=politics&pDepth2=Ptotal,머니투데이
"기정원 K-바이오랩허브, 신규 입주·멤버십 기업 모집",https://thumb.mt.co.kr/04/2025/02/2025021408543985854_1.jpg,중소기업기술정보진흥원 K-바이오랩허브사업추진단이 인천경제자유구역청과 함께 의약바이오 분야 혁신 스타트업 육성을 위한 신규 입주·멤버십기업을 모집한다고 14일 밝혔다. 'K-바이오랩허브'는 2023년부터 ...,2025.02.14 09:04,https://news.mt.co.kr/mtview.php?no=2025021408543985854&type=2&sec=politics&pDepth2=Ptotal,머니투데이
"원/달러 환율, 6원 내린 1441.5원 출발",,14일 서울 외환시장에서 원/달러 환율이 전 거래일 종가 대비 6원 내린 1441.5원에 거래를 시작했다. ...,2025.02.14 09:02,https://news.mt.co.kr/mtview.php?no=2025021408334484796&type=2&sec=politics&pDepth2=Ptotal,머니투데이
"최 권한대행 ""공매도 재개 위한 후속조치 만전 기해달라""",https://thumb.mt.co.kr/04/2025/02/2025021408482465180_1.jpg,"최상목 대통령 권한대행 부총리 겸 기획재정부 장관이 14일 ""미국의 상호관세 부과 발표 등 주요국 정책, 지정학적 요인 및 국제금융시장 동향을 24시간 예의주시하며 대응할 것""이라고 밝혔다. ...",2025.02.14 09:01,https://news.mt.co.kr/mtview.php?no=2025021408482465180&type=2&sec=politics&pDepth2=Ptotal,머니투데이
"국제유가·환율 상승에 수입물가 4개월째 상승…커피, 전년比 94.3%↑",https://thumb.mt.co.kr/04/2025/02/2025021316140845778_1.jpg,지난달 수입물가가 4개월 연속 상승했다. 국제유가와 원/달러 환율이 모두 오른 영향이다. 수입물가 상승은 시차를 두고 소비자물가 상승 압력으로 작용할 수 있다. 특히 커피 수입물가는 공급량 부족 우려 등이 겹...,2025.02.14 08:13,https://news.mt.co.kr/mtview.php?no=2025021316140845778&type=2&sec=politics&pDepth2=Ptotal,머니투데이
1월 취업자수 전년 比 13.5만↑…청년층 취업은 21.8만↓,https://thumb.mt.co.kr/04/2025/02/2025021407410384051_1.jpg,지난달 취업자수가 전년 동월 대비 13만5000명 늘었다. 15~29세 청년층 취업자수는 21만8000명 줄었다. 청년층 고용률 하락폭은 1.5%p(포인트)로 2021년 1월 -2.9%p 이후 가장 크다. 통계청이 14일 발표한 '2025...,2025.02.14 08:12,https://news.mt.co.kr/mtview.php?no=2025021407410384051&type=2&sec=politics&pDepth2=Ptotal,머니투데이
[속보]1월 취업자수 전년 比 13만5000명↑…고용률 68.8%,https://thumb.mt.co.kr/04/2025/02/2025021407391076632_1.jpg,통계청 1월 고용동향 ...,2025.02.14 08:00,https://news.mt.co.kr/mtview.php?no=2025021407391076632&type=2&sec=politics&pDepth2=Ptotal,머니투데이
"""환율까지 따지겠다""는 트럼프 상호관세, '관찰대상국' 韓 어쩌나",https://thumb.mt.co.kr/04/2025/02/2025021407000780656_1.jpg,도널드 트럼프 미국 대통령이 예고한 대로 13일(현지시간) 상호관세 조치를 발표했다. 오는 4월1일까지 무역 상대국의 관세와 비관세 장벽을 하나하나 검토해 상호관세를 차등 부과하겠다는 방침이다. 사실상 미국...,2025.02.14 07:22,https://news.mt.co.kr/mtview.php?no=2025021407000780656&type=2&sec=politics&pDepth2=Ptotal,머니투데이
"""1500조원 시장이 온다""...美 군함 해외발주에 K-방산 '잭팟' 터지나",https://thumb.mt.co.kr/04/2025/02/2025021317192663451_1.jpg,미국 공화당이 미 군함을 한국 등 동맹국에서 건조할 수 있도록 법안을 발의한 것은 중국과의 해군력 증강 경쟁에서 절대적 열세라는 우려에 따른 것으로 분석된다. 도널드 트럼프 미국 대통령이 자국 산업 보호...,2025.02.14 05:51,https://news.mt.co.kr/mtview.php?no=2025021317192663451&type=2&sec=politics&pDepth2=Ptotal,머니투데이
[기고]퇴직연금 적립금의 주식투자 한도가 문제가 아니다,https://thumb.mt.co.kr/04/2025/02/2025021313222658639_1.jpg,최근 금융위와 금감원에서 2%대로 저조한 퇴직연금 수익률을 개선하기 위해 근로자가 투자책임을 지는 확정기여형(DC)과 개인형퇴직연금(IRP)에서 적립금의 100%를 주식에 투자토록 허용하자는 의견을 내고 ...,2025.02.14 05:36,https://news.mt.co.kr/mtview.php?no=2025021313222658639&type=2&sec=politics&pDepth2=Ptotal,머니투데이
[기자수첩] 추경 '골든타임',https://thumb.mt.co.kr/04/2025/02/2025021313265663689_1.jpg,2025년 대한민국은 암울하다. '12·3 비상계엄 사태'로 촉발된 정치적 문제 때문만은 아니다. 경제 상황이 좋지 않다. 올해 우리나라는 1%대 저성장이 예상된다. 정부는 물론 국내외 기관 전망이 엇비슷하다. 가뜩...,2025.02.14 05:15,https://news.mt.co.kr/mtview.php?no=2025021313265663689&type=2&sec=politics&pDepth2=Ptotal,머니투데이
"[속보]백악관, 반도체법 보조금 재협상 추진-로이터",https://thumb.mt.co.kr/04/2025/02/2025021405134919140_1.jpg,도널드 트럼프 미국 대통령이 전임 조 바이든 행정부 시절 삼성전자 등이 받기로 확정한 반도체 보조금을 재협상할 계획이라고 로이터 통신이 13일(현지시간) 백악관 소식통을 인용해 보도했다. 로이터 통신에 따...,2025.02.14 05:14,https://news.mt.co.kr/mtview.php?no=2025021405134919140&type=2&sec=politics&pDepth2=Ptotal,머니투데이
"[속보]美상무 ""상호관세, 국가별 검토 4월1일까지 완료 후 시행""",https://thumb.mt.co.kr/04/2025/02/2025021404453034325_1.jpg,"하워드 러트닉 미국 상무부 장관 지명자가 13일(현지시간) 워싱턴DC 백악관 대통령 집무실에서 진행된 기자회견에서 ""상호관세를 국가별로 오는 4월1일까지 검토한 뒤 시행하겠다""고 밝혔다. ...",2025.02.14 04:46,https://news.mt.co.kr/mtview.php?no=2025021404453034325&type=2&sec=politics&pDepth2=Ptotal,머니투데이
"KTC, 기계산업 외국인력 활용 지원…품질·안전 인증 협력 강화",https://thumb.mt.co.kr/04/2025/02/2025021314101381833_1.jpg,한국기계전기전자시험연구원(KTC) 기계ISC(기계산업 인적자원개발위원회)가 기계산업 분야에서 외국인력을 활용하려는 기업을 지원하고 실무적인 정보를 제공하는 자리를 마련했다. KTC 기계ISC는 는...,2025.02.13 14:27,https://news.mt.co.kr/mtview.php?no=2025021314101381833&type=2&sec=politics&pDepth2=Ptotal,머니투데이
"가스공사, 수소 생태계 불씨 살린다…도시가스 수소 혼입 20%",https://thumb.mt.co.kr/04/2025/02/2025021313295098800_1.jpg,"수소는 탄소중립과 에너지전환을 위한 필수 에너지로, 그 수요가 2050년에 약 250백만 톤에 이를 것으로 예측되면서 차세대 친환경 에너지원으로 부상했다. 하지만 기술 미성숙에 따른 상용화·대형화 지연 등이 정...",2025.02.13 14:20,https://news.mt.co.kr/mtview.php?no=2025021313295098800&type=2&sec=politics&pDepth2=Ptotal,머니투데이
"한전KPS ""어제의 안전이 오늘의 안전을 보장하지 않는다""",https://thumb.mt.co.kr/04/2025/02/2025021314014227503_1.jpg,발·송전 설비 정비 전문 공기업인 한전KPS가 안전하고 행복한 일터 조성을 위해 전사 차원에서 나섰다. 한전KPS는 13일 전남 나주 본사 대회의실에서 '2025년 노·사·감 합동 안전실천 다짐행사'를 열고 ...,2025.02.13 14:15,https://news.mt.co.kr/mtview.php?no=2025021314014227503&type=2&sec=politics&pDepth2=Ptotal,머니투데이
"관세청, 中企 및 소상공인 대상 '원산지검증 대응 지원사업' 실시",https://thumb.mt.co.kr/04/2025/02/2025021313260986419_1.jpg,관세청은 중소기업 및 소상공인을 대상으로 '원산지검증 대응 지원사업'을 시작한다고 13일 밝혔다. '원산지검증'은 수입국 관세당국이 자유무역협정(FTA)에 따라 특혜관세를 신청한 수입물품에 대해 원산지 요...,2025.02.13 13:52,https://news.mt.co.kr/mtview.php?no=2025021313260986419&type=2&sec=politics&pDepth2=Ptotal,머니투데이
"""또 재난문자, 차단할까"" 이런 사람 늘자…중복 막고 글자 수 늘린다",https://thumb.mt.co.kr/04/2025/02/2025021308163293805_1.jpg,정부가 재난문자 글자 수를 확대하고 필터링 기능을 도입해 중복 발송을 방지한다. 행정안전부는 국민에게 보다 나은 재난문자 서비스를 제공하기 위해 오는 14일 '재난문자방송 운영협의회'를 개최하고 개선방안을...,2025.02.13 12:00,https://news.mt.co.kr/mtview.php?no=2025021308163293805&type=2&sec=politics&pDepth2=Ptotal,머니투데이
"기관별 데이터기반행정 수준 격차 여전…""편차 해소 힘쓸 것""",https://thumb.mt.co.kr/04/2025/02/2025021308305650939_1.jpg,정부 기관의 데이터기반행정에 대한 이행 수준을 점검한 결과 '우수' 등급 기관 비중이 40%를 넘었지만 '미흡' 등급 기관 비중도 높아 수준 격차가 높은 것으로 나타났다. 행정안전부는 중앙행정기관·지방자치단체...,2025.02.13 12:00,https://news.mt.co.kr/mtview.php?no=2025021308305650939&type=2&sec=politics&pDepth2=Ptotal,머니투데이
올해부터 강연·자문료 받고 간이지급명세서 미제출 시 가산세 부과,https://thumb.mt.co.kr/04/2025/02/2025021309434791884_1.jpg,올해부터 강연이나 자문료 등에 대해 간이지급명세서를 제출하지 않으면 가산세를 부담해야 한다. 국세청은 기타소득 간이지급명세서 미제출에 대한 가산세 유예기간이 지난해 말 종료된 것을 유의해야 한다고 13...,2025.02.13 12:00,https://news.mt.co.kr/mtview.php?no=2025021309434791884&type=2&sec=politics&pDepth2=Ptotal,머니투데이
국립공원 탐방객 5년만에 4000만명 회복…가장 인기있는 명소는?,https://thumb.mt.co.kr/04/2025/02/2025021310221513777_1.jpg,지난해 전국 국립공원 탐방객 수가 코로나19(COVID-19) 이후 5년만에 4000만명을 회복했다. 지속적인 탐방시설 확충과 각종 프로그램의 운영으로 국립공원을 찾는 인원이 매년 증가하고 있다는 분석이다. 환...,2025.02.13 12:00,https://news.mt.co.kr/mtview.php?no=2025021310221513777&type=2&sec=politics&pDepth2=Ptotal,머니투데이
시중에 풀린 돈 40.5조원 증가…투자대기성 자금 늘었다,https://thumb.mt.co.kr/04/2025/02/2025021309130663375_1.jpg,시중에 풀린 통화량이 19개월째 증가했다. 자산시장 변동성 확대로 투자대기성자금이 늘면서 수시입출식 저축성예금 중심으로 증가폭이 컸다. 한국은행이 13일 발표한 '2024년 12월 통화 및 유동성' 통계에 따르면 ...,2025.02.13 12:00,https://news.mt.co.kr/mtview.php?no=2025021309130663375&type=2&sec=politics&pDepth2=Ptotal,머니투데이
"최선인 줄 알았던 우리집 아파트 드레스룸 가구, 알고보니 제비뽑기?",https://thumb.mt.co.kr/04/2025/02/2025021309183257066_1.jpg,지난 10여년간 시스템 가구 입찰에서 '들러리 입찰' 등의 방식으로 담합을 벌인 20개 가구사가 공정거래위원회로부터 총 183억원의 과징금을 부과 받았다. 특히 2조원 규모 빌트인(내장형) 가구 입찰과 시스템 욕...,2025.02.13 12:00,https://news.mt.co.kr/mtview.php?no=2025021309183257066&type=2&sec=politics&pDepth2=Ptotal,머니투데이
"공정위 ""은행 LTV담합 재조사, 객관적 결론 위한 것…'끼워맞추기' 아냐""",https://thumb.mt.co.kr/04/2025/02/2025021310450292800_1.jpg,공정거래위원회 측이 시중은행 부동산 담보인정비율(LTV) 정보 교환 담합 사건 재조사와 관련 추가 사실 관계 확인이 필요하단 전원회의(법원 1심 기능)의 재심사 명령에 따른 것이라고 설명했다. 은행권 일각에...,2025.02.13 11:43,https://news.mt.co.kr/mtview.php?no=2025021310450292800&type=2&sec=politics&pDepth2=Ptotal,머니투데이
"조달청, 불공정 조달거래 아웃!…공정하고 투명한 韓 경제 이끈다.",https://thumb.mt.co.kr/04/2025/02/2025021310260160310_1.jpg,#1. 조달기업 A사는 지난해 계약체결 과정에서 위조 거래명세서 등 허위 서류를 제출해 계약을 체결한 뒤 공공기관에 납품했다. 이와 관련 신고를 접수한 조달청은 계약 과정을 면밀히 살펴 불공정 행위를 찾아냈고...,2025.02.13 11:40,https://news.mt.co.kr/mtview.php?no=2025021310260160310&type=2&sec=politics&pDepth2=Ptotal,머니투데이
