title,thumbnail,short_content,write_time,link,company
"복지부, 지역의료에 812억 투입…권역책임의료기관 역량 강화 착수",https://thumb.mt.co.kr/04/2025/02/2025021311283586954_1.jpg,정부가 전국 권역책임의료기관의 치료 역량 강화를 위해 올해 812억원의 국비를 투입한다. 지역·필수의료 강화를 위해서다. 보건복지부는 13일 지역 완결적 필수의료 체계 구축을 위한 핵심 재정투자로 권역책임의...,2025.02.13 11:30,https://news.mt.co.kr/mtview.php?no=2025021311283586954&type=2&sec=politics&pDepth2=Ptotal,머니투데이
"2027년 동물대체시험 국제회의, 서울서 개최",https://thumb.mt.co.kr/04/2025/02/2025021311150220302_1.jpg,"식품의약품안전처 소속 식품의약품안전평가원이 2027년 '제14차 생명과학 분야 동물실험과 대체에 대한 국제 회의'(이하 WC14)의 서울 개최가 결정됐다고 13일 밝혔다. WC14는 WC 이사회가 주최하고, 동물대...",2025.02.13 11:16,https://news.mt.co.kr/mtview.php?no=2025021311150220302&type=2&sec=politics&pDepth2=Ptotal,머니투데이
"강도형 해수부 장관 ""신방주호 화재 사고 인명피해 최소화 만전 기해라""",https://thumb.mt.co.kr/04/2025/02/2025021311074254056_1.jpg,"강도형 해양수산부 장관이 신방주호 화재 사고와 관련 ""해경 등과 협조해 신속히 화재를 진압하고 인명피해 최소화를 위해 만전을 기해달라""고 지시했다. 강 장관은 13일 오전, 전북 부안군 하...",2025.02.13 11:11,https://news.mt.co.kr/mtview.php?no=2025021311074254056&type=2&sec=politics&pDepth2=Ptotal,머니투데이
"박민수 복지차관 ""의료계 대화 나서야…인력 수급추계위 논의 적극 참여""",https://thumb.mt.co.kr/04/2025/02/2025021310425955725_1.jpg,정부가 의료계의 대화 참여를 촉구했다. 보건의료인력 수급추계위원회 법제화 논의에 적극 참여하고 의료개혁을 지속 추진하겠다는 의지도 밝혔다. 박민수 중앙재난안전대책본부 제1총괄조정관(보건복지부 제2차관)...,2025.02.13 10:46,https://news.mt.co.kr/mtview.php?no=2025021310425955725&type=2&sec=politics&pDepth2=Ptotal,머니투데이
"부안군 인근 해상서 어선 화재…최상목 ""최우선적으로 인명 구조""",https://thumb.mt.co.kr/04/2025/02/2025021310161015718_1.jpg,"최상목 대통령 권한대행 부총리 겸 기획재정부 장관이 13일 전라북도 부안군 위도 북서방 약 10km 해상에서 발생한 어선 화재와 관련해 ""최우선적으로 인명을 구조하고 정확한 승선원 확인을 통해 실종자...",2025.02.13 10:23,https://news.mt.co.kr/mtview.php?no=2025021310161015718&type=2&sec=politics&pDepth2=Ptotal,머니투데이
지난달 외국인 국채투자 1.8조 순유입…두달만에 플러스,https://thumb.mt.co.kr/04/2025/02/2025021309584843541_1.jpg,지난달 외국인 국채투자가 두 달 만에 순유입세로 전환됐다. 새해 들어 국고채 금리 상승세도 둔화하는 모양새다. 12·3 비상계엄 여파로 인한 혼란에서 벗어나 국채시장도 안정을 찾고 있다. 기획재정부가 13일 ...,2025.02.13 10:23,https://news.mt.co.kr/mtview.php?no=2025021309584843541&type=2&sec=politics&pDepth2=Ptotal,머니투데이
"수자원공사, 안전감찰 협력 기여…대통령 표창 수상",https://thumb.mt.co.kr/04/2025/02/2025021309341979932_1.jpg,한국수자원공사는 지난 12일 세종시 정부세종컨벤션센터에서 열린 행정안전부 주관 '2024년 안전감찰 유공 정부포상'에서 대통령 표창을 받았다고 밝혔다. 안전감찰 유공 정부포상은 안전 분야 자체 감사 활동을 ...,2025.02.13 10:22,https://news.mt.co.kr/mtview.php?no=2025021309341979932&type=2&sec=politics&pDepth2=Ptotal,머니투데이
"고기동 직무대행, ""부안 선박 화재, 구조에 총력"" 긴급지시",https://thumb.mt.co.kr/04/2025/02/2025021310135672371_1.jpg,"고기동 행정안전부 장관 직무대행은 13일 발생한 전북 부안해역 선박 화재와 관련해 ""관계기관은 모든 가용한 자원을 총동원해 인명구조에 총력을 다해 달라고 긴급 지시했다. 고 직무대행은 아울러 &qu...",2025.02.13 10:21,https://news.mt.co.kr/mtview.php?no=2025021310135672371&type=2&sec=politics&pDepth2=Ptotal,머니투데이
"원/달러 환율, 1.3원 내린 1452.1원 출발",,13일 서울 외환시장에서 원/달러 환율이 전 거래일 종가 대비 1.3원 내린 1452.1원에 거래를 시작했다. ...,2025.02.13 09:01,https://news.mt.co.kr/mtview.php?no=2025021308534639602&type=2&sec=politics&pDepth2=Ptotal,머니투데이
트럼프 이르면 12일 상호관세 서명…한국도 대상 가능성(상보),https://thumb.mt.co.kr/04/2025/02/2025021307262751684_1.jpg,도널드 트럼프 미국 대통령이 미국과 교역하는 모든 나라의 관세율에 맞춰 관세를 부과하는 상호관세 행정명에 이르면 12일(현지시간) 서명할 것이라고 밝혔다. 트럼프 대통령은 이날 워싱턴DC 백악관에서 진행된...,2025.02.13 07:28,https://news.mt.co.kr/mtview.php?no=2025021307262751684&type=2&sec=politics&pDepth2=Ptotal,머니투데이
"[속보]트럼프 ""이르면 12일 상호관세 행정명령 서명할 수도""",https://thumb.mt.co.kr/04/2025/02/2025021306035946860_1.jpg,도널드 트럼프 미국 대통령이 이르면 12일(현지시간) 미국산 수입품에 관세를 부과하는 모든 국가에 상호관세를 부과하는 행정명령에 서명할 수 있다고 말했다고 로이터통신이 보도했다. ...,2025.02.13 06:05,https://news.mt.co.kr/mtview.php?no=2025021306035946860&type=2&sec=politics&pDepth2=Ptotal,머니투데이
트럼프발 우크라전 종식 가능성…국제유가 급락,https://thumb.mt.co.kr/04/2025/02/2025021305553318026_1.jpg,국제유가가 12일(미국 동부 현지시간) 급락했다. 러시아와 우크라이나의 전쟁 종식 가능성이 급부상한 영향으로 풀이된다. 이날 오후 3시35분 현재 뉴욕상업거래소에서 근월물인 3월 인도분 서부텍사스산원유(WTI...,2025.02.13 06:02,https://news.mt.co.kr/mtview.php?no=2025021305553318026&type=2&sec=politics&pDepth2=Ptotal,머니투데이
한화 '아워홈 인수' 지분 9.7%에 뒤집히나..우선매수권·자금조달 불씨,https://thumb.mt.co.kr/04/2025/02/2025021217011714241_1.jpg,한화호텔앤드리조트(이하 한화호텔)의 아워홈 인수가 끝난 것은 아니다. 그간 지분율을 두고 다퉈왔던 오너일가 '남매의 난'이 정관상 명시된 우선매수권 행사 여부로 옮겨가면서 법적 분쟁으로 비화될 가능성이 남...,2025.02.13 05:40,https://news.mt.co.kr/mtview.php?no=2025021217011714241&type=2&sec=politics&pDepth2=Ptotal,머니투데이
자산운용사 독점 깨고 '무한경쟁'…수익률 극대화 노린다,https://thumb.mt.co.kr/04/2025/02/2025021223171971386_1.jpg,'정부 기금과 공공기관 여유자금의 내실 있는 운용' 정부가 12일 발표한 '연기금투자풀 제도 개편 방안'의 목표다. 연기금투자풀은 연기금과 공공기관의 여유자금을 통합해 전문 운용사에 맡겨 자산을 굴리는 제도...,2025.02.13 04:30,https://news.mt.co.kr/mtview.php?no=2025021223171971386&type=2&sec=politics&pDepth2=Ptotal,머니투데이
"백악관 ""13일 인도총리 방문 전 상호관세 발표…상대국 대화 시작""",https://thumb.mt.co.kr/04/2025/02/2025021304142416898_1.jpg,도널드 트럼프 미국 대통령이 오는 13일(이하 현지시간) 나렌드라 모디 인도 총리와 정상회담 전에 상호관세를 발표할 것이라고 백악관이 12일 밝혔다. 캐롤라인 레빗 백악관 대변인은 이날 브리핑에서 상호관세 ...,2025.02.13 04:17,https://news.mt.co.kr/mtview.php?no=2025021304142416898&type=2&sec=politics&pDepth2=Ptotal,머니투데이
머니투데이 오프라인 헤드라인-13일,,[종합] '잠실·삼성·대치·청담' 토허제 풀렸다 불안할수록 긴 줄…中 금은방도 오픈런 '잠삼대청' 아파트 291곳 해제…콧대 높은 '엘리트' 집값 더 올리나 자산운용사 독점 깨고 '무한경쟁'…수익률 극대화 노린다...,2025.02.13 03:00,https://news.mt.co.kr/mtview.php?no=2025021222404065563&type=2&sec=politics&pDepth2=Ptotal,머니투데이
"고기동 직무대행 ""서귀포해역 어선 전복, 인명구조에 총력""",https://thumb.mt.co.kr/04/2025/02/2025021221050128551_1.jpg,"고기동 행정안전부 장관 직무대행이 12일 발생한 제주 서귀포해역 어선 전복 사고와 관련해 ""관계기관은 모든 가용한 자원을 총동원해 인명 구조에 총력을 다하고, 그 과정에서 구조대원이나 지원 세력의 ...",2025.02.12 21:19,https://news.mt.co.kr/mtview.php?no=2025021221050128551&type=2&sec=politics&pDepth2=Ptotal,머니투데이
철강 관세폭탄에 '협상력' 부재 우려…'일본은 제외 요청이라도 하는데',https://thumb.mt.co.kr/04/2025/02/2025021218140437414_1.jpg,미국이 철강·알루미늄 수입품에 대한 25% 관세를 부과하면서 전 세계가 출렁인다. 일본은 자국 기업에 대한 예외 인정을 요청했다. 유럽연합(EU)과 캐나다는 강경 대응을 예고하면서도 협상 여지를 남겼다. 탄...,2025.02.12 18:47,https://news.mt.co.kr/mtview.php?no=2025021218140437414&type=2&sec=politics&pDepth2=Ptotal,머니투데이
"崔 권한대행, 폴란드 총리와 통화…""방산 협력 견고하게 지속""",https://thumb.mt.co.kr/04/2025/02/2025021217440785134_1.jpg,"최상목 대통령 권한대행 부총리 겸 기획재정부 장관이 12일 도날드 투스크(Donald Tusk) 폴란드 총리와 통화에서 ""한국과 폴란드의 방산협력은 초당적 지지 하에 앞으로도 견고하게 지속될 것&q...",2025.02.12 18:11,https://news.mt.co.kr/mtview.php?no=2025021217440785134&type=2&sec=politics&pDepth2=Ptotal,머니투데이
"식약처, 혁신제품 20개 선정해 허가까지 집중 지원",https://thumb.mt.co.kr/04/2025/02/2025021217115769416_1.jpg,"식품의약품안전처 소속 식품의약품안전평가원이 신약, 첨단바이오의약품, 혁신의료기기 등 혁신제품 20개를 선정해 집중 사전상담으로 신속한 제품화를 지원하는 '길잡이' 프로그램을 올해부터 새롭게 운영한다고 12...",2025.02.12 17:12,https://news.mt.co.kr/mtview.php?no=2025021217115769416&type=2&sec=politics&pDepth2=Ptotal,머니투데이
"동반위, 국내 100대 기업 공급망 ESG 공시비율 절반 수준에 불과",https://thumb.mt.co.kr/04/2025/02/2025021214193243151_1.jpg,국내 100대 기업의 공급망 ESG(환경·사회·지배구조) 공시비율이 절반 정도 수준에 그치는 것으로 나타났다. 동반성장위원회는 국내 매출액 상위 100대 기업을 대상으로'공급망 ESG 관리 공시 수준'을 조...,2025.02.12 16:34,https://news.mt.co.kr/mtview.php?no=2025021214193243151&type=2&sec=politics&pDepth2=Ptotal,머니투데이
'아워홈 인수' 지분 9.7%에 뒤집힐까..'우선매수권' 행사 여부 남았다,https://thumb.mt.co.kr/04/2025/02/2025021211445259207_1.jpg,한화호텔앤드리조트(이하 한화호텔)의 아워홈 인수가 끝난 것은 아니다. 그간 지분율을 두고 다퉈왔던 오너일가 '남매의 난'이 정관상 명시된 우선매수권 행사 여부로 옮겨가면서 법적 분쟁으로 비화될 가능성이 남...,2025.02.12 16:30,https://news.mt.co.kr/mtview.php?no=2025021211445259207&type=2&sec=politics&pDepth2=Ptotal,머니투데이
제도 도입 31년 만에 '민간투자 정책펀드' 출범…2000억원 규모,https://thumb.mt.co.kr/04/2025/02/2025021214002182029_1.jpg,"1994년 민간투자 제도 도입 후 최초의 민간투자 정책펀드가 출범했다. 김윤상 기획재정부 2차관은 12일 민간투자사업 특별 인프라펀드 출범식에 참석해 ""올해는 출자 전용 특별 인프라펀드 출범을 계기로 ...",2025.02.12 16:30,https://news.mt.co.kr/mtview.php?no=2025021214002182029&type=2&sec=politics&pDepth2=Ptotal,머니투데이
"박창숙 신임 여경협회장 ""326만 여성기업과 경제성장 이끌 것""",https://thumb.mt.co.kr/04/2025/02/2025021214170697565_1.jpg,"박창숙 신임 여성경제인협회(여경협) 회장이 12일 ""저성장·저출생, 장기화된 내수 침체에 직면한 지금 여성기업이 대한민국 위기 극복과 성장을 이끌 수 있도록 앞장서겠다""며 ""여경협...",2025.02.12 16:30,https://news.mt.co.kr/mtview.php?no=2025021214170697565&type=2&sec=politics&pDepth2=Ptotal,머니투데이
"기재부 ""4월까지 배추·무 1.7만톤 공급…유가 연동보조금 연장""",https://thumb.mt.co.kr/04/2025/02/2025021215402476795_1.jpg,"정부가 배추·무 수급 안정화를 위해 6000톤의 추가 물량을 확보해 4월까지 총 1만7000톤을 공급한다. 김 가격을 낮추기 위해 구조적 수급 안정화 방안을 3월 중에 마련한다. 유류세 인하조치 연장과 함께 경유, 천...",2025.02.12 16:16,https://news.mt.co.kr/mtview.php?no=2025021215402476795&type=2&sec=politics&pDepth2=Ptotal,머니투데이
여야 주도권 싸움탓…2년째 말뿐인 '소비증가분 추가 소득공제',https://thumb.mt.co.kr/04/2025/02/2025021210175183284_1.jpg,'12·3 비상계엄' 여파에 따른 국내 정국 불안으로 내수 회복이 더딘 가운데 정부의 내수부양책이 좀처럼 속도를 내지 못하고 있다. 여야가 앞에선 민생을 외치지만 뒤에선 정책 주도권을 뺏기지 않으려는 기싸움을 ...,2025.02.12 15:50,https://news.mt.co.kr/mtview.php?no=2025021210175183284&type=2&sec=politics&pDepth2=Ptotal,머니투데이
"자고 있던 공적 자금, 투자 유도해 수익낸다…연기금투자풀 개편",https://thumb.mt.co.kr/04/2025/02/2025021209364283568_1.jpg,'정부 기금과 공공기관 여유자금의 내실 있는 운용' 정부가 12일 발표한 '연기금투자풀 제도 개편 방안'의 목표다. 연기금투자풀은 연기금과 공공기관의 여유자금을 통합해 전문 운용사에 맡겨 자산을 굴리는 제도...,2025.02.12 15:48,https://news.mt.co.kr/mtview.php?no=2025021209364283568&type=2&sec=politics&pDepth2=Ptotal,머니투데이
"올해 민간 제조업 투자 119조원…안덕근 장관 ""AI 투자 실기 말아야""",https://thumb.mt.co.kr/04/2025/02/2025021211294654280_1.jpg,"반도체, 자동차 등 올해 10대 제조업 국내 투자가 119조원에 달할 것으로 보인다. 전년대비 7% 증가한 수치로 대외 불확실성에 대응하는 차원에서 국내 투자 확대는 긍정적이란 평가다. 안덕근 산업통상자원부 장...",2025.02.12 14:35,https://news.mt.co.kr/mtview.php?no=2025021211294654280&type=2&sec=politics&pDepth2=Ptotal,머니투데이
부안·고창 해역에 1GW 해상풍력 단지 조성…주민수용성 확보,https://thumb.mt.co.kr/04/2025/02/2025021213531188478_1.jpg,정부가 전북 서남권에 1GW(기가와트) 규모의 해상풍력 단지를 조성한다. 산업통상자원부는 12일 신재생에너지정책심의회의 심의·의결을 거쳐 '전북 서남권 1GW 해상풍력 사업(확산단지1)'을 신재생에너지 집...,2025.02.12 14:35,https://news.mt.co.kr/mtview.php?no=2025021213531188478&type=2&sec=politics&pDepth2=Ptotal,머니투데이
"송미령 장관 ""청년 스마트농업·영농정착 적극 지원""",https://thumb.mt.co.kr/04/2025/02/2025021211163242838_1.jpg,"송미령 농림축산식품부장관이 ""스마트농업은 청년농업인의 영농 정착과 농업의 미래 경쟁력을 높이는 핵심 요소""라고 12일 밝혔다. 송 장관은 이날 오후 충남 홍성군에 위치한 스마트팜 '옥토팜'...",2025.02.12 14:30,https://news.mt.co.kr/mtview.php?no=2025021211163242838&type=2&sec=politics&pDepth2=Ptotal,머니투데이
"최상목 권한대행, 대전 찾아 故 김하늘양 빈소 조문",https://thumb.mt.co.kr/04/2025/02/2025021213232664315_1.jpg,최상목 대통령 권한대행 부총리 겸 기획재정부 장관이 12일 대전의 한 초등학교에서 발생한 살인 사건 피해자 고(故) 김하늘양의 빈소를 찾아 문상했다. 기재부에 따르면 최 권한대행은 이날 오후 1시16분쯤 대전 ...,2025.02.12 13:54,https://news.mt.co.kr/mtview.php?no=2025021213232664315&type=2&sec=politics&pDepth2=Ptotal,머니투데이
"관세청, 프랑스발 국제우편서 '신종 마약' 세계 첫 적발",https://thumb.mt.co.kr/04/2025/02/2025021211083052617_1.jpg,프랑스발(發) 국제우편으로 국내에 들어온 우편물에서 국내외에 보고된 적 없는 신종 합성마약이 발견됐다. 관세청 중앙관세분석소는 12일 프랑스발 국제우편에서 반입된 성분 미상의 분말에서 강력한 환각제인 마...,2025.02.12 13:51,https://news.mt.co.kr/mtview.php?no=2025021211083052617&type=2&sec=politics&pDepth2=Ptotal,머니투데이
"축산환경관리원, 광주에 지역사무소 첫 런칭…경기·영남·제주도 추진",,축산환경관리원 첫 지역사무소가 호남 요충지인 광주에 처음 문을 열었다. 축산환경관리원은 축산환경 문제의 신속하고 효과적인 해결을 위해 광주광역시에 호남 지역사무소를 개소했다고 12일 밝혔다. 세종시...,2025.02.12 13:35,https://news.mt.co.kr/mtview.php?no=2025021213212176456&type=2&sec=politics&pDepth2=Ptotal,머니투데이
주세 감면 확대·양조장 창업 촉진…전통주 산업 활성화 나선다,https://thumb.mt.co.kr/04/2025/02/2025021211531282322_1.jpg,"정부가 소규모 전통주 제조업체에 대한 주세 감면 혜택을 확대하고, 양조장 창업을 촉진하기 위해 소규모 주류제조면허 주종을 더 늘리기로 했다. 정부는 12일 열린 경제관계장관회의에서 이같은 내용을 중심으로...",2025.02.12 12:08,https://news.mt.co.kr/mtview.php?no=2025021211531282322&type=2&sec=politics&pDepth2=Ptotal,머니투데이
한 사람이 481대 관리하는 CCTV…'AI 관제체계'로 개선한다,https://thumb.mt.co.kr/04/2025/02/2025021207523059213_1.jpg,CCTV 통합관제센터 요원 1인당 평균 481대의 CCTV를 관리하는 것으로 나타났다. 정부는 업무부담을 해소하기 위해 AI(인공지능) 기반 관제시스템을 도입한다. 행정안전부는 지난 11일 '과학기술로 재난...,2025.02.12 12:00,https://news.mt.co.kr/mtview.php?no=2025021207523059213&type=2&sec=politics&pDepth2=Ptotal,머니투데이
"은행권 가계대출 2개월 연속 감소…""당분간 둔화 흐름 지속""",https://thumb.mt.co.kr/04/2025/02/2025021209034732939_1.jpg,지난달 은행권 가계대출이 2개월 연속 전월 대비 감소했다. 주택담보대출 증가폭이 소폭 확대됐지만 명절·성과 상여금 등 지급에 따라 신용대출 잔액이 줄어든 영향으로 분석된다. 한국은행이 12일 발표한 '2025년...,2025.02.12 12:00,https://news.mt.co.kr/mtview.php?no=2025021209034732939&type=2&sec=politics&pDepth2=Ptotal,머니투데이
작년 대기업 수출 11.6%↑… '톱 10' 무역집중도 6년 만에 최대,https://thumb.mt.co.kr/04/2025/02/2025021210565367937_1.jpg,"지난해 수출액이 기업 규모별, 산업별로 엇갈렸다. 수출액 상위 10대 기업의 무역집중도는 6년 만에 최대치를 기록했다. 통계청과 관세청이 12일 발표한 '2024년 연간 기업특성별 무역통계'에 따르면 지난해 수출액...",2025.02.12 12:00,https://news.mt.co.kr/mtview.php?no=2025021210565367937&type=2&sec=politics&pDepth2=Ptotal,머니투데이
"무신사, 다운·캐시미어 부적합 판정 42개 브랜드 추가 적발",https://thumb.mt.co.kr/04/2025/02/2025021209380429596_1.jpg,패션 플랫폼 무신사가 최근 입점 브랜드를 상대로 진행하고 있는 다운·캐미시어 소재 혼용률 전수 검사 결과 문제가 있는 42개 브랜드를 추가로 적발했다고 12일 밝혔다. 해당 브랜드 위반 행위의 경중에 따라 전...,2025.02.12 11:40,https://news.mt.co.kr/mtview.php?no=2025021209380429596&type=2&sec=politics&pDepth2=Ptotal,머니투데이
트럼프 관세정책으로 中企 미국 수출 1조 감소?…정책금융 확대 검토,https://thumb.mt.co.kr/04/2025/02/2025021210163687786_1.jpg,"오영주 중소벤처기업부 장관은 """"신보호무역주의가 우리 중소기업에 도전적인 상황인 동시에 새로운 기회가 될 수 있도록, 철저히 대응하고 우리 중소기업의 수출 경쟁력을 높일 지원 대책을 이...",2025.02.12 11:29,https://news.mt.co.kr/mtview.php?no=2025021210163687786&type=2&sec=politics&pDepth2=Ptotal,머니투데이
"수협, 어선사고 저감 특별 예방 활동 돌입",https://thumb.mt.co.kr/04/2025/02/2025021211163437940_1.jpg,수협중앙회가 어선 사고로부터 어업인 인명피해를 줄이기 위해 2주간 전국에서 대대적인 특별 예방 활동에 돌입한다. 이는 기후변화로 해양기상이 급변하고 어획량 감소에 따른 과도한 조업 등으로 어선 사고 발생...,2025.02.12 11:22,https://news.mt.co.kr/mtview.php?no=2025021211163437940&type=2&sec=politics&pDepth2=Ptotal,머니투데이
기아해결 등 성과땐 '노벨상' 넘본다…진화하는 'K-농업ODA',https://thumb.mt.co.kr/04/2025/02/2025021210123649512_1.jpg,식량원조와 K-라이스벨트 등으로 대표되는 우리 정부의 농업분야공적개발원조(ODA)가 올해 본격적인 외연확장에 나선다. 농식품부는 이를 위해 국제사회에서 높은 평가를 받고 있는 대표 사업들을 더 고도화하고...,2025.02.12 11:07,https://news.mt.co.kr/mtview.php?no=2025021210123649512&type=2&sec=politics&pDepth2=Ptotal,머니투데이
가짜 재생에너지 사업자 걸러낸다…전력망 부족지역 신규배정,https://thumb.mt.co.kr/04/2025/02/2025021209525726322_1.jpg,정부가 전력망만 선점하고 발전사업은 하지 않는 허수사업자 관리 강화에 나섰다. 전력망 알박기를 해소함에 따라 전력계통 부족지역에서 재생에너지 발전사업을 원하는 신규 사업자의 진입이 원활해 질 전망이다. ...,2025.02.12 11:00,https://news.mt.co.kr/mtview.php?no=2025021209525726322&type=2&sec=politics&pDepth2=Ptotal,머니투데이
"애물단지 전동킥보드, 이제는 재활용한다…시스템 구축 시동",https://thumb.mt.co.kr/04/2025/02/2025021210194431524_1.jpg,처리가 곤란했던 폐전기자전거·전동킥보드 등을 재활용할 수 있는 시스템이 구축된다. 각종 부품의 재활용으로 연간 3400톤의 철·알루미늄 등이 회수 가능할 것이란 전망이다. 환경부는 12일 수도권자원순환센터...,2025.02.12 11:00,https://news.mt.co.kr/mtview.php?no=2025021210194431524&type=2&sec=politics&pDepth2=Ptotal,머니투데이
"행안부, 가축전염병 4개 시·도에 방역활동비 16억 긴급지원",https://thumb.mt.co.kr/04/2025/02/2025021210002980900_1.jpg,행정안전부가 가축전염병 발생 위험이 큰 4개 시·도(경기·충북·전북·전남)에 재난안전관리 특별교부세 16억원을 긴급 지원한다고 12일 밝혔다. 지원 대상은 설 연휴 이후 고병원성 조류인플루엔자(HPAI)와...,2025.02.12 10:43,https://news.mt.co.kr/mtview.php?no=2025021210002980900&type=2&sec=politics&pDepth2=Ptotal,머니투데이
"62조 연기금 투자풀 시장, 증권사 진출 허용…국내 ETF 투자 가능",https://thumb.mt.co.kr/04/2025/02/2025021208283886649_1.jpg,62조원 규모의 '연기금 투자풀' 시장에 증권사도 진출하게 된다. 현재는 자산운용사들의 참여만 가능하다. 연기금 투자 수익을 높이기 위해 국내 주식·채권형 ETF(상장지수펀드) 투자도 허용된다. 기획재정부...,2025.02.12 10:30,https://news.mt.co.kr/mtview.php?no=2025021208283886649&type=2&sec=politics&pDepth2=Ptotal,머니투데이
"최상목 ""다음주 '수출전략회의'…관세 피해 기업 지원""",https://thumb.mt.co.kr/04/2025/02/2025021209035277889_1.jpg,"최상목 대통령 권한대행 부총리 겸 기획재정부 장관이 12일 ""다음주 수출전략회의를 개최해 관세 피해 우려기업에 대한 지원과 수출 품목·지역 다변화를 위한 방안들을 논의하겠다""고 밝혔다. ...",2025.02.12 10:30,https://news.mt.co.kr/mtview.php?no=2025021209035277889&type=2&sec=politics&pDepth2=Ptotal,머니투데이
"""서류 8종→1종""…K뷰티·K푸드 FTA 수출 절차 간소해진다",https://thumb.mt.co.kr/04/2025/02/2025021209532819025_1.jpg,FTA(자유무역협정)를 활용한 K뷰티와 K푸드의 수출 절차가 간소해진다. 재활용 원재료를 기반으로 한 친환경제품 역시 마찬가지다. 정부는 숨겨진 FTA 활용 기회를 적극 발굴한다는 계획이다. 정부는 12일 ...,2025.02.12 10:30,https://news.mt.co.kr/mtview.php?no=2025021209532819025&type=2&sec=politics&pDepth2=Ptotal,머니투데이
공동묘지에 강제이주된 김제 '개미마을'...주민들에게 공유지 매각,https://thumb.mt.co.kr/04/2025/02/2025021208505713199_1.jpg,김제시가 50년 전 공동묘지로 사용되던 전북 김제시 성덕면 만경로 362-44 일원(이하 개미마을)으로 강제 이주당한 개미마을 주민들에게 시 소유의 공유지를 매각한다. 국민권익위원회는 김제시장이 참석한 가운...,2025.02.12 10:18,https://news.mt.co.kr/mtview.php?no=2025021208505713199&type=2&sec=politics&pDepth2=Ptotal,머니투데이
