title,thumbnail,short_content,write_time,link,company
"시진핑, 다카이치에 ""침략 역사 깊이 반성해야""",https://img.segye.com/content/image/2025/11/01/300/20251101500516.jpg,"시진핑 중국 국가주석은 31일 다카이치 사나에 신임 일본 총리에게 일본이 침략 역사를 반성해야 한다는 취지로 말했다. 중국중앙TV(CCTV) 등에 따르면 시 주석은 이날 경주 아시아태평양경제협력체(APEC) 정상회의를 계기로 열린 다카이치 총리와 회담에서 “무라야마 담화는 일본의 침략 역사를 깊이 반성하고 피해국들에 사과했다”면서 “그 정신은 계승할 만한 가치가 있다”고 밝혔다. 무라야마 담화는 무라야마 도미이치 전 일본 총리가 재임 중이던 1995년 일본의 식민지 지배와 주변국 침략에 대한 반성과 사죄를 명시한 담화다. 시 주석은 “양국이 서로에게 위협이 돼서는 안 된다”며 “역사에서 교훈을 얻고 미래를 향하는 등 정치적 공감대를 실제로 적용해야 한다”고 말했다. 이날 회담은 최근 냉랭한 두 나라의 관계를 대변하듯 긴장된 분위기 속에 약 30분 만에 종료됐다. 중국은 다카이치 총리가 지난 21일 취임한 뒤 그간의 관례와 달리 시진핑 주석 명의의 축전을 보내지 않았고, 리창 총리의 축전만 발송했다. 다카이치 총리에 대한 불편한 감정을 노골적으로 드러낸 것이다. 중국 관영매체들은 다카이치 총리가 반중(反中) 성향을 드러내 왔고, 난징대학살을 부정하거나 야스쿠니신사를 참배하는 등 중국 국민감정에 반하는 인사라고 비난해왔다.",2025-11-01 01:56:42,https://www.segye.com/newsView/20251101500420,세계일보
"시진핑 ""日, 침략역사 반성정신 발양해야""",https://img.segye.com/content/image/2025/10/31/300/20251031516016.jpg,"시진핑 중국 국가주석은 31일 다카이치 사나에 신임 일본 총리와의 첫 만남에서 일본의 침략 역사와 대만 문제를 거론했다. 시 주석이 양국 관계 발전을 위해 소통을 유지하자는 원칙적 입장을 표명하되 '강경 보수' 성향의 다카이치 총리가 이끄는 내각에 대한 강한 경고성 메시지도 발신한 것으로 풀이된다. 중국중앙TV(CCTV)에 따르면 시 주석은 이날 경주 아시아태평양경제협력체(APEC) 정상회의를 계기로 열린 다카이치 총리와의 양자 회담에서 ""무라야마 담화는 일본의 침략 역사를 깊이 반성하고 피해국들에 사과했다""면서 ""그 정신은 발양할 만한 가치가 있다""고 말했다. '무라야마 담화'는 지난 17일 별세한 무라야마 도미이치 전 일본 총리가 재임 중이던 1995년 일본의 식민지 지배와 주변국 침략에 대한 반성과 사죄를 명시한 담화다. 시 주석은 ""현재 중일 관계에는 기회와 도전이 병존한다""며 ""일본의 새로운 내각이 중국에 대한 올바른 인식을 세우고 양국의 원로 정치인과 각계 인사들이 중일발전을 위해 기울인 정성과 노력을 소중히 하길 바란다""고 강조했다. 이어 ""양국이 서로에게 위협이 되어서는 안 되며 역사에서 교훈을 얻고 미래를 향하는 등 정치적 공감대를 실제로 적용해야 한다""고 말했다. 그는 또 ""중일은 협력의 광활한 공간이 있다""면서 ""첨단제조, 디지털경제, 녹색발전, 재정금융, 의료요양 등의 협력을 강화해 다자무역체제와 산업·공급망의 안정적이고 원활한 흐름을 함께 유지할 수 있다""고 밝혔다. 이어 ""정부, 정당, 입법기관의 소통을 지속적으로 전개하고 인문·지방 교류를 확대하며 국민감정을 개선해야 한다""고 밝혔다. 시 주석은 진정한 다자주의을 실천하고 서로 내정 불간섭 원칙을 지키며 아시아태평양 공동체 구축을 추진하면서 다자 협력을 강화할 것도 강조했다. 그러면서 양국 관계를 차이로 규정지어서는 안 된다고 덧붙였다. 시 주석은 이날 모두발언에서는 ""나는 당신(다카이치 총리)과 소통을 유지하고 중일 관계가 올바른 궤도로 전진·발전하도록 함께 추동할 용의가 있다""고 말했다. 그는 ""현재 세계는 100년만의 변화가 가속하고 있고, 국제·지역 형세는 복잡하다""며 ""중국과 일본 양국은 서로 중요한 이웃으로, 중일 관계의 장기적이고 건강하며 안정적인 발전을 추동하는 것은 양국 인민과 국제 사회의 보편적 기대에 부합한다""고 강조했다. 이어 ""당신(다카이치 총리)은 취임 후 '중국이 일본의 중요한 이웃 국가이고, 건설적이고 안정적인 대(對)중국 관계를 구축하며 양국의 전략적 호혜 관계를 전면 추진하겠다'고 밝혔다""며 ""이는 중일 관계에 대한 당신과 새로운 내각의 중시를 보여줬다""고 했다. 그러면서 ""중국은 일본과 '4대 정치문건'이 확립한 원칙과 방향에 따라 양자 관계의 정치적 기초를 함께 수호하고, 중일 전략적 호혜 관계를 추진할 용의가 있다""면서 ""새로운 시대의 요구에 맞는 건설적이고 안정적인 중일 관계 구축에 힘쓸 용의가 있다""고 했다. 또 역사와 대만 등 중대한 원칙 문제에 대한 '4대 정치문건'의 명확한 규정을 준수하고 이행하며 중일 관계의 기초가 손상되거나 흔들리지 않도록 해야한다고 밝혔다. 시 주석이 말한 중국과 일본의 4대 정치문건은 1972년 수교 때 발표한 '중일 공동성명', 1978년 '중일 평화우호조약', 1998년 '중일 평화와 발전의 우호협력 동반자 관계 수립 노력을 위한 공동선언', 2008년 '중일 전략적 호혜관계 전면 추진에 관한 공동성명'을 가리킨다. 이 문건들은 '하나의 중국' 원칙과 주권·영토 완전성 상호 존중, 패권 추구 반대 등의 내용을 담고 있다. 중국이 대만과 긴밀한 관계를 유지해온 일본에 자주 꺼내 드는 카드기도 하다. 다카이치 총리는 대만 문제에 대해 1972년의 입장을 견지할 것이라고 밝혔다고 CCTV는 보도했다. 중국은 다카이치 총리가 지난 21일 취임한 뒤 그간의 관례와 달리 시진핑 주석 명의의 축전을 보내지 않았고, 리창 총리의 축전만 발송했다. 관영매체들은 다카이치 총리가 반중(反中) 성향을 드러내 왔고, 난징대학살을 부정하거나 야스쿠니신사를 참배하는 등 중국 국민감정에 반하는 인사라며 직설적으로 비난하기도 했다. 이런 가운데 중국 정부가 정상회담이 열린 이날까지도 회담 개최 예정 여부를 발표하지 않으면서 일각에선 중국이 불편한 심기를 드러내고 있다는 해석이 나오기도 했다. 이날 언론에 공개된 시 주석의 회담 모두발언에서도 별도의 취임 축하 언급은 나오지 않았다. 이날 회담에는 중국공산당 중앙정치국 상무위원인 차이치 당 중앙서기처 서기(공식 서열 5위)와 왕이 중국공산당 중앙외사판공실 주임(외교부장 겸임) 등이 배석했다.",2025-10-31 22:26:11,https://www.segye.com/newsView/20251031515960,세계일보
"중국·캐나다, 8년만에 공식 정상회담…習 “협력 확대”",https://img.segye.com/content/image/2025/10/31/300/20251031515345.jpg,"도널드 트럼프 미국 대통령의 전방위적인 관세 압박이 이어지는 가운데, 한동안 관계가 냉랭했던 중국과 캐나다가 8년 만에 공식 정상회담을 갖고 관계 회복 의지를 밝혔다. AFP·블룸버그통신과 중국 관영 신화통신에 따르면 시진핑 중국 국가주석은 31일 경주 아시아태평양경제협력체(APEC) 정상회의를 계기로 마크 카니 캐나다 총리와 만나 “최근 양측의 공동 노력으로 중국·캐나다 관계가 회복세를 보이고 있다”고 말했다. 이어 “이는 양국의 공동 이익에 부합한다”면서 “중국은 양국 관계를 올바른 궤도로 돌려놓기 위해 캐나다와 협력하고자 한다”고 밝혔다. 시 주석은 카니 총리를 중국에 초청했고, 카니 총리는 이를 수락하면서 “건설적이고 실용적인 대화를 기대한다”고 화답했다. 그는 또 “올해는 중국과 캐나다 수교 55주년이자 전략적 동반자 관계 수립 20주년”이라면서 “양국이 상호 이익과 ‘윈윈’의 원칙을 견지하고 경제무역과 에너지 등의 분야에서 실질적인 협력을 확대해야 한다”고 강조했다. 이어 “유엔 등 다자의 틀에서 조정과 협력을 강화해 보다 공정하고 합리적인 글로벌 거버넌스 체계를 구축하고 국제적 공평과 정의를 수호해야 한다”고 덧붙였다. 이에 카니 총리는 “양국 관계 개선과 발전의 기회를 잡아 수교의 초심을 되찾고 잃어버린 시간을 되돌리고 양자 협력을 재개하기를 기대한다”면서 “실무적이고 건설적인 방식으로 양국 관계가 더 많은 성과를 거두도록 추진하겠다”고 강조했다. 이어 “캐나다는 중국 측과 고위급 교류를 긴밀히 하고 농업·에너지·기후변화 등의 분야에서 협력을 추진해 양국 국민에게 더 많은 복지를 가져오기를 바란다”고 밝혔다. 앞서 카니 총리는 지난 27일 “중국은 우리의 두 번째로 큰 교역 동반자이자 세계에서 두 번째로 큰 경제대국”이라면서 대중 관계에서의 실용적 접근을 강조하기도 했다. 이번 공식 정상회담은 쥐스탱 트뤼도 총리 재임 시기인 2017년 이후 처음이다. 양국 관계는 미중 간 1차 무역전쟁 당시인 2018년 캐나다가 미국의 요청으로 중국 최대 통신장비 업체 화웨이의 멍완저우 부회장 체포하고, 중국이 이에 대한 보복으로 캐나다인 2명을 간첩 혐의로 구금하면서 얼어붙었다. 중국이 중국계 캐나다인 정치인을 사찰했다는 의혹이 불거진 2023년에는 양국이 상대 외교관들을 맞추방하면서 갈등이 격화했다. 중국이 2021년 캐나다 총선에 개입했다는 의혹까지 제기된 상황에서 캐나다는 작년 8월 중국산 전기차에 100%, 철강·알루미늄에 25%의 관세를 부과했고, 중국은 올해 3월 카놀라유 등 캐나다산 농축산물에 25∼100%의 맞불 관세를 매겼다. 시 주석은 2022년 11월 주요 20개국(G20) 정상회의에서 트뤼도 당시 총리와 나눈 대화가 언론에 공개된 사실을 거론하며 불쾌감을 표시하기도 했다. 캐나다가 경제적 이익을 지키기 위해 중국에 손을 내밀었지만 통상 문제의 복잡성 때문에 결과가 쉽게 나오지는 않을 것이라는 전망도 나온다. 중국은 전기차에 부과된 관세 인하를 원하는데, 캐나다 입장에서는 자동차 산업의 피해를 감수하면서 농민의 이익을 지킬 것인지 딜레마가 생긴다. 또 미국과 계속 협상해야 하는 상황에서 캐나다가 미국의 눈치를 보지 않고 중국과 큰 거래를 도출하기는 어렵다는 분석도 있다. 이날 시 주석은 카니 총리와 회담을 마친 뒤 아누틴 찬위라꾼 태국 총리와 다카이치 사나에 총리와도 잇달아 회담했다.",2025-10-31 20:50:02,https://www.segye.com/newsView/20251031515346,세계일보
“현금 집에 쌓아두나?”…10억원 넘는 고액 예금 갑자기 줄어든 이유?,https://img.segye.com/content/image/2025/11/02/300/20251102501322.jpg,"올해 상반기 잔액이 10억원을 넘는 고액 예금 계좌 수가 12년 만에 처음으로 줄었다. 기업 여유자금을 예치하는 기업자유예금의 계좌 수와 잔액이 나란히 감소한 점이 눈에 띄었다. 2일 한국은행 경제통계시스템에 따르면, 올해 상반기 말 은행의 저축성예금 중 잔액이 10억원을 초과하는 계좌 수는 9만9000좌로 집계됐다. 지난해 말 10만좌보다 1000",2025-11-02 06:24:54,http://www.segye.com/newsView/20251102501324,세계일보
"정의선 회장 ""국가에 큰 도움 받았다…신세 꼭 갚겠다""",https://img.segye.com/content/image/2025/11/02/300/20251102500779.jpg,"정의선 현대차그룹 회장이 경주 아시아태평양경제협력체(APEC) 정상회의를 계기로 타결된 한미 관세 협상과 관련, “이번에 국가로부터 큰 도움을 받았고, 그 신세를 꼭 갚겠다”고 말했다고 우원식 국회의장이 1일 밝혔다. 우 의장은 이날 페이스북에서 “전날 아시아태평양경제협력체(APEC) 만찬 자리에서 정 회장과 만났다는데, 이러한 말을 해서 인상적이었다”",2025-11-02 06:17:36,http://www.segye.com/newsView/20251102500781,세계일보
“옛스러움 속 새로움에 끌린다”…Z세대가 반응하는 유통업계 경험 공식,https://img.segye.com/content/image/2025/11/01/300/20251101501950.jpg,"Z세대(1997~2012년생)의 공간 소비 방식이 달라지고 있다. 부모 세대의 취향과 라이프스타일을 재해석해 즐기는 이른바 ‘엄빠코어’ 트렌드가 확산하면서, 골목, 상업 공간, 박물관처럼 옛 정취 가득한 장소들이 새로운 ‘힙플레이스’로 주목받고 있다. 공간에 담긴 이야기와 분위기를 체험하고, 그 안에서 자신만의 취향을 새롭게 발견하고 공유할 수 있는 곳들이",2025-11-02 05:30:00,http://www.segye.com/newsView/20251101501949,세계일보
"호텔업계, ‘제철코어’족 겨냥 가을 한정 디저트 프로모션 열전",https://img.segye.com/content/image/2025/11/01/300/20251101501937.jpg,"완연한 가을에 접어들며 늦캉스를 즐기려는 여행 수요가 늘어나는 가운데, ‘제철코어(제철+Core)’가 새로운 여행 트렌드로 주목받고 있다. ‘제철코어’란 특정 계절에 즐길 수 있는 음식이나 활동에 과감히 소비하는 현상을 일컫는다. 경험 소비 트렌드가 완전히 자리잡으면서, 계절이 주는 한정적인 즐거움을 제대로 누리자는 인식이 확산되고 있는 것이다. 이",2025-11-02 05:30:00,http://www.segye.com/newsView/20251101501936,세계일보
쌀쌀한 가을…유통업계 ‘필수템’으로 자리잡은 보온 텀블러,https://img.segye.com/content/image/2025/11/01/300/20251101501972.jpg,"아침저녁으로 제법 쌀쌀함이 느껴지는 가을, 따뜻한 커피와 티가 더욱 생각나는 계절이다. 직장인과 주부, 학생을 가리지 않고 '필수템'으로 자리 잡은 보온 텀블러가 감각적인 디자인과 강화된 기능으로 소비자들의 눈길을 끌고 있다. 2일 유통업계에 따르면 락앤락은 세계적으로 인기를 끌고 있는 산리오캐릭터즈를 앞세운 '스쿨핏 시리즈 텀블러'를 최근 출시했다.",2025-11-02 05:30:00,http://www.segye.com/newsView/20251101501969,세계일보
"유통업계, ‘근본이즘’ 트렌드 겨냥 전통성 강조 콘텐츠 열전",https://img.segye.com/content/image/2025/11/02/300/20251102500674.jpg,"유행이 빠르게 뒤바뀌는 변화의 홍수 속에서 본질적인 가치를 중시하는 ‘근본이즘(根本+ism)’ 트렌드가 다시금 주목받고 있다. ‘근본이즘’이란 원조격으로 불리는 기업의 제품을 소비하며 안정감과 만족감을 느끼는 현상을 일컫는다. 스테디셀러에 대한 신뢰가 기반이 되어 ‘가치 소비’ 트렌드와도 맞닿아 있다. 이에 유통업계에서도 브랜드 고유의 전통성, 철학",2025-11-02 05:30:00,http://www.segye.com/newsView/20251102500673,세계일보
"유통업계, 가을 시즌 ‘신제품 라인업’ 강화",https://img.segye.com/content/image/2025/11/02/300/20251102500678.jpg,"가을을 맞은 유통업계가 ‘잇텀(eat+autumn)’ 트렌드에 발맞춰 미각과 감성을 자극하는 시즌 한정 제품을 잇따라 선보이고 있다. 이는 최근 MZ세대를 중심으로 계절의 맛과 향을 즐기려는 소비 트렌드가 확산되면서, 식음료 브랜드들이 풍미와 비주얼을 모두 갖춘 가을 한정 제품을 선보이고 있는 것이다. 이러한 배경에는 소비자들의 계절감 있는 소비 욕구를",2025-11-02 05:30:00,http://www.segye.com/newsView/20251102500677,세계일보
"‘블랙프라이데이’ 코앞…유통업계, 대형 쇼핑 행사 마련",https://img.segye.com/content/image/2025/11/02/300/20251102500680.jpg,연중 최대 쇼핑 행사 블랙프라이데이가 다가오는 가운데 유통업계도 대형 쇼핑 행사를 마련했다. 2일 업계에 따르면 11번가는 1일부터 11일까지 진행하는 연중 최대 쇼핑축제 '2025 그랜드십일절'에서 매일 오후 9시부터 밤 12시까지 치킨·피자·햄버거 등 야식으로 즐기기 좋은 외식 e쿠폰을 매일 2개씩 최대 55% 할인 판매하는 ‘심야배달’을 신규 오픈,2025-11-02 05:30:00,http://www.segye.com/newsView/20251102500679,세계일보
"“30대, 이제 월급 안 모은다고?”…대신 ‘이걸’로 돈 불린다",https://img.segye.com/content/image/2025/11/02/300/20251102500670.jpg,1억원 이상 자산을 보유한 ‘대중 부유층(Mass Affluent)’ 시장의 주역이 MZ세대로 빠르게 교체되고 있다. 저축 중심의 자산 운용이 투자 중심으로 이동하면서 한국 금융 소비지형이 세대교체의 한가운데를 지나고 있다. ◆“저축보다 투자” 자산 구조가 바뀌었다 2일 하나금융경영연구소의 ‘2026 대한민국 금융소비자 트렌드’ 보고서에 따르면,2025-11-02 06:20:32,http://www.segye.com/newsView/20251102500669,세계일보
"한국 헌정 영상 올린 엔비디아…“산업화, e스포츠 등 소개”",https://img.segye.com/content/image/2025/11/01/300/20251101507150.jpg,세계 최대 인공지능(AI) 반도체 기업 엔비디아가 ‘한국의 차세대 산업혁명’이라는 제목의 헌정 영상을 공개했다. 젠슨 황 엔비디아 최고경영자(CEO)의 2025 아시아태평양경제협력체(APEC·에이펙) 행사 참석을 계기로 최신 그래픽처리장치(GPU) 26만장을 한국에 공급하기로 한 소식이 알려진 직후다. 엔비디아는 31일(현지시간) 유튜브 공식 계정에 3,2025-11-01 22:09:00,http://www.segye.com/newsView/20251101507014,세계일보
