title,thumbnail,short_content,write_time,link,company
韓·싱가포르 “첨단기술·에너지 전방위 협력”,https://img.segye.com/content/image/2026/03/02/300/20260302510726.jpg,싱가포르를 국빈 방문한 이재명 대통령은 2일 “양국은 첨단기술과 에너지 안보 분야에서 전방위적인 협력을 확대해 나가기로 했다”며 “대한민국과 싱가포르의 인공지능(AI) 역량과 혁신적인 산업 생태계가 시너지를 발휘해 역내 AI 발전이 한층 가속화될 것”이라고 밝혔다. 이번 정상회담을 계기로 양국은 경제적 연대와 경제안보 협력을 강화하고자 한·싱가포르 자유무역,2026-03-03 06:00:00,http://www.segye.com/newsView/20260302510438,세계일보
박홍근 빠지고… 민주 서울시장 후보 경선 5파전,https://img.segye.com/content/image/2026/03/02/300/20260302513283.jpg,"더불어민주당 공천관리위원회는 2일 6·3 지방선거에서 서울·경기·울산과 통합특별시장 선출 예정인 전남·광주에 출사표를 던진 후보 전원에 대해 경선을 치르기로 확정했다. 서울시장 선거 본선행 티켓을 쥐기 위한 당내 경선은 5파전으로 막을 열게 됐다. 김이수 공관위원장은 서울 여의도 당사에서 서울시장 후보로 공모한 김영배 의원과 김형남 전 군인권센터 사무국장,",2026-03-03 06:00:00,http://www.segye.com/newsView/20260302512523,세계일보
'1억 공천헌금' 강선우·김경 구속 갈림길…오늘 영장심사,https://img.segye.com/content/image/2026/03/03/300/20260303501568.jpg,"‘1억 공천헌금’ 의혹을 받는 무소속 강선우 의원과 김경 전 서울시의원이 3일 구속 갈림길에 나란히 선다. 서울중앙지법 이종록 영장전담 부장판사는 이날 오전 10시 김 전 시의원, 오후 2시30분 강 의원에 대한 구속 전 피의자 심문(영장실질심사)을 차례로 연다. 경찰이 두 사람에 대한 구속영장을 신청한 날로부터 26일, 국회 본회의에서 체포동의안이",2026-03-03 05:26:17,http://www.segye.com/newsView/20260303501569,세계일보
"김남준 전 청와대 대변인, 2일 북콘서트 열고 본격 정치 행보 나서",https://img.segye.com/content/image/2026/03/02/300/20260302514135.jpg,"김남준 전 청와대 대변인이 2일 인천 계양구 경인교육대학교에서 출판기념회를 열고, 계양을 국회의원 보궐선거를 향한 본격적인 정치 행보에 나섰다. 이날 출판기념회에는 정청래 더불어민주당 대표와 인천시장 출마를 선언한 박찬대(연수갑)국회의원을 비롯한 민주당 의원 30여명과 도성훈 인천시교육감, 윤환 계양구청장, 민주당 당원 등 300여명이 참석했다. 김 전",2026-03-03 00:12:16,http://www.segye.com/newsView/20260302514137,세계일보
靑 “중동 정세 지나치게 우려하지 않아도 돼…모든 분야서 철저히 대비”,https://img.segye.com/content/image/2026/03/03/300/20260303500128.jpg,"위성락 청와대 국가안보실장은 최근 중동에서의 상황과 관련해 2일 “지나치게 우려하지 않으셔도 된다”며 “정부는 실물 경제, 금융, 군사안보 등 모든 분야에서 철저히 대비하고 있고, 대통령실 또한 비상대응체제를 유지하고 있다”고 밝혔다. 위 실장은 이날 싱가포르에서 열린 한·싱가포르 정상회담 관련 브리핑에서 미국의 이란 공격으로 인한 중동 정세에 대해 “수시",2026-03-03 00:29:00,http://www.segye.com/newsView/20260302514048,세계일보
청와대 “중동 사태 지나치게 우려하지 않아도 돼…비상대응 체제 유지”,https://img.segye.com/content/image/2026/03/02/300/20260302513878.jpg,위성락 청와대 국가안보실장은 2일(현지시간) 중동 사태와 관련해 “대통령께서 SNS를 통해 말씀하셨듯이 지나치게 우려하지 않아도 된다”고 밝혔다. 싱가포르를 국빈 방문 중인 이재명 대통령을 수행 중인 위 실장은 이날 현지에 마련된 순방기자단 프레스센터에서 브리핑을 열고 “최근 중동 중세가 불안해지면서 여러 뉴스가 나온다”며 이 같이 말했다. 위 실장은,2026-03-02 22:48:39,http://www.segye.com/newsView/20260302513841,세계일보
"보훈부·현대차, 比 ‘6·25 영웅’ 추모시설 정비",https://img.segye.com/content/image/2026/03/02/300/20260302512325.jpg,"국가보훈부가 현대차그룹과 함께 필리핀 국립 영웅묘지 한국전 참전비와 필리핀 한국전 참전 기념관(사진)에 대한 보수 및 환경개선 작업에 나선다고 2일 밝혔다. 필리핀은 아시아에서 첫 번째, 세계 세 번째로 6·25전쟁에 파병을 했다. 필리핀 마닐라에 위치한 참전비와 기념관은 6·25전쟁에 파병된 필리핀 한국 원정군(PEFTOK) 5개 전투대대, 7420",2026-03-02 21:07:00,http://www.segye.com/newsView/20260302510150,세계일보
"비명횡사 딛고 총리급 발탁… 박용진, 규제개혁 키 잡다",https://img.segye.com/content/image/2026/03/02/300/20260302510957.jpg,2년 전 22대 총선 더불어민주당 경선 과정에서 ‘비명횡사’(비명계 공천탈락)의 대표 격으로 불리며 친이재명계 인사들과 대립각을 세웠던 박용진 전 의원이 이재명 대통령 직속 규제합리화위원회(규제합리위) 부위원장에 2일 임명됐다. 규제합리위 위원장은 대통령이다. 이 대통령이 취임 후 국무총리·민간 공동위원장 체제이던 규제개혁위원회를 격상하고 규모를 확대했다.,2026-03-02 21:46:28,http://www.segye.com/newsView/20260302510556,세계일보
정통 법조인 출신… ‘이화영 변호’ 전력 [정일연 국민권익위원장 프로필],https://img.segye.com/content/image/2026/03/02/300/20260302511188.jpg,국민권익위원회 신임 위원장으로 임명된 정일연(사진) 변호사는 서울중앙지법 부장판사와 수원지방법원 안산지원장 등을 역임한 정통 법조인 출신 인사다. 전북 전주 출신으로 건국대 법학과를 졸업하고 사법연수원을 20기로 수료한 정 위원장은 법관 퇴직 이후 법무법인 베이시스 변호사로 활동하며 공직사회와 관련한 다양한 외부 활동을 이어왔다. 법무부 사면심사위원회,2026-03-02 21:49:12,http://www.segye.com/newsView/20260302510531,세계일보
중앙지법 부장판사 등 23년간 법관 생활 [전현정 중앙선관위원 후보 프로필],https://img.segye.com/content/image/2026/03/02/300/20260302511059.jpg,"전현정(사진) 중앙선거관리위원회 위원 후보자는 사법연수원 22기를 수료한 뒤 수원지법 성남지원 판사를 시작으로 대법원 재판연구관, 서울중앙지법 부장판사 등을 지냈다. 23년간 법관생활을 한 뒤 변호사로 자리를 옮겼으며, 한양대 법학전문대학원 겸임교수, 성균관대 법학전문대학원 초빙교수, 서울시 행정심판위원 등 다양한 활동을 했다. 헌법재판관과 초대 공수처장",2026-03-02 19:07:00,http://www.segye.com/newsView/20260302510535,세계일보
‘이재명 기본소득’ 설계한 진보 경제학자 [강남훈 기본사회위 부위원장 프로필],https://img.segye.com/content/image/2026/03/02/300/20260302511129.jpg,대통령 소속 자문위원회인 기본사회위원회 강남훈(사진) 부위원장은 이재명 대통령의 핵심 정책인 ‘기본소득’을 설계한 진보 성향의 경제학자다. 이한주 경제·인문사회연구회 이사장과 함께 이 대통령 경제정책에 가장 큰 영향을 줬다는 평가를 받는다. 2017년 기본소득한국네트워크 이사장을 맡아 ‘기본소득 개헌’을 주장했던 강 부위원장은 이듬해 이 대통령이 경기도지사,2026-03-02 21:50:37,http://www.segye.com/newsView/20260302510549,세계일보
해양 항만·정책통… 북극항로 개척 적임 [황종우 해수부 장관 후보 프로필],https://img.segye.com/content/image/2026/03/02/300/20260302510995.jpg,"황종우 해양수산부 장관 후보자는 27년간 해수부 관료로서 쌓은 경험을 바탕으로 해양수도권 도약을 위해 북극항로 시대를 준비할 적임자로 평가받는다. 황 후보자는 부산 출신으로 행정고시 38회로 공직에 입문해 해수부에서 해양 정책·환경·보전·레저 부문을 모두 경험했다. 해수부 항만물류기획과장, 해양정책과장, 대변인, 해사안전국장, 기획조정실장 등 핵심 보직",2026-03-02 21:48:02,http://www.segye.com/newsView/20260302510551,세계일보
유서대필 조작 변론… 인권침해 규명 앞장 [송상교 3기 진실화해위원장 프로필],https://img.segye.com/content/image/2026/03/02/300/20260302511141.jpg,"진실·화해를위한과거사정리위원회(진실화해위) 3기 초대 위원장으로 임명된 송상교(사진) 전 진실화해위 사무처장은 인권 침해 사건 진실규명을 위해 싸워온 변호사다. 법무부 검찰과거사위원회 위원 등을 지내며 유서대필 조작사건, 재일동포 간첩조작사건, 경찰의 불법체포 국가배상 청구소송, 군 사망 미통지 국가배상 사건 등의 변론을 수행했다. 2021년에는 진실화",2026-03-02 21:49:55,http://www.segye.com/newsView/20260302510553,세계일보
국내 생명공학 연구윤리 기준 마련 기여 [김옥주 생명윤리심의위원장 프로필],https://img.segye.com/content/image/2026/03/02/300/20260302511117.jpg,국가생명윤리심의위원회 위원장으로 임명된 김옥주(사진) 서울대 의대 인문의학교실 주임교수는 국내 생명윤리 기준 마련에 기여한 인물로 평가받는다. 김 교수는 미국 하버드대에서 박사후 연구원으로 재직하며 의학사·의료 윤리 연구를 수행한 뒤 2002년 한국으로 돌아와 서울대 의대 의사학(醫史學)교실 조교수로 근무하다가 2008년 인문의학교실 교수로 임명돼 현재까지,2026-03-02 21:51:21,http://www.segye.com/newsView/20260302510567,세계일보
민주주의·정당·여론 등 연구한 정치학자 [윤광일 중앙선관위원 후보 프로필],https://img.segye.com/content/image/2026/03/02/300/20260302511091.jpg,"윤광일(사진) 중앙선거관리위원회 위원 후보자는 한국과 미국 정치, 정당정치, 정치심리 등 다양한 분야를 연구해온 학자다. 서울에서 태어나 중대부고와 서울대 정치학과를 졸업한 뒤 서울대에서 정치학 석사 학위를, 미국 미시간대 앤아버 캠퍼스에서 정치학 박사 학위를 받았다. 공군사관학교 전임강사를 거쳐 숙명여대 정치외교학과 교수로 재직 중이다. 대표 저서로는 ‘",2026-03-02 19:07:00,http://www.segye.com/newsView/20260302510506,세계일보
"대법 “쪼개기 후원, KT경영진 배상 책임”",https://img.segye.com/content/image/2026/03/02/300/20260302511816.jpg,"비자금을 조성해 국회의원들에게 이른바 ‘쪼개기 후원’을 한 혐의로 벌금형이 확정된 구현모 전 KT 대표이사와 경영 책임자였던 황창규 전 KT 회장이 소액주주들에게 일부 배상책임이 있다는 대법원 판단이 나왔다. 대법원 3부(주심 이흥구 대법관)는 박모씨 등 KT 소액주주 35명이 황 전 회장과 이석채 전 회장, 구 전 대표 등 전현직 임원 13명을 상대로 낸",2026-03-03 06:00:00,http://www.segye.com/newsView/20260302510257,세계일보
"인천~제주 하늘길, 10년 만에 다시 열린다",https://img.segye.com/content/image/2026/03/02/300/20260302510255.jpg,"인천과 제주를 잇는 직항 노선이 이르면 4월부터 재개될 것으로 보인다. 2일 제주도와 항공업계 등에 따르면 정부는 지난달 25일 대통령 주재로 열린 제11차 국가관광전략회의에서 지방 공항의 국제선 노선을 대폭 확대하고, 인천공항 입국자들도 국내선 등을 통해 지방으로 쉽게 이동할 수 있도록 교통편을 확대하는 내용의 주요 관광정책을 심의·확정했다. 외국인",2026-03-03 06:00:00,http://www.segye.com/newsView/20260302510254,세계일보
채용 합격 4분 만에 취소… 법원 “부당 해고”,https://img.segye.com/content/image/2026/03/02/300/20260302511648.jpg,채용 합격 소식을 전한 지 4분 만에 구체적인 사유를 밝히지 않고 채용 취소를 통보한 건 부당해고라는 법원 판단이 나왔다. 2일 법조계에 따르면 서울행정법원 행정13부(재판장 진현섭)는 핀테크 기업 A사가 중앙노동위원회(중노위)를 상대로 제기한 부당채용취소 구제 재심판정 취소 소송에서 원고 패소로 판결했다. A사는 2024년 온라인 구직사이트에서 글로,2026-03-03 06:00:00,http://www.segye.com/newsView/20260302510065,세계일보
"국세청, 반납 받은 탈취 코인 또 털렸다",https://img.segye.com/content/image/2026/03/02/300/20260302513326.jpg,국세청 가상자산 유출 사고가 두 차례에 걸쳐 발생한 것으로 확인됐다. 해킹범이 탈취한 코인을 반납했는데 이 코인이 또다시 빠져나간 것이다. 2일 경찰에 따르면 경찰청 사이버테러수사대는 국세청의 가상자산 유출 사고에 대한 입건 전 조사(내사)를 컴퓨터 등 사용 기기 혐의 정식 수사로 전환했다. 경찰은 국세청 가상자산을 탈취했다가 돌려놓은 해킹범으로부터,2026-03-03 06:00:00,http://www.segye.com/newsView/20260302512604,세계일보
[법조브리핑] ‘사법 3법’ 강행 처리 후폭풍…현장 혼란·재판 지연 심화 우려 外,https://img.segye.com/content/image/2026/03/02/300/20260302512697.jpg,더불어민주당이 지난달 국회 본회의에서 법왜곡죄·재판소원·대법관 증원 등 ‘사법 3법’을 일방 처리한 뒤 법조계에선 여진이 계속되고 있다. 특히 법왜곡죄(개정 형법)와 재판소원(개정 헌법재판소법)의 경우 이달 중 정부가 법률을 공포하는 즉시 시행되면 사건 폭증과 관련 규정 미비로 인해 현장 혼란이 불가피할 것이란 우려가 터져나온다. 채용 합격 소식을 전,2026-03-03 06:00:00,http://www.segye.com/newsView/20260302512631,세계일보
"[사사건건] ‘공천헌금 의혹’ 강선우·김경, 3일 구속기로 外",https://img.segye.com/content/image/2026/03/03/300/20260303500323.jpg,"‘1억 공천헌금’ 의혹을 받는 무소속 강선우 의원과 김경 전 서울시의원의 구속 전 피의자 심문(영장실질심사)이 3일 각각 열린다. 이날 심사에서는 “쇼핑백을 받았지만 1억원이 들어있다는 사실을 몰랐다”는 강 의원의 진술 등이 검증 대상이 될 것으로 보인다. ◆법원, 3일 강선우·김경 영장심사 열어 서울중앙지법 이종록 영장전담 부장판사는 이날 오전 10시",2026-03-03 06:00:00,http://www.segye.com/newsView/20260302513913,세계일보
부산 강풍에 건물 외장재 와르르…피해 속출,https://img.segye.com/content/image/2026/03/02/300/20260302513028.jpg,"2일 강풍주의보가 내려진 부산에 순간 최대풍속 초속 20ｍ가 훌쩍 넘는 강한 바람이 불면서 건물 외장재가 떨어지는 등 피해가 잇따랐다. 부산소방재난본부에 따르면 이날 부산 서구의 순간 최대 풍속은 초속 29.5ｍ를 기록했고, 사하구에서도 초속 25.4ｍ의 강풍이 불었다. 이 때문에 오후 3시 10분께 부산 북구 구포동의 한 건물 외장재가 파손되면서 바",2026-03-02 21:06:25,http://www.segye.com/newsView/20260302512839,세계일보
[단독] “장애 아들 살 곳만이라도 찾아주고 떠나고파”,https://img.segye.com/content/image/2026/03/02/300/20260302511744.jpg,"27일 서울 강동구 자택에서 만난 전경철(64세)씨가 황달로 검누런 빛이 도는 얼굴로 힘겹게 입을 뗐다. 전씨는 지난해 4월 간암 말기 판정을 받았다. 하지만 전씨는 “차라리 마음이 편했다”고 했다. 20여년간 중증 자폐 아들을 홀로 돌보고, 치매 노모까지 수발하며 이미 만신창이가 된 그에게 죽음은 비로소 마주한 ‘해방구’였다. ◆간암말기 아빠의 숙제…발달",2026-03-02 22:44:12,http://www.segye.com/newsView/20260302510152,세계일보
"배우 명계남, 황해도지사 임명…연봉 1억5000만원 ‘이북5도지사’ 다시 도마 [이슈플러스]",https://img.segye.com/content/image/2026/03/02/300/20260302512473.jpg,정부가 이북5도위원회 소속 황해도지사에 배우 명계남씨를 임명했다. 이번 인사는 명 신임지사 부모가 황해도 실향민인 점을 고려한 것으로 알려졌다. 다만 명 지사 임명과 별개로 실질적 행정권이 없는 이북5도지사를 존치할 필요가 있느냐는 지적이 나온다. 2일 행정안전부에 따르면 명 지사 부모는 황해도 실향민인 것으로 알려졌다. 행안부 관계자는 “명 지사의 선,2026-03-03 05:33:50,http://www.segye.com/newsView/20260302512422,세계일보
원구성도 국회의원 입김… ‘꼭두각시 구의회’ 전락 [심층기획-자치 없는 지방자치],https://img.segye.com/content/image/2026/03/02/300/20260302511514.jpg,서울에서 3선 구의원을 지낸 A씨는 최근 통화에서 지역·당협위원장이 구의회 의장단 선출 과정에 직접 개입한다며 이같이 말했다. 그는 “위원장이 ‘이 사람 뽑아야 한다’고 하면 소속 구의원들이 공천 때문에 순응할 수밖에 없다. 그거 생각 없이 원칙대로 하자고 하면 눈밖에 나서 다음에 공천 못 받는 결과로 돌아오는 것”이라며 “내가 3선 하면서 (의장단 선출이,2026-03-02 22:19:26,http://www.segye.com/newsView/20260302510346,세계일보
“그 분 지시로 발의”… 주민보다 ‘의원님 심기’가 기준 [심층기획-자치 없는 지방자치],https://img.segye.com/content/image/2026/03/02/300/20260302511713.jpg,B 구의원은 2024년 8월 서울의 한 구의회 본회의에서 원구성과 관련해 “상대당이 협치의 원칙을 깨뜨렸다”고 지적하며 이같이 발언했다. 그는 상대당 소속 A 국회의원이 “직접 회의를 주재하며 (의장단) 경선 전반에 대해 감독했다는 사실을 알고 본 의원은 경악을 금치 못했다”고 했다. 이는 해당 구의회 회의록에 기록된 내용이다. 비록 상대당과의 정쟁,2026-03-02 20:00:00,http://www.segye.com/newsView/20260302510348,세계일보
초고령화 속 베이비부머 은퇴…국민연금 수급자 800만 시대,https://img.segye.com/content/image/2026/03/02/300/20260302511804.jpg,올해 국민연금 수급자가 800만명을 돌파할 전망이다. 2024년 11월 말 700만명을 돌파한 지 2년도 안 돼 100만명 늘어날 것이라는 관측이 나왔다. 국민연금공단은 지난해 11월30일 기준 국민연금 수급자가 782만9598명으로 2024년 말 대비 6.2% 증가했다고 2일 밝혔다. 노령연금·유족연금을 비롯해 이밖에 일시금 수급자를 모두 합한 것으로,2026-03-02 22:30:59,http://www.segye.com/newsView/20260302510137,세계일보
내신 9등급 막차… ‘반수생’ 10만명 달할 듯,https://img.segye.com/content/image/2026/03/02/300/20260302511439.jpg,내신 9등급제가 마지막으로 적용되는 2027학년도 대입에서 이른바 ‘반수’를 하는 수험생이 역대 최다 규모가 될 것이라는 입시업계 전망이 나왔다. 종로학원은 올해 수능에서 반수생이 10만명대에 육박할 것으로 예상한다고 2일 밝혔다. 반수는 대학에 입학한 상태에서 다시 한 번 입시에 도전하는 것을 뜻한다. 10만명이라는 규모는 지난해 반수생(9만2390,2026-03-02 19:45:00,http://www.segye.com/newsView/20260302510070,세계일보
기간제 교사 성폭행 울산 사립학교 간부교사 파면 [사건수첩],https://img.segye.com/content/image/2026/03/02/300/20260302512157.jpg,기간제 교사들에게 성폭력을 저지른 울산의 한 사립학교 간부급 교사가 파면됐다. 2일 울산시교육청 등에 따르면 해당 학교 법인은 지난 1일 징계위원회를 열어 한 사립고교 50대 교사 A씨를 파면하기로 의결했다. 징계위는 해당 학교장에 대해선 관리·감독 부실의 책임을 물어 정직 1개월을 결정했다. A씨는 지난해 9월 있었던 술자리 이후 20대 기간제,2026-03-02 19:44:41,http://www.segye.com/newsView/20260302512135,세계일보
청년 건강의 최대 적… 男 “경쟁” 女 “차별”,https://img.segye.com/content/image/2026/03/02/300/20260302511786.jpg,"20∼30대 청년들이 직접 경험한 가장 큰 사회적 건강 위험 요인이 성별에 따라 다르게 나타났다. 남성은 과도한 경쟁을, 여성은 성차별을 건강 위협 요인으로 각각 꼽았다. 2일 한국보건사회연구원에 따르면 지난해 5월21일부터 6월11일까지 전국 만 19세 이상∼34세 이하 청년 1000명(남성 520명·여성 480명)을 대상으로 설문한 결과 이같이 확",2026-03-02 19:37:00,http://www.segye.com/newsView/20260302510215,세계일보
“아침마다 영양제 한 움큼?”…전문의가 꼽은 ‘탈모 악화’ 4대 범인,https://img.segye.com/content/image/2026/02/28/300/20260228501073.jpg,"아침마다 머리를 감고 난 뒤 배수구에 시커멓게 엉킨 머리카락을 걷어내는 순간, 덜컥 겁이 난다. 지푸라기라도 잡는 심정으로 탈모에 좋다는 고함량 영양제와 건강식을 매일 한 움큼씩 털어 넣는다. 하지만 전문가들은 말한다. 결핍을 채우려다 넘쳐버린 영양소가 오히려 모낭 환경을 흔들 수 있다고. 28일 국민건강보험공단 진료 빅데이터에 따르면 2022년 기준",2026-02-28 05:23:06,http://www.segye.com/newsView/20260228501071,세계일보
[재미로 보는 오늘의 운세] 2월 28일 (토요일) 띠별 운세,https://img.segye.com/content/image/2026/02/26/300/20260226519380.jpg,백운철학원,2026-02-28 04:00:00,http://www.segye.com/newsView/20260226517108,세계일보
"한국장애인재단, 권선진 이사장 선임",https://img.segye.com/content/image/2026/02/27/300/20260227515814.jpg,"한국장애인재단이 최근 제128차 이사회를 열고 권선진 평택대학교 교수를 이사장으로 선임했다. 권선진 이사장은 연세대학교 사회복지학과에서 학사·석사·박사 학위를 취득한 장애인복지 분야의 대표적 학자로, 한국보건사회연구원을 거쳐 1999년부터 평택대학교 교수로 재직하고 있다. 장애인재활상담사 국가시험 출제 및 검토위원, 한국직업재활학회 회장을 역임했고, 한",2026-02-27 22:18:50,http://www.segye.com/newsView/20260227515739,세계일보
“오징어 게임 시즌3” “폭삭 속았수다” 환호하는 사이...K-콘텐츠 역대 최대 수출,https://img.segye.com/content/image/2026/02/27/300/20260227506469.jpg,"넷플릭스 시리즈 ‘오징어 게임 시즌3’나 제주를 배경으로 한 드라마 ‘폭싹 속았수다’(사진) 등이 전 세계 시청 순위에서 상위권을 기록하면서 K-드라마의 IP(지식재산권) 중심 수출이 급증하고 있다. 이뿐만이 아니다. 네이버웹툰과 카카오엔터테인먼트가 일본, 북미, 동남아 등에서 웹툰 플랫폼 1위를 기록하며 한국 웹툰의 글로벌 시장 규모가 2조 원을 넘어서기",2026-02-27 17:52:38,http://www.segye.com/newsView/20260227506470,세계일보
"청춘들의 시린 자화상 그린 한로로의 소설 자몽살구클럽, 베스트셀러 1위에",https://img.segye.com/content/image/2026/02/27/300/20260227506113.jpg,“우리들의 모순적인 소원. 나는 알고 있다. 죽고 싶지만 실은 죽고 싶지 않은 서로의 진실을 알아줄 사람은 서로밖에 없음을.” 알코올 중독 아빠와 가정폭력 등 세상에 대한 분노와 체념을 가진 소하를 포함한 죽음을 생각하는 네 여중생들이 만든 비밀 모임 이야기를 통해 우리 시대 청춘들의 시린 자화상을 묘파한 싱어송라이터 한로로의 소설 ‘자몽살구클럽’이 베,2026-02-27 17:52:19,http://www.segye.com/newsView/20260227506114,세계일보
갈등 유발하는 캣맘 ‘길고양이 밥자리’ 더 늘었다…‘대형화’에 ‘비위생’ 골칫거리,https://img.segye.com/content/image/2026/02/27/300/20260227513852.jpg,서울 시내 길고양이 중성화율이 낮아진 가운데 이른바 ‘캣맘’이 길고양이에게 먹이를 주는 밥자리도 늘어나고 대형화된 것으로 조사됐다. 캣맘은 길고양이를 자발적으로 돌보는 사람들을 지칭하는 말이다. 27일 서울시에 따르면 시내 길고양이는 9만마리에서 9만2000마리 수준으로 1㎢당 149~151마리가 서식하고 있다. 중성화율은 2023년 67.3%에,2026-02-27 17:41:25,http://www.segye.com/newsView/20260227513853,세계일보
