title,thumbnail,short_content,write_time,link,company
‘김정은 금고지기’ 사위가 파헤친 北 비자금의 실체,https://img.segye.com/content/image/2025/10/30/300/20251030520930.jpg,김정은의 숨겨진 비밀 금고/ 류현우/ 동아일보사/ 2만3000원 2021년 1월 “‘김정은 금고지기’ 사위 2019년 한국 망명”이라는 보도로 세상에 알려진 류현우 전 쿠웨이트 주재 북한 대사대리가 쓴 책이다. 1972년 평양에서 태어난 저자는 북한 노동당 39호실장 전일춘 외동딸과 결혼해 17년간 처가에서 생활했다. ‘김씨 일가의 금고지기’로 불린 장,2025-11-01 06:00:00,http://www.segye.com/newsView/20251030516833,세계일보
먼 길 [詩의 뜨락],,"젊은 날에는 좋은 시인이 되고 싶어 몇 번이고 술 마시고 취해서 땅에 쓰러졌다. 바른 길 외치다가 감방에도 갔다. 종국에는 온몸에 상처만 쌓이고 나라를 멀리 떠나 외로워져서야 나그네가 된 나에게 네가 다가왔다. 어두워 몸부림쳐도 외면만 하고 동반자 하나도 허용하지 않던 길, 그늘에 가려 추운 대답을 기다리면 그제야 눈길만 몇 개 보내주었지 그 갈증, 그",2025-11-01 06:00:00,http://www.segye.com/newsView/20251030516670,세계일보
인류 흥망성쇠 결정짓는 핵심 ‘자원·물류’,https://img.segye.com/content/image/2025/10/30/300/20251030520715.jpg,"움직이는 문명, 자원과 물류의 세계사/ 한종수·성흠제·조성준/ 섬앤섬/ 2만5000원 석유가 인류의 중요한 에너지 자원으로 부상한 시기는 19세기 후반 자동차가 개발돼 보급되면서였다. 그 이전까지 인류는 등유만 사용하고 휘발유는 길거리에 내다 버렸다. 자동차가 개발돼 석유가 연료로 사용되면서 비로소 각광을 받기 시작한 것이다. 지금은 각종 산업용 원자재",2025-11-01 06:00:00,http://www.segye.com/newsView/20251030516673,세계일보
자본주의와 남성성의 위기… 우리 사회는 제 역할을 하고 있나,https://img.segye.com/content/image/2025/10/30/300/20251030520763.jpg,"젊은 남성은 왜 분노하는가?/ 사이먼 제임스 코플런드/ 송은혜 옮김/ 바다출판사/ 1만9800원 여성 대상 폭력과 살인, 온라인 집단 괴롭힘, 여성과 외국인 혐오, 불특정 다수를 향한 테러까지. 우리 사회를 위협하는 젊은 남성의 분노 표출은 비단 대한민국뿐 아니라 전 세계가 골머리를 앓는 사안이다. 대부분의 사람은 이런 남성을 열등감에 빠진 낙오자, 미",2025-11-01 06:00:00,http://www.segye.com/newsView/20251030516698,세계일보
불확실성의 핵심 美·中 대립… 한국의 복합 위기 해법 찾기,https://img.segye.com/content/image/2025/10/30/300/20251030520788.jpg,미중 관계 레볼루션/ 이희옥·김영한·권석준·차태서/ 한겨레출판사/ 1만7000원 트럼프 2기 출범 이후 더욱 첨예해진 미·중 대립은 우리나라 국민 다수가 체감하는 불확실성의 핵심 변수로 떠올랐다. 이제 국제사회는 ‘지정학(地政學)’이 아닌 ‘기정학(技政學)’ 시대로 진입하고 있다. 그 중심에 선 인공지능(AI)은 국가의 생존을 좌우할 게임 체인저가 됐다,2025-11-01 06:00:00,http://www.segye.com/newsView/20251030516701,세계일보
[새로 나온 책] 풋볼리티카 외,https://img.segye.com/content/image/2025/10/30/300/20251030520959.jpg,"풋볼리티카(라몬 우살, 조진희 옮김, 나름북스, 2만2000원)=‘풋볼리티카(Futbolitica)’는 스페인 바르셀로나 지방에서 사용되는 카탈루냐어의 축구(futbol)와 정치(politica)를 결합한 조어다. 바르셀로나 출신 작가인 저자는 축구를 “정치적 함의를 지닌 스포츠”라고 주장한다. 축구클럽은 민족의 정체성을 상징한다. FC 바르셀로나는 카탈루",2025-11-01 06:00:00,http://www.segye.com/newsView/20251030516796,세계일보
드라마 속 예쁜 배우 누구?…알고 보니 90년대 인기가수 딸이었다,https://img.segye.com/content/image/2025/10/31/300/20251031512036.jpg,예쁘다고 소문났던 SM 연습생 출신이 이제는 배우로 자리 잡았다. 가수 박학기의 딸로 잘 알려진 박정연이 드라마에서 자주 얼굴을 비추며 활동 보폭을 넓히고 있다. 아이돌 연습생으로 이름을 알렸던 그는 이제 ‘배우 박정연’으로 자신만의 색을 만들어가고 있다. 박정연은 2015년 SM엔터테인먼트 연습생으로 발탁돼 약 4년간 트레이닝을 받았다. 프리 데뷔팀,2025-11-02 06:10:12,http://www.segye.com/newsView/20251030516361,세계일보
"래퍼 정상수, 충암고 축제서 ""윤 어게인"" 외쳐, 학생회 ""협의 없었다""",https://img.segye.com/content/image/2025/11/01/300/20251101505834.jpg,"래퍼 정상수(41)가 충암고등학교 축제 무대에서 윤석열 전 대통령을 지지하는 구호 ""윤 어게인""을 외쳐 논란이 되고 있다. 정상수는 지난 달 31일 서울 은평구 충암고등학교에서 진행된 '충암제' 무대에 올라 축하 공연을 펼쳤다. 이후 정상수는 무대 위로 한 학생을 초청했고 해당 학생이 정치적 발언을 하자 이를 계기로 정상수가 '윤 어게인'을 외친 것",2025-11-01 17:46:14,http://www.segye.com/newsView/20251101505647,세계일보
"백지영, ‘살림남’ 하차에 눈물 펑펑 쏟은 이유? “녹화 날짜 바꿔달라 했는데…”",https://img.segye.com/content/image/2025/11/01/300/20251101505605.jpg,가수 백지영이 KBS2 예능 프로그램 ‘살림하는 남자들 시즌2’(이하 ‘살림남’)에서 하차하게 된 이유를 솔직하게 털어놨다. 1일 백지영의 공식 유튜브 채널 ‘백지영’에는 ‘백지영♥정석원 부부가 캠핑장에서 직접 요리한 핵매운 쭈꾸미 삼겹살’이라는 제목의 영상이 게재됐다. 영상에서 백지영은 남편 정석원과 함께 ‘차박(차에서 숙박하는 여행)’을 즐기며 직접,2025-11-02 00:01:23,http://www.segye.com/newsView/20251101505767,세계일보
"'천의 얼굴' 배우 이정은 ""연극배우 시절 연봉 20만원, 식당 일도 했다""",https://img.segye.com/content/image/2025/11/01/300/20251101505385.jpg,"'천만 배우' 수식어를 갖고 있는 배우 이정은(55)이 연극배우 시절 경제적 어려움으로 생계유지를 위해 고생했던 과거를 공개했다. 이정은은 지난 달 31일 채널S 예능 '전현무계획3'에 배우 정려원과 '먹친구'로 출연해 전현무, 곽튜브(본명 곽준빈)와 함께 '64번째 길바닥' 보령으로 '먹트립'을 떠났다. 이정은은 이날 보령의 묵 전문식당으로 이동해",2025-11-01 16:24:27,http://www.segye.com/newsView/20251101505171,세계일보
이요원 “23살 결혼 이유? 화려한 싱글 꿈꿨지만 지쳐 있었다” 솔직 고백,https://img.segye.com/content/image/2025/11/01/300/20251101505256.jpg,"‘원조 국민 첫사랑’ 이요원이 20대 초반 결혼을 결심했던 이유를 솔직하게 털어놨다. 오는 2일 방송되는 KBS 1TV 무비 토크쇼 ‘인생이 영화’ 29회에는 배우 이요원이 출연해 데뷔 초부터 지금까지의 연기 인생을 돌아본다. 이날 그는 드라마 ‘선덕여왕’과 영화 ‘주유소 습격사건’, ‘광식이 동생 광태’, ‘고양이를 부탁해’ 등에 얽힌 다양한 비하인드",2025-11-01 16:03:55,http://www.segye.com/newsView/20251101505313,세계일보
톱모델 딸 아니랄까 봐…뉴욕서 우월한 비주얼 뽐낸 스타 2세,https://img.segye.com/content/image/2025/10/29/300/20251029514453.jpg,"미국 뉴욕 거리를 환하게 물들인 스타 모녀의 일상이 공개됐다. 모델 출신 배우인 엄마와 그의 딸은 현지에서의 자연스러운 일상을 공유하며 세련된 분위기를 자아냈다. SNS에 공개된 사진 속 딸은 또렷한 이목구비와 늘씬한 체형으로 시선을 사로잡았고, “모델이냐”고 묻는 현지인들의 반응까지 전해지며 화제를 모았다. 뉴욕 소호 거리를 런웨이로 만든 모녀의 정체",2025-11-01 16:00:00,http://www.segye.com/newsView/20251029514879,세계일보
"지드래곤, APEC 세계 정상도 사로잡은 'GD 파워'‥환영 만찬 무대 장식",https://img.segye.com/content/image/2025/11/01/300/20251101504826.jpg,"지드래곤(G-DRAGON)이 경상북도 경주시에서 열린 '2025 아시아태평양경제협력체(APEC) 정상회의' 환영 만찬 자리에 한국 대표 아티스트로 참석해 존재감을 입증했다. 지드래곤은 지난 31일 경북 경주 라한셀렉트호텔 대연회장에서 진행된 '2025 APEC 정상회의' 환영 만찬자리에 초청돼, 이재명 대통령과 시진핑 중국 국가 주석을 비롯한 각국 정상",2025-11-01 15:06:05,http://www.segye.com/newsView/20251101504842,세계일보
"2PM 옥택연, 내년 봄 품절남 된다…‘에펠탑 프러포즈’ 9개월 만에 현실로",https://img.segye.com/content/image/2025/11/01/300/20251101504710.jpg,"그룹 2PM 출신 배우 옥택연이 오랜 연인과 결혼 소식을 전했다. 공개 열애 약 6년 만이다. 1일 소속사 피프티원케이는 “옥택연이 오랜 기간 만남을 이어온 분과 서로의 인생을 함께하기로 약속했다”고 공식 발표했다. 결혼식은 내년 봄, 양가 가족과 가까운 지인만 참석한 가운데 서울 모처에서 조용히 진행될 예정이다. 소속사 측은 “배우자가 비연예인",2025-11-01 15:06:24,http://www.segye.com/newsView/20251101504777,세계일보
"‘결혼 6년만에 남편상’ 김선영 앵커 “故 백성문, 항암 중 실명해도 사력 다해""",https://img.segye.com/content/image/2025/11/01/300/20251101503884.jpg,"암 투병 끝에 세상을 떠난 백성문 변호사를 향해 아내 김선영 YTN 앵커가 추모의 글을 남기며 먹먹한 심경을 전했다. 김 앵커는 1일 고(故) 백성문 변호사의 사회관계망서비스(SNS)에 신혼여행지였던 프랑스 파리에서 함께 찍은 사진을 게재하며 “사람 좋은 선한 미소로 제게 다가온 남편, 백성문 변호사가 영면에 들었다”고 전했다. 이어 “제 남편은 지",2025-11-01 12:05:29,http://www.segye.com/newsView/20251101503934,세계일보
"‘친형 소송·가족 절연’ 박수홍, 생일상 앞에서 울컥 “평생 미역국 못 먹었다”",https://img.segye.com/content/image/2025/11/01/300/20251101503766.jpg,방송인 박수홍의 아내 김다예가 남편을 위해 정성 가득한 생일상을 차렸다. 지난달 31일 공개된 유튜브 채널 ‘박수홍 행복해다홍’ 영상에는 김다예가 직접 준비한 박수홍의 생일상이 담겼다. 이날 김다예는 “오늘 남편이 자유부인 시간을 줬다”며 “남편 생일상을 준비해보려 한다”고 말하며 본격적인 준비에 나섰다. 김다예는 “보양할 수 있는 음식이 좋겠다고,2025-11-01 13:30:08,http://www.segye.com/newsView/20251101503767,세계일보
언론과 형사의 합심 '승부수'에 자백한 범인… '사패산 살인사건',https://img.segye.com/content/image/2025/11/01/300/20251101503374.jpg,"등산객을 살인한 후 현장에서 음란물 시청까지 한 뻔뻔한 범인의 정체가 공개됐따. 지난달 31일 방송된 티캐스트 E채널 ‘용감한 형사들4’에서는 중랑경찰서 형사2과장 박원식 경정, 의정부경찰서 수사2과장 이윤형 경감과 과학수사대(KCSI) 윤외출 전 경무관, 김진수 경감이 출연해 수사 일지를 펼쳤다. 이날 소개된 사건은 이른 오전 강력팀으로 “등산로에",2025-11-01 11:02:24,http://www.segye.com/newsView/20251101503416,세계일보
"박명수, '학폭 불합격 처리' 경북대 바람직… 행사비 20% 빼 드릴 것",https://img.segye.com/content/image/2025/11/01/300/20251101502990.jpg,방송인 박명수가 학교폭력 전력이 있는 수험생을 불합격 처리한 경북대를 칭찬했다. 지난달 31일 방송된 KBS 라디오 쿨FM ‘박명수의 라디오쇼’에서 DJ 박명수는 한 주간의 이슈에 관해 이야기를 나눴다. 이날 박명수는 그는 경북대가 2025학년도 입시 과정에서 과거 학교폭력 전력으로 징계 처분을 받은 바 있는 22명의 수험생을 불합격 처리한 사건을,2025-11-01 09:41:34,http://www.segye.com/newsView/20251101503010,세계일보
‘은중과 상연’부터 ‘당신이 죽였다’까지…여성 서사로 불붙은 넷플릭스 오리지널 시리즈,https://img.segye.com/content/image/2025/10/31/300/20251031515146.jpg,"올해 넷플릭스 한국 오리지널 시리즈는 유독 ‘여자들의 이야기’로 뜨겁다. 사랑하고, 동경하고, 부러워하고, 원망하고, 이해하는 복잡한 감정의 미로 속에서 여성들은 각자의 방식으로 생존하고 성장한다. 시대극, 스릴러, 미스터리까지 다양한 장르의 옷을 갈아입으며 여성 서사는 넓고 깊게 확장되고 있다. ◆“너 없이 내 인생 못 논해”…‘은중과 상연’ ‘애마’",2025-11-01 08:16:38,http://www.segye.com/newsView/20251031515150,세계일보
“시한부 3개월”…세 번의 유언 남기고 기적처럼 살아난 원로배우,https://img.segye.com/content/image/2025/10/30/300/20251030511584.jpg,"한때 그는 시한부 3개월 판정을 받고 아들의 간 이식으로 새 삶을 얻었다. 하지만 회복의 기적 뒤에도 시련은 끝나지 않았다. 부정맥과 뇌출혈, 심근경색이 잇따라 찾아오며 가족에게 유언까지 남겨야 했던 그는, 지금 87세의 나이로 다시 삶의 현장으로 돌아왔다. 그 주인공은 원로배우 양택조다. 양택조가 생사의 고비를 수차례 넘긴 지난 세월을 고백했다. 지난",2025-11-01 06:02:46,http://www.segye.com/newsView/20251030511694,세계일보
[포토] 정수정 '매력적인 손인사',https://img.segye.com/content/image/2025/10/31/300/20251031514288.jpg,배우 정수정이 31일 오후 서울 성동구 성수동 인근에서 열린 ‘홀리데이 익스피리언스’ 포토콜 행사에 참석해 포즈를 취하고 있다.,2025-10-31 18:37:38,http://www.segye.com/newsView/20251031514297,세계일보
2년 만에 우승한 LG…‘52억’ 역대 최고 배당금 받는다,https://img.segye.com/content/image/2025/11/01/300/20251101503677.jpg,"지난달 31일에 2025 KBO(한국야구위원회)리그 통합 우승을 달성한 우승한 LG 트윈스가 역대 가장 많은 우승 배당금을 받는다. KBO 관계자에 따르면, KBO리그는 올해 PS(포스트시즌) 16경기인 와일드카드 결정전 2경기, 준플레이오프 4경기, 플레이오프 5경기, KS(한국시리즈) 5경기에서 모두 매진을 기록하며 33만5080명의 관중을 모아 입",2025-11-01 11:25:05,http://www.segye.com/newsView/20251101503666,세계일보
"암흑기 깨고 KS 준우승했으니 성공? 아니, 위치에너지가 크니 상실감은 더 크다...KS 직행도, KS우승도 가능했던 한화가 실패한 결정적 네 장면",https://img.segye.com/content/image/2025/11/01/300/20251101500099.jpg,"프로야구 한화는 2007년 이후 하위권만 맴돌았다. 천하의 명장이라는 김응용, 김성근 감독을 데려와도 소용없었다. 그러다 2018년, 11년 만에 가을야구 초대장을 받아들었지만 이후 또 암흑기에 빠져들었다. 2019년부터 2024년까지 9위-10위-10위-10위-9위-8위로 시즌을 마쳤다. 이랬던 만년 하위권팀이 2025년에 정규리그 2위, 한국시리즈",2025-11-01 00:15:15,http://www.segye.com/newsView/20251101500108,세계일보
"김현수, 3번의 준우승 아픔 딛고 3번 우승…KS MVP로 우뚝 섰다",https://img.segye.com/content/image/2025/10/31/300/20251031516063.jpg,프로야구 LG 김현수(37)가 2025년 가을을 가장 멋지게 수놓은 선수가 됐다. 김현수는 31일 대전 한화생명볼파크에서 열린 2025 한국시리즈 5차전에서 4타수 3안타 1볼넷 2타점을 기록하며 팀의 4-1 승리에 앞장섰다. 이 승리로 LG는 시리즈 전적 4승1패로 2023년 이후 2년 만에 통합 우승을 차지했다. 특히 김현수는 이번 한국시리즈 5경기,2025-10-31 22:47:48,http://www.segye.com/newsView/20251031516014,세계일보
"또다시 2등 징크스 못깬 김경문 감독… ""내년 시즌 잘 준비하겠다""",https://img.segye.com/content/image/2025/10/31/300/20251031515931.jpg,프로야구 한화 김경문 감독이 또 한국시리즈 한 번 준우승이라는 쓰디쓴 아픔을 맛봤다. 벌써 5번째다. 김경문 감독이 이끄는 한화는 31일 대전 한화생명볼파크에서 열린 2025 KBO 한국시리즈(KS·7전4승제) 5차전 LG 트윈스와 홈 경기에서 1-4로 졌다. 1승4패로 시리즈를 마친 한화는 정규시즌 2위에 이어 한국시리즈에서도 준우승에 만족하게 됐다,2025-10-31 22:11:42,http://www.segye.com/newsView/20251031515932,세계일보
"LG, 한국시리즈 우승… 2년 만에 통합우승 달성",https://img.segye.com/content/image/2025/10/31/300/20251031516421.jpg,프로야구 LG가 2025년을 최고의 한 해로 만들었다. LG는 31일 대전 한화생명볼파크에서 열린 2025 KBO 한국시리즈(KS·7전4승제) 5차전에서 선발 투수 앤더슨 톨허스트의 7이닝 4피안타 2볼넷 5탈삼진 1실점 호투와 3안타 2타점을 기록한 김현수의 타격을 앞세워 4-1로 승리했다. 이로써 시리즈 전적 4승1패를 만든 LG는 2023년 이후,2025-10-31 23:23:50,http://www.segye.com/newsView/20251031515832,세계일보
"韓 남자탁구 간판 장우진, 대만 에이스 린윈루 꺾고 WTT 프랑스 대회 8강",https://img.segye.com/content/image/2025/10/31/300/20251031508511.jpg,한국 남자 탁구 간판 장우진(세아)은 이달 11∼15일 인도에서 열린 아시아선수권에 한국 남자대표팀 일원으로 참가했지만 목 통증 여파로 뛰지 못했다. 컨디션을 회복한 장우진이 월드테이블테니스(WTT) 시리즈 상위급 대회인 챔피언스 몽펠리에에서 대만의 에이스 린윈루를 꺾고 8강에 올랐다. 세계랭킹 21위인 장우진은 31일 프랑스 몽펠리에에서 열린 대회,2025-10-31 13:17:14,http://www.segye.com/newsView/20251031508512,세계일보
‘그 아버지에 그 아들’ 호날두 장남 호날두 주니어 U-16 대표팀 데뷔전 치러,https://img.segye.com/content/image/2025/10/31/300/20251031508398.JPG,그 아버지에 그 아들이다. ‘축구 스타’ 크리스티아누 호날두(알나스르)의 장남인 크리스티아누 호날두 주니어(15)가 포르투갈 16세 이하(U-16) 축구 대표팀 데뷔전을 치렀다. 포르투갈 U-16 대표팀의 호날두 주니어는 31일 튀르키예 안탈리아에서 열린 튀르키예와의 2025 페더레이션컵 1차전에 2-0으로 앞선 후반 45분 교체로 투입돼 데뷔전을,2025-10-31 12:58:52,http://www.segye.com/newsView/20251031508379,세계일보
이탈리아 축구명가 유벤투스 새 사령탑에 루치아노 스팔레티 감독,https://img.segye.com/content/image/2025/10/31/300/20251031508318.jpg,"루치아노 스팔레티(66·이탈리아) 감독은 2022-2023시즌 나폴리를 이끌며 세리에A 우승을 지휘했고, 이를 바탕으로 2023년부터 지난 6월까지 이탈리아 대표팀을 이끈 명장이다. 이탈리아 ‘축구명가’ 유벤투스가 새로운 사령탑으로 스팔레티 감독을 선택했다. 유벤투스는 31일 홈페이지를 통해 “스팔레티 감독과 2026년 6월 30일까지 계약했다”며 “",2025-10-31 12:50:09,http://www.segye.com/newsView/20251031508319,세계일보
"KS 5차전 한화 문동주 vs LG 톨허스트, 5일만에 리턴매치",https://img.segye.com/content/image/2025/10/30/300/20251030523771.jpg,더 물러설 곳이 없는 한화가 31일 대전 한화생명볼파크에서 열리는 2025 프로야구 한국시리즈(KS·7전4승제) 5차전에 토종 파이어볼러 문동주(22)를 내세워 대반격에 시동을 건다. 이에 맞서 LG는 대체 외국인 선수 성공 사례를 만든 앤더스 톨허스트(26)로 1차전의 승리를 재연하겠다는 각오다. 문동주와 톨허스트의 닷새 만에 리턴매치다. 한화가 시리,2025-10-31 08:00:00,http://www.segye.com/newsView/20251030523772,세계일보
김경문 감독의 김서현에 대한 ‘선택적 믿음의 야구’…한화의 19년 만의 한국시리즈를 비극으로 끝낼 위기로 내몰고 있다,https://img.segye.com/content/image/2025/10/31/300/20251031500411.jpg,"이쯤이면 2008 베이징 올림픽 9전 전승의 우승 신화의 대위업도 다시 뒤집어 봐야하지 않나 싶을 정도다. ‘믿음의 야구’라고 쓰고 고집이라 읽어야 하지 않을까. 더 믿고 가야할 때는 믿지 않고, 믿음을 접어야 할때는 계속 믿었다가 낭패를 보는 게 이번이 처음이 아니다. 개인 통산 다섯 번째 한국시리즈마저 준우승 위기에 몰린 한화 김경문 감독에 대한 얘기다",2025-10-31 01:26:48,http://www.segye.com/newsView/20251031500400,세계일보
LG 9회 6득점 대역전극… KS 우승 한 걸음 남았다,https://img.segye.com/content/image/2025/10/30/300/20251030523802.jpg,가을야구를 한 편의 드라마라고 부르는 이유는 그 안에 엄청난 사연과 감정이 녹아들어가 있기 때문이다. 한화와 LG가 치르고 있는 2025 프로야구 한국시리즈(KS·7전4승제)도 많은 이야기를 만들어 내며 감동의 승부가 이어지고 있다. 지난 29일 열린 3차전에서는 한화가 8회에만 6점을 올리는 기적 같은 각본으로 7-3으로 승리해 대 역전극을 쓴 데 이어,2025-10-31 01:14:41,http://www.segye.com/newsView/20251030523590,세계일보
"'9회 대역전극' LG, 4차전서 한화 7-4 제압",https://img.segye.com/content/image/2025/10/30/300/20251030523321.jpg,"프로야구 LG 트윈스가 대역전극을 선보이며 한국시리즈(KS·7전4선승제) 4차전을 승리로 장식하고 우승을 눈앞에 뒀다. LG는 30일 대전 한화생명볼파크에서 벌어진 2025 신한 쏠뱅크 KBO 포스트시즌 KS 4차전 한화 이글스와의 원정 경기에서 7-4로 역전승을 거뒀다. 안방 잠실에서 열린 KS 1, 2차전에서 모두 이기며 기세를 끌어올린 LG는",2025-10-30 22:26:49,http://www.segye.com/newsView/20251030523320,세계일보
K리그1 득점왕 경쟁 ‘끝까지 간다’,https://img.segye.com/content/image/2025/10/30/300/20251030522209.jpg,"프로축구 K리그1의 우승은 전북 현대가 일찌감치 확정했지만, 득점왕 경쟁은 시즌 끝까지 펼쳐질 전망이다. 30일 현재 16골의 싸박(수원FC)이 K리그1 득점 랭킹 단독 선두에 올라있는 가운데, 이호재(포항 스틸러스)와 전진우(전북, 이상 15골)가 공동 2위, 주민규(대전 하나시티즌)가 14골로 4위, 콤파뇨(전북), 모따(FC안양), 이동경(울산 HD)",2025-10-30 23:19:42,http://www.segye.com/newsView/20251030518540,세계일보
"3년 차 웸반야마, 정상급 빅맨 ‘우뚝’",https://img.segye.com/content/image/2025/10/30/300/20251030521218.jpg,2023년 미국프로농구(NBA) 신인드래프트에서 가장 주목받은 선수는 2004년생 프랑스 출신의 빅터 웸반야마였다. 224㎝라는 장신에 양팔을 벌린 길이인 윙스팬은 244㎝나 되는 엄청난 신체조건을 가졌을 뿐 아니라 드리블과 외곽슛 능력도 겸비했다는 평가를 받았기 때문이다. 웸반야마는 당연히 전체 1순위로 샌안토니오 스퍼스에 지명됐고 2023∼2024,2025-10-30 20:31:19,http://www.segye.com/newsView/20251030518511,세계일보
토론토 신인의 ‘괴력투’… WS 정상까지 1승 남아,https://img.segye.com/content/image/2025/10/30/300/20251030521165.jpg,미국프로야구 메이저리그(MLB) 토론토 블루제이스의 투수 트레이 예새비지는 정규시즌 막바지인 지난 9월 빅리그에 데뷔한 신인이다. 이 겁 없는 신인이 토론토를 32년 만에 월드시리즈(WS·7전 4승제) 우승에 한발 앞까지 이끌고 갔다. 토론토는 30일 미국 캘리포니아주 로스앤젤레스(LA) 다저스타디움에서 열린 LA 다저스와 2025 WS 5차전에서 선,2025-10-30 23:19:54,http://www.segye.com/newsView/20251030518534,세계일보
오르다스 발로 만든 결승골… 시작은 해결사 ‘손’이었다,https://img.segye.com/content/image/2025/10/30/300/20251030521092.jpg,미국 메이저리그사커(MLS) 전체 연봉 2위다운 활약이었다. 로스앤젤레스(LA)FC의 ‘슈퍼스타’ 손흥민(사진)이 거의 풀타임을 소화하며 ‘가을 축구’의 첫 경기를 승리로 이끌었다. 손흥민은 30일 미국 캘리포니아주 LA의 BMO 스타디움에서 열린 오스틴FC와 2025 MLS컵 플레이오프(PO) 서부 콘퍼런스 1라운드(3전2승제) 1차전 홈 경기에 ‘흥,2025-10-30 23:21:31,http://www.segye.com/newsView/20251030518559,세계일보
