title,thumbnail,short_content,write_time,link,company
韓·日 전용 심사대 운영… 출입국 빨라진다,,"한국과 일본이 국교 정상화 60주년을 맞아 6월 한 달간 양국 국민 전용 입국심사대를 운영해 출입국 절차를 간소화한다. 21일 외교부와 법무부에 따르면 한국 김포공항과 김해공항, 일본 하네다공항과 후쿠오카공항에 각각 일본인과 한국인 대상 패스트트랙이 생긴다. 한 달간 시범운영하는 이 제도는 입국일 기준 최근 1년 안에 1회 이상 상대국을 방문한 적 있",2025-05-21 18:52:05,http://www.segye.com/newsView/20250521515734,세계일보
공약집은 안 내고… '말잔치 대선판',https://img.segye.com/content/image/2025/05/21/300/20250521516610.jpg,6·3 대선이 2주도 채 남지 않았지만 아직 각 당의 정책공약집이 유권자들의 손에 공개되지 않고 있다. 유권자와의 약속인 공약이 후보들의 말이나 소속 정당의 발표로만 채워지면서 제대로 된 검증은 멀어진 채 국민의 알 권리를 심대하게 침해하고 있다는 비판이 쏟아진다. 더불어민주당 조승래 선대위 공보단장은 21일 서울 여의도 당사에서 열린 기자회견에서 “,2025-05-21 18:31:05,http://www.segye.com/newsView/20250521515960,세계일보
"[속보] “내 정보가 어떻게 유출? 교사들 정치에 이용 말라”… 국힘, ‘김문수 묻지마 임명장’ 난발 '결국 사과'",https://img.segye.com/content/image/2025/05/21/300/20250521516668.jpg,국민의힘은 21일 김문수 대선 후보 명의의 중앙선거대책위원회 임명장이 최근 불특정 다수에게 발송된 것과 관련 “사전 동의 없이 문자가 발송된 데 대해 불편을 겪으신 모든 분께 진심으로 사과드린다”고 했다. 국민의힘 중앙선거대책위원회는 이날 사과문을 통해 “오늘 오전 ‘국민의힘 중앙선거대책위원회 조직총괄본부 시민소통본부 직책에 임명됐다’는 내용의 모바,2025-05-21 17:35:02,http://www.segye.com/newsView/20250521515801,세계일보
"간첩법, 대선 정국서 ‘정쟁 불쏘시개’ 될라… “법 개정에 도움 안 돼”",https://img.segye.com/content/image/2025/05/21/300/20250521516127.jpg,"6·3 대선을 앞두고 보수 진영 대선 주자들이 간첩법 개정 필요성을 거론하면서 이 법의 내용은 무엇이고, 왜 개정돼야 하는지가 재조명되고 있다. 22대 국회 들어 활발했던 국회의 간첩법 개정 논의는 12·3 비상계엄 사태 이후 사실상 중단된 상태다. 윤석열 전 대통령이 계엄 선포 사유 중 하나로 ‘더불어민주당의 간첩법 개정 반대’를 주장한 탓에 간첩법 개정",2025-05-21 17:12:31,http://www.segye.com/newsView/20250521515532,세계일보
"개보위원장 ""SKT 사태 역대급…이미 피해 어마어마해""",https://img.segye.com/content/image/2025/05/21/300/20250521516172.jpg,"고학수 개인정보보호위원회 위원장은 21일 ""SK텔레콤 (개인정보 유출 사고) 건은 저희가 보는 정황으로는 역대급 사건""이라며 ""경각심을 갖고 심각하게 사안을 들여다보고 있다""고 말했다. 고 위원장은 이날 서울 중구 은행회관에서 개인정보위와 한국CPO(개인정보보호책임자)협의회가 공동 주관한 개인정보 정책포럼에서 기자들과 만나 이같이 밝혔다. 그는 ""기본",2025-05-21 18:02:37,http://www.segye.com/newsView/20250521515344,세계일보
“이재명이 껏만 빼묵고” 공보물 배송…민형배 “고의인가 실수인가”,https://img.segye.com/content/image/2025/05/21/300/20250521515418.jpg,더불어민주당 민형배 의원은 21일 같은 당 이재명 대선 후보를 제외하고 다른 후보들만 포함된 선거 공보물이 광주 일부 지역에 배송됐다며 정확한 원인 규명을 촉구했다. 민 의원은 이날 자신의 사회관계망서비스(SNS)에 올린 글에서 “두 분이 팔을 잡아끌며 따지시더라”며 이같이 말했다. 이어 “꽤 서운하고 놀란 목소리로 이재명 후보 선거공보물이 없다는 사실,2025-05-21 16:47:22,http://www.segye.com/newsView/20250521514651,세계일보
"김용태 ""김건희 여사 문제 깊이 반성
대통령 주변인 감찰 개선할 것""",https://img.segye.com/content/image/2025/05/21/300/20250521515925.jpg,국민의힘 김용태 비상대책위원장이 윤석열 전 대통령 부인 김건희 여사를 둘러싼 논란을 두고 사과했다. 대통령 주변인에 대한 감찰제도를 개선하겠다고도 약속했다. 김 비대위원장은 21일 국회에서 기자회견을 열고 “국민의힘은 중단 없이 반성하는 보수로 거듭날 것”이라며 “계엄에 대한 사과와 윤 전 대통령 탈당에 이어 김 여사 문제에 대한 당의 진심 어린 반,2025-05-21 17:01:30,http://www.segye.com/newsView/20250521514638,세계일보
"김용태 ""김여사 행위에 국민 우려 못 헤아려…사과""",https://img.segye.com/content/image/2025/05/21/300/20250521514193.jpg,"국민의힘 김용태 비상대책위원장은 21일 ""국민의힘은 김건희 여사의 과거 행위에 대한 국민의 우려를 헤아리지 못한 점에 대해 국민 앞에 정중히 사과드린다""고 말했다. 김 위원장은 이날 국회에서 기자회견을 열어 ""국민의힘은 중단 없이 반성하는 보수로 거듭나겠다""며 이같이 밝혔다. 김 위원장은 ""국민의힘은 이 문제를 깊이 반성하며 근본적으로 변화하겠다는 다짐",2025-05-21 16:39:38,http://www.segye.com/newsView/20250521514159,세계일보
"[속보] 민주 “SPC ‘참담’… 김문수, ‘중대재해처벌법’이 악법인가”",https://img.segye.com/content/image/2025/05/21/300/20250521513683.jpg,더불어민주당 상임총괄선대위원장인 박찬대 원내대표는 21일 SPC삼립 시화공장에서 발생한 근로자 사망 사고를 두고 “정부는 이번 사고를 엄정하고 철저하게 조사하라”고 촉구했다. 박 원내대표는 이날 서울 여의도 중앙당사에서 열린 중앙선대위 회의에서 “너무나 참담한 마음”이라며 이같이 말했다. 박 원내대표는 “2022년에 발생한 사고 이후 SPC가 대,2025-05-21 16:42:30,http://www.segye.com/newsView/20250521513662,세계일보
尹 부정선거 영화 관람에 이재명·김문수 반응?,https://img.segye.com/content/image/2025/05/21/300/20250521513206.jpg,더불어민주당 이재명 대선 후보는 21일 윤석열 전 대통령이 부정선거 의혹을 주장하는 다큐멘터리 영화를 관람한 것과 관련해 “그 선거 시스템으로 본인이 선거에 이겼는데 부정선거라고 하면 어떻게 되는 것이냐”고 비판했다. 이 후보는 이날 오전 인천 미추홀구 문학경기장 동문 광장에서 기자들과 만나 “잘 이해가 안 된다”며 이같이 밝혔다. 이 후보는 국민의,2025-05-21 17:03:47,http://www.segye.com/newsView/20250521511409,세계일보
尹 ‘부정선거’ 영화관람 당내 불만 쇄도… 김문수는 “선관위 의혹 해명 노력해야”,https://img.segye.com/content/image/2025/05/21/300/20250521512439.jpg,국민의힘 김문수 대선 후보는 21일 윤석열 전 대통령이 부정 선거론을 주장하는 영화 시사회에 참석해 관람한 것과 관련해 “부정선거 의혹을 완전하게 일소할 수 있도록 최선을 다해서 노력하겠다”고 말했다. 김 후보는 이날 방송기자클럽 초청 토론회에서 ‘윤 전 대통령이 부정선거 다큐멘터리 영화를 보러 간 것이 선거에 도움이 될 것 같은가’라는 질문에 “어,2025-05-21 15:10:01,http://www.segye.com/newsView/20250521512394,세계일보
"이재명 “국힘, 윤석열과 여전히 일심동체“",https://img.segye.com/content/image/2025/05/21/300/20250521511080.jpg,"이재명 더불어민주당 대선 후보는 21일 윤석열 전 대통령이 부정선거를 다룬 영화 '부정선거, 신의 작품인가'를 전한길씨 등과 관람한 데 대해 “본인이 이긴 선거 시스템을 부정하는 것”이냐고 비판했다. 이 후보는 이날 인천 유세에 앞서 기자들과 만나 관련 질문에 “선거 시스템으로 본인이 이겼는데 부정선거라고 하면 어떻게 되는 것”이냐며 “잘 이해가 안",2025-05-21 14:52:49,http://www.segye.com/newsView/20250521511072,세계일보
김종인 “이재명 50%대 초반 득표로 승리…이준석 10%만 넘어도 성공”,https://img.segye.com/content/image/2025/05/21/300/20250521511038.jpg,국민의힘 김종인 전 비대위원장은 21대 대선에서 더불어민주당 이재명 대선 후보가 50%대 초반 득표율로 승리할 것으로 예상했다. 김 전 위원장은 20일 밤 CBS 라디오 ‘박재홍의 한판 승부’에서 21대 대선 결과 전망에 대해 “현재 여론조사 추세를 볼 때 이재명 후보가 승리할 것 같다”고 말했다. 득표율에 대해선 “(유시민 작가의 말처럼 이재명 후,2025-05-21 16:18:17,http://www.segye.com/newsView/20250521510975,세계일보
"이준석 측 “친윤, 들어와서 당 먹으라며 단일화 제안” 폭로",https://img.segye.com/content/image/2025/05/21/300/20250521510607.jpg,"개혁신당 이준석 대선 후보가 국민의힘으로부터 전방위적 단일화 러브콜을 받는 가운데 개혁신당 이동훈 수석대변인은 21일 “대부분 친윤(친윤석열)계 인사들이 전화를 많이 걸어온다”고 밝혔다. 이 수석대변인은 이날 자신의 사회관계망서비스(SNS)에 ‘단일화 러브콜?’이라는 제목의 글을 올려 이같이 말했다. 그는 “이분들은 ‘당권을 줄 테니 단일화를 하자’,",2025-05-21 14:06:21,http://www.segye.com/newsView/20250521510608,세계일보
“진짜 민주정부 완성 이재명과 함께 하겠다”… DJ·盧·文정부 등 원로들 李지지 선언,https://img.segye.com/content/image/2025/05/21/300/20250521510535.jpg,김대중·노무현·문재인 전 대통령 당시 활동한 민주 정부 원로들이 21일 이재명 더불어민주당 대선 후보를 지지한다고 밝혔다. 민주당 중앙선거대책위원회 민주정부계승위원회는 이날 오전 서울 여의도 민주당 서울시당 회의실에서 ‘진짜 대한민국 원탁회의’를 통해 “김대중·노무현·문재인 대통령으로 이어지는 세 민주정부의 정통성과 헌정 가치를 계승하고 윤석열 정권,2025-05-21 13:55:44,http://www.segye.com/newsView/20250521510543,세계일보
[파고다 강남 끝토익 RC김나래] PART 5,https://img.segye.com/content/image/2025/05/21/300/20250521517346.jpg,,2025-05-21 18:30:19,http://www.segye.com/newsView/20250521514064,세계일보
[시사일본어학원의 초단기 일본어 회화] 복층구조,https://img.segye.com/content/image/2025/05/21/300/20250521517347.jpg,,2025-05-21 18:30:08,http://www.segye.com/newsView/20250521514065,세계일보
[시사중국어학원의 리얼 중국어 회화] 모르는 게 약이다.,https://img.segye.com/content/image/2025/05/21/300/20250521517364.jpg,,2025-05-21 18:29:48,http://www.segye.com/newsView/20250521514067,세계일보
[22일의 날씨] 전국 곳곳 빗방울… 이른 더위 식혀줄까,https://img.segye.com/content/image/2025/05/21/300/20250521517459.jpg,,2025-05-21 18:29:22,http://www.segye.com/newsView/20250521516059,세계일보
"서울 올해 첫 30도 넘는 '초여름 더위'
목요일 비 오며 다소 주춤",https://img.segye.com/content/image/2025/05/21/300/20250521517038.jpg,목요일인 22일에는 한낮 기온이 예년 수준으로 내려가겠지만 더위가 아주 물러나진 않겠다. 21일 경기 양평군 옥천면은 기온이 한때 35.2도까지 오르는 등 한여름과 다름없었다. 충남 홍성은 기온이 30.7도까지 올랐는데 5월 기온으로는 역대 2번째로 높았다. 서울은 낮 최고기온이 평년기온보다 6.2도나 높은 30.8도를 기록했다. 서울 최고기온이,2025-05-21 18:04:49,http://www.segye.com/newsView/20250521516855,세계일보
성주 플라스틱 재생 공장서 불… 한때 재난문자 발송,https://img.segye.com/content/image/2025/05/21/300/20250521516991.jpg,경북 성주의 플라스틱 재생 공장에서 원인을 알 수 없는 불이 났다. 21일 경북소방본부에 따르면 이날 낮 12시12분쯤 성주군 월항면 플라스틱 재생 공장에서 화재가 발생했다는 신고가 접수됐다. 소방 당국은 현장에 장비 17대와 인력 38명을 투입해 오후 4시7분쯤 불길을 진화했다. 다행히 인명피해는 없었다. 다만 공장 1개 동(981.8㎡)이 전부,2025-05-21 17:54:32,http://www.segye.com/newsView/20250521516783,세계일보
‘122만명 투약 가능’ 코카인 유통하려한 일당에 중형,https://img.segye.com/content/image/2025/05/21/300/20250521516968.jpg,"국내 코카인 범죄 사상 최대인 소매가로 300억원어치, 122만명이 동시 투약할 수 있는 마약을 유통하려 한 일당에게 중형이 선고됐다. 21일 법조계에 따르면 인천지법 형사15부는 최근 특정범죄가중처벌법상 마약 등 혐의로 기소된 국내 제조 총책 A(34)씨와 판매 총책인 캐나다 국적 B(56)씨에게 각각 징역 25년, 징역 20년을 선고했다. A씨 등은",2025-05-21 17:54:01,http://www.segye.com/newsView/20250521516447,세계일보
“사는 게 너무 힘들어서” 지적장애 아들 살해한 친모 ‘징역 4년’,https://img.segye.com/content/image/2025/05/21/300/20250521515938.jpg,극심한 생활고와 돌봄 부담에 시달리던 40대 어머니가 지적장애를 가진 아들을 살해한 사건에 대해 법원이 징역형을 선고했다. 보호자의 손에 소중한 생명을 잃은 아동의 안타까운 죽음은 복지 사각지대에 방치된 가족 돌봄 현실을 되짚게 한다. 전주지법 제11형사부(부장판사 김상곤)는 21일 살인 혐의로 구속 기소된 A(48)씨에게 징역 4년을 선고했다. A,2025-05-21 17:03:55,http://www.segye.com/newsView/20250521515672,세계일보
“배달 라이더 시급 7864원…도급 근로자도 최저임금 보장해야”,https://img.segye.com/content/image/2025/05/21/300/20250521515343.jpg,"배달라이더의 평균 시급이 7864원으로 최저임금에 미달한다는 분석이 나왔다. 노동계는 라이더를 포함해 계약당 급여나 건당 수수료를 받는 도급 근로자도 최저임금을 적용받아야 한다고 주장했다. 양대노총과 더불어민주당 김주영, 이수진, 박홍배, 박해철 의원 등은 21일 서울 여의도 국회에서 ‘2026년 적용 최저임금 개선 과제’ 토론회를 개최했다. 이 자리에서",2025-05-21 16:44:34,http://www.segye.com/newsView/20250521515123,세계일보
가정위탁의 날 맞아 위탁부모 18명 표창 수여,https://img.segye.com/content/image/2025/05/21/300/20250521514744.jpg,정부가 제22회 가정위탁의 날(22일)을 하루 앞둔 21일 가정위탁 제도 활성화에 기여한 위탁부모 18명 등에게 표창을 수여했다. 가정위탁 제도는 원가정에서 아동을 양육할 수 없게 돼 보호가 필요한 아동이 발생했을 때 일정기간 위탁가정에서 아동이 보호받고 성장할 수 있도록 지원하는 제도다. 보건복지부은 이날 아동권리보장원과 함께 강원 쏠비치 양양에,2025-05-21 16:36:55,http://www.segye.com/newsView/20250521514746,세계일보
집중호우 대비 서초구 '안전 한국 및 긴급구조 종합 훈련' [한강로 사진관],https://img.segye.com/content/image/2025/05/21/300/20250521514739.jpg,"21일 서울 서초구 양재천·여의천 합수부에서 서초구와 서초소방서 주관 풍수해 대비 '2025 재난대응 안전한국 및 긴급구조 종합훈련'에서 구조대원들이 구조훈련을 했다. 주요 훈련 내용은 드론 활용해 익수자에게 구조튜브 전달하는 하는 구조 훈련, 구조보트, 구명환 등을 활용 익수자 구조, 침수차 내 고립된 익수자 구조, 교량 붕괴로 차량에 매몰된 요구조자",2025-05-21 16:28:57,http://www.segye.com/newsView/20250521514553,세계일보
"경찰, SKT 유심 해킹 늑장 대처 의혹 수사 본격화... 고발인 소환",https://img.segye.com/content/image/2025/05/21/300/20250521514339.jpg,경찰이 SK텔레콤(SKT)의 유심 해킹 사태 늑장 대처 의혹과 관련해 본격적인 수사에 착수했다. 서울 남대문경찰서는 21일 유영상 SKT 대표이사와 보안 책임자를 업무상 배임과 위계공무집행방해 등의 혐의로 고발한 법무법인 대륜 측 손계준·천정민 변호사를 소환해 고발 경위 등을 조사했다. 손 변호사는 조사에 앞서 경찰서 정문에서 기자회견을 열고 “SKT,2025-05-21 16:15:35,http://www.segye.com/newsView/20250521514282,세계일보
"시흥 살인 차철남 ""다친 피해자들 살해 의도 없었다""",https://img.segye.com/content/image/2025/05/21/300/20250521514284.jpg,"경기 시흥에서 2명을 살해하고 2명을 다치게 한 뒤 도주했다가 체포된 중국동포 차철남이 21일 다친 피해자들에 대해서는 살해 의도가 없었다는 입장을 밝혔다. 차철남은 구속 전 피의자 심문(영장실질심사)에 출석하기 위해 이날 오전 9시 30분께 시흥경찰서를 나서며 ""편의점주와 집주인에 대한 살해 의도가 있었느냐""는 취재진 질문에 ""없었습니다""라고 답했다",2025-05-21 16:11:22,http://www.segye.com/newsView/20250521508327,세계일보
서대문구서 버스 전신주 추돌 사고…11명 경상·일대 정전,https://img.segye.com/content/image/2025/05/21/300/20250521513964.jpg,서울 서대문구 홍은동에서 버스가 전신주를 들이받는 사고가 발생해 11명이 다치고 인근 지역 127가구가 정전되는 피해가 발생했다. 사고 지역 일대에서는 한국전력공사의 복구 작업이 진행 중이다. 서대문소방서에 따르면 21일 오후 2시7분 서울 서대문구 홍은동 홍은초등학교 인근 내리막길에서 상조회사 버스가 전신주와 버스정류장을 잇따라 들이받는 사고가 발생했,2025-05-21 16:09:21,http://www.segye.com/newsView/20250521513816,세계일보
갑자기 찾아온 여름,https://img.segye.com/content/image/2025/05/21/300/20250521513408.jpg,서울 최고온도 32도로 무더운 날씨를 보인 21일 서울 여의대로에 아지랑이가 피어오르고 있다. 21일은 24절기 중 여덟번째 절기인 소만(小滿)으로 태양이 황경 60도를 통과할 때를 말한다. 여름 기운이 돌기 시작한다고 알려진 소만(小滿)은 입하(立夏)와 망종(芒種) 사이에 들어 햇볕이 풍부하고 만물이 점차 생장하여 가득 찬다는 의미가 있다. 고온,2025-05-21 15:44:07,http://www.segye.com/newsView/20250521513410,세계일보
[재미로 보는 오늘의 운세] 5월 22일 (목요일) 띠별 운세,https://img.segye.com/content/image/2025/05/21/300/20250521517235.jpg,쥐 96년생 경계심을 버리고 현실을 인정하면 시원하게 뚫린다 84년생 품을 것과 버릴 것 확실히 구분할 것. 72년생 항상 욕심이 화를 부르는 법이니 양보하라. 60년생 경험하지 못한 일이 일어나지만 득실을 따지기엔 무리. 48년생 고개를 숙이는 것은 어렵지만 어쩔 수 없다. 36년생 굳어 있는 마음을 풀지 못하면 불편하다. 소 97년생 분위기에 휩쓸,2025-05-21 18:30:52,http://www.segye.com/newsView/20250521514063,세계일보
[22일의 날씨] 전국 곳곳 빗방울… 이른 더위 식혀줄까,https://img.segye.com/content/image/2025/05/21/300/20250521517459.jpg,,2025-05-21 18:29:22,http://www.segye.com/newsView/20250521516059,세계일보
환자 무릎 특성 반영한 ‘맞춤형’ 로봇 인공관절 수술… “회복과 만족도 높다”,https://img.segye.com/content/image/2025/05/21/300/20250521516092.jpg,무릎 인공관절 수술 시 환자의 무릎 특성을 반영해 자연스러운 움직임이 가능한 로봇 인공관절 수술이 환자 만족도와 기능 회복에 더 낫다는 연구결과가 나왔다. 한림대강남성심병원 정형외과 김중일 교수팀은 ‘경골 후방경사각’이라는 개인별 무릎 특성을 재현한 후방십자인대 보존형 로봇인공관절수술이 환자 100명을 대상으로 수술 후 임상 결과를 1년간 추적 관찰한,2025-05-21 17:47:14,http://www.segye.com/newsView/20250521516093,세계일보
"서울아산병원 황성욱 교수, 장초음파 국제인증 2종 국내 첫 획득",https://img.segye.com/content/image/2025/05/21/300/20250521516588.JPG,"염증성장질환은 위장관에 만성적으로 염증이 생기는 질환으로, 염증 정도를 정확히 모니터링해 조기에 치료하는 게 중요하다. 적극적인 모니터링을 위해 해외에서는 장초음파 검사가 널리 시행되고 있는데, 최근 국내 의료진이 장초음파 국제인증 2종을 처음 획득했다. 서울아산병원은 황성욱 서울아산병원 염증성장질환센터 교수(소화기내과)가 국내 염증성장질환 의료진 최초",2025-05-21 17:32:25,http://www.segye.com/newsView/20250521516626,세계일보
"이혁준 서울대병원 교수, 국제위암학회 차차기 회장 선출",https://img.segye.com/content/image/2025/05/21/300/20250521516494.jpg,"이혁준 서울대병원 위장관외과 교수가 지난 7일 개최된 국제위암학회 제16회 학술대회(IGCC 2025)에서 차차기 회장으로 선출됐다. 임기는 2029년 6월부터 2년이다. 국제위암학회는 1995년 설립된 위암 분야 세계 최고의 학술단체다. 한국을 포함해 일본, 중국, 유럽, 미국 등 전 세계 의료진이 참여하고 있는 학회는 위암의 예방, 진단 및 치료 발",2025-05-21 17:25:37,http://www.segye.com/newsView/20250521516519,세계일보
"연세의료원, ‘The Great Future 위대한 미래를 여는 밤’ 개최",https://img.segye.com/content/image/2025/05/21/300/20250521516365.jpg,"연세의료원은 20일 저녁 6시 서울 중구 반얀트리 호텔에서 진료·교육·연구 발전을 위한 모금캠페인 중간보고회 및 미래발전위원 추가 위촉식 ‘The Great Future 위대한 미래를 여는 밤’을 개최했다. 이날 행사는 그간 연세의료원이 펼쳐온 모금캠페인 성과를 공유하고 기부 활성화 등을 논의하는 자리로 허동수 연세대 이사장, 이경률 연세대 총동문회장,",2025-05-21 17:18:32,http://www.segye.com/newsView/20250521516377,세계일보
"동국제약, ‘제28회 국립공원 산행안전 캠페인’ 진행",https://img.segye.com/content/image/2025/05/21/300/20250521515952.jpg,"동국제약(대표이사 송준호)은 17일 서울 도봉산 등산로 입구에서 ‘제28회 국립공원 산행안전 캠페인’을 진행했다. 이날 캠페인에는 국립공원공단과 동국제약 임직원이 함께 참여해, 산행안전수칙과 구급함 위치가 표시된 지도를 배포하며 탐방객들의 안전한 산행을 독려했다. 동국제약은 2009년 국립공원공단과 ‘안전한 산악문화 정착을 위한 협약’을 체결한 이래 매",2025-05-21 17:04:13,http://www.segye.com/newsView/20250521516011,세계일보
"“팔면 끝, 고갱님이 알아서 하셔야죠~” 여전한 중고차 업계",https://img.segye.com/content/image/2025/05/21/300/20250521515681.jpg,"대기업의 중고차 시장 진출이 이어지는 가운데 일부 부도덕한 업체의 ‘팔면 끝’ 배짱 장사가 여전한 것으로 나타났다. 대표적인 사례가 고장 난 차를 수리없이 소비자에게 팔고 대금을 받아 챙기는 수법이다. 또 문제 발생 시 환불을 약속해 놓고 이를 지키지 않거나, 탁송료 등의 명목으로 높은 수수료를 제하고 환불하는 이른바 ‘수수료 장사’도 최근 성행하고 있",2025-05-21 17:00:32,http://www.segye.com/newsView/20250521515640,세계일보
426년째 모임 이어온 조선 후기 붕당 소북(小北)의 후예들,https://img.segye.com/content/image/2025/05/21/300/20250521512172.jpg,"조선 후기 사림을 둘로 나눈 동인과 서인. 동인은 다시 남인과 북인으로 분화되었다. 이후 북인은 대북과 소북으로 나뉘었으며, 그 가운데 소북의 후손들이 오늘날까지도 학문과 도덕을 중시하는 전통을 이어오고 있다. 이들 소북동일회가 국립중앙도서관과 공동으로 학술대회를 개최한다. 22일 오후 1시 국립중앙도서관 디지털도서관 대회의실에서 열리는 “‘소북동일회(",2025-05-21 14:57:01,http://www.segye.com/newsView/20250521512086,세계일보
“염증 40% 줄었다”…매일 마시는 ‘이것’의 놀라운 효능,https://img.segye.com/content/image/2025/05/21/300/20250521510509.jpg,"매일 아침과 저녁, 작은 컵 두 잔 분량의 체리주스를 꾸준히 마시면 장 내 염증 수치를 줄일 수 있다는 연구 결과가 나왔다. 영국 허트퍼드셔 대학교와 센트럴랭커셔 대학교 공동 연구팀은 타트 체리주스의 항염 효과를 분석한 연구를 국제학술지 라이프(Life)에 발표했다. 연구는 만성 염증성 장질환 중 하나인 ‘궤양성 대장염(UC)’을 앓고 있는 성인 환자를",2025-05-21 14:00:00,http://www.segye.com/newsView/20250520506272,세계일보
