title,thumbnail,short_content,write_time,link,company
"이란, 최고지도자 하메네이 테헤란의 집무실서 사망…공식 확인",https://img.segye.com/content/image/2026/03/01/300/20260301505481.jpg,"이란 정부가 1일(현지시간) 최고지도자 아야톨라 세예드 알리 하메네이(86)의 사망을 공식 확인했다. 현지 언론들은 그가 테헤란의 집무실에서 사망했다고 전했다. 이란 정부는 이날 아야톨라 하메네이의 사망을 발표하면서 40일간 전국민적 추도 기간과 일주일간의 공휴일을 선포했다. 이란 국영방송 프레스TV와 국영통신 IRNA도 이날 “이슬람혁명의 지도자 아야톨라 세예드 알리 하메네이가 미국과 이스라엘의 이란에 대한 공격으로 순교했다”고 보도했다. 하메네이가 사망한 정확한 시점은 알려지지 않았으나 전날 미국과 이스라엘의 폭격으로 사망한 것으로 추정된다. 앞서 도널드 트럼프 미국 대통령은 이날 오후 4시40분(미 동부시간) 소셜미디어(SNS) 트루스소셜에 글을 올려 “역사상 가장 사악한 사람 중 한 명인 하메네이가 사망했다”고 발표했다. 이날 오전 1시 15분, 이란 시간으로 오전 9시 45분 미국과 이스라엘이 이란에 대한 공격을 개시한 지 15시간여만이다. 미국 매체들은 하메네이가 주로 거주하는 테헤란 북부 보안구역이 폭격으로 파괴된 위성사진을 공개했다. 이란 현지 언론은 “순교하는 순간 아야톨라 하메네이는 집무실을 지키며 자신에게 주어진 임무를 수행 중이었다”며 “비겁한 그 공격이 토요일(2월28일) 오전에 일어났다”고 보도했다. 그러면서 “시온주의 정권(이스라엘)과 유착한 매체들은 그가 암살이 두려워 비밀 장소에 있다고 반복적으로 주장했다”며 “집무실에서의 순교는 적들의 심리전이 날조라는 사실을 또다시 입증한 동시에 그가 항상 국민 속에, 책임과 불굴의 용기로 오만한 세력(서방)에 맞서는 최전선에 서 있다는 점을 방증했다”고 덧붙였다. 한편 트럼프 대통령은 하메네이 사망과 관련 “이는 이란 국민뿐만 아니라 모든 위대한 미국인들, 하메네이와 그의 피에 굶주린 깡패 무리에게 살해되거나 불구가 된 전 세계 많은 나라 사람들을 위한 정의”라고 강조했다. 또 “그는 우리의 정보 역량과 고도로 정교한 추적 시스템을 피할 수 없었다”며 “이스라엘과 긴밀히 협력한 가운데, 그(하메네이)나 그와 함께 사살된 다른 지도자들이 할 수 있는 건 없었다”고 말했다. 트럼프 대통령은 하메네이의 사망이 “이란 국민이 그들의 나라를 되찾을 수 있는 단 한 번의 위대한 기회”라며 “이슬람혁명수비대(IRGC), 군, 그리고 보안·경찰의 많은 이들이 더 이상 싸우기를 원하지 않으며, 우리로부터 면책을 구하고 있다고 듣고 있다”고 말했다. 그는 “지금은 면책받을 수 있지만, 나중에는 죽음만 얻게 될 것”이라고 경고했다. 이란 군경의 투항을 촉구한 것으로 풀이된다. 트럼프 대통령은 “혁명수비대와 경찰은 이란의 애국자들과 평화롭게 합류해 함께 일하며 그 나라를 마땅히 누려야 할 위대함으로 되돌리기를 바란다”며 “그 과정은 곧 시작돼야 한다”고 말했다.",2026-03-01 11:24:12,https://www.segye.com/newsView/20260301505485,세계일보
"이란, 최고지도자 하메네이 사망 공식 확인…40일간 추도기간",https://img.segye.com/content/image/2026/03/01/300/20260301505305.jpg,"이란 정부가 1일(현지시간) 최고지도자 아야톨라 세예드 하메네이(86)의 사망을 공식 확인했다. 이란 정부는 이날 아야톨라 하메네이의 사망을 발표하면서 40일간 전국민적 추도 기간과 일주일간의 공휴일을 선포했다. 이란 국영방송 프레스TV와 국영통신 IRNA도 이날 ""이슬람혁명의 지도자 아야톨라 세예드 알리 하메네이가 미국과 이스라엘의 이란에 대한 공격으로 순교했다""고 보도했다. 이란 국영방송 앵커는 흐느끼며 아야톨라 하메네이의 사망 소식을 전했다. 그가 사망한 정확한 시점은 알려지지 않았으나 전날 미국과 이스라엘의 폭격으로 사망한 것으로 보인다. 미국 매체들은 아야톨라 하메네이가 주로 거주하는 테헤란 북부 보안구역이 폭격으로 파괴된 위성사진을 공개했다. 현지 언론들은 그가 테헤란의 집무실에서 사망했다고 전했다. 메흐르통신은 ""순교하는 순간 아야톨라 하메네이는 집무실을 지키며 자신에게 주어진 임무를 수행 중이었다""며 ""비겁한 그 공격이 토요일(2월28일) 오전에 일어났다""고 보도했다. 이어 ""시온주의 정권(이스라엘)과 유착한 매체들은 그가 암살이 두려워 비밀 장소에 있다고 반복적으로 주장했다""며 ""집무실에서의 순교는 적들의 심리전이 날조라는 사실을 또다시 입증한 동시에 그가 항상 국민 속에, 책임과 불굴의 용기로 오만한 세력(서방)에 맞서는 최전선에 서 있다는 점을 방증했다""고 덧붙였다.",2026-03-01 11:08:27,https://www.segye.com/newsView/20260301505270,세계일보
"“자산운용 특화 금융허브로”… 신한금융그룹, 전주서 출범식",https://img.segye.com/content/image/2026/02/24/300/20260224513865.jpg,"신한금융그룹이 전북도와 전북혁신도시를 자산운용 특화 금융 중심지로 육성하기 위한 행보에 나섰다. 신한금융그룹은 24일 전주 만성동에서 ‘전북 금융허브 출범식과 신한펀드파트너스 전주본부 개소식’을 동시에 열었다. 이 자리에는 진옥동 신한금융그룹 회장과 김종훈 전북도 경제부지사, 김성주 국민연금공단 이사장, 우범기 전주시장 등이 참석했다. 신한금융그룹은",2026-02-24 16:00:21,http://www.segye.com/newsView/20260224513866,세계일보
"검찰, ‘주가조작 공모 혐의’ 대신증권 본사 압수수색… 전직 부장 강제수사",https://img.segye.com/content/image/2026/02/24/300/20260224513785.jpg,검찰이 증권사 간부가 시세조종 세력과 공모해 코스닥 상장사 주가를 조작한 혐의를 포착하고 강제수사에 나섰다. 서울남부지검 금융·증권범죄합동수사부는 24일 오전부터 서울 중구 대신증권 본사 등에 대한 압수수색을 진행하고 있다. 이번 수사는 대신증권 경기도 소재 지점에서 근무했던 부장급 직원 A씨의 비위 혐의를 중심으로 이루어지고 있다. A씨는 지난해,2026-02-24 16:00:08,http://www.segye.com/newsView/20260224512632,세계일보
"비트코인 6만3천달러 아래로…""올해 들어 27% 하락""",https://img.segye.com/content/image/2026/02/24/300/20260224513783.jpg,"비트코인 가격이 6만3천달러 아래로 내려왔다. 미국 경제 매체 CNBC는 관세 문제가 다시 불거지고 지정학적 긴장이 고조된 가운데 24일(현지시간) 비트코인 가격이 5% 넘게 급락해 개당 6만2천964.64달러까지 밀렸다고 보도했다. 자산운용사 인베스코의 크리스토퍼 해밀턴은 ""이번 하락은 암호화폐 고유의 충격이라기보다는 전형적인 위험 심리 재설정",2026-02-24 15:59:26,http://www.segye.com/newsView/20260224513781,세계일보
"한국장애인재활협회, 제25대 회장에 나운환 대구대 명예교수 선출",https://img.segye.com/content/image/2026/02/24/300/20260224512544.jpg,"(사)한국장애인재활협회는 지난 2월 12일 대의원총회를 통해 제1대 백낙준(전 연세대 총장), 제5대 박두병(전 서울상공회의소 회장), 제7대 임병직(제1대 유엔대사), 제14대 조일묵(전 대한적십자 사무총장), 제21대 이상철(전 KT 사장), 제24대 김인규(전 KBS 사장)에 이어 제25대 신임 회장으로 나운환 대구대 명예교수를 선출했다. 나운환",2026-02-24 15:17:50,http://www.segye.com/newsView/20260224512563,세계일보
청년 부진에 특별·광역시 고용률 또 하락…쉬었음 등 역대 최대,https://img.segye.com/content/image/2026/02/24/300/20260224512493.jpg,"청년층 고용 부진 영향으로 작년 하반기 7개 특별·광역시 고용률이 상반기에 이어 또 하락했다. 일도, 구직 활동도 하지 않는 '쉬었음' 인구가 포함된 기타 비경제활동인구는 역대 가장 많았다. 국가데이터처가 24일 발표한 '2025년 하반기 지역별고용조사 시군구 주요고용지표'에 따르면, 특별·광역시 구(區) 단위 취업자 수는 1천158만9천명으로 전년",2026-02-24 15:14:29,http://www.segye.com/newsView/20260224508522,세계일보
"‘사조그룹’ 편입 푸디스트, 매출 1조 돌파…‘역대급’ 실적",https://img.segye.com/content/image/2026/02/24/300/20260224511707.jpg,"B2B(기업간 거래) 식자재 전문기업 푸디스트가 창사 이래 최대 매출과 영업이익을 달성했다고 24일 밝혔다. 지난해 사조그룹에 편입한 푸디스트는 그룹 내 핵심 계열사로 자리매김, 외형 성장과 내실 경영을 동시에 실현하며 사업 체질 개선 성과를 가시화했다. 이날 푸디스트에 따르면 지난해 매출액은 전년보다 7.1% 성장한 1조766억원으로 사상 최대",2026-02-24 14:47:15,http://www.segye.com/newsView/20260224511711,세계일보
"카스, 대한체육회와 함께 ‘비욘드 메달 어워즈’로 비인기 종목 선수 후원",https://img.segye.com/content/image/2026/02/24/300/20260224511438.jpg,"2026 밀라노-코르티나 동계올림픽 공식 파트너 카스가 대한체육회와 함께 ‘카스 비욘드 메달 어워즈’를 통해 대한민국 스포츠 발전 및 비인기 종목 지원을 이어간다고 24일 밝혔다. 어워즈는 카스와 대한체육회가 공동 기획했다. 메달 유무와 관계없이 탁월함(Excellence), 존중(Respect), 우정(Friendship) 세 분야에서 올림픽 정신을",2026-02-24 14:49:58,http://www.segye.com/newsView/20260224511439,세계일보
"노스페이스, 글로벌 트레일러닝 ‘2026 TNF 100 코리아’ 참가자 모집",https://img.segye.com/content/image/2026/02/24/300/20260224511500.jpg,영원아웃도어가 전개하는 노스페이스가 5월 16~17일 이틀간 강원도 강릉 및 평창 일대에서 개최하는 글로벌 트레일러닝 대회 ‘2026 TNF 100 코리아 위드 벡티브’(TNF 100 코리아)의 참가자를 27일부터 선착순 모집한다고 24일 밝혔다. TNF 100은 노스페이스의 브랜드 슬로건인 '멈추지 않는 탐험'을 상징하는 대표적 이벤트 중 하나이자 중,2026-02-24 14:40:55,http://www.segye.com/newsView/20260224511489,세계일보
"코스피, 연일 최고치 랠리…공포지수도 엿새째 상승",https://img.segye.com/content/image/2026/02/24/300/20260224511198.jpg,"코스피가 연일 최고치 랠리를 이어가며 '육천피'(코스피 6,000) 돌파를 목전에 둔 가운데 '공포지수'도 꾸준히 상승 중이다. 24일 한국거래소에 따르면 한국형 공포지수로 불리는 '코스피200 변동성지수(VKOSPI)'는 이날 오후 2시 15분 기준 전장보다 1.69포인트(3.65%) 뛴 48.03을 나타내고 있다. 장중에는 한때 48.30까지 치솟",2026-02-24 14:29:59,http://www.segye.com/newsView/20260224511139,세계일보
"KT, ‘MWC26’서 상생협력관 운영…중소벤처기업 해외 진출 지원",https://img.segye.com/content/image/2026/02/24/300/20260224510483.jpg,KT는 다음달 2~5일 스페인 바르셀로나에서 열리는 세계 최대 통신기술 전시회 ‘모바일월드콩그레스(MWC) 26’에서 상생협력관 운영으로 국내 중소벤처기업의 해외 진출을 지원한다고 24일 밝혔다. 상생협력관은 MWC가 열리는 피라 그란비아(Fira Granvia) 스타트업 전문 전시관인 4YFN(4 Years From Now) 특별관 8.1홀의 단독,2026-02-24 14:06:22,http://www.segye.com/newsView/20260224510528,세계일보
손흥민의 차 제네시스 GV80 쿠페…LA서 직접 운전하는 모습 포착돼,https://img.segye.com/content/image/2026/02/24/300/20260224510229.jpg,미국 메이저리그사커(MLS) LA FC에서 뛰고 있는 손흥민이 제네시스 GV80 쿠페를 직접 운전하는 모습이 포착돼 화제다. 24일 현대자동차에 따르면 GV80 쿠페는 GV80을 쿠페 스타일로 재해석한 모델이다. 국내 판매 가격은 8000만원대부터 시작해 풀옵션 사양은 1억원을 넘는다. 손흥민은 지난 22일 LA 현지에서 GV80 쿠페를 운행하다 팬,2026-02-24 13:58:54,http://www.segye.com/newsView/20260224510207,세계일보
"폭스바겐, 안드레아스 민트 신임 그룹 디자인 총괄 임명",https://img.segye.com/content/image/2026/02/24/300/20260224509883.jpg,폭스바겐 브랜드 디자인 총괄인 안드레아스 민트(Andreas Mindt)가 오는 2026년 3월 1일부로 폭스바겐그룹 디자인 총괄직을 추가로 맡게 된다. 24일 폭스바겐그룹에 따르면 안드레아스 민트는 세대교체 과정의 일환으로 원만한 합의 하에 회사를 떠나는 미하엘 마우어(Michael Mauer)의 뒤를 잇는다. 올리버 블루메(Oliver Blume,2026-02-24 13:41:16,http://www.segye.com/newsView/20260224509889,세계일보
'5월9일 다주택 양도 중과' 시행령 개정안 국무회의 의결,https://img.segye.com/content/image/2026/02/24/300/20260224509825.jpg,5월 9일부터 재시행되는 '다주택자 양도소득세 중과' 조치가 담긴 시행령 개정안이 국무회의를 통과했다. 지난달 발표한 개정 세법 관련 시행령 개정안도 일부 수정돼 의결됐다. 정부는 24일 국무회의를 열고 이러한 내용이 담긴 세법 관련 시행령 개정안을 의결했다고 재정경제부가 밝혔다. 이날 의결된 소득세법 시행령 등에 따르면 다주택자가 보유한 조정대,2026-02-24 13:37:44,http://www.segye.com/newsView/20260224509732,세계일보
"SK하이닉스, ‘100만닉스’ 달성… ‘황제주’ 반열에",https://img.segye.com/content/image/2026/02/24/300/20260224508318.jpg,"SK하이닉스가 ‘100만닉스’를 달성하며 ‘황제주’ 반열에 올랐다. 24일 한국거래소에 따르면 SK하이닉스 주가는 이날 오전 11시13분쯤 100만원을 터치하며 역대 최고가를 경신했다. 이후 소폭 하락했지만, 99만원대 후반을 유지하며 100만원 고지를 재차 노리고 있다. SK하이닉스는 이날 전 거래일 대비 1000원 상승한 95만2000원에 거래를",2026-02-24 11:47:50,http://www.segye.com/newsView/20260224508249,세계일보
"“운동 뒤 한컵 딱”…풀무원다논 요프로, 출시 2개월 만에 100만개 판매 돌파",https://img.segye.com/content/image/2026/02/24/300/20260224503580.jpg,"풀무원다논은 프리미엄 고함량 프로틴 요거트 브랜드 ‘요프로(YoPRO)’가 지난해 12월 출시 후 2개월여 만에 누적 판매 100만개를 돌파했다고 24일 밝혔다. 요프로는 100년 발효기술을 가진 세계 판매 1위 기업 다논의 프리미엄 고함량 프로틴 요거트 브랜드로, 지난 12월 초 한국 소비자의 식습관과 건강 관리 트렌드를 반영해 영양 설계를 최적화해",2026-02-24 11:25:00,http://www.segye.com/newsView/20260224503336,세계일보
