title,thumbnail,short_content,write_time,link,company
"독일 수입차 부품회사 마일레, ‘HD부품’ 앞세워 수입차 정비 전문 브랜드 론칭",https://img.segye.com/content/image/2025/05/21/300/20250521510215.jpg,독일 프리미엄 자동차 부품 유통기업인 마일레(MEYLE)가 수입차 부품의 한국 유통을 시작한다고 21일 밝혔다. 마일레는 국내에서 ‘마일레 오토 서비스’라는 프리미엄 수입차 정비 전문 브랜드를 론칭하고 현재 전국 61개의 서비스센터를 통해 국내 수입차 고객들에게 차량 관리 및 정비 서비스를 제공하고 있다. 마일레는 독일 함부르크에 소재한 프리미엄 글,2025-05-21 13:39:01,http://www.segye.com/newsView/20250521510242,세계일보
"타타대우모빌리티, 협력사와의 지속가능한 동반성장 다짐",https://img.segye.com/content/image/2025/05/21/300/20250521509966.jpg,"타타대우모빌리티(사장 김태성)가 협력사와의 상생 협력을 강화하기 위해 ‘2025 협진회 정기총회 및 벤더 컨퍼런스’를 개최했다고 21일 밝혔다. 이번 컨퍼런스는 지난 19일, 20일 양일간 강원도 강릉에 위치한 라카이 샌드파인 리조트에서 타타대우모빌리티 김태성 사장을 비롯한 주요 관계자들과 전국 87개 협력사 대표들이 참석한 가운데 진행됐다. 타타대우모",2025-05-21 13:29:20,http://www.segye.com/newsView/20250521509977,세계일보
"벤츠 한성자동차, ‘2024 벤츠 딜러 어워드’서 6개 부문 1위 석권",https://img.segye.com/content/image/2025/05/21/300/20250521509923.jpg,"메르세데스-벤츠 공식 딜러 한성자동차(대표 김마르코)는 지난 15일 개최된 ‘2024 메르세데스-벤츠 코리아 딜러 어워드’에서 테크니션 팀을 포함한 6개 부문에서 1위를 차지하며 브랜드 경쟁력을 다시 한번 입증했다고 21일 밝혔다. 메르세데스-벤츠 코리아 딜러 어워드는 한 해 동안 우수한 성과를 거둔 공식 딜러사와 임직원을 격려하는 자리로, 올해는 반얀",2025-05-21 13:24:55,http://www.segye.com/newsView/20250521509931,세계일보
"현대차 그랜저, 연식 변경…고객 선호사양 담은 ‘아너스’ 트림 신규 출식",https://img.segye.com/content/image/2025/05/21/300/20250521509816.jpg,"주요 선호사양 적용한 스페셜 트림 '아너스(Honors)' 출시로 고객 선택 폭 확대 현대자동차가 대한민국을 대표하는 고품격 세단, 그랜저의 연식 변경 모델 ‘2026 그랜저’를 21일(수) 출시한다고 밝혔다. 2026 그랜저는 기존 모델의 주요 선호사양을 대폭 적용한 스페셜 트림 ‘아너스(Honors)’를 새롭게 마련해 고객 선택의 폭을 확대한다.",2025-05-21 13:19:01,http://www.segye.com/newsView/20250521509825,세계일보
‘경기도 다낭시’ 롯데렌터카 베트남서 ‘공항·호텔 픽업’ 할인 이벤트…최대 30%,https://img.segye.com/content/image/2025/05/21/300/20250521507330.jpg,롯데렌탈(대표이사 사장 최진환)의 대한민국 No.1 렌터카 브랜드 롯데렌터카가 베트남 공항과 숙소 간 편리한 이동을 지원하는 ‘안심픽업 서비스’ 할인 이벤트를 실시한다고 21일 밝혔다. ‘안심픽업 서비스’는 베트남 주요 3개 도시를 방문한 한국인이 공항과 숙소 간 이동을 운전기사가 포함된 렌터카 차량으로 할 수 있는 서비스다. 공항과 숙소를 오가는 ‘왕,2025-05-21 11:11:54,http://www.segye.com/newsView/20250521507358,세계일보
"롤링홀 30주년 페스티벌, 멜론에서 티켓 오픈",https://img.segye.com/content/image/2025/05/21/300/20250521517011.jpg,"음악의 성지 롤링홀 30주년 기념해 선보이는 초대형 페스티벌 ‘사운드플래닛페스티벌 2025(SOUND PLANET FESTIVAL 2025)’가 21일 멜론티켓을 통해 예매를 시작했다. 사운드플래닛페스티벌 2025의 라인업에는 YB, 체리필터, 넬, 이승윤, 브로큰발렌타인, 데이먼스 이어, 송소희, 캔트비블루, KARDI, 도시, 해서웨이, envy,",2025-05-21 18:11:08,http://www.segye.com/newsView/20250521517012,세계일보
"‘39세’ 오연서, 04년생 연하男에게 대시 받았다 “내 데뷔보다 늦게 태어나”",https://img.segye.com/content/image/2025/05/21/300/20250521516342.jpg,"배우 오연서가 2004년생 남성 팬의 고백에 당황한 모습을 보였다. 지난 20일, 유튜브 채널 ‘오연서’에는 ‘Q. 결혼 언제 하실 거예요?’라는 제목의 영상이 게재됐다, 공개된 영상에서는 오연서가 ‘무엇이든 물어보세요’를 진행하며 팬들의 짊룬에 답변하는 시간을 가졌다. 이날 오연서는 ‘결혼 생각을 가지고 있냐’는 질문에 “저는 결혼하고 싶다”고 답",2025-05-21 18:04:33,http://www.segye.com/newsView/20250521515624,세계일보
"이주화, 사인 웨딩드레스 화제 “무대 위 감동 잇는 기록”",https://img.segye.com/content/image/2025/05/21/300/20250521515595.jpg,배우 이주화가 웨딩드레스에 남겨진 사인을 통해 무대의 감동을 이어간다. 이해랑예술극장에서 공연된 음악극 ‘조선협객’을 성공적으로 마친 이주화는 무대를 함께 한 동료 배우와 스태프의 사인을 자신의 웨딩드레스에 남겼다. 이주화의 웨딩드레스는 지난 2023년 모노드라마 ‘웨딩드레스’ 초연과 2024년 영국 에든버러 프린지 페스티벌 무대에서 직접 입었던 의상이,2025-05-21 16:51:58,http://www.segye.com/newsView/20250520511645,세계일보
"블랙핑크 리사, ‘♥재벌 2세’와 이탈리아 데이트...공개연애 시작하나?",https://img.segye.com/content/image/2025/05/21/300/20250521515568.jpg,"그룹 블랙핑크 리사가 프랑스 재벌 2세와의 열애설이 또 한 번 불거졌다. 최근 온라인 커뮤니티와 외신을 중심으로, 블랙핑크 리사가 루이비통모에헤니시(LVMH) 베르나로 아르노 회장의 넷째 아들 프레데릭 아르노와 함께 있는 사진이 확산됐다. 공개된 사진 속에서 이들은 이탈리아 시칠리아에 위치한 해안가 식당에서 식사를 즐기고 있었다. 특히 이들은 한",2025-05-21 16:59:06,http://www.segye.com/newsView/20250521514162,세계일보
"배연정, ‘췌장암 투병’으로 온몸 근육 소실 “4년간 남편이 업고 다녔다”",https://img.segye.com/content/image/2025/05/21/300/20250521513797.jpg,개그우먼 배연정이 췌장암 투병 당시를 회상하며 남편에게 고마움을 전했다. 21일 방영되는 TV조선 시사교양 프로그램 ‘퍼펙트 라이프’ 241회에는 ‘1세대 원조 미녀 개그우먼’ 배연정은 남편 김도만 씨와 함께 게스트로 출연한다. 이에 패널 이성미는 “아직도 남편이 개그맨 배일집인 줄 아시는 분이 많다”고 너스레를 떨었다. 배연정에게 배일집의 근황을,2025-05-21 16:53:57,http://www.segye.com/newsView/20250521512495,세계일보
"'활동 금지' 뉴진스 다니엘, 솔로 활동 예고?…'빛삭'",https://img.segye.com/content/image/2025/05/21/300/20250521513817.jpg,"소속사 어도어와 전속계약 분쟁 중인 걸그룹 '뉴진스' 멤버 다니엘이 솔로 활동을 암시하는 게시물이 올라와 눈길을 끌었다. 해당 게시물은 곧바로 삭제돼 궁금증을 더했다. 21일 연예계에 따르면, 미국 R&B 혼성 듀오 이모셔널 오렌지스(Emotional Oranges)는 지난 19일 소셜미디어에 다니엘과 함께 찍은 사진을 올렸다. 사진 속 다니엘은 청",2025-05-21 15:54:23,http://www.segye.com/newsView/20250521512818,세계일보
"오연서 ""2004년생과 연애?…너무 어려 안돼""",https://img.segye.com/content/image/2025/05/21/300/20250521513441.jpg,"배우 오연서(38)가 결혼과 연애에 대한 생각을 밝혔다. 21일 유튜브 채널 '오연서'에는 '결혼 언제 하실 거예요?'라는 제목의 영상이 올라왔다. 영상에서 오연서는 팬들의 질문에 답하는 시간을 가졌다. 오연서는 '결혼 생각 갖고 있냐'는 질문에 ""저는 결혼하고 싶다""고 답했다. 이어 ""사람들이 '왜 결혼 안 해?'라고 물어보는데 안 하는 게",2025-05-21 15:40:37,http://www.segye.com/newsView/20250521511965,세계일보
"한소희, 칸 레드카펫 빛냈다…고혹적 미모",https://img.segye.com/content/image/2025/05/21/300/20250521513378.jpg,배우 한소희가 근황을 공개했다. 한소희는 지난 20일 인스타그램에 사진 여러 장을 공유했다. 사진 속 한소희는 제 78회 칸 국제영화제 참석한 순간의 모습이 담겼다. 그는 이번 영화제에 한 주얼리 브랜드의 글로벌 홍보대사 자격으로 참석했다. 레드카펫 위에서 화사한 하얀색 탑 드레스를 입은 한소희는 고혹적인 미모를 뽐냈다. 반짝이는 은색 목걸이,2025-05-21 15:39:15,http://www.segye.com/newsView/20250521511824,세계일보
'이혼숙려캠프' 故강지용 아내 “죄책감? 난 죄 지은 적 없어” 분노,https://img.segye.com/content/image/2025/05/21/300/20250521512828.jpg,"전 축구선수 고(故) 강지용(1989~2025)의 부인 이다은이 누리꾼들 악플에 심경을 밝혔다. 이다은은 지난 20일 자신의 인스타그램 DM(다이렉트 메시지)로 받은 메시지를 공개했다. 공개된 사진에는 한 누리꾼이 ""하. 너는 죄책감 갖고 살아라""라고 보낸 메시지가 담겼다. 이에 이다은은 ""죄책감은 죄지은 사람이, 죄짓고 있는 사람이 가져야 하는",2025-05-21 15:40:52,http://www.segye.com/newsView/20250521512666,세계일보
아차차! 도경완 무슨 말 했길래…장윤정 “요즘 같은 시국에” 아찔,https://img.segye.com/content/image/2025/05/20/300/20250520517734.jpg,아나운서 출신 방송인 도경완의 아찔한 말실수에 아내인 가수 장윤정이 당황하며 사태 수습에 진땀을 뺐다. 앞서 두 자녀의 순수한 폭로에 민망했던 경험도 있는 장윤정은 결국 가족들의 입단속 실패로 예상치 못한 큰 웃음을 안기는 결과를 가져왔다. 21일 유튜브 채널 ‘도장TV’에는 ‘도경환 조병환 허경환 염경환 아니고 도경완-43세 유튜버의 이름 찾기’라는,2025-05-21 15:09:53,http://www.segye.com/newsView/20250520517745,세계일보
"“흉터 이 정도였어?”...윤진이, 피부과 시술 중 생긴 화상 자국에 ‘눈길’",https://img.segye.com/content/image/2025/05/21/300/20250521512189.jpg,"배우 윤진이가 가족과 함께한 일상을 공개한 가운데, 선명한 흉터가 눈길을 끌었다. 지난 20일, 유튜브 채널 ‘진짜 윤진이’에는 ‘'배우 윤진이 가족 상상나라 VLOG’라는 제목의 영상이 게재됐다. 공개된 영상에서는 윤진이가 어린이날을 맞이해 남편 김태근 씨, 딸 제이와 함께 나들이 가는 모습이 담겼다. 이날 윤진이는 가족과 함께 복합문화 체험시설",2025-05-21 15:09:32,http://www.segye.com/newsView/20250521510866,세계일보
"‘축구 국대’ 정우영, 배우 이광기 딸 이연지와 6월 결혼",https://img.segye.com/content/image/2025/05/21/300/20250521511820.jpg,"축구 국가대표 정우영이 배우 이광기의 딸 이연지와 웨딩화보를 공개했다. 지난 20일 정우영은 자신의 인스타그램을 통해 ""인생에서 가장 기쁜 소식을 여러분과 직접 나누고 싶었는데 먼저 기사로 전해지게 되어 아쉽지만, 이렇게 웨딩 사진과 함께 인사 드린다""라고 했다. 이어 ""사랑하는 사람을 만나 평생을 함께하기로 약속했다. 축복해주신 모든 분들께 진심으",2025-05-21 15:10:40,http://www.segye.com/newsView/20250521512175,세계일보
"염정아, 종합병원장 사모님 된 근황...‘♥의사 남편’과 찰칵",https://img.segye.com/content/image/2025/05/21/300/20250521510385.jpg,"배우 염정아가 자신의 남편이 운영하는 화성유일병원의 종합병원 승격식에 참석했다. 지난 20일, 화성유일병원은 신관 7층 하늘정원에서 종합병원 승격 기념행사를 개최했다. 이날 행사에서는 정명근 화성특례시장을 비롯해 시도의원, 남양읍 사회단체, 화성시 서부·동부·동탄 보건소장 등이 참석해 자리를 채웠다. 이날 정 시장은 “화성 서부지역에서 종합병원으로서",2025-05-21 13:57:05,http://www.segye.com/newsView/20250521509756,세계일보
"트루디♥이대은, 2세 성별 공개 ""오타니처럼 만들자""",https://img.segye.com/content/image/2025/05/21/300/20250521510157.jpg,"래퍼 트루디와 야구선수 출신 이대은 부부가 2세 성별을 공개했다. 트루디는 지난 20일 인스타그램에 ""이대은 트루디 부부 금똥이는 과연 딸? 아들?""이라며 영상을 올렸다. 영상 속 트루디와 이대은은 젠더리빌(성별 공개) 파티하는 모습이다. 이대은은 검은색 풍선을 들고 있다. 영상 속에서 트루디는 남편에게 ""원하는 성별 있냐""고 물었고, 이대은은",2025-05-21 13:35:17,http://www.segye.com/newsView/20250521509687,세계일보
"장우혁, 손성윤에 ""뽀뽀해주기 내기하자…나 어떠냐"" 직진",https://img.segye.com/content/image/2025/05/21/300/20250521510107.jpg,"'신랑수업' 장우혁이 손성윤에게 '심쿵' 플러팅을 한다. 21일 방송되는 채널A 예능 프로그램 '요즘 남자 라이프-신랑수업'(이하 '신랑수업') 164회에서는 장우혁이 손성윤과 캠핑장에서 두 번째 데이트를 하면서 '꽁냥 케미'를 발산하는 하루가 펼쳐진다. 이날 '캠핑 러버' 장우혁은 손성윤과 캠핑장에 도착하자 ""여기다가 이제 살림을 차릴 거다""라며",2025-05-21 13:33:00,http://www.segye.com/newsView/20250521507847,세계일보
"이정후, 4타수 1안타로 이틀 연속 타점",https://img.segye.com/content/image/2025/05/21/300/20250521510959.jpg,미국프로야구 메이저리그(MLB) 샌프란시스코 자이언츠 외야수 이정후(27)가 두 경기 연속 타점을 생산했다. 이정후는 21일 미국 캘리포니아주 샌프란시스코의 오라클 파크에서 열린 2025 MLB 정규시즌 캔자스시티 로열스와 홈 경기에서 3번 타자 중견수로 선발 출전한 이정후는 4타수 1안타 1타점을 기록하며 팀의 3-2 승리에 한몫했다. 전날 캔자스시,2025-05-21 14:17:48,http://www.segye.com/newsView/20250521510894,세계일보
“트럭 시위 언급은 농담일 뿐...V리그는 언제든 다시 돌아오고 싶은 곳” [아본단자 인터뷰 下],https://img.segye.com/content/image/2025/05/20/300/20250520519995.jpg,"마르첼로 아본단자(이탈리아) 감독과의 인터뷰 분위기가 무르익자 이번 인터뷰의 직접적 계기가 됐던 트럭 시위에 대한 생각을 물었다. 아본단자 감독의 세 번째 시즌이 시작 되기 전, V리그의 전초전 성격으로 통영 KOVO컵이 열렸다. 흥국생명은 1승2패로 조별예선 탈락이라는 쓴잔을 맛봐야 했고, 일부 열성적인 흥국생명 팬들은 광화문 흥국생명 본사 앞으로 아본단",2025-05-21 08:00:00,http://www.segye.com/newsView/20250520520001,세계일보
"‘포심 최고 구속이 157km을 찍으면 뭐하나, 스트라이크를 못 던지는데...’ 롯데의 ‘긁지 않은 복권’ 윤성빈, 고질병 제구 문제로 1이닝 9자책 ‘꽝’",https://img.segye.com/content/image/2025/05/21/300/20250521500270.jpg,"포심 패스트볼의 최고 시속 157km까지 찍혔다. 맞추기 쉽지 않은 스피드였다. 그럼 뭐하나. 방망이를 댈 수 있는 곳에 던지지를 못하는데...프로야구 롯데의 ‘긁지 않은 복권’인 것 같았던 만년 유망주 윤성빈(26)이 고질적인 약점인 제구력 문제로 또 한 번 고개를 숙여야 했다. 긁어봤지만, 1이닝 9실점(9자책)으로 ‘꽝’이었다. 윤성빈은 20일 부",2025-05-21 08:00:00,http://www.segye.com/newsView/20250521500274,세계일보
"문동주, 무실점 호투… 한화, 선두 추격",https://img.segye.com/content/image/2025/05/20/300/20250520519701.jpg,5월 초 12연승을 내달리던 프로야구 한화는 지난주 6경기에서 1승5패의 부진에 빠졌다. 한때 단독 선두까지 치고 올라갔던 순위도 2위로 내려가며 위기를 맞은 것이 아니냐는 말들이 나오기 시작했다. 한화가 분위기 반전이 시급한 가운데 맞은 한 주의 첫 경에서 기대했던 선발 투수의 깔끔한 호투에 힘입어 기분 좋은 승리를 가져왔다. 한화 승리를 이끈 주역,2025-05-20 23:43:04,http://www.segye.com/newsView/20250520519515,세계일보
반전 노리는 키움 “알칸타라 어깨만 믿어”,https://img.segye.com/content/image/2025/05/20/300/20250520518135.jpg,"프로야구 키움은 2025시즌을 앞두고 과감한 결정을 내렸다. 지난해 공격력이 부족했다는 판단 아래 외국인 선수를 투수 1명, 타자 2명을 쓰기로 한 것이다. 하지만 결과는 실망스러웠다. 키움은 19일 기준 승률 2할대(0.286)의 처참한 성적으로 최하위에 머물고 있다. 결국 키움이 이날 타자 야시엘 푸이그(사진)를 방출하고 투수 라울 알칸타라(33)",2025-05-20 21:28:24,http://www.segye.com/newsView/20250520515657,세계일보
"메이저 우승, 이번엔 ‘손’ 잡을까",https://img.segye.com/content/image/2025/05/20/300/20250520518101.jpg,손흥민은 한국 축구역사상 가장 위대한 선수로 손꼽힌다. 축구 종주국 잉글랜드 프리미어리그(EPL)에서 득점왕을 차지하는 등 유럽무대에서 손흥민이 남긴 족적은 한국은 물론 아시아에선 그 누구도 범접할 수 없는 수준이다. 하지만 그의 축구 인생을 더욱 빛나게 해줄 우승 경험이 없는 게 옥에 티다. ‘한국축구의 전설’로 불리는 차범근 전 감독은 독일 분데스리가와,2025-05-20 23:14:43,http://www.segye.com/newsView/20250520515699,세계일보
두 개 대회 연속 컷탈락 윤이나… 톱랭커 빠진 대회서 부진 탈출할까,https://img.segye.com/content/image/2025/05/20/300/20250520513212.jpg,지난해 한국여자프로골프(KLPGA) 투어를 평정하고 올해 미국여자프로골프(LPGA) 투어에 뛰어든 윤이나(22·하이트진로)는 ‘대형 루키’로 주목 받았다. 작심하고 치면 드라이브샷 비거리가 290야드를 넘고 정교한 아이언샷까지 갖춰 신인왕 후보로까지 거론됐다. 하지만 성적은 이런 기대에 전혀 미치지 못한다. 2월초 데뷔전인 파운더스 컵에서 컷탈락해 체면을,2025-05-20 15:43:29,http://www.segye.com/newsView/20250520513213,세계일보
"이정후, 2경기 무안타 침묵 깨고 2루타",https://img.segye.com/content/image/2025/05/20/300/20250520509733.jpg,미국 메이저리그(MLB) 샌프란시스코 자이언츠의 ‘바람의 손자’ 이정후(27)가 2경기 연속 무안타의 침묵을 깨고 3경기 만에 안타를 때려냈다. ‘미스터 2루타’라는 또 다른 별명답게 팀의 유일한 득점을 올리는 적시 2루타였다. 이정후는 20일(한국시간) 미국 캘리포니아주 샌프란시스코 오라클 파크에서 열린 2025 MLB 캔자스시티 로열스와 홈경기에 3번,2025-05-20 13:45:06,http://www.segye.com/newsView/20250520509718,세계일보
"“지금도 그때 생각만 하면 소름이 돋을 정도… 전력은 약해졌지만, 팀 전체가 똘똘 뭉쳐 만들어낸 우승”",https://img.segye.com/content/image/2025/05/20/300/20250520504852.jpg,"며칠 전 누군가 본 기자의 인스타그램 계정을 팔로우 한다는 알림이 휴대폰에 떴다. 확인해보니 그 아이디는 ‘marcelloabbondanza’. 2024~2025 V리그 여자부 흥국생명의 통합우승을 이끌고 떠난 마르첼로 아본단자(이탈리아) 감독의 인스타그램 계정이었다. 그때만 해도 “이 양반이 나를 왜 팔로우했지?”라고 생각하고 대수롭지 않게 넘겼는데, 얼",2025-05-20 09:51:36,http://www.segye.com/newsView/20250520504858,세계일보
"김하성, 복귀 준비 돌입…주말 마이너리그 루키리그 출전",https://img.segye.com/content/image/2025/05/20/300/20250520504199.jpg,미국프로야구 메이저리그(MLB) 탬파베이 레이스 김하성(29)이 드디어 실전에 나서며 본격적인 복귀 준비에 돌입했다. 케빈 캐시 탬파베이 감독은 20일 미국 플로리다주 탬파 조지 M 스타인브레너 필드에서 열리는 2025 MLB 휴스턴 애스트로스와 홈 경기에 앞서 현지 매체와 가진 인터뷰에서 “김하성이 이번 주말 마이너리그 루키리그에 출전해 몇 차례 타격,2025-05-20 09:31:12,http://www.segye.com/newsView/20250520504200,세계일보
"키움, 선발진 강화로 반등의 불씨 키울까",https://img.segye.com/content/image/2025/05/20/300/20250520504127.jpg,"리그 최하위를 달리는 프로야구 키움 히어로즈가 더 늦기 전에 승부수를 던졌다. 시즌 초반 기대 이하의 타격감을 보여줬던 야시엘 푸이그와 결별하고 마운드 보강에 나섰다. 꼴찌를 벗어나겠다는 강한 의지가 보인다. 키움은 지난 19일 외국인 타자 푸이그에 대한 웨이버 공시를 KBO에 요청했으며, 대체 선수로 우완 투수 라울 알칸타라와 총액 40만 달러(연",2025-05-20 09:23:14,http://www.segye.com/newsView/20250520502422,세계일보
"신유빈, 세계선수권 여자복식·혼합복식 16강 진출",https://img.segye.com/content/image/2025/05/20/300/20250520502700.jpg,한국 여자 탁구 간판스타 신유빈(대한항공)이 국제탁구연맹(ITTF) 세계선수권대회 혼합복식과 여자복식 16강에 올랐다. 신유빈은 유한나(포스코인터내셔널)와 함께 20일(한국 시간) 카타르 도하의 루사일 스포츠아레나에서 열린 대회 여자복식 32강에서 조지나 포타(헝가리)-사라 드 누트(룩셈부르크)를 3-0(11-3 11-7 11-4)으로 제압했다. 1,2025-05-20 09:22:29,http://www.segye.com/newsView/20250520502698,세계일보
"손흥민, UEL 결승에 선발로 뛸까",https://img.segye.com/content/image/2025/05/20/300/20250520504098.jpg,잉글랜드 프로축구 프리미어리그(EPL) 토트넘홋스퍼 '주장' 손흥민(33)이 유럽축구연맹(UEFA) 유로파리그(UEL) 결승전 선발 명단에 이름을 올릴 수 있을지 관심이다. 토트넘은 오는 22일 오전 4시(한국 시간) 스페인 빌바오의 에스타디오 산 마메스에서 EPL 맨체스터 유나이티드와 2024~2025시즌 UEL 결승전을 치른다. 토트넘은 지난 2,2025-05-20 09:21:56,http://www.segye.com/newsView/20250520502846,세계일보
날아 오른 갈매기… 안방서 선두 자리 ‘호시탐탐’,https://img.segye.com/content/image/2025/05/19/300/20250519518124.jpg,"2025시즌 프로야구 5월 초 분위기를 달군 구단은 12연승을 내달리며 선두까지 차지했던 한화였다. 이런 한화가 지난주 1승5패의 부진에 빠진 사이 치고 올라오는 팀이 있다. 바로 롯데다. 롯데는 최근 10경기에서 7승2패1무를 내달리며 28승18패2무로 한화와 함께 공동 2위까지 올라섰다. 롯데가 승패 차 10 이상 기록한 건, 2023년 5월28일",2025-05-19 20:39:31,http://www.segye.com/newsView/20250519515349,세계일보
이상민 KCC 신임 감독 “건강한 KCC 만들어 우승으로 보답할 것”,https://img.segye.com/content/image/2025/05/19/300/20250519515232.jpg,이상민 부산 KCC 신임 감독은 19일 세계일보와 전화 인터뷰에서 “우리가 건강하면 어떤 팀인지 모두가 잘 알고 있을 것”이라며 “건강한 팀을 만들어 한 시즌을 치러보겠다”고 강조했다. 2023~2024시즌 챔피언결정전에서 우승한 KCC는 올 시즌 라건아가 해외 무대로 떠난 것을 제외하면 우승 전력을 그대로 갖추고 있었다. 2024~2025시즌 강력한 우승,2025-05-19 17:56:12,http://www.segye.com/newsView/20250519515234,세계일보
‘대회 중 체포’ 악몽 씻은 세계 1위 셰플러...PGA 챔피언십 첫 제패,https://img.segye.com/content/image/2025/05/19/300/20250519513369.jpg,"2023년 5월부터 미국프로골프(PGA) 투어 세계랭킹 1위 자리를 지키고 있는 스코티 셰플러(미국)는 마스터스에서 두 차례 우승했지만 다른 메이저 대회에서는 번번이 우승 문턱에서 좌절했다. 지난해 PGA 챔피언십이 대표적이다. 이 대회 직전 5개 대회에서 우승 4번, 준우승 1번을 차지해 강력한 우승 후보로 거론됐지만 2라운드를 앞두고 경찰 폭행 혐의로",2025-05-19 15:55:32,http://www.segye.com/newsView/20250519513371,세계일보
세이 길저스 알렉산더 요키치 눌렀다… 오클라호마시티 9년 만에 서부 콘퍼런스 결승행,https://img.segye.com/content/image/2025/05/19/300/20250519504422.jpg,셰이 길저스-알렉산더가 니콜라 요키치와의 최우수선수(MVP) 대전에서 이겼다. 미국프로농구(NBA) 오클라호마시티 썬더가 9년 만에 서부콘퍼런스 결승에 진출에 성공했다. ‘에이스’ 웃었다. 1번 시드 오클라호마시티는 19일 미국 오클라호마주 오클라호마시티의 페이컴 센터에서 열린 2024~2025 NBA 플레이오프(PO) 2라운드(7전4승제) 7차전에서,2025-05-19 09:40:26,http://www.segye.com/newsView/20250519504182,세계일보
