title,thumbnail,short_content,write_time,link,company
"‘프리미엄 정비 서비스’ 강화 전략…아우디, 동대문에 신규 서비스센터 오픈",https://img.segye.com/content/image/2025/08/26/300/20250826511119.jpg,"아우디 코리아(사장: 스티브 클로티)는 공식 딜러사 고진모터스(대표: 장인우)가 ‘아우디 동대문 서비스센터’를 신규 오픈했다고 밝혔다고 26일 밝혔다. 아우디 동대문 서비스센터는 총 연면적 2,874㎡ 규모에 8개의 워크베이를 갖추고 있으며, 다이렉트 접수 시스템을 통해 빠르고 편리한 서비스를 제공한다. 고급스러운 고객 라운지와 최신 장비, 숙련된",2025-08-26 13:31:22,http://www.segye.com/newsView/20250826511125,세계일보
"처서 지나도 폭염은 계속… 온열질환자, 올해 누적 4000명 돌파",https://img.segye.com/content/image/2025/08/26/300/20250826511070.jpg,"8월 말 습한 더위가 계속되면서 온열질환 발생도 꾸준히 늘어 올해 누적 4000명을 돌파했다. 26일 질병관리청 온열질환 응급실 감시체계에 따르면 지난 24일 응급실에 방문한 온열질환자는 55명, 온열질환 추정사망자는 1명으로 집계됐다. 절기상 처서였던 23일에도 49명이 온열질환으로 응급실을 찾았고 1명은 관련 질환으로 사망했다. 지난 5월 1",2025-08-26 13:29:25,http://www.segye.com/newsView/20250826511114,세계일보
"엔카, 차량 구매시 총 1억원 지원금",https://img.segye.com/content/image/2025/08/26/300/20250826511029.jpg,"자동차 거래 플랫폼 엔카닷컴(대표 김상범)이 신규 광고 캠페인 론칭을 기념해 총 1억원의 차량 구매 지원금을 제공하는 ‘내 차 팔고, 드림카로 바로 직진’ 이벤트를 진행한다고 26일 밝혔다. 오는 9월 25일(목)까지 진행되는 ‘내 차 팔고, 드림카로 바로 직진’ 이벤트는 ‘엔카 비교견적’으로 내 차 시세를 조회한 고객들을 대상으로 진행된다. 참여",2025-08-26 13:24:55,http://www.segye.com/newsView/20250826511043,세계일보
건강검진 때마다 CT 촬영? “암 걸릴 위험 ↑”,https://img.segye.com/content/image/2025/08/26/300/20250826510591.jpg,"질병 진단이나 건강검진 목적으로 이뤄지는 의료방사선 검사가 1년 전보다 3.5% 늘었다. 의료방사선을 이용한 검사 시엔 방사선에 노출되는데, 피폭선량이 증가하면 암 발생 위험도 높아지므로 꼭 필요할 때만 검사를 받아야 한다. 26일 질병청 발표에 따르면 지난해 우리 국민이 받은 의료방사선 검사는 총 4억1271만여건(국민 1인당 8건)으로 전년 대비 3.5",2025-08-26 12:54:26,http://www.segye.com/newsView/20250826510378,세계일보
겉모습 집착하다 고립되는 현대인… ‘인간탐구’의 발레 ‘Mirror’,https://img.segye.com/content/image/2025/08/26/300/20250826507288.jpg,무용예술단체 사단법인 무트댄스가 오는 9월12일과 17일 공연 ‘4th BE-MUT’를 선보인다. ‘BE-MUT’는 무트댄스가 주도하는 창작무용 시리즈로 올해 네 번째를 맞았다. 2025년 서울문화재단 예술창작활동지원 프로젝트 선정작인 이번 공연은 국내 창작과 국제 협업 무대로 구성된다. 12일 서강대 메리홀 대극장에서는 국내 신진 및 기성 안무가,2025-08-26 10:43:56,http://www.segye.com/newsView/20250826507289,세계일보
"“숨겨둔 셋째 딸 있다”...김응수, 깜짝 ‘가정사’ 고백",https://img.segye.com/content/image/2025/08/26/300/20250826515893.jpg,"배우 김응수가 ‘라디오스타’에서 뜻밖의 가정사를 털어놓는다. 오는 27일, MBC 예능 프로그램 ‘라디오스타’(이하 ‘라스’)는 929회를 맞이해 ‘K-아재 흥행 헌터스’ 특집으로 꾸며진다. 이번 회차에서는 배우 김응수, 그룹 ‘신화’ 김동완, 그룹 ‘코요태’ 빽가, 뮤지컬 배우 김호영이 게스트로 출연해 재치 있는 입담을 자랑한다. 이날 김응수는 최",2025-08-26 17:47:54,http://www.segye.com/newsView/20250826514397,세계일보
"진선규 여친, 낯익다했더니…‘솔로지옥 2’ 출연자였어?",https://img.segye.com/content/image/2025/08/26/300/20250826517714.jpg,‘솔로지옥 2’에 출연해 얼굴을 알린 배우 이소이가 ‘애마’에서 파격 변신을 감행해 눈길을 끌었다. 지난 22일 공개된 넷플릭스 시리즈 ‘애마’는 1980년대 한국을 강타했던 에로영화의 탄생 과정 속 화려한 스포트라이트에 숨겨진 어두운 현실에 용감하게 맞서는 톱스타 희란(이하늬)과 신인 배우 주애(방효린)의 관계를 담은 작품이다. 지난 25일 기준,2025-08-26 18:35:16,http://www.segye.com/newsView/20250826517783,세계일보
"""사람들은 다정한 남편·아빠인 줄 알아""… '결혼지옥' 속 불안감",https://img.segye.com/content/image/2025/08/26/300/20250826516881.jpg,‘오은영 리포트-결혼지옥’에서 남편의 한숨과 무관심에 고통받는 가족들의 이야기가 그려졌다. 25일 방송된 MBC ‘오은영 리포트-결혼 지옥’에서는 대화 중 늘 한숨을 쉬는 남편과 자신의 말을 경청해주길 바라는 아내가 끝없이 갈등하는 ‘한숨 부부’의 사연이 그려졌다. ‘한숨 부부’ 아내는 “지인들은 우리가 다정한 부부인 줄 안다. 27년 만에 처음,2025-08-26 17:36:10,http://www.segye.com/newsView/20250826517354,세계일보
"노래까지 잘하더니 박진주, 일냈다…韓 유일 ‘디즈니 프린세스 무대’ 초청",https://img.segye.com/content/image/2025/08/26/300/20250826516750.jpg,"배우 박진주가 한국인 중 유일하게 ‘디즈니 콘서트’ 무대에 오르는 영광을 누린다. 26일 박진주의 소속사 프레인TPC는 “배우 박진주가 디즈니 프린세스 콘서트 ‘Princess All Stars in Concert’의 스페셜 게스트로 초대돼 유일한 한국인 게스트로 무대를 빛낸다”고 밝혔다. 박진주는 다양한 장르의 드라마와 영화, 예능은 물론 뮤지컬",2025-08-26 17:10:39,http://www.segye.com/newsView/20250826516945,세계일보
"‘속옷 CEO’ 송지효, 8억짜리 슈퍼카에 진심…“내가 페라리를 몰다니!”",https://img.segye.com/content/image/2025/08/26/300/20250826516087.jpg,방송인 송지효가 슈퍼카에 대한 남다른 애정을 드러냈다. 지난 25일 방송인 지석진의 유튜브 채널 ‘지편한 세상’에는 ‘지효야 차 사러 가자! XX억대 슈퍼카 탑승기ㅣ지편한세상 송지효 편’이라는 제목의 영상이 게재됐다. 영상에서 지석진과 배우 송지효는 슈퍼카 전문가와 함께 여러 고가 슈퍼카를 직접 살펴보고 체험하는 시간을 가졌다. 이날 지석,2025-08-26 16:56:04,http://www.segye.com/newsView/20250826516529,세계일보
"김병만, 전처 관련 충격 주장 “나 죽었으면 돈 엄청 벌었을 것…사건 전문 다큐감”",https://img.segye.com/content/image/2025/08/26/300/20250826510922.jpg,9월 재혼을 앞둔 개그맨 김병만이 과거 결혼생활의 균열을 털어놨다. 그는 전처와의 경제적 갈등과 의지할 곳 없이 외롭고 두려웠던 시간들을 조심스레 꺼내놨다. 버텨야만 했던 시간들을 힘겹게 정리한 김병만은 재혼하는 아내와 두 자녀를 처음 공개하며 새로운 출발을 알렸다. 25일 방송된 TV조선 ‘조선의 사랑꾼’에는 김병만이 새로운 사랑꾼으로 합류해 가족과의,2025-08-26 16:02:29,http://www.segye.com/newsView/20250826510641,세계일보
"'레전드 女앵커' 백지연, 4050 여성에 필요한 클린한 아침 식단 공개",https://img.segye.com/content/image/2025/08/26/300/20250826514413.jpg,"미모와 지성미를 갖춘 전 MBC 아나운서 출신 백지연이 자신만의 건강한 아침 식사법을 공개했다. 백지연은 25일 자신의 유튜브 채널 '지금백지연'에 ""45세 이후 여성에게 꼭 필요한 아침 식사법""이라는 제목의 영상을 게시했다. 백지연은 ""예전에는 너무 젊은 분들이 건강 건강 이러지 않는 분위기 였는데 요즘에는 남녀노소 불문하고 건강을 챙기는게 트",2025-08-26 15:54:03,http://www.segye.com/newsView/20250826514472,세계일보
"임지우, 새 싱글 ‘SKIT’ 발매… ”나는 너의 스킷이나 플랜 B가 아니야”",https://img.segye.com/content/image/2025/08/26/300/20250826514494.jpg,"싱어송라이터 임지우가 26일 새 싱글 ‘스킷(SKIT)’을 전격 발매했다. ‘스킷(SKIT)’은 공연이나 앨범에서 짧게 지나가는 장면이나 소극 등을 의미하는 단어다. 임지우는 이번 곡을 통해 누군가에게 그저 스쳐 지나가는 사람이 아닌, 기억에 오래 남는 대단한 사랑이 되고 싶은 마음을 담아냈다. 특히 ‘나는 너의 스킷이나 플랜 B가 되기엔 너무",2025-08-26 15:40:53,http://www.segye.com/newsView/20250826514421,세계일보
야구 꿈나무들에 ‘1200만원 한우 골든벨’ 울린 이대호,https://img.segye.com/content/image/2025/08/26/300/20250826514241.jpg,‘프로야구 레전드’ 이대호가 모교인 경남고 야구부 후배들을 위해 통 크게 한우를 쏴 시선을 끌었다. 지난 25일 이대호의 유튜브 채널에는 “大경남고 우승 기념으로 후배들에게 한우 쐈습니다”라는 제목의 영상이 게재됐다. 지난 2일 경남고는 경북 포항야구장에서 열린 ‘제59회 대통령배 전국고교야구대회’ 결승전에서 휘문고를 4대 3으로 꺾고 우승을 탈환했,2025-08-26 15:34:39,http://www.segye.com/newsView/20250826514353,세계일보
장원영 군 입대?… 군복 입고 유격 훈련도 참가해,https://img.segye.com/content/image/2025/08/26/300/20250826513609.jpg,"그룹 아이브의 장원영이 '전과자'를 통해 입대했다. 지난 25일 유튜브 채널 'ootb STUDIO'에는 '[속보] 아이브 장원영 군 입대'라는 제목의 예고편 쇼츠 영상이 공개됐다. 영상에서는 MC 카이가 ""오늘은 어떤 활동인가요?""라고 질문하고, 제작진은 ""동반 입대""라고 답했다. 카이는 '입대'라는 말에 외마디의 비명을 지르며 괴로워하는 모습을",2025-08-26 15:23:57,http://www.segye.com/newsView/20250826513869,세계일보
"미혼모로 낳은 아들에 ‘인간 말종 XX야’…이성미, 눈물의 회한 “내가 잘못”",https://img.segye.com/content/image/2025/08/26/300/20250826513281.jpg,"개그우먼 이성미가 과거 아들과의 격한 갈등을 계기로 인생이 완전히 바뀌었다고 털어놨다. 최근 배우 송승환이 진행하는 유튜브 채널 ‘송승환의 원더풀 라이프’에는 이성미가 게스트로 출연해 캐나다에서 아들과 함께 지내던 시절을 회상하며, 당시 겪었던 갈등과 신앙을 통한 변화를 솔직하게 전했다. 이날 영상에서 이성미는 “‘어떻게 그럴 수 있냐’라고 생각",2025-08-26 15:17:29,http://www.segye.com/newsView/20250826513549,세계일보
"김종국, ‘9월 결혼’ 앞두고 사랑꾼 면모 “여친에게만 애교 많아”",https://img.segye.com/content/image/2025/08/26/300/20250826513243.jpg,"가수 김종국이 평소 이미지와 다른 뜻밖의 연애 스타일을 밝혀 눈길을 끌었다. 오는 28일, KBS 2TV 예능 프로그램 ‘옥탑방의 문제아들’(이하 ‘옥문아’) 281회가 방영된다. 이번 회차에서는 ‘오래된 만남 추구3’(이하 ‘오만추3’)에 사랑을 찾아 나선 황보와 솔비가 게스트로 출연해 유쾌한 입담을 뽐낸다. 이날 솔비는 자신이 ‘남다른 연애촉’을",2025-08-26 15:14:29,http://www.segye.com/newsView/20250826512179,세계일보
김종국 이어 이정진도 품절♥? ‘신혼집 투어’ 나섰다,https://img.segye.com/content/image/2025/08/26/300/20250826513318.jpg,"배우 이정진이 신혼집을 염두에 두고 임장 투어에 나서 “결혼에 임박한 게 아니냐”는 시선이 나온다. 27일 방송하는 채널A ‘요즘 남자 라이프-신랑수업(이하 ‘신랑수업’)’ 178회에서는 이정진이 절친인 정준하와 함께 방배동, 청담동, 잠실 등을 돌며 부동산을 알아보는 현장이 공개된다. 이날 이정진은 정준하를 만나 “집을 좀 알아보고 싶다”며 결혼과",2025-08-26 15:05:19,http://www.segye.com/newsView/20250826513425,세계일보
"“200억 모아서 독립유공자 후손 후원”...션, 수액 맞고 81.5km 달렸다",https://img.segye.com/content/image/2025/08/26/300/20250826511761.jpg,"그룹 ‘지누션’ 멤버 션이 감기 몸살에도 불구하고, 광복절을 맞아 81.5km 완주에 성공했다. 지난 24일, 유튜브 채널 ‘션과 함께’에는 ‘무리인 걸 알면서도 매년 81.5km를 달리는 이유’라는 제목의 영상이 게재됐다. 공개된 영상에서는 션이 광복절 80주년을 맞아 기부 마라톤 ‘2025 815 런’을 열고 81.5km를 완주하는 모습이 담겼다.",2025-08-26 14:48:13,http://www.segye.com/newsView/20250826510839,세계일보
"이수혁, 수지 후궁되나♥…‘하렘의 남자들’ 긍정 검토",https://img.segye.com/content/image/2025/08/26/300/20250826511794.jpg,"배우 이수혁이 인기 웹소설 원작 ‘하렘의 남자들’ 드라마 출연을 제안받았다고 밝혀 관심이 쏠린다. 26일 이수혁의 소속사 사람엔터테인먼트는 “이수혁이 ‘하렘의 남자들’ 출연 제안을 받고 긍정적으로 검토 중”이라고 발표했다. 동명의 웹소설을 원작으로 한 ‘하렘의 남자들(극본 황진영, 연출 이응복)’은 타리움 제국의 여황제 라틸이 제국을 지키기 위해 남",2025-08-26 14:19:53,http://www.segye.com/newsView/20250826511965,세계일보
GS칼텍스 3년차 리베로 유가람 “코트 위 수진 언니는 하늘 같아 보여요. 열심히 따라갈게요”,https://img.segye.com/content/image/2025/08/26/300/20250826517319.jpg,여자 프로배구 GS칼텍스의 3년차 리베로 유가람(20)은 최근 코로나19에 걸려 고생을 좀 했다. 지난 7일부터 17일까지 인도네시아 수라바야에서 열린 U-21 세계선수권대회에 참석했다가 코로나19에 걸려왔다. GS칼텍스의 구단 미디어데이가 열린 26일 경기도 가평의 GS칼텍스 클럽하우스에서 만난 유가람은 건강을 되찾은 모습이었다. 웃는 얼굴로 기자를,2025-08-26 17:17:54,http://www.segye.com/newsView/20250826517320,세계일보
GS칼텍스 2년차 사령탑 이영택 감독 “올 시즌은 지난 시즌과는 분명 달라…젊은 선수들의 성장을 바탕으로 봄 배구 진출하겠다”,https://img.segye.com/content/image/2025/08/26/300/20250826514818.jpg,“지난 시즌과는 분명 다를 겁니다. 젊은 선수들의 성장을 바탕으로 봄 배구에 꼭 진출해보이겠습니다” 여자 프로배구 GS칼텍스의 2년차 사령탑 이영택 감독이 다가올 2025~2026시즌 V리그를 향한 당찬 포부를 드러냈다. 이 감독은 26일 경기도 가평의 청평 GS칼텍스 클럽하우스에서 열린 구단 미디어데이에 주장 유서연과 함께 참석했다. 이 감독은 “,2025-08-26 15:49:00,http://www.segye.com/newsView/20250826514573,세계일보
"유해란, ‘특급대회’ FM 챔피언십 2연패·시즌 첫 다승 두 마리 토끼 잡을까",https://img.segye.com/content/image/2025/08/26/300/20250826514229.jpg,올해 미국여자프로골프(LPGA) 투어는 절대 강자가 없다. 2승 이상을 거둔 다승자가 단 한명도 없을 정도다. 지난해 5연승 포함 7승을 거두며 투어를 장악하던 넬리 코르다(27·미국)가 올해 단 1승도 신고하지 못하며 부진을 겪고 있기 때문이다. 유해란(24·다올금융그룹)이 28일(현지시간) 미국 매사추세츠주 노턴의 보스턴 TPC(파72·6533야드),2025-08-26 15:32:34,http://www.segye.com/newsView/20250826514168,세계일보
"롤리, MLB 포수 최초 단일시즌 50홈런",https://img.segye.com/content/image/2025/08/26/300/20250826512313.jpg,미국프로야구 메이저리그(MLB) 시애틀 매리너스의 칼 롤리(28)가 포수로는 사상 처음으로 단일 시즌 50홈런 고지를 밟았다. 롤리는 26일(한국시간) 미국 워싱턴주 시애틀 T모바일파크에서 열린 2025 MLB 샌디에이고 파드리스와 홈 경기에 2번 지명타자로 선발 출전한 뒤 0-0으로 맞선 1회말 1사에서 좌월 홈런을 때려 시즌 50호째를 기록했다.,2025-08-26 14:19:32,http://www.segye.com/newsView/20250826511864,세계일보
"역대급 흥행 가도 속에 최악 부진으로 홀로 관중동원 마이너스로 역행하는 KIA, 남은 기간 반등하며 성난 광주 민심 달랠까",https://img.segye.com/content/image/2025/08/26/300/20250826504421.jpg,2025 KBO리그는 역대급 흥행 가도를 달리고 있다. 최소 경기 100만(60경기)을 시작으로 1000만(587경기) 관중 등 100만명 단위의 관중을 기록한 경기 수가 모두 역대 최소 신기록이다. 지난해에는 1000만을 넘기는 데 671경기가 필요했다. 올해 프로야구는 경기당 평균 1만7187명이 찾고 있어 KBO리그 역대 최다 평균 관중(2024시즌,2025-08-26 08:47:37,http://www.segye.com/newsView/20250826504429,세계일보
"황희찬 경기감각 떨어졌다고 본 홍명보 감독, 미국서 뛰는 정상빈 대체 발탁",https://img.segye.com/content/image/2025/08/26/300/20250826500521.jpg,“경기 감각” 홍명보 한국 축구대표팀 감독이 2026 국제축구연맹(FIFA) 북중미 월드컵 출전 조건 중 가장 중요하게 생각하는 평가 요소다. 이 조건에 따라 지난 월드컵에서 맹활약했던 황희찬(울버햄프턴)이 9월 A매치 원정길에 동행하지 못하게 됐다. 홍 감독은 25일 서울 종로구 축구회관에서 열린 A대표팀 명단을 발표했다. 월드컵 진출을 확정한 뒤,2025-08-26 01:30:53,http://www.segye.com/newsView/20250826500509,세계일보
"40홈런으로 홈런왕 예약한 삼성 디아즈, 외인 최초 50홈런 돌파? 그렇게 되면 삼성의 가을야구 진출 가능성은 더 높아진다",https://img.segye.com/content/image/2025/08/25/300/20250825517852.jpg,미국 메이저리그(MLB)에 칼 롤리(시애틀 매리너스)가 있다면 KBO리그에는 삼성의 르윈 디아즈(도미니카 공화국)가 있다. KBO리그 풀타임 첫해를 치르는 디아즈는 40홈런을 채우며 이미 홈런왕은 예약했다. 이제 관심은 외국인 타자 역사상 첫 50홈런 돌파 여부에 쏠린다. 디아즈는 지난 24일 대구 삼성라이온즈파크에서 열린 키움과의 홈 경기에서 삼성이,2025-08-26 00:04:39,http://www.segye.com/newsView/20250825517859,세계일보
"‘독한’ 카스트로프, 이중국적 축구선수 첫 태극마크 단다",https://img.segye.com/content/image/2025/08/25/300/20250825516415.jpg,한국 축구 역사상 처음으로 이중국적 선수가 남자 A대표팀에 합류했다. 주인공은 독일에서 태어난 옌스 카스트로프(22·묀헨글라트바흐)다. 한국에서 태어난 혼혈선수가 태극마크를 단 적은 있었지만 외국출신 선수가 대표팀에 합류한 건 최초다. 홍명보 한국 축구대표팀 감독은 25일 서울 종로구 축구회관에서 9월 A매치 원정에 동행할 대표팀 명단 26명을 발표했,2025-08-25 22:00:00,http://www.segye.com/newsView/20250825514337,세계일보
"‘평영 샛별’ 문수아, 주니어선수권 한국 첫 金",https://img.segye.com/content/image/2025/08/25/300/20250825516434.jpg,여자 평영 간판 문수아(17·서울체고·사진)가 한국 수영 사상 처음으로 세계주니어선수권대회에서 금메달을 목에 걸었다. 문수아는 25일(한국시간) 루마니아 오토페니에서 열린 세계수영연맹(World Aquatics) 2025 세계주니어선수권대회 여자 평영 200m 결승에서 2분24초77의 기록으로 우승했다. 2위 레나 루트비히(독일·2분26초56)보다 1,2025-08-25 21:30:00,http://www.segye.com/newsView/20250825514324,세계일보
‘거포본색’ 칼 롤리… 포수 첫 시즌 49호포,https://img.segye.com/content/image/2025/08/25/300/20250825516435.jpg,칼 롤리(29·시애틀 매리너스·사진)가 미국프로야구 메이저리그(MLB) 포수 단일 시즌 최다 홈런이라는 새 역사를 썼다. 그는 에런 저지(뉴욕 양키스)를 제치고 아메리칸리그 최우수선수(MVP) 자리도 넘보고 있다. 롤리는 25일 미국 워싱턴주 시애틀 T모바일아레나에서 열린 2025 MLB 애슬레틱스와 홈경기에서 1회와 2회 연거푸 펜스를 넘기며 시즌,2025-08-25 21:10:00,http://www.segye.com/newsView/20250825514317,세계일보
‘163전 164기’ 토미 플리트우드 드디어 웃었다...PO 최종전서 데뷔 첫승,https://img.segye.com/content/image/2025/08/25/300/20250825512020.jpg,2010년 미국프로골프(PGA) 투어에 데뷔한 토미 플리트우드(34·잉글랜드)는 ‘무관의 제왕’이라는 달갑지 않은 별명을 꼬리표처럼 달고 다녔다. 15년 동안 우승을 못했지만 우승 없는 선수중 상금 1위에 올랐기 때문이다. 올해 페덱스컵 플레이오프 시작 전까지 그가 벌어들인 상금은 3136만669달러(약 436억원)다. 플리트우드는 또 PGA 투어 162개,2025-08-25 15:27:13,http://www.segye.com/newsView/20250825512021,세계일보
"네덜란드서 뛰는 ‘신성’ 윤도영, 유럽 무대 데뷔 3경기 만에 데뷔골",https://img.segye.com/content/image/2025/08/25/300/20250825503966.jpg,네덜란드 프로축구 엑셀시오르 로테르담에서 뛰는 신성 윤도영(18)이 유럽 무대 데뷔 3경기 만에 첫 골을 터트렸다. 윤도영은 25일 네덜란드 위트레흐트의 스타디온 할헌바르트에서 열린 FC위트레흐트와의 2025∼2026 네덜란드 에레디비시 3라운드 원정 경기에서 팀이 0-4로 끌려다니던 후반 38분 만회 골을 넣었다. 윤도영이 유럽 프로축구 무대에 데뷔해,2025-08-25 09:30:59,http://www.segye.com/newsView/20250825503791,세계일보
"‘KBO MVP’ 페디, MLB 애틀랜타서 방출",https://img.segye.com/content/image/2025/08/25/300/20250825503374.jpg,2023년 KBO리그 최우수선수(MVP)를 수상한 뒤 미국 무대로 복귀했던 에릭 페디(32)가 두 시즌 만에 방출됐다. 미국프로야구(MLB) 애틀랜타 브레이브스 구단은 25일(한국시간) 페디를 자유계약 선수로 방출한다고 발표했다. 2017년부터 2022년까지 MLB 워싱턴 내셔널스 소속으로 뛰었던 페디는 2023년 KBO리그 NC와 계약해 새로운 활로를,2025-08-25 09:13:51,http://www.segye.com/newsView/20250825503279,세계일보
"이정후, 밀워키전 1안타 1볼넷 멀티 출루",https://img.segye.com/content/image/2025/08/25/300/20250825503060.jpg,"미국프로야구 메이저리그(MLB) 샌프란시스코 자이언츠 이정후(27)가 2경기 연속 안타와 더불어 멀티 출루(한 경기 2출루 이상)하며 팀 역전승에 한몫을 했다. 이정후는 25일(한국시간) 미국 위스콘신주 밀워키 아메리칸패밀리필드에서 열린 2025 MLB 밀워키 브루어스와 원정 경기에 1번 타자 중견수로 선발 출전, 4타수 1안타를 치고 볼넷 1개를",2025-08-25 09:01:48,http://www.segye.com/newsView/20250825502991,세계일보
"‘엄상백 보상선수’로 KT 이적→ 프로 10년차 만에 첫 억대연봉 진입...장진혁, 대타 3점포로 억대 연봉의 자격을 증명했다...“팀에 보탬이 되어 뿌듯”",https://img.segye.com/content/image/2025/08/25/300/20250825500144.jpg,"프로야구 KT의 외야수 장진혁은 광주일고 시절이던 2011년 청소년대표에 발탁될 정도로 전국구급 재능이었지만, 그해 2012 신인 드래프트에서 지명을 받지 못했다. 단국대에 진학 후 1학년 때부터 주전으로 뛰며 4년 내내 꾸준한 활약을 보여주면서 2016 신인 드래프트에서 2차 4라운드 39순위로 한화 지명을 받으며 프로에 데뷔했다. 다만 프로의 벽은 높았",2025-08-25 08:00:00,http://www.segye.com/newsView/20250825500150,세계일보
“박물관 전시해야”… 손흥민 MLS 첫 골,https://img.segye.com/content/image/2025/08/24/300/20250824509593.jpg,미국 메이저리그사커(MLS) 로스앤젤레스(LA)FC 손흥민(33)이 새 무대에서 처음으로 ‘찰칵 세리머니’를 선보였다. 손흥민이 LAFC 유니폼을 입은 지 3경기 만에 마수걸이 골을 넣고 나서다. 손흥민은 24일 미국 텍사스주 댈러스 토요타 스타디움에서 열린 댈러스와 2025시즌 정규리그 원정경기에서 전반 6분 프리킥으로 득점을 신고했다. LAFC가,2025-08-24 22:11:19,http://www.segye.com/newsView/20250824508450,세계일보
