title,thumbnail,short_content,write_time,link,company
"“李·트럼프 서로 칭찬, 한미 경제·안보관계 아낌없는 찬사”… 외신 평가",https://img.segye.com/content/image/2025/08/26/300/20250826505510.jpg,"25일(현지 시간) 열린 한미 정상회담은 도널드 트럼프 대통령의 소셜미디어(SNS) 폭탄발언에도 따뜻한 환대로 시작해 긍정적인 분위기로 마무리됐다는 평가가 외신에서 나오고 있다. 영국 BBC는 이날 한미 정상회담이 끝난 후 “이 대통령이 ‘오벌오피스(집무실) 서프라이즈’를 피하면서 모두가 미소짓고 있다”고 평가했다. 방송은 “해외 지도자가 집무실에 들어서면 무슨 일이 일어날지 누구도 알 수 없다”며 앞서 트럼프 대통령과 회담에서 낭패를 본 볼로디미르 젤렌스키 우크라이나 대통령과 시릴 라마포사 남아프리카공화국 대통령을 언급했다. 이어 “이 대통령은 트럼프 대통령과의 공개적인 만남을 긍정적으로 마무리하면서 오늘 그러한 운명에서 벗어났다”며 “두 정상은 서로에 대한 칭찬과 한미 경제 및 안보관계에 대해 아낌없는 찬사를 보냈다”고 주목했다 외신들은 이날 회담에 앞서 트럼프 대통령이 SNS를 통해 돌연 이재명 정부를 공격하는 듯한 발언을 내놓으면서 위기감이 높아졌지만, 이 대통령이 트럼프 대통령에 대한 칭찬세례로 회담을 시작하며 분위기를 바꿔놨다고 평가했다. AP통신은 ‘이 대통령에 대한 트럼프의 초기 경고는 아첨 후 따뜻한 환영으로 바뀌었다’는 분석기사에서 “이 대통령이 집무실 장식을 아낌없이 칭찬하고, 한반도 평화를 위한 노력을 요청하며, 심지어 북한에 트럼프 타워 건립까지 제안하자 적대적인 오벌오피스 회담이 이뤄질 모든 가능성은 완전히 사라졌다”고 분석했다. 그러면서 “이 화기애애한 모습은 세계 정상들이 트럼프 대통령과 과거 회담에서 교훈을 얻고 있음을 보여준다”며 “그들은 대체로 유리한 무역조건과 미국의 지속적인 군사 지원을 요구하면서 대결보다는 칭찬과 찬사의 길을 택했다”고 주목했다. 워싱턴포스트(WP)도 “이 대통령은 트럼프 대통령의 집무실 새 단장, 전세계에서의 평화 노력, 최근 다우존스 지수 최고치 경신 등에 대해 칭찬을 아끼지 않았다”며 “트럼프 대통령이 북한에 트럼프타워를 짓고 골프를 쳐야한다는 농담을 던져 트럼프의 미소를 자아냈다”고 주목했다.",2025-08-26 09:31:44,https://www.segye.com/newsView/20250826505471,세계일보
"트럼프 사돈, 프랑스 외교부 초치 불응… 양국 관계 험악해져",https://img.segye.com/content/image/2025/08/26/300/20250826502293.jpg,"프랑스 외교부가 파리 주재 미국 대사의 ‘내정 간섭’을 이유로 초치(招致)를 통보했다. 하지만 대사는 자신이 부재 중이라며 대리인을 보냈다. 미국 정부가 자국 대사를 적극 감싸면서 두 나라 간 외교 갈등으로 비화할 조짐이다. 현재 주(駐)프랑스 미국 대사는 도널드 트럼프 대통령의 사돈이자 트럼프의 딸 이방카 트럼프의 시아버지인 찰스 쿠슈너(71)다. 25일(현지시간) AFP 통신에 따르면 전날 프랑스 외교부의 초치 통고를 받은 쿠슈너 대사는 이날 자리를 비웠다. 그를 대신해 대사 대리(charge d'affaires)가 외교부로 갔다. 국장급 간부 2명이 외교부에서 미국 대사 대리를 맞이했다고 AFP는 전했다. 쿠슈너는 최근 에마뉘엘 마크롱 프랑스 대통령 앞으로 보낸 공개 서한에서 ‘프랑스 정부가 반(反)유대주의에 맞서기 위해 충분한 조치를 취하지 않았다’는 취지의 주장을 폈다. 그는 마크롱이 오는 9월 유엔 총회를 계기로 팔레스타인을 정식 국가로 승인하겠다는 방침을 밝힌 점에 맹비난을 퍼부었다. 쿠슈너는 “(프랑스 정부의 결정은) 극단주의자들을 포용하고 폭력을 조장하며 프랑스 내 유대인의 삶을 위협한다”고 지적했다. 쿠슈너는 제2차 세계대전 당시 나치 독일의 홀로코스트(유대인 대학살)를 피해 미국으로 건너간 동유럽 유대인의 후손이다. 그 점을 부각하려는 듯 그는 편지에서 “트럼프 대통령과 나는 유대인 자녀를 두고 있으며, 유대인 손자들을 공유하고 있다”고도 했다. 이에 프랑스 외교부는 성명에서 “프랑스는 쿠슈너 대사의 주장을 단호히 거부한다”며 “2023년 10월7일 팔레스타인 무장 정파 하마스의 이스라엘 공격 이후 반유대주의 범죄가 증가함에 따라 프랑스 당국은 이 참을 수 없는 행위에 대처하기 위해 만전을 기하고 있다”고 밝혔다. 이어 “쿠슈너 대사의 언행은 외국 내정에 간섭하지 말아야 할 대사의 의무를 위반한 것”이라며 “용납할 수 없다”고 질타했다. 하지만 미국 행정부는 쿠슈너를 전적으로 옹호하는 분위기다. 미 국무부 토미 피곳 대변인은 “우리는 쿠슈너 대사의 발언을 지지한다”며 “그는 프랑스에 주재하는 미국 정부의 대표로서, 자신의 임무에서 미국의 국익 증진에 커다란 역할을 하고 있다”고 말했다. 이날 프랑스 내무부에 따르면 올해 1월부터 6월까지 프랑스에서 기록된 반유대주의 행위는 646건으로, 지난해 같은 기간의 891건에 비해 감소했다. 그러나 이는 2023년 1월부터 6월까지 기록된 304건보다는 두 배 이상 많은 숫자다. 프랑스는 서유럽 국가들 중 가장 큰 규모의 유대인 공동체가 존재한다. 프랑스에 거주하는 유대인은 약 50만명으로 프랑스 전체 인구의 거의 1%에 해당한다. 부동산 개발업자 출신의 억만장자인 쿠슈너는 트럼프 1기 행정부 시절 백악관 선임 고문을 지낸 재러드 쿠슈너(44)의 부친이다. 2009년 재러드가 이방카와 결혼하며 트럼프와 사돈지간이 되었다.",2025-08-26 07:32:53,https://www.segye.com/newsView/20250826502295,세계일보
"우버, ‘월 4900원’ 택시 멤버십 출시… 카카오T와 구독 경쟁 가열",https://img.segye.com/content/image/2025/08/26/300/20250826512815.jpg,"우버 택시가 내달 멤버십 서비스를 국내 출시한다. 카카오T가 '카카오 T 멤버십' 공식 출시를 예고한 만큼 모빌리티 플랫폼 시장에도 구독 경쟁이 가열될 전망이다. 우버 택시는 26일 롯데호텔 서울에서 기자간담회를 열고 하반기 신규 서비스 론칭 계획과 상반기 성과를 발표했다. 송진우 우버 택시 코리아 총괄은 ""하반기에는 승객에겐 더 다양한 선택지를 기사에",2025-08-26 18:25:02,http://www.segye.com/newsView/20250826512493,세계일보
트럼프 “美 디지털기업 규제 국가에 추가 관세”,https://img.segye.com/content/image/2025/08/26/300/20250826517315.jpg,"도널드 트럼프 미국 대통령이 자국 디지털 기업을 규제하거나 과세하는 국가에 대해 대규모 추가 관세 부과, 반도체 수출 제한 등의 제재를 하겠다고 경고했다. 미국 정부가 온라인 플랫폼법 등 한국의 디지털 규제 완화를 꾸준히 요구하며 무역협상에서도 제기했다는 점에서 주목된다. 트럼프 대통령은 25일(현지시간) 사회관계망서비스(SNS) 트루스소셜에 “미국 대",2025-08-26 18:18:54,http://www.segye.com/newsView/20250826517092,세계일보
패션도 ‘말차 코어’가 대세?…Z세대 사이에서 유행한다는 ‘이것’,https://img.segye.com/content/image/2025/08/26/300/20250826518273.jpg,미국 Z세대를 중심으로 유행하고 있는 ‘말차 열풍’이 패션 업계까지 점령하고 있다. 26일 LF몰에 따르면 올여름 패션계 전반에서 그린 계열 아이템을 중심으로 한 ‘말차 코어 룩’이 대세로 자리잡고 있다. 그린 컬러의 채도나 명도를 조절하거나 은은한 톤을 가미한 다양한 아이템이 트렌드 키 아이템으로 부상하고 있는 것이다. 실제로 LF몰에서 지,2025-08-26 18:07:47,http://www.segye.com/newsView/20250826517682,세계일보
“여름배추 나는 건 기적”…강원 정선 현장 점검 나선 농수산식품유통공사,https://img.segye.com/content/image/2025/08/26/300/20250826517490.jpg,"한국농수산식품유통공사(aT)는 강원도 정선에서 기후변화 대응 신품종 육성, 재배적지 발굴과 여름배추 시범재배지를 연이어 점검했다고 26일 밝혔다. 강원 고랭지 지역의 배추 재배면적은 1996년 10793ha에 달했으나, 이후 감소세가 이어져 2023년에는 3395ha로 줄었다. 이에 aT는 국립원예특작과학원과 협력해 여름철 배추의 안정적 공급 기반 마련",2025-08-26 17:30:00,http://www.segye.com/newsView/20250826516913,세계일보
"“안심하라던 고위직 출신, 알고 보니 사기꾼”…전세사기 피해 110억",https://img.segye.com/content/image/2025/08/26/300/20250826517642.jpg,"전 부산시 고위공무원이 무자본 갭투자 방식으로 수십억 원대 전세사기를 벌인 혐의로 중형을 구형받았다. 검찰은 26일 부산지법 형사6부(재판장 김용균) 심리로 열린 결심공판에서 특정경제범죄가중처벌법 위반(사기) 혐의로 기소된 70대 남성 A씨에게 징역 12년을 선고해달라고 재판부에 요청했다. 검찰은 “피고인의 범행으로 피해자가 다수 발생했고, 피해액은 총",2025-08-26 17:26:09,http://www.segye.com/newsView/20250826517494,세계일보
"영양고추 넣은 ‘더핫 열라면’…오뚜기, 행안부·영양군과 MOU 체결",https://img.segye.com/content/image/2025/08/26/300/20250826512277.jpg,"오뚜기는 지난 25일 서울 코엑스에서 대한상공회의소 주최, 행정안전부 후원으로 열린 ‘대한민국 사회적가치 페스타’의 ‘지역·기업 상생 협력’ 세션에 참석해 경상북도 영양군과 상생 협력을 위한 업무협약(MOU)을 체결했다고 26일 밝혔다. 이번 협약은 지역 농가와의 상생을 강화하고, 특산물을 활용한 가치 소비 확대에 기여하기 위해 추진됐다. 행사에는 황성",2025-08-26 17:20:00,http://www.segye.com/newsView/20250826512235,세계일보
삼성전자 등 19개 계열사 공채 실시…“양질의 일자리 창출”,https://img.segye.com/content/image/2025/08/26/300/20250826516977.jpg,"삼성전자와 삼성물산, 삼성생명 등 19개 개열사가 오는 27일부터 2025년 하반기 공개채용에 나선다. 앞서 이재용 회장이 국내 양질의 일자리 창출과 고부가가치 산업 육성에 대한 의지를 밝힌 바 있다. 삼성은 오는 27일부터 계열사 19곳이 하반기 공채를 실시한다고 26일 밝혔다. 이번 하반기 공채에 참여하는 계열사는 △삼성전자 △삼성물산 △삼성바",2025-08-26 17:16:38,http://www.segye.com/newsView/20250826515506,세계일보
"누리미디어, 동국대학교 중앙도서관과 DBpia AI 구독 계약 체결",https://img.segye.com/content/image/2025/08/26/300/20250826516933.jpg,"누리미디어는 18일, 동국대학교 중앙도서관이 자사 인공지능 기반 학술연구 지원 서비스인 ‘DBpia AI’의 구독 계약을 체결했다고 밝혔다. 이번 계약을 통해 동국대학교 서울캠퍼스 소속 연구자와 학생들은 연구 주제 탐색부터 관련 논문 추천까지 연구 전 과정에서 인공지능의 도움을 받아 한층 더 정교하고 효율적인 학술 활동을 수행할 수 있게 됐다. DBpi",2025-08-26 16:57:20,http://www.segye.com/newsView/20250826516947,세계일보
"메디랩코리아, 프리미엄 중식 델리 브랜드 ‘js가든 델리’ 오픈",https://img.segye.com/content/image/2025/08/26/300/20250826516758.jpg,㈜메디랩코리아는 프리미엄 중식의 일상화를 위해 강남 유통의 주요 상권인 신세계 백화점 강남점에 js가든 델리를 오픈했다고 26일 밝혔다. 강남 신세계백화점 지하 1층에 입점한 js가든 델리는 중식당에서만 만날 수 있었던 정통 중식 요리들을 간편한 포장으로 경험할 수 있는 신규 델리 브랜드이다. js가든 델리에서 가장 심혈을 기울인 것은 바로 당일 조리,2025-08-26 16:52:25,http://www.segye.com/newsView/20250826516766,세계일보
"농심, 청소년 요리 경연대회 ‘고등셰프 라면전쟁’ 개최",https://img.segye.com/content/image/2025/08/26/300/20250826511351.jpg,"농심은 요리에 관심 있는 청소년들을 대상으로 요리 경연대회 ‘고등셰프; 라면전쟁’을 개최했다고 26일 밝혔다. 올해 처음 열리는 ‘고등셰프; 라면전쟁’은 남녀노소 누구나 즐기는 라면을 주제로, 고등학생 또는 2007∼2009년생 청소년이 농심 라면 제품을 활용해 자신만의 독창적인 요리 레시피를 선보이는 대회다. 대회는 온라인 예선과 오프라인 본선 두",2025-08-26 16:50:00,http://www.segye.com/newsView/20250826511343,세계일보
