title,thumbnail,short_content,write_time,link,company
"샤오미폰 선물받은 李 ""통신보안 되나?"" 習 ‘빵 터졌다’…무슨 일?",https://img.segye.com/content/image/2025/11/02/300/20251102500716.jpg,"시진핑 중국 국가주석은 1일 정상회담을 기념해 이재명 대통령에게 중국 브랜드인 샤오미 스마트폰과 문방사우 세트를 선물했다. 이 대통령과 시 주석은 이날 오후 경주에서 열린 정상회담을 마치고 선물을 주고받는 친교 시간을 가졌다. 이 대통령이 먼저 본비자나무로 제작된 바둑판과 조각 받침대, 나전칠기 자개원형쟁반을 선물로 건넸다. 시 주석은 바둑판을 만져보며",2025-11-02 06:16:25,http://www.segye.com/newsView/20251102500717,세계일보
"“핵추진잠수함 도입도 논의
中, 한반도 평화 위한 협력 용의 밝혀”",https://img.segye.com/content/image/2025/11/01/300/20251101507203.jpg,이재명 대통령과 시진핑 중국 국가주석의 한·중 정상회담에서 한국과 미국이 논의한 한국 핵추진참수함 도입을 포함한 다양한 안보 관련 논의가 있었다고 대통령실이 밝혔다. 중국은 남북 대화 재개를 위한 역할 요청에 한반도 평화와 안정을 위해 협력할 용의가 있다는 뜻을 밝혔다. 시 주석은 이 대통령의 중국 방문도 요청했다고 대통령실은 전했다. 위성락 대통령실,2025-11-01 22:35:10,http://www.segye.com/newsView/20251101506912,세계일보
100분 간의 한·중 정상회담… 위성락 “국익·실용 기반으로 한·중관계 전면 복원”,https://img.segye.com/content/image/2025/11/01/300/20251101507131.jpg,이재명 대통령은 1일 시진핑 중국 국가주석과 한·중 정상회담을 갖고 시대의 변화에 발맞춰 양국 간 협력관계의 성숙한 발전을 추구해나가자는 데에 뜻을 모았다. 이 대통령은 이날 경북 경주의 경주박물관에서 시 주석과 약 100분에 걸친 한·중 정상회담을 진행했다. 위성락 국가안보실장은 이날 정상회담 후 국제미디어센터(IMC)에서 진행한 브리핑에서 이날 회,2025-11-01 22:01:17,http://www.segye.com/newsView/20251101506854,세계일보
"[속보] 대통령실 “한중 정상, 미북 대화 중요하다는데 의견 일치”",https://img.segye.com/content/image/2025/11/01/300/20251101506898.jpg,"[속보] 대통령실 “한중 정상, 미북 대화 중요하다는데 의견 일치”",2025-11-01 21:08:10,http://www.segye.com/newsView/20251101506894,세계일보
"[속보] 시진핑, 李대통령 중국 방문 요청",https://img.segye.com/content/image/2025/11/01/300/20251101506823.jpg,"[속보] 시진핑, 李대통령 중국 방문 요청",2025-11-01 20:38:14,http://www.segye.com/newsView/20251101506822,세계일보
여야 입모아 APEC 성공 개최 환영…“후속조치 협력” 약속,https://img.segye.com/content/image/2025/11/01/300/20251101506657.jpg,"2025 아시아태평양경제협의체(APEC·에이펙) 정상회의 폐막일인 1일 여야가 한목소리로 에이펙의 성공적인 개최를 환영했다. 올해 에이펙의 3대 중점과제인 연결·혁신·번영을 중심으로 무역·투자, 디지털 혁신, 포용적 성장 등 내용이 담긴 ‘경주선언’을 에이펙 정상들이 채택한 것에 대해서도 여야 모두 협력을 약속했다. 더불어민주당 백승아 원내대변인은 이날",2025-11-01 20:07:14,http://www.segye.com/newsView/20251101506632,세계일보
[속보] 대통령실 “한중관계 전면 복원…국익·실용 기반 외교로”,https://img.segye.com/content/image/2025/11/01/300/20251101506658.jpg,"[속보] 대통령실 “한중관계 전면 복원…국익·실용 기반 외교로” [속보] 한중, 고위급 정례 소통채널 가동…전략적 소통 강화키로",2025-11-01 20:07:06,http://www.segye.com/newsView/20251101506652,세계일보
"한·중, 경제·문화·범죄대응 MOU 체결
원·위안 통화스와프도",https://img.segye.com/content/image/2025/11/01/300/20251101506542.jpg,"이재명 대통령이 1일 시진핑 중국 국가주석과 정상회담을 하고, 경제 및 문화, 범죄 대응 분야에 양해각서(MOU)를 체결했다. 양국 정상은 이날 경주국립박물관에서 한·중 양해각서 및 계약 교환식을 열고 6건의 MOU를 체결하고, 원·위안 통화스와프 계약도 체결했다. 대통령실에 따르면 양국은 한·중 간 호혜적 협력을 추진해 나가기 위한 장기적 방향",2025-11-01 19:51:19,http://www.segye.com/newsView/20251101506517,세계일보
[속보] 李대통령 “시주석과 흔들림 없이 평화의 길 나아가기로 뜻 모아”,https://img.segye.com/content/image/2025/11/01/300/20251101506478.jpg,"[속보] 李대통령 ""시주석과 흔들림 없이 평화의 길 나아가기로 뜻 모아""",2025-11-01 19:39:11,http://www.segye.com/newsView/20251101506477,세계일보
"나란히 '푸른 타이' 97분 첫 대좌
""협력"" 입 모아",https://img.segye.com/content/image/2025/11/01/300/20251101506260.jpg,"이재명 대통령과 시진핑 중국 국가주석의 첫 정상회담이 1일 오후 경주국립박물관에서 열렸다. 특히 회담에 앞서 열린 공식 환영식부터 전통 복장을 한 취타대가 등장, '신라의 천년 고도' 경주의 매력을 마음껏 뽐냈다. 오후 3시 35분께 오성홍기를 단 시 주석의 전용 의전 차량인 '훙치N701'이 취타대 '호위'를 받으며 박물관 입구에 모습을 드러냈",2025-11-01 19:04:29,http://www.segye.com/newsView/20251101506203,세계일보
한중 정상회담 [한강로 사진관],https://img.segye.com/content/image/2025/11/01/300/20251101506219.jpg,이재명 대통령이 1일 경북 경주 국립경주박물관에서 시진핑 중국 국가주석 국빈방문 공식환영식 및 한중 정상회담을 진행했다. 이어 양국 정상은 7개 분야의 경제협력 공동계획 양해 각서 교환식을 가졌다. 이어 친밀한 유대감을 형성하기 위한 친교일정에서 이 대통령은 시 주석에게 '본비자 바둑판'과 '나전칠기 자개원형쟁반'을 선물했다. 시 주석이 11년 전,2025-11-01 19:00:51,http://www.segye.com/newsView/20251101506221,세계일보
"李대통령, ‘국빈방한’ 시진핑 공식 환영식…첫 한중정상회담 개최",https://img.segye.com/content/image/2025/11/01/300/20251101506015.jpg,이재명 대통령이 1일 국빈 방한한 시진핑 중국 국가주석과 정상회담에 앞서 공식 환영식을 열었다. 시 주석이 국빈 자격으로 한국을 찾은 것은 2014년 이후 11년 만이다. 이 대통령은 이날 오후 국립경주박물관 천년미소관 앞에서 시 주석을 비롯한 중국 대표단을 맞이했다. 국립경주박물관은 지난 29일 도널드 트럼프 미국 대통령과의 정상회담이 열린 장소다.,2025-11-01 18:16:36,http://www.segye.com/newsView/20251101505980,세계일보
1박 2일 본회의 마무리…정상들 '옥빛 목도리' 두르고 '찰칵',https://img.segye.com/content/image/2025/11/01/300/20251101505831.jpg,"경북 경주에서 1박 2일 일정으로 열린 아시아태평양경제협력체(APEC) 정상회의 본회의 행사가 1일 공식 마무리됐다. 이 대통령은 이날 오전 열린 두 번째 세션을 마친 뒤 ""아태 지역의 새로운 이정표가 필요한 중차대한 시기에 대한민국이 APEC 의장국을 맡게 된 것은 큰 기쁨이고 영광이었다""며 ""적극적으로 지원해 준 지도자 여러분께 깊은 감사의 말씀을",2025-11-01 17:52:40,http://www.segye.com/newsView/20251101505830,세계일보
[속보] 한중 정상회담 종료…1시간 37분 동안 진행,https://img.segye.com/content/image/2025/11/01/300/20251101505860.jpg,[속보] 한중 정상회담 종료…1시간 37분 동안 진행,2025-11-01 17:51:03,http://www.segye.com/newsView/20251101505857,세계일보
"외교·통상 장관들, ‘경주선언’서 빠진 “WTO 중요성 인정” 공동성명",https://img.segye.com/content/image/2025/11/01/300/20251101505816.jpg,"아시아태평양경제협력체(APEC·에이펙) 외교·통상 장관들이 세계 무역을 활발하게 하기 위해 세계무역기구(WTO)의 중요성을 인정한다는 취지의 공동성명을 1일 채택했다. 도널드 트럼프 미국 대통령이 불편함을 드러내 온 ‘자유 무역’ 문구가 정상 단위 합의문인 ‘경주 선언’에서는 빠졌지만, 외교·통상 장관들의 공동성명에는 들어가면서 에이펙의 기본 정신은 지",2025-11-01 17:48:55,http://www.segye.com/newsView/20251101505817,세계일보
[속보] “어제 독감 주사”…3세 여아 숨져 경찰 수사,https://img.segye.com/content/image/2025/11/01/300/20251101506493.jpg,충북 청주 한 가정에서 3세 여아가 숨져 경찰이 수사에 나섰다. 1일 경찰과 소방당국 등에 따르면 이날 오전 9시 28분쯤 청주시 흥덕구 가경동 한 아파트에서 “거실에 누워있는 아이가 숨을 쉬지 않는다”는 신고가 접수됐다. 경찰과 소방당국이 현장에 출동했을 때 아이는 이미 숨을 거둔 상태였다. 조사 결과 아이의 몸에 멍 자국 등 학대 정황은 발견,2025-11-01 21:35:22,http://www.segye.com/newsView/20251101506359,세계일보
젠슨 황이 언급한 카이스트 “엔비디아와 AI 혁신 긴밀히 협력할 것”,https://img.segye.com/content/image/2025/11/01/300/20251101506520.jpg,"2025 아시아태평양경제협력체(APEC·에이펙) 현장을 찾은 젠슨 황 엔비디아 최고경영자(CEO)가 한국의 ‘우수한 대학’으로 한국과학기술원(카이스트)를 언급한 것에 대해 카이스트가 “엔비디아와 긴밀히 협력해 인공지능(AI) 혁신 생태계를 구축하겠다”고 화답했다. 카이스트는 1일 보도자료를 통해 “카이스트는 국가 AI 연구거점으로서 정부, 산업계와 협력",2025-11-01 19:48:28,http://www.segye.com/newsView/20251101506453,세계일보
“인천대교에 내려주세요”…택시기사 직감이 20대 투신 여성 살렸다,https://img.segye.com/content/image/2025/11/01/300/20251101504551.jpg,인천대교에서 택시 승객이 바다로 투신했다가 택시 기사의 신고로 현장에 신속히 도착한 구조대에 의해 구조됐다. 1일 인천광역시소방본부에 따르면 전날 오후 11시 8분쯤 인천대교 영종IC에서 연수분기점 방향으로 2km 지점 교량 위에서 택시 승객인 20대 여성 A씨가 투신했다는 신고가 접수됐다. 택시 기사는 승객이 해당 지점에서 하차를 요구해 내려줬지만,2025-11-01 18:58:28,http://www.segye.com/newsView/20251101504552,세계일보
“가을 끝났나?”…일요일 낮부터 찬바람 불며 체감온도 ‘뚝’,https://img.segye.com/content/image/2025/11/01/300/20251101505846.jpg,"일요일인 2일은 낮부터 추워지고 전국에는 가끔 구름이 많겠다. 해안가에는 바람이 강하게 불어 안전사고에 유의해야겠다. 1일 기상청에 따르면 북쪽의 찬 공기가 남하하면서 낮부터 기온이 떨어지며 바람도 강하게 불어 체감온도가 더욱 낮아지겠다. 새벽까지 강원동해안을 제외한 중부지방과, 전라권, 경상서부내륙에 비가 내리는 곳이 있겠다. 오전에는 고도 1",2025-11-01 17:48:21,http://www.segye.com/newsView/20251101505825,세계일보
마사지 업소 자리 기다리며 마셨다더니…CCTV에 드러난 진실 [사건수첩],https://img.segye.com/content/image/2025/11/01/300/20251101505682.jpg,음주운전에 적발되자 마사지 업소에 자리가 나기를 기다리면서 차 안에서 술을 마셨을 뿐이라고 항변한 50대 남성이 철창신세를 지게 됐다. 춘천지법 형사2부 김성래 부장판사는 도로교통법 위반(음주운전) 혐의로 기소된 A(50)씨에 대한 항소심에서 징역 1년을 선고한 원심을 유지했다고 1일 밝혔다. 공소사실에 따르면 A씨는 지난해 6월 19일 오후 10시,2025-11-01 17:47:37,http://www.segye.com/newsView/20251101505684,세계일보
시진핑 한마디에 ‘황남빵’ 동났다… APEC 현장서도 외신 사로잡은 ‘K컬처’,https://img.segye.com/content/image/2025/11/01/300/20251101505643.jpg,경주 아시아태평양경제협력체(APEC·에이펙) 정상회의 마지막 날인 1일. 전 세계 취재진이 모인 국제미디어센터(IMC) 간식 코너 한켠에 유독 많은 인파가 몰렸다. 시진핑 중국 국가주석이 전날 이재명 대통령과의 첫 대면에서 “선물 받은 황남빵을 맛있게 먹었다”는 감사 인사를 전하면서 취재진에게 간식으로 제공된 황남빵을 직접 맛보려는 이들의 발길이 이어진 것,2025-11-01 17:24:31,http://www.segye.com/newsView/20251101505612,세계일보
한·중정상회담 앞두고 경계강화…혐중시위 사전차단,https://img.segye.com/content/image/2025/11/01/300/20251101505500.jpg,"2025 아시아태평양경제협력체(APEC·에이펙) 정상회의 폐막일인 1일, 한·중정상회담을 앞둔 경주박물관 일대는 경찰과 경호처 직원들이 모든 출입을 통제하며 철통 경계가 유지됐다. 시진핑 중국 국가주석의 방한 전부터 혐중 집회에 대한 우려가 컸던 만큼 한·미정상회담 당시보다 경비가 강화됐다. 경찰에 따르면 이날 경주박물관 일대에는 차벽이 세워졌고 길마다 경",2025-11-01 16:39:54,http://www.segye.com/newsView/20251101505479,세계일보
'기습 시위' 막아라…회담장 850m 앞부터 '완전 통제',https://img.segye.com/content/image/2025/11/01/300/20251101505146.jpg,"""도보로도 이동이 불가하니 돌아가 주세요."" 1일 오후, 한중 정상회담이 진행된 경북 경주시 국립경주박물관 주변. 정상회담을 한시간여 앞둔 오후 2시 30분께 경주박물관 일대는 평소 주말의 시끌벅적한 분위기는 온데간데없는 모습이었다. 경주박물관으로 향하는 도로는 모두 통제된 상태로, 곳곳에 경찰과 경호처 직원들이 주변을 살피며 경비를 서고",2025-11-01 16:05:25,http://www.segye.com/newsView/20251101505145,세계일보
무면허 10대 킥보드 멈춰 세우려다 학생 다쳐…경찰관 형사처벌 위기,https://img.segye.com/content/image/2025/11/01/300/20251101505033.jpg,한 경찰관이 무면허로 전동킥보드를 타던 고등학생을 단속하던 중 이들을 넘어뜨려 다치게 한 혐의로 검찰에 넘겨졌다. 1일 경찰에 따르면 인천경찰서 형사기동대는 최근 업무상 과실치상 혐의로 인천 한 경찰서 소속 A 경사를 불구속 입건해 검찰에 송치했다. A경사는 지난 6월 13일 오후 2시 45분쯤 인천시 부평구에서 전동킥보드를 타던 고등학생 B군을 넘어뜨,2025-11-01 15:12:34,http://www.segye.com/newsView/20251101504711,세계일보
[속보] 한 달간 운항 중단됐던 한강버스...정식 재개,https://img.segye.com/content/image/2025/11/01/300/20251101504974.jpg,지난 9월 29일부터 운항이 중단됐던 한강버스가 1일 운항이 재개됐다. 서울시는 이날 오전 9시부터 정상적으로 시민이 탑승해 운항을 다시 시작했다고 밝혔다. 한강버스는 안전성 확보와 품질 개선을 위해 한 달간 운항이 중단됐었다. 첫 출항지인 잠실과 마곡 선착장에서는 시민이 41명과 26명이 각각 탑승했다. 시는 한 달여 훈련 기간에 안전성은 물론 접,2025-11-01 15:21:02,http://www.segye.com/newsView/20251101504939,세계일보
‘음주운전 4차례’ 처벌받고도 또 음주운전… 결국 '철장 신세' [사건수첩],https://img.segye.com/content/image/2025/11/01/300/20251101503930.jpg,음주운전으로 4차례에 걸쳐 처벌을 받았음에도 또 술을 마시고 운전대를 잡았다가 도로에서 잠든 40대가 결국 철창신세를 지게 됐다. 춘천지법 형사2부 김성래 부장판사는 도로교통법위반(음주운전) 혐의로 기소된 A(43)씨에 대한 항소심 결심공판에서 징역 1년 6개월을 선고한 원심을 그대로 유지했다고 1일 밝혔다. 공소사실에 따르면 지난 1월 25일 오후,2025-11-01 13:24:00,http://www.segye.com/newsView/20251101503931,세계일보
초등생 아들에 흉기 들이댄 50대 친부…“오토바이 절도·담임과 말다툼해서” [사건수첩],https://img.segye.com/content/image/2025/11/01/300/20251101504250.jpg,오토바이를 훔치고 담임교사와 말다툼 했다는 이유로 초등학생 아들을 흉기로 위협한 50대 친부가 법의 심판을 받았다. 춘천지법 형사1단독 송종환 부장판사는 아동복지법위반(아동학대)과 특수협박 혐의로 기소된 A(59)씨에게 징역 6개월에 집행유예 2년을 선고했다고 1일 밝혔다. 또 아동학대 재범예방강의 40시간 수강과 3년간 아동 관련기관 취업제한을 명,2025-11-01 13:06:38,http://www.segye.com/newsView/20251101503850,세계일보
"경찰, 캄보디아 범죄조직 수상한 코인거래 포착…업비트 압수수색",https://img.segye.com/content/image/2025/11/01/300/20251101504235.jpg,캄보디아 범죄조직의 자금세탁처로 알려진 후이원그룹과 국내 거래소 업비트 간 수상한 가상자산 거래를 경찰이 추격하고 있다. 후이원그룹은 한국인을 대상으로 한 캄보디아 범죄조직 프린스그룹의 자금세탁처로 국제사회에서 금융제재를 받고 있는 기업으로 북한 해킹그룹 라자루스와도 밀접한 관련이 있는 것으로 알려졌다. 서울경찰청 안보수사과는 지난달 15일 업비트를 압,2025-11-01 19:46:58,http://www.segye.com/newsView/20251101503791,세계일보
한강버스 운항 재개 첫날 시민사회단체 활동가들 반대 시위,https://img.segye.com/content/image/2025/11/01/300/20251101503486.jpg,"서울시 한강버스가 시민 탑승 운항을 재개한 1일 시민사회단체들이 한강버스 선착장에서 운항 중단을 촉구하는 시위를 벌였다. 전국민주노동조합총연맹(민주노총) 서울본부와 서울환경연합 등은 이날 오전 9시께 성동구 한강버스 옥수 선착장에 모여 ""혈세 낭비 한강버스 한강을 떠나라"", ""시민 생명 위협하는 한강버스 한강을 떠나라"" 등 구호를 외쳤다. 이들은",2025-11-01 11:08:59,http://www.segye.com/newsView/20251101503485,세계일보
"‘죽음의 다리’ 오명 인천대교서 또 투신… 20대女, 택시기사 신고로 살렸다",https://img.segye.com/content/image/2025/11/01/300/20251101503476.jpg,인천대교에서 택시 승객이 바다로 투신했다가 택시 기사의 신고로 현장에 신속히 도착한 구조대에 의해 구조됐다. 1일 인천광역시소방본부에 따르면 전날 오후 11시 8분쯤 인천대교 영종IC에서 연수분기점 방향으로 2km 지점 교량 위에서 택시 승객인 20대 여성 A씨가 투신했다는 신고가 접수됐다. 택시 기사는 승객이 해당 지점에서 하차를 요구해 내려줬,2025-11-01 11:06:58,http://www.segye.com/newsView/20251101503496,세계일보
세종문화회관서 펼쳐질 이집트 장군의 개선행진… 서울시오페라단의 ‘아이다’,https://img.segye.com/content/image/2025/10/31/300/20251031506459.jpg,"베르디 만년의 걸작 오페라 ‘아이다’가 11년 만에 서울시오페라단 창단 40주년 기념작으로 세종문화회관 대극장 무대에 오른다. 대규모 합창과 관현악, 발레, 무대장치 등 오페라 예술의 모든 장르적 요소가 집대성되며 ‘오페라 예술의 최정점’으로 여겨지는 작품이다. 박혜진 서울시오페라단장은 지난 21일 제작발표회에서 ""국가와 개인 간의 갈등 그리고 비극적",2025-11-02 06:29:36,http://www.segye.com/newsView/20251031506460,세계일보
'직업 예술가' 20만명 돌파… 제도적 보호 기반 안착,https://img.segye.com/content/image/2025/10/31/300/20251031503655.jpg,문화체육관광부 산하 한국예술인복지재단은 예술활동증명 누적 완료자가 20만 명(2025년 10월 5주차 기준)을 돌파했다고 밝혔다. 예술활동증명은 ‘예술인 복지법’ 제2조에 따라 예술인이 직업적으로 예술활동을 하고 있음을 확인하는 제도다. 각종 예술인 복지사업에 참여하기 위한 기본 절차다. 직업예술가 20만명 등록은 2012년 11월 예술인복지재단 설립,2025-11-02 06:26:57,http://www.segye.com/newsView/20251031503656,세계일보
"“감기인 줄 알았다”…백성문 변호사 떠난 뒤, 희귀암 ‘부비동암’ 경각심 커진다",https://img.segye.com/content/image/2025/11/02/300/20251102500662.jpg,"활발한 방송 활동으로 얼굴을 알렸던 고(故) 백성문(52) 변호사의 별세 소식이 전해지며, 그가 투병했던 ‘부비동암(Paranasal sinus cancer)’에 대한 사회적 관심이 커지고 있다. 희귀암으로 분류되는 부비동암은 초기 증상이 일반 비염이나 감기와 유사해 조기 발견이 어려운 질환이다. ◆희귀하지만 ‘치명적’…“단순 비염인 줄 알았는데”",2025-11-02 06:05:52,http://www.segye.com/newsView/20251102500660,세계일보
[재미로 보는 오늘의 운세] 11월 2일 (일요일) 띠별 운세,https://img.segye.com/content/image/2025/10/30/300/20251030520461.jpg,쥐 96년생 똑같은 말도 표현방법에 따라 달라진다. 84년생 멋이란 자기 개성에 어울려야 한다. 72년생 취미와 일상생활을 명확하게 구분하라. 60년생 지금 이 순간부터가 시작이라고 생각하라. 48년생 오늘만 날이 아니니 다음을 생각하라. 36년생 집안에 있어도 밖을 나가도 마음이 편치 않다. 소 97년생 힘들면 힘들다고 이야기하는 것이 유리하다. 8,2025-11-01 18:00:00,http://www.segye.com/newsView/20251030518865,세계일보
"담배 유해성분, 내년 하반기부터 전면 공개돼",https://img.segye.com/content/image/2025/11/01/300/20251101503484.jpg,내년 하반기부터 담배 속 유해 성분 정보를 확인할 수 있다. 1일 식품의약안전처와 보건복지부는 담배에 포함된 유해 성분의 분석 및 정보공개 등을 주요 내용으로 하는 ‘담배의 유해성 관리에 관한 법률’이 1일 시행됐다고 밝혔다. 이 법은 담배의 유해성에 관한 국민의 알 권리를 보장하고 담배의 위해(危害)로부터 국민 건강을 보호하기 위한 목적으로 담배,2025-11-01 13:23:08,http://www.segye.com/newsView/20251101503343,세계일보
"짧지만 완전한 이야기, ‘위픽’이 쌓은 100개의 우주",https://img.segye.com/content/image/2025/10/31/300/20251031515156.jpg,"‘단 한 편의 이야기’라는 슬로건으로 2023년 3월 출발한 위즈덤하우스의 단편소설 시리즈 ‘위픽’이 이달로 100권을 발간했다. ‘한 편의 단편소설이 한 권의 책이 될 수 있을까?’ 하는 세간의 의심 섞인 물음에 답하듯, 시리즈는 한국문학의 흐름을 응축하는 한편 디지털 시대 한국문학 독자들이 짧지만, 물성 있는 문학 작품을 원한다는 사실을 드러냈다.",2025-11-01 09:00:37,http://www.segye.com/newsView/20251031515157,세계일보
이쑤시개 하나로 시작된 유물 복원…이제 3D스캔·AI로 역사를 되살린다 [밀착취재],https://img.segye.com/content/image/2025/10/29/300/20251029514663.jpg,"지난 28일 찾은 서울 용산구 국립중앙박물관. 관람객 500만명을 돌파한 명성에 걸맞게 평일 오전임에도 이곳은 활기찼다. 박물관 열린마당 옆 에스컬레이터를 타고 내려가 약 3분 정도 걷자, 상설전시관 뒤편에 자리한 보존과학센터가 모습을 드러냈다. 소란스러웠던 상설전시관과 달리 이곳은 조용했다. 이날 국립중앙박물관 보존과학센터의 개관식이 열렸다. 1976",2025-11-01 07:00:00,http://www.segye.com/newsView/20251029514437,세계일보
“조선의 흥망성쇠를 품은 강”…고문헌 속 ‘한반도 물길’,https://img.segye.com/content/image/2025/10/31/300/20251031504029.jpg,"한국국학진흥원은 전통시대 한반도의 강(江)이 지닌 복합적인 의미를 조명하는 ‘웹진 담(談) 11월호’를 발행했다고 1일 밝혔다. 이번 호 ‘강(江) 나누고 잇다’는 강이 단순한 지리적 경계를 넘는 점에 주목한다. 경제적 부와 문화적 소통의 통로이자 때로는 자연의 경고와 비극을 담는 매개체였음을 입체적으로 조명하고 있다. ◆한강·낙동강, 조선 경제와 문화",2025-11-01 06:24:08,http://www.segye.com/newsView/20251031504030,세계일보
"음료에 ‘밥알이 동동’?…호불호 갈리던 ‘이 음료’, 외국인이 더 열광한다는데 [FOOD+]",https://img.segye.com/content/image/2025/10/27/300/20251027514442.jpg,"세계적으로 웰빙(well-being) 트렌드가 확산하면서 ‘식혜’가 주목받고 있다. ‘동동’ 떠다니는 밥알이 씹히는 독특한 식감과 발효 과정에서 우러나는 은은한 단맛, 곡물의 고소함이 어우러져 예부터 식혜는 명절날이나 잔칫날 빼놓을 수 없던 음식으로 여겨졌다. 최근엔 ‘한라봉 식혜’ ‘녹차 식혜’등 다양한 식혜가 출시돼 사계절 내내 즐겨 먹는 음료로 사랑받",2025-11-01 06:14:19,http://www.segye.com/newsView/20251027513529,세계일보
