title,thumbnail,short_content,write_time,link,company
"오픈AI, ‘이미지 보고 추론 가능’ 새 AI모델 ‘o3’ 출시",https://img.segye.com/content/image/2025/04/17/300/20250417505322.jpg,"챗GPT 개발사 오픈AI가 16일(현지시간) 새로운 인공지능(AI) 모델인 ‘o3’와 소형 모델인 ‘o4 미니’를 출시했다. 새로 출시한 모델은 이용자 질문에 추론하는 것을 넘어 이미지를 보고 생각하는 추론 기능이 포함됐다. 이번에 출시한 ‘o3’는 복잡한 문제를 해결하고 여러 단계에 걸쳐 답변을 추론하는 데 중점을 두고 지난해 9월 출시된 오픈AI의 첫 번째 추론 모델 o1의 후속 모델이다. ‘o3’는 오픈AI의 가장 정교한 추론 모델로, 수학·코딩·추론·과학·시각적 이해 능력을 측정하는 테스트에서 이전 모델들을 능가했다고 오픈AI측은 설명했다. 또 오픈AI는 ‘o4미니’는 가격과 속도, 성능 사이에 균형을 추구하는 모델이라도 덧붙였다. 특히 오픈AI는 이들 모델이 AI가 이미지를 보고 “생각할 수 있는 자사의 첫 모델”이라며 “단순히 이미지를 보는 것이 아니라 시각 정보를 추론 과정에 직접 통합할 수 있다는 의미”라고 설명했다. ‘o3’ 모델은 이용자가 화이트보드나 그림, 도표 등 다양한 이미지를 올리면 이를 분석 가능하다. 이용자가 올린 흐릿하거나 품질이 낮은 이미지도 이해할 수 있고, 이미지를 확대하거나 회전시키며 작업을 수행할 수 있다. 또한 새로운 모델은 이미지 분석 외에도 브라우저 내에서 직접 파이선 코드를 실행한다. 아울러 현재 사건에 대해 웹 검색도 수행 가능하다. 새로 출시된 ‘o3’와 ‘o4미니’ 모델은 이날부터 챗GPT 플러스와 프로, 팀 등 유료 고객들에게 제공된다. 또 응답의 신뢰도를 높이기 위해 더 많은 시간을 들여 답변을 만드는 ‘o4 미니 하이(hihg)’ 버전도 제공된다. 이밖에 오픈AI는 향후 몇 주 내로 ‘o3’의 상위 버전인 ‘o3-프로’ 모델을 챗GPT 프로 가입자용으로도 출시할 계획이다. 이 모델은 ‘o3’ 보다 한층 정교한 응답을 생성 가능하다. 샘 올트먼 오픈AI 최고경영자(CEO)는 “o3와 o4 미니는 GPT-5 출시 전까지 마지막 독립형 AI 추론 모델이 될 수 있다”고 밝혔다.",2025-04-17 09:55:48,https://www.segye.com/newsView/20250417505221,세계일보
"“골드바 사자”… 5대銀 1분기 판매, 2024년 총액 넘어",https://img.segye.com/content/image/2025/04/17/300/20250417517828.jpg,국제 금값이 온스당 3300달러를 돌파하며 사상 최고가를 다시 썼다. 미국의 관세정책이 야기한 불확실성 확대로 안전자산인 금 수요가 높아지면서 한때 국내에서 품귀 현상을 빚었던 골드바 판매량은 이미 지난해 전체 판매량을 훌쩍 넘어섰다. 금 선물 가격은 지난 16일(현지시간) 뉴욕상품거래소(COMEX)에서 장중 온스(oz)당 3355.10달러에 거래되며 사상,2025-04-17 18:27:35,http://www.segye.com/newsView/20250417516094,세계일보
"농협목우촌, 한입에 쏙! 주부9단 신제품 팝콘치킨 출시",https://img.segye.com/content/image/2025/04/17/300/20250417517369.jpg,"농협(회장 강호동)목우촌이 한입에 쏙 들어오는 크기로 간편하게 온 가족이 함께 즐길 수 있는 신제품 ’팝콘치킨’을 출시했다. 신제품 ’팝콘치킨’은 100% 국산 닭 가슴살을 사용해 담백하고 부드러운 식감을 자랑하며, 국산 꿀과 쌀가루로 감칠맛은 더하고 바삭함과 고소함을 살렸다. 또한 함께 제공되는 양념치킨소스를 곁들이면 기호에 따라 더욱 풍부한 맛을 즐",2025-04-17 17:51:25,http://www.segye.com/newsView/20250417517385,세계일보
"남해화학, 초저탄소암모니아 비료 제조 활용",https://img.segye.com/content/image/2025/04/17/300/20250417517219.jpg,"남해화학(대표이사 김창수)은 15일 사우디아라비아 글로벌 화학 기업 Ma'aden(마덴)으로부터 도입한 초저탄소암모니아(ULCA, Ultra Low Carbon Ammonia)를 비료 제조에 활용한다고 밝혔다. 초저탄소암모니아(ULCA)는 기존 화석연료를 기반으로 한 암모니아보다 온실가스 배출을 획기적으로 줄인 친환경 원료로, 비료 생산 과정에서 탄소",2025-04-17 17:48:25,http://www.segye.com/newsView/20250417517241,세계일보
"이스타항공, 승무원 체력시험 도입 훈련 교관 체력 측정",https://img.segye.com/content/image/2025/04/17/300/20250417516713.jpg,17일 서울 마포구 망원동 마포체력인증센터에서 이스타항공 승무원 훈련 교관들이 첫 승무원 체력시험 도입을 앞두고 체력 측정 및 훈련을 하고 있다. 이스타항공(대표 조중석)은 차주 있을 신입 객실 승무원 체력 시험 전형을 앞두고 교관 등 현직 승무원들이 직접 체력시험을 진행하며 전형을 최종 점검했다. 이스타항공은 이번 채용부터 객실 승무원의 기내 안전 요원,2025-04-17 17:41:28,http://www.segye.com/newsView/20250417516716,세계일보
"농협경제지주, 이웃사랑 실천 봉사활동 실시",https://img.segye.com/content/image/2025/04/17/300/20250417516848.jpg,농협(회장 강호동) 경제지주(농업경제대표이사 박서홍)는 14일 서울 서대문구에 위치한 한부모가족 복지시설‘애란원’을 찾아 주거환경 개선 봉사활동을 진행했다. 이날 활동에는 정승일 경제기획본부장을 비롯한 임직원 15여명이 참여하였다. 이들은 생활관 곳곳을 깨끗하게 청소하고 주변 환경을 정비하며 미혼모자 가정이 보다 쾌적한 환경에서 생활할 수 있도록 힘을,2025-04-17 17:23:05,http://www.segye.com/newsView/20250417516903,세계일보
"태남생활건강 - OATC, 피부 과학 기반 미래 뷰티 시장 선도 위한 전략적 협약 체결",https://img.segye.com/content/image/2025/04/17/300/20250417516805.jpg,"태남생활건강㈜과 임상시험 전문기업 ㈜오에이티씨(OATC)는 '피부 과학, 미래 뷰티 시장을 선도하기 위한 동행'이라는 주제로 17일(목) 업무협약(MOU)을 체결했다. 이번 협약은 과학적 검증과 혁신적 제품 개발을 위한 전략적 파트너십 구축을 목표로 한다. 양사는 고기능성 화장품의 연구 개발, 피부과학 기반 효능 검증, 지속 가능한 원료 활용 등 미래 뷰티",2025-04-17 17:21:07,http://www.segye.com/newsView/20250417516824,세계일보
“이럴 줄 알았으면 설 전에 살 걸”…서울 아파트값 11주째 상승,https://img.segye.com/content/image/2025/04/17/300/20250417516678.jpg,“2월에 살까 말까 망설이다가 안 샀거든요. 이럴 줄 알았으면 그냥 설 전에 계약할걸…” 서울 동작구 사당동의 한 중개업소를 찾은 40대 박모 씨는 최근 단지 시세가 1억 원 가까이 오르자 뒤늦게 아쉬움을 토로했다. 서울 아파트값이 11주 연속 오르며 시장이 다시 상승 흐름을 보이고 있다. 17일 한국부동산원이 발표한 ‘4월 둘째 주 주간 아파트,2025-04-17 17:16:56,http://www.segye.com/newsView/20250417514479,세계일보
“부동산은 한 채면 충분”…‘주식·코인’ 영리치 vs ‘예금·채권’ 올드리치,https://img.segye.com/content/image/2025/04/17/300/20250417515735.jpg,"“지금은 굳이 여러 채를 가질 이유가 없다. 집 한 채로 충분하다” 서울 강남권에 거주하며 30억 원대 자산을 운용하는 40대 A씨는 최근 서울 외 지역의 부동산 매물을 정리하고, 대신 미국 ETF와 외화 채권 투자를 늘렸다. 그는 “시장에 대한 낙관보다 유동성과 분산이 더 중요해졌다”고 말했다. 17일 하나금융경영연구소의 ‘2025 대한민국 웰",2025-04-17 16:54:52,http://www.segye.com/newsView/20250417515593,세계일보
"루미네이트-크리에이터스네트워크, 한국 음악 산업 데이터 협력 맞손",https://img.segye.com/content/image/2025/04/17/300/20250417515248.jpg,"2025년 4월 16일, 로스앤젤레스 글로벌 엔터테인먼트 데이터 기업 ‘루미네이트(Luminate)’는 대한민국 서울에 본사를 둔 음악 데이터 전문 기업 크리에이터스네트워크(KreatorsNetwork)와 한국 시장 내 독점 파트너십을 공식 발표했다. 이번 파트너십을 통해 크리에이터스네트워크는 루미네이트의 통합 음악 스트리밍 데이터, 소비자 인사이트,",2025-04-17 16:30:09,http://www.segye.com/newsView/20250417515254,세계일보
“이거면 내 머리도 풍성?” 믿고 싶은 마음은 알지만…식약처 “효과 인정된 식품 없어”,https://img.segye.com/content/image/2025/04/14/300/20250414512845.jpg,"“머리카락 나고 속눈썹 길어지는 건 이제 입 아파서 얘기 안 해요~” 탈모 예방에 효과가 있다며 식품과 건강기능식품(건기식)을 부당 광고·판매한 게시물이 식품의약품안전처에 대거 적발됐다. 14일 식약처는 식품 또는 건기식을 탈모 예방 등으로 광고·판매하는 온라인 게시물을 집중 점검한 결과, 식품 등의 표시·광고에 관한 법률을 위반한 192건을 적발했다고",2025-04-17 16:21:52,http://www.segye.com/newsView/20250414505769,세계일보
