title,thumbnail,short_content,write_time,link,company
생명의 철학적 성찰 ‘변태’ 개념으로 분석,https://img.segye.com/content/image/2025/06/12/300/20250612518792.jpg,"메타모르포시스/ 에마누엘레 코치아/ 이아름 옮김/ 에코리브르/ 1만8000원 ‘식물의 삶’으로 잘 알려진 이탈리아 출신 철학자의 신작. 생명과 존재, 정체성에 대한 철학적 성찰을 ‘변태’라는 개념으로 풀어낸다. 곤충이 고치 속에서 전혀 다른 생명으로 태어나는 생물학적 현상에서 출발한 개념이다. 저자는 “인간을 비롯한 모든 종은 이전 생명체의 변태다”라고 말",2025-06-14 06:00:00,http://www.segye.com/newsView/20250612514036,세계일보
매혹과 선전… ‘한국 영화의 통치학’ 탐구,https://img.segye.com/content/image/2025/06/12/300/20250612518539.jpg,"영화, 그 매혹의 정치 - 현대적 주체성의 구성과 한국 대중영화 1919∼1979/ 김청강/ 책과함께/ 3만3000원 한국의 대중영화가 근현대 대중과 어떠한 영향을 주고받으며 형성되어 왔는지 살펴본다. 20세기 초반부터 1970년대까지 ‘매혹’과 ‘선전성’이 강한 영화들을 중심으로 영화와 국가 통치성 사이를 추적한다. ‘매혹’이 자본주의 방식으로 관",2025-06-14 06:00:00,http://www.segye.com/newsView/20250612514091,세계일보
"의료사고, 시스템 오류·의료 문화 한계 속 벌어진 비극",https://img.segye.com/content/image/2025/06/12/300/20250612518565.jpg,"의료 사고를 일으키는 의사들/ 대니엘 오프리/ 고기탁 옮김/ 사람의집/ 2만5000원 1984년 하버드대 연구자들은 1년간 뉴욕주에 있는 51개 병원에서 무작위로 3만121개의 차트를 선별했다. 이를 통해 치료과정에서 의도되지 않은 상해로 규정한 이상 반응 횟수, 이른바 ‘의료 사고’를 확인했다. 그 결과 입원 치료의 3.7%가 의료 상해로 드러났",2025-06-14 06:00:00,http://www.segye.com/newsView/20250612514104,세계일보
“약보다 낫다?”…암 환자 사망률 37% 낮춘 ‘이것’의 정체,https://img.segye.com/content/image/2025/06/13/300/20250613513660.jpg,꾸준한 운동이 암 환자의 재발을 막고 사망률을 낮추는 데 있어 일부 약물보다 더 효과적이라는 연구 결과가 나왔다. 캐나다 킹스턴의 퀸스대학교 연구팀은 대장암 3기 환자들을 대상으로 장기간에 걸쳐 실시한 운동 프로그램의 효과를 분석한 결과를 14일 국제 학술지 뉴잉글랜드 의학저널(NEJM)에 발표했다. 연구를 이끈 크리스토퍼 부스 종양학과 교수는 이,2025-06-14 05:24:51,http://www.segye.com/newsView/20250611503835,세계일보
"15년간 폐암 추적해보니… 발생률 상승↑, 5년 생존율 2배↑",https://img.segye.com/content/image/2025/06/13/300/20250613513700.jpg,국내 사망률 1위인 폐암 발생률이 최근 15년 동안 상승했지만 생존율은 개선된 것으로 나타났다. 폐암 환자 10명 중 6명 이상은 60~79세에 발생했다. 13일 국민건강보험공단과 대한폐암학회가 2008∼2023년 20세 이상 의료급여 및 건강보험 자격 유지자의 데이터를 토대로 공동 발간한 ‘2024 폐암백서’에 따르면 국내폐암 조발생률은 2008년 0,2025-06-13 23:00:00,http://www.segye.com/newsView/20250613513510,세계일보
"예스24, 해킹 ‘먹통’ 닷새 만에 도서·티켓 등 일부 서비스 재개",https://img.segye.com/content/image/2025/06/13/300/20250613514416.jpg,"해킹으로 마비된 인터넷서점 예스24의 일부 서비스가 닷새 만에 재개됐다. 예스24는 13일 공지를 통해 도서, 티켓 등 일부 서비스를 재개했다고 밝혔다. 현재 가능한 서비스는 도서 및 음반·DVD·문구·기프트 구매, 주문 결제, 1:1문의, 티켓 서비스 등이다. 전자책, 웹서재, 매장상품 검색, 리뷰 검색, 원클릭 구매 등의 기능은 복구되지 않았다.",2025-06-13 18:51:16,http://www.segye.com/newsView/20250613514333,세계일보
[재미로 보는 오늘의 운세] 6월 14일 (토요일) 띠별 운세,https://img.segye.com/content/image/2025/06/12/300/20250612517675.jpg,쥐 96년생:구체적인 대안없이 일하면 꼬인다. 84년생:한번으로 되리라 기대말 것. 72년생:북서방에서 활동하면 덕이오다. 60년생:상사와 일에 뜻을 맞추어라 48년생:여행사 운수업 통신업은 광고에 성과가 있다. 36년생: 금전거래는 후에 미루어라 소 97년생:사사로운 마찰로 여러 사람이 피곤해진다. 85년생:새로운 일이나 인연에 관심,2025-06-13 18:00:00,http://www.segye.com/newsView/20250612513891,세계일보
‘공황장애’ 약 먹고 운전하면 위험?…전문가들 “문제 없어” [건강+],https://img.segye.com/content/image/2025/06/13/300/20250613511575.jpg,"최근 약물을 복용하고 차량을 운전한 혐의로 경찰 조사를 받은 개그맨 이경규씨가 공황장애 약을 처방받았다고 밝히며, 해당 질병에 대한 관심이 커지고 있다. 정신건강의학과 전문가들은 공황장애 약물의 경우, 오남용을 막기 위해 마약류 검사키트에 포함돼 있는 경우가 있는 만큼, 정상적인 처방약을 먹어도 마약류 양성이 나타날 수 있다고 설명했다. 다만 처방에 따",2025-06-13 15:42:13,http://www.segye.com/newsView/20250613511470,세계일보
[포토] 지드래곤 '40분 지각',https://img.segye.com/content/image/2025/06/13/300/20250613515060.jpg,가수 지드래곤이 13일 오후 서울 용산구 그랜드 하얏트 서울에서 열린 한 주류 브랜드 포토콜 행사에 참석해 포즈를 취하고 있다.,2025-06-13 20:21:25,http://www.segye.com/newsView/20250613515080,세계일보
[포토] 지드래곤 '40분 지각에 플래시 세례',https://img.segye.com/content/image/2025/06/13/300/20250613515045.jpg,가수 지드래곤이 13일 오후 서울 용산구 그랜드 하얏트 서울에서 열린 한 주류 브랜드 포토콜 행사에 참석해 포즈를 취하고 있다.,2025-06-13 20:14:39,http://www.segye.com/newsView/20250613515046,세계일보
[포토] 지드래곤 '사이버트럭 타고 40분 지각',https://img.segye.com/content/image/2025/06/13/300/20250613515008.jpg,가수 지드래곤이 13일 오후 서울 용산구 그랜드 하얏트 서울에서 열린 한 주류 브랜드 포토콜 행사에 참석하고 있다.,2025-06-13 20:10:21,http://www.segye.com/newsView/20250613515013,세계일보
[포토] 지드래곤 '늦어서 죄송합니다',https://img.segye.com/content/image/2025/06/13/300/20250613514976.jpg,가수 지드래곤이 13일 오후 서울 용산구 그랜드 하얏트 서울에서 열린 한 주류 브랜드 포토콜 행사에 참석하고 있다.,2025-06-13 20:05:16,http://www.segye.com/newsView/20250613514981,세계일보
[포토] 지드래곤 '사이버트럭과 함께',https://img.segye.com/content/image/2025/06/13/300/20250613514957.jpg,가수 지드래곤이 13일 오후 서울 용산구 그랜드 하얏트 서울에서 열린 한 주류 브랜드 포토콜 행사에 참석해 포즈를 취하고 있다.,2025-06-13 20:02:52,http://www.segye.com/newsView/20250613514964,세계일보
[포토] 지드래곤 '멋짐 폭발',https://img.segye.com/content/image/2025/06/13/300/20250613514935.jpg,가수 지드래곤이 13일 오후 서울 용산구 그랜드 하얏트 서울에서 열린 한 주류 브랜드 포토콜 행사에 참석해 포즈를 취하고 있다.,2025-06-13 19:59:32,http://www.segye.com/newsView/20250613514937,세계일보
[포토] 지드래곤 '미소 천사',https://img.segye.com/content/image/2025/06/13/300/20250613514914.jpg,가수 지드래곤이 13일 오후 서울 용산구 그랜드 하얏트 서울에서 열린 한 주류 브랜드 포토콜 행사에 참석해 포즈를 취하고 있다.,2025-06-13 19:58:53,http://www.segye.com/newsView/20250613514933,세계일보
[포토] 지드래곤 '사이버트럭과 함께',https://img.segye.com/content/image/2025/06/13/300/20250613514906.jpg,가수 지드래곤이 13일 오후 서울 용산구 그랜드 하얏트 서울에서 열린 한 주류 브랜드 포토콜 행사에 참석해 포즈를 취하고 있다.,2025-06-13 19:56:21,http://www.segye.com/newsView/20250613514078,세계일보
"사랑 찾고 행복한 줄만 알았던 ‘싱글맘’ 김나영, 24억 날리고 서울 떠난 사연",https://img.segye.com/content/image/2025/06/09/300/20250609511813.jpg,"2015년 4월, 많은 사람들의 축복 속에 금융계 종사자인 남편과 결혼식을 올렸던 방송인 김나영. 하지만 남편이 200억대의 부당이득을 취득한 혐의로 구속돼 사회적 파장을 일으킨 이후인 2019년 1월, 두 아들을 김나영이 양육한다는 조건 하에 이혼을 발표하며 세간을 놀라게 했다. 결혼 4년 만에 마침표를 찍은 김나영은 두 아들을 키우며 홀로의 삶을 사",2025-06-13 19:20:58,http://www.segye.com/newsView/20250609511826,세계일보
"'제이팝 스타' 日 후지이 카제, 3년만에 정규 3집 수록곡 '하치코' 선공개",https://img.segye.com/content/image/2025/06/13/300/20250613513417.jpg,일본의 인기 싱어송라이터 후지이 카제(Fujii Kaze·ふじいかぜ)가 3년만에 정규 음반을 발매한다. 13일 유니버셜뮤직에 따르면 후지이 카제는 오는 9월 5일 정규 3집 '프리마(Prema)'를 공개한다. 후지이 카제는 이날 정규 3집 발매에 앞서 수록곡 '하치코(Hachikō)'와 뮤직비디오를 선공개 했다. 해당 노래 제목은 도쿄 시부야의 강,2025-06-13 17:34:30,http://www.segye.com/newsView/20250613513424,세계일보
“진짜 오은영 맞아?”...바뀐 헤어스타일 ‘눈길’ → 민낯까지 최초 공개,https://img.segye.com/content/image/2025/06/13/300/20250613513124.jpg,"정신건강의학과 전문의 오은영 박사가 화장기 없는 얼굴과 편안한 복장을 한 모습으로 처음 등장했다. 지난 12일, MBN은 개국 30주년 대국민 위로 프로젝트로 기획한 예능 프로그램 ‘오은영 스테이’의 티저 영상을 공개했다. 오은영 박사는 방송 최초로 화장기 없는 얼굴과 손질 없는 헤어, 편한 트레이닝 복장으로 나타나 시선을 모았다. 이날 오은영 박사",2025-06-13 17:03:14,http://www.segye.com/newsView/20250613512171,세계일보
"정동원, 해병대 입대 의지 ""남자라면 멋있게 갔다와야""",https://img.segye.com/content/image/2025/06/13/300/20250613512958.jpg,"가수 정동원(18)이 해병대 입대 의지를 드러냈다. 정동원은 지난 12일 공개된 유튜브 채널 '정동원(JD1)' 영상에서 해병대 출신 배우 오종혁과 함께 군 입대에 관한 진솔한 대화를 나눴다. 영상에서 정동원은 병역 판정 검사 통지서를 공개하며 ""가슴이 떨리고 두근거린다""며 긴장된 마음을 전했다. 그는 ""해병대 수색대에 가고 싶다""며 ""남자로 태",2025-06-13 16:50:16,http://www.segye.com/newsView/20250613512469,세계일보
"신동엽 ""이병헌♥이민정 집에서 백상 뒤풀이""",https://img.segye.com/content/image/2025/06/13/300/20250613512021.jpg,"개그맨 신동엽이 오랜 절친인 배우 이병헌과의 남다른 인연을 밝혔다. 13일 오후 10시 방송되는 KBS 2TV 예능물 '가는정 오는정 이민정'에 신동엽이 게스트로 출연한다. 신동엽이 야외 예능에서 진행자가 아닌 손님으로 출연하는 것이 드문 일이기에 관심이 쏠린다. 방송에서 MC 붐은 신동엽 등장에 ""얼마 전 상을 받았다""며 축하를 건넨다. 신동엽은",2025-06-13 16:04:24,http://www.segye.com/newsView/20250613509816,세계일보
“휴대전화 복제로 4시간 만에 6000만원 털려”...피싱 피해 고백한 女배우,https://img.segye.com/content/image/2025/06/13/300/20250613512015.jpg,"배우 이미숙이 피싱 피해 경험을 고백하며 수천만원을 잃었다고 전했다. 지난 12일, 유튜브 채널 ‘이미숙_숙스러운 미숙씨’에는 ‘배우 이미숙, 챗 GPT의 첫 만남..결혼할 수 있을까?’라는 제목의 영상이 게재됐다. 공개된 영상에서는 이미숙이 챗 GPT를 처음으로 사용하는 모습이 담겼다. 이날 제작진은 이미숙에게 ‘챗 GPT 활용하기’라는 콘텐츠를",2025-06-13 16:12:35,http://www.segye.com/newsView/20250613510658,세계일보
"""4시간만 6천만원 날려""…이미숙 보이스피싱 피해",https://img.segye.com/content/image/2025/06/13/300/20250613511995.jpg,"배우 이미숙(65)이 보이스피싱으로 6000만원을 잃었다. 이미숙은 12일 공개한 유튜브 채널 '이미숙_숙스러운 미숙씨'에서 ""내가 피싱 피해를 당했을 때 크롬을 통해 접속한 것 같다. 그때 통장이 털려서 5000만~6000만원이 날아갔다""며 ""이후로는 절대 휴대전화로 결제하지 않는다. 해킹범이 내 휴대전화를 복제해 새벽에 4시간 동안 내 신용카드로 온",2025-06-13 16:01:33,http://www.segye.com/newsView/20250613503129,세계일보
"김광현, SSG와 2년 36억원 연장 계약…2027년까지 원클럽맨",https://img.segye.com/content/image/2025/06/13/300/20250613508199.jpg,투수 김광현(36)이 프로야구 SSG와 2년 연장 계약을 맺고 2027년까지 함께 하게 됐다. SSG는 13일 “김광현과 계약기간 2년 총 36억원(연봉 30억·옵션 6억)에 다년 계약을 했다”고 밝혔다. 올해로 자유계약선수(FA) 계약이 끝나는 김광현은 2년 연장 계약을 하며 2027년까지 SSG 유니폼을 입게 됐다. 2027년 이후에도 선수 생활을,2025-06-13 11:58:35,http://www.segye.com/newsView/20250613508069,세계일보
"LG-한화, 물러설 수 없는 주말 3연전",https://img.segye.com/content/image/2025/06/13/300/20250613506092.jpg,수성이냐 탈환이냐. 2025 KBO리그 순위표 맨 윗자리를 놓고 LG와 한화가 13일부터 물러설 수 없는 주말 3연전에 돌입한다. 12일까지 LG는 40승26패1무로 2위 한화(40승27패)에 0.5경기 차로 앞선 아슬아슬한 선두를 내달리고 있다. 이런 가운데 공교롭게도 LG와 한화가 13일부터 대전 한화생명볼파크에서 1위 자리가 걸린 3연전 혈투를,2025-06-13 10:30:49,http://www.segye.com/newsView/20250613505910,세계일보
토트넘 새 감독 브렌트퍼드 이끈 프랑크,https://img.segye.com/content/image/2025/06/13/300/20250613505121.JPG,손흥민이 속한 잉글랜드 프로축구 프리미어리그(EPL) 토트넘이 브렌트퍼드를 이끌던 토마스 프랑크 감독을 새 사령탑으로 선임했다고 13일(한국시간) 발표했다. 프랑크 감독은 2028년까지 팀을 지휘한다고 발표했다. 덴마크 출신 프랑크 감독은 브렌트퍼드 수석코치를 거쳐 2018년부터는 정식 감독으로 7년간 팀을 이끌어 왔다. 그는 2018∼2019시즌 챔피,2025-06-13 09:57:12,http://www.segye.com/newsView/20250613505051,세계일보
"이정후, 3경기 연속 안타 행진…14∼16일 김혜성과 절친 맞대결 펼친다",https://img.segye.com/content/image/2025/06/13/300/20250613504910.jpg,이정후(27·샌프란시스코 자이언츠)가 3경기 연속 안타 행진으로 타격감각을 유지했다. 이제 14일부터는 옛 동료 김혜성(26·로스앤젤레스 다저스)와 우정의 맞대결을 펼친다. 이정후는 13일(한국시간) 미국 콜로라도주 덴버의 쿠어스필드에서 벌인 2025 미국프로야구 메이저리그(MLB) 콜로라도 로키스와 방문 경기에 1번 타자 중견수로 선발 출전해 4타수 1,2025-06-13 09:47:14,http://www.segye.com/newsView/20250613504652,세계일보
이원석 결승타·김서현 마무리…한화 40승,https://img.segye.com/content/image/2025/06/12/300/20250612520149.jpg,프로야구 한화가 두산과의 주중 3연전을 싹쓸이하면서 선두 LG와 함께 시즌 40승 고지에 올라섰다. 한화는 12일 대전 한화생명볼파크에서 열린 2025 KBO리그 두산과의 홈 경기에서 이원석(사진)의 결승타에 힘입어 3-2로 승리했다. 이날 승리로 두산과의 주중 3연전을 스윕하는 데 성공한 한화는 시즌 40승(27패) 고지를 선점했다. 잠실에서,2025-06-12 22:41:20,http://www.segye.com/newsView/20250612520040,세계일보
"22득점 ‘맹공 버튼’ 누른 할리버튼… 인디애나, 파이널 3차전 반격 성공",https://img.segye.com/content/image/2025/06/12/300/20250612519055.jpg,미국프로농구(NBA) 인디애나 페이서스가 에이스 타이리스 할리버튼의 맹활약을 앞세워 챔피언결정전(7전4승제)에서 2승1패로 우승 고지를 향해 한발 앞서나갔다. 인디애나는 12일 미국 인디애나주 인디애나폴리스의 게인브리지 필드하우스에서 열린 2024~2025 NBA 챔프전 3차전 홈 경기에서 오클라호마시티 선더를 116-107로 이겼다. 인디애나는 지난,2025-06-12 23:08:55,http://www.segye.com/newsView/20250612515968,세계일보
전역 앞둔 ‘132억 좌완’ 구창모,https://img.segye.com/content/image/2025/06/12/300/20250612519086.jpg,시즌 중반으로 접어들어 치열한 순위싸움이 진행 중인 2025 KBO리그에 변수가 하나 생긴다. 병역 의무를 다하고 있는 상무 소속 선수 13명이 17일 전역해 각 팀에 복귀한다. 이번에 제대하는 ‘말년 병장’ 중에는 입대 전 팀에서 핵심 역할을 했던 선수들이 꽤 있어 이들의 활약에 따라 울고 웃는 팀들이 생길 전망이다. 가장 관심을 끄는 선수는 NC의,2025-06-12 20:54:49,http://www.segye.com/newsView/20250612515972,세계일보
"물 오른 전진우, K리그1 선두 수성도 ‘전진’",https://img.segye.com/content/image/2025/06/12/300/20250612519077.jpg,"한국이 2026 국제축구연맹(FIFA) 북중미 월드컵 본선행을 확정 짓는 경기에서 눈부신 활약을 펼친 선수 중 하나로 전진우(전북 현대·사진)를 꼽을 수 있다. 전진우는 A매치 데뷔전이었던 이라크전(2-0 승)에서는 후반 교체 투입돼 오현규의 추가 골을 도와 첫 공격포인트까지 기록했고, 쿠웨이트와의 경기(4-0 승)에서는 선발로 나서서 비록 상대 자책골로",2025-06-12 20:55:16,http://www.segye.com/newsView/20250612515963,세계일보
우승 상금 1708억원…32개 축구클럽 ‘혈전’,https://img.segye.com/content/image/2025/06/12/300/20250612519003.jpg,세계 최강 클럽팀을 가리는 2025 국제축구연맹(FIFA) 클럽월드컵이 15일 개막해 1억2500만달러(약 1708억원)라는 엄청난 우승 상금을 놓고 미국 전역 12개 도시에서 한 달간의 열전에 돌입한다. 21회째를 맞는 이번 대회에는 6개 대륙을 대표하는 32개 축구 클럽(아시아 4팀·아프리카 4팀·북중미 4팀·남미 6팀·오세아니아 1팀·유럽 12팀·,2025-06-12 23:08:27,http://www.segye.com/newsView/20250612515962,세계일보
"다저스 김혜성, 2루수 선발 출전 경기서 무안타·송구 실책",https://img.segye.com/content/image/2025/06/12/300/20250612507192.JPG,로스앤젤레스 다저스 김혜성(26)이 주 포지션인 2루수로 선발 출전한 경기에서 실책을 범하는 등 아쉬운 모습을 보였다. 김혜성은 12일(한국시간) 미국 캘리포니아주 샌디에이고 펫코 파크에서 열린 2025 미국프로야구 메이저리그(MLB) 샌디에이고 파드리스와 방문 경기에 9번 타자 2루수로 선발 출전해 2타수 무안타에 몸에 맞는 볼로 한 차레 출루하는,2025-06-12 10:50:33,http://www.segye.com/newsView/20250612507174,세계일보
막상막하 골프 2강 “이제 최강자 가리자”,https://img.segye.com/content/image/2025/06/11/300/20250611518584.jpg,"골프 세계랭킹 1, 2위에 자리한 스코티 셰플러(29·미국)와 로리 매킬로이(36·북아일랜드)가 미국프로골프(PGA) 투어 시즌 세 번째 메이저대회 US오픈에서 또다시 자존심 대결을 벌인다. 마스터스 토너먼트에서는 매킬로이가, PGA 챔피언십에서는 셰플러가 우승하는 등 앞서 열린 두 번의 메이저 타이틀을 사이좋게 나눠 가진 두 선수가 세 번째 메이저대회에서",2025-06-11 21:00:15,http://www.segye.com/newsView/20250611516297,세계일보
대승하고도 쏟아진 야유 세례 …이강인 “홍명보 우리 보스” 호소,https://img.segye.com/content/image/2025/06/11/300/20250611518653.jpg,한국 축구대표팀 미래로 꼽히는 이강인(파리 생제르맹·PSG)이 홍명보 한국축구대표팀 감독을 두둔했다. 최상의 전력을 구축해 2026 국제축구연맹(FIFA) 북중미 월드컵 본선을 준비해야 하는 사령탑에게 힘 실어주기에 나선 것이다. 이강인은 지난 10일 서울월드컵경기장에서 열린 쿠웨이트와 2026 북중미 월드컵 아시아지역 3차예선 최종전 뒤 “이런 얘기를,2025-06-11 22:57:06,http://www.segye.com/newsView/20250611516302,세계일보
男배구 OK저축銀 …안산 떠나 ‘부산행’,https://img.segye.com/content/image/2025/06/11/300/20250611519245.jpg,"남자 프로배구 OK저축은행이 2013년 안산을 연고지로 창단한 지 12년 만에 부산으로 둥지를 옮기며 구단 역사의 전환점을 맞이한다. 모든 프로 스포츠 구단들이 연고지를 수도권으로 옮기려는 상황에서 오히려 추세에 역행하는 도전에 나서는 셈이다. OK저축은행의 연고지 이전은 12일 한국배구연맹(KOVO) 실무위원회에서 안건이 상정되고, 24일로 예정된",2025-06-11 20:59:52,http://www.segye.com/newsView/20250611516298,세계일보
"5선발의 반란… 송승기·오원석, 에이스급 역투",https://img.segye.com/content/image/2025/06/11/300/20250611518614.jpg,프로야구 구단들은 긴 정규시즌을 치르기 위해 최소 5명의 선발진을 구축한다. 5명이 로테이션을 돌아야 선발투수가 4일 이상의 휴식을 보장받을 수 있기 때문이다. 다만 5명의 확실한 선발 투수진을 갖추기가 생각보다 쉽지는 않다. 그래서 다섯 번째 선발투수는 언제나 교체 가능한 자원 정도로 여겨지는 경우가 많다. 그런데 2025시즌 KBO리그에서는 5선발로 시,2025-06-11 20:58:33,http://www.segye.com/newsView/20250611516295,세계일보
축구협회가 달라져야 비판을 멈추죠,https://img.segye.com/content/image/2025/06/11/300/20250611517441.jpg,“과도한 비판은 선수들에게 도움이 되지 않습니다.” 한국축구대표팀 이강인 발언이 후폭풍을 일으켰다. 홍명보 한국축구대표팀 감독과 그를 선임한 대한축구협회를 향한 비판을 자제해 달라는 의미였다. 10일 대표팀이 쿠웨이트에 4-0 완승을 거두고 무패 조 1위를 확정한 서울월드컵경기장 관중석은 65%도 채워지지 않았다. 11회 연속 월드컵 진출을 확정한,2025-06-11 17:56:54,http://www.segye.com/newsView/20250611517444,세계일보
"프랑크 감독, 토트넘 입성 눈앞?",https://img.segye.com/content/image/2025/06/11/300/20250611504637.jpg,잉글랜드 프로축구 토트넘 홋스퍼가 토마스 프랑크(51·덴마크) 브렌트퍼드 감독을 이번 주말까지 새로운 사령탑으로 공식 임명할 가능성이 높아지고 있다. 영국 BBC는 11일(한국시간) “토트넘과 브렌트퍼드의 협상이 긍정적으로 진행되고 있다”며 “프랑크 감독이 안지 포스테코글루 감독의 후임으로 48시간 이내에 확정될 수 있다는 기대감이 커지고 있다”고 전,2025-06-11 09:32:03,http://www.segye.com/newsView/20250611504568,세계일보
"이강인 “감독님은 우리 보스… 과도한 비판, 선수도 상처받아요”",https://img.segye.com/content/image/2025/06/11/300/20250611502980.jpg,한국 축구대표팀의 에이스 이강인(파리 생제르맹)이 축구팬들에게 “과도한 비판은 선수들에게도 영향을 준다”며 진심 어린 호소를 전했다. 최근 대한축구협회와 홍명보 감독을 둘러싼 여론의 비판을 두둔하며 “긍정적인 시선도 함께 해달라”고 말했다. 이강인은 10일 서울월드컵경기장에서 열린 2026 북중미 월드컵 아시아 최종예선 B조 10차전 쿠웨이트와의 경기에,2025-06-11 07:42:44,http://www.segye.com/newsView/20250611502954,세계일보
"와이스 완벽투… 한화, 두산 제압",https://img.segye.com/content/image/2025/06/10/300/20250610520020.jpg,프로야구 한화가 라이언 와이스(사진)의 완벽투와 타선의 집중력을 앞세워 선두 탈환을 눈 앞에 뒀다. 한화는 10일 대전 한화생명 볼파크에서 열린 2025 KBO리그 두산과의 홈 경기에서 6-2로 승리했다. 이날 승리로 시즌 성적 38승27패가 된 2위 한화는 SSG에 2-6으로 패한 선두 LG(38승1무26패)에 0.5경기 차로 따라붙으며 선두 탈환의,2025-06-11 05:00:00,http://www.segye.com/newsView/20250610519847,세계일보
