title,thumbnail,short_content,write_time,link,company
"'혜성특급' 김혜성, 빅리그 생존 성공",https://img.segye.com/content/image/2025/05/19/300/20250519503860.JPG,"미국 메이저리그(MLB) 로스앤젤레스(LA) 다저스의 ‘혜성 특급’ 김혜성(26)이 빅리그에서 살아남았다. 콜업 후 멀티 포지션 소화에 주루, 타격 능력에서 기대 이상의 활약을 보여준 덕분이다. 다저스는 크리스 테일러를 지명양도(DFA)로 방출했다. 다저스는 19일(이하 한국시간) 미국 캘리포니아주 LA의 다저 스타디움에서 열린 2025 MLB LA",2025-05-19 09:15:55,http://www.segye.com/newsView/20250519503696,세계일보
‘선수 은퇴’ 김연경… “배구 위해 일할 것”,https://img.segye.com/content/image/2025/05/18/300/20250518511337.jpg,“선수로서는 이렇게 마지막이지만 앞으로 배구를 위해 일하겠습니다.” 18일 관중이 꽉 찬 인천 삼산월드체육관에서 열린 KYK(김연경) 인비테이셔널 2025를 마친 ‘배구 여제’ 김연경의 일성이다. 김연경은 이날 ‘팀 스타’ 감독 겸 선수로 경기에 나서 ‘팀 월드’ 마르첼로 아본단자 감독과 지략 대결을 펼쳤다. 김연경과 튀르키예 리그 페네르바체와 엑자시,2025-05-18 23:53:04,http://www.segye.com/newsView/20250518511109,세계일보
사자 잡은 거인 공동 2위 '우뚝',https://img.segye.com/content/image/2025/05/18/300/20250518510483.jpg,프로야구 롯데의 기세가 만만치 않다. 롯데가 삼성과 주말 홈 3연전을 싹쓸이하면서 공동 2위까지 치고 올라왔다. 롯데는 18일 부산 사직구장에서 열린 2025 KBO리그에서 부상에서 돌아온 전민재의 3점포를 앞세워 삼성을 6-3으로 꺾었다. 롯데 선발 터커 데이비슨이 6이닝 5피안타 1실점 8탈삼진으로 역투하며 6승(1패)째를 챙겼다. 지난달 29일,2025-05-19 09:40:57,http://www.segye.com/newsView/20250518510235,세계일보
눈앞에 지도·카메라가 좍∼ 구글·삼성 ‘스마트안경’ 재도전,https://img.segye.com/content/image/2025/05/21/300/20250521516982.jpg,"구글이 삼성전자와 함께 차세대 혼합현실(XR) 스마트안경을 개발하면서 스마트안경 시장 재도전에 나선다. 이 사업은 한국 안경 기업인 젠틀몬스터도 함께 한다. 구글은 검색 기능에 이미지와 동영상 제작, 업무 자동화 등 인공지능(AI) 기능을 대폭 접목해 본격적인 AI 경쟁에도 나선다고 발표했다. 구글은 20일(현지시간) 미국 캘리포니아주 마운틴뷰에서 연례",2025-05-21 18:50:53,http://www.segye.com/newsView/20250521515750,세계일보
강학모 ‘송도향’ 양조장 대표 “시류 좇지 않고 전통주 한길… 삼양춘 진가 12년 만에 인정”,https://img.segye.com/content/image/2025/05/21/300/20250521517289.jpg,"우리나라에는 각 도시마다 그 지역의 오랜 역사와 문화를 담은 술이 있다. 조선시대 3대 명주 하나로 전통 소주에 배와 생강이 들어가는 전주 이강주, 청주를 증류시켜 만든 알콜 도수 45도의 경북 무형문화재 안동소주, 충남 서천군 한산면 일원에서 전승되며 ‘앉은뱅이술’로도 불리는 한산 소곡주 등등. “인천 문학산성 아래에 삼해주 고개가 있어요. 이런 상징성을",2025-05-21 18:50:18,http://www.segye.com/newsView/20250521516019,세계일보
"한수원, 체코 법원에 항고… ‘원전 계약 금지’ 가처분 취소 요청",https://img.segye.com/content/image/2025/05/21/300/20250521516915.jpg,한국수력원자력이 체코 신규원전 건설 최종 계약을 본안 판결 때까지 금지한다는 현지 지방법원의 결정에 불복해 최고행정법원에 항고했다. 21일 원전 업계에 따르면 한수원은 20일(현지시간) 체코 최고행정법원에 항고장을 접수했다. 한수원 관계자는 “체코 사법 제도상으로 가처분 사건의 이해당사자인 한수원 역시 EDUⅡ(두코바니Ⅱ 원자력발전사)와 마찬가지로 현지,2025-05-21 17:50:30,http://www.segye.com/newsView/20250521516366,세계일보
“제발 출시해줘”…만우절 장난으로 올렸다 실제 나온 이 아이스크림,https://img.segye.com/content/image/2025/05/21/300/20250521515893.jpg,"롯데웰푸드는 자사 대표 빙과 브랜드인 스크류바, 죠스바의 미니 버전을 출시한다고 21일 밝혔다. 만우절 장난으로 시작된 아이디어가 예상을 뛰어넘는 인기에 힘입어 실제 출시까지 이어졌다. 이번에 선보인 ‘미니 스크류바’, ‘미니 죠스바’는 지난 4월 만우절 당시 롯데웰푸드 공식 사회관계망서비스(SNS) 계정에서 큰 화제를 모은 ‘믿거나 먹거나’ 시리즈에서",2025-05-21 17:50:00,http://www.segye.com/newsView/20250521515912,세계일보
"한국 제조업 GDP, 해외 수요에 58% 의존… 미·중 24% 차지",https://img.segye.com/content/image/2025/05/21/300/20250521516901.jpg,한국 제조업 국내총생산(GDP) 중 58.4%는 해외 수요에서 나온 것으로 집계됐다. 제조업 GDP의 미국·중국 의존도는 24.5%로 경쟁국들보다 높아 미·중 갈등이 깊어질 경우 제조업 생산 차질이 우려된다. 한국경영자총협회는 21일 이런 내용의 ‘우리 제조업 국내 및 해외 수요 의존도 현황과 시사점’ 보고서를 발표했다. 보고서에 따르면 아시아개발은행,2025-05-21 17:49:39,http://www.segye.com/newsView/20250521516239,세계일보
"“햄버거 200원에 먹어볼까”…노브랜드버거, 스타필스 수원서 팝업",https://img.segye.com/content/image/2025/05/21/300/20250521516586.jpg,"신세계푸드는 노브랜드 버거의 최강 가성비 신메뉴인 ‘NBB 어메이징 더블’을 더 많은 고객이 경험할 수 있도록 오는 7월21일까지 스타필드 수원에서 팝업스토어를 연다고 21일 밝혔다. 신메뉴 ‘NBB 어메이징 더블’을 비롯해 ‘NBB 어메이징 더블 업’, ‘NBB 새우’ 등 인기 메뉴를 선별해 팝업스토어 메뉴를 구성했으며, 스타필드 수원 고객들에게 노브",2025-05-21 17:31:20,http://www.segye.com/newsView/20250521516521,세계일보
"국내 유일 영유아식품 소스…남양유업, ‘아이꼬야 맘스쿠킹 소스’ 출시",https://img.segye.com/content/image/2025/05/21/300/20250521516486.jpg,"남양유업은 12개월 이상 유아를 위한 간편 조리식 ‘아이꼬야 맘스쿠킹 바로먹는 소스’ 2종(소고기 라구, 소고기 짜장)을 출시했다고 21일 밝혔다. 이번 신제품은 건강한 식재료와 나트륨 안심설계는 물론 까다로운 영∙유아용식품 기준을 충족해 국내 소스 식품유형 제품 중 유일하게 ‘영∙유아식품’으로 표시됐다. 이번 신제품은 국내산 소고기와 신선한 채소를 아",2025-05-21 17:25:00,http://www.segye.com/newsView/20250521516430,세계일보
“조합장이 38억 성과급?”… 평촌 어바인퍼스트 조합 총회 앞두고 조합원들 반발 확산,https://img.segye.com/content/image/2025/05/21/300/20250521516380.jpg,"경기 안양시 호원지구 재개발정비사업 조합(현 ‘평촌 어바인퍼스트 아파트’)이 오는 5월 29일 개최 예정인 조합 총회에 과도한 성과금·청산비용 안건을 상정하면서 조합원들의 강한 반발에 직면했다. 21일 조합이 배포한 총회 안건자료에 따르면 이번 총회에는 조합장 1인에게 38억 원, 임원 8인에게 11억 원, 대의원 108인에게 총 10억8000만 원 등",2025-05-21 17:22:23,http://www.segye.com/newsView/20250521516364,세계일보
"“인생을 맛있게”…농심, 전국 10개 대학서 팝업스토어 연다",https://img.segye.com/content/image/2025/05/21/300/20250521515512.jpg,"농심은 오는 30일까지 전국 10개 대학교를 대상으로 ‘캠퍼스 팝업스토어’를 운영한다고 21일 밝혔다. 농심은 올해 창립 60주년을 기념해 ‘농심 특별 상점’을 콘셉트로, 다양한 농심 제품과 브랜드 체험 콘텐츠를 전시‧운영한다. 이번 캠퍼스 팝업스토어는 농심의 기업 슬로건인 ‘인생을 맛있게’를 주제로, 대학생들에게 농심 대표 브랜드를 색다른 방식으로 체",2025-05-21 17:20:00,http://www.segye.com/newsView/20250521515502,세계일보
지식재산권 보유한 기업 매출 더 높다… IP 보유 건수 매출에 영향 커,https://img.segye.com/content/image/2025/05/21/300/20250521515805.jpg,"지식재산권(IP)을 보유한 국내 기업이 보유하지 않은 기업에 비해 종업원 1인당 매출액이 평균 20.9% 더 높은 것으로 나타났다. 보유한 지식재산권의 종류와 건수, 국내외 병행 활동 여부에 따라 매출 성과는 더욱 뚜렷한 차이를 보였다. 21일 한국지식재산연구원과 한국개발연구원(KDI)은 이같은 내용을 골자로 한 ‘지식재산권 보유에 따른 기업 매출",2025-05-21 17:12:10,http://www.segye.com/newsView/20250521515806,세계일보
"“3500평 노들섬 물들인 초록 물결”…올리브영, 역대급 K뷰티 축제 열었다 [현장]",https://img.segye.com/content/image/2025/05/21/300/20250521515339.jpg,"“뷰티 페스타는 많이 다녀봤지만, 이렇게 다양한 이벤트가 있는 곳은 처음이에요. 친구들이랑 테마파크에 놀러 온 기분입니다.” 21일 서울 용산구 노들섬 전체가 거대한 ‘축제의 장’으로 탈바꿈했다. 이날 오전 기온이 27도에 육박할 정도로 더운 날씨였지만, 관람객들은 아랑곳하지 않고 저마다 부스를 돌며 행사를 즐겼다. 입구 부스부터 긴 줄이 이어졌다.",2025-05-21 17:01:13,http://www.segye.com/newsView/20250521506985,세계일보
"“팔면 끝, 고갱님이 알아서 하셔야죠~” 여전한 중고차 업계",https://img.segye.com/content/image/2025/05/21/300/20250521515681.jpg,"대기업의 중고차 시장 진출이 이어지는 가운데 일부 부도덕한 업체의 ‘팔면 끝’ 배짱 장사가 여전한 것으로 나타났다. 대표적인 사례가 고장 난 차를 수리없이 소비자에게 팔고 대금을 받아 챙기는 수법이다. 또 문제 발생 시 환불을 약속해 놓고 이를 지키지 않거나, 탁송료 등의 명목으로 높은 수수료를 제하고 환불하는 이른바 ‘수수료 장사’도 최근 성행하고 있",2025-05-21 17:00:32,http://www.segye.com/newsView/20250521515640,세계일보
"농협 축산경제, '친환경축산조합장협의회' 정기총회 개최",https://img.segye.com/content/image/2025/05/21/300/20250521513544.jpg,"농협(회장 강호동) 경제지주(축산경제대표이사 안병우)가 지난 16일 서울 중구 농협중앙회 본관에서 안병우 축산경제대표이사, 김재경 농식품부 축산환경자원과장, 협의회 회원 조합장 등이 참석한 가운데 2025년 ’친환경축산조합장협의회 정기총회’를 개최했다고 밝혔다. 이날 정기총회에서는 가축분뇨 처리 확대를 위한 경축순환 활성화계획과 가축분뇨 REC 가중치",2025-05-21 15:56:39,http://www.segye.com/newsView/20250521513589,세계일보
“고객가치 최우선”… 강태영 NH농협은행장 기업 고객과 농번기 일손 돕기,https://img.segye.com/content/image/2025/05/21/300/20250521513255.jpg,"강태영 NH농협은행장이 21일 경기 광주시의 한 토마토 농가를 찾아 농번기 일손을 도왔다고 NH농협은행이 전했다. NH농협은행의 기업 고객인 대명종합건설의 지우종 이사와 양사 임직원 등 50여명이 참여해 토마토를 수확했고, 이를 구매했다. 강 행장은 일손 돕기 후 대명종합건설 관계자들과 간담회를 열어 최근 건설업계가 겪는 어려움을 듣고 지원 방안",2025-05-21 15:34:19,http://www.segye.com/newsView/20250521513278,세계일보
“남주 달리는 장면 찾아줘” 주문하면…네이버 AI가 다 해준다,https://img.segye.com/content/image/2025/05/21/300/20250521512655.jpg,"네이버클라우드가 21일 인공지능(AI)으로 방대한 영상 속 정보를 분석해 자동 추출하는 서비스를 선보였다. 네이버클라우드는 이날 서울 강남구 코엑스에서 개최된 ‘국제 방송·미디어·음향·조명 전시회(KOBA 2025)’에서 ‘MAIU(Media AI Understanding)’를 공개했다. 국내 방송사와 파트너사 대상 비공개 테스트 중이며, 내달 중에",2025-05-21 15:54:52,http://www.segye.com/newsView/20250521512669,세계일보
