title,thumbnail,short_content,write_time,link,company
"넥슨, 고교 반 대항 축구대회 ‘2025 넥슨 챔피언스 컵’ 결승 개최",https://img.segye.com/content/image/2025/10/30/300/20251030519146.jpg,"넥슨은 EA 코리아 스튜디오가 개발하고 자사가 서비스하는 정통 온라인 축구게임 ‘EA SPORTS FC Online(FC 온라인)’의 전국 고등학교 반 대항 축구대회 ‘2025 넥슨 챔피언스 컵’ 결승전을 다음달 1일 개최한다고 30일 밝혔다. 서울, 경기, 인천, 강원, 충청, 경상, 전라, 제주 등 예선전을 통해 선발된 8개 권역 대표팀이 지난 5월",2025-10-30 17:13:28,http://www.segye.com/newsView/20251030519157,세계일보
"LG 오스틴, 언제 살아나나… 작년 PO부터 '가을 야구' 26타수 1안타 부진",https://img.segye.com/content/image/2025/10/30/300/20251030505164.jpg,염경엽 LG 감독은 2025 프로야구 한국시리즈 개막을 앞두고 공격진의 열쇠를 쥔 선수로 외국인 타자 오스틴 딘을 꼽았다. 오스틴이 살아나야 공격력 전체가 살아난다면서 그를 아예 지명타자로 활용하며 수비 부담까지 줄였다. 그러나 오스인이 올해 한국시리즈에서 영 힘을 쓰지 못하고 있다. 오스틴은 29일 대전 한화생명 볼파크에서 열린 한화 이글스와 한국시리,2025-10-30 09:20:32,http://www.segye.com/newsView/20251030505139,세계일보
"올해 가을, 지옥에만 살던 한화 김서현이 처음 천당에 입성해 뜨거운 눈물을 흘렸다… “9회 막은 경기 오랜만이라 눈물 터져 나왔다”",https://img.segye.com/content/image/2025/10/30/300/20251030500909.jpg,[남정훈 기자] 한화 3년차 우완 마무리 김서현(21)만큼이나 이번 가을야구에서 천국과 지옥을 왔다 갔다 했던 선수가 있을까. 아니 왔다 갔다라고 할 수 없을만큼 29일 대전 한화생명 볼파크에서 열린 LG와의 2025 KBO 한국시리즈 3차전 이전까진 지옥에만 빠졌던 김서현이었다. 그랬기에 3차전 승리를 스스로 매조지한 뒤 뜨거운 눈물을 흘렸다. 그간의 마,2025-10-30 07:00:00,http://www.segye.com/newsView/20251030500912,세계일보
"‘BABIP神이 한화에 제대로 강림했다…’ 8회에만 빗맞은 안타 3개로 ‘약속의 8회’ 만들어낸 한화, 기적 같은 역전승으로 26년 만에 KS 승리",https://img.segye.com/content/image/2025/10/30/300/20251030500678.jpg,"[남정훈 기자] 야구라는 스포츠가 참 어렵다. 잘 맞은 타구가 수비 정면으로 가서 뜬공이나 땅볼로 아웃이 되기도 하고, 빗맞은 타구가 절묘한 코스에 떨어져 안타가 되기도 한다. 팬들은 빗맞은 타구가 코스가 좋아서 혹은 수비 시프트에 의해 안타로 바뀔 때 BABIP(인플레이 타구의 안타율)神의 가호라고 부르기도 한다. 29일 대전 한화생명 볼파크에서 열린",2025-10-30 02:16:02,http://www.segye.com/newsView/20251030500684,세계일보
"[속보] 시진핑, 경주APEC·한중정상회담 등 방한 일정 마치고 귀국길",https://img.segye.com/content/image/2025/11/01/300/20251101506508.jpg,"[속보] 시진핑, 경주APEC·한중정상회담 등 방한 일정 마치고 귀국길",2025-11-01 19:44:47,https://www.segye.com/newsView/20251101506506,세계일보
미·중 대두 갈등 불안한 봉합…“수출 다변화” 목소리,https://img.segye.com/content/image/2025/10/30/300/20251030518531.jpg,"지난 8월 11일 도널드 트럼프 미국 대통령은 자신의 사회관계망서비스(SNS) 트루스소셜에 글을 올렸다. 시진핑 중국 주석에게 직접 자국산 대두 수입을 촉구한 것이다. 그런데 바로 다음달인 9월 중국의 미국 대두 수입은 ‘제로’였다. 이는 1차 미·중 무역전쟁이 한창이던 2018년 11월 이후 7년 만에 처음 있는 일이다. 미·중 관계에서 대두는 단순한 농산물 이상의 의미를 가진다. 6년 만에 만난 양국 정상의 협상 테이블에 희토류, 반도체, 관세 등과 함께 오를 정도로 존재감 있는 외교적 수단이다. 경주 아시아태평양경제협력체(APEC·에이펙) 회의를 계기로 미국은 대두 재수출의 물꼬를 트게 됐지만, 언제든 다시 위협받을 수 있다는 불안감은 앞으로도 계속될 전망이다. ◆‘표심’으로 연결되는 美 대두 수출 트럼프 대통령이 대두 수출에 이토록 매달리는 이유는 미국 농가의 생존은 물론 행정부의 정치적 생존과 직결되기 때문이다. 미국은 세계 최대 대두 생산국 가운데 하나로 연 수확량의 40% 이상을 수출한다. 2024년 기준 미국의 대두 수출은 5221만t, 약 244억7000만달러(약 35조원)에 이른다. 이 가운데 중국이 차지하는 비중이 51%로 절반이 넘는다. 중국이 구매를 중단하면 미국 대두시장은 곧바로 수급불균형에 빠진다. 이런 일은 트럼프 집권 1기였던 2018년 실제 발생했다. 당시 미국이 중국산 제품에 25% 관세를 부과하자, 중국은 미국산 농산물에 보복관세를 매기고 대두 수입을 단기간에 90%가량 줄였다. 곧바로 미국 농가에 대두 재고가 쌓였다. 미 농무부 농업경제연구청(ERS)에 따르면 2018~2019년 무역전쟁으로 인한 농산물 수출 손실은 270억달러로 추산됐는데, 그중 71%를 대두가 차지했다. 농가의 불만이 폭발하면서 정치권도 흔들렸다. 미국 대두 주산지인 중서부 ‘팜벨트’(아이오와·일리노이·네브래스카)는 대통령 선거의 승패를 가르는 ‘스윙벨트’로도 꼽히는 만큼, 대두 농가 피해가 지지율에 직접 영향을 미칠 수 있는 상황이었다. 트럼프 대통령은 농가의 불만을 잠재우고자 긴급 구제책을 내놨다. 농가에 144억달러(약 20조5000억원) 규모의 보조금을 지급한 것이다. 그럼에도 대두 공급 과잉은 해소되지 않았다. 내수 소비 정체에 수출까지 줄자 가격도 급락했다. 2019년 대두 선물가격이 10년 만에 최저로 떨어지면서 농가 소득이 직격탄을 맞았다. 이에 정부는 86억달러를 추가로 풀었다. 두 차례에 걸쳐 지급한 230억달러의 보조금 중 절반 이상이 대두 재배농가에 돌아갔다. 표심을 달래는 데는 효과적이었으나 농가 한 곳당 수만 달러씩 응급수혈을 해야 했다. 글로벌 대두 시장에서 수출 점유율을 브라질에 빼앗기는 등 회복하기 어려운 손해도 입었다. 트럼프 2기 행정부가 출범하면서 시작된 2차 미·중 무역전쟁에서 대두 농가는 또다시 희생양이 됐다. 같은 일을 반복하고 싶지 않은 트럼프 대통령에게 중국과의 무역협상에서 대두 수출 문제를 해결하는 것이 시급한 과제였던 이유다. ◆세계 최대 대두 소비국… 식량 안보 직결 중국은 세계 최대 대두 소비국이다. 지난해 중국은 약 1억2500만t의 대두를 소비했고, 그중 1억500만t을 수입했다. 약 84%를 해외 수입에 의존하고 있는 것이다. 중국인의 식생활을 보면 중국이 왜 이렇게 대두를 많이 필요로 하는지 알 수 있다. 중국은 콩 요리나 두부를 만드는 데 자국산 콩을 사용한다. 수입산은 대부분 가공용이다. 기름을 짜 식용유를 생산하고, 남은 찌꺼기(대두박)로 돼지, 닭, 어류의 단백질 사료를 만든다. 음식에 기름을 많이 사용하면서 세계 최대 돼지고기 소비국이자 생산국인 중국에 콩은 단순한 식재료가 아닌 전략적 자원이다. 국제 대두가격이 오르거나 수입이 조금만 줄어도 식용유와 사료 가격이 올라 물가 상승으로 이어진다. 중국은 이런 상황을 2018년 미·중 무역전쟁에서 겪었다. 중국은 미국산 대두 수입을 2017년 3290만t에서 2018년 1660만t으로 절반 넘게 줄였다. 미국에 타격을 주는 데 성공했지만 자국 피해도 만만치 않았다. 브라질산 수입을 늘리니 품질은 하락하고 운송비와 환율 부담이 더해졌다. 식용유값과 사료값 급등에 식품 가격도 줄줄이 올라 물가 상승을 초래했다. 중국국가통계국에 따르면 2018년 하반기 중국 소비자물가지수(CPI)는 전년 대비 2.5% 상승했다. 그중 식품 물가가 4%로 큰 폭 올랐다. 중국은 이후 수입 대두의 미국 의존도를 낮추기 위해 브라질과 협력을 맺고 안정적인 대두 공급망을 구축해 왔다. 지난해 기준 중국 수입 대두에서 브라질이 차지하는 비중은 71%, 미국은 21%로 크게 벌어졌다. 하지만 물류비가 저렴하고 가격대비 품질이 우수한 미국산 대두를 완전히 포기하는 것은 중국 입장에서도 손해다. 대두는 경쟁국인 미국 행정부가 직접 압박하기에도 좋은 카드다. 이 때문에 중국은 미국과의 협상에서 대두를 가볍게 다룰 수 없다. ◆여전한 시한폭탄… “수출 다변화” 목소리 30일 미·중 정상이 중국의 미국산 대두 수입 재개, 희토류 규제 완화, 미국의 대중국 관세 완화 등을 포함한 내용에 합의하기로 하면서 미국 농업계에는 기대감이 확산했다. 국제 대두 가격이 상승하는 등 시장도 반응했다. 하지만 이 합의가 장기적이고 견고한 거래 구조가 될지에 대해서는 회의적인 시각이 많다. 중국 대두 관련 정책은 이미 그 반대를 향하고 있기 때문이다. 전략 작물인 대두의 수입 의존도가 80%를 넘는다는 것은 중국의 식량 주권을 위협하는 구조적 약점으로 지목돼 왔다. 이에 중국은 대두 수입 의존도를 줄이기 위해 국산 대두 재배 확대, 사료 내 대두박 비중 축소, 수입선 다변화 등의 조치를 병행하고 있다. 중국은 사료 내 대두박 투입률을 2022년 14.5% 수준에서 2024년 약 12.9%까지 낮췄다. 목표대로라면 2030년에는 10% 수준까지 떨어진다. 이는 중국의 대두 수입 수요가 줄어들 것임을 의미한다. 남미산 대두와의 경쟁도 쉽지 않다. 중국 대두 시장에서 브라질, 아르헨티나 등 남미산은 이미 안정적인 수입선으로 자리를 잡은 상태다. 가격과 품질면에서 경쟁력이 월등하지 않으면 미국산 수입이 재개되더라도 예전처럼 높은 점유율을 차지하기는 어려울 가능성이 높다. 정치적 리스크도 여전히 남아있다. 수출의 절반을 중국에 의존하는 상황에서 대두는 양국 관계 변화에 따라 언제든 다시 협상 카드로 등장할 수 있다. 근본적인 문제를 해결하기 위해 미국 전문가와 농가들은 대두 수출 시장 다변화를 강조하고 있다. 브룩 롤린스 미 농무부 장관은 지난 16일 언론 인터뷰에서 “미국은 더 이상 한 나라, 특히 중국 하나에 대두 수출을 의존할 수 없다”며 “농가들이 이 상태를 벗어나도록 시장을 다변화해야 한다”고 말했다. 앨런 수더맨 스톤엑스 수석 상품이코노미스트는 “중국이 이미 미국산 대두에서 브라질산으로 빠르게 선회하고 있으며, 미국 농가는 저장공간 부족과 가격 하락의 이중고를 겪고 있다”며 “지금은 새로운 수출시장을 찾아야 할 시급한 시점”이라고 지적했다. 위기를 피부로 느끼고 있는 농가들도 정부에 대책을 촉구하고 있다. 미국대두협회(ASA)는 지난 8월 트럼프 대통령에 보낸 서한에서 “미국 대두농가들은 중국이라는 거대 수출시장에 과도하게 기대 왔고, 이 구조가 바뀌지 않는 한 위기는 반복될 것”이라며 “새로운 수출처 발굴과 국내 소비 확대를 병행하는 전략이 필요하다”고 강조했다.",2025-11-01 19:00:00,https://www.segye.com/newsView/20251030517621,세계일보
경찰 무력 작전에 가족 잃은 사람들의 절규,https://img.segye.com/content/image/2025/10/30/300/20251030521747.jpg,"29일(현지시간) 브라질 리우데자네이루 페냐 빈민가 주민들이 전날 경찰의 범죄조직 소탕 작전 중 목숨을 잃은 가족의 시신을 어루만지며 절규하고 있다. 주정부는 사망자가 64명이라고 발표했으나, 지역 단체는 132명으로 확인됐다고 밝혔다. 주민들은 “무고한 청년들이 다수 희생됐다”고 주장했고, 유엔인권사무소 등 인권기구들은 시신에서 발견된 등과 머리 뒤 총상 등을 근거로 즉결처형 및 인권침해 가능성을 제기했다. ‘공공안전을 위한 작전’이라는 주정부의 설명에도 “빈민가를 대상으로 한 과도한 무력 사용”이라는 비판이 나오고 있다. 시민들은 다음날 진상 규명을 촉구하는 시위를 벌였다.",2025-11-01 18:32:42,https://www.segye.com/newsView/20251030516819,세계일보
"인구·경제 대국 인도, 여권 파워는 한국과 현격한 차이… 왜?",https://img.segye.com/content/image/2025/11/01/300/20251101505000.jpg,"2023년 인도는 중국을 제치고 세계에서 가장 인구가 많은 나라로 공인을 받았다. 현재 인도 인구는 약 14억6300만명, 중국은 14억1600만명으로 인도의 근소한 우위가 계속되고 있다. 인도는 경제력 면에서도 영국, 프랑스 등 유럽 주요국을 진작 제쳤다. 국내총생산(GDP) 규모로 따져 인도는 미국, 중국, 독일, 일본에 이은 세계 5위 경제 대국으로 통한다. 지구촌 최대 시장 중 한 곳으로 부상한 인도에 세계 각국의 러브콜이 쏟아진다. 하지만 정작 인도인들이 관광 등 명목으로 자국에 오는 것은 부담스럽다는 나라들이 여전히 많다. 초강대국의 요건을 하나둘씩 갖춰 가는 인도의 여권 파워는 아직 약소국 수준에 머물러 있다는 뜻이다. 10월31일(현지시간) BBC 방송에 따르면 최근 공개된 ‘헨리 여권 지수’(Henley Passport Index)에서 인도는 199개국 가운데 고작 85위에 그쳤다. 이는 2024년과 비교해 5계단이나 떨어진 수치로 르완다(78위), 가나(74위), 아제르바이잔(72위)처럼 인구 및 경제 규모가 인도와 비교도 안 되는 나라들보다 못한 수준이다. 국제 법률 회사 ‘헨리 앤드 파트너스’가 매년 세계 각국을 상대로 조사를 실시한 뒤 발표하는 헨리 여권 지수는 여권만 있으면 비자(사증) 없이 입국할 수 있는 국가 수를 기준으로 매긴다. 순위가 높은 나라의 국민은 무비자로 방문이 가능한 외국 수가 그만큼 많다는 뜻이다. 현재 1위는 싱가포르(193개국 무비자 여행 가능), 2위는 한국(190개국 〃 ), 3위는 일본(189개국 〃 )이 각각 차지하고 있다. 반면 인도 국민이 무비자로 입국할 수 있는 나라는 57개국에 불과하다. 이 같은 인도 여권의 취약성은 경쟁국인 중국과 비교하면 더욱 두드러진다. 중국은 지난 10년간 국력 신장을 바탕으로 여러 국가와 협정을 체결해 자국민의 무비자 입국이 가능한 나라 수를 82개국까지 늘렸다. 그 결과 올해 헨리 여권 지수에서 인도보다 훨씬 높은 60위에 랭크될 수 있었다. 인도의 여권 파워는 왜 그토록 기대 이하일까. 일각에선 인도의 정정이 불안해진 것을 주된 요인으로 꼽는다. 2014년 집권한 나렌드라 모디 총리 정부는 강력한 힌두교 민족주의에 기반한 소수 종교·민족 억압책을 펴는 중이다. 이에 반발한 시크교 인도인들은 국내에서 분리·독립 운동을 전개하는 한편 외국으로 나가서 모디 총리를 성토하는 반정부 운동에 가담하고 있다. 한 전문가는 “힌두교와 시크교의 대립 심화, 소수 종교·민족에 대한 사회적 개방성 위축 등 정치적 격변이 안정적이고 민주적인 국가로서 인도의 이미지를 약화시켰다”고 지적했다. 세계 곳곳에서 인도 국적의 불법 체류자 적발이 끊이지 않는 현실 또한 악재로 작용하고 있다. 인도의 어느 전직 외교관은 BBC에 “많은 국가들이 인도 출신 이민자들을 여전히 경계하는 중”이라며 “불법 체류자 증가가 국제사회에서 인도의 평판에 나쁜 영향을 끼치는 것은 분명한 사실”이라고 전했다. 더욱이 인도 정부의 여권 발급 및 관리 등 시스템은 보안이 취약하기로 악명이 높다. 2024년 델리 경찰은 비자나 여권 조작 같은 사기를 저지른 혐의로 무려 203명을 체포했다. 인도의 느리고 까다로운 출입국 절차 또한 악재로 작용하고 있음을 부인하기 어렵다.",2025-11-01 19:56:46,https://www.segye.com/newsView/20251101505002,세계일보
"美, 중·대형 트럭에 25% 관세부과 개시…한국산 트랙터 등 영향",https://img.segye.com/content/image/2025/11/01/300/20251101504876.jpg,"미국 도널드 트럼프 행정부가 중·대형 트럭과 그 부품에 수입관세 25%를 부과하는 조치가 1일(현지시간) 발효됐다고 AFP통신이 전했다. 버스에 대한 10% 수입관세 부과와 함께 발효돼 시행에 들어간 이번 조치는 트럼프 대통령이 1962년 무역확장법에 따라 이런 물품들의 수입이 국가안보에 미치는 영향을 조사하는 이른바 '232조 조사'를 상무부에 지시한 데 따른 것이다. 트럼프 대통령은 지난달 17일에 이번 관세 부과를 지시하는 포고문에 서명했다. 중형 트럭은 총중량 1만4천1파운드(약 6천350㎏)∼2만6천 파운드(약 1만1천793kg) 대형 트럭은 총중량 2만6천1 파운드 이상의 차량을 의미한다. 미국은 이보다 총중량이 작은 승용차와 경트럭에는 이미 지난 4월부터 25% 관세를 부과하고 있다. 이번 트럭 관세는 일부 품목의 품목별 관세와 중복해서 적용되지는 않는다. 품목별 관세는 철강과 알루미늄 25%, 목재 10%, 구리 50% 등이다. 25% 트럭 관세는 일반 자동차 관세와 범주가 다르기 때문에, 앞서 트럼프 행정부와 무역 협상을 타결해 자동차 관세를 25%에서 15%로 낮춘 일본과 유럽연합(EU)에도 일단 그대로 적용될 것으로 보인다. 트럭에는 교역 상대국에 따라 달라지는 이른바 '상호관세'는 적용되지 않는다고 AFP는 설명했다. 이번 관세 부과 조치로 한국산 트랙터 등의 대미 수출에 영향이 있을 것으로 보인다. 한국 관세청에 따르면 미국의 이번 조치 시행으로 트랙터, 트럭, 레미콘 등 중·대형 차량과 해당 차량에 사용되는 부품에는 앞으로 25% 관세가 부과되며, 버스에는 10% 관세가 부과된다. 모두 기존에는 한국산 물품에 대해 15% 상호관세가 부과되던 품목들이다. 미국의 트럭 수입 물량 대부분은 이웃 국가인 멕시코나 캐나다에서 온다. 특히 미국에 수입되는 대형 트럭 중 70% 이상이 멕시코, 약 20%가 캐나다가 각각 수출한 것이다.",2025-11-01 14:58:16,https://www.segye.com/newsView/20251101504875,세계일보
"美中정상, '넥스페리아 사태'도 합의…車업계 공급망 위기 해소",https://img.segye.com/content/image/2025/11/01/300/20251101503418.jpg,미중 정상회담을 계기로 반도체 생산기업 넥스페리아에서 시작된 자동차 업계의 공급망 위기가 일단 해소될 것으로 보인다. 월스트리트저널(WSJ)은 31일(현지시간) 소식통을 인용해 도널드 트럼프 미국 대통령과 시진핑 중국 국가주석의 합의에 따라 넥스페리아가 중국 공장에서 생산된 반도체 수출을 재개할 예정이라고 보도했다. 넥스페리아와 관련한 양국 정상의 합의는 미중 무역합의 세부내용을 담은 백악관 문서에 포함될 것으로 알려졌다. 네덜란드에 본사를 둔 넥스페리아는 주요 완성차 업체의 부품에 들어가는 범용 반도체를 생산하는 기업이다. 넥스페리아의 반도체는 자동차의 속도계부터 에어컨 공조 시스템까지 다양한 부품에 사용된다. 문제는 미국이 지난 2019년 넥스페리아를 인수한 중국 스마트폰 조립업체 윙테크를 수출제한조치 대상에 올린 것이다. 미국은 지난해 말 이 같은 조치를 발표한 뒤 네덜란드 정부에 넥스페리아의 윙테크 경영권을 박탈하라는 요구를 한 것으로 알려졌다. 실제로 네덜란드는 지난 9월 말 국가안보를 이유로 윙테크의 경영권을 박탈했다. 중국 정부는 이 같은 조치에 반발해 상하이와 베이징 등 현지 공장에서 생산하는 반도체에 대한 수출을 차단했다. 이 때문에 일본 자동차업체 혼다가 반도체 부족 사태에 대응하기 위해 북미 일부 공장의 생산량을 절반으로 줄이기도 했다. 다만 트럼프 대통령과 시 주석의 합의로 자동차 업계의 공급망 위기는 해소될 것으로 보인다. 백악관은 조만간 넥스페리아와 관련한 합의 내용을 담은 성명을 발표할 것으로 전해졌다.,2025-11-01 11:08:31,https://www.segye.com/newsView/20251101503417,세계일보
영화 ‘니키타’ 속 냉혹한 킬러 교관 연기한 佛 배우 카료 별세,https://img.segye.com/content/image/2025/11/01/300/20251101503410.jpg,"프랑스 영화 ‘니키타’와 영국 TV 시리즈 ‘실종’ 등에서 열연을 펼친 프랑스 배우 체키 카료가 72세를 일기로 별세했다. 10월31일(현지시간) BBC 방송에 따르면 카료는 오랜 암 투병 끝에 이날 숨을 거뒀다. 사망 장소가 어디인지, 임종의 순간 가족이 곁을 지켰는지 등은 공개되지 않았다. 카료는 튀르키예계 프랑스인으로 프랑스어는 물론 영어, 스페인어, 아랍어 등에도 능통했다. 덕분에 할리우드 영화에 여럿 출연하며 미국, 영국 등 영어권 국가들에서 이름과 얼굴이 널리 알려졌다. 1953년 10월 튀르키예 이스탄불에서 태어난 카료는 어린 시절 가족과 함께 프랑스 파리로 이주했다. 아버지는 스페인 혈통이 섞인 유대계 튀르키예인이었고 어머니는 그리스 출신이었다. 가족은 트럭 운전사인 아버지의 얼마 안 되는 수입으로 힘겹게 삶을 이어갔다. 그래서 카료는 10대 중반의 나이에 고등학교를 마친 뒤 독립을 선언하고 생활 전선에 뛰어들었다. 학창 시절부터 연기와 연극에 관심이 많았던 카료는 작은 극단에 들어가 단역 배우로 일했다. 어느 정도 경력을 쌓은 뒤로는 프랑스·독일 접경 지대에 있는 스트라스부르 소재 국립극단으로 옮겨 고전과 현대 연극을 두루 섭렵했다. 1980년대 들어 카료는 그의 재능을 눈여겨본 영화 감독들한테 발탁돼 영화에 출연했다. 다니엘 비뉴 감독의 ‘마르탱 게르의 귀향‘(1982), 에릭 노메르 감독의 ‘파리의 보름달’(1984), 그리고 장 자크 아노 감독과 함께한 ‘곰’(1988) 등이 대표적이다. 특히 ‘곰’에서 카료에서 연기한 사냥꾼 캐릭터는 전 세계 비평가와 관객들에게 강렬한 인상을 남겼다. 카료를 일약 유명한 배우로 만든 작품은 뤽 베송 감독의 영화 ‘니키타’(1990)였다. 극중 카료는 범죄에 물든 불량한 여자 청소년 니키타(안느 파릴로)를 훈련시켜 프랑스 정보기관의 비밀 요원으로 길러내는 교관 ‘밥’ 역할을 맡았다. 이 영화는 프랑스는 물론 미국에서도 큰 호응을 얻었으며, 훗날 뤽 베송 감독이 할리우드에 진출해 ‘레옹’ 등을 만들 수 있는 토대로 작용했다. ‘니키타’의 성공에 힘입어 카료로 할리우드 영화계의 러브콜을 받았다. 리들리 스콧 감독의 ‘1492 콜럼버스’(1992), 로저 크리스찬 감독의 ‘노스트라다무스’(1994), 마이클 베이 감독의 ‘나쁜 녀석들’(1995), 마틴 캠벨 감독의 ‘007 골든아이’(1995) 등에서 조연 또는 주연을 맡아 영어권 국가 관객들의 눈길을 사로잡았다. 뤽 베송 감독이 영어로 만든 영화 ‘잔다르크’(1999)에선 프랑스·영국 간 100년 전쟁에서 잔다르크(밀라 요보비치)와 함께 활약하는 프랑스군 지휘관 ‘장 드 뒤누아’ 역을 소화했다. 카료의 최근작으로는 영국 BBC에서 방영된 드라마 ‘실종’ 시즌 1(2014)과 시즌 2(2016)를 꼽을 수 있다. 둘 다 8부작 드라마로 편성됐는데 카료는 각각 프랑스에서 실종된 영국 소년(시즌 1), 그리고 독일에서 실종된 영국 소녀(시즌 2)의 뒤를 좇는 프랑스인 형사 ‘줄리앙 밥티스트’ 역할을 맡아 열연으로 영국 방송계의 호평을 얻었다.",2025-11-01 10:53:45,https://www.segye.com/newsView/20251101503411,세계일보
