title,thumbnail,short_content,write_time,link,company
폭격당한 '이란 핵프로그램 중추' 나탄즈 핵시설은,https://img.segye.com/content/image/2025/06/13/300/20250613515000.jpg,"13일(현지시간) 새벽 이스라엘이 표적 공습한 나탄즈 핵시설은 이란 핵 프로그램의 중추라고 할 수 있다. 이란의 핵시설은 크게 중부 이스파한주(州)의 나탄즈와 곰주의 포르도 등 두 곳으로 나뉜다. 특히 수도 테헤란에서 남쪽으로 약 250㎞ 떨어진 나탄즈는 핵무기 제조용으로 전환할 수 있는 고농축 우라늄이 생산되고 있는 것으로 전해진다. 이스라엘 매체 타임스오브이스라엘에 따르면 나탄즈에는 지하 우라늄농축시설(FEP)과 지상 핵연료농축시설(PFEP) 등 두 개의 농축시설이 있다. FEP는 상업적 농축을 위해 지어진 시설로 원심분리기 5만대가량을 수용할 수 있는 규모로 전해진다. 현재는 약 1만4천대의 원심분리기가 설치돼있으며 그 중 약 1만1천대가 순도 5% 수준으로 우라늄을 농축하고 있다고 한다. 이는 발전용 연료로 쓰일 수 있는 수준이다. 지상 PFEP에는 원심분리기가 수백개가량 설치됐는데 이란은 이곳에서 최고 순도 60%까지 우라늄을 농축하고 있다고 이 매체는 전했다. 순도 60%는 준무기급으로 평가된다. 핵무기 생산을 위해서는 순도 90%의 농축 우라늄이 필요하지만, 이란이 60% 농축에 성공한 만큼 90%에 도달하는 것도 어렵지 않을 수 있다는 우려가 제기돼왔다. 미국 당국자들은 이란이 현재 비축된 농축도 60%의 우라늄을 무기급으로 전환하는데 2주도 걸리지 않을 것이라고 경고해온 바 있다. 나탄즈 핵시설은 지난 2002년 이란 반정부단체의 폭로로 존재가 국제사회에 알려졌으며 이후로 국제원자력기구(IAEA)의 사찰을 받아왔다. 이 때문에 과거에도 이스라엘의 공격 대상 1순위로 꼽혀왔다. 이스라엘은 지난해 4월 나탄즈 핵시설 인근에 배치돼 있던 S-300 대공포대를 파괴했고, 2021년에도 나탄즈 핵시설에 대한 사보타주(파괴 공작)를 감행한 것으로 전해진다. 다만 FEP 시설은 지하 3층 깊이에 있는 것으로 알려진 만큼 이번 이스라엘의 공격으로 어느 정도 손상이 가해졌을지는 미지수다. 이에 대해 이스라엘군은 ""나탄즈 핵단지의 지하시설이 (공습작전에) 손상됐다""며 ""이 지하시설엔 원심분리기가 설치된 여러 층짜리 농축실, 전기실, 기타 지원부가 있다""고 밝혔다. 이어 ""나탄즈 핵시설이 연속적으로 가동할 수 있도록 하는 중요한 인프라와 이란 정권이 핵무기를 획득하려는 계속된 노력을 표적으로 삼았다""고 주장했다. 이란 국영TV는 나탄즈 우라늄 농축 시설이 여러 차례 공격받았다고 보도하며 현장에서 검은 연기가 피어오르는 장면을 내보내고 있다. 이란 언론들은 또 나탄즈 핵시설에서 공습 이후 몇 시간 만에 새로운 폭발음이 들렸다고도 전하고 있다. 나탄즈 핵시설이 위치한 이스파한주에는 이란의 핵기술연구센터(NTRC)와 군사시설 등 여러 핵심 시설도 밀집해 추가적인 피해가 발생했을 가능성도 있다. 이란은 다만 이번 공습으로 나탄즈 핵시설에서 방사성 물질 유출 등은 없다고 주장하고 있다. 국제원자력기구(IAEA)도 현재까지 나탄즈 핵시설에서 ""방사능 수치의 상승은 없다""며 ""초기 징후로 보면 저장된 농축우라늄을 보호하는 여러 겹의 보관고를 이스라엘 공습이 관통하지 못했다""고 밝혔다. 이란의 유일한 원자력발전소인 부셰르 원전은 이번 이스라엘의 공습 대상에 포함되지 않았다. 일각에선 나탄즈와 함께 우라늄 농축시설이 있는 포르도도 공격받은 것 아니냐는 추측이 나오지만, IAEA는 포르도가 현재로선 공습의 영향을 받지 않은 것으로 파악했다고 로이터 통신 등 외신이 전했다. 이밖에 이스파한의 핵원료 제조 시설과 아라크의 중수로 기반 플루토늄 생산 시설 등이 있지만, 이번에 공습 대상에 포함됐는지는 확인되지 않았다.",2025-06-13 20:09:23,https://www.segye.com/newsView/20250613514563,세계일보
"트럼프 ""이스라엘 공격 훌륭…이란, 늦기 전에 합의""",https://img.segye.com/content/image/2025/06/13/300/20250613514932.jpg,"도널드 트럼프 미국 대통령이 13일(현지시간) 이스라엘의 대규모 공습을 당한 이란에 다음 공격은 ""더 잔혹할 것""이라면서 더 늦기 전에 미국과 핵합의에 나설 것을 촉구했다. 이스라엘의 이번 공격에 대해서는 ""훌륭했다고 생각한다""고 평가하면서 앞으로 더 많은 공격이 올 수 있다고도 경고했다. 트럼프 대통령은 이날 자신의 사회관계망서비스(SNS) 트루스소셜에 글을 올려 이란에 ""이미 엄청난 죽음과 파괴가 발생했지만, 이 학살을 끝낼 시간은 아직 남아있다""면서 ""이미 계획된 다음 공격들은 이보다 더 잔혹할 것""이라고 경고했다. 트럼프 대통령은 그러면서 ""이란은 아무것도 남지 않게 되기 전에 반드시 합의를 해야 하며, 한때 이란 제국으로 알려졌던 것을 지켜야 한다""고 적었다. 트럼프 대통령은 자신은 그간 이란이 핵협상을 타결짓지 않을 경우 군사 행동에 나설 것을 경고해왔다면서 ""이란의 강경파들은 무슨 일이 벌어질지 알지 못했다. 그들은 지금 모두 죽었고, 상황은 앞으로 더 나빠질 것""이라고 덧붙였다. 트럼프 대통령은 뒤이어 올린 다른 게시글에서는 자신은 두 달 전 이란에 핵합의를 요구하며 60일의 시한을 줬다면서 ""오늘이 61일째다. 나는 그들에게 무엇을 할지 알려줬지만, 그들은 그저 거기에 도달하지 못했다""고 적었다. 그러면서 ""이제 그들은 아마도 두 번째 기회를 가지고 있다""고 덧붙였다. 이란 핵 프로그램의 핵심인 우라늄 농축 시설을 둘러싸고 교착에 빠진 이란과 미국의 핵협상은 오는 15일 오만 무스카트에서 재개될 예정이었지만, 이스라엘은 양국의 핵협상을 이틀 앞둔 이날 새벽 이란을 전격 공습했다. 트럼프 행정부는 핵탄두 원료를 추출할 토대가 되는 자체 우라늄 농축을 포기하라고 이란에 요구하고 있지만, 이란은 이를 거부하고 자국 내에 새로운 농축시설을 추가로 건립하겠다며 트럼프 행정부의 압박에 정면으로 맞서고 있는 상황이다. 이런 가운데 미 ABC 뉴스는 트럼프 대통령이 이날 오전 ABC뉴스 기자와 전화 통화에서 이스라엘의 이란 공격이 ""훌륭했다고 생각한다""고 말했다고 보도했다. 보도에 따르면 트럼프 대통령은 그러면서 ""우리는 그들(이란)에 기회를 줬고 그들은 이를 받아들이지 않았다. 그들은 매우 세게 맞았다""며 ""그리고 앞으로 올 것이 더 많다, 매우 더""라고 말했다. 월스트리트저널(WSJ)은 트럼프 대통령이 이스라엘의 이란 공격 계획에 관해 미리 브리핑 받았다고 보도했다. 트럼프 대통령은 WSJ 기자와의 전화 통화에서 '사전통보를 받았냐'는 질의에 ""사전통보? 그것은 사전통보가 아니었다. 우리는 무슨 일이 벌어지고 있는지 다 알고 있었다""라고 말했다고 이 신문은 전했다. 트럼프 대통령은 전날에 이어 이날도 베냐민 네타냐후 이스라엘 총리와 통화할 예정이라고 말했다. 금융시장 영향에 대해선 ""궁극적으로 시장에 좋을 것이고 역사상 최고의 일이 될 수도 있다""며 ""이란이 인류에 큰 위협이 되는 핵무기를 갖지 못하게 되기 때문""이라고 말했다. 미 CNN 방송은 이날 소식통을 인용해 이번 이스라엘의 공격에도 불구하고 트럼프 행정부는 이란과의 6차 핵협상이 오만에서 예정대로 열리기를 희망하고 있다고 전했다.",2025-06-13 23:31:15,https://www.segye.com/newsView/20250613514835,세계일보
"이스라엘, 왜 이란 공습했나…""핵무기 비밀계획 포착""",https://img.segye.com/content/image/2025/06/13/300/20250613514918.jpg,"이스라엘이 미국과 핵협상 중이던 이란의 핵시설을 13일(현지시간) 전격 공습한 이유에 관심이 집중된다. 이스라엘은 이란이 핵무기를 개발하고 이스라엘 파괴 계획을 세운 것이 포착됐다는 명분을 내세웠지만, 최근 연립정부 붕괴 위기에 몰렸던 베냐민 네타냐후 총리가 이란이라는 외부의 적으로 돌파구를 마련하려 했을 가능성도 제기된다. 이스라엘군은 이날 공습 직후 성명에서 ""지난 몇달간 이란 정권이 '돌이킬 수 없는 지점'에 다다르고 있는 증거가 확보됐다""며 이란이 핵무기 개발의 모든 단계에 걸쳐 기술을 발전시키기 위한 비밀 계획을 추진해왔다고 주장했다. 이란이 수천㎏에 달하는 농축우라늄 생산 노력을 기울인 끝에 단기간에 핵무기를 확보할 수 있게 됐고 핵폭탄에 적합한 무기 부품 생산도 진전했다는 것이다. 이스라엘군은 ""이란은 수십년간 핵무기를 확보하려 노력했고 세계는 이를 막으려 외교적 노력을 기울였지만 이란은 이를 거부했다""며 ""이스라엘은 선택의 여지가 없다""고 강조했다. 또 별도 성명에서 ""이란 정권은 수년간 핵무기 개발, 첨단 장거리미사일과 탄두 개발, 중동 전역의 테러 대리세력에 대한 자금지원과 지휘를 통해 이스라엘에 대한 직간접적 테러 활동을 벌여왔다""고 비난했다. 이어 ""이스라엘군 정보국은 '이스라엘 파괴 계획'이라고 불리는 이란 정권의 구체적 계획을 보여주는 방대한 자료를 수집해 분석해왔다""고 강조했다. 이란이 미사일과 무인기(드론) 수만기 생산에 집중하며 여러 전선에서 동시에 이스라엘 대한 '합동 지상공격'을 꾸며왔다는 것이다. 이스라엘군은 거듭 ""우리 국민을 보호하기 위해 이스라엘은 선택의 여지가 없었다""며 공격의 정당성과 불가피성을 부각했다. 그러나 이는 이스라엘이 '맹방' 미국마저 만류해온 이란 핵시설 공습을, 그것도 핵협상이 한창인 시기에 감행했는지를 설명하기에는 충분하지 않다는 지적이 나온다. 이란 공격이 '내부용'이라는 해석이 나오는 이유다. 네타냐후 내각은 2023년 10월 이스라엘이 팔레스타인 무장정파 하마스에 기습 공격을 당한 직후 이를 제대로 대비하지 못했다는 비판 여론으로 위기에 내몰렸다. 그러자 강도높은 하마스 소탕전을 벌임과 동시에 레바논 무장정파 헤즈볼라, 예멘의 후티 반군 등 중동의 친이란 무장세력들과 다면전을 벌이는 것으로 정권을 지탱해왔다. 하지만 이스라엘군의 압도적인 화력으로 하마스와 헤즈볼라의 지도부가 궤멸하다시피 하면서 전쟁의 긴장도는 낮아졌고, 다시 이스라엘 야권에서는 네타냐후 정권을 실각시켜야 한다는 목소리가 커졌다. 특히 지난 12일 이스라엘 야권이 발의한 연립정부 해산안이 의회(크네세트)에서 간신히 부결되자 네타냐후 내각을 자극했을 것으로 보인다. 네타냐후 총리가 속한 집권 리쿠르당은 연정 파트너인 보수 종교주의 진영이 초정통파 유대교도 '하레디'에 대한 징집 확대 방침에 불만을 품고 이탈하려 하는 것을 극적 타협안 도출로 막았지만 6개월 뒤면 또다시 해산안이 발의될 수 있다는 점에서 불씨가 여전하다. 이런 상황에서 네타냐후 정권은 이스라엘의 적성국 이란의 핵시설 파괴라는 숙원을 달성, 국내 여론을 외부로 분산해 한동안 안정적인 통치를 이어갈 수 있게 됐다. 도널드 트럼프 미국 대통령과 네타냐후 총리가 이번 공습과 관련해 암묵적인 소통을 주고받았을 가능성도 있다. 이날 공습 직후 마코 루비오 미국 국무장관은 ""이스라엘이 이란에 대해 단독 행동을 했다""며 ""이스라엘은 이번 조처가 자위를 위해 필요하다고 믿는다고 우리에게 통보해왔다""고 선을 그었다. 하지만 이스라엘 관리들은 ""이스라엘은 이란이 핵무기 개발에 돌파구를 마련했다는 증거를 미국에 제시했고, 공습과 관련해 미국과 완전히 공조했다""고 말했다고 예루살렘포스트가 보도했다. 특히 트럼프 대통령이 전날 이스라엘의 이란 공격 가능성에 대해 ""임박했다고 말하고 싶지는 않지만 일어날 가능성이 매우 큰 일로 보인다""고 언급했고 이스라엘이 이를 '그린라이트'로 받아들였을 것이라고 이 매체는 설명했다. 이 발언 직후 트럼프 대통령이 소셜미디어에 ""우리는 이란 핵 문제를 '외교적 해결'로 풀겠다는 약속을 유지한다""고 말을 바꾼 것은 이스라엘의 공습 계획을 이란이 눈치챌 수 있다는 우려 때문이라는 것이다. 미국과 이란의 핵협상에서 이란이 우라늄 농축을 포기할 수 없다고 버티며 논의가 교착에 빠지자 트럼프 대통령도 '극약처방'에 기울었을 것이고, 결국 줄기차게 핵시설 폭격을 주장해온 네타냐후 총리와 이해가 맞아떨어졌을 것이라는 시각이다. 공습 시점이 협상 불과 이틀 전이라는 점은 역설적으로 이같은 분석을 뒷받침한다. [https://youtu.be/V98y_--VDFU]",2025-06-13 19:57:31,https://www.segye.com/newsView/20250613514862,세계일보
“제발 그만 시켜주세요”…알바가 울부짖은 ‘이것’ 벌써 50만개 팔렸다,https://img.segye.com/content/image/2025/06/14/300/20250614502076.jpg,"유통업체들이 저렴한 1인용 컵빙수로 여름 시장을 공략하며 인기를 끌고 있다. 고물가 장기화로 소비자들이 지갑을 조심스럽게 여는 가운데, 소형 제품 중심의 라인업을 확대한 전략이 주효했다는 분석이다. 14일 업계에 따르면 메가MGC커피가 지난 4월 말 출시한 ‘팥빙 젤라또 파르페’와 ‘망빙 파르페’는 출시 한 달도 채 되지 않아 누적 판매량 50만개를 돌",2025-06-14 06:35:18,http://www.segye.com/newsView/20250614502082,세계일보
"건설연, 비탈면 유지관리 스마트 호환센서 개발",,한국건설기술연구원(건설연)은 다양한 제조사의 센서와 호환되는 스마트 센서 및 통합형 데이터 수집장치를 개발했다고 13일 밝혔다. 산사태나 낙석 위험이 높은 비탈면 등 주요 토목구조물에는 재난 예방과 안전관리를 위한 계측시스템이 운용된다. 하지만 계측시스템에 여러 제조사의 유사 센서를 혼용하면 유지관리가 어렵고 비용 늘어난다는 문제점이 있다. 아울러,2025-06-14 06:26:07,http://www.segye.com/newsView/20250613506613,세계일보
"HD현대, 국내 최초 전기추진 함정용 ‘고압 추진 드라이브’ 제품 개발",https://img.segye.com/content/image/2025/06/13/300/20250613504401.jpg,"HD현대가 국내 최초로 모듈형 구조의 ‘고압 추진 드라이브’ 제품 개발에 성공했다. HD현대의 조선 부문 중간지주사인 HD한국조선해양은 최근 MMC(Modular Multilevel Converter) 구조 고압 추진 드라이브 제품 개발 및 육상 실증에 성공했다고 13일 밝혔다. 기술 시연회에는 김성준 HD한국조선해양 대표, 주원호 HD현대중공업 특수선",2025-06-14 06:25:05,http://www.segye.com/newsView/20250613504404,세계일보
"“전세가 12억이라고요?”…집 없는 서울, 더 절망이 된다",https://img.segye.com/content/image/2025/06/13/300/20250613513975.jpg,서울 아파트 전세 시장이 빠르게 과열되고 있다. 일부 지역에서는 전셋값이 단기간에 수억원씩 치솟았다. 매매가와 함께 전세가도 가파른 상승세를 보이고 있다. 내년까지 신규 입주 물량이 제한적인 상황에서 ‘전세 대란’에 대한 우려가 점차 현실로 다가오고 있다는 분석이 나온다. 14일 부동산업계에 따르면 서울 서초구 반포동의 ‘반포 자이’ 전용면적 59㎡,2025-06-14 05:22:48,http://www.segye.com/newsView/20250611504539,세계일보
"코레일유통, 7월부터 신규 중소기업 상품 298개 선정",https://img.segye.com/content/image/2025/06/13/300/20250613514813.jpg,코레일유통은 전국 KTX역에 위치한 ‘중소기업명품마루’에서 하반기부터 판매할 중소기업 상품 298개를 선정했다고 13일 밝혔다. 코레일유통은 올해 2분기 ‘중소기업 입점기업 선정위원회’를 개최해 총 70개 중소기업을 신규 선정했다. 선정된 기업 298개 제품은 7월부터 ‘중소기업명품마루’ 매장에 입점해 판매될 예정이다. 중소기업명품마루는 코레일유,2025-06-13 23:00:00,http://www.segye.com/newsView/20250613514814,세계일보
2조5000억원 AI 컴퓨팅 센터 구축 사업 2차 공모에도 참여 기업 ‘0’,https://img.segye.com/content/image/2025/06/13/300/20250613515341.jpg,최대 2조5000억원을 투입해 인공지능(AI) 학습용그래픽처리장치(GPU) 기반을 마련하겠다며 정부가 야심 차게 추진했던 ‘국가 AI 컴퓨팅 센터’ 사업이 두 차례나 공모를 진행했음에도 참여 기업이 나오지 않아 백지화가 됐다. 과학기술정보통신부는 13일 국가 AI 컴퓨팅 센터 구축 사업 재공고에 지원한 민간 컨소시엄이 없어 최종 유찰됐다고 밝혔다.,2025-06-13 21:05:51,http://www.segye.com/newsView/20250613515254,세계일보
"취임 9일 만에 재계 만난 李
“유연한 통상정책으로 위기 총력대응”",https://img.segye.com/content/image/2025/06/13/300/20250613514966.jpg,이재명 대통령이 취임 9일째인 13일 재계와 첫 만남을 가졌다. 역대 민주당 출신 대통령 중 취임 후 가장 빨리 재계와 마주 앉은 것이다. 이 대통령은 이날 서울 용산 대통령실에서 경제 6 단체장 및 5대 그룹 총수와 간담회를 진행했다. 이 대통령은 “국민의 생명과 안전을 지키는 치안·안보 문제는 당연히 정부가 기본적으로 해야 할 일이고 그 외에 제일,2025-06-13 20:03:18,http://www.segye.com/newsView/20250613513533,세계일보
가격표 보고 입이 ‘쩍’…알고도 놀라는 ‘샤오미’의 가성비,https://img.segye.com/content/image/2025/06/13/300/20250613513266.jpg,"소파 등의 먼지와 진드기 등을 강력하게 빨아들이는 진공청소기는 5만4800원, 속칭 ‘바리깡’이라 부르는 이발기는 3만4800원, 버튼 하나만 누르면 뜨거운 증기가 나오는 ‘휴대용 스팀 다리미’는 5만9800원…. 13일 오후 서울 강남구 코엑스 D홀 ‘스마트 테크 코리아(Smart Tech Korea·STK) 2025’ 박람회에 마련된 중국 IT업체",2025-06-13 17:12:58,http://www.segye.com/newsView/20250613513229,세계일보
유기농데이(6월2일) 기념 농협 친환경농산물 최대 44% 할인행사 실시,https://img.segye.com/content/image/2025/06/13/300/20250613513025.jpg,"농협(회장 강호동) 경제지주(농업경제대표이사 박서홍)는 유기농데이를 기념해 12일부터 7일간 전국 주요 하나로마트 62개소에서 친환경농산물* 우수성 홍보 및 소비촉진을 위한 할인행사를 진행한다. * 친환경농산물 : 합성농약, 화학자재를 사용하지 않거나 최소화하고, 농업생태계와 환경을 유지·보전하면서 생산되어, 소비자들이 안심하고 먹을 수 있는 농산물 유",2025-06-13 16:55:32,http://www.segye.com/newsView/20250613513042,세계일보
"농협상호금융, NH콕뱅크에서 농협손해보험 서비스 도입",https://img.segye.com/content/image/2025/06/13/300/20250613512864.jpg,농협(회장 강호동) 상호금융(대표이사 여영현)은 지난 12일 대표 모바일 플랫폼 「NH콕뱅크」에서 「NH농협손해보험」 서비스를 오픈하고 생활금융 서비스를 강화하여 고객 이용 편의를 제고했다고 밝혔다. 「NH농협손해보험」 서비스는 「NH콕뱅크」 앱에서 별도의 앱 다운로드 없이 ▲보험계약 정보 조회 ▲보험상품 추천 ▲셀프 보장 분석 ▲보험금 청구 연계 등,2025-06-13 16:44:57,http://www.segye.com/newsView/20250613512878,세계일보
