title,thumbnail,short_content,write_time,link,company
"국내 연구진, 두경부암 초기 발생에 관여하는 돌연변이 유전자 확인",https://img.segye.com/content/image/2025/04/17/300/20250417510041.jpg,"국내 의료진이 두경부암 초기 발생에 관여하는 돌연변이 유전자를 공동연구를 통해 밝혀냈다. 강남세브란스병원 이비인후과 박영민 교수팀은 미국 서던캘리포니아대(USC) 두경부센터 남제현 박사 등과 공동 연구팀을 꾸려 두경부암 발생 전 단계를 실제와 같이 구현한 '3차원 오가노이드(Organoid) 모델'을 개발하고, 두경부암 초기 발생에 관여하는 유전자 돌연",2025-04-17 13:24:03,http://www.segye.com/newsView/20250417510043,세계일보
"협심증 수술 받은 당뇨환자, 수술 후 운동 시작해도 심부전 등 위험 감소",https://img.segye.com/content/image/2025/04/17/300/20250417509221.jpg,"관상동맥중재시술 전·후 유산소운동을 꾸준히 유지한 당뇨병 환자는 전혀 운동하지 않는 환자보다 심혈관사건(사망, 심근경색, 재관류술, 심부전) 위험이 22% 감소하는 것으로 나타났다. 서울대병원 순환기내과 한정규 교수팀(숭실대 한경도 교수)은 2009∼2012년 사이 관상동맥 중재시술을 받은 당뇨병 환자 8225명을 유산소운동 습관 변화에 따라 평균 4",2025-04-17 13:20:09,http://www.segye.com/newsView/20250417509222,세계일보
"관상동맥시술 받은 당뇨병 환자, 심혈관 위험 낮추려면 [건강+]",https://img.segye.com/content/image/2025/04/17/300/20250417507758.jpg,"‘관상동맥중재시술법’은 심장의 근육에 피를 공급하는 관상동맥이 좁아지거나 막혔을 때 좁아진 혈관에 스텐트를 삽입해 혈관을 넓히는 시술이다. 이 시술 전후 유산소운동을 꾸준히 유지한 당뇨병 환자는 전혀 운동하지 않는 환자보다 심혈관질환(사망, 심근경색, 재관류술, 심부전) 위험이 22% 감소하는 것으로 나타났다. 17일 서울대병원 순환기내과 한정규 교수",2025-04-17 11:14:49,http://www.segye.com/newsView/20250417507551,세계일보
"유럽서 활동한 독립운동가 서영해, 관련 자료 등록문화유산된다",https://img.segye.com/content/image/2025/04/17/300/20250417504693.jpg,일제 강점기 유럽에서 활동한 독립운동가 서영해 관련 자료가 국가등록문화유산이 된다. 국가유산청은 ‘독립운동가 서영해 관련 자료’를 국가등록문화유산으로 등록할 예정이라고 17일 예고했다. 서영해(본명 서희수)는 일제 강점기 유럽에서 독립운동을 주도적으로 이끌었던 인물이다. 1929년 프랑스 파리에 설립한 고려통신사를 중심으로 대한민국임시정부 외교 특파원,2025-04-17 11:28:17,http://www.segye.com/newsView/20250417504648,세계일보
'금융맨' 효민 남편 정체는…서울대 출신 사모펀드 전무,https://img.segye.com/content/image/2025/04/17/300/20250417517611.jpg,"‘금융맨’으로만 알려졌던 그룹 티아라 효민의 남편 정체가 공개됐다. 17일 파이낸셜뉴스는 투자은행(IB)업계 등의 말을 빌려 효민의 남편이 글로벌 사모펀드(PEF) 베인캐피탈 한국 사무소 김현승 전무라고 보도했다. 베인캐피탈은 최근 두각을 드러내고 있는 글로벌 PEF로, 효민의 남편인 김 전무는 이곳의 핵심 키맨으로 주요 딜 담당 및 포트폴리오 관리",2025-04-17 18:06:25,http://www.segye.com/newsView/20250417517555,세계일보
"다이어트 요요로 30kg 증량...홍윤화, 40kg 감량 선언 후 12kg 빠진 근황",https://img.segye.com/content/image/2025/04/17/300/20250417517357.jpg,"개그우먼 홍윤화가 40kg 감량을 선언한 가운데 12kg이 빠졌다고 밝혔다. 지난 16일, 유튜브 채널 ‘홍윤기 김민기 꽁냥꽁냥’에는 “패티부터 마요네즈까지 직접 만든 윤화표 두툼 새우 버거ㅣ‘덜’ 찌는 레시피”라는 제목의 영상이 게재됐다. 공개된 영상에서는 홍윤화가 다이어트 근황을 밝혔다. 이날 홍윤화는 “더욱 건강해지고 있다”며 밝게 인사했다",2025-04-17 17:52:29,http://www.segye.com/newsView/20250417516710,세계일보
"장근석, 80평대 초호화 자택서 '♥여친 흔적' 발견?…""눈썰미 좋네""",https://img.segye.com/content/image/2025/04/17/300/20250417516363.jpg,배우 장근석이 80평대 초호화 자택을 공개했다. 17일 MBN ‘가보자GO’ 측은 오는 20일 11회 본 방송에 앞서 선공개 영상을 게재했다. 이날 게스트로 등장한 장근석은 MC 안정환과 홍현희를 집으로 초대해 다양한 이야기를 나눴다. 이날 집을 둘러보던 안정환은 거실에 놓인 머리띠를 발견하고 “여자친구 거냐”고 물었다. 이에 장근석은 “진짜 눈썰,2025-04-17 17:42:06,http://www.segye.com/newsView/20250417517158,세계일보
"“자연임신 실패, 결혼도 후회”...손민수♥임라라, 250만 유튜브 중단했던 이유",https://img.segye.com/content/image/2025/04/17/300/20250417515868.jpg,"코미디언 부부 손민수, 임라라가 유튜브 활동을 중단할 수밖에 없었던 이유를 고백했다. 지난 16일, 유튜브 채널 ‘엔조이커플’에는 “이렇게 힘들 줄 몰랐습니다...Didn’t expect it to ve this hard..”라는 제목의 영상이 게재됐다. 공개된 영상에서는 손민수, 임라라가 약 한 달만의 근황을 전했다. 이날 두 사람은 “엔조이 커플",2025-04-17 16:49:38,http://www.segye.com/newsView/20250417513721,세계일보
"임채무, 직원 26명에게 아파트 사주고 본인은 노숙 생활",https://img.segye.com/content/image/2025/04/17/300/20250417512962.jpg,배우 임채무가 놀이동산 ‘두리랜드’ 직원들에 대한 남다른 책임감을 드러냈다. 임채무는 과거 채널A ‘풍문으로 들었쇼’에 출연해 놀이동산 ‘두리랜드’에 관한 솔직한 이야기를 전했다. 그는 “두리랜드 전 직원에게 아파트를 선물해 줬다는 이야기가 있는데 사실이냐”는 질문에 “맞다. 내가 80년대 최고 전성기를 누렸을 때 이야기”라고 밝혔다. 그러면서 “,2025-04-17 16:57:14,http://www.segye.com/newsView/20250417512335,세계일보
[포토] 김지연 '완벽한 미모',https://img.segye.com/content/image/2025/04/17/300/20250417514773.jpg,배우 김지연이 17일 서울 양천구 목동SBS에서 열린 SBS 새 금토드라마 '귀궁'의 제작발표회에 참석해 포즈를 취하고 있다. '귀궁'은 영매의 운명을 거부하는 무녀 여리와 여리의 첫사랑 윤갑의 몸에 갇힌 이무기 강철이가 왕가에 원한을 품은 팔척귀에 맞닥뜨리며 몸과 혼이 단단히 꼬여버리는 육신 쟁탈 판타지 로코다.,2025-04-17 16:13:56,http://www.segye.com/newsView/20250417514788,세계일보
[포토] 김지연 '여신의 볼하트',https://img.segye.com/content/image/2025/04/17/300/20250417514734.jpg,배우 김지연이 17일 서울 양천구 목동SBS에서 열린 SBS 새 금토드라마 '귀궁'의 제작발표회에 참석해 포즈를 취하고 있다. '귀궁'은 영매의 운명을 거부하는 무녀 여리와 여리의 첫사랑 윤갑의 몸에 갇힌 이무기 강철이가 왕가에 원한을 품은 팔척귀에 맞닥뜨리며 몸과 혼이 단단히 꼬여버리는 육신 쟁탈 판타지 로코다.,2025-04-17 16:13:18,http://www.segye.com/newsView/20250417514762,세계일보
[포토] 육성재 '반가운 손인사',https://img.segye.com/content/image/2025/04/17/300/20250417514586.jpg,배우 육성재가 17일 서울 양천구 목동SBS에서 열린 SBS 새 금토드라마 '귀궁'의 제작발표회에 참석해 포즈를 취하고 있다. '귀궁'은 영매의 운명을 거부하는 무녀 여리와 여리의 첫사랑 윤갑의 몸에 갇힌 이무기 강철이가 왕가에 원한을 품은 팔척귀에 맞닥뜨리며 몸과 혼이 단단히 꼬여버리는 육신 쟁탈 판타지 로코다.,2025-04-17 16:12:32,http://www.segye.com/newsView/20250417514653,세계일보
[포토] 육성재 '깜찍하게',https://img.segye.com/content/image/2025/04/17/300/20250417514284.jpg,배우 육성재가 17일 서울 양천구 목동SBS에서 열린 SBS 새 금토드라마 '귀궁'의 제작발표회에 참석해 포즈를 취하고 있다. '귀궁'은 영매의 운명을 거부하는 무녀 여리와 여리의 첫사랑 윤갑의 몸에 갇힌 이무기 강철이가 왕가에 원한을 품은 팔척귀에 맞닥뜨리며 몸과 혼이 단단히 꼬여버리는 육신 쟁탈 판타지 로코다.,2025-04-17 16:00:55,http://www.segye.com/newsView/20250417514316,세계일보
[포토] 육성재 '어흥',https://img.segye.com/content/image/2025/04/17/300/20250417514213.jpg,배우 육성재가 17일 서울 양천구 목동SBS에서 열린 SBS 새 금토드라마 '귀궁'의 제작발표회에 참석해 포즈를 취하고 있다. '귀궁'은 영매의 운명을 거부하는 무녀 여리와 여리의 첫사랑 윤갑의 몸에 갇힌 이무기 강철이가 왕가에 원한을 품은 팔척귀에 맞닥뜨리며 몸과 혼이 단단히 꼬여버리는 육신 쟁탈 판타지 로코다.,2025-04-17 15:58:18,http://www.segye.com/newsView/20250417514225,세계일보
[포토] 육성재 '귀궁으로 돌아왔어요!',https://img.segye.com/content/image/2025/04/17/300/20250417514076.jpg,배우 육성재가 17일 서울 양천구 목동SBS에서 열린 SBS 새 금토드라마 '귀궁'의 제작발표회에 참석해 포즈를 취하고 있다. '귀궁'은 영매의 운명을 거부하는 무녀 여리와 여리의 첫사랑 윤갑의 몸에 갇힌 이무기 강철이가 왕가에 원한을 품은 팔척귀에 맞닥뜨리며 몸과 혼이 단단히 꼬여버리는 육신 쟁탈 판타지 로코다.,2025-04-17 15:56:23,http://www.segye.com/newsView/20250417514077,세계일보
[포토] 트와이스 나연 '사랑스러운 볼하트',https://img.segye.com/content/image/2025/04/17/300/20250417511263.jpg,그룹 트와이스 나연이 17일 서울 성수동 한 팝업 스토어에서 열린 슈즈 브랜드 행사에 참석해 포즈를 취하고 있다.,2025-04-17 15:52:47,http://www.segye.com/newsView/20250417511286,세계일보
"'간호사 폭행 혐의' 日 여배우, 석방 후 '활짝' 미소 논란",https://img.segye.com/content/image/2025/04/17/300/20250417514243.jpg,간호사 폭행혐의로 체포된 일본의 여배우 히로스에 료코가 석방 된 후 미소를 지어 논란이 되고 있다. NHK 등 현지 매체에 따르면 히로스에 료코와 피해 간호사 측과 합의가 진행됨에 따라 시즈오카현경은 지난 16일 오전 히로스에를 석방했다. 히로스에는 이날 오전 6시 검은 정장 차림으로 경찰서를 나서며 별다른 입장을 밝히지 않았다. 그녀는 취재진에 3초간,2025-04-17 16:00:10,http://www.segye.com/newsView/20250417511226,세계일보
"‘전원일기 일용이’ 박은수, 80억대 사기 피해로 집 잃어 → 돼지농장서 생활",https://img.segye.com/content/image/2025/04/17/300/20250417513346.jpg,"배우 박은수가 80억대 사기를 당한 후 돼지농장에서 생활했다고 밝혔다. 지난 16일, 유튜브 채널 ‘클레먹타임’에는 ‘전원일기 일용이가 돼지농장에 갈 수밖에 없었던 이유’라는 제목의 영상이 게재됐다. 공개된 영상에서는 박은수가 게스트로 출연해 이동준에게 자신의 인생사를 털어놨다. 이날 이동준은 박은수에게 슬럼프에 빠졌던 적이 있냐고 질문했다. 그는",2025-04-17 15:31:51,http://www.segye.com/newsView/20250417511548,세계일보
"태민, 노제와 열애설 부인…""친한 동료 사이, 억측 자제""",https://img.segye.com/content/image/2025/04/17/300/20250417512202.jpg,샤이니 태민이 노제와의 열애설을 부인했다. 샤이니 멤버 겸 솔로 가수 태민이 댄서 노제와 열애설에 휩싸인 가운데 소속사 빅플래닛메이드엔터가 “두 사람은 친한 동료 사이일 뿐”이라고 해명했다. 17일 빅플래닛메이드엔터는 입장문에서 “태민의 지속적인 스케줄로 인하여 확인이 다소 지연된 점 양해 부탁드린다”며 “두 사람은 같이 일을 해온 친한 동료 사,2025-04-17 14:49:47,http://www.segye.com/newsView/20250417512084,세계일보
"두산, 19일 KIA전 승리기원 시구자로 JTBC 출신 강지영 아나운서",https://img.segye.com/content/image/2025/04/17/300/20250417511700.jpg,"프로야구 두산이 19일 서울 잠실구장에서 열리는 KIA타이거즈와 정규시즌 홈 경기에서 승리기원 시구를 진행한다. 이날 시구는 강지영 아나운서가 맡는다. 2011년 JTBC에 입사한 강지영 아나운서는 ‘정치부회의’, ‘썰전 라이브’ ‘차이나는 클라스’ 등 뉴스, 교양, 예능 등 장르를 넘나들며 다양한 프로그램에서 활약하며 시청자들의 관심을 받았다. JTB",2025-04-17 14:35:40,http://www.segye.com/newsView/20250417511701,세계일보
"키움, 19일 KT전 보이그룹 ‘더보이즈’ 에릭 시구 및 케빈 시타",https://img.segye.com/content/image/2025/04/17/300/20250417511595.jpg,"프로야구 키움은 19일 서울 고척스카이돔에서 열리는 KT와의 홈 경기의 시구, 시타자로 보이그룹 ‘더보이즈(THE BOYZ)’의 멤버 에릭과 케빈으로 선정했다고 17일 밝혔다. 이날 시구자로 나서는 에릭은 “첫 시구 때 너무 긴장해 아쉬운 모습을 보인 것 같아 다시 도전한다. 항상 히어로즈를 응원하고 있다. 지난번 시구에 하지 못한 ‘승리요정’ 이번에는 꼭",2025-04-17 14:32:58,http://www.segye.com/newsView/20250417511597,세계일보
"이정후, 시즌 10호 2루타…멀티히트 행진",https://img.segye.com/content/image/2025/04/17/300/20250417507719.jpg,"미국프로야구 메이저리그(MLB) 샌프란시스코 자이언츠 이정후(27)가 빅리그에서 2025시즌 가장 먼저 2루타 10개를 때린 선수가 됐다. 이정후는 17일(한국시간) 미국 펜실베이니아주 필라델피아의 시티즌스 뱅크 파크에서 열린 2025 MLB 정규시즌 필라델피아 필리스와 원정 경기에서 3번 타자 중견수로 선발 출전해 5타수 2안타, 2타점, 2득점으로 활약",2025-04-17 11:23:40,http://www.segye.com/newsView/20250417507601,세계일보
"이창호, 시니어 세계바둑대회 초대 우승",https://img.segye.com/content/image/2025/04/17/300/20250417506004.jpg,"50세 이상 기사를 대상으로 열리는 첫 대회, 시니어 세계바둑대회에서 ‘돌부처’ 이창호(50) 9단이 정상에 올라섰다. 이창호는 16일 서울 성동구 한국기원 바둑TV스튜디오에서 열린 제1회 블리츠자산운용 시니어 세계바둑 오픈 결승에서 유창혁(59) 9단에게 304수 만에 흑 2집 반승을 거뒀다. 이번 승리로 이창호는 상금 3000만원을 가져갔다. 2000",2025-04-17 10:57:31,http://www.segye.com/newsView/20250417505969,세계일보
‘최대어’ 임성진의 KB손해보험 이적의 ‘나비효과’? 남자 프로배구 FA 시장이 요동친다,https://img.segye.com/content/image/2025/04/17/300/20250417500405.jpg,"남자 프로배구 FA 시장이 요동친다. 현대캐피탈의 2005~2006시즌 이후 19년 만의 통합 우승이자 2018~2019시즌 이후 챔피언결정전 우승으로 마무리된 V리그 남자부는 지난 8일부터 FA 시장이 개막했다. 공시 이후 2주가 지나는 시점인 21일 오후 6시에 협상기간이 마무리되는 가운데, 대어들의 이적이 속속들이 드러나고 있다. 가장 관심을 모은",2025-04-17 09:46:18,http://www.segye.com/newsView/20250417500406,세계일보
"LG, 꿈의 100승 가능할까",https://img.segye.com/content/image/2025/04/17/300/20250417500661.jpg,그야말로 ‘미친 상승세’다. 이대로라면 ‘꿈의 100승’도 가능한 페이스로 달려나가고 있다. 프로야구 LG가 시즌 초반 압도적인 승률로 치고나가고 있다. 산술적으로는 121승까지 가능한 페이스다. LG는 16일 서울 잠실구장에서 열린 2025 KBO리그에서 삼성을 12-2로 대파했다. 전날 팀 노히트 노런으로 삼성 타선을 침묵시킨 데 이어 이날은 선취점,2025-04-17 07:00:00,http://www.segye.com/newsView/20250417500532,세계일보
임진희 모자 빈 칸에 ‘신한금융’ 새긴다,https://img.segye.com/content/image/2025/04/16/300/20250416518709.jpg,신한금융이 미국여자프로골프(LPGA)에서 활약 중인 임진희(사진)와 메인 스폰서 계약을 체결했다고 16일 밝혔다. 임진희는 프로 데뷔 후 5년 동안 무명 시절을 보내다 2021년 한국여자프로골프(KLPGA)에서 첫 우승을 거머쥔 ‘노력의 아이콘’으로 알려져 있다. 2023년에는 시즌 4승을 거두며 KLPGA 다승왕까지 올랐다. 지난해 LPGA Q,2025-04-16 20:53:41,http://www.segye.com/newsView/20250416516071,세계일보
"이강인 또 결장… PSG, 챔스 4강행",https://img.segye.com/content/image/2025/04/16/300/20250416519108.jpg,대한민국 축구대표팀의 간판 이강인이 뛰고 있는 프랑스 파리 생제르맹(PSG)이 유럽축구연맹 챔피언스리그(UCL) 4강 진출에 성공했다. 2024~2025 프랑스 리그1 조기 우승을 확정한 데다 쿠프 드 프랑스(프랑스컵) 결승에 진출한 PSG는 첫 UCL 우승트로피와 함께 ‘트레블’을 이루겠다는 각오다. 한국 축구팬들로선 이강인이 PSG가 치르는 주요 경기에,2025-04-16 20:37:00,http://www.segye.com/newsView/20250416516098,세계일보
"이정후, 이쯤되면 ‘2루타 기계’",https://img.segye.com/content/image/2025/04/16/300/20250416518721.jpg,처음 밟은 뉴욕 양키스타디움에서 맹활약을 펼친 미국 메이저리그(MLB) 샌프란시스코 자이언츠 이정후(27·사진)가 필라델피아 필리스와의 원정 경기 첫날 5타수 무안타 3삼진을 기록한 수모를 씻어냈다. 이정후는 16일 펜실베니아주 필라델피아 시티즌스 뱅크 파크에서 열린 필라델피아 필리스와의 원정 경기에 3번 타자 중견수로 선발 출장해 4타수 2안타 1타,2025-04-16 20:35:52,http://www.segye.com/newsView/20250416516090,세계일보
8할 승률 LG “우리 못 당하겠지?”,https://img.segye.com/content/image/2025/04/16/300/20250416520581.jpg,"“2023년 우승 때와 느낌이 비슷하다.” 프로야구 LG 염경엽 감독이 지난 15일 서울 잠실구장에서 열린 삼성전을 앞두고 한 말이다. 아직 시즌 초반이라고는 해도 1994년 이후 29년 만에 한국시리즈를 우승할 때만큼 팀 분위기가 좋다는 의미다. 그도 그럴 것이 2025시즌 들어 LG는 마운드와 타선, 수비까지 모두 잘 돌아간다. 패하는 경기가 드물고",2025-04-16 23:30:36,http://www.segye.com/newsView/20250416516108,세계일보
"유승민 대한체육회장 “스포츠윤리센터 조사와 판단 존중하지만, 종목 수익사업 활동 제약 없도록 개선하겠다”",https://img.segye.com/content/image/2025/04/16/300/20250416516455.jpg,유승민 대한체육회장이 최근 문화체육관광부 산하 스포츠윤리센터가 자신의 대한탁구협회장 시절의 인센티브 부당 지급과 관련해 협회에 징계를 요구한 것과 관련해 스포츠윤리센터의 조사와 판단을 존중한다는 뜻을 밝혔다. 또 비슷한 상황의 다른 종목 단체들의 수익사업 활동에 제약이 없도록 필요한 부분은 개선하겠다는 입장이다. 유승민 회장은 16일 오전 충북 진천국가,2025-04-16 18:09:35,http://www.segye.com/newsView/20250416516459,세계일보
"‘수원 프린스’에서 이제 ‘의정부 프린스’로...FA 최대어 임성진, KB손해보험으로 최고 대우로 이적",https://img.segye.com/content/image/2025/04/16/300/20250416517395.jpg,"‘수원 프린스’가 이제는 ‘의정부 프린스’가 된다. 남자 프로배구 KB손해보험이 ‘FA 최대어’로 꼽혔던, 한국전력에서 FA로 풀린 아웃사이드 히터 임성진을 치열한 경쟁 끝에 품으며 전력을 급상승시켰다. 차기 시즌 ‘디펜딩 챔피언’ 현대캐피탈의 가장 큰 대항마로 떠오른 KB손해보험이다. KB손해보험은 16일 임성진과의 FA 계약을 마쳤다고 밝혔다. 계약",2025-04-16 17:51:18,http://www.segye.com/newsView/20250416517396,세계일보
"대한항공, FA로 풀린 김선호 영입",https://img.segye.com/content/image/2025/04/16/300/20250416514740.jpg,"남자 프로배구 ‘통합우스 5연패’ 도전이 좌절된 대한항공이 리빌딩을 위해 외부 전력을 수혈한다. 현대캐피탈에서 FA로 풀린 김선호를 영입했다. 대한항공은 16일 현대캐피탈 소속 아웃사이드 히터 김선호를 FA계약을 통해 영입한다고 밝혔다. 계약 조건은 계약기간 3년에 연봉 1억5000만원, 옵션 5000만원이다. 김선호 선수는 한양대 3학년 재학",2025-04-16 16:20:32,http://www.segye.com/newsView/20250416514718,세계일보
"샷감 뜨거운 김효주, 메이저 대회 전초전서 시즌 2승 도전",https://img.segye.com/content/image/2025/04/16/300/20250416513903.jpg,"지난해 미국여자프로골프(LPGA) 투어에서 3승을 합작하는데 그쳤던 한국여자골프는 시즌 초반에 김아림(30·메디힐)과 김효주(29·롯데)가 2승을 만들며 분위기를 확 바꿨다. 그중 김효주의 상승세가 아주 좋다. 그는 시즌 개막전 힐트 그랜드 베케이션 토너먼트에서 10위에 올라 시즌을 산뜻하게 출발했다. 이후 공동 28위, 45위로 주춤했지만 HSBC 위민스",2025-04-16 16:11:00,http://www.segye.com/newsView/20250416513778,세계일보
"“마지막 시상식이라 제일 튀어 보이고 싶었어요” ‘G.O.A.T’ 김연경의 은퇴가 더욱 아쉬운 이유, 특유의 위트 섞인 인터뷰가 더 그리울 것 같아서 [남정훈의 오버 더 네트]",https://img.segye.com/content/image/2025/04/16/300/20250416507274.jpg,"스포츠에서 자주 나오는 논쟁이 있다. 그 종목의 역사상 최고의 선수를 뜻하는 단어인 ‘G.O.A.T’(Greatest Of All Time)가 누구냐는 것이다. 한국의 4대 프로스포츠로 꼽히는 야구-축구-농구-배구에서도 ‘G.O.A.T’ 논쟁이 팬들의 주요 논쟁거리다. 야구에선 타자는 ‘추강대엽’(추신수-강정호-이대호-이승엽), 투수는 선동열, 박찬호,",2025-04-16 11:27:16,http://www.segye.com/newsView/20250416507280,세계일보
"‘3삼진 굴욕’으로 식었던 이정후의 방망이, 하루 만에 뜨거워졌다…2루타 ML 단독 선두 등극에 주심의 행운 섞인 콜에 적시타까지",https://img.segye.com/content/image/2025/04/16/300/20250416506176.jpg,양키 스타디움에서의 역사적인 활약 이후 시티즌스 뱅크 파크로 옮긴 첫날 5타수 무안타 3삼진의 굴욕을 당했던 샌프란시스코 자이언츠의 ‘바람의 손자’ 이정후(27)가 다시금 뜨거워진 방망이를 자랑했다. 이정후는 16일(이하 한국시간) 미국 펜실베니아주 필라델피아에 위치한 시티즌스 뱅크 파크에서 열린 2025 미국 메이저리그(MLB) 필라델피아 필리스와의 원정,2025-04-16 10:35:02,http://www.segye.com/newsView/20250416506184,세계일보
"삼성 후라도, 불운의 아이콘 되나",https://img.segye.com/content/image/2025/04/16/300/20250416503636.jpg,이 정도면 불운의 아이콘이라고 해야 할까. 연일 호투를 펼치지만 팀 타선의 지원부족으로 패전의 아픔만 쌓이는 투수가 있다. 바로 삼성 외국인 선수 아리엘 후라도다. 후라도의 2025시즌 성적은 4경기 등판에 승리 없이 3패다. 하지만 평균자책점은 2.25로 준수하다. 팀이 3점만 뽑아주면 승리할 수 있었다는 얘기다. 하지만 후라도가 마운드에 서면 삼성,2025-04-16 08:52:27,http://www.segye.com/newsView/20250416503611,세계일보
"남자부 초대 영플레이어상 수상자 우리카드 세터 한태준의 야심찬 포부…“30주년 베스트7은 택의 형, 40주년은 제껍니다”",https://img.segye.com/content/image/2025/04/16/300/20250416500298.jpg,“30주년은 (황)택의 형이 받을 것 같고...저는 40주년을 노려보겠습니다” 지난 14일 서울 스위스 그랜드 호텔에서 열린 2024~2025 V리그 시상식 영플레이어상 남자부 수상자인 우리카드의 세터 한태준이 기자회견에서 한 말이다. 무슨 사연이었을까? 이날 시상식에서는 V리그 20주년 베스트7을 선정해 시상했다. 남자부 세터 부문은 ‘대한항공 왕,2025-04-16 08:00:00,http://www.segye.com/newsView/20250416500302,세계일보
2차전도 잡은 현대모비스… 4강 진출 눈앞,https://img.segye.com/content/image/2025/04/15/300/20250415519589.jpg,"프로농구 울산 현대모비스가 6강 플레이오프(PO·5전3승제) 1, 2차전에 모두 승리하며 4강 PO 진출 확률 100를 잡았다. 현대모비스는 15일 울산 동천체육관에서 열린 2024∼2025 KCC 프로농구 6강 PO 2차전 홈 경기에서 게이지 프림(21점 5리바운드)과 서명진(13점 5리바운드 3도움)이 34점을 합작하며 공격을 이끈 데 힘입어 안양",2025-04-15 22:49:06,http://www.segye.com/newsView/20250415519446,세계일보
