title,thumbnail,short_content,write_time,link,company
"대구, 16경기 연속 無승… 2부 강등 초읽기",https://img.segye.com/content/image/2025/08/24/300/20250824508458.jpg,2003년부터 K리그에 뛰어든 대구FC가 역대 두 번째 강등 위기에 몰렸다. ‘대구의 왕’ 세징야가 나홀로 고군분투하고 있지만 대구가 K리그1에서 살아남기는 어려워 보인다. 대구는 지난 24일 대구 iM뱅크파크에서 열린 제주 유나이티드와 K리그1 27라운드에서 2-2 무승부를 거뒀다. 대구로선 비긴 게 다행이었다. 전반을 0-0으로 마친 두 팀은 후반,2025-08-24 22:00:00,http://www.segye.com/newsView/20250824508457,세계일보
587 최소경기 만에… 1000만 관중 ‘홈런’… 1200만 고지 넘본다,https://img.segye.com/content/image/2025/08/24/300/20250824509598.jpg,2008년 8월23일 한국 야구는 역사상 길이 남을 쾌거를 이룩했다. 2008 베이징 올림픽 야구 결승에서 쿠바를 3-2로 꺾고 금메달을 따낸 것. 그것도 예선부터 결승까지 9전 전승으로 금메달을 따낸 날을 기념해 한국야구위원회(KBO)는 이듬해부터 8월23일을 ‘야구의 날’로 지정했다. 야구의 날 17주년인 올해 8월23일에도 또 하나의 기념비적인 이,2025-08-24 22:00:00,http://www.segye.com/newsView/20250824508448,세계일보
"KT 소형준은 선발 체질이었나, 18일 만의 선발 복귀전에서 7이닝 1실점으로 시즌 8승째 신고...“충분히 시간을 주셔서 선발 루틴대로 던질 수 있었다”",https://img.segye.com/content/image/2025/08/24/300/20250824510244.jpg,그는 선발 체질이었던 것인가. KT의 토종 에이스 소형준이 선발 복귀전에서 7이닝 1실점 호투로 시즌 8승(6패)째를 챙겼다. 소형준은 24일 서울 잠실구장에서 열린 2025 KBO리그 두산과의 원정 경기에 선발 등판했다. 지난 2023년 5월 팔꿈치 인대 접합 수술을 받은 소형준은 지난해 9월 마운드에 복귀했다. 보직은 불펜이었다. 올 시즌은 개막부터,2025-08-24 21:58:38,http://www.segye.com/newsView/20250824510250,세계일보
"‘엄상백 보상선수’ KT 장진혁의 벼락같은 대타 쓰리런 홈런포 한 방...KT, 두산과의 주말 3연전 싹쓸이하며 ‘4위’로 점프, 두산은 7연승 뒤 3연패",https://img.segye.com/content/image/2025/08/24/300/20250824510065.jpg,"어설픈 ‘좌우놀이’를 응징하는 화끈한 한 방이었다. ‘마법사 군단’ KT가 8회 터진 대타 장진혁의 쓰리런 홈런을 앞세워 두산과의 주말 3연전을 모두 잡았다. KT는 24일 서울 잠실구장에서 열린 2025 KBO리그 두산과의 원정 경기에서 0-1로 뒤진 8회 2사 1,2루에서 나온 대타 장진혁의 대포 하나로 3-1 승리를 거뒀다. 이날 승리로 KT는 두",2025-08-24 21:06:45,http://www.segye.com/newsView/20250824510073,세계일보
주한미군기지 땅 달라는 트럼프…미군감축·방위비 대신 꺼낸 이유는 [뉴스+],https://img.segye.com/content/image/2025/08/26/300/20250826517716.jpg,"도널드 트럼프 미국 대통령이 25일(현지시간) 이재명 대통령과의 정상회담에서 주한미군기지의 부지 소유권을 넘겨받고 싶다고 말해 논란이 예상된다. 주한미군기지에 대한 소유권을 건네받으려면 한미주둔군지위협정(SOFA) 개정이 필요하기 때문이다. 트럼프 대통령의 이번 발언은 방위비 분담금 증액 등을 노린 협상용 포석이라는 해석이 나온다. 트럼프 대통령은 이날 백악관에서 열린 이 대통령과의 정상회담에서 “내가 하고 싶은 것은 우리가 사용하는 큰 군사기지 부지의 소유권을 한국으로부터 넘겨받는 것”이라며 “우리는 그 부지를 짓는데 막대한 자금을 투자했다. 한국도 일정 부분 기여했다”고 밝혔다. 이어 “임대 계약을 해지하고 대규모 군사기지가 있는 땅의 소유권을 얻을 수 있는지 알아보고 싶다”며 “우리(한·미)는 군사적으로 매우 좋은 관계를 유지하고 있고 한국은 우리에게 땅을 줬다고 말하지만 사실은 임대한 것이다. ‘주는 것’과 ‘빌려주는 것’은 매우 큰 차이가 있다”고 덧붙였다. 그는 주한미군 감축을 고려하냐는 질문에는 “그걸 지금 말하고 싶지는 않다. 우리는 친구이기 때문”이라고 답했다. 미군은 한국에서 경기 평택 캠프 험프리스 등 10여개의 주요 기지를 운영하고 있다. 이 가운데 캠프 험프리스는 해외 미군기지 중 가장 큰 규모로, 평택시 전체의 3.5%인 1470만㎡에 달한다. 2017년 트럼프 대통령이 한국을 국빈 방문 했을 당시 헬기를 타고 기지를 둘러본 바 있다. 다만, 트럼프 대통령의 소유권 이전 발언은 실현가능성이 낮다는 평가가 지배적이다. 한미주둔군지위협정(SOFA) 제2조에 따라 미군이 사용하는 토지와 시설은 한국 정부 소유다. 한국 정부는 SOFA에 근거해 주한미군에 임차료를 받지 않고 기지 부지를 ‘무상 공여(무상 제공)’하고 있다. 대신 기지 내 관리와 출입 통제 등 운영권은 미군이 행사한다. 현 SOFA 체제는 주한미군이 부지를 무상으로 사용하지만 “더 필요가 없게 되는 때에는 대한민국에 반환되어야 한다”(SOFA 제2조)고도 규정하고 있다. 미군이 해당 부지에 대한 소유권이 없음을 밝히고 있는 것이다. 위성락 국가안보실장은 한미정상회담 이후 언론 브리핑에서 “주한미군 부지는 우리가 공여하는 것이지 우리가 주고 지대(rent)를 받는 개념은 아니다”라고 못 박았다. 또 트럼프 대통령이 “주한미군기지 건설에 많은 돈을 썼다”고 언급한 것도 사실과 다르다. 주한미군기지 건설비용은 대부분 한국이 부담했다. 2016년 4월 당시 빈센트 브룩스 주한미군 사령관은 “(기지 건설에) 약 108억달러(약 16조원)가 투입됐고, 이 중 한국이 90% 이상을 투자했다”며 “90%를 부담한 만큼 미국은 여러분과 함께 100% 동행한다”고 밝힌 바 있다. 트럼프 대통령의 이번 발언은 방위비 분담금 증액 등을 노린 협상용 포석이라고 해석이 나온다. 웬디 커틀러 아시아소사이어티 정책연구소 부회장은 관련 논평에서 “안보 문제와 관련해 트럼프 행정부는 한국에 자체 방위비 지출을 늘리도록 압박하고 있다”며 “트럼프는 오늘 심지어 주한미군기지를 미국이 빌리는 것이 아니라 직접 소유해야 한다고 언급했는데, 이는 이 대통령으로서는 정치적으로 수용 불가능한 제안”이라고 지적했다. 일각에서는 부동산 개발업자 출신인 트럼프가 ‘영토’에 대한 야심을 드러낸 것 아니냐는 관측도 나온다. 트럼프는 2기 취임 이후 팔레스타인 가자지구와 그린란드, 파나마 운하 등을 병합하고 싶다는 뜻을 드러낸 바 있다. 트럼프 대통령은 이날 한국이 미국의 최대 무기 구매국이라는 설명을 하기도 했다. 그는 정상회담 모두발언에서 “한국은 우리 군사장비의 주요 구매국이므로 이것도 논의할 예정”이라고 말해 향후 미국산 무기 구매 압박이 커질 가능성도 있다.",2025-08-26 17:58:42,https://www.segye.com/newsView/20250826517643,세계일보
李대통령 의자 직접 빼주는 트럼프…“따뜻한 외교 매너”,https://img.segye.com/content/image/2025/08/26/300/20250826511281.jpg,"도널드 트럼프 미국 대통령이 25일(현지시간) 첫 한미 정상회담 기념 서명식에서 이재명 대통령의 의자를 직접 빼주는 모습이 포착돼 관심을 끌고 있다. 이날 이 대통령은 한미 정상회담을 위해 찾은 워싱턴DC 백악관에서 트럼프 대통령의 안내로 별도로 마련된 장소로 이동해 방명록에 서명했다. 트럼프 대통령은 이 대통령이 방명록 앞에 앉기 편하도록 직접 의자를 빼주는 매너를 보였다. 트럼프 대통령이 미국을 방문한 해외 정상의 의자를 챙겨준 모습은 이번이 처음은 아니다. 앞서 트럼프 대통령은 지난 4월 백악관에서 방명록 앞에 앉은 베냐민 네타냐후 이스라엘 총리의 의자를 테이블 가까이로 밀어 넣어줬다. 또 지난 2월 나렌드라 모디 인도 총리와의 회동에서도 트럼프 대통령은 방명록 앞에 앉은 모디 총리의 의자를 직접 당겨주었다. 이를 두고 “존경의 제스처”, “따뜻한 외교 매너”라는 긍정적 반응이 쏟아졌다. 이 같은 장면은 최근 미국 백악관이 소셜미디어(SNS)를 통해 공개한 트럼프 대통령과 유럽 정상들이 모인 다자 회담 사진과 대조된다. 해당 사진에는 지난 18일 미국 워싱턴 백악관에서 열린 다자 회담에서 트럼프 대통령 혼자만 책상에 앉아 있고, 나머지 정상들은 그를 바라보며 책상 없이 의자에 부채꼴 모양으로 앉아 있는 모습이 담겼다. 당시 회담엔 키어 스타머 영국 총리, 조르자 멜로니 이탈리아 총리, 우르줄라 폰데어라이엔 EU 집행위원장, 프리드리히 메르츠 독일 총리, 에마뉘엘 마크롱 프랑스 대통령, 알렉산데르 스투브 핀란드 대통령, 볼로디미르 젤렌스키 우크라이나 대통령, 마르크 뤼터 북대서양조약기구(NATO·나토) 사무총장 등이 총출동했다. 외교 관례상 다수 국가 정상이 모이면 상석이 없는 원형 테이블 등에 앉는데 트럼프 대통령만 상석에 앉은 것이다. 트럼프 대통령 혼자 ‘상석(上席)’에 앉은 듯한 모습에 유럽에선 “굴욕적”이라는 반응도 나왔다.",2025-08-26 13:39:35,https://www.segye.com/newsView/20250826508105,세계일보
나이는 숫자? 20대 수준으로 건강한 92세 할머니,https://img.segye.com/content/image/2025/08/26/300/20250826508269.jpg,"92세의 나이에도 불구하고 20대 못지않은 신체 나이를 보이며 건강한 삶을 이어가고 있는 이탈리아 여성 화제다. 24일(현지시간) 워싱턴포스트(WP)는 90세 이상 여자 실내외 200m, 100m 달리기 종목에서 세계 기록을 4개나 보유하고 있는 이탈리아 국적의 에마 마리아 마첸가를 소개했다. 고등학교 과학교사였던 마첸가는 19세에 이탈리아 파도바대에서 생물학을 전공하며 육상을 시작했다. 졸업 후에도 선수 생활을 이어갔지만 어머니의 병환과 결혼·출산 등으로 운동을 접었고, 53세에 다시 트랙으로 복귀했다. 그리고 마첸가는 91세였던 지난해 5월 90세 이상 여자 실외 200m 달리기에서 51초47로 세계 기록을 갱신했다. 한 달 뒤에는 50초33으로 자신의 기록을 1초 이상 단축하기도 했다. 이탈리아와 미국 연구진은 이런 그녀의 심혈관 건강과 다리 근력을 분석하기 위해 사이클링, 웨이트 트레이닝 등 다양한 신체검사를 실시했다. 그 결과 그녀는 50대의 수준의 심폐 기능을 갖고 있으며, 세포 내 에너지원인 미토콘드리아 기능이 건강한 20대와 맞먹는 것으로 나타났다. 연구진은 ""마첸가는 근육에 산소를 전달하는 능력이 탁월하고, 근육 내 미토콘드리아가 잘 보존돼 있다""면서 ""유전적 요인이든 생활 습관이든, 혹은 둘 다이든 그녀의 뇌·신경·근육은 일반적인 90세 노인보다 훨씬 건강하다""라고 평가했다. 현재 마첸가는 다음달 이탈리아 카타니아에서 열리는 100m, 200m 경주를 위해 훈련 중인 것으로 전해졌다. 그녀는 ""스포츠는 제게 정말 많은 것을 준 생명의 은인이나 다름없다. 그저 해가 지기를 기다리는 것만으로는 살아갈 수 없다""면서 ""노년기의 운동은 먼저 자신의 한계를 아는 것이 중요하다. 먼저 의사와 상담해 달리기를 시작하기 적합한지 확인하고 꾸준히 운동하라""고 조언했다.",2025-08-26 12:58:18,https://www.segye.com/newsView/20250826508267,세계일보
자살특공대 ‘가미카제’ 상호 세계 곳곳에…“상호 바꾸도록 역사 알려야”,https://img.segye.com/content/image/2025/08/26/300/20250826509748.jpg,"제2차 세계대전 당시 일본군의 ‘자살 특공대’를 뜻하는 ‘가미카제’(Kamikaze) 상호가 세계 곳곳에서 사용되고 있는 것에 대한 우려의 목소리가 나왔다. 서경덕 성신여대 교수는 26일 자신의 페이스북에서 “많은 누리꾼이 제보를 해줬고 확인해보니 포르투갈 리스본의 한 아시안 식당, 호주의 이동식 놀이공원, 태국의 유명 음반사 등 다양한 곳에서 ‘가미카제’를 사용하고 있었다”며 이같이 밝혔다. 가미카제는 일본어로 ‘신의 바람’(神風)을 뜻한다. 제2차 세계대전이 끝날 무렵 폭탄이 실린 전투기를 몰고 적군 전함 등에 충돌한 일본의 ‘자살 특공대’를 일컫는다. 제2차 세계대전 당시 34척의 전함을 침몰시켰고, 특히 미국 해군과 전투를 치르던 오키나와에서는 5천 명에 이르는 전사자를 발생시킨 바 있다. 서 교수에 따르면, 실제로 일본뿐 아니라 세계 곳곳에서 가미카제 관련 상품이 버젓이 판매되거나 상호가 사용되고 있다. 서 교수는 지난 5월 도쿄 하라주쿠를 방문한 경험을 공유하면서 “많은 상점에서 욱일기와 가미카제 관련 다양한 상품들을 팔고 있었으나, 관광객과 상인들은 그 의미를 모른 채 물건을 사고팔고 있었다”고 전했다. 2022년 카타르 월드컵 때는 일본 응원자들이 가미카제가 새겨진 티셔츠를 흔드는 장면이 공개돼 국제축구연맹(FIFA)에 고발이 접수되면서 재발 방지 요청이 이뤄졌다. 또 세계적으로 많이 사용되는 메신저 앱 ‘텔레그램’에서 가미카제라는 이름이 붙은 이모티콘이 결국 다른 이름으로 교체되기도 했다. 2014년에는 일본 규슈(九州)의 가고시마(鹿兒島) 현 미나미큐슈(南九州)시가 가미카제 요원들의 유서와 편지 등을 유네스코 세계기록유산으로 등재 신청하겠다고 해 논란이 된 바 있다. 서 교수는 일본 제국주의의 극단적 파시즘을 상징하는 가미카제가 희화화되거나 상업적으로 소비돼서는 안 된다며 꾸준히 비판해왔다. 그는 “가미카제의 역사적 의미를 전 세계에 지속적으로 알려 다시는 이런 일이 벌어지지 않도록 해야만 한다”며 “제보를 받은 곳에 조만간 항의 메일을 보내 상호 사용을 바꿀 수 있도록 하겠다”고 강조했다.",2025-08-26 14:01:35,https://www.segye.com/newsView/20250826509661,세계일보
"외신들 ""李, 트럼프 웃게 한 노력 결실…우려 피했다""",https://img.segye.com/content/image/2025/08/26/300/20250826510360.jpg,"해외 주요 언론들은 25일(현지시간) 백악관에서 열린 이재명 대통령과 도널드 트럼프 미국 대통령의 한미정상회담을 두고 “트럼프 대통령을 매료시키려는 이 대통령의 노력이 결실을 맺었다”고 평가했다. 트럼프 대통령이 이날 회담을 2시간 30분가량 앞두고 소셜미디어(SNS) 트루스소셜을 통해 한국 특검의 수사를 겨냥한 발언을 해 회담 전 긴장감이 올라갔지만, 이 대통령이 적극적으로 해명하고 분위기를 이끌면서 공개 회담은 우호적인 분위기에서 이뤄졌다는 설명이다. 미 일간 워싱턴포스트(WP)는 “트럼프 대통령은 한국과 거래를 중단할 수 있다고 위협한 뒤 이 대통령과 회담했지만 긴장감을 피했다”며 “이 대통령이 트럼프 대통령을 웃게 했다”고 보도했다. WP는 이날 오전 트럼프 대통령이 “한국에서 무슨 일이 일어나고 있는 것인가. 숙청 또는 혁명같이 보인다”라고 트루스소셜에 쓴 뒤 관련 사안에 대해 거듭 불만을 표시한 점을 지적하면서 이 대통령이 지난 2월 볼로디미르 젤렌스키 우크라이나 대통령이 겪은 것과 비슷하게 “궁지에 몰릴 수도 있었다”고 우려했다. 하지만 트럼프 대통령이 결국 이 대통령과의 회담에서 자신의 앞선 발언을 “오해”로 결론 내리고 “한국에 대해 매우 따뜻하게 느낀다”고 언급했다고 WP는 전했다. WP는 이 대통령이 회담 서두에 오벌 오피스 리모델링과 세계 평화를 위한 노력, 다우존스산업평균지수 최고치 기록 등을 언급하며 트럼프 대통령에게 찬사를 건넸고, 북한과의 대화를 요청하면서 “북한에 트럼프월드도 지을 수 있게 해 달라”고 농담해 트럼프 대통령의 미소를 자아냈다고 짚었다. 아울러 WP는 “트럼프와 한국의 새 대통령은 피살 위험에서 살아남는 등 여러 공통된 경험을 갖고 있다”며 “이번 정상회담은 두 지도자가 첫 만남으로 친밀한 관계(rapport)를 형성하는 기회가 됐다”고 평가했다. 블룸버그통신도 “트럼프 대통령이 회담 중에 이 대통령에게 ‘습격’에 대해 추궁했지만 이 대통령이 설명하자 트럼프 대통령은 ‘오해라고 확신한다’고 말했다”며 “이는 트럼프 대통령을 매료시키려는 이 대통령의 노력이 결실을 맺었다는 신호였다”고 전했다. AP통신은 ‘경고가 따뜻한 환영으로 전환됐다’는 제목의 기사에서 “트럼프 대통령의 SNS 게시글로 우려됐던 적대적인 회담 가능성은 이 대통령이 미국 대통령을 향해 칭찬을 쏟아내면서 사라졌다”며 “이날 우호적인 모습은 세계 정상들이 트럼프와의 과거 회담에서 교훈을 얻고 있음을 보여준다”고 분석했다. 영국 BBC는 “볼로디미르 젤렌스키 우크라이나 대통령과 시릴 라마포사 남아프리카공화국 대통령이 올 초 경험했던 것처럼 많은 정상들은 백악관 집무실에 들어설 때 어떤 일이 일어날지 확신하지 못한다”며 “이 대통령은 그런 운명을 피했다”고 했다. 로이터 통신도 “이 대통령이 지난 2월 젤렌스키 대통령이나 5월 라마포사 대통령 방문 때처럼 연극적인 대치 상황을 피했다”며 “이 대통령은 트럼프 백악관을 방문하는 외국 정상들이 사용해온 익숙한 전략을 활용해 골프 이야기를 하고 집무실 인테리어와 평화 중재 능력을 칭찬했다”고 전했다. 트럼프 대통령은 이날 이재명 대통령과 회담을 마친 뒤 진행한 포고문 서명식에서 이 대통령에 대해 “그(이 대통령)는 매우 좋은 남자(guy)이며 매우 좋은 한국 대표다”라고 치켜세웠다.",2025-08-26 12:27:41,https://www.segye.com/newsView/20250826508794,세계일보
李대통령과 악수하던 트럼프 손등에 ‘멍’ 포착…왜?,https://img.segye.com/content/image/2025/08/26/300/20250826507266.jpg,"이재명 대통령과 첫 대면 정상회담을 한 도널드 트럼프 미국 대통령 손등에 큰 멍이 포착됐다. 잦은 악수와 아스피린 부작용 때문이라는 게 백악관 설명이다. 트럼프 대통령은 25일(현지 시간) 미국 워싱턴 백악관을 찾은 이 대통령을 환대하며 악수했다. 이 대통령 손을 잡은 트럼프 대통령 오른손 등에는 큰 멍이 들어 있었다. 이후 오벌 오피스에서 이 대통령과 함께 취재진을 만난 자리에서도 트럼프 대통령 손등의 큰 멍은 내내 눈에 띄었다. AP 등에 따르면 지난 22일에도 트럼프 대통령 손등에는 피부색과 맞지 않는 메이크업 자국이 확인됐다. 이전에도 트럼프 대통령은 같은 부위를 화장으로 자주 가려왔다고 뉴욕타임스는 전했다. 앞서 트럼프 대통령은 지난 2월 에마뉘엘 마크롱 프랑스 대통령과의 만남에서도 오른손에 멍 자국이 포착되며 ‘건강이상설’에 휩싸인 바 있다. 당시 백악관은 “많은 사람들과 악수하면서 생긴 멍”이라고 간단히 설명했다. 그러나 멍자국이 지속적으로 포착되며 논란이 일자 백악관은 지난달 17일 “트럼프 대통령이 다리가 붓는 증상이 있어 종합 검진을 받았고, 그 결과 만성 정맥부전을 진단받았다”며 “손등의 멍은 잦은 악수와 아스피린 때문”이라는 해명을 추가로 내놨다. 혈액 응고를 방해하는 아스피린 특성상 손등 멍이 생겼다는 취지다. 트럼프 대통령은 올해 79세로 지난 1월 취임 기준으로 역대 최고령 미국 대통령이다. 골프장에서 불편하게 걷거나 기억을 혼동하는 모습 등도 종종 보여 꾸준히 건강 이상설이 제기되고 있다. 트럼프 대통령은 건강과 관련해 제한된 정보만 언론에 공개해 왔는데, 건강검진 결과를 가장 최근 공개한 건 2023년 11월이다. 당시 주치의가 작성한 건강진단 결과 문건에는 “전체적인 건강 상태는 뛰어나다” “인지력 등 정신 건강은 탁월하다” 등의 내용이 있었으나 이를 뒷받침할 자세한 내용은 포함되지 않았다.",2025-08-26 11:10:00,https://www.segye.com/newsView/20250826507005,세계일보
"美 국방부, ‘전쟁부’로 바뀌나… 트럼프 “방어 말고 공격도 원해”",https://img.segye.com/content/image/2025/08/26/300/20250826507143.jpg,"도널드 트럼프 행정부가 25일(현지 시간) 향후 며칠 내 국방부의 명칭을 전쟁부(Department of War)로 바꿀 가능성을 시사했다. 폴리티코 등 미국 언론에 따르면 트럼프 대통령은 이날 백악관에서 열린 이재명 대통령과의 한미 정상회담에서 “아마도 약 일주일 안에 국방부를 예전처럼 공격적인 명칭으로 되돌릴 예정”이라고 말했다. 이어 “우리가 제1차 세계대전, 제2차 세계대전에서 승리했을 때 그것(국방부)은 전쟁부로 불렸었다”며 “전쟁부 시절에 우리는 믿을 수 없는 승리의 역사를 가졌다는 것을 좋아한다. 그러나 우리는 (전쟁부를) 국방부로 바꿨다”고 주장했다. 미국 역사에서 전쟁부는 1789년부터 1947년까지 존재했다. 해리 트루먼 당시 대통령은 1947년 전쟁부를 육군과 공군으로 분리하고 독립적으로 운영되던 해군을 통합했다. 그는 새롭게 구성된 내각급 기관의 명칭을 국방부로 명명했다. 트럼프 대통령은 이후 행정명령 서명식에서 피트 헤그세스 국방부 장관에게 명칭 변경에 관한 업무를 맡기겠다고 말했다. 트럼프 대통령은 “나는 방어 말고 공격도 원한다”고 강조했다. 다만 국방부는 1947년 의회가 의결한 법률에 따라 설립되었기 때문에 명칭 변경이 추진되면 의회의 승인이 필요할 것으로 보인다고 폴리티코는 전했다. 트럼프 대통령과 헤그세스 장관은 국방부라는 명칭에 대해 공개적으로 불만을 토로해 왔다. 트럼프 대통령은 지난 6월 북대서양조약기구(NATO·나토) 정상회의에서 헤그세스 장관을 “전쟁부 장관”으로 부르며 명칭 변경을 암시했다. 애나 켈리 미 국방부 대변인은 트럼프 대통령의 발언에 대해 “그가 국방부에서 다양성·형평성·포용성(DEI) 정책과 이념 대신 전쟁 참전 용사들을 우선시한 이유”라며 “계속 지켜봐 달라”고 밝혔다.",2025-08-26 10:30:44,https://www.segye.com/newsView/20250826507153,세계일보
"트럼프 ""美 디지털기업 과세·규제하는 국가에 추가 관세""",https://img.segye.com/content/image/2025/08/26/300/20250826505953.jpg,"[속보] 트럼프 ""美 디지털기업 과세·규제하는 국가에 추가 관세""",2025-08-26 09:46:26,https://www.segye.com/newsView/20250826505693,세계일보
