title,thumbnail,short_content,write_time,link,company
"""긴장 완화""vs""공격 규탄""…입장 엇갈린 '앙숙' 印·파키스탄",https://img.segye.com/content/image/2026/03/01/300/20260301506886.jpg,"미국과 이스라엘의 이란 공습을 놓고 남아시아의 오랜 앙숙인 인도와 파키스탄의 입장이 다소 엇갈렸다. 1일(현지시간) AFP 통신과 러시아 관영 리아노보스티 등에 따르면 인도 외무부는 전날 미국과 이스라엘이 이란을 공습한 이후 성명을 내고 중동 지역의 긴장 완화를 위한 외교적 노력을 촉구했다. 인도 외무부는 ""걸프 해역(페르시아만)의 최근 사태 전개에 깊은 우려를 나타낸다""며 ""모든 당사자가 사태 악화를 피해야 하고 모든 국가의 주권과 영토 보전은 반드시 존중돼야 한다""고 밝혔다. S. 자이샨카르 인도 외무장관은 소셜미디어(SNS) 엑스(X·옛 트위터)에 ""기드온 사르 이스라엘 외무장관과 통화했다""며 ""긴장을 완화하기 위한 대화와 외교적 노력을 촉구하는 인도 입장을 재차 전달했다""고 썼다. 이스라엘은 인도의 주요 무기 공급국 가운데 하나다. 지난달 말 나렌드라 모디 인도 총리는 9년 만에 이스라엘을 방문했고, 2021년 이후 교착상태에 빠진 자유무역협정(FTA) 협상을 재개하기로 했다. 자이샨카르 장관은 또 다른 게시물에서 ""저녁에 아바스 아라그치 이란 외무장관과 전화 회담했다""며 ""이란과 해당 지역의 최근 상황과 관련해 깊은 우려를 전했다""고 밝혔다. 사실상 핵보유국인 인도는 이란을 둘러싼 혼란이 커져 파키스탄에까지 영향이 미치지 않을지 우려한다. 인도는 지난해 4월 자국령 카슈미르에서 관광객 등 26명이 숨진 총기 테러가 발생하자 5월에 파키스탄과 미사일 공격을 주고받는 등 전면전 직전까지 가는 무력 충돌을 했다. 이란의 이웃국인 파키스탄은 남아시아 국가 가운데 유일하게 미국과 이스라엘의 이번 이란 공습이 부당하다며 규탄했다. 아심 이프티카르 아마드 주유엔 파키스탄 대사는 전날 열린 유엔 안전보장이사회(안보리) 긴급회의에서 ""국제법을 위반한 (미국과 이스라엘의) 공격이 평화적으로 해결하기 위한 외교적 노력이 재개된 시점에 이뤄졌다""며 ""파키스탄은 이란을 향한 부당한 공격을 규탄한다""고 말했다. 다만 그는 ""(미군 기지를 겨냥한) 이란의 중동 국가 공격도 규탄한다""며 ""유감스럽다""고 덧붙였다. 수니파 무슬림이 많은 파키스탄은 시아파가 다수인 이란과 900㎞ 넘는 국경을 접하고 있다. 두 나라는 종파 갈등과 지정학적 관계 등으로 인해 협력과 갈등을 반복한다. 2024년에는 이란이 파키스탄에 있는 자국 수니파 분리주의 무장 조직의 근거지를 미사일로 공격했고 이틀 뒤 파키스탄도 이란 동남부 접경지를 공습해 보복했으나 곧바로 화해했다. 한편, 동남아시아에서는 베트남이 중동 지역의 긴장 고조에 우려를 나타내면서 평화적 해결을 촉구했고, 인도네시아도 프라보워 수비안토 대통령이 직접 이번 사태를 중재하겠다고 제안했다.",2026-03-01 14:29:26,https://www.segye.com/newsView/20260301506885,세계일보
"""수뇌부 회의 노려 대낮에 때렸다""
기습에 하메네이 등 지휘부 사망",https://img.segye.com/content/image/2026/03/01/300/20260301506606.jpg,"미국과 이스라엘이 이란 공습 시점을 토요일 대낮으로 잡은 것은 이란의 정치·군사 분야 수뇌부 인사들이 회의에 한꺼번에 모이는 기회를 포착했기 때문이라고 미국 일간 월스트리트저널(WSJ)이 전했다. WSJ 취재에 응한 정보당국 관계자들에 따르면 이란 수뇌부 인사들의 회의는 도합 3건이 포착됐으며, 오래 기다려 온 끝에 잡은 절호의 기회를 놓칠 수 없다고 판단한 이스라엘과 미국은 대낮에 공습 작전을 개시했다. 이번 공격으로 최고지도자 하메네이뿐만 아니라 아지즈 나시르자데 이란 국방장관, 모하마드 파크푸르 이슬람혁명수비대(IRGC) 총사령관, 최고지도자 군사고문인 알리 샴카니 전 최고국방회의 사무총장 등이 숨졌다. 아모스 야들린 전 이스라엘군 정보사령부 사령관은 WSJ에 작년 6월 이란 핵시설 공습이 심야에 이뤄졌던 점을 지적하면서 이번 대낮 공격은 ""전술적 기습""이었다고 설명했다. 이런 공격은 이스라엘 정보기관들의 뛰어난 정보수집 능력 덕택에 기회가 포착됐으며, 이와 동시에 미국이 2003년 이라크 전쟁 개전 후 최근 20여년간 전례가 없었던 엄청난 규모의 화력을 이란 주변에 배치해둔 상태였기 때문에 실행이 가능했다. 공격 당일 중동에는 미군의 항공모함 2척, 구축함 12대 안팎이 배치됐고 다른 연안 공격함들까지 포함해 수많은 군함들이 함대지 미사일을 탑재한 채 대기 중이었다. 또 최신 전투기들이 이란 주변 해역과 기지에 배치된 상태였다. 방어가 취약할 수밖에 없는 심야나 새벽 시간대로 공습 시점을 택하는 경우가 흔하지만, 이번 경우 효과를 극대화하기 위해 이란 시간으로 2월 28일 오전 10시가 되기 조금 전에 공습이 시작됐다. 엄청난 수의 미사일과 제트기가 동원됐으며, 특히 최고지도자 아야톨라 세예드 알리 하메이니가 있는 장소에는 이스라엘군이 폭탄 30발을 투하하는 등 집중적 공격이 가해졌다. 이날 저녁시간까지 이스라엘군 전투기 약 200대가 거의 500개소에 이르는 서로 다른 목표물을 타격했으며 이는 이스라엘군 역사상 최대 규모의 공군 작전이었다. 이스라엘군은 이란 당국 주요 인사와 미사일 역량을 공격하는 데 주력했으며, 미군은 미사일 인프라와 군사 목표물을 타격하는 역할을 맡았다. 이런 군사행동과 동시에 이스라엘은 이란에 미디어와 휴대전화 앱 등을 상대로 한 사이버공격을 가했다. 이스라엘은 무슬림들이 기도 시간을 파악하기 위해 이란에서 널리 쓰는 앱을 해킹해 이란 군인들에게 반란을 권유하고 이란 시민들에게 정부에 맞서서 일어나라는 메시지를 띄웠다. 이란 국영 뉴스통신사 IRNA의 홈페이지도 해킹당해, 초기화면에 ""아야톨라 정권의 치안부대에게 두려운 시간이 찾아왔다. IRGC와 바시즈(IRGC 산하 민병대)가 치명타를 입었다""는 메시지가 표시됐다.",2026-03-01 13:21:03,https://www.segye.com/newsView/20260301506516,세계일보
中 고위직 지난해 181명 입건… 전년 대비 두 배,https://img.segye.com/content/image/2026/03/01/300/20260301506270.jpg,"새해에도 ‘반부패 척결’을 이어가는 중국 사정당국이 지난해 고위간부 181명을 입건해 조사한 것으로 전해졌다. 전년 대비 2배 가까이 늘어난 수치다. 1일 중국 관영 신화통신에 따르면 중국 최고 반부패 기구인 중앙기율검사위원회는 전날 공개한 업무보고에서 중앙기율검사위원회·국가감찰위원회가 지난해 중관(中管) 간부 181명을 입건해 조사했다고 밝혔다. 중관 간부는 중앙위원, 중앙후보위원, 장관급 이상 고위 관료, 중앙기업 주요 책임자 등 당 중앙이 직접 관리하는 고위직을 뜻한다. 이는 2024년(92명)보다 89명 늘어난 것이다. 이는 시진핑 중국 국가주석 집권 이후 이어져 온 중국의 고강도 반부패 기조가 강력히 유지되고 있음을 보여주는 것으로 해석된다. 특히 최근 군 서열 2위 장유샤 중국공산당 중앙군사위원회 부주석이 낙마하는 등 중국 체제 전반에 반부패 드라이브가 더욱 강해지고 있다. 중앙기율위가 공개한 조사 대상자에는 진샹쥔 전 산시성 성장, 란톈리 전 광시좡족자치구 주석, 왕리샤 전 네이멍구자치구 주석, 비징취안 전 중국국제경제교류센터 이사장, 치자라 전 티베트자치구 주석, 장차오량 전 후베이성 당서기, 류후이 닝샤후이족자치구 전 주석, 이후이만 전 증권감독관리위원회 주석 등이 포함됐다. 중앙기율위는 이들의 구체적인 혐의 내용은 밝히지 않았다. 중앙기율위·국가감찰위는 전날도 홈페이지를 통해 국영 대기업 화룬그룹의 한쑹 부총경리를 중대한 기율·법률 위반 혐의로 조사하고 있다고 밝혔다. 홍콩 명보는 올해 들어 중앙기율위가 공개적으로 조사 사실을 발표한 중관 간부가 13명으로 늘었다고 전했다. 앞서 시 주석은 최근 공산당 중앙정치국 위원, 서기처 서기, 전국인민대표대회 상무위원회 등으로부터 서면 업무보고를 받은 뒤 최고위 간부들에게 내부 통제 강화를 주문하며 반부패 기조를 재확인했다.",2026-03-01 12:41:01,https://www.segye.com/newsView/20260301505616,세계일보
기술발전 둔화·자본주의 붕괴 불안… 다시 부푼 ‘AI 거품론’ [세계는 지금],https://img.segye.com/content/image/2026/02/26/300/20260226519798.jpg,"2022년 11월 오픈AI의 챗GPT가 세상에 등장한 이후 거세게 불었던 인공지능(AI) 열풍은 지난해 역풍에 직면했다. AI 투자 열기가 너무 과도하다는 ‘거품론’이 제기된 탓으로 한때 몇 차례 관련 주가가 급락하는 우여곡절이 있었다. 그러나 한 해가 마무리될 때까지 시장 붕괴는 일어나지 않았고, AI 시장은 여전히 뜨거움을 유지한 채 2026년을 맞이했다. 다만, 새해가 시작되고 두 달이 더 지났음에도 불안감은 여전히 남아 있다. AI 빅테크(거대기술기업)들의 주가는 여전히 높고, 삼성전자·SK하이닉스 등 국내 반도체기업과 엔비디아 등이 천문학적 이익을 내고 있지만 그 누구도 거품은 없다고 단언하지 못하는 상황이다. ◆한계 봉착한 AI 기술 발전 AI가 향후 어떤 방향으로 발전할지에 대한 설왕설래는 이어지고 있지만, 이 신기술이 인류의 삶을 크게 바꾸리라는 것만큼은 이미 전 세계인들 사이에 합의가 이루어진 흐름이다. 대중이 변화를 직접 체감하고 있기 때문이다. 이미 AI 시스템은 기본적인 검색부터 생활서비스는 물론 기업 관리, 생산까지 대부분의 분야에 급속도로 접목되는 중이다. AI가 인터넷 혁명, 스마트폰 혁명에 이어 인류의 삶을 근본적으로 바꿀 것이라는 기대가 광범위하게 퍼져나가고 있다. 문제는 체감을 통해 만들어진 기대감이 AI 기술에 대한 과도한 투자 열기로 이어졌다는 점이다. 특히, 글로벌 빅테크들의 AI 투자는 매년 급속도로 늘어나는 중이다. 로열뱅크오브캐나다(RBC)가 이달 초 발표한 자료에 따르면 알파벳(구글), 마이크로소프트(MS), 아마존, 메타 등 주요 빅테크 8개사의 지난해 AI 관련 투자는 4270억달러(약 615조원)로 추정됐다. 2020년 1070억달러(약 154조원)에서 5년 만에 4배나 늘어난 수치다. RBC는 AI 투자가 더 가속화돼 올해 5620억달러(약 809조원), 2027년에는 6370억달러(약 917조원)에 달할 것으로 전망했다. AI가 새로운 시대의 핵심기술임이 확실해지면서 뒤처지지 않기 위한 기업들의 투자 경쟁이 치열해지며 투자의 규모가 기하급수적으로 커지는 것이다. 그러나 기술의 특성상 발전 속도에 한계가 나타나기 시작했다. 천문학적인 기술개발 투자 자금을 쏟아부어도 AI 모델의 성능향상이 2∼4%에 불과한 상황에 이르렀다. 이른바 ‘AI 스케일링의 법칙’이 무너졌다. ‘AI 스케일링의 법칙’은 AI 모델의 크기, 학습 데이터양, 컴퓨팅 자원 등을 늘릴수록 AI 성능도 이에 비례해 지속적으로 향상된다는 법칙으로 빅테크들이 거대한 투자를 합리화하는 배경이 돼 왔다. 투입 대비 성과가 줄어드니 안정적 수익창출 구조가 무너질 수밖에 없다. JP모건은 지난해 11월 보고서를 통해 “2030년까지 예상된 AI 투자가 연 10% 수익률을 내려면 연간 추가 매출 6500억달러(약 957조원)가 필요하다”고 분석했다. 이는 구글 1년 전체 매출의 두 배에 달하는 액수다. 대규모 자원투입을 하지 못한 나머지 대부분의 AI 기업들의 수익화는 더 요원하다. 지난 8월 매사추세츠공과대(MIT) 산하 연구조직 ‘난다(NANDA) 이니셔티브’는 AI에 투자한 기업 95%가 전혀 이익을 얻지 못하고 있다고 분석하기도 했다. 이러다 보니 인터넷 시대의 기대감을 바탕으로 자산시장을 뜨겁게 달구다 2000년대 초 전 세계 경제의 충격으로 이어진 ‘닷컴버블’이 재현될 수 있다는 전망도 여전히 살아 있다. 닷컴버블에서 시장을 주도하는 기업이 됐다 극적인 붕괴를 경험했던 기업인 정보기술(IT) 장비 기업 시스코의 척 로빈스 회장은 최근 BBC와 인터뷰에서 “AI 기술이 인터넷보다 더 큰 영향을 발휘할 것”이라면서도 “현재 시장은 거품일 가능성이 크며, 일부 기업들은 생존하지 못할 것”이라고 밝혔다. ◆과도한 기대에 금융시장은 폭발 직전 AI로 인한 기대감이 기업의 투자를 넘어 주식시장 등 자산시장의 과도한 팽창으로 이어졌다는 것이 우려를 더 키운다. 미국 주식시장의 경우 2023년 이후 3년간 나스닥100 지수가 131%, 스탠더드앤드푸어스(S&P)500 지수는 약 70% 상승했다. 이는 역사에 기록된 대표적인 ‘거품 장세’의 뜨거움과 비교해봐도 뒤지지 않는다. 과거 거품 장세의 역사에서 입증됐듯 너무 비싼 주가로 인한 조정은 기술의 발전과 사회 안착 여부와 관계없이 반드시 나타날 수밖에 없기에 긴장감은 계속된다. 결국, AI 관련 주식시장은 작은 요인 하나만으로도 주가가 큰 폭으로 요동치는 ‘초민감 시장’이 됐다. 지난달 말 AI 기업 앤트로픽의 ‘클로드 코워크’ 서비스 공개 뒤 2월 내내 벌어진 미 증시의 모습은 이를 보여주는 또 하나의 사례다. AI로 각종 업무를 대행하는 플랫폼인 클로드 코워크가 세상에 나오자 경쟁에서 밀릴 우려가 생긴 AI 경쟁사와 소프트웨어 기업들의 주가가 대폭 하락한 것이다. 2월 주요 AI 기업들은 아마존(-14.2%), 알파벳(-9.5%), 메타(-9.5%) 등 상당수가 두 자릿수 내외 하락률을 기록하고 있다. AI 시장의 대규모 변동을 야기할 수 있는 사건이 추가로 발생하고, 민감성이 극에 달한 시장이 요동치는 과정이 향후 몇 차례 더 반복되다 보면 결국 거품이 터질 여지도 상당하다. 이에 대해 국제투자기금(IMF)은 지난달 발간한 세계경제보고서를 통해 우려를 제기하기도 했다. 피에르 올리비에 구랭샤스 IMF 수석 이코노미스트는 보고서에서 현재 미국의 성장세가 제한된 소수의 동력, 특히 미국 기술 부문과 이에 따른 주식시장 붐에 의존하고 있다는 점을 지적하며 “AI가 생산성과 수익성을 얼마나 끌어올릴 수 있을지에 대한 기대가 실현되지 않을 경우 시장 조정이 발생할 위험이 있다”고 밝혔다. ◆‘자본주의 붕괴’ 불안감 속 방향전환 제언도 AI 거품론의 이면에는 또 다른 우려가 존재한다는 평가다. AI 기술이 한계를 극복하고 더 발전한다 하더라도 사회가 이를 완전히 수용할 수 있을까에 대한 의문이다. 핵심은 AI의 노동 대체로 인해 AI로 생산한 기업의 제품을 사줄 소비자가 사라진다는 점이다. 자본주의 시스템을 뒤흔들 수 있는 이 모순에 대해 ‘닥터 둠’으로 잘 알려진 누리엘 루비니 뉴욕대 명예교수는 AI 혁명이 막대한 부의 증가와 소비자 물가의 급락을 가져올 것이지만 영구적인 기술적 실업의 확산으로 이어질 수 있다면서 “노동자의 소득이 없다면 기계가 생산하는 상품과 서비스를 누가 구매하겠는가”라고 반문하기도 했다. 이미 AI로 인한 실업은 현실화되는 중이다. 미국의 컨설팅 업체 챌린저 그레이 앤드 크리스마스에 따르면 지난해 1∼11월 미국 내 기업의 감원규모는 117만건으로 전년의 76만건보다 54%나 증가했다. 이 중 AI로 인한 해고가 5만4000여건에 달한다. 세계경제포럼(WEF)이 지난해 보고서에서 “고용주의 41%가 AI로 인한 인력 감축을 계획 중”이라고 적시하는 등 이런 추세는 지속해서 확대될 것으로 전망된다. 노동자들의 불안감도 증폭되고 있다. 미국 구인구직기업 레주메나우가 1150명의 구인구직자를 대상으로 설문해 지난달 12일 발표한 내용에 따르면 응답자의 68%가 “AI가 고용시장에 악영향을 미칠 것”이라고 평가했다. 과도한 투자로 인해 경제가 무너질 수 있는 상황에 대비한 안전장치뿐 아니라 AI의 일상화가 인간의 삶에 미칠 영향에 대비할 안전망 역시 필요하다는 지적이 나온다. 2024년 노벨경제학상 수상자 다론 아제모을루 MIT 교수는 AI 활용의 방향성이 기존의 직업 대체에서 변화해야 한다고 제언하기도 했다. 그는 “AI는 노동자를 대체하는 기술이 아닌 보완하는 방향으로 발전해야 한다”면서 “우리는 일을 자동화해야 하지만, 동시에 배관공은 더 나은 배관공으로, 전기공은 더 나은 전기공으로, 교육자는 더 나은 교육자로 만들어야 한다”고 강조했다.",2026-03-01 12:33:55,https://www.segye.com/newsView/20260225520498,세계일보
“잠옷 입고 공항 가면 민폐?” vs “비행기엔 편해야”…금지 글에 갑론을박,https://img.segye.com/content/image/2026/02/27/300/20260227512966.jpg,"미국 플로리다주 탬파국제공항이 사회관계망서비스(SNS)에 올린 글이 화제다. ‘농담 해프닝’이었지만 공항 복장을 어디까지 허용할 수 있느냐에 대한 논쟁은 이어지고 있다. 탬파공항은 26일(현지시간) 엑스(X), 인스타그램에 “우리는 이제 충분히 봤습니다. 충분히 참았습니다”라며 “이제는 탬파국제공항에서 잠옷을 금지할 때”라고 밝혔다. 공항은 대낮의 ‘잠옷’ 공항패션을 지적하며 “크록스를 성공적으로 금지하고, 모두에게 세계 최초의 크록스 없는 공항을 경험할 놀라운 기회를 제공한 데 이어, 이제는 훨씬 더 큰 위기에 맞서야 한다”고 했다. 그러면서 “이 결정이 당신 삶의 누군가에게 혼란을 줄 수 있다는 것을 우리는 알고 있다. 이제 그들과 어려운 대화를 나눠야 한다”고 부연했다. 공항은 “광기는 오늘로 끝이다. 이 운동은 지금 시작된다”며 “크록스와 잠옷 없는 공항이 되도록 도와달라”고 적었다. 사실 이 글은 SNS 소통을 위한 탬파공항 측의 유머다. 공항은 승객들과의 소통을 위해 유쾌하고 풍자적인 콘텐츠를 종종 올린다. 이번 글도 여행 당일 패션 논쟁을 풍자한 것이다. 크록스 금지도 된 적이 없고, 잠옷도 금지할 계획이 없다. 보 짐머 탬파공항 대변인은 AP통신에 “이건 모두 재미를 위한 것”이라며 “여행객들이 편안하게 즐기시길 바란다”고 말했다. 짐머 대변인은 “SNS 초창기부터 구축해 온 재치 넘치는 어조의 계정”이라며 “이용자들은 이런 콘텐츠를 정말 좋아한다”고 덧붙였다. 그럼에도 이 글 이후 찬반 의견이 이어졌다. 숀 더피 미국 교통부 장관은 환영했다. 더피 장관은 지난해 11월 ‘여행의 황금기는 당신으로부터 시작됩니다’라는 슬로건을 내걸고 예절 캠페인을 시작했는데, 이 중 하나가 기내에서 좀 더 격식을 갖춘 복장을 착용할 것을 권장하는 것이었다. 앞서 더피 장관은 “청바지에 셔츠를 입는 것처럼, 저는 사람들이 조금 더 단정하게 옷을 입도록 권장하고 싶다”며 “공항에 갈 때는 슬리퍼나 잠옷을 입지 않도록 노력하자. 그게 더 좋을 것 같다”고 말한 바 있다. 이용자들의 의견은 반대가 주를 이뤘다. “권위주의적인 헛소리”라 거나 “여행 중에 뭘 입고 뭘 입지 말아야 하는지 사람들에게 지시하는 것은 권한 남용이다”는 등의 지적이 나왔다. “잠옷을 입으면 다른 누군가 다치냐”는 반발도 적지 않았다. “잠옷의 기준이 뭐냐. 트레이닝 바지, 요가 바지 등은 잠옷인가, 아닌가”라는 반응도 있었다. 영국 인디펜던트는 항공 여행이 지속해서 불편해지고 있다는 점을 지적하면서 승객들의 복장이 달라지고 있다는 점을 짚었다. 인디펜던트가 전한 승객 권익 옹호단체 ‘플라이어스 라이츠’ 자료에 따르면 40년 전과 비교해 평균 좌석 간격(다리 뻗는 공간)은 35인치(약 89㎝)에서 31인치(약 79㎝)로 줄었고, 저가 항공사는 좌석 간격이 29~30인치로 더 좁다. 항공기 좌석 크기는 1990년대 18.5인치였으나 현재 17인치다. 과거에는 항공사들이 좌석 점유율을 70%로 운항해 승객들이 더 여유롭게 앉을 수 있었으나, 최근에는 점유율 80~85%로 운영 중이다. 공항 검색도 편안한 옷이 필요하게 만든다. 보안검색대에서 긴 줄을 서서 기다려야 하고, 전신 스캔을 받아야 하며, 이상 징후가 발견될 경우 연방 직원에 의한 신체 수색을 받기도 한다. 인디펜던트는 “승객들이 비행기에 탑승하기 위해 신체 수색을 받아야 한다면 차라리 그 과정이 편안하게 진행되는 편이 낫다”고 전했다.",2026-03-01 12:33:37,https://www.segye.com/newsView/20260227512675,세계일보
