title,thumbnail,short_content,write_time,link,company
"與 “李 대통령, 협상가 기질 발휘”… 野 “굴욕적 아부 일관… 외교참사”",https://img.segye.com/content/image/2025/08/26/300/20250826518090.jpg,"여야 정치권은 26일 이재명 대통령과 도널드 트럼프 미국 대통령 간 한·미 정상회담을 놓고 극과 극의 평가를 내놨다. 여권에서는 호평이 쏟아진 반면, 야당은 “역대급 외교참사”라고 깎아내렸다. 김민석 국무총리는 이날 오전 국무회의를 주재한 자리에서 외교부 등 유관부처가 정상회담 후속조치에 만전을 기해달라고 주문했다. 김 총리는 “양 정상은 급격한 국제 질서",2025-08-26 18:23:25,http://www.segye.com/newsView/20250826517292,세계일보
강성 당원·극우 유튜버 공략 성공… 장동혁 “내부 총질 땐 결단”,https://img.segye.com/content/image/2025/08/26/300/20250826518205.jpg,"“싸우지 않는 자, 배지를 떼라!” 26일 당선된 국민의힘 장동혁 신임 당대표가 지난달 말 전당대회 출마를 선언하며 내건 구호다. 장 대표는 전당대회 기간 내내 “이기는 정당”을 외치며 강한 대여투쟁력을 자신의 주무기로 강조했다. 불과 3개월 전까지 당의 대선후보였던 김문수 전 고용노동부 장관을 제치고 ‘1.5선’에 불과한 그가 당대표로 선출된 이변은",2025-08-26 18:23:04,http://www.segye.com/newsView/20250826517301,세계일보
‘찬탄파’ 줄줄이 낙선… “한동훈 가장 치명타”,https://img.segye.com/content/image/2025/08/26/300/20250826518151.jpg,"‘반탄파’(윤석열 전 대통령 탄핵 반대) 장동혁 신임 당대표의 당선으로 ‘찬탄파’ 주자들의 거취에 관심이 쏠린다. 당 안팎에서는 분당 가능성이 거론되지만, 당장 현실화할 가능성은 크지 않다는 전망이 우세하다. 국민의힘 제6차 전당대회 결과로 가장 큰 정치적 타격을 입은 것은 한동훈 전 대표로 평가된다. 한국갤럽의 올해 장래 정치 지도자 선호도 조사(주관식)",2025-08-26 18:22:36,http://www.segye.com/newsView/20250826517295,세계일보
한·미 ‘비서실장 핫라인’… 회담 전 만난 강훈식·와일스,https://img.segye.com/content/image/2025/08/26/300/20250826517845.jpg,강훈식 대통령실 비서실장이 이례적으로 대통령 방미 일정에 동행한 이유가 ‘실세’로 불리는 수지 와일스 백악관 비서실장과의 핫라인 구축을 위한 것이었다는 사실이 확인됐다. 강 실장은 한·미 정상회담 직후인 25일(현지시간) 워싱턴에 마련된 프레스센터에서 기자들과 만나 자신의 방미 이유와 관련해 “오늘(25일) 오전 10시 30분부터 40분간 양국 대통령,2025-08-26 18:20:44,http://www.segye.com/newsView/20250826517217,세계일보
李 ‘트럼프 청구서’ 전략적 수용… ‘동맹 강화’ 큰 틀 합의,https://img.segye.com/content/image/2025/08/26/300/20250826518036.jpg,한·미 정상회담에서 이재명 대통령이 국방비 인상 계획을 공식화한 것은 도널드 트럼프 2기 행정부의 안보 청구서를 사실상 받아들인 것이다. 정상회담의 핵심 의제였던 ‘동맹 현대화’ 과제 중 우리 측이 비교적 수용할 수 있는 사안을 전략적으로 선택한 것으로 풀이된다. 정부는 양국이 한반도에서 연합 방위 태세를 강화한다는 공감대를 확인했다고 밝혔다. 우려했던,2025-08-26 18:17:40,http://www.segye.com/newsView/20250826517208,세계일보
SOFA 개정·국회 동의 필요… “실현 가능성 작아”,https://img.segye.com/content/image/2025/08/26/300/20250826517968.jpg,"도널드 트럼프 미국 대통령이 25일(현지시간) 이재명 대통령과의 정상회담에서 언급한 주한미군 기지 부지 소유권 요구의 실현 가능성에 대해 관심이 쏠린다. 현재 독일, 일본, 이탈리아 등 미국 본토 밖에 있는 해외 주둔 미군 기지는 대부분 임차 형태로 되어 있다. 한국도 한미상호방위조약과 주둔군지위협정(SOFA)에 의해 미군 기지 부지를 제공하고 있다. 한미",2025-08-26 18:15:24,http://www.segye.com/newsView/20250826517195,세계일보
"李대통령 “美, 대중 견제 속 ‘안미경중’ 어려워” [韓·美 정상회담]",https://img.segye.com/content/image/2025/08/26/300/20250826517913.jpg,이재명 대통령은 25일(현지시간) 워싱턴에서 진행한 미국 싱크탱크 전략국제문제연구소(CSIS) 초청 연설에서 12·3 비상계엄 사태 이후 한국이 안팎으로 겪었던 위기를 언급하고 “이 전례 없는 도전과 변화에 맞서기 위해 위기를 기회로 바꾸고 새롭게 도약할 발판으로 만드는 지혜가 어느 때보다도 더 절실하다”며 ‘국익 중심 실용외교’를 해답으로 제시했다. 그러,2025-08-26 18:15:08,http://www.segye.com/newsView/20250826517194,세계일보
"트럼프 “한·일, 위안부 민감”… 李 “이시바 만나 걱정 정리”",https://img.segye.com/content/image/2025/08/26/300/20250826518156.jpg,도널드 트럼프 미국 대통령은 25일(현지시간) 열린 한·미 정상회담에서 위안부 문제를 ‘아주 민감한 문제’라고 언급하며 한·미·일 협력 강화를 위해서라도 한·일 간의 과거사 문제를 해결해야 한다는 취지로 말했다. 이재명 대통령도 “한·미·일 협력은 매우 중요한 과제”라며 “한·미 관계의 발전을 위해서라도 한·일 관계도 어느 정도 수습이 돼야 한다”고 밝혔다,2025-08-26 18:14:41,http://www.segye.com/newsView/20250826517197,세계일보
몸 낮춘 李… 칭찬 외교로 ‘트럼프 환심 사기’,https://img.segye.com/content/image/2025/08/26/300/20250826517791.jpg,"이재명 대통령은 도널드 트럼프 미국 대통령과의 첫 정상회담에서 잇단 찬사를 건네며 회담장을 휘감은 긴장 국면을 우호적 분위기로 전환하려는 ‘칭찬 외교’를 구사했다. 트럼프 행정부의 관세 인상 및 대미 투자 압박, 주한미군 주둔비를 포함한 방위비 증액 요구, 주한미군 전략적 유연화 등 경제 통상, 외교안보 분야 전반에서 압박이 고조되는 상황에서 트럼프 대통령",2025-08-26 18:00:00,http://www.segye.com/newsView/20250826517164,세계일보
압박 리스크 여전… 강훈식 “끊임없는 협상이 뉴노멀”,https://img.segye.com/content/image/2025/08/26/300/20250826517563.jpg,"이재명 대통령과 도널드 트럼프 미국 대통령의 첫 한·미 정상회담은 두 정상의 공동 발표나 성명, 합의문 등 없이 ‘열린 결말’로 끝이 났다. 지난달 말 관세 협상 타결 이후, 정상회담 일정에 맞춰 쫓기듯이 결과를 도출해내기보다 시간을 확보했다는 평가가 나오는 동시에 경제와 통상, 안보 분야 주요 협상을 매듭짓지 못하면서 미국의 전방위적 압박에 따른 리스크가",2025-08-26 18:08:25,http://www.segye.com/newsView/20250826517126,세계일보
시작 전 “숙청·혁명” 마주 앉자 “영광”… 롤러코스터 회담,https://img.segye.com/content/image/2025/08/26/300/20250826517753.jpg,25일(현지시간) 열린 한·미 정상회담은 두 정상이 마주 앉기 전까지 긴장이 극도로 고조됐다가 회담이 시작되자 화기애애한 분위기로 바뀌며 ‘롤러코스터’를 탄 듯했다. 도널드 트럼프 대통령은 정오로 예정된 정상회담을 2시간40분가량 앞두고 자신의 사회관계망서비스(SNS)에 “한국에서 숙청 또는 혁명(Purge or Revolution)이 일어나는 것처럼 보인,2025-08-26 17:41:51,http://www.segye.com/newsView/20250826517162,세계일보
"李, 국방비 증액 공식화…“美와 방산협력 확대”",https://img.segye.com/content/image/2025/08/26/300/20250826518281.jpg,이재명 대통령이 25일(현지시간) 국방비 증액을 공식 선언하며 한·미동맹 현대화 구상을 내놨다. 이번 한·미 정상회담을 계기로 1500억달러 규모의 한국 기업 대미 투자 계획도 발표됐다. 이 대통령은 이날 한·미 정상회담 이후 진행한 미국 싱크탱크 전략국제문제연구소(CSIS) 초청 연설에서 “오늘 도널드 트럼프 대통령과의 정상회담에서 한·미동맹을 안보 환경,2025-08-26 18:04:01,http://www.segye.com/newsView/20250826517026,세계일보
국민의힘 당대표에 ‘더 센 반탄’ 장동혁,https://img.segye.com/content/image/2025/08/26/300/20250826518400.jpg,"내년 6·3 지방선거를 이끌 국민의힘 새 당대표에 재선 장동혁 의원이 26일 선출됐다. 강경 우파 노선을 내세운 장 대표의 당선으로 여권과의 ‘강 대 강’ 대치가 격화되고, 윤석열 전 대통령 탄핵을 둘러싼 찬반 갈등으로 당내 내홍도 심화될 것이라는 전망이 나온다. 국민의힘 선거관리위원회는 이날 국회 도서관에서 속개된 제6차 전당대회 당대표 결선투표에서",2025-08-26 18:14:41,http://www.segye.com/newsView/20250826517030,세계일보
"트럼프 “김정은 만나고 싶다”
李대통령 “APEC서 추진”",https://img.segye.com/content/image/2025/08/26/300/20250826518251.jpg,"도널드 트럼프 미국 대통령이 25일(현지시간) 이재명 대통령과의 첫 한·미 정상회담에서 “올해 그(김정은 북한 국무위원장)를 만나고 싶다”며 북·미 대화 재개 의지를 밝혔다. 이 대통령이 10월 경주 아시아태평양경제협력체(APEC·에이펙) 정상회의에서 김 위원장과의 회동을 제안하자, 트럼프 대통령은 “슬기로운 제안”이라며 긍정적으로 화답했다. 트럼프 대통령",2025-08-26 18:02:30,http://www.segye.com/newsView/20250826517032,세계일보
"“與김상욱, 대부업체 사내이사 겸직”‥ 국민의힘, 징계안 제출",https://img.segye.com/content/image/2025/08/26/300/20250826517439.jpg,국민의힘은 26일 더불어민주당 김상욱 의원이 대부업체 사내이사를 겸직했다고 주장하며 김 의원에 대한 징계안을 국회에 제출했다. 곽규택 수석대변인은 이날 징계안을 제출한 뒤 기자들과 만나 “김 의원이 국회의원에 당선된 이후에도 울산지역 대부업체 사내이사를 겸직한 사실이 확인됐다”고 밝혔다. 곽 수석대변인은 “김 의원이 국회법으로 규정된 겸직 금지와,2025-08-26 17:14:14,http://www.segye.com/newsView/20250826517451,세계일보
"[단독] 존치 결론난 기동순찰대… 지휘부 ‘긍정’, 일선 경찰 ‘부정’",https://img.segye.com/content/image/2025/08/26/300/20250826518485.jpg,"‘묻지마 폭행’ 등 이상동기범죄 대응을 위해 지난해 출범한 경찰 기동순찰대를 바라보는 지휘부와 일선 경찰들의 온도차가 극명한 것으로 나타났다. 지휘부는 대규모 상황 지원이나 집중순찰에 기순대를 효과적으로 활용할 수 있다는 입장이지만, 지구대·파출소 등 일선 경찰은 자신들이 하는 업무와 큰 차이가 없다는 이유로 10명 중 7명이 부정적이었다. 26일 경찰청에",2025-08-26 18:29:06,http://www.segye.com/newsView/20250826517011,세계일보
대법 “신탁계약 어기고 환급금 사용 횡령 아냐”,https://img.segye.com/content/image/2025/08/26/300/20250826517582.jpg,신탁계약에서 위탁자가 부가가치세 환급금을 수탁자에게 넘기기로 약속하고선 이를 어긴 채 직접 사용했더라도 횡령죄로 처벌할 수 없다는 대법원 판단이 나왔다. 26일 법조계에 따르면 대법원 3부(주심 노경필 대법관)는 최근 특정경제범죄 가중처벌법상 횡령 혐의로 기소된 A씨 등에게 징역형 또는 징역형의 집행유예를 선고한 원심을 깨고 사건을 광주고등법원으로 돌,2025-08-26 18:30:48,http://www.segye.com/newsView/20250826517106,세계일보
보이스피싱 피해금 ‘코인 세탁’ 30대 실형,https://img.segye.com/content/image/2025/08/26/300/20250826517241.jpg,보이스피싱으로 얻은 범죄 수익을 가상자산으로 환전해 세탁한 30대 남성이 실형을 선고받았다. 26일 법조계에 따르면 서울동부지법 형사3단독 이호동 판사는 범죄수익은닉규제법 위반 혐의로 기소된 배모(39)씨에게 최근 징역 1년6개월을 선고했다. 배씨는 보이스피싱 피해금을 코인으로 바꿔 해외 조직에 송금했다. 테더코인(USDT) 환전 알선 업자인 배씨는,2025-08-26 18:26:56,http://www.segye.com/newsView/20250826517095,세계일보
청년 변호사들 “검찰 보완수사권 폐지는 교각살우”,https://img.segye.com/content/image/2025/08/26/300/20250826517698.jpg,정부와 여당이 검찰개혁 일환으로 추진 중인 검찰 보완수사권 폐지에 대해 청년 변호사 단체가 반대 목소리를 냈다. 이들은 수사권 제도 개선은 범죄 피해로부터 국민을 보호하는 방향으로 이뤄져야 한다면서 보완수사권이 사라지면 부실 수사 등이 악화된다고 우려했다. ‘새로운 미래를 위한 청년변호사 모임’(새변)은 26일 성명을 내 “검찰 보완수사권 완전 폐지가,2025-08-26 18:25:54,http://www.segye.com/newsView/20250826517114,세계일보
"채해병 특검 “교회 압수수색, 법적 절차에 문제 없어”",https://img.segye.com/content/image/2025/08/26/300/20250826518410.jpg,해병대 채모 상병 순직사건 관련 의혹 등을 수사하는 채해병 특별검사팀(특검 이명현)은 교회 압수수색을 무리하게 진행했다는 논란과 관련해 수사상 필요해 진행했으며 법적 절차를 어긴 사실이 없다고 26일 밝혔다. 특검팀은 1차 수사기간(60일)을 30일 연장하기로 하고 이날 대통령과 국회에 연장 사유를 제출했다. 정민영 채해병 특검보는 이날 서울 서초구 특,2025-08-26 18:25:29,http://www.segye.com/newsView/20250826517817,세계일보
[27일의 날씨] 끈적끈적 비구름… 불쾌지수 상승,https://img.segye.com/content/image/2025/08/26/300/20250826518406.jpg,,2025-08-26 18:15:37,http://www.segye.com/newsView/20250826517019,세계일보
[파고다 강남 끝토익 RC김나래] PART 5,https://img.segye.com/content/image/2025/08/26/300/20250826518359.jpg,,2025-08-26 18:12:54,http://www.segye.com/newsView/20250826515036,세계일보
[시사일본어학원의 초단기 일본어 회화] 뭔가를 해도 흐지부지하게 돼,https://img.segye.com/content/image/2025/08/26/300/20250826518371.jpg,,2025-08-26 18:12:44,http://www.segye.com/newsView/20250826515032,세계일보
[시사중국어학원의 리얼 중국어 회화] 특수 효과를 넣다.,https://img.segye.com/content/image/2025/08/26/300/20250826518382.jpg,,2025-08-26 18:12:30,http://www.segye.com/newsView/20250826515034,세계일보
사라진 손님 금목걸이 어디에…20대 女접객원이 속옷에 숨겨,https://img.segye.com/content/image/2025/08/26/300/20250826518183.jpg,전북 전주덕진경찰서는 손님의 금목걸이를 훔친 혐의(절도)로 유흥주점 접객원 A(20대·여)씨를 불구속 입건했다고 26일 밝혔다. A씨는 지난 21일 0시쯤 전주시 덕진구 우아동의 한 유흥주점에서 손님 B(30대)씨가 착용하고 있던 20돈 상당의 금목걸이를 훔친 혐의를 받고 있다. 당시 술에 취한 B씨는 뒤늦게 목걸이가 없어진 사실을 확인하고 경찰에,2025-08-26 18:02:03,http://www.segye.com/newsView/20250826517792,세계일보
전공의들 “정부의 사직서 수리 금지는 위법”,https://img.segye.com/content/image/2025/08/26/300/20250826517125.jpg,지난해 의대 증원 정책에 반발해 사직서를 낸 전공의들이 정부를 상대로 낸 퇴직금·위자료 청구 사건의 첫 변론기일에서 정부의 사직서 수리 금지 명령은 부당하다고 주장했다. 반면 수련병원과 정부 측은 국민의 기본권을 위해 적법한 조치라고 반박했다. 서울중앙지법 민사48단독 지은희 판사는 26일 국립중앙의료원 사직 전공의 현모 씨 등 2명이 병원과 국가를 상,2025-08-26 17:06:20,http://www.segye.com/newsView/20250826516911,세계일보
"“밤에도 안심 분만” 전국 10곳 병원, 24시간 산모·신생아 진료",https://img.segye.com/content/image/2025/08/26/300/20250826516949.jpg,"정부가 산모와 신생아가 밤에도 안심하고 진료받을 수 있도록 전국 10개 병원을 ‘지역모자의료센터’로 지정했다. 이들 센터는 24시간 분만과 고위험 신생아 진료를 맡아, 임산부가 병원을 찾아 헤매는 불안을 줄이고 지역별 의료 격차를 해소하는 역할을 하게 된다. 보건복지부는 26일 전국 10곳을 지역모자의료센터로 새롭게 지정했다고 밝혔다. 이번에 선정된 기",2025-08-26 16:59:02,http://www.segye.com/newsView/20250826516730,세계일보
로컬파이오니어스쿨 2025 ‘커리어캠프’ 성료…“취·창업 역량에 큰 도움”,https://img.segye.com/content/image/2025/08/26/300/20250826516304.jpg,청년 창작자들이 지역을 기반으로 취·창업 역량을 키울 수 있도록 돕는 실무형 일경험 교육 프로그램 ‘로컬 파이오니어 스쿨 2025(로파스)’의 두 번째 교육 과정인 ‘커리어캠프’가 성황리에 마무리됐다. 26일 로파스에 따르면 지난 20일부터 22일까지 3일간 진행된 ‘커리어캠프’는 로파스 첫 번째 교육과정인 로컬 비즈니스 클래스를 우수한 성적으로 마친,2025-08-26 16:50:00,http://www.segye.com/newsView/20250826516283,세계일보
"“아내 살해, 미안한 거 없다”던 중국인 남편 첫 재판서 “전자발찌 필요 없다” 주장",https://img.segye.com/content/image/2025/08/26/300/20250826516375.jpg,"법원의 접근금지 명령이 종료된 지 일주일 만에 아내를 찾아가 흉기로 살해한 60대 남성이 법정에서 혐의를 인정하면서도 위치추적 전자장치(전자발찌) 부착 필요성은 없다고 주장했다. 살인 혐의로 기소된 중국 국적 60대 A씨의 변호인은 26일 인천지법 형사16부(윤이진 부장판사) 심리로 열린 첫 재판에서 “범죄 사실은 인정하지만, 제삼자에 대한 재범 위험성",2025-08-26 16:40:48,http://www.segye.com/newsView/20250826516382,세계일보
대기업 직원 사칭해 인테리어 '노쇼 사기'… 경찰 수사,https://img.segye.com/content/image/2025/08/26/300/20250826516173.jpg,"대기업 직원을 사칭해 인테리어를 하겠다며 시공업자에게 접근해 자재비를 가로채는 '노쇼 사기' 신고가 접수돼 경찰이 수사에 나섰다. 26일 경기 파주경찰서에 따르면 지난 22일 불상의 인물은 파주 지역의 한 타일 시공업자에게 전화를 걸어 회사 임원 사무실 인테리어 공사를 의뢰했다. 이어 특정 타일 업체를 소개하며 ""자재비 일부를 먼저 송금해 달라""고 요구",2025-08-26 16:29:18,http://www.segye.com/newsView/20250826515733,세계일보
[27일의 날씨] 끈적끈적 비구름… 불쾌지수 상승,https://img.segye.com/content/image/2025/08/26/300/20250826518406.jpg,,2025-08-26 18:15:37,http://www.segye.com/newsView/20250826517019,세계일보
[재미로 보는 오늘의 운세] 8월 27일 (수요일) 띠별 운세,https://img.segye.com/content/image/2025/08/26/300/20250826518325.jpg,쥐 96년생 남서쪽으로 움직이는 것은 피하는 것이 좋겠다. 84년생 직업적인 딜레마에 빠져 허우적대기 쉬운 때. 72년생 마음 속에 장애물이 있음을 느끼곤 한다. 60년생 적극적인 자세로 나서면 좋다. 48년생 사업자는 인력관리에 심혈을 기울여라. 36년생 남들이 가만히 있을 때를 기다리라. 소 97년생 변변한 것이 없다고 용기를 잃지마라. 85년,2025-08-26 18:13:27,http://www.segye.com/newsView/20250826515035,세계일보
"국립중앙박물관, 관람객 500만 돌파 눈앞…세계 4위 박물관 넘본다 [뉴스+]",https://img.segye.com/content/image/2025/08/26/300/20250826517928.jpg,국립중앙박물관을 찾은 올해 관람객 수가 역대 최다를 넘어 500만명을 눈앞에 두고 있다. 연말까지 600만명에 육박할 것으로 예상되면서 국립중앙박물관이 세계 4위 박물관으로 올라설지 주목된다. 26일 국립중앙박물관에 따르면 올해 1월1일부터 이달 25일까지 박물관을 찾은 관람객은 418만9822명으로 잠정 집계됐다. 이는 연간 관람객이 400만명을,2025-08-26 17:44:00,http://www.segye.com/newsView/20250826517934,세계일보
"“서른도 안 됐는데 당뇨예요”… 젊은층 2형환자, 13년간 4배 늘었다",https://img.segye.com/content/image/2025/08/26/300/20250826514585.jpg,30세 미만의 젊은 당뇨 환자가 급증하고 있다. 주로 비만과 관련이 있는 2형 당뇨병의 유병률이 국내 30세 미만 젊은층에서 13년 새 4배 가까이 올랐다. 저소득층이 중·고소득층보다 발생률이 높아 취약계층을 위한 질병 예방·관리 대책이 시급하다는 지적이 나온다. 26일 질병관리청 국립보건연구원에 따르면 연구원의 지원을 받은 분당서울대병원 소아청소년과,2025-08-26 17:09:51,http://www.segye.com/newsView/20250826513469,세계일보
세계평화통일가정연합유지재단 제22대 김문식 신임 이사장 취임,https://img.segye.com/content/image/2025/08/26/300/20250826516599.jpg,"세계평화통일가정연합유지재단(이하 통일재단)은 26일 제22대 김문식 신임 이사장(58)이 취임했다고 밝혔다. 김 이사장 취임식은 이날 문연아 학교법인 선학학원 이사장, 두승연 세계평화통일가정연합 세계선교본부장, 김영석 세계평화통일가정연합 한국부회장, 김종관 효정글로벌통일재단 이사장, 김고은 세계평화여성연합 회장 등 산하 기관과 통일그룹 주요 인사들이 참",2025-08-26 16:46:38,http://www.segye.com/newsView/20250826516601,세계일보
“궁금해서 계속 지켜보게 돼” 카톡 채팅창에 ‘…’ 입력 중 표시 지우는 방법은?,https://img.segye.com/content/image/2025/08/26/300/20250826515247.jpg,카카오톡 업데이트 후 ‘메시지 입력 중 상태 보기’ 기능이 추가되면서 일부 사용자들이 불만을 토로하고 있다. 26일 카카오에 따르면 업데이트는 ‘대화 몰입감을 높이기 위해 기능을 추가’한 것으로 전해졌다. 하지만 일부 사용자 사이에서 상대방이 메시지를 작성하는 동안 채팅창에 표시되는 ‘···’가 신경이 쓰이고 부담스럽다는 반응이 많다. ‘상대방이,2025-08-26 16:03:17,http://www.segye.com/newsView/20250826515258,세계일보
"에어컨 없는 여름, 몸은 더 빨리 늙는다",https://img.segye.com/content/image/2025/08/26/300/20250826512402.jpg,폭염이 인간의 ‘가속 노화’를 앞당긴다는 연구 결과가 나왔다. 홍콩대 건축학부 도시계획학과 궈추이(郭萃) 조교수 연구팀은 25일(현지시간) 국제 학술지 네이처 기후변화(Nature Climate Change)에 ‘폭염이 가속 노화에 미치는 장기적 영향’이라는 제목의 논문을 발표했다. 연구팀은 2008~2022년 대만 성인 2만4922명의 건강 데이터,2025-08-26 14:30:00,http://www.segye.com/newsView/20250826512321,세계일보
"볼보, 아동·청소년 이어 노인 주거 환경 개선 사업 지원",https://img.segye.com/content/image/2025/08/26/300/20250826512239.jpg,볼보그룹코리아(볼보건설기계코리아)가 한국해비타트와 협력 25주년을 맞아 ‘볼보 뉴홈 프로젝트(Volvo New Home Project)’ 4호 추진을 위한 업무협약을 체결했다고 26일 밝혔다. 볼보는 이번 업무협약을 통해 주거 취약 계층을 위한 환경 개선 활동의 폭을 한층 넓힌는 계획이다. 앞선 25일 서울 한남동 볼보그룹코리아 본사에서 열린 협약식,2025-08-26 14:17:40,http://www.segye.com/newsView/20250826512225,세계일보
"폭스바겐, IAA 모빌리티 2025서 미래 모빌리티 비전 제시",https://img.segye.com/content/image/2025/08/26/300/20250826511717.jpg,폭스바겐이 오는 9월 9일부터 14일까지 독일 뮌헨에서 열리는 ‘IAA 모빌리티 2025(뮌헨 모빌리티쇼)’에서 ‘모두를 위한 모빌리티(Mobility For Everyone)’라는 브랜드 비전을 선보인다. 폭스바겐은 뮌헨 시내 오데온 광장에서 개방형 체험 전시 공간인 ‘오픈 스페이스’를 운영한다. 모든 사람에게 무료로 공개되는 이곳에서 폭스바겐은 새로,2025-08-26 13:57:20,http://www.segye.com/newsView/20250826511723,세계일보
"2025 문화도시 박람회, 전국 문화도시가 영등포에 모인다",https://img.segye.com/content/image/2025/08/26/300/20250826511397.jpg,"영등포문화재단(대표이사 이건왕) 문화도시센터는 9월 4일(목)부터 7일(일)까지 여의도공원, 더현대서울 등 서울 여의도 일대에서 ‘2025 문화도시 박람회’(이하 박람회)를 개최한다. 영등포구는 지난 2021년 3차 법정 문화도시로 지정된 이후 올해 전국문화도시협의회 의장도시(의장 최호권)로 선출됐다. 청주, 서귀포, 영도, 춘천에 이어 다섯 번째로 문",2025-08-26 13:45:13,http://www.segye.com/newsView/20250826511407,세계일보
