title,thumbnail,short_content,write_time,link,company
"내란특검 등 7개 법안, 재표결서 부결
'수신료 통합징수' 가결",https://img.segye.com/content/image/2025/04/17/300/20250417517597.jpg,"'내란·명태균 특검법'과 상법 개정안 등을 비롯한 7개 법안이 17일 국회 본회의 재표결에서 부결, 자동 폐기됐다. 국회법에 따라 무기명으로 이뤄진 이날 재표결에서 내란 특검법은 총 299명 투표 중 찬성 197표·반대 102표, 명태균 특검법은 299명 중 찬성 197표·반대 98표·무효 4표로 각각 부결됐다. 재표결 법안은 재적의원 과반수 출석, 출",2025-04-17 18:10:54,http://www.segye.com/newsView/20250417515745,세계일보
"""文정부, 주택통계 102회 왜곡 지시""",https://img.segye.com/content/image/2025/04/17/300/20250417517651.jpg,"문재인정부 당시 대통령비서실과 국토교통부 등이 주택 통계를 100차례 넘게 조작한 것으로 감사원 감사 결과 드러났다. 통계작성기관인 한국부동산원과 감정원에 부당한 영향력을 행사하며 직·간접적으로 통계를 조정하게 했다는 것이다. 감사원은 17일 전국주택가격동향조사(주택통계), 가계동향조사(소득통계), 경제활동인구조사(고용통계)를 대상으로 한 ‘주요 국가통",2025-04-17 18:06:45,http://www.segye.com/newsView/20250417513974,세계일보
[속보] ‘피고인 尹’ 법정 모습 21일엔 공개…재판부 촬영 허가,https://img.segye.com/content/image/2025/04/17/300/20250417514073.jpg,서울중앙지법 형사합의25부(재판장 지귀연)는 17일 윤석열 전 대통령의 다음 형사재판에서 법정 내 사진과 영상 촬영을 허가한다고 밝혔다.,2025-04-17 15:57:12,http://www.segye.com/newsView/20250417514074,세계일보
"北, 美 B-1B 전개에 ""공격 준비 과정…묵과 안 해""",https://img.segye.com/content/image/2025/04/17/300/20250417514021.jpg,"북한은 최근 미국의 B-1B 전략폭격기 등 전략자산이 한반도에 일상적으로 전개되고 있다면서, 이는 미국이 자신들을 상시 타격할 수 있는 군사 대응 태세를 갖추기 위한 목적이라고 17일 주장했다. 북한 관영매체들은 국방성 대변인이 16일자 담화에서 “이번에 감행된 미한(미국·한국)의 군사적망동은 우리 국가의 안전에 대한 노골적인 위협이며 지역의 군사적 긴",2025-04-17 16:00:59,http://www.segye.com/newsView/20250417513853,세계일보
"""文정부, 집값 통계 102회 왜곡 지시""
감사원, 최종결과 발표",https://img.segye.com/content/image/2025/04/17/300/20250417513356.jpg,문재인 정부가 수년간 주택·소득·고용 분야의 주요 국가 통계를 왜곡했다는 내용의 감사원 감사 결과가 확정됐다. 감사원은 지난 10일 감사위원회에서 2023년 9월 중간 발표한 '주요 국가통계 작성 및 활용 실태 감사 결과'를 의결해 확정했다고 17일 밝혔다. 감사원은 당시 청와대와 국토교통부가 총 102차례에 걸쳐 부동산원에 주택가격 변동률을 하,2025-04-17 15:35:36,http://www.segye.com/newsView/20250417510798,세계일보
’3자 대결’ 이재명 45% vs 국힘 17∼24% vs 이준석 7∼9% [NBS],https://img.segye.com/content/image/2025/04/17/300/20250417511874.jpg,"차기 대통령 선거에서 정권을 교체해야 한다는 인식은 54%, 정권 재창출을 해야 한다는 인식은 33%라는 여론조사 결과가 17일 나왔다. 엠브레인퍼블릭ㆍ케이스탯리서치ㆍ코리아리서치ㆍ한국리서치가 지난 14일부터 전날까지 만 18세 이상 남녀 1천1명을 대상으로 진행한 '전국지표조사(NBS) 리포트'에 따르면 이같이 집계됐다. '차기 대선에서 정권교체",2025-04-17 14:51:06,http://www.segye.com/newsView/20250417511896,세계일보
한미 공군 '프리덤 플래그' 연합훈련… 스텔스기가 처음으로 가상 적기 임무 맡아,https://img.segye.com/content/image/2025/04/17/300/20250417511265.jpg,"한미 공군은 17일부터 다음달 2일까지 대규모 연합공중훈련인 프리덤 플래그를 실시한다고 한국 공군이 밝혔다. 양국 공군은 매년 상반기와 하반기에 각각 하던 연합편대군종합훈련과 비질런트 디펜스 훈련을 지난해부터 통합해 프리덤 플래그라는 명칭으로 연 2회 실시하고 있다. 이번 훈련에서 한국 공군은 F-35A, F-15K, KF-16 전투기와 KC-330",2025-04-17 14:23:50,http://www.segye.com/newsView/20250417511267,세계일보
국힘 토론회 조 추첨…'나경원·한동훈·홍준표' 붙는다,https://img.segye.com/content/image/2025/04/17/300/20250417511183.jpg,"국민의힘은 17일 여의도 당사에서 경선 후보 8명의 토론회 조 추첨 행사를 진행했다. 그 결과, A조는 김문수·안철수·양향자·유정복 후보, B조는 나경원·이철우·한동훈·홍준표 후보(가나다 순)로 편성됐다. 토론 주제는 A조 '미래청년', B조는 '사회통합'이다. A조는 오는 19일, B조는 20일 토론회를 각각 진행한다. 조 추첨은 행사장에 도착",2025-04-17 14:16:19,http://www.segye.com/newsView/20250417509372,세계일보
‘차기 대통령’ 이재명 39% 1위… 김문수·홍준표 8% [NBS],https://img.segye.com/content/image/2025/04/17/300/20250417510286.jpg,"이재명 더불어민주당 전 대표가 여야 차기 대선 주자들 중 ‘차기 대통령 적합도’, ‘대선후보 호감도’ 조사에서 1위를 기록했다는 여론조사 결과가 17일 나왔다. 가상 3자 대결 구도의 여론조사에서도 이 전 대표가 우세했다. 엠브레인퍼블릭·케이스탯리서치·코리아리서치·한국리서치가 지난 14일부터 16일까지 만 18세 이상 남녀 1001명을 대상으로 진행한",2025-04-17 13:35:39,http://www.segye.com/newsView/20250417510323,세계일보
"김정은, 붉은광장에 설까",https://img.segye.com/content/image/2025/04/17/300/20250417510367.jpg,제2차 세계대전에서 승리한 연합국들이 기리는 두 가지 날이 있다. 군국주의 일본의 항복이 계기가 된 ‘일본을 상대로 한 승전’ 기념일(V-J 데이)과 나치 독일의 항복에 따른 ‘유럽에서의 승전’ 기념일(V-E 데이)이 그것이다. 영국 등 유럽 국가들에선 1945년 8월15일 일왕이 항복 선언을 한 점에 착안해 8월15일을 V-J 데이로 여긴다. 우리에겐 바,2025-04-17 13:37:43,http://www.segye.com/newsView/20250417510186,세계일보
"李 ""손쉽게 증세 얘기하는 것 부적절…선택적 모병제 운영""",https://img.segye.com/content/image/2025/04/17/300/20250417510183.jpg,"더불어민주당 이재명 대선경선 후보는 경선 경쟁자인 김경수·김동연 후보의 증세론에 대해 ""재정 문제를 해결하기 위해 손쉽게 증세 얘기를 하는 것은 적절하지 않다""고 지적했다. 이 후보는 17일 대전 국방과학연구소 방문 후 기자들과 만나 ""세금 문제는 매우 예민하고, 국가 재정도 어렵지만 개별 기업이나 우리 국민도 다 어렵다""며 이같이 밝혔다. 그러면서",2025-04-17 13:28:30,http://www.segye.com/newsView/20250417509344,세계일보
"고향 충북 찾은 김동연 ""세종시를 실질적 행정수도로 완성할 것""",https://img.segye.com/content/image/2025/04/17/300/20250417510141.jpg,"더불어민주당 김동연 대선 경선 후보가 17일 첫 순회 경선지이자 자신의 고향(충북 음성)이 있는 충청권에서 승리의 각오를 다지기 위해 청주를 방문했다. 청주를 찾은 대선 주자는 김 후보가 처음이다. 김 후보는 이날 오전 청주 상당공원 내 4·19 학생혁명 기념탑 참배로 공식 일정을 시작하면서 기자들과 만나 ""(공원 옆) 충북도청은 오래전 공무원 생",2025-04-17 13:27:04,http://www.segye.com/newsView/20250417510063,세계일보
올해 1분기 탈북민 38명 국내 입국…MZ세대가 절반 이상,https://img.segye.com/content/image/2025/04/17/300/20250417509216.jpg,"올해 1분기 국내 입국한 북한이탈주민(탈북민)은 총 38명으로 집계됐다. 통일부는 17일 올해 1∼3월에 한국에 들어온 탈북민은 남성 1명, 여성 37명으로 총 38명이라고 밝혔다. 이들 가운데 절반 이상인 20명가량이 ‘MZ세대’로 불리는 2030세대인 것으로 알려졌다. 통일부는 지난해와 재작년 1분기의 경우 각각 43명, 34명의 탈북민이 입",2025-04-17 12:27:18,http://www.segye.com/newsView/20250417508622,세계일보
"박찬대 “한덕수, 위헌행위 국민께 석고대죄해야”",https://img.segye.com/content/image/2025/04/17/300/20250417507613.jpg,더불어민주당 박찬대 당대표 직무대행 겸 원내대표는 17일 대통령 권한대행 한덕수 국무총리를 향해 “헌법재판관 지명을 철회하고 위헌행위를 한 것에 대해 국민께 석고대죄해야 한다”고 밝혔다. 박 직무대행은 이날 오전에 열린 민주당 정책조정회의에서 헌법재판소가 헌법재판관 지명 효력정지 가처분을 인용한 것을 두고 “상식적이고 합리적인 결정”이라고 평가했다.,2025-04-17 11:14:37,http://www.segye.com/newsView/20250417507563,세계일보
이준석 “빅텐트론은 허상…호사가들이 만들어내는 얼치기 전략”,https://img.segye.com/content/image/2025/04/17/300/20250417507419.jpg,"이준석 개혁신당 대선 후보는 6·3 대선을 앞두고 확산하는 ‘반(反)이재명 빅텐트론’에 대해 “묻지 마 식 통합은 언제나 국민에게 심판의 대상 됐다”며 “빅텐트는 허상에 불과하다”고 지적했다. 이 후보는 17일 대구아트파크에서 열린 대구경북 언론인 모임 아시아포럼21 정책토론회에서 이같이 말하고, “호사가들이 만들어내는 얼치기 전략”이라고 평가절하했다.",2025-04-17 11:06:34,http://www.segye.com/newsView/20250417507209,세계일보
[파고다 강남 끝토익 RC김나래] PART 5,https://img.segye.com/content/image/2025/04/17/300/20250417517956.jpg,,2025-04-17 18:45:47,http://www.segye.com/newsView/20250417516262,세계일보
[시사일본어학원의 초단기 일본어 회화] 뱅 스타일은 싫어,https://img.segye.com/content/image/2025/04/17/300/20250417517971.jpg,,2025-04-17 18:45:08,http://www.segye.com/newsView/20250417516263,세계일보
[시사중국어학원의 리얼 중국어 회화] 문 앞까지 배달해 주니 편하다.,https://img.segye.com/content/image/2025/04/17/300/20250417517993.jpg,,2025-04-17 18:44:49,http://www.segye.com/newsView/20250417516264,세계일보
[18일의 날씨] 한낮 땀방울 '송골송골',https://img.segye.com/content/image/2025/04/17/300/20250417518029.jpg,,2025-04-17 18:44:22,http://www.segye.com/newsView/20250417516143,세계일보
상습 폭행 울산 장애인시설 ‘질병死’도 속출,https://img.segye.com/content/image/2025/04/17/300/20250417517157.jpg,"작년 말 울산의 한 중증장애인 거주시설에서 입소 장애인들을 대상으로 한 직원들의 상습 폭행 등 학대 사실이 드러나면서 장애인단체 사이에선 “인권 참사”라며 거주시설 학대 문제가 재점화하고 있다. 이런 가운데 해당 A시설에서 최근 5년간 발생한 16명의 장애인 사망자 중 20∼30대가 절반인 8명으로, 이들은 폐렴 등 질병 때문에 사망한 것으로 드러나 부실",2025-04-17 18:32:22,http://www.segye.com/newsView/20250417516162,세계일보
"똥 기저귀 어린이집 교사 얼굴에 던진 엄마… 항소심, 징역 6개월 선고",https://img.segye.com/content/image/2025/04/17/300/20250417517490.JPG,자녀를 아동학대 했다고 의심해 똥 묻은 기저귀로 어린이집 교사 얼굴을 때린 어머니에게 항소심 재판부가 징역형의 집행유예를 선고한 원심을 깨고 실형을 선고했다. 17일 대전지법 3-3형사 항소부(박은진 부장판사)는 A(40대)씨의 상해 혐의 사건 항소심에서 징역 6개월을 선고했다. 징역 6개월에 집행유예 2년을 선고한 1심의 형이 가벼워 부당하다는 검,2025-04-17 17:57:26,http://www.segye.com/newsView/20250417517317,세계일보
"디지털플랫폼정부위, 공공 부문 AI 활용 위한 가이드라인 마련",,"디지털플랫폼정부위원회가 공공 부문에서 인공지능(AI) 기술을 안전하고 효과적으로 활용할 수 있게 ‘공공부문 초거대 AI 도입·활용 가이드라인 2.0’을 마련해 중앙 부처와 지방자치단체, 공공기관에 배포한다. 17일 디지털플랫폼정부위원회에 따르면 위원회는 지난해 4월 마련한 공공부문 초거대 AI 도입·활용 가이드라인에 AI 관련 최신 기술과 정책 동향,",2025-04-17 17:57:01,http://www.segye.com/newsView/20250417517339,세계일보
외국인 명의로 수억원 대출받아 대포차 유통한 일당 검거,https://img.segye.com/content/image/2025/04/17/300/20250417517436.jpg,대포차를 취득해 시중에 렌터카로 유통한 전문 유통업자와 중고차 매매상 등 40명이 경찰에 붙잡혔다. 이들은 외국인과 공모해 8억9000만원 상당의 사기 대출을 받아 대포차량을 확보했다. 서울경찰청 마약범죄수사대는 대포차 전문 유통업자 A씨 등 2명을 사기·장물취득·여객운수사업법위반·공기호부정사용 등 혐의로 검찰에 송치했다고 17일 밝혔다. 중고차 매매상,2025-04-17 17:54:51,http://www.segye.com/newsView/20250417517365,세계일보
영덕 산불 피해 3170억 집계… 선박 35척·주택 1623채 타,https://img.segye.com/content/image/2025/04/17/300/20250417517089.jpg,사상 최악의 산불로 기록된 경북 북부 일대에 번진 산불로 영덕지역 피해가 3170억원으로 잠정 집계된 것으로 나타났다. 영덕군 올해 예산 6171억원의 절반이 넘는 수준이다. 김광열 영덕군수는 17일 오전 군청 3층 회의실에서 긴급 브리핑을 갖고 산불 피해 종합 복구계획을 발표했다. 17일 영덕군에 따르면 지난달 22일 의성에서 시작해 25일 영덕까,2025-04-17 17:46:14,http://www.segye.com/newsView/20250417517090,세계일보
尹 파면에 분노… 경찰 버스 유리창 깬 30대 재판행,https://img.segye.com/content/image/2025/04/17/300/20250417515616.jpg,헌법재판소의 윤석열 전 대통령 파면 결정에 반발해 경찰 버스를 파손한 30대 남성이 17일 재판에 넘겨졌다. 서울중앙지검 형사2부(부장검사 조아라)는 이날 30대 이모씨를 특수공용물건손상 혐의로 구속기소했다. 이씨는 헌재가 윤 전 대통령 탄핵심판 선고기일을 연 4일 탄핵소추를 인용해 윤 전 대통령이 파면된 직후 서울지하철 3호선 안국역 5번 출구 앞에,2025-04-17 17:00:00,http://www.segye.com/newsView/20250417515617,세계일보
"퇴임 앞둔 문형배 ""관용·자제 없다면 민주주의 발전 못해""",https://img.segye.com/content/image/2025/04/17/300/20250417516211.jpg,"퇴임을 앞둔 문형배 헌법재판소장 권한대행(재판관)이 대학에서 강의를 열고 “관용과 자제가 없다면 민주주의는 발전할 수 없다”고 말했다. 문 대행은 헌재가 이런 고민을 윤석열 전 대통령 탄핵 결정에 담았다고 강조했다. 문 대행은 17일 인하대학교에서 ‘법률가의 길’: 혼(魂), 창(創), 통(通)’이라는 이름의 특강을 진행했다. 이 학교 법학전문대학원",2025-04-17 16:57:47,http://www.segye.com/newsView/20250417515744,세계일보
부산 반얀트리 화재사고 관련 기장군청 공무원 4명 피의자 전환 입건,https://img.segye.com/content/image/2025/04/17/300/20250417515733.jpg,"지난 2월 부산 기장군에서 발생한 ‘반얀트리 해운대 부산(반얀트리)’ 화재사고를 수사 중인 경찰이 인·허가와 관련해 기방소방서 공무원을 입건한데 이어, 기장군청 소속 공무원을 추가 입건했다. 부산경찰청 형사기동대는 최근 부산 기장군청 건축과 및 협의부서 소속 복수의 공무원에 대한 수사 개시를 통보하고, 이들을 피의자로 전환해 수사하고 있다고 17일 밝혔",2025-04-17 16:45:26,http://www.segye.com/newsView/20250417515694,세계일보
"법원, 尹 전 대통령 21일 공판 법정 촬영 허가",https://img.segye.com/content/image/2025/04/17/300/20250417515414.jpg,법원이 윤석열 전 대통령의 내란 우두머리 혐의 재판의 언론 촬영을 허용했다. 과거 박근혜 전 대통령 국정농단 사건 첫 정식 재판과 이명박 전 대통령의 뇌물수수 사건 첫 재판 모습이 언론을 통해 공개된 적이 있다. 서울중앙지법 형사25부(재판장 지귀연)은 17일 윤 전 대통령의 두 번째 공판에서 취재진의 법정 촬영을 허가했다. 해당 공판은 21일 오전 1,2025-04-17 16:47:36,http://www.segye.com/newsView/20250417515058,세계일보
"도박에 빠져 아이들 휴대폰까지 판 남편, ""생사도 모르는 상황""",https://img.segye.com/content/image/2025/04/17/300/20250417515091.jpg,남편이 도박에 빠져 재산은 물론 아이들의 휴대폰까지 중고로 팔아버린 후 잠적한 사연이 전해졌다. 17일 YTN 라디오 ‘조인섭 변호사의 상담소’에는 남편의 도박 빚에 허덕이다가 이혼을 결심하게 된 사연자가 등장했다. 사연자는 남편이 신혼 때부터 도박에 빠져 가정을 제대로 돌보지 않았다고 토로했다. 남편 등쌀에 소액대출까지 받은 사연자는 빚에,2025-04-17 16:58:00,http://www.segye.com/newsView/20250417515403,세계일보
"尹 ‘내란 혐의’ 형사재판 모습 결국 공개된다… 法, 촬영 허가",https://img.segye.com/content/image/2025/04/17/300/20250417514699.jpg,법원이 윤석열 전 대통령의 ‘내란 혐의’ 형사재판의 법정 촬영을 허가했다. 윤 전 대통령의 ‘내란 우두머리(수괴)’ 재판을 심리하는 서울중앙지법 형사합의25부(부장판사 지귀연)는 오는 21일 오전 10시 417호 형사대법정에서 열릴 2차 공판에서 취재진의 법정 촬영을 17일 허가했다. 앞서 지난 14일 열린 첫 공판 때는 재판부가 촬영 신청을 받,2025-04-17 16:16:00,http://www.segye.com/newsView/20250417514712,세계일보
[18일의 날씨] 한낮 땀방울 '송골송골',https://img.segye.com/content/image/2025/04/17/300/20250417518029.jpg,,2025-04-17 18:44:22,http://www.segye.com/newsView/20250417516143,세계일보
[재미로 보는 오늘의 운세] 4월 18일 (금요일) 띠별 운세,https://img.segye.com/content/image/2025/04/17/300/20250417517749.jpg,쥐 96년생 필요할 때 찾으면 눈에 잘 띄지 않는다. 84년생 벗을 가까이 하면 크게 얻는다. 72년생 원하는 것을 얻지만 오래 간직함은 힘들다. 60년생 오해가 있었던 사람과 화해하기 좋은 시기. 48년생 부부유별이 없어지는 것은 아니다. 36년생 좁은 것 보다 넓은 공간에 있는 것이 좋다. 소 97년생 투자나 매매 시에 반드시 조언을 구하라.,2025-04-17 18:17:33,http://www.segye.com/newsView/20250417516265,세계일보
“요즘 왜 우울하지”…봄에 유독 자살률이 높은 이유 [건강+],https://img.segye.com/content/image/2025/04/17/300/20250417516129.jpg,"우울증은 일조량이 감소하는 겨울철에 많이 발생한다고 알려져 있지만, 햇볕이 늘고 기온이 상승하는 봄철에도 계절성 우울장애로 ‘봄철 우울증’이 나타날 수 있다. 전문가들은 주요 원인으로 △ 일조량의 변화 △ 호르몬의 변화 △ 신경전달물질 분균형 등을 꼽는다. 17일 이아라 경희대병원 정신건강의학과 교수는 “봄은 입학, 취업 등 새로운 시작이 많은 계절로",2025-04-17 18:16:50,http://www.segye.com/newsView/20250417516152,세계일보
연세의료원·하나은행 등 실버타운 시니어복지시설 다자 업무협약 체결,https://img.segye.com/content/image/2025/04/17/300/20250417514572.jpg,"연세의료원이 금융기관, 개발업체, 자산운용업체와 손잡고 시니어복지시설 건립에 나선다. 16일 연세의료원은 하나은행, MDI미래도시개발, YK자산운용과 실버타운 시니어복지시설 건립을 위한 다자간 업무협약을 체결했다고 밝혔다. 이번 협약을 통해 연세의료원은 실버타운 시니어복지시설 건립에서 의료서비스 분야 관련 계획과 운영을, 하나은행은 사업 금융구조",2025-04-17 16:10:39,http://www.segye.com/newsView/20250417514574,세계일보
"현대차, ‘2025 뉴욕 국제 오토쇼’서 모터스포츠 존, EV 트랙 존 등 고객 체험형 콘텐츠 마련",https://img.segye.com/content/image/2025/04/17/300/20250417513168.jpg,"현대차는 이달 27일(현지시간)까지 진행되는 뉴욕 오토쇼에서 4,433m2(약 1,341평) 규모의 전시 공간을 마련하고 메인 존, 모터스포츠 존, EV 트랙 존 등을 운영해 총 28대의 차량을 전시하는 등 북미 시장에 현대차의 경쟁력 있는 라인업을 선보인다. 먼저 부스 전면의 메인 존에는 ▲팰리세이드 ▲팰리세이드 XRT Pro 등 신차를 비롯해 ▲아이",2025-04-17 15:22:45,http://www.segye.com/newsView/20250417513186,세계일보
"현대차, ‘2025 뉴욕 국제 오토쇼’ 참가",https://img.segye.com/content/image/2025/04/17/300/20250417513060.jpg,"현대자동차가 16일(수, 현지시간) 미국 뉴욕 제이콥 재비츠 컨벤션 센터(Jacob Javits Convention Center)에서 열린 ‘2025 뉴욕 국제 오토쇼(2025 New York International Auto Show)’에서 ‘디 올 뉴 팰리세이드(The all-new Palisade)’를 북미 시장에 최초로 선보였다. 현대차의 플래그",2025-04-17 15:19:18,http://www.segye.com/newsView/20250417513078,세계일보
"기아, ‘2025 뉴욕 국제 오토쇼’ 참가",https://img.segye.com/content/image/2025/04/17/300/20250417512845.jpg,"기아가 16일(수, 현지시간) 미국 뉴욕 ‘제이콥 재비츠 컨벤션 센터(Jacob Javits Convention Center)’에서 열린 '2025 뉴욕 국제 오토쇼(2025 New York International Auto Show, 이하 뉴욕 오토쇼)’에 참가했다. 기아는 뉴욕 오토쇼에서 플래그십 전기 SUV ‘EV9 나이트폴(Nightfall) 에",2025-04-17 15:13:06,http://www.segye.com/newsView/20250417512849,세계일보
"기아 EV3, ‘2025 세계 올해의 차’ 선정",https://img.segye.com/content/image/2025/04/17/300/20250417512576.jpg,"기아가 16일(현지시간) 진행된 ‘2025 월드카 어워즈(2025 World Car Awards)’에서 EV3가 ‘세계 올해의 자동차(World Car of the Year, WCOTY)’에 선정됐다고 밝혔다. 기아는 지난해 EV9에 이어 이번 EV3까지 2년 연속 세계 올해의 자동차에 오르는 쾌거를 달성하며 대형 전동화 SUV부터 콤팩트 전동화 SUV",2025-04-17 15:02:24,http://www.segye.com/newsView/20250417512591,세계일보
"토요타, 2025 시즌 모터스포츠 프로그램 ‘가주 레이싱 6000 클래스’ 본격 가동",https://img.segye.com/content/image/2025/04/17/300/20250417511760.jpg,"토요타코리아가 오는 4월 19일 개막하는 ‘2025 오네(O-NE) 슈퍼레이스 챔피언십’을 시작으로 본격적인 모터스포츠 활동에 돌입한다. 올 시즌부터 대회 최상위 클래스 명칭을 ‘토요타 가주 레이싱 6000 클래스(TOYOTA GAZOO Racing 6000 Class)’로 변경하며, 브랜드 철학과 레이싱의 가치를 국내 팬들에게 적극적으로 전달할 예정이",2025-04-17 14:33:42,http://www.segye.com/newsView/20250417511756,세계일보
"비대면 중고차 판매 플랫폼 리본카, 전년 동기 21% 성장",https://img.segye.com/content/image/2025/04/17/300/20250417511502.jpg,"비대면 직영인증중고차 플랫폼 리본카가 2025년 1분기(1~3월) 고객 데이터를 분석한 결과, 100% 비대면 차량 판매 서비스인 ‘내차팔기’ 이용 건수가 전년 동기 대비 21% 증가한 것으로 나타났다. 중고차 업계 최초로 도입된 리본카의 ‘비대면 내차팔기’는 현재까지도 업계에서 유일하게 진행하고 있는 독보적인 서비스로, 차량 등록부터 견적 확인, 계약",2025-04-17 14:25:36,http://www.segye.com/newsView/20250417511555,세계일보
"볼보 전기 SUV EX90, ‘2025 월드 카 어워즈’서 럭셔리 카 수상",https://img.segye.com/content/image/2025/04/17/300/20250417511045.jpg,"볼보자동차의 차세대 플래그십 전기 SUV, ‘EX90’이 세계적인 권위의 ‘2025 월드 카 어워즈(2025 World Car Awards)’에서 올해 가장 럭셔리 한 차량으로 선정됐다. 올해로 21회를 맞는 월드 카 어워즈(World Car Awards)는 전 세계 30개국에서 선발된 자동차 전문 기자 96명으로 구성된 심사위원단이 매년 비밀 투표로",2025-04-17 14:08:53,http://www.segye.com/newsView/20250417511068,세계일보
