title,thumbnail,short_content,write_time,link,company
국민의힘 원내대표 선거 ‘시계제로’… 지역·계파 다자구도로 확대되나,https://img.segye.com/content/image/2025/06/13/300/20250613515468.jpg,대선 패배 이후 쇄신 방안을 두고 갈등의 골이 깊어지고 있는 국민의힘이 원내대표 자리를 두고 영남권에서 새로운 후보가 부상하면서 ‘친윤’ 대 ‘친한’으로 짜여진 계파 구도가 다자 지역 대결로 변화할 조짐이 나타났다. 4선 이헌승(부산 부산진을) 의원은 14일 통화에서 “주변에서 출마를 권유하는 의견이 많아 원내대표 선거 출마를 고심 중”이라며 “결심만,2025-06-14 06:00:00,http://www.segye.com/newsView/20250613515133,세계일보
李대통령 “인도 항공사고에 충격…피해자와 가족에 깊은 애도”,https://img.segye.com/content/image/2025/06/13/300/20250613516049.jpg,이재명 대통령이 인도 에어인디아 여객기 추락 사고 희생자들을 애도했다. 이 대통령은 13일 엑스(X·옛 트위터)에 “인도 아메다바드에서 발생한 항공사고에 놀라고 깊이 충격을 받았다”며 “사고로 희생된 승객과 사고 지역의 피해자 및 그 가족 여러분에게 깊은 애도와 진심 어린 위로를 전한다”고 밝혔다. 이 대통령은 이어 “이 어려운 시기에 대한민국은 인,2025-06-13 23:05:37,http://www.segye.com/newsView/20250613515965,세계일보
닻 올린 내란∙김건희∙해병 특검…‘메머드급’ 수사 인력∙사무실 확보 돌입,https://img.segye.com/content/image/2025/06/13/300/20250613515229.jpg,"윤석열 전 대통령 부부를 겨냥한 내란∙김건희∙순직해병 특검이 임명되면서 3개 특별검사팀이 동시에 닻을 올렸다. 이재명 대통령 당선 8일 만에 3개 특검법이 통과되고 더불어민주당∙조국혁신당의 특검 후보 추천, 이 대통령 임명까지 속전속결로 이뤄졌다. 내란 특검에는 조은석 전 감사원장 권한대행, 김건희 특검에는 민중기 전 서울중앙지방법원장, 순직해병 특검에",2025-06-13 20:53:48,http://www.segye.com/newsView/20250613515152,세계일보
"“국민은 여러분 충성심 믿어”… 李대통령, 전방부대 장병 격려",https://img.segye.com/content/image/2025/06/13/300/20250613514999.jpg,"이재명 대통령은 13일 최전방 부대를 방문해 군 대비 태세를 점검하고 장병들의 노고를 격려했다. 또 군의 대북 확성기 방송 중지 이후 북한의 대남 소음방송이 멈춘 접경지역 마을을 방문해 그동안 피해를 본 주민들을 위로했다. 오는 15∼17일 주요 7개국(G7) 정상회의에 참석하기 위해 국내를 비우기 전 안보·방위를 점검하는 동시에, 전 정부와 차",2025-06-13 20:27:40,http://www.segye.com/newsView/20250613515002,세계일보
"외교부, 14일부로 이스라엘·이란에 ‘특별여행주의보’ 발령",https://img.segye.com/content/image/2025/06/13/300/20250613514548.jpg,"외교부는 이스라엘의 이란 공습 및 이란의 보복 공격 등 중동 지역 정세가 급격히 악화되고 있는 점을 감안, 14일부로 이스라엘 및 이란 일부지역에 대해 특별여행주의보를 발령한다고 13일 밝혔다. 이번 조치로 양국의 기존 2단계(여행자제) 여행경보 발령지역이 특별여행주의보(2.5단계)로 격상된다. 기존 발령된 이스라엘 일부 지역에 대한 여행경보 3단계",2025-06-13 20:03:07,http://www.segye.com/newsView/20250613514553,세계일보
민주 원내운영수석에 문진석…정책수석 허영·소통수석 박상혁,https://img.segye.com/content/image/2025/06/13/300/20250613514819.jpg,"더불어민주당 김병기 신임 원내대표는 13일 원내운영수석으로 문진석 의원을 임명했다. 문 의원은 원조 친명(친이재명) 그룹 '7인회' 멤버다. 김 원내대표와는 '이재명 1기 지도부'에서 각각 원내 전략기획위원장, 수석사무부총장으로 함께 일한 바 있다. 문 의원은 ""집권 여당 원내운영수석에 선임돼 막중한 책임감을 느낀다. 이재명 정부의 성공을 위해 제 모",2025-06-13 19:40:02,http://www.segye.com/newsView/20250613514751,세계일보
"‘민변 출신’ 송기호 변호사, 대통령실 국정상황실장 임명",https://img.segye.com/content/image/2025/06/13/300/20250613514727.jpg,"민주사회를 위한 변호사모임(민변) 출신 송기호 변호사가 이재명 정부의 신임 대통령실 국정상황실장으로 임명됐다. 송 실장은 13일 공식 발령을 받고 대통령실로 출근했다. 그는 낮 12시 30분 대통령실에서 열린 안보경제 긴급 점검 회의에도 참석했다. 이 대통령은 회의실에서 송 실장을 보고 ""오늘부터 발령 나셨냐, 잘 부탁드린다. 상당히 노가다 자리""라고",2025-06-13 19:30:56,http://www.segye.com/newsView/20250613509348,세계일보
"한·EU정상, G7 정상회의서 회동…첫 약식회담 성사",https://img.segye.com/content/image/2025/06/13/300/20250613514625.jpg,"이재명 대통령의 주요 7개국(G7) 정상회의 참석을 계기로 유럽연합(EU)과 약식 정상회담이 개최되는 것으로 파악됐다. EU 대변인실 관계자는 13일(현지시간) 연합뉴스 서면 질의에 ""안토니우 코스타 EU 정상회의 상임의장이 우르줄라 폰데어라이엔 집행위원장과 함께 한국 대통령을 만날 것""이라고 답했다. 다자회의 계기로 EU 지도부와의 상견례이자",2025-06-13 19:26:23,http://www.segye.com/newsView/20250613514352,세계일보
"김민석 “유통 과정 불분명한 품목, 투명성 높여야”",https://img.segye.com/content/image/2025/06/13/300/20250613513740.jpg,김민석 국무총리 후보자는 13일 “유통 과정이 불분명하거나 불투명한 품목들에 대해서는 거래의 투명성을 높여야 한다”고 말했다. ‘민생 경제 살리기’에 방점을 둔 이재명 대통령에 발맞춰 김 후보자도 식품 물가 잡기를 최우선 과제로 꼽았다. 김 후보자는 이날 서울 종로구 통의동 금융감독원 연수원에서 ‘밥상 물가안정 경청 간담회’를 주재하고 “과거처럼 기업의,2025-06-13 20:06:30,http://www.segye.com/newsView/20250613513487,세계일보
김병기 與 신임 원내대표 “李정부 성공을 위해 분골쇄신”,https://img.segye.com/content/image/2025/06/13/300/20250613513498.jpg,김병기 더불어민주당 신임 원내대표는 13일 “제 맡은 바 임무를 충실히 하고 이재명 정부 성공과 국가 재건에 교두보 되는 1년을 맡아 분골쇄신 하겠다”고 말했다. 김 원내대표는 이날 오후 국회에서 민주당 제2기 원내대표로 당선된 직후 기자들과 만나 이같이 소감을 밝혔다. 김 원내대표는 신임 원내지도부 인선 관련 질문에 “운영수석(부대표)과 정책수,2025-06-13 17:25:53,http://www.segye.com/newsView/20250613513476,세계일보
"문재인 “3년간 남북관계 파탄…李정부, 평화의 길 개척할 것”",https://img.segye.com/content/image/2025/06/13/300/20250613513382.jpg,문재인 전 대통령은 13일 “역대 민주당 정부가 그래 왔듯 이재명정부는 파탄 난 남북관계를 복원하고 한반도 평화의 길을 다시 개척할 것으로 믿는다”고 말했다. 문 전 대통령은 이날 국회에서 열린 6·15 남북공동선언 25주년 학술회의 및 ‘민주정부 한반도평화 계승발전협의회’ 발족식에서 박능후 포럼 사의재 상임대표가 대독한 축사를 통해 “과거 어느 때보다,2025-06-13 17:35:19,http://www.segye.com/newsView/20250613513383,세계일보
與 신임 원내대표 김병기 “광장 뜻 이어받아 개혁 완수”,https://img.segye.com/content/image/2025/06/13/300/20250613513044.jpg,더불어민주당 신임 원내대표에 13일 김병기 의원이 선출됐다. 김 원내대표는 국가정보원 출신으로 당내 ‘정보통’으로 꼽히는 대표적 친이재명계 인사다. 그는 취임 첫 일성으로 “광장의 뜻을 이어받아 개혁을 완수하고 민생회복·경제성장·국민통합의 기틀을 마련하겠다”고 밝혔다. 이번 원내대표 선거 출사표를 던지며 스스로를 “이재명의 블랙(요원)”이라고 소개한 김,2025-06-13 17:22:39,http://www.segye.com/newsView/20250613512924,세계일보
"李, 감말랭이로 끼니 때우며 “체력은 자신 있다”…전 대변인의 회상",https://img.segye.com/content/image/2025/06/13/300/20250613512808.jpg,더불어민주당 홍정민 전 의원은 12일 이재명 대통령이 지난 2022년 제20대 대선 당시 ‘감말랭이’로 식사를 때우며 유세를 했던 일화를 소개했다. 홍 전 의원은 이날 자신의 사회관계망서비스(SNS)에 ‘이재명 대통령 - 감말랭이와 DNA 일화’라는 제목의 글을 올렸다. 홍 전 의원은 이 대통령이 11일 대통령실 직원의 과로로 인한 건강 이상 소식을 접,2025-06-13 16:51:46,http://www.segye.com/newsView/20250613512810,세계일보
"李, 3대 특검 임명… 국힘 “탄압·대대적 정치보복”",https://img.segye.com/content/image/2025/06/13/300/20250613512332.jpg,"국민의힘은 13일 이재명 대통령이 ‘내란·김건희·채상병 특검’ 등 3대 특검을 임명한 데 대해 “특검의 목적이 야당 탄압에 있다는 걸 보여준다”고 비판했다. 김용태 비상대책위원장은 이날 국회에서 기자들과 만나 “특검이라는 것은 공정성이 매우 중요하다”며 “어제 지명된 분들은 민주당 성향, 친여(親與) 성향이 강한 인사로 기억한다. 특검이 어떤 수사(결과",2025-06-13 16:18:34,http://www.segye.com/newsView/20250613512303,세계일보
"李정부 대통령실, 청와대 모습 담긴 업무표장 다시 쓴다",https://img.segye.com/content/image/2025/06/13/300/20250613512105.jpg,청와대의 외관을 본뜬 업무표장이 이재명정부 대통령실에서 다시 사용된다. 이재명 대통령이 청와대로의 복귀를 준비 중인 만큼 용산 대통령실 청사를 담은 현재의 표장을 계속 사용하는 것이 부적절하다는 판단에서다. 대통령실은 13일 “청와대 복귀 추진에 따라 이재명정부는 용산 대통령실 청사를 형상화한 현재의 대통령실 업무표장 사용을 지양하고 과거 청와대에서,2025-06-13 16:08:30,http://www.segye.com/newsView/20250613512106,세계일보
“피부가 간지럽고 눈이 따가운 이유 있었네”… ‘이것’ 때문? [수민이가 궁금해요],https://img.segye.com/content/image/2025/06/13/300/20250613502944.jpg,손톱용 미용 접착제 7개 제품에서 피부를 자극하는 함유 금지 물질이 검출됐다. 13일 소비자원에 따르면 해외 직접구매(직구)로 또는 국내에서 제조되거나 수입되는 미용 접착제 17종을 시험 검사한 결과 해외직구 상품 3종에서는 다이클로로 메탄(DCM)과 메틸메타크릴레이트(MMA) 등 유해 물질 2종이 검출됐다. 또 엔리안 브러쉬온 젤글루(제조사 원진포리머,2025-06-14 05:27:16,http://www.segye.com/newsView/20250613502946,세계일보
제주·영호남 호우특보… 중대본 1단계 가동,https://img.segye.com/content/image/2025/06/14/300/20250614500096.jpg,"행정안전부는 제주와 전라권, 경상권에 호우 특보가 발효됨에 따라 13일 오후 11시 30분을 기해 중앙재난안전대책본부(중대본) 1단계를 가동했다고 밝혔다. 중대본에 따르면 남해에 위치한 정체전선이 점차 북상하면서 14일까지 제주 50∼120㎜, 부산·울산·경남 30∼80㎜, 광주·전남 30∼80㎜ 등 강하고 많은 비가 내릴 것으로 전망된다. 중대본은",2025-06-14 00:15:42,http://www.segye.com/newsView/20250614500053,세계일보
광주 시내버스 노사 지노위 조정 또 결렬…파업 계속,https://img.segye.com/content/image/2025/06/13/300/20250613516169.jpg,임금·단체협약(임단협) 갈등을 빚고 있는 광주 시내버스 노사의 협상이 다시 한번 결렬돼 당분간 파업이 지속될 것으로 보인다. 13일 전국자동차노동조합연맹(자동차노련) 광주지역버스노동조합에 따르면 노사는 이날 오후 전남지방노동위원회(지노위) 중재로 사후 조정을 시도했다. 지노위 조정 절차는 이번이 3번째다. 임금 8.2％ 인상을 요구하던 노조,2025-06-13 23:24:59,http://www.segye.com/newsView/20250613516148,세계일보
상품권 거래 가장해 범죄수익금 2388억원 세탁한 일당 검거,https://img.segye.com/content/image/2025/06/13/300/20250613514362.jpg,상품권 거래를 가장해 범죄수익을 세탁한 일당이 검찰에 넘겨졌다. 구로경찰서는 13일 범죄수익금을 입금받아 현금으로 세탁에 가담한 상품권업체 대표 A씨와 자금 세탁을 의뢰한 허위 상품권업체 대표 및 직원 등 21명을 범죄수익 은닉 혐의로 송치했다고 밝혔다. A씨와 허위 상품권 업체 대표 8명 등 11명은 구속 송치됐다. 경찰은 상품권을 구입하는 척,2025-06-13 22:07:00,http://www.segye.com/newsView/20250613514280,세계일보
"제주, 비상 1단계… 14일까지 최대 250㎜ 장맛비",https://img.segye.com/content/image/2025/06/13/300/20250613515395.jpg,"13일 오후 들어 제주에 본격적으로 장맛비가 쏟아지고 강풍과 거센 풍랑이 일고 있어 각별한 주의가 필요하다. 제주지방기상청에 따르면 이날 오후 8시 30분 기준 서부와 남부 지역을 중심으로 제주에 시간당 10∼20㎜의 강한 비가 내리고 있다. 지점별 일 누적 강수량은 한라산 진달래밭 50.0㎜, 어리목 48.5㎜, 사제비 47.5㎜, 영실 41.5㎜,",2025-06-13 21:17:12,http://www.segye.com/newsView/20250613515270,세계일보
“수법 매우 잔혹”…여친 살해 의대생 2심서 ‘징역 30년’,https://img.segye.com/content/image/2025/06/13/300/20250613512848.jpg,"여자친구를 흉기로 찔러 살해해 1심에서 징역 26년을 선고받은 명문대 의대생 최모(26)씨가 2심에서 징역 30년을 선고받았다. 서울고법 형사7부(재판장 이재권)는 13일 살인 혐의로 기소된 최씨에게 징역 26년을 선고한 원심을 파기하고 징역 30년을 선고했다. 5년의 보호관찰도 명령했다. 재판부는 “이 사건은 치밀한 계획 하에 이뤄졌고, 수법 또한",2025-06-13 21:09:10,http://www.segye.com/newsView/20250613512703,세계일보
"‘윤석열 김건희 부부 공천개입 의혹’… 검찰, 정진석 전 실장 참고인 조사",https://img.segye.com/content/image/2025/06/13/300/20250613515119.jpg,윤석열 전 대통령이 연루된 ‘정치 브로커’ 명태균 씨의 공천개입 의혹을 수사하는 검찰이 정진석 전 대통령 비서실장을 조사했다. 13일 법조계에 따르면 서울중앙지검 명태균 의혹 전담수사팀(팀장 이지형 차장검사)은 최근 정 전 실장을 참고인 신분으로 조사했다. 검찰은 정 전 실장을 상대로 2022년 지방선거 당시 윤 전 대통령과 부인 김건희 여사가,2025-06-13 20:57:09,http://www.segye.com/newsView/20250613515122,세계일보
"경북 봉화 석포제련소서 포크레인 전도, 60대 근로자 사망",https://img.segye.com/content/image/2025/06/13/300/20250613512480.jpg,13일 오후 12시 40분쯤 경북 봉화군 석포면 영풍 석포제련소 적치장에서 포크레인을 운전하던 근로자 A(60대)씨가 작업 도중 포크레인이 전도되며 숨졌다. 경북소방본부 등에 따르면 소방 당국은 사고 발생 2시간 만에 A씨를 구조해 병원으로 긴급 이송했으나 이미 숨진 상태로 확인됐다. 경찰은 A씨가 포크레인을 이용해 쌓여있는 물건을 빼던 중 물건들이,2025-06-13 20:15:39,http://www.segye.com/newsView/20250613512419,세계일보
‘미성년 친족성폭력’ 공소시효 폐지 왜 안 되나,https://img.segye.com/content/image/2025/06/12/300/20250612513832.jpg,"대전지법 천안지원 제1형사부 전경호 부장판사는 지난 4월7일 성폭력범죄의처벌등에관한특례법위반(친족관계에의한강간)등 혐의로 구속기소된 A(70대)씨에게 징역 25년을 선고하며 이같이 말했다. 재판부에 따르면 A씨는 1985년부터 최근까지 자신의 친딸을 277회 성폭행하고, 딸을 임신시켜 낳은 손녀에게도 지속적으로 성폭력을 행사한 혐의로 재판에 넘겨졌다.",2025-06-13 20:12:37,http://www.segye.com/newsView/20250612511443,세계일보
"경찰, 윤석열·김건희 부부 ‘캣타워 횡령 의혹’ 수사…고발인 조사",https://img.segye.com/content/image/2025/06/13/300/20250613514298.jpg,"경찰이 윤석열 전 대통령 부부가 국가 예산으로 고액의 캣타워를 구매한 뒤 횡령했다는 의혹에 대해 수사에 나섰다. 13일 경찰에 따르면 서울 서초경찰서는 전날 윤 전 대통령 내외를 형법상 횡령, 절도 혐의로 고발한 김상민 정의연대 사무총장을 불러 조사했다. 김 사무총장은 지난 4월 윤 전 대통령과 김건희 여사를 횡령, 절도 혐의로 경찰에 고발했다.",2025-06-13 18:48:51,http://www.segye.com/newsView/20250613514301,세계일보
"한국연구재단, 연구자 개인정보 12만건 유출…개인정보위 조사 착수",https://img.segye.com/content/image/2025/06/13/300/20250613511624.jpg,"최근 분야를 가리지 않고 해킹으로 인한 대규모 개인정보 유출 사건이 잇따르는 가운데, 한국연구재단 시스템에서도 연구자 개인정보 12만여건이 유출됐다. 개인정보보호위원회는 13일 한국연구재단에 대한 조사에 착수했다고 밝혔다. 재단은 ‘온라인 논문 투고·심사 시스템(JAMS·Journal Article Management System)’에서 서버 취약점",2025-06-13 18:29:35,http://www.segye.com/newsView/20250613511572,세계일보
“돈 빌려줘” 초등생 팔 라이터로 지져… 경찰 “중학생 추정”,https://img.segye.com/content/image/2025/06/13/300/20250613513883.jpg,부산에서 중학생으로 추정되는 10대들이 돈을 빼앗기 위해 초등학생의 팔을 라이터로 지지는 등 화상을 입혔다는 신고가 접수돼 경찰이 수사에 나섰다. 13일 부산 해운대경찰서에 따르면 지난 7일 오전 11시10분쯤 부산 해운대구 우동 한 상가 건물 앞에서 중학생으로 보이는 10대 남자 2명과 여자 1명이 초등학생 A군과 동급생 B군에게 “아이스크림을 사 먹,2025-06-13 17:53:49,http://www.segye.com/newsView/20250613513731,세계일보
“예산은 백종원을 믿습니다”…고향 주민들의 응원 현수막 등장,https://img.segye.com/content/image/2025/06/13/300/20250613513763.jpg,"원산지 허위 표시 의혹 등 논란이 이어지는 가운데, 백종원 더본코리아 대표를 향한 고향 주민들의 응원 메시지가 눈길을 끌고 있다. 13일 예산군에 따르면, 예산읍 이장협의회는 최근 읍내 주요 도로변에 백 대표를 지지하는 현수막을 내걸었다. 현수막에는 “백종원 대표님이 조용히 흘린 땀과 눈물, 예산은 늘 기억하고 응원합니다”, “예산을 사랑하는 백종원 대",2025-06-13 17:43:26,http://www.segye.com/newsView/20250613513760,세계일보
‘공사현장서 노동자 열사병 사망’ 중대재해처벌 첫 판결…원청 대표 실형 선고,,열사병으로 숨진 노동자의 안전 보호 의무를 소홀히 한 혐의로 기소된 원청 기업 대표가 실형을 선고받았다. 대전지법 형사12단독 이재민 부장판사는 13일 중대재해처벌법 위반 혐의로 기소된 원청업체 대표이사 A씨에게 징역 1년에 집행유예 2년을 선고했다. 산업안전보건법 위반 등 혐의로 기소된 원청업체 현장소장 B씨에게는 징역 8개월에 집행유예 2년,2025-06-13 17:40:50,http://www.segye.com/newsView/20250613513686,세계일보
"경주 공장서 60대 근로자 5ｍ 아래 추락, 심정지로 병원 이송",,13일 오후 1시 14분쯤 경북 경주시 내남면 명계리 한 공장에서 A(60대)씨가 설비 작업 중 구조물과 함께 약 5ｍ 아래로 추락했다. 경북소방본부 등에 따르면 이 사고로 A씨는 심정지 상태에서 병원으로 옮겨졌다. 경찰과 소방 당국은 자세한 사고 원인을 조사하고 있다.,2025-06-13 16:55:50,http://www.segye.com/newsView/20250613513035,세계일보
제주 중심 많은 비…오후엔 대부분 그쳐 [오늘날씨],https://img.segye.com/content/image/2025/06/14/300/20250614501895.jpg,"14일인 토요일은 전국에 비가 내리는 가운데 낮 기온이 30도 내외로 올라 덥겠다. 기상청은 이날 전국에 내리는 비는 오후에 대부분 그치겠지만, 제주도는 밤까지 이어지겠다고 예보했다. 수도권에는 최대 40㎜의 강수량이 예상되고 전남남해안, 부산·경남남해안과 제주도 등 일부 지역에는 100㎜가 넘는 많은 비가 내리겠다. 이 지역에는 돌풍과 함께 천",2025-06-14 06:07:16,http://www.segye.com/newsView/20250614501894,세계일보
버핏의 투자 철학·전략… 행동경제학으로 분석,https://img.segye.com/content/image/2025/06/12/300/20250612518573.jpg,워런 버핏 웨이/ 로버트 해그스트롬/ 신용우 옮김/ 상상스퀘어/ 3만3000원 올해 말 경영 일선에서 물러나겠다고 선언한 ‘오마하의 현인’ 워런 버핏 미국 버크셔해서웨이 회장 겸 최고경영자(CEO). 그는 주식을 주가 그래프나 거래 대상만이 아니라 실제 가치를 가진 사업의 일부분으로 바라보는 관점으로 큰 부를 축적했다. 그의 지론은 지금도 많은 투자자들,2025-06-14 06:00:00,http://www.segye.com/newsView/20250612514107,세계일보
[새로 나온 책] AI 코리아 외,https://img.segye.com/content/image/2025/06/12/300/20250612518852.jpg,"AI 코리아(구윤철, 바다위의 정원, 2만원)=문재인정부에서 국무조정실장을 지닌 저자가 제안하는 ‘AI 경제 혁신’을 담은 책이다. 책에 따르면 지금은 국가, 기업, 국민 모두 AI 관련 사업에 총력을 기울여야 할 때다. 이를 위해서는 해야 할 일이 있다. AI 관련 기술 개발과 AI 인력 양성에 집중해야 한다. 더불어 AI+X(기업, 생활, 사물, 행정",2025-06-14 06:00:00,http://www.segye.com/newsView/20250612514022,세계일보
한 편의 다큐로 끝날 수 없는 [詩의 뜨락],,지구 저편에 군화와 총대와 시신이 나뒹구는 세계가 지금도 있다 벗겨진 군화의 밑창에는 거친 평온이라도 있을까 쓰러져 누운 자 쓰러뜨려 눕힌 자 그들의 찢어진 삶이 햇볕에 반사된다 나는 그들을 내려다보는 자 생명 있는 자가 생명 없는 자에게 생명 없는 자가 생명 있는 자에게 무슨 말을 할 수 있을까 울음과 울음 사이에 말 없는 눈물이 있을,2025-06-14 06:00:00,http://www.segye.com/newsView/20250612514088,세계일보
인간을 초월하는 인공지능… AI가 바꿀 문명 대전환 엿본다,https://img.segye.com/content/image/2025/06/12/300/20250612518784.jpg,"마침내 특이점이 시작된다/ 레이 커즈와일/ 이충호 옮김/ 비즈니스북스/ 3만원 지금으로부터 20년 전 미국의 미래학자 레이 커즈와일이 내놓은 ‘특이점이 온다’는 책은 출간 즉시 아마존 베스트셀러에 오르며 화제가 됐다. 그는 인공지능(AI)이 급속히 발전하면서 인간 전체의 지능을 뛰어넘는 시점이 올 것이고, 이를 특이점(Singularity)이라고 불렀다",2025-06-14 06:00:00,http://www.segye.com/newsView/20250612514015,세계일보
인권 사각을 향한 공익변호사들의 외침,https://img.segye.com/content/image/2025/06/12/300/20250612518790.jpg,"그래도 되는 차별은 없다/ 공익인권법재단 공감/ 창비/ 1만8000원 ‘차별에 동의한다’고 말하는 사람은 없다. ‘인권 수호에 반대한다’고 말하는 사람 역시 없다. 그러나 실제 사례를 보면 이야기는 달라진다. 화성외국인보호소에서 한 난민 신청자가 손발이 몸 뒤로 결박되는 ‘새우 꺾기’ 고문을 당하는 사건이 발생하자, 이를 보도한 언론 기사에는 ‘얼마나",2025-06-14 06:00:00,http://www.segye.com/newsView/20250612514017,세계일보
‘창의성’은 본질적 덕목이며… 시대 초월한 핵심 가치일까?,https://img.segye.com/content/image/2025/06/12/300/20250612518742.jpg,"창의성에 집착하는 시대/ 새뮤얼 W 프랭클린/ 고현석 옮김/ 해나무/ 2만2000원 ‘창의성(creativity)’. 현대사회에 요구되는 핵심 능력 가운데 하나다. 모두가 ‘창의적’이 되고 싶어한다. 기업은 창의적인 인재를 원하고, 학교는 창의적 교육을 강조하며, 정부는 창의경제를 내세운다. 창의성은 예술 분야는 물론 기업 경영, 교육, 광고, 도시 정",2025-06-14 06:00:00,http://www.segye.com/newsView/20250612514033,세계일보
