title,thumbnail,short_content,write_time,link,company
PK ‘극장골’…U-17 아시안컵 4강행,https://img.segye.com/content/image/2025/04/15/300/20250415518669.jpg,한국 17세 이하(U-17) 축구대표팀이 승부차기 끝에 타지키스탄을 물리치고 2025 아시아축구연맹 U-17 아시안컵 4강에 진출했다. 북한도 4강에 오르면서 남북한이 한 경기씩 더 이기면 우승컵을 놓고 다투게 된다. 백기태(사진) 감독이 이끄는 대표팀은 15일 사우디아라비아 제다의 프린스 압둘라 알 파이살 스타디움에서 열린 타지키스탄과 8강에서 2-,2025-04-15 21:50:50,http://www.segye.com/newsView/20250415515742,세계일보
中 가짜 ‘서울신문’ 사이트 또 적발…‘시진핑 정권’ 홍보용?,https://img.segye.com/content/image/2025/04/17/300/20250417517302.jpg,"중국 언론홍보업체가 국내 언론사로 위장한 온라인 사이트를 운영하고 있는 것으로 나타났다. 앞서 2023년에도 중국 홍보업체들이 국내 언론사로 위장한 사이트들을 통해 중국에 우호적인 가짜 뉴스를 퍼트린 것이 확인된 바 있다. 17일 국가정보원(국정원)은 중국의 언론홍보업체 ‘취안메이셔(Quanmeishe)’가 국내 7개 언론사 이름을 도용한 사이트를 운영하고 있다고 밝혔다. 이들 사이트는 중국·미국·싱가포르에 도메인을 두고 있었다. 도용된 언론사 명칭과 사이트 주소는 서울신문(news.fiinformation.com)·제주일보(market.ecomweeks.com)·대구뉴스(daegunews.net)·매일신문(kr.yuemengmuye.com)·서울 데일리 뉴스(seouldailynews.net)·블루뉴스(kr.nodiwa.com)·인터랙티브 뉴스(kr.yujiacomm.com)다. 국정원은 아직까지 해당 사이트에서 국내 언론사 기사의 무단 도용이나 가짜 뉴스를 퍼뜨리는 모습은 확인되지 않았다고 밝혔다. 그러나 해당 사이트가 국내 언론사의 신뢰도를 악용해 이 같은 행위를 할 가능성이 있다고 보고 모니터링에 나서고 있다. 앞서 2023년 국정원은 중국 언론홍보업체 ‘하이마이(Haimai)’와 ‘하이쉰(Haixun)’이 서울프레스 등 국내 언론사로 위장한 200여개 사이트를 운영한 사실을 공개했다. 이들 사이트는 국내 언론사 기사를 무단으로 도용하고, 중국 정부의 코로나19 대응 성과를 홍보하는 등 중국에게 유리한 콘텐츠를 유포했다.",2025-04-17 17:47:29,https://www.segye.com/newsView/20250417517243,세계일보
"젤렌스키, 계엄령 90일 연장…野 ""권위주의 정권 수립 노리나""",https://img.segye.com/content/image/2025/04/17/300/20250417512795.jpg,"러시아와 전쟁 중인 우크라이나에서 계엄령이 오는 8월 초까지로 90일 연장됐다. 미국의 종전 요구에도 불구하고 러시아가 공세의 고삐를 늦추지 않자 교전 장기화를 염두에 두고 선제적 조치를 취한 것으로 풀이된다. 계엄령 하에서는 선거가 불가능한 만큼 이미 임기가 끝난 볼로디미르 젤렌스키 대통령의 후임자를 뽑기 위한 대선도 이르면 9∼10월에나 가능할 전망이다. 16일(현지시간) dpa 통신에 따르면 우크라이나 의회는 젤렌스키가 제출한 계엄령 및 동원령 연장안을 의원 3분의 2 이상의 동의로 통과시켰다. 이에 따라 오는 5월9일 종료할 예정이었던 계엄령과 동원령은 8월6일까지 90일간 더 연장된다. 우크라이나는 러시아군이 전면 침공을 단행한 2022년 2월24일 계엄령이 선포된 이래 계속 유지되고 있다. 함께 선포된 동원령은 군대에서 싸울 병사 징집을 위한 것으로, 이에 따라 우크라이나는 징병 대상인 18∼60세 남성의 출국을 금지하고 있다. 1978년 1월생으로 현재 47세인 젤렌스키는 2019년 5년 임기의 우크라이나 대통령에 당선됐다. 그해 5월20일 취임한 젤렌스키는 2024년 5월19일 임기가 끝났다. 하지만 러시아와의 전쟁으로 인해 계엄령이 선포돼 있고 계엄령 하에서는 선거 실시가 불가능하기 때문에 임기 만료 이후로도 1년 가까이 대통령 직무를 수행하고 있다. 이에 블라디미르 푸틴 러시아 대통령은 현 우크라이나 정부를 ‘불법’으로 규정하며 대통령 자격이 없는 젤렌스키와는 협상 테이블에 마주 앉을 수 없다는 입장을 내비쳤다. 도널트 트럼프 미국 대통령 역시 젤렌스키를 겨냥해 “선거를 치르지 않은 독재자”라고 부르며 맹비난했다. 트럼프는 특히 젤렌스키가 러시아에 양보하는 내용의 종전 협정에 거부감을 드러내자 “그(젤렌스키)는 선거를 거부하고 우크라이나 여론조사에서 매우 낮은 지지율을 보이고 있다”며 “(협상을) 서두르지 않으면 나라를 잃게 될 것”이라고 경고하기도 했다. 젤렌스키도 이 같은 상황을 무척 난처하게 여긴 모양이다. 미국의 적극적인 중재로 러시아·우크라이나 간 종전 협상에 속도가 붙는 듯하자 젤렌스키는 전면적 휴전이 이뤄진다는 전제 아래 계엄령을 해제하고 대선을 실시하는 방안을 진지하게 검토했다. 영국 언론은 지난 3월 “젤렌스키가 정부에 대선 준비를 지시했으며 이르면 7월쯤 선거 실시가 가능할 것”이라고 보도했다. 하지만 종전 협상에 진전이 없고 러시아의 미사일 공격은 계속되자 결국 계엄령 연장을 결심한 것으로 보인다. 우크라이나 야당인 ‘유럽연대’ 지도자이자 젤렌스키의 정적으로 꼽히는 페트로 포로셴코 전 대통령(2014∼2019년 재임)은 계엄령 연장 소식에 발끈했다. 포로셴코는 “현재 시행 중인 계엄령이 만료되기까지 아직 1개월 가까이 남았는데도 정부가 서둘러 계엄 연장안의 의회 통과를 밀어붙였다”고 지적했다. 그러면서 “계엄령이 러시아로부터 국가를 방어할 목적뿐만이 아니라 (젤렌스키에 의한) 권위주의 정권 수립에도 쓰이고 있다”고 주장했다. 2019년 대선 당시 젤렌스키에 지면서 연임에 실패한 포로셴코는 퇴임 후 부정부패 혐의로 수사를 받다가 이웃나라 폴란드로 망명하는 등 젤렌스키와는 악연이다. 하지만 2022년 러시아의 우크라이나 침략 후 스스로 귀국해 야당 지도자로서 젤렌스키의 전쟁 수행을 도왔다.",2025-04-17 15:12:37,https://www.segye.com/newsView/20250417512701,세계일보
"中, ‘美 245% 관세’에 “의미 없다. 끝까지 싸울 것”",https://img.segye.com/content/image/2025/04/17/300/20250417511456.jpg,"미국 백악관이 무역전쟁 국면에서 홈페이지를 통해 중국에 245%의 관세율을 적용했다고 밝힌 데 대해 중국 상무부가 의미 없는 발언으로 대응하지 않을 것임을 밝혔다. 16일 중국 상무부는 웹사이트에 올린 성명에서 “우리는 미국으로 수출하는 일부 상품에 부과된 다양한 명목의 관세가 누적돼 245%에 달했다는 점을 주목했다”며 “이는 미국이 관세를 도구화, 무기화하는 것이 이성을 상실한 수준에 이르렀음을 보여준다”고 밝혔다. 중국 상무부는 또 “중국은 이미 미국이 일방적으로 관세를 인상한 데 대해 여러 차례 입장을 밝혔다”며 “미국 측의 이런 의미 없는 관세 숫자놀음에 대해 중국 측은 대응하지 않을 것임을 밝혔다”고 강조했다. 이어 “그러나 미국 측이 계속해서 실질적으로 중국의 권익을 침해한다면 중국은 단호히 반격할 것이며 끝까지 맞서 싸울 것”이라고 역설했다. 백악관은 15일(현지 시간) 홈페이지 게재 팩트시트를 통해 “보복 조치의 결과로 중국은 현재 미국에 수입되는 물품에 245%의 관세를 적용받는다”고 발표했다. 미국은 현재 중국산 수입품에 125%의 상호관세와 펜타닐 유입의 책임을 물은 20%의 징벌적 관세 총 145%의 관세를 부과하고 있다. 백악관의 발표대로면 관세율이 100%포인트 더 오른 것이다. 백악관은 대중국 관세율 245% 산정의 구체적 근거는 밝히지 않았다. 다만 뉴욕타임스(NYT)는 최근 트럼프표 관세 분석 기사에서 지난해 9월 바이든 행정부가 부과한 주사기와 바늘 관세(100%)가 포함됐을 가능성을 거론했다. 중국 외교부도 17일 이번 백악관의 발표를 무시하겠다는 입장을 분명히 했다. 외교부는 이날 기자 질문에 대한 답변 형식의 대변인 입장문을 통해 “245%라는 숫자가 어떻게 나왔는지는 (중국이 아니라)미국에 물어야 한다”며 “중국은 이전에 미국의 연이은 과도한 대(對)중국 관세 부과가 이미 숫자놀음으로 전락했고 경제적으로는 더 이상 실질적인 의미가 없다고 강조한 바 있다”고 밝혔다. 이어 “이는 미국이 관세를 도구화·무기화해 괴롭힘과 협박을 일삼는 수법을 더욱 드러낼 뿐”이라며 “만약 미국이 관세 숫자놀음을 계속한다면 중국은 이를 무시할 것”이라고 강조했다. 아울러 “관세전쟁·무역전쟁에는 승자가 없고 중국은 싸움을 원치 않지만 싸움을 두려워하지도 않는다”며 “미국이 계속해서 중국의 실질적 권익을 침해하려 한다면 단호히 반격하고 끝까지 상대할 것”이라고 덧붙였다. 앞서 린젠 중국 외교부 대변인은 전날 정례브리핑에서 “중국은 관세 문제에 대한 엄정한 입장을 이미 수차례 명확히 했고 이번 관세전쟁은 미국이 시작한 것”이라며 반발한 바 있다.",2025-04-17 14:22:22,https://www.segye.com/newsView/20250417511476,세계일보
"'화장지 사직서', 직장인들 공감 불렀다",https://img.segye.com/content/image/2025/04/17/300/20250417510593.jpg,"퇴사 사유가 담긴 한 장의 '화장지 사직서' 사진이 온라인상에서 큰 화제를 모으고 있다. 15일(현지 시간) 타임스오브인디아, NDTV 등 현지 매체에 따르면 싱가포르의 한 헤드헌팅 업체 이사 안젤라 여는 링크드인 계정을 통해 '해로운 직장 문화에 대한 문제'를 언급했다. 안젤라는 한 장의 사진을 첨부하며 자신이 만난 한 구직자의 퇴사 사유를 소개했다. 안젤라는 ""그(구직자)는 '나는 마치 화장지 같았다. 필요할 때만 쓰이고, 아무 생각 없이 버려지는 기분이었다'고 말했다. 그 말이 머릿속에 깊게 남았다""고 적었다. 사진 속 화장지에는 ""회사가 나를 어떻게 대했는지를 보여주기 위해 사직서를 화장지에 썼다. 회사를 그만둔다""는 문구가 적혀 있다. 다만 이 사진이 실제 사직서인지 상징적인 연출인지 여부는 알려지지 않았다. 안젤라는 이 게시글을 통해 회사 경영진에게 ""직원들이 회사를 떠나더라도 원망이 아닌 감사의 마음으로 떠날 수 있도록, 그들이 진심으로 인정받고 있다고 느끼게 해줘야 한다""고 강조했다. 이어 ""직원의 퇴사는 불성실함 때문이 아니라, 직장 환경이 얼마나 개선이 필요한지를 보여주는 신호일 수 있다""고 덧붙였다. 아울러 ""인정은 단순히 직원을 붙잡기 위한 수단이 아니라, 그 사람의 가치를 보여주는 방식""이라며 ""직원들이 저평가됐다고 느낄 때, 조직은 스스로를 돌아봐야 한다""고 경고했다. ""표현 하나만 달라져도 결과는 전혀 달라질 수 있다""는 말도 덧붙였다. 해당 게시물은 사회관계망서비스(SNS)를 통해 빠르게 확산됐고 많은 누리꾼들은 공감하며 다양한 의견을 표현했다. 게시물을 접한 한 누리꾼은 ""직원은 자원이 아니라 사람이다. 진심 어린 존중을 받을 때 더 큰 책임감과 열정을 보여줄 수 있다""고 적었다. 또 다른 이는 ""회사에 위기가 닥쳤을 때도 사람을 진심으로 아껴주는 상사가 있었기에 함께 버텼다. 결국 사람과 사람의 관계가 회사를 움직인다""고 자신의 경험을 공유하기도 했다. 일각에서는 ""조직에서 소외감을 느꼈다면, 그 감정을 들여다보는 자기 성찰도 필요하다"" ""무조건 조직만 탓할 일은 아니다"" ""사직서조차 감정의 표현 수단이 된 시대""라고 비판했다.",2025-04-17 13:51:33,https://www.segye.com/newsView/20250417500579,세계일보
미국 영주권 70억원에 파는 ‘골드카드’ 제도 시행 임박?,https://img.segye.com/content/image/2025/04/17/300/20250417507668.jpg,"미국 영주권을 70억원에 판매하는 ‘골드카드’ 정책 실행이 임박한 것으로 보인다. 16일(현지시간) 미국 뉴욕타임스(NYT)는 정부효율부(DOGE)가 ‘골드카드’의 전산 시스템을 구축 중이라고 소식통을 보도했다. DOGE 팀원과 엔지니어들이 미 국무부와 국토안보부, 시민권·이민국 직원들과 함께 발급에 필요한 웹사이트와 비자 신청 절차 등을 개발 중이다. NYT는 골드카드 전산 시스템 개발자들이 기존의 비자 심사 인터뷰와 신상 조사 등을 포함한 복잡한 영주권 취득 절차를 간소화해 신청 후 2주 이내에 영주권을 받을 수 있도록 만들기 위해 노력하고 있다고 전했다. 앞서 도널드 트럼프 대통령은 지난 2월 기존의 투자이민(EB-5) 제도를 없애고 500만달러(약 70억원)에 영주권을 주는 골드카드 정책을 시행하겠다고 처음 밝힌 바 있다. 지난 3일에는 플로리다주로 이동하는 전용기 안에서 기자들에게 실물로 제작된 골드카드를 보여주며 “2주 이내에 출시될 것”이라고 말하기도 했다. 트럼프 대통령의 공언에 이어 실무를 위한 전산 시스템 구축까지 진행된 만큼 제도가 곧 실행될 것으로 전망된다. 이 프로젝트는 머스크와 DOGE의 임무가 초기 과제였던 연방 정부 비용 절감에서 수익 창출이라는 새로운 목표로 전환 중임을 보여준다고 NYT는 풀이했다. 다만, 제도 시행이 예고됐음에도 아직 수익이 창출을 미미한 것으로 추정된다. 하워드 러트닉 상무부 장관이 지난달 20일 한 팟캐스트에 출연해 골드카드에 관해 설명하며 “어제 1000개를 팔았다”고 말했지만 NYT는 이 프로젝트 관계자의 말을 인용해 골드카드 판매 대금으로 거래된 돈은 아직 없다고 전했다.",2025-04-17 11:11:27,https://www.segye.com/newsView/20250417507605,세계일보
"'희토류 부국' 카자흐, 걸프국들에 희토류 공동개발 제안",https://img.segye.com/content/image/2025/04/17/300/20250417506940.jpg,"미국과 무역전쟁을 치르는 중국이 희토류 수출을 제한한 가운데 중앙아시아 카자흐스탄이 걸프 국가들에 자국 내 희토류 공동 개발을 제안하고 나섰다. 17일 타스통신에 따르면 무라트 누르틀레우 카자흐스탄 부총리 겸 외무장관은 전날 수도 아스타나에서 제3차 중앙아시아-걸프협력회의(GCC) 장관급 회담을 마친 뒤 내놓은 보도자료를 통해 이같이 밝혔다. 누르틀레우 장관은 ""카자흐스탄은 국내에 5천여개 희토류 매장지를 보유하고 있고, 이들 희토류의 추정 가치를 따지면 총 46조달러(약 6경5천400조원)를 웃돈다""면서 ""GCC 회원국들이 지질 탐사에서부터 가공 등 전체 가치사슬과 관련된 프로젝트에 참여할 것을 요청한다""고 말했다. 1981년 안보와 무역 등 부문 협력을 목표로 출범한 GCC 회원국은 바레인, 쿠웨이트, 오만, 카타르, 사우디아라비아, 아랍에미리트(UAE) 등 6개국이다. 누르틀레우 장관의 제안은 최근 카자흐스탄에서 최대 추정량 2천만t 이상의 희토류 매장지가 발견된 이후 이뤄진 것이다. 카자흐스탄 공업건설부는 지난 2일 성명에서 자국 지질학자들이 중동부 카라간다주(州)에서 2천만t 이상의 희토류가 묻혀있을 것으로 추정되는 매장지를 발견했다고 밝혔다. 아스타나에서 420km 떨어진 이 매장지에는 네오디뮴, 세륨, 란타넘, 이트륨 등이 매장된 것으로 추정된다. 이번에 발견된 매장지 희토류량이 확인되면 카자흐스탄은 매장량에서 중국과 브라질에 이어 3위를 차지하게 된다. 카자흐스탄 정부는 국내 희토류 개발에 매진하고 있다. 카심-조마르트 토카예프 대통령은 2023년 9월 대국민 연설에서 희토류 개발은 국가의 우선 과제가 돼야 한다면서 희토류를 ""새로운 원유(new oil)""이라고 표현했다고 현지 일간 아스타나타임스는 전했다. 카자흐스탄 측의 이번 희토류 공동개발 제안은 도널드 트럼프 대통령이 이끄는 미국과 중국간 무역전쟁이 격화하면서 중국이 미국 등 전세계를 상대로 희토류 수출을 제한한 이후 나온 것이기도 하다. 중국은 세계 정제(가공) 희토류의 약 90%를 생산하고 있다. 또 정제되지 않은 원자재 생산의 점유율은 약 60%에 달한다.",2025-04-17 11:01:23,https://www.segye.com/newsView/20250417506939,세계일보
"시진핑 '49% 美관세폭탄' 캄보디아 방문 앞서 ""패권주의 맞서자""",https://img.segye.com/content/image/2025/04/17/300/20250417507141.jpg,"동남아 3국을 순방 중인 시진핑 중국 국가주석이 마지막 행선지인 캄보디아 방문을 앞두고 현지 매체 기고문을 통해 보호무역주의·패권주의에 함께 맞설 것을 촉구했다. 시 주석은 17일(현지시간) 크메르타임스 등 캄보디아 매체 기고문에서 ""우리는 함께 패권주의, 힘의 정치, 진영 간 대립에 맞서고, 양국과 여타 개발도상국의 공동 이익을 수호해야 한다""고 밝혔다. 또 도널드 트럼프 미국 대통령의 '관세 폭탄' 등 무역 전쟁을 겨냥해 ""보호무역주의에 공동으로 반대하고 개방과 협력의 국제 환경을 지켜야 한다""고 강조했다. 아울러 평등하고 질서 있는 다극화된 세계, 보편적으로 유익하고 포용적인 경제 세계화를 옹호할 것을 주창했다. 시 주석은 ""수년 동안 중국은 캄보디아의 가장 큰 무역 파트너이자 가장 큰 투자 원천이었다""고 언급했다. 이어 ""캄보디아 최초의 고속도로, 강 계곡을 가로지르는 최초의 고가 다리, 최대 규모의 발전소, 최대 규모의 경기장 같은 중국 지원 인프라 프로젝트는 캄보디아 국민에게 실질적 혜택을 가져다줬고 이 나라의 장기 발전을 크게 강화했다""고 말했다. 그는 ""주변국과 우호·협력을 심화하고, 중국 현대화의 혜택을 주변국에 확대하며, 지역 평화와 안정을 수호하고 아시아의 현대화를 함께 발전시키기 위해 노력할 것""이라고 밝혔다. 또 '외부 세력'의 내정 간섭, 불화 조장, 양국 간 우호 훼손 시도에 ""단호히 반대해야 한다""면서 양국 합동 훈련, 일대일로(중국-중앙아시아-유럽을 연결하는 육상·해상 실크로드) 주요 사업에 대한 비상 관리·보안 협력, 통신·사이버 사기와 기타 범죄 행위 단속 등을 강화할 것을 촉구했다. 시 주석은 이번 방문에 대해 ""마치 좋은 친구의 집에 온 것 같은 기분""이라면서 방문을 계기로 ""중국·캄보디아 운명공동체 구축이 진전되기를 진심으로 바란다""고 덧붙였다. 시 주석은 이날 2박 3일간의 말레이시아 방문을 마무리하고 캄보디아로 이동, 1박 2일간 국빈 방문을 진행한다. 방문 기간 훈 마네트 총리 등과 만나 양국 협력 강화 방안을 논의할 예정이다. 캄보디아는 동남아의 대표적인 친중 국가로 중국으로부터 일대일로 인프라 투자 등 각종 투자를 끌어들이고 있다. 하지만 트럼프 행정부로부터 베트남 등과 함께 중국산 상품의 대미 우회 수출 경로라는 '낙인'이 찍혀 최고 수준인 49%의 상호 관세 부과가 예고된 상태다.",2025-04-17 10:56:56,https://www.segye.com/newsView/20250417507140,세계일보
"日정부 관계자 ""트럼프, 日방위 부담 확대 관련 언급""",https://img.segye.com/content/image/2025/04/17/300/20250417506805.jpg,"日정부 관계자 ""트럼프, 日방위 부담 확대 관련 언급""",2025-04-17 10:44:08,https://www.segye.com/newsView/20250417506593,세계일보
"美 국세청, ‘트럼프 정책 저항’ 하버드대 면세지위 박탈 추진",https://img.segye.com/content/image/2025/04/17/300/20250417505837.jpg,"미국 국세청(IRS)이 도널드 트럼프 행정부의 교내 정책 변경 요구에 반기를 든 미국 하버드대의 ‘세금 면제 지위’ 박탈을 추진하고 있다고 미 CNN방송이 16일(현지시간) 보도했다. CNN은 사안에 정통한 소식통들을 인용해 하버드대 면세 지위 박탈에 대한 최종 결정이 곧 내려질 것이라고 전했다. 트럼프 대통령은 전날 자신의 소셜미디어(SNS) 트루스소셜에서 “면세지위는 전적으로 공공의 이익에 따른 행동에 달렸다는 점을 기억하라”라고 하버드대를 저격했다. 이어 그는 “만약 하버드가 계속해서 정치적이고 이념적이며 테러리스트의 영감을 받거나 (테러리스트가) 지지하는 ‘질병’을 계속해서 추진한다면 아마 하버드는 면세 지위를 잃고 정치 단체로 세금이 매겨져야 할 것”이라고 강조했다. 미 국세청은 연방법에 따라 세금 면제를 취소할 권한을 가지고 있다. 하버드대와 같은 교육, 종교, 자선 목적의 비영리 기관은 다양한 부분에서 면세 혜택을 받고 있다. 하지만 정치 활동을 하는 등 규정을 위반하면 면세 지위를 잃을 수 있다. 다만 미 국세청이 면세를 철회하는 일은 흔치 않다고 CNN은 분석했다. 윌리엄 스나이더 조지메이슨대 교수는 “내가 알기로 행정부가 이런 일을 시도한것은 처음”이라며 “고등교육의 궁극적인 목적은 대중을 교육하는 것인데 당신이 좋아하지 않는 방식으로 교육한다고 해서 면세 지위를 박탈할 수가 있느냐”고 지적했다. 면세 지위를 잃은 대학은 재정적으로 큰 타격을 받을 것으로 예상된다. 또한 미 국세청이 다른 대학에 대해서도 이런 조치를 검토하고 있는지는 확실하지 않다고 CNN은 전했다. 앞서 지난 14일 하버드대는 미국 대학 중에서는 처음으로 캠퍼스 내 반(反)이스라엘주의 근절, 다양성 프로그램 해제 등을 명분으로 한 트럼프 행정부의 교내 정책 변경 요구를 거부했다. 트럼프 행정부는 하버드대가 연방 보조금을 받으려면 입학·채용에서 다양성 우대 조치를 중단하고, 반이스라엘 성향 학생의 입학을 막기 위한 유학생 제도를 개편하는 등의 조치를 실행해야 한다고 요구했다.",2025-04-17 10:12:07,https://www.segye.com/newsView/20250417505447,세계일보
