title,thumbnail,short_content,write_time,link,company
골·골·골·골…16년 만의 '월드컵 예선 무패' 자축포,https://img.segye.com/content/image/2025/06/10/300/20250610520011.jpg,"2026 국제축구연맹(FIFA) 북중미 월드컵 진출을 확정한 한국 축구대표팀이 아시아 지역 예선을 무패로 통과했다. 대표팀은 한수 아래인 쿠웨이트와 최종전에서 압도적인 경기를 펼쳤고, 전진우(전북)와 이강인(파리 생제르맹), 오현규(헹크), 이재성(마인츠)가 축포를 쏘며 11회 연속 월드컵 진출을 자축했다. 홍명보 감독이 이끄는 한국은 10일 서울월드컵경기",2025-06-10 22:58:26,http://www.segye.com/newsView/20250610519845,세계일보
"韓, 쿠웨이트 4-0 완파…16년 만에 월드컵 예선 무패",https://img.segye.com/content/image/2025/06/10/300/20250610519485.jpg,북중미행을 확정한 한국 축구가 안방에서 쿠웨이트를 대파하고 11회 연속 월드컵 본선 진출을 자축했다. 홍명보 감독이 지휘하는 한국 축구대표팀은 10일 서울월드컵경기장에서 열린 쿠웨이트와의 2026 북중미월드컵 아시아 3차 예선 B조 최종 10차전 홈 경기에서 4-0 완승을 거뒀다. 지난 6일 이라크 원정으로 치른 9차전 원정 경기에서 2-0 승리하며 북,2025-06-10 22:22:20,http://www.segye.com/newsView/20250610519484,세계일보
IAEA “나탄즈 외부방사능 변함없어”…유엔 안보리 긴급회의,https://img.segye.com/content/image/2025/06/14/300/20250614500690.jpg,"유엔 안전보장이사회(안보리)는 13일(현지시간) 긴급회의를 열고 이스라엘의 이란 공습에 따른 중동 지역 긴장 고조 문제를 다룬다. 로이터 등 외신에 따르면 안보리는 이란의 긴급 소집 요청에 따라 이날 오후 3시 미국 뉴욕 유엔본부에서 이스라엘의 이란 공습 문제를 다루는 공식 회의를 연다. 이란의 아바스 아라그치 외무장관은 안보리에 보낸 회의 소집요청 서한에서 “이스라엘이 이제 모든 선을 넘었으며 국제사회는 이런 범죄행위가 처벌받지 않고 넘어가는 것을 허용해서는 안 된다”고 밝혔다. 베냐민 네타냐후 이스라엘 총리는 이란이 우라늄 농축을 넘어 핵무기화 단계로 나아갈 징후가 보였다고 주장하며 이란 공습을 정당화했다. 네타냐후 총리는 이란 핵시설 제거 명령이 지난해 11월에 내려졌다고 밝혔다고 타임스오브이스라엘이 전했다. 네타냐후 총리는 “이 지시는 (헤즈볼라 수장) 나스랄라의 암살 직후 내려졌다”며 나스랄라 축출로 대리세력 축이 와해하면 이란이 핵무기 개발을 서두를 것이 분명했다고 설명했다. 애초 올해 4월 말 공습하려 했으나 다양한 이유로 연기됐다면서도 어떤 이유였는지, 왜 이날을 공습일로 정했는지는 설명하지 않았다. 네타냐후 총리는 이란 공습 전 미국에 통보했다고도 밝혔다. 그는 “사전에 그들(미국)에게 통보했다. 그들은 공격 계획을 알고 있었다”며 “미국의 입장은 미국에 맡기겠다”고 말했다. 라파엘 그로시 국제원자력기구(IAEA) 사무총장은 이스라엘 공습을 받은 이란 중부 나탄즈 핵시설 외부의 방사능 수치 변화가 없다고 설명했다. 그로시 사무총장은 이날 엑스(X·옛 트위터)를 통해 “나탄즈 시설 외부의 방사능 수치는 변하지 않았다”며 “시설 내부에서 발견된 방사능 오염은 주로 알파 입자이며 이는 적절한 보호 조치로 관리가 가능하다”고 전했다. 나탄즈 핵시설 외부의 방사능 수치가 안전한 수준으로 유지되고 있고 내부 오염도 관리 가능하다는 것이다. 나탄즈 핵시설을 상당 부분 파괴했다는 이스라엘군의 발표와는 배치된다. 이스라엘군은 두 차례에 걸쳐 이란의 핵시설과 군사 시설을 대대적으로 공습했다. 핵심 표적은 이란 수도 테헤란에서 남쪽으로 약 250㎞ 떨어진 나탄즈의 우라늄 농축 시설이었다. 추가 공습 뒤 이스라엘군 에피 데프린 대변인은 나탄즈 핵시설이 “상당히 파괴됐다”고 발표했다. 그러나 이란원자력청은 ‘피상적 손해’가 있었다고 반박했다.",2025-06-14 02:25:41,https://www.segye.com/newsView/20250614500486,세계일보
이스라엘·이란까지…전쟁 3개 동시에 벌어지나,https://img.segye.com/content/image/2025/06/14/300/20250614500675.jpg,"이스라엘이 ‘레드라인’을 넘어 이란을 폭격하면서 양국 간 전면전 가능성이 커졌다. 이스라엘은 13일(현지시간) 새벽 이란에 있는 표적 100여곳을 타격했다. 이스라엘군은 전투기 200여대를 동원해 이란 중부 나탄즈 핵시설과 군 고위직 은신처·주거지, 탄도미사일 생산기지 등에 폭탄 330발 이상을 퍼부었다. 이란 내 핵 시설을 공습하면서 핵 프로그램을 주도하는 과학자들도 최소 6명 숨진 것으로 파악됐다. 이란은 핵시설에 대한 공격을 레드라인(위반 시 반드시 대가를 묻겠다는 기준)으로 삼은 만큼 이스라엘이 전면전을 염두에 두고 선제공격을 감행한 것이란 분석이 제기된다. 이스라엘이 이번 공격을 미국에 사전 통보한 것으로 알려지면서 미국이 사실상 이스라엘의 공격을 ‘묵인’했다는 보도가 이어지고 있다. 그간 미국 정부는 전면전을 우려해 네타냐후 정권의 이란 내 핵시설 공격안을 줄곧 만류해왔다. ◆약해진 이란, 미국은 모른 척 이스라엘의 이번 공습에는 내외부 문제가 중첩된 데 따른 것으로 보인다. 이스라엘이 공격 명분으로 내세운 건 이란의 핵무기 획득 의혹이었다. 이스라엘군은 공습 직후 성명에서 “지난 몇 달간 이란 정권이 ‘돌이킬 수 없는 지점’에 다다르고 있는 증거가 확보됐다”며 이란이 핵무기 개발의 모든 단계에 걸쳐 기술을 발전시키기 위한 비밀 계획을 추진해왔다고 주장했다. 2018년 트럼프 행정부의 이란 핵합의(JCPOA·포괄적 공동행동계획) 파기 이후 이란은 우라늄 농축을 가속해 농축도 60%를 달성했다. 트럼프 행정부 2기는 올해 4월부터 이란과 핵 협상을 시작했지만 이란의 우라늄 농축 프로그램을 핵무기 획득 의도로 봤고 협상은 교착됐다. 국제원자력기구(IAEA) 이사회는 전날 이란이 핵사찰·검증 의무를 준수하지 않고 있다고 20년 만에 결의하기도 했다. 이런 가운데 도널드 트럼프 미국 대통령은 이란과 핵 협상에서 이스라엘의 침공 가능성을 공연히 거론했다. 이스라엘의 폭격을 말리지 않을 수 있다는 얘기를 던지며 협상에서 이란을 압박해온 것이다. 베냐민 네타냐후 이스라엘 총리는 이런 미국의 기류를 놓치지 않았다. 마침 이란의 대리군 역할을 하던 ‘저항의 축’도 약화한 시기였다. 이스라엘은 가자지구 전쟁을 계기로 하마스와 레바논 헤즈볼라를 차례로 와해했다. 이란의 맹방 시리아도 친서방 반군으로 정권이 교체됐다. 저항의 축을 차례로 무너뜨린 이스라엘이 이들의 ‘본진’인 이란을 노린 것이다. 사우디아라비아 등 수니 아랍권은 2020년 아브라함 협정으로 적대가 비교적 희석된 것으로 평가된다. 이스라엘이 중동에서 마지막 남은 적성국 이란과 힘의 경쟁에서 우위를 확인한다면 중동 ‘최강국’으로도 올라설 수 있다. 이스라엘은 가자전쟁을 넓혀 1948년 건국 이후 형성된 종교적 분쟁과 1967년 제3차 중동전쟁에서 빚어진 이슬람권과의 안보 불안, 1979년 이란 이슬람 혁명에서 시작된 이란과 대결 구도를 군사력 우위로 종식하려 한 것으로 보인다. 지난해 10월 이스라엘 공습으로 이란의 방어체계가 약해졌기 때문에 이번 기회를 흘려보내지 않은 것으로도 분석된다. ◆또다시 ‘내부용’ 전쟁하나 내부적으로는 네타냐후 총리가 외부의 적을 통해 정권 붕괴 위기 문제 등을 해결하려 했을 가능성도 제기된다. 네타냐후 내각은 2023년 10월 이스라엘이 팔레스타인 무장정파 하마스에 기습 공격을 당한 직후 이를 제대로 대비하지 못했다는 비판 여론으로 위기에 몰렸다. 이후 강도 높은 하마스 소탕전을 벌이고 레바논 무장정파 헤즈볼라, 예멘의 후티 반군 등 중동의 친이란 무장세력들과 다면전을 벌이는 것으로 정권을 지탱해왔다. 하지만 이스라엘군의 압도적인 화력으로 하마스와 헤즈볼라의 지도부가 궤멸하다시피 하면서 전쟁의 긴장도는 낮아졌고, 다시 이스라엘 야권에서는 네타냐후 정권을 실각시켜야 한다는 목소리가 커졌다. 12일 이스라엘 야권이 발의한 연립정부 해산안이 의회(크네세트)에서 간신히 부결된 건 네타냐후 내각에도 타격이 컸다. 집권 리쿠르당은 연정 파트너인 보수 종교주의 진영과 극적으로 타협안을 도출해 해산안을 막았지만 6개월 후 또다시 해산안이 발의될 가능성이 남아있다. 이스라엘과 미국 등 안팎의 이해관계가 맞아떨어지면서 이란에 대한 선제폭격이 가능했을 것이란 분석이다. ◆이란 “강도 높은 보복할 것” 공격을 당한 이란은 이스라엘에 대해 강력한 보복을 선언했다. 아야톨라 세예드 알리 하메네이 이란 최고지도자는 성명에서 “시온주의자 정권(이스라엘)은 더럽고 피비린내 나는 손을 뻗어 사랑하는 우리 조국의 주거지역을 공격했다”며 “가혹한 응징을 당해야 한다”고 반격을 예고했다. 양국이 전면전을 치른다면 우크라이나, 가자지구 전쟁을 포함해 전쟁 3개가 동시에 벌어지게 된다. 다만 이란이 이스라엘에 보복할 여력이 있을지에 대해선 회의적 시각이 많다. 이란의 군사력은 오랜 서방의 제재와 코로나19에 따른 경제난, 2023년 10월 시작된 가자전쟁 등으로 현격히 약화했다는 평가를 받고 있다. 이란은 지난해 4월과 10월 두 차례에 걸쳐 이스라엘에 대한 대규모 공습을 강행했다가 번번이 보복당했다. 두 번째 보복에서 이란은 탄도미사일 시설, 방공망 등 핵심 군사 인프라에 심한 손상을 입은 것으로 전해졌다. 이란이 대규모 미사일, 드론(무인기) 공습으로 이스라엘에 보복 공격할 것이란 게 전문가들 예상이다. 이란은 피격 직후 이스라엘을 향해 드론 100여대를 발사했으나 실효를 거두진 못한 것으로 알려졌다. 이스라엘은 이날 국가 전체에 비상사태를 선포하고 학교와 직장 문을 닫는 등 이란의 보복 공격에 대한 대비에 들어갔다. 국가비상사태가 선포되면서 필수 시설들을 제외한 학교와 직장은 문을 닫았다. 사회적 모임도 금지됐다. 주요 병원들은 이란의 공습에 대비해 입원 환자들을 지하로 옮기고 외래 환자 진료를 중단했다. 주민들도 일제히 대피 시설로 몸을 숨겼고 이란이 강도 높은 전면 공격에 나설 가능성에 대비하고 있다.",2025-06-14 02:19:09,https://www.segye.com/newsView/20250614500377,세계일보
"美, 이란 보복 공격 대비 중동에 함정 파견",https://img.segye.com/content/image/2025/06/13/300/20250613516286.jpg,"미국이 이스라엘 공습을 받은 이란의 보복 공격에 대비하기 위해 중동에 함정 등 군 자원을 파견했다. 이스라엘은 세계 각국 주재 대사관과 영사관을 일시 폐쇄했다. 13일(현지시간) AP통신이 미 국방 당국자들을 인용한 보도에 따르면 미 해군은 구축함 ‘토머스 허드너’를 동부 지중해로 보냈고, 백악관이 요청할 경우 추가 투입할 수 있는 다른 구축함에도 전방 이동을 지시했다. 토머스 허드너는 알리 버크급 구축함으로 탄도미사일 공격을 방어할 수 있다. 미군은 지난해 이란이 이스라엘을 겨냥해 200여기 미사일을 발사하자 이스라엘을 방어하기 위해 군 자산을 투입한 바 있다. 당시 미 해군 구축함들은 10여기의 요격미사일을 발사했다. 도널드 트럼프 미국 대통령은 이날 중동 상황을 논의하기 위해 국가안보회의(NSC)를 소집했다. 미군은 이스라엘의 이란 공습을 예상하고 이란의 대규모 반격을 대비해 군인 동반 가족들을 이동시키는 등 공습 전부터 대비 조처했다고 한다. 중동 지역에는 미군 약 3만명이 주둔하고 있다. 지난해 10월 예멘의 친이란 반군 세력 후티가 홍해 선박을 공격하면서 미군 숫자가 4만3000명으로 급증하기도 했다. 이스라엘도 이란의 보복 공격에 대비해 각국 주재 대사관과 영사관 문을 닫았다. AFP, 로이터 통신 등에 따르면 미국과 영국, 프랑스, 독일, 스웨덴, 노르웨이, 러시아, 우크라이나, 프랑스, 나이지리아 등 전 세계에 있는 이스라엘 공관이 폐쇄됐다. 이스라엘 외무부는 성명에서 “최근 상황으로 인해 전 세계 이스라엘 공관이 닫히고 영사 서비스가 제공되지 않을 것”이라고 밝혔다. 폐쇄 기간은 밝히지 않았다. 이스라엘 외무부는 각국에 체류하는 자국민에게 양식 작성을 통해 위치, 현재 상황 등을 정부에 알리고 적대행위를 맞닥뜨리면 현지 안보 당국과 협조하라고 당부했다.",2025-06-13 23:44:53,https://www.segye.com/newsView/20250613516230,세계일보
"이란 최고지도자, 군부 수뇌 폭사 직후 후임 인사",https://img.segye.com/content/image/2025/06/13/300/20250613516043.JPG,"이스라엘 공습으로 이란 고위 지휘관 20여명이 사망한 뒤 이란 군 수뇌부 후임자가 임명됐다. 이란 국영 IRNA통신은 13일(현지시간) 이란 최고지도자 아야톨라 알리 하메네이가 이란군 참모총장에 세예드 압둘라힘 무시비 소장을 임명했다고 보도했다. 이란 이슬람혁명수비대 총사령관엔 모하마드 파크푸르 소장을 선임했다. 혁명수비대 대공방어부대 하탐알안비아 사령관은 알리 샤데마니가 맡는다. 로이터 통신은 이날 이스라엘 공습으로 이란 고위 지휘관 20명 이상이 사망했다고 현지 소식통을 인용해 보도했다. 현지 소식통은 로이터에 모하마드 바게리 이란군 참모총장과 호세인 살라미 혁명수비대 총사령관, 하탐알안비아의 골람알리 라시드 사령관 등이 사망했다고 전했다. 이번에 사망한 혁명수비대의 아미르 알리 하지자데 대공 사령관은 이란 탄도미사일 프로그램 책임자다. 이스라엘은 그를 자국 영토 공습 작전을 지휘한 핵심 인물로 지목해왔다. 이스라엘군(IDF)은 이날 발표에서 “지난밤 정보국은 혁명수비대 공군 고위 지휘부가 이스라엘에 대한 공격을 준비하기 위해 지하 지휘 센터에 집결했다는 사실을 확인했다”며 “이에 공군 전투기들이 하지자데와 다른 고위 관료들이 있던 지휘 센터를 공격했다”고 밝혔다. IDF는 하지자데 외에 혁명수비대 공군 무인기 부대 사령관 타헤르-푸르와 공군 공중 지휘부 사령관 다우드 샤이키언이 제거됐다고 밝혔다. IDF는 “혁명수비대 공군은 이스라엘 민간인에 대한 반복적인 공격을 감행해 왔다”며 “특히 하지자데와 그 부하들은 지난해 10월 이스라엘에 대한 이란의 미사일·드론 공격 등을 지휘했다”고 설명했다. IDF는 이들이 2019년 9월 예멘 반군의 사우디아라비아 석유 시설 공격도 주도했다고 덧붙였다. 이스라엘 공습으로 이란의 핵 과학자도 최소 6명 숨진 것으로 알려졌다. 전 이슬람 아자드대 총장인 모하마드 테헤란치, 이란원자력기구(AEOI) 수장을 역임한 페레이둔 아바시 등이 사망했다고 로이터는 전했다.",2025-06-13 23:08:15,https://www.segye.com/newsView/20250613515893,세계일보
"트럼프 지지율, 일부 조사서 30%대로 하락…이민문제 가장 높아",https://img.segye.com/content/image/2025/06/13/300/20250613515971.JPG,"도널드 트럼프 미국 대통령의 국정 지지율이 한 여론조사에서 30%대로 떨어진 것으로 13일(현지시간) 나타났다. 퀴니피악대가 지난 5∼9일 자신이 등록 유권자라고 밝힌 전국의 성인 1천265명을 상대로 실시한 여론조사(오차범위 ±2.8%p)에서 트럼프 대통령의 대통령직 수행을 지지한다는 응답은 38%, 지지하지 않는다는 응답은 54%로 각각 집계됐다. 퀴니피악대 조사에서 트럼프 대통령 지지율이 40% 아래로 떨어진 것은 1월 그의 백악관 복귀 이후 처음이다. 그러나 이번 조사 외에 다른 기관이 최근 실시된 조사에서 트럼프 대통령 지지율은 대부분 40%대로 나타났다. 이번 조사에서 공화당 지지자는 85%가 트럼프 대통령에 대한 지지를 표한 반면, 민주당 지지자는 단 1%만이 지지한다고 응답했다. 무당파 응답자 중에서는 35%가 지지했다. 이는 트럼프 대통령 지지율이 전체적으로는 떨어졌을지라도 공화당 내부의 지지는 견고함을 보여주는 결과로 풀이된다. 이슈별 지지율에서는 그나마 이민 문제가 43%의 지지를 받으며 다른 이슈에 비해 높게 나타났다. 이는 같은 기관의 4월 조사 결과와 비교하면 2% 포인트 내려간 것이다. 아울러 트럼프 대통령의 경제 분야 지지율은 40%, 무역 분야 지지율은 38%로 각각 집계됐다. 하버드대와의 갈등 와중에 대학 문제에서는 37%, 이스라엘-하마스 전쟁은 35%, 러시아-우크라이나전쟁은 34%의 지지율을 각각 보였다.",2025-06-13 22:58:03,https://www.segye.com/newsView/20250613515852,세계일보
“이스라엘 공습에 이란군 고위급 20명 이상 사망”,https://img.segye.com/content/image/2025/06/13/300/20250613515500.jpg,"이스라엘의 공습으로 이란 고위 지휘관 20명 이상이 사망했다고 로이터 통신이 13일(현지시간) 현지 소식통을 인용해 보도했다. 현지 소식통 두 명은 로이터에 이번 이스라엘의 공격으로 호세인 살라미 이슬람혁명수비대(IRGC) 총사령관, 혁명수비대 대공방어부대 하탐알안비야의 골람알리 라시드 사령관 등 이란 고위 지휘관 20명 이상이 숨졌다고 전했다. 이번 공습으로 숨진 모하마드 바게리 이란군 참모총장도 전직 혁명수비대 사령관 출신으로, 2016년부터 보직을 맡아왔다. 그 역시 1980년대 이란-이라크 전쟁 당시 혁명수비대에 입대했다. 혁명수비대의 아미르 알리 하지자데 대공 사령관도 사망자 중 한 명이다. 그는 이란 탄도미사일 프로그램의 책임자로, 이스라엘은 그를 자국 영토에 대한 공습을 지휘한 핵심 인물로 지목해왔다. 이스라엘군(IDF)은 이날 발표에서 ""지난밤 정보국은 혁명수비대 공군 고위 지휘부가 이스라엘에 대한 공격을 준비하기 위해 지하 지휘 센터에 집결했다는 사실을 확인했다""며 ""이에 공군 전투기들이 하지자데와 다른 고위 관료들이 있던 지휘 센터를 공격했다""고 밝혔다. IDF는 하지자데 외에 혁명수비대 공군 무인기 부대 사령관 타헤르-푸르와 공군 공중 지휘부 사령관 다우드 샤이키언이 제거됐다고 밝혔다. IDF는 ""혁명수비대 공군은 이스라엘 민간인에 대한 반복적인 공격을 감행해 왔다""며 ""특히 하지자데와 그 부하들은 지난해 10월 이스라엘에 대한 이란의 미사일·드론 공격 등을 지휘했다""고 설명했다. IDF는 또 이들이 2019년 9월 예멘 반군의 사우디아라비아 석유 시설 공격도 주도했다고 덧붙였다. 이스라엘 공습으로 이란의 핵 과학자도 최소 6명 숨진 것으로 알려졌다. 모하마드 테헤란치는 테헤란의 이슬람 아자드 대학 총장이었으며, 압바시는 2011년부터 2013년까지 이란원자력기구(AEOI)의 수장을 역임했다. 이들 외에 압돌하미드 마누체르, 아흐마드 레자 졸파가리, 아미르호세인 페기, 모탈리비자데가 숨졌다고 로이터 통신은 전했다.",2025-06-13 21:32:27,https://www.segye.com/newsView/20250613515360,세계일보
"러시아, 이스라엘의 이란 공습 규탄 “용납할 수 없어”",https://img.segye.com/content/image/2025/06/13/300/20250613515132.jpg,"러시아는 이스라엘이 이란과 핵시설을 정당한 이유 없이 공격해 중동 지역의 긴장을 고조시켰다고 규탄했다. 러시아 외무부는 13일(현지시간) 성명에서 “유엔 회원국이자 주권 국가인 이란과 그 국민, 평화로운 도시들, 핵에너지 인프라에 대한 정당한 이유 없는 군사 공격은 절대로 용납할 수 없다”고 밝혔다. 외무부는 이스라엘의 이란 공습을 유엔 헌장과 국제법 규범을 명백히 위반한 것으로 간주한다고 비판했다. 또 “이란에 대한 공격을 계획하고 개발하고 실행한 자들이 그 어떤 정당화를 제시한다고 해도 이란 핵 문제는 무력으로 해결될 수 없고 평화적, 정치적, 외교적 방법으로만 보장될 수 있다고 굳게 믿는다”고 강조했다. 이어 “이 도발로 인한 모든 결과의 책임은 이스라엘 지도부에 돌아갈 것”이라며 “이스라엘이 긴장을 더욱 높이는 결정을 의도적으로 선택했다”고 주장했다. 드미트리 페스코프 크렘린궁 대변인은 “블라디미르 푸틴 러시아 대통령이 중동 위기 상황을 예의주시하고 있으며 외교부, 국방부, 정보 당국의 보고를 받고 있다”고 밝혔다. 레오니트 슬루츠키 러시아 하원(국가두마) 국제문제위원장은 “이란과 이스라엘의 전면전은 중동 전체를 불안정하게 하고 제3차 세계대전으로 이어질 위험이 있다”며 “국제사회가 모든 수단을 동원해 외교적 해결의 길을 열어야 한다”고 말했다. 러시아는 전통적으로 이스라엘과 우호적이지만 우크라이나 ‘특별군사작전’ 이후 이란과 밀착했고 지난 1월에는 양국간 포괄적 전략적 동반자 조약을 체결했다.",2025-06-13 20:30:18,https://www.segye.com/newsView/20250613515067,세계일보
