title,thumbnail,short_content,write_time,link,company
"""연예인 1인 기획사 논란, '탈세' 낙인보다 과세기준 마련해야""",https://img.segye.com/content/image/2025/02/18/300/20250218509944.jpg,"유명 연예인들의 1인 기획사를 둘러싼 세금 회피 논란이 잇따른 가운데 이를 '탈세'로 낙인찍기보다는 대중문화산업의 특성을 고려한 제도 정비가 필요하다는 주장이 나왔다. 27일 국회 의원회관 제6간담회의실에서는 더불어민주당 박민규·정태호·임오경·이기헌 의원 등의 주최로 '연예인 1인 기획사 탈세 논란, 그 대안은?' 정책간담회가 열렸다. 발제를 맡은 이",2026-02-27 15:32:00,http://www.segye.com/newsView/20260227511295,세계일보
“갈아 마시면 설탕물?” 250ml에 당 30g…‘과일주스’의 위험한 반전,https://img.segye.com/content/image/2026/02/27/300/20260227501146.jpg,"26일 오전 8시, 서울 광화문 일대 오피스 상가. 바쁜 출근길 직장인들의 손에는 과일 스무디 한 잔씩이 들려 있다. 믹서기 소리와 함께 갈려 나온 ‘건강’이라는 이미지 뒤에는 당류 30g, 즉 각설탕(1개 3g 기준) 약 10개 분량의 단맛이 담겨 있다. 질병관리청이 발표한 ‘2022년 국민건강영양조사’에 따르면 한국인의 가공식품 당류 섭취 급원 1위",2026-02-27 16:01:19,http://www.segye.com/newsView/20260227501140,세계일보
수천만원대 에르메스가 600만원부터…체납자 명품 가방·시계·예술품 등 경매로 쏟아진다,https://img.segye.com/content/image/2026/02/27/300/20260227510294.jpg,고액·상습 체납자 추적을 위해 출범한 국세청 특수조직이 4개월간 집중 수색을 벌여 총 81억원 상당의 현금과 귀금속 등을 압류했다. 국세청은 압류한 물품을 다음 달 두 차례에 걸쳐 온라인 공매로 매각할 예정이다. 국세청은 26일 124명으로부터 현금 13억원과 금두꺼비 등 현물 68억원 상당을 압류했다고 밝혔다. 압류품은 492점에 달하는 것으로 전,2026-02-27 14:15:42,http://www.segye.com/newsView/20260227510298,세계일보
"“응급실 뺑뺑이” 막는다… 전문의 배치 기준 2배 강화, ‘수술 불가’ 시 감점",https://img.segye.com/content/image/2026/02/27/300/20260227507721.jpg,정부가 이른바 ‘응급실 뺑뺑이’로 불리는 의료 공백 사태를 해결하기 위해 응급실 인력과 시설 기준을 대폭 강화한다. 단순히 응급실 문만 열어두는 것이 아니라 실질적인 수술과 처치가 가능하도록 구조를 뜯어고치겠다는 취지다. 27일 보건복지부는 응급실 전담 전문의 배치 기준을 강화하고 응급 환자를 위한 전속 전문의를 의무적으로 두는 내용을 골자로 한 ‘응급,2026-02-27 11:25:03,http://www.segye.com/newsView/20260227506914,세계일보
"박성현, 뮤지컬 ‘여명의 눈동자’ 합류…최대치로 열연 예고",https://img.segye.com/content/image/2026/02/27/300/20260227507518.jpg,뮤지컬이라는 고정 관념을 깨고 360도 무대와 관객과의 가장 가까운 거리를 자랑하는 무대로 매일 화제를 모으고 있는 뮤지컬 ‘여명의 눈동자’가 배우 백성현을 최대치 역으로 캐스팅했다. ‘여명의 눈동자’는 1991년 방송돼 최고 시청률 58.4%를 기록한 동명의 국민 드라마를 원작으로 한 뮤지컬이다. 한국 현대사의 격동기를 배경으로 한 원작은 방영 당시,2026-02-27 11:14:07,http://www.segye.com/newsView/20260227507519,세계일보
"작사가 황지효, 동요 작사집 ‘말하는 고양이 우체부’ 출간",https://img.segye.com/content/image/2026/02/27/300/20260227506163.jpg,"어린이의 마음을 노래해 온 황지효 작사가가 첫 동요 작사집 ‘말하는 고양이 우체부’를 출간했다. 이번 작품집은 그동안 발표된 동요 가사들을 한데 모아 엮은 첫 단행본으로, KBS 창작동요대회 수상작을 비롯해 어린이들의 순수한 감성을 담은 노랫말들이 수록되어 있다. 책의 제목이기도 한 ‘말하는 고양이 우체부’는 작가가 일상 속에서 교감해 온 고양이에서 모",2026-02-27 10:23:24,http://www.segye.com/newsView/20260227506197,세계일보
[알립니다] 세계일보 지방주재 경력기자 모집,https://img.segye.com/content/image/2023/04/25/300/20230425517790.jpg,세계일보에서 참신하고 유능한 인재를 모십니다. 많은 지원 바랍니다. ※자세한 사항은 본사 홈페이지(www.segye.com) 배너를 참조하시기 바랍니다.,2026-02-27 08:59:18,http://www.segye.com/newsView/20260226517822,세계일보
“절대 타협 못 해!” 주먹다짐하던 앙숙 형제 화해시킨 도멘 레셔노 [최현태 기자의 와인홀릭],https://img.segye.com/content/image/2026/02/27/300/20260227500205.jpg,‘신의 물방울’ 3~4권 이시카와 와인샵 운영 형제 에피소드 등장/준야·켄야 형제 극과 극 성격 틈만나면 싸워/레셔노 필립·뱅상 형제도 갈등 겪다 화해/영세한 와이너리 평론가 극찬받는 와이너리로 키워 아기 다다시 남매의 와인 만화 ‘신의 물방울’ 3~4권에는 부친이 물려준 와인샵 ‘이시카와’를 운영하는 형제 이시카와 준야와 이시카와 켄야의 에피소드가 등,2026-02-27 07:00:00,http://www.segye.com/newsView/20260227500224,세계일보
"박찬욱, 한국인 첫 ‘칸 심사위원장’ 됐다",https://img.segye.com/content/image/2026/02/26/300/20260226520524.jpg,박찬욱(사진) 감독이 제79회 칸국제영화제 심사위원장에 위촉됐다. 한국인이 칸영화제 심사위원장을 맡는 것은 이번이 처음이다. 칸영화제 조직위원회는 26일(현지시간) 박 감독을 올해 5월12일 개막하는 칸영화제 심사위원장으로 선정했다고 밝혔다. 조직위원장 이리스 크노블로흐와 집행위원장 티에리 프레모는 공동성명을 통해 “박찬욱 감독의 독창성과 뛰어난,2026-02-27 06:00:00,http://www.segye.com/newsView/20260226517759,세계일보
"‘푸시 우먼’ 심석희·‘부상투혼’ 노도희, 팬들 눈물 ‘쏙’ 빼놓은 애잔한 SNS",https://img.segye.com/content/image/2026/03/03/300/20260303500492.jpg,2026 밀라노·코르티나담페초 동계올림픽 쇼트트랙 여자 3000m 계주 금메달리스트 심석희(서울시청)와 노도희(화성시청)가 애잔한 심경글을 남겨 팬들의 가슴을 뭉클하게 만들었다. 노도희는 2일 자신의 사회관계망서비스(SNS)를 통해 “25년 동안 꿈꾸던 첫 올림픽 3000m 여자 단체전 계주에서 금메달을 목에 걸 수 있어 큰 영광”이라는 글과 함께 자신,2026-03-03 01:24:51,http://www.segye.com/newsView/20260303500478,세계일보
"“세계선수권 끝나고 진솔하게 말씀드리겠다”…‘트러블메이커’ 황대헌, 린샤오쥔과 얽힌 사건+박지원에 대한 ‘팀킬 논란’ 해명 내놓나",https://img.segye.com/content/image/2026/03/02/300/20260302514146.jpg,"무슨 얘기를 하려는걸까. 한국 남자 쇼트트랙 대표팀의 황대헌이 쇼트트랙 세계선수권대회를 마치고 자신을 둘러싼 비판과 논란에 대해 해명하겠다고 예고했다. 황대헌은 2일 자신의 SNS(인스타그램)을 통해 최근 막내린 2026 밀라노·코르티나담페초 동계올림픽에 대한 소감과 감사 인사를 전했다. 2018 평창, 2022 베이징에 이어 개인 통산 세 번째 올림픽",2026-03-03 00:04:37,http://www.segye.com/newsView/20260302514148,세계일보
美·이란 확전 가능성에… 글로벌 스포츠 무대 ‘불똥’,https://img.segye.com/content/image/2026/03/02/300/20260302513094.jpg,"미국과 이스라엘의 이란 공습, 이에 맞선 이란의 보복 공격까지 이어지며 중동 전역의 군사적 긴장감이 극한으로 치닫고 있다. 국제사회가 확전 가능성에 촉각을 곤두세운 가운데 그 여파가 외교·경제를 넘어 스포츠 무대까지 덮치고 있다. 가장 먼저 직격탄을 맞은 건 오는 6월 개막을 앞둔 2026 국제축구연맹(FIFA) 북중미 월드컵이다. 이번 월드컵은 미국·캐나",2026-03-02 21:30:00,http://www.segye.com/newsView/20260302510051,세계일보
WBC 류지현호 완전체 출격…日 한신과 연습경기서 무승부,https://img.segye.com/content/image/2026/03/02/300/20260302512317.jpg,"월드베이스볼클래식(WBC)에 출전하는 한국 야구대표팀을 이끄는 류지현 감독은 지난 1일 30명 ‘완전체’로 첫 훈련을 지휘한 뒤 “기대감이 크다”고 말했다. 이날 주장 이정후(샌프란시스코 자이언츠)를 비롯해 김혜성(로스앤젤레스 다저스), 고우석(디트로이트 타이거스 산하 마이너리그), 저마이 존스(디트로이트), 셰이 위트컴(휴스턴 애스트로스), 데인 더",2026-03-02 20:53:00,http://www.segye.com/newsView/20260302510052,세계일보
"‘축신’ 메시 2연패냐, ‘신성’의 반란이냐",https://img.segye.com/content/image/2026/03/02/300/20260302512377.jpg,"미국, 캐나다, 멕시코 등 북중미 3국에서 6월11일(현지시간) 막을 올리는 2026 국제축구연맹(FIFA) 북중미 월드컵이 3일로 딱 100일을 남겨뒀다. 사상 최초로 48개국 체제로 확대 개편돼 열리는 이번 월드컵은 12개조 1, 2위뿐만 아니라 성적이 좋은 조 3위 8개국까지 더해 32강부터 토너먼트가 열린다. 2026 북중미 월드컵의 최대 관전",2026-03-02 20:45:00,http://www.segye.com/newsView/20260302510040,세계일보
‘중동 불기둥’ 심장 덜컥 호날두…하메네이 사망에 축구계 ‘카오스’,https://img.segye.com/content/image/2026/03/02/300/20260302511001.jpg,"중동을 뒤덮은 불기둥이 결국 축구계까지 집어삼켰다. 이란 최고지도자 아야톨라 알리 하메네이의 사망 소식이 전해지면서 국제정세는 걷잡을 수 없는 혼돈 국면으로 치닫고 있다. 확전 가능성이 고조되자 축구계 역시 긴장 속에 상황을 예의주시하고 있다. ‘정치와 스포츠는 분리된다’는 오랜 명제가 또 한 번 시험대에 오른 모습이다. 2일 축구계에 따르면, 크리스티아누",2026-03-02 17:36:29,http://www.segye.com/newsView/20260302510465,세계일보
"“클래스는 영원하다!” 켑카, 컷 탈락 수모 딛고 PGA 복귀 첫 ‘톱10’ 작렬",https://img.segye.com/content/image/2026/03/02/300/20260302508649.jpg,"브룩스 켑카(36·미국)가 지난 1월 LIV 골프와 결별하고 미국프로골프(PGA) 투어로 복귀하자 골프계의 관심이 집중됐다. 투어 통산 9승중 5승을 메이저 대회에서 달성해 ‘메이저 사냥꾼’으로 불릴 정도로 빼어난 실력을 지녔기 때문이다. 하지만 기대와 달리 2개 대회서 56위, 컷탈락을 기록해 팬들에게 실망감을 안겼다. 이에 3주동안 샷을 날카롭게 다듬은",2026-03-02 15:23:56,http://www.segye.com/newsView/20260302508652,세계일보
"“이게 축구야? 격투기야?” 韓 팬들 폭발…손흥민, 뒤에서 아킬레스건 밟혔다",https://img.segye.com/content/image/2026/03/02/300/20260302506278.jpg,"미국메이저리그사커(MLS) 휴스턴 다이너모의 안토니오 카를로스가 ‘캡틴’ 손흥민(33)을 상대로 무리한 플레이로 반칙을 범해 파장이 거세지고 있다. 카를로스는 그 자리에서 레드카드를 받고 퇴장 당했다. 손흥민의 뒤에서 반칙을 저질렀고, 부상 정도가 가볍지 않다는 점에서 한국 축구 팬들의 분노가 커지고 있다. 로스앤젤레스(LA)FC는 1일 미국 텍사스주",2026-03-02 12:39:11,http://www.segye.com/newsView/20260302505899,세계일보
샌디에이고 송성문 시범경기 3타수 무안타 삼진 1개…타율 0.167,https://img.segye.com/content/image/2026/03/02/300/20260302503532.jpg,미국프로야구 메이저리그(MLB) 샌디에이고 파드리스의 내야수 송성문이 시범 경기 3경기 연속 안타에 실패했다. 송성문은 2일 미국 애리조나주 스코츠데일의 스코츠데일 스타디움에서 열린 2026 MLB 시범 경기 샌프란시스코 자이언츠와 원정경기에 5번 타자 2루수로 선발 출전해 3타수 무안타에 삼진 1개를 기록했다. 샌디에이고는 이날 샌프란시스코에 1-9,2026-03-02 09:17:30,http://www.segye.com/newsView/20260302503504,세계일보
‘하메네이 사망’ 불똥 튄 이기제…포탄 날아다니는 이란서 ‘안전 우려↑’,https://img.segye.com/content/image/2026/03/02/300/20260302500359.jpg,"미국과 이스라엘이 이란을 겨냥해 대대적인 군사작전을 단행하면서 군사적 긴장 수위가 고조되고 있다. 이런 가운데 이란 프로축구 리그에서 뛰고 있는 대한민국 국가대표팀 수비수 출신 이기제(34·메스 라프산잔)의 안전에 대한 우려 역시 높아지고 있다. 2일 연합뉴스에 따르면 이기제는 급히 귀국을 준비 중이며, 현재 대사관에서 가능한 귀국 루트를 알아보고 있다",2026-03-02 01:21:12,http://www.segye.com/newsView/20260302500360,세계일보
"[스포츠 브리핑] 2연속 선발 이강인, 시즌 4호 도움 외",https://img.segye.com/content/image/2026/03/01/300/20260301510405.jpg,"2연속 선발 이강인, 시즌 4호 도움 파리생제르맹(PSG) 이강인(25·사진)이 시즌 4호 도움으로 팀 승리를 이끌었다. 이강인은 1일 프랑스 르아브르의 스타드 오세안에서 열린 2025~2026 프랑스 리그1 24라운드 원정경기에 오른쪽 날개 공격수로 2경기 연속 선발 출전해 전반 37분 날카로운 왼발 크로스로 브래들리 바르콜라의 헤더 결승골을 도우며",2026-03-01 19:56:43,http://www.segye.com/newsView/20260301509071,세계일보
"‘특급 도우미’ 손흥민, 골 없어도 ‘펄펄’",https://img.segye.com/content/image/2026/03/01/300/20260301510393.jpg,"미국 프로축구 메이저리그사커(MLS) 무대를 점령 중인 ‘캡틴’ 손흥민(33)이 도움과 상대 파울 유도로 소속팀 로스앤젤레스(LA)FC의 연승을 이끌었다. 골운이 따르지 않아 득점을 기록하진 못했지만, 경기에서 나온 두 골에 모두 기여하며 팀의 일등공신이 됐다. 원톱 스트라이커로 선발 출전한 손흥민은 1일 미국 텍사스주 휴스턴의 쉘 에너지 스타디움에서",2026-03-01 21:42:29,http://www.segye.com/newsView/20260301509082,세계일보
3·1절 한일전 역전패… 자존심 구긴 마줄스號,https://img.segye.com/content/image/2026/03/01/300/20260301510402.jpg,"한국 남자농구 대표팀은 라트비아 출신의 니콜라이스 마줄스(사진) 감독을 사상 첫 외국인 감독으로 선임하며 새로운 도약을 노렸다. 하지만 마줄스 감독의 시작은 좋지 못했다. ‘팀 농구’를 강조했지만, 데뷔전이었던 지난달 26일 열린 2027 국제농구연맹(FIBA) 카타르 농구 월드컵 아시아 예선 1라운드 B조 3차전 대만과 원정경기에서 65-77로 완패했다.",2026-03-01 21:41:47,http://www.segye.com/newsView/20260301509086,세계일보
구름관중 몰린 K리그… 새 사령탑 개막전 ‘희비’,https://img.segye.com/content/image/2026/03/01/300/20260301510355.jpg,"겨우내 기다렸던 축구팬들의 함성이 그라운드에 울려 퍼졌다. 2026 프로축구 K리그가 많은 관중과 함께 힘차게 그 시작을 알렸다. 특히 이번 시즌은 감독들의 이동이 유독 많았다. K리그1 우승팀 전북 현대가 정정용 감독을 영입했고, 울산 HD는 팀 레전드 출신 김현석 감독을 골랐다. K리그2에서도 수원 삼성이 이정효 감독을 영입해 ‘명가 재건’을 노린다",2026-03-01 21:41:08,http://www.segye.com/newsView/20260301509088,세계일보
1타 차 추격하던 유해란 ‘보기가 발목’… 다잡은 통산 4승 놓쳐,https://img.segye.com/content/image/2026/03/01/300/20260301510281.jpg,역전 우승을 노리던 유해란(25·다올금융그룹)이 뒷심 부족으로 아쉽게 통산 4승을 눈앞에서 놓쳤다. 하지만 3개 대회 연속 톱10 성적을 내며 상승세를 이어갔다. 유해란은 1일 싱가포르 센토사 골프클럽(파72·6793야드)에서 열린 미국여자프로골프(LPGA) 투어 HSBC 월드챔피언십(총상금 300만달러) 4라운드에서 버디 4개와 보기 4개로 타수를 줄이지,2026-03-01 19:25:23,http://www.segye.com/newsView/20260301510193,세계일보
"월드컵 외교전 불붙나…‘하메네이 사망’ 격분한 이란, 美 월드컵 불참 카드?",https://img.segye.com/content/image/2026/03/01/300/20260301508691.jpg,‘월드컵 외교전’이 불붙을 조짐을 보이고 있다. 이란 최고지도자 아야톨라 알리 하메네이 사망 후폭풍으로 국제 정세까지 요동치면서다. 이란의 2026 국제축구연맹(FIFA) 북중미 월드컵 참가 여부에 전세계의 이목이 쏠리고 있다. 이런 가운데 미국과 이스라엘의 합동 공습을 받은 이란이 오는 6월 북중미월드컵에 불참할 것이라는 전망이 나와 관심이 집중되고,2026-03-01 17:22:49,http://www.segye.com/newsView/20260301508599,세계일보
"이란, ‘북중미 월드컵’ 출전할 수 있을까",https://img.segye.com/content/image/2026/03/01/300/20260301504007.jpg,2026 북중미 월드컵 공동 개최국인 미국이 이란을 상대로 군사 작전을 펼치면서 국제축구연맹(FIFA)이 미국에서 월드컵 본선에 진출한 이란이 출전할 수 있을지에 관심이 쏠리고 있다. 잔니 인판티노 FIFA 회장은 지난해 12월 도널드 트럼프 미국 대통령에게 신설한 ‘FIFA 평화상’을 수여한 가운데 미국이 이란에 대한 미사일 공격을 감행해 이란 최고,2026-03-01 09:52:17,http://www.segye.com/newsView/20260301503990,세계일보
"린샤오쥔(임효준), 돌연 한국행 소문 일파만파…中 매체들 흥분",https://img.segye.com/content/image/2026/03/01/300/20260301500485.jpg,"린샤오쥔(30·한국명 임효준)이 최근 가족과의 만남을 위해 한국에 입국했다는 소문이 중국 매체를 통해 전해지면서 온라인이 또 시끌벅적하다. 1일 중국 매체 ‘소후닷컴’과 ‘텐센트 뉴스’ 등에 따르면, 최근 린샤오쥔은 가족과의 만남을 위해 한국행을 택했다. 이는 3월13일부터 사흘간 캐나다 몬트리올에서 열리는 2026 세계 쇼트트랙 선수권대회에 린샤오쥔이",2026-03-01 06:09:40,http://www.segye.com/newsView/20260301500464,세계일보
"메시, 친선경기서 난입 관중과 엉켜 쓰러져…몸 상태 '이상 無'",https://img.segye.com/content/image/2026/02/28/300/20260228506904.jpg,"미국 프로축구 메이저리그사커(MLS) 인터 마이애미의 리오넬 메시(38)가 친선 경기 도중 경기장에 난입한 관중과 엉켜 쓰러지는 소동이 일어났다. 메시는 27일(이하 한국시간) 푸에르토리코 바야몬의 후안 라몬 루브리엘 스타디움에서 열린 에콰도르 챔피언 인데펜디엔테 델 바예와 친선 경기 막판, 경기장에 난입한 한 남성 팬을 마주했다. 상의를 벗은 채 센",2026-02-28 18:55:54,http://www.segye.com/newsView/20260228502828,세계일보
“언제까지 선수들 헌신에만 기댈 건가”…‘제2의 최가온’ 만들기 위해선,https://img.segye.com/content/image/2026/02/27/300/20260227511977.jpg,"2026 밀라노·코르티나담페초 동계올림픽 스노보드 여자 하프파이프 금메달리스트 최가온(세화여고)이 남긴 한탄이다. 한국 스노보드가 이번 대회에서 금메달(최가온), 은메달(김상겸), 동메달(유승은)을 각각 획득하면서 ‘황금 세대’의 문을 활짝 열었다. 이는 1960년 스쿼밸리 대회부터 올림픽 무대에 도전해 온 한국 설상 종목의 역대 최고 성적표이기도 하다",2026-02-27 15:39:04,http://www.segye.com/newsView/20260227511753,세계일보
"이란 ""역대 최대 보복"" 천명…이틀째 미군 거점 동시다발 타격",https://img.segye.com/content/image/2026/03/01/300/20260301507554.jpg,"이란은 미국과 이스라엘 공습에 맞서 1일(현지시간) 이틀째 중동 곳곳의 미군 거점을 동시다발로 타격하며 보복을 이어갔다. 로이터 통신에 따르면 이란 혁명수비대(IRGC)는 이날 성명에서 ""역대 최대 규모의 보복 작전을 개시할 것""이라고 천명했다. 이란 국영 방송은 역내 미군 기지 27곳을 비롯해 이스라엘 군 본부와 방위 산업 단지 등이 공격 목표에 포함됐다고 전했다. 혁명수비대 성명이 공개된 시점과 맞물려 이날 이른 아침부터 이스라엘, 중동 내 미군 거점 곳곳에서 폭발음이 이어졌다. 이날 오전 6시 직후 이스라엘 전역에는 공습 사이렌이 반복적으로 울리며 공격 임박을 알렸고, 텔아비브에서는 정밀 방공망이 가동되면서 연쇄적인 폭발음이 들렸다고 로이터 통신이 전했다. 비슷한 시간 이라크 에르빌 공항 근처에서도 여러 차례 폭발음이 들렸으며, 검은 연기가 치솟았다고 AFP 통신이 보도했다. 앞서 전날 미군은 에르빌 상공에서 여러 발의 미사일과 드론을 격추한 바 있다. 비슷한 시간 아랍에미리트(UAE) 두바이와 카타르 도하, 바레인 마나마에서도 여러 차례 굉음이 이어졌고, 도하 상공에서는 시커먼 포화가 치솟았다고 목격자들이 전했다.",2026-03-01 15:10:48,https://www.segye.com/newsView/20260301507553,세계일보
이란도 이틀째 보복…중동 내 미군 거점 곳곳 타격,https://img.segye.com/content/image/2026/03/01/300/20260301507503.jpg,"이란은 미국과 이스라엘 공습에 맞서 1일(현지시간) 이틀째 중동 곳곳의 미군 거점을 타격하며 보복을 이어갔다. 일요일인 이날 이른 시간 이라크 에르빌 공항 근처에서 수차례 폭발음이 들렸으며, 검은 연기가 치솟았다고 AFP 통신이 보도했다. 앞서 전날 미군은 에르빌 상공에서 여러 발의 미사일과 드론을 격추한 바 있다. 비슷한 시간 두바이에서도 수차례 굉음이 이어졌다고 로이터 통신이 목격자를 인용해 보도했다.",2026-03-01 14:45:57,https://www.segye.com/newsView/20260301506892,세계일보
"""중동 항해 선박에 보험료 최대 50% 할증""",https://img.segye.com/content/image/2026/03/01/300/20260301506679.jpg,"미국의 이란 공격 여파로 중동 해역의 긴장이 고조되자 전쟁 전문 보험사들이 보험료 인상 작업에 착수했다. 이에 따라 석유 교역 요충지인 호르무즈 해협과 걸프만 등을 지나는 선박들의 물류비용 부담은 급격히 늘어날 전망이다. 28일(현지시간) 파이낸셜타임스(FT)에 따르면 전쟁 전문 보험사들은 미국의 이란 공격 이후 주요 석유 요충지를 통과하는 선박들에 대한 기존 보장 계약 취소 통지서를 일제히 제출했다. 현재 계약된 보장 사항을 일단 무효화한 뒤, 전쟁 위험 가중치를 반영해 인상된 보험료로 재계약을 체결하겠다는 취지다. 이에 따라 현재 선박 대체 비용의 약 0.25% 수준인 걸프 항해 보험료는 향후 최대 50% 할증된 가격으로 책정될 전망이다. 가령 1억달러 가치 선박의 경우 항해당 보험료가 현행 25만달러에서 37만5천달러까지 치솟을 수 있다는 것이다. 이스라엘 항구에 기항하는 선박들의 보험 비용 역시 이란의 보복 조치 가능성에 대비해 이전보다 최대 50% 급등할 것으로 보인다고 업계 관계자들이 FT에 전했다. 특히 보험업자들은 이란의 호르무즈 해협 폐쇄 여부에 촉각을 곤두세우고 있다. 글로벌 보험사 '마쉬'의 딜런 모티머 영국 해상전쟁보험 부문장은 ""미국과 이스라엘의 공격이 계속될 경우 이란은 역내 해운 통제권을 지렛대로 활용하기 시작할 것""이라고 내다봤다. 아울러 보험사들은 이란의 대리 세력들이 인근 해역에서 선박 나포를 시도할 가능성까지 염두에 두고 보험료를 재산정하는 것으로 알려졌다. 곡물·석유 등 원자재 화물 보험사들도 잇달아 계약 해지에 나섰다. 화물 업계에서는 보험사들이 선박 보장 자체를 거부하기보다, 대폭 상승한 가격으로 재협상에 나설 것이란 관측이 나온다. 일부 선주들은 아예 호르무즈 해협으로 향하는 항해 자체를 취소하고 있다. FT에 따르면 이날 최소 3척의 선박이 피격 위험 등을 우려해 해협 통과 직전 기수를 돌린 것으로 확인됐다. 호르무즈 해협은 전 세계 원유 물동량의 약 5분의 1이 지나는 해상 요충이다.",2026-03-01 14:30:05,https://www.segye.com/newsView/20260301506678,세계일보
