title,thumbnail,short_content,write_time,link,company
국민의힘 '최종 대선 경선' 당원투표율 53%로 마감,https://img.sbs.co.kr/newimg/news/20250502/202067656_300.jpg,▲ 국민의힘 경선 후보 벽보국민의힘 최종 대선 후보를 뽑기 위한 당원 선거인단 투표가 약 53%의 투표율로 마감됐습니다.당 선거관리위…,2025.05.02 23:56,https://news.sbs.co.kr/news/endPage.do?news_id=N1008087527,SBS
"칠레 남부 바다서 7.4 강진…""일부 남극 기지에도 대피령""",,"남극과 남미 최남단 사이 바다에서 강진이 발생해, 남극 일부 시설에 긴급 대피령이 내려졌습니다.미국 지질조사국은 칠레 현지시간 2일 오전 8시 …",2025.05.02 23:47,https://news.sbs.co.kr/news/endPage.do?news_id=N1008087526,SBS
러시아 노래 번역해 부르는 파병 북한군 모습 공개,https://img.sbs.co.kr/newimg/news/20250502/202067655_300.jpg,"▲ 러시아 쿠르스크 북한군 숙소 식당 식탁에 놓인 고춧가루러시아 남서부 접경지 쿠르스크에 파병된 북한 병사들이 러시아 노래를 번역해 부르는 장면이 공개됐습니다.러시아 국영방송 기자인 고려인 후손 마리나 김은 현지시간 지난달 30일 자신의 텔레그램에 쿠르스크 파병 북한군을 취재한 영상을 올렸습니다.마리나 김은 ""아주 젊은 친구들이다.",2025.05.02 23:41,https://news.sbs.co.kr/news/endPage.do?news_id=N1008087524,SBS
'트럼프 관세' 미국 4월 고용 호조…17만 7천 명 증가,https://img.sbs.co.kr/newimg/news/20250502/202067654_300.jpg,▲ 미 일리노이주 소매점의 구인 간판도널드 트럼프 미 행정부의 관세정책이 경기 침체를 가져올 것이란 우려에도 불구하고 지난달 미국의 …,2025.05.02 23:40,https://news.sbs.co.kr/news/endPage.do?news_id=N1008087523,SBS
"트럼프, 반기 든 하버드대에 ""면세 지위 박탈할 것""",https://img.sbs.co.kr/news/pc/thumb_v3.png,▲ 트럼프 미국 대통령도널드 트럼프 미국 대통령은 트럼프 정부의 정책에 따르지 않고 각을 세우고 있는 하버드대학교의 면세 혜택을 취소…,2025.05.02 23:39,https://news.sbs.co.kr/news/endPage.do?news_id=N1008087522,SBS
"한국 배드민턴, 덴마크 꺾고 세계혼합단체선수권 4강 진출",https://img.sbs.co.kr/news/pc/thumb_v3.png,▲ 파이팅 외치는 배드민턴 국가대표팀한국 배드민턴이 세계혼합단체선수권 4강에 진출했습니다.박주봉 신임 감독이 이끄는 배드민턴 국가대표…,2025.05.02 23:15,https://news.sbs.co.kr/news/endPage.do?news_id=N1008087519,SBS
프로야구 2위 한화 · 롯데 나란히 승리…선두 LG와 0.5경기 차,https://img.sbs.co.kr/news/pc/thumb_v3.png,▲ 롯데 나승엽프로야구에서 공동 2위 한화와 롯데가 나란히 연승행진을 이어가며 선두 LG를 0.5경기 차로 추격했습니다.한화는 광주에…,2025.05.02 22:43,https://news.sbs.co.kr/news/endPage.do?news_id=N1008087516,SBS
"[뉴스직격] 김윤희 문화일보 기자, 김종일 시사저널 기자, 안희재 SBS 기자",https://img.sbs.co.kr/news/pc/thumb_v3.png,■ 주영진의 뉴스직격 (FM 103.5 MHz 17:00 ∼ 18:00)■ 일자 : 2025년 5월 2일■ 진행…,2025.05.02 21:42,https://news.sbs.co.kr/news/endPage.do?news_id=N1008087495,SBS
임플란트 시술한 치과 찾아가 흉기 휘두른 60대 남성 구속송치,https://img.sbs.co.kr/news/pc/thumb_v3.png,▲ 경기 성남수정경찰서임플란트 치료한 부위가 아프다며 치과에 찾아가 흉기를 휘둘러 직원들을 다치게 한 혐의를 받는 60대 남성이 구속…,2025.05.02 21:33,https://news.sbs.co.kr/news/endPage.do?news_id=N1008087492,SBS
클로징,https://img.sbs.co.kr/news/pc/thumb_v3.png,8시 뉴스 마칩니다. 고맙습니다.,2025.05.02 21:17,https://news.sbs.co.kr/news/endPage.do?news_id=N1008087445,SBS
[날씨] 연휴 동안 오락가락 비…돌풍·벼락 주의,https://img.sbs.co.kr/newimg/news/20250502/202067649_300.jpg,"연휴 동안 우산 잘 챙기셔야겠습니다.기압계가 빠르게 변화하면서 연휴 마지막 날인 화요일까지 비가 내렸다, 맑아졌다 날씨가 다소 변덕스럽겠는데요.…",2025.05.02 21:17,https://news.sbs.co.kr/news/endPage.do?news_id=N1008087444,SBS
"SSG 최정, 복귀 첫 타석에서 496번째 홈런포",https://img.sbs.co.kr/newimg/news/20250502/202067648_300.jpg,KBO리그 통산 최다 홈런 1위 SSG 최정 선수가 올 시즌 자신의 첫 1군 경기 첫 타석부터 통산 496호 홈런을 터뜨렸습니다.,2025.05.02 21:16,https://news.sbs.co.kr/news/endPage.do?news_id=N1008087443,SBS
"응원단장 변신한 '캡틴 손'…""결승행 확률 91%""",https://img.sbs.co.kr/newimg/news/20250502/202067647_300.jpg,토트넘이 유로파리그 준결승 1차전에서 두 골 차 승리를 거둬 결승 진출에 청신호를 켰습니다. 부상으로 결장한 주장 손흥민 선수는 벤치에서 힘을 …,2025.05.02 21:14,https://news.sbs.co.kr/news/endPage.do?news_id=N1008087442,SBS
"""남편 여권 뺏겨도 좋아요""…팬심 잡는 '홈 Run 클럽'",https://img.sbs.co.kr/newimg/news/20250502/202067646_300.jpg,한화의 '외국인 원투펀치' 폰세와 와이스의 두 아내들은 한국 문화에 적극적으로 녹아드는 노력으로 유명한데요. 최근에는 한화 팬들과 함께하는 '러닝 크루'를 만들었습니다.전영민 기자가 함께 뛰었습니다.,2025.05.02 21:13,https://news.sbs.co.kr/news/endPage.do?news_id=N1008087441,SBS
"NC파크 '어린이날 재개장' 무산…""추가 보완 필요""",https://img.sbs.co.kr/news/pc/thumb_v3.png,지난 3월 말 구조물 추락에 따른 관객 사망 사건 이후 경기 개최가 중단됐던 창원 NC파크의 재개장이 또 한 번 미뤄졌습니다. 국토교통부가 야구…,2025.05.02 21:13,https://news.sbs.co.kr/news/endPage.do?news_id=N1008087440,SBS
일출 보려 '화장실에서 노숙'…연휴 맞은 중국 '인산인해',https://img.sbs.co.kr/news/pc/thumb_v3.png,우리처럼 긴 연휴를 맞은 중국에서는 곳곳에 여행객이 넘쳐나고 있습니다. 유명 관광지는 입장하기조차 힘든 데다 해 뜨는 걸 보려고 화장실에서 노숙…,2025.05.02 21:12,https://news.sbs.co.kr/news/endPage.do?news_id=N1008087436,SBS
"""기재부 왕 노릇"" 예산편성권 분리? 미국 따라 했다는데 [사실은]",https://img.sbs.co.kr/news/pc/thumb_v3.png,"이재명 민주당 대선 후보가 최근 기획재정부가 왕 노릇을 한다고 비판했죠. 이후 민주당 안에서 기재부 권한을 쪼개서 미국처럼 예산 편성 권한은 대통령 직속으로 두자는 목소리가 나오자, 국민의힘은 대통령 권한이 너무 커진다고 반발하고 있는데요.안상우 기자가 팩트체크 '사실은' 코너에서 따져봤습니다.",2025.05.02 21:08,https://news.sbs.co.kr/news/endPage.do?news_id=N1008087435,SBS
서울에서도 종일 '재활 뺑뺑이'…늘어나는 사설도 '문제',https://img.sbs.co.kr/news/pc/thumb_v3.png,발달장애 아동들이 재활 치료를 받을 시설이 부족하다는 실태 얼마 전 전해드렸습니다. 치료받을 수 있는 분야도 시설마다 나뉘어 있어서 아이들과 부모는 종일 곳곳을 돌아다녀야 하는데요.,2025.05.02 21:07,https://news.sbs.co.kr/news/endPage.do?news_id=N1008087434,SBS
"""자리가 없어요""…주차 간신히 했는데 유심 바꾸려 하자",https://img.sbs.co.kr/news/pc/thumb_v3.png,"다음 주 화요일까지 이어지는 연휴를 맞아 외국 여행 가려는 사람들로 오늘 인천공항은 하루 내내 붐볐습니다. 그러다 보니 주차하는 데도 시간이 꽤 걸렸고, 또 SK 쓰는 사람들은 유심까지 바꿔야 해서 출국 시간 맞추기가 빠듯했습니다.현장을 엄민재 기자가 취재했습니다.",2025.05.02 21:02,https://news.sbs.co.kr/news/endPage.do?news_id=N1008087432,SBS
"SKT ""신규 가입 중단""…""15일 이후 유심 부족 해소될 듯""",https://img.sbs.co.kr/news/pc/thumb_v3.png,해킹 사고로 사람들에게 큰 불편을 안겨준 SK텔레콤이 유심 교체에 더 속도를 내기 위해 당분간 신규 가입자 모집을 중단하기로 했습니다. SK텔레…,2025.05.02 20:58,https://news.sbs.co.kr/news/endPage.do?news_id=N1008087431,SBS
처벌 피한 김건희 '명품백'…'다이아 목걸이' 수사 전망은,https://img.sbs.co.kr/newimg/news/20250502/202067632_300.jpg,"검찰은 또, 앞서 언급된 다이아몬드 목걸이가 김건희 여사에게 전달됐다는 증거를 찾는 데에 수사력을 집중하고 있습니다. 김 여사가 명품 가방을 받…",2025.05.02 20:52,https://news.sbs.co.kr/news/endPage.do?news_id=N1008087430,SBS
[단독] 재정 책임자도 입건…통일교 재단으로 수사 확대,https://img.sbs.co.kr/newimg/news/20250502/202067630_300.jpg,"건진법사 관련 의혹을 수사하는 검찰이 통일교 재정을 담당했던 인사를 피의자로 입건한 것으로 확인됐습니다. 건진법사에게 고가의 목걸이와 명품 가방을 건넨 의혹을 받는 통일교 전 간부의 아내로, 통일교 재단으로 검찰 수사가 확대되는 모양새입니다.동은영 기자의 단독 보도입니다.",2025.05.02 20:46,https://news.sbs.co.kr/news/endPage.do?news_id=N1008087429,SBS
"관세 협상 어쩌나…미 행정부 ""이주호 권한대행과 협력""",https://img.sbs.co.kr/newimg/news/20250502/202067627_300.jpg,"이주호 권한대행 앞에는 경험해 보지 못한 외교와 통상, 경제 현안이 쌓여 있습니다. 당장 가장 걱정되는 게 최상목 전 부총리가 주요한 역할을 했…",2025.05.02 20:43,https://news.sbs.co.kr/news/endPage.do?news_id=N1008087428,SBS
"이주호 대대대행 체제 첫날…""공정한 선거 관리에 중점""",https://img.sbs.co.kr/newimg/news/20250502/202067625_300.jpg,"정부 서열 4위인 이주호 부총리 겸 교육부 장관이 대통령 권한대행을 맡게 됐습니다. 이 권한대행은 공정한 선거 관리에 중점을 두겠다고 말했고, 긴급 국가안전보장회의, 임시 국무회의를 잇따라 주재했습니다.장훈경 기자입니다.",2025.05.02 20:41,https://news.sbs.co.kr/news/endPage.do?news_id=N1008087427,SBS
대법 판결 후 행동 나선 민주당…국민의힘 계산도 복잡?,https://img.sbs.co.kr/news/pc/thumb_v3.png,"지금까지 내용, 정치부 박하정 기자와 정리해 보겠습니다.Q. 민주당 오늘 반응, 이유는?[박하정 기자 : 항소심 무죄 판결로 좀 사그라진 듯했던 사법 리스크 불씨가 다시 살아난 셈인 거잖아요.",2025.05.02 20:38,https://news.sbs.co.kr/news/endPage.do?news_id=N1008087424,SBS
"김문수 ""단시간 안에 소통""…한동훈 ""개싸움 감당 못 해""",https://img.sbs.co.kr/news/pc/thumb_v3.png,국민의힘의 김문수 경선 후보는 만약 자신이 당의 후보로 확정되면 한덕수 전 총리와 빠른 시간 안에 소통하겠다고 말했습니다. 한동훈 후보는 대선에…,2025.05.02 20:38,https://news.sbs.co.kr/news/endPage.do?news_id=N1008087423,SBS
"이재명 ""선거 관리하는 분이 선수로…국민이 판단할 것""",https://img.sbs.co.kr/news/pc/thumb_v3.png,"이재명 민주당 대선 후보는 오늘 강원도 접경지역을 찾았습니다. 이 후보는 대선 출마를 선언한 한덕수 전 총리를 겨냥해, 선거 관리를 맡다가 갑자기 선수로 뛰겠다는 게 어떻게 비칠지 스스로 돌아보라고 말했습니다.김상민 기자가 취재했습니다.",2025.05.02 20:27,https://news.sbs.co.kr/news/endPage.do?news_id=N1008087422,SBS
"출사표 낸 한덕수 ""개헌 뒤 2028년 퇴임""…빅텐트 시동",https://img.sbs.co.kr/news/pc/thumb_v3.png,"어지러운 정국을 추스르고, 원래는 선거를 관리했어야 할 한덕수 전 총리가 어제 사퇴한 이후 오늘 대선 출사표를 던졌습니다. 자신이 당선되면 새로운 헌법을 마련해서 2028년에 대선과 총선을 실시한 뒤 대통령직에서 물러나겠다고 말했습니다.배준우 기자가 전하겠습니다.",2025.05.02 20:21,https://news.sbs.co.kr/news/endPage.do?news_id=N1008087421,SBS
국민 절반이 피해자;;…SKT 유심 해킹 사건 3분 정리 / 스브스뉴스,https://img.sbs.co.kr/news/pc/thumb_v3.png,"지난 19일 SK텔레콤이 해커의 악성코드 공격을 받아가입자 2,500만 명의 유심 정보 일부가 유출된 사건이 벌어졌습니다.국내 통신사 역사상 &…",2025.05.02 20:18,https://news.sbs.co.kr/news/endPage.do?news_id=N1008082435,SBS
이재명 후보 선거법 재판 '파기환송'혼돈의 대선 경우의 수 알아봄 / 스브스뉴스,https://img.sbs.co.kr/news/pc/thumb_v3.png,"5월 1일, 대법원이 이재명 더불어민주당 후보의 선거법 재판 3심에서 '유죄 취지 파기환송'을 선고했습니다.대체 이게 무슨 뜻인지…",2025.05.02 20:18,https://news.sbs.co.kr/news/endPage.do?news_id=N1008087470,SBS
국무회의 정족수 논란…국무위원 4명 더 빠지면 무력화,https://img.sbs.co.kr/newimg/news/20250502/202067612_300.jpg,이렇게 한덕수 전 총리와 최상목 전 부총리까지 잇따라 사퇴하면서 국무위원 숫자가 14명으로 줄었습니다.정부 주요 정책을 논의하는 국무회의가 제대…,2025.05.02 20:16,https://news.sbs.co.kr/news/endPage.do?news_id=N1008087419,SBS
"""관세 책임 물어 탄핵""…""국무회의 무력화 하려는 의도""",https://img.sbs.co.kr/newimg/news/20250502/202067607_300.jpg,"최상목 전 부총리에 대한 탄핵 시도는 대법원 판결에 대응 차원인 동시에 한덕수 전 총리도 겨냥한 측면이 있다고 민주당은 말했습니다. 민주당 안에서는 굳이 탄핵할 필요가 있었느냐는 목소리도 나왔는데, 국민의힘은 국무회의 자체를 무력화하려는 의도라고 주장했습니다.손기준 기자가 취재했습니다.",2025.05.02 20:14,https://news.sbs.co.kr/news/endPage.do?news_id=N1008087420,SBS
"최상목, 탄핵 시도하자 사퇴…사상 초유 '대대대행 체제'",https://img.sbs.co.kr/newimg/news/20250502/202067608_300.jpg,이에 앞서 어젯밤 민주당 주도로 최상목 경제부총리에 대한 탄핵안이 국회 본회의에 상정됐습니다. 그러자 최상목 부총리는 스스로 사퇴했습니다. 한덕수 전 총리가 이미 물러난 상황이라 이주호 사회부총리가 대통령 권한대행을 맡게 됐습니다.,2025.05.02 20:11,https://news.sbs.co.kr/news/endPage.do?news_id=N1008087418,SBS
"민주 ""제2의 조봉암 사건""…국힘 ""사법부 겁박 도 넘어""",https://img.sbs.co.kr/newimg/news/20250502/202067604_300.jpg,"대법관인 법원행정처장이 오늘 국회에 나와서 어제 대법원 판결은 오로지 헌법과 법률에 따라 엄중하게 검토한 결과라고 말했습니다. 민주당은 사법 살인에 비유하면서 사법부를 강도 높게 비판했고, 국민의힘은 이런 민주당의 겁박이 도를 넘었다고 맞섰습니다.이 내용은 민경호 기자가 취재했습니다.",2025.05.02 20:07,https://news.sbs.co.kr/news/endPage.do?news_id=N1008087416,SBS
"민주당 의원들, 대법원 항의 방문…""대법관들 탄핵해야""",https://img.sbs.co.kr/news/pc/thumb_v3.png,민주당 의원 40여 명은 오늘 대법원을 항의 방문했습니다. 선거를 한 달가량 앞둔 시점에 대법원이 사건을 파기환송한 건 대선 개입이라며 편파적인 판결이라고 주장했습니다.,2025.05.02 20:03,https://news.sbs.co.kr/news/endPage.do?news_id=N1008087415,SBS
"'대통령 당선되면 재판 중지' 법 추진…국힘 ""방탄 악법""",https://img.sbs.co.kr/news/pc/thumb_v3.png,"어제 대법원 판결 이후, 민주당에서는 반발의 목소리가 이어지고 있습니다. 민주당은 대통령에 당선되면 그동안 진행되던 재판을 멈추도록 하는 내용의 법안을 국회 법사위에 상정했습니다.",2025.05.02 20:01,https://news.sbs.co.kr/news/endPage.do?news_id=N1008087414,SBS
"첫 기일 바로 지정, 파기환송심도 속전속결?…결론 언제",https://img.sbs.co.kr/news/pc/thumb_v3.png,대법원이 이례적으로 신속하게 결론을 냈던 것처럼 파기환송심 재판부도 심리에 속도를 내는 모양새입니다.그렇다면 판결은 어떤 절차를 거쳐 언제쯤 나…,2025.05.02 19:57,https://news.sbs.co.kr/news/endPage.do?news_id=N1008087426,SBS
이재명 파기환송심 5월 15일에 시작…소환장 인편 송달,https://img.sbs.co.kr/news/pc/thumb_v3.png,"이재명 민주당 대선 후보의 공직선거법 위반 사건 파기환송심 재판이 이번 달 15일에 시작됩니다. 어제 대법원에서 유죄 취지로 파기환송된 이후 오늘 서울고등법원에서 담당 재판부가 정해졌고, 첫 공판기일까지 잡힌 겁니다.",2025.05.02 19:52,https://news.sbs.co.kr/news/endPage.do?news_id=N1008087425,SBS
[글로벌D리포트] 왈츠 국가안보보좌관 경질…'네오콘 숙청'의 시작?,https://img.sbs.co.kr/news/pc/thumb_v3.png,트럼프 미국 대통령이 백악관 행사에서 자신의 치적을 자랑하다 각료들까지 호명하며 치켜세웁니다. [도널드 트럼프/미국 대통령: 피트 헤그세스는 정말 일을 훌륭하게 하고 있습니다.,2025.05.02 19:43,https://news.sbs.co.kr/news/endPage.do?news_id=N1008087452,SBS
오늘의 SBS 8뉴스 예고 (5월 2일),https://img.sbs.co.kr/news/pc/thumb_v3.png,오늘 <SBS 8뉴스>에서는▶ 이재명 재판 '파기환송' 후폭풍...민주당 등 형소법 개정 추진▶ 국회 법사위…,2025.05.02 19:36,https://news.sbs.co.kr/news/endPage.do?news_id=N1008087346,SBS
"한덕수, 광주 5·18 묘지 방문…반대 집회로 참배는 못 해",https://img.sbs.co.kr/newimg/news/20250502/202067590_300.jpg,▲ 2일 오후 광주 북구 국립 5·18 민주묘지를 찾은 한덕수 전 총리가 광주비상행동 등 시민·사회단체 관계자들의 반발에 발걸음을 돌…,2025.05.02 19:31,https://news.sbs.co.kr/news/endPage.do?news_id=N1008087454,SBS
"트럼프 ""관세로 경제 살렸다""며 공개한 '미국 부흥 플랜'…하지만 미국인들 반응이 극과 극인 이유 / 비디오머그 / 딥빽",https://img.sbs.co.kr/newimg/news/20250502/202067589_300.jpg,도널드 트럼프 미국 대통령이 취임 100일을 맞아 미시간주의 두 곳에서 향후 1360일간의 '미국 부흥 계획'을 직접 발표했습니다…,2025.05.02 19:22,https://news.sbs.co.kr/news/endPage.do?news_id=N1008087304,SBS
"[D리포트] 한국 위성, 달에 사람 보내는 '아르테미스 2호'에 투입",https://img.sbs.co.kr/newimg/news/20250502/202067566_300.jpg,달에 다시 사람을 보내겠다는 미국의 아르테미스 프로젝트에 한국이 참여하게 됐습니다.내년 4월 미국에서 발사되는 아르테미스 2호에 우리나라의 위성…,2025.05.02 19:17,https://news.sbs.co.kr/news/endPage.do?news_id=N1008087338,SBS
"'KLPGA 챔피언십 3번째 우승 도전' 박현경, 2R 공동 선두",https://img.sbs.co.kr/newimg/news/20250502/202067588_300.jpg,"▲ 박현경한국여자프로골프, KLPGA 투어 시즌 첫 메이저 대회인 크리스에프엔씨 제47회 KLPGA 챔피언십 2라운드에서 이 대회 통…",2025.05.02 19:14,https://news.sbs.co.kr/news/endPage.do?news_id=N1008087451,SBS
"""중국, 유사시 군 수송 겸용 선박 건조…타이완 겨냥""",https://img.sbs.co.kr/news/pc/thumb_v3.png,▲ 지난 3월 15일 타이완 진먼다오 인근 순찰하는 중국 해경중국이 타이완 유사시를 가정해 군사·민간 용도로 모두 활용할 수 있는 선…,2025.05.02 19:00,https://news.sbs.co.kr/news/endPage.do?news_id=N1008087446,SBS
이재명 파기환송심 15일 첫 공판…'인편'으로 소환장 송달,https://img.sbs.co.kr/news/pc/thumb_v3.png,▲ 이재명 더불어민주당 대선 후보이재명 민주당 대선 후보의 공직선거법 위반 혐의 사건 파기환송심 첫 공판이 선거운동 기간인 오는 15…,2025.05.02 18:57,https://news.sbs.co.kr/news/endPage.do?news_id=N1008087439,SBS
"보트 2척으로 눈속임…중국 신종 불법조업 확인 ""퇴거 조처""",https://img.sbs.co.kr/news/pc/thumb_v3.png,▲ 태안해양경찰서태안해양경찰서는 중국 대련 선적 10t급 자망어선 고속보트 1척에 대해 불법 조업 혐의를 적용하고 담보금 1억 5천만…,2025.05.02 18:53,https://news.sbs.co.kr/news/endPage.do?news_id=N1008087413,SBS
인제 펜션서 화목난로 원인 불…1억 2천만 원 피해,https://img.sbs.co.kr/news/pc/thumb_v3.png,오늘 낮 12시 31분 강원 인제군 기린면 방동리 한 펜션에서 불이 나 3시간 만에 꺼졌습니다.화재로 건물 2개 동이 전소 돼 소방 당국 추산 …,2025.05.02 18:51,https://news.sbs.co.kr/news/endPage.do?news_id=N1008087412,SBS
산림청 추경 4천407억 확정…헬기6대 추가·산불특수대 5팀 보강,https://img.sbs.co.kr/news/pc/thumb_v3.png,▲ 대구 대형 산불 발생 이틀째인 29일 오전 대구 북구 산불 현장에서 헬기가 물을 투하하고 있다. 올해 산불 진화 핵심 장비인 헬기…,2025.05.02 18:51,https://news.sbs.co.kr/news/endPage.do?news_id=N1008087411,SBS
"5·18 묘지 참배 막힌 한덕수 ""저도 호남 사람, 서로 사랑해야""",https://img.sbs.co.kr/news/pc/thumb_v3.png,"▲ 2일 오후 광주 북구 국립5ㆍ18민주묘지를 찾은 한덕수 전 총리가 광주비상행동 등 시민사회단체 관계자들에게 가로막혀 있다.제21대 대통령 선거 출마를 선언한 뒤 오늘 광주를 찾은 한덕수 전 국무총리가 시민 단체의 반발로 5·18 민주묘지를 참배하지 못했습니다.한 전 총리는 오늘 오후 5시 35분쯤 광주 북구 운정동 국립 5·18 민주묘지에 도착해 지지자 100여 명의 연호를 받으며 민주묘지로 향했습니다.그러나 민주묘지로 들어가는 초입인 '민주의 문' 앞에서 한 전 총리의 대선 출마와 5·18 묘지 참배를 비판하는 시민단체 '내란청산·사회대개혁 광주비상행동'과 '오월정신지키기범시도민대책위' 관계자들에게 가로막혔습니다.한 전 총리가 도착하기 2시간여 전부터 민주묘지에 모인 이들 단체는 ""내란 동조 세력 한덕수는 물러가라"", ""5·18 참배 자격 없다""고 연신 외쳤고, 민주의 문으로 다가오는 한 전 총리를 경호하는 인력과 밀고 당기며 경미한 몸싸움을 벌였습니다.지지자들에게 둘러싸인 채 10여 분간 민주묘지로 들어가지 못한 한 전 총리는 헌화·분향 대신 민주의 문 앞에서 고개를 숙이며 참배를 대신했습니다.묵념을 마친 후에도 시민 단체의 고성이 오가는 반발이 사그라지지 않자 한 전 총리는 제자리에 서서 참배를 한목소리로 반대하는 시민 단체를 아쉬운 눈빛으로 바라보기도 했습니다.결국 발걸음을 돌린 한 전 총리는 ""여러분 조용히 해주세요""라고 여러 차례 외쳤으나, 지지자·시민단체의 고성에 묻혔고, ""저도 호남 사람입니다.",2025.05.02 18:50,https://news.sbs.co.kr/news/endPage.do?news_id=N1008087408,SBS
[8뉴스 예고] '당선 시 재판 중지'…형소법 개정안 민주당 주도 발의,https://img.sbs.co.kr/newimg/news/20250502/202067581_300.jpg,대법원이 민주당 이재명 대선 후보의 공직선거법 위반 사건을 파기환송한 이후 정치권에선 거센 후폭풍이 불고 있습니다. 오늘 8시 뉴스에선 이 내용 집중적으로 전할 예정입니다.1.,2025.05.02 18:45,https://news.sbs.co.kr/news/endPage.do?news_id=N1008087345,SBS
명문팀 꺾은 방과후 클럽팀!? 용인시야구단이 증명 중인 '행복야구의 힘',https://img.sbs.co.kr/newimg/news/20250502/202067583_300.jpg,"예전과 달라졌다지만 아직 우리 학원 스포츠계에는 강압적이고 폭력적인 방식이 남아 있는 곳이 많은데요, 즐겁고 자유로운 분위기로 새 바람을 일으키…",2025.05.02 18:43,https://news.sbs.co.kr/news/endPage.do?news_id=N1008086996,SBS
"""판사 따위가 감히 대통령 고유 권한을 뺏어?"" 단단히 화난 트럼프…""이것 발동할 수도"" 소름 돋는 구상 '슥' 흘리자 (트럼프 NOW)",https://img.sbs.co.kr/newimg/news/20250502/202067549_300.jpg,트럼프 미국 행정부가 베네수엘라 이민자들 추방에 18세기 제정된 '적성국 국민법'을 적용한 것은 권한 남용이라는 미 연방법원의 첫…,2025.05.02 18:36,https://news.sbs.co.kr/news/endPage.do?news_id=N1008086705,SBS
완성차 5사 4월 판매량 68만 8천778대…작년 동월보다 2.4％ ↑,https://img.sbs.co.kr/newimg/news/20250429/202066356_300.jpg,"지난달 국내 완성차 5개 사의 글로벌 실적이 현대차·기아에 힘입어 플러스로 돌아섰습니다.현대차와 기아, 한국GM, 르노코리아, KG모빌리티에 따…",2025.05.02 18:32,https://news.sbs.co.kr/news/endPage.do?news_id=N1008087398,SBS
코스닥 상장사 인수해 수십억 횡령 후 15년 해외도피 60대 기소,https://img.sbs.co.kr/news/pc/thumb_v3.png,코스닥 상장회사를 인수한 뒤 자금 수십억 원을 횡령한 60대가 도피 생활 15년 만에 붙잡혀 구속돼 재판에 넘겨졌습니다.수원지검 성남지청 형사3…,2025.05.02 18:30,https://news.sbs.co.kr/news/endPage.do?news_id=N1008087399,SBS
