title,thumbnail,short_content,write_time,link,company
영국서 압수된 짝퉁 장난감 90%가 라부부…3/4은 안전검사 불합격,https://img.sbs.co.kr/newimg/news/20250611/202080628_300.jpg,올해 들어 영국 국경에서 압수된 수십억 원 규모의 '짝퉁' 장난감 대다수가 전 세계적으로 열풍이 분 중국 캐릭터 인형 라부부 모조…,2025.09.25 18:33,https://news.sbs.co.kr/news/endPage.do?news_id=N1008272634,SBS
"바나듐쌀 당뇨병 광고에…식약처 ""제도 개선, 엄정히 단속할 것""",https://img.sbs.co.kr/newimg/news/20250924/202113913_300.jpg,시중에 판매되고 있는 바나듐쌀이 당뇨병 치료와 예방에 효능이 있는 것처럼 소비자가 오인할 수 있는데도 단속할 법적 근거가 없다고 지적해 온 SB…,2025.09.25 18:32,https://news.sbs.co.kr/news/endPage.do?news_id=N1008272633,SBS
[속보] '비의료인 문신 시술 허용' 문신사법 국회 본회의 통과,https://img.sbs.co.kr/newimg/news/20250925/202114230_300.jpg,'비의료인 문신 시술 허용' 문신사법 국회 본회의 통과,2025.09.25 18:21,https://news.sbs.co.kr/news/endPage.do?news_id=N1008272610,SBS
강남 삼성역 사거리서 3중 추돌 사고…무면허 운전자 검거,https://img.sbs.co.kr/newimg/news/20250515/202071592_300.jpg,▲ 서울 강남경찰서서울 강남구 삼성역 사거리에서 3중 추돌 사고를 일으킨 무면허 화물차 운전자가 경찰에 붙잡혔습니다.서울 강남경찰서는…,2025.09.25 18:18,https://news.sbs.co.kr/news/endPage.do?news_id=N1008272613,SBS
"""경찰서 가본 적도 없었는데""…'횡령' 황정음, 1심 집행유예 선고에 눈물",https://img.sbs.co.kr/news/pc/thumb_v3.png,"자신이 운영하던 1인 기획사 자금을 횡령해 암호화폐에 투자한 혐의로 재판에 넘겨진 배우 황정음이 1심에서 집행유예를 선고받았다.제주지법 형사2부는 25일 특정경제범죄가중처벌법상 횡령 혐의로 기소된 황정음에게 징역 2년, 집행유예 4년을 선고했다.",2025.09.25 18:17,https://news.sbs.co.kr/news/endPage.do?news_id=N1008272517,SBS
"'북극성' 전지현X강동원, 서로 끌어안고 절벽서 뛰어내렸다…뜨겁게 치닫는 전개",https://img.sbs.co.kr/news/pc/thumb_v3.png,"디즈니+의 오리지널 시리즈 '북극성' 전지현과 강동원이 서로를 끌어안고 절벽에서 뛰어내렸다.유엔대사로서 국제적 명성을 쌓아온 '문주'가 대통령 후보 피격 사건의 배후를 쫓는 가운데, 그녀를 지켜야만 하는 국적불명의 특수요원 '산호'와 함께 한반도를 위협하는 거대한 진실을 마주하는 이야기를 그린 '북극성'이 지난 24일 6∼7회를 공개한 가운데, 뜨겁게 치닫는 전개를 향한 시청자들의 폭발적인 반응이 이어지고 있다.'북극성' 6∼7회에서는 베일에 싸여 있던 준익의 피격 사건의 전말이 서서히 드러나며 점점 더 흥미로워지는 전개로 궁금증을 고조시켰다.",2025.09.25 18:16,https://news.sbs.co.kr/news/endPage.do?news_id=N1008272210,SBS
"이수지 ""욕이나 '살 빼라'는 악플, 그냥 웃겨서 막 웃어…흡수 안 된다""",https://img.sbs.co.kr/news/pc/thumb_v3.png,개그우먼 이수지가 악플에 대한 견해를 밝혔다.25일 패션 매거진 '하퍼스 바자' 코리아는 이수지와 함께한 10월호 화보를 공개했다.,2025.09.25 18:16,https://news.sbs.co.kr/news/endPage.do?news_id=N1008272037,SBS
"안세영, 코리아오픈 8강행…서승재-김원호도 동반 진출",https://img.sbs.co.kr/news/pc/thumb_v3.png,▲ 안세영 선수2년 만에 안방 국제 대회 정상 탈환을 노리는 배드민턴 '세계 최강' 안세영이 여유 있게 코리아오픈 8강…,2025.09.25 18:14,https://news.sbs.co.kr/news/endPage.do?news_id=N1008272608,SBS
"조희대, 신임 법관 향해 ""헌법, 재판 독립 천명·법관 신분 보장""",https://img.sbs.co.kr/news/pc/thumb_v3.png,"▲ 조희대 대법원장이 25일 서울 서초구 대법원으로 출근하고 있다.조희대 대법원장이 오늘 신임 법관 임명식에서 ""우리 헌법은 …",2025.09.25 18:09,https://news.sbs.co.kr/news/endPage.do?news_id=N1008272600,SBS
"내란특검, 윤석열 30일 오전 10시 출석 재통보",https://img.sbs.co.kr/news/pc/thumb_v3.png,▲ 윤석열 전 대통령이 지난 7월 9일 서울중앙지방법원에서 구속 전 피의자 심문을 마치고 법원을 나서고 있다.12·3 비상계엄 관련 …,2025.09.25 18:04,https://news.sbs.co.kr/news/endPage.do?news_id=N1008272595,SBS
"""베트남 럼 서기장, 내달 북한 방문…김정은 만날 것""",https://img.sbs.co.kr/newimg/news/20250811/202099744_300.jpg,▲ 지난 8월 한·베트남 확대 정상회담에 참석한 또 럼 베트남 공산당 서기장베트남 1인자인 또 럼 베트남 공산당 서기장이 다음 달 북…,2025.09.25 17:54,https://news.sbs.co.kr/news/endPage.do?news_id=N1008272576,SBS
"""러시아 경제 끔찍하게 붕괴 중!"" ""유럽 안 부끄럽냐?"" 트럼프 분개하더니…""깜짝이야!"" 갑자기 입장 바꾼 이유 (트럼프 NOW)",https://img.sbs.co.kr/newimg/news/20250925/202114168_300.jpg,종전을 위해서는 우크라이나에 영토 일부를 포기해야 한다고 압박하던 트럼프 미국 대통령이 처음으로 '영토 탈환'을 언급한 이후 유럽…,2025.09.25 17:51,https://news.sbs.co.kr/news/endPage.do?news_id=N1008271769,SBS
[날씨] 제주 체감 33도…'역대 가장 늦은' 폭염주의보,https://img.sbs.co.kr/newimg/news/20250925/202114227_300.jpg,오늘 제주 해안가로는 역대 가장 늦은 폭염주의보가 내려졌습니다.고온 다습한 남풍의 영향으로 체감 온도가 33도 안팎까지 올랐습니다.충청 이남 지…,2025.09.25 17:49,https://news.sbs.co.kr/news/endPage.do?news_id=N1008272447,SBS
"보령시·SBS, '미디어파크 조성' 업무협약 체결…2028년 완공 목표",https://img.sbs.co.kr/newimg/news/20250925/202114224_300.jpg,"충남 보령시와 SBS, SBS A&T는 오늘 '미디어파크'조성을 위한 업무협약을 체결했습니다.이번 사업은 대규모 오픈세트장과 체험…",2025.09.25 17:47,https://news.sbs.co.kr/news/endPage.do?news_id=N1008272441,SBS
"식약처 ""임신부 타이레놀 복용 가능…하루 4천㎎ 이하로""",https://img.sbs.co.kr/news/pc/thumb_v3.png,"식품의약품안전처가 임신 중 해열·진통제 '타이레놀' 복용이 자폐아 위험을 높인다는 미국 정부의 발표와 관련해 ""기존 사용상…",2025.09.25 17:45,https://news.sbs.co.kr/news/endPage.do?news_id=N1008272440,SBS
"흑산공항 '여객 수요' 부풀려 선정…""108만→18만 명""",https://img.sbs.co.kr/news/pc/thumb_v3.png,감사원이 흑산공항의 여객 수요가 크게 부풀려 산정됐다는 결과를 발표했습니다.감사원은 국토부가 제시한 흑산공항의 2050년 여객 수요는 108만 …,2025.09.25 17:45,https://news.sbs.co.kr/news/endPage.do?news_id=N1008272430,SBS
"무역위, 일본·중국산 로봇에 최대 43.6% 잠정 덤핑방지관세 건의",https://img.sbs.co.kr/news/pc/thumb_v3.png,▲ 로보월드 2023 참가한 산업용 협동 로봇산업통상자원부 무역위원회는 일본·중국산 산업용 로봇에 대해 최대 43.6%의 잠정 덤핑방…,2025.09.25 17:43,https://news.sbs.co.kr/news/endPage.do?news_id=N1008272572,SBS
"'까만 반점 곳곳' 깨씨무늬병 확산…""벼 말라 죽인다""",https://img.sbs.co.kr/news/pc/thumb_v3.png,수확을 앞두고 일부 논에 벼 이삭과 줄기가 말라 버리는 깨씨무늬병이 번지고 있는데요. 지난해 발생한 벼멸구 피해 면적을 넘어설 것이라는 전망이 나오고 있습니다.,2025.09.25 17:42,https://news.sbs.co.kr/news/endPage.do?news_id=N1008272429,SBS
"포항상의, 결의문 채택…""철강·이차전지 산업 지원""",https://img.sbs.co.kr/news/pc/thumb_v3.png,포항상공회의소는 임시 의원총회를 열어 '경제위기 극복과 지역산업 발전을 위한 결의문'을 채택했습니다.포항상의 상공의원들은 결의문에…,2025.09.25 17:40,https://news.sbs.co.kr/news/endPage.do?news_id=N1008272428,SBS
"박도영, '메이저 대회' 하이트진로 챔피언십 첫날 단독 선두",https://img.sbs.co.kr/news/pc/thumb_v3.png,한국여자프로골프 투어 시즌 마지막 메이저 대회인 제25회 하이트진로 챔피언십에서 박도영 선수가 첫날 단독 선두에 올랐습니다.박도영은 경기도 여주…,2025.09.25 17:40,https://news.sbs.co.kr/news/endPage.do?news_id=N1008272561,SBS
22년 만에 울린 '성덕대왕신종'…천상의 소리 되살아나다,https://img.sbs.co.kr/newimg/news/20250925/202114211_300.jpg,속칭 에밀레종으로 국민적 사랑을 받아온 '국보 성덕대왕신종'이 어젯밤 공개 타종 됐습니다. 무려 22년 만에 선보인 타종 장면인데요.,2025.09.25 17:38,https://news.sbs.co.kr/news/endPage.do?news_id=N1008272425,SBS
"[글로벌D리포트] 얼굴은 '쏙' 빼고 ""왜 이게 여기에""…바이든 인지력 조롱?",https://img.sbs.co.kr/newimg/news/20250925/202114194_300.jpg,미 대통령 집무실 등이 있는 백악관 업무동 웨스트윙에서 로즈가든을 따라 본관 관저로 이어지는 회랑입니다.최근 이곳에 '대통령 명예의 거리…,2025.09.25 17:36,https://news.sbs.co.kr/news/endPage.do?news_id=N1008272499,SBS
"화장실은 하루 '3번만'…논란의 학교 규정, 이유는?",https://img.sbs.co.kr/newimg/news/20250925/202114208_300.jpg,<오! 클릭> 마지막 검색어는 '학교 화장실은 하루 3번만 사용'입니다.교직원들 앞에서 의견을 말하는 학생들 얼굴에 불만이 매우 …,2025.09.25 17:35,https://news.sbs.co.kr/news/endPage.do?news_id=N1008272420,SBS
"검찰, '미공개 정보로 시세 차익 의혹' 메리츠금융 압수수색",https://img.sbs.co.kr/newimg/news/20250925/202114210_300.jpg,메리츠화재 전직 사장 등이 미공개 정보를 이용해 주식을 사들여 시세 차익을 얻은 의혹에 대해 검찰이 강제 수사에 착수했습니다.서울남부지검 금융조…,2025.09.25 17:34,https://news.sbs.co.kr/news/endPage.do?news_id=N1008272553,SBS
"""비밀번호 공유""…SNS에 퍼진 '한국 여행 꿀팁' 뭐길래?",https://img.sbs.co.kr/news/pc/thumb_v3.png,최근 타이완의 한 누리꾼이 한국 서울 시내 건물에 있는 화장실을 무료로 이용할 수 있다는 문 비밀번호 목록을 공개해 논란이 되고 있습니다.<오!…,2025.09.25 17:30,https://news.sbs.co.kr/news/endPage.do?news_id=N1008272419,SBS
김건희 이어 윤석열 재판도…이번에는 처음부터 끝까지 중계 [스프],https://img.sbs.co.kr/news/pc/thumb_v3.png,어제 전 대통령 부인 김건희 씨가 재판 받는 장면을 동영상으로 볼 수 있었습니다. 재판부가 재판 앞부분 촬영을 언론에 허가했기 때문이죠. 내일은 윤석열 전 대통령이 재판 받는 장면을 동영상으로 볼 수 있을 것 같습니다.,2025.09.25 17:30,https://news.sbs.co.kr/news/endPage.do?news_id=N1008271691,SBS
"""삼시세끼 햄버거는 인권 침해""…'공항 난민' 문제 인권위에 진정",https://img.sbs.co.kr/news/pc/thumb_v3.png,▲ 25일 난민인권네트워크 등 인권단체가 김해공항 공항 난민 문제와 관련해 인권위에 진정을 제기하고 있다.부산 김해국제공항 출국 대기…,2025.09.25 17:30,https://news.sbs.co.kr/news/endPage.do?news_id=N1008272542,SBS
"갑자기 '푹'…식당서 뭉친 경찰들, 시민 살렸다",https://img.sbs.co.kr/news/pc/thumb_v3.png,<오! 클릭> 두 번째 검색어는 '쓰러진 시민 구한 경찰들'입니다.지난 18일 오후 전라북도 정읍의 한 식당 내부입니다.손님들이 …,2025.09.25 17:28,https://news.sbs.co.kr/news/endPage.do?news_id=N1008272418,SBS
"""고양이 공짜로 드려요""…회원 등록 사은품? '황당'",https://img.sbs.co.kr/news/pc/thumb_v3.png,SNS를 통해 오늘 하루 관심사와 누리꾼들의 반응을 알아보는 <오! 클릭> 시간입니다.요즘 워낙 운동시설이 많다 보니 회원을 유치하기 위한 홍보…,2025.09.25 17:26,https://news.sbs.co.kr/news/endPage.do?news_id=N1008272417,SBS
[오뉴스 출연] 카톡 업데이트 불편 논란 (박연미 경제평론가),https://img.sbs.co.kr/news/pc/thumb_v3.png,오늘의 이슈를 박연미 경제평론가와 함께 오뉴스에서 자세하게 알아봅니다.※,2025.09.25 17:21,https://news.sbs.co.kr/news/endPage.do?news_id=N1008272408,SBS
"[AFTER 8NEWS] 극비 '미국판 아이언돔' 오산에 '떡'…""한국은 항공모함"" 미군의 진심?",https://img.sbs.co.kr/newimg/news/20250925/202114182_300.jpg,미 육군이 경기도 오산에 있는 주한미군 제35 방공 포병여단에 IFPC 간접 화력 방어 능력이라는 신무기를 배치했습니다. 미군 해외 기지에 IFPC가 배치된 건 주한미군이 처음입니다.,2025.09.25 17:19,https://news.sbs.co.kr/news/endPage.do?news_id=N1008271868,SBS
"[자막뉴스] 네이버, 두나무 품었다…디지털 업계 지각 변동 신호?",https://img.sbs.co.kr/newimg/news/20250925/202114161_300.jpg,"국내 최대 가상자산 거래소 업비트를 운영하고 있는 두나무가, 네이버에 자회사로 완전 편입됩니다.네이버는 핀테크 자회사 네이버파이낸셜을 통해 두나…",2025.09.25 17:17,https://news.sbs.co.kr/news/endPage.do?news_id=N1008272446,SBS
"[현장영상] ""기어 조작 미숙"" 주차 후 미끄러져 내려가는 차량 잡아보지만…",https://img.sbs.co.kr/newimg/news/20250925/202114137_300.jpg,"운전자가 주차한 후 차에서 내리자마자 비탈길로 미끄러져 내려가는 차량. 가속이 붙더니 내리막을 달려 평상에 있던 노부부와 노점상을 덮쳤습니다. 차는 울타리를 들이받고 인근 밭으로 떨어졌는데요.이 사고로 노부부 중 남편은 숨지고, 아내와 상인이 크게 다쳤습니다.",2025.09.25 17:16,https://news.sbs.co.kr/news/endPage.do?news_id=N1008271865,SBS
추석 대목인데…고랭지 배추 출하 포기하는 강릉 안반데기 농민들,https://img.sbs.co.kr/newimg/news/20250925/202114184_300.jpg,▲ 추석 연휴 시작을 1주일여 앞둔 25일 강원 강릉시 왕산면 안반데기의 고랭지 배추가 재난 수준의 기후 영향으로 누렇게 변해 있다.…,2025.09.25 17:15,https://news.sbs.co.kr/news/endPage.do?news_id=N1008272533,SBS
인천 아파트 공사 현장서 60대 작업자 추락사,https://img.sbs.co.kr/news/pc/thumb_v3.png,오늘 오후 3시쯤 인천 계양구의 한 아파트 철거 공사 현장에서 60대 작업자가 추락해 숨졌습니다.이 작업자는 15m 높이에서 작업을 하다가 추락…,2025.09.25 17:14,https://news.sbs.co.kr/news/endPage.do?news_id=N1008272534,SBS
"[귀에빡종원] 또다시 탈원전?…""다른 나라만 좋은 일 시키는 겁니다"" (feat. 카이스트 정용훈 교수)",https://img.sbs.co.kr/news/pc/thumb_v3.png,"신규 원설 없이, 기존 원전 유지 쪽으로 가닥이 잡힌 듯한 대통령의 발언이 나오면서 '탈원전 시즌2'가 확정된 것 아니냐는 말 들…",2025.09.25 17:14,https://news.sbs.co.kr/news/endPage.do?news_id=N1008260298,SBS
"주한미군, '드론 요격 체계' 배치 확인…""지역 도전 대응""",https://img.sbs.co.kr/news/pc/thumb_v3.png,"미국의 최신 방어시스템인 'IFPC'가, 한국에 배치됐다는 SBS 보도에 대해 주한 미군이 공식 입장을 내놨습니다. 변화하는 안보 환경에 발맞춰 한미 동맹의 현대화를 진행하고, 지역 도전에 대응하고 있다는 건데요.",2025.09.25 17:12,https://news.sbs.co.kr/news/endPage.do?news_id=N1008272406,SBS
"내일 윤석열 피고인석 모습 공개된다…""중계·촬영 허가""",https://img.sbs.co.kr/news/pc/thumb_v3.png,특검 수사와 재판에 계속 불응해 온 윤석열 전 대통령이 내일 시작되는 체포영장 집행 방해 혐의 공판과 석방을 결정하는 보석 심문에는 출석하겠다고 밝혔습니다.,2025.09.25 17:11,https://news.sbs.co.kr/news/endPage.do?news_id=N1008272405,SBS
"94세 머독, 미드 '석세션' 소재 됐던 후계 정리 끝…틱톡 오너 될까? [이현식의 글로벌썰]",https://img.sbs.co.kr/news/pc/thumb_v3.png,"'SBS ' ■ ■ ■ 이현식 SBS 뉴스브리핑팀 기자● 드라마 방불하는 후계 다툼""94세 미디어 황제 루퍼트 머독, 최근에야 후계 다툼 종식""""두 아들 성향 정반대...보수우파 장남 vs 진보 리버럴 차남""""머독, 아들들 경쟁시키다 결국 장남 손 들어줘""● 우파 노인들이 '틱톡' 통제?""머독, 엘리슨과 함께 틱톡 미국 인수시 주요 주주로 떠올라""""미국, 틱톡의 알고리즘이 미국인들 여론에 큰 영향 준다 판단""● 초고령 '열정'의 비결은?""머독, 고령에도 열정적 활동...나이보다 젊은 외모""""열정적 활동이 건강 가능하게 해...닭과 달걀 같은 관계""""시진핑-푸틴, 최근 '150세 수명 가능성' 환담""""세계 최고 갑부와 권력자들, 인간 신체 '업그레이드' 과학에 관심▷ 편상욱 / 앵커 : 그리고 이 스타게이트 발표하고 바로 그 다 음 달에 또 트럼프 대통령이 오버로피스 집무실에서 행정명령 서명을 하는데 저 자리에도 지금 사진 뒤편에 보시면 래비 엘리슨이 있죠.",2025.09.25 17:09,https://news.sbs.co.kr/news/endPage.do?news_id=N1008272085,SBS
정부조직법 개편안 본회의 상정…필리버스터 맞불,https://img.sbs.co.kr/news/pc/thumb_v3.png,"검찰청 폐지를 핵심으로 하는 정부조직법 개정안이 국회 본회의 안건으로 올라갔습니다. 여야는 본회의 직전까지 막판 협상을 벌였지만, 합의에 이르지 못했습니다.",2025.09.25 17:07,https://news.sbs.co.kr/news/endPage.do?news_id=N1008272403,SBS
