title,thumbnail,short_content,write_time,link,company
"""김상민 도우면 장관"" 주장에…김 여사 측 ""명백한 허위""",https://static.sbsdlab.co.kr/image/thumb_default.png,"윤석열 대통령 부부 공천 개입 의혹 핵심 인물 명태균 씨가 연일 김건희 여사에 대한 폭로를 이어가고 있습니다. 오늘은 지난해 총선 앞두고 김 여사가 김영선 전 의원에게, 검사 출신의 김상민 후보를 당선되게 도와주면 장관 자리를 주겠다고 말했다는 주장을 폈습니다.",2025.02.20 20:22,https://news.sbs.co.kr/news/endPage.do?news_id=N1007992798,SBS
"[단독] 여인형 메모, 이재명 측근도 등장…체포 고려했나",https://static.sbsdlab.co.kr/image/thumb_default.png,오늘 헌재 증인으로 나왔던 홍장원 전 국정원 차장에게 계엄 당일 이른바 '체포 명단'을 불러준 걸로 지목된 사람이 바로 여인형 전 방첩사령관입니다.,2025.02.20 20:18,https://news.sbs.co.kr/news/endPage.do?news_id=N1007992796,SBS
"오전엔 법원, 오후엔 헌재…윤 동선 따라 몰려간 지지자들",https://static.sbsdlab.co.kr/image/thumb_default.png,"방금 보셨던 헌법재판소 앞에서는 오늘 낮부터 탄핵에 반대하는 대통령 지지자들이 모여들었습니다. 지금은 어떤지 현장 나가있는 취재기자를 연결해 보도록 하겠습니다.신용일 기자, 방금 전해드린 것처럼 아직 변론이 끝나지를 않았는데, 집회도 그럼 계속 이어지고 있습니까? 저녁 늦게까지 증인 신문이 계속 이어지면서 윤 대통령 지지자들도 자리를 뜨지 않고 집회를 이어가고 있습니다.",2025.02.20 20:16,https://news.sbs.co.kr/news/endPage.do?news_id=N1007992794,SBS
윤 첫 형사재판 13분 만에 종료…구속취소 심문엔 공방,https://static.sbsdlab.co.kr/image/thumb_default.png,"앞서 잠시 보신 거처럼 윤 대통령은 탄핵 심판에 앞서 오늘 오전 대통령으로서는 헌정사상 처음으로, 형사재판 법정에 섰습니다. 첫 재판은 13분 만에 끝났습니다.",2025.02.20 20:13,https://news.sbs.co.kr/news/endPage.do?news_id=N1007992795,SBS
"윤 ""홍장원 메모는 탄핵 공작…통화를 체포지시로 엮어""",https://static.sbsdlab.co.kr/image/thumb_default.png,"오늘 오후 3시에 시작된 대통령 탄핵 심판 변론은 지금까지 계속 이어지고 있습니다. 헌법재판소에 나가 있는 취재기자 연결해서 자세한 내용 알아보겠습니다.이현영 기자, 한덕수 총리가 나왔을 때 잠시 자리를 비웠던 윤 대통령이 다음 증인 때는 다시 돌아와서 이야기를 꽤 많이 하고 있던데 주로 어떤 내용이었습니까.",2025.02.20 20:11,https://news.sbs.co.kr/news/endPage.do?news_id=N1007992792,SBS
"3분 만에 퇴정한 윤…한덕수, 국무회의 '흠결' 거듭 증언",https://static.sbsdlab.co.kr/image/thumb_default.png,오늘 변론에는 한덕수 국무총리도 증인으로 나왔습니다. 윤 대통령은 총리의 말을 듣고 있는 게 부적절하다며 자리를 떠났습니다. 한 총리는 계엄 직전 열렸던 국무회의가 절차적으로 흠결이 있어서 국무회의보다는 간담회에 가까웠다는 기존 입장을 거듭 확인했습니다.민경호 기자입니다.,2025.02.20 20:08,https://news.sbs.co.kr/news/endPage.do?news_id=N1007992791,SBS
"[영상] 홍장원 답변 가만히 들으며 두 번 '피식' 비웃은 윤 대통령…""그 메모로 어떤 정치적 입지를 만들 수 있죠?""",https://img.sbs.co.kr/newimg/news/20250220/202042333_300.jpg,"오늘 헌법재판소에서 열린 윤석열 대통령 탄핵심판 10차 변론기일에 홍장원 전 국정원 1차장이 증인으로 출석했습니다.""정치적 입지를 만들기…",2025.02.20 20:06,https://news.sbs.co.kr/news/endPage.do?news_id=N1007992831,SBS
"""메모 진술 다르다"" CCTV 공개…이틀 전 말 바꾼 홍장원",https://img.sbs.co.kr/newimg/news/20250220/202042329_300.jpg,오늘 열린 윤 대통령 탄핵심판 변론에 홍장원 전 국정원 1차장이 다시 증인으로 나왔습니다. 이에 앞서 여당은 국정원 CCTV를 공개하며 홍 전 차장이 이른바 체포 명단이 담긴 메모를 썼다고 한 장소가 거짓이라고 주장했습니다.,2025.02.20 20:05,https://news.sbs.co.kr/news/endPage.do?news_id=N1007992790,SBS
"[영상] ""대통령이랑 그런 얘기할 사이가 됩니까?""…'충심' 주장한 홍장원에게 재판관이 물은 '의아한 점'",https://img.sbs.co.kr/newimg/news/20250220/202042331_300.jpg,오늘 헌법재판소에서 열린 윤석열 대통령 탄핵심판 10차 변론기일에 홍장원 전 국정원 1차장이 증인으로 출석했습니다.김형두 재판관은 이날 홍 전 …,2025.02.20 20:04,https://news.sbs.co.kr/news/endPage.do?news_id=N1007992834,SBS
"[바로이뉴스] ""국정원 CCTV, 오차 보정 필요한데 선별적 공개하고 있죠?"" ""네""",https://img.sbs.co.kr/newimg/news/20250220/202042319_300.jpg,"윤석열 대통령의 탄핵심판 10차 변론에 증인으로 출석한 홍장원 전 국정원 1차장은 국정원이 CCTV 시간을 보정하지 않았고, 선별적으로 공개하고…",2025.02.20 19:59,https://news.sbs.co.kr/news/endPage.do?news_id=N1007992852,SBS
"[단독] 기억 못한 복명, 조용한 철수…""방 폭파"" 707단장 해명 (풀영상)",https://static.sbsdlab.co.kr/image/thumb_default.png,"비상계엄 때 국회에 출동했던 707 특수임무단의 텔레그램 단체 대화방 내용, 저희가 어제 단독으로 전해 드렸습니다. 보도가 나간 뒤 김현태 특임단장은 저희 취재진에게 실제 운영했던 대화방이라며 그 존재를 인정했습니다.",2025.02.20 19:58,https://news.sbs.co.kr/news/endPage.do?news_id=N1007992789,SBS
"[단독] 계엄 대화방 있었는데…""생성 안 했다"" 거짓 해명",https://static.sbsdlab.co.kr/image/thumb_default.png,김현태 특임단장은 텔레그램 단체대화방을 계엄 상황이 끝난 뒤에 폭파했다고 말했습니다. 특임단은 계엄 당시 SNS 단체대화방이 있었느냐는 야당 의…,2025.02.20 19:56,https://news.sbs.co.kr/news/endPage.do?news_id=N1007992788,SBS
[단독] '조용한 루트로 들어간다' 해놓고 국회 철수?,https://static.sbsdlab.co.kr/image/thumb_default.png,"저희 취재진은 김현태 단장에게 국회에 조용한 루트로 들어가는 방법을 확인하고 있다는 단체대화방의 글이 무슨 의미인지도 물어봤습니다. 여기에 대해서 김 단장은 국회에서 병력을 철수하는 방법을 뜻한 거라고 해명했는데, 그럼 당시 상황은 실제로 어땠는지도 짚어보겠습니다.이어서 최재영 기자의 단독 보도입니다.",2025.02.20 19:55,https://news.sbs.co.kr/news/endPage.do?news_id=N1007992787,SBS
"[단독] 707단장 ""'의원 차단' 사령관 지시 적은 것""",https://static.sbsdlab.co.kr/image/thumb_default.png,"비상계엄 때 국회에 출동했던 707 특수임무단의 텔레그램 단체 대화방 내용, 저희가 어제 단독으로 전해 드렸습니다. 보도가 나간 뒤 김현태 특임단장은 저희 취재진에게 실제 운영했던 대화방이라며 그 존재를 인정했습니다.",2025.02.20 19:50,https://news.sbs.co.kr/news/endPage.do?news_id=N1007992786,SBS
미 국무 이어 재무장관도 G20 불참 결정,https://static.sbsdlab.co.kr/image/thumb_default.png,"▲ 스콧 베센트 미국 재무장관트럼프 미국 대통령이 관세와 우크라이나전 종전협상 등에서 잇따라 동맹을 무시한 행보를 보이는 가운데 트럼프 행정부의 장관급 인사들이 주요 글로벌 다자무대에 잇따라 불참을 통보했습니다.스콧 베센트 미국 재무장관은 현지시간 26일부터 이틀간 남아프리카공화국에서 열리는 주요 20개국 재무장관·중앙은행장 회의에 불참한다고 밝혔습니다.베센트 장관은 현지시간 19일 엑스에 올린 글에서 워싱턴에서 해야 할 일들 때문에 G20 회의에 참석하지 못한다면서, 다른 고위 당국자가 대신 참석할 예정이라고 전했습니다.일각에서는 트럼프 대통령이 이달 중으로 푸틴 러시아 대통령과 만날 수 있다고 밝힌 점에 주목하고 베센트 장관이 미러 정상회담 준비 때문에 G20 회의에 불참하는 것 아니냐는 관측이 나오고 있습니다.앞서 마코 루비오 미 국무장관도 20∼21일 남아공에서 열리는 G20 외교장관 회의에 참석하지 않기로 했습니다.루비오 장관은 G20 외교장관 회의 불참 사유로 남아공 정부가 추진하는 토지 몰수 정책과 회의 의제를 꼽았습니다.루비오 장관은 ""남아공은 매우 나쁜 짓들을 하고 있다.",2025.02.20 19:46,https://news.sbs.co.kr/news/endPage.do?news_id=N1007992851,SBS
"[바로이뉴스] 메모 4차례나 작성한 이유는…""이름 잊지 않기 위해""",https://static.sbsdlab.co.kr/image/thumb_default.png,윤석열 대통령의 탄핵심판 10차 변론에 증인으로 출석한 홍장원 전 국정원 1차장은 탄핵 심판의 핵심 증거인 '체포 명단 메모'를 …,2025.02.20 19:46,https://news.sbs.co.kr/news/endPage.do?news_id=N1007992775,SBS
"[바로이뉴스] ""위증한 거야?"" ""아니!?"" 체포명단 메모 놓고 격돌",https://img.sbs.co.kr/newimg/news/20250220/202042282_300.jpg,윤석열 대통령의 탄핵심판 10차 변론에 증인으로 출석한 홍장원 전 국정원 1차장은 탄핵 심판의 핵심 증거인 '체포 명단 메모'를 …,2025.02.20 19:39,https://news.sbs.co.kr/news/endPage.do?news_id=N1007992765,SBS
"여자축구, 핑크레이디스컵 1차전 승리",https://img.sbs.co.kr/newimg/news/20250220/202042306_300.jpg,▲ 우즈베키스탄전 선발 출전 선수신상우 감독이 이끄는 여자 축구대표팀이 아랍에미리트에서 열리는 6개국 친선대회 첫 경기에서 우즈베키스…,2025.02.20 19:39,https://news.sbs.co.kr/news/endPage.do?news_id=N1007992843,SBS
"[바로이뉴스] ""자기도 못 알아보는데 보좌관이 다시 써?""…메모 작성 경위 추궁하는 윤석열 대통령 측 대리인",https://img.sbs.co.kr/newimg/news/20250220/202042286_300.jpg,윤석열 대통령의 탄핵심판 10차 변론에 증인으로 출석한 홍장원 전 국정원 1차장에 대해 '메모 작성' 경위에 대해 집중 심리가 이뤄졌습니다.,2025.02.20 19:38,https://news.sbs.co.kr/news/endPage.do?news_id=N1007992762,SBS
"[바로이뉴스] '씨익' 웃은 홍장원 ""윤 대통령이 차장님을 거짓말쟁이로 묘사하는데…""",https://img.sbs.co.kr/newimg/news/20250220/202042309_300.jpg,"윤석열 대통령의 탄핵심판 10차 변론에 증인으로 출석한 홍장원 전 국정원 1차장이 귀갓길에 기자들과 만나 질의응답을 가졌습니다. 한 기자가 ""윤 대통령이 차장님을 거짓말하는 사람으로 묘사할 때 기분이 어땠나""라는 질문을 던졌습니다.",2025.02.20 19:38,https://news.sbs.co.kr/news/endPage.do?news_id=N1007992846,SBS
"[바로이뉴스] ""공터야? 사무실이야?"" ""이 추운데 밖에서 메모를 해?""…왔다 갔다 '체포조 메모' 진술 따져 묻는 윤석열 대통령 측 대리인",https://static.sbsdlab.co.kr/image/thumb_default.png,윤석열 대통령의 탄핵심판 10차 변론에 증인으로 출석한 홍장원 전 국정원 1차장이 탄핵 심판의 핵심 증거인 '체포 명단' 작성 과정에 대한 진술을 정정할 필요가 있다고 밝혔습니다.,2025.02.20 19:37,https://news.sbs.co.kr/news/endPage.do?news_id=N1007992754,SBS
"[바로이뉴스] ""탄핵을 공작한 게 문제다""…윤석열 대통령 작심 발언",https://static.sbsdlab.co.kr/image/thumb_default.png,"윤석열 대통령의 탄핵심판 10차 변론에서, 윤석열 대통령이 다시 입정해 직접 발언했습니다. 홍장원 전 차장이 ""탄핵을 공작한 게 문제&#…",2025.02.20 19:37,https://news.sbs.co.kr/news/endPage.do?news_id=N1007992850,SBS
"[바로이뉴스] ""공관 앞 아니고 운전 중이던데?"" ""진술 정정 필요성 느낀다""",https://static.sbsdlab.co.kr/image/thumb_default.png,윤석열 대통령의 탄핵심판 10차 변론에 증인으로 출석한 홍장원 전 국정원 1차장은 탄핵 심판의 핵심 증거인 '체포 명단' 작성 과정에 대한 진술을 정정할 필요가 있다고 밝혔습니다.,2025.02.20 19:37,https://news.sbs.co.kr/news/endPage.do?news_id=N1007992744,SBS
오늘의 SBS 8뉴스 예고 (2월 20일),https://static.sbsdlab.co.kr/image/thumb_default.png,"잠시 후 <SBS 8뉴스> 에서는▶ 윤석열 대통령, 현직 대통령 사상 첫 형사재판 출석...70여 분 '묵묵부답' …",2025.02.20 19:29,https://news.sbs.co.kr/news/endPage.do?news_id=N1007992771,SBS
"여야정 국정협의회 116분 만에 종료…""추후 계속 논의""",https://static.sbsdlab.co.kr/image/thumb_default.png,"▲ 최상목 대통령 권한대행 부총리 겸 기획재정부 장관과 우원식 국회의장, 국민의힘 권영세 비상대책위원장, 더불어민주당 이재명 대표가 …",2025.02.20 19:28,https://news.sbs.co.kr/news/endPage.do?news_id=N1007992841,SBS
건물주 원픽 됐다는 다이소 근황 ㄷㄷ / 스브스뉴스,https://static.sbsdlab.co.kr/image/thumb_default.png,여러분이 만약 건물주가 되었다면어떤 점포를 입점시킬 건가요?최근 '건물주의 꿈'이라고 불리던스타벅스 입점의 인기가 한풀 꺾이고다이…,2025.02.20 19:23,https://news.sbs.co.kr/news/endPage.do?news_id=N1007992844,SBS
"최 대행 ""반도체법 지체할 시간 없어…근로시간특례 포함돼야""",https://img.sbs.co.kr/newimg/news/20250220/202042302_300.jpg,▲ 최상목 대통령 권한대행 부총리가 20일 오후 국회 사랑재에서 열린 여야정 국정협의회 첫 회의에서 발언을 하고 있다.최상목 대통령 …,2025.02.20 19:22,https://news.sbs.co.kr/news/endPage.do?news_id=N1007992835,SBS
"하마스, 이스라엘 인질 시신 4구 넘겨…10개월 유아도",https://img.sbs.co.kr/newimg/news/20250220/202042301_300.jpg,▲ 20일 오전 팔레스타인 무장정파 하마스가 가자지구 남부 칸유니스에 설치된 무대에 이스라엘 인질 시신 4구를 올려놓고 행사 중이다.…,2025.02.20 19:20,https://news.sbs.co.kr/news/endPage.do?news_id=N1007992828,SBS
인천 상가주택서 불…70대 여성 사망,https://img.sbs.co.kr/newimg/news/20250220/202042299_300.jpg,▲ 불 난 상가주택인천 상가주택에서 불이 나 70대 여성이 숨졌습니다.오늘 오후 4시 27분쯤 중구 신흥동 상가주택 3층에서 불이 났…,2025.02.20 19:20,https://news.sbs.co.kr/news/endPage.do?news_id=N1007992827,SBS
"피겨 이시형, 어깨 탈골 부상…사대륙·세계선수권 출전 무산",https://img.sbs.co.kr/newimg/news/20250220/202042297_300.jpg,▲ 피겨스케이팅 이시형이 19일 서울 목동아이스링크에서 열린 국제빙상경기연맹 사대륙선수권대회 공식 연습에서 연기하고 있다.피겨스케이팅…,2025.02.20 19:12,https://news.sbs.co.kr/news/endPage.do?news_id=N1007992781,SBS
"봉준호 ""계엄 극복한 국민 자랑스러워…남은 건 법적 절차""",https://static.sbsdlab.co.kr/image/thumb_default.png,"▲ 20일 서울 강남구 메가박스 코엑스점에서 열린 영화 '미키 17' 기자간담회에서 봉준호 감독이 질문에 답하고 있다.봉준호 감독이 12·3 비상계엄 사태에 대해 ""이미 극복했다고 생각한다""며 ""남은 건 법적, 형식적 절차라고 생각한다""고 20일 말했습니다.봉 감독은 이날 서울 메가박스 코엑스에서 열린 '미키 17' 기자간담회에서 계엄 사태에 관한 생각을 묻자 ""우리가 지금 이렇게 영화 기자회견을 하고 있다.",2025.02.20 19:02,https://news.sbs.co.kr/news/endPage.do?news_id=N1007992780,SBS
"[영상] 재판관 '슥' 보며 ""여기서 4명 탄핵된다면!""…'벌떡' 일어나 마이크 잡고 던진 '돌발 질문'에",https://static.sbsdlab.co.kr/image/thumb_default.png,"오늘 윤석열 대통령 탄핵심판 10차 변론기일이 진행되고 있습니다. 증인으로 한덕수 국무총리, 홍장원 전 국정원 1차장, 조지호 전 경찰청장이 출…",2025.02.20 19:00,https://news.sbs.co.kr/news/endPage.do?news_id=N1007992560,SBS
"[단독] 707단장 '의원 차단' 글…""사령관 지시 공유한 것""",https://static.sbsdlab.co.kr/image/thumb_default.png,"김현태 특전사 707특임단장이 비상계엄 당일 특임단 텔레그램 대화방에 의원들을 차단하라는 글을 올린 데 대해 ""사령관 지시를 공유한 것&…",2025.02.20 18:56,https://news.sbs.co.kr/news/endPage.do?news_id=N1007992797,SBS
"마크 러팔로 ""'미키 17' 속 독재자, 특정인 연상되지 않길""",https://static.sbsdlab.co.kr/image/thumb_default.png,"▲ 20일 서울 강남구 메가박스 코엑스점에서 열린 영화 '미키 17' 기자간담회에서 배우 마크 러팔로가 포즈를 취하고 있다.배우 마크 러팔로가 영화 '미키 17'에서 자신이 맡은 독재자 마셜이 도널드 트럼프 미국 대통령 등 특정 정치인을 떠올리게 한다는 평가에 대해 ""특정인을 연상시키지 않기를 바란다""고 20일 말했습니다.러팔로는 이날 서울 메가박스 코엑스에서 열린 '미키 17' 기자간담회에서 ""다양한 인물들이 의도적으로 들어갔다""며 ""말할 때 인물의 악센트나 말하는 방식을 바꿨다.",2025.02.20 18:55,https://news.sbs.co.kr/news/endPage.do?news_id=N1007992778,SBS
"블랙핑크, 7월 고양서 새 월드투어 출발",https://static.sbsdlab.co.kr/image/thumb_default.png,▲ 블랙핑크걸그룹 블랙핑크가 7월 5∼6일 고양종합운동장 주 경기장을 시작으로 새 월드투어를 시작합니다.20일 YG엔터테인먼트…,2025.02.20 18:55,https://news.sbs.co.kr/news/endPage.do?news_id=N1007992777,SBS
국립심포니의 진혼곡…베르디 '레퀴엠' 3월 공연,https://static.sbsdlab.co.kr/image/thumb_default.png,▲ 베르디 '레퀴엠' 공연국립심포니오케스트라가 다음 달 9일 예술의 전당 콘서트홀에서 베르디의 '레퀴엠'…,2025.02.20 18:50,https://news.sbs.co.kr/news/endPage.do?news_id=N1007992774,SBS
"""촌철살인의 통찰""…서울시극단, 코미디극 '코믹' 3월 공연",https://img.sbs.co.kr/newimg/news/20250220/202042280_300.jpg,서울시극단은 올해 시즌 개막작으로 코미디극 '코믹'을 다음 달 28일부터 4월 20일까지 세종문화회관 M씨어터에서 선보인다고 20…,2025.02.20 18:44,https://news.sbs.co.kr/news/endPage.do?news_id=N1007992773,SBS
'중국산 후판' 저가 수출에…'반덤핑' 관세 부과 건의,https://img.sbs.co.kr/newimg/news/20250220/202042276_300.jpg,▲ 현대제철 후판 생산 모습정부가 중국산 후판에 최대 38%의 관세를 부과하기로 하면서 최근 5년 새 악화해온 중국의 '저가 …,2025.02.20 18:25,https://news.sbs.co.kr/news/endPage.do?news_id=N1007992752,SBS
"'8강 확정' 한국 축구, U-20 아시안컵 조별리그 한일전 1-1 비겨",https://img.sbs.co.kr/newimg/news/20250220/202042274_300.jpg,이창원호가 2025 아시아축구연맹 아시안컵 조별리그 최종전에서 성사된 '한일전'에서 종료 직전에 나온 김태원의 '극장 동점…,2025.02.20 18:21,https://news.sbs.co.kr/news/endPage.do?news_id=N1007992747,SBS
"박지원 ""북한 비핵화 3단계론 제안…핵보유국 인정해야""",https://img.sbs.co.kr/newimg/news/20250220/202042273_300.jpg,"▲ 더불어민주당 박지원 의원민주당 박지원 의원은 '한반도 비핵화를 위한 3단계론'을 거론하며 ""첫 번째로 북한을…",2025.02.20 18:20,https://news.sbs.co.kr/news/endPage.do?news_id=N1007992742,SBS
"고진영, 혼다 LPGA 타일랜드 첫날 공동 4위",https://static.sbsdlab.co.kr/image/thumb_default.png,▲ 고진영의 벙커샷이번 주 태국에서 열리는 미국여자프로골프 투어 대회 '혼다 LPGA 타일랜드'에서 고진영 선수가 첫날…,2025.02.20 18:18,https://news.sbs.co.kr/news/endPage.do?news_id=N1007992741,SBS
"'친노' 이광재 ""이재명, 정도로 가고 있다…실용주의로 가야""",https://static.sbsdlab.co.kr/image/thumb_default.png,"▲ 이광재 전 강원지사친노 인사로 분류되는 이광재 전 강원지사는 오늘 페이스북에 올린 글에서, ""이념은 이상이고, 실용은 현실""이라며 ""이념을 넘어 실용주의의 길을 가야 한다.",2025.02.20 18:16,https://news.sbs.co.kr/news/endPage.do?news_id=N1007992737,SBS
영·프 정상 다음 주 미국 방문…'우크라전·관세' 트럼프 설득,https://static.sbsdlab.co.kr/image/thumb_default.png,▲ 키어 스타머 영국 총리와 마크롱 프랑스 대통령영국과 프랑스 정상이 다음 주 백악관을 찾아 도널드 트럼프 대통령을 만나기로 해 주목…,2025.02.20 18:13,https://news.sbs.co.kr/news/endPage.do?news_id=N1007992736,SBS
"형사재판에, 탄핵심판에…윤 대통령의 긴 하루 [스프]",https://static.sbsdlab.co.kr/image/thumb_default.png,"오늘 놓치지 말아야 할 이슈, 퇴근길에 보는 이브닝 브리핑에 있습니다. 윤 대통령이 현직 대통령으로는 처음으로 형사재판의 피고인으로 법정에 출석했습니다.",2025.02.20 18:12,https://news.sbs.co.kr/news/endPage.do?news_id=N1007992160,SBS
[바로이뉴스] '계엄 늑장 해제' 비밀 '인물별 동선' 따져 묻자,https://static.sbsdlab.co.kr/image/thumb_default.png,"오늘 윤석열 대통령 탄핵심판 10차 변론기일이 진행되고 있습니다.증인으로 한덕수 국무총리, 홍장원 전 국정원 1차장, 조지호 전 경찰청장이 출석…",2025.02.20 18:12,https://news.sbs.co.kr/news/endPage.do?news_id=N1007992609,SBS
"[바로이뉴스] 여야정 국정협의회 첫 개최…우원식 ""죽을힘 다해 결실 내놔야""",https://static.sbsdlab.co.kr/image/thumb_default.png,"여야정 국정협의회 첫 회의가 오늘 오후 국회 사랑재에서 열렸습니다.최상목 대통령 권한대행과 권영세 국민의힘 비대위원장, 이재명 더불어민주당 대표…",2025.02.20 18:07,https://news.sbs.co.kr/news/endPage.do?news_id=N1007992738,SBS
