title,thumbnail,short_content,write_time,link,company
"한밤중 고속도로 걷던 남성, 주행 차량에 치여 사망",https://img.sbs.co.kr/newimg/news/20241025/201999920_300.jpg,고속도로 1차선을 걸어가던 한 남성이 달리던 차량에 부딪혀 숨지는 사고가 발생했습니다.오늘 밤 10시 20분쯤 대전 유성구 하기동 호남고속도로지…,2025.02.20 23:59,https://news.sbs.co.kr/news/endPage.do?news_id=N1007992964,SBS
'강제 입맞춤' 전 스페인 축구협회장 1심 벌금형,https://img.sbs.co.kr/newimg/news/20230914/201833606_300.jpg,▲ 루이스 루비알레스 전 스페인 축구협회장여자 축구선수에게 강제로 입맞춤해 물의를 빚은 루이스 루비알레스 전 스페인 축구협회장이 20…,2025.02.20 23:43,https://news.sbs.co.kr/news/endPage.do?news_id=N1007992958,SBS
"""미, 우크라 지지·러 규탄 유엔 결의안 공동발의 거부""",https://img.sbs.co.kr/newimg/news/20241128/202012357_300.jpg,▲ 볼로디미르 젤렌스키 우크라이나 대통령과 트럼프 대통령침공당한 우크라이나 대신 러시아를 옹호하는 미국 도널드 트럼프 행정부가 러시아…,2025.02.20 23:41,https://news.sbs.co.kr/news/endPage.do?news_id=N1007992957,SBS
"25일 변론종결 예고…국회 측 ""끝까지 최선"" 윤 측 ""최종변론 준비""",https://img.sbs.co.kr/newimg/news/20250220/202042414_300.jpg,"▲ 정청래 국회 법제사법위원장헌법재판소가 윤석열 대통령 탄핵심판의 변론을 오는 25일 끝내기로 하자 국회 측은 다행스러운 일이라며 ""파면의 순간까지 최선을 다하겠다""고 했습니다.윤 대통령 측은 최종 변론과 관련한 입장은 법정에서 밝히겠다며 선고 결과 승복 여부에 대해 ""시작부터 끝까지 법치 테두리 내에서 법 절차에 따라 이뤄져야 한다""고 말했습니다.문형배 헌재소장 권한대행은 오늘 탄핵심판 10차 변론에서 ""오는 25일 양측 대리인의 종합 변론과 최종 의견을 듣겠다""며 변론 종결을 예고했습니다.탄핵 소추위원인 정청래 국회 법제사법위원장은 이날 변론이 끝난 뒤 취재진과 만나 ""윤 대통령 탄핵심판의 끝이 보이는 것 같다""며 ""파면의 그 순간까지 최선을 다하겠다""고 말했습니다.이어 ""윤석열 대통령을 파면시키기에 필요충분한 조건이 이미 성숙했다""며 ""지금 국민들께서 가장 원하는 게 신속한 파면이라고 생각한다면 다음 주 화요일에 최종 변론이 잡힌 건 다행스러운 일""이라고 덧붙였습니다.더불어민주당 최기상 의원도 ""대통령을 파면하는 데 필요한 정도가 100이라고 한다면 소추위원 측은 1000 정도를 충분히 증명했다고 판단된다""고 말했습니다.그는 ""대통령이 아직 반성하지 않는데 이런 사람이 복귀한다면 나라가 더 불안해지고 자신을 반대하던 국민과 언론을 어떻게 대할지 아주 우려스럽다""며 ""헌재에서 신속한 결정을 통해 국민들께서 평화로운 새봄을 맞이할 수 있도록 마무리를 잘하겠다""고 말했습니다.국회 대리인단 장순욱 변호사는 ""변호사는 끝까지 재판을 낙관하면 안 된다.",2025.02.20 23:33,https://news.sbs.co.kr/news/endPage.do?news_id=N1007992956,SBS
"조지호 ""윤 전화 받은 건 맞지만 계엄사령관에 협조 안 해""",https://static.sbsdlab.co.kr/image/thumb_default.png,"▲ 윤 대통령의 탄핵 심판 10차 변론서 발언하는 조지호 경찰청장조지호 경찰청장은 비상계엄이 해제된 후 윤석열 대통령이 전화해 '덕분에 신속히 잘 끝났다'고 말한 데 대해 ""질책으로 받아들이지는 않았다""고 밝혔습니다.조 청장은 오늘 윤 대통령 탄핵심판 10차 변론에 출석해 비상계엄 해제 이후인 지난해 12월 4일 새벽 윤 대통령과 주고받은 통화 내용에 대해 증언했습니다.조 청장은 ' 대략적 취지는 김봉식 전 서울경찰청장이 초동 대처를 잘하고 잘 들여보내 줘서 잘 끝났다는 취지가 맞느냐'는 윤 대통령 측 이동찬 변호사 질문에 ""신속하게, 덕분에 신속히 잘 끝났다.",2025.02.20 23:30,https://news.sbs.co.kr/news/endPage.do?news_id=N1007992955,SBS
윤 탄핵심판 25일 변론종결…3월 중순 선고 전망,https://static.sbsdlab.co.kr/image/thumb_default.png,▲ 윤 대통령 탄핵심판 10차 변론기일헌법재판소가 윤석열 대통령 탄핵심판의 변론을 오는 25일 종결하기로 했습니다.국회가 지난해 12…,2025.02.20 22:47,https://news.sbs.co.kr/news/endPage.do?news_id=N1007992945,SBS
체코서 10대 칼부림에 여성 2명 사망,https://static.sbsdlab.co.kr/image/thumb_default.png,20일 오전 체코에서 흉기 공격으로 2명이 숨졌습니다.사건은 오전 8시 30분쯤 수도 프라하에서 동쪽으로 약 110km 떨어진 흐라데츠크랄로베 …,2025.02.20 22:25,https://news.sbs.co.kr/news/endPage.do?news_id=N1007992940,SBS
[바로이뉴스] 홍장원 '메모 추궁' 내내 '씨익'…표정으로 말하는 김계리 변호사,https://static.sbsdlab.co.kr/image/thumb_default.png,"윤석열 대통령 탄핵심판 10차 변론기일에서 홍장원 전 국정원 1차장 상대 '메모 신빙성' 추궁하는 내내, 김계리 변호사가 알 수 …",2025.02.20 22:15,https://news.sbs.co.kr/news/endPage.do?news_id=N1007992871,SBS
"삼성화재, 한국전력 3대 0 꺾고 5위 수성",https://static.sbsdlab.co.kr/image/thumb_default.png,"▲ 득점 후 기뻐하는 삼성화재 선수들남자 프로배구 삼성화재가 원정에서 한국전력을 무너뜨리고 5위 자리를 지켰고, 여자부 한국도로공사는…",2025.02.20 22:04,https://news.sbs.co.kr/news/endPage.do?news_id=N1007992929,SBS
"[바로이뉴스] ""아픈데 계엄 명확히 기억하나"" 진술 의심에 ""섬망 증상은 없어""",https://static.sbsdlab.co.kr/image/thumb_default.png,"윤석열 대통령 탄핵심판 10차 변론기일에 증인으로 출석한 조지호 전 경찰청장은 윤 대통령 측으로부터 ""건강이 좋지 않은데 계엄 당시 상황…",2025.02.20 21:58,https://news.sbs.co.kr/news/endPage.do?news_id=N1007992924,SBS
"강이슬 29점·통산 5천 득점…여자농구 KB, 4위로 PO 막차",https://img.sbs.co.kr/newimg/news/20250220/202042405_300.jpg,▲ KB의 강이슬과 송윤하여자프로농구 청주 KB가 정규리그 4위를 확정하며 마지막 플레이오프행 티켓을 거머쥐었습니다.KB는 오늘 용인…,2025.02.20 21:56,https://news.sbs.co.kr/news/endPage.do?news_id=N1007992926,SBS
"[바로이뉴스] ""죄송하다""며 답을 피하던 체포조 '키맨' 조지호, 비상계엄 당시 내란이라는 생각을 조금이라도 했느냐 묻자, 짧게 답했다",https://img.sbs.co.kr/newimg/news/20250220/202042403_300.jpg,"윤석열 대통령 탄핵심판 10차 변론기일에서 조지호 전 경찰청장은 대부분 질문에 ""공소사실과 관련된다""며 답을 피했습니다. 다만, …",2025.02.20 21:49,https://news.sbs.co.kr/news/endPage.do?news_id=N1007992888,SBS
"[바로이뉴스] 윤석열 대통령 ""덕분에 잘 끝났어""…'뼈 발언' 캐묻는 김형두 재판관",https://img.sbs.co.kr/newimg/news/20250220/202042395_300.jpg,윤석열 대통령 탄핵심판 10차 변론 기일에서 체포조 '키맨' 조지호 전 경찰청장이 '뼈있는 발언'에 대한 경위를 밝…,2025.02.20 21:47,https://news.sbs.co.kr/news/endPage.do?news_id=N1007992898,SBS
"'삼각편대 47점' 도로공사, 셧아웃 승리…기업은행 5연패",https://img.sbs.co.kr/newimg/news/20250220/202042402_300.jpg,▲ 득점 후 기뻐하는 도로공사 선수들여자 프로배구 한국도로공사가 IBK기업은행을 5연패 수렁으로 밀어 넣었습니다.도로공사는 20일 화…,2025.02.20 21:44,https://news.sbs.co.kr/news/endPage.do?news_id=N1007992923,SBS
"[영상] ""기억 안 난다고요? 보여 드려요?""…홍장원 답변에 변호인들 '씨익' 웃자 윤 대통령도 궁금해 하더니",https://static.sbsdlab.co.kr/image/thumb_default.png,오늘 헌법재판소에서 열린 윤석열 대통령 탄핵심판 10차 변론기일에 홍장원 전 국정원 1차장이 증인으로 출석했습니다.홍장원 전 차장의 답변에 윤 …,2025.02.20 21:44,https://news.sbs.co.kr/news/endPage.do?news_id=N1007992864,SBS
"[영상] ""덕분에 잘 끝났다"" 윤 대통령의 말? 조지호 ""인간적으로 죄송해서""…""두 차례 전화 받고도 협조 안 했죠?"" 묻자",https://static.sbsdlab.co.kr/image/thumb_default.png,"윤석열 대통령 탄핵심판 10차 변론기일에 출석한 조지호 경찰청장이 오늘 12·3 비상계엄 사태 다음 날인 지난해 12월 4일 윤석열 대통령에게 전화로 ""수고했다""는 내용을 들었다고 밝혔습니다.",2025.02.20 21:38,https://news.sbs.co.kr/news/endPage.do?news_id=N1007992894,SBS
"[바로이뉴스] 윤석열 대통령 ""건강 빨리 회복하시길 바랍니다""…조지호 전 청장 ""감사합니다""",https://static.sbsdlab.co.kr/image/thumb_default.png,"윤석열 대통령 탄핵심판 10차 변론기일에 출석한 증인 조지호 전 경찰청장에게 윤 대통령이 ""건강 빨리 회복하시길 바랍니다""라고 말…",2025.02.20 21:38,https://news.sbs.co.kr/news/endPage.do?news_id=N1007992913,SBS
"[바로이뉴스] ""국회 단전·단수 지시는 없었어…국회 '셧' 하라는 맥락 기억해""",https://static.sbsdlab.co.kr/image/thumb_default.png,"윤석열 대통령 탄핵심판 10차 변론기일에서 조지호 전 경찰청장은 대부분 질문에 ""공소사실과 관련된다""며 답을 피했습니다. 국회 측…",2025.02.20 21:36,https://news.sbs.co.kr/news/endPage.do?news_id=N1007992911,SBS
클로징,https://static.sbsdlab.co.kr/image/thumb_default.png,들으신 것처럼 당분간은 한겨울 추위가 계속 된다고 하니까 외출하실 때 단단히 챙겨 입으셔야겠습니다.8시 뉴스 마칩니다. 고맙습니다.,2025.02.20 21:29,https://news.sbs.co.kr/news/endPage.do?news_id=N1007992826,SBS
[날씨] 봄은 언제쯤 오나…내일 아침도 찬바람 '쌩쌩',https://static.sbsdlab.co.kr/image/thumb_default.png,연일 계속되는 늦겨울 강추위에 따뜻한 봄 날씨 기다리는 분들 많으시죠.기상학적으로 일평균 기온이 5도 이상 올라간 후에 다시 떨어지지 않을 때 …,2025.02.20 21:29,https://news.sbs.co.kr/news/endPage.do?news_id=N1007992825,SBS
40살 슈퍼스타의 슬램덩크…동료들도 입이 '떡',https://img.sbs.co.kr/newimg/news/20250220/202042385_300.jpg,"NBA, LA 레이커스의 40살 슈퍼스타 르브론 제임스가 나이를 잊은 슬램덩크를 선보였습니다.동료들도 놀라서 입을 다물지 못하네요.",2025.02.20 21:27,https://news.sbs.co.kr/news/endPage.do?news_id=N1007992824,SBS
귀화 후 첫 댄스…6위로 출발,https://img.sbs.co.kr/newimg/news/20250220/202042384_300.jpg,4대륙 피겨선수권 아이스 댄스 첫날 임해나-권예 조가 6위에 올랐습니다.최근 귀화 절차를 마무리한 캐나다 출신 권예는 한국 국적으로는 처음 국제…,2025.02.20 21:25,https://news.sbs.co.kr/news/endPage.do?news_id=N1007992823,SBS
'극장골'로 극적인 무승부…'조 1위' 8강 진출,https://img.sbs.co.kr/newimg/news/20250220/202042383_300.jpg,13년 만에 아시아 정상에 도전하는 20세 이하 축구대표팀이 일본과 극적인 무승부를 거두고 조 1위로 8강에 올랐습니다.이미 2연승으로 8강행을…,2025.02.20 21:24,https://news.sbs.co.kr/news/endPage.do?news_id=N1007992822,SBS
"음바페, 환상 해트트릭…이강인도 챔스리그 16강행",https://img.sbs.co.kr/newimg/news/20250220/202042382_300.jpg,현역 최고의 공격수로 꼽히는 레알 마드리드 음바페가 맨시티를 상대로 해트트릭을 작성하며 챔피언스리그 16강 진출을 이끌었습니다. 파리 생제르맹 …,2025.02.20 21:24,https://news.sbs.co.kr/news/endPage.do?news_id=N1007992821,SBS
올해도 달린다!…드론 활용 '이색 훈련',https://static.sbsdlab.co.kr/image/thumb_default.png,"프로야구 LG는 염경엽 감독 부임 이후, 틈만 나면 도루를 시도하는 발야구로 유명하죠. 요즘 스프링캠프에서도 열심히 발야구를 가다듬고 있는데, 야구장에서 보기 힘든 장비들까지 활용되고 있다네요.애리조나에서 배정훈 기자입니다.",2025.02.20 21:24,https://news.sbs.co.kr/news/endPage.do?news_id=N1007992820,SBS
'쯔양 공갈 혐의' 구제역 징역 3년 법정구속,https://static.sbsdlab.co.kr/image/thumb_default.png,1천만 명 넘는 구독자를 보유한 유튜버 쯔양을 협박해 수천만 원을 뜯어낸 혐의로 기소된 유튜버 '구제역'에 대한 1심에서 법원이 …,2025.02.20 21:23,https://news.sbs.co.kr/news/endPage.do?news_id=N1007992885,SBS
"생명연 ""항원 검사 도입…영장류 관리체계 강화""",https://static.sbsdlab.co.kr/image/thumb_default.png,"실험용 원숭이 수백 마리가 치명적인 B 바이러스 감염이 의심되는데도 당국에 알리지 않는 등 처리 과정에 문제가 있었다는 SBS 보도와 관련해, …",2025.02.20 21:22,https://news.sbs.co.kr/news/endPage.do?news_id=N1007992819,SBS
'가습기 살균제' 정부 출연 몫 6월까지 결정,https://static.sbsdlab.co.kr/image/thumb_default.png,"가습기살균제 참사와 관련해 SBS가 지난달 보도한 피해구제기금 정부 출연에 대해, 김완섭 환경부 장관이 정부 용역 결과를 바탕으로 오는 6월까지…",2025.02.20 21:21,https://news.sbs.co.kr/news/endPage.do?news_id=N1007992818,SBS
"트럼프, 침략국에 '선물 보따리'…젤렌스키엔 ""독재자""",https://static.sbsdlab.co.kr/image/thumb_default.png,러시아와 밀착 행보를 보이고 있는 트럼프 미국 대통령이 젤렌스키 우크라이나 대통령을 독재자라고 불러 파문이 일고 있습니다. 젤렌스키 대통령은 트럼프가 러시아가 만든 허위 정보에 살고 있다고 강하게 반발했습니다.곽상은 특파원의 보도입니다.,2025.02.20 21:21,https://news.sbs.co.kr/news/endPage.do?news_id=N1007992816,SBS
2년 걸릴 연구 하루에…'한국형 챗GPT' 키운다,https://static.sbsdlab.co.kr/image/thumb_default.png,"최근 중국이 미국 빅테크 수준의 AI 모델 딥시크를 내놓으며, 전 세계에 충격을 준 가운데 한국의 자체 AI 모델은 미국이나 중국에 비해 뒤처져…",2025.02.20 21:19,https://news.sbs.co.kr/news/endPage.do?news_id=N1007992815,SBS
"[바로이뉴스] 국회의원 체포조 핵심 질문에…조지호 경찰청장  ""죄송""",https://img.sbs.co.kr/newimg/news/20250220/202042396_300.jpg,"윤석열 대통령 탄핵심판 10차 변론기일에 증인으로 출석한 조지호 전 경찰청장은 대부분 질문에 ""공소사실과 관련된다""며 답을 피했습…",2025.02.20 21:19,https://news.sbs.co.kr/news/endPage.do?news_id=N1007992878,SBS
제일 많이 일해도 가장 가난…굴레에 갇힌 한국 노인들,https://img.sbs.co.kr/newimg/news/20250220/202042372_300.jpg,"초고령사회를 직면한 우리나라가 고민해야 할 문제, 오늘도 짚어보겠습니다. 한국 노인들은 OECD 국가 가운데 가장 열심히 일하면서도 가장 가난한 역설적 상황에 처해있는데요.",2025.02.20 21:18,https://news.sbs.co.kr/news/endPage.do?news_id=N1007992814,SBS
"교황 병세 공개 꺼리는 교황청…""대중 우려 고려해 더 솔직해야""",https://img.sbs.co.kr/newimg/news/20250220/202042387_300.jpg,▲ 프란치스코 교황폐렴 진단을 받고 일주일째 입원 중인 프란치스코 교황의 상태에 대한 교황청의 명쾌하지 않은 설명이 뜬소문을 부채질하…,2025.02.20 21:14,https://news.sbs.co.kr/news/endPage.do?news_id=N1007992893,SBS
"윤 대통령 ""방첩사령관 동향파악 시도 불필요…체포 지시 아냐""",https://img.sbs.co.kr/newimg/news/20250220/202042392_300.jpg,▲ 윤석열 대통령이 20일 서울 종로구 헌법재판소에서 열린 윤 대통령 탄핵 심판 10차 변론에 출석해 있다.윤석열 대통령이 12·3 …,2025.02.20 21:14,https://news.sbs.co.kr/news/endPage.do?news_id=N1007992901,SBS
"[바로이뉴스] ""재판 중"" 답 피하더니…검찰 진술 사실이냐 묻자 '맞습니다' 칼답",https://static.sbsdlab.co.kr/image/thumb_default.png,"윤석열 대통령 탄핵심판 10차 변론기일에 증인으로 출석한 조지호 전 경찰청장은 대부분 질문에 ""공소사실과 관련된다""며 답을 피했습…",2025.02.20 21:14,https://news.sbs.co.kr/news/endPage.do?news_id=N1007992877,SBS
'중국산 후판' 저가 수출에…최대 38% 반덤핑 관세 부과,https://static.sbsdlab.co.kr/image/thumb_default.png,트럼프는 수입 철강에 대해서는 당장 다음 달부터 높은 관세를 부과하겠다고 일찌감치 예고했죠. 이걸 앞두고 우리 정부가 중국산 두꺼운 철판 후판에 대해 많게는 38%의 관세를 매기기로 했습니다.,2025.02.20 21:14,https://news.sbs.co.kr/news/endPage.do?news_id=N1007992813,SBS
"트럼프 ""자동차·반도체 한 달 안에""…당겨진 관세 시간표",https://static.sbsdlab.co.kr/image/thumb_default.png,미국 트럼프 행정부가 들어선 지 한 달이 지났습니다. 취임하자마자 관세 폭탄으로 연일 전 세계를 뒤흔들고 있는 트럼프는 이번에는 원래 예고했던 것과 달리 '한 달 안에' 우리 주력 수출 품목인 자동차와 반도체에 대한 관세를 발표하겠다며 시간표를 앞당기고 나섰습니다.김용태 특파원의 보도입니다.,2025.02.20 21:12,https://news.sbs.co.kr/news/endPage.do?news_id=N1007992812,SBS
하루 78명 목숨 잃었다…폭풍이 부른 '죽음의 나비효과',https://static.sbsdlab.co.kr/image/thumb_default.png,"2월도 끝을 향해 가는데 추위가 여전합니다. 다음 주 초까지는 이렇게 계속 춥다가 그 이후에나 날이 좀 풀릴 것으로 예상됩니다. 그런데 우리뿐 아니라, 아시아 주변 나라에도 2월에 매서운 한파가 찾아왔습니다.그 이유가 뭘지, 서동균 기자가 분석했습니다.",2025.02.20 21:12,https://news.sbs.co.kr/news/endPage.do?news_id=N1007992811,SBS
"[바로이뉴스] ""계엄날, 보통의 날과 같았다"" 까맣게 몰랐다는 탄핵심판 '키맨'",https://static.sbsdlab.co.kr/image/thumb_default.png,"윤석열 대통령 탄핵심판 10차 변론기일에 증인으로 출석한 조지호 전 경찰청장은 대부분 질문에 ""공소사실과 관련된다""며 답을 피했습…",2025.02.20 21:09,https://news.sbs.co.kr/news/endPage.do?news_id=N1007992876,SBS
철골 드러났는데 '사용 승인'?…발인 미룬 유족들,https://static.sbsdlab.co.kr/image/thumb_default.png,"얼마 전 불이 난 부산 리조트의 시공사가 지난해 12월 당시, 공사가 진행 중이었는데도 건물이 다 지어진 뒤에 나오는 사용승인을 받았던 것으로 확인됐습니다.",2025.02.20 21:02,https://news.sbs.co.kr/news/endPage.do?news_id=N1007992809,SBS
"착륙중 여객기 뒤집힌 델타항공, 승객당 4천300만 원 보상금 제시",https://img.sbs.co.kr/newimg/news/20250220/202042380_300.jpg,▲ 캐나다 토론토 피어슨 국제공항에 델타항공 비행기가 뒤집혀있다.캐나다 토론토 공항 착륙과정에서 여객기가 전복됐던 미국 델타항공이 피…,2025.02.20 21:00,https://news.sbs.co.kr/news/endPage.do?news_id=N1007992892,SBS
"일기장 보니 ""계획범행 무게""…치료 중 웃음? ""사실무근""",https://img.sbs.co.kr/newimg/news/20250220/202042361_300.jpg,경찰이 초등학생 김하늘 양을 숨지게 한 교사의 일기장을 확보해 사전에 범행을 준비한 정황을 파악하고 있습니다. 중환자실에서 계속 치료를 받고 있…,2025.02.20 20:59,https://news.sbs.co.kr/news/endPage.do?news_id=N1007992808,SBS
"윤 탄핵심판 25일 변론종결…헌재, 3월 중순 선고 가능성",https://img.sbs.co.kr/newimg/news/20250220/202042214_300.jpg,▲ 윤석열 대통령이 20일 서울 종로구 헌법재판소에서 열린 윤 대통령 탄핵 심판 10차 변론에 출석해 있다.윤석열 대통령 탄핵심판을 …,2025.02.20 20:55,https://news.sbs.co.kr/news/endPage.do?news_id=N1007992887,SBS
광주 팬들 앞 '전두환 사진'…경기 2시간 전 한국서 짐쌌다,https://img.sbs.co.kr/newimg/news/20250220/202042357_300.jpg,지난주 중국에서 열린 우리나라와 중국의 프로축구팀 경기에서 일부 관중이 전두환과 김정은의 사진을 펼쳐 들어서 논란이 일었습니다. 중국에 원정 응원 갔던 한국 팬들을 도발하려고 한 겁니다.,2025.02.20 20:48,https://news.sbs.co.kr/news/endPage.do?news_id=N1007992807,SBS
"잔혹 살인 후 피묻은 족적…""99% 일치"" 20년 만에 잡았다",https://static.sbsdlab.co.kr/image/thumb_default.png,"지난 2004년 강원도 영월에서 한 남성이 숨진 채 발견됐습니다. 오랫동안 풀리지 않던 사건이었는데, 과학수사를 바탕으로 특정된 용의자가 지난해 재판에 넘겨졌고, 오늘 1심에서 무기징역이 선고됐습니다.자세한 내용, G1방송 정창영 기자가 전하겠습니다.",2025.02.20 20:48,https://news.sbs.co.kr/news/endPage.do?news_id=N1007992806,SBS
약 먹고 잠든 아이 숨진 채 발견…부모는 PC방서 게임,https://static.sbsdlab.co.kr/image/thumb_default.png,태어난 지 23개월 된 아기가 아파트에서 숨진 채 발견됐습니다. 아기의 부모는 아파서 약 먹고 잠든 아기를 홀로 집에 둔 채 PC방에 가서 게임을 하고 있었던 걸로 조사됐습니다.김태원 기자가 취재했습니다.,2025.02.20 20:42,https://news.sbs.co.kr/news/endPage.do?news_id=N1007992805,SBS
"접속 막힌 딥시크, 맥에 통째로 깔 수 있다? / 오목교 전자상가",https://static.sbsdlab.co.kr/image/thumb_default.png,"AI 업계에서 ‘스푸트니크 쇼크’로 불리는 중국산 AI, ‘딥시크 R1’이 글로벌 기술 시장에 던진 충격이 심상치 않습니다.",2025.02.20 20:40,https://news.sbs.co.kr/news/endPage.do?news_id=N1007992879,SBS
"여야정 모여 ""추경 필요 공감""…반도체법·연금개혁 '빈손'",https://static.sbsdlab.co.kr/image/thumb_default.png,"여야 대표와 국회의장, 대통령 권한대행이 국정 현안을 논의하기 위해 오늘 한자리에 모였습니다. 그동안 여야가 첨예하게 맞서온 현안들에 이번에는 …",2025.02.20 20:34,https://news.sbs.co.kr/news/endPage.do?news_id=N1007992801,SBS
"조지호, 탄핵심판서 ""공소사실 관련 증언 못 해""…답변 거부",https://static.sbsdlab.co.kr/image/thumb_default.png,▲ 12·3 비상계엄 사태 관련 내란 혐의를 받는 조지호 경찰청장이 지난해 12월 13일 오후 서울중앙지법에서 열린 구속 전 피의자 …,2025.02.20 20:33,https://news.sbs.co.kr/news/endPage.do?news_id=N1007992873,SBS
"이재명, 친기업 행보…'중도 보수' 놓고 논란 가열",https://static.sbsdlab.co.kr/image/thumb_default.png,조기 대선을 염두에 둔 듯한 행보를 이어가고 있는 이재명 민주당 대표가 오늘 기업 현장을 찾아 다시금 성장을 강조했습니다. 민주당 정체성이 &#…,2025.02.20 20:30,https://news.sbs.co.kr/news/endPage.do?news_id=N1007992799,SBS
"어깨 수술했던 롯데 최준용, 팔꿈치 미세 손상으로 조기 귀국",https://img.sbs.co.kr/newimg/news/20250220/202042355_300.jpg,▲ 1차 스프링캠프에서 훈련하는 롯데 최준용프로야구 롯데 자이언츠의 오른손 불펜 투수 최준용이 팔꿈치 인대 미세 손상 부상으로 개막전…,2025.02.20 20:30,https://news.sbs.co.kr/news/endPage.do?news_id=N1007992868,SBS
"""보좌관이 한동훈 친구 아닌가""…윤 측, '홍장원 메모' 공격",https://img.sbs.co.kr/newimg/news/20250220/202042347_300.jpg,▲ 홍장원 전 국가정보원 제1차장이 지난 4일 서울 종로구 헌법재판소에서 열린 윤석열 대통령 탄핵심판 5차 변론기일에 증인으로 출석해…,2025.02.20 20:30,https://news.sbs.co.kr/news/endPage.do?news_id=N1007992867,SBS
"김문수 ""故오요안나 사건, 용납 안돼""…야당과 계엄 설전",https://img.sbs.co.kr/newimg/news/20250220/202042343_300.jpg,"범여권 잠룡으로 불리는 김문수 고용노동부 장관이, 오늘 국회에 출석했습니다. 김 장관은 MBC 기상캐스터 고 오요안나 씨가 숨진 사건에 대해 ""우리 사회가 용납할 수 없는 일""이라 밝혔는데, 야당 의원들과는 계엄을 놓고 설전을 벌이기도 했습니다.박예린 기자의 보도입니다.",2025.02.20 20:29,https://news.sbs.co.kr/news/endPage.do?news_id=N1007992800,SBS
"헌재 주변 지지자 집결…전광훈 ""대통령 복귀시키라""",https://img.sbs.co.kr/newimg/news/20250220/202042344_300.jpg,▲ 20일 윤석열 대통령 탄핵 심판 10차 변론기일이 열리는 서울 종로구 헌법재판소 인근에서 윤 대통령의 지지자들이 탄핵 반대 집회를…,2025.02.20 20:24,https://news.sbs.co.kr/news/endPage.do?news_id=N1007992866,SBS
