title,thumbnail,short_content,write_time,link,company
"한덕수 측, 후보 변경 무산에 ""국민·당원 뜻 겸허히 수용""",https://img.sbs.co.kr/newimg/news/20250510/202069783_300.jpg,"▲ 한덕수 후보한덕수 대통령선거 예비후보 측은 국민의힘 대선 후보 변경이 무산된 데 대해 ""한덕수 후보자는 국민과 당원의 뜻을…",2025.05.10 23:43,https://news.sbs.co.kr/news/endPage.do?news_id=N1008095527,SBS
국힘 당원 투표서 '한덕수로 후보 변경' 안건 부결,https://img.sbs.co.kr/newimg/news/20250508/202069076_300.jpg,국민의힘은 오늘 대선 후보자를 한덕수 후보로 교체하는 안건을 두고 찬반 투표를 진행한 결과 부결됐다고 밝혔습니다.국민의힘은 안건 부결로 김문수…,2025.05.10 23:34,https://news.sbs.co.kr/news/endPage.do?news_id=N1008095524,SBS
국힘 당원투표 '한덕수로 후보 변경' 부결…김문수 후보 회복,https://img.sbs.co.kr/newimg/news/20250510/202069695_300.jpg,▲ 국민의힘 김문수 대선후보와 무소속 한덕수 대선 예비후보가 8일 서울 국회 사랑재에 위치한 커피숍에서 회동을 마친 후 인사하고 있다…,2025.05.10 23:32,https://news.sbs.co.kr/news/endPage.do?news_id=N1008095523,SBS
[속보] '한덕수 후보 변경' 안건 부결…김문수 후보 자격 회복,https://img.sbs.co.kr/newimg/news/20250510/202069825_300.jpg,▲ 회동 마치고 인사하는 김문수-한덕수'한덕수 후보 변경' 안건 부결...김문수 후보 자격 회복,2025.05.10 23:25,https://news.sbs.co.kr/news/endPage.do?news_id=N1008095520,SBS
"'무력 충돌' 인도-파키스탄, 극적 휴전 합의",https://img.sbs.co.kr/news/pc/thumb_v3.png,▲ 파키스탄의 드론 공격으로 피해를 입은 인도의 건물전면전 직전까지 치달으며 무력 충돌을 이어온 인도와 파키스탄이 극적으로 휴전에 합…,2025.05.10 22:59,https://news.sbs.co.kr/news/endPage.do?news_id=N1008095515,SBS
속초 방파제서 60대 부부 추락…40여 분 만에 구조,https://img.sbs.co.kr/news/pc/thumb_v3.png,▲ 방파제 추락한 60대 부부 구조강원 속초시 방파제에서 60대 부부가 추락했다가 해경과 소방에 의해 구조됐습니다.속초해양경찰서 등에…,2025.05.10 22:36,https://news.sbs.co.kr/news/endPage.do?news_id=N1008095512,SBS
"남자 400ｍ계주팀, 광저우 세계육상릴레이에서 한국 신기록",https://img.sbs.co.kr/news/pc/thumb_v3.png,▲ 남자 400m 계주 1조 예선에서 경기를 마친 대한민국의 고승환과 이재성이 함께 환호하고 있다.한 국 육상 남자 400ᦇ…,2025.05.10 22:03,https://news.sbs.co.kr/news/endPage.do?news_id=N1008095508,SBS
"김문수·한덕수 측, 후보교체 사태 속 단일화 협상…이견만 재확인",https://img.sbs.co.kr/news/pc/thumb_v3.png,▲ 국민의힘 김문수 대선후보와 한덕수 예비후보가 지난 8일 서울 국회 사랑재에 위치한 커피숍에서 회동을 가졌다.국민의힘 김문수 대선 …,2025.05.10 21:54,https://news.sbs.co.kr/news/endPage.do?news_id=N1008095506,SBS
"트럼프 ""인도-파키스탄, 미 중재로 즉각 휴전 합의""",https://img.sbs.co.kr/news/pc/thumb_v3.png,▲ 도널드 트럼프 미국 대통령보복전을 이어오던 인도와 파키스탄이 미국의 중재로 휴전에 합의했다고 트럼프 미국 대통령이 밝혔습니다.트럼…,2025.05.10 21:51,https://news.sbs.co.kr/news/endPage.do?news_id=N1008095505,SBS
"국민의힘 ""한덕수 후보등록, 선거법 위반 아냐…선관위 확인""",https://img.sbs.co.kr/news/pc/thumb_v3.png,▲ 한덕수 대선 예비후보국민의힘은 오늘 중앙선거관리위원회로부터 한덕수 대선 예비후보가 후보등록 기간에 입당해 후보로 등록해도 법 위반…,2025.05.10 21:49,https://news.sbs.co.kr/news/endPage.do?news_id=N1008095504,SBS
"프로야구 한화, 33년 만에 11연승 질주",https://img.sbs.co.kr/newimg/news/20250510/202069821_300.jpg,▲ 10일 키움을 꺾고 11연승을 거둔 한화 선수단프로야구 한화가 무려 33년 만에 11연승을 내달렸습니다.한화는 서울 구로구 고척스…,2025.05.10 21:48,https://news.sbs.co.kr/news/endPage.do?news_id=N1008095502,SBS
"컴파운드 양궁 베테랑 최용희, 올해 첫 월드컵서 2위",https://img.sbs.co.kr/newimg/news/20250510/202069820_300.jpg,▲ 최용희 은메달 획득2028 LA 올림픽 정식종목이 된 컴파운드 양궁의 베테랑 최용희가 올해 처음 출전한 월드컵에서 2위에 올랐습니…,2025.05.10 21:47,https://news.sbs.co.kr/news/endPage.do?news_id=N1008095501,SBS
"우크라 ""러시아와 최소 30일 조건없는 휴전 준비돼""",https://img.sbs.co.kr/newimg/news/20250510/202069819_300.jpg,▲ 우크라에 모인 유럽 정상들우크라이나가 오는 12일부터 최소 30일 동안 러시아와 조건 없이 휴전할 준비가 돼 있다고 밝혔습니다.안…,2025.05.10 21:18,https://news.sbs.co.kr/news/endPage.do?news_id=N1008095492,SBS
클로징,https://img.sbs.co.kr/newimg/news/20250510/202069814_300.jpg,오늘 준비한 소식은 여기까지입니다.시청해 주신 여러분 고맙습니다.,2025.05.10 21:09,https://news.sbs.co.kr/news/endPage.do?news_id=N1008095440,SBS
[날씨] 내일 아침까지 짙은 안개…낮부터 포근,https://img.sbs.co.kr/news/pc/thumb_v3.png,종일 쌀쌀한 하루였죠.오늘 밤까지는 중부 내륙에 약한 비가 조금 더 이어지겠고요.강한 바람도 내일은 잠잠해지겠습니다.다만 밤사이 안개가 짙어지겠…,2025.05.10 21:09,https://news.sbs.co.kr/news/endPage.do?news_id=N1008095439,SBS
"이호재, 아버지처럼 강력 슛…수원FC 제압한 포항",https://img.sbs.co.kr/news/pc/thumb_v3.png,프로축구 포항이 수원FC를 2대 0으로 제압했는데요.이호재 선수가 '캐넌 슈터'로 유명했던 아버지 이기형 감독처럼 강력한 슛으로 …,2025.05.10 21:07,https://news.sbs.co.kr/news/endPage.do?news_id=N1008095437,SBS
"""피치에서 만나요""…손흥민 복귀 임박",https://img.sbs.co.kr/news/pc/thumb_v3.png,발 부상에서 회복 중인 토트넘의 손흥민 선수가 SNS로 복귀가 임박했음을 알렸습니다.빠르면 내일 밤 리그 경기 출전도 가능합니다.토트넘이 유로파…,2025.05.10 21:05,https://news.sbs.co.kr/news/endPage.do?news_id=N1008095436,SBS
'최고 선수 초청 대회' 우승…국제 대회 4연승,https://img.sbs.co.kr/news/pc/thumb_v3.png,한국 높이뛰기의 간판 우상혁 선수가 세계 최고 선수들만 초대받은 이벤트 대회에서 정상에 올랐습니다. 최근 4개 대회 연속 우승의 급상승세입니다.…,2025.05.10 21:05,https://news.sbs.co.kr/news/endPage.do?news_id=N1008095435,SBS
"진격의 한화, '33년 만에 11연승'",https://img.sbs.co.kr/news/pc/thumb_v3.png,21세기에 한 번도 없었던 프로야구 선두 한화의 '불패 행진'이 계속됐습니다. 키움을 완파하고 무려 33년 만에 11연승을 질주했…,2025.05.10 21:04,https://news.sbs.co.kr/news/endPage.do?news_id=N1008095433,SBS
트랙터 상경시위 경찰에 저지…교통혼잡,https://img.sbs.co.kr/news/pc/thumb_v3.png,서울 도심 시위에 참석하기 위해 트랙터를 몰고 상경한 전국농민회총연맹이 도로진입을 막은 경찰에 가로막혔습니다.오늘 오전 트랙터 32대를 몰고 경…,2025.05.10 21:03,https://news.sbs.co.kr/news/endPage.do?news_id=N1008095427,SBS
이제 1시간 배송까지…불붙은 '퀵커머스',https://img.sbs.co.kr/newimg/news/20250510/202069806_300.jpg,"온라인, 오프라인 할 것 없이 유통업체들의 배송 속도 경쟁에 불이 붙고 있습니다. 장을 보면 한 시간도 안 돼서 집으로 배달해 주는 퀵커머스 서비스에 기업들이 속속 뛰어들고 있습니다.유덕기 기자입니다.",2025.05.10 21:03,https://news.sbs.co.kr/news/endPage.do?news_id=N1008095421,SBS
"아들 곁에 농약 20병…치매 노모 돌보다 ""인생 포기했다""",https://img.sbs.co.kr/newimg/news/20250510/202069803_300.jpg,"간병에 지쳐 무너지는 가족들의 일상, 연속보도해드리고 있습니다. 오늘은 환자를 돌보던 가족이 오히려 심각한 우울증 환자가 되는 현실을 짚어봅니다.가족들의 정신 건강을 위한 대책은 없는지, 정성진 기자가 취재했습니다.",2025.05.10 20:59,https://news.sbs.co.kr/news/endPage.do?news_id=N1008095420,SBS
서로 미사일 퍼부었다…인도·파키스탄 말리는 국제사회,https://img.sbs.co.kr/newimg/news/20250510/202069797_300.jpg,카슈미르 테러 이후 인도와 파키스탄 간 미사일 보복전이 격화하면서 갈등이 폭발 직전까지 치닫고 있습니다. 전면전 우려 속에서 국제사회도 본격적인 중재에 나섰습니다.윤창현 기자의 보도입니다.,2025.05.10 20:48,https://news.sbs.co.kr/news/endPage.do?news_id=N1008095418,SBS
"김효주, LET 아람코 챔피언십 2R 단독 선두…박성현도 12위",https://img.sbs.co.kr/newimg/news/20250510/202069818_300.jpg,▲ 김효주의 1라운드 경기 모습김효주가 유러피언투어 아람코 챔피언십 2년 연속 우승 가능성을 부풀렸습니다.김효주는 경기도 고양시 뉴코…,2025.05.10 20:42,https://news.sbs.co.kr/news/endPage.do?news_id=N1008095471,SBS
"옥태훈, KPGA 클래식 2R도 단독 선두",https://img.sbs.co.kr/news/pc/thumb_v3.png,"▲ 옥태훈의 2라운드 경기 모습옥태훈이 한국프로골프, KPGA 투어 유일의 변형 스테이블포드 방식 대회인 KPGA 클래식에서 선두를 …",2025.05.10 20:41,https://news.sbs.co.kr/news/endPage.do?news_id=N1008095469,SBS
"K리그1 포항, 수원FC 완파…이호재 멀티골",https://img.sbs.co.kr/news/pc/thumb_v3.png,▲ 골 넣고 기뻐하는 이호재프로축구 K리그1 포항이 이호재의 멀티골을 앞세워 수원FC를 물리쳤습니다.포항은 포항 스틸야드에서 열린 하…,2025.05.10 20:40,https://news.sbs.co.kr/news/endPage.do?news_id=N1008095468,SBS
"""안방 창문 위로"" 새벽에 벌벌…주민들 깨운 굉음 정체",https://img.sbs.co.kr/news/pc/thumb_v3.png,"오늘 새벽 경기 수원에서 전기차 1대가 주택가로 돌진해 2명이 다치는 사고가 났습니다. 운전자는 경찰에서 ""차량이 갑자기 튀어나갔다""고 주장했습니다.사건사고 소식 김보미 기자입니다.",2025.05.10 20:39,https://news.sbs.co.kr/news/endPage.do?news_id=N1008095417,SBS
"'디펜딩 챔프' 이예원, KLPGA NH투자증권 챔피언십 2R도 선두",https://img.sbs.co.kr/news/pc/thumb_v3.png,"▲ 이예원이예원이 한국여자프로골프, KLPGA 투어 NH투자증권 레이디스 챔피언십에서 이틀 연속 선두를 달리며 시즌 2승에 바짝 다가…",2025.05.10 20:37,https://news.sbs.co.kr/news/endPage.do?news_id=N1008095464,SBS
"첫날 이재명 후보등록…""가만히 있으면 상대 자빠져""",https://img.sbs.co.kr/news/pc/thumb_v3.png,"국민의힘이 혼란에 휩싸인 사이 이재명 민주당 대선후보는 후보 등록 첫날 곧바로 등록을 마쳤습니다. 오늘도 지역 일정을 이어간 이 후보는 국민의힘을 겨냥해서 ""가만히 있으면 상대방이 자빠진다""고 말하기도 했습니다.박예린 기자가 취재했습니다.",2025.05.10 20:35,https://news.sbs.co.kr/news/endPage.do?news_id=N1008095416,SBS
기호 2번은 누구에게…단일화 내분에 '빅텐트' 무산?,https://img.sbs.co.kr/news/pc/thumb_v3.png,정치부 박서경 기자와 자세한 이야기 나눠보겠습니다.Q. 가처분 인용 가능성은?[박서경 기자 : 앞선 기사에서도 언급이 됐지만 이번 김문수 대선 후보 선출 취소만 놓고 보면 논란의 여지가 있습니다.,2025.05.10 20:31,https://news.sbs.co.kr/news/endPage.do?news_id=N1008095415,SBS
이례적 속도 낸 법원…김문수 측 가처분 결과 언제쯤?,https://img.sbs.co.kr/newimg/news/20250510/202069788_300.jpg,"국민의힘 김문수 후보가 당을 상대로 낸 후보선출 취소 가처분 심문이 열린 법원에 저희 취재기자 나가있습니다.조윤하 기자, 오늘 심문은 마무리가 …",2025.05.10 20:29,https://news.sbs.co.kr/news/endPage.do?news_id=N1008095414,SBS
"""북한도 이렇게는"" ""마지막 자폭""…국힘 단체방도 시끌",https://img.sbs.co.kr/newimg/news/20250510/202069785_300.jpg,"심야에 강행된 후보 교체 결정에 국민의힘 안팎에서는 비판이 터져 나왔습니다. 김문수 후보와 막판까지 경합했던 한동훈 전 대표는 ""북한도 이렇게는 안 한다""고 직격했습니다.",2025.05.10 20:27,https://news.sbs.co.kr/news/endPage.do?news_id=N1008095413,SBS
"""그 어떤 덕수라도 되겠다""…경선 주자들 꺼낸 한덕수",https://img.sbs.co.kr/newimg/news/20250510/202069784_300.jpg,"오늘 새벽 국민의힘에 입당한 한덕수 예비후보는 후보 교체를 둘러싼 혼란이 이어지자 국민과 당원에게 죄송하다고 사과했습니다. 모두 끌어안겠다며 통합을 강조했지만, 후보 교체를 놓고는 조금 다른 반응을 보였습니다.최승훈 기자가 취재했습니다.",2025.05.10 20:22,https://news.sbs.co.kr/news/endPage.do?news_id=N1008095412,SBS
"대선후보 등록 첫날…이재명·이준석 등 6명 등록, 국힘은 못해",https://img.sbs.co.kr/newimg/news/20250510/202069742_300.jpg,▲ 영남 신라벨트 골목골목 경청투어에 나선 더불어민주당 이재명 대선 후보가 10일 경남 창녕군 창녕공설시장을 찾아 즉흥 연설을 하고 …,2025.05.10 20:16,https://news.sbs.co.kr/news/endPage.do?news_id=N1008095465,SBS
"'국힘 후보'로 소개한 김문수…""야밤 쿠데타, 당이 괴물로""",https://img.sbs.co.kr/news/pc/thumb_v3.png,"김문수 후보는 오늘 오전 긴급 기자회견을 열고, 당이 대선 후보 자격을 불법적으로 박탈했다고 강하게 반발했습니다. 김 후보는 ""당의 민주주의는 죽었다""면서 대선후보 자격을 되돌려달라는 내용의 가처분 신청을 냈습니다.이어서 박서경 기자입니다.",2025.05.10 20:15,https://news.sbs.co.kr/news/endPage.do?news_id=N1008095411,SBS
"새벽 1시간에 서류 32건…후보 교체 강행에 ""읍참마속""",https://img.sbs.co.kr/news/pc/thumb_v3.png,"대선후보 등록마감일을 하루 앞두고 국민의힘이 사상 초유의 대선 후보 교체에 나섰습니다. 유력 정당이 전당대회까지 해서 뽑은 당 대선후보를 한밤중에 바꾸는, 우리나라 정당사에 유례없는 일이 벌어진 것입니다.",2025.05.10 20:09,https://news.sbs.co.kr/news/endPage.do?news_id=N1008095410,SBS
오늘의 SBS 8뉴스 예고 (5월 10일),https://img.sbs.co.kr/news/pc/thumb_v3.png,"오늘 <SBS 8뉴스>에서는▶ 국민의힘, 초유의 대선후보 교체 강행...김문수 취소·한덕수 등록▶ 반발한 김문수 ""…",2025.05.10 19:44,https://news.sbs.co.kr/news/endPage.do?news_id=N1008095393,SBS
술 마시다 지인에게 흉기 휘두른 50대…살인미수 혐의 체포,https://img.sbs.co.kr/news/pc/thumb_v3.png,▲ 전주덕진경찰서함께 술 마시던 지인에게 흉기를 휘두른 50대 남성이 경찰에 붙잡혔습니다.전북 전주덕진경찰서는 살인미수 혐의로 50대…,2025.05.10 19:35,https://news.sbs.co.kr/news/endPage.do?news_id=N1008095456,SBS
"[현장영상] 국민의힘 당사 에워싼 김문수 지지자들…""권성동-권영세 사퇴해!"" 한덕수 보더니 폭발",https://img.sbs.co.kr/news/pc/thumb_v3.png,"김문수 국민의힘 대선 후보 지지자들이 국민의힘 당사를 에워싸고 ""권영세-권성동 사퇴!""를 외치며 당 지도부를 향해 거세게 항의했습…",2025.05.10 19:10,https://news.sbs.co.kr/news/endPage.do?news_id=N1008095401,SBS
"[단독] 김용태, 오늘 비대위 불참…""혼자 반대, 무슨 의미 있나""",https://img.sbs.co.kr/news/pc/thumb_v3.png,▲ 국민의힘 김용태 의원국민의힘 대선후보 교체를 최종 결정하기 위해 오늘 밤 10시에 열리는 비대위 회의에 김용태 국민의힘 비대상대책…,2025.05.10 19:02,https://news.sbs.co.kr/news/endPage.do?news_id=N1008095450,SBS
"유럽정상들, 러 전승절 과시 이튿날 우크라 동행해 휴전 압박",https://img.sbs.co.kr/newimg/news/20250510/202069773_300.jpg,"▲ 도날트 투스크 폴란드 총리와 키어 스타머 영국 총리, 올레나 젤렌스카 우크라이나 대통령 부인, 볼로디미르 젤렌스키 우크라이나 대통…",2025.05.10 18:50,https://news.sbs.co.kr/news/endPage.do?news_id=N1008095447,SBS
"미중, 스위스 제네바서 고위급 무역 협상 시작…""현재 진행 중""",https://img.sbs.co.kr/newimg/news/20250425/202065146_300.jpg,미국과 중국이 현지시간 오늘 스위스 제네바에서 고위급 무역 협상을 시작했다고 중국 관영 신화통신이 보도했습니다.중국 CCTV도 미중 무역 회담이…,2025.05.10 18:48,https://news.sbs.co.kr/news/endPage.do?news_id=N1008095446,SBS
"프로야구 한화, 33년 만에 11연승 질주",https://img.sbs.co.kr/newimg/news/20250510/202069772_300.jpg,▲ 한화 폰세의 10일 경기 모습프로야구 한화 이글스가 무려 33년 만에 11연승을 내달렸습니다.한화는 10일 서울 구로구 고척스카이…,2025.05.10 18:47,https://news.sbs.co.kr/news/endPage.do?news_id=N1008095445,SBS
"[바로이뉴스] 가처분 심문 직접 출석한 김문수…재판부 반응 보더니 ""어제와 달라, 좋은 결과 나올 듯""",https://img.sbs.co.kr/newimg/news/20250510/202069771_300.jpg,김문수 국민의힘 대선 후보가 오늘 서울 남부지법에서 진행된 '후보 선출취소 효력정지' 가처분 심문에 직접 출석했습니다.구성 정경윤…,2025.05.10 18:44,https://news.sbs.co.kr/news/endPage.do?news_id=N1008095407,SBS
양양서 서핑 10∼20대 4명 높은 파도에 휩쓸려 표류 중 구조,https://img.sbs.co.kr/news/pc/thumb_v3.png,▲ 바다에 표류하던 서퍼 4명 구조오 늘 낮 1시 50분쯤 강원 양양군 현남면 남애3리 해수욕장에서 10∼20대 서퍼 4명이 …,2025.05.10 18:33,https://news.sbs.co.kr/news/endPage.do?news_id=N1008095441,SBS
"[바로이뉴스] ""한덕수 탈당하고 당 지도부는 다 되돌려놔!"" 분통 터진 안철수…""이대로 가면 다 죽습니다""",https://img.sbs.co.kr/news/pc/thumb_v3.png,"안철수 국민의힘 의원이 ""당 지도부는 퇴진하라""면서, 한덕수 후보를 향해서 탈당하라고 요구했습니다.구성 정경윤 / 영상편집 김인선…",2025.05.10 17:45,https://news.sbs.co.kr/news/endPage.do?news_id=N1008095388,SBS
"의협 회장 ""의대생 단 1명이라도 제적되면 좌시하지 않을 것""",https://img.sbs.co.kr/news/pc/thumb_v3.png,"▲ 김택우 대한의사협회 회장김택우 대한의사협회 회장이 ""의대생 단 1명이라도 제적되면 좌시하지 않겠다""고 밝혔습니다.김…",2025.05.10 17:24,https://news.sbs.co.kr/news/endPage.do?news_id=N1008095390,SBS
"민주 ""이재명 테러위협 커져…대응TF 구성·제보센터 운영""",https://img.sbs.co.kr/news/pc/thumb_v3.png,▲ 영남 신라벨트 골목골목 경청투어에 나선 더불어민주당 이재명 대선 후보가 10일 경남 함안군 가야전통시장을 찾아 상인들과 인사하고 …,2025.05.10 17:22,https://news.sbs.co.kr/news/endPage.do?news_id=N1008095389,SBS
"이재명, 국힘 후보교체에 ""당 지배하는 특정인 위한 친위쿠데타""",https://img.sbs.co.kr/news/pc/thumb_v3.png,▲ 영남 신라벨트 골목골목 경청투어에 나선 더불어민주당 이재명 대선 후보가 10일 경남 의령군 의령전통시장에서 지지자들에게 인사하고 …,2025.05.10 17:21,https://news.sbs.co.kr/news/endPage.do?news_id=N1008095387,SBS
경기 연천서 규모 3.3과 2.5 지진 잇따라…수도권 '흔들림',https://img.sbs.co.kr/news/pc/thumb_v3.png,▲ 연천 지진 발생경기 연천군에서 규모 3.3 지진과 규모 2.5 지진이 연이어 발생했습니다.기상청에 따르면 오늘 낮 1시 19분쯤 …,2025.05.10 17:19,https://news.sbs.co.kr/news/endPage.do?news_id=N1008095386,SBS
"국민의힘 배현진 ""절차적 하자 있다면 바로 잡아야""",https://img.sbs.co.kr/newimg/news/20250310/202048115_300.jpg,▲ 배현진 국민의힘 의원국민의힘이 사상 초유의 대선 후보 재선출 절차에 돌입한 상황에서 배현진 국민의힘 의원이 절차적 정당성을 강하게…,2025.05.10 17:03,https://news.sbs.co.kr/news/endPage.do?news_id=N1008095380,SBS
"이재명, '문형배 은인' 김장하와 차담…""훌륭한 제자 두셨다""",https://img.sbs.co.kr/newimg/news/20250510/202069827_300.jpg,"▲ 영남 신라벨트 골목골목 경청투어에 나선 더불어민주당 이재명 대선 후보가 10일 경남 진주시의 한 찻집에서 진주 지역 독지가 김장하 선생과 차담을 갖고 있다.더불어민주당 이재명 대선 후보는 오늘, 경남 진주의 한 찻집에서 다큐멘터리 어른 김장하의 주인공으로 알려진 지역 독지가 김장하 선생과 만났습니다.이 후보는 김 선생에게, 장학금을 받은 학생 중 한 명이 문형배 전 헌법재판소장 권한대행이라며 그와의 인연을 언급했습니다.문 전 권한대행은 윤석열 전 대통령 파면 선고를 주도한 헌법재판관으로, 이 후보와는 사법시험 28회, 사법연수원 18기 동기입니다.이 후보는 ""문형배 그 친구는 저와 꽤 가까운 친구""라며, ""헌재에 간 이후에는 연락하지 못했고, 부산에 있을 때 한 번 봤다.",2025.05.10 16:47,https://news.sbs.co.kr/news/endPage.do?news_id=N1008095373,SBS
"[자막뉴스] ""끝까지 싸워달라"" 국민의힘 당사 앞으로 몰려간 지지자들…가처분 신청 낸 김문수",https://img.sbs.co.kr/newimg/news/20250510/202069763_300.jpg,오늘 오전 서울 여의도 캠프 사무실에서 긴급 기자회견을 연 김문수 국민의힘 대선 후보[ 김문수 / 국민의힘 대선 후보 : 야밤의 정치 쿠데타가 …,2025.05.10 16:26,https://news.sbs.co.kr/news/endPage.do?news_id=N1008095350,SBS
"'무력 충돌' 인도·파키스탄 ""상대가 도발 중단하면 우리도 중단""",https://img.sbs.co.kr/newimg/news/20250508/202069240_300.jpg,▲ 인도·파키스탄 무력 충돌 '사실상 핵보유국'인 인도와 파키스탄이 군사작전을 펼치며 전면전 위기가 고조된 가운데 양국…,2025.05.10 16:24,https://news.sbs.co.kr/news/endPage.do?news_id=N1008095365,SBS
"[바로이뉴스] 한덕수 ""김덕수, 홍덕수, 안덕수, 나덕수""…'덕수'만 끌어안겠다?",https://img.sbs.co.kr/news/pc/thumb_v3.png,국민의힘에 입당한 한덕수 대선 예비 후보가 후보 교체와 관련한 논란을 두고 긴급 기자회견을 열었습니다.(구성 정경윤 / 영상편집 김인선 / 제작…,2025.05.10 15:59,https://news.sbs.co.kr/news/endPage.do?news_id=N1008095357,SBS
"중국, 인도-파키스탄 충돌 격화에 ""깊이 우려…긴장 고조 피해야""",https://img.sbs.co.kr/news/pc/thumb_v3.png,▲ 파키스탄의 드론 공격으로 파손된 인도 잠무 지역의 주택들'사실상 핵보유국'인 인도와 파키스탄 간 무력충돌이 격화하자…,2025.05.10 15:55,https://news.sbs.co.kr/news/endPage.do?news_id=N1008095358,SBS
"이재명 ""해병대, 독립적 준4군 체제로…해병대사령관 위상 격상""",https://img.sbs.co.kr/news/pc/thumb_v3.png,▲ 영남 신라벨트 골목골목 경청투어에 나선 더불어민주당 이재명 대선 후보가 10일 경남 함안군 가야전통시장을 찾아 즉흥 연설을 하고 …,2025.05.10 15:54,https://news.sbs.co.kr/news/endPage.do?news_id=N1008095360,SBS
'고속도로 방음벽 공사 비리' 우제창 전 의원 구속,https://img.sbs.co.kr/news/pc/thumb_v3.png,우제창 전 국회의원이 고속도로 방음벽 공사 비리에 연루돼 검찰에 구속된 것으로 확인됐습니다.10일 법조계에 따르면 수원지법 이성율 영장전담 부장…,2025.05.10 15:42,https://news.sbs.co.kr/news/endPage.do?news_id=N1008095354,SBS
"이재명 ""해병대, 독립적 준4군 체제로…해병대사령관 위상 격상""",https://img.sbs.co.kr/news/pc/thumb_v3.png,▲ 영남 신라벨트 골목골목 경청투어에 나선 더불어민주당 이재명 대선 후보가 10일 경남 의령군 의령전통시장에서 지지자들에게 인사하고 …,2025.05.10 15:34,https://news.sbs.co.kr/news/endPage.do?news_id=N1008095351,SBS
"[글로벌D리포트] 파키스탄, 인도에 미사일 보복…대규모 군사작전 개시",https://img.sbs.co.kr/news/pc/thumb_v3.png,"현지시간 오늘 새벽 이슬람 기도 시간이 끝난 직후, 파키스탄군은 인도 내 군사목표물 여러 곳을 미사일로 공격했습니다.파키스탄군은 인도 비아스에 …",2025.05.10 15:28,https://news.sbs.co.kr/news/endPage.do?news_id=N1008095226,SBS
축구장에 최경주가?…K리그1 제주 11일 홈경기서 '시타·사인회',https://img.sbs.co.kr/newimg/news/20250510/202069750_300.jpg,▲ 최경주 초청 이벤트 포스터지난해 SK텔레콤오픈 챔피언 최경주가 제주월드컵경기장에서 축구 팬들이 보는 앞에서 '아일랜드 샷&…,2025.05.10 15:18,https://news.sbs.co.kr/news/endPage.do?news_id=N1008095344,SBS
