title,thumbnail,short_content,write_time,link,company
"법원, 김문수 '후보 선출취소 효력정지' 가처분 오후 5시 심문",https://img.sbs.co.kr/newimg/news/20250510/202069702_300.jpg,▲ 김문수 대선 후보가 10일 서울 여의도 캠프 사무실에서 긴급 기자회견을 열어 당 지도부 주도의 사상 초유 대선 후보 교체 강행에 …,2025.05.10 15:01,https://news.sbs.co.kr/news/endPage.do?news_id=N1008095327,SBS
SK텔레콤 해킹에 남몰래 웃는 삼성전자·애플…이유는 '이심',https://img.sbs.co.kr/newimg/news/20250430/202066593_300.jpg,"▲ 삼성SK텔레콤 해킹 사고의 여파가 계속되는 가운데, 스마트폰 제조업계는 표정 관리를 하고 있습니다.삼성전자와 애플 등 제조사들은 …",2025.05.10 14:55,https://news.sbs.co.kr/news/endPage.do?news_id=N1008095322,SBS
"트럼프, 자진 출국 불법 이민자에 '항공권+보너스' 지급 명령",https://img.sbs.co.kr/newimg/news/20250508/202069056_300.jpg,▲ 도널드 트럼프 미국 대통령도널드 트럼프 미국 대통령이 불법체류자의 자진 출국을 유도하기 위해 항공권과 '귀국 보너스'…,2025.05.10 14:52,https://news.sbs.co.kr/news/endPage.do?news_id=N1008095321,SBS
트럼프 이민자추방정책 갈등 심화…시설진입 민주당 시장 구금,https://img.sbs.co.kr/news/pc/thumb_v3.png,▲ 뉴어크 이민자 구금시설 앞 시위 발언하는 바라카 시장도널드 트럼프 전 미국 대통령의 이민자 추방 정책을 두고 연방정부와 민주당 소…,2025.05.10 14:51,https://news.sbs.co.kr/news/endPage.do?news_id=N1008095320,SBS
"중, 인도-파키스탄 충돌 격화에 ""깊이 우려…긴장 고조 피해야""",https://img.sbs.co.kr/news/pc/thumb_v3.png,▲ 파키스탄의 드론 공격으로 파손된 인도 잠무 지역의 주택들'사실상 핵보유국'인 인도와 파키스탄 간 무력 충돌이 격화하…,2025.05.10 14:47,https://news.sbs.co.kr/news/endPage.do?news_id=N1008095313,SBS
"민주 ""국힘, 후보 강탈해 윤 대리인에 상납""·""밤치기 도둑 수법""",https://img.sbs.co.kr/news/pc/thumb_v3.png,"▲ 더불어민주당 황정아 의원 민주당은 오늘 국민의힘이 김문수 대선후보의 선출을 취소하고 후보 재선출에 돌입한 것을 두고 ""국민…",2025.05.10 14:45,https://news.sbs.co.kr/news/endPage.do?news_id=N1008095312,SBS
"[현장영상] ""가만히 있으면 상대가 자빠져!"" 간밤에 '후보 교체'한 국민의힘 보더니 이재명이 한 말",https://img.sbs.co.kr/news/pc/thumb_v3.png,"이재명 민주당 대선 후보가 국민의힘 상황을 두고 ""가만히 있으면 상대가 자빠진다""면서 비판했습니다. (구성 정경윤 / 영상편집 김…",2025.05.10 14:43,https://news.sbs.co.kr/news/endPage.do?news_id=N1008095287,SBS
"한덕수, 단일화 관련 ""누가 잘못했든 국민께 불편드린 점 송구""",https://img.sbs.co.kr/news/pc/thumb_v3.png,"▲ 한덕수 대통령선거 예비후보한덕수 대통령선거 예비후보는 10일 국민의힘 김문수 후보와의 단일화 과정과 관련해 ""어떤 사정이 …",2025.05.10 14:39,https://news.sbs.co.kr/news/endPage.do?news_id=N1008095314,SBS
전농 '트랙터 상경 시위대' 서울 길목서 경찰에 막혀,https://img.sbs.co.kr/news/pc/thumb_v3.png,▲ 10일 석수역 인근에서 전국농민회총연맹 전봉준투쟁단이 광화문에서 열리는 '내란농정 청산 농업대개혁 실현 범시민대회'…,2025.05.10 14:38,https://news.sbs.co.kr/news/endPage.do?news_id=N1008095308,SBS
"이재명 ""가만히 있으면 상대방 자빠져…그러면 우리가 이긴다""",https://img.sbs.co.kr/newimg/news/20250510/202069745_300.jpg,"▲ 영남 신라벨트 골목골목 경청투어에 나선 더불어민주당 이재명 대선 후보가 10일 경남 의령군 의령전통시장에 도착해 차에서 내리며 지지자들을 향해 인사하고 있다.이재명 민주당 대선후보는 오늘 ""정치는 잘하려다가 실수하면 괜찮은데, 이익을 노리고 막 움직이면 반드시 걸려 자빠지게 돼 있다.",2025.05.10 14:35,https://news.sbs.co.kr/news/endPage.do?news_id=N1008095307,SBS
"김혜성, 대주자로 나와 결승 득점…다저스 역전승",https://img.sbs.co.kr/newimg/news/20250510/202069744_300.jpg,▲ LA 다저스 김혜성메이저리그 LA 다저스가 9회 터진 오타니 쇼헤이의 역전 결승 3점포에 힘입어 애리조나 다이아몬드백스에 짜릿한 …,2025.05.10 14:31,https://news.sbs.co.kr/news/endPage.do?news_id=N1008095303,SBS
서울 한 초등학교서 학생 등 100여 명 식중독 의심 증세,https://img.sbs.co.kr/newimg/news/20240715/201958345_300.jpg,▲위 사진은 기사 내용과 관련이 없습니다.서울 서대문구의 한 초등학교에서 학생과 교직원 등 100여 명이 식중독 의심 증세를 보여 보…,2025.05.10 14:22,https://news.sbs.co.kr/news/endPage.do?news_id=N1008095300,SBS
휴일 낮 경기 연천서 규모 3.3 지진…수도권 곳곳 '흔들림',https://img.sbs.co.kr/newimg/news/20250510/202069737_300.jpg,▲ 연천군에서 규모 3.3 지진 발생오늘 오후 경기 연천군에서 규모 3.3 지진이 발생했습니다.기상청에 따르면 오늘 오후 1시 19분…,2025.05.10 14:20,https://news.sbs.co.kr/news/endPage.do?news_id=N1008095299,SBS
"이재명 ""가만히 있으면 상대방 자빠져…그러면 우리가 이긴다""",https://img.sbs.co.kr/news/pc/thumb_v3.png,"▲ 영남 신라벨트 골목골목 경청투어에 나선 더불어민주당 이재명 대선 후보가 10일 경남 창녕군 창녕공설시장을 찾아 즉흥 연설을 하고 있다.더불어민주당 이재명 대선 후보는 오늘, ""정치는 잘해보려다 실수하는 건 괜찮지만, 이익을 노리고 움직이면 반드시 걸려 넘어진다""고 말했습니다.이 후보는 오늘 경남 창녕군에서 열린 연설에서, ""어느 집단을 보니 그런 생각이 들었다""고 덧붙이며 국민의힘이 밤사이 김문수 대선 후보를 교체한 일을 에둘러 비판했습니다.이 후보는 고 김영삼 전 대통령의 말을 인용해 ""정치는 너무 격변해 우리가 잘한다고 되는 게 아니라, 가만히 있으면 상대방이 자빠진다.",2025.05.10 14:13,https://news.sbs.co.kr/news/endPage.do?news_id=N1008095294,SBS
"새벽 3시 공고에 한덕수 단독 신청…국힘, 한밤 새며 속전속결 후보 교체",https://img.sbs.co.kr/news/pc/thumb_v3.png,▲ 국민의힘 이양수 사무총장이 9일 서울 여의도 국회에서 재개된 국민의힘 김문수 대선 후보와 무소속 한덕수 대선 예비 후보 간의 단일…,2025.05.10 14:08,https://news.sbs.co.kr/news/endPage.do?news_id=N1008095292,SBS
"김문수, '국민의힘 후보 선출 취소' 효력정지 가처분 신청",https://img.sbs.co.kr/news/pc/thumb_v3.png,▲ 국민의힘 김문수 대선 후보가 10일 서울 여의도 국민의힘 당사 대통령 후보실에서 캠프 관계자들과 사상 초유 대선 후보 교체 강행에…,2025.05.10 13:57,https://news.sbs.co.kr/news/endPage.do?news_id=N1008095289,SBS
"일본 방위백서 ""새로운 위기 시대…북러 협력, 안보에 다층적 영향""",https://img.sbs.co.kr/news/pc/thumb_v3.png,"▲ 일본 방위성일본 방위성이 해마다 발간하는 '방위백서' 초안에서 중국과 러시아 군사 위협을 염두에 두고 ""새로…",2025.05.10 13:49,https://news.sbs.co.kr/news/endPage.do?news_id=N1008095281,SBS
"[단독] ""야밤 빈집털이하듯""…국힘 의원 단체방에서도 비판 잇따라",https://img.sbs.co.kr/news/pc/thumb_v3.png,국민의힘이 사상 초유의 대선 후보 재선출 절차에 돌입한 가운데 국민의힘 의원 단체방에서도 우려와 비판의 목소리가 이어지고 있습니다.SBS 취재를…,2025.05.10 13:40,https://news.sbs.co.kr/news/endPage.do?news_id=N1008095283,SBS
"[자막뉴스] 새벽 3시에 후보 등록 받은 국민의힘…""북한도 이렇게 안 해"" 반발 확산",https://img.sbs.co.kr/news/pc/thumb_v3.png,국민의힘이 오늘 새벽에 올린 대선 후보자 등록 신청 공고입니다.등록 신청 기간이 새벽 3시에서 4시 사이입니다.한덕수 후보는 이 시간 내에 국민…,2025.05.10 13:31,https://news.sbs.co.kr/news/endPage.do?news_id=N1008095239,SBS
"기상청 ""경기 연천 북북동쪽서 규모 3.3 지진 발생""",https://img.sbs.co.kr/newimg/news/20250510/202069737_300.jpg,"오늘 오후 1시 19분 0초 경기 연천군 북북동쪽 5km 지역에서 규모 3.3의 지진이 발생했다고 기상청이 밝혔습니다.진앙은 북위 38.14도,…",2025.05.10 13:29,https://news.sbs.co.kr/news/endPage.do?news_id=N1008095276,SBS
"피츠버그 배지환, 감독 바뀌고 36일 만에 빅리그 복귀",https://img.sbs.co.kr/newimg/news/20240824/201976827_300.jpg,▲ 배지환미 프로야구 메이저리그이 빅리그에 복귀했습니다.피츠버그 구단은 10일 산하 트리플A 구단인 인디애나폴리스 인디언스에서 뛰던 …,2025.05.10 13:10,https://news.sbs.co.kr/news/endPage.do?news_id=N1008095266,SBS
"이정후, 미네소타전 4타수 무안타…시즌 타율 0.293으로 하락",https://img.sbs.co.kr/newimg/news/20250510/202069733_300.jpg,▲ 이정후의 미네소타전 타격 모습.미 프로야구 샌프란시스코 자이언츠 외야수 이정후의 시즌 타율이 2할대로 내려갔습니다.샌프란시스코는 …,2025.05.10 13:06,https://news.sbs.co.kr/news/endPage.do?news_id=N1008095265,SBS
"이준석 대선후보 등록…""계엄 세력과 삼권분립 파괴세력 막겠다""",https://img.sbs.co.kr/newimg/news/20250510/202069732_300.jpg,▲ 개혁신당 이준석 대선 후보가 10일 경기도 과천 중앙선거관리위원회에서 제21대 대통령선거 후보 등록을 위해 입장하고 있다.개혁신당…,2025.05.10 12:57,https://news.sbs.co.kr/news/endPage.do?news_id=N1008095262,SBS
[날씨] 오후 대부분 비 그쳐…해안가·산지 중심 강풍특보,https://img.sbs.co.kr/news/pc/thumb_v3.png,"주말인 오늘 중부와 호남 지역을 중심으로 비가 이어지고 있습니다.현재 레이더 영상을 보시면 중부와 경북 북부 내륙, 전북 내륙 지역에 약한 비구…",2025.05.10 12:36,https://news.sbs.co.kr/news/endPage.do?news_id=N1008095236,SBS
"""중국 관세 80% 적절""…미·중 협상 곧 시작",https://img.sbs.co.kr/news/pc/thumb_v3.png,"중국과 관세 협상을 하루 앞두고 있는 트럼프 대통령이, 대 중국 관세를 80%까지 낮추는 게 적절하다는 글을 올렸습니다. 협상 전에 중국 측에 일부 타협점을 제시하는 것으로 해석됩니다.김범주 특파원입니다.",2025.05.10 12:29,https://news.sbs.co.kr/news/endPage.do?news_id=N1008095235,SBS
"이틀째 영남 공략…""색 구분 말자"" 통합 강조",https://img.sbs.co.kr/news/pc/thumb_v3.png,"이재명 민주당 대선후보는 이틀째 보수 지지세가 강한 영남 지역을 찾았습니다. 이 후보는 선관위 대선후보 등록을 마쳤는데, 빨강과 파랑, 또 왼쪽과 오른쪽을 구분하지 말자며 통합을 강조했습니다.노동규 기자입니다.",2025.05.10 12:28,https://news.sbs.co.kr/news/endPage.do?news_id=N1008095234,SBS
"초유의 '후보 교체' 착수…김문수 ""야밤 쿠데타""",https://img.sbs.co.kr/news/pc/thumb_v3.png,"김문수 국민의힘 대선후보와 한덕수 예비후보의 단일화 협상이 결렬되자, 국민의힘이 초유의 대선후보 교체 절차에 돌입했습니다. 김문수 후보는 강력 반발하며 법적 조치를 예고했습니다.김수영 기자입니다.",2025.05.10 12:26,https://news.sbs.co.kr/news/endPage.do?news_id=N1008095232,SBS
"미, 인도-파키스탄 중재 착수…""건설적 대화 시작할 지원 제안""",https://img.sbs.co.kr/news/pc/thumb_v3.png,'사실상 핵보유국'인 인도와 파키스탄의 무력충돌 격화로 확전이 우려되자 미국이 중재에 나섰습니다.미 국무부는 마코 루비오 장관이 …,2025.05.10 12:13,https://news.sbs.co.kr/news/endPage.do?news_id=N1008095252,SBS
"미, 민간 항공기·제트엔진 '관세 조사' 시작…유럽 겨냥한 듯",https://img.sbs.co.kr/news/pc/thumb_v3.png,"▲ 프랑스의 에어버스 공장미국 도널드 트럼프 행정부가 국가 안보를 명분으로 관세를 부과해 온 가운데, 이번에는 항공기와 제트엔진을 겨…",2025.05.10 12:09,https://news.sbs.co.kr/news/endPage.do?news_id=N1008095253,SBS
이스라엘에 계속 미사일 쏘는 후티…이스라엘 '3중 방공망'도 뚫었다,https://img.sbs.co.kr/newimg/news/20250510/202069726_300.jpg,▲ 후티 반군 지지자들예멘의 친이란 반군 후티가 미국과 휴전한 이후에도 이스라엘에 대한 탄도미사일 공격을 계속하고 있습니다.최근 후티…,2025.05.10 12:08,https://news.sbs.co.kr/news/endPage.do?news_id=N1008095245,SBS
"""미, '트럼프 편입 희망' 그린란드에 연합 협정 제안 검토""",https://img.sbs.co.kr/newimg/news/20250510/202069725_300.jpg,▲ 3월 28일 그린란드 방문한 JD 밴스 미국 부통령미국 백악관이 덴마크령 그린란드와 자유연합협정 체결을 추진 중이라고 로이터통신이…,2025.05.10 12:06,https://news.sbs.co.kr/news/endPage.do?news_id=N1008095242,SBS
푸틴·룰라 정상회담…트럼프 관세·우크라 위기 언급,https://img.sbs.co.kr/newimg/news/20250510/202069724_300.jpg,▲ 크렘린궁에서 회담하는 푸틴 대통령과 룰라 대통령블라디미르 푸틴 러시아 대통령과 루이스 이나시우 룰라 다시우바 브라질 대통령이 어제…,2025.05.10 12:02,https://news.sbs.co.kr/news/endPage.do?news_id=N1008095241,SBS
가상화폐 상승세 속 이더리움 주간 30%↑…2021년 이후 최고,https://img.sbs.co.kr/newimg/news/20240220/201896747_300.jpg,"▲ 가상화폐가상화폐 시장이 상승세를 이어가는 가운데, 시가총액 2위 이더리움의 급등세가 두드러지고 있습니다.오늘 미국 가상화폐 거래소…",2025.05.10 11:57,https://news.sbs.co.kr/news/endPage.do?news_id=N1008095231,SBS
"전광훈 측, 김문수 후보 박탈 국힘 비난…""애국보수 타도 대상""",https://img.sbs.co.kr/news/pc/thumb_v3.png,▲ 국민의힘 김문수 대선 후보가 10일 서울 여의도 캠프 사무실에서 긴급 기자회견을 열어 당 지도부 주도의 사상 초유 대선 후보 교체…,2025.05.10 11:52,https://news.sbs.co.kr/news/endPage.do?news_id=N1008095228,SBS
"[바로이뉴스] ""윤석열 아바타당 자폭 핵버튼""…배후로 윤석열·김건희 거론하며 ""해체 안 될 자신있냐""",https://img.sbs.co.kr/news/pc/thumb_v3.png,"김민석 더불어민주당 상임공동선대위원장은 오늘 오전 긴급 기자회견을 통해 ""윤석열 아바타당이 자폭 핵버튼을 눌렀다""며 맹비난했습니다…",2025.05.10 11:50,https://news.sbs.co.kr/news/endPage.do?news_id=N1008095224,SBS
서울 한 초등학교서 학생 등 100여 명 식중독 의심 증세,https://img.sbs.co.kr/news/pc/thumb_v3.png,▲ 서울시교육청 서울 서대문구의 한 초등학교에서 학생과 교직원 100여 명이 식중독 의심 증세를 보여 보건당국이 역학조사에 나섰습니다…,2025.05.10 11:48,https://news.sbs.co.kr/news/endPage.do?news_id=N1008095227,SBS
"[바로이뉴스] ""김문수는 시간만 끌고 단일화 무산시켜"" 권영세 기자회견…""왜 새벽에 후보 등록했나"" 질문에",https://img.sbs.co.kr/news/pc/thumb_v3.png,권영세 국민의힘 비대위원장이 긴급 기자회견을 열고 김문수 대선 후보를 취소한 이유를 설명했습니다.(구성 정경윤 / 영상편집 김인선 / 제작 디지…,2025.05.10 11:39,https://news.sbs.co.kr/news/endPage.do?news_id=N1008095206,SBS
"홍명보호 6월 원정 상대 이라크, 새 사령탑에 아널드 감독 선임",https://img.sbs.co.kr/news/pc/thumb_v3.png,▲ 이라크 축구대표팀 지휘봉을 잡은 그레이엄 아널드 감독한국 축구대표팀 사령탑 최종 후보군에 올랐던 호주 출신의 그레이엄 아널드 감독…,2025.05.10 11:33,https://news.sbs.co.kr/news/endPage.do?news_id=N1008095221,SBS
"'NC 출신' 페디, MLB 데뷔 첫 완봉승",https://img.sbs.co.kr/news/pc/thumb_v3.png,▲ 완봉승을 완성하고 포수와 포옹한 에릭 페디과거 프로야구 NC 다이노스에서 활약하며 KBO리그 최우수선수를 받았던 에릭 페디가 빅리…,2025.05.10 11:31,https://news.sbs.co.kr/news/endPage.do?news_id=N1008095220,SBS
