title,thumbnail,short_content,write_time,link,company
미성년자에게 성착취물 요구해 받아낸 현직 경찰관 구속,https://img.sbs.co.kr/news/pc/thumb_v3.png,SNS로 미성년자에게 접근한 뒤 성착취물을 요구해 받아낸 현직 경찰관이 검찰에 넘겨졌습니다.경기 부천 오정경찰서는 오늘 아동·청소년의 성보호에 …,2025.05.02 18:28,https://news.sbs.co.kr/news/endPage.do?news_id=N1008087394,SBS
"의대 5곳, 학생 1천916명 제적 예정 통보",https://img.sbs.co.kr/news/pc/thumb_v3.png,의대 5곳이 1개월 이상 '무단결석'한 학생에 대해 학칙에 따라 제적 예정 통보를 했습니다.교육부는 2일 학칙상 1개월 이상 무단…,2025.05.02 18:28,https://news.sbs.co.kr/news/endPage.do?news_id=N1008087393,SBS
"[현장영상] ""조롱하세요?"" 싱크홀 사건 유족 눈물 쏟게 한 예능 섭외 논란",https://img.sbs.co.kr/news/pc/thumb_v3.png,지난 3월 서울시 강동구에서 발생한 싱크홀 사고로 숨진 30대 남성의 유가족이 한 예능 프로그램 제작진의 섭외 요청 때문에 큰 상처를 입었습니다…,2025.05.02 18:24,https://news.sbs.co.kr/news/endPage.do?news_id=N1008087317,SBS
교황 선출 위한 콘클라베 굴뚝 설치…연기 피워 결과 알린다,https://img.sbs.co.kr/news/pc/thumb_v3.png,새 교황 선출 여부를 연기를 통해 세상에 알리는 굴뚝이 시스티나 성당 지붕에 설치됐습니다.AP 통신은 현지시간 1일 바티칸의 소방관들이 시스티나…,2025.05.02 18:23,https://news.sbs.co.kr/news/endPage.do?news_id=N1008087390,SBS
"'이재명 대통령 되면 재판 스톱' 법안 시동…여당 ""위인설법"" [스프]",https://img.sbs.co.kr/news/pc/thumb_v3.png,"오늘 놓치지 말아야 할 이슈, 퇴근길에 보는 이브닝 브리핑에 있습니다. 대선판이 요동치고 있습니다.여론조사에서 압도적 1위를 달리는 이재명 민주…",2025.05.02 18:14,https://news.sbs.co.kr/news/endPage.do?news_id=N1008087321,SBS
"""금감원 직원 사칭한 가상자산 외부평가위원 위촉 메일 주의""",https://img.sbs.co.kr/newimg/news/20250502/202067574_300.jpg,▲ 금융감독원 사칭 위조공문금융감독원 직원을 사칭해 가상자산 관련 외부평가위원을 위촉한다며 개인정보를 요구하는 메일이 발견돼 금감원이…,2025.05.02 18:13,https://news.sbs.co.kr/news/endPage.do?news_id=N1008087383,SBS
"[바로이뉴스] '이재명 유죄' 선고한 대법원장 ""계엄은…"" 회의서 제일 먼저 말했다",https://img.sbs.co.kr/newimg/news/20250502/202067565_300.jpg,천대엽 법원행정처장은 지난해 12·3 비상계엄 당시 대법원 간부회의가 열렸을 때 조희대 대법원장이 가장 먼저 계엄의 위헌성을 언급했다고 밝혔습니…,2025.05.02 18:12,https://news.sbs.co.kr/news/endPage.do?news_id=N1008087369,SBS
"법원행정처장 ""최고법원 판결 존중해야…사안 무게에 엄중 검토""",https://img.sbs.co.kr/newimg/news/20250312/202049197_300.jpg,천대엽 법원행정처장이 더불어민주당 이재명 대선 후보의 공직선거법 위반 혐의 사건에 대한 1일 대법원 판결은 최고법원의 판결이므로 존중해야 한다고…,2025.05.02 18:11,https://news.sbs.co.kr/news/endPage.do?news_id=N1008087380,SBS
"이재명 파기환송에 민주당서 ""대통령되면 재판정지"" 법안 발의 잇따라",https://img.sbs.co.kr/newimg/news/20250501/202067230_300.jpg,더불어민주당에서 오늘 대통령 당선 시 진행 중인 형사재판을 정지하도록 하는 내용의 법안 발의가 잇따랐습니다.김용민 의원은 대통령에 당선된 피고인…,2025.05.02 17:59,https://news.sbs.co.kr/news/endPage.do?news_id=N1008087366,SBS
강남 19층짜리 건물 옥상서 투신소동…2시간 만에 구조,https://img.sbs.co.kr/news/pc/thumb_v3.png,▲ 서울 강남구 역삼동 오피스텔 건물 옥상 투신 소동오늘 낮 1시 30분쯤 서울 강남구 역삼동 19층짜리 오피스텔 건물 옥상에서 한 …,2025.05.02 17:55,https://news.sbs.co.kr/news/endPage.do?news_id=N1008087364,SBS
"'논란 가득' 100일 만에 백악관 떠나는 머스크…""브로맨스는 계속""",https://img.sbs.co.kr/news/pc/thumb_v3.png,"▲ 일론 머스크도널드 트럼프 미국 대통령의 취임 100일과 함께, 최측근 일론 머스크 테슬라 최고경영자의 '공무원 생활'…",2025.05.02 17:53,https://news.sbs.co.kr/news/endPage.do?news_id=N1008087361,SBS
이재명 파기환송심 첫 공판 5월 15일…대선 전 결론?,https://img.sbs.co.kr/news/pc/thumb_v3.png,"이재명 더불어민주당 대통령 후보의 공직선거법 위반 사건 파기환송심 첫 공판이 오는 15일로 잡힌 가운데, 대선 전 파기환송심 결론이 나올지 관심…",2025.05.02 17:48,https://news.sbs.co.kr/news/endPage.do?news_id=N1008087353,SBS
[날씨] 흐리고 서늘한 날씨…비 오는 황금연휴,https://img.sbs.co.kr/news/pc/thumb_v3.png,오늘 바람은 강했지만 낮 동안 하늘이 쾌청하게 드러났는데요.차츰 하늘빛이 흐려지면서 내일은 다시 비 소식이 있습니다.중부 지방은 이른 새벽부터 …,2025.05.02 17:46,https://news.sbs.co.kr/news/endPage.do?news_id=N1008087179,SBS
잇단 땅꺼짐 사고에 '지하공간 통합지도' 세밀해진다,https://img.sbs.co.kr/news/pc/thumb_v3.png,"대형 싱크홀, 지반침하 발생이 잇따르는 가운데 정부가 지하공간 안전 관리를 위한 통합지도를 더 세밀하게 개선합니다.지반침하 이력과 건설공사 정보…",2025.05.02 17:43,https://news.sbs.co.kr/news/endPage.do?news_id=N1008087177,SBS
"충북 범도민기구, 지역 의제 대선 공약화 건의",https://img.sbs.co.kr/news/pc/thumb_v3.png,균형발전 지방분권 충북본부와 각 분야 범도민기구가 21대 대선 충북 의제 14개를 선정해 각 정당과 후보에 공약화를 요구하기로 했습니다.대선 충…,2025.05.02 17:41,https://news.sbs.co.kr/news/endPage.do?news_id=N1008087171,SBS
"'자녀 학폭' 성남시의원, 개인정보보호법 위반 혐의 피소",https://img.sbs.co.kr/newimg/news/20241021/201997907_300.jpg,지난 2월 동급생에게 과자와 모래를 섞어 먹이는 등 학교폭력을 저지른 학생들이 소년 법정으로 넘겨진 가운데 가해 학생의 학부모 중 한 사람인 성…,2025.05.02 17:41,https://news.sbs.co.kr/news/endPage.do?news_id=N1008087342,SBS
"[자막뉴스] 과감히 올려친 주차 요금…""저 아파트 부럽다"" 극찬",https://img.sbs.co.kr/newimg/news/20250502/202067564_300.jpg,최근 한 온라인 커뮤니티에 '우리 아파트 차량 주차비'라는 제목으로 올라온 사진인데요.글쓴이는 차량 1대를 보유한 입주민은 주차 …,2025.05.02 17:40,https://news.sbs.co.kr/news/endPage.do?news_id=N1008084506,SBS
"한전 개폐소 후보지 형평성 논란…""특정 지역에 불리""",https://img.sbs.co.kr/newimg/news/20250502/202067552_300.jpg,최근 한국전력이 추진하는 송전 시설 등과 관련해 갈등이 계속되고 있습니다. 진천군 문백면에 이어 이번에는 청주시 3개 면과 세종시 부강면을 후보지로 한 개폐소 입지선정위원회의 인선을 놓고 형평성 논란이 빚어지고 있습니다.,2025.05.02 17:39,https://news.sbs.co.kr/news/endPage.do?news_id=N1008087170,SBS
여주 '남한강 출렁다리' 개통…도자기 축제도 개막,https://img.sbs.co.kr/newimg/news/20250502/202067559_300.jpg,"남한강을 가로지르는 '여주 남한강 출렁다리'가 새로 개통됐습니다. 330억 원이 넘는 사업비가 투입됐는데요, 여주시는 새로운 랜드마크가 될 것으로 기대하고 있습니다.유영수 기자입니다.",2025.05.02 17:37,https://news.sbs.co.kr/news/endPage.do?news_id=N1008087172,SBS
얼굴 절반만 보톡스 맞으면?…미국 의사 '셀프 실험',https://img.sbs.co.kr/news/pc/thumb_v3.png,<오! 클릭> 마지막 검색어는 '보톡스 한쪽만 맞은 얼굴 공개'입니다.미국의 한 의사가 얼굴 중앙에 검정색 줄을 그은 채 카메라 …,2025.05.02 17:33,https://news.sbs.co.kr/news/endPage.do?news_id=N1008087169,SBS
"""내가 사는 곳""…푸틴, 개인 저택 내부 직접 공개",https://img.sbs.co.kr/news/pc/thumb_v3.png,"푸틴 러시아 대통령이 크렘린궁 안에 있는 개인 저택 모습을 처음으로 공개했습니다.<오! 클릭> 세 번째 검색어, '푸틴의 개인 저택 내부…",2025.05.02 17:32,https://news.sbs.co.kr/news/endPage.do?news_id=N1008087168,SBS
"김민규, LIV 골프 코리아 첫날 공동 9위…선두와 4타 차이",https://img.sbs.co.kr/news/pc/thumb_v3.png,▲ 2일 인천 송도 잭 니클라우스 골프클럽 코리아에서 열린 LIV 골프 코리아 1라운드 1번 홀에서 레인지고츠 팀 김민규가 퍼팅 전 …,2025.05.02 17:30,https://news.sbs.co.kr/news/endPage.do?news_id=N1008087331,SBS
"법원행정처장 ""계엄 위헌성, 회의서 대법원장이 맨 먼저 발언""",https://img.sbs.co.kr/news/pc/thumb_v3.png,▲ 2일 서울 여의도 국회에서 열린 법제사법위원회 전체회의에서 천대엽 법원행정처장이 의원 질의에 답하고 있다.천대엽 법원행정처장은 지…,2025.05.02 17:26,https://news.sbs.co.kr/news/endPage.do?news_id=N1008087328,SBS
"유심 교체 미끼 스미싱 주의보…""유심 재고 문자 아직 발송 안 해""",https://img.sbs.co.kr/news/pc/thumb_v3.png,"▲ 유심 재고 알림 등을 빙자한 스미싱 문자 예시방송통신위원회가 최근 SK텔레콤 해킹 사건과 관련해 교체용 유심 재고 도착 알림, 유…",2025.05.02 17:25,https://news.sbs.co.kr/news/endPage.do?news_id=N1008087316,SBS
95년 만에 첫 '외국인 미스춘향'…남원시 홍보대사 됐다,https://img.sbs.co.kr/news/pc/thumb_v3.png,<오! 클릭> 두 번째 검색어는 '95년 만에 첫 외국인 미스 춘향'입니다.한복이 참 잘 어울리는 것 같죠.95년 전통의 남원 춘…,2025.05.02 17:24,https://news.sbs.co.kr/news/endPage.do?news_id=N1008087167,SBS
동두천서 교차로 교통사고로 50대 남성 숨져,https://img.sbs.co.kr/newimg/news/20250502/202067533_300.jpg,▲ 경기 동두천 생연동 동두천시청 앞 교차로 교통사고오늘 아침 8시 50분쯤 경기 동두천시청 앞 사거리에서 지행역 방향으로 주행하던 …,2025.05.02 17:24,https://news.sbs.co.kr/news/endPage.do?news_id=N1008087298,SBS
"SKT 대리점에 나붙은 안내문…""화가 더 나는데요""",https://img.sbs.co.kr/newimg/news/20250502/202067524_300.jpg,SNS를 통해 오늘 하루 관심사와 누리꾼들의 반응을 알아보는 <오! 클릭> 시간입니다.SK텔레콤의 유심 정보 유출 사태로 무상 유심 교체가 이뤄…,2025.05.02 17:24,https://news.sbs.co.kr/news/endPage.do?news_id=N1008087166,SBS
"국힘 ""'대통령 당선 시 재판 정지' 법안, 전대미문 입법 쿠데타""",https://img.sbs.co.kr/newimg/news/20250502/202067488_300.jpg,"▲ 2일 서울 여의도 국회에서 열린 법제사법위원회 전체회의에서 배형원 법원행정처 차장이 의원 질의에 답하고 있다.국민의힘은 오늘 더불어민주당 주도로 국회 법제사법위원회에서 대통령 당선 시 진행 중인 형사 재판을 정지하도록 하는 내용의 형사소송법 개정안이 상정된 데 대해 ""전대미문의 입법 쿠데타""라고 비판했습니다.신동욱 수석대변인은 오늘 논평에서 ""민주당이 이성을 잃었다.",2025.05.02 17:23,https://news.sbs.co.kr/news/endPage.do?news_id=N1008087309,SBS
"인천 공장 승강기 위에서 60대 숨진 채 발견…""외부인으로 확인""",https://img.sbs.co.kr/newimg/news/20250311/202048561_300.jpg,인천의 한 공장에서 60대 남성이 화물용 승강기 위에서 숨진 채 발견돼 경찰이 수사에 나섰습니다.인천 서부경찰서에 따르면 오늘 오전 9시 30분…,2025.05.02 17:23,https://news.sbs.co.kr/news/endPage.do?news_id=N1008087320,SBS
[오뉴스 출연] '대행의 대행의 대행' (배종찬 인사이트케이 소장),https://img.sbs.co.kr/news/pc/thumb_v3.png,오늘의 이슈를 배종찬 인사이트케이 소장과 함께 오뉴스에서 자세하게 알아봅니다.※,2025.05.02 17:23,https://news.sbs.co.kr/news/endPage.do?news_id=N1008087161,SBS
이재명 파기환송심 재판부 배당…재판장은 이재권 판사,https://img.sbs.co.kr/news/pc/thumb_v3.png,이재명 더불어민주당 대선 후보의 공직선거법 위반 혐의 사건에서 파기환송심 재판부가 정해졌습니다.서울고법은 오늘 이 후보의 공직선거법 사건 파기환…,2025.05.02 17:19,https://news.sbs.co.kr/news/endPage.do?news_id=N1008087303,SBS
"초유의 '대대대행' 업무 첫날…""공정한 선거관리 중점""",https://img.sbs.co.kr/news/pc/thumb_v3.png,"어제 한덕수 전 대통령 권한대행과 최상목 전 부총리가 연이어 사퇴하면서, 대통령 권한대행직은 국정 서열 4위의 이주호 부총리 겸 교육부 장관에게…",2025.05.02 17:10,https://news.sbs.co.kr/news/endPage.do?news_id=N1008087158,SBS
"서울고법, 이재명 '선거법 파기환송' 형사7부에 배당",https://img.sbs.co.kr/news/pc/thumb_v3.png,서울고등법원이 대법원의 파기환송 선고 하루 만에 이재명 민주당 대선 후보의 공직선거법 위반 사건을 선거 사건 전담 재판부인 서울고법 형사7부에 …,2025.05.02 17:04,https://news.sbs.co.kr/news/endPage.do?news_id=N1008087283,SBS
"트럼프, 공영 NPR·PBS 지원 중단 명령…""공정하지 않아"" 주장",https://img.sbs.co.kr/news/pc/thumb_v3.png,▲ 미국의 공영라디오 NPR 본사'편향성'을 주장하며 공영방송사들을 눈엣가시로 여겨온 도널드 트럼프 미국 대통령이 결국…,2025.05.02 17:01,https://news.sbs.co.kr/news/endPage.do?news_id=N1008087275,SBS
"트럼프, 내년 정부 지출 230조 원 삭감 추진…국방비는 1천400조 원",https://img.sbs.co.kr/news/pc/thumb_v3.png,"▲ 도널드 트럼프 미국 대통령도널드 트럼프 미국 대통령이 환경 및 교육, 재생 에너지, 해외 원조 등 비국방 분야에서 내년도 정부 지…",2025.05.02 17:00,https://news.sbs.co.kr/news/endPage.do?news_id=N1008087276,SBS
부여군 2년 연속 출산율 충남 최하위에 '태어나면 1천만 원 쏜다',https://img.sbs.co.kr/newimg/news/20250502/202067517_300.jpg,▲ 부여군청충남 부여군이 출생 순위와 관계없이 신생아 1인당 최대 1천만 원을 지원하는 내용의 출산 육아 지원금 제도를 개편한다고 오…,2025.05.02 17:00,https://news.sbs.co.kr/news/endPage.do?news_id=N1008087271,SBS
이천시서 땅꺼짐 발생해 버스 바퀴 빠져…현재는 복구 완료,https://img.sbs.co.kr/newimg/news/20250502/202067516_300.jpg,▲ 경기 이천 부발읍 신하리 땅꺼짐 발생경기 이천시에서 이틀 전에 도로가 꺼지면서 주행 중이던 통근버스의 바퀴가 일부 빠지는 사고가 …,2025.05.02 16:59,https://news.sbs.co.kr/news/endPage.do?news_id=N1008087265,SBS
"[자막뉴스] 우크라이나 내 전략 광물 모두 미국 손에? ""전기차 태양광 등 꿩먹고 알먹고""",https://img.sbs.co.kr/newimg/news/20250502/202067454_300.jpg,"미국과 우크라이나가 진통 끝에 광물 협정을 타결하면서 25억 년 간 잠들어있던 자원 보고에 결국 미국이 접근하게 됐습니다.'월드 마이닝 데이터'는 2024년 보고서에서 우크라이나를 세계 40위 광물 생산국으로 평가한 가운데 우크라이나에 어떤 전략 광물이, 얼마나 있는 지에 큰 관심이 쏠리고 있습니다.현지 시간 지난달 30일 영국 인디펜던트는 우크라이나가 자국 내 엄청난 자원들을 보유하고 있는데 그 자원들이 첨단 산업과 친환경 에너지 전환에 있어 그 중요성이 더 크다고 보도했습니다.우크라이나 전역에 걸쳐 땅 표면 아래 '우크라이나 순상지'라는 지형이 존재하는데 이는 약 25억 년 전에 형성된 광물질 바위 지형으로 그동안 여러 차례 지질 작용이 리튬, 흑연, 망간, 티타늄, 희토류 등 여러 광물 자원이 형성되는 데 좋은 조건을 만들었다는 겁니다.[줄리 클링거 / 미국 델라웨어대 지리학 교수: 희토류 원소는 각종 전자 기술과 고성능 합금에 널리 사용됩니다.",2025.05.02 16:58,https://news.sbs.co.kr/news/endPage.do?news_id=N1008086823,SBS
"""대통령 당선 시 진행 재판 정지"" 형소법 개정안 상정",https://img.sbs.co.kr/newimg/news/20250502/202067514_300.jpg,"이재명 더불어민주당 대선 후보의 공직선거법 사건에 대한 대법원의 파기환송 결정으로, 대통령의 불소추 특권을 규정한 헌법 조항 해석이 다시 논란이 되고 있습니다.",2025.05.02 16:55,https://news.sbs.co.kr/news/endPage.do?news_id=N1008087157,SBS
"""중국과 연관 없다""던 하버드대 과학자, 중국 칭화대로 옮겨",https://img.sbs.co.kr/news/pc/thumb_v3.png,▲ 칭화대학 교수 임용되는 찰스 리버 중국 정부의 해외 인재 유치 사업과의 관련성을 부인했다가 미국에서 유죄 판결을 받은 전직 하버…,2025.05.02 16:53,https://news.sbs.co.kr/news/endPage.do?news_id=N1008087261,SBS
중국 관영방송 K팝 아이돌 초청 공연 추진설 관심…중국 측 부인,https://img.sbs.co.kr/news/pc/thumb_v3.png,▲ 웨이보 실시간 1위 차지한 중국 중앙방송총국의 K팝 공연 관련 입장 중국에서 '한한령'(限韓…,2025.05.02 16:53,https://news.sbs.co.kr/news/endPage.do?news_id=N1008087262,SBS
[글로벌D리포트] 일출 보려고 화장실 노숙…연휴맞은 중국 '인산인해',https://img.sbs.co.kr/news/pc/thumb_v3.png,"중국 대표 명산 태산의 화장실, 옷과 우비를 겹겹이 입은 사람들이 바닥에 앉아 있습니다.들어갈 틈이 없는데도 사람들이 계속 밀려듭니다.여자 화장…",2025.05.02 16:52,https://news.sbs.co.kr/news/endPage.do?news_id=N1008087070,SBS
"[인터뷰] 유상임 ""범부처 협업으로 우리 고유의 기술사업화 생태계 구축""",https://img.sbs.co.kr/news/pc/thumb_v3.png,"'SBS <편상욱의 뉴스브리핑>' ■ <편상욱의 뉴스브리핑> ■ ■ 유상임 과학기술정보통신부 장관--------------------------------------------● 유상임 과기정통부 장관 인터뷰""통신업체들, 보안에 많은 재정 투입하고 대비해야""""한국 AI 사업, 재정·인력적인 면에서 열세인 것은 사실""""열악한 처우에 AI 인재 유출...합당한 대우 해줘야""""새로운 기술, 사업화 성공해야 제 역할 할 수 있어""""우리나라 고유의 기술사업화 생태계 만드는 것이 우선""""기술사업화 잘 작동하려면 여러 정부 부처 협업 필요""""AI 디지털, 우리 국민의 장점 잘 살릴 수 있는 분야""-------------------------------------------- ▷ 편상욱 / 앵커 : 반도체, 인공지능 등 첨단기술 산업 주도권을 놓고 미중 간의 힘겨루기가 갈수록 치열해지고 있습니다.",2025.05.02 16:48,https://news.sbs.co.kr/news/endPage.do?news_id=N1008086953,SBS
강남 19층짜리 건물 옥상서 투신소동…2시간 만에 구조,https://img.sbs.co.kr/news/pc/thumb_v3.png,오늘 오후 1시 35분쯤 서울 강남구 역삼동 19층짜리 오피스텔 건물 옥상에서 한 여성이 투신 소동을 벌이다 약 2시간 만에 구조됐습니다.소방 …,2025.05.02 16:47,https://news.sbs.co.kr/news/endPage.do?news_id=N1008087251,SBS
잠실 롯데마트서 불…손님·직원 300여 명 대피 소동,https://img.sbs.co.kr/news/pc/thumb_v3.png,▲ 2일 오후 1시36분께 서울 송파구 잠실 롯데월드 내 롯데마트에서 불이 나 소방 당국이 진화 중이다. 오늘 오후 1시 36분 서울…,2025.05.02 16:46,https://news.sbs.co.kr/news/endPage.do?news_id=N1008087250,SBS
