title,thumbnail,short_content,write_time,link,company
"구윤철 ""대주주 양도세 기준, 아직 검토 중…여러 상황 고려""",https://img.sbs.co.kr/newimg/news/20250819/202102145_300.jpg,▲ 구윤철 경제부총리 겸 기획재정부 장관이 19일 국회에서 열린 기획재정위원회 전체회의에서 의원 질의에 답변하고 있다. 구윤철 부총리…,2025.08.19 18:18,https://news.sbs.co.kr/news/endPage.do?news_id=N1008222884,SBS
"한수원, 폴란드 원전 사업도 철수…유럽서 사실상 철수 선언",https://img.sbs.co.kr/news/pc/thumb_v3.png,▲ 황주호 한국수력원자력 사장한국수력원자력이 그간 유망한 추가 수출 지역으로 보던 폴란드에서도 사업을 접기로 했다는 방침을 공식 확인…,2025.08.19 18:16,https://news.sbs.co.kr/news/endPage.do?news_id=N1008222883,SBS
10월부터 '사망보험금' 연금처럼…55세 이상 생전 수령 가능,https://img.sbs.co.kr/news/pc/thumb_v3.png,▲ 금융위원회10월부터 55세 이상은 사망보험금을 연금처럼 생전에 받을 수 있게 됩니다.사망보험금 1억 원 중 70%를 55세부터 2…,2025.08.19 18:15,https://news.sbs.co.kr/news/endPage.do?news_id=N1008222882,SBS
"김윤덕 국토장관 ""부동산 공급대책 늦어도 9월 초 발표""",https://img.sbs.co.kr/news/pc/thumb_v3.png,▲ 19일 서울 여의도 국회에서 열린 국토교통위원회 전체회의에서 김윤덕 국토교통부 장관이 의원 질의에 답하고 있다.김윤덕 국토교통부 …,2025.08.19 18:12,https://news.sbs.co.kr/news/endPage.do?news_id=N1008222877,SBS
"[현장영상] ""숨을 안 쉬어요!"" ""아 제발"" 축구하다 심정지, 10분간 사투 끝에…",https://img.sbs.co.kr/news/pc/thumb_v3.png,"지난 8월 6일, 제주소방안전본부로 긴급 신고가 접수됐습니다. 축구를 하던 한 20대 청년이 갑자기 쓰러져 숨을 쉬지 않는다는 건데요. 심정지 상황이 발생한 것을 인지한 상황실에서는 즉시 구급대, 항공대 등을 현장으로 급파하고, 동시에 영상통화로 현장에 있던 사람들에게 심폐소생술 시행을 유도했습니다.그렇게 시작된 필사의 심폐소생술, 10분 간의 사투 끝에 남성은 극적으로 호흡이 돌아왔습니다.",2025.08.19 18:09,https://news.sbs.co.kr/news/endPage.do?news_id=N1008222478,SBS
"광복회장, 독립기념관장 해임 촉구·감사 요청서 제출",https://img.sbs.co.kr/news/pc/thumb_v3.png,▲ 광복회이종찬 광복회장은 광복절 기념식 축사로 논란이 된 김형석 독립기념관장에 대한 해임 촉구 및 감사원 감사 요청서를 국가보훈부에…,2025.08.19 18:01,https://news.sbs.co.kr/news/endPage.do?news_id=N1008222865,SBS
"마크롱 ""백악관 회담서 '영토 양보' 논의 없어…안전 보장 필수""",https://img.sbs.co.kr/news/pc/thumb_v3.png,▲ 18일 미국 워싱턴DC 백악관에서 도널드 트럼프 대통령 등과 회담을 마치고 기자들에게 발언하는 에마뉘엘 마크롱 프랑스 대통령에마뉘…,2025.08.19 17:59,https://news.sbs.co.kr/news/endPage.do?news_id=N1008222863,SBS
"[자막뉴스] 배달 대기 중 쓰러진 기사, 밥 먹던 손님은 있는 힘을 다해",https://img.sbs.co.kr/newimg/news/20250819/202102227_300.jpg,"지난 2일, 광주시 서구의 한 식당.문 앞에서 음식을 기다리던 배달기사가 잠시 몸을 기울이더니 그대로 바닥에 쓰러집니다.'쿵' 소…",2025.08.19 17:55,https://news.sbs.co.kr/news/endPage.do?news_id=N1008222720,SBS
"김태형 롯데 감독 ""그제 만루 홈런 맞은 김원중, 사인 낸 내 책임""",https://img.sbs.co.kr/newimg/news/20250725/202095007_300.jpg,"▲ 롯데 자이언츠 김태형 감독프로야구 롯데 자이언츠는 최근 9경기에서 1무 8패의 극심한 부진에 빠져 있습니다.8연패에 빠진 롯데에 가장 뼈아팠던 경기라면 그제 삼성 라이온즈전이 꼽힙니다.롯데는 0-3으로 끌려가다가 모처럼 폭발한 타선 덕에 7-3으로 경기를 뒤집은 채 8회 초를 맞이했습니다.투수들의 제구 난조로 1아웃 만루 위기에 봉착했고, 타석에는 한 방이 있는 삼성 김영웅이 등장했습니다.그러자 롯데는 정현수를 내리고 마무리 김원중을 조기 투입했습니다.그러나 김원중은 김영웅과 8구 풀카운트 대결 끝에 동점 만루 홈런을 허용하고 말았습니다.스트라이크 존에 들어온 포크볼을 김영웅이 놓치지 않았습니다.김태형 롯데 감독은 오늘 잠실 LG 트윈스전을 앞두고 그 장면을 복기했습니다.그는 ""홈런 맞은 건 내 책임""이라며 ""내가 계속 포크볼 던지라고 벤치에서 사인을 냈다""고 설명했습니다.김원중은 초구 포크볼이 볼이 되자 2구째는 직구를 던졌고, 이 또한 스트라이크 존을 벗어났습니다.이후 그는 6개 연달아 포크볼을 던졌고, 김영웅은 공이 눈에 익은 덕분인지 담장 밖으로 타구를 보냈습니다.김 감독은 ""김영웅은 따라 나오는 스타일이다.",2025.08.19 17:54,https://news.sbs.co.kr/news/endPage.do?news_id=N1008222860,SBS
"메드베데프, 백악관 찾아간 유럽 정상들 조롱…""감사와 아부 쏟아내""",https://img.sbs.co.kr/newimg/news/20250819/202102089_300.jpg,▲ 백악관에 모인 미국과 유럽 지도자들푸틴 러시아 대통령의 측근으로 꼽히는 메드베데프 러시아 국가안보회의 부의장이 19일 우크라이나 …,2025.08.19 17:53,https://news.sbs.co.kr/news/endPage.do?news_id=N1008222859,SBS
[날씨] 폭염·열대야 기승…곳곳 소나기까지,https://img.sbs.co.kr/newimg/news/20250819/202102257_300.jpg,"폭염이 좀처럼 수그러들지 못하고 있습니다.오늘도 한 차례 일부 수도권과 충청, 경북 내륙에 특보가 강화된 가운데 한낮에 서울 기온이 32.3도,…",2025.08.19 17:53,https://news.sbs.co.kr/news/endPage.do?news_id=N1008222683,SBS
"푸틴·젤렌스키 회담 성사되면 어디서?…마크롱, 제네바 제안",https://img.sbs.co.kr/news/pc/thumb_v3.png,▲ 에마뉘엘 마크롱 프랑스 대통령에마뉘엘 마크롱 프랑스 대통령은 블라디미르 푸틴 러시아 대통령과 볼로디미르 젤렌스키 우크라이나 대통령…,2025.08.19 17:53,https://news.sbs.co.kr/news/endPage.do?news_id=N1008222846,SBS
"비전향장기수 6명 ""북한으로 보내달라""…정부에 요청",https://img.sbs.co.kr/news/pc/thumb_v3.png,"비전향장기수 6명이 북한으로 보내달라고 정부에 요청했습니다.통일부 관계자는 96세 양원진, 95세 안학섭 씨 등 6명으로부터 최근 북송 요청을 …",2025.08.19 17:52,https://news.sbs.co.kr/news/endPage.do?news_id=N1008222681,SBS
"""압수 명품 낙찰받자""…경기도 체납자 물품 공매",https://img.sbs.co.kr/news/pc/thumb_v3.png,"경기도가 다음 주에 고액의 세금을 내지 않은 체납자들로부터 압수한 물품들을 온라인 공매에 내놓습니다. 30돈짜리 순금 거북이부터 최고급 위스키, 명품 가방 등 고가의 물품들이 모두 공매 처분된다고 합니다.최호원 기자가 취재했습니다.",2025.08.19 17:51,https://news.sbs.co.kr/news/endPage.do?news_id=N1008222677,SBS
"울산 울주배, 올해 첫 미국 수출…400t 계획",https://img.sbs.co.kr/news/pc/thumb_v3.png,울주군은 어제 울산원예농협 율리사업소에서 올해 생산된 '울산 울주배'의 미국 첫 수출 환송 행사를 열었습니다.이번에 수출하는 울주…,2025.08.19 17:50,https://news.sbs.co.kr/news/endPage.do?news_id=N1008222676,SBS
국내 유일 '산악영화제' 다음 달 울산서 개막…'올해 10주년',https://img.sbs.co.kr/news/pc/thumb_v3.png,국내 유일 산악영화제인 울산 울주 세계산악영화제가 한 달여 앞으로 다가왔습니다. 올해는 특히 영화제 10주년을 맞아 더 많은 볼거리로 관객들을 …,2025.08.19 17:49,https://news.sbs.co.kr/news/endPage.do?news_id=N1008222672,SBS
"경기도, 호우 피해 북부 5개 시에 응급복구비 11억 원 지원",https://img.sbs.co.kr/news/pc/thumb_v3.png,▲ 수도권에 많은 비가 내린 지난 13일 경기 고양시 덕양구 화랑로에서 차량이 침수되자 운전자가 밖으로 나오고 있다.경기도는 지난 1…,2025.08.19 17:47,https://news.sbs.co.kr/news/endPage.do?news_id=N1008222837,SBS
"교사 향한 성희롱성 메시지, '교권 침해' 인정…재심의 결정",https://img.sbs.co.kr/newimg/news/20250819/202102250_300.jpg,퇴근 후 집에 있던 교사에게 성희롱성 메시지를 보낸 학생의 행동이 교권 침해가 아니라던 교권보호위원회의 판단이 행정심판에서 뒤집혔습니다.전북자치…,2025.08.19 17:47,https://news.sbs.co.kr/news/endPage.do?news_id=N1008222671,SBS
부안-고창 10분 시대 오나?…노을대교 착공 '성큼',https://img.sbs.co.kr/newimg/news/20250819/202102247_300.jpg,전북에서 가장 오래된 숙원사업 가운데 하나인 노을대교가 본격적인 추진 단계에 접어들고 있습니다. 턱없이 부족했던 예산이 올해 초 크게 늘면서 내년 착공이 유력해질 전망인데요.,2025.08.19 17:45,https://news.sbs.co.kr/news/endPage.do?news_id=N1008222670,SBS
"강훈식 ""측근·실세 인사 없다…절차·시스템 따라 검증""",https://img.sbs.co.kr/newimg/news/20250819/202102198_300.jpg,▲ 강훈식 대통령비서실장이 19일 서울 용산 대통령실 청사에서 기자간담회를 하고 있다.강훈식 대통령 비서실장은 이재명 정부 인사 검증…,2025.08.19 17:45,https://news.sbs.co.kr/news/endPage.do?news_id=N1008222825,SBS
"택배차에 두고 간 봉투, 열어보니…'먹다 남은 음식물 쓰레기'",https://img.sbs.co.kr/newimg/news/20250819/202102213_300.jpg,<오! 클릭> 마지막 검색어는 '택배기사 몰래 두고 간 봉투의 정체'입니다.택배차 안에 흰 봉투 2개가 놓여 있습니다.한 택배 기…,2025.08.19 17:44,https://news.sbs.co.kr/news/endPage.do?news_id=N1008222625,SBS
"내란 특검, 이상민 전 장관 구속기소…내란 가담 혐의",https://img.sbs.co.kr/news/pc/thumb_v3.png,▲ 이상민 전 행정안전부 장관윤석열 전 대통령의 12·3 비상계엄에 공모한 혐의를 받는 이상민 전 행정안전부 장관이 구속 상태로 재판…,2025.08.19 17:42,https://news.sbs.co.kr/news/endPage.do?news_id=N1008222831,SBS
해수욕장 정자 한가운데 '우뚝'…못질까지? '캠핑족 논란',https://img.sbs.co.kr/news/pc/thumb_v3.png,휴가철만 되면 해변마다 '민폐 캠핑족'이 기승을 부리죠.강원 삼척의 한 해수욕장에서 황당한 방법으로 텐트를 친 모습이 포착돼 논란…,2025.08.19 17:41,https://news.sbs.co.kr/news/endPage.do?news_id=N1008222624,SBS
"도로 점령한 '자라니' 무법 라이딩…""도로 무법자""",https://img.sbs.co.kr/news/pc/thumb_v3.png,<오! 클릭> 두 번째 검색어는 '도로 점령한 민폐 자전거 무리'입니다.행진을 하듯 차들이 길게 한 줄로 가고 있습니다.속도도 내…,2025.08.19 17:38,https://news.sbs.co.kr/news/endPage.do?news_id=N1008222623,SBS
"비행 직전, 술 냄새 '풀풀'…""금연 껌 냄새라고요?""",https://img.sbs.co.kr/news/pc/thumb_v3.png,"SNS를 통해 오늘 하루 관심사와 누리꾼들의 반응을 알아보는 <오! 클릭> 시간입니다.미국 한 항공사의 조종사가 비행 직전, 음주 사실이 확인되…",2025.08.19 17:37,https://news.sbs.co.kr/news/endPage.do?news_id=N1008222622,SBS
"[속보] 특검, 김건희에 21일 오후 2시 소환 통보",https://img.sbs.co.kr/news/pc/thumb_v3.png,"특검, 김건희에 21일 오후 2시 소환 통보",2025.08.19 17:36,https://news.sbs.co.kr/news/endPage.do?news_id=N1008222819,SBS
"헌재, 조지호 탄핵심판 준비 절차 종료…윤 파면 결정문 증거 채택",https://img.sbs.co.kr/news/pc/thumb_v3.png,▲ 지난달 1일 헌법재판소 소심판정에서 조지호 경찰청장 탄핵심판 첫 변론준비기일이 열리고 있다.조지호 경찰청장의 파면 여부를 가릴 헌…,2025.08.19 17:34,https://news.sbs.co.kr/news/endPage.do?news_id=N1008222802,SBS
"법원, '윤 비상계엄 위자료' 항소심 재판부 배당",https://img.sbs.co.kr/newimg/news/20250807/202098971_300.jpg,시민들이 12·3 비상계엄으로 인한 정신적 피해 배상을 요구하며 윤석열 전 대통령을 상대로 낸 손해배상청구 소송 항소심을 서울중앙지법 민사항소부…,2025.08.19 17:33,https://news.sbs.co.kr/news/endPage.do?news_id=N1008222799,SBS
대통령실에 모인 이재용·최태원·구광모…한미정상회담 앞두고 '2시간 전략회의' [현장영상],https://img.sbs.co.kr/newimg/news/20250819/202102251_300.jpg,"이재명 대통령은 오늘 관세 협상 과정에서 우리 기업인들이 애를 많이 써줘서 생각보다 좋은 성과를 냈다""며 기업인들에게 감사의 뜻을 표했습…",2025.08.19 17:32,https://news.sbs.co.kr/news/endPage.do?news_id=N1008222783,SBS
토론토 달군 'K-박람회'…콘텐츠 바람 타고 중소기업 수출 지원,https://img.sbs.co.kr/newimg/news/20250819/202102243_300.jpg,"해외에 한국 콘텐츠와 관광, 화장품, 식품까지, 다양한 분야의 한류 산업을 소개하는 'K-박람회'가 캐나다에서는 올해 처음으로 열…",2025.08.19 17:32,https://news.sbs.co.kr/news/endPage.do?news_id=N1008222610,SBS
"성인 4명 중 1명 ""디지털 기기 사용 어려워""…노인은 더 심각",https://img.sbs.co.kr/newimg/news/20250819/202102241_300.jpg,"지도앱으로 길을 찾는다든지, 키오스크로 음식 주문하는 거, 익숙하게 하시나요? 우리나라 성인 4명 중에 1명은 디지털 기기를 일상생활에 활용하는…",2025.08.19 17:31,https://news.sbs.co.kr/news/endPage.do?news_id=N1008222609,SBS
구속 기로에 선 한덕수…계엄 전후 행적의 재구성 [스프],https://img.sbs.co.kr/news/pc/thumb_v3.png,한덕수 전 국무총리가 조은석 내란외환 특별검사팀에 피의자 신분으로 소환돼 조사를 받고 있습니다. 한 전 총리는 윤석열 전 대통령이 불법 비상계엄을 실행하는 데 핵심 공범으로 지목돼 있습니다.,2025.08.19 17:30,https://news.sbs.co.kr/news/endPage.do?news_id=N1008222695,SBS
"여당, 21∼25일 노란봉투법 등 처리…'국힘 전대' 22일 본회의 미개최",https://img.sbs.co.kr/news/pc/thumb_v3.png,"▲ 우원식 국회의장과 더불어민주당 김병기 원내대표, 국민의힘 송언석 비상대책위원장 겸 원내대표가 19일 국회에서 회동을 하고 있다.노…",2025.08.19 17:27,https://news.sbs.co.kr/news/endPage.do?news_id=N1008222796,SBS
"[단독] 특검, '집사 게이트' IMS모빌리티 대표 내일 소환",https://img.sbs.co.kr/news/pc/thumb_v3.png,김건희 여사 관련 의혹을 수사하는 민중기 특별검사팀이 이른바 '집사 게이트' 의혹의 중심 인물인 김예성 씨의 동업자 IMS모빌리티…,2025.08.19 17:23,https://news.sbs.co.kr/news/endPage.do?news_id=N1008222798,SBS
"여야, '원전 수출 불공정 합의 논란' 한수원 등 질타",https://img.sbs.co.kr/news/pc/thumb_v3.png,"▲ 19일 국회에서 열린 산업통상자원중소벤처기업위원회 전체회의에서 이철규 위원장, 박성민 야당 간사가 올해 초 한전과 한수원이 미국 …",2025.08.19 17:19,https://news.sbs.co.kr/news/endPage.do?news_id=N1008222787,SBS
"[오뉴스 출연] ""배터리 발화 추정 화재"" (고란 경제전문기자)",https://img.sbs.co.kr/news/pc/thumb_v3.png,오늘의 이슈를 고란 경제전문기자와 함께 오뉴스에서 자세하게 알아봅니다.※,2025.08.19 17:18,https://news.sbs.co.kr/news/endPage.do?news_id=N1008222604,SBS
"이 대통령, 순방 동행 기업인과 간담회…'성과 극대화' 방안 논의",https://img.sbs.co.kr/news/pc/thumb_v3.png,이재명 대통령이 미국과 일본 순방을 앞두고 동행할 기업인들과 간담회를 가졌습니다. 이 자리에서 경제 분야 성과를 극대화하기 위한 방안들이 논의됐…,2025.08.19 17:15,https://news.sbs.co.kr/news/endPage.do?news_id=N1008222603,SBS
"""인생 최대 굴욕, 친정팀에 대실망""…6점 차 대패에 엉엉 운 네이마르",https://img.sbs.co.kr/newimg/news/20250819/202102224_300.jpg,브라질 프로축구 '명문' 산투스FC가 홈경기에서 강등권 팀 바스쿠 다 가마에 0대 6으로 크게 패했습니다.굴욕적인 완패에 팬들은 …,2025.08.19 17:13,https://news.sbs.co.kr/news/endPage.do?news_id=N1008222029,SBS
"세종안성 고속도로 붕괴, ""전도방지시설 임의 제거가 결정적 원인""",https://img.sbs.co.kr/newimg/news/20250819/202102222_300.jpg,지난 2월 10명의 사상자를 낸 세종안성 고속도로 공사 현장 붕괴 사고는 넘어짐을 막기 위해 설치한 시설을 임의로 제거한 게 결정적 원인으로 지…,2025.08.19 17:13,https://news.sbs.co.kr/news/endPage.do?news_id=N1008222602,SBS
"LG, 한화와 운명의 3연전 편성…염경엽 LG 감독 ""마지막에 승부""",https://img.sbs.co.kr/newimg/news/20250819/202102239_300.jpg,한국야구위원회 사무국은 미편성 45경기와 우천 취소 경기 등을 포함해 재편성이 필요한 53경기 등 총 98경기 일정을 새로 짜 오늘 발표했습니다…,2025.08.19 17:13,https://news.sbs.co.kr/news/endPage.do?news_id=N1008222788,SBS
"특검, 건진법사 구속영장 청구…한덕수 전 총리 소환",https://img.sbs.co.kr/newimg/news/20250819/202102214_300.jpg,"김건희 특검팀이 건진법사 전성배 씨를 조사한 지 하루 만에 구속영장을 청구했습니다. 전 씨는 특검 조사에서도 통일교 측으로부터 청탁을 받긴 했지만, 김건희 여사에게 목걸이 등을 전달하지는 않았다는 기존 입장을 바꾸지 않은 것으로 전해졌습니다.",2025.08.19 17:10,https://news.sbs.co.kr/news/endPage.do?news_id=N1008222598,SBS
"7명 덮친 무궁화호 열차 사고…""소음 적어 인지 못했을 것""",https://img.sbs.co.kr/news/pc/thumb_v3.png,오늘 오전 경북 청도에서 무궁화호 열차가 경부선 철로 점검을 위해서 선로 주변에 있던 작업자들을 치는 사고가 났습니다. 이 사고로 2명이 숨지고 5명이 다쳤는데요.,2025.08.19 17:08,https://news.sbs.co.kr/news/endPage.do?news_id=N1008222596,SBS
[자막뉴스] 너도나도 '영끌' '빚투'…가계 빚 역대 최대,https://img.sbs.co.kr/news/pc/thumb_v3.png,올해 2분기 이른바 영끌과 빚투로 주택과 주식 투자가 급증하면서 가계 빚이 역대 최대 기록을 경신했습니다.한국은행이 발표한 '2025년 …,2025.08.19 17:07,https://news.sbs.co.kr/news/endPage.do?news_id=N1008222705,SBS
"[자막뉴스] ""괴로워서 떠나는 이웃들"" 경찰도 손 못쓰는 공포의 층간 소음",https://img.sbs.co.kr/news/pc/thumb_v3.png,서울의 한 오피스텔.이곳의 주민 소통 게시판이 층간 소음 관련한 내용으로 가득합니다.'쿵쿵' 울리는 소음과 진동이 지난해 말부터 끊임없이 이어지고 있기 때문입니다.[인근 세대 주민 A 씨 : 제가 작년 12월에 이사를 왔거든요.,2025.08.19 17:03,https://news.sbs.co.kr/news/endPage.do?news_id=N1008222439,SBS
"테슬라, 중국 공략 재시동…""중국 맞춤형 '모델 Y L' 곧 출시""",https://img.sbs.co.kr/news/pc/thumb_v3.png,▲ 테슬라의 신형 '모델 Y L' 판매량 감소로 고전하는 테슬라가 세계 최대 전기차 시장인 중국에 특화한 모델을 출시하…,2025.08.19 16:59,https://news.sbs.co.kr/news/endPage.do?news_id=N1008222770,SBS
"강훈식 ""국채 발행 검토할 수밖에 없어…부동산 공급책 조속 발표""",https://img.sbs.co.kr/news/pc/thumb_v3.png,"▲ 강훈식 대통령비서실장이 19일 서울 용산 대통령실 청사에서 기자간담회를 하고 있다.강훈식 대통령 비서실장은 정부의 예산운용 기조와 관련해 ""재정만으로 경기를 살릴 수 있다고 생각하지 않지만, 재정을 빼고 경기를 살릴 수 있는 형편도 아니다""라며 '확장재정 기조'를 재확인했습니다.강 실장은 이날 대통령실에서 가진 기자간담회에서 ""지금은 재정 지출을 통해 경기를 살려야 한다""며 이같이 밝혔습니다.특히 강 실장은 정부가 국채 추가발행을 추진할 수 있다는 일각의 관측에 대해 ""사실 정해져 있는 답이다.",2025.08.19 16:55,https://news.sbs.co.kr/news/endPage.do?news_id=N1008222762,SBS
"이번에는 '화기애애'…트럼프 ""저 친구가 지난번에 당신 공격했어!""",https://img.sbs.co.kr/news/pc/thumb_v3.png,"'SBS ' ■ ■ ■ 이현식 SBS 뉴스브리핑팀 기자● 트럼프·젤렌스키 회담이현식 / SBS 기자""트럼프·젤렌스키 회담, 지난 2월 회담과 달리 화기애애""""미·우 양자회담 뒤, 유럽정상 참여 확대 다자회담""""트럼프, 회담 중 푸틴과 40분간 통화""● 이번엔 '화기애애'이현식 / SBS 기자""러시아, 우크라이나 아이들 2만 명 러시아로 보내...강제 입양""""멜라니아 여사, 푸틴에 공개 서한 보내""""젤렌스키 부인, 멜라니아 여사에게 감사 서한 전달"" ""트럼프, 공들여 제작한 편지 주고받는 외교방식 좋아해""▷ 편상욱 / 앵커 : 우리 시간으로 오늘 새벽 백악관에서 열린 트럼프 대통령과 젤렌스키 우크라이나 대통령의 회담이 큰 탈 없이 마무리됐습니다.",2025.08.19 16:51,https://news.sbs.co.kr/news/endPage.do?news_id=N1008222359,SBS
