title,thumbnail,short_content,write_time,link,company
"트럼프 ""푸틴, 잘해 주길 바라…젤렌스키도 유연함 보여줘야""",https://img.sbs.co.kr/newimg/news/20250819/202102297_300.jpg,"▲ 트럼프 미국 대통령도널드 트럼프 미국 대통령은 우크라이나의 안보 보장과 관련해 북대서양조약기구, 나토 회원 가입은 불가능하다고 못 박았습니다.트럼프 대통령은 현지시간 19일 폭스뉴스와의 전화 인터뷰에서 ""어떤 형태의 안보 보장은 필요할 것이지만 나토 가입은 아니다""라고 말했습니다.트럼프 대통령은 이어 ""그건 절대 일어나지 않을 일""이라며 ""당신이 러시아라면 적이 국경에 있는 걸 원하겠나""라고 되물었습니다.트럼프 대통령은 ""안보 문제에 있어서 그들에 병력을 파견하려 한다.우리는 그들을 돕고 싶다""며 ""아마도 당신은 방공 지원을 얘기할 수 있을 것이다.왜냐하면 우리처럼 그런 장비를 가진 나라는 없기 때문""이라고 말했습니다.트럼프 대통령은 미군이 우크라이나 국경을 보호하기 위해 배치되지는 않을 것이라고 밝힌 점을 지적하자 ""나는 보장할 수 있다.",2025.08.19 23:28,https://news.sbs.co.kr/news/endPage.do?news_id=N1008223014,SBS
"톨허스트 또 무실점 역투…LG, 롯데 9연패 밀어 넣고 선두 질주",https://img.sbs.co.kr/newimg/news/20250819/202102356_300.jpg,▲ 9일 서울 잠실야구장에서 열린 프로야구 롯데와 LG의 경기에서 승리한 LG선수들이 경기 후 환호하고 있다.LG 트윈스가 새 외국인…,2025.08.19 23:24,https://news.sbs.co.kr/news/endPage.do?news_id=N1008223012,SBS
"두산, 올 시즌 첫 5연승 질주…조성환 체제 '승률 5할'",https://img.sbs.co.kr/newimg/news/20250819/202102355_300.jpg,▲ 두산 정수빈두산 베어스가 갈 길 바쁜 한화 이글스를 제압하고 시즌 첫 5연승을 질주했습니다.조성환 감독 대행이 이끄는 두산은 오늘…,2025.08.19 23:21,https://news.sbs.co.kr/news/endPage.do?news_id=N1008223011,SBS
"마크롱 ""푸틴·젤렌스키 회담, 스위스 제네바 제안""",https://img.sbs.co.kr/newimg/news/20250819/202102296_300.jpg,에마뉘엘 마크롱 프랑스 대통령은 블라디미르 푸틴 러시아 대통령과 볼로디미르 젤렌스키 우크라이나 대통령 간 양자 회담을 중립국인 스위스에서 열자고…,2025.08.19 22:06,https://news.sbs.co.kr/news/endPage.do?news_id=N1008222998,SBS
"""미·유럽, 병력 수 확대 등 우크라이나 안보 보장안 마련 착수""",https://img.sbs.co.kr/news/pc/thumb_v3.png,▲ 훈련받는 우크라이나군미국과 유럽이 우크라이나 안보 보장안의 일환으로 종전 후 우크라이나의 병력 수를 제한 없이 확대할 수 있게 하…,2025.08.19 22:02,https://news.sbs.co.kr/news/endPage.do?news_id=N1008222997,SBS
클로징,https://img.sbs.co.kr/news/pc/thumb_v3.png,8시 뉴스 마칩니다.시청해 주신 여러분 고맙습니다.,2025.08.19 21:34,https://news.sbs.co.kr/news/endPage.do?news_id=N1008222948,SBS
[날씨] '처서 매직' 없다…밤낮 없는 무더위 계속,https://img.sbs.co.kr/news/pc/thumb_v3.png,"올여름 무더위 좀처럼 꺾일 기미가 안 보입니다.이번 주말이 절기 처서인데요.작년 여름에 이어 올여름도 처서 무렵에 더위가 마법처럼 수그러든다는,…",2025.08.19 21:33,https://news.sbs.co.kr/news/endPage.do?news_id=N1008222947,SBS
맨땅에 헤엄치듯 몸 날려…절묘한 2루타!,https://img.sbs.co.kr/news/pc/thumb_v3.png,프로야구 한화의 손아섭 선수가 마치 맨땅에 헤엄치듯 절묘하게 태그를 피해 2루타를 만들어냈습니다.,2025.08.19 21:33,https://news.sbs.co.kr/news/endPage.do?news_id=N1008222946,SBS
"심판들의 지옥훈련…""훈련소가 더 쉬웠어요""",https://img.sbs.co.kr/news/pc/thumb_v3.png,"명확한 판정을 위해, 코트를 누빌 체력이 뒷받침돼야 하는 프로농구 심판들은, 선수 못지않게 한여름 구슬땀을 흘리는데요.군사 훈련소만큼이나 힘들다는, 심판들의 체력 훈련 현장에, 전영민 기자가 다녀왔습니다.",2025.08.19 21:32,https://news.sbs.co.kr/news/endPage.do?news_id=N1008222945,SBS
'0:2 → 3:2' 짜릿한 뒤집기…'이렇게 좋을 수가',https://img.sbs.co.kr/news/pc/thumb_v3.png,"세계 정상급 선수들이 총출동한 유럽 스매시 1라운드에서, 탁구 대표팀 맏형 장우진 선수가, 세계 6위 프랑스 르브렁에 짜릿한 역전승을 거뒀습니다…",2025.08.19 21:32,https://news.sbs.co.kr/news/endPage.do?news_id=N1008222944,SBS
"메시와 나란히 '베스트 11'…""이타적인 슈퍼스타""",https://img.sbs.co.kr/newimg/news/20250819/202102346_300.jpg,LAFC의 손흥민 선수가 마이애미의 메시와 함께 미국 프로축구 주간 베스트 11에 선정됐습니다.지난 뉴잉글랜드전에서 완벽한 패스로 쐐기골을 어시…,2025.08.19 21:31,https://news.sbs.co.kr/news/endPage.do?news_id=N1008222943,SBS
"'체크스윙 비디오 판독' 첫선…""환영해""",https://img.sbs.co.kr/newimg/news/20250819/202102345_300.jpg,"타자가 스윙하다가 멈추는, 이른바 체크스윙의 스트라이크 여부를 가리는 비디오 판독이, 오늘부터 1군에서도 시작됐습니다. 선수들은 환영의 뜻을 나…",2025.08.19 21:31,https://news.sbs.co.kr/news/endPage.do?news_id=N1008222941,SBS
"'강선우 의원 갑질' 보도, 이달의 방송기자상 수상",https://img.sbs.co.kr/newimg/news/20250819/202102354_300.jpg,"SBS 탐사보도부 안상우, 정다은 기자가 '강선우 의원 갑질 및 청문회 거짓 해명 연속 보도'로, 방송기자연합회가 주관하는 제20…",2025.08.19 21:31,https://news.sbs.co.kr/news/endPage.do?news_id=N1008222940,SBS
"60세 이상 10명 중 6명 ""디지털기기 다루기 어려워요""",https://img.sbs.co.kr/newimg/news/20250819/202102342_300.jpg,"스마트폰 앱으로 기차표를 예매하거나 식당에서 키오스크로 음식을 주문하는 것, 누군가에게 쉬운 일이 누군가에겐 어려운 일일 수도 있습니다. 특히, 60세 이상 고령층에선 10명 중 6명이 이런 디지털 기기 조작에 어려움을 겪는 걸로 조사됐습니다.이혜미 기자가 취재했습니다.",2025.08.19 21:26,https://news.sbs.co.kr/news/endPage.do?news_id=N1008222938,SBS
"""녹조 위험 축소"" 논란 일자…환경부, '검사 지점' 바꾼다",https://img.sbs.co.kr/news/pc/thumb_v3.png,"강에 녹색 물감을 풀어놓은 듯한 이 녹조 현상은 매해 되풀이되며 해를 더해갈수록 심각해지고 있죠. 그동안 이 녹조를 측정할 때 물을 어디서, 어떻게 뜨느냐를 놓고 환경단체와 정부 사이에 논쟁이 있었는데요.",2025.08.19 21:24,https://news.sbs.co.kr/news/endPage.do?news_id=N1008222937,SBS
"김 총리 ""검찰 개혁 대원칙 정해졌지만 시기 조정 가능""",https://img.sbs.co.kr/news/pc/thumb_v3.png,정청래 민주당 대표가 오는 10월 추석 전에 검찰 개혁을 끝내겠다며 속도전을 펼치고 있죠. 그런데 김민석 국무총리가 오늘 검찰 개혁의 대원칙은 …,2025.08.19 21:22,https://news.sbs.co.kr/news/endPage.do?news_id=N1008222935,SBS
"기업인들 만나 ""관세협상 애써줘 감사""…방미 성과 당부",https://img.sbs.co.kr/news/pc/thumb_v3.png,경영계의 반발 속에서도 여당은 상법 개정안과 노란봉투법을 처리하겠다는 의지를 드러내고 있죠. 이런 상황에서 이재명 대통령이 미국 순방에 동행하는 기업인들을 만났습니다.,2025.08.19 21:20,https://news.sbs.co.kr/news/endPage.do?news_id=N1008222933,SBS
"사용자 범위 등 논란…'노란봉투법', 쟁점이 뭔지 봤더니",https://img.sbs.co.kr/news/pc/thumb_v3.png,이런 갈등에도 '노란봉투법'이 국회 본회의를 통과할 가능성은 매우 높습니다.막판까지 노란봉투법을 두고 경영계와 노동계가 맞붙는 이…,2025.08.19 21:17,https://news.sbs.co.kr/news/endPage.do?news_id=N1008222932,SBS
"[뉴스직격] ""지지율 하락? 복합적 이유"" vs ""NO! 조국 사면 때문""",https://img.sbs.co.kr/news/pc/thumb_v3.png,"""李 지지율 하락은 민감한 이슈 여러 개 몰아친 탓""""지지율 떨어졌다고 개혁 과제 경로 바뀌지 않아""""'노란봉투법' 2조, 이미 충분히 공론화 거친 법안""""'당정 협의 정례화' 목소리 이미 많았어...검찰 개혁과 맞물려""""李, 검찰 개혁 연말로 늦추라는 것 아냐...당정 소통하란 의미""""혁신당이 변수 될 수 있지만...수사·기소 분리 대원칙 있어""""지금 국힘 전당대회는 축제...전한길로 웃음 주고 있어""""난 정청래의 대변인 아닌 '민주당 대변인' 맡아""""'X맨' 전한길 활개쳐...국힘, 與 지지율 못 가져오는 상황""""국민의힘 'X맨'은 전한길, 與 'X맨'은 조국""""조국, 1일 1화두 던지는 중...우리 당 마음 한결 편해""""與 지지율, 예상대로 하락...'노봉법' 통과 시 지지율 더 하락할 것""""李, '검찰 개혁' 속도 조절하라는 무언의 압력""""전한길 행보 '창피해'...전당대회 들어가려고 구걸""""전한길, 쓸데없는 뉴스로 전당대회 다 덮고 있어""""국힘, 여당 복 있어...지지율 올리려면 전한길 논란 그만해야""■ 주영진의 뉴스직격 (FM 103.5 MHz 17:00 ∼ 18:00)■ 일자 : 2025년 8월 19일 ■ 진행 : 주영진 SBS 앵커■ 출연 : 부승찬 더불어민주당 의원, 김소희 국민의힘 의원▷주영진: 두 분 나오셨습니다.",2025.08.19 21:14,https://news.sbs.co.kr/news/endPage.do?news_id=N1008222965,SBS
"임종훈-신유빈, WTT 유럽 스매시 혼복서 스웨덴 조 꺾고 8강행",https://img.sbs.co.kr/news/pc/thumb_v3.png,▲ 파이팅 외치는 임종훈과 신유빈한국 탁구의 '황금 콤비' 임종훈 조가 세계 정상급 선수들이 총출동한 월드테이블테니스 …,2025.08.19 21:14,https://news.sbs.co.kr/news/endPage.do?news_id=N1008222983,SBS
"'노란봉투법' 국회 본회의 처리 임박…노사, 막판 총력전",https://img.sbs.co.kr/newimg/news/20250819/202102328_300.jpg,"이른바 '노란봉투법'으로 불리는 노동조합법 개정안의 국회 본회의 처리가 다가오면서 재계는 법안 수정을, 노동계는 원안 통과를 요구하며 막판 총력전을 벌이고 있습니다.",2025.08.19 21:13,https://news.sbs.co.kr/news/endPage.do?news_id=N1008222931,SBS
"박정훈 인터뷰 : 이번 전대, 이 두 장면!…""당원들에게 각성효과"" [스프]",https://img.sbs.co.kr/newimg/news/20250819/202102272_300.jpg,※ 'SBS 유튜브 <정치컨설팅 스토브리그>' 를 정확히 밝혀주시기 바랍니다. (아래 내용은 8월 19일 방송을 바탕으로 정리했습니다.)정유미 기자 : 보니까 대선 끝나고는 처음 모시는 거네요.,2025.08.19 21:11,https://news.sbs.co.kr/news/endPage.do?news_id=N1008221123,SBS
"[단독] UN 출신 최정원 입건…""자해 암시"" 원룸 무슨 일",https://img.sbs.co.kr/newimg/news/20250819/202102327_300.jpg,"가수 출신 배우 최정원 씨가 스토킹 혐의로 경찰에 입건된 것으로 저희 취재 결과 확인됐습니다. 피해자에게 접근할 수 없고, 연락도 할 수 없도록 법원의 긴급응급조치 명령까지 내려졌습니다.",2025.08.19 21:07,https://news.sbs.co.kr/news/endPage.do?news_id=N1008222927,SBS
무너짐 방지 시설 제거한 게 붕괴 원인…관리 감독 부실,https://img.sbs.co.kr/newimg/news/20250819/202102325_300.jpg,"지난 2월, 10명의 사상자가 발생한 세종안성고속도로 붕괴 사고에 대한 조사 결과가 나왔습니다. 무너지는 걸 막는 안전장치를 임의로 제거했던 것…",2025.08.19 21:05,https://news.sbs.co.kr/news/endPage.do?news_id=N1008222930,SBS
[단독] 비닐하우스 안 수상한 차량…박스갈이 딱 걸렸다,https://img.sbs.co.kr/news/pc/thumb_v3.png,"강원도 횡성은 지역 특산품으로 한우와 함께 고랭지에서 재배한 방울토마토가 유명합니다. 그런데 평창에서 생산된 토마토를 값이 더 비싼 횡성산으로 둔갑시키는, 이른바 '박스갈이' 현장이 취재진에 포착됐습니다.G1 방송 박성준 기자의 단독 보도입니다.",2025.08.19 21:00,https://news.sbs.co.kr/news/endPage.do?news_id=N1008222929,SBS
"""도와주세요"" 한마디에 우르르…시민 구한 남성들 정체",https://img.sbs.co.kr/news/pc/thumb_v3.png,"서울의 한 식당에서 밥을 먹던 경찰관들이 의식을 잃고 쓰러진 60대 남성을 구한 일이 뒤늦게 알려져 화제입니다. 동기 경찰관인 이들은 빠르게 역할을 분담해 응급조치했고, 남성을 목숨을 구해냈습니다.김보미 기자가 이 경찰들을 만났습니다.",2025.08.19 20:54,https://news.sbs.co.kr/news/endPage.do?news_id=N1008222928,SBS
"""갑자기 사이렌"" 아파트서 화재…""수십 개 발견"" 봤더니",https://img.sbs.co.kr/news/pc/thumb_v3.png,이틀 전 서울 마포구의 한 아파트에서 전동스쿠터 배터리가 원인으로 추정되는 불이 나서 큰 인명 피해로 이어졌습니다. 그런데 오늘 경기 동두천의 아파트에서도 캠핑용 배터리가 폭발해 6명이 다쳤습니다.동은영 기자가 취재했습니다.,2025.08.19 20:51,https://news.sbs.co.kr/news/endPage.do?news_id=N1008222926,SBS
'사망보험금' 55세부터 연금으로 받는다…'대상자' 보니,https://img.sbs.co.kr/news/pc/thumb_v3.png,"사후에나 받을 수 있었던 사망보험금을 가입자가 살아있을 때, 노후 연금처럼 받을 수 있는 상품이 10월부터 출시됩니다. 보험료를 모두 낸 만 55세 이상 가입자면 누구나 신청할 수 있습니다.자세한 내용 박재현 기자가 전하겠습니다.",2025.08.19 20:48,https://news.sbs.co.kr/news/endPage.do?news_id=N1008222925,SBS
'핵심 비선' 잇따랐던 의혹…결국 세 번째 구속영장 청구,https://img.sbs.co.kr/news/pc/thumb_v3.png,"건진법사 전성배 씨는 윤석열 대선 후보 시절부터 '핵심 비선'이란 의혹이 끊이질 않았지만, 대통령실은 매번 일축해 왔습니다. 하지만 검찰과 특검 수사를 통해 의혹의 실체가 드러났고, 결국, 전 씨에 대한 세 번째 구속영장이 청구됐습니다.원종진 기자입니다.",2025.08.19 20:43,https://news.sbs.co.kr/news/endPage.do?news_id=N1008222916,SBS
"""체코 원전 수출하려고 이렇게까지…"" 굴욕 논란 터지자",https://img.sbs.co.kr/news/pc/thumb_v3.png,"한국수력원자력과 한국전력이 체코 원전 수출을 위해 미국의 웨스팅하우스와 불리한 계약을 맺었다는 논란이 불거졌습니다. 원전 한 기를 수출할 때마다 1조 원이 넘는 일감과 기술 사용료를 챙겨줘야 한다는 내용인데, 대통령실은 진상 파악을 지시했습니다.김관진 기자의 보도입니다.",2025.08.19 20:38,https://news.sbs.co.kr/news/endPage.do?news_id=N1008222924,SBS
"""명백한 전쟁 도발 의지""…광복절 메시지에도 북한 냉랭",https://img.sbs.co.kr/newimg/news/20250819/202102305_300.jpg,북한 김정은 총비서가 한미 연합훈련은 명백한 전쟁 도발의 의지라고 비난했습니다. 이재명 대통령이 광복절 경축사에서 어떤 형태의 흡수통일도 추구하…,2025.08.19 20:36,https://news.sbs.co.kr/news/endPage.do?news_id=N1008222923,SBS
"""조건 없이 회담""…'영토 분할-안전 보장' 합의 가능할까",https://img.sbs.co.kr/newimg/news/20250819/202102303_300.jpg,"우크라이나 종전 논의가 급물살을 타는 모습입니다. 러시아와 우크라이나의 회담이 성사된다면, 바로 그 자리에서 우크라이나 전쟁의 운명이 결정될 가능성이 큽니다.",2025.08.19 20:33,https://news.sbs.co.kr/news/endPage.do?news_id=N1008222922,SBS
"젤렌스키 공개 망신 주더니…""멋지다"" 돌연 칭찬 날렸다",https://img.sbs.co.kr/newimg/news/20250819/202102330_300.jpg,지난 2월 트럼프와의 정상회담에 나온 젤렌스키 대통령입니다.복장 때문에 친트럼프 기자에게 공개 면박을 당하기도 했죠.[볼로디미르 젤렌스키/우크라…,2025.08.19 20:32,https://news.sbs.co.kr/news/endPage.do?news_id=N1008222921,SBS
"[앵커 인터뷰 ㅅㄱㅅㄱ] ""방송국 x들이! 그걸 또!"" 하이다이버 최병화의 고성과 눈물!",https://img.sbs.co.kr/newimg/news/20250819/202102290_300.jpg,"SBS 8뉴스의 사공성근 앵커의 사심 충만 인터뷰 ‘ㅅㄱㅅㄱ’. 아파트 10층 높이에서 뛰어내리는 것도 놀라운데, 인터뷰 한 번으로 100만 뷰를 기록한! 대한민국 최초, 유일의 하이다이빙 최병화 선수를 모셨습니다.",2025.08.19 20:28,https://news.sbs.co.kr/news/endPage.do?news_id=N1008222829,SBS
"푸틴-젤렌스키 담판 조율 중…""종전 협상, 2주 내 결론""",https://img.sbs.co.kr/news/pc/thumb_v3.png,"젤렌스키 우크라이나 대통령과 유럽 주요국 정상들을 잇따라 만난 트럼프 미국 대통령이, 젤렌스키와 푸틴 러시아 대통령의 정상회담을 조율하고 있다고 밝혔습니다.",2025.08.19 20:24,https://news.sbs.co.kr/news/endPage.do?news_id=N1008222920,SBS
'선로 진입한 지 7분 만에…' 열차 감지기 있었는데 참변,https://img.sbs.co.kr/news/pc/thumb_v3.png,이번 사고는 인재라는 지적이 나오고 있습니다. 작업자들이 선로에 들어간 지 불과 7분 만에 사고가 발생한 데다 열차가 다가오는 걸 알 수 있는 …,2025.08.19 20:19,https://news.sbs.co.kr/news/endPage.do?news_id=N1008222919,SBS
선로 점검하다 열차에 그대로 치여…2명 사망·5명 부상,https://img.sbs.co.kr/news/pc/thumb_v3.png,"경북 청도에서 기차 선로를 점검하던 작업자 7명이 열차에 치여 2명이 숨지고, 5명이 다쳤습니다. 사고가 난 열차는 소음이 거의 없는 전기 기차라, 작업자들이 열차가 다가오는 걸 듣지 못해 사고를 당한 것으로 추정됩니다.먼저 TBC 박가영 기자가 보도합니다.",2025.08.19 20:16,https://news.sbs.co.kr/news/endPage.do?news_id=N1008222918,SBS
"""김기현 당대표 당선 도와"" 전 통일교 본부장 진술 확보",https://img.sbs.co.kr/news/pc/thumb_v3.png,"김건희 특검팀이 어제 기소된 통일교 전 핵심 간부로부터, 국민의힘 전당대회에 통일교가 조직적으로 개입했단 진술을 확보한 걸로 파악됐습니다. 현장 연결해서 자세한 소식 물어보겠습니다.김지욱 기자, 통일교 전 간부의 진술 내용부터 집어주시죠.",2025.08.19 20:10,https://news.sbs.co.kr/news/endPage.do?news_id=N1008222917,SBS
"건진법사 구속영장 청구…특검 ""진술 일관되지 못하다""",https://img.sbs.co.kr/news/pc/thumb_v3.png,"김건희 특검팀은 건진법사 전성배 씨에 대한 구속영장을 청구했습니다. 전 씨는 통일교 측으로부터 각종 교단 현안을 청탁받고, 김 여사 선물용으로 고가의 명품들을 건네받은 혐의를 받습니다.",2025.08.19 20:06,https://news.sbs.co.kr/news/endPage.do?news_id=N1008222913,SBS
"""계엄 문건 못 봤다""지만…'허위 증언에 가담 정황' 의심",https://img.sbs.co.kr/news/pc/thumb_v3.png,"한덕수 전 총리는 12·3 비상계엄 당일 계엄 선포문을 못 봤고, 계엄을 막기 위해 국무회의 소집을 건의한 것이라고 주장해 왔습니다. 그러나 특검팀은 수사를 통해 확인한 증거와 정황들로 볼 때, 한 전 총리의 주장이 사실과 다르다고 보고 있습니다.이어서, 백운 기자의 보도입니다.",2025.08.19 20:05,https://news.sbs.co.kr/news/endPage.do?news_id=N1008222911,SBS
"한덕수, '피의자 신분' 소환조사…""헌재 때와 상황 달라""",https://img.sbs.co.kr/newimg/news/20250819/202102275_300.jpg,"윤석열 정부 시절 국정 2인자였던 한덕수 전 총리가 피의자 신분으로 내란 특검팀에 출석했습니다. 한 전 총리는 자신은 계엄과 무관하다며 지난 대선에서 출마 선언까지 했지만, 특검팀은 한 전 총리가 내란에 동조한 걸로 의심하고 있습니다.",2025.08.19 20:02,https://news.sbs.co.kr/news/endPage.do?news_id=N1008222910,SBS
'출장비 공금 허위 청구' 전현직 서대문구의원 1심 벌금형,https://img.sbs.co.kr/newimg/news/20250819/202102274_300.jpg,▲ 서대문구의회출장비를 허위 청구해 공금을 챙긴 전·현직 서대문구의원에게 벌금형이 내려졌습니다.서울서부지법 형사9단독 김민정 판사는 …,2025.08.19 19:45,https://news.sbs.co.kr/news/endPage.do?news_id=N1008222960,SBS
오늘의 SBS 8뉴스 예고 (8월 19일),https://img.sbs.co.kr/newimg/news/20250721/202093471_300.jpg,"오늘 <SBS 8뉴스>에서는▶ 내란 특검, 한덕수 전 총리 피의자 신분으로 소환...불법 계엄 가담 혐의▶ 김건희 특검, …",2025.08.19 19:38,https://news.sbs.co.kr/news/endPage.do?news_id=N1008222834,SBS
"[8뉴스 예고] 한덕수 전 총리, 피의자 신분으로 특검 출석",https://img.sbs.co.kr/newimg/news/20250819/202102270_300.jpg,"8시 뉴스 주요 내용 살펴봅니다.1. 한덕수 전 총리, 피의자 신분으로 특검 출석윤석열 정부의 국정 2인자였던 한덕수 전 국무총리가 오늘 피의자 신분으로 특검에 출석했습니다.",2025.08.19 18:59,https://news.sbs.co.kr/news/endPage.do?news_id=N1008222833,SBS
"""중대재해 나면 대출 불이익""…금융권 여신 심사에 리스크 반영",https://img.sbs.co.kr/news/pc/thumb_v3.png,"금융 당국이 금융권 대출 심사에 '중대재해 리스크'를 본격 반영할 것으로 전망됩니다.기업에서 중대재해가 발생한 경우 대출 규모, …",2025.08.19 18:58,https://news.sbs.co.kr/news/endPage.do?news_id=N1008222936,SBS
"하마스, 완화된 휴전 중재안에 동의…협상 진전?",https://img.sbs.co.kr/news/pc/thumb_v3.png,▲ 가자지구의 폐허가 된 건물들팔레스타인 무장정파 하마스가 이전보다 완화된 가자지구 휴전안을 수용하면서 한동안 교착 상태에 빠진 협상…,2025.08.19 18:57,https://news.sbs.co.kr/news/endPage.do?news_id=N1008222934,SBS
"미 상원의원, 조선 3사와 간담회…업계 ""미국 규제 완화 필요""",https://img.sbs.co.kr/news/pc/thumb_v3.png,▲ 미 상원의원-조선 3사 간담회한국을 방문 중인 미 상원의원들이 국내 조선업계와 한국 정부 관계자와 만나 미국 내 규제 완화 필요성…,2025.08.19 18:55,https://news.sbs.co.kr/news/endPage.do?news_id=N1008222914,SBS
"[현장영상] ""CPR 할 수 있는 분!"" 다급한 외침에 우르르 뛰어나오더…'착착착' 5분 안에 기적 이뤄낸 동기 경찰",https://img.sbs.co.kr/news/pc/thumb_v3.png,서울의 한 식당에서 식사를 하던 동기 경찰관들이 의식을 잃고 쓰러진 60대 할아버지를 신속하게 구한 일이 뒤늦게 알려져 화제입니다.빠르게 역할을…,2025.08.19 18:48,https://news.sbs.co.kr/news/endPage.do?news_id=N1008222735,SBS
"정청래, 민주 지지율 하락에 ""높아질 수 있도록 하겠다""",https://img.sbs.co.kr/news/pc/thumb_v3.png,▲ 더불어민주당 정청래 대표가 19일 경북 경주시 경주화백컨벤션센터에 조성 중인 아시아태평양경제협력체 정상회의장을 찾아 관계자의 설명…,2025.08.19 18:42,https://news.sbs.co.kr/news/endPage.do?news_id=N1008222903,SBS
"""잠깐, 미국 전쟁 나면!"" 트럼프 정상회담 중 포착된 '장면들'…""미친 소리 같지?"" 백악관 '우르르' 깜짝 놀란 이유가 (트럼프 NOW)",https://img.sbs.co.kr/news/pc/thumb_v3.png,"트럼프 미국 대통령과 볼로디미르 젤렌스키 우크라이나 대통령, 7명의 유럽 정상 및 정상급 지도자들이 18일 백악관에서 우크라이나 종전 논의를 위…",2025.08.19 18:28,https://news.sbs.co.kr/news/endPage.do?news_id=N1008221916,SBS
"강훈식 ""'불확실성이 뉴노멀' 통상 환경…미 끊임없는 협상 예고""",https://img.sbs.co.kr/newimg/news/20250819/202102268_300.jpg,▲ 강훈식 대통령비서실장이 19일 서울 용산 대통령실 청사에서 기자간담회를 하고 있다.강훈식 대통령 비서실장은 한미 관세협상과 관련해…,2025.08.19 18:23,https://news.sbs.co.kr/news/endPage.do?news_id=N1008222889,SBS
"""원주국토관리청, 터널 붕괴 사고 책임 안 따지고 공사비 늘려줘""",https://img.sbs.co.kr/newimg/news/20250819/202102267_300.jpg,"▲ 터널 붕괴 사진감사원은 도로 건설 당시 부실시공으로 터널이 붕괴했는데, 당국이 원인을 알아보지 않고 관련 제재도 없었다고 밝혔습니…",2025.08.19 18:22,https://news.sbs.co.kr/news/endPage.do?news_id=N1008222887,SBS
작년 공공기관 청탁금지법 위반으로 제재 446명…역대 최다,https://img.sbs.co.kr/newimg/news/20240717/201959495_300.jpg,▲ 국민권익위원회청탁금지법을 위반해 제재를 받은 공공기관 소속 공직자 수가 지난해 가장 많았던 것으로 나타났습니다.국민권익위원회는 청…,2025.08.19 18:19,https://news.sbs.co.kr/news/endPage.do?news_id=N1008222885,SBS
