title,thumbnail,short_content,write_time,link,company
"[자막뉴스] ""기가 막힐 따름""…또 '업글'된 도쿄 내 독도 영유 주장 전시관",https://img.sbs.co.kr/newimg/news/20250509/202069526_300.jpg,"관람객이 커다란 몰입형 시어터를 통해 독도의 모습을 감상합니다.이곳은 일본 도쿄에 위치한 영토·주권 전시관.이 전시관은 일본 정부가 독도를 비롯해 센카쿠열도, 쿠릴 열도 남단 4개 섬 등에 대한 영유권을 주장하기 위해 2018년 건립했습니다.2020년 한 차례 확장 이전을 거친 뒤, 지난 4월에 몰입형 시어터와 애니메이션 등 체험형 전시 콘텐츠를 추가해 재개관했습니다.본격적으로 영유권 홍보에 나선 데 대해 '독도 지킴이' 서경덕 교수는 SNS를 통해 ""최근 직접 방문해 달라진 전시 시설들을 확인했다""고 전했습니다.[서경덕/성신여대 교수 : 새로 단장한 전시관은 몰입형 씨어터 애니메이션 영상 시설을 갖춰 초중고 학생들이 견학을 하기 좋겠다는 그런 느낌이 들었고요.",2025.05.09 18:21,https://news.sbs.co.kr/news/endPage.do?news_id=N1008094685,SBS
"""김주애, 가장 사랑하는 따님""…김정은, 러 전승절에 러시아대사관 방문",https://img.sbs.co.kr/newimg/news/20250509/202069541_300.jpg,▲ 김정은 북한 국무위원장이 소련의 제2차 세계대전 승리 80주년을 맞아 9일 딸 주애와 평양 주재 러시아 대사관을 방문했다.북한 매…,2025.05.09 18:07,https://news.sbs.co.kr/news/endPage.do?news_id=N1008094758,SBS
[날씨] 전국 촉촉이 적신 봄비…강한 바람 유의,https://img.sbs.co.kr/newimg/news/20250509/202069535_300.jpg,금요일인 오늘 전국에 봄비가 내리고 있습니다.현재 이 시각 서초대로의 화면인데요.도로 곳곳으로 물웅덩이가 살펴지고 있는 만큼 퇴근길 감속 운전하…,2025.05.09 18:06,https://news.sbs.co.kr/news/endPage.do?news_id=N1008094644,SBS
SKT 소비자들 '위약금 면제 · 30만 원 배상' 집단분쟁조정 신청,https://img.sbs.co.kr/newimg/news/20250509/202069533_300.jpg,SK텔레콤 해킹과 관련해 소비자들이 위약금 없이 가입을 중도 해지할 수 있게 해 달라는 집단 분쟁조정을 신청했습니다.이철우 변호사는 SK텔레콤 …,2025.05.09 18:03,https://news.sbs.co.kr/news/endPage.do?news_id=N1008094641,SBS
'파크 골프장의 메카' 꿈꾸는 양평…추가 조성 추진,https://img.sbs.co.kr/news/pc/thumb_v3.png,"전국 최대 규모의 파크골프장이 있는 경기도 양평군이 '파크 골프장의 성지'를 꿈꾸고 있다는 소식입니다.유영수 기자입니다. 경기도 양평군 강상면에 있는 양평 파크 골프장입니다.장애인을 위한 코스 18홀을 비롯해 전체 81홀로 구성돼 있습니다.전국 최대 규모로, 공식 대회가 정기적으로 개최되고 동호회 활동도 활발합니다.지난해 양평군민을 비롯해 모두 16만 명 가까운 이용객이 찾을 정도로 인기가 높습니다.[성점연/양평군 강상면 : 저 일부러 골프장 때문에 이사 왔어요, 서울에서.",2025.05.09 18:01,https://news.sbs.co.kr/news/endPage.do?news_id=N1008094640,SBS
"[트럼프NOW] ""롤스로이스는 미국서 안 만들테니"" 영국과 첫 무역합의…한국은?",https://img.sbs.co.kr/news/pc/thumb_v3.png,관세전쟁을 선포한 미국이 영국과 첫 무역협상을 타결했습니다.영국은 미국이 무역 흑자를 보고 있는 '쉬운 협상 상대'로 평가되고 있…,2025.05.09 17:59,https://news.sbs.co.kr/news/endPage.do?news_id=N1008094464,SBS
"[속보] 법원, '국민의힘 전당대회 금지·후보확인' 가처분 모두 기각",https://img.sbs.co.kr/news/pc/thumb_v3.png,▲ 국민의힘 김문수 대선 후보국민의힘 김문수 대선 후보가 후보자 지위를 인정해 달라며 낸 가처분 신청을 법원이 받아들이지 않았습니다.…,2025.05.09 17:58,https://news.sbs.co.kr/news/endPage.do?news_id=N1008094747,SBS
"'뽀빠이 아저씨' 이상용 81세로 별세…""심정지로 쓰러져""",https://img.sbs.co.kr/news/pc/thumb_v3.png,▲ 뽀빠이 이상용인기 군 위문 프로그램 '우정의 무대' MC를 지낸 방송인 '뽀빠이' 이상용 씨가 향년 …,2025.05.09 17:58,https://news.sbs.co.kr/news/endPage.do?news_id=N1008094746,SBS
청주 국제공예공모전에 71개국 참여…역대 최다,https://img.sbs.co.kr/news/pc/thumb_v3.png,올해 청주 비엔날레 국제 공예공모전에 역대 가장 많은 국가가 참여했습니다.청주 공예 비엔날레 조직위는 지난 2일까지 진행된 청주 국제 공예공모전…,2025.05.09 17:55,https://news.sbs.co.kr/news/endPage.do?news_id=N1008094636,SBS
"[취재파일] ""전례 없다"" vs ""도리 아냐""…단일화, 누구 말이 맞을까 [사실은]",https://img.sbs.co.kr/news/pc/thumb_v3.png,"▲ 무소속 한덕수 대선 예비후보가 지난 8일 서울 국회 사랑재에 위치한 커피숍에서 국민의힘 김문수 대선후보와 후보 단일화 관련 회동을 가졌다.국민의힘 대선 경선을 뚫고 올라온 김문수 후보와 한덕수 전 국무총리, 두 사람의 단일화가 이번 대선에서 가장 뜨거운 이슈로 부상했습니다.",2025.05.09 17:55,https://news.sbs.co.kr/news/endPage.do?news_id=N1008094652,SBS
북진천 나들목 '진천선수촌IC' 명칭 변경 재추진,https://img.sbs.co.kr/newimg/news/20250509/202069529_300.jpg,"평택제천고속도로 북진천IC 근처에는 우리나라 엘리트 스포츠의 요람인 국가대표 진천선수촌이 자리하고 있습니다. 지난 2018년, 북진천IC의 이름을 진천선수촌IC로 바꾸자는 제안이 있었지만 결과적으로는 무산됐는데요.",2025.05.09 17:54,https://news.sbs.co.kr/news/endPage.do?news_id=N1008094635,SBS
"[속보] 법원, '김문수 국민의힘 대선후보 지위 인정' 가처분 기각",https://img.sbs.co.kr/newimg/news/20250509/202069500_300.jpg,"법원, '김문수 국민의힘 대선후보 지위 인정' 가처분 기각",2025.05.09 17:51,https://news.sbs.co.kr/news/endPage.do?news_id=N1008094736,SBS
20살 생일 맞은 '국내 최고령' 백두산 호랑이,https://img.sbs.co.kr/newimg/news/20250509/202069525_300.jpg,"<오! 클릭> 마지막 검색어는 '국내 최고령 백두산 호랑이의 생일'입니다.우리나라에서 가장 나이가 많다고 알려진 백두산 호랑이, …",2025.05.09 17:49,https://news.sbs.co.kr/news/endPage.do?news_id=N1008094634,SBS
나날이 발전하는 제모 기술…새 삶 찾은 태국 여성,https://img.sbs.co.kr/newimg/news/20250509/202069523_300.jpg,희귀 질환으로 생긴 많은 털 때문에 놀림을 받던 태국 여성이 현재 완전히 다른 모습으로 살고 있어 화제입니다.<오! 클릭> 세 번째 검색어 &#…,2025.05.09 17:44,https://news.sbs.co.kr/news/endPage.do?news_id=N1008094633,SBS
"춤 실력 뽐내는 대학교수…""재능 찾으신 듯""",https://img.sbs.co.kr/news/pc/thumb_v3.png,<오! 클릭> 두 번째 검색어 '조회수 폭발한 교수님 댄스'입니다.얼핏 보면 뮤직비디오나 요즘 흔히 볼 수 있는 댄스 챌린지 영상…,2025.05.09 17:42,https://news.sbs.co.kr/news/endPage.do?news_id=N1008094632,SBS
"[단독] 정은경 ""의대 증원 어느 정도 필요"" (D리포트)",https://img.sbs.co.kr/news/pc/thumb_v3.png,국내 코로나19 환자 발생 이후 2년여간 문재인 정부의 방역 대응을 총괄했던 정은경 전 질병관리청장. 이번 대선을 앞두고 민주당 선거대책위원회에…,2025.05.09 17:41,https://news.sbs.co.kr/news/endPage.do?news_id=N1008094561,SBS
"[D리포트] ""20대 인기 브랜드 특히 조심""…SNS 사기 광고 기승",https://img.sbs.co.kr/news/pc/thumb_v3.png,인스타그램을 훑다가 유명 캐주얼 칼하트의 옷들을 80% 파격 할인한다는 광고를 보게 된 김 모 씨.봄맞이 할인행사를 하고 있다기에 의심 없이 광…,2025.05.09 17:40,https://news.sbs.co.kr/news/endPage.do?news_id=N1008094697,SBS
제주 강풍에 항공편 무더기 결항·지연…악천후 사고도 잇따라,https://img.sbs.co.kr/news/pc/thumb_v3.png,▲ 제주도에 호우특보가 내려진 9일 오전 제주시 산지천 인근에서 수학여행 온 학생들이 우산을 쓰고 이동하고 있다.제주에 강한 비바람이…,2025.05.09 17:38,https://news.sbs.co.kr/news/endPage.do?news_id=N1008094722,SBS
음주 운전하다 차량 전도…그대로 두고 '줄행랑',https://img.sbs.co.kr/news/pc/thumb_v3.png,끊이질 않는 음주 운전에 대해서 더욱더 강력한 대책이 필요하다는 지적이 커지고 있습니다.얼마 전 서울 도심의 한 도로에서도 음주 운전으로 아찔한…,2025.05.09 17:38,https://news.sbs.co.kr/news/endPage.do?news_id=N1008094631,SBS
"[자막뉴스] '뽀빠이' 이상용 씨 별세, 향년 81세…""우리 어머니가 확실합니다"" 이제는 영원히 추억으로",https://img.sbs.co.kr/news/pc/thumb_v3.png,'뽀빠이 아저씨'로 유명한 방송인 이상용 씨가 오늘 낮 12시 45분쯤 향년 81세로 별세했습니다. 이 씨는 건강상 이유로 오늘 오전 서울 서초구 자택 인근 병원을 다녀오는 길에 쓰러진 것으로 전해졌습니다.,2025.05.09 17:38,https://news.sbs.co.kr/news/endPage.do?news_id=N1008094703,SBS
[뉴블더] 앞으로 노인이 노인 돌본다…곧 닥칠 현실,https://img.sbs.co.kr/newimg/news/20250509/202069514_300.jpg,지금으로부터 18년 후인 2043년에는 요양보호사 열 명 중 일곱 명이 60세 이상일 전망입니다.젊은 사람이 부족해 노인이 노인을 돌봐야 하는 …,2025.05.09 17:37,https://news.sbs.co.kr/news/endPage.do?news_id=N1008094309,SBS
"[컬쳐로드] 뉴욕에서 런던...K뮤지컬, 뮤지컬 심장 입성",https://img.sbs.co.kr/newimg/news/20250509/202069515_300.jpg,한국 제작사가 만든 K뮤지컬 위대한 개츠비가 세계 뮤지컬의 심장 뉴욕 브로드웨이와 런던 웨스트엔드에서 신성한 파장을 불러일으키고 있습니다. 미국…,2025.05.09 17:37,https://news.sbs.co.kr/news/endPage.do?news_id=N1008094723,SBS
"'관중 사상' 창원NC파크, 시설물 정비 후 이르면 이달 재개장",https://img.sbs.co.kr/newimg/news/20250329/202055454_300.jpg,"▲ 창원 NC파크 전경지난 3월 구조물 추락으로 관중 사상 사고가 발생한 뒤, 문을 닫은 경남 창원NC파크에서 이르면 이달 중 경기가…",2025.05.09 17:33,https://news.sbs.co.kr/news/endPage.do?news_id=N1008094719,SBS
'미국 출신은 곤란' 금기 깼다…새 교황 레오 14세는 누구?,https://img.sbs.co.kr/newimg/news/20250509/202069472_300.jpg,'SBS <편상욱의 뉴스브리핑>' ■ <편상욱의 뉴스브리핑> ■ ■ 김헌식 중원대학교 특임교수/문…,2025.05.09 17:30,https://news.sbs.co.kr/news/endPage.do?news_id=N1008094299,SBS
[D리포트] 인간 뇌 닮은 컴퓨터 칩 속속 개발…10년 뒤 상용화 될까?,https://img.sbs.co.kr/news/pc/thumb_v3.png,"눈부시게 발전하는 AI 기술, 그러나 엄청난 전력 소비는 고민거립니다.[최혜림/SBS 그랜드 퀘스트 진행자 : 미국 텍사스에 있는 마이크로소프트 데이터 센터 사진입니다.",2025.05.09 17:27,https://news.sbs.co.kr/news/endPage.do?news_id=N1008094696,SBS
"[자막뉴스] '빵부빵조'…꿈인가? ""성심당에 간식 샌드위치 146개를""",https://img.sbs.co.kr/news/pc/thumb_v3.png,대전의 한 샌드위치 가게가 유명 빵집 성심당으로부터 샌드위치 146개를 주문받은 사연이 화제입니다.지난 8일 은행동에서 샌드위치 가게를 운영하는…,2025.05.09 17:20,https://news.sbs.co.kr/news/endPage.do?news_id=N1008094518,SBS
"250억대 주한미군 납품 담합, 한미 공조 수사로 '적발'",https://img.sbs.co.kr/news/pc/thumb_v3.png,주한 미군에 들어가는 250억 원대 시설과 물품 용역 입찰에서 담합을 벌인 업체 임직원들이 무더기로 재판에 넘겨졌습니다. 한국과 미국이 동시에 …,2025.05.09 17:19,https://news.sbs.co.kr/news/endPage.do?news_id=N1008094627,SBS
"'집단유급'에 내년 의대 1학년 6천여 명될 듯…""신입생 우선교육""",https://img.sbs.co.kr/news/pc/thumb_v3.png,"정부와 대학이 이달 7일을 미복귀 의대생에 대한 유급·제적 마지노선으로 정하고 설득에 총력을 벌였지만, 수업 참여율이 34%에 그치면서 대규모 …",2025.05.09 17:16,https://news.sbs.co.kr/news/endPage.do?news_id=N1008094689,SBS
의대생 '8천305명' 유급 확정…46명은 제적,https://img.sbs.co.kr/news/pc/thumb_v3.png,"수업 불참 등을 사유로 전국 40개 의과대학에서 8천3백여 명이 유급, 40여 명이 제적 대상자로 확정됐다고 교육부가 밝혔습니다. 의대생 단체들…",2025.05.09 17:15,https://news.sbs.co.kr/news/endPage.do?news_id=N1008094620,SBS
프로야구 인천·잠실·수원·대구 우천 취소…내일 더블헤더,https://img.sbs.co.kr/news/pc/thumb_v3.png,"▲ 경기장을 점검하는 김시진 경기 운영위원오늘 오후 6시 30분에 열릴 예정이던 프로야구 KIA 타이거즈-SSG 랜더스, NC 다이노…",2025.05.09 17:13,https://news.sbs.co.kr/news/endPage.do?news_id=N1008094693,SBS
"검찰, AI 형사법 연구회 출범…""업무 활용 방안 논의""",https://img.sbs.co.kr/newimg/news/20250321/202052355_300.jpg,검찰이 내부 연구회를 꾸리고 인공지능 기술을 검찰 업무에 적용할 방안을 모색할 예정입니다.대검찰청은 오늘 오후 심우정 검찰총장 주재로 '…,2025.05.09 17:12,https://news.sbs.co.kr/news/endPage.do?news_id=N1008094691,SBS
"이재명 ""법관회의, 문제해결 과정…사법부가 총구난사하면 고쳐야""",https://img.sbs.co.kr/newimg/news/20250509/202069493_300.jpg,"▲ 더불어민주당 이재명 대선 후보가 제3차 골목골목 경청투어로 경북지역 방문에 나선 9일 경북 칠곡군 석적읍 방문을 마친 뒤 다음 일정으로 이동하며 지지자들에게 인사하고 있다.더불어민주당 이재명 대선후보는 오늘 자신의 선거법 사건에 대한 대법원의 파기환송 판결을 둘러싼 논란과 관련해 전국법관대표회의가 26일 소집된 것을 두고 ""문제를 해결해 가는 과정 중 일부""라고 말했습니다.이 후보는 오늘 경북 김천시에서 '경청투어'를 진행하던 중 기자들을 만나 관련 질문이 나오자 ""금방 열릴 줄 알았는데 상당히 뒤로 미뤄졌다""며 이같이 말했습니다.이 후보는 ""법원은 우리 국민이 얼마나 사법부를 신뢰하고 기대하는지 기억해야 한다""고 강조했습니다.이어 "" 맹목적인 추종이나 굴종이 아닌, 합리적이고 상식적인 법률에 부합하는 판단을 하기 위해 노력한다고 믿고 있다.",2025.05.09 17:10,https://news.sbs.co.kr/news/endPage.do?news_id=N1008094687,SBS
법관대표회의 26일 개최…'사법신뢰 · 재판독립' 논의,https://img.sbs.co.kr/newimg/news/20250509/202069491_300.jpg,전국 법관 대표들이 이재명 민주당 대선후보의 선거법 사건 파기환송 선고로 불거진 '대법원의 정치 개입 논란' 등을 다루기 위해서 …,2025.05.09 17:08,https://news.sbs.co.kr/news/endPage.do?news_id=N1008094619,SBS
"이재명 ""사법부 믿지만…총구 우릴 향해 난사하면 고쳐야""",https://img.sbs.co.kr/newimg/news/20250509/202069511_300.jpg,▲ 더불어민주당 이재명 대선 후보가 제3차 골목골목 경청투어로 경북지역 방문에 나선 9일 경북 칠곡군 석적읍의 한 상가 앞에서 주민과…,2025.05.09 17:03,https://news.sbs.co.kr/news/endPage.do?news_id=N1008094673,SBS
"[영상] ""맞을 짓을 왜 했니?"" 여학생들 폭행하더니 뻔뻔…보조배터리로 가격하고 비비탄 총까지",https://img.sbs.co.kr/news/pc/thumb_v3.png,"한 고등학교 태권도부 코치가 술에 취한 상태로 여고생 선수들의 숙소에 무단 침입해 제자들을 폭행하는 사건이 발생했습니다. 코치는 마스터키를 이용해, 자고 있던 여학생들을 깨워 침대에 눕힌 뒤 보조배터리를 이용해 머리를 가격하는 등 학생들을 대상으로 잔혹한 수위의 폭행을 저질렀는데 폭언도 서슴지 않았습니다.",2025.05.09 17:02,https://news.sbs.co.kr/news/endPage.do?news_id=N1008094014,SBS
"동업 거절하자 끓는 물 붓고 폭행 살해…유족 ""엄벌해 달라""",https://img.sbs.co.kr/news/pc/thumb_v3.png,'SBS <편상욱의 뉴스브리핑>' ■ <편상욱의 뉴스브리핑> ■ ■ 박성배 변호사---------…,2025.05.09 16:48,https://news.sbs.co.kr/news/endPage.do?news_id=N1008094301,SBS
"지상파 3사, JTBC 올림픽 · 월드컵 중계권 입찰 중지 가처분 신청",https://img.sbs.co.kr/news/pc/thumb_v3.png,"SBS와 KBS, MBC 등 지상파 방송 3사가 JTBC의 올림픽·월드컵 중계권 불공정 입찰을 멈춰달라며 중앙그룹 등을 상대로 가처분을 신청했습…",2025.05.09 16:46,https://news.sbs.co.kr/news/endPage.do?news_id=N1008094655,SBS
"'뽀빠이' 이상용, 병원 다녀오던 중 쓰러져 별세…향년 81세",https://img.sbs.co.kr/news/pc/thumb_v3.png,'뽀빠이'라는 별명으로 유명한 방송인 이상용이 9일 서울 서초구 자택 인근에서 별세했다. 향년 81세.9일 방송 관계자에 따르면 이상용은 9일 낮 12시 45분쯤 병원을 다녀오던 중 쓰러졌다.,2025.05.09 16:43,https://news.sbs.co.kr/news/endPage.do?news_id=N1008094650,SBS
군인 아들 데리러 가다…음주 · 무면허 · 역주행 차량에 어버이날 참변,https://img.sbs.co.kr/news/pc/thumb_v3.png,'SBS <편상욱의 뉴스브리핑>' ■ <편상욱의 뉴스브리핑> ■ ■ 박성배 변호사---------…,2025.05.09 16:43,https://news.sbs.co.kr/news/endPage.do?news_id=N1008094300,SBS
'이재명 판결' 논란 속 법관대표 26일 회의…사법신뢰 · 재판독립 논의,https://img.sbs.co.kr/news/pc/thumb_v3.png,더불어민주당 이재명 대선 후보의 대법원 파기환송 판결을 둘러싼 논란을 다룰 전국법관대표회의가 오는 26일 오전 열립니다.김예영 법관대표회의 의장…,2025.05.09 16:41,https://news.sbs.co.kr/news/endPage.do?news_id=N1008094622,SBS
"""청각장애인 보조견이 어딨냐""…식당 · 경찰에 문전박대 당해",https://img.sbs.co.kr/newimg/news/20250509/202069483_300.jpg,장애인 이동권 보장을 위해 장애인 보조견 동반 출입 권리를 강화하는 개정령이 시행됐지만 현장에서는 홍보 부족 등의 문제로 여전히 갈등이 이어지고…,2025.05.09 16:41,https://news.sbs.co.kr/news/endPage.do?news_id=N1008094630,SBS
"더본코리아, 가맹점 상생 위해 300억 원 규모 지원책 시행",https://img.sbs.co.kr/newimg/news/20250506/202068266_300.jpg,▲ 백종원 더본코리아 대표백종원 대표가 이끄는 더본코리아가 300억 원 규모의 가맹점 상생 지원책을 시행한다고 오늘 밝혔습니다.백 대…,2025.05.09 16:38,https://news.sbs.co.kr/news/endPage.do?news_id=N1008094617,SBS
"교황 레오 14세, 과거 네차례 방한…""승용차 대신 지하철 이용""",https://img.sbs.co.kr/newimg/news/20250509/202069478_300.jpg,▲ 2002년 방한한 레오 14세 교황제267대 교황으로 선출된 레오 14세는 과거에 여러 차례 한국을 방문한 적이 있습니다.오늘 성…,2025.05.09 16:34,https://news.sbs.co.kr/news/endPage.do?news_id=N1008094615,SBS
"[스토브리그] ""국힘, 안 된다니까요"" 단일화 두고 역대급 충돌에…이준석 몸값 올라가나? (ft. 이준석 대선후보)",https://img.sbs.co.kr/newimg/news/20250509/202069477_300.jpg,김문수 국민의힘 대선후보와 무소속 한덕수 예비후보의 단일화를 둘러싸고 연일 강한 충돌이 일어나고 있습니다. 대선특집 SBS 유튜브 '정치컨설팅 스토브리그'는 이준석 개혁신당 대선후보와 함께 합니다.,2025.05.09 16:32,https://news.sbs.co.kr/news/endPage.do?news_id=N1008094352,SBS
"[자막뉴스] ""원금 보장"" 믿다가…끝내 노후 자금까지 다 날리는 사람들",https://img.sbs.co.kr/news/pc/thumb_v3.png,"60대 여성 배 모 씨는 지난 3월 '노후 복리' '원금 보장'이라는 말에 속아 평생 모은 돈을 잃었습니다.봉사라는 명목을 내세운 사기 행각에 노년의 마지막 희망까지 무너진 겁니다.[배 모 씨/유사수신 사기 피해자 : 봉사 단체 회원 동생이 맨날 힘들게 돈 벌지 말고, 돈도 벌면서 봉사도 하면서 이런 좋은 단체가 있으니 한번 얘기나 들어보라고 하더라고요.",2025.05.09 16:31,https://news.sbs.co.kr/news/endPage.do?news_id=N1008094400,SBS
"[D리포트] ""70세까지 단계적 확대""…첫 사회적 제안",https://img.sbs.co.kr/news/pc/thumb_v3.png,학계와 시민사회단체 등 10명의 전문가들이 현재 65세인 노인 연령을 단계적으로 70세로 상향해야 한다고 공식 제안했습니다.2년마다 1살씩 올려…,2025.05.09 16:29,https://news.sbs.co.kr/news/endPage.do?news_id=N1008094565,SBS
"[자막뉴스] 순간의 실수로 '망자의 계좌'에…""이제 어떡하죠"" 직원 발동동",https://img.sbs.co.kr/news/pc/thumb_v3.png,"한 중소기업 직원이 거래처에 보내야 할 돈을 다른 사람 계좌에 잘못 보냈다가, 돌려받지 못할 처지에 놓였습니다.부산 사하경찰서에 따르면 중소기업…",2025.05.09 16:18,https://news.sbs.co.kr/news/endPage.do?news_id=N1008092605,SBS
[속보] 러시아 전승절 열병식 시작…푸틴 · 시진핑 참석,https://img.sbs.co.kr/news/pc/thumb_v3.png,러시아 전승절 열병식 시작...푸틴 · 시진핑 참석,2025.05.09 16:16,https://news.sbs.co.kr/news/endPage.do?news_id=N1008094581,SBS
"한덕수 ""당에서 단일화 결정 나온 직후 바로 입당할 것""",https://img.sbs.co.kr/news/pc/thumb_v3.png,▲ 유튜브 '두시엔 김광일' 출연한 무소속 한덕수 대선 예비후보무소속 한덕수 대통령선거 예비후보는 오늘 국민의힘 입당 …,2025.05.09 16:14,https://news.sbs.co.kr/news/endPage.do?news_id=N1008094584,SBS
[자막뉴스] '단일화 대혼란' 사이…'신라벨트' 공략 나선 이재명,https://img.sbs.co.kr/news/pc/thumb_v3.png,이재명 더불어민주당 대선 후보가 당의 '불모지'인 대구·경북 지역을 찾았습니다.이 후보는 1박 2일 일정의 '영남 신라벨트…,2025.05.09 16:14,https://news.sbs.co.kr/news/endPage.do?news_id=N1008094469,SBS
"김문수, '선대위원장 임명' 공지했다 취소…홍준표 ""안 맡아""",https://img.sbs.co.kr/newimg/news/20250509/202069445_300.jpg,"국민의힘 김문수 대선 후보가 오늘 홍준표 전 대구시장을 상임선거대책위원장으로 임명했다고 밝혔지만, 홍 전 시장은 이를 즉각 부인했습니다.김 후보…",2025.05.09 16:13,https://news.sbs.co.kr/news/endPage.do?news_id=N1008094578,SBS
"[여담야담] 이재명, '험지' 경북 표심 공략…민주, 사법부 압박 속도조절",https://img.sbs.co.kr/newimg/news/20250509/202069470_300.jpg,"'SBS <편상욱의 뉴스브리핑>' ■ <편상욱의 뉴스브리핑> ■ ■ 김동원 국민의힘 대변인, 장경…",2025.05.09 16:12,https://news.sbs.co.kr/news/endPage.do?news_id=N1008094298,SBS
"미 상무 ""한국·일본과 무역협상에 상당한 시간 걸릴 듯""",https://img.sbs.co.kr/newimg/news/20250509/202069469_300.jpg,▲ 영국과의 관세협상 결과 설명하는 러트닉 상무장관하워드 러트닉 미 상무부 장관이 트럼프 행정부의 각종 고율관세 등과 관련한 한국과의…,2025.05.09 16:11,https://news.sbs.co.kr/news/endPage.do?news_id=N1008094580,SBS
[여담야담] 커지는 내홍에 창당 주장까지…'후보 지위' 가처분 결과는?,https://img.sbs.co.kr/newimg/news/20250509/202069464_300.jpg,"'SBS <편상욱의 뉴스브리핑>' ■ <편상욱의 뉴스브리핑> ■ ■ 김동원 국민의힘 대변인, 장경…",2025.05.09 16:10,https://news.sbs.co.kr/news/endPage.do?news_id=N1008094297,SBS
"'MLB 통산 555홈런' 매니 라미레스, 모레 한화-키움전 시타",https://img.sbs.co.kr/news/pc/thumb_v3.png,▲ 매니 라미레스 과거 미국프로야구 메이저리그를 주름잡았던 강타자 매니 라미레스가 서울 고척스카이돔 타석에 섭니다.프로야구 키움 히어…,2025.05.09 16:05,https://news.sbs.co.kr/news/endPage.do?news_id=N1008094559,SBS
[여담야담] 파국으로 치닫는 국힘 '단일화'…여론조사 오늘 마감,https://img.sbs.co.kr/news/pc/thumb_v3.png,"'SBS <편상욱의 뉴스브리핑>' ■ <편상욱의 뉴스브리핑> ■ ■ 김동원 국민의힘 대변인, 장경…",2025.05.09 16:04,https://news.sbs.co.kr/news/endPage.do?news_id=N1008094296,SBS
김문수의 약진? '단일화 선호도' 묻자…심상치 않은 여론조사 결과,https://img.sbs.co.kr/news/pc/thumb_v3.png,김문수 국민의힘 대선 후보와 한덕수 무소속 대선 예비후보의 단일화 선호도 여론조사에서 김 후보가 한 후보를 오차 범위 내에서 앞선다는 여론조사 …,2025.05.09 16:02,https://news.sbs.co.kr/news/endPage.do?news_id=N1008094495,SBS
