title,thumbnail,short_content,write_time,link,company
"이스라엘 ""팔레스타인 자치정부 지역은 합병 논의 안해""",https://img.sbs.co.kr/newimg/news/20250921/202112612_300.jpg,▲ 현지시간 20일 가자지구에 설치된 임시텐트 캠프에 이스라엘 작전 중 피난민이 된 팔레스타인들이 서 있다.이스라엘 내각에서 요르단강…,2025.09.25 23:44,https://news.sbs.co.kr/news/endPage.do?news_id=N1008272805,SBS
인천 해저터널서 차량 3대 추돌…2명 다쳐,https://img.sbs.co.kr/newimg/news/20250925/202114316_300.jpg,▲ 25일 인천 청라에서 해저터널을 달리던 차량 3대가 추돌하는 사고가 발생했다.인천 해저터널을 달리던 차량 3대가 추돌해 2명이 다…,2025.09.25 23:43,https://news.sbs.co.kr/news/endPage.do?news_id=N1008272804,SBS
덴마크서 또 '대형드론' 동시 출몰…F-35 기지서도 목격,https://img.sbs.co.kr/newimg/news/20250923/202113188_300.jpg,▲ 코펜하겐 공항 인근의 덴마크 경찰덴마크에서 현지 시간 24일 또다시 정체불명의 드론이 여러 공항과 공군 기지에 동시 출몰했습니다.…,2025.09.25 23:14,https://news.sbs.co.kr/news/endPage.do?news_id=N1008272801,SBS
"최휘영 장관 ""전통문화는 K-콘텐츠 성장동력…정책역량 집중""",https://img.sbs.co.kr/newimg/news/20250925/202114315_300.jpg,▲ 전통문화산업 청년 기업인들과 간담회를 하는 최휘영 문체부 장관최휘영 문화체육관광부 장관은 오늘 서울 성수동에서 열리는 '2…,2025.09.25 22:55,https://news.sbs.co.kr/news/endPage.do?news_id=N1008272792,SBS
"'개그계 대부' 전유성, 폐기흉 악화로 별세…향년 76세",https://img.sbs.co.kr/news/pc/thumb_v3.png,특유의 입담과 인품 덕에 '개그계 대부'로 불리던 코미디언 전유성이 향년 76세로 오늘 별세했습니다.대한민국방송코미디언협회에 따르…,2025.09.25 22:19,https://news.sbs.co.kr/news/endPage.do?news_id=N1008272772,SBS
미 2분기 성장률 확정치 3.8%…잠정치 대비 0.5%p↑,https://img.sbs.co.kr/news/pc/thumb_v3.png,▲ 미 로스앤젤레스항의 컨테이너미 상무부는 현지 시간 25일 2분기 미국의 국내총생산 증가율 확정치가 3.8%로 집계됐다고 밝혔습니다…,2025.09.25 21:48,https://news.sbs.co.kr/news/endPage.do?news_id=N1008272759,SBS
"프랑스 사르코지, '카다피 뒷돈 수수 사건' 1심 징역 5년",https://img.sbs.co.kr/news/pc/thumb_v3.png,▲ 현지 시간 25일 파리 법원 1심에서 징역 5년형을 선고받은 니콜라 사르코지 전 대통령2007년 프랑스 대통령 선거를 앞두고 리비…,2025.09.25 21:45,https://news.sbs.co.kr/news/endPage.do?news_id=N1008272756,SBS
"삼성 디아즈, 한 시즌 타점 신기록에 외국인 최다 49호 홈런",https://img.sbs.co.kr/news/pc/thumb_v3.png,▲ 25일 대구 삼성라이온즈파크에서 열린 프로야구 키움과 삼성의 경기. 5회 말 1사 주자 3루 상황에서 타석에 들어선 삼성 디아즈가…,2025.09.25 21:38,https://news.sbs.co.kr/news/endPage.do?news_id=N1008272754,SBS
클로징,https://img.sbs.co.kr/news/pc/thumb_v3.png,8시 뉴스 마칩니다.시청해 주신 여러분 고맙습니다.,2025.09.25 21:36,https://news.sbs.co.kr/news/endPage.do?news_id=N1008272691,SBS
[날씨] 역대급 늦더위…제주 '체감 33도',https://img.sbs.co.kr/news/pc/thumb_v3.png,가을이 깊어가고 있지만 아직 제주에는 여름의 열기가 남아 있습니다.오늘로 76일째 열대야가 이어지고 있는 가운데 오늘 제주 해안을 중심으로는 폭…,2025.09.25 21:36,https://news.sbs.co.kr/news/endPage.do?news_id=N1008272690,SBS
마커 맞고 '쏙'…행운의 버디!,https://img.sbs.co.kr/newimg/news/20250925/202114307_300.jpg,국내 여자골프에서 나온 고지원 선수의 행운의 버디 보시죠.마치 당구처럼 동반자의 '마커'에 맞고 방향이 바뀌면서 홀에 빨려 들어갔…,2025.09.25 21:35,https://news.sbs.co.kr/news/endPage.do?news_id=N1008272689,SBS
"안방 돌아온 '세계 최강'…""많은 팬이 든든한 힘""",https://img.sbs.co.kr/newimg/news/20250925/202114305_300.jpg,배드민턴 세계 최강 안세영 선수가 2년 만에 코리아오픈에 출전했는데요. 뜨거운 응원 속에 가볍게 8강에 오른 안세영 선수는 국내 팬들 앞에서 시즌 8번째 우승을 약속했습니다.배정훈 기자입니다.,2025.09.25 21:34,https://news.sbs.co.kr/news/endPage.do?news_id=N1008272688,SBS
부상 털고 '첫 선발 출전'…유로파 첫 승 신고,https://img.sbs.co.kr/newimg/news/20250925/202114304_300.jpg,"긴 부상에서 돌아온 덴마크 미트윌란 조규성이, 빠르게 이전의 모습을 되찾고 있습니다.오늘은 복귀 이후 처음으로 선발 출전해 유로파리그 승리에 힘…",2025.09.25 21:33,https://news.sbs.co.kr/news/endPage.do?news_id=N1008272687,SBS
'시즌 베스트'로 쇼트 1위…연속 우승 보인다!,https://img.sbs.co.kr/newimg/news/20250925/202114303_300.jpg,남자 피겨의 17살 유망주 서민규 선수가 주니어 그랑프리 쇼트 프로그램에서 시즌 베스트 기록으로 1위에 올랐습니다. 두 대회 연속 우승 가능성도…,2025.09.25 21:33,https://news.sbs.co.kr/news/endPage.do?news_id=N1008272686,SBS
디아즈 147타점…한 시즌 최다 신기록,https://img.sbs.co.kr/news/pc/thumb_v3.png,프로야구 삼성의 거포 디아즈 선수가 대기록을 작성했습니다. 시즌 147번째 타점을 올려 한 시즌 최다 타점 신기록을 세웠습니다.이성훈 기자입니다…,2025.09.25 21:32,https://news.sbs.co.kr/news/endPage.do?news_id=N1008272681,SBS
"전국 한 곳뿐인데 ""유배지 같다""…학폭 피해자 시설 보니",https://img.sbs.co.kr/news/pc/thumb_v3.png,"학교폭력 피해로 학교에 다니기 힘든 학생들이 수업을 들으면서 심리 치료도 받을 수 있는 기숙 교육시설이 있습니다. 전국에 단 한 곳뿐인데, 선생님도 없고 유배지 같다는 말이 나올 정도로 환경이 매우 열악합니다.정성진 기자가 취재했습니다.",2025.09.25 21:31,https://news.sbs.co.kr/news/endPage.do?news_id=N1008272678,SBS
"""중등교원 1,600여 명 증원"" 고교학점제 부담 줄어들까",https://img.sbs.co.kr/news/pc/thumb_v3.png,"올해 도입된 고교학점제를 놓고 교육 현장의 불만이 이어지자, 교육부가 개선 방안을 내놨습니다. 여기에는 교사들의 늘어난 수업 부담을 덜어주기 위해 교사를 1천600명 이상 더 뽑겠다는 내용이 담겼습니다.자세한 내용은 이혜미 기자가 전하겠습니다.",2025.09.25 21:28,https://news.sbs.co.kr/news/endPage.do?news_id=N1008272677,SBS
김선경 북한 외무성 부상 베이징 도착…유엔총회 참석할 듯,https://img.sbs.co.kr/news/pc/thumb_v3.png,▲ 김선경 북한 외무성 부상미국 뉴욕에서 열리는 제80차 유엔총회에 북한이 파견할 고위급으로 알려진 김선경 북한 외무성 부상이 오늘 …,2025.09.25 21:25,https://news.sbs.co.kr/news/endPage.do?news_id=N1008272748,SBS
"'지미 키멀 라이브' 최고 시청률…트럼프 ""믿을 수 없다""",https://img.sbs.co.kr/news/pc/thumb_v3.png,"트럼프 행정부의 압박으로 중단됐던 미국 인기 토크쇼 '지미 키멀 라이브'가 재개됐습니다. 진행자는 복귀 방송에서 '표현의 자유'가 가장 중요하다고 강조했는데, 이번 사태가 언론 자유의 상징적인 사건으로 떠오르면서 역대 최고 시청률을 기록하기도 했습니다.장선이 기자입니다.",2025.09.25 21:24,https://news.sbs.co.kr/news/endPage.do?news_id=N1008272676,SBS
순천 중앙시장서 상인 흉기로 찌른 20대 여성 체포,https://img.sbs.co.kr/news/pc/thumb_v3.png,시장 상인에게 흉기를 휘두른 여성이 경찰에 붙잡혔습니다.전남 순천경찰서는 시장 상인을 흉기로 찔러 다치게 한 혐의로 20대 여성 A 씨를 붙잡아…,2025.09.25 21:22,https://news.sbs.co.kr/news/endPage.do?news_id=N1008272743,SBS
"'반 이민국' 총격 사건…트럼프 ""좌파 단체 해체시킬 것""",https://img.sbs.co.kr/newimg/news/20250925/202114292_300.jpg,미국 이민 당국 구금시설을 겨냥한 총격 사건이 발생해 수감자 1명이 숨지고 2명이 크게 다쳤습니다. 용의자는 트럼프 대통령의 반이민 정책에 대한 불만을 품고 범행을 저지른 걸로 추정되는데요.,2025.09.25 21:21,https://news.sbs.co.kr/news/endPage.do?news_id=N1008272675,SBS
[단독] 항공통제기 오는 30일 결정…미 초고가 무기 도입?,https://img.sbs.co.kr/newimg/news/20250925/202114291_300.jpg,"방위사업청이 오는 30일, 3조 원이 넘는 규모의 외국 항공통제기의 구매를 최종 결정하는데, 미국산이 유력한 것으로 확인됐습니다. 미국이 국방비를 늘리라고 압박하는 상황에서 이재명 정부가 초고가의 미국 무기를 도입하는 첫 번째 사례가 될 것으로 보입니다.김태훈 국방전문기자의 단독 보도입니다.",2025.09.25 21:19,https://news.sbs.co.kr/news/endPage.do?news_id=N1008272674,SBS
방산업체 총기실험실서 총상 사망…폰에서 발견된 메일,https://img.sbs.co.kr/newimg/news/20250925/202114284_300.jpg,부산의 방위산업체 공장에서 총기 개발을 담당하는 30대 직원이 총상을 입고 숨진 채 발견됐습니다. 경찰은 총기 안전 관리에 문제가 없었는지 살펴…,2025.09.25 21:13,https://news.sbs.co.kr/news/endPage.do?news_id=N1008272672,SBS
"범행 핵심 증거들, 이미 중국에…윗선 수사는 '첩첩산중'",https://img.sbs.co.kr/newimg/news/20250925/202114282_300.jpg,"KT 무단 소액결제 사건의 피의자 3명이 검찰에 넘겨졌습니다. 경찰은 윗선에 대한 수사를 이어가고 있는데, 범행에 쓰였던 핵심 증거들이 이미 중국으로 넘어간 상황이라 사건 규명에 난항을 겪고 있습니다.신용일 기자의 보도입니다.",2025.09.25 21:10,https://news.sbs.co.kr/news/endPage.do?news_id=N1008272671,SBS
"베트남서 한국 경마장 영상이?…적발된 판돈만 1,700억",https://img.sbs.co.kr/news/pc/thumb_v3.png,베트남에 사무실을 차려놓고 한국 마사회의 실시간 경마 영상을 도용해 불법 경마 도박 사이트를 운영한 일당이 검거됐습니다. 경기가 없는 날에는 일…,2025.09.25 21:08,https://news.sbs.co.kr/news/endPage.do?news_id=N1008272708,SBS
"""내가 사람 죽였다"" 발칵…세차장 직원이 업주 살해했다",https://img.sbs.co.kr/news/pc/thumb_v3.png,경기 시흥의 한 세차장에서 직원이 휘두른 흉기에 업주가 목숨을 잃었습니다. 이 직원은 자신이 범행을 저질렀다며 경찰에 스스로 신고했습니다.보도에 박재연 기자입니다.,2025.09.25 21:05,https://news.sbs.co.kr/news/endPage.do?news_id=N1008272670,SBS
"한화 와이스, 200탈삼진 달성…역대 최초 한 팀서 200K 2명 배출",https://img.sbs.co.kr/news/pc/thumb_v3.png,▲ 25일 서울 송파구 잠실구장에서 열린 프로야구 2025 신한 SOL 뱅크 KBO리그 한화 이글스와 두산 베어스의 경기. 한화 선발…,2025.09.25 21:00,https://news.sbs.co.kr/news/endPage.do?news_id=N1008272739,SBS
중국인 50명 난동…아수라장 된 제주 카지노서 무슨 일,https://img.sbs.co.kr/news/pc/thumb_v3.png,"제주도의 한 대형 카지노에서 중국인 수십 명이 집단으로 항의하며 난동을 부려 경찰까지 출동하는 일이 있었습니다. 카지노 보안요원을 폭행한 중국인 3명이 체포되기도 했는데요.왜 이런 일이 벌어진 건지, JIBS 김동은 기자가 취재했습니다.",2025.09.25 20:58,https://news.sbs.co.kr/news/endPage.do?news_id=N1008272669,SBS
"삼성 디아즈, 프로야구 한 시즌 최다 147타점 신기록 달성",https://img.sbs.co.kr/news/pc/thumb_v3.png,▲ 삼성 라이온즈의 외국인 타자 르윈 디아즈프로야구 삼성 라이온즈의 외국인 타자 르윈 디아즈가 KBO리그 역대 한 시즌 최다 타점 신…,2025.09.25 20:58,https://news.sbs.co.kr/news/endPage.do?news_id=N1008272738,SBS
"""3개월만 먹여보세요""…S대 출신 의사라더니 반전 정체",https://img.sbs.co.kr/news/pc/thumb_v3.png,"SNS에서 의사나 약사가 추천하는 건강기능식품 광고 한 번쯤 보셨을 텐데요, 그대로 믿으시면 안 됩니다. 이런 광고에 등장하는 의사들은 대부분 인공지능이 만든 가짜 의사입니다.",2025.09.25 20:54,https://news.sbs.co.kr/news/endPage.do?news_id=N1008272668,SBS
"""움직이는 AI 시대 시작""…피지컬 AI 글로벌 얼라이언스 출범",https://img.sbs.co.kr/newimg/news/20230913/201832895_300.jpg,▲ 과학기술정보통신부과학기술정보통신부는 피지컬 인공지능 분야 국내외 주요 기업·기관·연구 주체가 참여하는 '피지컬 AI 글로벌…,2025.09.25 20:52,https://news.sbs.co.kr/news/endPage.do?news_id=N1008272736,SBS
"""토허구역 묶이면 못 산다""…문의 쏟아지며 잇단 신고가",https://img.sbs.co.kr/newimg/news/20250925/202114270_300.jpg,"서울 부동산 시장이 심상치 않습니다. 서울 아파트값 상승 폭이 3주 연속 커졌는데요. 대출 규제 효과가 한계에 달했고, 지난 7일 내놓은 주택 공급 대책도 별 게 없다는 반응 속에, 추가 규제가 있기 전에 집을 사놓자는 심리만 자극했다는 지적까지 나오고 있습니다.정준호 기자의 보도입니다.",2025.09.25 20:49,https://news.sbs.co.kr/news/endPage.do?news_id=N1008272667,SBS
"""이럴 거면 추석 선물세트 왜 사나"" 가격 따져봤다 깜짝",https://img.sbs.co.kr/newimg/news/20250925/202114266_300.jpg,"추석 앞두고 선물세트 이미 주고받으셨거나 준비하는 분들 많으실 텐데요. 시중에서 판매 중인 선물세트를 조사해 봤더니, 낱개로 사는 것보다 세트로 살 때 가격이 최대 2배 더 비싼 걸로 나타났습니다.",2025.09.25 20:45,https://news.sbs.co.kr/news/endPage.do?news_id=N1008272665,SBS
"'안보리 의장석' 앉아 회의 첫 주재…""AI·방산 협력 강화""",https://img.sbs.co.kr/newimg/news/20250925/202114264_300.jpg,"이재명 대통령은 한국 정상으로는 처음으로, 유엔 안전보장이사회 의장석에 앉아 인공지능과 국제 평화 안보를 주제로 공개 토의를 이끌었습니다. 이 …",2025.09.25 20:43,https://news.sbs.co.kr/news/endPage.do?news_id=N1008272664,SBS
"미 재무장관 만나 ""'통화스와프' 필요""…""잘 전달하겠다""",https://img.sbs.co.kr/news/pc/thumb_v3.png,"유엔 총회에 참석하기 위해 미국 뉴욕을 방문 중인 이재명 대통령이 베선트 재무장관을 직접 만났습니다. 이 대통령은 관세 협상에 대해 이야길 나누면서 한미 통화스와프가 필요하다고 강조했는데, 베선트 장관은 잘 전달하겠다고 답했습니다.뉴욕에서 강민우 기자입니다.",2025.09.25 20:39,https://news.sbs.co.kr/news/endPage.do?news_id=N1008272663,SBS
"김상민 문자도 제시…""김건희 진술 거부"" 질문 뭐였길래",https://img.sbs.co.kr/news/pc/thumb_v3.png,김건희 여사가 김상민 전 검사로부터 이우환 화백 그림을 받았다는 혐의와 관련해 첫 특검 조사를 받았습니다. 특검팀은 김 여사에게 김 전 검사가 …,2025.09.25 20:31,https://news.sbs.co.kr/news/endPage.do?news_id=N1008272662,SBS
윤 '체포 방해 혐의' 첫 재판 중계…두 달 만에 모습 공개,https://img.sbs.co.kr/news/pc/thumb_v3.png,법원이 내일 윤석열 전 대통령의 체포 방해 혐의 첫 재판을 중계하기로 했습니다. 지난 7월 재구속된 뒤 수사와 재판에 불응해 온 윤 전 대통령도…,2025.09.25 20:27,https://news.sbs.co.kr/news/endPage.do?news_id=N1008272661,SBS
"""재판 독립"" 5차례 강조한 조희대…'법관대표회의' 진행",https://img.sbs.co.kr/news/pc/thumb_v3.png,"여권의 계속되는 압박에도 청문회 출석 여부를 밝히지 않고 있는 조희대 대법원장이, 재판 독립을 강조하는 발언을 내놨습니다. 이 내용은 대법원에 …",2025.09.25 20:25,https://news.sbs.co.kr/news/endPage.do?news_id=N1008272660,SBS
"[단독] 지귀연 의혹 법원 감사위 회부…""외부인사 심의""",https://img.sbs.co.kr/news/pc/thumb_v3.png,"조희대 대법원장과 함께 국회 청문회 증인으로 포함된 지귀연 부장판사의 술 접대 의혹과 관련해, 대법원이 외부 인사들이 참여하는 법원 감사위원회를…",2025.09.25 20:20,https://news.sbs.co.kr/news/endPage.do?news_id=N1008272659,SBS
"조희대 국감 증인 추진…친명 중진은 ""청문회는 급발진""",https://img.sbs.co.kr/news/pc/thumb_v3.png,"오는 30일, 조희대 대법원장 청문회를 열기로 한 민주당 법제사법위원들이 다음 달 중순 시작되는 국정감사에도 조 대법원장을 증인으로 부르는 방안을 추진하고 있습니다.",2025.09.25 20:19,https://news.sbs.co.kr/news/endPage.do?news_id=N1008272657,SBS
"[단독] ""뭘 하고 있나""…대검 수뇌부 면전서 검사들 성토",https://img.sbs.co.kr/newimg/news/20250925/202114249_300.jpg,"검찰청 폐지 법안의 국회 본회의 처리가 초읽기에 들어가면서 검찰 일선에서 불만이 커지자, 대검 수뇌부가 전국의 검찰청을 돌며 간담회까지 진행한 걸로 확인됐습니다.",2025.09.25 20:14,https://news.sbs.co.kr/news/endPage.do?news_id=N1008272655,SBS
"특검, 박진 전 장관 '이종섭 대사 임명 과정 비정상' 진술 확보",https://img.sbs.co.kr/newimg/news/20250923/202113258_300.jpg,▲ 박진 전 외교부 장관이 지난 23일 이명현 순직해병 특별검사팀 사무실에 참고인 자격으로 조사를 받기 위해 출석하고 있다.채상병 특…,2025.09.25 20:14,https://news.sbs.co.kr/news/endPage.do?news_id=N1008272722,SBS
정부조직법 등 4개 상정…4박5일 필리버스터 돌입했다,https://img.sbs.co.kr/newimg/news/20250925/202114248_300.jpg,오늘 국회 본회의에는 정부조직법 개편안의 수정안이 상정됐습니다. 국민의힘은 수정안도 안 된다며 무제한 토론 '필리버스터'로 맞서고 있습니다.,2025.09.25 20:12,https://news.sbs.co.kr/news/endPage.do?news_id=N1008272653,SBS
"'예산·금융 기능' 없는 재정경제부?…""졸속 추진 혼란만""",https://img.sbs.co.kr/newimg/news/20250925/202114246_300.jpg,"금융 당국 개편안이 사실상 백지로 돌아가면서, 경제 사령탑 역할을 하던 기획재정부는 당혹감을 감추지 못했습니다. 예산과 금융 기능 모두 없어 이제 껍데기만 남았다는 반응도 나왔는데, 졸속으로 추진된 조직 개편이었다는 비판도 상당합니다.이어서 채희선 기자의 보도입니다.",2025.09.25 20:12,https://news.sbs.co.kr/news/endPage.do?news_id=N1008272654,SBS
"""금융위·금감원 현행대로 유지""…정부 조직 개편서 철회",https://img.sbs.co.kr/news/pc/thumb_v3.png,"이재명 정부의 첫 정부 조직 개편안 가운데 금융감독 체제의 개편이 오늘 갑작스럽게 철회됐습니다. 여당과 정부, 그리고 대통령실이 금융감독위원회 신설을 포기하고, 기존의 금융위원회와 금융감독원을 유지하기로 방침을 바꾼 겁니다.",2025.09.25 20:03,https://news.sbs.co.kr/news/endPage.do?news_id=N1008272652,SBS
고용노동부 6층 들어가 인화물질 뿌린 50대 민원인 체포,https://img.sbs.co.kr/news/pc/thumb_v3.png,▲ 세종경찰청정부세종청사 내 고용노동부를 찾아가 인화물질을 뿌리고 불을 지르려 한 50대가 경찰에 붙잡혔습니다.세종남부경찰은 오늘 저…,2025.09.25 19:56,https://news.sbs.co.kr/news/endPage.do?news_id=N1008272714,SBS
오늘의 SBS 8뉴스 예고 (9월 25일),https://img.sbs.co.kr/news/pc/thumb_v3.png,"오늘 <SBS 8뉴스>에서는▶ 당정대 ""금융위·금감원 현행 유지""...금융 개편 뺀 정부조직법 처리로 전격 선회`…",2025.09.25 19:37,https://news.sbs.co.kr/news/endPage.do?news_id=N1008272551,SBS
"신진서, 박정환 꺾고 명인전 우승…올해 5번째 타이틀",https://img.sbs.co.kr/news/pc/thumb_v3.png,▲ 명인전에서 우승한 신진서 9단신진서 9단이 세 번째 명인전 정상에 올랐습니다.신진서는 오늘 경기도 성남시 K바둑스튜디오에서 열린 …,2025.09.25 19:36,https://news.sbs.co.kr/news/endPage.do?news_id=N1008272703,SBS
파주 상가건물서 불…학원생 등 80여 명 대피 소동,https://img.sbs.co.kr/news/pc/thumb_v3.png,"▲ 119오늘 오후 5시 45분쯤 경기 파주시 동패동의 한 상가건물 1층에서 불이 났습니다.이 불로 인명피해는 없었지만, 건물에 입주…",2025.09.25 19:34,https://news.sbs.co.kr/news/endPage.do?news_id=N1008272702,SBS
"1기 국교위 정면 비판한 전 상임위원 ""교육부 들러리·박수부대 전락""",https://img.sbs.co.kr/news/pc/thumb_v3.png,▲ 정대화 국가교육위원회 상임위원이 25일 서울 종로구 정부서울청사에서 퇴임 기자 간담회를 하고 있다. 국가교육위원회의 쇄신을 요구하…,2025.09.25 19:31,https://news.sbs.co.kr/news/endPage.do?news_id=N1008272701,SBS
"펜싱 사브르 오상욱, 구본길 꺾고 전국체전 우승",https://img.sbs.co.kr/newimg/news/20250925/202114238_300.jpg,▲ 전국체전 남자 사브르 개인전 우승 차지한 오상욱국가대표 복귀를 앞둔 펜싱 남자 사브르 간판 오상욱이 제106회 전국체육대회 개인전…,2025.09.25 19:30,https://news.sbs.co.kr/news/endPage.do?news_id=N1008272700,SBS
수도권 생활폐기물 직매립 금지 '내년 시행 여부' 논의 시작,https://img.sbs.co.kr/newimg/news/20250925/202114237_300.jpg,▲ 김성환 환경부 장관이 25일 서울 영등포구 이룸센터에서 수도권 3개 광역지방자치단체 부단체장과 수도권 생활폐기물 직매립 금지 조처…,2025.09.25 19:28,https://news.sbs.co.kr/news/endPage.do?news_id=N1008272698,SBS
"의협 ""임신 중 타이레놀 자폐증 유발 근거 없어…불안 야기 말아야""",https://img.sbs.co.kr/newimg/news/20250612/202080960_300.jpg,"▲ 김성근 대한의사협회 대변인대한의사협회는 최근 도널드 트럼프 미국 대통령이 ""타이레놀의 주성분인 아세트아미노펜은 자폐아 출산…",2025.09.25 19:25,https://news.sbs.co.kr/news/endPage.do?news_id=N1008272697,SBS
"[단독] 30일 항공통제기 결정…이재명 정부, 미국 초고가 무기 첫 구매",https://img.sbs.co.kr/newimg/news/20240205/201891011_300.jpg,"방위사업청이 오는 30일, 항공통제기 2차 사업의 최종 기종을 결정할 걸로 확인됐습니다.항공통제기 2차 사업은 3조 원 넘는 돈을 들여 신형 항…",2025.09.25 19:00,https://news.sbs.co.kr/news/endPage.do?news_id=N1008272647,SBS
[8뉴스 예고] 정부조직법 개정안 본회의 상정…금융 개편 철회,https://img.sbs.co.kr/news/pc/thumb_v3.png,8시 뉴스 주요 내용입니다.1. 정부조직법 개정안 본회의 상정...금융 개편 철회검찰청 폐지를 골자로 한 정부조직법 개정안이 국회 본회의에 상정됐습니다.,2025.09.25 18:53,https://news.sbs.co.kr/news/endPage.do?news_id=N1008272550,SBS
"행안부·세무사회, 무료 세무상담과 고향사랑기부제 홍보",https://img.sbs.co.kr/news/pc/thumb_v3.png,"행정안전부와 한국세무사회가 서울 남구로시장에서 '찾아가는 마을 세무사' 행사를 열고, 전통시장 상인과 주민들을 대상으로 세무 상담…",2025.09.25 18:49,https://news.sbs.co.kr/news/endPage.do?news_id=N1008272618,SBS
"'이글 2개' 최승빈, KPGA 투어 최경주 인비테이셔널 첫날 공동 선두",https://img.sbs.co.kr/news/pc/thumb_v3.png,한국프로골프 투어 현대해상 최경주 인비테이셔널에서 최승빈 선수가 이글 2개를 잡아내며 첫날 공동 선두에 올랐습니다.최승빈은 경기도 여주시 페럼클…,2025.09.25 18:49,https://news.sbs.co.kr/news/endPage.do?news_id=N1008272646,SBS
"애플, EU에 ""디지털시장법 폐기해야…삼성과 차별도 불공정""",https://img.sbs.co.kr/news/pc/thumb_v3.png,애플이 유럽연합에 디지털시장법 폐기를 촉구했다고 현지 언론들이 보도했습니다.애플은 EU 집행위원회에 제출한 의견서에서 디지털시장법이 애플 사용자…,2025.09.25 18:47,https://news.sbs.co.kr/news/endPage.do?news_id=N1008272643,SBS
"김건희, 4시간 30분간 '뇌물 혐의' 특검 조사…진술 거부",https://img.sbs.co.kr/news/pc/thumb_v3.png,▲ 지난 24일 서울중앙지법에서 열린 첫 재판에 출석한 김건희구속된 김상민 전 부장검사로부터 이우환 화백 그림을 받았다는 김건희 여사…,2025.09.25 18:38,https://news.sbs.co.kr/news/endPage.do?news_id=N1008272637,SBS
'검찰청 폐지' 정부조직법 본회의 상정…여야 필리버스터 돌입,https://img.sbs.co.kr/news/pc/thumb_v3.png,▲ 25일 국회 본회의에서 더불어민주당 소속 신정훈 행정안전위원장이 정부조직법 일부개정법률안에 대한 제안 설명을 하고 있다. 검찰청 …,2025.09.25 18:34,https://news.sbs.co.kr/news/endPage.do?news_id=N1008272630,SBS
