title,thumbnail,short_content,write_time,link,company
[자막뉴스] 정년 연장 없이 일만 '5년 더'…국민연금 노린 듯 절묘한 숫자,https://img.sbs.co.kr/news/pc/thumb_v3.png,"경제사회노동위원회 공익위원 제언은 법정 정년 60세를 유지하면서, 사업주에게 근로자가 원할 경우 65세까지 고용을 의무화하는 방안입니다.우선 노…",2025.05.09 16:00,https://news.sbs.co.kr/news/endPage.do?news_id=N1008093847,SBS
[온더스팟] 세계 최대 미국 노퍽 해군기지를 가다…녹슨 군함들 한국이 수리하나?,https://img.sbs.co.kr/news/pc/thumb_v3.png,세계 최대 미국 해군기지에 올해 한국 언론으로는 유일하게 SBS가 다녀왔습니다.트럼프 2기 행정부와 관세 협상을 앞두고 조선업 협력이 대응책으로…,2025.05.09 15:53,https://news.sbs.co.kr/news/endPage.do?news_id=N1008094548,SBS
여자배구 국가대표팀 소집…17일 세계 올스타팀과 연습경기,https://img.sbs.co.kr/news/pc/thumb_v3.png,▲ 진천선수촌에 모인 여자배구대표팀 선수들에게 이야기하는 모랄레스 감독올해 국제대회에 나서는 여자배구 국가대표팀이 본격적인 담금질에 …,2025.05.09 15:53,https://news.sbs.co.kr/news/endPage.do?news_id=N1008094544,SBS
"""윤통과 두 놈, 천벌 받을 것""…당 지도부 저격 수위 높이는 홍준표",https://img.sbs.co.kr/newimg/news/20250509/202069466_300.jpg,국민의힘 대선 경선에 참여했다 정계 은퇴를 선언한 홍준표 전 대구시장이 단일화 갈등을 겪는 국민의힘 지도부를 연일 비난하고 나섰습니다.홍 전 시…,2025.05.09 15:52,https://news.sbs.co.kr/news/endPage.do?news_id=N1008094484,SBS
"혁신 등 4당, 이재명 지지 공동선언…진보당 김재연 후보 사퇴",https://img.sbs.co.kr/newimg/news/20250509/202069459_300.jpg,"조국혁신당과 진보당, 기본소득당, 사회민주당 등 4당과 광장대선연합정치시민연대가 더불어민주당 이재명 대선 후보에 대한 지지를 공식화하고 정권 교…",2025.05.09 15:52,https://news.sbs.co.kr/news/endPage.do?news_id=N1008094545,SBS
"[속보] 중앙선관위, 국힘 '후보 적합도' 여론조사 공표 불가 통보",https://img.sbs.co.kr/newimg/news/20250407/202058339_300.jpg,"중앙선관위, 국힘 '후보 적합도' 여론조사 공표 불가 통보",2025.05.09 15:51,https://news.sbs.co.kr/news/endPage.do?news_id=N1008094549,SBS
"러시아 금성탐사선 내일 오후 추락…""한반도 위험 없을 것""",https://img.sbs.co.kr/newimg/news/20250509/202069453_300.jpg,▲ 러시아 금성탐사선 추락 예측시간 6시간 전 궤도 범위러시아 금성탐사선 '코스모스 482 착륙선'이 10일 오후 중 …,2025.05.09 15:49,https://news.sbs.co.kr/news/endPage.do?news_id=N1008094527,SBS
"""미국, 주말 협상서 중국 관세 60% 이하로 인하 검토""",https://img.sbs.co.kr/news/pc/thumb_v3.png,도널드 트럼프 미국 행정부가 이번 주말 스위스에서 열릴 중국과의 무역 협상에서 긴장을 완화하고 양국이 이미 체감하기 시작한 경제적 고통을 줄이기…,2025.05.09 15:49,https://news.sbs.co.kr/news/endPage.do?news_id=N1008094529,SBS
"꽃다발로 시작한 김문수 첫 의총, 단일화 문제로 20분 만에 파국",https://img.sbs.co.kr/news/pc/thumb_v3.png,▲ 국민의힘 김문수 대선 후보가 9일 서울 여의도 국회에서 열린 의원총회에서 권영세 비상대책위원장이 단일화를 압박하는 발언 뒤 퇴장하…,2025.05.09 15:47,https://news.sbs.co.kr/news/endPage.do?news_id=N1008094519,SBS
"[여담야담] 의총 반전은 없었다…김문수, 강제단일화 거부",https://img.sbs.co.kr/news/pc/thumb_v3.png,"'SBS <편상욱의 뉴스브리핑>' ■ <편상욱의 뉴스브리핑> ■ ■ 김동원 국민의힘 대변인, 장경…",2025.05.09 15:45,https://news.sbs.co.kr/news/endPage.do?news_id=N1008094295,SBS
"[자막뉴스] 공무원 피하는 요즘 20대들…""월 300? 500 정도는 줘야죠""",https://img.sbs.co.kr/news/pc/thumb_v3.png,한때 안정된 직장의 대명사였던 공무원이 더 이상 꿈의 직업이 아닌 분위기라고요.한 채용 플랫폼이 Z세대 구직자 2천여 명을 대상으로 설문조사 한…,2025.05.09 15:43,https://news.sbs.co.kr/news/endPage.do?news_id=N1008090723,SBS
법관대표회의 26일 개최…사법신뢰·재판독립 논의,https://img.sbs.co.kr/news/pc/thumb_v3.png,▲ 대법원이재명 더불어민주당 대선 후보의 공직선거법 위반 사건 상고심 관련 논란에 대해 전국 각급 법원 대표 판사들의 회의체인 전국법…,2025.05.09 15:42,https://news.sbs.co.kr/news/endPage.do?news_id=N1008094521,SBS
'집단유급 현실화' 의대생 8천305명 유급된다…46명은 제적,https://img.sbs.co.kr/news/pc/thumb_v3.png,올해 1학기에도 의대생들의 수업 거부가 이어지는 가운데 전국 40개 의대 재학생의 43%가 유급 대상자로 확정됐습니다.의대생 신분을 잃게 되는 …,2025.05.09 15:42,https://news.sbs.co.kr/news/endPage.do?news_id=N1008094487,SBS
"2028 LA 올림픽 개회식, 콜리세움 · 소파이 스타디움서 동시 진행",https://img.sbs.co.kr/newimg/news/20250509/202069449_300.jpg,▲ 로스앤젤레스 메모리얼 콜리세움2028 로스앤젤레스 하계올림픽 조직위원회가 LA 올림픽 개회식을 두 곳에서 동시에 진행한다고 발표했…,2025.05.09 15:42,https://news.sbs.co.kr/news/endPage.do?news_id=N1008094504,SBS
"형들이 왜 거기서 나와?…에픽하이, 사이먼 페그 등과 반전 인맥",https://img.sbs.co.kr/newsnet/etv/upload/2025/05/09/30000990790_16v9.jpg,"그룹 에픽하이와 할리우드 스타들의 반전 인맥이 공개됐다.배우 사이먼 페그는 지난 8일 본인의 SNS 계정을 통해 에픽하이와 함께한 스토리 게시물을 게재했다.공개된 게시물에는 사이먼 페그, 그렉 타잔 데이비스와 함께 4컷 포토를 촬영한 에픽하이의 모습이 담겨 눈길을 끈다.",2025.05.09 15:40,https://news.sbs.co.kr/news/endPage.do?news_id=N1008094458,SBS
"[스포츠머그] 이게 결승 진출한 감독의 반응이 맞나?…""토트넘 폄하 그만해"" 울분 쏟아낸 포스텍",https://img.sbs.co.kr/newimg/news/20250509/202069448_300.jpg,"잉글랜드 프로축구 토트넘이 오늘 유로파리그 준결승 2차전에서 노르웨이의 보되/글림트를 1, 2차전 합계 5대 1로 앞서 결승행 티켓을 거머쥐었습…",2025.05.09 15:38,https://news.sbs.co.kr/news/endPage.do?news_id=N1008094071,SBS
"""파키스탄 중국산 전투기가 인도 프랑스산 라팔 격추""…미국도 촉각",https://img.sbs.co.kr/newimg/news/20250508/202069240_300.jpg,▲ 인도·파키스탄 무력 충돌파키스탄이 운용하는 중국산 전투기가 인도의 프랑스산 전투기를 격추했다는 파키스탄의 주장은 사실이라고 미국 …,2025.05.09 15:37,https://news.sbs.co.kr/news/endPage.do?news_id=N1008094492,SBS
"미 부통령, 인도-파키스탄 분쟁에 ""우리와 관련없는 일""",https://img.sbs.co.kr/news/pc/thumb_v3.png,▲ JD 밴스 부통령인도와 파키스탄의 무력 충돌에 대해 도널드 트럼프 미국 행정부의 2인자인 JD 밴스 부통령이 불개입 입장을 밝혔습…,2025.05.09 15:32,https://news.sbs.co.kr/news/endPage.do?news_id=N1008094483,SBS
[뉴블더] 한번 걸려들면 못 빠져나가는 마약의 굴레…재복역률 2위,https://img.sbs.co.kr/news/pc/thumb_v3.png,"이제 유명인이 마약을 투약했다거나, 또 국내에서 대규모 마약 유통 조직이 적발됐다는 소식이 크게 놀랍지 않을 정도로 우리나라도 마약 청정국의 지…",2025.05.09 15:31,https://news.sbs.co.kr/news/endPage.do?news_id=N1008094310,SBS
"""조희대 사퇴하라"" 대법 기습진입 시도…대진연 4명 체포",https://img.sbs.co.kr/news/pc/thumb_v3.png,▲ 조희대 대법원장의 사퇴를 촉구하는 대진연 회원들조희대 대법원장 사퇴를 요구하며 대법원 안으로 들어가려 한 한국대학생진보연합 회원 …,2025.05.09 15:25,https://news.sbs.co.kr/news/endPage.do?news_id=N1008094474,SBS
"[속보] 김문수, 홍준표 상임선대위원장 임명",https://img.sbs.co.kr/news/pc/thumb_v3.png,"김문수, 홍준표 상임선대위원장 임명",2025.05.09 15:23,https://news.sbs.co.kr/news/endPage.do?news_id=N1008094478,SBS
"의대생단체, 교육부 차관 등 공수처 고발…""대학에 유급 압박""",https://img.sbs.co.kr/news/pc/thumb_v3.png,▲ 이선우 대한의과대학·의학전문대학원학생협회 비대위원장이 9일 정부과천청사 고위공직자범죄수사처에 교육부 오석환 차관과 김홍순 의대교육…,2025.05.09 15:19,https://news.sbs.co.kr/news/endPage.do?news_id=N1008094465,SBS
"전국장애학생체육대회, 13∼16일 경남서 개최",https://img.sbs.co.kr/news/pc/thumb_v3.png,"제19회 전국장애학생체육대회가 13일부터 16일까지 나흘 동안 경상남도 지역에서 열립니다.육성종목 5개, 보급종목 11개(농구, 디스크골프, 배…",2025.05.09 15:15,https://news.sbs.co.kr/news/endPage.do?news_id=N1008094461,SBS
남양주 요양원 건물 옥상서 불…환자 등 58명 대피,https://img.sbs.co.kr/newimg/news/20250425/202064843_300.jpg,"오늘 오전 11시쯤 경기 남양주시 화도읍의 4층짜리 요양원 상가 건물 옥상에서 불이 났습니다.이 불로 인명피해는 없었지만, 건물 4층에 위치한 …",2025.05.09 14:52,https://news.sbs.co.kr/news/endPage.do?news_id=N1008094410,SBS
"이별 통보한 연인 흉기로 살해한 김레아, 항소심도 무기징역",https://img.sbs.co.kr/newimg/news/20250425/202065009_300.jpg,▲ 여자친구 살해한 혐의로 기소된 김레아이별을 통보한 연인을 살해한 혐의로 기소된 김레아가 항소심에서도 1심과 동일한 무기징역을 선고…,2025.05.09 14:52,https://news.sbs.co.kr/news/endPage.do?news_id=N1008094405,SBS
[D리포트] 250억대 주한미군 납품 담합 '덜미'…한미 공조 수사,https://img.sbs.co.kr/newimg/news/20250509/202069433_300.jpg,"검찰이 미국 법무부와 공조 수사를 통해 200억 원대 규모의 주한미군 시설 관리와 물품 공급, 또 설치 하도급 용역 입찰을 담합한 업체들을 적발…",2025.05.09 14:51,https://news.sbs.co.kr/news/endPage.do?news_id=N1008094397,SBS
"신임 교황 레오 14세, 과거 SNS에 공유된 게시물 보니",https://img.sbs.co.kr/newimg/news/20250509/202069348_300.jpg,전 세계 14억 가톨릭 신자를 이끌게 된 레오 14세는 모국 미국의 도널드 트럼프 행정부의 각종 정책에 대해 부정적인 입장이라는 분석이 제기됐습…,2025.05.09 14:38,https://news.sbs.co.kr/news/endPage.do?news_id=N1008094390,SBS
"'미임파8' 톰 크루즈, 트럼프 영화 관세 질문에 ""잘 안 들린다""며 대답 회피",https://img.sbs.co.kr/news/pc/thumb_v3.png,"할리우드 스타 톰 크루즈가 내한 기자회견에서 미국 트럼프 대통령의 영화 관세 부과에 관한 질문을 받았으나 답변을 피했다.8일 서울 잠실 월드타워 롯데시네마에서 열린 '미션 임파서블: 파이널 레코닝' 기자회견에 참석한 톰 크루즈는 행사 말미 한 방소사의 기자로부터 ""'미션 임파서블: 파이널 레코닝'이 아프리카 등 여러 나라에서 촬영을 한 것으로 알고 있다.",2025.05.09 14:35,https://news.sbs.co.kr/news/endPage.do?news_id=N1008093848,SBS
"뉴진스 민지, 팬들에게 메시지 ""멈춘 게 아냐…깊어질 뿐""",https://img.sbs.co.kr/news/pc/thumb_v3.png,활동 중단 중인 그룹 뉴진스 멤버 민지가 기다리는 팬들에게 앞으로의 활동을 기대해 달라고 당부했다.지난 7일 생일을 맞은 민지는 멤버들과 만든 …,2025.05.09 14:34,https://news.sbs.co.kr/news/endPage.do?news_id=N1008094158,SBS
"남궁민 소속사, 매니저 사칭 피해→노쇼 사기 확인…주의 당부",https://img.sbs.co.kr/news/pc/thumb_v3.png,"배우 남궁민, 박주현 등이 소속된 연예기획사 935엔터테인먼트가 매니저 사칭 사기 주의를 당부했다.9일 935엔터테인먼트 측은 보도자료를 통해 …",2025.05.09 14:34,https://news.sbs.co.kr/news/endPage.do?news_id=N1008094219,SBS
"[꼬꼬무 찐리뷰] ""살인으로 세계 제일 되겠다""…황당한 꿈꿨던 온보현, 충격적인 살인일지",https://img.sbs.co.kr/news/pc/thumb_v3.png,"우리가 잊지 말아야 할 역사 속 '그날'의 이야기를, '장트리오' 장현성-장성규-장도연이 들려주는 SBS '꼬리에 꼬리를 무는 그날 이야기'.",2025.05.09 14:34,https://news.sbs.co.kr/news/endPage.do?news_id=N1008094235,SBS
[현장영상] '옥새런 김문수' 그날 이미 모든 걸 말했다?,https://img.sbs.co.kr/news/pc/thumb_v3.png,"한덕수 대선 예비 후보와의 단일화로 논란이 일고 있는 가운데, 지난달 30일 김문수 국민의힘 대선 후보의 발언이 다시 조명받고 있습니다. 시종일관 한 후보와의 단일화를 반드시 하겠다고 말했던 김 후보의 말이 확 달라졌기 때문입니다.",2025.05.09 14:33,https://news.sbs.co.kr/news/endPage.do?news_id=N1008094031,SBS
'잘 나가던' 백종원이 어쩌다가 '리스크'가 됐나 [스프],https://img.sbs.co.kr/news/pc/thumb_v3.png,'주말에 뭐 볼까?' 주말을 즐겁게 보내는 방법을 스프가 알려드립니다. 우리나라는 먹는 것에 민감한 편이다. 가볍게만 봐도 그렇다.,2025.05.09 14:27,https://news.sbs.co.kr/news/endPage.do?news_id=N1008094275,SBS
"김정은도 기소되나…유럽, '우크라이나 침략 범죄' 단죄 추진",https://img.sbs.co.kr/newimg/news/20240613/201944778_300.jpg,"▲ 김정은 북한 국무위원장과 블라디미르 푸틴 러시아 대통령유럽연합이 우크라이나 전쟁에서 발생한 러시아와 북한, 벨라루스의 침략 범죄를…",2025.05.09 14:25,https://news.sbs.co.kr/news/endPage.do?news_id=N1008094379,SBS
"미네소타, '커리 결장' GS에 완승…시리즈 1승 1패",https://img.sbs.co.kr/newimg/news/20250509/202069421_300.jpg,▲ 덩크하는 미네소타 줄리어스 랜들NBA 미네소타가 스테픈 커리가 부상으로 결장한 골든스테이트를 제압하고 시리즈를 원점으로 돌렸습니다…,2025.05.09 14:19,https://news.sbs.co.kr/news/endPage.do?news_id=N1008094364,SBS
"""드론 · 미사일로 또 공격""…'무력 충돌' 인도 · 파키스탄, 서로 비난",https://img.sbs.co.kr/newimg/news/20250507/202068778_300.jpg,인도와 파키스탄 간 무력 충돌이 전면전으로 확산할 수 있다는 우려가 고조되는 가운데 양국은 드론과 미사일 공격을 주고받고 있습니다.인도와 파키스…,2025.05.09 14:19,https://news.sbs.co.kr/news/endPage.do?news_id=N1008094369,SBS
미얀마 남동부 국경지대서 내전 격화…주민 수백 명 태국 대피,https://img.sbs.co.kr/newimg/news/20250403/202056976_300.jpg,미얀마 군사정권이 지진 복구를 위한 휴전 연장을 선언했지만 내전이 계속돼 민간인 피해가 늘고 있습니다.AFP통신은 오늘 미얀마 남동부 카인주에서…,2025.05.09 14:17,https://news.sbs.co.kr/news/endPage.do?news_id=N1008094366,SBS
중국 4월 수출 8.1% '깜짝 증가'…예상치 대폭 웃돌아,https://img.sbs.co.kr/news/pc/thumb_v3.png,미중 관세전쟁이 본격화한 가운데서도 중국의 지난달 수출이 예상치를 크게 뛰어넘어 8.1% '깜짝 증가'한 것으로 나타났습니다.중국…,2025.05.09 14:15,https://news.sbs.co.kr/news/endPage.do?news_id=N1008094365,SBS
남양주 요양원 건물 옥상서 불…환자 등 58명 대피,https://img.sbs.co.kr/news/pc/thumb_v3.png,오늘 오전 11시쯤 경기 남양주시 화도읍의 4층짜리 요양원 상가 건물 옥상에서 불이 났습니다.불은 약 20분 만에 모두 꺼졌고 다행히 인명피해는…,2025.05.09 14:15,https://news.sbs.co.kr/news/endPage.do?news_id=N1008094363,SBS
대선 앞두고 세종 아파트값 '파죽지세'…17개 시도 중 최고 상승률,https://img.sbs.co.kr/news/pc/thumb_v3.png,▲ 5월 첫째주 지역별 아파트 매매가격 동향내달 대선을 앞두고 세종시의 집값이 파죽지세로 오르고 있습니다.한국부동산원이 오늘 발표한 …,2025.05.09 14:15,https://news.sbs.co.kr/news/endPage.do?news_id=N1008094355,SBS
"벌써 수확 시작된 춘향골 복숭아…""노지보다 40일 빨라""",https://img.sbs.co.kr/news/pc/thumb_v3.png,▲ 춘향골 복숭아 수확전북 남원시 송동면의 한 비닐하우스에서 최근 복숭아 수확이 시작됐습니다.이 복숭아는 '초극황도' …,2025.05.09 14:14,https://news.sbs.co.kr/news/endPage.do?news_id=N1008094350,SBS
"""내가 점장이야"" 편의점 4곳서 기프트카드 무단 충전…20대 실형",https://img.sbs.co.kr/news/pc/thumb_v3.png,▲ 청주지법편의점 점장을 사칭해 여러 차례 카운터에서 구글 기프트카드를 무단으로 충전한 20대가 실형을 선고받았습니다.청주지법 형사3…,2025.05.09 14:14,https://news.sbs.co.kr/news/endPage.do?news_id=N1008094349,SBS
"일본 ""북한, 어제 발사한 변칙궤도 미사일은 KN-23…우크라서 사용""",https://img.sbs.co.kr/news/pc/thumb_v3.png,▲ 나타카니 겐 일본 방위상나카타니 겐 일본 방위상은 오늘 북한이 어제 동해상으로 발사한 탄도미사일 중 한 발이 2023년 9월 발사…,2025.05.09 14:14,https://news.sbs.co.kr/news/endPage.do?news_id=N1008094340,SBS
