title,thumbnail,short_content,write_time,link,company
"일 언론 ""한일 정부, 캐나다 G7 때 양국 정상회담 조율 착수""",https://img.sbs.co.kr/newimg/news/20250612/202081048_300.jpg,▲ 일본 총리와 전화 통화하는 이재명 대통령한국과 일본 정부가 오는 15∼17일 주요 7개국 정상회의가 열리는 캐나다에서 이재…,2025.06.12 23:13,https://news.sbs.co.kr/news/endPage.do?news_id=N1008136307,SBS
미 5월 도매 물가도 관세 영향 '제한적'…전월 대비 0.1%↑,https://img.sbs.co.kr/newimg/news/20250420/202062857_300.jpg,▲ 미국 캘리포니아주 오클랜드항에서 컨테이너를 싣기 위해 기다리는 트럭들도널드 트럼프 미 행정부의 관세 정책 강행에도 불구하고 5월 …,2025.06.12 23:11,https://news.sbs.co.kr/news/endPage.do?news_id=N1008136306,SBS
미 2주 이상 실업수당 청구 3년 7개월 만에 최대…고용 냉각 우려,https://img.sbs.co.kr/newimg/news/20250612/202081047_300.jpg,▲ 미국 일리노이주 한 소매점의 구인광고미국에서 실직 후에 새 일자리를 바로 찾지 못하는 실업자들이 3년여 만에 최대 수준으로 늘어난…,2025.06.12 23:10,https://news.sbs.co.kr/news/endPage.do?news_id=N1008136305,SBS
"재정 규정 어긴 광주FC, 벌금 1천만 원 + 영입 금지 1년에 집행유예",https://img.sbs.co.kr/newimg/news/20250612/202081046_300.jpg,▲ 한국프로축구연맹 조남돈 상벌위원장이 12일 서울 종로구 한국프로축구연맹에서 열린 광주FC 관련 상벌위원회 개회 선언을 하고 있다.…,2025.06.12 21:32,https://news.sbs.co.kr/news/endPage.do?news_id=N1008136279,SBS
클로징,https://img.sbs.co.kr/news/pc/thumb_v3.png,8시 뉴스 마칩니다. 고맙습니다.,2025.06.12 21:27,https://news.sbs.co.kr/news/endPage.do?news_id=N1008136219,SBS
[날씨] 서울 토요일까지 더위…금요일 남부부터 비 확대,https://img.sbs.co.kr/news/pc/thumb_v3.png,"오늘도 많이 더우셨죠.오늘 서울의 낮 최고 기온이 33도까지 올라서 올 들어 가장 더웠습니다.내일은 하늘이 흐려지면서 더위가 조금 덜하겠지만, …",2025.06.12 21:27,https://news.sbs.co.kr/news/endPage.do?news_id=N1008136218,SBS
"이정후, 이틀 연속 3루타…팀 7연승 이끌었다",https://img.sbs.co.kr/news/pc/thumb_v3.png,이정후 선수가 이틀 연속 3루타를 터뜨리며 샌프란시스코의 7연승을 이끌었습니다.,2025.06.12 21:25,https://news.sbs.co.kr/news/endPage.do?news_id=N1008136217,SBS
"이규민 짜릿한 홀인원…""내 차! 내 차!""",https://img.sbs.co.kr/news/pc/thumb_v3.png,"국내 남자 골프에서 짜릿한 홀인원이 나왔는데요.홀인원의 주인공은 온몸으로 기쁨을 표현했습니다.하나은행 인비테이셔널 첫날, 149m 거리의 파3,…",2025.06.12 21:24,https://news.sbs.co.kr/news/endPage.do?news_id=N1008136216,SBS
'19살 샛별' 첫 도전서 은메달…계영 800m 새 희망,https://img.sbs.co.kr/news/pc/thumb_v3.png,19살 수영 괴물 김영범 선수가 국내 대회 자유형 200m에 처음으로 출전해 김우민에 이어 2위를 차지했습니다. 계영 800m 대표팀 합류도 확…,2025.06.12 21:23,https://news.sbs.co.kr/news/endPage.do?news_id=N1008136215,SBS
"광주FC, '벌금 1천만 원'·'영입 금지 1년' 징계",https://img.sbs.co.kr/news/pc/thumb_v3.png,프로축구 광주가 재정 건전화 규정을 어겼다는 이유로 제재금 1천만 원 등의 중징계를 받았습니다.프로축구연맹은 광주가 지난해 23억 원의 적자를 …,2025.06.12 21:22,https://news.sbs.co.kr/news/endPage.do?news_id=N1008136214,SBS
전역 앞둔 상무 3인방…'릴레이 위력투',https://img.sbs.co.kr/newimg/news/20250612/202081037_300.jpg,"닷새 뒤 전역하는 동갑내기 투수 3인방 구창모와 이정용, 배제성 선수가 상무에서의 마지막 등판을 깔끔하게 마쳤습니다. 다음 주부터는 1군에서 원…",2025.06.12 21:21,https://news.sbs.co.kr/news/endPage.do?news_id=N1008136213,SBS
"""분열 말자"" 퇴임한 권성동 강조했지만…국힘 첩첩산중",https://img.sbs.co.kr/newimg/news/20250612/202081035_300.jpg,"권성동 국민의힘 원내대표가 오늘 퇴임 기자회견에서 ""분열하지 말자""고 강조했습니다. 하지만 대선 후보 교체 시도와 관련한 당무 감사가 일부 반발이 있는 상태에서 진행되며 내부 갈등이 길어질 조짐을 보이고 있습니다.박찬범 기자입니다.",2025.06.12 21:19,https://news.sbs.co.kr/news/endPage.do?news_id=N1008136209,SBS
'영상' 보고 배워 사람처럼 작업…정확도·속도 높아졌다,https://img.sbs.co.kr/newimg/news/20250612/202081034_300.jpg,"최근 전 세계 빅테크들이 휴머노이드 개발에 열을 올리면서 이걸 학습시키는 방식도 발전하고 있습니다. 사람이 정해준 규칙이 아니라, 휴머노이드 로봇이 영상을 보고 동작을 익혀서 사람처럼 작업한다고 하는데요.홍영재 기자가 전해드립니다.",2025.06.12 21:17,https://news.sbs.co.kr/news/endPage.do?news_id=N1008136208,SBS
강원 홍천 고속도로서 트럭 전도…40대 운전자 숨져,https://img.sbs.co.kr/newimg/news/20191127/201378259_300.jpg,오늘 저녁 7시 10분쯤 강원 홍천군 북방면 하화계리 중앙고속도로 364㎞ 지점 대구 방향 하행선에서 2.5t 트럭이 넘어졌습니다.…,2025.06.12 21:15,https://news.sbs.co.kr/news/endPage.do?news_id=N1008136273,SBS
아이들 탄 차량 들이받고 총 겨눴다…미 시위 계속 확산,https://img.sbs.co.kr/news/pc/thumb_v3.png,불법 이민자 단속에 저항하는 시위가 전역으로 번지고 있는 미국에서는 당국의 무리한 단속에 논란이 일고 있습니다. 아이들도 타고 있는 차를 들이받고 총을 겨누기도 했는데 트럼프 행정부는 비난이 쏟아져도 강경 대응을 굽히지 않고 있습니다.김경희 기자입니다.,2025.06.12 21:15,https://news.sbs.co.kr/news/endPage.do?news_id=N1008136206,SBS
'상호관세' 유예 기간 연장하나…곧바로 선 그은 트럼프,https://img.sbs.co.kr/news/pc/thumb_v3.png,"미국이 세계 각국에 물린 상호관세를 유예한 기간이 한 달도 채 남지 않았습니다. 미국 재무장관이 이 기간을 늘려줄 가능성을 언급했는데, 트럼프 대통령은 곧바로 그럴 필요가 없을 거라며 선을 그었습니다.워싱턴 김용태 특파원의 보도입니다.",2025.06.12 21:14,https://news.sbs.co.kr/news/endPage.do?news_id=N1008136207,SBS
242명 탑승 인도 여객기 추락 후 폭발…이륙 직후 사고,https://img.sbs.co.kr/news/pc/thumb_v3.png,"인도에서 영국 런던으로 향하던 여객기 1대가 이륙 직후 주택가로 추락해 폭발했습니다. 사고 여객기에는 242명이 타고 있었는데, 아직 구체적인 …",2025.06.12 21:09,https://news.sbs.co.kr/news/endPage.do?news_id=N1008136205,SBS
"""활주로 놔두고 왜""…KF-16 전투기 사고 조사하자 반전",https://img.sbs.co.kr/news/pc/thumb_v3.png,"어제 우리 공군 전투기가 미국 알래스카에서 이륙하던 도중에 사고가 나서 조종사 2명이 비상탈출하는 일이 있었습니다. 조사 결과, 원래 정해진 활…",2025.06.12 21:04,https://news.sbs.co.kr/news/endPage.do?news_id=N1008136204,SBS
'굉음' 나더니 그대로 돌진…대낮 강남서 사람들 날벼락,https://img.sbs.co.kr/news/pc/thumb_v3.png,오늘 점심 시간대에 서울 강남에서 승용차 1대가 식당 쪽으로 돌진해 4명이 다쳤습니다. 사고를 낸 80대 운전자는 급발진을 주장하고 있는 것으로 알려졌습니다.신용일 기자가 취재했습니다.,2025.06.12 21:00,https://news.sbs.co.kr/news/endPage.do?news_id=N1008136203,SBS
"""이 대통령 아들 결혼식 테러"" 글…붙잡힌 남성 꺼낸 말",https://img.sbs.co.kr/news/pc/thumb_v3.png,이재명 대통령 아들의 결혼식을 언급하며 테러를 암시하는 듯한 글을 SNS에 올린 50대 남성이 붙잡혔습니다. 이 남성은 실제 행동에 옮길 뜻은 없었다고 경찰에 진술했습니다.신정은 기자입니다.,2025.06.12 20:58,https://news.sbs.co.kr/news/endPage.do?news_id=N1008136200,SBS
'서울 33.1도' 올 들어 최고 기온…주말 전국에 '비 소식',https://img.sbs.co.kr/newimg/news/20250612/202081014_300.jpg,오늘도 참 더웠습니다. 서울은 낮 기온이 섭씨 33도를 넘으면서 한여름처럼 햇볕에 얼굴이 따가울 정도였습니다. 제주와 남해안에는 내일 밤부터 비가 많이 온다고 하니까 피해 없도록 대비하시기 바랍니다.서동균 기자가 전하겠습니다.,2025.06.12 20:56,https://news.sbs.co.kr/news/endPage.do?news_id=N1008136199,SBS
"미 ""북한과 진전 원해""…""북한은 트럼프 친서 거절했다""",https://img.sbs.co.kr/newimg/news/20250612/202081012_300.jpg,"트럼프 미국 대통령이 북한과 진전을 바란다는 메시지를 내놨습니다. 실제로 트럼프 대통령은 김정은 국무위원장에게 집권 1기 때처럼 편지도 써서 보내려고 했는데, 북한이 이걸 거절했다는 보도가 나왔습니다.어떻게 해석해야 할지, 김범주 특파원이 짚어봤습니다.",2025.06.12 20:54,https://news.sbs.co.kr/news/endPage.do?news_id=N1008136198,SBS
'대북 확성기' 멈추자 대남 방송 중지…접경지역 가보니,https://img.sbs.co.kr/newimg/news/20250612/202081009_300.jpg,"우리 군이 대북 확성기 방송을 멈췄단 소식 전해드렸는데, 북한도 오늘 새벽부터 대남 방송을 하지 않고 있습니다. 온갖 소음에 고통받던 접경지역 주민들은 반가워하고 있는데요.북한과 맞닿아있는 인천 강화도 지역에 김수영 기자가 다녀왔습니다.",2025.06.12 20:51,https://news.sbs.co.kr/news/endPage.do?news_id=N1008136197,SBS
"""웅크려 가야 하나""…대한항공 장거리 이코노미 무슨 일",https://img.sbs.co.kr/newimg/news/20250612/202081005_300.jpg,"이런 가운데 대한항공이 장거리 노선 기종의 이코노미 좌석 수를 늘리는 방향을 추진해 논란이 일고 있습니다. 이렇게 되면 항공사 수익은 늘지만, …",2025.06.12 20:44,https://news.sbs.co.kr/news/endPage.do?news_id=N1008136195,SBS
"대한항공 마일리지 통합안에 퇴짜…""권익 보호에 미흡""",https://img.sbs.co.kr/news/pc/thumb_v3.png,"아시아나항공과 합병 절차를 밟고 있는 대한항공이 오늘 두 회사의 마일리지를 통합하는 방안을 공정거래위원회에 제출했습니다. 그런데 내자마자 바로 퇴짜를 맞았습니다.두 회사가 합쳐지면 마일리지는 어떻게 될지가 사람들의 큰 관심사였는데요, 공정위가 어떤 점을 보완하라고 한 건지 정준호 기자가 전해드립니다.",2025.06.12 20:42,https://news.sbs.co.kr/news/endPage.do?news_id=N1008136194,SBS
조국 사면론 '솔솔'…옥중 인터뷰 통해 직접 입장 밝혔다,https://img.sbs.co.kr/news/pc/thumb_v3.png,"자녀 입시 비리 혐의로 수감된 조국 전 대표의 사면 이야기가 대선 이후 정치권에서 최근 계속 흘러나오고 있습니다. 이런 상황에서 조국 전 대표가 옥중 인터뷰를 통해 자신의 특별사면 문제에 대해서 처음으로 입장을 밝혔습니다.자세한 내용을, 백운 기자가 전하겠습니다.",2025.06.12 20:38,https://news.sbs.co.kr/news/endPage.do?news_id=N1008136193,SBS
"출석 요구에도 윤 ""불출석 의지 확고""…'강제 구인' 검토",https://img.sbs.co.kr/news/pc/thumb_v3.png,"윤석열 전 대통령이 오늘 경찰의 두 번째 출석 요구에도 응하지 않았습니다. 경찰은 일주일 뒤에 다시 조사받으러 나오라고 통보했는데, 그때도 응하…",2025.06.12 20:34,https://news.sbs.co.kr/news/endPage.do?news_id=N1008136192,SBS
건진법사 재소환한 검찰…'명품 목걸이·가방' 행방 추궁,https://img.sbs.co.kr/news/pc/thumb_v3.png,김건희 여사를 둘러싼 의혹을 조사하고 있는 검찰이 오늘 건진법사 전성배 씨를 다시 불러서 조사하고 있습니다. 검찰에 나가 있는 취재기자 연결해서…,2025.06.12 20:30,https://news.sbs.co.kr/news/endPage.do?news_id=N1008136191,SBS
"""25만 원 민생지원금 지급""…전 국민 지급? 선별 지급?",https://img.sbs.co.kr/news/pc/thumb_v3.png,"민생지원금을 한 사람한테 25만 원씩 지급하는 방안이 여당 안에서 논의되고 있습니다. 다만 모든 사람한테 다 똑같이 돈을 줄지, 아니면 선별적으로 나눠줄지, 여기에 대해서는 의견이 조금씩 엇갈리고 있습니다.손기준 기자가 취재했습니다.",2025.06.12 20:27,https://news.sbs.co.kr/news/endPage.do?news_id=N1008136190,SBS
"5일 만에 1억 5천 올라 신고가…""전화하면 1억 더 달라""",https://img.sbs.co.kr/news/pc/thumb_v3.png,"서울 아파트 값이 아홉 달 만에 가장 높은 상승률을 기록했습니다. 강남뿐 아니라 그 주변 지역에서도 상승세가 이어지고 있습니다. 정부는 이런 시장 상황을 엄중하게 보고 있다며, 가능한 정책 수단을 모두 다 검토하겠다고 밝혔습니다.하정연 기자가 취재했습니다.",2025.06.12 20:24,https://news.sbs.co.kr/news/endPage.do?news_id=N1008136189,SBS
"'김민석, 하루 9명에게 1천만 원씩 빌려'…석연찮은 흐름",https://img.sbs.co.kr/newimg/news/20250612/202080989_300.jpg,김민석 국무총리 후보자가 과거 불법 정치자금을 받았던 사람한테 7년 전에 또다시 수천만 원을 빌린 뒤 지금까지도 그 돈을 갚지 않고 있는 것으로…,2025.06.12 20:19,https://news.sbs.co.kr/news/endPage.do?news_id=N1008136187,SBS
"예정 없던 이태원 찾아간 이 대통령…""참사, 재발 안 돼""",https://img.sbs.co.kr/newimg/news/20250612/202080985_300.jpg,"이재명 대통령이 오늘 이태원 참사 현장을 찾아 희생자들을 추모했습니다. 다시는 이런 참사가 일어나면 안 된다며, 안전 관리를 담당하는 공직자들의…",2025.06.12 20:14,https://news.sbs.co.kr/news/endPage.do?news_id=N1008136186,SBS
자주파 대 동맹파 대통령실 의견 대립?…나토 참석할까,https://img.sbs.co.kr/newimg/news/20250612/202080984_300.jpg,"이 내용은 대통령실 취재기자를 연결해서 더 자세히 알아보도록 하겠습니다.박예린 기자, 대통령이 나토 정상회의에 갈 가능성이 좀 더 커진 걸로 보…",2025.06.12 20:14,https://news.sbs.co.kr/news/endPage.do?news_id=N1008136185,SBS
"""대통령, 나토 참석이 좋지 않겠나…러 통화 계획 없어""",https://img.sbs.co.kr/newimg/news/20250612/202080982_300.jpg,"이재명 대통령이 이번 달 열리는 북대서양조약기구, 즉 나토 정상회의에 참석할 가능성이 큰 것으로 파악됐습니다. 그동안 여권 안에서는 참석 여부를…",2025.06.12 20:06,https://news.sbs.co.kr/news/endPage.do?news_id=N1008136184,SBS
윤과 갈등 빚거나 좌천됐었다…후보들 면면 살펴봤더니,https://img.sbs.co.kr/news/pc/thumb_v3.png,"대통령에게 추천된 특검 후보자들이 어떤 사람인지 좀 더 자세히 들여다보겠습니다. 후보자 가운데는 윤 전 대통령과 갈등이 있었거나, 지난 정부 때 좌천된 인사들도 있습니다.이어서 한성희 기자입니다.",2025.06.12 20:03,https://news.sbs.co.kr/news/endPage.do?news_id=N1008136183,SBS
"민주·혁신당, '3대 특검' 후보자 6명 추천…사흘 내 결정",https://img.sbs.co.kr/news/pc/thumb_v3.png,"내란 특검과 김건희 특검, 그리고 채 상병 특검을 지휘할 특별검사 후보자들이 확정됐습니다. 민주당과 조국혁신당이 오늘 특검 후보자를 각각 3명씩 대통령에게 추천했습니다.",2025.06.12 19:59,https://news.sbs.co.kr/news/endPage.do?news_id=N1008136182,SBS
"'시흥 흉기 살인범' 차철남 구속기소…""6개월 전부터 범행 준비""",https://img.sbs.co.kr/news/pc/thumb_v3.png,중국인 형제 2명을 살해하고 내국인 2명을 추가로 살해하려다가 미수에 그친 중국 동포 차철남이 구속 상태로 재판에 넘겨졌습니다.수원지검 안산지청…,2025.06.12 19:57,https://news.sbs.co.kr/news/endPage.do?news_id=N1008136256,SBS
"이형준·옥태훈, 하나은행 인비테이셔널 1라운드 공동 선두",https://img.sbs.co.kr/news/pc/thumb_v3.png,▲ 티샷 날리는 이형준한국프로골프 투어에서 통산 6승을 차지한 이형준과 올 시즌 '톱 5'만 네 차례 기록한 옥태훈이 …,2025.06.12 19:50,https://news.sbs.co.kr/news/endPage.do?news_id=N1008136254,SBS
"에어인디아 여객기 인도 서부서 이륙 직후 추락…""최소 110명 사망""",https://img.sbs.co.kr/news/pc/thumb_v3.png,"▲ 추락 사고 현장240여 명을 태운 에어인디아 여객기가 현지 시간 12일, 인도 서부 아메다바드 공항 근처에서 추락했습니다.현지 매…",2025.06.12 19:46,https://news.sbs.co.kr/news/endPage.do?news_id=N1008136255,SBS
오늘의 SBS 8뉴스 예고 (6월 12일),https://img.sbs.co.kr/news/pc/thumb_v3.png,"오늘 <SBS 8뉴스>에서는▶ 민주당, 3특검 후보에 조은석·민중기·이윤제...조국혁신당, 한동수·심재철·이명현 추천▶ 인…",2025.06.12 19:39,https://news.sbs.co.kr/news/endPage.do?news_id=N1008136063,SBS
"'지난해 신인왕' 유현조, 한국여자오픈 골프 첫날 단독 선두",https://img.sbs.co.kr/newimg/news/20250612/202080969_300.jpg,"▲ 유현조의 티샷한국여자프로골프, KLPGA 투어 시즌 두 번째 메이저 대회이자 '내셔널 타이틀 대회'인 한국여자오픈에…",2025.06.12 19:32,https://news.sbs.co.kr/news/endPage.do?news_id=N1008136243,SBS
[귀에빡종원] 사진 지우기 달인 삼성 vs AI 사기꾼 애플…삼성 갤럭시가 이기는 판 왔나?,https://img.sbs.co.kr/newimg/news/20250612/202080967_300.jpg,AI 산업에 너무 늦게 뛰어들었다는 비판을 받던 애플은 이러한 우려를 지난해 한 방에 날렸습니다. 자사 최대 행사인 WWDC2024에서 장장 40분에 걸쳐 애플 인텔리전스라 이름 붙인 AI 기능을 소개한 겁니다.,2025.06.12 19:16,https://news.sbs.co.kr/news/endPage.do?news_id=N1008131990,SBS
'전통의 강호' 이탈리아는 어쩌다 월드컵 본선 진출을 걱정하게 됐나? (ft. 박찬우 해설),https://img.sbs.co.kr/newimg/news/20250612/202080968_300.jpg,내년 열리는 북중미 월드컵 유럽 예선에 나선 '전통의 강호' 이탈리아.I조 1차전 노르웨이 원정에서 0대 3 완패를 당한 뒤 월드…,2025.06.12 19:11,https://news.sbs.co.kr/news/endPage.do?news_id=N1008133739,SBS
"[8뉴스 예고] 민주·조국혁신당, 3대 특검 후보자 추천",https://img.sbs.co.kr/newimg/news/20250612/202080940_300.jpg,"오늘 낮 서울 기온이 32도까지 올라 올 들어 가장 더웠습니다. 주말엔 전국에 비 소식이 있습니다. 8시 뉴스 주요 내용 살펴보겠습니다.1. 민주·조국혁신당, 3대 특검 후보자 추천더불어민주당과 조국혁신당이 내란·김건희·채 상병, 이른바 3대 특검 후보자들을 각각 추천했습니다.",2025.06.12 18:51,https://news.sbs.co.kr/news/endPage.do?news_id=N1008136062,SBS
"김우민, 광주 전국수영선수권 자유형 200m 우승",https://img.sbs.co.kr/news/pc/thumb_v3.png,▲ 김우민의 역영한국 수영의 간판 김우민이 컨디션 점검 차 출전한 자유형 200m 종목에서 우승을 차지했습니다.김우민은 오늘 광주광역…,2025.06.12 18:47,https://news.sbs.co.kr/news/endPage.do?news_id=N1008136178,SBS
"홍명보호, 10월 14일 파라과이와 국내서 평가전",https://img.sbs.co.kr/news/pc/thumb_v3.png,▲ 2022년 6월 10일 파라과이 평가전에서 득점하는 손흥민11회 연속 월드컵 본선 진출을 달성한 축구 대표팀이 10월 A매치 기간…,2025.06.12 18:44,https://news.sbs.co.kr/news/endPage.do?news_id=N1008136177,SBS
"""누가 LA 폭동에 자금 댄다고!"" 배후 세력 들쑤신 트럼프…""실패한 독재자!"" 위헌 비판에 '불꽃 설전' 벌이더니 (트럼프 NOW)",https://img.sbs.co.kr/news/pc/thumb_v3.png,"LA에서 트럼프 행정부의 불법이민자 단속에 맞선 시위는 엿새째 이어지고 있습니다.전날 내려진 통행금지령의 영향으로 약탈이나 폭력 행위, 큰 충돌…",2025.06.12 18:34,https://news.sbs.co.kr/news/endPage.do?news_id=N1008135231,SBS
"한국 모빌리티 기술 중국에 선보여…KIC중국, 청두 K-데모데이 개최",https://img.sbs.co.kr/news/pc/thumb_v3.png,우리나라 혁신기업들이 글로벌혁신센터 등의 지원으로 중국 쓰촨성 청두에서 모빌리티 혁신 기술을 선보이며 투자 유치에 나섰습니다.KIC중국은 오늘 …,2025.06.12 18:27,https://news.sbs.co.kr/news/endPage.do?news_id=N1008136161,SBS
화성 폐기물 처리업체서 40대 외국인 근로자 기계에 끼여 숨져,https://img.sbs.co.kr/news/pc/thumb_v3.png,경기 화성시의 한 폐기물 처리업체에서 40대 외국인 근로자가 기계에 끼여 숨지는 사고가 났습니다.경기 화성서부경찰서에 따르면 오늘 아침 7시 3…,2025.06.12 18:23,https://news.sbs.co.kr/news/endPage.do?news_id=N1008136160,SBS
"정근식 서울교육감, 리박스쿨 논란에 ""강사 자격·경력 관리 필요""",https://img.sbs.co.kr/news/pc/thumb_v3.png,"▲ 정근식 서울교육감보수 성향 교육단체인 리박스쿨의 늘봄학교 강사 파견 논란과 관련해 정근식 서울교육감이 ""늘봄학교 강사 자격…",2025.06.12 18:19,https://news.sbs.co.kr/news/endPage.do?news_id=N1008136154,SBS
"법무부, 에콰도르서 성착취물 3천 건 배포한 한국인 송환",https://img.sbs.co.kr/newimg/news/20231116/201857965_300.jpg,해외에서 아동·청소년 성착취물을 배포하고 한국인을 상대로 음란 사이트를 운영한 혐의를 받는 50대 남성이 에콰도르에서 송환됐습니다.법무부는 51…,2025.06.12 18:17,https://news.sbs.co.kr/news/endPage.do?news_id=N1008136151,SBS
"건보공단 담배 소송 지지한 석학들…""기만적 행위 책임 물어야""",https://img.sbs.co.kr/newimg/news/20250521/202073238_300.jpg,▲ 서울 시내 편의점의 담배 판매대 모습담배회사를 대상으로 한 국민건강보험공단의 500억 원대 항소심이 진행 중인 가운데 세계 석학들…,2025.06.12 18:13,https://news.sbs.co.kr/news/endPage.do?news_id=N1008136147,SBS
대선 패배 후 만난 이준석·김용태…'이준석 지령설' 말하며 '폭소' [현장영상],https://img.sbs.co.kr/newimg/news/20250612/202080936_300.jpg,"대선에서 동반 패배한 이준석 개혁신당 의원과 김용태 국민의힘 비상대책위원장이 카메라 앞에서 마주쳤습니다.잡담을 나누는가 싶던 두 사람, 김 위원…",2025.06.12 18:12,https://news.sbs.co.kr/news/endPage.do?news_id=N1008136072,SBS
[자막뉴스] AI는 사실 '전기 먹는 하마'…'블랙아웃' 위협 턱밑까지 왔다,https://img.sbs.co.kr/newimg/news/20250612/202080961_300.jpg,"전 세계 인구의 10%가 사용하는 생성형 AI, 그 편의성 덕분에 여러 분야에 쓰이고 있습니다.[궤도/과학커뮤니케이터: 생성형 AI는 누구나 쉽게 쓸 수 있기 때문에 실생활부터 교육, 엔터테인먼트, 비즈니스 등 여러 분야에 빠르게 적용되고 있죠.] 하지만 더 많은 사람들이 AI를 사용하면서 전력 소모량이 급속도로 늘고 결국 전력 공급이 끊기면서 한 도시나 국가 전체가 어둠에 빠지는 이른바 '블랙아웃'의 위험성이 커지고 있습니다.[이성수 교수/숭실대학교 전자정보공학부: 어느 순간에는 정말 AI 때문에 블랙아웃이 올 가능성을 전혀 배제할 수는 없다고 봅니다.]우리가 챗GPT로 쉽게 부르는 대화형 AI 사용 시 전력량은 엄청난 수준입니다.",2025.06.12 18:12,https://news.sbs.co.kr/news/endPage.do?news_id=N1008135995,SBS
"[현장영상] 이태원 참사 현장 찾은 이 대통령 ""피해자 아낌없이 지원…진상규명 철저""",https://img.sbs.co.kr/news/pc/thumb_v3.png,이재명 대통령은 오늘 오후 이태원 참사현장을 찾았습니다. 이태원 '기억과 안전의 길'을 꼼꼼히 둘러본 이 대통령은 참사 피해자에 …,2025.06.12 18:09,https://news.sbs.co.kr/news/endPage.do?news_id=N1008136097,SBS
"경찰, 윤 전 대통령에 19일 3차 소환 통보 '최후통첩'…""반드시 대면조사",https://img.sbs.co.kr/news/pc/thumb_v3.png,▲ 윤석열 전 대통령경찰이 오늘 2차 출석 요구에 불응한 윤석열 전 대통령에게 오는 19일까지 출석하라는 3차 소환 통보를 했습니다.…,2025.06.12 18:05,https://news.sbs.co.kr/news/endPage.do?news_id=N1008136141,SBS
290명 탑승 에어인디아 여객기 인도 서부서 이륙 직후 추락,https://img.sbs.co.kr/news/pc/thumb_v3.png,▲ 에어인디아 여객기 약 290명을 태운 에어인디아 여객기가 현지시간 오늘 인도 서부 아메다바드 공항 근처에서 추락했습니다.타임스오브…,2025.06.12 18:01,https://news.sbs.co.kr/news/endPage.do?news_id=N1008136127,SBS
"'비대면 진료' 법안 발의에 의료계 반발…""환자 안전 우려""",https://img.sbs.co.kr/news/pc/thumb_v3.png,▲ 김성근 대한의사협회 대변인이재명 대통령의 공약이기도 했던 '비대면 진료 제도화'와 관련한 의료법 개정안이 발의되자 …,2025.06.12 17:54,https://news.sbs.co.kr/news/endPage.do?news_id=N1008136121,SBS
