title,thumbnail,short_content,write_time,link,company
"""대법원장 사퇴"" 민주당 최고조 압박…속끓는 법원 '침묵'",https://img.sbs.co.kr/newimg/news/20250912/202110067_300.jpg,▲ 9월 12일 서울 서초구 대법원에서 열린 '2025 대한민국 법원의 날 기념식'에 참석한 조희대 대법원장.더불어민주…,2025.09.15 18:35,https://news.sbs.co.kr/news/endPage.do?news_id=N1008257951,SBS
"법원, 국힘 의원 3명 증인신문 청구 수용…29·30일 진술",https://img.sbs.co.kr/newimg/news/20250915/202110852_300.jpg,▲ 비상의원총회 참석하는 서범수 사무총장과 한지아 수석대변인내란특검팀이 국민의힘 의원 3명을 상대로 청구한 '공판 전 증인 신…,2025.09.15 18:28,https://news.sbs.co.kr/news/endPage.do?news_id=N1008257949,SBS
"""하마스, 이스라엘 공격 막으려 인질들 지상으로 옮겨""",https://img.sbs.co.kr/newimg/news/20250915/202110851_300.jpg,▲ 14일 대피 중인 가자지구 주민팔레스타인 무장 정파 하마스가 이스라엘군의 가자시티 공세를 막기 위해 인질들을 지상으로 옮겼다고 이…,2025.09.15 18:12,https://news.sbs.co.kr/news/endPage.do?news_id=N1008257938,SBS
"장동혁, 나경원 실형 구형 검찰에 ""무슨 미련으로 권력 시녀 노릇""",https://img.sbs.co.kr/newimg/news/20250915/202110712_300.jpg,▲ 국민의힘 장동혁 대표가 15일 부산 수영구 남천동 부산시당에서 열린 현장최고위원회에서 발언하고 있다.국민의힘은 검찰이 '국…,2025.09.15 18:09,https://news.sbs.co.kr/news/endPage.do?news_id=N1008257937,SBS
경기 북부 5개 시 연결 고속도로 추진…고양∼남양주 98분 단축,https://img.sbs.co.kr/news/pc/thumb_v3.png,▲ 경기북부 중심 고속화도로 보고받는 김동연 경기지사경기도가 고양에서 남양주까지 이동시간을 98분 단축해 경기 북부 대개발을 이끌 &…,2025.09.15 18:08,https://news.sbs.co.kr/news/endPage.do?news_id=N1008257929,SBS
"중국 ""엔비디아 반독점법 위반 추가 조사""…미국 압박?",https://img.sbs.co.kr/news/pc/thumb_v3.png,▲ 엔비디아중국 정부가 엔비디아의 반도체기업 인수 관련 반독점법 등 법규 위반에 대해 추가 조사를 하기로 했습니다.중국 국가시장감독관…,2025.09.15 18:04,https://news.sbs.co.kr/news/endPage.do?news_id=N1008257927,SBS
미·중 모두 스파이 취급…미 유학 중국 학생들 취업난,https://img.sbs.co.kr/news/pc/thumb_v3.png,▲ 미 하버드대학교 정문최근 수년간 미중 갈등이 고조되면서 미국에서 유학한 중국인 학생들이 미국은 물론 중국에서도 '스파이 취…,2025.09.15 18:02,https://news.sbs.co.kr/news/endPage.do?news_id=N1008257922,SBS
"두산, 베테랑 김재환·정수빈 말소…""재정비 차원""",https://img.sbs.co.kr/news/pc/thumb_v3.png,▲ 두산 김재환프로야구 두산 베어스의 베테랑 외야수 김재환과 정수빈이 1군 엔트리에서 빠졌습니다.최근 5연패를 기록한 9위 두산은 휴…,2025.09.15 18:01,https://news.sbs.co.kr/news/endPage.do?news_id=N1008257921,SBS
복사기 회사가 성수동이랑 도쿄 땅을 왜요? 거금 들여 부동산 사들인 이유 알아봄,https://img.sbs.co.kr/news/pc/thumb_v3.png,복사기 회사로 유명한 '신도리코'.이 기업이 성수동과 도쿄 시부야의 땅과 건물을 약 3천억 원으로 매입했다고 하는데요.왜 하필 성…,2025.09.15 18:00,https://news.sbs.co.kr/news/endPage.do?news_id=N1008257703,SBS
"특검, '양평고속도로 의혹' 국토부 서기관 구속영장 청구",https://img.sbs.co.kr/news/pc/thumb_v3.png,▲ 지난 5월 압수수색 중인 국토교통부 도로정책과 모습김건희 특검팀은 오늘 김건희 여사 일가 특혜 의혹 관련인 양평고속도로 노선 변경…,2025.09.15 17:58,https://news.sbs.co.kr/news/endPage.do?news_id=N1008257915,SBS
"'연일 최고치 기록' 코스피에…투자자 예탁금, 3년 8개월래 최고",https://img.sbs.co.kr/newimg/news/20250915/202110845_300.jpg,▲ 15일 서울 중구 하나은행 딜링룸 현황판에 코스피 지수 등이 표시되고 있다.코스피가 연일 사상 최고 기록을 세우며 다시 '…,2025.09.15 17:57,https://news.sbs.co.kr/news/endPage.do?news_id=N1008257912,SBS
"대통령실, 전력 당국에 ""추석 연휴 정전 없도록 철저 대비 당부""",https://img.sbs.co.kr/newimg/news/20250912/202110122_300.jpg,▲ 강훈식 대통령 비서실장강훈식 대통령 비서실장이 추석 연휴 기간 정전이 발생하지 않도록 철저한 대비를 해 달라고 전력 당국에 당부했…,2025.09.15 17:56,https://news.sbs.co.kr/news/endPage.do?news_id=N1008257895,SBS
"프로배구 OK저축은행, 컵대회서 KB손해보험에 완승",https://img.sbs.co.kr/newimg/news/20250915/202110842_300.jpg,▲ OK저축은행 선수단OK저축은행이 프로배구 컵대회에서 가장 먼저 2승을 거뒀습니다.OK저축은행은 오늘 전남 여수 진남체육관에서 열린…,2025.09.15 17:55,https://news.sbs.co.kr/news/endPage.do?news_id=N1008257894,SBS
"[바로이뉴스] ""유가족, 동료 억울함 없도록 독립기관에서 조사해"" '순직 해경' 동료 기자회견 본 대통령 반응",https://img.sbs.co.kr/newimg/news/20250915/202110847_300.jpg,이재명 대통령이 15일 갯벌에 고립된 70대 남성을 구조하고 순직한 해양경찰 고 이재석 경사 사건에 대한 내부 은폐 의혹이 제기되자 해경이 아닌…,2025.09.15 17:53,https://news.sbs.co.kr/news/endPage.do?news_id=N1008257891,SBS
[날씨] 내일 강한 소나기…시간당 30mm,https://img.sbs.co.kr/news/pc/thumb_v3.png,"오늘도 낮 동안 늦더위가 이어졌습니다.일부 남부와 제주에는 폭염주의보가 발효 중인 가운데 양산의 낮 기온이 32도를 웃돌았고, 한편 제주는 오늘…",2025.09.15 17:52,https://news.sbs.co.kr/news/endPage.do?news_id=N1008257689,SBS
한강버스 18일 운항 시작…마곡-잠실 127분,https://img.sbs.co.kr/news/pc/thumb_v3.png,서울의 새 친환경 수상교통수단인 '한강버스'가 3개월간 시민 체험 운항을 마치고 18일 오전 11시 정식 운항을 시작합니다.한강버…,2025.09.15 17:49,https://news.sbs.co.kr/news/endPage.do?news_id=N1008257686,SBS
"서울, 혼인 증가세 속 '황혼 이혼' 급증…1인 가구 40%",https://img.sbs.co.kr/news/pc/thumb_v3.png,"혼자 사는 사람들이 크게 늘면서 서울은 10가구 중에 4가구가 1인 가구로 나타났습니다. 또 이혼 건수는 줄었는데, 60세 이상의 황혼 이혼은 …",2025.09.15 17:48,https://news.sbs.co.kr/news/endPage.do?news_id=N1008257679,SBS
경남 연안 적조 '주춤'…어류 폐사 감소,https://img.sbs.co.kr/news/pc/thumb_v3.png,지난달 경남 연안에서 발생해 지금까지 124만 마리 넘는 양식어류 폐사 피해를 낸 적조가 이달 중순이 지나면서 다소 주춤하고 있는 것으로 나타났…,2025.09.15 17:44,https://news.sbs.co.kr/news/endPage.do?news_id=N1008257678,SBS
"""상생 노력은 없고 소송만""…SNT모티브 향한 냉담한 민심",https://img.sbs.co.kr/news/pc/thumb_v3.png,얼마 전 SNT모티브가 지역의 동종 업체를 상대로 제기한 기술 유출 소송과 관련해 검찰은 무혐의 처분을 내렸습니다. SNT모티브가 신생기업의 발…,2025.09.15 17:43,https://news.sbs.co.kr/news/endPage.do?news_id=N1008257677,SBS
"춘천, 'WT 본부' 건립 내년 국비 35억 확보",https://img.sbs.co.kr/news/pc/thumb_v3.png,"춘천시가 세계태권도연맹, WT 본부 건립과 관련해 내년도 정부 예산 35억 원을 확보했습니다.춘천시는 문화체육관광부로부터 WT 본부 건립 사업 …",2025.09.15 17:41,https://news.sbs.co.kr/news/endPage.do?news_id=N1008257676,SBS
크루즈로 일본 관광길…체험단 모집까지 '인기',https://img.sbs.co.kr/newimg/news/20250915/202110837_300.jpg,속초항을 중심으로 하는 크루즈 관광이 주목받고 있습니다. 강원자치도는 올해 처음으로 도민 크루즈 체험단을 운영하는 등 크루즈 관광 활성화에 나섰습니다.최경식 기자가 취재했습니다.,2025.09.15 17:40,https://news.sbs.co.kr/news/endPage.do?news_id=N1008257675,SBS
"안전 장비도 없이 ""쌩""…도로 점령한 학생들에 '아찔'",https://img.sbs.co.kr/newimg/news/20250915/202110795_300.jpg,<오! 클릭> 마지막 검색어는 '도로에서 위험천만 자전거 폭주'입니다.최근 한 온라인 커뮤니티에 올라온 영상입니다.학생으로 추정되…,2025.09.15 17:39,https://news.sbs.co.kr/news/endPage.do?news_id=N1008257671,SBS
"내란특검 ""'교회 압수수색' 한 적 없어…허위 비방, 악의적·비열""",https://img.sbs.co.kr/newimg/news/20250701/202087253_300.jpg,"▲ 박지영 특검보내란특검팀은 오늘 ""특검팀은 교회를 압수수색한 적이 없다""며 관련 언론 사설을 ""악의적이고 비열…",2025.09.15 17:39,https://news.sbs.co.kr/news/endPage.do?news_id=N1008257900,SBS
"특검 '3번 불출석' 한학자 총재 체포 시사…한학자 ""출석 거부 아냐""",https://img.sbs.co.kr/newimg/news/20250901/202106182_300.jpg,▲ 통일교 한학자 총재김건희특검팀이 오늘까지 세 차례에 걸쳐 출석 요구에 응하지 않은 한학자 통일교 총재에 대해 체포영장 청구를 포함…,2025.09.15 17:38,https://news.sbs.co.kr/news/endPage.do?news_id=N1008257898,SBS
위반 거듭하다 '억대 벌금'…누적된 액수에 '경악',https://img.sbs.co.kr/news/pc/thumb_v3.png,경찰이 순찰 중 벌금이 억대로 쌓인 트럭을 우연히 발견해 운전자를 그 자리에서 붙잡았습니다.<오! 클릭> 세 번째 검색어는 '쌓인 벌금만…,2025.09.15 17:38,https://news.sbs.co.kr/news/endPage.do?news_id=N1008257670,SBS
운행 중 갑자기 담배 타임?…'안에 승객도 있는데',https://img.sbs.co.kr/news/pc/thumb_v3.png,"<오! 클릭> 두 번째 검색어는 '승객보다 흡연이 중요?'입니다.최근 제주도청 홈페이지 민원 게시판에는 ""버스 기사 운행 …",2025.09.15 17:33,https://news.sbs.co.kr/news/endPage.do?news_id=N1008257669,SBS
"[글로벌D리포트] ""살인자 네타냐후""…3대 자전거대회 막은 시위",https://img.sbs.co.kr/news/pc/thumb_v3.png,스페인 수도 마드리드입니다.친팔레스타인 시위대가 깃발을 들고 이스라엘의 가자지구 공격을 규탄하고 있습니다 막아서는 경찰에게 물건을 던지며 격렬하…,2025.09.15 17:32,https://news.sbs.co.kr/news/endPage.do?news_id=N1008257780,SBS
"[자막뉴스] '자칭 제보자' 돌연 ""한국인 비자는 몰라""…""기술 주면 웰컴"" 트럼프도 태세 전환",https://img.sbs.co.kr/news/pc/thumb_v3.png,"자신이 처음으로 현대차 공장 문제를 이민세관단속국에 신고했다고 수차례 주장한 미국 공화당원 토리 브래넘.내년에 치러질 중간 선거에서 조지아주 12선거구 하원 의원 후보로 출마한 인물입니다.그간 미국 현지는 물론 한국 언론과의 인터뷰에서도, 단속 당국에 자신이 직접 현대차 공장을 신고했다고 밝혔습니다.브래넘은 최근 SBS 취재진에게 한국인들의 비자와 관련해 아무것도 신고하지 않았다며, 트럼프 정부 관료에게 문의하라고 전했습니다.[ 토리 브래넘 : 한국인들의 비자에 대해선 알지 못했습니다.",2025.09.15 17:32,https://news.sbs.co.kr/news/endPage.do?news_id=N1008257764,SBS
"살아있는 박물관에 ""빵빵…역시 흥과 해학의 민족""",https://img.sbs.co.kr/news/pc/thumb_v3.png,SNS를 통해 오늘 하루 관심사와 누리꾼들의 반응을 알아보는 <오! 클릭> 시간입니다.최근 국립중앙박물관이 개최한 '2025 국중박 분장…,2025.09.15 17:31,https://news.sbs.co.kr/news/endPage.do?news_id=N1008257668,SBS
"이 대통령 ""투자 결정 잘못하면 배임죄로 감옥…어떻게 사업하나""",https://img.sbs.co.kr/news/pc/thumb_v3.png,"▲ 이재명 대통령이 15일 서울 성북구 한국과학기술연구원에서 열린 제1차 핵심규제 합리화 전략 회의에서 발언하고 있다.이재명 대통령은 ""대한민국에는 불필요하게 처벌 조항이 너무 많고 정작 그 효과도 별로 없다""며 ""이번에 대대적으로 바꿔볼 생각""이라고 말했습니다.이 대통령은 서울 성북구 한국과학기술연구원에서 열린 '제1차 핵심 규제 합리화 전략회의'에 참석해 ""대한민국은 지나치게 처벌 중심적이며 불합리하고 쓸데없는 규제도 꽤 있다""면서 이같이 밝혔습니다.이 대통령은 회의 참석자들에게 ""얼마 전 미국에서 '한국 사람들 비자 심사나 출입국 심사할 때 처벌을 받은 전과가 있는지 자료를 내라'고 요구했다더라.",2025.09.15 17:30,https://news.sbs.co.kr/news/endPage.do?news_id=N1008257888,SBS
"대통령실, '조희대 사퇴 요구 원칙적 공감' 아니라면? [스프]",https://img.sbs.co.kr/newimg/news/20250915/202110825_300.jpg,"여당에서 제기되는 조희대 대법원장 사퇴 요구에 대해, 대통령실이 원칙적으로 공감을 표했다는 언론 보도를 두고 대통령실이 정정을 요구하는 일이 있었습니다.",2025.09.15 17:30,https://news.sbs.co.kr/news/endPage.do?news_id=N1008256939,SBS
"외교부 ""구금 인권 침해, 기업과 협조해 사실 관계 확인""",https://img.sbs.co.kr/newimg/news/20250912/202110129_300.jpg,▲ 미국 이민당국에 의해 조지아주에 구금됐던 한국인 근로자들이 12일 영종도 인천국제공항 제2여객터미널 입국장을 나서고 있다.외교부는…,2025.09.15 17:27,https://news.sbs.co.kr/news/endPage.do?news_id=N1008257870,SBS
"해군 입대 이재용 삼성 회장 장남 이지호 씨, 함정 통역 장교 복무",https://img.sbs.co.kr/newimg/news/20250915/202110732_300.jpg,▲ 이재용 삼성전자 회장의 장남 이지호 씨가 탑승한 것으로 추정되는 미니밴이 15일 오후 경남 창원시 진해구 진해기지사령부 제3 정문…,2025.09.15 17:25,https://news.sbs.co.kr/news/endPage.do?news_id=N1008257869,SBS
[오뉴스 출연] 대법원장 사퇴 논란 (김수민 시사평론가),https://img.sbs.co.kr/newimg/news/20250915/202110821_300.jpg,오늘의 이슈를 김수민 시사평론가와 함께 오뉴스에서 자세하게 알아봅니다.※,2025.09.15 17:19,https://news.sbs.co.kr/news/endPage.do?news_id=N1008257667,SBS
"성비위 사건 수습 나선 조국…""통렬히 반성할 것""",https://img.sbs.co.kr/news/pc/thumb_v3.png,조국 조국혁신당 비대위원장이 오늘 첫 비상대책회의를 주재하고 당내 성비위 사건 수습에 나섰습니다. 조 위원장은 책임지고 피해자의 상처를 치유하고 당내 제도를 개선하겠다고 밝혔습니다.민경호 기자입니다.,2025.09.15 17:19,https://news.sbs.co.kr/news/endPage.do?news_id=N1008257664,SBS
"포항서 가스 누출에 보름째 도로 통제…""19일께 복구 완료""",https://img.sbs.co.kr/news/pc/thumb_v3.png,▲ 15일 경북 포항시 남구 연일읍 유강리 도로에서 작업자들이 도로 통행을 일부 차단한 채 가스 누출 배관을 복구하고 있다.경북 포항…,2025.09.15 17:17,https://news.sbs.co.kr/news/endPage.do?news_id=N1008257851,SBS
"미국 재무장관 ""중국과 '틱톡 매각' 합의에 근접""",https://img.sbs.co.kr/news/pc/thumb_v3.png,▲ 스콧 베선트 미국 재무장관미국과 중국이 중국계 동영상 플랫폼 틱톡의 미국 내 사업권 매각 관련 합의에 근접했다고 스콧 베선트 미국…,2025.09.15 17:15,https://news.sbs.co.kr/news/endPage.do?news_id=N1008257850,SBS
"법률구조공단, 전 직원 연봉 감액 합의…노사·노노 화합 선언",https://img.sbs.co.kr/news/pc/thumb_v3.png,"▲ 대한법률구조공단의 일반직과 변호사 노조 위원장, 이사장이 15일 '노사·노노 화합 선언식'에서 연봉 감액에 합의한 …",2025.09.15 17:15,https://news.sbs.co.kr/news/endPage.do?news_id=N1008257846,SBS
경남 연안 빈산소수괴로 가리비·굴·홍합 폐사 피해 45억 추산,https://img.sbs.co.kr/news/pc/thumb_v3.png,▲ 고성 가리비 양식경남도는 올해 산소부족 물 덩어리로 폐사 피해를 본 양식장 면적이 220㏊에 이른다고 밝혔습니다.고성…,2025.09.15 17:15,https://news.sbs.co.kr/news/endPage.do?news_id=N1008257853,SBS
연 3명 이상 사망사고에 영업이익 5%…'산재 과징금 강화',https://img.sbs.co.kr/news/pc/thumb_v3.png,앞으로 연간 3명 이상 산재 사망사고가 발생한 법인에 대해서는 영업이익의 5% 이내의 과징금이 부과됩니다.영업손실이 난 법인은 최소 30억 원의…,2025.09.15 17:14,https://news.sbs.co.kr/news/endPage.do?news_id=N1008257763,SBS
"서울서 한일 재무차관회의 개최…""긴밀 협력 지속""",https://img.sbs.co.kr/newimg/news/20250915/202110829_300.jpg,▲ 최지영 기획재정부 국제경제관리관이 8일 오전 서울 여의도 국회에서 열린 외환시장 점검 간담회에 참석해 발언하고 있다.기획재정부 최…,2025.09.15 17:13,https://news.sbs.co.kr/news/endPage.do?news_id=N1008257854,SBS
"[현장영상] ""대가로 회사 지분을"" 냉동 창고에 갇힌 여성 극적으로 구조",https://img.sbs.co.kr/newimg/news/20250915/202110738_300.jpg,냉동 창고에 갇힌 한 여성이 근처를 지나던 배달 기사의 도움으로 구조된 사연이 전해졌습니다. 12일 홍콩 사우스차이나모닝포스트에 따르면 중국에서 물류 회사를 운영하는 천 모 씨는 지난달 31일 저녁 혼자 냉동 창고에서 제품 분류 작업을 하던 중 창고 문이 잠겨 내부에 갇히고 말았는데요.,2025.09.15 17:09,https://news.sbs.co.kr/news/endPage.do?news_id=N1008257440,SBS
이재명 정부 첫 대정부질문…'대법원장 사퇴' 놓고 격돌,https://img.sbs.co.kr/newimg/news/20250915/202110815_300.jpg,"이재명 정부 출범 이후 첫 국회 대정부질문이 시작됐습니다. 나흘간 이어질 예정인데, 첫날부터 특검 연장과 대법원장 사퇴 등을 놓고 여야가 날을 세웠습니다.손형안 기자입니다.",2025.09.15 17:09,https://news.sbs.co.kr/news/endPage.do?news_id=N1008257661,SBS
"고 이재석 경사 동료들 ""함구 지시 있었다""…인재로 드러나나?",https://img.sbs.co.kr/newimg/news/20250915/202110812_300.jpg,"'SBS ' ■ ■ ■ 백기종 전 수서경찰서 강력팀장● 홀로 구조나선 해경 순직 백기종 /공인탐정연구원장""이 경사, 고립자에게 구명조끼 벗어주고 심정지 상태로 발견""""파출소 팀장, 즉시 보고하고 추가 인원 투입 했어야‥늦은 보고로 인재 발생""""지휘관·팀장 등 과실 밝혀지면 직무유기·업무상과실치사 혐의 적용 가능"" ▷ 편상욱 / 앵커 : 갯벌에서 고립된 노인을 홀로 구조하다 순직한 고 이재석 경사의 영결식이 오늘 진행됐습니다.",2025.09.15 17:04,https://news.sbs.co.kr/news/endPage.do?news_id=N1008257405,SBS
"프로야구선수협회, 김앤장과 협약…""SNS서 가족 협박 강경 대응""",https://img.sbs.co.kr/news/pc/thumb_v3.png,▲ 양현종 한국프로야구선수협회장이 15일 서울 종로구 김앤장 법률사무소에서 열린 업무협약식에서 포즈를 취하고 있다.한국프로야구선수협회…,2025.09.15 17:03,https://news.sbs.co.kr/news/endPage.do?news_id=N1008257835,SBS
"차정인 국교위원장 ""대입 경쟁 체제 개혁 책무 피하지 않을 것""",https://img.sbs.co.kr/news/pc/thumb_v3.png,▲ 차정인 신임 국가교육위원장이 15일 서울 종로구 정부서울청사에서 열린 취임식에서 취임사를 하고 있다.차정인 신임 국가교육위원회 위…,2025.09.15 17:01,https://news.sbs.co.kr/news/endPage.do?news_id=N1008257822,SBS
경북 의성 북서쪽서 규모 2.3·2.0 지진 연이어 발생,https://img.sbs.co.kr/news/pc/thumb_v3.png,▲ 15일 경북 의성 북서쪽 지진이 발생한 위치오늘 오후 경북 의성군에서 규모 2.3 지진과 규모 2.0 지진이 연이어 발생했습니다.…,2025.09.15 16:55,https://news.sbs.co.kr/news/endPage.do?news_id=N1008257821,SBS
식당 주방서 조리? 데우기만?…조리 방법 공개하라는 중국 소비자들,https://img.sbs.co.kr/news/pc/thumb_v3.png,"▲ 중국의 위즈차이 생산 작업장식당 측이 손님에게 제공한 음식이 주방에서 직접 조리한 것인지, 이미 조리된 제품을 데우기만 한 것인지…",2025.09.15 16:53,https://news.sbs.co.kr/news/endPage.do?news_id=N1008257820,SBS
"[여담야담] '조국 비대위' 가동…""책임지고 피해자 상처 치유""",https://img.sbs.co.kr/news/pc/thumb_v3.png,"'SBS ' ■ ■ ■ 박수현 더불어민주당 수석대변인, 김근식 전 국민의힘 비전전략실장● '조국 비대위' 첫 회의 / ""성추행 없었다"" 파문박수현 / 더불어민주당 수석대변인""조국, 비대위원장 자리에 너무 빨리 복귀한 듯""김근식 / 전 국민의힘 비전전략실장""김보협, 새 비대위 나온 날 반박‥조국에 대한 기대감 아닌지 의문""▷ 편상욱 / 앵커 : 계속해서 조국혁신당 소식 잠깐 짚어보겠습니다.",2025.09.15 16:52,https://news.sbs.co.kr/news/endPage.do?news_id=N1008257404,SBS
"[바로이뉴스] '패스트트랙 사건' 6년 만에…검찰, 나경원 징역 2년 구형",https://img.sbs.co.kr/news/pc/thumb_v3.png,"지난 2019년 발생한 '국회 패스트트랙 충돌' 사건으로 재판에 넘겨진 국민의힘의 전신, 자유한국당 지도부에 검찰이 실형을 구형했…",2025.09.15 16:52,https://news.sbs.co.kr/news/endPage.do?news_id=N1008257814,SBS
"[여담야담] 조희대 사퇴 압박하는 여당…""많은 국민이 요구""·""파기환송 앙갚음""",https://img.sbs.co.kr/newimg/news/20250915/202110807_300.jpg,"'SBS ' ■ ■ ■ 박수현 더불어민주당 수석대변인, 김근식 전 국민의힘 비전전략실장● ""조희대 사퇴"" 압박박수현 / 더불어민주당 수석대변인""민주, '내란특별재판부' 주장한 적 없어...내란 전담 내부 조직 신설하겠다는 것""김근식 / 전 국민의힘 비전전략실장""민주, 조희대 사퇴 요구는 '유죄 취지의 파기환송'에 대한 앙갚음""▷ 편상욱 / 앵커 : 계속해서 국내 정치 상황 짚어보겠습니다.",2025.09.15 16:52,https://news.sbs.co.kr/news/endPage.do?news_id=N1008257403,SBS
"[여담야담] 트럼프 ""외국기업 직원 환영""…한미 관세 후속협상은 난항",https://img.sbs.co.kr/newimg/news/20250915/202110804_300.jpg,"'SBS ' ■ ■ ■ 박수현 더불어민주당 수석대변인, 김근식 전 국민의힘 비전전략실장● ""외국 직원 환영"" 박수현 / 더불어민주당 수석대변인""트럼프 메시지는 강온 전략의 일환인 듯""김근식 / 전 국민의힘 비전전략실장""이 대통령, 지나친 낙관에 빠진 듯...명확한 입장 정한 뒤 트럼프에 통보해야""▷ 편상욱 / 앵커 : 국회의 대정부 질문 상황 생중계로 전해드렸고요.",2025.09.15 16:52,https://news.sbs.co.kr/news/endPage.do?news_id=N1008257402,SBS
"환경부·환경단체, 낙동강 조류 독소 공동 조사…진실 공방 끝낼까",https://img.sbs.co.kr/newimg/news/20250915/202110801_300.jpg,▲ 지난 3일 낙동강 유역에 있는 녹조 모습낙동강 녹조에서 대기 중으로 조류 독소가 확산했는지를 두고 공방을 벌여온 환경부와 환경단체…,2025.09.15 16:51,https://news.sbs.co.kr/news/endPage.do?news_id=N1008257807,SBS
"트럼프, 워싱턴 치안 거론하며 ""국가비상사태 선포할 수도""",https://img.sbs.co.kr/newimg/news/20250913/202110379_300.jpg,▲ 트럼프 미국 대통령트럼프 미 대통령이 수도 워싱턴DC의 치안 유지를 위해 국가비상사태를 선포할 수도 있다고 경고했습니다.트럼프 대…,2025.09.15 16:47,https://news.sbs.co.kr/news/endPage.do?news_id=N1008257806,SBS
"[자막뉴스] 삼성 이재용 회장 장남 지호 씨, 진해 해군 부대 장교 훈련 입대",https://img.sbs.co.kr/news/pc/thumb_v3.png,이재용 삼성전자 회장의 장남 이지호 씨가 미국 시민권을 버리고 오늘 국방의 의무를 다하기 위해 해군 장교로 입대했습니다. 이지호씨는 오늘 오후 1시쯤 차를 타고 경남 창원시 진해구 진해기지사령부 제3 정문 위병소를 탑승한 채로 통과했습니다.,2025.09.15 16:46,https://news.sbs.co.kr/news/endPage.do?news_id=N1008257499,SBS
[자막뉴스] 내 이름 검색 '딱 한 번'…숨어있던 '18조 원' 찾는 법,https://img.sbs.co.kr/news/pc/thumb_v3.png,금융권에서 잊어버리고 있었던 금융자산을 찾아주는 캠페인도 한다면서요? 국민들이 오랫동안 잊어버리고 찾지 않은 숨은 금융자산이 18조 원에 육박하…,2025.09.15 16:44,https://news.sbs.co.kr/news/endPage.do?news_id=N1008257606,SBS
"내란특검, '교회 압수수색' 언론 사설에 ""악의적이고 비열한 작태""",https://img.sbs.co.kr/news/pc/thumb_v3.png,▲ 박지영 내란특검보가 지난 19일 오후 특검 사무실이 마련된 서울 서초구 고등검찰청 기자실에서 브리핑을 하고 있다. 12·3 비상계…,2025.09.15 16:42,https://news.sbs.co.kr/news/endPage.do?news_id=N1008257802,SBS
