title,thumbnail,short_content,write_time,link,company
미군 오산기지 들어가 전투기 불법 촬영한 대만인 2명 구속기소,https://img.sbs.co.kr/news/pc/thumb_v3.png,▲ 수원지검 평택지청주한미군 공군기지 내에서 열린 에어쇼 행사장에 들어가 전투기를 무단 촬영한 대만인들이 재판에 넘겨졌습니다.수원지검…,2025.06.12 17:53,https://news.sbs.co.kr/news/endPage.do?news_id=N1008136122,SBS
"직통 철도 개통한 러·북 ""항공편 확대도 논의 중""",https://img.sbs.co.kr/news/pc/thumb_v3.png,▲ 북한 고려항공러시아와 북한이 직통 철도 재개통에 이어 항공 교통망 확대도 논의하고 있다고 마리야 자하로바 러시아 외무부 대변인이 …,2025.06.12 17:51,https://news.sbs.co.kr/news/endPage.do?news_id=N1008136113,SBS
[날씨] 중부 무더위…새벽 전남·경남 지역 비,https://img.sbs.co.kr/newimg/news/20250612/202080949_300.jpg,"오늘 중부 지방은 어제보다 무더웠는데요.내일 오늘보다는 덜하겠지만, 수도권을 중심으로 30도 안팎의 낮 더위가 이어지겠습니다.현재 제주는 정체 …",2025.06.12 17:50,https://news.sbs.co.kr/news/endPage.do?news_id=N1008135896,SBS
에어컨 사용 늘자…'전기 접촉 불량' 화재 증가,https://img.sbs.co.kr/newimg/news/20250612/202080958_300.jpg,"여름철 폭염에 에어컨과 선풍기 사용이 많아지면서 화재도 늘었습니다.행정안전부에 따르면 에어컨 화재가 지난 2020년 221건이었으나, 2024년…",2025.06.12 17:49,https://news.sbs.co.kr/news/endPage.do?news_id=N1008135890,SBS
전남 수산물 산지 거점유통센터 공모에 목포 선정,https://img.sbs.co.kr/newimg/news/20250612/202080953_300.jpg,해양수산부의 전남권 수산물산지거점유통센터 공모 사업에 목포시가 선정됐습니다.전남권 수산물산지거점유통센터는 수산물을 매입한 후 전처리와 가공·유통…,2025.06.12 17:48,https://news.sbs.co.kr/news/endPage.do?news_id=N1008135889,SBS
"""플라스틱 매립""…친환경 외면한 공기업",https://img.sbs.co.kr/newimg/news/20250612/202080947_300.jpg,"공기업인 한국동서발전이 짓고 있는 새 LNG 발전소의 기반을 다지기 위해 막대한 양의 플라스틱을 매립하기로 해 논란이 일고 있습니다. 생분해되는 친환경 소재로 대체할 수도 있었지만, 비싸다는 이유로 외면했습니다.박성호 기자의 보도입니다.",2025.06.12 17:47,https://news.sbs.co.kr/news/endPage.do?news_id=N1008135878,SBS
"[영상] 병원에 온 아기, 알고 보니 정교하게 만들어진 인형? 양육권 분쟁까지",https://img.sbs.co.kr/news/pc/thumb_v3.png,브라질에서 실제 아기와 흡사하게 제작한 인형인 ‘리본돌’이 화제와 동시에 논란이 되고 있습니다. 실제 아기처럼 정교하게 만…,2025.06.12 17:47,https://news.sbs.co.kr/news/endPage.do?news_id=N1008135444,SBS
베트남 하노이 '경북학당' 개소…현지 학생 교육,https://img.sbs.co.kr/news/pc/thumb_v3.png,베트남 하노이에 최근 경북학당이 문을 열었습니다 .하노이 경북학당은 가톨릭상지대와 하노이 국립외국어대가 현지 학생을 대상으로 한국어와 경북학 교…,2025.06.12 17:46,https://news.sbs.co.kr/news/endPage.do?news_id=N1008135877,SBS
"미 구호재단 ""가자지구서 하마스 공격에 직원 최소 5명 사망""",https://img.sbs.co.kr/news/pc/thumb_v3.png,▲ 11일 팔레스타인 사람들이 가자지구 남부 라파에서 가자인도주의재단이 배달한 식량과 인도주의 지원 패키지가 담긴 가방을 들고 있다.…,2025.06.12 17:46,https://news.sbs.co.kr/news/endPage.do?news_id=N1008136102,SBS
AI 디지털교과서 퇴출 기로…현장 혼란 예상,https://img.sbs.co.kr/news/pc/thumb_v3.png,"대구교육청이 역점 사업으로 추진해 온 AI 디지털교과서가 퇴출 기로에 놓였습니다. 이재명 대통령과 여당이 AI 디지털교과서에 줄곧 부정적인 입장을 보이고 있는 데다, 최근 감사원도 감사에 착수한 상태인데요.",2025.06.12 17:45,https://news.sbs.co.kr/news/endPage.do?news_id=N1008135876,SBS
판자 내던지며 필사의 도주…역주행해 6번 '쾅쾅',https://img.sbs.co.kr/news/pc/thumb_v3.png,"<오! 클릭> 마지막 검색어, '판자 내던지며 필사의 도주'입니다.미국 오하이오에서 있었던 일인데요.흰색 픽업트럭 1대가 뒤따라오…",2025.06.12 17:44,https://news.sbs.co.kr/news/endPage.do?news_id=N1008135874,SBS
"[자막뉴스] 대구 살인 사건 용의자 사흘째 도주 중…""산에 가지 마세요"" 세종시 '발칵'",https://img.sbs.co.kr/news/pc/thumb_v3.png,지난 10일 대구의 한 아파트에서 스토킹하던 여성을 살해한 혐의를 받는 용의자가 범행 직후 대구를 벗어나 세종시의 한 야산으로 숨어든 뒤 사흘째…,2025.06.12 17:41,https://news.sbs.co.kr/news/endPage.do?news_id=N1008136038,SBS
"""'착불' 단어가 어렵나요?""…중고생들 어휘력 논란",https://img.sbs.co.kr/newimg/news/20250612/202080927_300.jpg,요즘 젊은 세대 사이에서 어휘력 논란이 잇따르고 있습니다.이번엔 '착불'이라는 단어가 어휘력 테스트로 올라왔는데요.<오! 클릭> …,2025.06.12 17:39,https://news.sbs.co.kr/news/endPage.do?news_id=N1008135873,SBS
퇴근길 도로 한복판에 '휙'…얼음컵 투척 '공분',https://img.sbs.co.kr/newimg/news/20250612/202080925_300.jpg,"<오! 클릭> 두 번째 검색어, '도로 한복판에 얼음컵 투척'입니다.최근 한 온라인 커뮤니티에 올라온 영상입니다.지난달 말 퇴근 …",2025.06.12 17:36,https://news.sbs.co.kr/news/endPage.do?news_id=N1008135872,SBS
이스라엘 의회 해산안 부결…네타냐후 연정 한숨 돌려,https://img.sbs.co.kr/newimg/news/20250612/202080937_300.jpg,▲ 이스라엘 의회이스라엘 의회에 해당하는 크네세트 해산안이 부결됐다고 이스라엘 현지 매체들이 오늘 보도했습니다.연립정부에 참여한 보수…,2025.06.12 17:34,https://news.sbs.co.kr/news/endPage.do?news_id=N1008136092,SBS
"""5060 남성 출입 불가""…술집 '노아저씨존' 논란",https://img.sbs.co.kr/newimg/news/20250612/202080924_300.jpg,SNS를 통해 오늘 하루 관심사와 누리꾼들의 반응을 알아보는 <오! 클릭> 시간입니다.식당이나 카페에 노키즈존 들어보셨죠.아이들의 출입을 금지한…,2025.06.12 17:31,https://news.sbs.co.kr/news/endPage.do?news_id=N1008135871,SBS
알래스카 KF-16 사고도 조종사 실수…활주로 아닌 유도로 진입,https://img.sbs.co.kr/news/pc/thumb_v3.png,"미국 알래스카에서 열린 다국적 공중 연합훈련 중 발생한 공군 KF-16 전투기 사고도 조종사 실수에서 비롯된 것으로 조사됐습니다.활주로가 아닌,…",2025.06.12 17:31,https://news.sbs.co.kr/news/endPage.do?news_id=N1008136083,SBS
[글로벌D리포트] LA 진정됐지만 곳곳 확산…이민자 급습·체포 계속,https://img.sbs.co.kr/news/pc/thumb_v3.png,"방패를 든 대원을 발로 차고, 달려들어 넘어뜨립니다.방패를 밀치고 잡아당기며 대열을 무너뜨리려 합니다.미국 LA 인근에서 대기 중인 캘리포니아 …",2025.06.12 17:28,https://news.sbs.co.kr/news/endPage.do?news_id=N1008135853,SBS
전국 하수처리장서 5년 연속 필로폰 검출,https://img.sbs.co.kr/news/pc/thumb_v3.png,식약처가 전국 하수처리장을 조사해 봤더니 5년 연속 필로폰 성분이 검출됐습니다. 특히 인천이나 경기 시화 등 외국인 밀집 지역에서 많이 검출됐습니다.최고운 기자입니다.,2025.06.12 17:27,https://news.sbs.co.kr/news/endPage.do?news_id=N1008135870,SBS
"중국 ""희토류 품목 일정량 수출 허가 이미 승인…한층 강화할 것""",https://img.sbs.co.kr/news/pc/thumb_v3.png,▲ 허야둥 중국 상무부 대변인중국이 법에 따라 일정량의 희토류 관련 품목에 대한 수출 허가를 이미 승인했다고 오늘 밝혔습니다.중국 상…,2025.06.12 17:25,https://news.sbs.co.kr/news/endPage.do?news_id=N1008136077,SBS
[오뉴스 출연] '코스피 랠리' (박연미 경제평론가),https://img.sbs.co.kr/news/pc/thumb_v3.png,오늘의 이슈를 박연미 경제평론가와 함께 오뉴스에서 자세하게 알아봅니다.※,2025.06.12 17:25,https://news.sbs.co.kr/news/endPage.do?news_id=N1008135868,SBS
"숙박·음식점 대출 90조 돌파…""빚으로 버텨요""",https://img.sbs.co.kr/news/pc/thumb_v3.png,대표적인 내수 업종인 숙박업과 음식점의 금융권 대출액이 90조 원을 넘어섰습니다. 내수경기 침체가 길어지면서 소상공인의 위기가 깊어지고 있습니다…,2025.06.12 17:24,https://news.sbs.co.kr/news/endPage.do?news_id=N1008135866,SBS
"이 대통령, 내일 재계 총수 면담 예정…연일 경제 행보",https://img.sbs.co.kr/newimg/news/20250612/202080911_300.jpg,"▲ 이재명 대통령 대선 후보 시절 경제5단체장과의 기념사진이재명 대통령이 내일 오전, 용산 대통령실에서 취임 후 처음으로 재계 총수들…",2025.06.12 17:22,https://news.sbs.co.kr/news/endPage.do?news_id=N1008136071,SBS
서부지법 난동 때 벽돌 던지고 유리창 깬 30대 징역 2년 6개월,https://img.sbs.co.kr/newimg/news/20250207/202037601_300.jpg,▲ 윤 전 대통령 지지자들이 서울서부지방법원 내부로 난입해 불법폭력사태를 일으킨 지난 1월 19일 오후 서부지법에서 청사 관계자들이 …,2025.06.12 17:21,https://news.sbs.co.kr/news/endPage.do?news_id=N1008136069,SBS
'구속영장 몰래 복사' 검찰수사관 구속,https://img.sbs.co.kr/newimg/news/20250612/202080907_300.jpg,"검찰이나 경찰에서 수사 정보 유출 사건이 잇따르고 있는데요. 대구지검에서 검찰 수사관이 수시 기밀을 외부로 빼돌리려다 적발돼 구속됐습니다. 해당 수사관은 최근 대구지검이 뇌물수수 혐의로 현직 경찰관 2명을 구속했는데, 이 사건에 대한 구속영장을 복사해서 유출하려다 적발됐습니다.TBC 남효주 기자입니다.",2025.06.12 17:14,https://news.sbs.co.kr/news/endPage.do?news_id=N1008135865,SBS
"트럼프, '민중혁명' 레미제라블 관람…객석선 야유·환호 교차",https://img.sbs.co.kr/newimg/news/20250612/202080909_300.jpg,▲ 현지 시간 11일 워싱턴DC 케네디센터 찾은 트럼프 대통령 부부트럼프 미 대통령이 현지 시간 11일 저녁 뮤지컬 '레미제라…,2025.06.12 17:13,https://news.sbs.co.kr/news/endPage.do?news_id=N1008136056,SBS
"한국배구연맹 이사회, 24일 OK저축은행 부산 연고 이전 심의",https://img.sbs.co.kr/news/pc/thumb_v3.png,▲ 기뻐하는 OK저축은행 선수들한국배구연맹 실무위원회가 남자부 OK저축은행의 '부산 연고지 이전'을 이사회 안건으로 상…,2025.06.12 17:13,https://news.sbs.co.kr/news/endPage.do?news_id=N1008136051,SBS
"""중국 유학생 허용""…트럼프 ""관세 유예 필요 없어""",https://img.sbs.co.kr/news/pc/thumb_v3.png,미중 양국의 2차 무역 협상에 따라 중국은 미국에 희토류 공급을 재개하고 미국은 중국인 유학생을 허용하기로 합의했다고 트럼프 대통령이 밝혔습니다.,2025.06.12 17:13,https://news.sbs.co.kr/news/endPage.do?news_id=N1008135864,SBS
"권성동 ""윤 비상계엄, 아직도 이해할 수 없어""",https://img.sbs.co.kr/news/pc/thumb_v3.png,"권성동 국민의힘 원내대표가 6개월 만에 원내대표 자리에서 물러났습니다. 권 원내대표는 퇴임 기자회견에서 ""윤석열 전 대통령의 비상계엄 선표를 아직도 이해할 수 없다""며 다만, ""윤 전 대통령은 떠나더라도 당은 살아남아야 한다는 생각에 탄핵소추안 통과를 최대한 늦춰보려고 했다""고 말했습니다.이경원 기자입니다.",2025.06.12 17:11,https://news.sbs.co.kr/news/endPage.do?news_id=N1008135858,SBS
"장애인체육회, 중국·일본 패럴림픽위원회와 MOU 체결",https://img.sbs.co.kr/news/pc/thumb_v3.png,"▲ 정진완 대한장애인체육회장이 12일 중국·일본 패럴림픽위원회와 MOU를 체결하고 있다.대한장애인체육회는 오늘 중국 패럴림픽위원회, …",2025.06.12 17:11,https://news.sbs.co.kr/news/endPage.do?news_id=N1008136050,SBS
"'드론 기습' 탓?…러, '대당 7천억 원' 전투기 극동으로 이동",https://img.sbs.co.kr/news/pc/thumb_v3.png,▲ 러시아의 전략폭격기 투폴레프-160우크라이나의 드론 급습에 일격을 당한 러시아가 고가의 전투기들을 극동으로 옮긴 것으로 나타났다고…,2025.06.12 17:10,https://news.sbs.co.kr/news/endPage.do?news_id=N1008136044,SBS
"민주·혁신당, '3대 특검' 후보자 추천",https://img.sbs.co.kr/news/pc/thumb_v3.png,"더불어민주당과 조국혁신당이 3대 특검 후보자를 각각 1명씩, 모두 6명을 추천했습니다. 이재명 대통령은 앞으로 사흘 안에 각 특검 별로 1명을 …",2025.06.12 17:10,https://news.sbs.co.kr/news/endPage.do?news_id=N1008135857,SBS
"""먹었는데 괜찮아서""…유통기한 지난 젤리 초등생에 준 40대 입건",https://img.sbs.co.kr/newimg/news/20250612/202080707_300.jpg,인천 한 초등학교에서 유통기한이 지난 젤리를 학생들에게 나눠준 40대 여성이 경찰에 입건됐습니다.인천 부평경찰서는 과실치상 혐의로 40대 여성 …,2025.06.12 17:04,https://news.sbs.co.kr/news/endPage.do?news_id=N1008136035,SBS
안양 석수역 인근 상행 전동열차서 스파크…승객들 하차해 이동,https://img.sbs.co.kr/newimg/news/20250612/202080893_300.jpg,오늘 오후 3시쯤 경기 안양시 지하철 1호선 석수역 인근을 지나던 한 상행선 전동열차의 후미에서 스파크가 발생했다는 119 신고가 접수됐습니다.…,2025.06.12 16:56,https://news.sbs.co.kr/news/endPage.do?news_id=N1008135970,SBS
"[자막뉴스] ""저소득일수록 몸이…"" 수영장 안내문 발칵",https://img.sbs.co.kr/newimg/news/20250612/202080899_300.jpg,경기도의 한 수영시설에서 저소득층을 비하하는 표현이 담긴 안내문이 붙었다고요.최근 한 온라인 커뮤니티에는 경기도 소재의 사설 수영장에 게시된 시…,2025.06.12 16:52,https://news.sbs.co.kr/news/endPage.do?news_id=N1008135979,SBS
"이 대통령, 이태원 참사 현장 방문…""안전 마인드 통째로 바꿔야""",https://img.sbs.co.kr/newimg/news/20250612/202080971_300.jpg,▲ 이재명 대통령이 12일 서울 용산구 이태원 참사 현장 '10·29 기억과 안전의 길'에서 헌화를 위해 이동하고 있다…,2025.06.12 16:50,https://news.sbs.co.kr/news/endPage.do?news_id=N1008135989,SBS
잇몸까지 무너지는 KIA…윤도현 손가락 골절로 전반기 아웃,https://img.sbs.co.kr/news/pc/thumb_v3.png,▲ KIA 타이거즈 윤도현부상 병동 KIA 타이거즈에 또 다친 선수가 나왔습니다.김선빈의 빈자리를 훌륭하게 메워주던 2루수 윤도현이 …,2025.06.12 16:48,https://news.sbs.co.kr/news/endPage.do?news_id=N1008135986,SBS
"검찰, 2억 원대 뇌물 받아 봐주기 수사한 경찰 간부 구속기소",https://img.sbs.co.kr/news/pc/thumb_v3.png,서울중앙지검 형사1부 담당 사건 피의자로부터 억대의 뇌물을 받고 그 대가로 각종 직무상 불법행위를 저지른 A 경찰서 수사과 소속 경찰관 B 씨를…,2025.06.12 16:37,https://news.sbs.co.kr/news/endPage.do?news_id=N1008135965,SBS
"[자막뉴스] ""왜 동탄에?"" ""들어오면 지옥""…엄청난 싸움이 시작됐다",https://img.sbs.co.kr/news/pc/thumb_v3.png,경기도 화성시 장지동 일대의 '유통업무시설' 부지입니다.지난해 모 건설사가 매입해 오는 2027년까지 지상 8층 물류센터와 지상 20층의 업무시설을 건설할 예정입니다.문제는 이로 인해 인근 장지 나들목과 오산 나들목의 교통량이 크게 늘 수 있다는 겁니다.[이권재/오산시장 : 오산IC를 평택과 화성에서도 다 이용을 하고 있습니다.,2025.06.12 16:30,https://news.sbs.co.kr/news/endPage.do?news_id=N1008133685,SBS
"전 미 태평양사령관 ""중국 침공 시 미국 개입은 타이완 방위 의지에 달려""",https://img.sbs.co.kr/news/pc/thumb_v3.png,▲ '타이완해협 방위 워게임' 관련 기자회견타이완 해협에서 충돌이 발생할 경우 미국의 개입 여부는 타이완의 방위 의지에…,2025.06.12 16:28,https://news.sbs.co.kr/news/endPage.do?news_id=N1008135934,SBS
중국서 샤오미 전기차 16대 연쇄 추돌사고…안전성 논란 재점화,https://img.sbs.co.kr/news/pc/thumb_v3.png,▲ 중국 정저우시에서 발생한 샤오미 전기차 SU7 연쇄 추돌 사고중국에서 탑승자 3명이 사망하는 사고가 났던 샤오미의 전기차 모델이 …,2025.06.12 16:23,https://news.sbs.co.kr/news/endPage.do?news_id=N1008135933,SBS
대구 스토킹 피해 여성 살해사건 장기화 우려…용의자 공개수배 검토,https://img.sbs.co.kr/news/pc/thumb_v3.png,▲ 대구 성서경찰서경찰의 피해자안전조치를 받던 스토킹 피해 여성을 살해한 혐의를 받는 용의자가 범행 직후 대구를 벗어나 세종시 한 야…,2025.06.12 16:23,https://news.sbs.co.kr/news/endPage.do?news_id=N1008135937,SBS
