title,thumbnail,short_content,write_time,link,company
트럼프 “국가비상사태 선포할 수도 있다”,https://img.seoul.co.kr/img/upload/2025/09/15/SSC_20250915174915_N1.jpg.webp,"도널드 트럼프 미국 대통령이 수도 워싱턴DC의 치안 유지를 위해 국가비상사태를 선포할 수도 있다고 경고했다. 트럼프 대통령은 15일(현지시간) “뮤리얼 바우저 (워싱턴DC) 시장이 연방 정부에 시(市) 경찰국이 위험한 불법체류자들을 내보내고 이주시키는 이민세관단속국(ICE)과 협력하지 않겠다고 통보했다”라는 글을 본인의 소셜미디어(SNS) 트루스소셜에 게시했다. 트럼프 대통령은 “내가 이를 허용한다면, 범죄가 다시 많아질 것”이라며 “워싱턴 DC 시민과 기업 여러분, 걱정하지 말라. 내가 여러분과 함께한다. 나는 이런 일이 일어나도록 내버려 두지 않을 것이다”라고 강조했다. 그러면서 “필요하다면 국가 비상사태를 선포하고 연방 정부의 통제하에 둘 것”이라고 덧붙였다. 앞서 트럼프 대통령은 지난달 11일 수도 워싱턴 DC의 치안 상황이 통제 불능 상태라고 주장하면서 연방정부가 시 경찰을 직접 지휘하고, 주 방위군을 워싱턴 치안에 투입하겠다고 발표했다. 그러자 워싱턴DC 시 당국은 트럼프 행정부의 조치가 워싱턴DC의 자치권을 명시한 ‘워싱턴DC 자치법’을 침해했다고 반발하며 소송을 제기했다. 바우저 시장실은 이번 트럼프 대통령의 ‘국가비상사태’ 언급과 관련",2025-09-15,https://www.seoul.co.kr/news/international/2025/09/15/20250915500298,서울신문
죽음으로 내몰리는 중국의 젊은 과학자들,https://img.seoul.co.kr/img/upload/2025/09/15/SSC_20250915174200_N1.png.webp,"올들어 중국의 젊은 과학자들이 극단 선택을 하거나 돌연사를 하는 사례가 잇따르면서 경쟁 위주의 대학 사회에 경고음을 내고 있다. 홍콩 사우스차이나모닝포스트는 14일(현지시간) 최근 몇 달 동안 중국 최고 대학의 저명한 젊은 과학자 3명이 사망하자 무자비한 학계 시스템이 도마 위에 올랐다고 전했다. 미국과의 기술 경쟁 속에 중국 학계의 젊은 과학자들은 국가 수준의 야심찬 목표와 성과 경쟁 속에 스스로 극단적 선택을 하는 일이 늘고 있다. 지난 8월 4일 중국 저장대학교 생물시스템공학 및 식품과학대학의 35세 과학자 두동동은 교내에서 추락사했다. 그의 연구 분야는 농업 로봇, 생체모방 소프트 로봇 등이었다. 지난달 광둥성에 있는 광둥 테크니온-이스라엘 기술대학의 황카이(41) 교수 역시 추락사했다. 중국 최고 명문 베이징대를 졸업하고 2011년 캐나다 토론토대학에서 1986년 노벨화학상을 받은 존 폴라니의 지도로 박사 학위를 받은 전도유망한 학자였다. 고국으로 돌아오기 전 토론토대와 독일 프리츠 하버 연구소에서 근무했었다. 난징대학교 지속가능에너지자원학부의 동스자(33) 조교수도 이른 나이에 사망했지만, 대학 측은 그의 죽음에 대해 논평을 내놓지 않았",2025-09-15,https://www.seoul.co.kr/news/international/2025/09/15/20250915500294,서울신문
“살고 싶어 조국 버린다” 우크라 청년들 大탈출…출국 러시,https://img.seoul.co.kr/img/upload/2025/09/15/SSC_20250915154026_N1.jpg.webp,"우크라이나 정부가 18∼22세 남성에 대한 출국금지를 해제한 뒤 외국으로 떠나는 청년이 급증하고 있다고 폴란드 매체 TVP가 12일(현지시간) 전했다. 보도에 따르면 지난달 27일 출국금지가 풀린 이후 일주일간 국경을 넘어 폴란드에 입국한 우크라이나인이 약 1만명 늘었다. 우크라이나와 국경을 접한 폴란드 2개주에서 해당 연령대 남성의 출국이 급격히 증가했다. 포트카르파치에주를 거쳐 출국한 18∼22세 남성은 5600명으로 일주일 새 12배, 루블린주는 4000명으로 10배 증가했다. 하르키우 출신 미하일로 셰브첸코(22)는 독일 일간 타게스슈피겔에 “정부가 출국금지를 해제하자마자 기차표를 끊었다”며 “미사일 위협과 징집 가능성이 있는 삶을 더 이상 견딜 수 없었다”고 말했다. 그는 직장 동료가 징병검사를 위해 끌려가는 장면을 목격한 후 검문을 피하기 위해 거리에 좀처럼 나가지 않았다고 전했다. 우크라이나는 2022년 2월 개전 이후 18∼60세 남성이 특별 허가 없이 출국하지 못하도록 했다. 징집 대상 연령은 기존 27세에서 지난해 25세로 낮췄고, 25세 미만은 자진 입대할 수 있도록 했다. 그러다 지난달 18∼22세 남성이 국경을 자유롭게 넘을 수",2025-09-15,https://www.seoul.co.kr/news/international/2025/09/15/20250915500224,서울신문
“이건 누가 봐도 ‘인어 로고’ 따라한 거 아냐?”…스타벅스 뒷목 잡게 만든 ‘이 카페’,https://img.seoul.co.kr/img/upload/2025/09/15/SSC_20250915151033_N1.jpg.webp,"파키스탄의 도시 카라치의 카페 ‘사타르 벅시’가 글로벌 커피 대기업 스타벅스와 벌인 상표권 분쟁에서 승리를 거둔 것으로 알려졌다. 스타벅스와 유사한 로고 디자인을 사용해 논란이 됐지만 “패러디이자 파키스탄 문화의 표현”이라는 카페 측 주장이 법정에서 인정받으며 영업을 이어갈 수 있게 됐다. 14일(현지시간) 데일리 K2, CNN-뉴스18 등 외신에 따르면, 파키스탄 카페 ‘사타르 벅시’가 독특한 브랜딩으로 국제적 관심을 받고 있다. 이 카페의 로고에는 초록색 원형에 물결 무늬와 콧수염 난 남성이 그려져 있다. 이는 스타벅스의 상징인 인어 로고를 연상시켜 화제가 됐다. 소셜미디어(SNS)에서 입소문을 타며 네티즌들의 호기심을 자극했고, 결국 글로벌 커피 대기업인 스타벅스와의 치열한 법정 공방으로까지 번졌다. 사타르 벅시는 2013년 리즈완 아흐마드와 아드난 유수프가 카라치에서 문을 연 카페다. 유머와 파키스탄 문화를 전면에 내세웠다. 스타벅스의 인어 로고를 패러디해 콧수염 난 남성을 그려 넣은 것도 이런 의도에서였다. 당시 스타벅스는 파키스탄에 매장을 열지 않은 상태였다. 그렇지만 사타르 벅시 카페의 이름과 로고가 소비자 혼란을 일으키고 자사 브랜드 가치",2025-09-15,https://www.seoul.co.kr/news/international/2025/09/15/20250915500212,서울신문
결혼사진 속 ‘낯선 하객’…스토커인 줄 알았더니 반전 정체에 ‘깜짝’,https://img.seoul.co.kr/img/upload/2025/09/15/SSC_20250915145319_N1.jpg.webp,"영국의 한 여성이 자신의 결혼식 사진에서 뒤늦게 발견한 낯선 하객의 신원을 4년 만에 알게 된 사연이 전해졌다. 지난 12일(현지시간) BBC, 가디언 등 외신에 따르면 미셸 와일리는 2021년 11월 20일 영국 스코틀랜드 사우스 에어셔의 한 호텔에서 결혼식을 올렸다. 와일리는 사진작가로부터 결혼식 사진을 받은 후 정체를 알 수 없는 키 큰 남성 하객을 발견하고 의문에 휩싸였다. 와일리는 “남편과 함께 사진을 보고 난 뒤 ‘누구지?’라는 생각이 들었다”며 “처음에 부모님께 여쭤보고 친척, 친구를 비롯해 호텔 측에도 물어봤지만 아무도 그 사람이 누군지 모른다고 했다”고 말했다. 와일리는 소셜미디어(SNS)에 사진을 올리며 이 남성의 정체를 밝히려고 애썼으나 시간이 지나도 미스터리는 풀리지 않았다. 그런데도 이상하게 ‘초대하지 않은 하객’ 생각이 계속 머릿속을 맴돌았다고 한다. 와일리는 “‘누군가는 이 사람이 누군지 알아야 하지 않나’라는 생각이 들었다”며 “남편에게 ‘이 남자 정말 몰라? 혹시 당신 직장 동료 아니야?’라고 몇 번이나 물어봤다”고 했다. 와일리는 이 남성이 미친 스토커일까 봐 걱정했다고 한다. 와일리는 인터넷의 힘을 믿어보기로 했",2025-09-15,https://www.seoul.co.kr/news/international/topic-global/2025/09/15/20250915500205,서울신문
도쿄 도심에 후쿠시마 오염토 투입… “방사능 불안” 확산,https://img.seoul.co.kr/img/upload/2025/09/15/SSC_20250915135907_N1.jpg.webp,"일본 정부가 후쿠시마 원전 사고로 발생한 제염토를 도쿄 도심 한복판 정부 청사에 본격 투입하기 시작했다. 시민들의 거부감을 뚫고 전국 확산의 물꼬를 트겠다는 의도로 풀이된다. 교도통신에 따르면 14일 도쿄 도심 관청가인 가스미가세키의 환경성, 경제산업성, 부흥청 청사 화단에 약 45㎥의 제염토를 투입해 다지는 작업이 진행됐다. 경제산업성 입주 청사 주차장 앞 화단에서는 55㎝ 깊이까지 제염토를 넣고, 비산 방지를 위해 위쪽에 일반 토양을 20㎝ 두께로 덮는 작업이 이뤄졌다. 이는 지난 7월 도쿄 지요다구 나가타초 총리 관저 앞마당에 이어 후쿠시마현 밖 지역에 제염토가 활용된 두 번째 사례다. 당시 총리 관저에는 2㎥의 제염토를 가로·세로 각각 2m 구간에 깔고 일반 흙으로 덮은 뒤 원예용 풀을 심었다. 일본 정부는 시민들의 거부감 때문에 제염토 활용이 진척되지 못하자 정부 청사부터 시작해 ‘성공 사례’를 만들어 이해를 확산하려는 전략을 구사하고 있다. 환경성 담당자는 “공사 전후 측정된 방사선량은 거의 같다”며 측정 방사선량을 홈페이지에 공표하겠다고 밝혔다. 제염토는 2011년 후쿠시마 제1원자력발전소 폭발 사고 후 주변 주택, 농지 등을 대상으로 오염",2025-09-15,https://www.seoul.co.kr/news/international/2025/09/15/20250915500162,서울신문
“외삼촌이 미성년 女조카 납치한 뒤 성폭행”…발칵 뒤집힌 ‘이 나라’,https://img.seoul.co.kr/img/upload/2025/09/15/SSC_20250915135100_N1.png.webp,"인도의 한 남성이 자신의 조카를 납치한 후 성폭행한 혐의로 체포됐다. 15일(현지시간) 타임스오브인디아에 따르면 자발푸르 지역의 한 미성년 소녀가 최근 실종됐다는 신고가 들어왔다. 소녀의 가족은 다른 지역에 살고 있는 외삼촌이 소녀를 납치했을 것이라고 의심해 실종 신고를 한 것으로 전해졌다. 이에 경찰은 즉시 수색 작전을 벌였고, 결국 삼촌의 보호 아래에 있던 소녀를 찾아냈다. 충격적인 것은 심문 과정에서 소녀가 “삼촌에게 납치당한 후 성폭행당했다”고 진술한 것이다. 자신의 조카를 납치하고 성폭행한 혐의를 받는 남성은 현재 기소된 것으로 알려졌다. 한편 같은 날 싱그라울리 지역에서는 10대 자매가 납치돼 정글로 끌려가 3명의 남자에게 집단 성폭행을 당하는 사건이 발생했다. 자매는 모두 경찰과 지역 주민들에 의해 발견됐으며, 의식을 잃은 상태였다. 두 사람은 치료를 위해 지역 병원으로 이송된 것으로 알려졌다.",2025-09-15,https://www.seoul.co.kr/news/international/2025/09/15/20250915500158,서울신문
日 공항 검색대에서 사라진 승객 돈 1400만원…“고양이에게 생선 맡긴 꼴”,https://img.seoul.co.kr/img/upload/2025/06/01/SSC_20250601152843_N1.jpg.webp,"일본 공항에서 공항 보안검색대 직원이 승객의 수하물에서 상습적으로 현금을 훔치다 적발됐다. 15일 요미우리신문 등에 따르면 일본 경시청은 오타구 하네다 공항에서 승객들의 수하물을 검사하던 중 수하물에 있던 현금을 훔친 혐의로 보안검색대 직원인 20대 남성 A씨를 검거해 조사하고 있다. 경찰에 따르면 A씨는 지난 13일 하네다 공항의 기내 수하물 보안검색대에서 근무하며 30대 남성 승객의 수하물에서 현금 9만엔(84만원)을 훔친 혐의를 받는다. A씨는 바구니에 담긴 승객의 수하물이 엑스레이 장치를 통과하기 전 수하물을 정리하는 척 하면서 바구니 위에 놓여있는 현금을 훔치고, 근무 중 자리를 옮길 때 화장실로 가 휴지심 안에 현금을 숨긴 것으로 드러났다. 피해 승객이 자신의 수하물에서 현금이 사라진 것을 발견하고 자리로 돌아온 뒤 A씨에게 문제를 제기하며 말다툼을 벌이다 A씨의 범행이 드러났다. A씨는 경찰 조사에서 “들킬지도 모른다는 스릴을 즐기기 위해 범행을 저질렀다”면서 “일이 체력적으로 힘들어 그만둘 생각을 하던 도중 생활비를 모으려 했다”는 취지로 진술한 것으로 알려졌다. 또한 지난 8월부터 총 70~80건 가량 범행을 저질렀으며 훔친 돈이 15",2025-09-15,https://www.seoul.co.kr/news/international/japan/2025/09/15/20250915500153,서울신문
日 공항 검색대에서 사라진 승객 돈 1400만원…“고양이에게 생선 맡긴 꼴”,https://img.seoul.co.kr/img/upload/2025/06/01/SSC_20250601152843_N1.jpg.webp,"일본 공항에서 공항 보안검색대 직원이 승객의 수하물에서 상습적으로 현금을 훔치다 적발됐다. 15일 요미우리신문 등에 따르면 일본 경시청은 오타구 하네다 공항에서 승객들의 수하물을 검사하던 중 수하물에 있던 현금을 훔친 혐의로 보안검색대 직원인 20대 남성 A씨를 검거해 조사하고 있다. 경찰에 따르면 A씨는 지난 13일 하네다 공항의 기내 수하물 보안검색대에서 근무하며 30대 남성 승객의 수하물에서 현금 9만엔(84만원)을 훔친 혐의를 받는다. A씨는 바구니에 담긴 승객의 수하물이 엑스레이 장치를 통과하기 전 수하물을 정리하는 척 하면서 바구니 위에 놓여있는 현금을 훔치고, 근무 중 자리를 옮길 때 화장실로 가 휴지심 안에 현금을 숨긴 것으로 드러났다. 피해 승객이 자신의 수하물에서 현금이 사라진 것을 발견하고 자리로 돌아온 뒤 A씨에게 문제를 제기하며 말다툼을 벌이다 A씨의 범행이 드러났다. A씨는 경찰 조사에서 “들킬지도 모른다는 스릴을 즐기기 위해 범행을 저질렀다”면서 “일이 체력적으로 힘들어 그만둘 생각을 하던 도중 생활비를 모으려 했다”는 취지로 진술한 것으로 알려졌다. 또한 지난 8월부터 총 70~80건 가량 범행을 저질렀으며 훔친 돈이 15",2025-09-15,https://www.seoul.co.kr/news/international/japan/2025/09/15/20250915500153,서울신문
“정신질환 노숙자 처형해야”… 美흑인의 女난민 살해사건에 ‘과격발언’ 결국,https://img.seoul.co.kr/img/upload/2025/09/15/SSC_20250915133438_N1.png.webp,폭스뉴스 보수 토크쇼 진행자 킬미드 “치사 주사 놓든가 죽여야” 논란되자 발언 나흘 만에 “매우 무정했다” 사과 사건 CCTV 확산 후 인종적 논란 번져 보수 성향의 토크쇼 ‘폭스 앤 프렌즈’를 진행자이자 폭스뉴스의 유명 정치평론가인 브라이언 킬미드가 ‘정부 도움을 거부하는 노숙자는 처형해야 한다’는 취지로 발언했다가 비판이 빗발치자 사과했다고 14일(현지시간) AP·로이터통신 등이 전했다. 킬미드는 이날 폭스뉴스 인터뷰를 통해 “(문제의 발언은) 매우 무정했다”며 고개를 숙였다. 이어 “저는 정신질환을 앓고 있는 노숙자 모두가 ‘노스캐롤라이나의 가해자’처럼 행동하지는 않는다는 것을 물론 알고 있다. 많은 노숙자는 우리의 공감과 연민을 받을 자격이 있다는 것 또한 알고 있다”고 말했다. 앞서 킬미드는 지난 10일 ‘폭스 앤 프렌즈’ 방송에서 지난달 노스캘로라이나주 샬럿에서 발생한 우크라이나 난민 여성 이리나 자루츠카(23) 피살 사건에 관해 얘기하고 있었다. CNN에 따르면 자루츠카 살해 용의자 디칼로스 브라운(34)의 모친은 아들이 정신질환을 앓고 있었으며 노숙자 쉼터에서 생활하고 있었다고 전했다. 토크쇼에서 공동진행자인 로렌스 존스는 노숙자 지원에 수,2025-09-15,https://www.seoul.co.kr/news/international/USA-amrica/2025/09/15/20250915500147,서울신문
13년만 복귀 앞두고…돌연 숨진 채 발견된 전설의 ‘세계 챔피언’,https://img.seoul.co.kr/img/upload/2025/09/15/SSC_20250915132428_N1.jpg.webp,"세계 챔피언 타이틀을 두 차례나 거머쥐며 복싱계에서 인기를 끈 영국의 간판 복서 리키 해튼이 46세의 나이로 사망했다. 2012년 이후 링 위에 서지 않은 해튼은 복귀를 선언한 지 두달 만에 세상을 떠나 안타까움을 자아냈다. 15일(현지시간) AP통신 등 외신에 따르면 해튼은 전날 오전 영국 그레이터 맨체스터의 하이드에 있는 자택에서 숨진 채 발견됐다. 맨체스터 경찰은 “현재로서는 (사망과 관련해) 의심스러운 정황은 없는 것으로 보인다”고 밝혔다. 해튼은 2005년 세계복싱협회(WBA) 라이트웰터급, 2006년 웰터급에서 세계 챔피언 타이틀을 획득했다. 그는 플로이드 메이웨더, 코스티야 추, 매니 파키아오 등과 함께 당대 최고의 복서와 함께 전성기를 누렸다. 해튼의 프로 통산 전적은 48전 45승 3패다. 해튼은 선수 시절 소탈하고 겸손한 화법과 성격으로 팬들에게 사랑을 받았다. 2012년 은퇴한 이후 겪은 우울증과 음주·약물 중독 등에 대해서도 공개적으로 털어놔 화제가 됐다. 해튼의 사망 소식이 더 안타까운 이유는, 그가 13년 만에 복귀를 선언한 지 두달여 만에 갑작스레 세상을 떠났기 때문이다. 앞서 그는 오는 12월 아랍에미리트(UAE) 두바이에",2025-09-15,https://www.seoul.co.kr/news/international/2025/09/15/20250915500143,서울신문
"“전등 속에 전선이? 그런데 갑자기 ‘꿈틀’”…공포의 36시간, 인도서 무슨 일이",https://img.seoul.co.kr/img/upload/2025/09/15/SSC_20250915130347_N1.png.webp,"인도의 한 아파트에서 부엌 천장 전등 속으로 독사인 코브라가 숨어들어 온 가족이 36시간 동안 공포에 떤 사건이 화제가 되고 있다. 뱀은 긴급 출동한 산림청 구조팀에 의해 천장에서 구조돼 자연으로 돌아갔다. 14일(현지시간) CNN-뉴스18 등 외신 보도에 따르면, 인도 북부 우타르프라데시 주의 도시인 노이다에서 한 가족이 지난 9일 부엌 천장 전등 속 코브라를 발견하는 사건이 일어났다. 이 가족은 처음엔 전선으로 착각했다가 꿈틀거리는 모습을 보고서야 뱀이라는 사실을 알아차리고는 충격을 받았다고 한다. 가족들은 곧바로 2층 방으로 대피해 문을 잠그고 외부에서 음식을 배달시켜 먹으며 버텼다. 코브라가 있는 부엌은 접근조차 할 수 없는 상황이었다. 한편 가족들은 산림청에 긴급 신고했다. 뱀 포획 전문가와 산림청 직원들이 출동했지만 구조 작업은 예상보다 까다로웠다. 구조팀은 수 시간에 걸친 사투 끝에 천장에 특수 가루를 뿌려 코브라가 자발적으로 나오도록 유도하는 작전을 펼쳤다. 결국 지난 10일 저녁, 36시간의 긴장된 대치 상황이 마무리됐다. 산림청이 코브라를 무사히 구조한 것이다. 코브라는 오클라 조류 보호구역으로 옮겨져 자연으로 돌아갔다.",2025-09-15,https://www.seoul.co.kr/news/international/2025/09/15/20250915500135,서울신문
세계 최초 ‘AI 장관’ 임명한 ‘이 나라’…임무는 ‘부패 척결’,https://img.seoul.co.kr/img/upload/2025/09/15/SSC_20250915123238_N1.jpg.webp,"알바니아가 세계 최초로 인공지능(AI) 기반 ‘가상 장관’을 내각에 포함했다. 지난 13일(현지시간) AP통신에 따르면 에디 라마 알바니아 총리는 이날 자신의 페이스북 계정을 통해 AI로 생성된 ‘디엘라’(Diella·태양)를 새 내각에 장관으로 임명했다고 밝혔다. 라마 총리는 “디엘라는 물리적으로 존재하지 않지만, 공공 입찰을 100% 부패 없이 진행할 수 있고 정부가 더욱 신속하고 투명하게 일할 수 있도록 지원할 것”이라고 했다. 알바니아 정보사회국에 따르면 디엘라는 최신 AI 모델과 기술을 기반으로 행정 업무를 수행하며 전통 민속 의상을 입은 가상 인물로 구현됐다. 올해 초 마이크로소프트와 협력해 개발됐으며, 공공 서비스 플랫폼 ‘e-Albania’에서 가상 비서로 운영되며 약 100만 건의 디지털 문의와 문서 처리를 지원한 것으로 알려졌다. 영국 BBC 방송은 “새 장관이 팝스타처럼 단지 디엘라라는 이름으로만 알려져 있다”며 “알바니아 헌법을 고려할 때 이러한 조치는 공식적이기보다는 상징적 성격을 갖는다”고 설명했다. 알바니아 헌법에 따르면 정부 장관은 18세 이상의 정신적으로 유능한 시민이어야 하기 때문이다. 디엘라 장관 임명에 대해 야당인",2025-09-15,https://www.seoul.co.kr/news/international/topic-global/2025/09/15/20250915500132,서울신문
“세계 신기록” 7㎝ 하이힐 신고 뒤로 달린 男…100m 몇 초? [포착],https://img.seoul.co.kr/img/upload/2025/09/15/SSC_20250915115553_N1.jpg.webp,"스페인 출신의 한 남성이 하이힐을 신고 뒤로 달리기(역주) 100m 종목에서 세계 신기록을 세워 화제다. 14일(현지시간) 타임스오브인디아에 따르면 기네스 세계기록은 지난 8일 스페인 출신 남성 크리스티안 로베르토 로페스 로드리게스가 굽 높이 7㎝ 이상의 푸른색 하이힐을 신고 100m를 뒤로 달려 16.55초를 기록했다고 밝혔다. 이는 그가 앞서 지난 2014년 한 스페인 TV 프로그램에서 세운 기존 기록(20.05초)을 약 3.5초 단축한 것이다. 도전 당시 그는 푸른색 하이힐에 양말, 빨간색 반바지, 분홍·파랑이 섞인 상의를 입었다. 기록을 세우는 과정에서 물집이나 발목 부상 위험이 있었지만, 그는 끝까지 완주하며 새로운 세계기록을 완성했다. 타임스오브인디아는 “뒤로 전력 질주를 해 본 적이 있다면 알겠지만 이 일은 생각보다 더 힘들다”며 “앞으로 달리는 것은 우리 몸이 그렇게 움직이도록 만들어졌기 때문에 쉽지만, 반대는 어렵다”고 설명했다. 이어 “가장 큰 어려움은 평소 움직임을 지탱하던 근육에 갑자기 움직이라고 요구하는 것”이라면서 “게다가 어디로 가는지 볼 수 없다는 사실까지 더해지면 뇌와 몸은 똑바로 가기 위해 2배로 힘을 써야 한다”",2025-09-15,https://www.seoul.co.kr/news/international/2025/09/15/20250915500130,서울신문
“콜드플레이가 저 남자를 위해?”…커크 애도에 분열 확산,https://img.seoul.co.kr/img/upload/2025/09/15/SSC_20250915102133_N1.jpg.webp,"세계적 록밴드 콜드플레이가 공연 무대에서 최근 총격으로 사망한 미국 청년 우익 활동가 찰리 커크를 언급하면서 뜻밖의 논쟁에 휘말렸다. 미국 음악 전문매체 롤링스톤과 버라이어티 등은 14일(현지시간) 콜드플레이 보컬 크리스 마틴이 지난 12일 영국 런던 웸블리 스타디움에서 열린 ‘뮤직 오브 더 스피어스’ 월드투어 피날레 공연에서 “찰리 커크의 가족에게 사랑을 보내자”고 발언했다고 전했다. 마틴은 무대에서 두 팔을 머리 위로 들어 올리며 “이렇게 손을 들어 세상 어디든 사랑을 보내고 싶은 곳에 사랑을 전하자”고 관객들을 독려했다. 그는 “여러분의 형제자매에게, 힘든 일을 겪고 있는 사람들의 가족에게, 찰리 커크의 가족에게도 보낼 수 있다”며 “의견이 다른 사람들에게도 사랑을 보낼 수 있다”고 말했다. “커리어 내던진다” vs “가족 애도도 못하나” 마틴의 발언이 소셜미디어에 확산되자 팬들과 네티즌들 사이에서는 찬반 논쟁이 격화됐다. 엑스에서는 해당 공연 영상이 빠르게 공유되며 “논란의 여지도 없이 콜드플레이가 그간 쌓아온 커리어를 찰리 커크에게 내던지고 있다” “차라리 스스로 어리석다고 밝혀라” 등의 비판적 반응이 쏟아졌다. 반면 일부 팬들은 “가족에게",2025-09-15,https://www.seoul.co.kr/news/international/2025/09/15/20250915500070,서울신문
