title,thumbnail,short_content,write_time,link,company
레이더 이어 무력시위 공방… 갈등 골 깊어지는 중국·일본,https://img.seoul.co.kr/img/upload/2025/12/10/SSC_20251210180646_N1.jpg.webp,"中 항모, 오키나와 감싸듯 항해 함재기 이착륙만 나흘간 140회 日, 압박 훈련 일상화 국면 우려 “교신 음성 있다” “필수 정보 없어” 레이더 조준 논란도 대립 지속 다카이치 사나에 일본 총리의 ‘대만 유사시’ 발언 이후 중일 간 갈등이 격화된 가운데 중국 항공모함 랴오닝 전단이 오키나와 해역을 ‘포위 항해’하며 압박 수위를 끌어올렸다. 중국은 레이더 조사 공방의 교신 음성까지 공개하며 일본을 정조준했고 일본은 “구체적 정보가 없었다”며 즉각 반발했다. 군사 행동과 정보전이 뒤엉키며 중일 간 긴장이 급격히 치솟고 있다. 10일 일본 방위성에 따르면 랴오닝함은 지난 5일 동중국해에서 오키나와 해역으로 접근한 뒤 7일까지 오키나와 본섬을 ‘ㄷ자’ 형태로 감싸듯 항해했다. 전날까지는 오키나와현 동쪽 미나미다이토지마 주변을 시계 방향으로 선회하며 ‘S자 항로’로 압박 강도를 높였다. 전단의 활동 규모도 커지고 있다. 방위성은 8일 기준 함재기·헬기 이착륙이 약 40회, 5~8일 나흘간 합산 약 140회에 이른다고 밝혔다. 전날에는 보급함도 합류한 것으로 파악됐다. 지지통신은 “(랴오닝 항모가) 한 달 이상 장기 항해에 나설 가능성”을 제기했다. 이에 일본 정부",2025-12-11,https://www.seoul.co.kr/news/international/2025/12/11/20251211014001,서울신문
"‘케데헌’ 헌트릭스, 또 일냈다…타임지 커버 장식",https://img.seoul.co.kr/img/upload/2025/12/10/SSC_20251210174437_N1.jpg.webp,"넷플릭스 애니메이션 영화 ‘케이팝 데몬 헌터스’(케데헌)의 주인공 걸그룹 ‘헌트릭스’가 미국 시사주간지 타임(Time) 표지를 장식했다. 9일(현지시간) 미국 시사주간지 타임은 케데헌을 ‘2025 올해의 돌파구(Breakthrough of the Year)’로 선정하고, 12월 29일자 표지에 주역 캐릭터 루미·미라·조이를 전면 배치했다. 이 매체는 뉴욕 브루클린에서 열린 상영회가 연일 매진된 것을 언급하며 “아이들뿐 아니라 어른들까지 노래를 따라 부르며 몰입했다”고 밝혔다. 이어 “2013년 ‘겨울왕국’ 이후 이처럼 일상 곳곳에 스며든 애니메이션은 없었다”고 평가했다. 케데헌의 대표 OST ‘Golden’에 대해서도 타임은 “경쾌하면서도 중독성 강한 곡”이라면서 “한국적 디테일과 생동감 넘치는 비주얼을 결합한 영화의 정서를 완성한다”고 설명했다. 음악 작업에 참여한 한국인 작곡가 이재(Ejae)는 타임과의 인터뷰에서 “한국의 완벽주의 문화 속에서 ‘불완전함도 아름답다’는 메시지가 많은 관객에게 울림을 준다”고 전했다. 타임은 케데헌이 한국 전통 식문화·한의원·대중목욕탕 등 세밀한 생활 풍경을 자연스럽게 녹여냈다는 점과 K팝 프로듀서 테디·린드그렌 등",2025-12-10,https://www.seoul.co.kr/news/life/pop-culture/2025/12/10/20251210500247,서울신문
"미 행정부 마두로 축출 시나리오 검토…트럼프, “그의 시대 얼마 안남아”",https://img.seoul.co.kr/img/upload/2025/12/10/SSC_20251210163711_N1.jpg.webp,베네수엘라에 대한 미국의 군사적 위협이 강화되고 있는 가운데 도널드 트럼프 행정부가 이미 니콜라스 마두로 정권 붕괴 후 시나리오 검토에 착수한 것으로 알려졌다. 트럼프 대통령은 “마두로의 시대가 얼마 남지 않았다”며 축출 의지를 공개적으로 드러냈다. 미 CNN방송은 9일(현지시간) 트럼프 행정부가 마두로 대통령이 권좌에서 축출될 경우를 대비한 후속 계획 초안을 작성하고 있다고 고위 관계자 등을 인용해 보도했다. 이 계획에는 마두로 대통령이 자진 퇴진하거나 군사 공격 등으로 축출될 경우 미국이 권력 공백에 빠진 베네수엘라를 안정시킬 수 있는 방안 등이 담긴 것으로 알려졌다. 스티븐 밀러 백악관 부비서실장이 이끄는 국가안보회의(NSC)가 작업을 주도하고 있다고 한다. 다만 베네수엘라에 대한 군사 공격이나 비밀작전 전개 여부를 놓고는 트럼프 행정부 내에서 여전히 의견이 엇갈리고 있다. 트럼프 대통령도 아직 최종 결정을 내리지 않은 것으로 알려졌다. 앞서 트럼프 행정부는 마두로 대통령에게 ‘즉각 사임하고 망명하면 안전한 출국을 보장하겠다’고 제안했으나 거부당한 것으로 전해졌다. 트럼프 대통령은 이날 미 정치매체 폴리티코와의 인터뷰에서 마두로 대통령 축출에 대한,2025-12-10,https://www.seoul.co.kr/news/international/2025/12/10/20251210500211,서울신문
"트럼프 엔비디아 첨단칩 수출 허가했지만, 중국 “늦었다”",https://img.seoul.co.kr/img/upload/2025/12/10/SSC_20251210150921_N1.png.webp,"젠슨 황 엔비디아 최고경영자(CEO)의 끈질긴 설득으로 도널드 트럼프 미국 대통령이 H200칩의 중국 수출을 허가했으나 중국 당국은 자국 기업의 사용을 제한할 전망이다. 중국은 7월에도 엔비디아의 H20칩 수출이 재개되자 ‘백도어(해킹 경로)’가 있다며 보안 위험을 제기한 바 있다. 이번 H200칩 수출 허가를 놓고도 중국 언론은 “늦었다”는 반응을 보였다. 파이낸셜타임스(FT)는 9일(현지시간) 중국 정부가 트럼프 대통령이 전날 수출을 허용했다고 밝힌 H200 칩 사용을 규제하는 방안을 논의하고 있다고 보도했다. 중국 정부는 엔비디아 칩을 구매하겠다고 요청한 중국 기업에 대해 국산 대안 제품을 쓰지 않는 이유를 설명하도록 하는 승인 절차를 의무화해 까다롭게 할 가능성이 높은 것으로 알려졌다. 정부나 공공기관의 H200 구매는 금지하는 조치가 도입될 수도 있다. 앞서 중국 국가인터넷정보판공실은 엔비디아가 미국 정부의 수출 규제에 따라 중국 수출용으로 성능을 낮춘 H20칩에 대해 ‘백도어(해킹 경로)’가 있다며 보안 위험을 제기했다. 이에 엔비디아 측은 백도어, 킬 스위치(비상 차단 장치), 모니터링 소프트웨어 등이 없다고 해명했으나 중국 수출은 제한적으",2025-12-10,https://www.seoul.co.kr/news/international/2025/12/10/20251210500163,서울신문
"트럼프, 북한 부럽나? “100만 볼트 ‘3중 철조망’…美보다 강력”",https://img.seoul.co.kr/img/upload/2025/12/10/SSC_20251210143447_N1.png.webp,"도널드 트럼프 미국 대통령이 9일(현지시간) 불법 이민 차단 정책의 성과를 강조하며 미국보다 강력한 국경을 가진 국가로 북한을 지목했다. 이날 펜실베이니아주 마운트 포코노에서 연설한 트럼프 대통령은 “지금은 역대 가장 탄탄한 국경을 갖고 있다”며 “우리는 세계에서 가장 강력한 국경 중 하나를 보유하고 있다”고 주장했다. 이는 조 바이든 전 행정부 시절 대규모 불법 이민자가 미국으로 유입됐으나, 자신이 국경 보안을 강화해 이를 시정했다는 점을 부각하는 과정에서 나온 발언이다. 그는 콩고·베네수엘라 교도소에 수감 돼 있던 범죄자들이 미국으로 쏟아져 들어왔다는 주장까지 덧붙이며 국경 통제 필요성을 강조했다. 트럼프 대통령은 그러더니 뜬금없이 북한을 언급했다. 그는 “나는 아마도 더 강력한 국경을 가진 나라가 하나 있다고 말하겠다”며 “어디인지 아는가. 그것은 북한”이라고 말했다. 트럼프 대통령은 “북한은 일곱 겹의 철조망 벽을 갖고 있으며, 각각의 벽에는 100만 볼트의 전류가 흐른다”고 했다. 이어 “한 개를 넘으면 다음 장벽에서 죽을 것이다. 두 개를 넘으면 기록을 세운 것”이라고 농담 섞인 어조로 덧붙였다. 다만 그는 “그러나 우리 국경은 꽤 안전",2025-12-10,https://www.seoul.co.kr/news/international/2025/12/10/20251210500148,서울신문
"中, 오키나와 ‘포위 항해’ 무력 시위 수위 ↑...중국 교신 음성 공개엔 고이즈미 긴급 회견",https://img.seoul.co.kr/img/upload/2025/12/07/SSC_20251207143132_N1.jpg.webp,"다카이치 사나에 일본 총리의 ‘대만 유사시’ 발언 이후 중일 간 갈등이 격화된 가운데 중국 항공모함 랴오닝 전단이 오키나와 해역을 ‘포위 항해’하며 압박 수위를 끌어올렸다. 중국은 레이더 조사 공방의 교신 음성까지 공개하며 일본을 정조준했고 일본은 “구체적 정보가 없었다”며 즉각 반발했다. 군사 행동과 정보전이 뒤엉키며 중일 간 긴장이 급격히 치솟고 있다. 10일 일본 방위성에 따르면 랴오닝함은 지난 5일 동중국해에서 오키나와 해역으로 접근한 뒤 7일까지 오키나와 본섬을 ‘ㄷ자’ 형태로 감싸듯 항해했다. 전날까지는 오키나와현 동쪽 미나미다이토지마 주변을 시계 방향으로 선회하며 ‘S자 항로’로 압박 강도를 높였다. 전단의 활동 규모도 커지고 있다. 방위성은 8일 기준 함재기·헬기 이착륙이 약 40회, 5~8일 나흘간 합산 약 140회에 이른다고 밝혔다. 전날에는 보급함도 합류한 것으로 파악됐다. 지지통신은 “(랴오닝 항모가) 한 달 이상 장기 항해에 나설 가능성”을 제기했다. 이에 일본 정부는 오키나와 주변 해역에 해상자위대 호위함 데루즈키를 전개해 중국 항모 전단을 밀착 감시하고, 함재기 이착륙 움직임에 맞춰 항공자위대 전투기를 긴급 발진시키고 있다. 일",2025-12-10,https://www.seoul.co.kr/news/international/2025/12/10/20251210500121,서울신문
"신혼부부 한국인 남편, 6살 소년 美 이민국에 붙잡힌 사연",https://img.seoul.co.kr/img/upload/2025/12/10/SSC_20251210123758_N1.png.webp,"트럼프 2기 정부 출범 이후 불법 이민 단속이 강화되면서 억울하게 구금된 이민자들의 사연이 잇따라 전해지고 있다. 미국 로스앤젤레스 지역 방송국 KTLA5는 지난 8일(현지시간) 한국인 이민자 황태하(38) 씨가 영주권 인터뷰 직후 구금돼 40일 이상 수감 상태에 놓여 있다고 보도했다. 황씨는 지난 2월 로스앤젤레스에서 아내 셀레나 디아즈와 결혼했으며, 지난 10월 29일 이민국에서 영주권(그린카드) 인터뷰를 마친 직후 수갑이 채워져 구금됐다. 아내 디아즈는 “남편이 40일 넘게 개처럼 감금돼 있다”며 “처음에는 몇 시간 동안 연락조차 할 수 없었고, 담요도 없이 바닥에서 자며 유치장에서 30시간 넘게 지냈다고 들었다”고 울분을 토했다. 황씨가 구금된 이유는 지난해 5월 이민 법원 출두 날짜를 놓쳤기 때문이다. 당시 이사 과정에서 주소가 변경돼 법원 통지서를 받지 못한 것으로 알려졌다. 미 국토안보부는 황씨가 현재 아델란토 이민세관단속국(ICE) 구금센터에 수감돼 있으며 “F1 학생비자 만료 후 불법 체류했고, 법원 출두 명령을 무시해 1년 전 최종 추방 명령을 받았다”고 밝혔다. 황씨는 과거 첫 결혼을 통해 조건부 영주권을 취득했으나 2021년 이",2025-12-10,https://www.seoul.co.kr/news/international/2025/12/10/20251210500103,서울신문
“남학생들 물놀이 모습에 흥분” 다 잡아들인 男교사가 저지른 짓…日발칵,https://img.seoul.co.kr/img/upload/2025/12/10/SSC_20251210112202_N1.jpg.webp,일본에서 학원 강사가 남자 초등학생들을 대상으로 성희롱을 한 사실이 발각됐다. 심지어 이 남성은 비슷한 범죄로 처벌받은 적이 있어 현지 사회에 더 큰 충격을 낳았다. 10일 산케이신문에 따르면 경시청은 남자 초등학생에게 성희롱을 한 도쿄 하치오지시의 학원 강사 다나카 고이치로(75·남)를 비동의 외설 혐의로 전날 체포했다. 다나카는 지난 10월 초 도쿄 아키루노시 아키가와 하천에서 A(12)군이 13세 미만 청소년인 것을 알면서도 외설스러운 행위를 한 혐의를 받는다. 다나카는 앞서 9월 강에서 놀고 있던 A군 등 남아들에게 말을 걸어 바비큐 파티를 하자고 약속하고 연락처를 교환했다. 범행 당일에는 강에서 놀다 나온 A군 등에게 “(옷을) 벗고 물기를 짜는 것이 좋다”며 수영복이나 속옷을 벗도록 강요했다. 일부 남아에게는 외설스러운 말을 하면서 신체 접촉도 한 것으로 조사됐다. 피해를 입은 A군으로부터 다나카 관련 이야기를 들은 어머니가 수상하게 여기고 경찰에 신고해 다나카의 범행이 발각됐다. 다나카는 경찰 조사에서 “고의로 만지지는 않았다”며 혐의를 부인했다. 다만 “어린이들이 알몸으로 놀고 있는 것을 보고 누디스트(나체주의자) 마을에 있는 것 같이,2025-12-10,https://www.seoul.co.kr/news/international/japan/2025/12/10/20251210500093,서울신문
"한국인 보이스피싱 일당, 캄보디아→태국…230억 사기 행각",https://img.seoul.co.kr/img/upload/2025/10/14/SSC_20251014104453_N1.jpg.webp,"태국에서 수백억대 전화금융사기(보이스피싱)를 벌인 한국인 일당 14명이 현지 경찰에 체포됐다. 지난 9일 방콕포스트에 따르면 이들은 캄보디아에서 범죄를 저지르다 최근 태국으로 거점을 옮긴 것으로 파악됐다. 태국 중앙수사국은 수도 방콕에서 한국인 용의자 14명과 함께 중국인 3명도 체포했다고 발표했다. 용의자들의 연령대는 27~43세였다. 이들 조직은 한국에 있는 피해자들에게 최소 5억 밧(약 230억원)의 피해를 준 것으로 조사됐다. 이들은 원래 캄보디아에서 2024년 10월부터 지난 5월까지 사기 행각을 벌여온 것으로 드러났다. 최근 캄보디아에서 한국인 연루 범죄 조직에 대한 대규모 단속이 이뤄지자, 이를 피해 태국으로 거점을 옮겨 범죄를 이어갔다. 용의자들은 방콕 시내의 라마 3세 및 룸피니 지역 인근 콘도를 임대해 사무실을 차리고 생활해 왔다. 태국 경찰은 이들의 거점을 급습해 일당을 잡아들이고 현장에서 범행에 사용된 증거물들을 대거 압수했다. 압수된 물품에는 인터넷 전화기 50대, 휴대전화 35대, 컴퓨터, 가짜 신분증, 사기 시나리오 대본 등이 포함됐다. 체포된 용의자들에게는 우선 불법 취업 및 비자 기간 초과 체류 혐의가 적용됐다. 태국 경",2025-12-10,https://www.seoul.co.kr/news/international/asia-oceania/2025/12/10/20251210500084,서울신문
"美 국방부, 구글 제미나이 전면 도입…AI 전력 본격화",https://img.seoul.co.kr/img/upload/2023/10/05/SSC_20231005075516_N1.jpg.webp,"미국 국방부가 구글의 인공지능(AI) 모델인 제미나이를 기반으로 하는 군사용 AI 도입을 전면 실행한다. 피트 헤그세스 미국 국방부 장관은 9일(현지시간) X(엑스·옛 트위터)에 게시한 영상에서 “미국 전쟁의 미래가 이것이며, AI라고 쓴다”며 “기술이 발전함에 따라 우리의 적대국들도 발전하고 있지만, 전쟁부는 수수방관하고 있지 않다”고 밝혔다. 그는 “버튼 클릭 한 번으로 인공지능 모델을 활용해 심층 연구를 수행하고 문서를 서식화하며, 심지어 전례 없는 속도로 영상이나 이미지를 분석할 수 있다”며 “‘제너레이티브 AI 플랫폼’(GenAI.mil)은 구글 제미나이를 시작으로 세계에서 가장 강력한 최첨단 인공지능 모델을 모든 미군 전사의 손에 직접 쥐여줄 것”이라고 설명했다. 국방부는 이날 GenAI.mil을 통한 ‘정부용 제미나이’ 배포를 공식화했다. 국방부는 “전례 없는 수준의 AI 기술 우위를 달성하라”는 도널드 트럼프 미국 대통령의 지난 7월 행정명령에 따른 것이라고 덧붙였다. 이어 “향후 수년간 디지털 전장을 주도할 문화적인 변화를 끌어낼 것”이라며 “미국 AI 기술의 우수성을 구현한 제미나이는 세계 최강의 전투력에 타의 추종을 불허하는 분석 및",2025-12-10,https://www.seoul.co.kr/news/international/USA-amrica/2025/12/10/20251210500037,서울신문
日 아오모리현 ‘7.5’ 강진…대만인 관광객 ‘이 행동’에 일본인들 놀랐다,https://img.seoul.co.kr/img/upload/2025/12/10/SSC_20251210072529_N1.jpg.webp,"지난 8일 일본 아오모리현 앞 바다에서 규모 7.5의 강진이 발생한 가운데, 현지의 한 호텔에 머물던 대만인 관광객들의 대처가 소셜미디어(SNS)에서 화제가 되고 있다. 거실 높은 곳에 놓여 있던 TV가 쓰러져 다치는 상황을 방지하려는 행동이었다. 대만 연합신문망 등에 따르면 아오모리현을 찾은 대만인 A씨는 지난 8일 자신의 SNS 스레드에 “아오모리에 놀러왔다 강진과 마주쳤다”며 호텔 안에서 찍은 영상과 사진을 올렸다. 영상 속에서 대만인 관광객들은 거실 바닥에 앉아 식사를 하는 도중 거센 진동을 느꼈고, 남성 두명은 거실 테이블 위에 놓여 있는 TV로 달려갔다. TV는 일반적인 거실장보다 높은 곳에 놓여 있었다. 이들은 TV가 거실 바닥에 쓰러지지 않도록 필사적으로 TV를 붙잡는 한편, 객실 안에 다른 떨어지는 물건이나 쓰러지는 가구가 있는지 살폈다. 이어 진동이 멈추자 TV를 들어 거실 바닥에 눕혔다. 이후 이들 일행은 거실 창문을 덮고 있던 커튼을 열고 바깥 상황을 살폈다. A씨가 올린 사진을 보면 거실 테이블 위에 놓여 있던 거울이 바닥에 떨어졌고, 컵도 떨어져 산산조각났다. A씨의 게시물은 스레드에서 1만 6000여개의 ‘좋아요’를 받았고",2025-12-10,https://www.seoul.co.kr/news/international/japan/2025/12/10/20251210500006,서울신문
“호흡 멈출 뻔”…의사 엉터리 진단 후 챗GPT 켰다가 목숨 구한 10대,https://img.seoul.co.kr/img/upload/2025/12/10/SSC_20251210064849_N1.jpg.webp,"영국의 한 10대 청소년이 의사의 오진을 받은 후 인공지능(AI) 챗봇에 증상을 입력해 희귀 질환을 스스로 진단하고 목숨을 건졌다. 병원에서 이 진단이 맞다고 확인하면서 그는 생명을 위협하는 마비 증상을 막을 수 있었다. 7일(현지시간) 영국 일간지 더 선에 따르면, 칼란 이일스(17)가 희소 질환인 길랭-바레 증후군을 진단받아 응급치료를 받을 수 있었던 건 AI 챗봇인 챗GPT 덕분이었다. 칼란은 감기 증상이 좀처럼 회복되지 않고 발까지 파랗게 변하며 움직임이 힘들어지자 동네 병원을 찾았다. 담당 의사는 혈액순환 장애인 레이노 증후군이라고 진단하며 따뜻하게 지내고 장갑을 착용하라고 조언했다. 그러나 칼란은 더 심각한 문제라고 느꼈다. 여자친구를 만나고 돌아오는 버스 안에서 그는 챗GPT에 자신의 증상을 입력했다. 챗GPT는 길랭-바레 증후군일 가능성이 있다고 답했다. 길랭-바레 증후군은 신체의 면역체계가 신경을 공격하는 질환이다. 이 병은 근육 약화와 감각 이상을 일으키며 심할 경우 마비를 유발해 생명까지 위협할 수 있다. 칼란은 어머니 리안 콘스탄틴과 함께 지난 11월 응급실을 찾았다. 의료진은 챗GPT의 진단이 맞다고 확인했다. 그는 즉시 브리스",2025-12-10,https://www.seoul.co.kr/news/international/2025/12/10/20251210500005,서울신문
한국계 우주비행사 조니 김 추수감사절 음식은 ‘햇반’,https://img.seoul.co.kr/img/upload/2025/12/09/SSC_20251209180309_N1.jpg.webp,미국 항공우주국(NASA) 소속인 한국계 우주비행사 조니 김(41)이 245일간의 국제우주정거장(ISS) 임무를 마치고 9일 지구로 귀환했다. 사진은 조니 김이 지난 6일 자신의 소셜미디어에 공개한 영상에서 추수감사절 음식으로 준비했다며 CJ제일제당 햇반을 소개하는 모습. 조니 김은 햇반과 함께 김치와 스팸 등을 자신의 ‘최애 음식’으로 소개했다. 조니 김 인스타그램,2025-12-10,https://www.seoul.co.kr/news/international/USA-amrica/2025/12/10/20251210027010,서울신문
“일주일은 조심해야”… 강진 덮친 일본 첫 ‘후발 지진 주의보’,https://img.seoul.co.kr/img/upload/2025/12/10/SSC_20251210015215_N1.jpg.webp,"아오모리 앞바다서 이틀 연속 발생 7.5 거대 지진 이어 6.4 여진 잇따라 30명 부상·신칸센 중단 등 피해 속출 홋카이도 등 182개 지역 대비 당부 일본 혼슈 동북부 아오모리현 앞바다에서 지난 8일 밤 규모 7.5의 강진이 발생한 데 이어 9일 아침에도 규모 6.4의 여진이 잇따르며 피해와 긴장감이 이어지고 있다. 일본 기상청은 이례적으로 ‘후발 지진 주의 정보’를 발령하고 향후 일주일간 추가 강진 가능성에 각별한 주의를 당부했다. 일본 기상청에 따르면 전날 오후 11시 15분쯤 아오모리현 앞바다에서 규모 7.5의 강한 지진이 발생했다. 진원 깊이는 약 54㎞로, 기상청은 당초 규모를 7.2로 발표했다가 7.6으로 상향한 뒤 다시 7.5로 조정했다. 이는 지난해 1월 노토반도 지진(규모 7.6)에 맞먹는 강도다. NHK 등에 따르면 일본 정부는 이 지진으로 최소 30명의 부상자가 발생했고 주택 화재 1건이 확인됐다고 밝혔다. 도호쿠 신칸센을 비롯한 일부 열차 운행은 한때 중단됐고 수도 공급도 끊기면서 아오모리현과 홋카이도 학교 187곳이 휴교했다. 다만 원자력발전소 등 주요 원전 시설에서 중대한 이상은 보고되지 않았다. 강진 직후 아오모리·이와테",2025-12-10,https://www.seoul.co.kr/news/international/japan/2025/12/10/20251210012007,서울신문
"호주, 16세 미만 SNS 금지… 말레이시아·뉴질랜드도 추진",https://img.seoul.co.kr/img/upload/2025/12/10/SSC_20251210015217_N1.jpg.webp,"호주가 10일부터 16세 미만 청소년의 소셜미디어(SNS) 계정 사용을 금지한다. 청소년 보호를 이유로 국가가 SNS 접속을 제한하는 첫 사례로 세계 각국이 호주 모델을 주시하고 있다. 이번 조치는 플랫폼이 16세 미만 이용자의 계정 개설과 로그인을 막지 않을 경우 최대 4950만 호주달러(약 485억원)를 부과하는 내용을 담는다. 페이스북·인스타그램·틱톡 등 10개 주요 플랫폼이 우선 적용 대상이다. 이용자나 부모는 처벌 대상이 아니다. 호주 정부는 계정 보유를 막으면 알고리즘·푸시 알림 등 중독성을 높이는 기능에서 청소년을 보호할 수 있다고 설명한다. 온라인 안전 규제기관 e세이프티도 “청소년은 로그인 상태일 때 감당하기 어려운 압박과 위험에 노출될 가능성이 높다”고 했다. 이어 “이런 위험은 소셜미디어 플랫폼의 설계 방식에서 비롯되며 사용자들이 화면 앞에서 보내는 시간을 늘리게 하고 부정적이거나 불안감을 유발하거나 심리를 조종하는 콘텐츠를 접하게 될 가능성을 높인다”고 지적했다. 다만 실효성 논란은 크다. 주민등록제도가 없는 호주는 인공지능(AI)을 활용한 얼굴인식, 음성·위치정보 분석 등으로 연령을 추정해야 한다. 이 과정에서 오차가 발생해 16세",2025-12-10,https://www.seoul.co.kr/news/international/asia-oceania/2025/12/10/20251210012006,서울신문
