title,thumbnail,short_content,write_time,link,company
“결제 버튼인 줄”… 쿠팡 ‘멤버십 인상 동의’ 4.8만명 낚였다,https://img.seoul.co.kr/img/upload/2025/10/15/SSC_20251015181953_N1.jpg.webp,"쿠팡이 와우멤버십 가격을 올리면서 이용자들이 인상에 자연스럽게 ‘동의’하도록 유인한 혐의로 제재받게 됐다. 공정거래위원회는 쿠팡을 비롯해 웨이브, NHN벅스, 스포티파이에 시정명령과 총 1050만 원의 과태료를 부과하기로 했다. 15일 공정위에 따르면 쿠팡은 지난해 4월 와우멤버십 요금을 4990원에서 7890원으로 58% 인상하면서, 인상 동의를 유도하는 방식으로 구독자를 기만했다. ‘동의하고 혜택 계속 받기’ 버튼은 크고 선명하게 배치한 반면, ‘나중에 하기’는 구석에 작게 배치했다. 상품 결제 단계에는 ‘월회비 변경에 동의하고 구매하기’ 문구를 결제 버튼과 같은 형태로 넣어 이용자가 자연스럽게 동의하도록 유도했다. 이런 방식으로 최소 4만 8000여 명이 자신도 모르게 인상에 동의한 것으로 조사됐다. 쿠팡은 뒤늦게 이를 시정해 철회 신청을 한 이용자에게 환불했지만, 신청하지 않은 이도 적지 않은 것으로 보인다. 공정위는 쿠팡 외에도 웨이브, NHN벅스, 스포티파이 등 3개 사업자가 전자상거래법을 위반한 사실을 확인해 시정명령과 과태료를 부과했다. 과태료는 쿠팡 250만 원, 웨이브 400만 원, NHN벅스 300만 원, 스포티파이 100만 원이다.",2025-10-16,https://www.seoul.co.kr/news/economy/2025/10/16/20251016018007,서울신문
美서 띄우고 북유럽 공략… K방산 이끄는 한화,,"한화그룹 계열사들이 잇따라 방산 분야에서 성과를 내며 사업 기반을 넓히고 있다. 한화에어로스페이스는 14일(현지시간) 미국 워싱턴DC에서 열린 미 육군협회(AUSA) 전시회에서 제너럴 아토믹스(GA-ASI)와 단거리 이착륙(STOL) 무인기 ‘Gray Eagle-STOL’(GE-STOL) 공동개발 계약을 체결했다고 15일 밝혔다. 양사는 시제기를 개발해 2027년 초도비행, 2028년 구매국 첫 인도를 목표로 한다. 한화에어로스페이스는 엔진·랜딩기어·연료계통, 한화시스템은 항전장비를 공급한다. 또 한화에어로스페이스는 이날 스웨덴 방위사업청과 3년간 155㎜ 모듈형 추진장약(MCS) 공급을 핵심 내용으로 한 기본협약·1차 실행계약도 체결했다. 계약 규모는 약 1500억원이다. 한화오션은 이날 서울 중구 더플라자 호텔에서 열린 ‘차세대 스마트 함정 기술 연구회’에서 차세대 전략 수상함 개념을 공개했다. 파랑 관통형 선수와 텀블홈 선체를 적용해 스텔스 기능과 기동성을 높였고, 인공지능(AI) 기반 자동화로 약 70명 수준의 승조원 운용이 가능하다. 한화오션은 차세대 전략 수상함을 기본으로 한 플랫폼을 개발해, 향후 20~30년간 국내 해양 방산의 대표상품이 될",2025-10-16,https://www.seoul.co.kr/news/economy/industry/2025/10/16/20251016018006,서울신문
“美관세 이대로면 현대차 연 8.4조원 부담… 도요타는 6.2조”,,"미국이 한국에 부과한 자동차 수출 관세율이 25뉴로 유지되면 현대자동차그룹의 관세 비용이 연간 8조원을 넘겨 경쟁사들보다 더 많은 부담이 될 것이라는 분석이 나왔다. 내년에는 미국 자동차 시장이 전반적으로 부진할 것으로 보여 조속한 관세율 인하가 필요하다는 목소리가 나온다. 15일 나이스신용평가의 자동차 산업점검에 따르면 대미 자동차 수출 관세율이 현재와 같이 한국은 25뉴, 유럽연합(EU)과 일본은 15뉴로 적용되면 현대차그룹의 관세 비용은 연간 8조 4000억원으로 추산됐다. 이는 경쟁업체인 도요타(6조 2000억원), GM(7조원), 폭스바겐(4조 6000억원)을 크게 웃도는 수준이다. 나이스신용평가는 이에 따라 현대차그룹의 연간 영업이익률은 기존 9.7뉴에서 6.3뉴로 하락할 것이라고 전망했다. 영업이익률 하락 폭 역시 도요타(9.7→ 8.1뉴), GM(8.0→5.0뉴), 폭스바겐(6.0 →4.8%)보다 큰 수준이다. GM은 관세 비용과 영업이익률 하락 폭 모두에서 현대차그룹 다음을 차지했는데 대미 수출기지 역할을 하는 한국GM의 영향으로 보인다. 한국GM은 지난해 약 41만 8782대를 미국에 수출했다. 반면 한국 자동차도 일본이나 EU처럼 대미",2025-10-16,https://www.seoul.co.kr/news/economy/car/2025/10/16/20251016018004,서울신문
“中 마스가 제재 영향 미미”… 반도체 등 희토류 압박 우려엔 긴장,https://img.seoul.co.kr/img/upload/2025/10/15/SSC_20251015181954_N1.jpg.webp,"중국이 한화그룹 미국 자회사 5곳에 대한 제재로 한미 조선업 협력 프로젝트 ‘마스가’(MASGA)를 때렸지만, 국내 조선업계에 미칠 영향은 미미할 것으로 보인다. 다만 중국이 미국과 협력하는 국내 기업에 경고성 조치를 취한 만큼, 중국이 희토류를 무기로 국내 기업들을 압박할 수 있어 산업계가 촉각을 곤두세우고 있다. 유안타증권은 15일 보고서에서 “이번 제재가 현재 조선·해운 시장에 어떠한 영향도 줄 수 없다고 판단한다”며 “미국에서 만들어진 배는 원래 중국과 엮일 일이 없다”고 평가했다. 한국투자증권도 “중국이 한화그룹의 미국 자회사를 제재해서 직접적으로 끌어낼 수 있는 실익은 없다”며 “일종의 경고성 조치”라고 진단했다. 전날 급락했던 한화오션 주가도 이날 1.94% 오른 10만 5100원으로 장을 마쳤다. 정부도 이번 조치를 미중 대립 속에 ‘예상할 수 있는 일 중 하나’로 봤다. 위성락 국가안보실장은 이날 용산 대통령실에서 브리핑을 통해 “표면적 이유는 (중국 측의) 발표 속에 들어있는 것으로 이해한다”며 “공급망 부분에서 (미중간) 첨예한 대립이 있기 때문에, 중간에서 사업을 하는 한국 기업에 이런 소지는 항상 있었다고 파악하고 있다”고 설명했다",2025-10-16,https://www.seoul.co.kr/news/economy/industry/2025/10/16/20251016018005,서울신문
실업급여 8개월째 1조원 넘게 지급… 코로나 때보다 길어진 ‘고용 한파’,https://img.seoul.co.kr/img/upload/2025/10/16/SSC_20251016005935_N1.jpg.webp,"역대 최장… 1인당 일자리는 0.44개 건설·제조업 고용보험 가입자 감소 구직급여(실업급여) 지급액이 8개월 연속 1조원을 넘어서며 1995년 제도 도입 이후 최장 기록을 세웠다. 경기 둔화와 고용 한파가 이어지면서 비자발적 실직자가 좀처럼 줄지 않고 있다. 고용노동부가 15일 발표한 ‘고용행정 통계로 본 노동시장 동향’에 따르면 지난 9월 지급된 실업급여는 1조 673억원으로, 전년 동월 대비 10.9%(1048억원) 증가했다. 같은 달 신규 신청자는 8만 9000명으로, 1년 전보다 10.0%(8000명) 늘었다. 실업급여 지급액은 지난 2월(1조 728억원) 이후 8개월째 1조원대를 유지하고 있다. 코로나19 충격이 컸던 2021년 2~8월(7개월 연속)을 넘어선 것으로, 현 상황이 코로나 때보다 더 악화했다는 분석이 나온다. 구인·구직 불균형도 깊어졌다. 지난달 ‘고용24’에 등록된 신규 구직자는 37만 8000명으로 전년 동월보다 10.8%(3만7000명) 늘었지만, 기업의 신규 구인은 16만 5000명으로 3.5%(6000명) 감소했다. 구직자는 늘었지만 채용 수요가 줄면서 구인배수(구직자 1인당 일자리 수)는 0.44로, 전년 동월 대비 0.",2025-10-16,https://www.seoul.co.kr/news/economy/2025/10/16/20251016018003,서울신문
"재계 총수들, 美서 ‘스타게이트 회동’ 한다",https://img.seoul.co.kr/img/upload/2025/10/16/SSC_20251016005920_N1.jpg.webp,"우리나라 대표 기업 총수들이 스타게이트 프로젝트를 이끄는 손정의 소프트뱅크 회장의 초청으로 미국을 방문한다. 한미 양국의 후속 관세 협상 시기와 겹쳐 총수들이 협상을 지원 사격할 가능성도 있다. 15일 재계에 따르면 손 회장은 최근 삼성, SK, 현대자동차, LG그룹 총수의 미국 방문을 초청한 것으로 전해졌다. 현재 한미일 경제대화(TED) 참석차 일본에 머무는 이재용 삼성전자 회장과 정의선 현대차그룹 회장이 미국을 찾을 수 있다는 관측이 나온다. 최태원 SK그룹 회장도 이튿날인 16일 미국으로 떠날 것으로 알려졌다. 구광모 LG 회장의 합류도 거론된다. 손 회장이 오픈AI, 오라클과 함께 진행하는 스타게이트 프로젝트는 미국 전역에 인공지능(AI) 데이터센터를 구축하는 5000억 달러(700조원) 규모의 프로젝트다. 국내 기업 총수들은 손 회장과의 회동에서 스타게이트 협력을 구체화하고, 반도체·전력 등에서 추가 협력 방안을 모색할 예정이다. 삼성과 SK그룹은 최근 방한한 샘 올트먼 오픈AI 최고경영자(CEO)와 만나 스타게이트를 위한 파트너십을 맺은 바 있다. 기업 총수들의 방미 기간은 김용범 대통령실 정책실장과 김정관 산업통상부 장관의 방미 기간과 겹쳐",2025-10-16,https://www.seoul.co.kr/news/economy/industry/2025/10/16/20251016016011,서울신문
법인세 내고 세무조사 받은 한은… “이중납세 바꿔야”,https://img.seoul.co.kr/img/upload/2025/10/15/SSC_20251015180805_N1.jpg.webp,"올해 상반기 법인세 1위(실제로는 3위)로 알려져 화제가 됐던 한국은행의 ‘불필요한 이중납세 구조’를 개선해야 한다는 목소리가 높아지고 있다. 법인세 납부 대상이지만, 어차피 이익금은 법정적립금만 남기고 모두 세외수입으로 정부에 납부하고 있기 때문이다. 게다가 국세청의 세무조사를 받으며 중앙은행의 독립성을 침해당하고 있고, 관련 세무비용도 수천만원이 들어 혈세 낭비라는 지적이 나온다. 15일 차규근 조국혁신당 의원실에 따르면, 한은은 최근 10년간 2018년과 2022년(2022년 10월 27일~2023년 3월 3일) 두 차례에 걸쳐 국세청의 정기세무조사를 받았다. 이 과정에서 2018년엔 법인세 등 12억원, 2023년엔 법인세와 부가세 등 36억 7000만원을 추가로 납부했다. 법인세 등 납부를 위한 세무 관련 비용도 2015년 1712만원에서 해마다 꾸준히 늘어나 2024년엔 3638만원까지 증가했다. 여기엔 국세청 세무조사에 대응하기 위해 회계법인을 선임한 용역비도 포함돼 있다. 세무조사 관련 회계법인 용역비는 2018년 1억 2100만원, 2022년 3억 5200만원이 들어갔다. 한은은 통화신용정책의 수립·집행을 위해 무자본 특수법인으로 설립됐다",2025-10-16,https://www.seoul.co.kr/news/economy/2025/10/16/20251016016010,서울신문
"SSG닷컴, 성수동서 ‘미지엄 페스타’… 먹거리·뷰티 쇼핑객 북새통",,"15일 오후 서울 성동구 성수동에서 열린 SSG닷컴 ‘미지엄 페스타’ 현장은 두 손 가득 먹거리와 뷰티 상품을 든 인파로 붐볐다. 4층 건물 통째로 꾸민 행사장에는 식품과 화장품 브랜드 100여곳이 참여했는데, 저마다 신제품 시식이나 할인, 증정품 이벤트 등을 진행하고 있었다. 한 뷰티 브랜드 부스는 체험객이 몰려 ‘대기 35분’ 안내문이 붙을 정도였다. 평소 뷰티 팝업 행사에 자주 다닌다는 20대 관람객 김민지 씨는 “SSG닷컴을 평소에 이용하진 않지만 SNS를 통해 행사를 알았다”면서 “식품 시식을 다양하게 해볼 수 있어서 만족스러웠다”고 말했다. 이커머스인 SSG닷컴이 오프라인 팝업 행사를 연 것은 처음이다. 그동안 신세계 주력 계열사인 이마트와 신세계백화점의 온라인 창구 성격이 짙었지만, 팝업을 통해 고객 접점을 확대하고 플랫폼 신뢰도를 높이겠다는 전략이다. 실제로 커피 전문점 ‘카멜 커피’, 뷰티 브랜드 ‘겔랑’ 등 참여 브랜드 중 절반인 49곳은 첫 플랫폼 연계 오프라인 팝업이고, 유명 셰프와 단독 협업해 출시한 간편식을 선보이는 등 SSG닷컴만의 상품 경쟁력과 운영 노하우를 강조했다. 이마트와의 시너지 전략도 눈에 띄었다. 행사장 2층에 ‘이마트",2025-10-16,https://www.seoul.co.kr/news/economy/distribution/2025/10/16/20251016016008,서울신문
벨기에펀드 900억 규모 불완전 판매 ‘의혹’… 한투·KB·우리은행 투자자 얼마나 배상받나,,"‘벨기에 정부기관이 임차해 안전하다’는 설명으로 판매된 900억원 규모 부동산펀드가 전액 손실을 내자 금융감독원이 불완전판매 의혹에 대한 현장검사에 착수했다. 15일 금융당국에 따르면 금감원은 이날부터 한국투자증권·KB국민은행·우리은행 등 벨기에펀드 판매사 3곳을 대상으로 판매 절차를 점검하고 있다. 한국투자증권이 약 589억원어치를 판매해 최대 판매사로 확인됐고, KB국민은행(200억원)과 우리은행(120억원)이 뒤를 이었다. 이번 조사는 ‘소비자 보호 강화’를 최우선 과제로 내세운 이찬진 금감원장이 직접 지휘하는 첫 펀드 검사다. 문제가 된 ‘한국투자 벨기에 코어오피스 부동산투자신탁 2호’는 2019년 한국투자리얼에셋운용이 설정한 공모형 부동산펀드로, 벨기에 브뤼셀의 정부 임차 오피스 장기임차권에 투자했다. 국내에서 약 900억원을 공모로 모은 뒤 현지 대출을 더해 1900억원 규모로 매입했으나 금리 상승과 유럽 부동산 경기 악화로 매각이 무산되며 투자금이 전액 손실처리됐다. 투자자 피해가 확산되면서 판매 과정의 문제와 배상 책임을 둘러싼 논란도 커지고 있다. ‘정부기관 임차’ ‘임대율 100%’ 등을 내세워 안전성을 강조했지만 실제로는 대출 비중이 높",2025-10-16,https://www.seoul.co.kr/news/economy/finance/2025/10/16/20251016016009,서울신문
30대 그룹 사내이사 1269명 곧 임기 만료… 인사 태풍 거세지나,,"대표이사 직함 단 CEO 47% 달해 4대 그룹 대표이사 100여명 ‘임박’ SK 47·삼성 21·LG 20·현대차 19명 이재용 회장 사내이사 복귀 관심 “불확실성 커… 소폭 인사 가능성도” 대기업들이 연말 정기 인사를 앞둔 가운데 국내 30대 그룹에서 임기가 곧 끝나는 사내이사가 1260여명에 이르는 것으로 파악됐다. 삼성, SK, 현대차, LG 등 4대 그룹에서도 대표이사급 최고경영자(CEO) 100여명이 임기 만료를 앞두고 있어 이들의 거취가 주목된다. 15일 헤드헌팅 전문기업 유니코써치가 공정거래위원회 지정 대기업 집단 중 자산 순위 상위 30개 그룹의 계열사를 대상으로 조사한 결과, 내년 상반기 중 임기가 종료되는 사내이사는 1269명인 것으로 나타났다. 이 중 대표이사 직함을 단 CEO급 경영자는 47%(596명)였다. 연임 혹은 자리 이동, 퇴임 등 이들의 거취에 따라 미등기 임원 인사의 폭도 크게 달라질 것으로 보인다. 4대 그룹에서는 SK그룹이 임기 만료를 앞둔 사내이사가 99명으로 가장 많았고, 이 중 47명이 대표이사급이었다. 삼성은 48명(대표이사 21명), LG 39명(20명), 현대차 34명(19명) 순으로 파악됐다. 삼성전자의",2025-10-16,https://www.seoul.co.kr/news/economy/industry/2025/10/16/20251016016007,서울신문
"‘19금 챗GPT’ 풀린다, AI 윤리·규제 논란 확산 [INTO]",https://img.seoul.co.kr/img/upload/2025/10/15/SSC_20251015181510_N1.jpg.webp,"올트먼 CEO “콘텐츠 범위 확대 성인 인증하면 성애물까지 생성” 유료 구독자 늘려 수익 향상 전략 캘리포니아주 아동·청소년 대상 내년부터 AI 챗봇 사용 제한 시행 한국은 AI 콘텐츠 규제 사각지대 2024년 2월 미국 플로리다주에서 방에 틀어박혀 지내던 14세 소년 슈얼 세처가 스스로 세상을 등졌다. 그는 생전 상담 치료에서 불안장애 등을 진단받았지만 비극적 선택을 할 것이라고 예측한 주변인은 아무도 없었다. 세처의 부모는 사후에야 그가 방에서 인공지능(AI) 챗봇(캐릭터닷AI) 여자친구와 성적인 대화를 나누며 대부분의 시간을 보냈다는 사실을 알고 경악했다. TV 시리즈 ‘왕좌의 게임’ 속 캐릭터가 모델인 챗봇은 세처에게 “사랑한다. 가능한 한 빨리 내게 와 줘”라고 말했고, 얼마 지나지 않아 세처는 숨진 채 발견됐다. 글로벌 AI 서비스 업체들이 성적인 대화, 성애물 등 ‘19금(禁)’ 콘텐츠를 본격 허용하면서 미성년자 접근 제한, 자살·혐오 방지 등 AI 윤리·규제 논란이 한층 가열되고 있다. 미국은 연방정부와 개별 주정부들이 각각 규제 법안을 내놓고 있는 반면 한국은 AI 콘텐츠가 규제 사각지대에 방치돼 있어 대책 마련이 시급한 것으로 지적된",2025-10-16,https://www.seoul.co.kr/news/international/2025/10/16/20251016002002,서울신문
"국토부 홈피 마비, 은행 대출상담 북새통… 부동산 규제 ‘패닉’",https://img.seoul.co.kr/img/upload/2025/10/16/SSC_20251016012557_N1.jpg.webp,강북 “강남도 아닌데 규제 날벼락” 취득세 오르기 전 계약 서두르기도 “전세대출 제한에 주거비 부담 우려” “대책 발표 후에 1억원을 내리겠다는 물건이 나왔지만 이제는 매수자가 거부를 한다.”(서울 동대문구 A공인중개소 관계자) 15일 정부의 ‘10·15 부동산 대책’이 발표된 후 서울 부동산 현장은 그야말로 ‘패닉’에 빠졌다. 서울 전역이 규제지역으로 묶이자 집값이 높지 않은 강북 지역에선 계약 취소 소식과 함께 집값 상승세도 꺾이며 “강남과 비교하면 아직 집값이 한참 낮은데 강남권 규제를 적용한다니 이게 무슨 날벼락이냐”는 불만 섞인 반응이 나왔다. 당장 16일에 규제지역으로 지정되면 대출이 줄거나 1주택 이상 보유자는 취득세가 8~12%로 늘어나 그 전에 계약을 앞당기려는 모습도 나타났다. 서울 영등포구의 한 공인중개사는 “저가 아파트는 대출에 큰 문제가 없어도 취득세가 8배가 되는데 (규제지역으로 묶이면) 어떻게 매수를 하겠느냐”며 “매도자가 다음주에 외국에서 오면 계약하기로 했는데 바로 오늘 전자계약으로 진행했다”고 전했다. 부동산 대책 관련 자료를 내려받으려는 접속자가 몰리면서 국토교통부 홈페이지는 진행 속도가 느려지는 등 접속 장애가 지속됐다,2025-10-16,https://www.seoul.co.kr/news/economy/finance/2025/10/16/20251016004004,서울신문
15일까지 대출·계약엔 기존 규정… 20일부터 2년간 실거주 의무 부과,https://img.seoul.co.kr/img/upload/2025/10/16/SSC_20251016062813_N1.jpg.webp,"비주택담보대출 LTV 40%로 생애최초 구입, LTV 70% 유지 생활자금·중도금 목적 대출 제외 대출·세제·청약 등을 총망라한 10·15 주택시장 안정화 대책으로 16일부터 규제지역에서 유주택자는 대출 0원, 무주택자가 1주택을 사더라도 집값이 25억원을 넘으면 2억원까지만 대출이 가능하다. 오는 29일부터는 전세대출도 빚에 포함된다. 10·15 대책의 핵심 내용을 일문일답 형식으로 정리했다. Q. 대책별 시행일은. A. 16일부터 무주택자의 주택담보대출비율(LTV)은 70%에서 40%로 강화되고, 유주택자는 대출이 전면 금지된다. 수도권과 규제지역 내 주택담보대출(주담대)에 적용되는 스트레스 금리는 1.5%에서 3.0%로 상향돼 대출 여력이 약 10% 줄며, 1주택자가 추가 주택을 매입하면 취득세가 1%(6억원 이하)에서 8%로 급등한다. 규제지역 내 주택은 3년간 전매가 제한된다. 20일부터는 서울 전역이 토지거래허가구역으로 지정돼 2년간 실거주 의무가 부과되고, 꼬마빌딩 등 비주택담보대출 LTV도 70%에서 40%로 강화된다. 29일부터는 1주택자의 전세대출 이자 상환분이 총부채원리금상환비율(DSR) 산정에 포함된다. Q. 15일까지 대출받으면",2025-10-16,https://www.seoul.co.kr/news/economy/2025/10/16/20251016004003,서울신문
베선트 美재무 “한국과 무역협상 마무리 단계”,https://img.seoul.co.kr/img/upload/2025/10/16/SSC_20251016012107_N1.png.webp,김용범·구윤철·김정관 등 미국행 김 실장 “APEC 때 관세 타결 목표” 스콧 베선트 미국 재무부 장관은 15일(현지시간) 한국과의 무역 협상이 마무리 단계라고 밝혔다. 베선트 장관은 이날 CNBC 방송에 출연해 현재 어떤 무역 협상에 가장 집중하고 있느냐는 질문에 “내 생각에 우리는 한국과 마무리하려는 참”이라고 답했다. 이어 한국의 3500억 달러(약 498조원) 미국 투자를 두고 이견이 있지 않으냐는 추가 질문에 “악마는 디테일에 있지만 우리는 디테일을 해결하고 있다”고 설명했다. 관세 협상 후속 조치 협의를 위해 16일 미국을 방문하는 김용범 대통령실 정책실장이 15일 “아시아태평양경제협력체(APEC) 기간 타결이 목표”라고 밝혔다. APEC 계기 타결론<서울신문 10월 10일자>을 공식화한 것이다. 3500억 달러(약 499조원) 규모의 대미 투자 패키지 구체화 방안을 놓고 교착 상태에 빠진 상황에서 김정관 산업통상부 장관도 김 실장과 함께 출국한다. 구윤철 부총리 겸 기획재정부 장관은 하루 앞선 이날 워싱턴으로 출국했다. 한국경제 수뇌부가 총출동해 ‘집중 협상’을 벌이게 되는 만큼 협상 타결의 분수령이 될 것이란 전망이 나온다. 김,2025-10-16,https://www.seoul.co.kr/news/economy/2025/10/16/20251016001005,서울신문
"서울·분당·과천·하남, 전세 끼고 집 못 산다",https://img.seoul.co.kr/img/upload/2025/10/15/SSC_20251015181522_N1.jpg.webp,"25억 넘는 집 주담대 2억 제한… 1주택자 전세대출도 DSR 적용 서울 전체·경기 12곳 토허구역 지정 ‘갭 투자’ 막아 풍선효과 원천 봉쇄 15억~25억 주택, 대출 4억으로 축소 서울 25개 자치구와 분당·과천·하남 등 경기 12개 지역이 규제지역(조정대상지역 및 투기과열지구)으로 확대 지정되고 토지거래허가구역(토허구역)으로도 묶인다. 이 지역에선 오는 20일부터 전세를 낀 매매(갭 투자)가 금지되고 2년 실거주 요건을 충족해야 한다. 대출 규제도 추가됐다. 25억원 초과 주택에 대한 주택담보대출(주담대) 한도가 2억원으로 줄어들고, 신용대출을 1억원 넘게 받으면 1년간 규제지역에서 주택을 살 수 없다. 국토교통부·기획재정부·금융위원회·국무조정실·국세청은 15일 정부서울청사에서 부동산관계장관회의를 열고 이런 내용의 ‘주택시장 안정화 대책’을 발표했다. 6·27 대출 규제와 9·7 공급 대책에도 수도권 집값이 잡히지 않자 이재명 정부가 한 달여 만에 초강력 규제를 망라한 세 번째 대책을 내놓은 것이다. 이번에는 제외됐지만 효과가 없을 경우 보유세 강화 등 추가 규제도 예고했다. 정부는 조정대상지역·투기과열지구·토허구역 등 ‘3중 규제지역’을 현재의",2025-10-16,https://www.seoul.co.kr/news/economy/estate/2025/10/16/20251016001004,서울신문
