title,thumbnail,short_content,write_time,link,company
"李대통령 “처벌 중심 기업 규제, 대대적으로 바꿀 것”",https://img.seoul.co.kr/img/upload/2025/09/15/SSC_20250915181021_N1.jpg.webp,"“투자 결정 잘못하면 배임죄 감옥 처벌 조항 너무 많고 효과는 없어 직속 규제합리화위원회 만들 것” 이재명 대통령이 15일 배임죄 등 경제 형벌과 관련해 “대한민국에는 처벌 조항이 불필요하게 너무 많고 효과도 별로 없다. 에너지만 엄청나게 든다”며 “이런 것들을 대대적으로 한번 바꿔 볼 생각”이라고 밝혔다. 이 대통령은 이날 서울 한국과학기술연구원(KIST)에서 열린 ‘제1차 핵심규제 합리화 전략회의’를 주재하면서 이같이 말했다. 이 대통령은 기업 규제가 지나치게 처벌 중심이라고 지적했다. 이 대통령은 “얼마 전 미국에서 한국 사람들에게 비자 심사나 출입국 신고를 할 때 처벌받은 전과가 있는지 자료를 내라고 했다고 한다”고 전했다. 이어 “우리나라는 전과자가 너무 많다. 민방위기본법, 예비군설치법, 산림법 등 벌금 5만~10만원 내고 기록은 평생 가는 게 너무 많다”며 “이걸 저쪽에서 보면 ‘처벌받았다니 엄청난 범죄자구나’라고 생각한다”고 했다. 또 배임죄도 언급하며 “기업인들이 외국에 투자할 때 ‘한국은 가서 투자 결정 잘못하면 감옥 가는 수가 있다’고 얘기한다고 한다”며 “(외국 기업인들에게는) 상상도 못 할 일”이라고 지적했다. 이 대통령은 기업 규",2025-09-16,https://www.seoul.co.kr/news/politics/president/2025/09/16/20250916009008,서울신문
‘갯벌 순직’ 은폐 의혹 김용진 해경청장 사의,https://img.seoul.co.kr/img/upload/2025/09/15/SSC_20250915194148_N1.jpg.webp,"갯벌에 고립된 70대 중국인 A씨를 구하다 순직한 고 이재석(34) 경사의 출동 과정에서 해경의 부실 대응과 은폐 의혹이 불거진 가운데 내부 상황보고서에는 이 경사의 지원 요청 사실이 누락된 것으로 15일 파악됐다. 사고 뒤에는 “사실을 말하지 말라”는 지시가 내려졌다는 증언까지 나왔다. 사건 은폐 의혹이 확산되면서 김용진 해양경찰청장은 이날 사의를 표했다. 서울신문이 이날 국회 농림축산식품해양수산위원회 소속 정희용 국민의힘 의원실을 통해 확보한 인천해경 영흥파출소 상황보고서 및 녹취록을 보면 이 경사는 사건 당시인 지난 11일 오전 2시 43분 현장 지원 요청을 했지만 이 내용은 상황보고서에 기록되지 않았다. 보고서에는 오전 2시 30분 ‘이 경장이 영흥도 안도 인근에 도착했고, 사람이 보이지 않아 안도 쪽으로 도보 이동(발목 수심)’, 오전 3시 ‘이 경장, 요구조자와 상봉 외근조끼 입히고 육지로 이동 시작(배꼽 수심)’이라는 내용만 기재됐다. 그사이 있었던 이 경사의 인력 충원 요청은 누락된 것이다. 당일 무전 기록에 따르면 이 경사는 당일 오전 2시 43분 “물이 차올라서 (인력이) 조금 필요할 것 같다”며 “발목 정도 차오르거든요”라고 인력 지원",2025-09-16,https://www.seoul.co.kr/news/politics/2025/09/16/20250916001006,서울신문
국회 복귀한 조국 “성 비위 피해자 치유·제도 개선할 것”,https://img.seoul.co.kr/img/upload/2025/09/15/SSC_20250915180943_N1.jpg.webp,"조국 조국혁신당 비상대책위원장이 15일 오전 국회에서 열린 비대위 첫 회의에 참석하고 있다. 9개월 만에 국회로 복귀한 조 위원장은 성 비위 사건에 대해 “책임지고 피해자 상처 치유, 온전한 보상, 재발 방지, 제도 개선을 하겠다”고 밝혔다.",2025-09-16,https://www.seoul.co.kr/news/politics/congress/2025/09/16/20250916008007,서울신문
"장동혁 “유죄 재판 뒤집기 나선 李대통령, 명백한 탄핵 사유”",https://img.seoul.co.kr/img/upload/2025/09/15/SSC_20250915180805_N1.jpg.webp,국민의힘은 15일 더불어민주당이 조희대 대법원장 사퇴를 압박하고 대통령실이 여기에 동조하는 듯한 모습을 보이자 “이재명 대통령 유죄 재판 뒤집기에 나선 것”이라고 비판했다. 대통령실의 메시지에 장동혁 국민의힘 대표는 “명백한 탄핵 사유”라고 말했다. 정부 출범 후 국민의힘이 이 대통령의 탄핵을 언급한 것은 처음이다. 장 대표는 이날 국회에서 기자들과 만나 “헌법에 임기가 보장된 대법원장이 마음에 들지 않는다며 사퇴하라고 외치는 민주당의 저열한 목소리에 대통령이 원칙적으로 공감한다고 표현했다면 저는 명백한 탄핵 사유라 생각한다”고 말했다. 이어 장 대표는 “대법원을 향해 ‘내 공직선거법 사건을 유죄로 판결했으니 당신 물러나라’라고 하는 게 반헌법이 아니면 도대체 무엇이 반헌법이냐”며 “명백한 탄핵 사유”라고 거듭 강조했다. 앞서 부산 현장최고위원회의에서도 이 대통령을 겨냥해 “유무죄가 바뀔 가능성은 0%”라며 “그것이 두려운 대통령실은 지금 조 대법원장을 사퇴시키고 그 이전의 유죄판결을 뒤집으려 할 것”이라고 말했다. 내란특별재판부 추진과 관련해서도 장 대표는 “무엇이 위헌이냐는 인식을 가지고 민주당에 더 속도를 내라는 보이지 않는 명령을 한 것 아닌가”라,2025-09-16,https://www.seoul.co.kr/news/politics/2025/09/16/20250916004005,서울신문
野 대정부질문 맞받아친 김민석 총리 “내년 선거 출마 생각 없다”,https://img.seoul.co.kr/img/upload/2025/09/15/SSC_20250915180921_N1.jpg.webp,이재명 정부 출범 후 첫 국회 대정부질문이 진행된 15일 더불어민주당은 ‘내란 청산’을 강조하며 야당을 압박했다. 국민의힘은 정부와 여당을 겨냥해 ‘독재 정권’이라며 맞섰고 민주당 지도부를 향해선 이재명 대통령에 대한 탄핵소추안 발의를 제안해 장내에서 잠시 소란이 벌어지기도 했다. 다만 국무위원들은 의원들 질의에 비교적 차분하게 대응하는 모습을 보였다. 김민석 국무총리는 이날 남색 정장 차림에 ‘통합’을 상징하는 줄무늬 넥타이를 매고 대정부질문에 참석했다. 김 총리는 임이자 국민의힘 의원의 ‘내년 지방선거에 출마하느냐’는 질문에도 한동안 웃음을 짓고는 “그것을 왜 물어보느냐”고 되물었다. 이어 “생각이 없다”고 답하기도 했다. 정청래 민주당 대표와 동반 사퇴할 생각이 없느냐는 물음에도 미소로만 답했다. 김 총리를 비롯한 국무위원들은 비교적 야당 의원들의 공세에도 차분하게 답하며 ‘저자세 모드’를 유지했다. 이 대통령이 ‘선출 권력에 대한 존중’을 강조한 만큼 최대한 신중한 모습을 보인 것으로 풀이된다. 다만 곽규택 국민의힘 의원이 ‘국가 부채 문제는 총리처럼 쉽게 개인이 스폰서에게 돈을 빌리고 이런 게 아니지 않으냐’며 김 총리의 인사청문회 과정에서 나온,2025-09-16,https://www.seoul.co.kr/news/politics/congress/2025/09/16/20250916006004,서울신문
함께 입장하는 민주 투톱,https://img.seoul.co.kr/img/upload/2025/09/15/SSC_20250915180900_N1.jpg.webp,3대 특검법 개정안 합의를 두고 ‘투톱 갈등’을 겪었던 정청래(왼쪽) 더불어민주당 대표와 김병기 원내대표가 15일 함께 웃으며 나란히 국회에서 열린 최고위원회의에 입장하고 있다.,2025-09-16,https://www.seoul.co.kr/news/politics/2025/09/16/20250916004004,서울신문
李대통령 취임 104일 만에 내각 완성… 대·현·동 전진 배치,https://img.seoul.co.kr/img/upload/2025/09/11/SSC_20250911202122_N1.jpg.webp,"이재명 대통령이 15일 최교진 교육부 장관, 원민경 여성가족부 장관 등에게 임명장을 수여하면서 취임 104일 만에 1기 내각 구성을 완료했다. 이재명 정부의 첫 인선 코드는 대기업 출신과 현역 국회의원, 이 대통령의 사법연수원 18기 동기의 약진이 두드러진 ‘대·현·동 인사’로 요약된다. 이재명 정부 1기 내각에서 대기업 출신은 장관급만 4명에 달한다. 통상 백지 신탁 등 문제로 기업인 입각이 극소수였던 과거 정부들과 구별된다. 현역 의원 출신 장관은 7명으로 김대중 정부 이후 역대 최대 규모다. 또 이 대통령의 연수원 동기들은 법무 분야뿐 아니라 외교, 교육, 금융감독 등 각 분야에 포진했다. 이날 이 대통령과 사시 28회·연수원 18기 동기인 차지훈 법무법인 화우 변호사는 이재명 정부 초대 주유엔 대사에 임명됐다. 연수원 동기인 차정인 국가교육위원장도 이날 임명됐다. 앞서 임명된 정성호 법무부 장관, 조원철 법제처장, 이찬진 금융감독원장, 위철환 중앙선거관리위원회 위원 후보자 등도 연수원 동기다. 이재명 정부의 첫 민정수석이었던 오광수 전 수석도 마찬가지다. 아울러 이 대통령의 사건 변호인도 대거 주요 공직을 맡으면서 ‘법연’이 정부 첫 인선에 주요하",2025-09-16,https://www.seoul.co.kr/news/politics/president/2025/09/16/20250916006003,서울신문
외교부 “B1비자 확대 美와 협의”… 트럼프 “대미 투자 위축 안 돼”,https://img.seoul.co.kr/img/upload/2025/09/15/SSC_20250915180335_N1.jpg.webp,"한국 근로자 구금 사태를 계기로 정부는 B1(단기상용) 비자 해석을 더 유연하게 하는 등의 방안을 미국과 우선 협의할 계획이라고 밝혔다. 또 구금 시설에서 인권 침해 등이 있었는지를 전수조사해 필요할 경우 미측에 추가로 문제 제기를 하기로 했다. 외교부 당국자는 15일 기자들과 만나 “이 문제에 대해 한미 간에 근본적으로는 (비자 제도의) 구조적 문제에서 비롯됐다는 인식을 같이한다”며 “전화위복의 계기로 삼기 위해서 이 문제와 관련된 여러 사례를 기록화하려고 하며 미측과의 여러 계기에 이 문제를 꺼낼 것”이라고 말했다. 이 당국자는 “이미 현지에 B1 비자를 받고 가신 분들도 많기 때문에 당장은 B1 체류 자격에 대한 해석을 미측과 적극적으로 교섭해서 최대한 광범위한 방향으로 협의해야 하지 않을까 생각한다”며 “(비자 제도 개선을 위한) 한미 워킹그룹 협의가 시작된다면 제일 우선적으로 논의될 의제”라고도 전했다. B1 비자는 기계·설비 작업이나 현지 인력 교육·훈련 목적으로 체류는 허용하지만 직접적인 육체 노동은 금하고 있다. 이번 구금 사태와 관련해서도 우리 정부는 근로자들이 B1 비자 목적에 맞게 체류했다고 항의했으나, 미 이민세관단속국(ICE)은 구",2025-09-16,https://www.seoul.co.kr/news/politics/diplomacy/2025/09/16/20250916002004,서울신문
‘조희대 사퇴론’ 용산도 힘 실었다,https://img.seoul.co.kr/img/upload/2025/09/15/SSC_20250915182844_N1.jpg.webp,"대통령실 “이유 돌이켜 봐야” 공감 정청래 “대법원장 탄핵 대상 아닌가” 대통령실이 15일 여당의 조희대 대법원장 사퇴 요구와 관련해 “그 요구에 대한 개연성과 이유를 돌이켜 봐야 될 필요가 있다”고 밝혔다. 여당의 사퇴 요구에 공감을 표하면서 대통령실이 조 대법원장 사퇴 압박에 가세한 것으로 풀이된다. 여당에서는 조 대법원장에 대한 탄핵도 다시 거론됐다. 강유정 대통령실 대변인은 이날 오전 8시 50분쯤 브리핑에서 더불어민주당 소속 추미애 국회 법제사법위원장의 ‘대법원장 공개 사퇴 요구’와 관련한 입장을 묻자 이같이 밝혔다. 강 대변인은 “특별한 입장은 없다”면서도 “국회가 어떤 숙고와 논의를 통해서 헌법 정신과 국민의 뜻을 반영하고자 한다면 가장 우선시되는 그런 국민의 선출 권력”이라고 말했다. 이어 “그리고 그 부분에 대해서 그런 시대적인, 국민적인 요구가 있다면 임명된 권한으로서는 한편으로 그 요구의 개연성과 그 이유에 대해서는 좀 돌이켜 봐야 될 필요가 있지 않나라는 점에서는 아주 원칙적으로 공감하고 있다”고 말했다. 생중계 브리핑에서 나온 강 대변인의 발언은 여당 내의 조 대법원장 사퇴 요구에 대통령실이 ‘원칙적으로 공감’하고 있다는 의미로 풀",2025-09-16,https://www.seoul.co.kr/news/politics/2025/09/16/20250916001004,서울신문
"배현진, 국민의힘 서울시당위원장 당선",https://img.seoul.co.kr/img/upload/2025/09/15/SSC_20250915220005_N1.png.webp,"국민의힘 서울시당위원장으로 배현진(재선·송파을) 의원이 15일 당선됐다. 국민의힘은 이날 서울시당대회를 열고 시당 대의원 대상으로 ARS 투표를 실시한 결과 배 의원이 서울시당위원장에 선출됐다고 밝혔다. 투표율은 59.9%로, 대의원 총 4108명 가운데 2461명이 투표에 참여했다. 배 의원은 45.10%(1110표)의 득표율로 당선됐다. 경쟁 상대였던 조정훈(재선·마포갑) 의원은 43.07%(1060표)를 기록해 2.03%포인트(50표)차로 석패했다. 강성만 금천구 당협위원장은 11.83%(291표)에 그쳤다. 배 의원은 중앙당 최고위원회의 승인을 거쳐 공식 임기를 시작할 예정이다.",2025-09-15,https://www.seoul.co.kr/news/politics/2025/09/15/20250915500329,서울신문
토허제 외국인 거래 중국인 ‘최다’...전체의 80% ↑,https://img.seoul.co.kr/img/upload/2025/09/15/SSC_20250915214457_N1.jpg.webp,"정부가 실거주 목적이 없는 외국인을 상대로 수도권 주택 매입을 사실상 차단한 가운데 지난 5년간 토지거래허가구역 내 외국인 부동산 거래의 80% 이상이 중국인인 것으로 나타났다. 국회 국토교통위원회 소속 안태준 더불어민주당 의원이 국토교통부로부터 제출받은 자료에 따르면 최근 5년간(2020년~2025년 7월) 토지거래허가구역 내 외국인 부동산 거래 허가는 총 3756건인 것으로 집계됐다. 이 가운데 중국 국적은 3055건으로 전체의 81.3%를 차지했다. 뒤이어 미국 국적은 408건(10.9%), 캐나다 국적은 90건(2.4%) 순으로 나타났다. 거래 목적으로는 실거주가 3523건으로 전체의 93.8%를 차지하며 가장 많았고, 이어 임대용이 105건(2.8%), 농업용이 69건(1.8%)으로 집계됐다. 소재지는 경기도가 3588건(95.5%), 서울시가 154건(4.1%), 제주시가 13건(0.3%)으로 나타났다. 특히 2021년에는 전체 외국인 부동산 거래 가운데 70%인 2592건이 몰렸다. 이는 이재명 당시 경기지사가 경기도 전역에 대한 외국인과 법인에 대한 토허제를 실시한 영향으로 분석됐다. 정부는 지난달 26일 외국인의 무분별한 주택 매입을 억",2025-09-15,https://www.seoul.co.kr/news/politics/2025/09/15/20250915500328,서울신문
"장동혁 “李, 강원도민이 선택한 김진태 차별”…金 “고맙다는 말도 못 해”",https://img.seoul.co.kr/img/upload/2025/09/15/SSC_20250915190620_N1.jpg.webp,"지난 12일 강원도 춘천에서 열린 강원타운홀미팅에서 이재명 대통령이 국민의힘 소속 김진태 강원지사에게 발언권을 주지 않은 것을 두고 후폭풍이 계속되고 있다. 장동혁 국민의힘 대표는 15일 “노골적인 지역 차별, 야당 차별”이라고 비판했고, 김 지사는 “강릉 가뭄 현장 방문에 고맙다고 말하려고 했다”며 아쉬움을 토로했다. 장 대표는 이날 부산 현장 최고위원회의에서 “강원도를 대표하는 강원지사가 두 차례나 발언권을 요청했지만, 대통령은 끝내 발언권을 막았다”며 “민주당 소속 당협위원장에게는 마이크를 주면서 강원도민의 선택을 받은 도지사의 마이크는 빼앗은 것이다. 이것이야말로 노골적인 지역 차별이고, 야당 차별이다”라고 지적했다. 장 대표는 지난 7월 부산타운홀미팅 때 국민의힘 소속 박형준 부산시장도 마이크를 잡지 못한 것을 거론하며 “박 시장을 선출해 준 부산시민의 민심을 무시한 것”이라고 비판했다. 이어 장 대표는 “이재명 정권은 온갖 권력과 힘을 동원해서 우리당 소속 광역단체장과 지방행정을 탄압하고 있다”며 “얼마 전 경찰이 우리당 소속 인천시장을 불구속 입건하고, 인천 시청을 압수수색했다. 민주당은 허황한 거짓 선동에 엮어보고자 우리당 소속 광역단체장",2025-09-15,https://www.seoul.co.kr/news/politics/2025/09/15/20250915500317,서울신문
굳은 표정으로 법원 나서는 조희대 대법원장,https://img.seoul.co.kr/img/upload/2025/09/15/SSC_20250915182844_N1.jpg.webp,조희대 대법원장이 15일 서울 서초구 대법원 청사를 나서고 있다. 이날 더불어민주당 지도부는 조 대법원장에 대한 사퇴 요구를 강화했다.,2025-09-15,https://www.seoul.co.kr/news/politics/2025/09/15/20250915500311,서울신문
장동혁 “與 일당독재 야욕 부화뇌동”…檢 패스트트랙 구형 비판,https://img.seoul.co.kr/img/upload/2025/09/15/SSC_20250915181201_N1.jpg.webp,"장동혁 국민의힘 대표는 15일 “검찰이 권력 앞에서 권력의 시녀가 돼 야당 의원들에 대해 상상할 수 없는 중형을 구형했다”며 “대한민국을 일당 독재로 만들겠다는 야욕에 부화뇌동하는 것”이라고 비판했다. 검찰이 ‘국회 패스트트랙(신속처리안건) 충돌 사건’으로 기소된 나경원 의원 등 국민의힘 소속 의원들에 대해 의원직 상실에 해당하는 실형을 구형한 데 따른 것이다. 장 대표는 이날 국회에서 기자들과 만나 “패스트트랙 사건은 연동형 비례대표제와 관련된 공직선거법, 고위공직자범죄수사청(공수청) 설치 법안을 막기 위한 것이었다”며 “연동형 비례대표제는 실패한 법 개정으로 확인됐고, 지금의 공수처는 태어나지 말았어야 할 기관이란 것이 명확해졌다”고 말했다. 그러면서 “그때 패스트트랙에서 싸웠던 우리 당 의원들은 개인적 이익, 우리 당의 이익이 아니라 대한민국을 위해 싸웠던 분들”이라며 “그 행위와 죄질과 어떤 균형도 맞지 않는 구형”이라고 지적했다. 장 대표는 “검찰은 여전히 권력 앞에 시녀 노릇을 하고 있다”며 “(정부·여당이) 권력을 위해 시녀 노릇 했던 자신들을 향해 칼을 들고 심장과 가슴을 계속 찔러대면서 검찰을 해체하겠다고 하고 있는데, 검찰은 아직도 무슨",2025-09-15,https://www.seoul.co.kr/news/politics/2025/09/15/20250915500309,서울신문
독립기념관장에 직접 칼 빼든 보훈부…“권한 최대한 행사할 것”,https://img.seoul.co.kr/img/upload/2025/09/15/SSC_20250915175616_N1.jpg.webp,국가보훈부가 광복절 경축식 기념사와 관련해 논란이 일고 있는 김형석 독립기념관장에 대해 감사를 실시할 계획이라고 15일 밝혔다. 권오을 국가보훈부 장관은 이날 서울 용산구 서울지방보훈청에 김 관장 문제를 항의하기 위해 찾아온 국회 정무위원회 소속 강준현·김용만·이강일·이정문 더불어민주당 의원과 만나 “국가보훈부가 할 수 있는 관리·감독권을 최대한 행사하겠다”며 자체적으로 특정감사를 실시하기로 했다. 앞서 국가보훈부는 감사원에 공문을 보내 독립기념관장에 대한 감사를 요청한 바 있다. 그러나 감사원 감사는 기약을 알 수 없고 현 독립기념관 이사회를 통해 논의가 이뤄질 경우 면죄부가 주어질 수 있다고 판단해 자체 감사를 하는 방향으로 결정했다. 김 의원은 “감사원 감사는 야당 동의가 있어야 하는데 국민의힘 쪽에서 협조적으로 하지 않고 있다”면서 “민주당 정무위에서 사태 해결을 위해 적극적으로 임해야 한다는 생각을 가지고 항의 방문을 했다”고 말했다. 김 의원은 “지금 김 관장이 보여준 모습만으로도 독립기념관 정관이나 독립기념관법에 문제가 될 부분이 상당히 있다”면서 “김 관장 측에서 저항이 있을 것이라 확실한 근거를 가지고 해임 절차를 착수해야 하기 때문에 감,2025-09-15,https://www.seoul.co.kr/news/politics/2025/09/15/20250915500307,서울신문
이 경사 “인원 필요해” 요청…해경 상황보고서에는 빠졌다,https://img.seoul.co.kr/img/upload/2025/09/15/SSC_20250915173200_N1.png.webp,"갯벌에 고립된 70대 중국인을 구하려다 숨진 인천해양경찰서 영흥파출소 소속 고 이재석 경사의 현장지원 요청이 내부 상황보고서에 누락된 것으로 파악됐다. 이 경사는 녹취록에서 “(인력이) 조금 필요할 것 같다”고 말했지만 관련 조치는 없었던 것으로 확인됐다. 15일 해경이 국회 농림축산식품해양수산위원회 소속 정희용 국민의힘 의원실에 제출한 영흥파출소 상황보고서 및 이 경사 녹취록을 보면 지난 11일 오전 2시 43분 이 경사의 현장지원 요청이 상황보고서 내 조치 내용에서 빠진 것으로 파악됐다. 상황보고서에 따르면 오전 2시 30분 ‘이 경장이 영흥도 안도 인근 도착했고, 사람이 보이지 않아 안도 쪽으로 도보 이동(발목 수심)’, 오전 3시 ‘이 경장, 요구조자와 상봉 외근조끼 입히고 육지로 이동시작(배꼽수심)’ 사이에 인력 충원 요청 보고가 누락된 것이다. 정 의원실에서 확보한 이 경사 녹취록에 따르면 이 경사는 당일 오전 2시 43분 “물이 차올라서 (인력이) 조금 필요할 것 같다”며 “발목 정도 차오르거든요”라고 인력 지원을 강조했다. 파출소 내부에서 “어떻게 추가 누구 함 좀 보내줄까 깨워서(?)”라고 말하자 이 경사가 인력 지원을 요청한 것이다. 그",2025-09-15,https://www.seoul.co.kr/news/politics/2025/09/15/20250915500288,서울신문
"이억원 금융위원장, 금융지주 회장들과 간담회",https://img.seoul.co.kr/img/upload/2025/09/15/SSC_20250915162757_N1.jpg.webp,"이억원 금융위원장이 15일 서울 중구 은행연합회에서 열린 금융위원장-금융지주 회장 간담회에 참석해 있다. 이 원장은 이날 취임식을 마치고 8대 금융지주 회장들과 간담회를 가졌다. 이날 간담회는 이찬우 농협금융지주 회장, 빈대인 BNK 금융지주 회장, 김기홍 JB금융지주 회장, 함영주 하나금융지주 회장, 임종룡 우리금융지주 회장, 이 위원장, 조용병 은행연합회장, 양종희 KB금융지주 회장, 진옥동 신한금융지주 회장, 황병우 iM금융지주 회장 등이 참석한 가운데 진행됐다.",2025-09-15,https://www.seoul.co.kr/news/politics/2025/09/15/20250915500250,서울신문
"이석연 국민통합위원장 “국정운영, 민주당 집권 논리로만 할 수 없다”",https://img.seoul.co.kr/img/upload/2025/09/15/SSC_20250915161645_N1.jpg.webp,이석연 신임 국민통합위원장은 15일 “‘국민통합’은 이재명 정부 제1의 국정 원칙이자 국정철학”이라며 “현 정부와 생각이 다르고 대통령을 지지하지 않았던 국민이라도 서로를 보완하면서 그분들과 함께 갈 수 있는 길을 찾고자 한다”고 밝혔다. 이 위원장은 이날 정부서울청사에서 열린 취임식에서 “국민통합은 각자가 지닌 ‘다름’과 ‘차이’를 인정하고 존중하면서 공존과 번영을 위해 함께 가는 것”이라며 이같이 말했다. 그러면서 이 위원장은 ‘말(馬) 위에서 천하를 얻었다고 해서 말 위에서 통치할 수는 없다’는 사마천 ‘사기’ 열전을 인용하며 “이재명 정부는 더불어민주당 논리로 집권하였지만 국정 운영은 그 집권 논리로만 할 수 없다”고 설명했다. 이어 이 위원장은 “이제는 말 위에서 내려 전체 국민을 아우르고 함께 가는 모두의 대통령이 돼야 한다”라고 덧붙였다. 이어 그는 “이야말로 통합의 리더십의 요체”라며 “취임 100일 기자회견 그 첫머리에서 바로 이 점을 명확히 한 것”이라고 설명했다. 지난 대선에서 더불어민주당 선거대책위원장 겸 국민대통합위원장을 맡은 이 위원장은 이명박 정부 법제처장 출신으로 헌법 전문가이자 대표적인 중도 보수 인사로 꼽힌다. 이날 오전,2025-09-15,https://www.seoul.co.kr/news/politics/2025/09/15/20250915500244,서울신문
