title,thumbnail,short_content,write_time,link,company
"한동훈, 부산 구포시장 방문",https://img.seoul.co.kr/img/upload/2026/03/07/SSC_20260307164350_N1.jpg.webp,한동훈(왼쪽) 전 국민의힘 대표가 지난 7일 부산 북구 구포시장을 찾아 지지자들에게 둘러싸인 가운데 한 상인과 악수하며 인사를 나누고 있다. 부산 뉴스1,2026-03-09,https://www.seoul.co.kr/news/politics/local-election2026/2026/03/09/20260309006006,서울신문
오세훈 ‘당 노선 정상화’ 배수진… 서울시장 공천 신청 안 했다,https://img.seoul.co.kr/img/upload/2026/03/09/SSC_20260309000433_N1.jpg.webp,"오 “당 노선 과제 풀어야 지선 승리” 공천 신청 미루고 ‘끝장토론’ 요구 불출마·무소속 출마 배제하지 않아 김태흠 충남지사도 후보 등록 안 해 오세훈 서울시장이 국민의힘 6·3 지방선거 공천 신청 마지막 날인 8일까지 후보 접수를 하지 않았다. 장동혁 대표를 향해 “당 노선 정상화가 선결 과제”라고 최후통첩을 했지만 지도부가 호응하지 않자 배수진을 친 것으로 풀이된다. 양측의 입장이 좁혀지지 않으면 오 시장을 제외한 국민의힘 예비후보간 경선이 일단 치러질 가능성도 있다. 오 시장은 접수 마감 시한인 이날 오후 6시까지 공천 신청을 하지 않았다. 공천관리위원회가 오후 10시까지 온라인 접수 시스템을 연장 운영했으나 끝내 응하지 않았다. 서울시는 공지를 통해 “오 시장은 ‘당 노선 정상화라는 선결 과제를 풀어낼 때, 패배의 길을 승리의 길로 바꿀 수 있다’고 호소한 바 있다”며 “지금도 그 입장에는 변함이 없으며 당 지도부와 의원들의 응답을 기다리고 있다”고 전했다. 앞서 오 시장은 지난 7일 ‘마지막 호소’라는 글을 올려 “지역에서 뛰는 국민의힘 선수들이 명함조차 내밀지 못할 정도로 지금 민심은 우리 당에 적대적”이라며 “공천 접수를 미루더라도 우리 당 의",2026-03-09,https://www.seoul.co.kr/news/politics/local-election2026/2026/03/09/20260309006005,서울신문
"새 인물 없는 국힘, 경선 흥행 비상… 민주는 제주·전북지사 3파전 확정",https://img.seoul.co.kr/img/upload/2026/03/09/SSC_20260309000435_N1.jpg.webp,"국민의힘 6·3 지방선거 경선 흥행에 비상이 걸렸다. 8일 광역·기초단체장 공천 접수를 마감했으나 최대 승부처인 수도권을 포함해 눈에 띄는 ‘새 인물’은 없었다. 수도권은 경선 도전자가 1~2명에 그치면서 예비 경선 승자를 현역 단체장과 붙이는 이른바 ‘한국시리즈 경선’도 적용이 쉽지 않을 전망이다. 서울시장 출마 가능성이 나왔던 신동욱 최고위원은 페이스북을 통해 “정치적 진로와 당이 처한 상황 등을 종합적으로 고려하며 성찰의 시간을 가졌지만 경선에 참여하지 않기로 결정했다”고 적었다. 서울시장 후보군으로 거론됐던 나경원 의원도 “이번 지방선거에서는 백의종군”이라며 불출마를 선언했다. 이정현 공천관리위원장이 한국시리즈식 경선 적용을 시사했던 서울시장은 윤희숙 전 여의도연구원장, 이상규 서울 성북을 당협위원장, 이승현 한국무역협회 부회장 등 원외 인사 3명만 도전했다. 윤 전 위원장은 이날 서울신문에 “결정된 (새 경선) 룰은 따르겠지만 현역과 도전자 모두의 경쟁력을 떨어뜨리는 이상한 룰”이라고 반발했다. 현역 단체장을 제외하고 실시한 예비 경선 승자가 최종적으로 현역 단체장과 맞붙는 식의 경선 방식은 KBO 리그 결승전인 ‘한국시리즈’와 TV 프로그램 ‘",2026-03-09,https://www.seoul.co.kr/news/politics/local-election2026/2026/03/09/20260309006004,서울신문
주한미군 패트리엇 차출한 듯… “중동전 장기화되면 안보 공백”,https://img.seoul.co.kr/img/upload/2026/03/09/SSC_20260309000420_N1.jpg.webp,"미국이 주한미군에 배치된 지대공 유도미사일 체계 패트리엇(PAC-3)을 중동 지역에 이동 배치했을 것이라는 분석이 나오면서 전쟁이 장기화되면 한반도 대공 방어망에 구멍이 뚫릴 수 있다는 우려가 커지고 있다. 8일 항공 추적 사이트 등에 따르면 미군의 초대형 수송기인 C-5는 지난달 하순 이례적으로 한국에 들어왔다가 지난달 28일과 지난 2일 잇따라 출국했다. 목적지가 공개되지 않은 채 14시간 이상 비행해 패트리엇 포대를 싣고 중동으로 이동했을 가능성이 거론된다. 역시 대형 장비를 수송하는 C-17도 지난 3~7일 오산 기지에서 대규모로 이륙했다. 지난해 6월에도 미국은 주한미군 패트리엇 2개 포대를 중동 지역으로 재배치했다. 이를 고려하면 이번에도 패트리엇 포대 일부가 수송기에 실려 한국을 떠났을 것이라는 분석이 나온다. 특히 미국이 전쟁 장기화를 언급하는 만큼 이번에는 3개 포대 이상이 차출됐을 것이라는 관측도 있다. 우리나라 방공망은 40㎞ 이상 고고도에서는 사드(THAAD), 종말 단계인 15~30㎞의 저고도 요격에서는 주한미군 패트리엇과 천궁-Ⅱ가 핵심 전력이다. 주한미군 자산이 일부 빠지면 남은 자산이 공백을 메워야 하기 때문에 요격 확률이 떨",2026-03-09,https://www.seoul.co.kr/news/politics/diplomacy/2026/03/09/20260309004003,서울신문
李 “집권세력 됐다고 마음대로 해선 안 돼”,https://img.seoul.co.kr/img/upload/2026/03/08/SSC_20260308175516_N1.jpg.webp,"이재명 대통령은 “집권 세력이 됐다고 마음대로 다 할 수는 없다”고 강조했다. 특정 현안을 언급하진 않았지만 최근 논란이 다시 불거진 검찰개혁을 염두에 둔 것이란 해석이 나온다. 이런 가운데 정청래 더불어민주당 대표는 검찰개혁 정부안에 대한 수정 가능성을 열어 두며 입법 과정에서 진통이 예상된다. 이 대통령은 지난 7일 엑스(X)에 “대통령이 되기까지 가졌던 이상이나 가치, 약속을 결코 포기해서는 안 된다”면서도 “모든 공적 현안을 결정할 때 토론하고, 의견을 모으고, 대세에 지장이 없는 한 조정하고 타협하는 이유는 어떤 의견은 틀리고 어떤 의견은 옳아서가 아니라 모든 의견이 나름의 타당성이 있기 때문”이라고 설명했다. 이 대통령은 또 “권한을 가진다는 것은 동일한 양의 책임을 진다는 것을 의미한다”며 “주장하고 비판하는 것으로 충분한 입장과 주장하는 만큼의 대안을 내고 그 결과에 대해 무한 책임을 져야 하는 입장은 또 다르다”고 했다. 이어 “권한만큼 무거운 책임을 져야 하는 공인은 공정한 제3자의 시각과 냉철한 이성으로, 국가와 국민 최대 다수에게 최대의 행복이 되는 길이 무엇인지 치열하게 찾아야 한다”고 지적했다. 또 “아무리 잘 포장하고 숨겨도 집",2026-03-09,https://www.seoul.co.kr/news/politics/2026/03/09/20260309001005,서울신문
"李대통령, 김윤지 금메달에 “환한 미소로 즐거운 도전 이어가길”",https://img.seoul.co.kr/img/upload/2026/03/08/SSC_20260308204733_N1.jpg.webp,"이재명 대통령은 8일 김윤지 선수가 한국 여자 선수로는 최초로 동계 패럴림픽 금메달을 획득한 데 대해 “이번 우승은 대한민국 스포츠 역사에 새로운 이정표를 세웠다”며 축하했다. 이 대통령은 이날 페이스북을 통해 “2026 밀라노-코르티나 동계패럴림픽 바이애슬론 여자 12.5㎞ 좌식 종목에서 금메달을 거머쥔 김윤지 선수, 진심으로 축하한다”며 이같이 말했다. 이 대통령은 “김윤지 선수는 여름에는 수영을 하고 겨울에는 스키를 타며 계절과 한계를 뛰어넘는 도전을 해왔다”며 “그 노력과 열정이 마침내 이번 겨울 설원 위에서 금빛 결실로 이어졌다”고 전했다. 이어 “첫 패럴림픽 출전에서 거둔 성과이기에 앞으로의 행보가 더욱 기대된다”고 했다. 이 대통령은 “김윤지 선수의 레이스는 아직 끝나지 않았다”며 “남은 네 개의 종목에서도 멋진 경기를 펼칠 김윤지 선수를 우리 국민 여러분과 함께 끝까지 응원하겠다”고 밝혔다. 이 대통령은 “이번 금메달이 김윤지 선수의 삶에 오래도록 큰 자긍심으로 남길 바란다”며 “앞으로도 ‘스마일리’라는 별명처럼 환한 미소로 당당하고 즐거운 도전을 이어가길 기원한다”고 전했다. 김윤지는 이날(현지시간) 이탈리아 테세로 크로스컨트리 스타디움",2026-03-08,https://www.seoul.co.kr/news/politics/president/2026/03/08/20260308500127,서울신문
"오세훈, 국민의힘 서울시장 후보등록 안 했다…“당 노선변경 촉구”",https://img.seoul.co.kr/img/upload/2026/03/08/SSC_20260308190024_N1.jpg.webp,"오세훈 서울시장이 8일 오후 6시 마감이었던 국민의힘 6·3 지방선거 광역단체장 후보 신청을 하지 않았다. 오 시장 측은 국민의힘 지도부가 지선을 앞두고 윤석열 전 대통령과의 절연(절윤)으로 당 노선을 변경하는 것이 우선이라고 보고 이같이 결단한 것으로 알려졌다. 오 시장 측은 이날 언론 공지문에서 “오 시장은 지난 7일 ‘당 노선 정상화라는 선결 과제를 풀어낼 때, 패배의 길을 승리의 길로 바꿀 수 있다’고 호소한 바 있다”며 “지금도 그 입장에는 변함이 없으며, 당 지도부와 의원들의 응답을 기다리고 있다”고 밝혔다. 앞서 오 시장은 지난 7일 페이스북에 올린 글에서 장동혁 국민의힘 대표를 향해 “공천 접수를 미루더라도 우리 당 의원들이 한자리에 모여 치열한 끝장토론을 할 수 있는 자리부터 마련하기 바란다”며 “무엇이 국민 신뢰를 회복하고 선거에서 승리할 수 있는 길인지 반드시 결론을 내야 한다”고 강조했다.",2026-03-08,https://www.seoul.co.kr/news/politics/2026/03/08/20260308500120,서울신문
"오세훈, 국민의힘 서울시장 후보 등록 안 해…“노선 정상화 먼저”",https://img.seoul.co.kr/img/upload/2026/03/08/SSC_20260308185828_N1.jpg.webp,"국민의힘 6·3 지방선거 공천 접수 마감일 오세훈, 오후 6시까지 후보 등록 안 해 “당 노선 정상화 선결 과제 풀어야” 장동혁 압박...‘불출마’ 카드는 아직 오세훈 서울시장이 국민의힘 6·3 지방선거 공천 신청을 하지 않았다. 장동혁 대표를 향해 “당 노선 정상화라는 선결 과제를 풀지 않는 이상, 후보 접수와 경선이 무슨 의미가 있느냐”고 최후통첩한 후 별다른 반응이 없자 배수의 진을 친 것으로 보인다. 장 대표가 ‘노선 정상화’를 끝내 거부하면 ‘불출마 중대 결심’에 나설 가능성도 나온다. 오 시장은 국민의힘 광역단체장 공천 신청 접수 마감일인 8일 오후 6시까지 공천 신청을 하지 않았다. 서울시는 공지를 통해 “오 시장은 ‘당 노선 정상화라는 선결 과제를 풀어낼 때, 패배의 길을 승리의 길로 바꿀 수 있다’고 호소한 바 있다”며 “지금도 그 입장에는 변함이 없으며 당 지도부와 의원들의 응답을 기다리고 있다”고 전했다. 앞서 오 시장은 지난 7일 ‘마지막 호소’라는 글을 올려 “지역에서 뛰는 국민의힘 선수들이 명함조차 내밀지 못할 정도로 지금 민심은 우리 당에 적대적”이라며 “객관적 수치와 장수들의 아우성이 장 대표는 보이지도 들리지도 않느냐”라고",2026-03-08,https://www.seoul.co.kr/news/politics/2026/03/08/20260308500118,서울신문
조국에 공격당한 與 강득구 “사면 외쳤더니… 내 지역구서 직접 붙자”,https://img.seoul.co.kr/img/upload/2026/03/09/SSC_20260309000427_N1.jpg.webp,"더불어민주당과 조국혁신당이 6월 지방선거를 앞두고 선거 연대 여부를 본격 논의하기도 전에 양당 간 신경전이 재점화하고 있다. 합당 무산 과정에서 민주당 내 강한 반발에 서운함을 내비친 조국 조국혁신당 대표가 합당에 반대했던 민주당 인사를 콕 집어 혁신당과의 경쟁 가능성을 언급한 게 갈등의 도화선이 됐다. 강득구 민주당 최고위원은 8일 오전 페이스북에 “저는 동지라는 마음으로 구치소에 면회를 갔고 여러분들에게 사면을 요청했다”면서 “그러나 조 대표는 사실상 제게 좌표를 찍었다”고 했다. 그러면서 “조 대표께 제안한다. 다음 총선에서 (지역구인) 안양 만안구로 직접 오시라. 정정당당하게 선의의 경쟁을 했으면 한다”고 했다. 강 최고위원은 지난 6일과 7일에도 각각 “최소한의 존중과 절제가 필요하다”, “본인과 입장이 다르면 정치적으로 매장시키겠다는 뜻으로 이해한다”며 조 대표를 겨냥한 글을 올렸다. 다만 8일 페북 글은 잠시 삭제됐으나 현재는 복구됐다. 앞서 조 대표는 지난 6일 유튜브 방송 ‘장윤선의 취재편의점’에 출연해 정청래 민주당 대표가 제안한 지방선거 전 합당과 관련해 민주당 내 강한 반발이 있었던 것에 대한 서운함을 토로했다. 그는 민주당 내 합당",2026-03-09,https://www.seoul.co.kr/news/politics/2026/03/09/20260309005001,서울신문
"손훈모 순천시장 예비후보, 선거사무소 개소식···1000여명 성황",https://img.seoul.co.kr/img/upload/2026/03/08/SSC_20260308180317_N1.jpg.webp,"손훈모 순천시장 예비후보가 선거사무소 개소식을 열고 본격적인 선거전에 돌입했다. 지난 7일 연향동 선거사무소에서 열린 개소식에는 1000여명의 지지자들이 몰려 행사장 내부는 물론 건물 입구까지 인산인해를 이뤘다. 이날 행사에는 국회 교육위원회 위원장인 더불어민주당 김영호 의원을 비롯 김문수 의원과 권향엽 의원, 지역 원로, 주부, 청년들에 이르기까지 다양한 계층의 시민들이 참석해 지지를 보냈다. 국회 법사위원회 위원장인 추미애 의원과 국가균형성장특별위원장 김태년 의원, 박찬대 전 민주당 원내대표, 이언주 수석 최고위원과 송영길 전 당대표, 문금주 의원 등은 축하영상과 축전을 보내 응원 릴레이에 힘을 보탰다. 특히 손훈모 예비후보의 어머니가 아들의 선전을 기원하면서 신발과 더불어민주당 선거복을 전달하는 순서에서는 참석자들이 눈시울을 붉히며 박수를 보내는 등 감동적인 분위기가 연출되기도 했다. 국회 교육위원회 위원장인 김영호(서대문 을)의원은 축사를 통해 “순천을 대표하는 홍매화의 향기처럼 손훈모의 향기가 널리 퍼지기를 바란다”고 덕담하고 “손훈모 예비후보가 오랫동안 꾸어왔던 열정과 꿈을 꼭 이루기를 기원한다”고 힘을 실었다. 지역위원장인 김문수 의",2026-03-08,https://www.seoul.co.kr/news/politics/2026/03/08/20260308500110,서울신문
"정원오, ‘여성의날’ 경력보유여성 지원 방안 간담회",https://img.seoul.co.kr/img/upload/2026/03/08/SSC_20260308163651_N1.jpg.webp,"더불어민주당 서울시장 예비후보들은 8일 3·8 세계 여성의 날을 맞아 여성 정책 관련 간담회를 여는 등 분주하게 움직였다. 성동구청장 출신인 정원오 후보는 이날 서울 성동구의 한 커뮤니티 오피스에서 전혜영 전 더블유 플랜트 창업자, 이소영 창고살롱 대표, 서현선 SSIR 코리아 편집장 등과 만나 여성의 경력 재개를 위한 지원 방안을 논의했다. 이 자리에서 정 후보는 참석자들에게 세계 여성의 날을 기념하는 장미꽃과 빵을 선물하며 앞으로 발표할 여성 공약과 정책의 방향에 대해 설명했다. 그는 성동구청장 시절 경력보유여성에 대한 재취업을 돕고 인식 개선을 위한 시도로 주목받았다. 앞서 성동구는 2021년 ‘경력보유여성 등의 존중 및 권익 증진에 관한 조례’ 제정을 전국 최초로 추진하며 경력보유여성이라는 용어를 처음으로 사용했다. 돌봄 노동에 대한 경력 인정서를 발급하는 등 지원을 체계화했다. 경력보유여성이라는 표현이 경기도, 세종시, 전남도 등 전국으로 확산된 데 이어 지난해 12월 개정된 ‘양성평등기본법’에서 용어 개정으로 이어졌다.",2026-03-08,https://www.seoul.co.kr/news/society/2026/03/08/20260308500091,서울신문
경기도교육감 선거전 ‘후끈’ …안민석 이어 유은혜·박효진 사무소 개소,https://img.seoul.co.kr/img/upload/2026/03/08/SSC_20260308160308_N1.jpg.webp,"6월 전국 동시 지방선거가 90일도 채 남지 않은 가운데 경기도교육감 예비후보들이 잇달아 선거사무소 문을 열고 선거전에 본격적으로 뛰어들고 있다. 유은혜 경기도교육감 예비후보는 7일 오후 3시 수원 마라톤빌딩에서 이재정 전 경기도교육감과 송주명·구희현·곽상욱·김거성·이성대·이재삼·장현국·최태석 공동 선대위원장단 등 1000여명이 참석한 가운데 수원 팔달구에 ‘유는 해’ 캠프 개소식을 열었다. 이원종 배우와 변영주 감독이 공동 후원회장을 맡았고, 고문단에는 이재정 전 경기도교육감, 김진표·장영달·김상희 전 국회의원, 인재근 경기도경제과학진흥원 이사장이 참여했다. 유 예비후보는 인사말을 통해 “현장에서 만난 수많은 분의 목소리는 경기교육을 이대로 두어서는 안 된다는 절박한 외침이었다”며 “우리 아이들이 차별 없이 교육받을 권리를 누리고 누구나 자신의 행복한 미래를 만들어 갈 수 있도록 든든한 버팀목이 되어야 한다는 사명감으로 이 자리에 섰다”고 밝혔다. 그는 “우리 아이들이 학교 가는 길이 행복하고 학교에서 마음껏 숨 쉴 수 있는 ‘숨 쉬는 학교’를 위해 반드시 승리하겠다”고 강조했다. 박효진 예비후보도 7일 오후 5시 수원 장안구 선거사무소 개소식을",2026-03-08,https://www.seoul.co.kr/news/politics/local-election2026/2026/03/08/20260308500082,서울신문
"李 대통령, 내일 중동 상황 경제·물가 비상경제점검회의 주재",https://img.seoul.co.kr/img/upload/2026/03/02/SSC_20260302180131_N1.jpg.webp,"이재명 대통령이 9일 오전 11시 중동 상황과 관련한 ‘경제 및 물가 상황 점검 비상경제점검회의’를 주재한다. 8일 강유정 청와대 강유정 대변인에 따르면 회의에는 재정경제부와 산업통상부, 기후에너지부, 기획예산처, 농림축산식품부, 공정거래위원회, 국세청 등이 참석할 예정이다. 이 대통령은 이 자리에서 중동발 불확실성 증대에 따른 국제 금융시장과 유가 등의 변동 상황, 증시와 환율 등 국내 경제 상황과 석유류 등 물가에 미치는 영향 등을 두루 점검하고 대책을 논의할 것으로 보인다. 이 대통령은 앞서 지난 5일 국무회의에서도 중동 상황 관련 내용을 보고 받고 대응책을 논의했다.",2026-03-08,https://www.seoul.co.kr/news/politics/president/2026/03/08/20260308500073,서울신문
"與이건태 “수원지검 검사실, 김성태 집무실 전락”…법무부에 조사 촉구",https://img.seoul.co.kr/img/upload/2026/03/08/SSC_20260308143629_N1.jpg.webp,"이건태 더불어민주당 의원은 8일 민주당의 국정조사 추진 대상 중 하나인 ‘쌍방울 대북송금 사건’과 관련해 수원지검 검사실이 김성태 전 쌍방울 회장의 집무실로 전락했다며 법무부의 경위 조사를 촉구했다. 이 의원은 국회에서 기자회견을 열고 김 전 회장의 구치소 면회 녹취록을 인용하며 “수원지검 1313호 검사실에서 피의자인 김 전 회장이 업계 지인과 쌍방울 그룹 고문을 면담하고, 쌍방울 대표이사와 계열사 대표이사들을 만나 주주총회 관련 업무 지시를 하고 회의를 했다”고 주장했다. 이 의원은 이어 “이것은 수용 질서와 수사 준칙을 훼손한 중대한 사안”이라며 “이는 검사와 김 전 회장이 얼마나 깊게 유착돼 있었는지를 상징적으로 보여주는 사건이고, 검찰개혁의 필요성을 웅변하는 사건”이라고 했다. 그러면서 법무부를 향해 집무실 사용 허락 경위를 즉각 조사·공개하라고 했다. 또 수용 질서 위반, 공무집행방해, 직권남용 등 혐의에 대해 수사·처벌하며 김 전 회장에게 검사실이 제공된 추가 사례를 조사·공개하라고 촉구했다. 이 의원은 국정조사 추진 계획과 관련해 “12일 (본회의에) 보고해야 하므로 11일 (국정조사 요구서를) 제출할 예정”이라고 했다. 이어 “(국정조사",2026-03-08,https://www.seoul.co.kr/news/politics/2026/03/08/20260308500065,서울신문
"李대통령, 10일 기업인들과 간담회… “상생협력 실천 기업 격려”",https://img.seoul.co.kr/img/upload/2026/03/08/SSC_20260308140149_N1.jpg.webp,"이재명 대통령은 오는 10일 대기업과 중소기업 간 상생 협력을 실천하는 기업인들과의 간담회를 주재한다. 강유정 청와대 대변인은 8일 “이 대통령이 ‘상생을 실천하는 기업인과의 대화’를 주제로 간담회를 주재한다”며 이같이 밝혔다. 간담회는 대·중소기업 상생협력 우수 실천 기업을 격려하고 모범 사례를 확산하기 위해 마련됐다고 청와대는 설명했다. 이날은 하청·간접고용 노동자의 교섭권 강화와 원청 기업의 사용자 책임 범위 확대를 골자로 한 이른바 ‘노란봉투법’이 6개월의 유예 기간을 거쳐 시행되는 날이다. 이번 간담회에는 36명이 참석한다. 정부에서 구윤철 부총리 겸 재정경제부 장관, 한성숙 중소벤처기업부 장관, 안규백 국방부 장관이 함께한다. 청와대에선 강훈식 청와대 비서실장, 김용범 정책실장, 하준경 경제성장수석 등이 참석한다. 민간에서는 삼성전자, SK수펙스추구협의회, 현대자동차, 한화오션, 네이버 등 상생을 실천하는 대기업과 협력 중소기업, 관련 전문가 등이 자리할 예정이다. 강 대변인은 “기업인들은 현장의 생생한 협력 사례를 소개하고, 상생 생태계 발전을 위한 다양한 아이디어를 제시할 예정”이라고 전했다.",2026-03-08,https://www.seoul.co.kr/news/politics/president/2026/03/08/20260308500059,서울신문
"민형배 의원, 광양서 청년정책 해커톤…“청년이 정책 설계”",https://img.seoul.co.kr/img/upload/2026/03/08/SSC_20260308125019_N1.jpg.webp,"“청년은 정책의 대상이 아니라 주체입니다. 청년정책은 청년이 직접 만들어야 합니다.” ‘시민이 설계하는 정치’를 강조해 온 더불어민주당 전남광주통합특별시장 경선 후보 민형배 국회의원(광주 광산을)이 전남 동부지역 청년들과 함께 청년정책을 발굴하고 나섰다. 지난 7일 오후 광양시청소년문화센터에서는 민 의원이 주도하는 ‘전남광주특별시 청년정책 해커톤’토론이 열렸다. 지난달 21일 나주에서 열린 ‘청년정책 해커톤’에 이은 두 번째 청년정책 공론장이다. 광양, 여수, 순천 등지에서 참가한 150여 명의 청년들은 AI와 문화, 주거, 복지, 육아, 청년 정치 등 7개 주제별로 12개 팀을 꾸려 정책 의제를 발굴하고 민 의원과 실질적인 개선 방안을 논의했다. 이 날 참가자들이 제시한 주요 의제는 ▲청년 정착형 AI 일자리 패키지 ▲청년이 기획하는 전남ㆍ광주 통합 청년축제 ▲작은학교 특성화 교육 ▲공공돌봄 서비스 확대 ▲농촌 정주환경 개선 등 5가지다. 이어진 조별 발제에서는 지역 청년들의 현실적인 고민이 배어났다. 토론 과정에서 청년들은 “AI 관련 일자리가 부족해 지역 청년들이 수도권으로 떠나고 있다”며 AI 기업 유치와 지역 산업 기반 일자리 확대 필요성을",2026-03-08,https://www.seoul.co.kr/news/politics/2026/03/08/20260308500054,서울신문
