title,thumbnail,short_content,write_time,link,company
‘미스터 쓴소리’ 이상민 前 5선 의원 별세,https://img.seoul.co.kr/img/upload/2025/10/16/SSC_20251016010249_N1.jpg.webp,"5선 국회의원을 지낸 이상민 전 의원이 15일 별세했다. 67세. 이 전 의원은 이날 대전 유성구 자택에서 별세한 것으로 전해졌다. 소방당국이 이 전 의원 배우자의 신고를 받고 출동했을 때 심정지 상태였으며 이후 병원으로 옮겨졌으나 사망 판정을 받았다. 경찰은 이 전 의원이 지병으로 숨진 것으로 추정하고 있다. 이 전 의원은 당뇨병을 앓고 있었고 최근 증세가 심해져 투석 치료를 받으며 자주 입원했었다고 한다. 1958년생인 이 전 의원은 대전에서 태어났다. 생후 6개월 때 소아마비에 걸려 지체장애 3급 판정을 받았고 소아마비 후유증으로 한쪽 다리에 장애를 겪었다. 이후 교통사고로 인해 척수신경이 손상돼 하반신이 마비됐다. 이 전 의원은 충남대 법학과를 졸업하고 사법시험에 합격해 변호사로 활동했다. 17대 총선 당시 열린우리당 소속으로 대전 유성구에 출마해 당선됐다. 이후 21대 총선까지 내리 당선돼 5선 고지에 올랐다. 이 전 의원은 2008년 18대 총선을 앞두고 공천에서 탈락, 자유선진당으로 당적을 바꿔 재선에 성공했다. 2011년 자유선진당을 탈당해 친정인 민주통합당(더불어민주당 전신)에 복귀했다. 이후 19·20·21대 총선에서 새정치민주연합·민주",2025-10-16,https://www.seoul.co.kr/news/peoples/2025/10/16/20251016027003,서울신문
가을하늘 수놓는 블랙이글스,https://img.seoul.co.kr/img/upload/2025/10/15/SSC_20251015181417_N1.jpg.webp,15일 경기 성남시 상공에서 공군 특수비행팀 블랙이글스가 17일부터 사흘간 서울공항에서 열리는 서울 국제 항공우주 및 방위산업 전시회(ADEX) ‘퍼블릭 데이’를 앞두고 사전 연습을 하고 있다. 퍼블릭 데이는 일반인 누구나 관람할 수 있다. 연합뉴스,2025-10-16,https://www.seoul.co.kr/news/politics/diplomacy/2025/10/16/20251016014010,서울신문
“국제 마피아 대개 중국인… 무비자 입국 재고를”,https://img.seoul.co.kr/img/upload/2025/10/15/SSC_20251015180524_N1.jpg.webp,"캄보디아 내 한국인 납치·감금 사태와 관련해 중국인 단체관광객 무비자 입국 정책을 재검토해야 한다는 주장이 15일 여당에서 나왔다. 이언주 더불어민주당 최고위원은 이날 국회에서 열린 최고위원회의에서 “대부분 국제 마피아들은 중국인 출신”이라며 “캄보디아로 흘러 들어와서 암약하고 있는 게 아닌지, 그렇다면 외교당국이 캄보디아뿐 아니라 중국에도 자국 범죄자를 송환하고 단속하도록 얘기해야 한다”고 말했다. 이 최고위원은 또 “캄보디아를 단속하고 토벌한다고 해도 어떤 풍선 효과로 인해 인근의 동남아 등으로 흘러 들어갈 가능성이 굉장히 많다”며 “그렇게 되면 우리 국민을 대상으로 한 범죄는 계속 이어지고 이러한 범죄자들이 다시 우리나라로 흘러 들어올 가능성도 배제할 수 없다”고 말했다. 이어 “외교당국에선 중국인 무비자 (입국) 문제에 대해 추이를 지켜보며 불법 체류자 문제를 제대로 점검하고 문제가 있다고 생각하면 재고할 필요가 있다”고 했다. 다만 평당원 출신인 박지원 민주당 최고위원은 캄보디아 사태에 대해 “단순히 어느 국가를 미워하거나 특정 정파를 탓한다고 해서, 관계를 끊거나 문제를 외면한다고 해서 이런 현실이 사라지지 않는다”며 “정부와 집권 여당은 책임",2025-10-16,https://www.seoul.co.kr/news/politics/2025/10/16/20251016012008,서울신문
"캄보디아 인근 베트남서 韓여성 사망… 경찰, 피싱조직 연루 내사",https://img.seoul.co.kr/img/upload/2025/10/14/SSC_20251014134433_N1.jpg.webp,"캄보디아와 맞닿은 베트남 국경지대에서 30대 한국인 여성이 숨진 채 발견돼 경찰이 경위 파악에 들어갔다. 경찰은 범죄조직과 연관성이 있는지 조사할 예정이다. 15일 서울 혜화경찰서 등에 따르면 한국인 여성 A씨가 지난 8일 오전(현지시간) 캄보디아 국경 인근 베트남 모처에서 숨진 채 발견돼 현지 경찰이 사망 원인을 조사 중이다. 외교부는 9일 A씨 유가족이 베트남에 입국해 11일까지 부검, 유해 운구를 마쳤다고 전했다. 현지 경찰은 캄보디아에서 대포통장 운반책 역할을 하다 탈출한 한국인으로부터 ‘A씨가 현지 호텔에 장기간 감금됐다’는 취지의 진술을 확보한 것으로 전해졌다. 시신에서 폭행 등 타살 흔적은 발견되지 않았다고 한다. 현지 경찰은 A씨의 혈액을 채취해 약물중독 여부 등을 살펴볼 계획이다. 한국 경찰도 A씨 사망 사건에 대해 입건 전 조사(내사)에 착수했다. 경찰은 특히 보이스피싱 등 범죄조직과의 연관성을 들여다보고 있다. 캄보디아에 머무르던 A씨가 범죄조직의 지시를 받고 베트남을 찾았다가 되돌아오는 과정에서 숨졌을 가능성이 있다는 판단이다. 최근 경찰당국의 감시가 삼엄해지자 범죄조직들은 근거지를 베트남 등지로 옮기고 있는 것으로 알려졌다. 캄보디",2025-10-16,https://www.seoul.co.kr/news/politics/diplomacy/2025/10/16/20251016012005,서울신문
"“기재부, 스스로 개편 자초… ‘서울플러스 대한민국’으로”",https://img.seoul.co.kr/img/upload/2025/10/15/SSC_20251015180452_N1.jpg.webp,"상속세 손질, 중산층 부담 완화를 서울 강남·강북 균형 발전 이뤄야 국회 기획재정위원회 소속 박홍근(4선·서울 중랑을) 더불어민주당 의원은 15일 “정부 조직 개편을 통해 기획재정부 기능을 효율화시킨 측면도 있지만 책임의 문제도 엄중하다”고 말했다. 박 의원은 이날 국회 의원회관에서 진행된 서울신문과의 인터뷰에서 “윤석열 정부의 헌정 질서 파괴뿐 아니라 경제 폭망도 제대로 평가받아야 한다”면서 “기재부 개편을 자초한 것은 그 누구도 아닌 기재부 자신”이라고 했다. 다음은 일문일답. -국정감사에서 윤석열 정부를 ‘잃어버린 3년’이라고 평가했는데. “지난 3년간 민생과 경제 분야의 25개 핵심 지표를 받아 재구성해 보니 어느 하나 나아진 게 없었다. 일본의 잃어버린 20년처럼 대한민국도 잃어버린 3년을 겪은 것이다. 경제 정책의 실패를 총괄한 부처가 기재부 아닌가. (그 책임에서) 자유롭지 못하다. 구윤철 부총리 겸 기재부 장관도 지난 정부 3년의 경제 정책의 잘못에 대해서 ‘정책상 에러가 있었다’고 공감했다.” -구 부총리가 상속세 손질을 언급했는데. “상속세 개편은 부자 감세가 아닌 중산층 부담 완화 측면에서 바라봐야 한다. 앞으로 5년 후인 2030년에",2025-10-16,https://www.seoul.co.kr/news/politics/congress/2025/10/16/20251016008005,서울신문
초유의 대법원 현장검증 날… 조희대·추미애·나경원 ‘불편한 점심’,https://img.seoul.co.kr/img/upload/2025/10/15/SSC_20251015180431_N1.jpg.webp,"법사위원들과 현안 얘기 없이 식사 조, 오후 8시 30분쯤 국감장에 나와 “남은 감사에도 성실하게 임하겠다” 범여권, 대법 추가 현장 국감 요구 국힘 “입법권력 빙자한 폭동” 비판 추미애 국회 법제사법위원장을 비롯한 법사위 소속 여당 의원들이 15일 대법원에서 초유의 현장검증을 강행했다. 이재명 대통령의 공직선거법 위반 사건에 대한 대법원 전원합의체 파기환송 선고의 정당성을 따지겠다는 이유에서다. 더불어민주당은 종합 답변을 듣겠다며 조희대 대법원장을 국정감사장에 나오게 한 후 사실상 질의도 이어 갔다. 조 대법원장은 이날 오전 10시 서울 서초구 대법원 청사에서 열린 국정감사에 나오지 않았다. 지난 13일 국회에서 열린 대법원 감사에 출석했던 만큼 이날은 출석하지 않았다. 그러나 조 대법원장은 여야 법사위원들과의 오찬에는 참석했다. 대법원 청사 16층에 마련된 오찬장 헤드테이블에는 추 위원장, 나경원 국민의힘 의원, 박지원 민주당 의원, 조배숙 국민의힘 의원, 조 대법원장, 노태악 대법관(중앙선거관리위원장), 천 처장 등이 함께 앉아 식사를 했다고 한다. 다른 법사위원들도 오찬에 참석했다. 대법원은 관례적인 식사라고 설명했으며, 참석자들은 현안 관련 이야",2025-10-16,https://www.seoul.co.kr/news/politics/2025/10/16/20251016006004,서울신문
野 “선관위 관리 부실로 부정선거 음모론 판쳐”… 김현지 재산 내역 놓고 여야 설전,https://img.seoul.co.kr/img/upload/2025/10/16/SSC_20251016013057_N1.jpg.webp,15일 국회 행정안전위원회 국정감사에서는 중앙선거관리위원회의 부실 선거 관리가 다시 도마 위에 올랐다. 의원들은 선관위가 선거 관리 부실의 원인을 여전히 파악하지 못하고 있다고 지적하며 강도 높은 대책을 주문했다. 이성권 국민의힘 의원은 이날 국감에서 허철훈 선관위 사무총장을 향해 “선관위가 제대로 선거 관리를 하고 있지 못하기 때문에 부정선거와 관련된 음모론이 판을 치고 있다”고 지적했다. 특히 그는 “최근 네 차례 선거에서 발생한 선거 관리 부실 사례의 80%가 위촉사무원 과실이었다”며 강하게 따져 물었다. 그러나 허 사무총장이 “이렇게 높은 비율을 차지하는 줄 몰랐다”고 답하자 이 의원은 “오늘에서야 이 사실을 알았다는 것은 그동안 선관위가 원인 파악에 미흡했음을 입증하는 것”이라며 강하게 질책했다. 이 의원에 따르면 위촉사무원은 사전 교육 없이 투표 당일 1시간 전에 교육을 받기도 했고 그마저도 관리가 제대로 되지 않았다. 이 의원은 “한숨이 나올 정도”라며 “교육이 모든 지역에서 동일하고 체계적으로 이뤄질 수 있도록 교육 강화 방안을 마련해 보고하라”고 요구했다. 행안위 국감에선 김현지 대통령실 1부속실장의 재산 내역 제출을 두고도 공방이 벌어졌,2025-10-16,https://www.seoul.co.kr/news/politics/2025/10/16/20251016006003,서울신문
서울시 30년 이상 고위험 노후 하수관로…송파·강남·서초 순으로 길다,https://img.seoul.co.kr/img/upload/2025/10/09/SSC_20251009133603_N1.jpg.webp,"서울시 내 30년 이상 고위험 노후 하수관로가 가장 긴 자치구는 강남 3구인 것으로 15일 파악됐다. 국회 기획재정위원회 소속 박민규 더불어민주당 의원실이 서울시로부터 제출받은 ‘자치구별 하수관로 현황’ 자료에 따르면 송파구는 30년 이상 50년 미만인 고위험 하수관로가 317㎞에 달했다. 연도 미상인 하수관로는 106㎞에 달했다. 강남구는 30년 이상 50년 미만 고위험 하수관로가 303㎞에 달했고, 연도 미상 하수관로는 126㎞에 달했다. 서초구는 30년 이상 50년 미만 고위험 하수관로가 283㎞에 달했고, 연도 미상 하수관로는 96㎞에 달했다. 서울시 전체 자치구의 30년 이상 50년 미만 고위험 하수관로 길이는 2728㎞에 달했고, 50년 이상 된 하수관로도 374㎞에 달했다. 특히 연도 미상인 하수관로는 2925㎞에 달했다. 서울시는 30년 이상 하수관로가 55.5%, 50년 이상 하수관로가 30.4%에 달해 노후 하수관로 정비사업 국고 지원이 필요하다는 입장이다. 서울시가 최근 10년간 지반침하 원인별 분석 결과 총 228건의 침하 건수 중 111건(48.7%)이 하수도 지하 시설물 손상이 원인이다. 서울시는 생활인구 1000만명 이상의 초",2025-10-15,https://www.seoul.co.kr/news/politics/2025/10/15/20251015500269,서울신문
박홍근 “서울 강남과 강북 격차 줄여야…인프라·재정 배분 문제 과감하게 제기할 때”[인터뷰],https://img.seoul.co.kr/img/upload/2025/10/15/SSC_20251015182314_N1.jpg.webp,국회 기획재정위원회 소속 박홍근(4선·서울 중랑을) 더불어민주당 의원은 15일 “정부 조직 개편을 통해 기획재정부 기능을 효율화시킨 측면도 있지만 책임의 문제도 엄중하다”고 말했다. 박 의원은 이날 국회 의원회관에서 진행된 서울신문과의 인터뷰에서 “윤석열 정부의 헌정 질서 파괴 뿐 아니라 경제 폭망도 제대로 평가받아야 한다”며 “기재부 개편을 자초한 것은 그 누구도 아닌 기재부 자신”이라고 했다. 박 의원은 이재명 대통령의 20대 대선 후보 비서실장과 당 대표 시절 원내대표로 호흡을 맞췄다. 집권 후 국정기획위원회 국정기획분과장과 정부 조직개편 태스크포스(TF) 팀장을 맡는 등 ‘이재명 정부 설계자’로 평가받는다. 다음은 일문일답. -국정감사에서 윤석열 정부를 ‘잃어버린 3년’이라고 평가했는데. “지난 3년간 민생과 경제 분야의 25개 핵심 지표를 받아 재구성해보니 어느 하나 나아진 게 없었다. 일본의 잃어버린 20년처럼 대한민국도 잃어버린 3년을 겪은 것이다. 경제 정책의 실패를 총괄한 부처가 기재부 아닌가. (그 책임에서) 자유롭지 못하다. 구윤철 부총리 겸 기재부 장관도 지난 정부 3년의 경제 정책의 잘못에 대해서 ‘정책상 에러가 있었다’고 공,2025-10-15,https://www.seoul.co.kr/news/politics/2025/10/15/20251015500260,서울신문
"野주진우 “실행자 김현지, 배후 李대통령…사건 콘트롤타워”",https://img.seoul.co.kr/img/upload/2025/10/15/SSC_20251015180121_N1.jpg.webp,"주진우 국민의힘 의원이 15일 “김현지 (대통령실) 부속실장이 이재명 당시 더불어민주당 대표의 형사사건 콘트롤타워라는 정황이 사실로 입증됐다”고 주장했다. 또 의혹 해소를 위해 김 실장의 국정감사 출석이 반드시 필요하다고 했다. 국회 법제사법위원회 소속 주 의원은 이날 국회 소통관에서 기자회견을 열고 “김 실장은 김용 전 민주연구원 부원장 사건에도 깊숙이 관여한 정황이 있다”며 “김 전 부원장이 검찰에 체포영장으로 체포됐을 때 김 전 부원장의 변호를 맡은 이상호 변호사는 체포영장을 몰래 당시 보좌관이던 김 실장에게 보낸 것으로 보인다”며 이같이 말했다. 김 전 부원장은 20대 대선 경선 과정에서 유동규 전 성남도시개발공사 기획본부장과 남욱 변호사로부터 불법 대선자금 6억원을 받은 혐의로 재판을 받고 있다. 주 의원은 “(김 실장이) 누구에게 보고했겠나. 모든 공범 사건을 이렇게 관리해 왔고, 지금도 관리하고 있나”라고 의혹을 제기했다. 이어 “김 실장이 ‘이재명 사건’의 총괄 콘트롤타워였다는 설주완 변호사의 양심 고백이 있었다”며 “공범의 수사 상황을 변호인을 통해 몰래 빼내고 증거 인멸을 시도하는 것은 명백한 범죄다. 실행자는 김현지고, 배후는 이재명”",2025-10-15,https://www.seoul.co.kr/news/politics/2025/10/15/20251015500258,서울신문
야구만 끝나면 쓰레기 산…상반기에만 3500t 넘었다,https://img.seoul.co.kr/img/upload/2024/04/07/SSC_20240407180656_N1.png.webp,올해 프로야구 정규시즌 관중 수가 사상 최대인 1231만여명을 넘어선 가운데 야구장 폐기물 발생량도 상반기에만 3500t을 넘어선 것으로 15일 파악됐다. 구단마다 폐기물 배출량을 줄이기 위한 다회용기 시범 도입에도 나섰지만 실질적 효과는 적고 전수 적용 노력은 몇 년째 불발되고 있다는 지적이다. 국회 기후에너지환경노동위원회 소속 이학영 더불어민주당 의원실이 문화체육관광부로부터 제출받은 자료에 따르면 지난 8월까지 8개 구장 폐기물 발생량은 총 3533t에 달했다. 폐기물 분리수거장의 부재로 외부 폐기물 처리업체로 운반 후 분리하는 서울 고척스카이돔의 야구 폐기물 발생량을 포함한 수치다. 이 의원실 관계자는 “야구장은 한정된 공간에서 폐기물이 지속적으로 나오는 공간”이라며 “가을야구를 진행 중인 야구장은 올해도 무분별한 폐기물 배출이 계속되고 있다”고 지적했다. 음식물 쓰레기 배출량이 가장 많은 구장은 광주 기아챔피언스필드로 72t이 넘었다. 일반폐기물 발생량이 가장 많은 구장으로는 삼성라이온즈파크가 796t을 넘겼다. 재활용 폐기물이 가장 많이 분리 배출된 구장은 두산과 LG 구단이 함께 사용하는 잠실야구장으로 148t을 넘었다. 특히 삼성 라이온즈와,2025-10-15,https://www.seoul.co.kr/news/politics/2025/10/15/20251015500251,서울신문
"정부, 캄보디아 보코산·바벳·포이펫 ‘여행금지’ 발령",https://img.seoul.co.kr/img/upload/2025/10/15/SSC_20251015174230_N1.jpg.webp,"최근 캄보디아로 출국한 우리 국민이 납치되거나 실종되는 사례가 잇따르는 가운데 외교부는 캄보디아 일부 지역에 대해 16일 0시를 기해 여행경보 4단계 ‘여행금지’를 발령한다고 15일 밝혔다. 현재 특별여행주의보가 발령된 지역 중 캄폿주 보코산 지역, 바벳시, 포이펫시는 여행금지 지역으로 지정된다. 보코산은 지난 8월 한국인 1명이 숨진 곳이며, 바벳시와 포이펫시는 범죄 단체들이 많이 포진한 곳으로 알려졌다. 외교부는 여행금지 발령에 따라 해당 지역에 방문·체류하는 경우 여권법 등 관련 규정에 따라 처벌받을 수 있다고 강조했다. 범죄 단체 밀집 지역인 시하누크빌주에는 3단계 ‘출국권고’가 발령된다. 특별여행주의보(2.5단계) 발령 지역은 현 효력이 계속 유지되며, 특별여행주의보 및 3·4단계가 아닌 전 지역에는 2단계 ‘여행자제’가 발령된다.",2025-10-15,https://www.seoul.co.kr/news/politics/diplomacy/2025/10/15/20251015500243,서울신문
"정몽준 “한일, 채워지지 않은 물컵 반 잔…일본이 채우는 노력해야”",https://img.seoul.co.kr/img/upload/2025/10/15/SSC_20251015171242_N1.jpg.webp,"정몽준 아산정책연구원 명예이사장이 15일 한일 관계를 두고 ‘채워지지 않은 물컵 반 잔’이라며 “일본이 진심 어린 마음으로 나머지 반 잔을 채우려는 노력이 필요하다”고 강조했다. 정 이사장은 이날 일본 도쿄 국제문화회관에서 아산정책연구원과 일본 민간연구소 아시아퍼시픽이니셔티브(API) 공동 주최로 연 ‘2025 한일 정책 대화’에서 “급변하는 지역안보 상황에 따라 보다 긴밀한 한일 협력 관계 구축이 필요하다”며 이렇게 밝혔다. 정 이사장은 “미국 펜실베니아대 이정식 교수에 따르면 위안부는 20만명, 강제징용은 200만명, 강제 징병은 20만명에 달했다고 한다”며 “일부 일본 정치인이 강제징용 사실 자체를 부정하는 것은 매우 유감스럽다”고 지적하기도 했다. 그러면서 “일본은 진정성 있는 사과와 실질적인 보상 방안을 조속히 마련해야 한다”고 했다. 이어 “상대방의 아픔을 배려하고 진심을 다하는 노력, 미래세대에도 올바른 역사의 교훈을 물려주겠다는 약속이야말로 양국 관계의 신뢰를 쌓는 토대가 될 것”이라고 강조했다. 정 이사장은 특히 “북한의 핵 위협과 북러 군사 밀착 등 지역 안보 상황과 기후변화 등 다양한 도전 속에 한일 양국의 협력이 더욱 절실해지고 있다",2025-10-15,https://www.seoul.co.kr/news/politics/diplomacy/2025/10/15/20251015500233,서울신문
“졸속 개편에 간판갈이”…본부는 ‘데이터처’ 지방은 ‘통계청’,https://img.seoul.co.kr/img/upload/2025/10/15/SSC_20251015170642_N1.png.webp,"정부조직 개편에 따라 통계청이 ‘국가데이터처’로 승격됐지만 지방은 여전히 ‘통계청’ 명칭을 유지하는 것으로 15일 파악됐다. 5년 주기 인구주택총조사 등을 앞두고 생소한 기관명에 따른 ‘응답률 감소’를 우려한 결정인데 정부조직 개편 강행에 따른 ‘간판 갈이’라는 지적이 나온다. 국회 기획재정위원회 소속 천하람 개혁신당 의원실이 국가데이터처로부터 제출받은 자료에 따르면 정부조직법 개정으로 통계청은 국가데이터처로 명칭이 변경되고 격상했지만 경인, 동북, 호남, 동남, 충청지방통계청 등 5개 지방청은 그대로 통계청 명칭을 유지한다. 본부 외 소속기관은 조직개편에 따른 직제 개정 사항이 없어 지방통계청은 현재 명칭을 우선 유지하기로 행정안전부와 협의했다는 것이 국가데이터처의 설명이다. 지방청 명칭 개편은 인구주택총조사, 농림어업총조사 등 3대 총조사 후 검토·진행한다는 방침이다. 국가데이터처는 “5년 주기 대규모 조사를 앞두고 응답률이 감소하는 조사 환경과 기존 통계청 인지도 감안해 현행 유지하기로 결정했다”며 “향후 국가데이터처에 대한 대국민 인식 동향과 조사 환경 등 살펴 지방청 명칭 변경 등 직제 개정을 검토하겠다”고 했다. 1948년 공보처 통계국으",2025-10-15,https://www.seoul.co.kr/news/politics/2025/10/15/20251015500227,서울신문
[포토] ‘스웨덴 왕세녀 접견’ 이재명 대통령,https://img.seoul.co.kr/img/upload/2025/10/15/SSI_20251015165215_N1.jpg.webp,이재명 대통령이 15일 용산 대통령실에서 스웨덴 빅토리아 왕세녀를 접견하고 있다.,2025-10-15,https://www.seoul.co.kr/news/politics/diplomacy/2025/10/15/20251015800004,서울신문
"김영훈 노동장관 “노란봉투법, 보완 입법 검토할 것”",https://img.seoul.co.kr/img/upload/2025/10/15/SSC_20251015164001_N1.jpg.webp,"김영훈 고용노동부 장관은 15일 노동조합 및 노동관계조정법 2·3조 개정안(노란봉투법)과 관련해 “(원·하청 창구 단일화에 대한) 보완 입법을 검토하겠다”고 밝혔다. 김 장관은 이날 국회 기후에너지환경노동위원회 국정감사에서 ‘가이드라인 작성을 넘어 원·하청 교섭 창구 단일화 관련 보완 입법이 필요하다’는 윤상현 국민의힘 의원의 말에 이렇게 답했다. 김 장관은 ‘노동쟁의 대상이 불확실하다’는 지적에는 “질병판정위원회처럼 어디까지 노동쟁의 대상이 되는지 결정할 수 있는 기구도 고민하고 있다”면서 “내년 3월 10일(시행 예정일)까지 이러한 우려가 없도록 신속하게 가이드라인이나 필요한 시행령 개정도 할 것”이라고 말했다. 주 4.5일제와 관련해선 법 제정보다는 기업 지원 방식으로 추진하겠다고 밝혔다. 박해철 더불어민주당 의원이 진행 상황을 묻자, 김 장관은 “일방적 법 제정보다는 기업에서 자율적으로 진행되는 부분을 지원할 것”이라며 “특히 주 52시간 상한제를 지키지 못하는 사업장에 대해 근로감독을 하고, 연차 휴가를 활성화하는 방식으로 노동시간을 줄일 생각”이라고 설명했다. 김 장관은 최근 캄보디아에서 발생한 한국인 대상 취업 사기와 관련해 “채용 절차 관리",2025-10-15,https://www.seoul.co.kr/news/politics/congress/2025/10/15/20251015500209,서울신문
