title,thumbnail,short_content,write_time,link,company
"삼성SDI, 미국서 2조원 규모 ESS용 LFP 배터리 공급",https://img.seoul.co.kr/img/upload/2025/12/10/SSC_20251210183550_N1.jpg.webp,"삼성SDI가 미국의 대형 에너지 전문기업에 에너지저장장치(ESS)용 리튬인산철(LFP) 배터리를 대규모로 공급한다. 성장 가능성이 높은 ESS 시장을 겨냥해 LFP 시장 진출을 본격화하는 것으로 풀이된다. 삼성SDI는 10일 미주법인인 삼성SDI아메리카(SDIA)가 현지 에너지 관련 인프라 개발·운영 업체와 ESS용 LFP 배터리 공급 계약을 체결했다고 밝혔다. 계약 규모는 2조원 이상이며, 공급 기간은 2027년부터 3년간이다. 13조원으로 추산되는 삼성SDI 올해 매출 가운데 최소 15%가 넘는 수준이다. 삼성SDI가 이번에 공급하는 LFP 배터리셀은 일체형 ESS 배터리 솔루션인 ‘SBB 2.0’에 탑재된다. 삼성SDI는 미국 내 전기차 시장 공략을 위해 스텔란티스와 공동으로 전기차용 각형 배터리 공장을 가동 중이며, 일부 생산라인을 ESS용으로 전환하고 있다. 현재는 ESS용 삼원계(NCA) 배터리를 생산 중이지만 현지 수요에 맞춰 LFP 생산라인도 확보할 계획이다. 삼성SDI는 이번 계약을 통해 포트폴리오를 LFP 배터리로 확장하는 동시에, 기술 경쟁력을 바탕으로 ESS용 각형 배터리의 글로벌 판로를 확대하게 됐다. 삼원계 배터리는 에너지밀도가",2025-12-10,https://www.seoul.co.kr/news/economy/industry/2025/12/10/20251210500268,서울신문
삼성·SK “정부 반도체 비전 환영… 투자구조 개혁·인프라 정비 시급”,https://img.seoul.co.kr/img/upload/2025/12/10/SSC_20251210180948_N1.jpg.webp,"정부가 ‘인공지능(AI) 시대, K반도체 비전과 육성전략’을 발표하자 반도체 업계는 대체로 환영의 뜻을 밝히면서도 초대형 투자를 떠받칠 제도·인프라 정비가 시급하다고 입을 모았다. 전략의 방향성에는 공감하지만 글로벌 격차를 실제 벌릴 수 있을지는 결국 ‘실행력’에 달렸다는 의미다. 전영현 삼성전자 부회장은 10일 용산 대통령실에서 열린 ‘K반도체 육성전략 보고회’에서 “AI는 기업 간 경쟁을 넘어 국가 총력전으로 가고 있다”며 “결국 승부는 우수 인재와 국내 생태계에 달려 있다”고 밝혔다. 전 부회장은 AI 반도체가 로직·메모리·파운드리·패키징이 유기적으로 맞물려야 완성되는 만큼 “소부장(소재·부품·장비) 경쟁력이 무엇보다 중요하다”고 강조했으며, “국민성장펀드 같은 투자 기반 정책이 민간투자의 마중물이 될 것”이라고 평가했다. 곽노정 SK하이닉스 대표는 “초대형 투자를 단일 기업이 단독으로 감당하긴 어렵다”며 투자 구조의 제약을 언급했다. 그는 “투자 타이밍을 놓치지 않으려면 대규모 자금 조달을 가능하게 하는 규제 완화가 절실하다”며 “용인 클러스터, 청주 등 동시다발적으로 진행되는 투자를 고려하면 지금의 제도로는 속도전을 따라가기 어렵다”고 강조했다.",2025-12-11,https://www.seoul.co.kr/news/economy/industry/2025/12/11/20251211003001,서울신문
쿠팡 새 대표에 ‘김범석 복심’ 왔다… 오너 책임론 회피 지적도,https://img.seoul.co.kr/img/upload/2025/12/10/SSC_20251210180731_N1.jpg.webp,"후임에 美 모회사 출신 로저스 선임 “이번 사태 철저히 대응해 신뢰 회복” 한국 경험 없는 법률가 ‘회의적 시선’ 개보위 “면책 조항·탈퇴 절차 개선을” 대규모 개인정보 유출 사태로 사면초가에 놓인 쿠팡의 박대준 대표이사가 사임했다. 향후 사태 수습에는 박 대표를 대신해 ‘김범석의 복심’으로 통하는 쿠팡 모회사의 2인자가 나선다. 하지만 김범석 쿠팡Inc 이사회 의장의 국회 출석 요구 시점을 1주일 앞둔 인사라는 점에서 김 의장의 책임 비켜가기가 계속 되는 것 아니냐는 지적이 나온다. 쿠팡은 박 대표 사임에 따라 미국 모회사인 쿠팡Inc의 해럴드 로저스 최고관리책임자 겸 법무총괄을 임시 대표(직무대행)로 즉시 선임했다고 10일 밝혔다. 로저스 신임 대표는 사내 공지에서 “지금 우리의 우선순위는 명확하다”면서 “이번 사태를 철저히 대응하고, 재발을 방지하기 위해 정보보안을 강화하며, 신뢰를 회복하는 것”이라고 밝혔다. 로저스 임시 대표는 하버드 로스쿨 출신의 법률·컴플라이언스(준법 경영) 분야 전문가로, 2020년 1월 쿠팡Inc에 합류했다. 김 의장과 긴밀하게 의사소통을 주고받는 쿠팡Inc의 2인자로 통한다. 박 대표는 이날 “이번 사태의 발생과 수습",2025-12-11,https://www.seoul.co.kr/news/economy/2025/12/11/20251211016005,서울신문
"금감원, 금융사 CEO 장기 연임 구조 손본다",https://img.seoul.co.kr/img/upload/2025/12/10/SSC_20251210180723_N1.jpg.webp,이달 중 지배구조 개선 TF 가동 신한·BNK·우리금융 등 영향 주목 보안·소비자보호 사외이사 배치 이찬진 금융감독원장이 10일 8개 금융지주 회장들을 불러 모아 지배구조 전반의 손질을 예고했다. 이사회 구성과 승계 절차를 다시 정비해 불투명한 최고경영자(CEO) 장기 연임 구조를 바로잡겠다는 뜻을 분명히 했다. 이 원장은 이날 은행연합회에서 열린 금융지주 CEO 간담회에서 금융지주·은행연합회·학계 등이 참여하는 ‘지배구조 개선 태스크포스(TF)’를 이달 중 가동한다고 밝혔다. TF에서는 ▲공정하고 객관적인 CEO 자격기준 마련 ▲사외이사 추천 경로 다양화 ▲이사회 내 보안·금융소비자 전문가 배치 등 이사회 구성을 다양화하는 방안을 중점적으로 논의한다. 핵심은 회장후보추천위원회(회추위)가 회장 재임 기간에 선임된 사외이사들로 꾸려져 ‘내부 참호’를 만드는 관행을 끊는 것이다. 이 원장은 취임 직후부터 “금융지주 회장이 되면 이사회에 자기 사람을 채워 ‘참호’를 구축하는 분들이 보인다”고 공개적으로 문제를 제기해 왔다. 이를 위해 금감원은 사외이사 추천 경로를 넓히는 방안을 추진한다. 국민연금 등 대표 기관의 외부 추천을 받는 방식이 포함된다. 동시에 이사,2025-12-11,https://www.seoul.co.kr/news/economy/2025/12/11/20251211016004,서울신문
"LG전자, 가상 스튜디오에 고화질 LED 공급",https://img.seoul.co.kr/img/upload/2025/12/10/SSC_20251210180727_N1.jpg.webp,LG전자는 10일 문화체육관광부와 한국콘텐츠진흥원이 대전에 운영 중인 공공 영상제작 시설 ‘스튜디오큐브’에 버추얼 프로덕션 전용 고화질 대형 발광다이오드(LED)를 공급했다고 10일 밝혔다. 사진은 국내 최대 가상 스튜디오인 스튜디오큐브에 설치된 LG전자 LED솔루션. LG전자 제공,2025-12-11,https://www.seoul.co.kr/news/economy/2025/12/11/20251211016003,서울신문
‘소비쿠폰’ 약발 떨어지자… 숙박·음식업 취업자 감소,,"지난 7월부터 지급된 민생회복 소비쿠폰 영향으로 증가했던 숙박·음식점업 취업자가 4개월만에 다시 마이너스로 돌아섰다. 취업자 증가 폭은 두 달째 20만명 안팎에 머물렀고, 제조업·건설업에 불어닥친 고용 한파로 청년층 고용률은 19개월 연속 하락했다. 30대 ‘쉬었음’ 인구는 역대 최대를 기록했다. 10일 국가데이터처가 발표한 ‘11월 고용동향’에 따르면 지난달 취업자 수는 2904만 6000명으로 전년 동월 대비 22만 5000명(0.8%) 증가했다. 취업자 증가 폭은 올해 6~8월 10만명대에서 9월 31만 2000명으로 늘었으나 지난 10월 다시 19만3000명으로 줄며 증가세가 꺾였다. 청년 고용은 악화일로다. 15~29세 청년층 취업자는 전년 동월 대비 17만7000명 감소했다. 청년층 고용률은 1.2%포인트 감소한 44.3%로 집계됐다. 청년 인구의 절반 이상이 미취업 상태란 뜻이다. 청년층 고용 악화는 양질의 일자리를 보유한 제조업 부진과 맞물려 있다. 제조업 취업자 수는 435만 5000명으로 전년 동월 대비 0.9%(4만1000명) 줄어들며 마이너스 기간을 17개월로 늘렸다. 내수와 직결된 숙박·음식점업 취업자는 2만 2000명 줄며 7월 이",2025-12-11,https://www.seoul.co.kr/news/economy/2025/12/11/20251211016002,서울신문
은값도 무섭네… 온스당 60달러 돌파,https://img.seoul.co.kr/img/upload/2025/12/10/SSC_20251210180718_N1.jpg.webp,"국제 은값이 사상 처음으로 온스당 60달러(한화 8만 8278원)를 돌파했다. 9일(현지시간) 뉴욕상품거래소(COMEX)에서 은 선물 가격은 전일 대비 4.17% 급등한 온스당 60.84달러에 마감했다. 국제 은값이 종가 기준 60달러 선을 돌파한 건 이번이 사상 처음이다. 은값은 최근 며칠간 꾸준히 올랐는데, 미국 연방준비제도(Fed·연준)가 9~10일 개최하는 연방공개시장위원회(FOMC)에서 기준금리를 0.25% 포인트로 인하할 것이라는 기대감 때문이라는 분석이 나온다. 시카고상품거래소(CME) 페드워치툴에 따르면 연방기금금리 선물시장은 12월에 기준금리가 0.25% 포인트 인하될 확률을 87.6%로 반영했다. 은 가격은 올해 들어 두 배 이상 올라 금값 상승률(60%)을 훨씬 웃돈다. 은값이 치솟는 이유는 지난 5년 동안 지속된 실물 시장의 공급 부족과 투자자들의 수요 급증이 주된 요인으로 꼽힌다. 금과 달리 은은 다른 광물의 부산물로 생산되기 때문에 광산업계의 공급이 수요를 따라갈 수 없는 상황이다. 지난 10월엔 세계 최대 은 소비국으로 꼽히는 인도와 은 기반 상장지수펀드(ETF)의 수요 급증으로 런던 시장에서 공급난이 심화했다. 중국 내 은 재",2025-12-11,https://www.seoul.co.kr/news/economy/2025/12/11/20251211016001,서울신문
"국내 최대 규모 ‘낙월해상풍력’, 첫 상업 운전 본격 개시",https://img.seoul.co.kr/img/upload/2025/12/10/SSC_20251210175907_N1.png.webp,"국내 최대 규모(총 364.8MW)인 낙월해상풍력 발전사업이 첫 상업 운전을 개시했다. 고정가격계약 경쟁입찰에서 선정된 지 2년, 착공한 지 21개월 만이다. 이 사업을 주도하는 명운산업개발은 한국전력거래소로부터 ‘최초 전력거래 개시 승인 확인서’를 발급받아 지난 2일 발전기 1호기가 상업 발전을 시작했다고 10일 밝혔다. 해당 사업은 전남 영광군 계마항에서 20km 떨어진 해상에 5.7MW 풍력발전기 총 64기를 설치하는 것으로 현재까지 7기가 설치됐다. 명운산업개발은 내년 6월까지 모든 발전기 설치를 완료해 순차 상업 발전에 돌입한다는 계획이다. 이 사업 단지가 최종 준공되면 국내 해상풍력발전 용량은 기존 352MW에서 716.8MW로 두 배 이상 확대될 전망이다. 명운산업개발 관계자는 “연간 약 25만 가구에 공급 가능한 900GWh의 전력 생산과 온실가스 감축으로 국내 재생에너지 확대, 탄소중립에 기여할 것”이라 말했다. 해당 사업에는 대한전선, 호반산업, 삼해이앤씨, GS엔텍, 현대스틸산업 등 100여개 이상 국내 기업들이 참여하고 있으며 국내 해상풍력발전 공급망 형성과 경험 축적에 기여한다는 평가를 받는다. 주민참여제도를 통한 발전기금 출연,",2025-12-10,https://www.seoul.co.kr/news/economy/industry/2025/12/10/20251210500260,서울신문
염소계 휘발성 물질 포함돼 점막 자극…강한 산성에 금속 구조물 부식,,"페놀폼(PF)단열재는 미국과 독일 등 주요 선진국에서 유해 물질 방출, 실내 공기질 악화, 금속 부식 가능성으로 퇴출 수순을 밟았다. 10일 업계에 따르면 독일 프라이부르크 환경화학연구소(FIUC)가 2009년 PF 단열재 시료를 분석한 이후 공공 부문과 일반 건축용으로의 사용을 피할 것을 권고했다. 암과 백혈병을 유발하는 포름알데히드가 가장 큰 문제다. FIUC가 모서리를 절단한 PF단열재를 실험실에서 측정한 결과, 20분 만에 기준치(0.1ppm)를 초과하는 포름알데히드가 방출됐다. 또 단열재 내부의 가스를 분석하니 염소계 휘발성 물질로 점막 자극을 일으키는 클로로프로판이 1% 이상 포함돼 있었다. PF단열재의 산성도(pH)가 2.0수준으로 식초보다 강한 산성이라는 점도 확인됐다. FIUC는 “습기와 맞닿을 경우 주변의 철·알루미늄 구조물을 부식시킬 수 있다”고 지적했다. 미국 화학기업 다우케미컬이 2011년 분석한 결과 PF단열재에서는 177~253ppm 수준의 잔류 포름알데히드가 검출돼, 다른 단열재에서 포름알데히드가 거의 확인되지 않은 것과 대비됐다. 미국에서는 1980~1990년대 PF단열재가 지붕 금속판을 부식시켜 누수와 붕괴 위험을 초래한 사건",2025-12-10,https://www.seoul.co.kr/news/economy/2025/12/10/20251210500259,서울신문
선진국서 퇴출 ‘위험한 PF 단열재’ 한국에선 사용 늘었다,https://img.seoul.co.kr/img/upload/2025/12/10/SSC_20251210175509_N1.jpg.webp,"2011년 봄 독일 남부 뉘른베르크의 한 시립유치원에서 리모델링 이후 이유를 알 수 없는 화학 냄새로 뒤덮였다. 아이들은 눈이 따갑고 머리가 아프다고 호소했다. 바닥에 깔린 페놀폼(PF) 단열재 제조 과정에서 사용된 유해 가스(클로로프로판)가 실내로 새어 나온 것이었다. 아이들의 눈과 점막을 자극하고, 고농도로 노출되면 신장이나 심장 기능에 영향을 줄 수 있었다. 바닥 공사 업체는 목재 섬유보드를 사용해야 했지만, 바닥 높이가 제한돼 더 얇은 재료가 필요했기에 PF 단열재를 사용했다. 뉘른베르크시는 이 사건 후 ‘PF 단열재를 공공건축물에서 사용하지 않겠다’고 했다. 해당 PF 단열재를 둘러싼 안전성 논란은 이제 우리나라에서 ‘뜨거운 감자’다. 10일 김원이 더불어민주당 의원실과 한국화학경제연구원(CMRI)에 따르면 국내 건축물에 투입되는 PF단열재 시장 규모는 2018년 1만 8600t에서 올해 7만 3000t으로 전망돼 7년 만에 4배 가까이 성장했다. 2018년에는 PF 단열재가 전체 단열재(73만 4600t)의 2.5%였지만, 2023년 6.8%로 늘었고, 올해는 9.5%에 이를 것으로 추정된다. 2028년에는 11.2%에 달할 전망이다. PF 단",2025-12-10,https://www.seoul.co.kr/news/economy/2025/12/10/20251210500257,서울신문
“中자본이 내 노후 자금을?”…잊을만 하면 금융주권 논란[경제 블로그],https://img.seoul.co.kr/img/upload/2025/12/10/SSC_20251210175050_N1.png.webp,"금융권에 다시 ‘중국계 자본 공포’가 번지고 있습니다. 국내 최대 부동산 자산운용사인 이지스자산운용의 새 주인이 사실상 중국계 사모펀드(PEF)로 굳어지면서입니다. 특히 이 운용사에는 연기금 자금이 들어가 있어 국민 노후자금을 중국계 자본에 믿고 맡길 수 있겠느냐는 우려가 나오는 겁니다. 10일 금융권에 따르면 힐하우스는 ‘프로그레시브 딜’(경매호가식 입찰) 방식을 통해 1조 1000억원을 제시하며 흥국생명(1조 500억원)과 한화생명(9000억원대 후반)을 제쳤습니다. 이번 지분 매각 대상은 창업주 고 김대영 회장의 배우자인 최대주주 손화자 씨의 지분 12.4%와 분산된 재무적투자자(FI) 지분을 합친 최대 98.8%로 알려져 있습니다. 사실상 경영권 전체입니다. 이지스자산운용에는 국민연금과 공무원연금, 행정공제회 등 연기금 자금이 6조원 이상 들어가 있죠. 중국 허난성 출신 기업가 장 레이 회장이 2005년 설립한 힐하우스는 중국계 사모펀드로 알려져 있는데요. 일각에선 힐하우스를 중국계로 보기 어렵단 반론도 나옵니다. 장 회장은 미국 예일대에서 경영학석사(MBA)를 취득했고 힐하우스 설립 당시 들어간 돈도 미국 예일대 기금에서 끌어왔기 때문이죠. 업계",2025-12-10,https://www.seoul.co.kr/news/economy/finance/2025/12/10/20251210500253,서울신문
치솟는 은값…사상 처음 온스당 60달러 돌파,https://img.seoul.co.kr/img/upload/2025/12/10/SSC_20251210173524_N1.jpg.webp,"금테크에 금수입 IMF이후 최대 국제 은값이 사상 처음으로 온스당 60달러(한화 8만 8278원)를 돌파했다. 9일(현지시간) 뉴욕상품거래소(COMEX)에서 은 선물 가격은 전일 대비 4.17% 급등한 온스당 60.84달러에 마감했다. 국제 은값이 종가 기준 60달러 선을 돌파한 건 이번이 사상 처음이다. 은값은 최근 며칠간 꾸준히 올랐는데, 미국 연방준비제도(Fed·연준)가 9~10일 개최하는 연방공개시장위원회(FOMC)에서 기준금리를 0.25% 포인트로 인하할 것이라는 기대감 때문이라는 분석이 나온다. 시카고상품거래소(CME) 페드워치툴에 따르면 연방기금금리 선물시장은 12월에 기준금리가 0.25% 포인트 인하될 확률을 87.6%로 반영했다. 은 가격은 올해 들어 두 배 이상 올라 금값 상승률(60%)을 훨씬 웃돈다. 은값이 치솟는 이유는 지난 5년 동안 지속된 실물 시장의 공급 부족과 투자자들의 수요 급증이 주된 요인으로 꼽힌다. 금과 달리 은은 다른 광물의 부산물로 생산되기 때문에 광산업계의 공급이 수요를 따라갈 수 없는 상황이다. 지난 10월엔 세계 최대 은 소비국으로 꼽히는 인도와 은 기반 상장지수펀드(ETF)의 수요 급증으로 런던 시장에서 공",2025-12-10,https://www.seoul.co.kr/news/economy/2025/12/10/20251210500244,서울신문
상습침수 대림1구역의 변신…오세훈 “현장 목소리 듣는다”,https://img.seoul.co.kr/img/upload/2025/12/10/SSC_20251210172921_N1.jpg.webp,"지난 2022년 집중호우로 특별재난지역에 지정됐던 서울 영등포구 대림동 855-1번지 일대 대림1구역이 호우 예방 시설을 갖춘 최고 35층짜리 단지로 재탄생한다. 서울시는 대림1구역에 신속통합기획(신통기획) 2.0을 적용, 2035년까지 총 1026세대를 공급할 계획이라고 10일 밝혔다. 오세훈 서울시장은 이날 오후 대림1구역을 방문해 현장을 점검하고 주민 의견을 들은 뒤 정비사업 추진 방안을 설명했다. 대림1구역은 2022년 말 신통기획 재개발 후보지에 선정된 지 2년 만에 정비구역 지정 고시를 하고 8개월 뒤 추진위 승인이 완료되는 등 정비기간을 단축한 대표 사례로 꼽힌다. 한 걸음 더 나아가 지난 7월 발표된 신통기획 2.0을 적용, 평균 18년 6개월 걸리던 정비사업을 12년 수준으로 단축하겠다는 게 시의 목표다. 이를 위해 갈등관리책임관을 배치해 갈등 요소를 최소화하는 등 내년 상반기 조합설립인가를 목표로 사업에 속도를 내고 있다. 사업 여건도 획기적으로 개선했다. 용도지역은 2종 일반에서 3종으로 상향, 용적률을 250%에서 285%로 완화했다. 침수 취약지인 점을 고려해 단지 내 공원 지하에 1만 5000t 규모 대형 저류조도 조성한다.",2025-12-10,https://www.seoul.co.kr/news/economy/estate/2025/12/10/20251210500239,서울신문
하나·신한證 발행어음 사업자 된다…증선위 통과,https://img.seoul.co.kr/img/upload/2025/11/12/SSC_20251112175749_N1.jpg.webp,"하나증권과 신한투자증권이 발행어음 사업자가 된다. 10일 금융당국에 따르면 금융위원회 산하 증권선물위원회는 이날 정례회의에서 하나증권과 신한투자증권의 자기자본 4조원 이상 종합금융투자사업자(종투사) 지정과 발행어음 인가를 심의·의결했다. 오는 17일 금융위 정례회의에서 의결이 이뤄지면 두 회사는 한국투자증권, 미래에셋증권, NH투자증권, KB증권, 키움증권에 이어 발행어음 사업자로 최종 확정된다. 발행어음은 증권사가 자체 신용으로 발행하는 1년 이내 단기채로, 원리금이 보장돼 증권사의 정기 예금이라고 불린다. 종투사는 2028년까지 조달금액의 25%를 의무적으로 모험자본에 투자해야 한다. 현재 발행어음 인가 대기사는 메리츠증권·삼성증권 등 2곳이 남아 있다. 두 회사는 외부평가심의위원회 심사를 마치고 현장 실사를 기다리고 있다.",2025-12-10,https://www.seoul.co.kr/news/economy/2025/12/10/20251210500221,서울신문
반도체 업황 훈풍에…500대 기업 잉여현금흐름 1년새 20조 증가,https://img.seoul.co.kr/img/upload/2025/12/10/SSC_20251210165325_N1.png.webp,"국내 500대 기업 중 상장사의 올해 3분기 누적 잉여현금흐름(FCF)이 전년 대비 20조원 이상 증가한 것으로 나타났다. 반도체 업황 호조에 힘입어 삼성전자, SK하이닉스 등 주요 기업의 잉여현금흐름이 크게 늘어난 결과로 풀이된다. 10일 기업데이터연구소 CEO스코어가 지난해부터 올해까지 분기(9월)보고서를 공시한 국내 500대 기업(금융사 제외) 중 상장사 237곳을 조사한 결과, 이들 기업의 올 3분기 누적 잉여현금흐름 총액은 69조 6498억원을 기록했다. 전년 동기 49조 539억원 대비 20조 5959억원(42.0%) 증가한 수치다. 잉여현금흐름은 영업활동 현금흐름에서 자본적 지출을 뺀 수치다. 기업의 실제 자금 사정이 얼마나 양호한지를 알려주는 지표이자 연말 배당 여력을 가늠할 수 있는 지표이기도 하다. 조사대상 237곳의 3분기 영업활동 현금흐름 총액은 164조 4827억원으로 전년 동기(132조 1035억원) 대비 24.5%(32조 3792억원) 늘어났다. 늘어난 잉여현금흐름은 기업의 투자 활성화로 이어졌다. 자본적 지출 역시 94조 8329억원으로 전년 동기(83조 496억원)에 비해 14.2%(11조 7833억원) 늘었다. 자본적 지출",2025-12-10,https://www.seoul.co.kr/news/economy/industry/2025/12/10/20251210500220,서울신문
반도체 업황 훈풍에…500대 기업 잉여현금흐름 1년새 20조 증가,https://img.seoul.co.kr/img/upload/2025/12/10/SSC_20251210165325_N1.png.webp,"국내 500대 기업 중 상장사의 올해 3분기 누적 잉여현금흐름(FCF)이 전년 대비 20조원 이상 증가한 것으로 나타났다. 반도체 업황 호조에 힘입어 삼성전자, SK하이닉스 등 주요 기업의 잉여현금흐름이 크게 늘어난 결과로 풀이된다. 10일 기업데이터연구소 CEO스코어가 지난해부터 올해까지 분기(9월)보고서를 공시한 국내 500대 기업(금융사 제외) 중 상장사 237곳을 조사한 결과, 이들 기업의 올 3분기 누적 잉여현금흐름 총액은 69조 6498억원을 기록했다. 전년 동기 49조 539억원 대비 20조 5959억원(42.0%) 증가한 수치다. 잉여현금흐름은 영업활동 현금흐름에서 자본적 지출을 뺀 수치다. 기업의 실제 자금 사정이 얼마나 양호한지를 알려주는 지표이자 연말 배당 여력을 가늠할 수 있는 지표이기도 하다. 조사대상 237곳의 3분기 영업활동 현금흐름 총액은 164조 4827억원으로 전년 동기(132조 1035억원) 대비 24.5%(32조 3792억원) 늘어났다. 늘어난 잉여현금흐름은 기업의 투자 활성화로 이어졌다. 자본적 지출 역시 94조 8329억원으로 전년 동기(83조 496억원)에 비해 14.2%(11조 7833억원) 늘었다. 자본적 지출",2025-12-10,https://www.seoul.co.kr/news/economy/industry/2025/12/10/20251210500220,서울신문
"DX KOREA 2026 조직위, 방산공제조합과 ‘K방산 수출 지원 강화’ MOU 체결",https://img.seoul.co.kr/img/upload/2025/12/10/SSC_20251210165021_N1.jpg.webp,"DX KOREA 2026 조직위원회는 10일 방위산업공제조합과 서울 중구 방위산업공제조합 회의실에서 ‘K-방산 수출 확대를 위한 업무협약’을 체결했다고 밝혔다. 이번 협약에 따라 양 기관은 ▲방산기업 대상 보증·공제·수출지원 프로그램 공동 운영 ▲‘DX KOREA 2026’(제7회 대한민국 방위산업전) 기간 중 세미나·수출 상담회 공동 개최 ▲참가기업 대상 수출 리스크 관리·금융보증 컨설팅 제공 ▲방산 스타트업 및 중소기업 지원 등을 추진하게 된다. 이에 따라 DX KOREA 2026 참가 기업들은 수출 계약부터 금융 조달, 리스크 관리까지 전 과정에 걸쳐 실질적인 지원을 받게 될 전망이다.",2025-12-10,https://www.seoul.co.kr/news/economy/2025/12/10/20251210500219,서울신문
