title,thumbnail,short_content,write_time,link,company
이란 해역 지나는 ‘만능키’… “우리는 중국 선박입니다”,https://img.seoul.co.kr/img/upload/2026/03/05/SSC_20260305171846_N1.jpg.webp,"美·이스라엘·동맹국 통행 시 공격 실제 ‘中 선주’ 위장해 건넌 사례도 페르시아만과 인근 해역을 지나는 선박들이 이란의 공격을 피하기 위해 ‘중국 선박’으로 위장하는 사례가 늘고 있는 것으로 전해졌다. 이란과 우방 관계인 중국 선박은 공격 대상에서 제외될 것이라는 기대 때문이다. 영국 파이낸셜타임스(FT)는 7일(현지시간) 해상 교통 데이터 플랫폼 마린트래픽을 분석한 결과 최근 일주일 동안 최소 10척의 선박이 트랜스폰더(선박 자동식별장치)에 입력하는 정보를 ‘중국인 선주’, ‘전원 중국인 선원’ 등으로 바꿨다고 보도했다. 이란은 지난 1일 호르무즈 해협 봉쇄를 선언하면서 미국·이스라엘·유럽 및 그 동맹국 선박의 통과를 금지했다. 다만 중국 선박에 대해서는 별도로 언급하지 않았다. 이에 일부 선주들이 중국과 관련된 것처럼 신호를 바꿔 해협을 통과하려는 것으로 보인다. 해운 데이터 플랫폼 케이플러의 매튜 라이트 애널리스트는 FT에 “특정 항구나 국적과의 연관성을 숨기기 위해 위장하는 것”이라고 설명했다. 신호를 바꾼 선박은 컨테이너선과 유조선 등 종류가 다양했으며 화물을 가득 실은 배와 빈 배가 섞여 있었다고 FT는 전했다. 트랜스폰더 신호는 주변 선박과",2026-03-09,https://www.seoul.co.kr/news/international/middleeast-africa/2026/03/09/20260309014004,서울신문
말 바꾼 트럼프 “쿠르드는 빠져라”… 지상군 투입 배제 안 해,https://img.seoul.co.kr/img/upload/2026/03/08/SSC_20260308175128_N1.jpg.webp,반이란 세력인 쿠르드족 민병대의 참전을 지지했던 도널드 트럼프 미국 대통령이 돌연 입장을 바꿔 개입을 원하지 않는다고 밝혔다. 미국의 최정예 공수부대가 훈련을 중단하고 대기에 들어가는 등 이란 본토로 지상군이 투입될 수 있다는 관측이 잇따르고 있다. 트럼프 대통령은 7일(현지시간) 전용기에서 취재진과 만나 “쿠르드족이 개입하지 않아도 전쟁은 충분히 복잡하다”며 이들의 개입을 배제하겠다고 말했다. 앞서 쿠르드족의 이란 공격 가능성에 대해 “전적으로 찬성한다”는 입장을 낸 것에서 180도 바뀐 것이다. 쿠르드족은 미군을 대신해 이번 대이란 전쟁에 지상군으로 투입될 가능성이 제기돼 왔다. 트럼프 대통령이 관련 입장을 바꾼 것은 쿠르드족이 이란전 참전을 계기로 각지에서 무장 궐기하는 등 전선이 확대될 가능성이 있다고 우려했기 때문으로 보인다. 쿠르드족을 이용해 대리전을 치르려 한다는 국제사회의 따가운 시선도 부담이 된 것으로 여겨진다. 트럼프 대통령은 “나는 쿠르드족이 다치거나 죽는 모습을 보고 싶지 않다”며 “우리는 좋은 관계를 유지해 왔다”고 부연했다. ‘쿠르드족 지상군’ 참전 가능성에 선을 그은 트럼프 대통령은 이란 군사력이 붕괴될 경우 지상군을 투입해 마,2026-03-09,https://www.seoul.co.kr/news/international/USA-amrica/2026/03/09/20260309004004,서울신문
테헤란 인근 유류시설 3곳서 불기둥… 이란은 유조선 때렸다,https://img.seoul.co.kr/img/upload/2026/03/09/SSC_20260309000350_N1.jpg.webp,"이 전투기 80대 석유 저장고 공격 베이루트 중심부서 첫 교전 발생 이란, 호르무즈 유조선 드론 타격 “UAE, 이란 공격… 걸프국 첫 보복” 미국·이스라엘과 이란 간 전쟁이 2주째로 접어든 가운데 중동 일대의 민간 시설로 피해가 확대되고 있다. 미·이스라엘의 광범위한 공습으로 이란이 더욱 고립된 가운데 전쟁이 장기화될지 여부는 2주 차 전황에서 가늠될 것이란 관측이 나온다. 공습 1주 차에 이란 영공을 장악한 미국과 이스라엘은 공격 대상을 이란 무기 생산 시설과 에너지 인프라로 넓히며 압박 수위를 높이고 있다. 7일(현지시간) 외신을 종합하면 이번 전쟁은 이날 현재 이란 수도 테헤란, 레바논 수도 베이루트, 호르무즈 해협 등 3대 전선으로 확대됐다. 이스라엘군은 이날 성명에서 80대 이상의 전투기가 테헤란 내 목표물을 향해 ‘광범위한 파상 공습’에 나섰다고 밝혔다. 주요 목표물은 테헤란과 이란 중부의 군사기지, 미사일 발사대 등이었다. 테헤란 인근 유류시설 3곳이 공격을 받았는데, 이란의 민간 에너지 시설이 공격받은 건 개전 이래 처음이었다. 국경에서 맞붙었던 이스라엘과 레바논 무장정파 헤즈볼라 간 교전은 레바논 수도 베이루트 중심부로 번졌다. 이스",2026-03-09,https://www.seoul.co.kr/news/international/middleeast-africa/2026/03/09/20260309002004,서울신문
“피해 본 이웃에 사과” 이란 대통령에 강경파 반발… 후계자 선출 임박,https://img.seoul.co.kr/img/upload/2026/03/09/SSC_20260309000352_N1.jpg.webp,"이란 대통령이 이란이 미국과 이스라엘에 반격하는 과정에서 피해를 본 주변 걸프 국가에 사과하고 공격을 중단하겠다고 선언하자 강경파 지도부가 반발하는 등 이란 정권 내부가 분열 조짐을 보이고 있다. 7일(현지시간) AFP통신, 뉴욕타임스(NYT) 등에 따르면 마수드 페제시키안 이란 대통령은 이날 오전 국영 TV 연설에서 “임시 지도자위원회가 이웃 국가들이 이란을 공격하지 않는 한 이들 국가에 대한 공격을 중단하는 안을 승인했다”고 밝혔다. 그러면서 “이란의 행동으로 피해를 본 이웃 국가들에 개인적으로 사과한다”고 덧붙였다. 온건 개혁 성향으로 분류되는 페제시키안 대통령의 사과는 걸프 국가가 계속되는 공격에 군사 대응을 검토하고, 유럽 주요국이 중동 동맹국에 대한 군사 지원을 공식화한 가운데 나왔다. 그의 발언은 걸프국의 분노를 누그러뜨리기 위한 의도가 깔린 것으로 풀이됐으나, 일부 성직자와 최정예 부대 이슬람혁명수비대(IRGC)의 분노를 샀다. 강경파 성직자이자 국회의원인 하미드 라사이는 엑스(X)에 “페제시키안씨, 당신의 입장은 비전문적이고 나약하며 용납할 수 없다”며 “군은 제멋대로 발포한 것이 아니라 억지력과 상호 대응이라는 정책에 따라 임무를 잘 수",2026-03-09,https://www.seoul.co.kr/news/international/middleeast-africa/2026/03/09/20260309002003,서울신문
쿠웨이트 석유 감산… 에너지 쇼크 닥쳤다,https://img.seoul.co.kr/img/upload/2026/03/08/SSC_20260308175032_N1.jpg.webp,"“이란 계속된 공격·위협… 불가항력” 美, 이란 민간 에너지시설 첫 공습 미국·이스라엘과 이란 간 전쟁이 격화하는 가운데 중동 주요 산유국인 쿠웨이트가 감산을 선언했다. 이란의 호르무즈 해협 봉쇄 상황을 고려한 것으로, 국제유가는 배럴당 90달러를 넘어서며 글로벌 에너지 위기가 본격적으로 엄습했다. 7일(현지시간) 로이터통신 등에 따르면 쿠웨이트 국영 석유회사 KPC는 이날 성명에서 “쿠웨이트에 대한 이란의 계속된 공격과 호르무즈 해협 선박 통항에 대한 위협에 따라 예방적 조치로 원유와 정제 처리량을 감축한다”고 밝혔다. 쿠웨이트는 원유 감산을 이유로 ‘불가항력 조항’을 들었다. 불가항력 조항은 전쟁과 자연재해 같은 상황에서 계약상 의무를 이행하지 않아도 책임을 면제해 준다. 아랍에미리트(UAE) 아부다비 국영석유회사(ADNOC)도 같은 날 “저장 수요를 충족하기 위해 해상 유전의 생산량을 적극적으로 관리하고 있고 장기간 지연 없이 정상 운영을 재개할 수 있게 하겠다”며 사실상 감산에 돌입했음을 시사했다. 미·이스라엘의 대이란 공습은 개전 후 처음으로 이란 석유 시설로 옮겨붙었다. 이스라엘군은 이날 테헤란과 인근 도시 카라지, 북서부 샤흐란 등의 석유 저",2026-03-09,https://www.seoul.co.kr/news/international/middleeast-africa/2026/03/09/20260309001004,서울신문
"“사별한 전처 묘 돌보다 아내와 싸웠습니다” 재혼남 하소연, 어쩌나",https://img.seoul.co.kr/img/upload/2024/05/27/SSC_20240527094028_N1.png.webp,"사별한 전처의 묘소를 여전히 돌보는 남편의 행동, 아내에게 무례인 걸까 아니면 존중해야 할까. 최근 미국의 유명 고민 상담 칼럼 ‘디어 애비’(Dear Abby)에는 사별한 전처의 묘소를 찾았다가 현재 아내와 갈등을 빚고 있다는 한 남성의 사연이 올라와 눈길을 끌고 있다. 미국 서부에 살고 있다는 남성 A씨는 최근 아내와 함께 처남과 장인의 묘소를 찾았다. 헌화를 마친 뒤 돌아오는 길에 A씨는 잠시 발걸음을 멈췄다. 16년 전 사별한 첫 번째 아내의 묘소를 살피기 위해서였다. 뒤늦게 이 사실을 알게 된 현재 아내는 큰 충격을 받았다. 사별한 지 16년이 넘었고, 자신과 재혼한 지도 벌써 15년이 지났는데 여전히 전처를 챙기고 있다는 점이 서운함으로 다가온 것이다. 아내가 “얼마나 자주 이런 일을 하느냐”고 묻자, A씨는 “일년에 두 번 정도 조화가 잘 있는지 확인한다”고 답했다. 하지만 이 답변은 오히려 화를 키웠고, 아내는 남편에게 배신감과 서운함을 토로하며 냉전 상태에 돌입했다. 이에 A씨는 “전처의 묘소가 부모님 묘역 근처에 있어서 지나가는 길에 예의를 표한 것일 뿐이며, 현재의 결혼 생활에도 매우 만족하고 있다”며 “죽은 이에게 예의를 갖추는 것",2026-03-08,https://www.seoul.co.kr/news/international/topic-global/2026/03/08/20260308500126,서울신문
"“트럼프, 美 특수부대 투입해 이란 우라늄 회수 검토”",https://img.seoul.co.kr/img/upload/2026/03/08/SSC_20260308172709_N1.jpg.webp,"미국과 이스라엘이 전쟁 후반 단계에 고농축 우라늄 비축량을 확보하기 위해 이란에 특수부대를 투입하는 방안을 논의했다는 보도가 나왔다. 미 정치전문매체 악시오스는 8일(현지시간) 이 논의 내용을 잘 알고 있는 네 명의 소식통을 인용해 “이란이 핵무기를 절대 보유하지 못하도록 막는 것은 트럼프 대통령의 선언된 전쟁 목표 중 하나”라며 “이란 정권이 보유한 450kg의 60% 농축 우라늄(몇 주 내로 무기급으로 전환 가능)은 이 목표 달성의 핵심 열쇠”라고 보도했다. 해당 물질을 압수하기 위한 작전이 성공하기 위해서는 이란 영토에 미군이나 이스라엘 군대를 투입해 전쟁이 벌어지는 한가운데서 중무장된 지하 시설을 탐색해야 할 가능성이 높다. 이 작전이 미국 단독 작전인지, 이스라엘 단독 작전인지, 아니면 공동 작전인지는 아직 불분명하다. 이 작전은 미국과 이스라엘 양국이 이란 군대가 관련 부대에 더 이상 심각한 위협을 가할 수 없다고 확신한 뒤에야 비로소 이루어질 가능성이 높다고 악시오스는 전했다. 이스라엘 국방 당국자는 트럼프 대통령과 그의 팀이 특정 임무를 위해 특수작전 부대를 이란에 파견하는 방안을 진지하게 검토 중이라고 밝혔다. 미국 당국자는 도널드 트럼프",2026-03-08,https://www.seoul.co.kr/news/international/2026/03/08/20260308500106,서울신문
트럼프 “쿠르드 참전 말라”...공수부대 대기 등 지상군 투입 관측 잇따라,https://img.seoul.co.kr/img/upload/2026/03/08/SSC_20260308172134_N1.jpg.webp,"전선 확대 우려, 대리전 등 부담 관측 “정당한 이유 있으면 지상군 투입 가능” 반이란 세력인 쿠르드족 민병대의 참전을 지지했던 도널드 트럼프 미국 대통령이 돌연 입장을 바꾸고 개입을 원하지 않는다고 밝혔다. 미국의 최정예 공수부대가 훈련을 중단하고 대기에 들어가는 등 본토 지상군이 투입될 수 있다는 관측이 잇따르고 있다. 트럼프 대통령은 7일(현지시간) 전용기에서 취재진과 만나 “쿠르드족이 개입하지 않아도 전쟁은 충분히 복잡하다”며 이들의 개입을 배제하겠다고 말했다. 앞서 쿠르드족의 이란 공격 가능성에 대해 “전적으로 찬성한다”는 입장을 낸 것에서 180도 바뀐 것이다. 독립국가를 이루지 못하고 중동에 흩어져 거주 중인 쿠르드족이 이란전 참전을 계기로 각지에서 무장궐기하는 등 전선이 확대될 가능성을 우려한 것으로 보인다. 미국은 2003년 이라크 전쟁과 2010년 이슬람국가(IS) 격퇴 당시 쿠르드족의 도움을 받았지만 독립국가 건설을 지원하지 않아 토사구팽이란 말을 들었는데, 이번에도 일찌감치 손절한 것 아니냐는 분석이 제기된다. 쿠르드족을 이용해 대리전을 치르려 한다는 국제사회의 따가운 시선도 부담이 된 것으로 보인다. 트럼프 대통령은 이란의",2026-03-08,https://www.seoul.co.kr/news/international/2026/03/08/20260308500104,서울신문
화염에 휩쌓인 테헤란…이란 석유 시설 첫 공습,https://img.seoul.co.kr/img/upload/2026/03/08/SSC_20260308165436_N1.jpg.webp,"트럼프 “무조건 항복 외엔 협상 없어” 이란 “6개월 전쟁 가능” 장기전 우려 석유시설을 겨냥한 미국·이스라엘의 대이란 공습으로 이란 수도 테헤란 등 주요도시가 거대한 불기둥에 휩싸이는 등 공습대상이 민간 시설로 확대되고 있다. 도널드 트럼프 미국 대통령은 이란에 ‘무조건 항복’을 요구하고 이란은 항전 의지를 다지면서 전쟁이 장기화할 수 있다는 우려가 나온다. 이스라엘군은 7일(현지시간) 테헤란과 인근 도시 카라즈, 북서부 샤흐란 등의 석유 저장 시설이 군수 물자 공급 용도로 사용되고 있다며 공습을 단행했다고 밝혔다. 지난달 28일 개전 이후 이란 에너지 시설이 직접 타깃이 된 건 처음이다. 뉴욕타임스(NYT)는 “석유 시설에서 발생한 폭발음으로 10~20㎞ 떨어진 집까지 흔들렸고 하늘이 연기로 뒤덮였다”며 “주택과 상점, 도로, 병원, 학교가 광범위하게 파괴됐다”고 보도했다. 이날 공격은 트럼프 대통령이 “이란은 매우 강력한 타격을 입을 것이다. 이란의 나쁜 행동 때문에 지금까지 목표물로 고려되지 않았던 지역과 집단이 파괴와 죽음을 위한 심각한 검토 대상이 됐다”고 위협한 이후 단행됐다. 트럼프 대통령은 “이란과의 협상은 무조건 항복 외에는 없을",2026-03-08,https://www.seoul.co.kr/news/international/2026/03/08/20260308500099,서울신문
“이란 죽음” 연설한 트럼프에 메시 ‘어리둥절’…女 피겨 스타 “백악관 안 가”,https://img.seoul.co.kr/img/upload/2026/03/08/SSC_20260308164528_N1.jpg.webp,"도널드 트럼프 미국 대통령이 2026 밀라노·코르티나담페초 동계올림픽과 자국 프로스포츠 리그 우승팀을 백악관으로 초청하고 있는 가운데, 미국의 피겨스케이팅 스타인 앰버 글렌이 “백악관에 가지 않겠다”고 선언했다. 7일(현지시간) AFP통신 등에 따르면 이번 동계올림픽에서 피겨스케이팅 단체전 금메달을 따낸 미국 대표팀의 일원인 글렌은 지난 5일 로스앤젤레스(LA)에서 한 성소수자 옹호 단체가 주최한 행사에 참석해 이같이 밝혔다. 글렌은 앞서 이번 대회에서 금메달을 따낸 미국 여자 아이스하키 대표팀이 백악관 초청을 거절한 것에 대해 “나도 하지 않기로 결정했기 때문에 그들을 비난하지 않는다”라고 말했다. 글렌은 “우리가 하는 일과 지지하지 않는 일을 선택할 수 있는 건 우리의 권리”라고 한 인터뷰에서 말했다. 트럼프 대통령은 이번 올림픽에서 금메달을 따낸 미국 남자 아이스하키 대표팀을 백악관에 초청했으며, 이어 여자 대표팀도 백악관에 초청하겠다고 밝혔다. 그러나 여자 대표팀은 대회 이후의 일정을 이유로 이를 거절했다. 성소수자…트럼프 지지자에 협박·욕설 시달려 미국 피겨스케이팅 여자 싱글의 간판 스타인 글렌은 양성애자로서 평소 성소수자의 인권과 관련해",2026-03-08,https://www.seoul.co.kr/news/international/USA-amrica/2026/03/08/20260308500096,서울신문
서반구 연합체 출범시킨 트럼프…“쿠바 막다른 골목 놓여”,https://img.seoul.co.kr/img/upload/2026/03/08/SSC_20260308161334_N1.jpg.webp,"미주 지역 범죄 카르텔 공동 대응 협력 이란 무력 충돌 속 ‘돈로주의’ 강조 풀이 도널드 트럼프 미국 대통령이 미주 지역의 범죄 카르텔에 대응하기 위해 미국과 중남미 국가들의 군사 협력을 강화하는 새로운 연합체를 공식 출범시켰다. 이란과의 무력 충돌에도 전략적 초점이 여전히 서반구에 있다는 ‘돈로주의’(서반구 패권주의)를 강조하기 위한 것으로, 트럼프 대통령은 쿠바를 향해선 “막다른 골목에 놓여있다”고 날을 세웠다. 트럼프 대통령은 7일(현지시간) 플로리다주 마이애미 도랄 리조트에서 아르헨티나와 볼리비아 등 중남미 12개국 정상들이 참석한 가운데 ‘미주의 방패’ 행사를 개최하고, ‘미주 카르텔 대응 연합’ 출범을 위한 대통령 포고문에 서명했다. 포고문은 연합체 참여국들이 서반구 내 범죄 카르텔의 영토 통제, 자금 조달, 자원 접근권을 박탈하기 위해 협력한다는 내용을 담았다. 미국이 전투력 확보를 위해 동맹국 군대를 훈련·동원할 수 있고, 연합체가 공동으로 ‘서반구 밖 악의적 외국 세력 등의 위협을 차단해야 한다’는 내용도 포함됐다. 이날 협의체 출범은 이란에 대한 군사작전으로 마가(미국을 다시 위대하게) 지지층 일각에서 제기되고 있는 불만을 잠재우",2026-03-08,https://www.seoul.co.kr/news/international/2026/03/08/20260308500086,서울신문
"한국 야구, 승부치기 끝 대만에 패배…호주 이겨야 ‘경우의 수’",https://img.seoul.co.kr/img/upload/2026/03/08/SSC_20260308153437_N1.jpg.webp,"한국 야구가 대만에 발목잡히면서 월드베이스볼클래식(WBC) 8강 진출에 먹구름이 끼었다. 한국은 8일 일본 도쿄돔에서 열린 2026 WBC 조별리그 C조 대만과의 경기에서 10회 승부치기 접전 끝에 4대5로 패배했다. 한국은 1대2로 끌려가던 6회 말 김도영의 투런 포로 역전에 성공했지만, 8회 투런 홈런을 내줘 3대4로 재역전당했다. 8회 말 김도영의 2루타로 동점을 만들어내 연장 10회 승부치기에 돌입했고, 한국은 무사 1, 3루에서 대만 장군위의 스퀴즈 번트에 1점을 내줬다. 앞서 체코에 승리하고 일본에 패배 한국은 이날 대만에게 패하면서 1승 2패에 그쳤다. 한국은 9일 오후 7시 열리는 호주와의 조별리그 최종전에서 승리해야 ‘경우의 수’를 따져 8강 진출을 기대해볼 수 있게 됐다. 앞서 2승을 거둔 호주는 이날 오후 7시 일본(2승)과의 경기를 앞두고 있다. 호주가 일본을 이기면 한국은 조별리그에서 탈락한다. 호주가 일본에 지고 한국이 호주를 잡으면 한국과 대만, 호주가 2승 2패 동률이 된다. 이 경우 3개국 간 맞대결에서 실점 수를 아웃카운트 수로 나눈 결과를 비교해 조 2위를 정한다.",2026-03-08,https://www.seoul.co.kr/news/sport/baseball/WBC2026/2026/03/08/20260308500077,서울신문
WBC 한일전에 또 ‘욱일기’…“주최 측 강력 조치해야”,https://img.seoul.co.kr/img/upload/2026/03/08/SSC_20260308140449_N1.jpg.webp,지난 7일 일본 도쿄돔에서 열린 2026 월드베이스볼클래식(WBC) 한일전에서 욱일기 응원이 등장해 논란이다. 서경덕 성신여대 교수는 지난 8일 소셜미디어(SNS)에 “몇몇 일본 팬들이 도쿄돔에 입장하기 전 욱일기를 버젓이 펼치고 응원하는 장면이 포착됐다”며 “즉각 WBC 측에 항의 메일을 보냈다”고 했다. 서 교수는 항의 메일에서 “욱일기는 일본 군국주의와 제국주의를 상징하는 깃발이고 욱일기 응원은 과거 일본이 범한 침략전쟁 역사를 부정하는 짓”이라며 “아시아인들에게는 전쟁 공포를 다시금 상기시키는 행위”라고 했다. 그는 “이런 욱일기 역사를 인정한 FIFA(국제축구연맹)는 지난 카타르 월드컵에서 일본 측 응원단이 펼친 욱일기 응원을 즉각 제지했다”고 했다. 이어 욱일기 관련 영상을 첨부하면서 “WBC 주최 측도 욱일기 응원을 금지하고 다시는 이런 행위가 벌어지지 않도록 강력한 조처를 해달라”고 강조했다. 앞서 2023년 도쿄돔에서 열린 WBC 한일전에서도 욱일기 응원이 등장해 논란이 됐다. 하지만 미국 메이저리그 사무국과 선수노조가 주도하는 WBC에는 이를 제재하는 특별한 조항이 없다. 정치적 의도가 담긴 문구나 행위를 엄격히 금지하는 국제축구연맹(,2026-03-08,https://www.seoul.co.kr/news/society/accident/2026/03/08/20260308500060,서울신문
"“트럼프, 100시간 전쟁에 5조원 태웠다”…초고가 청구서 [배틀라인]",https://img.seoul.co.kr/img/upload/2026/03/08/SSC_20260308130402_N1.jpg.webp,"[배틀라인 3줄 요약] ● 미·이스라엘의 대이란 군사작전 ‘장대한 분노’ 첫 100시간 전쟁 비용이 약 37억 달러(5조원)로 추산됐다. ● 전체 비용의 80% 이상이 정밀유도 탄약 보충 비용으로, 현대 공습전에서 무기 가격이 전쟁 비용을 좌우하는 구조가 드러났다. ● 이란의 저가 드론·미사일 공격을 고가 방공망으로 요격하는 ‘비대칭 비용’과 미 의회 예산 변수는 작전 지속 가능성을 좌우할 핵심 변수로 꼽힌다. 미국과 이스라엘의 대(對)이란 군사작전 ‘장대한 분노’(Epic Fury) 첫 100시간 동안 미국이 지출한 전쟁 비용이 약 37억 달러(약 5조 4945억원)에 달하는 것으로 추산됐다. 미국 외교안보싱크탱크 CSIS는 5일(현지시간) 보고서에서 미군 작전 비용과 탄약 사용량, 장비 손실 등을 종합해 이 같은 규모를 제시했다. 하루 평균 약 9억 달러(약 1조 3360억원), 시간당 약 3700만 달러(약 550억원) 수준이다. 이는 전쟁 기간 대비 큰 비용이 드는 현대전의 패러다임 변화를 드러낸 것으로 평가된다. 최근 미군 작전 가운데서도 상당히 많은 비용이 소요된 작전이라는 분석이 나온다. 전쟁 100시간, 5조원 증발…80%는 탄약",2026-03-08,https://www.seoul.co.kr/news/international/2026/03/08/20260308500056,서울신문
‘우주에서 빚은 술’ 가격 ‘어마어마’…“100㎖당 9억원”,https://img.seoul.co.kr/img/upload/2026/03/08/SSC_20260308113731_N1.jpg.webp,"일본 주조회사가 우주에서 만든 술이 100㎖당 9억원에 판매될 예정이다. 지난 7일 요미우리신문 등에 따르면 주조회사 닷사이는 국제우주정거장(ISS)의 일본 실험동에서 양조된 청주 발효물을 전날 간사이국제공항에서 건네받았다. 닷사이는 지난해 10월 규슈 남부 다네가시마 우주센터에서 쏘아 올려진 화물 보급 우주선 HTV-X 1호기에 누룩과 쌀 등 청주 원료와 양조 설비를 실어 ISS로 보냈다. 이어 ISS 실험동에서 우주비행사 도움으로 양조 작업이 진행됐다. 이 회사 사쿠라이 히로시 회장은 “이미 알코올이 검출됐다”며 “우주 공간에서 발효가 가능할지 몰랐지만, 지금은 조금 안심했다”고 말했다. 발효물은 냉동 상태로 지난달 27일 지구로 귀환했으며 다시 항공편으로 미국에서 일본으로 보내졌다. 닷사이는 앞으로 인류가 달 표면에 이주해도 술을 즐길 수 있게 하겠다는 목표로 이번 프로젝트를 진행했다. 이 회사는 발효물에서 술찌꺼기를 걸러내는 등 추가 작업을 거쳐 완성한 청주 약 100㎖를 최종 구매자에게 전달할 계획이다. 이미 약 1억엔(약 9억원)에 예약 판매한 상태이며 판매 대금은 일본의 우주 개발 사업에 기부할 예정이다.",2026-03-08,https://www.seoul.co.kr/news/international/japan/2026/03/08/20260308500041,서울신문
