title,thumbnail,short_content,write_time,link,company
“파업 불참 시 해고 1순위”…삼성전자 노조 ‘경고’ 논란,https://img.seoul.co.kr/img/upload/2026/02/12/SSC_20260212150328_N1.png.webp,"삼성전자 노동조합이 9일부터 쟁의 행위 찬반 투표를 실시하면서 향후 파업에 참여하지 않는 직원에게 불이익을 주겠다고 밝혀 논란이다. 8일 업계에 따르면 삼성전자 노조 공동투쟁본부(본부)는 9일부터 18일까지 전체 조합원을 대상으로 쟁의 행위 찬반 투표를 실시한다. 본부에 소속된 노조는 초기업노조 삼성전자지부, 전국삼성전자노동조합(전삼노), 삼성전자노조동행 등으로 전체 합산 조합원 수는 약 8만 9000명으로 추산된다. 본부 측은 지난 5일 유튜브 라이브 방송을 통해 투표에서 과반 찬성으로 쟁의권을 확보할 경우 다음 달 23일 조합원 참여 집회를 열고 오는 5월 21일부터 6월 7일까지 18일간 총파업을 진행할 계획이라고 밝혔다. 최승호 초기업노조 위원장은 유튜브 방송에서 “총파업 동안 모든 집행부는 평택 사무실을 점거해 집회를 진행할 계획이며 스태프를 모집해 평택 사업장 모든 사무실에서 관리·감독할 것”이라며 “만약 회사를 위해 근무하는 자가 있다면 명단을 관리해 추후 조합과의 협의가 필요한 강제 전환 배치나 해고에 이들을 우선해 안내할 것”이라고 했다. 노조는 파업 기간 신고센터를 운영해 회사에 협조적인 직원들을 신고할 경우 포상을 주는 제도도 운용하겠",2026-03-08,https://www.seoul.co.kr/news/economy/industry/2026/03/08/20260308500115,서울신문
석유·가스 중동 의존도 10년만에 20%p 감소…미국으로 수입선 다변화,https://img.seoul.co.kr/img/upload/2026/03/08/SSC_20260308174805_N1.png.webp,"미국·이스라엘과 이란 전쟁으로 호르무즈 해협이 봉쇄된 가운데 미국으로 원유·가스 등 에너지 수입선을 다변화하는 카드가 주목받고 있다. 미국의 서부텍사스산 원유와 셰일가스가 중동산보다 싸고, 중동의 지정학적 리스크가 없어 정치적으로 안정돼 있다는 분석이다. 8일 한국무역협회 통계 서비스에 따르면 지난해 한국의 원유(MTI 1310 기준) 수입액 총 753억 달러(약 111조 8200억원) 중 사우디아라비아, 아랍에미리트(UAE) 등 중동 국가 수입 비중이 68.8%였다. 석유의 중동 수입 의존도는 2016년 85.2%에 달했지만 주요 수입국을 미국으로 다변화하며 꾸준히 낮아졌다. 2021년 59.5%까지 떨어졌다 2022년 67.0%, 2023년 71.6%로 다시 반등했던 중동 의존도는 지난해 다시 70% 선 밑으로 내려갔다. 지난해 미국은 석유 수입 비중 17.1%로 2대 수입국을 기록했다. 천연가스(MTI 1340 기준)는 지난해 총 수입액 260억 달러 중 19.7%만 중동에서 수입했다. 지난해 천연가스 최대 수입국은 호주(32.8%)였고 카타르(15.3%), 말레이시아(15.0%), 미국(9.2%), 러시아(5.1%), 인도네시아(3.5%), 오만(",2026-03-08,https://www.seoul.co.kr/news/economy/industry/2026/03/08/20260308500109,서울신문
"HD현대일렉트릭, 美 변압기 공장 증설 착수…북미 시장 공략 가속",https://img.seoul.co.kr/img/upload/2026/03/08/SSC_20260308173712_N1.jpg.webp,"HD현대일렉트릭이 미국 앨라배마에 제2공장 건설에 착수했다. 앨라배마 공장은 북미 최대 규모의 초고압 변압기 생산기지로, 전력 인프라 호황에 대응해 생산 능력을 확보할 계획이다. HD현대일렉트릭은 6일(현지시간) 미국 앨라배마주 몽고메리시에 위치한 북미 생산법인(HD HPT)에서 제2공장 기공식을 개최했다고 8일 밝혔다. 행사에는 김영기 HD현대일렉트릭 사장, 이준호 애틀랜타 총영사, 앨런 맥네어 앨라배마주 상무장관 등이 참석했다. HD HPT는 2011년 국내 전력기기 업계 최초로 미국에 구축한 변압기 생산공장이다. 북미에서 가장 큰 전력변압기 제조기지로 연간 초고압 변압기 생산 능력은 105대에 달한다. 제2공장이 준공되면 생산능력은 50% 증가한다. HD현대일렉트릭 관계자는 “미국 노후 전력 인프라 교체와 전력망 현대화 투자 수요가 급증하면서 선제적으로 현지 투자를 해왔다”며 “이번 제2공장을 성공적으로 완공하고, 올해 9월 완료 예정인 울산공장 증설과도 시너지를 내 북미 초고압 변압기 시장에서의 리더십을 더욱 강화하겠다”고 말했다.",2026-03-08,https://www.seoul.co.kr/news/economy/2026/03/08/20260308500108,서울신문
"갤러리아 센터시티, 봄 시즌 ‘G-Week’ 선보여",https://img.seoul.co.kr/img/upload/2026/03/08/SSC_20260308173133_N1.jpg.webp,"G캐시 최대10% 적립·카드 무이자 할부 갤러리아 센터시티는 12~15일 고객을 대상으로 다양한 혜택을 제공하는 G-Week 행사를 진행한다고 8일 밝혔다. 이번 행사의 특징은 구매 금액대별 G캐시 적립과 카드 무이자 할부 혜택을 결합해 고객 체감 혜택을 강화했다. 행사 기간 중 단일 브랜드에서 10만원 이상 구매한 고객에게는 ‘GOURMET 보냉 장바구니’를 증정한다. G캐시 적립 혜택도 마련했다. 전 고객을 대상으로 단일 브랜드 30·60·100만원 이상 구매 시 5% G캐시를 제공한다. 패션 일부 브랜드 구매 시 10% G캐시를 제공하는 G-Week 판촉 사은 행사도 함께 운영한다. 카드 혜택도 강화했다. 갤러리아 카드로 단일 브랜드 100만원 이상 구매 시 최대 10개월 무이자 할부로 이용할 수 있다. 대형가전 품목은 300만원 이상이며 식품관, 제휴카드, 온라인 구매는 제외된다. 갤러리아 관계자는 “단기간 집중 프로모션을 통해 고객들에게 실질적인 쇼핑 혜택을 제공하고자 이번 행사를 기획했고 풍성한 혜택을 마련했다”고 말했다.",2026-03-08,https://www.seoul.co.kr/news/economy/distribution/2026/03/08/20260308500107,서울신문
[르포]“중국 말곤 온산제련소 뿐”…미중 ‘광물 대결’에 몸값 치솟는 K제련,https://img.seoul.co.kr/img/upload/2026/03/08/SSC_20260308172314_N1.jpg.webp,"지난 5일 찾은 울산 울주군 고려아연 온산제련소 인듐 공장에서는 약 200도의 고온에서 녹은 은빛 액체가 주조 용기에 들어간 뒤 길이 약 50㎝, 무게 5㎏, 순도 99.999%의 인듐괴로 생산됐다. 열을 식힌 고순도의 인듐은 1t 단위로 적재된 뒤 공장을 빠져나갔다. 인듐은 반도체와 양자컴퓨터 양자처리장치(QPU)·태양전지·디스플레이 등 첨단 산업에 사용되는 금속이며, 미국 등 주요국이 지정한 핵심 전략광물이다. 전종빈 고려아연 전자소재팀 책임은 “중국의 전략 광물 수출 통제로 가격이 더 올라 지난해 1t당 6억원에서 최근 10억원을 넘겼다”며 “90%는 미국과 일본으로 팔려 나간다”고 설명했다. 미·중 간 광물 전쟁이 격화하면서 미국 주도의 ﻿핵심광물 공급망 재편이 속도를 내는 가운데 우리나라 비철금속 제련 기술이 주목받고 있다. 우리나라는 중국 외 핵심 광물 제련 기술을 가진 유일한 국가다. 특히 최근 미국의 이란 공습으로 중동 긴장이 커지면서 전략 광물 공급망의 중요성은 더욱 커지고 있다. 중국이 2024년 전략광물 수출 통제를 본격화하자 고려아연이 대체 공급망으로 급부상했다. 세계 전략광물 생산량의 70%를 차지하는 중국을 제외하면, 전략 광물",2026-03-08,https://www.seoul.co.kr/news/economy/2026/03/08/20260308500105,서울신문
"“어서 타” 이번엔 김승연 회장…한화, 사상 첫 ‘시총 4위’",https://img.seoul.co.kr/img/upload/2026/03/03/SSC_20260303170301_N1.jpg.webp,"중동 사태 이후 시가총액 상위 그룹들 순위에 ‘지각변동’이 일어났다. 방산주가 급등하면서 방산 기업을 다수 보유한 한화그룹이 LG그룹을 제치고 시가총액 4위로 올라섰다. 8일 한국거래소에 따르면 6일 기준 한화그룹 12개 상장사의 시가총액 합산액은 180조 6740억원으로 집계됐다. 이는 삼성그룹(1433조 2720억원)과 SK그룹(826조 5930억원), 현대자동차그룹(300조 6250억원)에 이은 4위 규모다. 그간 4위를 지켰던 LG그룹(175조 290억원)은 5위로 내려앉았다. 한화에어로스페이스와 한화시스템 등 방산 관련 계열사들의 주가가 중동 사태를 계기로 ‘지붕 없는’ 상승을 이어가면서 한화그룹의 시총을 키웠다. 국내 방산 대장주인 한화에어로스페이스는 미국과 이스라엘의 이란 침공 이후 첫 거래일인 3일부터 4거래일간 23.9% 급등해 종가 기준 신고가인 148만 1000원까지 치솟았다. 지난 6일에는 장중 신고가(165만 5000원)를 기록하기도 했다. 같은 기간 한화시스템도 39.8% 급등해 15만 8900원으로 종가 기준 신고가에 장을 마감했다. 한화그룹의 시가총액은 지난 3일 한화에어로스페이스가 19%대, 한화시스템이 29%대 급등하면",2026-03-08,https://www.seoul.co.kr/news/economy/securities/2026/03/08/20260308500103,서울신문
중동발 ‘3고 악재(유가·환율·물가)’에 안개 낀 2% 경제성장률,https://img.seoul.co.kr/img/upload/2026/03/08/SSC_20260308165437_N1.jpg.webp,"미국과 이란의 군사충돌로 촉발된 중동 사태가 장기화할 조짐이 보이면서 ‘고유가·고환율·고물가’ 등 이른바 ‘3고 충격’이 가시화하고 있다. 에너지와 원자재 수입 의존도가 높은 한국 경제 특성상 이런 충격이 이어질 경우 정부가 제시한 올해 경제성장률 2.0% 전망도 흔들릴 수 있다는 분석이 나온다. 8일 관련 업계에 따르면 지난 6일(미국 동부시간) 뉴욕상업거래소에서 4월 인도분 서부텍사스산원유(WTI) 가격은 전장 대비 9.89달러(12.21%) 폭등한 배럴당 90.90달러에 마감됐다. 52주 신고가로, 2023년 9월 28일 이후 최고치다. 유가 급등은 단순히 에너지 가격 상승에 그치지 않는다. 원유는 운송비와 전기요금, 각종 원자재 가격에 영향을 미치기 때문에 시간이 지나면 전반적인 물가 상승 압력으로 번지는 경우가 많다. 우크라이나 전쟁이 시작된 2022년에도 국제 유가 급등이 물가 상승의 핵심 요인으로 작용했다. 당시 미국과 유럽의 러시아산 석유 제재로 국제 유가가 배럴당 100달러를 넘어서면서 국내 휘발유와 경유 가격도 리터당 2100원을 돌파했다. 그 결과 2022년 우리나라 소비자물가 상승률은 5.1%로, 외환위기 직후였던 1998년 이후 가",2026-03-08,https://www.seoul.co.kr/news/economy/2026/03/08/20260308500100,서울신문
“설계사 따라 보험 갈아탔다 보장 끊겨”… ‘1200% 룰’ 앞두고 설계사 몸값 전쟁,https://img.seoul.co.kr/img/upload/2026/03/08/SSC_20260308164045_N1.png.webp,"정착지원금 1억원·연봉 2~3배… 설계사 영입 경쟁 “팀원 10명 데려오면 2억원”… 관리자 팀 영입 확산 10년 넘게 한 대형보험사 소속 설계사와 거래해 온 50대 고객 A씨는 최근 예상치 못한 일을 겪었다. 담당 설계사가 법인보험대리점(GA)으로 옮겼다며 새로운 암보험 가입을 권유한 것이다. A씨는 기존 계약을 해지하고 새 상품에 가입했다. 하지만 얼마 뒤 위암 2기 진단을 받았고, 가입 후 90일이 지나지 않았다는 이유로 보험금 지급이 거절됐다. 원래 보험을 유지했다면 받을 수 있었던 보장이 사라진 셈이다. 보험 설계사를 둘러싼 ‘몸값 경쟁’이 격화되면서 소비자 피해가 늘어날 수 있다는 우려가 나온다. 설계사 이동이 잦아질수록 기존 고객에게 보험을 해지하고 새 상품으로 갈아타도록 권유하는 ‘승환 계약’ 역시 늘어날 가능성이 있기 때문이다. 계약을 해지하면 해약환급금 손실이 발생하고, 새 보험은 면책기간이 다시 적용돼 보장 공백이 생길 수 있다. 8일 보험업계에 따르면 최근 설계사 영입 경쟁이 과열되는 분위기다. 과거에는 설계사 개인을 중심으로 스카우트가 이뤄졌지만 최근에는 지점장·팀장 등 영업 관리자와 설계사를 한꺼번에 데려오는 ‘팀 단위 영입’이",2026-03-08,https://www.seoul.co.kr/news/economy/finance/2026/03/08/20260308500093,서울신문
구윤철 부총리 “석유류 ‘바가지 가격’ 반드시 근절”,https://img.seoul.co.kr/img/upload/2026/03/08/SSC_20260308155555_N1.jpg.webp,"구윤철 부총리 겸 재정경제부 장관이 최근 중동 사태로 국제유가가 급상승하면서 국내 석유류 가격이 과도하게 오른 것을 ‘바가지 요금’으로 규정하며 대응 의지를 밝혔다. 구 부총리는 8일 소셜미디어(SNS) 엑스(X·옛 트위터)에 글을 올려 “공동체를 해하는 폭리 요금은 근절해야 한다”고 밝혔다. 그는 “지난달 25일 대통령 주재 국가관광전략회의에서 발표된 ‘바가지 요금 근절 대책’이 전례 없는 고강도 대책이라는 평가가 있다”면서 “‘시장 자율’이라는 명목 하에 사회질서를 해치면서까지 성수기와 대형 이벤트가 있을 때마다 반복돼 온 일각의 한탕주의 행태를 ‘뿌리 뽑기’ 위한 조치였다”고 언급했다. 그러면서 “최근 중동 상황과 맞물린 석유류의 과도한 인상도 마찬가지”라며 “상식과 통념에 맞는 수준으로 가격이 결정될 수 있도록 단호히 대응하겠다”고 밝혔다. 석유류 가격 인상 문제에 대해서도 같은 원칙이 적용돼야 함을 시사한 구 부총리는 “업계의 적극적인 협조를 당부드린다”고 덧붙였다. 정부는 최근 중동 정세 불안으로 유류 가격이 크게 오른 것에 대해 연일 대응 의지를 피력하고 있다. 범부처 합동점검단은 지난 6일부터 불법 석유 유통, 매점매석, 가짜 석유·혼합",2026-03-08,https://www.seoul.co.kr/news/economy/2026/03/08/20260308500080,서울신문
"LG유플러스·퓨리오사AI, 기업용 ‘소버린 AI 어플라이언스’ 개발 추진[MWC26]",https://img.seoul.co.kr/img/upload/2026/03/08/SSC_20260308152538_N1.jpg.webp,LG유플러스와 인공지능(AI) 반도체 스타트업 퓨리오사AI가 기업 내부에서 바로 사용할 수 있는 ‘소버린 AI 어플라이언스’ 개발에 나선다. 외부 클라우드로 데이터를 보내지 않고 기업 내부 인프라에서 AI를 활용할 수 있는 시스템으로 공공·국방·의료 등 보안이 중요한 분야를 겨냥한 사업이다. 양사는 4일(현지시간) 스페인 바르셀로나에서 열린 MWC26 현장에서 기자간담회를 열고 기업용 소버린 AI 어플라이언스 공동 개발 계획을 공개했다. 이 장비는 기업 내부 인프라(온프레미스) 환경에서 AI를 구동할 수 있는 일체형 시스템이다. 복잡한 서버 구축 없이 전원과 네트워크만 연결하면 바로 사용할 수 있는 ‘AI 장비’ 형태로 설계되는 것이 특징이다. LG유플러스는 기업용 AI 플랫폼과 LG AI연구원의 ‘엑사원(EXAONE) 4.0’ 모델을 기반으로 시스템 구조를 설계한다. 퓨리오사AI는 자사 신경망처리장치(NPU)를 활용해 AI 연산 성능을 높이고 전력 효율을 개선하는 역할을 맡는다. 이상엽 LG유플러스 최고기술책임자(CTO)는 현장 간담회에서 “소버린 AI 수요는 커지고 있지만 기업이 직접 AI 인프라를 구축하기에는 부담이 큰 것이 현실”이라며 “전원과 네,2026-03-08,https://www.seoul.co.kr/news/economy/industry/2026/03/08/20260308500074,서울신문
“상장사 여성 임원 100명 중 4명 뿐”… 여전한 ‘유리천장’,https://img.seoul.co.kr/img/upload/2026/03/08/SSC_20260308121520_N1.png.webp,"여성 임원 비율 0.42%… 남성 4분의 1 이사회 여성 사내이사 없는 기업 81% 국내 상장기업에서 여성 직원 비중은 늘고 있지만 고위직으로 올라갈수록 여성의 비중은 크게 낮아지는 등 ‘유리천장’이 여전히 견고한 것으로 나타났다. KCGI자산운용은 ESG 평가기관 서스틴베스트와 함께 국내 주요 상장기업 360곳의 성평등 지표를 분석한 결과 여성 직원 중 임원으로 선임되는 비율이 0.42%에 그쳤다고 8일 밝혔다. 여성 직원 1000명 중 4명만 임원이 되는 셈으로, 남성 임원 선임 비율 1.6%의 4분의 1 수준이다. 기업 내 여성 인력 비중은 증가하는 추세다. 조사 대상 기업의 여성 직원 비중은 2020년 25.0%에서 2024년 28.6%로 3.6%포인트 늘었다. 그러나 임원과 이사회 등 의사결정 구조에서는 여성 비중이 여전히 낮은 것으로 나타났다. 실제로 2024년 기준 조사 대상 기업 360곳 가운데 292곳(81.1%)은 여성 사내이사가 한 명도 없는 것으로 집계됐다. 자산총계 2조원 이상 대기업의 경우에도 여성 직원 중 임원 비율은 0.35%에 그쳤다. 또 여성 임원을 사외이사 형태로 선임한 기업은 171곳(47.5%)으로 나타났다. 남녀",2026-03-08,https://www.seoul.co.kr/news/economy/2026/03/08/20260308500048,서울신문
“기계는 우리 것만 써라” 가맹점 압박한 동대문엽떡에 공정위 시정명령,https://img.seoul.co.kr/img/upload/2026/03/08/SSC_20260308113806_N1.png.webp,"공정거래위원회는 떡볶이 전문점 ‘불닭발 땡초 동대문엽기떡볶이’의 가맹본부 ㈜핫시즈너에 전자기기 품목을 자신 또는 자신이 지정한 특정 거래상대방에게만 구입하도록 강제한 행위로 시정명령을 결정했다고 8일 밝혔다. 가맹본부가 구입처를 강제한 기기는 정산 정보를 처리하는 포스(POS), 키오스크, 정보·광고 등을 제공하는 디지털 정보 디스플레이(DID) 3개 품목이다. 핫시즈너는 2013년 4월부터 지난해 8월까지 POS를, 2024년 8월부터 지난해 8월까지는 키오스크와 DID를 강제 품목으로 지정하고 공급처를 제한했다. 가맹본부나 가맹본부가 지정한 업체 외 타 업체로부터 공급받을 경우에는 공급 제한, 가맹계약 해지 및 위약벌 등을 부과할 수 있는 계약 조항을 설정했다. 하지만 해당 전자기기는 시중에서 유사한 성능의 제품을 쉽게 구매할 수 있는 일반 공산품이다. 공정위는 반드시 특정 거래처를 통해서만 구매할 필요가 있다고 보기 어렵다고 판단했다. 이에 공정위는 가맹사업법상 부당한 거래상대방 구속에 해당한다고 보고 시정명령을 결정했다. 실제로 가맹본부는 지난해 8월 이후 이 사건 3종 품목을 거래상대방 ‘필수’ 품목에서 ‘권장’ 품목으로 변경했다. 공정위는 “가",2026-03-08,https://www.seoul.co.kr/news/economy/2026/03/08/20260308500042,서울신문
“이란 하메네이 후계자로 차남 모즈타바 선출”,https://img.seoul.co.kr/img/upload/2026/03/09/SSC_20260309062355_N1.jpg.webp,[속보] “이란 하메네이 후계자로 차남 모즈타바 선출”,2026-03-09,https://www.seoul.co.kr/news/international/2026/03/09/20260309500002,서울신문
"中 외교부장, 美 언급 없이 이란전쟁 비판",https://img.seoul.co.kr/img/upload/2026/03/08/SSC_20260308182043_N1.jpg.webp,왕이(왼쪽 두 번째) 중국 외교부장이 8일 베이징에서 열린 전국인민대표대회 외교 분야 기자회견에서 발언하고 있다. 왕 부장은 미국·이스라엘의 공습으로 시작된 이란 전쟁에 대해 미국을 겨냥한 직접적인 비판은 피한 채 “일어나서는 안 될 전쟁”이라며 휴전을 촉구했다. 베이징 신화 연합뉴스,2026-03-09,https://www.seoul.co.kr/news/international/china/2026/03/09/20260309014008,서울신문
시진핑 “군은 총 든 곳… 딴마음 품지 마라”,https://img.seoul.co.kr/img/upload/2026/03/08/SSC_20260308182038_N1.jpg.webp,"내부 기강·충성 논란 불거지자 부패 군인에 무관용 입장 발표 시진핑 중국 국가주석이 “군에는 당에 대해 다른 마음을 품은 사람이 있어선 안 된다”며 부패한 군 인사에 대한 무관용 입장을 밝혔다. 8일 중국 관영 신화통신에 따르면 시 주석은 전날 베이징에서 열린 제14기 전국인민대표대회(전인대) 4차 회의 해방군·무장경찰부대 대표단 전체회의에 참석해 이같이 말했다. 시 주석은 “군대는 총을 든 곳”이라고 강조하며 “부패 분자가 숨을 곳이 없도록 해야 하며 흔들림 없이 반부패 투쟁을 해야 한다”고 말했다. 이 발언은 최근 군 수뇌부에서 부패 사건이 잇따르며 대대적인 숙청이 이어지는 상황에서 나왔다. 군 서열 2위인 장유샤 중앙군사위원회 부주석과 류전리 연합참모부 참모장 등이 기율·법률 위반 혐의로 입건돼 조사받으면서 군 내부 기강 문제와 충성 논란이 불거진 상태다. 시 주석은 또 “제15차 5개년 계획에 맞춰 엄격한 감독·관리와 강력한 규율 체계를 구축해야 한다”며 자금 흐름과 권력 운영, 품질 관리 등 핵심 분야를 철저히 점검하라고 지시했다. 이어 군비 예산 관리 개혁을 추진해 자금을 필요한 곳에 효율적으로 사용해야 한다고 강조했다. 아울러 ‘정치건군’(정",2026-03-09,https://www.seoul.co.kr/news/international/china/2026/03/09/20260309014007,서울신문
대만 행정부 수장은 왜 단교 54년 만에 일본 찾았나,https://img.seoul.co.kr/img/upload/2026/03/09/SSC_20260309000553_N1.jpg.webp,"다카이치 사나에 일본 총리의 ‘대만 유사시’ 발언으로 중일 갈등이 이어지는 가운데 대만 총리 격 인사가 일본을 찾았다. 대만 행정부 수장의 방일은 일본과 대만이 단교한 1972년 이후 처음이다. 8일 아사히신문 등 일본 언론은 대만 중앙통신사를 인용해 줘룽타이 대만 행정원장이 지난 7일 일본을 방문했다고 보도했다. 그는 도쿄돔에서 열린 2026 월드베이스볼클래식(WBC) C조 조별리그 대만 대 체코 경기를 관람했다. 줘 행정원장은 주일 대만대사 격인 리이양 타이베이주일경제문화대표처 대표, 리양 운동부장과 함께 경기를 지켜보다 6회말 무렵 경기장을 떠난 것으로 전해졌다. 대만은 이날 체코를 14-0으로 꺾었다. 아사히신문은 “일본과 대만의 외교 관계가 끊긴 상황에서 현역 행정원장이 일본을 찾은 것은 매우 이례적”이라고 전했다. 대만 행정원 측은 이번 일본 방문이 “사적인 일정”이라며 확대 해석을 경계했다. 신문은 행정원장의 방일이 1972년 단교 이후 사실상 처음이라고 전했다. 2004년 유시쿤 당시 행정원장이 미국 방문 뒤 귀국 과정에서 태풍을 이유로 일본 오키나와에 들른 사례가 있지만 이를 제외하면 첫 사례라는 설명이다. 일본은 그동안 중국과의 관계를",2026-03-09,https://www.seoul.co.kr/news/international/2026/03/09/20260309014006,서울신문
"중남미와 反카르텔 연합 띄운 트럼프… “쿠바, 막다른 골목에”",https://img.seoul.co.kr/img/upload/2026/03/08/SSC_20260308161334_N1.jpg.webp,"‘미주의 방패’ 행사서 포고문 서명 아르헨 등 중남미 12개국 정상 참석 영토 통제·자금 조달 등 차단 협력 석유 끊긴 쿠바 두고 “협상 원할 것” 쿠바 대통령은 “신식민주의” 비판 도널드 트럼프 미국 대통령이 미주 지역의 범죄 카르텔에 대응하기 위해 미국과 중남미 국가들의 군사 협력을 강화하는 새로운 연합체를 공식 출범시켰다. 이란과의 무력 충돌에도 전략적 초점이 여전히 서반구에 있다는 ‘돈로주의’(서반구 패권주의)를 강조하기 위한 것으로, 트럼프 대통령은 쿠바를 향해선 “막다른 골목에 놓여있다”고 날을 세웠다. 트럼프 대통령은 7일(현지시간) 플로리다주 마이애미 도랄 리조트에서 아르헨티나와 볼리비아 등 중남미 12개국 정상들이 참석한 가운데 ‘미주의 방패’ 행사를 개최하고, ‘미주 카르텔 대응 연합’ 출범을 위한 대통령 포고문에 서명했다. 포고문은 연합체 참여국들이 서반구 내 범죄 카르텔의 영토 통제, 자금 조달, 자원 접근권을 차단하기 위해 협력한다는 내용을 담았다. 미국이 전투력 확보를 위해 동맹국 군대를 훈련·동원할 수 있고, 연합체가 공동으로 ‘서반구 밖 악의적 외국 세력 등의 위협을 차단해야 한다’는 내용도 포함됐다. 이날 협의체 출범은 이란",2026-03-09,https://www.seoul.co.kr/news/international/USA-amrica/2026/03/09/20260309014005,서울신문
