title,thumbnail,short_content,write_time,link,company
"삼성전자, 글로벌 TV시장 20년째 1위",https://img.seoul.co.kr/img/upload/2026/03/09/SSC_20260309000839_N1.jpg.webp,"삼성전자가 글로벌 TV 시장에서 20년 연속 1위를 기록했다. 프리미엄 TV 시장에서 절반이 넘는 점유율을 확보하며 시장 지배력을 이어가는 동시에 인공지능(AI) 기반 TV와 차세대 디스플레이 기술로 선두 유지를 꾀한다. 삼성전자는 8일 2025년 글로벌 TV 시장에서 매출 기준 29.1%의 점유율로 2006년 이후 20년째 1위를 유지했다고 시장조사업체 옴디아 집계를 인용해 밝혔다. 삼성전자는 2006년 디자인 혁신을 앞세운 ‘보르도 TV’를 통해 처음 글로벌 TV 시장 점유율 1위에 오른 바 있다. 특히 삼성전자는 2500달러 이상 프리미엄 TV 시장에서 Neo QLED·유기발광다이오드(OLED)·라이프스타일 TV 등을 앞세워 54.3%의 점유율을 기록했다. 1500달러 이상 시장에서도 52.2%의 점유율을 확보했다. 삼성전자는 지난 20년 동안 LED TV, 스마트 TV, QLED TV, 8K TV, 마이크로 LED 등 다양한 기술을 선보이며 TV 화질과 기능, 디자인을 발전시켰다. 스마트 TV 도입은 TV를 단순 시청 기기에서 콘텐츠 플랫폼으로 확장시켰다는 평가를 받는다. 최근에는 AI 기능을 강화하는 전략에 속도를 내고 있다. 2024년 업",2026-03-09,https://www.seoul.co.kr/news/economy/industry/2026/03/09/20260309031005,서울신문
보험설계사 몸값 경쟁… 환승 고객은 보장 ‘빈손’,https://img.seoul.co.kr/img/upload/2026/03/09/SSC_20260309000843_N1.jpg.webp,"‘일잘러’ 설계사 모시기 전쟁 격화 이동 잦아지며 새 상품 권유 늘어 면책 기간 적용에 보장 공백 우려 10년 넘게 한 대형보험사 소속 설계사와 거래해 온 50대 고객 A씨는 최근 예상치 못한 일을 겪었다. 담당 설계사가 법인보험대리점(GA)으로 옮겼다며 새로운 암보험 가입을 권유한 것이다. A씨는 기존 계약을 해지하고 새 상품에 가입했다. 하지만 얼마 뒤 위암 2기 진단을 받았고, 가입 후 90일이 지나지 않았다는 이유로 보험금 지급이 거절됐다. 원래 보험을 유지했다면 받을 수 있었던 보장이 사라진 셈이다. 보험 설계사를 둘러싼 ‘몸값 경쟁’이 격화되면서 소비자 피해가 늘어날 수 있다는 우려가 나온다. 설계사 이동이 잦아질수록 기존 고객에게 보험을 해지하고 새 상품으로 갈아타도록 권유하는 ‘승환 계약’ 역시 늘어날 가능성이 있기 때문이다. 계약을 해지하면 해약환급금 손실이 발생하고, 새 보험은 면책기간이 다시 적용돼 보장 공백이 생길 수 있다. 8일 보험업계에 따르면 최근 설계사 영입 경쟁이 과열되는 분위기다. 과거에는 설계사 개인을 중심으로 스카우트가 이뤄졌지만 최근에는 지점장·팀장 등 영업 관리자와 설계사를 한꺼번에 데려오는 ‘팀 단위 영입’이 늘",2026-03-09,https://www.seoul.co.kr/news/economy/finance/2026/03/09/20260309031004,서울신문
"HD현대일렉트릭, 美 2공장 착공",,"HD현대일렉트릭이 미국 앨라배마에 제2공장 건설에 착수했다. 앨라배마 공장은 북미 최대 규모의 초고압 변압기 생산기지로, 전력 인프라 호황에 대응해 생산능력을 확보할 계획이다. HD현대일렉트릭은 6일(현지시간) 미국 앨라배마주 몽고메리시에 위치한 북미 생산법인(HD HPT)에서 제2공장 기공식을 개최했다고 8일 밝혔다. 행사에는 김영기 HD현대일렉트릭 사장, 이준호 애틀랜타 총영사, 앨런 맥네어 앨라배마주 상무장관 등이 참석했다.",2026-03-09,https://www.seoul.co.kr/news/economy/industry/2026/03/09/20260309031003,서울신문
중고차 시장도 중동 사태 ‘불똥’,https://img.seoul.co.kr/img/upload/2026/03/09/SSC_20260309000832_N1.jpg.webp,미국·이스라엘과 이란 간 충돌 영향으로 중고차 전체 수출 중 약 3분의1(35%)을 차지하는 중동 지역 중고차 수출에도 큰 차질이 빚어진 가운데 8일 인천시 연수구 옥련동 옛 송도유원지의 중고차 수출단지에 차량들이 빼곡히 주차돼 있다. 연합뉴스,2026-03-09,https://www.seoul.co.kr/news/economy/car/2026/03/09/20260309030006,서울신문
삼성전자 노조 “파업 불참 시 해고 1순위”,,삼성전자 노동조합이 쟁의 행위 찬반 투표를 앞두고 파업에 참여하지 않는 직원에 대한 불이익 가능성을 언급하면서 파장이 커지고 있다. 8일 업계에 따르면 삼성전자 노조 공동투쟁본부는 9일부터 18일까지 전체 조합원을 대상으로 쟁의 행위 찬반 투표를 실시한다. 투표에서 과반 찬성이 나오면 4월 조합원 집회를 거쳐 5월 21일부터 6월 7일까지 총파업을 진행할 계획이다. 총파업이 현실화되면 삼성전자는 2024년에 이어 창사 두 번째 파업 상황을 맞게 된다. 노조 측은 최근 유튜브 방송을 통해 파업 기간에 근무하는 직원의 명단을 관리해 향후 인사 조치 협의 시 강제 전배나 해고에 우선적으로 안내할 수 있다는 취지의 발언을 했다. 또 회사에 협조적인 직원을 신고하는 제도를 운영하겠다고도 했다. 일부 직원들은 파업 참여 여부가 개인 선택이어야 한다고 우려한다. 업계에서는 노조 조직 규모가 크게 증가한 점도 변수로 본다. 공동투쟁본부 조합원 수는 약 8만 9000명으로 추산되며 상당수가 반도체 사업을 담당하는 DS부문 소속이다. 특히 고대역폭메모리(HBM) 생산이 진행되는 시기와 맞물릴 경우 공급 차질 가능성도 거론된다.,2026-03-09,https://www.seoul.co.kr/news/economy/industry/2026/03/09/20260309031002,서울신문
한국 집값 잡히면 [ ] 변한다,,"가계 자산 대부분이 부동산에 묶여 있는 한국 경제 구조에서 집값이 안정되면 주거 부담이 줄어들면서 소비와 결혼·출산 등 경제 활동이 살아날 수 있다는 분석이 나왔다. 신한금융지주 미래전략연구소는 8일 ‘집값이 안정되면 달라질 것들: 내수의 질적 전환과 금융의 역할’ 보고서를 통해 부동산 가격 안정이 가계 소비 회복과 인구 구조 변화, 금융 수요 재편으로 이어질 가능성이 있다고 밝혔다. 보고서에 따르면 한국 가계 자산의 약 70%는 부동산에 집중돼 있다. 이런 구조에서는 집값 상승이 곧 자산 격차 확대로 이어진다. 실제로 순자산 상위 20%가 전체 자산의 65%를 보유한 반면 하위 40%의 점유율은 4.8%에 그친다. 자산 불평등을 나타내는 지니계수는 0.625로 통계 집계 이후 가장 높은 수준을 기록했다. 연구소는 이런 구조에서 집값 안정이 소비 회복의 출발점이 될 수 있다고 봤다. 특히 주거비 부담의 영향을 크게 받는 25~39세 청년층에서 소비 반등 효과가 클 것으로 예상했다. 집값 안정은 결혼과 출산에도 영향을 줄 수 있다. 한국에서는 결혼과 주택 마련이 사실상 연결돼 있어 주거비 부담이 줄면 청년층의 결혼과 출산 장벽도 낮아질 수 있다는 설명이다.",2026-03-09,https://www.seoul.co.kr/news/economy/2026/03/09/20260309031001,서울신문
‘미국 설득전’ 마친 김정관 장관 귀국… “대미투자법 통과 땐 관세 인상 없어”,,"미국 현지에서 ‘대미 관세 설득전’을 마치고 8일 귀국한 김정관 산업통상부 장관이 대미투자특별법이 우리 국회를 통과하면 미국이 한국산에 대한 관세를 인상하지 않을 것이라고 밝혔다. 김 장관은 이날 인천국제공항에서 취재진에게 “하워드 러트닉 미 상무부 장관을 만나 다음 주 특별법이 국회를 통과한다고 설명하자 아주 높이 평가했고 고맙다는 반응을 보였다”면서 “(러트닉 장관으로부터) 지금처럼 한국에서 법이 통과된다든지, 한미 협상과 관련한 내용이 이행된다면 관세 인상과 관련한 관보 게재는 없을 것 같다는 이야기와 반응을 들었다”고 전했다. 미국 연방대법원의 상호관세 위법 판결 이후 도널드 트럼프 행정부가 추진하는 15%의 글로벌 관세와 관련해 김 장관은 “한국이 불리한 대우를 받지 않도록 협의했다”면서 “경쟁국보다 불리하지 않도록 동등한 대우를 받거나 오히려 더 나은 대우를 받을 가능성에 대해 여지를 열어놓고 왔다”고 했다. 김 장관은 미국의 쿠팡 투자사들이 “한국 정부가 쿠팡을 차별해 제재한다”며 미 무역대표부(USTR)에 무역법 301조(보복 관세 규정) 발동과 관련한 조사를 청원한 것에 대해서도 러트닉 장관과 의견을 나눴다고 밝혔다. 같은 기간 방미해 제이",2026-03-09,https://www.seoul.co.kr/news/economy/2026/03/09/20260309030005,서울신문
"전쟁이 바꾼 기업 순위… 한화, 시총 4위로 ‘껑충’",https://img.seoul.co.kr/img/upload/2026/02/26/SSC_20260226163927_N1.jpg.webp,"미국·이스라엘과 이란 간 지정학적 긴장 고조로 방산주가 급등하면서 한화그룹이 시가총액에서 LG그룹을 제치고 사상 첫 4위에 올랐다. 8일 한국거래소에 따르면 지난 6일 종가 기준 한화그룹 12개 상장사의 시가총액 합계는 180조 6740억원으로 집계됐다. 삼성그룹(1433조 2720억원), SK그룹(826조 5930억원), 현대차그룹(300조 6250억원)에 이어 국내 그룹사 중 4위가 됐다. 기존 4위였던 LG그룹(175조 290억원)은 5위로 밀렸다. 이는 최근 방산 계열사의 주가가 급등하면서다. 이란 사태 이후 한화에어로스페이스와 한화시스템 등 방산 관련 종목이 강세를 보이며 한화그룹 전체 시가총액이 불어났다. 한화에어로스페이스는 지난 3일부터 4거래일간 주가가 119만 5000원에서 148만 1000원으로 28만 6000원(23.93%) 상승했다. 이에 따라 시가총액도 76조 3653억원으로 14조 7471억원 늘었다. 같은 기간 한화시스템 주가도 11만 3600원에서 15만 8900원으로 4만 5300원(39.88%) 올랐으며, 시가총액은 30조 192억원으로 8조 5580억원 늘어났다. 앞서 지난해 방산·조선업 호황 등에 힘입어 한화그룹은 꾸준",2026-03-09,https://www.seoul.co.kr/news/economy/securities/2026/03/09/20260309030004,서울신문
"전쟁발 에너지 수급 다변화… 미국, 원유 대체 수입국 부상",,"미국·이스라엘과 이란 전쟁이 일주일째 이어지면서 중동 원유의 대체 수입국으로 미국이 부상하고 있다. 8일 에너지 업계에 따르면 국내 석유 기업들은 최근 중동 사태를 계기로 서부텍사스산 원유 등을 중심으로 원유 수입선 다변화를 적극 모색하고 있다. 정유업계 관계자는 “추가적으로 기존에 거래하던 미국, 브라질, 캐나다 등 중남미 쪽 원유를 더 들여올 방안이 없는 지 확인 중”이라며 “전 세계가 동일한 상황이라 당장 수입량을 늘리기 쉽지 않아 기존에 교류하던 루트를 통해서라도 대체 방안을 찾고 있다”고 말했다. 정부는 중동 이외 지역에서 원유를 수입해오는 기업에 운송비를 지원하는 등 수입선 다변화를 추진해왔다. 한국무역협회 통계 서비스에 따르면 지난해 한국의 원유(MTI 1310 기준) 수입액 총 753억 달러(약 111조 8200억원) 가운데 중동 국가 수입 비중은 68.8%로 2016년(85.2%)에서 크게 낮아졌다. 천연가스의 중동 의존도는 2019년 44.9%로 절반에 육박했으나 지난해 19.7%까지 낮아진 상태다. 특히 지난해 7월 관세 협상에서 4년간 1000억 달러 규모의 미국산 에너지 구매를 약속하는 등 트럼프 행정부의 통상 전략과 맞물리면서 에너",2026-03-09,https://www.seoul.co.kr/news/economy/industry/2026/03/09/20260309030003,서울신문
중동발 유가·환율·물가 ‘3고 악재’… 올해 성장률 2% 먹구름,,"미국과 이란의 군사충돌로 촉발된 중동 사태가 장기화할 조짐이 보이면서 ‘고유가·고환율·고물가’ 등 이른바 ‘3고 충격’이 가시화하고 있다. 에너지와 원자재 수입 의존도가 높은 한국 경제 특성상 이런 충격이 이어질 경우 정부가 제시한 올해 경제성장률 2.0% 전망도 흔들릴 수 있다는 분석이 나온다. 8일 국가통계포털(KOSIS) 등에 따르면 우크라이나 전쟁이 시작된 지난 2022년 연간 소비자물가 상승률은 5.1%로 외환위기 중이던 1998년(7.5%) 이후 가장 높았다. 당시 미국과 유럽의 러시아산 석유 제재로 국제 유가가 배럴당 100달러를 넘어서면서 국내 휘발유와 경유 가격도 리터당 2100원을 돌파했다. 유가 급등은 단순히 에너지 가격 상승에 그치지 않는다. 원유는 운송비와 전기요금, 각종 원자재 가격에 영향을 미치기 때문에 시간이 지나면 전반적인 물가 상승 압력으로 번지는 경우가 많다. 현재 물가 지표만 보면 아직 충격은 제한적이다. KOSIS에 따르면 지난달 소비자물가지수는 전년 동월 대비 2.0% 상승했다. 다만 리터당 2000원 돌파를 앞두고 있는 최근의 유가 급등이 통계에 반영되지 않았다는 점에서 향후 물가 압력이 다시 커질 가능성이 있다는",2026-03-09,https://www.seoul.co.kr/news/economy/2026/03/09/20260309030002,서울신문
석유 최고가격 지정제 곧 시행,https://img.seoul.co.kr/img/upload/2026/03/08/SSC_20260308184000_N1.jpg.webp,"정부가 이재명 대통령이 검토를 지시한 석유 최고 가격 지정제를 곧 시행한다고 밝혔다. 1997년 유가 자유화 조치 이후 사문화된 비상조치가 29년 만에 처음 가동되는 것이다. 중동 전쟁으로 국제 유가 급등세가 심상치 않은 상황에서 국내 유가 안정을 위한 정책 속도전이다. 미국 방문을 마치고 8일 귀국한 김정관 산업통상부 장관은 석유 최고 가격 지정제와 관련해 “거의 준비를 마쳤다”면서 “시장 상황을 더 지켜보며 대응할 계획이고, 시행을 결정하면 곧바로 할 수 있도록 조치해 나가겠다”고 밝혔다. 제도 시행 시 재정 부담이 커진다는 우려에 대해선 “그런 내용에 대한 대응책 준비도 이미 마쳤다”며 “발표 시점에 상세한 내용을 같이 발표하겠다”고 말했다. 석유 최고가격 지정제는 ‘석유 및 석유대체연료 사업법’ 제23조를 근거로 한다. 석유 가격이 현저히 등락해 국민 경제의 안정을 해칠 우려가 있을 때 산업부 장관이 판매 가격의 최고액을 직접 지정할 수 있다. 위반 시 2년 이하 징역 또는 2000만원 이하 벌금이 부과된다. 초과 수익은 정부가 환수한다. 한국석유공사 오피넷에 따르면 이날 오후 7시 기준 서울 평균 휘발유 가격은 리터당 1945.78원으로 지난달",2026-03-09,https://www.seoul.co.kr/news/economy/2026/03/09/20260309003004,서울신문
국제 유가 100달러 초읽기… 석화업계 ‘도미노 타격’ 우려,https://img.seoul.co.kr/img/upload/2026/03/09/SSC_20260309000355_N1.jpg.webp,"미국·이스라엘과 이란의 군사적 충돌로 인한 호르무즈 해협 봉쇄에 이어 쿠웨이트 등 중동 산유국들의 석유 생산 감축이 이어지면서 유가 ‘배럴당 100달러’가 초읽기에 들어갔다. 국내 나프타 재고가 2~3주 분량뿐인 상황에서 여천 나프타분해시설(NCC)이 고객사들에 공급 감소를 예고하는 등 석유화학(석화)업계에도 비상이 걸렸다. 8일 미국 마켓워치에 따르면 브렌트유 선물 가격은 지난 6일(현지시간) 한때 장중 배럴당 94.37달러까지 올랐고 종가는 93.32달러를 기록했다. 종가 기준으로 전쟁 전인 지난달 27일(72.48달러)보다 28.8% 오른 셈이다. 지난 6일 뉴욕상업거래소에서 4월 인도분 서부텍사스산원유(WTI) 선물 가격은 전장 대비 9.89달러(12.21%) 폭등해 배럴당 90.90달러에 마감했다. 2023년 9월 28일 이후 최고치다. 사드 알카비 카타르 에너지부 장관은 영국 파이낸셜타임스(FT)에 “호르무즈 해협 봉쇄가 지속되면 2∼3주 이내에 유가는 배럴당 150달러, 천연가스 가격은 메가와트시(㎿h)당 약 138달러까지 치솟아 세계 경제가 타격을 받을 것”이라고 경고했다. SK에너지와 GS칼텍스, 에쓰오일, HD현대오일뱅크 등 국내 정유업",2026-03-09,https://www.seoul.co.kr/news/economy/2026/03/09/20260309003003,서울신문
박정원 두산 회장 현장 경영 “AI 기술로 건설장비 선도”,https://img.seoul.co.kr/img/upload/2026/03/08/SSC_20260308212731_N1.jpg.webp,"박정원 두산그룹 회장이 북미 최대 건설장비 전시회 ‘콘엑스포(CONEXPO) 2026’을 찾아 현장경영 행보를 펼쳤다고 두산그룹이 8일 밝혔다. 박 회장은 지난 7일까지 미국 라스베이거스 컨벤션센터에서 열린 콘엑스포 2026을 방문해 건설장비 부문 경쟁력을 점검했다. 콘엑스포는 독일 바우마, 프랑스 인터마트와 함께 세계 3대 건설기계 전시회로 꼽힌다. 박 회장은 두산밥캣, 두산모트롤 부스를 방문한 뒤 글로벌 경쟁사들의 전시관도 둘러보며 인공지능(AI) 기반 생산성 향상, 무인화 기술 상용화 현황 등을 집중적으로 살폈다. 박 회장은 “건설장비와 작업 현장에 적용되는 AI 기술의 발전 속도가 빨라지면서 하드웨어 기술력을 중요하게 여기던 건설장비 시장의 판도가 바뀌고 있다”며 “두산밥캣의 독보적 데이터를 바탕으로 차별화된 AI 기술을 내놓으면서 건설장비의 미래를 제시하고 시장을 선도해 나가자”고 강조했다. 두산밥캣은 이번 전시회에서 소형 로더, 굴착기 등 30여 종의 첨단 제품을 선보였고 핵심 제품군인 소형 로더 라인업을 보급형(클래식)과 고급형(프로)으로 이원화하는 브랜드 전략을 공개했다. 프로 모델은 음성 인식으로 50가지 이상의 기능을 제어하고, 주변 장",2026-03-08,https://www.seoul.co.kr/news/economy/industry/2026/03/08/20260308500130,서울신문
김정관 “대미투자법 통과 시 美 관세인상 없을 듯…석유 최고가격제 준비 마쳐”(종합),https://img.seoul.co.kr/img/upload/2026/03/08/SSC_20260308184000_N1.jpg.webp,"김정관 산업통상부 장관이 8일 미국 방문을 마치고 인천공항으로 귀국하면서 국회에서 대미투자특별법이 신속히 처리되면 미국의 관세 인상이 없을 것 같다는 이야기를 들었다고 밝혔다. 김 장관은 이날 취재진과 만나 “다음 주에 있는 국회의 법(대미투자특별법) 통과 관련 설명을 드렸고, 미국에서 높이 평가해줬고 고맙게 반응을 보였다”며 “한국의 법 통과가 이행된다면 관세 인상은 없을 것 같다는 이야기를 들었다”고 전했다. 또한 미국 연방대법원의 상호관세 위법 판결 이후 트럼프 행정부가 추진하는 15%의 글로벌 관세와 관련해서도 불리한 대우를 받지 않도록 협의했다고 밝혔다. 김 장관은 “우리나라가 경쟁국에 비해 불리하지 않도록 동등한 대우를 받거나 오히려 더 나은 대우를 받을 수 있는 가능성에 대해서 여지를 열어놓고 왔다”고 했다. 김 장관은 앞서 지난 5일 LG에너지솔루션의 캐나다 배터리 공장 준공식에 참석한 후, 바로 미국으로 향해 하워드 러트닉 미 상무부 장관과 회담했다. 미국의 쿠팡 투자사들이 한국 정부를 상대로 무역법 301조 조사를 미국 정부에 청원한 것과 관해서도 러트닉 장관과 의견을 나눴다고 전했다. 김 장관은 “미국 기업에 대해 차별적 대우해선",2026-03-08,https://www.seoul.co.kr/news/economy/2026/03/08/20260308500119,서울신문
아연·납·동 동시 생산 ‘연금술’… 광물 전쟁 속 몸값 뛴 ‘K제련’,https://img.seoul.co.kr/img/upload/2026/03/08/SSC_20260308184134_N1.jpg.webp,"반도체·태양전지 등 원자재 ‘인듐’ 中 수출 통제에 t당 6억→10억원 방산 핵심 ‘안티모니’ 등 매출 2.5배 공급망 재편·중동 전쟁 겹쳐 ‘껑충’ 지난 5일 찾은 울산 울주군 고려아연 온산제련소 인듐 공장에서는 약 200도의 고온에서 녹은 은빛 액체가 주조 용기에 들어간 뒤 길이 약 50㎝, 무게 5㎏, 순도 99.999%의 인듐괴로 생산됐다. 열을 식힌 고순도의 인듐은 1t 단위로 적재된 뒤 공장을 빠져나갔다. 인듐은 반도체와 양자컴퓨터 양자처리장치(QPU)·태양전지·디스플레이 등 첨단 산업에 사용되는 금속이며, 미국 등 주요국이 지정한 핵심 전략광물이다. 전종빈 고려아연 전자소재팀 책임은 “중국의 전략 광물 수출 통제로 가격이 더 올라 지난해 1t당 6억원에서 최근 10억원을 넘겼다”며 “90%는 미국과 일본으로 팔려 나간다”고 설명했다. 미·중 간 광물 전쟁이 격화하면서 미국 주도의 ﻿핵심광물 공급망 재편이 속도를 내는 가운데 우리나라 비철금속 제련 기술이 주목받고 있다. 우리나라는 중국 외 핵심 광물 제련 기술을 가진 유일한 국가다. 특히 최근 미국의 이란 공습으로 중동 긴장이 커지면서 전략 광물 공급망의 중요성은 더욱 커지고 있다. 중국이",2026-03-09,https://www.seoul.co.kr/news/economy/industry/2026/03/09/20260309029002,서울신문
김정관 “대미투자법 통과되면 美 관세인상 없을 것 같다 들어”,https://img.seoul.co.kr/img/upload/2026/03/08/SSC_20260308184000_N1.jpg.webp,"김정관 산업통상부 장관이 8일 미국 방문을 마치고 인천공항으로 귀국하면서 국회에서 대미투자특별법이 신속히 처리되면 미국의 관세 인상이 없을 것 같다는 이야기를 들었다고 밝혔다. 김 장관은 이날 “다음 주에 있는 국회의 법(대미투자특별법) 통과 관련 설명을 드렸고, 미국에서 높이 평가해줬고 고맙게 반응을 보였다”며 “한국의 법 통과가 이행된다면 관세 인상은 없을 것 같다는 이야기를 들었다”고 전했다. 김 장관은 앞서 지난 5일 LG에너지솔루션의 캐나다 배터리 공장 준공식에 참석한 후, 바로 미국으로 향해 하워드 러트닉 미 상무부 장관과 회담했다.",2026-03-08,https://www.seoul.co.kr/news/economy/2026/03/08/20260308500117,서울신문
월세 150만원 시대,https://img.seoul.co.kr/img/upload/2026/03/08/SSC_20260308181849_N1.jpg.webp,"전세 물건 절벽과 대출 규제로 ‘전세의 월세화’가 빨라지며 서울 아파트 평균 월세 가격이 역대 최고치를 기록했다. 8일 한국부동산원에 따르면 지난 1월 서울 아파트 평균 월세 가격은 150만 4000원으로 최고치를 경신했다. 아파트 월세가격지수도 104.59로 통계가 작성된 2015년 이후 가장 높았다. 서울에서 평균 아파트 월세 가격이 가장 높은 지역은 용산구(268만 1000원)였고, 강남구(266만 3000원), 서초구(258만 9000원), 성동구(229만 1000원), 송파구(206만 7000원) 순이었다. 국토교통부 실거래가 공개시스템에 따르면 올해 들어 지난 6일까지 이뤄진 서울 아파트 신규 임대차(전월세) 계약 1만 9843건 중 월세(1만 341건)가 52.1%를 차지했다. 지난해 서울 아파트 임대차 신규 계약 중 월세는 47.1%였다. 월세 전환이 빨라진 데에는 전세자금대출 심사 강화와 수도권·규제지역의 소유권 이전 조건부 전세대출 금지 등이 영향을 미친 것으로 보인다. 직방에 따르면 지난해 6·27 대출 규제 이후 입주한 서울 아파트의 경우 월세 비중이 평균 60%에 달했다.",2026-03-09,https://www.seoul.co.kr/news/economy/estate/2026/03/09/20260309029001,서울신문
