title,thumbnail,short_content,write_time,link,company
충남 건설산업 되살린다 ‘상생약속’…41개 기관 협의회 가동,https://img.seoul.co.kr/img/upload/2025/12/10/SSC_20251210164510_N1.jpg.webp,"도, 대전국토관리청 등 17개 기관 ‘맞손’ 41개 기관 ‘건설산업활성화협의회’ 가동 충남도가 공공기관 등과 손잡고 발주량 감소와 원자재값 폭등에 따른 위축된 지역 건설산업 되살리기에 나섰다. 김태흠 지사는 10일 도청사에서 방윤석 대전지방국토관리청장 등 17개 기관 대표와 ‘충남 지역 건설산업 활성화를 위한 상생 협력 업무협약’을 체결했다. 이날 도와 협약 참여 기관은 15개 시군 및 도의회, 대한건설협회 등 41개 기관·협회 42명으로 구성된 지역건설산업활성화협의회도 구성해 운영을 시작했다. 협약과 협의회 구성은 지역 자재·장비 사용, 인력 고용, 음식·숙박업 등 지역경제에 영향이 큰 건설산업 활성화를 위해 마련됐다. 협약에 참여한 도와 17개 기관은 지역 제한 경쟁입찰 대상 공사 발주 확대와 의무 공동도급 발주 시 지역 건설업체 참여 향상, 지역 생산 자재·장비 사용, 지역 인력 고용 등을 위해 노력할 계획이다. 협의회는 공공 건설공사의 지역 건설업체 참여 실적을 정기적으로 공유해 직접적 소통 창구 역할과 지역업체 육성·지원 등을 담당한다. 김태흠 지사는 “건설산업은 지역경제 근간이다. 일자리가 늘고, 돈이 돌면서 도내 구석구석 골목상권도 활",2025-12-10,https://www.seoul.co.kr/news/economy/2025/12/10/20251210500215,서울신문
“따뜻하대서 큰맘 먹고 샀는데”…‘이 패딩’ 입어도 추운 이유,https://img.seoul.co.kr/img/upload/2025/12/10/SSC_20251210162354_N1.jpg.webp,"온라인 패션 플랫폼에서 ‘구스다운(거위털) 패딩’으로 판매되는 제품 중 일부가 실제로는 덕다운(오리털) 제품이거나 거위털 함량 비율이 기준에 못 미치는 것으로 드러났다. ‘거위털 80% 이상’이라며 고가 전략을 취하면서도 실제 품질은 이를 충족하지 못한 것이다. 10일 한국소비자원은 더블유컨셉·무신사·에이블리·지그재그 등 4개 패션 플랫폼에서 판매되는 구스다운 패딩 24개 제품을 조사한 결과, 5개 제품이 KS 기준(거위털 80% 이상)에 미달했다고 밝혔다. 특히 이 중 일부는 거위털 비율이 6%대에 불과했다. 이번 조사는 9월 25일 기준 각 플랫폼에서 ‘구스다운’ 제품을 추천순으로 정렬해 30만원 미만 제품을 선정해 이뤄졌다. 문제의 5개 제품은 힙플리 ‘트윙클폭스퍼벨트롱패딩’(6.6%), 레미 ‘구스다운숏점퍼’(35.4%), 라벨르핏 ‘루벨르구스다운숏패딩벨티드패딩’(37.6%), 프롬유즈 ‘구스다운사가폭스퍼숏패딩’(51.0%), 클릭앤퍼니 ‘워즈경량패딩점퍼’(57.1%) 등이다. 또 에이블리가 판매한 벨리아 ‘007시리즈프리미엄구스다운니트패딩’(4.7%), 젠아흐레 ‘리얼폭스구스다운거위털경량숏패딩’(1.9%) 등 2개 제품은 온라인 판매 페이지에서",2025-12-10,https://www.seoul.co.kr/news/economy/2025/12/10/20251210500204,서울신문
[서울데이터랩]12월 10일 코스피 주요 종목 마감시황,https://img.seoul.co.kr/img/upload/2025/12/10/SSC_20251210161901_N1.jpg.webp,"12월 10일 한국거래소에 따르면, 금호건설우(002995)는 전 거래일 대비 29.97% 상승한 15,350원에 거래를 마감하며 금일 코스피 상승률 1위를 차지했다. 동양고속(084670)은 29.96% 상승한 46,850원에 거래를 마치며 뒤를 이었다. 태영건설우(009415)는 29.92% 상승한 8,510원에 거래를 끝냈다. 동부건설우(005965)는 21.81% 상승한 19,600원에 마감하며 4위를 기록했다. 대성산업(128820)은 15.79% 상승한 5,940원에 거래를 마쳤다. 코오롱모빌리티그룹은 전 거래일 대비 16.42% 하락한 9,060원에 거래를 마감하며 금일 코스피 하락률 1위를 기록했다. 현대약품은 12.21% 하락한 6,110원에 거래를 마쳤다. 삼성제약은 11.23% 하락한 1,755원에 마감했다. 코오롱모빌리티그룹우는 10.31% 하락한 17,920원에 거래를 마쳤고, 와이투솔루션은 10.12% 하락한 4,350원에 장을 마감했다. 시가총액 상위 종목 중 상승한 종목은 없다. 삼성전자는 591만 주가 거래되며 0.19%의 하락세를 기록했다. SK하이닉스는 177만 주의 거래량을 기록하며 0.05% 하락했다. LG에너지솔루션",2025-12-10,https://www.seoul.co.kr/news/economy/2025/12/10/20251210500199,서울신문
[포토] ‘딸기 따는’ 로봇,https://img.seoul.co.kr/img/upload/2025/12/10/SSI_20251210153924_N1.jpg.webp,"농림축산식품부는 10일부터 11일까지 서울 양재 aT센터에서 ‘2025 농림축산식품 과학기술대전’이 진행된다고 밝혔다. 지난 2004년부터 격년으로 열리고 있는 과학기술대전은 올해로 11회째를 맞았다. 올해 과학기술대전은 ‘미래농업, 내일을 열다’라는 주제로 AI(인공지능)농업혁신, 대체식품, 리버스에이징, 디지털육종, 극한환경농업, 애니멀 웰케어 등 6개 분야에 110여개 기관의 농식품 연구개발 성과 및 혁신적 기술·제품을 전시해 다양한 최신 농업분야 과학기술을 접할 수 있도록 준비했다. 글로벌·혁신존에는 2026년 CES(Consumer Electronics Show, 소비자 가전 전시회) 혁신상을 수상한 선도기업들이 포함, 내년 개최 예정인 CES 전시기업의 성과를 사전에 직접 확인할 수 있다. ‘수직농장 기술개발 동향 및 미래전략’을 주제로 한 미래성장포럼, 우수기술을 보유한 기업의 해외진출 및 상용화 컨설팅 등 유익한 연계 프로그램도 마련했다. 특히 기조강연에는 바둑으로 인공지능(AI)을 상대로 유일한 1승을 거둔 울산과학기술원(UNIST) 이세돌 객원교수를 초청, 알파고와의 대국을 통해 경험한 인공지능에 대한 소회와 인공지능을 활용한 농업분야",2025-12-10,https://www.seoul.co.kr/news/economy/industry/2025/12/10/20251210800007,서울신문
[서울데이터랩]페스카로 74.84% 상승…금일 증시 상승률 1위로 마감,https://img.seoul.co.kr/img/upload/2025/12/10/SSC_20251210154730_N1.jpg.webp,"10일 오후 3시 40분 페스카로(0015S0)가 등락률 +74.84%로 상승률 1위로 마감했다. 페스카로는 장 중 16,095,266주가 거래되었으며 주가는 공모가 대비 11,600원 오른 27,100원에 마감했다. 한편 페스카로의 PER은 -26.88로 주가가 이익 대비 과대 평가되어 있을 가능성을 나타내며, ROE는 -46.66%로 수익성이 부정적인 상태다. 이어 상승률 2위 아이로보틱스(066430)는 주가가 29.99% 상한가를 기록하며 종가 1,556원에 상승 마감했다. 상승률 3위 셀바스헬스케어(208370)의 주가는 5,620원으로 29.94% 상한가를 기록하며 강세를 보였다. 상승률 4위 엔젯(419080)은 29.89% 상승하며 7,040원에 마감했다. 상승률 5위 벡트(457600)는 29.83%의 상승세를 타고 종가 3,090원에 마감했다. 6위 뉴인텍(012340)은 종가 592원으로 29.82% 상승 마감했다. 7위 성호전자(043260)는 종가 6,250원으로 24.75% 상승 마감했다. 8위 메디아나(041920)는 종가 7,880원으로 22.93% 상승 마감했다. 9위 자비스(254120)는 종가 1,906원으로 20.79%",2025-12-10,https://www.seoul.co.kr/news/economy/2025/12/10/20251210500184,서울신문
[서울데이터랩]금호건설우 29.97% 상한가 금일 증시 상승률 1위로 마감,https://img.seoul.co.kr/img/upload/2025/12/10/SSC_20251210154728_N1.jpg.webp,"10일 오후 3시 35분 금호건설우(002995)가 등락률 +29.97%로 상승률 1위로 마감했다. 금호건설우는 장 중 50,290주가 거래되었으며 주가는 전 거래일 대비 3,540원 오른 15,350원에 마감했다. 한편 금호건설우의 PER은 26.06으로 상대적으로 적정보다는 높은 평가를 받을 가능성을 시사한다. 이어 상승률 2위 동양고속(084670)은 주가가 29.96% 폭등하며 종가 46,850원에 마감했다. 상승률 3위 태영건설우(009415)의 주가는 8,510원으로 29.92% 폭등하며 강세를 보였다. 상승률 4위 동부건설우(005965)는 21.81% 급등하며 19,600원에 마감했다. 상승률 5위 대성산업(128820)은 15.79%의 상승세를 타고 종가 5,940원에 마감했다. 6위 세아베스틸지주(001430)는 종가 34,950원으로 14.03% 상승 마감했다. 7위 세기상사(002420)는 종가 6,240원으로 13.66% 상승 마감했다. 8위 에이프로젠(007460)은 종가 910원으로 13.04% 상승 마감했다. 9위 자화전자(033240)는 종가 22,100원으로 9.95% 상승 마감했다. 10위 일동제약(249420)은 종가",2025-12-10,https://www.seoul.co.kr/news/economy/2025/12/10/20251210500183,서울신문
[서울데이터랩]마감 직후 인기 검색 종목 20選,https://img.seoul.co.kr/img/upload/2025/12/10/SSC_20251210154727_N1.png.webp,"SK하이닉스(000660)가 12월 10일 장 마감 5분 만에 7.43%의 검색비율을 기록해 많은 투자자들의 관심을 받고 있다. SK하이닉스의 현재가는 587,000원으로 전 거래일 대비 3.71% 상승하며 장을 마감했다. 거래량은 3,983,919주를 기록했다. 이어 검색비율 2위의 삼성전자(005930)는 등락률 -0.37%로 소폭 하락했다. 검색비율 3위의 에이비엘바이오(298380)는 9.02% 상승 마감했다. 검색비율 4위 에코프로(086520)는 -0.85% 하락했다. 검색비율 5위 테라뷰(950250)는 6.44% 상승하며 거래를 마쳤다. 6위 페스카로(0015S0)는 등락률 74.84%로 폭등을 기록했다. 7위 동양고속(084670)은 29.96%의 등락률로 상한가에 도달했다. 8위 셀바스AI(108860)는 20.40%의 급등세로 거래를 마쳤다. 9위 바이젠셀(308080)은 19.16% 급등 마감했다. 10위 삼성SDI(006400)는 2.42% 상승했다. 이 밖에도 두산에너빌리티(034020) ▲0.13%, NAVER(035420) ▼1.41%, 현대차(005380) ▼1.47%, 클로봇(466100) ▲6.68%, 에코프로비엠(2",2025-12-10,https://www.seoul.co.kr/news/economy/2025/12/10/20251210500182,서울신문
‘개인정보 유출’ 박대준 쿠팡 대표 사임…“미국 본사가 사태 수습”,https://img.seoul.co.kr/img/upload/2025/12/10/SSC_20251210144422_N1.jpg.webp,"박대준 쿠팡 대표이사가 3370만명의 정보 유출 사태에 책임을 지고 10일 사임했다. 박 대표는 이날 “최근의 개인정보 사태에 대해 국민께 실망드린 점에 대해 매우 송구스럽게 생각한다”며 “이번 사태의 발생과 수습과정에서의 책임을 통감하고 모든 직위에서 물러나기로 했다”고 밝혔다. 쿠팡 모회사인 미국 쿠팡 Inc.는 이번 사태를 적극적으로 수습하고, 고객들의 불안감을 해소하기 위해 박 대표의 후임으로 해롤드 로저스 쿠팡 Inc. 최고관리책임자 겸 법무총괄을 쿠팡의 임시 대표로 선임했다. 쿠팡은 “로저스 신임 임시 대표는 개인정보 유출 사태에 따른 고객불안을 해소하고, 대내외적인 위기를 수습하는 한편 조직 안정화에 주력할 방침”이라고 설명했다. 미국 쿠팡 Inc.가 개인정보 유출 사태에 대한 수습을 위해 적극적으로 나선다는 게 쿠팡의 입장이다. 쿠팡은 “개인정보 유출 사태로 심려를 끼쳐드린 점에 대해 깊이 사과드린다”며 “재발 방지를 위해 정보보안을 강화하고 신뢰 회복에 최선을 다할 것”이라고 말했다.",2025-12-10,https://www.seoul.co.kr/news/economy/industry/2025/12/10/20251210500151,서울신문
이창용 한국은행 총재의 남 몰래 ‘연탄봉사활동’[경제 블로그],https://img.seoul.co.kr/img/upload/2025/02/28/SSC_20250228131149_N1.jpg.webp,"이창용 한국은행 총재가 직원들과 함께 남 몰래 ‘연탄봉사활동’을 꾸준히 해오고 있습니다. 한국은행은 코로나19 시기 중단했던 ‘사랑의 연탄 나눔’ 행사를 2023년부터 재개했고, 올해도 지난 8일 밥상공동체복지재단 서울연탄은행과 함께 서울 서대문구 홍제동 개미마을에서 취약가구에 연탄을 배달하는 행사를 진행했습니다. 이 총재를 비롯해 국·실장 등 총 55명의 임직원이 참여했습니다. 한은에 따르면 연탄 기부는 2023년에 6만장, 2024년에 4만 5000장, 올해 4만 4000장(직접 배달 2000장)으로 누적으로 총 15만장에 이른다고 합니다. 한은은 쌀, 귤, 라면 등도 연탄은행을 통해 취약가구에 기부했습니다. ●서울연탄은행과 함께 누적 15만장 기부 이날 행사에 앞서 서울연탄은행 연탄교회 허기복 목사는 “우리도 은행이다. 한국은행과 관계가 깊다”고 강조했고, 이 총재 역시 “한국은행은 연탄은행과 끈끈한 관계”라고 화답했다고 합니다. 이날 취약가구에 배달된 연탄은 총 2000장. 연탄 배달은 2~3장, 4~6장, 8장 단위로 배달하도록 돼있었는데 연탄 한 장이 3.56㎏이어서 임직원들이 연탄을 실어 나르느라 구슬땀을 흘렸다는 후문입니다. 190㎝가 넘는",2025-12-10,https://www.seoul.co.kr/news/economy/2025/12/10/20251210500140,서울신문
"[서울데이터랩]금일 코스닥 거래량 1위 테라뷰 거래대금 무려 5,698억 돌파",https://img.seoul.co.kr/img/upload/2025/12/10/SSC_20251210131227_N1.jpg.webp,"코스닥 거래량 상위 종목들이 전반적으로 상승세를 보인다. 10일 한국거래소에 따르면, 테라뷰(950250)가 3천만주 이상 거래되며 코스닥 종목 중 실시간 거래량 1위를 차지한다. 현재 주가는 19,470원이며, 시가총액은 6,915백만원이다. 거래대금은 569,890백만원으로 시가총액의 8.24%에 해당하는 거래가 이루어지고 있다. PER은 -68.32이며 ROE는 N/A로 기록된다. 재영솔루텍(049630)은 2,870원으로 거래량 2위에 올라섰으며, 2천만주 이상의 거래량을 기록하고 있다. 시가총액은 3,355백만원이며, 거래대금은 76,685백만원이다. PER은 79.72, ROE는 6.16으로 나타난다. 나노엔텍(039860)은 현재 4,510원으로 거래되고 있으며, 12.89% 상승률을 기록한다. 거래량은 22,104,606주이다. 성호전자(043260)는 24.35%의 급등세로 6,230원에 거래되고 있다. 네오이뮨텍(950220)은 9.15% 하락한 725원에 거래되고 있다. 아이로보틱스(066430)는 1,556원으로 상한가를 기록하며 거래량 15,886,085주를 기록하고 있다. 다날(064260)은 7,190원에 거래되며 13,061,",2025-12-10,https://www.seoul.co.kr/news/economy/2025/12/10/20251210500115,서울신문
[서울데이터랩]에임드바이오 5.80% 하락 주목받아,https://img.seoul.co.kr/img/upload/2025/12/10/SSC_20251210131224_N1.png.webp,"코스닥 시가총액 상위 종목들이 전반적으로 엇갈린 흐름을 보이고 있다. 10일 한국거래소에 따르면, 시가총액 1위 알테오젠(196170)은 현재가 454,000원으로 전 거래일 대비 0.66% 하락세를 보이고 있다. 시가총액은 242,916억원이며 외국인 비율은 13.99%에 달한다. 거래량은 185,770주로 비교적 활발하게 거래되고 있으며, PER은 193.36배, ROE는 29.52%로 나타났다. 2위 에코프로비엠(247540)은 현재가 182,100원으로 보합세를 기록하고 있으며, 시가총액은 178,096억원이다. 외국인 비율은 13.01%이고, 거래량은 435,191주로 활발한 거래가 이루어지고 있다. PER은 5,690.62배, ROE는 -6.26%로 나타나고 있다. 에코프로(086520)는 전 거래일 대비 1.02% 상승한 119,000원을 기록하며, 에이비엘바이오(298380)는 5.05% 상승한 195,600원에 거래되고 있다. 레인보우로보틱스(277810)는 2.07% 오른 468,500원, 코오롱티슈진(950160)은 1.98% 상승한 82,500원에 거래 중이다. 리가켐바이오(141080)는 2.02% 상승해 186,900원, 펩트론(",2025-12-10,https://www.seoul.co.kr/news/economy/2025/12/10/20251210500114,서울신문
[서울데이터랩]금일 코스피 거래량 1위 대성산업 거래대금 846억 돌파,https://img.seoul.co.kr/img/upload/2025/12/10/SSC_20251210131226_N1.png.webp,"코스피 거래량 상위 종목들이 전반적으로 엇갈린 흐름을 보인다. 10일 한국거래소에 따르면, 대성산업(128820)이 1,456만4,733주가 거래되며 코스피 종목 중 실시간 거래량 1위를 차지했다. 현재 주가는 6,100원으로, 거래대금은 846억4,700만원에 달하며 시가총액의 30.68%에 해당한다. 등락률은 +18.91%로 급등세를 보이고 있으며, PER -31.12, ROE 1.08로 나타나 재무적 측면에서는 다소 불안정한 상태다. 에이프로젠(007460)은 1,240만6,710주가 거래되며 거래량 2위를 기록했다. 현재 주가는 885원으로, 거래대금은 105억5,800만원이며, 이는 시가총액의 3.62%이다. 등락률은 +9.94%로 상승세를 보이며, PER -5.40, ROE -37.91로 재무 상태가 부정적인 모습을 보인다. 일동제약(249420)은 현재 33,800원으로 +13.80% 상승하며 거래량 1,113만8,436주를 기록하고 있다. 코오롱모빌리티그룹(450140)은 9,400원으로 -13.28% 하락하며 거래량 893만9,114주를 기록 중이다. 삼성제약(001360)은 1,784원으로 -9.76% 하락 중이며, 거래량은 859만7,",2025-12-10,https://www.seoul.co.kr/news/economy/2025/12/10/20251210500113,서울신문
[서울데이터랩]12월 10일 암호화폐 시총 상위종목 동향,https://img.seoul.co.kr/img/upload/2025/12/10/SSC_20251210131229_N1.png.webp,"글로벌 가상자산 시황 중계 사이트 코인마켓캡(CoinMarketCap)에 따르면, 현재 가상자산 시장에서 비트코인, 이더리움, 리플, 비앤비가 주목받고 있다. 비트코인은 현재 1억 3607만 원에 거래되고 있으며, 24시간 동안 2.21% 상승했다. 시가총액은 2716조 1248억 원이며, 1시간 변화율은 0.07%로 소폭 상승세를 이어가고 있다. 이더리움은 487만 3737원으로 5.89% 상승하며 강세를 보이고 있다. 현재 시가총액은 588조 2368억 원이며, 1시간 변화율은 0.17%로 추가 상승 가능성을 시사한다. 리플은 3068원으로 0.68% 상승했으며, 시가총액은 185조 1388억 원이다. 1시간 변화율은 -0.10%로, 단기적으로는 약간의 조정을 보일 수 있다. 비앤비는 131만 1186원으로 0.40% 하락했으며, 시가총액은 180조 5972억 원이다. 1시간 변화율은 0.03%로 미미하게 반등하고 있다. 한편, 솔라나는 20만 3547원으로 3.04% 상승했다. 시가총액은 114조 2836억 원이다. 같은 시각, 트론은 415원으로 0.63% 상승했다. 도지코인은 217원으로 4.14% 상승하며, 시가총액은 33조 367억 원이다. 에",2025-12-10,https://www.seoul.co.kr/news/economy/2025/12/10/20251210500112,서울신문
(영상)“‘좋아요’ 받으려고” 살아있는 아들 진공백에 넣고 빨아들인 인플루언서 母…러 공분,https://img.seoul.co.kr/img/upload/2025/12/10/SSC_20251210182204_N1.jpg.webp,"러시아의 유명 인플루언서가 자신의 10살 아들을 진공 포장백에 넣고 공기를 빨아들이는 영상을 소셜미디어(SNS)에 올려 사회적 공분을 샀다. 9일(현지시간) 러시아 리아노보스티 통신 등에 따르면 육아 인플루언서 안나 사파리나(36)는 자신의 SNS에 아들을 비닐백에 넣은 모습이 담긴 영상을 올렸다. 영상을 보면 그는 아들을 대형 비닐백 안에 눕게 한 뒤 지퍼를 닫고 청소기 호스를 연결해 공기를 빨아들였다. 아들은 “하나, 둘, 셋”을 외친 뒤 숨을 크게 들이마셨고, 곧이어 비닐이 얼굴에 밀착되자 “엄마!”라며 비명을 질렀다. 아들의 목소리는 비닐에 눌려 먹먹하게 들렸다. 이후 사파리나가 지퍼를 열고 아이를 꺼냈고 아이는 안도한 듯 엄지손가락을 들어 보였다. 영상에는 “병가 3주째라 애가 심심해 해서”라는 자막이 삽입돼 있었다. 사파리나는 이 영상을 올린 이유에 대해서는 “‘좋아요’를 받으려고”라고 밝혔다. 해당 영상이 확산되며 러시아는 물론 국제적으로도 거센 비난 여론이 터져 나왔다. 네티즌들은 “아이의 생명을 담보로 한 장난”, “‘좋아요’에 목맨 부모의 위험한 본보기”라며 지적했다. 논란이 커지자 러시아 사라토프 지역 경찰과 아동보호기관은 즉각",2025-12-10,https://www.seoul.co.kr/news/international/europe/2025/12/10/20251210500264,서울신문
“마두로 시대 얼마 안 남아” 축출 시나리오 짜는 트럼프,https://img.seoul.co.kr/img/upload/2025/12/10/SSC_20251210180650_N1.jpg.webp,베네수엘라에 대한 미국의 군사적 위협이 강화되고 있는 가운데 도널드 트럼프 행정부가 이미 니콜라스 마두로 정권 붕괴 후 시나리오 검토에 착수한 것으로 알려졌다. 트럼프 대통령은 “마두로의 시대가 얼마 남지 않았다”며 축출 의지를 공개적으로 드러냈다. 미 CNN방송은 9일(현지시간) 트럼프 행정부가 마두로 대통령이 권좌에서 축출될 경우를 대비한 후속 계획 초안을 작성하고 있다고 고위 관계자 등을 인용해 보도했다. 이 계획에는 마두로 대통령이 자진 퇴진하거나 군사 공격 등으로 축출될 경우 미국이 권력 공백에 빠진 베네수엘라를 안정시킬 수 있는 방안 등이 담긴 것으로 알려졌다. 스티븐 밀러 백악관 부비서실장이 이끄는 국가안보회의(NSC)가 작업을 주도하고 있다고 한다. 다만 베네수엘라에 대한 군사 공격이나 비밀작전 전개 여부를 놓고는 트럼프 행정부 내에서 여전히 의견이 엇갈리고 있다. 트럼프 대통령도 아직 최종 결정을 내리지 않은 것으로 알려졌다. 앞서 트럼프 행정부는 마두로 대통령에게 ‘즉각 사임하고 망명하면 안전한 출국을 보장하겠다’고 제안했으나 거부당한 것으로 전해졌다. 트럼프 대통령은 이날 미 정치매체 폴리티코와의 인터뷰에서 마두로 대통령 축출에 대한,2025-12-11,https://www.seoul.co.kr/news/international/USA-amrica/2025/12/11/20251211014004,서울신문
피란민 텐트로 가득 찬 태국 사케오주,https://img.seoul.co.kr/img/upload/2025/12/10/SSC_20251210180644_N1.jpg.webp,10일 태국 사케오주에서 피란민들이 캄보디아와의 무력 충돌을 피해 텐트 안에 머물고 있다. 지난 7월 휴전했던 태국과 캄보디아는 국경 충돌이 다시 재발하면서 60만명 이상의 피란민이 발생했다. 사케오 AFP 연합뉴스,2025-12-11,https://www.seoul.co.kr/news/international/asia-oceania/2025/12/11/20251211014003,서울신문
"엔비디아 ‘H200’ 수출길 열려도… “中, 자국 기업 사용 규제 검토”",https://img.seoul.co.kr/img/upload/2025/12/10/SSC_20251210150921_N1.png.webp,중국이 엔비디아의 인공지능(AI) 칩 ‘H200’에 대해서도 자국 기업의 사용을 제한할 것으로 알려졌다. 파이낸셜타임스(FT)는 9일(현지시간) 중국 정부가 도널드 트럼프 대통령이 전날 대중국 수출을 허용한다고 밝힌 H200에 대해 사용을 규제하는 방안을 논의하고 있다고 보도했다. FT는 관계자를 인용해 당국이 엔비디아 칩을 쓰려는 중국 기업에게 국산 제품을 쓰지 않는 이유를 설명하도록 하는 등 정부 승인 절차를 의무화할 가능성이 높다고 전했다. FT는 또 정부 산하 기관은 H200 구매를 금지하는 등의 규제 조치를 논의 중이라고도 덧붙였다. 중국은 엔비디아가 중국 수출용으로 성능을 제한한 ‘H20’에 대해서도 ‘백도어(해킹 경로)’가 있다며 보안 문제를 제기하고 사용을 제한한 바 있다. 중국 당국은 트럼프 대통령의 수출 허용 발표에도 엔비디아 제품 구매와 관련한 방침을 아직 밝히지 않고 있다. H200에 대한 중국 내 규제가 도입되면 트럼프 대통령이 수출 허용으로 기대했던 것과는 다른 방향으로 미중 AI 패권경쟁이 전개될 가능성도 적지 않다. 관영 중국일보는 AI가 매우 민감한 분야로 보안 위험이 있다며 중국 기업들이 실제로 H200을 구매할지는 구체,2025-12-11,https://www.seoul.co.kr/news/international/china/2025/12/11/20251211014002,서울신문
