title,thumbnail,short_content,write_time,link,company
"재계, ‘한미일 경제대화’ 참석…반도체·에너지 공급망 협력 모색",https://img.seoul.co.kr/img/upload/2025/10/15/SSC_20251015182023_N1.jpg.webp,"한미일 정·재계 인사들이 15일 일본 도쿄에서 열린 ‘제3회 한미일 경제대화’(TED)에서 미중 갈등을 비롯한 글로벌 경제 현안과 복합 위기 극복 방안을 논의했다. 미국 측은 세 나라의 가장 큰 위협으로 중국을 지목하며 3국의 결속을 강조했고, 참석자들은 반도체·에너지·공급망 등 다양한 분야의 협력을 모색한 것으로 알려졌다. 일본 도쿄의 게이단렌(일본경제단체연합회) 회관에서 열린 이번 회의에는 이재용 삼성전자 회장, 정의선 현대자동차그룹 회장, 조현준 효성그룹 회장을 비롯해 한미일 정부·의회·기업 관계자 100여명이 참석했다. 정부 측에서는 여한구 산업통상부 통상교섭본부장이 참석했다. 일본 측에서는 다케히코 마쓰오 경제산업성 통상차관과 게이단렌, 도요타자동차, 소니, NEC 관계자 등이 함께했다. 참석자들은 전날 만찬을 가진 데 이어 이날 분야별 토론을 가졌다. 회의는 비공개로 진행된 가운데 미중 갈등에 따른 공급망 문제를 주로 논의한 것으로 전해졌다. 이 모임을 주도해온 빌 해거티 미국 상원의원(공화당)은 최근 중국의 한국 조선업 제재, 과거 일본에 대한 희토류 수출 중단 등을 거론하면서 가장 큰 우려 사항으로 중국을 지목했다. 해거티 의원은 “이 회의",2025-10-15,https://www.seoul.co.kr/news/economy/2025/10/15/20251015500270,서울신문
中 마스가 제재 영향 미미…장기 땐 희토류 압박 가능성에 ‘긴장’,https://img.seoul.co.kr/img/upload/2025/10/15/SSC_20251015183103_N1.jpg.webp,"중국이 한화그룹 미국 자회사 5곳에 대한 제재로 한미 조선업 협력 프로젝트 ‘마스가’(MASGA)를 때렸지만, 국내 조선업계에 미칠 영향은 미미할 것으로 보인다. 다만 중국이 미국과 협력하는 국내 기업에 경고성 조치를 취한 만큼, 중국이 희토류를 무기로 국내 기업들을 압박할 수 있어 산업계가 촉각을 곤두세우고 있다. 유안타증권은 15일 보고서에서 “이번 제재가 현재 조선·해운 시장에 어떠한 영향도 줄 수 없다고 판단한다”며 “미국에서 만들어진 배는 원래 중국과 엮일 일이 없다”고 평가했다. 한국투자증권도 “중국이 한화그룹의 미국 자회사를 제재해서 직접적으로 끌어낼 수 있는 실익은 없다”며 “일종의 경고성 조치”라고 진단했다. 전날 급락했던 한화오션 주가도 이날 1.94% 오른 10만 5100원으로 장을 마쳤다. 정부도 이번 조치를 미중 대립 속에 ‘예상할 수 있는 일 중 하나’로 봤다. 위성락 국가안보실장은 이날 용산 대통령실에서 브리핑을 통해 “표면적 이유는 (중국 측의) 발표 속에 들어있는 것으로 이해한다”며 “공급망 부분에서 (미중간) 첨예한 대립이 있기 때문에, 중간에서 사업을 하는 한국 기업에 이런 소지는 항상 있었다고 파악하고 있다”고 설명했다",2025-10-15,https://www.seoul.co.kr/news/economy/industry/2025/10/15/20251015500263,서울신문
이재용·정의선 ‘한미일 경제대화’ 참석,https://img.seoul.co.kr/img/upload/2025/10/15/SSC_20251015182023_N1.jpg.webp,"한미일 정·재계 인사들이 15일 일본 도쿄에서 열린 ‘제3회 한미일 경제대화’(TED)에서 미중 갈등을 비롯한 글로벌 경제 현안과 복합 위기 극복 방안을 논의했다. 미국 측은 세 나라의 가장 큰 위협으로 중국을 지목하며 3국의 결속을 강조했고, 참석자들은 반도체·에너지·공급망 등 다양한 분야의 협력을 모색한 것으로 알려졌다. 일본 도쿄의 일본경제단체연합회(게이단렌) 회관에서 열린 이번 회의에는 이재용 삼성전자 회장, 정의선 현대자동차그룹 회장, 조현준 효성그룹 회장을 비롯해 한미일 정부·의회·기업 관계자 100여명이 참석했다. 정부 측에서는 여한구 산업통상부 통상교섭본부장이 참석했다. 일본 측에서는 다케히코 마쓰오 경제산업성 통상차관과 게이단렌, 도요타자동차, 소니, NEC 관계자 등이 함께했다. 참석자들은 전날 만찬을 가진 데 이어 이날 분야별 토론을 가졌다. 회의는 비공개로 진행된 가운데 미중 갈등에 따른 공급망 문제를 주로 논의한 것으로 전해졌다. 이 모임을 주도해 온 빌 해거티 미국 상원의원(공화당)은 최근 중국의 한국 조선업 제재, 과거 일본에 대한 희토류 수출 중단 등을 거론하면서 가장 큰 우려 사항으로 중국을 지목했다. 해거티 의원은 “이 회",2025-10-16,https://www.seoul.co.kr/news/peoples/2025/10/16/20251016027001,서울신문
"파월, 추가 금리 인하 시사… 코스피 3650, 또 최고치 찍었다",https://img.seoul.co.kr/img/upload/2025/10/15/SSC_20251015181947_N1.jpg.webp,"2.68% 급등… 시총 3000조 첫 돌파 고강도 부동산 정책 발표 효과도 국제금값, 온스당 4200달러 돌파 미중 무역 갈등에도 미 연방준비제도(Fed·연준)의 기준금리 인하 기대감이 커지면서 코스피가 3650선을 돌파하며 사상 최고치를 경신했다. 미 연준의 금리인하 기대감으로 국제금값도 온스당 4200달러를 넘어 또 사상 최고치를 찍었다. 15일 한국거래소에 따르면 코스피는 전장보다 95.47포인트(2.68%) 오른 3657.28로 거래를 종료하며 장중 및 종가 기준 사상 최고치를 모두 갈아치웠다. 코스피는 전날에도 장 중 한때 3646.77까지 오르며, 직전 장중 최고 기록(10월 10일 3617.86)을 새로 썼으나 이후 급락해 3561.81로 장을 마쳤는데 하루 만에 이를 만회한 것을 넘어 기록을 경신했다. 코스피 시가총액도 약 3012조원으로 3000조원 선을 넘어섰다. 앞서 14일(미국 동부시간) 도널드 트럼프 미 대통령은 뉴욕증시 마감을 앞두고 중국의 미국산 대두 수입 중단과 관련해 “이에 대한 보복 조치로, 식용유 및 다른 교역 품목과 관련된 중국과의 사업 관계를 단절하는 것을 검토하고 있다”고 말해 시장의 우려를 키웠다. 뉴욕증시 3",2025-10-16,https://www.seoul.co.kr/news/economy/securities/2025/10/16/20251016019001,서울신문
“보유세·거래세 조정 검토”… 최후의 수단 ‘세제 카드’ 경고했다,https://img.seoul.co.kr/img/upload/2025/10/15/SSC_20251015180410_N1.jpg.webp,"대통령실 “보유세 낮은 것은 사실” 과열 지속 땐 보유세 인상 메시지 비수도권 양도세 완화도 열어둬 수사권 지닌 부동산 감독기구 설치 10·15 부동산 대책에서 세제 개편을 통한 ‘보유세 강화안’은 예상대로 빠졌다. ‘증세’의 파급력과 내년 지방선거를 앞둔 상황, “세금으로 집값을 잡지 않겠다”는 이재명 대통령의 뜻이 두루 담긴 결정으로 풀이된다. 대신 시장 상황에 따라 세제를 ‘조정’하겠다는 메시지가 담겼다. 부동산 과열이 이어진다면 보유세·거래세 등 세제 카드를 꺼내 들 수 있다는 ‘경고’다. 구윤철 부총리 겸 기획재정부 장관은 15일 ‘주택시장 안정화 대책’ 브리핑에서 “생산적 부문으로 자금 흐름을 유도하고 응능부담(납세자 능력에 맞는 부담) 과세 원칙, 국민의 수용성 등을 종합적으로 고려해 부동산 세제 합리화 방안을 마련하겠다”고 밝혔다. 방향에 대해선 “세제 개편의 구체적인 방향·시기·순서 등은 부동산 시장에 미치는 영향과 과세 형평 등을 고려해 종합 검토할 계획”이라면서 “연구용역 및 관계부처와의 논의를 통해 보유세·거래세 조정과 특정 지역 수요 쏠림 완화를 위한 세제 합리화 방안을 검토하겠다”고 언급했다. 정부가 보유세를 올리는 방향으로 부동",2025-10-16,https://www.seoul.co.kr/news/economy/estate/2025/10/16/20251016005002,서울신문
230만가구 규제 묶여 타격…“계약 앞당겨달라” 대혼란,,"정부가 초강력 대책을 내놓으면서 주택시장이 패닉에 빠졌다. 15일 부동산R114에 따르면 이번 10·15 대책으로 서울 전체 156만 가구, 경기 12개 지역 74만 가구 등 총 230만가구가 규제지역으로 묶이며 타격을 받을 것으로 분석됐다. 서울 서초구 반포동의 한 중개업소 대표는 “고가주택은 아예 보유 현금이 없으면 사지 말라는 말이나 다름없다”며 “거래가 쉽지 않을 것”이라고 말했다. 정부가 예상보다 광범위하게 규제지역을 지정하면서 서울 외곽과 수도권에서는 거래 침체를 우려하는 목소리가 크다. 그러나 당장은 규제지역 지정 전에 계약하기 위해 날짜를 앞당기거나 막판 갭투자를 하려는 사람들의 문의가 빗발쳤다. 16일 규제지역으로 지정되면 대출한도가 줄거나 1주택 이상 보유자는 취득세가 8~12%로 늘어나 그 전에 계약을 앞당기려는 것이다. 시가 5억원 아파트를 이날까지 매수하면 취득세 1%가 적용돼 500만원을 내면 되지만 16일부터 1주택 보유자가 주택을 추가로 매수하면 취득세가 8%인 4000만원으로 8배 급증한다. 서울 노원구 상계동의 한 공인중개사는 “저가 아파트는 대출에 큰 문제가 없어도 취득세가 8배가 되는데 (규제지역으로 묶이면) 어떻게 매수",2025-10-16,https://www.seoul.co.kr/news/economy/estate/2025/10/16/20251016004001,서울신문
‘카톡 개편 불만’ 이용자들 다시 부글부글,https://img.seoul.co.kr/img/upload/2025/10/15/SSC_20251015180343_N1.jpg.webp,"카카오가 카카오톡 업데이트를 이전 버전으로 되돌리는 ‘롤백’은 기술적으로 어렵다고 밝혀 최근 개편에 불만을 품은 이용자들의 원성이 다시 커졌다. 우영규 카카오 부사장은 지난 14일 국회 과학기술정보방송통신위원회의 방송통신미디어통신위원회 국정감사에서 황정아 더불어민주당 의원의 “이전 버전으로 롤백이 불가능하느냐”라는 질의에 “버전 2.0에서 1.0으로 완전히 되돌리기는 기술적으로 불가능하다”고 답했다. 그러면서 “업데이트를 안 받은 이용자는 (이전 버전을) 쓸 수 있지만 사후 수리(AS) 측면에서 문제가 있을 수 있다”고 했다. 앞서 카카오는 지난달 29일 업데이트 관련 이용자들의 불만이 빗발치자 이용자들의 요구를 수용해 기존 카카오톡 첫 화면인 친구탭의 ‘친구 목록’을 되살리고 피드형 게시물을 별도 ‘소식’ 메뉴로 제공하는 방식을 연내 적용하기로 했다. 하지만 우 부사장의 ‘롤백 불가’ 발언으로 이 약속 이행에 대한 논란이 다시 불거졌다. 일부 이용자들은 ‘카카오 같은 대기업이 기술적으로 불가능하다면 문제가 있는 것’이라는 날 선 비판도 내놨다. 이에 카카오 측은 ‘롤백 불가’는 이미 다운로드된 새 버전을 구버전으로 되돌리는 것이 어렵다는 뜻일 뿐이며,",2025-10-16,https://www.seoul.co.kr/news/economy/IT/2025/10/16/20251016016002,서울신문
“美관세 이대로면 현대차 연 8.4조 부담…도요타는 6.2조”,https://img.seoul.co.kr/img/upload/2025/10/15/SSC_20251015175000_N1.jpg.webp,"미국이 한국에 부과한 자동차 수출 관세율이 25％로 유지되면 현대자동차그룹의 관세 비용이 연간 8조원을 넘겨 경쟁사들보다 더 많은 부담이 될 것이라는 분석이 나왔다. 내년에는 미국 자동차 시장이 전반적으로 부진할 것으로 보여 조속한 관세율 인하가 필요하다는 목소리가 나온다. 15일 나이스신용평가의 자동차 산업점검에 따르면 대미 자동차 수출 관세율이 현재와 같이 한국은 25％, 유럽연합(EU)과 일본은 15％로 적용되면 현대차그룹의 관세 비용은 연간 8조 4000억원으로 추산됐다. 이는 경쟁업체인 도요타(6조 2000억원), GM(7조원), 폭스바겐(4조 6000억원)을 크게 웃도는 수준이다. 나이스신용평가는 이에 따라 현대차그룹의 연간 영업이익률은 기존 9.7％에서 6.3％로 하락할 것이라고 전망했다. 영업이익률 하락 폭 역시 도요타(9.7→8.1％), GM(8.0→5.0％), 폭스바겐(6.0→4.8%)보다 큰 수준이다. GM은 관세 비용과 영업이익률 하락 폭 모두에서 현대차그룹 다음을 차지했는데 대미 수출기지 역할을 하는 한국GM의 영향으로 보인다. 한국GM은 지난해 약 41만 8782대를 미국에 수출했다. 반면 한국 자동차도 일본이나 EU처럼 대미 관",2025-10-15,https://www.seoul.co.kr/news/economy/car/2025/10/15/20251015500252,서울신문
"미관 해치지 않는 ‘빌트인 가전’의 결정체…LG전자, 빌트인 전용 전시관 ‘SKS 서울’ 가보니",https://img.seoul.co.kr/img/upload/2025/10/15/SSC_20251015173403_N1.png.webp,"LG전자가 프리미엄 빌트인 가전 브랜드인 ‘SKS‘의 전시관 ‘SKS 서울’을 재단장해 개관했다고 15일 밝혔다. SKS는 LG전자가 올해 초 프리미엄 빌트인 주방 가전 브랜드인 ‘시그니처 키친 스위트’를 리브랜딩 한 것으로, 직관적인 명칭으로 글로벌 빌트인 가전 시장을 공략하기 위한 브랜드다. 서울 강남구 논현동에 위치한 SKS 서울은 지하 1층부터 지상 5층까지 다양한 분위기의 인테리어로 총 10개의 제품 전시 공간을 연출했다. 연면적 1918㎡ 규모로 조성돼 고객들이 SKS 빌트인 가전을 활용한 일상생활 속 모습을 엿보고 경험할 수 있도록 했다. 공간 설계는 최고급 골프 리조트인 ‘아난티 남해’, ‘세이지우드 골프&리조트’ 등을 맡았던 민성진 건축가가 담당했다. 예를 들어 ‘히어로키친’ 컨셉의 지하 1층에는 용도에 따라 냉장고와 냉동고 크기를 서로 다르게 선택해 조립할 수 있는 ‘컬럼 냉장고’와 싱크대 아래쪽에 배치할 수 있는 소형 ‘아일랜드 냉장고’ 등이 빌트인돼 전시됐다. 몰테니앤씨, 아크리니아 등 이탈리아의 대표 명품 가구 업체 등과 협업해 미관을 해치지 않으면서 부엌 공간에 자연스럽게 녹아들게 했다. 고객들은 SKS 서울을 방문해 컬럼",2025-10-15,https://www.seoul.co.kr/news/economy/industry/2025/10/15/20251015500241,서울신문
"검찰, ‘한전 발주 입찰 담합’ LS일렉트릭 등 7곳 압수수색",https://img.seoul.co.kr/img/upload/2025/08/25/SSC_20250825184144_N1.jpg.webp,"검찰이 한국전력공사(한전)가 발주한 5600억원 규모의 설비장치 입찰에서 8년간 담합한 혐의를 받는 LS일렉트릭(옛 LS산전) 등 7곳에 대한 강제수사에 착수했다. 서울중앙지검 공정거래조사부(부장 나희석)는 15일 LS일렉트릭과 일진전기, 동남, 제룡전기, 한국중전기사업협동조합(중전기조합) 등 7곳과 관련자들에 대한 압수수색을 진행했다고 밝혔다. 해당 업체들은 2015년부터 2022년까지 한전이 ‘가스절연개폐장치’ 구매를 위해 실시한 일반경쟁·지역 제한 입찰에서 사전에 물량을 배분하기로 합의한 뒤 차례로 낙찰받은 혐의를 받는다. 발전소나 변전소에 설치되는 가스절연개폐장치(GIS)는 과도한 전류를 신속하게 차단시켜 전력 설비를 보호하는 장치다. 특히 이런 담합 행위로 인해 가스절연개폐장치의 낙찰가가 상승했고, 전기료가 인상되는 등 소비자 피해로 이어졌다는 게 검찰의 판단이다. 앞서 공정거래위원회는 지난해 12월 해당 사건과 관련해 담합이 의심되는 10개 사업자에 대해 시정명령과 함께 과징금 총 391억원(잠정금액)을 부과하고 6개 사업자를 고발했다. 이들은 담합의 증거를 남기지 않기 위해 참여자가 모두 한 자리에 모이지 않는 등 치밀하게 계획했다. 대기업군",2025-10-15,https://www.seoul.co.kr/news/society/2025/10/15/20251015500240,서울신문
"블랙야크, 강력한 방풍·보온 ‘히마 다운’ 시리즈 공개… “고어텍스·그래핀 기술력 집약”",https://img.seoul.co.kr/img/upload/2025/10/15/SSC_20251015170732_N1.jpg.webp,"고어텍스 윈드스토퍼·그래핀 안감 등 최첨단 기술력으로 겨울 프리미엄 다운 시장 공략 헝가리산 구스다운, RDS 인증 구스 적용… 숏부터 롱까지 세분화된 라인업 브랜드 모델 아이유와 함께한 캠페인 영상 공개… 포토부스 네컷 사진 ‘눈길’ 고기능성 글로벌 아웃도어 브랜드 블랙야크(회장 강태선)가 강력한 방풍·보온 기술력을 집약한 겨울 시그니처 시리즈 ‘히마 다운’(HIMA DOWN)을 공개하며 프리미엄 다운 자켓 시장 공략에 나섰다고 15일 밝혔다. 블랙야크는 히말라얀 오리지널 정체성과 혁신 기술력을 담은 프리미엄 다운 자켓 ‘히마’ 시리즈를 매년 선보이고 있다. 올해 새롭게 선보이는 히마 다운 시리즈는 고어텍스 윈드스토퍼(GORE-TEX INFINIUM™ WINDSTOPPER®) 소재를 전 라인업에 적용해 찬 바람을 완벽히 차단하며 보온성을 극대화한 것이 특징이다. 여기에 정전기 방지 및 체온 유지를 돕는 그래핀(Graphene) 안감을 더해 춥고 건조한 겨울에도 따뜻함과 쾌적함을 동시에 제공한다. 제품별로 후드 퍼(Fur), 금속 허리 벨트 등 고급스러운 디테일을 더했으며, 트렌디한 숏 기장부터 한겨울까지 착용 가능한 코트형·야상형 롱다운까지 다채로운",2025-10-15,https://www.seoul.co.kr/news/economy/2025/10/15/20251015500229,서울신문
"푸틴 돈줄 끊기나… 트럼프 “인도, 러시아산 석유 구매 않겠다 약속”",https://img.seoul.co.kr/img/upload/2025/10/16/SSC_20251016062416_N1.jpg.webp,"“큰 진전…중국도 똑같은 일 하게 만들 것” 도널드 트럼프 미국 대통령은 15일(현지시간) 인도가 러시아로부터의 석유 수입을 중단할 것이라고 약속했다고 밝혔다고 AP·로이터통신 등이 전했다. 트럼프 대통령은 이날 워싱턴DC 백악관 행사에서 기자들에게 “나는 인도가 (러시아로부터) 석유를 사는 것을 좋아하지 않았고, 그러자 나렌드라 모디 인도 총리는 오늘 내게 인도가 러시아로부터 석유를 사지 않을 것이라고 확신시켰다”고 말했다. 트럼프 대통령은 그러며서 “큰 진전이다. 이제 중국도 똑같은 일을 하게 만들 것”이라고 강조했다. 트럼프 대통령은 “인도가 즉각적으로 선적을 중단할 수는 없고, 약간의 과정이 필요하다”면서도 “하지만 그 과정은 곧 끝날 것”이라고 덧붙였다. 로이터는 주워싱턴 인도대사관에 모디 총리가 트럼프 대통령에 이같은 약속을 했는지 물었으나 즉시 응답이 오진 않았다고 전했다. 지속하는 우크라이나 전쟁 속에서 미국이 (세계 각국의) 러시아산 석유 수입을 억제하기 위해 노력하고 있는 가운데 인도가 러시아산 석유 수입을 중단하겠다고 약속한 것은 세계 에너지 외교에서 잠재적인 전환점이 될 것이라고 로이터는 짚었다.",2025-10-16,https://www.seoul.co.kr/news/international/USA-amrica/2025/10/16/20251016500005,서울신문
“누가 올지 궁금” 죽은 척 장례식 열고 화장 직전 깨어난 70대 남성…인도 ‘경악’,https://img.seoul.co.kr/img/upload/2025/10/16/SSC_20251016014136_N1.jpg.webp,"인도에서 한 남성이 살아있는 상태에서 자신의 장례식을 열고 화장 직전 깨어나면서 마을 사람들을 경악케 했다. 15일(현지시간) 인디안익스프레스 등 현지 매체에 따르면 인도 비하르주 콘치 마을에서 은퇴한 군 장교 모한 랄(74)이 자신이 건립한 새로운 화장터에서 자신의 장례식을 연출하는 전례 없는 사건이 발생했다. 장례식에서 랄은 전통적인 흰색 수의에 싸인 채 관 위에 누워있었다. 현지 주민들은 이 상황이 실제 사망이라고 믿었으며, 많은 인파가 고인에게 조의를 표하기 위해 모여들었다. 보도에 따르면 장례 행렬은 모든 관습적인 의식을 따랐으며 주민들은 그의 명복을 빌었다. 그러나 행렬이 화장터에 도착하자 예상치 못한 상황이 발생했다. 랄이 갑자기 일어나 앉아 장례식이 연출된 것임을 밝힌 것이다. 랄은 장례식을 연출한 이유에 대해 “나는 누가 진정으로 나를 아끼는지 보고 싶었다”고 설명했다. 이러한 이벤트의 배경에는 지역 사회 봉사에 대한 열망도 있었다. 랄은 마을 주민들이 우기 동안 시신 화장을 치르는 데 어려움을 겪는 모습을 목격한 후 직접 나서서 적절한 화장 시설을 건설하기로 결정했다. 랄은 “은퇴 후에도 마을과 사회에 봉사하고 싶었다”며 “마을 주",2025-10-16,https://www.seoul.co.kr/news/international/asia-oceania/2025/10/16/20251016500003,서울신문
佛총리 결단? 굴욕?,https://img.seoul.co.kr/img/upload/2025/10/16/SSC_20251016010250_N1.jpg.webp,"사임 뒤 재임명… 연금 개혁 연기 “현재부터 2028년 1월까지” 제안 세바스티앵 르코르뉘 프랑스 총리가 불신임 투표를 하루 앞둔 14일(현지시간) 에마뉘엘 마크롱 대통령이 역점 사업으로 추진해 온 연금 개혁 중단을 선언했다. 르코르뉘 총리는 이날 국회 연설에서 “2023년의 연금 개혁을 다음 대선 이후로 연기할 것을 의회에 제안하겠다”며 “현재부터 2028년 1월까지 정년 연장은 없을 것”이라고 밝혔다. 다음 대선은 2027년 4~5월로 예정돼 있다. 르코르뉘 총리가 임명 27일 만에 사임했다가 나흘 만에 재임명된 만큼 이는 프랑스의 정치적 불안을 막기 위한 고육지책이다. 마크롱 대통령도 르코르뉘 총리 재임명 뒤 본인의 대선 핵심 공약이었던 연금 개혁을 연기할 의사를 밝혔다. 폴리티코는 이에 대해 “정치인으로서 자기 소신을 꺾는, 가장 하기 힘든 결정을 했다”고 평가했다. 마크롱 2기 행정부가 여론의 거센 반발에도 2023년 9월 시작한 연금 개혁은 퇴직 연령을 기존 62세에서 64세로 늘리고 연금 만기 수령 납입 기한도 2027년부터 43년으로 1년 늘리는 게 골자다. 앞서 극우부터 극좌 야당 모두 15일 르코르뉘 총리 불신임 투표를 발의했다. 하지만",2025-10-16,https://www.seoul.co.kr/news/peoples/2025/10/16/20251016027007,서울신문
처음 열린 북극항로,https://img.seoul.co.kr/img/upload/2025/10/16/SSC_20251016005939_N1.jpg.webp,세계 최초로 북극 항로를 운항한 중국 국적의 화물선 이스탄불 브리지호가 지난 13일(현지시간) 영국 펠릭스토항에 도착하고 있다. 중국 동부의 저장성 닝보시 저우산항에서 출발한 화물선은 22일 만에 유럽에 도착해 수에즈 운하를 통과하는 기존 항로보다 약 20일 빨랐다. 펠릭스토우 신화 연합뉴스,2025-10-16,https://www.seoul.co.kr/news/international/2025/10/16/20251016018008,서울신문
"‘적반하장’ 캄보디아 관광업계… “한국, 국민 교육부터 시켜라”",,"캄보디아에서 벌어지고 있는 한국인 대상 납치·감금·살인 등의 범죄에 대해 한국 정부가 강경 대응에 나서자 캄보디아 관광업계가 “일반 관광객이 아니라 범죄 조직에 연루된 사람들에게 일어나는 일”이라며 유감을 표했다. 한국인 실종 신고가 쏟아지고 사망자까지 발생한 상황에서 캄보디아 경찰은 물론 관광업계까지 피해자와 한국 정부 탓이라며 적반하장식 반응을 보여 논란이 일 전망이다. 셈 속헹 캄보디아 한국관광가이드협회장은 지난 13일 프놈펜포스트와의 인터뷰에서 “희생자들은 대부분 관광객이 아니라 불법적인 일자리에 지원한 사람들”이라며 “한국 정부가 범죄와 관광을 구분하지 않는 점이 안타깝다”고 말했다. 그러면서 “지난 열흘 동안 캄보디아를 여행한 한국 관광객들은 모두 안전하게 지냈다”며 “한국 정부가 할 일은 자국민에게 온라인 사기의 전형적인 수법, 특히 고액 일자리 제안을 미끼로 한 사기, 그리고 피해를 예방하는 방법을 더 잘 교육하는 것”이라고 주장했다. 캄보디아 경찰당국은 이번 사태를 피해자와 한국 정부 탓으로 돌렸다. 한국인 피해자 가족이 외교적 도움을 요청했다는 보도와 관련해 캄보디아 경찰은 크메르타임스에 “시신이 발견되기 전 피해자 가족이나 한국 대사관으로",2025-10-16,https://www.seoul.co.kr/news/international/asia-oceania/2025/10/16/20251016012006,서울신문
