title,thumbnail,short_content,write_time,link,company
셀린 디옹·손정의·저커버그·시진핑… 글로벌 인사 순례지 된 ‘제2 백악관’,https://img.seoul.co.kr/img/upload/2025/10/19/SSC_20251019175724_N1.jpg.webp,"미국 플로리다 팜비치에 있는 마러라고 리조트는 시리얼 회사 포스트 가문이 미 연방정부에 기증했던 저택을 1985년 부동산 개발업자이던 도널드 트럼프 대통령이 사들인 뒤 개인 별장 겸 리조트로 개발한 곳이다. 트럼프 대통령은 집권 1기 때인 2019년 개인 거처를 뉴욕에서 이곳으로 옮겼다. 마러라고는 배우, 가수, 운동선수 등 글로벌 유명 인사들의 사교 무대였고 트럼프 집권 후엔 굴지의 기업인, 정치인들의 로비, 외교의 장으로 거듭나며 ‘제2의 백악관’이 됐다. 1990년대부터 트럼프 1기 집권 전까지 ﻿각종 파티와 자선행사, 콘서트, 새해맞이 갈라 행사가 트럼프 주재하에 열렸다. 당시 최고 인기를 누렸던 캐나다 팝가수 셀린 디옹, 할리우드 배우 존 스타모스, 가수 제니퍼 허드슨 등이 자선행사에 수차례 참석했고 전설적인 재즈 가수 고(故) 토니 베넷도 1995년과 1997년 파티 및 자신의 공연을 주최한 바 있다. 배우 스티븐 볼드윈, 가수 마이클 볼턴, 로드 스튜어트, 라이오넬 리치, 색소폰 연주자 케니 G, 토크쇼 진행자 제이 레노, 테니스 스타 세리나 윌리엄스, 오페라 가수 안드레아 보첼리 등이 마러라고에 초대됐던 스타들이다. 배우 실베스터 스탤론은 2",2025-10-20,https://www.seoul.co.kr/news/international/USA-amrica/2025/10/20/20251020002002,서울신문
‘모나리자 도둑’ 될뻔했던 피카소의 손바닥만 한 작품 사라져,https://img.seoul.co.kr/img/upload/2025/10/19/SSC_20251019173828_N1.png.webp,"가장 도난 사고를 많이 당한 화가로 유명한 ‘입체파의 창시자’ 파블로 피카소의 정물화가 모국 스페인에서 운송 도중 사라졌다. 스페인 일간지 엘 파이스는 지난 2일 수도 마드리드에서 출발해 그라나다로 향하던 피카소의 1919년작 ‘기타가 있는 정물’의 행방을 경찰이 수사 중이라고 전했다. 사라진 그림은 개인 소장품으로, 인물화 캔버스 규격인 1호(22.7×15.8㎝)보다도 작은 가로 9.8㎝, 세로 12.7㎝의 크기다. 피카소 작품을 전문적으로 판매하는 ‘레도르 파인 아트’는 도난당한 그림이 몇 년 전 60만 유로(약 10억원)에 팔렸다고 밝혔다. 6만점 이상으로 추정되는 작품을 남긴 피카소는 1000점 이상의 유작이 도난, 분실, 소유권 분쟁을 겪고 있다. 이번 사고는 카하 그라나다 문화센터에서 지난 9일부터 내년 1월까지 열리는 ‘정물: 움직이지 않는 것의 영원함’ 전시회를 위해 작품을 옮기다 발생했다. 나머지 50여점 이상의 그림들은 무사히 그라나다에 도착해 현재 전시가 열리고 있다. 마드리드에서 그라나다는 자동차로 약 4시간이 걸리는데 사라진 ‘기타가 있는 정물’은 소장자의 집에서 운송회사로 먼저 옮겨졌다. 운송회사는 나머지 전시작품이 모두",2025-10-19,https://www.seoul.co.kr/news/international/2025/10/19/20251019500105,서울신문
“친아빠·친오빠들이 성폭행” 10대 자매 사건에 ‘발칵’…말레이서 무슨 일이,https://img.seoul.co.kr/img/upload/2025/10/19/SSC_20251019170522_N1.png.webp,"말레이시아에서 60대 아버지와 두 아들이 미성년자 자매를 성폭행한 혐의로 기소되는 충격적인 사건이 발생했다. 18일(현지시간) 현지 매체 the Vibes 등에 따르면 말레이시아 클란탄주 검찰은 지난 7일 아버지 A(65)씨와 두 아들 B(33)씨, C(24)씨를 파시르 푸테 법원에 기소했다. 이들은 각각 12세와 16세 자매를 성폭행한 혐의를 받고 있다. A씨는 올해 7월 자택에서 두 딸을 성폭행한 혐의로 기소됐다. B씨와 C씨는 올해 두 차례에 걸쳐 같은 장소에서 16세 친동생을 성폭행한 혐의를 받고 있다. 세 사람은 모두 무죄를 주장하며 혐의를 부인하고 있다. 만약 유죄가 인정될 경우 최대 징역 20년과 태형이라는 중형에 처해질 수 있다. 말레이시아 법원은 어린이를 대상으로 성범죄를 저지른 범죄자에게 매우 엄격한 판결을 하는 것으로 알려져 있다. 지난 2023년 한 말레이시아 남성은 친딸(15)을 지난 3년간 성폭행한 혐의로 징역 218년과 태형 75대를 선고받았다. 딸은 침실 문 잠금장치를 바꾸면서 부친의 성폭행을 피하려고 애썼지만, 부친의 성폭행은 멈추지 않았다. 그러나 학교에서 실시한 건강검진을 통해 딸의 임신 7개월 사실이 밝혀지면서 부친",2025-10-19,https://www.seoul.co.kr/news/international/2025/10/19/20251019500092,서울신문
“정육점 할인?” 불륜 의심해 아내 살해하려던 男 감형…‘반전’ 있었다,https://img.seoul.co.kr/img/upload/2025/10/02/SSC_20251002171350_N1.jpg.webp,"중국의 한 남성이 아내가 정육점에서 할인받았다는 이유로 외도를 의심해 아내를 살해하려 한 충격적인 사건이 발생한 가운데, 아내가 남편의 선처를 호소해 눈길을 끌고 있다. 19일 홍콩 사우스차이나모닝포스트(SCMP)에 따르면 지난 3월 중국 지린성 쑹위안시에서 남편 저우씨는 아내 자오씨가 정육점에서 할인을 받아오자 정육점 주인과 부적절한 관계를 맺고 있다고 의심하기 시작했다. 근거 없는 질투심에 사로잡힌 저우씨는 결국 아내를 살해할 계획을 세웠다. 자오씨와 격렬한 말다툼을 하던 저우씨는 미리 침대 옆 서랍에 숨겨둔 흉기로 자오씨를 여러 차례 찔렀다. 이 공격으로 자오씨는 심각한 내상을 입었으며, 본인도 몇 번이나 찔렸는지 기억하지 못할 정도였던 것으로 전해졌다. 하지만 놀랍게도 자오씨는 남편에 대한 처벌을 원치 않는다며 남편의 선처를 호소했다. 자오씨는 “30년 넘게 결혼 생활을 해오면서 남편과 늘 좋은 관계였고 심각한 갈등은 없었다”며 “남편은 돈을 벌어 모두 가족에게 가져다주는 성실한 사람이다. 아들, 손자도 있는데 더 이상 일을 키우고 싶지 않다. 상해 정도 평가도 원하지 않고, 장애 보상금도 신청하지 않겠다”고 밝혔다. 이에 쑹위안시 닝장구 인민법",2025-10-19,https://www.seoul.co.kr/news/international/2025/10/19/20251019500069,서울신문
"왕관 쓴 대통령, “왕은 없다” 시위대에 ‘오물 폭격’…국민 조롱한 트럼프 [포착]",https://img.seoul.co.kr/img/upload/2025/10/19/SSC_20251019144331_N1.jpg.webp,"“노 킹스!” 18일(현지시간) 미국 전역 2700여곳에서 수백만명이 도널드 트럼프 대통령의 제왕적 국정 운영을 비판하는 ‘노 킹스’(No Kings·왕은 없다) 시위가 벌어졌다. 같은 날 트럼프 대통령은 시위대 조롱 영상을 공유하며 각을 세웠다. 이날 오전 10∼11시쯤 워싱턴DC와 뉴욕, 보스턴, 애틀랜타 등 동부 주요 도시의 중심 거리에 각각 시위 인파가 모여들기 시작했다. 이어 시차가 있는 일리노이주 시카고, 텍사스주 휴스턴 등 중서부 지역에서도 같은 기치를 내건 시위가 잇따랐다. 특히 워싱턴DC 연방의회 의사당 앞에서는 오전부터 모여들기 시작한 시위대가 점점 불어나 그 인원이 수천명에 이르렀고, 백악관에서 의사당으로 이어지는 펜실베이니아 애비뉴를 거의 가득 메웠다. 참가자들은 ▲미국 내 치안 유지 목적의 군대 동원 ▲법원 판결 무시 ▲이민자 대거 추방 ▲대외 원조 삭감 ▲선거 공정성 훼손 등 트럼프 대통령의 여러 정책이나 언행이 민주주의적이지 않다고 지적하면서 그가 독재자나 파시스트처럼 국정을 운영하고 있다고 비판했다. 이에 트럼프 대통령은 자신이 왕관을 쓰고 시위대에 ‘오물 폭격’을 퍼붓는 영상을 소셜미디어(SNS)에 게시하며 맞불",2025-10-19,https://www.seoul.co.kr/news/international/2025/10/19/20251019500067,서울신문
"이재용·최태원·정의선·구광모, 트럼프와 단체 골프…전무후무",https://img.seoul.co.kr/img/upload/2025/10/19/SSC_20251019115244_N1.jpg.webp,"이재용 삼성전자 회장, 최태원 SK그룹 회장, 정의선 현대차그룹 회장, 구광모 LG그룹 회장, 김동관 한화그룹 부회장이 도널드 트럼프 미국 대통령과 골프를 쳤다. 한국의 주요 재벌기업 총수들이 집단으로 미국의 대통령 및 정·관계 주요 인사들과 함께 골프를 즐긴 것은 사상 유례가 없는 전무후무한 일이다. 트럼프 대통령은 18일(현지시간) 한국·일본·대만 기업 대표들과 플로리다주 팜비치섬 내 본인 소유인 ‘트럼프 인터내셔널 골프 클럽’에서 한나절에 걸쳐 회동했다. 경찰은 이날 오전 트럼프 대통령의 마러라고 별장에서 골프장으로 이어지는 도로를 약 10분간 통제했고, 트럼프 대통령은 오전 9시 15분쯤 골프장에 도착했다. 트럼프 대통령이 골프장에 도착한 후 각 조가 각 홀에서 동시 티오프하는 ‘샷건’ 방식으로 라운딩이 시작됐을 것으로 짐작된다. 다만 통상 4인 1조로 진행되는 아마추어 골프 경기에서 트럼프 대통령이 누구와 한 조를 이뤘는지는 알려지지 않았다. 백악관은 풀기자단의 확인 요청을 거부했다. 트럼프 대통령이 한국 기업인들과 동반 라운딩을 하지 않았더라도, 이들은 경기 전후 또는 점심시간이나 휴식시간 등에 트럼프 대통령과 대화했을 가능성이 크다.",2025-10-19,https://www.seoul.co.kr/news/international/2025/10/19/20251019500032,서울신문
말레이시아에 ‘총격범 조승희’ 이름이…여학생 살해한 범행도구서 발견,https://img.seoul.co.kr/img/upload/2025/10/19/SSC_20251019110958_N1.jpg.webp,말레이시아의 한 학교에서 남학생이 여학생을 살해해 현지에서 파장이 일고 있는 가운데 이 남학생이 사용한 흉기에 미국의 한국인 총격범 ‘조승희’의 이름이 적혀 있던 것으로 전해졌다. 앞서 싱가포르 매체 더 스타(The Star) 등의 보도에 따르면 지난 14일 오전 9시 10분쯤 말레이시아 슬랑오르주의 한 학교 여학생 화장실 주변에서 여학생 A(16)양이 숨진 채 발견됐다. 경찰은 같은 학교 학생인 남학생 B(14)군을 용의자로 체포해 구금했다. 범행 당시 피해자가 비명을 질렀고 이를 들은 교사가 화장실 근처에서 피해자를 발견해 오전 9시 40분쯤 경찰에 신고했다. A양은 몸 여러 군데에 찔린 상처가 있었다. B군은 사건 직후 범행 도구를 들고 학교 내부를 돌아다니며 “사람을 죽였다”고 외친 것으로 전해졌다. 이후 교사와 B군의 형이 나서서 그를 제압했다. 범행에 사용된 흉기 2점도 발견됐다. 범행 동기는 공식적으로 밝혀지지 않았으나 A양의 친구는 현지의 중국계 매체인 중국보(차이나프레스)에 “사건 전날 밤 B군이 A양에게 고백했으나 거절당했다”고 주장했다. 중국보에 따르면 현지 경찰은 지난 15일 중간수사 발표를 통해 흉기 3점을 압수했다고 밝혔다.,2025-10-19,https://www.seoul.co.kr/news/international/asia-oceania/2025/10/19/20251019500030,서울신문
젤렌스키 앞에서 러시아 국기 색깔 넥타이 맨 미국 ‘전쟁장관’,https://img.seoul.co.kr/img/upload/2025/10/19/SSC_20251019104901_N1.png.webp,"17일 도널드 트럼프 미국 대통령의 두번째 취임 이후 볼로디미르 젤렌스키 우크라이나 대통령이 백악관을 세번째 방문했다. 지난 2월 방문에서 “(전쟁에서 이길) 카드가 없다”며 트럼프 대통령으로부터 면박당했던 젤렌스키 대통령은 이번에는 검정 재킷을 차려입었으며 “스타일리쉬하다”는 칭찬을 들었다. 트럼프 대통령은 “많은 것을 이겨낸 강한 지도자”라고 젤렌스키 대통령에게 찬사를 보냈지만 우크라이나가 원한 토마호크 미사일은 약속하지 않았다. 이번 미·우 정상회담은 가자지구 평화협상을 끌어낸 트럼프 대통령이 자신의 평화 중재 성과를 더하기 위해 마련한 것으로 전날 블라디미르 푸틴 러시아 대통령과 두시간이 넘는 통화를 한 뒤였다. 이날 회담에서는 특히 젤렌스키 대통령의 맞은편에 맞은 피트 헤그세스 국방부 장관의 넥타이가 눈길을 끌었다. 러시아 관영 타스통신은 트럼프 대통령을 포함해 대부분 단색 넥타이를 맨 회담장에서 러시아 국기의 색깔과 같은 넥타이를 헤그세스 장관이 맸다고 지적했다. 헤그세스 장관이 착용한 넥타이는 러시아 국기와 같은 순서로 흰색, 파란색, 빨간색 줄무늬가 굵게 배열되어 있어 눈길을 끌었다고 전했다. 미국 성조기에도 같은 색상이 사용됐지만,",2025-10-19,https://www.seoul.co.kr/news/international/2025/10/19/20251019500025,서울신문
"갓 태어난 여아, 산 채로 묻혔다…부모는 어디에? 인도 잔혹 사건",https://img.seoul.co.kr/img/upload/2025/07/21/SSC_20250721070713_N1.jpg.webp,"인도 북부 우타르프라데시주 샤자한푸르 지구에서 생후 15일가량 된 것으로 보이는 여자 아기가 땅에 산 채로 묻힌 상태로 발견됐다. 16일(현지시간) CNN 보도에 따르면, 샤자한푸르에서 돼지 농장을 운영하는 남성은 마을 강가에서 버려진 인형처럼 보이는 무언가를 발견했다. 가까이 다가가 보니 작은 손이 진흙을 뚫고 나와 있었다. 그는 “가까이 가서 보니 아이의 손가락이 움직이고 있었다. 더 가까이 다가가니 심장이 뛰는 소리가 들렸다. 그제야 누군가 이 아이를 산 채로 묻었다는 걸 알았다”라고 설명했다. 수건에 싸인 채 땅 30㎝ 깊이에 묻힌 아기는 입과 코가 흙으로 막혀 간신히 숨만 쉬고 있었다. 신고를 받고 출동한 구급대는 아기를 샤자한푸르 의과대학 병원으로 급히 이송했다. 산소 부족으로 얼굴이 파랗게 질린 아기는 체온과 혈압이 위험할 정도로 낮았다. 사건을 수사 중인 경찰은 세 가지 가능성을 제시했다. 부모가 병약한 아기를 죽은 것으로 착각해 전통 방식대로 매장했거나, 아기의 ‘합지증’(손가락이나 발가락이 붙어 있는 질환) 때문에 일부러 유기했을 수 있다는 게 경찰의 추정이다. 인도 일부 지역에는 장애에 대한 편견이 남아 있다. 경찰은 남아 선호 사",2025-10-19,https://www.seoul.co.kr/news/international/2025/10/19/20251019500018,서울신문
"“은퇴 후 온천서 일하다가…” 日 레슬링 전설, 야생곰 습격에 사망",https://img.seoul.co.kr/img/upload/2025/10/19/SSC_20251019085057_N1.jpg.webp,"일본 프로레슬링계의 전설적인 심판 사사자키 가쓰미(60)가 근무 중 야생 곰의 습격을 받아 사망했다. 17일 일본 아사히신문과 배틀 뉴스 등에 따르면 사사자키는 전날 오전 10시 이와테현 기타카미시의 세미온천 노천탕을 청소하던 중 실종됐다. 여관 대표가 오전 11시 15분 경찰에 신고했고, 현장에는 청소 도구와 안경, 슬리퍼가 흩어져 있었으며 울타리 안팎에서 혈흔과 곰의 털이 발견됐다. 노천탕은 게토가와 강 위 절벽에 위치한 곳으로 1m 높이의 울타리로 둘러싸여 있었다. 경찰은 시 공무원 및 지역 사냥꾼 협회와 함께 약 30명의 인력을 투입해 수색을 시작했지만 악천후로 30분 만에 중단했다. 다음 날 오전 9시 수색이 재개됐고, 온천 북서쪽 약 50m 떨어진 숲에서 사사자키의 시신이 발견됐다. 현지 경찰은 시신 훼손 정도로 미루어 곰의 공격을 사망 원인으로 보고 있다. 현장 근처에서는 키 약 1.5m의 성체 수컷 반달가슴곰이 사살됐다. 이 지역에서는 10월 8일에도 또 다른 남성이 곰의 습격을 받아 사망한 사건이 발생했으며, 당국은 두 사건의 동일 개체 여부를 조사 중이다. 전문가는 “단기간에, 가까운 곳에서 인명 피해가 잇따르는 것은 이례적”이라며 “곰",2025-10-19,https://www.seoul.co.kr/news/international/2025/10/19/20251019500004,서울신문
“펑!” 기내 보조배터리서 불…인천행 여객기 상하이 비상착륙,https://img.seoul.co.kr/img/upload/2025/10/19/SSC_20251019063359_N1.jpg.webp,"중국 항저우에서 인천으로 향하던 중국국제항공(에어차이나) 여객기가 한국인 승객의 보조배터리에서 불이 나 상하이에 비상 착륙했다. 18일 중국국제항공과 중국 매체 극목신문 등에 따르면, 이날 오전 9시 47분(현지시간) 항저우 샤오산국제공항을 이륙한 CA139편(에어버스 A321)은 비행 중 기내 수하물 선반에서 화재가 발생해 오전 11시 5분 상하이 푸둥국제공항에 긴급 착륙했다. 한국 교민사회에 따르면 불은 한 한국인 승객이 휴대용 보조배터리를 기내에 반입한 뒤 발생한 것으로 알려졌다. 소셜미디어에 퍼진 영상에는 수하물 선반 위에서 불꽃이 치솟자 승객들이 놀라 비명을 지르고, 승무원들이 소화기로 진화하는 모습이 담겼다. 목격자는 “펑 하는 소리와 함께 불길이 뿜어져 나왔다”고 전했다. 중국국제항공은 “한 승객이 실은 수하물 내 리튬배터리가 자연 발화했지만 승무원들이 즉시 진화해 인명 피해는 없었다”며 “비행 안전을 위해 상하이에 착륙한 뒤 항공편을 재조정했다”고 밝혔다. 불이 난 배터리의 소지자인 한국인 승객은 현지 당국의 조사를 받고 있으며, 19일 귀국할 예정인 것으로 전해졌다. CA139편은 오후 3시 3분 상하이를 다시 출발해 오후 5시 34분",2025-10-19,https://www.seoul.co.kr/news/international/2025/10/19/20251019500002,서울신문
"다음달 트럼프·김정은 회동?…“美 행정부, 비공개로 검토 중”",https://img.seoul.co.kr/img/upload/2025/10/18/SSC_20251018202614_N1.jpg.webp,"도널드 트럼프 미국 대통령이 다음달 아시아 순방 중 김정은 북한 국무위원장과의 만남을 비공개로 검토하고 있다고 CNN이 18일(현지시간) 미 행정부 소식통을 인용해 보도했다. 실현 가능성은 불투명한 상황이다. 트럼프 1기 행정부 때인 지난 2019년 판문점 회동처럼 두 정상이 급작스럽게 만날 가능성이 열려있지만, 남북관계 냉각과 미북 간 소통 단절로 당시와는 상황이 크게 달라졌다. 관계자들은 아직 회동을 위한 실질적인 계획 작업에 착수하지 않은 상태다. 트럼프 대통령이 올해 초 김 국무위원장에게 보낸 서신은 북한 측이 받기를 거부하면서 답장조차 받지 못했다고 두 소식통이 CNN에 밝혔다. 미중 무역 갈등 속에서 트럼프 행정부는 이번 순방의 초점을 시진핑 중국 국가주석과의 회동에 맞추고 있다. 하지만 트럼프 대통령은 공개석상과 비공개 자리에서 모두 김 국무위원장과 만나고 싶다는 뜻을 여러 차례 내비쳤다. 미 행정부 관계자들도 순방 중 회동 가능성을 배제하지 않고 있다. 1기 행정부 당시 트럼프 대통령이 트위터로 제안한 뒤 48시간 만에 판문점에서 깜짝 회동이 성사된 사례가 있기 때문이다. 트럼프 대통령이 김 국무위원장과의 만남에 관심을 갖게 된 계기는",2025-10-18,https://www.seoul.co.kr/news/international/2025/10/18/20251018500043,서울신문
아내 불륜 현장 덮쳤다가 상간남과 ‘악수’?…충격적인 ‘이 나라’ 전통 의식,https://img.seoul.co.kr/img/upload/2025/10/18/SSC_20251018200606_N1.jpg.webp,"인도네시아에서 아내의 불륜을 발견한 한 남성이 법정 소송 대신 전통 화해 의식을 택해 화제가 되고 있다. 외도 상대는 아내를 넘겨받는 대가로 소와 현금 등을 보상했고, 두 남성은 마을 주민들이 지켜보는 가운데 악수로 갈등을 마무리했다. 17일(현지시간) CNN-뉴스18에 따르면, 인도네시아의 한 남성은 5년간 함께 살아온 아내가 지난 9월 다른 남성과 외도하는 장면을 목격했다. 하숙집에서 두 사람을 발견한 남편은 즉시 경찰에 신고했고, 아내와 상대 남성 모두 불륜 사실을 인정했다. 하지만 이 남성은 형사 고소를 진행하는 대신 색다른 선택을 했다. 마을 어른들을 찾아가 ‘모웨아 사라푸’라는 전통 의식을 요청한 것이다. ‘놓아주고 화해한다’는 뜻을 가진 이 의식은 톨라키족이 수백 년간 이어온 관습이다. 톨라키족은 인도네시아 토착민으로, 공동체의 평화와 명예를 무엇보다 중시하는 문화를 가지고 있다. 이들은 부부 갈등이나 가정 문제가 해결되지 않으면 마을 전체에 불행이 찾아온다고 믿는다. 그래서 처벌보다는 화해를 가장 큰 가치로 여긴다. 의식은 마을 어른들과 가족, 주민들이 모인 자리에서 진행됐다. 남편과 아내가 나란히 앉은 가운데, 외도 상대 남성은 상징적인",2025-10-18,https://www.seoul.co.kr/news/international/2025/10/18/20251018500042,서울신문
시신 곁에 두고도 아내 죽음 모른 시각장애인 남편… “태국에 남고 싶다”는데,https://img.seoul.co.kr/img/upload/2025/10/18/SSC_20251018185432_N1.png.webp,"아내는 교통사고 낸 후 배상금 때문에 고민 독일인 남편 비자 만료…퇴직연금으로 생활 태국에서 시각장애가 있는 독일인 남성이 현지인 아내가 집안에서 사망했다는 사실을 모른 채 아내를 기다리던 상태로 발견됐다고 지난 15일(현지시간) 채널7 등 현지 매체가 전했다. 태국 방콕 동쪽에 접한 차층사오주(州)의 2층짜리 주택 내부에 53세 태국인 여성이 숨져 있다는 신고를 받고 현지 경찰이 출동한 건 전날 오후 6시 30분쯤이었다. 집 안 계단 옆에 목을 매 숨져 있는 여성 시신을 경찰이 확인했을 때 고인의 남편인 양쪽 눈 모두를 실명한 69세 남성은 자택 발코니 테이블 앞에 앉아 있었다. 부부는 1년 넘게 현재 거주지에서 월세로 살고 있었는데, 방콕에서 택시 운전기사로 일하는 아내는 남편을 위해 2~3일치 식사를 준비해 놓고 떠나 방콕에 머물곤 했다. 아내가 집을 오래 비우게 되면 이웃에 사는 48세 여성이 집에 와 요리를 해주고 남편의 몸을 닦아주기도 하는 등 도움을 줬다. 아내가 숨져 있는 것을 처음 본 사람도 이웃이었다. 이날 남편은 집에 온 이웃에게 불을 켜달라고 했고, 이웃이 불을 켜던 중 시신을 발견했다. 남편은 경찰에 아내가 교통사고를 내고 충격",2025-10-18,https://www.seoul.co.kr/news/international/asia-oceania/2025/10/18/20251018500040,서울신문
캄보디아 ‘사기 배후’ 천즈 회장 행방 묘연…도피설 제기,https://img.seoul.co.kr/img/upload/2025/10/15/SSC_20251015161436_N1.jpg.webp,"캄보디아에서 대규모 사기 범죄의 배후로 지목된 프린스그룹 천즈 회장이 최근 자취를 감춘 것으로 전해졌다. 지난 17일(현지시간) 캄보디아 매체 캄보디아데일리에 따르면 미국과 영국 정부가 지난 14일 프린스그룹 등에 대한 제재를 발표한 가운데 천즈 회장 행방이 묘연해졌다고 했다. 앞서 미 법무부는 천즈 회장을 온라인 금융사기와 자금세탁 등의 혐의로 기소했다고 밝혔다. 법무부는 천즈 회장이 보유해온 약 150억 달러(약 21조원) 상당의 비트코인 12만 7271개를 몰수하기 위한 소송도 제기했다. 중국도 프린스그룹이 사기 범죄로 불법 수입을 올린 것으로 보고 2020년 특별수사팀을 꾸렸고, 이후 중국 각지의 지방법원이 프린스 그룹 하위 직원과 연루자 다수를 도박·자금세탁죄로 유죄 선고했다. 캄보디아데일리는 “천즈의 행방은 캄보디아에서 감쪽같이 사라졌다”며 “대중은 그가 캄보디아 국적을 박탈당해 중국으로 송환됐을 가능성도 의심하고 있다”고 전했다. 캄보디아 범죄단지 배후로 지목되는 프린스그룹에 대한 압박과 제재가 가해지자 프린스은행에서는 ‘뱅크런’(예금 대량 인출) 조짐도 나타나고 있다. 미국과 영국 정부의 강력한 제재 이후 캄보디아 수도 프놈펜에 주요 지",2025-10-18,https://www.seoul.co.kr/news/international/asia-oceania/2025/10/18/20251018500037,서울신문
