title,thumbnail,short_content,write_time,link,company
합참 “북한군 1명 오늘 군사분계선 넘어 귀순…조사 예정”,https://img.seoul.co.kr/img/upload/2024/12/30/SSC_20241230055554_N1.jpg.webp,"합동참모본부가 중부전선 군사분계선(MDL)을 넘어와 귀순 의사를 밝힌 북한군 1명의 신병을 확보했다고 밝혔다. 19일 합참은 “군은 MDL 일대에서 인원을 식별해 추적, 감시했고 정상적인 유도 작전을 실시해 신병을 확보했으며 세부 남하 과정에 대해서는 관계기관에서 조사 예정”이라고 설명했다. 현재까지 북한군의 특이 동향은 없는 것으로 알려졌다. 이재명 정부 출범 후 귀순 사례는 이번이 세 번째이지만 군인 귀순은 이번이 처음이다.",2025-10-19,https://www.seoul.co.kr/news/politics/north/2025/10/19/20251019500116,서울신문
고소·고발 ‘난장판 국감’… 증인들 불러 놓고 정쟁 하세월,,"여야가 이재명 정부 첫 국정감사 초반부터 정책 질의 대신 욕설과 고성, 고소·고발을 남발하면서 ‘난장판 국감’이 됐다는 비판이 이어지고 있다. 특히 이 과정에서 진통 끝에 합의해 국감장에 나온 일반증인·참고인들은 무한정 대기하는 모습이 반복되면서 ‘구태’라는 지적이 나온다. 지난 14일 과학기술정보방송통신위원회 국감장에선 김우영 더불어민주당 의원과 박정훈 국민의힘 의원이 사적으로 주고받은 문자 내용을 두고 충돌하면서 전체 국감이 마비되는 상황이 발생했다. 당시 ‘사이버 레커’ 공갈·협박 피해를 증언하기 위해 오전 10시부터 국감장에 자리한 유튜버 ‘쯔양’은 두 의원의 갈등 상황 탓에 약 7시간 대기 끝에 겨우 발언 기회를 얻었다. 김장겸 국민의힘 의원은 쯔양 질의 시간에도 두 의원의 갈등 관련 내용을 묻기도 했다. 당초 과방위는 구글과 애플의 과도한 인앱결제 수수료를 둘러싼 갑질 논란과 관련해 질의할 계획이었으나 질의 시간이 짧아 심도 깊은 질의가 이뤄지지 못했다. 마크 리 애플코리아 사장은 14일 증인으로 출석해 수수료 논란에 “30%에 달하는 수수료를 지불하는 것은 일부 대기업”이라고 짧게 답하는 데 그쳤다. 과방위는 16일 국감도 양측 충돌에 정회와",2025-10-20,https://www.seoul.co.kr/news/politics/congress/2025/10/20/20251020010003,서울신문
“재생에너지 생산·공급·소비 일체화… 지방소멸 해법 될 수 있을 것”,https://img.seoul.co.kr/img/upload/2025/10/19/SSC_20251019174405_N1.jpg.webp,"‘RE100 산단 특별법’ 대표 발의 李대통령 핵심 국정과제 이행 재생에너지자립도시 조성·지원 인력 확충·정주 여건 개선 추진 “‘RE100’(재생에너지 100% 사용)은 가장 좋은 선택지가 아니라 우리나라 산업 경쟁력을 유지하기 위한 유일한 길입니다. 안 가면 죽는 겁니다.” 국회 산업통상자원중소벤처기업위원회 여당 간사인 김원이 더불어민주당 의원은 19일 국회 의원회관에서 진행된 서울신문 인터뷰에서 “지금은 미래 첨단산업으로 전환하는 산업 대전환의 시기이자 기후위기로 인한 에너지 대전환의 시기”라면서 이렇게 말했다. 김 의원은 최근 이재명 정부의 핵심 국정과제인 ‘RE100 산업단지 조성’을 뒷받침하는 재생에너지자립도시 조성 및 지원에 관한 특별법을 발의했다. 김 의원은 “재생에너지 생산·공급·소비를 일체화시키면 지방 소멸 위기의 해법이 될 수 있을 것”이라고 말했다. 다음은 일문일답. -이 법안의 핵심은. “재생에너지 부족, 송전망 건설에 따른 사회적 갈등, 에너지 생산지 소외 현상 등 얽힌 실타래를 동시에 풀어보자는 게 이 법안의 취지다. 법안은 ‘재생에너지 생산→분산형 전력공급망 구축→산업 유치→주택·학교·병원 등 정주여건 조성’ 등 크게 네 단",2025-10-20,https://www.seoul.co.kr/news/politics/2025/10/20/20251020010002,서울신문
장동혁 “尹면회 약속지켰다”… 與 “내란 잔당” 野 일부도“부적절”,https://img.seoul.co.kr/img/upload/2025/10/19/SSC_20251019180502_N1.jpg.webp,"장동혁 국민의힘 대표가 서울구치소에 수감 중인 윤석열 전 대통령을 면회했다. 장 대표는 당대표 후보 시절 약속을 지켰다는 입장이지만 국민의힘 내부에서도 우려의 목소리가 나왔다. 더불어민주당은 19일 “야스쿠니 신사 참배”라고 맹비난했다. 장 대표는 전날 페이스북에 “어제(17일) 오전 대통령님을 면회하고 왔다”고 밝혔다. 이어 “힘든 상황에서도 성경 말씀과 기도로 단단히 무장하고 계셨다”며 “우리도 하나로 뭉쳐 싸우자, 좌파 정권으로 무너지는 자유대한민국을 살리기 위해”라고 덧붙였다. 내란 우두머리 혐의 등을 받는 윤 전 대통령은 지난 7월 10일 서울구치소에 재구속됐다. 장 대표는 김민수 최고위원과 10분가량 윤 대통령을 만났는데 가림막을 사이에 둔 일반면회였다. 서울구치소 측은 장 대표와 김 최고위원 등의 특별면회(장소변경접견) 신청을 불허해왔다. 김 최고위원은 자신의 소셜미디어(SNS)에 “눈물로 절반의 시간을 보냈다”고 전했다. 장 대표가 일반면회로 윤 전 대통령을 만난 것을 두고는 ‘윤어게인’을 주도하는 윤 전 대통령 측 변호인단은 일제히 공개 불만을 터뜨렸다. 김계리 변호사는 페이스북에 “조용히 잡범들과 섞여서 ‘일반 접견’으로 보는 거로 그저",2025-10-20,https://www.seoul.co.kr/news/politics/2025/10/20/20251020010001,서울신문
"‘귀국’ 김용범 “한미 관세 협상, 대부분 쟁점서 실질적 진전”",https://img.seoul.co.kr/img/upload/2025/10/19/SSC_20251019175206_N1.jpg.webp,미국과의 관세 협상을 진행한 뒤 귀국한 김용범 대통령실 정책실장이 “이번 방미 협의에선 대부분의 쟁점에서 실질적인 진전이 있었다”고 밝혔다. 김 실장은 19일 인천공항에서 미국과의 관세 협상을 진행한 뒤 귀국하며 “한미 양국이 매우 진지하고 건설적 분위기 속에서 협상에 임했다”면서 이같이 말했다. 김 실장은 “2시간 훌쩍 넘는 공식 협의 외에 이어진 만찬 자리에서도 밀도 있는 대화를 주고받았다”면서도 “다만 여전히 조율이 필요한 부분이 남아있다”고 전했다. 이어 “이번 협의 성과 토대로 협상을 원만하게 마무리할 수 있도록 끝까지 최선을 다하겠다”며 “국익에 도움이 되는 결과를 만들겠다”고 덧붙였다.,2025-10-19,https://www.seoul.co.kr/news/politics/diplomacy/2025/10/19/20251019500111,서울신문
재생에너지서 답을 찾다…與김원이 “획기적 인센티브로 기업 유치…지방소멸 해법”[인터뷰],https://img.seoul.co.kr/img/upload/2025/10/19/SSC_20251019174421_N1.jpg.webp,"“‘RE100’(재생에너지 100% 사용)은 가장 좋은 선택지가 아니라 우리나라 산업 경쟁력을 유지하기 위한 유일한 길입니다. 안 가면 죽는 겁니다.” 국회 산업통상자원중소벤처기업위원회 여당 간사인 김원이(재선·전남 목포) 더불어민주당 의원은 19일 국회 의원회관에서 진행된 서울신문 인터뷰에서 “ 지금은 미래 첨단산업으로 전환하는 산업 대전환의 시기이자 기후위기로 인한 에너지 대전환의 시기 ”라면서 이렇게 말했다. 김 의원은 최근 자신의 22대 총선 공약이자 이재명 정부의 핵심 국정과제인 ‘RE100 산업단지 조성’을 뒷받침하는 ‘재생에너지자립도시 조성 및 지원에 관한 특별법안’(RE100 산단 특별법)을 발의했다. 김 의원은 “ 재생에너지 생산·공급·소비를 일체화시키면 지방 소멸 위기의 해법이 될 수 있을 것 ”이라고 말했다. 다음은 일문일답. -이 법안의 핵심은. “재생에너지 부족, 송전망 건설에 따른 사회적 갈등, 에너지 생산지 소외 현상 등 얽힌 실타래를 동시에 풀어보자는 게 이 법안의 취지다. 법안은 ‘재생에너지 생산→분산형 전력공급망 구축→산업 유치→주택·학교·병원 등 정주여건 조성’ 등 크게 네 단계로 구성 돼 있다. 산업통상부,",2025-10-19,https://www.seoul.co.kr/news/politics/2025/10/19/20251019500109,서울신문
[포토] KF-21의 비행,https://img.seoul.co.kr/img/upload/2025/10/19/SSI_20251019162523_N1.jpg.webp,"19일 경기도 성남시 서울공항에서 열린 ‘서울 국제항공우주 및 방위산업 전시회(ADEX)’에서 KF-21이 시범비행을 하고 있다. ‘서울 국제 항공우주 및 방위산업 전시회(서울 ADEX 2025)’가 17일 서울공항에서 블랙이글스의 축하비행과 함께 개막했다고 국방부가 밝혔다. 올해로 15회를 맞는 이번 행사는 오는 24일까지 8일간 열린다. 1996년 ‘서울에어쇼’로 시작해 격년제로 개최돼 온 서울 ADEX는 파리, 런던 에어쇼와 함께 세계 3대 항공우주·방위산업 종합전시회로 평가받는다. 이날 오전 열린 개막식은 성남시립국악단과 공군 군악의장대대의 공연으로 시작돼 F-35A, F-15K, KF-16 등 주요 전력기의 축하비행과 국산 T-50 고등훈련기, KF-21 전투기의 시범비행, 공군 제53특수비행전대 블랙이글스의 특수비행이 이뤄졌다. 서울 ADEX 2025는 19일까지 서울공항에서 일반 관람객 중심의 에어쇼를 진행한 뒤, 20일부터 24일까지는 일산 킨텍스에서 방산종합전시회를 연다. 20일 열리는 공식 개막식에는 각국 국방 관계자와 방산기업 관계자들이 참석할 예정이다. 행사 기간 중 서울공항에는 청소년과 가족 단위 방문객을 위한 체험행사도 다",2025-10-19,https://www.seoul.co.kr/news/politics/diplomacy/2025/10/19/20251019800001,서울신문
"與, 사법개혁특위안에 ‘재판소원’ 제외…법안 발의 후 공론화",https://img.seoul.co.kr/img/upload/2025/10/19/SSC_20251019154823_N1.jpg.webp,더불어민주당이 대법관 증원 등을 골자로 한 사법개혁안을 20일 발표할 예정인 가운데 사실상 ‘4심제’라며 논란이 된 재판소원은 포함하지 않기로 했다. 당론으로도 채택하지 않으며 향후 개별 의원들이 발의하면 공론화 과정을 거치겠다는 방침이다. 김병기 민주당 원내대표는 19일 국회에서 기자간담회를 열고 “재판소원에 대해서는 굉장히 찬성과 반대 의견이 있다”며 “개혁안에는 안 들어가 있다”고 밝혔다. 그러면서 “당론으로 발의하지 않고 사법개혁특별위원회(사개특위)의 안으로도 발의하지 않는다”고 말했다. 재판소원은 대법원 확정 판결을 헌법재판소에서 추가로 다툴 수 있도록 길을 열어주는 제도로 사실상 ‘4심제’ 도입이라는 논란을 불러일으켰다. 당초 민주당은 사법개혁안에 재판소원을 담으려고 했으나 당 안팎 반대 여론에 부딪히면서 해당 내용은 제외하기로 한 것으로 보인다. 민주당의 한 의원은 “당내 법률가 출신 의원들을 중심으로 우려의 목소리가 제기되고 있는 것은 사실”이라고 밝혔다. 김 원내대표는 “검찰개혁과는 조금 다른 방식이 될 것”이라며 급진적인 개혁에 나서지 않을 것이라는 뜻을 분명히 했다. 그는 “발의하면 발의한 것을 논의의 장으로 올려 충분하게 검토할 것”,2025-10-19,https://www.seoul.co.kr/news/politics/2025/10/19/20251019500076,서울신문
"與 전현희, 캄보디아 관련 “군사적 조치 배제 안 돼…ODA 중단 검토”",https://img.seoul.co.kr/img/upload/2025/10/19/SSC_20251019143643_N1.jpg.webp,"캄보디아에서 발생한 한국인 납치·살인 사태와 관련해 군사적 조치도 배제해선 안 된다는 주장이 여권에서 나왔다. 전현희 더불어민주당 최고위원은 19일 국회에서 기자간담회를 갖고 “대한민국은 외교·군사·정보 등 국가가 보유한 모든 역량을 총동원해 국민의 생명을 지키고 구출해내야 한다”며 “필요하다면 군사적 조치 또한 배제해서는 안 된다”고 밝혔다. 이어 “이것은 결코 전쟁하자는 게 아니라, 우리 군대는 바로 국민의 생명과 안전을 위해 존재한다는 헌법적 당위성을 말하는 것”이라고 말했다. 그는 “특히 윤석열 정권 3년간 공적개발원조(ODA) 규모는 급증해 수조 원대에 이르렀다”면서 “이재명 정부의 외교적 노력에도 불구하고 캄보디아 정부의 비협조가 이어져 우리 국민의 희생이 계속된다면, 정부는 캄보디아에 대한 ODA 원조 중단도 적극 검토해야 한다”고 언급했다. 다만 김병기 민주당 원내대표는 기자간담회에서 “군사적 조치에 대한 것은 굉장히 신중해야 한다”면서 “군은 근본적으로 무법성을 인정받지 않는다. 발언을 굉장히 신중하게 해야 한다”고 말했다. 민주당 재외국민 안전대책단장인 김병주 최고위원은 이날 국회에서 캄보디아 현장 방문 관련 브리핑을 열고 군사 조",2025-10-19,https://www.seoul.co.kr/news/politics/2025/10/19/20251019500065,서울신문
‘방산협력 특사’ 강훈식 “국방부만으로 안 돼…국부 창출에 기여할 것”,https://img.seoul.co.kr/img/upload/2025/10/19/SSC_20251019132412_N1.jpg.webp,"강훈식 대통령 비서실장은 19일 “국부 창출에 조금이라도 기여한다는 마음으로 이번 출장을 마치고 돌아오겠다고 국민 여러분께 보고드린다”고 말했다. 강 실장은 이날 ‘전략 경제 협력 대통령 특사’라는 자격으로 인천공항에서 유럽 국가로 출국하기 전 기자들과 만나 “우리나라는 방산 4대 강국이라는 목표를 가지고 실천할 수 있는 모든 노력을 다할 것”이라며 이처럼 각오를 밝혔다. 강 실장은 내년 상반기까지 3차례에 걸쳐 전략 경제 협력을 위한 특사 임무를 수행할 계획이다. 강 실장은 “현재 추진되는 사업 모두를 수주하긴 어렵겠지만 최선을 다해서 그 수주량을 늘리는 것을 이번 방문의 목표로 생각하고 있다”며 “초대형 방위산업의 경우에 단순히 국방부의 노력으로만 되지 않는다는 게 저희 내부적 결론이었다”고 말했다. 이어 “금융지원, 산업 협력, 방산 스타트업 협력에 이르기까지 많은 분야의 협력이 이뤄져야 한다”고 덧붙였다. 그는 “방위산업은 파급력이 막강하고 어마어마하다”며 “군함 한척을 대기업이 수주할 경우 300개 이상의 1차 협력업체가 고용 창출 효과를 가져올 수 있다”고 설명했다. 이어 “대부분의 그런 업체들이 비수도권에 위치한다는 점에서 우리 정부는 매우",2025-10-19,https://www.seoul.co.kr/news/politics/2025/10/19/20251019500056,서울신문
ICBM이 美 위협? 한국이 더 위험할 수도 [FM리포트],https://img.seoul.co.kr/img/upload/2025/10/19/SSC_20251019025148_N1.jpg.webp,화성-20형 공개로 무력 과시 나선 北 북한이 지난 10일 평양 김일성광장에서 조선노동당 창건 80주년 기념 열병식을 통해 보유한 첨단 전력을 공개했다. 대외적으로는 미국을 겨냥한 대륙간탄도미사일(ICBM) 화성-20형이 주목받았지만 당장 남한을 노린 무기 체계들에 더 주목하고 대응책을 세밀하게 마련해야 한다는 지적이 나온다. 이번 열병식에서는 ICBM 화성-20형이 큰 주목을 받았다. 화성-20형은 미국 본토를 직접 타격할 수 있는 다탄두 ICBM 확보를 목적으로 개발 중인 미사일이다. 시험발사가 이뤄지지 않아 아직 개발이 완료되지 않은 것으로 보이지만 북중러 연대를 과시하고 대미 압박을 하는 차원에서 미리 공개한 것으로 보인다. 화성-20형에 대해 조선중앙TV는 “사정권에는 한계가 없음을 선언하는 초강력전략공격무기”라고 자랑했다. 공개된 사진과 영상을 보면 화성-20형은 지난해 10월 31일 북한이 처음 발사한 ICBM 화성-19형과 마찬가지로 이동식발사대 바퀴가 11축이지만 발사대와 발사관 형상에 다소 차이가 있다. 군사전문기자 출신인 유용원 국민의힘 의원은 “화성-20형 ICBM 이동식발사대는 화성-19형과 달리 좌우 발사관 기립장치가 아닌,2025-10-19,https://www.seoul.co.kr/news/politics/congress/2025/10/19/20251019500001,서울신문
[포토] 비행 체험하는 국민조종사,https://img.seoul.co.kr/img/upload/2025/10/18/SSI_20251018174936_N1.jpg.webp,제10기 국민조종사가 18일 서울공항에서 FA-50 전투기에 탑승해 공군 전투조종사의 임무를 체험해보는 비행체험을 하고 있다.,2025-10-18,https://www.seoul.co.kr/news/politics/diplomacy/2025/10/18/20251018800005,서울신문
장동혁 “尹대통령님 면회…성경 말씀과 기도로 단단히 무장하고 계셔”,https://img.seoul.co.kr/img/upload/2025/10/18/SSC_20251018164157_N1.jpg.webp,"장동혁 국민의힘 대표가 윤석열 전 대통령 면회를 다녀왔다고 18일 밝혔다. 장 대표는 이날 자신의 페이스북에 “어제 오전 윤석열 대통령님을 면회하고 왔다”며 “힘든 상황에서도 성경 말씀과 기도로 단단히 무장하고 계셨다”고 적었다. 이어 “우리도 하나로 뭉쳐 싸우자”며 “좌파 정권으로 무너지는 자유대한민국을 살리기 위해, 국민의 평안한 삶을 지키기 위해”라고 덧붙였다. 이번 면회는 일반 면회 형식으로, 김민수 최고위원이 동석한 가운데 전날 오전 11시 10분부터 10분가량 진행된 것으로 전해졌다. 장 대표의 윤 전 대통령 면회는 지난 8월 26일 국민의힘 대표에 당선된 지 50여일 만이다. 장 대표는 대표 선출을 위한 전당대회 과정에서 “당대표가 된다면 적절한 시점에 윤 전 대통령 면회를 가겠다”고 밝힌 바 있다. 앞서 장 대표는 지난달 12일 윤 전 대통령에 대한 특별면회를 신청했으나, 구치소측이 특검 조사를 이유로 불허하면서 불발됐다.",2025-10-18,https://www.seoul.co.kr/news/politics/2025/10/18/20251018500034,서울신문
"박지원 “김현지, 국감 ‘안 나간다고 안 했다’고 말해”",https://img.seoul.co.kr/img/upload/2025/10/14/SSC_20251014183051_N1.jpg.webp,"박지원 더불어민주당 의원은 김현지 대통령실 제1부속실장의 국정감사 출석 논란과 관련, “김 실장이 국감에 안 나온다고 명확히 말한 적은 없다”고 했다. 박 의원은 지난 16일 KBC ‘여의도초대석’에 출연해 “제가 김현지 부속실장을 잘 안다. 근거 없는 ‘안방마님’, ‘빨갱이’ 같은 모략으로 공격하는 것은 옳지 않다”고 말했다. 박 의원은 김 실장과 통화 내용을 언급하면서 “‘너 똑똑한데 국감 받아라’라고 권유했더니 김 실장이 ‘안 나간다고 안 했다’고 답했다”고 전했다. 이어 “이번 국정감사를 하면서 국민의힘이 김 실장을 조희대 대법원장급으로 놓고 있는데, 체급이 안 된다. 유도나 복싱이나 레슬링도 체급끼리, 맞는 것끼리 하지 않나”라며 “김 실장을 대법원장급으로 올려줘서 한편으론 참 어떻게 저렇게 출세시켜줄까 하는 생각을 갖게 된다”고 했다. 그러면서 “당시 김 실장은 총무비서관으로 국감 출석이 필요했지만, 지금은 부속실장이다. 박근혜 정부 문고리 권력처럼 비리가 있는가, 내란을 일으켰는가”라며 “운영위원회에서 여야 협상 결과가 나오면 출석 여부가 결정될 수 있다. 그때까지는 상황을 지켜보는 것이 바람직하다” 말했다.",2025-10-18,https://www.seoul.co.kr/news/politics/2025/10/18/20251018500033,서울신문
‘캄보디아 구금’ 한국인 송환 두고 여야 공방…“한국 청년 3명 추가 구출”,https://img.seoul.co.kr/img/upload/2025/10/18/SSC_20251018154244_N1.jpg.webp,"여야는 18일 캄보디아에서 구금됐던 한국인 송환을 두고 공방을 벌였다. 국민의힘이 피의자부터 데려오는 ‘청개구리식 대응’이라고 비판하자 더불어민주당은 “청개구리 운운 전에 윤석열 정권의 ‘묻지마 퍼주기’ 원조부터 사과하라”고 맞받았다. 김현정 민주당 원내대변인은 서면브리핑을 통해 “많은 국민들은 김건희가 심장질환을 앓고 있는 소년을 안고 찍은 사진을 지금도 생생히 기억한다”며 “세계적인 배우이자 인도주의자인 오드리 헵번과 비슷하게 연출해 전세계적인 비웃음거리가 돼 국민을 부끄럽게 만들었기 때문”이라고 했다. 김 원내대변인은 “그때가 바로 2022년이고 그 곳이 바로 캄보디아였다”며 “우리 국민들의 납치, 감금 신고가 잇따를 때 김건희는 개인 홍보 사진이나 찍고, 윤석열 정부는 김건희에 목걸이와 명품백을 선물한 통일교 청탁을 들어주기 위해 묻지마 퍼주기에만 급급했던 것”이라고 했다. 이어 “청개구리’ 운운 전에 김건희-헵번 촬영과 묻지마 퍼주기 원조부터 사과하라”고 했다. 조용술 국민의힘 대변인은 이날 논평을 통해 “국민 상식에 맞는 대응이라면 피해자부터 구출하고 국민의 생명을 지키는 것이 일반적이다. 그럼에도 이재명 정권은 성과 홍보를 앞세워 피의자부",2025-10-18,https://www.seoul.co.kr/news/politics/2025/10/18/20251018500027,서울신문
조국 “국민의힘 퇴출이 역사의 정의이자 치유”,https://img.seoul.co.kr/img/upload/2025/10/18/SSC_20251018142405_N1.jpg.webp,"조국 조국혁신당 비상대책위원장은 18일 “국민의힘을 퇴출하는 것이 역사의 정의이고 치유”라고 밝혔다. 조 위원장은 이날 페이스북에 “내란을 옹호하는 극우세력의 망상과 망동의 끝이 보이지 않는다”며 “국민의힘은 극우의 눈으로 대한민국의 역사를 왜곡한 ‘건국전쟁2’를 관람했다”고 했다. 그는 이날 제주도당 당원간담회 참석을 위해 제주를 방문했다. 조 위원장은 “간담회 전에 ‘제주 4.3 평화공원’ 위령탑을 참배한다”며 “4·3의 영령들과 희생자들의 넋을 기리고, 역사의 정의와 치유의 길을 되새기려고 한다”고 했다. 그는 “우리는 현기영 선생님의 작품 속에 등장하는 수많은 ‘순이 삼촌’을 기억해야 한다”며 “그러나 여전히 제주 4·3에 대한 거짓과 조작, 왜곡과 폄훼가 남아 있다. 제주 4·3의 완전한 해결은 아직이다”라고 주장했다. 이어 “‘건국전쟁2’는 4·3 당시 민간인 집단 학살을 주도한 대령 박진경을 미화한다”며 “장동혁 대표와 국민의힘이 ‘건국전쟁2’를 극찬하는 건, 마치 아우슈비츠 생존자 앞에서 나치 선전물을 극찬하는 것과 다를 바 없다”고 했다. 그러면서 “학살의 희생자들에게 이념적 누명을 씌운다. 표현의 자유가 용인할 수 있는 선을 넘었다”",2025-10-18,https://www.seoul.co.kr/news/politics/congress/2025/10/18/20251018500022,서울신문
"“그렇게 우는 건 처음 봤다”…한동훈, 故 이상민 빈소서 오열",https://img.seoul.co.kr/img/upload/2025/08/31/SSC_20250831072046_N1.jpg.webp,한동훈 전 국민의힘 대표가 최근 별세한 고 이상민 전 의원의 빈소에서 오열했다는 사연이 전해졌다. 한 전 대표 측근인 국민의힘 윤희석 전 대변인은 지난 16일 CBS라디오 ‘박재홍의 한판승부’에서 이 전 의원 빈소에서 한 전 대표와 만났다고 했다. 윤 전 대변인은 “(이 전 의원이) 갑자기 돌아가시게 돼서 너무 황망한 마음에 갔다”며 “한 전 대표도 마찬가지다. 저희 당에 (이 전 의원을) 영입한 분이 한 전 대표이기 때문에 마음이 각별한 상태에서 갔다”고 했다. 그는 “조문하다가 한 전 대표가 그렇게 우는 건 처음 봤다”며 “우는 것 자체를 처음 봤다”고 말했다. 5선 의원 출신인 이 전 의원은 지난 15일 대전 자택에서 심정지 상태로 병원에 이송됐으나 세상을 떠났다. 그는 더불어민주당을 탈당해 2024년 총선을 앞두고 국민의힘에 입당했다. 한 전 대표는 이 전 의원의 사망 소식이 알려진 후 페이스북에 “황망하고 안타깝다”며 “얼마 전에도 통화했는데 지치지 말고 함께 꼭 좋은 정치같이 하자고 말씀하시던 특유의 굵고 선한 목소리가 생생하다”고 했다. 이어 “빈소에 다녀오는 길”이라며 “우리 당에 오셔서 고생만 하시다가 떠나시는 것 같아 제가 죄스럽고,2025-10-18,https://www.seoul.co.kr/news/politics/2025/10/18/20251018500010,서울신문
