title,thumbnail,short_content,write_time,link,company
제주항 57년만에 ‘첫 국제 정기화물선’… 제주 해상물류 새 시대 개막,https://img.seoul.co.kr/img/upload/2025/10/19/SSC_20251019092705_N1.jpg.webp,"제주항에 57년 만에 첫 국제 정기 컨테이너선이 입항했다. 물류비는 62% 절감되고 운송 시간은 최소 2일로 단축돼 제주 기업들의 수출입 경쟁력이 크게 높아질 전망이다. 제주도는 지난 18일 오후 2시 제주항 국제여객터미널에서 ‘제주~칭다오 정기 컨테이너선 첫 입항식’을 열었다고 19일 밝혔다. 첫 입항 선박 ‘SMC 르자오’호에는 페트칩, 기계장비 등 약 40컨테이너(TEU)의 수입 화물이 실렸으며, 제주에서는 수산물 가공품, 삼다수 등 10TEU 규모의 제품이 중국으로 수출된다. 이번 항로 개설은 1968년 제주항이 무역항으로 지정된 이후 57년 만의 첫 정기 국제항로 개설로, 단순한 노선 신설이 아니다. 제주가 글로벌 해상 물류망에 정식으로 연결된 역사적 이정표를 찍는 순간이다. 해양수산부가 지난 7월 말 항로 개설을 승인하고, 8월 운영선사를 확정한 뒤 10월 초 운항계획 신고 절차를 마치면서 본격 운항에 들어갔다. 오는 22일부터는 매주 수요일 오전 정기적으로 제주항에 입항할 예정이다. 오영훈 지사는 이날 입항식에서 “제주는 천 년 전 탐라시대부터 바다를 통해 세상과 소통해온 해상왕국의 정신을 품은 섬”이라며 “제주~칭다오 항로 개설은 탐라의",2025-10-19,https://www.seoul.co.kr/news/economy/2025/10/19/20251019500013,서울신문
[서울데이터랩]펌프펀 모포 모네로 24시간 상승률 상위,https://img.seoul.co.kr/img/upload/2025/10/19/SSC_20251019092201_N1.jpg.webp,"글로벌 가상자산 시황 중계 사이트 코인마켓캡(CoinMarketCap)에 따르면, 펌프펀(PUMP)이 24시간 동안 9.92% 상승하며 가장 높은 등락률을 기록했다. 펌프펀은 현재 5.57원에 거래되고 있으며, 시가총액은 약 1조 9723억 원이다. 해당 코인은 거래량이 3614억 3195만 원으로, 활발한 거래를 보이고 있다. 모포(MORPHO)도 24시간 동안 7.64% 상승하며 주목받고 있다. 현재 가격은 2675원, 시가총액은 9442억 2691만 원이다. 모포의 거래량은 1822억 4820만 원으로 기록되었다. 모포는 새로운 금융 및 거래 솔루션을 제공하는 프로젝트로, 다양한 블록체인 플랫폼과의 인터페이스를 강화하고 있다. 모네로(XMR)는 6.73% 상승하며 44만 1813원에 거래 중이다. 모네로는 개인 정보 보호를 중시하는 가상자산으로, 시가총액은 8조 1500억 원에 이른다. 거래량은 2405억 4791만 원으로, 꾸준한 인기를 보이고 있다. 플레어(FLR)는 6.63% 상승하며 25원에 거래되고 있다. 시가총액은 1조 9204억 원이며, 거래량은 173억 4288만 원이다. 플레어는 스마트 계약 솔루션을 제공하는 블록체인으로, 다양한 디",2025-10-19,https://www.seoul.co.kr/news/economy/2025/10/19/20251019500012,서울신문
"[서울데이터랩]엠와이엑스 파이낸스 플라즈마 더블제로, 1시간 상승률 상위",https://img.seoul.co.kr/img/upload/2025/10/19/SSC_20251019092204_N1.jpg.webp,"글로벌 가상자산 시황 중계 사이트 코인마켓캡(CoinMarketCap)에 따르면, 2023년 11월 1일 17:00 기준, 시가총액 300위권 내 가상자산 중 1시간 등락률 상위 종목으로 엠와이엑스 파이낸스, 플라즈마, 더블제로가 눈에 띈다. 엠와이엑스 파이낸스는 1시간 등락률 2.10%로 가장 높은 상승세를 기록했다. 현재가는 4187원이며, 24시간 동안 1.83%의 상승을 보였다. 거래량은 609억 2218만 원으로 중간 정도의 거래량을 기록하고 있으며, 시가총액은 8630억 1832만 원으로 93위에 랭크되어 있다. 엠와이엑스 파이낸스의 최근 상승세는 투자자들 사이에서 주목받고 있다. 플라즈마는 1시간 등락률 1.40%로 두 번째로 높은 상승률을 기록했다. 현재가는 576원이며, 24시간 동안 3.19%의 상승을 보였다. 플라즈마의 24시간 거래량은 5200억 2206만 원으로 매우 활발한 거래량을 나타내고 있다. 시가총액은 1조 377억 원으로 84위에 위치해 있다. 플라즈마의 이러한 거래량과 상승세는 투자자들의 관심을 끌고 있다. 더블제로는 1시간 등락률 0.78%로 세 번째로 높은 상승률을 기록했다. 현재가는 323원이며, 24시간 동안 -1",2025-10-19,https://www.seoul.co.kr/news/economy/2025/10/19/20251019500011,서울신문
"[서울데이터랩]모네로 플레어 펌프펀, 1시간 상승률 상위",https://img.seoul.co.kr/img/upload/2025/10/19/SSC_20251019092202_N1.png.webp,"글로벌 가상자산 시황 중계 사이트 코인마켓캡(CoinMarketCap)에 따르면, 2023년 10월 18일 기준 최근 1시간 동안 시가총액 300위권 내 암호화폐 중 상승률이 높은 종목은 모네로, 플레어, 펌프펀이다. 이들은 각각 최근 1시간 동안 2.60%, 2.53%, 1.82% 상승했다. 모네로는 현재 44만 8204원에 거래되고 있으며, 24시간 동안 7.79% 상승하는 등 강력한 상승세를 이어가고 있다. 24시간 거래량은 2400억 6613만 원에 달하며, 시가총액은 8조 2679억 원으로 시총 순위 21위를 기록하고 있다. 프라이버시 중심의 암호화폐인 모네로는 최근 보안성과 익명성을 강조하며 투자자들의 관심을 받고 있다. 플레어는 현재 25원에 거래 중이며, 24시간 동안 6.85% 상승했다. 24시간 거래량은 171억 5155만 원이며, 시가총액은 1조 9328억 원으로 시총 순위 57위에 위치해 있다. 스마트 계약과 상호운용성을 강화한 플랫폼인 플레어는 최근 블록체인 간 연결성 개선 작업을 추진하면서 주목받고 있다. 펌프펀은 현재 5.22원에 거래되고 있으며, 24시간 동안 1.93% 상승했다. 24시간 거래량은 2538억 3597만 원이며",2025-10-19,https://www.seoul.co.kr/news/economy/2025/10/19/20251019500010,서울신문
"[서울데이터랩]지캐시·에스피엑스6900·페치, 24시간 하락률 상위",https://img.seoul.co.kr/img/upload/2025/10/19/SSC_20251019092200_N1.png.webp,"글로벌 가상자산 시황 중계 사이트 코인마켓캡(CoinMarketCap)에 따르면, 최근 24시간 동안 지캐시(ZEC)가 5.15% 하락하며 가장 큰 하락폭을 기록했다. 지캐시는 주로 익명성을 강조한 프라이버시 코인으로, 현재 가격은 약 31만 151원이며 시가총액은 약 5조 458억 원이다. 지캐시는 개인 정보 보호와 관련한 기술적 특징으로 사용자의 거래 내역을 보호하는 데 중점을 두고 있다. 에스피엑스6900(SPX)도 4.36% 하락하면서 주목을 받고 있다. 에스피엑스6900은 특정 금융 플랫폼에서 활용되는 토큰으로, 현재 가격은 1367원이다. 시가총액은 약 1조 2727억 원으로, 금융 서비스와 관련된 다양한 기능을 제공하는 데 초점을 맞추고 있다. 페치(FET)는 3.32% 하락하며, 인공지능과 블록체인을 결합한 플랫폼으로 주목받고 있다. 페치의 현재 가격은 373원이며, 시가총액은 약 8861억 5117만 원이다. 이 플랫폼은 주로 데이터 교환과 관련된 분산형 경제를 구축하는 것을 목표로 하고 있다. 카스파(KAS)는 3.14% 하락했다. 카스파는 블록체인의 확장성과 보안성을 강화하는데 중점을 둔 프로젝트로, 현재 가격은 71원이다. 시가총액은",2025-10-19,https://www.seoul.co.kr/news/economy/2025/10/19/20251019500009,서울신문
"삼성 오너 일가, ‘1조 7344억’ 주식 처분…이재용 회장, 모친 지분율 첫 추월",https://img.seoul.co.kr/img/upload/2025/10/17/SSC_20251017193648_N1.jpg.webp,"홍라희 리움미술관 명예관장과 이부진 호텔신라 사장, 이서현 삼성물산 사장 등 삼성의 세 모녀가 상속세 납부 및 대출금 상환을 위해 대규모 삼성전자 주식 처분에 나선다. 17일 금융감독원 전자공시시스템에 따르면, 세 모녀는 전날(16일) 신한은행과 삼성전자 주식 총 1771만 6000주를 매각하기 위한 신탁계약을 체결했다. 이날 종가(9만 7900원)를 기준으로 약 1조 7344억 584만원 규모다. 구체적으로 홍 명예관장은 1000만 주, 이부진 사장은 600만 주, 이서현 사장은 171만 6000주를 처분할 예정이다. 세 모녀는 신탁계약 목적을 “세금 납부 및 대출금 상환용”이라고 밝혔으며, 여기서 세금은 상속세를 의미하는 것으로 풀이된다. 이 회장을 포함한 삼성 오너 일가 4인은 2020년 고 이건희 선대회장의 별세 이후 5년에 걸쳐 총 12조 원의 상속세를 분할 납부(연부연납) 중이다. 이들은 내년 4월 마지막 6차 납부를 앞두고 있다. 세 모녀는 그간 보유 중인 삼성전자, 삼성물산, 삼성SDS 주식을 매도하거나 주식담보대출을 받는 방식 등으로 상속세 재원을 마련해왔다. 이번 계획대로 처분이 완료되면 홍 명예관장의 보유 주식 수는 기존 9797만 8",2025-10-17,https://www.seoul.co.kr/news/economy/industry/2025/10/17/20251017500250,서울신문
"카카오, 개편으로 선보인 숏폼서 1시간 이상 장애 발생",https://img.seoul.co.kr/img/upload/2025/10/17/SSC_20251017181959_N1.png.webp,"카카오가 이번 서비스 개편에서 새로 만들었던 숏폼(짧은 영상) 콘텐츠에서 1시간 가령 서비스 장애가 발생했다. 17일 국회 과학기술정보방송통신위원회 소속 황정아 의원(더불어민주당)이 과학기술정보통신부로부터 제출받은 카카오톡 숏폼 장애 보고서에 따르면 이날 오후 3시 45분쯤부터 카카오톡 숏폼 송출에서 장애가 빚어졌다. 숏폼을 시청하려고 들어가면 ‘연결이 원활하지 않다’는 메시지가 뜨는 식이었는데, 다른 카카오 서비스에는 장애가 일어나지 않았다. 서비스 장애는 1시간 20분 뒤인 오후 5시 5분 복구가 완료됐다. 카카오는 이용자들에게 오후 4시 40분 장애 사실을 고지했다고 밝혔다. 서비스 장애가 30분 이상 지속될 경우 이를 인지한 시점부터 10분 이내에 장애 사실을 당국에 신고해야 하는 규정은 어기지 않은 것으로 알려졌다. 카카오는 과기정통부에 “서비스 운영 시스템에 일시적인 오류가 발생해 관련 숏폼 서비스의 일시적인 중단이 일어났다”고 원인을 설명했다. 황 의원은 “지난 방송미디어통신위원회 국정감사에서 카카오가 서비스 개편을 되돌리는 ‘롤백’이 불가능하다고 밝혀 논란을 일으켰는데, 졸속 서비스를 만드느라 기본도 지키지 못하고 있는 것 아니냐”고 꼬집었",2025-10-17,https://www.seoul.co.kr/news/economy/industry/2025/10/17/20251017500243,서울신문
"삼성, 암 조기진단하는 미국 ‘그레일’에 1억 달러 전략적 투자",https://img.seoul.co.kr/img/upload/2025/10/17/SSC_20251017181324_N1.jpg.webp,"삼성물산과 삼성전자가 증상이 없는 사람의 혈액 채취만으로 암을 조기 진단하는 미국 생명공학 기업 ‘그레일(Grail)’에 1억 1000만 달러를 투자한다고 16일(현지시간) 밝혔다. 그레일은 혈액 내 수억 개의 DNA 조각 중 암과 연관된 미세한 DNA 조각을 최적으로 선별하고, 이를 AI 기반 유전체 데이터 기술로 분석해 암 발병 유무 뿐 아니라 암이 발생한 장기 위치까지 예측할 수 있는 기술을 보유한 업체이다. 다양한 임상시험 결과로 출시한 제품 ‘갤러리(Galleri)’는 단 한 번의 혈액검사로 50여종의 암을 조기에 발견할 수 있다. 2021년 출시 이후 현재까지 약 40만건의 누적 검사 실적을 보유하고 있으며, 영국에서도 국립보건서비스(NHS)와 함께 대규모 임상을 진행하고 있다. 갤러리 검사를 활용하면 췌장암, 난소암 등 표준화된 선별 검사가 없는 암을 조기에 발견할 가능성이 높아 암 치료의 부담을 줄여줄 것으로 예상된다. 그레일은 자사의 갤러리 검사를 내년 중 美 FDA에 승인 신청할 계획이다. 삼성물산은 이번 투자를 통해 한국에서 갤러리 검사를 독점 유통할 수 있는 권리를 확보했으며, 향후 싱가폴, 일본 등에서도 그레일과 협력할 예정이다.",2025-10-17,https://www.seoul.co.kr/news/economy/industry/2025/10/17/20251017500241,서울신문
비듬 샴푸 아녔어? ‘니조랄’ 전신 피부에도 효과적,https://img.seoul.co.kr/img/upload/2025/10/17/SSC_20251017181056_N1.jpg.webp,"휴온스는 자사가 수입하는 비듬 샴푸 브랜드인 ‘니조랄’이 지루성 피부염에도 효과가 있다고 17일 밝혔다. 니조랄은 비듬에 효과가 있는 샴푸로 알려져있다. 일반의약품 글로벌 시장 조사 기업인 ‘니콜라스 홀 데이터’에 따르면 니조랄은 12개국에서 2020년부터 2024년까지 5년 연속으로 아시아 12개국에서 넘버원(No.1) 치료용(medicated) 비듬 샴푸 브랜드로 이름을 올렸다. 니조랄은 미국, 유럽, 아시아, 중남미 등 전 세계에서 30년 이상 안전하게 사용되는 대표적인 광범위 항진균제다. 비듬뿐만 아니라 지루성 피부염에도 효과적이라고 회사 측은 설명했다. 특히 ‘니조랄 2%’ 제품은 두피 외에도 가슴, 등처럼 지루성 피부염이 자주 발생하는 부위에도 사용이 가능하다. 비듬과 지루성 피부염은 건조한 시기가 지속되는 가을에 더 발생하기가 쉽다. 피지선이 발달한 얼굴, 가슴, 등 부위에 수분이 빠르게 증발되며 건조감이 심해지는데 이때 피부가 부족한 수준을 채우기 위해 피지선 활동을 늘려 유분이 과도해질 수 있기 때문이다. 이때 지루성 피부염의 원인균으로 알려진 말라세지아가 빠르게 증식할 수 있다. 휴온스 관계자는 “단순한 비듬 샴푸나 일반 클렌징 제품으",2025-10-17,https://www.seoul.co.kr/news/economy/distribution/2025/10/17/20251017500240,서울신문
CJ제일제당 새 대표에 윤석환…강신호는 사의,https://img.seoul.co.kr/img/upload/2025/10/17/SSC_20251017175637_N1.jpg.webp,"CJ그룹이 17일 CJ제일제당 대표이사에 윤석환 바이오사업부문 대표, CJ푸드빌 대표이사에 이건일 CJ프레시웨이 대표를 각각 내정하는 CEO(최고경영자) 인사를 냈다. 윤 대표와 이 대표는 각각 기존 바이오사업부문과 CJ프레시웨이 대표이사직을 겸직한다. CJ그룹은 매년 연말 CEO 인사와 신임 경영리더 승진, 계열사별 조직 개편 등을 통합적으로 하던 방식에서 탈피해 그룹 주도로 CEO 인사를 먼저 시행하고 계열사 CEO 주도의 후속 인사를 진행할 계획이다. 각 사업별 성장을 주도할 적임 CEO를 선제적으로 배치해 단기 사업계획과 중기전략을 조기에 확정, 미래를 준비하고 책임 경영을 강화하려는 목적이다. 윤석환 대표는 바이오 남미사업담당, 바이오 글로벌 마케팅담당, 바이오 기술연구소장 등을 역임하며 글로벌 사업 운영 및 전략, 연구개발(R&D) 등을 맡아왔다. 2023년부터 바이오사업부문 대표로서 거둔 성과를 바탕으로 최근 실적이 부진한 CJ제일제당을 총괄할 적임자로 낙점됐다. CJ그룹 최초의 공채 출신 부회장으로 지난해 2월부터 CJ제일제당을 이끌어온 강신호 대표이사는 건강상의 사유로 사의를 표명했다고 회사 측은 설명했다. CJ푸드빌을 이끌",2025-10-17,https://www.seoul.co.kr/news/economy/distribution/2025/10/17/20251017500237,서울신문
아파트만 LTV 강화… 오피스텔·상가는 기존 70% 유지,https://img.seoul.co.kr/img/upload/2025/10/17/SSC_20251017170134_N1.jpg.webp,"정부의 ‘10·15 주택시장 안정화 대책’에서 오피스텔·상가 등 비주택 담보대출은 규제 대상에서 제외됐다. 새로 지정된 토지거래허가구역에서도 담보인정비율(LTV)은 기존과 동일하게 70%가 적용된다. 금융위원회는 17일 ‘10·15 주택시장 안정화 대책 관련 FAQ’를 통해 비주택 대출 규제 적용 여부를 명확히 했다. 대책 발표 이후 토지거래허가구역 내 상가·오피스텔의 LTV 산정 기준을 두고 혼선이 빚어지자, 이틀 만에 해명에 나선 것이다. 이번 대책은 서울 전역과 경기 12개 지역을 규제지역으로 확대하고, 주택담보대출의 LTV를 기존 70%에서 40%로 낮추는 내용을 핵심으로 한다. 다만 토지거래허가구역 지정 효력은 아파트 등 주택에만 미치며, 오피스텔·상가·토지 등 비주택은 규제 대상에서 빠졌다. 금융위는 “기존에 비주택을 포함해 지정된 토지거래허가구역의 경우에는 LTV 40%가 적용되지만, 이번 대책은 주택만을 대상으로 지정돼 비주택 담보대출 규제는 기존 수준을 유지한다”고 설명했다. 서민·실수요자 요건을 충족하면 완화된 LTV 기준을 적용받을 수 있다. 부부합산 연소득 9000만원 이하, 주택가격 8억원 이하의 무주택 세대주는 은행권의 서민·실수",2025-10-17,https://www.seoul.co.kr/news/economy/2025/10/17/20251017500217,서울신문
"지주택, 토지매매계약서 90% 확보 못하면 조합원 모집 불가",https://img.seoul.co.kr/img/upload/2025/10/17/SSC_20251017170122_N1.jpg.webp,"앞으로 신규 지역주택조합(지주택)은 90% 이상의 토지매매계약서를 확보하지 않으면 조합원을 모집할 수 없게 될 전망이다. 국토교통부는 17일 신규 부실 조합 차단을 위해 실질적인 토지 확보 노력 없이는 조합원을 모집할 수 없게 하겠다고 밝혔다. 토지매매계약서 제출은 부동산거래신고법에 따라 계약서와 10% 이상의 계약금 입금 증빙 자료를 함께 내야 한다. 현재는 토지 사용권원만 50% 확보하면 조합원 모집 신고 신청이 가능한데, 신청 기준을 강화해 부실 조합에 의한 피해를 사전 예방하겠다는 취지다. 아울러 국토부는 용도지역과 용적률 등 지구단위계획 변경이 선행된 경우에만 조합원 모집 신고를 수리하도록 제도를 개선할 계획이다. 불확실한 사업 계획을 갖고 조합원을 모집하는 행위를 차단하고, 사업 속도를 높이기 위해서다. 또 조합원 모집 공고문에는 토지 매입비·공사비·대행 수수료 등 추정 사업비 세부 내역을 공개하도록 의무화하기로 했다. 조합 가입자들이 사업의 경제성과 위험 요인을 사전에 확인할 수 있도록 하기 위해서다. 국토부는 제도 개선을 위해 주택법 개정을 신속히 추진할 방침이다. 이미 추진 중인 지주택 사업을 위한 종합 제도 개선 방안도 연내 마련할 예정",2025-10-17,https://www.seoul.co.kr/news/economy/estate/2025/10/17/20251017500216,서울신문
‘노 킹스!’ 美 전역 시위… “역사상 최대 700만명 운집”,https://img.seoul.co.kr/img/upload/2025/10/19/SSC_20251019181413_N1.jpg.webp,"도널드 트럼프 미국 대통령의 권위주의적 통치를 규탄한 ‘노 킹스(No Kings·왕은 없다) 시위가 18일(현지시간) 미국 50개주 전역에서 대규모로 열렸다. 반(反) 이민정책과 주방위군을 동원한 치안 개입, 관세 부과에 따른 물가 상승 우려, 청년 보수활동가 찰리 커크의 죽음을 계기로 선포된 이념전쟁 등에 대해 불만의 목소리가 한꺼번에 터져나온 것이다. 주최 측은 전국 2600여개 도시와 마을에서 700만명의 군중이 집결했다며 현대 미국사에서 최대 규모 시위라고 밝혔다. 워싱턴DC와 뉴욕, 로스앤젤레스(LA), 시카고, 보스턴 등 미국 주요 도시에선 이날 오전부터 트럼프 대통령에 반대하는 팻말을 든 시위 인파가 집결했다. 미 전역에서 ‘노 킹스’ 시위가 열린 건 트럼프 대통령이 자신의 생일에 대규모 열병식을 거행한 지난 6월 14일 이후 두 번째로, 첫 전국 시위보다 200만명이 더 모였다. 워싱턴DC의 경우 국회의사당 앞을 중심으로 모여들기 시작한 시위대가 점점 불어나 백악관으로 이어지는 펜실베이니아 애비뉴를 가득 메웠다. 개구리, 카피바라, 공룡 등 우스꽝스러운 ‘동물 코스튬’ 의상을 입고 나온 사람이 많았다. 동물 코스튬은 트럼프 대통령이 최근",2025-10-20,https://www.seoul.co.kr/news/international/USA-amrica/2025/10/20/20251020014002,서울신문
日 다카이치 총리 선출 확실시… ‘연정 구원투수’ 된 일본유신회,https://img.seoul.co.kr/img/upload/2025/10/19/SSC_20251019181133_N1.jpg.webp,연립 세력 이탈로 정권 기반에 타격을 입은 일본 집권 자민당의 다카이치 사나에 총재가 제2야당 일본유신회를 ‘구원투수’로 맞으며 오는 21일 총리 지명이 사실상 확실해졌다. 요미우리신문과 산케이신문은 양당이 총리 지명선거를 하루 앞둔 20일 연립 정권 합의서에 서명할 예정이라고 19일 전했다. 내각제인 일본은 총리 지명선거에서 의원들의 과반 표를 얻어야 한다. 현재 소수 여당인 자민당은 중의원(하원)에서 의장 몫을 포함해 197표를 확보하고 있다. 여기에 유신회 35석을 합치면 232석으로 총리 지명 선 조건인 과반(233석)에서 단 1석이 모자라게 된다. 자민당은 중의원 의석 3석을 보유한 우익 성향의 참정당 등에도 협력을 요청하고 있는 만큼 1차 투표에서 과반을 달성해 결선 투표가 치러지지 않을 가능성도 있다. 총리 선거에서는 과반이 나오지 않으면 상위 두 명이 결선 투표를 치른다. 유신회는 공명당 이탈로 과반이 깨진 자민당의 ‘캐스팅보트’를 쥔 채 개혁 의제 관철을 노린 것으로 보인다. 실제 유신회는 자민당과의 연정 협상에서 의원 정수 감축과 기업·단체 헌금 전면 폐지 등 강도 높은 정치 개혁안을 내세웠다. 특히 국회의원 정수 감축 법안을 강하게,2025-10-20,https://www.seoul.co.kr/news/international/japan/2025/10/20/20251020014001,서울신문
APEC 앞두고… 조셉 윤 주한 美대사대리 교체,https://img.seoul.co.kr/img/upload/2025/10/19/SSC_20251019180008_N1.jpg.webp,오는 31일 경북 경주에서 열리는 아시아태평양경제협력체(APEC) 정상회의를 앞두고 도널드 트럼프 미국 행정부가 조셉 윤 주한 미국대사대리를 교체한다. 한국계 미국인인 케빈 김 미 국무부 동아시아·태평양 부차관보가 후임으로 거론되고 있다. 트럼프 행정부 출범 9개월 만에 정식 대사가 아닌 두 번째 대사대리가 임명되는 것은 한미 외교 관계에서 이례적인 상황으로 평가된다. 19일 외교가에 따르면 윤 대사대리는 9개월여간의 임무를 마치고 오는 26일쯤 자리에서 물러난다. 윤 대사대리는 최근 지인들에게 이 사실을 알렸다고 한다. 조 바이든 전 대통령이 임명한 윤 대사대리는 트럼프 대통령 임기 시작 열흘 전인 지난 1월 10일 임명됐다. 한국계 미국인인 윤 대사대리는 과거 버락 오바마 행정부에서 국무부 대북정책 대표와 북핵 문제 해결을 위한 6자회담 수석대표 등을 지냈다. 후임은 국무부에서 한반도 문제를 담당하는 김 부차관보로 알려졌다. 한국계인 김 부차관보는 빌 해거티 상원의원(공화당·테네시)의 보좌관을 지냈으며 트럼프 1기 정부 때인 2018~ 2020년 국무부 대북정책특별대표실에서 근무했다. 국무부 부장관을 지낸 스티븐 비건 전 대북정책특별대표 등과 함께 근,2025-10-20,https://www.seoul.co.kr/news/international/USA-amrica/2025/10/20/20251020004001,서울신문
