title,thumbnail,short_content,write_time,link,company
굴착기 직접 조종하고 상금? 콘엑스포서 ‘경연’ 열렸다,https://img.seoul.co.kr/img/upload/2026/03/04/SSC_20260304160908_N1.jpg.webp,"HD건설기계가 7일(현지시간)까지 미국 라스베이거스에서 열리는 북미 최대 건설장비 전시회 ‘콘엑스포(CONEXPO) 2026’에서 ‘오퍼레이터 챌린지’를 연다고 4일 밝혔다. 이 이벤트는 미니 전기 굴착기 신제품(HX19E)으로 3개의 공을 정해진 홀에 빠르게 넣는 방식으로 매일 한 명의 우승자를 가려 상금 1000달러를 전달한다. HD건설기계는 관람객들이 미니 전기 굴착기가 구동되는 모습을 가까이에서 구경하고, 직접 제품의 성능을 체감할 수 있게 이번 이벤트를 마련했다고 설명했다. 이벤트에 투입된 현대 미니 전기 굴착기 ‘HX19E’는 동급 최대 수준인 40kWh 배터리 탑재가 가능해 최대 10시간 이상 운용이 가능하다. 기존 내연기관 장비와 대등한 작업 성능을 구현하지만 소음과 배기가스 배출이 없다. 글로벌 시장조사기관 마켓리서치퓨처에 따르면 미국 소형 전기 건설 장비 시장은 2025년 91억 6000만달러(13조원)에서 2035년 416억 4000만 달러(60조원)로 연평균 16.3% 성장할 전망이다. HD건설기계는 출범 후 첫 글로벌 전시회인 이번 콘엑스포에 참가해 현대와 디벨론 부스를 각각 운영하며 23~40t급에 차세대 신모델 9종을 북미 시장",2026-03-04,https://www.seoul.co.kr/news/economy/industry/2026/03/04/20260304500222,서울신문
"아산 삼일파라뷰 사고사업장, 계약 종료 즉시 보증금 청구 길 열려",https://img.seoul.co.kr/img/upload/2026/03/04/SSC_20260304160706_N1.jpg.webp,"아산시는 온천동 삼일파라뷰 시그니처 단지에서 주택도시보증공사(HUG)와 함께 임대보증금 보증이행 관련 설명회를 열고 임차인 보호 대책과 향후 절차를 안내했다고 4일 밝혔다. 시에 따르면 ‘아산온천 삼일파라뷰 시그니처’는 2024년 1월 준공된 민간임대주택으로 440가구가 거주 중이다. 최장 10년간 전세 거주가 가능한 단지지만, 지난 1월 시공사 삼일건설과 임대사업자 파라뷰골든클래스가 법정관리에 돌입하면서 보증금 반환 우려가 확산했다. 시는 법정관리 신청 직후 HUG에 임차보증금 반환 절차의 신속한 협조를 요청하고, 시공사와 임차인 비대위 측과 수차례 소통하며 상황 관리에 나섰다. HUG는 지난달 26일 해당 단지를 보증사고 사업장으로 지정했다. 일반적으로 임대차 계약 종료 후 2개월이 지나야 보증이행 청구가 가능하지만, 사고 사업장으로 지정되면 계약 종료 후 임차권등기를 마치는 즉시 보증금 반환을 청구할 수 있다. 시는 이번 조치로 임차인의 반환 시점이 앞당겨지면서 불안이 상당 부분 해소될 것으로 보고 있다. HUG는 3일부터 6일까지 단지 내 ‘찾아가는 임대보증 이행 상담소’를 설치하고, 반환 청구 절차와 필요 서류 안내, 법률 상담을 병행한다.",2026-03-04,https://www.seoul.co.kr/news/economy/estate/2026/03/04/20260304500221,서울신문
삼성전자 7만원에 팔고 21만원에 산 침착맨… 모범납세자 선정,https://img.seoul.co.kr/img/upload/2026/03/04/SSC_20260304160059_N1.png.webp,"미국·이스라엘과 이란 간 전쟁 여파로 코스피가 이틀간 18.5% 가까이 폭락한 가운데 유명 웹툰 작가 겸 인터넷 방송인 침착맨(본명 이병건·42)이 삼성전자 주식을 7만원대에 팔았다가 최근 21만원에 다시 샀다고 밝혀 주목받고 있다. 침착맨은 4일 모범납세자에 이름을 올렸다. 침착맨은 지난달 27일 자신의 유튜브 채널에 올린 ‘침착맨 삼전 재진입’이라는 제목의 짧은 영상을 통해 삼성전자 매수 근황을 전했다. 영상에서 침착맨은 ‘왜 삼전 가격이 떨어졌죠? 삼전 사셨나요?’라는 한 시청자의 채팅에 “어제 샀다. 열받아서 합류했다”고 답했다. 그는 매수 이유에 대해 “어차피 주가가 내려가도 다 같이 떨어지지 않느냐. 안 사면 나 혼자 외로운데 다 같이 떨어지면 외롭지는 않다”고 설명했다. 삼성전자는 오랜 기간 4만~7만원대 구간에 머무르다 지난해 하반기쯤부터 급등을 거듭하며 지난달 27일 장중 22만 3000원까지 올랐다. 그러나 미국과 이스라엘의 이란 공습 직후인 지난 3일과 이날(4일) 각각 9.88%, 11.74% 급락하면서 17만 2200원에 장을 마감했다. 앞서 침착맨은 지난해 7월 유튜브 라이브 방송을 통해 “삼성전자 주식이 이제야 양전했다”고",2026-03-04,https://www.seoul.co.kr/news/economy/2026/03/04/20260304500218,서울신문
코스피 12% 폭락 ‘증시 최악의 날’…‘5000피’ 턱걸이했다,https://img.seoul.co.kr/img/upload/2026/03/04/SSC_20260304154540_N1.jpg.webp,"이란 전쟁이 장기화할 우려에 코스피가 4일 12% 폭락했다. 역대 최대 낙폭을 경신하며 ‘5000피’에 간신히 턱걸이했다. 코스피는 이날 전 거래일 대비 698.37포인트(12.06%) 하락한 5093.54에 거래를 마쳤다. 지수는 전 거래일 대비 199.32포인트(3.44%) 내린 5592.59로 출발해 낙폭을 키우며 오전에는 프로그램매도호가 일시효력정지(사이드카)가 발동됐다. 이어 오후에는 20분 동안 거래를 중단하는 서킷브레이커가 발동됐다. 서킷브레이커 발동 당시 469.75포인트(8.11%) 하락한 5322.16을 나타냈는데, 거래 재개 후 낙폭을 키워 12%대까지 떨어졌다. 앞서 미국과 이스라엘의 이란 공습 이후 첫 거래일인 전날 7.24% 하락하며 사흘만에 6000선을 내준 코스피는 이날 증시 개장 이래 역대 최대 폭으로 급락했다. 직전 역대 1위는 미국 9·11 테러 직후인 2001년 9월 12일 기록한 12.02%다. 코스피는 2거래일 동안 18.42% 폭락하며 지난달 6일(5089.14) 이후의 상승분을 모두 반납했다. 삼성전자는 전 거래일 대비 11.74% 급락한 17만 2200원에 거래를 마치며 ‘17만전자’ 붕괴를 눈앞에 뒀다.",2026-03-04,https://www.seoul.co.kr/news/economy/securities/2026/03/04/20260304500206,서울신문
"냉혹한 글로벌 문턱…K-스타트업, 바르셀로나서 실력으로 정면 돌파[MWC26]",https://img.seoul.co.kr/img/upload/2026/03/04/SSC_20260304153109_N1.png.webp,"“시장에 이미 자율주행 로봇이 넘쳐납니다. 그 수많은 로봇 사이에서 당신들만의 고유한 강점은 무엇이며, 어떻게 차별화됩니까?” 3일(현지시간) 스페인 바르셀로나 피라 그란 비아 8.1홀. 전시장 입구에서 가장 멀리 떨어진 이곳은 MWC의 스타트업 전용관 ‘4YFN(4 Years From Now)’이 자리한 곳이다. 대기업관의 화려한 쇼케이스는 없지만 ‘4년 뒤’ 본무대의 주인공을 꿈꾸는 젊은 에너지가 가득했다. 이날 KT가 지원하는 8개 혁신 기업의 피칭 세션이 끝나자 KPN 벤처스의 한스 소겐 투자자가 마이크를 잡았다. 그는 기술적 수사보다는 비즈니스의 실질적인 생존 가능성을 파고드는 ‘송곳 질문’을 던졌고, 순간 무대 위 공기는 팽팽한 긴장감으로 얼어붙었다 질문을 받은 자율주행 로봇 전문기업 ‘트위니’는 글로벌 시장의 냉혹한 문턱을 실감해야 했다. 쏟아지는 영어 질문의 압박감 속에 천홍석 트위니 대표는 답변을 이어가는 데 적잖은 고전를 치렀다. 그러나 무대 밖에서 만난 천 대표의 눈빛은 달랐다. 그는 앞서 진행된 기자 간담회에서 “휴머노이드가 춤추는 화려한 영상은 많지만, 정작 복잡한 현장을 조이스틱 없이 스스로 걷는 로봇은 없다”며 “독자적 알고리즘",2026-03-04,https://www.seoul.co.kr/news/economy/industry/2026/03/04/20260304500205,서울신문
[포토] 스마트공장·자동화산업전,https://img.seoul.co.kr/img/upload/2026/03/04/SSI_20260304140229_N1.jpg.webp,4일 코엑스에서 열린 2026 스마트공장·자동화산업전에서 모델들이 현대글로비스 아틀라스와 기념촬영을 하고 있다.,2026-03-04,https://www.seoul.co.kr/news/economy/industry/2026/03/04/20260304800007,서울신문
"아로셀, 2026년 ‘기술 중심 홈케어 솔루션 기업’ 전환 가속화",https://img.seoul.co.kr/img/upload/2026/03/04/SSC_20260304142507_N1.jpg.webp,"1,500만 장 판매된 슈퍼 콜라겐 마스크 이어 아크토닝 디바이스 및 버블 세럼 마스크 출시 아로셀(AROCELL)은 2025년 한 해 동안 핵심 제품 경쟁력을 기반으로 매출 성과와 소비자 인지도를 동시에 확대하며 프리미엄 홈케어 시장에서의 입지를 공고히 했다. 특히 대표 제품인 ‘슈퍼 콜라겐 마스크’는 누적 판매량 1,500만 장을 돌파하며 브랜드를 대표하는 베스트셀러로 자리매김했다. 이러한 성과를 기반으로 아로셀은 2026년 제품 포트폴리오의 기술적 고도화와 확장을 본격화한다고 밝혔다. 단순히 화장품을 판매하는 브랜드를 넘어, 특허 기반 기술과 디바이스 기술 등을 바탕으로 ‘기술 중심 홈케어 솔루션 기업’으로의 체질 개선에 나선다는 전략이다. 먼저 아로셀은 복합 기능을 탑재한 뷰티 디바이스 ‘아크토닝(ARC TONING)’을 선보이며 홈케어 시장을 디바이스 영역으로 확장했다. 아크토닝은 피부를 깨우고, 열고, 반응하는 3단계 리셋 기술을 담아 설계된 토탈 홈케어 디바이스로, 기존 마스크 및 기능성 제품과의 시너지를 통해 과학적이고 체계적인 피부 관리를 돕는다. 기술적 차별화는 신제품 ‘슈퍼 콜라겐 버블 세럼 마스크’에서도 나타난다. 2026년 1월 출",2026-03-04,https://www.seoul.co.kr/news/economy/2026/03/04/20260304500175,서울신문
[서울데이터랩]3월 4일 암호화폐 시총 상위종목 동향,https://img.seoul.co.kr/img/upload/2026/03/04/SSC_20260304141052_N1.png.webp,"글로벌 가상자산 시황 중계 사이트 코인마켓캡에 따르면 비트코인은 현재가 9975만 1960원으로 시가총액은 1994조 7935억원이다. 24시간 등락률은 -1.09%로 하락세를 보였으며, 1시간 등락률도 -1.06%로 나타나 단기적으로 하락세가 지속되고 있다. 거래량은 74조 471억원이다. 이더리움은 현재가 288만 6738원, 시가총액 348조 4066억원을 기록하고 있다. 24시간 등락률은 -2.59%로 하락폭이 크고, 1시간 등락률 역시 -1.20%로 하락세가 계속되고 있다. 거래량은 35조 5780억원이다. 비앤비는 현재가 92만 6763원이며, 시가총액은 126조 3722억원에 달한다. 24시간 동안 -1.17% 하락했으며, 1시간 등락률은 -0.94%로 단기 하락세가 지속되고 있다. 거래량은 2조 5516억원이다. 리플의 현재가는 1990원으로, 시가총액은 121조 5989억원이다. 24시간 등락률은 -1.79%, 1시간 등락률은 -0.90%로 단기적으로 하락세가 지속되고 있다. 거래량은 4조 777억원이다. 한편 솔라나는 24시간 동안 -0.82% 하락하며 현재가 12만 6324원을 기록하고 있다. 시가총액은 71조 9755억원이다.",2026-03-04,https://www.seoul.co.kr/news/economy/IT/2026/03/04/20260304500167,서울신문
[서울데이터랩]금일 코스피 거래량 1위 흥아해운 거래대금 3916억 돌파,https://img.seoul.co.kr/img/upload/2026/03/04/SSC_20260304141027_N1.png.webp,"코스피 거래량 상위 종목들이 전반적으로 엇갈린 흐름을 보이고 있다. 한국거래소에 따르면 흥아해운(003280)이 1억 4350만주 이상 거래되며 코스피 종목 중 실시간 거래량 1위를 차지하고 있다. 현재 주가는 2790원으로, 시가총액의 약 5.8%에 해당하는 거래대금 3916억원을 기록하며 19.7% 급등하고 있다. PER 24.47, ROE 20.08로 기업의 재무 상태도 양호한 편이다. 대한해운(005880)은 현재 2355원으로 거래되며, 1억 1137만주를 기록해 거래량 2위를 차지하고 있다. 이 종목은 시가총액 대비 거래대금이 3.9% 수준이며, 16.4% 폭락한 상태다. PER 5.23, ROE 8.93으로 수급과 재무 지표에서 안정성을 보인다. 삼성전자(005930)는 현재 17만 4200원으로 10.7% 하락하며 거래량 5863만주를 기록 중이다. SH에너지화학(002360)은 570원으로 18.7% 상승하며 5390만주가 거래됐다. SK증권(001510)은 1494원으로 17.9% 하락하며 거래량 4720만주를 기록하고 있다. 서울식품(004410)은 174원으로 17.9% 하락, 남선알미늄(008350)은 1190원으로 1.7% 상승,",2026-03-04,https://www.seoul.co.kr/news/economy/securities/2026/03/04/20260304500166,서울신문
‘증시 패닉’… 9·11 때보다 더 빠졌다,https://img.seoul.co.kr/img/upload/2026/03/04/SSC_20260304181822_N1.jpg.webp,"이틀 만에 800조 날린 코스피… 李, 오늘 임시 국무회의 소집 12% 폭락한 5090대 ‘역대 최대 낙폭’ 코스닥과 동반 서킷브레이커 발동 환율 1500원 터치·원자재값도 ‘출렁’ 이란 사태가 장기화될 조짐을 보이면서 주가·환율·유가가 동시에 흔들리는 이른바 ‘트리플 쇼크’가 현실화됐다. 특히 중동 원유 의존도가 높고 수출 비중이 큰 한국 경제 구조상 글로벌 충격이 크게 반영됐다는 분석이 나온다. 최근 한국 증시가 가파른 상승세를 이어 온 만큼 시장 변동성에 더 취약해졌다는 평가도 있다. 이번 사태가 금융시장 불안을 넘어 실물경제에도 부담으로 이어질 수 있다는 우려가 제기된다. 4일 코스피는 전일 대비 698.37포인트(12.06%) 급락한 5093.54에 거래를 마쳤다. 장중 한때 5059.45(-12.65%)까지 밀리며 2001년 9·11 테러 직후 기록했던 12.02% 하락률을 넘어서는 사상 최대 낙폭을 기록했다. 지난달 말 6300선을 돌파했던 지수가 이틀 만에 1000포인트 이상 증발한 것이다. 이 기간 코스피 시가총액도 5146조 3731억원에서 4328조 7682억원으로 800조원 넘게 쪼그라들었다. 오전 중 코스피와 코스닥 시장에서는 사이드",2026-03-05,https://www.seoul.co.kr/news/economy/finance/2026/03/05/20260305001003,서울신문
"“새 지도자, 하메네이 차남 유력”… ‘결사항전’ 택하는 이란",https://img.seoul.co.kr/img/upload/2026/03/04/SSC_20260304181606_N1.jpg.webp,"미국과 이스라엘의 공습으로 사망한 이란 최고지도자 아야톨라 알리 하메네이의 후계자로 그의 차남인 모즈타바 하메네이가 유력하게 거론되는 것으로 3일(현지시간) 알려졌다. 모즈타바는 이란 최정예 부대인 혁명수비대(IRGC)와 긴밀히 협력해 온 강경파로, 이란 차기 지도부가 대미 결사항전 수순을 밟을 것이라는 관측이 제기된다. 뉴욕타임스(NYT)는 이날 이란 당국자들의 말을 인용해 최고지도자를 선출하는 헌법 기구인 전문가회의가 이날 두 차례에 걸쳐 화상 회의를 했으며, 모즈타바를 최고지도자로 공식 발표하는 방안을 고려하고 있다고 보도했다. 이란 반체제 매체 이란인터내셔널은 차기 최고지도자로 이미 모즈타바가 선출됐다고도 보도했다. 이란 최고지도자는 헌법에 따라 88명의 고위 성직자로 구성된 전문가회의에서 선출된다. 이란 반관영 파르스 통신은 전문가회의가 최고지도자 선출 ‘최종 단계’에 접어들었다고 했으나, 결과가 언제 발표될지는 불분명하다. 전문가회의 최종 대면 회의는 하메네이 장례식 이후 이뤄질 것으로 예상된다. 1969년 이란 종교 도시 마슈하드에서 태어난 모즈타바는 공식 직함은 없지만 하메네이의 ‘문고리 권력’으로서 막후에서 영향력을 행사해 온 것으로 알려",2026-03-05,https://www.seoul.co.kr/news/international/2026/03/05/20260305001002,서울신문
"美, 이란 지도자 선출기구 폭격… 이란, 호르무즈 선박 10척 타격",https://img.seoul.co.kr/img/upload/2026/03/04/SSC_20260304181428_N1.png.webp,"헌법기구 청사, 폭격 당시 회의 안 해 美, 이란 군함 17척 격침 등 화력 높여 이스라엘은 지하 핵시설 정밀 타격 이란 “첨단 무기 아직 다 쓰지 않아” 美 CIA 지부·영사관 등엔 드론 공격 미국·이스라엘과 이란 간 공습이 사태 발발 나흘째인 3일(현지시간)에도 계속됐다. CNN방송 등은 이란 최고지도자를 선출하는 헌법 기구인 전문가회의 청사가 이날 미국과 이스라엘의 폭격으로 붕괴됐다고 보도했다. 8년 임기의 성직자 88명으로 구성된 전문가회의는 지난달 28일 공습으로 사망한 최고지도자 아야톨라 세예드 알리 하메네이의 후계자 선출 작업을 하고 있다. 다만 폭격 당시 이곳에서 회의는 열리지 않았다고 현지 매체는 전했다. 이스라엘군이 이란 테헤란 동부 외곽에 있는 지하 핵시설 ‘민자데헤’를 타격했음을 밝혔다고 AFP통신이 보도했다. 이스라엘군은 이곳을 “이란 핵 과학자들이 핵무기용 핵심 부품을 개발하려 비밀리에 활동했던 곳”이라고 설명했다. 또 이스라엘군은 이날 성명을 통해 레바논 수도 베이루트 공습 과정에서 이란 이슬람혁명수비대(IRGC) 정예군인 쿠드스군 산하 ‘레바논 군단’의 사령관 대행 다우드 알리자데가 사망했다고도 밝혔다. 미 중부사령부는 이날",2026-03-05,https://www.seoul.co.kr/news/international/2026/03/05/20260305003001,서울신문
NYT 사주의 호소… “어떤 신문이든 구독해 달라”,https://img.seoul.co.kr/img/upload/2026/03/04/SSC_20260304181412_N1.jpg.webp,"“보통 이런 광고에서는 우리 신문을 구독해 달라고 하겠죠. 하지만 오늘은 아닙니다. 어떤 뉴스 조직이든 지원해 주길 바랍니다.” 미국 최고 권위지 뉴욕타임스(NYT)의 사주인 아서 그레그 설즈버거 회장이 던진 이 한마디가 전 세계 언론계의 이목을 끌고 있다. NYT에 따르면 설즈버거 회장은 지난 2일(현지시간) 자사 팟캐스트에 1분 분량의 음성 광고를 실었다. 통상적인 ‘구독 권유’ 대신 그는 “나는 뉴스 운영과 사업을 총괄하는 동시에 기자 출신으로서, 최근 몇 년간 우리 직업이 점점 위축되는 모습을 우려하고 있다”고 운을 뗐다. 이어 “어떤 기사 링크도 클릭해 달라고 하지 않겠다”며 “독자적인 보도에 전념하는 어떤 뉴스 조직이든 지원해 달라”고 호소했다. 설즈버거 회장은 특히 “훌륭한 지역 신문들은 여러분의 지원이 절실하다”고 강조했다. 그러면서 “NYT를 후원한다면 그 돈을 활용해 기자들을 현장에 보내 인공지능(AI)으로 절대 얻을 수 없는 사실과 맥락을 찾아내겠다”고 덧붙였다. 잘나가는 신문의 수장이 “우리 말고도 보라”고 말하는 장면은 그 자체로 역설적이다. NYT는 디지털 전환에 성공하며 지난해 구독자 1200만명을 돌파했다. 반면 한때 양대 산",2026-03-05,https://www.seoul.co.kr/news/peoples/2026/03/05/20260305023001,서울신문
중국 전인대 “이란 주권 존중”… 미중 정상회담 앞두고 직접 비판은 자제,https://img.seoul.co.kr/img/upload/2026/03/04/SSC_20260304180411_N1.jpg.webp,"중국 최대 정치행사인 양회가 4일 베이징 인민대회당에서 시작된 가운데 한국의 국회 격인 전국인민대표대회(전인대)는 이란에 대한 군사행동 중단을 요청했다. 하지만 미국에 대한 직접적인 비판은 자제하면서 양국 간 협력 의지를 강조해 미중 정상회담를 앞두고 메시지 수위를 조절했다. 8일 일정으로 막 올린 올해 양회에서 세계의 눈은 리창 국무원 총리가 5일 제시할 국내총생산(GDP) 성장률 목표치보다 왕이 외교부장이 이어 내놓을 대외 메시지에 쏠리고 있다. 양회 개막과 함께 열린 기자회견에서는 러우친젠 전인대 대변인이 “중국은 이란 사태를 주시하고 있다”며 “이란 주권과 안보는 존중받아야 하고 군사 작전은 당장 중단되어야 한다”고 강조했다. 러우 대변인은 “어떤 국가도 국제 문제를 좌지우지하거나 타국의 운명을 지배할 권리가 없으며, 제멋대로 행동해서는 안 된다”면서도 미국을 언급하진 않았다. 그는 미중관계에 대해 “미국과 모든 수준과 채널에서 소통을 강화할 것”이라고 밝혔다. 이달 말 미중정상회담을 앞두고 미국과 안정적 관계를 가져가겠다는 의지다. 한편 주된 석유 공급원인 베네수엘라와 이란이 연달아 미국의 공격을 받은 가운데 2023년 이후 처음으로 중국이 GD",2026-03-05,https://www.seoul.co.kr/news/international/china/2026/03/05/20260305010003,서울신문
"‘고액 헌금’ 일본 통일교, 청산 절차 본격화… 2심도 “해산 불가피”",https://img.seoul.co.kr/img/upload/2024/06/10/SSC_20240610193306_N1.jpg.webp,자산 1181억엔은 피해 배상에 사용 언론 “자민당 유착 의혹 해소 안 돼” 일본 법원이 고액 헌금 논란이 이어져 온 세계평화통일가정연합(옛 통일교)에 대한 해산 명령을 유지했다. 이에 따라 교단 자산 청산 절차가 시작된다. 도쿄신문에 따르면 도쿄고등법원은 4일 교단 해산을 명령한 도쿄지방법원 1심 결정을 유지하고 교단 측의 즉시항고를 기각했다. 종교법인법상 해산 명령은 고등법원 판단으로 효력이 발생한다. 법원은 교단이 약 40년 동안 불법적인 헌금 권유를 통해 204억엔(약 1917억원) 규모의 피해를 일으켰다고 인정했다. 재판부는 “헌금 피해는 악질적이며 공공의 복리를 현저히 해친다”며 “해산은 불가피하다”고 판단했다. 민법상 불법행위를 근거로 종교법인 해산을 명령한 것은 일본에서 처음이다. 교단은 최근 39억엔 이상을 지급하는 등 피해 보상에 나섰다며 해산 사유가 없다고 주장했지만 받아들여지지 않았다. 이날 2심 판결로 교단이 보유한 약 1181억엔 규모 자산은 청산 절차를 거쳐 헌금 피해자 배상 등에 사용된다. 교단의 종교법인 지위는 상실되고 세제 혜택도 받을 수 없게 된다. 일본 정부 대변인인 기하라 미노루 관방장관은 이번 판결에 대해 “국가 측,2026-03-05,https://www.seoul.co.kr/news/international/japan/2026/03/05/20260305010002,서울신문
“이란이 먼저 공격하려 했다”… ‘뒷북’ 명분 쌓는 트럼프,https://img.seoul.co.kr/img/upload/2026/03/04/SSC_20260304180217_N1.jpg.webp,"이란의 ‘임박한 위협’ 제시했지만 美 정보기관은 징후 못 찾아 논란 일각 “이스라엘 때문에 감행” 지적 “美 해군이 호르무즈 유조선 호위” 이스라엘과 함께 이란에 나흘째 공습을 가한 도널드 트럼프 미국 대통령이 연일 이란의 ‘선제공격설’ 등을 내세우며 명분 쌓기에 나서고 있다. 하지만 이를 뒷받침할 구체적인 근거가 제시되지 않고 있는 데다 이스라엘에 이끌려 이란을 타격한 것 아니냐는 지적이 나오자 여론전을 펼친 것으로 보인다. 트럼프 대통령은 이란이 호르무즈 해협 통과 선박을 공격하겠다고 위협한 것에 대해선 미 해군이 호위하겠다며 시장의 불안감을 안정시키기에 나섰다. 트럼프 대통령은 3일(현지시간) 백악관에서 취재진과 만나 “우리는 미치광이들(이란)과 협상하고 있었는데, 그들이 먼저 공격할 것이라고 봤다”며 “그들은 (미국을) 공격할 참이었다. 우리가 하지 않았다면 그들이 먼저 공격했을 것”이라고 말했다. 트럼프 대통령은 지난달 28일 대국민 영상연설에서도 이란의 ‘임박한 위협’을 제거하기 위해 공습을 단행했다고 밝혔고, 지난 1일 ABC 방송과의 인터뷰에선 이란이 자신에 대한 암살을 시도했다는 취지의 주장도 펼쳤다. 하지만 미 정보기관은 앞서 의회를 상",2026-03-05,https://www.seoul.co.kr/news/international/USA-amrica/2026/03/05/20260305004002,서울신문
