title,thumbnail,short_content,write_time,link,company
단지 바로 앞 학교·‘더 현대 부산’ 개점,https://img.seoul.co.kr/img/upload/2025/09/16/SSC_20250916004029_N1.jpg.webp,"대우건설 컨소시엄이 최근 ‘에코델타시티 푸르지오 트레파크’ 견본주택을 개관하고 분양에 들어갔다. 부산시 강서구 강동동 4434 일대(에코델타시티 11블록)에 들어서는 이 단지는 지하 2층~지상 24층 13개 동, 전용면적 59~84㎡, 총 1370가구로 조성된다. 택지지구 내 공급물량이 적었던 전용면적 59㎡의 소형 평형 비중이 높아 신혼부부나 1~2인 가구에 큰 호응을 얻을 것으로 보인다. 분양가 상한제 적용 단지로 3.3㎡당 평균 분양가가 1605만원이며 계약금 5% 중 1차 계약금 500만원 정액제를 적용했다. 7만 6000여명의 입주민과 주택 3만 가구를 수용하는 국내 최대 규모의 스마트시티 국가시범도시인 부산 에코델타시티에 들어선다. 남해고속도로 제2지선, 서부산IC, 명지IC 등이 가까워 이동이 수월하다. 단지 바로 앞에 중학교, 도보권 내 유치원과 초·고교 예정 부지가 있다. 2027년 백화점과 프리미엄아울렛, 쇼핑몰이 결합한 ‘더 현대 부산’이 개점한다. 팬트리, 알파룸, 드레스룸 등 다양한 수납공간을 제공한다. 초등학생들의 방과후 돌봄을 지원하는 다함께돌봄센터, 시니어클럽, GX룸 등 커뮤니티 시설이 들어선다. 견본주택은 부산 강서구",2025-09-16,https://www.seoul.co.kr/news/economy/estate/2025/09/16/20250916023001,서울신문
양산 시작한 KF-21 AESA 레이다… ‘1000개의 눈’ 하늘 감시한다,https://img.seoul.co.kr/img/upload/2025/09/15/SSC_20250915175507_N1.jpg.webp,"표적 화면에 뜨자 실시간 식별 핵심 송수신 블록 1000개 채널 모듈화 성공, 함정 등 확장 가능 ‘공랭식’ 무인기용 경량화 개발 지난달 29일 경기 용인시 한화시스템 용인종합연구소 AESA(능동형전자주사식위상배열) 레이다 시험장. 모니터 속 서해안 항공도(비행기 항로를 표시한 지도) 위로 숫자가 적힌 흰 점들이 움직였다. 시험장 반대편 ‘비콘 타워’(표적 모의 장치)가 가동되자 새로운 모의 표적이 화면에 떴다. 레이다는 실시간으로 거리·속도·고도를 식별했다. 임동주 한화시스템 수석연구원은 “휴대전화 업데이트처럼 레이다도 모의 표적을 식별하며 성능을 개선한다”고 설명했다. KF-21에 탑재될 AESA 레이다가 국내 최초 독자 개발에 성공, 최근 양산을 들어갔다. AESA 레이다는 공중·지상·해상 등 다중 표적을 동시에 탐지·추적하고, 미사일 유도와 전자전 대응까지 맡는 전투기의 핵심 장비다. 국방과학연구소가 주관하고 한화시스템이 시제업체로 참여했다. AESA 레이다 성능을 좌우하는 핵심은 송수신 블록(TRB)이다. 벽돌 모양의 TRB는 빔 신호를 증폭시키며, 한 개에 10여 채널로 구성된다. KF-21 AESA 레이다에는 1000개 이상의 채널이 들어가",2025-09-16,https://www.seoul.co.kr/news/economy/industry/2025/09/16/20250916019004,서울신문
기아 ‘더 2026 카니발 하이리무진’ 출시… 더 풍성한 트림 선택,https://img.seoul.co.kr/img/upload/2025/09/16/SSC_20250916003958_N1.jpg.webp,"기아가 국내 대표 프리미엄 리무진인 ‘카니발 하이리무진’의 연식 변경 모델인 ‘더 2026 카니발 하이리무진’을 15일 출시하고 판매를 시작했다. 편의사양을 강화했고, 신규 트림 운영으로 고객의 선택 폭을 넓힌 것이 특징이며 가격은 6327만원부터 시작한다. 사진은 ‘더 2026 카니발 하이리무진’의 외장. 기아 제공",2025-09-16,https://www.seoul.co.kr/news/economy/car/2025/09/16/20250916018006,서울신문
"“베트남 복합 쇼핑몰 2~3곳 더 출점” 롯데쇼핑, 2030년 매출 20조 선언",https://img.seoul.co.kr/img/upload/2025/09/16/SSC_20250916003956_N1.jpg.webp,"롯데쇼핑이 향후 5년 내 베트남에 복합 쇼핑몰을 새로 여는 등 해외 사업 확장과 리테일 테크 중심의 신사업을 육성해 2030년까지 매출 20조 3000억원과 영업이익 1조 3000억원을 달성한다는 목표를 공개했다. 목표 영업이익은 지난해의 3배에 육박하는 수준이다. 롯데쇼핑은 15일 서울 송파구 시그니엘 서울에서 최고경영자 기업설명회(CEO IR DAY)를 열고 이러한 중장기 성장 전략을 밝혔다. 이날 행사는 자산운용사, 증권사, 은행 관계자 등 100여명이 참석해 역대 최대 규모로 진행됐다. 우선 해외 사업은 2030년 매출 3조원 달성을 목표로 한다. 대표 사업인 ‘롯데몰 웨스트레이크 하노이’ 같은 복합단지를 베트남 주요 도시에 2~3개 신규 출점한다. 또 롯데마트 익스프레스 등 소규모 점포 확대, 현지 유통 컨설팅 등을 통해 동남아 시장에서 입지를 강화한다. 인공지능(AI)이 업무를 주도하는 ‘에이전틱 엔터프라이즈’를 도입해 쇼핑·상품기획﻿ 전반의 효율성을 높인다. 네이버 등과의 협업을 통해 AI 경쟁력을 확보하고, 내년 가동 예정인 ‘제타 부산 CFC’ 물류센터를 기반으로 온라인 신선식품 시장에서 차별화를 꾀한다. 김상현 롯데쇼핑 대표이사(부회장)",2025-09-16,https://www.seoul.co.kr/news/economy/distribution/2025/09/16/20250916018005,서울신문
법원 “면세점 임대료 낮춰라”… 인천공항 “수용 못 해”,,법원이 인천국제공항 면세구역 내 입점한 신라면세점에 이어 신세계면세점에도 임대료를 깎아주라는 취지의 강제조정 결정을 내렸다. 하지만 인천국제공항공사는 “조정안을 수용할 수 없다”며 이의 신청을 하겠다고 맞섰다. 인천공항 면세점 임대료 갈등이 결국 소송 또는 영업 철수로 이어질 것으로 보인다. 15일 면세업계에 따르면 인천지방법원은 지난 12일 신세계면세점 주류·담배·향수·화장품 매장(DF2 구역)의 객당 임대료를 현 9020원에서 6568원으로 27.2% 인하하는 내용의 강제조정을 내렸다. 조정을 따를 경우 신세계면세점이 인천공항에 내야 할 임대료는 1710억원으로 당초 2347억원보다 약 637억원 줄게 된다. 법원은 지난 8일 신라면세점(DF1 구역)의 임대료도 객당 8987원에서 6717원으로 25% 인하해주라고 강제조정한 바 있다. 이들 면세점은 지난 4~5월 인천공항 면세점 매출이 저조해 출국 여객 수에 비례해 내는 현재 임대료 방식이 과도하다는 이유로 임대료 40% 인하를 요구하며 인천지법에 조정 신청을 냈다. 반면 공항 측은 국제 입찰을 거친 정당한 계약이라 조정은 불가하다면서 조정 절차에 참여하지 않았다. 법원이 내놓은 강제조정안의 임대료는 2,2025-09-16,https://www.seoul.co.kr/news/economy/distribution/2025/09/16/20250916019003,서울신문
대한항공 ‘규제 틈새까지 독점’ 우려에… 공정위 “조치 미대상 노선도 모니터링”[서울신문 보도 그후],,"공정거래위원회가 대한항공과 아시아나항공의 합병으로 독과점 우려가 제기된 40개 노선 이외에도 시장 점유율이 높은 항공 노선을 모니터링하고 있다고 15일 밝혔다. 공정위는 이날 설명자료를 통해 “공정위는 국토교통부와 협업해 슬롯과 운수권 이전 등 구조적 조치 이행 과정에서 충실한 경쟁 제한성 심사 등을 통해 독과점 우려를 신속하게 해소하기 위해 노력하고 있다”며 “기업결합 시정조치 대상이 아닌 노선에서도 항공 소비자의 권익이 훼손되지 않도록 모니터링하고 있다”고 밝혔다. 앞서 공정위는 지난해 두 항공사의 합병으로 26개 국제노선과 14개 국내 노선에 대해 시장 경쟁이 제한될 우려가 있다고 보고 ‘슬롯’(각 항공사에 배정된 출발·도착 시간)과 ‘운수권’(특정 국가에 취항할 수 있는 권리)을 이전하라는 내용의 구조적 조치와 운임 규제 등 행태적 조치를 부과한 바 있다. 그러나 올해 상반기 두 항공사가 운항 중인 인천발 국제노선 중 통합 점유율이 50%를 넘는 데도 공정위의 구조적 조치를 빗겨 간 ‘사각지대 노선’만 5개로, 공정위의 시정조치 대상이 아닌 ‘틈새 노선’의 점유율은 오히려 2019년보다 확대된 것으로 나타났다.",2025-09-16,https://www.seoul.co.kr/news/economy/industry/2025/09/16/20250916019002,서울신문
4조원대 유전 해수공급시설… ‘이라크 대어’ 낚은 현대건설,https://img.seoul.co.kr/img/upload/2025/09/15/SSC_20250915135718_N1.jpg.webp,"현대건설이 지난 14일(현지시간) 이라크 바그다드에 있는 이라크 정부 총리실에서 30억 달러(약 4조 3900억원) 규모의 해수공급시설(WIP) 프로젝트에 관한 계약을 체결했다고 15일 밝혔다. WIP 프로젝트는 이라크 수도인 바그다드에서 동남쪽으로 약 500㎞ 떨어진 코르 알 주바이르 항구 인근에 하루 5백만 배럴 용량의 용수 생산이 가능한 해수 처리 플랜트를 건설하는 공사다. 이곳에서 생산한 용수는 이라크 바스라 남부에 있는 웨스트 쿠르나, 남부 루마일라 등 이라크 대표 유전의 원유 증산을 위해 사용된다. 석유 매장량 세계 5위인 이라크는 국가 수입의 90% 이상을 원유 수출에 의존하고 있다. WIP는 2030년까지 현재 하루 420만 배럴의 원유 생산량을 800만 배럴까지 증산하기 위한 이라크 주요 정책사업 중 하나이다. 프랑스 에너지 기업 토탈에너지스와 이라크 석유부 산하 바스라 석유회사, 카타르 국영 석유기업인 카타르 에너지가 공동 투자한다. 공사 기간은 착공 후 49개월이다.",2025-09-16,https://www.seoul.co.kr/news/economy/industry/2025/09/16/20250916018004,서울신문
"“인간 통제 회피하는 악당 AI, ‘과학자 AI’로 잡는다”",https://img.seoul.co.kr/img/upload/2025/09/16/SSC_20250916003954_N1.jpg.webp,"전문가 200명 모여 연구 성과 공유 반도체 설계·소프트웨어 활용 논의 삼성전자가 15일 전 세계 인공지능(AI) 석학들과 업계 전문가들이 모여 AI 분야의 최신 연구 성과를 공유하고 방향을 설정하는 ‘삼성 AI 포럼 2025’를 개최했다. 올해로 9회를 맞은 삼성 AI 포럼은 첫날 삼성전자 디바이스솔루션(DS)부문이, 2일차인 16일에는 삼성전자 디바이스경험(DX)부문이 주관한다. 이날 경기 용인의 삼성전자 ‘더유니버스’에서 진행된 1일차 포럼에는 사전에 초청된 전문가 200여명이 참석해 ‘반도체 산업의 버티컬(산업특화) AI 전략과 비전’을 주제로 논의했다. 전경훈 삼성전자 DX부문 최고기술책임자(CTO) 겸 삼성리서치장(사장)은 “생성형 AI는 이미 일상과 산업 전반에서 필수 도구로 자리 잡았다”며 “삼성전자는 본격화되는 ‘에이전틱(자율작업) AI’ 시대에 맞춰 사용자에게 실질적으로 도움이 되는 AI 기술을 준비할 것”이라고 말했다. 첫날 기조강연을 맡은 요슈아 벤지오 캐나다 몬트리올대 교수는 기존 AI 모델에서 발생할 수 있는 ‘인간 통제 회피’, ‘악의적 사용’ 등 위험 요소를 설명하며 안전장치 역할을 할 ‘과학자 AI’ 모델을 소개했다. 벤지오",2025-09-16,https://www.seoul.co.kr/news/economy/industry/2025/09/16/20250916018003,서울신문
중국발 값싼 ‘나트륨이온 배터리’ 공습… 전기차 시장 잠식하나,https://img.seoul.co.kr/img/upload/2025/09/16/SSC_20250916003952_N1.jpg.webp,세계 1위 배터리 업체인 중국 CATL이 최근 공개한 차세대 나트륨이온 배터리가 저렴한 가격 등을 앞세워 리튬·인산·철(LFP) 배터리처럼 시장 점유율을 확대할 것으로 전망됐다. 이에 따라 국내 배터리 업계가 발 빠른 대응에 나서야 한다는 지적이 나왔다. 한국자동차연구원은 15일 이런 내용의 보고서를 발표했다. 자동차연구원에 따르면 CATL은 지난 4월 상하이에서 연 자체 테크 데이 행사에서 나트륨이온 배터리 ‘낙스트라’를 공개하고 오는 12월 양산할 예정이라고 밝혔다. 이는 2021년 CATL이 처음 발표한 1세대 나트륨이온 배터리에 이은 2세대 제품이다. 나트륨이온 배터리는 생산 단가가 낮고 열·화학적 안정성이 높아 화재 위험이 낮으며 영하 40도에서도 충전량 90% 이상을 유지하는 등 저온에서 성능이 크게 저하되지 않는 장점을 가지고 있다. 주원료인 나트륨의 지각 내 매장량은 리튬의 약 1200배에 달한다. 경제성이 확보되면 해수에서 수급도 가능해 수요가 증가해도 가격이 급등할 우려가 낮다. 이에 따라 나트륨이온 배터리는 가격 경쟁력과 기술적 이점으로 글로벌 전기차 배터리 시장에서 입지를 키울 것으로 자동차연구원은 전망했다. 또 향후 완성차 기업이,2025-09-16,https://www.seoul.co.kr/news/economy/industry/2025/09/16/20250916018002,서울신문
펨토셀 33% ‘먹통’… 北 AI 딥페이크 해킹 첫 확인,,"KT에서 무단 소액결제 사건이 발생하면서 통신사의 보안 부실 문제가 대두되는 가운데 개인정보 유출 경로로 지목된 초소형 기지국(펨토셀)의 33%가 시스템상 잡히지 않는 것으로 나타났다. 15일 최수진 국민의힘 의원실이 이동통신 3사로부터 받은 자료에 따르면 통신 3사의 전체 펨토셀 19만 5000대 중 약 33%에 달하는 6만 4000대가 미작동해 신호가 잡히지 않고 있다. 회사별로 보면 무단 소액결제 사고가 발생한 KT에서 이러한 펨토셀이 가장 많았는데, 총 15만 7000여대의 KT 펨토셀 중 5만 7000대가 신호가 잡히지 않았다. LG유플러스는 2만 8000대 중 4000대, SK텔레콤은 1만대 중 3000대에서 신호가 잡히지 않았다. KT는 이와 관련해 “일부 초소형 기지국 신호가 잡히지 않는 이유는 전원 꺼짐, 고장 등이 주요 원인”이라면서 “잠재적 추가 악용을 막기 위해 신호가 잡히지 않는 초소형의 기지국에 대한 망 접근을 차단했다”고 밝혔다. SK텔레콤은 “신호가 잡히지 않은 3000대는 재고 수량에 해당한다”고 했다. 관리의 사각지대에 놓인 펨토셀은 해킹의 대상이 되기 쉬운데, 펌웨어가 깔려있고 외부와의 통신이 가능해서다. 공격자는 방치된",2025-09-16,https://www.seoul.co.kr/news/economy/IT/2025/09/16/20250916018001,서울신문
조직 개편 앞 금융당국 고위직 공석 혼란… ‘코스피 5000’ 발목 잡을까 우려,https://img.seoul.co.kr/img/upload/2025/09/15/SSC_20250915162743_N1.jpg.webp,"금융당국 고위직 인사가 정부 조직개편에 막혀 멈춰섰다. 금융위원회와 금융감독원 모두 공석을 채우지 못한 채 ‘시한부 조직’ 운영이 이어지며 ‘코스피 5000 시대’를 향한 시장 신뢰에도 부담이 될 수 있다는 우려가 나온다. 15일 금융당국과 금융권에 따르면 이찬진 금융감독원장은 연말까지 임원 인사를 보류하기로 했다. 지난 7월 함용일 자본시장부문 부원장과 지난달 김범준 보험부문 부원장보가 잇따라 퇴임했지만 후임 인선은 없는 상태다. 금감원은 새 원장 취임 시 임원 전원이 일괄 사표를 내고 세대교체 인사가 단행되는 것이 관례였지만, 이번에는 정부의 조직개편 변수가 겹치며 사실상 인사가 중단됐다. 금융위도 사정은 다르지 않다. 권대영 부위원장이 승진하면서 사무처장(1급) 자리가 비었고, 금융정책 기능의 재정경제부 이관과 제2차관 신설 가능성이 거론되면서 고위직 인사가 이뤄지지 않고 있다. 금융당국 관계자는 “내년 1월 새 체제가 출범하면 일부 직위가 사라질 수 있어 ‘5개월짜리 시한부 임원’을 임명하는 것은 무의미하다”며 “조직 안정에 오히려 역효과가 날 수 있다”고 설명했다. 문제는 인사 공백이 내부 불안으로 이어진다는 점이다. 금감원 직원들은 이날도 일주",2025-09-16,https://www.seoul.co.kr/news/economy/finance/2025/09/16/20250916016008,서울신문
대주주 기준 50억 유지 훈풍… 코스피 사상 첫 3400선 돌파,https://img.seoul.co.kr/img/upload/2025/09/15/SSC_20250915181032_N1.jpg.webp,"외국인 6거래일째 ‘바이 코리아’ 자본시장 친화적 정책에 ‘화답’ 美 금리 인하 전망, 호재로 작용 블룸버그 ‘이재명 랠리’에 주목 코스피가 15일 사상 처음으로 3400선을 돌파하며 4거래일 연속 최고가를 경신했다. 정부가 양도소득세 대주주 기준을 50억원으로 유지하겠다는 방침을 밝히면서 투자심리가 살아난 것으로 보인다. 15일 코스피는 전 거래일보다 11.77포인트(0.35%) 오른 3407.31로 마감했다. 장중 3420.23까지 오르며 4거래일 연속 사상 최고치를 경신했고, 종가 기준으로는 10거래일 연속 상승세를 이어갔다. 코스닥도 5.61포인트(0.66%) 오른 852.69로 강세를 나타냈다. 구윤철 부총리 겸 기획재정부 장관은 이날 “자본시장 활성화에 대한 국민적 열망과 함께 대주주 기준 유지가 필요하다는 당의 입장 등을 종합적으로 고려해 대주주 기준을 50억원으로 유지하기로 했다”고 밝혔다. 앞서 코스피는 정부가 대주주의 종목당 주식보유액 기준을 50억원에서 10억원으로 강화하는 내용의 세제 개편안을 내놓은 뒤 급락했다. 코스피에서 외국인은 2668억원 순매수해 6거래일 연속 ‘사자’에 나섰고, 개인과 기관은 각각 1376억원, 1374억원",2025-09-16,https://www.seoul.co.kr/news/economy/securities/2025/09/16/20250916016007,서울신문
공시가격 9억→12억 이하 비과세… 민간임대주택 종부세 요건 완화,,"올해부터 주택을 30호 이상 짓거나 사들인 임대사업자가 공급하는 민간임대주택(10년 의무 임대)에 부과되는 종합부동산세 요건이 완화된다. 단기 민간임대주택에 대한 종부세 비과세 혜택도 늘어난다. 주택 공급 확대에 도움이 되는 ‘착한 임대’로 간주하고 종부세 혜택을 준다는 취지다. 국세청은 올해 종부세 합산 배제(비과세)·과세 특례 적용이 예상되는 납세자 5만여명에게 안내문을 발송했다고 15일 밝혔다. 각종 비과세·특례를 받을 수 있는 주택 보유자가 오는 11월 ‘종부세 폭탄’을 맞지 않으려면 이달 30일까지 합산배제·특례 신청을 해야 한다. 민간임대주택 임대사업자가 새로 짓는 주택에 대한 비과세 요건은 현행 공시가격 9억원 이하에서 12억원 이하로, 사들인 주택에 대해서는 6억원(비수도권 3억원) 이하에서 9억원(비수도권 6억원) 이하로 완화된다. 올해부터 1주택자가 소유한 주택이 재건축·재개발된 주택 또는 배우자로부터 상속받은 주택일 때 특례 신청을 하면 보유 기간별로 세액공제를 받을 수 있다. 기존에 시행된 특례 제도로는 ‘지방 저가주택·부부공동명의 주택·일시적 2주택’ 등이 있다. 수도권 1주택자가 비수도권 내 광역시·특별자치시가 아닌 곳에 공시가격",2025-09-16,https://www.seoul.co.kr/news/economy/2025/09/16/20250916016006,서울신문
건설업계 “원청 책임만 강조하나”… 경총도 “국가 경제 심각한 악영향”,,"중견업체 “국내 토목 노동자 없어 불법 외국 노동자 쓰는 상황” 토로 정부가 연간 3명 이상 노동자 사망 사고를 내는 기업에 영업이익의 5% 이내 과징금을 부과하고 다수 사망 시 업체 등록 말소까지 추진하는 내용의 노동안전 종합대책을 15일 내놓자 건설업계가 “원청 책임만 강조한다”고 지적했다. 10대 건설사 관계자는 “사망 사고를 줄이자는 정책 취지 자체에는 공감한다”면서도 “건설업계 사망 사고는 원청뿐 아니라 발주처와 하청업체, 노동자 개인의 부주의 등이 얽혀 발생한다. 이번 종합대책은 원청 책임만 강화하고 있어 업계에 심각한 영향을 미칠 것”이라고 했다. 중견 건설업체 관계자는 외국인 사망 사고 발생 시 기존 1년이었던 고용 제한을 3년으로 늘리는 조항에 “토목이나 터널 공정에는 국내 노동자들이 없어 불법으로 외국인 노동자를 쓰는 상황”이라고 토로했다. 대한건설협회 관계자는 “건설안전특별법에서 3%를 정해 놓고 과징금을 5%까지 올린 건 다소 과하다. 등록 말소 처분 역시 사실상 회사 문을 닫으라는 것인데, 남은 노동자들에 대한 고용 보장 등도 보완해야 한다”고 강조했다. 다만 입찰 시 최저가를 규정했던 공사비를 발주자가 산정하고 공사 기간 산정 기준",2025-09-16,https://www.seoul.co.kr/news/economy/2025/09/16/20250916009006,서울신문
성수품 ‘반값’… 역대 최대 900억 풀어 장바구니 부담 던다,https://img.seoul.co.kr/img/upload/2025/09/16/SSC_20250916003833_N1.jpg.webp,"성수품 17.2만t… 평시의 1.6배 재난지역 숙박 쿠폰도 15만장 온누리상품권 370억원 ‘환급’ 서민·청년층 정책금융 1145억 정부가 역대 최대 규모인 17만 2000t의 추석 성수품을 공급하고, 900억원을 들여 과일·한우 등 선물 세트를 최대 50% 할인한다. 또 특별재난지역 숙박시설에서 쓸 수 있는 쿠폰 15만장도 발행한다. 정부는 15일 구윤철 부총리 겸 기획재정부 장관 주재로 정부서울청사에서 열린 경제관계장관회의에서 이런 내용의 ‘추석 민생안정대책’을 발표했다. 우선 농축수산물의 가격·수급 안정을 위해 공급을 늘린다. 공급 물량은 농산물 5만t, 축산물 10만 8000t, 수산물 1만 4000t 등으로 평상시의 1.6배 수준이다. 정부 비축 물량 1만 9000t을 시장에 풀고, 사과·배·단감 등 과일 3만 2000t을 도매시장에 출하할 예정이다. 할인 지원에 역대 최대 규모인 900억원을 배정했다. 정부 지원으로 20%, 생산자·유통업체 부담으로 20~30%가 각각 할인되는 구조다. 전통시장의 온누리상품권 현장 환급액을 지난해 167억원에서 올해 370억원으로 크게 확대했다. 또 과일·축산물·전통주·홍삼 등 국산 농식품 94개 선물 세트를",2025-09-16,https://www.seoul.co.kr/news/economy/2025/09/16/20250916009007,서울신문
"한 해 3명 이상 사망 사고 낸 기업, 영업이익 최대 5% 과징금",https://img.seoul.co.kr/img/upload/2025/09/15/SSC_20250915181013_N1.jpg.webp,"건설사 영업 정지 요건 대폭 확대 3년간 세 차례 받으면 업계 ‘퇴출’ 외국인 사망 고용 제한 1년→3년 안전·보건 의무 위반 때 즉시 처벌 앞으로는 1년 동안 3명 이상의 노동자가 산업재해로 숨진 기업은 영업이익의 최대 5%를 과징금으로 내야 한다. 건설사 영업정지 요건은 현행 ‘동시 2명 이상 사망’에서 ‘연간 다수 사망’으로 확대되고, 영업정지를 3년간 세 차례 받으면 사실상 퇴출된다. 또 중대 재해 발생에 책임이 있는 공공기관장은 해임할 수 있는 법적 근거도 마련한다. ‘산재와의 전쟁’을 선포한 이재명 정부가 내놓은 초강수다. 고용노동부는 15일 정부서울청사에서 이런 내용의 ‘노동안전 종합대책’을 발표했다. 기존 벌금 수준에 그쳤던 경제적 불이익을 대폭 강화한 게 핵심이다. 산재 사고 사망자 비율을 1만명당 0.39명에서 2030년까지 경제협력개발기구(OECD) 평균인 0.29명으로 감축하는 게 목표다. 사망 사고가 반복적으로 일어난 건설사에 대해서는 노동부가 관계 부처에 등록 말소를 요청할 수 있는 규정이 신설된다. 3년간 영업정지 처분을 두 차례 받은 뒤 다시 해당 사유가 발생한 기업이 대상이다. 등록 말소 때는 모든 영업활동이 불가능하다. 중",2025-09-16,https://www.seoul.co.kr/news/economy/2025/09/16/20250916009005,서울신문
