title,thumbnail,short_content,write_time,link,company
트럼프 “中과 식용유 교역 단절 검토”… APEC 앞두고 미중 다시 ‘치킨게임’,https://img.seoul.co.kr/img/upload/2025/10/15/SSC_20251015180441_N1.jpg.webp,이달 말 경북 경주 아시아태평양경제협력체(APEC) 정상회의를 앞두고 무역 전쟁에 돌입한 미국과 중국이 하루가 멀다 하고 서로에 대한 제재 조치를 발표하면서 ‘치킨게임’ 양상으로 흐르고 있다. 지난 4월 100%가 넘는 초고율 관세를 주고받으며 ‘경제 핵전쟁’으로 치달았던 형국이 재연되는 양상이다. 유럽연합(EU)도 가세해 중국 기업에 대한 규제 강화를 검토하는 등 지구촌 전역으로 무역 갈등이 확산하고 있다. 미중 대립으로 마스가(MASGA·미국 조선업을 다시 위대하게)의 상징인 한화그룹 미국 내 자회사가 중국으로부터 제재를 받은 한국으로선 또 다른 불똥이 우려되는 상황이다. 도널드 트럼프 미국 대통령은 14일(현지시간) 트루스소셜에서 “중국이 의도적으로 우리 대두를 구매하지 않고 농가에 어려움을 초래하는 것은 경제적으로 적대적인 행위”라며 “보복 조치로 식용유 및 기타 무역 관련 중국과의 사업을 중단하는 것을 고려하고 있다”고 밝혔다. 세계 최대 대두 소비국인 중국은 수입량의 50%가량을 미국산으로 충당했지만 지난 6월부터 수입을 중단했다. 이에 트럼프 대통령은 경주 APEC에서 시진핑 중국 국가주석과 만나 대두 문제를 주요 의제로 다룰 것이라고 예고,2025-10-16,https://www.seoul.co.kr/news/international/2025/10/16/20251016008006,서울신문
美 전문가 “中 보복에 농업·제조업 타격 우려”… 관세 역풍 경고,https://img.seoul.co.kr/img/upload/2025/10/16/SSC_20251016005759_N1.png.webp,"이달 말 경북 경주에서 열리는 아시아태평양경제협력체(APEC) 정상회의를 앞두고 미중 무역 전쟁이 다시 불붙은 가운데 미국 전문가들은 도널드 트럼프 행정부의 관세 정책이 부메랑이 될 수 있다고 우려했다. 미 상공회의소 아시아 담당 부회장을 지낸 태미 오버비 미국·아시아 협회 부회장은 14일(현지시간) 서울신문과의 인터뷰에서 “중국의 보복으로 농업과 제조업 등 산업 충격이 우려된다”고 진단했다. 자동차 산업 전문가 테런스 라우 시러큐스대 로스쿨 학장은 “포드와 제너럴모터스(GM) 등 미국 자동차 제조업체가 관세로 큰 타격을 입었다”며 조만간 가격 인상을 통해 소비자에게 부담을 전가할 것이라고 내다봤다. 다음은 두 전문가와의 일문일답. -미국 관세 정책이 아직까지는 물가를 크게 자극하진 않고 있는데 앞으로는 어떤가. (오버비 부회장) “관세 부과 초기에는 소비자 물가가 크게 상승하지 않을 수 있다. 기업들은 경쟁력 있는 가격을 유지하고, 고객을 유지하기 위해 관세 비용을 일시적으로 부담한다. 기존 재고나 공급 계약도 가격 상승을 일시적으로 억제할 수 있다. 하지만 관세가 계속 유지되면 물가 상승 가능성이 커진다. 기업들은 결국 수입품 가격 상승분을 전가하게",2025-10-16,https://www.seoul.co.kr/news/international/USA-amrica/2025/10/16/20251016008004,서울신문
"‘19금 챗GPT’ 풀린다, AI 윤리·규제 논란 확산 [INTO]",https://img.seoul.co.kr/img/upload/2025/10/15/SSC_20251015181510_N1.jpg.webp,"올트먼 CEO “콘텐츠 범위 확대 성인 인증하면 성애물까지 생성” 유료 구독자 늘려 수익 향상 전략 캘리포니아주 아동·청소년 대상 내년부터 AI 챗봇 사용 제한 시행 한국은 AI 콘텐츠 규제 사각지대 2024년 2월 미국 플로리다주에서 방에 틀어박혀 지내던 14세 소년 슈얼 세처가 스스로 세상을 등졌다. 그는 생전 상담 치료에서 불안장애 등을 진단받았지만 비극적 선택을 할 것이라고 예측한 주변인은 아무도 없었다. 세처의 부모는 사후에야 그가 방에서 인공지능(AI) 챗봇(캐릭터닷AI) 여자친구와 성적인 대화를 나누며 대부분의 시간을 보냈다는 사실을 알고 경악했다. TV 시리즈 ‘왕좌의 게임’ 속 캐릭터가 모델인 챗봇은 세처에게 “사랑한다. 가능한 한 빨리 내게 와 줘”라고 말했고, 얼마 지나지 않아 세처는 숨진 채 발견됐다. 글로벌 AI 서비스 업체들이 성적인 대화, 성애물 등 ‘19금(禁)’ 콘텐츠를 본격 허용하면서 미성년자 접근 제한, 자살·혐오 방지 등 AI 윤리·규제 논란이 한층 가열되고 있다. 미국은 연방정부와 개별 주정부들이 각각 규제 법안을 내놓고 있는 반면 한국은 AI 콘텐츠가 규제 사각지대에 방치돼 있어 대책 마련이 시급한 것으로 지적된",2025-10-16,https://www.seoul.co.kr/news/international/2025/10/16/20251016002002,서울신문
닭벼슬 주름에 대머리…타임지 표지 사진에 트럼프 분노,https://img.seoul.co.kr/img/upload/2025/10/15/SSC_20251015174011_N1.png.webp,"도널드 트럼프 대통령이 미국을 대표하는 시사잡지 타임의 표지에 실린 자기 얼굴 사진이 맘에 들지 않는다며 불평했다. 기사 내용은 트럼프 대통령의 팔레스타인 가자지구 평화 협상 중재를 칭송하는 것이지만, 사진 각도가 최악이라며 비판했다. 트럼프 대통령은 14일(현지시간) 자신의 소셜미디어 트루스소셜에 “도대체 무슨 생각으로 이런 사진을 쓴 거지?”라며 공개 비판하는 글을 올렸다. 타임지의 기사 내용은 비교적 괜찮지만 사진은 역대 최악이라며 “머리카락이 지워졌고 머리 위에 왕관이 떠다니는 것처럼 보이지만 너무 작다”고 지적했다. 이어 “정말 이상하다”면서 자신은 아래에서 찍는 사진 각도를 좋아하지 않는다며 타임지의 표지 사진은 비판받아 마땅하다고 강조했다. 다음 달 10일 자로 발간되는 타임지의 표지는 햇살 아래 서 있는 트럼프 대통령의 모습으로 넥타이에 졸린 목주름이 두드러져 닭 볏처럼 보인다. 게다가 머리카락은 거의 투명해서 마치 대머리처럼 찍혔다. 이번 사진은 지난 5일 백악관에서 촬영한 것인데, 이례적으로 러시아도 트럼프 대통령 편을 들었다. 마리야 자하로바 러시아 외무부 대변인은 소셜미디어를 통해 “어디가 아프거나 악의, 증오로 가득 찬 사람만",2025-10-15,https://www.seoul.co.kr/news/international/2025/10/15/20251015500246,서울신문
‘시각장애인’이 멀쩡히 눈 떴다…수억원 복지혜택 토해낸 伊 70대,https://img.seoul.co.kr/img/upload/2025/10/15/SSC_20251015172736_N1.jpg.webp,"이탈리아의 한 시각장애인 남성이 국가를 상대로 거액을 편취한 혐의로 고발당했다. 50년 동안 시각장애인으로 살면서 십수억원에 달하는 복지 혜택을 누렸는데, 당국의 조사 결과 ‘가짜 장애인’이었음이 드러나면서다. 14일(현지시간) 일 마테오 등 이탈리아 언론에 따르면 이탈리아 비센차 주 검찰은 70세 남성 A씨에 대해 국가를 상대로 사기를 저지른 혐의로 기소했다. 검찰에 따르면 A씨는 1972년부터 ‘완전 실명’ 상태의 시각장애인으로 등록돼 연금과 생활 수당 등 장애인으로서의 복지 혜택을 받았다. 그가 50년간 받아온 복지 혜택은 100만 유로(16억 5000만원)에 달했다. 그러나 당국은 복지 수급자 관련 데이터를 분석하는 과정에서 A씨에 대해 수상한 점을 발견하고, 경찰은 A씨를 상대로 두 달 동안 감시에 나섰다. 경찰의 관찰 과정에서 A씨는 시각장애인으로서는 불가능한 생활을 하고 있었다. 날렵한 도구를 사용해 자신의 정원을 세심하게 가꾸는가 하면, 다른 사람의 도움 없이 시장을 돌아다니며 직접 과일을 살피고 현금을 건네 구입하기도 했다. 경찰은 A씨를 ‘국가 상대 사기’ 혐의로 고발했고 당국은 A씨에 대한 모든 보조금과 연금을 동결했다. 이어 세무조",2025-10-16,https://www.seoul.co.kr/news/international/europe/2025/10/15/20251015500238,서울신문
"3년간 증발한 억대 레인지로버, 6800㎞ 밖 ‘신호’ 터졌다…벤틀리 이어 또",https://img.seoul.co.kr/img/upload/2025/10/15/SSC_20251015161924_N1.jpg.webp,"영국에서 사라진 고급 스포츠유틸리티차(SUV)가 3년 만에 6800㎞ 떨어진 파키스탄에서 위치 신호를 보내왔다. 인터폴은 파키스탄 경찰에 도난 차량 추적 지원을 요청했다. 14일(현지시간) 영국 인디펜던트 등 외신에 따르면, 2022년 11월 영국 북부 요크셔주 해러게이트에서 도난당한 검은색 레인지로버가 파키스탄 카라치에서 최근 발견됐다. 앞서 이 차량은 인터폴의 글로벌 도난 차량 데이터베이스에 등록돼 있었다. 차량에 장착된 원격 정보 시스템이 지난 2월 카라치 사다르 지역에서 위치 신호를 보내면서 소재가 확인됐다. 차량의 원래 주인은 아직 알려지지 않았다. 파키스탄 인터폴 국가중앙사무국은 영국 당국으로부터 도난 차량 추적 협조 요청을 받았다고 밝혔다. 카라치 경찰 차량절도방지팀을 이끄는 암자드 아메드 샤이크 경감은 “인터폴로부터 영국에서 도난당한 차량 회수 지원 요청 서한을 받았다”며 “최신 위치 정보를 받는 즉시 조치에 나서 차량을 회수할 것”이라고 덧붙였다. 영국에서 도난당한 고급 차량이 파키스탄에서 발견된 사례는 이번이 처음이 아니다. 2022년에는 런던에서 사라진 20만 파운드(약 3억 8000만원) 상당의 벤틀리가 카라치에서 발견됐다. 당시",2025-10-15,https://www.seoul.co.kr/news/international/2025/10/15/20251015500201,서울신문
"‘캄보디아 노예’ 배후, 87년생 천즈의 프린스그룹…美도 별렀다",https://img.seoul.co.kr/img/upload/2025/10/15/SSC_20251015161436_N1.jpg.webp,"캄보디아 내 한국인 대상 범죄의 배후로 ‘프린스 그룹’(Prince Group)이 거론되는 가운데, 미국과 영국도 유사 피해 사례를 감지하고 해당 조직에 대한 제재를 감행했다. 14일(현지시간) 미국과 영국 정부는 캄보디아 등지를 근거지로 삼아 활동하며 전 세계 피해자들의 돈을 뜯어내고 인신매매한 노동자들을 고문하는 불법 스캠(사기)센터를 운영해온 조직을 제재했다고 밝혔다. 한국 젊은이들을 캄보디아로 유인해 감금한 뒤 자신들의 범죄에 동원하고, 고문·살해까지 한 일당의 범죄와 피해 실태가 충격파를 던진 가운데, 미국과 영국도 유사한 조직에 주목하고 있었던 사실이 드러난 것이다. 제재 대상은 프린스 그룹과 회장 천즈다. 영국 정부 성명에 따르면 프린스 그룹은 캄보디아 등지에서 카지노와 스캠센터용 단지를 건설하고 대리인을 통해 운영에 관여하고 있다. 1987년 중국에서 태어난 천즈는 빠르게 부를 축적하며 캄보디아에서 정치적 영향력을 행사했다. 이후 키프로스와 바누아투 시민권을 사들인 것으로 추정된다. 프린스 그룹과 연계된 레저·엔터테인먼트 사업을 하는 ‘진베이 그룹’, 진베이·프린스 그룹과 연계된 암호화폐 플랫폼 ‘바이엑스 거래소’도 제재 대상이다. 영",2025-10-15,https://www.seoul.co.kr/news/international/2025/10/15/20251015500197,서울신문
"“3분만 기다리세요”…대만 편의점 직원, 韓 손님 결제 막은 사연은",https://img.seoul.co.kr/img/upload/2025/10/15/SSC_20251015161418_N1.png.webp,"대만을 방문한 한 한국인이 편의점에서 직원과 3분간 대치한 유쾌한 사연으로 화제를 모았다. 14일 CTS, 미러미디어 등 대만의 여러 매체는 현지 편의점을 방문한 한 한국인 손님이 직원 덕분에 할인된 가격으로 물건을 구매하게 된 사연을 소개했다. 지난 12일 한 한국인 네티즌은 소셜미디어(SNS)에 “대만 편의점 아르바이트생이랑 마주 보고 대치 중”이라고 시작하는 글을 올렸다. 작성자는 “이유는 모르겠는데 3분만 기다리면 이 샐러드는 할인이라고 해서 ‘알았다’고 하고 멍하니 서로 마주 보고 3분 동안 기다리는 중인데 뭔가 웃기고 어색하다”라고 적었다. 작성자가 글과 함께 올린 사진에는 점원이 계산대 위 샐러드에 오른손을 올린 모습이 담겼다. 대만 편의점은 음식 쓰레기를 줄이기 위해 유통기한이 임박한 일부 신선 식품을 시간대에 따라 할인율을 달리 적용해 판매하고 있다. 이 게시물은 SNS에서 화제가 되며 15일 기준 ‘좋아요’ 6만 5000회 이상을 기록했다. 국내 네티즌들은 “착한 직원이다”, “보통 바로 계산하고 할인 신경 안 쓰는데 이 직원은 친절한 것 같다”, “기억에 남는 경험일 것 같다”, “이런 간섭은 좋다” 등의 반응을 보였다. 대만 네티",2025-10-15,https://www.seoul.co.kr/news/international/asia-oceania/2025/10/15/20251015500195,서울신문
"‘억대 지참금’ 20대女와 결혼한 70대, 알고보니 사기?…인도네시아 ‘시끌’",https://img.seoul.co.kr/img/upload/2025/08/21/SSC_20250821135136_N1.png.webp,"인도네시아에서 70대 노인이 20대 여성과 결혼하며 2억원이 넘는 지참금을 전달해 화제가 됐다. 그런데 지참금으로 건넨 수표을 둘러싼 의혹이 제기되자 경찰이 수사에 착수했고, 네티즌과 현지 언론은 노인의 과거 이력을 ‘파묘’하기 시작했다. 15일 CNN 인도네시아와 롬복 포스트 등에 따르면 지난 8일 인도네시아 동자바 주 파시탄의 한 마을에서 음바 타르만(74)과 셸라 아리카(24)가 결혼식을 올렸다. 이들의 결혼식 영상과 사진은 소셜미디어(SNS)에서 화제를 모았다. 네티즌이 주목한 건 타르만이 신부 측에 건넨 지참금 액수였다. 부부는 결혼식 도중 타르만이 지참금으로 건네기로 한 수표를 들어보였는데, 수표에는 무려 30억 루피아(2억 5000만원)가 기재돼 있었다. 또한 타르만이 지참금 명목으로 5000만원에 달하는 도요타 캠리를 전달할 것이라는 사실도 이목을 끌었다. 50살의 나이 차를 뛰어넘은 ‘세기의 결혼’은 뜻밖에도 SNS에서 구설수에 올랐다. 네티즌들은 결혼식에 등장한 수표가 위조된 가짜 수표라는 의혹을 제기했다. 현지 경찰은 부부가 수표를 현금화해 지난 10일 신부의 가족에게 입금할 예정이었지만 어떤 이유에서인지 입금이 되지 않았다고 보도했다",2025-10-15,https://www.seoul.co.kr/news/international/asia-oceania/2025/10/15/20251015500192,서울신문
캄보디아 국제사기 주도한 중국인 천즈 회장…“40년 총리의 고문”,https://img.seoul.co.kr/img/upload/2025/10/15/SSC_20251015160507_N1.png.webp,"중국 범죄조직에 의한 국제 사기의 중심지가 된 캄보디아 사태에 미국과 영국도 제재에 나섰다. 미국 법무부는 14일(현지시간) 캄보디아에 본사를 둔 프린스 그룹 설립자 천즈(38·일명 빈센트) 회장을 송금 사기 및 자금 세탁 공모 혐의로 기소했다. 프린스 그룹은 캄보디아 전역에 강제 노동 시설을 운영하며 ‘돼지 도살’로 알려진 암호화폐 투자 사기를 벌여 미국과 전 세계 피해자들로부터 수십억 달러를 탈취했다. 미 검찰은 12만개 이상의 비트코인(현재가치 약 21조원)을 몰수하기 위한 민사 소송도 제기했는데 법무부 역사상 최대 규모의 몰수 소송이다. 현재 도주 중인 천 회장은 2015년부터 30개국 이상에서 대외적으로는 부동산 개발, 금융 서비스 등의 사업을 벌였다. 하지만 비밀리에 프린스 그룹을 아시아 최대 규모의 초국적 범죄 조직 중 하나로 키워 캄보디아 전역에서 투자 사기 조직을 운영했다. 프린스 그룹의 사기는 미국을 포함한 전 세계를 대상으로 이뤄졌으며 미국에서도 250명 이상이 수백만 달러의 사기 피해를 당했다. 중국 푸젠성에서 태어난 천 회장은 푸저우에서 인터넷 카페를 운영하는 첫 사업을 시작한 뒤 캄보디아로 이주해 허름한 해안 휴양지 시아누크빌을",2025-10-15,https://www.seoul.co.kr/news/international/2025/10/15/20251015500188,서울신문
포켓몬 카드 들고 입국하다 세관 끌려간 남성… 싱가포르 당국 “몽땅 잡고 말겠어!”,https://img.seoul.co.kr/img/upload/2025/10/15/SSC_20251015155550_N1.png.webp,"수천만원 상당의 포켓몬 트레이딩 카드를 소지한 채 싱가포르에 입국하던 남성이 자진 신고를 하지 않아 세관 조사를 받았다고 14일(현지시간) 스트레이츠타임스 등이 전했다. 싱가포르 출입국관리국(ICA)은 이날 공식 소셜미디어(SNS)를 통해 “지난 10일 싱가포르 창이공항 1터미널 ICA 담당자들이 수하물 검사 중 대량의 포켓몬 트레이딩 카드를 적발했다”고 밝혔다. 해당 카드의 주인인 25세 싱가포르 남성은 수하물 심사장에서 “신고할 것이 있냐”는 ICA 직원의 질문에 “없다”고 답헀으나, 남성의 수하물을 검사한 결과 총 3만 싱가포르달러(약 3300만원) 이상의 가치가 있는 포켓몬 트레이딩 카드가 발견됐다고 ICA는 설명했다. ICA는 이같은 사실을 알리는 SNS 글에 ‘몽땅 잡고 말겠어!’(Gotta catch them all!)라는 제목을 붙였다. 이는 ‘포켓몬스터’ 1세대 애니메이션 북미판 주제가 후렴구를 인용한 표현이다. 포켓몬 카드는 전 세계적인 수집 열풍에 힘입어 희귀 카드의 경우 수억원대에 거래되기도 한다. 스트레이츠타임스는 “최근 포켓몬 카드가 고수익을 추구하는 젊은 투자자들 사이에서 인기가 높다”며 “분석회사 ‘카드 래더’에 따르면",2025-10-15,https://www.seoul.co.kr/news/international/asia-oceania/2025/10/15/20251015500181,서울신문
결국 “초밥 전량 폐기” 사태…‘만지고 핥고’ 일본인들 왜이러나 [이런 日이],https://img.seoul.co.kr/img/upload/2025/10/15/SSC_20251015144917_N1.png.webp,"2023년 이른바 ‘초밥테러’로 골머리를 앓던 일본 회전초밥 업체들이 이를 방지하기 위해 여러 대책을 내놓았지만, 피해는 이어지고 있다. 최근에는 여학생들이 회전대 위에 진열된 회전초밥에 침을 묻히거나, 간장병에 직접 입을 갖다 대는 영상을 올려 공분을 샀다. 15일 니혼게이자이신문(닛케이) 등에 따르면 일본 대형 회전초밥 체인인 쿠라스시는 전날 “야마가타 미나미다테점에서 손님이 회전대 위의 초밥에 손을 대는 등의 민폐 행위를 한 사실이 확인됐다”고 밝혔다. 앞서 지난 11일 엑스(X) 등 소셜미디어(SNS)에서는 쿠라스시에 방문한 한 여학생이 회전대 위에 놓인 초밥을 맨손으로 만지는 영상이 올라와 논란이 일었다. 이 학생은 초밥 접시의 뚜껑을 일부러 열더니 초밥을 여러 차례 만지고는 그대로 뚜껑을 닫았다. 이런 사실을 모른 다른 손님이 만져진 초밥을 먹을 수도 있는 상황이었다. 또 다른 영상에는 공동으로 사용하는 간장을 간장병째로 입에 털어넣는 모습도 담겼다. 이 학생은 간장병 입구를 혀로 핥기도 했다. 쿠라스시는 사태를 파악한 직후 해당 점포의 회전대 위 모든 초밥을 교체했으며, 간장·고추냉이 등 공동 조미료 용기도 소독했다고 설명했다. 현재 해당",2025-10-15,https://www.seoul.co.kr/news/international/japan/2025/10/15/20251015500147,서울신문
유부남 애인 ‘중요부위’ 자른 내연녀 체포…‘충격 이유’ 있었다,https://img.seoul.co.kr/img/upload/2025/10/02/SSC_20251002171350_N1.jpg.webp,"말레이시아에서 한 30대 여성이 유부남 애인이 이혼하지 않았다는 이유로 애인의 성기를 자른 충격적인 일이 발생했다. 14일(현지시간) 더스타 등 현지 매체에 따르면 말레이시아 조호르바루 경찰은 지난 8일 오후 방글라데시 국적의 A(34)씨를 체포했다. A씨는 같은 국적인 남자친구 B(33)씨의 성기를 자르고 왼손에 심각한 상처를 입힌 혐의를 받고 있다. B씨는 치료를 위해 병원으로 이송된 것으로 알려졌다. 앞서 경찰은 B씨의 친구로부터 신고 전화를 받고 출동해 A씨를 체포했다. 경찰은 범행에 사용된 것으로 추정되는 길이 29㎝의 칼도 압수했다. A씨는 이후 진행된 마약 검사에서 음성 반응을 보였으며, 범죄 전력은 없던 것으로 전해졌다. 경찰 조사 결과 A씨가 B씨를 공격한 이유는 질투심 때문이었다. 경찰은 “A씨는 B씨가 자신과 연인 관계를 유지하면서도 방글라데시에 있는 아내와 이혼하지 않았다는 사실을 알게 됐다”고 전했다.",2025-10-15,https://www.seoul.co.kr/news/international/2025/10/15/20251015500143,서울신문
"美 유명 모델 출시한 ‘그 부위’ 가짜 털 속옷…혼돈의 SNS, 근데 벌써 품절?",https://img.seoul.co.kr/img/upload/2023/04/27/SSC_20230427105916_N1.jpg.webp,"미국의 유명 모델 킴 카다시안의 속옷 브랜드 스킴스가 가짜 털이 달린 속옷을 출시해 논란이 되고 있다. 32달러(약 4만 6000원)짜리 이 기괴한 제품은 소셜미디어(SNS)에서 “신고하겠다”는 반응을 얻었지만, 벌써 12가지 디자인이 모두 동났다. 15일(현지시간) 인디펜던트, 피플지 등 외신 보도에 따르면, 카다시안의 속옷 브랜드 스킴스는 ‘얼티밋 부시’라는 이름의 인조 음모 속옷을 출시했다. 스킴스는 속옷의 한계를 시험하는 것으로 유명한 브랜드다. 약 2년 전에는 가짜 젖꼭지가 달린 브래지어를 내놓기도 했다. 더 나아가 이번에는 가짜 음모가 달린 속옷을 선보인 것이다. 새 제품을 홍보하기 위해 스킴스는 지난 14일 복고풍 게임쇼 콘셉트의 영상을 올렸다. 영상에서는 ‘카펫이 커튼과 색이 같을까?’라는 질문이 나왔다. 이 제품이 여러 색상의 가짜 털을 제공하기 때문에 머리 색깔에 맞추거나 전혀 다른 색을 고를 수 있다는 점을 장난스럽게 표현한 것이다. 영상은 시청자들에게 강렬한 인상을 남겼다. 일부 SNS 사용자들은 눈을 의심했다. “만우절이 아닌지 확인하려고 날짜를 검색했다”는 댓글이 달렸고, “911에 전화하겠다”는 반응도 나왔다. 신고할 정",2025-10-15,https://www.seoul.co.kr/news/international/2025/10/15/20251015500123,서울신문
"한국, 세계 여권 파워 2위…미국은 최초로 10위권 밖으로",https://img.seoul.co.kr/img/upload/2025/10/15/SSC_20251015130202_N1.jpg.webp,"대한민국의 여권 파워가 세계 2위로 올라선 반면, 미국 여권 순위는 사상 처음 10위권 밖으로 밀려났다. 14일(현지시간) 미국 CNN는 헨리앤파트너스가 발표한 여권 파워 순위를 보도했다. 세계 여권 파워 순위 1~3위는 모두 아시아 국가가 가져갔다. 1위인 싱가포르는 193개국에 비자 없이 입국할 수 있다. 2위인 한국은 190개국, 3위인 일본은 189개국의 무비자 입국이 가능하다. 4위는 188개국인 독일, 이탈리아, 룩셈부르크, 스페인, 스위스가 차지했다. 5위에는 187개국의 오스트리아, 벨기에, 덴마크, 핀란드, 프랑스, 아일랜드, 네덜란드가 올랐다. 특히 미국은 여권 파워를 측정해 온 20년 역사상 최초로 10위권 아래인 12위에 그쳤다. 미국의 무이자 입국 가능국 수는 180개국으로 말레이시아와 동률이다. 크리스티안 캘린 헨리앤파트너스 회장은 “미국 여권 파워가 지난 10년간 하락한 것은 단순한 순위 변동 이상의 의미가 있다”며 “이는 글로벌 이동성과 소프트 파워 역학의 근본적인 변화를 보여준다”고 말했다. 헨리 여권 파워 지수는 국제항공운송기구(IATA) 데이터를 기반으로 해당국 여권 소지자가 비자 없이 방문할 수 있는 국가의 수를 기",2025-10-15,https://www.seoul.co.kr/news/international/topic-global/2025/10/15/20251015500114,서울신문
