title,thumbnail,short_content,write_time,link,company
"지상군 투입 않고 이란 흔드나… 美, 쿠르드 무장세력 지원 검토",,"도널드 트럼프 미국 대통령이 이란·이라크 내 쿠르드 무장 세력을 지원하는 방안을 검토 중인 것으로 알려졌다. 미 지상군을 직접 투입하는 대신 쿠르드족에 무기를 지원해 이란 정권을 압박하거나 붕괴를 유도하려는 구상으로 풀이된다. 3일(현지시간) CNN 등에 따르면 트럼프 대통령은 대이란 공습 다음날인 지난 1일 쿠르드족 지도자들과 통화하는 등 접촉을 이어 갔다. 미 중앙정보국(CIA)도 현지에서 군사 지원 방안을 논의 중인 것으로 알려졌다. 다만 월스트리트저널(WSJ)은 트럼프 대통령이 아직 최종 결정을 내리지 않았다고 보도했다. 쿠르드족은 오스만제국 해체 이후 독립국가를 세우지 못한 채 이란·이라크·튀르키예·시리아 등에 흩어져 살고 있는 소수 민족이다. 이란 내 쿠르드족은 오랜 기간 정부의 탄압을 받아 왔으며, 현재 반정부 진영의 핵심 세력 가운데 하나로 꼽힌다. 미 정부 관계자는 CNN에 “쿠르드 무장 세력이 움직일 경우 이란 내부에 혼란을 일으키고 군사력을 분산시키는 효과가 있다”며 “이란 북부 일부 지역을 장악해 이스라엘에 유리한 완충지대를 조성하는 방안도 논의되고 있다”고 밝혔다. 트럼프 행정부가 쿠르드족과의 접촉을 늘리는 배경에는 이란 정권 교체를",2026-03-05,https://www.seoul.co.kr/news/international/USA-amrica/2026/03/05/20260305004001,서울신문
"코스피 ‘패닉셀’… 9·11 때보다 더 빠졌다, 주가·환율·유가 ‘트리플 쇼크’",https://img.seoul.co.kr/img/upload/2026/03/04/SSC_20260304172548_N1.jpg.webp,코스피 12% 급락… 이틀 새 시총 800조원 증발 환율 장중 1500원 터치… 외환시장도 요동 브렌트유 81달러 돌파… 유가 상승 압력 확대 원유 의존·수출 중심에 한국 시장 충격 확대 이란 사태가 장기화될 조짐을 보이면서 주가·환율·유가가 동시에 흔들리는 이른바 ‘트리플 쇼크’가 현실화됐다. 특히 중동 원유 의존도가 높고 수출 비중이 큰 한국 경제 구조상 글로벌 충격이 크게 반영됐다는 분석이 나온다. 최근 한국 증시가 가파른 상승세를 이어온 만큼 시장 변동성에 더 취약해졌다는 평가도 있다. 이번 사태가 금융시장 불안을 넘어 실물경제에도 부담으로 이어질 수 있다는 우려가 제기된다. 4일 코스피는 전일 대비 698.37포인트(12.06%) 급락한 5093.54에 거래를 마쳤다. 장중 한때 5059.45(-12.65%)까지 밀리며 2001년 9·11 테러 직후 기록했던 12.02% 하락률을 넘어서는 사상 최대 낙폭을 기록했다. 지난달 말 6300선을 돌파했던 지수가 이틀 만에 1000포인트 이상 증발한 것이다. 이 기간 코스피 시가총액도 5146조 3731억원에서 4328조 7682억원으로 800조원 넘게 쪼그라들었다. 오전 중 코스피와 코스닥 시장에서는,2026-03-04,https://www.seoul.co.kr/news/economy/finance/2026/03/04/20260304500270,서울신문
‘이란 사태’ 장기화 가능성에 커지는 ‘국제법 무용론’,https://img.seoul.co.kr/img/upload/2026/03/04/SSC_20260304161533_N1.jpg.webp,"미국·이스라엘의 이란 공습에 대한 국제법 위반 논란이 커지고 있다. 국제기구의 성명 발표 등 반대 움직임이 실질적인 확전 차단으로 이어지진 못하면서 국제법 및 조약이 분쟁 해결 능력을 상실했다는 ‘무용론’도 제기된다. 4일 법조계 등에 따르면 이번 이란 공습은 국제법상 자위권의 범위를 넘어서는 선제 공격인 데다, 전시에도 민간인 보호가 이뤄져야 한다는 국제인도법상 규정이 지켜지지 않았다는 점에서 위법 가능성이 높다는 분석이다. 이와 관련 도널드 트럼프 미국 대통령은 전날 “이란이 먼저 공격하려는 정황을 확신해 선제공격을 했다”는 취지로 주장했다. 그러나 현재까지 드러난 사실 관계에 따르면 이란이 먼저 무력 공격을 시도했단 징후가 확인되지 않은 만큼 트럼프의 주장에 신빙성이 낮다는 시각이 지배적이다. 소병천 아주대 법학전문대학원 교수는 “상대방의 선제공격이 있거나, 예외적으로 상대방의 공격이 임박했다는 구체적인 증거가 있거나 예상되는 공격 규모가 자국의 자위권을 파괴할 정도라는 정황이 명확할 경우에만 국제법상 자위권이 인정된다”면서 “(트럼프의 주장은) 예방적 자위권을 행사했다는 논리로 공격을 정당화하려는 시도로 읽힌다”고 설명했다. 위법성이 입증된다 하더",2026-03-04,https://www.seoul.co.kr/news/society/2026/03/04/20260304500226,서울신문
‘이란 선제공격설’ 내세우며 명분 쌓는 트럼프 “호르무즈 선박 호위할 것”,https://img.seoul.co.kr/img/upload/2026/03/04/SSC_20260304154744_N1.jpg.webp,"이란의 암살 시도설도 제기...美 국무는 이스라엘 언급했다가 철회 마가 진영에서도 부정적 여론...“미국 우선주의에 부합하지 않아” 이스라엘과 함께 이란에 나흘째 공습을 가한 도널드 트럼프 미국 대통령이 연일 이란의 ‘선제공격설’ 등을 내세우며 명분 쌓기에 나서고 있다. 하지만 이를 뒷받침할 구체적인 근거가 제시되지 않고 있는 데다 이스라엘에 이끌려 이란을 타격한 것 아니냐는 지적이 나오자 여론전을 펼친 것으로 보인다. 트럼프 대통령은 이란이 호르무즈 해협 통과 선박을 공격하겠다고 위협한 것에 대해선 미 해군이 호위하겠다며 시장의 불안감을 안정시키기에 나섰다. 트럼프 대통령은 3일(현지시간) 백악관에서 취재진과 만나 “우리는 미치광이들(이란)과 협상하고 있었는데, 그들이 먼저 공격할 것이라고 봤다”며 “그들은 (미국을) 공격할 참이었다. 우리가 하지 않았다면 그들이 먼저 공격했을 것”이라고 말했다. 트럼프 대통령은 지난달 28일 대국민 영상연설에서도 이란의 ‘임박한 위협’을 제거하기 위해 공습을 단행했다고 밝혔고, 지난 1일 ABC 방송과의 인터뷰에선 이란이 자신에 대한 암살을 시도했다는 취지의 주장도 펼쳤다. 하지만 미 정보기관은 앞서 의회를 상",2026-03-04,https://www.seoul.co.kr/news/international/2026/03/04/20260304500212,서울신문
중국 “이란에 대한 군사 작전 당장 중단되어야”,https://img.seoul.co.kr/img/upload/2026/03/04/SSC_20260304145851_N1.png.webp,"중국 최대 정치행사인 양회가 4일 베이징 인민대회당에서 시작된 가운데 한국의 국회 격인 전국인민대표대회(전인대)는 이란에 대한 군사행동 중단을 요청했다. 8일 일정으로 막올린 올해 양회에서 중국의 전략 파트너이자 중요 석유 공급원인 베네수엘라와 이란을 미국이 잇따라 타격한 데 대한 대외 메시지에 세계의 관심이 쏠렸다. 양회 개막과 함께 열린 기자회견에서 러우친젠 전인대 대변인은 “중국은 이란 사태를 주시하고 있다”며 “이란 주권과 안보는 존중받아야 하고 군사 작전은 당장 중단되어야 한다”며 책임있는 대국의 역할을 다할 것이라고 강조했다. 러 대변인은 “중국은 일관되게 크고 작은 국가가 서로 존중하고, 모두가 평등해야 한다고 주장해 왔다”면서 “어떤 국가도 국제 문제를 좌지우지하거나 타국의 운명을 지배하거나 발전의 이점을 독점할 권리가 없으며, 제멋대로 행동해서는 안 된다”고 주장했다. 그는 미중관계에 대해서는 양국이 서로 존중해야 한다며 “미국과 모든 수준과 채널에서 소통을 강화할 것”이라고 밝혔다. 이는 왕이 중국 공산당 중앙정치국 위원 겸 외교부장이 2일 아바스 아라그치 이란 외교장관과의 통화에서 말한 것과 동일한 내용이다.",2026-03-04,https://www.seoul.co.kr/news/international/2026/03/04/20260304500185,서울신문
주스 대신 ‘살충제 음료’ 건넨 호주 식당…“4100만원 벌금 내라” 판결,https://img.seoul.co.kr/img/upload/2026/03/04/SSC_20260304145401_N1.jpg.webp,"호주의 한 레스토랑이 어린이 손님에게 크랜베리 주스 대신 살충제 성분이 든 오일을 제공했다가 4000만원대 벌금을 물게 됐다. 아이들은 음료를 마신 뒤 병원 치료를 받았고, 이 식당 전 대표는 법원에서 유죄 판결을 받았다. 3일(현지시간) 현지 공영 ABC방송에 따르면, 2024년 6월 호주 퍼스 크롤리 지역의 한 이탈리안 레스토랑에서 부모와 함께 저녁 식사를 하던 자매 해나 레민(12)과 올리비아 레민(11)이 크랜베리 주스를 주문했다가 바텐더가 실수로 내온 분홍빛 시트로넬라 오일 용액을 마시는 사건이 발생했다. 시트로넬라는 모기 등 해충을 쫓는 방충 성분으로, 야외용 램프나 횃불 등에 쓰이는 물질이다. 두 자매는 음료를 한 모금 머금자마자 “독 맛이 난다”고 말했다. 어머니 미셸 레민은 “딸들이 크랜베리 주스를 꿀꺽 삼키려다 뱉으면서 ‘독이 든 것 같아’라고 했다”며 “설마 하고 내가 직접 마셔봤다가 나도 뱉어냈다”고 당시 상황을 전했다. 아버지 마커스 레민은 이상한 냄새를 맡고 카운터로 달려가 음료 병을 보여달라고 요구했다. 그러나 직원은 처음에 “오래된 크랜베리 주스일 뿐”이라며 버텼고, 병을 카운터 아래에 숨기기까지 했다. 마커스가 강하게 항의",2026-03-04,https://www.seoul.co.kr/news/international/2026/03/04/20260304500181,서울신문
“美 CIA 쿠르드족 이란 서부 공격 지원할듯”,https://img.seoul.co.kr/img/upload/2026/03/04/SSC_20260304133949_N1.jpg.webp,"이란 쿠르드족 민병대가 최근 며칠간 이란 서부 지역에서 이란 보안군을 공격할지 여부와 방법에 대해 미국과 협의했다는 보도가 나왔다. 미 중앙정보국(CIA)이 이란에서 민중 봉기를 촉발하기 위해 쿠르드족 군대에 무기를 공급하는 작업을 진행 중이라고 이 계획에 정통한 다수의 관계자가 3일(현지시간) 전했다고 CNN이 보도했다. 트럼프 행정부는 이란 반정부 단체와 이라크 내 쿠르드족 지도자들과 군사적 지원을 제공하는 방안에 대해 활발히 논의해 왔다고 소식통들은 전했다. 이란 이슬람 혁명수비대(IRGC)는 개전 이후 쿠르드족 단체들을 공격해왔고, 이날 수십 대의 드론을 동원해 쿠르드족 세력을 표적으로 삼았다고 밝혔다. 또한 도널드 트럼프 미국 대통령이 이란쿠르드민주당(KDPI)의 무스타파 히즈리 대표와 통화했다고 이란 쿠르드계 고위 관계자가 CNN에 전했다. KDPI는 이란 혁명수비대(IRGC)의 표적이 된 단체 중 하나다. 이란 쿠르드족 고위 관리는 CNN에 “이란 쿠르드족 반군 세력이 앞으로 며칠 내로 서부 이란에서 지상 작전에 참여할 것으로 예상된다”고 전했다. 그는 “지금이 큰 기회라고 믿는다”며 “민병대가 미국과 이스라엘의 지원을 기대하고 있다”고 덧붙",2026-03-04,https://www.seoul.co.kr/news/international/2026/03/04/20260304500150,서울신문
"“네타냐후, 공격 5일 전 트럼프에 전화해 하메네이 회동 장소 미리 알려줬다”",https://img.seoul.co.kr/img/upload/2026/03/04/SSC_20260304125306_N1.jpg.webp,"베냐민 네타냐후 이스라엘 총리가 지난달 23일(현지시간) 도널드 트럼프 미국 대통령에게 직접 전화를 걸어 “아야톨라 알리 하메네이 이란 최고지도자가 28일 오전 테헤란에서 고위 보좌관들과 회동할 예정”이라고 사전에 알려줬고, 이로 인해 단일 타격으로 이란 수뇌부를 모두 제거할 수 있게 되었다는 보도가 나왔다. 미 정치전문매체 악시오스는 3일(현지시간) 해당 통화 내용을 브리핑받은 소식통을 인용해 “네타냐후와 트럼프가 나눈 23일 통화는 ‘중동을 바꾼 전화’였다”고 밝혔다. 그는 이후 트럼프 대통령은 이스라엘 군사정보국 아만의 제보를 조사하라고 미 중앙정보국(CIA)에 지시했으며, CIA가 이를 확인했다고 말했다. 악스오스가 인용한 미국 관리들에 따르면, 공격 준비가 진행되던 중 트럼프 대통령은 네타냐후 총리와의 통화 이튿날인 지난달 24일 예정된 국정연설에서 이란에 지나치게 초점을 맞추지 않기로 의도적인 결정을 내렸다고 한다. 이는 하메네이가 지하로 숨을 수 있다는 우려 때문이었다. 그리고 이틀 뒤인 지난달 26일 트럼프 행정부의 최고 특사들이 제네바에서 이란 협상가들과 만난 바로 그날, CIA는 이들이 모두 한자리에 모일 것임을 최종적으로 확인했으며,",2026-03-04,https://www.seoul.co.kr/news/international/2026/03/04/20260304500139,서울신문
“조국이 위협받아” ‘이란 손흥민’ 자진 군입대? 유럽 명문 구단 “가짜뉴스”,https://img.seoul.co.kr/img/upload/2026/03/04/SSC_20260304121206_N1.jpg.webp,포르투갈 리그에서 득점왕을 차지하고 이탈리아 명문 인터밀란에서 뛰기도 했던 이란의 축구 스타가 “조국이 위협받고 있다”며 군에 자진 입대하기로 했다는 보도가 나왔다. 그러나 소속사와 해당 선수의 에이전트는 ‘가짜뉴스’라고 일축했다. 3일(현지시간) 골닷컴 등 유럽 축구 전문 매체에 따르면 그리스 프로축구 수페르리가 엘라다의 명문 구단인 올림피아코스 FC 소속 메흐디 타레미(33)가 군입대를 결심했다는 보도에 대해 타레미의 에이전트가 “현실과 전혀 다른 발언이 유포되고 있다”고 밝혔다. 보도에 따르면 타레미의 에이전트는 자신의 소셜미디어(SNS)를 통해 “타레미는 소속 팀에서 자신의 일에 집중하고 있다”면서 “지금과 같이 민감한 시기에는 부정확한 뉴스를 피하는 것이 중요하다”라고 강조했다. 소속팀 역시 이러한 보도에 대해 사실 무근이라고 일축했다고 외신들은 전했다. 이러한 ‘가짜뉴스’의 진원지는 튀르키예와 그리스의 몇몇 언론이었다. 이들 매체는 “타레미가 구단 경영진에 고국으로 돌아가겠다는 의사를 전달했다”면서 이란 축구협회 관계자들이 그의 군 입대 결심을 만류하고 있다고 보도했다. 타레미가 자신의 측근들에게 “지금이 조국이 나를 가장 필요로 하는 순간이,2026-03-04,https://www.seoul.co.kr/news/international/middleeast-africa/2026/03/04/20260304500134,서울신문
트럼프 ‘군사 협조 거부’ 스페인에…“모든 무역 중단”,https://img.seoul.co.kr/img/upload/2026/03/03/SSC_20260303163444_N1.jpg.webp,"도널드 트럼프 미국 대통령이 이란과의 전쟁에 협력을 거부한 스페인에 무역 전면 중단을 위협했다. 로이터·블룸버그 통신에 따르면 트럼프 대통령은 3일(현지시간) 워싱턴DC 백악관에서 프리드리히 메르츠 독일 총리와 만난 자리에서 “우리는 스페인과의 모든 무역을 중단할 것”이라며 “우리는 스페인과 아무것도 하고 싶지 않다”고 말했다. 그는 “스콧(스콧 베선트 재무장관)에게 스페인과 모든 거래를 끊으라고 했다”며 “나에게 모든 스페인산 상품에 금수 조치를 내릴 권한이 있다”고 강조했다. 배석한 베선트 장관도 미 무역대표부(USTR)와 상무부에 스페인에 대한 제재 조치 검토를 지시하겠다고 전했다. 트럼프 대통령은 스페인이 미국의 이란 공격에 스페인 군기지 사용을 불허한 점과 스페인이 국내총생산(GDP)의 5%로 국방비를 증액하기로 한 북대서양조약기구(NATO·나토) 약속에 동참하지 않는다는 점을 지적했다. 미국과 이스라엘의 이란 공습과 관련, 페드로 산체스 스페인 정부는 이란에 대한 공격에 카디스의 로타 해군기지와 세비야의 모론 공군기지 사용을 차단했다. 이들 기지는 스페인에서 대서양 동맹 관계의 상징적 역할을 해온 곳이다. 마르가리타 로블레스 스페인 국방장관은",2026-03-04,https://www.seoul.co.kr/news/international/topic-global/2026/03/04/20260304500124,서울신문
"日 법원, 구 통일교 해산 명령…1조원대 자산 청산 돌입",https://img.seoul.co.kr/img/upload/2026/03/04/SSC_20260304113128_N1.jpg.webp,아베 피격 이후 4년…‘민법 불법행위’ 첫 종교법인 해산 일본 법원이 세계평화통일가정연합(옛 통일교)에 대한 해산 명령을 유지했다. 종교법인법상 해산 명령은 고등법원 판단으로 효력이 발생해 교단 자산 청산 절차가 시작된다. 도쿄고등법원은 4일 교단 해산을 명령한 도쿄지방법원 1심 결정을 유지하고 교단 측의 즉시항고를 기각했다. 지방법원은 교단이 1980년대 이후 40여년 동안 불법적인 헌금 권유를 통해 204억엔(약 1917억원) 규모의 피해를 발생시켰다고 인정했다. 법원은 “헌금 피해는 악질적이며 공공의 복리를 현저히 해친다”며 “해산은 필요하고 불가피하다”고 판단했다. 민법상 불법행위를 근거로 종교법인 해산을 명령한 것은 일본에서 처음이다. 교단은 최근 39억엔(약 360억원) 이상을 지급하는 등 피해 보상에 나섰다며 해산 사유가 없다고 주장했지만 받아들여지지 않았다. 해산 절차가 진행되면 교단이 보유한 약 1181억엔(1조 1108억원) 규모 자산은 청산 절차를 거쳐 헌금 피해자 배상 등에 사용될 것으로 보인다. 교단은 최고재판소에 불복 신청을 할 수 있다. 최고재판소가 판단을 뒤집으면 해산 절차는 중단된다. 다만 쟁점이 헌법 위반 여부가 될 가능,2026-03-04,https://www.seoul.co.kr/news/international/2026/03/04/20260304500117,서울신문
“이스라엘서 타란티노 사망” 소문 확산…측근 “살아있다”,https://img.seoul.co.kr/img/upload/2026/03/04/SSC_20260304111819_N1.jpg.webp,"미국과 이란 간 무력 충돌이 격화되는 가운데 할리우드 거장 쿠엔틴 타란티노 감독의 사망설이 온라인을 중심으로 확산했지만, 사실이 아닌 것으로 확인됐다. 2일(현지시간) 미국 연예전문매체 TMZ는 “타란티노 감독이 이스라엘에서 미사일 공격으로 사망했다는 소문은 모두 거짓”이라며 “그와 가족 모두 무사하다”고 보도했다. 감독 측근은 TMZ에 “쿠엔틴은 살아있고 건강하며 가족 역시 안전하다”고 밝혔다. 앞서 소셜미디어 엑스에는 ‘타란티노가 이란의 이스라엘 미사일 공격으로 사망했다’는 게시물이 올라왔다. 팔로워 약 15만명을 보유한 한 사용자가 미국 매체 데드라인을 출처로 언급하며 해당 내용을 확산시켰다. 그러나 데드라인 측은 “자사 보도를 오인한 것”이라며 “타란티노 사망설은 전혀 사실이 아니다”고 부인했다. 엑스에는 타란티노 감독이 이스라엘 방공호에 있는 모습이라는 설명이 붙은 이미지도 다수 게시됐다. 데드라인은 해당 이미지들이 인공지능(AI)으로 생성된 가짜라고 전했다. 타란티노는 이스라엘 출신 배우 겸 모델 다니엘라 픽과 결혼해 두 자녀를 두고 있다. 가족은 로스앤젤레스(LA)와 이스라엘을 오가며 생활하는 것으로 알려졌다. 그는 2023년 이스라엘-하",2026-03-04,https://www.seoul.co.kr/news/international/2026/03/04/20260304500107,서울신문
“샤넬백 자랑? 언제적 얘기냐”…‘누가 더 가난한지’ 경쟁하는 이 나라 청년들,https://img.seoul.co.kr/img/upload/2026/03/04/SSC_20260304095753_N1.jpg.webp,중국 청년층 사이에서 부를 자랑하는 대신 서로의 고충을 나누고 누가 더 싸게 물건을 샀는지 겨루는 ‘역비교’ 문화가 빠르게 번지고 있다. 치열한 경쟁 사회에서 살아남기 위한 자기방어적 태도라는 분석이 나오는 한편 이들의 의욕을 꺾을 수 있다는 우려도 제기된다. 홍콩 사우스차이나모닝포스트(SCMP)는 3일 중국 젊은 세대 사이에서 역비교 트렌드가 확산되고 있다고 보도했다. 이전 세대가 명품이나 고가 제품을 과시하며 성공을 드러내던 것과 달리 2000년대 전후에 태어난 Z세대는 최대한 저렴하게 물건을 사는 것을 자랑스럽게 여기는 분위기다. 소셜미디어(SNS)에는 이런 흐름을 보여주는 게시물이 줄을 잇고 있다. “룸메이트가 세탁 세제 두 봉지를 단돈 1펀(0.01위안)에 샀다는 말에 이틀 밤을 뒤척였다”는 글은 5만 2000개의 ‘좋아요’를 받았다. “친구가 A4 용지 100장을 단돈 0.99위안에 샀다는 걸 알고 절망감에 이를 악물었다”는 글에도 9000개의 ‘좋아요’가 달렸다. 대도시에서 월 3000위안(약 64만원)으로 생활하는 법을 공유하는 콘텐츠 역시 큰 인기를 끌고 있다. 절약 경쟁은 소비에만 그치지 않는다. 설 연휴에 고향을 찾은 젊은이들은 가,2026-03-04,https://www.seoul.co.kr/news/international/2026/03/04/20260304500055,서울신문
[포토] ‘폭격피해 탈출’ 이란 피란행렬,https://img.seoul.co.kr/img/upload/2026/03/04/SSI_20260304094054_N1.jpg.webp,"“어제 하루에만도 내가 살던 테헤란 지역에서 5∼6번의 큰 폭발을 느꼈어요. 더는 버티기 힘들 것 같아서 짐을 싸서 떠난 거예요.” 미국과 이스라엘이 이란을 공격해 무력 충돌이 발생한지 나흘째인 3일(현지시간). 이란 북서부 라지 마을을 통해 튀르키예 동쪽 끝 카프쾨이 검문소로 출국한 젊은 여성 파리나즈는 “탈 수 있는 버스가 여기로 오는 것 뿐이었다”며 이같이 말했다. 파리나즈는 “의사인 아버지가 병원에 남아 다친 사람들을 돌봐야 해서 가족이 함께 오지 못한 것이 걱정된다”고 말했다. 이날 카프쾨이 검문소에서는 끊이지 않는 폭격의 위험을 피해 피란길에 오른 이란 국민들과 일부 외국인들이 쉴 틈 없이 밀려나오고 있었다. 아침 최저기온이 영하 12도로 추운 날씨였지만 카프쾨이 검문소를 빠져나오는 이들 중에는 홑겹 겉옷만 이은 이들이 상당수였다. 다들 급박하게 거처를 떠나 피란길에 올랐을 터였다. 막 국경을 넘은 갓난아기가 유모차 안에서 칭얼대자 어머니로 보이는 여성이 이유식을 떠먹이며 달래는 모습도 보였다. 전날 튀르키예 당국이 여행객의 육로 출입국 전면 차단을 발표했지만, 얼마 지나지 않아 별다른 추가 공지 없이 통행이 재개됐다고 한다. 영국 BBC,",2026-03-04,https://www.seoul.co.kr/news/international/middleeast-africa/2026/03/04/20260304800001,서울신문
"“중동 전쟁 지속기간, 이란 미사일 비축량에 달려”",https://img.seoul.co.kr/img/upload/2026/03/04/SSC_20260304093606_N1.jpg.webp,"닷새째 계속되고 있는 미국·이스라엘과 이란 간 중동 전쟁의 지속 기간은 이란의 드론·미사일 비축량과 미국·이스라엘·걸프 국가들의 미사일 방공망 무기 양에 따라 결정될 수 있다고 가디언은 3일(현지시간) 분석했다. 미국 워싱턴 소재 싱크탱크 신미국안보센터(CNAS)의 스테이시 페티존 국방 프로그램 책임자는 가디언에 “이 분쟁은 일종의 ‘포격 경쟁’으로 변모했다”고 밝혔다. 이는 대립하는 군대 간에 다량의 정밀유도무기를 동시에 집중 발사하는 군사 전략 개념을 설명하는 표현이다. 그는 “핵심 무기의 비축량이 더 많은 쪽이 누구인가가 문제이며, 가장 큰 미지수는 이란의 비축량이 얼마나 되는지다”라고 설명했다. 페티존 책임자는 “공중 방어 무기 비축량이 고갈될 경우 이스라엘과 미국이 공격 작전을 중단하고 협상을 모색하도록 압박할 수 있다”면서도 “반대로 이란의 미사일이 바닥나면 그들은 평화를 구걸하고 생존을 모색하며, 결국 시간이 지나면서 역량을 재건해야 할지도 모른다”고 전했다. 미사일방어자문연합(MDAA)의 탈 인바르 선임 연구원은 “100% 방어라는 것은 존재하지 않는다. 이는 소모전이다”라며 “단 한 발의 미사일이 대학, 병원, 발전소 같은 시설을 타격한다",2026-03-04,https://www.seoul.co.kr/news/international/2026/03/04/20260304500043,서울신문
