title,thumbnail,short_content,write_time,link,company
"특례시시장협의회, 국회 행안위에 ‘특례시 지원에 관한 특별법’ 조속 제정 건의",https://img.seoul.co.kr/img/upload/2025/12/10/SSC_20251210183302_N1.jpg.webp,"대한민국특례시시장협의회가 10일 국회 행정안전위원회 위원들과 간담회를 갖고 특례시의 법적 지위와 행정·재정 권한 강화를 위한 ‘특례시 지원에 관한 특별법’ 제정을 촉구했다 간담회에는 국회에서 행정안전위원회 신정훈 위원장, 권칠승, 이상식 의원 등 3명이 참석했고, 특례시시장협의회에서는 대표회장인 정명근 화성특례시장과 이재준 수원특례시장, 이상일 용인특례시장, 이동환 고양특례시장, 정숙이 창원특례시 자치행정국장이 함께 자리했다. 협의회는 특례시의 제도적 기반 강화를 위해 ‘특례시 지원에 관한 특별법’ 제정의 시급성을 강조하고, 이에 대한 구체적 내용을 담은 건의문을 신정훈 위원장에게 직접 전달했다. 건의문에는 ▲ 특례시 법적 지위 명확화 ▲ 특례시 지위에 걸맞은 재정특례 지원 ▲ 실질적이고 실효성 있는 사무 이양 등의 내용이 담겼다. 그동안 5개 특례시는 기초자치단체이면서도 인구 100만 명이 넘는 지자체들은 광역시급 행정수요와 광범위하게 점점 늘어나는 도시문제를 해결하는 데 한계를 보였다. 이러한 기초자치단체의 한계를 보완하기 위해 2022년 1월 13일 ‘특례시’ 제도가 신설되었지만, 마치 몸에 맞지 않는 작은 옷을 벗고, 제 크기에 맞는 새",2025-12-10,https://www.seoul.co.kr/news/politics/2025/12/10/20251210500267,서울신문
3년 7개월 만에… 다시 ‘청와대 시대’,https://img.seoul.co.kr/img/upload/2025/12/10/SSC_20251210181542_N1.jpg.webp,"대통령실이 이달 말 용산에서 청와대로 이전을 완료한다. 윤석열 정부를 대표하던 ‘용산 대통령실 시대’는 3년 7개월 만에 막을 내리고 다시 ‘청와대 시대’가 열리는 것이다. 청와대 이전은 12·3 비상계엄이 남긴 상처를 완전히 지우고 대한민국이 새로운 도약을 시작한다는 상징적 사건으로 평가된다. 10일 대통령실에 따르면 지난달 청와대 환경 정비와 정보통신 공사가 마무리됐다. 지난 3일 지원 시설부터 시작해 순차적으로 브리핑룸과 기자실, 비서관실, 수석실 등이 청와대로 이동 중이며 오는 25일 성탄절까지 이전 작업이 완료된다. 이재명 대통령은 시설 이전이 완료된 이후 청와대에서 공식 업무를 시작할 것으로 예상된다. 여권 관계자는 “이 대통령이 집무를 시작하는 날부터 공식적으로 청와대 대통령실이 가동되는 것”이라며 “기념행사도 준비하는 것으로 안다”고 전했다. 다만 한남동 대통령 관저는 보안·경호 등의 문제를 감안해 내년 초쯤 청와대 관저로 옮길 것으로 보인다. 이번 이전에 투입된 예비비는 259억원이다. 여민관과 춘추관 등 기존 건물을 개보수해 예산을 최소화했다고 한다. 비슷한 업무의 비서관실 등을 한데 묶는 등 업무 공간의 효율성도 극대화하기로 했다. 청",2025-12-11,https://www.seoul.co.kr/news/politics/2025/12/11/20251211001003,서울신문
K팹리스 10배 키워… 반도체 ‘투톱’ 도약,https://img.seoul.co.kr/img/upload/2025/12/10/SSC_20251210181549_N1.jpg.webp,"남부권에 반도체 혁신벨트… 매년 300명 정예군도 키운다 2047년까지 700조 투입 공장 신설 세계 최대 반도체 클러스터 조성 ﻿“반도체 패권에 미래·경제·안보 달려” 정부가 반도체 관련 기업을 지원해 ‘세계 1위 초격차’를 유지하고 국내 팹리스(반도체 설계) 산업 규모를 현재의 10배로 확장하기로 했다. 또 소재·부품·장비(소부장) 등에 투자를 집중해 전 세계 반도체 시장 패권 경쟁에서 우리나라가 ‘세계 2강’으로 도약하도록 하겠다는 전략을 세웠다. 김정관 산업통상부 장관은 10일 용산 대통령실에서 이재명 대통령 주재로 열린 ‘인공지능(AI) 시대, K반도체 비전과 육성 전략 보고회’에서 “반도체 패권을 누가 쥐느냐가 AI 시대, 그리고 대한민국의 미래·경제·안보를 좌우할 것”이라며 반도체 산업 지원 전략을 밝혔다. 정부는 ▲세계 최대·최고 반도체 클러스터 조성 ▲팹리스 등 시스템반도체 육성 ▲반도체 대학원대학 신설 ▲남부권 반도체 혁신벨트 구축 등 4대 목표를 세웠다. 먼저 정부는 2047년까지 모두 700조원 이상을 투입, 팹(반도체 생산 공장) 10기를 신설해 세계 최대·최고 수준의 반도체 클러스터를 조성하기로 했다. 이미 정부는 지난 2월 용인",2025-12-11,https://www.seoul.co.kr/news/politics/2025/12/11/20251211001002,서울신문
가짜뉴스 퍼뜨리면 ‘최대 5배 손배’ 강행,https://img.seoul.co.kr/img/upload/2025/12/10/SSC_20251210181545_N1.jpg.webp,"‘허위조작정보 근절법’ 과방위 통과 ﻿국힘 “언론 억압 악법” 표결 불참 가짜뉴스를 퍼뜨리면 손해액의 최대 5배까지 손해배상을 청구할 수 있도록 하는 ‘허위조작정보 근절법’이 10일 범여권 주도로 국회 과학기술정보방송통신위원회를 통과했다. 언론 단체를 비롯한 각계의 우려에도 정치인과 고위 공직자 등 ‘권력자’들의 손해배상 청구권은 그대로 남겨 뒀다. 과기방통위는 이날 법안심사소위와 전체회의를 잇따라 열고 이 같은 내용의 정보통신망법 개정안을 더불어민주당과 조국혁신당 주도로 의결했다. 국민의힘은 법안 내용에 반대하며 퇴장했다. 개정안은 불법 또는 허위 정보임을 알면서도 타인을 해할 의도로 정보통신망을 통해 손해를 가한 경우 손해액의 최대 5배까지 배상하도록 하는 내용이 골자다. ﻿ 언론 단체에서는 정치인과 공직자, 대기업 임원과 대주주 등 권력자의 징벌적 손해배상 청구권을 제한해야 한다는 의견을 제기했으나 반영되지 않았다. 다만 과도한 손해배상 청구를 법원이 조기에 각하할 수 있도록 하는 ‘전략적 봉쇄소송’ 방지 관련 특칙을 두기로 했다. 탐사보도 위축 우려가 제기된 ‘최초 발화자 책임 조항’과 언론사에 대한 입증책임 전환 조항도 삭제했다. 이해민 혁신당",2025-12-11,https://www.seoul.co.kr/news/politics/2025/12/11/20251211001001,서울신문
李 “여야 관계없이 엄정 수사”… 통일교 논란 정면 돌파,https://img.seoul.co.kr/img/upload/2025/12/10/SSC_20251210180537_N1.jpg.webp,"이재명 대통령은 여야 인사들이 통일교로부터 부적절한 후원을 받았다는 의혹과 관련해 10일 “여야 관계 없이 엄정 수사하라”고 지시했다. 야권에서 촉발된 통일교 금품 수수 의혹이 여권으로 옮겨붙으며 논란이 확산하자 정면돌파를 택한 것으로 풀이된다. 대통령실은 이날 언론 공지를 통해 “이 대통령은 특정 종교 단체와 정치인의 불법적 연루 의혹에 대해 여야, 지위고하와 관계없이 엄정하게 수사할 것을 지시했다”고 밝혔다. 이를 두고 여권 핵심 인사들이 거명되는 등 통일교 로비 의혹이 일파만파 커지자 이 대통령이 선제 대응에 나선 것이란 해석이 나왔다. 정교 분리 원칙을 강조해 온 이 대통령이 이 사안을 심각하게 받아들이고 있다는 것이 주변의 전언이다. 통일교 연루설이 제기된 인사들이 의혹을 부인하는 가운데 더불어민주당은 “수사 결과를 지켜보자”며 원칙적 입장을 밝히고 있다. 박수현 수석대변인은 이날 SBS 라디오에서 “민주당 인사들이 불법적으로 연관이 돼 있는 게 있다면 그대로 수사하고 결과에 따라 처벌하면 되는 것”이라고 했다. 국회 행정안전위원회 여당 간사인 윤건영 의원은 CBS 라디오에서 “철저하게 진실을 규명해서 불법적인 행위에 대해서는 단죄하는 게 맞다”",2025-12-11,https://www.seoul.co.kr/news/politics/2025/12/11/20251211008002,서울신문
인요한 “희생 없이 변화 없다” 의원직 사퇴… 이소희 비례 승계,https://img.seoul.co.kr/img/upload/2025/12/10/SSC_20251210180517_N1.jpg.webp,인요한 국민의힘 의원이 10일 국회의원직에서 사퇴하겠다고 밝혔다. 지도부의 만류에도 인 의원은 “희생 없이는 변화도 없다”며 사의를 거두지 않았다. 지난해 12·3 비상계엄 이후 국민의힘에서 나온 ‘의원직 사퇴 1호’다. 인 의원은 국회 소통관 기자회견에서 “저는 헌법기관이자 국민의 봉사자로서 오늘 저의 거취에 대해 숙고 끝에 내린 결단을 말씀드린다”며 “지난 1년 반 동안 의정 활동을 마무리하고 국회의원직을 떠나 본업에 돌아가기를 희망한다”고 밝혔다. 연세대 의대 교수이던 인 의원은 2023년 10월 국민의힘 혁신위원장을 맡아 정계에 본격 입문했다. 이날 인 의원은 “오직 진영 논리만을 따라가는 정치 행보가 국민을 힘들게 하고 국가 발전의 장애물이 되고 있다”며 “흑백 논리와 진영 논리는 벗어나야 국민 통합이 가능하다”고 강조했다. 또 “윤석열 정부의 계엄 이후 지난 1년간 이어지고 있는 불행한 일들은 대한민국 미래를 위해 극복해야 할 일”이라며 “희생 없이는 변화가 없다. ‘저 자신부터 모든 기득권을 내려놓고 본업에 복귀하여 국민 통합과 국가 발전에 기여를 하고자 한다”고 말했다. 인 의원은 기자회견에 앞서 장동혁 대표와 송언석 원내대표에게 사퇴 의사,2025-12-11,https://www.seoul.co.kr/news/politics/2025/12/11/20251211006002,서울신문
‘한동훈 가족’ 당게 감사에… “인권 유린” “범죄 못 숨겨” 내홍,https://img.seoul.co.kr/img/upload/2025/12/10/SSC_20251210180519_N1.jpg.webp,"국민의힘 당무감사위원회가 한동훈(사진) 전 대표의 ‘당원 게시판’(당게) 의혹에 본격적인 감사에 나선 것을 두고 당내 의견이 엇갈리고 있다. 친한(친한동훈)계는 10일에도 장동혁 대표의 배후설을 거론하며 반발했으나 지도부는 “당무감사위는 독립기구”라며 거리를 뒀다. 이호선 당무감사위원장은 이날 자신의 블로그를 통해 친한계의 개인정보보호법 위반 지적에 적극 반박했다. 이 위원장은 “범죄나 비윤리적 행위 자체를 숨기기 위한 수단으로 개인정보 보호를 주장할 수는 없다”며 “공익적 목적의 수사, 재판, 행정 집행 과정에서는 개인정보라도 제한될 수 있다”고 주장했다. 또 “‘보호’는 절대적 가치가 아니며 공익적 필요가 우월하게 드러나는 상황에서는 제한될 수 있다”는 입장도 밝혔다. 이 위원장은 전날 한 전 대표의 가족 4인과 같은 이름의 당원들에 대한 신원을 확인하는 중이라고 사실상 ‘중간조사’ 결과를 공개한 바 있다. 반면 친한계 박정훈 의원은 한 라디오 출연에서 “제정신이 아닌 것”이라며 “자녀의 실명까지 다 낸 것은 인권 유린”이라고 지적했다. 또 “익명 게시판에 누구든 얼마든지 문제를 제기할 수 있었다”며 “그걸 들여다본 것 자체가 법적으로 문제가 되는 거",2025-12-11,https://www.seoul.co.kr/news/politics/2025/12/11/20251211006001,서울신문
신축 없이 보수 최소로… 대통령·3실장 여민관 같이 쓸 듯,https://img.seoul.co.kr/img/upload/2025/12/10/SSC_20251210180459_N1.jpg.webp,"여민관 등 사무실 배치 이전과 변경 李·참모진 근거리서 소통·효율 강화 조경·건물 환경 거의 그대로 유지 춘추관, 브리핑룸·기자실 등 활용 “언론과 소통 강화하는 계기 될 것” 대통령실은 이달 말 복귀하는 청와대를 ‘소통’과 ‘효율’ 중심의 업무 공간으로 꾸린다. 리모델링을 최소화해 이전 비용을 아끼고, 대통령 집무실과 참모 사무실 등의 배치를 재조정하는 등 청와대가 이재명 정부의 ‘실용주의’를 상징하는 국정 공간으로 자리매김하도록 만들겠다는 계획이다. 대통령실은 기존 청와대 건물을 새로 짓거나 증·개축하지 않고 그대로 사용한다. 3년 7개월 동안 사용하지 않아 노후화된 일부 건물과 시설 등을 개·보수하는 선에 그쳤다. 청와대 내 조경과 건물 환경도 거의 바꾸지 않았다고 한다. 이에 따라 이재명 정부는 청와대를 사용한 전임 정부들과 마찬가지로 본관은 대통령 집무실과 부속실, 업무동인 여민관은 수석실과 비서관실 등 참모 사무실, 춘추관은 브리핑룸과 기자실 등으로 그대로 활용한다. 대통령 집무실은 문재인 정부 때처럼 본관 외에 여민관에도 추가로 둘 것으로 보인다. 문재인 정부는 본관과 여민관이 도보로 10분가량 떨어져 있어 대통령과 참모들의 소통이 어렵다는",2025-12-11,https://www.seoul.co.kr/news/politics/president/2025/12/11/20251211005002,서울신문
"청와대 나올 때 378억, 돌아갈 때 259억",,"대통령실의 청와대 복귀에는 259억원의 예산이 투입된다. 3년 전 용산으로 옮겨 올 때 들었던 비용의 3분의 2 수준이다. 하지만 각종 간접비용까지 합치면 두 번의 이사로 1000억원이 넘는 혈세가 들어간다는 분석이 나온다. 10일 대통령실에 따르면 이재명 대통령은 지난 6월 국무회의에서 청와대 복귀를 위한 259억원의 예비비 지출 안건을 의결했다. 윤석열 전 대통령이 취임 직후 청와대에 있던 대통령 집무실을 용산으로 옮길 때 들었던 예비비 378억원보다 119억원 적은 액수다. 용산 이전 당시엔 경호·보안 설비와 통신·전산망 등 초기 인프라 설치비가 추가 반영됐을 것으로 분석된다. 국방부 등 정부 부처가 연쇄 이동하는 비용까지 포함하면 액수는 크게 불어난다. 청와대 이전 후 국방부가 용산 대통령실 청사로 다시 들어가는 데에는 238억원이 소요될 것으로 집계됐다. 대통령실 관계자는 “대통령실 이전에 필요한 ‘최소 비용’이 259억원”이라고 밝힌 바 있다. 국회예산정책처는 전 정부가 대통령실과 관저의 용산 이전을 위해 2022년에만 650억원을 썼고, 이후부터 지난해까지 182억 1600만원을 추가 집행해 총 832억 1600만원을 들인 것으로 추산했다. 청",2025-12-11,https://www.seoul.co.kr/news/politics/president/2025/12/11/20251211005001,서울신문
국방부·합참·직할부대 ‘원대 복귀’ 전망,,"용산 대통령실이 청와대로 이전함에 따라 건물 주인이던 국방부, 또 국방부와 한집살이를 하던 합동참모본부 등까지 연쇄 대이동이 벌어질 것으로 전망된다. 10일 군에 따르면 이달 말 용산 대통령실이 청와대 이전을 완료하면 해당 공간에는 국방부가 들어올 예정이다. 현재 국방부가 머물고 있는 건물은 합참이 단독으로 사용하게 된다. 3년 7개월 전 대통령실이 용산으로 옮겨오기 직전 상태로 되돌아가는 것이다. 분리 배치됐던 국방부 직할부대 등도 용산으로 돌아올 것으로 예상된다. 군 관계자들 사이에서는 ‘원대 복귀’ 시 업무 효율성이 증대될 것이라는 기대감이 가장 크다. 국방부의 경우 일부 부대는 같은 영내에 있긴 하지만 건물이 물리적으로 분리돼 있어 ﻿소통이 원활하지 않았다는 게 공통된 목소리다. 한 국방부 관계자는 “그간 비효율이 많았는데 원상태로 돌아가는 당연한 수순”이라고 말했다. 합참도 반기는 분위기다. 전략 시스템 등이 청사 내에 갖춰져 있어 관련 부대가 온전히 한 건물을 쓰는 것이 효율적이란 것이다. 일각에서 이전 작업으로 인한 보안 공백 우려가 제기되지만 합참 관계자는 “최소 대비 인력이 있고 이미 망이 갖춰진 원래 건물로 복귀하는 것이라 문제가 없다”고",2025-12-11,https://www.seoul.co.kr/news/politics/2025/12/11/20251211004001,서울신문
대통령실 이전에 국방부·합참·국직부대도 연쇄 이동할 듯,https://img.seoul.co.kr/img/upload/2025/12/10/SSC_20251210175149_N1.jpg.webp,"국방부는 대통령실로...합참은 현 건물 단독 업무 효율성·소통 원활 기대감 “확정은 아냐...검토 단계” 용산 대통령실이 청와대로 이전함에 따라 건물 주인이던 국방부, 또 국방부와 한집살이를 하던 합동참모본부 등까지 연쇄 대이동이 벌어질 것으로 전망된다. 10일 군에 따르면 이달 말 용산 대통령실이 청와대 이전을 완료하면 해당 공간에는 국방부가 들어올 것으로 보인다. 현재 국방부가 머물고 있는 건물은 합참이 단독으로 사용할 것으로 예상된다. 3년 7개월 전 대통령실이 용산으로 옮겨오기 직전 상태로 되돌아가는 것이다. 분리 배치됐던 국방부 직할부대 등도 용산으로 돌아올 것으로 예상된다. 군 관계자들 사이에서는 ‘원대 복귀’ 시 업무 효율성이 증대될 것이라는 기대감이 가장 크다. 국방부의 경우 일부 부대는 같은 영내에 있긴 하지만 건물이 물리적으로 분리돼 있어 이전만큼 소통이 원활하지 않았다는 게 공통된 목소리다. 한 국방부 관계자는 “그간 비효율이 많았는데 원상태로 돌아가는 당연한 수순”이라고 말했다. 합참도 반기는 분위기다. 전략 시스템 등이 청사 내에 갖춰져 있어 관련 부대가 온전히 한 건물을 쓰는 것이 효율적이란 것이다. 일각에서 이전 작업으로 인한",2025-12-10,https://www.seoul.co.kr/news/politics/2025/12/10/20251210500254,서울신문
"KADIZ 뚫린 날, ‘서울 불바다’ 방사포도 뻥뻥…김정은·푸틴·시진핑 입 맞췄나",https://img.seoul.co.kr/img/upload/2025/12/10/SSC_20251210173828_N1.jpg.webp,중국과 러시아 군용기에 한국방공식별구역(KADIZ)이 뚫린 9일 북한도 서해상으로 방사포 10여발을 발사한 것으로 전해졌다. 10일 군 소식통에 따르면 우리 군은 전날 오후 3시쯤 북한군이 서해상으로 발사한 240㎜ 추정 방사포 10여발을 식별했다. 240㎜ 방사포는 북한이 이른바 ‘서울 불바다’ 위협을 할 때 들고나오는 대표적인 장사정포다. 앞서 북한군은 경주 아시아태평양경제협력체(AEPC) 정상회의를 겨냥한 듯 지난달 1일과 3일에도 240㎜로 추정되는 방사포 각각 10여발을 서해상으로 발사한 바 있다. 12월 동계훈련 일환…전원회의 맞춘 무력 과시 분석 우리 군은 북한의 이번 도발 12월 동계훈련 일환으로 보고 있다. 일각에선 같은날 시작된 북한 노동당 전원회의에 맞춘 무력 과시로도 분석한다. 조선중앙통신에 따르면 이날 북한에서는 김정은 국무위원장의 사회로 노동당 중앙위원회 제8기 제13차 전원회의 확대회의가 소집됐다. 노동당 전원회의는 당 대회가 열리지 않는 기간에 당 내외 주요 문제들을 논의·의결하는 기구다. 내년 1∼2월 9차 당대회와 이후 예상되는 최고인민회의 등 북한의 연쇄 정치행사 첫 단추를 끼우는 ‘신호탄’ 격이기도 하다. 중·,2025-12-10,https://www.seoul.co.kr/news/politics/north/2025/12/10/20251210500245,서울신문
"與, 내란 전담재판부 위헌 소지 최소화…사법개혁 입법 내년 초까지",https://img.seoul.co.kr/img/upload/2025/12/10/SSC_20251210015020_N1.jpg.webp,"이재명 대통령이 ‘국민 눈높이에 맞는 합리적 개혁 입법 처리’를 여당 지도부에 주문한 가운데 연내 처리를 목표했던 일부 사법개혁 입법이 내년 초까지 이어질 거란 전망이 나온다. 12월 임시국회 기간 필리버스터(무제한 토론)를 거쳐 처리할 수 있는 쟁점 법안 수가 한정되면서 사법개혁 입법도 순차적으로 진행될 것으로 보인다. 더불어민주당 핵심 관계자는 10일 서울신문과의 통화에서 “올해 처리 방침은 변함이 없다”면서도 “근데 필리버스터 때문에 자동적으로 처리를 올해 못 할 가능성이 있다. (내년으로) 넘어갈 가능성이 있다”고 말했다. 이에 따라 법 왜곡죄 신설(형법 개정안), 법원행정처 폐지법(법원조직법 개정안) 등이 내년으로 처리가 미뤄질 가능성도 있다. 민주당은 11일부터 14일까지 본회의를 열고 쟁점 법안 처리를 시도한다는 방침이다. 쟁점 법안 처리를 시도할 경우 국민의힘은 무제한 토론 실시를 요구하고 곧장 민주당은 무제한 토론 종결 동의를 제출한 후 24시간이 지나 재적의원 5분의 3(179명)의 찬성으로 토론을 종결한 후 표결 처리를 진행하는 방식이다. 이 경우 쟁점 법안을 1건 처리하는데 하루 이상이 소요된다. 민주당은 정기국회 마지막 본회의였던",2025-12-10,https://www.seoul.co.kr/news/politics/2025/12/10/20251210500197,서울신문
李 대통령 측근 정진상 “통일교와 어떤 접촉도 없었다”,https://img.seoul.co.kr/img/upload/2025/12/10/SSC_20251210140603_N1.jpg.webp,이재명 대통령의 최측근으로 꼽히는 정진상 전 더불어민주당 당대표실 정무조정실장이 통일교와의 연관설에 대해 부인했다. 김지호 민주당 대변인은 10일 기자들에게 알림 메시지를 통해 “최근 통일교 측이 정 전 실장과 접촉했다는 보도와 관련해 정 전 실장은 ‘해당 내용은 전혀 사실이 아니며 통일교 측과 어떠한 접촉도 없었다’고 밝혀왔다”고 전했다. 앞서 지난 9일 건진법사 전성배씨의 알선수재 혐의 재판에서 통일교 측이 2022년 대통령 선거 직전 이 대통령과 윤석열 전 대통령 모두에게 접촉을 시도한 정황이 담긴 통일교 간부의 녹음파일이 다수 재생됐다. 여기서 정 전 실장의 이름이 나왔다. 윤영호 전 통일교 세계본부장은 2022년 1월 25일 이현영 전 통일교 부회장과의 통화에서 당시 ‘한반도 평화서밋’ 행사 축사에 대해 “정진상 부실장이나 그 밑에 쪽은 화상 대담이잖아. 힐러리(클린턴 전 미국 국무장관) 정도는 될 것 같다”라고 말했다. 정 전 실장은 2022년 1월 당시 이재명 캠프의 선거대책위원회 비서실 부실장이었다.,2025-12-10,https://www.seoul.co.kr/news/politics/congress/2025/12/10/20251210500135,서울신문
"李대통령 “종교단체·정치인 연루 의혹, 여야 관계없이 엄정 수사”",https://img.seoul.co.kr/img/upload/2025/12/10/SSC_20251210113322_N1.jpg.webp,"이재명 대통령은 10일 “특정 종교 단체와 정치인의 불법적 연루 의혹에 대해 여야·지위고하와 관계없이 엄정하게 수사하라”고 지시했다. 대통령실은 이날 이 대통령이 이같은 지시를 내렸다고 밝혔다. 이 대통령은 앞서 지난 2일 국무회의에서 “정교분리 원칙을 어기고 종교재단이 조직적·체계적으로 정치에 개입한 사례가 있다”면서, 일본에서는 이와 유사한 사례에 대해 종교재단 해산 명령을 했다는 사실을 언급하며 조 처장에게 검토할 것을 지시했다. 이어 전날 국무회의에서는 “정치에 개입하고 불법 행위를 하는 종교 단체는 헌법과 법률에 위반되는 행위를 하면 해산시켜야 한다”라면서 조원철 법제처장을 향해 관련 검토를 했느냐고 물었다. 이 대통령은 특정 종교단체를 언급하지는 않았지만, 통일교가 국민의힘 뿐 아니라 더불어민주당 등 여권 인사들에게도 금품을 제공했다는 의혹이 제기된 상황을 염두에 둔 것으로 풀이됐다. 다만 강유정 대변인은 브리핑에서 이 대통령의 종교단체 해산 관련 언급이 나온 배경에 대한 질문에 “특정 종교를 언급한 건 아니었다”라고 설명했다. 이어 “(대통령이 앞서) 헌법 20조에 정교분리 조항이 있는데 종교가 정치에 과도하게 개입할 경우에 어떤 조치가 가",2025-12-10,https://www.seoul.co.kr/news/politics/president/2025/12/10/20251210500097,서울신문
