title,thumbnail,short_content,write_time,link,company
"美, 전쟁통에 차등 관세… 국회 대미투자법 12일 처리 합의",https://img.seoul.co.kr/img/upload/2026/03/04/SSC_20260304154744_N1.jpg.webp,"트럼프, 최대 15% ‘차등관세’ 언급 무역법 301조 근거로 5개월 조사 여한구 “국회 적기 통과 중요” 강조 도널드 트럼프 미국 대통령이 각국에 서로 다른 ‘차등 관세’를 부과하는 방안을 검토 중이라고 밝혔다. 현재 시행 중인 ‘글로벌 관세’의 법정 시한(150일)이 끝나면 국가별 관세 체계로 전환하겠다는 뜻으로 풀이된다. 한편 여야는 오는 12일 국회 본회의에서 대미투자특별법을 처리하기로 합의했다. 트럼프 대통령은 3일(현지시간) 워싱턴DC 백악관에서 프리드리히 메르츠 독일 총리와 만난 자리에서 “우리는 (‘글로벌 관세’ 부과가 가능한) 최장 5개월의 기간을 갖고 있으며, 그동안 (최대치인) 15%로 갈 수 있다”고 밝혔다. 이어 “우리는 다양한 연구를 진행 중이며, 각국에 서로 다른 관세 부과를 발표할 것”이라고 언급했다. 트럼프 대통령은 지난달 20일 연방대법원의 상호관세 위헌 결정 이후 무역법 122조를 근거로 전 세계에 10% 글로벌 관세를 부과했다. 트럼프 대통령은 15%까지 인상하겠다고 밝혔으나 아직 인상 조치는 이뤄지지 않았다. 트럼프 대통령은 관세율 인상 가능성을 언급하면서도 기존 무역 합의의 틀은 유지할 것이라고 주장했다. 그는 “모",2026-03-05,https://www.seoul.co.kr/news/politics/2026/03/05/20260305010001,서울신문
민주 인천시장 후보 박찬대 단수 공천… 국힘 서울 윤희숙·경기 양향자 도전,https://img.seoul.co.kr/img/upload/2026/03/04/SSC_20260304180306_N1.jpg.webp,"서울 출마 정원오, 구청장 퇴임식 경남 김경수도 위원장직 내려놔 野 인물난에 고심…나경원 불출마 오세훈, 토너먼트 승자와 ‘맞대결’ 6·3 지방선거가 90일 앞으로 다가온 가운데 여야 광역단체장 후보군의 윤곽이 차츰 드러나고 있다. 더불어민주당은 인천시장 후보자로 박찬대 의원을 단수 공천했다. 국민의힘에선 윤희숙 전 혁신위원장이 서울시장 출마를 공식화했고, 양향자 최고위원은 경기지사 출마를 시사했다. 김이수 민주당 공천관리위원장은 4일 국회에서 열린 공관위 회의에서 “박 의원은 험지로 꼽히던 인천 연수구에 도전해 연수구 30년 역사의 첫 민주당 국회의원으로 이름을 새겼다. 2024년 말에는 원내대표로서 비상계엄 정국 아래 내란 우두머리 윤석열 탄핵의 선봉에 섰다”고 단수 공천 배경을 설명했다. 우상호 전 청와대 정무수석을 강원지사 후보로 단수 공천한 데 이어 민주당의 ‘2호 공천’이다. 정청래 민주당 대표는 지난해 전당대회에서 경쟁했던 박 의원을 향해 “정권 교체의 일등 공신”이라고 치켜 세웠다. 이에 박 의원은 “수도권·전국에서 승리를 견인하라는 준엄한 명령이라고 생각한다”고 밝혔다. 서울시장에 도전장을 낸 정원오 서울 성동구청장은 공직자 사퇴 시한을",2026-03-05,https://www.seoul.co.kr/news/politics/local-election2026/2026/03/05/20260305006002,서울신문
"조희대 몰아치는 與… 정청래 “사퇴도 타이밍, 거취 표명하라”",https://img.seoul.co.kr/img/upload/2026/03/04/SSC_20260304180301_N1.jpg.webp,"‘사법개혁 3법’(법왜곡죄·재판소원·대법관 증원) 입법을 완수한 정청래 더불어민주당 대표는 4일 조희대 대법원장을 향해 “사퇴도 적절한 타이밍이 있다”며 거취 표명을 촉구했다. 범여권 의원들은 조 대법원장 탄핵 공청회를 열고 “탄핵소추안을 이미 마련해뒀다”며 압박 수위를 높였다. 정 대표는 이날 국회에서 열린 최고위원회의에서 “조 대법원장은 사법부 수장으로서 무능·무지할 뿐만 아니라 국민 정서에도 반하고 번지수도 잘못 잡고 있다”며 공개적으로 사퇴를 요구했다. 정 대표는 “지금 사법개혁에 대한 저항군 우두머리 역할을 하는 것이냐”며 “사법개혁 3법에 대해서 그동안 얼마나 많은 국민들이 염원했고, 사법개혁 3대 입법이 국민들의 지지를 얼마나 많이 받고 있는지 진정 모르시나”라고 물었다. 전날 조 대법원장이 사법개혁 3법과 관련해 “갑작스러운 대변혁이 과연 국민들에게 도움이 되는지 마지막까지 심사숙고해달라”고 말한 데 대한 비판이다. 이런 가운데 민주당 민형배·조계원 의원, 무소속 최혁진 의원 등 ‘국회 공정사회포럼’(처럼회) 소속 의원들은 이날 국회에서 ‘조 대법원장 탄핵 공청회’를 열고 탄핵 추진을 선언했다. 민 의원은 “(사법 개혁과 내란 청산의) 돌파",2026-03-05,https://www.seoul.co.kr/news/politics/2026/03/05/20260305006001,서울신문
李대통령 “한국 부동산처럼 스캠 범죄도 꺾여… 한국인 건들면 패가망신”,https://img.seoul.co.kr/img/upload/2026/03/04/SSC_20260304164648_N1.jpg.webp,"“한국 상대 범죄에 인력·예산 투입” 현지 수감 ‘마약왕’ 국내 인도 요청 비즈니스 포럼서 MOU 7건 체결 변호사 때 인연 맺은 노동자 재회 필리핀을 국빈 방문한 이재명 대통령은 4일 “내국인을 상대로 한 스캠 범죄, 보이스피싱 피해액은 22% 줄어들었다”며 “대한민국 부동산 값이 꺾이듯이 꺾였다”고 말했다. 순방 기간에도 부동산 관련 메시지를 발신해온 이 대통령이 부동산과 스캠 범죄 문제 양쪽에 모두 자신감을 드러낸 것이다. 이 대통령은 이날 마닐라 시내 호텔에서 동포 오찬 간담회를 열고 “‘대한민국 사람을 건들면 패가망신한다’고 현지 언론에 퍼트리고 내국인 상대 범죄 행위에 과할 정도로 인력과 예산을 투입하고 있다”며 이같이 밝혔다. 이어 “계속 압박할 것”이라며 “인력도 늘리고 있고, 국가 기관도 현지 활동하게 하는 상황”이라고 전했다. 이 대통령은 전날 페르디난드 로무알데스 마르코스 주니어 필리핀 대통령과 정상회담에서 필리핀에 수감 중인 한국인 박모씨를 인도해줄 것을 요청했다고 전했다. 이 인물은 ‘텔레그램 마약왕 전세계’로 불리며 국내에 필로폰을 공급해오다 2022년 필리핀 당국에 검거돼 수감 중인 박왕열씨로 보인다. 이 대통령은 “이 사람이",2026-03-05,https://www.seoul.co.kr/news/politics/president/2026/03/05/20260305005002,서울신문
"김성태 기사 공유한 李 “증거 조작, 살인보다 더 나쁜 짓”",https://img.seoul.co.kr/img/upload/2026/03/04/SSC_20260304181303_N1.jpg.webp,"이재명 대통령은 4일 ‘쌍방울 대북 송금 사건’과 관련해 “증거 조작, 사건 조작은 일반 범죄자가 저지르는 강도나 납치 살인보다 더 나쁜 짓”이라고 검찰을 비판했다. 이 대통령이 직접 검찰 수사의 부당함을 지적하면서 여당이 추진 중인 이 사건 관련 국정조사도 탄력을 받을 전망이다. 필리핀을 국빈 방문 중이던 이 대통령은 이날 엑스(X)에 해당 사건 수사 과정에서 김성태 전 쌍방울 회장이 ‘이 대통령에게 돈을 준 사실이 없다’는 취지로 말했다는 언론 보도를 공유하며 이같이 밝혔다. 이 보도는 법무부가 대북 송금 수사에 대한 감찰 과정에서 김 전 회장이 측근에게 “이재명에게 돈 준 사실 없다”며 “검찰이 기소권을 갖고 장난친다”는 내용의 녹취를 확보했다는 내용이다. 앞서 검찰은 이 대통령이 경기지사 시절이던 2019년 경기도가 북한에 지급하기로 약속한 황해도 스마트팜 지원 사업비 500만 달러(약 74억원)와 방북 비용 300만 달러(약 44억원) 등을 김 전 회장에게 대납하게 했다며 이 대통령을 2024년 기소했다. 관련 재판 절차는 이 대통령 취임 이후 중단된 상태다. 이 대통령의 강경한 기조에 발맞춰 여당도 국정조사 추진에 속도를 낼 전망이다. 한병도",2026-03-05,https://www.seoul.co.kr/news/politics/president/2026/03/05/20260305005001,서울신문
[포토] 평양의 정월대보름 달맞이,https://img.seoul.co.kr/img/upload/2026/03/04/SSI_20260304174528_N1.jpg.webp,북한이 지난 3일 정월대보름을 맞아 보름달은 오후 6시 23분께 뜨기 시작했으나 저기압의 영향으로 흐린 날씨가 이어지고 개기월식까지 겹치면서 오후 10시 20분께부터 관측이 가능했다고 조선중앙TV가 4일 보도했다.,2026-03-04,https://www.seoul.co.kr/news/politics/north/2026/03/04/20260304800012,서울신문
정원오 “더 넓은 곳으로 나아가겠다”… 5일 서울시장 예비후보 등록,https://img.seoul.co.kr/img/upload/2026/03/04/SSC_20260304170058_N1.jpg.webp,"“시민과 함께하겠다는 한결같은 마음으로 한 발 한 발 나아가겠습니다.” 정원오 성동구청장이 4일 구청장직을 내려놓고 6·3 지방선거 레이스에 본격적으로 뛰어들었다. 정 구청장은 이날 오후 구청에서 열린 퇴임식에서 “지난 12년간 한결같이 응원해주신 성동구민 여러분께 진심으로 감사하다”며 “여러분의 응원에 힘입어 더 넓은 곳으로 나아가고자 한다”고 밝혔다. 구청 로비와 광장에는 정 구청장에 대한 지지를 뜻하는 ‘15(원오) 하늘색 풍선’을 든 주민과 지지자 1000여명이 모였다. 그는 5일 더불어민주당 서울시장 예비후보로 등록할 예정이다. 지난달 23일 민주당 당사에서 열린 중앙당 공천관리위원회 2차 회의와 광역단체장 후보자 면접에도 참석했다. 정 구청장은 “12년 전 여러분과 처음 만나 성동구의 발전을 위해 함께 뛰어왔다”며 “그사이 많은 변화가 있었고, 많은 주민들께서 성동에 사는 자부심을 이야기하고 있다”고 전했다. 그는 이어 “직원 여러분도 큰 자부심을 갖고 일해 왔다고 생각하며 진심으로 감사드린다”며 “오늘의 제가 있기까지 모든 것은 직원 여러분과 성동구민 여러분의 힘이었다고 생각한다”고 강조했다. 그러면서 “이 자리를 빌려 다시 한번 감사 인사를",2026-03-04,https://www.seoul.co.kr/news/publicnews/2026/03/04/20260304500260,서울신문
"‘산업재해’ 필리핀 노동자 도왔던 변호사 李대통령, 34년만 재회",https://img.seoul.co.kr/img/upload/2026/03/04/SSC_20260304164648_N1.jpg.webp,"필리핀을 국빈 방문한 이재명 대통령이 34년 전 인권 변호사 시절 산업재해보상금을 받을 수 있도록 도움을 줬던 필리핀 노동자와 깜짝 만남을 가졌다. 이 대통령은 필리핀 순방 마지막 날인 이날 오후 과거 특별한 인연이 있는 아리엘 갈락씨와 만났다고 강유정 청와대 대변인이 전했다. 두 사람의 인연은 1992년으로 거슬러 올라간다. 갈락씨는 한국의 한 공장에서 근무하다 불의의 사고를 당하고 필리핀으로 귀국했다. 고향에 있는 가족들을 부양하기 위해 타지에서 밤낮없이 일하다 한 팔을 잃었지만, 보상도 받지 못한 채 강제 출국 당한 것이다. 당시 인권 변호사로 활동했던 이 대통령은 갈락씨의 안타까운 사연을 접했다. 이 대통령은 1년여의 재심 절차를 진행한 끝에 갈락씨가 요양 인정과 산업재해보상금을 받을 수 있게 도왔다. 낯선 땅에서 도움을 줬던 변호사는 34년 후 한국의 대통령이 돼 갈락씨를 찾았다. 갈락씨는 이 대통령과 만난 자리에서 “알아봐 주시고 만나뵐 수 있어서 영광이고 감사하다”며 “비록 사고를 당했지만 한국에 대해 늘 좋은 기억을 갖고 있고, 당시 변호사로서 좋은 결과를 만들어주셔서 감사하다”고 전했다. 이 대통령은 “산업재해를 당한 외국인들의 강제",2026-03-04,https://www.seoul.co.kr/news/politics/president/2026/03/04/20260304500251,서울신문
"“아직 끝난 게 아니다” TK 정치권, 3월 임시국회 통합법 처리 총력전",https://img.seoul.co.kr/img/upload/2026/03/04/SSC_20260304164112_N1.jpg.webp,"대구·경북(TK) 행정통합 특별법의 2월 임시국회 처리가 무산된 가운데 지역 정치권은 3월 임시국회에서는 특별법을 처리하기 위해 총력전에 나섰다. 국민의힘은 대규모 결의대회를 열고 더불어민주당의 결단을 촉구하는 한편, 대구시와 경북도는 통합의 필요성을 거듭 강조하고 있다. 정치권에선 본회의가 열리는 오는 12일을 현실적인 데드라인으로 보고 있다. 현행 공직선거법상 지방선거 출마 공직자 사퇴 시한이 5일까지이지만, 특별법안에 통합 광역단체장 선거를 예외로 공무원 사퇴 시한을 늦춘다는 부칙이 있어서다. 4일 대구시와 경북도, 지역 정치권에 따르면 국민의힘은 이날 오후 국회에서 결의대회를 열고 더불어민주당을 향해 TK 통합 특별법 처리를 촉구했다. 행사에는 대구와 경북에 지역구를 둔 국회의원 20여 명과 광역·기초의원을 비롯한 당원 1500여 명이 참석했다. 이들은 국회 절대다수 의석을 차지한 민주당이 TK 통합 특별법을 대전·충남 통합 특별법과 함께 처리해야 한다는 입장을 고수하는 데 대해 강도 높게 비판했다. 경북도당위원장인 구자근(경북 구미갑) 의원은 “지방소멸 위기 앞에서 우리가 그렇게 살자고 발버둥 치는데 중앙정부가 도와주진 못할망정 왜 사사건건 발목",2026-03-04,https://www.seoul.co.kr/news/politics/2026/03/04/20260304500247,서울신문
대안과미래 “노선 전환 요구 중단…선거 책임 장동혁 몫으로”,https://img.seoul.co.kr/img/upload/2026/03/04/SSC_20260304162149_N1.jpg.webp,"국민의힘 소장파 ‘대안과미래’ 소속 의원들이 4일 장동혁 대표를 면담해 ‘절윤(윤석열과의 절연)’을 포함한 노선 전환 필요성에 대한 인식차를 재확인하고 더 이상 관련 요구를 하지 않기로 했다. 사실상 장 대표의 노선 수정 가능성이 없다고 보고 6·3 지방선거 이후 정치적 책임을 묻기로 한 것이다. 대안과미래 의원들은 이날 오전 국회에서 비공개 모임 후 송언석 원내대표와 40분 면담을 하고 오후에는 장 대표를 30분 동안 만난 뒤 이렇게 결론을 냈다. 모임 간사인 이성권 의원과 조은희 의원은 국회 소통관 브리핑에서 “내일(5일)부터 지방선거 공천 신청이 시작되고 사법 파괴 3대 악법에 대한 대여투쟁이 계속될 예정인 상황에서 당 노선을 둘러싼 의원총회를 소집하면 혼란도 가중될 수 있다는 판단에 마지막으로 지도부에 윤석열 그리고 ‘윤어게인’과의 절연을 다시 한번 건의드리기 위한 면담이었다”고 설명했다. 이 의원은 “지도부에 윤석열 그리고 윤어게인과의 절연을 다시 한번 더 간곡하고 강하게 요청드렸다”며 “확인한 바로는 지방선거 승리라는 목적지를 두고선 상당히 동일한 문제의식을 갖고 있지만, 그 목적 달성을 위한 방법론과 경로 혹은 전략과 전술에는 차이가 있다는",2026-03-04,https://www.seoul.co.kr/news/politics/2026/03/04/20260304500233,서울신문
“20조원은 충청을 바꿀 마중물” vs “20조원 실체 없어”,https://img.seoul.co.kr/img/upload/2026/03/04/SSC_20260304155905_N1.jpg.webp,"대전·충남 행정통합을 요구하는 더불어민주당의 삭발·단식이 이어지고 있다. 통합에 반대하는 국민의힘을 겨냥해 ‘매향노’, ‘탕자’, ‘공직 사퇴’ 등을 거론하며 정쟁이 격화하는 양상이다. 민주당 대전시당은 4일 대전시청 북문 앞에서 ‘대전·충남 차별 내란잔당규탄 및 통합 촉구 결의대회’를 열고 2차 비상 행동을 선언했다. 이 자리에서 지방선거 출마 예정자와 당원 등 8명이 삭발과 함께 무기한 천막 농성에 돌입했다. 이들은 성명에서 “대전·충남 통합법은 대구·경북 통합법과 토씨 하나 다르지 않은 ‘쌍둥이 법안’인데 대구·경북은 ‘살 길’이고 대전·충남은 정치적 득실에 따라 내팽개쳐도 되는 하찮은 존재냐”면서 “시·도민을 기만하는 지역 차별이자 노골적 이중잣대”라고 비판했다. 이어 “20조원은 충청의 산업과 교통·일자리·교육을 바꿀 거대한 마중물로, 국민의힘과 단체장의 몽니로 충청만 멈춰 설 수는 없다”며 “지방소멸의 시계는 결코 우리를 기다려주지 않는다”고 강조했다. 허태정 전 대전시장은 “대전의 빚이 눈덩이라며 연간 5조원의 지원을 걷어차는 심보가 무엇이냐”며 “통합의 길에 동참하지 않는 이장우 대전시장과 김태흠 충남지사는 사퇴해야 한다”고 주장했다. 앞서",2026-03-04,https://www.seoul.co.kr/news/politics/2026/03/04/20260304500215,서울신문
"허석 순천시장 예비후보, 정책공약 자료집 출간 ‘눈길’",https://img.seoul.co.kr/img/upload/2026/03/04/SSC_20260304154431_N1.jpg.webp,"허석 순천시장 예비후보의 정책공약 자료집이 지역 서점에서 판매되고 있어 눈길을 끈다. 6·3 지방선거를 앞두고 후보자의 정책 방향과 세부 실행 계획을 한 권으로 정리한 자료집이라는 점에서 지역 정치권과 유권자들의 관심이 모아지고 있다. 이번 정책공약 자료집은 허 예비후보가 제시해온 주요 정책 비전과 분야별 공약을 체계적으로 정리한 것으로 알려졌다. 이 책은 단순한 구호를 나열하는 데 그치지 않는다. 정책 추진 배경과 목표, 실행 방향 등을 함께 담아 유권자들이 후보자의 시정 철학과 정책 구상을 종합적으로 이해할 수 있도록 구성한 점이 특징이다. 자료집은 순천 관내 ▲중앙서점 ▲명문서점 ▲성지서점 ▲왕지서점 ▲반석서점 ▲서원문고 등 지역 서점을 통해 판매되고 있다. 대형 온라인 유통이 아닌 지역 오프라인 서점을 중심으로 배포함으로써 지역 상권과 연계한 유통 구조를 선택했다는 점도 눈에 띈다. 시민들은 서점을 통해 직접 자료집을 구매하고 공약 내용을 확인할 수 있다. 허 예비후보는 더불어민주당 소속으로 민선 7기 순천시장을 지냈다. 지난 대선에서는 이재명대통령 후보 전남선대위 상임고문을 맡은 바 있다. 이번 자료집에는 그간의 시정 운영 경험과 정치",2026-03-04,https://www.seoul.co.kr/news/politics/2026/03/04/20260304500210,서울신문
[포토] ‘과거 산재피해노동자 재회’ 이 대통령,https://img.seoul.co.kr/img/upload/2026/03/04/SSI_20260304150950_N1.jpg.webp,"필리핀을 국빈방문한 이재명 대통령이 4일 마닐라에서 인권변호사 시절 인연을 맺은 필리핀 노동자 아리엘 갈락 씨를 만나 자신의 자서전을 선물하고 있다. 이 대통령은 인권 변호사로 활동하던 1992년, 한국의 한 공장에서 근무하다가 사고를 당하고도 보상받지 못한 채 필리핀으로 강제 출국당한 갈락 씨의 사연을 접했다. 이후 이 대통령은 1년여에 걸쳐 재심 절차를 진행한 끝에 갈락 씨가 요양인정과 산업재해보상금을 받을 수 있도록 도왔다.",2026-03-04,https://www.seoul.co.kr/news/politics/president/2026/03/04/20260304800009,서울신문
"포항 찾은 김재원 경북지사 예비후보, “지진 소송 법률지원”",https://img.seoul.co.kr/img/upload/2026/03/04/SSC_20260304152020_N1.jpg.webp,김재원 경북지사 예비후보가 포항을 찾아 지진 피해 소송 지원 등 지역 맞춤형 공약을 발표했다. 김 예비후보는 4일 포항시청에서 간담회를 열고 “경북지사가 되면 포항지진 정신적 위자료 소송에 대해 피해주민을 위한 법률지원을 하겠다”며 “위자료 소송은 1심에선 승소했지만 항소심에 패소해 현재 대법원의 판단을 기다리고 있어 행정적 뒷받침을 위해 우수한 전문가들을 지원해야 한다”고 밝혔다. 이어 그는 “영일만항을 북극항로 국가거점항만으로 육성해 북방에너지와 물류 전진기지로 만들겠다”며 “포항이 환동해권을 비롯한 경북의 새로운 발전을 개척할 바닷길의 중심이 돼야 한다”고 설명했다. 또한 김 예비후보는 “포스코가 추진하는 수소환원제철소와 이차전지 클러스터 등 혁신·첨단 산업을 전폭 지원하겠다”며 “이를 위해 경북도청 동부청사에 혁신경제지원본부를 설치해 경제부지사가 총괄하도록 할 것”이라고 했다. 끝으로 그는 “당선 직후 포스텍 연구중심 대학병원 설립추진위원회를 구성해 동해안권 의료수준을 향상시키고 세계적 수준의 의료·바이오 연구대학으로 키우겠다”고 덧붙였다.,2026-03-04,https://www.seoul.co.kr/news/politics/local-election2026/2026/03/04/20260304500202,서울신문
"서동욱 전 전남도의장, 의원직 사직···순천시장 도전 본격화",https://img.seoul.co.kr/img/upload/2026/03/04/SSC_20260304152018_N1.jpg.webp,"서동욱 전 전남도의회 의장이 6·3 지방선거 순천시장 출마를 위해 도의원직을 사직했다. 24년간 쌓아온 입법·행정 경험을 바탕으로 순천 시정 혁신에 나서겠다는 포부다. 서 전 의장은 4일 열린 전남도의회 제378회 임시회 본회의에서 신상발언을 통해 “2002년 순천시의원으로 시작해 4선 도의원을 거쳐 제12대 전반기 의장에 이르기까지 24년간 도민의 뜻을 대변해 왔다”며 의정 활동을 마무리하는 소회를 밝혔다. 그는 “도정과 교육행정에 대한 견제와 대안 제시를 통해 행정의 원칙을 세우고자 노력해 왔다”며 “이제 정든 의회를 떠나 그동안 쌓은 행정 경험과 역량을 순천 발전에 온전히 쏟아붓고자 한다”고 출마 의지를 보였다. 서 전 의장은 현재 순천이 직면한 최대 과제로 ‘단절’을 지목했다. 그는 “순천은 집권 여당인 민주당과의 단절, 시대정신인 국민주권과의 단절로 전남 대표 도시로서의 경쟁력이 약화되고 있다”고 진단했다. 이에 대한 해법으로 ‘단절된 순천, 시민주권시대로의 대전환’을 슬로건으로 제시하고 5대 시정 비전(시민주권·경제·문화·복지·청년)을 제시했다. 주요 정책으로는 ▲원스톱 시민소통센터를 통한 행정 혁신 ▲RE100 산업단지 유치 및 공공개발 이익",2026-03-04,https://www.seoul.co.kr/news/politics/2026/03/04/20260304500201,서울신문
李대통령 “한국 부동산 값 꺾이듯 스캠 범죄도 꺾여”,https://img.seoul.co.kr/img/upload/2026/03/04/SSC_20260304151521_N1.jpg.webp,"필리핀을 국빈 방문한 이재명 대통령은 4일 “내국인 상대로 한 스캠 범죄, 보이스피싱이 피해액은 22% 줄어 들었다”며 “대한민국 부동산 값 꺾이듯이 꺾였다”고 말했다. 이 대통령은 이날 마닐라 시내 호텔에서 동포 오찬 간담회를 열고 “‘대한민국 사람을 건들면 패가망신한다’고 현지 언론에 퍼트리고 내국인 상대 범죄 행위에 과할 정도로 인력과 예산을 투입하고 있다”며 이같이 밝혔다. 이어 “계속 압박할 것”이라며 “인력도 늘리고 있고, 국가 기관도 현지 활동하게 하는 상황”이라고 전했다. 이 대통령은 전날 페르디난드 로무알데스 마르코스 주니어 필리핀 대통령과 정상회담에서 필리핀에 수감된 한국인 ‘마약왕’을 인도해줄 것을 요청했다고 전했다. ‘텔레그램 마약왕 전세계’로 불리는 박모씨는 국내에 필로폰을 공급해오다 2022년 필리핀에서 검거돼 수감 중이다. 이 대통령은 “이 사람이 교도소 안에서 지금도 대한민국으로 마약을 수출하고 있다고 한다”며 “대한민국으로 불러서 조사해야겠다고 했는데 (마르코스 대통령이) 빠른 시일 내에 적극 검토해서 시행해 보겠다고 했다”고 밝혔다. 또 마르코스 대통령에게 2015년 필리핀 경찰에 의해 피살된 지익주씨 사건의 주범을 빨리",2026-03-04,https://www.seoul.co.kr/news/politics/president/2026/03/04/20260304500195,서울신문
