title,thumbnail,short_content,write_time,link,company
"캠리보다 비싸진 쏘나타… 美, 반도체 ‘최혜국 대우’도 불확실",https://img.seoul.co.kr/img/upload/2025/09/15/SSC_20250915180221_N1.jpg.webp,"미국에서 일본보다 높은 25% 관세를 적용받는 국내 자동차와 부품업계는 협의가 장기화할 때 가격 경쟁력과 수익성 악화, 원가 손실에 따른 부품 납품 중단 등을 우려하고 있다. 일본과 마찬가지로 50% 관세를 부과받는 철강업계는 일본제철의 US스틸 인수 효과에 촉각을 기울이고 있으며, 미국 도널드 트럼프 행정부로부터 최혜국 대우 약속을 문서화하지 못한 반도체 업계는 불안감에 시달리고 있다. 한 25%>일 15% … 뒤집힌 자동차값 쏘나타, 캠리보다 1000弗 비싸져 사태 장기화 땐 수익성 악화 불가피 ‘원가 타격’ 부품 납품 중단 우려도 국내외 완성차 업체들이 현재 대미 수출 가격을 동결하고 있지만 고관세율이 계속 이어지면 수익성 악화가 임계치에 달해 가격 인상이 불가피할 것으로 보인다. 현재 미국에서 현대차 쏘나타는 기본 트림 기준 2만 6900달러로 일본 도요타 캠리(2만 8400달러)보다 낮은 가격에 판매되고 있다. 하지만 한국 25%, 일본 15% 관세를 차 가격에 그대로 적용한다면 쏘나타는 3만 3625달러로 캠리(3만 2660달러)보다 비싸진다. 김경유 산업연구원 선임연구위원은 “현대차·기아가 바로 가격을 인상하진 않겠지만 2분기 때와 마찬",2025-09-16,https://www.seoul.co.kr/news/economy/industry/2025/09/16/20250916003002,서울신문
"오늘부터 한일 車관세 뒤집힌다… 여한구, 美 급파",https://img.seoul.co.kr/img/upload/2025/09/16/SSC_20250916003713_N1.jpg.webp,한미 관세 협상이 교착 상태에 빠진 가운데 당장 16일부터 일본산 자동차에 대한 미국 관세가 기존 27.5%에서 15%로 낮아져 국내 산업계에 비상이 걸렸다. 미국이 약속한 반도체와 의약품 등 품목관세에 대한 최혜국 대우도 흔들리면서 한국 경제에 불확실성이 커지는 모습이다. 김정관 산업통상자원부 장관이 귀국한 지 하루 만에 여한구 통상교섭본부장이 15일 관세 협상을 위해 미국으로 출국했다. 상황이 급박하게 돌아가고 있다. 한국자동차모빌리티산업협회(KAMA)에 따르면 올해 1~7월 대미 완성차 수출은 80만 1109대로 지난해(87만 4182대)보다 8.4% 줄었다. 지난 4월부터 관세 25%에 묶인 현대차·기아는 이 부담을 미국 소비자에게 전가하지 않고 감내하면서 지난 2분기에만 1조 6000억원의 영업이익이 감소했다. 앞으로가 더 문제다. 일본과 달리 한미 간 총 3500억 달러(약 486조원) 규모의 대미 투자 사인이 미뤄지면서 한일 간 관세 역전이 우리 경제의 발목을 잡을 수 있어서다. 여 본부장은 워싱턴DC에서 제이미슨 그리어 미국 무역대표부(USTR) 대표 등을 만나 ‘로테이션 협의’를 이어 갈 것으로 알려졌다. 강유정 대통령실 대변인은 이날 브,2025-09-16,https://www.seoul.co.kr/news/economy/2025/09/16/20250916001005,서울신문
"SK온, B1비자 직원들 美공장 복귀 검토… 현대차 ‘구원투수’ 역할",https://img.seoul.co.kr/img/upload/2025/09/16/SSC_20250916055009_N1.jpg.webp,미국 조지아주에서 발생한 대규모 단속 사태로 현대차그룹·LG에너지솔루션의 배터리 공장 건설이 차질을 빚자 SK온이 ‘구원투수’로 나섰다. 미국 출장 인력을 현장으로 복귀시키고 현지 공장을 활용해 현대차의 배터리 수요를 충당한다는 계획이다. 15일 업계에 따르면 SK온은 최근 단기 상용 B1 비자를 가진 직원들에게 숙소 대기 방침을 해제하고 정상 근무토록 하는 방안을 검토하고 있다. SK온은 미국 국무부 외교 업무 매뉴얼에 따라 ▲현장 작업자 교육 ▲연수·세미나 참석 ▲고객사 미팅·계약 ▲장비 설치·정비 관리 감독 등 업무를 B1 비자로 수행할 수 있다고 직원들에게 공지했다. LG에너지솔루션 등 다른 기업들이 여전히 B1 비자 보유 직원들에게 대기 지침을 내린 것과 대비된다. SK온의 이번 조치는 배터리 공급에 비상이 걸린 현대차와의 협력 필요성이 중요하게 고려된 것으로 보인다. SK온은 이미 연간 22GWh 규모의 조지아주 커머스 단독 공장 ‘SK배터리아메리카’(SKBA)를 운영하며 현대차 미국 내 배터리 수요의 60~70%를 공급하고 있다. SKBA는 현대차 메타플랜트 아메리카와 약 300㎞ 거리에 있어 협업 환경도 유리하다. 이달 말 전기차 구매 보조,2025-09-16,https://www.seoul.co.kr/news/economy/industry/2025/09/16/20250916002003,서울신문
중국산 값싼 ‘나트륨이온 배터리’ 공습…전기차 시장 잠식하나,https://img.seoul.co.kr/img/upload/2025/09/15/SSC_20250915200124_N1.jpg.webp,세계 1위 배터리 업체인 중국 CATL이 최근 공개한 차세대 나트륨이온 배터리가 저렴한 가격 등을 앞세워 리튬·인산·철(LFP) 배터리처럼 시장 점유율을 확대할 것으로 전망됐다. 이에 따라 국내 배터리 업계가 발 빠른 대응에 나서야 한다는 지적이 나왔다. 한국자동차연구원은 15일 이런 내용의 보고서를 발표했다. 자동차연구원에 따르면 CATL은 지난 4월 상하이에서 연 자체 테크 데이 행사에서 나트륨이온 배터리 ‘낙스트라’를 공개하고 오는 12월 양산할 예정이라고 밝혔다. 이는 2021년 CATL이 처음 발표한 1세대 나트륨이온 배터리에 이은 2세대 제품이다. 나트륨이온 배터리는 생산 단가가 낮고 열·화학적 안정성이 높아 화재 위험이 낮으며 영하 40도에서도 충전량 90% 이상을 유지하는 등 저온에서 성능이 크게 저하되지 않는 장점을 가지고 있다. 주원료인 나트륨의 지각 내 매장량은 리튬의 약 1200배에 달한다. 경제성이 확보되면 해수에서 수급도 가능해 수요가 증가해도 가격이 급등할 우려가 낮다. 이에 따라 나트륨이온 배터리는 가격 경쟁력과 기술적 이점으로 글로벌 전기차 배터리 시장에서 입지를 키울 것으로 자동차연구원은 전망했다. 또 향후 완성차 기업이,2025-09-15,https://www.seoul.co.kr/news/economy/car/2025/09/15/20250915500325,서울신문
"이노션 미국법인, 최고 책임자 직책 신설…GS&P 출신 선임",https://img.seoul.co.kr/img/upload/2025/09/15/SSC_20250915185809_N1.jpg.webp,"이노션이 미국법인의 ‘최고 책임자’ 직책을 신설하고 광고업계 30년 경력의 베테랑인 레슬리 배럿 (사진) 을 영입했다고 15일 밝혔다. 배럿은 이노션에 합류하기 전까지 세계적인 광고회사 굿비 실버스타인 앤드 파트너스(GS&P)에서 최고 책임자 겸 공동경영자를 역임했다. 세계적인 아이스크림 브랜드인 하겐다즈를 보유한 다국적 식품회사 ‘제너럴 밀스’, 미국 크래프트 맥주 시장을 대표하는 브랜드인 ‘사무엘 아담스’, HP, 로지텍 등의 브랜드 캠페인이 그의 손을 거쳤다. 이노션 미국법인은 배럿의 합류를 계기로 미국 시장 내 영향력과 글로벌 시장에서의 입지를 넓혀간다는 계획이다. 신설된 최고 책임자 직책은 CEO 바로 아래의 최고 경영진 직위로, 배럿은 ▲조직 운영 ▲신사업 및 성장 전략 구축 ▲고객 서비스 및 인공지능(AI) 등 기술 혁신을 총괄할 예정이다. 전일수 이노션 글로벌 비즈니스 총괄 겸 미국법인 최고경영자(CEO) 부사장은 “배럿의 합류는 이노션에 매우 의미 있는 전환점”이라며 “열정과 전략적 통찰을 겸비한 글로벌 마케팅 업계의 검증을 마친 리더로, 이노션의 비전과도 부합해 비즈니스 경쟁력과 기술 혁신, 조직 문화가 한 단계 도약할 것으로 기",2025-09-15,https://www.seoul.co.kr/news/economy/industry/2025/09/15/20250915500312,서울신문
코스피 랠리 속 넥스트레이드 급성장…시간외 거래 비중 30% 육박,https://img.seoul.co.kr/img/upload/2025/09/15/SSC_20250915175245_N1.jpg.webp,"코스피가 나흘 연속 사상 최고치를 경신하면서 국내 첫 대체거래소(ATS)인 넥스트레이드의 거래 규모도 빠르게 불어나고 있다. 특히 출근 전·퇴근 후에도 거래할 수 있는 넥스트레이드의 시간외 시장의 비중이 빠르게 커지는 모습이다. 15일 넥스트레이드에 따르면 지난 12일 하루 거래대금은 9조 7537억원으로, 국내 증시가 조정에 들어간 지난 8월 1일(9조 8877억원) 이후 가장 많았다. 이달 초(1~8일) 일평균 4조~5조원대였던 것과 비교하면 두 배 가까이 늘어난 것이다. 같은 기간 한국거래소 거래대금은 13조~16조원대에서 22조원대로 약 1.5배 증가했다. 이달 초 대비 랠리 구간(10~12일) 평균을 단순 비교하면 거래소가 51% 늘 때 넥스트레이드는 56% 증가했다. 이에 따라 지난 12일 기준 넥스트레이드 거래 규모는 한국거래소 거래대금 대비 44%, 한국거래소 거래량 대비 16% 수준까지 올라갔다. 눈에 띄는 대목은 시간외 거래 확대다. 이달 들어 넥스트레이드 거래 종목은 80개 가까이 줄었지만 코스피가 연일 최고 기록을 경신한 지난 10~12일 사흘 동안 프리마켓(오전 8시~8시 50분) 비중은 15%에서 19%로 늘었다. 애프터마켓(오후",2025-09-15,https://www.seoul.co.kr/news/economy/securities/2025/09/15/20250915500304,서울신문
“지난해 1kg 160만원까지 치솟은 ‘이것’”…영동 ‘최악 가뭄’에 또 가격 오르나,https://img.seoul.co.kr/img/upload/2025/09/15/SSC_20250915174918_N1.jpg.webp,"올여름 강원 동해안을 중심으로 이어진 최악 가뭄이 송이 작황에 영향을 주고 있다. 15일 양양속초산림조합에 따르면 올해 양양 송이 첫 공판 일정은 아직 확정되지 않았다. 양양 송이는 매년 9월 초 채취가 시작되고 일정 수준 이상의 채취량이 확보되면 추석을 전후한 9월 초·중순부터 약 한 달간 공판을 진행한다. 하지만 올해는 영동지역 일대 가뭄과 늦더위 등의 영향으로 작황 부진이 발생하면서 공판 일정도 함께 연기되고 있다. 지난해에도 예년보다 늦은 9월 20일에 첫 공판이 열렸으나, 올해는 이보다 더 늦어질 가능성이 있다. 다만 올해 추석은 10월 6일로 평소보다 늦어 추석 전 공판 개시는 가능할 것으로 보인다. 추석 선물용으로 인기가 많은 양양 송이는 작황 부진이 이어질 경우 가격이 높게 형성될 가능성이 크다. 지난해에도 비슷한 이유로 공판에 어려움을 겪었는데, 당시 양양 송이 1등급은 kg당 공판가가 160만원까지 올라 역대 최고 가격을 기록하기도 했다. 지역 상인 등에 따르면 현재 송이 채취량은 전무한 상황이다. 첫 공판은 빨라야 이달 말 열릴 것으로 예상된다. 강원 고성지역도 양양과 비슷한 시기 출하를 시작하지만, 올해 첫 공판 날짜가 정해지지",2025-09-15,https://www.seoul.co.kr/news/economy/distribution/2025/09/15/20250915500297,서울신문
[재테크+] 월가 손꼽아 기다린 ‘올해 첫 금리인하’…이례적인 3파전 전망,https://img.seoul.co.kr/img/upload/2025/09/15/SSC_20250915174742_N1.png.webp,"미국 연방준비제도이사회(연준)가 이번 주 열리는 회의에서 올해 첫 금리 인하를 단행할 것이라는 기대감이 월가를 지배하고 있습니다. 연준 위원들 사이에서는 0.5% 포인트 대폭 인하, 0.25% 포인트 소폭 인하, 금리 동결을 놓고 이례적인 3파전이 벌어질 전망입니다. 9월 연준 회의서 올해 첫 금리 인하 전망 미국 연방준비제도이사회가 오는 16~17일(현지시간) 양일간 열리는 연방공개시장위원회(FOMC) 회의를 마치고 올해 첫 금리 인하를 발표할 것으로 예상되고 있습니다. 연준은 지난해 1% 포인트의 금리 인하를 단행한 후 지난 12월부터 기준금리를 4.25~4.50% 범위에서 동결해왔습니다. 파이낸셜타임스는 15일(현지시간) 보도에서 연준 위원들이 이번 금리 결정을 두고 3파전으로 갈라질 수 있다고 지적했습니다. 금리를 0.5% 포인트 대폭 인하해야 한다는 의견과 0.25% 포인트만 낮추자는 의견, 현행 금리를 유지하자는 의견이 대립할 것이라는 전망입니다. 2019년 이후로 FOMC가 3파전으로 갈라진 적은 없었습니다. 에버코어 ISI의 크리슈나 구하는 “3파전 가능성은 위원회가 현재 직면한 독특한 압박 상황을 보여주는 신호”라며 “단순한 경제 논리를",2025-09-15,https://www.seoul.co.kr/news/economy/2025/09/15/20250915500296,서울신문
"HD현대삼호, 휴머노이드 로봇과 자동화 기술개발",https://img.seoul.co.kr/img/upload/2025/09/15/SSC_20250915172806_N1.jpg.webp,"HD현대삼호가 지속가능한 조선산업 생태계 조성을 위해 AI 기반 휴머노이드 로봇과 물류 자동화 기술개발을 통한 미래 조선소 구축에 속도를 낸다. HD현대삼호는 15일 홍보관에서 LG CNS, HD현대로보틱스, HD한국조선해양과 함께 ‘안전한 공정 운영 및 효율화를 위한 휴머노이드 및 물류자동화 기술 개발’ 업무협약을 체결했다. 주요 내용은 용접 외 측정·성형·관제 등 다양한 생산 활동에 적용 가능한 휴머노이드 개발과 자율이동로봇 개발을 통한 조선소 물류 자동화 시스템 구축 등이다. HD현대삼호는 제조 데이터 확보와 현장 인프라 조성을, LG CNS는 조선산업용 AI 및 데이터 융합 플랫폼 구축 및 운영을 맡는다. HD현대로보틱스는 공정별 특화 AI 모션 제어 기술을 개발·제공하고 HD한국조선해양은 로봇, 시뮬레이션, 용접 등 다양한 제조 기술을 개발·지원한다. 이번 기술개발을 통해 기존 자동화 설비 및 협동로봇의 한계를 넘어 복잡한 용접·조립·의장 및 검수 공정의 자동화를 실현해 현장 작업자의 안전 확보는 물론 생산성의 한계를 동시에 극복할 수 있을 것으로 기대된다. HD현대삼호는 2022년 자동화혁신센터 출범 이후 협동로봇과 수중선체청소로봇 도입 등",2025-09-15,https://www.seoul.co.kr/news/economy/2025/09/15/20250915500287,서울신문
사이클 대회 중단시킨 스페인 ‘반이스라엘 시위’,https://img.seoul.co.kr/img/upload/2025/09/15/SSC_20250915182834_N1.jpg.webp,반이스라엘 시위대가 14일(현지시간) 스페인 마드리드에서 열린 세계 3대 도로 사이클 대회 ‘부엘타 아 에스파냐’의 마지막 21구간에 난입해 대회 설치물을 부수고 팔레스타인 깃발을 흔들며 이스라엘팀 참가에 항의하고 있다. 총 길이 3151㎞로 이뤄진 이번 대회는 시위 여파로 결승선을 약 43㎞ 남겨 두고 중단됐다. 주최 측은 선두를 달리던 덴마크의 요나스 빙에고르를 최종 우승자로 결정했다. 마드리드 AP 연합뉴스,2025-09-16,https://www.seoul.co.kr/news/international/europe/2025/09/16/20250916014012,서울신문
‘통곡의 벽’ 찾은 루비오·네타냐후,https://img.seoul.co.kr/img/upload/2025/09/16/SSC_20250916003914_N1.jpg.webp,마코 루비오(오른쪽) 미국 국무장관이 14일(현지시간) 베냐민 네타냐후 이스라엘 총리와 함께 예루살렘 구시가지에 있는 유대교 성지 ‘통곡의 벽’을 찾아 기도문을 끼워 넣고 있다. 미 국무부는 이번 방문에 대해 “예루살렘을 이스라엘의 영원한 수도로 인정한다는 미국의 의지를 재확인하는 것”이라고 설명했다. 예루살렘 AP 연합뉴스,2025-09-16,https://www.seoul.co.kr/news/international/middleeast-africa/2025/09/16/20250916014011,서울신문
트럼프 “미중 무역협상 잘 됐다”… 틱톡 매각 합의한 듯,https://img.seoul.co.kr/img/upload/2025/09/04/SSC_20250904002626_N1.jpg.webp,"도널드 트럼프 미국 대통령이 14∼15일(현지시간) 스페인인 마드리드에서 열린 미중 무역협상에 대해 “매우 잘 됐다”고 밝혔다. 또 중국계 동영상 플랫폼 기업 틱톡 매각과 관련한 합의에 도달했다고 전했다. 트럼프 대통령은 15일 자신의 트루스소셜에 “유럽에서 열린 미국과 중국의 큰 무역 회담이 매우 잘 됐다”면서 “(회담은) 곧 마무리될 것”이라고 썼다. 트럼프 대통령은 또 “우리 나라 젊은이들이 매우 구해내고 싶어 했던 ‘특정’ 회사에 대해서도 합의에 도달했다”며 “그들은 매우 기뻐할 것”이라고 전했다. 이는 틱톡의 미국내 사업권 매각을 가리킨 것으로 보인다. 미국은 국가 안보와 개인정보 보호 등을 이유로 전임 조 바이든 행정부 시절인 작년 4월 이른바 ‘틱톡 강제 매각법’을 제정했다. 트럼프 대통령이 세 차례 매각 시한을 연장했지만, 오는 17일까지 미중이 합의에 도달하지 못하면 미국 내 틱톡 서비스는 중단된다. 트럼프 대통령은 그러면서 “시진핑 주석과 금요일(19일) 대화(통화)할 것”이라며 “(미중) 관계는 여전히 매우 강력하다”고 밝혔다. 스콧 베선트 미국 재무장관도 15일 2일차 무역협상을 시작하기에 앞서 기자들과 만나 중국과 틱톡 매각 관련",2025-09-16,https://www.seoul.co.kr/news/international/2025/09/16/20250916014010,서울신문
‘트리플 쇼크’ 맞은 중국… 성장률 5% 목표 빨간불,,"중국의 8월 생산·소비·투자 지표가 예상보다 악화하며 두 달 연속 둔화세를 보였다. 중국 경제가 미국과의 무역 갈등에 따라 수출 둔화, 내수 부진이라는 ‘내우외환’에 시달리면서 ‘5% 경제 성장’이라는 정부 목표에도 빨간불이 켜졌다. 하반기 경제 둔화 가능성에 중국 당국이 추가 경기부양책을 내놓을 것이라는 관측이 나온다. 15일 중국 국가통계국이 발표한 주요 경제 지표에 따르면 8월 중국 산업생산은 전년 동월 대비 5.2% 증가하며 로이터 전망치(5.7%)와 블룸버그 전망치(5.6%)를 밑돌았다. 이는 지난해 8월(4.5%) 이후 최저치다. 백화점, 편의점 등 다양한 유형의 소매점 실적으로 집계하는 소매판매도 3.4% 증가하는 데 그쳐, 지난해 11월(3.0%) 이후 증가율이 가장 낮았다. 또 농촌을 뺀 공장, 도로, 전력망, 부동산 등에 대한 자본 투자 변화를 보여주는 1~8월 고정자산투자는 지난해 같은 기간보다 0.5% 늘었는데, 이는 2020년 이후 최악의 수치다. 같은 날 발표된 중국의 8월 신규주택 가격도 전년 대비 2.5% 하락하며 26개월 연속 하락세를 이어갔다. 수출도 심상치 않다. 지난 8일 발표된 중국의 8월 수출액은 전년 동월 대비 4.4",2025-09-16,https://www.seoul.co.kr/news/international/china/2025/09/16/20250916014009,서울신문
"커크 암살에 분열된 美… “알고리즘, 이념 갈등 부추겨”",https://img.seoul.co.kr/img/upload/2025/09/12/SSC_20250912010016_N1.png.webp,"도널드 트럼프 미국 대통령의 측근이자 보수 성향 청년 정치 활동가 찰리 ﻿커크 암살로 촉발된 미국 정치권 분열이 좀처럼 가라앉지 않고 있다. 내년 중간선거를 앞두고 보수와 진보의 이념 갈등이 갈수록 심화될 수 있다는 우려가 나온다. 14일(현지시간) 폭스뉴스에 따르면 애리조나주 피닉스의 터닝포인트USA 본부 앞 커크를 추모하는 공간에서 19세 남성이 꽃과 깃발 등을 발로 찼다가 기물 파손 등의 혐의로 구금됐다. 터닝포인트USA는 커크가 창립한 청년 보수 정치단체다. 이 남성은 커크를 암살한 혐의로 체포된 타일러 로빈슨(22)이 입었던 것과 거의 비슷한 검은색 셔츠를 입고 있었다. 커크가 살해당한 유타주 솔트레이크시티에서는 2명의 남성이 언론사 취재 차량에 폭발물을 설치했다가 체포됐다고 CBS와 연계된 현지 방송 KUTV가 보도했다. 이들이 범행을 저지른 동기는 아직 알려지지 않았다. 커크의 죽음을 비하하는 발언을 했다가 직장에서 해고되는 사례도 이어지고 있다. 로이터통신은 최소 15명이 온라인에서 커크의 죽음을 언급한 뒤 해고되거나 정직 처분을 받았다고 전했다. MSNBC 정치평론가 매슈 다우드는 지난 10일 방송에서 “커크는 끔찍한 생각을 멈추지 않고,",2025-09-16,https://www.seoul.co.kr/news/international/USA-amrica/2025/09/16/20250916014008,서울신문
“아프리카 이민자 반대”… 일본서 ‘혐한’ 넘은 외국인 혐오 분출,,"지자체·아프리카 교류 구상에 항의 치안 불안 주장하며 쿠르드인 폭행 “더 약한 집단 향한 ‘배외주의’ 확대” 전세계적으로 반이민 정서가 급속히 확산하고 있는 가운데 일본 정부 산하 국제협력기구(JICA)의 아프리카 연계 구상이 ‘이민 공포’로 연결돼 논란이 일고 있다. 미국, 유럽 등에서 확산하는 배외주의 영향과 소셜미디어(SNS)를 통한 혐오 발언 확산이 맞물리며 일본 사회 곳곳에서 외국인 혐오 정서가 분출하고 있다는 지적이다. 15일 일본 언론에 따르면 최근 JICA의 아프리카·지방 연계 구상이 SNS 허위 정보에 휘말려 역풍에 직면했다. 이 계획은 지난달 19~21일 요코하마에서 열린 아프리카개발회의(TICAD)에서 처음 공개됐다. JICA는 아프리카와 인연이 깊은 지방 도시 4곳을 ‘홈타운’으로 지정해 인재 교류와 공동 이벤트를 추진하겠다고 발표했다. 사람 중심의 국제협력을 내세운 구상이었다. 그러나 나이지리아 대통령실이 “일본 정부가 특별 비자를 만든다”는 잘못된 성명을 내면서 논란이 확산했다. 외무성은 즉각 부인했지만 SNS에는 “이민자가 몰려온다”는 주장이 급속히 퍼졌고, 지난달 28일 도쿄 중심부에서는 100여명이 모여 ‘JICA 해체’ 시위를",2025-09-16,https://www.seoul.co.kr/news/international/japan/2025/09/16/20250916014007,서울신문
“도시를 아프리카에 준다고?” SNS 타고 번진 日 ‘반이민정서’,https://img.seoul.co.kr/img/upload/2025/09/15/SSC_20250915190153_N1.jpg.webp,"전세계적으로 반이민 정서가 급속히 확산하고 있는 가운데 일본 정부 산하 국제협력기구(JICA)의 아프리카 연계 구상이 ‘이민 공포’로 연결돼 논란이 일고 있다. 미국, 유럽 등에서 확산하는 배외주의 영향과 소셜미디어(SNS)를 통한 혐오 발언 확산이 맞물리며 일본 사회 곳곳에서 외국인 혐오 정서가 분출하고 있다는 지적이다. 15일 일본 언론에 따르면 최근 JICA의 아프리카·지방 연계 구상이 SNS 허위 정보에 휘말려 역풍에 직면했다. 이 계획은 지난달 19~21일 요코하마에서 열린 아프리카개발회의(TICAD)에서 처음 공개됐다. JICA는 아프리카와 인연이 깊은 지방 도시 4곳을 ‘홈타운’으로 지정해 인재 교류와 공동 이벤트를 추진하겠다고 발표했다. 사람 중심의 국제협력을 내세운 구상이었다. 그러나 나이지리아 대통령실이 “일본 정부가 특별 비자를 만든다”는 잘못된 성명을 내면서 논란이 확산했다. 외무성은 즉각 부인했지만 SNS에는 “이민자가 몰려온다”는 주장이 급속히 퍼졌고, 지난달 28일 도쿄 중심부에서는 100여명이 모여 ‘JICA 해체’ 시위를 벌였다. 아사히신문에 따르면 지바현 기사라즈시는 최근까지 하루 200통에 달하는 항의 전화를 받고 있다.",2025-09-15,https://www.seoul.co.kr/news/international/2025/09/15/20250915500314,서울신문
