title,thumbnail,short_content,write_time,link,company
보유세 강화 신중론 강조한 당정… “타이밍 봐야” “최후의 수단”,https://img.seoul.co.kr/img/upload/2025/10/19/SSC_20251019173622_N1.jpg.webp,"구윤철 부총리 겸 기획재정부 장관이 앞서 10·15 부동산 대책과 함께 내놓은 ‘부동산 세제 합리화 방침’과 관련해 “세제 개편은 최후의 수단”이라고 거듭 밝혔다. 이번 대책의 효과를 봐 가면서 종합부동산세·재산세 등 보유세와 양도소득세·취득세 등 거래세를 조정할 여지를 열어 둠으로써 시장에 대한 경고 메시지를 던지면서도 최대한 신중한 접근을 강조한 것으로 풀이된다. 구 부총리는 지난 16일(현지시간) 미국 워싱턴DC 국제통화기금(IMF) 본부에서 열린 기자간담회에서 “부동산 보유세는 부동산 정책일 수도 있고, 응능부담(납세자 능력에 맞는 부담)의 원칙이 될 수도 있다”며 이렇게 말했다. 이어 “그것(보유세 강화)도 쉽게 하면 안 되니까 용역을 발주해 전문가 의견을 듣고, 준비되면 어느 타이밍에 어떻게 할 것인지도 한번 보겠다”고 말했다. ‘타이밍’을 언급한 건 내년 6월 지방선거 등 정치 변수까지 고려하겠다는 뜻으로 읽힌다. 구 부총리는 “한국은 부동산 보유세가 낮고 양도세는 높아 ‘록인 이펙트’(매물 잠김 현상)가 굉장히 크다”면서 “팔 때 비용(양도세)이 많이 들다 보니 안 팔고 그냥 (집을) 들고 있다”고 진단했다. 이어 “고가의 집을 보유하는 데",2025-10-20,https://www.seoul.co.kr/news/economy/estate/2025/10/20/20251020008001,서울신문
미국산 대두 수입 카드… 관세 협상 마지막 ‘키’ 될까,https://img.seoul.co.kr/img/upload/2025/10/17/SSC_20251017174654_N1.jpg.webp,"3500억 달러(약 499조원) 규모 대미투자 패키지를 둘러싼 한미 양측의 밀고당기기가 한창인 가운데 미국산 대두(콩) 카드가 실마리로 작용할지 관심이 쏠린다. 19일 정부에 따르면 미국은 최근 관세 협상 과정에서 한국 정부에 대두 수입 확대를 요청한 것으로 전해졌다. 앞서 위성락 대통령실 국가안보실장은 지난 17일 정부의 농산물 원칙이 달라질 수 있는지에 대해 “한미 무역협상에서 농산물 관련 새로 들은 것은 대두 정도”라고 밝혔다. 위 실장의 발언 이후 ‘농산물 개방 불가’ 기조가 바뀐 것 아니냐는 관측이 나왔다. 김용범 대통령실 정책실장은 지난 7월 관세 협상 타결 당시 “농축산물에 대한 논의는 전혀 없었고, 합의된 게 없다”고 밝힌 바 있다. 하지만 미중 갈등으로 상황이 달라졌다. 미국산 대두의 최대 수입국인 중국이 지난 5월부터 대두 수입을 전면 중단한 것이다. 대두의 주요 산지인 중서부 농업 지역은 도널드 트럼프 대통령의 지지기반이다. 때문에 정부가 대두 수입 확대로 트럼프 대통령의 ‘체면’을 살려주고 3500억 달러 투자 패키지 협상에서 양보를 끌어내는 것 아니냐는 전망도 나온다. 정부 관계자는 “트럼프 대통령을 설득할 만한 카드가 될 수 있다",2025-10-20,https://www.seoul.co.kr/news/economy/2025/10/20/20251020003001,서울신문
5대 기업 총수·트럼프 ‘7시간 골프’… 관세협상·투자 논의한 듯,https://img.seoul.co.kr/img/upload/2025/10/19/SSC_20251019115305_N1.jpg.webp,"총수들, 수행원·개인차 없이 이동 트럼프·이재용 함께 라운딩 추측 12개 조마다 美 정부·기업인 구성 경기 전후·식사 시간 등 대화한 듯 도널드 트럼프 미국 대통령과 한국 재계 총수들의 골프 회동이 18일(현지시간) 미국 플로리다주에서 진행됐다. 트럼프 대통령의 사저인 마러라고 리조트 인근에서 열린 이번 회동엔 이재용 삼성전자 회장, 최태원 SK그룹 회장, 정의선 현대차그룹 회장, 구광모 LG그룹 회장, 김동관 한화그룹 부회장이 참가한 것으로 알려졌다. 국내 주요 총수들이 단체로 트럼프 대통령과 골프 라운딩에 나선 것은 처음인데, 한미 무역협상과 관련한 대미 투자와 관세에 대한 의견을 나눴을지 주목된다. 이날 백악관 풀기자단 등에 따르면 트럼프 대통령은 마러라고 리조트 인근의 ‘웨스트팜비치 트럼프 인터내셔널 골프 클럽’에서 한국과 일본, 대만 등 아시아 기업인과 골프 라운딩을 가졌다. 트럼프 대통령은 이날 오전 9시 15분쯤 골프장에 들어갔다가 오후 4시 50분쯤 빠져나왔다. 마러라고 리조트에서 골프장까지는 차로 10분가량 걸리는 거리인데, 트럼프 대통령이 이동할 때는 경찰에 의해 도로가 통제됐다. 이 회장 등 골프 회동에 초청된 기업인들은 인근 팜비치",2025-10-20,https://www.seoul.co.kr/news/economy/industry/2025/10/20/20251020002001,서울신문
"정부, 프린스·후이원 금융 제재 검토… 미국·영국 나서자 ‘뒷북’",https://img.seoul.co.kr/img/upload/2025/10/19/SSC_20251019175319_N1.jpg.webp,"금융·외환·출입국 제재 동시에 검토 유엔, 5월 한국인 인신매매 등 경고 교민 제보도 있었지만 수동적 대응 美·英 2차 제재로 韓기업 영향 우려 정부가 캄보디아 범죄조직을 대상으로 금융·외환·출입국 제재를 동시에 검토하고 있다. 미국의 대(對)캄보디아 제재에 이은 후속성 조치다. 앞서 미국과 영국은 캄보디아 시아누크빌의 온라인 범죄단지 운영 배후로 프린스그룹과 후이원그룹을 지목하고 공동 제재를 발표했다. 정부의 뒤늦은 제재에 대해 ‘뒷북 제재’라는 지적이 나온다. 지난 5월 유엔 인권최고대표사무소(OHCHR)의 경고가 있었고, 국가정보원도 두 조직의 인신매매·불법감금·온라인사기 정황을 인지하고 있었던 것으로 알려진다. 외교 경로를 통한 피해 보고와 현지 교민 사회의 제보도 이어졌으나 정부는 판단을 미루고 별다른 조치를 취하지 않았다. 19일 금융당국에 따르면 금융위원회 산하 금융정보분석원(FIU)은 캄보디아 범죄조직을 금융거래 제한 대상자로 지정하는 방안을 검토 중이다. 금융위는 테러자금 조달 및 공중협박 행위와 관련된 개인·법인·단체를 지정·고시할 수 있으며 지정되면 금융위 허가 없이는 국내에서 금융·부동산·채권 등의 거래가 일절 불가능하다. 제재",2025-10-20,https://www.seoul.co.kr/news/economy/2025/10/20/20251020005001,서울신문
근로기준법 확대 방침에…외식업중앙회 “영세 자영업자 생존 위협”,https://img.seoul.co.kr/img/upload/2025/10/19/SSC_20251019174752_N1.jpg.webp,"5인 미만 사업장에 근로기준법을 단계적으로 확대 적용하려는 정부 방침에 외식업계를 중심으로 우려의 목소리가 커지고 있다. 한국외식업중앙회는 19일 입장문을 내고 “전국 외식업소 70만여곳 중 절반 이상이 5인 미만 사업장”이라며 “추가 규제는 영세 자영업자의 생존을 위협할 수 있다”고 주장했다. 통계청에 따르면 2023년 기준 전체 사업체의 약 86%인 539만곳이 5인 미만 사업장이다. 정부는 국정운영 5개년 계획과 최근 국정감사를 통해 소규모 사업장에도 근로기준법을 확대 적용하겠다는 의지를 밝혔다. 김영훈 고용노동부 장관은 지난 15일 국회 국정감사에서 “5인 미만 사업장 노동자 보호와 영세사업주 수용성 등을 고려해 지킬 수 있는 조항부터 단계적으로 확대하겠다”고 말했다. 현재 5인 미만 사업장은 최저임금, 퇴직금, 주휴수당 등의 규정을 적용받고 있다. 법 적용이 확대되면 해고 제한, 연차휴가 의무, 근로시간 규제 등이 추가된다. 외식업계는 특히 장시간 근로가 일반적인 업종 특성상 근로시간 상한이 도입되면 인력 운영에 차질이 불가피하다고 우려했다. 또 외식업은 직무와 숙련도에 따른 임금 차등을 두기 어려워 정부가 추진 중인 ‘동일노동 동일임금’ 원칙",2025-10-19,https://www.seoul.co.kr/news/economy/2025/10/19/20251019500110,서울신문
“막차 놓칠라”…10·15 대책 전후 아파트 폭풍 매수세에 신고가 속출,https://img.seoul.co.kr/img/upload/2025/10/19/SSC_20251019173622_N1.jpg.webp,"10·15 부동산 대책 실행을 앞두고 서울·경기 지역에서 막판 신고가 계약이 속출한 것으로 나타났다. 대책 발표 전인 추석 연휴에도 규제를 피하고자 서울에서 아파트 거래가 활발히 이뤄졌다. 19일 국토교통부 실거래가 공개시스템에 따르면 서울 양천구 래미안목동아델리체 전용면적 59.82㎡는 지난 15일 15억 5000만원(22층)에 매매 계약이 체결됐다. 이 아파트의 같은 전용면적은 수도권 주택담보대출 한도를 6억원으로 제한한 6·27 대책 발표 직전인 6월 25일 14억 2000만원(26층)에 거래됐는데, 10·15 대책 발표 당일 1억 3000만원 높은 가격으로 역대 최고가를 경신한 것이다. 서울 광진구의 자양 9차 현대홈타운 전용면적 82.56㎡도 같은 날 18억원(4층)에 매매돼 약 4개월 만에 3억원이나 올랐다. 경기 과천시에서는 원문동 래미안슈르 전용면적 94.95㎡가 21억 9000만원으로 역대 최고가를 기록했다. 내 집 마련에 마음이 급한 실수요자들이 10·15 대책으로 인한 대출 규제를 피하기 위해 매수에 나섰지만, 매도자와의 가격 협상에서 밀리면서 신고가 거래가 이어졌다. 아울러 20일부터 ‘규제지역’에서 전세를 끼고 집을 사는 ‘갭투자’",2025-10-19,https://www.seoul.co.kr/news/economy/estate/2025/10/19/20251019500103,서울신문
"HD현대, 정기선 회장 체제 가동…조선·건설기계 재편, 마스가 승부수",https://img.seoul.co.kr/img/upload/2025/10/19/SSC_20251019172957_N1.jpg.webp,"HD현대가 정기선(43) 회장 체제를 공식화하며 조선·건설기계 사업 재편과 함께 미국 ‘마스가(MASGA) 프로젝트’ 대응에 나선다. 세대교체와 동시에 북미 중심의 글로벌 사업 구조를 재정비하려는 전략적 포석으로 보인다. 19일 업계에 따르면 정 회장은 조기 사장단 인사를 통해 조영철 부회장과의 공동대표 체제를 확정했다. 조선과 건설기계 계열사 각각의 통합 일정을 앞두고 의사결정 구조를 정비하려는 의도로 풀이된다. HD현대 산하 조선사인 HD현대중공업과 HD현대미포는 오는 12월, 다음해 1월에는 HD현대건설기계와 HD현대인프라코어가 합병해 각각 조선·건설기계 단일 법인으로 출범할 예정이다. 조선 부문 통합으로 정 회장은 중형선부터 대형·특수선까지 아우르는 전 분야 생산체계를 갖추고, 방산 수주·친환경 연료 전환 등 미래 수요 대응력을 확보할 예정이다. 싱가포르에 신설한 ‘HD현대아시아홀딩스’를 중심으로 베트남·필리핀 조선소까지 포함하는 해외 사업 재편도 동시에 추진하고 있다. 건설기계 부문 역시 ‘현대’와 ‘디벨론’ 듀얼 브랜드 전략을 유지하고 제품 포트폴리오를 재정비해 2030년 연매출 14조 8000억원 달성을 목표로 한다. 마스가 프로젝트 대응",2025-10-19,https://www.seoul.co.kr/news/economy/industry/2025/10/19/20251019500100,서울신문
"‘엔비디아’ 젠슨 황, 15년 만에 공개 방한…경주서 삼성·SK와 ‘반도체 협력’ 가능성",https://img.seoul.co.kr/img/upload/2025/10/19/SSC_20251019172907_N1.jpg.webp,"인공지능(AI) 반도체 기업 엔비디아의 창업주 젠슨 황 최고경영자(CEO)가 약 열흘 뒤 ‘아시아태평양경제협력체(APEC) CEO 서밋 2025’에 연사로 나선다. 황 CEO가 한국을 공식 방문한 건 2010년 서울에서 열린 ‘스타크래프트2’ 게임 출시 기념행사 이후 15년 만이다. 엔비디아는 황 CEO가 경주에서 열리는 CEO 서밋에 참석하기 위해 한국을 방문한다고 19일 밝혔다. 엔비디아는 “황CEO는 이번 방문에서 AI, 로보틱스, 디지털 트윈, 자율주행 기술 등 다양한 분야에서 한국을 포함한 전 세계의 기술 혁신과 성장을 가속화하기 위한 엔비디아의 비전을 공유할 예정”이라고 밝혔다. 대한상공회의소가 주관하는 CEO 서밋은 31일 개막하는 APEC 정상회의의 공식 부대행사로, 28일부터 31일까지 ‘Bridge, Business, Beyond(3B·연결, 비즈니스, 그 너머)를 주제로 열린다. APEC 21개 회원국 가운데 정상급 인사 16명과 글로벌 기업 CEO 1700여명이 참석한다. 황 CEO의 강연은 CEO 서밋의 마지막 날인 31일 오후 4시쯤으로 예정돼있다. 방한 직전인 28일(현지시간) 미국에서 열리는 AI 콘퍼런스 ‘엔비디아 GTC’에",2025-10-19,https://www.seoul.co.kr/news/economy/industry/2025/10/19/20251019500098,서울신문
"美서 고전하는 현대차, 유럽 시장에선 시선 집중",https://img.seoul.co.kr/img/upload/2025/10/19/SSC_20251019172447_N1.jpg.webp,"현대자동차가 최대 시장인 미국에서 25%의 고율 관세로 고전하고 있지만 유럽에선 판매 증가와 ‘올해의 차’ 선정 등으로 존재감을 뽐내고 있다. 현대차는 유럽에서 전기차 및 전략형 모델로 입지를 강화하겠다는 계획이다. 19일 오스트리아 통계청에 따르면 현대차는 지난달 오스트리아 승용차 시장에서 지난해 같은 기간보다 102% 늘어난 1966대를 판매하며 시장 점유율 7.6%를 기록했다. 독일 폭스바겐(14.3%), 체코 스코다(10.8%)에 이은 브랜드 순위 3위다. 지난해 1만 1364대의 판매량으로 브랜드별 순위 6위에 올랐던 현대차는 올해 1∼9월에는 지난해 같은 기간보다 28% 증가한 8604대를 판 것으로 집계됐다. 특히 대표 스포츠유틸리티차(SUV) 모델인 ‘투싼’은 지난 9월 한 달간 455대가 판매돼 모델별 판매 순위 6위를 기록했다. 현대차는 지난 8월 유럽에서 지난해 같은 기간보다 13.8 늘어난 3만 7411대를 팔았는데 이런 추세면 조만간 발표할 9월 유럽 전체 판매량도 상승세를 지속할 전망이다. 현대차의 상품성도 유럽에서 호평받고 있다. 하이브리드 및 플러그인 하이브리드 모델을 보유한 투싼은 유럽 자동차 선도 국가인 독일의 자동차",2025-10-19,https://www.seoul.co.kr/news/economy/car/2025/10/19/20251019500097,서울신문
"KB금융, 두바이 ‘지텍스 글로벌’서 첨단산업·스타트업 지원 방안 논의",https://img.seoul.co.kr/img/upload/2025/10/19/SSC_20251019165703_N1.jpg.webp,"KB금융이 지난 13일부터 17일까지 아랍에미리트(UAE) 두바이 세계무역센터에서 진행된 ‘지텍스 글로벌(GITEX Global) 2025’에 참여해 첨단산업·스타트업 지원과 투자 활성화 방안 논의했다고 19일 밝혔다. 지텍스 글로벌은 두바이 디지털경제청이 주최하는 중동 최대 규모의 정보통신기술(ICT) 전시회다. 이창권 KB금융 디지털·정보기술(IT)부문장을 중심으로 꾸려진 참관단은 현지 벤처캐피털(VC), 투자사 등과 만나 인공지능(AI)·핀테크·블록체인·사이버 보안 등 현지의 기술 투자 흐름을 파악했다. 특히 참관단은 자율주행 스타트업 ‘오토노머스A2Z’와 AI 기반의 글로벌 위성·지리정보 분석기업 ‘스페이스42’의 공동 전시부스에서 생산적 금융 관점의 첨단산업·스타트업 성장 지원 및 투자 활성화 방안을 논의했다. 아울러 두바이 정부 유관기관을 방문해 디지털 금융 혁신 정책을 공유하고 글로벌 협력 방안을 논의했다. 두바이 정부에서 설립한 두바이 가상자산규제청(VARA)과 두바이 실리콘 오아시스(DSO)의 대표를 포함한 주요 관계자들과 디지털자산 규제 정책, 스마트시티 혁신 생태계, 기술 기업 육성 전략 등 중장기 협력 가능성에 대해서도 의견을 교환했",2025-10-19,https://www.seoul.co.kr/news/economy/finance/2025/10/19/20251019500090,서울신문
"즉시연금 ‘설명 의무 미이행’ 대법 판결에 금감원, “후속 점검하겠다”",https://img.seoul.co.kr/img/upload/2025/10/19/SSC_20251019175608_N1.png.webp,"생명보험업계 즉시연금 미지급금 반환 청구 소송이 대법원 판결로 사실상 마무리된 가운데, 금융당국이 보험사의 설명 의무 위반을 인정받은 대법원 판결과 관련 후속 점검에 나서기로 했다. 지난 16일 대법원이 생보사 즉시연금 가입자 소송에서 “설명 의무가 충분히 이행됐다고 보기 어렵다”고 판단한 데 대해 금융감독원은 “소비자 보호 관점에서 점검 등 후속 조치에 착수하겠다”고 19일 밝혔다. 문제가 된 ‘상속만기형 즉시연금’은 가입자가 목돈을 맡기면 곧바로 매달 연금처럼 보험금을 받다가 만기에 원금을 돌려받는 상품이다. 이를 취급하던 생보사들은 매달 지급하는 연금액에서 만기 환급금 재원을 미리 공제하고 지급했지만, 가입자들은 이러한 공제 구조가 약관에 명시되지 않았고 상품 가입 시 설명도 제대로 듣지 못했다고 주장했다. 2017년 민원이 제기되자 금감원은 2018년 “약관이 불명확하다”며 미지급금을 추가로 지급하라고 권고했으나 생보사들이 이를 거부하면서 이에 법정 다툼으로 번졌다. 최근 삼성생명·미래에셋생명·동양생명 등에 대한 대법원 판결이 내려진 가운데 삼성생명 소송 판결문에서 대법원은 “포괄적 지시조항만으로는 설명의무가 충분히 이행됐다고 보기 어렵다”고 명시",2025-10-19,https://www.seoul.co.kr/news/economy/finance/2025/10/19/20251019500089,서울신문
역세권·분상제·상품성 ‘3박자’에 몰린 인파…김포풍무 호반써밋 견본주택 가보니,https://img.seoul.co.kr/img/upload/2025/10/19/SSC_20251019164713_N1.jpg.webp,"김포시 사우동 475-2 인근의 ‘김포풍무 호반써밋’ 견본주택은 19일 이른 아침부터 내 집 마련을 위한 실수요자들로 북새통을 이뤘다. ‘김포 골드라인’ 풍무역에서 걸어서 5분밖에 안 걸리는 ‘초역세권’에 자리하는 데다 분양가 상한제를 적용해 가격 경쟁력까지 갖췄기 때문이다. 특히 이곳은 10·15 부동산 대책에서 제외된 비(非)규제지역이어서 시민들의 높은 관심이 청약 열기로 이어질 것으로 보인다. 50m 넘게 이어진 입장 대기 줄에 맞춰 내부로 들어가 보니 조명을 환하게 밝힌 단지 모형물이 관람객의 시선을 사로잡는다. 김포풍무 호반써밋은 지하 2층~지상 27층, 9개 동, 전용면적 84~186㎡, 총 956가구이다. 전용면적별 가구 수는 84㎡A 331가구, 84㎡B 183가구, 112㎡A 408가구, 112㎡B 28가구, 186P㎡ 6가구로, 선호도 높은 중대형으로 구성했다. 견본주택 내에는 4베이(bay) 구조 84㎡B(33평형)와 5베이의 112㎡A(43평형) 모델의 내부를 그대로 구현했다. 84㎡B의 경우 출입구 왼쪽에 부부 침실과 화장실, 드레스룸을 연결했다. 여기에 복도를 따라 가운데 쪽에 작은 방 2개를 이어 배치하고, 오른쪽으로는 거실과",2025-10-19,https://www.seoul.co.kr/news/economy/estate/2025/10/19/20251019500088,서울신문
역세권·분상제·상품성 ‘3박자’에 몰린 인파…김포풍무 호반써밋 견본주택 가보니,https://img.seoul.co.kr/img/upload/2025/10/19/SSC_20251019164713_N1.jpg.webp,"김포시 사우동 475-2 인근의 ‘김포풍무 호반써밋’ 견본주택은 19일 이른 아침부터 내 집 마련을 위한 실수요자들로 북새통을 이뤘다. ‘김포 골드라인’ 풍무역에서 걸어서 5분밖에 안 걸리는 ‘초역세권’에 자리하는 데다 분양가 상한제를 적용해 가격 경쟁력까지 갖췄기 때문이다. 특히 이곳은 10·15 부동산 대책에서 제외된 비(非)규제지역이어서 시민들의 높은 관심이 청약 열기로 이어질 것으로 보인다. 50m 넘게 이어진 입장 대기 줄에 맞춰 내부로 들어가 보니 조명을 환하게 밝힌 단지 모형물이 관람객의 시선을 사로잡는다. 김포풍무 호반써밋은 지하 2층~지상 27층, 9개 동, 전용면적 84~186㎡, 총 956가구이다. 전용면적별 가구 수는 84㎡A 331가구, 84㎡B 183가구, 112㎡A 408가구, 112㎡B 28가구, 186P㎡ 6가구로, 선호도 높은 중대형으로 구성했다. 견본주택 내에는 4베이(bay) 구조 84㎡B(33평형)와 5베이의 112㎡A(43평형) 모델의 내부를 그대로 구현했다. 84㎡B의 경우 출입구 왼쪽에 부부 침실과 화장실, 드레스룸을 연결했다. 여기에 복도를 따라 가운데 쪽에 작은 방 2개를 이어 배치하고, 오른쪽으로는 거실과",2025-10-19,https://www.seoul.co.kr/news/economy/estate/2025/10/19/20251019500088,서울신문
“다이소 긴장해”…5000원 이하 초저가로 80만개 ‘대박’ 터뜨린 이곳 정체,https://img.seoul.co.kr/img/upload/2025/10/19/SSC_20251019163058_N1.jpg.webp,"국내 건강기능식품(건기식) 시장이 빠르게 성장하고 있는 가운데 편의점 건기식 매출이 급증했다. 19일 GS25는 지난 8월부터 선보인 건강기능식품의 판매량이 80만개를 돌파했다고 밝혔다. GS25는 전국 5000여개 점포에서 30여종의 건기식 제품을 판매한다. 편의점 특성에 맞게 주로 5000원 이하 소용량 제품들이다. 500여개 점포는 건기식 특화 매장으로 꾸며졌다. GS25에 따르면 전 연령대에서 가장 많이 팔린 제품은 비타민이다. 10~20대는 단백질 셰이크 등 ‘이너 뷰티’ 제품을, 30~40대는 피로 개선과 간 건강 제품을 주로 구매했다. 50~60대에서는 혈당 관리 제품 등 ‘저속노화’ 연관 상품이 인기를 끌었다. GS25는 이달 말 건기식 판매량이 100만개를 넘어설 것으로 전망했다. 이달 말까지 삼진제약의 ‘하루엔진올인원’ 등 20종을 대상으로 ‘원플러스원(1+1)’ 행사를 진행하고, 연말까지 건기식 제품군을 40여종으로 늘릴 계획이다. 고웅 GS리테일 라이프리빙팀 상품기획자는 “고객이 신뢰하고 구매할 수 있는 건기식을 선보이고자 유명 제약사들과 협업 관계를 이어가고 있다”며 “접근성과 실용성을 모두 갖춘 ‘건강 솔루션 플랫폼’ 역할",2025-10-19,https://www.seoul.co.kr/news/economy/distribution/2025/10/19/20251019500084,서울신문
[서울데이터랩]10월 19일 암호화폐 시총 상위종목 동향,https://img.seoul.co.kr/img/upload/2025/10/19/SSC_20251019132100_N1.png.webp,"글로벌 가상자산 시황 중계 사이트 코인마켓캡(CoinMarketCap)에 따르면, 비트코인은 현재 1억 5,252만 원에 거래되고 있으며, 시가총액은 3,040조 8,197억 원이다. 24시간 동안 0.15% 상승했으며, 1시간 등락률은 0.38%로 단기적으로 상승세를 유지하고 있다. 거래량은 44조 8,212억 원에 달한다. 이더리움은 555만 2,525원으로 시가총액이 653조 8,550억 원이다. 24시간 동안 0.89% 상승했으며, 1시간 등락률은 0.82%이다. 거래량은 31조 3,412억 원으로 나타났다. 이더리움은 현재 상승세를 이어가고 있는 모습이다. 리플은 3,364원에 거래되고 있으며, 시가총액은 201조 7,594억 원이다. 24시간 동안 1.20% 상승했다. 1시간 등락률은 0.94%로, 단기 상승세가 지속될 가능성을 보여준다. 거래량은 3조 8,753억 원이다. 한편, 비앤비는 155만 2,390원으로 24시간 동안 0.14% 상승했다. 시가총액은 216조 629억 원이며, 거래량은 5조 941억 원이다. 같은 시각 솔라나는 26만 5,809원으로 1.13% 상승했다. 시가총액은 145조 3,852억 원이고, 거래량은 5조 4,",2025-10-19,https://www.seoul.co.kr/news/economy/2025/10/19/20251019500055,서울신문
